Sheet: Sheet2
A1: شرکت | B1: نماد | C1: صنعت | D1: P/E | E1: P/NAV | F1: P/E صنعت | G1: امتیاز P/E | H1: امتیاز P/NAV | I1: امتیاز کل
A2: ذغالسنگ نگین | B2: کطبس | C2: =VLOOKUP(RC[-1],Sheet1!R3C2:R802C3,2,FALSE) -> استخراج زغال سنگ | D2: =VLOOKUP(RC[-2],Sheet1!R3C2:R802C9,8,FALSE) -> 7.8 | E2: =IF(VLOOKUP(RC[-3],Sheet1!R3C2:R803C11,10,FALSE)=0,"",VLOOKUP(Sheet2!RC[-3],Sheet1!R[1]C[-3]:R[801]C[6],10,FALSE)) ->  | F2: =Sheet1!R9C10 -> 7.1682740032996701 | G2: =IF(RC[-3]<0,0,IF(AND(RC[-3]<RC[-1],RC[-3]<2),100,IF(AND(RC[-3]<RC[-1],RC[-3]>=2,RC[-3]<3),95,IF(AND(RC[-3]<RC[-1],RC[-3]>=3,RC[-3]<4),90,IF(AND(RC[-3]<RC[-1],RC[-3]>=4,RC[-3]<5),85,IF(AND(RC[-3]<RC[-1],RC[-3]>=5,RC[-3]<6),80,IF(AND(RC[-3]<RC[-1],RC[-3]>=6,RC[-3]<7),75,IF(AND(RC[-3]<RC[-1],RC[-3]>=7,RC[-3]<8),70,IF(AND(RC[-3]<RC[-1],RC[-3]>=8,RC[-3]<9),65,IF(AND(RC[-3]<RC[-1],RC[-3]>=9,RC[-3]<10),60,IF(AND(RC[-3]<RC[-1],RC[-3]>=10,RC[-3]<11),55,IF(AND(RC[-3]<RC[-1],RC[-3]>=11,RC[-3]<12),50,IF(AND(RC[-3]<RC[-1],RC[-3]>=12,RC[-3]<13),45,IF(AND(RC[-3]<RC[-1],RC[-3]>=13,RC[-3]<14),40,IF(AND(RC[-3]<RC[-1],RC[-3]>=14,RC[-3]<15),35,IF(AND(RC[-3]<RC[-1],RC[-3]>=15,RC[-3]<16),30,IF(AND(RC[-3]<RC[-1],RC[-3]>=16,RC[-3]<17),25,IF(AND(RC[-3]<RC[-1],RC[-3]>=17,RC[-3]<18),20,IF(AND(RC[-3]<RC[-1],RC[-3]>=18,RC[-3]<19),15,IF(AND(RC[-3]<RC[-1],RC[-3]>=19,RC[-3]<20),10,IF(AND(RC[-3]<RC[-1],RC[-3]>=20,RC[-3]<21),5,IF(AND(RC[-3]<RC[-1],RC[-3]>=21),0,IF(AND(RC[-3]>RC[-1],RC[-3]>=2,RC[-3]<3),90,IF(AND(RC[-3]>RC[-1],RC[-3]>=3,RC[-3]<4),90,IF(AND(RC[-3]>RC[-1],RC[-3]>=4,RC[-3]<5),80,IF(AND(RC[-3]>RC[-1],RC[-3]>=5,RC[-3]<6),70,IF(AND(RC[-3]>RC[-1],RC[-3]>=6,RC[-3]<7),60,IF(AND(RC[-3]>RC[-1],RC[-3]>=7,RC[-3]<8),50,IF(AND(RC[-3]>RC[-1],RC[-3]>=8,RC[-3]<9),40,IF(AND(RC[-3]>RC[-1],RC[-3]>=9,RC[-3]<10),30,IF(AND(RC[-3]>RC[-1],RC[-3]>=10,RC[-3]<11),20,IF(AND(RC[-3]>RC[-1],RC[-3]>=11,RC[-3]<12),10,IF(AND(RC[-3]>RC[-1],RC[-3]>=12),0))))))))))))))))))))))))))))))))) -> 50 | H2: =IF(RC[-3]="","",IF(RC[-3]<0.3,100,IF(AND(RC[-3]>=0.3,RC[-3]>0.4),95,IF(AND(RC[-3]>=0.4,RC[-3]<0.5),90,IF(AND(RC[-3]>=0.5,RC[-3]<0.6),85,IF(AND(RC[-3]>=0.6,RC[-3]<0.7),80,IF(AND(RC[-3]>=0.6,RC[-3]<1),80,IF(AND(RC[-3]>1,RC[-3]<2),50,IF(RC[-3]>2,0))))))))) ->  | I2: =IF(RC[-1]="",RC[-2],0.7*RC[-1]+0.3*RC[-2]) -> 50
A3: زغال سنگ پروده طبس | B3: کزغال | C3: =VLOOKUP(RC[-1],Sheet1!R3C2:R802C3,2,FALSE) -> استخراج زغال سنگ | D3: =VLOOKUP(RC[-2],Sheet1!R3C2:R802C9,8,FALSE) -> 5.1584169869028225 | E3: =IF(VLOOKUP(RC[-3],Sheet1!R3C2:R803C11,10,FALSE)=0,"",VLOOKUP(Sheet2!RC[-3],Sheet1!R[1]C[-3]:R[801]C[6],10,FALSE)) ->  | F3: =Sheet1!R9C10 -> 7.1682740032996701 | G3: =IF(RC[-3]<0,0,IF(AND(RC[-3]<RC[-1],RC[-3]<2),100,IF(AND(RC[-3]<RC[-1],RC[-3]>=2,RC[-3]<3),95,IF(AND(RC[-3]<RC[-1],RC[-3]>=3,RC[-3]<4),90,IF(AND(RC[-3]<RC[-1],RC[-3]>=4,RC[-3]<5),85,IF(AND(RC[-3]<RC[-1],RC[-3]>=5,RC[-3]<6),80,IF(AND(RC[-3]<RC[-1],RC[-3]>=6,RC[-3]<7),75,IF(AND(RC[-3]<RC[-1],RC[-3]>=7,RC[-3]<8),70,IF(AND(RC[-3]<RC[-1],RC[-3]>=8,RC[-3]<9),65,IF(AND(RC[-3]<RC[-1],RC[-3]>=9,RC[-3]<10),60,IF(AND(RC[-3]<RC[-1],RC[-3]>=10,RC[-3]<11),55,IF(AND(RC[-3]<RC[-1],RC[-3]>=11,RC[-3]<12),50,IF(AND(RC[-3]<RC[-1],RC[-3]>=12,RC[-3]<13),45,IF(AND(RC[-3]<RC[-1],RC[-3]>=13,RC[-3]<14),40,IF(AND(RC[-3]<RC[-1],RC[-3]>=14,RC[-3]<15),35,IF(AND(RC[-3]<RC[-1],RC[-3]>=15,RC[-3]<16),30,IF(AND(RC[-3]<RC[-1],RC[-3]>=16,RC[-3]<17),25,IF(AND(RC[-3]<RC[-1],RC[-3]>=17,RC[-3]<18),20,IF(AND(RC[-3]<RC[-1],RC[-3]>=18,RC[-3]<19),15,IF(AND(RC[-3]<RC[-1],RC[-3]>=19,RC[-3]<20),10,IF(AND(RC[-3]<RC[-1],RC[-3]>=20,RC[-3]<21),5,IF(AND(RC[-3]<RC[-1],RC[-3]>=21),0,IF(AND(RC[-3]>RC[-1],RC[-3]>=2,RC[-3]<3),90,IF(AND(RC[-3]>RC[-1],RC[-3]>=3,RC[-3]<4),90,IF(AND(RC[-3]>RC[-1],RC[-3]>=4,RC[-3]<5),80,IF(AND(RC[-3]>RC[-1],RC[-3]>=5,RC[-3]<6),70,IF(AND(RC[-3]>RC[-1],RC[-3]>=6,RC[-3]<7),60,IF(AND(RC[-3]>RC[-1],RC[-3]>=7,RC[-3]<8),50,IF(AND(RC[-3]>RC[-1],RC[-3]>=8,RC[-3]<9),40,IF(AND(RC[-3]>RC[-1],RC[-3]>=9,RC[-3]<10),30,IF(AND(RC[-3]>RC[-1],RC[-3]>=10,RC[-3]<11),20,IF(AND(RC[-3]>RC[-1],RC[-3]>=11,RC[-3]<12),10,IF(AND(RC[-3]>RC[-1],RC[-3]>=12),0))))))))))))))))))))))))))))))))) -> 80 | H3: =IF(RC[-3]="","",IF(RC[-3]<0.3,100,IF(AND(RC[-3]>=0.3,RC[-3]>0.4),95,IF(AND(RC[-3]>=0.4,RC[-3]<0.5),90,IF(AND(RC[-3]>=0.5,RC[-3]<0.6),85,IF(AND(RC[-3]>=0.6,RC[-3]<0.7),80,IF(AND(RC[-3]>=0.6,RC[-3]<1),80,IF(AND(RC[-3]>1,RC[-3]<2),50,IF(RC[-3]>2,0))))))))) ->  | I3: =IF(RC[-1]="",RC[-2],0.7*RC[-1]+0.3*RC[-2]) -> 80
A4: صنعتی و معدنی شمال شرق شاهرود | B4: کشرق | C4: =VLOOKUP(RC[-1],Sheet1!R3C2:R802C3,2,FALSE) -> استخراج زغال سنگ | D4: =VLOOKUP(RC[-2],Sheet1!R3C2:R802C9,8,FALSE) -> 26.685318980289921 | E4: =IF(VLOOKUP(RC[-3],Sheet1!R3C2:R803C11,10,FALSE)=0,"",VLOOKUP(Sheet2!RC[-3],Sheet1!R[1]C[-3]:R[801]C[6],10,FALSE)) ->  | F4: =Sheet1!R9C10 -> 7.1682740032996701 | G4: =IF(RC[-3]<0,0,IF(AND(RC[-3]<RC[-1],RC[-3]<2),100,IF(AND(RC[-3]<RC[-1],RC[-3]>=2,RC[-3]<3),95,IF(AND(RC[-3]<RC[-1],RC[-3]>=3,RC[-3]<4),90,IF(AND(RC[-3]<RC[-1],RC[-3]>=4,RC[-3]<5),85,IF(AND(RC[-3]<RC[-1],RC[-3]>=5,RC[-3]<6),80,IF(AND(RC[-3]<RC[-1],RC[-3]>=6,RC[-3]<7),75,IF(AND(RC[-3]<RC[-1],RC[-3]>=7,RC[-3]<8),70,IF(AND(RC[-3]<RC[-1],RC[-3]>=8,RC[-3]<9),65,IF(AND(RC[-3]<RC[-1],RC[-3]>=9,RC[-3]<10),60,IF(AND(RC[-3]<RC[-1],RC[-3]>=10,RC[-3]<11),55,IF(AND(RC[-3]<RC[-1],RC[-3]>=11,RC[-3]<12),50,IF(AND(RC[-3]<RC[-1],RC[-3]>=12,RC[-3]<13),45,IF(AND(RC[-3]<RC[-1],RC[-3]>=13,RC[-3]<14),40,IF(AND(RC[-3]<RC[-1],RC[-3]>=14,RC[-3]<15),35,IF(AND(RC[-3]<RC[-1],RC[-3]>=15,RC[-3]<16),30,IF(AND(RC[-3]<RC[-1],RC[-3]>=16,RC[-3]<17),25,IF(AND(RC[-3]<RC[-1],RC[-3]>=17,RC[-3]<18),20,IF(AND(RC[-3]<RC[-1],RC[-3]>=18,RC[-3]<19),15,IF(AND(RC[-3]<RC[-1],RC[-3]>=19,RC[-3]<20),10,IF(AND(RC[-3]<RC[-1],RC[-3]>=20,RC[-3]<21),5,IF(AND(RC[-3]<RC[-1],RC[-3]>=21),0,IF(AND(RC[-3]>RC[-1],RC[-3]>=2,RC[-3]<3),90,IF(AND(RC[-3]>RC[-1],RC[-3]>=3,RC[-3]<4),90,IF(AND(RC[-3]>RC[-1],RC[-3]>=4,RC[-3]<5),80,IF(AND(RC[-3]>RC[-1],RC[-3]>=5,RC[-3]<6),70,IF(AND(RC[-3]>RC[-1],RC[-3]>=6,RC[-3]<7),60,IF(AND(RC[-3]>RC[-1],RC[-3]>=7,RC[-3]<8),50,IF(AND(RC[-3]>RC[-1],RC[-3]>=8,RC[-3]<9),40,IF(AND(RC[-3]>RC[-1],RC[-3]>=9,RC[-3]<10),30,IF(AND(RC[-3]>RC[-1],RC[-3]>=10,RC[-3]<11),20,IF(AND(RC[-3]>RC[-1],RC[-3]>=11,RC[-3]<12),10,IF(AND(RC[-3]>RC[-1],RC[-3]>=12),0))))))))))))))))))))))))))))))))) -> 0 | H4: =IF(RC[-3]="","",IF(RC[-3]<0.3,100,IF(AND(RC[-3]>=0.3,RC[-3]>0.4),95,IF(AND(RC[-3]>=0.4,RC[-3]<0.5),90,IF(AND(RC[-3]>=0.5,RC[-3]<0.6),85,IF(AND(RC[-3]>=0.6,RC[-3]<0.7),80,IF(AND(RC[-3]>=0.6,RC[-3]<1),80,IF(AND(RC[-3]>1,RC[-3]<2),50,IF(RC[-3]>2,0))))))))) ->  | I4: =IF(RC[-1]="",RC[-2],0.7*RC[-1]+0.3*RC[-2]) -> 0
A5: فرآوری ذغال سنگ پروده طبس | B5: کپرور | C5: =VLOOKUP(RC[-1],Sheet1!R3C2:R802C3,2,FALSE) -> استخراج زغال سنگ | D5: =VLOOKUP(RC[-2],Sheet1!R3C2:R802C9,8,FALSE) -> 4.7257142559021501 | E5: =IF(VLOOKUP(RC[-3],Sheet1!R3C2:R803C11,10,FALSE)=0,"",VLOOKUP(Sheet2!RC[-3],Sheet1!R[1]C[-3]:R[801]C[6],10,FALSE)) ->  | F5: =Sheet1!R9C10 -> 7.1682740032996701 | G5: =IF(RC[-3]<0,0,IF(AND(RC[-3]<RC[-1],RC[-3]<2),100,IF(AND(RC[-3]<RC[-1],RC[-3]>=2,RC[-3]<3),95,IF(AND(RC[-3]<RC[-1],RC[-3]>=3,RC[-3]<4),90,IF(AND(RC[-3]<RC[-1],RC[-3]>=4,RC[-3]<5),85,IF(AND(RC[-3]<RC[-1],RC[-3]>=5,RC[-3]<6),80,IF(AND(RC[-3]<RC[-1],RC[-3]>=6,RC[-3]<7),75,IF(AND(RC[-3]<RC[-1],RC[-3]>=7,RC[-3]<8),70,IF(AND(RC[-3]<RC[-1],RC[-3]>=8,RC[-3]<9),65,IF(AND(RC[-3]<RC[-1],RC[-3]>=9,RC[-3]<10),60,IF(AND(RC[-3]<RC[-1],RC[-3]>=10,RC[-3]<11),55,IF(AND(RC[-3]<RC[-1],RC[-3]>=11,RC[-3]<12),50,IF(AND(RC[-3]<RC[-1],RC[-3]>=12,RC[-3]<13),45,IF(AND(RC[-3]<RC[-1],RC[-3]>=13,RC[-3]<14),40,IF(AND(RC[-3]<RC[-1],RC[-3]>=14,RC[-3]<15),35,IF(AND(RC[-3]<RC[-1],RC[-3]>=15,RC[-3]<16),30,IF(AND(RC[-3]<RC[-1],RC[-3]>=16,RC[-3]<17),25,IF(AND(RC[-3]<RC[-1],RC[-3]>=17,RC[-3]<18),20,IF(AND(RC[-3]<RC[-1],RC[-3]>=18,RC[-3]<19),15,IF(AND(RC[-3]<RC[-1],RC[-3]>=19,RC[-3]<20),10,IF(AND(RC[-3]<RC[-1],RC[-3]>=20,RC[-3]<21),5,IF(AND(RC[-3]<RC[-1],RC[-3]>=21),0,IF(AND(RC[-3]>RC[-1],RC[-3]>=2,RC[-3]<3),90,IF(AND(RC[-3]>RC[-1],RC[-3]>=3,RC[-3]<4),90,IF(AND(RC[-3]>RC[-1],RC[-3]>=4,RC[-3]<5),80,IF(AND(RC[-3]>RC[-1],RC[-3]>=5,RC[-3]<6),70,IF(AND(RC[-3]>RC[-1],RC[-3]>=6,RC[-3]<7),60,IF(AND(RC[-3]>RC[-1],RC[-3]>=7,RC[-3]<8),50,IF(AND(RC[-3]>RC[-1],RC[-3]>=8,RC[-3]<9),40,IF(AND(RC[-3]>RC[-1],RC[-3]>=9,RC[-3]<10),30,IF(AND(RC[-3]>RC[-1],RC[-3]>=10,RC[-3]<11),20,IF(AND(RC[-3]>RC[-1],RC[-3]>=11,RC[-3]<12),10,IF(AND(RC[-3]>RC[-1],RC[-3]>=12),0))))))))))))))))))))))))))))))))) -> 85 | H5: =IF(RC[-3]="","",IF(RC[-3]<0.3,100,IF(AND(RC[-3]>=0.3,RC[-3]>0.4),95,IF(AND(RC[-3]>=0.4,RC[-3]<0.5),90,IF(AND(RC[-3]>=0.5,RC[-3]<0.6),85,IF(AND(RC[-3]>=0.6,RC[-3]<0.7),80,IF(AND(RC[-3]>=0.6,RC[-3]<1),80,IF(AND(RC[-3]>1,RC[-3]<2),50,IF(RC[-3]>2,0))))))))) ->  | I5: =IF(RC[-1]="",RC[-2],0.7*RC[-1]+0.3*RC[-2]) -> 85
A6: تامین ماسه ریخته گری | B6: کماسه | C6: =VLOOKUP(RC[-1],Sheet1!R3C2:R802C3,2,FALSE) -> استخراج سایر معادن | D6: =VLOOKUP(RC[-2],Sheet1!R3C2:R802C9,8,FALSE) -> 9.0474424829963436 | E6: =IF(VLOOKUP(RC[-3],Sheet1!R3C2:R803C11,10,FALSE)=0,"",VLOOKUP(Sheet2!RC[-3],Sheet1!R[1]C[-3]:R[801]C[6],10,FALSE)) ->  | F6: =Sheet1!R9C10 -> 7.1682740032996701 | G6: =IF(RC[-3]<0,0,IF(AND(RC[-3]<RC[-1],RC[-3]<2),100,IF(AND(RC[-3]<RC[-1],RC[-3]>=2,RC[-3]<3),95,IF(AND(RC[-3]<RC[-1],RC[-3]>=3,RC[-3]<4),90,IF(AND(RC[-3]<RC[-1],RC[-3]>=4,RC[-3]<5),85,IF(AND(RC[-3]<RC[-1],RC[-3]>=5,RC[-3]<6),80,IF(AND(RC[-3]<RC[-1],RC[-3]>=6,RC[-3]<7),75,IF(AND(RC[-3]<RC[-1],RC[-3]>=7,RC[-3]<8),70,IF(AND(RC[-3]<RC[-1],RC[-3]>=8,RC[-3]<9),65,IF(AND(RC[-3]<RC[-1],RC[-3]>=9,RC[-3]<10),60,IF(AND(RC[-3]<RC[-1],RC[-3]>=10,RC[-3]<11),55,IF(AND(RC[-3]<RC[-1],RC[-3]>=11,RC[-3]<12),50,IF(AND(RC[-3]<RC[-1],RC[-3]>=12,RC[-3]<13),45,IF(AND(RC[-3]<RC[-1],RC[-3]>=13,RC[-3]<14),40,IF(AND(RC[-3]<RC[-1],RC[-3]>=14,RC[-3]<15),35,IF(AND(RC[-3]<RC[-1],RC[-3]>=15,RC[-3]<16),30,IF(AND(RC[-3]<RC[-1],RC[-3]>=16,RC[-3]<17),25,IF(AND(RC[-3]<RC[-1],RC[-3]>=17,RC[-3]<18),20,IF(AND(RC[-3]<RC[-1],RC[-3]>=18,RC[-3]<19),15,IF(AND(RC[-3]<RC[-1],RC[-3]>=19,RC[-3]<20),10,IF(AND(RC[-3]<RC[-1],RC[-3]>=20,RC[-3]<21),5,IF(AND(RC[-3]<RC[-1],RC[-3]>=21),0,IF(AND(RC[-3]>RC[-1],RC[-3]>=2,RC[-3]<3),90,IF(AND(RC[-3]>RC[-1],RC[-3]>=3,RC[-3]<4),90,IF(AND(RC[-3]>RC[-1],RC[-3]>=4,RC[-3]<5),80,IF(AND(RC[-3]>RC[-1],RC[-3]>=5,RC[-3]<6),70,IF(AND(RC[-3]>RC[-1],RC[-3]>=6,RC[-3]<7),60,IF(AND(RC[-3]>RC[-1],RC[-3]>=7,RC[-3]<8),50,IF(AND(RC[-3]>RC[-1],RC[-3]>=8,RC[-3]<9),40,IF(AND(RC[-3]>RC[-1],RC[-3]>=9,RC[-3]<10),30,IF(AND(RC[-3]>RC[-1],RC[-3]>=10,RC[-3]<11),20,IF(AND(RC[-3]>RC[-1],RC[-3]>=11,RC[-3]<12),10,IF(AND(RC[-3]>RC[-1],RC[-3]>=12),0))))))))))))))))))))))))))))))))) -> 30 | H6: =IF(RC[-3]="","",IF(RC[-3]<0.3,100,IF(AND(RC[-3]>=0.3,RC[-3]>0.4),95,IF(AND(RC[-3]>=0.4,RC[-3]<0.5),90,IF(AND(RC[-3]>=0.5,RC[-3]<0.6),85,IF(AND(RC[-3]>=0.6,RC[-3]<0.7),80,IF(AND(RC[-3]>=0.6,RC[-3]<1),80,IF(AND(RC[-3]>1,RC[-3]<2),50,IF(RC[-3]>2,0))))))))) ->  | I6: =IF(RC[-1]="",RC[-2],0.7*RC[-1]+0.3*RC[-2]) -> 30
A7: باما | B7: کاما | C7: =VLOOKUP(RC[-1],Sheet1!R3C2:R802C3,2,FALSE) -> استخراج کانه های فلزی | D7: =VLOOKUP(RC[-2],Sheet1!R3C2:R802C9,8,FALSE) -> 12.14505351514882 | E7: =IF(VLOOKUP(RC[-3],Sheet1!R3C2:R803C11,10,FALSE)=0,"",VLOOKUP(Sheet2!RC[-3],Sheet1!R[1]C[-3]:R[801]C[6],10,FALSE)) ->  | F7: =Sheet1!R28C10 -> 5.1398616868408133 | G7: =IF(RC[-3]<0,0,IF(AND(RC[-3]<RC[-1],RC[-3]<2),100,IF(AND(RC[-3]<RC[-1],RC[-3]>=2,RC[-3]<3),95,IF(AND(RC[-3]<RC[-1],RC[-3]>=3,RC[-3]<4),90,IF(AND(RC[-3]<RC[-1],RC[-3]>=4,RC[-3]<5),85,IF(AND(RC[-3]<RC[-1],RC[-3]>=5,RC[-3]<6),80,IF(AND(RC[-3]<RC[-1],RC[-3]>=6,RC[-3]<7),75,IF(AND(RC[-3]<RC[-1],RC[-3]>=7,RC[-3]<8),70,IF(AND(RC[-3]<RC[-1],RC[-3]>=8,RC[-3]<9),65,IF(AND(RC[-3]<RC[-1],RC[-3]>=9,RC[-3]<10),60,IF(AND(RC[-3]<RC[-1],RC[-3]>=10,RC[-3]<11),55,IF(AND(RC[-3]<RC[-1],RC[-3]>=11,RC[-3]<12),50,IF(AND(RC[-3]<RC[-1],RC[-3]>=12,RC[-3]<13),45,IF(AND(RC[-3]<RC[-1],RC[-3]>=13,RC[-3]<14),40,IF(AND(RC[-3]<RC[-1],RC[-3]>=14,RC[-3]<15),35,IF(AND(RC[-3]<RC[-1],RC[-3]>=15,RC[-3]<16),30,IF(AND(RC[-3]<RC[-1],RC[-3]>=16,RC[-3]<17),25,IF(AND(RC[-3]<RC[-1],RC[-3]>=17,RC[-3]<18),20,IF(AND(RC[-3]<RC[-1],RC[-3]>=18,RC[-3]<19),15,IF(AND(RC[-3]<RC[-1],RC[-3]>=19,RC[-3]<20),10,IF(AND(RC[-3]<RC[-1],RC[-3]>=20,RC[-3]<21),5,IF(AND(RC[-3]<RC[-1],RC[-3]>=21),0,IF(AND(RC[-3]>RC[-1],RC[-3]>=2,RC[-3]<3),90,IF(AND(RC[-3]>RC[-1],RC[-3]>=3,RC[-3]<4),90,IF(AND(RC[-3]>RC[-1],RC[-3]>=4,RC[-3]<5),80,IF(AND(RC[-3]>RC[-1],RC[-3]>=5,RC[-3]<6),70,IF(AND(RC[-3]>RC[-1],RC[-3]>=6,RC[-3]<7),60,IF(AND(RC[-3]>RC[-1],RC[-3]>=7,RC[-3]<8),50,IF(AND(RC[-3]>RC[-1],RC[-3]>=8,RC[-3]<9),40,IF(AND(RC[-3]>RC[-1],RC[-3]>=9,RC[-3]<10),30,IF(AND(RC[-3]>RC[-1],RC[-3]>=10,RC[-3]<11),20,IF(AND(RC[-3]>RC[-1],RC[-3]>=11,RC[-3]<12),10,IF(AND(RC[-3]>RC[-1],RC[-3]>=12),0))))))))))))))))))))))))))))))))) -> 0 | H7: =IF(RC[-3]="","",IF(RC[-3]<0.3,100,IF(AND(RC[-3]>=0.3,RC[-3]>0.4),95,IF(AND(RC[-3]>=0.4,RC[-3]<0.5),90,IF(AND(RC[-3]>=0.5,RC[-3]<0.6),85,IF(AND(RC[-3]>=0.6,RC[-3]<0.7),80,IF(AND(RC[-3]>=0.6,RC[-3]<1),80,IF(AND(RC[-3]>1,RC[-3]<2),50,IF(RC[-3]>2,0))))))))) ->  | I7: =IF(RC[-1]="",RC[-2],0.7*RC[-1]+0.3*RC[-2]) -> 0
A8: پویا زرکان آق دره | B8: فزر | C8: =VLOOKUP(RC[-1],Sheet1!R3C2:R802C3,2,FALSE) -> استخراج کانه های فلزی | D8: =VLOOKUP(RC[-2],Sheet1!R3C2:R802C9,8,FALSE) -> 4 | E8: =IF(VLOOKUP(RC[-3],Sheet1!R3C2:R803C11,10,FALSE)=0,"",VLOOKUP(Sheet2!RC[-3],Sheet1!R[1]C[-3]:R[801]C[6],10,FALSE)) ->  | F8: =Sheet1!R28C10 -> 5.1398616868408133 | G8: =IF(RC[-3]<0,0,IF(AND(RC[-3]<RC[-1],RC[-3]<2),100,IF(AND(RC[-3]<RC[-1],RC[-3]>=2,RC[-3]<3),95,IF(AND(RC[-3]<RC[-1],RC[-3]>=3,RC[-3]<4),90,IF(AND(RC[-3]<RC[-1],RC[-3]>=4,RC[-3]<5),85,IF(AND(RC[-3]<RC[-1],RC[-3]>=5,RC[-3]<6),80,IF(AND(RC[-3]<RC[-1],RC[-3]>=6,RC[-3]<7),75,IF(AND(RC[-3]<RC[-1],RC[-3]>=7,RC[-3]<8),70,IF(AND(RC[-3]<RC[-1],RC[-3]>=8,RC[-3]<9),65,IF(AND(RC[-3]<RC[-1],RC[-3]>=9,RC[-3]<10),60,IF(AND(RC[-3]<RC[-1],RC[-3]>=10,RC[-3]<11),55,IF(AND(RC[-3]<RC[-1],RC[-3]>=11,RC[-3]<12),50,IF(AND(RC[-3]<RC[-1],RC[-3]>=12,RC[-3]<13),45,IF(AND(RC[-3]<RC[-1],RC[-3]>=13,RC[-3]<14),40,IF(AND(RC[-3]<RC[-1],RC[-3]>=14,RC[-3]<15),35,IF(AND(RC[-3]<RC[-1],RC[-3]>=15,RC[-3]<16),30,IF(AND(RC[-3]<RC[-1],RC[-3]>=16,RC[-3]<17),25,IF(AND(RC[-3]<RC[-1],RC[-3]>=17,RC[-3]<18),20,IF(AND(RC[-3]<RC[-1],RC[-3]>=18,RC[-3]<19),15,IF(AND(RC[-3]<RC[-1],RC[-3]>=19,RC[-3]<20),10,IF(AND(RC[-3]<RC[-1],RC[-3]>=20,RC[-3]<21),5,IF(AND(RC[-3]<RC[-1],RC[-3]>=21),0,IF(AND(RC[-3]>RC[-1],RC[-3]>=2,RC[-3]<3),90,IF(AND(RC[-3]>RC[-1],RC[-3]>=3,RC[-3]<4),90,IF(AND(RC[-3]>RC[-1],RC[-3]>=4,RC[-3]<5),80,IF(AND(RC[-3]>RC[-1],RC[-3]>=5,RC[-3]<6),70,IF(AND(RC[-3]>RC[-1],RC[-3]>=6,RC[-3]<7),60,IF(AND(RC[-3]>RC[-1],RC[-3]>=7,RC[-3]<8),50,IF(AND(RC[-3]>RC[-1],RC[-3]>=8,RC[-3]<9),40,IF(AND(RC[-3]>RC[-1],RC[-3]>=9,RC[-3]<10),30,IF(AND(RC[-3]>RC[-1],RC[-3]>=10,RC[-3]<11),20,IF(AND(RC[-3]>RC[-1],RC[-3]>=11,RC[-3]<12),10,IF(AND(RC[-3]>RC[-1],RC[-3]>=12),0))))))))))))))))))))))))))))))))) -> 85 | H8: =IF(RC[-3]="","",IF(RC[-3]<0.3,100,IF(AND(RC[-3]>=0.3,RC[-3]>0.4),95,IF(AND(RC[-3]>=0.4,RC[-3]<0.5),90,IF(AND(RC[-3]>=0.5,RC[-3]<0.6),85,IF(AND(RC[-3]>=0.6,RC[-3]<0.7),80,IF(AND(RC[-3]>=0.6,RC[-3]<1),80,IF(AND(RC[-3]>1,RC[-3]<2),50,IF(RC[-3]>2,0))))))))) ->  | I8: =IF(RC[-1]="",RC[-2],0.7*RC[-1]+0.3*RC[-2]) -> 85
A9: تجلی توسعه معادن و فلزات | B9: تجلی | C9: =VLOOKUP(RC[-1],Sheet1!R3C2:R802C3,2,FALSE) -> استخراج کانه های فلزی | D9: =VLOOKUP(RC[-2],Sheet1!R3C2:R802C9,8,FALSE) -> 19.493379979591531 | E9: =IF(VLOOKUP(RC[-3],Sheet1!R3C2:R803C11,10,FALSE)=0,"",VLOOKUP(Sheet2!RC[-3],Sheet1!R[1]C[-3]:R[801]C[6],10,FALSE)) ->  | F9: =Sheet1!R28C10 -> 5.1398616868408133 | G9: =IF(RC[-3]<0,0,IF(AND(RC[-3]<RC[-1],RC[-3]<2),100,IF(AND(RC[-3]<RC[-1],RC[-3]>=2,RC[-3]<3),95,IF(AND(RC[-3]<RC[-1],RC[-3]>=3,RC[-3]<4),90,IF(AND(RC[-3]<RC[-1],RC[-3]>=4,RC[-3]<5),85,IF(AND(RC[-3]<RC[-1],RC[-3]>=5,RC[-3]<6),80,IF(AND(RC[-3]<RC[-1],RC[-3]>=6,RC[-3]<7),75,IF(AND(RC[-3]<RC[-1],RC[-3]>=7,RC[-3]<8),70,IF(AND(RC[-3]<RC[-1],RC[-3]>=8,RC[-3]<9),65,IF(AND(RC[-3]<RC[-1],RC[-3]>=9,RC[-3]<10),60,IF(AND(RC[-3]<RC[-1],RC[-3]>=10,RC[-3]<11),55,IF(AND(RC[-3]<RC[-1],RC[-3]>=11,RC[-3]<12),50,IF(AND(RC[-3]<RC[-1],RC[-3]>=12,RC[-3]<13),45,IF(AND(RC[-3]<RC[-1],RC[-3]>=13,RC[-3]<14),40,IF(AND(RC[-3]<RC[-1],RC[-3]>=14,RC[-3]<15),35,IF(AND(RC[-3]<RC[-1],RC[-3]>=15,RC[-3]<16),30,IF(AND(RC[-3]<RC[-1],RC[-3]>=16,RC[-3]<17),25,IF(AND(RC[-3]<RC[-1],RC[-3]>=17,RC[-3]<18),20,IF(AND(RC[-3]<RC[-1],RC[-3]>=18,RC[-3]<19),15,IF(AND(RC[-3]<RC[-1],RC[-3]>=19,RC[-3]<20),10,IF(AND(RC[-3]<RC[-1],RC[-3]>=20,RC[-3]<21),5,IF(AND(RC[-3]<RC[-1],RC[-3]>=21),0,IF(AND(RC[-3]>RC[-1],RC[-3]>=2,RC[-3]<3),90,IF(AND(RC[-3]>RC[-1],RC[-3]>=3,RC[-3]<4),90,IF(AND(RC[-3]>RC[-1],RC[-3]>=4,RC[-3]<5),80,IF(AND(RC[-3]>RC[-1],RC[-3]>=5,RC[-3]<6),70,IF(AND(RC[-3]>RC[-1],RC[-3]>=6,RC[-3]<7),60,IF(AND(RC[-3]>RC[-1],RC[-3]>=7,RC[-3]<8),50,IF(AND(RC[-3]>RC[-1],RC[-3]>=8,RC[-3]<9),40,IF(AND(RC[-3]>RC[-1],RC[-3]>=9,RC[-3]<10),30,IF(AND(RC[-3]>RC[-1],RC[-3]>=10,RC[-3]<11),20,IF(AND(RC[-3]>RC[-1],RC[-3]>=11,RC[-3]<12),10,IF(AND(RC[-3]>RC[-1],RC[-3]>=12),0))))))))))))))))))))))))))))))))) -> 0 | H9: =IF(RC[-3]="","",IF(RC[-3]<0.3,100,IF(AND(RC[-3]>=0.3,RC[-3]>0.4),95,IF(AND(RC[-3]>=0.4,RC[-3]<0.5),90,IF(AND(RC[-3]>=0.5,RC[-3]<0.6),85,IF(AND(RC[-3]>=0.6,RC[-3]<0.7),80,IF(AND(RC[-3]>=0.6,RC[-3]<1),80,IF(AND(RC[-3]>1,RC[-3]<2),50,IF(RC[-3]>2,0))))))))) ->  | I9: =IF(RC[-1]="",RC[-2],0.7*RC[-1]+0.3*RC[-2]) -> 0
A10: توسعه معدنی و صنعتی صبانور | B10: کنور | C10: =VLOOKUP(RC[-1],Sheet1!R3C2:R802C3,2,FALSE) -> استخراج کانه های فلزی | D10: =VLOOKUP(RC[-2],Sheet1!R3C2:R802C9,8,FALSE) -> 5.7481412837411474 | E10: =IF(VLOOKUP(RC[-3],Sheet1!R3C2:R803C11,10,FALSE)=0,"",VLOOKUP(Sheet2!RC[-3],Sheet1!R[1]C[-3]:R[801]C[6],10,FALSE)) ->  | F10: =Sheet1!R28C10 -> 5.1398616868408133 | G10: =IF(RC[-3]<0,0,IF(AND(RC[-3]<RC[-1],RC[-3]<2),100,IF(AND(RC[-3]<RC[-1],RC[-3]>=2,RC[-3]<3),95,IF(AND(RC[-3]<RC[-1],RC[-3]>=3,RC[-3]<4),90,IF(AND(RC[-3]<RC[-1],RC[-3]>=4,RC[-3]<5),85,IF(AND(RC[-3]<RC[-1],RC[-3]>=5,RC[-3]<6),80,IF(AND(RC[-3]<RC[-1],RC[-3]>=6,RC[-3]<7),75,IF(AND(RC[-3]<RC[-1],RC[-3]>=7,RC[-3]<8),70,IF(AND(RC[-3]<RC[-1],RC[-3]>=8,RC[-3]<9),65,IF(AND(RC[-3]<RC[-1],RC[-3]>=9,RC[-3]<10),60,IF(AND(RC[-3]<RC[-1],RC[-3]>=10,RC[-3]<11),55,IF(AND(RC[-3]<RC[-1],RC[-3]>=11,RC[-3]<12),50,IF(AND(RC[-3]<RC[-1],RC[-3]>=12,RC[-3]<13),45,IF(AND(RC[-3]<RC[-1],RC[-3]>=13,RC[-3]<14),40,IF(AND(RC[-3]<RC[-1],RC[-3]>=14,RC[-3]<15),35,IF(AND(RC[-3]<RC[-1],RC[-3]>=15,RC[-3]<16),30,IF(AND(RC[-3]<RC[-1],RC[-3]>=16,RC[-3]<17),25,IF(AND(RC[-3]<RC[-1],RC[-3]>=17,RC[-3]<18),20,IF(AND(RC[-3]<RC[-1],RC[-3]>=18,RC[-3]<19),15,IF(AND(RC[-3]<RC[-1],RC[-3]>=19,RC[-3]<20),10,IF(AND(RC[-3]<RC[-1],RC[-3]>=20,RC[-3]<21),5,IF(AND(RC[-3]<RC[-1],RC[-3]>=21),0,IF(AND(RC[-3]>RC[-1],RC[-3]>=2,RC[-3]<3),90,IF(AND(RC[-3]>RC[-1],RC[-3]>=3,RC[-3]<4),90,IF(AND(RC[-3]>RC[-1],RC[-3]>=4,RC[-3]<5),80,IF(AND(RC[-3]>RC[-1],RC[-3]>=5,RC[-3]<6),70,IF(AND(RC[-3]>RC[-1],RC[-3]>=6,RC[-3]<7),60,IF(AND(RC[-3]>RC[-1],RC[-3]>=7,RC[-3]<8),50,IF(AND(RC[-3]>RC[-1],RC[-3]>=8,RC[-3]<9),40,IF(AND(RC[-3]>RC[-1],RC[-3]>=9,RC[-3]<10),30,IF(AND(RC[-3]>RC[-1],RC[-3]>=10,RC[-3]<11),20,IF(AND(RC[-3]>RC[-1],RC[-3]>=11,RC[-3]<12),10,IF(AND(RC[-3]>RC[-1],RC[-3]>=12),0))))))))))))))))))))))))))))))))) -> 70 | H10: =IF(RC[-3]="","",IF(RC[-3]<0.3,100,IF(AND(RC[-3]>=0.3,RC[-3]>0.4),95,IF(AND(RC[-3]>=0.4,RC[-3]<0.5),90,IF(AND(RC[-3]>=0.5,RC[-3]<0.6),85,IF(AND(RC[-3]>=0.6,RC[-3]<0.7),80,IF(AND(RC[-3]>=0.6,RC[-3]<1),80,IF(AND(RC[-3]>1,RC[-3]<2),50,IF(RC[-3]>2,0))))))))) ->  | I10: =IF(RC[-1]="",RC[-2],0.7*RC[-1]+0.3*RC[-2]) -> 70
A11: چادرملو | B11: کچاد | C11: =VLOOKUP(RC[-1],Sheet1!R3C2:R802C3,2,FALSE) -> استخراج کانه های فلزی | D11: =VLOOKUP(RC[-2],Sheet1!R3C2:R802C9,8,FALSE) -> 3.5174844021787588 | E11: =IF(VLOOKUP(RC[-3],Sheet1!R3C2:R803C11,10,FALSE)=0,"",VLOOKUP(Sheet2!RC[-3],Sheet1!R[1]C[-3]:R[801]C[6],10,FALSE)) ->  | F11: =Sheet1!R28C10 -> 5.1398616868408133 | G11: =IF(RC[-3]<0,0,IF(AND(RC[-3]<RC[-1],RC[-3]<2),100,IF(AND(RC[-3]<RC[-1],RC[-3]>=2,RC[-3]<3),95,IF(AND(RC[-3]<RC[-1],RC[-3]>=3,RC[-3]<4),90,IF(AND(RC[-3]<RC[-1],RC[-3]>=4,RC[-3]<5),85,IF(AND(RC[-3]<RC[-1],RC[-3]>=5,RC[-3]<6),80,IF(AND(RC[-3]<RC[-1],RC[-3]>=6,RC[-3]<7),75,IF(AND(RC[-3]<RC[-1],RC[-3]>=7,RC[-3]<8),70,IF(AND(RC[-3]<RC[-1],RC[-3]>=8,RC[-3]<9),65,IF(AND(RC[-3]<RC[-1],RC[-3]>=9,RC[-3]<10),60,IF(AND(RC[-3]<RC[-1],RC[-3]>=10,RC[-3]<11),55,IF(AND(RC[-3]<RC[-1],RC[-3]>=11,RC[-3]<12),50,IF(AND(RC[-3]<RC[-1],RC[-3]>=12,RC[-3]<13),45,IF(AND(RC[-3]<RC[-1],RC[-3]>=13,RC[-3]<14),40,IF(AND(RC[-3]<RC[-1],RC[-3]>=14,RC[-3]<15),35,IF(AND(RC[-3]<RC[-1],RC[-3]>=15,RC[-3]<16),30,IF(AND(RC[-3]<RC[-1],RC[-3]>=16,RC[-3]<17),25,IF(AND(RC[-3]<RC[-1],RC[-3]>=17,RC[-3]<18),20,IF(AND(RC[-3]<RC[-1],RC[-3]>=18,RC[-3]<19),15,IF(AND(RC[-3]<RC[-1],RC[-3]>=19,RC[-3]<20),10,IF(AND(RC[-3]<RC[-1],RC[-3]>=20,RC[-3]<21),5,IF(AND(RC[-3]<RC[-1],RC[-3]>=21),0,IF(AND(RC[-3]>RC[-1],RC[-3]>=2,RC[-3]<3),90,IF(AND(RC[-3]>RC[-1],RC[-3]>=3,RC[-3]<4),90,IF(AND(RC[-3]>RC[-1],RC[-3]>=4,RC[-3]<5),80,IF(AND(RC[-3]>RC[-1],RC[-3]>=5,RC[-3]<6),70,IF(AND(RC[-3]>RC[-1],RC[-3]>=6,RC[-3]<7),60,IF(AND(RC[-3]>RC[-1],RC[-3]>=7,RC[-3]<8),50,IF(AND(RC[-3]>RC[-1],RC[-3]>=8,RC[-3]<9),40,IF(AND(RC[-3]>RC[-1],RC[-3]>=9,RC[-3]<10),30,IF(AND(RC[-3]>RC[-1],RC[-3]>=10,RC[-3]<11),20,IF(AND(RC[-3]>RC[-1],RC[-3]>=11,RC[-3]<12),10,IF(AND(RC[-3]>RC[-1],RC[-3]>=12),0))))))))))))))))))))))))))))))))) -> 90 | H11: =IF(RC[-3]="","",IF(RC[-3]<0.3,100,IF(AND(RC[-3]>=0.3,RC[-3]>0.4),95,IF(AND(RC[-3]>=0.4,RC[-3]<0.5),90,IF(AND(RC[-3]>=0.5,RC[-3]<0.6),85,IF(AND(RC[-3]>=0.6,RC[-3]<0.7),80,IF(AND(RC[-3]>=0.6,RC[-3]<1),80,IF(AND(RC[-3]>1,RC[-3]<2),50,IF(RC[-3]>2,0))))))))) ->  | I11: =IF(RC[-1]="",RC[-2],0.7*RC[-1]+0.3*RC[-2]) -> 90
A12: سر. توسعه معادن و فلزات | B12: ومعادن | C12: =VLOOKUP(RC[-1],Sheet1!R3C2:R802C3,2,FALSE) -> استخراج کانه های فلزی | D12: =VLOOKUP(RC[-2],Sheet1!R3C2:R802C9,8,FALSE) -> 3.1389879108444365 | E12: =IF(VLOOKUP(RC[-3],Sheet1!R3C2:R803C11,10,FALSE)=0,"",VLOOKUP(Sheet2!RC[-3],Sheet1!R[1]C[-3]:R[801]C[6],10,FALSE)) -> 0.6 | F12: =Sheet1!R28C10 -> 5.1398616868408133 | G12: =IF(RC[-3]<0,0,IF(AND(RC[-3]<RC[-1],RC[-3]<2),100,IF(AND(RC[-3]<RC[-1],RC[-3]>=2,RC[-3]<3),95,IF(AND(RC[-3]<RC[-1],RC[-3]>=3,RC[-3]<4),90,IF(AND(RC[-3]<RC[-1],RC[-3]>=4,RC[-3]<5),85,IF(AND(RC[-3]<RC[-1],RC[-3]>=5,RC[-3]<6),80,IF(AND(RC[-3]<RC[-1],RC[-3]>=6,RC[-3]<7),75,IF(AND(RC[-3]<RC[-1],RC[-3]>=7,RC[-3]<8),70,IF(AND(RC[-3]<RC[-1],RC[-3]>=8,RC[-3]<9),65,IF(AND(RC[-3]<RC[-1],RC[-3]>=9,RC[-3]<10),60,IF(AND(RC[-3]<RC[-1],RC[-3]>=10,RC[-3]<11),55,IF(AND(RC[-3]<RC[-1],RC[-3]>=11,RC[-3]<12),50,IF(AND(RC[-3]<RC[-1],RC[-3]>=12,RC[-3]<13),45,IF(AND(RC[-3]<RC[-1],RC[-3]>=13,RC[-3]<14),40,IF(AND(RC[-3]<RC[-1],RC[-3]>=14,RC[-3]<15),35,IF(AND(RC[-3]<RC[-1],RC[-3]>=15,RC[-3]<16),30,IF(AND(RC[-3]<RC[-1],RC[-3]>=16,RC[-3]<17),25,IF(AND(RC[-3]<RC[-1],RC[-3]>=17,RC[-3]<18),20,IF(AND(RC[-3]<RC[-1],RC[-3]>=18,RC[-3]<19),15,IF(AND(RC[-3]<RC[-1],RC[-3]>=19,RC[-3]<20),10,IF(AND(RC[-3]<RC[-1],RC[-3]>=20,RC[-3]<21),5,IF(AND(RC[-3]<RC[-1],RC[-3]>=21),0,IF(AND(RC[-3]>RC[-1],RC[-3]>=2,RC[-3]<3),90,IF(AND(RC[-3]>RC[-1],RC[-3]>=3,RC[-3]<4),90,IF(AND(RC[-3]>RC[-1],RC[-3]>=4,RC[-3]<5),80,IF(AND(RC[-3]>RC[-1],RC[-3]>=5,RC[-3]<6),70,IF(AND(RC[-3]>RC[-1],RC[-3]>=6,RC[-3]<7),60,IF(AND(RC[-3]>RC[-1],RC[-3]>=7,RC[-3]<8),50,IF(AND(RC[-3]>RC[-1],RC[-3]>=8,RC[-3]<9),40,IF(AND(RC[-3]>RC[-1],RC[-3]>=9,RC[-3]<10),30,IF(AND(RC[-3]>RC[-1],RC[-3]>=10,RC[-3]<11),20,IF(AND(RC[-3]>RC[-1],RC[-3]>=11,RC[-3]<12),10,IF(AND(RC[-3]>RC[-1],RC[-3]>=12),0))))))))))))))))))))))))))))))))) -> 90 | H12: =IF(RC[-3]="","",IF(RC[-3]<0.3,100,IF(AND(RC[-3]>=0.3,RC[-3]>0.4),95,IF(AND(RC[-3]>=0.4,RC[-3]<0.5),90,IF(AND(RC[-3]>=0.5,RC[-3]<0.6),85,IF(AND(RC[-3]>=0.6,RC[-3]<0.7),80,IF(AND(RC[-3]>=0.6,RC[-3]<1),80,IF(AND(RC[-3]>1,RC[-3]<2),50,IF(RC[-3]>2,0))))))))) -> 95 | I12: =IF(RC[-1]="",RC[-2],0.7*RC[-1]+0.3*RC[-2]) -> 93.5
A13: سر. صدر تامین | B13: تاصیکو | C13: =VLOOKUP(RC[-1],Sheet1!R3C2:R802C3,2,FALSE) -> استخراج کانه های فلزی | D13: =VLOOKUP(RC[-2],Sheet1!R3C2:R802C9,8,FALSE) -> 4.5992583711843382 | E13: =IF(VLOOKUP(RC[-3],Sheet1!R3C2:R803C11,10,FALSE)=0,"",VLOOKUP(Sheet2!RC[-3],Sheet1!R[1]C[-3]:R[801]C[6],10,FALSE)) -> 0.7 | F13: =Sheet1!R28C10 -> 5.1398616868408133 | G13: =IF(RC[-3]<0,0,IF(AND(RC[-3]<RC[-1],RC[-3]<2),100,IF(AND(RC[-3]<RC[-1],RC[-3]>=2,RC[-3]<3),95,IF(AND(RC[-3]<RC[-1],RC[-3]>=3,RC[-3]<4),90,IF(AND(RC[-3]<RC[-1],RC[-3]>=4,RC[-3]<5),85,IF(AND(RC[-3]<RC[-1],RC[-3]>=5,RC[-3]<6),80,IF(AND(RC[-3]<RC[-1],RC[-3]>=6,RC[-3]<7),75,IF(AND(RC[-3]<RC[-1],RC[-3]>=7,RC[-3]<8),70,IF(AND(RC[-3]<RC[-1],RC[-3]>=8,RC[-3]<9),65,IF(AND(RC[-3]<RC[-1],RC[-3]>=9,RC[-3]<10),60,IF(AND(RC[-3]<RC[-1],RC[-3]>=10,RC[-3]<11),55,IF(AND(RC[-3]<RC[-1],RC[-3]>=11,RC[-3]<12),50,IF(AND(RC[-3]<RC[-1],RC[-3]>=12,RC[-3]<13),45,IF(AND(RC[-3]<RC[-1],RC[-3]>=13,RC[-3]<14),40,IF(AND(RC[-3]<RC[-1],RC[-3]>=14,RC[-3]<15),35,IF(AND(RC[-3]<RC[-1],RC[-3]>=15,RC[-3]<16),30,IF(AND(RC[-3]<RC[-1],RC[-3]>=16,RC[-3]<17),25,IF(AND(RC[-3]<RC[-1],RC[-3]>=17,RC[-3]<18),20,IF(AND(RC[-3]<RC[-1],RC[-3]>=18,RC[-3]<19),15,IF(AND(RC[-3]<RC[-1],RC[-3]>=19,RC[-3]<20),10,IF(AND(RC[-3]<RC[-1],RC[-3]>=20,RC[-3]<21),5,IF(AND(RC[-3]<RC[-1],RC[-3]>=21),0,IF(AND(RC[-3]>RC[-1],RC[-3]>=2,RC[-3]<3),90,IF(AND(RC[-3]>RC[-1],RC[-3]>=3,RC[-3]<4),90,IF(AND(RC[-3]>RC[-1],RC[-3]>=4,RC[-3]<5),80,IF(AND(RC[-3]>RC[-1],RC[-3]>=5,RC[-3]<6),70,IF(AND(RC[-3]>RC[-1],RC[-3]>=6,RC[-3]<7),60,IF(AND(RC[-3]>RC[-1],RC[-3]>=7,RC[-3]<8),50,IF(AND(RC[-3]>RC[-1],RC[-3]>=8,RC[-3]<9),40,IF(AND(RC[-3]>RC[-1],RC[-3]>=9,RC[-3]<10),30,IF(AND(RC[-3]>RC[-1],RC[-3]>=10,RC[-3]<11),20,IF(AND(RC[-3]>RC[-1],RC[-3]>=11,RC[-3]<12),10,IF(AND(RC[-3]>RC[-1],RC[-3]>=12),0))))))))))))))))))))))))))))))))) -> 85 | H13: =IF(RC[-3]="","",IF(RC[-3]<0.3,100,IF(AND(RC[-3]>=0.3,RC[-3]>0.4),95,IF(AND(RC[-3]>=0.4,RC[-3]<0.5),90,IF(AND(RC[-3]>=0.5,RC[-3]<0.6),85,IF(AND(RC[-3]>=0.6,RC[-3]<0.7),80,IF(AND(RC[-3]>=0.6,RC[-3]<1),80,IF(AND(RC[-3]>1,RC[-3]<2),50,IF(RC[-3]>2,0))))))))) -> 95 | I13: =IF(RC[-1]="",RC[-2],0.7*RC[-1]+0.3*RC[-2]) -> 92
A14: سنگ آهن گهر زمین | B14: کگهر | C14: =VLOOKUP(RC[-1],Sheet1!R3C2:R802C3,2,FALSE) -> استخراج کانه های فلزی | D14: =VLOOKUP(RC[-2],Sheet1!R3C2:R802C9,8,FALSE) -> 5.8677192255530883 | E14: =IF(VLOOKUP(RC[-3],Sheet1!R3C2:R803C11,10,FALSE)=0,"",VLOOKUP(Sheet2!RC[-3],Sheet1!R[1]C[-3]:R[801]C[6],10,FALSE)) ->  | F14: =Sheet1!R28C10 -> 5.1398616868408133 | G14: =IF(RC[-3]<0,0,IF(AND(RC[-3]<RC[-1],RC[-3]<2),100,IF(AND(RC[-3]<RC[-1],RC[-3]>=2,RC[-3]<3),95,IF(AND(RC[-3]<RC[-1],RC[-3]>=3,RC[-3]<4),90,IF(AND(RC[-3]<RC[-1],RC[-3]>=4,RC[-3]<5),85,IF(AND(RC[-3]<RC[-1],RC[-3]>=5,RC[-3]<6),80,IF(AND(RC[-3]<RC[-1],RC[-3]>=6,RC[-3]<7),75,IF(AND(RC[-3]<RC[-1],RC[-3]>=7,RC[-3]<8),70,IF(AND(RC[-3]<RC[-1],RC[-3]>=8,RC[-3]<9),65,IF(AND(RC[-3]<RC[-1],RC[-3]>=9,RC[-3]<10),60,IF(AND(RC[-3]<RC[-1],RC[-3]>=10,RC[-3]<11),55,IF(AND(RC[-3]<RC[-1],RC[-3]>=11,RC[-3]<12),50,IF(AND(RC[-3]<RC[-1],RC[-3]>=12,RC[-3]<13),45,IF(AND(RC[-3]<RC[-1],RC[-3]>=13,RC[-3]<14),40,IF(AND(RC[-3]<RC[-1],RC[-3]>=14,RC[-3]<15),35,IF(AND(RC[-3]<RC[-1],RC[-3]>=15,RC[-3]<16),30,IF(AND(RC[-3]<RC[-1],RC[-3]>=16,RC[-3]<17),25,IF(AND(RC[-3]<RC[-1],RC[-3]>=17,RC[-3]<18),20,IF(AND(RC[-3]<RC[-1],RC[-3]>=18,RC[-3]<19),15,IF(AND(RC[-3]<RC[-1],RC[-3]>=19,RC[-3]<20),10,IF(AND(RC[-3]<RC[-1],RC[-3]>=20,RC[-3]<21),5,IF(AND(RC[-3]<RC[-1],RC[-3]>=21),0,IF(AND(RC[-3]>RC[-1],RC[-3]>=2,RC[-3]<3),90,IF(AND(RC[-3]>RC[-1],RC[-3]>=3,RC[-3]<4),90,IF(AND(RC[-3]>RC[-1],RC[-3]>=4,RC[-3]<5),80,IF(AND(RC[-3]>RC[-1],RC[-3]>=5,RC[-3]<6),70,IF(AND(RC[-3]>RC[-1],RC[-3]>=6,RC[-3]<7),60,IF(AND(RC[-3]>RC[-1],RC[-3]>=7,RC[-3]<8),50,IF(AND(RC[-3]>RC[-1],RC[-3]>=8,RC[-3]<9),40,IF(AND(RC[-3]>RC[-1],RC[-3]>=9,RC[-3]<10),30,IF(AND(RC[-3]>RC[-1],RC[-3]>=10,RC[-3]<11),20,IF(AND(RC[-3]>RC[-1],RC[-3]>=11,RC[-3]<12),10,IF(AND(RC[-3]>RC[-1],RC[-3]>=12),0))))))))))))))))))))))))))))))))) -> 70 | H14: =IF(RC[-3]="","",IF(RC[-3]<0.3,100,IF(AND(RC[-3]>=0.3,RC[-3]>0.4),95,IF(AND(RC[-3]>=0.4,RC[-3]<0.5),90,IF(AND(RC[-3]>=0.5,RC[-3]<0.6),85,IF(AND(RC[-3]>=0.6,RC[-3]<0.7),80,IF(AND(RC[-3]>=0.6,RC[-3]<1),80,IF(AND(RC[-3]>1,RC[-3]<2),50,IF(RC[-3]>2,0))))))))) ->  | I14: =IF(RC[-1]="",RC[-2],0.7*RC[-1]+0.3*RC[-2]) -> 70
A15: فراوری معدنی اپال کانی پارس | B15: اپال | C15: =VLOOKUP(RC[-1],Sheet1!R3C2:R802C3,2,FALSE) -> استخراج کانه های فلزی | D15: =VLOOKUP(RC[-2],Sheet1!R3C2:R802C9,8,FALSE) -> 4.93911016324624 | E15: =IF(VLOOKUP(RC[-3],Sheet1!R3C2:R803C11,10,FALSE)=0,"",VLOOKUP(Sheet2!RC[-3],Sheet1!R[1]C[-3]:R[801]C[6],10,FALSE)) ->  | F15: =Sheet1!R28C10 -> 5.1398616868408133 | G15: =IF(RC[-3]<0,0,IF(AND(RC[-3]<RC[-1],RC[-3]<2),100,IF(AND(RC[-3]<RC[-1],RC[-3]>=2,RC[-3]<3),95,IF(AND(RC[-3]<RC[-1],RC[-3]>=3,RC[-3]<4),90,IF(AND(RC[-3]<RC[-1],RC[-3]>=4,RC[-3]<5),85,IF(AND(RC[-3]<RC[-1],RC[-3]>=5,RC[-3]<6),80,IF(AND(RC[-3]<RC[-1],RC[-3]>=6,RC[-3]<7),75,IF(AND(RC[-3]<RC[-1],RC[-3]>=7,RC[-3]<8),70,IF(AND(RC[-3]<RC[-1],RC[-3]>=8,RC[-3]<9),65,IF(AND(RC[-3]<RC[-1],RC[-3]>=9,RC[-3]<10),60,IF(AND(RC[-3]<RC[-1],RC[-3]>=10,RC[-3]<11),55,IF(AND(RC[-3]<RC[-1],RC[-3]>=11,RC[-3]<12),50,IF(AND(RC[-3]<RC[-1],RC[-3]>=12,RC[-3]<13),45,IF(AND(RC[-3]<RC[-1],RC[-3]>=13,RC[-3]<14),40,IF(AND(RC[-3]<RC[-1],RC[-3]>=14,RC[-3]<15),35,IF(AND(RC[-3]<RC[-1],RC[-3]>=15,RC[-3]<16),30,IF(AND(RC[-3]<RC[-1],RC[-3]>=16,RC[-3]<17),25,IF(AND(RC[-3]<RC[-1],RC[-3]>=17,RC[-3]<18),20,IF(AND(RC[-3]<RC[-1],RC[-3]>=18,RC[-3]<19),15,IF(AND(RC[-3]<RC[-1],RC[-3]>=19,RC[-3]<20),10,IF(AND(RC[-3]<RC[-1],RC[-3]>=20,RC[-3]<21),5,IF(AND(RC[-3]<RC[-1],RC[-3]>=21),0,IF(AND(RC[-3]>RC[-1],RC[-3]>=2,RC[-3]<3),90,IF(AND(RC[-3]>RC[-1],RC[-3]>=3,RC[-3]<4),90,IF(AND(RC[-3]>RC[-1],RC[-3]>=4,RC[-3]<5),80,IF(AND(RC[-3]>RC[-1],RC[-3]>=5,RC[-3]<6),70,IF(AND(RC[-3]>RC[-1],RC[-3]>=6,RC[-3]<7),60,IF(AND(RC[-3]>RC[-1],RC[-3]>=7,RC[-3]<8),50,IF(AND(RC[-3]>RC[-1],RC[-3]>=8,RC[-3]<9),40,IF(AND(RC[-3]>RC[-1],RC[-3]>=9,RC[-3]<10),30,IF(AND(RC[-3]>RC[-1],RC[-3]>=10,RC[-3]<11),20,IF(AND(RC[-3]>RC[-1],RC[-3]>=11,RC[-3]<12),10,IF(AND(RC[-3]>RC[-1],RC[-3]>=12),0))))))))))))))))))))))))))))))))) -> 85 | H15: =IF(RC[-3]="","",IF(RC[-3]<0.3,100,IF(AND(RC[-3]>=0.3,RC[-3]>0.4),95,IF(AND(RC[-3]>=0.4,RC[-3]<0.5),90,IF(AND(RC[-3]>=0.5,RC[-3]<0.6),85,IF(AND(RC[-3]>=0.6,RC[-3]<0.7),80,IF(AND(RC[-3]>=0.6,RC[-3]<1),80,IF(AND(RC[-3]>1,RC[-3]<2),50,IF(RC[-3]>2,0))))))))) ->  | I15: =IF(RC[-1]="",RC[-2],0.7*RC[-1]+0.3*RC[-2]) -> 85
A16: گروه صنعتی و معدنی امیر | B16: وامیر | C16: =VLOOKUP(RC[-1],Sheet1!R3C2:R802C3,2,FALSE) -> استخراج کانه های فلزی | D16: =VLOOKUP(RC[-2],Sheet1!R3C2:R802C9,8,FALSE) -> 11.037315387167459 | E16: =IF(VLOOKUP(RC[-3],Sheet1!R3C2:R803C11,10,FALSE)=0,"",VLOOKUP(Sheet2!RC[-3],Sheet1!R[1]C[-3]:R[801]C[6],10,FALSE)) -> 0.45 | F16: =Sheet1!R28C10 -> 5.1398616868408133 | G16: =IF(RC[-3]<0,0,IF(AND(RC[-3]<RC[-1],RC[-3]<2),100,IF(AND(RC[-3]<RC[-1],RC[-3]>=2,RC[-3]<3),95,IF(AND(RC[-3]<RC[-1],RC[-3]>=3,RC[-3]<4),90,IF(AND(RC[-3]<RC[-1],RC[-3]>=4,RC[-3]<5),85,IF(AND(RC[-3]<RC[-1],RC[-3]>=5,RC[-3]<6),80,IF(AND(RC[-3]<RC[-1],RC[-3]>=6,RC[-3]<7),75,IF(AND(RC[-3]<RC[-1],RC[-3]>=7,RC[-3]<8),70,IF(AND(RC[-3]<RC[-1],RC[-3]>=8,RC[-3]<9),65,IF(AND(RC[-3]<RC[-1],RC[-3]>=9,RC[-3]<10),60,IF(AND(RC[-3]<RC[-1],RC[-3]>=10,RC[-3]<11),55,IF(AND(RC[-3]<RC[-1],RC[-3]>=11,RC[-3]<12),50,IF(AND(RC[-3]<RC[-1],RC[-3]>=12,RC[-3]<13),45,IF(AND(RC[-3]<RC[-1],RC[-3]>=13,RC[-3]<14),40,IF(AND(RC[-3]<RC[-1],RC[-3]>=14,RC[-3]<15),35,IF(AND(RC[-3]<RC[-1],RC[-3]>=15,RC[-3]<16),30,IF(AND(RC[-3]<RC[-1],RC[-3]>=16,RC[-3]<17),25,IF(AND(RC[-3]<RC[-1],RC[-3]>=17,RC[-3]<18),20,IF(AND(RC[-3]<RC[-1],RC[-3]>=18,RC[-3]<19),15,IF(AND(RC[-3]<RC[-1],RC[-3]>=19,RC[-3]<20),10,IF(AND(RC[-3]<RC[-1],RC[-3]>=20,RC[-3]<21),5,IF(AND(RC[-3]<RC[-1],RC[-3]>=21),0,IF(AND(RC[-3]>RC[-1],RC[-3]>=2,RC[-3]<3),90,IF(AND(RC[-3]>RC[-1],RC[-3]>=3,RC[-3]<4),90,IF(AND(RC[-3]>RC[-1],RC[-3]>=4,RC[-3]<5),80,IF(AND(RC[-3]>RC[-1],RC[-3]>=5,RC[-3]<6),70,IF(AND(RC[-3]>RC[-1],RC[-3]>=6,RC[-3]<7),60,IF(AND(RC[-3]>RC[-1],RC[-3]>=7,RC[-3]<8),50,IF(AND(RC[-3]>RC[-1],RC[-3]>=8,RC[-3]<9),40,IF(AND(RC[-3]>RC[-1],RC[-3]>=9,RC[-3]<10),30,IF(AND(RC[-3]>RC[-1],RC[-3]>=10,RC[-3]<11),20,IF(AND(RC[-3]>RC[-1],RC[-3]>=11,RC[-3]<12),10,IF(AND(RC[-3]>RC[-1],RC[-3]>=12),0))))))))))))))))))))))))))))))))) -> 10 | H16: =IF(RC[-3]="","",IF(RC[-3]<0.3,100,IF(AND(RC[-3]>=0.3,RC[-3]>0.4),95,IF(AND(RC[-3]>=0.4,RC[-3]<0.5),90,IF(AND(RC[-3]>=0.5,RC[-3]<0.6),85,IF(AND(RC[-3]>=0.6,RC[-3]<0.7),80,IF(AND(RC[-3]>=0.6,RC[-3]<1),80,IF(AND(RC[-3]>1,RC[-3]<2),50,IF(RC[-3]>2,0))))))))) -> 95 | I16: =IF(RC[-1]="",RC[-2],0.7*RC[-1]+0.3*RC[-2]) -> 69.5
A17: گل گهر | B17: کگل | C17: =VLOOKUP(RC[-1],Sheet1!R3C2:R802C3,2,FALSE) -> استخراج کانه های فلزی | D17: =VLOOKUP(RC[-2],Sheet1!R3C2:R802C9,8,FALSE) -> 5.8652521592698985 | E17: =IF(VLOOKUP(RC[-3],Sheet1!R3C2:R803C11,10,FALSE)=0,"",VLOOKUP(Sheet2!RC[-3],Sheet1!R[1]C[-3]:R[801]C[6],10,FALSE)) ->  | F17: =Sheet1!R28C10 -> 5.1398616868408133 | G17: =IF(RC[-3]<0,0,IF(AND(RC[-3]<RC[-1],RC[-3]<2),100,IF(AND(RC[-3]<RC[-1],RC[-3]>=2,RC[-3]<3),95,IF(AND(RC[-3]<RC[-1],RC[-3]>=3,RC[-3]<4),90,IF(AND(RC[-3]<RC[-1],RC[-3]>=4,RC[-3]<5),85,IF(AND(RC[-3]<RC[-1],RC[-3]>=5,RC[-3]<6),80,IF(AND(RC[-3]<RC[-1],RC[-3]>=6,RC[-3]<7),75,IF(AND(RC[-3]<RC[-1],RC[-3]>=7,RC[-3]<8),70,IF(AND(RC[-3]<RC[-1],RC[-3]>=8,RC[-3]<9),65,IF(AND(RC[-3]<RC[-1],RC[-3]>=9,RC[-3]<10),60,IF(AND(RC[-3]<RC[-1],RC[-3]>=10,RC[-3]<11),55,IF(AND(RC[-3]<RC[-1],RC[-3]>=11,RC[-3]<12),50,IF(AND(RC[-3]<RC[-1],RC[-3]>=12,RC[-3]<13),45,IF(AND(RC[-3]<RC[-1],RC[-3]>=13,RC[-3]<14),40,IF(AND(RC[-3]<RC[-1],RC[-3]>=14,RC[-3]<15),35,IF(AND(RC[-3]<RC[-1],RC[-3]>=15,RC[-3]<16),30,IF(AND(RC[-3]<RC[-1],RC[-3]>=16,RC[-3]<17),25,IF(AND(RC[-3]<RC[-1],RC[-3]>=17,RC[-3]<18),20,IF(AND(RC[-3]<RC[-1],RC[-3]>=18,RC[-3]<19),15,IF(AND(RC[-3]<RC[-1],RC[-3]>=19,RC[-3]<20),10,IF(AND(RC[-3]<RC[-1],RC[-3]>=20,RC[-3]<21),5,IF(AND(RC[-3]<RC[-1],RC[-3]>=21),0,IF(AND(RC[-3]>RC[-1],RC[-3]>=2,RC[-3]<3),90,IF(AND(RC[-3]>RC[-1],RC[-3]>=3,RC[-3]<4),90,IF(AND(RC[-3]>RC[-1],RC[-3]>=4,RC[-3]<5),80,IF(AND(RC[-3]>RC[-1],RC[-3]>=5,RC[-3]<6),70,IF(AND(RC[-3]>RC[-1],RC[-3]>=6,RC[-3]<7),60,IF(AND(RC[-3]>RC[-1],RC[-3]>=7,RC[-3]<8),50,IF(AND(RC[-3]>RC[-1],RC[-3]>=8,RC[-3]<9),40,IF(AND(RC[-3]>RC[-1],RC[-3]>=9,RC[-3]<10),30,IF(AND(RC[-3]>RC[-1],RC[-3]>=10,RC[-3]<11),20,IF(AND(RC[-3]>RC[-1],RC[-3]>=11,RC[-3]<12),10,IF(AND(RC[-3]>RC[-1],RC[-3]>=12),0))))))))))))))))))))))))))))))))) -> 70 | H17: =IF(RC[-3]="","",IF(RC[-3]<0.3,100,IF(AND(RC[-3]>=0.3,RC[-3]>0.4),95,IF(AND(RC[-3]>=0.4,RC[-3]<0.5),90,IF(AND(RC[-3]>=0.5,RC[-3]<0.6),85,IF(AND(RC[-3]>=0.6,RC[-3]<0.7),80,IF(AND(RC[-3]>=0.6,RC[-3]<1),80,IF(AND(RC[-3]>1,RC[-3]<2),50,IF(RC[-3]>2,0))))))))) ->  | I17: =IF(RC[-1]="",RC[-2],0.7*RC[-1]+0.3*RC[-2]) -> 70
A18: معادن بافق | B18: کبافق | C18: =VLOOKUP(RC[-1],Sheet1!R3C2:R802C3,2,FALSE) -> استخراج کانه های فلزی | D18: =VLOOKUP(RC[-2],Sheet1!R3C2:R802C9,8,FALSE) -> 11.097421013185 | E18: =IF(VLOOKUP(RC[-3],Sheet1!R3C2:R803C11,10,FALSE)=0,"",VLOOKUP(Sheet2!RC[-3],Sheet1!R[1]C[-3]:R[801]C[6],10,FALSE)) ->  | F18: =Sheet1!R28C10 -> 5.1398616868408133 | G18: =IF(RC[-3]<0,0,IF(AND(RC[-3]<RC[-1],RC[-3]<2),100,IF(AND(RC[-3]<RC[-1],RC[-3]>=2,RC[-3]<3),95,IF(AND(RC[-3]<RC[-1],RC[-3]>=3,RC[-3]<4),90,IF(AND(RC[-3]<RC[-1],RC[-3]>=4,RC[-3]<5),85,IF(AND(RC[-3]<RC[-1],RC[-3]>=5,RC[-3]<6),80,IF(AND(RC[-3]<RC[-1],RC[-3]>=6,RC[-3]<7),75,IF(AND(RC[-3]<RC[-1],RC[-3]>=7,RC[-3]<8),70,IF(AND(RC[-3]<RC[-1],RC[-3]>=8,RC[-3]<9),65,IF(AND(RC[-3]<RC[-1],RC[-3]>=9,RC[-3]<10),60,IF(AND(RC[-3]<RC[-1],RC[-3]>=10,RC[-3]<11),55,IF(AND(RC[-3]<RC[-1],RC[-3]>=11,RC[-3]<12),50,IF(AND(RC[-3]<RC[-1],RC[-3]>=12,RC[-3]<13),45,IF(AND(RC[-3]<RC[-1],RC[-3]>=13,RC[-3]<14),40,IF(AND(RC[-3]<RC[-1],RC[-3]>=14,RC[-3]<15),35,IF(AND(RC[-3]<RC[-1],RC[-3]>=15,RC[-3]<16),30,IF(AND(RC[-3]<RC[-1],RC[-3]>=16,RC[-3]<17),25,IF(AND(RC[-3]<RC[-1],RC[-3]>=17,RC[-3]<18),20,IF(AND(RC[-3]<RC[-1],RC[-3]>=18,RC[-3]<19),15,IF(AND(RC[-3]<RC[-1],RC[-3]>=19,RC[-3]<20),10,IF(AND(RC[-3]<RC[-1],RC[-3]>=20,RC[-3]<21),5,IF(AND(RC[-3]<RC[-1],RC[-3]>=21),0,IF(AND(RC[-3]>RC[-1],RC[-3]>=2,RC[-3]<3),90,IF(AND(RC[-3]>RC[-1],RC[-3]>=3,RC[-3]<4),90,IF(AND(RC[-3]>RC[-1],RC[-3]>=4,RC[-3]<5),80,IF(AND(RC[-3]>RC[-1],RC[-3]>=5,RC[-3]<6),70,IF(AND(RC[-3]>RC[-1],RC[-3]>=6,RC[-3]<7),60,IF(AND(RC[-3]>RC[-1],RC[-3]>=7,RC[-3]<8),50,IF(AND(RC[-3]>RC[-1],RC[-3]>=8,RC[-3]<9),40,IF(AND(RC[-3]>RC[-1],RC[-3]>=9,RC[-3]<10),30,IF(AND(RC[-3]>RC[-1],RC[-3]>=10,RC[-3]<11),20,IF(AND(RC[-3]>RC[-1],RC[-3]>=11,RC[-3]<12),10,IF(AND(RC[-3]>RC[-1],RC[-3]>=12),0))))))))))))))))))))))))))))))))) -> 10 | H18: =IF(RC[-3]="","",IF(RC[-3]<0.3,100,IF(AND(RC[-3]>=0.3,RC[-3]>0.4),95,IF(AND(RC[-3]>=0.4,RC[-3]<0.5),90,IF(AND(RC[-3]>=0.5,RC[-3]<0.6),85,IF(AND(RC[-3]>=0.6,RC[-3]<0.7),80,IF(AND(RC[-3]>=0.6,RC[-3]<1),80,IF(AND(RC[-3]>1,RC[-3]<2),50,IF(RC[-3]>2,0))))))))) ->  | I18: =IF(RC[-1]="",RC[-2],0.7*RC[-1]+0.3*RC[-2]) -> 10
A19: معادن روی ایران | B19: کروی | C19: =VLOOKUP(RC[-1],Sheet1!R3C2:R802C3,2,FALSE) -> استخراج کانه های فلزی | D19: =VLOOKUP(RC[-2],Sheet1!R3C2:R802C9,8,FALSE) -> 4.7876039013702361 | E19: =IF(VLOOKUP(RC[-3],Sheet1!R3C2:R803C11,10,FALSE)=0,"",VLOOKUP(Sheet2!RC[-3],Sheet1!R[1]C[-3]:R[801]C[6],10,FALSE)) -> 0.56000000000000005 | F19: =Sheet1!R28C10 -> 5.1398616868408133 | G19: =IF(RC[-3]<0,0,IF(AND(RC[-3]<RC[-1],RC[-3]<2),100,IF(AND(RC[-3]<RC[-1],RC[-3]>=2,RC[-3]<3),95,IF(AND(RC[-3]<RC[-1],RC[-3]>=3,RC[-3]<4),90,IF(AND(RC[-3]<RC[-1],RC[-3]>=4,RC[-3]<5),85,IF(AND(RC[-3]<RC[-1],RC[-3]>=5,RC[-3]<6),80,IF(AND(RC[-3]<RC[-1],RC[-3]>=6,RC[-3]<7),75,IF(AND(RC[-3]<RC[-1],RC[-3]>=7,RC[-3]<8),70,IF(AND(RC[-3]<RC[-1],RC[-3]>=8,RC[-3]<9),65,IF(AND(RC[-3]<RC[-1],RC[-3]>=9,RC[-3]<10),60,IF(AND(RC[-3]<RC[-1],RC[-3]>=10,RC[-3]<11),55,IF(AND(RC[-3]<RC[-1],RC[-3]>=11,RC[-3]<12),50,IF(AND(RC[-3]<RC[-1],RC[-3]>=12,RC[-3]<13),45,IF(AND(RC[-3]<RC[-1],RC[-3]>=13,RC[-3]<14),40,IF(AND(RC[-3]<RC[-1],RC[-3]>=14,RC[-3]<15),35,IF(AND(RC[-3]<RC[-1],RC[-3]>=15,RC[-3]<16),30,IF(AND(RC[-3]<RC[-1],RC[-3]>=16,RC[-3]<17),25,IF(AND(RC[-3]<RC[-1],RC[-3]>=17,RC[-3]<18),20,IF(AND(RC[-3]<RC[-1],RC[-3]>=18,RC[-3]<19),15,IF(AND(RC[-3]<RC[-1],RC[-3]>=19,RC[-3]<20),10,IF(AND(RC[-3]<RC[-1],RC[-3]>=20,RC[-3]<21),5,IF(AND(RC[-3]<RC[-1],RC[-3]>=21),0,IF(AND(RC[-3]>RC[-1],RC[-3]>=2,RC[-3]<3),90,IF(AND(RC[-3]>RC[-1],RC[-3]>=3,RC[-3]<4),90,IF(AND(RC[-3]>RC[-1],RC[-3]>=4,RC[-3]<5),80,IF(AND(RC[-3]>RC[-1],RC[-3]>=5,RC[-3]<6),70,IF(AND(RC[-3]>RC[-1],RC[-3]>=6,RC[-3]<7),60,IF(AND(RC[-3]>RC[-1],RC[-3]>=7,RC[-3]<8),50,IF(AND(RC[-3]>RC[-1],RC[-3]>=8,RC[-3]<9),40,IF(AND(RC[-3]>RC[-1],RC[-3]>=9,RC[-3]<10),30,IF(AND(RC[-3]>RC[-1],RC[-3]>=10,RC[-3]<11),20,IF(AND(RC[-3]>RC[-1],RC[-3]>=11,RC[-3]<12),10,IF(AND(RC[-3]>RC[-1],RC[-3]>=12),0))))))))))))))))))))))))))))))))) -> 85 | H19: =IF(RC[-3]="","",IF(RC[-3]<0.3,100,IF(AND(RC[-3]>=0.3,RC[-3]>0.4),95,IF(AND(RC[-3]>=0.4,RC[-3]<0.5),90,IF(AND(RC[-3]>=0.5,RC[-3]<0.6),85,IF(AND(RC[-3]>=0.6,RC[-3]<0.7),80,IF(AND(RC[-3]>=0.6,RC[-3]<1),80,IF(AND(RC[-3]>1,RC[-3]<2),50,IF(RC[-3]>2,0))))))))) -> 95 | I19: =IF(RC[-1]="",RC[-2],0.7*RC[-1]+0.3*RC[-2]) -> 92
A20: معادن مس تکنار | B20: تکنار | C20: =VLOOKUP(RC[-1],Sheet1!R3C2:R802C3,2,FALSE) -> استخراج کانه های فلزی | D20: =VLOOKUP(RC[-2],Sheet1!R3C2:R802C9,8,FALSE) -> 28.410843611305417 | E20: =IF(VLOOKUP(RC[-3],Sheet1!R3C2:R803C11,10,FALSE)=0,"",VLOOKUP(Sheet2!RC[-3],Sheet1!R[1]C[-3]:R[801]C[6],10,FALSE)) ->  | F20: =Sheet1!R28C10 -> 5.1398616868408133 | G20: =IF(RC[-3]<0,0,IF(AND(RC[-3]<RC[-1],RC[-3]<2),100,IF(AND(RC[-3]<RC[-1],RC[-3]>=2,RC[-3]<3),95,IF(AND(RC[-3]<RC[-1],RC[-3]>=3,RC[-3]<4),90,IF(AND(RC[-3]<RC[-1],RC[-3]>=4,RC[-3]<5),85,IF(AND(RC[-3]<RC[-1],RC[-3]>=5,RC[-3]<6),80,IF(AND(RC[-3]<RC[-1],RC[-3]>=6,RC[-3]<7),75,IF(AND(RC[-3]<RC[-1],RC[-3]>=7,RC[-3]<8),70,IF(AND(RC[-3]<RC[-1],RC[-3]>=8,RC[-3]<9),65,IF(AND(RC[-3]<RC[-1],RC[-3]>=9,RC[-3]<10),60,IF(AND(RC[-3]<RC[-1],RC[-3]>=10,RC[-3]<11),55,IF(AND(RC[-3]<RC[-1],RC[-3]>=11,RC[-3]<12),50,IF(AND(RC[-3]<RC[-1],RC[-3]>=12,RC[-3]<13),45,IF(AND(RC[-3]<RC[-1],RC[-3]>=13,RC[-3]<14),40,IF(AND(RC[-3]<RC[-1],RC[-3]>=14,RC[-3]<15),35,IF(AND(RC[-3]<RC[-1],RC[-3]>=15,RC[-3]<16),30,IF(AND(RC[-3]<RC[-1],RC[-3]>=16,RC[-3]<17),25,IF(AND(RC[-3]<RC[-1],RC[-3]>=17,RC[-3]<18),20,IF(AND(RC[-3]<RC[-1],RC[-3]>=18,RC[-3]<19),15,IF(AND(RC[-3]<RC[-1],RC[-3]>=19,RC[-3]<20),10,IF(AND(RC[-3]<RC[-1],RC[-3]>=20,RC[-3]<21),5,IF(AND(RC[-3]<RC[-1],RC[-3]>=21),0,IF(AND(RC[-3]>RC[-1],RC[-3]>=2,RC[-3]<3),90,IF(AND(RC[-3]>RC[-1],RC[-3]>=3,RC[-3]<4),90,IF(AND(RC[-3]>RC[-1],RC[-3]>=4,RC[-3]<5),80,IF(AND(RC[-3]>RC[-1],RC[-3]>=5,RC[-3]<6),70,IF(AND(RC[-3]>RC[-1],RC[-3]>=6,RC[-3]<7),60,IF(AND(RC[-3]>RC[-1],RC[-3]>=7,RC[-3]<8),50,IF(AND(RC[-3]>RC[-1],RC[-3]>=8,RC[-3]<9),40,IF(AND(RC[-3]>RC[-1],RC[-3]>=9,RC[-3]<10),30,IF(AND(RC[-3]>RC[-1],RC[-3]>=10,RC[-3]<11),20,IF(AND(RC[-3]>RC[-1],RC[-3]>=11,RC[-3]<12),10,IF(AND(RC[-3]>RC[-1],RC[-3]>=12),0))))))))))))))))))))))))))))))))) -> 0 | H20: =IF(RC[-3]="","",IF(RC[-3]<0.3,100,IF(AND(RC[-3]>=0.3,RC[-3]>0.4),95,IF(AND(RC[-3]>=0.4,RC[-3]<0.5),90,IF(AND(RC[-3]>=0.5,RC[-3]<0.6),85,IF(AND(RC[-3]>=0.6,RC[-3]<0.7),80,IF(AND(RC[-3]>=0.6,RC[-3]<1),80,IF(AND(RC[-3]>1,RC[-3]<2),50,IF(RC[-3]>2,0))))))))) ->  | I20: =IF(RC[-1]="",RC[-2],0.7*RC[-1]+0.3*RC[-2]) -> 0
A21: معادن منگنز ایران | B21: کمنگنز | C21: =VLOOKUP(RC[-1],Sheet1!R3C2:R802C3,2,FALSE) -> استخراج کانه های فلزی | D21: =VLOOKUP(RC[-2],Sheet1!R3C2:R802C9,8,FALSE) -> 5.7332393863948186 | E21: =IF(VLOOKUP(RC[-3],Sheet1!R3C2:R803C11,10,FALSE)=0,"",VLOOKUP(Sheet2!RC[-3],Sheet1!R[1]C[-3]:R[801]C[6],10,FALSE)) ->  | F21: =Sheet1!R28C10 -> 5.1398616868408133 | G21: =IF(RC[-3]<0,0,IF(AND(RC[-3]<RC[-1],RC[-3]<2),100,IF(AND(RC[-3]<RC[-1],RC[-3]>=2,RC[-3]<3),95,IF(AND(RC[-3]<RC[-1],RC[-3]>=3,RC[-3]<4),90,IF(AND(RC[-3]<RC[-1],RC[-3]>=4,RC[-3]<5),85,IF(AND(RC[-3]<RC[-1],RC[-3]>=5,RC[-3]<6),80,IF(AND(RC[-3]<RC[-1],RC[-3]>=6,RC[-3]<7),75,IF(AND(RC[-3]<RC[-1],RC[-3]>=7,RC[-3]<8),70,IF(AND(RC[-3]<RC[-1],RC[-3]>=8,RC[-3]<9),65,IF(AND(RC[-3]<RC[-1],RC[-3]>=9,RC[-3]<10),60,IF(AND(RC[-3]<RC[-1],RC[-3]>=10,RC[-3]<11),55,IF(AND(RC[-3]<RC[-1],RC[-3]>=11,RC[-3]<12),50,IF(AND(RC[-3]<RC[-1],RC[-3]>=12,RC[-3]<13),45,IF(AND(RC[-3]<RC[-1],RC[-3]>=13,RC[-3]<14),40,IF(AND(RC[-3]<RC[-1],RC[-3]>=14,RC[-3]<15),35,IF(AND(RC[-3]<RC[-1],RC[-3]>=15,RC[-3]<16),30,IF(AND(RC[-3]<RC[-1],RC[-3]>=16,RC[-3]<17),25,IF(AND(RC[-3]<RC[-1],RC[-3]>=17,RC[-3]<18),20,IF(AND(RC[-3]<RC[-1],RC[-3]>=18,RC[-3]<19),15,IF(AND(RC[-3]<RC[-1],RC[-3]>=19,RC[-3]<20),10,IF(AND(RC[-3]<RC[-1],RC[-3]>=20,RC[-3]<21),5,IF(AND(RC[-3]<RC[-1],RC[-3]>=21),0,IF(AND(RC[-3]>RC[-1],RC[-3]>=2,RC[-3]<3),90,IF(AND(RC[-3]>RC[-1],RC[-3]>=3,RC[-3]<4),90,IF(AND(RC[-3]>RC[-1],RC[-3]>=4,RC[-3]<5),80,IF(AND(RC[-3]>RC[-1],RC[-3]>=5,RC[-3]<6),70,IF(AND(RC[-3]>RC[-1],RC[-3]>=6,RC[-3]<7),60,IF(AND(RC[-3]>RC[-1],RC[-3]>=7,RC[-3]<8),50,IF(AND(RC[-3]>RC[-1],RC[-3]>=8,RC[-3]<9),40,IF(AND(RC[-3]>RC[-1],RC[-3]>=9,RC[-3]<10),30,IF(AND(RC[-3]>RC[-1],RC[-3]>=10,RC[-3]<11),20,IF(AND(RC[-3]>RC[-1],RC[-3]>=11,RC[-3]<12),10,IF(AND(RC[-3]>RC[-1],RC[-3]>=12),0))))))))))))))))))))))))))))))))) -> 70 | H21: =IF(RC[-3]="","",IF(RC[-3]<0.3,100,IF(AND(RC[-3]>=0.3,RC[-3]>0.4),95,IF(AND(RC[-3]>=0.4,RC[-3]<0.5),90,IF(AND(RC[-3]>=0.5,RC[-3]<0.6),85,IF(AND(RC[-3]>=0.6,RC[-3]<0.7),80,IF(AND(RC[-3]>=0.6,RC[-3]<1),80,IF(AND(RC[-3]>1,RC[-3]<2),50,IF(RC[-3]>2,0))))))))) ->  | I21: =IF(RC[-1]="",RC[-2],0.7*RC[-1]+0.3*RC[-2]) -> 70
A22: معدنی دماوند | B22: کدما | C22: =VLOOKUP(RC[-1],Sheet1!R3C2:R802C3,2,FALSE) -> استخراج کانه های فلزی | D22: =VLOOKUP(RC[-2],Sheet1!R3C2:R802C9,8,FALSE) -> 156.25515940382988 | E22: =IF(VLOOKUP(RC[-3],Sheet1!R3C2:R803C11,10,FALSE)=0,"",VLOOKUP(Sheet2!RC[-3],Sheet1!R[1]C[-3]:R[801]C[6],10,FALSE)) ->  | F22: =Sheet1!R28C10 -> 5.1398616868408133 | G22: =IF(RC[-3]<0,0,IF(AND(RC[-3]<RC[-1],RC[-3]<2),100,IF(AND(RC[-3]<RC[-1],RC[-3]>=2,RC[-3]<3),95,IF(AND(RC[-3]<RC[-1],RC[-3]>=3,RC[-3]<4),90,IF(AND(RC[-3]<RC[-1],RC[-3]>=4,RC[-3]<5),85,IF(AND(RC[-3]<RC[-1],RC[-3]>=5,RC[-3]<6),80,IF(AND(RC[-3]<RC[-1],RC[-3]>=6,RC[-3]<7),75,IF(AND(RC[-3]<RC[-1],RC[-3]>=7,RC[-3]<8),70,IF(AND(RC[-3]<RC[-1],RC[-3]>=8,RC[-3]<9),65,IF(AND(RC[-3]<RC[-1],RC[-3]>=9,RC[-3]<10),60,IF(AND(RC[-3]<RC[-1],RC[-3]>=10,RC[-3]<11),55,IF(AND(RC[-3]<RC[-1],RC[-3]>=11,RC[-3]<12),50,IF(AND(RC[-3]<RC[-1],RC[-3]>=12,RC[-3]<13),45,IF(AND(RC[-3]<RC[-1],RC[-3]>=13,RC[-3]<14),40,IF(AND(RC[-3]<RC[-1],RC[-3]>=14,RC[-3]<15),35,IF(AND(RC[-3]<RC[-1],RC[-3]>=15,RC[-3]<16),30,IF(AND(RC[-3]<RC[-1],RC[-3]>=16,RC[-3]<17),25,IF(AND(RC[-3]<RC[-1],RC[-3]>=17,RC[-3]<18),20,IF(AND(RC[-3]<RC[-1],RC[-3]>=18,RC[-3]<19),15,IF(AND(RC[-3]<RC[-1],RC[-3]>=19,RC[-3]<20),10,IF(AND(RC[-3]<RC[-1],RC[-3]>=20,RC[-3]<21),5,IF(AND(RC[-3]<RC[-1],RC[-3]>=21),0,IF(AND(RC[-3]>RC[-1],RC[-3]>=2,RC[-3]<3),90,IF(AND(RC[-3]>RC[-1],RC[-3]>=3,RC[-3]<4),90,IF(AND(RC[-3]>RC[-1],RC[-3]>=4,RC[-3]<5),80,IF(AND(RC[-3]>RC[-1],RC[-3]>=5,RC[-3]<6),70,IF(AND(RC[-3]>RC[-1],RC[-3]>=6,RC[-3]<7),60,IF(AND(RC[-3]>RC[-1],RC[-3]>=7,RC[-3]<8),50,IF(AND(RC[-3]>RC[-1],RC[-3]>=8,RC[-3]<9),40,IF(AND(RC[-3]>RC[-1],RC[-3]>=9,RC[-3]<10),30,IF(AND(RC[-3]>RC[-1],RC[-3]>=10,RC[-3]<11),20,IF(AND(RC[-3]>RC[-1],RC[-3]>=11,RC[-3]<12),10,IF(AND(RC[-3]>RC[-1],RC[-3]>=12),0))))))))))))))))))))))))))))))))) -> 0 | H22: =IF(RC[-3]="","",IF(RC[-3]<0.3,100,IF(AND(RC[-3]>=0.3,RC[-3]>0.4),95,IF(AND(RC[-3]>=0.4,RC[-3]<0.5),90,IF(AND(RC[-3]>=0.5,RC[-3]<0.6),85,IF(AND(RC[-3]>=0.6,RC[-3]<0.7),80,IF(AND(RC[-3]>=0.6,RC[-3]<1),80,IF(AND(RC[-3]>1,RC[-3]<2),50,IF(RC[-3]>2,0))))))))) ->  | I22: =IF(RC[-1]="",RC[-2],0.7*RC[-1]+0.3*RC[-2]) -> 0
A23: حفاری شمال | B23: حفاری | C23: =VLOOKUP(RC[-1],Sheet1!R3C2:R802C3,2,FALSE) -> استخراج نفت گاز جز اکتشاف | D23: =VLOOKUP(RC[-2],Sheet1!R3C2:R802C9,8,FALSE) -> 9.162217485772338 | E23: =IF(VLOOKUP(RC[-3],Sheet1!R3C2:R803C11,10,FALSE)=0,"",VLOOKUP(Sheet2!RC[-3],Sheet1!R[1]C[-3]:R[801]C[6],10,FALSE)) ->  | F23: =Sheet1!R31C10 -> 12.247206851986135 | G23: =IF(RC[-3]<0,0,IF(AND(RC[-3]<RC[-1],RC[-3]<2),100,IF(AND(RC[-3]<RC[-1],RC[-3]>=2,RC[-3]<3),95,IF(AND(RC[-3]<RC[-1],RC[-3]>=3,RC[-3]<4),90,IF(AND(RC[-3]<RC[-1],RC[-3]>=4,RC[-3]<5),85,IF(AND(RC[-3]<RC[-1],RC[-3]>=5,RC[-3]<6),80,IF(AND(RC[-3]<RC[-1],RC[-3]>=6,RC[-3]<7),75,IF(AND(RC[-3]<RC[-1],RC[-3]>=7,RC[-3]<8),70,IF(AND(RC[-3]<RC[-1],RC[-3]>=8,RC[-3]<9),65,IF(AND(RC[-3]<RC[-1],RC[-3]>=9,RC[-3]<10),60,IF(AND(RC[-3]<RC[-1],RC[-3]>=10,RC[-3]<11),55,IF(AND(RC[-3]<RC[-1],RC[-3]>=11,RC[-3]<12),50,IF(AND(RC[-3]<RC[-1],RC[-3]>=12,RC[-3]<13),45,IF(AND(RC[-3]<RC[-1],RC[-3]>=13,RC[-3]<14),40,IF(AND(RC[-3]<RC[-1],RC[-3]>=14,RC[-3]<15),35,IF(AND(RC[-3]<RC[-1],RC[-3]>=15,RC[-3]<16),30,IF(AND(RC[-3]<RC[-1],RC[-3]>=16,RC[-3]<17),25,IF(AND(RC[-3]<RC[-1],RC[-3]>=17,RC[-3]<18),20,IF(AND(RC[-3]<RC[-1],RC[-3]>=18,RC[-3]<19),15,IF(AND(RC[-3]<RC[-1],RC[-3]>=19,RC[-3]<20),10,IF(AND(RC[-3]<RC[-1],RC[-3]>=20,RC[-3]<21),5,IF(AND(RC[-3]<RC[-1],RC[-3]>=21),0,IF(AND(RC[-3]>RC[-1],RC[-3]>=2,RC[-3]<3),90,IF(AND(RC[-3]>RC[-1],RC[-3]>=3,RC[-3]<4),90,IF(AND(RC[-3]>RC[-1],RC[-3]>=4,RC[-3]<5),80,IF(AND(RC[-3]>RC[-1],RC[-3]>=5,RC[-3]<6),70,IF(AND(RC[-3]>RC[-1],RC[-3]>=6,RC[-3]<7),60,IF(AND(RC[-3]>RC[-1],RC[-3]>=7,RC[-3]<8),50,IF(AND(RC[-3]>RC[-1],RC[-3]>=8,RC[-3]<9),40,IF(AND(RC[-3]>RC[-1],RC[-3]>=9,RC[-3]<10),30,IF(AND(RC[-3]>RC[-1],RC[-3]>=10,RC[-3]<11),20,IF(AND(RC[-3]>RC[-1],RC[-3]>=11,RC[-3]<12),10,IF(AND(RC[-3]>RC[-1],RC[-3]>=12),0))))))))))))))))))))))))))))))))) -> 60 | H23: =IF(RC[-3]="","",IF(RC[-3]<0.3,100,IF(AND(RC[-3]>=0.3,RC[-3]>0.4),95,IF(AND(RC[-3]>=0.4,RC[-3]<0.5),90,IF(AND(RC[-3]>=0.5,RC[-3]<0.6),85,IF(AND(RC[-3]>=0.6,RC[-3]<0.7),80,IF(AND(RC[-3]>=0.6,RC[-3]<1),80,IF(AND(RC[-3]>1,RC[-3]<2),50,IF(RC[-3]>2,0))))))))) ->  | I23: =IF(RC[-1]="",RC[-2],0.7*RC[-1]+0.3*RC[-2]) -> 60
A24: مهندسی و ساختمان صنایع نفت | B24: شساخت | C24: =VLOOKUP(RC[-1],Sheet1!R3C2:R802C3,2,FALSE) -> استخراج نفت گاز جز اکتشاف | D24: =VLOOKUP(RC[-2],Sheet1!R3C2:R802C9,8,FALSE) -> 13.403993076977137 | E24: =IF(VLOOKUP(RC[-3],Sheet1!R3C2:R803C11,10,FALSE)=0,"",VLOOKUP(Sheet2!RC[-3],Sheet1!R[1]C[-3]:R[801]C[6],10,FALSE)) ->  | F24: =Sheet1!R31C10 -> 12.247206851986135 | G24: =IF(RC[-3]<0,0,IF(AND(RC[-3]<RC[-1],RC[-3]<2),100,IF(AND(RC[-3]<RC[-1],RC[-3]>=2,RC[-3]<3),95,IF(AND(RC[-3]<RC[-1],RC[-3]>=3,RC[-3]<4),90,IF(AND(RC[-3]<RC[-1],RC[-3]>=4,RC[-3]<5),85,IF(AND(RC[-3]<RC[-1],RC[-3]>=5,RC[-3]<6),80,IF(AND(RC[-3]<RC[-1],RC[-3]>=6,RC[-3]<7),75,IF(AND(RC[-3]<RC[-1],RC[-3]>=7,RC[-3]<8),70,IF(AND(RC[-3]<RC[-1],RC[-3]>=8,RC[-3]<9),65,IF(AND(RC[-3]<RC[-1],RC[-3]>=9,RC[-3]<10),60,IF(AND(RC[-3]<RC[-1],RC[-3]>=10,RC[-3]<11),55,IF(AND(RC[-3]<RC[-1],RC[-3]>=11,RC[-3]<12),50,IF(AND(RC[-3]<RC[-1],RC[-3]>=12,RC[-3]<13),45,IF(AND(RC[-3]<RC[-1],RC[-3]>=13,RC[-3]<14),40,IF(AND(RC[-3]<RC[-1],RC[-3]>=14,RC[-3]<15),35,IF(AND(RC[-3]<RC[-1],RC[-3]>=15,RC[-3]<16),30,IF(AND(RC[-3]<RC[-1],RC[-3]>=16,RC[-3]<17),25,IF(AND(RC[-3]<RC[-1],RC[-3]>=17,RC[-3]<18),20,IF(AND(RC[-3]<RC[-1],RC[-3]>=18,RC[-3]<19),15,IF(AND(RC[-3]<RC[-1],RC[-3]>=19,RC[-3]<20),10,IF(AND(RC[-3]<RC[-1],RC[-3]>=20,RC[-3]<21),5,IF(AND(RC[-3]<RC[-1],RC[-3]>=21),0,IF(AND(RC[-3]>RC[-1],RC[-3]>=2,RC[-3]<3),90,IF(AND(RC[-3]>RC[-1],RC[-3]>=3,RC[-3]<4),90,IF(AND(RC[-3]>RC[-1],RC[-3]>=4,RC[-3]<5),80,IF(AND(RC[-3]>RC[-1],RC[-3]>=5,RC[-3]<6),70,IF(AND(RC[-3]>RC[-1],RC[-3]>=6,RC[-3]<7),60,IF(AND(RC[-3]>RC[-1],RC[-3]>=7,RC[-3]<8),50,IF(AND(RC[-3]>RC[-1],RC[-3]>=8,RC[-3]<9),40,IF(AND(RC[-3]>RC[-1],RC[-3]>=9,RC[-3]<10),30,IF(AND(RC[-3]>RC[-1],RC[-3]>=10,RC[-3]<11),20,IF(AND(RC[-3]>RC[-1],RC[-3]>=11,RC[-3]<12),10,IF(AND(RC[-3]>RC[-1],RC[-3]>=12),0))))))))))))))))))))))))))))))))) -> 0 | H24: =IF(RC[-3]="","",IF(RC[-3]<0.3,100,IF(AND(RC[-3]>=0.3,RC[-3]>0.4),95,IF(AND(RC[-3]>=0.4,RC[-3]<0.5),90,IF(AND(RC[-3]>=0.5,RC[-3]<0.6),85,IF(AND(RC[-3]>=0.6,RC[-3]<0.7),80,IF(AND(RC[-3]>=0.6,RC[-3]<1),80,IF(AND(RC[-3]>1,RC[-3]<2),50,IF(RC[-3]>2,0))))))))) ->  | I24: =IF(RC[-1]="",RC[-2],0.7*RC[-1]+0.3*RC[-2]) -> 0
A25: آتیه داده پرداز | B25: اپرداز | C25: =VLOOKUP(RC[-1],Sheet1!R3C2:R802C3,2,FALSE) -> اطلاعات و ارتباطات | D25: =VLOOKUP(RC[-2],Sheet1!R3C2:R802C9,8,FALSE) -> 13.062038090820582 | E25: =IF(VLOOKUP(RC[-3],Sheet1!R3C2:R803C11,10,FALSE)=0,"",VLOOKUP(Sheet2!RC[-3],Sheet1!R[1]C[-3]:R[801]C[6],10,FALSE)) ->  | F25: =Sheet1!R36C10 -> 12.376633854230223 | G25: =IF(RC[-3]<0,0,IF(AND(RC[-3]<RC[-1],RC[-3]<2),100,IF(AND(RC[-3]<RC[-1],RC[-3]>=2,RC[-3]<3),95,IF(AND(RC[-3]<RC[-1],RC[-3]>=3,RC[-3]<4),90,IF(AND(RC[-3]<RC[-1],RC[-3]>=4,RC[-3]<5),85,IF(AND(RC[-3]<RC[-1],RC[-3]>=5,RC[-3]<6),80,IF(AND(RC[-3]<RC[-1],RC[-3]>=6,RC[-3]<7),75,IF(AND(RC[-3]<RC[-1],RC[-3]>=7,RC[-3]<8),70,IF(AND(RC[-3]<RC[-1],RC[-3]>=8,RC[-3]<9),65,IF(AND(RC[-3]<RC[-1],RC[-3]>=9,RC[-3]<10),60,IF(AND(RC[-3]<RC[-1],RC[-3]>=10,RC[-3]<11),55,IF(AND(RC[-3]<RC[-1],RC[-3]>=11,RC[-3]<12),50,IF(AND(RC[-3]<RC[-1],RC[-3]>=12,RC[-3]<13),45,IF(AND(RC[-3]<RC[-1],RC[-3]>=13,RC[-3]<14),40,IF(AND(RC[-3]<RC[-1],RC[-3]>=14,RC[-3]<15),35,IF(AND(RC[-3]<RC[-1],RC[-3]>=15,RC[-3]<16),30,IF(AND(RC[-3]<RC[-1],RC[-3]>=16,RC[-3]<17),25,IF(AND(RC[-3]<RC[-1],RC[-3]>=17,RC[-3]<18),20,IF(AND(RC[-3]<RC[-1],RC[-3]>=18,RC[-3]<19),15,IF(AND(RC[-3]<RC[-1],RC[-3]>=19,RC[-3]<20),10,IF(AND(RC[-3]<RC[-1],RC[-3]>=20,RC[-3]<21),5,IF(AND(RC[-3]<RC[-1],RC[-3]>=21),0,IF(AND(RC[-3]>RC[-1],RC[-3]>=2,RC[-3]<3),90,IF(AND(RC[-3]>RC[-1],RC[-3]>=3,RC[-3]<4),90,IF(AND(RC[-3]>RC[-1],RC[-3]>=4,RC[-3]<5),80,IF(AND(RC[-3]>RC[-1],RC[-3]>=5,RC[-3]<6),70,IF(AND(RC[-3]>RC[-1],RC[-3]>=6,RC[-3]<7),60,IF(AND(RC[-3]>RC[-1],RC[-3]>=7,RC[-3]<8),50,IF(AND(RC[-3]>RC[-1],RC[-3]>=8,RC[-3]<9),40,IF(AND(RC[-3]>RC[-1],RC[-3]>=9,RC[-3]<10),30,IF(AND(RC[-3]>RC[-1],RC[-3]>=10,RC[-3]<11),20,IF(AND(RC[-3]>RC[-1],RC[-3]>=11,RC[-3]<12),10,IF(AND(RC[-3]>RC[-1],RC[-3]>=12),0))))))))))))))))))))))))))))))))) -> 0 | H25: =IF(RC[-3]="","",IF(RC[-3]<0.3,100,IF(AND(RC[-3]>=0.3,RC[-3]>0.4),95,IF(AND(RC[-3]>=0.4,RC[-3]<0.5),90,IF(AND(RC[-3]>=0.5,RC[-3]<0.6),85,IF(AND(RC[-3]>=0.6,RC[-3]<0.7),80,IF(AND(RC[-3]>=0.6,RC[-3]<1),80,IF(AND(RC[-3]>1,RC[-3]<2),50,IF(RC[-3]>2,0))))))))) ->  | I25: =IF(RC[-1]="",RC[-2],0.7*RC[-1]+0.3*RC[-2]) -> 0
A26: انتقال داده های آسیاتک | B26: اسیاتک | C26: =VLOOKUP(RC[-1],Sheet1!R3C2:R802C3,2,FALSE) -> اطلاعات و ارتباطات | D26: =VLOOKUP(RC[-2],Sheet1!R3C2:R802C9,8,FALSE) -> 14.308953283168336 | E26: =IF(VLOOKUP(RC[-3],Sheet1!R3C2:R803C11,10,FALSE)=0,"",VLOOKUP(Sheet2!RC[-3],Sheet1!R[1]C[-3]:R[801]C[6],10,FALSE)) ->  | F26: =Sheet1!R36C10 -> 12.376633854230223 | G26: =IF(RC[-3]<0,0,IF(AND(RC[-3]<RC[-1],RC[-3]<2),100,IF(AND(RC[-3]<RC[-1],RC[-3]>=2,RC[-3]<3),95,IF(AND(RC[-3]<RC[-1],RC[-3]>=3,RC[-3]<4),90,IF(AND(RC[-3]<RC[-1],RC[-3]>=4,RC[-3]<5),85,IF(AND(RC[-3]<RC[-1],RC[-3]>=5,RC[-3]<6),80,IF(AND(RC[-3]<RC[-1],RC[-3]>=6,RC[-3]<7),75,IF(AND(RC[-3]<RC[-1],RC[-3]>=7,RC[-3]<8),70,IF(AND(RC[-3]<RC[-1],RC[-3]>=8,RC[-3]<9),65,IF(AND(RC[-3]<RC[-1],RC[-3]>=9,RC[-3]<10),60,IF(AND(RC[-3]<RC[-1],RC[-3]>=10,RC[-3]<11),55,IF(AND(RC[-3]<RC[-1],RC[-3]>=11,RC[-3]<12),50,IF(AND(RC[-3]<RC[-1],RC[-3]>=12,RC[-3]<13),45,IF(AND(RC[-3]<RC[-1],RC[-3]>=13,RC[-3]<14),40,IF(AND(RC[-3]<RC[-1],RC[-3]>=14,RC[-3]<15),35,IF(AND(RC[-3]<RC[-1],RC[-3]>=15,RC[-3]<16),30,IF(AND(RC[-3]<RC[-1],RC[-3]>=16,RC[-3]<17),25,IF(AND(RC[-3]<RC[-1],RC[-3]>=17,RC[-3]<18),20,IF(AND(RC[-3]<RC[-1],RC[-3]>=18,RC[-3]<19),15,IF(AND(RC[-3]<RC[-1],RC[-3]>=19,RC[-3]<20),10,IF(AND(RC[-3]<RC[-1],RC[-3]>=20,RC[-3]<21),5,IF(AND(RC[-3]<RC[-1],RC[-3]>=21),0,IF(AND(RC[-3]>RC[-1],RC[-3]>=2,RC[-3]<3),90,IF(AND(RC[-3]>RC[-1],RC[-3]>=3,RC[-3]<4),90,IF(AND(RC[-3]>RC[-1],RC[-3]>=4,RC[-3]<5),80,IF(AND(RC[-3]>RC[-1],RC[-3]>=5,RC[-3]<6),70,IF(AND(RC[-3]>RC[-1],RC[-3]>=6,RC[-3]<7),60,IF(AND(RC[-3]>RC[-1],RC[-3]>=7,RC[-3]<8),50,IF(AND(RC[-3]>RC[-1],RC[-3]>=8,RC[-3]<9),40,IF(AND(RC[-3]>RC[-1],RC[-3]>=9,RC[-3]<10),30,IF(AND(RC[-3]>RC[-1],RC[-3]>=10,RC[-3]<11),20,IF(AND(RC[-3]>RC[-1],RC[-3]>=11,RC[-3]<12),10,IF(AND(RC[-3]>RC[-1],RC[-3]>=12),0))))))))))))))))))))))))))))))))) -> 0 | H26: =IF(RC[-3]="","",IF(RC[-3]<0.3,100,IF(AND(RC[-3]>=0.3,RC[-3]>0.4),95,IF(AND(RC[-3]>=0.4,RC[-3]<0.5),90,IF(AND(RC[-3]>=0.5,RC[-3]<0.6),85,IF(AND(RC[-3]>=0.6,RC[-3]<0.7),80,IF(AND(RC[-3]>=0.6,RC[-3]<1),80,IF(AND(RC[-3]>1,RC[-3]<2),50,IF(RC[-3]>2,0))))))))) ->  | I26: =IF(RC[-1]="",RC[-2],0.7*RC[-1]+0.3*RC[-2]) -> 0
A27: داده گستر عصر نوین - های وب | B27: های وب | C27: =VLOOKUP(RC[-1],Sheet1!R3C2:R802C3,2,FALSE) -> اطلاعات و ارتباطات | D27: =VLOOKUP(RC[-2],Sheet1!R3C2:R802C9,8,FALSE) -> 1.4658518332221058 | E27: =IF(VLOOKUP(RC[-3],Sheet1!R3C2:R803C11,10,FALSE)=0,"",VLOOKUP(Sheet2!RC[-3],Sheet1!R[1]C[-3]:R[801]C[6],10,FALSE)) ->  | F27: =Sheet1!R36C10 -> 12.376633854230223 | G27: =IF(RC[-3]<0,0,IF(AND(RC[-3]<RC[-1],RC[-3]<2),100,IF(AND(RC[-3]<RC[-1],RC[-3]>=2,RC[-3]<3),95,IF(AND(RC[-3]<RC[-1],RC[-3]>=3,RC[-3]<4),90,IF(AND(RC[-3]<RC[-1],RC[-3]>=4,RC[-3]<5),85,IF(AND(RC[-3]<RC[-1],RC[-3]>=5,RC[-3]<6),80,IF(AND(RC[-3]<RC[-1],RC[-3]>=6,RC[-3]<7),75,IF(AND(RC[-3]<RC[-1],RC[-3]>=7,RC[-3]<8),70,IF(AND(RC[-3]<RC[-1],RC[-3]>=8,RC[-3]<9),65,IF(AND(RC[-3]<RC[-1],RC[-3]>=9,RC[-3]<10),60,IF(AND(RC[-3]<RC[-1],RC[-3]>=10,RC[-3]<11),55,IF(AND(RC[-3]<RC[-1],RC[-3]>=11,RC[-3]<12),50,IF(AND(RC[-3]<RC[-1],RC[-3]>=12,RC[-3]<13),45,IF(AND(RC[-3]<RC[-1],RC[-3]>=13,RC[-3]<14),40,IF(AND(RC[-3]<RC[-1],RC[-3]>=14,RC[-3]<15),35,IF(AND(RC[-3]<RC[-1],RC[-3]>=15,RC[-3]<16),30,IF(AND(RC[-3]<RC[-1],RC[-3]>=16,RC[-3]<17),25,IF(AND(RC[-3]<RC[-1],RC[-3]>=17,RC[-3]<18),20,IF(AND(RC[-3]<RC[-1],RC[-3]>=18,RC[-3]<19),15,IF(AND(RC[-3]<RC[-1],RC[-3]>=19,RC[-3]<20),10,IF(AND(RC[-3]<RC[-1],RC[-3]>=20,RC[-3]<21),5,IF(AND(RC[-3]<RC[-1],RC[-3]>=21),0,IF(AND(RC[-3]>RC[-1],RC[-3]>=2,RC[-3]<3),90,IF(AND(RC[-3]>RC[-1],RC[-3]>=3,RC[-3]<4),90,IF(AND(RC[-3]>RC[-1],RC[-3]>=4,RC[-3]<5),80,IF(AND(RC[-3]>RC[-1],RC[-3]>=5,RC[-3]<6),70,IF(AND(RC[-3]>RC[-1],RC[-3]>=6,RC[-3]<7),60,IF(AND(RC[-3]>RC[-1],RC[-3]>=7,RC[-3]<8),50,IF(AND(RC[-3]>RC[-1],RC[-3]>=8,RC[-3]<9),40,IF(AND(RC[-3]>RC[-1],RC[-3]>=9,RC[-3]<10),30,IF(AND(RC[-3]>RC[-1],RC[-3]>=10,RC[-3]<11),20,IF(AND(RC[-3]>RC[-1],RC[-3]>=11,RC[-3]<12),10,IF(AND(RC[-3]>RC[-1],RC[-3]>=12),0))))))))))))))))))))))))))))))))) -> 100 | H27: =IF(RC[-3]="","",IF(RC[-3]<0.3,100,IF(AND(RC[-3]>=0.3,RC[-3]>0.4),95,IF(AND(RC[-3]>=0.4,RC[-3]<0.5),90,IF(AND(RC[-3]>=0.5,RC[-3]<0.6),85,IF(AND(RC[-3]>=0.6,RC[-3]<0.7),80,IF(AND(RC[-3]>=0.6,RC[-3]<1),80,IF(AND(RC[-3]>1,RC[-3]<2),50,IF(RC[-3]>2,0))))))))) ->  | I27: =IF(RC[-1]="",RC[-2],0.7*RC[-1]+0.3*RC[-2]) -> 100
A28: مبین وان کیش | B28: اوان | C28: =VLOOKUP(RC[-1],Sheet1!R3C2:R802C3,2,FALSE) -> اطلاعات و ارتباطات | D28: =VLOOKUP(RC[-2],Sheet1!R3C2:R802C9,8,FALSE) -> 138.66399806454416 | E28: =IF(VLOOKUP(RC[-3],Sheet1!R3C2:R803C11,10,FALSE)=0,"",VLOOKUP(Sheet2!RC[-3],Sheet1!R[1]C[-3]:R[801]C[6],10,FALSE)) ->  | F28: =Sheet1!R36C10 -> 12.376633854230223 | G28: =IF(RC[-3]<0,0,IF(AND(RC[-3]<RC[-1],RC[-3]<2),100,IF(AND(RC[-3]<RC[-1],RC[-3]>=2,RC[-3]<3),95,IF(AND(RC[-3]<RC[-1],RC[-3]>=3,RC[-3]<4),90,IF(AND(RC[-3]<RC[-1],RC[-3]>=4,RC[-3]<5),85,IF(AND(RC[-3]<RC[-1],RC[-3]>=5,RC[-3]<6),80,IF(AND(RC[-3]<RC[-1],RC[-3]>=6,RC[-3]<7),75,IF(AND(RC[-3]<RC[-1],RC[-3]>=7,RC[-3]<8),70,IF(AND(RC[-3]<RC[-1],RC[-3]>=8,RC[-3]<9),65,IF(AND(RC[-3]<RC[-1],RC[-3]>=9,RC[-3]<10),60,IF(AND(RC[-3]<RC[-1],RC[-3]>=10,RC[-3]<11),55,IF(AND(RC[-3]<RC[-1],RC[-3]>=11,RC[-3]<12),50,IF(AND(RC[-3]<RC[-1],RC[-3]>=12,RC[-3]<13),45,IF(AND(RC[-3]<RC[-1],RC[-3]>=13,RC[-3]<14),40,IF(AND(RC[-3]<RC[-1],RC[-3]>=14,RC[-3]<15),35,IF(AND(RC[-3]<RC[-1],RC[-3]>=15,RC[-3]<16),30,IF(AND(RC[-3]<RC[-1],RC[-3]>=16,RC[-3]<17),25,IF(AND(RC[-3]<RC[-1],RC[-3]>=17,RC[-3]<18),20,IF(AND(RC[-3]<RC[-1],RC[-3]>=18,RC[-3]<19),15,IF(AND(RC[-3]<RC[-1],RC[-3]>=19,RC[-3]<20),10,IF(AND(RC[-3]<RC[-1],RC[-3]>=20,RC[-3]<21),5,IF(AND(RC[-3]<RC[-1],RC[-3]>=21),0,IF(AND(RC[-3]>RC[-1],RC[-3]>=2,RC[-3]<3),90,IF(AND(RC[-3]>RC[-1],RC[-3]>=3,RC[-3]<4),90,IF(AND(RC[-3]>RC[-1],RC[-3]>=4,RC[-3]<5),80,IF(AND(RC[-3]>RC[-1],RC[-3]>=5,RC[-3]<6),70,IF(AND(RC[-3]>RC[-1],RC[-3]>=6,RC[-3]<7),60,IF(AND(RC[-3]>RC[-1],RC[-3]>=7,RC[-3]<8),50,IF(AND(RC[-3]>RC[-1],RC[-3]>=8,RC[-3]<9),40,IF(AND(RC[-3]>RC[-1],RC[-3]>=9,RC[-3]<10),30,IF(AND(RC[-3]>RC[-1],RC[-3]>=10,RC[-3]<11),20,IF(AND(RC[-3]>RC[-1],RC[-3]>=11,RC[-3]<12),10,IF(AND(RC[-3]>RC[-1],RC[-3]>=12),0))))))))))))))))))))))))))))))))) -> 0 | H28: =IF(RC[-3]="","",IF(RC[-3]<0.3,100,IF(AND(RC[-3]>=0.3,RC[-3]>0.4),95,IF(AND(RC[-3]>=0.4,RC[-3]<0.5),90,IF(AND(RC[-3]>=0.5,RC[-3]<0.6),85,IF(AND(RC[-3]>=0.6,RC[-3]<0.7),80,IF(AND(RC[-3]>=0.6,RC[-3]<1),80,IF(AND(RC[-3]>1,RC[-3]<2),50,IF(RC[-3]>2,0))))))))) ->  | I28: =IF(RC[-1]="",RC[-2],0.7*RC[-1]+0.3*RC[-2]) -> 0
A29: آ.س.پ | B29: آ س پ | C29: =VLOOKUP(RC[-1],Sheet1!R3C2:R802C3,2,FALSE) -> انبوه سازی املاک و مستغلات | D29: =VLOOKUP(RC[-2],Sheet1!R3C2:R802C9,8,FALSE) -> 188.99629051685417 | E29: =IF(VLOOKUP(RC[-3],Sheet1!R3C2:R803C11,10,FALSE)=0,"",VLOOKUP(Sheet2!RC[-3],Sheet1!R[1]C[-3]:R[801]C[6],10,FALSE)) ->  | F29: =Sheet1!R71C10 -> 123.43233621398711 | G29: =IF(RC[-3]<0,0,IF(AND(RC[-3]<RC[-1],RC[-3]<2),100,IF(AND(RC[-3]<RC[-1],RC[-3]>=2,RC[-3]<3),95,IF(AND(RC[-3]<RC[-1],RC[-3]>=3,RC[-3]<4),90,IF(AND(RC[-3]<RC[-1],RC[-3]>=4,RC[-3]<5),85,IF(AND(RC[-3]<RC[-1],RC[-3]>=5,RC[-3]<6),80,IF(AND(RC[-3]<RC[-1],RC[-3]>=6,RC[-3]<7),75,IF(AND(RC[-3]<RC[-1],RC[-3]>=7,RC[-3]<8),70,IF(AND(RC[-3]<RC[-1],RC[-3]>=8,RC[-3]<9),65,IF(AND(RC[-3]<RC[-1],RC[-3]>=9,RC[-3]<10),60,IF(AND(RC[-3]<RC[-1],RC[-3]>=10,RC[-3]<11),55,IF(AND(RC[-3]<RC[-1],RC[-3]>=11,RC[-3]<12),50,IF(AND(RC[-3]<RC[-1],RC[-3]>=12,RC[-3]<13),45,IF(AND(RC[-3]<RC[-1],RC[-3]>=13,RC[-3]<14),40,IF(AND(RC[-3]<RC[-1],RC[-3]>=14,RC[-3]<15),35,IF(AND(RC[-3]<RC[-1],RC[-3]>=15,RC[-3]<16),30,IF(AND(RC[-3]<RC[-1],RC[-3]>=16,RC[-3]<17),25,IF(AND(RC[-3]<RC[-1],RC[-3]>=17,RC[-3]<18),20,IF(AND(RC[-3]<RC[-1],RC[-3]>=18,RC[-3]<19),15,IF(AND(RC[-3]<RC[-1],RC[-3]>=19,RC[-3]<20),10,IF(AND(RC[-3]<RC[-1],RC[-3]>=20,RC[-3]<21),5,IF(AND(RC[-3]<RC[-1],RC[-3]>=21),0,IF(AND(RC[-3]>RC[-1],RC[-3]>=2,RC[-3]<3),90,IF(AND(RC[-3]>RC[-1],RC[-3]>=3,RC[-3]<4),90,IF(AND(RC[-3]>RC[-1],RC[-3]>=4,RC[-3]<5),80,IF(AND(RC[-3]>RC[-1],RC[-3]>=5,RC[-3]<6),70,IF(AND(RC[-3]>RC[-1],RC[-3]>=6,RC[-3]<7),60,IF(AND(RC[-3]>RC[-1],RC[-3]>=7,RC[-3]<8),50,IF(AND(RC[-3]>RC[-1],RC[-3]>=8,RC[-3]<9),40,IF(AND(RC[-3]>RC[-1],RC[-3]>=9,RC[-3]<10),30,IF(AND(RC[-3]>RC[-1],RC[-3]>=10,RC[-3]<11),20,IF(AND(RC[-3]>RC[-1],RC[-3]>=11,RC[-3]<12),10,IF(AND(RC[-3]>RC[-1],RC[-3]>=12),0))))))))))))))))))))))))))))))))) -> 0 | H29: =IF(RC[-3]="","",IF(RC[-3]<0.3,100,IF(AND(RC[-3]>=0.3,RC[-3]>0.4),95,IF(AND(RC[-3]>=0.4,RC[-3]<0.5),90,IF(AND(RC[-3]>=0.5,RC[-3]<0.6),85,IF(AND(RC[-3]>=0.6,RC[-3]<0.7),80,IF(AND(RC[-3]>=0.6,RC[-3]<1),80,IF(AND(RC[-3]>1,RC[-3]<2),50,IF(RC[-3]>2,0))))))))) ->  | I29: =IF(RC[-1]="",RC[-2],0.7*RC[-1]+0.3*RC[-2]) -> 0
A30: بهساز کاشانه تهران | B30: ثبهساز | C30: =VLOOKUP(RC[-1],Sheet1!R3C2:R802C3,2,FALSE) -> انبوه سازی املاک و مستغلات | D30: =VLOOKUP(RC[-2],Sheet1!R3C2:R802C9,8,FALSE) -> 4.8875241390197512 | E30: =IF(VLOOKUP(RC[-3],Sheet1!R3C2:R803C11,10,FALSE)=0,"",VLOOKUP(Sheet2!RC[-3],Sheet1!R[1]C[-3]:R[801]C[6],10,FALSE)) ->  | F30: =Sheet1!R71C10 -> 123.43233621398711 | G30: =IF(RC[-3]<0,0,IF(AND(RC[-3]<RC[-1],RC[-3]<2),100,IF(AND(RC[-3]<RC[-1],RC[-3]>=2,RC[-3]<3),95,IF(AND(RC[-3]<RC[-1],RC[-3]>=3,RC[-3]<4),90,IF(AND(RC[-3]<RC[-1],RC[-3]>=4,RC[-3]<5),85,IF(AND(RC[-3]<RC[-1],RC[-3]>=5,RC[-3]<6),80,IF(AND(RC[-3]<RC[-1],RC[-3]>=6,RC[-3]<7),75,IF(AND(RC[-3]<RC[-1],RC[-3]>=7,RC[-3]<8),70,IF(AND(RC[-3]<RC[-1],RC[-3]>=8,RC[-3]<9),65,IF(AND(RC[-3]<RC[-1],RC[-3]>=9,RC[-3]<10),60,IF(AND(RC[-3]<RC[-1],RC[-3]>=10,RC[-3]<11),55,IF(AND(RC[-3]<RC[-1],RC[-3]>=11,RC[-3]<12),50,IF(AND(RC[-3]<RC[-1],RC[-3]>=12,RC[-3]<13),45,IF(AND(RC[-3]<RC[-1],RC[-3]>=13,RC[-3]<14),40,IF(AND(RC[-3]<RC[-1],RC[-3]>=14,RC[-3]<15),35,IF(AND(RC[-3]<RC[-1],RC[-3]>=15,RC[-3]<16),30,IF(AND(RC[-3]<RC[-1],RC[-3]>=16,RC[-3]<17),25,IF(AND(RC[-3]<RC[-1],RC[-3]>=17,RC[-3]<18),20,IF(AND(RC[-3]<RC[-1],RC[-3]>=18,RC[-3]<19),15,IF(AND(RC[-3]<RC[-1],RC[-3]>=19,RC[-3]<20),10,IF(AND(RC[-3]<RC[-1],RC[-3]>=20,RC[-3]<21),5,IF(AND(RC[-3]<RC[-1],RC[-3]>=21),0,IF(AND(RC[-3]>RC[-1],RC[-3]>=2,RC[-3]<3),90,IF(AND(RC[-3]>RC[-1],RC[-3]>=3,RC[-3]<4),90,IF(AND(RC[-3]>RC[-1],RC[-3]>=4,RC[-3]<5),80,IF(AND(RC[-3]>RC[-1],RC[-3]>=5,RC[-3]<6),70,IF(AND(RC[-3]>RC[-1],RC[-3]>=6,RC[-3]<7),60,IF(AND(RC[-3]>RC[-1],RC[-3]>=7,RC[-3]<8),50,IF(AND(RC[-3]>RC[-1],RC[-3]>=8,RC[-3]<9),40,IF(AND(RC[-3]>RC[-1],RC[-3]>=9,RC[-3]<10),30,IF(AND(RC[-3]>RC[-1],RC[-3]>=10,RC[-3]<11),20,IF(AND(RC[-3]>RC[-1],RC[-3]>=11,RC[-3]<12),10,IF(AND(RC[-3]>RC[-1],RC[-3]>=12),0))))))))))))))))))))))))))))))))) -> 85 | H30: =IF(RC[-3]="","",IF(RC[-3]<0.3,100,IF(AND(RC[-3]>=0.3,RC[-3]>0.4),95,IF(AND(RC[-3]>=0.4,RC[-3]<0.5),90,IF(AND(RC[-3]>=0.5,RC[-3]<0.6),85,IF(AND(RC[-3]>=0.6,RC[-3]<0.7),80,IF(AND(RC[-3]>=0.6,RC[-3]<1),80,IF(AND(RC[-3]>1,RC[-3]<2),50,IF(RC[-3]>2,0))))))))) ->  | I30: =IF(RC[-1]="",RC[-2],0.7*RC[-1]+0.3*RC[-2]) -> 85
A31: تامین مسکن جوانان | B31: ثجوان | C31: =VLOOKUP(RC[-1],Sheet1!R3C2:R802C3,2,FALSE) -> انبوه سازی املاک و مستغلات | D31: =VLOOKUP(RC[-2],Sheet1!R3C2:R802C9,8,FALSE) -> 433.04734471284002 | E31: =IF(VLOOKUP(RC[-3],Sheet1!R3C2:R803C11,10,FALSE)=0,"",VLOOKUP(Sheet2!RC[-3],Sheet1!R[1]C[-3]:R[801]C[6],10,FALSE)) ->  | F31: =Sheet1!R71C10 -> 123.43233621398711 | G31: =IF(RC[-3]<0,0,IF(AND(RC[-3]<RC[-1],RC[-3]<2),100,IF(AND(RC[-3]<RC[-1],RC[-3]>=2,RC[-3]<3),95,IF(AND(RC[-3]<RC[-1],RC[-3]>=3,RC[-3]<4),90,IF(AND(RC[-3]<RC[-1],RC[-3]>=4,RC[-3]<5),85,IF(AND(RC[-3]<RC[-1],RC[-3]>=5,RC[-3]<6),80,IF(AND(RC[-3]<RC[-1],RC[-3]>=6,RC[-3]<7),75,IF(AND(RC[-3]<RC[-1],RC[-3]>=7,RC[-3]<8),70,IF(AND(RC[-3]<RC[-1],RC[-3]>=8,RC[-3]<9),65,IF(AND(RC[-3]<RC[-1],RC[-3]>=9,RC[-3]<10),60,IF(AND(RC[-3]<RC[-1],RC[-3]>=10,RC[-3]<11),55,IF(AND(RC[-3]<RC[-1],RC[-3]>=11,RC[-3]<12),50,IF(AND(RC[-3]<RC[-1],RC[-3]>=12,RC[-3]<13),45,IF(AND(RC[-3]<RC[-1],RC[-3]>=13,RC[-3]<14),40,IF(AND(RC[-3]<RC[-1],RC[-3]>=14,RC[-3]<15),35,IF(AND(RC[-3]<RC[-1],RC[-3]>=15,RC[-3]<16),30,IF(AND(RC[-3]<RC[-1],RC[-3]>=16,RC[-3]<17),25,IF(AND(RC[-3]<RC[-1],RC[-3]>=17,RC[-3]<18),20,IF(AND(RC[-3]<RC[-1],RC[-3]>=18,RC[-3]<19),15,IF(AND(RC[-3]<RC[-1],RC[-3]>=19,RC[-3]<20),10,IF(AND(RC[-3]<RC[-1],RC[-3]>=20,RC[-3]<21),5,IF(AND(RC[-3]<RC[-1],RC[-3]>=21),0,IF(AND(RC[-3]>RC[-1],RC[-3]>=2,RC[-3]<3),90,IF(AND(RC[-3]>RC[-1],RC[-3]>=3,RC[-3]<4),90,IF(AND(RC[-3]>RC[-1],RC[-3]>=4,RC[-3]<5),80,IF(AND(RC[-3]>RC[-1],RC[-3]>=5,RC[-3]<6),70,IF(AND(RC[-3]>RC[-1],RC[-3]>=6,RC[-3]<7),60,IF(AND(RC[-3]>RC[-1],RC[-3]>=7,RC[-3]<8),50,IF(AND(RC[-3]>RC[-1],RC[-3]>=8,RC[-3]<9),40,IF(AND(RC[-3]>RC[-1],RC[-3]>=9,RC[-3]<10),30,IF(AND(RC[-3]>RC[-1],RC[-3]>=10,RC[-3]<11),20,IF(AND(RC[-3]>RC[-1],RC[-3]>=11,RC[-3]<12),10,IF(AND(RC[-3]>RC[-1],RC[-3]>=12),0))))))))))))))))))))))))))))))))) -> 0 | H31: =IF(RC[-3]="","",IF(RC[-3]<0.3,100,IF(AND(RC[-3]>=0.3,RC[-3]>0.4),95,IF(AND(RC[-3]>=0.4,RC[-3]<0.5),90,IF(AND(RC[-3]>=0.5,RC[-3]<0.6),85,IF(AND(RC[-3]>=0.6,RC[-3]<0.7),80,IF(AND(RC[-3]>=0.6,RC[-3]<1),80,IF(AND(RC[-3]>1,RC[-3]<2),50,IF(RC[-3]>2,0))))))))) ->  | I31: =IF(RC[-1]="",RC[-2],0.7*RC[-1]+0.3*RC[-2]) -> 0
A32: توسعه ساختمان | B32: ثاخت | C32: =VLOOKUP(RC[-1],Sheet1!R3C2:R802C3,2,FALSE) -> انبوه سازی املاک و مستغلات | D32: =VLOOKUP(RC[-2],Sheet1!R3C2:R802C9,8,FALSE) -> 11.960419599993951 | E32: =IF(VLOOKUP(RC[-3],Sheet1!R3C2:R803C11,10,FALSE)=0,"",VLOOKUP(Sheet2!RC[-3],Sheet1!R[1]C[-3]:R[801]C[6],10,FALSE)) ->  | F32: =Sheet1!R71C10 -> 123.43233621398711 | G32: =IF(RC[-3]<0,0,IF(AND(RC[-3]<RC[-1],RC[-3]<2),100,IF(AND(RC[-3]<RC[-1],RC[-3]>=2,RC[-3]<3),95,IF(AND(RC[-3]<RC[-1],RC[-3]>=3,RC[-3]<4),90,IF(AND(RC[-3]<RC[-1],RC[-3]>=4,RC[-3]<5),85,IF(AND(RC[-3]<RC[-1],RC[-3]>=5,RC[-3]<6),80,IF(AND(RC[-3]<RC[-1],RC[-3]>=6,RC[-3]<7),75,IF(AND(RC[-3]<RC[-1],RC[-3]>=7,RC[-3]<8),70,IF(AND(RC[-3]<RC[-1],RC[-3]>=8,RC[-3]<9),65,IF(AND(RC[-3]<RC[-1],RC[-3]>=9,RC[-3]<10),60,IF(AND(RC[-3]<RC[-1],RC[-3]>=10,RC[-3]<11),55,IF(AND(RC[-3]<RC[-1],RC[-3]>=11,RC[-3]<12),50,IF(AND(RC[-3]<RC[-1],RC[-3]>=12,RC[-3]<13),45,IF(AND(RC[-3]<RC[-1],RC[-3]>=13,RC[-3]<14),40,IF(AND(RC[-3]<RC[-1],RC[-3]>=14,RC[-3]<15),35,IF(AND(RC[-3]<RC[-1],RC[-3]>=15,RC[-3]<16),30,IF(AND(RC[-3]<RC[-1],RC[-3]>=16,RC[-3]<17),25,IF(AND(RC[-3]<RC[-1],RC[-3]>=17,RC[-3]<18),20,IF(AND(RC[-3]<RC[-1],RC[-3]>=18,RC[-3]<19),15,IF(AND(RC[-3]<RC[-1],RC[-3]>=19,RC[-3]<20),10,IF(AND(RC[-3]<RC[-1],RC[-3]>=20,RC[-3]<21),5,IF(AND(RC[-3]<RC[-1],RC[-3]>=21),0,IF(AND(RC[-3]>RC[-1],RC[-3]>=2,RC[-3]<3),90,IF(AND(RC[-3]>RC[-1],RC[-3]>=3,RC[-3]<4),90,IF(AND(RC[-3]>RC[-1],RC[-3]>=4,RC[-3]<5),80,IF(AND(RC[-3]>RC[-1],RC[-3]>=5,RC[-3]<6),70,IF(AND(RC[-3]>RC[-1],RC[-3]>=6,RC[-3]<7),60,IF(AND(RC[-3]>RC[-1],RC[-3]>=7,RC[-3]<8),50,IF(AND(RC[-3]>RC[-1],RC[-3]>=8,RC[-3]<9),40,IF(AND(RC[-3]>RC[-1],RC[-3]>=9,RC[-3]<10),30,IF(AND(RC[-3]>RC[-1],RC[-3]>=10,RC[-3]<11),20,IF(AND(RC[-3]>RC[-1],RC[-3]>=11,RC[-3]<12),10,IF(AND(RC[-3]>RC[-1],RC[-3]>=12),0))))))))))))))))))))))))))))))))) -> 50 | H32: =IF(RC[-3]="","",IF(RC[-3]<0.3,100,IF(AND(RC[-3]>=0.3,RC[-3]>0.4),95,IF(AND(RC[-3]>=0.4,RC[-3]<0.5),90,IF(AND(RC[-3]>=0.5,RC[-3]<0.6),85,IF(AND(RC[-3]>=0.6,RC[-3]<0.7),80,IF(AND(RC[-3]>=0.6,RC[-3]<1),80,IF(AND(RC[-3]>1,RC[-3]<2),50,IF(RC[-3]>2,0))))))))) ->  | I32: =IF(RC[-1]="",RC[-2],0.7*RC[-1]+0.3*RC[-2]) -> 50
A33: توسعه و عمران امید | B33: ثامید | C33: =VLOOKUP(RC[-1],Sheet1!R3C2:R802C3,2,FALSE) -> انبوه سازی املاک و مستغلات | D33: =VLOOKUP(RC[-2],Sheet1!R3C2:R802C9,8,FALSE) -> 4.2280080002806164 | E33: =IF(VLOOKUP(RC[-3],Sheet1!R3C2:R803C11,10,FALSE)=0,"",VLOOKUP(Sheet2!RC[-3],Sheet1!R[1]C[-3]:R[801]C[6],10,FALSE)) ->  | F33: =Sheet1!R71C10 -> 123.43233621398711 | G33: =IF(RC[-3]<0,0,IF(AND(RC[-3]<RC[-1],RC[-3]<2),100,IF(AND(RC[-3]<RC[-1],RC[-3]>=2,RC[-3]<3),95,IF(AND(RC[-3]<RC[-1],RC[-3]>=3,RC[-3]<4),90,IF(AND(RC[-3]<RC[-1],RC[-3]>=4,RC[-3]<5),85,IF(AND(RC[-3]<RC[-1],RC[-3]>=5,RC[-3]<6),80,IF(AND(RC[-3]<RC[-1],RC[-3]>=6,RC[-3]<7),75,IF(AND(RC[-3]<RC[-1],RC[-3]>=7,RC[-3]<8),70,IF(AND(RC[-3]<RC[-1],RC[-3]>=8,RC[-3]<9),65,IF(AND(RC[-3]<RC[-1],RC[-3]>=9,RC[-3]<10),60,IF(AND(RC[-3]<RC[-1],RC[-3]>=10,RC[-3]<11),55,IF(AND(RC[-3]<RC[-1],RC[-3]>=11,RC[-3]<12),50,IF(AND(RC[-3]<RC[-1],RC[-3]>=12,RC[-3]<13),45,IF(AND(RC[-3]<RC[-1],RC[-3]>=13,RC[-3]<14),40,IF(AND(RC[-3]<RC[-1],RC[-3]>=14,RC[-3]<15),35,IF(AND(RC[-3]<RC[-1],RC[-3]>=15,RC[-3]<16),30,IF(AND(RC[-3]<RC[-1],RC[-3]>=16,RC[-3]<17),25,IF(AND(RC[-3]<RC[-1],RC[-3]>=17,RC[-3]<18),20,IF(AND(RC[-3]<RC[-1],RC[-3]>=18,RC[-3]<19),15,IF(AND(RC[-3]<RC[-1],RC[-3]>=19,RC[-3]<20),10,IF(AND(RC[-3]<RC[-1],RC[-3]>=20,RC[-3]<21),5,IF(AND(RC[-3]<RC[-1],RC[-3]>=21),0,IF(AND(RC[-3]>RC[-1],RC[-3]>=2,RC[-3]<3),90,IF(AND(RC[-3]>RC[-1],RC[-3]>=3,RC[-3]<4),90,IF(AND(RC[-3]>RC[-1],RC[-3]>=4,RC[-3]<5),80,IF(AND(RC[-3]>RC[-1],RC[-3]>=5,RC[-3]<6),70,IF(AND(RC[-3]>RC[-1],RC[-3]>=6,RC[-3]<7),60,IF(AND(RC[-3]>RC[-1],RC[-3]>=7,RC[-3]<8),50,IF(AND(RC[-3]>RC[-1],RC[-3]>=8,RC[-3]<9),40,IF(AND(RC[-3]>RC[-1],RC[-3]>=9,RC[-3]<10),30,IF(AND(RC[-3]>RC[-1],RC[-3]>=10,RC[-3]<11),20,IF(AND(RC[-3]>RC[-1],RC[-3]>=11,RC[-3]<12),10,IF(AND(RC[-3]>RC[-1],RC[-3]>=12),0))))))))))))))))))))))))))))))))) -> 85 | H33: =IF(RC[-3]="","",IF(RC[-3]<0.3,100,IF(AND(RC[-3]>=0.3,RC[-3]>0.4),95,IF(AND(RC[-3]>=0.4,RC[-3]<0.5),90,IF(AND(RC[-3]>=0.5,RC[-3]<0.6),85,IF(AND(RC[-3]>=0.6,RC[-3]<0.7),80,IF(AND(RC[-3]>=0.6,RC[-3]<1),80,IF(AND(RC[-3]>1,RC[-3]<2),50,IF(RC[-3]>2,0))))))))) ->  | I33: =IF(RC[-1]="",RC[-2],0.7*RC[-1]+0.3*RC[-2]) -> 85
A34: ساختمان اصفهان | B34: ثاصفا | C34: =VLOOKUP(RC[-1],Sheet1!R3C2:R802C3,2,FALSE) -> انبوه سازی املاک و مستغلات | D34: =VLOOKUP(RC[-2],Sheet1!R3C2:R802C9,8,FALSE) -> -469.47727272727275 | E34: =IF(VLOOKUP(RC[-3],Sheet1!R3C2:R803C11,10,FALSE)=0,"",VLOOKUP(Sheet2!RC[-3],Sheet1!R[1]C[-3]:R[801]C[6],10,FALSE)) ->  | F34: =Sheet1!R71C10 -> 123.43233621398711 | G34: =IF(RC[-3]<0,0,IF(AND(RC[-3]<RC[-1],RC[-3]<2),100,IF(AND(RC[-3]<RC[-1],RC[-3]>=2,RC[-3]<3),95,IF(AND(RC[-3]<RC[-1],RC[-3]>=3,RC[-3]<4),90,IF(AND(RC[-3]<RC[-1],RC[-3]>=4,RC[-3]<5),85,IF(AND(RC[-3]<RC[-1],RC[-3]>=5,RC[-3]<6),80,IF(AND(RC[-3]<RC[-1],RC[-3]>=6,RC[-3]<7),75,IF(AND(RC[-3]<RC[-1],RC[-3]>=7,RC[-3]<8),70,IF(AND(RC[-3]<RC[-1],RC[-3]>=8,RC[-3]<9),65,IF(AND(RC[-3]<RC[-1],RC[-3]>=9,RC[-3]<10),60,IF(AND(RC[-3]<RC[-1],RC[-3]>=10,RC[-3]<11),55,IF(AND(RC[-3]<RC[-1],RC[-3]>=11,RC[-3]<12),50,IF(AND(RC[-3]<RC[-1],RC[-3]>=12,RC[-3]<13),45,IF(AND(RC[-3]<RC[-1],RC[-3]>=13,RC[-3]<14),40,IF(AND(RC[-3]<RC[-1],RC[-3]>=14,RC[-3]<15),35,IF(AND(RC[-3]<RC[-1],RC[-3]>=15,RC[-3]<16),30,IF(AND(RC[-3]<RC[-1],RC[-3]>=16,RC[-3]<17),25,IF(AND(RC[-3]<RC[-1],RC[-3]>=17,RC[-3]<18),20,IF(AND(RC[-3]<RC[-1],RC[-3]>=18,RC[-3]<19),15,IF(AND(RC[-3]<RC[-1],RC[-3]>=19,RC[-3]<20),10,IF(AND(RC[-3]<RC[-1],RC[-3]>=20,RC[-3]<21),5,IF(AND(RC[-3]<RC[-1],RC[-3]>=21),0,IF(AND(RC[-3]>RC[-1],RC[-3]>=2,RC[-3]<3),90,IF(AND(RC[-3]>RC[-1],RC[-3]>=3,RC[-3]<4),90,IF(AND(RC[-3]>RC[-1],RC[-3]>=4,RC[-3]<5),80,IF(AND(RC[-3]>RC[-1],RC[-3]>=5,RC[-3]<6),70,IF(AND(RC[-3]>RC[-1],RC[-3]>=6,RC[-3]<7),60,IF(AND(RC[-3]>RC[-1],RC[-3]>=7,RC[-3]<8),50,IF(AND(RC[-3]>RC[-1],RC[-3]>=8,RC[-3]<9),40,IF(AND(RC[-3]>RC[-1],RC[-3]>=9,RC[-3]<10),30,IF(AND(RC[-3]>RC[-1],RC[-3]>=10,RC[-3]<11),20,IF(AND(RC[-3]>RC[-1],RC[-3]>=11,RC[-3]<12),10,IF(AND(RC[-3]>RC[-1],RC[-3]>=12),0))))))))))))))))))))))))))))))))) -> 0 | H34: =IF(RC[-3]="","",IF(RC[-3]<0.3,100,IF(AND(RC[-3]>=0.3,RC[-3]>0.4),95,IF(AND(RC[-3]>=0.4,RC[-3]<0.5),90,IF(AND(RC[-3]>=0.5,RC[-3]<0.6),85,IF(AND(RC[-3]>=0.6,RC[-3]<0.7),80,IF(AND(RC[-3]>=0.6,RC[-3]<1),80,IF(AND(RC[-3]>1,RC[-3]<2),50,IF(RC[-3]>2,0))))))))) ->  | I34: =IF(RC[-1]="",RC[-2],0.7*RC[-1]+0.3*RC[-2]) -> 0
A35: سخت آژند | B35: ثاژن | C35: =VLOOKUP(RC[-1],Sheet1!R3C2:R802C3,2,FALSE) -> انبوه سازی املاک و مستغلات | D35: =VLOOKUP(RC[-2],Sheet1!R3C2:R802C9,8,FALSE) -> 148.19125093214001 | E35: =IF(VLOOKUP(RC[-3],Sheet1!R3C2:R803C11,10,FALSE)=0,"",VLOOKUP(Sheet2!RC[-3],Sheet1!R[1]C[-3]:R[801]C[6],10,FALSE)) ->  | F35: =Sheet1!R71C10 -> 123.43233621398711 | G35: =IF(RC[-3]<0,0,IF(AND(RC[-3]<RC[-1],RC[-3]<2),100,IF(AND(RC[-3]<RC[-1],RC[-3]>=2,RC[-3]<3),95,IF(AND(RC[-3]<RC[-1],RC[-3]>=3,RC[-3]<4),90,IF(AND(RC[-3]<RC[-1],RC[-3]>=4,RC[-3]<5),85,IF(AND(RC[-3]<RC[-1],RC[-3]>=5,RC[-3]<6),80,IF(AND(RC[-3]<RC[-1],RC[-3]>=6,RC[-3]<7),75,IF(AND(RC[-3]<RC[-1],RC[-3]>=7,RC[-3]<8),70,IF(AND(RC[-3]<RC[-1],RC[-3]>=8,RC[-3]<9),65,IF(AND(RC[-3]<RC[-1],RC[-3]>=9,RC[-3]<10),60,IF(AND(RC[-3]<RC[-1],RC[-3]>=10,RC[-3]<11),55,IF(AND(RC[-3]<RC[-1],RC[-3]>=11,RC[-3]<12),50,IF(AND(RC[-3]<RC[-1],RC[-3]>=12,RC[-3]<13),45,IF(AND(RC[-3]<RC[-1],RC[-3]>=13,RC[-3]<14),40,IF(AND(RC[-3]<RC[-1],RC[-3]>=14,RC[-3]<15),35,IF(AND(RC[-3]<RC[-1],RC[-3]>=15,RC[-3]<16),30,IF(AND(RC[-3]<RC[-1],RC[-3]>=16,RC[-3]<17),25,IF(AND(RC[-3]<RC[-1],RC[-3]>=17,RC[-3]<18),20,IF(AND(RC[-3]<RC[-1],RC[-3]>=18,RC[-3]<19),15,IF(AND(RC[-3]<RC[-1],RC[-3]>=19,RC[-3]<20),10,IF(AND(RC[-3]<RC[-1],RC[-3]>=20,RC[-3]<21),5,IF(AND(RC[-3]<RC[-1],RC[-3]>=21),0,IF(AND(RC[-3]>RC[-1],RC[-3]>=2,RC[-3]<3),90,IF(AND(RC[-3]>RC[-1],RC[-3]>=3,RC[-3]<4),90,IF(AND(RC[-3]>RC[-1],RC[-3]>=4,RC[-3]<5),80,IF(AND(RC[-3]>RC[-1],RC[-3]>=5,RC[-3]<6),70,IF(AND(RC[-3]>RC[-1],RC[-3]>=6,RC[-3]<7),60,IF(AND(RC[-3]>RC[-1],RC[-3]>=7,RC[-3]<8),50,IF(AND(RC[-3]>RC[-1],RC[-3]>=8,RC[-3]<9),40,IF(AND(RC[-3]>RC[-1],RC[-3]>=9,RC[-3]<10),30,IF(AND(RC[-3]>RC[-1],RC[-3]>=10,RC[-3]<11),20,IF(AND(RC[-3]>RC[-1],RC[-3]>=11,RC[-3]<12),10,IF(AND(RC[-3]>RC[-1],RC[-3]>=12),0))))))))))))))))))))))))))))))))) -> 0 | H35: =IF(RC[-3]="","",IF(RC[-3]<0.3,100,IF(AND(RC[-3]>=0.3,RC[-3]>0.4),95,IF(AND(RC[-3]>=0.4,RC[-3]<0.5),90,IF(AND(RC[-3]>=0.5,RC[-3]<0.6),85,IF(AND(RC[-3]>=0.6,RC[-3]<0.7),80,IF(AND(RC[-3]>=0.6,RC[-3]<1),80,IF(AND(RC[-3]>1,RC[-3]<2),50,IF(RC[-3]>2,0))))))))) ->  | I35: =IF(RC[-1]="",RC[-2],0.7*RC[-1]+0.3*RC[-2]) -> 0
A36: سر. توس گستر | B36: وتوس | C36: =VLOOKUP(RC[-1],Sheet1!R3C2:R802C3,2,FALSE) -> انبوه سازی املاک و مستغلات | D36: =VLOOKUP(RC[-2],Sheet1!R3C2:R802C9,8,FALSE) -> 14.005607373219609 | E36: =IF(VLOOKUP(RC[-3],Sheet1!R3C2:R803C11,10,FALSE)=0,"",VLOOKUP(Sheet2!RC[-3],Sheet1!R[1]C[-3]:R[801]C[6],10,FALSE)) ->  | F36: =Sheet1!R71C10 -> 123.43233621398711 | G36: =IF(RC[-3]<0,0,IF(AND(RC[-3]<RC[-1],RC[-3]<2),100,IF(AND(RC[-3]<RC[-1],RC[-3]>=2,RC[-3]<3),95,IF(AND(RC[-3]<RC[-1],RC[-3]>=3,RC[-3]<4),90,IF(AND(RC[-3]<RC[-1],RC[-3]>=4,RC[-3]<5),85,IF(AND(RC[-3]<RC[-1],RC[-3]>=5,RC[-3]<6),80,IF(AND(RC[-3]<RC[-1],RC[-3]>=6,RC[-3]<7),75,IF(AND(RC[-3]<RC[-1],RC[-3]>=7,RC[-3]<8),70,IF(AND(RC[-3]<RC[-1],RC[-3]>=8,RC[-3]<9),65,IF(AND(RC[-3]<RC[-1],RC[-3]>=9,RC[-3]<10),60,IF(AND(RC[-3]<RC[-1],RC[-3]>=10,RC[-3]<11),55,IF(AND(RC[-3]<RC[-1],RC[-3]>=11,RC[-3]<12),50,IF(AND(RC[-3]<RC[-1],RC[-3]>=12,RC[-3]<13),45,IF(AND(RC[-3]<RC[-1],RC[-3]>=13,RC[-3]<14),40,IF(AND(RC[-3]<RC[-1],RC[-3]>=14,RC[-3]<15),35,IF(AND(RC[-3]<RC[-1],RC[-3]>=15,RC[-3]<16),30,IF(AND(RC[-3]<RC[-1],RC[-3]>=16,RC[-3]<17),25,IF(AND(RC[-3]<RC[-1],RC[-3]>=17,RC[-3]<18),20,IF(AND(RC[-3]<RC[-1],RC[-3]>=18,RC[-3]<19),15,IF(AND(RC[-3]<RC[-1],RC[-3]>=19,RC[-3]<20),10,IF(AND(RC[-3]<RC[-1],RC[-3]>=20,RC[-3]<21),5,IF(AND(RC[-3]<RC[-1],RC[-3]>=21),0,IF(AND(RC[-3]>RC[-1],RC[-3]>=2,RC[-3]<3),90,IF(AND(RC[-3]>RC[-1],RC[-3]>=3,RC[-3]<4),90,IF(AND(RC[-3]>RC[-1],RC[-3]>=4,RC[-3]<5),80,IF(AND(RC[-3]>RC[-1],RC[-3]>=5,RC[-3]<6),70,IF(AND(RC[-3]>RC[-1],RC[-3]>=6,RC[-3]<7),60,IF(AND(RC[-3]>RC[-1],RC[-3]>=7,RC[-3]<8),50,IF(AND(RC[-3]>RC[-1],RC[-3]>=8,RC[-3]<9),40,IF(AND(RC[-3]>RC[-1],RC[-3]>=9,RC[-3]<10),30,IF(AND(RC[-3]>RC[-1],RC[-3]>=10,RC[-3]<11),20,IF(AND(RC[-3]>RC[-1],RC[-3]>=11,RC[-3]<12),10,IF(AND(RC[-3]>RC[-1],RC[-3]>=12),0))))))))))))))))))))))))))))))))) -> 35 | H36: =IF(RC[-3]="","",IF(RC[-3]<0.3,100,IF(AND(RC[-3]>=0.3,RC[-3]>0.4),95,IF(AND(RC[-3]>=0.4,RC[-3]<0.5),90,IF(AND(RC[-3]>=0.5,RC[-3]<0.6),85,IF(AND(RC[-3]>=0.6,RC[-3]<0.7),80,IF(AND(RC[-3]>=0.6,RC[-3]<1),80,IF(AND(RC[-3]>1,RC[-3]<2),50,IF(RC[-3]>2,0))))))))) ->  | I36: =IF(RC[-1]="",RC[-2],0.7*RC[-1]+0.3*RC[-2]) -> 35
A37: سر. توسعه آذربایجان | B37: وآذر | C37: =VLOOKUP(RC[-1],Sheet1!R3C2:R802C3,2,FALSE) -> انبوه سازی املاک و مستغلات | D37: =VLOOKUP(RC[-2],Sheet1!R3C2:R802C9,8,FALSE) -> -77.671398112901528 | E37: =IF(VLOOKUP(RC[-3],Sheet1!R3C2:R803C11,10,FALSE)=0,"",VLOOKUP(Sheet2!RC[-3],Sheet1!R[1]C[-3]:R[801]C[6],10,FALSE)) -> 4 | F37: =Sheet1!R71C10 -> 123.43233621398711 | G37: =IF(RC[-3]<0,0,IF(AND(RC[-3]<RC[-1],RC[-3]<2),100,IF(AND(RC[-3]<RC[-1],RC[-3]>=2,RC[-3]<3),95,IF(AND(RC[-3]<RC[-1],RC[-3]>=3,RC[-3]<4),90,IF(AND(RC[-3]<RC[-1],RC[-3]>=4,RC[-3]<5),85,IF(AND(RC[-3]<RC[-1],RC[-3]>=5,RC[-3]<6),80,IF(AND(RC[-3]<RC[-1],RC[-3]>=6,RC[-3]<7),75,IF(AND(RC[-3]<RC[-1],RC[-3]>=7,RC[-3]<8),70,IF(AND(RC[-3]<RC[-1],RC[-3]>=8,RC[-3]<9),65,IF(AND(RC[-3]<RC[-1],RC[-3]>=9,RC[-3]<10),60,IF(AND(RC[-3]<RC[-1],RC[-3]>=10,RC[-3]<11),55,IF(AND(RC[-3]<RC[-1],RC[-3]>=11,RC[-3]<12),50,IF(AND(RC[-3]<RC[-1],RC[-3]>=12,RC[-3]<13),45,IF(AND(RC[-3]<RC[-1],RC[-3]>=13,RC[-3]<14),40,IF(AND(RC[-3]<RC[-1],RC[-3]>=14,RC[-3]<15),35,IF(AND(RC[-3]<RC[-1],RC[-3]>=15,RC[-3]<16),30,IF(AND(RC[-3]<RC[-1],RC[-3]>=16,RC[-3]<17),25,IF(AND(RC[-3]<RC[-1],RC[-3]>=17,RC[-3]<18),20,IF(AND(RC[-3]<RC[-1],RC[-3]>=18,RC[-3]<19),15,IF(AND(RC[-3]<RC[-1],RC[-3]>=19,RC[-3]<20),10,IF(AND(RC[-3]<RC[-1],RC[-3]>=20,RC[-3]<21),5,IF(AND(RC[-3]<RC[-1],RC[-3]>=21),0,IF(AND(RC[-3]>RC[-1],RC[-3]>=2,RC[-3]<3),90,IF(AND(RC[-3]>RC[-1],RC[-3]>=3,RC[-3]<4),90,IF(AND(RC[-3]>RC[-1],RC[-3]>=4,RC[-3]<5),80,IF(AND(RC[-3]>RC[-1],RC[-3]>=5,RC[-3]<6),70,IF(AND(RC[-3]>RC[-1],RC[-3]>=6,RC[-3]<7),60,IF(AND(RC[-3]>RC[-1],RC[-3]>=7,RC[-3]<8),50,IF(AND(RC[-3]>RC[-1],RC[-3]>=8,RC[-3]<9),40,IF(AND(RC[-3]>RC[-1],RC[-3]>=9,RC[-3]<10),30,IF(AND(RC[-3]>RC[-1],RC[-3]>=10,RC[-3]<11),20,IF(AND(RC[-3]>RC[-1],RC[-3]>=11,RC[-3]<12),10,IF(AND(RC[-3]>RC[-1],RC[-3]>=12),0))))))))))))))))))))))))))))))))) -> 0 | H37: =IF(RC[-3]="","",IF(RC[-3]<0.3,100,IF(AND(RC[-3]>=0.3,RC[-3]>0.4),95,IF(AND(RC[-3]>=0.4,RC[-3]<0.5),90,IF(AND(RC[-3]>=0.5,RC[-3]<0.6),85,IF(AND(RC[-3]>=0.6,RC[-3]<0.7),80,IF(AND(RC[-3]>=0.6,RC[-3]<1),80,IF(AND(RC[-3]>1,RC[-3]<2),50,IF(RC[-3]>2,0))))))))) -> 95 | I37: =IF(RC[-1]="",RC[-2],0.7*RC[-1]+0.3*RC[-2]) -> 66.5
A38: سر. توسعه خوزستان | B38: وثخوز | C38: =VLOOKUP(RC[-1],Sheet1!R3C2:R802C3,2,FALSE) -> انبوه سازی املاک و مستغلات | D38: =VLOOKUP(RC[-2],Sheet1!R3C2:R802C9,8,FALSE) -> 28.274057222534111 | E38: =IF(VLOOKUP(RC[-3],Sheet1!R3C2:R803C11,10,FALSE)=0,"",VLOOKUP(Sheet2!RC[-3],Sheet1!R[1]C[-3]:R[801]C[6],10,FALSE)) -> 3 | F38: =Sheet1!R71C10 -> 123.43233621398711 | G38: =IF(RC[-3]<0,0,IF(AND(RC[-3]<RC[-1],RC[-3]<2),100,IF(AND(RC[-3]<RC[-1],RC[-3]>=2,RC[-3]<3),95,IF(AND(RC[-3]<RC[-1],RC[-3]>=3,RC[-3]<4),90,IF(AND(RC[-3]<RC[-1],RC[-3]>=4,RC[-3]<5),85,IF(AND(RC[-3]<RC[-1],RC[-3]>=5,RC[-3]<6),80,IF(AND(RC[-3]<RC[-1],RC[-3]>=6,RC[-3]<7),75,IF(AND(RC[-3]<RC[-1],RC[-3]>=7,RC[-3]<8),70,IF(AND(RC[-3]<RC[-1],RC[-3]>=8,RC[-3]<9),65,IF(AND(RC[-3]<RC[-1],RC[-3]>=9,RC[-3]<10),60,IF(AND(RC[-3]<RC[-1],RC[-3]>=10,RC[-3]<11),55,IF(AND(RC[-3]<RC[-1],RC[-3]>=11,RC[-3]<12),50,IF(AND(RC[-3]<RC[-1],RC[-3]>=12,RC[-3]<13),45,IF(AND(RC[-3]<RC[-1],RC[-3]>=13,RC[-3]<14),40,IF(AND(RC[-3]<RC[-1],RC[-3]>=14,RC[-3]<15),35,IF(AND(RC[-3]<RC[-1],RC[-3]>=15,RC[-3]<16),30,IF(AND(RC[-3]<RC[-1],RC[-3]>=16,RC[-3]<17),25,IF(AND(RC[-3]<RC[-1],RC[-3]>=17,RC[-3]<18),20,IF(AND(RC[-3]<RC[-1],RC[-3]>=18,RC[-3]<19),15,IF(AND(RC[-3]<RC[-1],RC[-3]>=19,RC[-3]<20),10,IF(AND(RC[-3]<RC[-1],RC[-3]>=20,RC[-3]<21),5,IF(AND(RC[-3]<RC[-1],RC[-3]>=21),0,IF(AND(RC[-3]>RC[-1],RC[-3]>=2,RC[-3]<3),90,IF(AND(RC[-3]>RC[-1],RC[-3]>=3,RC[-3]<4),90,IF(AND(RC[-3]>RC[-1],RC[-3]>=4,RC[-3]<5),80,IF(AND(RC[-3]>RC[-1],RC[-3]>=5,RC[-3]<6),70,IF(AND(RC[-3]>RC[-1],RC[-3]>=6,RC[-3]<7),60,IF(AND(RC[-3]>RC[-1],RC[-3]>=7,RC[-3]<8),50,IF(AND(RC[-3]>RC[-1],RC[-3]>=8,RC[-3]<9),40,IF(AND(RC[-3]>RC[-1],RC[-3]>=9,RC[-3]<10),30,IF(AND(RC[-3]>RC[-1],RC[-3]>=10,RC[-3]<11),20,IF(AND(RC[-3]>RC[-1],RC[-3]>=11,RC[-3]<12),10,IF(AND(RC[-3]>RC[-1],RC[-3]>=12),0))))))))))))))))))))))))))))))))) -> 0 | H38: =IF(RC[-3]="","",IF(RC[-3]<0.3,100,IF(AND(RC[-3]>=0.3,RC[-3]>0.4),95,IF(AND(RC[-3]>=0.4,RC[-3]<0.5),90,IF(AND(RC[-3]>=0.5,RC[-3]<0.6),85,IF(AND(RC[-3]>=0.6,RC[-3]<0.7),80,IF(AND(RC[-3]>=0.6,RC[-3]<1),80,IF(AND(RC[-3]>1,RC[-3]<2),50,IF(RC[-3]>2,0))))))))) -> 95 | I38: =IF(RC[-1]="",RC[-2],0.7*RC[-1]+0.3*RC[-2]) -> 66.5
A39: سر. توسعه و عمران استان اردبیل | B39: ثتوسا | C39: =VLOOKUP(RC[-1],Sheet1!R3C2:R802C3,2,FALSE) -> انبوه سازی املاک و مستغلات | D39: =VLOOKUP(RC[-2],Sheet1!R3C2:R802C9,8,FALSE) -> -15.531976744186046 | E39: =IF(VLOOKUP(RC[-3],Sheet1!R3C2:R803C11,10,FALSE)=0,"",VLOOKUP(Sheet2!RC[-3],Sheet1!R[1]C[-3]:R[801]C[6],10,FALSE)) ->  | F39: =Sheet1!R71C10 -> 123.43233621398711 | G39: =IF(RC[-3]<0,0,IF(AND(RC[-3]<RC[-1],RC[-3]<2),100,IF(AND(RC[-3]<RC[-1],RC[-3]>=2,RC[-3]<3),95,IF(AND(RC[-3]<RC[-1],RC[-3]>=3,RC[-3]<4),90,IF(AND(RC[-3]<RC[-1],RC[-3]>=4,RC[-3]<5),85,IF(AND(RC[-3]<RC[-1],RC[-3]>=5,RC[-3]<6),80,IF(AND(RC[-3]<RC[-1],RC[-3]>=6,RC[-3]<7),75,IF(AND(RC[-3]<RC[-1],RC[-3]>=7,RC[-3]<8),70,IF(AND(RC[-3]<RC[-1],RC[-3]>=8,RC[-3]<9),65,IF(AND(RC[-3]<RC[-1],RC[-3]>=9,RC[-3]<10),60,IF(AND(RC[-3]<RC[-1],RC[-3]>=10,RC[-3]<11),55,IF(AND(RC[-3]<RC[-1],RC[-3]>=11,RC[-3]<12),50,IF(AND(RC[-3]<RC[-1],RC[-3]>=12,RC[-3]<13),45,IF(AND(RC[-3]<RC[-1],RC[-3]>=13,RC[-3]<14),40,IF(AND(RC[-3]<RC[-1],RC[-3]>=14,RC[-3]<15),35,IF(AND(RC[-3]<RC[-1],RC[-3]>=15,RC[-3]<16),30,IF(AND(RC[-3]<RC[-1],RC[-3]>=16,RC[-3]<17),25,IF(AND(RC[-3]<RC[-1],RC[-3]>=17,RC[-3]<18),20,IF(AND(RC[-3]<RC[-1],RC[-3]>=18,RC[-3]<19),15,IF(AND(RC[-3]<RC[-1],RC[-3]>=19,RC[-3]<20),10,IF(AND(RC[-3]<RC[-1],RC[-3]>=20,RC[-3]<21),5,IF(AND(RC[-3]<RC[-1],RC[-3]>=21),0,IF(AND(RC[-3]>RC[-1],RC[-3]>=2,RC[-3]<3),90,IF(AND(RC[-3]>RC[-1],RC[-3]>=3,RC[-3]<4),90,IF(AND(RC[-3]>RC[-1],RC[-3]>=4,RC[-3]<5),80,IF(AND(RC[-3]>RC[-1],RC[-3]>=5,RC[-3]<6),70,IF(AND(RC[-3]>RC[-1],RC[-3]>=6,RC[-3]<7),60,IF(AND(RC[-3]>RC[-1],RC[-3]>=7,RC[-3]<8),50,IF(AND(RC[-3]>RC[-1],RC[-3]>=8,RC[-3]<9),40,IF(AND(RC[-3]>RC[-1],RC[-3]>=9,RC[-3]<10),30,IF(AND(RC[-3]>RC[-1],RC[-3]>=10,RC[-3]<11),20,IF(AND(RC[-3]>RC[-1],RC[-3]>=11,RC[-3]<12),10,IF(AND(RC[-3]>RC[-1],RC[-3]>=12),0))))))))))))))))))))))))))))))))) -> 0 | H39: =IF(RC[-3]="","",IF(RC[-3]<0.3,100,IF(AND(RC[-3]>=0.3,RC[-3]>0.4),95,IF(AND(RC[-3]>=0.4,RC[-3]<0.5),90,IF(AND(RC[-3]>=0.5,RC[-3]<0.6),85,IF(AND(RC[-3]>=0.6,RC[-3]<0.7),80,IF(AND(RC[-3]>=0.6,RC[-3]<1),80,IF(AND(RC[-3]>1,RC[-3]<2),50,IF(RC[-3]>2,0))))))))) ->  | I39: =IF(RC[-1]="",RC[-2],0.7*RC[-1]+0.3*RC[-2]) -> 0
A40: سر. توسعه و عمران استان کرمان | B40: کرمان | C40: =VLOOKUP(RC[-1],Sheet1!R3C2:R802C3,2,FALSE) -> انبوه سازی املاک و مستغلات | D40: =VLOOKUP(RC[-2],Sheet1!R3C2:R802C9,8,FALSE) -> 163.8095339175425 | E40: =IF(VLOOKUP(RC[-3],Sheet1!R3C2:R803C11,10,FALSE)=0,"",VLOOKUP(Sheet2!RC[-3],Sheet1!R[1]C[-3]:R[801]C[6],10,FALSE)) -> 1 | F40: =Sheet1!R71C10 -> 123.43233621398711 | G40: =IF(RC[-3]<0,0,IF(AND(RC[-3]<RC[-1],RC[-3]<2),100,IF(AND(RC[-3]<RC[-1],RC[-3]>=2,RC[-3]<3),95,IF(AND(RC[-3]<RC[-1],RC[-3]>=3,RC[-3]<4),90,IF(AND(RC[-3]<RC[-1],RC[-3]>=4,RC[-3]<5),85,IF(AND(RC[-3]<RC[-1],RC[-3]>=5,RC[-3]<6),80,IF(AND(RC[-3]<RC[-1],RC[-3]>=6,RC[-3]<7),75,IF(AND(RC[-3]<RC[-1],RC[-3]>=7,RC[-3]<8),70,IF(AND(RC[-3]<RC[-1],RC[-3]>=8,RC[-3]<9),65,IF(AND(RC[-3]<RC[-1],RC[-3]>=9,RC[-3]<10),60,IF(AND(RC[-3]<RC[-1],RC[-3]>=10,RC[-3]<11),55,IF(AND(RC[-3]<RC[-1],RC[-3]>=11,RC[-3]<12),50,IF(AND(RC[-3]<RC[-1],RC[-3]>=12,RC[-3]<13),45,IF(AND(RC[-3]<RC[-1],RC[-3]>=13,RC[-3]<14),40,IF(AND(RC[-3]<RC[-1],RC[-3]>=14,RC[-3]<15),35,IF(AND(RC[-3]<RC[-1],RC[-3]>=15,RC[-3]<16),30,IF(AND(RC[-3]<RC[-1],RC[-3]>=16,RC[-3]<17),25,IF(AND(RC[-3]<RC[-1],RC[-3]>=17,RC[-3]<18),20,IF(AND(RC[-3]<RC[-1],RC[-3]>=18,RC[-3]<19),15,IF(AND(RC[-3]<RC[-1],RC[-3]>=19,RC[-3]<20),10,IF(AND(RC[-3]<RC[-1],RC[-3]>=20,RC[-3]<21),5,IF(AND(RC[-3]<RC[-1],RC[-3]>=21),0,IF(AND(RC[-3]>RC[-1],RC[-3]>=2,RC[-3]<3),90,IF(AND(RC[-3]>RC[-1],RC[-3]>=3,RC[-3]<4),90,IF(AND(RC[-3]>RC[-1],RC[-3]>=4,RC[-3]<5),80,IF(AND(RC[-3]>RC[-1],RC[-3]>=5,RC[-3]<6),70,IF(AND(RC[-3]>RC[-1],RC[-3]>=6,RC[-3]<7),60,IF(AND(RC[-3]>RC[-1],RC[-3]>=7,RC[-3]<8),50,IF(AND(RC[-3]>RC[-1],RC[-3]>=8,RC[-3]<9),40,IF(AND(RC[-3]>RC[-1],RC[-3]>=9,RC[-3]<10),30,IF(AND(RC[-3]>RC[-1],RC[-3]>=10,RC[-3]<11),20,IF(AND(RC[-3]>RC[-1],RC[-3]>=11,RC[-3]<12),10,IF(AND(RC[-3]>RC[-1],RC[-3]>=12),0))))))))))))))))))))))))))))))))) -> 0 | H40: =IF(RC[-3]="","",IF(RC[-3]<0.3,100,IF(AND(RC[-3]>=0.3,RC[-3]>0.4),95,IF(AND(RC[-3]>=0.4,RC[-3]<0.5),90,IF(AND(RC[-3]>=0.5,RC[-3]<0.6),85,IF(AND(RC[-3]>=0.6,RC[-3]<0.7),80,IF(AND(RC[-3]>=0.6,RC[-3]<1),80,IF(AND(RC[-3]>1,RC[-3]<2),50,IF(RC[-3]>2,0))))))))) -> 95 | I40: =IF(RC[-1]="",RC[-2],0.7*RC[-1]+0.3*RC[-2]) -> 66.5
A41: سر. توسعه و عمران زاگرس | B41: ثزاگرس | C41: =VLOOKUP(RC[-1],Sheet1!R3C2:R802C3,2,FALSE) -> انبوه سازی املاک و مستغلات | D41: =VLOOKUP(RC[-2],Sheet1!R3C2:R802C9,8,FALSE) -> 86.111111111111114 | E41: =IF(VLOOKUP(RC[-3],Sheet1!R3C2:R803C11,10,FALSE)=0,"",VLOOKUP(Sheet2!RC[-3],Sheet1!R[1]C[-3]:R[801]C[6],10,FALSE)) ->  | F41: =Sheet1!R71C10 -> 123.43233621398711 | G41: =IF(RC[-3]<0,0,IF(AND(RC[-3]<RC[-1],RC[-3]<2),100,IF(AND(RC[-3]<RC[-1],RC[-3]>=2,RC[-3]<3),95,IF(AND(RC[-3]<RC[-1],RC[-3]>=3,RC[-3]<4),90,IF(AND(RC[-3]<RC[-1],RC[-3]>=4,RC[-3]<5),85,IF(AND(RC[-3]<RC[-1],RC[-3]>=5,RC[-3]<6),80,IF(AND(RC[-3]<RC[-1],RC[-3]>=6,RC[-3]<7),75,IF(AND(RC[-3]<RC[-1],RC[-3]>=7,RC[-3]<8),70,IF(AND(RC[-3]<RC[-1],RC[-3]>=8,RC[-3]<9),65,IF(AND(RC[-3]<RC[-1],RC[-3]>=9,RC[-3]<10),60,IF(AND(RC[-3]<RC[-1],RC[-3]>=10,RC[-3]<11),55,IF(AND(RC[-3]<RC[-1],RC[-3]>=11,RC[-3]<12),50,IF(AND(RC[-3]<RC[-1],RC[-3]>=12,RC[-3]<13),45,IF(AND(RC[-3]<RC[-1],RC[-3]>=13,RC[-3]<14),40,IF(AND(RC[-3]<RC[-1],RC[-3]>=14,RC[-3]<15),35,IF(AND(RC[-3]<RC[-1],RC[-3]>=15,RC[-3]<16),30,IF(AND(RC[-3]<RC[-1],RC[-3]>=16,RC[-3]<17),25,IF(AND(RC[-3]<RC[-1],RC[-3]>=17,RC[-3]<18),20,IF(AND(RC[-3]<RC[-1],RC[-3]>=18,RC[-3]<19),15,IF(AND(RC[-3]<RC[-1],RC[-3]>=19,RC[-3]<20),10,IF(AND(RC[-3]<RC[-1],RC[-3]>=20,RC[-3]<21),5,IF(AND(RC[-3]<RC[-1],RC[-3]>=21),0,IF(AND(RC[-3]>RC[-1],RC[-3]>=2,RC[-3]<3),90,IF(AND(RC[-3]>RC[-1],RC[-3]>=3,RC[-3]<4),90,IF(AND(RC[-3]>RC[-1],RC[-3]>=4,RC[-3]<5),80,IF(AND(RC[-3]>RC[-1],RC[-3]>=5,RC[-3]<6),70,IF(AND(RC[-3]>RC[-1],RC[-3]>=6,RC[-3]<7),60,IF(AND(RC[-3]>RC[-1],RC[-3]>=7,RC[-3]<8),50,IF(AND(RC[-3]>RC[-1],RC[-3]>=8,RC[-3]<9),40,IF(AND(RC[-3]>RC[-1],RC[-3]>=9,RC[-3]<10),30,IF(AND(RC[-3]>RC[-1],RC[-3]>=10,RC[-3]<11),20,IF(AND(RC[-3]>RC[-1],RC[-3]>=11,RC[-3]<12),10,IF(AND(RC[-3]>RC[-1],RC[-3]>=12),0))))))))))))))))))))))))))))))))) -> 0 | H41: =IF(RC[-3]="","",IF(RC[-3]<0.3,100,IF(AND(RC[-3]>=0.3,RC[-3]>0.4),95,IF(AND(RC[-3]>=0.4,RC[-3]<0.5),90,IF(AND(RC[-3]>=0.5,RC[-3]<0.6),85,IF(AND(RC[-3]>=0.6,RC[-3]<0.7),80,IF(AND(RC[-3]>=0.6,RC[-3]<1),80,IF(AND(RC[-3]>1,RC[-3]<2),50,IF(RC[-3]>2,0))))))))) ->  | I41: =IF(RC[-1]="",RC[-2],0.7*RC[-1]+0.3*RC[-2]) -> 0
A42: سر. ساختمان ایران | B42: وساخت | C42: =VLOOKUP(RC[-1],Sheet1!R3C2:R802C3,2,FALSE) -> انبوه سازی املاک و مستغلات | D42: =VLOOKUP(RC[-2],Sheet1!R3C2:R802C9,8,FALSE) -> 8.1417946724054033 | E42: =IF(VLOOKUP(RC[-3],Sheet1!R3C2:R803C11,10,FALSE)=0,"",VLOOKUP(Sheet2!RC[-3],Sheet1!R[1]C[-3]:R[801]C[6],10,FALSE)) -> 1.1000000000000001 | F42: =Sheet1!R71C10 -> 123.43233621398711 | G42: =IF(RC[-3]<0,0,IF(AND(RC[-3]<RC[-1],RC[-3]<2),100,IF(AND(RC[-3]<RC[-1],RC[-3]>=2,RC[-3]<3),95,IF(AND(RC[-3]<RC[-1],RC[-3]>=3,RC[-3]<4),90,IF(AND(RC[-3]<RC[-1],RC[-3]>=4,RC[-3]<5),85,IF(AND(RC[-3]<RC[-1],RC[-3]>=5,RC[-3]<6),80,IF(AND(RC[-3]<RC[-1],RC[-3]>=6,RC[-3]<7),75,IF(AND(RC[-3]<RC[-1],RC[-3]>=7,RC[-3]<8),70,IF(AND(RC[-3]<RC[-1],RC[-3]>=8,RC[-3]<9),65,IF(AND(RC[-3]<RC[-1],RC[-3]>=9,RC[-3]<10),60,IF(AND(RC[-3]<RC[-1],RC[-3]>=10,RC[-3]<11),55,IF(AND(RC[-3]<RC[-1],RC[-3]>=11,RC[-3]<12),50,IF(AND(RC[-3]<RC[-1],RC[-3]>=12,RC[-3]<13),45,IF(AND(RC[-3]<RC[-1],RC[-3]>=13,RC[-3]<14),40,IF(AND(RC[-3]<RC[-1],RC[-3]>=14,RC[-3]<15),35,IF(AND(RC[-3]<RC[-1],RC[-3]>=15,RC[-3]<16),30,IF(AND(RC[-3]<RC[-1],RC[-3]>=16,RC[-3]<17),25,IF(AND(RC[-3]<RC[-1],RC[-3]>=17,RC[-3]<18),20,IF(AND(RC[-3]<RC[-1],RC[-3]>=18,RC[-3]<19),15,IF(AND(RC[-3]<RC[-1],RC[-3]>=19,RC[-3]<20),10,IF(AND(RC[-3]<RC[-1],RC[-3]>=20,RC[-3]<21),5,IF(AND(RC[-3]<RC[-1],RC[-3]>=21),0,IF(AND(RC[-3]>RC[-1],RC[-3]>=2,RC[-3]<3),90,IF(AND(RC[-3]>RC[-1],RC[-3]>=3,RC[-3]<4),90,IF(AND(RC[-3]>RC[-1],RC[-3]>=4,RC[-3]<5),80,IF(AND(RC[-3]>RC[-1],RC[-3]>=5,RC[-3]<6),70,IF(AND(RC[-3]>RC[-1],RC[-3]>=6,RC[-3]<7),60,IF(AND(RC[-3]>RC[-1],RC[-3]>=7,RC[-3]<8),50,IF(AND(RC[-3]>RC[-1],RC[-3]>=8,RC[-3]<9),40,IF(AND(RC[-3]>RC[-1],RC[-3]>=9,RC[-3]<10),30,IF(AND(RC[-3]>RC[-1],RC[-3]>=10,RC[-3]<11),20,IF(AND(RC[-3]>RC[-1],RC[-3]>=11,RC[-3]<12),10,IF(AND(RC[-3]>RC[-1],RC[-3]>=12),0))))))))))))))))))))))))))))))))) -> 65 | H42: =IF(RC[-3]="","",IF(RC[-3]<0.3,100,IF(AND(RC[-3]>=0.3,RC[-3]>0.4),95,IF(AND(RC[-3]>=0.4,RC[-3]<0.5),90,IF(AND(RC[-3]>=0.5,RC[-3]<0.6),85,IF(AND(RC[-3]>=0.6,RC[-3]<0.7),80,IF(AND(RC[-3]>=0.6,RC[-3]<1),80,IF(AND(RC[-3]>1,RC[-3]<2),50,IF(RC[-3]>2,0))))))))) -> 95 | I42: =IF(RC[-1]="",RC[-2],0.7*RC[-1]+0.3*RC[-2]) -> 86
A43: سر. ساختمانی اعتماد گستر | B43: ثعتما | C43: =VLOOKUP(RC[-1],Sheet1!R3C2:R802C3,2,FALSE) -> انبوه سازی املاک و مستغلات | D43: =VLOOKUP(RC[-2],Sheet1!R3C2:R802C9,8,FALSE) -> 42.752715857269664 | E43: =IF(VLOOKUP(RC[-3],Sheet1!R3C2:R803C11,10,FALSE)=0,"",VLOOKUP(Sheet2!RC[-3],Sheet1!R[1]C[-3]:R[801]C[6],10,FALSE)) -> 0.2 | F43: =Sheet1!R71C10 -> 123.43233621398711 | G43: =IF(RC[-3]<0,0,IF(AND(RC[-3]<RC[-1],RC[-3]<2),100,IF(AND(RC[-3]<RC[-1],RC[-3]>=2,RC[-3]<3),95,IF(AND(RC[-3]<RC[-1],RC[-3]>=3,RC[-3]<4),90,IF(AND(RC[-3]<RC[-1],RC[-3]>=4,RC[-3]<5),85,IF(AND(RC[-3]<RC[-1],RC[-3]>=5,RC[-3]<6),80,IF(AND(RC[-3]<RC[-1],RC[-3]>=6,RC[-3]<7),75,IF(AND(RC[-3]<RC[-1],RC[-3]>=7,RC[-3]<8),70,IF(AND(RC[-3]<RC[-1],RC[-3]>=8,RC[-3]<9),65,IF(AND(RC[-3]<RC[-1],RC[-3]>=9,RC[-3]<10),60,IF(AND(RC[-3]<RC[-1],RC[-3]>=10,RC[-3]<11),55,IF(AND(RC[-3]<RC[-1],RC[-3]>=11,RC[-3]<12),50,IF(AND(RC[-3]<RC[-1],RC[-3]>=12,RC[-3]<13),45,IF(AND(RC[-3]<RC[-1],RC[-3]>=13,RC[-3]<14),40,IF(AND(RC[-3]<RC[-1],RC[-3]>=14,RC[-3]<15),35,IF(AND(RC[-3]<RC[-1],RC[-3]>=15,RC[-3]<16),30,IF(AND(RC[-3]<RC[-1],RC[-3]>=16,RC[-3]<17),25,IF(AND(RC[-3]<RC[-1],RC[-3]>=17,RC[-3]<18),20,IF(AND(RC[-3]<RC[-1],RC[-3]>=18,RC[-3]<19),15,IF(AND(RC[-3]<RC[-1],RC[-3]>=19,RC[-3]<20),10,IF(AND(RC[-3]<RC[-1],RC[-3]>=20,RC[-3]<21),5,IF(AND(RC[-3]<RC[-1],RC[-3]>=21),0,IF(AND(RC[-3]>RC[-1],RC[-3]>=2,RC[-3]<3),90,IF(AND(RC[-3]>RC[-1],RC[-3]>=3,RC[-3]<4),90,IF(AND(RC[-3]>RC[-1],RC[-3]>=4,RC[-3]<5),80,IF(AND(RC[-3]>RC[-1],RC[-3]>=5,RC[-3]<6),70,IF(AND(RC[-3]>RC[-1],RC[-3]>=6,RC[-3]<7),60,IF(AND(RC[-3]>RC[-1],RC[-3]>=7,RC[-3]<8),50,IF(AND(RC[-3]>RC[-1],RC[-3]>=8,RC[-3]<9),40,IF(AND(RC[-3]>RC[-1],RC[-3]>=9,RC[-3]<10),30,IF(AND(RC[-3]>RC[-1],RC[-3]>=10,RC[-3]<11),20,IF(AND(RC[-3]>RC[-1],RC[-3]>=11,RC[-3]<12),10,IF(AND(RC[-3]>RC[-1],RC[-3]>=12),0))))))))))))))))))))))))))))))))) -> 0 | H43: =IF(RC[-3]="","",IF(RC[-3]<0.3,100,IF(AND(RC[-3]>=0.3,RC[-3]>0.4),95,IF(AND(RC[-3]>=0.4,RC[-3]<0.5),90,IF(AND(RC[-3]>=0.5,RC[-3]<0.6),85,IF(AND(RC[-3]>=0.6,RC[-3]<0.7),80,IF(AND(RC[-3]>=0.6,RC[-3]<1),80,IF(AND(RC[-3]>1,RC[-3]<2),50,IF(RC[-3]>2,0))))))))) -> 100 | I43: =IF(RC[-1]="",RC[-2],0.7*RC[-1]+0.3*RC[-2]) -> 70
A44: سر. ساختمانی بین المللی نام آوران مهندسی | B44: ثنام | C44: =VLOOKUP(RC[-1],Sheet1!R3C2:R802C3,2,FALSE) -> انبوه سازی املاک و مستغلات | D44: =VLOOKUP(RC[-2],Sheet1!R3C2:R802C9,8,FALSE) -> 72.798839096691339 | E44: =IF(VLOOKUP(RC[-3],Sheet1!R3C2:R803C11,10,FALSE)=0,"",VLOOKUP(Sheet2!RC[-3],Sheet1!R[1]C[-3]:R[801]C[6],10,FALSE)) ->  | F44: =Sheet1!R71C10 -> 123.43233621398711 | G44: =IF(RC[-3]<0,0,IF(AND(RC[-3]<RC[-1],RC[-3]<2),100,IF(AND(RC[-3]<RC[-1],RC[-3]>=2,RC[-3]<3),95,IF(AND(RC[-3]<RC[-1],RC[-3]>=3,RC[-3]<4),90,IF(AND(RC[-3]<RC[-1],RC[-3]>=4,RC[-3]<5),85,IF(AND(RC[-3]<RC[-1],RC[-3]>=5,RC[-3]<6),80,IF(AND(RC[-3]<RC[-1],RC[-3]>=6,RC[-3]<7),75,IF(AND(RC[-3]<RC[-1],RC[-3]>=7,RC[-3]<8),70,IF(AND(RC[-3]<RC[-1],RC[-3]>=8,RC[-3]<9),65,IF(AND(RC[-3]<RC[-1],RC[-3]>=9,RC[-3]<10),60,IF(AND(RC[-3]<RC[-1],RC[-3]>=10,RC[-3]<11),55,IF(AND(RC[-3]<RC[-1],RC[-3]>=11,RC[-3]<12),50,IF(AND(RC[-3]<RC[-1],RC[-3]>=12,RC[-3]<13),45,IF(AND(RC[-3]<RC[-1],RC[-3]>=13,RC[-3]<14),40,IF(AND(RC[-3]<RC[-1],RC[-3]>=14,RC[-3]<15),35,IF(AND(RC[-3]<RC[-1],RC[-3]>=15,RC[-3]<16),30,IF(AND(RC[-3]<RC[-1],RC[-3]>=16,RC[-3]<17),25,IF(AND(RC[-3]<RC[-1],RC[-3]>=17,RC[-3]<18),20,IF(AND(RC[-3]<RC[-1],RC[-3]>=18,RC[-3]<19),15,IF(AND(RC[-3]<RC[-1],RC[-3]>=19,RC[-3]<20),10,IF(AND(RC[-3]<RC[-1],RC[-3]>=20,RC[-3]<21),5,IF(AND(RC[-3]<RC[-1],RC[-3]>=21),0,IF(AND(RC[-3]>RC[-1],RC[-3]>=2,RC[-3]<3),90,IF(AND(RC[-3]>RC[-1],RC[-3]>=3,RC[-3]<4),90,IF(AND(RC[-3]>RC[-1],RC[-3]>=4,RC[-3]<5),80,IF(AND(RC[-3]>RC[-1],RC[-3]>=5,RC[-3]<6),70,IF(AND(RC[-3]>RC[-1],RC[-3]>=6,RC[-3]<7),60,IF(AND(RC[-3]>RC[-1],RC[-3]>=7,RC[-3]<8),50,IF(AND(RC[-3]>RC[-1],RC[-3]>=8,RC[-3]<9),40,IF(AND(RC[-3]>RC[-1],RC[-3]>=9,RC[-3]<10),30,IF(AND(RC[-3]>RC[-1],RC[-3]>=10,RC[-3]<11),20,IF(AND(RC[-3]>RC[-1],RC[-3]>=11,RC[-3]<12),10,IF(AND(RC[-3]>RC[-1],RC[-3]>=12),0))))))))))))))))))))))))))))))))) -> 0 | H44: =IF(RC[-3]="","",IF(RC[-3]<0.3,100,IF(AND(RC[-3]>=0.3,RC[-3]>0.4),95,IF(AND(RC[-3]>=0.4,RC[-3]<0.5),90,IF(AND(RC[-3]>=0.5,RC[-3]<0.6),85,IF(AND(RC[-3]>=0.6,RC[-3]<0.7),80,IF(AND(RC[-3]>=0.6,RC[-3]<1),80,IF(AND(RC[-3]>1,RC[-3]<2),50,IF(RC[-3]>2,0))))))))) ->  | I44: =IF(RC[-1]="",RC[-2],0.7*RC[-1]+0.3*RC[-2]) -> 0
A45: سر. ساختمانی نظام مهندسی ایران | B45: ثنظام | C45: =VLOOKUP(RC[-1],Sheet1!R3C2:R802C3,2,FALSE) -> انبوه سازی املاک و مستغلات | D45: =VLOOKUP(RC[-2],Sheet1!R3C2:R802C9,8,FALSE) -> 10099.375 | E45: =IF(VLOOKUP(RC[-3],Sheet1!R3C2:R803C11,10,FALSE)=0,"",VLOOKUP(Sheet2!RC[-3],Sheet1!R[1]C[-3]:R[801]C[6],10,FALSE)) ->  | F45: =Sheet1!R71C10 -> 123.43233621398711 | G45: =IF(RC[-3]<0,0,IF(AND(RC[-3]<RC[-1],RC[-3]<2),100,IF(AND(RC[-3]<RC[-1],RC[-3]>=2,RC[-3]<3),95,IF(AND(RC[-3]<RC[-1],RC[-3]>=3,RC[-3]<4),90,IF(AND(RC[-3]<RC[-1],RC[-3]>=4,RC[-3]<5),85,IF(AND(RC[-3]<RC[-1],RC[-3]>=5,RC[-3]<6),80,IF(AND(RC[-3]<RC[-1],RC[-3]>=6,RC[-3]<7),75,IF(AND(RC[-3]<RC[-1],RC[-3]>=7,RC[-3]<8),70,IF(AND(RC[-3]<RC[-1],RC[-3]>=8,RC[-3]<9),65,IF(AND(RC[-3]<RC[-1],RC[-3]>=9,RC[-3]<10),60,IF(AND(RC[-3]<RC[-1],RC[-3]>=10,RC[-3]<11),55,IF(AND(RC[-3]<RC[-1],RC[-3]>=11,RC[-3]<12),50,IF(AND(RC[-3]<RC[-1],RC[-3]>=12,RC[-3]<13),45,IF(AND(RC[-3]<RC[-1],RC[-3]>=13,RC[-3]<14),40,IF(AND(RC[-3]<RC[-1],RC[-3]>=14,RC[-3]<15),35,IF(AND(RC[-3]<RC[-1],RC[-3]>=15,RC[-3]<16),30,IF(AND(RC[-3]<RC[-1],RC[-3]>=16,RC[-3]<17),25,IF(AND(RC[-3]<RC[-1],RC[-3]>=17,RC[-3]<18),20,IF(AND(RC[-3]<RC[-1],RC[-3]>=18,RC[-3]<19),15,IF(AND(RC[-3]<RC[-1],RC[-3]>=19,RC[-3]<20),10,IF(AND(RC[-3]<RC[-1],RC[-3]>=20,RC[-3]<21),5,IF(AND(RC[-3]<RC[-1],RC[-3]>=21),0,IF(AND(RC[-3]>RC[-1],RC[-3]>=2,RC[-3]<3),90,IF(AND(RC[-3]>RC[-1],RC[-3]>=3,RC[-3]<4),90,IF(AND(RC[-3]>RC[-1],RC[-3]>=4,RC[-3]<5),80,IF(AND(RC[-3]>RC[-1],RC[-3]>=5,RC[-3]<6),70,IF(AND(RC[-3]>RC[-1],RC[-3]>=6,RC[-3]<7),60,IF(AND(RC[-3]>RC[-1],RC[-3]>=7,RC[-3]<8),50,IF(AND(RC[-3]>RC[-1],RC[-3]>=8,RC[-3]<9),40,IF(AND(RC[-3]>RC[-1],RC[-3]>=9,RC[-3]<10),30,IF(AND(RC[-3]>RC[-1],RC[-3]>=10,RC[-3]<11),20,IF(AND(RC[-3]>RC[-1],RC[-3]>=11,RC[-3]<12),10,IF(AND(RC[-3]>RC[-1],RC[-3]>=12),0))))))))))))))))))))))))))))))))) -> 0 | H45: =IF(RC[-3]="","",IF(RC[-3]<0.3,100,IF(AND(RC[-3]>=0.3,RC[-3]>0.4),95,IF(AND(RC[-3]>=0.4,RC[-3]<0.5),90,IF(AND(RC[-3]>=0.5,RC[-3]<0.6),85,IF(AND(RC[-3]>=0.6,RC[-3]<0.7),80,IF(AND(RC[-3]>=0.6,RC[-3]<1),80,IF(AND(RC[-3]>1,RC[-3]<2),50,IF(RC[-3]>2,0))))))))) ->  | I45: =IF(RC[-1]="",RC[-2],0.7*RC[-1]+0.3*RC[-2]) -> 0
A46: سر. سامان گستر اصفهان | B46: ثامان | C46: =VLOOKUP(RC[-1],Sheet1!R3C2:R802C3,2,FALSE) -> انبوه سازی املاک و مستغلات | D46: =VLOOKUP(RC[-2],Sheet1!R3C2:R802C9,8,FALSE) -> 18.543608136771411 | E46: =IF(VLOOKUP(RC[-3],Sheet1!R3C2:R803C11,10,FALSE)=0,"",VLOOKUP(Sheet2!RC[-3],Sheet1!R[1]C[-3]:R[801]C[6],10,FALSE)) ->  | F46: =Sheet1!R71C10 -> 123.43233621398711 | G46: =IF(RC[-3]<0,0,IF(AND(RC[-3]<RC[-1],RC[-3]<2),100,IF(AND(RC[-3]<RC[-1],RC[-3]>=2,RC[-3]<3),95,IF(AND(RC[-3]<RC[-1],RC[-3]>=3,RC[-3]<4),90,IF(AND(RC[-3]<RC[-1],RC[-3]>=4,RC[-3]<5),85,IF(AND(RC[-3]<RC[-1],RC[-3]>=5,RC[-3]<6),80,IF(AND(RC[-3]<RC[-1],RC[-3]>=6,RC[-3]<7),75,IF(AND(RC[-3]<RC[-1],RC[-3]>=7,RC[-3]<8),70,IF(AND(RC[-3]<RC[-1],RC[-3]>=8,RC[-3]<9),65,IF(AND(RC[-3]<RC[-1],RC[-3]>=9,RC[-3]<10),60,IF(AND(RC[-3]<RC[-1],RC[-3]>=10,RC[-3]<11),55,IF(AND(RC[-3]<RC[-1],RC[-3]>=11,RC[-3]<12),50,IF(AND(RC[-3]<RC[-1],RC[-3]>=12,RC[-3]<13),45,IF(AND(RC[-3]<RC[-1],RC[-3]>=13,RC[-3]<14),40,IF(AND(RC[-3]<RC[-1],RC[-3]>=14,RC[-3]<15),35,IF(AND(RC[-3]<RC[-1],RC[-3]>=15,RC[-3]<16),30,IF(AND(RC[-3]<RC[-1],RC[-3]>=16,RC[-3]<17),25,IF(AND(RC[-3]<RC[-1],RC[-3]>=17,RC[-3]<18),20,IF(AND(RC[-3]<RC[-1],RC[-3]>=18,RC[-3]<19),15,IF(AND(RC[-3]<RC[-1],RC[-3]>=19,RC[-3]<20),10,IF(AND(RC[-3]<RC[-1],RC[-3]>=20,RC[-3]<21),5,IF(AND(RC[-3]<RC[-1],RC[-3]>=21),0,IF(AND(RC[-3]>RC[-1],RC[-3]>=2,RC[-3]<3),90,IF(AND(RC[-3]>RC[-1],RC[-3]>=3,RC[-3]<4),90,IF(AND(RC[-3]>RC[-1],RC[-3]>=4,RC[-3]<5),80,IF(AND(RC[-3]>RC[-1],RC[-3]>=5,RC[-3]<6),70,IF(AND(RC[-3]>RC[-1],RC[-3]>=6,RC[-3]<7),60,IF(AND(RC[-3]>RC[-1],RC[-3]>=7,RC[-3]<8),50,IF(AND(RC[-3]>RC[-1],RC[-3]>=8,RC[-3]<9),40,IF(AND(RC[-3]>RC[-1],RC[-3]>=9,RC[-3]<10),30,IF(AND(RC[-3]>RC[-1],RC[-3]>=10,RC[-3]<11),20,IF(AND(RC[-3]>RC[-1],RC[-3]>=11,RC[-3]<12),10,IF(AND(RC[-3]>RC[-1],RC[-3]>=12),0))))))))))))))))))))))))))))))))) -> 15 | H46: =IF(RC[-3]="","",IF(RC[-3]<0.3,100,IF(AND(RC[-3]>=0.3,RC[-3]>0.4),95,IF(AND(RC[-3]>=0.4,RC[-3]<0.5),90,IF(AND(RC[-3]>=0.5,RC[-3]<0.6),85,IF(AND(RC[-3]>=0.6,RC[-3]<0.7),80,IF(AND(RC[-3]>=0.6,RC[-3]<1),80,IF(AND(RC[-3]>1,RC[-3]<2),50,IF(RC[-3]>2,0))))))))) ->  | I46: =IF(RC[-1]="",RC[-2],0.7*RC[-1]+0.3*RC[-2]) -> 15
A47: سر. شاهد | B47: ثشاهد | C47: =VLOOKUP(RC[-1],Sheet1!R3C2:R802C3,2,FALSE) -> انبوه سازی املاک و مستغلات | D47: =VLOOKUP(RC[-2],Sheet1!R3C2:R802C9,8,FALSE) -> 19.9272047319166 | E47: =IF(VLOOKUP(RC[-3],Sheet1!R3C2:R803C11,10,FALSE)=0,"",VLOOKUP(Sheet2!RC[-3],Sheet1!R[1]C[-3]:R[801]C[6],10,FALSE)) -> 1.6 | F47: =Sheet1!R71C10 -> 123.43233621398711 | G47: =IF(RC[-3]<0,0,IF(AND(RC[-3]<RC[-1],RC[-3]<2),100,IF(AND(RC[-3]<RC[-1],RC[-3]>=2,RC[-3]<3),95,IF(AND(RC[-3]<RC[-1],RC[-3]>=3,RC[-3]<4),90,IF(AND(RC[-3]<RC[-1],RC[-3]>=4,RC[-3]<5),85,IF(AND(RC[-3]<RC[-1],RC[-3]>=5,RC[-3]<6),80,IF(AND(RC[-3]<RC[-1],RC[-3]>=6,RC[-3]<7),75,IF(AND(RC[-3]<RC[-1],RC[-3]>=7,RC[-3]<8),70,IF(AND(RC[-3]<RC[-1],RC[-3]>=8,RC[-3]<9),65,IF(AND(RC[-3]<RC[-1],RC[-3]>=9,RC[-3]<10),60,IF(AND(RC[-3]<RC[-1],RC[-3]>=10,RC[-3]<11),55,IF(AND(RC[-3]<RC[-1],RC[-3]>=11,RC[-3]<12),50,IF(AND(RC[-3]<RC[-1],RC[-3]>=12,RC[-3]<13),45,IF(AND(RC[-3]<RC[-1],RC[-3]>=13,RC[-3]<14),40,IF(AND(RC[-3]<RC[-1],RC[-3]>=14,RC[-3]<15),35,IF(AND(RC[-3]<RC[-1],RC[-3]>=15,RC[-3]<16),30,IF(AND(RC[-3]<RC[-1],RC[-3]>=16,RC[-3]<17),25,IF(AND(RC[-3]<RC[-1],RC[-3]>=17,RC[-3]<18),20,IF(AND(RC[-3]<RC[-1],RC[-3]>=18,RC[-3]<19),15,IF(AND(RC[-3]<RC[-1],RC[-3]>=19,RC[-3]<20),10,IF(AND(RC[-3]<RC[-1],RC[-3]>=20,RC[-3]<21),5,IF(AND(RC[-3]<RC[-1],RC[-3]>=21),0,IF(AND(RC[-3]>RC[-1],RC[-3]>=2,RC[-3]<3),90,IF(AND(RC[-3]>RC[-1],RC[-3]>=3,RC[-3]<4),90,IF(AND(RC[-3]>RC[-1],RC[-3]>=4,RC[-3]<5),80,IF(AND(RC[-3]>RC[-1],RC[-3]>=5,RC[-3]<6),70,IF(AND(RC[-3]>RC[-1],RC[-3]>=6,RC[-3]<7),60,IF(AND(RC[-3]>RC[-1],RC[-3]>=7,RC[-3]<8),50,IF(AND(RC[-3]>RC[-1],RC[-3]>=8,RC[-3]<9),40,IF(AND(RC[-3]>RC[-1],RC[-3]>=9,RC[-3]<10),30,IF(AND(RC[-3]>RC[-1],RC[-3]>=10,RC[-3]<11),20,IF(AND(RC[-3]>RC[-1],RC[-3]>=11,RC[-3]<12),10,IF(AND(RC[-3]>RC[-1],RC[-3]>=12),0))))))))))))))))))))))))))))))))) -> 10 | H47: =IF(RC[-3]="","",IF(RC[-3]<0.3,100,IF(AND(RC[-3]>=0.3,RC[-3]>0.4),95,IF(AND(RC[-3]>=0.4,RC[-3]<0.5),90,IF(AND(RC[-3]>=0.5,RC[-3]<0.6),85,IF(AND(RC[-3]>=0.6,RC[-3]<0.7),80,IF(AND(RC[-3]>=0.6,RC[-3]<1),80,IF(AND(RC[-3]>1,RC[-3]<2),50,IF(RC[-3]>2,0))))))))) -> 95 | I47: =IF(RC[-1]="",RC[-2],0.7*RC[-1]+0.3*RC[-2]) -> 69.5
A48: سر. مسکن | B48: ثمسکن | C48: =VLOOKUP(RC[-1],Sheet1!R3C2:R802C3,2,FALSE) -> انبوه سازی املاک و مستغلات | D48: =VLOOKUP(RC[-2],Sheet1!R3C2:R802C9,8,FALSE) -> 16.708036245509764 | E48: =IF(VLOOKUP(RC[-3],Sheet1!R3C2:R803C11,10,FALSE)=0,"",VLOOKUP(Sheet2!RC[-3],Sheet1!R[1]C[-3]:R[801]C[6],10,FALSE)) -> 0.33 | F48: =Sheet1!R71C10 -> 123.43233621398711 | G48: =IF(RC[-3]<0,0,IF(AND(RC[-3]<RC[-1],RC[-3]<2),100,IF(AND(RC[-3]<RC[-1],RC[-3]>=2,RC[-3]<3),95,IF(AND(RC[-3]<RC[-1],RC[-3]>=3,RC[-3]<4),90,IF(AND(RC[-3]<RC[-1],RC[-3]>=4,RC[-3]<5),85,IF(AND(RC[-3]<RC[-1],RC[-3]>=5,RC[-3]<6),80,IF(AND(RC[-3]<RC[-1],RC[-3]>=6,RC[-3]<7),75,IF(AND(RC[-3]<RC[-1],RC[-3]>=7,RC[-3]<8),70,IF(AND(RC[-3]<RC[-1],RC[-3]>=8,RC[-3]<9),65,IF(AND(RC[-3]<RC[-1],RC[-3]>=9,RC[-3]<10),60,IF(AND(RC[-3]<RC[-1],RC[-3]>=10,RC[-3]<11),55,IF(AND(RC[-3]<RC[-1],RC[-3]>=11,RC[-3]<12),50,IF(AND(RC[-3]<RC[-1],RC[-3]>=12,RC[-3]<13),45,IF(AND(RC[-3]<RC[-1],RC[-3]>=13,RC[-3]<14),40,IF(AND(RC[-3]<RC[-1],RC[-3]>=14,RC[-3]<15),35,IF(AND(RC[-3]<RC[-1],RC[-3]>=15,RC[-3]<16),30,IF(AND(RC[-3]<RC[-1],RC[-3]>=16,RC[-3]<17),25,IF(AND(RC[-3]<RC[-1],RC[-3]>=17,RC[-3]<18),20,IF(AND(RC[-3]<RC[-1],RC[-3]>=18,RC[-3]<19),15,IF(AND(RC[-3]<RC[-1],RC[-3]>=19,RC[-3]<20),10,IF(AND(RC[-3]<RC[-1],RC[-3]>=20,RC[-3]<21),5,IF(AND(RC[-3]<RC[-1],RC[-3]>=21),0,IF(AND(RC[-3]>RC[-1],RC[-3]>=2,RC[-3]<3),90,IF(AND(RC[-3]>RC[-1],RC[-3]>=3,RC[-3]<4),90,IF(AND(RC[-3]>RC[-1],RC[-3]>=4,RC[-3]<5),80,IF(AND(RC[-3]>RC[-1],RC[-3]>=5,RC[-3]<6),70,IF(AND(RC[-3]>RC[-1],RC[-3]>=6,RC[-3]<7),60,IF(AND(RC[-3]>RC[-1],RC[-3]>=7,RC[-3]<8),50,IF(AND(RC[-3]>RC[-1],RC[-3]>=8,RC[-3]<9),40,IF(AND(RC[-3]>RC[-1],RC[-3]>=9,RC[-3]<10),30,IF(AND(RC[-3]>RC[-1],RC[-3]>=10,RC[-3]<11),20,IF(AND(RC[-3]>RC[-1],RC[-3]>=11,RC[-3]<12),10,IF(AND(RC[-3]>RC[-1],RC[-3]>=12),0))))))))))))))))))))))))))))))))) -> 25 | H48: =IF(RC[-3]="","",IF(RC[-3]<0.3,100,IF(AND(RC[-3]>=0.3,RC[-3]>0.4),95,IF(AND(RC[-3]>=0.4,RC[-3]<0.5),90,IF(AND(RC[-3]>=0.5,RC[-3]<0.6),85,IF(AND(RC[-3]>=0.6,RC[-3]<0.7),80,IF(AND(RC[-3]>=0.6,RC[-3]<1),80,IF(AND(RC[-3]>1,RC[-3]<2),50,IF(RC[-3]>2,0))))))))) -> 0 | I48: =IF(RC[-1]="",RC[-2],0.7*RC[-1]+0.3*RC[-2]) -> 7.5
A49: سر. مسکن الوند | B49: ثالوند | C49: =VLOOKUP(RC[-1],Sheet1!R3C2:R802C3,2,FALSE) -> انبوه سازی املاک و مستغلات | D49: =VLOOKUP(RC[-2],Sheet1!R3C2:R802C9,8,FALSE) -> 13.162642334092636 | E49: =IF(VLOOKUP(RC[-3],Sheet1!R3C2:R803C11,10,FALSE)=0,"",VLOOKUP(Sheet2!RC[-3],Sheet1!R[1]C[-3]:R[801]C[6],10,FALSE)) ->  | F49: =Sheet1!R71C10 -> 123.43233621398711 | G49: =IF(RC[-3]<0,0,IF(AND(RC[-3]<RC[-1],RC[-3]<2),100,IF(AND(RC[-3]<RC[-1],RC[-3]>=2,RC[-3]<3),95,IF(AND(RC[-3]<RC[-1],RC[-3]>=3,RC[-3]<4),90,IF(AND(RC[-3]<RC[-1],RC[-3]>=4,RC[-3]<5),85,IF(AND(RC[-3]<RC[-1],RC[-3]>=5,RC[-3]<6),80,IF(AND(RC[-3]<RC[-1],RC[-3]>=6,RC[-3]<7),75,IF(AND(RC[-3]<RC[-1],RC[-3]>=7,RC[-3]<8),70,IF(AND(RC[-3]<RC[-1],RC[-3]>=8,RC[-3]<9),65,IF(AND(RC[-3]<RC[-1],RC[-3]>=9,RC[-3]<10),60,IF(AND(RC[-3]<RC[-1],RC[-3]>=10,RC[-3]<11),55,IF(AND(RC[-3]<RC[-1],RC[-3]>=11,RC[-3]<12),50,IF(AND(RC[-3]<RC[-1],RC[-3]>=12,RC[-3]<13),45,IF(AND(RC[-3]<RC[-1],RC[-3]>=13,RC[-3]<14),40,IF(AND(RC[-3]<RC[-1],RC[-3]>=14,RC[-3]<15),35,IF(AND(RC[-3]<RC[-1],RC[-3]>=15,RC[-3]<16),30,IF(AND(RC[-3]<RC[-1],RC[-3]>=16,RC[-3]<17),25,IF(AND(RC[-3]<RC[-1],RC[-3]>=17,RC[-3]<18),20,IF(AND(RC[-3]<RC[-1],RC[-3]>=18,RC[-3]<19),15,IF(AND(RC[-3]<RC[-1],RC[-3]>=19,RC[-3]<20),10,IF(AND(RC[-3]<RC[-1],RC[-3]>=20,RC[-3]<21),5,IF(AND(RC[-3]<RC[-1],RC[-3]>=21),0,IF(AND(RC[-3]>RC[-1],RC[-3]>=2,RC[-3]<3),90,IF(AND(RC[-3]>RC[-1],RC[-3]>=3,RC[-3]<4),90,IF(AND(RC[-3]>RC[-1],RC[-3]>=4,RC[-3]<5),80,IF(AND(RC[-3]>RC[-1],RC[-3]>=5,RC[-3]<6),70,IF(AND(RC[-3]>RC[-1],RC[-3]>=6,RC[-3]<7),60,IF(AND(RC[-3]>RC[-1],RC[-3]>=7,RC[-3]<8),50,IF(AND(RC[-3]>RC[-1],RC[-3]>=8,RC[-3]<9),40,IF(AND(RC[-3]>RC[-1],RC[-3]>=9,RC[-3]<10),30,IF(AND(RC[-3]>RC[-1],RC[-3]>=10,RC[-3]<11),20,IF(AND(RC[-3]>RC[-1],RC[-3]>=11,RC[-3]<12),10,IF(AND(RC[-3]>RC[-1],RC[-3]>=12),0))))))))))))))))))))))))))))))))) -> 40 | H49: =IF(RC[-3]="","",IF(RC[-3]<0.3,100,IF(AND(RC[-3]>=0.3,RC[-3]>0.4),95,IF(AND(RC[-3]>=0.4,RC[-3]<0.5),90,IF(AND(RC[-3]>=0.5,RC[-3]<0.6),85,IF(AND(RC[-3]>=0.6,RC[-3]<0.7),80,IF(AND(RC[-3]>=0.6,RC[-3]<1),80,IF(AND(RC[-3]>1,RC[-3]<2),50,IF(RC[-3]>2,0))))))))) ->  | I49: =IF(RC[-1]="",RC[-2],0.7*RC[-1]+0.3*RC[-2]) -> 40
A50: سر. مسکن پردیس | B50: ثپردیس | C50: =VLOOKUP(RC[-1],Sheet1!R3C2:R802C3,2,FALSE) -> انبوه سازی املاک و مستغلات | D50: =VLOOKUP(RC[-2],Sheet1!R3C2:R802C9,8,FALSE) -> 4.0962225503309915 | E50: =IF(VLOOKUP(RC[-3],Sheet1!R3C2:R803C11,10,FALSE)=0,"",VLOOKUP(Sheet2!RC[-3],Sheet1!R[1]C[-3]:R[801]C[6],10,FALSE)) ->  | F50: =Sheet1!R71C10 -> 123.43233621398711 | G50: =IF(RC[-3]<0,0,IF(AND(RC[-3]<RC[-1],RC[-3]<2),100,IF(AND(RC[-3]<RC[-1],RC[-3]>=2,RC[-3]<3),95,IF(AND(RC[-3]<RC[-1],RC[-3]>=3,RC[-3]<4),90,IF(AND(RC[-3]<RC[-1],RC[-3]>=4,RC[-3]<5),85,IF(AND(RC[-3]<RC[-1],RC[-3]>=5,RC[-3]<6),80,IF(AND(RC[-3]<RC[-1],RC[-3]>=6,RC[-3]<7),75,IF(AND(RC[-3]<RC[-1],RC[-3]>=7,RC[-3]<8),70,IF(AND(RC[-3]<RC[-1],RC[-3]>=8,RC[-3]<9),65,IF(AND(RC[-3]<RC[-1],RC[-3]>=9,RC[-3]<10),60,IF(AND(RC[-3]<RC[-1],RC[-3]>=10,RC[-3]<11),55,IF(AND(RC[-3]<RC[-1],RC[-3]>=11,RC[-3]<12),50,IF(AND(RC[-3]<RC[-1],RC[-3]>=12,RC[-3]<13),45,IF(AND(RC[-3]<RC[-1],RC[-3]>=13,RC[-3]<14),40,IF(AND(RC[-3]<RC[-1],RC[-3]>=14,RC[-3]<15),35,IF(AND(RC[-3]<RC[-1],RC[-3]>=15,RC[-3]<16),30,IF(AND(RC[-3]<RC[-1],RC[-3]>=16,RC[-3]<17),25,IF(AND(RC[-3]<RC[-1],RC[-3]>=17,RC[-3]<18),20,IF(AND(RC[-3]<RC[-1],RC[-3]>=18,RC[-3]<19),15,IF(AND(RC[-3]<RC[-1],RC[-3]>=19,RC[-3]<20),10,IF(AND(RC[-3]<RC[-1],RC[-3]>=20,RC[-3]<21),5,IF(AND(RC[-3]<RC[-1],RC[-3]>=21),0,IF(AND(RC[-3]>RC[-1],RC[-3]>=2,RC[-3]<3),90,IF(AND(RC[-3]>RC[-1],RC[-3]>=3,RC[-3]<4),90,IF(AND(RC[-3]>RC[-1],RC[-3]>=4,RC[-3]<5),80,IF(AND(RC[-3]>RC[-1],RC[-3]>=5,RC[-3]<6),70,IF(AND(RC[-3]>RC[-1],RC[-3]>=6,RC[-3]<7),60,IF(AND(RC[-3]>RC[-1],RC[-3]>=7,RC[-3]<8),50,IF(AND(RC[-3]>RC[-1],RC[-3]>=8,RC[-3]<9),40,IF(AND(RC[-3]>RC[-1],RC[-3]>=9,RC[-3]<10),30,IF(AND(RC[-3]>RC[-1],RC[-3]>=10,RC[-3]<11),20,IF(AND(RC[-3]>RC[-1],RC[-3]>=11,RC[-3]<12),10,IF(AND(RC[-3]>RC[-1],RC[-3]>=12),0))))))))))))))))))))))))))))))))) -> 85 | H50: =IF(RC[-3]="","",IF(RC[-3]<0.3,100,IF(AND(RC[-3]>=0.3,RC[-3]>0.4),95,IF(AND(RC[-3]>=0.4,RC[-3]<0.5),90,IF(AND(RC[-3]>=0.5,RC[-3]<0.6),85,IF(AND(RC[-3]>=0.6,RC[-3]<0.7),80,IF(AND(RC[-3]>=0.6,RC[-3]<1),80,IF(AND(RC[-3]>1,RC[-3]<2),50,IF(RC[-3]>2,0))))))))) ->  | I50: =IF(RC[-1]="",RC[-2],0.7*RC[-1]+0.3*RC[-2]) -> 85
A51: سر. مسکن تهران | B51: ثتران | C51: =VLOOKUP(RC[-1],Sheet1!R3C2:R802C3,2,FALSE) -> انبوه سازی املاک و مستغلات | D51: =VLOOKUP(RC[-2],Sheet1!R3C2:R802C9,8,FALSE) -> 24.051136334363914 | E51: =IF(VLOOKUP(RC[-3],Sheet1!R3C2:R803C11,10,FALSE)=0,"",VLOOKUP(Sheet2!RC[-3],Sheet1!R[1]C[-3]:R[801]C[6],10,FALSE)) ->  | F51: =Sheet1!R71C10 -> 123.43233621398711 | G51: =IF(RC[-3]<0,0,IF(AND(RC[-3]<RC[-1],RC[-3]<2),100,IF(AND(RC[-3]<RC[-1],RC[-3]>=2,RC[-3]<3),95,IF(AND(RC[-3]<RC[-1],RC[-3]>=3,RC[-3]<4),90,IF(AND(RC[-3]<RC[-1],RC[-3]>=4,RC[-3]<5),85,IF(AND(RC[-3]<RC[-1],RC[-3]>=5,RC[-3]<6),80,IF(AND(RC[-3]<RC[-1],RC[-3]>=6,RC[-3]<7),75,IF(AND(RC[-3]<RC[-1],RC[-3]>=7,RC[-3]<8),70,IF(AND(RC[-3]<RC[-1],RC[-3]>=8,RC[-3]<9),65,IF(AND(RC[-3]<RC[-1],RC[-3]>=9,RC[-3]<10),60,IF(AND(RC[-3]<RC[-1],RC[-3]>=10,RC[-3]<11),55,IF(AND(RC[-3]<RC[-1],RC[-3]>=11,RC[-3]<12),50,IF(AND(RC[-3]<RC[-1],RC[-3]>=12,RC[-3]<13),45,IF(AND(RC[-3]<RC[-1],RC[-3]>=13,RC[-3]<14),40,IF(AND(RC[-3]<RC[-1],RC[-3]>=14,RC[-3]<15),35,IF(AND(RC[-3]<RC[-1],RC[-3]>=15,RC[-3]<16),30,IF(AND(RC[-3]<RC[-1],RC[-3]>=16,RC[-3]<17),25,IF(AND(RC[-3]<RC[-1],RC[-3]>=17,RC[-3]<18),20,IF(AND(RC[-3]<RC[-1],RC[-3]>=18,RC[-3]<19),15,IF(AND(RC[-3]<RC[-1],RC[-3]>=19,RC[-3]<20),10,IF(AND(RC[-3]<RC[-1],RC[-3]>=20,RC[-3]<21),5,IF(AND(RC[-3]<RC[-1],RC[-3]>=21),0,IF(AND(RC[-3]>RC[-1],RC[-3]>=2,RC[-3]<3),90,IF(AND(RC[-3]>RC[-1],RC[-3]>=3,RC[-3]<4),90,IF(AND(RC[-3]>RC[-1],RC[-3]>=4,RC[-3]<5),80,IF(AND(RC[-3]>RC[-1],RC[-3]>=5,RC[-3]<6),70,IF(AND(RC[-3]>RC[-1],RC[-3]>=6,RC[-3]<7),60,IF(AND(RC[-3]>RC[-1],RC[-3]>=7,RC[-3]<8),50,IF(AND(RC[-3]>RC[-1],RC[-3]>=8,RC[-3]<9),40,IF(AND(RC[-3]>RC[-1],RC[-3]>=9,RC[-3]<10),30,IF(AND(RC[-3]>RC[-1],RC[-3]>=10,RC[-3]<11),20,IF(AND(RC[-3]>RC[-1],RC[-3]>=11,RC[-3]<12),10,IF(AND(RC[-3]>RC[-1],RC[-3]>=12),0))))))))))))))))))))))))))))))))) -> 0 | H51: =IF(RC[-3]="","",IF(RC[-3]<0.3,100,IF(AND(RC[-3]>=0.3,RC[-3]>0.4),95,IF(AND(RC[-3]>=0.4,RC[-3]<0.5),90,IF(AND(RC[-3]>=0.5,RC[-3]<0.6),85,IF(AND(RC[-3]>=0.6,RC[-3]<0.7),80,IF(AND(RC[-3]>=0.6,RC[-3]<1),80,IF(AND(RC[-3]>1,RC[-3]<2),50,IF(RC[-3]>2,0))))))))) ->  | I51: =IF(RC[-1]="",RC[-2],0.7*RC[-1]+0.3*RC[-2]) -> 0
A52: سر. مسکن جنوب | B52: ثجنوب | C52: =VLOOKUP(RC[-1],Sheet1!R3C2:R802C3,2,FALSE) -> انبوه سازی املاک و مستغلات | D52: =VLOOKUP(RC[-2],Sheet1!R3C2:R802C9,8,FALSE) -> 7.3041488038818922 | E52: =IF(VLOOKUP(RC[-3],Sheet1!R3C2:R803C11,10,FALSE)=0,"",VLOOKUP(Sheet2!RC[-3],Sheet1!R[1]C[-3]:R[801]C[6],10,FALSE)) ->  | F52: =Sheet1!R71C10 -> 123.43233621398711 | G52: =IF(RC[-3]<0,0,IF(AND(RC[-3]<RC[-1],RC[-3]<2),100,IF(AND(RC[-3]<RC[-1],RC[-3]>=2,RC[-3]<3),95,IF(AND(RC[-3]<RC[-1],RC[-3]>=3,RC[-3]<4),90,IF(AND(RC[-3]<RC[-1],RC[-3]>=4,RC[-3]<5),85,IF(AND(RC[-3]<RC[-1],RC[-3]>=5,RC[-3]<6),80,IF(AND(RC[-3]<RC[-1],RC[-3]>=6,RC[-3]<7),75,IF(AND(RC[-3]<RC[-1],RC[-3]>=7,RC[-3]<8),70,IF(AND(RC[-3]<RC[-1],RC[-3]>=8,RC[-3]<9),65,IF(AND(RC[-3]<RC[-1],RC[-3]>=9,RC[-3]<10),60,IF(AND(RC[-3]<RC[-1],RC[-3]>=10,RC[-3]<11),55,IF(AND(RC[-3]<RC[-1],RC[-3]>=11,RC[-3]<12),50,IF(AND(RC[-3]<RC[-1],RC[-3]>=12,RC[-3]<13),45,IF(AND(RC[-3]<RC[-1],RC[-3]>=13,RC[-3]<14),40,IF(AND(RC[-3]<RC[-1],RC[-3]>=14,RC[-3]<15),35,IF(AND(RC[-3]<RC[-1],RC[-3]>=15,RC[-3]<16),30,IF(AND(RC[-3]<RC[-1],RC[-3]>=16,RC[-3]<17),25,IF(AND(RC[-3]<RC[-1],RC[-3]>=17,RC[-3]<18),20,IF(AND(RC[-3]<RC[-1],RC[-3]>=18,RC[-3]<19),15,IF(AND(RC[-3]<RC[-1],RC[-3]>=19,RC[-3]<20),10,IF(AND(RC[-3]<RC[-1],RC[-3]>=20,RC[-3]<21),5,IF(AND(RC[-3]<RC[-1],RC[-3]>=21),0,IF(AND(RC[-3]>RC[-1],RC[-3]>=2,RC[-3]<3),90,IF(AND(RC[-3]>RC[-1],RC[-3]>=3,RC[-3]<4),90,IF(AND(RC[-3]>RC[-1],RC[-3]>=4,RC[-3]<5),80,IF(AND(RC[-3]>RC[-1],RC[-3]>=5,RC[-3]<6),70,IF(AND(RC[-3]>RC[-1],RC[-3]>=6,RC[-3]<7),60,IF(AND(RC[-3]>RC[-1],RC[-3]>=7,RC[-3]<8),50,IF(AND(RC[-3]>RC[-1],RC[-3]>=8,RC[-3]<9),40,IF(AND(RC[-3]>RC[-1],RC[-3]>=9,RC[-3]<10),30,IF(AND(RC[-3]>RC[-1],RC[-3]>=10,RC[-3]<11),20,IF(AND(RC[-3]>RC[-1],RC[-3]>=11,RC[-3]<12),10,IF(AND(RC[-3]>RC[-1],RC[-3]>=12),0))))))))))))))))))))))))))))))))) -> 70 | H52: =IF(RC[-3]="","",IF(RC[-3]<0.3,100,IF(AND(RC[-3]>=0.3,RC[-3]>0.4),95,IF(AND(RC[-3]>=0.4,RC[-3]<0.5),90,IF(AND(RC[-3]>=0.5,RC[-3]<0.6),85,IF(AND(RC[-3]>=0.6,RC[-3]<0.7),80,IF(AND(RC[-3]>=0.6,RC[-3]<1),80,IF(AND(RC[-3]>1,RC[-3]<2),50,IF(RC[-3]>2,0))))))))) ->  | I52: =IF(RC[-1]="",RC[-2],0.7*RC[-1]+0.3*RC[-2]) -> 70
A53: سر. مسکن زاینده رود | B53: ثرود | C53: =VLOOKUP(RC[-1],Sheet1!R3C2:R802C3,2,FALSE) -> انبوه سازی املاک و مستغلات | D53: =VLOOKUP(RC[-2],Sheet1!R3C2:R802C9,8,FALSE) -> 12.114317519223738 | E53: =IF(VLOOKUP(RC[-3],Sheet1!R3C2:R803C11,10,FALSE)=0,"",VLOOKUP(Sheet2!RC[-3],Sheet1!R[1]C[-3]:R[801]C[6],10,FALSE)) ->  | F53: =Sheet1!R71C10 -> 123.43233621398711 | G53: =IF(RC[-3]<0,0,IF(AND(RC[-3]<RC[-1],RC[-3]<2),100,IF(AND(RC[-3]<RC[-1],RC[-3]>=2,RC[-3]<3),95,IF(AND(RC[-3]<RC[-1],RC[-3]>=3,RC[-3]<4),90,IF(AND(RC[-3]<RC[-1],RC[-3]>=4,RC[-3]<5),85,IF(AND(RC[-3]<RC[-1],RC[-3]>=5,RC[-3]<6),80,IF(AND(RC[-3]<RC[-1],RC[-3]>=6,RC[-3]<7),75,IF(AND(RC[-3]<RC[-1],RC[-3]>=7,RC[-3]<8),70,IF(AND(RC[-3]<RC[-1],RC[-3]>=8,RC[-3]<9),65,IF(AND(RC[-3]<RC[-1],RC[-3]>=9,RC[-3]<10),60,IF(AND(RC[-3]<RC[-1],RC[-3]>=10,RC[-3]<11),55,IF(AND(RC[-3]<RC[-1],RC[-3]>=11,RC[-3]<12),50,IF(AND(RC[-3]<RC[-1],RC[-3]>=12,RC[-3]<13),45,IF(AND(RC[-3]<RC[-1],RC[-3]>=13,RC[-3]<14),40,IF(AND(RC[-3]<RC[-1],RC[-3]>=14,RC[-3]<15),35,IF(AND(RC[-3]<RC[-1],RC[-3]>=15,RC[-3]<16),30,IF(AND(RC[-3]<RC[-1],RC[-3]>=16,RC[-3]<17),25,IF(AND(RC[-3]<RC[-1],RC[-3]>=17,RC[-3]<18),20,IF(AND(RC[-3]<RC[-1],RC[-3]>=18,RC[-3]<19),15,IF(AND(RC[-3]<RC[-1],RC[-3]>=19,RC[-3]<20),10,IF(AND(RC[-3]<RC[-1],RC[-3]>=20,RC[-3]<21),5,IF(AND(RC[-3]<RC[-1],RC[-3]>=21),0,IF(AND(RC[-3]>RC[-1],RC[-3]>=2,RC[-3]<3),90,IF(AND(RC[-3]>RC[-1],RC[-3]>=3,RC[-3]<4),90,IF(AND(RC[-3]>RC[-1],RC[-3]>=4,RC[-3]<5),80,IF(AND(RC[-3]>RC[-1],RC[-3]>=5,RC[-3]<6),70,IF(AND(RC[-3]>RC[-1],RC[-3]>=6,RC[-3]<7),60,IF(AND(RC[-3]>RC[-1],RC[-3]>=7,RC[-3]<8),50,IF(AND(RC[-3]>RC[-1],RC[-3]>=8,RC[-3]<9),40,IF(AND(RC[-3]>RC[-1],RC[-3]>=9,RC[-3]<10),30,IF(AND(RC[-3]>RC[-1],RC[-3]>=10,RC[-3]<11),20,IF(AND(RC[-3]>RC[-1],RC[-3]>=11,RC[-3]<12),10,IF(AND(RC[-3]>RC[-1],RC[-3]>=12),0))))))))))))))))))))))))))))))))) -> 45 | H53: =IF(RC[-3]="","",IF(RC[-3]<0.3,100,IF(AND(RC[-3]>=0.3,RC[-3]>0.4),95,IF(AND(RC[-3]>=0.4,RC[-3]<0.5),90,IF(AND(RC[-3]>=0.5,RC[-3]<0.6),85,IF(AND(RC[-3]>=0.6,RC[-3]<0.7),80,IF(AND(RC[-3]>=0.6,RC[-3]<1),80,IF(AND(RC[-3]>1,RC[-3]<2),50,IF(RC[-3]>2,0))))))))) ->  | I53: =IF(RC[-1]="",RC[-2],0.7*RC[-1]+0.3*RC[-2]) -> 45
A54: سر. مسکن شمال شرق | B54: ثشرق | C54: =VLOOKUP(RC[-1],Sheet1!R3C2:R802C3,2,FALSE) -> انبوه سازی املاک و مستغلات | D54: =VLOOKUP(RC[-2],Sheet1!R3C2:R802C9,8,FALSE) -> 16.075766235168516 | E54: =IF(VLOOKUP(RC[-3],Sheet1!R3C2:R803C11,10,FALSE)=0,"",VLOOKUP(Sheet2!RC[-3],Sheet1!R[1]C[-3]:R[801]C[6],10,FALSE)) ->  | F54: =Sheet1!R71C10 -> 123.43233621398711 | G54: =IF(RC[-3]<0,0,IF(AND(RC[-3]<RC[-1],RC[-3]<2),100,IF(AND(RC[-3]<RC[-1],RC[-3]>=2,RC[-3]<3),95,IF(AND(RC[-3]<RC[-1],RC[-3]>=3,RC[-3]<4),90,IF(AND(RC[-3]<RC[-1],RC[-3]>=4,RC[-3]<5),85,IF(AND(RC[-3]<RC[-1],RC[-3]>=5,RC[-3]<6),80,IF(AND(RC[-3]<RC[-1],RC[-3]>=6,RC[-3]<7),75,IF(AND(RC[-3]<RC[-1],RC[-3]>=7,RC[-3]<8),70,IF(AND(RC[-3]<RC[-1],RC[-3]>=8,RC[-3]<9),65,IF(AND(RC[-3]<RC[-1],RC[-3]>=9,RC[-3]<10),60,IF(AND(RC[-3]<RC[-1],RC[-3]>=10,RC[-3]<11),55,IF(AND(RC[-3]<RC[-1],RC[-3]>=11,RC[-3]<12),50,IF(AND(RC[-3]<RC[-1],RC[-3]>=12,RC[-3]<13),45,IF(AND(RC[-3]<RC[-1],RC[-3]>=13,RC[-3]<14),40,IF(AND(RC[-3]<RC[-1],RC[-3]>=14,RC[-3]<15),35,IF(AND(RC[-3]<RC[-1],RC[-3]>=15,RC[-3]<16),30,IF(AND(RC[-3]<RC[-1],RC[-3]>=16,RC[-3]<17),25,IF(AND(RC[-3]<RC[-1],RC[-3]>=17,RC[-3]<18),20,IF(AND(RC[-3]<RC[-1],RC[-3]>=18,RC[-3]<19),15,IF(AND(RC[-3]<RC[-1],RC[-3]>=19,RC[-3]<20),10,IF(AND(RC[-3]<RC[-1],RC[-3]>=20,RC[-3]<21),5,IF(AND(RC[-3]<RC[-1],RC[-3]>=21),0,IF(AND(RC[-3]>RC[-1],RC[-3]>=2,RC[-3]<3),90,IF(AND(RC[-3]>RC[-1],RC[-3]>=3,RC[-3]<4),90,IF(AND(RC[-3]>RC[-1],RC[-3]>=4,RC[-3]<5),80,IF(AND(RC[-3]>RC[-1],RC[-3]>=5,RC[-3]<6),70,IF(AND(RC[-3]>RC[-1],RC[-3]>=6,RC[-3]<7),60,IF(AND(RC[-3]>RC[-1],RC[-3]>=7,RC[-3]<8),50,IF(AND(RC[-3]>RC[-1],RC[-3]>=8,RC[-3]<9),40,IF(AND(RC[-3]>RC[-1],RC[-3]>=9,RC[-3]<10),30,IF(AND(RC[-3]>RC[-1],RC[-3]>=10,RC[-3]<11),20,IF(AND(RC[-3]>RC[-1],RC[-3]>=11,RC[-3]<12),10,IF(AND(RC[-3]>RC[-1],RC[-3]>=12),0))))))))))))))))))))))))))))))))) -> 25 | H54: =IF(RC[-3]="","",IF(RC[-3]<0.3,100,IF(AND(RC[-3]>=0.3,RC[-3]>0.4),95,IF(AND(RC[-3]>=0.4,RC[-3]<0.5),90,IF(AND(RC[-3]>=0.5,RC[-3]<0.6),85,IF(AND(RC[-3]>=0.6,RC[-3]<0.7),80,IF(AND(RC[-3]>=0.6,RC[-3]<1),80,IF(AND(RC[-3]>1,RC[-3]<2),50,IF(RC[-3]>2,0))))))))) ->  | I54: =IF(RC[-1]="",RC[-2],0.7*RC[-1]+0.3*RC[-2]) -> 25
A55: سر. مسکن شمالغرب | B55: ثغرب | C55: =VLOOKUP(RC[-1],Sheet1!R3C2:R802C3,2,FALSE) -> انبوه سازی املاک و مستغلات | D55: =VLOOKUP(RC[-2],Sheet1!R3C2:R802C9,8,FALSE) -> 11.224739906357204 | E55: =IF(VLOOKUP(RC[-3],Sheet1!R3C2:R803C11,10,FALSE)=0,"",VLOOKUP(Sheet2!RC[-3],Sheet1!R[1]C[-3]:R[801]C[6],10,FALSE)) ->  | F55: =Sheet1!R71C10 -> 123.43233621398711 | G55: =IF(RC[-3]<0,0,IF(AND(RC[-3]<RC[-1],RC[-3]<2),100,IF(AND(RC[-3]<RC[-1],RC[-3]>=2,RC[-3]<3),95,IF(AND(RC[-3]<RC[-1],RC[-3]>=3,RC[-3]<4),90,IF(AND(RC[-3]<RC[-1],RC[-3]>=4,RC[-3]<5),85,IF(AND(RC[-3]<RC[-1],RC[-3]>=5,RC[-3]<6),80,IF(AND(RC[-3]<RC[-1],RC[-3]>=6,RC[-3]<7),75,IF(AND(RC[-3]<RC[-1],RC[-3]>=7,RC[-3]<8),70,IF(AND(RC[-3]<RC[-1],RC[-3]>=8,RC[-3]<9),65,IF(AND(RC[-3]<RC[-1],RC[-3]>=9,RC[-3]<10),60,IF(AND(RC[-3]<RC[-1],RC[-3]>=10,RC[-3]<11),55,IF(AND(RC[-3]<RC[-1],RC[-3]>=11,RC[-3]<12),50,IF(AND(RC[-3]<RC[-1],RC[-3]>=12,RC[-3]<13),45,IF(AND(RC[-3]<RC[-1],RC[-3]>=13,RC[-3]<14),40,IF(AND(RC[-3]<RC[-1],RC[-3]>=14,RC[-3]<15),35,IF(AND(RC[-3]<RC[-1],RC[-3]>=15,RC[-3]<16),30,IF(AND(RC[-3]<RC[-1],RC[-3]>=16,RC[-3]<17),25,IF(AND(RC[-3]<RC[-1],RC[-3]>=17,RC[-3]<18),20,IF(AND(RC[-3]<RC[-1],RC[-3]>=18,RC[-3]<19),15,IF(AND(RC[-3]<RC[-1],RC[-3]>=19,RC[-3]<20),10,IF(AND(RC[-3]<RC[-1],RC[-3]>=20,RC[-3]<21),5,IF(AND(RC[-3]<RC[-1],RC[-3]>=21),0,IF(AND(RC[-3]>RC[-1],RC[-3]>=2,RC[-3]<3),90,IF(AND(RC[-3]>RC[-1],RC[-3]>=3,RC[-3]<4),90,IF(AND(RC[-3]>RC[-1],RC[-3]>=4,RC[-3]<5),80,IF(AND(RC[-3]>RC[-1],RC[-3]>=5,RC[-3]<6),70,IF(AND(RC[-3]>RC[-1],RC[-3]>=6,RC[-3]<7),60,IF(AND(RC[-3]>RC[-1],RC[-3]>=7,RC[-3]<8),50,IF(AND(RC[-3]>RC[-1],RC[-3]>=8,RC[-3]<9),40,IF(AND(RC[-3]>RC[-1],RC[-3]>=9,RC[-3]<10),30,IF(AND(RC[-3]>RC[-1],RC[-3]>=10,RC[-3]<11),20,IF(AND(RC[-3]>RC[-1],RC[-3]>=11,RC[-3]<12),10,IF(AND(RC[-3]>RC[-1],RC[-3]>=12),0))))))))))))))))))))))))))))))))) -> 50 | H55: =IF(RC[-3]="","",IF(RC[-3]<0.3,100,IF(AND(RC[-3]>=0.3,RC[-3]>0.4),95,IF(AND(RC[-3]>=0.4,RC[-3]<0.5),90,IF(AND(RC[-3]>=0.5,RC[-3]<0.6),85,IF(AND(RC[-3]>=0.6,RC[-3]<0.7),80,IF(AND(RC[-3]>=0.6,RC[-3]<1),80,IF(AND(RC[-3]>1,RC[-3]<2),50,IF(RC[-3]>2,0))))))))) ->  | I55: =IF(RC[-1]="",RC[-2],0.7*RC[-1]+0.3*RC[-2]) -> 50
A56: سر. کوه نور | B56: ثنور | C56: =VLOOKUP(RC[-1],Sheet1!R3C2:R802C3,2,FALSE) -> انبوه سازی املاک و مستغلات | D56: =VLOOKUP(RC[-2],Sheet1!R3C2:R802C9,8,FALSE) -> 1.1802140985143705 | E56: =IF(VLOOKUP(RC[-3],Sheet1!R3C2:R803C11,10,FALSE)=0,"",VLOOKUP(Sheet2!RC[-3],Sheet1!R[1]C[-3]:R[801]C[6],10,FALSE)) ->  | F56: =Sheet1!R71C10 -> 123.43233621398711 | G56: =IF(RC[-3]<0,0,IF(AND(RC[-3]<RC[-1],RC[-3]<2),100,IF(AND(RC[-3]<RC[-1],RC[-3]>=2,RC[-3]<3),95,IF(AND(RC[-3]<RC[-1],RC[-3]>=3,RC[-3]<4),90,IF(AND(RC[-3]<RC[-1],RC[-3]>=4,RC[-3]<5),85,IF(AND(RC[-3]<RC[-1],RC[-3]>=5,RC[-3]<6),80,IF(AND(RC[-3]<RC[-1],RC[-3]>=6,RC[-3]<7),75,IF(AND(RC[-3]<RC[-1],RC[-3]>=7,RC[-3]<8),70,IF(AND(RC[-3]<RC[-1],RC[-3]>=8,RC[-3]<9),65,IF(AND(RC[-3]<RC[-1],RC[-3]>=9,RC[-3]<10),60,IF(AND(RC[-3]<RC[-1],RC[-3]>=10,RC[-3]<11),55,IF(AND(RC[-3]<RC[-1],RC[-3]>=11,RC[-3]<12),50,IF(AND(RC[-3]<RC[-1],RC[-3]>=12,RC[-3]<13),45,IF(AND(RC[-3]<RC[-1],RC[-3]>=13,RC[-3]<14),40,IF(AND(RC[-3]<RC[-1],RC[-3]>=14,RC[-3]<15),35,IF(AND(RC[-3]<RC[-1],RC[-3]>=15,RC[-3]<16),30,IF(AND(RC[-3]<RC[-1],RC[-3]>=16,RC[-3]<17),25,IF(AND(RC[-3]<RC[-1],RC[-3]>=17,RC[-3]<18),20,IF(AND(RC[-3]<RC[-1],RC[-3]>=18,RC[-3]<19),15,IF(AND(RC[-3]<RC[-1],RC[-3]>=19,RC[-3]<20),10,IF(AND(RC[-3]<RC[-1],RC[-3]>=20,RC[-3]<21),5,IF(AND(RC[-3]<RC[-1],RC[-3]>=21),0,IF(AND(RC[-3]>RC[-1],RC[-3]>=2,RC[-3]<3),90,IF(AND(RC[-3]>RC[-1],RC[-3]>=3,RC[-3]<4),90,IF(AND(RC[-3]>RC[-1],RC[-3]>=4,RC[-3]<5),80,IF(AND(RC[-3]>RC[-1],RC[-3]>=5,RC[-3]<6),70,IF(AND(RC[-3]>RC[-1],RC[-3]>=6,RC[-3]<7),60,IF(AND(RC[-3]>RC[-1],RC[-3]>=7,RC[-3]<8),50,IF(AND(RC[-3]>RC[-1],RC[-3]>=8,RC[-3]<9),40,IF(AND(RC[-3]>RC[-1],RC[-3]>=9,RC[-3]<10),30,IF(AND(RC[-3]>RC[-1],RC[-3]>=10,RC[-3]<11),20,IF(AND(RC[-3]>RC[-1],RC[-3]>=11,RC[-3]<12),10,IF(AND(RC[-3]>RC[-1],RC[-3]>=12),0))))))))))))))))))))))))))))))))) -> 100 | H56: =IF(RC[-3]="","",IF(RC[-3]<0.3,100,IF(AND(RC[-3]>=0.3,RC[-3]>0.4),95,IF(AND(RC[-3]>=0.4,RC[-3]<0.5),90,IF(AND(RC[-3]>=0.5,RC[-3]<0.6),85,IF(AND(RC[-3]>=0.6,RC[-3]<0.7),80,IF(AND(RC[-3]>=0.6,RC[-3]<1),80,IF(AND(RC[-3]>1,RC[-3]<2),50,IF(RC[-3]>2,0))))))))) ->  | I56: =IF(RC[-1]="",RC[-2],0.7*RC[-1]+0.3*RC[-2]) -> 100
A57: شهر سازی و خانه سازی باغمیشه | B57: ثباغ | C57: =VLOOKUP(RC[-1],Sheet1!R3C2:R802C3,2,FALSE) -> انبوه سازی املاک و مستغلات | D57: =VLOOKUP(RC[-2],Sheet1!R3C2:R802C9,8,FALSE) -> 9.1717015620068345 | E57: =IF(VLOOKUP(RC[-3],Sheet1!R3C2:R803C11,10,FALSE)=0,"",VLOOKUP(Sheet2!RC[-3],Sheet1!R[1]C[-3]:R[801]C[6],10,FALSE)) ->  | F57: =Sheet1!R71C10 -> 123.43233621398711 | G57: =IF(RC[-3]<0,0,IF(AND(RC[-3]<RC[-1],RC[-3]<2),100,IF(AND(RC[-3]<RC[-1],RC[-3]>=2,RC[-3]<3),95,IF(AND(RC[-3]<RC[-1],RC[-3]>=3,RC[-3]<4),90,IF(AND(RC[-3]<RC[-1],RC[-3]>=4,RC[-3]<5),85,IF(AND(RC[-3]<RC[-1],RC[-3]>=5,RC[-3]<6),80,IF(AND(RC[-3]<RC[-1],RC[-3]>=6,RC[-3]<7),75,IF(AND(RC[-3]<RC[-1],RC[-3]>=7,RC[-3]<8),70,IF(AND(RC[-3]<RC[-1],RC[-3]>=8,RC[-3]<9),65,IF(AND(RC[-3]<RC[-1],RC[-3]>=9,RC[-3]<10),60,IF(AND(RC[-3]<RC[-1],RC[-3]>=10,RC[-3]<11),55,IF(AND(RC[-3]<RC[-1],RC[-3]>=11,RC[-3]<12),50,IF(AND(RC[-3]<RC[-1],RC[-3]>=12,RC[-3]<13),45,IF(AND(RC[-3]<RC[-1],RC[-3]>=13,RC[-3]<14),40,IF(AND(RC[-3]<RC[-1],RC[-3]>=14,RC[-3]<15),35,IF(AND(RC[-3]<RC[-1],RC[-3]>=15,RC[-3]<16),30,IF(AND(RC[-3]<RC[-1],RC[-3]>=16,RC[-3]<17),25,IF(AND(RC[-3]<RC[-1],RC[-3]>=17,RC[-3]<18),20,IF(AND(RC[-3]<RC[-1],RC[-3]>=18,RC[-3]<19),15,IF(AND(RC[-3]<RC[-1],RC[-3]>=19,RC[-3]<20),10,IF(AND(RC[-3]<RC[-1],RC[-3]>=20,RC[-3]<21),5,IF(AND(RC[-3]<RC[-1],RC[-3]>=21),0,IF(AND(RC[-3]>RC[-1],RC[-3]>=2,RC[-3]<3),90,IF(AND(RC[-3]>RC[-1],RC[-3]>=3,RC[-3]<4),90,IF(AND(RC[-3]>RC[-1],RC[-3]>=4,RC[-3]<5),80,IF(AND(RC[-3]>RC[-1],RC[-3]>=5,RC[-3]<6),70,IF(AND(RC[-3]>RC[-1],RC[-3]>=6,RC[-3]<7),60,IF(AND(RC[-3]>RC[-1],RC[-3]>=7,RC[-3]<8),50,IF(AND(RC[-3]>RC[-1],RC[-3]>=8,RC[-3]<9),40,IF(AND(RC[-3]>RC[-1],RC[-3]>=9,RC[-3]<10),30,IF(AND(RC[-3]>RC[-1],RC[-3]>=10,RC[-3]<11),20,IF(AND(RC[-3]>RC[-1],RC[-3]>=11,RC[-3]<12),10,IF(AND(RC[-3]>RC[-1],RC[-3]>=12),0))))))))))))))))))))))))))))))))) -> 60 | H57: =IF(RC[-3]="","",IF(RC[-3]<0.3,100,IF(AND(RC[-3]>=0.3,RC[-3]>0.4),95,IF(AND(RC[-3]>=0.4,RC[-3]<0.5),90,IF(AND(RC[-3]>=0.5,RC[-3]<0.6),85,IF(AND(RC[-3]>=0.6,RC[-3]<0.7),80,IF(AND(RC[-3]>=0.6,RC[-3]<1),80,IF(AND(RC[-3]>1,RC[-3]<2),50,IF(RC[-3]>2,0))))))))) ->  | I57: =IF(RC[-1]="",RC[-2],0.7*RC[-1]+0.3*RC[-2]) -> 60
A58: عمران و توسعه شاهد | B58: ثعمرا | C58: =VLOOKUP(RC[-1],Sheet1!R3C2:R802C3,2,FALSE) -> انبوه سازی املاک و مستغلات | D58: =VLOOKUP(RC[-2],Sheet1!R3C2:R802C9,8,FALSE) -> 8.4923242921670035 | E58: =IF(VLOOKUP(RC[-3],Sheet1!R3C2:R803C11,10,FALSE)=0,"",VLOOKUP(Sheet2!RC[-3],Sheet1!R[1]C[-3]:R[801]C[6],10,FALSE)) ->  | F58: =Sheet1!R71C10 -> 123.43233621398711 | G58: =IF(RC[-3]<0,0,IF(AND(RC[-3]<RC[-1],RC[-3]<2),100,IF(AND(RC[-3]<RC[-1],RC[-3]>=2,RC[-3]<3),95,IF(AND(RC[-3]<RC[-1],RC[-3]>=3,RC[-3]<4),90,IF(AND(RC[-3]<RC[-1],RC[-3]>=4,RC[-3]<5),85,IF(AND(RC[-3]<RC[-1],RC[-3]>=5,RC[-3]<6),80,IF(AND(RC[-3]<RC[-1],RC[-3]>=6,RC[-3]<7),75,IF(AND(RC[-3]<RC[-1],RC[-3]>=7,RC[-3]<8),70,IF(AND(RC[-3]<RC[-1],RC[-3]>=8,RC[-3]<9),65,IF(AND(RC[-3]<RC[-1],RC[-3]>=9,RC[-3]<10),60,IF(AND(RC[-3]<RC[-1],RC[-3]>=10,RC[-3]<11),55,IF(AND(RC[-3]<RC[-1],RC[-3]>=11,RC[-3]<12),50,IF(AND(RC[-3]<RC[-1],RC[-3]>=12,RC[-3]<13),45,IF(AND(RC[-3]<RC[-1],RC[-3]>=13,RC[-3]<14),40,IF(AND(RC[-3]<RC[-1],RC[-3]>=14,RC[-3]<15),35,IF(AND(RC[-3]<RC[-1],RC[-3]>=15,RC[-3]<16),30,IF(AND(RC[-3]<RC[-1],RC[-3]>=16,RC[-3]<17),25,IF(AND(RC[-3]<RC[-1],RC[-3]>=17,RC[-3]<18),20,IF(AND(RC[-3]<RC[-1],RC[-3]>=18,RC[-3]<19),15,IF(AND(RC[-3]<RC[-1],RC[-3]>=19,RC[-3]<20),10,IF(AND(RC[-3]<RC[-1],RC[-3]>=20,RC[-3]<21),5,IF(AND(RC[-3]<RC[-1],RC[-3]>=21),0,IF(AND(RC[-3]>RC[-1],RC[-3]>=2,RC[-3]<3),90,IF(AND(RC[-3]>RC[-1],RC[-3]>=3,RC[-3]<4),90,IF(AND(RC[-3]>RC[-1],RC[-3]>=4,RC[-3]<5),80,IF(AND(RC[-3]>RC[-1],RC[-3]>=5,RC[-3]<6),70,IF(AND(RC[-3]>RC[-1],RC[-3]>=6,RC[-3]<7),60,IF(AND(RC[-3]>RC[-1],RC[-3]>=7,RC[-3]<8),50,IF(AND(RC[-3]>RC[-1],RC[-3]>=8,RC[-3]<9),40,IF(AND(RC[-3]>RC[-1],RC[-3]>=9,RC[-3]<10),30,IF(AND(RC[-3]>RC[-1],RC[-3]>=10,RC[-3]<11),20,IF(AND(RC[-3]>RC[-1],RC[-3]>=11,RC[-3]<12),10,IF(AND(RC[-3]>RC[-1],RC[-3]>=12),0))))))))))))))))))))))))))))))))) -> 65 | H58: =IF(RC[-3]="","",IF(RC[-3]<0.3,100,IF(AND(RC[-3]>=0.3,RC[-3]>0.4),95,IF(AND(RC[-3]>=0.4,RC[-3]<0.5),90,IF(AND(RC[-3]>=0.5,RC[-3]<0.6),85,IF(AND(RC[-3]>=0.6,RC[-3]<0.7),80,IF(AND(RC[-3]>=0.6,RC[-3]<1),80,IF(AND(RC[-3]>1,RC[-3]<2),50,IF(RC[-3]>2,0))))))))) ->  | I58: =IF(RC[-1]="",RC[-2],0.7*RC[-1]+0.3*RC[-2]) -> 65
A59: عمران و توسعه فارس | B59: ثفارس | C59: =VLOOKUP(RC[-1],Sheet1!R3C2:R802C3,2,FALSE) -> انبوه سازی املاک و مستغلات | D59: =VLOOKUP(RC[-2],Sheet1!R3C2:R802C9,8,FALSE) -> 83.038407382250369 | E59: =IF(VLOOKUP(RC[-3],Sheet1!R3C2:R803C11,10,FALSE)=0,"",VLOOKUP(Sheet2!RC[-3],Sheet1!R[1]C[-3]:R[801]C[6],10,FALSE)) ->  | F59: =Sheet1!R71C10 -> 123.43233621398711 | G59: =IF(RC[-3]<0,0,IF(AND(RC[-3]<RC[-1],RC[-3]<2),100,IF(AND(RC[-3]<RC[-1],RC[-3]>=2,RC[-3]<3),95,IF(AND(RC[-3]<RC[-1],RC[-3]>=3,RC[-3]<4),90,IF(AND(RC[-3]<RC[-1],RC[-3]>=4,RC[-3]<5),85,IF(AND(RC[-3]<RC[-1],RC[-3]>=5,RC[-3]<6),80,IF(AND(RC[-3]<RC[-1],RC[-3]>=6,RC[-3]<7),75,IF(AND(RC[-3]<RC[-1],RC[-3]>=7,RC[-3]<8),70,IF(AND(RC[-3]<RC[-1],RC[-3]>=8,RC[-3]<9),65,IF(AND(RC[-3]<RC[-1],RC[-3]>=9,RC[-3]<10),60,IF(AND(RC[-3]<RC[-1],RC[-3]>=10,RC[-3]<11),55,IF(AND(RC[-3]<RC[-1],RC[-3]>=11,RC[-3]<12),50,IF(AND(RC[-3]<RC[-1],RC[-3]>=12,RC[-3]<13),45,IF(AND(RC[-3]<RC[-1],RC[-3]>=13,RC[-3]<14),40,IF(AND(RC[-3]<RC[-1],RC[-3]>=14,RC[-3]<15),35,IF(AND(RC[-3]<RC[-1],RC[-3]>=15,RC[-3]<16),30,IF(AND(RC[-3]<RC[-1],RC[-3]>=16,RC[-3]<17),25,IF(AND(RC[-3]<RC[-1],RC[-3]>=17,RC[-3]<18),20,IF(AND(RC[-3]<RC[-1],RC[-3]>=18,RC[-3]<19),15,IF(AND(RC[-3]<RC[-1],RC[-3]>=19,RC[-3]<20),10,IF(AND(RC[-3]<RC[-1],RC[-3]>=20,RC[-3]<21),5,IF(AND(RC[-3]<RC[-1],RC[-3]>=21),0,IF(AND(RC[-3]>RC[-1],RC[-3]>=2,RC[-3]<3),90,IF(AND(RC[-3]>RC[-1],RC[-3]>=3,RC[-3]<4),90,IF(AND(RC[-3]>RC[-1],RC[-3]>=4,RC[-3]<5),80,IF(AND(RC[-3]>RC[-1],RC[-3]>=5,RC[-3]<6),70,IF(AND(RC[-3]>RC[-1],RC[-3]>=6,RC[-3]<7),60,IF(AND(RC[-3]>RC[-1],RC[-3]>=7,RC[-3]<8),50,IF(AND(RC[-3]>RC[-1],RC[-3]>=8,RC[-3]<9),40,IF(AND(RC[-3]>RC[-1],RC[-3]>=9,RC[-3]<10),30,IF(AND(RC[-3]>RC[-1],RC[-3]>=10,RC[-3]<11),20,IF(AND(RC[-3]>RC[-1],RC[-3]>=11,RC[-3]<12),10,IF(AND(RC[-3]>RC[-1],RC[-3]>=12),0))))))))))))))))))))))))))))))))) -> 0 | H59: =IF(RC[-3]="","",IF(RC[-3]<0.3,100,IF(AND(RC[-3]>=0.3,RC[-3]>0.4),95,IF(AND(RC[-3]>=0.4,RC[-3]<0.5),90,IF(AND(RC[-3]>=0.5,RC[-3]<0.6),85,IF(AND(RC[-3]>=0.6,RC[-3]<0.7),80,IF(AND(RC[-3]>=0.6,RC[-3]<1),80,IF(AND(RC[-3]>1,RC[-3]<2),50,IF(RC[-3]>2,0))))))))) ->  | I59: =IF(RC[-1]="",RC[-2],0.7*RC[-1]+0.3*RC[-2]) -> 0
A60: عمران و سازندگی استان قزوین | B60: ثقزوی | C60: =VLOOKUP(RC[-1],Sheet1!R3C2:R802C3,2,FALSE) -> انبوه سازی املاک و مستغلات | D60: =VLOOKUP(RC[-2],Sheet1!R3C2:R802C9,8,FALSE) -> -26.659420289855074 | E60: =IF(VLOOKUP(RC[-3],Sheet1!R3C2:R803C11,10,FALSE)=0,"",VLOOKUP(Sheet2!RC[-3],Sheet1!R[1]C[-3]:R[801]C[6],10,FALSE)) ->  | F60: =Sheet1!R71C10 -> 123.43233621398711 | G60: =IF(RC[-3]<0,0,IF(AND(RC[-3]<RC[-1],RC[-3]<2),100,IF(AND(RC[-3]<RC[-1],RC[-3]>=2,RC[-3]<3),95,IF(AND(RC[-3]<RC[-1],RC[-3]>=3,RC[-3]<4),90,IF(AND(RC[-3]<RC[-1],RC[-3]>=4,RC[-3]<5),85,IF(AND(RC[-3]<RC[-1],RC[-3]>=5,RC[-3]<6),80,IF(AND(RC[-3]<RC[-1],RC[-3]>=6,RC[-3]<7),75,IF(AND(RC[-3]<RC[-1],RC[-3]>=7,RC[-3]<8),70,IF(AND(RC[-3]<RC[-1],RC[-3]>=8,RC[-3]<9),65,IF(AND(RC[-3]<RC[-1],RC[-3]>=9,RC[-3]<10),60,IF(AND(RC[-3]<RC[-1],RC[-3]>=10,RC[-3]<11),55,IF(AND(RC[-3]<RC[-1],RC[-3]>=11,RC[-3]<12),50,IF(AND(RC[-3]<RC[-1],RC[-3]>=12,RC[-3]<13),45,IF(AND(RC[-3]<RC[-1],RC[-3]>=13,RC[-3]<14),40,IF(AND(RC[-3]<RC[-1],RC[-3]>=14,RC[-3]<15),35,IF(AND(RC[-3]<RC[-1],RC[-3]>=15,RC[-3]<16),30,IF(AND(RC[-3]<RC[-1],RC[-3]>=16,RC[-3]<17),25,IF(AND(RC[-3]<RC[-1],RC[-3]>=17,RC[-3]<18),20,IF(AND(RC[-3]<RC[-1],RC[-3]>=18,RC[-3]<19),15,IF(AND(RC[-3]<RC[-1],RC[-3]>=19,RC[-3]<20),10,IF(AND(RC[-3]<RC[-1],RC[-3]>=20,RC[-3]<21),5,IF(AND(RC[-3]<RC[-1],RC[-3]>=21),0,IF(AND(RC[-3]>RC[-1],RC[-3]>=2,RC[-3]<3),90,IF(AND(RC[-3]>RC[-1],RC[-3]>=3,RC[-3]<4),90,IF(AND(RC[-3]>RC[-1],RC[-3]>=4,RC[-3]<5),80,IF(AND(RC[-3]>RC[-1],RC[-3]>=5,RC[-3]<6),70,IF(AND(RC[-3]>RC[-1],RC[-3]>=6,RC[-3]<7),60,IF(AND(RC[-3]>RC[-1],RC[-3]>=7,RC[-3]<8),50,IF(AND(RC[-3]>RC[-1],RC[-3]>=8,RC[-3]<9),40,IF(AND(RC[-3]>RC[-1],RC[-3]>=9,RC[-3]<10),30,IF(AND(RC[-3]>RC[-1],RC[-3]>=10,RC[-3]<11),20,IF(AND(RC[-3]>RC[-1],RC[-3]>=11,RC[-3]<12),10,IF(AND(RC[-3]>RC[-1],RC[-3]>=12),0))))))))))))))))))))))))))))))))) -> 0 | H60: =IF(RC[-3]="","",IF(RC[-3]<0.3,100,IF(AND(RC[-3]>=0.3,RC[-3]>0.4),95,IF(AND(RC[-3]>=0.4,RC[-3]<0.5),90,IF(AND(RC[-3]>=0.5,RC[-3]<0.6),85,IF(AND(RC[-3]>=0.6,RC[-3]<0.7),80,IF(AND(RC[-3]>=0.6,RC[-3]<1),80,IF(AND(RC[-3]>1,RC[-3]<2),50,IF(RC[-3]>2,0))))))))) ->  | I60: =IF(RC[-1]="",RC[-2],0.7*RC[-1]+0.3*RC[-2]) -> 0
A61: نوسازی و ساختمان تهران | B61: ثنوسا | C61: =VLOOKUP(RC[-1],Sheet1!R3C2:R802C3,2,FALSE) -> انبوه سازی املاک و مستغلات | D61: =VLOOKUP(RC[-2],Sheet1!R3C2:R802C9,8,FALSE) -> -90.87 | E61: =IF(VLOOKUP(RC[-3],Sheet1!R3C2:R803C11,10,FALSE)=0,"",VLOOKUP(Sheet2!RC[-3],Sheet1!R[1]C[-3]:R[801]C[6],10,FALSE)) ->  | F61: =Sheet1!R71C10 -> 123.43233621398711 | G61: =IF(RC[-3]<0,0,IF(AND(RC[-3]<RC[-1],RC[-3]<2),100,IF(AND(RC[-3]<RC[-1],RC[-3]>=2,RC[-3]<3),95,IF(AND(RC[-3]<RC[-1],RC[-3]>=3,RC[-3]<4),90,IF(AND(RC[-3]<RC[-1],RC[-3]>=4,RC[-3]<5),85,IF(AND(RC[-3]<RC[-1],RC[-3]>=5,RC[-3]<6),80,IF(AND(RC[-3]<RC[-1],RC[-3]>=6,RC[-3]<7),75,IF(AND(RC[-3]<RC[-1],RC[-3]>=7,RC[-3]<8),70,IF(AND(RC[-3]<RC[-1],RC[-3]>=8,RC[-3]<9),65,IF(AND(RC[-3]<RC[-1],RC[-3]>=9,RC[-3]<10),60,IF(AND(RC[-3]<RC[-1],RC[-3]>=10,RC[-3]<11),55,IF(AND(RC[-3]<RC[-1],RC[-3]>=11,RC[-3]<12),50,IF(AND(RC[-3]<RC[-1],RC[-3]>=12,RC[-3]<13),45,IF(AND(RC[-3]<RC[-1],RC[-3]>=13,RC[-3]<14),40,IF(AND(RC[-3]<RC[-1],RC[-3]>=14,RC[-3]<15),35,IF(AND(RC[-3]<RC[-1],RC[-3]>=15,RC[-3]<16),30,IF(AND(RC[-3]<RC[-1],RC[-3]>=16,RC[-3]<17),25,IF(AND(RC[-3]<RC[-1],RC[-3]>=17,RC[-3]<18),20,IF(AND(RC[-3]<RC[-1],RC[-3]>=18,RC[-3]<19),15,IF(AND(RC[-3]<RC[-1],RC[-3]>=19,RC[-3]<20),10,IF(AND(RC[-3]<RC[-1],RC[-3]>=20,RC[-3]<21),5,IF(AND(RC[-3]<RC[-1],RC[-3]>=21),0,IF(AND(RC[-3]>RC[-1],RC[-3]>=2,RC[-3]<3),90,IF(AND(RC[-3]>RC[-1],RC[-3]>=3,RC[-3]<4),90,IF(AND(RC[-3]>RC[-1],RC[-3]>=4,RC[-3]<5),80,IF(AND(RC[-3]>RC[-1],RC[-3]>=5,RC[-3]<6),70,IF(AND(RC[-3]>RC[-1],RC[-3]>=6,RC[-3]<7),60,IF(AND(RC[-3]>RC[-1],RC[-3]>=7,RC[-3]<8),50,IF(AND(RC[-3]>RC[-1],RC[-3]>=8,RC[-3]<9),40,IF(AND(RC[-3]>RC[-1],RC[-3]>=9,RC[-3]<10),30,IF(AND(RC[-3]>RC[-1],RC[-3]>=10,RC[-3]<11),20,IF(AND(RC[-3]>RC[-1],RC[-3]>=11,RC[-3]<12),10,IF(AND(RC[-3]>RC[-1],RC[-3]>=12),0))))))))))))))))))))))))))))))))) -> 0 | H61: =IF(RC[-3]="","",IF(RC[-3]<0.3,100,IF(AND(RC[-3]>=0.3,RC[-3]>0.4),95,IF(AND(RC[-3]>=0.4,RC[-3]<0.5),90,IF(AND(RC[-3]>=0.5,RC[-3]<0.6),85,IF(AND(RC[-3]>=0.6,RC[-3]<0.7),80,IF(AND(RC[-3]>=0.6,RC[-3]<1),80,IF(AND(RC[-3]>1,RC[-3]<2),50,IF(RC[-3]>2,0))))))))) ->  | I61: =IF(RC[-1]="",RC[-2],0.7*RC[-1]+0.3*RC[-2]) -> 0
A62: کیسون | B62: کیسون | C62: =VLOOKUP(RC[-1],Sheet1!R3C2:R802C3,2,FALSE) -> انبوه سازی املاک و مستغلات | D62: =VLOOKUP(RC[-2],Sheet1!R3C2:R802C9,8,FALSE) -> 9.2129145575350009 | E62: =IF(VLOOKUP(RC[-3],Sheet1!R3C2:R803C11,10,FALSE)=0,"",VLOOKUP(Sheet2!RC[-3],Sheet1!R[1]C[-3]:R[801]C[6],10,FALSE)) ->  | F62: =Sheet1!R71C10 -> 123.43233621398711 | G62: =IF(RC[-3]<0,0,IF(AND(RC[-3]<RC[-1],RC[-3]<2),100,IF(AND(RC[-3]<RC[-1],RC[-3]>=2,RC[-3]<3),95,IF(AND(RC[-3]<RC[-1],RC[-3]>=3,RC[-3]<4),90,IF(AND(RC[-3]<RC[-1],RC[-3]>=4,RC[-3]<5),85,IF(AND(RC[-3]<RC[-1],RC[-3]>=5,RC[-3]<6),80,IF(AND(RC[-3]<RC[-1],RC[-3]>=6,RC[-3]<7),75,IF(AND(RC[-3]<RC[-1],RC[-3]>=7,RC[-3]<8),70,IF(AND(RC[-3]<RC[-1],RC[-3]>=8,RC[-3]<9),65,IF(AND(RC[-3]<RC[-1],RC[-3]>=9,RC[-3]<10),60,IF(AND(RC[-3]<RC[-1],RC[-3]>=10,RC[-3]<11),55,IF(AND(RC[-3]<RC[-1],RC[-3]>=11,RC[-3]<12),50,IF(AND(RC[-3]<RC[-1],RC[-3]>=12,RC[-3]<13),45,IF(AND(RC[-3]<RC[-1],RC[-3]>=13,RC[-3]<14),40,IF(AND(RC[-3]<RC[-1],RC[-3]>=14,RC[-3]<15),35,IF(AND(RC[-3]<RC[-1],RC[-3]>=15,RC[-3]<16),30,IF(AND(RC[-3]<RC[-1],RC[-3]>=16,RC[-3]<17),25,IF(AND(RC[-3]<RC[-1],RC[-3]>=17,RC[-3]<18),20,IF(AND(RC[-3]<RC[-1],RC[-3]>=18,RC[-3]<19),15,IF(AND(RC[-3]<RC[-1],RC[-3]>=19,RC[-3]<20),10,IF(AND(RC[-3]<RC[-1],RC[-3]>=20,RC[-3]<21),5,IF(AND(RC[-3]<RC[-1],RC[-3]>=21),0,IF(AND(RC[-3]>RC[-1],RC[-3]>=2,RC[-3]<3),90,IF(AND(RC[-3]>RC[-1],RC[-3]>=3,RC[-3]<4),90,IF(AND(RC[-3]>RC[-1],RC[-3]>=4,RC[-3]<5),80,IF(AND(RC[-3]>RC[-1],RC[-3]>=5,RC[-3]<6),70,IF(AND(RC[-3]>RC[-1],RC[-3]>=6,RC[-3]<7),60,IF(AND(RC[-3]>RC[-1],RC[-3]>=7,RC[-3]<8),50,IF(AND(RC[-3]>RC[-1],RC[-3]>=8,RC[-3]<9),40,IF(AND(RC[-3]>RC[-1],RC[-3]>=9,RC[-3]<10),30,IF(AND(RC[-3]>RC[-1],RC[-3]>=10,RC[-3]<11),20,IF(AND(RC[-3]>RC[-1],RC[-3]>=11,RC[-3]<12),10,IF(AND(RC[-3]>RC[-1],RC[-3]>=12),0))))))))))))))))))))))))))))))))) -> 60 | H62: =IF(RC[-3]="","",IF(RC[-3]<0.3,100,IF(AND(RC[-3]>=0.3,RC[-3]>0.4),95,IF(AND(RC[-3]>=0.4,RC[-3]<0.5),90,IF(AND(RC[-3]>=0.5,RC[-3]<0.6),85,IF(AND(RC[-3]>=0.6,RC[-3]<0.7),80,IF(AND(RC[-3]>=0.6,RC[-3]<1),80,IF(AND(RC[-3]>1,RC[-3]<2),50,IF(RC[-3]>2,0))))))))) ->  | I62: =IF(RC[-1]="",RC[-2],0.7*RC[-1]+0.3*RC[-2]) -> 60
A63: اعتباری توسعه | B63: توسعه | C63: =VLOOKUP(RC[-1],Sheet1!R3C2:R802C3,2,FALSE) -> بانکها و موسسات اعتباری | D63: =VLOOKUP(RC[-2],Sheet1!R3C2:R802C9,8,FALSE) -> 12.614642857142858 | E63: =IF(VLOOKUP(RC[-3],Sheet1!R3C2:R803C11,10,FALSE)=0,"",VLOOKUP(Sheet2!RC[-3],Sheet1!R[1]C[-3]:R[801]C[6],10,FALSE)) ->  | F63: =Sheet1!R92C10 -> 20.170320066255385 | G63: =IF(RC[-3]<0,0,IF(AND(RC[-3]<RC[-1],RC[-3]<2),100,IF(AND(RC[-3]<RC[-1],RC[-3]>=2,RC[-3]<3),95,IF(AND(RC[-3]<RC[-1],RC[-3]>=3,RC[-3]<4),90,IF(AND(RC[-3]<RC[-1],RC[-3]>=4,RC[-3]<5),85,IF(AND(RC[-3]<RC[-1],RC[-3]>=5,RC[-3]<6),80,IF(AND(RC[-3]<RC[-1],RC[-3]>=6,RC[-3]<7),75,IF(AND(RC[-3]<RC[-1],RC[-3]>=7,RC[-3]<8),70,IF(AND(RC[-3]<RC[-1],RC[-3]>=8,RC[-3]<9),65,IF(AND(RC[-3]<RC[-1],RC[-3]>=9,RC[-3]<10),60,IF(AND(RC[-3]<RC[-1],RC[-3]>=10,RC[-3]<11),55,IF(AND(RC[-3]<RC[-1],RC[-3]>=11,RC[-3]<12),50,IF(AND(RC[-3]<RC[-1],RC[-3]>=12,RC[-3]<13),45,IF(AND(RC[-3]<RC[-1],RC[-3]>=13,RC[-3]<14),40,IF(AND(RC[-3]<RC[-1],RC[-3]>=14,RC[-3]<15),35,IF(AND(RC[-3]<RC[-1],RC[-3]>=15,RC[-3]<16),30,IF(AND(RC[-3]<RC[-1],RC[-3]>=16,RC[-3]<17),25,IF(AND(RC[-3]<RC[-1],RC[-3]>=17,RC[-3]<18),20,IF(AND(RC[-3]<RC[-1],RC[-3]>=18,RC[-3]<19),15,IF(AND(RC[-3]<RC[-1],RC[-3]>=19,RC[-3]<20),10,IF(AND(RC[-3]<RC[-1],RC[-3]>=20,RC[-3]<21),5,IF(AND(RC[-3]<RC[-1],RC[-3]>=21),0,IF(AND(RC[-3]>RC[-1],RC[-3]>=2,RC[-3]<3),90,IF(AND(RC[-3]>RC[-1],RC[-3]>=3,RC[-3]<4),90,IF(AND(RC[-3]>RC[-1],RC[-3]>=4,RC[-3]<5),80,IF(AND(RC[-3]>RC[-1],RC[-3]>=5,RC[-3]<6),70,IF(AND(RC[-3]>RC[-1],RC[-3]>=6,RC[-3]<7),60,IF(AND(RC[-3]>RC[-1],RC[-3]>=7,RC[-3]<8),50,IF(AND(RC[-3]>RC[-1],RC[-3]>=8,RC[-3]<9),40,IF(AND(RC[-3]>RC[-1],RC[-3]>=9,RC[-3]<10),30,IF(AND(RC[-3]>RC[-1],RC[-3]>=10,RC[-3]<11),20,IF(AND(RC[-3]>RC[-1],RC[-3]>=11,RC[-3]<12),10,IF(AND(RC[-3]>RC[-1],RC[-3]>=12),0))))))))))))))))))))))))))))))))) -> 45 | H63: =IF(RC[-3]="","",IF(RC[-3]<0.3,100,IF(AND(RC[-3]>=0.3,RC[-3]>0.4),95,IF(AND(RC[-3]>=0.4,RC[-3]<0.5),90,IF(AND(RC[-3]>=0.5,RC[-3]<0.6),85,IF(AND(RC[-3]>=0.6,RC[-3]<0.7),80,IF(AND(RC[-3]>=0.6,RC[-3]<1),80,IF(AND(RC[-3]>1,RC[-3]<2),50,IF(RC[-3]>2,0))))))))) ->  | I63: =IF(RC[-1]="",RC[-2],0.7*RC[-1]+0.3*RC[-2]) -> 45
A64: اعتباری ملل | B64: وملل | C64: =VLOOKUP(RC[-1],Sheet1!R3C2:R802C3,2,FALSE) -> بانکها و موسسات اعتباری | D64: =VLOOKUP(RC[-2],Sheet1!R3C2:R802C9,8,FALSE) -> -0.55865654862282188 | E64: =IF(VLOOKUP(RC[-3],Sheet1!R3C2:R803C11,10,FALSE)=0,"",VLOOKUP(Sheet2!RC[-3],Sheet1!R[1]C[-3]:R[801]C[6],10,FALSE)) ->  | F64: =Sheet1!R92C10 -> 20.170320066255385 | G64: =IF(RC[-3]<0,0,IF(AND(RC[-3]<RC[-1],RC[-3]<2),100,IF(AND(RC[-3]<RC[-1],RC[-3]>=2,RC[-3]<3),95,IF(AND(RC[-3]<RC[-1],RC[-3]>=3,RC[-3]<4),90,IF(AND(RC[-3]<RC[-1],RC[-3]>=4,RC[-3]<5),85,IF(AND(RC[-3]<RC[-1],RC[-3]>=5,RC[-3]<6),80,IF(AND(RC[-3]<RC[-1],RC[-3]>=6,RC[-3]<7),75,IF(AND(RC[-3]<RC[-1],RC[-3]>=7,RC[-3]<8),70,IF(AND(RC[-3]<RC[-1],RC[-3]>=8,RC[-3]<9),65,IF(AND(RC[-3]<RC[-1],RC[-3]>=9,RC[-3]<10),60,IF(AND(RC[-3]<RC[-1],RC[-3]>=10,RC[-3]<11),55,IF(AND(RC[-3]<RC[-1],RC[-3]>=11,RC[-3]<12),50,IF(AND(RC[-3]<RC[-1],RC[-3]>=12,RC[-3]<13),45,IF(AND(RC[-3]<RC[-1],RC[-3]>=13,RC[-3]<14),40,IF(AND(RC[-3]<RC[-1],RC[-3]>=14,RC[-3]<15),35,IF(AND(RC[-3]<RC[-1],RC[-3]>=15,RC[-3]<16),30,IF(AND(RC[-3]<RC[-1],RC[-3]>=16,RC[-3]<17),25,IF(AND(RC[-3]<RC[-1],RC[-3]>=17,RC[-3]<18),20,IF(AND(RC[-3]<RC[-1],RC[-3]>=18,RC[-3]<19),15,IF(AND(RC[-3]<RC[-1],RC[-3]>=19,RC[-3]<20),10,IF(AND(RC[-3]<RC[-1],RC[-3]>=20,RC[-3]<21),5,IF(AND(RC[-3]<RC[-1],RC[-3]>=21),0,IF(AND(RC[-3]>RC[-1],RC[-3]>=2,RC[-3]<3),90,IF(AND(RC[-3]>RC[-1],RC[-3]>=3,RC[-3]<4),90,IF(AND(RC[-3]>RC[-1],RC[-3]>=4,RC[-3]<5),80,IF(AND(RC[-3]>RC[-1],RC[-3]>=5,RC[-3]<6),70,IF(AND(RC[-3]>RC[-1],RC[-3]>=6,RC[-3]<7),60,IF(AND(RC[-3]>RC[-1],RC[-3]>=7,RC[-3]<8),50,IF(AND(RC[-3]>RC[-1],RC[-3]>=8,RC[-3]<9),40,IF(AND(RC[-3]>RC[-1],RC[-3]>=9,RC[-3]<10),30,IF(AND(RC[-3]>RC[-1],RC[-3]>=10,RC[-3]<11),20,IF(AND(RC[-3]>RC[-1],RC[-3]>=11,RC[-3]<12),10,IF(AND(RC[-3]>RC[-1],RC[-3]>=12),0))))))))))))))))))))))))))))))))) -> 0 | H64: =IF(RC[-3]="","",IF(RC[-3]<0.3,100,IF(AND(RC[-3]>=0.3,RC[-3]>0.4),95,IF(AND(RC[-3]>=0.4,RC[-3]<0.5),90,IF(AND(RC[-3]>=0.5,RC[-3]<0.6),85,IF(AND(RC[-3]>=0.6,RC[-3]<0.7),80,IF(AND(RC[-3]>=0.6,RC[-3]<1),80,IF(AND(RC[-3]>1,RC[-3]<2),50,IF(RC[-3]>2,0))))))))) ->  | I64: =IF(RC[-1]="",RC[-2],0.7*RC[-1]+0.3*RC[-2]) -> 0
A65: بانک آینده | B65: وآیند | C65: =VLOOKUP(RC[-1],Sheet1!R3C2:R802C3,2,FALSE) -> بانکها و موسسات اعتباری | D65: =VLOOKUP(RC[-2],Sheet1!R3C2:R802C9,8,FALSE) -> 76.208720930232559 | E65: =IF(VLOOKUP(RC[-3],Sheet1!R3C2:R803C11,10,FALSE)=0,"",VLOOKUP(Sheet2!RC[-3],Sheet1!R[1]C[-3]:R[801]C[6],10,FALSE)) ->  | F65: =Sheet1!R92C10 -> 20.170320066255385 | G65: =IF(RC[-3]<0,0,IF(AND(RC[-3]<RC[-1],RC[-3]<2),100,IF(AND(RC[-3]<RC[-1],RC[-3]>=2,RC[-3]<3),95,IF(AND(RC[-3]<RC[-1],RC[-3]>=3,RC[-3]<4),90,IF(AND(RC[-3]<RC[-1],RC[-3]>=4,RC[-3]<5),85,IF(AND(RC[-3]<RC[-1],RC[-3]>=5,RC[-3]<6),80,IF(AND(RC[-3]<RC[-1],RC[-3]>=6,RC[-3]<7),75,IF(AND(RC[-3]<RC[-1],RC[-3]>=7,RC[-3]<8),70,IF(AND(RC[-3]<RC[-1],RC[-3]>=8,RC[-3]<9),65,IF(AND(RC[-3]<RC[-1],RC[-3]>=9,RC[-3]<10),60,IF(AND(RC[-3]<RC[-1],RC[-3]>=10,RC[-3]<11),55,IF(AND(RC[-3]<RC[-1],RC[-3]>=11,RC[-3]<12),50,IF(AND(RC[-3]<RC[-1],RC[-3]>=12,RC[-3]<13),45,IF(AND(RC[-3]<RC[-1],RC[-3]>=13,RC[-3]<14),40,IF(AND(RC[-3]<RC[-1],RC[-3]>=14,RC[-3]<15),35,IF(AND(RC[-3]<RC[-1],RC[-3]>=15,RC[-3]<16),30,IF(AND(RC[-3]<RC[-1],RC[-3]>=16,RC[-3]<17),25,IF(AND(RC[-3]<RC[-1],RC[-3]>=17,RC[-3]<18),20,IF(AND(RC[-3]<RC[-1],RC[-3]>=18,RC[-3]<19),15,IF(AND(RC[-3]<RC[-1],RC[-3]>=19,RC[-3]<20),10,IF(AND(RC[-3]<RC[-1],RC[-3]>=20,RC[-3]<21),5,IF(AND(RC[-3]<RC[-1],RC[-3]>=21),0,IF(AND(RC[-3]>RC[-1],RC[-3]>=2,RC[-3]<3),90,IF(AND(RC[-3]>RC[-1],RC[-3]>=3,RC[-3]<4),90,IF(AND(RC[-3]>RC[-1],RC[-3]>=4,RC[-3]<5),80,IF(AND(RC[-3]>RC[-1],RC[-3]>=5,RC[-3]<6),70,IF(AND(RC[-3]>RC[-1],RC[-3]>=6,RC[-3]<7),60,IF(AND(RC[-3]>RC[-1],RC[-3]>=7,RC[-3]<8),50,IF(AND(RC[-3]>RC[-1],RC[-3]>=8,RC[-3]<9),40,IF(AND(RC[-3]>RC[-1],RC[-3]>=9,RC[-3]<10),30,IF(AND(RC[-3]>RC[-1],RC[-3]>=10,RC[-3]<11),20,IF(AND(RC[-3]>RC[-1],RC[-3]>=11,RC[-3]<12),10,IF(AND(RC[-3]>RC[-1],RC[-3]>=12),0))))))))))))))))))))))))))))))))) -> 0 | H65: =IF(RC[-3]="","",IF(RC[-3]<0.3,100,IF(AND(RC[-3]>=0.3,RC[-3]>0.4),95,IF(AND(RC[-3]>=0.4,RC[-3]<0.5),90,IF(AND(RC[-3]>=0.5,RC[-3]<0.6),85,IF(AND(RC[-3]>=0.6,RC[-3]<0.7),80,IF(AND(RC[-3]>=0.6,RC[-3]<1),80,IF(AND(RC[-3]>1,RC[-3]<2),50,IF(RC[-3]>2,0))))))))) ->  | I65: =IF(RC[-1]="",RC[-2],0.7*RC[-1]+0.3*RC[-2]) -> 0
A66: بانک اقتصاد نوین | B66: ونوین | C66: =VLOOKUP(RC[-1],Sheet1!R3C2:R802C3,2,FALSE) -> بانکها و موسسات اعتباری | D66: =VLOOKUP(RC[-2],Sheet1!R3C2:R802C9,8,FALSE) -> 2.868375887680302 | E66: =IF(VLOOKUP(RC[-3],Sheet1!R3C2:R803C11,10,FALSE)=0,"",VLOOKUP(Sheet2!RC[-3],Sheet1!R[1]C[-3]:R[801]C[6],10,FALSE)) ->  | F66: =Sheet1!R92C10 -> 20.170320066255385 | G66: =IF(RC[-3]<0,0,IF(AND(RC[-3]<RC[-1],RC[-3]<2),100,IF(AND(RC[-3]<RC[-1],RC[-3]>=2,RC[-3]<3),95,IF(AND(RC[-3]<RC[-1],RC[-3]>=3,RC[-3]<4),90,IF(AND(RC[-3]<RC[-1],RC[-3]>=4,RC[-3]<5),85,IF(AND(RC[-3]<RC[-1],RC[-3]>=5,RC[-3]<6),80,IF(AND(RC[-3]<RC[-1],RC[-3]>=6,RC[-3]<7),75,IF(AND(RC[-3]<RC[-1],RC[-3]>=7,RC[-3]<8),70,IF(AND(RC[-3]<RC[-1],RC[-3]>=8,RC[-3]<9),65,IF(AND(RC[-3]<RC[-1],RC[-3]>=9,RC[-3]<10),60,IF(AND(RC[-3]<RC[-1],RC[-3]>=10,RC[-3]<11),55,IF(AND(RC[-3]<RC[-1],RC[-3]>=11,RC[-3]<12),50,IF(AND(RC[-3]<RC[-1],RC[-3]>=12,RC[-3]<13),45,IF(AND(RC[-3]<RC[-1],RC[-3]>=13,RC[-3]<14),40,IF(AND(RC[-3]<RC[-1],RC[-3]>=14,RC[-3]<15),35,IF(AND(RC[-3]<RC[-1],RC[-3]>=15,RC[-3]<16),30,IF(AND(RC[-3]<RC[-1],RC[-3]>=16,RC[-3]<17),25,IF(AND(RC[-3]<RC[-1],RC[-3]>=17,RC[-3]<18),20,IF(AND(RC[-3]<RC[-1],RC[-3]>=18,RC[-3]<19),15,IF(AND(RC[-3]<RC[-1],RC[-3]>=19,RC[-3]<20),10,IF(AND(RC[-3]<RC[-1],RC[-3]>=20,RC[-3]<21),5,IF(AND(RC[-3]<RC[-1],RC[-3]>=21),0,IF(AND(RC[-3]>RC[-1],RC[-3]>=2,RC[-3]<3),90,IF(AND(RC[-3]>RC[-1],RC[-3]>=3,RC[-3]<4),90,IF(AND(RC[-3]>RC[-1],RC[-3]>=4,RC[-3]<5),80,IF(AND(RC[-3]>RC[-1],RC[-3]>=5,RC[-3]<6),70,IF(AND(RC[-3]>RC[-1],RC[-3]>=6,RC[-3]<7),60,IF(AND(RC[-3]>RC[-1],RC[-3]>=7,RC[-3]<8),50,IF(AND(RC[-3]>RC[-1],RC[-3]>=8,RC[-3]<9),40,IF(AND(RC[-3]>RC[-1],RC[-3]>=9,RC[-3]<10),30,IF(AND(RC[-3]>RC[-1],RC[-3]>=10,RC[-3]<11),20,IF(AND(RC[-3]>RC[-1],RC[-3]>=11,RC[-3]<12),10,IF(AND(RC[-3]>RC[-1],RC[-3]>=12),0))))))))))))))))))))))))))))))))) -> 95 | H66: =IF(RC[-3]="","",IF(RC[-3]<0.3,100,IF(AND(RC[-3]>=0.3,RC[-3]>0.4),95,IF(AND(RC[-3]>=0.4,RC[-3]<0.5),90,IF(AND(RC[-3]>=0.5,RC[-3]<0.6),85,IF(AND(RC[-3]>=0.6,RC[-3]<0.7),80,IF(AND(RC[-3]>=0.6,RC[-3]<1),80,IF(AND(RC[-3]>1,RC[-3]<2),50,IF(RC[-3]>2,0))))))))) ->  | I66: =IF(RC[-1]="",RC[-2],0.7*RC[-1]+0.3*RC[-2]) -> 95
A67: بانک ایران زمین | B67: وزمین | C67: =VLOOKUP(RC[-1],Sheet1!R3C2:R802C3,2,FALSE) -> بانکها و موسسات اعتباری | D67: =VLOOKUP(RC[-2],Sheet1!R3C2:R802C9,8,FALSE) -> 32.846666666666664 | E67: =IF(VLOOKUP(RC[-3],Sheet1!R3C2:R803C11,10,FALSE)=0,"",VLOOKUP(Sheet2!RC[-3],Sheet1!R[1]C[-3]:R[801]C[6],10,FALSE)) ->  | F67: =Sheet1!R92C10 -> 20.170320066255385 | G67: =IF(RC[-3]<0,0,IF(AND(RC[-3]<RC[-1],RC[-3]<2),100,IF(AND(RC[-3]<RC[-1],RC[-3]>=2,RC[-3]<3),95,IF(AND(RC[-3]<RC[-1],RC[-3]>=3,RC[-3]<4),90,IF(AND(RC[-3]<RC[-1],RC[-3]>=4,RC[-3]<5),85,IF(AND(RC[-3]<RC[-1],RC[-3]>=5,RC[-3]<6),80,IF(AND(RC[-3]<RC[-1],RC[-3]>=6,RC[-3]<7),75,IF(AND(RC[-3]<RC[-1],RC[-3]>=7,RC[-3]<8),70,IF(AND(RC[-3]<RC[-1],RC[-3]>=8,RC[-3]<9),65,IF(AND(RC[-3]<RC[-1],RC[-3]>=9,RC[-3]<10),60,IF(AND(RC[-3]<RC[-1],RC[-3]>=10,RC[-3]<11),55,IF(AND(RC[-3]<RC[-1],RC[-3]>=11,RC[-3]<12),50,IF(AND(RC[-3]<RC[-1],RC[-3]>=12,RC[-3]<13),45,IF(AND(RC[-3]<RC[-1],RC[-3]>=13,RC[-3]<14),40,IF(AND(RC[-3]<RC[-1],RC[-3]>=14,RC[-3]<15),35,IF(AND(RC[-3]<RC[-1],RC[-3]>=15,RC[-3]<16),30,IF(AND(RC[-3]<RC[-1],RC[-3]>=16,RC[-3]<17),25,IF(AND(RC[-3]<RC[-1],RC[-3]>=17,RC[-3]<18),20,IF(AND(RC[-3]<RC[-1],RC[-3]>=18,RC[-3]<19),15,IF(AND(RC[-3]<RC[-1],RC[-3]>=19,RC[-3]<20),10,IF(AND(RC[-3]<RC[-1],RC[-3]>=20,RC[-3]<21),5,IF(AND(RC[-3]<RC[-1],RC[-3]>=21),0,IF(AND(RC[-3]>RC[-1],RC[-3]>=2,RC[-3]<3),90,IF(AND(RC[-3]>RC[-1],RC[-3]>=3,RC[-3]<4),90,IF(AND(RC[-3]>RC[-1],RC[-3]>=4,RC[-3]<5),80,IF(AND(RC[-3]>RC[-1],RC[-3]>=5,RC[-3]<6),70,IF(AND(RC[-3]>RC[-1],RC[-3]>=6,RC[-3]<7),60,IF(AND(RC[-3]>RC[-1],RC[-3]>=7,RC[-3]<8),50,IF(AND(RC[-3]>RC[-1],RC[-3]>=8,RC[-3]<9),40,IF(AND(RC[-3]>RC[-1],RC[-3]>=9,RC[-3]<10),30,IF(AND(RC[-3]>RC[-1],RC[-3]>=10,RC[-3]<11),20,IF(AND(RC[-3]>RC[-1],RC[-3]>=11,RC[-3]<12),10,IF(AND(RC[-3]>RC[-1],RC[-3]>=12),0))))))))))))))))))))))))))))))))) -> 0 | H67: =IF(RC[-3]="","",IF(RC[-3]<0.3,100,IF(AND(RC[-3]>=0.3,RC[-3]>0.4),95,IF(AND(RC[-3]>=0.4,RC[-3]<0.5),90,IF(AND(RC[-3]>=0.5,RC[-3]<0.6),85,IF(AND(RC[-3]>=0.6,RC[-3]<0.7),80,IF(AND(RC[-3]>=0.6,RC[-3]<1),80,IF(AND(RC[-3]>1,RC[-3]<2),50,IF(RC[-3]>2,0))))))))) ->  | I67: =IF(RC[-1]="",RC[-2],0.7*RC[-1]+0.3*RC[-2]) -> 0
A68: بانک پارسیان | B68: وپارس | C68: =VLOOKUP(RC[-1],Sheet1!R3C2:R802C3,2,FALSE) -> بانکها و موسسات اعتباری | D68: =VLOOKUP(RC[-2],Sheet1!R3C2:R802C9,8,FALSE) -> 16.472857142857144 | E68: =IF(VLOOKUP(RC[-3],Sheet1!R3C2:R803C11,10,FALSE)=0,"",VLOOKUP(Sheet2!RC[-3],Sheet1!R[1]C[-3]:R[801]C[6],10,FALSE)) ->  | F68: =Sheet1!R92C10 -> 20.170320066255385 | G68: =IF(RC[-3]<0,0,IF(AND(RC[-3]<RC[-1],RC[-3]<2),100,IF(AND(RC[-3]<RC[-1],RC[-3]>=2,RC[-3]<3),95,IF(AND(RC[-3]<RC[-1],RC[-3]>=3,RC[-3]<4),90,IF(AND(RC[-3]<RC[-1],RC[-3]>=4,RC[-3]<5),85,IF(AND(RC[-3]<RC[-1],RC[-3]>=5,RC[-3]<6),80,IF(AND(RC[-3]<RC[-1],RC[-3]>=6,RC[-3]<7),75,IF(AND(RC[-3]<RC[-1],RC[-3]>=7,RC[-3]<8),70,IF(AND(RC[-3]<RC[-1],RC[-3]>=8,RC[-3]<9),65,IF(AND(RC[-3]<RC[-1],RC[-3]>=9,RC[-3]<10),60,IF(AND(RC[-3]<RC[-1],RC[-3]>=10,RC[-3]<11),55,IF(AND(RC[-3]<RC[-1],RC[-3]>=11,RC[-3]<12),50,IF(AND(RC[-3]<RC[-1],RC[-3]>=12,RC[-3]<13),45,IF(AND(RC[-3]<RC[-1],RC[-3]>=13,RC[-3]<14),40,IF(AND(RC[-3]<RC[-1],RC[-3]>=14,RC[-3]<15),35,IF(AND(RC[-3]<RC[-1],RC[-3]>=15,RC[-3]<16),30,IF(AND(RC[-3]<RC[-1],RC[-3]>=16,RC[-3]<17),25,IF(AND(RC[-3]<RC[-1],RC[-3]>=17,RC[-3]<18),20,IF(AND(RC[-3]<RC[-1],RC[-3]>=18,RC[-3]<19),15,IF(AND(RC[-3]<RC[-1],RC[-3]>=19,RC[-3]<20),10,IF(AND(RC[-3]<RC[-1],RC[-3]>=20,RC[-3]<21),5,IF(AND(RC[-3]<RC[-1],RC[-3]>=21),0,IF(AND(RC[-3]>RC[-1],RC[-3]>=2,RC[-3]<3),90,IF(AND(RC[-3]>RC[-1],RC[-3]>=3,RC[-3]<4),90,IF(AND(RC[-3]>RC[-1],RC[-3]>=4,RC[-3]<5),80,IF(AND(RC[-3]>RC[-1],RC[-3]>=5,RC[-3]<6),70,IF(AND(RC[-3]>RC[-1],RC[-3]>=6,RC[-3]<7),60,IF(AND(RC[-3]>RC[-1],RC[-3]>=7,RC[-3]<8),50,IF(AND(RC[-3]>RC[-1],RC[-3]>=8,RC[-3]<9),40,IF(AND(RC[-3]>RC[-1],RC[-3]>=9,RC[-3]<10),30,IF(AND(RC[-3]>RC[-1],RC[-3]>=10,RC[-3]<11),20,IF(AND(RC[-3]>RC[-1],RC[-3]>=11,RC[-3]<12),10,IF(AND(RC[-3]>RC[-1],RC[-3]>=12),0))))))))))))))))))))))))))))))))) -> 25 | H68: =IF(RC[-3]="","",IF(RC[-3]<0.3,100,IF(AND(RC[-3]>=0.3,RC[-3]>0.4),95,IF(AND(RC[-3]>=0.4,RC[-3]<0.5),90,IF(AND(RC[-3]>=0.5,RC[-3]<0.6),85,IF(AND(RC[-3]>=0.6,RC[-3]<0.7),80,IF(AND(RC[-3]>=0.6,RC[-3]<1),80,IF(AND(RC[-3]>1,RC[-3]<2),50,IF(RC[-3]>2,0))))))))) ->  | I68: =IF(RC[-1]="",RC[-2],0.7*RC[-1]+0.3*RC[-2]) -> 25
A69: بانک پاسارگاد | B69: وپاسار | C69: =VLOOKUP(RC[-1],Sheet1!R3C2:R802C3,2,FALSE) -> بانکها و موسسات اعتباری | D69: =VLOOKUP(RC[-2],Sheet1!R3C2:R802C9,8,FALSE) -> 2.3336151213866896 | E69: =IF(VLOOKUP(RC[-3],Sheet1!R3C2:R803C11,10,FALSE)=0,"",VLOOKUP(Sheet2!RC[-3],Sheet1!R[1]C[-3]:R[801]C[6],10,FALSE)) ->  | F69: =Sheet1!R92C10 -> 20.170320066255385 | G69: =IF(RC[-3]<0,0,IF(AND(RC[-3]<RC[-1],RC[-3]<2),100,IF(AND(RC[-3]<RC[-1],RC[-3]>=2,RC[-3]<3),95,IF(AND(RC[-3]<RC[-1],RC[-3]>=3,RC[-3]<4),90,IF(AND(RC[-3]<RC[-1],RC[-3]>=4,RC[-3]<5),85,IF(AND(RC[-3]<RC[-1],RC[-3]>=5,RC[-3]<6),80,IF(AND(RC[-3]<RC[-1],RC[-3]>=6,RC[-3]<7),75,IF(AND(RC[-3]<RC[-1],RC[-3]>=7,RC[-3]<8),70,IF(AND(RC[-3]<RC[-1],RC[-3]>=8,RC[-3]<9),65,IF(AND(RC[-3]<RC[-1],RC[-3]>=9,RC[-3]<10),60,IF(AND(RC[-3]<RC[-1],RC[-3]>=10,RC[-3]<11),55,IF(AND(RC[-3]<RC[-1],RC[-3]>=11,RC[-3]<12),50,IF(AND(RC[-3]<RC[-1],RC[-3]>=12,RC[-3]<13),45,IF(AND(RC[-3]<RC[-1],RC[-3]>=13,RC[-3]<14),40,IF(AND(RC[-3]<RC[-1],RC[-3]>=14,RC[-3]<15),35,IF(AND(RC[-3]<RC[-1],RC[-3]>=15,RC[-3]<16),30,IF(AND(RC[-3]<RC[-1],RC[-3]>=16,RC[-3]<17),25,IF(AND(RC[-3]<RC[-1],RC[-3]>=17,RC[-3]<18),20,IF(AND(RC[-3]<RC[-1],RC[-3]>=18,RC[-3]<19),15,IF(AND(RC[-3]<RC[-1],RC[-3]>=19,RC[-3]<20),10,IF(AND(RC[-3]<RC[-1],RC[-3]>=20,RC[-3]<21),5,IF(AND(RC[-3]<RC[-1],RC[-3]>=21),0,IF(AND(RC[-3]>RC[-1],RC[-3]>=2,RC[-3]<3),90,IF(AND(RC[-3]>RC[-1],RC[-3]>=3,RC[-3]<4),90,IF(AND(RC[-3]>RC[-1],RC[-3]>=4,RC[-3]<5),80,IF(AND(RC[-3]>RC[-1],RC[-3]>=5,RC[-3]<6),70,IF(AND(RC[-3]>RC[-1],RC[-3]>=6,RC[-3]<7),60,IF(AND(RC[-3]>RC[-1],RC[-3]>=7,RC[-3]<8),50,IF(AND(RC[-3]>RC[-1],RC[-3]>=8,RC[-3]<9),40,IF(AND(RC[-3]>RC[-1],RC[-3]>=9,RC[-3]<10),30,IF(AND(RC[-3]>RC[-1],RC[-3]>=10,RC[-3]<11),20,IF(AND(RC[-3]>RC[-1],RC[-3]>=11,RC[-3]<12),10,IF(AND(RC[-3]>RC[-1],RC[-3]>=12),0))))))))))))))))))))))))))))))))) -> 95 | H69: =IF(RC[-3]="","",IF(RC[-3]<0.3,100,IF(AND(RC[-3]>=0.3,RC[-3]>0.4),95,IF(AND(RC[-3]>=0.4,RC[-3]<0.5),90,IF(AND(RC[-3]>=0.5,RC[-3]<0.6),85,IF(AND(RC[-3]>=0.6,RC[-3]<0.7),80,IF(AND(RC[-3]>=0.6,RC[-3]<1),80,IF(AND(RC[-3]>1,RC[-3]<2),50,IF(RC[-3]>2,0))))))))) ->  | I69: =IF(RC[-1]="",RC[-2],0.7*RC[-1]+0.3*RC[-2]) -> 95
A70: بانک تجارت | B70: وتجارت | C70: =VLOOKUP(RC[-1],Sheet1!R3C2:R802C3,2,FALSE) -> بانکها و موسسات اعتباری | D70: =VLOOKUP(RC[-2],Sheet1!R3C2:R802C9,8,FALSE) -> 5.3532559617414179 | E70: =IF(VLOOKUP(RC[-3],Sheet1!R3C2:R803C11,10,FALSE)=0,"",VLOOKUP(Sheet2!RC[-3],Sheet1!R[1]C[-3]:R[801]C[6],10,FALSE)) ->  | F70: =Sheet1!R92C10 -> 20.170320066255385 | G70: =IF(RC[-3]<0,0,IF(AND(RC[-3]<RC[-1],RC[-3]<2),100,IF(AND(RC[-3]<RC[-1],RC[-3]>=2,RC[-3]<3),95,IF(AND(RC[-3]<RC[-1],RC[-3]>=3,RC[-3]<4),90,IF(AND(RC[-3]<RC[-1],RC[-3]>=4,RC[-3]<5),85,IF(AND(RC[-3]<RC[-1],RC[-3]>=5,RC[-3]<6),80,IF(AND(RC[-3]<RC[-1],RC[-3]>=6,RC[-3]<7),75,IF(AND(RC[-3]<RC[-1],RC[-3]>=7,RC[-3]<8),70,IF(AND(RC[-3]<RC[-1],RC[-3]>=8,RC[-3]<9),65,IF(AND(RC[-3]<RC[-1],RC[-3]>=9,RC[-3]<10),60,IF(AND(RC[-3]<RC[-1],RC[-3]>=10,RC[-3]<11),55,IF(AND(RC[-3]<RC[-1],RC[-3]>=11,RC[-3]<12),50,IF(AND(RC[-3]<RC[-1],RC[-3]>=12,RC[-3]<13),45,IF(AND(RC[-3]<RC[-1],RC[-3]>=13,RC[-3]<14),40,IF(AND(RC[-3]<RC[-1],RC[-3]>=14,RC[-3]<15),35,IF(AND(RC[-3]<RC[-1],RC[-3]>=15,RC[-3]<16),30,IF(AND(RC[-3]<RC[-1],RC[-3]>=16,RC[-3]<17),25,IF(AND(RC[-3]<RC[-1],RC[-3]>=17,RC[-3]<18),20,IF(AND(RC[-3]<RC[-1],RC[-3]>=18,RC[-3]<19),15,IF(AND(RC[-3]<RC[-1],RC[-3]>=19,RC[-3]<20),10,IF(AND(RC[-3]<RC[-1],RC[-3]>=20,RC[-3]<21),5,IF(AND(RC[-3]<RC[-1],RC[-3]>=21),0,IF(AND(RC[-3]>RC[-1],RC[-3]>=2,RC[-3]<3),90,IF(AND(RC[-3]>RC[-1],RC[-3]>=3,RC[-3]<4),90,IF(AND(RC[-3]>RC[-1],RC[-3]>=4,RC[-3]<5),80,IF(AND(RC[-3]>RC[-1],RC[-3]>=5,RC[-3]<6),70,IF(AND(RC[-3]>RC[-1],RC[-3]>=6,RC[-3]<7),60,IF(AND(RC[-3]>RC[-1],RC[-3]>=7,RC[-3]<8),50,IF(AND(RC[-3]>RC[-1],RC[-3]>=8,RC[-3]<9),40,IF(AND(RC[-3]>RC[-1],RC[-3]>=9,RC[-3]<10),30,IF(AND(RC[-3]>RC[-1],RC[-3]>=10,RC[-3]<11),20,IF(AND(RC[-3]>RC[-1],RC[-3]>=11,RC[-3]<12),10,IF(AND(RC[-3]>RC[-1],RC[-3]>=12),0))))))))))))))))))))))))))))))))) -> 80 | H70: =IF(RC[-3]="","",IF(RC[-3]<0.3,100,IF(AND(RC[-3]>=0.3,RC[-3]>0.4),95,IF(AND(RC[-3]>=0.4,RC[-3]<0.5),90,IF(AND(RC[-3]>=0.5,RC[-3]<0.6),85,IF(AND(RC[-3]>=0.6,RC[-3]<0.7),80,IF(AND(RC[-3]>=0.6,RC[-3]<1),80,IF(AND(RC[-3]>1,RC[-3]<2),50,IF(RC[-3]>2,0))))))))) ->  | I70: =IF(RC[-1]="",RC[-2],0.7*RC[-1]+0.3*RC[-2]) -> 80
A71: بانک خاورمیانه | B71: وخاور | C71: =VLOOKUP(RC[-1],Sheet1!R3C2:R802C3,2,FALSE) -> بانکها و موسسات اعتباری | D71: =VLOOKUP(RC[-2],Sheet1!R3C2:R802C9,8,FALSE) -> 3.3276585313520051 | E71: =IF(VLOOKUP(RC[-3],Sheet1!R3C2:R803C11,10,FALSE)=0,"",VLOOKUP(Sheet2!RC[-3],Sheet1!R[1]C[-3]:R[801]C[6],10,FALSE)) ->  | F71: =Sheet1!R92C10 -> 20.170320066255385 | G71: =IF(RC[-3]<0,0,IF(AND(RC[-3]<RC[-1],RC[-3]<2),100,IF(AND(RC[-3]<RC[-1],RC[-3]>=2,RC[-3]<3),95,IF(AND(RC[-3]<RC[-1],RC[-3]>=3,RC[-3]<4),90,IF(AND(RC[-3]<RC[-1],RC[-3]>=4,RC[-3]<5),85,IF(AND(RC[-3]<RC[-1],RC[-3]>=5,RC[-3]<6),80,IF(AND(RC[-3]<RC[-1],RC[-3]>=6,RC[-3]<7),75,IF(AND(RC[-3]<RC[-1],RC[-3]>=7,RC[-3]<8),70,IF(AND(RC[-3]<RC[-1],RC[-3]>=8,RC[-3]<9),65,IF(AND(RC[-3]<RC[-1],RC[-3]>=9,RC[-3]<10),60,IF(AND(RC[-3]<RC[-1],RC[-3]>=10,RC[-3]<11),55,IF(AND(RC[-3]<RC[-1],RC[-3]>=11,RC[-3]<12),50,IF(AND(RC[-3]<RC[-1],RC[-3]>=12,RC[-3]<13),45,IF(AND(RC[-3]<RC[-1],RC[-3]>=13,RC[-3]<14),40,IF(AND(RC[-3]<RC[-1],RC[-3]>=14,RC[-3]<15),35,IF(AND(RC[-3]<RC[-1],RC[-3]>=15,RC[-3]<16),30,IF(AND(RC[-3]<RC[-1],RC[-3]>=16,RC[-3]<17),25,IF(AND(RC[-3]<RC[-1],RC[-3]>=17,RC[-3]<18),20,IF(AND(RC[-3]<RC[-1],RC[-3]>=18,RC[-3]<19),15,IF(AND(RC[-3]<RC[-1],RC[-3]>=19,RC[-3]<20),10,IF(AND(RC[-3]<RC[-1],RC[-3]>=20,RC[-3]<21),5,IF(AND(RC[-3]<RC[-1],RC[-3]>=21),0,IF(AND(RC[-3]>RC[-1],RC[-3]>=2,RC[-3]<3),90,IF(AND(RC[-3]>RC[-1],RC[-3]>=3,RC[-3]<4),90,IF(AND(RC[-3]>RC[-1],RC[-3]>=4,RC[-3]<5),80,IF(AND(RC[-3]>RC[-1],RC[-3]>=5,RC[-3]<6),70,IF(AND(RC[-3]>RC[-1],RC[-3]>=6,RC[-3]<7),60,IF(AND(RC[-3]>RC[-1],RC[-3]>=7,RC[-3]<8),50,IF(AND(RC[-3]>RC[-1],RC[-3]>=8,RC[-3]<9),40,IF(AND(RC[-3]>RC[-1],RC[-3]>=9,RC[-3]<10),30,IF(AND(RC[-3]>RC[-1],RC[-3]>=10,RC[-3]<11),20,IF(AND(RC[-3]>RC[-1],RC[-3]>=11,RC[-3]<12),10,IF(AND(RC[-3]>RC[-1],RC[-3]>=12),0))))))))))))))))))))))))))))))))) -> 90 | H71: =IF(RC[-3]="","",IF(RC[-3]<0.3,100,IF(AND(RC[-3]>=0.3,RC[-3]>0.4),95,IF(AND(RC[-3]>=0.4,RC[-3]<0.5),90,IF(AND(RC[-3]>=0.5,RC[-3]<0.6),85,IF(AND(RC[-3]>=0.6,RC[-3]<0.7),80,IF(AND(RC[-3]>=0.6,RC[-3]<1),80,IF(AND(RC[-3]>1,RC[-3]<2),50,IF(RC[-3]>2,0))))))))) ->  | I71: =IF(RC[-1]="",RC[-2],0.7*RC[-1]+0.3*RC[-2]) -> 90
A72: بانک دی | B72: دی | C72: =VLOOKUP(RC[-1],Sheet1!R3C2:R802C3,2,FALSE) -> بانکها و موسسات اعتباری | D72: =VLOOKUP(RC[-2],Sheet1!R3C2:R802C9,8,FALSE) -> 1.0407587548638133 | E72: =IF(VLOOKUP(RC[-3],Sheet1!R3C2:R803C11,10,FALSE)=0,"",VLOOKUP(Sheet2!RC[-3],Sheet1!R[1]C[-3]:R[801]C[6],10,FALSE)) ->  | F72: =Sheet1!R92C10 -> 20.170320066255385 | G72: =IF(RC[-3]<0,0,IF(AND(RC[-3]<RC[-1],RC[-3]<2),100,IF(AND(RC[-3]<RC[-1],RC[-3]>=2,RC[-3]<3),95,IF(AND(RC[-3]<RC[-1],RC[-3]>=3,RC[-3]<4),90,IF(AND(RC[-3]<RC[-1],RC[-3]>=4,RC[-3]<5),85,IF(AND(RC[-3]<RC[-1],RC[-3]>=5,RC[-3]<6),80,IF(AND(RC[-3]<RC[-1],RC[-3]>=6,RC[-3]<7),75,IF(AND(RC[-3]<RC[-1],RC[-3]>=7,RC[-3]<8),70,IF(AND(RC[-3]<RC[-1],RC[-3]>=8,RC[-3]<9),65,IF(AND(RC[-3]<RC[-1],RC[-3]>=9,RC[-3]<10),60,IF(AND(RC[-3]<RC[-1],RC[-3]>=10,RC[-3]<11),55,IF(AND(RC[-3]<RC[-1],RC[-3]>=11,RC[-3]<12),50,IF(AND(RC[-3]<RC[-1],RC[-3]>=12,RC[-3]<13),45,IF(AND(RC[-3]<RC[-1],RC[-3]>=13,RC[-3]<14),40,IF(AND(RC[-3]<RC[-1],RC[-3]>=14,RC[-3]<15),35,IF(AND(RC[-3]<RC[-1],RC[-3]>=15,RC[-3]<16),30,IF(AND(RC[-3]<RC[-1],RC[-3]>=16,RC[-3]<17),25,IF(AND(RC[-3]<RC[-1],RC[-3]>=17,RC[-3]<18),20,IF(AND(RC[-3]<RC[-1],RC[-3]>=18,RC[-3]<19),15,IF(AND(RC[-3]<RC[-1],RC[-3]>=19,RC[-3]<20),10,IF(AND(RC[-3]<RC[-1],RC[-3]>=20,RC[-3]<21),5,IF(AND(RC[-3]<RC[-1],RC[-3]>=21),0,IF(AND(RC[-3]>RC[-1],RC[-3]>=2,RC[-3]<3),90,IF(AND(RC[-3]>RC[-1],RC[-3]>=3,RC[-3]<4),90,IF(AND(RC[-3]>RC[-1],RC[-3]>=4,RC[-3]<5),80,IF(AND(RC[-3]>RC[-1],RC[-3]>=5,RC[-3]<6),70,IF(AND(RC[-3]>RC[-1],RC[-3]>=6,RC[-3]<7),60,IF(AND(RC[-3]>RC[-1],RC[-3]>=7,RC[-3]<8),50,IF(AND(RC[-3]>RC[-1],RC[-3]>=8,RC[-3]<9),40,IF(AND(RC[-3]>RC[-1],RC[-3]>=9,RC[-3]<10),30,IF(AND(RC[-3]>RC[-1],RC[-3]>=10,RC[-3]<11),20,IF(AND(RC[-3]>RC[-1],RC[-3]>=11,RC[-3]<12),10,IF(AND(RC[-3]>RC[-1],RC[-3]>=12),0))))))))))))))))))))))))))))))))) -> 100 | H72: =IF(RC[-3]="","",IF(RC[-3]<0.3,100,IF(AND(RC[-3]>=0.3,RC[-3]>0.4),95,IF(AND(RC[-3]>=0.4,RC[-3]<0.5),90,IF(AND(RC[-3]>=0.5,RC[-3]<0.6),85,IF(AND(RC[-3]>=0.6,RC[-3]<0.7),80,IF(AND(RC[-3]>=0.6,RC[-3]<1),80,IF(AND(RC[-3]>1,RC[-3]<2),50,IF(RC[-3]>2,0))))))))) ->  | I72: =IF(RC[-1]="",RC[-2],0.7*RC[-1]+0.3*RC[-2]) -> 100
A73: بانک سامان | B73: سامان | C73: =VLOOKUP(RC[-1],Sheet1!R3C2:R802C3,2,FALSE) -> بانکها و موسسات اعتباری | D73: =VLOOKUP(RC[-2],Sheet1!R3C2:R802C9,8,FALSE) -> 2.2657220325306193 | E73: =IF(VLOOKUP(RC[-3],Sheet1!R3C2:R803C11,10,FALSE)=0,"",VLOOKUP(Sheet2!RC[-3],Sheet1!R[1]C[-3]:R[801]C[6],10,FALSE)) ->  | F73: =Sheet1!R92C10 -> 20.170320066255385 | G73: =IF(RC[-3]<0,0,IF(AND(RC[-3]<RC[-1],RC[-3]<2),100,IF(AND(RC[-3]<RC[-1],RC[-3]>=2,RC[-3]<3),95,IF(AND(RC[-3]<RC[-1],RC[-3]>=3,RC[-3]<4),90,IF(AND(RC[-3]<RC[-1],RC[-3]>=4,RC[-3]<5),85,IF(AND(RC[-3]<RC[-1],RC[-3]>=5,RC[-3]<6),80,IF(AND(RC[-3]<RC[-1],RC[-3]>=6,RC[-3]<7),75,IF(AND(RC[-3]<RC[-1],RC[-3]>=7,RC[-3]<8),70,IF(AND(RC[-3]<RC[-1],RC[-3]>=8,RC[-3]<9),65,IF(AND(RC[-3]<RC[-1],RC[-3]>=9,RC[-3]<10),60,IF(AND(RC[-3]<RC[-1],RC[-3]>=10,RC[-3]<11),55,IF(AND(RC[-3]<RC[-1],RC[-3]>=11,RC[-3]<12),50,IF(AND(RC[-3]<RC[-1],RC[-3]>=12,RC[-3]<13),45,IF(AND(RC[-3]<RC[-1],RC[-3]>=13,RC[-3]<14),40,IF(AND(RC[-3]<RC[-1],RC[-3]>=14,RC[-3]<15),35,IF(AND(RC[-3]<RC[-1],RC[-3]>=15,RC[-3]<16),30,IF(AND(RC[-3]<RC[-1],RC[-3]>=16,RC[-3]<17),25,IF(AND(RC[-3]<RC[-1],RC[-3]>=17,RC[-3]<18),20,IF(AND(RC[-3]<RC[-1],RC[-3]>=18,RC[-3]<19),15,IF(AND(RC[-3]<RC[-1],RC[-3]>=19,RC[-3]<20),10,IF(AND(RC[-3]<RC[-1],RC[-3]>=20,RC[-3]<21),5,IF(AND(RC[-3]<RC[-1],RC[-3]>=21),0,IF(AND(RC[-3]>RC[-1],RC[-3]>=2,RC[-3]<3),90,IF(AND(RC[-3]>RC[-1],RC[-3]>=3,RC[-3]<4),90,IF(AND(RC[-3]>RC[-1],RC[-3]>=4,RC[-3]<5),80,IF(AND(RC[-3]>RC[-1],RC[-3]>=5,RC[-3]<6),70,IF(AND(RC[-3]>RC[-1],RC[-3]>=6,RC[-3]<7),60,IF(AND(RC[-3]>RC[-1],RC[-3]>=7,RC[-3]<8),50,IF(AND(RC[-3]>RC[-1],RC[-3]>=8,RC[-3]<9),40,IF(AND(RC[-3]>RC[-1],RC[-3]>=9,RC[-3]<10),30,IF(AND(RC[-3]>RC[-1],RC[-3]>=10,RC[-3]<11),20,IF(AND(RC[-3]>RC[-1],RC[-3]>=11,RC[-3]<12),10,IF(AND(RC[-3]>RC[-1],RC[-3]>=12),0))))))))))))))))))))))))))))))))) -> 95 | H73: =IF(RC[-3]="","",IF(RC[-3]<0.3,100,IF(AND(RC[-3]>=0.3,RC[-3]>0.4),95,IF(AND(RC[-3]>=0.4,RC[-3]<0.5),90,IF(AND(RC[-3]>=0.5,RC[-3]<0.6),85,IF(AND(RC[-3]>=0.6,RC[-3]<0.7),80,IF(AND(RC[-3]>=0.6,RC[-3]<1),80,IF(AND(RC[-3]>1,RC[-3]<2),50,IF(RC[-3]>2,0))))))))) ->  | I73: =IF(RC[-1]="",RC[-2],0.7*RC[-1]+0.3*RC[-2]) -> 95
A74: بانک سرمایه | B74: سمایه | C74: =VLOOKUP(RC[-1],Sheet1!R3C2:R802C3,2,FALSE) -> بانکها و موسسات اعتباری | D74: =VLOOKUP(RC[-2],Sheet1!R3C2:R802C9,8,FALSE) -> -9.4537936618089291E-2 | E74: =IF(VLOOKUP(RC[-3],Sheet1!R3C2:R803C11,10,FALSE)=0,"",VLOOKUP(Sheet2!RC[-3],Sheet1!R[1]C[-3]:R[801]C[6],10,FALSE)) ->  | F74: =Sheet1!R92C10 -> 20.170320066255385 | G74: =IF(RC[-3]<0,0,IF(AND(RC[-3]<RC[-1],RC[-3]<2),100,IF(AND(RC[-3]<RC[-1],RC[-3]>=2,RC[-3]<3),95,IF(AND(RC[-3]<RC[-1],RC[-3]>=3,RC[-3]<4),90,IF(AND(RC[-3]<RC[-1],RC[-3]>=4,RC[-3]<5),85,IF(AND(RC[-3]<RC[-1],RC[-3]>=5,RC[-3]<6),80,IF(AND(RC[-3]<RC[-1],RC[-3]>=6,RC[-3]<7),75,IF(AND(RC[-3]<RC[-1],RC[-3]>=7,RC[-3]<8),70,IF(AND(RC[-3]<RC[-1],RC[-3]>=8,RC[-3]<9),65,IF(AND(RC[-3]<RC[-1],RC[-3]>=9,RC[-3]<10),60,IF(AND(RC[-3]<RC[-1],RC[-3]>=10,RC[-3]<11),55,IF(AND(RC[-3]<RC[-1],RC[-3]>=11,RC[-3]<12),50,IF(AND(RC[-3]<RC[-1],RC[-3]>=12,RC[-3]<13),45,IF(AND(RC[-3]<RC[-1],RC[-3]>=13,RC[-3]<14),40,IF(AND(RC[-3]<RC[-1],RC[-3]>=14,RC[-3]<15),35,IF(AND(RC[-3]<RC[-1],RC[-3]>=15,RC[-3]<16),30,IF(AND(RC[-3]<RC[-1],RC[-3]>=16,RC[-3]<17),25,IF(AND(RC[-3]<RC[-1],RC[-3]>=17,RC[-3]<18),20,IF(AND(RC[-3]<RC[-1],RC[-3]>=18,RC[-3]<19),15,IF(AND(RC[-3]<RC[-1],RC[-3]>=19,RC[-3]<20),10,IF(AND(RC[-3]<RC[-1],RC[-3]>=20,RC[-3]<21),5,IF(AND(RC[-3]<RC[-1],RC[-3]>=21),0,IF(AND(RC[-3]>RC[-1],RC[-3]>=2,RC[-3]<3),90,IF(AND(RC[-3]>RC[-1],RC[-3]>=3,RC[-3]<4),90,IF(AND(RC[-3]>RC[-1],RC[-3]>=4,RC[-3]<5),80,IF(AND(RC[-3]>RC[-1],RC[-3]>=5,RC[-3]<6),70,IF(AND(RC[-3]>RC[-1],RC[-3]>=6,RC[-3]<7),60,IF(AND(RC[-3]>RC[-1],RC[-3]>=7,RC[-3]<8),50,IF(AND(RC[-3]>RC[-1],RC[-3]>=8,RC[-3]<9),40,IF(AND(RC[-3]>RC[-1],RC[-3]>=9,RC[-3]<10),30,IF(AND(RC[-3]>RC[-1],RC[-3]>=10,RC[-3]<11),20,IF(AND(RC[-3]>RC[-1],RC[-3]>=11,RC[-3]<12),10,IF(AND(RC[-3]>RC[-1],RC[-3]>=12),0))))))))))))))))))))))))))))))))) -> 0 | H74: =IF(RC[-3]="","",IF(RC[-3]<0.3,100,IF(AND(RC[-3]>=0.3,RC[-3]>0.4),95,IF(AND(RC[-3]>=0.4,RC[-3]<0.5),90,IF(AND(RC[-3]>=0.5,RC[-3]<0.6),85,IF(AND(RC[-3]>=0.6,RC[-3]<0.7),80,IF(AND(RC[-3]>=0.6,RC[-3]<1),80,IF(AND(RC[-3]>1,RC[-3]<2),50,IF(RC[-3]>2,0))))))))) ->  | I74: =IF(RC[-1]="",RC[-2],0.7*RC[-1]+0.3*RC[-2]) -> 0
A75: بانک سینا | B75: وسینا | C75: =VLOOKUP(RC[-1],Sheet1!R3C2:R802C3,2,FALSE) -> بانکها و موسسات اعتباری | D75: =VLOOKUP(RC[-2],Sheet1!R3C2:R802C9,8,FALSE) -> 7.5015149849204708 | E75: =IF(VLOOKUP(RC[-3],Sheet1!R3C2:R803C11,10,FALSE)=0,"",VLOOKUP(Sheet2!RC[-3],Sheet1!R[1]C[-3]:R[801]C[6],10,FALSE)) ->  | F75: =Sheet1!R92C10 -> 20.170320066255385 | G75: =IF(RC[-3]<0,0,IF(AND(RC[-3]<RC[-1],RC[-3]<2),100,IF(AND(RC[-3]<RC[-1],RC[-3]>=2,RC[-3]<3),95,IF(AND(RC[-3]<RC[-1],RC[-3]>=3,RC[-3]<4),90,IF(AND(RC[-3]<RC[-1],RC[-3]>=4,RC[-3]<5),85,IF(AND(RC[-3]<RC[-1],RC[-3]>=5,RC[-3]<6),80,IF(AND(RC[-3]<RC[-1],RC[-3]>=6,RC[-3]<7),75,IF(AND(RC[-3]<RC[-1],RC[-3]>=7,RC[-3]<8),70,IF(AND(RC[-3]<RC[-1],RC[-3]>=8,RC[-3]<9),65,IF(AND(RC[-3]<RC[-1],RC[-3]>=9,RC[-3]<10),60,IF(AND(RC[-3]<RC[-1],RC[-3]>=10,RC[-3]<11),55,IF(AND(RC[-3]<RC[-1],RC[-3]>=11,RC[-3]<12),50,IF(AND(RC[-3]<RC[-1],RC[-3]>=12,RC[-3]<13),45,IF(AND(RC[-3]<RC[-1],RC[-3]>=13,RC[-3]<14),40,IF(AND(RC[-3]<RC[-1],RC[-3]>=14,RC[-3]<15),35,IF(AND(RC[-3]<RC[-1],RC[-3]>=15,RC[-3]<16),30,IF(AND(RC[-3]<RC[-1],RC[-3]>=16,RC[-3]<17),25,IF(AND(RC[-3]<RC[-1],RC[-3]>=17,RC[-3]<18),20,IF(AND(RC[-3]<RC[-1],RC[-3]>=18,RC[-3]<19),15,IF(AND(RC[-3]<RC[-1],RC[-3]>=19,RC[-3]<20),10,IF(AND(RC[-3]<RC[-1],RC[-3]>=20,RC[-3]<21),5,IF(AND(RC[-3]<RC[-1],RC[-3]>=21),0,IF(AND(RC[-3]>RC[-1],RC[-3]>=2,RC[-3]<3),90,IF(AND(RC[-3]>RC[-1],RC[-3]>=3,RC[-3]<4),90,IF(AND(RC[-3]>RC[-1],RC[-3]>=4,RC[-3]<5),80,IF(AND(RC[-3]>RC[-1],RC[-3]>=5,RC[-3]<6),70,IF(AND(RC[-3]>RC[-1],RC[-3]>=6,RC[-3]<7),60,IF(AND(RC[-3]>RC[-1],RC[-3]>=7,RC[-3]<8),50,IF(AND(RC[-3]>RC[-1],RC[-3]>=8,RC[-3]<9),40,IF(AND(RC[-3]>RC[-1],RC[-3]>=9,RC[-3]<10),30,IF(AND(RC[-3]>RC[-1],RC[-3]>=10,RC[-3]<11),20,IF(AND(RC[-3]>RC[-1],RC[-3]>=11,RC[-3]<12),10,IF(AND(RC[-3]>RC[-1],RC[-3]>=12),0))))))))))))))))))))))))))))))))) -> 70 | H75: =IF(RC[-3]="","",IF(RC[-3]<0.3,100,IF(AND(RC[-3]>=0.3,RC[-3]>0.4),95,IF(AND(RC[-3]>=0.4,RC[-3]<0.5),90,IF(AND(RC[-3]>=0.5,RC[-3]<0.6),85,IF(AND(RC[-3]>=0.6,RC[-3]<0.7),80,IF(AND(RC[-3]>=0.6,RC[-3]<1),80,IF(AND(RC[-3]>1,RC[-3]<2),50,IF(RC[-3]>2,0))))))))) ->  | I75: =IF(RC[-1]="",RC[-2],0.7*RC[-1]+0.3*RC[-2]) -> 70
A76: بانک صادرات ایران | B76: وبصادر | C76: =VLOOKUP(RC[-1],Sheet1!R3C2:R802C3,2,FALSE) -> بانکها و موسسات اعتباری | D76: =VLOOKUP(RC[-2],Sheet1!R3C2:R802C9,8,FALSE) -> 159.00236368597751 | E76: =IF(VLOOKUP(RC[-3],Sheet1!R3C2:R803C11,10,FALSE)=0,"",VLOOKUP(Sheet2!RC[-3],Sheet1!R[1]C[-3]:R[801]C[6],10,FALSE)) ->  | F76: =Sheet1!R92C10 -> 20.170320066255385 | G76: =IF(RC[-3]<0,0,IF(AND(RC[-3]<RC[-1],RC[-3]<2),100,IF(AND(RC[-3]<RC[-1],RC[-3]>=2,RC[-3]<3),95,IF(AND(RC[-3]<RC[-1],RC[-3]>=3,RC[-3]<4),90,IF(AND(RC[-3]<RC[-1],RC[-3]>=4,RC[-3]<5),85,IF(AND(RC[-3]<RC[-1],RC[-3]>=5,RC[-3]<6),80,IF(AND(RC[-3]<RC[-1],RC[-3]>=6,RC[-3]<7),75,IF(AND(RC[-3]<RC[-1],RC[-3]>=7,RC[-3]<8),70,IF(AND(RC[-3]<RC[-1],RC[-3]>=8,RC[-3]<9),65,IF(AND(RC[-3]<RC[-1],RC[-3]>=9,RC[-3]<10),60,IF(AND(RC[-3]<RC[-1],RC[-3]>=10,RC[-3]<11),55,IF(AND(RC[-3]<RC[-1],RC[-3]>=11,RC[-3]<12),50,IF(AND(RC[-3]<RC[-1],RC[-3]>=12,RC[-3]<13),45,IF(AND(RC[-3]<RC[-1],RC[-3]>=13,RC[-3]<14),40,IF(AND(RC[-3]<RC[-1],RC[-3]>=14,RC[-3]<15),35,IF(AND(RC[-3]<RC[-1],RC[-3]>=15,RC[-3]<16),30,IF(AND(RC[-3]<RC[-1],RC[-3]>=16,RC[-3]<17),25,IF(AND(RC[-3]<RC[-1],RC[-3]>=17,RC[-3]<18),20,IF(AND(RC[-3]<RC[-1],RC[-3]>=18,RC[-3]<19),15,IF(AND(RC[-3]<RC[-1],RC[-3]>=19,RC[-3]<20),10,IF(AND(RC[-3]<RC[-1],RC[-3]>=20,RC[-3]<21),5,IF(AND(RC[-3]<RC[-1],RC[-3]>=21),0,IF(AND(RC[-3]>RC[-1],RC[-3]>=2,RC[-3]<3),90,IF(AND(RC[-3]>RC[-1],RC[-3]>=3,RC[-3]<4),90,IF(AND(RC[-3]>RC[-1],RC[-3]>=4,RC[-3]<5),80,IF(AND(RC[-3]>RC[-1],RC[-3]>=5,RC[-3]<6),70,IF(AND(RC[-3]>RC[-1],RC[-3]>=6,RC[-3]<7),60,IF(AND(RC[-3]>RC[-1],RC[-3]>=7,RC[-3]<8),50,IF(AND(RC[-3]>RC[-1],RC[-3]>=8,RC[-3]<9),40,IF(AND(RC[-3]>RC[-1],RC[-3]>=9,RC[-3]<10),30,IF(AND(RC[-3]>RC[-1],RC[-3]>=10,RC[-3]<11),20,IF(AND(RC[-3]>RC[-1],RC[-3]>=11,RC[-3]<12),10,IF(AND(RC[-3]>RC[-1],RC[-3]>=12),0))))))))))))))))))))))))))))))))) -> 0 | H76: =IF(RC[-3]="","",IF(RC[-3]<0.3,100,IF(AND(RC[-3]>=0.3,RC[-3]>0.4),95,IF(AND(RC[-3]>=0.4,RC[-3]<0.5),90,IF(AND(RC[-3]>=0.5,RC[-3]<0.6),85,IF(AND(RC[-3]>=0.6,RC[-3]<0.7),80,IF(AND(RC[-3]>=0.6,RC[-3]<1),80,IF(AND(RC[-3]>1,RC[-3]<2),50,IF(RC[-3]>2,0))))))))) ->  | I76: =IF(RC[-1]="",RC[-2],0.7*RC[-1]+0.3*RC[-2]) -> 0
A77: بانک قرض الحسنه رسالت | B77: وسالت | C77: =VLOOKUP(RC[-1],Sheet1!R3C2:R802C3,2,FALSE) -> بانکها و موسسات اعتباری | D77: =VLOOKUP(RC[-2],Sheet1!R3C2:R802C9,8,FALSE) -> 4.0223192795766813 | E77: =IF(VLOOKUP(RC[-3],Sheet1!R3C2:R803C11,10,FALSE)=0,"",VLOOKUP(Sheet2!RC[-3],Sheet1!R[1]C[-3]:R[801]C[6],10,FALSE)) ->  | F77: =Sheet1!R92C10 -> 20.170320066255385 | G77: =IF(RC[-3]<0,0,IF(AND(RC[-3]<RC[-1],RC[-3]<2),100,IF(AND(RC[-3]<RC[-1],RC[-3]>=2,RC[-3]<3),95,IF(AND(RC[-3]<RC[-1],RC[-3]>=3,RC[-3]<4),90,IF(AND(RC[-3]<RC[-1],RC[-3]>=4,RC[-3]<5),85,IF(AND(RC[-3]<RC[-1],RC[-3]>=5,RC[-3]<6),80,IF(AND(RC[-3]<RC[-1],RC[-3]>=6,RC[-3]<7),75,IF(AND(RC[-3]<RC[-1],RC[-3]>=7,RC[-3]<8),70,IF(AND(RC[-3]<RC[-1],RC[-3]>=8,RC[-3]<9),65,IF(AND(RC[-3]<RC[-1],RC[-3]>=9,RC[-3]<10),60,IF(AND(RC[-3]<RC[-1],RC[-3]>=10,RC[-3]<11),55,IF(AND(RC[-3]<RC[-1],RC[-3]>=11,RC[-3]<12),50,IF(AND(RC[-3]<RC[-1],RC[-3]>=12,RC[-3]<13),45,IF(AND(RC[-3]<RC[-1],RC[-3]>=13,RC[-3]<14),40,IF(AND(RC[-3]<RC[-1],RC[-3]>=14,RC[-3]<15),35,IF(AND(RC[-3]<RC[-1],RC[-3]>=15,RC[-3]<16),30,IF(AND(RC[-3]<RC[-1],RC[-3]>=16,RC[-3]<17),25,IF(AND(RC[-3]<RC[-1],RC[-3]>=17,RC[-3]<18),20,IF(AND(RC[-3]<RC[-1],RC[-3]>=18,RC[-3]<19),15,IF(AND(RC[-3]<RC[-1],RC[-3]>=19,RC[-3]<20),10,IF(AND(RC[-3]<RC[-1],RC[-3]>=20,RC[-3]<21),5,IF(AND(RC[-3]<RC[-1],RC[-3]>=21),0,IF(AND(RC[-3]>RC[-1],RC[-3]>=2,RC[-3]<3),90,IF(AND(RC[-3]>RC[-1],RC[-3]>=3,RC[-3]<4),90,IF(AND(RC[-3]>RC[-1],RC[-3]>=4,RC[-3]<5),80,IF(AND(RC[-3]>RC[-1],RC[-3]>=5,RC[-3]<6),70,IF(AND(RC[-3]>RC[-1],RC[-3]>=6,RC[-3]<7),60,IF(AND(RC[-3]>RC[-1],RC[-3]>=7,RC[-3]<8),50,IF(AND(RC[-3]>RC[-1],RC[-3]>=8,RC[-3]<9),40,IF(AND(RC[-3]>RC[-1],RC[-3]>=9,RC[-3]<10),30,IF(AND(RC[-3]>RC[-1],RC[-3]>=10,RC[-3]<11),20,IF(AND(RC[-3]>RC[-1],RC[-3]>=11,RC[-3]<12),10,IF(AND(RC[-3]>RC[-1],RC[-3]>=12),0))))))))))))))))))))))))))))))))) -> 85 | H77: =IF(RC[-3]="","",IF(RC[-3]<0.3,100,IF(AND(RC[-3]>=0.3,RC[-3]>0.4),95,IF(AND(RC[-3]>=0.4,RC[-3]<0.5),90,IF(AND(RC[-3]>=0.5,RC[-3]<0.6),85,IF(AND(RC[-3]>=0.6,RC[-3]<0.7),80,IF(AND(RC[-3]>=0.6,RC[-3]<1),80,IF(AND(RC[-3]>1,RC[-3]<2),50,IF(RC[-3]>2,0))))))))) ->  | I77: =IF(RC[-1]="",RC[-2],0.7*RC[-1]+0.3*RC[-2]) -> 85
A78: بانک گردشگری | B78: وگردش | C78: =VLOOKUP(RC[-1],Sheet1!R3C2:R802C3,2,FALSE) -> بانکها و موسسات اعتباری | D78: =VLOOKUP(RC[-2],Sheet1!R3C2:R802C9,8,FALSE) -> 11.776137363442308 | E78: =IF(VLOOKUP(RC[-3],Sheet1!R3C2:R803C11,10,FALSE)=0,"",VLOOKUP(Sheet2!RC[-3],Sheet1!R[1]C[-3]:R[801]C[6],10,FALSE)) ->  | F78: =Sheet1!R92C10 -> 20.170320066255385 | G78: =IF(RC[-3]<0,0,IF(AND(RC[-3]<RC[-1],RC[-3]<2),100,IF(AND(RC[-3]<RC[-1],RC[-3]>=2,RC[-3]<3),95,IF(AND(RC[-3]<RC[-1],RC[-3]>=3,RC[-3]<4),90,IF(AND(RC[-3]<RC[-1],RC[-3]>=4,RC[-3]<5),85,IF(AND(RC[-3]<RC[-1],RC[-3]>=5,RC[-3]<6),80,IF(AND(RC[-3]<RC[-1],RC[-3]>=6,RC[-3]<7),75,IF(AND(RC[-3]<RC[-1],RC[-3]>=7,RC[-3]<8),70,IF(AND(RC[-3]<RC[-1],RC[-3]>=8,RC[-3]<9),65,IF(AND(RC[-3]<RC[-1],RC[-3]>=9,RC[-3]<10),60,IF(AND(RC[-3]<RC[-1],RC[-3]>=10,RC[-3]<11),55,IF(AND(RC[-3]<RC[-1],RC[-3]>=11,RC[-3]<12),50,IF(AND(RC[-3]<RC[-1],RC[-3]>=12,RC[-3]<13),45,IF(AND(RC[-3]<RC[-1],RC[-3]>=13,RC[-3]<14),40,IF(AND(RC[-3]<RC[-1],RC[-3]>=14,RC[-3]<15),35,IF(AND(RC[-3]<RC[-1],RC[-3]>=15,RC[-3]<16),30,IF(AND(RC[-3]<RC[-1],RC[-3]>=16,RC[-3]<17),25,IF(AND(RC[-3]<RC[-1],RC[-3]>=17,RC[-3]<18),20,IF(AND(RC[-3]<RC[-1],RC[-3]>=18,RC[-3]<19),15,IF(AND(RC[-3]<RC[-1],RC[-3]>=19,RC[-3]<20),10,IF(AND(RC[-3]<RC[-1],RC[-3]>=20,RC[-3]<21),5,IF(AND(RC[-3]<RC[-1],RC[-3]>=21),0,IF(AND(RC[-3]>RC[-1],RC[-3]>=2,RC[-3]<3),90,IF(AND(RC[-3]>RC[-1],RC[-3]>=3,RC[-3]<4),90,IF(AND(RC[-3]>RC[-1],RC[-3]>=4,RC[-3]<5),80,IF(AND(RC[-3]>RC[-1],RC[-3]>=5,RC[-3]<6),70,IF(AND(RC[-3]>RC[-1],RC[-3]>=6,RC[-3]<7),60,IF(AND(RC[-3]>RC[-1],RC[-3]>=7,RC[-3]<8),50,IF(AND(RC[-3]>RC[-1],RC[-3]>=8,RC[-3]<9),40,IF(AND(RC[-3]>RC[-1],RC[-3]>=9,RC[-3]<10),30,IF(AND(RC[-3]>RC[-1],RC[-3]>=10,RC[-3]<11),20,IF(AND(RC[-3]>RC[-1],RC[-3]>=11,RC[-3]<12),10,IF(AND(RC[-3]>RC[-1],RC[-3]>=12),0))))))))))))))))))))))))))))))))) -> 50 | H78: =IF(RC[-3]="","",IF(RC[-3]<0.3,100,IF(AND(RC[-3]>=0.3,RC[-3]>0.4),95,IF(AND(RC[-3]>=0.4,RC[-3]<0.5),90,IF(AND(RC[-3]>=0.5,RC[-3]<0.6),85,IF(AND(RC[-3]>=0.6,RC[-3]<0.7),80,IF(AND(RC[-3]>=0.6,RC[-3]<1),80,IF(AND(RC[-3]>1,RC[-3]<2),50,IF(RC[-3]>2,0))))))))) ->  | I78: =IF(RC[-1]="",RC[-2],0.7*RC[-1]+0.3*RC[-2]) -> 50
A79: بانک ملت | B79: وبملت | C79: =VLOOKUP(RC[-1],Sheet1!R3C2:R802C3,2,FALSE) -> بانکها و موسسات اعتباری | D79: =VLOOKUP(RC[-2],Sheet1!R3C2:R802C9,8,FALSE) -> 2.5195237950704898 | E79: =IF(VLOOKUP(RC[-3],Sheet1!R3C2:R803C11,10,FALSE)=0,"",VLOOKUP(Sheet2!RC[-3],Sheet1!R[1]C[-3]:R[801]C[6],10,FALSE)) ->  | F79: =Sheet1!R92C10 -> 20.170320066255385 | G79: =IF(RC[-3]<0,0,IF(AND(RC[-3]<RC[-1],RC[-3]<2),100,IF(AND(RC[-3]<RC[-1],RC[-3]>=2,RC[-3]<3),95,IF(AND(RC[-3]<RC[-1],RC[-3]>=3,RC[-3]<4),90,IF(AND(RC[-3]<RC[-1],RC[-3]>=4,RC[-3]<5),85,IF(AND(RC[-3]<RC[-1],RC[-3]>=5,RC[-3]<6),80,IF(AND(RC[-3]<RC[-1],RC[-3]>=6,RC[-3]<7),75,IF(AND(RC[-3]<RC[-1],RC[-3]>=7,RC[-3]<8),70,IF(AND(RC[-3]<RC[-1],RC[-3]>=8,RC[-3]<9),65,IF(AND(RC[-3]<RC[-1],RC[-3]>=9,RC[-3]<10),60,IF(AND(RC[-3]<RC[-1],RC[-3]>=10,RC[-3]<11),55,IF(AND(RC[-3]<RC[-1],RC[-3]>=11,RC[-3]<12),50,IF(AND(RC[-3]<RC[-1],RC[-3]>=12,RC[-3]<13),45,IF(AND(RC[-3]<RC[-1],RC[-3]>=13,RC[-3]<14),40,IF(AND(RC[-3]<RC[-1],RC[-3]>=14,RC[-3]<15),35,IF(AND(RC[-3]<RC[-1],RC[-3]>=15,RC[-3]<16),30,IF(AND(RC[-3]<RC[-1],RC[-3]>=16,RC[-3]<17),25,IF(AND(RC[-3]<RC[-1],RC[-3]>=17,RC[-3]<18),20,IF(AND(RC[-3]<RC[-1],RC[-3]>=18,RC[-3]<19),15,IF(AND(RC[-3]<RC[-1],RC[-3]>=19,RC[-3]<20),10,IF(AND(RC[-3]<RC[-1],RC[-3]>=20,RC[-3]<21),5,IF(AND(RC[-3]<RC[-1],RC[-3]>=21),0,IF(AND(RC[-3]>RC[-1],RC[-3]>=2,RC[-3]<3),90,IF(AND(RC[-3]>RC[-1],RC[-3]>=3,RC[-3]<4),90,IF(AND(RC[-3]>RC[-1],RC[-3]>=4,RC[-3]<5),80,IF(AND(RC[-3]>RC[-1],RC[-3]>=5,RC[-3]<6),70,IF(AND(RC[-3]>RC[-1],RC[-3]>=6,RC[-3]<7),60,IF(AND(RC[-3]>RC[-1],RC[-3]>=7,RC[-3]<8),50,IF(AND(RC[-3]>RC[-1],RC[-3]>=8,RC[-3]<9),40,IF(AND(RC[-3]>RC[-1],RC[-3]>=9,RC[-3]<10),30,IF(AND(RC[-3]>RC[-1],RC[-3]>=10,RC[-3]<11),20,IF(AND(RC[-3]>RC[-1],RC[-3]>=11,RC[-3]<12),10,IF(AND(RC[-3]>RC[-1],RC[-3]>=12),0))))))))))))))))))))))))))))))))) -> 95 | H79: =IF(RC[-3]="","",IF(RC[-3]<0.3,100,IF(AND(RC[-3]>=0.3,RC[-3]>0.4),95,IF(AND(RC[-3]>=0.4,RC[-3]<0.5),90,IF(AND(RC[-3]>=0.5,RC[-3]<0.6),85,IF(AND(RC[-3]>=0.6,RC[-3]<0.7),80,IF(AND(RC[-3]>=0.6,RC[-3]<1),80,IF(AND(RC[-3]>1,RC[-3]<2),50,IF(RC[-3]>2,0))))))))) ->  | I79: =IF(RC[-1]="",RC[-2],0.7*RC[-1]+0.3*RC[-2]) -> 95
A80: بانک کار آفرین | B80: وکار | C80: =VLOOKUP(RC[-1],Sheet1!R3C2:R802C3,2,FALSE) -> بانکها و موسسات اعتباری | D80: =VLOOKUP(RC[-2],Sheet1!R3C2:R802C9,8,FALSE) -> 6.9401432752063208 | E80: =IF(VLOOKUP(RC[-3],Sheet1!R3C2:R803C11,10,FALSE)=0,"",VLOOKUP(Sheet2!RC[-3],Sheet1!R[1]C[-3]:R[801]C[6],10,FALSE)) ->  | F80: =Sheet1!R92C10 -> 20.170320066255385 | G80: =IF(RC[-3]<0,0,IF(AND(RC[-3]<RC[-1],RC[-3]<2),100,IF(AND(RC[-3]<RC[-1],RC[-3]>=2,RC[-3]<3),95,IF(AND(RC[-3]<RC[-1],RC[-3]>=3,RC[-3]<4),90,IF(AND(RC[-3]<RC[-1],RC[-3]>=4,RC[-3]<5),85,IF(AND(RC[-3]<RC[-1],RC[-3]>=5,RC[-3]<6),80,IF(AND(RC[-3]<RC[-1],RC[-3]>=6,RC[-3]<7),75,IF(AND(RC[-3]<RC[-1],RC[-3]>=7,RC[-3]<8),70,IF(AND(RC[-3]<RC[-1],RC[-3]>=8,RC[-3]<9),65,IF(AND(RC[-3]<RC[-1],RC[-3]>=9,RC[-3]<10),60,IF(AND(RC[-3]<RC[-1],RC[-3]>=10,RC[-3]<11),55,IF(AND(RC[-3]<RC[-1],RC[-3]>=11,RC[-3]<12),50,IF(AND(RC[-3]<RC[-1],RC[-3]>=12,RC[-3]<13),45,IF(AND(RC[-3]<RC[-1],RC[-3]>=13,RC[-3]<14),40,IF(AND(RC[-3]<RC[-1],RC[-3]>=14,RC[-3]<15),35,IF(AND(RC[-3]<RC[-1],RC[-3]>=15,RC[-3]<16),30,IF(AND(RC[-3]<RC[-1],RC[-3]>=16,RC[-3]<17),25,IF(AND(RC[-3]<RC[-1],RC[-3]>=17,RC[-3]<18),20,IF(AND(RC[-3]<RC[-1],RC[-3]>=18,RC[-3]<19),15,IF(AND(RC[-3]<RC[-1],RC[-3]>=19,RC[-3]<20),10,IF(AND(RC[-3]<RC[-1],RC[-3]>=20,RC[-3]<21),5,IF(AND(RC[-3]<RC[-1],RC[-3]>=21),0,IF(AND(RC[-3]>RC[-1],RC[-3]>=2,RC[-3]<3),90,IF(AND(RC[-3]>RC[-1],RC[-3]>=3,RC[-3]<4),90,IF(AND(RC[-3]>RC[-1],RC[-3]>=4,RC[-3]<5),80,IF(AND(RC[-3]>RC[-1],RC[-3]>=5,RC[-3]<6),70,IF(AND(RC[-3]>RC[-1],RC[-3]>=6,RC[-3]<7),60,IF(AND(RC[-3]>RC[-1],RC[-3]>=7,RC[-3]<8),50,IF(AND(RC[-3]>RC[-1],RC[-3]>=8,RC[-3]<9),40,IF(AND(RC[-3]>RC[-1],RC[-3]>=9,RC[-3]<10),30,IF(AND(RC[-3]>RC[-1],RC[-3]>=10,RC[-3]<11),20,IF(AND(RC[-3]>RC[-1],RC[-3]>=11,RC[-3]<12),10,IF(AND(RC[-3]>RC[-1],RC[-3]>=12),0))))))))))))))))))))))))))))))))) -> 75 | H80: =IF(RC[-3]="","",IF(RC[-3]<0.3,100,IF(AND(RC[-3]>=0.3,RC[-3]>0.4),95,IF(AND(RC[-3]>=0.4,RC[-3]<0.5),90,IF(AND(RC[-3]>=0.5,RC[-3]<0.6),85,IF(AND(RC[-3]>=0.6,RC[-3]<0.7),80,IF(AND(RC[-3]>=0.6,RC[-3]<1),80,IF(AND(RC[-3]>1,RC[-3]<2),50,IF(RC[-3]>2,0))))))))) ->  | I80: =IF(RC[-1]="",RC[-2],0.7*RC[-1]+0.3*RC[-2]) -> 75
A81: پست بانک ایران | B81: وپست | C81: =VLOOKUP(RC[-1],Sheet1!R3C2:R802C3,2,FALSE) -> بانکها و موسسات اعتباری | D81: =VLOOKUP(RC[-2],Sheet1!R3C2:R802C9,8,FALSE) -> 4.0387849250441219 | E81: =IF(VLOOKUP(RC[-3],Sheet1!R3C2:R803C11,10,FALSE)=0,"",VLOOKUP(Sheet2!RC[-3],Sheet1!R[1]C[-3]:R[801]C[6],10,FALSE)) ->  | F81: =Sheet1!R92C10 -> 20.170320066255385 | G81: =IF(RC[-3]<0,0,IF(AND(RC[-3]<RC[-1],RC[-3]<2),100,IF(AND(RC[-3]<RC[-1],RC[-3]>=2,RC[-3]<3),95,IF(AND(RC[-3]<RC[-1],RC[-3]>=3,RC[-3]<4),90,IF(AND(RC[-3]<RC[-1],RC[-3]>=4,RC[-3]<5),85,IF(AND(RC[-3]<RC[-1],RC[-3]>=5,RC[-3]<6),80,IF(AND(RC[-3]<RC[-1],RC[-3]>=6,RC[-3]<7),75,IF(AND(RC[-3]<RC[-1],RC[-3]>=7,RC[-3]<8),70,IF(AND(RC[-3]<RC[-1],RC[-3]>=8,RC[-3]<9),65,IF(AND(RC[-3]<RC[-1],RC[-3]>=9,RC[-3]<10),60,IF(AND(RC[-3]<RC[-1],RC[-3]>=10,RC[-3]<11),55,IF(AND(RC[-3]<RC[-1],RC[-3]>=11,RC[-3]<12),50,IF(AND(RC[-3]<RC[-1],RC[-3]>=12,RC[-3]<13),45,IF(AND(RC[-3]<RC[-1],RC[-3]>=13,RC[-3]<14),40,IF(AND(RC[-3]<RC[-1],RC[-3]>=14,RC[-3]<15),35,IF(AND(RC[-3]<RC[-1],RC[-3]>=15,RC[-3]<16),30,IF(AND(RC[-3]<RC[-1],RC[-3]>=16,RC[-3]<17),25,IF(AND(RC[-3]<RC[-1],RC[-3]>=17,RC[-3]<18),20,IF(AND(RC[-3]<RC[-1],RC[-3]>=18,RC[-3]<19),15,IF(AND(RC[-3]<RC[-1],RC[-3]>=19,RC[-3]<20),10,IF(AND(RC[-3]<RC[-1],RC[-3]>=20,RC[-3]<21),5,IF(AND(RC[-3]<RC[-1],RC[-3]>=21),0,IF(AND(RC[-3]>RC[-1],RC[-3]>=2,RC[-3]<3),90,IF(AND(RC[-3]>RC[-1],RC[-3]>=3,RC[-3]<4),90,IF(AND(RC[-3]>RC[-1],RC[-3]>=4,RC[-3]<5),80,IF(AND(RC[-3]>RC[-1],RC[-3]>=5,RC[-3]<6),70,IF(AND(RC[-3]>RC[-1],RC[-3]>=6,RC[-3]<7),60,IF(AND(RC[-3]>RC[-1],RC[-3]>=7,RC[-3]<8),50,IF(AND(RC[-3]>RC[-1],RC[-3]>=8,RC[-3]<9),40,IF(AND(RC[-3]>RC[-1],RC[-3]>=9,RC[-3]<10),30,IF(AND(RC[-3]>RC[-1],RC[-3]>=10,RC[-3]<11),20,IF(AND(RC[-3]>RC[-1],RC[-3]>=11,RC[-3]<12),10,IF(AND(RC[-3]>RC[-1],RC[-3]>=12),0))))))))))))))))))))))))))))))))) -> 85 | H81: =IF(RC[-3]="","",IF(RC[-3]<0.3,100,IF(AND(RC[-3]>=0.3,RC[-3]>0.4),95,IF(AND(RC[-3]>=0.4,RC[-3]<0.5),90,IF(AND(RC[-3]>=0.5,RC[-3]<0.6),85,IF(AND(RC[-3]>=0.6,RC[-3]<0.7),80,IF(AND(RC[-3]>=0.6,RC[-3]<1),80,IF(AND(RC[-3]>1,RC[-3]<2),50,IF(RC[-3]>2,0))))))))) ->  | I81: =IF(RC[-1]="",RC[-2],0.7*RC[-1]+0.3*RC[-2]) -> 85
A82: موسسه اعتباری نور | B82: ونور | C82: =VLOOKUP(RC[-1],Sheet1!R3C2:R802C3,2,FALSE) -> بانکها و موسسات اعتباری | D82: =VLOOKUP(RC[-2],Sheet1!R3C2:R802C9,8,FALSE) -> 0 | E82: =IF(VLOOKUP(RC[-3],Sheet1!R3C2:R803C11,10,FALSE)=0,"",VLOOKUP(Sheet2!RC[-3],Sheet1!R[1]C[-3]:R[801]C[6],10,FALSE)) ->  | F82: =Sheet1!R92C10 -> 20.170320066255385 | G82: =IF(RC[-3]<0,0,IF(AND(RC[-3]<RC[-1],RC[-3]<2),100,IF(AND(RC[-3]<RC[-1],RC[-3]>=2,RC[-3]<3),95,IF(AND(RC[-3]<RC[-1],RC[-3]>=3,RC[-3]<4),90,IF(AND(RC[-3]<RC[-1],RC[-3]>=4,RC[-3]<5),85,IF(AND(RC[-3]<RC[-1],RC[-3]>=5,RC[-3]<6),80,IF(AND(RC[-3]<RC[-1],RC[-3]>=6,RC[-3]<7),75,IF(AND(RC[-3]<RC[-1],RC[-3]>=7,RC[-3]<8),70,IF(AND(RC[-3]<RC[-1],RC[-3]>=8,RC[-3]<9),65,IF(AND(RC[-3]<RC[-1],RC[-3]>=9,RC[-3]<10),60,IF(AND(RC[-3]<RC[-1],RC[-3]>=10,RC[-3]<11),55,IF(AND(RC[-3]<RC[-1],RC[-3]>=11,RC[-3]<12),50,IF(AND(RC[-3]<RC[-1],RC[-3]>=12,RC[-3]<13),45,IF(AND(RC[-3]<RC[-1],RC[-3]>=13,RC[-3]<14),40,IF(AND(RC[-3]<RC[-1],RC[-3]>=14,RC[-3]<15),35,IF(AND(RC[-3]<RC[-1],RC[-3]>=15,RC[-3]<16),30,IF(AND(RC[-3]<RC[-1],RC[-3]>=16,RC[-3]<17),25,IF(AND(RC[-3]<RC[-1],RC[-3]>=17,RC[-3]<18),20,IF(AND(RC[-3]<RC[-1],RC[-3]>=18,RC[-3]<19),15,IF(AND(RC[-3]<RC[-1],RC[-3]>=19,RC[-3]<20),10,IF(AND(RC[-3]<RC[-1],RC[-3]>=20,RC[-3]<21),5,IF(AND(RC[-3]<RC[-1],RC[-3]>=21),0,IF(AND(RC[-3]>RC[-1],RC[-3]>=2,RC[-3]<3),90,IF(AND(RC[-3]>RC[-1],RC[-3]>=3,RC[-3]<4),90,IF(AND(RC[-3]>RC[-1],RC[-3]>=4,RC[-3]<5),80,IF(AND(RC[-3]>RC[-1],RC[-3]>=5,RC[-3]<6),70,IF(AND(RC[-3]>RC[-1],RC[-3]>=6,RC[-3]<7),60,IF(AND(RC[-3]>RC[-1],RC[-3]>=7,RC[-3]<8),50,IF(AND(RC[-3]>RC[-1],RC[-3]>=8,RC[-3]<9),40,IF(AND(RC[-3]>RC[-1],RC[-3]>=9,RC[-3]<10),30,IF(AND(RC[-3]>RC[-1],RC[-3]>=10,RC[-3]<11),20,IF(AND(RC[-3]>RC[-1],RC[-3]>=11,RC[-3]<12),10,IF(AND(RC[-3]>RC[-1],RC[-3]>=12),0))))))))))))))))))))))))))))))))) -> 100 | H82: =IF(RC[-3]="","",IF(RC[-3]<0.3,100,IF(AND(RC[-3]>=0.3,RC[-3]>0.4),95,IF(AND(RC[-3]>=0.4,RC[-3]<0.5),90,IF(AND(RC[-3]>=0.5,RC[-3]<0.6),85,IF(AND(RC[-3]>=0.6,RC[-3]<0.7),80,IF(AND(RC[-3]>=0.6,RC[-3]<1),80,IF(AND(RC[-3]>1,RC[-3]<2),50,IF(RC[-3]>2,0))))))))) ->  | I82: =IF(RC[-1]="",RC[-2],0.7*RC[-1]+0.3*RC[-2]) -> 100
A83: بیمه آرمان | B83: آرمان | C83: =VLOOKUP(RC[-1],Sheet1!R3C2:R802C3,2,FALSE) -> بیمه و بازنشستگی | D83: =VLOOKUP(RC[-2],Sheet1!R3C2:R802C9,8,FALSE) -> 42.934823631310003 | E83: =IF(VLOOKUP(RC[-3],Sheet1!R3C2:R803C11,10,FALSE)=0,"",VLOOKUP(Sheet2!RC[-3],Sheet1!R[1]C[-3]:R[801]C[6],10,FALSE)) ->  | F83: =Sheet1!R[40]C[4] -> 15.41158038128737 | G83: =IF(RC[-3]<0,0,IF(AND(RC[-3]<RC[-1],RC[-3]<2),100,IF(AND(RC[-3]<RC[-1],RC[-3]>=2,RC[-3]<3),95,IF(AND(RC[-3]<RC[-1],RC[-3]>=3,RC[-3]<4),90,IF(AND(RC[-3]<RC[-1],RC[-3]>=4,RC[-3]<5),85,IF(AND(RC[-3]<RC[-1],RC[-3]>=5,RC[-3]<6),80,IF(AND(RC[-3]<RC[-1],RC[-3]>=6,RC[-3]<7),75,IF(AND(RC[-3]<RC[-1],RC[-3]>=7,RC[-3]<8),70,IF(AND(RC[-3]<RC[-1],RC[-3]>=8,RC[-3]<9),65,IF(AND(RC[-3]<RC[-1],RC[-3]>=9,RC[-3]<10),60,IF(AND(RC[-3]<RC[-1],RC[-3]>=10,RC[-3]<11),55,IF(AND(RC[-3]<RC[-1],RC[-3]>=11,RC[-3]<12),50,IF(AND(RC[-3]<RC[-1],RC[-3]>=12,RC[-3]<13),45,IF(AND(RC[-3]<RC[-1],RC[-3]>=13,RC[-3]<14),40,IF(AND(RC[-3]<RC[-1],RC[-3]>=14,RC[-3]<15),35,IF(AND(RC[-3]<RC[-1],RC[-3]>=15,RC[-3]<16),30,IF(AND(RC[-3]<RC[-1],RC[-3]>=16,RC[-3]<17),25,IF(AND(RC[-3]<RC[-1],RC[-3]>=17,RC[-3]<18),20,IF(AND(RC[-3]<RC[-1],RC[-3]>=18,RC[-3]<19),15,IF(AND(RC[-3]<RC[-1],RC[-3]>=19,RC[-3]<20),10,IF(AND(RC[-3]<RC[-1],RC[-3]>=20,RC[-3]<21),5,IF(AND(RC[-3]<RC[-1],RC[-3]>=21),0,IF(AND(RC[-3]>RC[-1],RC[-3]>=2,RC[-3]<3),90,IF(AND(RC[-3]>RC[-1],RC[-3]>=3,RC[-3]<4),90,IF(AND(RC[-3]>RC[-1],RC[-3]>=4,RC[-3]<5),80,IF(AND(RC[-3]>RC[-1],RC[-3]>=5,RC[-3]<6),70,IF(AND(RC[-3]>RC[-1],RC[-3]>=6,RC[-3]<7),60,IF(AND(RC[-3]>RC[-1],RC[-3]>=7,RC[-3]<8),50,IF(AND(RC[-3]>RC[-1],RC[-3]>=8,RC[-3]<9),40,IF(AND(RC[-3]>RC[-1],RC[-3]>=9,RC[-3]<10),30,IF(AND(RC[-3]>RC[-1],RC[-3]>=10,RC[-3]<11),20,IF(AND(RC[-3]>RC[-1],RC[-3]>=11,RC[-3]<12),10,IF(AND(RC[-3]>RC[-1],RC[-3]>=12),0))))))))))))))))))))))))))))))))) -> 0 | H83: =IF(RC[-3]="","",IF(RC[-3]<0.3,100,IF(AND(RC[-3]>=0.3,RC[-3]>0.4),95,IF(AND(RC[-3]>=0.4,RC[-3]<0.5),90,IF(AND(RC[-3]>=0.5,RC[-3]<0.6),85,IF(AND(RC[-3]>=0.6,RC[-3]<0.7),80,IF(AND(RC[-3]>=0.6,RC[-3]<1),80,IF(AND(RC[-3]>1,RC[-3]<2),50,IF(RC[-3]>2,0))))))))) ->  | I83: =IF(RC[-1]="",RC[-2],0.7*RC[-1]+0.3*RC[-2]) -> 0
A84: بیمه آسیا | B84: آسیا | C84: =VLOOKUP(RC[-1],Sheet1!R3C2:R802C3,2,FALSE) -> بیمه و بازنشستگی | D84: =VLOOKUP(RC[-2],Sheet1!R3C2:R802C9,8,FALSE) -> 4.9399921125749993 | E84: =IF(VLOOKUP(RC[-3],Sheet1!R3C2:R803C11,10,FALSE)=0,"",VLOOKUP(Sheet2!RC[-3],Sheet1!R[1]C[-3]:R[801]C[6],10,FALSE)) ->  | F84: =Sheet1!R[40]C[4] -> 15.718017700331446 | G84: =IF(RC[-3]<0,0,IF(AND(RC[-3]<RC[-1],RC[-3]<2),100,IF(AND(RC[-3]<RC[-1],RC[-3]>=2,RC[-3]<3),95,IF(AND(RC[-3]<RC[-1],RC[-3]>=3,RC[-3]<4),90,IF(AND(RC[-3]<RC[-1],RC[-3]>=4,RC[-3]<5),85,IF(AND(RC[-3]<RC[-1],RC[-3]>=5,RC[-3]<6),80,IF(AND(RC[-3]<RC[-1],RC[-3]>=6,RC[-3]<7),75,IF(AND(RC[-3]<RC[-1],RC[-3]>=7,RC[-3]<8),70,IF(AND(RC[-3]<RC[-1],RC[-3]>=8,RC[-3]<9),65,IF(AND(RC[-3]<RC[-1],RC[-3]>=9,RC[-3]<10),60,IF(AND(RC[-3]<RC[-1],RC[-3]>=10,RC[-3]<11),55,IF(AND(RC[-3]<RC[-1],RC[-3]>=11,RC[-3]<12),50,IF(AND(RC[-3]<RC[-1],RC[-3]>=12,RC[-3]<13),45,IF(AND(RC[-3]<RC[-1],RC[-3]>=13,RC[-3]<14),40,IF(AND(RC[-3]<RC[-1],RC[-3]>=14,RC[-3]<15),35,IF(AND(RC[-3]<RC[-1],RC[-3]>=15,RC[-3]<16),30,IF(AND(RC[-3]<RC[-1],RC[-3]>=16,RC[-3]<17),25,IF(AND(RC[-3]<RC[-1],RC[-3]>=17,RC[-3]<18),20,IF(AND(RC[-3]<RC[-1],RC[-3]>=18,RC[-3]<19),15,IF(AND(RC[-3]<RC[-1],RC[-3]>=19,RC[-3]<20),10,IF(AND(RC[-3]<RC[-1],RC[-3]>=20,RC[-3]<21),5,IF(AND(RC[-3]<RC[-1],RC[-3]>=21),0,IF(AND(RC[-3]>RC[-1],RC[-3]>=2,RC[-3]<3),90,IF(AND(RC[-3]>RC[-1],RC[-3]>=3,RC[-3]<4),90,IF(AND(RC[-3]>RC[-1],RC[-3]>=4,RC[-3]<5),80,IF(AND(RC[-3]>RC[-1],RC[-3]>=5,RC[-3]<6),70,IF(AND(RC[-3]>RC[-1],RC[-3]>=6,RC[-3]<7),60,IF(AND(RC[-3]>RC[-1],RC[-3]>=7,RC[-3]<8),50,IF(AND(RC[-3]>RC[-1],RC[-3]>=8,RC[-3]<9),40,IF(AND(RC[-3]>RC[-1],RC[-3]>=9,RC[-3]<10),30,IF(AND(RC[-3]>RC[-1],RC[-3]>=10,RC[-3]<11),20,IF(AND(RC[-3]>RC[-1],RC[-3]>=11,RC[-3]<12),10,IF(AND(RC[-3]>RC[-1],RC[-3]>=12),0))))))))))))))))))))))))))))))))) -> 85 | H84: =IF(RC[-3]="","",IF(RC[-3]<0.3,100,IF(AND(RC[-3]>=0.3,RC[-3]>0.4),95,IF(AND(RC[-3]>=0.4,RC[-3]<0.5),90,IF(AND(RC[-3]>=0.5,RC[-3]<0.6),85,IF(AND(RC[-3]>=0.6,RC[-3]<0.7),80,IF(AND(RC[-3]>=0.6,RC[-3]<1),80,IF(AND(RC[-3]>1,RC[-3]<2),50,IF(RC[-3]>2,0))))))))) ->  | I84: =IF(RC[-1]="",RC[-2],0.7*RC[-1]+0.3*RC[-2]) -> 85
A85: بیمه اتکائی امین | B85: اتکام | C85: =VLOOKUP(RC[-1],Sheet1!R3C2:R802C3,2,FALSE) -> بیمه و بازنشستگی | D85: =VLOOKUP(RC[-2],Sheet1!R3C2:R802C9,8,FALSE) -> 5.5364677064486365 | E85: =IF(VLOOKUP(RC[-3],Sheet1!R3C2:R803C11,10,FALSE)=0,"",VLOOKUP(Sheet2!RC[-3],Sheet1!R[1]C[-3]:R[801]C[6],10,FALSE)) ->  | F85: =Sheet1!R[40]C[4] -> 20.752760298010323 | G85: =IF(RC[-3]<0,0,IF(AND(RC[-3]<RC[-1],RC[-3]<2),100,IF(AND(RC[-3]<RC[-1],RC[-3]>=2,RC[-3]<3),95,IF(AND(RC[-3]<RC[-1],RC[-3]>=3,RC[-3]<4),90,IF(AND(RC[-3]<RC[-1],RC[-3]>=4,RC[-3]<5),85,IF(AND(RC[-3]<RC[-1],RC[-3]>=5,RC[-3]<6),80,IF(AND(RC[-3]<RC[-1],RC[-3]>=6,RC[-3]<7),75,IF(AND(RC[-3]<RC[-1],RC[-3]>=7,RC[-3]<8),70,IF(AND(RC[-3]<RC[-1],RC[-3]>=8,RC[-3]<9),65,IF(AND(RC[-3]<RC[-1],RC[-3]>=9,RC[-3]<10),60,IF(AND(RC[-3]<RC[-1],RC[-3]>=10,RC[-3]<11),55,IF(AND(RC[-3]<RC[-1],RC[-3]>=11,RC[-3]<12),50,IF(AND(RC[-3]<RC[-1],RC[-3]>=12,RC[-3]<13),45,IF(AND(RC[-3]<RC[-1],RC[-3]>=13,RC[-3]<14),40,IF(AND(RC[-3]<RC[-1],RC[-3]>=14,RC[-3]<15),35,IF(AND(RC[-3]<RC[-1],RC[-3]>=15,RC[-3]<16),30,IF(AND(RC[-3]<RC[-1],RC[-3]>=16,RC[-3]<17),25,IF(AND(RC[-3]<RC[-1],RC[-3]>=17,RC[-3]<18),20,IF(AND(RC[-3]<RC[-1],RC[-3]>=18,RC[-3]<19),15,IF(AND(RC[-3]<RC[-1],RC[-3]>=19,RC[-3]<20),10,IF(AND(RC[-3]<RC[-1],RC[-3]>=20,RC[-3]<21),5,IF(AND(RC[-3]<RC[-1],RC[-3]>=21),0,IF(AND(RC[-3]>RC[-1],RC[-3]>=2,RC[-3]<3),90,IF(AND(RC[-3]>RC[-1],RC[-3]>=3,RC[-3]<4),90,IF(AND(RC[-3]>RC[-1],RC[-3]>=4,RC[-3]<5),80,IF(AND(RC[-3]>RC[-1],RC[-3]>=5,RC[-3]<6),70,IF(AND(RC[-3]>RC[-1],RC[-3]>=6,RC[-3]<7),60,IF(AND(RC[-3]>RC[-1],RC[-3]>=7,RC[-3]<8),50,IF(AND(RC[-3]>RC[-1],RC[-3]>=8,RC[-3]<9),40,IF(AND(RC[-3]>RC[-1],RC[-3]>=9,RC[-3]<10),30,IF(AND(RC[-3]>RC[-1],RC[-3]>=10,RC[-3]<11),20,IF(AND(RC[-3]>RC[-1],RC[-3]>=11,RC[-3]<12),10,IF(AND(RC[-3]>RC[-1],RC[-3]>=12),0))))))))))))))))))))))))))))))))) -> 80 | H85: =IF(RC[-3]="","",IF(RC[-3]<0.3,100,IF(AND(RC[-3]>=0.3,RC[-3]>0.4),95,IF(AND(RC[-3]>=0.4,RC[-3]<0.5),90,IF(AND(RC[-3]>=0.5,RC[-3]<0.6),85,IF(AND(RC[-3]>=0.6,RC[-3]<0.7),80,IF(AND(RC[-3]>=0.6,RC[-3]<1),80,IF(AND(RC[-3]>1,RC[-3]<2),50,IF(RC[-3]>2,0))))))))) ->  | I85: =IF(RC[-1]="",RC[-2],0.7*RC[-1]+0.3*RC[-2]) -> 80
A86: بیمه اتکائی ایرانیان | B86: اتکای | C86: =VLOOKUP(RC[-1],Sheet1!R3C2:R802C3,2,FALSE) -> بیمه و بازنشستگی | D86: =VLOOKUP(RC[-2],Sheet1!R3C2:R802C9,8,FALSE) -> 5.1597271309161581 | E86: =IF(VLOOKUP(RC[-3],Sheet1!R3C2:R803C11,10,FALSE)=0,"",VLOOKUP(Sheet2!RC[-3],Sheet1!R[1]C[-3]:R[801]C[6],10,FALSE)) ->  | F86: =Sheet1!R[40]C[4] -> 36.470777998341767 | G86: =IF(RC[-3]<0,0,IF(AND(RC[-3]<RC[-1],RC[-3]<2),100,IF(AND(RC[-3]<RC[-1],RC[-3]>=2,RC[-3]<3),95,IF(AND(RC[-3]<RC[-1],RC[-3]>=3,RC[-3]<4),90,IF(AND(RC[-3]<RC[-1],RC[-3]>=4,RC[-3]<5),85,IF(AND(RC[-3]<RC[-1],RC[-3]>=5,RC[-3]<6),80,IF(AND(RC[-3]<RC[-1],RC[-3]>=6,RC[-3]<7),75,IF(AND(RC[-3]<RC[-1],RC[-3]>=7,RC[-3]<8),70,IF(AND(RC[-3]<RC[-1],RC[-3]>=8,RC[-3]<9),65,IF(AND(RC[-3]<RC[-1],RC[-3]>=9,RC[-3]<10),60,IF(AND(RC[-3]<RC[-1],RC[-3]>=10,RC[-3]<11),55,IF(AND(RC[-3]<RC[-1],RC[-3]>=11,RC[-3]<12),50,IF(AND(RC[-3]<RC[-1],RC[-3]>=12,RC[-3]<13),45,IF(AND(RC[-3]<RC[-1],RC[-3]>=13,RC[-3]<14),40,IF(AND(RC[-3]<RC[-1],RC[-3]>=14,RC[-3]<15),35,IF(AND(RC[-3]<RC[-1],RC[-3]>=15,RC[-3]<16),30,IF(AND(RC[-3]<RC[-1],RC[-3]>=16,RC[-3]<17),25,IF(AND(RC[-3]<RC[-1],RC[-3]>=17,RC[-3]<18),20,IF(AND(RC[-3]<RC[-1],RC[-3]>=18,RC[-3]<19),15,IF(AND(RC[-3]<RC[-1],RC[-3]>=19,RC[-3]<20),10,IF(AND(RC[-3]<RC[-1],RC[-3]>=20,RC[-3]<21),5,IF(AND(RC[-3]<RC[-1],RC[-3]>=21),0,IF(AND(RC[-3]>RC[-1],RC[-3]>=2,RC[-3]<3),90,IF(AND(RC[-3]>RC[-1],RC[-3]>=3,RC[-3]<4),90,IF(AND(RC[-3]>RC[-1],RC[-3]>=4,RC[-3]<5),80,IF(AND(RC[-3]>RC[-1],RC[-3]>=5,RC[-3]<6),70,IF(AND(RC[-3]>RC[-1],RC[-3]>=6,RC[-3]<7),60,IF(AND(RC[-3]>RC[-1],RC[-3]>=7,RC[-3]<8),50,IF(AND(RC[-3]>RC[-1],RC[-3]>=8,RC[-3]<9),40,IF(AND(RC[-3]>RC[-1],RC[-3]>=9,RC[-3]<10),30,IF(AND(RC[-3]>RC[-1],RC[-3]>=10,RC[-3]<11),20,IF(AND(RC[-3]>RC[-1],RC[-3]>=11,RC[-3]<12),10,IF(AND(RC[-3]>RC[-1],RC[-3]>=12),0))))))))))))))))))))))))))))))))) -> 80 | H86: =IF(RC[-3]="","",IF(RC[-3]<0.3,100,IF(AND(RC[-3]>=0.3,RC[-3]>0.4),95,IF(AND(RC[-3]>=0.4,RC[-3]<0.5),90,IF(AND(RC[-3]>=0.5,RC[-3]<0.6),85,IF(AND(RC[-3]>=0.6,RC[-3]<0.7),80,IF(AND(RC[-3]>=0.6,RC[-3]<1),80,IF(AND(RC[-3]>1,RC[-3]<2),50,IF(RC[-3]>2,0))))))))) ->  | I86: =IF(RC[-1]="",RC[-2],0.7*RC[-1]+0.3*RC[-2]) -> 80
A87: بیمه اتکای آوای پارس | B87: آواپارس | C87: =VLOOKUP(RC[-1],Sheet1!R3C2:R802C3,2,FALSE) -> بیمه و بازنشستگی | D87: =VLOOKUP(RC[-2],Sheet1!R3C2:R802C9,8,FALSE) -> 1.3168039229800002 | E87: =IF(VLOOKUP(RC[-3],Sheet1!R3C2:R803C11,10,FALSE)=0,"",VLOOKUP(Sheet2!RC[-3],Sheet1!R[1]C[-3]:R[801]C[6],10,FALSE)) ->  | F87: =Sheet1!R[40]C[4] -> 0 | G87: =IF(RC[-3]<0,0,IF(AND(RC[-3]<RC[-1],RC[-3]<2),100,IF(AND(RC[-3]<RC[-1],RC[-3]>=2,RC[-3]<3),95,IF(AND(RC[-3]<RC[-1],RC[-3]>=3,RC[-3]<4),90,IF(AND(RC[-3]<RC[-1],RC[-3]>=4,RC[-3]<5),85,IF(AND(RC[-3]<RC[-1],RC[-3]>=5,RC[-3]<6),80,IF(AND(RC[-3]<RC[-1],RC[-3]>=6,RC[-3]<7),75,IF(AND(RC[-3]<RC[-1],RC[-3]>=7,RC[-3]<8),70,IF(AND(RC[-3]<RC[-1],RC[-3]>=8,RC[-3]<9),65,IF(AND(RC[-3]<RC[-1],RC[-3]>=9,RC[-3]<10),60,IF(AND(RC[-3]<RC[-1],RC[-3]>=10,RC[-3]<11),55,IF(AND(RC[-3]<RC[-1],RC[-3]>=11,RC[-3]<12),50,IF(AND(RC[-3]<RC[-1],RC[-3]>=12,RC[-3]<13),45,IF(AND(RC[-3]<RC[-1],RC[-3]>=13,RC[-3]<14),40,IF(AND(RC[-3]<RC[-1],RC[-3]>=14,RC[-3]<15),35,IF(AND(RC[-3]<RC[-1],RC[-3]>=15,RC[-3]<16),30,IF(AND(RC[-3]<RC[-1],RC[-3]>=16,RC[-3]<17),25,IF(AND(RC[-3]<RC[-1],RC[-3]>=17,RC[-3]<18),20,IF(AND(RC[-3]<RC[-1],RC[-3]>=18,RC[-3]<19),15,IF(AND(RC[-3]<RC[-1],RC[-3]>=19,RC[-3]<20),10,IF(AND(RC[-3]<RC[-1],RC[-3]>=20,RC[-3]<21),5,IF(AND(RC[-3]<RC[-1],RC[-3]>=21),0,IF(AND(RC[-3]>RC[-1],RC[-3]>=2,RC[-3]<3),90,IF(AND(RC[-3]>RC[-1],RC[-3]>=3,RC[-3]<4),90,IF(AND(RC[-3]>RC[-1],RC[-3]>=4,RC[-3]<5),80,IF(AND(RC[-3]>RC[-1],RC[-3]>=5,RC[-3]<6),70,IF(AND(RC[-3]>RC[-1],RC[-3]>=6,RC[-3]<7),60,IF(AND(RC[-3]>RC[-1],RC[-3]>=7,RC[-3]<8),50,IF(AND(RC[-3]>RC[-1],RC[-3]>=8,RC[-3]<9),40,IF(AND(RC[-3]>RC[-1],RC[-3]>=9,RC[-3]<10),30,IF(AND(RC[-3]>RC[-1],RC[-3]>=10,RC[-3]<11),20,IF(AND(RC[-3]>RC[-1],RC[-3]>=11,RC[-3]<12),10,IF(AND(RC[-3]>RC[-1],RC[-3]>=12),0))))))))))))))))))))))))))))))))) -> 0 | H87: =IF(RC[-3]="","",IF(RC[-3]<0.3,100,IF(AND(RC[-3]>=0.3,RC[-3]>0.4),95,IF(AND(RC[-3]>=0.4,RC[-3]<0.5),90,IF(AND(RC[-3]>=0.5,RC[-3]<0.6),85,IF(AND(RC[-3]>=0.6,RC[-3]<0.7),80,IF(AND(RC[-3]>=0.6,RC[-3]<1),80,IF(AND(RC[-3]>1,RC[-3]<2),50,IF(RC[-3]>2,0))))))))) ->  | I87: =IF(RC[-1]="",RC[-2],0.7*RC[-1]+0.3*RC[-2]) -> 0
A88: بیمه اتکایی سامان | B88: اتکاسا | C88: =VLOOKUP(RC[-1],Sheet1!R3C2:R802C3,2,FALSE) -> بیمه و بازنشستگی | D88: =VLOOKUP(RC[-2],Sheet1!R3C2:R802C9,8,FALSE) -> 0.59643358407750002 | E88: =IF(VLOOKUP(RC[-3],Sheet1!R3C2:R803C11,10,FALSE)=0,"",VLOOKUP(Sheet2!RC[-3],Sheet1!R[1]C[-3]:R[801]C[6],10,FALSE)) ->  | F88: =Sheet1!R[40]C[4] -> 0 | G88: =IF(RC[-3]<0,0,IF(AND(RC[-3]<RC[-1],RC[-3]<2),100,IF(AND(RC[-3]<RC[-1],RC[-3]>=2,RC[-3]<3),95,IF(AND(RC[-3]<RC[-1],RC[-3]>=3,RC[-3]<4),90,IF(AND(RC[-3]<RC[-1],RC[-3]>=4,RC[-3]<5),85,IF(AND(RC[-3]<RC[-1],RC[-3]>=5,RC[-3]<6),80,IF(AND(RC[-3]<RC[-1],RC[-3]>=6,RC[-3]<7),75,IF(AND(RC[-3]<RC[-1],RC[-3]>=7,RC[-3]<8),70,IF(AND(RC[-3]<RC[-1],RC[-3]>=8,RC[-3]<9),65,IF(AND(RC[-3]<RC[-1],RC[-3]>=9,RC[-3]<10),60,IF(AND(RC[-3]<RC[-1],RC[-3]>=10,RC[-3]<11),55,IF(AND(RC[-3]<RC[-1],RC[-3]>=11,RC[-3]<12),50,IF(AND(RC[-3]<RC[-1],RC[-3]>=12,RC[-3]<13),45,IF(AND(RC[-3]<RC[-1],RC[-3]>=13,RC[-3]<14),40,IF(AND(RC[-3]<RC[-1],RC[-3]>=14,RC[-3]<15),35,IF(AND(RC[-3]<RC[-1],RC[-3]>=15,RC[-3]<16),30,IF(AND(RC[-3]<RC[-1],RC[-3]>=16,RC[-3]<17),25,IF(AND(RC[-3]<RC[-1],RC[-3]>=17,RC[-3]<18),20,IF(AND(RC[-3]<RC[-1],RC[-3]>=18,RC[-3]<19),15,IF(AND(RC[-3]<RC[-1],RC[-3]>=19,RC[-3]<20),10,IF(AND(RC[-3]<RC[-1],RC[-3]>=20,RC[-3]<21),5,IF(AND(RC[-3]<RC[-1],RC[-3]>=21),0,IF(AND(RC[-3]>RC[-1],RC[-3]>=2,RC[-3]<3),90,IF(AND(RC[-3]>RC[-1],RC[-3]>=3,RC[-3]<4),90,IF(AND(RC[-3]>RC[-1],RC[-3]>=4,RC[-3]<5),80,IF(AND(RC[-3]>RC[-1],RC[-3]>=5,RC[-3]<6),70,IF(AND(RC[-3]>RC[-1],RC[-3]>=6,RC[-3]<7),60,IF(AND(RC[-3]>RC[-1],RC[-3]>=7,RC[-3]<8),50,IF(AND(RC[-3]>RC[-1],RC[-3]>=8,RC[-3]<9),40,IF(AND(RC[-3]>RC[-1],RC[-3]>=9,RC[-3]<10),30,IF(AND(RC[-3]>RC[-1],RC[-3]>=10,RC[-3]<11),20,IF(AND(RC[-3]>RC[-1],RC[-3]>=11,RC[-3]<12),10,IF(AND(RC[-3]>RC[-1],RC[-3]>=12),0))))))))))))))))))))))))))))))))) -> 0 | H88: =IF(RC[-3]="","",IF(RC[-3]<0.3,100,IF(AND(RC[-3]>=0.3,RC[-3]>0.4),95,IF(AND(RC[-3]>=0.4,RC[-3]<0.5),90,IF(AND(RC[-3]>=0.5,RC[-3]<0.6),85,IF(AND(RC[-3]>=0.6,RC[-3]<0.7),80,IF(AND(RC[-3]>=0.6,RC[-3]<1),80,IF(AND(RC[-3]>1,RC[-3]<2),50,IF(RC[-3]>2,0))))))))) ->  | I88: =IF(RC[-1]="",RC[-2],0.7*RC[-1]+0.3*RC[-2]) -> 0
A89: بیمه البرز | B89: البرز | C89: =VLOOKUP(RC[-1],Sheet1!R3C2:R802C3,2,FALSE) -> بیمه و بازنشستگی | D89: =VLOOKUP(RC[-2],Sheet1!R3C2:R802C9,8,FALSE) -> 4.058651002615222 | E89: =IF(VLOOKUP(RC[-3],Sheet1!R3C2:R803C11,10,FALSE)=0,"",VLOOKUP(Sheet2!RC[-3],Sheet1!R[1]C[-3]:R[801]C[6],10,FALSE)) ->  | F89: =Sheet1!R[40]C[4] -> 0 | G89: =IF(RC[-3]<0,0,IF(AND(RC[-3]<RC[-1],RC[-3]<2),100,IF(AND(RC[-3]<RC[-1],RC[-3]>=2,RC[-3]<3),95,IF(AND(RC[-3]<RC[-1],RC[-3]>=3,RC[-3]<4),90,IF(AND(RC[-3]<RC[-1],RC[-3]>=4,RC[-3]<5),85,IF(AND(RC[-3]<RC[-1],RC[-3]>=5,RC[-3]<6),80,IF(AND(RC[-3]<RC[-1],RC[-3]>=6,RC[-3]<7),75,IF(AND(RC[-3]<RC[-1],RC[-3]>=7,RC[-3]<8),70,IF(AND(RC[-3]<RC[-1],RC[-3]>=8,RC[-3]<9),65,IF(AND(RC[-3]<RC[-1],RC[-3]>=9,RC[-3]<10),60,IF(AND(RC[-3]<RC[-1],RC[-3]>=10,RC[-3]<11),55,IF(AND(RC[-3]<RC[-1],RC[-3]>=11,RC[-3]<12),50,IF(AND(RC[-3]<RC[-1],RC[-3]>=12,RC[-3]<13),45,IF(AND(RC[-3]<RC[-1],RC[-3]>=13,RC[-3]<14),40,IF(AND(RC[-3]<RC[-1],RC[-3]>=14,RC[-3]<15),35,IF(AND(RC[-3]<RC[-1],RC[-3]>=15,RC[-3]<16),30,IF(AND(RC[-3]<RC[-1],RC[-3]>=16,RC[-3]<17),25,IF(AND(RC[-3]<RC[-1],RC[-3]>=17,RC[-3]<18),20,IF(AND(RC[-3]<RC[-1],RC[-3]>=18,RC[-3]<19),15,IF(AND(RC[-3]<RC[-1],RC[-3]>=19,RC[-3]<20),10,IF(AND(RC[-3]<RC[-1],RC[-3]>=20,RC[-3]<21),5,IF(AND(RC[-3]<RC[-1],RC[-3]>=21),0,IF(AND(RC[-3]>RC[-1],RC[-3]>=2,RC[-3]<3),90,IF(AND(RC[-3]>RC[-1],RC[-3]>=3,RC[-3]<4),90,IF(AND(RC[-3]>RC[-1],RC[-3]>=4,RC[-3]<5),80,IF(AND(RC[-3]>RC[-1],RC[-3]>=5,RC[-3]<6),70,IF(AND(RC[-3]>RC[-1],RC[-3]>=6,RC[-3]<7),60,IF(AND(RC[-3]>RC[-1],RC[-3]>=7,RC[-3]<8),50,IF(AND(RC[-3]>RC[-1],RC[-3]>=8,RC[-3]<9),40,IF(AND(RC[-3]>RC[-1],RC[-3]>=9,RC[-3]<10),30,IF(AND(RC[-3]>RC[-1],RC[-3]>=10,RC[-3]<11),20,IF(AND(RC[-3]>RC[-1],RC[-3]>=11,RC[-3]<12),10,IF(AND(RC[-3]>RC[-1],RC[-3]>=12),0))))))))))))))))))))))))))))))))) -> 80 | H89: =IF(RC[-3]="","",IF(RC[-3]<0.3,100,IF(AND(RC[-3]>=0.3,RC[-3]>0.4),95,IF(AND(RC[-3]>=0.4,RC[-3]<0.5),90,IF(AND(RC[-3]>=0.5,RC[-3]<0.6),85,IF(AND(RC[-3]>=0.6,RC[-3]<0.7),80,IF(AND(RC[-3]>=0.6,RC[-3]<1),80,IF(AND(RC[-3]>1,RC[-3]<2),50,IF(RC[-3]>2,0))))))))) ->  | I89: =IF(RC[-1]="",RC[-2],0.7*RC[-1]+0.3*RC[-2]) -> 80
A90: بیمه پارسیان | B90: پارسیان | C90: =VLOOKUP(RC[-1],Sheet1!R3C2:R802C3,2,FALSE) -> بیمه و بازنشستگی | D90: =VLOOKUP(RC[-2],Sheet1!R3C2:R802C9,8,FALSE) -> 16.209419897107978 | E90: =IF(VLOOKUP(RC[-3],Sheet1!R3C2:R803C11,10,FALSE)=0,"",VLOOKUP(Sheet2!RC[-3],Sheet1!R[1]C[-3]:R[801]C[6],10,FALSE)) ->  | F90: =Sheet1!R[40]C[4] -> 0 | G90: =IF(RC[-3]<0,0,IF(AND(RC[-3]<RC[-1],RC[-3]<2),100,IF(AND(RC[-3]<RC[-1],RC[-3]>=2,RC[-3]<3),95,IF(AND(RC[-3]<RC[-1],RC[-3]>=3,RC[-3]<4),90,IF(AND(RC[-3]<RC[-1],RC[-3]>=4,RC[-3]<5),85,IF(AND(RC[-3]<RC[-1],RC[-3]>=5,RC[-3]<6),80,IF(AND(RC[-3]<RC[-1],RC[-3]>=6,RC[-3]<7),75,IF(AND(RC[-3]<RC[-1],RC[-3]>=7,RC[-3]<8),70,IF(AND(RC[-3]<RC[-1],RC[-3]>=8,RC[-3]<9),65,IF(AND(RC[-3]<RC[-1],RC[-3]>=9,RC[-3]<10),60,IF(AND(RC[-3]<RC[-1],RC[-3]>=10,RC[-3]<11),55,IF(AND(RC[-3]<RC[-1],RC[-3]>=11,RC[-3]<12),50,IF(AND(RC[-3]<RC[-1],RC[-3]>=12,RC[-3]<13),45,IF(AND(RC[-3]<RC[-1],RC[-3]>=13,RC[-3]<14),40,IF(AND(RC[-3]<RC[-1],RC[-3]>=14,RC[-3]<15),35,IF(AND(RC[-3]<RC[-1],RC[-3]>=15,RC[-3]<16),30,IF(AND(RC[-3]<RC[-1],RC[-3]>=16,RC[-3]<17),25,IF(AND(RC[-3]<RC[-1],RC[-3]>=17,RC[-3]<18),20,IF(AND(RC[-3]<RC[-1],RC[-3]>=18,RC[-3]<19),15,IF(AND(RC[-3]<RC[-1],RC[-3]>=19,RC[-3]<20),10,IF(AND(RC[-3]<RC[-1],RC[-3]>=20,RC[-3]<21),5,IF(AND(RC[-3]<RC[-1],RC[-3]>=21),0,IF(AND(RC[-3]>RC[-1],RC[-3]>=2,RC[-3]<3),90,IF(AND(RC[-3]>RC[-1],RC[-3]>=3,RC[-3]<4),90,IF(AND(RC[-3]>RC[-1],RC[-3]>=4,RC[-3]<5),80,IF(AND(RC[-3]>RC[-1],RC[-3]>=5,RC[-3]<6),70,IF(AND(RC[-3]>RC[-1],RC[-3]>=6,RC[-3]<7),60,IF(AND(RC[-3]>RC[-1],RC[-3]>=7,RC[-3]<8),50,IF(AND(RC[-3]>RC[-1],RC[-3]>=8,RC[-3]<9),40,IF(AND(RC[-3]>RC[-1],RC[-3]>=9,RC[-3]<10),30,IF(AND(RC[-3]>RC[-1],RC[-3]>=10,RC[-3]<11),20,IF(AND(RC[-3]>RC[-1],RC[-3]>=11,RC[-3]<12),10,IF(AND(RC[-3]>RC[-1],RC[-3]>=12),0))))))))))))))))))))))))))))))))) -> 0 | H90: =IF(RC[-3]="","",IF(RC[-3]<0.3,100,IF(AND(RC[-3]>=0.3,RC[-3]>0.4),95,IF(AND(RC[-3]>=0.4,RC[-3]<0.5),90,IF(AND(RC[-3]>=0.5,RC[-3]<0.6),85,IF(AND(RC[-3]>=0.6,RC[-3]<0.7),80,IF(AND(RC[-3]>=0.6,RC[-3]<1),80,IF(AND(RC[-3]>1,RC[-3]<2),50,IF(RC[-3]>2,0))))))))) ->  | I90: =IF(RC[-1]="",RC[-2],0.7*RC[-1]+0.3*RC[-2]) -> 0
A91: بیمه پاسارگاد | B91: بپاس | C91: =VLOOKUP(RC[-1],Sheet1!R3C2:R802C3,2,FALSE) -> بیمه و بازنشستگی | D91: =VLOOKUP(RC[-2],Sheet1!R3C2:R802C9,8,FALSE) -> 16.21891205517348 | E91: =IF(VLOOKUP(RC[-3],Sheet1!R3C2:R803C11,10,FALSE)=0,"",VLOOKUP(Sheet2!RC[-3],Sheet1!R[1]C[-3]:R[801]C[6],10,FALSE)) ->  | F91: =Sheet1!R[40]C[4] -> 1.2949916184040187 | G91: =IF(RC[-3]<0,0,IF(AND(RC[-3]<RC[-1],RC[-3]<2),100,IF(AND(RC[-3]<RC[-1],RC[-3]>=2,RC[-3]<3),95,IF(AND(RC[-3]<RC[-1],RC[-3]>=3,RC[-3]<4),90,IF(AND(RC[-3]<RC[-1],RC[-3]>=4,RC[-3]<5),85,IF(AND(RC[-3]<RC[-1],RC[-3]>=5,RC[-3]<6),80,IF(AND(RC[-3]<RC[-1],RC[-3]>=6,RC[-3]<7),75,IF(AND(RC[-3]<RC[-1],RC[-3]>=7,RC[-3]<8),70,IF(AND(RC[-3]<RC[-1],RC[-3]>=8,RC[-3]<9),65,IF(AND(RC[-3]<RC[-1],RC[-3]>=9,RC[-3]<10),60,IF(AND(RC[-3]<RC[-1],RC[-3]>=10,RC[-3]<11),55,IF(AND(RC[-3]<RC[-1],RC[-3]>=11,RC[-3]<12),50,IF(AND(RC[-3]<RC[-1],RC[-3]>=12,RC[-3]<13),45,IF(AND(RC[-3]<RC[-1],RC[-3]>=13,RC[-3]<14),40,IF(AND(RC[-3]<RC[-1],RC[-3]>=14,RC[-3]<15),35,IF(AND(RC[-3]<RC[-1],RC[-3]>=15,RC[-3]<16),30,IF(AND(RC[-3]<RC[-1],RC[-3]>=16,RC[-3]<17),25,IF(AND(RC[-3]<RC[-1],RC[-3]>=17,RC[-3]<18),20,IF(AND(RC[-3]<RC[-1],RC[-3]>=18,RC[-3]<19),15,IF(AND(RC[-3]<RC[-1],RC[-3]>=19,RC[-3]<20),10,IF(AND(RC[-3]<RC[-1],RC[-3]>=20,RC[-3]<21),5,IF(AND(RC[-3]<RC[-1],RC[-3]>=21),0,IF(AND(RC[-3]>RC[-1],RC[-3]>=2,RC[-3]<3),90,IF(AND(RC[-3]>RC[-1],RC[-3]>=3,RC[-3]<4),90,IF(AND(RC[-3]>RC[-1],RC[-3]>=4,RC[-3]<5),80,IF(AND(RC[-3]>RC[-1],RC[-3]>=5,RC[-3]<6),70,IF(AND(RC[-3]>RC[-1],RC[-3]>=6,RC[-3]<7),60,IF(AND(RC[-3]>RC[-1],RC[-3]>=7,RC[-3]<8),50,IF(AND(RC[-3]>RC[-1],RC[-3]>=8,RC[-3]<9),40,IF(AND(RC[-3]>RC[-1],RC[-3]>=9,RC[-3]<10),30,IF(AND(RC[-3]>RC[-1],RC[-3]>=10,RC[-3]<11),20,IF(AND(RC[-3]>RC[-1],RC[-3]>=11,RC[-3]<12),10,IF(AND(RC[-3]>RC[-1],RC[-3]>=12),0))))))))))))))))))))))))))))))))) -> 0 | H91: =IF(RC[-3]="","",IF(RC[-3]<0.3,100,IF(AND(RC[-3]>=0.3,RC[-3]>0.4),95,IF(AND(RC[-3]>=0.4,RC[-3]<0.5),90,IF(AND(RC[-3]>=0.5,RC[-3]<0.6),85,IF(AND(RC[-3]>=0.6,RC[-3]<0.7),80,IF(AND(RC[-3]>=0.6,RC[-3]<1),80,IF(AND(RC[-3]>1,RC[-3]<2),50,IF(RC[-3]>2,0))))))))) ->  | I91: =IF(RC[-1]="",RC[-2],0.7*RC[-1]+0.3*RC[-2]) -> 0
A92: بیمه تجارت نو | B92: بنو | C92: =VLOOKUP(RC[-1],Sheet1!R3C2:R802C3,2,FALSE) -> بیمه و بازنشستگی | D92: =VLOOKUP(RC[-2],Sheet1!R3C2:R802C9,8,FALSE) -> 54.09565400944404 | E92: =IF(VLOOKUP(RC[-3],Sheet1!R3C2:R803C11,10,FALSE)=0,"",VLOOKUP(Sheet2!RC[-3],Sheet1!R[1]C[-3]:R[801]C[6],10,FALSE)) ->  | F92: =Sheet1!R[40]C[4] -> 1.5329633250047732 | G92: =IF(RC[-3]<0,0,IF(AND(RC[-3]<RC[-1],RC[-3]<2),100,IF(AND(RC[-3]<RC[-1],RC[-3]>=2,RC[-3]<3),95,IF(AND(RC[-3]<RC[-1],RC[-3]>=3,RC[-3]<4),90,IF(AND(RC[-3]<RC[-1],RC[-3]>=4,RC[-3]<5),85,IF(AND(RC[-3]<RC[-1],RC[-3]>=5,RC[-3]<6),80,IF(AND(RC[-3]<RC[-1],RC[-3]>=6,RC[-3]<7),75,IF(AND(RC[-3]<RC[-1],RC[-3]>=7,RC[-3]<8),70,IF(AND(RC[-3]<RC[-1],RC[-3]>=8,RC[-3]<9),65,IF(AND(RC[-3]<RC[-1],RC[-3]>=9,RC[-3]<10),60,IF(AND(RC[-3]<RC[-1],RC[-3]>=10,RC[-3]<11),55,IF(AND(RC[-3]<RC[-1],RC[-3]>=11,RC[-3]<12),50,IF(AND(RC[-3]<RC[-1],RC[-3]>=12,RC[-3]<13),45,IF(AND(RC[-3]<RC[-1],RC[-3]>=13,RC[-3]<14),40,IF(AND(RC[-3]<RC[-1],RC[-3]>=14,RC[-3]<15),35,IF(AND(RC[-3]<RC[-1],RC[-3]>=15,RC[-3]<16),30,IF(AND(RC[-3]<RC[-1],RC[-3]>=16,RC[-3]<17),25,IF(AND(RC[-3]<RC[-1],RC[-3]>=17,RC[-3]<18),20,IF(AND(RC[-3]<RC[-1],RC[-3]>=18,RC[-3]<19),15,IF(AND(RC[-3]<RC[-1],RC[-3]>=19,RC[-3]<20),10,IF(AND(RC[-3]<RC[-1],RC[-3]>=20,RC[-3]<21),5,IF(AND(RC[-3]<RC[-1],RC[-3]>=21),0,IF(AND(RC[-3]>RC[-1],RC[-3]>=2,RC[-3]<3),90,IF(AND(RC[-3]>RC[-1],RC[-3]>=3,RC[-3]<4),90,IF(AND(RC[-3]>RC[-1],RC[-3]>=4,RC[-3]<5),80,IF(AND(RC[-3]>RC[-1],RC[-3]>=5,RC[-3]<6),70,IF(AND(RC[-3]>RC[-1],RC[-3]>=6,RC[-3]<7),60,IF(AND(RC[-3]>RC[-1],RC[-3]>=7,RC[-3]<8),50,IF(AND(RC[-3]>RC[-1],RC[-3]>=8,RC[-3]<9),40,IF(AND(RC[-3]>RC[-1],RC[-3]>=9,RC[-3]<10),30,IF(AND(RC[-3]>RC[-1],RC[-3]>=10,RC[-3]<11),20,IF(AND(RC[-3]>RC[-1],RC[-3]>=11,RC[-3]<12),10,IF(AND(RC[-3]>RC[-1],RC[-3]>=12),0))))))))))))))))))))))))))))))))) -> 0 | H92: =IF(RC[-3]="","",IF(RC[-3]<0.3,100,IF(AND(RC[-3]>=0.3,RC[-3]>0.4),95,IF(AND(RC[-3]>=0.4,RC[-3]<0.5),90,IF(AND(RC[-3]>=0.5,RC[-3]<0.6),85,IF(AND(RC[-3]>=0.6,RC[-3]<0.7),80,IF(AND(RC[-3]>=0.6,RC[-3]<1),80,IF(AND(RC[-3]>1,RC[-3]<2),50,IF(RC[-3]>2,0))))))))) ->  | I92: =IF(RC[-1]="",RC[-2],0.7*RC[-1]+0.3*RC[-2]) -> 0
A93: بیمه تعاون | B93: وتعاون | C93: =VLOOKUP(RC[-1],Sheet1!R3C2:R802C3,2,FALSE) -> بیمه و بازنشستگی | D93: =VLOOKUP(RC[-2],Sheet1!R3C2:R802C9,8,FALSE) -> 53.871729662536985 | E93: =IF(VLOOKUP(RC[-3],Sheet1!R3C2:R803C11,10,FALSE)=0,"",VLOOKUP(Sheet2!RC[-3],Sheet1!R[1]C[-3]:R[801]C[6],10,FALSE)) ->  | F93: =Sheet1!R[40]C[4] -> 0.42416909579658069 | G93: =IF(RC[-3]<0,0,IF(AND(RC[-3]<RC[-1],RC[-3]<2),100,IF(AND(RC[-3]<RC[-1],RC[-3]>=2,RC[-3]<3),95,IF(AND(RC[-3]<RC[-1],RC[-3]>=3,RC[-3]<4),90,IF(AND(RC[-3]<RC[-1],RC[-3]>=4,RC[-3]<5),85,IF(AND(RC[-3]<RC[-1],RC[-3]>=5,RC[-3]<6),80,IF(AND(RC[-3]<RC[-1],RC[-3]>=6,RC[-3]<7),75,IF(AND(RC[-3]<RC[-1],RC[-3]>=7,RC[-3]<8),70,IF(AND(RC[-3]<RC[-1],RC[-3]>=8,RC[-3]<9),65,IF(AND(RC[-3]<RC[-1],RC[-3]>=9,RC[-3]<10),60,IF(AND(RC[-3]<RC[-1],RC[-3]>=10,RC[-3]<11),55,IF(AND(RC[-3]<RC[-1],RC[-3]>=11,RC[-3]<12),50,IF(AND(RC[-3]<RC[-1],RC[-3]>=12,RC[-3]<13),45,IF(AND(RC[-3]<RC[-1],RC[-3]>=13,RC[-3]<14),40,IF(AND(RC[-3]<RC[-1],RC[-3]>=14,RC[-3]<15),35,IF(AND(RC[-3]<RC[-1],RC[-3]>=15,RC[-3]<16),30,IF(AND(RC[-3]<RC[-1],RC[-3]>=16,RC[-3]<17),25,IF(AND(RC[-3]<RC[-1],RC[-3]>=17,RC[-3]<18),20,IF(AND(RC[-3]<RC[-1],RC[-3]>=18,RC[-3]<19),15,IF(AND(RC[-3]<RC[-1],RC[-3]>=19,RC[-3]<20),10,IF(AND(RC[-3]<RC[-1],RC[-3]>=20,RC[-3]<21),5,IF(AND(RC[-3]<RC[-1],RC[-3]>=21),0,IF(AND(RC[-3]>RC[-1],RC[-3]>=2,RC[-3]<3),90,IF(AND(RC[-3]>RC[-1],RC[-3]>=3,RC[-3]<4),90,IF(AND(RC[-3]>RC[-1],RC[-3]>=4,RC[-3]<5),80,IF(AND(RC[-3]>RC[-1],RC[-3]>=5,RC[-3]<6),70,IF(AND(RC[-3]>RC[-1],RC[-3]>=6,RC[-3]<7),60,IF(AND(RC[-3]>RC[-1],RC[-3]>=7,RC[-3]<8),50,IF(AND(RC[-3]>RC[-1],RC[-3]>=8,RC[-3]<9),40,IF(AND(RC[-3]>RC[-1],RC[-3]>=9,RC[-3]<10),30,IF(AND(RC[-3]>RC[-1],RC[-3]>=10,RC[-3]<11),20,IF(AND(RC[-3]>RC[-1],RC[-3]>=11,RC[-3]<12),10,IF(AND(RC[-3]>RC[-1],RC[-3]>=12),0))))))))))))))))))))))))))))))))) -> 0 | H93: =IF(RC[-3]="","",IF(RC[-3]<0.3,100,IF(AND(RC[-3]>=0.3,RC[-3]>0.4),95,IF(AND(RC[-3]>=0.4,RC[-3]<0.5),90,IF(AND(RC[-3]>=0.5,RC[-3]<0.6),85,IF(AND(RC[-3]>=0.6,RC[-3]<0.7),80,IF(AND(RC[-3]>=0.6,RC[-3]<1),80,IF(AND(RC[-3]>1,RC[-3]<2),50,IF(RC[-3]>2,0))))))))) ->  | I93: =IF(RC[-1]="",RC[-2],0.7*RC[-1]+0.3*RC[-2]) -> 0
A94: بیمه حافظ | B94: وحافظ | C94: =VLOOKUP(RC[-1],Sheet1!R3C2:R802C3,2,FALSE) -> بیمه و بازنشستگی | D94: =VLOOKUP(RC[-2],Sheet1!R3C2:R802C9,8,FALSE) -> 59.930966380534166 | E94: =IF(VLOOKUP(RC[-3],Sheet1!R3C2:R803C11,10,FALSE)=0,"",VLOOKUP(Sheet2!RC[-3],Sheet1!R[1]C[-3]:R[801]C[6],10,FALSE)) ->  | F94: =Sheet1!R[40]C[4] -> 1.425013995795285 | G94: =IF(RC[-3]<0,0,IF(AND(RC[-3]<RC[-1],RC[-3]<2),100,IF(AND(RC[-3]<RC[-1],RC[-3]>=2,RC[-3]<3),95,IF(AND(RC[-3]<RC[-1],RC[-3]>=3,RC[-3]<4),90,IF(AND(RC[-3]<RC[-1],RC[-3]>=4,RC[-3]<5),85,IF(AND(RC[-3]<RC[-1],RC[-3]>=5,RC[-3]<6),80,IF(AND(RC[-3]<RC[-1],RC[-3]>=6,RC[-3]<7),75,IF(AND(RC[-3]<RC[-1],RC[-3]>=7,RC[-3]<8),70,IF(AND(RC[-3]<RC[-1],RC[-3]>=8,RC[-3]<9),65,IF(AND(RC[-3]<RC[-1],RC[-3]>=9,RC[-3]<10),60,IF(AND(RC[-3]<RC[-1],RC[-3]>=10,RC[-3]<11),55,IF(AND(RC[-3]<RC[-1],RC[-3]>=11,RC[-3]<12),50,IF(AND(RC[-3]<RC[-1],RC[-3]>=12,RC[-3]<13),45,IF(AND(RC[-3]<RC[-1],RC[-3]>=13,RC[-3]<14),40,IF(AND(RC[-3]<RC[-1],RC[-3]>=14,RC[-3]<15),35,IF(AND(RC[-3]<RC[-1],RC[-3]>=15,RC[-3]<16),30,IF(AND(RC[-3]<RC[-1],RC[-3]>=16,RC[-3]<17),25,IF(AND(RC[-3]<RC[-1],RC[-3]>=17,RC[-3]<18),20,IF(AND(RC[-3]<RC[-1],RC[-3]>=18,RC[-3]<19),15,IF(AND(RC[-3]<RC[-1],RC[-3]>=19,RC[-3]<20),10,IF(AND(RC[-3]<RC[-1],RC[-3]>=20,RC[-3]<21),5,IF(AND(RC[-3]<RC[-1],RC[-3]>=21),0,IF(AND(RC[-3]>RC[-1],RC[-3]>=2,RC[-3]<3),90,IF(AND(RC[-3]>RC[-1],RC[-3]>=3,RC[-3]<4),90,IF(AND(RC[-3]>RC[-1],RC[-3]>=4,RC[-3]<5),80,IF(AND(RC[-3]>RC[-1],RC[-3]>=5,RC[-3]<6),70,IF(AND(RC[-3]>RC[-1],RC[-3]>=6,RC[-3]<7),60,IF(AND(RC[-3]>RC[-1],RC[-3]>=7,RC[-3]<8),50,IF(AND(RC[-3]>RC[-1],RC[-3]>=8,RC[-3]<9),40,IF(AND(RC[-3]>RC[-1],RC[-3]>=9,RC[-3]<10),30,IF(AND(RC[-3]>RC[-1],RC[-3]>=10,RC[-3]<11),20,IF(AND(RC[-3]>RC[-1],RC[-3]>=11,RC[-3]<12),10,IF(AND(RC[-3]>RC[-1],RC[-3]>=12),0))))))))))))))))))))))))))))))))) -> 0 | H94: =IF(RC[-3]="","",IF(RC[-3]<0.3,100,IF(AND(RC[-3]>=0.3,RC[-3]>0.4),95,IF(AND(RC[-3]>=0.4,RC[-3]<0.5),90,IF(AND(RC[-3]>=0.5,RC[-3]<0.6),85,IF(AND(RC[-3]>=0.6,RC[-3]<0.7),80,IF(AND(RC[-3]>=0.6,RC[-3]<1),80,IF(AND(RC[-3]>1,RC[-3]<2),50,IF(RC[-3]>2,0))))))))) ->  | I94: =IF(RC[-1]="",RC[-2],0.7*RC[-1]+0.3*RC[-2]) -> 0
A95: بیمه حکمت صبا | B95: وحکمت | C95: =VLOOKUP(RC[-1],Sheet1!R3C2:R802C3,2,FALSE) -> بیمه و بازنشستگی | D95: =VLOOKUP(RC[-2],Sheet1!R3C2:R802C9,8,FALSE) -> 13.428158647604031 | E95: =IF(VLOOKUP(RC[-3],Sheet1!R3C2:R803C11,10,FALSE)=0,"",VLOOKUP(Sheet2!RC[-3],Sheet1!R[1]C[-3]:R[801]C[6],10,FALSE)) ->  | F95: =Sheet1!R[40]C[4] -> 0.16026338724543346 | G95: =IF(RC[-3]<0,0,IF(AND(RC[-3]<RC[-1],RC[-3]<2),100,IF(AND(RC[-3]<RC[-1],RC[-3]>=2,RC[-3]<3),95,IF(AND(RC[-3]<RC[-1],RC[-3]>=3,RC[-3]<4),90,IF(AND(RC[-3]<RC[-1],RC[-3]>=4,RC[-3]<5),85,IF(AND(RC[-3]<RC[-1],RC[-3]>=5,RC[-3]<6),80,IF(AND(RC[-3]<RC[-1],RC[-3]>=6,RC[-3]<7),75,IF(AND(RC[-3]<RC[-1],RC[-3]>=7,RC[-3]<8),70,IF(AND(RC[-3]<RC[-1],RC[-3]>=8,RC[-3]<9),65,IF(AND(RC[-3]<RC[-1],RC[-3]>=9,RC[-3]<10),60,IF(AND(RC[-3]<RC[-1],RC[-3]>=10,RC[-3]<11),55,IF(AND(RC[-3]<RC[-1],RC[-3]>=11,RC[-3]<12),50,IF(AND(RC[-3]<RC[-1],RC[-3]>=12,RC[-3]<13),45,IF(AND(RC[-3]<RC[-1],RC[-3]>=13,RC[-3]<14),40,IF(AND(RC[-3]<RC[-1],RC[-3]>=14,RC[-3]<15),35,IF(AND(RC[-3]<RC[-1],RC[-3]>=15,RC[-3]<16),30,IF(AND(RC[-3]<RC[-1],RC[-3]>=16,RC[-3]<17),25,IF(AND(RC[-3]<RC[-1],RC[-3]>=17,RC[-3]<18),20,IF(AND(RC[-3]<RC[-1],RC[-3]>=18,RC[-3]<19),15,IF(AND(RC[-3]<RC[-1],RC[-3]>=19,RC[-3]<20),10,IF(AND(RC[-3]<RC[-1],RC[-3]>=20,RC[-3]<21),5,IF(AND(RC[-3]<RC[-1],RC[-3]>=21),0,IF(AND(RC[-3]>RC[-1],RC[-3]>=2,RC[-3]<3),90,IF(AND(RC[-3]>RC[-1],RC[-3]>=3,RC[-3]<4),90,IF(AND(RC[-3]>RC[-1],RC[-3]>=4,RC[-3]<5),80,IF(AND(RC[-3]>RC[-1],RC[-3]>=5,RC[-3]<6),70,IF(AND(RC[-3]>RC[-1],RC[-3]>=6,RC[-3]<7),60,IF(AND(RC[-3]>RC[-1],RC[-3]>=7,RC[-3]<8),50,IF(AND(RC[-3]>RC[-1],RC[-3]>=8,RC[-3]<9),40,IF(AND(RC[-3]>RC[-1],RC[-3]>=9,RC[-3]<10),30,IF(AND(RC[-3]>RC[-1],RC[-3]>=10,RC[-3]<11),20,IF(AND(RC[-3]>RC[-1],RC[-3]>=11,RC[-3]<12),10,IF(AND(RC[-3]>RC[-1],RC[-3]>=12),0))))))))))))))))))))))))))))))))) -> 0 | H95: =IF(RC[-3]="","",IF(RC[-3]<0.3,100,IF(AND(RC[-3]>=0.3,RC[-3]>0.4),95,IF(AND(RC[-3]>=0.4,RC[-3]<0.5),90,IF(AND(RC[-3]>=0.5,RC[-3]<0.6),85,IF(AND(RC[-3]>=0.6,RC[-3]<0.7),80,IF(AND(RC[-3]>=0.6,RC[-3]<1),80,IF(AND(RC[-3]>1,RC[-3]<2),50,IF(RC[-3]>2,0))))))))) ->  | I95: =IF(RC[-1]="",RC[-2],0.7*RC[-1]+0.3*RC[-2]) -> 0
A96: بیمه دانا | B96: دانا | C96: =VLOOKUP(RC[-1],Sheet1!R3C2:R802C3,2,FALSE) -> بیمه و بازنشستگی | D96: =VLOOKUP(RC[-2],Sheet1!R3C2:R802C9,8,FALSE) -> -0.19267451909384029 | E96: =IF(VLOOKUP(RC[-3],Sheet1!R3C2:R803C11,10,FALSE)=0,"",VLOOKUP(Sheet2!RC[-3],Sheet1!R[1]C[-3]:R[801]C[6],10,FALSE)) ->  | F96: =Sheet1!R[40]C[4] -> 4.8374014222460913 | G96: =IF(RC[-3]<0,0,IF(AND(RC[-3]<RC[-1],RC[-3]<2),100,IF(AND(RC[-3]<RC[-1],RC[-3]>=2,RC[-3]<3),95,IF(AND(RC[-3]<RC[-1],RC[-3]>=3,RC[-3]<4),90,IF(AND(RC[-3]<RC[-1],RC[-3]>=4,RC[-3]<5),85,IF(AND(RC[-3]<RC[-1],RC[-3]>=5,RC[-3]<6),80,IF(AND(RC[-3]<RC[-1],RC[-3]>=6,RC[-3]<7),75,IF(AND(RC[-3]<RC[-1],RC[-3]>=7,RC[-3]<8),70,IF(AND(RC[-3]<RC[-1],RC[-3]>=8,RC[-3]<9),65,IF(AND(RC[-3]<RC[-1],RC[-3]>=9,RC[-3]<10),60,IF(AND(RC[-3]<RC[-1],RC[-3]>=10,RC[-3]<11),55,IF(AND(RC[-3]<RC[-1],RC[-3]>=11,RC[-3]<12),50,IF(AND(RC[-3]<RC[-1],RC[-3]>=12,RC[-3]<13),45,IF(AND(RC[-3]<RC[-1],RC[-3]>=13,RC[-3]<14),40,IF(AND(RC[-3]<RC[-1],RC[-3]>=14,RC[-3]<15),35,IF(AND(RC[-3]<RC[-1],RC[-3]>=15,RC[-3]<16),30,IF(AND(RC[-3]<RC[-1],RC[-3]>=16,RC[-3]<17),25,IF(AND(RC[-3]<RC[-1],RC[-3]>=17,RC[-3]<18),20,IF(AND(RC[-3]<RC[-1],RC[-3]>=18,RC[-3]<19),15,IF(AND(RC[-3]<RC[-1],RC[-3]>=19,RC[-3]<20),10,IF(AND(RC[-3]<RC[-1],RC[-3]>=20,RC[-3]<21),5,IF(AND(RC[-3]<RC[-1],RC[-3]>=21),0,IF(AND(RC[-3]>RC[-1],RC[-3]>=2,RC[-3]<3),90,IF(AND(RC[-3]>RC[-1],RC[-3]>=3,RC[-3]<4),90,IF(AND(RC[-3]>RC[-1],RC[-3]>=4,RC[-3]<5),80,IF(AND(RC[-3]>RC[-1],RC[-3]>=5,RC[-3]<6),70,IF(AND(RC[-3]>RC[-1],RC[-3]>=6,RC[-3]<7),60,IF(AND(RC[-3]>RC[-1],RC[-3]>=7,RC[-3]<8),50,IF(AND(RC[-3]>RC[-1],RC[-3]>=8,RC[-3]<9),40,IF(AND(RC[-3]>RC[-1],RC[-3]>=9,RC[-3]<10),30,IF(AND(RC[-3]>RC[-1],RC[-3]>=10,RC[-3]<11),20,IF(AND(RC[-3]>RC[-1],RC[-3]>=11,RC[-3]<12),10,IF(AND(RC[-3]>RC[-1],RC[-3]>=12),0))))))))))))))))))))))))))))))))) -> 0 | H96: =IF(RC[-3]="","",IF(RC[-3]<0.3,100,IF(AND(RC[-3]>=0.3,RC[-3]>0.4),95,IF(AND(RC[-3]>=0.4,RC[-3]<0.5),90,IF(AND(RC[-3]>=0.5,RC[-3]<0.6),85,IF(AND(RC[-3]>=0.6,RC[-3]<0.7),80,IF(AND(RC[-3]>=0.6,RC[-3]<1),80,IF(AND(RC[-3]>1,RC[-3]<2),50,IF(RC[-3]>2,0))))))))) ->  | I96: =IF(RC[-1]="",RC[-2],0.7*RC[-1]+0.3*RC[-2]) -> 0
A97: بیمه دی | B97: ودی | C97: =VLOOKUP(RC[-1],Sheet1!R3C2:R802C3,2,FALSE) -> بیمه و بازنشستگی | D97: =VLOOKUP(RC[-2],Sheet1!R3C2:R802C9,8,FALSE) -> 5.704002425437908 | E97: =IF(VLOOKUP(RC[-3],Sheet1!R3C2:R803C11,10,FALSE)=0,"",VLOOKUP(Sheet2!RC[-3],Sheet1!R[1]C[-3]:R[801]C[6],10,FALSE)) ->  | F97: =Sheet1!R[40]C[4] -> 0.18788434540746074 | G97: =IF(RC[-3]<0,0,IF(AND(RC[-3]<RC[-1],RC[-3]<2),100,IF(AND(RC[-3]<RC[-1],RC[-3]>=2,RC[-3]<3),95,IF(AND(RC[-3]<RC[-1],RC[-3]>=3,RC[-3]<4),90,IF(AND(RC[-3]<RC[-1],RC[-3]>=4,RC[-3]<5),85,IF(AND(RC[-3]<RC[-1],RC[-3]>=5,RC[-3]<6),80,IF(AND(RC[-3]<RC[-1],RC[-3]>=6,RC[-3]<7),75,IF(AND(RC[-3]<RC[-1],RC[-3]>=7,RC[-3]<8),70,IF(AND(RC[-3]<RC[-1],RC[-3]>=8,RC[-3]<9),65,IF(AND(RC[-3]<RC[-1],RC[-3]>=9,RC[-3]<10),60,IF(AND(RC[-3]<RC[-1],RC[-3]>=10,RC[-3]<11),55,IF(AND(RC[-3]<RC[-1],RC[-3]>=11,RC[-3]<12),50,IF(AND(RC[-3]<RC[-1],RC[-3]>=12,RC[-3]<13),45,IF(AND(RC[-3]<RC[-1],RC[-3]>=13,RC[-3]<14),40,IF(AND(RC[-3]<RC[-1],RC[-3]>=14,RC[-3]<15),35,IF(AND(RC[-3]<RC[-1],RC[-3]>=15,RC[-3]<16),30,IF(AND(RC[-3]<RC[-1],RC[-3]>=16,RC[-3]<17),25,IF(AND(RC[-3]<RC[-1],RC[-3]>=17,RC[-3]<18),20,IF(AND(RC[-3]<RC[-1],RC[-3]>=18,RC[-3]<19),15,IF(AND(RC[-3]<RC[-1],RC[-3]>=19,RC[-3]<20),10,IF(AND(RC[-3]<RC[-1],RC[-3]>=20,RC[-3]<21),5,IF(AND(RC[-3]<RC[-1],RC[-3]>=21),0,IF(AND(RC[-3]>RC[-1],RC[-3]>=2,RC[-3]<3),90,IF(AND(RC[-3]>RC[-1],RC[-3]>=3,RC[-3]<4),90,IF(AND(RC[-3]>RC[-1],RC[-3]>=4,RC[-3]<5),80,IF(AND(RC[-3]>RC[-1],RC[-3]>=5,RC[-3]<6),70,IF(AND(RC[-3]>RC[-1],RC[-3]>=6,RC[-3]<7),60,IF(AND(RC[-3]>RC[-1],RC[-3]>=7,RC[-3]<8),50,IF(AND(RC[-3]>RC[-1],RC[-3]>=8,RC[-3]<9),40,IF(AND(RC[-3]>RC[-1],RC[-3]>=9,RC[-3]<10),30,IF(AND(RC[-3]>RC[-1],RC[-3]>=10,RC[-3]<11),20,IF(AND(RC[-3]>RC[-1],RC[-3]>=11,RC[-3]<12),10,IF(AND(RC[-3]>RC[-1],RC[-3]>=12),0))))))))))))))))))))))))))))))))) -> 70 | H97: =IF(RC[-3]="","",IF(RC[-3]<0.3,100,IF(AND(RC[-3]>=0.3,RC[-3]>0.4),95,IF(AND(RC[-3]>=0.4,RC[-3]<0.5),90,IF(AND(RC[-3]>=0.5,RC[-3]<0.6),85,IF(AND(RC[-3]>=0.6,RC[-3]<0.7),80,IF(AND(RC[-3]>=0.6,RC[-3]<1),80,IF(AND(RC[-3]>1,RC[-3]<2),50,IF(RC[-3]>2,0))))))))) ->  | I97: =IF(RC[-1]="",RC[-2],0.7*RC[-1]+0.3*RC[-2]) -> 70
A98: بیمه رازی | B98: ورازی | C98: =VLOOKUP(RC[-1],Sheet1!R3C2:R802C3,2,FALSE) -> بیمه و بازنشستگی | D98: =VLOOKUP(RC[-2],Sheet1!R3C2:R802C9,8,FALSE) -> 95.612907938493635 | E98: =IF(VLOOKUP(RC[-3],Sheet1!R3C2:R803C11,10,FALSE)=0,"",VLOOKUP(Sheet2!RC[-3],Sheet1!R[1]C[-3]:R[801]C[6],10,FALSE)) ->  | F98: =Sheet1!R[40]C[4] -> 0.12514504334477525 | G98: =IF(RC[-3]<0,0,IF(AND(RC[-3]<RC[-1],RC[-3]<2),100,IF(AND(RC[-3]<RC[-1],RC[-3]>=2,RC[-3]<3),95,IF(AND(RC[-3]<RC[-1],RC[-3]>=3,RC[-3]<4),90,IF(AND(RC[-3]<RC[-1],RC[-3]>=4,RC[-3]<5),85,IF(AND(RC[-3]<RC[-1],RC[-3]>=5,RC[-3]<6),80,IF(AND(RC[-3]<RC[-1],RC[-3]>=6,RC[-3]<7),75,IF(AND(RC[-3]<RC[-1],RC[-3]>=7,RC[-3]<8),70,IF(AND(RC[-3]<RC[-1],RC[-3]>=8,RC[-3]<9),65,IF(AND(RC[-3]<RC[-1],RC[-3]>=9,RC[-3]<10),60,IF(AND(RC[-3]<RC[-1],RC[-3]>=10,RC[-3]<11),55,IF(AND(RC[-3]<RC[-1],RC[-3]>=11,RC[-3]<12),50,IF(AND(RC[-3]<RC[-1],RC[-3]>=12,RC[-3]<13),45,IF(AND(RC[-3]<RC[-1],RC[-3]>=13,RC[-3]<14),40,IF(AND(RC[-3]<RC[-1],RC[-3]>=14,RC[-3]<15),35,IF(AND(RC[-3]<RC[-1],RC[-3]>=15,RC[-3]<16),30,IF(AND(RC[-3]<RC[-1],RC[-3]>=16,RC[-3]<17),25,IF(AND(RC[-3]<RC[-1],RC[-3]>=17,RC[-3]<18),20,IF(AND(RC[-3]<RC[-1],RC[-3]>=18,RC[-3]<19),15,IF(AND(RC[-3]<RC[-1],RC[-3]>=19,RC[-3]<20),10,IF(AND(RC[-3]<RC[-1],RC[-3]>=20,RC[-3]<21),5,IF(AND(RC[-3]<RC[-1],RC[-3]>=21),0,IF(AND(RC[-3]>RC[-1],RC[-3]>=2,RC[-3]<3),90,IF(AND(RC[-3]>RC[-1],RC[-3]>=3,RC[-3]<4),90,IF(AND(RC[-3]>RC[-1],RC[-3]>=4,RC[-3]<5),80,IF(AND(RC[-3]>RC[-1],RC[-3]>=5,RC[-3]<6),70,IF(AND(RC[-3]>RC[-1],RC[-3]>=6,RC[-3]<7),60,IF(AND(RC[-3]>RC[-1],RC[-3]>=7,RC[-3]<8),50,IF(AND(RC[-3]>RC[-1],RC[-3]>=8,RC[-3]<9),40,IF(AND(RC[-3]>RC[-1],RC[-3]>=9,RC[-3]<10),30,IF(AND(RC[-3]>RC[-1],RC[-3]>=10,RC[-3]<11),20,IF(AND(RC[-3]>RC[-1],RC[-3]>=11,RC[-3]<12),10,IF(AND(RC[-3]>RC[-1],RC[-3]>=12),0))))))))))))))))))))))))))))))))) -> 0 | H98: =IF(RC[-3]="","",IF(RC[-3]<0.3,100,IF(AND(RC[-3]>=0.3,RC[-3]>0.4),95,IF(AND(RC[-3]>=0.4,RC[-3]<0.5),90,IF(AND(RC[-3]>=0.5,RC[-3]<0.6),85,IF(AND(RC[-3]>=0.6,RC[-3]<0.7),80,IF(AND(RC[-3]>=0.6,RC[-3]<1),80,IF(AND(RC[-3]>1,RC[-3]<2),50,IF(RC[-3]>2,0))))))))) ->  | I98: =IF(RC[-1]="",RC[-2],0.7*RC[-1]+0.3*RC[-2]) -> 0
A99: بیمه زندگی باران | B99: باران | C99: =VLOOKUP(RC[-1],Sheet1!R3C2:R802C3,2,FALSE) -> بیمه و بازنشستگی | D99: =VLOOKUP(RC[-2],Sheet1!R3C2:R802C9,8,FALSE) -> 53.008757911334811 | E99: =IF(VLOOKUP(RC[-3],Sheet1!R3C2:R803C11,10,FALSE)=0,"",VLOOKUP(Sheet2!RC[-3],Sheet1!R[1]C[-3]:R[801]C[6],10,FALSE)) ->  | F99: =Sheet1!R[40]C[4] -> 5.556752813719517E-2 | G99: =IF(RC[-3]<0,0,IF(AND(RC[-3]<RC[-1],RC[-3]<2),100,IF(AND(RC[-3]<RC[-1],RC[-3]>=2,RC[-3]<3),95,IF(AND(RC[-3]<RC[-1],RC[-3]>=3,RC[-3]<4),90,IF(AND(RC[-3]<RC[-1],RC[-3]>=4,RC[-3]<5),85,IF(AND(RC[-3]<RC[-1],RC[-3]>=5,RC[-3]<6),80,IF(AND(RC[-3]<RC[-1],RC[-3]>=6,RC[-3]<7),75,IF(AND(RC[-3]<RC[-1],RC[-3]>=7,RC[-3]<8),70,IF(AND(RC[-3]<RC[-1],RC[-3]>=8,RC[-3]<9),65,IF(AND(RC[-3]<RC[-1],RC[-3]>=9,RC[-3]<10),60,IF(AND(RC[-3]<RC[-1],RC[-3]>=10,RC[-3]<11),55,IF(AND(RC[-3]<RC[-1],RC[-3]>=11,RC[-3]<12),50,IF(AND(RC[-3]<RC[-1],RC[-3]>=12,RC[-3]<13),45,IF(AND(RC[-3]<RC[-1],RC[-3]>=13,RC[-3]<14),40,IF(AND(RC[-3]<RC[-1],RC[-3]>=14,RC[-3]<15),35,IF(AND(RC[-3]<RC[-1],RC[-3]>=15,RC[-3]<16),30,IF(AND(RC[-3]<RC[-1],RC[-3]>=16,RC[-3]<17),25,IF(AND(RC[-3]<RC[-1],RC[-3]>=17,RC[-3]<18),20,IF(AND(RC[-3]<RC[-1],RC[-3]>=18,RC[-3]<19),15,IF(AND(RC[-3]<RC[-1],RC[-3]>=19,RC[-3]<20),10,IF(AND(RC[-3]<RC[-1],RC[-3]>=20,RC[-3]<21),5,IF(AND(RC[-3]<RC[-1],RC[-3]>=21),0,IF(AND(RC[-3]>RC[-1],RC[-3]>=2,RC[-3]<3),90,IF(AND(RC[-3]>RC[-1],RC[-3]>=3,RC[-3]<4),90,IF(AND(RC[-3]>RC[-1],RC[-3]>=4,RC[-3]<5),80,IF(AND(RC[-3]>RC[-1],RC[-3]>=5,RC[-3]<6),70,IF(AND(RC[-3]>RC[-1],RC[-3]>=6,RC[-3]<7),60,IF(AND(RC[-3]>RC[-1],RC[-3]>=7,RC[-3]<8),50,IF(AND(RC[-3]>RC[-1],RC[-3]>=8,RC[-3]<9),40,IF(AND(RC[-3]>RC[-1],RC[-3]>=9,RC[-3]<10),30,IF(AND(RC[-3]>RC[-1],RC[-3]>=10,RC[-3]<11),20,IF(AND(RC[-3]>RC[-1],RC[-3]>=11,RC[-3]<12),10,IF(AND(RC[-3]>RC[-1],RC[-3]>=12),0))))))))))))))))))))))))))))))))) -> 0 | H99: =IF(RC[-3]="","",IF(RC[-3]<0.3,100,IF(AND(RC[-3]>=0.3,RC[-3]>0.4),95,IF(AND(RC[-3]>=0.4,RC[-3]<0.5),90,IF(AND(RC[-3]>=0.5,RC[-3]<0.6),85,IF(AND(RC[-3]>=0.6,RC[-3]<0.7),80,IF(AND(RC[-3]>=0.6,RC[-3]<1),80,IF(AND(RC[-3]>1,RC[-3]<2),50,IF(RC[-3]>2,0))))))))) ->  | I99: =IF(RC[-1]="",RC[-2],0.7*RC[-1]+0.3*RC[-2]) -> 0
A100: بیمه زندگی خاورمیانه | B100: بخاور | C100: =VLOOKUP(RC[-1],Sheet1!R3C2:R802C3,2,FALSE) -> بیمه و بازنشستگی | D100: =VLOOKUP(RC[-2],Sheet1!R3C2:R802C9,8,FALSE) -> 9.6681176330945746 | E100: =IF(VLOOKUP(RC[-3],Sheet1!R3C2:R803C11,10,FALSE)=0,"",VLOOKUP(Sheet2!RC[-3],Sheet1!R[1]C[-3]:R[801]C[6],10,FALSE)) ->  | F100: =Sheet1!R[40]C[4] -> 9.1198523426859579E-2 | G100: =IF(RC[-3]<0,0,IF(AND(RC[-3]<RC[-1],RC[-3]<2),100,IF(AND(RC[-3]<RC[-1],RC[-3]>=2,RC[-3]<3),95,IF(AND(RC[-3]<RC[-1],RC[-3]>=3,RC[-3]<4),90,IF(AND(RC[-3]<RC[-1],RC[-3]>=4,RC[-3]<5),85,IF(AND(RC[-3]<RC[-1],RC[-3]>=5,RC[-3]<6),80,IF(AND(RC[-3]<RC[-1],RC[-3]>=6,RC[-3]<7),75,IF(AND(RC[-3]<RC[-1],RC[-3]>=7,RC[-3]<8),70,IF(AND(RC[-3]<RC[-1],RC[-3]>=8,RC[-3]<9),65,IF(AND(RC[-3]<RC[-1],RC[-3]>=9,RC[-3]<10),60,IF(AND(RC[-3]<RC[-1],RC[-3]>=10,RC[-3]<11),55,IF(AND(RC[-3]<RC[-1],RC[-3]>=11,RC[-3]<12),50,IF(AND(RC[-3]<RC[-1],RC[-3]>=12,RC[-3]<13),45,IF(AND(RC[-3]<RC[-1],RC[-3]>=13,RC[-3]<14),40,IF(AND(RC[-3]<RC[-1],RC[-3]>=14,RC[-3]<15),35,IF(AND(RC[-3]<RC[-1],RC[-3]>=15,RC[-3]<16),30,IF(AND(RC[-3]<RC[-1],RC[-3]>=16,RC[-3]<17),25,IF(AND(RC[-3]<RC[-1],RC[-3]>=17,RC[-3]<18),20,IF(AND(RC[-3]<RC[-1],RC[-3]>=18,RC[-3]<19),15,IF(AND(RC[-3]<RC[-1],RC[-3]>=19,RC[-3]<20),10,IF(AND(RC[-3]<RC[-1],RC[-3]>=20,RC[-3]<21),5,IF(AND(RC[-3]<RC[-1],RC[-3]>=21),0,IF(AND(RC[-3]>RC[-1],RC[-3]>=2,RC[-3]<3),90,IF(AND(RC[-3]>RC[-1],RC[-3]>=3,RC[-3]<4),90,IF(AND(RC[-3]>RC[-1],RC[-3]>=4,RC[-3]<5),80,IF(AND(RC[-3]>RC[-1],RC[-3]>=5,RC[-3]<6),70,IF(AND(RC[-3]>RC[-1],RC[-3]>=6,RC[-3]<7),60,IF(AND(RC[-3]>RC[-1],RC[-3]>=7,RC[-3]<8),50,IF(AND(RC[-3]>RC[-1],RC[-3]>=8,RC[-3]<9),40,IF(AND(RC[-3]>RC[-1],RC[-3]>=9,RC[-3]<10),30,IF(AND(RC[-3]>RC[-1],RC[-3]>=10,RC[-3]<11),20,IF(AND(RC[-3]>RC[-1],RC[-3]>=11,RC[-3]<12),10,IF(AND(RC[-3]>RC[-1],RC[-3]>=12),0))))))))))))))))))))))))))))))))) -> 30 | H100: =IF(RC[-3]="","",IF(RC[-3]<0.3,100,IF(AND(RC[-3]>=0.3,RC[-3]>0.4),95,IF(AND(RC[-3]>=0.4,RC[-3]<0.5),90,IF(AND(RC[-3]>=0.5,RC[-3]<0.6),85,IF(AND(RC[-3]>=0.6,RC[-3]<0.7),80,IF(AND(RC[-3]>=0.6,RC[-3]<1),80,IF(AND(RC[-3]>1,RC[-3]<2),50,IF(RC[-3]>2,0))))))))) ->  | I100: =IF(RC[-1]="",RC[-2],0.7*RC[-1]+0.3*RC[-2]) -> 30
A101: بیمه زندگی کاریزما | B101: کاریز | C101: =VLOOKUP(RC[-1],Sheet1!R3C2:R802C3,2,FALSE) -> بیمه و بازنشستگی | D101: =VLOOKUP(RC[-2],Sheet1!R3C2:R802C9,8,FALSE) -> 1.7692852087625002 | E101: =IF(VLOOKUP(RC[-3],Sheet1!R3C2:R803C11,10,FALSE)=0,"",VLOOKUP(Sheet2!RC[-3],Sheet1!R[1]C[-3]:R[801]C[6],10,FALSE)) ->  | F101: =Sheet1!R[40]C[4] -> 0.36908253671899194 | G101: =IF(RC[-3]<0,0,IF(AND(RC[-3]<RC[-1],RC[-3]<2),100,IF(AND(RC[-3]<RC[-1],RC[-3]>=2,RC[-3]<3),95,IF(AND(RC[-3]<RC[-1],RC[-3]>=3,RC[-3]<4),90,IF(AND(RC[-3]<RC[-1],RC[-3]>=4,RC[-3]<5),85,IF(AND(RC[-3]<RC[-1],RC[-3]>=5,RC[-3]<6),80,IF(AND(RC[-3]<RC[-1],RC[-3]>=6,RC[-3]<7),75,IF(AND(RC[-3]<RC[-1],RC[-3]>=7,RC[-3]<8),70,IF(AND(RC[-3]<RC[-1],RC[-3]>=8,RC[-3]<9),65,IF(AND(RC[-3]<RC[-1],RC[-3]>=9,RC[-3]<10),60,IF(AND(RC[-3]<RC[-1],RC[-3]>=10,RC[-3]<11),55,IF(AND(RC[-3]<RC[-1],RC[-3]>=11,RC[-3]<12),50,IF(AND(RC[-3]<RC[-1],RC[-3]>=12,RC[-3]<13),45,IF(AND(RC[-3]<RC[-1],RC[-3]>=13,RC[-3]<14),40,IF(AND(RC[-3]<RC[-1],RC[-3]>=14,RC[-3]<15),35,IF(AND(RC[-3]<RC[-1],RC[-3]>=15,RC[-3]<16),30,IF(AND(RC[-3]<RC[-1],RC[-3]>=16,RC[-3]<17),25,IF(AND(RC[-3]<RC[-1],RC[-3]>=17,RC[-3]<18),20,IF(AND(RC[-3]<RC[-1],RC[-3]>=18,RC[-3]<19),15,IF(AND(RC[-3]<RC[-1],RC[-3]>=19,RC[-3]<20),10,IF(AND(RC[-3]<RC[-1],RC[-3]>=20,RC[-3]<21),5,IF(AND(RC[-3]<RC[-1],RC[-3]>=21),0,IF(AND(RC[-3]>RC[-1],RC[-3]>=2,RC[-3]<3),90,IF(AND(RC[-3]>RC[-1],RC[-3]>=3,RC[-3]<4),90,IF(AND(RC[-3]>RC[-1],RC[-3]>=4,RC[-3]<5),80,IF(AND(RC[-3]>RC[-1],RC[-3]>=5,RC[-3]<6),70,IF(AND(RC[-3]>RC[-1],RC[-3]>=6,RC[-3]<7),60,IF(AND(RC[-3]>RC[-1],RC[-3]>=7,RC[-3]<8),50,IF(AND(RC[-3]>RC[-1],RC[-3]>=8,RC[-3]<9),40,IF(AND(RC[-3]>RC[-1],RC[-3]>=9,RC[-3]<10),30,IF(AND(RC[-3]>RC[-1],RC[-3]>=10,RC[-3]<11),20,IF(AND(RC[-3]>RC[-1],RC[-3]>=11,RC[-3]<12),10,IF(AND(RC[-3]>RC[-1],RC[-3]>=12),0))))))))))))))))))))))))))))))))) -> 0 | H101: =IF(RC[-3]="","",IF(RC[-3]<0.3,100,IF(AND(RC[-3]>=0.3,RC[-3]>0.4),95,IF(AND(RC[-3]>=0.4,RC[-3]<0.5),90,IF(AND(RC[-3]>=0.5,RC[-3]<0.6),85,IF(AND(RC[-3]>=0.6,RC[-3]<0.7),80,IF(AND(RC[-3]>=0.6,RC[-3]<1),80,IF(AND(RC[-3]>1,RC[-3]<2),50,IF(RC[-3]>2,0))))))))) ->  | I101: =IF(RC[-1]="",RC[-2],0.7*RC[-1]+0.3*RC[-2]) -> 0
A102: بیمه سامان | B102: بساما | C102: =VLOOKUP(RC[-1],Sheet1!R3C2:R802C3,2,FALSE) -> بیمه و بازنشستگی | D102: =VLOOKUP(RC[-2],Sheet1!R3C2:R802C9,8,FALSE) -> 13.764489935174984 | E102: =IF(VLOOKUP(RC[-3],Sheet1!R3C2:R803C11,10,FALSE)=0,"",VLOOKUP(Sheet2!RC[-3],Sheet1!R[1]C[-3]:R[801]C[6],10,FALSE)) ->  | F102: =Sheet1!R[40]C[4] -> 0.50154194551244002 | G102: =IF(RC[-3]<0,0,IF(AND(RC[-3]<RC[-1],RC[-3]<2),100,IF(AND(RC[-3]<RC[-1],RC[-3]>=2,RC[-3]<3),95,IF(AND(RC[-3]<RC[-1],RC[-3]>=3,RC[-3]<4),90,IF(AND(RC[-3]<RC[-1],RC[-3]>=4,RC[-3]<5),85,IF(AND(RC[-3]<RC[-1],RC[-3]>=5,RC[-3]<6),80,IF(AND(RC[-3]<RC[-1],RC[-3]>=6,RC[-3]<7),75,IF(AND(RC[-3]<RC[-1],RC[-3]>=7,RC[-3]<8),70,IF(AND(RC[-3]<RC[-1],RC[-3]>=8,RC[-3]<9),65,IF(AND(RC[-3]<RC[-1],RC[-3]>=9,RC[-3]<10),60,IF(AND(RC[-3]<RC[-1],RC[-3]>=10,RC[-3]<11),55,IF(AND(RC[-3]<RC[-1],RC[-3]>=11,RC[-3]<12),50,IF(AND(RC[-3]<RC[-1],RC[-3]>=12,RC[-3]<13),45,IF(AND(RC[-3]<RC[-1],RC[-3]>=13,RC[-3]<14),40,IF(AND(RC[-3]<RC[-1],RC[-3]>=14,RC[-3]<15),35,IF(AND(RC[-3]<RC[-1],RC[-3]>=15,RC[-3]<16),30,IF(AND(RC[-3]<RC[-1],RC[-3]>=16,RC[-3]<17),25,IF(AND(RC[-3]<RC[-1],RC[-3]>=17,RC[-3]<18),20,IF(AND(RC[-3]<RC[-1],RC[-3]>=18,RC[-3]<19),15,IF(AND(RC[-3]<RC[-1],RC[-3]>=19,RC[-3]<20),10,IF(AND(RC[-3]<RC[-1],RC[-3]>=20,RC[-3]<21),5,IF(AND(RC[-3]<RC[-1],RC[-3]>=21),0,IF(AND(RC[-3]>RC[-1],RC[-3]>=2,RC[-3]<3),90,IF(AND(RC[-3]>RC[-1],RC[-3]>=3,RC[-3]<4),90,IF(AND(RC[-3]>RC[-1],RC[-3]>=4,RC[-3]<5),80,IF(AND(RC[-3]>RC[-1],RC[-3]>=5,RC[-3]<6),70,IF(AND(RC[-3]>RC[-1],RC[-3]>=6,RC[-3]<7),60,IF(AND(RC[-3]>RC[-1],RC[-3]>=7,RC[-3]<8),50,IF(AND(RC[-3]>RC[-1],RC[-3]>=8,RC[-3]<9),40,IF(AND(RC[-3]>RC[-1],RC[-3]>=9,RC[-3]<10),30,IF(AND(RC[-3]>RC[-1],RC[-3]>=10,RC[-3]<11),20,IF(AND(RC[-3]>RC[-1],RC[-3]>=11,RC[-3]<12),10,IF(AND(RC[-3]>RC[-1],RC[-3]>=12),0))))))))))))))))))))))))))))))))) -> 0 | H102: =IF(RC[-3]="","",IF(RC[-3]<0.3,100,IF(AND(RC[-3]>=0.3,RC[-3]>0.4),95,IF(AND(RC[-3]>=0.4,RC[-3]<0.5),90,IF(AND(RC[-3]>=0.5,RC[-3]<0.6),85,IF(AND(RC[-3]>=0.6,RC[-3]<0.7),80,IF(AND(RC[-3]>=0.6,RC[-3]<1),80,IF(AND(RC[-3]>1,RC[-3]<2),50,IF(RC[-3]>2,0))))))))) ->  | I102: =IF(RC[-1]="",RC[-2],0.7*RC[-1]+0.3*RC[-2]) -> 0
A103: بیمه سرمد | B103: وسرمد | C103: =VLOOKUP(RC[-1],Sheet1!R3C2:R802C3,2,FALSE) -> بیمه و بازنشستگی | D103: =VLOOKUP(RC[-2],Sheet1!R3C2:R802C9,8,FALSE) -> -0.71763743455497386 | E103: =IF(VLOOKUP(RC[-3],Sheet1!R3C2:R803C11,10,FALSE)=0,"",VLOOKUP(Sheet2!RC[-3],Sheet1!R[1]C[-3]:R[801]C[6],10,FALSE)) ->  | F103: =Sheet1!R[40]C[4] -> 3.6576144136175229E-2 | G103: =IF(RC[-3]<0,0,IF(AND(RC[-3]<RC[-1],RC[-3]<2),100,IF(AND(RC[-3]<RC[-1],RC[-3]>=2,RC[-3]<3),95,IF(AND(RC[-3]<RC[-1],RC[-3]>=3,RC[-3]<4),90,IF(AND(RC[-3]<RC[-1],RC[-3]>=4,RC[-3]<5),85,IF(AND(RC[-3]<RC[-1],RC[-3]>=5,RC[-3]<6),80,IF(AND(RC[-3]<RC[-1],RC[-3]>=6,RC[-3]<7),75,IF(AND(RC[-3]<RC[-1],RC[-3]>=7,RC[-3]<8),70,IF(AND(RC[-3]<RC[-1],RC[-3]>=8,RC[-3]<9),65,IF(AND(RC[-3]<RC[-1],RC[-3]>=9,RC[-3]<10),60,IF(AND(RC[-3]<RC[-1],RC[-3]>=10,RC[-3]<11),55,IF(AND(RC[-3]<RC[-1],RC[-3]>=11,RC[-3]<12),50,IF(AND(RC[-3]<RC[-1],RC[-3]>=12,RC[-3]<13),45,IF(AND(RC[-3]<RC[-1],RC[-3]>=13,RC[-3]<14),40,IF(AND(RC[-3]<RC[-1],RC[-3]>=14,RC[-3]<15),35,IF(AND(RC[-3]<RC[-1],RC[-3]>=15,RC[-3]<16),30,IF(AND(RC[-3]<RC[-1],RC[-3]>=16,RC[-3]<17),25,IF(AND(RC[-3]<RC[-1],RC[-3]>=17,RC[-3]<18),20,IF(AND(RC[-3]<RC[-1],RC[-3]>=18,RC[-3]<19),15,IF(AND(RC[-3]<RC[-1],RC[-3]>=19,RC[-3]<20),10,IF(AND(RC[-3]<RC[-1],RC[-3]>=20,RC[-3]<21),5,IF(AND(RC[-3]<RC[-1],RC[-3]>=21),0,IF(AND(RC[-3]>RC[-1],RC[-3]>=2,RC[-3]<3),90,IF(AND(RC[-3]>RC[-1],RC[-3]>=3,RC[-3]<4),90,IF(AND(RC[-3]>RC[-1],RC[-3]>=4,RC[-3]<5),80,IF(AND(RC[-3]>RC[-1],RC[-3]>=5,RC[-3]<6),70,IF(AND(RC[-3]>RC[-1],RC[-3]>=6,RC[-3]<7),60,IF(AND(RC[-3]>RC[-1],RC[-3]>=7,RC[-3]<8),50,IF(AND(RC[-3]>RC[-1],RC[-3]>=8,RC[-3]<9),40,IF(AND(RC[-3]>RC[-1],RC[-3]>=9,RC[-3]<10),30,IF(AND(RC[-3]>RC[-1],RC[-3]>=10,RC[-3]<11),20,IF(AND(RC[-3]>RC[-1],RC[-3]>=11,RC[-3]<12),10,IF(AND(RC[-3]>RC[-1],RC[-3]>=12),0))))))))))))))))))))))))))))))))) -> 0 | H103: =IF(RC[-3]="","",IF(RC[-3]<0.3,100,IF(AND(RC[-3]>=0.3,RC[-3]>0.4),95,IF(AND(RC[-3]>=0.4,RC[-3]<0.5),90,IF(AND(RC[-3]>=0.5,RC[-3]<0.6),85,IF(AND(RC[-3]>=0.6,RC[-3]<0.7),80,IF(AND(RC[-3]>=0.6,RC[-3]<1),80,IF(AND(RC[-3]>1,RC[-3]<2),50,IF(RC[-3]>2,0))))))))) ->  | I103: =IF(RC[-1]="",RC[-2],0.7*RC[-1]+0.3*RC[-2]) -> 0
A104: بیمه سینا | B104: وسین | C104: =VLOOKUP(RC[-1],Sheet1!R3C2:R802C3,2,FALSE) -> بیمه و بازنشستگی | D104: =VLOOKUP(RC[-2],Sheet1!R3C2:R802C9,8,FALSE) -> -0.67900608519269778 | E104: =IF(VLOOKUP(RC[-3],Sheet1!R3C2:R803C11,10,FALSE)=0,"",VLOOKUP(Sheet2!RC[-3],Sheet1!R[1]C[-3]:R[801]C[6],10,FALSE)) ->  | F104: =Sheet1!R[40]C[4] -> 0.51664589800345839 | G104: =IF(RC[-3]<0,0,IF(AND(RC[-3]<RC[-1],RC[-3]<2),100,IF(AND(RC[-3]<RC[-1],RC[-3]>=2,RC[-3]<3),95,IF(AND(RC[-3]<RC[-1],RC[-3]>=3,RC[-3]<4),90,IF(AND(RC[-3]<RC[-1],RC[-3]>=4,RC[-3]<5),85,IF(AND(RC[-3]<RC[-1],RC[-3]>=5,RC[-3]<6),80,IF(AND(RC[-3]<RC[-1],RC[-3]>=6,RC[-3]<7),75,IF(AND(RC[-3]<RC[-1],RC[-3]>=7,RC[-3]<8),70,IF(AND(RC[-3]<RC[-1],RC[-3]>=8,RC[-3]<9),65,IF(AND(RC[-3]<RC[-1],RC[-3]>=9,RC[-3]<10),60,IF(AND(RC[-3]<RC[-1],RC[-3]>=10,RC[-3]<11),55,IF(AND(RC[-3]<RC[-1],RC[-3]>=11,RC[-3]<12),50,IF(AND(RC[-3]<RC[-1],RC[-3]>=12,RC[-3]<13),45,IF(AND(RC[-3]<RC[-1],RC[-3]>=13,RC[-3]<14),40,IF(AND(RC[-3]<RC[-1],RC[-3]>=14,RC[-3]<15),35,IF(AND(RC[-3]<RC[-1],RC[-3]>=15,RC[-3]<16),30,IF(AND(RC[-3]<RC[-1],RC[-3]>=16,RC[-3]<17),25,IF(AND(RC[-3]<RC[-1],RC[-3]>=17,RC[-3]<18),20,IF(AND(RC[-3]<RC[-1],RC[-3]>=18,RC[-3]<19),15,IF(AND(RC[-3]<RC[-1],RC[-3]>=19,RC[-3]<20),10,IF(AND(RC[-3]<RC[-1],RC[-3]>=20,RC[-3]<21),5,IF(AND(RC[-3]<RC[-1],RC[-3]>=21),0,IF(AND(RC[-3]>RC[-1],RC[-3]>=2,RC[-3]<3),90,IF(AND(RC[-3]>RC[-1],RC[-3]>=3,RC[-3]<4),90,IF(AND(RC[-3]>RC[-1],RC[-3]>=4,RC[-3]<5),80,IF(AND(RC[-3]>RC[-1],RC[-3]>=5,RC[-3]<6),70,IF(AND(RC[-3]>RC[-1],RC[-3]>=6,RC[-3]<7),60,IF(AND(RC[-3]>RC[-1],RC[-3]>=7,RC[-3]<8),50,IF(AND(RC[-3]>RC[-1],RC[-3]>=8,RC[-3]<9),40,IF(AND(RC[-3]>RC[-1],RC[-3]>=9,RC[-3]<10),30,IF(AND(RC[-3]>RC[-1],RC[-3]>=10,RC[-3]<11),20,IF(AND(RC[-3]>RC[-1],RC[-3]>=11,RC[-3]<12),10,IF(AND(RC[-3]>RC[-1],RC[-3]>=12),0))))))))))))))))))))))))))))))))) -> 0 | H104: =IF(RC[-3]="","",IF(RC[-3]<0.3,100,IF(AND(RC[-3]>=0.3,RC[-3]>0.4),95,IF(AND(RC[-3]>=0.4,RC[-3]<0.5),90,IF(AND(RC[-3]>=0.5,RC[-3]<0.6),85,IF(AND(RC[-3]>=0.6,RC[-3]<0.7),80,IF(AND(RC[-3]>=0.6,RC[-3]<1),80,IF(AND(RC[-3]>1,RC[-3]<2),50,IF(RC[-3]>2,0))))))))) ->  | I104: =IF(RC[-1]="",RC[-2],0.7*RC[-1]+0.3*RC[-2]) -> 0
A105: بیمه ما | B105: ما | C105: =VLOOKUP(RC[-1],Sheet1!R3C2:R802C3,2,FALSE) -> بیمه و بازنشستگی | D105: =VLOOKUP(RC[-2],Sheet1!R3C2:R802C9,8,FALSE) -> 3.6989335499028719 | E105: =IF(VLOOKUP(RC[-3],Sheet1!R3C2:R803C11,10,FALSE)=0,"",VLOOKUP(Sheet2!RC[-3],Sheet1!R[1]C[-3]:R[801]C[6],10,FALSE)) ->  | F105: =Sheet1!R[40]C[4] -> 0.32453635927076802 | G105: =IF(RC[-3]<0,0,IF(AND(RC[-3]<RC[-1],RC[-3]<2),100,IF(AND(RC[-3]<RC[-1],RC[-3]>=2,RC[-3]<3),95,IF(AND(RC[-3]<RC[-1],RC[-3]>=3,RC[-3]<4),90,IF(AND(RC[-3]<RC[-1],RC[-3]>=4,RC[-3]<5),85,IF(AND(RC[-3]<RC[-1],RC[-3]>=5,RC[-3]<6),80,IF(AND(RC[-3]<RC[-1],RC[-3]>=6,RC[-3]<7),75,IF(AND(RC[-3]<RC[-1],RC[-3]>=7,RC[-3]<8),70,IF(AND(RC[-3]<RC[-1],RC[-3]>=8,RC[-3]<9),65,IF(AND(RC[-3]<RC[-1],RC[-3]>=9,RC[-3]<10),60,IF(AND(RC[-3]<RC[-1],RC[-3]>=10,RC[-3]<11),55,IF(AND(RC[-3]<RC[-1],RC[-3]>=11,RC[-3]<12),50,IF(AND(RC[-3]<RC[-1],RC[-3]>=12,RC[-3]<13),45,IF(AND(RC[-3]<RC[-1],RC[-3]>=13,RC[-3]<14),40,IF(AND(RC[-3]<RC[-1],RC[-3]>=14,RC[-3]<15),35,IF(AND(RC[-3]<RC[-1],RC[-3]>=15,RC[-3]<16),30,IF(AND(RC[-3]<RC[-1],RC[-3]>=16,RC[-3]<17),25,IF(AND(RC[-3]<RC[-1],RC[-3]>=17,RC[-3]<18),20,IF(AND(RC[-3]<RC[-1],RC[-3]>=18,RC[-3]<19),15,IF(AND(RC[-3]<RC[-1],RC[-3]>=19,RC[-3]<20),10,IF(AND(RC[-3]<RC[-1],RC[-3]>=20,RC[-3]<21),5,IF(AND(RC[-3]<RC[-1],RC[-3]>=21),0,IF(AND(RC[-3]>RC[-1],RC[-3]>=2,RC[-3]<3),90,IF(AND(RC[-3]>RC[-1],RC[-3]>=3,RC[-3]<4),90,IF(AND(RC[-3]>RC[-1],RC[-3]>=4,RC[-3]<5),80,IF(AND(RC[-3]>RC[-1],RC[-3]>=5,RC[-3]<6),70,IF(AND(RC[-3]>RC[-1],RC[-3]>=6,RC[-3]<7),60,IF(AND(RC[-3]>RC[-1],RC[-3]>=7,RC[-3]<8),50,IF(AND(RC[-3]>RC[-1],RC[-3]>=8,RC[-3]<9),40,IF(AND(RC[-3]>RC[-1],RC[-3]>=9,RC[-3]<10),30,IF(AND(RC[-3]>RC[-1],RC[-3]>=10,RC[-3]<11),20,IF(AND(RC[-3]>RC[-1],RC[-3]>=11,RC[-3]<12),10,IF(AND(RC[-3]>RC[-1],RC[-3]>=12),0))))))))))))))))))))))))))))))))) -> 90 | H105: =IF(RC[-3]="","",IF(RC[-3]<0.3,100,IF(AND(RC[-3]>=0.3,RC[-3]>0.4),95,IF(AND(RC[-3]>=0.4,RC[-3]<0.5),90,IF(AND(RC[-3]>=0.5,RC[-3]<0.6),85,IF(AND(RC[-3]>=0.6,RC[-3]<0.7),80,IF(AND(RC[-3]>=0.6,RC[-3]<1),80,IF(AND(RC[-3]>1,RC[-3]<2),50,IF(RC[-3]>2,0))))))))) ->  | I105: =IF(RC[-1]="",RC[-2],0.7*RC[-1]+0.3*RC[-2]) -> 90
A106: بیمه معلم | B106: ومعلم | C106: =VLOOKUP(RC[-1],Sheet1!R3C2:R802C3,2,FALSE) -> بیمه و بازنشستگی | D106: =VLOOKUP(RC[-2],Sheet1!R3C2:R802C9,8,FALSE) -> 5.1631502347960812 | E106: =IF(VLOOKUP(RC[-3],Sheet1!R3C2:R803C11,10,FALSE)=0,"",VLOOKUP(Sheet2!RC[-3],Sheet1!R[1]C[-3]:R[801]C[6],10,FALSE)) ->  | F106: =Sheet1!R[40]C[4] -> 0.28613847969054867 | G106: =IF(RC[-3]<0,0,IF(AND(RC[-3]<RC[-1],RC[-3]<2),100,IF(AND(RC[-3]<RC[-1],RC[-3]>=2,RC[-3]<3),95,IF(AND(RC[-3]<RC[-1],RC[-3]>=3,RC[-3]<4),90,IF(AND(RC[-3]<RC[-1],RC[-3]>=4,RC[-3]<5),85,IF(AND(RC[-3]<RC[-1],RC[-3]>=5,RC[-3]<6),80,IF(AND(RC[-3]<RC[-1],RC[-3]>=6,RC[-3]<7),75,IF(AND(RC[-3]<RC[-1],RC[-3]>=7,RC[-3]<8),70,IF(AND(RC[-3]<RC[-1],RC[-3]>=8,RC[-3]<9),65,IF(AND(RC[-3]<RC[-1],RC[-3]>=9,RC[-3]<10),60,IF(AND(RC[-3]<RC[-1],RC[-3]>=10,RC[-3]<11),55,IF(AND(RC[-3]<RC[-1],RC[-3]>=11,RC[-3]<12),50,IF(AND(RC[-3]<RC[-1],RC[-3]>=12,RC[-3]<13),45,IF(AND(RC[-3]<RC[-1],RC[-3]>=13,RC[-3]<14),40,IF(AND(RC[-3]<RC[-1],RC[-3]>=14,RC[-3]<15),35,IF(AND(RC[-3]<RC[-1],RC[-3]>=15,RC[-3]<16),30,IF(AND(RC[-3]<RC[-1],RC[-3]>=16,RC[-3]<17),25,IF(AND(RC[-3]<RC[-1],RC[-3]>=17,RC[-3]<18),20,IF(AND(RC[-3]<RC[-1],RC[-3]>=18,RC[-3]<19),15,IF(AND(RC[-3]<RC[-1],RC[-3]>=19,RC[-3]<20),10,IF(AND(RC[-3]<RC[-1],RC[-3]>=20,RC[-3]<21),5,IF(AND(RC[-3]<RC[-1],RC[-3]>=21),0,IF(AND(RC[-3]>RC[-1],RC[-3]>=2,RC[-3]<3),90,IF(AND(RC[-3]>RC[-1],RC[-3]>=3,RC[-3]<4),90,IF(AND(RC[-3]>RC[-1],RC[-3]>=4,RC[-3]<5),80,IF(AND(RC[-3]>RC[-1],RC[-3]>=5,RC[-3]<6),70,IF(AND(RC[-3]>RC[-1],RC[-3]>=6,RC[-3]<7),60,IF(AND(RC[-3]>RC[-1],RC[-3]>=7,RC[-3]<8),50,IF(AND(RC[-3]>RC[-1],RC[-3]>=8,RC[-3]<9),40,IF(AND(RC[-3]>RC[-1],RC[-3]>=9,RC[-3]<10),30,IF(AND(RC[-3]>RC[-1],RC[-3]>=10,RC[-3]<11),20,IF(AND(RC[-3]>RC[-1],RC[-3]>=11,RC[-3]<12),10,IF(AND(RC[-3]>RC[-1],RC[-3]>=12),0))))))))))))))))))))))))))))))))) -> 70 | H106: =IF(RC[-3]="","",IF(RC[-3]<0.3,100,IF(AND(RC[-3]>=0.3,RC[-3]>0.4),95,IF(AND(RC[-3]>=0.4,RC[-3]<0.5),90,IF(AND(RC[-3]>=0.5,RC[-3]<0.6),85,IF(AND(RC[-3]>=0.6,RC[-3]<0.7),80,IF(AND(RC[-3]>=0.6,RC[-3]<1),80,IF(AND(RC[-3]>1,RC[-3]<2),50,IF(RC[-3]>2,0))))))))) ->  | I106: =IF(RC[-1]="",RC[-2],0.7*RC[-1]+0.3*RC[-2]) -> 70
A107: بیمه ملت | B107: ملت | C107: =VLOOKUP(RC[-1],Sheet1!R3C2:R802C3,2,FALSE) -> بیمه و بازنشستگی | D107: =VLOOKUP(RC[-2],Sheet1!R3C2:R802C9,8,FALSE) -> 27.564062500000002 | E107: =IF(VLOOKUP(RC[-3],Sheet1!R3C2:R803C11,10,FALSE)=0,"",VLOOKUP(Sheet2!RC[-3],Sheet1!R[1]C[-3]:R[801]C[6],10,FALSE)) ->  | F107: =Sheet1!R[40]C[4] -> 0.81582100931018953 | G107: =IF(RC[-3]<0,0,IF(AND(RC[-3]<RC[-1],RC[-3]<2),100,IF(AND(RC[-3]<RC[-1],RC[-3]>=2,RC[-3]<3),95,IF(AND(RC[-3]<RC[-1],RC[-3]>=3,RC[-3]<4),90,IF(AND(RC[-3]<RC[-1],RC[-3]>=4,RC[-3]<5),85,IF(AND(RC[-3]<RC[-1],RC[-3]>=5,RC[-3]<6),80,IF(AND(RC[-3]<RC[-1],RC[-3]>=6,RC[-3]<7),75,IF(AND(RC[-3]<RC[-1],RC[-3]>=7,RC[-3]<8),70,IF(AND(RC[-3]<RC[-1],RC[-3]>=8,RC[-3]<9),65,IF(AND(RC[-3]<RC[-1],RC[-3]>=9,RC[-3]<10),60,IF(AND(RC[-3]<RC[-1],RC[-3]>=10,RC[-3]<11),55,IF(AND(RC[-3]<RC[-1],RC[-3]>=11,RC[-3]<12),50,IF(AND(RC[-3]<RC[-1],RC[-3]>=12,RC[-3]<13),45,IF(AND(RC[-3]<RC[-1],RC[-3]>=13,RC[-3]<14),40,IF(AND(RC[-3]<RC[-1],RC[-3]>=14,RC[-3]<15),35,IF(AND(RC[-3]<RC[-1],RC[-3]>=15,RC[-3]<16),30,IF(AND(RC[-3]<RC[-1],RC[-3]>=16,RC[-3]<17),25,IF(AND(RC[-3]<RC[-1],RC[-3]>=17,RC[-3]<18),20,IF(AND(RC[-3]<RC[-1],RC[-3]>=18,RC[-3]<19),15,IF(AND(RC[-3]<RC[-1],RC[-3]>=19,RC[-3]<20),10,IF(AND(RC[-3]<RC[-1],RC[-3]>=20,RC[-3]<21),5,IF(AND(RC[-3]<RC[-1],RC[-3]>=21),0,IF(AND(RC[-3]>RC[-1],RC[-3]>=2,RC[-3]<3),90,IF(AND(RC[-3]>RC[-1],RC[-3]>=3,RC[-3]<4),90,IF(AND(RC[-3]>RC[-1],RC[-3]>=4,RC[-3]<5),80,IF(AND(RC[-3]>RC[-1],RC[-3]>=5,RC[-3]<6),70,IF(AND(RC[-3]>RC[-1],RC[-3]>=6,RC[-3]<7),60,IF(AND(RC[-3]>RC[-1],RC[-3]>=7,RC[-3]<8),50,IF(AND(RC[-3]>RC[-1],RC[-3]>=8,RC[-3]<9),40,IF(AND(RC[-3]>RC[-1],RC[-3]>=9,RC[-3]<10),30,IF(AND(RC[-3]>RC[-1],RC[-3]>=10,RC[-3]<11),20,IF(AND(RC[-3]>RC[-1],RC[-3]>=11,RC[-3]<12),10,IF(AND(RC[-3]>RC[-1],RC[-3]>=12),0))))))))))))))))))))))))))))))))) -> 0 | H107: =IF(RC[-3]="","",IF(RC[-3]<0.3,100,IF(AND(RC[-3]>=0.3,RC[-3]>0.4),95,IF(AND(RC[-3]>=0.4,RC[-3]<0.5),90,IF(AND(RC[-3]>=0.5,RC[-3]<0.6),85,IF(AND(RC[-3]>=0.6,RC[-3]<0.7),80,IF(AND(RC[-3]>=0.6,RC[-3]<1),80,IF(AND(RC[-3]>1,RC[-3]<2),50,IF(RC[-3]>2,0))))))))) ->  | I107: =IF(RC[-1]="",RC[-2],0.7*RC[-1]+0.3*RC[-2]) -> 0
A108: بیمه میهن | B108: میهن | C108: =VLOOKUP(RC[-1],Sheet1!R3C2:R802C3,2,FALSE) -> بیمه و بازنشستگی | D108: =VLOOKUP(RC[-2],Sheet1!R3C2:R802C9,8,FALSE) -> -0.79797742238946379 | E108: =IF(VLOOKUP(RC[-3],Sheet1!R3C2:R803C11,10,FALSE)=0,"",VLOOKUP(Sheet2!RC[-3],Sheet1!R[1]C[-3]:R[801]C[6],10,FALSE)) ->  | F108: =Sheet1!R[40]C[4] -> 0.15112987592492785 | G108: =IF(RC[-3]<0,0,IF(AND(RC[-3]<RC[-1],RC[-3]<2),100,IF(AND(RC[-3]<RC[-1],RC[-3]>=2,RC[-3]<3),95,IF(AND(RC[-3]<RC[-1],RC[-3]>=3,RC[-3]<4),90,IF(AND(RC[-3]<RC[-1],RC[-3]>=4,RC[-3]<5),85,IF(AND(RC[-3]<RC[-1],RC[-3]>=5,RC[-3]<6),80,IF(AND(RC[-3]<RC[-1],RC[-3]>=6,RC[-3]<7),75,IF(AND(RC[-3]<RC[-1],RC[-3]>=7,RC[-3]<8),70,IF(AND(RC[-3]<RC[-1],RC[-3]>=8,RC[-3]<9),65,IF(AND(RC[-3]<RC[-1],RC[-3]>=9,RC[-3]<10),60,IF(AND(RC[-3]<RC[-1],RC[-3]>=10,RC[-3]<11),55,IF(AND(RC[-3]<RC[-1],RC[-3]>=11,RC[-3]<12),50,IF(AND(RC[-3]<RC[-1],RC[-3]>=12,RC[-3]<13),45,IF(AND(RC[-3]<RC[-1],RC[-3]>=13,RC[-3]<14),40,IF(AND(RC[-3]<RC[-1],RC[-3]>=14,RC[-3]<15),35,IF(AND(RC[-3]<RC[-1],RC[-3]>=15,RC[-3]<16),30,IF(AND(RC[-3]<RC[-1],RC[-3]>=16,RC[-3]<17),25,IF(AND(RC[-3]<RC[-1],RC[-3]>=17,RC[-3]<18),20,IF(AND(RC[-3]<RC[-1],RC[-3]>=18,RC[-3]<19),15,IF(AND(RC[-3]<RC[-1],RC[-3]>=19,RC[-3]<20),10,IF(AND(RC[-3]<RC[-1],RC[-3]>=20,RC[-3]<21),5,IF(AND(RC[-3]<RC[-1],RC[-3]>=21),0,IF(AND(RC[-3]>RC[-1],RC[-3]>=2,RC[-3]<3),90,IF(AND(RC[-3]>RC[-1],RC[-3]>=3,RC[-3]<4),90,IF(AND(RC[-3]>RC[-1],RC[-3]>=4,RC[-3]<5),80,IF(AND(RC[-3]>RC[-1],RC[-3]>=5,RC[-3]<6),70,IF(AND(RC[-3]>RC[-1],RC[-3]>=6,RC[-3]<7),60,IF(AND(RC[-3]>RC[-1],RC[-3]>=7,RC[-3]<8),50,IF(AND(RC[-3]>RC[-1],RC[-3]>=8,RC[-3]<9),40,IF(AND(RC[-3]>RC[-1],RC[-3]>=9,RC[-3]<10),30,IF(AND(RC[-3]>RC[-1],RC[-3]>=10,RC[-3]<11),20,IF(AND(RC[-3]>RC[-1],RC[-3]>=11,RC[-3]<12),10,IF(AND(RC[-3]>RC[-1],RC[-3]>=12),0))))))))))))))))))))))))))))))))) -> 0 | H108: =IF(RC[-3]="","",IF(RC[-3]<0.3,100,IF(AND(RC[-3]>=0.3,RC[-3]>0.4),95,IF(AND(RC[-3]>=0.4,RC[-3]<0.5),90,IF(AND(RC[-3]>=0.5,RC[-3]<0.6),85,IF(AND(RC[-3]>=0.6,RC[-3]<0.7),80,IF(AND(RC[-3]>=0.6,RC[-3]<1),80,IF(AND(RC[-3]>1,RC[-3]<2),50,IF(RC[-3]>2,0))))))))) ->  | I108: =IF(RC[-1]="",RC[-2],0.7*RC[-1]+0.3*RC[-2]) -> 0
A109: بیمه نوین | B109: نوین | C109: =VLOOKUP(RC[-1],Sheet1!R3C2:R802C3,2,FALSE) -> بیمه و بازنشستگی | D109: =VLOOKUP(RC[-2],Sheet1!R3C2:R802C9,8,FALSE) -> 5.3720588235294127 | E109: =IF(VLOOKUP(RC[-3],Sheet1!R3C2:R803C11,10,FALSE)=0,"",VLOOKUP(Sheet2!RC[-3],Sheet1!R[1]C[-3]:R[801]C[6],10,FALSE)) ->  | F109: =Sheet1!R[40]C[4] -> 0.17898312844670131 | G109: =IF(RC[-3]<0,0,IF(AND(RC[-3]<RC[-1],RC[-3]<2),100,IF(AND(RC[-3]<RC[-1],RC[-3]>=2,RC[-3]<3),95,IF(AND(RC[-3]<RC[-1],RC[-3]>=3,RC[-3]<4),90,IF(AND(RC[-3]<RC[-1],RC[-3]>=4,RC[-3]<5),85,IF(AND(RC[-3]<RC[-1],RC[-3]>=5,RC[-3]<6),80,IF(AND(RC[-3]<RC[-1],RC[-3]>=6,RC[-3]<7),75,IF(AND(RC[-3]<RC[-1],RC[-3]>=7,RC[-3]<8),70,IF(AND(RC[-3]<RC[-1],RC[-3]>=8,RC[-3]<9),65,IF(AND(RC[-3]<RC[-1],RC[-3]>=9,RC[-3]<10),60,IF(AND(RC[-3]<RC[-1],RC[-3]>=10,RC[-3]<11),55,IF(AND(RC[-3]<RC[-1],RC[-3]>=11,RC[-3]<12),50,IF(AND(RC[-3]<RC[-1],RC[-3]>=12,RC[-3]<13),45,IF(AND(RC[-3]<RC[-1],RC[-3]>=13,RC[-3]<14),40,IF(AND(RC[-3]<RC[-1],RC[-3]>=14,RC[-3]<15),35,IF(AND(RC[-3]<RC[-1],RC[-3]>=15,RC[-3]<16),30,IF(AND(RC[-3]<RC[-1],RC[-3]>=16,RC[-3]<17),25,IF(AND(RC[-3]<RC[-1],RC[-3]>=17,RC[-3]<18),20,IF(AND(RC[-3]<RC[-1],RC[-3]>=18,RC[-3]<19),15,IF(AND(RC[-3]<RC[-1],RC[-3]>=19,RC[-3]<20),10,IF(AND(RC[-3]<RC[-1],RC[-3]>=20,RC[-3]<21),5,IF(AND(RC[-3]<RC[-1],RC[-3]>=21),0,IF(AND(RC[-3]>RC[-1],RC[-3]>=2,RC[-3]<3),90,IF(AND(RC[-3]>RC[-1],RC[-3]>=3,RC[-3]<4),90,IF(AND(RC[-3]>RC[-1],RC[-3]>=4,RC[-3]<5),80,IF(AND(RC[-3]>RC[-1],RC[-3]>=5,RC[-3]<6),70,IF(AND(RC[-3]>RC[-1],RC[-3]>=6,RC[-3]<7),60,IF(AND(RC[-3]>RC[-1],RC[-3]>=7,RC[-3]<8),50,IF(AND(RC[-3]>RC[-1],RC[-3]>=8,RC[-3]<9),40,IF(AND(RC[-3]>RC[-1],RC[-3]>=9,RC[-3]<10),30,IF(AND(RC[-3]>RC[-1],RC[-3]>=10,RC[-3]<11),20,IF(AND(RC[-3]>RC[-1],RC[-3]>=11,RC[-3]<12),10,IF(AND(RC[-3]>RC[-1],RC[-3]>=12),0))))))))))))))))))))))))))))))))) -> 70 | H109: =IF(RC[-3]="","",IF(RC[-3]<0.3,100,IF(AND(RC[-3]>=0.3,RC[-3]>0.4),95,IF(AND(RC[-3]>=0.4,RC[-3]<0.5),90,IF(AND(RC[-3]>=0.5,RC[-3]<0.6),85,IF(AND(RC[-3]>=0.6,RC[-3]<0.7),80,IF(AND(RC[-3]>=0.6,RC[-3]<1),80,IF(AND(RC[-3]>1,RC[-3]<2),50,IF(RC[-3]>2,0))))))))) ->  | I109: =IF(RC[-1]="",RC[-2],0.7*RC[-1]+0.3*RC[-2]) -> 70
A110: بیمه هوشمند فردا | B110: وفردا | C110: =VLOOKUP(RC[-1],Sheet1!R3C2:R802C3,2,FALSE) -> بیمه و بازنشستگی | D110: =VLOOKUP(RC[-2],Sheet1!R3C2:R802C9,8,FALSE) -> 0 | E110: =IF(VLOOKUP(RC[-3],Sheet1!R3C2:R803C11,10,FALSE)=0,"",VLOOKUP(Sheet2!RC[-3],Sheet1!R[1]C[-3]:R[801]C[6],10,FALSE)) ->  | F110: =Sheet1!R[40]C[4] -> 0.11644330679532362 | G110: =IF(RC[-3]<0,0,IF(AND(RC[-3]<RC[-1],RC[-3]<2),100,IF(AND(RC[-3]<RC[-1],RC[-3]>=2,RC[-3]<3),95,IF(AND(RC[-3]<RC[-1],RC[-3]>=3,RC[-3]<4),90,IF(AND(RC[-3]<RC[-1],RC[-3]>=4,RC[-3]<5),85,IF(AND(RC[-3]<RC[-1],RC[-3]>=5,RC[-3]<6),80,IF(AND(RC[-3]<RC[-1],RC[-3]>=6,RC[-3]<7),75,IF(AND(RC[-3]<RC[-1],RC[-3]>=7,RC[-3]<8),70,IF(AND(RC[-3]<RC[-1],RC[-3]>=8,RC[-3]<9),65,IF(AND(RC[-3]<RC[-1],RC[-3]>=9,RC[-3]<10),60,IF(AND(RC[-3]<RC[-1],RC[-3]>=10,RC[-3]<11),55,IF(AND(RC[-3]<RC[-1],RC[-3]>=11,RC[-3]<12),50,IF(AND(RC[-3]<RC[-1],RC[-3]>=12,RC[-3]<13),45,IF(AND(RC[-3]<RC[-1],RC[-3]>=13,RC[-3]<14),40,IF(AND(RC[-3]<RC[-1],RC[-3]>=14,RC[-3]<15),35,IF(AND(RC[-3]<RC[-1],RC[-3]>=15,RC[-3]<16),30,IF(AND(RC[-3]<RC[-1],RC[-3]>=16,RC[-3]<17),25,IF(AND(RC[-3]<RC[-1],RC[-3]>=17,RC[-3]<18),20,IF(AND(RC[-3]<RC[-1],RC[-3]>=18,RC[-3]<19),15,IF(AND(RC[-3]<RC[-1],RC[-3]>=19,RC[-3]<20),10,IF(AND(RC[-3]<RC[-1],RC[-3]>=20,RC[-3]<21),5,IF(AND(RC[-3]<RC[-1],RC[-3]>=21),0,IF(AND(RC[-3]>RC[-1],RC[-3]>=2,RC[-3]<3),90,IF(AND(RC[-3]>RC[-1],RC[-3]>=3,RC[-3]<4),90,IF(AND(RC[-3]>RC[-1],RC[-3]>=4,RC[-3]<5),80,IF(AND(RC[-3]>RC[-1],RC[-3]>=5,RC[-3]<6),70,IF(AND(RC[-3]>RC[-1],RC[-3]>=6,RC[-3]<7),60,IF(AND(RC[-3]>RC[-1],RC[-3]>=7,RC[-3]<8),50,IF(AND(RC[-3]>RC[-1],RC[-3]>=8,RC[-3]<9),40,IF(AND(RC[-3]>RC[-1],RC[-3]>=9,RC[-3]<10),30,IF(AND(RC[-3]>RC[-1],RC[-3]>=10,RC[-3]<11),20,IF(AND(RC[-3]>RC[-1],RC[-3]>=11,RC[-3]<12),10,IF(AND(RC[-3]>RC[-1],RC[-3]>=12),0))))))))))))))))))))))))))))))))) -> 100 | H110: =IF(RC[-3]="","",IF(RC[-3]<0.3,100,IF(AND(RC[-3]>=0.3,RC[-3]>0.4),95,IF(AND(RC[-3]>=0.4,RC[-3]<0.5),90,IF(AND(RC[-3]>=0.5,RC[-3]<0.6),85,IF(AND(RC[-3]>=0.6,RC[-3]<0.7),80,IF(AND(RC[-3]>=0.6,RC[-3]<1),80,IF(AND(RC[-3]>1,RC[-3]<2),50,IF(RC[-3]>2,0))))))))) ->  | I110: =IF(RC[-1]="",RC[-2],0.7*RC[-1]+0.3*RC[-2]) -> 100
A111: بیمه کارآفرین | B111: وآفری | C111: =VLOOKUP(RC[-1],Sheet1!R3C2:R802C3,2,FALSE) -> بیمه و بازنشستگی | D111: =VLOOKUP(RC[-2],Sheet1!R3C2:R802C9,8,FALSE) -> 5.4146150915766667 | E111: =IF(VLOOKUP(RC[-3],Sheet1!R3C2:R803C11,10,FALSE)=0,"",VLOOKUP(Sheet2!RC[-3],Sheet1!R[1]C[-3]:R[801]C[6],10,FALSE)) ->  | F111: =Sheet1!R[40]C[4] -> 0.81218580158476017 | G111: =IF(RC[-3]<0,0,IF(AND(RC[-3]<RC[-1],RC[-3]<2),100,IF(AND(RC[-3]<RC[-1],RC[-3]>=2,RC[-3]<3),95,IF(AND(RC[-3]<RC[-1],RC[-3]>=3,RC[-3]<4),90,IF(AND(RC[-3]<RC[-1],RC[-3]>=4,RC[-3]<5),85,IF(AND(RC[-3]<RC[-1],RC[-3]>=5,RC[-3]<6),80,IF(AND(RC[-3]<RC[-1],RC[-3]>=6,RC[-3]<7),75,IF(AND(RC[-3]<RC[-1],RC[-3]>=7,RC[-3]<8),70,IF(AND(RC[-3]<RC[-1],RC[-3]>=8,RC[-3]<9),65,IF(AND(RC[-3]<RC[-1],RC[-3]>=9,RC[-3]<10),60,IF(AND(RC[-3]<RC[-1],RC[-3]>=10,RC[-3]<11),55,IF(AND(RC[-3]<RC[-1],RC[-3]>=11,RC[-3]<12),50,IF(AND(RC[-3]<RC[-1],RC[-3]>=12,RC[-3]<13),45,IF(AND(RC[-3]<RC[-1],RC[-3]>=13,RC[-3]<14),40,IF(AND(RC[-3]<RC[-1],RC[-3]>=14,RC[-3]<15),35,IF(AND(RC[-3]<RC[-1],RC[-3]>=15,RC[-3]<16),30,IF(AND(RC[-3]<RC[-1],RC[-3]>=16,RC[-3]<17),25,IF(AND(RC[-3]<RC[-1],RC[-3]>=17,RC[-3]<18),20,IF(AND(RC[-3]<RC[-1],RC[-3]>=18,RC[-3]<19),15,IF(AND(RC[-3]<RC[-1],RC[-3]>=19,RC[-3]<20),10,IF(AND(RC[-3]<RC[-1],RC[-3]>=20,RC[-3]<21),5,IF(AND(RC[-3]<RC[-1],RC[-3]>=21),0,IF(AND(RC[-3]>RC[-1],RC[-3]>=2,RC[-3]<3),90,IF(AND(RC[-3]>RC[-1],RC[-3]>=3,RC[-3]<4),90,IF(AND(RC[-3]>RC[-1],RC[-3]>=4,RC[-3]<5),80,IF(AND(RC[-3]>RC[-1],RC[-3]>=5,RC[-3]<6),70,IF(AND(RC[-3]>RC[-1],RC[-3]>=6,RC[-3]<7),60,IF(AND(RC[-3]>RC[-1],RC[-3]>=7,RC[-3]<8),50,IF(AND(RC[-3]>RC[-1],RC[-3]>=8,RC[-3]<9),40,IF(AND(RC[-3]>RC[-1],RC[-3]>=9,RC[-3]<10),30,IF(AND(RC[-3]>RC[-1],RC[-3]>=10,RC[-3]<11),20,IF(AND(RC[-3]>RC[-1],RC[-3]>=11,RC[-3]<12),10,IF(AND(RC[-3]>RC[-1],RC[-3]>=12),0))))))))))))))))))))))))))))))))) -> 70 | H111: =IF(RC[-3]="","",IF(RC[-3]<0.3,100,IF(AND(RC[-3]>=0.3,RC[-3]>0.4),95,IF(AND(RC[-3]>=0.4,RC[-3]<0.5),90,IF(AND(RC[-3]>=0.5,RC[-3]<0.6),85,IF(AND(RC[-3]>=0.6,RC[-3]<0.7),80,IF(AND(RC[-3]>=0.6,RC[-3]<1),80,IF(AND(RC[-3]>1,RC[-3]<2),50,IF(RC[-3]>2,0))))))))) ->  | I111: =IF(RC[-1]="",RC[-2],0.7*RC[-1]+0.3*RC[-2]) -> 70
A112: بیمه کوثر | B112: کوثر | C112: =VLOOKUP(RC[-1],Sheet1!R3C2:R802C3,2,FALSE) -> بیمه و بازنشستگی | D112: =VLOOKUP(RC[-2],Sheet1!R3C2:R802C9,8,FALSE) -> 6.1248225887626617 | E112: =IF(VLOOKUP(RC[-3],Sheet1!R3C2:R803C11,10,FALSE)=0,"",VLOOKUP(Sheet2!RC[-3],Sheet1!R[1]C[-3]:R[801]C[6],10,FALSE)) ->  | F112: =Sheet1!R[40]C[4] -> 0.30382061193427773 | G112: =IF(RC[-3]<0,0,IF(AND(RC[-3]<RC[-1],RC[-3]<2),100,IF(AND(RC[-3]<RC[-1],RC[-3]>=2,RC[-3]<3),95,IF(AND(RC[-3]<RC[-1],RC[-3]>=3,RC[-3]<4),90,IF(AND(RC[-3]<RC[-1],RC[-3]>=4,RC[-3]<5),85,IF(AND(RC[-3]<RC[-1],RC[-3]>=5,RC[-3]<6),80,IF(AND(RC[-3]<RC[-1],RC[-3]>=6,RC[-3]<7),75,IF(AND(RC[-3]<RC[-1],RC[-3]>=7,RC[-3]<8),70,IF(AND(RC[-3]<RC[-1],RC[-3]>=8,RC[-3]<9),65,IF(AND(RC[-3]<RC[-1],RC[-3]>=9,RC[-3]<10),60,IF(AND(RC[-3]<RC[-1],RC[-3]>=10,RC[-3]<11),55,IF(AND(RC[-3]<RC[-1],RC[-3]>=11,RC[-3]<12),50,IF(AND(RC[-3]<RC[-1],RC[-3]>=12,RC[-3]<13),45,IF(AND(RC[-3]<RC[-1],RC[-3]>=13,RC[-3]<14),40,IF(AND(RC[-3]<RC[-1],RC[-3]>=14,RC[-3]<15),35,IF(AND(RC[-3]<RC[-1],RC[-3]>=15,RC[-3]<16),30,IF(AND(RC[-3]<RC[-1],RC[-3]>=16,RC[-3]<17),25,IF(AND(RC[-3]<RC[-1],RC[-3]>=17,RC[-3]<18),20,IF(AND(RC[-3]<RC[-1],RC[-3]>=18,RC[-3]<19),15,IF(AND(RC[-3]<RC[-1],RC[-3]>=19,RC[-3]<20),10,IF(AND(RC[-3]<RC[-1],RC[-3]>=20,RC[-3]<21),5,IF(AND(RC[-3]<RC[-1],RC[-3]>=21),0,IF(AND(RC[-3]>RC[-1],RC[-3]>=2,RC[-3]<3),90,IF(AND(RC[-3]>RC[-1],RC[-3]>=3,RC[-3]<4),90,IF(AND(RC[-3]>RC[-1],RC[-3]>=4,RC[-3]<5),80,IF(AND(RC[-3]>RC[-1],RC[-3]>=5,RC[-3]<6),70,IF(AND(RC[-3]>RC[-1],RC[-3]>=6,RC[-3]<7),60,IF(AND(RC[-3]>RC[-1],RC[-3]>=7,RC[-3]<8),50,IF(AND(RC[-3]>RC[-1],RC[-3]>=8,RC[-3]<9),40,IF(AND(RC[-3]>RC[-1],RC[-3]>=9,RC[-3]<10),30,IF(AND(RC[-3]>RC[-1],RC[-3]>=10,RC[-3]<11),20,IF(AND(RC[-3]>RC[-1],RC[-3]>=11,RC[-3]<12),10,IF(AND(RC[-3]>RC[-1],RC[-3]>=12),0))))))))))))))))))))))))))))))))) -> 60 | H112: =IF(RC[-3]="","",IF(RC[-3]<0.3,100,IF(AND(RC[-3]>=0.3,RC[-3]>0.4),95,IF(AND(RC[-3]>=0.4,RC[-3]<0.5),90,IF(AND(RC[-3]>=0.5,RC[-3]<0.6),85,IF(AND(RC[-3]>=0.6,RC[-3]<0.7),80,IF(AND(RC[-3]>=0.6,RC[-3]<1),80,IF(AND(RC[-3]>1,RC[-3]<2),50,IF(RC[-3]>2,0))))))))) ->  | I112: =IF(RC[-1]="",RC[-2],0.7*RC[-1]+0.3*RC[-2]) -> 60
A113: تأسیسات راه آهن | B113: بالاس | C113: =VLOOKUP(RC[-1],Sheet1!R3C2:R802C3,2,FALSE) -> پیمانکاری صنعتی | D113: =VLOOKUP(RC[-2],Sheet1!R3C2:R802C9,8,FALSE) -> 160.99274602864142 | E113: =IF(VLOOKUP(RC[-3],Sheet1!R3C2:R803C11,10,FALSE)=0,"",VLOOKUP(Sheet2!RC[-3],Sheet1!R[1]C[-3]:R[801]C[6],10,FALSE)) ->  | F113: =Sheet1!R126C10 -> 36.470777998341767 | G113: =IF(RC[-3]<0,0,IF(AND(RC[-3]<RC[-1],RC[-3]<2),100,IF(AND(RC[-3]<RC[-1],RC[-3]>=2,RC[-3]<3),95,IF(AND(RC[-3]<RC[-1],RC[-3]>=3,RC[-3]<4),90,IF(AND(RC[-3]<RC[-1],RC[-3]>=4,RC[-3]<5),85,IF(AND(RC[-3]<RC[-1],RC[-3]>=5,RC[-3]<6),80,IF(AND(RC[-3]<RC[-1],RC[-3]>=6,RC[-3]<7),75,IF(AND(RC[-3]<RC[-1],RC[-3]>=7,RC[-3]<8),70,IF(AND(RC[-3]<RC[-1],RC[-3]>=8,RC[-3]<9),65,IF(AND(RC[-3]<RC[-1],RC[-3]>=9,RC[-3]<10),60,IF(AND(RC[-3]<RC[-1],RC[-3]>=10,RC[-3]<11),55,IF(AND(RC[-3]<RC[-1],RC[-3]>=11,RC[-3]<12),50,IF(AND(RC[-3]<RC[-1],RC[-3]>=12,RC[-3]<13),45,IF(AND(RC[-3]<RC[-1],RC[-3]>=13,RC[-3]<14),40,IF(AND(RC[-3]<RC[-1],RC[-3]>=14,RC[-3]<15),35,IF(AND(RC[-3]<RC[-1],RC[-3]>=15,RC[-3]<16),30,IF(AND(RC[-3]<RC[-1],RC[-3]>=16,RC[-3]<17),25,IF(AND(RC[-3]<RC[-1],RC[-3]>=17,RC[-3]<18),20,IF(AND(RC[-3]<RC[-1],RC[-3]>=18,RC[-3]<19),15,IF(AND(RC[-3]<RC[-1],RC[-3]>=19,RC[-3]<20),10,IF(AND(RC[-3]<RC[-1],RC[-3]>=20,RC[-3]<21),5,IF(AND(RC[-3]<RC[-1],RC[-3]>=21),0,IF(AND(RC[-3]>RC[-1],RC[-3]>=2,RC[-3]<3),90,IF(AND(RC[-3]>RC[-1],RC[-3]>=3,RC[-3]<4),90,IF(AND(RC[-3]>RC[-1],RC[-3]>=4,RC[-3]<5),80,IF(AND(RC[-3]>RC[-1],RC[-3]>=5,RC[-3]<6),70,IF(AND(RC[-3]>RC[-1],RC[-3]>=6,RC[-3]<7),60,IF(AND(RC[-3]>RC[-1],RC[-3]>=7,RC[-3]<8),50,IF(AND(RC[-3]>RC[-1],RC[-3]>=8,RC[-3]<9),40,IF(AND(RC[-3]>RC[-1],RC[-3]>=9,RC[-3]<10),30,IF(AND(RC[-3]>RC[-1],RC[-3]>=10,RC[-3]<11),20,IF(AND(RC[-3]>RC[-1],RC[-3]>=11,RC[-3]<12),10,IF(AND(RC[-3]>RC[-1],RC[-3]>=12),0))))))))))))))))))))))))))))))))) -> 0 | H113: =IF(RC[-3]="","",IF(RC[-3]<0.3,100,IF(AND(RC[-3]>=0.3,RC[-3]>0.4),95,IF(AND(RC[-3]>=0.4,RC[-3]<0.5),90,IF(AND(RC[-3]>=0.5,RC[-3]<0.6),85,IF(AND(RC[-3]>=0.6,RC[-3]<0.7),80,IF(AND(RC[-3]>=0.6,RC[-3]<1),80,IF(AND(RC[-3]>1,RC[-3]<2),50,IF(RC[-3]>2,0))))))))) ->  | I113: =IF(RC[-1]="",RC[-2],0.7*RC[-1]+0.3*RC[-2]) -> 0
A114: صنعتی دریایی | B114: خصدرا | C114: =VLOOKUP(RC[-1],Sheet1!R3C2:R802C3,2,FALSE) -> پیمانکاری صنعتی | D114: =VLOOKUP(RC[-2],Sheet1!R3C2:R802C9,8,FALSE) -> 22.9981078367625 | E114: =IF(VLOOKUP(RC[-3],Sheet1!R3C2:R803C11,10,FALSE)=0,"",VLOOKUP(Sheet2!RC[-3],Sheet1!R[1]C[-3]:R[801]C[6],10,FALSE)) ->  | F114: =Sheet1!R126C10 -> 36.470777998341767 | G114: =IF(RC[-3]<0,0,IF(AND(RC[-3]<RC[-1],RC[-3]<2),100,IF(AND(RC[-3]<RC[-1],RC[-3]>=2,RC[-3]<3),95,IF(AND(RC[-3]<RC[-1],RC[-3]>=3,RC[-3]<4),90,IF(AND(RC[-3]<RC[-1],RC[-3]>=4,RC[-3]<5),85,IF(AND(RC[-3]<RC[-1],RC[-3]>=5,RC[-3]<6),80,IF(AND(RC[-3]<RC[-1],RC[-3]>=6,RC[-3]<7),75,IF(AND(RC[-3]<RC[-1],RC[-3]>=7,RC[-3]<8),70,IF(AND(RC[-3]<RC[-1],RC[-3]>=8,RC[-3]<9),65,IF(AND(RC[-3]<RC[-1],RC[-3]>=9,RC[-3]<10),60,IF(AND(RC[-3]<RC[-1],RC[-3]>=10,RC[-3]<11),55,IF(AND(RC[-3]<RC[-1],RC[-3]>=11,RC[-3]<12),50,IF(AND(RC[-3]<RC[-1],RC[-3]>=12,RC[-3]<13),45,IF(AND(RC[-3]<RC[-1],RC[-3]>=13,RC[-3]<14),40,IF(AND(RC[-3]<RC[-1],RC[-3]>=14,RC[-3]<15),35,IF(AND(RC[-3]<RC[-1],RC[-3]>=15,RC[-3]<16),30,IF(AND(RC[-3]<RC[-1],RC[-3]>=16,RC[-3]<17),25,IF(AND(RC[-3]<RC[-1],RC[-3]>=17,RC[-3]<18),20,IF(AND(RC[-3]<RC[-1],RC[-3]>=18,RC[-3]<19),15,IF(AND(RC[-3]<RC[-1],RC[-3]>=19,RC[-3]<20),10,IF(AND(RC[-3]<RC[-1],RC[-3]>=20,RC[-3]<21),5,IF(AND(RC[-3]<RC[-1],RC[-3]>=21),0,IF(AND(RC[-3]>RC[-1],RC[-3]>=2,RC[-3]<3),90,IF(AND(RC[-3]>RC[-1],RC[-3]>=3,RC[-3]<4),90,IF(AND(RC[-3]>RC[-1],RC[-3]>=4,RC[-3]<5),80,IF(AND(RC[-3]>RC[-1],RC[-3]>=5,RC[-3]<6),70,IF(AND(RC[-3]>RC[-1],RC[-3]>=6,RC[-3]<7),60,IF(AND(RC[-3]>RC[-1],RC[-3]>=7,RC[-3]<8),50,IF(AND(RC[-3]>RC[-1],RC[-3]>=8,RC[-3]<9),40,IF(AND(RC[-3]>RC[-1],RC[-3]>=9,RC[-3]<10),30,IF(AND(RC[-3]>RC[-1],RC[-3]>=10,RC[-3]<11),20,IF(AND(RC[-3]>RC[-1],RC[-3]>=11,RC[-3]<12),10,IF(AND(RC[-3]>RC[-1],RC[-3]>=12),0))))))))))))))))))))))))))))))))) -> 0 | H114: =IF(RC[-3]="","",IF(RC[-3]<0.3,100,IF(AND(RC[-3]>=0.3,RC[-3]>0.4),95,IF(AND(RC[-3]>=0.4,RC[-3]<0.5),90,IF(AND(RC[-3]>=0.5,RC[-3]<0.6),85,IF(AND(RC[-3]>=0.6,RC[-3]<0.7),80,IF(AND(RC[-3]>=0.6,RC[-3]<1),80,IF(AND(RC[-3]>1,RC[-3]<2),50,IF(RC[-3]>2,0))))))))) ->  | I114: =IF(RC[-1]="",RC[-2],0.7*RC[-1]+0.3*RC[-2]) -> 0
A115: سر. امید | B115: وامید | C115: =VLOOKUP(RC[-1],Sheet1!R3C2:R802C3,2,FALSE) -> چندرشته ای صنعتی | D115: =VLOOKUP(RC[-2],Sheet1!R3C2:R802C9,8,FALSE) -> 5.200729620002301 | E115: =IF(VLOOKUP(RC[-3],Sheet1!R3C2:R803C11,10,FALSE)=0,"",VLOOKUP(Sheet2!RC[-3],Sheet1!R[1]C[-3]:R[801]C[6],10,FALSE)) -> 0.6 | F115: =Sheet1!R136C10 -> 4.8374014222460913 | G115: =IF(RC[-3]<0,0,IF(AND(RC[-3]<RC[-1],RC[-3]<2),100,IF(AND(RC[-3]<RC[-1],RC[-3]>=2,RC[-3]<3),95,IF(AND(RC[-3]<RC[-1],RC[-3]>=3,RC[-3]<4),90,IF(AND(RC[-3]<RC[-1],RC[-3]>=4,RC[-3]<5),85,IF(AND(RC[-3]<RC[-1],RC[-3]>=5,RC[-3]<6),80,IF(AND(RC[-3]<RC[-1],RC[-3]>=6,RC[-3]<7),75,IF(AND(RC[-3]<RC[-1],RC[-3]>=7,RC[-3]<8),70,IF(AND(RC[-3]<RC[-1],RC[-3]>=8,RC[-3]<9),65,IF(AND(RC[-3]<RC[-1],RC[-3]>=9,RC[-3]<10),60,IF(AND(RC[-3]<RC[-1],RC[-3]>=10,RC[-3]<11),55,IF(AND(RC[-3]<RC[-1],RC[-3]>=11,RC[-3]<12),50,IF(AND(RC[-3]<RC[-1],RC[-3]>=12,RC[-3]<13),45,IF(AND(RC[-3]<RC[-1],RC[-3]>=13,RC[-3]<14),40,IF(AND(RC[-3]<RC[-1],RC[-3]>=14,RC[-3]<15),35,IF(AND(RC[-3]<RC[-1],RC[-3]>=15,RC[-3]<16),30,IF(AND(RC[-3]<RC[-1],RC[-3]>=16,RC[-3]<17),25,IF(AND(RC[-3]<RC[-1],RC[-3]>=17,RC[-3]<18),20,IF(AND(RC[-3]<RC[-1],RC[-3]>=18,RC[-3]<19),15,IF(AND(RC[-3]<RC[-1],RC[-3]>=19,RC[-3]<20),10,IF(AND(RC[-3]<RC[-1],RC[-3]>=20,RC[-3]<21),5,IF(AND(RC[-3]<RC[-1],RC[-3]>=21),0,IF(AND(RC[-3]>RC[-1],RC[-3]>=2,RC[-3]<3),90,IF(AND(RC[-3]>RC[-1],RC[-3]>=3,RC[-3]<4),90,IF(AND(RC[-3]>RC[-1],RC[-3]>=4,RC[-3]<5),80,IF(AND(RC[-3]>RC[-1],RC[-3]>=5,RC[-3]<6),70,IF(AND(RC[-3]>RC[-1],RC[-3]>=6,RC[-3]<7),60,IF(AND(RC[-3]>RC[-1],RC[-3]>=7,RC[-3]<8),50,IF(AND(RC[-3]>RC[-1],RC[-3]>=8,RC[-3]<9),40,IF(AND(RC[-3]>RC[-1],RC[-3]>=9,RC[-3]<10),30,IF(AND(RC[-3]>RC[-1],RC[-3]>=10,RC[-3]<11),20,IF(AND(RC[-3]>RC[-1],RC[-3]>=11,RC[-3]<12),10,IF(AND(RC[-3]>RC[-1],RC[-3]>=12),0))))))))))))))))))))))))))))))))) -> 70 | H115: =IF(RC[-3]="","",IF(RC[-3]<0.3,100,IF(AND(RC[-3]>=0.3,RC[-3]>0.4),95,IF(AND(RC[-3]>=0.4,RC[-3]<0.5),90,IF(AND(RC[-3]>=0.5,RC[-3]<0.6),85,IF(AND(RC[-3]>=0.6,RC[-3]<0.7),80,IF(AND(RC[-3]>=0.6,RC[-3]<1),80,IF(AND(RC[-3]>1,RC[-3]<2),50,IF(RC[-3]>2,0))))))))) -> 95 | I115: =IF(RC[-1]="",RC[-2],0.7*RC[-1]+0.3*RC[-2]) -> 87.5
A116: سر. تامین اجتماعی | B116: شستا | C116: =VLOOKUP(RC[-1],Sheet1!R3C2:R802C3,2,FALSE) -> چندرشته ای صنعتی | D116: =VLOOKUP(RC[-2],Sheet1!R3C2:R802C9,8,FALSE) -> 4.80468036171 | E116: =IF(VLOOKUP(RC[-3],Sheet1!R3C2:R803C11,10,FALSE)=0,"",VLOOKUP(Sheet2!RC[-3],Sheet1!R[1]C[-3]:R[801]C[6],10,FALSE)) -> 0.9 | F116: =Sheet1!R136C10 -> 4.8374014222460913 | G116: =IF(RC[-3]<0,0,IF(AND(RC[-3]<RC[-1],RC[-3]<2),100,IF(AND(RC[-3]<RC[-1],RC[-3]>=2,RC[-3]<3),95,IF(AND(RC[-3]<RC[-1],RC[-3]>=3,RC[-3]<4),90,IF(AND(RC[-3]<RC[-1],RC[-3]>=4,RC[-3]<5),85,IF(AND(RC[-3]<RC[-1],RC[-3]>=5,RC[-3]<6),80,IF(AND(RC[-3]<RC[-1],RC[-3]>=6,RC[-3]<7),75,IF(AND(RC[-3]<RC[-1],RC[-3]>=7,RC[-3]<8),70,IF(AND(RC[-3]<RC[-1],RC[-3]>=8,RC[-3]<9),65,IF(AND(RC[-3]<RC[-1],RC[-3]>=9,RC[-3]<10),60,IF(AND(RC[-3]<RC[-1],RC[-3]>=10,RC[-3]<11),55,IF(AND(RC[-3]<RC[-1],RC[-3]>=11,RC[-3]<12),50,IF(AND(RC[-3]<RC[-1],RC[-3]>=12,RC[-3]<13),45,IF(AND(RC[-3]<RC[-1],RC[-3]>=13,RC[-3]<14),40,IF(AND(RC[-3]<RC[-1],RC[-3]>=14,RC[-3]<15),35,IF(AND(RC[-3]<RC[-1],RC[-3]>=15,RC[-3]<16),30,IF(AND(RC[-3]<RC[-1],RC[-3]>=16,RC[-3]<17),25,IF(AND(RC[-3]<RC[-1],RC[-3]>=17,RC[-3]<18),20,IF(AND(RC[-3]<RC[-1],RC[-3]>=18,RC[-3]<19),15,IF(AND(RC[-3]<RC[-1],RC[-3]>=19,RC[-3]<20),10,IF(AND(RC[-3]<RC[-1],RC[-3]>=20,RC[-3]<21),5,IF(AND(RC[-3]<RC[-1],RC[-3]>=21),0,IF(AND(RC[-3]>RC[-1],RC[-3]>=2,RC[-3]<3),90,IF(AND(RC[-3]>RC[-1],RC[-3]>=3,RC[-3]<4),90,IF(AND(RC[-3]>RC[-1],RC[-3]>=4,RC[-3]<5),80,IF(AND(RC[-3]>RC[-1],RC[-3]>=5,RC[-3]<6),70,IF(AND(RC[-3]>RC[-1],RC[-3]>=6,RC[-3]<7),60,IF(AND(RC[-3]>RC[-1],RC[-3]>=7,RC[-3]<8),50,IF(AND(RC[-3]>RC[-1],RC[-3]>=8,RC[-3]<9),40,IF(AND(RC[-3]>RC[-1],RC[-3]>=9,RC[-3]<10),30,IF(AND(RC[-3]>RC[-1],RC[-3]>=10,RC[-3]<11),20,IF(AND(RC[-3]>RC[-1],RC[-3]>=11,RC[-3]<12),10,IF(AND(RC[-3]>RC[-1],RC[-3]>=12),0))))))))))))))))))))))))))))))))) -> 85 | H116: =IF(RC[-3]="","",IF(RC[-3]<0.3,100,IF(AND(RC[-3]>=0.3,RC[-3]>0.4),95,IF(AND(RC[-3]>=0.4,RC[-3]<0.5),90,IF(AND(RC[-3]>=0.5,RC[-3]<0.6),85,IF(AND(RC[-3]>=0.6,RC[-3]<0.7),80,IF(AND(RC[-3]>=0.6,RC[-3]<1),80,IF(AND(RC[-3]>1,RC[-3]<2),50,IF(RC[-3]>2,0))))))))) -> 95 | I116: =IF(RC[-1]="",RC[-2],0.7*RC[-1]+0.3*RC[-2]) -> 92
A117: سر. صندوق بازنشستگی | B117: وصندوق | C117: =VLOOKUP(RC[-1],Sheet1!R3C2:R802C3,2,FALSE) -> چندرشته ای صنعتی | D117: =VLOOKUP(RC[-2],Sheet1!R3C2:R802C9,8,FALSE) -> 3.6404839668972748 | E117: =IF(VLOOKUP(RC[-3],Sheet1!R3C2:R803C11,10,FALSE)=0,"",VLOOKUP(Sheet2!RC[-3],Sheet1!R[1]C[-3]:R[801]C[6],10,FALSE)) -> 0.9 | F117: =Sheet1!R136C10 -> 4.8374014222460913 | G117: =IF(RC[-3]<0,0,IF(AND(RC[-3]<RC[-1],RC[-3]<2),100,IF(AND(RC[-3]<RC[-1],RC[-3]>=2,RC[-3]<3),95,IF(AND(RC[-3]<RC[-1],RC[-3]>=3,RC[-3]<4),90,IF(AND(RC[-3]<RC[-1],RC[-3]>=4,RC[-3]<5),85,IF(AND(RC[-3]<RC[-1],RC[-3]>=5,RC[-3]<6),80,IF(AND(RC[-3]<RC[-1],RC[-3]>=6,RC[-3]<7),75,IF(AND(RC[-3]<RC[-1],RC[-3]>=7,RC[-3]<8),70,IF(AND(RC[-3]<RC[-1],RC[-3]>=8,RC[-3]<9),65,IF(AND(RC[-3]<RC[-1],RC[-3]>=9,RC[-3]<10),60,IF(AND(RC[-3]<RC[-1],RC[-3]>=10,RC[-3]<11),55,IF(AND(RC[-3]<RC[-1],RC[-3]>=11,RC[-3]<12),50,IF(AND(RC[-3]<RC[-1],RC[-3]>=12,RC[-3]<13),45,IF(AND(RC[-3]<RC[-1],RC[-3]>=13,RC[-3]<14),40,IF(AND(RC[-3]<RC[-1],RC[-3]>=14,RC[-3]<15),35,IF(AND(RC[-3]<RC[-1],RC[-3]>=15,RC[-3]<16),30,IF(AND(RC[-3]<RC[-1],RC[-3]>=16,RC[-3]<17),25,IF(AND(RC[-3]<RC[-1],RC[-3]>=17,RC[-3]<18),20,IF(AND(RC[-3]<RC[-1],RC[-3]>=18,RC[-3]<19),15,IF(AND(RC[-3]<RC[-1],RC[-3]>=19,RC[-3]<20),10,IF(AND(RC[-3]<RC[-1],RC[-3]>=20,RC[-3]<21),5,IF(AND(RC[-3]<RC[-1],RC[-3]>=21),0,IF(AND(RC[-3]>RC[-1],RC[-3]>=2,RC[-3]<3),90,IF(AND(RC[-3]>RC[-1],RC[-3]>=3,RC[-3]<4),90,IF(AND(RC[-3]>RC[-1],RC[-3]>=4,RC[-3]<5),80,IF(AND(RC[-3]>RC[-1],RC[-3]>=5,RC[-3]<6),70,IF(AND(RC[-3]>RC[-1],RC[-3]>=6,RC[-3]<7),60,IF(AND(RC[-3]>RC[-1],RC[-3]>=7,RC[-3]<8),50,IF(AND(RC[-3]>RC[-1],RC[-3]>=8,RC[-3]<9),40,IF(AND(RC[-3]>RC[-1],RC[-3]>=9,RC[-3]<10),30,IF(AND(RC[-3]>RC[-1],RC[-3]>=10,RC[-3]<11),20,IF(AND(RC[-3]>RC[-1],RC[-3]>=11,RC[-3]<12),10,IF(AND(RC[-3]>RC[-1],RC[-3]>=12),0))))))))))))))))))))))))))))))))) -> 90 | H117: =IF(RC[-3]="","",IF(RC[-3]<0.3,100,IF(AND(RC[-3]>=0.3,RC[-3]>0.4),95,IF(AND(RC[-3]>=0.4,RC[-3]<0.5),90,IF(AND(RC[-3]>=0.5,RC[-3]<0.6),85,IF(AND(RC[-3]>=0.6,RC[-3]<0.7),80,IF(AND(RC[-3]>=0.6,RC[-3]<1),80,IF(AND(RC[-3]>1,RC[-3]<2),50,IF(RC[-3]>2,0))))))))) -> 95 | I117: =IF(RC[-1]="",RC[-2],0.7*RC[-1]+0.3*RC[-2]) -> 93.5
A118: سر. غدیر | B118: وغدیر | C118: =VLOOKUP(RC[-1],Sheet1!R3C2:R802C3,2,FALSE) -> چندرشته ای صنعتی | D118: =VLOOKUP(RC[-2],Sheet1!R3C2:R802C9,8,FALSE) -> 5.4330902073158747 | E118: =IF(VLOOKUP(RC[-3],Sheet1!R3C2:R803C11,10,FALSE)=0,"",VLOOKUP(Sheet2!RC[-3],Sheet1!R[1]C[-3]:R[801]C[6],10,FALSE)) -> 1.1000000000000001 | F118: =Sheet1!R136C10 -> 4.8374014222460913 | G118: =IF(RC[-3]<0,0,IF(AND(RC[-3]<RC[-1],RC[-3]<2),100,IF(AND(RC[-3]<RC[-1],RC[-3]>=2,RC[-3]<3),95,IF(AND(RC[-3]<RC[-1],RC[-3]>=3,RC[-3]<4),90,IF(AND(RC[-3]<RC[-1],RC[-3]>=4,RC[-3]<5),85,IF(AND(RC[-3]<RC[-1],RC[-3]>=5,RC[-3]<6),80,IF(AND(RC[-3]<RC[-1],RC[-3]>=6,RC[-3]<7),75,IF(AND(RC[-3]<RC[-1],RC[-3]>=7,RC[-3]<8),70,IF(AND(RC[-3]<RC[-1],RC[-3]>=8,RC[-3]<9),65,IF(AND(RC[-3]<RC[-1],RC[-3]>=9,RC[-3]<10),60,IF(AND(RC[-3]<RC[-1],RC[-3]>=10,RC[-3]<11),55,IF(AND(RC[-3]<RC[-1],RC[-3]>=11,RC[-3]<12),50,IF(AND(RC[-3]<RC[-1],RC[-3]>=12,RC[-3]<13),45,IF(AND(RC[-3]<RC[-1],RC[-3]>=13,RC[-3]<14),40,IF(AND(RC[-3]<RC[-1],RC[-3]>=14,RC[-3]<15),35,IF(AND(RC[-3]<RC[-1],RC[-3]>=15,RC[-3]<16),30,IF(AND(RC[-3]<RC[-1],RC[-3]>=16,RC[-3]<17),25,IF(AND(RC[-3]<RC[-1],RC[-3]>=17,RC[-3]<18),20,IF(AND(RC[-3]<RC[-1],RC[-3]>=18,RC[-3]<19),15,IF(AND(RC[-3]<RC[-1],RC[-3]>=19,RC[-3]<20),10,IF(AND(RC[-3]<RC[-1],RC[-3]>=20,RC[-3]<21),5,IF(AND(RC[-3]<RC[-1],RC[-3]>=21),0,IF(AND(RC[-3]>RC[-1],RC[-3]>=2,RC[-3]<3),90,IF(AND(RC[-3]>RC[-1],RC[-3]>=3,RC[-3]<4),90,IF(AND(RC[-3]>RC[-1],RC[-3]>=4,RC[-3]<5),80,IF(AND(RC[-3]>RC[-1],RC[-3]>=5,RC[-3]<6),70,IF(AND(RC[-3]>RC[-1],RC[-3]>=6,RC[-3]<7),60,IF(AND(RC[-3]>RC[-1],RC[-3]>=7,RC[-3]<8),50,IF(AND(RC[-3]>RC[-1],RC[-3]>=8,RC[-3]<9),40,IF(AND(RC[-3]>RC[-1],RC[-3]>=9,RC[-3]<10),30,IF(AND(RC[-3]>RC[-1],RC[-3]>=10,RC[-3]<11),20,IF(AND(RC[-3]>RC[-1],RC[-3]>=11,RC[-3]<12),10,IF(AND(RC[-3]>RC[-1],RC[-3]>=12),0))))))))))))))))))))))))))))))))) -> 70 | H118: =IF(RC[-3]="","",IF(RC[-3]<0.3,100,IF(AND(RC[-3]>=0.3,RC[-3]>0.4),95,IF(AND(RC[-3]>=0.4,RC[-3]<0.5),90,IF(AND(RC[-3]>=0.5,RC[-3]<0.6),85,IF(AND(RC[-3]>=0.6,RC[-3]<0.7),80,IF(AND(RC[-3]>=0.6,RC[-3]<1),80,IF(AND(RC[-3]>1,RC[-3]<2),50,IF(RC[-3]>2,0))))))))) -> 95 | I118: =IF(RC[-1]="",RC[-2],0.7*RC[-1]+0.3*RC[-2]) -> 87.5
A119: سر. گروه توسعه ملی | B119: وبانک | C119: =VLOOKUP(RC[-1],Sheet1!R3C2:R802C3,2,FALSE) -> چندرشته ای صنعتی | D119: =VLOOKUP(RC[-2],Sheet1!R3C2:R802C9,8,FALSE) -> 3.0156950168916703 | E119: =IF(VLOOKUP(RC[-3],Sheet1!R3C2:R803C11,10,FALSE)=0,"",VLOOKUP(Sheet2!RC[-3],Sheet1!R[1]C[-3]:R[801]C[6],10,FALSE)) -> 0.6 | F119: =Sheet1!R136C10 -> 4.8374014222460913 | G119: =IF(RC[-3]<0,0,IF(AND(RC[-3]<RC[-1],RC[-3]<2),100,IF(AND(RC[-3]<RC[-1],RC[-3]>=2,RC[-3]<3),95,IF(AND(RC[-3]<RC[-1],RC[-3]>=3,RC[-3]<4),90,IF(AND(RC[-3]<RC[-1],RC[-3]>=4,RC[-3]<5),85,IF(AND(RC[-3]<RC[-1],RC[-3]>=5,RC[-3]<6),80,IF(AND(RC[-3]<RC[-1],RC[-3]>=6,RC[-3]<7),75,IF(AND(RC[-3]<RC[-1],RC[-3]>=7,RC[-3]<8),70,IF(AND(RC[-3]<RC[-1],RC[-3]>=8,RC[-3]<9),65,IF(AND(RC[-3]<RC[-1],RC[-3]>=9,RC[-3]<10),60,IF(AND(RC[-3]<RC[-1],RC[-3]>=10,RC[-3]<11),55,IF(AND(RC[-3]<RC[-1],RC[-3]>=11,RC[-3]<12),50,IF(AND(RC[-3]<RC[-1],RC[-3]>=12,RC[-3]<13),45,IF(AND(RC[-3]<RC[-1],RC[-3]>=13,RC[-3]<14),40,IF(AND(RC[-3]<RC[-1],RC[-3]>=14,RC[-3]<15),35,IF(AND(RC[-3]<RC[-1],RC[-3]>=15,RC[-3]<16),30,IF(AND(RC[-3]<RC[-1],RC[-3]>=16,RC[-3]<17),25,IF(AND(RC[-3]<RC[-1],RC[-3]>=17,RC[-3]<18),20,IF(AND(RC[-3]<RC[-1],RC[-3]>=18,RC[-3]<19),15,IF(AND(RC[-3]<RC[-1],RC[-3]>=19,RC[-3]<20),10,IF(AND(RC[-3]<RC[-1],RC[-3]>=20,RC[-3]<21),5,IF(AND(RC[-3]<RC[-1],RC[-3]>=21),0,IF(AND(RC[-3]>RC[-1],RC[-3]>=2,RC[-3]<3),90,IF(AND(RC[-3]>RC[-1],RC[-3]>=3,RC[-3]<4),90,IF(AND(RC[-3]>RC[-1],RC[-3]>=4,RC[-3]<5),80,IF(AND(RC[-3]>RC[-1],RC[-3]>=5,RC[-3]<6),70,IF(AND(RC[-3]>RC[-1],RC[-3]>=6,RC[-3]<7),60,IF(AND(RC[-3]>RC[-1],RC[-3]>=7,RC[-3]<8),50,IF(AND(RC[-3]>RC[-1],RC[-3]>=8,RC[-3]<9),40,IF(AND(RC[-3]>RC[-1],RC[-3]>=9,RC[-3]<10),30,IF(AND(RC[-3]>RC[-1],RC[-3]>=10,RC[-3]<11),20,IF(AND(RC[-3]>RC[-1],RC[-3]>=11,RC[-3]<12),10,IF(AND(RC[-3]>RC[-1],RC[-3]>=12),0))))))))))))))))))))))))))))))))) -> 90 | H119: =IF(RC[-3]="","",IF(RC[-3]<0.3,100,IF(AND(RC[-3]>=0.3,RC[-3]>0.4),95,IF(AND(RC[-3]>=0.4,RC[-3]<0.5),90,IF(AND(RC[-3]>=0.5,RC[-3]<0.6),85,IF(AND(RC[-3]>=0.6,RC[-3]<0.7),80,IF(AND(RC[-3]>=0.6,RC[-3]<1),80,IF(AND(RC[-3]>1,RC[-3]<2),50,IF(RC[-3]>2,0))))))))) -> 95 | I119: =IF(RC[-1]="",RC[-2],0.7*RC[-1]+0.3*RC[-2]) -> 93.5
A120: آسیا سیر ارس | B120: حآسا | C120: =VLOOKUP(RC[-1],Sheet1!R3C2:R802C3,2,FALSE) -> حمل و نقل انبارداری و ارتباطات | D120: =VLOOKUP(RC[-2],Sheet1!R3C2:R802C9,8,FALSE) -> 12.008786229154142 | E120: =IF(VLOOKUP(RC[-3],Sheet1!R3C2:R803C11,10,FALSE)=0,"",VLOOKUP(Sheet2!RC[-3],Sheet1!R[1]C[-3]:R[801]C[6],10,FALSE)) ->  | F120: =Sheet1!R156C10 -> 7.6389998027803898 | G120: =IF(RC[-3]<0,0,IF(AND(RC[-3]<RC[-1],RC[-3]<2),100,IF(AND(RC[-3]<RC[-1],RC[-3]>=2,RC[-3]<3),95,IF(AND(RC[-3]<RC[-1],RC[-3]>=3,RC[-3]<4),90,IF(AND(RC[-3]<RC[-1],RC[-3]>=4,RC[-3]<5),85,IF(AND(RC[-3]<RC[-1],RC[-3]>=5,RC[-3]<6),80,IF(AND(RC[-3]<RC[-1],RC[-3]>=6,RC[-3]<7),75,IF(AND(RC[-3]<RC[-1],RC[-3]>=7,RC[-3]<8),70,IF(AND(RC[-3]<RC[-1],RC[-3]>=8,RC[-3]<9),65,IF(AND(RC[-3]<RC[-1],RC[-3]>=9,RC[-3]<10),60,IF(AND(RC[-3]<RC[-1],RC[-3]>=10,RC[-3]<11),55,IF(AND(RC[-3]<RC[-1],RC[-3]>=11,RC[-3]<12),50,IF(AND(RC[-3]<RC[-1],RC[-3]>=12,RC[-3]<13),45,IF(AND(RC[-3]<RC[-1],RC[-3]>=13,RC[-3]<14),40,IF(AND(RC[-3]<RC[-1],RC[-3]>=14,RC[-3]<15),35,IF(AND(RC[-3]<RC[-1],RC[-3]>=15,RC[-3]<16),30,IF(AND(RC[-3]<RC[-1],RC[-3]>=16,RC[-3]<17),25,IF(AND(RC[-3]<RC[-1],RC[-3]>=17,RC[-3]<18),20,IF(AND(RC[-3]<RC[-1],RC[-3]>=18,RC[-3]<19),15,IF(AND(RC[-3]<RC[-1],RC[-3]>=19,RC[-3]<20),10,IF(AND(RC[-3]<RC[-1],RC[-3]>=20,RC[-3]<21),5,IF(AND(RC[-3]<RC[-1],RC[-3]>=21),0,IF(AND(RC[-3]>RC[-1],RC[-3]>=2,RC[-3]<3),90,IF(AND(RC[-3]>RC[-1],RC[-3]>=3,RC[-3]<4),90,IF(AND(RC[-3]>RC[-1],RC[-3]>=4,RC[-3]<5),80,IF(AND(RC[-3]>RC[-1],RC[-3]>=5,RC[-3]<6),70,IF(AND(RC[-3]>RC[-1],RC[-3]>=6,RC[-3]<7),60,IF(AND(RC[-3]>RC[-1],RC[-3]>=7,RC[-3]<8),50,IF(AND(RC[-3]>RC[-1],RC[-3]>=8,RC[-3]<9),40,IF(AND(RC[-3]>RC[-1],RC[-3]>=9,RC[-3]<10),30,IF(AND(RC[-3]>RC[-1],RC[-3]>=10,RC[-3]<11),20,IF(AND(RC[-3]>RC[-1],RC[-3]>=11,RC[-3]<12),10,IF(AND(RC[-3]>RC[-1],RC[-3]>=12),0))))))))))))))))))))))))))))))))) -> 0 | H120: =IF(RC[-3]="","",IF(RC[-3]<0.3,100,IF(AND(RC[-3]>=0.3,RC[-3]>0.4),95,IF(AND(RC[-3]>=0.4,RC[-3]<0.5),90,IF(AND(RC[-3]>=0.5,RC[-3]<0.6),85,IF(AND(RC[-3]>=0.6,RC[-3]<0.7),80,IF(AND(RC[-3]>=0.6,RC[-3]<1),80,IF(AND(RC[-3]>1,RC[-3]<2),50,IF(RC[-3]>2,0))))))))) ->  | I120: =IF(RC[-1]="",RC[-2],0.7*RC[-1]+0.3*RC[-2]) -> 0
A121: تاید واتر خاورمیانه | B121: حتاید | C121: =VLOOKUP(RC[-1],Sheet1!R3C2:R802C3,2,FALSE) -> حمل و نقل انبارداری و ارتباطات | D121: =VLOOKUP(RC[-2],Sheet1!R3C2:R802C9,8,FALSE) -> 3.1648566913310292 | E121: =IF(VLOOKUP(RC[-3],Sheet1!R3C2:R803C11,10,FALSE)=0,"",VLOOKUP(Sheet2!RC[-3],Sheet1!R[1]C[-3]:R[801]C[6],10,FALSE)) ->  | F121: =Sheet1!R156C10 -> 7.6389998027803898 | G121: =IF(RC[-3]<0,0,IF(AND(RC[-3]<RC[-1],RC[-3]<2),100,IF(AND(RC[-3]<RC[-1],RC[-3]>=2,RC[-3]<3),95,IF(AND(RC[-3]<RC[-1],RC[-3]>=3,RC[-3]<4),90,IF(AND(RC[-3]<RC[-1],RC[-3]>=4,RC[-3]<5),85,IF(AND(RC[-3]<RC[-1],RC[-3]>=5,RC[-3]<6),80,IF(AND(RC[-3]<RC[-1],RC[-3]>=6,RC[-3]<7),75,IF(AND(RC[-3]<RC[-1],RC[-3]>=7,RC[-3]<8),70,IF(AND(RC[-3]<RC[-1],RC[-3]>=8,RC[-3]<9),65,IF(AND(RC[-3]<RC[-1],RC[-3]>=9,RC[-3]<10),60,IF(AND(RC[-3]<RC[-1],RC[-3]>=10,RC[-3]<11),55,IF(AND(RC[-3]<RC[-1],RC[-3]>=11,RC[-3]<12),50,IF(AND(RC[-3]<RC[-1],RC[-3]>=12,RC[-3]<13),45,IF(AND(RC[-3]<RC[-1],RC[-3]>=13,RC[-3]<14),40,IF(AND(RC[-3]<RC[-1],RC[-3]>=14,RC[-3]<15),35,IF(AND(RC[-3]<RC[-1],RC[-3]>=15,RC[-3]<16),30,IF(AND(RC[-3]<RC[-1],RC[-3]>=16,RC[-3]<17),25,IF(AND(RC[-3]<RC[-1],RC[-3]>=17,RC[-3]<18),20,IF(AND(RC[-3]<RC[-1],RC[-3]>=18,RC[-3]<19),15,IF(AND(RC[-3]<RC[-1],RC[-3]>=19,RC[-3]<20),10,IF(AND(RC[-3]<RC[-1],RC[-3]>=20,RC[-3]<21),5,IF(AND(RC[-3]<RC[-1],RC[-3]>=21),0,IF(AND(RC[-3]>RC[-1],RC[-3]>=2,RC[-3]<3),90,IF(AND(RC[-3]>RC[-1],RC[-3]>=3,RC[-3]<4),90,IF(AND(RC[-3]>RC[-1],RC[-3]>=4,RC[-3]<5),80,IF(AND(RC[-3]>RC[-1],RC[-3]>=5,RC[-3]<6),70,IF(AND(RC[-3]>RC[-1],RC[-3]>=6,RC[-3]<7),60,IF(AND(RC[-3]>RC[-1],RC[-3]>=7,RC[-3]<8),50,IF(AND(RC[-3]>RC[-1],RC[-3]>=8,RC[-3]<9),40,IF(AND(RC[-3]>RC[-1],RC[-3]>=9,RC[-3]<10),30,IF(AND(RC[-3]>RC[-1],RC[-3]>=10,RC[-3]<11),20,IF(AND(RC[-3]>RC[-1],RC[-3]>=11,RC[-3]<12),10,IF(AND(RC[-3]>RC[-1],RC[-3]>=12),0))))))))))))))))))))))))))))))))) -> 90 | H121: =IF(RC[-3]="","",IF(RC[-3]<0.3,100,IF(AND(RC[-3]>=0.3,RC[-3]>0.4),95,IF(AND(RC[-3]>=0.4,RC[-3]<0.5),90,IF(AND(RC[-3]>=0.5,RC[-3]<0.6),85,IF(AND(RC[-3]>=0.6,RC[-3]<0.7),80,IF(AND(RC[-3]>=0.6,RC[-3]<1),80,IF(AND(RC[-3]>1,RC[-3]<2),50,IF(RC[-3]>2,0))))))))) ->  | I121: =IF(RC[-1]="",RC[-2],0.7*RC[-1]+0.3*RC[-2]) -> 90
A122: توسعه حمل و نقل ریلی پارسیان | B122: حپارسا | C122: =VLOOKUP(RC[-1],Sheet1!R3C2:R802C3,2,FALSE) -> حمل و نقل انبارداری و ارتباطات | D122: =VLOOKUP(RC[-2],Sheet1!R3C2:R802C9,8,FALSE) -> 4.3558336644395128 | E122: =IF(VLOOKUP(RC[-3],Sheet1!R3C2:R803C11,10,FALSE)=0,"",VLOOKUP(Sheet2!RC[-3],Sheet1!R[1]C[-3]:R[801]C[6],10,FALSE)) ->  | F122: =Sheet1!R156C10 -> 7.6389998027803898 | G122: =IF(RC[-3]<0,0,IF(AND(RC[-3]<RC[-1],RC[-3]<2),100,IF(AND(RC[-3]<RC[-1],RC[-3]>=2,RC[-3]<3),95,IF(AND(RC[-3]<RC[-1],RC[-3]>=3,RC[-3]<4),90,IF(AND(RC[-3]<RC[-1],RC[-3]>=4,RC[-3]<5),85,IF(AND(RC[-3]<RC[-1],RC[-3]>=5,RC[-3]<6),80,IF(AND(RC[-3]<RC[-1],RC[-3]>=6,RC[-3]<7),75,IF(AND(RC[-3]<RC[-1],RC[-3]>=7,RC[-3]<8),70,IF(AND(RC[-3]<RC[-1],RC[-3]>=8,RC[-3]<9),65,IF(AND(RC[-3]<RC[-1],RC[-3]>=9,RC[-3]<10),60,IF(AND(RC[-3]<RC[-1],RC[-3]>=10,RC[-3]<11),55,IF(AND(RC[-3]<RC[-1],RC[-3]>=11,RC[-3]<12),50,IF(AND(RC[-3]<RC[-1],RC[-3]>=12,RC[-3]<13),45,IF(AND(RC[-3]<RC[-1],RC[-3]>=13,RC[-3]<14),40,IF(AND(RC[-3]<RC[-1],RC[-3]>=14,RC[-3]<15),35,IF(AND(RC[-3]<RC[-1],RC[-3]>=15,RC[-3]<16),30,IF(AND(RC[-3]<RC[-1],RC[-3]>=16,RC[-3]<17),25,IF(AND(RC[-3]<RC[-1],RC[-3]>=17,RC[-3]<18),20,IF(AND(RC[-3]<RC[-1],RC[-3]>=18,RC[-3]<19),15,IF(AND(RC[-3]<RC[-1],RC[-3]>=19,RC[-3]<20),10,IF(AND(RC[-3]<RC[-1],RC[-3]>=20,RC[-3]<21),5,IF(AND(RC[-3]<RC[-1],RC[-3]>=21),0,IF(AND(RC[-3]>RC[-1],RC[-3]>=2,RC[-3]<3),90,IF(AND(RC[-3]>RC[-1],RC[-3]>=3,RC[-3]<4),90,IF(AND(RC[-3]>RC[-1],RC[-3]>=4,RC[-3]<5),80,IF(AND(RC[-3]>RC[-1],RC[-3]>=5,RC[-3]<6),70,IF(AND(RC[-3]>RC[-1],RC[-3]>=6,RC[-3]<7),60,IF(AND(RC[-3]>RC[-1],RC[-3]>=7,RC[-3]<8),50,IF(AND(RC[-3]>RC[-1],RC[-3]>=8,RC[-3]<9),40,IF(AND(RC[-3]>RC[-1],RC[-3]>=9,RC[-3]<10),30,IF(AND(RC[-3]>RC[-1],RC[-3]>=10,RC[-3]<11),20,IF(AND(RC[-3]>RC[-1],RC[-3]>=11,RC[-3]<12),10,IF(AND(RC[-3]>RC[-1],RC[-3]>=12),0))))))))))))))))))))))))))))))))) -> 85 | H122: =IF(RC[-3]="","",IF(RC[-3]<0.3,100,IF(AND(RC[-3]>=0.3,RC[-3]>0.4),95,IF(AND(RC[-3]>=0.4,RC[-3]<0.5),90,IF(AND(RC[-3]>=0.5,RC[-3]<0.6),85,IF(AND(RC[-3]>=0.6,RC[-3]<0.7),80,IF(AND(RC[-3]>=0.6,RC[-3]<1),80,IF(AND(RC[-3]>1,RC[-3]<2),50,IF(RC[-3]>2,0))))))))) ->  | I122: =IF(RC[-1]="",RC[-2],0.7*RC[-1]+0.3*RC[-2]) -> 85
A123: توسعه خدمات دریایی و بندری سینا | B123: حسینا | C123: =VLOOKUP(RC[-1],Sheet1!R3C2:R802C3,2,FALSE) -> حمل و نقل انبارداری و ارتباطات | D123: =VLOOKUP(RC[-2],Sheet1!R3C2:R802C9,8,FALSE) -> 2.9929353681205466 | E123: =IF(VLOOKUP(RC[-3],Sheet1!R3C2:R803C11,10,FALSE)=0,"",VLOOKUP(Sheet2!RC[-3],Sheet1!R[1]C[-3]:R[801]C[6],10,FALSE)) ->  | F123: =Sheet1!R156C10 -> 7.6389998027803898 | G123: =IF(RC[-3]<0,0,IF(AND(RC[-3]<RC[-1],RC[-3]<2),100,IF(AND(RC[-3]<RC[-1],RC[-3]>=2,RC[-3]<3),95,IF(AND(RC[-3]<RC[-1],RC[-3]>=3,RC[-3]<4),90,IF(AND(RC[-3]<RC[-1],RC[-3]>=4,RC[-3]<5),85,IF(AND(RC[-3]<RC[-1],RC[-3]>=5,RC[-3]<6),80,IF(AND(RC[-3]<RC[-1],RC[-3]>=6,RC[-3]<7),75,IF(AND(RC[-3]<RC[-1],RC[-3]>=7,RC[-3]<8),70,IF(AND(RC[-3]<RC[-1],RC[-3]>=8,RC[-3]<9),65,IF(AND(RC[-3]<RC[-1],RC[-3]>=9,RC[-3]<10),60,IF(AND(RC[-3]<RC[-1],RC[-3]>=10,RC[-3]<11),55,IF(AND(RC[-3]<RC[-1],RC[-3]>=11,RC[-3]<12),50,IF(AND(RC[-3]<RC[-1],RC[-3]>=12,RC[-3]<13),45,IF(AND(RC[-3]<RC[-1],RC[-3]>=13,RC[-3]<14),40,IF(AND(RC[-3]<RC[-1],RC[-3]>=14,RC[-3]<15),35,IF(AND(RC[-3]<RC[-1],RC[-3]>=15,RC[-3]<16),30,IF(AND(RC[-3]<RC[-1],RC[-3]>=16,RC[-3]<17),25,IF(AND(RC[-3]<RC[-1],RC[-3]>=17,RC[-3]<18),20,IF(AND(RC[-3]<RC[-1],RC[-3]>=18,RC[-3]<19),15,IF(AND(RC[-3]<RC[-1],RC[-3]>=19,RC[-3]<20),10,IF(AND(RC[-3]<RC[-1],RC[-3]>=20,RC[-3]<21),5,IF(AND(RC[-3]<RC[-1],RC[-3]>=21),0,IF(AND(RC[-3]>RC[-1],RC[-3]>=2,RC[-3]<3),90,IF(AND(RC[-3]>RC[-1],RC[-3]>=3,RC[-3]<4),90,IF(AND(RC[-3]>RC[-1],RC[-3]>=4,RC[-3]<5),80,IF(AND(RC[-3]>RC[-1],RC[-3]>=5,RC[-3]<6),70,IF(AND(RC[-3]>RC[-1],RC[-3]>=6,RC[-3]<7),60,IF(AND(RC[-3]>RC[-1],RC[-3]>=7,RC[-3]<8),50,IF(AND(RC[-3]>RC[-1],RC[-3]>=8,RC[-3]<9),40,IF(AND(RC[-3]>RC[-1],RC[-3]>=9,RC[-3]<10),30,IF(AND(RC[-3]>RC[-1],RC[-3]>=10,RC[-3]<11),20,IF(AND(RC[-3]>RC[-1],RC[-3]>=11,RC[-3]<12),10,IF(AND(RC[-3]>RC[-1],RC[-3]>=12),0))))))))))))))))))))))))))))))))) -> 95 | H123: =IF(RC[-3]="","",IF(RC[-3]<0.3,100,IF(AND(RC[-3]>=0.3,RC[-3]>0.4),95,IF(AND(RC[-3]>=0.4,RC[-3]<0.5),90,IF(AND(RC[-3]>=0.5,RC[-3]<0.6),85,IF(AND(RC[-3]>=0.6,RC[-3]<0.7),80,IF(AND(RC[-3]>=0.6,RC[-3]<1),80,IF(AND(RC[-3]>1,RC[-3]<2),50,IF(RC[-3]>2,0))))))))) ->  | I123: =IF(RC[-1]="",RC[-2],0.7*RC[-1]+0.3*RC[-2]) -> 95
A124: توکا ریل | B124: توریل | C124: =VLOOKUP(RC[-1],Sheet1!R3C2:R802C3,2,FALSE) -> حمل و نقل انبارداری و ارتباطات | D124: =VLOOKUP(RC[-2],Sheet1!R3C2:R802C9,8,FALSE) -> 9.8707366053952832 | E124: =IF(VLOOKUP(RC[-3],Sheet1!R3C2:R803C11,10,FALSE)=0,"",VLOOKUP(Sheet2!RC[-3],Sheet1!R[1]C[-3]:R[801]C[6],10,FALSE)) ->  | F124: =Sheet1!R156C10 -> 7.6389998027803898 | G124: =IF(RC[-3]<0,0,IF(AND(RC[-3]<RC[-1],RC[-3]<2),100,IF(AND(RC[-3]<RC[-1],RC[-3]>=2,RC[-3]<3),95,IF(AND(RC[-3]<RC[-1],RC[-3]>=3,RC[-3]<4),90,IF(AND(RC[-3]<RC[-1],RC[-3]>=4,RC[-3]<5),85,IF(AND(RC[-3]<RC[-1],RC[-3]>=5,RC[-3]<6),80,IF(AND(RC[-3]<RC[-1],RC[-3]>=6,RC[-3]<7),75,IF(AND(RC[-3]<RC[-1],RC[-3]>=7,RC[-3]<8),70,IF(AND(RC[-3]<RC[-1],RC[-3]>=8,RC[-3]<9),65,IF(AND(RC[-3]<RC[-1],RC[-3]>=9,RC[-3]<10),60,IF(AND(RC[-3]<RC[-1],RC[-3]>=10,RC[-3]<11),55,IF(AND(RC[-3]<RC[-1],RC[-3]>=11,RC[-3]<12),50,IF(AND(RC[-3]<RC[-1],RC[-3]>=12,RC[-3]<13),45,IF(AND(RC[-3]<RC[-1],RC[-3]>=13,RC[-3]<14),40,IF(AND(RC[-3]<RC[-1],RC[-3]>=14,RC[-3]<15),35,IF(AND(RC[-3]<RC[-1],RC[-3]>=15,RC[-3]<16),30,IF(AND(RC[-3]<RC[-1],RC[-3]>=16,RC[-3]<17),25,IF(AND(RC[-3]<RC[-1],RC[-3]>=17,RC[-3]<18),20,IF(AND(RC[-3]<RC[-1],RC[-3]>=18,RC[-3]<19),15,IF(AND(RC[-3]<RC[-1],RC[-3]>=19,RC[-3]<20),10,IF(AND(RC[-3]<RC[-1],RC[-3]>=20,RC[-3]<21),5,IF(AND(RC[-3]<RC[-1],RC[-3]>=21),0,IF(AND(RC[-3]>RC[-1],RC[-3]>=2,RC[-3]<3),90,IF(AND(RC[-3]>RC[-1],RC[-3]>=3,RC[-3]<4),90,IF(AND(RC[-3]>RC[-1],RC[-3]>=4,RC[-3]<5),80,IF(AND(RC[-3]>RC[-1],RC[-3]>=5,RC[-3]<6),70,IF(AND(RC[-3]>RC[-1],RC[-3]>=6,RC[-3]<7),60,IF(AND(RC[-3]>RC[-1],RC[-3]>=7,RC[-3]<8),50,IF(AND(RC[-3]>RC[-1],RC[-3]>=8,RC[-3]<9),40,IF(AND(RC[-3]>RC[-1],RC[-3]>=9,RC[-3]<10),30,IF(AND(RC[-3]>RC[-1],RC[-3]>=10,RC[-3]<11),20,IF(AND(RC[-3]>RC[-1],RC[-3]>=11,RC[-3]<12),10,IF(AND(RC[-3]>RC[-1],RC[-3]>=12),0))))))))))))))))))))))))))))))))) -> 30 | H124: =IF(RC[-3]="","",IF(RC[-3]<0.3,100,IF(AND(RC[-3]>=0.3,RC[-3]>0.4),95,IF(AND(RC[-3]>=0.4,RC[-3]<0.5),90,IF(AND(RC[-3]>=0.5,RC[-3]<0.6),85,IF(AND(RC[-3]>=0.6,RC[-3]<0.7),80,IF(AND(RC[-3]>=0.6,RC[-3]<1),80,IF(AND(RC[-3]>1,RC[-3]<2),50,IF(RC[-3]>2,0))))))))) ->  | I124: =IF(RC[-1]="",RC[-2],0.7*RC[-1]+0.3*RC[-2]) -> 30
A125: حمل و نقل بین المللی خلیج فارس | B125: حفارس | C125: =VLOOKUP(RC[-1],Sheet1!R3C2:R802C3,2,FALSE) -> حمل و نقل انبارداری و ارتباطات | D125: =VLOOKUP(RC[-2],Sheet1!R3C2:R802C9,8,FALSE) -> 14.405191286154791 | E125: =IF(VLOOKUP(RC[-3],Sheet1!R3C2:R803C11,10,FALSE)=0,"",VLOOKUP(Sheet2!RC[-3],Sheet1!R[1]C[-3]:R[801]C[6],10,FALSE)) ->  | F125: =Sheet1!R156C10 -> 7.6389998027803898 | G125: =IF(RC[-3]<0,0,IF(AND(RC[-3]<RC[-1],RC[-3]<2),100,IF(AND(RC[-3]<RC[-1],RC[-3]>=2,RC[-3]<3),95,IF(AND(RC[-3]<RC[-1],RC[-3]>=3,RC[-3]<4),90,IF(AND(RC[-3]<RC[-1],RC[-3]>=4,RC[-3]<5),85,IF(AND(RC[-3]<RC[-1],RC[-3]>=5,RC[-3]<6),80,IF(AND(RC[-3]<RC[-1],RC[-3]>=6,RC[-3]<7),75,IF(AND(RC[-3]<RC[-1],RC[-3]>=7,RC[-3]<8),70,IF(AND(RC[-3]<RC[-1],RC[-3]>=8,RC[-3]<9),65,IF(AND(RC[-3]<RC[-1],RC[-3]>=9,RC[-3]<10),60,IF(AND(RC[-3]<RC[-1],RC[-3]>=10,RC[-3]<11),55,IF(AND(RC[-3]<RC[-1],RC[-3]>=11,RC[-3]<12),50,IF(AND(RC[-3]<RC[-1],RC[-3]>=12,RC[-3]<13),45,IF(AND(RC[-3]<RC[-1],RC[-3]>=13,RC[-3]<14),40,IF(AND(RC[-3]<RC[-1],RC[-3]>=14,RC[-3]<15),35,IF(AND(RC[-3]<RC[-1],RC[-3]>=15,RC[-3]<16),30,IF(AND(RC[-3]<RC[-1],RC[-3]>=16,RC[-3]<17),25,IF(AND(RC[-3]<RC[-1],RC[-3]>=17,RC[-3]<18),20,IF(AND(RC[-3]<RC[-1],RC[-3]>=18,RC[-3]<19),15,IF(AND(RC[-3]<RC[-1],RC[-3]>=19,RC[-3]<20),10,IF(AND(RC[-3]<RC[-1],RC[-3]>=20,RC[-3]<21),5,IF(AND(RC[-3]<RC[-1],RC[-3]>=21),0,IF(AND(RC[-3]>RC[-1],RC[-3]>=2,RC[-3]<3),90,IF(AND(RC[-3]>RC[-1],RC[-3]>=3,RC[-3]<4),90,IF(AND(RC[-3]>RC[-1],RC[-3]>=4,RC[-3]<5),80,IF(AND(RC[-3]>RC[-1],RC[-3]>=5,RC[-3]<6),70,IF(AND(RC[-3]>RC[-1],RC[-3]>=6,RC[-3]<7),60,IF(AND(RC[-3]>RC[-1],RC[-3]>=7,RC[-3]<8),50,IF(AND(RC[-3]>RC[-1],RC[-3]>=8,RC[-3]<9),40,IF(AND(RC[-3]>RC[-1],RC[-3]>=9,RC[-3]<10),30,IF(AND(RC[-3]>RC[-1],RC[-3]>=10,RC[-3]<11),20,IF(AND(RC[-3]>RC[-1],RC[-3]>=11,RC[-3]<12),10,IF(AND(RC[-3]>RC[-1],RC[-3]>=12),0))))))))))))))))))))))))))))))))) -> 0 | H125: =IF(RC[-3]="","",IF(RC[-3]<0.3,100,IF(AND(RC[-3]>=0.3,RC[-3]>0.4),95,IF(AND(RC[-3]>=0.4,RC[-3]<0.5),90,IF(AND(RC[-3]>=0.5,RC[-3]<0.6),85,IF(AND(RC[-3]>=0.6,RC[-3]<0.7),80,IF(AND(RC[-3]>=0.6,RC[-3]<1),80,IF(AND(RC[-3]>1,RC[-3]<2),50,IF(RC[-3]>2,0))))))))) ->  | I125: =IF(RC[-1]="",RC[-2],0.7*RC[-1]+0.3*RC[-2]) -> 0
A126: حمل و نقل توکا | B126: حتوکا | C126: =VLOOKUP(RC[-1],Sheet1!R3C2:R802C3,2,FALSE) -> حمل و نقل انبارداری و ارتباطات | D126: =VLOOKUP(RC[-2],Sheet1!R3C2:R802C9,8,FALSE) -> 4.7380980251960496 | E126: =IF(VLOOKUP(RC[-3],Sheet1!R3C2:R803C11,10,FALSE)=0,"",VLOOKUP(Sheet2!RC[-3],Sheet1!R[1]C[-3]:R[801]C[6],10,FALSE)) ->  | F126: =Sheet1!R156C10 -> 7.6389998027803898 | G126: =IF(RC[-3]<0,0,IF(AND(RC[-3]<RC[-1],RC[-3]<2),100,IF(AND(RC[-3]<RC[-1],RC[-3]>=2,RC[-3]<3),95,IF(AND(RC[-3]<RC[-1],RC[-3]>=3,RC[-3]<4),90,IF(AND(RC[-3]<RC[-1],RC[-3]>=4,RC[-3]<5),85,IF(AND(RC[-3]<RC[-1],RC[-3]>=5,RC[-3]<6),80,IF(AND(RC[-3]<RC[-1],RC[-3]>=6,RC[-3]<7),75,IF(AND(RC[-3]<RC[-1],RC[-3]>=7,RC[-3]<8),70,IF(AND(RC[-3]<RC[-1],RC[-3]>=8,RC[-3]<9),65,IF(AND(RC[-3]<RC[-1],RC[-3]>=9,RC[-3]<10),60,IF(AND(RC[-3]<RC[-1],RC[-3]>=10,RC[-3]<11),55,IF(AND(RC[-3]<RC[-1],RC[-3]>=11,RC[-3]<12),50,IF(AND(RC[-3]<RC[-1],RC[-3]>=12,RC[-3]<13),45,IF(AND(RC[-3]<RC[-1],RC[-3]>=13,RC[-3]<14),40,IF(AND(RC[-3]<RC[-1],RC[-3]>=14,RC[-3]<15),35,IF(AND(RC[-3]<RC[-1],RC[-3]>=15,RC[-3]<16),30,IF(AND(RC[-3]<RC[-1],RC[-3]>=16,RC[-3]<17),25,IF(AND(RC[-3]<RC[-1],RC[-3]>=17,RC[-3]<18),20,IF(AND(RC[-3]<RC[-1],RC[-3]>=18,RC[-3]<19),15,IF(AND(RC[-3]<RC[-1],RC[-3]>=19,RC[-3]<20),10,IF(AND(RC[-3]<RC[-1],RC[-3]>=20,RC[-3]<21),5,IF(AND(RC[-3]<RC[-1],RC[-3]>=21),0,IF(AND(RC[-3]>RC[-1],RC[-3]>=2,RC[-3]<3),90,IF(AND(RC[-3]>RC[-1],RC[-3]>=3,RC[-3]<4),90,IF(AND(RC[-3]>RC[-1],RC[-3]>=4,RC[-3]<5),80,IF(AND(RC[-3]>RC[-1],RC[-3]>=5,RC[-3]<6),70,IF(AND(RC[-3]>RC[-1],RC[-3]>=6,RC[-3]<7),60,IF(AND(RC[-3]>RC[-1],RC[-3]>=7,RC[-3]<8),50,IF(AND(RC[-3]>RC[-1],RC[-3]>=8,RC[-3]<9),40,IF(AND(RC[-3]>RC[-1],RC[-3]>=9,RC[-3]<10),30,IF(AND(RC[-3]>RC[-1],RC[-3]>=10,RC[-3]<11),20,IF(AND(RC[-3]>RC[-1],RC[-3]>=11,RC[-3]<12),10,IF(AND(RC[-3]>RC[-1],RC[-3]>=12),0))))))))))))))))))))))))))))))))) -> 85 | H126: =IF(RC[-3]="","",IF(RC[-3]<0.3,100,IF(AND(RC[-3]>=0.3,RC[-3]>0.4),95,IF(AND(RC[-3]>=0.4,RC[-3]<0.5),90,IF(AND(RC[-3]>=0.5,RC[-3]<0.6),85,IF(AND(RC[-3]>=0.6,RC[-3]<0.7),80,IF(AND(RC[-3]>=0.6,RC[-3]<1),80,IF(AND(RC[-3]>1,RC[-3]<2),50,IF(RC[-3]>2,0))))))))) ->  | I126: =IF(RC[-1]="",RC[-2],0.7*RC[-1]+0.3*RC[-2]) -> 85
A127: حمل و نقل گهر ترابر سیرجان | B127: حگهر | C127: =VLOOKUP(RC[-1],Sheet1!R3C2:R802C3,2,FALSE) -> حمل و نقل انبارداری و ارتباطات | D127: =VLOOKUP(RC[-2],Sheet1!R3C2:R802C9,8,FALSE) -> 7.8480492400751247 | E127: =IF(VLOOKUP(RC[-3],Sheet1!R3C2:R803C11,10,FALSE)=0,"",VLOOKUP(Sheet2!RC[-3],Sheet1!R[1]C[-3]:R[801]C[6],10,FALSE)) ->  | F127: =Sheet1!R156C10 -> 7.6389998027803898 | G127: =IF(RC[-3]<0,0,IF(AND(RC[-3]<RC[-1],RC[-3]<2),100,IF(AND(RC[-3]<RC[-1],RC[-3]>=2,RC[-3]<3),95,IF(AND(RC[-3]<RC[-1],RC[-3]>=3,RC[-3]<4),90,IF(AND(RC[-3]<RC[-1],RC[-3]>=4,RC[-3]<5),85,IF(AND(RC[-3]<RC[-1],RC[-3]>=5,RC[-3]<6),80,IF(AND(RC[-3]<RC[-1],RC[-3]>=6,RC[-3]<7),75,IF(AND(RC[-3]<RC[-1],RC[-3]>=7,RC[-3]<8),70,IF(AND(RC[-3]<RC[-1],RC[-3]>=8,RC[-3]<9),65,IF(AND(RC[-3]<RC[-1],RC[-3]>=9,RC[-3]<10),60,IF(AND(RC[-3]<RC[-1],RC[-3]>=10,RC[-3]<11),55,IF(AND(RC[-3]<RC[-1],RC[-3]>=11,RC[-3]<12),50,IF(AND(RC[-3]<RC[-1],RC[-3]>=12,RC[-3]<13),45,IF(AND(RC[-3]<RC[-1],RC[-3]>=13,RC[-3]<14),40,IF(AND(RC[-3]<RC[-1],RC[-3]>=14,RC[-3]<15),35,IF(AND(RC[-3]<RC[-1],RC[-3]>=15,RC[-3]<16),30,IF(AND(RC[-3]<RC[-1],RC[-3]>=16,RC[-3]<17),25,IF(AND(RC[-3]<RC[-1],RC[-3]>=17,RC[-3]<18),20,IF(AND(RC[-3]<RC[-1],RC[-3]>=18,RC[-3]<19),15,IF(AND(RC[-3]<RC[-1],RC[-3]>=19,RC[-3]<20),10,IF(AND(RC[-3]<RC[-1],RC[-3]>=20,RC[-3]<21),5,IF(AND(RC[-3]<RC[-1],RC[-3]>=21),0,IF(AND(RC[-3]>RC[-1],RC[-3]>=2,RC[-3]<3),90,IF(AND(RC[-3]>RC[-1],RC[-3]>=3,RC[-3]<4),90,IF(AND(RC[-3]>RC[-1],RC[-3]>=4,RC[-3]<5),80,IF(AND(RC[-3]>RC[-1],RC[-3]>=5,RC[-3]<6),70,IF(AND(RC[-3]>RC[-1],RC[-3]>=6,RC[-3]<7),60,IF(AND(RC[-3]>RC[-1],RC[-3]>=7,RC[-3]<8),50,IF(AND(RC[-3]>RC[-1],RC[-3]>=8,RC[-3]<9),40,IF(AND(RC[-3]>RC[-1],RC[-3]>=9,RC[-3]<10),30,IF(AND(RC[-3]>RC[-1],RC[-3]>=10,RC[-3]<11),20,IF(AND(RC[-3]>RC[-1],RC[-3]>=11,RC[-3]<12),10,IF(AND(RC[-3]>RC[-1],RC[-3]>=12),0))))))))))))))))))))))))))))))))) -> 50 | H127: =IF(RC[-3]="","",IF(RC[-3]<0.3,100,IF(AND(RC[-3]>=0.3,RC[-3]>0.4),95,IF(AND(RC[-3]>=0.4,RC[-3]<0.5),90,IF(AND(RC[-3]>=0.5,RC[-3]<0.6),85,IF(AND(RC[-3]>=0.6,RC[-3]<0.7),80,IF(AND(RC[-3]>=0.6,RC[-3]<1),80,IF(AND(RC[-3]>1,RC[-3]<2),50,IF(RC[-3]>2,0))))))))) ->  | I127: =IF(RC[-1]="",RC[-2],0.7*RC[-1]+0.3*RC[-2]) -> 50
A128: خط دریا بندر | B128: حبندر | C128: =VLOOKUP(RC[-1],Sheet1!R3C2:R802C3,2,FALSE) -> حمل و نقل انبارداری و ارتباطات | D128: =VLOOKUP(RC[-2],Sheet1!R3C2:R802C9,8,FALSE) -> 26.668333970780711 | E128: =IF(VLOOKUP(RC[-3],Sheet1!R3C2:R803C11,10,FALSE)=0,"",VLOOKUP(Sheet2!RC[-3],Sheet1!R[1]C[-3]:R[801]C[6],10,FALSE)) ->  | F128: =Sheet1!R156C10 -> 7.6389998027803898 | G128: =IF(RC[-3]<0,0,IF(AND(RC[-3]<RC[-1],RC[-3]<2),100,IF(AND(RC[-3]<RC[-1],RC[-3]>=2,RC[-3]<3),95,IF(AND(RC[-3]<RC[-1],RC[-3]>=3,RC[-3]<4),90,IF(AND(RC[-3]<RC[-1],RC[-3]>=4,RC[-3]<5),85,IF(AND(RC[-3]<RC[-1],RC[-3]>=5,RC[-3]<6),80,IF(AND(RC[-3]<RC[-1],RC[-3]>=6,RC[-3]<7),75,IF(AND(RC[-3]<RC[-1],RC[-3]>=7,RC[-3]<8),70,IF(AND(RC[-3]<RC[-1],RC[-3]>=8,RC[-3]<9),65,IF(AND(RC[-3]<RC[-1],RC[-3]>=9,RC[-3]<10),60,IF(AND(RC[-3]<RC[-1],RC[-3]>=10,RC[-3]<11),55,IF(AND(RC[-3]<RC[-1],RC[-3]>=11,RC[-3]<12),50,IF(AND(RC[-3]<RC[-1],RC[-3]>=12,RC[-3]<13),45,IF(AND(RC[-3]<RC[-1],RC[-3]>=13,RC[-3]<14),40,IF(AND(RC[-3]<RC[-1],RC[-3]>=14,RC[-3]<15),35,IF(AND(RC[-3]<RC[-1],RC[-3]>=15,RC[-3]<16),30,IF(AND(RC[-3]<RC[-1],RC[-3]>=16,RC[-3]<17),25,IF(AND(RC[-3]<RC[-1],RC[-3]>=17,RC[-3]<18),20,IF(AND(RC[-3]<RC[-1],RC[-3]>=18,RC[-3]<19),15,IF(AND(RC[-3]<RC[-1],RC[-3]>=19,RC[-3]<20),10,IF(AND(RC[-3]<RC[-1],RC[-3]>=20,RC[-3]<21),5,IF(AND(RC[-3]<RC[-1],RC[-3]>=21),0,IF(AND(RC[-3]>RC[-1],RC[-3]>=2,RC[-3]<3),90,IF(AND(RC[-3]>RC[-1],RC[-3]>=3,RC[-3]<4),90,IF(AND(RC[-3]>RC[-1],RC[-3]>=4,RC[-3]<5),80,IF(AND(RC[-3]>RC[-1],RC[-3]>=5,RC[-3]<6),70,IF(AND(RC[-3]>RC[-1],RC[-3]>=6,RC[-3]<7),60,IF(AND(RC[-3]>RC[-1],RC[-3]>=7,RC[-3]<8),50,IF(AND(RC[-3]>RC[-1],RC[-3]>=8,RC[-3]<9),40,IF(AND(RC[-3]>RC[-1],RC[-3]>=9,RC[-3]<10),30,IF(AND(RC[-3]>RC[-1],RC[-3]>=10,RC[-3]<11),20,IF(AND(RC[-3]>RC[-1],RC[-3]>=11,RC[-3]<12),10,IF(AND(RC[-3]>RC[-1],RC[-3]>=12),0))))))))))))))))))))))))))))))))) -> 0 | H128: =IF(RC[-3]="","",IF(RC[-3]<0.3,100,IF(AND(RC[-3]>=0.3,RC[-3]>0.4),95,IF(AND(RC[-3]>=0.4,RC[-3]<0.5),90,IF(AND(RC[-3]>=0.5,RC[-3]<0.6),85,IF(AND(RC[-3]>=0.6,RC[-3]<0.7),80,IF(AND(RC[-3]>=0.6,RC[-3]<1),80,IF(AND(RC[-3]>1,RC[-3]<2),50,IF(RC[-3]>2,0))))))))) ->  | I128: =IF(RC[-1]="",RC[-2],0.7*RC[-1]+0.3*RC[-2]) -> 0
A129: دلیجان شکوه پارس | B129: حشکوه | C129: =VLOOKUP(RC[-1],Sheet1!R3C2:R802C3,2,FALSE) -> حمل و نقل انبارداری و ارتباطات | D129: =VLOOKUP(RC[-2],Sheet1!R3C2:R802C9,8,FALSE) -> 35.102967279195838 | E129: =IF(VLOOKUP(RC[-3],Sheet1!R3C2:R803C11,10,FALSE)=0,"",VLOOKUP(Sheet2!RC[-3],Sheet1!R[1]C[-3]:R[801]C[6],10,FALSE)) ->  | F129: =Sheet1!R156C10 -> 7.6389998027803898 | G129: =IF(RC[-3]<0,0,IF(AND(RC[-3]<RC[-1],RC[-3]<2),100,IF(AND(RC[-3]<RC[-1],RC[-3]>=2,RC[-3]<3),95,IF(AND(RC[-3]<RC[-1],RC[-3]>=3,RC[-3]<4),90,IF(AND(RC[-3]<RC[-1],RC[-3]>=4,RC[-3]<5),85,IF(AND(RC[-3]<RC[-1],RC[-3]>=5,RC[-3]<6),80,IF(AND(RC[-3]<RC[-1],RC[-3]>=6,RC[-3]<7),75,IF(AND(RC[-3]<RC[-1],RC[-3]>=7,RC[-3]<8),70,IF(AND(RC[-3]<RC[-1],RC[-3]>=8,RC[-3]<9),65,IF(AND(RC[-3]<RC[-1],RC[-3]>=9,RC[-3]<10),60,IF(AND(RC[-3]<RC[-1],RC[-3]>=10,RC[-3]<11),55,IF(AND(RC[-3]<RC[-1],RC[-3]>=11,RC[-3]<12),50,IF(AND(RC[-3]<RC[-1],RC[-3]>=12,RC[-3]<13),45,IF(AND(RC[-3]<RC[-1],RC[-3]>=13,RC[-3]<14),40,IF(AND(RC[-3]<RC[-1],RC[-3]>=14,RC[-3]<15),35,IF(AND(RC[-3]<RC[-1],RC[-3]>=15,RC[-3]<16),30,IF(AND(RC[-3]<RC[-1],RC[-3]>=16,RC[-3]<17),25,IF(AND(RC[-3]<RC[-1],RC[-3]>=17,RC[-3]<18),20,IF(AND(RC[-3]<RC[-1],RC[-3]>=18,RC[-3]<19),15,IF(AND(RC[-3]<RC[-1],RC[-3]>=19,RC[-3]<20),10,IF(AND(RC[-3]<RC[-1],RC[-3]>=20,RC[-3]<21),5,IF(AND(RC[-3]<RC[-1],RC[-3]>=21),0,IF(AND(RC[-3]>RC[-1],RC[-3]>=2,RC[-3]<3),90,IF(AND(RC[-3]>RC[-1],RC[-3]>=3,RC[-3]<4),90,IF(AND(RC[-3]>RC[-1],RC[-3]>=4,RC[-3]<5),80,IF(AND(RC[-3]>RC[-1],RC[-3]>=5,RC[-3]<6),70,IF(AND(RC[-3]>RC[-1],RC[-3]>=6,RC[-3]<7),60,IF(AND(RC[-3]>RC[-1],RC[-3]>=7,RC[-3]<8),50,IF(AND(RC[-3]>RC[-1],RC[-3]>=8,RC[-3]<9),40,IF(AND(RC[-3]>RC[-1],RC[-3]>=9,RC[-3]<10),30,IF(AND(RC[-3]>RC[-1],RC[-3]>=10,RC[-3]<11),20,IF(AND(RC[-3]>RC[-1],RC[-3]>=11,RC[-3]<12),10,IF(AND(RC[-3]>RC[-1],RC[-3]>=12),0))))))))))))))))))))))))))))))))) -> 0 | H129: =IF(RC[-3]="","",IF(RC[-3]<0.3,100,IF(AND(RC[-3]>=0.3,RC[-3]>0.4),95,IF(AND(RC[-3]>=0.4,RC[-3]<0.5),90,IF(AND(RC[-3]>=0.5,RC[-3]<0.6),85,IF(AND(RC[-3]>=0.6,RC[-3]<0.7),80,IF(AND(RC[-3]>=0.6,RC[-3]<1),80,IF(AND(RC[-3]>1,RC[-3]<2),50,IF(RC[-3]>2,0))))))))) ->  | I129: =IF(RC[-1]="",RC[-2],0.7*RC[-1]+0.3*RC[-2]) -> 0
A130: رهشاد سپاهان | B130: حرهشا | C130: =VLOOKUP(RC[-1],Sheet1!R3C2:R802C3,2,FALSE) -> حمل و نقل انبارداری و ارتباطات | D130: =VLOOKUP(RC[-2],Sheet1!R3C2:R802C9,8,FALSE) -> 412.97413793103448 | E130: =IF(VLOOKUP(RC[-3],Sheet1!R3C2:R803C11,10,FALSE)=0,"",VLOOKUP(Sheet2!RC[-3],Sheet1!R[1]C[-3]:R[801]C[6],10,FALSE)) ->  | F130: =Sheet1!R156C10 -> 7.6389998027803898 | G130: =IF(RC[-3]<0,0,IF(AND(RC[-3]<RC[-1],RC[-3]<2),100,IF(AND(RC[-3]<RC[-1],RC[-3]>=2,RC[-3]<3),95,IF(AND(RC[-3]<RC[-1],RC[-3]>=3,RC[-3]<4),90,IF(AND(RC[-3]<RC[-1],RC[-3]>=4,RC[-3]<5),85,IF(AND(RC[-3]<RC[-1],RC[-3]>=5,RC[-3]<6),80,IF(AND(RC[-3]<RC[-1],RC[-3]>=6,RC[-3]<7),75,IF(AND(RC[-3]<RC[-1],RC[-3]>=7,RC[-3]<8),70,IF(AND(RC[-3]<RC[-1],RC[-3]>=8,RC[-3]<9),65,IF(AND(RC[-3]<RC[-1],RC[-3]>=9,RC[-3]<10),60,IF(AND(RC[-3]<RC[-1],RC[-3]>=10,RC[-3]<11),55,IF(AND(RC[-3]<RC[-1],RC[-3]>=11,RC[-3]<12),50,IF(AND(RC[-3]<RC[-1],RC[-3]>=12,RC[-3]<13),45,IF(AND(RC[-3]<RC[-1],RC[-3]>=13,RC[-3]<14),40,IF(AND(RC[-3]<RC[-1],RC[-3]>=14,RC[-3]<15),35,IF(AND(RC[-3]<RC[-1],RC[-3]>=15,RC[-3]<16),30,IF(AND(RC[-3]<RC[-1],RC[-3]>=16,RC[-3]<17),25,IF(AND(RC[-3]<RC[-1],RC[-3]>=17,RC[-3]<18),20,IF(AND(RC[-3]<RC[-1],RC[-3]>=18,RC[-3]<19),15,IF(AND(RC[-3]<RC[-1],RC[-3]>=19,RC[-3]<20),10,IF(AND(RC[-3]<RC[-1],RC[-3]>=20,RC[-3]<21),5,IF(AND(RC[-3]<RC[-1],RC[-3]>=21),0,IF(AND(RC[-3]>RC[-1],RC[-3]>=2,RC[-3]<3),90,IF(AND(RC[-3]>RC[-1],RC[-3]>=3,RC[-3]<4),90,IF(AND(RC[-3]>RC[-1],RC[-3]>=4,RC[-3]<5),80,IF(AND(RC[-3]>RC[-1],RC[-3]>=5,RC[-3]<6),70,IF(AND(RC[-3]>RC[-1],RC[-3]>=6,RC[-3]<7),60,IF(AND(RC[-3]>RC[-1],RC[-3]>=7,RC[-3]<8),50,IF(AND(RC[-3]>RC[-1],RC[-3]>=8,RC[-3]<9),40,IF(AND(RC[-3]>RC[-1],RC[-3]>=9,RC[-3]<10),30,IF(AND(RC[-3]>RC[-1],RC[-3]>=10,RC[-3]<11),20,IF(AND(RC[-3]>RC[-1],RC[-3]>=11,RC[-3]<12),10,IF(AND(RC[-3]>RC[-1],RC[-3]>=12),0))))))))))))))))))))))))))))))))) -> 0 | H130: =IF(RC[-3]="","",IF(RC[-3]<0.3,100,IF(AND(RC[-3]>=0.3,RC[-3]>0.4),95,IF(AND(RC[-3]>=0.4,RC[-3]<0.5),90,IF(AND(RC[-3]>=0.5,RC[-3]<0.6),85,IF(AND(RC[-3]>=0.6,RC[-3]<0.7),80,IF(AND(RC[-3]>=0.6,RC[-3]<1),80,IF(AND(RC[-3]>1,RC[-3]<2),50,IF(RC[-3]>2,0))))))))) ->  | I130: =IF(RC[-1]="",RC[-2],0.7*RC[-1]+0.3*RC[-2]) -> 0
A131: ریل پرداز سیر | B131: حریل | C131: =VLOOKUP(RC[-1],Sheet1!R3C2:R802C3,2,FALSE) -> حمل و نقل انبارداری و ارتباطات | D131: =VLOOKUP(RC[-2],Sheet1!R3C2:R802C9,8,FALSE) -> 11.834301931392776 | E131: =IF(VLOOKUP(RC[-3],Sheet1!R3C2:R803C11,10,FALSE)=0,"",VLOOKUP(Sheet2!RC[-3],Sheet1!R[1]C[-3]:R[801]C[6],10,FALSE)) ->  | F131: =Sheet1!R156C10 -> 7.6389998027803898 | G131: =IF(RC[-3]<0,0,IF(AND(RC[-3]<RC[-1],RC[-3]<2),100,IF(AND(RC[-3]<RC[-1],RC[-3]>=2,RC[-3]<3),95,IF(AND(RC[-3]<RC[-1],RC[-3]>=3,RC[-3]<4),90,IF(AND(RC[-3]<RC[-1],RC[-3]>=4,RC[-3]<5),85,IF(AND(RC[-3]<RC[-1],RC[-3]>=5,RC[-3]<6),80,IF(AND(RC[-3]<RC[-1],RC[-3]>=6,RC[-3]<7),75,IF(AND(RC[-3]<RC[-1],RC[-3]>=7,RC[-3]<8),70,IF(AND(RC[-3]<RC[-1],RC[-3]>=8,RC[-3]<9),65,IF(AND(RC[-3]<RC[-1],RC[-3]>=9,RC[-3]<10),60,IF(AND(RC[-3]<RC[-1],RC[-3]>=10,RC[-3]<11),55,IF(AND(RC[-3]<RC[-1],RC[-3]>=11,RC[-3]<12),50,IF(AND(RC[-3]<RC[-1],RC[-3]>=12,RC[-3]<13),45,IF(AND(RC[-3]<RC[-1],RC[-3]>=13,RC[-3]<14),40,IF(AND(RC[-3]<RC[-1],RC[-3]>=14,RC[-3]<15),35,IF(AND(RC[-3]<RC[-1],RC[-3]>=15,RC[-3]<16),30,IF(AND(RC[-3]<RC[-1],RC[-3]>=16,RC[-3]<17),25,IF(AND(RC[-3]<RC[-1],RC[-3]>=17,RC[-3]<18),20,IF(AND(RC[-3]<RC[-1],RC[-3]>=18,RC[-3]<19),15,IF(AND(RC[-3]<RC[-1],RC[-3]>=19,RC[-3]<20),10,IF(AND(RC[-3]<RC[-1],RC[-3]>=20,RC[-3]<21),5,IF(AND(RC[-3]<RC[-1],RC[-3]>=21),0,IF(AND(RC[-3]>RC[-1],RC[-3]>=2,RC[-3]<3),90,IF(AND(RC[-3]>RC[-1],RC[-3]>=3,RC[-3]<4),90,IF(AND(RC[-3]>RC[-1],RC[-3]>=4,RC[-3]<5),80,IF(AND(RC[-3]>RC[-1],RC[-3]>=5,RC[-3]<6),70,IF(AND(RC[-3]>RC[-1],RC[-3]>=6,RC[-3]<7),60,IF(AND(RC[-3]>RC[-1],RC[-3]>=7,RC[-3]<8),50,IF(AND(RC[-3]>RC[-1],RC[-3]>=8,RC[-3]<9),40,IF(AND(RC[-3]>RC[-1],RC[-3]>=9,RC[-3]<10),30,IF(AND(RC[-3]>RC[-1],RC[-3]>=10,RC[-3]<11),20,IF(AND(RC[-3]>RC[-1],RC[-3]>=11,RC[-3]<12),10,IF(AND(RC[-3]>RC[-1],RC[-3]>=12),0))))))))))))))))))))))))))))))))) -> 10 | H131: =IF(RC[-3]="","",IF(RC[-3]<0.3,100,IF(AND(RC[-3]>=0.3,RC[-3]>0.4),95,IF(AND(RC[-3]>=0.4,RC[-3]<0.5),90,IF(AND(RC[-3]>=0.5,RC[-3]<0.6),85,IF(AND(RC[-3]>=0.6,RC[-3]<0.7),80,IF(AND(RC[-3]>=0.6,RC[-3]<1),80,IF(AND(RC[-3]>1,RC[-3]<2),50,IF(RC[-3]>2,0))))))))) ->  | I131: =IF(RC[-1]="",RC[-2],0.7*RC[-1]+0.3*RC[-2]) -> 10
A132: ریل پرداز نو آفرین | B132: حآفرین | C132: =VLOOKUP(RC[-1],Sheet1!R3C2:R802C3,2,FALSE) -> حمل و نقل انبارداری و ارتباطات | D132: =VLOOKUP(RC[-2],Sheet1!R3C2:R802C9,8,FALSE) -> 5.7131904755216585 | E132: =IF(VLOOKUP(RC[-3],Sheet1!R3C2:R803C11,10,FALSE)=0,"",VLOOKUP(Sheet2!RC[-3],Sheet1!R[1]C[-3]:R[801]C[6],10,FALSE)) ->  | F132: =Sheet1!R156C10 -> 7.6389998027803898 | G132: =IF(RC[-3]<0,0,IF(AND(RC[-3]<RC[-1],RC[-3]<2),100,IF(AND(RC[-3]<RC[-1],RC[-3]>=2,RC[-3]<3),95,IF(AND(RC[-3]<RC[-1],RC[-3]>=3,RC[-3]<4),90,IF(AND(RC[-3]<RC[-1],RC[-3]>=4,RC[-3]<5),85,IF(AND(RC[-3]<RC[-1],RC[-3]>=5,RC[-3]<6),80,IF(AND(RC[-3]<RC[-1],RC[-3]>=6,RC[-3]<7),75,IF(AND(RC[-3]<RC[-1],RC[-3]>=7,RC[-3]<8),70,IF(AND(RC[-3]<RC[-1],RC[-3]>=8,RC[-3]<9),65,IF(AND(RC[-3]<RC[-1],RC[-3]>=9,RC[-3]<10),60,IF(AND(RC[-3]<RC[-1],RC[-3]>=10,RC[-3]<11),55,IF(AND(RC[-3]<RC[-1],RC[-3]>=11,RC[-3]<12),50,IF(AND(RC[-3]<RC[-1],RC[-3]>=12,RC[-3]<13),45,IF(AND(RC[-3]<RC[-1],RC[-3]>=13,RC[-3]<14),40,IF(AND(RC[-3]<RC[-1],RC[-3]>=14,RC[-3]<15),35,IF(AND(RC[-3]<RC[-1],RC[-3]>=15,RC[-3]<16),30,IF(AND(RC[-3]<RC[-1],RC[-3]>=16,RC[-3]<17),25,IF(AND(RC[-3]<RC[-1],RC[-3]>=17,RC[-3]<18),20,IF(AND(RC[-3]<RC[-1],RC[-3]>=18,RC[-3]<19),15,IF(AND(RC[-3]<RC[-1],RC[-3]>=19,RC[-3]<20),10,IF(AND(RC[-3]<RC[-1],RC[-3]>=20,RC[-3]<21),5,IF(AND(RC[-3]<RC[-1],RC[-3]>=21),0,IF(AND(RC[-3]>RC[-1],RC[-3]>=2,RC[-3]<3),90,IF(AND(RC[-3]>RC[-1],RC[-3]>=3,RC[-3]<4),90,IF(AND(RC[-3]>RC[-1],RC[-3]>=4,RC[-3]<5),80,IF(AND(RC[-3]>RC[-1],RC[-3]>=5,RC[-3]<6),70,IF(AND(RC[-3]>RC[-1],RC[-3]>=6,RC[-3]<7),60,IF(AND(RC[-3]>RC[-1],RC[-3]>=7,RC[-3]<8),50,IF(AND(RC[-3]>RC[-1],RC[-3]>=8,RC[-3]<9),40,IF(AND(RC[-3]>RC[-1],RC[-3]>=9,RC[-3]<10),30,IF(AND(RC[-3]>RC[-1],RC[-3]>=10,RC[-3]<11),20,IF(AND(RC[-3]>RC[-1],RC[-3]>=11,RC[-3]<12),10,IF(AND(RC[-3]>RC[-1],RC[-3]>=12),0))))))))))))))))))))))))))))))))) -> 80 | H132: =IF(RC[-3]="","",IF(RC[-3]<0.3,100,IF(AND(RC[-3]>=0.3,RC[-3]>0.4),95,IF(AND(RC[-3]>=0.4,RC[-3]<0.5),90,IF(AND(RC[-3]>=0.5,RC[-3]<0.6),85,IF(AND(RC[-3]>=0.6,RC[-3]<0.7),80,IF(AND(RC[-3]>=0.6,RC[-3]<1),80,IF(AND(RC[-3]>1,RC[-3]<2),50,IF(RC[-3]>2,0))))))))) ->  | I132: =IF(RC[-1]="",RC[-2],0.7*RC[-1]+0.3*RC[-2]) -> 80
A133: ریل سیر کوثر | B133: حسیر | C133: =VLOOKUP(RC[-1],Sheet1!R3C2:R802C3,2,FALSE) -> حمل و نقل انبارداری و ارتباطات | D133: =VLOOKUP(RC[-2],Sheet1!R3C2:R802C9,8,FALSE) -> 7.1363048952619721 | E133: =IF(VLOOKUP(RC[-3],Sheet1!R3C2:R803C11,10,FALSE)=0,"",VLOOKUP(Sheet2!RC[-3],Sheet1!R[1]C[-3]:R[801]C[6],10,FALSE)) ->  | F133: =Sheet1!R156C10 -> 7.6389998027803898 | G133: =IF(RC[-3]<0,0,IF(AND(RC[-3]<RC[-1],RC[-3]<2),100,IF(AND(RC[-3]<RC[-1],RC[-3]>=2,RC[-3]<3),95,IF(AND(RC[-3]<RC[-1],RC[-3]>=3,RC[-3]<4),90,IF(AND(RC[-3]<RC[-1],RC[-3]>=4,RC[-3]<5),85,IF(AND(RC[-3]<RC[-1],RC[-3]>=5,RC[-3]<6),80,IF(AND(RC[-3]<RC[-1],RC[-3]>=6,RC[-3]<7),75,IF(AND(RC[-3]<RC[-1],RC[-3]>=7,RC[-3]<8),70,IF(AND(RC[-3]<RC[-1],RC[-3]>=8,RC[-3]<9),65,IF(AND(RC[-3]<RC[-1],RC[-3]>=9,RC[-3]<10),60,IF(AND(RC[-3]<RC[-1],RC[-3]>=10,RC[-3]<11),55,IF(AND(RC[-3]<RC[-1],RC[-3]>=11,RC[-3]<12),50,IF(AND(RC[-3]<RC[-1],RC[-3]>=12,RC[-3]<13),45,IF(AND(RC[-3]<RC[-1],RC[-3]>=13,RC[-3]<14),40,IF(AND(RC[-3]<RC[-1],RC[-3]>=14,RC[-3]<15),35,IF(AND(RC[-3]<RC[-1],RC[-3]>=15,RC[-3]<16),30,IF(AND(RC[-3]<RC[-1],RC[-3]>=16,RC[-3]<17),25,IF(AND(RC[-3]<RC[-1],RC[-3]>=17,RC[-3]<18),20,IF(AND(RC[-3]<RC[-1],RC[-3]>=18,RC[-3]<19),15,IF(AND(RC[-3]<RC[-1],RC[-3]>=19,RC[-3]<20),10,IF(AND(RC[-3]<RC[-1],RC[-3]>=20,RC[-3]<21),5,IF(AND(RC[-3]<RC[-1],RC[-3]>=21),0,IF(AND(RC[-3]>RC[-1],RC[-3]>=2,RC[-3]<3),90,IF(AND(RC[-3]>RC[-1],RC[-3]>=3,RC[-3]<4),90,IF(AND(RC[-3]>RC[-1],RC[-3]>=4,RC[-3]<5),80,IF(AND(RC[-3]>RC[-1],RC[-3]>=5,RC[-3]<6),70,IF(AND(RC[-3]>RC[-1],RC[-3]>=6,RC[-3]<7),60,IF(AND(RC[-3]>RC[-1],RC[-3]>=7,RC[-3]<8),50,IF(AND(RC[-3]>RC[-1],RC[-3]>=8,RC[-3]<9),40,IF(AND(RC[-3]>RC[-1],RC[-3]>=9,RC[-3]<10),30,IF(AND(RC[-3]>RC[-1],RC[-3]>=10,RC[-3]<11),20,IF(AND(RC[-3]>RC[-1],RC[-3]>=11,RC[-3]<12),10,IF(AND(RC[-3]>RC[-1],RC[-3]>=12),0))))))))))))))))))))))))))))))))) -> 70 | H133: =IF(RC[-3]="","",IF(RC[-3]<0.3,100,IF(AND(RC[-3]>=0.3,RC[-3]>0.4),95,IF(AND(RC[-3]>=0.4,RC[-3]<0.5),90,IF(AND(RC[-3]>=0.5,RC[-3]<0.6),85,IF(AND(RC[-3]>=0.6,RC[-3]<0.7),80,IF(AND(RC[-3]>=0.6,RC[-3]<1),80,IF(AND(RC[-3]>1,RC[-3]<2),50,IF(RC[-3]>2,0))))))))) ->  | I133: =IF(RC[-1]="",RC[-2],0.7*RC[-1]+0.3*RC[-2]) -> 70
A134: ریل گردش ایرانیان | B134: حگردش | C134: =VLOOKUP(RC[-1],Sheet1!R3C2:R802C3,2,FALSE) -> حمل و نقل انبارداری و ارتباطات | D134: =VLOOKUP(RC[-2],Sheet1!R3C2:R802C9,8,FALSE) -> 76.192023308992503 | E134: =IF(VLOOKUP(RC[-3],Sheet1!R3C2:R803C11,10,FALSE)=0,"",VLOOKUP(Sheet2!RC[-3],Sheet1!R[1]C[-3]:R[801]C[6],10,FALSE)) ->  | F134: =Sheet1!R156C10 -> 7.6389998027803898 | G134: =IF(RC[-3]<0,0,IF(AND(RC[-3]<RC[-1],RC[-3]<2),100,IF(AND(RC[-3]<RC[-1],RC[-3]>=2,RC[-3]<3),95,IF(AND(RC[-3]<RC[-1],RC[-3]>=3,RC[-3]<4),90,IF(AND(RC[-3]<RC[-1],RC[-3]>=4,RC[-3]<5),85,IF(AND(RC[-3]<RC[-1],RC[-3]>=5,RC[-3]<6),80,IF(AND(RC[-3]<RC[-1],RC[-3]>=6,RC[-3]<7),75,IF(AND(RC[-3]<RC[-1],RC[-3]>=7,RC[-3]<8),70,IF(AND(RC[-3]<RC[-1],RC[-3]>=8,RC[-3]<9),65,IF(AND(RC[-3]<RC[-1],RC[-3]>=9,RC[-3]<10),60,IF(AND(RC[-3]<RC[-1],RC[-3]>=10,RC[-3]<11),55,IF(AND(RC[-3]<RC[-1],RC[-3]>=11,RC[-3]<12),50,IF(AND(RC[-3]<RC[-1],RC[-3]>=12,RC[-3]<13),45,IF(AND(RC[-3]<RC[-1],RC[-3]>=13,RC[-3]<14),40,IF(AND(RC[-3]<RC[-1],RC[-3]>=14,RC[-3]<15),35,IF(AND(RC[-3]<RC[-1],RC[-3]>=15,RC[-3]<16),30,IF(AND(RC[-3]<RC[-1],RC[-3]>=16,RC[-3]<17),25,IF(AND(RC[-3]<RC[-1],RC[-3]>=17,RC[-3]<18),20,IF(AND(RC[-3]<RC[-1],RC[-3]>=18,RC[-3]<19),15,IF(AND(RC[-3]<RC[-1],RC[-3]>=19,RC[-3]<20),10,IF(AND(RC[-3]<RC[-1],RC[-3]>=20,RC[-3]<21),5,IF(AND(RC[-3]<RC[-1],RC[-3]>=21),0,IF(AND(RC[-3]>RC[-1],RC[-3]>=2,RC[-3]<3),90,IF(AND(RC[-3]>RC[-1],RC[-3]>=3,RC[-3]<4),90,IF(AND(RC[-3]>RC[-1],RC[-3]>=4,RC[-3]<5),80,IF(AND(RC[-3]>RC[-1],RC[-3]>=5,RC[-3]<6),70,IF(AND(RC[-3]>RC[-1],RC[-3]>=6,RC[-3]<7),60,IF(AND(RC[-3]>RC[-1],RC[-3]>=7,RC[-3]<8),50,IF(AND(RC[-3]>RC[-1],RC[-3]>=8,RC[-3]<9),40,IF(AND(RC[-3]>RC[-1],RC[-3]>=9,RC[-3]<10),30,IF(AND(RC[-3]>RC[-1],RC[-3]>=10,RC[-3]<11),20,IF(AND(RC[-3]>RC[-1],RC[-3]>=11,RC[-3]<12),10,IF(AND(RC[-3]>RC[-1],RC[-3]>=12),0))))))))))))))))))))))))))))))))) -> 0 | H134: =IF(RC[-3]="","",IF(RC[-3]<0.3,100,IF(AND(RC[-3]>=0.3,RC[-3]>0.4),95,IF(AND(RC[-3]>=0.4,RC[-3]<0.5),90,IF(AND(RC[-3]>=0.5,RC[-3]<0.6),85,IF(AND(RC[-3]>=0.6,RC[-3]<0.7),80,IF(AND(RC[-3]>=0.6,RC[-3]<1),80,IF(AND(RC[-3]>1,RC[-3]<2),50,IF(RC[-3]>2,0))))))))) ->  | I134: =IF(RC[-1]="",RC[-2],0.7*RC[-1]+0.3*RC[-2]) -> 0
A135: مهندسی حمل و نقل پتروشیمی | B135: حپترو | C135: =VLOOKUP(RC[-1],Sheet1!R3C2:R802C3,2,FALSE) -> حمل و نقل انبارداری و ارتباطات | D135: =VLOOKUP(RC[-2],Sheet1!R3C2:R802C9,8,FALSE) -> 41.116101643508308 | E135: =IF(VLOOKUP(RC[-3],Sheet1!R3C2:R803C11,10,FALSE)=0,"",VLOOKUP(Sheet2!RC[-3],Sheet1!R[1]C[-3]:R[801]C[6],10,FALSE)) ->  | F135: =Sheet1!R156C10 -> 7.6389998027803898 | G135: =IF(RC[-3]<0,0,IF(AND(RC[-3]<RC[-1],RC[-3]<2),100,IF(AND(RC[-3]<RC[-1],RC[-3]>=2,RC[-3]<3),95,IF(AND(RC[-3]<RC[-1],RC[-3]>=3,RC[-3]<4),90,IF(AND(RC[-3]<RC[-1],RC[-3]>=4,RC[-3]<5),85,IF(AND(RC[-3]<RC[-1],RC[-3]>=5,RC[-3]<6),80,IF(AND(RC[-3]<RC[-1],RC[-3]>=6,RC[-3]<7),75,IF(AND(RC[-3]<RC[-1],RC[-3]>=7,RC[-3]<8),70,IF(AND(RC[-3]<RC[-1],RC[-3]>=8,RC[-3]<9),65,IF(AND(RC[-3]<RC[-1],RC[-3]>=9,RC[-3]<10),60,IF(AND(RC[-3]<RC[-1],RC[-3]>=10,RC[-3]<11),55,IF(AND(RC[-3]<RC[-1],RC[-3]>=11,RC[-3]<12),50,IF(AND(RC[-3]<RC[-1],RC[-3]>=12,RC[-3]<13),45,IF(AND(RC[-3]<RC[-1],RC[-3]>=13,RC[-3]<14),40,IF(AND(RC[-3]<RC[-1],RC[-3]>=14,RC[-3]<15),35,IF(AND(RC[-3]<RC[-1],RC[-3]>=15,RC[-3]<16),30,IF(AND(RC[-3]<RC[-1],RC[-3]>=16,RC[-3]<17),25,IF(AND(RC[-3]<RC[-1],RC[-3]>=17,RC[-3]<18),20,IF(AND(RC[-3]<RC[-1],RC[-3]>=18,RC[-3]<19),15,IF(AND(RC[-3]<RC[-1],RC[-3]>=19,RC[-3]<20),10,IF(AND(RC[-3]<RC[-1],RC[-3]>=20,RC[-3]<21),5,IF(AND(RC[-3]<RC[-1],RC[-3]>=21),0,IF(AND(RC[-3]>RC[-1],RC[-3]>=2,RC[-3]<3),90,IF(AND(RC[-3]>RC[-1],RC[-3]>=3,RC[-3]<4),90,IF(AND(RC[-3]>RC[-1],RC[-3]>=4,RC[-3]<5),80,IF(AND(RC[-3]>RC[-1],RC[-3]>=5,RC[-3]<6),70,IF(AND(RC[-3]>RC[-1],RC[-3]>=6,RC[-3]<7),60,IF(AND(RC[-3]>RC[-1],RC[-3]>=7,RC[-3]<8),50,IF(AND(RC[-3]>RC[-1],RC[-3]>=8,RC[-3]<9),40,IF(AND(RC[-3]>RC[-1],RC[-3]>=9,RC[-3]<10),30,IF(AND(RC[-3]>RC[-1],RC[-3]>=10,RC[-3]<11),20,IF(AND(RC[-3]>RC[-1],RC[-3]>=11,RC[-3]<12),10,IF(AND(RC[-3]>RC[-1],RC[-3]>=12),0))))))))))))))))))))))))))))))))) -> 0 | H135: =IF(RC[-3]="","",IF(RC[-3]<0.3,100,IF(AND(RC[-3]>=0.3,RC[-3]>0.4),95,IF(AND(RC[-3]>=0.4,RC[-3]<0.5),90,IF(AND(RC[-3]>=0.5,RC[-3]<0.6),85,IF(AND(RC[-3]>=0.6,RC[-3]<0.7),80,IF(AND(RC[-3]>=0.6,RC[-3]<1),80,IF(AND(RC[-3]>1,RC[-3]<2),50,IF(RC[-3]>2,0))))))))) ->  | I135: =IF(RC[-1]="",RC[-2],0.7*RC[-1]+0.3*RC[-2]) -> 0
A136: کشتیرانی آریا | B136: حاریا | C136: =VLOOKUP(RC[-1],Sheet1!R3C2:R802C3,2,FALSE) -> حمل و نقل انبارداری و ارتباطات | D136: =VLOOKUP(RC[-2],Sheet1!R3C2:R802C9,8,FALSE) -> -7.2933070866141732 | E136: =IF(VLOOKUP(RC[-3],Sheet1!R3C2:R803C11,10,FALSE)=0,"",VLOOKUP(Sheet2!RC[-3],Sheet1!R[1]C[-3]:R[801]C[6],10,FALSE)) ->  | F136: =Sheet1!R156C10 -> 7.6389998027803898 | G136: =IF(RC[-3]<0,0,IF(AND(RC[-3]<RC[-1],RC[-3]<2),100,IF(AND(RC[-3]<RC[-1],RC[-3]>=2,RC[-3]<3),95,IF(AND(RC[-3]<RC[-1],RC[-3]>=3,RC[-3]<4),90,IF(AND(RC[-3]<RC[-1],RC[-3]>=4,RC[-3]<5),85,IF(AND(RC[-3]<RC[-1],RC[-3]>=5,RC[-3]<6),80,IF(AND(RC[-3]<RC[-1],RC[-3]>=6,RC[-3]<7),75,IF(AND(RC[-3]<RC[-1],RC[-3]>=7,RC[-3]<8),70,IF(AND(RC[-3]<RC[-1],RC[-3]>=8,RC[-3]<9),65,IF(AND(RC[-3]<RC[-1],RC[-3]>=9,RC[-3]<10),60,IF(AND(RC[-3]<RC[-1],RC[-3]>=10,RC[-3]<11),55,IF(AND(RC[-3]<RC[-1],RC[-3]>=11,RC[-3]<12),50,IF(AND(RC[-3]<RC[-1],RC[-3]>=12,RC[-3]<13),45,IF(AND(RC[-3]<RC[-1],RC[-3]>=13,RC[-3]<14),40,IF(AND(RC[-3]<RC[-1],RC[-3]>=14,RC[-3]<15),35,IF(AND(RC[-3]<RC[-1],RC[-3]>=15,RC[-3]<16),30,IF(AND(RC[-3]<RC[-1],RC[-3]>=16,RC[-3]<17),25,IF(AND(RC[-3]<RC[-1],RC[-3]>=17,RC[-3]<18),20,IF(AND(RC[-3]<RC[-1],RC[-3]>=18,RC[-3]<19),15,IF(AND(RC[-3]<RC[-1],RC[-3]>=19,RC[-3]<20),10,IF(AND(RC[-3]<RC[-1],RC[-3]>=20,RC[-3]<21),5,IF(AND(RC[-3]<RC[-1],RC[-3]>=21),0,IF(AND(RC[-3]>RC[-1],RC[-3]>=2,RC[-3]<3),90,IF(AND(RC[-3]>RC[-1],RC[-3]>=3,RC[-3]<4),90,IF(AND(RC[-3]>RC[-1],RC[-3]>=4,RC[-3]<5),80,IF(AND(RC[-3]>RC[-1],RC[-3]>=5,RC[-3]<6),70,IF(AND(RC[-3]>RC[-1],RC[-3]>=6,RC[-3]<7),60,IF(AND(RC[-3]>RC[-1],RC[-3]>=7,RC[-3]<8),50,IF(AND(RC[-3]>RC[-1],RC[-3]>=8,RC[-3]<9),40,IF(AND(RC[-3]>RC[-1],RC[-3]>=9,RC[-3]<10),30,IF(AND(RC[-3]>RC[-1],RC[-3]>=10,RC[-3]<11),20,IF(AND(RC[-3]>RC[-1],RC[-3]>=11,RC[-3]<12),10,IF(AND(RC[-3]>RC[-1],RC[-3]>=12),0))))))))))))))))))))))))))))))))) -> 0 | H136: =IF(RC[-3]="","",IF(RC[-3]<0.3,100,IF(AND(RC[-3]>=0.3,RC[-3]>0.4),95,IF(AND(RC[-3]>=0.4,RC[-3]<0.5),90,IF(AND(RC[-3]>=0.5,RC[-3]<0.6),85,IF(AND(RC[-3]>=0.6,RC[-3]<0.7),80,IF(AND(RC[-3]>=0.6,RC[-3]<1),80,IF(AND(RC[-3]>1,RC[-3]<2),50,IF(RC[-3]>2,0))))))))) ->  | I136: =IF(RC[-1]="",RC[-2],0.7*RC[-1]+0.3*RC[-2]) -> 0
A137: کشتیرانی ایران | B137: حکشتی | C137: =VLOOKUP(RC[-1],Sheet1!R3C2:R802C3,2,FALSE) -> حمل و نقل انبارداری و ارتباطات | D137: =VLOOKUP(RC[-2],Sheet1!R3C2:R802C9,8,FALSE) -> 3.9934807521333022 | E137: =IF(VLOOKUP(RC[-3],Sheet1!R3C2:R803C11,10,FALSE)=0,"",VLOOKUP(Sheet2!RC[-3],Sheet1!R[1]C[-3]:R[801]C[6],10,FALSE)) ->  | F137: =Sheet1!R156C10 -> 7.6389998027803898 | G137: =IF(RC[-3]<0,0,IF(AND(RC[-3]<RC[-1],RC[-3]<2),100,IF(AND(RC[-3]<RC[-1],RC[-3]>=2,RC[-3]<3),95,IF(AND(RC[-3]<RC[-1],RC[-3]>=3,RC[-3]<4),90,IF(AND(RC[-3]<RC[-1],RC[-3]>=4,RC[-3]<5),85,IF(AND(RC[-3]<RC[-1],RC[-3]>=5,RC[-3]<6),80,IF(AND(RC[-3]<RC[-1],RC[-3]>=6,RC[-3]<7),75,IF(AND(RC[-3]<RC[-1],RC[-3]>=7,RC[-3]<8),70,IF(AND(RC[-3]<RC[-1],RC[-3]>=8,RC[-3]<9),65,IF(AND(RC[-3]<RC[-1],RC[-3]>=9,RC[-3]<10),60,IF(AND(RC[-3]<RC[-1],RC[-3]>=10,RC[-3]<11),55,IF(AND(RC[-3]<RC[-1],RC[-3]>=11,RC[-3]<12),50,IF(AND(RC[-3]<RC[-1],RC[-3]>=12,RC[-3]<13),45,IF(AND(RC[-3]<RC[-1],RC[-3]>=13,RC[-3]<14),40,IF(AND(RC[-3]<RC[-1],RC[-3]>=14,RC[-3]<15),35,IF(AND(RC[-3]<RC[-1],RC[-3]>=15,RC[-3]<16),30,IF(AND(RC[-3]<RC[-1],RC[-3]>=16,RC[-3]<17),25,IF(AND(RC[-3]<RC[-1],RC[-3]>=17,RC[-3]<18),20,IF(AND(RC[-3]<RC[-1],RC[-3]>=18,RC[-3]<19),15,IF(AND(RC[-3]<RC[-1],RC[-3]>=19,RC[-3]<20),10,IF(AND(RC[-3]<RC[-1],RC[-3]>=20,RC[-3]<21),5,IF(AND(RC[-3]<RC[-1],RC[-3]>=21),0,IF(AND(RC[-3]>RC[-1],RC[-3]>=2,RC[-3]<3),90,IF(AND(RC[-3]>RC[-1],RC[-3]>=3,RC[-3]<4),90,IF(AND(RC[-3]>RC[-1],RC[-3]>=4,RC[-3]<5),80,IF(AND(RC[-3]>RC[-1],RC[-3]>=5,RC[-3]<6),70,IF(AND(RC[-3]>RC[-1],RC[-3]>=6,RC[-3]<7),60,IF(AND(RC[-3]>RC[-1],RC[-3]>=7,RC[-3]<8),50,IF(AND(RC[-3]>RC[-1],RC[-3]>=8,RC[-3]<9),40,IF(AND(RC[-3]>RC[-1],RC[-3]>=9,RC[-3]<10),30,IF(AND(RC[-3]>RC[-1],RC[-3]>=10,RC[-3]<11),20,IF(AND(RC[-3]>RC[-1],RC[-3]>=11,RC[-3]<12),10,IF(AND(RC[-3]>RC[-1],RC[-3]>=12),0))))))))))))))))))))))))))))))))) -> 90 | H137: =IF(RC[-3]="","",IF(RC[-3]<0.3,100,IF(AND(RC[-3]>=0.3,RC[-3]>0.4),95,IF(AND(RC[-3]>=0.4,RC[-3]<0.5),90,IF(AND(RC[-3]>=0.5,RC[-3]<0.6),85,IF(AND(RC[-3]>=0.6,RC[-3]<0.7),80,IF(AND(RC[-3]>=0.6,RC[-3]<1),80,IF(AND(RC[-3]>1,RC[-3]<2),50,IF(RC[-3]>2,0))))))))) ->  | I137: =IF(RC[-1]="",RC[-2],0.7*RC[-1]+0.3*RC[-2]) -> 90
A138: کشتیرانی دریای خزر | B138: حخزر | C138: =VLOOKUP(RC[-1],Sheet1!R3C2:R802C3,2,FALSE) -> حمل و نقل انبارداری و ارتباطات | D138: =VLOOKUP(RC[-2],Sheet1!R3C2:R802C9,8,FALSE) -> 9 | E138: =IF(VLOOKUP(RC[-3],Sheet1!R3C2:R803C11,10,FALSE)=0,"",VLOOKUP(Sheet2!RC[-3],Sheet1!R[1]C[-3]:R[801]C[6],10,FALSE)) ->  | F138: =Sheet1!R156C10 -> 7.6389998027803898 | G138: =IF(RC[-3]<0,0,IF(AND(RC[-3]<RC[-1],RC[-3]<2),100,IF(AND(RC[-3]<RC[-1],RC[-3]>=2,RC[-3]<3),95,IF(AND(RC[-3]<RC[-1],RC[-3]>=3,RC[-3]<4),90,IF(AND(RC[-3]<RC[-1],RC[-3]>=4,RC[-3]<5),85,IF(AND(RC[-3]<RC[-1],RC[-3]>=5,RC[-3]<6),80,IF(AND(RC[-3]<RC[-1],RC[-3]>=6,RC[-3]<7),75,IF(AND(RC[-3]<RC[-1],RC[-3]>=7,RC[-3]<8),70,IF(AND(RC[-3]<RC[-1],RC[-3]>=8,RC[-3]<9),65,IF(AND(RC[-3]<RC[-1],RC[-3]>=9,RC[-3]<10),60,IF(AND(RC[-3]<RC[-1],RC[-3]>=10,RC[-3]<11),55,IF(AND(RC[-3]<RC[-1],RC[-3]>=11,RC[-3]<12),50,IF(AND(RC[-3]<RC[-1],RC[-3]>=12,RC[-3]<13),45,IF(AND(RC[-3]<RC[-1],RC[-3]>=13,RC[-3]<14),40,IF(AND(RC[-3]<RC[-1],RC[-3]>=14,RC[-3]<15),35,IF(AND(RC[-3]<RC[-1],RC[-3]>=15,RC[-3]<16),30,IF(AND(RC[-3]<RC[-1],RC[-3]>=16,RC[-3]<17),25,IF(AND(RC[-3]<RC[-1],RC[-3]>=17,RC[-3]<18),20,IF(AND(RC[-3]<RC[-1],RC[-3]>=18,RC[-3]<19),15,IF(AND(RC[-3]<RC[-1],RC[-3]>=19,RC[-3]<20),10,IF(AND(RC[-3]<RC[-1],RC[-3]>=20,RC[-3]<21),5,IF(AND(RC[-3]<RC[-1],RC[-3]>=21),0,IF(AND(RC[-3]>RC[-1],RC[-3]>=2,RC[-3]<3),90,IF(AND(RC[-3]>RC[-1],RC[-3]>=3,RC[-3]<4),90,IF(AND(RC[-3]>RC[-1],RC[-3]>=4,RC[-3]<5),80,IF(AND(RC[-3]>RC[-1],RC[-3]>=5,RC[-3]<6),70,IF(AND(RC[-3]>RC[-1],RC[-3]>=6,RC[-3]<7),60,IF(AND(RC[-3]>RC[-1],RC[-3]>=7,RC[-3]<8),50,IF(AND(RC[-3]>RC[-1],RC[-3]>=8,RC[-3]<9),40,IF(AND(RC[-3]>RC[-1],RC[-3]>=9,RC[-3]<10),30,IF(AND(RC[-3]>RC[-1],RC[-3]>=10,RC[-3]<11),20,IF(AND(RC[-3]>RC[-1],RC[-3]>=11,RC[-3]<12),10,IF(AND(RC[-3]>RC[-1],RC[-3]>=12),0))))))))))))))))))))))))))))))))) -> 30 | H138: =IF(RC[-3]="","",IF(RC[-3]<0.3,100,IF(AND(RC[-3]>=0.3,RC[-3]>0.4),95,IF(AND(RC[-3]>=0.4,RC[-3]<0.5),90,IF(AND(RC[-3]>=0.5,RC[-3]<0.6),85,IF(AND(RC[-3]>=0.6,RC[-3]<0.7),80,IF(AND(RC[-3]>=0.6,RC[-3]<1),80,IF(AND(RC[-3]>1,RC[-3]<2),50,IF(RC[-3]>2,0))))))))) ->  | I138: =IF(RC[-1]="",RC[-2],0.7*RC[-1]+0.3*RC[-2]) -> 30
A139: فروشگاه رفاه | B139: رفاه | C139: =VLOOKUP(RC[-1],Sheet1!R3C2:R802C3,2,FALSE) -> خرده فروشی | D139: =VLOOKUP(RC[-2],Sheet1!R3C2:R802C9,8,FALSE) -> 8.542908658513424 | E139: =IF(VLOOKUP(RC[-3],Sheet1!R3C2:R803C11,10,FALSE)=0,"",VLOOKUP(Sheet2!RC[-3],Sheet1!R[1]C[-3]:R[801]C[6],10,FALSE)) ->  | F139: =Sheet1!R160C10 -> 6.7293344417326084 | G139: =IF(RC[-3]<0,0,IF(AND(RC[-3]<RC[-1],RC[-3]<2),100,IF(AND(RC[-3]<RC[-1],RC[-3]>=2,RC[-3]<3),95,IF(AND(RC[-3]<RC[-1],RC[-3]>=3,RC[-3]<4),90,IF(AND(RC[-3]<RC[-1],RC[-3]>=4,RC[-3]<5),85,IF(AND(RC[-3]<RC[-1],RC[-3]>=5,RC[-3]<6),80,IF(AND(RC[-3]<RC[-1],RC[-3]>=6,RC[-3]<7),75,IF(AND(RC[-3]<RC[-1],RC[-3]>=7,RC[-3]<8),70,IF(AND(RC[-3]<RC[-1],RC[-3]>=8,RC[-3]<9),65,IF(AND(RC[-3]<RC[-1],RC[-3]>=9,RC[-3]<10),60,IF(AND(RC[-3]<RC[-1],RC[-3]>=10,RC[-3]<11),55,IF(AND(RC[-3]<RC[-1],RC[-3]>=11,RC[-3]<12),50,IF(AND(RC[-3]<RC[-1],RC[-3]>=12,RC[-3]<13),45,IF(AND(RC[-3]<RC[-1],RC[-3]>=13,RC[-3]<14),40,IF(AND(RC[-3]<RC[-1],RC[-3]>=14,RC[-3]<15),35,IF(AND(RC[-3]<RC[-1],RC[-3]>=15,RC[-3]<16),30,IF(AND(RC[-3]<RC[-1],RC[-3]>=16,RC[-3]<17),25,IF(AND(RC[-3]<RC[-1],RC[-3]>=17,RC[-3]<18),20,IF(AND(RC[-3]<RC[-1],RC[-3]>=18,RC[-3]<19),15,IF(AND(RC[-3]<RC[-1],RC[-3]>=19,RC[-3]<20),10,IF(AND(RC[-3]<RC[-1],RC[-3]>=20,RC[-3]<21),5,IF(AND(RC[-3]<RC[-1],RC[-3]>=21),0,IF(AND(RC[-3]>RC[-1],RC[-3]>=2,RC[-3]<3),90,IF(AND(RC[-3]>RC[-1],RC[-3]>=3,RC[-3]<4),90,IF(AND(RC[-3]>RC[-1],RC[-3]>=4,RC[-3]<5),80,IF(AND(RC[-3]>RC[-1],RC[-3]>=5,RC[-3]<6),70,IF(AND(RC[-3]>RC[-1],RC[-3]>=6,RC[-3]<7),60,IF(AND(RC[-3]>RC[-1],RC[-3]>=7,RC[-3]<8),50,IF(AND(RC[-3]>RC[-1],RC[-3]>=8,RC[-3]<9),40,IF(AND(RC[-3]>RC[-1],RC[-3]>=9,RC[-3]<10),30,IF(AND(RC[-3]>RC[-1],RC[-3]>=10,RC[-3]<11),20,IF(AND(RC[-3]>RC[-1],RC[-3]>=11,RC[-3]<12),10,IF(AND(RC[-3]>RC[-1],RC[-3]>=12),0))))))))))))))))))))))))))))))))) -> 40 | H139: =IF(RC[-3]="","",IF(RC[-3]<0.3,100,IF(AND(RC[-3]>=0.3,RC[-3]>0.4),95,IF(AND(RC[-3]>=0.4,RC[-3]<0.5),90,IF(AND(RC[-3]>=0.5,RC[-3]<0.6),85,IF(AND(RC[-3]>=0.6,RC[-3]<0.7),80,IF(AND(RC[-3]>=0.6,RC[-3]<1),80,IF(AND(RC[-3]>1,RC[-3]<2),50,IF(RC[-3]>2,0))))))))) ->  | I139: =IF(RC[-1]="",RC[-2],0.7*RC[-1]+0.3*RC[-2]) -> 40
A140: فروشگاه های افق کوروش | B140: افق | C140: =VLOOKUP(RC[-1],Sheet1!R3C2:R802C3,2,FALSE) -> خرده فروشی | D140: =VLOOKUP(RC[-2],Sheet1!R3C2:R802C9,8,FALSE) -> 5.281041107230692 | E140: =IF(VLOOKUP(RC[-3],Sheet1!R3C2:R803C11,10,FALSE)=0,"",VLOOKUP(Sheet2!RC[-3],Sheet1!R[1]C[-3]:R[801]C[6],10,FALSE)) ->  | F140: =Sheet1!R160C10 -> 6.7293344417326084 | G140: =IF(RC[-3]<0,0,IF(AND(RC[-3]<RC[-1],RC[-3]<2),100,IF(AND(RC[-3]<RC[-1],RC[-3]>=2,RC[-3]<3),95,IF(AND(RC[-3]<RC[-1],RC[-3]>=3,RC[-3]<4),90,IF(AND(RC[-3]<RC[-1],RC[-3]>=4,RC[-3]<5),85,IF(AND(RC[-3]<RC[-1],RC[-3]>=5,RC[-3]<6),80,IF(AND(RC[-3]<RC[-1],RC[-3]>=6,RC[-3]<7),75,IF(AND(RC[-3]<RC[-1],RC[-3]>=7,RC[-3]<8),70,IF(AND(RC[-3]<RC[-1],RC[-3]>=8,RC[-3]<9),65,IF(AND(RC[-3]<RC[-1],RC[-3]>=9,RC[-3]<10),60,IF(AND(RC[-3]<RC[-1],RC[-3]>=10,RC[-3]<11),55,IF(AND(RC[-3]<RC[-1],RC[-3]>=11,RC[-3]<12),50,IF(AND(RC[-3]<RC[-1],RC[-3]>=12,RC[-3]<13),45,IF(AND(RC[-3]<RC[-1],RC[-3]>=13,RC[-3]<14),40,IF(AND(RC[-3]<RC[-1],RC[-3]>=14,RC[-3]<15),35,IF(AND(RC[-3]<RC[-1],RC[-3]>=15,RC[-3]<16),30,IF(AND(RC[-3]<RC[-1],RC[-3]>=16,RC[-3]<17),25,IF(AND(RC[-3]<RC[-1],RC[-3]>=17,RC[-3]<18),20,IF(AND(RC[-3]<RC[-1],RC[-3]>=18,RC[-3]<19),15,IF(AND(RC[-3]<RC[-1],RC[-3]>=19,RC[-3]<20),10,IF(AND(RC[-3]<RC[-1],RC[-3]>=20,RC[-3]<21),5,IF(AND(RC[-3]<RC[-1],RC[-3]>=21),0,IF(AND(RC[-3]>RC[-1],RC[-3]>=2,RC[-3]<3),90,IF(AND(RC[-3]>RC[-1],RC[-3]>=3,RC[-3]<4),90,IF(AND(RC[-3]>RC[-1],RC[-3]>=4,RC[-3]<5),80,IF(AND(RC[-3]>RC[-1],RC[-3]>=5,RC[-3]<6),70,IF(AND(RC[-3]>RC[-1],RC[-3]>=6,RC[-3]<7),60,IF(AND(RC[-3]>RC[-1],RC[-3]>=7,RC[-3]<8),50,IF(AND(RC[-3]>RC[-1],RC[-3]>=8,RC[-3]<9),40,IF(AND(RC[-3]>RC[-1],RC[-3]>=9,RC[-3]<10),30,IF(AND(RC[-3]>RC[-1],RC[-3]>=10,RC[-3]<11),20,IF(AND(RC[-3]>RC[-1],RC[-3]>=11,RC[-3]<12),10,IF(AND(RC[-3]>RC[-1],RC[-3]>=12),0))))))))))))))))))))))))))))))))) -> 80 | H140: =IF(RC[-3]="","",IF(RC[-3]<0.3,100,IF(AND(RC[-3]>=0.3,RC[-3]>0.4),95,IF(AND(RC[-3]>=0.4,RC[-3]<0.5),90,IF(AND(RC[-3]>=0.5,RC[-3]<0.6),85,IF(AND(RC[-3]>=0.6,RC[-3]<0.7),80,IF(AND(RC[-3]>=0.6,RC[-3]<1),80,IF(AND(RC[-3]>1,RC[-3]<2),50,IF(RC[-3]>2,0))))))))) ->  | I140: =IF(RC[-1]="",RC[-2],0.7*RC[-1]+0.3*RC[-2]) -> 80
A141: قاسم ایران | B141: قاسم | C141: =VLOOKUP(RC[-1],Sheet1!R3C2:R802C3,2,FALSE) -> خرده فروشی | D141: =VLOOKUP(RC[-2],Sheet1!R3C2:R802C9,8,FALSE) -> 6.3716794581547562 | E141: =IF(VLOOKUP(RC[-3],Sheet1!R3C2:R803C11,10,FALSE)=0,"",VLOOKUP(Sheet2!RC[-3],Sheet1!R[1]C[-3]:R[801]C[6],10,FALSE)) ->  | F141: =Sheet1!R160C10 -> 6.7293344417326084 | G141: =IF(RC[-3]<0,0,IF(AND(RC[-3]<RC[-1],RC[-3]<2),100,IF(AND(RC[-3]<RC[-1],RC[-3]>=2,RC[-3]<3),95,IF(AND(RC[-3]<RC[-1],RC[-3]>=3,RC[-3]<4),90,IF(AND(RC[-3]<RC[-1],RC[-3]>=4,RC[-3]<5),85,IF(AND(RC[-3]<RC[-1],RC[-3]>=5,RC[-3]<6),80,IF(AND(RC[-3]<RC[-1],RC[-3]>=6,RC[-3]<7),75,IF(AND(RC[-3]<RC[-1],RC[-3]>=7,RC[-3]<8),70,IF(AND(RC[-3]<RC[-1],RC[-3]>=8,RC[-3]<9),65,IF(AND(RC[-3]<RC[-1],RC[-3]>=9,RC[-3]<10),60,IF(AND(RC[-3]<RC[-1],RC[-3]>=10,RC[-3]<11),55,IF(AND(RC[-3]<RC[-1],RC[-3]>=11,RC[-3]<12),50,IF(AND(RC[-3]<RC[-1],RC[-3]>=12,RC[-3]<13),45,IF(AND(RC[-3]<RC[-1],RC[-3]>=13,RC[-3]<14),40,IF(AND(RC[-3]<RC[-1],RC[-3]>=14,RC[-3]<15),35,IF(AND(RC[-3]<RC[-1],RC[-3]>=15,RC[-3]<16),30,IF(AND(RC[-3]<RC[-1],RC[-3]>=16,RC[-3]<17),25,IF(AND(RC[-3]<RC[-1],RC[-3]>=17,RC[-3]<18),20,IF(AND(RC[-3]<RC[-1],RC[-3]>=18,RC[-3]<19),15,IF(AND(RC[-3]<RC[-1],RC[-3]>=19,RC[-3]<20),10,IF(AND(RC[-3]<RC[-1],RC[-3]>=20,RC[-3]<21),5,IF(AND(RC[-3]<RC[-1],RC[-3]>=21),0,IF(AND(RC[-3]>RC[-1],RC[-3]>=2,RC[-3]<3),90,IF(AND(RC[-3]>RC[-1],RC[-3]>=3,RC[-3]<4),90,IF(AND(RC[-3]>RC[-1],RC[-3]>=4,RC[-3]<5),80,IF(AND(RC[-3]>RC[-1],RC[-3]>=5,RC[-3]<6),70,IF(AND(RC[-3]>RC[-1],RC[-3]>=6,RC[-3]<7),60,IF(AND(RC[-3]>RC[-1],RC[-3]>=7,RC[-3]<8),50,IF(AND(RC[-3]>RC[-1],RC[-3]>=8,RC[-3]<9),40,IF(AND(RC[-3]>RC[-1],RC[-3]>=9,RC[-3]<10),30,IF(AND(RC[-3]>RC[-1],RC[-3]>=10,RC[-3]<11),20,IF(AND(RC[-3]>RC[-1],RC[-3]>=11,RC[-3]<12),10,IF(AND(RC[-3]>RC[-1],RC[-3]>=12),0))))))))))))))))))))))))))))))))) -> 75 | H141: =IF(RC[-3]="","",IF(RC[-3]<0.3,100,IF(AND(RC[-3]>=0.3,RC[-3]>0.4),95,IF(AND(RC[-3]>=0.4,RC[-3]<0.5),90,IF(AND(RC[-3]>=0.5,RC[-3]<0.6),85,IF(AND(RC[-3]>=0.6,RC[-3]<0.7),80,IF(AND(RC[-3]>=0.6,RC[-3]<1),80,IF(AND(RC[-3]>1,RC[-3]<2),50,IF(RC[-3]>2,0))))))))) ->  | I141: =IF(RC[-1]="",RC[-2],0.7*RC[-1]+0.3*RC[-2]) -> 75
A142: آهنگری تراکتور | B142: خاهن | C142: =VLOOKUP(RC[-1],Sheet1!R3C2:R802C3,2,FALSE) -> خودرو و قطعات | D142: =VLOOKUP(RC[-2],Sheet1!R3C2:R802C9,8,FALSE) -> 5.2678582834055838 | E142: =IF(VLOOKUP(RC[-3],Sheet1!R3C2:R803C11,10,FALSE)=0,"",VLOOKUP(Sheet2!RC[-3],Sheet1!R[1]C[-3]:R[801]C[6],10,FALSE)) ->  | F142: =Sheet1!R197C10 -> 53.061720219378913 | G142: =IF(RC[-3]<0,0,IF(AND(RC[-3]<RC[-1],RC[-3]<2),100,IF(AND(RC[-3]<RC[-1],RC[-3]>=2,RC[-3]<3),95,IF(AND(RC[-3]<RC[-1],RC[-3]>=3,RC[-3]<4),90,IF(AND(RC[-3]<RC[-1],RC[-3]>=4,RC[-3]<5),85,IF(AND(RC[-3]<RC[-1],RC[-3]>=5,RC[-3]<6),80,IF(AND(RC[-3]<RC[-1],RC[-3]>=6,RC[-3]<7),75,IF(AND(RC[-3]<RC[-1],RC[-3]>=7,RC[-3]<8),70,IF(AND(RC[-3]<RC[-1],RC[-3]>=8,RC[-3]<9),65,IF(AND(RC[-3]<RC[-1],RC[-3]>=9,RC[-3]<10),60,IF(AND(RC[-3]<RC[-1],RC[-3]>=10,RC[-3]<11),55,IF(AND(RC[-3]<RC[-1],RC[-3]>=11,RC[-3]<12),50,IF(AND(RC[-3]<RC[-1],RC[-3]>=12,RC[-3]<13),45,IF(AND(RC[-3]<RC[-1],RC[-3]>=13,RC[-3]<14),40,IF(AND(RC[-3]<RC[-1],RC[-3]>=14,RC[-3]<15),35,IF(AND(RC[-3]<RC[-1],RC[-3]>=15,RC[-3]<16),30,IF(AND(RC[-3]<RC[-1],RC[-3]>=16,RC[-3]<17),25,IF(AND(RC[-3]<RC[-1],RC[-3]>=17,RC[-3]<18),20,IF(AND(RC[-3]<RC[-1],RC[-3]>=18,RC[-3]<19),15,IF(AND(RC[-3]<RC[-1],RC[-3]>=19,RC[-3]<20),10,IF(AND(RC[-3]<RC[-1],RC[-3]>=20,RC[-3]<21),5,IF(AND(RC[-3]<RC[-1],RC[-3]>=21),0,IF(AND(RC[-3]>RC[-1],RC[-3]>=2,RC[-3]<3),90,IF(AND(RC[-3]>RC[-1],RC[-3]>=3,RC[-3]<4),90,IF(AND(RC[-3]>RC[-1],RC[-3]>=4,RC[-3]<5),80,IF(AND(RC[-3]>RC[-1],RC[-3]>=5,RC[-3]<6),70,IF(AND(RC[-3]>RC[-1],RC[-3]>=6,RC[-3]<7),60,IF(AND(RC[-3]>RC[-1],RC[-3]>=7,RC[-3]<8),50,IF(AND(RC[-3]>RC[-1],RC[-3]>=8,RC[-3]<9),40,IF(AND(RC[-3]>RC[-1],RC[-3]>=9,RC[-3]<10),30,IF(AND(RC[-3]>RC[-1],RC[-3]>=10,RC[-3]<11),20,IF(AND(RC[-3]>RC[-1],RC[-3]>=11,RC[-3]<12),10,IF(AND(RC[-3]>RC[-1],RC[-3]>=12),0))))))))))))))))))))))))))))))))) -> 80 | H142: =IF(RC[-3]="","",IF(RC[-3]<0.3,100,IF(AND(RC[-3]>=0.3,RC[-3]>0.4),95,IF(AND(RC[-3]>=0.4,RC[-3]<0.5),90,IF(AND(RC[-3]>=0.5,RC[-3]<0.6),85,IF(AND(RC[-3]>=0.6,RC[-3]<0.7),80,IF(AND(RC[-3]>=0.6,RC[-3]<1),80,IF(AND(RC[-3]>1,RC[-3]<2),50,IF(RC[-3]>2,0))))))))) ->  | I142: =IF(RC[-1]="",RC[-2],0.7*RC[-1]+0.3*RC[-2]) -> 80
A143: اشتاد ایران | B143: تشتاد | C143: =VLOOKUP(RC[-1],Sheet1!R3C2:R802C3,2,FALSE) -> خودرو و قطعات | D143: =VLOOKUP(RC[-2],Sheet1!R3C2:R802C9,8,FALSE) -> 42.422448049584148 | E143: =IF(VLOOKUP(RC[-3],Sheet1!R3C2:R803C11,10,FALSE)=0,"",VLOOKUP(Sheet2!RC[-3],Sheet1!R[1]C[-3]:R[801]C[6],10,FALSE)) ->  | F143: =Sheet1!R197C10 -> 53.061720219378913 | G143: =IF(RC[-3]<0,0,IF(AND(RC[-3]<RC[-1],RC[-3]<2),100,IF(AND(RC[-3]<RC[-1],RC[-3]>=2,RC[-3]<3),95,IF(AND(RC[-3]<RC[-1],RC[-3]>=3,RC[-3]<4),90,IF(AND(RC[-3]<RC[-1],RC[-3]>=4,RC[-3]<5),85,IF(AND(RC[-3]<RC[-1],RC[-3]>=5,RC[-3]<6),80,IF(AND(RC[-3]<RC[-1],RC[-3]>=6,RC[-3]<7),75,IF(AND(RC[-3]<RC[-1],RC[-3]>=7,RC[-3]<8),70,IF(AND(RC[-3]<RC[-1],RC[-3]>=8,RC[-3]<9),65,IF(AND(RC[-3]<RC[-1],RC[-3]>=9,RC[-3]<10),60,IF(AND(RC[-3]<RC[-1],RC[-3]>=10,RC[-3]<11),55,IF(AND(RC[-3]<RC[-1],RC[-3]>=11,RC[-3]<12),50,IF(AND(RC[-3]<RC[-1],RC[-3]>=12,RC[-3]<13),45,IF(AND(RC[-3]<RC[-1],RC[-3]>=13,RC[-3]<14),40,IF(AND(RC[-3]<RC[-1],RC[-3]>=14,RC[-3]<15),35,IF(AND(RC[-3]<RC[-1],RC[-3]>=15,RC[-3]<16),30,IF(AND(RC[-3]<RC[-1],RC[-3]>=16,RC[-3]<17),25,IF(AND(RC[-3]<RC[-1],RC[-3]>=17,RC[-3]<18),20,IF(AND(RC[-3]<RC[-1],RC[-3]>=18,RC[-3]<19),15,IF(AND(RC[-3]<RC[-1],RC[-3]>=19,RC[-3]<20),10,IF(AND(RC[-3]<RC[-1],RC[-3]>=20,RC[-3]<21),5,IF(AND(RC[-3]<RC[-1],RC[-3]>=21),0,IF(AND(RC[-3]>RC[-1],RC[-3]>=2,RC[-3]<3),90,IF(AND(RC[-3]>RC[-1],RC[-3]>=3,RC[-3]<4),90,IF(AND(RC[-3]>RC[-1],RC[-3]>=4,RC[-3]<5),80,IF(AND(RC[-3]>RC[-1],RC[-3]>=5,RC[-3]<6),70,IF(AND(RC[-3]>RC[-1],RC[-3]>=6,RC[-3]<7),60,IF(AND(RC[-3]>RC[-1],RC[-3]>=7,RC[-3]<8),50,IF(AND(RC[-3]>RC[-1],RC[-3]>=8,RC[-3]<9),40,IF(AND(RC[-3]>RC[-1],RC[-3]>=9,RC[-3]<10),30,IF(AND(RC[-3]>RC[-1],RC[-3]>=10,RC[-3]<11),20,IF(AND(RC[-3]>RC[-1],RC[-3]>=11,RC[-3]<12),10,IF(AND(RC[-3]>RC[-1],RC[-3]>=12),0))))))))))))))))))))))))))))))))) -> 0 | H143: =IF(RC[-3]="","",IF(RC[-3]<0.3,100,IF(AND(RC[-3]>=0.3,RC[-3]>0.4),95,IF(AND(RC[-3]>=0.4,RC[-3]<0.5),90,IF(AND(RC[-3]>=0.5,RC[-3]<0.6),85,IF(AND(RC[-3]>=0.6,RC[-3]<0.7),80,IF(AND(RC[-3]>=0.6,RC[-3]<1),80,IF(AND(RC[-3]>1,RC[-3]<2),50,IF(RC[-3]>2,0))))))))) ->  | I143: =IF(RC[-1]="",RC[-2],0.7*RC[-1]+0.3*RC[-2]) -> 0
A144: الکتریک خودرو شرق | B144: خشرق | C144: =VLOOKUP(RC[-1],Sheet1!R3C2:R802C3,2,FALSE) -> خودرو و قطعات | D144: =VLOOKUP(RC[-2],Sheet1!R3C2:R802C9,8,FALSE) -> 9.5142328850937137 | E144: =IF(VLOOKUP(RC[-3],Sheet1!R3C2:R803C11,10,FALSE)=0,"",VLOOKUP(Sheet2!RC[-3],Sheet1!R[1]C[-3]:R[801]C[6],10,FALSE)) ->  | F144: =Sheet1!R197C10 -> 53.061720219378913 | G144: =IF(RC[-3]<0,0,IF(AND(RC[-3]<RC[-1],RC[-3]<2),100,IF(AND(RC[-3]<RC[-1],RC[-3]>=2,RC[-3]<3),95,IF(AND(RC[-3]<RC[-1],RC[-3]>=3,RC[-3]<4),90,IF(AND(RC[-3]<RC[-1],RC[-3]>=4,RC[-3]<5),85,IF(AND(RC[-3]<RC[-1],RC[-3]>=5,RC[-3]<6),80,IF(AND(RC[-3]<RC[-1],RC[-3]>=6,RC[-3]<7),75,IF(AND(RC[-3]<RC[-1],RC[-3]>=7,RC[-3]<8),70,IF(AND(RC[-3]<RC[-1],RC[-3]>=8,RC[-3]<9),65,IF(AND(RC[-3]<RC[-1],RC[-3]>=9,RC[-3]<10),60,IF(AND(RC[-3]<RC[-1],RC[-3]>=10,RC[-3]<11),55,IF(AND(RC[-3]<RC[-1],RC[-3]>=11,RC[-3]<12),50,IF(AND(RC[-3]<RC[-1],RC[-3]>=12,RC[-3]<13),45,IF(AND(RC[-3]<RC[-1],RC[-3]>=13,RC[-3]<14),40,IF(AND(RC[-3]<RC[-1],RC[-3]>=14,RC[-3]<15),35,IF(AND(RC[-3]<RC[-1],RC[-3]>=15,RC[-3]<16),30,IF(AND(RC[-3]<RC[-1],RC[-3]>=16,RC[-3]<17),25,IF(AND(RC[-3]<RC[-1],RC[-3]>=17,RC[-3]<18),20,IF(AND(RC[-3]<RC[-1],RC[-3]>=18,RC[-3]<19),15,IF(AND(RC[-3]<RC[-1],RC[-3]>=19,RC[-3]<20),10,IF(AND(RC[-3]<RC[-1],RC[-3]>=20,RC[-3]<21),5,IF(AND(RC[-3]<RC[-1],RC[-3]>=21),0,IF(AND(RC[-3]>RC[-1],RC[-3]>=2,RC[-3]<3),90,IF(AND(RC[-3]>RC[-1],RC[-3]>=3,RC[-3]<4),90,IF(AND(RC[-3]>RC[-1],RC[-3]>=4,RC[-3]<5),80,IF(AND(RC[-3]>RC[-1],RC[-3]>=5,RC[-3]<6),70,IF(AND(RC[-3]>RC[-1],RC[-3]>=6,RC[-3]<7),60,IF(AND(RC[-3]>RC[-1],RC[-3]>=7,RC[-3]<8),50,IF(AND(RC[-3]>RC[-1],RC[-3]>=8,RC[-3]<9),40,IF(AND(RC[-3]>RC[-1],RC[-3]>=9,RC[-3]<10),30,IF(AND(RC[-3]>RC[-1],RC[-3]>=10,RC[-3]<11),20,IF(AND(RC[-3]>RC[-1],RC[-3]>=11,RC[-3]<12),10,IF(AND(RC[-3]>RC[-1],RC[-3]>=12),0))))))))))))))))))))))))))))))))) -> 60 | H144: =IF(RC[-3]="","",IF(RC[-3]<0.3,100,IF(AND(RC[-3]>=0.3,RC[-3]>0.4),95,IF(AND(RC[-3]>=0.4,RC[-3]<0.5),90,IF(AND(RC[-3]>=0.5,RC[-3]<0.6),85,IF(AND(RC[-3]>=0.6,RC[-3]<0.7),80,IF(AND(RC[-3]>=0.6,RC[-3]<1),80,IF(AND(RC[-3]>1,RC[-3]<2),50,IF(RC[-3]>2,0))))))))) ->  | I144: =IF(RC[-1]="",RC[-2],0.7*RC[-1]+0.3*RC[-2]) -> 60
A145: ایران خودرو | B145: خودرو | C145: =VLOOKUP(RC[-1],Sheet1!R3C2:R802C3,2,FALSE) -> خودرو و قطعات | D145: =VLOOKUP(RC[-2],Sheet1!R3C2:R802C9,8,FALSE) -> -2.5849864130434783 | E145: =IF(VLOOKUP(RC[-3],Sheet1!R3C2:R803C11,10,FALSE)=0,"",VLOOKUP(Sheet2!RC[-3],Sheet1!R[1]C[-3]:R[801]C[6],10,FALSE)) ->  | F145: =Sheet1!R197C10 -> 53.061720219378913 | G145: =IF(RC[-3]<0,0,IF(AND(RC[-3]<RC[-1],RC[-3]<2),100,IF(AND(RC[-3]<RC[-1],RC[-3]>=2,RC[-3]<3),95,IF(AND(RC[-3]<RC[-1],RC[-3]>=3,RC[-3]<4),90,IF(AND(RC[-3]<RC[-1],RC[-3]>=4,RC[-3]<5),85,IF(AND(RC[-3]<RC[-1],RC[-3]>=5,RC[-3]<6),80,IF(AND(RC[-3]<RC[-1],RC[-3]>=6,RC[-3]<7),75,IF(AND(RC[-3]<RC[-1],RC[-3]>=7,RC[-3]<8),70,IF(AND(RC[-3]<RC[-1],RC[-3]>=8,RC[-3]<9),65,IF(AND(RC[-3]<RC[-1],RC[-3]>=9,RC[-3]<10),60,IF(AND(RC[-3]<RC[-1],RC[-3]>=10,RC[-3]<11),55,IF(AND(RC[-3]<RC[-1],RC[-3]>=11,RC[-3]<12),50,IF(AND(RC[-3]<RC[-1],RC[-3]>=12,RC[-3]<13),45,IF(AND(RC[-3]<RC[-1],RC[-3]>=13,RC[-3]<14),40,IF(AND(RC[-3]<RC[-1],RC[-3]>=14,RC[-3]<15),35,IF(AND(RC[-3]<RC[-1],RC[-3]>=15,RC[-3]<16),30,IF(AND(RC[-3]<RC[-1],RC[-3]>=16,RC[-3]<17),25,IF(AND(RC[-3]<RC[-1],RC[-3]>=17,RC[-3]<18),20,IF(AND(RC[-3]<RC[-1],RC[-3]>=18,RC[-3]<19),15,IF(AND(RC[-3]<RC[-1],RC[-3]>=19,RC[-3]<20),10,IF(AND(RC[-3]<RC[-1],RC[-3]>=20,RC[-3]<21),5,IF(AND(RC[-3]<RC[-1],RC[-3]>=21),0,IF(AND(RC[-3]>RC[-1],RC[-3]>=2,RC[-3]<3),90,IF(AND(RC[-3]>RC[-1],RC[-3]>=3,RC[-3]<4),90,IF(AND(RC[-3]>RC[-1],RC[-3]>=4,RC[-3]<5),80,IF(AND(RC[-3]>RC[-1],RC[-3]>=5,RC[-3]<6),70,IF(AND(RC[-3]>RC[-1],RC[-3]>=6,RC[-3]<7),60,IF(AND(RC[-3]>RC[-1],RC[-3]>=7,RC[-3]<8),50,IF(AND(RC[-3]>RC[-1],RC[-3]>=8,RC[-3]<9),40,IF(AND(RC[-3]>RC[-1],RC[-3]>=9,RC[-3]<10),30,IF(AND(RC[-3]>RC[-1],RC[-3]>=10,RC[-3]<11),20,IF(AND(RC[-3]>RC[-1],RC[-3]>=11,RC[-3]<12),10,IF(AND(RC[-3]>RC[-1],RC[-3]>=12),0))))))))))))))))))))))))))))))))) -> 0 | H145: =IF(RC[-3]="","",IF(RC[-3]<0.3,100,IF(AND(RC[-3]>=0.3,RC[-3]>0.4),95,IF(AND(RC[-3]>=0.4,RC[-3]<0.5),90,IF(AND(RC[-3]>=0.5,RC[-3]<0.6),85,IF(AND(RC[-3]>=0.6,RC[-3]<0.7),80,IF(AND(RC[-3]>=0.6,RC[-3]<1),80,IF(AND(RC[-3]>1,RC[-3]<2),50,IF(RC[-3]>2,0))))))))) ->  | I145: =IF(RC[-1]="",RC[-2],0.7*RC[-1]+0.3*RC[-2]) -> 0
A146: ایران خودرو دیزل | B146: خاور | C146: =VLOOKUP(RC[-1],Sheet1!R3C2:R802C3,2,FALSE) -> خودرو و قطعات | D146: =VLOOKUP(RC[-2],Sheet1!R3C2:R802C9,8,FALSE) -> 6 | E146: =IF(VLOOKUP(RC[-3],Sheet1!R3C2:R803C11,10,FALSE)=0,"",VLOOKUP(Sheet2!RC[-3],Sheet1!R[1]C[-3]:R[801]C[6],10,FALSE)) ->  | F146: =Sheet1!R197C10 -> 53.061720219378913 | G146: =IF(RC[-3]<0,0,IF(AND(RC[-3]<RC[-1],RC[-3]<2),100,IF(AND(RC[-3]<RC[-1],RC[-3]>=2,RC[-3]<3),95,IF(AND(RC[-3]<RC[-1],RC[-3]>=3,RC[-3]<4),90,IF(AND(RC[-3]<RC[-1],RC[-3]>=4,RC[-3]<5),85,IF(AND(RC[-3]<RC[-1],RC[-3]>=5,RC[-3]<6),80,IF(AND(RC[-3]<RC[-1],RC[-3]>=6,RC[-3]<7),75,IF(AND(RC[-3]<RC[-1],RC[-3]>=7,RC[-3]<8),70,IF(AND(RC[-3]<RC[-1],RC[-3]>=8,RC[-3]<9),65,IF(AND(RC[-3]<RC[-1],RC[-3]>=9,RC[-3]<10),60,IF(AND(RC[-3]<RC[-1],RC[-3]>=10,RC[-3]<11),55,IF(AND(RC[-3]<RC[-1],RC[-3]>=11,RC[-3]<12),50,IF(AND(RC[-3]<RC[-1],RC[-3]>=12,RC[-3]<13),45,IF(AND(RC[-3]<RC[-1],RC[-3]>=13,RC[-3]<14),40,IF(AND(RC[-3]<RC[-1],RC[-3]>=14,RC[-3]<15),35,IF(AND(RC[-3]<RC[-1],RC[-3]>=15,RC[-3]<16),30,IF(AND(RC[-3]<RC[-1],RC[-3]>=16,RC[-3]<17),25,IF(AND(RC[-3]<RC[-1],RC[-3]>=17,RC[-3]<18),20,IF(AND(RC[-3]<RC[-1],RC[-3]>=18,RC[-3]<19),15,IF(AND(RC[-3]<RC[-1],RC[-3]>=19,RC[-3]<20),10,IF(AND(RC[-3]<RC[-1],RC[-3]>=20,RC[-3]<21),5,IF(AND(RC[-3]<RC[-1],RC[-3]>=21),0,IF(AND(RC[-3]>RC[-1],RC[-3]>=2,RC[-3]<3),90,IF(AND(RC[-3]>RC[-1],RC[-3]>=3,RC[-3]<4),90,IF(AND(RC[-3]>RC[-1],RC[-3]>=4,RC[-3]<5),80,IF(AND(RC[-3]>RC[-1],RC[-3]>=5,RC[-3]<6),70,IF(AND(RC[-3]>RC[-1],RC[-3]>=6,RC[-3]<7),60,IF(AND(RC[-3]>RC[-1],RC[-3]>=7,RC[-3]<8),50,IF(AND(RC[-3]>RC[-1],RC[-3]>=8,RC[-3]<9),40,IF(AND(RC[-3]>RC[-1],RC[-3]>=9,RC[-3]<10),30,IF(AND(RC[-3]>RC[-1],RC[-3]>=10,RC[-3]<11),20,IF(AND(RC[-3]>RC[-1],RC[-3]>=11,RC[-3]<12),10,IF(AND(RC[-3]>RC[-1],RC[-3]>=12),0))))))))))))))))))))))))))))))))) -> 75 | H146: =IF(RC[-3]="","",IF(RC[-3]<0.3,100,IF(AND(RC[-3]>=0.3,RC[-3]>0.4),95,IF(AND(RC[-3]>=0.4,RC[-3]<0.5),90,IF(AND(RC[-3]>=0.5,RC[-3]<0.6),85,IF(AND(RC[-3]>=0.6,RC[-3]<0.7),80,IF(AND(RC[-3]>=0.6,RC[-3]<1),80,IF(AND(RC[-3]>1,RC[-3]<2),50,IF(RC[-3]>2,0))))))))) ->  | I146: =IF(RC[-1]="",RC[-2],0.7*RC[-1]+0.3*RC[-2]) -> 75
A147: ایرکا پارت صنعت | B147: خکار | C147: =VLOOKUP(RC[-1],Sheet1!R3C2:R802C3,2,FALSE) -> خودرو و قطعات | D147: =VLOOKUP(RC[-2],Sheet1!R3C2:R802C9,8,FALSE) -> 5.3846148142490984 | E147: =IF(VLOOKUP(RC[-3],Sheet1!R3C2:R803C11,10,FALSE)=0,"",VLOOKUP(Sheet2!RC[-3],Sheet1!R[1]C[-3]:R[801]C[6],10,FALSE)) ->  | F147: =Sheet1!R197C10 -> 53.061720219378913 | G147: =IF(RC[-3]<0,0,IF(AND(RC[-3]<RC[-1],RC[-3]<2),100,IF(AND(RC[-3]<RC[-1],RC[-3]>=2,RC[-3]<3),95,IF(AND(RC[-3]<RC[-1],RC[-3]>=3,RC[-3]<4),90,IF(AND(RC[-3]<RC[-1],RC[-3]>=4,RC[-3]<5),85,IF(AND(RC[-3]<RC[-1],RC[-3]>=5,RC[-3]<6),80,IF(AND(RC[-3]<RC[-1],RC[-3]>=6,RC[-3]<7),75,IF(AND(RC[-3]<RC[-1],RC[-3]>=7,RC[-3]<8),70,IF(AND(RC[-3]<RC[-1],RC[-3]>=8,RC[-3]<9),65,IF(AND(RC[-3]<RC[-1],RC[-3]>=9,RC[-3]<10),60,IF(AND(RC[-3]<RC[-1],RC[-3]>=10,RC[-3]<11),55,IF(AND(RC[-3]<RC[-1],RC[-3]>=11,RC[-3]<12),50,IF(AND(RC[-3]<RC[-1],RC[-3]>=12,RC[-3]<13),45,IF(AND(RC[-3]<RC[-1],RC[-3]>=13,RC[-3]<14),40,IF(AND(RC[-3]<RC[-1],RC[-3]>=14,RC[-3]<15),35,IF(AND(RC[-3]<RC[-1],RC[-3]>=15,RC[-3]<16),30,IF(AND(RC[-3]<RC[-1],RC[-3]>=16,RC[-3]<17),25,IF(AND(RC[-3]<RC[-1],RC[-3]>=17,RC[-3]<18),20,IF(AND(RC[-3]<RC[-1],RC[-3]>=18,RC[-3]<19),15,IF(AND(RC[-3]<RC[-1],RC[-3]>=19,RC[-3]<20),10,IF(AND(RC[-3]<RC[-1],RC[-3]>=20,RC[-3]<21),5,IF(AND(RC[-3]<RC[-1],RC[-3]>=21),0,IF(AND(RC[-3]>RC[-1],RC[-3]>=2,RC[-3]<3),90,IF(AND(RC[-3]>RC[-1],RC[-3]>=3,RC[-3]<4),90,IF(AND(RC[-3]>RC[-1],RC[-3]>=4,RC[-3]<5),80,IF(AND(RC[-3]>RC[-1],RC[-3]>=5,RC[-3]<6),70,IF(AND(RC[-3]>RC[-1],RC[-3]>=6,RC[-3]<7),60,IF(AND(RC[-3]>RC[-1],RC[-3]>=7,RC[-3]<8),50,IF(AND(RC[-3]>RC[-1],RC[-3]>=8,RC[-3]<9),40,IF(AND(RC[-3]>RC[-1],RC[-3]>=9,RC[-3]<10),30,IF(AND(RC[-3]>RC[-1],RC[-3]>=10,RC[-3]<11),20,IF(AND(RC[-3]>RC[-1],RC[-3]>=11,RC[-3]<12),10,IF(AND(RC[-3]>RC[-1],RC[-3]>=12),0))))))))))))))))))))))))))))))))) -> 80 | H147: =IF(RC[-3]="","",IF(RC[-3]<0.3,100,IF(AND(RC[-3]>=0.3,RC[-3]>0.4),95,IF(AND(RC[-3]>=0.4,RC[-3]<0.5),90,IF(AND(RC[-3]>=0.5,RC[-3]<0.6),85,IF(AND(RC[-3]>=0.6,RC[-3]<0.7),80,IF(AND(RC[-3]>=0.6,RC[-3]<1),80,IF(AND(RC[-3]>1,RC[-3]<2),50,IF(RC[-3]>2,0))))))))) ->  | I147: =IF(RC[-1]="",RC[-2],0.7*RC[-1]+0.3*RC[-2]) -> 80
A148: بنیان دیزل | B148: خبنیان | C148: =VLOOKUP(RC[-1],Sheet1!R3C2:R802C3,2,FALSE) -> خودرو و قطعات | D148: =VLOOKUP(RC[-2],Sheet1!R3C2:R802C9,8,FALSE) -> 998.35484230208999 | E148: =IF(VLOOKUP(RC[-3],Sheet1!R3C2:R803C11,10,FALSE)=0,"",VLOOKUP(Sheet2!RC[-3],Sheet1!R[1]C[-3]:R[801]C[6],10,FALSE)) ->  | F148: =Sheet1!R197C10 -> 53.061720219378913 | G148: =IF(RC[-3]<0,0,IF(AND(RC[-3]<RC[-1],RC[-3]<2),100,IF(AND(RC[-3]<RC[-1],RC[-3]>=2,RC[-3]<3),95,IF(AND(RC[-3]<RC[-1],RC[-3]>=3,RC[-3]<4),90,IF(AND(RC[-3]<RC[-1],RC[-3]>=4,RC[-3]<5),85,IF(AND(RC[-3]<RC[-1],RC[-3]>=5,RC[-3]<6),80,IF(AND(RC[-3]<RC[-1],RC[-3]>=6,RC[-3]<7),75,IF(AND(RC[-3]<RC[-1],RC[-3]>=7,RC[-3]<8),70,IF(AND(RC[-3]<RC[-1],RC[-3]>=8,RC[-3]<9),65,IF(AND(RC[-3]<RC[-1],RC[-3]>=9,RC[-3]<10),60,IF(AND(RC[-3]<RC[-1],RC[-3]>=10,RC[-3]<11),55,IF(AND(RC[-3]<RC[-1],RC[-3]>=11,RC[-3]<12),50,IF(AND(RC[-3]<RC[-1],RC[-3]>=12,RC[-3]<13),45,IF(AND(RC[-3]<RC[-1],RC[-3]>=13,RC[-3]<14),40,IF(AND(RC[-3]<RC[-1],RC[-3]>=14,RC[-3]<15),35,IF(AND(RC[-3]<RC[-1],RC[-3]>=15,RC[-3]<16),30,IF(AND(RC[-3]<RC[-1],RC[-3]>=16,RC[-3]<17),25,IF(AND(RC[-3]<RC[-1],RC[-3]>=17,RC[-3]<18),20,IF(AND(RC[-3]<RC[-1],RC[-3]>=18,RC[-3]<19),15,IF(AND(RC[-3]<RC[-1],RC[-3]>=19,RC[-3]<20),10,IF(AND(RC[-3]<RC[-1],RC[-3]>=20,RC[-3]<21),5,IF(AND(RC[-3]<RC[-1],RC[-3]>=21),0,IF(AND(RC[-3]>RC[-1],RC[-3]>=2,RC[-3]<3),90,IF(AND(RC[-3]>RC[-1],RC[-3]>=3,RC[-3]<4),90,IF(AND(RC[-3]>RC[-1],RC[-3]>=4,RC[-3]<5),80,IF(AND(RC[-3]>RC[-1],RC[-3]>=5,RC[-3]<6),70,IF(AND(RC[-3]>RC[-1],RC[-3]>=6,RC[-3]<7),60,IF(AND(RC[-3]>RC[-1],RC[-3]>=7,RC[-3]<8),50,IF(AND(RC[-3]>RC[-1],RC[-3]>=8,RC[-3]<9),40,IF(AND(RC[-3]>RC[-1],RC[-3]>=9,RC[-3]<10),30,IF(AND(RC[-3]>RC[-1],RC[-3]>=10,RC[-3]<11),20,IF(AND(RC[-3]>RC[-1],RC[-3]>=11,RC[-3]<12),10,IF(AND(RC[-3]>RC[-1],RC[-3]>=12),0))))))))))))))))))))))))))))))))) -> 0 | H148: =IF(RC[-3]="","",IF(RC[-3]<0.3,100,IF(AND(RC[-3]>=0.3,RC[-3]>0.4),95,IF(AND(RC[-3]>=0.4,RC[-3]<0.5),90,IF(AND(RC[-3]>=0.5,RC[-3]<0.6),85,IF(AND(RC[-3]>=0.6,RC[-3]<0.7),80,IF(AND(RC[-3]>=0.6,RC[-3]<1),80,IF(AND(RC[-3]>1,RC[-3]<2),50,IF(RC[-3]>2,0))))))))) ->  | I148: =IF(RC[-1]="",RC[-2],0.7*RC[-1]+0.3*RC[-2]) -> 0
A149: بهمن دیزل | B149: خدیزل | C149: =VLOOKUP(RC[-1],Sheet1!R3C2:R802C3,2,FALSE) -> خودرو و قطعات | D149: =VLOOKUP(RC[-2],Sheet1!R3C2:R802C9,8,FALSE) -> 4.0052708227675007 | E149: =IF(VLOOKUP(RC[-3],Sheet1!R3C2:R803C11,10,FALSE)=0,"",VLOOKUP(Sheet2!RC[-3],Sheet1!R[1]C[-3]:R[801]C[6],10,FALSE)) ->  | F149: =Sheet1!R197C10 -> 53.061720219378913 | G149: =IF(RC[-3]<0,0,IF(AND(RC[-3]<RC[-1],RC[-3]<2),100,IF(AND(RC[-3]<RC[-1],RC[-3]>=2,RC[-3]<3),95,IF(AND(RC[-3]<RC[-1],RC[-3]>=3,RC[-3]<4),90,IF(AND(RC[-3]<RC[-1],RC[-3]>=4,RC[-3]<5),85,IF(AND(RC[-3]<RC[-1],RC[-3]>=5,RC[-3]<6),80,IF(AND(RC[-3]<RC[-1],RC[-3]>=6,RC[-3]<7),75,IF(AND(RC[-3]<RC[-1],RC[-3]>=7,RC[-3]<8),70,IF(AND(RC[-3]<RC[-1],RC[-3]>=8,RC[-3]<9),65,IF(AND(RC[-3]<RC[-1],RC[-3]>=9,RC[-3]<10),60,IF(AND(RC[-3]<RC[-1],RC[-3]>=10,RC[-3]<11),55,IF(AND(RC[-3]<RC[-1],RC[-3]>=11,RC[-3]<12),50,IF(AND(RC[-3]<RC[-1],RC[-3]>=12,RC[-3]<13),45,IF(AND(RC[-3]<RC[-1],RC[-3]>=13,RC[-3]<14),40,IF(AND(RC[-3]<RC[-1],RC[-3]>=14,RC[-3]<15),35,IF(AND(RC[-3]<RC[-1],RC[-3]>=15,RC[-3]<16),30,IF(AND(RC[-3]<RC[-1],RC[-3]>=16,RC[-3]<17),25,IF(AND(RC[-3]<RC[-1],RC[-3]>=17,RC[-3]<18),20,IF(AND(RC[-3]<RC[-1],RC[-3]>=18,RC[-3]<19),15,IF(AND(RC[-3]<RC[-1],RC[-3]>=19,RC[-3]<20),10,IF(AND(RC[-3]<RC[-1],RC[-3]>=20,RC[-3]<21),5,IF(AND(RC[-3]<RC[-1],RC[-3]>=21),0,IF(AND(RC[-3]>RC[-1],RC[-3]>=2,RC[-3]<3),90,IF(AND(RC[-3]>RC[-1],RC[-3]>=3,RC[-3]<4),90,IF(AND(RC[-3]>RC[-1],RC[-3]>=4,RC[-3]<5),80,IF(AND(RC[-3]>RC[-1],RC[-3]>=5,RC[-3]<6),70,IF(AND(RC[-3]>RC[-1],RC[-3]>=6,RC[-3]<7),60,IF(AND(RC[-3]>RC[-1],RC[-3]>=7,RC[-3]<8),50,IF(AND(RC[-3]>RC[-1],RC[-3]>=8,RC[-3]<9),40,IF(AND(RC[-3]>RC[-1],RC[-3]>=9,RC[-3]<10),30,IF(AND(RC[-3]>RC[-1],RC[-3]>=10,RC[-3]<11),20,IF(AND(RC[-3]>RC[-1],RC[-3]>=11,RC[-3]<12),10,IF(AND(RC[-3]>RC[-1],RC[-3]>=12),0))))))))))))))))))))))))))))))))) -> 85 | H149: =IF(RC[-3]="","",IF(RC[-3]<0.3,100,IF(AND(RC[-3]>=0.3,RC[-3]>0.4),95,IF(AND(RC[-3]>=0.4,RC[-3]<0.5),90,IF(AND(RC[-3]>=0.5,RC[-3]<0.6),85,IF(AND(RC[-3]>=0.6,RC[-3]<0.7),80,IF(AND(RC[-3]>=0.6,RC[-3]<1),80,IF(AND(RC[-3]>1,RC[-3]<2),50,IF(RC[-3]>2,0))))))))) ->  | I149: =IF(RC[-1]="",RC[-2],0.7*RC[-1]+0.3*RC[-2]) -> 85
A150: توسعه و عمران شهرستان نائین | B150: خعمرا | C150: =VLOOKUP(RC[-1],Sheet1!R3C2:R802C3,2,FALSE) -> خودرو و قطعات | D150: =VLOOKUP(RC[-2],Sheet1!R3C2:R802C9,8,FALSE) -> 27.580683991729479 | E150: =IF(VLOOKUP(RC[-3],Sheet1!R3C2:R803C11,10,FALSE)=0,"",VLOOKUP(Sheet2!RC[-3],Sheet1!R[1]C[-3]:R[801]C[6],10,FALSE)) ->  | F150: =Sheet1!R197C10 -> 53.061720219378913 | G150: =IF(RC[-3]<0,0,IF(AND(RC[-3]<RC[-1],RC[-3]<2),100,IF(AND(RC[-3]<RC[-1],RC[-3]>=2,RC[-3]<3),95,IF(AND(RC[-3]<RC[-1],RC[-3]>=3,RC[-3]<4),90,IF(AND(RC[-3]<RC[-1],RC[-3]>=4,RC[-3]<5),85,IF(AND(RC[-3]<RC[-1],RC[-3]>=5,RC[-3]<6),80,IF(AND(RC[-3]<RC[-1],RC[-3]>=6,RC[-3]<7),75,IF(AND(RC[-3]<RC[-1],RC[-3]>=7,RC[-3]<8),70,IF(AND(RC[-3]<RC[-1],RC[-3]>=8,RC[-3]<9),65,IF(AND(RC[-3]<RC[-1],RC[-3]>=9,RC[-3]<10),60,IF(AND(RC[-3]<RC[-1],RC[-3]>=10,RC[-3]<11),55,IF(AND(RC[-3]<RC[-1],RC[-3]>=11,RC[-3]<12),50,IF(AND(RC[-3]<RC[-1],RC[-3]>=12,RC[-3]<13),45,IF(AND(RC[-3]<RC[-1],RC[-3]>=13,RC[-3]<14),40,IF(AND(RC[-3]<RC[-1],RC[-3]>=14,RC[-3]<15),35,IF(AND(RC[-3]<RC[-1],RC[-3]>=15,RC[-3]<16),30,IF(AND(RC[-3]<RC[-1],RC[-3]>=16,RC[-3]<17),25,IF(AND(RC[-3]<RC[-1],RC[-3]>=17,RC[-3]<18),20,IF(AND(RC[-3]<RC[-1],RC[-3]>=18,RC[-3]<19),15,IF(AND(RC[-3]<RC[-1],RC[-3]>=19,RC[-3]<20),10,IF(AND(RC[-3]<RC[-1],RC[-3]>=20,RC[-3]<21),5,IF(AND(RC[-3]<RC[-1],RC[-3]>=21),0,IF(AND(RC[-3]>RC[-1],RC[-3]>=2,RC[-3]<3),90,IF(AND(RC[-3]>RC[-1],RC[-3]>=3,RC[-3]<4),90,IF(AND(RC[-3]>RC[-1],RC[-3]>=4,RC[-3]<5),80,IF(AND(RC[-3]>RC[-1],RC[-3]>=5,RC[-3]<6),70,IF(AND(RC[-3]>RC[-1],RC[-3]>=6,RC[-3]<7),60,IF(AND(RC[-3]>RC[-1],RC[-3]>=7,RC[-3]<8),50,IF(AND(RC[-3]>RC[-1],RC[-3]>=8,RC[-3]<9),40,IF(AND(RC[-3]>RC[-1],RC[-3]>=9,RC[-3]<10),30,IF(AND(RC[-3]>RC[-1],RC[-3]>=10,RC[-3]<11),20,IF(AND(RC[-3]>RC[-1],RC[-3]>=11,RC[-3]<12),10,IF(AND(RC[-3]>RC[-1],RC[-3]>=12),0))))))))))))))))))))))))))))))))) -> 0 | H150: =IF(RC[-3]="","",IF(RC[-3]<0.3,100,IF(AND(RC[-3]>=0.3,RC[-3]>0.4),95,IF(AND(RC[-3]>=0.4,RC[-3]<0.5),90,IF(AND(RC[-3]>=0.5,RC[-3]<0.6),85,IF(AND(RC[-3]>=0.6,RC[-3]<0.7),80,IF(AND(RC[-3]>=0.6,RC[-3]<1),80,IF(AND(RC[-3]>1,RC[-3]<2),50,IF(RC[-3]>2,0))))))))) ->  | I150: =IF(RC[-1]="",RC[-2],0.7*RC[-1]+0.3*RC[-2]) -> 0
A151: چرخشگر | B151: خچرخش | C151: =VLOOKUP(RC[-1],Sheet1!R3C2:R802C3,2,FALSE) -> خودرو و قطعات | D151: =VLOOKUP(RC[-2],Sheet1!R3C2:R802C9,8,FALSE) -> 25.076598220279912 | E151: =IF(VLOOKUP(RC[-3],Sheet1!R3C2:R803C11,10,FALSE)=0,"",VLOOKUP(Sheet2!RC[-3],Sheet1!R[1]C[-3]:R[801]C[6],10,FALSE)) ->  | F151: =Sheet1!R197C10 -> 53.061720219378913 | G151: =IF(RC[-3]<0,0,IF(AND(RC[-3]<RC[-1],RC[-3]<2),100,IF(AND(RC[-3]<RC[-1],RC[-3]>=2,RC[-3]<3),95,IF(AND(RC[-3]<RC[-1],RC[-3]>=3,RC[-3]<4),90,IF(AND(RC[-3]<RC[-1],RC[-3]>=4,RC[-3]<5),85,IF(AND(RC[-3]<RC[-1],RC[-3]>=5,RC[-3]<6),80,IF(AND(RC[-3]<RC[-1],RC[-3]>=6,RC[-3]<7),75,IF(AND(RC[-3]<RC[-1],RC[-3]>=7,RC[-3]<8),70,IF(AND(RC[-3]<RC[-1],RC[-3]>=8,RC[-3]<9),65,IF(AND(RC[-3]<RC[-1],RC[-3]>=9,RC[-3]<10),60,IF(AND(RC[-3]<RC[-1],RC[-3]>=10,RC[-3]<11),55,IF(AND(RC[-3]<RC[-1],RC[-3]>=11,RC[-3]<12),50,IF(AND(RC[-3]<RC[-1],RC[-3]>=12,RC[-3]<13),45,IF(AND(RC[-3]<RC[-1],RC[-3]>=13,RC[-3]<14),40,IF(AND(RC[-3]<RC[-1],RC[-3]>=14,RC[-3]<15),35,IF(AND(RC[-3]<RC[-1],RC[-3]>=15,RC[-3]<16),30,IF(AND(RC[-3]<RC[-1],RC[-3]>=16,RC[-3]<17),25,IF(AND(RC[-3]<RC[-1],RC[-3]>=17,RC[-3]<18),20,IF(AND(RC[-3]<RC[-1],RC[-3]>=18,RC[-3]<19),15,IF(AND(RC[-3]<RC[-1],RC[-3]>=19,RC[-3]<20),10,IF(AND(RC[-3]<RC[-1],RC[-3]>=20,RC[-3]<21),5,IF(AND(RC[-3]<RC[-1],RC[-3]>=21),0,IF(AND(RC[-3]>RC[-1],RC[-3]>=2,RC[-3]<3),90,IF(AND(RC[-3]>RC[-1],RC[-3]>=3,RC[-3]<4),90,IF(AND(RC[-3]>RC[-1],RC[-3]>=4,RC[-3]<5),80,IF(AND(RC[-3]>RC[-1],RC[-3]>=5,RC[-3]<6),70,IF(AND(RC[-3]>RC[-1],RC[-3]>=6,RC[-3]<7),60,IF(AND(RC[-3]>RC[-1],RC[-3]>=7,RC[-3]<8),50,IF(AND(RC[-3]>RC[-1],RC[-3]>=8,RC[-3]<9),40,IF(AND(RC[-3]>RC[-1],RC[-3]>=9,RC[-3]<10),30,IF(AND(RC[-3]>RC[-1],RC[-3]>=10,RC[-3]<11),20,IF(AND(RC[-3]>RC[-1],RC[-3]>=11,RC[-3]<12),10,IF(AND(RC[-3]>RC[-1],RC[-3]>=12),0))))))))))))))))))))))))))))))))) -> 0 | H151: =IF(RC[-3]="","",IF(RC[-3]<0.3,100,IF(AND(RC[-3]>=0.3,RC[-3]>0.4),95,IF(AND(RC[-3]>=0.4,RC[-3]<0.5),90,IF(AND(RC[-3]>=0.5,RC[-3]<0.6),85,IF(AND(RC[-3]>=0.6,RC[-3]<0.7),80,IF(AND(RC[-3]>=0.6,RC[-3]<1),80,IF(AND(RC[-3]>1,RC[-3]<2),50,IF(RC[-3]>2,0))))))))) ->  | I151: =IF(RC[-1]="",RC[-2],0.7*RC[-1]+0.3*RC[-2]) -> 0
A152: رادیاتور ایران | B152: ختور | C152: =VLOOKUP(RC[-1],Sheet1!R3C2:R802C3,2,FALSE) -> خودرو و قطعات | D152: =VLOOKUP(RC[-2],Sheet1!R3C2:R802C9,8,FALSE) -> 3.980177997399819 | E152: =IF(VLOOKUP(RC[-3],Sheet1!R3C2:R803C11,10,FALSE)=0,"",VLOOKUP(Sheet2!RC[-3],Sheet1!R[1]C[-3]:R[801]C[6],10,FALSE)) ->  | F152: =Sheet1!R197C10 -> 53.061720219378913 | G152: =IF(RC[-3]<0,0,IF(AND(RC[-3]<RC[-1],RC[-3]<2),100,IF(AND(RC[-3]<RC[-1],RC[-3]>=2,RC[-3]<3),95,IF(AND(RC[-3]<RC[-1],RC[-3]>=3,RC[-3]<4),90,IF(AND(RC[-3]<RC[-1],RC[-3]>=4,RC[-3]<5),85,IF(AND(RC[-3]<RC[-1],RC[-3]>=5,RC[-3]<6),80,IF(AND(RC[-3]<RC[-1],RC[-3]>=6,RC[-3]<7),75,IF(AND(RC[-3]<RC[-1],RC[-3]>=7,RC[-3]<8),70,IF(AND(RC[-3]<RC[-1],RC[-3]>=8,RC[-3]<9),65,IF(AND(RC[-3]<RC[-1],RC[-3]>=9,RC[-3]<10),60,IF(AND(RC[-3]<RC[-1],RC[-3]>=10,RC[-3]<11),55,IF(AND(RC[-3]<RC[-1],RC[-3]>=11,RC[-3]<12),50,IF(AND(RC[-3]<RC[-1],RC[-3]>=12,RC[-3]<13),45,IF(AND(RC[-3]<RC[-1],RC[-3]>=13,RC[-3]<14),40,IF(AND(RC[-3]<RC[-1],RC[-3]>=14,RC[-3]<15),35,IF(AND(RC[-3]<RC[-1],RC[-3]>=15,RC[-3]<16),30,IF(AND(RC[-3]<RC[-1],RC[-3]>=16,RC[-3]<17),25,IF(AND(RC[-3]<RC[-1],RC[-3]>=17,RC[-3]<18),20,IF(AND(RC[-3]<RC[-1],RC[-3]>=18,RC[-3]<19),15,IF(AND(RC[-3]<RC[-1],RC[-3]>=19,RC[-3]<20),10,IF(AND(RC[-3]<RC[-1],RC[-3]>=20,RC[-3]<21),5,IF(AND(RC[-3]<RC[-1],RC[-3]>=21),0,IF(AND(RC[-3]>RC[-1],RC[-3]>=2,RC[-3]<3),90,IF(AND(RC[-3]>RC[-1],RC[-3]>=3,RC[-3]<4),90,IF(AND(RC[-3]>RC[-1],RC[-3]>=4,RC[-3]<5),80,IF(AND(RC[-3]>RC[-1],RC[-3]>=5,RC[-3]<6),70,IF(AND(RC[-3]>RC[-1],RC[-3]>=6,RC[-3]<7),60,IF(AND(RC[-3]>RC[-1],RC[-3]>=7,RC[-3]<8),50,IF(AND(RC[-3]>RC[-1],RC[-3]>=8,RC[-3]<9),40,IF(AND(RC[-3]>RC[-1],RC[-3]>=9,RC[-3]<10),30,IF(AND(RC[-3]>RC[-1],RC[-3]>=10,RC[-3]<11),20,IF(AND(RC[-3]>RC[-1],RC[-3]>=11,RC[-3]<12),10,IF(AND(RC[-3]>RC[-1],RC[-3]>=12),0))))))))))))))))))))))))))))))))) -> 90 | H152: =IF(RC[-3]="","",IF(RC[-3]<0.3,100,IF(AND(RC[-3]>=0.3,RC[-3]>0.4),95,IF(AND(RC[-3]>=0.4,RC[-3]<0.5),90,IF(AND(RC[-3]>=0.5,RC[-3]<0.6),85,IF(AND(RC[-3]>=0.6,RC[-3]<0.7),80,IF(AND(RC[-3]>=0.6,RC[-3]<1),80,IF(AND(RC[-3]>1,RC[-3]<2),50,IF(RC[-3]>2,0))))))))) ->  | I152: =IF(RC[-1]="",RC[-2],0.7*RC[-1]+0.3*RC[-2]) -> 90
A153: ریخته گری تراکتور | B153: ختراک | C153: =VLOOKUP(RC[-1],Sheet1!R3C2:R802C3,2,FALSE) -> خودرو و قطعات | D153: =VLOOKUP(RC[-2],Sheet1!R3C2:R802C9,8,FALSE) -> 8.4484111490129852 | E153: =IF(VLOOKUP(RC[-3],Sheet1!R3C2:R803C11,10,FALSE)=0,"",VLOOKUP(Sheet2!RC[-3],Sheet1!R[1]C[-3]:R[801]C[6],10,FALSE)) ->  | F153: =Sheet1!R197C10 -> 53.061720219378913 | G153: =IF(RC[-3]<0,0,IF(AND(RC[-3]<RC[-1],RC[-3]<2),100,IF(AND(RC[-3]<RC[-1],RC[-3]>=2,RC[-3]<3),95,IF(AND(RC[-3]<RC[-1],RC[-3]>=3,RC[-3]<4),90,IF(AND(RC[-3]<RC[-1],RC[-3]>=4,RC[-3]<5),85,IF(AND(RC[-3]<RC[-1],RC[-3]>=5,RC[-3]<6),80,IF(AND(RC[-3]<RC[-1],RC[-3]>=6,RC[-3]<7),75,IF(AND(RC[-3]<RC[-1],RC[-3]>=7,RC[-3]<8),70,IF(AND(RC[-3]<RC[-1],RC[-3]>=8,RC[-3]<9),65,IF(AND(RC[-3]<RC[-1],RC[-3]>=9,RC[-3]<10),60,IF(AND(RC[-3]<RC[-1],RC[-3]>=10,RC[-3]<11),55,IF(AND(RC[-3]<RC[-1],RC[-3]>=11,RC[-3]<12),50,IF(AND(RC[-3]<RC[-1],RC[-3]>=12,RC[-3]<13),45,IF(AND(RC[-3]<RC[-1],RC[-3]>=13,RC[-3]<14),40,IF(AND(RC[-3]<RC[-1],RC[-3]>=14,RC[-3]<15),35,IF(AND(RC[-3]<RC[-1],RC[-3]>=15,RC[-3]<16),30,IF(AND(RC[-3]<RC[-1],RC[-3]>=16,RC[-3]<17),25,IF(AND(RC[-3]<RC[-1],RC[-3]>=17,RC[-3]<18),20,IF(AND(RC[-3]<RC[-1],RC[-3]>=18,RC[-3]<19),15,IF(AND(RC[-3]<RC[-1],RC[-3]>=19,RC[-3]<20),10,IF(AND(RC[-3]<RC[-1],RC[-3]>=20,RC[-3]<21),5,IF(AND(RC[-3]<RC[-1],RC[-3]>=21),0,IF(AND(RC[-3]>RC[-1],RC[-3]>=2,RC[-3]<3),90,IF(AND(RC[-3]>RC[-1],RC[-3]>=3,RC[-3]<4),90,IF(AND(RC[-3]>RC[-1],RC[-3]>=4,RC[-3]<5),80,IF(AND(RC[-3]>RC[-1],RC[-3]>=5,RC[-3]<6),70,IF(AND(RC[-3]>RC[-1],RC[-3]>=6,RC[-3]<7),60,IF(AND(RC[-3]>RC[-1],RC[-3]>=7,RC[-3]<8),50,IF(AND(RC[-3]>RC[-1],RC[-3]>=8,RC[-3]<9),40,IF(AND(RC[-3]>RC[-1],RC[-3]>=9,RC[-3]<10),30,IF(AND(RC[-3]>RC[-1],RC[-3]>=10,RC[-3]<11),20,IF(AND(RC[-3]>RC[-1],RC[-3]>=11,RC[-3]<12),10,IF(AND(RC[-3]>RC[-1],RC[-3]>=12),0))))))))))))))))))))))))))))))))) -> 65 | H153: =IF(RC[-3]="","",IF(RC[-3]<0.3,100,IF(AND(RC[-3]>=0.3,RC[-3]>0.4),95,IF(AND(RC[-3]>=0.4,RC[-3]<0.5),90,IF(AND(RC[-3]>=0.5,RC[-3]<0.6),85,IF(AND(RC[-3]>=0.6,RC[-3]<0.7),80,IF(AND(RC[-3]>=0.6,RC[-3]<1),80,IF(AND(RC[-3]>1,RC[-3]<2),50,IF(RC[-3]>2,0))))))))) ->  | I153: =IF(RC[-1]="",RC[-2],0.7*RC[-1]+0.3*RC[-2]) -> 65
A154: رینگ سازی مشهد | B154: خرینگ | C154: =VLOOKUP(RC[-1],Sheet1!R3C2:R802C3,2,FALSE) -> خودرو و قطعات | D154: =VLOOKUP(RC[-2],Sheet1!R3C2:R802C9,8,FALSE) -> 11.023336599885802 | E154: =IF(VLOOKUP(RC[-3],Sheet1!R3C2:R803C11,10,FALSE)=0,"",VLOOKUP(Sheet2!RC[-3],Sheet1!R[1]C[-3]:R[801]C[6],10,FALSE)) ->  | F154: =Sheet1!R197C10 -> 53.061720219378913 | G154: =IF(RC[-3]<0,0,IF(AND(RC[-3]<RC[-1],RC[-3]<2),100,IF(AND(RC[-3]<RC[-1],RC[-3]>=2,RC[-3]<3),95,IF(AND(RC[-3]<RC[-1],RC[-3]>=3,RC[-3]<4),90,IF(AND(RC[-3]<RC[-1],RC[-3]>=4,RC[-3]<5),85,IF(AND(RC[-3]<RC[-1],RC[-3]>=5,RC[-3]<6),80,IF(AND(RC[-3]<RC[-1],RC[-3]>=6,RC[-3]<7),75,IF(AND(RC[-3]<RC[-1],RC[-3]>=7,RC[-3]<8),70,IF(AND(RC[-3]<RC[-1],RC[-3]>=8,RC[-3]<9),65,IF(AND(RC[-3]<RC[-1],RC[-3]>=9,RC[-3]<10),60,IF(AND(RC[-3]<RC[-1],RC[-3]>=10,RC[-3]<11),55,IF(AND(RC[-3]<RC[-1],RC[-3]>=11,RC[-3]<12),50,IF(AND(RC[-3]<RC[-1],RC[-3]>=12,RC[-3]<13),45,IF(AND(RC[-3]<RC[-1],RC[-3]>=13,RC[-3]<14),40,IF(AND(RC[-3]<RC[-1],RC[-3]>=14,RC[-3]<15),35,IF(AND(RC[-3]<RC[-1],RC[-3]>=15,RC[-3]<16),30,IF(AND(RC[-3]<RC[-1],RC[-3]>=16,RC[-3]<17),25,IF(AND(RC[-3]<RC[-1],RC[-3]>=17,RC[-3]<18),20,IF(AND(RC[-3]<RC[-1],RC[-3]>=18,RC[-3]<19),15,IF(AND(RC[-3]<RC[-1],RC[-3]>=19,RC[-3]<20),10,IF(AND(RC[-3]<RC[-1],RC[-3]>=20,RC[-3]<21),5,IF(AND(RC[-3]<RC[-1],RC[-3]>=21),0,IF(AND(RC[-3]>RC[-1],RC[-3]>=2,RC[-3]<3),90,IF(AND(RC[-3]>RC[-1],RC[-3]>=3,RC[-3]<4),90,IF(AND(RC[-3]>RC[-1],RC[-3]>=4,RC[-3]<5),80,IF(AND(RC[-3]>RC[-1],RC[-3]>=5,RC[-3]<6),70,IF(AND(RC[-3]>RC[-1],RC[-3]>=6,RC[-3]<7),60,IF(AND(RC[-3]>RC[-1],RC[-3]>=7,RC[-3]<8),50,IF(AND(RC[-3]>RC[-1],RC[-3]>=8,RC[-3]<9),40,IF(AND(RC[-3]>RC[-1],RC[-3]>=9,RC[-3]<10),30,IF(AND(RC[-3]>RC[-1],RC[-3]>=10,RC[-3]<11),20,IF(AND(RC[-3]>RC[-1],RC[-3]>=11,RC[-3]<12),10,IF(AND(RC[-3]>RC[-1],RC[-3]>=12),0))))))))))))))))))))))))))))))))) -> 50 | H154: =IF(RC[-3]="","",IF(RC[-3]<0.3,100,IF(AND(RC[-3]>=0.3,RC[-3]>0.4),95,IF(AND(RC[-3]>=0.4,RC[-3]<0.5),90,IF(AND(RC[-3]>=0.5,RC[-3]<0.6),85,IF(AND(RC[-3]>=0.6,RC[-3]<0.7),80,IF(AND(RC[-3]>=0.6,RC[-3]<1),80,IF(AND(RC[-3]>1,RC[-3]<2),50,IF(RC[-3]>2,0))))))))) ->  | I154: =IF(RC[-1]="",RC[-2],0.7*RC[-1]+0.3*RC[-2]) -> 50
A155: زامیاد | B155: خزامیا | C155: =VLOOKUP(RC[-1],Sheet1!R3C2:R802C3,2,FALSE) -> خودرو و قطعات | D155: =VLOOKUP(RC[-2],Sheet1!R3C2:R802C9,8,FALSE) -> 22.599214109219492 | E155: =IF(VLOOKUP(RC[-3],Sheet1!R3C2:R803C11,10,FALSE)=0,"",VLOOKUP(Sheet2!RC[-3],Sheet1!R[1]C[-3]:R[801]C[6],10,FALSE)) ->  | F155: =Sheet1!R197C10 -> 53.061720219378913 | G155: =IF(RC[-3]<0,0,IF(AND(RC[-3]<RC[-1],RC[-3]<2),100,IF(AND(RC[-3]<RC[-1],RC[-3]>=2,RC[-3]<3),95,IF(AND(RC[-3]<RC[-1],RC[-3]>=3,RC[-3]<4),90,IF(AND(RC[-3]<RC[-1],RC[-3]>=4,RC[-3]<5),85,IF(AND(RC[-3]<RC[-1],RC[-3]>=5,RC[-3]<6),80,IF(AND(RC[-3]<RC[-1],RC[-3]>=6,RC[-3]<7),75,IF(AND(RC[-3]<RC[-1],RC[-3]>=7,RC[-3]<8),70,IF(AND(RC[-3]<RC[-1],RC[-3]>=8,RC[-3]<9),65,IF(AND(RC[-3]<RC[-1],RC[-3]>=9,RC[-3]<10),60,IF(AND(RC[-3]<RC[-1],RC[-3]>=10,RC[-3]<11),55,IF(AND(RC[-3]<RC[-1],RC[-3]>=11,RC[-3]<12),50,IF(AND(RC[-3]<RC[-1],RC[-3]>=12,RC[-3]<13),45,IF(AND(RC[-3]<RC[-1],RC[-3]>=13,RC[-3]<14),40,IF(AND(RC[-3]<RC[-1],RC[-3]>=14,RC[-3]<15),35,IF(AND(RC[-3]<RC[-1],RC[-3]>=15,RC[-3]<16),30,IF(AND(RC[-3]<RC[-1],RC[-3]>=16,RC[-3]<17),25,IF(AND(RC[-3]<RC[-1],RC[-3]>=17,RC[-3]<18),20,IF(AND(RC[-3]<RC[-1],RC[-3]>=18,RC[-3]<19),15,IF(AND(RC[-3]<RC[-1],RC[-3]>=19,RC[-3]<20),10,IF(AND(RC[-3]<RC[-1],RC[-3]>=20,RC[-3]<21),5,IF(AND(RC[-3]<RC[-1],RC[-3]>=21),0,IF(AND(RC[-3]>RC[-1],RC[-3]>=2,RC[-3]<3),90,IF(AND(RC[-3]>RC[-1],RC[-3]>=3,RC[-3]<4),90,IF(AND(RC[-3]>RC[-1],RC[-3]>=4,RC[-3]<5),80,IF(AND(RC[-3]>RC[-1],RC[-3]>=5,RC[-3]<6),70,IF(AND(RC[-3]>RC[-1],RC[-3]>=6,RC[-3]<7),60,IF(AND(RC[-3]>RC[-1],RC[-3]>=7,RC[-3]<8),50,IF(AND(RC[-3]>RC[-1],RC[-3]>=8,RC[-3]<9),40,IF(AND(RC[-3]>RC[-1],RC[-3]>=9,RC[-3]<10),30,IF(AND(RC[-3]>RC[-1],RC[-3]>=10,RC[-3]<11),20,IF(AND(RC[-3]>RC[-1],RC[-3]>=11,RC[-3]<12),10,IF(AND(RC[-3]>RC[-1],RC[-3]>=12),0))))))))))))))))))))))))))))))))) -> 0 | H155: =IF(RC[-3]="","",IF(RC[-3]<0.3,100,IF(AND(RC[-3]>=0.3,RC[-3]>0.4),95,IF(AND(RC[-3]>=0.4,RC[-3]<0.5),90,IF(AND(RC[-3]>=0.5,RC[-3]<0.6),85,IF(AND(RC[-3]>=0.6,RC[-3]<0.7),80,IF(AND(RC[-3]>=0.6,RC[-3]<1),80,IF(AND(RC[-3]>1,RC[-3]<2),50,IF(RC[-3]>2,0))))))))) ->  | I155: =IF(RC[-1]="",RC[-2],0.7*RC[-1]+0.3*RC[-2]) -> 0
A156: سازه پویش | B156: خپویش | C156: =VLOOKUP(RC[-1],Sheet1!R3C2:R802C3,2,FALSE) -> خودرو و قطعات | D156: =VLOOKUP(RC[-2],Sheet1!R3C2:R802C9,8,FALSE) -> 8.5116524108035705 | E156: =IF(VLOOKUP(RC[-3],Sheet1!R3C2:R803C11,10,FALSE)=0,"",VLOOKUP(Sheet2!RC[-3],Sheet1!R[1]C[-3]:R[801]C[6],10,FALSE)) ->  | F156: =Sheet1!R197C10 -> 53.061720219378913 | G156: =IF(RC[-3]<0,0,IF(AND(RC[-3]<RC[-1],RC[-3]<2),100,IF(AND(RC[-3]<RC[-1],RC[-3]>=2,RC[-3]<3),95,IF(AND(RC[-3]<RC[-1],RC[-3]>=3,RC[-3]<4),90,IF(AND(RC[-3]<RC[-1],RC[-3]>=4,RC[-3]<5),85,IF(AND(RC[-3]<RC[-1],RC[-3]>=5,RC[-3]<6),80,IF(AND(RC[-3]<RC[-1],RC[-3]>=6,RC[-3]<7),75,IF(AND(RC[-3]<RC[-1],RC[-3]>=7,RC[-3]<8),70,IF(AND(RC[-3]<RC[-1],RC[-3]>=8,RC[-3]<9),65,IF(AND(RC[-3]<RC[-1],RC[-3]>=9,RC[-3]<10),60,IF(AND(RC[-3]<RC[-1],RC[-3]>=10,RC[-3]<11),55,IF(AND(RC[-3]<RC[-1],RC[-3]>=11,RC[-3]<12),50,IF(AND(RC[-3]<RC[-1],RC[-3]>=12,RC[-3]<13),45,IF(AND(RC[-3]<RC[-1],RC[-3]>=13,RC[-3]<14),40,IF(AND(RC[-3]<RC[-1],RC[-3]>=14,RC[-3]<15),35,IF(AND(RC[-3]<RC[-1],RC[-3]>=15,RC[-3]<16),30,IF(AND(RC[-3]<RC[-1],RC[-3]>=16,RC[-3]<17),25,IF(AND(RC[-3]<RC[-1],RC[-3]>=17,RC[-3]<18),20,IF(AND(RC[-3]<RC[-1],RC[-3]>=18,RC[-3]<19),15,IF(AND(RC[-3]<RC[-1],RC[-3]>=19,RC[-3]<20),10,IF(AND(RC[-3]<RC[-1],RC[-3]>=20,RC[-3]<21),5,IF(AND(RC[-3]<RC[-1],RC[-3]>=21),0,IF(AND(RC[-3]>RC[-1],RC[-3]>=2,RC[-3]<3),90,IF(AND(RC[-3]>RC[-1],RC[-3]>=3,RC[-3]<4),90,IF(AND(RC[-3]>RC[-1],RC[-3]>=4,RC[-3]<5),80,IF(AND(RC[-3]>RC[-1],RC[-3]>=5,RC[-3]<6),70,IF(AND(RC[-3]>RC[-1],RC[-3]>=6,RC[-3]<7),60,IF(AND(RC[-3]>RC[-1],RC[-3]>=7,RC[-3]<8),50,IF(AND(RC[-3]>RC[-1],RC[-3]>=8,RC[-3]<9),40,IF(AND(RC[-3]>RC[-1],RC[-3]>=9,RC[-3]<10),30,IF(AND(RC[-3]>RC[-1],RC[-3]>=10,RC[-3]<11),20,IF(AND(RC[-3]>RC[-1],RC[-3]>=11,RC[-3]<12),10,IF(AND(RC[-3]>RC[-1],RC[-3]>=12),0))))))))))))))))))))))))))))))))) -> 65 | H156: =IF(RC[-3]="","",IF(RC[-3]<0.3,100,IF(AND(RC[-3]>=0.3,RC[-3]>0.4),95,IF(AND(RC[-3]>=0.4,RC[-3]<0.5),90,IF(AND(RC[-3]>=0.5,RC[-3]<0.6),85,IF(AND(RC[-3]>=0.6,RC[-3]<0.7),80,IF(AND(RC[-3]>=0.6,RC[-3]<1),80,IF(AND(RC[-3]>1,RC[-3]<2),50,IF(RC[-3]>2,0))))))))) ->  | I156: =IF(RC[-1]="",RC[-2],0.7*RC[-1]+0.3*RC[-2]) -> 65
A157: سایپا | B157: خساپا | C157: =VLOOKUP(RC[-1],Sheet1!R3C2:R802C3,2,FALSE) -> خودرو و قطعات | D157: =VLOOKUP(RC[-2],Sheet1!R3C2:R802C9,8,FALSE) -> -1.4560272536687631 | E157: =IF(VLOOKUP(RC[-3],Sheet1!R3C2:R803C11,10,FALSE)=0,"",VLOOKUP(Sheet2!RC[-3],Sheet1!R[1]C[-3]:R[801]C[6],10,FALSE)) ->  | F157: =Sheet1!R197C10 -> 53.061720219378913 | G157: =IF(RC[-3]<0,0,IF(AND(RC[-3]<RC[-1],RC[-3]<2),100,IF(AND(RC[-3]<RC[-1],RC[-3]>=2,RC[-3]<3),95,IF(AND(RC[-3]<RC[-1],RC[-3]>=3,RC[-3]<4),90,IF(AND(RC[-3]<RC[-1],RC[-3]>=4,RC[-3]<5),85,IF(AND(RC[-3]<RC[-1],RC[-3]>=5,RC[-3]<6),80,IF(AND(RC[-3]<RC[-1],RC[-3]>=6,RC[-3]<7),75,IF(AND(RC[-3]<RC[-1],RC[-3]>=7,RC[-3]<8),70,IF(AND(RC[-3]<RC[-1],RC[-3]>=8,RC[-3]<9),65,IF(AND(RC[-3]<RC[-1],RC[-3]>=9,RC[-3]<10),60,IF(AND(RC[-3]<RC[-1],RC[-3]>=10,RC[-3]<11),55,IF(AND(RC[-3]<RC[-1],RC[-3]>=11,RC[-3]<12),50,IF(AND(RC[-3]<RC[-1],RC[-3]>=12,RC[-3]<13),45,IF(AND(RC[-3]<RC[-1],RC[-3]>=13,RC[-3]<14),40,IF(AND(RC[-3]<RC[-1],RC[-3]>=14,RC[-3]<15),35,IF(AND(RC[-3]<RC[-1],RC[-3]>=15,RC[-3]<16),30,IF(AND(RC[-3]<RC[-1],RC[-3]>=16,RC[-3]<17),25,IF(AND(RC[-3]<RC[-1],RC[-3]>=17,RC[-3]<18),20,IF(AND(RC[-3]<RC[-1],RC[-3]>=18,RC[-3]<19),15,IF(AND(RC[-3]<RC[-1],RC[-3]>=19,RC[-3]<20),10,IF(AND(RC[-3]<RC[-1],RC[-3]>=20,RC[-3]<21),5,IF(AND(RC[-3]<RC[-1],RC[-3]>=21),0,IF(AND(RC[-3]>RC[-1],RC[-3]>=2,RC[-3]<3),90,IF(AND(RC[-3]>RC[-1],RC[-3]>=3,RC[-3]<4),90,IF(AND(RC[-3]>RC[-1],RC[-3]>=4,RC[-3]<5),80,IF(AND(RC[-3]>RC[-1],RC[-3]>=5,RC[-3]<6),70,IF(AND(RC[-3]>RC[-1],RC[-3]>=6,RC[-3]<7),60,IF(AND(RC[-3]>RC[-1],RC[-3]>=7,RC[-3]<8),50,IF(AND(RC[-3]>RC[-1],RC[-3]>=8,RC[-3]<9),40,IF(AND(RC[-3]>RC[-1],RC[-3]>=9,RC[-3]<10),30,IF(AND(RC[-3]>RC[-1],RC[-3]>=10,RC[-3]<11),20,IF(AND(RC[-3]>RC[-1],RC[-3]>=11,RC[-3]<12),10,IF(AND(RC[-3]>RC[-1],RC[-3]>=12),0))))))))))))))))))))))))))))))))) -> 0 | H157: =IF(RC[-3]="","",IF(RC[-3]<0.3,100,IF(AND(RC[-3]>=0.3,RC[-3]>0.4),95,IF(AND(RC[-3]>=0.4,RC[-3]<0.5),90,IF(AND(RC[-3]>=0.5,RC[-3]<0.6),85,IF(AND(RC[-3]>=0.6,RC[-3]<0.7),80,IF(AND(RC[-3]>=0.6,RC[-3]<1),80,IF(AND(RC[-3]>1,RC[-3]<2),50,IF(RC[-3]>2,0))))))))) ->  | I157: =IF(RC[-1]="",RC[-2],0.7*RC[-1]+0.3*RC[-2]) -> 0
A158: سایپا آذین | B158: خاذین | C158: =VLOOKUP(RC[-1],Sheet1!R3C2:R802C3,2,FALSE) -> خودرو و قطعات | D158: =VLOOKUP(RC[-2],Sheet1!R3C2:R802C9,8,FALSE) -> 249.49166666666667 | E158: =IF(VLOOKUP(RC[-3],Sheet1!R3C2:R803C11,10,FALSE)=0,"",VLOOKUP(Sheet2!RC[-3],Sheet1!R[1]C[-3]:R[801]C[6],10,FALSE)) ->  | F158: =Sheet1!R197C10 -> 53.061720219378913 | G158: =IF(RC[-3]<0,0,IF(AND(RC[-3]<RC[-1],RC[-3]<2),100,IF(AND(RC[-3]<RC[-1],RC[-3]>=2,RC[-3]<3),95,IF(AND(RC[-3]<RC[-1],RC[-3]>=3,RC[-3]<4),90,IF(AND(RC[-3]<RC[-1],RC[-3]>=4,RC[-3]<5),85,IF(AND(RC[-3]<RC[-1],RC[-3]>=5,RC[-3]<6),80,IF(AND(RC[-3]<RC[-1],RC[-3]>=6,RC[-3]<7),75,IF(AND(RC[-3]<RC[-1],RC[-3]>=7,RC[-3]<8),70,IF(AND(RC[-3]<RC[-1],RC[-3]>=8,RC[-3]<9),65,IF(AND(RC[-3]<RC[-1],RC[-3]>=9,RC[-3]<10),60,IF(AND(RC[-3]<RC[-1],RC[-3]>=10,RC[-3]<11),55,IF(AND(RC[-3]<RC[-1],RC[-3]>=11,RC[-3]<12),50,IF(AND(RC[-3]<RC[-1],RC[-3]>=12,RC[-3]<13),45,IF(AND(RC[-3]<RC[-1],RC[-3]>=13,RC[-3]<14),40,IF(AND(RC[-3]<RC[-1],RC[-3]>=14,RC[-3]<15),35,IF(AND(RC[-3]<RC[-1],RC[-3]>=15,RC[-3]<16),30,IF(AND(RC[-3]<RC[-1],RC[-3]>=16,RC[-3]<17),25,IF(AND(RC[-3]<RC[-1],RC[-3]>=17,RC[-3]<18),20,IF(AND(RC[-3]<RC[-1],RC[-3]>=18,RC[-3]<19),15,IF(AND(RC[-3]<RC[-1],RC[-3]>=19,RC[-3]<20),10,IF(AND(RC[-3]<RC[-1],RC[-3]>=20,RC[-3]<21),5,IF(AND(RC[-3]<RC[-1],RC[-3]>=21),0,IF(AND(RC[-3]>RC[-1],RC[-3]>=2,RC[-3]<3),90,IF(AND(RC[-3]>RC[-1],RC[-3]>=3,RC[-3]<4),90,IF(AND(RC[-3]>RC[-1],RC[-3]>=4,RC[-3]<5),80,IF(AND(RC[-3]>RC[-1],RC[-3]>=5,RC[-3]<6),70,IF(AND(RC[-3]>RC[-1],RC[-3]>=6,RC[-3]<7),60,IF(AND(RC[-3]>RC[-1],RC[-3]>=7,RC[-3]<8),50,IF(AND(RC[-3]>RC[-1],RC[-3]>=8,RC[-3]<9),40,IF(AND(RC[-3]>RC[-1],RC[-3]>=9,RC[-3]<10),30,IF(AND(RC[-3]>RC[-1],RC[-3]>=10,RC[-3]<11),20,IF(AND(RC[-3]>RC[-1],RC[-3]>=11,RC[-3]<12),10,IF(AND(RC[-3]>RC[-1],RC[-3]>=12),0))))))))))))))))))))))))))))))))) -> 0 | H158: =IF(RC[-3]="","",IF(RC[-3]<0.3,100,IF(AND(RC[-3]>=0.3,RC[-3]>0.4),95,IF(AND(RC[-3]>=0.4,RC[-3]<0.5),90,IF(AND(RC[-3]>=0.5,RC[-3]<0.6),85,IF(AND(RC[-3]>=0.6,RC[-3]<0.7),80,IF(AND(RC[-3]>=0.6,RC[-3]<1),80,IF(AND(RC[-3]>1,RC[-3]<2),50,IF(RC[-3]>2,0))))))))) ->  | I158: =IF(RC[-1]="",RC[-2],0.7*RC[-1]+0.3*RC[-2]) -> 0
A159: سایپا دیزل | B159: خکاوه | C159: =VLOOKUP(RC[-1],Sheet1!R3C2:R802C3,2,FALSE) -> خودرو و قطعات | D159: =VLOOKUP(RC[-2],Sheet1!R3C2:R802C9,8,FALSE) -> 58.339731491583173 | E159: =IF(VLOOKUP(RC[-3],Sheet1!R3C2:R803C11,10,FALSE)=0,"",VLOOKUP(Sheet2!RC[-3],Sheet1!R[1]C[-3]:R[801]C[6],10,FALSE)) ->  | F159: =Sheet1!R197C10 -> 53.061720219378913 | G159: =IF(RC[-3]<0,0,IF(AND(RC[-3]<RC[-1],RC[-3]<2),100,IF(AND(RC[-3]<RC[-1],RC[-3]>=2,RC[-3]<3),95,IF(AND(RC[-3]<RC[-1],RC[-3]>=3,RC[-3]<4),90,IF(AND(RC[-3]<RC[-1],RC[-3]>=4,RC[-3]<5),85,IF(AND(RC[-3]<RC[-1],RC[-3]>=5,RC[-3]<6),80,IF(AND(RC[-3]<RC[-1],RC[-3]>=6,RC[-3]<7),75,IF(AND(RC[-3]<RC[-1],RC[-3]>=7,RC[-3]<8),70,IF(AND(RC[-3]<RC[-1],RC[-3]>=8,RC[-3]<9),65,IF(AND(RC[-3]<RC[-1],RC[-3]>=9,RC[-3]<10),60,IF(AND(RC[-3]<RC[-1],RC[-3]>=10,RC[-3]<11),55,IF(AND(RC[-3]<RC[-1],RC[-3]>=11,RC[-3]<12),50,IF(AND(RC[-3]<RC[-1],RC[-3]>=12,RC[-3]<13),45,IF(AND(RC[-3]<RC[-1],RC[-3]>=13,RC[-3]<14),40,IF(AND(RC[-3]<RC[-1],RC[-3]>=14,RC[-3]<15),35,IF(AND(RC[-3]<RC[-1],RC[-3]>=15,RC[-3]<16),30,IF(AND(RC[-3]<RC[-1],RC[-3]>=16,RC[-3]<17),25,IF(AND(RC[-3]<RC[-1],RC[-3]>=17,RC[-3]<18),20,IF(AND(RC[-3]<RC[-1],RC[-3]>=18,RC[-3]<19),15,IF(AND(RC[-3]<RC[-1],RC[-3]>=19,RC[-3]<20),10,IF(AND(RC[-3]<RC[-1],RC[-3]>=20,RC[-3]<21),5,IF(AND(RC[-3]<RC[-1],RC[-3]>=21),0,IF(AND(RC[-3]>RC[-1],RC[-3]>=2,RC[-3]<3),90,IF(AND(RC[-3]>RC[-1],RC[-3]>=3,RC[-3]<4),90,IF(AND(RC[-3]>RC[-1],RC[-3]>=4,RC[-3]<5),80,IF(AND(RC[-3]>RC[-1],RC[-3]>=5,RC[-3]<6),70,IF(AND(RC[-3]>RC[-1],RC[-3]>=6,RC[-3]<7),60,IF(AND(RC[-3]>RC[-1],RC[-3]>=7,RC[-3]<8),50,IF(AND(RC[-3]>RC[-1],RC[-3]>=8,RC[-3]<9),40,IF(AND(RC[-3]>RC[-1],RC[-3]>=9,RC[-3]<10),30,IF(AND(RC[-3]>RC[-1],RC[-3]>=10,RC[-3]<11),20,IF(AND(RC[-3]>RC[-1],RC[-3]>=11,RC[-3]<12),10,IF(AND(RC[-3]>RC[-1],RC[-3]>=12),0))))))))))))))))))))))))))))))))) -> 0 | H159: =IF(RC[-3]="","",IF(RC[-3]<0.3,100,IF(AND(RC[-3]>=0.3,RC[-3]>0.4),95,IF(AND(RC[-3]>=0.4,RC[-3]<0.5),90,IF(AND(RC[-3]>=0.5,RC[-3]<0.6),85,IF(AND(RC[-3]>=0.6,RC[-3]<0.7),80,IF(AND(RC[-3]>=0.6,RC[-3]<1),80,IF(AND(RC[-3]>1,RC[-3]<2),50,IF(RC[-3]>2,0))))))))) ->  | I159: =IF(RC[-1]="",RC[-2],0.7*RC[-1]+0.3*RC[-2]) -> 0
A160: سر. ایران خودرو | B160: خگستر | C160: =VLOOKUP(RC[-1],Sheet1!R3C2:R802C3,2,FALSE) -> خودرو و قطعات | D160: =VLOOKUP(RC[-2],Sheet1!R3C2:R802C9,8,FALSE) -> 42.135417228887896 | E160: =IF(VLOOKUP(RC[-3],Sheet1!R3C2:R803C11,10,FALSE)=0,"",VLOOKUP(Sheet2!RC[-3],Sheet1!R[1]C[-3]:R[801]C[6],10,FALSE)) -> 0.9 | F160: =Sheet1!R197C10 -> 53.061720219378913 | G160: =IF(RC[-3]<0,0,IF(AND(RC[-3]<RC[-1],RC[-3]<2),100,IF(AND(RC[-3]<RC[-1],RC[-3]>=2,RC[-3]<3),95,IF(AND(RC[-3]<RC[-1],RC[-3]>=3,RC[-3]<4),90,IF(AND(RC[-3]<RC[-1],RC[-3]>=4,RC[-3]<5),85,IF(AND(RC[-3]<RC[-1],RC[-3]>=5,RC[-3]<6),80,IF(AND(RC[-3]<RC[-1],RC[-3]>=6,RC[-3]<7),75,IF(AND(RC[-3]<RC[-1],RC[-3]>=7,RC[-3]<8),70,IF(AND(RC[-3]<RC[-1],RC[-3]>=8,RC[-3]<9),65,IF(AND(RC[-3]<RC[-1],RC[-3]>=9,RC[-3]<10),60,IF(AND(RC[-3]<RC[-1],RC[-3]>=10,RC[-3]<11),55,IF(AND(RC[-3]<RC[-1],RC[-3]>=11,RC[-3]<12),50,IF(AND(RC[-3]<RC[-1],RC[-3]>=12,RC[-3]<13),45,IF(AND(RC[-3]<RC[-1],RC[-3]>=13,RC[-3]<14),40,IF(AND(RC[-3]<RC[-1],RC[-3]>=14,RC[-3]<15),35,IF(AND(RC[-3]<RC[-1],RC[-3]>=15,RC[-3]<16),30,IF(AND(RC[-3]<RC[-1],RC[-3]>=16,RC[-3]<17),25,IF(AND(RC[-3]<RC[-1],RC[-3]>=17,RC[-3]<18),20,IF(AND(RC[-3]<RC[-1],RC[-3]>=18,RC[-3]<19),15,IF(AND(RC[-3]<RC[-1],RC[-3]>=19,RC[-3]<20),10,IF(AND(RC[-3]<RC[-1],RC[-3]>=20,RC[-3]<21),5,IF(AND(RC[-3]<RC[-1],RC[-3]>=21),0,IF(AND(RC[-3]>RC[-1],RC[-3]>=2,RC[-3]<3),90,IF(AND(RC[-3]>RC[-1],RC[-3]>=3,RC[-3]<4),90,IF(AND(RC[-3]>RC[-1],RC[-3]>=4,RC[-3]<5),80,IF(AND(RC[-3]>RC[-1],RC[-3]>=5,RC[-3]<6),70,IF(AND(RC[-3]>RC[-1],RC[-3]>=6,RC[-3]<7),60,IF(AND(RC[-3]>RC[-1],RC[-3]>=7,RC[-3]<8),50,IF(AND(RC[-3]>RC[-1],RC[-3]>=8,RC[-3]<9),40,IF(AND(RC[-3]>RC[-1],RC[-3]>=9,RC[-3]<10),30,IF(AND(RC[-3]>RC[-1],RC[-3]>=10,RC[-3]<11),20,IF(AND(RC[-3]>RC[-1],RC[-3]>=11,RC[-3]<12),10,IF(AND(RC[-3]>RC[-1],RC[-3]>=12),0))))))))))))))))))))))))))))))))) -> 0 | H160: =IF(RC[-3]="","",IF(RC[-3]<0.3,100,IF(AND(RC[-3]>=0.3,RC[-3]>0.4),95,IF(AND(RC[-3]>=0.4,RC[-3]<0.5),90,IF(AND(RC[-3]>=0.5,RC[-3]<0.6),85,IF(AND(RC[-3]>=0.6,RC[-3]<0.7),80,IF(AND(RC[-3]>=0.6,RC[-3]<1),80,IF(AND(RC[-3]>1,RC[-3]<2),50,IF(RC[-3]>2,0))))))))) -> 95 | I160: =IF(RC[-1]="",RC[-2],0.7*RC[-1]+0.3*RC[-2]) -> 66.5
A161: سر. رنا | B161: ورنا | C161: =VLOOKUP(RC[-1],Sheet1!R3C2:R802C3,2,FALSE) -> خودرو و قطعات | D161: =VLOOKUP(RC[-2],Sheet1!R3C2:R802C9,8,FALSE) -> 23.690081817558234 | E161: =IF(VLOOKUP(RC[-3],Sheet1!R3C2:R803C11,10,FALSE)=0,"",VLOOKUP(Sheet2!RC[-3],Sheet1!R[1]C[-3]:R[801]C[6],10,FALSE)) -> 0.85 | F161: =Sheet1!R197C10 -> 53.061720219378913 | G161: =IF(RC[-3]<0,0,IF(AND(RC[-3]<RC[-1],RC[-3]<2),100,IF(AND(RC[-3]<RC[-1],RC[-3]>=2,RC[-3]<3),95,IF(AND(RC[-3]<RC[-1],RC[-3]>=3,RC[-3]<4),90,IF(AND(RC[-3]<RC[-1],RC[-3]>=4,RC[-3]<5),85,IF(AND(RC[-3]<RC[-1],RC[-3]>=5,RC[-3]<6),80,IF(AND(RC[-3]<RC[-1],RC[-3]>=6,RC[-3]<7),75,IF(AND(RC[-3]<RC[-1],RC[-3]>=7,RC[-3]<8),70,IF(AND(RC[-3]<RC[-1],RC[-3]>=8,RC[-3]<9),65,IF(AND(RC[-3]<RC[-1],RC[-3]>=9,RC[-3]<10),60,IF(AND(RC[-3]<RC[-1],RC[-3]>=10,RC[-3]<11),55,IF(AND(RC[-3]<RC[-1],RC[-3]>=11,RC[-3]<12),50,IF(AND(RC[-3]<RC[-1],RC[-3]>=12,RC[-3]<13),45,IF(AND(RC[-3]<RC[-1],RC[-3]>=13,RC[-3]<14),40,IF(AND(RC[-3]<RC[-1],RC[-3]>=14,RC[-3]<15),35,IF(AND(RC[-3]<RC[-1],RC[-3]>=15,RC[-3]<16),30,IF(AND(RC[-3]<RC[-1],RC[-3]>=16,RC[-3]<17),25,IF(AND(RC[-3]<RC[-1],RC[-3]>=17,RC[-3]<18),20,IF(AND(RC[-3]<RC[-1],RC[-3]>=18,RC[-3]<19),15,IF(AND(RC[-3]<RC[-1],RC[-3]>=19,RC[-3]<20),10,IF(AND(RC[-3]<RC[-1],RC[-3]>=20,RC[-3]<21),5,IF(AND(RC[-3]<RC[-1],RC[-3]>=21),0,IF(AND(RC[-3]>RC[-1],RC[-3]>=2,RC[-3]<3),90,IF(AND(RC[-3]>RC[-1],RC[-3]>=3,RC[-3]<4),90,IF(AND(RC[-3]>RC[-1],RC[-3]>=4,RC[-3]<5),80,IF(AND(RC[-3]>RC[-1],RC[-3]>=5,RC[-3]<6),70,IF(AND(RC[-3]>RC[-1],RC[-3]>=6,RC[-3]<7),60,IF(AND(RC[-3]>RC[-1],RC[-3]>=7,RC[-3]<8),50,IF(AND(RC[-3]>RC[-1],RC[-3]>=8,RC[-3]<9),40,IF(AND(RC[-3]>RC[-1],RC[-3]>=9,RC[-3]<10),30,IF(AND(RC[-3]>RC[-1],RC[-3]>=10,RC[-3]<11),20,IF(AND(RC[-3]>RC[-1],RC[-3]>=11,RC[-3]<12),10,IF(AND(RC[-3]>RC[-1],RC[-3]>=12),0))))))))))))))))))))))))))))))))) -> 0 | H161: =IF(RC[-3]="","",IF(RC[-3]<0.3,100,IF(AND(RC[-3]>=0.3,RC[-3]>0.4),95,IF(AND(RC[-3]>=0.4,RC[-3]<0.5),90,IF(AND(RC[-3]>=0.5,RC[-3]<0.6),85,IF(AND(RC[-3]>=0.6,RC[-3]<0.7),80,IF(AND(RC[-3]>=0.6,RC[-3]<1),80,IF(AND(RC[-3]>1,RC[-3]<2),50,IF(RC[-3]>2,0))))))))) -> 95 | I161: =IF(RC[-1]="",RC[-2],0.7*RC[-1]+0.3*RC[-2]) -> 66.5
A162: صنایع ریخته گری ایران | B162: خریخت | C162: =VLOOKUP(RC[-1],Sheet1!R3C2:R802C3,2,FALSE) -> خودرو و قطعات | D162: =VLOOKUP(RC[-2],Sheet1!R3C2:R802C9,8,FALSE) -> 6.5904295998737306 | E162: =IF(VLOOKUP(RC[-3],Sheet1!R3C2:R803C11,10,FALSE)=0,"",VLOOKUP(Sheet2!RC[-3],Sheet1!R[1]C[-3]:R[801]C[6],10,FALSE)) ->  | F162: =Sheet1!R197C10 -> 53.061720219378913 | G162: =IF(RC[-3]<0,0,IF(AND(RC[-3]<RC[-1],RC[-3]<2),100,IF(AND(RC[-3]<RC[-1],RC[-3]>=2,RC[-3]<3),95,IF(AND(RC[-3]<RC[-1],RC[-3]>=3,RC[-3]<4),90,IF(AND(RC[-3]<RC[-1],RC[-3]>=4,RC[-3]<5),85,IF(AND(RC[-3]<RC[-1],RC[-3]>=5,RC[-3]<6),80,IF(AND(RC[-3]<RC[-1],RC[-3]>=6,RC[-3]<7),75,IF(AND(RC[-3]<RC[-1],RC[-3]>=7,RC[-3]<8),70,IF(AND(RC[-3]<RC[-1],RC[-3]>=8,RC[-3]<9),65,IF(AND(RC[-3]<RC[-1],RC[-3]>=9,RC[-3]<10),60,IF(AND(RC[-3]<RC[-1],RC[-3]>=10,RC[-3]<11),55,IF(AND(RC[-3]<RC[-1],RC[-3]>=11,RC[-3]<12),50,IF(AND(RC[-3]<RC[-1],RC[-3]>=12,RC[-3]<13),45,IF(AND(RC[-3]<RC[-1],RC[-3]>=13,RC[-3]<14),40,IF(AND(RC[-3]<RC[-1],RC[-3]>=14,RC[-3]<15),35,IF(AND(RC[-3]<RC[-1],RC[-3]>=15,RC[-3]<16),30,IF(AND(RC[-3]<RC[-1],RC[-3]>=16,RC[-3]<17),25,IF(AND(RC[-3]<RC[-1],RC[-3]>=17,RC[-3]<18),20,IF(AND(RC[-3]<RC[-1],RC[-3]>=18,RC[-3]<19),15,IF(AND(RC[-3]<RC[-1],RC[-3]>=19,RC[-3]<20),10,IF(AND(RC[-3]<RC[-1],RC[-3]>=20,RC[-3]<21),5,IF(AND(RC[-3]<RC[-1],RC[-3]>=21),0,IF(AND(RC[-3]>RC[-1],RC[-3]>=2,RC[-3]<3),90,IF(AND(RC[-3]>RC[-1],RC[-3]>=3,RC[-3]<4),90,IF(AND(RC[-3]>RC[-1],RC[-3]>=4,RC[-3]<5),80,IF(AND(RC[-3]>RC[-1],RC[-3]>=5,RC[-3]<6),70,IF(AND(RC[-3]>RC[-1],RC[-3]>=6,RC[-3]<7),60,IF(AND(RC[-3]>RC[-1],RC[-3]>=7,RC[-3]<8),50,IF(AND(RC[-3]>RC[-1],RC[-3]>=8,RC[-3]<9),40,IF(AND(RC[-3]>RC[-1],RC[-3]>=9,RC[-3]<10),30,IF(AND(RC[-3]>RC[-1],RC[-3]>=10,RC[-3]<11),20,IF(AND(RC[-3]>RC[-1],RC[-3]>=11,RC[-3]<12),10,IF(AND(RC[-3]>RC[-1],RC[-3]>=12),0))))))))))))))))))))))))))))))))) -> 75 | H162: =IF(RC[-3]="","",IF(RC[-3]<0.3,100,IF(AND(RC[-3]>=0.3,RC[-3]>0.4),95,IF(AND(RC[-3]>=0.4,RC[-3]<0.5),90,IF(AND(RC[-3]>=0.5,RC[-3]<0.6),85,IF(AND(RC[-3]>=0.6,RC[-3]<0.7),80,IF(AND(RC[-3]>=0.6,RC[-3]<1),80,IF(AND(RC[-3]>1,RC[-3]<2),50,IF(RC[-3]>2,0))))))))) ->  | I162: =IF(RC[-1]="",RC[-2],0.7*RC[-1]+0.3*RC[-2]) -> 75
A163: صنعتی روان فن آور | B163: خفناور | C163: =VLOOKUP(RC[-1],Sheet1!R3C2:R802C3,2,FALSE) -> خودرو و قطعات | D163: =VLOOKUP(RC[-2],Sheet1!R3C2:R802C9,8,FALSE) -> 117.83148893452783 | E163: =IF(VLOOKUP(RC[-3],Sheet1!R3C2:R803C11,10,FALSE)=0,"",VLOOKUP(Sheet2!RC[-3],Sheet1!R[1]C[-3]:R[801]C[6],10,FALSE)) ->  | F163: =Sheet1!R197C10 -> 53.061720219378913 | G163: =IF(RC[-3]<0,0,IF(AND(RC[-3]<RC[-1],RC[-3]<2),100,IF(AND(RC[-3]<RC[-1],RC[-3]>=2,RC[-3]<3),95,IF(AND(RC[-3]<RC[-1],RC[-3]>=3,RC[-3]<4),90,IF(AND(RC[-3]<RC[-1],RC[-3]>=4,RC[-3]<5),85,IF(AND(RC[-3]<RC[-1],RC[-3]>=5,RC[-3]<6),80,IF(AND(RC[-3]<RC[-1],RC[-3]>=6,RC[-3]<7),75,IF(AND(RC[-3]<RC[-1],RC[-3]>=7,RC[-3]<8),70,IF(AND(RC[-3]<RC[-1],RC[-3]>=8,RC[-3]<9),65,IF(AND(RC[-3]<RC[-1],RC[-3]>=9,RC[-3]<10),60,IF(AND(RC[-3]<RC[-1],RC[-3]>=10,RC[-3]<11),55,IF(AND(RC[-3]<RC[-1],RC[-3]>=11,RC[-3]<12),50,IF(AND(RC[-3]<RC[-1],RC[-3]>=12,RC[-3]<13),45,IF(AND(RC[-3]<RC[-1],RC[-3]>=13,RC[-3]<14),40,IF(AND(RC[-3]<RC[-1],RC[-3]>=14,RC[-3]<15),35,IF(AND(RC[-3]<RC[-1],RC[-3]>=15,RC[-3]<16),30,IF(AND(RC[-3]<RC[-1],RC[-3]>=16,RC[-3]<17),25,IF(AND(RC[-3]<RC[-1],RC[-3]>=17,RC[-3]<18),20,IF(AND(RC[-3]<RC[-1],RC[-3]>=18,RC[-3]<19),15,IF(AND(RC[-3]<RC[-1],RC[-3]>=19,RC[-3]<20),10,IF(AND(RC[-3]<RC[-1],RC[-3]>=20,RC[-3]<21),5,IF(AND(RC[-3]<RC[-1],RC[-3]>=21),0,IF(AND(RC[-3]>RC[-1],RC[-3]>=2,RC[-3]<3),90,IF(AND(RC[-3]>RC[-1],RC[-3]>=3,RC[-3]<4),90,IF(AND(RC[-3]>RC[-1],RC[-3]>=4,RC[-3]<5),80,IF(AND(RC[-3]>RC[-1],RC[-3]>=5,RC[-3]<6),70,IF(AND(RC[-3]>RC[-1],RC[-3]>=6,RC[-3]<7),60,IF(AND(RC[-3]>RC[-1],RC[-3]>=7,RC[-3]<8),50,IF(AND(RC[-3]>RC[-1],RC[-3]>=8,RC[-3]<9),40,IF(AND(RC[-3]>RC[-1],RC[-3]>=9,RC[-3]<10),30,IF(AND(RC[-3]>RC[-1],RC[-3]>=10,RC[-3]<11),20,IF(AND(RC[-3]>RC[-1],RC[-3]>=11,RC[-3]<12),10,IF(AND(RC[-3]>RC[-1],RC[-3]>=12),0))))))))))))))))))))))))))))))))) -> 0 | H163: =IF(RC[-3]="","",IF(RC[-3]<0.3,100,IF(AND(RC[-3]>=0.3,RC[-3]>0.4),95,IF(AND(RC[-3]>=0.4,RC[-3]<0.5),90,IF(AND(RC[-3]>=0.5,RC[-3]<0.6),85,IF(AND(RC[-3]>=0.6,RC[-3]<0.7),80,IF(AND(RC[-3]>=0.6,RC[-3]<1),80,IF(AND(RC[-3]>1,RC[-3]<2),50,IF(RC[-3]>2,0))))))))) ->  | I163: =IF(RC[-1]="",RC[-2],0.7*RC[-1]+0.3*RC[-2]) -> 0
A164: فنرسازی خاور | B164: خفنر | C164: =VLOOKUP(RC[-1],Sheet1!R3C2:R802C3,2,FALSE) -> خودرو و قطعات | D164: =VLOOKUP(RC[-2],Sheet1!R3C2:R802C9,8,FALSE) -> 10.039810940986024 | E164: =IF(VLOOKUP(RC[-3],Sheet1!R3C2:R803C11,10,FALSE)=0,"",VLOOKUP(Sheet2!RC[-3],Sheet1!R[1]C[-3]:R[801]C[6],10,FALSE)) ->  | F164: =Sheet1!R197C10 -> 53.061720219378913 | G164: =IF(RC[-3]<0,0,IF(AND(RC[-3]<RC[-1],RC[-3]<2),100,IF(AND(RC[-3]<RC[-1],RC[-3]>=2,RC[-3]<3),95,IF(AND(RC[-3]<RC[-1],RC[-3]>=3,RC[-3]<4),90,IF(AND(RC[-3]<RC[-1],RC[-3]>=4,RC[-3]<5),85,IF(AND(RC[-3]<RC[-1],RC[-3]>=5,RC[-3]<6),80,IF(AND(RC[-3]<RC[-1],RC[-3]>=6,RC[-3]<7),75,IF(AND(RC[-3]<RC[-1],RC[-3]>=7,RC[-3]<8),70,IF(AND(RC[-3]<RC[-1],RC[-3]>=8,RC[-3]<9),65,IF(AND(RC[-3]<RC[-1],RC[-3]>=9,RC[-3]<10),60,IF(AND(RC[-3]<RC[-1],RC[-3]>=10,RC[-3]<11),55,IF(AND(RC[-3]<RC[-1],RC[-3]>=11,RC[-3]<12),50,IF(AND(RC[-3]<RC[-1],RC[-3]>=12,RC[-3]<13),45,IF(AND(RC[-3]<RC[-1],RC[-3]>=13,RC[-3]<14),40,IF(AND(RC[-3]<RC[-1],RC[-3]>=14,RC[-3]<15),35,IF(AND(RC[-3]<RC[-1],RC[-3]>=15,RC[-3]<16),30,IF(AND(RC[-3]<RC[-1],RC[-3]>=16,RC[-3]<17),25,IF(AND(RC[-3]<RC[-1],RC[-3]>=17,RC[-3]<18),20,IF(AND(RC[-3]<RC[-1],RC[-3]>=18,RC[-3]<19),15,IF(AND(RC[-3]<RC[-1],RC[-3]>=19,RC[-3]<20),10,IF(AND(RC[-3]<RC[-1],RC[-3]>=20,RC[-3]<21),5,IF(AND(RC[-3]<RC[-1],RC[-3]>=21),0,IF(AND(RC[-3]>RC[-1],RC[-3]>=2,RC[-3]<3),90,IF(AND(RC[-3]>RC[-1],RC[-3]>=3,RC[-3]<4),90,IF(AND(RC[-3]>RC[-1],RC[-3]>=4,RC[-3]<5),80,IF(AND(RC[-3]>RC[-1],RC[-3]>=5,RC[-3]<6),70,IF(AND(RC[-3]>RC[-1],RC[-3]>=6,RC[-3]<7),60,IF(AND(RC[-3]>RC[-1],RC[-3]>=7,RC[-3]<8),50,IF(AND(RC[-3]>RC[-1],RC[-3]>=8,RC[-3]<9),40,IF(AND(RC[-3]>RC[-1],RC[-3]>=9,RC[-3]<10),30,IF(AND(RC[-3]>RC[-1],RC[-3]>=10,RC[-3]<11),20,IF(AND(RC[-3]>RC[-1],RC[-3]>=11,RC[-3]<12),10,IF(AND(RC[-3]>RC[-1],RC[-3]>=12),0))))))))))))))))))))))))))))))))) -> 55 | H164: =IF(RC[-3]="","",IF(RC[-3]<0.3,100,IF(AND(RC[-3]>=0.3,RC[-3]>0.4),95,IF(AND(RC[-3]>=0.4,RC[-3]<0.5),90,IF(AND(RC[-3]>=0.5,RC[-3]<0.6),85,IF(AND(RC[-3]>=0.6,RC[-3]<0.7),80,IF(AND(RC[-3]>=0.6,RC[-3]<1),80,IF(AND(RC[-3]>1,RC[-3]<2),50,IF(RC[-3]>2,0))))))))) ->  | I164: =IF(RC[-1]="",RC[-2],0.7*RC[-1]+0.3*RC[-2]) -> 55
A165: فنرسازی زر | B165: خزر | C165: =VLOOKUP(RC[-1],Sheet1!R3C2:R802C3,2,FALSE) -> خودرو و قطعات | D165: =VLOOKUP(RC[-2],Sheet1!R3C2:R802C9,8,FALSE) -> 8.2073809152657464 | E165: =IF(VLOOKUP(RC[-3],Sheet1!R3C2:R803C11,10,FALSE)=0,"",VLOOKUP(Sheet2!RC[-3],Sheet1!R[1]C[-3]:R[801]C[6],10,FALSE)) ->  | F165: =Sheet1!R197C10 -> 53.061720219378913 | G165: =IF(RC[-3]<0,0,IF(AND(RC[-3]<RC[-1],RC[-3]<2),100,IF(AND(RC[-3]<RC[-1],RC[-3]>=2,RC[-3]<3),95,IF(AND(RC[-3]<RC[-1],RC[-3]>=3,RC[-3]<4),90,IF(AND(RC[-3]<RC[-1],RC[-3]>=4,RC[-3]<5),85,IF(AND(RC[-3]<RC[-1],RC[-3]>=5,RC[-3]<6),80,IF(AND(RC[-3]<RC[-1],RC[-3]>=6,RC[-3]<7),75,IF(AND(RC[-3]<RC[-1],RC[-3]>=7,RC[-3]<8),70,IF(AND(RC[-3]<RC[-1],RC[-3]>=8,RC[-3]<9),65,IF(AND(RC[-3]<RC[-1],RC[-3]>=9,RC[-3]<10),60,IF(AND(RC[-3]<RC[-1],RC[-3]>=10,RC[-3]<11),55,IF(AND(RC[-3]<RC[-1],RC[-3]>=11,RC[-3]<12),50,IF(AND(RC[-3]<RC[-1],RC[-3]>=12,RC[-3]<13),45,IF(AND(RC[-3]<RC[-1],RC[-3]>=13,RC[-3]<14),40,IF(AND(RC[-3]<RC[-1],RC[-3]>=14,RC[-3]<15),35,IF(AND(RC[-3]<RC[-1],RC[-3]>=15,RC[-3]<16),30,IF(AND(RC[-3]<RC[-1],RC[-3]>=16,RC[-3]<17),25,IF(AND(RC[-3]<RC[-1],RC[-3]>=17,RC[-3]<18),20,IF(AND(RC[-3]<RC[-1],RC[-3]>=18,RC[-3]<19),15,IF(AND(RC[-3]<RC[-1],RC[-3]>=19,RC[-3]<20),10,IF(AND(RC[-3]<RC[-1],RC[-3]>=20,RC[-3]<21),5,IF(AND(RC[-3]<RC[-1],RC[-3]>=21),0,IF(AND(RC[-3]>RC[-1],RC[-3]>=2,RC[-3]<3),90,IF(AND(RC[-3]>RC[-1],RC[-3]>=3,RC[-3]<4),90,IF(AND(RC[-3]>RC[-1],RC[-3]>=4,RC[-3]<5),80,IF(AND(RC[-3]>RC[-1],RC[-3]>=5,RC[-3]<6),70,IF(AND(RC[-3]>RC[-1],RC[-3]>=6,RC[-3]<7),60,IF(AND(RC[-3]>RC[-1],RC[-3]>=7,RC[-3]<8),50,IF(AND(RC[-3]>RC[-1],RC[-3]>=8,RC[-3]<9),40,IF(AND(RC[-3]>RC[-1],RC[-3]>=9,RC[-3]<10),30,IF(AND(RC[-3]>RC[-1],RC[-3]>=10,RC[-3]<11),20,IF(AND(RC[-3]>RC[-1],RC[-3]>=11,RC[-3]<12),10,IF(AND(RC[-3]>RC[-1],RC[-3]>=12),0))))))))))))))))))))))))))))))))) -> 65 | H165: =IF(RC[-3]="","",IF(RC[-3]<0.3,100,IF(AND(RC[-3]>=0.3,RC[-3]>0.4),95,IF(AND(RC[-3]>=0.4,RC[-3]<0.5),90,IF(AND(RC[-3]>=0.5,RC[-3]<0.6),85,IF(AND(RC[-3]>=0.6,RC[-3]<0.7),80,IF(AND(RC[-3]>=0.6,RC[-3]<1),80,IF(AND(RC[-3]>1,RC[-3]<2),50,IF(RC[-3]>2,0))))))))) ->  | I165: =IF(RC[-1]="",RC[-2],0.7*RC[-1]+0.3*RC[-2]) -> 65
A166: قطعات اتومبیل | B166: ختوقا | C166: =VLOOKUP(RC[-1],Sheet1!R3C2:R802C3,2,FALSE) -> خودرو و قطعات | D166: =VLOOKUP(RC[-2],Sheet1!R3C2:R802C9,8,FALSE) -> 8.5564466686976388 | E166: =IF(VLOOKUP(RC[-3],Sheet1!R3C2:R803C11,10,FALSE)=0,"",VLOOKUP(Sheet2!RC[-3],Sheet1!R[1]C[-3]:R[801]C[6],10,FALSE)) ->  | F166: =Sheet1!R197C10 -> 53.061720219378913 | G166: =IF(RC[-3]<0,0,IF(AND(RC[-3]<RC[-1],RC[-3]<2),100,IF(AND(RC[-3]<RC[-1],RC[-3]>=2,RC[-3]<3),95,IF(AND(RC[-3]<RC[-1],RC[-3]>=3,RC[-3]<4),90,IF(AND(RC[-3]<RC[-1],RC[-3]>=4,RC[-3]<5),85,IF(AND(RC[-3]<RC[-1],RC[-3]>=5,RC[-3]<6),80,IF(AND(RC[-3]<RC[-1],RC[-3]>=6,RC[-3]<7),75,IF(AND(RC[-3]<RC[-1],RC[-3]>=7,RC[-3]<8),70,IF(AND(RC[-3]<RC[-1],RC[-3]>=8,RC[-3]<9),65,IF(AND(RC[-3]<RC[-1],RC[-3]>=9,RC[-3]<10),60,IF(AND(RC[-3]<RC[-1],RC[-3]>=10,RC[-3]<11),55,IF(AND(RC[-3]<RC[-1],RC[-3]>=11,RC[-3]<12),50,IF(AND(RC[-3]<RC[-1],RC[-3]>=12,RC[-3]<13),45,IF(AND(RC[-3]<RC[-1],RC[-3]>=13,RC[-3]<14),40,IF(AND(RC[-3]<RC[-1],RC[-3]>=14,RC[-3]<15),35,IF(AND(RC[-3]<RC[-1],RC[-3]>=15,RC[-3]<16),30,IF(AND(RC[-3]<RC[-1],RC[-3]>=16,RC[-3]<17),25,IF(AND(RC[-3]<RC[-1],RC[-3]>=17,RC[-3]<18),20,IF(AND(RC[-3]<RC[-1],RC[-3]>=18,RC[-3]<19),15,IF(AND(RC[-3]<RC[-1],RC[-3]>=19,RC[-3]<20),10,IF(AND(RC[-3]<RC[-1],RC[-3]>=20,RC[-3]<21),5,IF(AND(RC[-3]<RC[-1],RC[-3]>=21),0,IF(AND(RC[-3]>RC[-1],RC[-3]>=2,RC[-3]<3),90,IF(AND(RC[-3]>RC[-1],RC[-3]>=3,RC[-3]<4),90,IF(AND(RC[-3]>RC[-1],RC[-3]>=4,RC[-3]<5),80,IF(AND(RC[-3]>RC[-1],RC[-3]>=5,RC[-3]<6),70,IF(AND(RC[-3]>RC[-1],RC[-3]>=6,RC[-3]<7),60,IF(AND(RC[-3]>RC[-1],RC[-3]>=7,RC[-3]<8),50,IF(AND(RC[-3]>RC[-1],RC[-3]>=8,RC[-3]<9),40,IF(AND(RC[-3]>RC[-1],RC[-3]>=9,RC[-3]<10),30,IF(AND(RC[-3]>RC[-1],RC[-3]>=10,RC[-3]<11),20,IF(AND(RC[-3]>RC[-1],RC[-3]>=11,RC[-3]<12),10,IF(AND(RC[-3]>RC[-1],RC[-3]>=12),0))))))))))))))))))))))))))))))))) -> 65 | H166: =IF(RC[-3]="","",IF(RC[-3]<0.3,100,IF(AND(RC[-3]>=0.3,RC[-3]>0.4),95,IF(AND(RC[-3]>=0.4,RC[-3]<0.5),90,IF(AND(RC[-3]>=0.5,RC[-3]<0.6),85,IF(AND(RC[-3]>=0.6,RC[-3]<0.7),80,IF(AND(RC[-3]>=0.6,RC[-3]<1),80,IF(AND(RC[-3]>1,RC[-3]<2),50,IF(RC[-3]>2,0))))))))) ->  | I166: =IF(RC[-1]="",RC[-2],0.7*RC[-1]+0.3*RC[-2]) -> 65
A167: گروه اقتصادی کرمان خودرو | B167: خکرمان | C167: =VLOOKUP(RC[-1],Sheet1!R3C2:R802C3,2,FALSE) -> خودرو و قطعات | D167: =VLOOKUP(RC[-2],Sheet1!R3C2:R802C9,8,FALSE) -> -152.89862230864 | E167: =IF(VLOOKUP(RC[-3],Sheet1!R3C2:R803C11,10,FALSE)=0,"",VLOOKUP(Sheet2!RC[-3],Sheet1!R[1]C[-3]:R[801]C[6],10,FALSE)) -> 1.5 | F167: =Sheet1!R197C10 -> 53.061720219378913 | G167: =IF(RC[-3]<0,0,IF(AND(RC[-3]<RC[-1],RC[-3]<2),100,IF(AND(RC[-3]<RC[-1],RC[-3]>=2,RC[-3]<3),95,IF(AND(RC[-3]<RC[-1],RC[-3]>=3,RC[-3]<4),90,IF(AND(RC[-3]<RC[-1],RC[-3]>=4,RC[-3]<5),85,IF(AND(RC[-3]<RC[-1],RC[-3]>=5,RC[-3]<6),80,IF(AND(RC[-3]<RC[-1],RC[-3]>=6,RC[-3]<7),75,IF(AND(RC[-3]<RC[-1],RC[-3]>=7,RC[-3]<8),70,IF(AND(RC[-3]<RC[-1],RC[-3]>=8,RC[-3]<9),65,IF(AND(RC[-3]<RC[-1],RC[-3]>=9,RC[-3]<10),60,IF(AND(RC[-3]<RC[-1],RC[-3]>=10,RC[-3]<11),55,IF(AND(RC[-3]<RC[-1],RC[-3]>=11,RC[-3]<12),50,IF(AND(RC[-3]<RC[-1],RC[-3]>=12,RC[-3]<13),45,IF(AND(RC[-3]<RC[-1],RC[-3]>=13,RC[-3]<14),40,IF(AND(RC[-3]<RC[-1],RC[-3]>=14,RC[-3]<15),35,IF(AND(RC[-3]<RC[-1],RC[-3]>=15,RC[-3]<16),30,IF(AND(RC[-3]<RC[-1],RC[-3]>=16,RC[-3]<17),25,IF(AND(RC[-3]<RC[-1],RC[-3]>=17,RC[-3]<18),20,IF(AND(RC[-3]<RC[-1],RC[-3]>=18,RC[-3]<19),15,IF(AND(RC[-3]<RC[-1],RC[-3]>=19,RC[-3]<20),10,IF(AND(RC[-3]<RC[-1],RC[-3]>=20,RC[-3]<21),5,IF(AND(RC[-3]<RC[-1],RC[-3]>=21),0,IF(AND(RC[-3]>RC[-1],RC[-3]>=2,RC[-3]<3),90,IF(AND(RC[-3]>RC[-1],RC[-3]>=3,RC[-3]<4),90,IF(AND(RC[-3]>RC[-1],RC[-3]>=4,RC[-3]<5),80,IF(AND(RC[-3]>RC[-1],RC[-3]>=5,RC[-3]<6),70,IF(AND(RC[-3]>RC[-1],RC[-3]>=6,RC[-3]<7),60,IF(AND(RC[-3]>RC[-1],RC[-3]>=7,RC[-3]<8),50,IF(AND(RC[-3]>RC[-1],RC[-3]>=8,RC[-3]<9),40,IF(AND(RC[-3]>RC[-1],RC[-3]>=9,RC[-3]<10),30,IF(AND(RC[-3]>RC[-1],RC[-3]>=10,RC[-3]<11),20,IF(AND(RC[-3]>RC[-1],RC[-3]>=11,RC[-3]<12),10,IF(AND(RC[-3]>RC[-1],RC[-3]>=12),0))))))))))))))))))))))))))))))))) -> 0 | H167: =IF(RC[-3]="","",IF(RC[-3]<0.3,100,IF(AND(RC[-3]>=0.3,RC[-3]>0.4),95,IF(AND(RC[-3]>=0.4,RC[-3]<0.5),90,IF(AND(RC[-3]>=0.5,RC[-3]<0.6),85,IF(AND(RC[-3]>=0.6,RC[-3]<0.7),80,IF(AND(RC[-3]>=0.6,RC[-3]<1),80,IF(AND(RC[-3]>1,RC[-3]<2),50,IF(RC[-3]>2,0))))))))) -> 95 | I167: =IF(RC[-1]="",RC[-2],0.7*RC[-1]+0.3*RC[-2]) -> 66.5
A168: گروه بهمن | B168: خبهمن | C168: =VLOOKUP(RC[-1],Sheet1!R3C2:R802C3,2,FALSE) -> خودرو و قطعات | D168: =VLOOKUP(RC[-2],Sheet1!R3C2:R802C9,8,FALSE) -> 23.437490165396309 | E168: =IF(VLOOKUP(RC[-3],Sheet1!R3C2:R803C11,10,FALSE)=0,"",VLOOKUP(Sheet2!RC[-3],Sheet1!R[1]C[-3]:R[801]C[6],10,FALSE)) -> 0.9 | F168: =Sheet1!R197C10 -> 53.061720219378913 | G168: =IF(RC[-3]<0,0,IF(AND(RC[-3]<RC[-1],RC[-3]<2),100,IF(AND(RC[-3]<RC[-1],RC[-3]>=2,RC[-3]<3),95,IF(AND(RC[-3]<RC[-1],RC[-3]>=3,RC[-3]<4),90,IF(AND(RC[-3]<RC[-1],RC[-3]>=4,RC[-3]<5),85,IF(AND(RC[-3]<RC[-1],RC[-3]>=5,RC[-3]<6),80,IF(AND(RC[-3]<RC[-1],RC[-3]>=6,RC[-3]<7),75,IF(AND(RC[-3]<RC[-1],RC[-3]>=7,RC[-3]<8),70,IF(AND(RC[-3]<RC[-1],RC[-3]>=8,RC[-3]<9),65,IF(AND(RC[-3]<RC[-1],RC[-3]>=9,RC[-3]<10),60,IF(AND(RC[-3]<RC[-1],RC[-3]>=10,RC[-3]<11),55,IF(AND(RC[-3]<RC[-1],RC[-3]>=11,RC[-3]<12),50,IF(AND(RC[-3]<RC[-1],RC[-3]>=12,RC[-3]<13),45,IF(AND(RC[-3]<RC[-1],RC[-3]>=13,RC[-3]<14),40,IF(AND(RC[-3]<RC[-1],RC[-3]>=14,RC[-3]<15),35,IF(AND(RC[-3]<RC[-1],RC[-3]>=15,RC[-3]<16),30,IF(AND(RC[-3]<RC[-1],RC[-3]>=16,RC[-3]<17),25,IF(AND(RC[-3]<RC[-1],RC[-3]>=17,RC[-3]<18),20,IF(AND(RC[-3]<RC[-1],RC[-3]>=18,RC[-3]<19),15,IF(AND(RC[-3]<RC[-1],RC[-3]>=19,RC[-3]<20),10,IF(AND(RC[-3]<RC[-1],RC[-3]>=20,RC[-3]<21),5,IF(AND(RC[-3]<RC[-1],RC[-3]>=21),0,IF(AND(RC[-3]>RC[-1],RC[-3]>=2,RC[-3]<3),90,IF(AND(RC[-3]>RC[-1],RC[-3]>=3,RC[-3]<4),90,IF(AND(RC[-3]>RC[-1],RC[-3]>=4,RC[-3]<5),80,IF(AND(RC[-3]>RC[-1],RC[-3]>=5,RC[-3]<6),70,IF(AND(RC[-3]>RC[-1],RC[-3]>=6,RC[-3]<7),60,IF(AND(RC[-3]>RC[-1],RC[-3]>=7,RC[-3]<8),50,IF(AND(RC[-3]>RC[-1],RC[-3]>=8,RC[-3]<9),40,IF(AND(RC[-3]>RC[-1],RC[-3]>=9,RC[-3]<10),30,IF(AND(RC[-3]>RC[-1],RC[-3]>=10,RC[-3]<11),20,IF(AND(RC[-3]>RC[-1],RC[-3]>=11,RC[-3]<12),10,IF(AND(RC[-3]>RC[-1],RC[-3]>=12),0))))))))))))))))))))))))))))))))) -> 0 | H168: =IF(RC[-3]="","",IF(RC[-3]<0.3,100,IF(AND(RC[-3]>=0.3,RC[-3]>0.4),95,IF(AND(RC[-3]>=0.4,RC[-3]<0.5),90,IF(AND(RC[-3]>=0.5,RC[-3]<0.6),85,IF(AND(RC[-3]>=0.6,RC[-3]<0.7),80,IF(AND(RC[-3]>=0.6,RC[-3]<1),80,IF(AND(RC[-3]>1,RC[-3]<2),50,IF(RC[-3]>2,0))))))))) -> 95 | I168: =IF(RC[-1]="",RC[-2],0.7*RC[-1]+0.3*RC[-2]) -> 66.5
A169: لنت ترمز | B169: خلنت | C169: =VLOOKUP(RC[-1],Sheet1!R3C2:R802C3,2,FALSE) -> خودرو و قطعات | D169: =VLOOKUP(RC[-2],Sheet1!R3C2:R802C9,8,FALSE) -> 14.288550210862706 | E169: =IF(VLOOKUP(RC[-3],Sheet1!R3C2:R803C11,10,FALSE)=0,"",VLOOKUP(Sheet2!RC[-3],Sheet1!R[1]C[-3]:R[801]C[6],10,FALSE)) ->  | F169: =Sheet1!R197C10 -> 53.061720219378913 | G169: =IF(RC[-3]<0,0,IF(AND(RC[-3]<RC[-1],RC[-3]<2),100,IF(AND(RC[-3]<RC[-1],RC[-3]>=2,RC[-3]<3),95,IF(AND(RC[-3]<RC[-1],RC[-3]>=3,RC[-3]<4),90,IF(AND(RC[-3]<RC[-1],RC[-3]>=4,RC[-3]<5),85,IF(AND(RC[-3]<RC[-1],RC[-3]>=5,RC[-3]<6),80,IF(AND(RC[-3]<RC[-1],RC[-3]>=6,RC[-3]<7),75,IF(AND(RC[-3]<RC[-1],RC[-3]>=7,RC[-3]<8),70,IF(AND(RC[-3]<RC[-1],RC[-3]>=8,RC[-3]<9),65,IF(AND(RC[-3]<RC[-1],RC[-3]>=9,RC[-3]<10),60,IF(AND(RC[-3]<RC[-1],RC[-3]>=10,RC[-3]<11),55,IF(AND(RC[-3]<RC[-1],RC[-3]>=11,RC[-3]<12),50,IF(AND(RC[-3]<RC[-1],RC[-3]>=12,RC[-3]<13),45,IF(AND(RC[-3]<RC[-1],RC[-3]>=13,RC[-3]<14),40,IF(AND(RC[-3]<RC[-1],RC[-3]>=14,RC[-3]<15),35,IF(AND(RC[-3]<RC[-1],RC[-3]>=15,RC[-3]<16),30,IF(AND(RC[-3]<RC[-1],RC[-3]>=16,RC[-3]<17),25,IF(AND(RC[-3]<RC[-1],RC[-3]>=17,RC[-3]<18),20,IF(AND(RC[-3]<RC[-1],RC[-3]>=18,RC[-3]<19),15,IF(AND(RC[-3]<RC[-1],RC[-3]>=19,RC[-3]<20),10,IF(AND(RC[-3]<RC[-1],RC[-3]>=20,RC[-3]<21),5,IF(AND(RC[-3]<RC[-1],RC[-3]>=21),0,IF(AND(RC[-3]>RC[-1],RC[-3]>=2,RC[-3]<3),90,IF(AND(RC[-3]>RC[-1],RC[-3]>=3,RC[-3]<4),90,IF(AND(RC[-3]>RC[-1],RC[-3]>=4,RC[-3]<5),80,IF(AND(RC[-3]>RC[-1],RC[-3]>=5,RC[-3]<6),70,IF(AND(RC[-3]>RC[-1],RC[-3]>=6,RC[-3]<7),60,IF(AND(RC[-3]>RC[-1],RC[-3]>=7,RC[-3]<8),50,IF(AND(RC[-3]>RC[-1],RC[-3]>=8,RC[-3]<9),40,IF(AND(RC[-3]>RC[-1],RC[-3]>=9,RC[-3]<10),30,IF(AND(RC[-3]>RC[-1],RC[-3]>=10,RC[-3]<11),20,IF(AND(RC[-3]>RC[-1],RC[-3]>=11,RC[-3]<12),10,IF(AND(RC[-3]>RC[-1],RC[-3]>=12),0))))))))))))))))))))))))))))))))) -> 35 | H169: =IF(RC[-3]="","",IF(RC[-3]<0.3,100,IF(AND(RC[-3]>=0.3,RC[-3]>0.4),95,IF(AND(RC[-3]>=0.4,RC[-3]<0.5),90,IF(AND(RC[-3]>=0.5,RC[-3]<0.6),85,IF(AND(RC[-3]>=0.6,RC[-3]<0.7),80,IF(AND(RC[-3]>=0.6,RC[-3]<1),80,IF(AND(RC[-3]>1,RC[-3]<2),50,IF(RC[-3]>2,0))))))))) ->  | I169: =IF(RC[-1]="",RC[-2],0.7*RC[-1]+0.3*RC[-2]) -> 35
A170: مالیبل سایپا | B170: خلیبل | C170: =VLOOKUP(RC[-1],Sheet1!R3C2:R802C3,2,FALSE) -> خودرو و قطعات | D170: =VLOOKUP(RC[-2],Sheet1!R3C2:R802C9,8,FALSE) -> 506.78234631905099 | E170: =IF(VLOOKUP(RC[-3],Sheet1!R3C2:R803C11,10,FALSE)=0,"",VLOOKUP(Sheet2!RC[-3],Sheet1!R[1]C[-3]:R[801]C[6],10,FALSE)) ->  | F170: =Sheet1!R197C10 -> 53.061720219378913 | G170: =IF(RC[-3]<0,0,IF(AND(RC[-3]<RC[-1],RC[-3]<2),100,IF(AND(RC[-3]<RC[-1],RC[-3]>=2,RC[-3]<3),95,IF(AND(RC[-3]<RC[-1],RC[-3]>=3,RC[-3]<4),90,IF(AND(RC[-3]<RC[-1],RC[-3]>=4,RC[-3]<5),85,IF(AND(RC[-3]<RC[-1],RC[-3]>=5,RC[-3]<6),80,IF(AND(RC[-3]<RC[-1],RC[-3]>=6,RC[-3]<7),75,IF(AND(RC[-3]<RC[-1],RC[-3]>=7,RC[-3]<8),70,IF(AND(RC[-3]<RC[-1],RC[-3]>=8,RC[-3]<9),65,IF(AND(RC[-3]<RC[-1],RC[-3]>=9,RC[-3]<10),60,IF(AND(RC[-3]<RC[-1],RC[-3]>=10,RC[-3]<11),55,IF(AND(RC[-3]<RC[-1],RC[-3]>=11,RC[-3]<12),50,IF(AND(RC[-3]<RC[-1],RC[-3]>=12,RC[-3]<13),45,IF(AND(RC[-3]<RC[-1],RC[-3]>=13,RC[-3]<14),40,IF(AND(RC[-3]<RC[-1],RC[-3]>=14,RC[-3]<15),35,IF(AND(RC[-3]<RC[-1],RC[-3]>=15,RC[-3]<16),30,IF(AND(RC[-3]<RC[-1],RC[-3]>=16,RC[-3]<17),25,IF(AND(RC[-3]<RC[-1],RC[-3]>=17,RC[-3]<18),20,IF(AND(RC[-3]<RC[-1],RC[-3]>=18,RC[-3]<19),15,IF(AND(RC[-3]<RC[-1],RC[-3]>=19,RC[-3]<20),10,IF(AND(RC[-3]<RC[-1],RC[-3]>=20,RC[-3]<21),5,IF(AND(RC[-3]<RC[-1],RC[-3]>=21),0,IF(AND(RC[-3]>RC[-1],RC[-3]>=2,RC[-3]<3),90,IF(AND(RC[-3]>RC[-1],RC[-3]>=3,RC[-3]<4),90,IF(AND(RC[-3]>RC[-1],RC[-3]>=4,RC[-3]<5),80,IF(AND(RC[-3]>RC[-1],RC[-3]>=5,RC[-3]<6),70,IF(AND(RC[-3]>RC[-1],RC[-3]>=6,RC[-3]<7),60,IF(AND(RC[-3]>RC[-1],RC[-3]>=7,RC[-3]<8),50,IF(AND(RC[-3]>RC[-1],RC[-3]>=8,RC[-3]<9),40,IF(AND(RC[-3]>RC[-1],RC[-3]>=9,RC[-3]<10),30,IF(AND(RC[-3]>RC[-1],RC[-3]>=10,RC[-3]<11),20,IF(AND(RC[-3]>RC[-1],RC[-3]>=11,RC[-3]<12),10,IF(AND(RC[-3]>RC[-1],RC[-3]>=12),0))))))))))))))))))))))))))))))))) -> 0 | H170: =IF(RC[-3]="","",IF(RC[-3]<0.3,100,IF(AND(RC[-3]>=0.3,RC[-3]>0.4),95,IF(AND(RC[-3]>=0.4,RC[-3]<0.5),90,IF(AND(RC[-3]>=0.5,RC[-3]<0.6),85,IF(AND(RC[-3]>=0.6,RC[-3]<0.7),80,IF(AND(RC[-3]>=0.6,RC[-3]<1),80,IF(AND(RC[-3]>1,RC[-3]<2),50,IF(RC[-3]>2,0))))))))) ->  | I170: =IF(RC[-1]="",RC[-2],0.7*RC[-1]+0.3*RC[-2]) -> 0
A171: محورخودرو | B171: خمحور | C171: =VLOOKUP(RC[-1],Sheet1!R3C2:R802C3,2,FALSE) -> خودرو و قطعات | D171: =VLOOKUP(RC[-2],Sheet1!R3C2:R802C9,8,FALSE) -> 54.690651307565005 | E171: =IF(VLOOKUP(RC[-3],Sheet1!R3C2:R803C11,10,FALSE)=0,"",VLOOKUP(Sheet2!RC[-3],Sheet1!R[1]C[-3]:R[801]C[6],10,FALSE)) ->  | F171: =Sheet1!R197C10 -> 53.061720219378913 | G171: =IF(RC[-3]<0,0,IF(AND(RC[-3]<RC[-1],RC[-3]<2),100,IF(AND(RC[-3]<RC[-1],RC[-3]>=2,RC[-3]<3),95,IF(AND(RC[-3]<RC[-1],RC[-3]>=3,RC[-3]<4),90,IF(AND(RC[-3]<RC[-1],RC[-3]>=4,RC[-3]<5),85,IF(AND(RC[-3]<RC[-1],RC[-3]>=5,RC[-3]<6),80,IF(AND(RC[-3]<RC[-1],RC[-3]>=6,RC[-3]<7),75,IF(AND(RC[-3]<RC[-1],RC[-3]>=7,RC[-3]<8),70,IF(AND(RC[-3]<RC[-1],RC[-3]>=8,RC[-3]<9),65,IF(AND(RC[-3]<RC[-1],RC[-3]>=9,RC[-3]<10),60,IF(AND(RC[-3]<RC[-1],RC[-3]>=10,RC[-3]<11),55,IF(AND(RC[-3]<RC[-1],RC[-3]>=11,RC[-3]<12),50,IF(AND(RC[-3]<RC[-1],RC[-3]>=12,RC[-3]<13),45,IF(AND(RC[-3]<RC[-1],RC[-3]>=13,RC[-3]<14),40,IF(AND(RC[-3]<RC[-1],RC[-3]>=14,RC[-3]<15),35,IF(AND(RC[-3]<RC[-1],RC[-3]>=15,RC[-3]<16),30,IF(AND(RC[-3]<RC[-1],RC[-3]>=16,RC[-3]<17),25,IF(AND(RC[-3]<RC[-1],RC[-3]>=17,RC[-3]<18),20,IF(AND(RC[-3]<RC[-1],RC[-3]>=18,RC[-3]<19),15,IF(AND(RC[-3]<RC[-1],RC[-3]>=19,RC[-3]<20),10,IF(AND(RC[-3]<RC[-1],RC[-3]>=20,RC[-3]<21),5,IF(AND(RC[-3]<RC[-1],RC[-3]>=21),0,IF(AND(RC[-3]>RC[-1],RC[-3]>=2,RC[-3]<3),90,IF(AND(RC[-3]>RC[-1],RC[-3]>=3,RC[-3]<4),90,IF(AND(RC[-3]>RC[-1],RC[-3]>=4,RC[-3]<5),80,IF(AND(RC[-3]>RC[-1],RC[-3]>=5,RC[-3]<6),70,IF(AND(RC[-3]>RC[-1],RC[-3]>=6,RC[-3]<7),60,IF(AND(RC[-3]>RC[-1],RC[-3]>=7,RC[-3]<8),50,IF(AND(RC[-3]>RC[-1],RC[-3]>=8,RC[-3]<9),40,IF(AND(RC[-3]>RC[-1],RC[-3]>=9,RC[-3]<10),30,IF(AND(RC[-3]>RC[-1],RC[-3]>=10,RC[-3]<11),20,IF(AND(RC[-3]>RC[-1],RC[-3]>=11,RC[-3]<12),10,IF(AND(RC[-3]>RC[-1],RC[-3]>=12),0))))))))))))))))))))))))))))))))) -> 0 | H171: =IF(RC[-3]="","",IF(RC[-3]<0.3,100,IF(AND(RC[-3]>=0.3,RC[-3]>0.4),95,IF(AND(RC[-3]>=0.4,RC[-3]<0.5),90,IF(AND(RC[-3]>=0.5,RC[-3]<0.6),85,IF(AND(RC[-3]>=0.6,RC[-3]<0.7),80,IF(AND(RC[-3]>=0.6,RC[-3]<1),80,IF(AND(RC[-3]>1,RC[-3]<2),50,IF(RC[-3]>2,0))))))))) ->  | I171: =IF(RC[-1]="",RC[-2],0.7*RC[-1]+0.3*RC[-2]) -> 0
A172: محورسازان | B172: خوساز | C172: =VLOOKUP(RC[-1],Sheet1!R3C2:R802C3,2,FALSE) -> خودرو و قطعات | D172: =VLOOKUP(RC[-2],Sheet1!R3C2:R802C9,8,FALSE) -> 44.077867808166161 | E172: =IF(VLOOKUP(RC[-3],Sheet1!R3C2:R803C11,10,FALSE)=0,"",VLOOKUP(Sheet2!RC[-3],Sheet1!R[1]C[-3]:R[801]C[6],10,FALSE)) ->  | F172: =Sheet1!R197C10 -> 53.061720219378913 | G172: =IF(RC[-3]<0,0,IF(AND(RC[-3]<RC[-1],RC[-3]<2),100,IF(AND(RC[-3]<RC[-1],RC[-3]>=2,RC[-3]<3),95,IF(AND(RC[-3]<RC[-1],RC[-3]>=3,RC[-3]<4),90,IF(AND(RC[-3]<RC[-1],RC[-3]>=4,RC[-3]<5),85,IF(AND(RC[-3]<RC[-1],RC[-3]>=5,RC[-3]<6),80,IF(AND(RC[-3]<RC[-1],RC[-3]>=6,RC[-3]<7),75,IF(AND(RC[-3]<RC[-1],RC[-3]>=7,RC[-3]<8),70,IF(AND(RC[-3]<RC[-1],RC[-3]>=8,RC[-3]<9),65,IF(AND(RC[-3]<RC[-1],RC[-3]>=9,RC[-3]<10),60,IF(AND(RC[-3]<RC[-1],RC[-3]>=10,RC[-3]<11),55,IF(AND(RC[-3]<RC[-1],RC[-3]>=11,RC[-3]<12),50,IF(AND(RC[-3]<RC[-1],RC[-3]>=12,RC[-3]<13),45,IF(AND(RC[-3]<RC[-1],RC[-3]>=13,RC[-3]<14),40,IF(AND(RC[-3]<RC[-1],RC[-3]>=14,RC[-3]<15),35,IF(AND(RC[-3]<RC[-1],RC[-3]>=15,RC[-3]<16),30,IF(AND(RC[-3]<RC[-1],RC[-3]>=16,RC[-3]<17),25,IF(AND(RC[-3]<RC[-1],RC[-3]>=17,RC[-3]<18),20,IF(AND(RC[-3]<RC[-1],RC[-3]>=18,RC[-3]<19),15,IF(AND(RC[-3]<RC[-1],RC[-3]>=19,RC[-3]<20),10,IF(AND(RC[-3]<RC[-1],RC[-3]>=20,RC[-3]<21),5,IF(AND(RC[-3]<RC[-1],RC[-3]>=21),0,IF(AND(RC[-3]>RC[-1],RC[-3]>=2,RC[-3]<3),90,IF(AND(RC[-3]>RC[-1],RC[-3]>=3,RC[-3]<4),90,IF(AND(RC[-3]>RC[-1],RC[-3]>=4,RC[-3]<5),80,IF(AND(RC[-3]>RC[-1],RC[-3]>=5,RC[-3]<6),70,IF(AND(RC[-3]>RC[-1],RC[-3]>=6,RC[-3]<7),60,IF(AND(RC[-3]>RC[-1],RC[-3]>=7,RC[-3]<8),50,IF(AND(RC[-3]>RC[-1],RC[-3]>=8,RC[-3]<9),40,IF(AND(RC[-3]>RC[-1],RC[-3]>=9,RC[-3]<10),30,IF(AND(RC[-3]>RC[-1],RC[-3]>=10,RC[-3]<11),20,IF(AND(RC[-3]>RC[-1],RC[-3]>=11,RC[-3]<12),10,IF(AND(RC[-3]>RC[-1],RC[-3]>=12),0))))))))))))))))))))))))))))))))) -> 0 | H172: =IF(RC[-3]="","",IF(RC[-3]<0.3,100,IF(AND(RC[-3]>=0.3,RC[-3]>0.4),95,IF(AND(RC[-3]>=0.4,RC[-3]<0.5),90,IF(AND(RC[-3]>=0.5,RC[-3]<0.6),85,IF(AND(RC[-3]>=0.6,RC[-3]<0.7),80,IF(AND(RC[-3]>=0.6,RC[-3]<1),80,IF(AND(RC[-3]>1,RC[-3]<2),50,IF(RC[-3]>2,0))))))))) ->  | I172: =IF(RC[-1]="",RC[-2],0.7*RC[-1]+0.3*RC[-2]) -> 0
A173: مهرکام پارس | B173: خمهر | C173: =VLOOKUP(RC[-1],Sheet1!R3C2:R802C3,2,FALSE) -> خودرو و قطعات | D173: =VLOOKUP(RC[-2],Sheet1!R3C2:R802C9,8,FALSE) -> 23.008389062947682 | E173: =IF(VLOOKUP(RC[-3],Sheet1!R3C2:R803C11,10,FALSE)=0,"",VLOOKUP(Sheet2!RC[-3],Sheet1!R[1]C[-3]:R[801]C[6],10,FALSE)) ->  | F173: =Sheet1!R197C10 -> 53.061720219378913 | G173: =IF(RC[-3]<0,0,IF(AND(RC[-3]<RC[-1],RC[-3]<2),100,IF(AND(RC[-3]<RC[-1],RC[-3]>=2,RC[-3]<3),95,IF(AND(RC[-3]<RC[-1],RC[-3]>=3,RC[-3]<4),90,IF(AND(RC[-3]<RC[-1],RC[-3]>=4,RC[-3]<5),85,IF(AND(RC[-3]<RC[-1],RC[-3]>=5,RC[-3]<6),80,IF(AND(RC[-3]<RC[-1],RC[-3]>=6,RC[-3]<7),75,IF(AND(RC[-3]<RC[-1],RC[-3]>=7,RC[-3]<8),70,IF(AND(RC[-3]<RC[-1],RC[-3]>=8,RC[-3]<9),65,IF(AND(RC[-3]<RC[-1],RC[-3]>=9,RC[-3]<10),60,IF(AND(RC[-3]<RC[-1],RC[-3]>=10,RC[-3]<11),55,IF(AND(RC[-3]<RC[-1],RC[-3]>=11,RC[-3]<12),50,IF(AND(RC[-3]<RC[-1],RC[-3]>=12,RC[-3]<13),45,IF(AND(RC[-3]<RC[-1],RC[-3]>=13,RC[-3]<14),40,IF(AND(RC[-3]<RC[-1],RC[-3]>=14,RC[-3]<15),35,IF(AND(RC[-3]<RC[-1],RC[-3]>=15,RC[-3]<16),30,IF(AND(RC[-3]<RC[-1],RC[-3]>=16,RC[-3]<17),25,IF(AND(RC[-3]<RC[-1],RC[-3]>=17,RC[-3]<18),20,IF(AND(RC[-3]<RC[-1],RC[-3]>=18,RC[-3]<19),15,IF(AND(RC[-3]<RC[-1],RC[-3]>=19,RC[-3]<20),10,IF(AND(RC[-3]<RC[-1],RC[-3]>=20,RC[-3]<21),5,IF(AND(RC[-3]<RC[-1],RC[-3]>=21),0,IF(AND(RC[-3]>RC[-1],RC[-3]>=2,RC[-3]<3),90,IF(AND(RC[-3]>RC[-1],RC[-3]>=3,RC[-3]<4),90,IF(AND(RC[-3]>RC[-1],RC[-3]>=4,RC[-3]<5),80,IF(AND(RC[-3]>RC[-1],RC[-3]>=5,RC[-3]<6),70,IF(AND(RC[-3]>RC[-1],RC[-3]>=6,RC[-3]<7),60,IF(AND(RC[-3]>RC[-1],RC[-3]>=7,RC[-3]<8),50,IF(AND(RC[-3]>RC[-1],RC[-3]>=8,RC[-3]<9),40,IF(AND(RC[-3]>RC[-1],RC[-3]>=9,RC[-3]<10),30,IF(AND(RC[-3]>RC[-1],RC[-3]>=10,RC[-3]<11),20,IF(AND(RC[-3]>RC[-1],RC[-3]>=11,RC[-3]<12),10,IF(AND(RC[-3]>RC[-1],RC[-3]>=12),0))))))))))))))))))))))))))))))))) -> 0 | H173: =IF(RC[-3]="","",IF(RC[-3]<0.3,100,IF(AND(RC[-3]>=0.3,RC[-3]>0.4),95,IF(AND(RC[-3]>=0.4,RC[-3]<0.5),90,IF(AND(RC[-3]>=0.5,RC[-3]<0.6),85,IF(AND(RC[-3]>=0.6,RC[-3]<0.7),80,IF(AND(RC[-3]>=0.6,RC[-3]<1),80,IF(AND(RC[-3]>1,RC[-3]<2),50,IF(RC[-3]>2,0))))))))) ->  | I173: =IF(RC[-1]="",RC[-2],0.7*RC[-1]+0.3*RC[-2]) -> 0
A174: موتورسازان تراکتور | B174: خموتور | C174: =VLOOKUP(RC[-1],Sheet1!R3C2:R802C3,2,FALSE) -> خودرو و قطعات | D174: =VLOOKUP(RC[-2],Sheet1!R3C2:R802C9,8,FALSE) -> 10.094353437555792 | E174: =IF(VLOOKUP(RC[-3],Sheet1!R3C2:R803C11,10,FALSE)=0,"",VLOOKUP(Sheet2!RC[-3],Sheet1!R[1]C[-3]:R[801]C[6],10,FALSE)) ->  | F174: =Sheet1!R197C10 -> 53.061720219378913 | G174: =IF(RC[-3]<0,0,IF(AND(RC[-3]<RC[-1],RC[-3]<2),100,IF(AND(RC[-3]<RC[-1],RC[-3]>=2,RC[-3]<3),95,IF(AND(RC[-3]<RC[-1],RC[-3]>=3,RC[-3]<4),90,IF(AND(RC[-3]<RC[-1],RC[-3]>=4,RC[-3]<5),85,IF(AND(RC[-3]<RC[-1],RC[-3]>=5,RC[-3]<6),80,IF(AND(RC[-3]<RC[-1],RC[-3]>=6,RC[-3]<7),75,IF(AND(RC[-3]<RC[-1],RC[-3]>=7,RC[-3]<8),70,IF(AND(RC[-3]<RC[-1],RC[-3]>=8,RC[-3]<9),65,IF(AND(RC[-3]<RC[-1],RC[-3]>=9,RC[-3]<10),60,IF(AND(RC[-3]<RC[-1],RC[-3]>=10,RC[-3]<11),55,IF(AND(RC[-3]<RC[-1],RC[-3]>=11,RC[-3]<12),50,IF(AND(RC[-3]<RC[-1],RC[-3]>=12,RC[-3]<13),45,IF(AND(RC[-3]<RC[-1],RC[-3]>=13,RC[-3]<14),40,IF(AND(RC[-3]<RC[-1],RC[-3]>=14,RC[-3]<15),35,IF(AND(RC[-3]<RC[-1],RC[-3]>=15,RC[-3]<16),30,IF(AND(RC[-3]<RC[-1],RC[-3]>=16,RC[-3]<17),25,IF(AND(RC[-3]<RC[-1],RC[-3]>=17,RC[-3]<18),20,IF(AND(RC[-3]<RC[-1],RC[-3]>=18,RC[-3]<19),15,IF(AND(RC[-3]<RC[-1],RC[-3]>=19,RC[-3]<20),10,IF(AND(RC[-3]<RC[-1],RC[-3]>=20,RC[-3]<21),5,IF(AND(RC[-3]<RC[-1],RC[-3]>=21),0,IF(AND(RC[-3]>RC[-1],RC[-3]>=2,RC[-3]<3),90,IF(AND(RC[-3]>RC[-1],RC[-3]>=3,RC[-3]<4),90,IF(AND(RC[-3]>RC[-1],RC[-3]>=4,RC[-3]<5),80,IF(AND(RC[-3]>RC[-1],RC[-3]>=5,RC[-3]<6),70,IF(AND(RC[-3]>RC[-1],RC[-3]>=6,RC[-3]<7),60,IF(AND(RC[-3]>RC[-1],RC[-3]>=7,RC[-3]<8),50,IF(AND(RC[-3]>RC[-1],RC[-3]>=8,RC[-3]<9),40,IF(AND(RC[-3]>RC[-1],RC[-3]>=9,RC[-3]<10),30,IF(AND(RC[-3]>RC[-1],RC[-3]>=10,RC[-3]<11),20,IF(AND(RC[-3]>RC[-1],RC[-3]>=11,RC[-3]<12),10,IF(AND(RC[-3]>RC[-1],RC[-3]>=12),0))))))))))))))))))))))))))))))))) -> 55 | H174: =IF(RC[-3]="","",IF(RC[-3]<0.3,100,IF(AND(RC[-3]>=0.3,RC[-3]>0.4),95,IF(AND(RC[-3]>=0.4,RC[-3]<0.5),90,IF(AND(RC[-3]>=0.5,RC[-3]<0.6),85,IF(AND(RC[-3]>=0.6,RC[-3]<0.7),80,IF(AND(RC[-3]>=0.6,RC[-3]<1),80,IF(AND(RC[-3]>1,RC[-3]<2),50,IF(RC[-3]>2,0))))))))) ->  | I174: =IF(RC[-1]="",RC[-2],0.7*RC[-1]+0.3*RC[-2]) -> 55
A175: نصیر ماشین | B175: خنصیر | C175: =VLOOKUP(RC[-1],Sheet1!R3C2:R802C3,2,FALSE) -> خودرو و قطعات | D175: =VLOOKUP(RC[-2],Sheet1!R3C2:R802C9,8,FALSE) -> 32.199456506619349 | E175: =IF(VLOOKUP(RC[-3],Sheet1!R3C2:R803C11,10,FALSE)=0,"",VLOOKUP(Sheet2!RC[-3],Sheet1!R[1]C[-3]:R[801]C[6],10,FALSE)) ->  | F175: =Sheet1!R197C10 -> 53.061720219378913 | G175: =IF(RC[-3]<0,0,IF(AND(RC[-3]<RC[-1],RC[-3]<2),100,IF(AND(RC[-3]<RC[-1],RC[-3]>=2,RC[-3]<3),95,IF(AND(RC[-3]<RC[-1],RC[-3]>=3,RC[-3]<4),90,IF(AND(RC[-3]<RC[-1],RC[-3]>=4,RC[-3]<5),85,IF(AND(RC[-3]<RC[-1],RC[-3]>=5,RC[-3]<6),80,IF(AND(RC[-3]<RC[-1],RC[-3]>=6,RC[-3]<7),75,IF(AND(RC[-3]<RC[-1],RC[-3]>=7,RC[-3]<8),70,IF(AND(RC[-3]<RC[-1],RC[-3]>=8,RC[-3]<9),65,IF(AND(RC[-3]<RC[-1],RC[-3]>=9,RC[-3]<10),60,IF(AND(RC[-3]<RC[-1],RC[-3]>=10,RC[-3]<11),55,IF(AND(RC[-3]<RC[-1],RC[-3]>=11,RC[-3]<12),50,IF(AND(RC[-3]<RC[-1],RC[-3]>=12,RC[-3]<13),45,IF(AND(RC[-3]<RC[-1],RC[-3]>=13,RC[-3]<14),40,IF(AND(RC[-3]<RC[-1],RC[-3]>=14,RC[-3]<15),35,IF(AND(RC[-3]<RC[-1],RC[-3]>=15,RC[-3]<16),30,IF(AND(RC[-3]<RC[-1],RC[-3]>=16,RC[-3]<17),25,IF(AND(RC[-3]<RC[-1],RC[-3]>=17,RC[-3]<18),20,IF(AND(RC[-3]<RC[-1],RC[-3]>=18,RC[-3]<19),15,IF(AND(RC[-3]<RC[-1],RC[-3]>=19,RC[-3]<20),10,IF(AND(RC[-3]<RC[-1],RC[-3]>=20,RC[-3]<21),5,IF(AND(RC[-3]<RC[-1],RC[-3]>=21),0,IF(AND(RC[-3]>RC[-1],RC[-3]>=2,RC[-3]<3),90,IF(AND(RC[-3]>RC[-1],RC[-3]>=3,RC[-3]<4),90,IF(AND(RC[-3]>RC[-1],RC[-3]>=4,RC[-3]<5),80,IF(AND(RC[-3]>RC[-1],RC[-3]>=5,RC[-3]<6),70,IF(AND(RC[-3]>RC[-1],RC[-3]>=6,RC[-3]<7),60,IF(AND(RC[-3]>RC[-1],RC[-3]>=7,RC[-3]<8),50,IF(AND(RC[-3]>RC[-1],RC[-3]>=8,RC[-3]<9),40,IF(AND(RC[-3]>RC[-1],RC[-3]>=9,RC[-3]<10),30,IF(AND(RC[-3]>RC[-1],RC[-3]>=10,RC[-3]<11),20,IF(AND(RC[-3]>RC[-1],RC[-3]>=11,RC[-3]<12),10,IF(AND(RC[-3]>RC[-1],RC[-3]>=12),0))))))))))))))))))))))))))))))))) -> 0 | H175: =IF(RC[-3]="","",IF(RC[-3]<0.3,100,IF(AND(RC[-3]>=0.3,RC[-3]>0.4),95,IF(AND(RC[-3]>=0.4,RC[-3]<0.5),90,IF(AND(RC[-3]>=0.5,RC[-3]<0.6),85,IF(AND(RC[-3]>=0.6,RC[-3]<0.7),80,IF(AND(RC[-3]>=0.6,RC[-3]<1),80,IF(AND(RC[-3]>1,RC[-3]<2),50,IF(RC[-3]>2,0))))))))) ->  | I175: =IF(RC[-1]="",RC[-2],0.7*RC[-1]+0.3*RC[-2]) -> 0
A176: نیرو محرکه | B176: خمحرکه | C176: =VLOOKUP(RC[-1],Sheet1!R3C2:R802C3,2,FALSE) -> خودرو و قطعات | D176: =VLOOKUP(RC[-2],Sheet1!R3C2:R802C9,8,FALSE) -> 35.933257215862497 | E176: =IF(VLOOKUP(RC[-3],Sheet1!R3C2:R803C11,10,FALSE)=0,"",VLOOKUP(Sheet2!RC[-3],Sheet1!R[1]C[-3]:R[801]C[6],10,FALSE)) ->  | F176: =Sheet1!R197C10 -> 53.061720219378913 | G176: =IF(RC[-3]<0,0,IF(AND(RC[-3]<RC[-1],RC[-3]<2),100,IF(AND(RC[-3]<RC[-1],RC[-3]>=2,RC[-3]<3),95,IF(AND(RC[-3]<RC[-1],RC[-3]>=3,RC[-3]<4),90,IF(AND(RC[-3]<RC[-1],RC[-3]>=4,RC[-3]<5),85,IF(AND(RC[-3]<RC[-1],RC[-3]>=5,RC[-3]<6),80,IF(AND(RC[-3]<RC[-1],RC[-3]>=6,RC[-3]<7),75,IF(AND(RC[-3]<RC[-1],RC[-3]>=7,RC[-3]<8),70,IF(AND(RC[-3]<RC[-1],RC[-3]>=8,RC[-3]<9),65,IF(AND(RC[-3]<RC[-1],RC[-3]>=9,RC[-3]<10),60,IF(AND(RC[-3]<RC[-1],RC[-3]>=10,RC[-3]<11),55,IF(AND(RC[-3]<RC[-1],RC[-3]>=11,RC[-3]<12),50,IF(AND(RC[-3]<RC[-1],RC[-3]>=12,RC[-3]<13),45,IF(AND(RC[-3]<RC[-1],RC[-3]>=13,RC[-3]<14),40,IF(AND(RC[-3]<RC[-1],RC[-3]>=14,RC[-3]<15),35,IF(AND(RC[-3]<RC[-1],RC[-3]>=15,RC[-3]<16),30,IF(AND(RC[-3]<RC[-1],RC[-3]>=16,RC[-3]<17),25,IF(AND(RC[-3]<RC[-1],RC[-3]>=17,RC[-3]<18),20,IF(AND(RC[-3]<RC[-1],RC[-3]>=18,RC[-3]<19),15,IF(AND(RC[-3]<RC[-1],RC[-3]>=19,RC[-3]<20),10,IF(AND(RC[-3]<RC[-1],RC[-3]>=20,RC[-3]<21),5,IF(AND(RC[-3]<RC[-1],RC[-3]>=21),0,IF(AND(RC[-3]>RC[-1],RC[-3]>=2,RC[-3]<3),90,IF(AND(RC[-3]>RC[-1],RC[-3]>=3,RC[-3]<4),90,IF(AND(RC[-3]>RC[-1],RC[-3]>=4,RC[-3]<5),80,IF(AND(RC[-3]>RC[-1],RC[-3]>=5,RC[-3]<6),70,IF(AND(RC[-3]>RC[-1],RC[-3]>=6,RC[-3]<7),60,IF(AND(RC[-3]>RC[-1],RC[-3]>=7,RC[-3]<8),50,IF(AND(RC[-3]>RC[-1],RC[-3]>=8,RC[-3]<9),40,IF(AND(RC[-3]>RC[-1],RC[-3]>=9,RC[-3]<10),30,IF(AND(RC[-3]>RC[-1],RC[-3]>=10,RC[-3]<11),20,IF(AND(RC[-3]>RC[-1],RC[-3]>=11,RC[-3]<12),10,IF(AND(RC[-3]>RC[-1],RC[-3]>=12),0))))))))))))))))))))))))))))))))) -> 0 | H176: =IF(RC[-3]="","",IF(RC[-3]<0.3,100,IF(AND(RC[-3]>=0.3,RC[-3]>0.4),95,IF(AND(RC[-3]>=0.4,RC[-3]<0.5),90,IF(AND(RC[-3]>=0.5,RC[-3]<0.6),85,IF(AND(RC[-3]>=0.6,RC[-3]<0.7),80,IF(AND(RC[-3]>=0.6,RC[-3]<1),80,IF(AND(RC[-3]>1,RC[-3]<2),50,IF(RC[-3]>2,0))))))))) ->  | I176: =IF(RC[-1]="",RC[-2],0.7*RC[-1]+0.3*RC[-2]) -> 0
A177: کمک فنر ایندامین | B177: خکمک | C177: =VLOOKUP(RC[-1],Sheet1!R3C2:R802C3,2,FALSE) -> خودرو و قطعات | D177: =VLOOKUP(RC[-2],Sheet1!R3C2:R802C9,8,FALSE) -> 151.88333333333333 | E177: =IF(VLOOKUP(RC[-3],Sheet1!R3C2:R803C11,10,FALSE)=0,"",VLOOKUP(Sheet2!RC[-3],Sheet1!R[1]C[-3]:R[801]C[6],10,FALSE)) ->  | F177: =Sheet1!R197C10 -> 53.061720219378913 | G177: =IF(RC[-3]<0,0,IF(AND(RC[-3]<RC[-1],RC[-3]<2),100,IF(AND(RC[-3]<RC[-1],RC[-3]>=2,RC[-3]<3),95,IF(AND(RC[-3]<RC[-1],RC[-3]>=3,RC[-3]<4),90,IF(AND(RC[-3]<RC[-1],RC[-3]>=4,RC[-3]<5),85,IF(AND(RC[-3]<RC[-1],RC[-3]>=5,RC[-3]<6),80,IF(AND(RC[-3]<RC[-1],RC[-3]>=6,RC[-3]<7),75,IF(AND(RC[-3]<RC[-1],RC[-3]>=7,RC[-3]<8),70,IF(AND(RC[-3]<RC[-1],RC[-3]>=8,RC[-3]<9),65,IF(AND(RC[-3]<RC[-1],RC[-3]>=9,RC[-3]<10),60,IF(AND(RC[-3]<RC[-1],RC[-3]>=10,RC[-3]<11),55,IF(AND(RC[-3]<RC[-1],RC[-3]>=11,RC[-3]<12),50,IF(AND(RC[-3]<RC[-1],RC[-3]>=12,RC[-3]<13),45,IF(AND(RC[-3]<RC[-1],RC[-3]>=13,RC[-3]<14),40,IF(AND(RC[-3]<RC[-1],RC[-3]>=14,RC[-3]<15),35,IF(AND(RC[-3]<RC[-1],RC[-3]>=15,RC[-3]<16),30,IF(AND(RC[-3]<RC[-1],RC[-3]>=16,RC[-3]<17),25,IF(AND(RC[-3]<RC[-1],RC[-3]>=17,RC[-3]<18),20,IF(AND(RC[-3]<RC[-1],RC[-3]>=18,RC[-3]<19),15,IF(AND(RC[-3]<RC[-1],RC[-3]>=19,RC[-3]<20),10,IF(AND(RC[-3]<RC[-1],RC[-3]>=20,RC[-3]<21),5,IF(AND(RC[-3]<RC[-1],RC[-3]>=21),0,IF(AND(RC[-3]>RC[-1],RC[-3]>=2,RC[-3]<3),90,IF(AND(RC[-3]>RC[-1],RC[-3]>=3,RC[-3]<4),90,IF(AND(RC[-3]>RC[-1],RC[-3]>=4,RC[-3]<5),80,IF(AND(RC[-3]>RC[-1],RC[-3]>=5,RC[-3]<6),70,IF(AND(RC[-3]>RC[-1],RC[-3]>=6,RC[-3]<7),60,IF(AND(RC[-3]>RC[-1],RC[-3]>=7,RC[-3]<8),50,IF(AND(RC[-3]>RC[-1],RC[-3]>=8,RC[-3]<9),40,IF(AND(RC[-3]>RC[-1],RC[-3]>=9,RC[-3]<10),30,IF(AND(RC[-3]>RC[-1],RC[-3]>=10,RC[-3]<11),20,IF(AND(RC[-3]>RC[-1],RC[-3]>=11,RC[-3]<12),10,IF(AND(RC[-3]>RC[-1],RC[-3]>=12),0))))))))))))))))))))))))))))))))) -> 0 | H177: =IF(RC[-3]="","",IF(RC[-3]<0.3,100,IF(AND(RC[-3]>=0.3,RC[-3]>0.4),95,IF(AND(RC[-3]>=0.4,RC[-3]<0.5),90,IF(AND(RC[-3]>=0.5,RC[-3]<0.6),85,IF(AND(RC[-3]>=0.6,RC[-3]<0.7),80,IF(AND(RC[-3]>=0.6,RC[-3]<1),80,IF(AND(RC[-3]>1,RC[-3]<2),50,IF(RC[-3]>2,0))))))))) ->  | I177: =IF(RC[-1]="",RC[-2],0.7*RC[-1]+0.3*RC[-2]) -> 0
A178: البرز بالک | B178: دبالک | C178: =VLOOKUP(RC[-1],Sheet1!R3C2:R802C3,2,FALSE) -> دارویی | D178: =VLOOKUP(RC[-2],Sheet1!R3C2:R802C9,8,FALSE) -> 8.863144252805391 | E178: =IF(VLOOKUP(RC[-3],Sheet1!R3C2:R803C11,10,FALSE)=0,"",VLOOKUP(Sheet2!RC[-3],Sheet1!R[1]C[-3]:R[801]C[6],10,FALSE)) ->  | F178: =Sheet1!R246C10 -> 7.5295416184238002 | G178: =IF(RC[-3]<0,0,IF(AND(RC[-3]<RC[-1],RC[-3]<2),100,IF(AND(RC[-3]<RC[-1],RC[-3]>=2,RC[-3]<3),95,IF(AND(RC[-3]<RC[-1],RC[-3]>=3,RC[-3]<4),90,IF(AND(RC[-3]<RC[-1],RC[-3]>=4,RC[-3]<5),85,IF(AND(RC[-3]<RC[-1],RC[-3]>=5,RC[-3]<6),80,IF(AND(RC[-3]<RC[-1],RC[-3]>=6,RC[-3]<7),75,IF(AND(RC[-3]<RC[-1],RC[-3]>=7,RC[-3]<8),70,IF(AND(RC[-3]<RC[-1],RC[-3]>=8,RC[-3]<9),65,IF(AND(RC[-3]<RC[-1],RC[-3]>=9,RC[-3]<10),60,IF(AND(RC[-3]<RC[-1],RC[-3]>=10,RC[-3]<11),55,IF(AND(RC[-3]<RC[-1],RC[-3]>=11,RC[-3]<12),50,IF(AND(RC[-3]<RC[-1],RC[-3]>=12,RC[-3]<13),45,IF(AND(RC[-3]<RC[-1],RC[-3]>=13,RC[-3]<14),40,IF(AND(RC[-3]<RC[-1],RC[-3]>=14,RC[-3]<15),35,IF(AND(RC[-3]<RC[-1],RC[-3]>=15,RC[-3]<16),30,IF(AND(RC[-3]<RC[-1],RC[-3]>=16,RC[-3]<17),25,IF(AND(RC[-3]<RC[-1],RC[-3]>=17,RC[-3]<18),20,IF(AND(RC[-3]<RC[-1],RC[-3]>=18,RC[-3]<19),15,IF(AND(RC[-3]<RC[-1],RC[-3]>=19,RC[-3]<20),10,IF(AND(RC[-3]<RC[-1],RC[-3]>=20,RC[-3]<21),5,IF(AND(RC[-3]<RC[-1],RC[-3]>=21),0,IF(AND(RC[-3]>RC[-1],RC[-3]>=2,RC[-3]<3),90,IF(AND(RC[-3]>RC[-1],RC[-3]>=3,RC[-3]<4),90,IF(AND(RC[-3]>RC[-1],RC[-3]>=4,RC[-3]<5),80,IF(AND(RC[-3]>RC[-1],RC[-3]>=5,RC[-3]<6),70,IF(AND(RC[-3]>RC[-1],RC[-3]>=6,RC[-3]<7),60,IF(AND(RC[-3]>RC[-1],RC[-3]>=7,RC[-3]<8),50,IF(AND(RC[-3]>RC[-1],RC[-3]>=8,RC[-3]<9),40,IF(AND(RC[-3]>RC[-1],RC[-3]>=9,RC[-3]<10),30,IF(AND(RC[-3]>RC[-1],RC[-3]>=10,RC[-3]<11),20,IF(AND(RC[-3]>RC[-1],RC[-3]>=11,RC[-3]<12),10,IF(AND(RC[-3]>RC[-1],RC[-3]>=12),0))))))))))))))))))))))))))))))))) -> 40 | H178: =IF(RC[-3]="","",IF(RC[-3]<0.3,100,IF(AND(RC[-3]>=0.3,RC[-3]>0.4),95,IF(AND(RC[-3]>=0.4,RC[-3]<0.5),90,IF(AND(RC[-3]>=0.5,RC[-3]<0.6),85,IF(AND(RC[-3]>=0.6,RC[-3]<0.7),80,IF(AND(RC[-3]>=0.6,RC[-3]<1),80,IF(AND(RC[-3]>1,RC[-3]<2),50,IF(RC[-3]>2,0))))))))) ->  | I178: =IF(RC[-1]="",RC[-2],0.7*RC[-1]+0.3*RC[-2]) -> 40
A179: البرزدارو | B179: دالبر | C179: =VLOOKUP(RC[-1],Sheet1!R3C2:R802C3,2,FALSE) -> دارویی | D179: =VLOOKUP(RC[-2],Sheet1!R3C2:R802C9,8,FALSE) -> 4.3982673128090859 | E179: =IF(VLOOKUP(RC[-3],Sheet1!R3C2:R803C11,10,FALSE)=0,"",VLOOKUP(Sheet2!RC[-3],Sheet1!R[1]C[-3]:R[801]C[6],10,FALSE)) ->  | F179: =Sheet1!R246C10 -> 7.5295416184238002 | G179: =IF(RC[-3]<0,0,IF(AND(RC[-3]<RC[-1],RC[-3]<2),100,IF(AND(RC[-3]<RC[-1],RC[-3]>=2,RC[-3]<3),95,IF(AND(RC[-3]<RC[-1],RC[-3]>=3,RC[-3]<4),90,IF(AND(RC[-3]<RC[-1],RC[-3]>=4,RC[-3]<5),85,IF(AND(RC[-3]<RC[-1],RC[-3]>=5,RC[-3]<6),80,IF(AND(RC[-3]<RC[-1],RC[-3]>=6,RC[-3]<7),75,IF(AND(RC[-3]<RC[-1],RC[-3]>=7,RC[-3]<8),70,IF(AND(RC[-3]<RC[-1],RC[-3]>=8,RC[-3]<9),65,IF(AND(RC[-3]<RC[-1],RC[-3]>=9,RC[-3]<10),60,IF(AND(RC[-3]<RC[-1],RC[-3]>=10,RC[-3]<11),55,IF(AND(RC[-3]<RC[-1],RC[-3]>=11,RC[-3]<12),50,IF(AND(RC[-3]<RC[-1],RC[-3]>=12,RC[-3]<13),45,IF(AND(RC[-3]<RC[-1],RC[-3]>=13,RC[-3]<14),40,IF(AND(RC[-3]<RC[-1],RC[-3]>=14,RC[-3]<15),35,IF(AND(RC[-3]<RC[-1],RC[-3]>=15,RC[-3]<16),30,IF(AND(RC[-3]<RC[-1],RC[-3]>=16,RC[-3]<17),25,IF(AND(RC[-3]<RC[-1],RC[-3]>=17,RC[-3]<18),20,IF(AND(RC[-3]<RC[-1],RC[-3]>=18,RC[-3]<19),15,IF(AND(RC[-3]<RC[-1],RC[-3]>=19,RC[-3]<20),10,IF(AND(RC[-3]<RC[-1],RC[-3]>=20,RC[-3]<21),5,IF(AND(RC[-3]<RC[-1],RC[-3]>=21),0,IF(AND(RC[-3]>RC[-1],RC[-3]>=2,RC[-3]<3),90,IF(AND(RC[-3]>RC[-1],RC[-3]>=3,RC[-3]<4),90,IF(AND(RC[-3]>RC[-1],RC[-3]>=4,RC[-3]<5),80,IF(AND(RC[-3]>RC[-1],RC[-3]>=5,RC[-3]<6),70,IF(AND(RC[-3]>RC[-1],RC[-3]>=6,RC[-3]<7),60,IF(AND(RC[-3]>RC[-1],RC[-3]>=7,RC[-3]<8),50,IF(AND(RC[-3]>RC[-1],RC[-3]>=8,RC[-3]<9),40,IF(AND(RC[-3]>RC[-1],RC[-3]>=9,RC[-3]<10),30,IF(AND(RC[-3]>RC[-1],RC[-3]>=10,RC[-3]<11),20,IF(AND(RC[-3]>RC[-1],RC[-3]>=11,RC[-3]<12),10,IF(AND(RC[-3]>RC[-1],RC[-3]>=12),0))))))))))))))))))))))))))))))))) -> 85 | H179: =IF(RC[-3]="","",IF(RC[-3]<0.3,100,IF(AND(RC[-3]>=0.3,RC[-3]>0.4),95,IF(AND(RC[-3]>=0.4,RC[-3]<0.5),90,IF(AND(RC[-3]>=0.5,RC[-3]<0.6),85,IF(AND(RC[-3]>=0.6,RC[-3]<0.7),80,IF(AND(RC[-3]>=0.6,RC[-3]<1),80,IF(AND(RC[-3]>1,RC[-3]<2),50,IF(RC[-3]>2,0))))))))) ->  | I179: =IF(RC[-1]="",RC[-2],0.7*RC[-1]+0.3*RC[-2]) -> 85
A180: ایران دارو | B180: دیران | C180: =VLOOKUP(RC[-1],Sheet1!R3C2:R802C3,2,FALSE) -> دارویی | D180: =VLOOKUP(RC[-2],Sheet1!R3C2:R802C9,8,FALSE) -> 11.092415335964331 | E180: =IF(VLOOKUP(RC[-3],Sheet1!R3C2:R803C11,10,FALSE)=0,"",VLOOKUP(Sheet2!RC[-3],Sheet1!R[1]C[-3]:R[801]C[6],10,FALSE)) ->  | F180: =Sheet1!R246C10 -> 7.5295416184238002 | G180: =IF(RC[-3]<0,0,IF(AND(RC[-3]<RC[-1],RC[-3]<2),100,IF(AND(RC[-3]<RC[-1],RC[-3]>=2,RC[-3]<3),95,IF(AND(RC[-3]<RC[-1],RC[-3]>=3,RC[-3]<4),90,IF(AND(RC[-3]<RC[-1],RC[-3]>=4,RC[-3]<5),85,IF(AND(RC[-3]<RC[-1],RC[-3]>=5,RC[-3]<6),80,IF(AND(RC[-3]<RC[-1],RC[-3]>=6,RC[-3]<7),75,IF(AND(RC[-3]<RC[-1],RC[-3]>=7,RC[-3]<8),70,IF(AND(RC[-3]<RC[-1],RC[-3]>=8,RC[-3]<9),65,IF(AND(RC[-3]<RC[-1],RC[-3]>=9,RC[-3]<10),60,IF(AND(RC[-3]<RC[-1],RC[-3]>=10,RC[-3]<11),55,IF(AND(RC[-3]<RC[-1],RC[-3]>=11,RC[-3]<12),50,IF(AND(RC[-3]<RC[-1],RC[-3]>=12,RC[-3]<13),45,IF(AND(RC[-3]<RC[-1],RC[-3]>=13,RC[-3]<14),40,IF(AND(RC[-3]<RC[-1],RC[-3]>=14,RC[-3]<15),35,IF(AND(RC[-3]<RC[-1],RC[-3]>=15,RC[-3]<16),30,IF(AND(RC[-3]<RC[-1],RC[-3]>=16,RC[-3]<17),25,IF(AND(RC[-3]<RC[-1],RC[-3]>=17,RC[-3]<18),20,IF(AND(RC[-3]<RC[-1],RC[-3]>=18,RC[-3]<19),15,IF(AND(RC[-3]<RC[-1],RC[-3]>=19,RC[-3]<20),10,IF(AND(RC[-3]<RC[-1],RC[-3]>=20,RC[-3]<21),5,IF(AND(RC[-3]<RC[-1],RC[-3]>=21),0,IF(AND(RC[-3]>RC[-1],RC[-3]>=2,RC[-3]<3),90,IF(AND(RC[-3]>RC[-1],RC[-3]>=3,RC[-3]<4),90,IF(AND(RC[-3]>RC[-1],RC[-3]>=4,RC[-3]<5),80,IF(AND(RC[-3]>RC[-1],RC[-3]>=5,RC[-3]<6),70,IF(AND(RC[-3]>RC[-1],RC[-3]>=6,RC[-3]<7),60,IF(AND(RC[-3]>RC[-1],RC[-3]>=7,RC[-3]<8),50,IF(AND(RC[-3]>RC[-1],RC[-3]>=8,RC[-3]<9),40,IF(AND(RC[-3]>RC[-1],RC[-3]>=9,RC[-3]<10),30,IF(AND(RC[-3]>RC[-1],RC[-3]>=10,RC[-3]<11),20,IF(AND(RC[-3]>RC[-1],RC[-3]>=11,RC[-3]<12),10,IF(AND(RC[-3]>RC[-1],RC[-3]>=12),0))))))))))))))))))))))))))))))))) -> 10 | H180: =IF(RC[-3]="","",IF(RC[-3]<0.3,100,IF(AND(RC[-3]>=0.3,RC[-3]>0.4),95,IF(AND(RC[-3]>=0.4,RC[-3]<0.5),90,IF(AND(RC[-3]>=0.5,RC[-3]<0.6),85,IF(AND(RC[-3]>=0.6,RC[-3]<0.7),80,IF(AND(RC[-3]>=0.6,RC[-3]<1),80,IF(AND(RC[-3]>1,RC[-3]<2),50,IF(RC[-3]>2,0))))))))) ->  | I180: =IF(RC[-1]="",RC[-2],0.7*RC[-1]+0.3*RC[-2]) -> 10
A181: پارس دارو | B181: دپارس | C181: =VLOOKUP(RC[-1],Sheet1!R3C2:R802C3,2,FALSE) -> دارویی | D181: =VLOOKUP(RC[-2],Sheet1!R3C2:R802C9,8,FALSE) -> 6.7258598195329604 | E181: =IF(VLOOKUP(RC[-3],Sheet1!R3C2:R803C11,10,FALSE)=0,"",VLOOKUP(Sheet2!RC[-3],Sheet1!R[1]C[-3]:R[801]C[6],10,FALSE)) ->  | F181: =Sheet1!R246C10 -> 7.5295416184238002 | G181: =IF(RC[-3]<0,0,IF(AND(RC[-3]<RC[-1],RC[-3]<2),100,IF(AND(RC[-3]<RC[-1],RC[-3]>=2,RC[-3]<3),95,IF(AND(RC[-3]<RC[-1],RC[-3]>=3,RC[-3]<4),90,IF(AND(RC[-3]<RC[-1],RC[-3]>=4,RC[-3]<5),85,IF(AND(RC[-3]<RC[-1],RC[-3]>=5,RC[-3]<6),80,IF(AND(RC[-3]<RC[-1],RC[-3]>=6,RC[-3]<7),75,IF(AND(RC[-3]<RC[-1],RC[-3]>=7,RC[-3]<8),70,IF(AND(RC[-3]<RC[-1],RC[-3]>=8,RC[-3]<9),65,IF(AND(RC[-3]<RC[-1],RC[-3]>=9,RC[-3]<10),60,IF(AND(RC[-3]<RC[-1],RC[-3]>=10,RC[-3]<11),55,IF(AND(RC[-3]<RC[-1],RC[-3]>=11,RC[-3]<12),50,IF(AND(RC[-3]<RC[-1],RC[-3]>=12,RC[-3]<13),45,IF(AND(RC[-3]<RC[-1],RC[-3]>=13,RC[-3]<14),40,IF(AND(RC[-3]<RC[-1],RC[-3]>=14,RC[-3]<15),35,IF(AND(RC[-3]<RC[-1],RC[-3]>=15,RC[-3]<16),30,IF(AND(RC[-3]<RC[-1],RC[-3]>=16,RC[-3]<17),25,IF(AND(RC[-3]<RC[-1],RC[-3]>=17,RC[-3]<18),20,IF(AND(RC[-3]<RC[-1],RC[-3]>=18,RC[-3]<19),15,IF(AND(RC[-3]<RC[-1],RC[-3]>=19,RC[-3]<20),10,IF(AND(RC[-3]<RC[-1],RC[-3]>=20,RC[-3]<21),5,IF(AND(RC[-3]<RC[-1],RC[-3]>=21),0,IF(AND(RC[-3]>RC[-1],RC[-3]>=2,RC[-3]<3),90,IF(AND(RC[-3]>RC[-1],RC[-3]>=3,RC[-3]<4),90,IF(AND(RC[-3]>RC[-1],RC[-3]>=4,RC[-3]<5),80,IF(AND(RC[-3]>RC[-1],RC[-3]>=5,RC[-3]<6),70,IF(AND(RC[-3]>RC[-1],RC[-3]>=6,RC[-3]<7),60,IF(AND(RC[-3]>RC[-1],RC[-3]>=7,RC[-3]<8),50,IF(AND(RC[-3]>RC[-1],RC[-3]>=8,RC[-3]<9),40,IF(AND(RC[-3]>RC[-1],RC[-3]>=9,RC[-3]<10),30,IF(AND(RC[-3]>RC[-1],RC[-3]>=10,RC[-3]<11),20,IF(AND(RC[-3]>RC[-1],RC[-3]>=11,RC[-3]<12),10,IF(AND(RC[-3]>RC[-1],RC[-3]>=12),0))))))))))))))))))))))))))))))))) -> 75 | H181: =IF(RC[-3]="","",IF(RC[-3]<0.3,100,IF(AND(RC[-3]>=0.3,RC[-3]>0.4),95,IF(AND(RC[-3]>=0.4,RC[-3]<0.5),90,IF(AND(RC[-3]>=0.5,RC[-3]<0.6),85,IF(AND(RC[-3]>=0.6,RC[-3]<0.7),80,IF(AND(RC[-3]>=0.6,RC[-3]<1),80,IF(AND(RC[-3]>1,RC[-3]<2),50,IF(RC[-3]>2,0))))))))) ->  | I181: =IF(RC[-1]="",RC[-2],0.7*RC[-1]+0.3*RC[-2]) -> 75
A182: پخش البرز | B182: پخش | C182: =VLOOKUP(RC[-1],Sheet1!R3C2:R802C3,2,FALSE) -> دارویی | D182: =VLOOKUP(RC[-2],Sheet1!R3C2:R802C9,8,FALSE) -> 8.756641894573951 | E182: =IF(VLOOKUP(RC[-3],Sheet1!R3C2:R803C11,10,FALSE)=0,"",VLOOKUP(Sheet2!RC[-3],Sheet1!R[1]C[-3]:R[801]C[6],10,FALSE)) ->  | F182: =Sheet1!R246C10 -> 7.5295416184238002 | G182: =IF(RC[-3]<0,0,IF(AND(RC[-3]<RC[-1],RC[-3]<2),100,IF(AND(RC[-3]<RC[-1],RC[-3]>=2,RC[-3]<3),95,IF(AND(RC[-3]<RC[-1],RC[-3]>=3,RC[-3]<4),90,IF(AND(RC[-3]<RC[-1],RC[-3]>=4,RC[-3]<5),85,IF(AND(RC[-3]<RC[-1],RC[-3]>=5,RC[-3]<6),80,IF(AND(RC[-3]<RC[-1],RC[-3]>=6,RC[-3]<7),75,IF(AND(RC[-3]<RC[-1],RC[-3]>=7,RC[-3]<8),70,IF(AND(RC[-3]<RC[-1],RC[-3]>=8,RC[-3]<9),65,IF(AND(RC[-3]<RC[-1],RC[-3]>=9,RC[-3]<10),60,IF(AND(RC[-3]<RC[-1],RC[-3]>=10,RC[-3]<11),55,IF(AND(RC[-3]<RC[-1],RC[-3]>=11,RC[-3]<12),50,IF(AND(RC[-3]<RC[-1],RC[-3]>=12,RC[-3]<13),45,IF(AND(RC[-3]<RC[-1],RC[-3]>=13,RC[-3]<14),40,IF(AND(RC[-3]<RC[-1],RC[-3]>=14,RC[-3]<15),35,IF(AND(RC[-3]<RC[-1],RC[-3]>=15,RC[-3]<16),30,IF(AND(RC[-3]<RC[-1],RC[-3]>=16,RC[-3]<17),25,IF(AND(RC[-3]<RC[-1],RC[-3]>=17,RC[-3]<18),20,IF(AND(RC[-3]<RC[-1],RC[-3]>=18,RC[-3]<19),15,IF(AND(RC[-3]<RC[-1],RC[-3]>=19,RC[-3]<20),10,IF(AND(RC[-3]<RC[-1],RC[-3]>=20,RC[-3]<21),5,IF(AND(RC[-3]<RC[-1],RC[-3]>=21),0,IF(AND(RC[-3]>RC[-1],RC[-3]>=2,RC[-3]<3),90,IF(AND(RC[-3]>RC[-1],RC[-3]>=3,RC[-3]<4),90,IF(AND(RC[-3]>RC[-1],RC[-3]>=4,RC[-3]<5),80,IF(AND(RC[-3]>RC[-1],RC[-3]>=5,RC[-3]<6),70,IF(AND(RC[-3]>RC[-1],RC[-3]>=6,RC[-3]<7),60,IF(AND(RC[-3]>RC[-1],RC[-3]>=7,RC[-3]<8),50,IF(AND(RC[-3]>RC[-1],RC[-3]>=8,RC[-3]<9),40,IF(AND(RC[-3]>RC[-1],RC[-3]>=9,RC[-3]<10),30,IF(AND(RC[-3]>RC[-1],RC[-3]>=10,RC[-3]<11),20,IF(AND(RC[-3]>RC[-1],RC[-3]>=11,RC[-3]<12),10,IF(AND(RC[-3]>RC[-1],RC[-3]>=12),0))))))))))))))))))))))))))))))))) -> 40 | H182: =IF(RC[-3]="","",IF(RC[-3]<0.3,100,IF(AND(RC[-3]>=0.3,RC[-3]>0.4),95,IF(AND(RC[-3]>=0.4,RC[-3]<0.5),90,IF(AND(RC[-3]>=0.5,RC[-3]<0.6),85,IF(AND(RC[-3]>=0.6,RC[-3]<0.7),80,IF(AND(RC[-3]>=0.6,RC[-3]<1),80,IF(AND(RC[-3]>1,RC[-3]<2),50,IF(RC[-3]>2,0))))))))) ->  | I182: =IF(RC[-1]="",RC[-2],0.7*RC[-1]+0.3*RC[-2]) -> 40
A183: پخش رازی | B183: درازی | C183: =VLOOKUP(RC[-1],Sheet1!R3C2:R802C3,2,FALSE) -> دارویی | D183: =VLOOKUP(RC[-2],Sheet1!R3C2:R802C9,8,FALSE) -> 7.1080789604526853 | E183: =IF(VLOOKUP(RC[-3],Sheet1!R3C2:R803C11,10,FALSE)=0,"",VLOOKUP(Sheet2!RC[-3],Sheet1!R[1]C[-3]:R[801]C[6],10,FALSE)) ->  | F183: =Sheet1!R246C10 -> 7.5295416184238002 | G183: =IF(RC[-3]<0,0,IF(AND(RC[-3]<RC[-1],RC[-3]<2),100,IF(AND(RC[-3]<RC[-1],RC[-3]>=2,RC[-3]<3),95,IF(AND(RC[-3]<RC[-1],RC[-3]>=3,RC[-3]<4),90,IF(AND(RC[-3]<RC[-1],RC[-3]>=4,RC[-3]<5),85,IF(AND(RC[-3]<RC[-1],RC[-3]>=5,RC[-3]<6),80,IF(AND(RC[-3]<RC[-1],RC[-3]>=6,RC[-3]<7),75,IF(AND(RC[-3]<RC[-1],RC[-3]>=7,RC[-3]<8),70,IF(AND(RC[-3]<RC[-1],RC[-3]>=8,RC[-3]<9),65,IF(AND(RC[-3]<RC[-1],RC[-3]>=9,RC[-3]<10),60,IF(AND(RC[-3]<RC[-1],RC[-3]>=10,RC[-3]<11),55,IF(AND(RC[-3]<RC[-1],RC[-3]>=11,RC[-3]<12),50,IF(AND(RC[-3]<RC[-1],RC[-3]>=12,RC[-3]<13),45,IF(AND(RC[-3]<RC[-1],RC[-3]>=13,RC[-3]<14),40,IF(AND(RC[-3]<RC[-1],RC[-3]>=14,RC[-3]<15),35,IF(AND(RC[-3]<RC[-1],RC[-3]>=15,RC[-3]<16),30,IF(AND(RC[-3]<RC[-1],RC[-3]>=16,RC[-3]<17),25,IF(AND(RC[-3]<RC[-1],RC[-3]>=17,RC[-3]<18),20,IF(AND(RC[-3]<RC[-1],RC[-3]>=18,RC[-3]<19),15,IF(AND(RC[-3]<RC[-1],RC[-3]>=19,RC[-3]<20),10,IF(AND(RC[-3]<RC[-1],RC[-3]>=20,RC[-3]<21),5,IF(AND(RC[-3]<RC[-1],RC[-3]>=21),0,IF(AND(RC[-3]>RC[-1],RC[-3]>=2,RC[-3]<3),90,IF(AND(RC[-3]>RC[-1],RC[-3]>=3,RC[-3]<4),90,IF(AND(RC[-3]>RC[-1],RC[-3]>=4,RC[-3]<5),80,IF(AND(RC[-3]>RC[-1],RC[-3]>=5,RC[-3]<6),70,IF(AND(RC[-3]>RC[-1],RC[-3]>=6,RC[-3]<7),60,IF(AND(RC[-3]>RC[-1],RC[-3]>=7,RC[-3]<8),50,IF(AND(RC[-3]>RC[-1],RC[-3]>=8,RC[-3]<9),40,IF(AND(RC[-3]>RC[-1],RC[-3]>=9,RC[-3]<10),30,IF(AND(RC[-3]>RC[-1],RC[-3]>=10,RC[-3]<11),20,IF(AND(RC[-3]>RC[-1],RC[-3]>=11,RC[-3]<12),10,IF(AND(RC[-3]>RC[-1],RC[-3]>=12),0))))))))))))))))))))))))))))))))) -> 70 | H183: =IF(RC[-3]="","",IF(RC[-3]<0.3,100,IF(AND(RC[-3]>=0.3,RC[-3]>0.4),95,IF(AND(RC[-3]>=0.4,RC[-3]<0.5),90,IF(AND(RC[-3]>=0.5,RC[-3]<0.6),85,IF(AND(RC[-3]>=0.6,RC[-3]<0.7),80,IF(AND(RC[-3]>=0.6,RC[-3]<1),80,IF(AND(RC[-3]>1,RC[-3]<2),50,IF(RC[-3]>2,0))))))))) ->  | I183: =IF(RC[-1]="",RC[-2],0.7*RC[-1]+0.3*RC[-2]) -> 70
A184: پخش هجرت | B184: هجرت | C184: =VLOOKUP(RC[-1],Sheet1!R3C2:R802C3,2,FALSE) -> دارویی | D184: =VLOOKUP(RC[-2],Sheet1!R3C2:R802C9,8,FALSE) -> 5.0974051320574043 | E184: =IF(VLOOKUP(RC[-3],Sheet1!R3C2:R803C11,10,FALSE)=0,"",VLOOKUP(Sheet2!RC[-3],Sheet1!R[1]C[-3]:R[801]C[6],10,FALSE)) ->  | F184: =Sheet1!R246C10 -> 7.5295416184238002 | G184: =IF(RC[-3]<0,0,IF(AND(RC[-3]<RC[-1],RC[-3]<2),100,IF(AND(RC[-3]<RC[-1],RC[-3]>=2,RC[-3]<3),95,IF(AND(RC[-3]<RC[-1],RC[-3]>=3,RC[-3]<4),90,IF(AND(RC[-3]<RC[-1],RC[-3]>=4,RC[-3]<5),85,IF(AND(RC[-3]<RC[-1],RC[-3]>=5,RC[-3]<6),80,IF(AND(RC[-3]<RC[-1],RC[-3]>=6,RC[-3]<7),75,IF(AND(RC[-3]<RC[-1],RC[-3]>=7,RC[-3]<8),70,IF(AND(RC[-3]<RC[-1],RC[-3]>=8,RC[-3]<9),65,IF(AND(RC[-3]<RC[-1],RC[-3]>=9,RC[-3]<10),60,IF(AND(RC[-3]<RC[-1],RC[-3]>=10,RC[-3]<11),55,IF(AND(RC[-3]<RC[-1],RC[-3]>=11,RC[-3]<12),50,IF(AND(RC[-3]<RC[-1],RC[-3]>=12,RC[-3]<13),45,IF(AND(RC[-3]<RC[-1],RC[-3]>=13,RC[-3]<14),40,IF(AND(RC[-3]<RC[-1],RC[-3]>=14,RC[-3]<15),35,IF(AND(RC[-3]<RC[-1],RC[-3]>=15,RC[-3]<16),30,IF(AND(RC[-3]<RC[-1],RC[-3]>=16,RC[-3]<17),25,IF(AND(RC[-3]<RC[-1],RC[-3]>=17,RC[-3]<18),20,IF(AND(RC[-3]<RC[-1],RC[-3]>=18,RC[-3]<19),15,IF(AND(RC[-3]<RC[-1],RC[-3]>=19,RC[-3]<20),10,IF(AND(RC[-3]<RC[-1],RC[-3]>=20,RC[-3]<21),5,IF(AND(RC[-3]<RC[-1],RC[-3]>=21),0,IF(AND(RC[-3]>RC[-1],RC[-3]>=2,RC[-3]<3),90,IF(AND(RC[-3]>RC[-1],RC[-3]>=3,RC[-3]<4),90,IF(AND(RC[-3]>RC[-1],RC[-3]>=4,RC[-3]<5),80,IF(AND(RC[-3]>RC[-1],RC[-3]>=5,RC[-3]<6),70,IF(AND(RC[-3]>RC[-1],RC[-3]>=6,RC[-3]<7),60,IF(AND(RC[-3]>RC[-1],RC[-3]>=7,RC[-3]<8),50,IF(AND(RC[-3]>RC[-1],RC[-3]>=8,RC[-3]<9),40,IF(AND(RC[-3]>RC[-1],RC[-3]>=9,RC[-3]<10),30,IF(AND(RC[-3]>RC[-1],RC[-3]>=10,RC[-3]<11),20,IF(AND(RC[-3]>RC[-1],RC[-3]>=11,RC[-3]<12),10,IF(AND(RC[-3]>RC[-1],RC[-3]>=12),0))))))))))))))))))))))))))))))))) -> 80 | H184: =IF(RC[-3]="","",IF(RC[-3]<0.3,100,IF(AND(RC[-3]>=0.3,RC[-3]>0.4),95,IF(AND(RC[-3]>=0.4,RC[-3]<0.5),90,IF(AND(RC[-3]>=0.5,RC[-3]<0.6),85,IF(AND(RC[-3]>=0.6,RC[-3]<0.7),80,IF(AND(RC[-3]>=0.6,RC[-3]<1),80,IF(AND(RC[-3]>1,RC[-3]<2),50,IF(RC[-3]>2,0))))))))) ->  | I184: =IF(RC[-1]="",RC[-2],0.7*RC[-1]+0.3*RC[-2]) -> 80
A185: تهران دارو | B185: دتهران‌ | C185: =VLOOKUP(RC[-1],Sheet1!R3C2:R802C3,2,FALSE) -> دارویی | D185: =VLOOKUP(RC[-2],Sheet1!R3C2:R802C9,8,FALSE) -> 7.1087324434448984 | E185: =IF(VLOOKUP(RC[-3],Sheet1!R3C2:R803C11,10,FALSE)=0,"",VLOOKUP(Sheet2!RC[-3],Sheet1!R[1]C[-3]:R[801]C[6],10,FALSE)) ->  | F185: =Sheet1!R246C10 -> 7.5295416184238002 | G185: =IF(RC[-3]<0,0,IF(AND(RC[-3]<RC[-1],RC[-3]<2),100,IF(AND(RC[-3]<RC[-1],RC[-3]>=2,RC[-3]<3),95,IF(AND(RC[-3]<RC[-1],RC[-3]>=3,RC[-3]<4),90,IF(AND(RC[-3]<RC[-1],RC[-3]>=4,RC[-3]<5),85,IF(AND(RC[-3]<RC[-1],RC[-3]>=5,RC[-3]<6),80,IF(AND(RC[-3]<RC[-1],RC[-3]>=6,RC[-3]<7),75,IF(AND(RC[-3]<RC[-1],RC[-3]>=7,RC[-3]<8),70,IF(AND(RC[-3]<RC[-1],RC[-3]>=8,RC[-3]<9),65,IF(AND(RC[-3]<RC[-1],RC[-3]>=9,RC[-3]<10),60,IF(AND(RC[-3]<RC[-1],RC[-3]>=10,RC[-3]<11),55,IF(AND(RC[-3]<RC[-1],RC[-3]>=11,RC[-3]<12),50,IF(AND(RC[-3]<RC[-1],RC[-3]>=12,RC[-3]<13),45,IF(AND(RC[-3]<RC[-1],RC[-3]>=13,RC[-3]<14),40,IF(AND(RC[-3]<RC[-1],RC[-3]>=14,RC[-3]<15),35,IF(AND(RC[-3]<RC[-1],RC[-3]>=15,RC[-3]<16),30,IF(AND(RC[-3]<RC[-1],RC[-3]>=16,RC[-3]<17),25,IF(AND(RC[-3]<RC[-1],RC[-3]>=17,RC[-3]<18),20,IF(AND(RC[-3]<RC[-1],RC[-3]>=18,RC[-3]<19),15,IF(AND(RC[-3]<RC[-1],RC[-3]>=19,RC[-3]<20),10,IF(AND(RC[-3]<RC[-1],RC[-3]>=20,RC[-3]<21),5,IF(AND(RC[-3]<RC[-1],RC[-3]>=21),0,IF(AND(RC[-3]>RC[-1],RC[-3]>=2,RC[-3]<3),90,IF(AND(RC[-3]>RC[-1],RC[-3]>=3,RC[-3]<4),90,IF(AND(RC[-3]>RC[-1],RC[-3]>=4,RC[-3]<5),80,IF(AND(RC[-3]>RC[-1],RC[-3]>=5,RC[-3]<6),70,IF(AND(RC[-3]>RC[-1],RC[-3]>=6,RC[-3]<7),60,IF(AND(RC[-3]>RC[-1],RC[-3]>=7,RC[-3]<8),50,IF(AND(RC[-3]>RC[-1],RC[-3]>=8,RC[-3]<9),40,IF(AND(RC[-3]>RC[-1],RC[-3]>=9,RC[-3]<10),30,IF(AND(RC[-3]>RC[-1],RC[-3]>=10,RC[-3]<11),20,IF(AND(RC[-3]>RC[-1],RC[-3]>=11,RC[-3]<12),10,IF(AND(RC[-3]>RC[-1],RC[-3]>=12),0))))))))))))))))))))))))))))))))) -> 70 | H185: =IF(RC[-3]="","",IF(RC[-3]<0.3,100,IF(AND(RC[-3]>=0.3,RC[-3]>0.4),95,IF(AND(RC[-3]>=0.4,RC[-3]<0.5),90,IF(AND(RC[-3]>=0.5,RC[-3]<0.6),85,IF(AND(RC[-3]>=0.6,RC[-3]<0.7),80,IF(AND(RC[-3]>=0.6,RC[-3]<1),80,IF(AND(RC[-3]>1,RC[-3]<2),50,IF(RC[-3]>2,0))))))))) ->  | I185: =IF(RC[-1]="",RC[-2],0.7*RC[-1]+0.3*RC[-2]) -> 70
A186: تهران شیمی | B186: شتهران | C186: =VLOOKUP(RC[-1],Sheet1!R3C2:R802C3,2,FALSE) -> دارویی | D186: =VLOOKUP(RC[-2],Sheet1!R3C2:R802C9,8,FALSE) -> 11.35188828427877 | E186: =IF(VLOOKUP(RC[-3],Sheet1!R3C2:R803C11,10,FALSE)=0,"",VLOOKUP(Sheet2!RC[-3],Sheet1!R[1]C[-3]:R[801]C[6],10,FALSE)) ->  | F186: =Sheet1!R246C10 -> 7.5295416184238002 | G186: =IF(RC[-3]<0,0,IF(AND(RC[-3]<RC[-1],RC[-3]<2),100,IF(AND(RC[-3]<RC[-1],RC[-3]>=2,RC[-3]<3),95,IF(AND(RC[-3]<RC[-1],RC[-3]>=3,RC[-3]<4),90,IF(AND(RC[-3]<RC[-1],RC[-3]>=4,RC[-3]<5),85,IF(AND(RC[-3]<RC[-1],RC[-3]>=5,RC[-3]<6),80,IF(AND(RC[-3]<RC[-1],RC[-3]>=6,RC[-3]<7),75,IF(AND(RC[-3]<RC[-1],RC[-3]>=7,RC[-3]<8),70,IF(AND(RC[-3]<RC[-1],RC[-3]>=8,RC[-3]<9),65,IF(AND(RC[-3]<RC[-1],RC[-3]>=9,RC[-3]<10),60,IF(AND(RC[-3]<RC[-1],RC[-3]>=10,RC[-3]<11),55,IF(AND(RC[-3]<RC[-1],RC[-3]>=11,RC[-3]<12),50,IF(AND(RC[-3]<RC[-1],RC[-3]>=12,RC[-3]<13),45,IF(AND(RC[-3]<RC[-1],RC[-3]>=13,RC[-3]<14),40,IF(AND(RC[-3]<RC[-1],RC[-3]>=14,RC[-3]<15),35,IF(AND(RC[-3]<RC[-1],RC[-3]>=15,RC[-3]<16),30,IF(AND(RC[-3]<RC[-1],RC[-3]>=16,RC[-3]<17),25,IF(AND(RC[-3]<RC[-1],RC[-3]>=17,RC[-3]<18),20,IF(AND(RC[-3]<RC[-1],RC[-3]>=18,RC[-3]<19),15,IF(AND(RC[-3]<RC[-1],RC[-3]>=19,RC[-3]<20),10,IF(AND(RC[-3]<RC[-1],RC[-3]>=20,RC[-3]<21),5,IF(AND(RC[-3]<RC[-1],RC[-3]>=21),0,IF(AND(RC[-3]>RC[-1],RC[-3]>=2,RC[-3]<3),90,IF(AND(RC[-3]>RC[-1],RC[-3]>=3,RC[-3]<4),90,IF(AND(RC[-3]>RC[-1],RC[-3]>=4,RC[-3]<5),80,IF(AND(RC[-3]>RC[-1],RC[-3]>=5,RC[-3]<6),70,IF(AND(RC[-3]>RC[-1],RC[-3]>=6,RC[-3]<7),60,IF(AND(RC[-3]>RC[-1],RC[-3]>=7,RC[-3]<8),50,IF(AND(RC[-3]>RC[-1],RC[-3]>=8,RC[-3]<9),40,IF(AND(RC[-3]>RC[-1],RC[-3]>=9,RC[-3]<10),30,IF(AND(RC[-3]>RC[-1],RC[-3]>=10,RC[-3]<11),20,IF(AND(RC[-3]>RC[-1],RC[-3]>=11,RC[-3]<12),10,IF(AND(RC[-3]>RC[-1],RC[-3]>=12),0))))))))))))))))))))))))))))))))) -> 10 | H186: =IF(RC[-3]="","",IF(RC[-3]<0.3,100,IF(AND(RC[-3]>=0.3,RC[-3]>0.4),95,IF(AND(RC[-3]>=0.4,RC[-3]<0.5),90,IF(AND(RC[-3]>=0.5,RC[-3]<0.6),85,IF(AND(RC[-3]>=0.6,RC[-3]<0.7),80,IF(AND(RC[-3]>=0.6,RC[-3]<1),80,IF(AND(RC[-3]>1,RC[-3]<2),50,IF(RC[-3]>2,0))))))))) ->  | I186: =IF(RC[-1]="",RC[-2],0.7*RC[-1]+0.3*RC[-2]) -> 10
A187: توزیع داروپخش | B187: دتوزیع | C187: =VLOOKUP(RC[-1],Sheet1!R3C2:R802C3,2,FALSE) -> دارویی | D187: =VLOOKUP(RC[-2],Sheet1!R3C2:R802C9,8,FALSE) -> 4.911756913305152 | E187: =IF(VLOOKUP(RC[-3],Sheet1!R3C2:R803C11,10,FALSE)=0,"",VLOOKUP(Sheet2!RC[-3],Sheet1!R[1]C[-3]:R[801]C[6],10,FALSE)) ->  | F187: =Sheet1!R246C10 -> 7.5295416184238002 | G187: =IF(RC[-3]<0,0,IF(AND(RC[-3]<RC[-1],RC[-3]<2),100,IF(AND(RC[-3]<RC[-1],RC[-3]>=2,RC[-3]<3),95,IF(AND(RC[-3]<RC[-1],RC[-3]>=3,RC[-3]<4),90,IF(AND(RC[-3]<RC[-1],RC[-3]>=4,RC[-3]<5),85,IF(AND(RC[-3]<RC[-1],RC[-3]>=5,RC[-3]<6),80,IF(AND(RC[-3]<RC[-1],RC[-3]>=6,RC[-3]<7),75,IF(AND(RC[-3]<RC[-1],RC[-3]>=7,RC[-3]<8),70,IF(AND(RC[-3]<RC[-1],RC[-3]>=8,RC[-3]<9),65,IF(AND(RC[-3]<RC[-1],RC[-3]>=9,RC[-3]<10),60,IF(AND(RC[-3]<RC[-1],RC[-3]>=10,RC[-3]<11),55,IF(AND(RC[-3]<RC[-1],RC[-3]>=11,RC[-3]<12),50,IF(AND(RC[-3]<RC[-1],RC[-3]>=12,RC[-3]<13),45,IF(AND(RC[-3]<RC[-1],RC[-3]>=13,RC[-3]<14),40,IF(AND(RC[-3]<RC[-1],RC[-3]>=14,RC[-3]<15),35,IF(AND(RC[-3]<RC[-1],RC[-3]>=15,RC[-3]<16),30,IF(AND(RC[-3]<RC[-1],RC[-3]>=16,RC[-3]<17),25,IF(AND(RC[-3]<RC[-1],RC[-3]>=17,RC[-3]<18),20,IF(AND(RC[-3]<RC[-1],RC[-3]>=18,RC[-3]<19),15,IF(AND(RC[-3]<RC[-1],RC[-3]>=19,RC[-3]<20),10,IF(AND(RC[-3]<RC[-1],RC[-3]>=20,RC[-3]<21),5,IF(AND(RC[-3]<RC[-1],RC[-3]>=21),0,IF(AND(RC[-3]>RC[-1],RC[-3]>=2,RC[-3]<3),90,IF(AND(RC[-3]>RC[-1],RC[-3]>=3,RC[-3]<4),90,IF(AND(RC[-3]>RC[-1],RC[-3]>=4,RC[-3]<5),80,IF(AND(RC[-3]>RC[-1],RC[-3]>=5,RC[-3]<6),70,IF(AND(RC[-3]>RC[-1],RC[-3]>=6,RC[-3]<7),60,IF(AND(RC[-3]>RC[-1],RC[-3]>=7,RC[-3]<8),50,IF(AND(RC[-3]>RC[-1],RC[-3]>=8,RC[-3]<9),40,IF(AND(RC[-3]>RC[-1],RC[-3]>=9,RC[-3]<10),30,IF(AND(RC[-3]>RC[-1],RC[-3]>=10,RC[-3]<11),20,IF(AND(RC[-3]>RC[-1],RC[-3]>=11,RC[-3]<12),10,IF(AND(RC[-3]>RC[-1],RC[-3]>=12),0))))))))))))))))))))))))))))))))) -> 85 | H187: =IF(RC[-3]="","",IF(RC[-3]<0.3,100,IF(AND(RC[-3]>=0.3,RC[-3]>0.4),95,IF(AND(RC[-3]>=0.4,RC[-3]<0.5),90,IF(AND(RC[-3]>=0.5,RC[-3]<0.6),85,IF(AND(RC[-3]>=0.6,RC[-3]<0.7),80,IF(AND(RC[-3]>=0.6,RC[-3]<1),80,IF(AND(RC[-3]>1,RC[-3]<2),50,IF(RC[-3]>2,0))))))))) ->  | I187: =IF(RC[-1]="",RC[-2],0.7*RC[-1]+0.3*RC[-2]) -> 85
A188: تولید ژلاتین کپسول ایران | B188: دکپسول | C188: =VLOOKUP(RC[-1],Sheet1!R3C2:R802C3,2,FALSE) -> دارویی | D188: =VLOOKUP(RC[-2],Sheet1!R3C2:R802C9,8,FALSE) -> 6.369043700920451 | E188: =IF(VLOOKUP(RC[-3],Sheet1!R3C2:R803C11,10,FALSE)=0,"",VLOOKUP(Sheet2!RC[-3],Sheet1!R[1]C[-3]:R[801]C[6],10,FALSE)) ->  | F188: =Sheet1!R246C10 -> 7.5295416184238002 | G188: =IF(RC[-3]<0,0,IF(AND(RC[-3]<RC[-1],RC[-3]<2),100,IF(AND(RC[-3]<RC[-1],RC[-3]>=2,RC[-3]<3),95,IF(AND(RC[-3]<RC[-1],RC[-3]>=3,RC[-3]<4),90,IF(AND(RC[-3]<RC[-1],RC[-3]>=4,RC[-3]<5),85,IF(AND(RC[-3]<RC[-1],RC[-3]>=5,RC[-3]<6),80,IF(AND(RC[-3]<RC[-1],RC[-3]>=6,RC[-3]<7),75,IF(AND(RC[-3]<RC[-1],RC[-3]>=7,RC[-3]<8),70,IF(AND(RC[-3]<RC[-1],RC[-3]>=8,RC[-3]<9),65,IF(AND(RC[-3]<RC[-1],RC[-3]>=9,RC[-3]<10),60,IF(AND(RC[-3]<RC[-1],RC[-3]>=10,RC[-3]<11),55,IF(AND(RC[-3]<RC[-1],RC[-3]>=11,RC[-3]<12),50,IF(AND(RC[-3]<RC[-1],RC[-3]>=12,RC[-3]<13),45,IF(AND(RC[-3]<RC[-1],RC[-3]>=13,RC[-3]<14),40,IF(AND(RC[-3]<RC[-1],RC[-3]>=14,RC[-3]<15),35,IF(AND(RC[-3]<RC[-1],RC[-3]>=15,RC[-3]<16),30,IF(AND(RC[-3]<RC[-1],RC[-3]>=16,RC[-3]<17),25,IF(AND(RC[-3]<RC[-1],RC[-3]>=17,RC[-3]<18),20,IF(AND(RC[-3]<RC[-1],RC[-3]>=18,RC[-3]<19),15,IF(AND(RC[-3]<RC[-1],RC[-3]>=19,RC[-3]<20),10,IF(AND(RC[-3]<RC[-1],RC[-3]>=20,RC[-3]<21),5,IF(AND(RC[-3]<RC[-1],RC[-3]>=21),0,IF(AND(RC[-3]>RC[-1],RC[-3]>=2,RC[-3]<3),90,IF(AND(RC[-3]>RC[-1],RC[-3]>=3,RC[-3]<4),90,IF(AND(RC[-3]>RC[-1],RC[-3]>=4,RC[-3]<5),80,IF(AND(RC[-3]>RC[-1],RC[-3]>=5,RC[-3]<6),70,IF(AND(RC[-3]>RC[-1],RC[-3]>=6,RC[-3]<7),60,IF(AND(RC[-3]>RC[-1],RC[-3]>=7,RC[-3]<8),50,IF(AND(RC[-3]>RC[-1],RC[-3]>=8,RC[-3]<9),40,IF(AND(RC[-3]>RC[-1],RC[-3]>=9,RC[-3]<10),30,IF(AND(RC[-3]>RC[-1],RC[-3]>=10,RC[-3]<11),20,IF(AND(RC[-3]>RC[-1],RC[-3]>=11,RC[-3]<12),10,IF(AND(RC[-3]>RC[-1],RC[-3]>=12),0))))))))))))))))))))))))))))))))) -> 75 | H188: =IF(RC[-3]="","",IF(RC[-3]<0.3,100,IF(AND(RC[-3]>=0.3,RC[-3]>0.4),95,IF(AND(RC[-3]>=0.4,RC[-3]<0.5),90,IF(AND(RC[-3]>=0.5,RC[-3]<0.6),85,IF(AND(RC[-3]>=0.6,RC[-3]<0.7),80,IF(AND(RC[-3]>=0.6,RC[-3]<1),80,IF(AND(RC[-3]>1,RC[-3]<2),50,IF(RC[-3]>2,0))))))))) ->  | I188: =IF(RC[-1]="",RC[-2],0.7*RC[-1]+0.3*RC[-2]) -> 75
A189: تولیدو صادرات ریشمک | B189: ریشمک | C189: =VLOOKUP(RC[-1],Sheet1!R3C2:R802C3,2,FALSE) -> دارویی | D189: =VLOOKUP(RC[-2],Sheet1!R3C2:R802C9,8,FALSE) -> 12.253830307340595 | E189: =IF(VLOOKUP(RC[-3],Sheet1!R3C2:R803C11,10,FALSE)=0,"",VLOOKUP(Sheet2!RC[-3],Sheet1!R[1]C[-3]:R[801]C[6],10,FALSE)) ->  | F189: =Sheet1!R246C10 -> 7.5295416184238002 | G189: =IF(RC[-3]<0,0,IF(AND(RC[-3]<RC[-1],RC[-3]<2),100,IF(AND(RC[-3]<RC[-1],RC[-3]>=2,RC[-3]<3),95,IF(AND(RC[-3]<RC[-1],RC[-3]>=3,RC[-3]<4),90,IF(AND(RC[-3]<RC[-1],RC[-3]>=4,RC[-3]<5),85,IF(AND(RC[-3]<RC[-1],RC[-3]>=5,RC[-3]<6),80,IF(AND(RC[-3]<RC[-1],RC[-3]>=6,RC[-3]<7),75,IF(AND(RC[-3]<RC[-1],RC[-3]>=7,RC[-3]<8),70,IF(AND(RC[-3]<RC[-1],RC[-3]>=8,RC[-3]<9),65,IF(AND(RC[-3]<RC[-1],RC[-3]>=9,RC[-3]<10),60,IF(AND(RC[-3]<RC[-1],RC[-3]>=10,RC[-3]<11),55,IF(AND(RC[-3]<RC[-1],RC[-3]>=11,RC[-3]<12),50,IF(AND(RC[-3]<RC[-1],RC[-3]>=12,RC[-3]<13),45,IF(AND(RC[-3]<RC[-1],RC[-3]>=13,RC[-3]<14),40,IF(AND(RC[-3]<RC[-1],RC[-3]>=14,RC[-3]<15),35,IF(AND(RC[-3]<RC[-1],RC[-3]>=15,RC[-3]<16),30,IF(AND(RC[-3]<RC[-1],RC[-3]>=16,RC[-3]<17),25,IF(AND(RC[-3]<RC[-1],RC[-3]>=17,RC[-3]<18),20,IF(AND(RC[-3]<RC[-1],RC[-3]>=18,RC[-3]<19),15,IF(AND(RC[-3]<RC[-1],RC[-3]>=19,RC[-3]<20),10,IF(AND(RC[-3]<RC[-1],RC[-3]>=20,RC[-3]<21),5,IF(AND(RC[-3]<RC[-1],RC[-3]>=21),0,IF(AND(RC[-3]>RC[-1],RC[-3]>=2,RC[-3]<3),90,IF(AND(RC[-3]>RC[-1],RC[-3]>=3,RC[-3]<4),90,IF(AND(RC[-3]>RC[-1],RC[-3]>=4,RC[-3]<5),80,IF(AND(RC[-3]>RC[-1],RC[-3]>=5,RC[-3]<6),70,IF(AND(RC[-3]>RC[-1],RC[-3]>=6,RC[-3]<7),60,IF(AND(RC[-3]>RC[-1],RC[-3]>=7,RC[-3]<8),50,IF(AND(RC[-3]>RC[-1],RC[-3]>=8,RC[-3]<9),40,IF(AND(RC[-3]>RC[-1],RC[-3]>=9,RC[-3]<10),30,IF(AND(RC[-3]>RC[-1],RC[-3]>=10,RC[-3]<11),20,IF(AND(RC[-3]>RC[-1],RC[-3]>=11,RC[-3]<12),10,IF(AND(RC[-3]>RC[-1],RC[-3]>=12),0))))))))))))))))))))))))))))))))) -> 0 | H189: =IF(RC[-3]="","",IF(RC[-3]<0.3,100,IF(AND(RC[-3]>=0.3,RC[-3]>0.4),95,IF(AND(RC[-3]>=0.4,RC[-3]<0.5),90,IF(AND(RC[-3]>=0.5,RC[-3]<0.6),85,IF(AND(RC[-3]>=0.6,RC[-3]<0.7),80,IF(AND(RC[-3]>=0.6,RC[-3]<1),80,IF(AND(RC[-3]>1,RC[-3]<2),50,IF(RC[-3]>2,0))))))))) ->  | I189: =IF(RC[-1]="",RC[-2],0.7*RC[-1]+0.3*RC[-2]) -> 0
A190: دارو ابوریحان | B190: دابور | C190: =VLOOKUP(RC[-1],Sheet1!R3C2:R802C3,2,FALSE) -> دارویی | D190: =VLOOKUP(RC[-2],Sheet1!R3C2:R802C9,8,FALSE) -> 3.8309406276738951 | E190: =IF(VLOOKUP(RC[-3],Sheet1!R3C2:R803C11,10,FALSE)=0,"",VLOOKUP(Sheet2!RC[-3],Sheet1!R[1]C[-3]:R[801]C[6],10,FALSE)) ->  | F190: =Sheet1!R246C10 -> 7.5295416184238002 | G190: =IF(RC[-3]<0,0,IF(AND(RC[-3]<RC[-1],RC[-3]<2),100,IF(AND(RC[-3]<RC[-1],RC[-3]>=2,RC[-3]<3),95,IF(AND(RC[-3]<RC[-1],RC[-3]>=3,RC[-3]<4),90,IF(AND(RC[-3]<RC[-1],RC[-3]>=4,RC[-3]<5),85,IF(AND(RC[-3]<RC[-1],RC[-3]>=5,RC[-3]<6),80,IF(AND(RC[-3]<RC[-1],RC[-3]>=6,RC[-3]<7),75,IF(AND(RC[-3]<RC[-1],RC[-3]>=7,RC[-3]<8),70,IF(AND(RC[-3]<RC[-1],RC[-3]>=8,RC[-3]<9),65,IF(AND(RC[-3]<RC[-1],RC[-3]>=9,RC[-3]<10),60,IF(AND(RC[-3]<RC[-1],RC[-3]>=10,RC[-3]<11),55,IF(AND(RC[-3]<RC[-1],RC[-3]>=11,RC[-3]<12),50,IF(AND(RC[-3]<RC[-1],RC[-3]>=12,RC[-3]<13),45,IF(AND(RC[-3]<RC[-1],RC[-3]>=13,RC[-3]<14),40,IF(AND(RC[-3]<RC[-1],RC[-3]>=14,RC[-3]<15),35,IF(AND(RC[-3]<RC[-1],RC[-3]>=15,RC[-3]<16),30,IF(AND(RC[-3]<RC[-1],RC[-3]>=16,RC[-3]<17),25,IF(AND(RC[-3]<RC[-1],RC[-3]>=17,RC[-3]<18),20,IF(AND(RC[-3]<RC[-1],RC[-3]>=18,RC[-3]<19),15,IF(AND(RC[-3]<RC[-1],RC[-3]>=19,RC[-3]<20),10,IF(AND(RC[-3]<RC[-1],RC[-3]>=20,RC[-3]<21),5,IF(AND(RC[-3]<RC[-1],RC[-3]>=21),0,IF(AND(RC[-3]>RC[-1],RC[-3]>=2,RC[-3]<3),90,IF(AND(RC[-3]>RC[-1],RC[-3]>=3,RC[-3]<4),90,IF(AND(RC[-3]>RC[-1],RC[-3]>=4,RC[-3]<5),80,IF(AND(RC[-3]>RC[-1],RC[-3]>=5,RC[-3]<6),70,IF(AND(RC[-3]>RC[-1],RC[-3]>=6,RC[-3]<7),60,IF(AND(RC[-3]>RC[-1],RC[-3]>=7,RC[-3]<8),50,IF(AND(RC[-3]>RC[-1],RC[-3]>=8,RC[-3]<9),40,IF(AND(RC[-3]>RC[-1],RC[-3]>=9,RC[-3]<10),30,IF(AND(RC[-3]>RC[-1],RC[-3]>=10,RC[-3]<11),20,IF(AND(RC[-3]>RC[-1],RC[-3]>=11,RC[-3]<12),10,IF(AND(RC[-3]>RC[-1],RC[-3]>=12),0))))))))))))))))))))))))))))))))) -> 90 | H190: =IF(RC[-3]="","",IF(RC[-3]<0.3,100,IF(AND(RC[-3]>=0.3,RC[-3]>0.4),95,IF(AND(RC[-3]>=0.4,RC[-3]<0.5),90,IF(AND(RC[-3]>=0.5,RC[-3]<0.6),85,IF(AND(RC[-3]>=0.6,RC[-3]<0.7),80,IF(AND(RC[-3]>=0.6,RC[-3]<1),80,IF(AND(RC[-3]>1,RC[-3]<2),50,IF(RC[-3]>2,0))))))))) ->  | I190: =IF(RC[-1]="",RC[-2],0.7*RC[-1]+0.3*RC[-2]) -> 90
A191: دارو اسوه | B191: داسوه | C191: =VLOOKUP(RC[-1],Sheet1!R3C2:R802C3,2,FALSE) -> دارویی | D191: =VLOOKUP(RC[-2],Sheet1!R3C2:R802C9,8,FALSE) -> 10.849054371046019 | E191: =IF(VLOOKUP(RC[-3],Sheet1!R3C2:R803C11,10,FALSE)=0,"",VLOOKUP(Sheet2!RC[-3],Sheet1!R[1]C[-3]:R[801]C[6],10,FALSE)) ->  | F191: =Sheet1!R246C10 -> 7.5295416184238002 | G191: =IF(RC[-3]<0,0,IF(AND(RC[-3]<RC[-1],RC[-3]<2),100,IF(AND(RC[-3]<RC[-1],RC[-3]>=2,RC[-3]<3),95,IF(AND(RC[-3]<RC[-1],RC[-3]>=3,RC[-3]<4),90,IF(AND(RC[-3]<RC[-1],RC[-3]>=4,RC[-3]<5),85,IF(AND(RC[-3]<RC[-1],RC[-3]>=5,RC[-3]<6),80,IF(AND(RC[-3]<RC[-1],RC[-3]>=6,RC[-3]<7),75,IF(AND(RC[-3]<RC[-1],RC[-3]>=7,RC[-3]<8),70,IF(AND(RC[-3]<RC[-1],RC[-3]>=8,RC[-3]<9),65,IF(AND(RC[-3]<RC[-1],RC[-3]>=9,RC[-3]<10),60,IF(AND(RC[-3]<RC[-1],RC[-3]>=10,RC[-3]<11),55,IF(AND(RC[-3]<RC[-1],RC[-3]>=11,RC[-3]<12),50,IF(AND(RC[-3]<RC[-1],RC[-3]>=12,RC[-3]<13),45,IF(AND(RC[-3]<RC[-1],RC[-3]>=13,RC[-3]<14),40,IF(AND(RC[-3]<RC[-1],RC[-3]>=14,RC[-3]<15),35,IF(AND(RC[-3]<RC[-1],RC[-3]>=15,RC[-3]<16),30,IF(AND(RC[-3]<RC[-1],RC[-3]>=16,RC[-3]<17),25,IF(AND(RC[-3]<RC[-1],RC[-3]>=17,RC[-3]<18),20,IF(AND(RC[-3]<RC[-1],RC[-3]>=18,RC[-3]<19),15,IF(AND(RC[-3]<RC[-1],RC[-3]>=19,RC[-3]<20),10,IF(AND(RC[-3]<RC[-1],RC[-3]>=20,RC[-3]<21),5,IF(AND(RC[-3]<RC[-1],RC[-3]>=21),0,IF(AND(RC[-3]>RC[-1],RC[-3]>=2,RC[-3]<3),90,IF(AND(RC[-3]>RC[-1],RC[-3]>=3,RC[-3]<4),90,IF(AND(RC[-3]>RC[-1],RC[-3]>=4,RC[-3]<5),80,IF(AND(RC[-3]>RC[-1],RC[-3]>=5,RC[-3]<6),70,IF(AND(RC[-3]>RC[-1],RC[-3]>=6,RC[-3]<7),60,IF(AND(RC[-3]>RC[-1],RC[-3]>=7,RC[-3]<8),50,IF(AND(RC[-3]>RC[-1],RC[-3]>=8,RC[-3]<9),40,IF(AND(RC[-3]>RC[-1],RC[-3]>=9,RC[-3]<10),30,IF(AND(RC[-3]>RC[-1],RC[-3]>=10,RC[-3]<11),20,IF(AND(RC[-3]>RC[-1],RC[-3]>=11,RC[-3]<12),10,IF(AND(RC[-3]>RC[-1],RC[-3]>=12),0))))))))))))))))))))))))))))))))) -> 20 | H191: =IF(RC[-3]="","",IF(RC[-3]<0.3,100,IF(AND(RC[-3]>=0.3,RC[-3]>0.4),95,IF(AND(RC[-3]>=0.4,RC[-3]<0.5),90,IF(AND(RC[-3]>=0.5,RC[-3]<0.6),85,IF(AND(RC[-3]>=0.6,RC[-3]<0.7),80,IF(AND(RC[-3]>=0.6,RC[-3]<1),80,IF(AND(RC[-3]>1,RC[-3]<2),50,IF(RC[-3]>2,0))))))))) ->  | I191: =IF(RC[-1]="",RC[-2],0.7*RC[-1]+0.3*RC[-2]) -> 20
A192: دارو امین | B192: دامین | C192: =VLOOKUP(RC[-1],Sheet1!R3C2:R802C3,2,FALSE) -> دارویی | D192: =VLOOKUP(RC[-2],Sheet1!R3C2:R802C9,8,FALSE) -> 6.9384121954967197 | E192: =IF(VLOOKUP(RC[-3],Sheet1!R3C2:R803C11,10,FALSE)=0,"",VLOOKUP(Sheet2!RC[-3],Sheet1!R[1]C[-3]:R[801]C[6],10,FALSE)) ->  | F192: =Sheet1!R246C10 -> 7.5295416184238002 | G192: =IF(RC[-3]<0,0,IF(AND(RC[-3]<RC[-1],RC[-3]<2),100,IF(AND(RC[-3]<RC[-1],RC[-3]>=2,RC[-3]<3),95,IF(AND(RC[-3]<RC[-1],RC[-3]>=3,RC[-3]<4),90,IF(AND(RC[-3]<RC[-1],RC[-3]>=4,RC[-3]<5),85,IF(AND(RC[-3]<RC[-1],RC[-3]>=5,RC[-3]<6),80,IF(AND(RC[-3]<RC[-1],RC[-3]>=6,RC[-3]<7),75,IF(AND(RC[-3]<RC[-1],RC[-3]>=7,RC[-3]<8),70,IF(AND(RC[-3]<RC[-1],RC[-3]>=8,RC[-3]<9),65,IF(AND(RC[-3]<RC[-1],RC[-3]>=9,RC[-3]<10),60,IF(AND(RC[-3]<RC[-1],RC[-3]>=10,RC[-3]<11),55,IF(AND(RC[-3]<RC[-1],RC[-3]>=11,RC[-3]<12),50,IF(AND(RC[-3]<RC[-1],RC[-3]>=12,RC[-3]<13),45,IF(AND(RC[-3]<RC[-1],RC[-3]>=13,RC[-3]<14),40,IF(AND(RC[-3]<RC[-1],RC[-3]>=14,RC[-3]<15),35,IF(AND(RC[-3]<RC[-1],RC[-3]>=15,RC[-3]<16),30,IF(AND(RC[-3]<RC[-1],RC[-3]>=16,RC[-3]<17),25,IF(AND(RC[-3]<RC[-1],RC[-3]>=17,RC[-3]<18),20,IF(AND(RC[-3]<RC[-1],RC[-3]>=18,RC[-3]<19),15,IF(AND(RC[-3]<RC[-1],RC[-3]>=19,RC[-3]<20),10,IF(AND(RC[-3]<RC[-1],RC[-3]>=20,RC[-3]<21),5,IF(AND(RC[-3]<RC[-1],RC[-3]>=21),0,IF(AND(RC[-3]>RC[-1],RC[-3]>=2,RC[-3]<3),90,IF(AND(RC[-3]>RC[-1],RC[-3]>=3,RC[-3]<4),90,IF(AND(RC[-3]>RC[-1],RC[-3]>=4,RC[-3]<5),80,IF(AND(RC[-3]>RC[-1],RC[-3]>=5,RC[-3]<6),70,IF(AND(RC[-3]>RC[-1],RC[-3]>=6,RC[-3]<7),60,IF(AND(RC[-3]>RC[-1],RC[-3]>=7,RC[-3]<8),50,IF(AND(RC[-3]>RC[-1],RC[-3]>=8,RC[-3]<9),40,IF(AND(RC[-3]>RC[-1],RC[-3]>=9,RC[-3]<10),30,IF(AND(RC[-3]>RC[-1],RC[-3]>=10,RC[-3]<11),20,IF(AND(RC[-3]>RC[-1],RC[-3]>=11,RC[-3]<12),10,IF(AND(RC[-3]>RC[-1],RC[-3]>=12),0))))))))))))))))))))))))))))))))) -> 75 | H192: =IF(RC[-3]="","",IF(RC[-3]<0.3,100,IF(AND(RC[-3]>=0.3,RC[-3]>0.4),95,IF(AND(RC[-3]>=0.4,RC[-3]<0.5),90,IF(AND(RC[-3]>=0.5,RC[-3]<0.6),85,IF(AND(RC[-3]>=0.6,RC[-3]<0.7),80,IF(AND(RC[-3]>=0.6,RC[-3]<1),80,IF(AND(RC[-3]>1,RC[-3]<2),50,IF(RC[-3]>2,0))))))))) ->  | I192: =IF(RC[-1]="",RC[-2],0.7*RC[-1]+0.3*RC[-2]) -> 75
A193: دارو اکسیر | B193: دلر | C193: =VLOOKUP(RC[-1],Sheet1!R3C2:R802C3,2,FALSE) -> دارویی | D193: =VLOOKUP(RC[-2],Sheet1!R3C2:R802C9,8,FALSE) -> 3.5168051583505582 | E193: =IF(VLOOKUP(RC[-3],Sheet1!R3C2:R803C11,10,FALSE)=0,"",VLOOKUP(Sheet2!RC[-3],Sheet1!R[1]C[-3]:R[801]C[6],10,FALSE)) ->  | F193: =Sheet1!R246C10 -> 7.5295416184238002 | G193: =IF(RC[-3]<0,0,IF(AND(RC[-3]<RC[-1],RC[-3]<2),100,IF(AND(RC[-3]<RC[-1],RC[-3]>=2,RC[-3]<3),95,IF(AND(RC[-3]<RC[-1],RC[-3]>=3,RC[-3]<4),90,IF(AND(RC[-3]<RC[-1],RC[-3]>=4,RC[-3]<5),85,IF(AND(RC[-3]<RC[-1],RC[-3]>=5,RC[-3]<6),80,IF(AND(RC[-3]<RC[-1],RC[-3]>=6,RC[-3]<7),75,IF(AND(RC[-3]<RC[-1],RC[-3]>=7,RC[-3]<8),70,IF(AND(RC[-3]<RC[-1],RC[-3]>=8,RC[-3]<9),65,IF(AND(RC[-3]<RC[-1],RC[-3]>=9,RC[-3]<10),60,IF(AND(RC[-3]<RC[-1],RC[-3]>=10,RC[-3]<11),55,IF(AND(RC[-3]<RC[-1],RC[-3]>=11,RC[-3]<12),50,IF(AND(RC[-3]<RC[-1],RC[-3]>=12,RC[-3]<13),45,IF(AND(RC[-3]<RC[-1],RC[-3]>=13,RC[-3]<14),40,IF(AND(RC[-3]<RC[-1],RC[-3]>=14,RC[-3]<15),35,IF(AND(RC[-3]<RC[-1],RC[-3]>=15,RC[-3]<16),30,IF(AND(RC[-3]<RC[-1],RC[-3]>=16,RC[-3]<17),25,IF(AND(RC[-3]<RC[-1],RC[-3]>=17,RC[-3]<18),20,IF(AND(RC[-3]<RC[-1],RC[-3]>=18,RC[-3]<19),15,IF(AND(RC[-3]<RC[-1],RC[-3]>=19,RC[-3]<20),10,IF(AND(RC[-3]<RC[-1],RC[-3]>=20,RC[-3]<21),5,IF(AND(RC[-3]<RC[-1],RC[-3]>=21),0,IF(AND(RC[-3]>RC[-1],RC[-3]>=2,RC[-3]<3),90,IF(AND(RC[-3]>RC[-1],RC[-3]>=3,RC[-3]<4),90,IF(AND(RC[-3]>RC[-1],RC[-3]>=4,RC[-3]<5),80,IF(AND(RC[-3]>RC[-1],RC[-3]>=5,RC[-3]<6),70,IF(AND(RC[-3]>RC[-1],RC[-3]>=6,RC[-3]<7),60,IF(AND(RC[-3]>RC[-1],RC[-3]>=7,RC[-3]<8),50,IF(AND(RC[-3]>RC[-1],RC[-3]>=8,RC[-3]<9),40,IF(AND(RC[-3]>RC[-1],RC[-3]>=9,RC[-3]<10),30,IF(AND(RC[-3]>RC[-1],RC[-3]>=10,RC[-3]<11),20,IF(AND(RC[-3]>RC[-1],RC[-3]>=11,RC[-3]<12),10,IF(AND(RC[-3]>RC[-1],RC[-3]>=12),0))))))))))))))))))))))))))))))))) -> 90 | H193: =IF(RC[-3]="","",IF(RC[-3]<0.3,100,IF(AND(RC[-3]>=0.3,RC[-3]>0.4),95,IF(AND(RC[-3]>=0.4,RC[-3]<0.5),90,IF(AND(RC[-3]>=0.5,RC[-3]<0.6),85,IF(AND(RC[-3]>=0.6,RC[-3]<0.7),80,IF(AND(RC[-3]>=0.6,RC[-3]<1),80,IF(AND(RC[-3]>1,RC[-3]<2),50,IF(RC[-3]>2,0))))))))) ->  | I193: =IF(RC[-1]="",RC[-2],0.7*RC[-1]+0.3*RC[-2]) -> 90
A194: دارو جابرابن حیان | B194: دجابر | C194: =VLOOKUP(RC[-1],Sheet1!R3C2:R802C3,2,FALSE) -> دارویی | D194: =VLOOKUP(RC[-2],Sheet1!R3C2:R802C9,8,FALSE) -> 6.431002849316517 | E194: =IF(VLOOKUP(RC[-3],Sheet1!R3C2:R803C11,10,FALSE)=0,"",VLOOKUP(Sheet2!RC[-3],Sheet1!R[1]C[-3]:R[801]C[6],10,FALSE)) ->  | F194: =Sheet1!R246C10 -> 7.5295416184238002 | G194: =IF(RC[-3]<0,0,IF(AND(RC[-3]<RC[-1],RC[-3]<2),100,IF(AND(RC[-3]<RC[-1],RC[-3]>=2,RC[-3]<3),95,IF(AND(RC[-3]<RC[-1],RC[-3]>=3,RC[-3]<4),90,IF(AND(RC[-3]<RC[-1],RC[-3]>=4,RC[-3]<5),85,IF(AND(RC[-3]<RC[-1],RC[-3]>=5,RC[-3]<6),80,IF(AND(RC[-3]<RC[-1],RC[-3]>=6,RC[-3]<7),75,IF(AND(RC[-3]<RC[-1],RC[-3]>=7,RC[-3]<8),70,IF(AND(RC[-3]<RC[-1],RC[-3]>=8,RC[-3]<9),65,IF(AND(RC[-3]<RC[-1],RC[-3]>=9,RC[-3]<10),60,IF(AND(RC[-3]<RC[-1],RC[-3]>=10,RC[-3]<11),55,IF(AND(RC[-3]<RC[-1],RC[-3]>=11,RC[-3]<12),50,IF(AND(RC[-3]<RC[-1],RC[-3]>=12,RC[-3]<13),45,IF(AND(RC[-3]<RC[-1],RC[-3]>=13,RC[-3]<14),40,IF(AND(RC[-3]<RC[-1],RC[-3]>=14,RC[-3]<15),35,IF(AND(RC[-3]<RC[-1],RC[-3]>=15,RC[-3]<16),30,IF(AND(RC[-3]<RC[-1],RC[-3]>=16,RC[-3]<17),25,IF(AND(RC[-3]<RC[-1],RC[-3]>=17,RC[-3]<18),20,IF(AND(RC[-3]<RC[-1],RC[-3]>=18,RC[-3]<19),15,IF(AND(RC[-3]<RC[-1],RC[-3]>=19,RC[-3]<20),10,IF(AND(RC[-3]<RC[-1],RC[-3]>=20,RC[-3]<21),5,IF(AND(RC[-3]<RC[-1],RC[-3]>=21),0,IF(AND(RC[-3]>RC[-1],RC[-3]>=2,RC[-3]<3),90,IF(AND(RC[-3]>RC[-1],RC[-3]>=3,RC[-3]<4),90,IF(AND(RC[-3]>RC[-1],RC[-3]>=4,RC[-3]<5),80,IF(AND(RC[-3]>RC[-1],RC[-3]>=5,RC[-3]<6),70,IF(AND(RC[-3]>RC[-1],RC[-3]>=6,RC[-3]<7),60,IF(AND(RC[-3]>RC[-1],RC[-3]>=7,RC[-3]<8),50,IF(AND(RC[-3]>RC[-1],RC[-3]>=8,RC[-3]<9),40,IF(AND(RC[-3]>RC[-1],RC[-3]>=9,RC[-3]<10),30,IF(AND(RC[-3]>RC[-1],RC[-3]>=10,RC[-3]<11),20,IF(AND(RC[-3]>RC[-1],RC[-3]>=11,RC[-3]<12),10,IF(AND(RC[-3]>RC[-1],RC[-3]>=12),0))))))))))))))))))))))))))))))))) -> 75 | H194: =IF(RC[-3]="","",IF(RC[-3]<0.3,100,IF(AND(RC[-3]>=0.3,RC[-3]>0.4),95,IF(AND(RC[-3]>=0.4,RC[-3]<0.5),90,IF(AND(RC[-3]>=0.5,RC[-3]<0.6),85,IF(AND(RC[-3]>=0.6,RC[-3]<0.7),80,IF(AND(RC[-3]>=0.6,RC[-3]<1),80,IF(AND(RC[-3]>1,RC[-3]<2),50,IF(RC[-3]>2,0))))))))) ->  | I194: =IF(RC[-1]="",RC[-2],0.7*RC[-1]+0.3*RC[-2]) -> 75
A195: دارو رازک | B195: درازک | C195: =VLOOKUP(RC[-1],Sheet1!R3C2:R802C3,2,FALSE) -> دارویی | D195: =VLOOKUP(RC[-2],Sheet1!R3C2:R802C9,8,FALSE) -> 3.8748943738551778 | E195: =IF(VLOOKUP(RC[-3],Sheet1!R3C2:R803C11,10,FALSE)=0,"",VLOOKUP(Sheet2!RC[-3],Sheet1!R[1]C[-3]:R[801]C[6],10,FALSE)) ->  | F195: =Sheet1!R246C10 -> 7.5295416184238002 | G195: =IF(RC[-3]<0,0,IF(AND(RC[-3]<RC[-1],RC[-3]<2),100,IF(AND(RC[-3]<RC[-1],RC[-3]>=2,RC[-3]<3),95,IF(AND(RC[-3]<RC[-1],RC[-3]>=3,RC[-3]<4),90,IF(AND(RC[-3]<RC[-1],RC[-3]>=4,RC[-3]<5),85,IF(AND(RC[-3]<RC[-1],RC[-3]>=5,RC[-3]<6),80,IF(AND(RC[-3]<RC[-1],RC[-3]>=6,RC[-3]<7),75,IF(AND(RC[-3]<RC[-1],RC[-3]>=7,RC[-3]<8),70,IF(AND(RC[-3]<RC[-1],RC[-3]>=8,RC[-3]<9),65,IF(AND(RC[-3]<RC[-1],RC[-3]>=9,RC[-3]<10),60,IF(AND(RC[-3]<RC[-1],RC[-3]>=10,RC[-3]<11),55,IF(AND(RC[-3]<RC[-1],RC[-3]>=11,RC[-3]<12),50,IF(AND(RC[-3]<RC[-1],RC[-3]>=12,RC[-3]<13),45,IF(AND(RC[-3]<RC[-1],RC[-3]>=13,RC[-3]<14),40,IF(AND(RC[-3]<RC[-1],RC[-3]>=14,RC[-3]<15),35,IF(AND(RC[-3]<RC[-1],RC[-3]>=15,RC[-3]<16),30,IF(AND(RC[-3]<RC[-1],RC[-3]>=16,RC[-3]<17),25,IF(AND(RC[-3]<RC[-1],RC[-3]>=17,RC[-3]<18),20,IF(AND(RC[-3]<RC[-1],RC[-3]>=18,RC[-3]<19),15,IF(AND(RC[-3]<RC[-1],RC[-3]>=19,RC[-3]<20),10,IF(AND(RC[-3]<RC[-1],RC[-3]>=20,RC[-3]<21),5,IF(AND(RC[-3]<RC[-1],RC[-3]>=21),0,IF(AND(RC[-3]>RC[-1],RC[-3]>=2,RC[-3]<3),90,IF(AND(RC[-3]>RC[-1],RC[-3]>=3,RC[-3]<4),90,IF(AND(RC[-3]>RC[-1],RC[-3]>=4,RC[-3]<5),80,IF(AND(RC[-3]>RC[-1],RC[-3]>=5,RC[-3]<6),70,IF(AND(RC[-3]>RC[-1],RC[-3]>=6,RC[-3]<7),60,IF(AND(RC[-3]>RC[-1],RC[-3]>=7,RC[-3]<8),50,IF(AND(RC[-3]>RC[-1],RC[-3]>=8,RC[-3]<9),40,IF(AND(RC[-3]>RC[-1],RC[-3]>=9,RC[-3]<10),30,IF(AND(RC[-3]>RC[-1],RC[-3]>=10,RC[-3]<11),20,IF(AND(RC[-3]>RC[-1],RC[-3]>=11,RC[-3]<12),10,IF(AND(RC[-3]>RC[-1],RC[-3]>=12),0))))))))))))))))))))))))))))))))) -> 90 | H195: =IF(RC[-3]="","",IF(RC[-3]<0.3,100,IF(AND(RC[-3]>=0.3,RC[-3]>0.4),95,IF(AND(RC[-3]>=0.4,RC[-3]<0.5),90,IF(AND(RC[-3]>=0.5,RC[-3]<0.6),85,IF(AND(RC[-3]>=0.6,RC[-3]<0.7),80,IF(AND(RC[-3]>=0.6,RC[-3]<1),80,IF(AND(RC[-3]>1,RC[-3]<2),50,IF(RC[-3]>2,0))))))))) ->  | I195: =IF(RC[-1]="",RC[-2],0.7*RC[-1]+0.3*RC[-2]) -> 90
A196: دارو زهراوی | B196: دزهراوی | C196: =VLOOKUP(RC[-1],Sheet1!R3C2:R802C3,2,FALSE) -> دارویی | D196: =VLOOKUP(RC[-2],Sheet1!R3C2:R802C9,8,FALSE) -> 27.356585799749023 | E196: =IF(VLOOKUP(RC[-3],Sheet1!R3C2:R803C11,10,FALSE)=0,"",VLOOKUP(Sheet2!RC[-3],Sheet1!R[1]C[-3]:R[801]C[6],10,FALSE)) ->  | F196: =Sheet1!R246C10 -> 7.5295416184238002 | G196: =IF(RC[-3]<0,0,IF(AND(RC[-3]<RC[-1],RC[-3]<2),100,IF(AND(RC[-3]<RC[-1],RC[-3]>=2,RC[-3]<3),95,IF(AND(RC[-3]<RC[-1],RC[-3]>=3,RC[-3]<4),90,IF(AND(RC[-3]<RC[-1],RC[-3]>=4,RC[-3]<5),85,IF(AND(RC[-3]<RC[-1],RC[-3]>=5,RC[-3]<6),80,IF(AND(RC[-3]<RC[-1],RC[-3]>=6,RC[-3]<7),75,IF(AND(RC[-3]<RC[-1],RC[-3]>=7,RC[-3]<8),70,IF(AND(RC[-3]<RC[-1],RC[-3]>=8,RC[-3]<9),65,IF(AND(RC[-3]<RC[-1],RC[-3]>=9,RC[-3]<10),60,IF(AND(RC[-3]<RC[-1],RC[-3]>=10,RC[-3]<11),55,IF(AND(RC[-3]<RC[-1],RC[-3]>=11,RC[-3]<12),50,IF(AND(RC[-3]<RC[-1],RC[-3]>=12,RC[-3]<13),45,IF(AND(RC[-3]<RC[-1],RC[-3]>=13,RC[-3]<14),40,IF(AND(RC[-3]<RC[-1],RC[-3]>=14,RC[-3]<15),35,IF(AND(RC[-3]<RC[-1],RC[-3]>=15,RC[-3]<16),30,IF(AND(RC[-3]<RC[-1],RC[-3]>=16,RC[-3]<17),25,IF(AND(RC[-3]<RC[-1],RC[-3]>=17,RC[-3]<18),20,IF(AND(RC[-3]<RC[-1],RC[-3]>=18,RC[-3]<19),15,IF(AND(RC[-3]<RC[-1],RC[-3]>=19,RC[-3]<20),10,IF(AND(RC[-3]<RC[-1],RC[-3]>=20,RC[-3]<21),5,IF(AND(RC[-3]<RC[-1],RC[-3]>=21),0,IF(AND(RC[-3]>RC[-1],RC[-3]>=2,RC[-3]<3),90,IF(AND(RC[-3]>RC[-1],RC[-3]>=3,RC[-3]<4),90,IF(AND(RC[-3]>RC[-1],RC[-3]>=4,RC[-3]<5),80,IF(AND(RC[-3]>RC[-1],RC[-3]>=5,RC[-3]<6),70,IF(AND(RC[-3]>RC[-1],RC[-3]>=6,RC[-3]<7),60,IF(AND(RC[-3]>RC[-1],RC[-3]>=7,RC[-3]<8),50,IF(AND(RC[-3]>RC[-1],RC[-3]>=8,RC[-3]<9),40,IF(AND(RC[-3]>RC[-1],RC[-3]>=9,RC[-3]<10),30,IF(AND(RC[-3]>RC[-1],RC[-3]>=10,RC[-3]<11),20,IF(AND(RC[-3]>RC[-1],RC[-3]>=11,RC[-3]<12),10,IF(AND(RC[-3]>RC[-1],RC[-3]>=12),0))))))))))))))))))))))))))))))))) -> 0 | H196: =IF(RC[-3]="","",IF(RC[-3]<0.3,100,IF(AND(RC[-3]>=0.3,RC[-3]>0.4),95,IF(AND(RC[-3]>=0.4,RC[-3]<0.5),90,IF(AND(RC[-3]>=0.5,RC[-3]<0.6),85,IF(AND(RC[-3]>=0.6,RC[-3]<0.7),80,IF(AND(RC[-3]>=0.6,RC[-3]<1),80,IF(AND(RC[-3]>1,RC[-3]<2),50,IF(RC[-3]>2,0))))))))) ->  | I196: =IF(RC[-1]="",RC[-2],0.7*RC[-1]+0.3*RC[-2]) -> 0
A197: دارو سبحان | B197: دسبحا | C197: =VLOOKUP(RC[-1],Sheet1!R3C2:R802C3,2,FALSE) -> دارویی | D197: =VLOOKUP(RC[-2],Sheet1!R3C2:R802C9,8,FALSE) -> 9.1157414959474998 | E197: =IF(VLOOKUP(RC[-3],Sheet1!R3C2:R803C11,10,FALSE)=0,"",VLOOKUP(Sheet2!RC[-3],Sheet1!R[1]C[-3]:R[801]C[6],10,FALSE)) -> 1.1000000000000001 | F197: =Sheet1!R246C10 -> 7.5295416184238002 | G197: =IF(RC[-3]<0,0,IF(AND(RC[-3]<RC[-1],RC[-3]<2),100,IF(AND(RC[-3]<RC[-1],RC[-3]>=2,RC[-3]<3),95,IF(AND(RC[-3]<RC[-1],RC[-3]>=3,RC[-3]<4),90,IF(AND(RC[-3]<RC[-1],RC[-3]>=4,RC[-3]<5),85,IF(AND(RC[-3]<RC[-1],RC[-3]>=5,RC[-3]<6),80,IF(AND(RC[-3]<RC[-1],RC[-3]>=6,RC[-3]<7),75,IF(AND(RC[-3]<RC[-1],RC[-3]>=7,RC[-3]<8),70,IF(AND(RC[-3]<RC[-1],RC[-3]>=8,RC[-3]<9),65,IF(AND(RC[-3]<RC[-1],RC[-3]>=9,RC[-3]<10),60,IF(AND(RC[-3]<RC[-1],RC[-3]>=10,RC[-3]<11),55,IF(AND(RC[-3]<RC[-1],RC[-3]>=11,RC[-3]<12),50,IF(AND(RC[-3]<RC[-1],RC[-3]>=12,RC[-3]<13),45,IF(AND(RC[-3]<RC[-1],RC[-3]>=13,RC[-3]<14),40,IF(AND(RC[-3]<RC[-1],RC[-3]>=14,RC[-3]<15),35,IF(AND(RC[-3]<RC[-1],RC[-3]>=15,RC[-3]<16),30,IF(AND(RC[-3]<RC[-1],RC[-3]>=16,RC[-3]<17),25,IF(AND(RC[-3]<RC[-1],RC[-3]>=17,RC[-3]<18),20,IF(AND(RC[-3]<RC[-1],RC[-3]>=18,RC[-3]<19),15,IF(AND(RC[-3]<RC[-1],RC[-3]>=19,RC[-3]<20),10,IF(AND(RC[-3]<RC[-1],RC[-3]>=20,RC[-3]<21),5,IF(AND(RC[-3]<RC[-1],RC[-3]>=21),0,IF(AND(RC[-3]>RC[-1],RC[-3]>=2,RC[-3]<3),90,IF(AND(RC[-3]>RC[-1],RC[-3]>=3,RC[-3]<4),90,IF(AND(RC[-3]>RC[-1],RC[-3]>=4,RC[-3]<5),80,IF(AND(RC[-3]>RC[-1],RC[-3]>=5,RC[-3]<6),70,IF(AND(RC[-3]>RC[-1],RC[-3]>=6,RC[-3]<7),60,IF(AND(RC[-3]>RC[-1],RC[-3]>=7,RC[-3]<8),50,IF(AND(RC[-3]>RC[-1],RC[-3]>=8,RC[-3]<9),40,IF(AND(RC[-3]>RC[-1],RC[-3]>=9,RC[-3]<10),30,IF(AND(RC[-3]>RC[-1],RC[-3]>=10,RC[-3]<11),20,IF(AND(RC[-3]>RC[-1],RC[-3]>=11,RC[-3]<12),10,IF(AND(RC[-3]>RC[-1],RC[-3]>=12),0))))))))))))))))))))))))))))))))) -> 30 | H197: =IF(RC[-3]="","",IF(RC[-3]<0.3,100,IF(AND(RC[-3]>=0.3,RC[-3]>0.4),95,IF(AND(RC[-3]>=0.4,RC[-3]<0.5),90,IF(AND(RC[-3]>=0.5,RC[-3]<0.6),85,IF(AND(RC[-3]>=0.6,RC[-3]<0.7),80,IF(AND(RC[-3]>=0.6,RC[-3]<1),80,IF(AND(RC[-3]>1,RC[-3]<2),50,IF(RC[-3]>2,0))))))))) -> 95 | I197: =IF(RC[-1]="",RC[-2],0.7*RC[-1]+0.3*RC[-2]) -> 75.5
A198: دارو عبیدی | B198: دعبید | C198: =VLOOKUP(RC[-1],Sheet1!R3C2:R802C3,2,FALSE) -> دارویی | D198: =VLOOKUP(RC[-2],Sheet1!R3C2:R802C9,8,FALSE) -> 8.0799592975607801 | E198: =IF(VLOOKUP(RC[-3],Sheet1!R3C2:R803C11,10,FALSE)=0,"",VLOOKUP(Sheet2!RC[-3],Sheet1!R[1]C[-3]:R[801]C[6],10,FALSE)) ->  | F198: =Sheet1!R246C10 -> 7.5295416184238002 | G198: =IF(RC[-3]<0,0,IF(AND(RC[-3]<RC[-1],RC[-3]<2),100,IF(AND(RC[-3]<RC[-1],RC[-3]>=2,RC[-3]<3),95,IF(AND(RC[-3]<RC[-1],RC[-3]>=3,RC[-3]<4),90,IF(AND(RC[-3]<RC[-1],RC[-3]>=4,RC[-3]<5),85,IF(AND(RC[-3]<RC[-1],RC[-3]>=5,RC[-3]<6),80,IF(AND(RC[-3]<RC[-1],RC[-3]>=6,RC[-3]<7),75,IF(AND(RC[-3]<RC[-1],RC[-3]>=7,RC[-3]<8),70,IF(AND(RC[-3]<RC[-1],RC[-3]>=8,RC[-3]<9),65,IF(AND(RC[-3]<RC[-1],RC[-3]>=9,RC[-3]<10),60,IF(AND(RC[-3]<RC[-1],RC[-3]>=10,RC[-3]<11),55,IF(AND(RC[-3]<RC[-1],RC[-3]>=11,RC[-3]<12),50,IF(AND(RC[-3]<RC[-1],RC[-3]>=12,RC[-3]<13),45,IF(AND(RC[-3]<RC[-1],RC[-3]>=13,RC[-3]<14),40,IF(AND(RC[-3]<RC[-1],RC[-3]>=14,RC[-3]<15),35,IF(AND(RC[-3]<RC[-1],RC[-3]>=15,RC[-3]<16),30,IF(AND(RC[-3]<RC[-1],RC[-3]>=16,RC[-3]<17),25,IF(AND(RC[-3]<RC[-1],RC[-3]>=17,RC[-3]<18),20,IF(AND(RC[-3]<RC[-1],RC[-3]>=18,RC[-3]<19),15,IF(AND(RC[-3]<RC[-1],RC[-3]>=19,RC[-3]<20),10,IF(AND(RC[-3]<RC[-1],RC[-3]>=20,RC[-3]<21),5,IF(AND(RC[-3]<RC[-1],RC[-3]>=21),0,IF(AND(RC[-3]>RC[-1],RC[-3]>=2,RC[-3]<3),90,IF(AND(RC[-3]>RC[-1],RC[-3]>=3,RC[-3]<4),90,IF(AND(RC[-3]>RC[-1],RC[-3]>=4,RC[-3]<5),80,IF(AND(RC[-3]>RC[-1],RC[-3]>=5,RC[-3]<6),70,IF(AND(RC[-3]>RC[-1],RC[-3]>=6,RC[-3]<7),60,IF(AND(RC[-3]>RC[-1],RC[-3]>=7,RC[-3]<8),50,IF(AND(RC[-3]>RC[-1],RC[-3]>=8,RC[-3]<9),40,IF(AND(RC[-3]>RC[-1],RC[-3]>=9,RC[-3]<10),30,IF(AND(RC[-3]>RC[-1],RC[-3]>=10,RC[-3]<11),20,IF(AND(RC[-3]>RC[-1],RC[-3]>=11,RC[-3]<12),10,IF(AND(RC[-3]>RC[-1],RC[-3]>=12),0))))))))))))))))))))))))))))))))) -> 40 | H198: =IF(RC[-3]="","",IF(RC[-3]<0.3,100,IF(AND(RC[-3]>=0.3,RC[-3]>0.4),95,IF(AND(RC[-3]>=0.4,RC[-3]<0.5),90,IF(AND(RC[-3]>=0.5,RC[-3]<0.6),85,IF(AND(RC[-3]>=0.6,RC[-3]<0.7),80,IF(AND(RC[-3]>=0.6,RC[-3]<1),80,IF(AND(RC[-3]>1,RC[-3]<2),50,IF(RC[-3]>2,0))))))))) ->  | I198: =IF(RC[-1]="",RC[-2],0.7*RC[-1]+0.3*RC[-2]) -> 40
A199: دارو فارابی | B199: دفارا | C199: =VLOOKUP(RC[-1],Sheet1!R3C2:R802C3,2,FALSE) -> دارویی | D199: =VLOOKUP(RC[-2],Sheet1!R3C2:R802C9,8,FALSE) -> 5.5 | E199: =IF(VLOOKUP(RC[-3],Sheet1!R3C2:R803C11,10,FALSE)=0,"",VLOOKUP(Sheet2!RC[-3],Sheet1!R[1]C[-3]:R[801]C[6],10,FALSE)) ->  | F199: =Sheet1!R246C10 -> 7.5295416184238002 | G199: =IF(RC[-3]<0,0,IF(AND(RC[-3]<RC[-1],RC[-3]<2),100,IF(AND(RC[-3]<RC[-1],RC[-3]>=2,RC[-3]<3),95,IF(AND(RC[-3]<RC[-1],RC[-3]>=3,RC[-3]<4),90,IF(AND(RC[-3]<RC[-1],RC[-3]>=4,RC[-3]<5),85,IF(AND(RC[-3]<RC[-1],RC[-3]>=5,RC[-3]<6),80,IF(AND(RC[-3]<RC[-1],RC[-3]>=6,RC[-3]<7),75,IF(AND(RC[-3]<RC[-1],RC[-3]>=7,RC[-3]<8),70,IF(AND(RC[-3]<RC[-1],RC[-3]>=8,RC[-3]<9),65,IF(AND(RC[-3]<RC[-1],RC[-3]>=9,RC[-3]<10),60,IF(AND(RC[-3]<RC[-1],RC[-3]>=10,RC[-3]<11),55,IF(AND(RC[-3]<RC[-1],RC[-3]>=11,RC[-3]<12),50,IF(AND(RC[-3]<RC[-1],RC[-3]>=12,RC[-3]<13),45,IF(AND(RC[-3]<RC[-1],RC[-3]>=13,RC[-3]<14),40,IF(AND(RC[-3]<RC[-1],RC[-3]>=14,RC[-3]<15),35,IF(AND(RC[-3]<RC[-1],RC[-3]>=15,RC[-3]<16),30,IF(AND(RC[-3]<RC[-1],RC[-3]>=16,RC[-3]<17),25,IF(AND(RC[-3]<RC[-1],RC[-3]>=17,RC[-3]<18),20,IF(AND(RC[-3]<RC[-1],RC[-3]>=18,RC[-3]<19),15,IF(AND(RC[-3]<RC[-1],RC[-3]>=19,RC[-3]<20),10,IF(AND(RC[-3]<RC[-1],RC[-3]>=20,RC[-3]<21),5,IF(AND(RC[-3]<RC[-1],RC[-3]>=21),0,IF(AND(RC[-3]>RC[-1],RC[-3]>=2,RC[-3]<3),90,IF(AND(RC[-3]>RC[-1],RC[-3]>=3,RC[-3]<4),90,IF(AND(RC[-3]>RC[-1],RC[-3]>=4,RC[-3]<5),80,IF(AND(RC[-3]>RC[-1],RC[-3]>=5,RC[-3]<6),70,IF(AND(RC[-3]>RC[-1],RC[-3]>=6,RC[-3]<7),60,IF(AND(RC[-3]>RC[-1],RC[-3]>=7,RC[-3]<8),50,IF(AND(RC[-3]>RC[-1],RC[-3]>=8,RC[-3]<9),40,IF(AND(RC[-3]>RC[-1],RC[-3]>=9,RC[-3]<10),30,IF(AND(RC[-3]>RC[-1],RC[-3]>=10,RC[-3]<11),20,IF(AND(RC[-3]>RC[-1],RC[-3]>=11,RC[-3]<12),10,IF(AND(RC[-3]>RC[-1],RC[-3]>=12),0))))))))))))))))))))))))))))))))) -> 80 | H199: =IF(RC[-3]="","",IF(RC[-3]<0.3,100,IF(AND(RC[-3]>=0.3,RC[-3]>0.4),95,IF(AND(RC[-3]>=0.4,RC[-3]<0.5),90,IF(AND(RC[-3]>=0.5,RC[-3]<0.6),85,IF(AND(RC[-3]>=0.6,RC[-3]<0.7),80,IF(AND(RC[-3]>=0.6,RC[-3]<1),80,IF(AND(RC[-3]>1,RC[-3]<2),50,IF(RC[-3]>2,0))))))))) ->  | I199: =IF(RC[-1]="",RC[-2],0.7*RC[-1]+0.3*RC[-2]) -> 80
A200: دارو لقمان | B200: دلقما | C200: =VLOOKUP(RC[-1],Sheet1!R3C2:R802C3,2,FALSE) -> دارویی | D200: =VLOOKUP(RC[-2],Sheet1!R3C2:R802C9,8,FALSE) -> 38.083778900137418 | E200: =IF(VLOOKUP(RC[-3],Sheet1!R3C2:R803C11,10,FALSE)=0,"",VLOOKUP(Sheet2!RC[-3],Sheet1!R[1]C[-3]:R[801]C[6],10,FALSE)) ->  | F200: =Sheet1!R246C10 -> 7.5295416184238002 | G200: =IF(RC[-3]<0,0,IF(AND(RC[-3]<RC[-1],RC[-3]<2),100,IF(AND(RC[-3]<RC[-1],RC[-3]>=2,RC[-3]<3),95,IF(AND(RC[-3]<RC[-1],RC[-3]>=3,RC[-3]<4),90,IF(AND(RC[-3]<RC[-1],RC[-3]>=4,RC[-3]<5),85,IF(AND(RC[-3]<RC[-1],RC[-3]>=5,RC[-3]<6),80,IF(AND(RC[-3]<RC[-1],RC[-3]>=6,RC[-3]<7),75,IF(AND(RC[-3]<RC[-1],RC[-3]>=7,RC[-3]<8),70,IF(AND(RC[-3]<RC[-1],RC[-3]>=8,RC[-3]<9),65,IF(AND(RC[-3]<RC[-1],RC[-3]>=9,RC[-3]<10),60,IF(AND(RC[-3]<RC[-1],RC[-3]>=10,RC[-3]<11),55,IF(AND(RC[-3]<RC[-1],RC[-3]>=11,RC[-3]<12),50,IF(AND(RC[-3]<RC[-1],RC[-3]>=12,RC[-3]<13),45,IF(AND(RC[-3]<RC[-1],RC[-3]>=13,RC[-3]<14),40,IF(AND(RC[-3]<RC[-1],RC[-3]>=14,RC[-3]<15),35,IF(AND(RC[-3]<RC[-1],RC[-3]>=15,RC[-3]<16),30,IF(AND(RC[-3]<RC[-1],RC[-3]>=16,RC[-3]<17),25,IF(AND(RC[-3]<RC[-1],RC[-3]>=17,RC[-3]<18),20,IF(AND(RC[-3]<RC[-1],RC[-3]>=18,RC[-3]<19),15,IF(AND(RC[-3]<RC[-1],RC[-3]>=19,RC[-3]<20),10,IF(AND(RC[-3]<RC[-1],RC[-3]>=20,RC[-3]<21),5,IF(AND(RC[-3]<RC[-1],RC[-3]>=21),0,IF(AND(RC[-3]>RC[-1],RC[-3]>=2,RC[-3]<3),90,IF(AND(RC[-3]>RC[-1],RC[-3]>=3,RC[-3]<4),90,IF(AND(RC[-3]>RC[-1],RC[-3]>=4,RC[-3]<5),80,IF(AND(RC[-3]>RC[-1],RC[-3]>=5,RC[-3]<6),70,IF(AND(RC[-3]>RC[-1],RC[-3]>=6,RC[-3]<7),60,IF(AND(RC[-3]>RC[-1],RC[-3]>=7,RC[-3]<8),50,IF(AND(RC[-3]>RC[-1],RC[-3]>=8,RC[-3]<9),40,IF(AND(RC[-3]>RC[-1],RC[-3]>=9,RC[-3]<10),30,IF(AND(RC[-3]>RC[-1],RC[-3]>=10,RC[-3]<11),20,IF(AND(RC[-3]>RC[-1],RC[-3]>=11,RC[-3]<12),10,IF(AND(RC[-3]>RC[-1],RC[-3]>=12),0))))))))))))))))))))))))))))))))) -> 0 | H200: =IF(RC[-3]="","",IF(RC[-3]<0.3,100,IF(AND(RC[-3]>=0.3,RC[-3]>0.4),95,IF(AND(RC[-3]>=0.4,RC[-3]<0.5),90,IF(AND(RC[-3]>=0.5,RC[-3]<0.6),85,IF(AND(RC[-3]>=0.6,RC[-3]<0.7),80,IF(AND(RC[-3]>=0.6,RC[-3]<1),80,IF(AND(RC[-3]>1,RC[-3]<2),50,IF(RC[-3]>2,0))))))))) ->  | I200: =IF(RC[-1]="",RC[-2],0.7*RC[-1]+0.3*RC[-2]) -> 0
A201: داروپخش | B201: وپخش | C201: =VLOOKUP(RC[-1],Sheet1!R3C2:R802C3,2,FALSE) -> دارویی | D201: =VLOOKUP(RC[-2],Sheet1!R3C2:R802C9,8,FALSE) -> 4.9093223364344265 | E201: =IF(VLOOKUP(RC[-3],Sheet1!R3C2:R803C11,10,FALSE)=0,"",VLOOKUP(Sheet2!RC[-3],Sheet1!R[1]C[-3]:R[801]C[6],10,FALSE)) -> 0.75 | F201: =Sheet1!R246C10 -> 7.5295416184238002 | G201: =IF(RC[-3]<0,0,IF(AND(RC[-3]<RC[-1],RC[-3]<2),100,IF(AND(RC[-3]<RC[-1],RC[-3]>=2,RC[-3]<3),95,IF(AND(RC[-3]<RC[-1],RC[-3]>=3,RC[-3]<4),90,IF(AND(RC[-3]<RC[-1],RC[-3]>=4,RC[-3]<5),85,IF(AND(RC[-3]<RC[-1],RC[-3]>=5,RC[-3]<6),80,IF(AND(RC[-3]<RC[-1],RC[-3]>=6,RC[-3]<7),75,IF(AND(RC[-3]<RC[-1],RC[-3]>=7,RC[-3]<8),70,IF(AND(RC[-3]<RC[-1],RC[-3]>=8,RC[-3]<9),65,IF(AND(RC[-3]<RC[-1],RC[-3]>=9,RC[-3]<10),60,IF(AND(RC[-3]<RC[-1],RC[-3]>=10,RC[-3]<11),55,IF(AND(RC[-3]<RC[-1],RC[-3]>=11,RC[-3]<12),50,IF(AND(RC[-3]<RC[-1],RC[-3]>=12,RC[-3]<13),45,IF(AND(RC[-3]<RC[-1],RC[-3]>=13,RC[-3]<14),40,IF(AND(RC[-3]<RC[-1],RC[-3]>=14,RC[-3]<15),35,IF(AND(RC[-3]<RC[-1],RC[-3]>=15,RC[-3]<16),30,IF(AND(RC[-3]<RC[-1],RC[-3]>=16,RC[-3]<17),25,IF(AND(RC[-3]<RC[-1],RC[-3]>=17,RC[-3]<18),20,IF(AND(RC[-3]<RC[-1],RC[-3]>=18,RC[-3]<19),15,IF(AND(RC[-3]<RC[-1],RC[-3]>=19,RC[-3]<20),10,IF(AND(RC[-3]<RC[-1],RC[-3]>=20,RC[-3]<21),5,IF(AND(RC[-3]<RC[-1],RC[-3]>=21),0,IF(AND(RC[-3]>RC[-1],RC[-3]>=2,RC[-3]<3),90,IF(AND(RC[-3]>RC[-1],RC[-3]>=3,RC[-3]<4),90,IF(AND(RC[-3]>RC[-1],RC[-3]>=4,RC[-3]<5),80,IF(AND(RC[-3]>RC[-1],RC[-3]>=5,RC[-3]<6),70,IF(AND(RC[-3]>RC[-1],RC[-3]>=6,RC[-3]<7),60,IF(AND(RC[-3]>RC[-1],RC[-3]>=7,RC[-3]<8),50,IF(AND(RC[-3]>RC[-1],RC[-3]>=8,RC[-3]<9),40,IF(AND(RC[-3]>RC[-1],RC[-3]>=9,RC[-3]<10),30,IF(AND(RC[-3]>RC[-1],RC[-3]>=10,RC[-3]<11),20,IF(AND(RC[-3]>RC[-1],RC[-3]>=11,RC[-3]<12),10,IF(AND(RC[-3]>RC[-1],RC[-3]>=12),0))))))))))))))))))))))))))))))))) -> 85 | H201: =IF(RC[-3]="","",IF(RC[-3]<0.3,100,IF(AND(RC[-3]>=0.3,RC[-3]>0.4),95,IF(AND(RC[-3]>=0.4,RC[-3]<0.5),90,IF(AND(RC[-3]>=0.5,RC[-3]<0.6),85,IF(AND(RC[-3]>=0.6,RC[-3]<0.7),80,IF(AND(RC[-3]>=0.6,RC[-3]<1),80,IF(AND(RC[-3]>1,RC[-3]<2),50,IF(RC[-3]>2,0))))))))) -> 95 | I201: =IF(RC[-1]="",RC[-2],0.7*RC[-1]+0.3*RC[-2]) -> 92
A202: داروسازی آوه سینا | B202: داوه | C202: =VLOOKUP(RC[-1],Sheet1!R3C2:R802C3,2,FALSE) -> دارویی | D202: =VLOOKUP(RC[-2],Sheet1!R3C2:R802C9,8,FALSE) -> 15.010846836351785 | E202: =IF(VLOOKUP(RC[-3],Sheet1!R3C2:R803C11,10,FALSE)=0,"",VLOOKUP(Sheet2!RC[-3],Sheet1!R[1]C[-3]:R[801]C[6],10,FALSE)) ->  | F202: =Sheet1!R246C10 -> 7.5295416184238002 | G202: =IF(RC[-3]<0,0,IF(AND(RC[-3]<RC[-1],RC[-3]<2),100,IF(AND(RC[-3]<RC[-1],RC[-3]>=2,RC[-3]<3),95,IF(AND(RC[-3]<RC[-1],RC[-3]>=3,RC[-3]<4),90,IF(AND(RC[-3]<RC[-1],RC[-3]>=4,RC[-3]<5),85,IF(AND(RC[-3]<RC[-1],RC[-3]>=5,RC[-3]<6),80,IF(AND(RC[-3]<RC[-1],RC[-3]>=6,RC[-3]<7),75,IF(AND(RC[-3]<RC[-1],RC[-3]>=7,RC[-3]<8),70,IF(AND(RC[-3]<RC[-1],RC[-3]>=8,RC[-3]<9),65,IF(AND(RC[-3]<RC[-1],RC[-3]>=9,RC[-3]<10),60,IF(AND(RC[-3]<RC[-1],RC[-3]>=10,RC[-3]<11),55,IF(AND(RC[-3]<RC[-1],RC[-3]>=11,RC[-3]<12),50,IF(AND(RC[-3]<RC[-1],RC[-3]>=12,RC[-3]<13),45,IF(AND(RC[-3]<RC[-1],RC[-3]>=13,RC[-3]<14),40,IF(AND(RC[-3]<RC[-1],RC[-3]>=14,RC[-3]<15),35,IF(AND(RC[-3]<RC[-1],RC[-3]>=15,RC[-3]<16),30,IF(AND(RC[-3]<RC[-1],RC[-3]>=16,RC[-3]<17),25,IF(AND(RC[-3]<RC[-1],RC[-3]>=17,RC[-3]<18),20,IF(AND(RC[-3]<RC[-1],RC[-3]>=18,RC[-3]<19),15,IF(AND(RC[-3]<RC[-1],RC[-3]>=19,RC[-3]<20),10,IF(AND(RC[-3]<RC[-1],RC[-3]>=20,RC[-3]<21),5,IF(AND(RC[-3]<RC[-1],RC[-3]>=21),0,IF(AND(RC[-3]>RC[-1],RC[-3]>=2,RC[-3]<3),90,IF(AND(RC[-3]>RC[-1],RC[-3]>=3,RC[-3]<4),90,IF(AND(RC[-3]>RC[-1],RC[-3]>=4,RC[-3]<5),80,IF(AND(RC[-3]>RC[-1],RC[-3]>=5,RC[-3]<6),70,IF(AND(RC[-3]>RC[-1],RC[-3]>=6,RC[-3]<7),60,IF(AND(RC[-3]>RC[-1],RC[-3]>=7,RC[-3]<8),50,IF(AND(RC[-3]>RC[-1],RC[-3]>=8,RC[-3]<9),40,IF(AND(RC[-3]>RC[-1],RC[-3]>=9,RC[-3]<10),30,IF(AND(RC[-3]>RC[-1],RC[-3]>=10,RC[-3]<11),20,IF(AND(RC[-3]>RC[-1],RC[-3]>=11,RC[-3]<12),10,IF(AND(RC[-3]>RC[-1],RC[-3]>=12),0))))))))))))))))))))))))))))))))) -> 0 | H202: =IF(RC[-3]="","",IF(RC[-3]<0.3,100,IF(AND(RC[-3]>=0.3,RC[-3]>0.4),95,IF(AND(RC[-3]>=0.4,RC[-3]<0.5),90,IF(AND(RC[-3]>=0.5,RC[-3]<0.6),85,IF(AND(RC[-3]>=0.6,RC[-3]<0.7),80,IF(AND(RC[-3]>=0.6,RC[-3]<1),80,IF(AND(RC[-3]>1,RC[-3]<2),50,IF(RC[-3]>2,0))))))))) ->  | I202: =IF(RC[-1]="",RC[-2],0.7*RC[-1]+0.3*RC[-2]) -> 0
A203: داروسازی الحاوی | B203: دحاوی | C203: =VLOOKUP(RC[-1],Sheet1!R3C2:R802C3,2,FALSE) -> دارویی | D203: =VLOOKUP(RC[-2],Sheet1!R3C2:R802C9,8,FALSE) -> 13.471004919210072 | E203: =IF(VLOOKUP(RC[-3],Sheet1!R3C2:R803C11,10,FALSE)=0,"",VLOOKUP(Sheet2!RC[-3],Sheet1!R[1]C[-3]:R[801]C[6],10,FALSE)) ->  | F203: =Sheet1!R246C10 -> 7.5295416184238002 | G203: =IF(RC[-3]<0,0,IF(AND(RC[-3]<RC[-1],RC[-3]<2),100,IF(AND(RC[-3]<RC[-1],RC[-3]>=2,RC[-3]<3),95,IF(AND(RC[-3]<RC[-1],RC[-3]>=3,RC[-3]<4),90,IF(AND(RC[-3]<RC[-1],RC[-3]>=4,RC[-3]<5),85,IF(AND(RC[-3]<RC[-1],RC[-3]>=5,RC[-3]<6),80,IF(AND(RC[-3]<RC[-1],RC[-3]>=6,RC[-3]<7),75,IF(AND(RC[-3]<RC[-1],RC[-3]>=7,RC[-3]<8),70,IF(AND(RC[-3]<RC[-1],RC[-3]>=8,RC[-3]<9),65,IF(AND(RC[-3]<RC[-1],RC[-3]>=9,RC[-3]<10),60,IF(AND(RC[-3]<RC[-1],RC[-3]>=10,RC[-3]<11),55,IF(AND(RC[-3]<RC[-1],RC[-3]>=11,RC[-3]<12),50,IF(AND(RC[-3]<RC[-1],RC[-3]>=12,RC[-3]<13),45,IF(AND(RC[-3]<RC[-1],RC[-3]>=13,RC[-3]<14),40,IF(AND(RC[-3]<RC[-1],RC[-3]>=14,RC[-3]<15),35,IF(AND(RC[-3]<RC[-1],RC[-3]>=15,RC[-3]<16),30,IF(AND(RC[-3]<RC[-1],RC[-3]>=16,RC[-3]<17),25,IF(AND(RC[-3]<RC[-1],RC[-3]>=17,RC[-3]<18),20,IF(AND(RC[-3]<RC[-1],RC[-3]>=18,RC[-3]<19),15,IF(AND(RC[-3]<RC[-1],RC[-3]>=19,RC[-3]<20),10,IF(AND(RC[-3]<RC[-1],RC[-3]>=20,RC[-3]<21),5,IF(AND(RC[-3]<RC[-1],RC[-3]>=21),0,IF(AND(RC[-3]>RC[-1],RC[-3]>=2,RC[-3]<3),90,IF(AND(RC[-3]>RC[-1],RC[-3]>=3,RC[-3]<4),90,IF(AND(RC[-3]>RC[-1],RC[-3]>=4,RC[-3]<5),80,IF(AND(RC[-3]>RC[-1],RC[-3]>=5,RC[-3]<6),70,IF(AND(RC[-3]>RC[-1],RC[-3]>=6,RC[-3]<7),60,IF(AND(RC[-3]>RC[-1],RC[-3]>=7,RC[-3]<8),50,IF(AND(RC[-3]>RC[-1],RC[-3]>=8,RC[-3]<9),40,IF(AND(RC[-3]>RC[-1],RC[-3]>=9,RC[-3]<10),30,IF(AND(RC[-3]>RC[-1],RC[-3]>=10,RC[-3]<11),20,IF(AND(RC[-3]>RC[-1],RC[-3]>=11,RC[-3]<12),10,IF(AND(RC[-3]>RC[-1],RC[-3]>=12),0))))))))))))))))))))))))))))))))) -> 0 | H203: =IF(RC[-3]="","",IF(RC[-3]<0.3,100,IF(AND(RC[-3]>=0.3,RC[-3]>0.4),95,IF(AND(RC[-3]>=0.4,RC[-3]<0.5),90,IF(AND(RC[-3]>=0.5,RC[-3]<0.6),85,IF(AND(RC[-3]>=0.6,RC[-3]<0.7),80,IF(AND(RC[-3]>=0.6,RC[-3]<1),80,IF(AND(RC[-3]>1,RC[-3]<2),50,IF(RC[-3]>2,0))))))))) ->  | I203: =IF(RC[-1]="",RC[-2],0.7*RC[-1]+0.3*RC[-2]) -> 0
A204: داروسازی تولید دارو | B204: دتولید | C204: =VLOOKUP(RC[-1],Sheet1!R3C2:R802C3,2,FALSE) -> دارویی | D204: =VLOOKUP(RC[-2],Sheet1!R3C2:R802C9,8,FALSE) -> 69.021985876037604 | E204: =IF(VLOOKUP(RC[-3],Sheet1!R3C2:R803C11,10,FALSE)=0,"",VLOOKUP(Sheet2!RC[-3],Sheet1!R[1]C[-3]:R[801]C[6],10,FALSE)) ->  | F204: =Sheet1!R246C10 -> 7.5295416184238002 | G204: =IF(RC[-3]<0,0,IF(AND(RC[-3]<RC[-1],RC[-3]<2),100,IF(AND(RC[-3]<RC[-1],RC[-3]>=2,RC[-3]<3),95,IF(AND(RC[-3]<RC[-1],RC[-3]>=3,RC[-3]<4),90,IF(AND(RC[-3]<RC[-1],RC[-3]>=4,RC[-3]<5),85,IF(AND(RC[-3]<RC[-1],RC[-3]>=5,RC[-3]<6),80,IF(AND(RC[-3]<RC[-1],RC[-3]>=6,RC[-3]<7),75,IF(AND(RC[-3]<RC[-1],RC[-3]>=7,RC[-3]<8),70,IF(AND(RC[-3]<RC[-1],RC[-3]>=8,RC[-3]<9),65,IF(AND(RC[-3]<RC[-1],RC[-3]>=9,RC[-3]<10),60,IF(AND(RC[-3]<RC[-1],RC[-3]>=10,RC[-3]<11),55,IF(AND(RC[-3]<RC[-1],RC[-3]>=11,RC[-3]<12),50,IF(AND(RC[-3]<RC[-1],RC[-3]>=12,RC[-3]<13),45,IF(AND(RC[-3]<RC[-1],RC[-3]>=13,RC[-3]<14),40,IF(AND(RC[-3]<RC[-1],RC[-3]>=14,RC[-3]<15),35,IF(AND(RC[-3]<RC[-1],RC[-3]>=15,RC[-3]<16),30,IF(AND(RC[-3]<RC[-1],RC[-3]>=16,RC[-3]<17),25,IF(AND(RC[-3]<RC[-1],RC[-3]>=17,RC[-3]<18),20,IF(AND(RC[-3]<RC[-1],RC[-3]>=18,RC[-3]<19),15,IF(AND(RC[-3]<RC[-1],RC[-3]>=19,RC[-3]<20),10,IF(AND(RC[-3]<RC[-1],RC[-3]>=20,RC[-3]<21),5,IF(AND(RC[-3]<RC[-1],RC[-3]>=21),0,IF(AND(RC[-3]>RC[-1],RC[-3]>=2,RC[-3]<3),90,IF(AND(RC[-3]>RC[-1],RC[-3]>=3,RC[-3]<4),90,IF(AND(RC[-3]>RC[-1],RC[-3]>=4,RC[-3]<5),80,IF(AND(RC[-3]>RC[-1],RC[-3]>=5,RC[-3]<6),70,IF(AND(RC[-3]>RC[-1],RC[-3]>=6,RC[-3]<7),60,IF(AND(RC[-3]>RC[-1],RC[-3]>=7,RC[-3]<8),50,IF(AND(RC[-3]>RC[-1],RC[-3]>=8,RC[-3]<9),40,IF(AND(RC[-3]>RC[-1],RC[-3]>=9,RC[-3]<10),30,IF(AND(RC[-3]>RC[-1],RC[-3]>=10,RC[-3]<11),20,IF(AND(RC[-3]>RC[-1],RC[-3]>=11,RC[-3]<12),10,IF(AND(RC[-3]>RC[-1],RC[-3]>=12),0))))))))))))))))))))))))))))))))) -> 0 | H204: =IF(RC[-3]="","",IF(RC[-3]<0.3,100,IF(AND(RC[-3]>=0.3,RC[-3]>0.4),95,IF(AND(RC[-3]>=0.4,RC[-3]<0.5),90,IF(AND(RC[-3]>=0.5,RC[-3]<0.6),85,IF(AND(RC[-3]>=0.6,RC[-3]<0.7),80,IF(AND(RC[-3]>=0.6,RC[-3]<1),80,IF(AND(RC[-3]>1,RC[-3]<2),50,IF(RC[-3]>2,0))))))))) ->  | I204: =IF(RC[-1]="",RC[-2],0.7*RC[-1]+0.3*RC[-2]) -> 0
A205: داروسازی دانا | B205: ددانا | C205: =VLOOKUP(RC[-1],Sheet1!R3C2:R802C3,2,FALSE) -> دارویی | D205: =VLOOKUP(RC[-2],Sheet1!R3C2:R802C9,8,FALSE) -> 5.3423505386358796 | E205: =IF(VLOOKUP(RC[-3],Sheet1!R3C2:R803C11,10,FALSE)=0,"",VLOOKUP(Sheet2!RC[-3],Sheet1!R[1]C[-3]:R[801]C[6],10,FALSE)) ->  | F205: =Sheet1!R246C10 -> 7.5295416184238002 | G205: =IF(RC[-3]<0,0,IF(AND(RC[-3]<RC[-1],RC[-3]<2),100,IF(AND(RC[-3]<RC[-1],RC[-3]>=2,RC[-3]<3),95,IF(AND(RC[-3]<RC[-1],RC[-3]>=3,RC[-3]<4),90,IF(AND(RC[-3]<RC[-1],RC[-3]>=4,RC[-3]<5),85,IF(AND(RC[-3]<RC[-1],RC[-3]>=5,RC[-3]<6),80,IF(AND(RC[-3]<RC[-1],RC[-3]>=6,RC[-3]<7),75,IF(AND(RC[-3]<RC[-1],RC[-3]>=7,RC[-3]<8),70,IF(AND(RC[-3]<RC[-1],RC[-3]>=8,RC[-3]<9),65,IF(AND(RC[-3]<RC[-1],RC[-3]>=9,RC[-3]<10),60,IF(AND(RC[-3]<RC[-1],RC[-3]>=10,RC[-3]<11),55,IF(AND(RC[-3]<RC[-1],RC[-3]>=11,RC[-3]<12),50,IF(AND(RC[-3]<RC[-1],RC[-3]>=12,RC[-3]<13),45,IF(AND(RC[-3]<RC[-1],RC[-3]>=13,RC[-3]<14),40,IF(AND(RC[-3]<RC[-1],RC[-3]>=14,RC[-3]<15),35,IF(AND(RC[-3]<RC[-1],RC[-3]>=15,RC[-3]<16),30,IF(AND(RC[-3]<RC[-1],RC[-3]>=16,RC[-3]<17),25,IF(AND(RC[-3]<RC[-1],RC[-3]>=17,RC[-3]<18),20,IF(AND(RC[-3]<RC[-1],RC[-3]>=18,RC[-3]<19),15,IF(AND(RC[-3]<RC[-1],RC[-3]>=19,RC[-3]<20),10,IF(AND(RC[-3]<RC[-1],RC[-3]>=20,RC[-3]<21),5,IF(AND(RC[-3]<RC[-1],RC[-3]>=21),0,IF(AND(RC[-3]>RC[-1],RC[-3]>=2,RC[-3]<3),90,IF(AND(RC[-3]>RC[-1],RC[-3]>=3,RC[-3]<4),90,IF(AND(RC[-3]>RC[-1],RC[-3]>=4,RC[-3]<5),80,IF(AND(RC[-3]>RC[-1],RC[-3]>=5,RC[-3]<6),70,IF(AND(RC[-3]>RC[-1],RC[-3]>=6,RC[-3]<7),60,IF(AND(RC[-3]>RC[-1],RC[-3]>=7,RC[-3]<8),50,IF(AND(RC[-3]>RC[-1],RC[-3]>=8,RC[-3]<9),40,IF(AND(RC[-3]>RC[-1],RC[-3]>=9,RC[-3]<10),30,IF(AND(RC[-3]>RC[-1],RC[-3]>=10,RC[-3]<11),20,IF(AND(RC[-3]>RC[-1],RC[-3]>=11,RC[-3]<12),10,IF(AND(RC[-3]>RC[-1],RC[-3]>=12),0))))))))))))))))))))))))))))))))) -> 80 | H205: =IF(RC[-3]="","",IF(RC[-3]<0.3,100,IF(AND(RC[-3]>=0.3,RC[-3]>0.4),95,IF(AND(RC[-3]>=0.4,RC[-3]<0.5),90,IF(AND(RC[-3]>=0.5,RC[-3]<0.6),85,IF(AND(RC[-3]>=0.6,RC[-3]<0.7),80,IF(AND(RC[-3]>=0.6,RC[-3]<1),80,IF(AND(RC[-3]>1,RC[-3]<2),50,IF(RC[-3]>2,0))))))))) ->  | I205: =IF(RC[-1]="",RC[-2],0.7*RC[-1]+0.3*RC[-2]) -> 80
A206: داروسازی قاضی | B206: دقاضی | C206: =VLOOKUP(RC[-1],Sheet1!R3C2:R802C3,2,FALSE) -> دارویی | D206: =VLOOKUP(RC[-2],Sheet1!R3C2:R802C9,8,FALSE) -> 4.8292860922286671 | E206: =IF(VLOOKUP(RC[-3],Sheet1!R3C2:R803C11,10,FALSE)=0,"",VLOOKUP(Sheet2!RC[-3],Sheet1!R[1]C[-3]:R[801]C[6],10,FALSE)) ->  | F206: =Sheet1!R246C10 -> 7.5295416184238002 | G206: =IF(RC[-3]<0,0,IF(AND(RC[-3]<RC[-1],RC[-3]<2),100,IF(AND(RC[-3]<RC[-1],RC[-3]>=2,RC[-3]<3),95,IF(AND(RC[-3]<RC[-1],RC[-3]>=3,RC[-3]<4),90,IF(AND(RC[-3]<RC[-1],RC[-3]>=4,RC[-3]<5),85,IF(AND(RC[-3]<RC[-1],RC[-3]>=5,RC[-3]<6),80,IF(AND(RC[-3]<RC[-1],RC[-3]>=6,RC[-3]<7),75,IF(AND(RC[-3]<RC[-1],RC[-3]>=7,RC[-3]<8),70,IF(AND(RC[-3]<RC[-1],RC[-3]>=8,RC[-3]<9),65,IF(AND(RC[-3]<RC[-1],RC[-3]>=9,RC[-3]<10),60,IF(AND(RC[-3]<RC[-1],RC[-3]>=10,RC[-3]<11),55,IF(AND(RC[-3]<RC[-1],RC[-3]>=11,RC[-3]<12),50,IF(AND(RC[-3]<RC[-1],RC[-3]>=12,RC[-3]<13),45,IF(AND(RC[-3]<RC[-1],RC[-3]>=13,RC[-3]<14),40,IF(AND(RC[-3]<RC[-1],RC[-3]>=14,RC[-3]<15),35,IF(AND(RC[-3]<RC[-1],RC[-3]>=15,RC[-3]<16),30,IF(AND(RC[-3]<RC[-1],RC[-3]>=16,RC[-3]<17),25,IF(AND(RC[-3]<RC[-1],RC[-3]>=17,RC[-3]<18),20,IF(AND(RC[-3]<RC[-1],RC[-3]>=18,RC[-3]<19),15,IF(AND(RC[-3]<RC[-1],RC[-3]>=19,RC[-3]<20),10,IF(AND(RC[-3]<RC[-1],RC[-3]>=20,RC[-3]<21),5,IF(AND(RC[-3]<RC[-1],RC[-3]>=21),0,IF(AND(RC[-3]>RC[-1],RC[-3]>=2,RC[-3]<3),90,IF(AND(RC[-3]>RC[-1],RC[-3]>=3,RC[-3]<4),90,IF(AND(RC[-3]>RC[-1],RC[-3]>=4,RC[-3]<5),80,IF(AND(RC[-3]>RC[-1],RC[-3]>=5,RC[-3]<6),70,IF(AND(RC[-3]>RC[-1],RC[-3]>=6,RC[-3]<7),60,IF(AND(RC[-3]>RC[-1],RC[-3]>=7,RC[-3]<8),50,IF(AND(RC[-3]>RC[-1],RC[-3]>=8,RC[-3]<9),40,IF(AND(RC[-3]>RC[-1],RC[-3]>=9,RC[-3]<10),30,IF(AND(RC[-3]>RC[-1],RC[-3]>=10,RC[-3]<11),20,IF(AND(RC[-3]>RC[-1],RC[-3]>=11,RC[-3]<12),10,IF(AND(RC[-3]>RC[-1],RC[-3]>=12),0))))))))))))))))))))))))))))))))) -> 85 | H206: =IF(RC[-3]="","",IF(RC[-3]<0.3,100,IF(AND(RC[-3]>=0.3,RC[-3]>0.4),95,IF(AND(RC[-3]>=0.4,RC[-3]<0.5),90,IF(AND(RC[-3]>=0.5,RC[-3]<0.6),85,IF(AND(RC[-3]>=0.6,RC[-3]<0.7),80,IF(AND(RC[-3]>=0.6,RC[-3]<1),80,IF(AND(RC[-3]>1,RC[-3]<2),50,IF(RC[-3]>2,0))))))))) ->  | I206: =IF(RC[-1]="",RC[-2],0.7*RC[-1]+0.3*RC[-2]) -> 85
A207: داروسازی کوثر | B207: دکوثر | C207: =VLOOKUP(RC[-1],Sheet1!R3C2:R802C3,2,FALSE) -> دارویی | D207: =VLOOKUP(RC[-2],Sheet1!R3C2:R802C9,8,FALSE) -> 71.065456105887648 | E207: =IF(VLOOKUP(RC[-3],Sheet1!R3C2:R803C11,10,FALSE)=0,"",VLOOKUP(Sheet2!RC[-3],Sheet1!R[1]C[-3]:R[801]C[6],10,FALSE)) ->  | F207: =Sheet1!R246C10 -> 7.5295416184238002 | G207: =IF(RC[-3]<0,0,IF(AND(RC[-3]<RC[-1],RC[-3]<2),100,IF(AND(RC[-3]<RC[-1],RC[-3]>=2,RC[-3]<3),95,IF(AND(RC[-3]<RC[-1],RC[-3]>=3,RC[-3]<4),90,IF(AND(RC[-3]<RC[-1],RC[-3]>=4,RC[-3]<5),85,IF(AND(RC[-3]<RC[-1],RC[-3]>=5,RC[-3]<6),80,IF(AND(RC[-3]<RC[-1],RC[-3]>=6,RC[-3]<7),75,IF(AND(RC[-3]<RC[-1],RC[-3]>=7,RC[-3]<8),70,IF(AND(RC[-3]<RC[-1],RC[-3]>=8,RC[-3]<9),65,IF(AND(RC[-3]<RC[-1],RC[-3]>=9,RC[-3]<10),60,IF(AND(RC[-3]<RC[-1],RC[-3]>=10,RC[-3]<11),55,IF(AND(RC[-3]<RC[-1],RC[-3]>=11,RC[-3]<12),50,IF(AND(RC[-3]<RC[-1],RC[-3]>=12,RC[-3]<13),45,IF(AND(RC[-3]<RC[-1],RC[-3]>=13,RC[-3]<14),40,IF(AND(RC[-3]<RC[-1],RC[-3]>=14,RC[-3]<15),35,IF(AND(RC[-3]<RC[-1],RC[-3]>=15,RC[-3]<16),30,IF(AND(RC[-3]<RC[-1],RC[-3]>=16,RC[-3]<17),25,IF(AND(RC[-3]<RC[-1],RC[-3]>=17,RC[-3]<18),20,IF(AND(RC[-3]<RC[-1],RC[-3]>=18,RC[-3]<19),15,IF(AND(RC[-3]<RC[-1],RC[-3]>=19,RC[-3]<20),10,IF(AND(RC[-3]<RC[-1],RC[-3]>=20,RC[-3]<21),5,IF(AND(RC[-3]<RC[-1],RC[-3]>=21),0,IF(AND(RC[-3]>RC[-1],RC[-3]>=2,RC[-3]<3),90,IF(AND(RC[-3]>RC[-1],RC[-3]>=3,RC[-3]<4),90,IF(AND(RC[-3]>RC[-1],RC[-3]>=4,RC[-3]<5),80,IF(AND(RC[-3]>RC[-1],RC[-3]>=5,RC[-3]<6),70,IF(AND(RC[-3]>RC[-1],RC[-3]>=6,RC[-3]<7),60,IF(AND(RC[-3]>RC[-1],RC[-3]>=7,RC[-3]<8),50,IF(AND(RC[-3]>RC[-1],RC[-3]>=8,RC[-3]<9),40,IF(AND(RC[-3]>RC[-1],RC[-3]>=9,RC[-3]<10),30,IF(AND(RC[-3]>RC[-1],RC[-3]>=10,RC[-3]<11),20,IF(AND(RC[-3]>RC[-1],RC[-3]>=11,RC[-3]<12),10,IF(AND(RC[-3]>RC[-1],RC[-3]>=12),0))))))))))))))))))))))))))))))))) -> 0 | H207: =IF(RC[-3]="","",IF(RC[-3]<0.3,100,IF(AND(RC[-3]>=0.3,RC[-3]>0.4),95,IF(AND(RC[-3]>=0.4,RC[-3]<0.5),90,IF(AND(RC[-3]>=0.5,RC[-3]<0.6),85,IF(AND(RC[-3]>=0.6,RC[-3]<0.7),80,IF(AND(RC[-3]>=0.6,RC[-3]<1),80,IF(AND(RC[-3]>1,RC[-3]<2),50,IF(RC[-3]>2,0))))))))) ->  | I207: =IF(RC[-1]="",RC[-2],0.7*RC[-1]+0.3*RC[-2]) -> 0
A208: دارویی برکت | B208: برکت | C208: =VLOOKUP(RC[-1],Sheet1!R3C2:R802C3,2,FALSE) -> دارویی | D208: =VLOOKUP(RC[-2],Sheet1!R3C2:R802C9,8,FALSE) -> 3.7440358395323967 | E208: =IF(VLOOKUP(RC[-3],Sheet1!R3C2:R803C11,10,FALSE)=0,"",VLOOKUP(Sheet2!RC[-3],Sheet1!R[1]C[-3]:R[801]C[6],10,FALSE)) -> 1 | F208: =Sheet1!R246C10 -> 7.5295416184238002 | G208: =IF(RC[-3]<0,0,IF(AND(RC[-3]<RC[-1],RC[-3]<2),100,IF(AND(RC[-3]<RC[-1],RC[-3]>=2,RC[-3]<3),95,IF(AND(RC[-3]<RC[-1],RC[-3]>=3,RC[-3]<4),90,IF(AND(RC[-3]<RC[-1],RC[-3]>=4,RC[-3]<5),85,IF(AND(RC[-3]<RC[-1],RC[-3]>=5,RC[-3]<6),80,IF(AND(RC[-3]<RC[-1],RC[-3]>=6,RC[-3]<7),75,IF(AND(RC[-3]<RC[-1],RC[-3]>=7,RC[-3]<8),70,IF(AND(RC[-3]<RC[-1],RC[-3]>=8,RC[-3]<9),65,IF(AND(RC[-3]<RC[-1],RC[-3]>=9,RC[-3]<10),60,IF(AND(RC[-3]<RC[-1],RC[-3]>=10,RC[-3]<11),55,IF(AND(RC[-3]<RC[-1],RC[-3]>=11,RC[-3]<12),50,IF(AND(RC[-3]<RC[-1],RC[-3]>=12,RC[-3]<13),45,IF(AND(RC[-3]<RC[-1],RC[-3]>=13,RC[-3]<14),40,IF(AND(RC[-3]<RC[-1],RC[-3]>=14,RC[-3]<15),35,IF(AND(RC[-3]<RC[-1],RC[-3]>=15,RC[-3]<16),30,IF(AND(RC[-3]<RC[-1],RC[-3]>=16,RC[-3]<17),25,IF(AND(RC[-3]<RC[-1],RC[-3]>=17,RC[-3]<18),20,IF(AND(RC[-3]<RC[-1],RC[-3]>=18,RC[-3]<19),15,IF(AND(RC[-3]<RC[-1],RC[-3]>=19,RC[-3]<20),10,IF(AND(RC[-3]<RC[-1],RC[-3]>=20,RC[-3]<21),5,IF(AND(RC[-3]<RC[-1],RC[-3]>=21),0,IF(AND(RC[-3]>RC[-1],RC[-3]>=2,RC[-3]<3),90,IF(AND(RC[-3]>RC[-1],RC[-3]>=3,RC[-3]<4),90,IF(AND(RC[-3]>RC[-1],RC[-3]>=4,RC[-3]<5),80,IF(AND(RC[-3]>RC[-1],RC[-3]>=5,RC[-3]<6),70,IF(AND(RC[-3]>RC[-1],RC[-3]>=6,RC[-3]<7),60,IF(AND(RC[-3]>RC[-1],RC[-3]>=7,RC[-3]<8),50,IF(AND(RC[-3]>RC[-1],RC[-3]>=8,RC[-3]<9),40,IF(AND(RC[-3]>RC[-1],RC[-3]>=9,RC[-3]<10),30,IF(AND(RC[-3]>RC[-1],RC[-3]>=10,RC[-3]<11),20,IF(AND(RC[-3]>RC[-1],RC[-3]>=11,RC[-3]<12),10,IF(AND(RC[-3]>RC[-1],RC[-3]>=12),0))))))))))))))))))))))))))))))))) -> 90 | H208: =IF(RC[-3]="","",IF(RC[-3]<0.3,100,IF(AND(RC[-3]>=0.3,RC[-3]>0.4),95,IF(AND(RC[-3]>=0.4,RC[-3]<0.5),90,IF(AND(RC[-3]>=0.5,RC[-3]<0.6),85,IF(AND(RC[-3]>=0.6,RC[-3]<0.7),80,IF(AND(RC[-3]>=0.6,RC[-3]<1),80,IF(AND(RC[-3]>1,RC[-3]<2),50,IF(RC[-3]>2,0))))))))) -> 95 | I208: =IF(RC[-1]="",RC[-2],0.7*RC[-1]+0.3*RC[-2]) -> 93.5
A209: دارویی ره آورد تامین | B209: درهآور | C209: =VLOOKUP(RC[-1],Sheet1!R3C2:R802C3,2,FALSE) -> دارویی | D209: =VLOOKUP(RC[-2],Sheet1!R3C2:R802C9,8,FALSE) -> 8.0734215120334714 | E209: =IF(VLOOKUP(RC[-3],Sheet1!R3C2:R803C11,10,FALSE)=0,"",VLOOKUP(Sheet2!RC[-3],Sheet1!R[1]C[-3]:R[801]C[6],10,FALSE)) ->  | F209: =Sheet1!R246C10 -> 7.5295416184238002 | G209: =IF(RC[-3]<0,0,IF(AND(RC[-3]<RC[-1],RC[-3]<2),100,IF(AND(RC[-3]<RC[-1],RC[-3]>=2,RC[-3]<3),95,IF(AND(RC[-3]<RC[-1],RC[-3]>=3,RC[-3]<4),90,IF(AND(RC[-3]<RC[-1],RC[-3]>=4,RC[-3]<5),85,IF(AND(RC[-3]<RC[-1],RC[-3]>=5,RC[-3]<6),80,IF(AND(RC[-3]<RC[-1],RC[-3]>=6,RC[-3]<7),75,IF(AND(RC[-3]<RC[-1],RC[-3]>=7,RC[-3]<8),70,IF(AND(RC[-3]<RC[-1],RC[-3]>=8,RC[-3]<9),65,IF(AND(RC[-3]<RC[-1],RC[-3]>=9,RC[-3]<10),60,IF(AND(RC[-3]<RC[-1],RC[-3]>=10,RC[-3]<11),55,IF(AND(RC[-3]<RC[-1],RC[-3]>=11,RC[-3]<12),50,IF(AND(RC[-3]<RC[-1],RC[-3]>=12,RC[-3]<13),45,IF(AND(RC[-3]<RC[-1],RC[-3]>=13,RC[-3]<14),40,IF(AND(RC[-3]<RC[-1],RC[-3]>=14,RC[-3]<15),35,IF(AND(RC[-3]<RC[-1],RC[-3]>=15,RC[-3]<16),30,IF(AND(RC[-3]<RC[-1],RC[-3]>=16,RC[-3]<17),25,IF(AND(RC[-3]<RC[-1],RC[-3]>=17,RC[-3]<18),20,IF(AND(RC[-3]<RC[-1],RC[-3]>=18,RC[-3]<19),15,IF(AND(RC[-3]<RC[-1],RC[-3]>=19,RC[-3]<20),10,IF(AND(RC[-3]<RC[-1],RC[-3]>=20,RC[-3]<21),5,IF(AND(RC[-3]<RC[-1],RC[-3]>=21),0,IF(AND(RC[-3]>RC[-1],RC[-3]>=2,RC[-3]<3),90,IF(AND(RC[-3]>RC[-1],RC[-3]>=3,RC[-3]<4),90,IF(AND(RC[-3]>RC[-1],RC[-3]>=4,RC[-3]<5),80,IF(AND(RC[-3]>RC[-1],RC[-3]>=5,RC[-3]<6),70,IF(AND(RC[-3]>RC[-1],RC[-3]>=6,RC[-3]<7),60,IF(AND(RC[-3]>RC[-1],RC[-3]>=7,RC[-3]<8),50,IF(AND(RC[-3]>RC[-1],RC[-3]>=8,RC[-3]<9),40,IF(AND(RC[-3]>RC[-1],RC[-3]>=9,RC[-3]<10),30,IF(AND(RC[-3]>RC[-1],RC[-3]>=10,RC[-3]<11),20,IF(AND(RC[-3]>RC[-1],RC[-3]>=11,RC[-3]<12),10,IF(AND(RC[-3]>RC[-1],RC[-3]>=12),0))))))))))))))))))))))))))))))))) -> 40 | H209: =IF(RC[-3]="","",IF(RC[-3]<0.3,100,IF(AND(RC[-3]>=0.3,RC[-3]>0.4),95,IF(AND(RC[-3]>=0.4,RC[-3]<0.5),90,IF(AND(RC[-3]>=0.5,RC[-3]<0.6),85,IF(AND(RC[-3]>=0.6,RC[-3]<0.7),80,IF(AND(RC[-3]>=0.6,RC[-3]<1),80,IF(AND(RC[-3]>1,RC[-3]<2),50,IF(RC[-3]>2,0))))))))) ->  | I209: =IF(RC[-1]="",RC[-2],0.7*RC[-1]+0.3*RC[-2]) -> 40
A210: روز دارو | B210: دروز | C210: =VLOOKUP(RC[-1],Sheet1!R3C2:R802C3,2,FALSE) -> دارویی | D210: =VLOOKUP(RC[-2],Sheet1!R3C2:R802C9,8,FALSE) -> 31.673732058399114 | E210: =IF(VLOOKUP(RC[-3],Sheet1!R3C2:R803C11,10,FALSE)=0,"",VLOOKUP(Sheet2!RC[-3],Sheet1!R[1]C[-3]:R[801]C[6],10,FALSE)) ->  | F210: =Sheet1!R246C10 -> 7.5295416184238002 | G210: =IF(RC[-3]<0,0,IF(AND(RC[-3]<RC[-1],RC[-3]<2),100,IF(AND(RC[-3]<RC[-1],RC[-3]>=2,RC[-3]<3),95,IF(AND(RC[-3]<RC[-1],RC[-3]>=3,RC[-3]<4),90,IF(AND(RC[-3]<RC[-1],RC[-3]>=4,RC[-3]<5),85,IF(AND(RC[-3]<RC[-1],RC[-3]>=5,RC[-3]<6),80,IF(AND(RC[-3]<RC[-1],RC[-3]>=6,RC[-3]<7),75,IF(AND(RC[-3]<RC[-1],RC[-3]>=7,RC[-3]<8),70,IF(AND(RC[-3]<RC[-1],RC[-3]>=8,RC[-3]<9),65,IF(AND(RC[-3]<RC[-1],RC[-3]>=9,RC[-3]<10),60,IF(AND(RC[-3]<RC[-1],RC[-3]>=10,RC[-3]<11),55,IF(AND(RC[-3]<RC[-1],RC[-3]>=11,RC[-3]<12),50,IF(AND(RC[-3]<RC[-1],RC[-3]>=12,RC[-3]<13),45,IF(AND(RC[-3]<RC[-1],RC[-3]>=13,RC[-3]<14),40,IF(AND(RC[-3]<RC[-1],RC[-3]>=14,RC[-3]<15),35,IF(AND(RC[-3]<RC[-1],RC[-3]>=15,RC[-3]<16),30,IF(AND(RC[-3]<RC[-1],RC[-3]>=16,RC[-3]<17),25,IF(AND(RC[-3]<RC[-1],RC[-3]>=17,RC[-3]<18),20,IF(AND(RC[-3]<RC[-1],RC[-3]>=18,RC[-3]<19),15,IF(AND(RC[-3]<RC[-1],RC[-3]>=19,RC[-3]<20),10,IF(AND(RC[-3]<RC[-1],RC[-3]>=20,RC[-3]<21),5,IF(AND(RC[-3]<RC[-1],RC[-3]>=21),0,IF(AND(RC[-3]>RC[-1],RC[-3]>=2,RC[-3]<3),90,IF(AND(RC[-3]>RC[-1],RC[-3]>=3,RC[-3]<4),90,IF(AND(RC[-3]>RC[-1],RC[-3]>=4,RC[-3]<5),80,IF(AND(RC[-3]>RC[-1],RC[-3]>=5,RC[-3]<6),70,IF(AND(RC[-3]>RC[-1],RC[-3]>=6,RC[-3]<7),60,IF(AND(RC[-3]>RC[-1],RC[-3]>=7,RC[-3]<8),50,IF(AND(RC[-3]>RC[-1],RC[-3]>=8,RC[-3]<9),40,IF(AND(RC[-3]>RC[-1],RC[-3]>=9,RC[-3]<10),30,IF(AND(RC[-3]>RC[-1],RC[-3]>=10,RC[-3]<11),20,IF(AND(RC[-3]>RC[-1],RC[-3]>=11,RC[-3]<12),10,IF(AND(RC[-3]>RC[-1],RC[-3]>=12),0))))))))))))))))))))))))))))))))) -> 0 | H210: =IF(RC[-3]="","",IF(RC[-3]<0.3,100,IF(AND(RC[-3]>=0.3,RC[-3]>0.4),95,IF(AND(RC[-3]>=0.4,RC[-3]<0.5),90,IF(AND(RC[-3]>=0.5,RC[-3]<0.6),85,IF(AND(RC[-3]>=0.6,RC[-3]<0.7),80,IF(AND(RC[-3]>=0.6,RC[-3]<1),80,IF(AND(RC[-3]>1,RC[-3]<2),50,IF(RC[-3]>2,0))))))))) ->  | I210: =IF(RC[-1]="",RC[-2],0.7*RC[-1]+0.3*RC[-2]) -> 0
A211: زاگرس فارمد پارس | B211: ددام | C211: =VLOOKUP(RC[-1],Sheet1!R3C2:R802C3,2,FALSE) -> دارویی | D211: =VLOOKUP(RC[-2],Sheet1!R3C2:R802C9,8,FALSE) -> 7.4877783216197571 | E211: =IF(VLOOKUP(RC[-3],Sheet1!R3C2:R803C11,10,FALSE)=0,"",VLOOKUP(Sheet2!RC[-3],Sheet1!R[1]C[-3]:R[801]C[6],10,FALSE)) ->  | F211: =Sheet1!R246C10 -> 7.5295416184238002 | G211: =IF(RC[-3]<0,0,IF(AND(RC[-3]<RC[-1],RC[-3]<2),100,IF(AND(RC[-3]<RC[-1],RC[-3]>=2,RC[-3]<3),95,IF(AND(RC[-3]<RC[-1],RC[-3]>=3,RC[-3]<4),90,IF(AND(RC[-3]<RC[-1],RC[-3]>=4,RC[-3]<5),85,IF(AND(RC[-3]<RC[-1],RC[-3]>=5,RC[-3]<6),80,IF(AND(RC[-3]<RC[-1],RC[-3]>=6,RC[-3]<7),75,IF(AND(RC[-3]<RC[-1],RC[-3]>=7,RC[-3]<8),70,IF(AND(RC[-3]<RC[-1],RC[-3]>=8,RC[-3]<9),65,IF(AND(RC[-3]<RC[-1],RC[-3]>=9,RC[-3]<10),60,IF(AND(RC[-3]<RC[-1],RC[-3]>=10,RC[-3]<11),55,IF(AND(RC[-3]<RC[-1],RC[-3]>=11,RC[-3]<12),50,IF(AND(RC[-3]<RC[-1],RC[-3]>=12,RC[-3]<13),45,IF(AND(RC[-3]<RC[-1],RC[-3]>=13,RC[-3]<14),40,IF(AND(RC[-3]<RC[-1],RC[-3]>=14,RC[-3]<15),35,IF(AND(RC[-3]<RC[-1],RC[-3]>=15,RC[-3]<16),30,IF(AND(RC[-3]<RC[-1],RC[-3]>=16,RC[-3]<17),25,IF(AND(RC[-3]<RC[-1],RC[-3]>=17,RC[-3]<18),20,IF(AND(RC[-3]<RC[-1],RC[-3]>=18,RC[-3]<19),15,IF(AND(RC[-3]<RC[-1],RC[-3]>=19,RC[-3]<20),10,IF(AND(RC[-3]<RC[-1],RC[-3]>=20,RC[-3]<21),5,IF(AND(RC[-3]<RC[-1],RC[-3]>=21),0,IF(AND(RC[-3]>RC[-1],RC[-3]>=2,RC[-3]<3),90,IF(AND(RC[-3]>RC[-1],RC[-3]>=3,RC[-3]<4),90,IF(AND(RC[-3]>RC[-1],RC[-3]>=4,RC[-3]<5),80,IF(AND(RC[-3]>RC[-1],RC[-3]>=5,RC[-3]<6),70,IF(AND(RC[-3]>RC[-1],RC[-3]>=6,RC[-3]<7),60,IF(AND(RC[-3]>RC[-1],RC[-3]>=7,RC[-3]<8),50,IF(AND(RC[-3]>RC[-1],RC[-3]>=8,RC[-3]<9),40,IF(AND(RC[-3]>RC[-1],RC[-3]>=9,RC[-3]<10),30,IF(AND(RC[-3]>RC[-1],RC[-3]>=10,RC[-3]<11),20,IF(AND(RC[-3]>RC[-1],RC[-3]>=11,RC[-3]<12),10,IF(AND(RC[-3]>RC[-1],RC[-3]>=12),0))))))))))))))))))))))))))))))))) -> 70 | H211: =IF(RC[-3]="","",IF(RC[-3]<0.3,100,IF(AND(RC[-3]>=0.3,RC[-3]>0.4),95,IF(AND(RC[-3]>=0.4,RC[-3]<0.5),90,IF(AND(RC[-3]>=0.5,RC[-3]<0.6),85,IF(AND(RC[-3]>=0.6,RC[-3]<0.7),80,IF(AND(RC[-3]>=0.6,RC[-3]<1),80,IF(AND(RC[-3]>1,RC[-3]<2),50,IF(RC[-3]>2,0))))))))) ->  | I211: =IF(RC[-1]="",RC[-2],0.7*RC[-1]+0.3*RC[-2]) -> 70
A212: سبحان آنکولوژی | B212: دسانکو | C212: =VLOOKUP(RC[-1],Sheet1!R3C2:R802C3,2,FALSE) -> دارویی | D212: =VLOOKUP(RC[-2],Sheet1!R3C2:R802C9,8,FALSE) -> 17.975604304761735 | E212: =IF(VLOOKUP(RC[-3],Sheet1!R3C2:R803C11,10,FALSE)=0,"",VLOOKUP(Sheet2!RC[-3],Sheet1!R[1]C[-3]:R[801]C[6],10,FALSE)) ->  | F212: =Sheet1!R246C10 -> 7.5295416184238002 | G212: =IF(RC[-3]<0,0,IF(AND(RC[-3]<RC[-1],RC[-3]<2),100,IF(AND(RC[-3]<RC[-1],RC[-3]>=2,RC[-3]<3),95,IF(AND(RC[-3]<RC[-1],RC[-3]>=3,RC[-3]<4),90,IF(AND(RC[-3]<RC[-1],RC[-3]>=4,RC[-3]<5),85,IF(AND(RC[-3]<RC[-1],RC[-3]>=5,RC[-3]<6),80,IF(AND(RC[-3]<RC[-1],RC[-3]>=6,RC[-3]<7),75,IF(AND(RC[-3]<RC[-1],RC[-3]>=7,RC[-3]<8),70,IF(AND(RC[-3]<RC[-1],RC[-3]>=8,RC[-3]<9),65,IF(AND(RC[-3]<RC[-1],RC[-3]>=9,RC[-3]<10),60,IF(AND(RC[-3]<RC[-1],RC[-3]>=10,RC[-3]<11),55,IF(AND(RC[-3]<RC[-1],RC[-3]>=11,RC[-3]<12),50,IF(AND(RC[-3]<RC[-1],RC[-3]>=12,RC[-3]<13),45,IF(AND(RC[-3]<RC[-1],RC[-3]>=13,RC[-3]<14),40,IF(AND(RC[-3]<RC[-1],RC[-3]>=14,RC[-3]<15),35,IF(AND(RC[-3]<RC[-1],RC[-3]>=15,RC[-3]<16),30,IF(AND(RC[-3]<RC[-1],RC[-3]>=16,RC[-3]<17),25,IF(AND(RC[-3]<RC[-1],RC[-3]>=17,RC[-3]<18),20,IF(AND(RC[-3]<RC[-1],RC[-3]>=18,RC[-3]<19),15,IF(AND(RC[-3]<RC[-1],RC[-3]>=19,RC[-3]<20),10,IF(AND(RC[-3]<RC[-1],RC[-3]>=20,RC[-3]<21),5,IF(AND(RC[-3]<RC[-1],RC[-3]>=21),0,IF(AND(RC[-3]>RC[-1],RC[-3]>=2,RC[-3]<3),90,IF(AND(RC[-3]>RC[-1],RC[-3]>=3,RC[-3]<4),90,IF(AND(RC[-3]>RC[-1],RC[-3]>=4,RC[-3]<5),80,IF(AND(RC[-3]>RC[-1],RC[-3]>=5,RC[-3]<6),70,IF(AND(RC[-3]>RC[-1],RC[-3]>=6,RC[-3]<7),60,IF(AND(RC[-3]>RC[-1],RC[-3]>=7,RC[-3]<8),50,IF(AND(RC[-3]>RC[-1],RC[-3]>=8,RC[-3]<9),40,IF(AND(RC[-3]>RC[-1],RC[-3]>=9,RC[-3]<10),30,IF(AND(RC[-3]>RC[-1],RC[-3]>=10,RC[-3]<11),20,IF(AND(RC[-3]>RC[-1],RC[-3]>=11,RC[-3]<12),10,IF(AND(RC[-3]>RC[-1],RC[-3]>=12),0))))))))))))))))))))))))))))))))) -> 0 | H212: =IF(RC[-3]="","",IF(RC[-3]<0.3,100,IF(AND(RC[-3]>=0.3,RC[-3]>0.4),95,IF(AND(RC[-3]>=0.4,RC[-3]<0.5),90,IF(AND(RC[-3]>=0.5,RC[-3]<0.6),85,IF(AND(RC[-3]>=0.6,RC[-3]<0.7),80,IF(AND(RC[-3]>=0.6,RC[-3]<1),80,IF(AND(RC[-3]>1,RC[-3]<2),50,IF(RC[-3]>2,0))))))))) ->  | I212: =IF(RC[-1]="",RC[-2],0.7*RC[-1]+0.3*RC[-2]) -> 0
A213: سبحان دارو | B213: دسبحان | C213: =VLOOKUP(RC[-1],Sheet1!R3C2:R802C3,2,FALSE) -> دارویی | D213: =VLOOKUP(RC[-2],Sheet1!R3C2:R802C9,8,FALSE) -> 6.3791799252638262 | E213: =IF(VLOOKUP(RC[-3],Sheet1!R3C2:R803C11,10,FALSE)=0,"",VLOOKUP(Sheet2!RC[-3],Sheet1!R[1]C[-3]:R[801]C[6],10,FALSE)) ->  | F213: =Sheet1!R246C10 -> 7.5295416184238002 | G213: =IF(RC[-3]<0,0,IF(AND(RC[-3]<RC[-1],RC[-3]<2),100,IF(AND(RC[-3]<RC[-1],RC[-3]>=2,RC[-3]<3),95,IF(AND(RC[-3]<RC[-1],RC[-3]>=3,RC[-3]<4),90,IF(AND(RC[-3]<RC[-1],RC[-3]>=4,RC[-3]<5),85,IF(AND(RC[-3]<RC[-1],RC[-3]>=5,RC[-3]<6),80,IF(AND(RC[-3]<RC[-1],RC[-3]>=6,RC[-3]<7),75,IF(AND(RC[-3]<RC[-1],RC[-3]>=7,RC[-3]<8),70,IF(AND(RC[-3]<RC[-1],RC[-3]>=8,RC[-3]<9),65,IF(AND(RC[-3]<RC[-1],RC[-3]>=9,RC[-3]<10),60,IF(AND(RC[-3]<RC[-1],RC[-3]>=10,RC[-3]<11),55,IF(AND(RC[-3]<RC[-1],RC[-3]>=11,RC[-3]<12),50,IF(AND(RC[-3]<RC[-1],RC[-3]>=12,RC[-3]<13),45,IF(AND(RC[-3]<RC[-1],RC[-3]>=13,RC[-3]<14),40,IF(AND(RC[-3]<RC[-1],RC[-3]>=14,RC[-3]<15),35,IF(AND(RC[-3]<RC[-1],RC[-3]>=15,RC[-3]<16),30,IF(AND(RC[-3]<RC[-1],RC[-3]>=16,RC[-3]<17),25,IF(AND(RC[-3]<RC[-1],RC[-3]>=17,RC[-3]<18),20,IF(AND(RC[-3]<RC[-1],RC[-3]>=18,RC[-3]<19),15,IF(AND(RC[-3]<RC[-1],RC[-3]>=19,RC[-3]<20),10,IF(AND(RC[-3]<RC[-1],RC[-3]>=20,RC[-3]<21),5,IF(AND(RC[-3]<RC[-1],RC[-3]>=21),0,IF(AND(RC[-3]>RC[-1],RC[-3]>=2,RC[-3]<3),90,IF(AND(RC[-3]>RC[-1],RC[-3]>=3,RC[-3]<4),90,IF(AND(RC[-3]>RC[-1],RC[-3]>=4,RC[-3]<5),80,IF(AND(RC[-3]>RC[-1],RC[-3]>=5,RC[-3]<6),70,IF(AND(RC[-3]>RC[-1],RC[-3]>=6,RC[-3]<7),60,IF(AND(RC[-3]>RC[-1],RC[-3]>=7,RC[-3]<8),50,IF(AND(RC[-3]>RC[-1],RC[-3]>=8,RC[-3]<9),40,IF(AND(RC[-3]>RC[-1],RC[-3]>=9,RC[-3]<10),30,IF(AND(RC[-3]>RC[-1],RC[-3]>=10,RC[-3]<11),20,IF(AND(RC[-3]>RC[-1],RC[-3]>=11,RC[-3]<12),10,IF(AND(RC[-3]>RC[-1],RC[-3]>=12),0))))))))))))))))))))))))))))))))) -> 75 | H213: =IF(RC[-3]="","",IF(RC[-3]<0.3,100,IF(AND(RC[-3]>=0.3,RC[-3]>0.4),95,IF(AND(RC[-3]>=0.4,RC[-3]<0.5),90,IF(AND(RC[-3]>=0.5,RC[-3]<0.6),85,IF(AND(RC[-3]>=0.6,RC[-3]<0.7),80,IF(AND(RC[-3]>=0.6,RC[-3]<1),80,IF(AND(RC[-3]>1,RC[-3]<2),50,IF(RC[-3]>2,0))))))))) ->  | I213: =IF(RC[-1]="",RC[-2],0.7*RC[-1]+0.3*RC[-2]) -> 75
A214: سر. البرز | B214: والبر | C214: =VLOOKUP(RC[-1],Sheet1!R3C2:R802C3,2,FALSE) -> دارویی | D214: =VLOOKUP(RC[-2],Sheet1!R3C2:R802C9,8,FALSE) -> 5.080713206584778 | E214: =IF(VLOOKUP(RC[-3],Sheet1!R3C2:R803C11,10,FALSE)=0,"",VLOOKUP(Sheet2!RC[-3],Sheet1!R[1]C[-3]:R[801]C[6],10,FALSE)) -> 0.65 | F214: =Sheet1!R246C10 -> 7.5295416184238002 | G214: =IF(RC[-3]<0,0,IF(AND(RC[-3]<RC[-1],RC[-3]<2),100,IF(AND(RC[-3]<RC[-1],RC[-3]>=2,RC[-3]<3),95,IF(AND(RC[-3]<RC[-1],RC[-3]>=3,RC[-3]<4),90,IF(AND(RC[-3]<RC[-1],RC[-3]>=4,RC[-3]<5),85,IF(AND(RC[-3]<RC[-1],RC[-3]>=5,RC[-3]<6),80,IF(AND(RC[-3]<RC[-1],RC[-3]>=6,RC[-3]<7),75,IF(AND(RC[-3]<RC[-1],RC[-3]>=7,RC[-3]<8),70,IF(AND(RC[-3]<RC[-1],RC[-3]>=8,RC[-3]<9),65,IF(AND(RC[-3]<RC[-1],RC[-3]>=9,RC[-3]<10),60,IF(AND(RC[-3]<RC[-1],RC[-3]>=10,RC[-3]<11),55,IF(AND(RC[-3]<RC[-1],RC[-3]>=11,RC[-3]<12),50,IF(AND(RC[-3]<RC[-1],RC[-3]>=12,RC[-3]<13),45,IF(AND(RC[-3]<RC[-1],RC[-3]>=13,RC[-3]<14),40,IF(AND(RC[-3]<RC[-1],RC[-3]>=14,RC[-3]<15),35,IF(AND(RC[-3]<RC[-1],RC[-3]>=15,RC[-3]<16),30,IF(AND(RC[-3]<RC[-1],RC[-3]>=16,RC[-3]<17),25,IF(AND(RC[-3]<RC[-1],RC[-3]>=17,RC[-3]<18),20,IF(AND(RC[-3]<RC[-1],RC[-3]>=18,RC[-3]<19),15,IF(AND(RC[-3]<RC[-1],RC[-3]>=19,RC[-3]<20),10,IF(AND(RC[-3]<RC[-1],RC[-3]>=20,RC[-3]<21),5,IF(AND(RC[-3]<RC[-1],RC[-3]>=21),0,IF(AND(RC[-3]>RC[-1],RC[-3]>=2,RC[-3]<3),90,IF(AND(RC[-3]>RC[-1],RC[-3]>=3,RC[-3]<4),90,IF(AND(RC[-3]>RC[-1],RC[-3]>=4,RC[-3]<5),80,IF(AND(RC[-3]>RC[-1],RC[-3]>=5,RC[-3]<6),70,IF(AND(RC[-3]>RC[-1],RC[-3]>=6,RC[-3]<7),60,IF(AND(RC[-3]>RC[-1],RC[-3]>=7,RC[-3]<8),50,IF(AND(RC[-3]>RC[-1],RC[-3]>=8,RC[-3]<9),40,IF(AND(RC[-3]>RC[-1],RC[-3]>=9,RC[-3]<10),30,IF(AND(RC[-3]>RC[-1],RC[-3]>=10,RC[-3]<11),20,IF(AND(RC[-3]>RC[-1],RC[-3]>=11,RC[-3]<12),10,IF(AND(RC[-3]>RC[-1],RC[-3]>=12),0))))))))))))))))))))))))))))))))) -> 80 | H214: =IF(RC[-3]="","",IF(RC[-3]<0.3,100,IF(AND(RC[-3]>=0.3,RC[-3]>0.4),95,IF(AND(RC[-3]>=0.4,RC[-3]<0.5),90,IF(AND(RC[-3]>=0.5,RC[-3]<0.6),85,IF(AND(RC[-3]>=0.6,RC[-3]<0.7),80,IF(AND(RC[-3]>=0.6,RC[-3]<1),80,IF(AND(RC[-3]>1,RC[-3]<2),50,IF(RC[-3]>2,0))))))))) -> 95 | I214: =IF(RC[-1]="",RC[-2],0.7*RC[-1]+0.3*RC[-2]) -> 90.5
A215: سر. دارویی تامین | B215: تیپیکو | C215: =VLOOKUP(RC[-1],Sheet1!R3C2:R802C3,2,FALSE) -> دارویی | D215: =VLOOKUP(RC[-2],Sheet1!R3C2:R802C9,8,FALSE) -> 4.972051663251289 | E215: =IF(VLOOKUP(RC[-3],Sheet1!R3C2:R803C11,10,FALSE)=0,"",VLOOKUP(Sheet2!RC[-3],Sheet1!R[1]C[-3]:R[801]C[6],10,FALSE)) -> 0.95 | F215: =Sheet1!R246C10 -> 7.5295416184238002 | G215: =IF(RC[-3]<0,0,IF(AND(RC[-3]<RC[-1],RC[-3]<2),100,IF(AND(RC[-3]<RC[-1],RC[-3]>=2,RC[-3]<3),95,IF(AND(RC[-3]<RC[-1],RC[-3]>=3,RC[-3]<4),90,IF(AND(RC[-3]<RC[-1],RC[-3]>=4,RC[-3]<5),85,IF(AND(RC[-3]<RC[-1],RC[-3]>=5,RC[-3]<6),80,IF(AND(RC[-3]<RC[-1],RC[-3]>=6,RC[-3]<7),75,IF(AND(RC[-3]<RC[-1],RC[-3]>=7,RC[-3]<8),70,IF(AND(RC[-3]<RC[-1],RC[-3]>=8,RC[-3]<9),65,IF(AND(RC[-3]<RC[-1],RC[-3]>=9,RC[-3]<10),60,IF(AND(RC[-3]<RC[-1],RC[-3]>=10,RC[-3]<11),55,IF(AND(RC[-3]<RC[-1],RC[-3]>=11,RC[-3]<12),50,IF(AND(RC[-3]<RC[-1],RC[-3]>=12,RC[-3]<13),45,IF(AND(RC[-3]<RC[-1],RC[-3]>=13,RC[-3]<14),40,IF(AND(RC[-3]<RC[-1],RC[-3]>=14,RC[-3]<15),35,IF(AND(RC[-3]<RC[-1],RC[-3]>=15,RC[-3]<16),30,IF(AND(RC[-3]<RC[-1],RC[-3]>=16,RC[-3]<17),25,IF(AND(RC[-3]<RC[-1],RC[-3]>=17,RC[-3]<18),20,IF(AND(RC[-3]<RC[-1],RC[-3]>=18,RC[-3]<19),15,IF(AND(RC[-3]<RC[-1],RC[-3]>=19,RC[-3]<20),10,IF(AND(RC[-3]<RC[-1],RC[-3]>=20,RC[-3]<21),5,IF(AND(RC[-3]<RC[-1],RC[-3]>=21),0,IF(AND(RC[-3]>RC[-1],RC[-3]>=2,RC[-3]<3),90,IF(AND(RC[-3]>RC[-1],RC[-3]>=3,RC[-3]<4),90,IF(AND(RC[-3]>RC[-1],RC[-3]>=4,RC[-3]<5),80,IF(AND(RC[-3]>RC[-1],RC[-3]>=5,RC[-3]<6),70,IF(AND(RC[-3]>RC[-1],RC[-3]>=6,RC[-3]<7),60,IF(AND(RC[-3]>RC[-1],RC[-3]>=7,RC[-3]<8),50,IF(AND(RC[-3]>RC[-1],RC[-3]>=8,RC[-3]<9),40,IF(AND(RC[-3]>RC[-1],RC[-3]>=9,RC[-3]<10),30,IF(AND(RC[-3]>RC[-1],RC[-3]>=10,RC[-3]<11),20,IF(AND(RC[-3]>RC[-1],RC[-3]>=11,RC[-3]<12),10,IF(AND(RC[-3]>RC[-1],RC[-3]>=12),0))))))))))))))))))))))))))))))))) -> 85 | H215: =IF(RC[-3]="","",IF(RC[-3]<0.3,100,IF(AND(RC[-3]>=0.3,RC[-3]>0.4),95,IF(AND(RC[-3]>=0.4,RC[-3]<0.5),90,IF(AND(RC[-3]>=0.5,RC[-3]<0.6),85,IF(AND(RC[-3]>=0.6,RC[-3]<0.7),80,IF(AND(RC[-3]>=0.6,RC[-3]<1),80,IF(AND(RC[-3]>1,RC[-3]<2),50,IF(RC[-3]>2,0))))))))) -> 95 | I215: =IF(RC[-1]="",RC[-2],0.7*RC[-1]+0.3*RC[-2]) -> 92
A216: سر. شفا دارو | B216: شفا | C216: =VLOOKUP(RC[-1],Sheet1!R3C2:R802C3,2,FALSE) -> دارویی | D216: =VLOOKUP(RC[-2],Sheet1!R3C2:R802C9,8,FALSE) -> 5.6039525844559526 | E216: =IF(VLOOKUP(RC[-3],Sheet1!R3C2:R803C11,10,FALSE)=0,"",VLOOKUP(Sheet2!RC[-3],Sheet1!R[1]C[-3]:R[801]C[6],10,FALSE)) -> 0.55000000000000004 | F216: =Sheet1!R246C10 -> 7.5295416184238002 | G216: =IF(RC[-3]<0,0,IF(AND(RC[-3]<RC[-1],RC[-3]<2),100,IF(AND(RC[-3]<RC[-1],RC[-3]>=2,RC[-3]<3),95,IF(AND(RC[-3]<RC[-1],RC[-3]>=3,RC[-3]<4),90,IF(AND(RC[-3]<RC[-1],RC[-3]>=4,RC[-3]<5),85,IF(AND(RC[-3]<RC[-1],RC[-3]>=5,RC[-3]<6),80,IF(AND(RC[-3]<RC[-1],RC[-3]>=6,RC[-3]<7),75,IF(AND(RC[-3]<RC[-1],RC[-3]>=7,RC[-3]<8),70,IF(AND(RC[-3]<RC[-1],RC[-3]>=8,RC[-3]<9),65,IF(AND(RC[-3]<RC[-1],RC[-3]>=9,RC[-3]<10),60,IF(AND(RC[-3]<RC[-1],RC[-3]>=10,RC[-3]<11),55,IF(AND(RC[-3]<RC[-1],RC[-3]>=11,RC[-3]<12),50,IF(AND(RC[-3]<RC[-1],RC[-3]>=12,RC[-3]<13),45,IF(AND(RC[-3]<RC[-1],RC[-3]>=13,RC[-3]<14),40,IF(AND(RC[-3]<RC[-1],RC[-3]>=14,RC[-3]<15),35,IF(AND(RC[-3]<RC[-1],RC[-3]>=15,RC[-3]<16),30,IF(AND(RC[-3]<RC[-1],RC[-3]>=16,RC[-3]<17),25,IF(AND(RC[-3]<RC[-1],RC[-3]>=17,RC[-3]<18),20,IF(AND(RC[-3]<RC[-1],RC[-3]>=18,RC[-3]<19),15,IF(AND(RC[-3]<RC[-1],RC[-3]>=19,RC[-3]<20),10,IF(AND(RC[-3]<RC[-1],RC[-3]>=20,RC[-3]<21),5,IF(AND(RC[-3]<RC[-1],RC[-3]>=21),0,IF(AND(RC[-3]>RC[-1],RC[-3]>=2,RC[-3]<3),90,IF(AND(RC[-3]>RC[-1],RC[-3]>=3,RC[-3]<4),90,IF(AND(RC[-3]>RC[-1],RC[-3]>=4,RC[-3]<5),80,IF(AND(RC[-3]>RC[-1],RC[-3]>=5,RC[-3]<6),70,IF(AND(RC[-3]>RC[-1],RC[-3]>=6,RC[-3]<7),60,IF(AND(RC[-3]>RC[-1],RC[-3]>=7,RC[-3]<8),50,IF(AND(RC[-3]>RC[-1],RC[-3]>=8,RC[-3]<9),40,IF(AND(RC[-3]>RC[-1],RC[-3]>=9,RC[-3]<10),30,IF(AND(RC[-3]>RC[-1],RC[-3]>=10,RC[-3]<11),20,IF(AND(RC[-3]>RC[-1],RC[-3]>=11,RC[-3]<12),10,IF(AND(RC[-3]>RC[-1],RC[-3]>=12),0))))))))))))))))))))))))))))))))) -> 80 | H216: =IF(RC[-3]="","",IF(RC[-3]<0.3,100,IF(AND(RC[-3]>=0.3,RC[-3]>0.4),95,IF(AND(RC[-3]>=0.4,RC[-3]<0.5),90,IF(AND(RC[-3]>=0.5,RC[-3]<0.6),85,IF(AND(RC[-3]>=0.6,RC[-3]<0.7),80,IF(AND(RC[-3]>=0.6,RC[-3]<1),80,IF(AND(RC[-3]>1,RC[-3]<2),50,IF(RC[-3]>2,0))))))))) -> 95 | I216: =IF(RC[-1]="",RC[-2],0.7*RC[-1]+0.3*RC[-2]) -> 90.5
A217: سینادارو | B217: دسینا | C217: =VLOOKUP(RC[-1],Sheet1!R3C2:R802C3,2,FALSE) -> دارویی | D217: =VLOOKUP(RC[-2],Sheet1!R3C2:R802C9,8,FALSE) -> 4.3861203474642458 | E217: =IF(VLOOKUP(RC[-3],Sheet1!R3C2:R803C11,10,FALSE)=0,"",VLOOKUP(Sheet2!RC[-3],Sheet1!R[1]C[-3]:R[801]C[6],10,FALSE)) ->  | F217: =Sheet1!R246C10 -> 7.5295416184238002 | G217: =IF(RC[-3]<0,0,IF(AND(RC[-3]<RC[-1],RC[-3]<2),100,IF(AND(RC[-3]<RC[-1],RC[-3]>=2,RC[-3]<3),95,IF(AND(RC[-3]<RC[-1],RC[-3]>=3,RC[-3]<4),90,IF(AND(RC[-3]<RC[-1],RC[-3]>=4,RC[-3]<5),85,IF(AND(RC[-3]<RC[-1],RC[-3]>=5,RC[-3]<6),80,IF(AND(RC[-3]<RC[-1],RC[-3]>=6,RC[-3]<7),75,IF(AND(RC[-3]<RC[-1],RC[-3]>=7,RC[-3]<8),70,IF(AND(RC[-3]<RC[-1],RC[-3]>=8,RC[-3]<9),65,IF(AND(RC[-3]<RC[-1],RC[-3]>=9,RC[-3]<10),60,IF(AND(RC[-3]<RC[-1],RC[-3]>=10,RC[-3]<11),55,IF(AND(RC[-3]<RC[-1],RC[-3]>=11,RC[-3]<12),50,IF(AND(RC[-3]<RC[-1],RC[-3]>=12,RC[-3]<13),45,IF(AND(RC[-3]<RC[-1],RC[-3]>=13,RC[-3]<14),40,IF(AND(RC[-3]<RC[-1],RC[-3]>=14,RC[-3]<15),35,IF(AND(RC[-3]<RC[-1],RC[-3]>=15,RC[-3]<16),30,IF(AND(RC[-3]<RC[-1],RC[-3]>=16,RC[-3]<17),25,IF(AND(RC[-3]<RC[-1],RC[-3]>=17,RC[-3]<18),20,IF(AND(RC[-3]<RC[-1],RC[-3]>=18,RC[-3]<19),15,IF(AND(RC[-3]<RC[-1],RC[-3]>=19,RC[-3]<20),10,IF(AND(RC[-3]<RC[-1],RC[-3]>=20,RC[-3]<21),5,IF(AND(RC[-3]<RC[-1],RC[-3]>=21),0,IF(AND(RC[-3]>RC[-1],RC[-3]>=2,RC[-3]<3),90,IF(AND(RC[-3]>RC[-1],RC[-3]>=3,RC[-3]<4),90,IF(AND(RC[-3]>RC[-1],RC[-3]>=4,RC[-3]<5),80,IF(AND(RC[-3]>RC[-1],RC[-3]>=5,RC[-3]<6),70,IF(AND(RC[-3]>RC[-1],RC[-3]>=6,RC[-3]<7),60,IF(AND(RC[-3]>RC[-1],RC[-3]>=7,RC[-3]<8),50,IF(AND(RC[-3]>RC[-1],RC[-3]>=8,RC[-3]<9),40,IF(AND(RC[-3]>RC[-1],RC[-3]>=9,RC[-3]<10),30,IF(AND(RC[-3]>RC[-1],RC[-3]>=10,RC[-3]<11),20,IF(AND(RC[-3]>RC[-1],RC[-3]>=11,RC[-3]<12),10,IF(AND(RC[-3]>RC[-1],RC[-3]>=12),0))))))))))))))))))))))))))))))))) -> 85 | H217: =IF(RC[-3]="","",IF(RC[-3]<0.3,100,IF(AND(RC[-3]>=0.3,RC[-3]>0.4),95,IF(AND(RC[-3]>=0.4,RC[-3]<0.5),90,IF(AND(RC[-3]>=0.5,RC[-3]<0.6),85,IF(AND(RC[-3]>=0.6,RC[-3]<0.7),80,IF(AND(RC[-3]>=0.6,RC[-3]<1),80,IF(AND(RC[-3]>1,RC[-3]<2),50,IF(RC[-3]>2,0))))))))) ->  | I217: =IF(RC[-1]="",RC[-2],0.7*RC[-1]+0.3*RC[-2]) -> 85
A218: شیرین دارو | B218: دشیری | C218: =VLOOKUP(RC[-1],Sheet1!R3C2:R802C3,2,FALSE) -> دارویی | D218: =VLOOKUP(RC[-2],Sheet1!R3C2:R802C9,8,FALSE) -> 13.201722627178986 | E218: =IF(VLOOKUP(RC[-3],Sheet1!R3C2:R803C11,10,FALSE)=0,"",VLOOKUP(Sheet2!RC[-3],Sheet1!R[1]C[-3]:R[801]C[6],10,FALSE)) ->  | F218: =Sheet1!R246C10 -> 7.5295416184238002 | G218: =IF(RC[-3]<0,0,IF(AND(RC[-3]<RC[-1],RC[-3]<2),100,IF(AND(RC[-3]<RC[-1],RC[-3]>=2,RC[-3]<3),95,IF(AND(RC[-3]<RC[-1],RC[-3]>=3,RC[-3]<4),90,IF(AND(RC[-3]<RC[-1],RC[-3]>=4,RC[-3]<5),85,IF(AND(RC[-3]<RC[-1],RC[-3]>=5,RC[-3]<6),80,IF(AND(RC[-3]<RC[-1],RC[-3]>=6,RC[-3]<7),75,IF(AND(RC[-3]<RC[-1],RC[-3]>=7,RC[-3]<8),70,IF(AND(RC[-3]<RC[-1],RC[-3]>=8,RC[-3]<9),65,IF(AND(RC[-3]<RC[-1],RC[-3]>=9,RC[-3]<10),60,IF(AND(RC[-3]<RC[-1],RC[-3]>=10,RC[-3]<11),55,IF(AND(RC[-3]<RC[-1],RC[-3]>=11,RC[-3]<12),50,IF(AND(RC[-3]<RC[-1],RC[-3]>=12,RC[-3]<13),45,IF(AND(RC[-3]<RC[-1],RC[-3]>=13,RC[-3]<14),40,IF(AND(RC[-3]<RC[-1],RC[-3]>=14,RC[-3]<15),35,IF(AND(RC[-3]<RC[-1],RC[-3]>=15,RC[-3]<16),30,IF(AND(RC[-3]<RC[-1],RC[-3]>=16,RC[-3]<17),25,IF(AND(RC[-3]<RC[-1],RC[-3]>=17,RC[-3]<18),20,IF(AND(RC[-3]<RC[-1],RC[-3]>=18,RC[-3]<19),15,IF(AND(RC[-3]<RC[-1],RC[-3]>=19,RC[-3]<20),10,IF(AND(RC[-3]<RC[-1],RC[-3]>=20,RC[-3]<21),5,IF(AND(RC[-3]<RC[-1],RC[-3]>=21),0,IF(AND(RC[-3]>RC[-1],RC[-3]>=2,RC[-3]<3),90,IF(AND(RC[-3]>RC[-1],RC[-3]>=3,RC[-3]<4),90,IF(AND(RC[-3]>RC[-1],RC[-3]>=4,RC[-3]<5),80,IF(AND(RC[-3]>RC[-1],RC[-3]>=5,RC[-3]<6),70,IF(AND(RC[-3]>RC[-1],RC[-3]>=6,RC[-3]<7),60,IF(AND(RC[-3]>RC[-1],RC[-3]>=7,RC[-3]<8),50,IF(AND(RC[-3]>RC[-1],RC[-3]>=8,RC[-3]<9),40,IF(AND(RC[-3]>RC[-1],RC[-3]>=9,RC[-3]<10),30,IF(AND(RC[-3]>RC[-1],RC[-3]>=10,RC[-3]<11),20,IF(AND(RC[-3]>RC[-1],RC[-3]>=11,RC[-3]<12),10,IF(AND(RC[-3]>RC[-1],RC[-3]>=12),0))))))))))))))))))))))))))))))))) -> 0 | H218: =IF(RC[-3]="","",IF(RC[-3]<0.3,100,IF(AND(RC[-3]>=0.3,RC[-3]>0.4),95,IF(AND(RC[-3]>=0.4,RC[-3]<0.5),90,IF(AND(RC[-3]>=0.5,RC[-3]<0.6),85,IF(AND(RC[-3]>=0.6,RC[-3]<0.7),80,IF(AND(RC[-3]>=0.6,RC[-3]<1),80,IF(AND(RC[-3]>1,RC[-3]<2),50,IF(RC[-3]>2,0))))))))) ->  | I218: =IF(RC[-1]="",RC[-2],0.7*RC[-1]+0.3*RC[-2]) -> 0
A219: شیمی داروپخش | B219: دشیمی | C219: =VLOOKUP(RC[-1],Sheet1!R3C2:R802C3,2,FALSE) -> دارویی | D219: =VLOOKUP(RC[-2],Sheet1!R3C2:R802C9,8,FALSE) -> 4.8570985867129464 | E219: =IF(VLOOKUP(RC[-3],Sheet1!R3C2:R803C11,10,FALSE)=0,"",VLOOKUP(Sheet2!RC[-3],Sheet1!R[1]C[-3]:R[801]C[6],10,FALSE)) ->  | F219: =Sheet1!R246C10 -> 7.5295416184238002 | G219: =IF(RC[-3]<0,0,IF(AND(RC[-3]<RC[-1],RC[-3]<2),100,IF(AND(RC[-3]<RC[-1],RC[-3]>=2,RC[-3]<3),95,IF(AND(RC[-3]<RC[-1],RC[-3]>=3,RC[-3]<4),90,IF(AND(RC[-3]<RC[-1],RC[-3]>=4,RC[-3]<5),85,IF(AND(RC[-3]<RC[-1],RC[-3]>=5,RC[-3]<6),80,IF(AND(RC[-3]<RC[-1],RC[-3]>=6,RC[-3]<7),75,IF(AND(RC[-3]<RC[-1],RC[-3]>=7,RC[-3]<8),70,IF(AND(RC[-3]<RC[-1],RC[-3]>=8,RC[-3]<9),65,IF(AND(RC[-3]<RC[-1],RC[-3]>=9,RC[-3]<10),60,IF(AND(RC[-3]<RC[-1],RC[-3]>=10,RC[-3]<11),55,IF(AND(RC[-3]<RC[-1],RC[-3]>=11,RC[-3]<12),50,IF(AND(RC[-3]<RC[-1],RC[-3]>=12,RC[-3]<13),45,IF(AND(RC[-3]<RC[-1],RC[-3]>=13,RC[-3]<14),40,IF(AND(RC[-3]<RC[-1],RC[-3]>=14,RC[-3]<15),35,IF(AND(RC[-3]<RC[-1],RC[-3]>=15,RC[-3]<16),30,IF(AND(RC[-3]<RC[-1],RC[-3]>=16,RC[-3]<17),25,IF(AND(RC[-3]<RC[-1],RC[-3]>=17,RC[-3]<18),20,IF(AND(RC[-3]<RC[-1],RC[-3]>=18,RC[-3]<19),15,IF(AND(RC[-3]<RC[-1],RC[-3]>=19,RC[-3]<20),10,IF(AND(RC[-3]<RC[-1],RC[-3]>=20,RC[-3]<21),5,IF(AND(RC[-3]<RC[-1],RC[-3]>=21),0,IF(AND(RC[-3]>RC[-1],RC[-3]>=2,RC[-3]<3),90,IF(AND(RC[-3]>RC[-1],RC[-3]>=3,RC[-3]<4),90,IF(AND(RC[-3]>RC[-1],RC[-3]>=4,RC[-3]<5),80,IF(AND(RC[-3]>RC[-1],RC[-3]>=5,RC[-3]<6),70,IF(AND(RC[-3]>RC[-1],RC[-3]>=6,RC[-3]<7),60,IF(AND(RC[-3]>RC[-1],RC[-3]>=7,RC[-3]<8),50,IF(AND(RC[-3]>RC[-1],RC[-3]>=8,RC[-3]<9),40,IF(AND(RC[-3]>RC[-1],RC[-3]>=9,RC[-3]<10),30,IF(AND(RC[-3]>RC[-1],RC[-3]>=10,RC[-3]<11),20,IF(AND(RC[-3]>RC[-1],RC[-3]>=11,RC[-3]<12),10,IF(AND(RC[-3]>RC[-1],RC[-3]>=12),0))))))))))))))))))))))))))))))))) -> 85 | H219: =IF(RC[-3]="","",IF(RC[-3]<0.3,100,IF(AND(RC[-3]>=0.3,RC[-3]>0.4),95,IF(AND(RC[-3]>=0.4,RC[-3]<0.5),90,IF(AND(RC[-3]>=0.5,RC[-3]<0.6),85,IF(AND(RC[-3]>=0.6,RC[-3]<0.7),80,IF(AND(RC[-3]>=0.6,RC[-3]<1),80,IF(AND(RC[-3]>1,RC[-3]<2),50,IF(RC[-3]>2,0))))))))) ->  | I219: =IF(RC[-1]="",RC[-2],0.7*RC[-1]+0.3*RC[-2]) -> 85
A220: فرآورده تزریقی | B220: دفرا | C220: =VLOOKUP(RC[-1],Sheet1!R3C2:R802C3,2,FALSE) -> دارویی | D220: =VLOOKUP(RC[-2],Sheet1!R3C2:R802C9,8,FALSE) -> 6.317340952669082 | E220: =IF(VLOOKUP(RC[-3],Sheet1!R3C2:R803C11,10,FALSE)=0,"",VLOOKUP(Sheet2!RC[-3],Sheet1!R[1]C[-3]:R[801]C[6],10,FALSE)) ->  | F220: =Sheet1!R246C10 -> 7.5295416184238002 | G220: =IF(RC[-3]<0,0,IF(AND(RC[-3]<RC[-1],RC[-3]<2),100,IF(AND(RC[-3]<RC[-1],RC[-3]>=2,RC[-3]<3),95,IF(AND(RC[-3]<RC[-1],RC[-3]>=3,RC[-3]<4),90,IF(AND(RC[-3]<RC[-1],RC[-3]>=4,RC[-3]<5),85,IF(AND(RC[-3]<RC[-1],RC[-3]>=5,RC[-3]<6),80,IF(AND(RC[-3]<RC[-1],RC[-3]>=6,RC[-3]<7),75,IF(AND(RC[-3]<RC[-1],RC[-3]>=7,RC[-3]<8),70,IF(AND(RC[-3]<RC[-1],RC[-3]>=8,RC[-3]<9),65,IF(AND(RC[-3]<RC[-1],RC[-3]>=9,RC[-3]<10),60,IF(AND(RC[-3]<RC[-1],RC[-3]>=10,RC[-3]<11),55,IF(AND(RC[-3]<RC[-1],RC[-3]>=11,RC[-3]<12),50,IF(AND(RC[-3]<RC[-1],RC[-3]>=12,RC[-3]<13),45,IF(AND(RC[-3]<RC[-1],RC[-3]>=13,RC[-3]<14),40,IF(AND(RC[-3]<RC[-1],RC[-3]>=14,RC[-3]<15),35,IF(AND(RC[-3]<RC[-1],RC[-3]>=15,RC[-3]<16),30,IF(AND(RC[-3]<RC[-1],RC[-3]>=16,RC[-3]<17),25,IF(AND(RC[-3]<RC[-1],RC[-3]>=17,RC[-3]<18),20,IF(AND(RC[-3]<RC[-1],RC[-3]>=18,RC[-3]<19),15,IF(AND(RC[-3]<RC[-1],RC[-3]>=19,RC[-3]<20),10,IF(AND(RC[-3]<RC[-1],RC[-3]>=20,RC[-3]<21),5,IF(AND(RC[-3]<RC[-1],RC[-3]>=21),0,IF(AND(RC[-3]>RC[-1],RC[-3]>=2,RC[-3]<3),90,IF(AND(RC[-3]>RC[-1],RC[-3]>=3,RC[-3]<4),90,IF(AND(RC[-3]>RC[-1],RC[-3]>=4,RC[-3]<5),80,IF(AND(RC[-3]>RC[-1],RC[-3]>=5,RC[-3]<6),70,IF(AND(RC[-3]>RC[-1],RC[-3]>=6,RC[-3]<7),60,IF(AND(RC[-3]>RC[-1],RC[-3]>=7,RC[-3]<8),50,IF(AND(RC[-3]>RC[-1],RC[-3]>=8,RC[-3]<9),40,IF(AND(RC[-3]>RC[-1],RC[-3]>=9,RC[-3]<10),30,IF(AND(RC[-3]>RC[-1],RC[-3]>=10,RC[-3]<11),20,IF(AND(RC[-3]>RC[-1],RC[-3]>=11,RC[-3]<12),10,IF(AND(RC[-3]>RC[-1],RC[-3]>=12),0))))))))))))))))))))))))))))))))) -> 75 | H220: =IF(RC[-3]="","",IF(RC[-3]<0.3,100,IF(AND(RC[-3]>=0.3,RC[-3]>0.4),95,IF(AND(RC[-3]>=0.4,RC[-3]<0.5),90,IF(AND(RC[-3]>=0.5,RC[-3]<0.6),85,IF(AND(RC[-3]>=0.6,RC[-3]<0.7),80,IF(AND(RC[-3]>=0.6,RC[-3]<1),80,IF(AND(RC[-3]>1,RC[-3]<2),50,IF(RC[-3]>2,0))))))))) ->  | I220: =IF(RC[-1]="",RC[-2],0.7*RC[-1]+0.3*RC[-2]) -> 75
A221: مواد داروپخش | B221: دتماد | C221: =VLOOKUP(RC[-1],Sheet1!R3C2:R802C3,2,FALSE) -> دارویی | D221: =VLOOKUP(RC[-2],Sheet1!R3C2:R802C9,8,FALSE) -> 3.9177177944224151 | E221: =IF(VLOOKUP(RC[-3],Sheet1!R3C2:R803C11,10,FALSE)=0,"",VLOOKUP(Sheet2!RC[-3],Sheet1!R[1]C[-3]:R[801]C[6],10,FALSE)) ->  | F221: =Sheet1!R246C10 -> 7.5295416184238002 | G221: =IF(RC[-3]<0,0,IF(AND(RC[-3]<RC[-1],RC[-3]<2),100,IF(AND(RC[-3]<RC[-1],RC[-3]>=2,RC[-3]<3),95,IF(AND(RC[-3]<RC[-1],RC[-3]>=3,RC[-3]<4),90,IF(AND(RC[-3]<RC[-1],RC[-3]>=4,RC[-3]<5),85,IF(AND(RC[-3]<RC[-1],RC[-3]>=5,RC[-3]<6),80,IF(AND(RC[-3]<RC[-1],RC[-3]>=6,RC[-3]<7),75,IF(AND(RC[-3]<RC[-1],RC[-3]>=7,RC[-3]<8),70,IF(AND(RC[-3]<RC[-1],RC[-3]>=8,RC[-3]<9),65,IF(AND(RC[-3]<RC[-1],RC[-3]>=9,RC[-3]<10),60,IF(AND(RC[-3]<RC[-1],RC[-3]>=10,RC[-3]<11),55,IF(AND(RC[-3]<RC[-1],RC[-3]>=11,RC[-3]<12),50,IF(AND(RC[-3]<RC[-1],RC[-3]>=12,RC[-3]<13),45,IF(AND(RC[-3]<RC[-1],RC[-3]>=13,RC[-3]<14),40,IF(AND(RC[-3]<RC[-1],RC[-3]>=14,RC[-3]<15),35,IF(AND(RC[-3]<RC[-1],RC[-3]>=15,RC[-3]<16),30,IF(AND(RC[-3]<RC[-1],RC[-3]>=16,RC[-3]<17),25,IF(AND(RC[-3]<RC[-1],RC[-3]>=17,RC[-3]<18),20,IF(AND(RC[-3]<RC[-1],RC[-3]>=18,RC[-3]<19),15,IF(AND(RC[-3]<RC[-1],RC[-3]>=19,RC[-3]<20),10,IF(AND(RC[-3]<RC[-1],RC[-3]>=20,RC[-3]<21),5,IF(AND(RC[-3]<RC[-1],RC[-3]>=21),0,IF(AND(RC[-3]>RC[-1],RC[-3]>=2,RC[-3]<3),90,IF(AND(RC[-3]>RC[-1],RC[-3]>=3,RC[-3]<4),90,IF(AND(RC[-3]>RC[-1],RC[-3]>=4,RC[-3]<5),80,IF(AND(RC[-3]>RC[-1],RC[-3]>=5,RC[-3]<6),70,IF(AND(RC[-3]>RC[-1],RC[-3]>=6,RC[-3]<7),60,IF(AND(RC[-3]>RC[-1],RC[-3]>=7,RC[-3]<8),50,IF(AND(RC[-3]>RC[-1],RC[-3]>=8,RC[-3]<9),40,IF(AND(RC[-3]>RC[-1],RC[-3]>=9,RC[-3]<10),30,IF(AND(RC[-3]>RC[-1],RC[-3]>=10,RC[-3]<11),20,IF(AND(RC[-3]>RC[-1],RC[-3]>=11,RC[-3]<12),10,IF(AND(RC[-3]>RC[-1],RC[-3]>=12),0))))))))))))))))))))))))))))))))) -> 90 | H221: =IF(RC[-3]="","",IF(RC[-3]<0.3,100,IF(AND(RC[-3]>=0.3,RC[-3]>0.4),95,IF(AND(RC[-3]>=0.4,RC[-3]<0.5),90,IF(AND(RC[-3]>=0.5,RC[-3]<0.6),85,IF(AND(RC[-3]>=0.6,RC[-3]<0.7),80,IF(AND(RC[-3]>=0.6,RC[-3]<1),80,IF(AND(RC[-3]>1,RC[-3]<2),50,IF(RC[-3]>2,0))))))))) ->  | I221: =IF(RC[-1]="",RC[-2],0.7*RC[-1]+0.3*RC[-2]) -> 90
A222: کارخانجات داروپخش | B222: دارو | C222: =VLOOKUP(RC[-1],Sheet1!R3C2:R802C3,2,FALSE) -> دارویی | D222: =VLOOKUP(RC[-2],Sheet1!R3C2:R802C9,8,FALSE) -> 4.4163459455010461 | E222: =IF(VLOOKUP(RC[-3],Sheet1!R3C2:R803C11,10,FALSE)=0,"",VLOOKUP(Sheet2!RC[-3],Sheet1!R[1]C[-3]:R[801]C[6],10,FALSE)) ->  | F222: =Sheet1!R246C10 -> 7.5295416184238002 | G222: =IF(RC[-3]<0,0,IF(AND(RC[-3]<RC[-1],RC[-3]<2),100,IF(AND(RC[-3]<RC[-1],RC[-3]>=2,RC[-3]<3),95,IF(AND(RC[-3]<RC[-1],RC[-3]>=3,RC[-3]<4),90,IF(AND(RC[-3]<RC[-1],RC[-3]>=4,RC[-3]<5),85,IF(AND(RC[-3]<RC[-1],RC[-3]>=5,RC[-3]<6),80,IF(AND(RC[-3]<RC[-1],RC[-3]>=6,RC[-3]<7),75,IF(AND(RC[-3]<RC[-1],RC[-3]>=7,RC[-3]<8),70,IF(AND(RC[-3]<RC[-1],RC[-3]>=8,RC[-3]<9),65,IF(AND(RC[-3]<RC[-1],RC[-3]>=9,RC[-3]<10),60,IF(AND(RC[-3]<RC[-1],RC[-3]>=10,RC[-3]<11),55,IF(AND(RC[-3]<RC[-1],RC[-3]>=11,RC[-3]<12),50,IF(AND(RC[-3]<RC[-1],RC[-3]>=12,RC[-3]<13),45,IF(AND(RC[-3]<RC[-1],RC[-3]>=13,RC[-3]<14),40,IF(AND(RC[-3]<RC[-1],RC[-3]>=14,RC[-3]<15),35,IF(AND(RC[-3]<RC[-1],RC[-3]>=15,RC[-3]<16),30,IF(AND(RC[-3]<RC[-1],RC[-3]>=16,RC[-3]<17),25,IF(AND(RC[-3]<RC[-1],RC[-3]>=17,RC[-3]<18),20,IF(AND(RC[-3]<RC[-1],RC[-3]>=18,RC[-3]<19),15,IF(AND(RC[-3]<RC[-1],RC[-3]>=19,RC[-3]<20),10,IF(AND(RC[-3]<RC[-1],RC[-3]>=20,RC[-3]<21),5,IF(AND(RC[-3]<RC[-1],RC[-3]>=21),0,IF(AND(RC[-3]>RC[-1],RC[-3]>=2,RC[-3]<3),90,IF(AND(RC[-3]>RC[-1],RC[-3]>=3,RC[-3]<4),90,IF(AND(RC[-3]>RC[-1],RC[-3]>=4,RC[-3]<5),80,IF(AND(RC[-3]>RC[-1],RC[-3]>=5,RC[-3]<6),70,IF(AND(RC[-3]>RC[-1],RC[-3]>=6,RC[-3]<7),60,IF(AND(RC[-3]>RC[-1],RC[-3]>=7,RC[-3]<8),50,IF(AND(RC[-3]>RC[-1],RC[-3]>=8,RC[-3]<9),40,IF(AND(RC[-3]>RC[-1],RC[-3]>=9,RC[-3]<10),30,IF(AND(RC[-3]>RC[-1],RC[-3]>=10,RC[-3]<11),20,IF(AND(RC[-3]>RC[-1],RC[-3]>=11,RC[-3]<12),10,IF(AND(RC[-3]>RC[-1],RC[-3]>=12),0))))))))))))))))))))))))))))))))) -> 85 | H222: =IF(RC[-3]="","",IF(RC[-3]<0.3,100,IF(AND(RC[-3]>=0.3,RC[-3]>0.4),95,IF(AND(RC[-3]>=0.4,RC[-3]<0.5),90,IF(AND(RC[-3]>=0.5,RC[-3]<0.6),85,IF(AND(RC[-3]>=0.6,RC[-3]<0.7),80,IF(AND(RC[-3]>=0.6,RC[-3]<1),80,IF(AND(RC[-3]>1,RC[-3]<2),50,IF(RC[-3]>2,0))))))))) ->  | I222: =IF(RC[-1]="",RC[-2],0.7*RC[-1]+0.3*RC[-2]) -> 85
A223: کاسپین تامین | B223: کاسپین | C223: =VLOOKUP(RC[-1],Sheet1!R3C2:R802C3,2,FALSE) -> دارویی | D223: =VLOOKUP(RC[-2],Sheet1!R3C2:R802C9,8,FALSE) -> 3.8826334152408939 | E223: =IF(VLOOKUP(RC[-3],Sheet1!R3C2:R803C11,10,FALSE)=0,"",VLOOKUP(Sheet2!RC[-3],Sheet1!R[1]C[-3]:R[801]C[6],10,FALSE)) ->  | F223: =Sheet1!R246C10 -> 7.5295416184238002 | G223: =IF(RC[-3]<0,0,IF(AND(RC[-3]<RC[-1],RC[-3]<2),100,IF(AND(RC[-3]<RC[-1],RC[-3]>=2,RC[-3]<3),95,IF(AND(RC[-3]<RC[-1],RC[-3]>=3,RC[-3]<4),90,IF(AND(RC[-3]<RC[-1],RC[-3]>=4,RC[-3]<5),85,IF(AND(RC[-3]<RC[-1],RC[-3]>=5,RC[-3]<6),80,IF(AND(RC[-3]<RC[-1],RC[-3]>=6,RC[-3]<7),75,IF(AND(RC[-3]<RC[-1],RC[-3]>=7,RC[-3]<8),70,IF(AND(RC[-3]<RC[-1],RC[-3]>=8,RC[-3]<9),65,IF(AND(RC[-3]<RC[-1],RC[-3]>=9,RC[-3]<10),60,IF(AND(RC[-3]<RC[-1],RC[-3]>=10,RC[-3]<11),55,IF(AND(RC[-3]<RC[-1],RC[-3]>=11,RC[-3]<12),50,IF(AND(RC[-3]<RC[-1],RC[-3]>=12,RC[-3]<13),45,IF(AND(RC[-3]<RC[-1],RC[-3]>=13,RC[-3]<14),40,IF(AND(RC[-3]<RC[-1],RC[-3]>=14,RC[-3]<15),35,IF(AND(RC[-3]<RC[-1],RC[-3]>=15,RC[-3]<16),30,IF(AND(RC[-3]<RC[-1],RC[-3]>=16,RC[-3]<17),25,IF(AND(RC[-3]<RC[-1],RC[-3]>=17,RC[-3]<18),20,IF(AND(RC[-3]<RC[-1],RC[-3]>=18,RC[-3]<19),15,IF(AND(RC[-3]<RC[-1],RC[-3]>=19,RC[-3]<20),10,IF(AND(RC[-3]<RC[-1],RC[-3]>=20,RC[-3]<21),5,IF(AND(RC[-3]<RC[-1],RC[-3]>=21),0,IF(AND(RC[-3]>RC[-1],RC[-3]>=2,RC[-3]<3),90,IF(AND(RC[-3]>RC[-1],RC[-3]>=3,RC[-3]<4),90,IF(AND(RC[-3]>RC[-1],RC[-3]>=4,RC[-3]<5),80,IF(AND(RC[-3]>RC[-1],RC[-3]>=5,RC[-3]<6),70,IF(AND(RC[-3]>RC[-1],RC[-3]>=6,RC[-3]<7),60,IF(AND(RC[-3]>RC[-1],RC[-3]>=7,RC[-3]<8),50,IF(AND(RC[-3]>RC[-1],RC[-3]>=8,RC[-3]<9),40,IF(AND(RC[-3]>RC[-1],RC[-3]>=9,RC[-3]<10),30,IF(AND(RC[-3]>RC[-1],RC[-3]>=10,RC[-3]<11),20,IF(AND(RC[-3]>RC[-1],RC[-3]>=11,RC[-3]<12),10,IF(AND(RC[-3]>RC[-1],RC[-3]>=12),0))))))))))))))))))))))))))))))))) -> 90 | H223: =IF(RC[-3]="","",IF(RC[-3]<0.3,100,IF(AND(RC[-3]>=0.3,RC[-3]>0.4),95,IF(AND(RC[-3]>=0.4,RC[-3]<0.5),90,IF(AND(RC[-3]>=0.5,RC[-3]<0.6),85,IF(AND(RC[-3]>=0.6,RC[-3]<0.7),80,IF(AND(RC[-3]>=0.6,RC[-3]<1),80,IF(AND(RC[-3]>1,RC[-3]<2),50,IF(RC[-3]>2,0))))))))) ->  | I223: =IF(RC[-1]="",RC[-2],0.7*RC[-1]+0.3*RC[-2]) -> 90
A224: کی بی سی | B224: کی بی سی | C224: =VLOOKUP(RC[-1],Sheet1!R3C2:R802C3,2,FALSE) -> دارویی | D224: =VLOOKUP(RC[-2],Sheet1!R3C2:R802C9,8,FALSE) -> 7.9366537425769366 | E224: =IF(VLOOKUP(RC[-3],Sheet1!R3C2:R803C11,10,FALSE)=0,"",VLOOKUP(Sheet2!RC[-3],Sheet1!R[1]C[-3]:R[801]C[6],10,FALSE)) ->  | F224: =Sheet1!R246C10 -> 7.5295416184238002 | G224: =IF(RC[-3]<0,0,IF(AND(RC[-3]<RC[-1],RC[-3]<2),100,IF(AND(RC[-3]<RC[-1],RC[-3]>=2,RC[-3]<3),95,IF(AND(RC[-3]<RC[-1],RC[-3]>=3,RC[-3]<4),90,IF(AND(RC[-3]<RC[-1],RC[-3]>=4,RC[-3]<5),85,IF(AND(RC[-3]<RC[-1],RC[-3]>=5,RC[-3]<6),80,IF(AND(RC[-3]<RC[-1],RC[-3]>=6,RC[-3]<7),75,IF(AND(RC[-3]<RC[-1],RC[-3]>=7,RC[-3]<8),70,IF(AND(RC[-3]<RC[-1],RC[-3]>=8,RC[-3]<9),65,IF(AND(RC[-3]<RC[-1],RC[-3]>=9,RC[-3]<10),60,IF(AND(RC[-3]<RC[-1],RC[-3]>=10,RC[-3]<11),55,IF(AND(RC[-3]<RC[-1],RC[-3]>=11,RC[-3]<12),50,IF(AND(RC[-3]<RC[-1],RC[-3]>=12,RC[-3]<13),45,IF(AND(RC[-3]<RC[-1],RC[-3]>=13,RC[-3]<14),40,IF(AND(RC[-3]<RC[-1],RC[-3]>=14,RC[-3]<15),35,IF(AND(RC[-3]<RC[-1],RC[-3]>=15,RC[-3]<16),30,IF(AND(RC[-3]<RC[-1],RC[-3]>=16,RC[-3]<17),25,IF(AND(RC[-3]<RC[-1],RC[-3]>=17,RC[-3]<18),20,IF(AND(RC[-3]<RC[-1],RC[-3]>=18,RC[-3]<19),15,IF(AND(RC[-3]<RC[-1],RC[-3]>=19,RC[-3]<20),10,IF(AND(RC[-3]<RC[-1],RC[-3]>=20,RC[-3]<21),5,IF(AND(RC[-3]<RC[-1],RC[-3]>=21),0,IF(AND(RC[-3]>RC[-1],RC[-3]>=2,RC[-3]<3),90,IF(AND(RC[-3]>RC[-1],RC[-3]>=3,RC[-3]<4),90,IF(AND(RC[-3]>RC[-1],RC[-3]>=4,RC[-3]<5),80,IF(AND(RC[-3]>RC[-1],RC[-3]>=5,RC[-3]<6),70,IF(AND(RC[-3]>RC[-1],RC[-3]>=6,RC[-3]<7),60,IF(AND(RC[-3]>RC[-1],RC[-3]>=7,RC[-3]<8),50,IF(AND(RC[-3]>RC[-1],RC[-3]>=8,RC[-3]<9),40,IF(AND(RC[-3]>RC[-1],RC[-3]>=9,RC[-3]<10),30,IF(AND(RC[-3]>RC[-1],RC[-3]>=10,RC[-3]<11),20,IF(AND(RC[-3]>RC[-1],RC[-3]>=11,RC[-3]<12),10,IF(AND(RC[-3]>RC[-1],RC[-3]>=12),0))))))))))))))))))))))))))))))))) -> 50 | H224: =IF(RC[-3]="","",IF(RC[-3]<0.3,100,IF(AND(RC[-3]>=0.3,RC[-3]>0.4),95,IF(AND(RC[-3]>=0.4,RC[-3]<0.5),90,IF(AND(RC[-3]>=0.5,RC[-3]<0.6),85,IF(AND(RC[-3]>=0.6,RC[-3]<0.7),80,IF(AND(RC[-3]>=0.6,RC[-3]<1),80,IF(AND(RC[-3]>1,RC[-3]<2),50,IF(RC[-3]>2,0))))))))) ->  | I224: =IF(RC[-1]="",RC[-2],0.7*RC[-1]+0.3*RC[-2]) -> 50
A225: کیمیدارو | B225: دکیمی | C225: =VLOOKUP(RC[-1],Sheet1!R3C2:R802C3,2,FALSE) -> دارویی | D225: =VLOOKUP(RC[-2],Sheet1!R3C2:R802C9,8,FALSE) -> 5.8112816004672618 | E225: =IF(VLOOKUP(RC[-3],Sheet1!R3C2:R803C11,10,FALSE)=0,"",VLOOKUP(Sheet2!RC[-3],Sheet1!R[1]C[-3]:R[801]C[6],10,FALSE)) ->  | F225: =Sheet1!R246C10 -> 7.5295416184238002 | G225: =IF(RC[-3]<0,0,IF(AND(RC[-3]<RC[-1],RC[-3]<2),100,IF(AND(RC[-3]<RC[-1],RC[-3]>=2,RC[-3]<3),95,IF(AND(RC[-3]<RC[-1],RC[-3]>=3,RC[-3]<4),90,IF(AND(RC[-3]<RC[-1],RC[-3]>=4,RC[-3]<5),85,IF(AND(RC[-3]<RC[-1],RC[-3]>=5,RC[-3]<6),80,IF(AND(RC[-3]<RC[-1],RC[-3]>=6,RC[-3]<7),75,IF(AND(RC[-3]<RC[-1],RC[-3]>=7,RC[-3]<8),70,IF(AND(RC[-3]<RC[-1],RC[-3]>=8,RC[-3]<9),65,IF(AND(RC[-3]<RC[-1],RC[-3]>=9,RC[-3]<10),60,IF(AND(RC[-3]<RC[-1],RC[-3]>=10,RC[-3]<11),55,IF(AND(RC[-3]<RC[-1],RC[-3]>=11,RC[-3]<12),50,IF(AND(RC[-3]<RC[-1],RC[-3]>=12,RC[-3]<13),45,IF(AND(RC[-3]<RC[-1],RC[-3]>=13,RC[-3]<14),40,IF(AND(RC[-3]<RC[-1],RC[-3]>=14,RC[-3]<15),35,IF(AND(RC[-3]<RC[-1],RC[-3]>=15,RC[-3]<16),30,IF(AND(RC[-3]<RC[-1],RC[-3]>=16,RC[-3]<17),25,IF(AND(RC[-3]<RC[-1],RC[-3]>=17,RC[-3]<18),20,IF(AND(RC[-3]<RC[-1],RC[-3]>=18,RC[-3]<19),15,IF(AND(RC[-3]<RC[-1],RC[-3]>=19,RC[-3]<20),10,IF(AND(RC[-3]<RC[-1],RC[-3]>=20,RC[-3]<21),5,IF(AND(RC[-3]<RC[-1],RC[-3]>=21),0,IF(AND(RC[-3]>RC[-1],RC[-3]>=2,RC[-3]<3),90,IF(AND(RC[-3]>RC[-1],RC[-3]>=3,RC[-3]<4),90,IF(AND(RC[-3]>RC[-1],RC[-3]>=4,RC[-3]<5),80,IF(AND(RC[-3]>RC[-1],RC[-3]>=5,RC[-3]<6),70,IF(AND(RC[-3]>RC[-1],RC[-3]>=6,RC[-3]<7),60,IF(AND(RC[-3]>RC[-1],RC[-3]>=7,RC[-3]<8),50,IF(AND(RC[-3]>RC[-1],RC[-3]>=8,RC[-3]<9),40,IF(AND(RC[-3]>RC[-1],RC[-3]>=9,RC[-3]<10),30,IF(AND(RC[-3]>RC[-1],RC[-3]>=10,RC[-3]<11),20,IF(AND(RC[-3]>RC[-1],RC[-3]>=11,RC[-3]<12),10,IF(AND(RC[-3]>RC[-1],RC[-3]>=12),0))))))))))))))))))))))))))))))))) -> 80 | H225: =IF(RC[-3]="","",IF(RC[-3]<0.3,100,IF(AND(RC[-3]>=0.3,RC[-3]>0.4),95,IF(AND(RC[-3]>=0.4,RC[-3]<0.5),90,IF(AND(RC[-3]>=0.5,RC[-3]<0.6),85,IF(AND(RC[-3]>=0.6,RC[-3]<0.7),80,IF(AND(RC[-3]>=0.6,RC[-3]<1),80,IF(AND(RC[-3]>1,RC[-3]<2),50,IF(RC[-3]>2,0))))))))) ->  | I225: =IF(RC[-1]="",RC[-2],0.7*RC[-1]+0.3*RC[-2]) -> 80
A226: ایران ترانسفو | B226: بترانس | C226: =VLOOKUP(RC[-1],Sheet1!R3C2:R802C3,2,FALSE) -> دستگاههای برقی | D226: =VLOOKUP(RC[-2],Sheet1!R3C2:R802C9,8,FALSE) -> 4.7481866461899997 | E226: =IF(VLOOKUP(RC[-3],Sheet1!R3C2:R803C11,10,FALSE)=0,"",VLOOKUP(Sheet2!RC[-3],Sheet1!R[1]C[-3]:R[801]C[6],10,FALSE)) ->  | F226: =Sheet1!R258C10 -> 216.23137628876444 | G226: =IF(RC[-3]<0,0,IF(AND(RC[-3]<RC[-1],RC[-3]<2),100,IF(AND(RC[-3]<RC[-1],RC[-3]>=2,RC[-3]<3),95,IF(AND(RC[-3]<RC[-1],RC[-3]>=3,RC[-3]<4),90,IF(AND(RC[-3]<RC[-1],RC[-3]>=4,RC[-3]<5),85,IF(AND(RC[-3]<RC[-1],RC[-3]>=5,RC[-3]<6),80,IF(AND(RC[-3]<RC[-1],RC[-3]>=6,RC[-3]<7),75,IF(AND(RC[-3]<RC[-1],RC[-3]>=7,RC[-3]<8),70,IF(AND(RC[-3]<RC[-1],RC[-3]>=8,RC[-3]<9),65,IF(AND(RC[-3]<RC[-1],RC[-3]>=9,RC[-3]<10),60,IF(AND(RC[-3]<RC[-1],RC[-3]>=10,RC[-3]<11),55,IF(AND(RC[-3]<RC[-1],RC[-3]>=11,RC[-3]<12),50,IF(AND(RC[-3]<RC[-1],RC[-3]>=12,RC[-3]<13),45,IF(AND(RC[-3]<RC[-1],RC[-3]>=13,RC[-3]<14),40,IF(AND(RC[-3]<RC[-1],RC[-3]>=14,RC[-3]<15),35,IF(AND(RC[-3]<RC[-1],RC[-3]>=15,RC[-3]<16),30,IF(AND(RC[-3]<RC[-1],RC[-3]>=16,RC[-3]<17),25,IF(AND(RC[-3]<RC[-1],RC[-3]>=17,RC[-3]<18),20,IF(AND(RC[-3]<RC[-1],RC[-3]>=18,RC[-3]<19),15,IF(AND(RC[-3]<RC[-1],RC[-3]>=19,RC[-3]<20),10,IF(AND(RC[-3]<RC[-1],RC[-3]>=20,RC[-3]<21),5,IF(AND(RC[-3]<RC[-1],RC[-3]>=21),0,IF(AND(RC[-3]>RC[-1],RC[-3]>=2,RC[-3]<3),90,IF(AND(RC[-3]>RC[-1],RC[-3]>=3,RC[-3]<4),90,IF(AND(RC[-3]>RC[-1],RC[-3]>=4,RC[-3]<5),80,IF(AND(RC[-3]>RC[-1],RC[-3]>=5,RC[-3]<6),70,IF(AND(RC[-3]>RC[-1],RC[-3]>=6,RC[-3]<7),60,IF(AND(RC[-3]>RC[-1],RC[-3]>=7,RC[-3]<8),50,IF(AND(RC[-3]>RC[-1],RC[-3]>=8,RC[-3]<9),40,IF(AND(RC[-3]>RC[-1],RC[-3]>=9,RC[-3]<10),30,IF(AND(RC[-3]>RC[-1],RC[-3]>=10,RC[-3]<11),20,IF(AND(RC[-3]>RC[-1],RC[-3]>=11,RC[-3]<12),10,IF(AND(RC[-3]>RC[-1],RC[-3]>=12),0))))))))))))))))))))))))))))))))) -> 85 | H226: =IF(RC[-3]="","",IF(RC[-3]<0.3,100,IF(AND(RC[-3]>=0.3,RC[-3]>0.4),95,IF(AND(RC[-3]>=0.4,RC[-3]<0.5),90,IF(AND(RC[-3]>=0.5,RC[-3]<0.6),85,IF(AND(RC[-3]>=0.6,RC[-3]<0.7),80,IF(AND(RC[-3]>=0.6,RC[-3]<1),80,IF(AND(RC[-3]>1,RC[-3]<2),50,IF(RC[-3]>2,0))))))))) ->  | I226: =IF(RC[-1]="",RC[-2],0.7*RC[-1]+0.3*RC[-2]) -> 85
A227: پارس سوئیچ | B227: بسویچ | C227: =VLOOKUP(RC[-1],Sheet1!R3C2:R802C3,2,FALSE) -> دستگاههای برقی | D227: =VLOOKUP(RC[-2],Sheet1!R3C2:R802C9,8,FALSE) -> 3.0100252463481474 | E227: =IF(VLOOKUP(RC[-3],Sheet1!R3C2:R803C11,10,FALSE)=0,"",VLOOKUP(Sheet2!RC[-3],Sheet1!R[1]C[-3]:R[801]C[6],10,FALSE)) ->  | F227: =Sheet1!R258C10 -> 216.23137628876444 | G227: =IF(RC[-3]<0,0,IF(AND(RC[-3]<RC[-1],RC[-3]<2),100,IF(AND(RC[-3]<RC[-1],RC[-3]>=2,RC[-3]<3),95,IF(AND(RC[-3]<RC[-1],RC[-3]>=3,RC[-3]<4),90,IF(AND(RC[-3]<RC[-1],RC[-3]>=4,RC[-3]<5),85,IF(AND(RC[-3]<RC[-1],RC[-3]>=5,RC[-3]<6),80,IF(AND(RC[-3]<RC[-1],RC[-3]>=6,RC[-3]<7),75,IF(AND(RC[-3]<RC[-1],RC[-3]>=7,RC[-3]<8),70,IF(AND(RC[-3]<RC[-1],RC[-3]>=8,RC[-3]<9),65,IF(AND(RC[-3]<RC[-1],RC[-3]>=9,RC[-3]<10),60,IF(AND(RC[-3]<RC[-1],RC[-3]>=10,RC[-3]<11),55,IF(AND(RC[-3]<RC[-1],RC[-3]>=11,RC[-3]<12),50,IF(AND(RC[-3]<RC[-1],RC[-3]>=12,RC[-3]<13),45,IF(AND(RC[-3]<RC[-1],RC[-3]>=13,RC[-3]<14),40,IF(AND(RC[-3]<RC[-1],RC[-3]>=14,RC[-3]<15),35,IF(AND(RC[-3]<RC[-1],RC[-3]>=15,RC[-3]<16),30,IF(AND(RC[-3]<RC[-1],RC[-3]>=16,RC[-3]<17),25,IF(AND(RC[-3]<RC[-1],RC[-3]>=17,RC[-3]<18),20,IF(AND(RC[-3]<RC[-1],RC[-3]>=18,RC[-3]<19),15,IF(AND(RC[-3]<RC[-1],RC[-3]>=19,RC[-3]<20),10,IF(AND(RC[-3]<RC[-1],RC[-3]>=20,RC[-3]<21),5,IF(AND(RC[-3]<RC[-1],RC[-3]>=21),0,IF(AND(RC[-3]>RC[-1],RC[-3]>=2,RC[-3]<3),90,IF(AND(RC[-3]>RC[-1],RC[-3]>=3,RC[-3]<4),90,IF(AND(RC[-3]>RC[-1],RC[-3]>=4,RC[-3]<5),80,IF(AND(RC[-3]>RC[-1],RC[-3]>=5,RC[-3]<6),70,IF(AND(RC[-3]>RC[-1],RC[-3]>=6,RC[-3]<7),60,IF(AND(RC[-3]>RC[-1],RC[-3]>=7,RC[-3]<8),50,IF(AND(RC[-3]>RC[-1],RC[-3]>=8,RC[-3]<9),40,IF(AND(RC[-3]>RC[-1],RC[-3]>=9,RC[-3]<10),30,IF(AND(RC[-3]>RC[-1],RC[-3]>=10,RC[-3]<11),20,IF(AND(RC[-3]>RC[-1],RC[-3]>=11,RC[-3]<12),10,IF(AND(RC[-3]>RC[-1],RC[-3]>=12),0))))))))))))))))))))))))))))))))) -> 90 | H227: =IF(RC[-3]="","",IF(RC[-3]<0.3,100,IF(AND(RC[-3]>=0.3,RC[-3]>0.4),95,IF(AND(RC[-3]>=0.4,RC[-3]<0.5),90,IF(AND(RC[-3]>=0.5,RC[-3]<0.6),85,IF(AND(RC[-3]>=0.6,RC[-3]<0.7),80,IF(AND(RC[-3]>=0.6,RC[-3]<1),80,IF(AND(RC[-3]>1,RC[-3]<2),50,IF(RC[-3]>2,0))))))))) ->  | I227: =IF(RC[-1]="",RC[-2],0.7*RC[-1]+0.3*RC[-2]) -> 90
A228: جوشکاب یزد | B228: بکاب | C228: =VLOOKUP(RC[-1],Sheet1!R3C2:R802C3,2,FALSE) -> دستگاههای برقی | D228: =VLOOKUP(RC[-2],Sheet1!R3C2:R802C9,8,FALSE) -> 18.855807724211406 | E228: =IF(VLOOKUP(RC[-3],Sheet1!R3C2:R803C11,10,FALSE)=0,"",VLOOKUP(Sheet2!RC[-3],Sheet1!R[1]C[-3]:R[801]C[6],10,FALSE)) ->  | F228: =Sheet1!R258C10 -> 216.23137628876444 | G228: =IF(RC[-3]<0,0,IF(AND(RC[-3]<RC[-1],RC[-3]<2),100,IF(AND(RC[-3]<RC[-1],RC[-3]>=2,RC[-3]<3),95,IF(AND(RC[-3]<RC[-1],RC[-3]>=3,RC[-3]<4),90,IF(AND(RC[-3]<RC[-1],RC[-3]>=4,RC[-3]<5),85,IF(AND(RC[-3]<RC[-1],RC[-3]>=5,RC[-3]<6),80,IF(AND(RC[-3]<RC[-1],RC[-3]>=6,RC[-3]<7),75,IF(AND(RC[-3]<RC[-1],RC[-3]>=7,RC[-3]<8),70,IF(AND(RC[-3]<RC[-1],RC[-3]>=8,RC[-3]<9),65,IF(AND(RC[-3]<RC[-1],RC[-3]>=9,RC[-3]<10),60,IF(AND(RC[-3]<RC[-1],RC[-3]>=10,RC[-3]<11),55,IF(AND(RC[-3]<RC[-1],RC[-3]>=11,RC[-3]<12),50,IF(AND(RC[-3]<RC[-1],RC[-3]>=12,RC[-3]<13),45,IF(AND(RC[-3]<RC[-1],RC[-3]>=13,RC[-3]<14),40,IF(AND(RC[-3]<RC[-1],RC[-3]>=14,RC[-3]<15),35,IF(AND(RC[-3]<RC[-1],RC[-3]>=15,RC[-3]<16),30,IF(AND(RC[-3]<RC[-1],RC[-3]>=16,RC[-3]<17),25,IF(AND(RC[-3]<RC[-1],RC[-3]>=17,RC[-3]<18),20,IF(AND(RC[-3]<RC[-1],RC[-3]>=18,RC[-3]<19),15,IF(AND(RC[-3]<RC[-1],RC[-3]>=19,RC[-3]<20),10,IF(AND(RC[-3]<RC[-1],RC[-3]>=20,RC[-3]<21),5,IF(AND(RC[-3]<RC[-1],RC[-3]>=21),0,IF(AND(RC[-3]>RC[-1],RC[-3]>=2,RC[-3]<3),90,IF(AND(RC[-3]>RC[-1],RC[-3]>=3,RC[-3]<4),90,IF(AND(RC[-3]>RC[-1],RC[-3]>=4,RC[-3]<5),80,IF(AND(RC[-3]>RC[-1],RC[-3]>=5,RC[-3]<6),70,IF(AND(RC[-3]>RC[-1],RC[-3]>=6,RC[-3]<7),60,IF(AND(RC[-3]>RC[-1],RC[-3]>=7,RC[-3]<8),50,IF(AND(RC[-3]>RC[-1],RC[-3]>=8,RC[-3]<9),40,IF(AND(RC[-3]>RC[-1],RC[-3]>=9,RC[-3]<10),30,IF(AND(RC[-3]>RC[-1],RC[-3]>=10,RC[-3]<11),20,IF(AND(RC[-3]>RC[-1],RC[-3]>=11,RC[-3]<12),10,IF(AND(RC[-3]>RC[-1],RC[-3]>=12),0))))))))))))))))))))))))))))))))) -> 15 | H228: =IF(RC[-3]="","",IF(RC[-3]<0.3,100,IF(AND(RC[-3]>=0.3,RC[-3]>0.4),95,IF(AND(RC[-3]>=0.4,RC[-3]<0.5),90,IF(AND(RC[-3]>=0.5,RC[-3]<0.6),85,IF(AND(RC[-3]>=0.6,RC[-3]<0.7),80,IF(AND(RC[-3]>=0.6,RC[-3]<1),80,IF(AND(RC[-3]>1,RC[-3]<2),50,IF(RC[-3]>2,0))))))))) ->  | I228: =IF(RC[-1]="",RC[-2],0.7*RC[-1]+0.3*RC[-2]) -> 15
A229: شهید قندی | B229: بکام | C229: =VLOOKUP(RC[-1],Sheet1!R3C2:R802C3,2,FALSE) -> دستگاههای برقی | D229: =VLOOKUP(RC[-2],Sheet1!R3C2:R802C9,8,FALSE) -> 1864.4278758295125 | E229: =IF(VLOOKUP(RC[-3],Sheet1!R3C2:R803C11,10,FALSE)=0,"",VLOOKUP(Sheet2!RC[-3],Sheet1!R[1]C[-3]:R[801]C[6],10,FALSE)) ->  | F229: =Sheet1!R258C10 -> 216.23137628876444 | G229: =IF(RC[-3]<0,0,IF(AND(RC[-3]<RC[-1],RC[-3]<2),100,IF(AND(RC[-3]<RC[-1],RC[-3]>=2,RC[-3]<3),95,IF(AND(RC[-3]<RC[-1],RC[-3]>=3,RC[-3]<4),90,IF(AND(RC[-3]<RC[-1],RC[-3]>=4,RC[-3]<5),85,IF(AND(RC[-3]<RC[-1],RC[-3]>=5,RC[-3]<6),80,IF(AND(RC[-3]<RC[-1],RC[-3]>=6,RC[-3]<7),75,IF(AND(RC[-3]<RC[-1],RC[-3]>=7,RC[-3]<8),70,IF(AND(RC[-3]<RC[-1],RC[-3]>=8,RC[-3]<9),65,IF(AND(RC[-3]<RC[-1],RC[-3]>=9,RC[-3]<10),60,IF(AND(RC[-3]<RC[-1],RC[-3]>=10,RC[-3]<11),55,IF(AND(RC[-3]<RC[-1],RC[-3]>=11,RC[-3]<12),50,IF(AND(RC[-3]<RC[-1],RC[-3]>=12,RC[-3]<13),45,IF(AND(RC[-3]<RC[-1],RC[-3]>=13,RC[-3]<14),40,IF(AND(RC[-3]<RC[-1],RC[-3]>=14,RC[-3]<15),35,IF(AND(RC[-3]<RC[-1],RC[-3]>=15,RC[-3]<16),30,IF(AND(RC[-3]<RC[-1],RC[-3]>=16,RC[-3]<17),25,IF(AND(RC[-3]<RC[-1],RC[-3]>=17,RC[-3]<18),20,IF(AND(RC[-3]<RC[-1],RC[-3]>=18,RC[-3]<19),15,IF(AND(RC[-3]<RC[-1],RC[-3]>=19,RC[-3]<20),10,IF(AND(RC[-3]<RC[-1],RC[-3]>=20,RC[-3]<21),5,IF(AND(RC[-3]<RC[-1],RC[-3]>=21),0,IF(AND(RC[-3]>RC[-1],RC[-3]>=2,RC[-3]<3),90,IF(AND(RC[-3]>RC[-1],RC[-3]>=3,RC[-3]<4),90,IF(AND(RC[-3]>RC[-1],RC[-3]>=4,RC[-3]<5),80,IF(AND(RC[-3]>RC[-1],RC[-3]>=5,RC[-3]<6),70,IF(AND(RC[-3]>RC[-1],RC[-3]>=6,RC[-3]<7),60,IF(AND(RC[-3]>RC[-1],RC[-3]>=7,RC[-3]<8),50,IF(AND(RC[-3]>RC[-1],RC[-3]>=8,RC[-3]<9),40,IF(AND(RC[-3]>RC[-1],RC[-3]>=9,RC[-3]<10),30,IF(AND(RC[-3]>RC[-1],RC[-3]>=10,RC[-3]<11),20,IF(AND(RC[-3]>RC[-1],RC[-3]>=11,RC[-3]<12),10,IF(AND(RC[-3]>RC[-1],RC[-3]>=12),0))))))))))))))))))))))))))))))))) -> 0 | H229: =IF(RC[-3]="","",IF(RC[-3]<0.3,100,IF(AND(RC[-3]>=0.3,RC[-3]>0.4),95,IF(AND(RC[-3]>=0.4,RC[-3]<0.5),90,IF(AND(RC[-3]>=0.5,RC[-3]<0.6),85,IF(AND(RC[-3]>=0.6,RC[-3]<0.7),80,IF(AND(RC[-3]>=0.6,RC[-3]<1),80,IF(AND(RC[-3]>1,RC[-3]<2),50,IF(RC[-3]>2,0))))))))) ->  | I229: =IF(RC[-1]="",RC[-2],0.7*RC[-1]+0.3*RC[-2]) -> 0
A230: لامپ پارس شهاب | B230: بشهاب | C230: =VLOOKUP(RC[-1],Sheet1!R3C2:R802C3,2,FALSE) -> دستگاههای برقی | D230: =VLOOKUP(RC[-2],Sheet1!R3C2:R802C9,8,FALSE) -> 5.8058039122296545 | E230: =IF(VLOOKUP(RC[-3],Sheet1!R3C2:R803C11,10,FALSE)=0,"",VLOOKUP(Sheet2!RC[-3],Sheet1!R[1]C[-3]:R[801]C[6],10,FALSE)) ->  | F230: =Sheet1!R258C10 -> 216.23137628876444 | G230: =IF(RC[-3]<0,0,IF(AND(RC[-3]<RC[-1],RC[-3]<2),100,IF(AND(RC[-3]<RC[-1],RC[-3]>=2,RC[-3]<3),95,IF(AND(RC[-3]<RC[-1],RC[-3]>=3,RC[-3]<4),90,IF(AND(RC[-3]<RC[-1],RC[-3]>=4,RC[-3]<5),85,IF(AND(RC[-3]<RC[-1],RC[-3]>=5,RC[-3]<6),80,IF(AND(RC[-3]<RC[-1],RC[-3]>=6,RC[-3]<7),75,IF(AND(RC[-3]<RC[-1],RC[-3]>=7,RC[-3]<8),70,IF(AND(RC[-3]<RC[-1],RC[-3]>=8,RC[-3]<9),65,IF(AND(RC[-3]<RC[-1],RC[-3]>=9,RC[-3]<10),60,IF(AND(RC[-3]<RC[-1],RC[-3]>=10,RC[-3]<11),55,IF(AND(RC[-3]<RC[-1],RC[-3]>=11,RC[-3]<12),50,IF(AND(RC[-3]<RC[-1],RC[-3]>=12,RC[-3]<13),45,IF(AND(RC[-3]<RC[-1],RC[-3]>=13,RC[-3]<14),40,IF(AND(RC[-3]<RC[-1],RC[-3]>=14,RC[-3]<15),35,IF(AND(RC[-3]<RC[-1],RC[-3]>=15,RC[-3]<16),30,IF(AND(RC[-3]<RC[-1],RC[-3]>=16,RC[-3]<17),25,IF(AND(RC[-3]<RC[-1],RC[-3]>=17,RC[-3]<18),20,IF(AND(RC[-3]<RC[-1],RC[-3]>=18,RC[-3]<19),15,IF(AND(RC[-3]<RC[-1],RC[-3]>=19,RC[-3]<20),10,IF(AND(RC[-3]<RC[-1],RC[-3]>=20,RC[-3]<21),5,IF(AND(RC[-3]<RC[-1],RC[-3]>=21),0,IF(AND(RC[-3]>RC[-1],RC[-3]>=2,RC[-3]<3),90,IF(AND(RC[-3]>RC[-1],RC[-3]>=3,RC[-3]<4),90,IF(AND(RC[-3]>RC[-1],RC[-3]>=4,RC[-3]<5),80,IF(AND(RC[-3]>RC[-1],RC[-3]>=5,RC[-3]<6),70,IF(AND(RC[-3]>RC[-1],RC[-3]>=6,RC[-3]<7),60,IF(AND(RC[-3]>RC[-1],RC[-3]>=7,RC[-3]<8),50,IF(AND(RC[-3]>RC[-1],RC[-3]>=8,RC[-3]<9),40,IF(AND(RC[-3]>RC[-1],RC[-3]>=9,RC[-3]<10),30,IF(AND(RC[-3]>RC[-1],RC[-3]>=10,RC[-3]<11),20,IF(AND(RC[-3]>RC[-1],RC[-3]>=11,RC[-3]<12),10,IF(AND(RC[-3]>RC[-1],RC[-3]>=12),0))))))))))))))))))))))))))))))))) -> 80 | H230: =IF(RC[-3]="","",IF(RC[-3]<0.3,100,IF(AND(RC[-3]>=0.3,RC[-3]>0.4),95,IF(AND(RC[-3]>=0.4,RC[-3]<0.5),90,IF(AND(RC[-3]>=0.5,RC[-3]<0.6),85,IF(AND(RC[-3]>=0.6,RC[-3]<0.7),80,IF(AND(RC[-3]>=0.6,RC[-3]<1),80,IF(AND(RC[-3]>1,RC[-3]<2),50,IF(RC[-3]>2,0))))))))) ->  | I230: =IF(RC[-1]="",RC[-2],0.7*RC[-1]+0.3*RC[-2]) -> 80
A231: موتوژن | B231: بموتو | C231: =VLOOKUP(RC[-1],Sheet1!R3C2:R802C3,2,FALSE) -> دستگاههای برقی | D231: =VLOOKUP(RC[-2],Sheet1!R3C2:R802C9,8,FALSE) -> 5.5140584381796751 | E231: =IF(VLOOKUP(RC[-3],Sheet1!R3C2:R803C11,10,FALSE)=0,"",VLOOKUP(Sheet2!RC[-3],Sheet1!R[1]C[-3]:R[801]C[6],10,FALSE)) ->  | F231: =Sheet1!R258C10 -> 216.23137628876444 | G231: =IF(RC[-3]<0,0,IF(AND(RC[-3]<RC[-1],RC[-3]<2),100,IF(AND(RC[-3]<RC[-1],RC[-3]>=2,RC[-3]<3),95,IF(AND(RC[-3]<RC[-1],RC[-3]>=3,RC[-3]<4),90,IF(AND(RC[-3]<RC[-1],RC[-3]>=4,RC[-3]<5),85,IF(AND(RC[-3]<RC[-1],RC[-3]>=5,RC[-3]<6),80,IF(AND(RC[-3]<RC[-1],RC[-3]>=6,RC[-3]<7),75,IF(AND(RC[-3]<RC[-1],RC[-3]>=7,RC[-3]<8),70,IF(AND(RC[-3]<RC[-1],RC[-3]>=8,RC[-3]<9),65,IF(AND(RC[-3]<RC[-1],RC[-3]>=9,RC[-3]<10),60,IF(AND(RC[-3]<RC[-1],RC[-3]>=10,RC[-3]<11),55,IF(AND(RC[-3]<RC[-1],RC[-3]>=11,RC[-3]<12),50,IF(AND(RC[-3]<RC[-1],RC[-3]>=12,RC[-3]<13),45,IF(AND(RC[-3]<RC[-1],RC[-3]>=13,RC[-3]<14),40,IF(AND(RC[-3]<RC[-1],RC[-3]>=14,RC[-3]<15),35,IF(AND(RC[-3]<RC[-1],RC[-3]>=15,RC[-3]<16),30,IF(AND(RC[-3]<RC[-1],RC[-3]>=16,RC[-3]<17),25,IF(AND(RC[-3]<RC[-1],RC[-3]>=17,RC[-3]<18),20,IF(AND(RC[-3]<RC[-1],RC[-3]>=18,RC[-3]<19),15,IF(AND(RC[-3]<RC[-1],RC[-3]>=19,RC[-3]<20),10,IF(AND(RC[-3]<RC[-1],RC[-3]>=20,RC[-3]<21),5,IF(AND(RC[-3]<RC[-1],RC[-3]>=21),0,IF(AND(RC[-3]>RC[-1],RC[-3]>=2,RC[-3]<3),90,IF(AND(RC[-3]>RC[-1],RC[-3]>=3,RC[-3]<4),90,IF(AND(RC[-3]>RC[-1],RC[-3]>=4,RC[-3]<5),80,IF(AND(RC[-3]>RC[-1],RC[-3]>=5,RC[-3]<6),70,IF(AND(RC[-3]>RC[-1],RC[-3]>=6,RC[-3]<7),60,IF(AND(RC[-3]>RC[-1],RC[-3]>=7,RC[-3]<8),50,IF(AND(RC[-3]>RC[-1],RC[-3]>=8,RC[-3]<9),40,IF(AND(RC[-3]>RC[-1],RC[-3]>=9,RC[-3]<10),30,IF(AND(RC[-3]>RC[-1],RC[-3]>=10,RC[-3]<11),20,IF(AND(RC[-3]>RC[-1],RC[-3]>=11,RC[-3]<12),10,IF(AND(RC[-3]>RC[-1],RC[-3]>=12),0))))))))))))))))))))))))))))))))) -> 80 | H231: =IF(RC[-3]="","",IF(RC[-3]<0.3,100,IF(AND(RC[-3]>=0.3,RC[-3]>0.4),95,IF(AND(RC[-3]>=0.4,RC[-3]<0.5),90,IF(AND(RC[-3]>=0.5,RC[-3]<0.6),85,IF(AND(RC[-3]>=0.6,RC[-3]<0.7),80,IF(AND(RC[-3]>=0.6,RC[-3]<1),80,IF(AND(RC[-3]>1,RC[-3]<2),50,IF(RC[-3]>2,0))))))))) ->  | I231: =IF(RC[-1]="",RC[-2],0.7*RC[-1]+0.3*RC[-2]) -> 80
A232: نیرو ترانس | B232: بنیرو | C232: =VLOOKUP(RC[-1],Sheet1!R3C2:R802C3,2,FALSE) -> دستگاههای برقی | D232: =VLOOKUP(RC[-2],Sheet1!R3C2:R802C9,8,FALSE) -> 6.9680045936899138 | E232: =IF(VLOOKUP(RC[-3],Sheet1!R3C2:R803C11,10,FALSE)=0,"",VLOOKUP(Sheet2!RC[-3],Sheet1!R[1]C[-3]:R[801]C[6],10,FALSE)) ->  | F232: =Sheet1!R258C10 -> 216.23137628876444 | G232: =IF(RC[-3]<0,0,IF(AND(RC[-3]<RC[-1],RC[-3]<2),100,IF(AND(RC[-3]<RC[-1],RC[-3]>=2,RC[-3]<3),95,IF(AND(RC[-3]<RC[-1],RC[-3]>=3,RC[-3]<4),90,IF(AND(RC[-3]<RC[-1],RC[-3]>=4,RC[-3]<5),85,IF(AND(RC[-3]<RC[-1],RC[-3]>=5,RC[-3]<6),80,IF(AND(RC[-3]<RC[-1],RC[-3]>=6,RC[-3]<7),75,IF(AND(RC[-3]<RC[-1],RC[-3]>=7,RC[-3]<8),70,IF(AND(RC[-3]<RC[-1],RC[-3]>=8,RC[-3]<9),65,IF(AND(RC[-3]<RC[-1],RC[-3]>=9,RC[-3]<10),60,IF(AND(RC[-3]<RC[-1],RC[-3]>=10,RC[-3]<11),55,IF(AND(RC[-3]<RC[-1],RC[-3]>=11,RC[-3]<12),50,IF(AND(RC[-3]<RC[-1],RC[-3]>=12,RC[-3]<13),45,IF(AND(RC[-3]<RC[-1],RC[-3]>=13,RC[-3]<14),40,IF(AND(RC[-3]<RC[-1],RC[-3]>=14,RC[-3]<15),35,IF(AND(RC[-3]<RC[-1],RC[-3]>=15,RC[-3]<16),30,IF(AND(RC[-3]<RC[-1],RC[-3]>=16,RC[-3]<17),25,IF(AND(RC[-3]<RC[-1],RC[-3]>=17,RC[-3]<18),20,IF(AND(RC[-3]<RC[-1],RC[-3]>=18,RC[-3]<19),15,IF(AND(RC[-3]<RC[-1],RC[-3]>=19,RC[-3]<20),10,IF(AND(RC[-3]<RC[-1],RC[-3]>=20,RC[-3]<21),5,IF(AND(RC[-3]<RC[-1],RC[-3]>=21),0,IF(AND(RC[-3]>RC[-1],RC[-3]>=2,RC[-3]<3),90,IF(AND(RC[-3]>RC[-1],RC[-3]>=3,RC[-3]<4),90,IF(AND(RC[-3]>RC[-1],RC[-3]>=4,RC[-3]<5),80,IF(AND(RC[-3]>RC[-1],RC[-3]>=5,RC[-3]<6),70,IF(AND(RC[-3]>RC[-1],RC[-3]>=6,RC[-3]<7),60,IF(AND(RC[-3]>RC[-1],RC[-3]>=7,RC[-3]<8),50,IF(AND(RC[-3]>RC[-1],RC[-3]>=8,RC[-3]<9),40,IF(AND(RC[-3]>RC[-1],RC[-3]>=9,RC[-3]<10),30,IF(AND(RC[-3]>RC[-1],RC[-3]>=10,RC[-3]<11),20,IF(AND(RC[-3]>RC[-1],RC[-3]>=11,RC[-3]<12),10,IF(AND(RC[-3]>RC[-1],RC[-3]>=12),0))))))))))))))))))))))))))))))))) -> 75 | H232: =IF(RC[-3]="","",IF(RC[-3]<0.3,100,IF(AND(RC[-3]>=0.3,RC[-3]>0.4),95,IF(AND(RC[-3]>=0.4,RC[-3]<0.5),90,IF(AND(RC[-3]>=0.5,RC[-3]<0.6),85,IF(AND(RC[-3]>=0.6,RC[-3]<0.7),80,IF(AND(RC[-3]>=0.6,RC[-3]<1),80,IF(AND(RC[-3]>1,RC[-3]<2),50,IF(RC[-3]>2,0))))))))) ->  | I232: =IF(RC[-1]="",RC[-2],0.7*RC[-1]+0.3*RC[-2]) -> 75
A233: نیرو سرمایه | B233: نیرو | C233: =VLOOKUP(RC[-1],Sheet1!R3C2:R802C3,2,FALSE) -> دستگاههای برقی | D233: =VLOOKUP(RC[-2],Sheet1!R3C2:R802C9,8,FALSE) -> 423.83674699075908 | E233: =IF(VLOOKUP(RC[-3],Sheet1!R3C2:R803C11,10,FALSE)=0,"",VLOOKUP(Sheet2!RC[-3],Sheet1!R[1]C[-3]:R[801]C[6],10,FALSE)) ->  | F233: =Sheet1!R258C10 -> 216.23137628876444 | G233: =IF(RC[-3]<0,0,IF(AND(RC[-3]<RC[-1],RC[-3]<2),100,IF(AND(RC[-3]<RC[-1],RC[-3]>=2,RC[-3]<3),95,IF(AND(RC[-3]<RC[-1],RC[-3]>=3,RC[-3]<4),90,IF(AND(RC[-3]<RC[-1],RC[-3]>=4,RC[-3]<5),85,IF(AND(RC[-3]<RC[-1],RC[-3]>=5,RC[-3]<6),80,IF(AND(RC[-3]<RC[-1],RC[-3]>=6,RC[-3]<7),75,IF(AND(RC[-3]<RC[-1],RC[-3]>=7,RC[-3]<8),70,IF(AND(RC[-3]<RC[-1],RC[-3]>=8,RC[-3]<9),65,IF(AND(RC[-3]<RC[-1],RC[-3]>=9,RC[-3]<10),60,IF(AND(RC[-3]<RC[-1],RC[-3]>=10,RC[-3]<11),55,IF(AND(RC[-3]<RC[-1],RC[-3]>=11,RC[-3]<12),50,IF(AND(RC[-3]<RC[-1],RC[-3]>=12,RC[-3]<13),45,IF(AND(RC[-3]<RC[-1],RC[-3]>=13,RC[-3]<14),40,IF(AND(RC[-3]<RC[-1],RC[-3]>=14,RC[-3]<15),35,IF(AND(RC[-3]<RC[-1],RC[-3]>=15,RC[-3]<16),30,IF(AND(RC[-3]<RC[-1],RC[-3]>=16,RC[-3]<17),25,IF(AND(RC[-3]<RC[-1],RC[-3]>=17,RC[-3]<18),20,IF(AND(RC[-3]<RC[-1],RC[-3]>=18,RC[-3]<19),15,IF(AND(RC[-3]<RC[-1],RC[-3]>=19,RC[-3]<20),10,IF(AND(RC[-3]<RC[-1],RC[-3]>=20,RC[-3]<21),5,IF(AND(RC[-3]<RC[-1],RC[-3]>=21),0,IF(AND(RC[-3]>RC[-1],RC[-3]>=2,RC[-3]<3),90,IF(AND(RC[-3]>RC[-1],RC[-3]>=3,RC[-3]<4),90,IF(AND(RC[-3]>RC[-1],RC[-3]>=4,RC[-3]<5),80,IF(AND(RC[-3]>RC[-1],RC[-3]>=5,RC[-3]<6),70,IF(AND(RC[-3]>RC[-1],RC[-3]>=6,RC[-3]<7),60,IF(AND(RC[-3]>RC[-1],RC[-3]>=7,RC[-3]<8),50,IF(AND(RC[-3]>RC[-1],RC[-3]>=8,RC[-3]<9),40,IF(AND(RC[-3]>RC[-1],RC[-3]>=9,RC[-3]<10),30,IF(AND(RC[-3]>RC[-1],RC[-3]>=10,RC[-3]<11),20,IF(AND(RC[-3]>RC[-1],RC[-3]>=11,RC[-3]<12),10,IF(AND(RC[-3]>RC[-1],RC[-3]>=12),0))))))))))))))))))))))))))))))))) -> 0 | H233: =IF(RC[-3]="","",IF(RC[-3]<0.3,100,IF(AND(RC[-3]>=0.3,RC[-3]>0.4),95,IF(AND(RC[-3]>=0.4,RC[-3]<0.5),90,IF(AND(RC[-3]>=0.5,RC[-3]<0.6),85,IF(AND(RC[-3]>=0.6,RC[-3]<0.7),80,IF(AND(RC[-3]>=0.6,RC[-3]<1),80,IF(AND(RC[-3]>1,RC[-3]<2),50,IF(RC[-3]>2,0))))))))) ->  | I233: =IF(RC[-1]="",RC[-2],0.7*RC[-1]+0.3*RC[-2]) -> 0
A234: کابل البرز | B234: بالبر | C234: =VLOOKUP(RC[-1],Sheet1!R3C2:R802C3,2,FALSE) -> دستگاههای برقی | D234: =VLOOKUP(RC[-2],Sheet1!R3C2:R802C9,8,FALSE) -> 34.936366623258664 | E234: =IF(VLOOKUP(RC[-3],Sheet1!R3C2:R803C11,10,FALSE)=0,"",VLOOKUP(Sheet2!RC[-3],Sheet1!R[1]C[-3]:R[801]C[6],10,FALSE)) ->  | F234: =Sheet1!R258C10 -> 216.23137628876444 | G234: =IF(RC[-3]<0,0,IF(AND(RC[-3]<RC[-1],RC[-3]<2),100,IF(AND(RC[-3]<RC[-1],RC[-3]>=2,RC[-3]<3),95,IF(AND(RC[-3]<RC[-1],RC[-3]>=3,RC[-3]<4),90,IF(AND(RC[-3]<RC[-1],RC[-3]>=4,RC[-3]<5),85,IF(AND(RC[-3]<RC[-1],RC[-3]>=5,RC[-3]<6),80,IF(AND(RC[-3]<RC[-1],RC[-3]>=6,RC[-3]<7),75,IF(AND(RC[-3]<RC[-1],RC[-3]>=7,RC[-3]<8),70,IF(AND(RC[-3]<RC[-1],RC[-3]>=8,RC[-3]<9),65,IF(AND(RC[-3]<RC[-1],RC[-3]>=9,RC[-3]<10),60,IF(AND(RC[-3]<RC[-1],RC[-3]>=10,RC[-3]<11),55,IF(AND(RC[-3]<RC[-1],RC[-3]>=11,RC[-3]<12),50,IF(AND(RC[-3]<RC[-1],RC[-3]>=12,RC[-3]<13),45,IF(AND(RC[-3]<RC[-1],RC[-3]>=13,RC[-3]<14),40,IF(AND(RC[-3]<RC[-1],RC[-3]>=14,RC[-3]<15),35,IF(AND(RC[-3]<RC[-1],RC[-3]>=15,RC[-3]<16),30,IF(AND(RC[-3]<RC[-1],RC[-3]>=16,RC[-3]<17),25,IF(AND(RC[-3]<RC[-1],RC[-3]>=17,RC[-3]<18),20,IF(AND(RC[-3]<RC[-1],RC[-3]>=18,RC[-3]<19),15,IF(AND(RC[-3]<RC[-1],RC[-3]>=19,RC[-3]<20),10,IF(AND(RC[-3]<RC[-1],RC[-3]>=20,RC[-3]<21),5,IF(AND(RC[-3]<RC[-1],RC[-3]>=21),0,IF(AND(RC[-3]>RC[-1],RC[-3]>=2,RC[-3]<3),90,IF(AND(RC[-3]>RC[-1],RC[-3]>=3,RC[-3]<4),90,IF(AND(RC[-3]>RC[-1],RC[-3]>=4,RC[-3]<5),80,IF(AND(RC[-3]>RC[-1],RC[-3]>=5,RC[-3]<6),70,IF(AND(RC[-3]>RC[-1],RC[-3]>=6,RC[-3]<7),60,IF(AND(RC[-3]>RC[-1],RC[-3]>=7,RC[-3]<8),50,IF(AND(RC[-3]>RC[-1],RC[-3]>=8,RC[-3]<9),40,IF(AND(RC[-3]>RC[-1],RC[-3]>=9,RC[-3]<10),30,IF(AND(RC[-3]>RC[-1],RC[-3]>=10,RC[-3]<11),20,IF(AND(RC[-3]>RC[-1],RC[-3]>=11,RC[-3]<12),10,IF(AND(RC[-3]>RC[-1],RC[-3]>=12),0))))))))))))))))))))))))))))))))) -> 0 | H234: =IF(RC[-3]="","",IF(RC[-3]<0.3,100,IF(AND(RC[-3]>=0.3,RC[-3]>0.4),95,IF(AND(RC[-3]>=0.4,RC[-3]<0.5),90,IF(AND(RC[-3]>=0.5,RC[-3]<0.6),85,IF(AND(RC[-3]>=0.6,RC[-3]<0.7),80,IF(AND(RC[-3]>=0.6,RC[-3]<1),80,IF(AND(RC[-3]>1,RC[-3]<2),50,IF(RC[-3]>2,0))))))))) ->  | I234: =IF(RC[-1]="",RC[-2],0.7*RC[-1]+0.3*RC[-2]) -> 0
A235: کابل تک | B235: بتک | C235: =VLOOKUP(RC[-1],Sheet1!R3C2:R802C3,2,FALSE) -> دستگاههای برقی | D235: =VLOOKUP(RC[-2],Sheet1!R3C2:R802C9,8,FALSE) -> 378.04681844013379 | E235: =IF(VLOOKUP(RC[-3],Sheet1!R3C2:R803C11,10,FALSE)=0,"",VLOOKUP(Sheet2!RC[-3],Sheet1!R[1]C[-3]:R[801]C[6],10,FALSE)) ->  | F235: =Sheet1!R258C10 -> 216.23137628876444 | G235: =IF(RC[-3]<0,0,IF(AND(RC[-3]<RC[-1],RC[-3]<2),100,IF(AND(RC[-3]<RC[-1],RC[-3]>=2,RC[-3]<3),95,IF(AND(RC[-3]<RC[-1],RC[-3]>=3,RC[-3]<4),90,IF(AND(RC[-3]<RC[-1],RC[-3]>=4,RC[-3]<5),85,IF(AND(RC[-3]<RC[-1],RC[-3]>=5,RC[-3]<6),80,IF(AND(RC[-3]<RC[-1],RC[-3]>=6,RC[-3]<7),75,IF(AND(RC[-3]<RC[-1],RC[-3]>=7,RC[-3]<8),70,IF(AND(RC[-3]<RC[-1],RC[-3]>=8,RC[-3]<9),65,IF(AND(RC[-3]<RC[-1],RC[-3]>=9,RC[-3]<10),60,IF(AND(RC[-3]<RC[-1],RC[-3]>=10,RC[-3]<11),55,IF(AND(RC[-3]<RC[-1],RC[-3]>=11,RC[-3]<12),50,IF(AND(RC[-3]<RC[-1],RC[-3]>=12,RC[-3]<13),45,IF(AND(RC[-3]<RC[-1],RC[-3]>=13,RC[-3]<14),40,IF(AND(RC[-3]<RC[-1],RC[-3]>=14,RC[-3]<15),35,IF(AND(RC[-3]<RC[-1],RC[-3]>=15,RC[-3]<16),30,IF(AND(RC[-3]<RC[-1],RC[-3]>=16,RC[-3]<17),25,IF(AND(RC[-3]<RC[-1],RC[-3]>=17,RC[-3]<18),20,IF(AND(RC[-3]<RC[-1],RC[-3]>=18,RC[-3]<19),15,IF(AND(RC[-3]<RC[-1],RC[-3]>=19,RC[-3]<20),10,IF(AND(RC[-3]<RC[-1],RC[-3]>=20,RC[-3]<21),5,IF(AND(RC[-3]<RC[-1],RC[-3]>=21),0,IF(AND(RC[-3]>RC[-1],RC[-3]>=2,RC[-3]<3),90,IF(AND(RC[-3]>RC[-1],RC[-3]>=3,RC[-3]<4),90,IF(AND(RC[-3]>RC[-1],RC[-3]>=4,RC[-3]<5),80,IF(AND(RC[-3]>RC[-1],RC[-3]>=5,RC[-3]<6),70,IF(AND(RC[-3]>RC[-1],RC[-3]>=6,RC[-3]<7),60,IF(AND(RC[-3]>RC[-1],RC[-3]>=7,RC[-3]<8),50,IF(AND(RC[-3]>RC[-1],RC[-3]>=8,RC[-3]<9),40,IF(AND(RC[-3]>RC[-1],RC[-3]>=9,RC[-3]<10),30,IF(AND(RC[-3]>RC[-1],RC[-3]>=10,RC[-3]<11),20,IF(AND(RC[-3]>RC[-1],RC[-3]>=11,RC[-3]<12),10,IF(AND(RC[-3]>RC[-1],RC[-3]>=12),0))))))))))))))))))))))))))))))))) -> 0 | H235: =IF(RC[-3]="","",IF(RC[-3]<0.3,100,IF(AND(RC[-3]>=0.3,RC[-3]>0.4),95,IF(AND(RC[-3]>=0.4,RC[-3]<0.5),90,IF(AND(RC[-3]>=0.5,RC[-3]<0.6),85,IF(AND(RC[-3]>=0.6,RC[-3]<0.7),80,IF(AND(RC[-3]>=0.6,RC[-3]<1),80,IF(AND(RC[-3]>1,RC[-3]<2),50,IF(RC[-3]>2,0))))))))) ->  | I235: =IF(RC[-1]="",RC[-2],0.7*RC[-1]+0.3*RC[-2]) -> 0
A236: کابلسازی ایران | B236: بایکا | C236: =VLOOKUP(RC[-1],Sheet1!R3C2:R802C3,2,FALSE) -> دستگاههای برقی | D236: =VLOOKUP(RC[-2],Sheet1!R3C2:R802C9,8,FALSE) -> 455.998880324975 | E236: =IF(VLOOKUP(RC[-3],Sheet1!R3C2:R803C11,10,FALSE)=0,"",VLOOKUP(Sheet2!RC[-3],Sheet1!R[1]C[-3]:R[801]C[6],10,FALSE)) ->  | F236: =Sheet1!R258C10 -> 216.23137628876444 | G236: =IF(RC[-3]<0,0,IF(AND(RC[-3]<RC[-1],RC[-3]<2),100,IF(AND(RC[-3]<RC[-1],RC[-3]>=2,RC[-3]<3),95,IF(AND(RC[-3]<RC[-1],RC[-3]>=3,RC[-3]<4),90,IF(AND(RC[-3]<RC[-1],RC[-3]>=4,RC[-3]<5),85,IF(AND(RC[-3]<RC[-1],RC[-3]>=5,RC[-3]<6),80,IF(AND(RC[-3]<RC[-1],RC[-3]>=6,RC[-3]<7),75,IF(AND(RC[-3]<RC[-1],RC[-3]>=7,RC[-3]<8),70,IF(AND(RC[-3]<RC[-1],RC[-3]>=8,RC[-3]<9),65,IF(AND(RC[-3]<RC[-1],RC[-3]>=9,RC[-3]<10),60,IF(AND(RC[-3]<RC[-1],RC[-3]>=10,RC[-3]<11),55,IF(AND(RC[-3]<RC[-1],RC[-3]>=11,RC[-3]<12),50,IF(AND(RC[-3]<RC[-1],RC[-3]>=12,RC[-3]<13),45,IF(AND(RC[-3]<RC[-1],RC[-3]>=13,RC[-3]<14),40,IF(AND(RC[-3]<RC[-1],RC[-3]>=14,RC[-3]<15),35,IF(AND(RC[-3]<RC[-1],RC[-3]>=15,RC[-3]<16),30,IF(AND(RC[-3]<RC[-1],RC[-3]>=16,RC[-3]<17),25,IF(AND(RC[-3]<RC[-1],RC[-3]>=17,RC[-3]<18),20,IF(AND(RC[-3]<RC[-1],RC[-3]>=18,RC[-3]<19),15,IF(AND(RC[-3]<RC[-1],RC[-3]>=19,RC[-3]<20),10,IF(AND(RC[-3]<RC[-1],RC[-3]>=20,RC[-3]<21),5,IF(AND(RC[-3]<RC[-1],RC[-3]>=21),0,IF(AND(RC[-3]>RC[-1],RC[-3]>=2,RC[-3]<3),90,IF(AND(RC[-3]>RC[-1],RC[-3]>=3,RC[-3]<4),90,IF(AND(RC[-3]>RC[-1],RC[-3]>=4,RC[-3]<5),80,IF(AND(RC[-3]>RC[-1],RC[-3]>=5,RC[-3]<6),70,IF(AND(RC[-3]>RC[-1],RC[-3]>=6,RC[-3]<7),60,IF(AND(RC[-3]>RC[-1],RC[-3]>=7,RC[-3]<8),50,IF(AND(RC[-3]>RC[-1],RC[-3]>=8,RC[-3]<9),40,IF(AND(RC[-3]>RC[-1],RC[-3]>=9,RC[-3]<10),30,IF(AND(RC[-3]>RC[-1],RC[-3]>=10,RC[-3]<11),20,IF(AND(RC[-3]>RC[-1],RC[-3]>=11,RC[-3]<12),10,IF(AND(RC[-3]>RC[-1],RC[-3]>=12),0))))))))))))))))))))))))))))))))) -> 0 | H236: =IF(RC[-3]="","",IF(RC[-3]<0.3,100,IF(AND(RC[-3]>=0.3,RC[-3]>0.4),95,IF(AND(RC[-3]>=0.4,RC[-3]<0.5),90,IF(AND(RC[-3]>=0.5,RC[-3]<0.6),85,IF(AND(RC[-3]>=0.6,RC[-3]<0.7),80,IF(AND(RC[-3]>=0.6,RC[-3]<1),80,IF(AND(RC[-3]>1,RC[-3]<2),50,IF(RC[-3]>2,0))))))))) ->  | I236: =IF(RC[-1]="",RC[-2],0.7*RC[-1]+0.3*RC[-2]) -> 0
A237: آسان پرداخت پرشین | B237: آپ | C237: =VLOOKUP(RC[-1],Sheet1!R3C2:R802C3,2,FALSE) -> رایانه | D237: =VLOOKUP(RC[-2],Sheet1!R3C2:R802C9,8,FALSE) -> 21.277287555851743 | E237: =IF(VLOOKUP(RC[-3],Sheet1!R3C2:R803C11,10,FALSE)=0,"",VLOOKUP(Sheet2!RC[-3],Sheet1!R[1]C[-3]:R[801]C[6],10,FALSE)) ->  | F237: =Sheet1!R276C10 -> 13.422868139420268 | G237: =IF(RC[-3]<0,0,IF(AND(RC[-3]<RC[-1],RC[-3]<2),100,IF(AND(RC[-3]<RC[-1],RC[-3]>=2,RC[-3]<3),95,IF(AND(RC[-3]<RC[-1],RC[-3]>=3,RC[-3]<4),90,IF(AND(RC[-3]<RC[-1],RC[-3]>=4,RC[-3]<5),85,IF(AND(RC[-3]<RC[-1],RC[-3]>=5,RC[-3]<6),80,IF(AND(RC[-3]<RC[-1],RC[-3]>=6,RC[-3]<7),75,IF(AND(RC[-3]<RC[-1],RC[-3]>=7,RC[-3]<8),70,IF(AND(RC[-3]<RC[-1],RC[-3]>=8,RC[-3]<9),65,IF(AND(RC[-3]<RC[-1],RC[-3]>=9,RC[-3]<10),60,IF(AND(RC[-3]<RC[-1],RC[-3]>=10,RC[-3]<11),55,IF(AND(RC[-3]<RC[-1],RC[-3]>=11,RC[-3]<12),50,IF(AND(RC[-3]<RC[-1],RC[-3]>=12,RC[-3]<13),45,IF(AND(RC[-3]<RC[-1],RC[-3]>=13,RC[-3]<14),40,IF(AND(RC[-3]<RC[-1],RC[-3]>=14,RC[-3]<15),35,IF(AND(RC[-3]<RC[-1],RC[-3]>=15,RC[-3]<16),30,IF(AND(RC[-3]<RC[-1],RC[-3]>=16,RC[-3]<17),25,IF(AND(RC[-3]<RC[-1],RC[-3]>=17,RC[-3]<18),20,IF(AND(RC[-3]<RC[-1],RC[-3]>=18,RC[-3]<19),15,IF(AND(RC[-3]<RC[-1],RC[-3]>=19,RC[-3]<20),10,IF(AND(RC[-3]<RC[-1],RC[-3]>=20,RC[-3]<21),5,IF(AND(RC[-3]<RC[-1],RC[-3]>=21),0,IF(AND(RC[-3]>RC[-1],RC[-3]>=2,RC[-3]<3),90,IF(AND(RC[-3]>RC[-1],RC[-3]>=3,RC[-3]<4),90,IF(AND(RC[-3]>RC[-1],RC[-3]>=4,RC[-3]<5),80,IF(AND(RC[-3]>RC[-1],RC[-3]>=5,RC[-3]<6),70,IF(AND(RC[-3]>RC[-1],RC[-3]>=6,RC[-3]<7),60,IF(AND(RC[-3]>RC[-1],RC[-3]>=7,RC[-3]<8),50,IF(AND(RC[-3]>RC[-1],RC[-3]>=8,RC[-3]<9),40,IF(AND(RC[-3]>RC[-1],RC[-3]>=9,RC[-3]<10),30,IF(AND(RC[-3]>RC[-1],RC[-3]>=10,RC[-3]<11),20,IF(AND(RC[-3]>RC[-1],RC[-3]>=11,RC[-3]<12),10,IF(AND(RC[-3]>RC[-1],RC[-3]>=12),0))))))))))))))))))))))))))))))))) -> 0 | H237: =IF(RC[-3]="","",IF(RC[-3]<0.3,100,IF(AND(RC[-3]>=0.3,RC[-3]>0.4),95,IF(AND(RC[-3]>=0.4,RC[-3]<0.5),90,IF(AND(RC[-3]>=0.5,RC[-3]<0.6),85,IF(AND(RC[-3]>=0.6,RC[-3]<0.7),80,IF(AND(RC[-3]>=0.6,RC[-3]<1),80,IF(AND(RC[-3]>1,RC[-3]<2),50,IF(RC[-3]>2,0))))))))) ->  | I237: =IF(RC[-1]="",RC[-2],0.7*RC[-1]+0.3*RC[-2]) -> 0
A238: افرانت | B238: افرا | C238: =VLOOKUP(RC[-1],Sheet1!R3C2:R802C3,2,FALSE) -> رایانه | D238: =VLOOKUP(RC[-2],Sheet1!R3C2:R802C9,8,FALSE) -> 14.403810961669143 | E238: =IF(VLOOKUP(RC[-3],Sheet1!R3C2:R803C11,10,FALSE)=0,"",VLOOKUP(Sheet2!RC[-3],Sheet1!R[1]C[-3]:R[801]C[6],10,FALSE)) ->  | F238: =Sheet1!R276C10 -> 13.422868139420268 | G238: =IF(RC[-3]<0,0,IF(AND(RC[-3]<RC[-1],RC[-3]<2),100,IF(AND(RC[-3]<RC[-1],RC[-3]>=2,RC[-3]<3),95,IF(AND(RC[-3]<RC[-1],RC[-3]>=3,RC[-3]<4),90,IF(AND(RC[-3]<RC[-1],RC[-3]>=4,RC[-3]<5),85,IF(AND(RC[-3]<RC[-1],RC[-3]>=5,RC[-3]<6),80,IF(AND(RC[-3]<RC[-1],RC[-3]>=6,RC[-3]<7),75,IF(AND(RC[-3]<RC[-1],RC[-3]>=7,RC[-3]<8),70,IF(AND(RC[-3]<RC[-1],RC[-3]>=8,RC[-3]<9),65,IF(AND(RC[-3]<RC[-1],RC[-3]>=9,RC[-3]<10),60,IF(AND(RC[-3]<RC[-1],RC[-3]>=10,RC[-3]<11),55,IF(AND(RC[-3]<RC[-1],RC[-3]>=11,RC[-3]<12),50,IF(AND(RC[-3]<RC[-1],RC[-3]>=12,RC[-3]<13),45,IF(AND(RC[-3]<RC[-1],RC[-3]>=13,RC[-3]<14),40,IF(AND(RC[-3]<RC[-1],RC[-3]>=14,RC[-3]<15),35,IF(AND(RC[-3]<RC[-1],RC[-3]>=15,RC[-3]<16),30,IF(AND(RC[-3]<RC[-1],RC[-3]>=16,RC[-3]<17),25,IF(AND(RC[-3]<RC[-1],RC[-3]>=17,RC[-3]<18),20,IF(AND(RC[-3]<RC[-1],RC[-3]>=18,RC[-3]<19),15,IF(AND(RC[-3]<RC[-1],RC[-3]>=19,RC[-3]<20),10,IF(AND(RC[-3]<RC[-1],RC[-3]>=20,RC[-3]<21),5,IF(AND(RC[-3]<RC[-1],RC[-3]>=21),0,IF(AND(RC[-3]>RC[-1],RC[-3]>=2,RC[-3]<3),90,IF(AND(RC[-3]>RC[-1],RC[-3]>=3,RC[-3]<4),90,IF(AND(RC[-3]>RC[-1],RC[-3]>=4,RC[-3]<5),80,IF(AND(RC[-3]>RC[-1],RC[-3]>=5,RC[-3]<6),70,IF(AND(RC[-3]>RC[-1],RC[-3]>=6,RC[-3]<7),60,IF(AND(RC[-3]>RC[-1],RC[-3]>=7,RC[-3]<8),50,IF(AND(RC[-3]>RC[-1],RC[-3]>=8,RC[-3]<9),40,IF(AND(RC[-3]>RC[-1],RC[-3]>=9,RC[-3]<10),30,IF(AND(RC[-3]>RC[-1],RC[-3]>=10,RC[-3]<11),20,IF(AND(RC[-3]>RC[-1],RC[-3]>=11,RC[-3]<12),10,IF(AND(RC[-3]>RC[-1],RC[-3]>=12),0))))))))))))))))))))))))))))))))) -> 0 | H238: =IF(RC[-3]="","",IF(RC[-3]<0.3,100,IF(AND(RC[-3]>=0.3,RC[-3]>0.4),95,IF(AND(RC[-3]>=0.4,RC[-3]<0.5),90,IF(AND(RC[-3]>=0.5,RC[-3]<0.6),85,IF(AND(RC[-3]>=0.6,RC[-3]<0.7),80,IF(AND(RC[-3]>=0.6,RC[-3]<1),80,IF(AND(RC[-3]>1,RC[-3]<2),50,IF(RC[-3]>2,0))))))))) ->  | I238: =IF(RC[-1]="",RC[-2],0.7*RC[-1]+0.3*RC[-2]) -> 0
A239: ایران ارقام | B239: مرقام | C239: =VLOOKUP(RC[-1],Sheet1!R3C2:R802C3,2,FALSE) -> رایانه | D239: =VLOOKUP(RC[-2],Sheet1!R3C2:R802C9,8,FALSE) -> -3.2391395154553049 | E239: =IF(VLOOKUP(RC[-3],Sheet1!R3C2:R803C11,10,FALSE)=0,"",VLOOKUP(Sheet2!RC[-3],Sheet1!R[1]C[-3]:R[801]C[6],10,FALSE)) ->  | F239: =Sheet1!R276C10 -> 13.422868139420268 | G239: =IF(RC[-3]<0,0,IF(AND(RC[-3]<RC[-1],RC[-3]<2),100,IF(AND(RC[-3]<RC[-1],RC[-3]>=2,RC[-3]<3),95,IF(AND(RC[-3]<RC[-1],RC[-3]>=3,RC[-3]<4),90,IF(AND(RC[-3]<RC[-1],RC[-3]>=4,RC[-3]<5),85,IF(AND(RC[-3]<RC[-1],RC[-3]>=5,RC[-3]<6),80,IF(AND(RC[-3]<RC[-1],RC[-3]>=6,RC[-3]<7),75,IF(AND(RC[-3]<RC[-1],RC[-3]>=7,RC[-3]<8),70,IF(AND(RC[-3]<RC[-1],RC[-3]>=8,RC[-3]<9),65,IF(AND(RC[-3]<RC[-1],RC[-3]>=9,RC[-3]<10),60,IF(AND(RC[-3]<RC[-1],RC[-3]>=10,RC[-3]<11),55,IF(AND(RC[-3]<RC[-1],RC[-3]>=11,RC[-3]<12),50,IF(AND(RC[-3]<RC[-1],RC[-3]>=12,RC[-3]<13),45,IF(AND(RC[-3]<RC[-1],RC[-3]>=13,RC[-3]<14),40,IF(AND(RC[-3]<RC[-1],RC[-3]>=14,RC[-3]<15),35,IF(AND(RC[-3]<RC[-1],RC[-3]>=15,RC[-3]<16),30,IF(AND(RC[-3]<RC[-1],RC[-3]>=16,RC[-3]<17),25,IF(AND(RC[-3]<RC[-1],RC[-3]>=17,RC[-3]<18),20,IF(AND(RC[-3]<RC[-1],RC[-3]>=18,RC[-3]<19),15,IF(AND(RC[-3]<RC[-1],RC[-3]>=19,RC[-3]<20),10,IF(AND(RC[-3]<RC[-1],RC[-3]>=20,RC[-3]<21),5,IF(AND(RC[-3]<RC[-1],RC[-3]>=21),0,IF(AND(RC[-3]>RC[-1],RC[-3]>=2,RC[-3]<3),90,IF(AND(RC[-3]>RC[-1],RC[-3]>=3,RC[-3]<4),90,IF(AND(RC[-3]>RC[-1],RC[-3]>=4,RC[-3]<5),80,IF(AND(RC[-3]>RC[-1],RC[-3]>=5,RC[-3]<6),70,IF(AND(RC[-3]>RC[-1],RC[-3]>=6,RC[-3]<7),60,IF(AND(RC[-3]>RC[-1],RC[-3]>=7,RC[-3]<8),50,IF(AND(RC[-3]>RC[-1],RC[-3]>=8,RC[-3]<9),40,IF(AND(RC[-3]>RC[-1],RC[-3]>=9,RC[-3]<10),30,IF(AND(RC[-3]>RC[-1],RC[-3]>=10,RC[-3]<11),20,IF(AND(RC[-3]>RC[-1],RC[-3]>=11,RC[-3]<12),10,IF(AND(RC[-3]>RC[-1],RC[-3]>=12),0))))))))))))))))))))))))))))))))) -> 0 | H239: =IF(RC[-3]="","",IF(RC[-3]<0.3,100,IF(AND(RC[-3]>=0.3,RC[-3]>0.4),95,IF(AND(RC[-3]>=0.4,RC[-3]<0.5),90,IF(AND(RC[-3]>=0.5,RC[-3]<0.6),85,IF(AND(RC[-3]>=0.6,RC[-3]<0.7),80,IF(AND(RC[-3]>=0.6,RC[-3]<1),80,IF(AND(RC[-3]>1,RC[-3]<2),50,IF(RC[-3]>2,0))))))))) ->  | I239: =IF(RC[-1]="",RC[-2],0.7*RC[-1]+0.3*RC[-2]) -> 0
A240: به پرداخت ملت | B240: پرداخت | C240: =VLOOKUP(RC[-1],Sheet1!R3C2:R802C3,2,FALSE) -> رایانه | D240: =VLOOKUP(RC[-2],Sheet1!R3C2:R802C9,8,FALSE) -> 14.340271265567839 | E240: =IF(VLOOKUP(RC[-3],Sheet1!R3C2:R803C11,10,FALSE)=0,"",VLOOKUP(Sheet2!RC[-3],Sheet1!R[1]C[-3]:R[801]C[6],10,FALSE)) ->  | F240: =Sheet1!R276C10 -> 13.422868139420268 | G240: =IF(RC[-3]<0,0,IF(AND(RC[-3]<RC[-1],RC[-3]<2),100,IF(AND(RC[-3]<RC[-1],RC[-3]>=2,RC[-3]<3),95,IF(AND(RC[-3]<RC[-1],RC[-3]>=3,RC[-3]<4),90,IF(AND(RC[-3]<RC[-1],RC[-3]>=4,RC[-3]<5),85,IF(AND(RC[-3]<RC[-1],RC[-3]>=5,RC[-3]<6),80,IF(AND(RC[-3]<RC[-1],RC[-3]>=6,RC[-3]<7),75,IF(AND(RC[-3]<RC[-1],RC[-3]>=7,RC[-3]<8),70,IF(AND(RC[-3]<RC[-1],RC[-3]>=8,RC[-3]<9),65,IF(AND(RC[-3]<RC[-1],RC[-3]>=9,RC[-3]<10),60,IF(AND(RC[-3]<RC[-1],RC[-3]>=10,RC[-3]<11),55,IF(AND(RC[-3]<RC[-1],RC[-3]>=11,RC[-3]<12),50,IF(AND(RC[-3]<RC[-1],RC[-3]>=12,RC[-3]<13),45,IF(AND(RC[-3]<RC[-1],RC[-3]>=13,RC[-3]<14),40,IF(AND(RC[-3]<RC[-1],RC[-3]>=14,RC[-3]<15),35,IF(AND(RC[-3]<RC[-1],RC[-3]>=15,RC[-3]<16),30,IF(AND(RC[-3]<RC[-1],RC[-3]>=16,RC[-3]<17),25,IF(AND(RC[-3]<RC[-1],RC[-3]>=17,RC[-3]<18),20,IF(AND(RC[-3]<RC[-1],RC[-3]>=18,RC[-3]<19),15,IF(AND(RC[-3]<RC[-1],RC[-3]>=19,RC[-3]<20),10,IF(AND(RC[-3]<RC[-1],RC[-3]>=20,RC[-3]<21),5,IF(AND(RC[-3]<RC[-1],RC[-3]>=21),0,IF(AND(RC[-3]>RC[-1],RC[-3]>=2,RC[-3]<3),90,IF(AND(RC[-3]>RC[-1],RC[-3]>=3,RC[-3]<4),90,IF(AND(RC[-3]>RC[-1],RC[-3]>=4,RC[-3]<5),80,IF(AND(RC[-3]>RC[-1],RC[-3]>=5,RC[-3]<6),70,IF(AND(RC[-3]>RC[-1],RC[-3]>=6,RC[-3]<7),60,IF(AND(RC[-3]>RC[-1],RC[-3]>=7,RC[-3]<8),50,IF(AND(RC[-3]>RC[-1],RC[-3]>=8,RC[-3]<9),40,IF(AND(RC[-3]>RC[-1],RC[-3]>=9,RC[-3]<10),30,IF(AND(RC[-3]>RC[-1],RC[-3]>=10,RC[-3]<11),20,IF(AND(RC[-3]>RC[-1],RC[-3]>=11,RC[-3]<12),10,IF(AND(RC[-3]>RC[-1],RC[-3]>=12),0))))))))))))))))))))))))))))))))) -> 0 | H240: =IF(RC[-3]="","",IF(RC[-3]<0.3,100,IF(AND(RC[-3]>=0.3,RC[-3]>0.4),95,IF(AND(RC[-3]>=0.4,RC[-3]<0.5),90,IF(AND(RC[-3]>=0.5,RC[-3]<0.6),85,IF(AND(RC[-3]>=0.6,RC[-3]<0.7),80,IF(AND(RC[-3]>=0.6,RC[-3]<1),80,IF(AND(RC[-3]>1,RC[-3]<2),50,IF(RC[-3]>2,0))))))))) ->  | I240: =IF(RC[-1]="",RC[-2],0.7*RC[-1]+0.3*RC[-2]) -> 0
A241: پرداخت الکترونیک سامان کیش | B241: سپ | C241: =VLOOKUP(RC[-1],Sheet1!R3C2:R802C3,2,FALSE) -> رایانه | D241: =VLOOKUP(RC[-2],Sheet1!R3C2:R802C9,8,FALSE) -> 24.430220168984906 | E241: =IF(VLOOKUP(RC[-3],Sheet1!R3C2:R803C11,10,FALSE)=0,"",VLOOKUP(Sheet2!RC[-3],Sheet1!R[1]C[-3]:R[801]C[6],10,FALSE)) ->  | F241: =Sheet1!R276C10 -> 13.422868139420268 | G241: =IF(RC[-3]<0,0,IF(AND(RC[-3]<RC[-1],RC[-3]<2),100,IF(AND(RC[-3]<RC[-1],RC[-3]>=2,RC[-3]<3),95,IF(AND(RC[-3]<RC[-1],RC[-3]>=3,RC[-3]<4),90,IF(AND(RC[-3]<RC[-1],RC[-3]>=4,RC[-3]<5),85,IF(AND(RC[-3]<RC[-1],RC[-3]>=5,RC[-3]<6),80,IF(AND(RC[-3]<RC[-1],RC[-3]>=6,RC[-3]<7),75,IF(AND(RC[-3]<RC[-1],RC[-3]>=7,RC[-3]<8),70,IF(AND(RC[-3]<RC[-1],RC[-3]>=8,RC[-3]<9),65,IF(AND(RC[-3]<RC[-1],RC[-3]>=9,RC[-3]<10),60,IF(AND(RC[-3]<RC[-1],RC[-3]>=10,RC[-3]<11),55,IF(AND(RC[-3]<RC[-1],RC[-3]>=11,RC[-3]<12),50,IF(AND(RC[-3]<RC[-1],RC[-3]>=12,RC[-3]<13),45,IF(AND(RC[-3]<RC[-1],RC[-3]>=13,RC[-3]<14),40,IF(AND(RC[-3]<RC[-1],RC[-3]>=14,RC[-3]<15),35,IF(AND(RC[-3]<RC[-1],RC[-3]>=15,RC[-3]<16),30,IF(AND(RC[-3]<RC[-1],RC[-3]>=16,RC[-3]<17),25,IF(AND(RC[-3]<RC[-1],RC[-3]>=17,RC[-3]<18),20,IF(AND(RC[-3]<RC[-1],RC[-3]>=18,RC[-3]<19),15,IF(AND(RC[-3]<RC[-1],RC[-3]>=19,RC[-3]<20),10,IF(AND(RC[-3]<RC[-1],RC[-3]>=20,RC[-3]<21),5,IF(AND(RC[-3]<RC[-1],RC[-3]>=21),0,IF(AND(RC[-3]>RC[-1],RC[-3]>=2,RC[-3]<3),90,IF(AND(RC[-3]>RC[-1],RC[-3]>=3,RC[-3]<4),90,IF(AND(RC[-3]>RC[-1],RC[-3]>=4,RC[-3]<5),80,IF(AND(RC[-3]>RC[-1],RC[-3]>=5,RC[-3]<6),70,IF(AND(RC[-3]>RC[-1],RC[-3]>=6,RC[-3]<7),60,IF(AND(RC[-3]>RC[-1],RC[-3]>=7,RC[-3]<8),50,IF(AND(RC[-3]>RC[-1],RC[-3]>=8,RC[-3]<9),40,IF(AND(RC[-3]>RC[-1],RC[-3]>=9,RC[-3]<10),30,IF(AND(RC[-3]>RC[-1],RC[-3]>=10,RC[-3]<11),20,IF(AND(RC[-3]>RC[-1],RC[-3]>=11,RC[-3]<12),10,IF(AND(RC[-3]>RC[-1],RC[-3]>=12),0))))))))))))))))))))))))))))))))) -> 0 | H241: =IF(RC[-3]="","",IF(RC[-3]<0.3,100,IF(AND(RC[-3]>=0.3,RC[-3]>0.4),95,IF(AND(RC[-3]>=0.4,RC[-3]<0.5),90,IF(AND(RC[-3]>=0.5,RC[-3]<0.6),85,IF(AND(RC[-3]>=0.6,RC[-3]<0.7),80,IF(AND(RC[-3]>=0.6,RC[-3]<1),80,IF(AND(RC[-3]>1,RC[-3]<2),50,IF(RC[-3]>2,0))))))))) ->  | I241: =IF(RC[-1]="",RC[-2],0.7*RC[-1]+0.3*RC[-2]) -> 0
A242: پیشگامان فن آوری و دانش آرامیس | B242: تپسی | C242: =VLOOKUP(RC[-1],Sheet1!R3C2:R802C3,2,FALSE) -> رایانه | D242: =VLOOKUP(RC[-2],Sheet1!R3C2:R802C9,8,FALSE) -> 16.658124547701593 | E242: =IF(VLOOKUP(RC[-3],Sheet1!R3C2:R803C11,10,FALSE)=0,"",VLOOKUP(Sheet2!RC[-3],Sheet1!R[1]C[-3]:R[801]C[6],10,FALSE)) ->  | F242: =Sheet1!R276C10 -> 13.422868139420268 | G242: =IF(RC[-3]<0,0,IF(AND(RC[-3]<RC[-1],RC[-3]<2),100,IF(AND(RC[-3]<RC[-1],RC[-3]>=2,RC[-3]<3),95,IF(AND(RC[-3]<RC[-1],RC[-3]>=3,RC[-3]<4),90,IF(AND(RC[-3]<RC[-1],RC[-3]>=4,RC[-3]<5),85,IF(AND(RC[-3]<RC[-1],RC[-3]>=5,RC[-3]<6),80,IF(AND(RC[-3]<RC[-1],RC[-3]>=6,RC[-3]<7),75,IF(AND(RC[-3]<RC[-1],RC[-3]>=7,RC[-3]<8),70,IF(AND(RC[-3]<RC[-1],RC[-3]>=8,RC[-3]<9),65,IF(AND(RC[-3]<RC[-1],RC[-3]>=9,RC[-3]<10),60,IF(AND(RC[-3]<RC[-1],RC[-3]>=10,RC[-3]<11),55,IF(AND(RC[-3]<RC[-1],RC[-3]>=11,RC[-3]<12),50,IF(AND(RC[-3]<RC[-1],RC[-3]>=12,RC[-3]<13),45,IF(AND(RC[-3]<RC[-1],RC[-3]>=13,RC[-3]<14),40,IF(AND(RC[-3]<RC[-1],RC[-3]>=14,RC[-3]<15),35,IF(AND(RC[-3]<RC[-1],RC[-3]>=15,RC[-3]<16),30,IF(AND(RC[-3]<RC[-1],RC[-3]>=16,RC[-3]<17),25,IF(AND(RC[-3]<RC[-1],RC[-3]>=17,RC[-3]<18),20,IF(AND(RC[-3]<RC[-1],RC[-3]>=18,RC[-3]<19),15,IF(AND(RC[-3]<RC[-1],RC[-3]>=19,RC[-3]<20),10,IF(AND(RC[-3]<RC[-1],RC[-3]>=20,RC[-3]<21),5,IF(AND(RC[-3]<RC[-1],RC[-3]>=21),0,IF(AND(RC[-3]>RC[-1],RC[-3]>=2,RC[-3]<3),90,IF(AND(RC[-3]>RC[-1],RC[-3]>=3,RC[-3]<4),90,IF(AND(RC[-3]>RC[-1],RC[-3]>=4,RC[-3]<5),80,IF(AND(RC[-3]>RC[-1],RC[-3]>=5,RC[-3]<6),70,IF(AND(RC[-3]>RC[-1],RC[-3]>=6,RC[-3]<7),60,IF(AND(RC[-3]>RC[-1],RC[-3]>=7,RC[-3]<8),50,IF(AND(RC[-3]>RC[-1],RC[-3]>=8,RC[-3]<9),40,IF(AND(RC[-3]>RC[-1],RC[-3]>=9,RC[-3]<10),30,IF(AND(RC[-3]>RC[-1],RC[-3]>=10,RC[-3]<11),20,IF(AND(RC[-3]>RC[-1],RC[-3]>=11,RC[-3]<12),10,IF(AND(RC[-3]>RC[-1],RC[-3]>=12),0))))))))))))))))))))))))))))))))) -> 0 | H242: =IF(RC[-3]="","",IF(RC[-3]<0.3,100,IF(AND(RC[-3]>=0.3,RC[-3]>0.4),95,IF(AND(RC[-3]>=0.4,RC[-3]<0.5),90,IF(AND(RC[-3]>=0.5,RC[-3]<0.6),85,IF(AND(RC[-3]>=0.6,RC[-3]<0.7),80,IF(AND(RC[-3]>=0.6,RC[-3]<1),80,IF(AND(RC[-3]>1,RC[-3]<2),50,IF(RC[-3]>2,0))))))))) ->  | I242: =IF(RC[-1]="",RC[-2],0.7*RC[-1]+0.3*RC[-2]) -> 0
A243: تجارت الکترونیک پارسیان | B243: رتاپ | C243: =VLOOKUP(RC[-1],Sheet1!R3C2:R802C3,2,FALSE) -> رایانه | D243: =VLOOKUP(RC[-2],Sheet1!R3C2:R802C9,8,FALSE) -> 4.8446182573998939 | E243: =IF(VLOOKUP(RC[-3],Sheet1!R3C2:R803C11,10,FALSE)=0,"",VLOOKUP(Sheet2!RC[-3],Sheet1!R[1]C[-3]:R[801]C[6],10,FALSE)) ->  | F243: =Sheet1!R276C10 -> 13.422868139420268 | G243: =IF(RC[-3]<0,0,IF(AND(RC[-3]<RC[-1],RC[-3]<2),100,IF(AND(RC[-3]<RC[-1],RC[-3]>=2,RC[-3]<3),95,IF(AND(RC[-3]<RC[-1],RC[-3]>=3,RC[-3]<4),90,IF(AND(RC[-3]<RC[-1],RC[-3]>=4,RC[-3]<5),85,IF(AND(RC[-3]<RC[-1],RC[-3]>=5,RC[-3]<6),80,IF(AND(RC[-3]<RC[-1],RC[-3]>=6,RC[-3]<7),75,IF(AND(RC[-3]<RC[-1],RC[-3]>=7,RC[-3]<8),70,IF(AND(RC[-3]<RC[-1],RC[-3]>=8,RC[-3]<9),65,IF(AND(RC[-3]<RC[-1],RC[-3]>=9,RC[-3]<10),60,IF(AND(RC[-3]<RC[-1],RC[-3]>=10,RC[-3]<11),55,IF(AND(RC[-3]<RC[-1],RC[-3]>=11,RC[-3]<12),50,IF(AND(RC[-3]<RC[-1],RC[-3]>=12,RC[-3]<13),45,IF(AND(RC[-3]<RC[-1],RC[-3]>=13,RC[-3]<14),40,IF(AND(RC[-3]<RC[-1],RC[-3]>=14,RC[-3]<15),35,IF(AND(RC[-3]<RC[-1],RC[-3]>=15,RC[-3]<16),30,IF(AND(RC[-3]<RC[-1],RC[-3]>=16,RC[-3]<17),25,IF(AND(RC[-3]<RC[-1],RC[-3]>=17,RC[-3]<18),20,IF(AND(RC[-3]<RC[-1],RC[-3]>=18,RC[-3]<19),15,IF(AND(RC[-3]<RC[-1],RC[-3]>=19,RC[-3]<20),10,IF(AND(RC[-3]<RC[-1],RC[-3]>=20,RC[-3]<21),5,IF(AND(RC[-3]<RC[-1],RC[-3]>=21),0,IF(AND(RC[-3]>RC[-1],RC[-3]>=2,RC[-3]<3),90,IF(AND(RC[-3]>RC[-1],RC[-3]>=3,RC[-3]<4),90,IF(AND(RC[-3]>RC[-1],RC[-3]>=4,RC[-3]<5),80,IF(AND(RC[-3]>RC[-1],RC[-3]>=5,RC[-3]<6),70,IF(AND(RC[-3]>RC[-1],RC[-3]>=6,RC[-3]<7),60,IF(AND(RC[-3]>RC[-1],RC[-3]>=7,RC[-3]<8),50,IF(AND(RC[-3]>RC[-1],RC[-3]>=8,RC[-3]<9),40,IF(AND(RC[-3]>RC[-1],RC[-3]>=9,RC[-3]<10),30,IF(AND(RC[-3]>RC[-1],RC[-3]>=10,RC[-3]<11),20,IF(AND(RC[-3]>RC[-1],RC[-3]>=11,RC[-3]<12),10,IF(AND(RC[-3]>RC[-1],RC[-3]>=12),0))))))))))))))))))))))))))))))))) -> 85 | H243: =IF(RC[-3]="","",IF(RC[-3]<0.3,100,IF(AND(RC[-3]>=0.3,RC[-3]>0.4),95,IF(AND(RC[-3]>=0.4,RC[-3]<0.5),90,IF(AND(RC[-3]>=0.5,RC[-3]<0.6),85,IF(AND(RC[-3]>=0.6,RC[-3]<0.7),80,IF(AND(RC[-3]>=0.6,RC[-3]<1),80,IF(AND(RC[-3]>1,RC[-3]<2),50,IF(RC[-3]>2,0))))))))) ->  | I243: =IF(RC[-1]="",RC[-2],0.7*RC[-1]+0.3*RC[-2]) -> 85
A244: تجارت الکترونیک پارسیان کیش | B244: تاپکیش | C244: =VLOOKUP(RC[-1],Sheet1!R3C2:R802C3,2,FALSE) -> رایانه | D244: =VLOOKUP(RC[-2],Sheet1!R3C2:R802C9,8,FALSE) -> 20.911936083547268 | E244: =IF(VLOOKUP(RC[-3],Sheet1!R3C2:R803C11,10,FALSE)=0,"",VLOOKUP(Sheet2!RC[-3],Sheet1!R[1]C[-3]:R[801]C[6],10,FALSE)) ->  | F244: =Sheet1!R276C10 -> 13.422868139420268 | G244: =IF(RC[-3]<0,0,IF(AND(RC[-3]<RC[-1],RC[-3]<2),100,IF(AND(RC[-3]<RC[-1],RC[-3]>=2,RC[-3]<3),95,IF(AND(RC[-3]<RC[-1],RC[-3]>=3,RC[-3]<4),90,IF(AND(RC[-3]<RC[-1],RC[-3]>=4,RC[-3]<5),85,IF(AND(RC[-3]<RC[-1],RC[-3]>=5,RC[-3]<6),80,IF(AND(RC[-3]<RC[-1],RC[-3]>=6,RC[-3]<7),75,IF(AND(RC[-3]<RC[-1],RC[-3]>=7,RC[-3]<8),70,IF(AND(RC[-3]<RC[-1],RC[-3]>=8,RC[-3]<9),65,IF(AND(RC[-3]<RC[-1],RC[-3]>=9,RC[-3]<10),60,IF(AND(RC[-3]<RC[-1],RC[-3]>=10,RC[-3]<11),55,IF(AND(RC[-3]<RC[-1],RC[-3]>=11,RC[-3]<12),50,IF(AND(RC[-3]<RC[-1],RC[-3]>=12,RC[-3]<13),45,IF(AND(RC[-3]<RC[-1],RC[-3]>=13,RC[-3]<14),40,IF(AND(RC[-3]<RC[-1],RC[-3]>=14,RC[-3]<15),35,IF(AND(RC[-3]<RC[-1],RC[-3]>=15,RC[-3]<16),30,IF(AND(RC[-3]<RC[-1],RC[-3]>=16,RC[-3]<17),25,IF(AND(RC[-3]<RC[-1],RC[-3]>=17,RC[-3]<18),20,IF(AND(RC[-3]<RC[-1],RC[-3]>=18,RC[-3]<19),15,IF(AND(RC[-3]<RC[-1],RC[-3]>=19,RC[-3]<20),10,IF(AND(RC[-3]<RC[-1],RC[-3]>=20,RC[-3]<21),5,IF(AND(RC[-3]<RC[-1],RC[-3]>=21),0,IF(AND(RC[-3]>RC[-1],RC[-3]>=2,RC[-3]<3),90,IF(AND(RC[-3]>RC[-1],RC[-3]>=3,RC[-3]<4),90,IF(AND(RC[-3]>RC[-1],RC[-3]>=4,RC[-3]<5),80,IF(AND(RC[-3]>RC[-1],RC[-3]>=5,RC[-3]<6),70,IF(AND(RC[-3]>RC[-1],RC[-3]>=6,RC[-3]<7),60,IF(AND(RC[-3]>RC[-1],RC[-3]>=7,RC[-3]<8),50,IF(AND(RC[-3]>RC[-1],RC[-3]>=8,RC[-3]<9),40,IF(AND(RC[-3]>RC[-1],RC[-3]>=9,RC[-3]<10),30,IF(AND(RC[-3]>RC[-1],RC[-3]>=10,RC[-3]<11),20,IF(AND(RC[-3]>RC[-1],RC[-3]>=11,RC[-3]<12),10,IF(AND(RC[-3]>RC[-1],RC[-3]>=12),0))))))))))))))))))))))))))))))))) -> 0 | H244: =IF(RC[-3]="","",IF(RC[-3]<0.3,100,IF(AND(RC[-3]>=0.3,RC[-3]>0.4),95,IF(AND(RC[-3]>=0.4,RC[-3]<0.5),90,IF(AND(RC[-3]>=0.5,RC[-3]<0.6),85,IF(AND(RC[-3]>=0.6,RC[-3]<0.7),80,IF(AND(RC[-3]>=0.6,RC[-3]<1),80,IF(AND(RC[-3]>1,RC[-3]<2),50,IF(RC[-3]>2,0))))))))) ->  | I244: =IF(RC[-1]="",RC[-2],0.7*RC[-1]+0.3*RC[-2]) -> 0
A245: توسعه فناوری اطلاعات خوارزمی | B245: مفاخر | C245: =VLOOKUP(RC[-1],Sheet1!R3C2:R802C3,2,FALSE) -> رایانه | D245: =VLOOKUP(RC[-2],Sheet1!R3C2:R802C9,8,FALSE) -> 19.154106146368221 | E245: =IF(VLOOKUP(RC[-3],Sheet1!R3C2:R803C11,10,FALSE)=0,"",VLOOKUP(Sheet2!RC[-3],Sheet1!R[1]C[-3]:R[801]C[6],10,FALSE)) ->  | F245: =Sheet1!R276C10 -> 13.422868139420268 | G245: =IF(RC[-3]<0,0,IF(AND(RC[-3]<RC[-1],RC[-3]<2),100,IF(AND(RC[-3]<RC[-1],RC[-3]>=2,RC[-3]<3),95,IF(AND(RC[-3]<RC[-1],RC[-3]>=3,RC[-3]<4),90,IF(AND(RC[-3]<RC[-1],RC[-3]>=4,RC[-3]<5),85,IF(AND(RC[-3]<RC[-1],RC[-3]>=5,RC[-3]<6),80,IF(AND(RC[-3]<RC[-1],RC[-3]>=6,RC[-3]<7),75,IF(AND(RC[-3]<RC[-1],RC[-3]>=7,RC[-3]<8),70,IF(AND(RC[-3]<RC[-1],RC[-3]>=8,RC[-3]<9),65,IF(AND(RC[-3]<RC[-1],RC[-3]>=9,RC[-3]<10),60,IF(AND(RC[-3]<RC[-1],RC[-3]>=10,RC[-3]<11),55,IF(AND(RC[-3]<RC[-1],RC[-3]>=11,RC[-3]<12),50,IF(AND(RC[-3]<RC[-1],RC[-3]>=12,RC[-3]<13),45,IF(AND(RC[-3]<RC[-1],RC[-3]>=13,RC[-3]<14),40,IF(AND(RC[-3]<RC[-1],RC[-3]>=14,RC[-3]<15),35,IF(AND(RC[-3]<RC[-1],RC[-3]>=15,RC[-3]<16),30,IF(AND(RC[-3]<RC[-1],RC[-3]>=16,RC[-3]<17),25,IF(AND(RC[-3]<RC[-1],RC[-3]>=17,RC[-3]<18),20,IF(AND(RC[-3]<RC[-1],RC[-3]>=18,RC[-3]<19),15,IF(AND(RC[-3]<RC[-1],RC[-3]>=19,RC[-3]<20),10,IF(AND(RC[-3]<RC[-1],RC[-3]>=20,RC[-3]<21),5,IF(AND(RC[-3]<RC[-1],RC[-3]>=21),0,IF(AND(RC[-3]>RC[-1],RC[-3]>=2,RC[-3]<3),90,IF(AND(RC[-3]>RC[-1],RC[-3]>=3,RC[-3]<4),90,IF(AND(RC[-3]>RC[-1],RC[-3]>=4,RC[-3]<5),80,IF(AND(RC[-3]>RC[-1],RC[-3]>=5,RC[-3]<6),70,IF(AND(RC[-3]>RC[-1],RC[-3]>=6,RC[-3]<7),60,IF(AND(RC[-3]>RC[-1],RC[-3]>=7,RC[-3]<8),50,IF(AND(RC[-3]>RC[-1],RC[-3]>=8,RC[-3]<9),40,IF(AND(RC[-3]>RC[-1],RC[-3]>=9,RC[-3]<10),30,IF(AND(RC[-3]>RC[-1],RC[-3]>=10,RC[-3]<11),20,IF(AND(RC[-3]>RC[-1],RC[-3]>=11,RC[-3]<12),10,IF(AND(RC[-3]>RC[-1],RC[-3]>=12),0))))))))))))))))))))))))))))))))) -> 0 | H245: =IF(RC[-3]="","",IF(RC[-3]<0.3,100,IF(AND(RC[-3]>=0.3,RC[-3]>0.4),95,IF(AND(RC[-3]>=0.4,RC[-3]<0.5),90,IF(AND(RC[-3]>=0.5,RC[-3]<0.6),85,IF(AND(RC[-3]>=0.6,RC[-3]<0.7),80,IF(AND(RC[-3]>=0.6,RC[-3]<1),80,IF(AND(RC[-3]>1,RC[-3]<2),50,IF(RC[-3]>2,0))))))))) ->  | I245: =IF(RC[-1]="",RC[-2],0.7*RC[-1]+0.3*RC[-2]) -> 0
A246: خدمات انفورماتیک | B246: رانفور | C246: =VLOOKUP(RC[-1],Sheet1!R3C2:R802C3,2,FALSE) -> رایانه | D246: =VLOOKUP(RC[-2],Sheet1!R3C2:R802C9,8,FALSE) -> 6.6071400333581822 | E246: =IF(VLOOKUP(RC[-3],Sheet1!R3C2:R803C11,10,FALSE)=0,"",VLOOKUP(Sheet2!RC[-3],Sheet1!R[1]C[-3]:R[801]C[6],10,FALSE)) ->  | F246: =Sheet1!R276C10 -> 13.422868139420268 | G246: =IF(RC[-3]<0,0,IF(AND(RC[-3]<RC[-1],RC[-3]<2),100,IF(AND(RC[-3]<RC[-1],RC[-3]>=2,RC[-3]<3),95,IF(AND(RC[-3]<RC[-1],RC[-3]>=3,RC[-3]<4),90,IF(AND(RC[-3]<RC[-1],RC[-3]>=4,RC[-3]<5),85,IF(AND(RC[-3]<RC[-1],RC[-3]>=5,RC[-3]<6),80,IF(AND(RC[-3]<RC[-1],RC[-3]>=6,RC[-3]<7),75,IF(AND(RC[-3]<RC[-1],RC[-3]>=7,RC[-3]<8),70,IF(AND(RC[-3]<RC[-1],RC[-3]>=8,RC[-3]<9),65,IF(AND(RC[-3]<RC[-1],RC[-3]>=9,RC[-3]<10),60,IF(AND(RC[-3]<RC[-1],RC[-3]>=10,RC[-3]<11),55,IF(AND(RC[-3]<RC[-1],RC[-3]>=11,RC[-3]<12),50,IF(AND(RC[-3]<RC[-1],RC[-3]>=12,RC[-3]<13),45,IF(AND(RC[-3]<RC[-1],RC[-3]>=13,RC[-3]<14),40,IF(AND(RC[-3]<RC[-1],RC[-3]>=14,RC[-3]<15),35,IF(AND(RC[-3]<RC[-1],RC[-3]>=15,RC[-3]<16),30,IF(AND(RC[-3]<RC[-1],RC[-3]>=16,RC[-3]<17),25,IF(AND(RC[-3]<RC[-1],RC[-3]>=17,RC[-3]<18),20,IF(AND(RC[-3]<RC[-1],RC[-3]>=18,RC[-3]<19),15,IF(AND(RC[-3]<RC[-1],RC[-3]>=19,RC[-3]<20),10,IF(AND(RC[-3]<RC[-1],RC[-3]>=20,RC[-3]<21),5,IF(AND(RC[-3]<RC[-1],RC[-3]>=21),0,IF(AND(RC[-3]>RC[-1],RC[-3]>=2,RC[-3]<3),90,IF(AND(RC[-3]>RC[-1],RC[-3]>=3,RC[-3]<4),90,IF(AND(RC[-3]>RC[-1],RC[-3]>=4,RC[-3]<5),80,IF(AND(RC[-3]>RC[-1],RC[-3]>=5,RC[-3]<6),70,IF(AND(RC[-3]>RC[-1],RC[-3]>=6,RC[-3]<7),60,IF(AND(RC[-3]>RC[-1],RC[-3]>=7,RC[-3]<8),50,IF(AND(RC[-3]>RC[-1],RC[-3]>=8,RC[-3]<9),40,IF(AND(RC[-3]>RC[-1],RC[-3]>=9,RC[-3]<10),30,IF(AND(RC[-3]>RC[-1],RC[-3]>=10,RC[-3]<11),20,IF(AND(RC[-3]>RC[-1],RC[-3]>=11,RC[-3]<12),10,IF(AND(RC[-3]>RC[-1],RC[-3]>=12),0))))))))))))))))))))))))))))))))) -> 75 | H246: =IF(RC[-3]="","",IF(RC[-3]<0.3,100,IF(AND(RC[-3]>=0.3,RC[-3]>0.4),95,IF(AND(RC[-3]>=0.4,RC[-3]<0.5),90,IF(AND(RC[-3]>=0.5,RC[-3]<0.6),85,IF(AND(RC[-3]>=0.6,RC[-3]<0.7),80,IF(AND(RC[-3]>=0.6,RC[-3]<1),80,IF(AND(RC[-3]>1,RC[-3]<2),50,IF(RC[-3]>2,0))))))))) ->  | I246: =IF(RC[-1]="",RC[-2],0.7*RC[-1]+0.3*RC[-2]) -> 75
A247: داده پردازی ایران | B247: مداران | C247: =VLOOKUP(RC[-1],Sheet1!R3C2:R802C3,2,FALSE) -> رایانه | D247: =VLOOKUP(RC[-2],Sheet1!R3C2:R802C9,8,FALSE) -> 5.0963552904967857 | E247: =IF(VLOOKUP(RC[-3],Sheet1!R3C2:R803C11,10,FALSE)=0,"",VLOOKUP(Sheet2!RC[-3],Sheet1!R[1]C[-3]:R[801]C[6],10,FALSE)) ->  | F247: =Sheet1!R276C10 -> 13.422868139420268 | G247: =IF(RC[-3]<0,0,IF(AND(RC[-3]<RC[-1],RC[-3]<2),100,IF(AND(RC[-3]<RC[-1],RC[-3]>=2,RC[-3]<3),95,IF(AND(RC[-3]<RC[-1],RC[-3]>=3,RC[-3]<4),90,IF(AND(RC[-3]<RC[-1],RC[-3]>=4,RC[-3]<5),85,IF(AND(RC[-3]<RC[-1],RC[-3]>=5,RC[-3]<6),80,IF(AND(RC[-3]<RC[-1],RC[-3]>=6,RC[-3]<7),75,IF(AND(RC[-3]<RC[-1],RC[-3]>=7,RC[-3]<8),70,IF(AND(RC[-3]<RC[-1],RC[-3]>=8,RC[-3]<9),65,IF(AND(RC[-3]<RC[-1],RC[-3]>=9,RC[-3]<10),60,IF(AND(RC[-3]<RC[-1],RC[-3]>=10,RC[-3]<11),55,IF(AND(RC[-3]<RC[-1],RC[-3]>=11,RC[-3]<12),50,IF(AND(RC[-3]<RC[-1],RC[-3]>=12,RC[-3]<13),45,IF(AND(RC[-3]<RC[-1],RC[-3]>=13,RC[-3]<14),40,IF(AND(RC[-3]<RC[-1],RC[-3]>=14,RC[-3]<15),35,IF(AND(RC[-3]<RC[-1],RC[-3]>=15,RC[-3]<16),30,IF(AND(RC[-3]<RC[-1],RC[-3]>=16,RC[-3]<17),25,IF(AND(RC[-3]<RC[-1],RC[-3]>=17,RC[-3]<18),20,IF(AND(RC[-3]<RC[-1],RC[-3]>=18,RC[-3]<19),15,IF(AND(RC[-3]<RC[-1],RC[-3]>=19,RC[-3]<20),10,IF(AND(RC[-3]<RC[-1],RC[-3]>=20,RC[-3]<21),5,IF(AND(RC[-3]<RC[-1],RC[-3]>=21),0,IF(AND(RC[-3]>RC[-1],RC[-3]>=2,RC[-3]<3),90,IF(AND(RC[-3]>RC[-1],RC[-3]>=3,RC[-3]<4),90,IF(AND(RC[-3]>RC[-1],RC[-3]>=4,RC[-3]<5),80,IF(AND(RC[-3]>RC[-1],RC[-3]>=5,RC[-3]<6),70,IF(AND(RC[-3]>RC[-1],RC[-3]>=6,RC[-3]<7),60,IF(AND(RC[-3]>RC[-1],RC[-3]>=7,RC[-3]<8),50,IF(AND(RC[-3]>RC[-1],RC[-3]>=8,RC[-3]<9),40,IF(AND(RC[-3]>RC[-1],RC[-3]>=9,RC[-3]<10),30,IF(AND(RC[-3]>RC[-1],RC[-3]>=10,RC[-3]<11),20,IF(AND(RC[-3]>RC[-1],RC[-3]>=11,RC[-3]<12),10,IF(AND(RC[-3]>RC[-1],RC[-3]>=12),0))))))))))))))))))))))))))))))))) -> 80 | H247: =IF(RC[-3]="","",IF(RC[-3]<0.3,100,IF(AND(RC[-3]>=0.3,RC[-3]>0.4),95,IF(AND(RC[-3]>=0.4,RC[-3]<0.5),90,IF(AND(RC[-3]>=0.5,RC[-3]<0.6),85,IF(AND(RC[-3]>=0.6,RC[-3]<0.7),80,IF(AND(RC[-3]>=0.6,RC[-3]<1),80,IF(AND(RC[-3]>1,RC[-3]<2),50,IF(RC[-3]>2,0))))))))) ->  | I247: =IF(RC[-1]="",RC[-2],0.7*RC[-1]+0.3*RC[-2]) -> 80
A248: رایان هم افزا | B248: رافزا | C248: =VLOOKUP(RC[-1],Sheet1!R3C2:R802C3,2,FALSE) -> رایانه | D248: =VLOOKUP(RC[-2],Sheet1!R3C2:R802C9,8,FALSE) -> 10.441641400414346 | E248: =IF(VLOOKUP(RC[-3],Sheet1!R3C2:R803C11,10,FALSE)=0,"",VLOOKUP(Sheet2!RC[-3],Sheet1!R[1]C[-3]:R[801]C[6],10,FALSE)) ->  | F248: =Sheet1!R276C10 -> 13.422868139420268 | G248: =IF(RC[-3]<0,0,IF(AND(RC[-3]<RC[-1],RC[-3]<2),100,IF(AND(RC[-3]<RC[-1],RC[-3]>=2,RC[-3]<3),95,IF(AND(RC[-3]<RC[-1],RC[-3]>=3,RC[-3]<4),90,IF(AND(RC[-3]<RC[-1],RC[-3]>=4,RC[-3]<5),85,IF(AND(RC[-3]<RC[-1],RC[-3]>=5,RC[-3]<6),80,IF(AND(RC[-3]<RC[-1],RC[-3]>=6,RC[-3]<7),75,IF(AND(RC[-3]<RC[-1],RC[-3]>=7,RC[-3]<8),70,IF(AND(RC[-3]<RC[-1],RC[-3]>=8,RC[-3]<9),65,IF(AND(RC[-3]<RC[-1],RC[-3]>=9,RC[-3]<10),60,IF(AND(RC[-3]<RC[-1],RC[-3]>=10,RC[-3]<11),55,IF(AND(RC[-3]<RC[-1],RC[-3]>=11,RC[-3]<12),50,IF(AND(RC[-3]<RC[-1],RC[-3]>=12,RC[-3]<13),45,IF(AND(RC[-3]<RC[-1],RC[-3]>=13,RC[-3]<14),40,IF(AND(RC[-3]<RC[-1],RC[-3]>=14,RC[-3]<15),35,IF(AND(RC[-3]<RC[-1],RC[-3]>=15,RC[-3]<16),30,IF(AND(RC[-3]<RC[-1],RC[-3]>=16,RC[-3]<17),25,IF(AND(RC[-3]<RC[-1],RC[-3]>=17,RC[-3]<18),20,IF(AND(RC[-3]<RC[-1],RC[-3]>=18,RC[-3]<19),15,IF(AND(RC[-3]<RC[-1],RC[-3]>=19,RC[-3]<20),10,IF(AND(RC[-3]<RC[-1],RC[-3]>=20,RC[-3]<21),5,IF(AND(RC[-3]<RC[-1],RC[-3]>=21),0,IF(AND(RC[-3]>RC[-1],RC[-3]>=2,RC[-3]<3),90,IF(AND(RC[-3]>RC[-1],RC[-3]>=3,RC[-3]<4),90,IF(AND(RC[-3]>RC[-1],RC[-3]>=4,RC[-3]<5),80,IF(AND(RC[-3]>RC[-1],RC[-3]>=5,RC[-3]<6),70,IF(AND(RC[-3]>RC[-1],RC[-3]>=6,RC[-3]<7),60,IF(AND(RC[-3]>RC[-1],RC[-3]>=7,RC[-3]<8),50,IF(AND(RC[-3]>RC[-1],RC[-3]>=8,RC[-3]<9),40,IF(AND(RC[-3]>RC[-1],RC[-3]>=9,RC[-3]<10),30,IF(AND(RC[-3]>RC[-1],RC[-3]>=10,RC[-3]<11),20,IF(AND(RC[-3]>RC[-1],RC[-3]>=11,RC[-3]<12),10,IF(AND(RC[-3]>RC[-1],RC[-3]>=12),0))))))))))))))))))))))))))))))))) -> 55 | H248: =IF(RC[-3]="","",IF(RC[-3]<0.3,100,IF(AND(RC[-3]>=0.3,RC[-3]>0.4),95,IF(AND(RC[-3]>=0.4,RC[-3]<0.5),90,IF(AND(RC[-3]>=0.5,RC[-3]<0.6),85,IF(AND(RC[-3]>=0.6,RC[-3]<0.7),80,IF(AND(RC[-3]>=0.6,RC[-3]<1),80,IF(AND(RC[-3]>1,RC[-3]<2),50,IF(RC[-3]>2,0))))))))) ->  | I248: =IF(RC[-1]="",RC[-2],0.7*RC[-1]+0.3*RC[-2]) -> 55
A249: سپیدار سیستم آسیا | B249: سپیدار | C249: =VLOOKUP(RC[-1],Sheet1!R3C2:R802C3,2,FALSE) -> رایانه | D249: =VLOOKUP(RC[-2],Sheet1!R3C2:R802C9,8,FALSE) -> 7.7880219767178396 | E249: =IF(VLOOKUP(RC[-3],Sheet1!R3C2:R803C11,10,FALSE)=0,"",VLOOKUP(Sheet2!RC[-3],Sheet1!R[1]C[-3]:R[801]C[6],10,FALSE)) ->  | F249: =Sheet1!R276C10 -> 13.422868139420268 | G249: =IF(RC[-3]<0,0,IF(AND(RC[-3]<RC[-1],RC[-3]<2),100,IF(AND(RC[-3]<RC[-1],RC[-3]>=2,RC[-3]<3),95,IF(AND(RC[-3]<RC[-1],RC[-3]>=3,RC[-3]<4),90,IF(AND(RC[-3]<RC[-1],RC[-3]>=4,RC[-3]<5),85,IF(AND(RC[-3]<RC[-1],RC[-3]>=5,RC[-3]<6),80,IF(AND(RC[-3]<RC[-1],RC[-3]>=6,RC[-3]<7),75,IF(AND(RC[-3]<RC[-1],RC[-3]>=7,RC[-3]<8),70,IF(AND(RC[-3]<RC[-1],RC[-3]>=8,RC[-3]<9),65,IF(AND(RC[-3]<RC[-1],RC[-3]>=9,RC[-3]<10),60,IF(AND(RC[-3]<RC[-1],RC[-3]>=10,RC[-3]<11),55,IF(AND(RC[-3]<RC[-1],RC[-3]>=11,RC[-3]<12),50,IF(AND(RC[-3]<RC[-1],RC[-3]>=12,RC[-3]<13),45,IF(AND(RC[-3]<RC[-1],RC[-3]>=13,RC[-3]<14),40,IF(AND(RC[-3]<RC[-1],RC[-3]>=14,RC[-3]<15),35,IF(AND(RC[-3]<RC[-1],RC[-3]>=15,RC[-3]<16),30,IF(AND(RC[-3]<RC[-1],RC[-3]>=16,RC[-3]<17),25,IF(AND(RC[-3]<RC[-1],RC[-3]>=17,RC[-3]<18),20,IF(AND(RC[-3]<RC[-1],RC[-3]>=18,RC[-3]<19),15,IF(AND(RC[-3]<RC[-1],RC[-3]>=19,RC[-3]<20),10,IF(AND(RC[-3]<RC[-1],RC[-3]>=20,RC[-3]<21),5,IF(AND(RC[-3]<RC[-1],RC[-3]>=21),0,IF(AND(RC[-3]>RC[-1],RC[-3]>=2,RC[-3]<3),90,IF(AND(RC[-3]>RC[-1],RC[-3]>=3,RC[-3]<4),90,IF(AND(RC[-3]>RC[-1],RC[-3]>=4,RC[-3]<5),80,IF(AND(RC[-3]>RC[-1],RC[-3]>=5,RC[-3]<6),70,IF(AND(RC[-3]>RC[-1],RC[-3]>=6,RC[-3]<7),60,IF(AND(RC[-3]>RC[-1],RC[-3]>=7,RC[-3]<8),50,IF(AND(RC[-3]>RC[-1],RC[-3]>=8,RC[-3]<9),40,IF(AND(RC[-3]>RC[-1],RC[-3]>=9,RC[-3]<10),30,IF(AND(RC[-3]>RC[-1],RC[-3]>=10,RC[-3]<11),20,IF(AND(RC[-3]>RC[-1],RC[-3]>=11,RC[-3]<12),10,IF(AND(RC[-3]>RC[-1],RC[-3]>=12),0))))))))))))))))))))))))))))))))) -> 70 | H249: =IF(RC[-3]="","",IF(RC[-3]<0.3,100,IF(AND(RC[-3]>=0.3,RC[-3]>0.4),95,IF(AND(RC[-3]>=0.4,RC[-3]<0.5),90,IF(AND(RC[-3]>=0.5,RC[-3]<0.6),85,IF(AND(RC[-3]>=0.6,RC[-3]<0.7),80,IF(AND(RC[-3]>=0.6,RC[-3]<1),80,IF(AND(RC[-3]>1,RC[-3]<2),50,IF(RC[-3]>2,0))))))))) ->  | I249: =IF(RC[-1]="",RC[-2],0.7*RC[-1]+0.3*RC[-2]) -> 70
A250: فن آوا | B250: فن آوا | C250: =VLOOKUP(RC[-1],Sheet1!R3C2:R802C3,2,FALSE) -> رایانه | D250: =VLOOKUP(RC[-2],Sheet1!R3C2:R802C9,8,FALSE) -> -46.000000000000007 | E250: =IF(VLOOKUP(RC[-3],Sheet1!R3C2:R803C11,10,FALSE)=0,"",VLOOKUP(Sheet2!RC[-3],Sheet1!R[1]C[-3]:R[801]C[6],10,FALSE)) ->  | F250: =Sheet1!R276C10 -> 13.422868139420268 | G250: =IF(RC[-3]<0,0,IF(AND(RC[-3]<RC[-1],RC[-3]<2),100,IF(AND(RC[-3]<RC[-1],RC[-3]>=2,RC[-3]<3),95,IF(AND(RC[-3]<RC[-1],RC[-3]>=3,RC[-3]<4),90,IF(AND(RC[-3]<RC[-1],RC[-3]>=4,RC[-3]<5),85,IF(AND(RC[-3]<RC[-1],RC[-3]>=5,RC[-3]<6),80,IF(AND(RC[-3]<RC[-1],RC[-3]>=6,RC[-3]<7),75,IF(AND(RC[-3]<RC[-1],RC[-3]>=7,RC[-3]<8),70,IF(AND(RC[-3]<RC[-1],RC[-3]>=8,RC[-3]<9),65,IF(AND(RC[-3]<RC[-1],RC[-3]>=9,RC[-3]<10),60,IF(AND(RC[-3]<RC[-1],RC[-3]>=10,RC[-3]<11),55,IF(AND(RC[-3]<RC[-1],RC[-3]>=11,RC[-3]<12),50,IF(AND(RC[-3]<RC[-1],RC[-3]>=12,RC[-3]<13),45,IF(AND(RC[-3]<RC[-1],RC[-3]>=13,RC[-3]<14),40,IF(AND(RC[-3]<RC[-1],RC[-3]>=14,RC[-3]<15),35,IF(AND(RC[-3]<RC[-1],RC[-3]>=15,RC[-3]<16),30,IF(AND(RC[-3]<RC[-1],RC[-3]>=16,RC[-3]<17),25,IF(AND(RC[-3]<RC[-1],RC[-3]>=17,RC[-3]<18),20,IF(AND(RC[-3]<RC[-1],RC[-3]>=18,RC[-3]<19),15,IF(AND(RC[-3]<RC[-1],RC[-3]>=19,RC[-3]<20),10,IF(AND(RC[-3]<RC[-1],RC[-3]>=20,RC[-3]<21),5,IF(AND(RC[-3]<RC[-1],RC[-3]>=21),0,IF(AND(RC[-3]>RC[-1],RC[-3]>=2,RC[-3]<3),90,IF(AND(RC[-3]>RC[-1],RC[-3]>=3,RC[-3]<4),90,IF(AND(RC[-3]>RC[-1],RC[-3]>=4,RC[-3]<5),80,IF(AND(RC[-3]>RC[-1],RC[-3]>=5,RC[-3]<6),70,IF(AND(RC[-3]>RC[-1],RC[-3]>=6,RC[-3]<7),60,IF(AND(RC[-3]>RC[-1],RC[-3]>=7,RC[-3]<8),50,IF(AND(RC[-3]>RC[-1],RC[-3]>=8,RC[-3]<9),40,IF(AND(RC[-3]>RC[-1],RC[-3]>=9,RC[-3]<10),30,IF(AND(RC[-3]>RC[-1],RC[-3]>=10,RC[-3]<11),20,IF(AND(RC[-3]>RC[-1],RC[-3]>=11,RC[-3]<12),10,IF(AND(RC[-3]>RC[-1],RC[-3]>=12),0))))))))))))))))))))))))))))))))) -> 0 | H250: =IF(RC[-3]="","",IF(RC[-3]<0.3,100,IF(AND(RC[-3]>=0.3,RC[-3]>0.4),95,IF(AND(RC[-3]>=0.4,RC[-3]<0.5),90,IF(AND(RC[-3]>=0.5,RC[-3]<0.6),85,IF(AND(RC[-3]>=0.6,RC[-3]<0.7),80,IF(AND(RC[-3]>=0.6,RC[-3]<1),80,IF(AND(RC[-3]>1,RC[-3]<2),50,IF(RC[-3]>2,0))))))))) ->  | I250: =IF(RC[-1]="",RC[-2],0.7*RC[-1]+0.3*RC[-2]) -> 0
A251: نرم افزاری نگین | B251: توسن | C251: =VLOOKUP(RC[-1],Sheet1!R3C2:R802C3,2,FALSE) -> رایانه | D251: =VLOOKUP(RC[-2],Sheet1!R3C2:R802C9,8,FALSE) -> 12.060166720543434 | E251: =IF(VLOOKUP(RC[-3],Sheet1!R3C2:R803C11,10,FALSE)=0,"",VLOOKUP(Sheet2!RC[-3],Sheet1!R[1]C[-3]:R[801]C[6],10,FALSE)) ->  | F251: =Sheet1!R276C10 -> 13.422868139420268 | G251: =IF(RC[-3]<0,0,IF(AND(RC[-3]<RC[-1],RC[-3]<2),100,IF(AND(RC[-3]<RC[-1],RC[-3]>=2,RC[-3]<3),95,IF(AND(RC[-3]<RC[-1],RC[-3]>=3,RC[-3]<4),90,IF(AND(RC[-3]<RC[-1],RC[-3]>=4,RC[-3]<5),85,IF(AND(RC[-3]<RC[-1],RC[-3]>=5,RC[-3]<6),80,IF(AND(RC[-3]<RC[-1],RC[-3]>=6,RC[-3]<7),75,IF(AND(RC[-3]<RC[-1],RC[-3]>=7,RC[-3]<8),70,IF(AND(RC[-3]<RC[-1],RC[-3]>=8,RC[-3]<9),65,IF(AND(RC[-3]<RC[-1],RC[-3]>=9,RC[-3]<10),60,IF(AND(RC[-3]<RC[-1],RC[-3]>=10,RC[-3]<11),55,IF(AND(RC[-3]<RC[-1],RC[-3]>=11,RC[-3]<12),50,IF(AND(RC[-3]<RC[-1],RC[-3]>=12,RC[-3]<13),45,IF(AND(RC[-3]<RC[-1],RC[-3]>=13,RC[-3]<14),40,IF(AND(RC[-3]<RC[-1],RC[-3]>=14,RC[-3]<15),35,IF(AND(RC[-3]<RC[-1],RC[-3]>=15,RC[-3]<16),30,IF(AND(RC[-3]<RC[-1],RC[-3]>=16,RC[-3]<17),25,IF(AND(RC[-3]<RC[-1],RC[-3]>=17,RC[-3]<18),20,IF(AND(RC[-3]<RC[-1],RC[-3]>=18,RC[-3]<19),15,IF(AND(RC[-3]<RC[-1],RC[-3]>=19,RC[-3]<20),10,IF(AND(RC[-3]<RC[-1],RC[-3]>=20,RC[-3]<21),5,IF(AND(RC[-3]<RC[-1],RC[-3]>=21),0,IF(AND(RC[-3]>RC[-1],RC[-3]>=2,RC[-3]<3),90,IF(AND(RC[-3]>RC[-1],RC[-3]>=3,RC[-3]<4),90,IF(AND(RC[-3]>RC[-1],RC[-3]>=4,RC[-3]<5),80,IF(AND(RC[-3]>RC[-1],RC[-3]>=5,RC[-3]<6),70,IF(AND(RC[-3]>RC[-1],RC[-3]>=6,RC[-3]<7),60,IF(AND(RC[-3]>RC[-1],RC[-3]>=7,RC[-3]<8),50,IF(AND(RC[-3]>RC[-1],RC[-3]>=8,RC[-3]<9),40,IF(AND(RC[-3]>RC[-1],RC[-3]>=9,RC[-3]<10),30,IF(AND(RC[-3]>RC[-1],RC[-3]>=10,RC[-3]<11),20,IF(AND(RC[-3]>RC[-1],RC[-3]>=11,RC[-3]<12),10,IF(AND(RC[-3]>RC[-1],RC[-3]>=12),0))))))))))))))))))))))))))))))))) -> 45 | H251: =IF(RC[-3]="","",IF(RC[-3]<0.3,100,IF(AND(RC[-3]>=0.3,RC[-3]>0.4),95,IF(AND(RC[-3]>=0.4,RC[-3]<0.5),90,IF(AND(RC[-3]>=0.5,RC[-3]<0.6),85,IF(AND(RC[-3]>=0.6,RC[-3]<0.7),80,IF(AND(RC[-3]>=0.6,RC[-3]<1),80,IF(AND(RC[-3]>1,RC[-3]<2),50,IF(RC[-3]>2,0))))))))) ->  | I251: =IF(RC[-1]="",RC[-2],0.7*RC[-1]+0.3*RC[-2]) -> 45
A252: همکاران سیستم | B252: سیستم | C252: =VLOOKUP(RC[-1],Sheet1!R3C2:R802C3,2,FALSE) -> رایانه | D252: =VLOOKUP(RC[-2],Sheet1!R3C2:R802C9,8,FALSE) -> 8.9950936675567572 | E252: =IF(VLOOKUP(RC[-3],Sheet1!R3C2:R803C11,10,FALSE)=0,"",VLOOKUP(Sheet2!RC[-3],Sheet1!R[1]C[-3]:R[801]C[6],10,FALSE)) ->  | F252: =Sheet1!R276C10 -> 13.422868139420268 | G252: =IF(RC[-3]<0,0,IF(AND(RC[-3]<RC[-1],RC[-3]<2),100,IF(AND(RC[-3]<RC[-1],RC[-3]>=2,RC[-3]<3),95,IF(AND(RC[-3]<RC[-1],RC[-3]>=3,RC[-3]<4),90,IF(AND(RC[-3]<RC[-1],RC[-3]>=4,RC[-3]<5),85,IF(AND(RC[-3]<RC[-1],RC[-3]>=5,RC[-3]<6),80,IF(AND(RC[-3]<RC[-1],RC[-3]>=6,RC[-3]<7),75,IF(AND(RC[-3]<RC[-1],RC[-3]>=7,RC[-3]<8),70,IF(AND(RC[-3]<RC[-1],RC[-3]>=8,RC[-3]<9),65,IF(AND(RC[-3]<RC[-1],RC[-3]>=9,RC[-3]<10),60,IF(AND(RC[-3]<RC[-1],RC[-3]>=10,RC[-3]<11),55,IF(AND(RC[-3]<RC[-1],RC[-3]>=11,RC[-3]<12),50,IF(AND(RC[-3]<RC[-1],RC[-3]>=12,RC[-3]<13),45,IF(AND(RC[-3]<RC[-1],RC[-3]>=13,RC[-3]<14),40,IF(AND(RC[-3]<RC[-1],RC[-3]>=14,RC[-3]<15),35,IF(AND(RC[-3]<RC[-1],RC[-3]>=15,RC[-3]<16),30,IF(AND(RC[-3]<RC[-1],RC[-3]>=16,RC[-3]<17),25,IF(AND(RC[-3]<RC[-1],RC[-3]>=17,RC[-3]<18),20,IF(AND(RC[-3]<RC[-1],RC[-3]>=18,RC[-3]<19),15,IF(AND(RC[-3]<RC[-1],RC[-3]>=19,RC[-3]<20),10,IF(AND(RC[-3]<RC[-1],RC[-3]>=20,RC[-3]<21),5,IF(AND(RC[-3]<RC[-1],RC[-3]>=21),0,IF(AND(RC[-3]>RC[-1],RC[-3]>=2,RC[-3]<3),90,IF(AND(RC[-3]>RC[-1],RC[-3]>=3,RC[-3]<4),90,IF(AND(RC[-3]>RC[-1],RC[-3]>=4,RC[-3]<5),80,IF(AND(RC[-3]>RC[-1],RC[-3]>=5,RC[-3]<6),70,IF(AND(RC[-3]>RC[-1],RC[-3]>=6,RC[-3]<7),60,IF(AND(RC[-3]>RC[-1],RC[-3]>=7,RC[-3]<8),50,IF(AND(RC[-3]>RC[-1],RC[-3]>=8,RC[-3]<9),40,IF(AND(RC[-3]>RC[-1],RC[-3]>=9,RC[-3]<10),30,IF(AND(RC[-3]>RC[-1],RC[-3]>=10,RC[-3]<11),20,IF(AND(RC[-3]>RC[-1],RC[-3]>=11,RC[-3]<12),10,IF(AND(RC[-3]>RC[-1],RC[-3]>=12),0))))))))))))))))))))))))))))))))) -> 65 | H252: =IF(RC[-3]="","",IF(RC[-3]<0.3,100,IF(AND(RC[-3]>=0.3,RC[-3]>0.4),95,IF(AND(RC[-3]>=0.4,RC[-3]<0.5),90,IF(AND(RC[-3]>=0.5,RC[-3]<0.6),85,IF(AND(RC[-3]>=0.6,RC[-3]<0.7),80,IF(AND(RC[-3]>=0.6,RC[-3]<1),80,IF(AND(RC[-3]>1,RC[-3]<2),50,IF(RC[-3]>2,0))))))))) ->  | I252: =IF(RC[-1]="",RC[-2],0.7*RC[-1]+0.3*RC[-2]) -> 65
A253: کارت اعتباری ایران کیش | B253: رکیش | C253: =VLOOKUP(RC[-1],Sheet1!R3C2:R802C3,2,FALSE) -> رایانه | D253: =VLOOKUP(RC[-2],Sheet1!R3C2:R802C9,8,FALSE) -> 15.806440970800278 | E253: =IF(VLOOKUP(RC[-3],Sheet1!R3C2:R803C11,10,FALSE)=0,"",VLOOKUP(Sheet2!RC[-3],Sheet1!R[1]C[-3]:R[801]C[6],10,FALSE)) ->  | F253: =Sheet1!R276C10 -> 13.422868139420268 | G253: =IF(RC[-3]<0,0,IF(AND(RC[-3]<RC[-1],RC[-3]<2),100,IF(AND(RC[-3]<RC[-1],RC[-3]>=2,RC[-3]<3),95,IF(AND(RC[-3]<RC[-1],RC[-3]>=3,RC[-3]<4),90,IF(AND(RC[-3]<RC[-1],RC[-3]>=4,RC[-3]<5),85,IF(AND(RC[-3]<RC[-1],RC[-3]>=5,RC[-3]<6),80,IF(AND(RC[-3]<RC[-1],RC[-3]>=6,RC[-3]<7),75,IF(AND(RC[-3]<RC[-1],RC[-3]>=7,RC[-3]<8),70,IF(AND(RC[-3]<RC[-1],RC[-3]>=8,RC[-3]<9),65,IF(AND(RC[-3]<RC[-1],RC[-3]>=9,RC[-3]<10),60,IF(AND(RC[-3]<RC[-1],RC[-3]>=10,RC[-3]<11),55,IF(AND(RC[-3]<RC[-1],RC[-3]>=11,RC[-3]<12),50,IF(AND(RC[-3]<RC[-1],RC[-3]>=12,RC[-3]<13),45,IF(AND(RC[-3]<RC[-1],RC[-3]>=13,RC[-3]<14),40,IF(AND(RC[-3]<RC[-1],RC[-3]>=14,RC[-3]<15),35,IF(AND(RC[-3]<RC[-1],RC[-3]>=15,RC[-3]<16),30,IF(AND(RC[-3]<RC[-1],RC[-3]>=16,RC[-3]<17),25,IF(AND(RC[-3]<RC[-1],RC[-3]>=17,RC[-3]<18),20,IF(AND(RC[-3]<RC[-1],RC[-3]>=18,RC[-3]<19),15,IF(AND(RC[-3]<RC[-1],RC[-3]>=19,RC[-3]<20),10,IF(AND(RC[-3]<RC[-1],RC[-3]>=20,RC[-3]<21),5,IF(AND(RC[-3]<RC[-1],RC[-3]>=21),0,IF(AND(RC[-3]>RC[-1],RC[-3]>=2,RC[-3]<3),90,IF(AND(RC[-3]>RC[-1],RC[-3]>=3,RC[-3]<4),90,IF(AND(RC[-3]>RC[-1],RC[-3]>=4,RC[-3]<5),80,IF(AND(RC[-3]>RC[-1],RC[-3]>=5,RC[-3]<6),70,IF(AND(RC[-3]>RC[-1],RC[-3]>=6,RC[-3]<7),60,IF(AND(RC[-3]>RC[-1],RC[-3]>=7,RC[-3]<8),50,IF(AND(RC[-3]>RC[-1],RC[-3]>=8,RC[-3]<9),40,IF(AND(RC[-3]>RC[-1],RC[-3]>=9,RC[-3]<10),30,IF(AND(RC[-3]>RC[-1],RC[-3]>=10,RC[-3]<11),20,IF(AND(RC[-3]>RC[-1],RC[-3]>=11,RC[-3]<12),10,IF(AND(RC[-3]>RC[-1],RC[-3]>=12),0))))))))))))))))))))))))))))))))) -> 0 | H253: =IF(RC[-3]="","",IF(RC[-3]<0.3,100,IF(AND(RC[-3]>=0.3,RC[-3]>0.4),95,IF(AND(RC[-3]>=0.4,RC[-3]<0.5),90,IF(AND(RC[-3]>=0.5,RC[-3]<0.6),85,IF(AND(RC[-3]>=0.6,RC[-3]<0.7),80,IF(AND(RC[-3]>=0.6,RC[-3]<1),80,IF(AND(RC[-3]>1,RC[-3]<2),50,IF(RC[-3]>2,0))))))))) ->  | I253: =IF(RC[-1]="",RC[-2],0.7*RC[-1]+0.3*RC[-2]) -> 0
A254: آینده سازان بهشت پارس | B254: آینده | C254: =VLOOKUP(RC[-1],Sheet1!R3C2:R802C3,2,FALSE) -> زراعت و خدمات وابسته | D254: =VLOOKUP(RC[-2],Sheet1!R3C2:R802C9,8,FALSE) -> 1.3537414965986396 | E254: =IF(VLOOKUP(RC[-3],Sheet1!R3C2:R803C11,10,FALSE)=0,"",VLOOKUP(Sheet2!RC[-3],Sheet1!R[1]C[-3]:R[801]C[6],10,FALSE)) ->  | F254: =Sheet1!R295C10 -> 26.498020837806894 | G254: =IF(RC[-3]<0,0,IF(AND(RC[-3]<RC[-1],RC[-3]<2),100,IF(AND(RC[-3]<RC[-1],RC[-3]>=2,RC[-3]<3),95,IF(AND(RC[-3]<RC[-1],RC[-3]>=3,RC[-3]<4),90,IF(AND(RC[-3]<RC[-1],RC[-3]>=4,RC[-3]<5),85,IF(AND(RC[-3]<RC[-1],RC[-3]>=5,RC[-3]<6),80,IF(AND(RC[-3]<RC[-1],RC[-3]>=6,RC[-3]<7),75,IF(AND(RC[-3]<RC[-1],RC[-3]>=7,RC[-3]<8),70,IF(AND(RC[-3]<RC[-1],RC[-3]>=8,RC[-3]<9),65,IF(AND(RC[-3]<RC[-1],RC[-3]>=9,RC[-3]<10),60,IF(AND(RC[-3]<RC[-1],RC[-3]>=10,RC[-3]<11),55,IF(AND(RC[-3]<RC[-1],RC[-3]>=11,RC[-3]<12),50,IF(AND(RC[-3]<RC[-1],RC[-3]>=12,RC[-3]<13),45,IF(AND(RC[-3]<RC[-1],RC[-3]>=13,RC[-3]<14),40,IF(AND(RC[-3]<RC[-1],RC[-3]>=14,RC[-3]<15),35,IF(AND(RC[-3]<RC[-1],RC[-3]>=15,RC[-3]<16),30,IF(AND(RC[-3]<RC[-1],RC[-3]>=16,RC[-3]<17),25,IF(AND(RC[-3]<RC[-1],RC[-3]>=17,RC[-3]<18),20,IF(AND(RC[-3]<RC[-1],RC[-3]>=18,RC[-3]<19),15,IF(AND(RC[-3]<RC[-1],RC[-3]>=19,RC[-3]<20),10,IF(AND(RC[-3]<RC[-1],RC[-3]>=20,RC[-3]<21),5,IF(AND(RC[-3]<RC[-1],RC[-3]>=21),0,IF(AND(RC[-3]>RC[-1],RC[-3]>=2,RC[-3]<3),90,IF(AND(RC[-3]>RC[-1],RC[-3]>=3,RC[-3]<4),90,IF(AND(RC[-3]>RC[-1],RC[-3]>=4,RC[-3]<5),80,IF(AND(RC[-3]>RC[-1],RC[-3]>=5,RC[-3]<6),70,IF(AND(RC[-3]>RC[-1],RC[-3]>=6,RC[-3]<7),60,IF(AND(RC[-3]>RC[-1],RC[-3]>=7,RC[-3]<8),50,IF(AND(RC[-3]>RC[-1],RC[-3]>=8,RC[-3]<9),40,IF(AND(RC[-3]>RC[-1],RC[-3]>=9,RC[-3]<10),30,IF(AND(RC[-3]>RC[-1],RC[-3]>=10,RC[-3]<11),20,IF(AND(RC[-3]>RC[-1],RC[-3]>=11,RC[-3]<12),10,IF(AND(RC[-3]>RC[-1],RC[-3]>=12),0))))))))))))))))))))))))))))))))) -> 100 | H254: =IF(RC[-3]="","",IF(RC[-3]<0.3,100,IF(AND(RC[-3]>=0.3,RC[-3]>0.4),95,IF(AND(RC[-3]>=0.4,RC[-3]<0.5),90,IF(AND(RC[-3]>=0.5,RC[-3]<0.6),85,IF(AND(RC[-3]>=0.6,RC[-3]<0.7),80,IF(AND(RC[-3]>=0.6,RC[-3]<1),80,IF(AND(RC[-3]>1,RC[-3]<2),50,IF(RC[-3]>2,0))))))))) ->  | I254: =IF(RC[-1]="",RC[-2],0.7*RC[-1]+0.3*RC[-2]) -> 100
A255: تلیسه نمونه | B255: تلیسه | C255: =VLOOKUP(RC[-1],Sheet1!R3C2:R802C3,2,FALSE) -> زراعت و خدمات وابسته | D255: =VLOOKUP(RC[-2],Sheet1!R3C2:R802C9,8,FALSE) -> 12.767092878057142 | E255: =IF(VLOOKUP(RC[-3],Sheet1!R3C2:R803C11,10,FALSE)=0,"",VLOOKUP(Sheet2!RC[-3],Sheet1!R[1]C[-3]:R[801]C[6],10,FALSE)) ->  | F255: =Sheet1!R295C10 -> 26.498020837806894 | G255: =IF(RC[-3]<0,0,IF(AND(RC[-3]<RC[-1],RC[-3]<2),100,IF(AND(RC[-3]<RC[-1],RC[-3]>=2,RC[-3]<3),95,IF(AND(RC[-3]<RC[-1],RC[-3]>=3,RC[-3]<4),90,IF(AND(RC[-3]<RC[-1],RC[-3]>=4,RC[-3]<5),85,IF(AND(RC[-3]<RC[-1],RC[-3]>=5,RC[-3]<6),80,IF(AND(RC[-3]<RC[-1],RC[-3]>=6,RC[-3]<7),75,IF(AND(RC[-3]<RC[-1],RC[-3]>=7,RC[-3]<8),70,IF(AND(RC[-3]<RC[-1],RC[-3]>=8,RC[-3]<9),65,IF(AND(RC[-3]<RC[-1],RC[-3]>=9,RC[-3]<10),60,IF(AND(RC[-3]<RC[-1],RC[-3]>=10,RC[-3]<11),55,IF(AND(RC[-3]<RC[-1],RC[-3]>=11,RC[-3]<12),50,IF(AND(RC[-3]<RC[-1],RC[-3]>=12,RC[-3]<13),45,IF(AND(RC[-3]<RC[-1],RC[-3]>=13,RC[-3]<14),40,IF(AND(RC[-3]<RC[-1],RC[-3]>=14,RC[-3]<15),35,IF(AND(RC[-3]<RC[-1],RC[-3]>=15,RC[-3]<16),30,IF(AND(RC[-3]<RC[-1],RC[-3]>=16,RC[-3]<17),25,IF(AND(RC[-3]<RC[-1],RC[-3]>=17,RC[-3]<18),20,IF(AND(RC[-3]<RC[-1],RC[-3]>=18,RC[-3]<19),15,IF(AND(RC[-3]<RC[-1],RC[-3]>=19,RC[-3]<20),10,IF(AND(RC[-3]<RC[-1],RC[-3]>=20,RC[-3]<21),5,IF(AND(RC[-3]<RC[-1],RC[-3]>=21),0,IF(AND(RC[-3]>RC[-1],RC[-3]>=2,RC[-3]<3),90,IF(AND(RC[-3]>RC[-1],RC[-3]>=3,RC[-3]<4),90,IF(AND(RC[-3]>RC[-1],RC[-3]>=4,RC[-3]<5),80,IF(AND(RC[-3]>RC[-1],RC[-3]>=5,RC[-3]<6),70,IF(AND(RC[-3]>RC[-1],RC[-3]>=6,RC[-3]<7),60,IF(AND(RC[-3]>RC[-1],RC[-3]>=7,RC[-3]<8),50,IF(AND(RC[-3]>RC[-1],RC[-3]>=8,RC[-3]<9),40,IF(AND(RC[-3]>RC[-1],RC[-3]>=9,RC[-3]<10),30,IF(AND(RC[-3]>RC[-1],RC[-3]>=10,RC[-3]<11),20,IF(AND(RC[-3]>RC[-1],RC[-3]>=11,RC[-3]<12),10,IF(AND(RC[-3]>RC[-1],RC[-3]>=12),0))))))))))))))))))))))))))))))))) -> 45 | H255: =IF(RC[-3]="","",IF(RC[-3]<0.3,100,IF(AND(RC[-3]>=0.3,RC[-3]>0.4),95,IF(AND(RC[-3]>=0.4,RC[-3]<0.5),90,IF(AND(RC[-3]>=0.5,RC[-3]<0.6),85,IF(AND(RC[-3]>=0.6,RC[-3]<0.7),80,IF(AND(RC[-3]>=0.6,RC[-3]<1),80,IF(AND(RC[-3]>1,RC[-3]<2),50,IF(RC[-3]>2,0))))))))) ->  | I255: =IF(RC[-1]="",RC[-2],0.7*RC[-1]+0.3*RC[-2]) -> 45
A256: سپید ماکیان | B256: سپید | C256: =VLOOKUP(RC[-1],Sheet1!R3C2:R802C3,2,FALSE) -> زراعت و خدمات وابسته | D256: =VLOOKUP(RC[-2],Sheet1!R3C2:R802C9,8,FALSE) -> 4.8415514099189725 | E256: =IF(VLOOKUP(RC[-3],Sheet1!R3C2:R803C11,10,FALSE)=0,"",VLOOKUP(Sheet2!RC[-3],Sheet1!R[1]C[-3]:R[801]C[6],10,FALSE)) ->  | F256: =Sheet1!R295C10 -> 26.498020837806894 | G256: =IF(RC[-3]<0,0,IF(AND(RC[-3]<RC[-1],RC[-3]<2),100,IF(AND(RC[-3]<RC[-1],RC[-3]>=2,RC[-3]<3),95,IF(AND(RC[-3]<RC[-1],RC[-3]>=3,RC[-3]<4),90,IF(AND(RC[-3]<RC[-1],RC[-3]>=4,RC[-3]<5),85,IF(AND(RC[-3]<RC[-1],RC[-3]>=5,RC[-3]<6),80,IF(AND(RC[-3]<RC[-1],RC[-3]>=6,RC[-3]<7),75,IF(AND(RC[-3]<RC[-1],RC[-3]>=7,RC[-3]<8),70,IF(AND(RC[-3]<RC[-1],RC[-3]>=8,RC[-3]<9),65,IF(AND(RC[-3]<RC[-1],RC[-3]>=9,RC[-3]<10),60,IF(AND(RC[-3]<RC[-1],RC[-3]>=10,RC[-3]<11),55,IF(AND(RC[-3]<RC[-1],RC[-3]>=11,RC[-3]<12),50,IF(AND(RC[-3]<RC[-1],RC[-3]>=12,RC[-3]<13),45,IF(AND(RC[-3]<RC[-1],RC[-3]>=13,RC[-3]<14),40,IF(AND(RC[-3]<RC[-1],RC[-3]>=14,RC[-3]<15),35,IF(AND(RC[-3]<RC[-1],RC[-3]>=15,RC[-3]<16),30,IF(AND(RC[-3]<RC[-1],RC[-3]>=16,RC[-3]<17),25,IF(AND(RC[-3]<RC[-1],RC[-3]>=17,RC[-3]<18),20,IF(AND(RC[-3]<RC[-1],RC[-3]>=18,RC[-3]<19),15,IF(AND(RC[-3]<RC[-1],RC[-3]>=19,RC[-3]<20),10,IF(AND(RC[-3]<RC[-1],RC[-3]>=20,RC[-3]<21),5,IF(AND(RC[-3]<RC[-1],RC[-3]>=21),0,IF(AND(RC[-3]>RC[-1],RC[-3]>=2,RC[-3]<3),90,IF(AND(RC[-3]>RC[-1],RC[-3]>=3,RC[-3]<4),90,IF(AND(RC[-3]>RC[-1],RC[-3]>=4,RC[-3]<5),80,IF(AND(RC[-3]>RC[-1],RC[-3]>=5,RC[-3]<6),70,IF(AND(RC[-3]>RC[-1],RC[-3]>=6,RC[-3]<7),60,IF(AND(RC[-3]>RC[-1],RC[-3]>=7,RC[-3]<8),50,IF(AND(RC[-3]>RC[-1],RC[-3]>=8,RC[-3]<9),40,IF(AND(RC[-3]>RC[-1],RC[-3]>=9,RC[-3]<10),30,IF(AND(RC[-3]>RC[-1],RC[-3]>=10,RC[-3]<11),20,IF(AND(RC[-3]>RC[-1],RC[-3]>=11,RC[-3]<12),10,IF(AND(RC[-3]>RC[-1],RC[-3]>=12),0))))))))))))))))))))))))))))))))) -> 85 | H256: =IF(RC[-3]="","",IF(RC[-3]<0.3,100,IF(AND(RC[-3]>=0.3,RC[-3]>0.4),95,IF(AND(RC[-3]>=0.4,RC[-3]<0.5),90,IF(AND(RC[-3]>=0.5,RC[-3]<0.6),85,IF(AND(RC[-3]>=0.6,RC[-3]<0.7),80,IF(AND(RC[-3]>=0.6,RC[-3]<1),80,IF(AND(RC[-3]>1,RC[-3]<2),50,IF(RC[-3]>2,0))))))))) ->  | I256: =IF(RC[-1]="",RC[-2],0.7*RC[-1]+0.3*RC[-2]) -> 85
A257: سر. کشاورزی کوثر | B257: زکوثر | C257: =VLOOKUP(RC[-1],Sheet1!R3C2:R802C3,2,FALSE) -> زراعت و خدمات وابسته | D257: =VLOOKUP(RC[-2],Sheet1!R3C2:R802C9,8,FALSE) -> 5.9670130849938472 | E257: =IF(VLOOKUP(RC[-3],Sheet1!R3C2:R803C11,10,FALSE)=0,"",VLOOKUP(Sheet2!RC[-3],Sheet1!R[1]C[-3]:R[801]C[6],10,FALSE)) -> 1.4 | F257: =Sheet1!R295C10 -> 26.498020837806894 | G257: =IF(RC[-3]<0,0,IF(AND(RC[-3]<RC[-1],RC[-3]<2),100,IF(AND(RC[-3]<RC[-1],RC[-3]>=2,RC[-3]<3),95,IF(AND(RC[-3]<RC[-1],RC[-3]>=3,RC[-3]<4),90,IF(AND(RC[-3]<RC[-1],RC[-3]>=4,RC[-3]<5),85,IF(AND(RC[-3]<RC[-1],RC[-3]>=5,RC[-3]<6),80,IF(AND(RC[-3]<RC[-1],RC[-3]>=6,RC[-3]<7),75,IF(AND(RC[-3]<RC[-1],RC[-3]>=7,RC[-3]<8),70,IF(AND(RC[-3]<RC[-1],RC[-3]>=8,RC[-3]<9),65,IF(AND(RC[-3]<RC[-1],RC[-3]>=9,RC[-3]<10),60,IF(AND(RC[-3]<RC[-1],RC[-3]>=10,RC[-3]<11),55,IF(AND(RC[-3]<RC[-1],RC[-3]>=11,RC[-3]<12),50,IF(AND(RC[-3]<RC[-1],RC[-3]>=12,RC[-3]<13),45,IF(AND(RC[-3]<RC[-1],RC[-3]>=13,RC[-3]<14),40,IF(AND(RC[-3]<RC[-1],RC[-3]>=14,RC[-3]<15),35,IF(AND(RC[-3]<RC[-1],RC[-3]>=15,RC[-3]<16),30,IF(AND(RC[-3]<RC[-1],RC[-3]>=16,RC[-3]<17),25,IF(AND(RC[-3]<RC[-1],RC[-3]>=17,RC[-3]<18),20,IF(AND(RC[-3]<RC[-1],RC[-3]>=18,RC[-3]<19),15,IF(AND(RC[-3]<RC[-1],RC[-3]>=19,RC[-3]<20),10,IF(AND(RC[-3]<RC[-1],RC[-3]>=20,RC[-3]<21),5,IF(AND(RC[-3]<RC[-1],RC[-3]>=21),0,IF(AND(RC[-3]>RC[-1],RC[-3]>=2,RC[-3]<3),90,IF(AND(RC[-3]>RC[-1],RC[-3]>=3,RC[-3]<4),90,IF(AND(RC[-3]>RC[-1],RC[-3]>=4,RC[-3]<5),80,IF(AND(RC[-3]>RC[-1],RC[-3]>=5,RC[-3]<6),70,IF(AND(RC[-3]>RC[-1],RC[-3]>=6,RC[-3]<7),60,IF(AND(RC[-3]>RC[-1],RC[-3]>=7,RC[-3]<8),50,IF(AND(RC[-3]>RC[-1],RC[-3]>=8,RC[-3]<9),40,IF(AND(RC[-3]>RC[-1],RC[-3]>=9,RC[-3]<10),30,IF(AND(RC[-3]>RC[-1],RC[-3]>=10,RC[-3]<11),20,IF(AND(RC[-3]>RC[-1],RC[-3]>=11,RC[-3]<12),10,IF(AND(RC[-3]>RC[-1],RC[-3]>=12),0))))))))))))))))))))))))))))))))) -> 80 | H257: =IF(RC[-3]="","",IF(RC[-3]<0.3,100,IF(AND(RC[-3]>=0.3,RC[-3]>0.4),95,IF(AND(RC[-3]>=0.4,RC[-3]<0.5),90,IF(AND(RC[-3]>=0.5,RC[-3]<0.6),85,IF(AND(RC[-3]>=0.6,RC[-3]<0.7),80,IF(AND(RC[-3]>=0.6,RC[-3]<1),80,IF(AND(RC[-3]>1,RC[-3]<2),50,IF(RC[-3]>2,0))))))))) -> 95 | I257: =IF(RC[-1]="",RC[-2],0.7*RC[-1]+0.3*RC[-2]) -> 90.5
A258: سیمرغ | B258: سیمرغ | C258: =VLOOKUP(RC[-1],Sheet1!R3C2:R802C3,2,FALSE) -> زراعت و خدمات وابسته | D258: =VLOOKUP(RC[-2],Sheet1!R3C2:R802C9,8,FALSE) -> 4.3 | E258: =IF(VLOOKUP(RC[-3],Sheet1!R3C2:R803C11,10,FALSE)=0,"",VLOOKUP(Sheet2!RC[-3],Sheet1!R[1]C[-3]:R[801]C[6],10,FALSE)) ->  | F258: =Sheet1!R295C10 -> 26.498020837806894 | G258: =IF(RC[-3]<0,0,IF(AND(RC[-3]<RC[-1],RC[-3]<2),100,IF(AND(RC[-3]<RC[-1],RC[-3]>=2,RC[-3]<3),95,IF(AND(RC[-3]<RC[-1],RC[-3]>=3,RC[-3]<4),90,IF(AND(RC[-3]<RC[-1],RC[-3]>=4,RC[-3]<5),85,IF(AND(RC[-3]<RC[-1],RC[-3]>=5,RC[-3]<6),80,IF(AND(RC[-3]<RC[-1],RC[-3]>=6,RC[-3]<7),75,IF(AND(RC[-3]<RC[-1],RC[-3]>=7,RC[-3]<8),70,IF(AND(RC[-3]<RC[-1],RC[-3]>=8,RC[-3]<9),65,IF(AND(RC[-3]<RC[-1],RC[-3]>=9,RC[-3]<10),60,IF(AND(RC[-3]<RC[-1],RC[-3]>=10,RC[-3]<11),55,IF(AND(RC[-3]<RC[-1],RC[-3]>=11,RC[-3]<12),50,IF(AND(RC[-3]<RC[-1],RC[-3]>=12,RC[-3]<13),45,IF(AND(RC[-3]<RC[-1],RC[-3]>=13,RC[-3]<14),40,IF(AND(RC[-3]<RC[-1],RC[-3]>=14,RC[-3]<15),35,IF(AND(RC[-3]<RC[-1],RC[-3]>=15,RC[-3]<16),30,IF(AND(RC[-3]<RC[-1],RC[-3]>=16,RC[-3]<17),25,IF(AND(RC[-3]<RC[-1],RC[-3]>=17,RC[-3]<18),20,IF(AND(RC[-3]<RC[-1],RC[-3]>=18,RC[-3]<19),15,IF(AND(RC[-3]<RC[-1],RC[-3]>=19,RC[-3]<20),10,IF(AND(RC[-3]<RC[-1],RC[-3]>=20,RC[-3]<21),5,IF(AND(RC[-3]<RC[-1],RC[-3]>=21),0,IF(AND(RC[-3]>RC[-1],RC[-3]>=2,RC[-3]<3),90,IF(AND(RC[-3]>RC[-1],RC[-3]>=3,RC[-3]<4),90,IF(AND(RC[-3]>RC[-1],RC[-3]>=4,RC[-3]<5),80,IF(AND(RC[-3]>RC[-1],RC[-3]>=5,RC[-3]<6),70,IF(AND(RC[-3]>RC[-1],RC[-3]>=6,RC[-3]<7),60,IF(AND(RC[-3]>RC[-1],RC[-3]>=7,RC[-3]<8),50,IF(AND(RC[-3]>RC[-1],RC[-3]>=8,RC[-3]<9),40,IF(AND(RC[-3]>RC[-1],RC[-3]>=9,RC[-3]<10),30,IF(AND(RC[-3]>RC[-1],RC[-3]>=10,RC[-3]<11),20,IF(AND(RC[-3]>RC[-1],RC[-3]>=11,RC[-3]<12),10,IF(AND(RC[-3]>RC[-1],RC[-3]>=12),0))))))))))))))))))))))))))))))))) -> 85 | H258: =IF(RC[-3]="","",IF(RC[-3]<0.3,100,IF(AND(RC[-3]>=0.3,RC[-3]>0.4),95,IF(AND(RC[-3]>=0.4,RC[-3]<0.5),90,IF(AND(RC[-3]>=0.5,RC[-3]<0.6),85,IF(AND(RC[-3]>=0.6,RC[-3]<0.7),80,IF(AND(RC[-3]>=0.6,RC[-3]<1),80,IF(AND(RC[-3]>1,RC[-3]<2),50,IF(RC[-3]>2,0))))))))) ->  | I258: =IF(RC[-1]="",RC[-2],0.7*RC[-1]+0.3*RC[-2]) -> 85
A259: شیر و گوشت زاگرس شهرکرد | B259: زشگزا | C259: =VLOOKUP(RC[-1],Sheet1!R3C2:R802C3,2,FALSE) -> زراعت و خدمات وابسته | D259: =VLOOKUP(RC[-2],Sheet1!R3C2:R802C9,8,FALSE) -> 7.5048364901288238 | E259: =IF(VLOOKUP(RC[-3],Sheet1!R3C2:R803C11,10,FALSE)=0,"",VLOOKUP(Sheet2!RC[-3],Sheet1!R[1]C[-3]:R[801]C[6],10,FALSE)) ->  | F259: =Sheet1!R295C10 -> 26.498020837806894 | G259: =IF(RC[-3]<0,0,IF(AND(RC[-3]<RC[-1],RC[-3]<2),100,IF(AND(RC[-3]<RC[-1],RC[-3]>=2,RC[-3]<3),95,IF(AND(RC[-3]<RC[-1],RC[-3]>=3,RC[-3]<4),90,IF(AND(RC[-3]<RC[-1],RC[-3]>=4,RC[-3]<5),85,IF(AND(RC[-3]<RC[-1],RC[-3]>=5,RC[-3]<6),80,IF(AND(RC[-3]<RC[-1],RC[-3]>=6,RC[-3]<7),75,IF(AND(RC[-3]<RC[-1],RC[-3]>=7,RC[-3]<8),70,IF(AND(RC[-3]<RC[-1],RC[-3]>=8,RC[-3]<9),65,IF(AND(RC[-3]<RC[-1],RC[-3]>=9,RC[-3]<10),60,IF(AND(RC[-3]<RC[-1],RC[-3]>=10,RC[-3]<11),55,IF(AND(RC[-3]<RC[-1],RC[-3]>=11,RC[-3]<12),50,IF(AND(RC[-3]<RC[-1],RC[-3]>=12,RC[-3]<13),45,IF(AND(RC[-3]<RC[-1],RC[-3]>=13,RC[-3]<14),40,IF(AND(RC[-3]<RC[-1],RC[-3]>=14,RC[-3]<15),35,IF(AND(RC[-3]<RC[-1],RC[-3]>=15,RC[-3]<16),30,IF(AND(RC[-3]<RC[-1],RC[-3]>=16,RC[-3]<17),25,IF(AND(RC[-3]<RC[-1],RC[-3]>=17,RC[-3]<18),20,IF(AND(RC[-3]<RC[-1],RC[-3]>=18,RC[-3]<19),15,IF(AND(RC[-3]<RC[-1],RC[-3]>=19,RC[-3]<20),10,IF(AND(RC[-3]<RC[-1],RC[-3]>=20,RC[-3]<21),5,IF(AND(RC[-3]<RC[-1],RC[-3]>=21),0,IF(AND(RC[-3]>RC[-1],RC[-3]>=2,RC[-3]<3),90,IF(AND(RC[-3]>RC[-1],RC[-3]>=3,RC[-3]<4),90,IF(AND(RC[-3]>RC[-1],RC[-3]>=4,RC[-3]<5),80,IF(AND(RC[-3]>RC[-1],RC[-3]>=5,RC[-3]<6),70,IF(AND(RC[-3]>RC[-1],RC[-3]>=6,RC[-3]<7),60,IF(AND(RC[-3]>RC[-1],RC[-3]>=7,RC[-3]<8),50,IF(AND(RC[-3]>RC[-1],RC[-3]>=8,RC[-3]<9),40,IF(AND(RC[-3]>RC[-1],RC[-3]>=9,RC[-3]<10),30,IF(AND(RC[-3]>RC[-1],RC[-3]>=10,RC[-3]<11),20,IF(AND(RC[-3]>RC[-1],RC[-3]>=11,RC[-3]<12),10,IF(AND(RC[-3]>RC[-1],RC[-3]>=12),0))))))))))))))))))))))))))))))))) -> 70 | H259: =IF(RC[-3]="","",IF(RC[-3]<0.3,100,IF(AND(RC[-3]>=0.3,RC[-3]>0.4),95,IF(AND(RC[-3]>=0.4,RC[-3]<0.5),90,IF(AND(RC[-3]>=0.5,RC[-3]<0.6),85,IF(AND(RC[-3]>=0.6,RC[-3]<0.7),80,IF(AND(RC[-3]>=0.6,RC[-3]<1),80,IF(AND(RC[-3]>1,RC[-3]<2),50,IF(RC[-3]>2,0))))))))) ->  | I259: =IF(RC[-1]="",RC[-2],0.7*RC[-1]+0.3*RC[-2]) -> 70
A260: گوشت مرغ ماهان | B260: زماهان | C260: =VLOOKUP(RC[-1],Sheet1!R3C2:R802C3,2,FALSE) -> زراعت و خدمات وابسته | D260: =VLOOKUP(RC[-2],Sheet1!R3C2:R802C9,8,FALSE) -> 7.8570615874412031 | E260: =IF(VLOOKUP(RC[-3],Sheet1!R3C2:R803C11,10,FALSE)=0,"",VLOOKUP(Sheet2!RC[-3],Sheet1!R[1]C[-3]:R[801]C[6],10,FALSE)) ->  | F260: =Sheet1!R295C10 -> 26.498020837806894 | G260: =IF(RC[-3]<0,0,IF(AND(RC[-3]<RC[-1],RC[-3]<2),100,IF(AND(RC[-3]<RC[-1],RC[-3]>=2,RC[-3]<3),95,IF(AND(RC[-3]<RC[-1],RC[-3]>=3,RC[-3]<4),90,IF(AND(RC[-3]<RC[-1],RC[-3]>=4,RC[-3]<5),85,IF(AND(RC[-3]<RC[-1],RC[-3]>=5,RC[-3]<6),80,IF(AND(RC[-3]<RC[-1],RC[-3]>=6,RC[-3]<7),75,IF(AND(RC[-3]<RC[-1],RC[-3]>=7,RC[-3]<8),70,IF(AND(RC[-3]<RC[-1],RC[-3]>=8,RC[-3]<9),65,IF(AND(RC[-3]<RC[-1],RC[-3]>=9,RC[-3]<10),60,IF(AND(RC[-3]<RC[-1],RC[-3]>=10,RC[-3]<11),55,IF(AND(RC[-3]<RC[-1],RC[-3]>=11,RC[-3]<12),50,IF(AND(RC[-3]<RC[-1],RC[-3]>=12,RC[-3]<13),45,IF(AND(RC[-3]<RC[-1],RC[-3]>=13,RC[-3]<14),40,IF(AND(RC[-3]<RC[-1],RC[-3]>=14,RC[-3]<15),35,IF(AND(RC[-3]<RC[-1],RC[-3]>=15,RC[-3]<16),30,IF(AND(RC[-3]<RC[-1],RC[-3]>=16,RC[-3]<17),25,IF(AND(RC[-3]<RC[-1],RC[-3]>=17,RC[-3]<18),20,IF(AND(RC[-3]<RC[-1],RC[-3]>=18,RC[-3]<19),15,IF(AND(RC[-3]<RC[-1],RC[-3]>=19,RC[-3]<20),10,IF(AND(RC[-3]<RC[-1],RC[-3]>=20,RC[-3]<21),5,IF(AND(RC[-3]<RC[-1],RC[-3]>=21),0,IF(AND(RC[-3]>RC[-1],RC[-3]>=2,RC[-3]<3),90,IF(AND(RC[-3]>RC[-1],RC[-3]>=3,RC[-3]<4),90,IF(AND(RC[-3]>RC[-1],RC[-3]>=4,RC[-3]<5),80,IF(AND(RC[-3]>RC[-1],RC[-3]>=5,RC[-3]<6),70,IF(AND(RC[-3]>RC[-1],RC[-3]>=6,RC[-3]<7),60,IF(AND(RC[-3]>RC[-1],RC[-3]>=7,RC[-3]<8),50,IF(AND(RC[-3]>RC[-1],RC[-3]>=8,RC[-3]<9),40,IF(AND(RC[-3]>RC[-1],RC[-3]>=9,RC[-3]<10),30,IF(AND(RC[-3]>RC[-1],RC[-3]>=10,RC[-3]<11),20,IF(AND(RC[-3]>RC[-1],RC[-3]>=11,RC[-3]<12),10,IF(AND(RC[-3]>RC[-1],RC[-3]>=12),0))))))))))))))))))))))))))))))))) -> 70 | H260: =IF(RC[-3]="","",IF(RC[-3]<0.3,100,IF(AND(RC[-3]>=0.3,RC[-3]>0.4),95,IF(AND(RC[-3]>=0.4,RC[-3]<0.5),90,IF(AND(RC[-3]>=0.5,RC[-3]<0.6),85,IF(AND(RC[-3]>=0.6,RC[-3]<0.7),80,IF(AND(RC[-3]>=0.6,RC[-3]<1),80,IF(AND(RC[-3]>1,RC[-3]<2),50,IF(RC[-3]>2,0))))))))) ->  | I260: =IF(RC[-1]="",RC[-2],0.7*RC[-1]+0.3*RC[-2]) -> 70
A261: مگسال | B261: زمگسا | C261: =VLOOKUP(RC[-1],Sheet1!R3C2:R802C3,2,FALSE) -> زراعت و خدمات وابسته | D261: =VLOOKUP(RC[-2],Sheet1!R3C2:R802C9,8,FALSE) -> 7.6142125061573642 | E261: =IF(VLOOKUP(RC[-3],Sheet1!R3C2:R803C11,10,FALSE)=0,"",VLOOKUP(Sheet2!RC[-3],Sheet1!R[1]C[-3]:R[801]C[6],10,FALSE)) ->  | F261: =Sheet1!R295C10 -> 26.498020837806894 | G261: =IF(RC[-3]<0,0,IF(AND(RC[-3]<RC[-1],RC[-3]<2),100,IF(AND(RC[-3]<RC[-1],RC[-3]>=2,RC[-3]<3),95,IF(AND(RC[-3]<RC[-1],RC[-3]>=3,RC[-3]<4),90,IF(AND(RC[-3]<RC[-1],RC[-3]>=4,RC[-3]<5),85,IF(AND(RC[-3]<RC[-1],RC[-3]>=5,RC[-3]<6),80,IF(AND(RC[-3]<RC[-1],RC[-3]>=6,RC[-3]<7),75,IF(AND(RC[-3]<RC[-1],RC[-3]>=7,RC[-3]<8),70,IF(AND(RC[-3]<RC[-1],RC[-3]>=8,RC[-3]<9),65,IF(AND(RC[-3]<RC[-1],RC[-3]>=9,RC[-3]<10),60,IF(AND(RC[-3]<RC[-1],RC[-3]>=10,RC[-3]<11),55,IF(AND(RC[-3]<RC[-1],RC[-3]>=11,RC[-3]<12),50,IF(AND(RC[-3]<RC[-1],RC[-3]>=12,RC[-3]<13),45,IF(AND(RC[-3]<RC[-1],RC[-3]>=13,RC[-3]<14),40,IF(AND(RC[-3]<RC[-1],RC[-3]>=14,RC[-3]<15),35,IF(AND(RC[-3]<RC[-1],RC[-3]>=15,RC[-3]<16),30,IF(AND(RC[-3]<RC[-1],RC[-3]>=16,RC[-3]<17),25,IF(AND(RC[-3]<RC[-1],RC[-3]>=17,RC[-3]<18),20,IF(AND(RC[-3]<RC[-1],RC[-3]>=18,RC[-3]<19),15,IF(AND(RC[-3]<RC[-1],RC[-3]>=19,RC[-3]<20),10,IF(AND(RC[-3]<RC[-1],RC[-3]>=20,RC[-3]<21),5,IF(AND(RC[-3]<RC[-1],RC[-3]>=21),0,IF(AND(RC[-3]>RC[-1],RC[-3]>=2,RC[-3]<3),90,IF(AND(RC[-3]>RC[-1],RC[-3]>=3,RC[-3]<4),90,IF(AND(RC[-3]>RC[-1],RC[-3]>=4,RC[-3]<5),80,IF(AND(RC[-3]>RC[-1],RC[-3]>=5,RC[-3]<6),70,IF(AND(RC[-3]>RC[-1],RC[-3]>=6,RC[-3]<7),60,IF(AND(RC[-3]>RC[-1],RC[-3]>=7,RC[-3]<8),50,IF(AND(RC[-3]>RC[-1],RC[-3]>=8,RC[-3]<9),40,IF(AND(RC[-3]>RC[-1],RC[-3]>=9,RC[-3]<10),30,IF(AND(RC[-3]>RC[-1],RC[-3]>=10,RC[-3]<11),20,IF(AND(RC[-3]>RC[-1],RC[-3]>=11,RC[-3]<12),10,IF(AND(RC[-3]>RC[-1],RC[-3]>=12),0))))))))))))))))))))))))))))))))) -> 70 | H261: =IF(RC[-3]="","",IF(RC[-3]<0.3,100,IF(AND(RC[-3]>=0.3,RC[-3]>0.4),95,IF(AND(RC[-3]>=0.4,RC[-3]<0.5),90,IF(AND(RC[-3]>=0.5,RC[-3]<0.6),85,IF(AND(RC[-3]>=0.6,RC[-3]<0.7),80,IF(AND(RC[-3]>=0.6,RC[-3]<1),80,IF(AND(RC[-3]>1,RC[-3]<2),50,IF(RC[-3]>2,0))))))))) ->  | I261: =IF(RC[-1]="",RC[-2],0.7*RC[-1]+0.3*RC[-2]) -> 70
A262: کشاورزی مکانیزه اصفهان کشت | B262: زکشت | C262: =VLOOKUP(RC[-1],Sheet1!R3C2:R802C3,2,FALSE) -> زراعت و خدمات وابسته | D262: =VLOOKUP(RC[-2],Sheet1!R3C2:R802C9,8,FALSE) -> 10.1586324544725 | E262: =IF(VLOOKUP(RC[-3],Sheet1!R3C2:R803C11,10,FALSE)=0,"",VLOOKUP(Sheet2!RC[-3],Sheet1!R[1]C[-3]:R[801]C[6],10,FALSE)) ->  | F262: =Sheet1!R295C10 -> 26.498020837806894 | G262: =IF(RC[-3]<0,0,IF(AND(RC[-3]<RC[-1],RC[-3]<2),100,IF(AND(RC[-3]<RC[-1],RC[-3]>=2,RC[-3]<3),95,IF(AND(RC[-3]<RC[-1],RC[-3]>=3,RC[-3]<4),90,IF(AND(RC[-3]<RC[-1],RC[-3]>=4,RC[-3]<5),85,IF(AND(RC[-3]<RC[-1],RC[-3]>=5,RC[-3]<6),80,IF(AND(RC[-3]<RC[-1],RC[-3]>=6,RC[-3]<7),75,IF(AND(RC[-3]<RC[-1],RC[-3]>=7,RC[-3]<8),70,IF(AND(RC[-3]<RC[-1],RC[-3]>=8,RC[-3]<9),65,IF(AND(RC[-3]<RC[-1],RC[-3]>=9,RC[-3]<10),60,IF(AND(RC[-3]<RC[-1],RC[-3]>=10,RC[-3]<11),55,IF(AND(RC[-3]<RC[-1],RC[-3]>=11,RC[-3]<12),50,IF(AND(RC[-3]<RC[-1],RC[-3]>=12,RC[-3]<13),45,IF(AND(RC[-3]<RC[-1],RC[-3]>=13,RC[-3]<14),40,IF(AND(RC[-3]<RC[-1],RC[-3]>=14,RC[-3]<15),35,IF(AND(RC[-3]<RC[-1],RC[-3]>=15,RC[-3]<16),30,IF(AND(RC[-3]<RC[-1],RC[-3]>=16,RC[-3]<17),25,IF(AND(RC[-3]<RC[-1],RC[-3]>=17,RC[-3]<18),20,IF(AND(RC[-3]<RC[-1],RC[-3]>=18,RC[-3]<19),15,IF(AND(RC[-3]<RC[-1],RC[-3]>=19,RC[-3]<20),10,IF(AND(RC[-3]<RC[-1],RC[-3]>=20,RC[-3]<21),5,IF(AND(RC[-3]<RC[-1],RC[-3]>=21),0,IF(AND(RC[-3]>RC[-1],RC[-3]>=2,RC[-3]<3),90,IF(AND(RC[-3]>RC[-1],RC[-3]>=3,RC[-3]<4),90,IF(AND(RC[-3]>RC[-1],RC[-3]>=4,RC[-3]<5),80,IF(AND(RC[-3]>RC[-1],RC[-3]>=5,RC[-3]<6),70,IF(AND(RC[-3]>RC[-1],RC[-3]>=6,RC[-3]<7),60,IF(AND(RC[-3]>RC[-1],RC[-3]>=7,RC[-3]<8),50,IF(AND(RC[-3]>RC[-1],RC[-3]>=8,RC[-3]<9),40,IF(AND(RC[-3]>RC[-1],RC[-3]>=9,RC[-3]<10),30,IF(AND(RC[-3]>RC[-1],RC[-3]>=10,RC[-3]<11),20,IF(AND(RC[-3]>RC[-1],RC[-3]>=11,RC[-3]<12),10,IF(AND(RC[-3]>RC[-1],RC[-3]>=12),0))))))))))))))))))))))))))))))))) -> 55 | H262: =IF(RC[-3]="","",IF(RC[-3]<0.3,100,IF(AND(RC[-3]>=0.3,RC[-3]>0.4),95,IF(AND(RC[-3]>=0.4,RC[-3]<0.5),90,IF(AND(RC[-3]>=0.5,RC[-3]<0.6),85,IF(AND(RC[-3]>=0.6,RC[-3]<0.7),80,IF(AND(RC[-3]>=0.6,RC[-3]<1),80,IF(AND(RC[-3]>1,RC[-3]<2),50,IF(RC[-3]>2,0))))))))) ->  | I262: =IF(RC[-1]="",RC[-2],0.7*RC[-1]+0.3*RC[-2]) -> 55
A263: کشاورزی و دامپروری بینالود | B263: زبینا | C263: =VLOOKUP(RC[-1],Sheet1!R3C2:R802C3,2,FALSE) -> زراعت و خدمات وابسته | D263: =VLOOKUP(RC[-2],Sheet1!R3C2:R802C9,8,FALSE) -> 8.8081266896584651 | E263: =IF(VLOOKUP(RC[-3],Sheet1!R3C2:R803C11,10,FALSE)=0,"",VLOOKUP(Sheet2!RC[-3],Sheet1!R[1]C[-3]:R[801]C[6],10,FALSE)) ->  | F263: =Sheet1!R295C10 -> 26.498020837806894 | G263: =IF(RC[-3]<0,0,IF(AND(RC[-3]<RC[-1],RC[-3]<2),100,IF(AND(RC[-3]<RC[-1],RC[-3]>=2,RC[-3]<3),95,IF(AND(RC[-3]<RC[-1],RC[-3]>=3,RC[-3]<4),90,IF(AND(RC[-3]<RC[-1],RC[-3]>=4,RC[-3]<5),85,IF(AND(RC[-3]<RC[-1],RC[-3]>=5,RC[-3]<6),80,IF(AND(RC[-3]<RC[-1],RC[-3]>=6,RC[-3]<7),75,IF(AND(RC[-3]<RC[-1],RC[-3]>=7,RC[-3]<8),70,IF(AND(RC[-3]<RC[-1],RC[-3]>=8,RC[-3]<9),65,IF(AND(RC[-3]<RC[-1],RC[-3]>=9,RC[-3]<10),60,IF(AND(RC[-3]<RC[-1],RC[-3]>=10,RC[-3]<11),55,IF(AND(RC[-3]<RC[-1],RC[-3]>=11,RC[-3]<12),50,IF(AND(RC[-3]<RC[-1],RC[-3]>=12,RC[-3]<13),45,IF(AND(RC[-3]<RC[-1],RC[-3]>=13,RC[-3]<14),40,IF(AND(RC[-3]<RC[-1],RC[-3]>=14,RC[-3]<15),35,IF(AND(RC[-3]<RC[-1],RC[-3]>=15,RC[-3]<16),30,IF(AND(RC[-3]<RC[-1],RC[-3]>=16,RC[-3]<17),25,IF(AND(RC[-3]<RC[-1],RC[-3]>=17,RC[-3]<18),20,IF(AND(RC[-3]<RC[-1],RC[-3]>=18,RC[-3]<19),15,IF(AND(RC[-3]<RC[-1],RC[-3]>=19,RC[-3]<20),10,IF(AND(RC[-3]<RC[-1],RC[-3]>=20,RC[-3]<21),5,IF(AND(RC[-3]<RC[-1],RC[-3]>=21),0,IF(AND(RC[-3]>RC[-1],RC[-3]>=2,RC[-3]<3),90,IF(AND(RC[-3]>RC[-1],RC[-3]>=3,RC[-3]<4),90,IF(AND(RC[-3]>RC[-1],RC[-3]>=4,RC[-3]<5),80,IF(AND(RC[-3]>RC[-1],RC[-3]>=5,RC[-3]<6),70,IF(AND(RC[-3]>RC[-1],RC[-3]>=6,RC[-3]<7),60,IF(AND(RC[-3]>RC[-1],RC[-3]>=7,RC[-3]<8),50,IF(AND(RC[-3]>RC[-1],RC[-3]>=8,RC[-3]<9),40,IF(AND(RC[-3]>RC[-1],RC[-3]>=9,RC[-3]<10),30,IF(AND(RC[-3]>RC[-1],RC[-3]>=10,RC[-3]<11),20,IF(AND(RC[-3]>RC[-1],RC[-3]>=11,RC[-3]<12),10,IF(AND(RC[-3]>RC[-1],RC[-3]>=12),0))))))))))))))))))))))))))))))))) -> 65 | H263: =IF(RC[-3]="","",IF(RC[-3]<0.3,100,IF(AND(RC[-3]>=0.3,RC[-3]>0.4),95,IF(AND(RC[-3]>=0.4,RC[-3]<0.5),90,IF(AND(RC[-3]>=0.5,RC[-3]<0.6),85,IF(AND(RC[-3]>=0.6,RC[-3]<0.7),80,IF(AND(RC[-3]>=0.6,RC[-3]<1),80,IF(AND(RC[-3]>1,RC[-3]<2),50,IF(RC[-3]>2,0))))))))) ->  | I263: =IF(RC[-1]="",RC[-2],0.7*RC[-1]+0.3*RC[-2]) -> 65
A264: کشاورزی و دامپروری ملارد شیر | B264: زملارد | C264: =VLOOKUP(RC[-1],Sheet1!R3C2:R802C3,2,FALSE) -> زراعت و خدمات وابسته | D264: =VLOOKUP(RC[-2],Sheet1!R3C2:R802C9,8,FALSE) -> 14.060663963494015 | E264: =IF(VLOOKUP(RC[-3],Sheet1!R3C2:R803C11,10,FALSE)=0,"",VLOOKUP(Sheet2!RC[-3],Sheet1!R[1]C[-3]:R[801]C[6],10,FALSE)) ->  | F264: =Sheet1!R295C10 -> 26.498020837806894 | G264: =IF(RC[-3]<0,0,IF(AND(RC[-3]<RC[-1],RC[-3]<2),100,IF(AND(RC[-3]<RC[-1],RC[-3]>=2,RC[-3]<3),95,IF(AND(RC[-3]<RC[-1],RC[-3]>=3,RC[-3]<4),90,IF(AND(RC[-3]<RC[-1],RC[-3]>=4,RC[-3]<5),85,IF(AND(RC[-3]<RC[-1],RC[-3]>=5,RC[-3]<6),80,IF(AND(RC[-3]<RC[-1],RC[-3]>=6,RC[-3]<7),75,IF(AND(RC[-3]<RC[-1],RC[-3]>=7,RC[-3]<8),70,IF(AND(RC[-3]<RC[-1],RC[-3]>=8,RC[-3]<9),65,IF(AND(RC[-3]<RC[-1],RC[-3]>=9,RC[-3]<10),60,IF(AND(RC[-3]<RC[-1],RC[-3]>=10,RC[-3]<11),55,IF(AND(RC[-3]<RC[-1],RC[-3]>=11,RC[-3]<12),50,IF(AND(RC[-3]<RC[-1],RC[-3]>=12,RC[-3]<13),45,IF(AND(RC[-3]<RC[-1],RC[-3]>=13,RC[-3]<14),40,IF(AND(RC[-3]<RC[-1],RC[-3]>=14,RC[-3]<15),35,IF(AND(RC[-3]<RC[-1],RC[-3]>=15,RC[-3]<16),30,IF(AND(RC[-3]<RC[-1],RC[-3]>=16,RC[-3]<17),25,IF(AND(RC[-3]<RC[-1],RC[-3]>=17,RC[-3]<18),20,IF(AND(RC[-3]<RC[-1],RC[-3]>=18,RC[-3]<19),15,IF(AND(RC[-3]<RC[-1],RC[-3]>=19,RC[-3]<20),10,IF(AND(RC[-3]<RC[-1],RC[-3]>=20,RC[-3]<21),5,IF(AND(RC[-3]<RC[-1],RC[-3]>=21),0,IF(AND(RC[-3]>RC[-1],RC[-3]>=2,RC[-3]<3),90,IF(AND(RC[-3]>RC[-1],RC[-3]>=3,RC[-3]<4),90,IF(AND(RC[-3]>RC[-1],RC[-3]>=4,RC[-3]<5),80,IF(AND(RC[-3]>RC[-1],RC[-3]>=5,RC[-3]<6),70,IF(AND(RC[-3]>RC[-1],RC[-3]>=6,RC[-3]<7),60,IF(AND(RC[-3]>RC[-1],RC[-3]>=7,RC[-3]<8),50,IF(AND(RC[-3]>RC[-1],RC[-3]>=8,RC[-3]<9),40,IF(AND(RC[-3]>RC[-1],RC[-3]>=9,RC[-3]<10),30,IF(AND(RC[-3]>RC[-1],RC[-3]>=10,RC[-3]<11),20,IF(AND(RC[-3]>RC[-1],RC[-3]>=11,RC[-3]<12),10,IF(AND(RC[-3]>RC[-1],RC[-3]>=12),0))))))))))))))))))))))))))))))))) -> 35 | H264: =IF(RC[-3]="","",IF(RC[-3]<0.3,100,IF(AND(RC[-3]>=0.3,RC[-3]>0.4),95,IF(AND(RC[-3]>=0.4,RC[-3]<0.5),90,IF(AND(RC[-3]>=0.5,RC[-3]<0.6),85,IF(AND(RC[-3]>=0.6,RC[-3]<0.7),80,IF(AND(RC[-3]>=0.6,RC[-3]<1),80,IF(AND(RC[-3]>1,RC[-3]<2),50,IF(RC[-3]>2,0))))))))) ->  | I264: =IF(RC[-1]="",RC[-2],0.7*RC[-1]+0.3*RC[-2]) -> 35
A265: کشت و دام قیام اصفهان | B265: زقیام | C265: =VLOOKUP(RC[-1],Sheet1!R3C2:R802C3,2,FALSE) -> زراعت و خدمات وابسته | D265: =VLOOKUP(RC[-2],Sheet1!R3C2:R802C9,8,FALSE) -> 10.015306502546197 | E265: =IF(VLOOKUP(RC[-3],Sheet1!R3C2:R803C11,10,FALSE)=0,"",VLOOKUP(Sheet2!RC[-3],Sheet1!R[1]C[-3]:R[801]C[6],10,FALSE)) ->  | F265: =Sheet1!R295C10 -> 26.498020837806894 | G265: =IF(RC[-3]<0,0,IF(AND(RC[-3]<RC[-1],RC[-3]<2),100,IF(AND(RC[-3]<RC[-1],RC[-3]>=2,RC[-3]<3),95,IF(AND(RC[-3]<RC[-1],RC[-3]>=3,RC[-3]<4),90,IF(AND(RC[-3]<RC[-1],RC[-3]>=4,RC[-3]<5),85,IF(AND(RC[-3]<RC[-1],RC[-3]>=5,RC[-3]<6),80,IF(AND(RC[-3]<RC[-1],RC[-3]>=6,RC[-3]<7),75,IF(AND(RC[-3]<RC[-1],RC[-3]>=7,RC[-3]<8),70,IF(AND(RC[-3]<RC[-1],RC[-3]>=8,RC[-3]<9),65,IF(AND(RC[-3]<RC[-1],RC[-3]>=9,RC[-3]<10),60,IF(AND(RC[-3]<RC[-1],RC[-3]>=10,RC[-3]<11),55,IF(AND(RC[-3]<RC[-1],RC[-3]>=11,RC[-3]<12),50,IF(AND(RC[-3]<RC[-1],RC[-3]>=12,RC[-3]<13),45,IF(AND(RC[-3]<RC[-1],RC[-3]>=13,RC[-3]<14),40,IF(AND(RC[-3]<RC[-1],RC[-3]>=14,RC[-3]<15),35,IF(AND(RC[-3]<RC[-1],RC[-3]>=15,RC[-3]<16),30,IF(AND(RC[-3]<RC[-1],RC[-3]>=16,RC[-3]<17),25,IF(AND(RC[-3]<RC[-1],RC[-3]>=17,RC[-3]<18),20,IF(AND(RC[-3]<RC[-1],RC[-3]>=18,RC[-3]<19),15,IF(AND(RC[-3]<RC[-1],RC[-3]>=19,RC[-3]<20),10,IF(AND(RC[-3]<RC[-1],RC[-3]>=20,RC[-3]<21),5,IF(AND(RC[-3]<RC[-1],RC[-3]>=21),0,IF(AND(RC[-3]>RC[-1],RC[-3]>=2,RC[-3]<3),90,IF(AND(RC[-3]>RC[-1],RC[-3]>=3,RC[-3]<4),90,IF(AND(RC[-3]>RC[-1],RC[-3]>=4,RC[-3]<5),80,IF(AND(RC[-3]>RC[-1],RC[-3]>=5,RC[-3]<6),70,IF(AND(RC[-3]>RC[-1],RC[-3]>=6,RC[-3]<7),60,IF(AND(RC[-3]>RC[-1],RC[-3]>=7,RC[-3]<8),50,IF(AND(RC[-3]>RC[-1],RC[-3]>=8,RC[-3]<9),40,IF(AND(RC[-3]>RC[-1],RC[-3]>=9,RC[-3]<10),30,IF(AND(RC[-3]>RC[-1],RC[-3]>=10,RC[-3]<11),20,IF(AND(RC[-3]>RC[-1],RC[-3]>=11,RC[-3]<12),10,IF(AND(RC[-3]>RC[-1],RC[-3]>=12),0))))))))))))))))))))))))))))))))) -> 55 | H265: =IF(RC[-3]="","",IF(RC[-3]<0.3,100,IF(AND(RC[-3]>=0.3,RC[-3]>0.4),95,IF(AND(RC[-3]>=0.4,RC[-3]<0.5),90,IF(AND(RC[-3]>=0.5,RC[-3]<0.6),85,IF(AND(RC[-3]>=0.6,RC[-3]<0.7),80,IF(AND(RC[-3]>=0.6,RC[-3]<1),80,IF(AND(RC[-3]>1,RC[-3]<2),50,IF(RC[-3]>2,0))))))))) ->  | I265: =IF(RC[-1]="",RC[-2],0.7*RC[-1]+0.3*RC[-2]) -> 55
A266: کشت و دام گلدشت نمونه اصفهان | B266: زگلدشت | C266: =VLOOKUP(RC[-1],Sheet1!R3C2:R802C3,2,FALSE) -> زراعت و خدمات وابسته | D266: =VLOOKUP(RC[-2],Sheet1!R3C2:R802C9,8,FALSE) -> 12.174872578832474 | E266: =IF(VLOOKUP(RC[-3],Sheet1!R3C2:R803C11,10,FALSE)=0,"",VLOOKUP(Sheet2!RC[-3],Sheet1!R[1]C[-3]:R[801]C[6],10,FALSE)) ->  | F266: =Sheet1!R295C10 -> 26.498020837806894 | G266: =IF(RC[-3]<0,0,IF(AND(RC[-3]<RC[-1],RC[-3]<2),100,IF(AND(RC[-3]<RC[-1],RC[-3]>=2,RC[-3]<3),95,IF(AND(RC[-3]<RC[-1],RC[-3]>=3,RC[-3]<4),90,IF(AND(RC[-3]<RC[-1],RC[-3]>=4,RC[-3]<5),85,IF(AND(RC[-3]<RC[-1],RC[-3]>=5,RC[-3]<6),80,IF(AND(RC[-3]<RC[-1],RC[-3]>=6,RC[-3]<7),75,IF(AND(RC[-3]<RC[-1],RC[-3]>=7,RC[-3]<8),70,IF(AND(RC[-3]<RC[-1],RC[-3]>=8,RC[-3]<9),65,IF(AND(RC[-3]<RC[-1],RC[-3]>=9,RC[-3]<10),60,IF(AND(RC[-3]<RC[-1],RC[-3]>=10,RC[-3]<11),55,IF(AND(RC[-3]<RC[-1],RC[-3]>=11,RC[-3]<12),50,IF(AND(RC[-3]<RC[-1],RC[-3]>=12,RC[-3]<13),45,IF(AND(RC[-3]<RC[-1],RC[-3]>=13,RC[-3]<14),40,IF(AND(RC[-3]<RC[-1],RC[-3]>=14,RC[-3]<15),35,IF(AND(RC[-3]<RC[-1],RC[-3]>=15,RC[-3]<16),30,IF(AND(RC[-3]<RC[-1],RC[-3]>=16,RC[-3]<17),25,IF(AND(RC[-3]<RC[-1],RC[-3]>=17,RC[-3]<18),20,IF(AND(RC[-3]<RC[-1],RC[-3]>=18,RC[-3]<19),15,IF(AND(RC[-3]<RC[-1],RC[-3]>=19,RC[-3]<20),10,IF(AND(RC[-3]<RC[-1],RC[-3]>=20,RC[-3]<21),5,IF(AND(RC[-3]<RC[-1],RC[-3]>=21),0,IF(AND(RC[-3]>RC[-1],RC[-3]>=2,RC[-3]<3),90,IF(AND(RC[-3]>RC[-1],RC[-3]>=3,RC[-3]<4),90,IF(AND(RC[-3]>RC[-1],RC[-3]>=4,RC[-3]<5),80,IF(AND(RC[-3]>RC[-1],RC[-3]>=5,RC[-3]<6),70,IF(AND(RC[-3]>RC[-1],RC[-3]>=6,RC[-3]<7),60,IF(AND(RC[-3]>RC[-1],RC[-3]>=7,RC[-3]<8),50,IF(AND(RC[-3]>RC[-1],RC[-3]>=8,RC[-3]<9),40,IF(AND(RC[-3]>RC[-1],RC[-3]>=9,RC[-3]<10),30,IF(AND(RC[-3]>RC[-1],RC[-3]>=10,RC[-3]<11),20,IF(AND(RC[-3]>RC[-1],RC[-3]>=11,RC[-3]<12),10,IF(AND(RC[-3]>RC[-1],RC[-3]>=12),0))))))))))))))))))))))))))))))))) -> 45 | H266: =IF(RC[-3]="","",IF(RC[-3]<0.3,100,IF(AND(RC[-3]>=0.3,RC[-3]>0.4),95,IF(AND(RC[-3]>=0.4,RC[-3]<0.5),90,IF(AND(RC[-3]>=0.5,RC[-3]<0.6),85,IF(AND(RC[-3]>=0.6,RC[-3]<0.7),80,IF(AND(RC[-3]>=0.6,RC[-3]<1),80,IF(AND(RC[-3]>1,RC[-3]<2),50,IF(RC[-3]>2,0))))))))) ->  | I266: =IF(RC[-1]="",RC[-2],0.7*RC[-1]+0.3*RC[-2]) -> 45
A267: کشت و دامداری فکا | B267: زفکا | C267: =VLOOKUP(RC[-1],Sheet1!R3C2:R802C3,2,FALSE) -> زراعت و خدمات وابسته | D267: =VLOOKUP(RC[-2],Sheet1!R3C2:R802C9,8,FALSE) -> 7.9299537687894155 | E267: =IF(VLOOKUP(RC[-3],Sheet1!R3C2:R803C11,10,FALSE)=0,"",VLOOKUP(Sheet2!RC[-3],Sheet1!R[1]C[-3]:R[801]C[6],10,FALSE)) ->  | F267: =Sheet1!R295C10 -> 26.498020837806894 | G267: =IF(RC[-3]<0,0,IF(AND(RC[-3]<RC[-1],RC[-3]<2),100,IF(AND(RC[-3]<RC[-1],RC[-3]>=2,RC[-3]<3),95,IF(AND(RC[-3]<RC[-1],RC[-3]>=3,RC[-3]<4),90,IF(AND(RC[-3]<RC[-1],RC[-3]>=4,RC[-3]<5),85,IF(AND(RC[-3]<RC[-1],RC[-3]>=5,RC[-3]<6),80,IF(AND(RC[-3]<RC[-1],RC[-3]>=6,RC[-3]<7),75,IF(AND(RC[-3]<RC[-1],RC[-3]>=7,RC[-3]<8),70,IF(AND(RC[-3]<RC[-1],RC[-3]>=8,RC[-3]<9),65,IF(AND(RC[-3]<RC[-1],RC[-3]>=9,RC[-3]<10),60,IF(AND(RC[-3]<RC[-1],RC[-3]>=10,RC[-3]<11),55,IF(AND(RC[-3]<RC[-1],RC[-3]>=11,RC[-3]<12),50,IF(AND(RC[-3]<RC[-1],RC[-3]>=12,RC[-3]<13),45,IF(AND(RC[-3]<RC[-1],RC[-3]>=13,RC[-3]<14),40,IF(AND(RC[-3]<RC[-1],RC[-3]>=14,RC[-3]<15),35,IF(AND(RC[-3]<RC[-1],RC[-3]>=15,RC[-3]<16),30,IF(AND(RC[-3]<RC[-1],RC[-3]>=16,RC[-3]<17),25,IF(AND(RC[-3]<RC[-1],RC[-3]>=17,RC[-3]<18),20,IF(AND(RC[-3]<RC[-1],RC[-3]>=18,RC[-3]<19),15,IF(AND(RC[-3]<RC[-1],RC[-3]>=19,RC[-3]<20),10,IF(AND(RC[-3]<RC[-1],RC[-3]>=20,RC[-3]<21),5,IF(AND(RC[-3]<RC[-1],RC[-3]>=21),0,IF(AND(RC[-3]>RC[-1],RC[-3]>=2,RC[-3]<3),90,IF(AND(RC[-3]>RC[-1],RC[-3]>=3,RC[-3]<4),90,IF(AND(RC[-3]>RC[-1],RC[-3]>=4,RC[-3]<5),80,IF(AND(RC[-3]>RC[-1],RC[-3]>=5,RC[-3]<6),70,IF(AND(RC[-3]>RC[-1],RC[-3]>=6,RC[-3]<7),60,IF(AND(RC[-3]>RC[-1],RC[-3]>=7,RC[-3]<8),50,IF(AND(RC[-3]>RC[-1],RC[-3]>=8,RC[-3]<9),40,IF(AND(RC[-3]>RC[-1],RC[-3]>=9,RC[-3]<10),30,IF(AND(RC[-3]>RC[-1],RC[-3]>=10,RC[-3]<11),20,IF(AND(RC[-3]>RC[-1],RC[-3]>=11,RC[-3]<12),10,IF(AND(RC[-3]>RC[-1],RC[-3]>=12),0))))))))))))))))))))))))))))))))) -> 70 | H267: =IF(RC[-3]="","",IF(RC[-3]<0.3,100,IF(AND(RC[-3]>=0.3,RC[-3]>0.4),95,IF(AND(RC[-3]>=0.4,RC[-3]<0.5),90,IF(AND(RC[-3]>=0.5,RC[-3]<0.6),85,IF(AND(RC[-3]>=0.6,RC[-3]<0.7),80,IF(AND(RC[-3]>=0.6,RC[-3]<1),80,IF(AND(RC[-3]>1,RC[-3]<2),50,IF(RC[-3]>2,0))))))))) ->  | I267: =IF(RC[-1]="",RC[-2],0.7*RC[-1]+0.3*RC[-2]) -> 70
A268: کشت و صنعت آبشیرین | B268: آبین | C268: =VLOOKUP(RC[-1],Sheet1!R3C2:R802C3,2,FALSE) -> زراعت و خدمات وابسته | D268: =VLOOKUP(RC[-2],Sheet1!R3C2:R802C9,8,FALSE) -> 189.51338782002932 | E268: =IF(VLOOKUP(RC[-3],Sheet1!R3C2:R803C11,10,FALSE)=0,"",VLOOKUP(Sheet2!RC[-3],Sheet1!R[1]C[-3]:R[801]C[6],10,FALSE)) ->  | F268: =Sheet1!R295C10 -> 26.498020837806894 | G268: =IF(RC[-3]<0,0,IF(AND(RC[-3]<RC[-1],RC[-3]<2),100,IF(AND(RC[-3]<RC[-1],RC[-3]>=2,RC[-3]<3),95,IF(AND(RC[-3]<RC[-1],RC[-3]>=3,RC[-3]<4),90,IF(AND(RC[-3]<RC[-1],RC[-3]>=4,RC[-3]<5),85,IF(AND(RC[-3]<RC[-1],RC[-3]>=5,RC[-3]<6),80,IF(AND(RC[-3]<RC[-1],RC[-3]>=6,RC[-3]<7),75,IF(AND(RC[-3]<RC[-1],RC[-3]>=7,RC[-3]<8),70,IF(AND(RC[-3]<RC[-1],RC[-3]>=8,RC[-3]<9),65,IF(AND(RC[-3]<RC[-1],RC[-3]>=9,RC[-3]<10),60,IF(AND(RC[-3]<RC[-1],RC[-3]>=10,RC[-3]<11),55,IF(AND(RC[-3]<RC[-1],RC[-3]>=11,RC[-3]<12),50,IF(AND(RC[-3]<RC[-1],RC[-3]>=12,RC[-3]<13),45,IF(AND(RC[-3]<RC[-1],RC[-3]>=13,RC[-3]<14),40,IF(AND(RC[-3]<RC[-1],RC[-3]>=14,RC[-3]<15),35,IF(AND(RC[-3]<RC[-1],RC[-3]>=15,RC[-3]<16),30,IF(AND(RC[-3]<RC[-1],RC[-3]>=16,RC[-3]<17),25,IF(AND(RC[-3]<RC[-1],RC[-3]>=17,RC[-3]<18),20,IF(AND(RC[-3]<RC[-1],RC[-3]>=18,RC[-3]<19),15,IF(AND(RC[-3]<RC[-1],RC[-3]>=19,RC[-3]<20),10,IF(AND(RC[-3]<RC[-1],RC[-3]>=20,RC[-3]<21),5,IF(AND(RC[-3]<RC[-1],RC[-3]>=21),0,IF(AND(RC[-3]>RC[-1],RC[-3]>=2,RC[-3]<3),90,IF(AND(RC[-3]>RC[-1],RC[-3]>=3,RC[-3]<4),90,IF(AND(RC[-3]>RC[-1],RC[-3]>=4,RC[-3]<5),80,IF(AND(RC[-3]>RC[-1],RC[-3]>=5,RC[-3]<6),70,IF(AND(RC[-3]>RC[-1],RC[-3]>=6,RC[-3]<7),60,IF(AND(RC[-3]>RC[-1],RC[-3]>=7,RC[-3]<8),50,IF(AND(RC[-3]>RC[-1],RC[-3]>=8,RC[-3]<9),40,IF(AND(RC[-3]>RC[-1],RC[-3]>=9,RC[-3]<10),30,IF(AND(RC[-3]>RC[-1],RC[-3]>=10,RC[-3]<11),20,IF(AND(RC[-3]>RC[-1],RC[-3]>=11,RC[-3]<12),10,IF(AND(RC[-3]>RC[-1],RC[-3]>=12),0))))))))))))))))))))))))))))))))) -> 0 | H268: =IF(RC[-3]="","",IF(RC[-3]<0.3,100,IF(AND(RC[-3]>=0.3,RC[-3]>0.4),95,IF(AND(RC[-3]>=0.4,RC[-3]<0.5),90,IF(AND(RC[-3]>=0.5,RC[-3]<0.6),85,IF(AND(RC[-3]>=0.6,RC[-3]<0.7),80,IF(AND(RC[-3]>=0.6,RC[-3]<1),80,IF(AND(RC[-3]>1,RC[-3]<2),50,IF(RC[-3]>2,0))))))))) ->  | I268: =IF(RC[-1]="",RC[-2],0.7*RC[-1]+0.3*RC[-2]) -> 0
A269: کشت و صنعت دشت خرمدره | B269: زدشت | C269: =VLOOKUP(RC[-1],Sheet1!R3C2:R802C3,2,FALSE) -> زراعت و خدمات وابسته | D269: =VLOOKUP(RC[-2],Sheet1!R3C2:R802C9,8,FALSE) -> 12.164320659368414 | E269: =IF(VLOOKUP(RC[-3],Sheet1!R3C2:R803C11,10,FALSE)=0,"",VLOOKUP(Sheet2!RC[-3],Sheet1!R[1]C[-3]:R[801]C[6],10,FALSE)) ->  | F269: =Sheet1!R295C10 -> 26.498020837806894 | G269: =IF(RC[-3]<0,0,IF(AND(RC[-3]<RC[-1],RC[-3]<2),100,IF(AND(RC[-3]<RC[-1],RC[-3]>=2,RC[-3]<3),95,IF(AND(RC[-3]<RC[-1],RC[-3]>=3,RC[-3]<4),90,IF(AND(RC[-3]<RC[-1],RC[-3]>=4,RC[-3]<5),85,IF(AND(RC[-3]<RC[-1],RC[-3]>=5,RC[-3]<6),80,IF(AND(RC[-3]<RC[-1],RC[-3]>=6,RC[-3]<7),75,IF(AND(RC[-3]<RC[-1],RC[-3]>=7,RC[-3]<8),70,IF(AND(RC[-3]<RC[-1],RC[-3]>=8,RC[-3]<9),65,IF(AND(RC[-3]<RC[-1],RC[-3]>=9,RC[-3]<10),60,IF(AND(RC[-3]<RC[-1],RC[-3]>=10,RC[-3]<11),55,IF(AND(RC[-3]<RC[-1],RC[-3]>=11,RC[-3]<12),50,IF(AND(RC[-3]<RC[-1],RC[-3]>=12,RC[-3]<13),45,IF(AND(RC[-3]<RC[-1],RC[-3]>=13,RC[-3]<14),40,IF(AND(RC[-3]<RC[-1],RC[-3]>=14,RC[-3]<15),35,IF(AND(RC[-3]<RC[-1],RC[-3]>=15,RC[-3]<16),30,IF(AND(RC[-3]<RC[-1],RC[-3]>=16,RC[-3]<17),25,IF(AND(RC[-3]<RC[-1],RC[-3]>=17,RC[-3]<18),20,IF(AND(RC[-3]<RC[-1],RC[-3]>=18,RC[-3]<19),15,IF(AND(RC[-3]<RC[-1],RC[-3]>=19,RC[-3]<20),10,IF(AND(RC[-3]<RC[-1],RC[-3]>=20,RC[-3]<21),5,IF(AND(RC[-3]<RC[-1],RC[-3]>=21),0,IF(AND(RC[-3]>RC[-1],RC[-3]>=2,RC[-3]<3),90,IF(AND(RC[-3]>RC[-1],RC[-3]>=3,RC[-3]<4),90,IF(AND(RC[-3]>RC[-1],RC[-3]>=4,RC[-3]<5),80,IF(AND(RC[-3]>RC[-1],RC[-3]>=5,RC[-3]<6),70,IF(AND(RC[-3]>RC[-1],RC[-3]>=6,RC[-3]<7),60,IF(AND(RC[-3]>RC[-1],RC[-3]>=7,RC[-3]<8),50,IF(AND(RC[-3]>RC[-1],RC[-3]>=8,RC[-3]<9),40,IF(AND(RC[-3]>RC[-1],RC[-3]>=9,RC[-3]<10),30,IF(AND(RC[-3]>RC[-1],RC[-3]>=10,RC[-3]<11),20,IF(AND(RC[-3]>RC[-1],RC[-3]>=11,RC[-3]<12),10,IF(AND(RC[-3]>RC[-1],RC[-3]>=12),0))))))))))))))))))))))))))))))))) -> 45 | H269: =IF(RC[-3]="","",IF(RC[-3]<0.3,100,IF(AND(RC[-3]>=0.3,RC[-3]>0.4),95,IF(AND(RC[-3]>=0.4,RC[-3]<0.5),90,IF(AND(RC[-3]>=0.5,RC[-3]<0.6),85,IF(AND(RC[-3]>=0.6,RC[-3]<0.7),80,IF(AND(RC[-3]>=0.6,RC[-3]<1),80,IF(AND(RC[-3]>1,RC[-3]<2),50,IF(RC[-3]>2,0))))))))) ->  | I269: =IF(RC[-1]="",RC[-2],0.7*RC[-1]+0.3*RC[-2]) -> 45
A270: کشت و صنعت شریف آباد | B270: زشریف | C270: =VLOOKUP(RC[-1],Sheet1!R3C2:R802C3,2,FALSE) -> زراعت و خدمات وابسته | D270: =VLOOKUP(RC[-2],Sheet1!R3C2:R802C9,8,FALSE) -> 7.5899753471988261 | E270: =IF(VLOOKUP(RC[-3],Sheet1!R3C2:R803C11,10,FALSE)=0,"",VLOOKUP(Sheet2!RC[-3],Sheet1!R[1]C[-3]:R[801]C[6],10,FALSE)) ->  | F270: =Sheet1!R295C10 -> 26.498020837806894 | G270: =IF(RC[-3]<0,0,IF(AND(RC[-3]<RC[-1],RC[-3]<2),100,IF(AND(RC[-3]<RC[-1],RC[-3]>=2,RC[-3]<3),95,IF(AND(RC[-3]<RC[-1],RC[-3]>=3,RC[-3]<4),90,IF(AND(RC[-3]<RC[-1],RC[-3]>=4,RC[-3]<5),85,IF(AND(RC[-3]<RC[-1],RC[-3]>=5,RC[-3]<6),80,IF(AND(RC[-3]<RC[-1],RC[-3]>=6,RC[-3]<7),75,IF(AND(RC[-3]<RC[-1],RC[-3]>=7,RC[-3]<8),70,IF(AND(RC[-3]<RC[-1],RC[-3]>=8,RC[-3]<9),65,IF(AND(RC[-3]<RC[-1],RC[-3]>=9,RC[-3]<10),60,IF(AND(RC[-3]<RC[-1],RC[-3]>=10,RC[-3]<11),55,IF(AND(RC[-3]<RC[-1],RC[-3]>=11,RC[-3]<12),50,IF(AND(RC[-3]<RC[-1],RC[-3]>=12,RC[-3]<13),45,IF(AND(RC[-3]<RC[-1],RC[-3]>=13,RC[-3]<14),40,IF(AND(RC[-3]<RC[-1],RC[-3]>=14,RC[-3]<15),35,IF(AND(RC[-3]<RC[-1],RC[-3]>=15,RC[-3]<16),30,IF(AND(RC[-3]<RC[-1],RC[-3]>=16,RC[-3]<17),25,IF(AND(RC[-3]<RC[-1],RC[-3]>=17,RC[-3]<18),20,IF(AND(RC[-3]<RC[-1],RC[-3]>=18,RC[-3]<19),15,IF(AND(RC[-3]<RC[-1],RC[-3]>=19,RC[-3]<20),10,IF(AND(RC[-3]<RC[-1],RC[-3]>=20,RC[-3]<21),5,IF(AND(RC[-3]<RC[-1],RC[-3]>=21),0,IF(AND(RC[-3]>RC[-1],RC[-3]>=2,RC[-3]<3),90,IF(AND(RC[-3]>RC[-1],RC[-3]>=3,RC[-3]<4),90,IF(AND(RC[-3]>RC[-1],RC[-3]>=4,RC[-3]<5),80,IF(AND(RC[-3]>RC[-1],RC[-3]>=5,RC[-3]<6),70,IF(AND(RC[-3]>RC[-1],RC[-3]>=6,RC[-3]<7),60,IF(AND(RC[-3]>RC[-1],RC[-3]>=7,RC[-3]<8),50,IF(AND(RC[-3]>RC[-1],RC[-3]>=8,RC[-3]<9),40,IF(AND(RC[-3]>RC[-1],RC[-3]>=9,RC[-3]<10),30,IF(AND(RC[-3]>RC[-1],RC[-3]>=10,RC[-3]<11),20,IF(AND(RC[-3]>RC[-1],RC[-3]>=11,RC[-3]<12),10,IF(AND(RC[-3]>RC[-1],RC[-3]>=12),0))))))))))))))))))))))))))))))))) -> 70 | H270: =IF(RC[-3]="","",IF(RC[-3]<0.3,100,IF(AND(RC[-3]>=0.3,RC[-3]>0.4),95,IF(AND(RC[-3]>=0.4,RC[-3]<0.5),90,IF(AND(RC[-3]>=0.5,RC[-3]<0.6),85,IF(AND(RC[-3]>=0.6,RC[-3]<0.7),80,IF(AND(RC[-3]>=0.6,RC[-3]<1),80,IF(AND(RC[-3]>1,RC[-3]<2),50,IF(RC[-3]>2,0))))))))) ->  | I270: =IF(RC[-1]="",RC[-2],0.7*RC[-1]+0.3*RC[-2]) -> 70
A271: کشت و صنعت و دامپروری پارس | B271: زپارس | C271: =VLOOKUP(RC[-1],Sheet1!R3C2:R802C3,2,FALSE) -> زراعت و خدمات وابسته | D271: =VLOOKUP(RC[-2],Sheet1!R3C2:R802C9,8,FALSE) -> 51.346376272917716 | E271: =IF(VLOOKUP(RC[-3],Sheet1!R3C2:R803C11,10,FALSE)=0,"",VLOOKUP(Sheet2!RC[-3],Sheet1!R[1]C[-3]:R[801]C[6],10,FALSE)) ->  | F271: =Sheet1!R295C10 -> 26.498020837806894 | G271: =IF(RC[-3]<0,0,IF(AND(RC[-3]<RC[-1],RC[-3]<2),100,IF(AND(RC[-3]<RC[-1],RC[-3]>=2,RC[-3]<3),95,IF(AND(RC[-3]<RC[-1],RC[-3]>=3,RC[-3]<4),90,IF(AND(RC[-3]<RC[-1],RC[-3]>=4,RC[-3]<5),85,IF(AND(RC[-3]<RC[-1],RC[-3]>=5,RC[-3]<6),80,IF(AND(RC[-3]<RC[-1],RC[-3]>=6,RC[-3]<7),75,IF(AND(RC[-3]<RC[-1],RC[-3]>=7,RC[-3]<8),70,IF(AND(RC[-3]<RC[-1],RC[-3]>=8,RC[-3]<9),65,IF(AND(RC[-3]<RC[-1],RC[-3]>=9,RC[-3]<10),60,IF(AND(RC[-3]<RC[-1],RC[-3]>=10,RC[-3]<11),55,IF(AND(RC[-3]<RC[-1],RC[-3]>=11,RC[-3]<12),50,IF(AND(RC[-3]<RC[-1],RC[-3]>=12,RC[-3]<13),45,IF(AND(RC[-3]<RC[-1],RC[-3]>=13,RC[-3]<14),40,IF(AND(RC[-3]<RC[-1],RC[-3]>=14,RC[-3]<15),35,IF(AND(RC[-3]<RC[-1],RC[-3]>=15,RC[-3]<16),30,IF(AND(RC[-3]<RC[-1],RC[-3]>=16,RC[-3]<17),25,IF(AND(RC[-3]<RC[-1],RC[-3]>=17,RC[-3]<18),20,IF(AND(RC[-3]<RC[-1],RC[-3]>=18,RC[-3]<19),15,IF(AND(RC[-3]<RC[-1],RC[-3]>=19,RC[-3]<20),10,IF(AND(RC[-3]<RC[-1],RC[-3]>=20,RC[-3]<21),5,IF(AND(RC[-3]<RC[-1],RC[-3]>=21),0,IF(AND(RC[-3]>RC[-1],RC[-3]>=2,RC[-3]<3),90,IF(AND(RC[-3]>RC[-1],RC[-3]>=3,RC[-3]<4),90,IF(AND(RC[-3]>RC[-1],RC[-3]>=4,RC[-3]<5),80,IF(AND(RC[-3]>RC[-1],RC[-3]>=5,RC[-3]<6),70,IF(AND(RC[-3]>RC[-1],RC[-3]>=6,RC[-3]<7),60,IF(AND(RC[-3]>RC[-1],RC[-3]>=7,RC[-3]<8),50,IF(AND(RC[-3]>RC[-1],RC[-3]>=8,RC[-3]<9),40,IF(AND(RC[-3]>RC[-1],RC[-3]>=9,RC[-3]<10),30,IF(AND(RC[-3]>RC[-1],RC[-3]>=10,RC[-3]<11),20,IF(AND(RC[-3]>RC[-1],RC[-3]>=11,RC[-3]<12),10,IF(AND(RC[-3]>RC[-1],RC[-3]>=12),0))))))))))))))))))))))))))))))))) -> 0 | H271: =IF(RC[-3]="","",IF(RC[-3]<0.3,100,IF(AND(RC[-3]>=0.3,RC[-3]>0.4),95,IF(AND(RC[-3]>=0.4,RC[-3]<0.5),90,IF(AND(RC[-3]>=0.5,RC[-3]<0.6),85,IF(AND(RC[-3]>=0.6,RC[-3]<0.7),80,IF(AND(RC[-3]>=0.6,RC[-3]<1),80,IF(AND(RC[-3]>1,RC[-3]<2),50,IF(RC[-3]>2,0))))))))) ->  | I271: =IF(RC[-1]="",RC[-2],0.7*RC[-1]+0.3*RC[-2]) -> 0
A272: لیزینگ پارسیان | B272: ولپارس | C272: =VLOOKUP(RC[-1],Sheet1!R3C2:R802C3,2,FALSE) -> سایر واسطه گریهای مالی | D272: =VLOOKUP(RC[-2],Sheet1!R3C2:R802C9,8,FALSE) -> 17.725985550615789 | E272: =IF(VLOOKUP(RC[-3],Sheet1!R3C2:R803C11,10,FALSE)=0,"",VLOOKUP(Sheet2!RC[-3],Sheet1!R[1]C[-3]:R[801]C[6],10,FALSE)) ->  | F272: =Sheet1!R300C10 -> 16.80901869261573 | G272: =IF(RC[-3]<0,0,IF(AND(RC[-3]<RC[-1],RC[-3]<2),100,IF(AND(RC[-3]<RC[-1],RC[-3]>=2,RC[-3]<3),95,IF(AND(RC[-3]<RC[-1],RC[-3]>=3,RC[-3]<4),90,IF(AND(RC[-3]<RC[-1],RC[-3]>=4,RC[-3]<5),85,IF(AND(RC[-3]<RC[-1],RC[-3]>=5,RC[-3]<6),80,IF(AND(RC[-3]<RC[-1],RC[-3]>=6,RC[-3]<7),75,IF(AND(RC[-3]<RC[-1],RC[-3]>=7,RC[-3]<8),70,IF(AND(RC[-3]<RC[-1],RC[-3]>=8,RC[-3]<9),65,IF(AND(RC[-3]<RC[-1],RC[-3]>=9,RC[-3]<10),60,IF(AND(RC[-3]<RC[-1],RC[-3]>=10,RC[-3]<11),55,IF(AND(RC[-3]<RC[-1],RC[-3]>=11,RC[-3]<12),50,IF(AND(RC[-3]<RC[-1],RC[-3]>=12,RC[-3]<13),45,IF(AND(RC[-3]<RC[-1],RC[-3]>=13,RC[-3]<14),40,IF(AND(RC[-3]<RC[-1],RC[-3]>=14,RC[-3]<15),35,IF(AND(RC[-3]<RC[-1],RC[-3]>=15,RC[-3]<16),30,IF(AND(RC[-3]<RC[-1],RC[-3]>=16,RC[-3]<17),25,IF(AND(RC[-3]<RC[-1],RC[-3]>=17,RC[-3]<18),20,IF(AND(RC[-3]<RC[-1],RC[-3]>=18,RC[-3]<19),15,IF(AND(RC[-3]<RC[-1],RC[-3]>=19,RC[-3]<20),10,IF(AND(RC[-3]<RC[-1],RC[-3]>=20,RC[-3]<21),5,IF(AND(RC[-3]<RC[-1],RC[-3]>=21),0,IF(AND(RC[-3]>RC[-1],RC[-3]>=2,RC[-3]<3),90,IF(AND(RC[-3]>RC[-1],RC[-3]>=3,RC[-3]<4),90,IF(AND(RC[-3]>RC[-1],RC[-3]>=4,RC[-3]<5),80,IF(AND(RC[-3]>RC[-1],RC[-3]>=5,RC[-3]<6),70,IF(AND(RC[-3]>RC[-1],RC[-3]>=6,RC[-3]<7),60,IF(AND(RC[-3]>RC[-1],RC[-3]>=7,RC[-3]<8),50,IF(AND(RC[-3]>RC[-1],RC[-3]>=8,RC[-3]<9),40,IF(AND(RC[-3]>RC[-1],RC[-3]>=9,RC[-3]<10),30,IF(AND(RC[-3]>RC[-1],RC[-3]>=10,RC[-3]<11),20,IF(AND(RC[-3]>RC[-1],RC[-3]>=11,RC[-3]<12),10,IF(AND(RC[-3]>RC[-1],RC[-3]>=12),0))))))))))))))))))))))))))))))))) -> 0 | H272: =IF(RC[-3]="","",IF(RC[-3]<0.3,100,IF(AND(RC[-3]>=0.3,RC[-3]>0.4),95,IF(AND(RC[-3]>=0.4,RC[-3]<0.5),90,IF(AND(RC[-3]>=0.5,RC[-3]<0.6),85,IF(AND(RC[-3]>=0.6,RC[-3]<0.7),80,IF(AND(RC[-3]>=0.6,RC[-3]<1),80,IF(AND(RC[-3]>1,RC[-3]<2),50,IF(RC[-3]>2,0))))))))) ->  | I272: =IF(RC[-1]="",RC[-2],0.7*RC[-1]+0.3*RC[-2]) -> 0
A273: لیزینگ کارآفرین | B273: ولکار | C273: =VLOOKUP(RC[-1],Sheet1!R3C2:R802C3,2,FALSE) -> سایر واسطه گریهای مالی | D273: =VLOOKUP(RC[-2],Sheet1!R3C2:R802C9,8,FALSE) -> 16.245760044103836 | E273: =IF(VLOOKUP(RC[-3],Sheet1!R3C2:R803C11,10,FALSE)=0,"",VLOOKUP(Sheet2!RC[-3],Sheet1!R[1]C[-3]:R[801]C[6],10,FALSE)) ->  | F273: =Sheet1!R300C10 -> 16.80901869261573 | G273: =IF(RC[-3]<0,0,IF(AND(RC[-3]<RC[-1],RC[-3]<2),100,IF(AND(RC[-3]<RC[-1],RC[-3]>=2,RC[-3]<3),95,IF(AND(RC[-3]<RC[-1],RC[-3]>=3,RC[-3]<4),90,IF(AND(RC[-3]<RC[-1],RC[-3]>=4,RC[-3]<5),85,IF(AND(RC[-3]<RC[-1],RC[-3]>=5,RC[-3]<6),80,IF(AND(RC[-3]<RC[-1],RC[-3]>=6,RC[-3]<7),75,IF(AND(RC[-3]<RC[-1],RC[-3]>=7,RC[-3]<8),70,IF(AND(RC[-3]<RC[-1],RC[-3]>=8,RC[-3]<9),65,IF(AND(RC[-3]<RC[-1],RC[-3]>=9,RC[-3]<10),60,IF(AND(RC[-3]<RC[-1],RC[-3]>=10,RC[-3]<11),55,IF(AND(RC[-3]<RC[-1],RC[-3]>=11,RC[-3]<12),50,IF(AND(RC[-3]<RC[-1],RC[-3]>=12,RC[-3]<13),45,IF(AND(RC[-3]<RC[-1],RC[-3]>=13,RC[-3]<14),40,IF(AND(RC[-3]<RC[-1],RC[-3]>=14,RC[-3]<15),35,IF(AND(RC[-3]<RC[-1],RC[-3]>=15,RC[-3]<16),30,IF(AND(RC[-3]<RC[-1],RC[-3]>=16,RC[-3]<17),25,IF(AND(RC[-3]<RC[-1],RC[-3]>=17,RC[-3]<18),20,IF(AND(RC[-3]<RC[-1],RC[-3]>=18,RC[-3]<19),15,IF(AND(RC[-3]<RC[-1],RC[-3]>=19,RC[-3]<20),10,IF(AND(RC[-3]<RC[-1],RC[-3]>=20,RC[-3]<21),5,IF(AND(RC[-3]<RC[-1],RC[-3]>=21),0,IF(AND(RC[-3]>RC[-1],RC[-3]>=2,RC[-3]<3),90,IF(AND(RC[-3]>RC[-1],RC[-3]>=3,RC[-3]<4),90,IF(AND(RC[-3]>RC[-1],RC[-3]>=4,RC[-3]<5),80,IF(AND(RC[-3]>RC[-1],RC[-3]>=5,RC[-3]<6),70,IF(AND(RC[-3]>RC[-1],RC[-3]>=6,RC[-3]<7),60,IF(AND(RC[-3]>RC[-1],RC[-3]>=7,RC[-3]<8),50,IF(AND(RC[-3]>RC[-1],RC[-3]>=8,RC[-3]<9),40,IF(AND(RC[-3]>RC[-1],RC[-3]>=9,RC[-3]<10),30,IF(AND(RC[-3]>RC[-1],RC[-3]>=10,RC[-3]<11),20,IF(AND(RC[-3]>RC[-1],RC[-3]>=11,RC[-3]<12),10,IF(AND(RC[-3]>RC[-1],RC[-3]>=12),0))))))))))))))))))))))))))))))))) -> 25 | H273: =IF(RC[-3]="","",IF(RC[-3]<0.3,100,IF(AND(RC[-3]>=0.3,RC[-3]>0.4),95,IF(AND(RC[-3]>=0.4,RC[-3]<0.5),90,IF(AND(RC[-3]>=0.5,RC[-3]<0.6),85,IF(AND(RC[-3]>=0.6,RC[-3]<0.7),80,IF(AND(RC[-3]>=0.6,RC[-3]<1),80,IF(AND(RC[-3]>1,RC[-3]<2),50,IF(RC[-3]>2,0))))))))) ->  | I273: =IF(RC[-1]="",RC[-2],0.7*RC[-1]+0.3*RC[-2]) -> 25
A274: توسعه اقتصادی آرین | B274: وآرین | C274: =VLOOKUP(RC[-1],Sheet1!R3C2:R802C3,2,FALSE) -> سرمایه گذاریها | D274: =VLOOKUP(RC[-2],Sheet1!R3C2:R802C9,8,FALSE) -> 15.3125 | E274: =IF(VLOOKUP(RC[-3],Sheet1!R3C2:R803C11,10,FALSE)=0,"",VLOOKUP(Sheet2!RC[-3],Sheet1!R[1]C[-3]:R[801]C[6],10,FALSE)) -> 0.9 | F274: =Sheet1!R375C10 -> 11.524146113687122 | G274: =IF(RC[-3]<0,0,IF(AND(RC[-3]<RC[-1],RC[-3]<2),100,IF(AND(RC[-3]<RC[-1],RC[-3]>=2,RC[-3]<3),95,IF(AND(RC[-3]<RC[-1],RC[-3]>=3,RC[-3]<4),90,IF(AND(RC[-3]<RC[-1],RC[-3]>=4,RC[-3]<5),85,IF(AND(RC[-3]<RC[-1],RC[-3]>=5,RC[-3]<6),80,IF(AND(RC[-3]<RC[-1],RC[-3]>=6,RC[-3]<7),75,IF(AND(RC[-3]<RC[-1],RC[-3]>=7,RC[-3]<8),70,IF(AND(RC[-3]<RC[-1],RC[-3]>=8,RC[-3]<9),65,IF(AND(RC[-3]<RC[-1],RC[-3]>=9,RC[-3]<10),60,IF(AND(RC[-3]<RC[-1],RC[-3]>=10,RC[-3]<11),55,IF(AND(RC[-3]<RC[-1],RC[-3]>=11,RC[-3]<12),50,IF(AND(RC[-3]<RC[-1],RC[-3]>=12,RC[-3]<13),45,IF(AND(RC[-3]<RC[-1],RC[-3]>=13,RC[-3]<14),40,IF(AND(RC[-3]<RC[-1],RC[-3]>=14,RC[-3]<15),35,IF(AND(RC[-3]<RC[-1],RC[-3]>=15,RC[-3]<16),30,IF(AND(RC[-3]<RC[-1],RC[-3]>=16,RC[-3]<17),25,IF(AND(RC[-3]<RC[-1],RC[-3]>=17,RC[-3]<18),20,IF(AND(RC[-3]<RC[-1],RC[-3]>=18,RC[-3]<19),15,IF(AND(RC[-3]<RC[-1],RC[-3]>=19,RC[-3]<20),10,IF(AND(RC[-3]<RC[-1],RC[-3]>=20,RC[-3]<21),5,IF(AND(RC[-3]<RC[-1],RC[-3]>=21),0,IF(AND(RC[-3]>RC[-1],RC[-3]>=2,RC[-3]<3),90,IF(AND(RC[-3]>RC[-1],RC[-3]>=3,RC[-3]<4),90,IF(AND(RC[-3]>RC[-1],RC[-3]>=4,RC[-3]<5),80,IF(AND(RC[-3]>RC[-1],RC[-3]>=5,RC[-3]<6),70,IF(AND(RC[-3]>RC[-1],RC[-3]>=6,RC[-3]<7),60,IF(AND(RC[-3]>RC[-1],RC[-3]>=7,RC[-3]<8),50,IF(AND(RC[-3]>RC[-1],RC[-3]>=8,RC[-3]<9),40,IF(AND(RC[-3]>RC[-1],RC[-3]>=9,RC[-3]<10),30,IF(AND(RC[-3]>RC[-1],RC[-3]>=10,RC[-3]<11),20,IF(AND(RC[-3]>RC[-1],RC[-3]>=11,RC[-3]<12),10,IF(AND(RC[-3]>RC[-1],RC[-3]>=12),0))))))))))))))))))))))))))))))))) -> 0 | H274: =IF(RC[-3]="","",IF(RC[-3]<0.3,100,IF(AND(RC[-3]>=0.3,RC[-3]>0.4),95,IF(AND(RC[-3]>=0.4,RC[-3]<0.5),90,IF(AND(RC[-3]>=0.5,RC[-3]<0.6),85,IF(AND(RC[-3]>=0.6,RC[-3]<0.7),80,IF(AND(RC[-3]>=0.6,RC[-3]<1),80,IF(AND(RC[-3]>1,RC[-3]<2),50,IF(RC[-3]>2,0))))))))) -> 95 | I274: =IF(RC[-1]="",RC[-2],0.7*RC[-1]+0.3*RC[-2]) -> 66.5
A275: تکادو | B275: وکادو | C275: =VLOOKUP(RC[-1],Sheet1!R3C2:R802C3,2,FALSE) -> سرمایه گذاریها | D275: =VLOOKUP(RC[-2],Sheet1!R3C2:R802C9,8,FALSE) -> 4.4733850880608212 | E275: =IF(VLOOKUP(RC[-3],Sheet1!R3C2:R803C11,10,FALSE)=0,"",VLOOKUP(Sheet2!RC[-3],Sheet1!R[1]C[-3]:R[801]C[6],10,FALSE)) -> 0.45 | F275: =Sheet1!R375C10 -> 11.524146113687122 | G275: =IF(RC[-3]<0,0,IF(AND(RC[-3]<RC[-1],RC[-3]<2),100,IF(AND(RC[-3]<RC[-1],RC[-3]>=2,RC[-3]<3),95,IF(AND(RC[-3]<RC[-1],RC[-3]>=3,RC[-3]<4),90,IF(AND(RC[-3]<RC[-1],RC[-3]>=4,RC[-3]<5),85,IF(AND(RC[-3]<RC[-1],RC[-3]>=5,RC[-3]<6),80,IF(AND(RC[-3]<RC[-1],RC[-3]>=6,RC[-3]<7),75,IF(AND(RC[-3]<RC[-1],RC[-3]>=7,RC[-3]<8),70,IF(AND(RC[-3]<RC[-1],RC[-3]>=8,RC[-3]<9),65,IF(AND(RC[-3]<RC[-1],RC[-3]>=9,RC[-3]<10),60,IF(AND(RC[-3]<RC[-1],RC[-3]>=10,RC[-3]<11),55,IF(AND(RC[-3]<RC[-1],RC[-3]>=11,RC[-3]<12),50,IF(AND(RC[-3]<RC[-1],RC[-3]>=12,RC[-3]<13),45,IF(AND(RC[-3]<RC[-1],RC[-3]>=13,RC[-3]<14),40,IF(AND(RC[-3]<RC[-1],RC[-3]>=14,RC[-3]<15),35,IF(AND(RC[-3]<RC[-1],RC[-3]>=15,RC[-3]<16),30,IF(AND(RC[-3]<RC[-1],RC[-3]>=16,RC[-3]<17),25,IF(AND(RC[-3]<RC[-1],RC[-3]>=17,RC[-3]<18),20,IF(AND(RC[-3]<RC[-1],RC[-3]>=18,RC[-3]<19),15,IF(AND(RC[-3]<RC[-1],RC[-3]>=19,RC[-3]<20),10,IF(AND(RC[-3]<RC[-1],RC[-3]>=20,RC[-3]<21),5,IF(AND(RC[-3]<RC[-1],RC[-3]>=21),0,IF(AND(RC[-3]>RC[-1],RC[-3]>=2,RC[-3]<3),90,IF(AND(RC[-3]>RC[-1],RC[-3]>=3,RC[-3]<4),90,IF(AND(RC[-3]>RC[-1],RC[-3]>=4,RC[-3]<5),80,IF(AND(RC[-3]>RC[-1],RC[-3]>=5,RC[-3]<6),70,IF(AND(RC[-3]>RC[-1],RC[-3]>=6,RC[-3]<7),60,IF(AND(RC[-3]>RC[-1],RC[-3]>=7,RC[-3]<8),50,IF(AND(RC[-3]>RC[-1],RC[-3]>=8,RC[-3]<9),40,IF(AND(RC[-3]>RC[-1],RC[-3]>=9,RC[-3]<10),30,IF(AND(RC[-3]>RC[-1],RC[-3]>=10,RC[-3]<11),20,IF(AND(RC[-3]>RC[-1],RC[-3]>=11,RC[-3]<12),10,IF(AND(RC[-3]>RC[-1],RC[-3]>=12),0))))))))))))))))))))))))))))))))) -> 85 | H275: =IF(RC[-3]="","",IF(RC[-3]<0.3,100,IF(AND(RC[-3]>=0.3,RC[-3]>0.4),95,IF(AND(RC[-3]>=0.4,RC[-3]<0.5),90,IF(AND(RC[-3]>=0.5,RC[-3]<0.6),85,IF(AND(RC[-3]>=0.6,RC[-3]<0.7),80,IF(AND(RC[-3]>=0.6,RC[-3]<1),80,IF(AND(RC[-3]>1,RC[-3]<2),50,IF(RC[-3]>2,0))))))))) -> 95 | I275: =IF(RC[-1]="",RC[-2],0.7*RC[-1]+0.3*RC[-2]) -> 92
A276: س. امین توان آفرین ساز | B276: وامین | C276: =VLOOKUP(RC[-1],Sheet1!R3C2:R802C3,2,FALSE) -> سرمایه گذاریها | D276: =VLOOKUP(RC[-2],Sheet1!R3C2:R802C9,8,FALSE) -> 11.322240873653227 | E276: =IF(VLOOKUP(RC[-3],Sheet1!R3C2:R803C11,10,FALSE)=0,"",VLOOKUP(Sheet2!RC[-3],Sheet1!R[1]C[-3]:R[801]C[6],10,FALSE)) -> 0.55000000000000004 | F276: =Sheet1!R375C10 -> 11.524146113687122 | G276: =IF(RC[-3]<0,0,IF(AND(RC[-3]<RC[-1],RC[-3]<2),100,IF(AND(RC[-3]<RC[-1],RC[-3]>=2,RC[-3]<3),95,IF(AND(RC[-3]<RC[-1],RC[-3]>=3,RC[-3]<4),90,IF(AND(RC[-3]<RC[-1],RC[-3]>=4,RC[-3]<5),85,IF(AND(RC[-3]<RC[-1],RC[-3]>=5,RC[-3]<6),80,IF(AND(RC[-3]<RC[-1],RC[-3]>=6,RC[-3]<7),75,IF(AND(RC[-3]<RC[-1],RC[-3]>=7,RC[-3]<8),70,IF(AND(RC[-3]<RC[-1],RC[-3]>=8,RC[-3]<9),65,IF(AND(RC[-3]<RC[-1],RC[-3]>=9,RC[-3]<10),60,IF(AND(RC[-3]<RC[-1],RC[-3]>=10,RC[-3]<11),55,IF(AND(RC[-3]<RC[-1],RC[-3]>=11,RC[-3]<12),50,IF(AND(RC[-3]<RC[-1],RC[-3]>=12,RC[-3]<13),45,IF(AND(RC[-3]<RC[-1],RC[-3]>=13,RC[-3]<14),40,IF(AND(RC[-3]<RC[-1],RC[-3]>=14,RC[-3]<15),35,IF(AND(RC[-3]<RC[-1],RC[-3]>=15,RC[-3]<16),30,IF(AND(RC[-3]<RC[-1],RC[-3]>=16,RC[-3]<17),25,IF(AND(RC[-3]<RC[-1],RC[-3]>=17,RC[-3]<18),20,IF(AND(RC[-3]<RC[-1],RC[-3]>=18,RC[-3]<19),15,IF(AND(RC[-3]<RC[-1],RC[-3]>=19,RC[-3]<20),10,IF(AND(RC[-3]<RC[-1],RC[-3]>=20,RC[-3]<21),5,IF(AND(RC[-3]<RC[-1],RC[-3]>=21),0,IF(AND(RC[-3]>RC[-1],RC[-3]>=2,RC[-3]<3),90,IF(AND(RC[-3]>RC[-1],RC[-3]>=3,RC[-3]<4),90,IF(AND(RC[-3]>RC[-1],RC[-3]>=4,RC[-3]<5),80,IF(AND(RC[-3]>RC[-1],RC[-3]>=5,RC[-3]<6),70,IF(AND(RC[-3]>RC[-1],RC[-3]>=6,RC[-3]<7),60,IF(AND(RC[-3]>RC[-1],RC[-3]>=7,RC[-3]<8),50,IF(AND(RC[-3]>RC[-1],RC[-3]>=8,RC[-3]<9),40,IF(AND(RC[-3]>RC[-1],RC[-3]>=9,RC[-3]<10),30,IF(AND(RC[-3]>RC[-1],RC[-3]>=10,RC[-3]<11),20,IF(AND(RC[-3]>RC[-1],RC[-3]>=11,RC[-3]<12),10,IF(AND(RC[-3]>RC[-1],RC[-3]>=12),0))))))))))))))))))))))))))))))))) -> 50 | H276: =IF(RC[-3]="","",IF(RC[-3]<0.3,100,IF(AND(RC[-3]>=0.3,RC[-3]>0.4),95,IF(AND(RC[-3]>=0.4,RC[-3]<0.5),90,IF(AND(RC[-3]>=0.5,RC[-3]<0.6),85,IF(AND(RC[-3]>=0.6,RC[-3]<0.7),80,IF(AND(RC[-3]>=0.6,RC[-3]<1),80,IF(AND(RC[-3]>1,RC[-3]<2),50,IF(RC[-3]>2,0))))))))) -> 95 | I276: =IF(RC[-1]="",RC[-2],0.7*RC[-1]+0.3*RC[-2]) -> 81.5
A277: س.ص. بازنشستگی کارکنان بانکها | B277: وسکاب | C277: =VLOOKUP(RC[-1],Sheet1!R3C2:R802C3,2,FALSE) -> سرمایه گذاریها | D277: =VLOOKUP(RC[-2],Sheet1!R3C2:R802C9,8,FALSE) -> 2.1868178974219084 | E277: =IF(VLOOKUP(RC[-3],Sheet1!R3C2:R803C11,10,FALSE)=0,"",VLOOKUP(Sheet2!RC[-3],Sheet1!R[1]C[-3]:R[801]C[6],10,FALSE)) -> 0.64 | F277: =Sheet1!R375C10 -> 11.524146113687122 | G277: =IF(RC[-3]<0,0,IF(AND(RC[-3]<RC[-1],RC[-3]<2),100,IF(AND(RC[-3]<RC[-1],RC[-3]>=2,RC[-3]<3),95,IF(AND(RC[-3]<RC[-1],RC[-3]>=3,RC[-3]<4),90,IF(AND(RC[-3]<RC[-1],RC[-3]>=4,RC[-3]<5),85,IF(AND(RC[-3]<RC[-1],RC[-3]>=5,RC[-3]<6),80,IF(AND(RC[-3]<RC[-1],RC[-3]>=6,RC[-3]<7),75,IF(AND(RC[-3]<RC[-1],RC[-3]>=7,RC[-3]<8),70,IF(AND(RC[-3]<RC[-1],RC[-3]>=8,RC[-3]<9),65,IF(AND(RC[-3]<RC[-1],RC[-3]>=9,RC[-3]<10),60,IF(AND(RC[-3]<RC[-1],RC[-3]>=10,RC[-3]<11),55,IF(AND(RC[-3]<RC[-1],RC[-3]>=11,RC[-3]<12),50,IF(AND(RC[-3]<RC[-1],RC[-3]>=12,RC[-3]<13),45,IF(AND(RC[-3]<RC[-1],RC[-3]>=13,RC[-3]<14),40,IF(AND(RC[-3]<RC[-1],RC[-3]>=14,RC[-3]<15),35,IF(AND(RC[-3]<RC[-1],RC[-3]>=15,RC[-3]<16),30,IF(AND(RC[-3]<RC[-1],RC[-3]>=16,RC[-3]<17),25,IF(AND(RC[-3]<RC[-1],RC[-3]>=17,RC[-3]<18),20,IF(AND(RC[-3]<RC[-1],RC[-3]>=18,RC[-3]<19),15,IF(AND(RC[-3]<RC[-1],RC[-3]>=19,RC[-3]<20),10,IF(AND(RC[-3]<RC[-1],RC[-3]>=20,RC[-3]<21),5,IF(AND(RC[-3]<RC[-1],RC[-3]>=21),0,IF(AND(RC[-3]>RC[-1],RC[-3]>=2,RC[-3]<3),90,IF(AND(RC[-3]>RC[-1],RC[-3]>=3,RC[-3]<4),90,IF(AND(RC[-3]>RC[-1],RC[-3]>=4,RC[-3]<5),80,IF(AND(RC[-3]>RC[-1],RC[-3]>=5,RC[-3]<6),70,IF(AND(RC[-3]>RC[-1],RC[-3]>=6,RC[-3]<7),60,IF(AND(RC[-3]>RC[-1],RC[-3]>=7,RC[-3]<8),50,IF(AND(RC[-3]>RC[-1],RC[-3]>=8,RC[-3]<9),40,IF(AND(RC[-3]>RC[-1],RC[-3]>=9,RC[-3]<10),30,IF(AND(RC[-3]>RC[-1],RC[-3]>=10,RC[-3]<11),20,IF(AND(RC[-3]>RC[-1],RC[-3]>=11,RC[-3]<12),10,IF(AND(RC[-3]>RC[-1],RC[-3]>=12),0))))))))))))))))))))))))))))))))) -> 95 | H277: =IF(RC[-3]="","",IF(RC[-3]<0.3,100,IF(AND(RC[-3]>=0.3,RC[-3]>0.4),95,IF(AND(RC[-3]>=0.4,RC[-3]<0.5),90,IF(AND(RC[-3]>=0.5,RC[-3]<0.6),85,IF(AND(RC[-3]>=0.6,RC[-3]<0.7),80,IF(AND(RC[-3]>=0.6,RC[-3]<1),80,IF(AND(RC[-3]>1,RC[-3]<2),50,IF(RC[-3]>2,0))))))))) -> 95 | I277: =IF(RC[-1]="",RC[-2],0.7*RC[-1]+0.3*RC[-2]) -> 95
A278: سر. آتیه دماوند | B278: واتی | C278: =VLOOKUP(RC[-1],Sheet1!R3C2:R802C3,2,FALSE) -> سرمایه گذاریها | D278: =VLOOKUP(RC[-2],Sheet1!R3C2:R802C9,8,FALSE) -> 3.188977648746663 | E278: =IF(VLOOKUP(RC[-3],Sheet1!R3C2:R803C11,10,FALSE)=0,"",VLOOKUP(Sheet2!RC[-3],Sheet1!R[1]C[-3]:R[801]C[6],10,FALSE)) -> 0.45 | F278: =Sheet1!R375C10 -> 11.524146113687122 | G278: =IF(RC[-3]<0,0,IF(AND(RC[-3]<RC[-1],RC[-3]<2),100,IF(AND(RC[-3]<RC[-1],RC[-3]>=2,RC[-3]<3),95,IF(AND(RC[-3]<RC[-1],RC[-3]>=3,RC[-3]<4),90,IF(AND(RC[-3]<RC[-1],RC[-3]>=4,RC[-3]<5),85,IF(AND(RC[-3]<RC[-1],RC[-3]>=5,RC[-3]<6),80,IF(AND(RC[-3]<RC[-1],RC[-3]>=6,RC[-3]<7),75,IF(AND(RC[-3]<RC[-1],RC[-3]>=7,RC[-3]<8),70,IF(AND(RC[-3]<RC[-1],RC[-3]>=8,RC[-3]<9),65,IF(AND(RC[-3]<RC[-1],RC[-3]>=9,RC[-3]<10),60,IF(AND(RC[-3]<RC[-1],RC[-3]>=10,RC[-3]<11),55,IF(AND(RC[-3]<RC[-1],RC[-3]>=11,RC[-3]<12),50,IF(AND(RC[-3]<RC[-1],RC[-3]>=12,RC[-3]<13),45,IF(AND(RC[-3]<RC[-1],RC[-3]>=13,RC[-3]<14),40,IF(AND(RC[-3]<RC[-1],RC[-3]>=14,RC[-3]<15),35,IF(AND(RC[-3]<RC[-1],RC[-3]>=15,RC[-3]<16),30,IF(AND(RC[-3]<RC[-1],RC[-3]>=16,RC[-3]<17),25,IF(AND(RC[-3]<RC[-1],RC[-3]>=17,RC[-3]<18),20,IF(AND(RC[-3]<RC[-1],RC[-3]>=18,RC[-3]<19),15,IF(AND(RC[-3]<RC[-1],RC[-3]>=19,RC[-3]<20),10,IF(AND(RC[-3]<RC[-1],RC[-3]>=20,RC[-3]<21),5,IF(AND(RC[-3]<RC[-1],RC[-3]>=21),0,IF(AND(RC[-3]>RC[-1],RC[-3]>=2,RC[-3]<3),90,IF(AND(RC[-3]>RC[-1],RC[-3]>=3,RC[-3]<4),90,IF(AND(RC[-3]>RC[-1],RC[-3]>=4,RC[-3]<5),80,IF(AND(RC[-3]>RC[-1],RC[-3]>=5,RC[-3]<6),70,IF(AND(RC[-3]>RC[-1],RC[-3]>=6,RC[-3]<7),60,IF(AND(RC[-3]>RC[-1],RC[-3]>=7,RC[-3]<8),50,IF(AND(RC[-3]>RC[-1],RC[-3]>=8,RC[-3]<9),40,IF(AND(RC[-3]>RC[-1],RC[-3]>=9,RC[-3]<10),30,IF(AND(RC[-3]>RC[-1],RC[-3]>=10,RC[-3]<11),20,IF(AND(RC[-3]>RC[-1],RC[-3]>=11,RC[-3]<12),10,IF(AND(RC[-3]>RC[-1],RC[-3]>=12),0))))))))))))))))))))))))))))))))) -> 90 | H278: =IF(RC[-3]="","",IF(RC[-3]<0.3,100,IF(AND(RC[-3]>=0.3,RC[-3]>0.4),95,IF(AND(RC[-3]>=0.4,RC[-3]<0.5),90,IF(AND(RC[-3]>=0.5,RC[-3]<0.6),85,IF(AND(RC[-3]>=0.6,RC[-3]<0.7),80,IF(AND(RC[-3]>=0.6,RC[-3]<1),80,IF(AND(RC[-3]>1,RC[-3]<2),50,IF(RC[-3]>2,0))))))))) -> 95 | I278: =IF(RC[-1]="",RC[-2],0.7*RC[-1]+0.3*RC[-2]) -> 93.5
A279: سر. آوا نوین | B279: وآوا | C279: =VLOOKUP(RC[-1],Sheet1!R3C2:R802C3,2,FALSE) -> سرمایه گذاریها | D279: =VLOOKUP(RC[-2],Sheet1!R3C2:R802C9,8,FALSE) -> 2.9661760733293643 | E279: =IF(VLOOKUP(RC[-3],Sheet1!R3C2:R803C11,10,FALSE)=0,"",VLOOKUP(Sheet2!RC[-3],Sheet1!R[1]C[-3]:R[801]C[6],10,FALSE)) -> 1.2 | F279: =Sheet1!R375C10 -> 11.524146113687122 | G279: =IF(RC[-3]<0,0,IF(AND(RC[-3]<RC[-1],RC[-3]<2),100,IF(AND(RC[-3]<RC[-1],RC[-3]>=2,RC[-3]<3),95,IF(AND(RC[-3]<RC[-1],RC[-3]>=3,RC[-3]<4),90,IF(AND(RC[-3]<RC[-1],RC[-3]>=4,RC[-3]<5),85,IF(AND(RC[-3]<RC[-1],RC[-3]>=5,RC[-3]<6),80,IF(AND(RC[-3]<RC[-1],RC[-3]>=6,RC[-3]<7),75,IF(AND(RC[-3]<RC[-1],RC[-3]>=7,RC[-3]<8),70,IF(AND(RC[-3]<RC[-1],RC[-3]>=8,RC[-3]<9),65,IF(AND(RC[-3]<RC[-1],RC[-3]>=9,RC[-3]<10),60,IF(AND(RC[-3]<RC[-1],RC[-3]>=10,RC[-3]<11),55,IF(AND(RC[-3]<RC[-1],RC[-3]>=11,RC[-3]<12),50,IF(AND(RC[-3]<RC[-1],RC[-3]>=12,RC[-3]<13),45,IF(AND(RC[-3]<RC[-1],RC[-3]>=13,RC[-3]<14),40,IF(AND(RC[-3]<RC[-1],RC[-3]>=14,RC[-3]<15),35,IF(AND(RC[-3]<RC[-1],RC[-3]>=15,RC[-3]<16),30,IF(AND(RC[-3]<RC[-1],RC[-3]>=16,RC[-3]<17),25,IF(AND(RC[-3]<RC[-1],RC[-3]>=17,RC[-3]<18),20,IF(AND(RC[-3]<RC[-1],RC[-3]>=18,RC[-3]<19),15,IF(AND(RC[-3]<RC[-1],RC[-3]>=19,RC[-3]<20),10,IF(AND(RC[-3]<RC[-1],RC[-3]>=20,RC[-3]<21),5,IF(AND(RC[-3]<RC[-1],RC[-3]>=21),0,IF(AND(RC[-3]>RC[-1],RC[-3]>=2,RC[-3]<3),90,IF(AND(RC[-3]>RC[-1],RC[-3]>=3,RC[-3]<4),90,IF(AND(RC[-3]>RC[-1],RC[-3]>=4,RC[-3]<5),80,IF(AND(RC[-3]>RC[-1],RC[-3]>=5,RC[-3]<6),70,IF(AND(RC[-3]>RC[-1],RC[-3]>=6,RC[-3]<7),60,IF(AND(RC[-3]>RC[-1],RC[-3]>=7,RC[-3]<8),50,IF(AND(RC[-3]>RC[-1],RC[-3]>=8,RC[-3]<9),40,IF(AND(RC[-3]>RC[-1],RC[-3]>=9,RC[-3]<10),30,IF(AND(RC[-3]>RC[-1],RC[-3]>=10,RC[-3]<11),20,IF(AND(RC[-3]>RC[-1],RC[-3]>=11,RC[-3]<12),10,IF(AND(RC[-3]>RC[-1],RC[-3]>=12),0))))))))))))))))))))))))))))))))) -> 95 | H279: =IF(RC[-3]="","",IF(RC[-3]<0.3,100,IF(AND(RC[-3]>=0.3,RC[-3]>0.4),95,IF(AND(RC[-3]>=0.4,RC[-3]<0.5),90,IF(AND(RC[-3]>=0.5,RC[-3]<0.6),85,IF(AND(RC[-3]>=0.6,RC[-3]<0.7),80,IF(AND(RC[-3]>=0.6,RC[-3]<1),80,IF(AND(RC[-3]>1,RC[-3]<2),50,IF(RC[-3]>2,0))))))))) -> 95 | I279: =IF(RC[-1]="",RC[-2],0.7*RC[-1]+0.3*RC[-2]) -> 95
A280: سر. ارزش آفرینان | B280: وآفر | C280: =VLOOKUP(RC[-1],Sheet1!R3C2:R802C3,2,FALSE) -> سرمایه گذاریها | D280: =VLOOKUP(RC[-2],Sheet1!R3C2:R802C9,8,FALSE) -> 4.0307763300195232 | E280: =IF(VLOOKUP(RC[-3],Sheet1!R3C2:R803C11,10,FALSE)=0,"",VLOOKUP(Sheet2!RC[-3],Sheet1!R[1]C[-3]:R[801]C[6],10,FALSE)) -> 0.9 | F280: =Sheet1!R375C10 -> 11.524146113687122 | G280: =IF(RC[-3]<0,0,IF(AND(RC[-3]<RC[-1],RC[-3]<2),100,IF(AND(RC[-3]<RC[-1],RC[-3]>=2,RC[-3]<3),95,IF(AND(RC[-3]<RC[-1],RC[-3]>=3,RC[-3]<4),90,IF(AND(RC[-3]<RC[-1],RC[-3]>=4,RC[-3]<5),85,IF(AND(RC[-3]<RC[-1],RC[-3]>=5,RC[-3]<6),80,IF(AND(RC[-3]<RC[-1],RC[-3]>=6,RC[-3]<7),75,IF(AND(RC[-3]<RC[-1],RC[-3]>=7,RC[-3]<8),70,IF(AND(RC[-3]<RC[-1],RC[-3]>=8,RC[-3]<9),65,IF(AND(RC[-3]<RC[-1],RC[-3]>=9,RC[-3]<10),60,IF(AND(RC[-3]<RC[-1],RC[-3]>=10,RC[-3]<11),55,IF(AND(RC[-3]<RC[-1],RC[-3]>=11,RC[-3]<12),50,IF(AND(RC[-3]<RC[-1],RC[-3]>=12,RC[-3]<13),45,IF(AND(RC[-3]<RC[-1],RC[-3]>=13,RC[-3]<14),40,IF(AND(RC[-3]<RC[-1],RC[-3]>=14,RC[-3]<15),35,IF(AND(RC[-3]<RC[-1],RC[-3]>=15,RC[-3]<16),30,IF(AND(RC[-3]<RC[-1],RC[-3]>=16,RC[-3]<17),25,IF(AND(RC[-3]<RC[-1],RC[-3]>=17,RC[-3]<18),20,IF(AND(RC[-3]<RC[-1],RC[-3]>=18,RC[-3]<19),15,IF(AND(RC[-3]<RC[-1],RC[-3]>=19,RC[-3]<20),10,IF(AND(RC[-3]<RC[-1],RC[-3]>=20,RC[-3]<21),5,IF(AND(RC[-3]<RC[-1],RC[-3]>=21),0,IF(AND(RC[-3]>RC[-1],RC[-3]>=2,RC[-3]<3),90,IF(AND(RC[-3]>RC[-1],RC[-3]>=3,RC[-3]<4),90,IF(AND(RC[-3]>RC[-1],RC[-3]>=4,RC[-3]<5),80,IF(AND(RC[-3]>RC[-1],RC[-3]>=5,RC[-3]<6),70,IF(AND(RC[-3]>RC[-1],RC[-3]>=6,RC[-3]<7),60,IF(AND(RC[-3]>RC[-1],RC[-3]>=7,RC[-3]<8),50,IF(AND(RC[-3]>RC[-1],RC[-3]>=8,RC[-3]<9),40,IF(AND(RC[-3]>RC[-1],RC[-3]>=9,RC[-3]<10),30,IF(AND(RC[-3]>RC[-1],RC[-3]>=10,RC[-3]<11),20,IF(AND(RC[-3]>RC[-1],RC[-3]>=11,RC[-3]<12),10,IF(AND(RC[-3]>RC[-1],RC[-3]>=12),0))))))))))))))))))))))))))))))))) -> 85 | H280: =IF(RC[-3]="","",IF(RC[-3]<0.3,100,IF(AND(RC[-3]>=0.3,RC[-3]>0.4),95,IF(AND(RC[-3]>=0.4,RC[-3]<0.5),90,IF(AND(RC[-3]>=0.5,RC[-3]<0.6),85,IF(AND(RC[-3]>=0.6,RC[-3]<0.7),80,IF(AND(RC[-3]>=0.6,RC[-3]<1),80,IF(AND(RC[-3]>1,RC[-3]<2),50,IF(RC[-3]>2,0))))))))) -> 95 | I280: =IF(RC[-1]="",RC[-2],0.7*RC[-1]+0.3*RC[-2]) -> 92
A281: سر. استان آذربایجان شرقی | B281: وساشرقی | C281: =VLOOKUP(RC[-1],Sheet1!R3C2:R802C3,2,FALSE) -> سرمایه گذاریها | D281: =VLOOKUP(RC[-2],Sheet1!R3C2:R802C9,8,FALSE) -> 1.7038520987670429 | E281: =IF(VLOOKUP(RC[-3],Sheet1!R3C2:R803C11,10,FALSE)=0,"",VLOOKUP(Sheet2!RC[-3],Sheet1!R[1]C[-3]:R[801]C[6],10,FALSE)) ->  | F281: =Sheet1!R375C10 -> 11.524146113687122 | G281: =IF(RC[-3]<0,0,IF(AND(RC[-3]<RC[-1],RC[-3]<2),100,IF(AND(RC[-3]<RC[-1],RC[-3]>=2,RC[-3]<3),95,IF(AND(RC[-3]<RC[-1],RC[-3]>=3,RC[-3]<4),90,IF(AND(RC[-3]<RC[-1],RC[-3]>=4,RC[-3]<5),85,IF(AND(RC[-3]<RC[-1],RC[-3]>=5,RC[-3]<6),80,IF(AND(RC[-3]<RC[-1],RC[-3]>=6,RC[-3]<7),75,IF(AND(RC[-3]<RC[-1],RC[-3]>=7,RC[-3]<8),70,IF(AND(RC[-3]<RC[-1],RC[-3]>=8,RC[-3]<9),65,IF(AND(RC[-3]<RC[-1],RC[-3]>=9,RC[-3]<10),60,IF(AND(RC[-3]<RC[-1],RC[-3]>=10,RC[-3]<11),55,IF(AND(RC[-3]<RC[-1],RC[-3]>=11,RC[-3]<12),50,IF(AND(RC[-3]<RC[-1],RC[-3]>=12,RC[-3]<13),45,IF(AND(RC[-3]<RC[-1],RC[-3]>=13,RC[-3]<14),40,IF(AND(RC[-3]<RC[-1],RC[-3]>=14,RC[-3]<15),35,IF(AND(RC[-3]<RC[-1],RC[-3]>=15,RC[-3]<16),30,IF(AND(RC[-3]<RC[-1],RC[-3]>=16,RC[-3]<17),25,IF(AND(RC[-3]<RC[-1],RC[-3]>=17,RC[-3]<18),20,IF(AND(RC[-3]<RC[-1],RC[-3]>=18,RC[-3]<19),15,IF(AND(RC[-3]<RC[-1],RC[-3]>=19,RC[-3]<20),10,IF(AND(RC[-3]<RC[-1],RC[-3]>=20,RC[-3]<21),5,IF(AND(RC[-3]<RC[-1],RC[-3]>=21),0,IF(AND(RC[-3]>RC[-1],RC[-3]>=2,RC[-3]<3),90,IF(AND(RC[-3]>RC[-1],RC[-3]>=3,RC[-3]<4),90,IF(AND(RC[-3]>RC[-1],RC[-3]>=4,RC[-3]<5),80,IF(AND(RC[-3]>RC[-1],RC[-3]>=5,RC[-3]<6),70,IF(AND(RC[-3]>RC[-1],RC[-3]>=6,RC[-3]<7),60,IF(AND(RC[-3]>RC[-1],RC[-3]>=7,RC[-3]<8),50,IF(AND(RC[-3]>RC[-1],RC[-3]>=8,RC[-3]<9),40,IF(AND(RC[-3]>RC[-1],RC[-3]>=9,RC[-3]<10),30,IF(AND(RC[-3]>RC[-1],RC[-3]>=10,RC[-3]<11),20,IF(AND(RC[-3]>RC[-1],RC[-3]>=11,RC[-3]<12),10,IF(AND(RC[-3]>RC[-1],RC[-3]>=12),0))))))))))))))))))))))))))))))))) -> 100 | H281: =IF(RC[-3]="","",IF(RC[-3]<0.3,100,IF(AND(RC[-3]>=0.3,RC[-3]>0.4),95,IF(AND(RC[-3]>=0.4,RC[-3]<0.5),90,IF(AND(RC[-3]>=0.5,RC[-3]<0.6),85,IF(AND(RC[-3]>=0.6,RC[-3]<0.7),80,IF(AND(RC[-3]>=0.6,RC[-3]<1),80,IF(AND(RC[-3]>1,RC[-3]<2),50,IF(RC[-3]>2,0))))))))) ->  | I281: =IF(RC[-1]="",RC[-2],0.7*RC[-1]+0.3*RC[-2]) -> 100
A282: سر. استان آذربایجان غربی | B282: وساغربی | C282: =VLOOKUP(RC[-1],Sheet1!R3C2:R802C3,2,FALSE) -> سرمایه گذاریها | D282: =VLOOKUP(RC[-2],Sheet1!R3C2:R802C9,8,FALSE) -> 1.172042468413487E-6 | E282: =IF(VLOOKUP(RC[-3],Sheet1!R3C2:R803C11,10,FALSE)=0,"",VLOOKUP(Sheet2!RC[-3],Sheet1!R[1]C[-3]:R[801]C[6],10,FALSE)) ->  | F282: =Sheet1!R375C10 -> 11.524146113687122 | G282: =IF(RC[-3]<0,0,IF(AND(RC[-3]<RC[-1],RC[-3]<2),100,IF(AND(RC[-3]<RC[-1],RC[-3]>=2,RC[-3]<3),95,IF(AND(RC[-3]<RC[-1],RC[-3]>=3,RC[-3]<4),90,IF(AND(RC[-3]<RC[-1],RC[-3]>=4,RC[-3]<5),85,IF(AND(RC[-3]<RC[-1],RC[-3]>=5,RC[-3]<6),80,IF(AND(RC[-3]<RC[-1],RC[-3]>=6,RC[-3]<7),75,IF(AND(RC[-3]<RC[-1],RC[-3]>=7,RC[-3]<8),70,IF(AND(RC[-3]<RC[-1],RC[-3]>=8,RC[-3]<9),65,IF(AND(RC[-3]<RC[-1],RC[-3]>=9,RC[-3]<10),60,IF(AND(RC[-3]<RC[-1],RC[-3]>=10,RC[-3]<11),55,IF(AND(RC[-3]<RC[-1],RC[-3]>=11,RC[-3]<12),50,IF(AND(RC[-3]<RC[-1],RC[-3]>=12,RC[-3]<13),45,IF(AND(RC[-3]<RC[-1],RC[-3]>=13,RC[-3]<14),40,IF(AND(RC[-3]<RC[-1],RC[-3]>=14,RC[-3]<15),35,IF(AND(RC[-3]<RC[-1],RC[-3]>=15,RC[-3]<16),30,IF(AND(RC[-3]<RC[-1],RC[-3]>=16,RC[-3]<17),25,IF(AND(RC[-3]<RC[-1],RC[-3]>=17,RC[-3]<18),20,IF(AND(RC[-3]<RC[-1],RC[-3]>=18,RC[-3]<19),15,IF(AND(RC[-3]<RC[-1],RC[-3]>=19,RC[-3]<20),10,IF(AND(RC[-3]<RC[-1],RC[-3]>=20,RC[-3]<21),5,IF(AND(RC[-3]<RC[-1],RC[-3]>=21),0,IF(AND(RC[-3]>RC[-1],RC[-3]>=2,RC[-3]<3),90,IF(AND(RC[-3]>RC[-1],RC[-3]>=3,RC[-3]<4),90,IF(AND(RC[-3]>RC[-1],RC[-3]>=4,RC[-3]<5),80,IF(AND(RC[-3]>RC[-1],RC[-3]>=5,RC[-3]<6),70,IF(AND(RC[-3]>RC[-1],RC[-3]>=6,RC[-3]<7),60,IF(AND(RC[-3]>RC[-1],RC[-3]>=7,RC[-3]<8),50,IF(AND(RC[-3]>RC[-1],RC[-3]>=8,RC[-3]<9),40,IF(AND(RC[-3]>RC[-1],RC[-3]>=9,RC[-3]<10),30,IF(AND(RC[-3]>RC[-1],RC[-3]>=10,RC[-3]<11),20,IF(AND(RC[-3]>RC[-1],RC[-3]>=11,RC[-3]<12),10,IF(AND(RC[-3]>RC[-1],RC[-3]>=12),0))))))))))))))))))))))))))))))))) -> 100 | H282: =IF(RC[-3]="","",IF(RC[-3]<0.3,100,IF(AND(RC[-3]>=0.3,RC[-3]>0.4),95,IF(AND(RC[-3]>=0.4,RC[-3]<0.5),90,IF(AND(RC[-3]>=0.5,RC[-3]<0.6),85,IF(AND(RC[-3]>=0.6,RC[-3]<0.7),80,IF(AND(RC[-3]>=0.6,RC[-3]<1),80,IF(AND(RC[-3]>1,RC[-3]<2),50,IF(RC[-3]>2,0))))))))) ->  | I282: =IF(RC[-1]="",RC[-2],0.7*RC[-1]+0.3*RC[-2]) -> 100
A283: سر. استان اردبیل | B283: وساربیل | C283: =VLOOKUP(RC[-1],Sheet1!R3C2:R802C3,2,FALSE) -> سرمایه گذاریها | D283: =VLOOKUP(RC[-2],Sheet1!R3C2:R802C9,8,FALSE) -> 0.97090066830083621 | E283: =IF(VLOOKUP(RC[-3],Sheet1!R3C2:R803C11,10,FALSE)=0,"",VLOOKUP(Sheet2!RC[-3],Sheet1!R[1]C[-3]:R[801]C[6],10,FALSE)) ->  | F283: =Sheet1!R375C10 -> 11.524146113687122 | G283: =IF(RC[-3]<0,0,IF(AND(RC[-3]<RC[-1],RC[-3]<2),100,IF(AND(RC[-3]<RC[-1],RC[-3]>=2,RC[-3]<3),95,IF(AND(RC[-3]<RC[-1],RC[-3]>=3,RC[-3]<4),90,IF(AND(RC[-3]<RC[-1],RC[-3]>=4,RC[-3]<5),85,IF(AND(RC[-3]<RC[-1],RC[-3]>=5,RC[-3]<6),80,IF(AND(RC[-3]<RC[-1],RC[-3]>=6,RC[-3]<7),75,IF(AND(RC[-3]<RC[-1],RC[-3]>=7,RC[-3]<8),70,IF(AND(RC[-3]<RC[-1],RC[-3]>=8,RC[-3]<9),65,IF(AND(RC[-3]<RC[-1],RC[-3]>=9,RC[-3]<10),60,IF(AND(RC[-3]<RC[-1],RC[-3]>=10,RC[-3]<11),55,IF(AND(RC[-3]<RC[-1],RC[-3]>=11,RC[-3]<12),50,IF(AND(RC[-3]<RC[-1],RC[-3]>=12,RC[-3]<13),45,IF(AND(RC[-3]<RC[-1],RC[-3]>=13,RC[-3]<14),40,IF(AND(RC[-3]<RC[-1],RC[-3]>=14,RC[-3]<15),35,IF(AND(RC[-3]<RC[-1],RC[-3]>=15,RC[-3]<16),30,IF(AND(RC[-3]<RC[-1],RC[-3]>=16,RC[-3]<17),25,IF(AND(RC[-3]<RC[-1],RC[-3]>=17,RC[-3]<18),20,IF(AND(RC[-3]<RC[-1],RC[-3]>=18,RC[-3]<19),15,IF(AND(RC[-3]<RC[-1],RC[-3]>=19,RC[-3]<20),10,IF(AND(RC[-3]<RC[-1],RC[-3]>=20,RC[-3]<21),5,IF(AND(RC[-3]<RC[-1],RC[-3]>=21),0,IF(AND(RC[-3]>RC[-1],RC[-3]>=2,RC[-3]<3),90,IF(AND(RC[-3]>RC[-1],RC[-3]>=3,RC[-3]<4),90,IF(AND(RC[-3]>RC[-1],RC[-3]>=4,RC[-3]<5),80,IF(AND(RC[-3]>RC[-1],RC[-3]>=5,RC[-3]<6),70,IF(AND(RC[-3]>RC[-1],RC[-3]>=6,RC[-3]<7),60,IF(AND(RC[-3]>RC[-1],RC[-3]>=7,RC[-3]<8),50,IF(AND(RC[-3]>RC[-1],RC[-3]>=8,RC[-3]<9),40,IF(AND(RC[-3]>RC[-1],RC[-3]>=9,RC[-3]<10),30,IF(AND(RC[-3]>RC[-1],RC[-3]>=10,RC[-3]<11),20,IF(AND(RC[-3]>RC[-1],RC[-3]>=11,RC[-3]<12),10,IF(AND(RC[-3]>RC[-1],RC[-3]>=12),0))))))))))))))))))))))))))))))))) -> 100 | H283: =IF(RC[-3]="","",IF(RC[-3]<0.3,100,IF(AND(RC[-3]>=0.3,RC[-3]>0.4),95,IF(AND(RC[-3]>=0.4,RC[-3]<0.5),90,IF(AND(RC[-3]>=0.5,RC[-3]<0.6),85,IF(AND(RC[-3]>=0.6,RC[-3]<0.7),80,IF(AND(RC[-3]>=0.6,RC[-3]<1),80,IF(AND(RC[-3]>1,RC[-3]<2),50,IF(RC[-3]>2,0))))))))) ->  | I283: =IF(RC[-1]="",RC[-2],0.7*RC[-1]+0.3*RC[-2]) -> 100
A284: سر. استان اصفهان | B284: وسصفا | C284: =VLOOKUP(RC[-1],Sheet1!R3C2:R802C3,2,FALSE) -> سرمایه گذاریها | D284: =VLOOKUP(RC[-2],Sheet1!R3C2:R802C9,8,FALSE) -> 114.12959764213677 | E284: =IF(VLOOKUP(RC[-3],Sheet1!R3C2:R803C11,10,FALSE)=0,"",VLOOKUP(Sheet2!RC[-3],Sheet1!R[1]C[-3]:R[801]C[6],10,FALSE)) ->  | F284: =Sheet1!R375C10 -> 11.524146113687122 | G284: =IF(RC[-3]<0,0,IF(AND(RC[-3]<RC[-1],RC[-3]<2),100,IF(AND(RC[-3]<RC[-1],RC[-3]>=2,RC[-3]<3),95,IF(AND(RC[-3]<RC[-1],RC[-3]>=3,RC[-3]<4),90,IF(AND(RC[-3]<RC[-1],RC[-3]>=4,RC[-3]<5),85,IF(AND(RC[-3]<RC[-1],RC[-3]>=5,RC[-3]<6),80,IF(AND(RC[-3]<RC[-1],RC[-3]>=6,RC[-3]<7),75,IF(AND(RC[-3]<RC[-1],RC[-3]>=7,RC[-3]<8),70,IF(AND(RC[-3]<RC[-1],RC[-3]>=8,RC[-3]<9),65,IF(AND(RC[-3]<RC[-1],RC[-3]>=9,RC[-3]<10),60,IF(AND(RC[-3]<RC[-1],RC[-3]>=10,RC[-3]<11),55,IF(AND(RC[-3]<RC[-1],RC[-3]>=11,RC[-3]<12),50,IF(AND(RC[-3]<RC[-1],RC[-3]>=12,RC[-3]<13),45,IF(AND(RC[-3]<RC[-1],RC[-3]>=13,RC[-3]<14),40,IF(AND(RC[-3]<RC[-1],RC[-3]>=14,RC[-3]<15),35,IF(AND(RC[-3]<RC[-1],RC[-3]>=15,RC[-3]<16),30,IF(AND(RC[-3]<RC[-1],RC[-3]>=16,RC[-3]<17),25,IF(AND(RC[-3]<RC[-1],RC[-3]>=17,RC[-3]<18),20,IF(AND(RC[-3]<RC[-1],RC[-3]>=18,RC[-3]<19),15,IF(AND(RC[-3]<RC[-1],RC[-3]>=19,RC[-3]<20),10,IF(AND(RC[-3]<RC[-1],RC[-3]>=20,RC[-3]<21),5,IF(AND(RC[-3]<RC[-1],RC[-3]>=21),0,IF(AND(RC[-3]>RC[-1],RC[-3]>=2,RC[-3]<3),90,IF(AND(RC[-3]>RC[-1],RC[-3]>=3,RC[-3]<4),90,IF(AND(RC[-3]>RC[-1],RC[-3]>=4,RC[-3]<5),80,IF(AND(RC[-3]>RC[-1],RC[-3]>=5,RC[-3]<6),70,IF(AND(RC[-3]>RC[-1],RC[-3]>=6,RC[-3]<7),60,IF(AND(RC[-3]>RC[-1],RC[-3]>=7,RC[-3]<8),50,IF(AND(RC[-3]>RC[-1],RC[-3]>=8,RC[-3]<9),40,IF(AND(RC[-3]>RC[-1],RC[-3]>=9,RC[-3]<10),30,IF(AND(RC[-3]>RC[-1],RC[-3]>=10,RC[-3]<11),20,IF(AND(RC[-3]>RC[-1],RC[-3]>=11,RC[-3]<12),10,IF(AND(RC[-3]>RC[-1],RC[-3]>=12),0))))))))))))))))))))))))))))))))) -> 0 | H284: =IF(RC[-3]="","",IF(RC[-3]<0.3,100,IF(AND(RC[-3]>=0.3,RC[-3]>0.4),95,IF(AND(RC[-3]>=0.4,RC[-3]<0.5),90,IF(AND(RC[-3]>=0.5,RC[-3]<0.6),85,IF(AND(RC[-3]>=0.6,RC[-3]<0.7),80,IF(AND(RC[-3]>=0.6,RC[-3]<1),80,IF(AND(RC[-3]>1,RC[-3]<2),50,IF(RC[-3]>2,0))))))))) ->  | I284: =IF(RC[-1]="",RC[-2],0.7*RC[-1]+0.3*RC[-2]) -> 0
A285: سر. استان ایلام | B285: وسیلام | C285: =VLOOKUP(RC[-1],Sheet1!R3C2:R802C3,2,FALSE) -> سرمایه گذاریها | D285: =VLOOKUP(RC[-2],Sheet1!R3C2:R802C9,8,FALSE) -> 0.97131369993664884 | E285: =IF(VLOOKUP(RC[-3],Sheet1!R3C2:R803C11,10,FALSE)=0,"",VLOOKUP(Sheet2!RC[-3],Sheet1!R[1]C[-3]:R[801]C[6],10,FALSE)) ->  | F285: =Sheet1!R375C10 -> 11.524146113687122 | G285: =IF(RC[-3]<0,0,IF(AND(RC[-3]<RC[-1],RC[-3]<2),100,IF(AND(RC[-3]<RC[-1],RC[-3]>=2,RC[-3]<3),95,IF(AND(RC[-3]<RC[-1],RC[-3]>=3,RC[-3]<4),90,IF(AND(RC[-3]<RC[-1],RC[-3]>=4,RC[-3]<5),85,IF(AND(RC[-3]<RC[-1],RC[-3]>=5,RC[-3]<6),80,IF(AND(RC[-3]<RC[-1],RC[-3]>=6,RC[-3]<7),75,IF(AND(RC[-3]<RC[-1],RC[-3]>=7,RC[-3]<8),70,IF(AND(RC[-3]<RC[-1],RC[-3]>=8,RC[-3]<9),65,IF(AND(RC[-3]<RC[-1],RC[-3]>=9,RC[-3]<10),60,IF(AND(RC[-3]<RC[-1],RC[-3]>=10,RC[-3]<11),55,IF(AND(RC[-3]<RC[-1],RC[-3]>=11,RC[-3]<12),50,IF(AND(RC[-3]<RC[-1],RC[-3]>=12,RC[-3]<13),45,IF(AND(RC[-3]<RC[-1],RC[-3]>=13,RC[-3]<14),40,IF(AND(RC[-3]<RC[-1],RC[-3]>=14,RC[-3]<15),35,IF(AND(RC[-3]<RC[-1],RC[-3]>=15,RC[-3]<16),30,IF(AND(RC[-3]<RC[-1],RC[-3]>=16,RC[-3]<17),25,IF(AND(RC[-3]<RC[-1],RC[-3]>=17,RC[-3]<18),20,IF(AND(RC[-3]<RC[-1],RC[-3]>=18,RC[-3]<19),15,IF(AND(RC[-3]<RC[-1],RC[-3]>=19,RC[-3]<20),10,IF(AND(RC[-3]<RC[-1],RC[-3]>=20,RC[-3]<21),5,IF(AND(RC[-3]<RC[-1],RC[-3]>=21),0,IF(AND(RC[-3]>RC[-1],RC[-3]>=2,RC[-3]<3),90,IF(AND(RC[-3]>RC[-1],RC[-3]>=3,RC[-3]<4),90,IF(AND(RC[-3]>RC[-1],RC[-3]>=4,RC[-3]<5),80,IF(AND(RC[-3]>RC[-1],RC[-3]>=5,RC[-3]<6),70,IF(AND(RC[-3]>RC[-1],RC[-3]>=6,RC[-3]<7),60,IF(AND(RC[-3]>RC[-1],RC[-3]>=7,RC[-3]<8),50,IF(AND(RC[-3]>RC[-1],RC[-3]>=8,RC[-3]<9),40,IF(AND(RC[-3]>RC[-1],RC[-3]>=9,RC[-3]<10),30,IF(AND(RC[-3]>RC[-1],RC[-3]>=10,RC[-3]<11),20,IF(AND(RC[-3]>RC[-1],RC[-3]>=11,RC[-3]<12),10,IF(AND(RC[-3]>RC[-1],RC[-3]>=12),0))))))))))))))))))))))))))))))))) -> 100 | H285: =IF(RC[-3]="","",IF(RC[-3]<0.3,100,IF(AND(RC[-3]>=0.3,RC[-3]>0.4),95,IF(AND(RC[-3]>=0.4,RC[-3]<0.5),90,IF(AND(RC[-3]>=0.5,RC[-3]<0.6),85,IF(AND(RC[-3]>=0.6,RC[-3]<0.7),80,IF(AND(RC[-3]>=0.6,RC[-3]<1),80,IF(AND(RC[-3]>1,RC[-3]<2),50,IF(RC[-3]>2,0))))))))) ->  | I285: =IF(RC[-1]="",RC[-2],0.7*RC[-1]+0.3*RC[-2]) -> 100
A286: سر. استان بوشهر | B286: وسبوشهر | C286: =VLOOKUP(RC[-1],Sheet1!R3C2:R802C3,2,FALSE) -> سرمایه گذاریها | D286: =VLOOKUP(RC[-2],Sheet1!R3C2:R802C9,8,FALSE) -> 19.489773195833489 | E286: =IF(VLOOKUP(RC[-3],Sheet1!R3C2:R803C11,10,FALSE)=0,"",VLOOKUP(Sheet2!RC[-3],Sheet1!R[1]C[-3]:R[801]C[6],10,FALSE)) ->  | F286: =Sheet1!R375C10 -> 11.524146113687122 | G286: =IF(RC[-3]<0,0,IF(AND(RC[-3]<RC[-1],RC[-3]<2),100,IF(AND(RC[-3]<RC[-1],RC[-3]>=2,RC[-3]<3),95,IF(AND(RC[-3]<RC[-1],RC[-3]>=3,RC[-3]<4),90,IF(AND(RC[-3]<RC[-1],RC[-3]>=4,RC[-3]<5),85,IF(AND(RC[-3]<RC[-1],RC[-3]>=5,RC[-3]<6),80,IF(AND(RC[-3]<RC[-1],RC[-3]>=6,RC[-3]<7),75,IF(AND(RC[-3]<RC[-1],RC[-3]>=7,RC[-3]<8),70,IF(AND(RC[-3]<RC[-1],RC[-3]>=8,RC[-3]<9),65,IF(AND(RC[-3]<RC[-1],RC[-3]>=9,RC[-3]<10),60,IF(AND(RC[-3]<RC[-1],RC[-3]>=10,RC[-3]<11),55,IF(AND(RC[-3]<RC[-1],RC[-3]>=11,RC[-3]<12),50,IF(AND(RC[-3]<RC[-1],RC[-3]>=12,RC[-3]<13),45,IF(AND(RC[-3]<RC[-1],RC[-3]>=13,RC[-3]<14),40,IF(AND(RC[-3]<RC[-1],RC[-3]>=14,RC[-3]<15),35,IF(AND(RC[-3]<RC[-1],RC[-3]>=15,RC[-3]<16),30,IF(AND(RC[-3]<RC[-1],RC[-3]>=16,RC[-3]<17),25,IF(AND(RC[-3]<RC[-1],RC[-3]>=17,RC[-3]<18),20,IF(AND(RC[-3]<RC[-1],RC[-3]>=18,RC[-3]<19),15,IF(AND(RC[-3]<RC[-1],RC[-3]>=19,RC[-3]<20),10,IF(AND(RC[-3]<RC[-1],RC[-3]>=20,RC[-3]<21),5,IF(AND(RC[-3]<RC[-1],RC[-3]>=21),0,IF(AND(RC[-3]>RC[-1],RC[-3]>=2,RC[-3]<3),90,IF(AND(RC[-3]>RC[-1],RC[-3]>=3,RC[-3]<4),90,IF(AND(RC[-3]>RC[-1],RC[-3]>=4,RC[-3]<5),80,IF(AND(RC[-3]>RC[-1],RC[-3]>=5,RC[-3]<6),70,IF(AND(RC[-3]>RC[-1],RC[-3]>=6,RC[-3]<7),60,IF(AND(RC[-3]>RC[-1],RC[-3]>=7,RC[-3]<8),50,IF(AND(RC[-3]>RC[-1],RC[-3]>=8,RC[-3]<9),40,IF(AND(RC[-3]>RC[-1],RC[-3]>=9,RC[-3]<10),30,IF(AND(RC[-3]>RC[-1],RC[-3]>=10,RC[-3]<11),20,IF(AND(RC[-3]>RC[-1],RC[-3]>=11,RC[-3]<12),10,IF(AND(RC[-3]>RC[-1],RC[-3]>=12),0))))))))))))))))))))))))))))))))) -> 0 | H286: =IF(RC[-3]="","",IF(RC[-3]<0.3,100,IF(AND(RC[-3]>=0.3,RC[-3]>0.4),95,IF(AND(RC[-3]>=0.4,RC[-3]<0.5),90,IF(AND(RC[-3]>=0.5,RC[-3]<0.6),85,IF(AND(RC[-3]>=0.6,RC[-3]<0.7),80,IF(AND(RC[-3]>=0.6,RC[-3]<1),80,IF(AND(RC[-3]>1,RC[-3]<2),50,IF(RC[-3]>2,0))))))))) ->  | I286: =IF(RC[-1]="",RC[-2],0.7*RC[-1]+0.3*RC[-2]) -> 0
A287: سر. استان خراسان رضوی | B287: وسرضوی | C287: =VLOOKUP(RC[-1],Sheet1!R3C2:R802C3,2,FALSE) -> سرمایه گذاریها | D287: =VLOOKUP(RC[-2],Sheet1!R3C2:R802C9,8,FALSE) -> 4.3488195296649012E-5 | E287: =IF(VLOOKUP(RC[-3],Sheet1!R3C2:R803C11,10,FALSE)=0,"",VLOOKUP(Sheet2!RC[-3],Sheet1!R[1]C[-3]:R[801]C[6],10,FALSE)) ->  | F287: =Sheet1!R375C10 -> 11.524146113687122 | G287: =IF(RC[-3]<0,0,IF(AND(RC[-3]<RC[-1],RC[-3]<2),100,IF(AND(RC[-3]<RC[-1],RC[-3]>=2,RC[-3]<3),95,IF(AND(RC[-3]<RC[-1],RC[-3]>=3,RC[-3]<4),90,IF(AND(RC[-3]<RC[-1],RC[-3]>=4,RC[-3]<5),85,IF(AND(RC[-3]<RC[-1],RC[-3]>=5,RC[-3]<6),80,IF(AND(RC[-3]<RC[-1],RC[-3]>=6,RC[-3]<7),75,IF(AND(RC[-3]<RC[-1],RC[-3]>=7,RC[-3]<8),70,IF(AND(RC[-3]<RC[-1],RC[-3]>=8,RC[-3]<9),65,IF(AND(RC[-3]<RC[-1],RC[-3]>=9,RC[-3]<10),60,IF(AND(RC[-3]<RC[-1],RC[-3]>=10,RC[-3]<11),55,IF(AND(RC[-3]<RC[-1],RC[-3]>=11,RC[-3]<12),50,IF(AND(RC[-3]<RC[-1],RC[-3]>=12,RC[-3]<13),45,IF(AND(RC[-3]<RC[-1],RC[-3]>=13,RC[-3]<14),40,IF(AND(RC[-3]<RC[-1],RC[-3]>=14,RC[-3]<15),35,IF(AND(RC[-3]<RC[-1],RC[-3]>=15,RC[-3]<16),30,IF(AND(RC[-3]<RC[-1],RC[-3]>=16,RC[-3]<17),25,IF(AND(RC[-3]<RC[-1],RC[-3]>=17,RC[-3]<18),20,IF(AND(RC[-3]<RC[-1],RC[-3]>=18,RC[-3]<19),15,IF(AND(RC[-3]<RC[-1],RC[-3]>=19,RC[-3]<20),10,IF(AND(RC[-3]<RC[-1],RC[-3]>=20,RC[-3]<21),5,IF(AND(RC[-3]<RC[-1],RC[-3]>=21),0,IF(AND(RC[-3]>RC[-1],RC[-3]>=2,RC[-3]<3),90,IF(AND(RC[-3]>RC[-1],RC[-3]>=3,RC[-3]<4),90,IF(AND(RC[-3]>RC[-1],RC[-3]>=4,RC[-3]<5),80,IF(AND(RC[-3]>RC[-1],RC[-3]>=5,RC[-3]<6),70,IF(AND(RC[-3]>RC[-1],RC[-3]>=6,RC[-3]<7),60,IF(AND(RC[-3]>RC[-1],RC[-3]>=7,RC[-3]<8),50,IF(AND(RC[-3]>RC[-1],RC[-3]>=8,RC[-3]<9),40,IF(AND(RC[-3]>RC[-1],RC[-3]>=9,RC[-3]<10),30,IF(AND(RC[-3]>RC[-1],RC[-3]>=10,RC[-3]<11),20,IF(AND(RC[-3]>RC[-1],RC[-3]>=11,RC[-3]<12),10,IF(AND(RC[-3]>RC[-1],RC[-3]>=12),0))))))))))))))))))))))))))))))))) -> 100 | H287: =IF(RC[-3]="","",IF(RC[-3]<0.3,100,IF(AND(RC[-3]>=0.3,RC[-3]>0.4),95,IF(AND(RC[-3]>=0.4,RC[-3]<0.5),90,IF(AND(RC[-3]>=0.5,RC[-3]<0.6),85,IF(AND(RC[-3]>=0.6,RC[-3]<0.7),80,IF(AND(RC[-3]>=0.6,RC[-3]<1),80,IF(AND(RC[-3]>1,RC[-3]<2),50,IF(RC[-3]>2,0))))))))) ->  | I287: =IF(RC[-1]="",RC[-2],0.7*RC[-1]+0.3*RC[-2]) -> 100
A288: سر. استان خراسان شمالی | B288: وسخراش | C288: =VLOOKUP(RC[-1],Sheet1!R3C2:R802C3,2,FALSE) -> سرمایه گذاریها | D288: =VLOOKUP(RC[-2],Sheet1!R3C2:R802C9,8,FALSE) -> 3.4846336993468153E-3 | E288: =IF(VLOOKUP(RC[-3],Sheet1!R3C2:R803C11,10,FALSE)=0,"",VLOOKUP(Sheet2!RC[-3],Sheet1!R[1]C[-3]:R[801]C[6],10,FALSE)) ->  | F288: =Sheet1!R375C10 -> 11.524146113687122 | G288: =IF(RC[-3]<0,0,IF(AND(RC[-3]<RC[-1],RC[-3]<2),100,IF(AND(RC[-3]<RC[-1],RC[-3]>=2,RC[-3]<3),95,IF(AND(RC[-3]<RC[-1],RC[-3]>=3,RC[-3]<4),90,IF(AND(RC[-3]<RC[-1],RC[-3]>=4,RC[-3]<5),85,IF(AND(RC[-3]<RC[-1],RC[-3]>=5,RC[-3]<6),80,IF(AND(RC[-3]<RC[-1],RC[-3]>=6,RC[-3]<7),75,IF(AND(RC[-3]<RC[-1],RC[-3]>=7,RC[-3]<8),70,IF(AND(RC[-3]<RC[-1],RC[-3]>=8,RC[-3]<9),65,IF(AND(RC[-3]<RC[-1],RC[-3]>=9,RC[-3]<10),60,IF(AND(RC[-3]<RC[-1],RC[-3]>=10,RC[-3]<11),55,IF(AND(RC[-3]<RC[-1],RC[-3]>=11,RC[-3]<12),50,IF(AND(RC[-3]<RC[-1],RC[-3]>=12,RC[-3]<13),45,IF(AND(RC[-3]<RC[-1],RC[-3]>=13,RC[-3]<14),40,IF(AND(RC[-3]<RC[-1],RC[-3]>=14,RC[-3]<15),35,IF(AND(RC[-3]<RC[-1],RC[-3]>=15,RC[-3]<16),30,IF(AND(RC[-3]<RC[-1],RC[-3]>=16,RC[-3]<17),25,IF(AND(RC[-3]<RC[-1],RC[-3]>=17,RC[-3]<18),20,IF(AND(RC[-3]<RC[-1],RC[-3]>=18,RC[-3]<19),15,IF(AND(RC[-3]<RC[-1],RC[-3]>=19,RC[-3]<20),10,IF(AND(RC[-3]<RC[-1],RC[-3]>=20,RC[-3]<21),5,IF(AND(RC[-3]<RC[-1],RC[-3]>=21),0,IF(AND(RC[-3]>RC[-1],RC[-3]>=2,RC[-3]<3),90,IF(AND(RC[-3]>RC[-1],RC[-3]>=3,RC[-3]<4),90,IF(AND(RC[-3]>RC[-1],RC[-3]>=4,RC[-3]<5),80,IF(AND(RC[-3]>RC[-1],RC[-3]>=5,RC[-3]<6),70,IF(AND(RC[-3]>RC[-1],RC[-3]>=6,RC[-3]<7),60,IF(AND(RC[-3]>RC[-1],RC[-3]>=7,RC[-3]<8),50,IF(AND(RC[-3]>RC[-1],RC[-3]>=8,RC[-3]<9),40,IF(AND(RC[-3]>RC[-1],RC[-3]>=9,RC[-3]<10),30,IF(AND(RC[-3]>RC[-1],RC[-3]>=10,RC[-3]<11),20,IF(AND(RC[-3]>RC[-1],RC[-3]>=11,RC[-3]<12),10,IF(AND(RC[-3]>RC[-1],RC[-3]>=12),0))))))))))))))))))))))))))))))))) -> 100 | H288: =IF(RC[-3]="","",IF(RC[-3]<0.3,100,IF(AND(RC[-3]>=0.3,RC[-3]>0.4),95,IF(AND(RC[-3]>=0.4,RC[-3]<0.5),90,IF(AND(RC[-3]>=0.5,RC[-3]<0.6),85,IF(AND(RC[-3]>=0.6,RC[-3]<0.7),80,IF(AND(RC[-3]>=0.6,RC[-3]<1),80,IF(AND(RC[-3]>1,RC[-3]<2),50,IF(RC[-3]>2,0))))))))) ->  | I288: =IF(RC[-1]="",RC[-2],0.7*RC[-1]+0.3*RC[-2]) -> 100
A289: سر. استان خوزستان | B289: وسخوز | C289: =VLOOKUP(RC[-1],Sheet1!R3C2:R802C3,2,FALSE) -> سرمایه گذاریها | D289: =VLOOKUP(RC[-2],Sheet1!R3C2:R802C9,8,FALSE) -> 3.0692540382598374 | E289: =IF(VLOOKUP(RC[-3],Sheet1!R3C2:R803C11,10,FALSE)=0,"",VLOOKUP(Sheet2!RC[-3],Sheet1!R[1]C[-3]:R[801]C[6],10,FALSE)) ->  | F289: =Sheet1!R375C10 -> 11.524146113687122 | G289: =IF(RC[-3]<0,0,IF(AND(RC[-3]<RC[-1],RC[-3]<2),100,IF(AND(RC[-3]<RC[-1],RC[-3]>=2,RC[-3]<3),95,IF(AND(RC[-3]<RC[-1],RC[-3]>=3,RC[-3]<4),90,IF(AND(RC[-3]<RC[-1],RC[-3]>=4,RC[-3]<5),85,IF(AND(RC[-3]<RC[-1],RC[-3]>=5,RC[-3]<6),80,IF(AND(RC[-3]<RC[-1],RC[-3]>=6,RC[-3]<7),75,IF(AND(RC[-3]<RC[-1],RC[-3]>=7,RC[-3]<8),70,IF(AND(RC[-3]<RC[-1],RC[-3]>=8,RC[-3]<9),65,IF(AND(RC[-3]<RC[-1],RC[-3]>=9,RC[-3]<10),60,IF(AND(RC[-3]<RC[-1],RC[-3]>=10,RC[-3]<11),55,IF(AND(RC[-3]<RC[-1],RC[-3]>=11,RC[-3]<12),50,IF(AND(RC[-3]<RC[-1],RC[-3]>=12,RC[-3]<13),45,IF(AND(RC[-3]<RC[-1],RC[-3]>=13,RC[-3]<14),40,IF(AND(RC[-3]<RC[-1],RC[-3]>=14,RC[-3]<15),35,IF(AND(RC[-3]<RC[-1],RC[-3]>=15,RC[-3]<16),30,IF(AND(RC[-3]<RC[-1],RC[-3]>=16,RC[-3]<17),25,IF(AND(RC[-3]<RC[-1],RC[-3]>=17,RC[-3]<18),20,IF(AND(RC[-3]<RC[-1],RC[-3]>=18,RC[-3]<19),15,IF(AND(RC[-3]<RC[-1],RC[-3]>=19,RC[-3]<20),10,IF(AND(RC[-3]<RC[-1],RC[-3]>=20,RC[-3]<21),5,IF(AND(RC[-3]<RC[-1],RC[-3]>=21),0,IF(AND(RC[-3]>RC[-1],RC[-3]>=2,RC[-3]<3),90,IF(AND(RC[-3]>RC[-1],RC[-3]>=3,RC[-3]<4),90,IF(AND(RC[-3]>RC[-1],RC[-3]>=4,RC[-3]<5),80,IF(AND(RC[-3]>RC[-1],RC[-3]>=5,RC[-3]<6),70,IF(AND(RC[-3]>RC[-1],RC[-3]>=6,RC[-3]<7),60,IF(AND(RC[-3]>RC[-1],RC[-3]>=7,RC[-3]<8),50,IF(AND(RC[-3]>RC[-1],RC[-3]>=8,RC[-3]<9),40,IF(AND(RC[-3]>RC[-1],RC[-3]>=9,RC[-3]<10),30,IF(AND(RC[-3]>RC[-1],RC[-3]>=10,RC[-3]<11),20,IF(AND(RC[-3]>RC[-1],RC[-3]>=11,RC[-3]<12),10,IF(AND(RC[-3]>RC[-1],RC[-3]>=12),0))))))))))))))))))))))))))))))))) -> 90 | H289: =IF(RC[-3]="","",IF(RC[-3]<0.3,100,IF(AND(RC[-3]>=0.3,RC[-3]>0.4),95,IF(AND(RC[-3]>=0.4,RC[-3]<0.5),90,IF(AND(RC[-3]>=0.5,RC[-3]<0.6),85,IF(AND(RC[-3]>=0.6,RC[-3]<0.7),80,IF(AND(RC[-3]>=0.6,RC[-3]<1),80,IF(AND(RC[-3]>1,RC[-3]<2),50,IF(RC[-3]>2,0))))))))) ->  | I289: =IF(RC[-1]="",RC[-2],0.7*RC[-1]+0.3*RC[-2]) -> 90
A290: سر. استان زنجان | B290: وسزنجان | C290: =VLOOKUP(RC[-1],Sheet1!R3C2:R802C3,2,FALSE) -> سرمایه گذاریها | D290: =VLOOKUP(RC[-2],Sheet1!R3C2:R802C9,8,FALSE) -> 2.6251104522396296 | E290: =IF(VLOOKUP(RC[-3],Sheet1!R3C2:R803C11,10,FALSE)=0,"",VLOOKUP(Sheet2!RC[-3],Sheet1!R[1]C[-3]:R[801]C[6],10,FALSE)) ->  | F290: =Sheet1!R375C10 -> 11.524146113687122 | G290: =IF(RC[-3]<0,0,IF(AND(RC[-3]<RC[-1],RC[-3]<2),100,IF(AND(RC[-3]<RC[-1],RC[-3]>=2,RC[-3]<3),95,IF(AND(RC[-3]<RC[-1],RC[-3]>=3,RC[-3]<4),90,IF(AND(RC[-3]<RC[-1],RC[-3]>=4,RC[-3]<5),85,IF(AND(RC[-3]<RC[-1],RC[-3]>=5,RC[-3]<6),80,IF(AND(RC[-3]<RC[-1],RC[-3]>=6,RC[-3]<7),75,IF(AND(RC[-3]<RC[-1],RC[-3]>=7,RC[-3]<8),70,IF(AND(RC[-3]<RC[-1],RC[-3]>=8,RC[-3]<9),65,IF(AND(RC[-3]<RC[-1],RC[-3]>=9,RC[-3]<10),60,IF(AND(RC[-3]<RC[-1],RC[-3]>=10,RC[-3]<11),55,IF(AND(RC[-3]<RC[-1],RC[-3]>=11,RC[-3]<12),50,IF(AND(RC[-3]<RC[-1],RC[-3]>=12,RC[-3]<13),45,IF(AND(RC[-3]<RC[-1],RC[-3]>=13,RC[-3]<14),40,IF(AND(RC[-3]<RC[-1],RC[-3]>=14,RC[-3]<15),35,IF(AND(RC[-3]<RC[-1],RC[-3]>=15,RC[-3]<16),30,IF(AND(RC[-3]<RC[-1],RC[-3]>=16,RC[-3]<17),25,IF(AND(RC[-3]<RC[-1],RC[-3]>=17,RC[-3]<18),20,IF(AND(RC[-3]<RC[-1],RC[-3]>=18,RC[-3]<19),15,IF(AND(RC[-3]<RC[-1],RC[-3]>=19,RC[-3]<20),10,IF(AND(RC[-3]<RC[-1],RC[-3]>=20,RC[-3]<21),5,IF(AND(RC[-3]<RC[-1],RC[-3]>=21),0,IF(AND(RC[-3]>RC[-1],RC[-3]>=2,RC[-3]<3),90,IF(AND(RC[-3]>RC[-1],RC[-3]>=3,RC[-3]<4),90,IF(AND(RC[-3]>RC[-1],RC[-3]>=4,RC[-3]<5),80,IF(AND(RC[-3]>RC[-1],RC[-3]>=5,RC[-3]<6),70,IF(AND(RC[-3]>RC[-1],RC[-3]>=6,RC[-3]<7),60,IF(AND(RC[-3]>RC[-1],RC[-3]>=7,RC[-3]<8),50,IF(AND(RC[-3]>RC[-1],RC[-3]>=8,RC[-3]<9),40,IF(AND(RC[-3]>RC[-1],RC[-3]>=9,RC[-3]<10),30,IF(AND(RC[-3]>RC[-1],RC[-3]>=10,RC[-3]<11),20,IF(AND(RC[-3]>RC[-1],RC[-3]>=11,RC[-3]<12),10,IF(AND(RC[-3]>RC[-1],RC[-3]>=12),0))))))))))))))))))))))))))))))))) -> 95 | H290: =IF(RC[-3]="","",IF(RC[-3]<0.3,100,IF(AND(RC[-3]>=0.3,RC[-3]>0.4),95,IF(AND(RC[-3]>=0.4,RC[-3]<0.5),90,IF(AND(RC[-3]>=0.5,RC[-3]<0.6),85,IF(AND(RC[-3]>=0.6,RC[-3]<0.7),80,IF(AND(RC[-3]>=0.6,RC[-3]<1),80,IF(AND(RC[-3]>1,RC[-3]<2),50,IF(RC[-3]>2,0))))))))) ->  | I290: =IF(RC[-1]="",RC[-2],0.7*RC[-1]+0.3*RC[-2]) -> 95
A291: سر. استان سیستان و بلوچستان | B291: وسیستا | C291: =VLOOKUP(RC[-1],Sheet1!R3C2:R802C3,2,FALSE) -> سرمایه گذاریها | D291: =VLOOKUP(RC[-2],Sheet1!R3C2:R802C9,8,FALSE) -> 115.19992441033824 | E291: =IF(VLOOKUP(RC[-3],Sheet1!R3C2:R803C11,10,FALSE)=0,"",VLOOKUP(Sheet2!RC[-3],Sheet1!R[1]C[-3]:R[801]C[6],10,FALSE)) ->  | F291: =Sheet1!R375C10 -> 11.524146113687122 | G291: =IF(RC[-3]<0,0,IF(AND(RC[-3]<RC[-1],RC[-3]<2),100,IF(AND(RC[-3]<RC[-1],RC[-3]>=2,RC[-3]<3),95,IF(AND(RC[-3]<RC[-1],RC[-3]>=3,RC[-3]<4),90,IF(AND(RC[-3]<RC[-1],RC[-3]>=4,RC[-3]<5),85,IF(AND(RC[-3]<RC[-1],RC[-3]>=5,RC[-3]<6),80,IF(AND(RC[-3]<RC[-1],RC[-3]>=6,RC[-3]<7),75,IF(AND(RC[-3]<RC[-1],RC[-3]>=7,RC[-3]<8),70,IF(AND(RC[-3]<RC[-1],RC[-3]>=8,RC[-3]<9),65,IF(AND(RC[-3]<RC[-1],RC[-3]>=9,RC[-3]<10),60,IF(AND(RC[-3]<RC[-1],RC[-3]>=10,RC[-3]<11),55,IF(AND(RC[-3]<RC[-1],RC[-3]>=11,RC[-3]<12),50,IF(AND(RC[-3]<RC[-1],RC[-3]>=12,RC[-3]<13),45,IF(AND(RC[-3]<RC[-1],RC[-3]>=13,RC[-3]<14),40,IF(AND(RC[-3]<RC[-1],RC[-3]>=14,RC[-3]<15),35,IF(AND(RC[-3]<RC[-1],RC[-3]>=15,RC[-3]<16),30,IF(AND(RC[-3]<RC[-1],RC[-3]>=16,RC[-3]<17),25,IF(AND(RC[-3]<RC[-1],RC[-3]>=17,RC[-3]<18),20,IF(AND(RC[-3]<RC[-1],RC[-3]>=18,RC[-3]<19),15,IF(AND(RC[-3]<RC[-1],RC[-3]>=19,RC[-3]<20),10,IF(AND(RC[-3]<RC[-1],RC[-3]>=20,RC[-3]<21),5,IF(AND(RC[-3]<RC[-1],RC[-3]>=21),0,IF(AND(RC[-3]>RC[-1],RC[-3]>=2,RC[-3]<3),90,IF(AND(RC[-3]>RC[-1],RC[-3]>=3,RC[-3]<4),90,IF(AND(RC[-3]>RC[-1],RC[-3]>=4,RC[-3]<5),80,IF(AND(RC[-3]>RC[-1],RC[-3]>=5,RC[-3]<6),70,IF(AND(RC[-3]>RC[-1],RC[-3]>=6,RC[-3]<7),60,IF(AND(RC[-3]>RC[-1],RC[-3]>=7,RC[-3]<8),50,IF(AND(RC[-3]>RC[-1],RC[-3]>=8,RC[-3]<9),40,IF(AND(RC[-3]>RC[-1],RC[-3]>=9,RC[-3]<10),30,IF(AND(RC[-3]>RC[-1],RC[-3]>=10,RC[-3]<11),20,IF(AND(RC[-3]>RC[-1],RC[-3]>=11,RC[-3]<12),10,IF(AND(RC[-3]>RC[-1],RC[-3]>=12),0))))))))))))))))))))))))))))))))) -> 0 | H291: =IF(RC[-3]="","",IF(RC[-3]<0.3,100,IF(AND(RC[-3]>=0.3,RC[-3]>0.4),95,IF(AND(RC[-3]>=0.4,RC[-3]<0.5),90,IF(AND(RC[-3]>=0.5,RC[-3]<0.6),85,IF(AND(RC[-3]>=0.6,RC[-3]<0.7),80,IF(AND(RC[-3]>=0.6,RC[-3]<1),80,IF(AND(RC[-3]>1,RC[-3]<2),50,IF(RC[-3]>2,0))))))))) ->  | I291: =IF(RC[-1]="",RC[-2],0.7*RC[-1]+0.3*RC[-2]) -> 0
A292: سر. استان فارس | B292: وسفارس | C292: =VLOOKUP(RC[-1],Sheet1!R3C2:R802C3,2,FALSE) -> سرمایه گذاریها | D292: =VLOOKUP(RC[-2],Sheet1!R3C2:R802C9,8,FALSE) -> 1.7285570516457494 | E292: =IF(VLOOKUP(RC[-3],Sheet1!R3C2:R803C11,10,FALSE)=0,"",VLOOKUP(Sheet2!RC[-3],Sheet1!R[1]C[-3]:R[801]C[6],10,FALSE)) ->  | F292: =Sheet1!R375C10 -> 11.524146113687122 | G292: =IF(RC[-3]<0,0,IF(AND(RC[-3]<RC[-1],RC[-3]<2),100,IF(AND(RC[-3]<RC[-1],RC[-3]>=2,RC[-3]<3),95,IF(AND(RC[-3]<RC[-1],RC[-3]>=3,RC[-3]<4),90,IF(AND(RC[-3]<RC[-1],RC[-3]>=4,RC[-3]<5),85,IF(AND(RC[-3]<RC[-1],RC[-3]>=5,RC[-3]<6),80,IF(AND(RC[-3]<RC[-1],RC[-3]>=6,RC[-3]<7),75,IF(AND(RC[-3]<RC[-1],RC[-3]>=7,RC[-3]<8),70,IF(AND(RC[-3]<RC[-1],RC[-3]>=8,RC[-3]<9),65,IF(AND(RC[-3]<RC[-1],RC[-3]>=9,RC[-3]<10),60,IF(AND(RC[-3]<RC[-1],RC[-3]>=10,RC[-3]<11),55,IF(AND(RC[-3]<RC[-1],RC[-3]>=11,RC[-3]<12),50,IF(AND(RC[-3]<RC[-1],RC[-3]>=12,RC[-3]<13),45,IF(AND(RC[-3]<RC[-1],RC[-3]>=13,RC[-3]<14),40,IF(AND(RC[-3]<RC[-1],RC[-3]>=14,RC[-3]<15),35,IF(AND(RC[-3]<RC[-1],RC[-3]>=15,RC[-3]<16),30,IF(AND(RC[-3]<RC[-1],RC[-3]>=16,RC[-3]<17),25,IF(AND(RC[-3]<RC[-1],RC[-3]>=17,RC[-3]<18),20,IF(AND(RC[-3]<RC[-1],RC[-3]>=18,RC[-3]<19),15,IF(AND(RC[-3]<RC[-1],RC[-3]>=19,RC[-3]<20),10,IF(AND(RC[-3]<RC[-1],RC[-3]>=20,RC[-3]<21),5,IF(AND(RC[-3]<RC[-1],RC[-3]>=21),0,IF(AND(RC[-3]>RC[-1],RC[-3]>=2,RC[-3]<3),90,IF(AND(RC[-3]>RC[-1],RC[-3]>=3,RC[-3]<4),90,IF(AND(RC[-3]>RC[-1],RC[-3]>=4,RC[-3]<5),80,IF(AND(RC[-3]>RC[-1],RC[-3]>=5,RC[-3]<6),70,IF(AND(RC[-3]>RC[-1],RC[-3]>=6,RC[-3]<7),60,IF(AND(RC[-3]>RC[-1],RC[-3]>=7,RC[-3]<8),50,IF(AND(RC[-3]>RC[-1],RC[-3]>=8,RC[-3]<9),40,IF(AND(RC[-3]>RC[-1],RC[-3]>=9,RC[-3]<10),30,IF(AND(RC[-3]>RC[-1],RC[-3]>=10,RC[-3]<11),20,IF(AND(RC[-3]>RC[-1],RC[-3]>=11,RC[-3]<12),10,IF(AND(RC[-3]>RC[-1],RC[-3]>=12),0))))))))))))))))))))))))))))))))) -> 100 | H292: =IF(RC[-3]="","",IF(RC[-3]<0.3,100,IF(AND(RC[-3]>=0.3,RC[-3]>0.4),95,IF(AND(RC[-3]>=0.4,RC[-3]<0.5),90,IF(AND(RC[-3]>=0.5,RC[-3]<0.6),85,IF(AND(RC[-3]>=0.6,RC[-3]<0.7),80,IF(AND(RC[-3]>=0.6,RC[-3]<1),80,IF(AND(RC[-3]>1,RC[-3]<2),50,IF(RC[-3]>2,0))))))))) ->  | I292: =IF(RC[-1]="",RC[-2],0.7*RC[-1]+0.3*RC[-2]) -> 100
A293: سر. استان قم | B293: وسقم | C293: =VLOOKUP(RC[-1],Sheet1!R3C2:R802C3,2,FALSE) -> سرمایه گذاریها | D293: =VLOOKUP(RC[-2],Sheet1!R3C2:R802C9,8,FALSE) -> 2.2991355314837714 | E293: =IF(VLOOKUP(RC[-3],Sheet1!R3C2:R803C11,10,FALSE)=0,"",VLOOKUP(Sheet2!RC[-3],Sheet1!R[1]C[-3]:R[801]C[6],10,FALSE)) ->  | F293: =Sheet1!R375C10 -> 11.524146113687122 | G293: =IF(RC[-3]<0,0,IF(AND(RC[-3]<RC[-1],RC[-3]<2),100,IF(AND(RC[-3]<RC[-1],RC[-3]>=2,RC[-3]<3),95,IF(AND(RC[-3]<RC[-1],RC[-3]>=3,RC[-3]<4),90,IF(AND(RC[-3]<RC[-1],RC[-3]>=4,RC[-3]<5),85,IF(AND(RC[-3]<RC[-1],RC[-3]>=5,RC[-3]<6),80,IF(AND(RC[-3]<RC[-1],RC[-3]>=6,RC[-3]<7),75,IF(AND(RC[-3]<RC[-1],RC[-3]>=7,RC[-3]<8),70,IF(AND(RC[-3]<RC[-1],RC[-3]>=8,RC[-3]<9),65,IF(AND(RC[-3]<RC[-1],RC[-3]>=9,RC[-3]<10),60,IF(AND(RC[-3]<RC[-1],RC[-3]>=10,RC[-3]<11),55,IF(AND(RC[-3]<RC[-1],RC[-3]>=11,RC[-3]<12),50,IF(AND(RC[-3]<RC[-1],RC[-3]>=12,RC[-3]<13),45,IF(AND(RC[-3]<RC[-1],RC[-3]>=13,RC[-3]<14),40,IF(AND(RC[-3]<RC[-1],RC[-3]>=14,RC[-3]<15),35,IF(AND(RC[-3]<RC[-1],RC[-3]>=15,RC[-3]<16),30,IF(AND(RC[-3]<RC[-1],RC[-3]>=16,RC[-3]<17),25,IF(AND(RC[-3]<RC[-1],RC[-3]>=17,RC[-3]<18),20,IF(AND(RC[-3]<RC[-1],RC[-3]>=18,RC[-3]<19),15,IF(AND(RC[-3]<RC[-1],RC[-3]>=19,RC[-3]<20),10,IF(AND(RC[-3]<RC[-1],RC[-3]>=20,RC[-3]<21),5,IF(AND(RC[-3]<RC[-1],RC[-3]>=21),0,IF(AND(RC[-3]>RC[-1],RC[-3]>=2,RC[-3]<3),90,IF(AND(RC[-3]>RC[-1],RC[-3]>=3,RC[-3]<4),90,IF(AND(RC[-3]>RC[-1],RC[-3]>=4,RC[-3]<5),80,IF(AND(RC[-3]>RC[-1],RC[-3]>=5,RC[-3]<6),70,IF(AND(RC[-3]>RC[-1],RC[-3]>=6,RC[-3]<7),60,IF(AND(RC[-3]>RC[-1],RC[-3]>=7,RC[-3]<8),50,IF(AND(RC[-3]>RC[-1],RC[-3]>=8,RC[-3]<9),40,IF(AND(RC[-3]>RC[-1],RC[-3]>=9,RC[-3]<10),30,IF(AND(RC[-3]>RC[-1],RC[-3]>=10,RC[-3]<11),20,IF(AND(RC[-3]>RC[-1],RC[-3]>=11,RC[-3]<12),10,IF(AND(RC[-3]>RC[-1],RC[-3]>=12),0))))))))))))))))))))))))))))))))) -> 95 | H293: =IF(RC[-3]="","",IF(RC[-3]<0.3,100,IF(AND(RC[-3]>=0.3,RC[-3]>0.4),95,IF(AND(RC[-3]>=0.4,RC[-3]<0.5),90,IF(AND(RC[-3]>=0.5,RC[-3]<0.6),85,IF(AND(RC[-3]>=0.6,RC[-3]<0.7),80,IF(AND(RC[-3]>=0.6,RC[-3]<1),80,IF(AND(RC[-3]>1,RC[-3]<2),50,IF(RC[-3]>2,0))))))))) ->  | I293: =IF(RC[-1]="",RC[-2],0.7*RC[-1]+0.3*RC[-2]) -> 95
A294: سر. استان گلستان | B294: وسگلستا | C294: =VLOOKUP(RC[-1],Sheet1!R3C2:R802C3,2,FALSE) -> سرمایه گذاریها | D294: =VLOOKUP(RC[-2],Sheet1!R3C2:R802C9,8,FALSE) -> 3.5621094031033333 | E294: =IF(VLOOKUP(RC[-3],Sheet1!R3C2:R803C11,10,FALSE)=0,"",VLOOKUP(Sheet2!RC[-3],Sheet1!R[1]C[-3]:R[801]C[6],10,FALSE)) ->  | F294: =Sheet1!R375C10 -> 11.524146113687122 | G294: =IF(RC[-3]<0,0,IF(AND(RC[-3]<RC[-1],RC[-3]<2),100,IF(AND(RC[-3]<RC[-1],RC[-3]>=2,RC[-3]<3),95,IF(AND(RC[-3]<RC[-1],RC[-3]>=3,RC[-3]<4),90,IF(AND(RC[-3]<RC[-1],RC[-3]>=4,RC[-3]<5),85,IF(AND(RC[-3]<RC[-1],RC[-3]>=5,RC[-3]<6),80,IF(AND(RC[-3]<RC[-1],RC[-3]>=6,RC[-3]<7),75,IF(AND(RC[-3]<RC[-1],RC[-3]>=7,RC[-3]<8),70,IF(AND(RC[-3]<RC[-1],RC[-3]>=8,RC[-3]<9),65,IF(AND(RC[-3]<RC[-1],RC[-3]>=9,RC[-3]<10),60,IF(AND(RC[-3]<RC[-1],RC[-3]>=10,RC[-3]<11),55,IF(AND(RC[-3]<RC[-1],RC[-3]>=11,RC[-3]<12),50,IF(AND(RC[-3]<RC[-1],RC[-3]>=12,RC[-3]<13),45,IF(AND(RC[-3]<RC[-1],RC[-3]>=13,RC[-3]<14),40,IF(AND(RC[-3]<RC[-1],RC[-3]>=14,RC[-3]<15),35,IF(AND(RC[-3]<RC[-1],RC[-3]>=15,RC[-3]<16),30,IF(AND(RC[-3]<RC[-1],RC[-3]>=16,RC[-3]<17),25,IF(AND(RC[-3]<RC[-1],RC[-3]>=17,RC[-3]<18),20,IF(AND(RC[-3]<RC[-1],RC[-3]>=18,RC[-3]<19),15,IF(AND(RC[-3]<RC[-1],RC[-3]>=19,RC[-3]<20),10,IF(AND(RC[-3]<RC[-1],RC[-3]>=20,RC[-3]<21),5,IF(AND(RC[-3]<RC[-1],RC[-3]>=21),0,IF(AND(RC[-3]>RC[-1],RC[-3]>=2,RC[-3]<3),90,IF(AND(RC[-3]>RC[-1],RC[-3]>=3,RC[-3]<4),90,IF(AND(RC[-3]>RC[-1],RC[-3]>=4,RC[-3]<5),80,IF(AND(RC[-3]>RC[-1],RC[-3]>=5,RC[-3]<6),70,IF(AND(RC[-3]>RC[-1],RC[-3]>=6,RC[-3]<7),60,IF(AND(RC[-3]>RC[-1],RC[-3]>=7,RC[-3]<8),50,IF(AND(RC[-3]>RC[-1],RC[-3]>=8,RC[-3]<9),40,IF(AND(RC[-3]>RC[-1],RC[-3]>=9,RC[-3]<10),30,IF(AND(RC[-3]>RC[-1],RC[-3]>=10,RC[-3]<11),20,IF(AND(RC[-3]>RC[-1],RC[-3]>=11,RC[-3]<12),10,IF(AND(RC[-3]>RC[-1],RC[-3]>=12),0))))))))))))))))))))))))))))))))) -> 90 | H294: =IF(RC[-3]="","",IF(RC[-3]<0.3,100,IF(AND(RC[-3]>=0.3,RC[-3]>0.4),95,IF(AND(RC[-3]>=0.4,RC[-3]<0.5),90,IF(AND(RC[-3]>=0.5,RC[-3]<0.6),85,IF(AND(RC[-3]>=0.6,RC[-3]<0.7),80,IF(AND(RC[-3]>=0.6,RC[-3]<1),80,IF(AND(RC[-3]>1,RC[-3]<2),50,IF(RC[-3]>2,0))))))))) ->  | I294: =IF(RC[-1]="",RC[-2],0.7*RC[-1]+0.3*RC[-2]) -> 90
A295: سر. استان گیلان | B295: وسگیلا | C295: =VLOOKUP(RC[-1],Sheet1!R3C2:R802C3,2,FALSE) -> سرمایه گذاریها | D295: =VLOOKUP(RC[-2],Sheet1!R3C2:R802C9,8,FALSE) -> 87.833574518043164 | E295: =IF(VLOOKUP(RC[-3],Sheet1!R3C2:R803C11,10,FALSE)=0,"",VLOOKUP(Sheet2!RC[-3],Sheet1!R[1]C[-3]:R[801]C[6],10,FALSE)) ->  | F295: =Sheet1!R375C10 -> 11.524146113687122 | G295: =IF(RC[-3]<0,0,IF(AND(RC[-3]<RC[-1],RC[-3]<2),100,IF(AND(RC[-3]<RC[-1],RC[-3]>=2,RC[-3]<3),95,IF(AND(RC[-3]<RC[-1],RC[-3]>=3,RC[-3]<4),90,IF(AND(RC[-3]<RC[-1],RC[-3]>=4,RC[-3]<5),85,IF(AND(RC[-3]<RC[-1],RC[-3]>=5,RC[-3]<6),80,IF(AND(RC[-3]<RC[-1],RC[-3]>=6,RC[-3]<7),75,IF(AND(RC[-3]<RC[-1],RC[-3]>=7,RC[-3]<8),70,IF(AND(RC[-3]<RC[-1],RC[-3]>=8,RC[-3]<9),65,IF(AND(RC[-3]<RC[-1],RC[-3]>=9,RC[-3]<10),60,IF(AND(RC[-3]<RC[-1],RC[-3]>=10,RC[-3]<11),55,IF(AND(RC[-3]<RC[-1],RC[-3]>=11,RC[-3]<12),50,IF(AND(RC[-3]<RC[-1],RC[-3]>=12,RC[-3]<13),45,IF(AND(RC[-3]<RC[-1],RC[-3]>=13,RC[-3]<14),40,IF(AND(RC[-3]<RC[-1],RC[-3]>=14,RC[-3]<15),35,IF(AND(RC[-3]<RC[-1],RC[-3]>=15,RC[-3]<16),30,IF(AND(RC[-3]<RC[-1],RC[-3]>=16,RC[-3]<17),25,IF(AND(RC[-3]<RC[-1],RC[-3]>=17,RC[-3]<18),20,IF(AND(RC[-3]<RC[-1],RC[-3]>=18,RC[-3]<19),15,IF(AND(RC[-3]<RC[-1],RC[-3]>=19,RC[-3]<20),10,IF(AND(RC[-3]<RC[-1],RC[-3]>=20,RC[-3]<21),5,IF(AND(RC[-3]<RC[-1],RC[-3]>=21),0,IF(AND(RC[-3]>RC[-1],RC[-3]>=2,RC[-3]<3),90,IF(AND(RC[-3]>RC[-1],RC[-3]>=3,RC[-3]<4),90,IF(AND(RC[-3]>RC[-1],RC[-3]>=4,RC[-3]<5),80,IF(AND(RC[-3]>RC[-1],RC[-3]>=5,RC[-3]<6),70,IF(AND(RC[-3]>RC[-1],RC[-3]>=6,RC[-3]<7),60,IF(AND(RC[-3]>RC[-1],RC[-3]>=7,RC[-3]<8),50,IF(AND(RC[-3]>RC[-1],RC[-3]>=8,RC[-3]<9),40,IF(AND(RC[-3]>RC[-1],RC[-3]>=9,RC[-3]<10),30,IF(AND(RC[-3]>RC[-1],RC[-3]>=10,RC[-3]<11),20,IF(AND(RC[-3]>RC[-1],RC[-3]>=11,RC[-3]<12),10,IF(AND(RC[-3]>RC[-1],RC[-3]>=12),0))))))))))))))))))))))))))))))))) -> 0 | H295: =IF(RC[-3]="","",IF(RC[-3]<0.3,100,IF(AND(RC[-3]>=0.3,RC[-3]>0.4),95,IF(AND(RC[-3]>=0.4,RC[-3]<0.5),90,IF(AND(RC[-3]>=0.5,RC[-3]<0.6),85,IF(AND(RC[-3]>=0.6,RC[-3]<0.7),80,IF(AND(RC[-3]>=0.6,RC[-3]<1),80,IF(AND(RC[-3]>1,RC[-3]<2),50,IF(RC[-3]>2,0))))))))) ->  | I295: =IF(RC[-1]="",RC[-2],0.7*RC[-1]+0.3*RC[-2]) -> 0
A296: سر. استان لرستان | B296: وسلرستا | C296: =VLOOKUP(RC[-1],Sheet1!R3C2:R802C3,2,FALSE) -> سرمایه گذاریها | D296: =VLOOKUP(RC[-2],Sheet1!R3C2:R802C9,8,FALSE) -> 1.4287784858157564 | E296: =IF(VLOOKUP(RC[-3],Sheet1!R3C2:R803C11,10,FALSE)=0,"",VLOOKUP(Sheet2!RC[-3],Sheet1!R[1]C[-3]:R[801]C[6],10,FALSE)) ->  | F296: =Sheet1!R375C10 -> 11.524146113687122 | G296: =IF(RC[-3]<0,0,IF(AND(RC[-3]<RC[-1],RC[-3]<2),100,IF(AND(RC[-3]<RC[-1],RC[-3]>=2,RC[-3]<3),95,IF(AND(RC[-3]<RC[-1],RC[-3]>=3,RC[-3]<4),90,IF(AND(RC[-3]<RC[-1],RC[-3]>=4,RC[-3]<5),85,IF(AND(RC[-3]<RC[-1],RC[-3]>=5,RC[-3]<6),80,IF(AND(RC[-3]<RC[-1],RC[-3]>=6,RC[-3]<7),75,IF(AND(RC[-3]<RC[-1],RC[-3]>=7,RC[-3]<8),70,IF(AND(RC[-3]<RC[-1],RC[-3]>=8,RC[-3]<9),65,IF(AND(RC[-3]<RC[-1],RC[-3]>=9,RC[-3]<10),60,IF(AND(RC[-3]<RC[-1],RC[-3]>=10,RC[-3]<11),55,IF(AND(RC[-3]<RC[-1],RC[-3]>=11,RC[-3]<12),50,IF(AND(RC[-3]<RC[-1],RC[-3]>=12,RC[-3]<13),45,IF(AND(RC[-3]<RC[-1],RC[-3]>=13,RC[-3]<14),40,IF(AND(RC[-3]<RC[-1],RC[-3]>=14,RC[-3]<15),35,IF(AND(RC[-3]<RC[-1],RC[-3]>=15,RC[-3]<16),30,IF(AND(RC[-3]<RC[-1],RC[-3]>=16,RC[-3]<17),25,IF(AND(RC[-3]<RC[-1],RC[-3]>=17,RC[-3]<18),20,IF(AND(RC[-3]<RC[-1],RC[-3]>=18,RC[-3]<19),15,IF(AND(RC[-3]<RC[-1],RC[-3]>=19,RC[-3]<20),10,IF(AND(RC[-3]<RC[-1],RC[-3]>=20,RC[-3]<21),5,IF(AND(RC[-3]<RC[-1],RC[-3]>=21),0,IF(AND(RC[-3]>RC[-1],RC[-3]>=2,RC[-3]<3),90,IF(AND(RC[-3]>RC[-1],RC[-3]>=3,RC[-3]<4),90,IF(AND(RC[-3]>RC[-1],RC[-3]>=4,RC[-3]<5),80,IF(AND(RC[-3]>RC[-1],RC[-3]>=5,RC[-3]<6),70,IF(AND(RC[-3]>RC[-1],RC[-3]>=6,RC[-3]<7),60,IF(AND(RC[-3]>RC[-1],RC[-3]>=7,RC[-3]<8),50,IF(AND(RC[-3]>RC[-1],RC[-3]>=8,RC[-3]<9),40,IF(AND(RC[-3]>RC[-1],RC[-3]>=9,RC[-3]<10),30,IF(AND(RC[-3]>RC[-1],RC[-3]>=10,RC[-3]<11),20,IF(AND(RC[-3]>RC[-1],RC[-3]>=11,RC[-3]<12),10,IF(AND(RC[-3]>RC[-1],RC[-3]>=12),0))))))))))))))))))))))))))))))))) -> 100 | H296: =IF(RC[-3]="","",IF(RC[-3]<0.3,100,IF(AND(RC[-3]>=0.3,RC[-3]>0.4),95,IF(AND(RC[-3]>=0.4,RC[-3]<0.5),90,IF(AND(RC[-3]>=0.5,RC[-3]<0.6),85,IF(AND(RC[-3]>=0.6,RC[-3]<0.7),80,IF(AND(RC[-3]>=0.6,RC[-3]<1),80,IF(AND(RC[-3]>1,RC[-3]<2),50,IF(RC[-3]>2,0))))))))) ->  | I296: =IF(RC[-1]="",RC[-2],0.7*RC[-1]+0.3*RC[-2]) -> 100
A297: سر. استان مازندران | B297: وسمازن | C297: =VLOOKUP(RC[-1],Sheet1!R3C2:R802C3,2,FALSE) -> سرمایه گذاریها | D297: =VLOOKUP(RC[-2],Sheet1!R3C2:R802C9,8,FALSE) -> 0 | E297: =IF(VLOOKUP(RC[-3],Sheet1!R3C2:R803C11,10,FALSE)=0,"",VLOOKUP(Sheet2!RC[-3],Sheet1!R[1]C[-3]:R[801]C[6],10,FALSE)) ->  | F297: =Sheet1!R375C10 -> 11.524146113687122 | G297: =IF(RC[-3]<0,0,IF(AND(RC[-3]<RC[-1],RC[-3]<2),100,IF(AND(RC[-3]<RC[-1],RC[-3]>=2,RC[-3]<3),95,IF(AND(RC[-3]<RC[-1],RC[-3]>=3,RC[-3]<4),90,IF(AND(RC[-3]<RC[-1],RC[-3]>=4,RC[-3]<5),85,IF(AND(RC[-3]<RC[-1],RC[-3]>=5,RC[-3]<6),80,IF(AND(RC[-3]<RC[-1],RC[-3]>=6,RC[-3]<7),75,IF(AND(RC[-3]<RC[-1],RC[-3]>=7,RC[-3]<8),70,IF(AND(RC[-3]<RC[-1],RC[-3]>=8,RC[-3]<9),65,IF(AND(RC[-3]<RC[-1],RC[-3]>=9,RC[-3]<10),60,IF(AND(RC[-3]<RC[-1],RC[-3]>=10,RC[-3]<11),55,IF(AND(RC[-3]<RC[-1],RC[-3]>=11,RC[-3]<12),50,IF(AND(RC[-3]<RC[-1],RC[-3]>=12,RC[-3]<13),45,IF(AND(RC[-3]<RC[-1],RC[-3]>=13,RC[-3]<14),40,IF(AND(RC[-3]<RC[-1],RC[-3]>=14,RC[-3]<15),35,IF(AND(RC[-3]<RC[-1],RC[-3]>=15,RC[-3]<16),30,IF(AND(RC[-3]<RC[-1],RC[-3]>=16,RC[-3]<17),25,IF(AND(RC[-3]<RC[-1],RC[-3]>=17,RC[-3]<18),20,IF(AND(RC[-3]<RC[-1],RC[-3]>=18,RC[-3]<19),15,IF(AND(RC[-3]<RC[-1],RC[-3]>=19,RC[-3]<20),10,IF(AND(RC[-3]<RC[-1],RC[-3]>=20,RC[-3]<21),5,IF(AND(RC[-3]<RC[-1],RC[-3]>=21),0,IF(AND(RC[-3]>RC[-1],RC[-3]>=2,RC[-3]<3),90,IF(AND(RC[-3]>RC[-1],RC[-3]>=3,RC[-3]<4),90,IF(AND(RC[-3]>RC[-1],RC[-3]>=4,RC[-3]<5),80,IF(AND(RC[-3]>RC[-1],RC[-3]>=5,RC[-3]<6),70,IF(AND(RC[-3]>RC[-1],RC[-3]>=6,RC[-3]<7),60,IF(AND(RC[-3]>RC[-1],RC[-3]>=7,RC[-3]<8),50,IF(AND(RC[-3]>RC[-1],RC[-3]>=8,RC[-3]<9),40,IF(AND(RC[-3]>RC[-1],RC[-3]>=9,RC[-3]<10),30,IF(AND(RC[-3]>RC[-1],RC[-3]>=10,RC[-3]<11),20,IF(AND(RC[-3]>RC[-1],RC[-3]>=11,RC[-3]<12),10,IF(AND(RC[-3]>RC[-1],RC[-3]>=12),0))))))))))))))))))))))))))))))))) -> 100 | H297: =IF(RC[-3]="","",IF(RC[-3]<0.3,100,IF(AND(RC[-3]>=0.3,RC[-3]>0.4),95,IF(AND(RC[-3]>=0.4,RC[-3]<0.5),90,IF(AND(RC[-3]>=0.5,RC[-3]<0.6),85,IF(AND(RC[-3]>=0.6,RC[-3]<0.7),80,IF(AND(RC[-3]>=0.6,RC[-3]<1),80,IF(AND(RC[-3]>1,RC[-3]<2),50,IF(RC[-3]>2,0))))))))) ->  | I297: =IF(RC[-1]="",RC[-2],0.7*RC[-1]+0.3*RC[-2]) -> 100
A298: سر. استان مرکزی | B298: وسمرکز | C298: =VLOOKUP(RC[-1],Sheet1!R3C2:R802C3,2,FALSE) -> سرمایه گذاریها | D298: =VLOOKUP(RC[-2],Sheet1!R3C2:R802C9,8,FALSE) -> 4.0601286194056501 | E298: =IF(VLOOKUP(RC[-3],Sheet1!R3C2:R803C11,10,FALSE)=0,"",VLOOKUP(Sheet2!RC[-3],Sheet1!R[1]C[-3]:R[801]C[6],10,FALSE)) ->  | F298: =Sheet1!R375C10 -> 11.524146113687122 | G298: =IF(RC[-3]<0,0,IF(AND(RC[-3]<RC[-1],RC[-3]<2),100,IF(AND(RC[-3]<RC[-1],RC[-3]>=2,RC[-3]<3),95,IF(AND(RC[-3]<RC[-1],RC[-3]>=3,RC[-3]<4),90,IF(AND(RC[-3]<RC[-1],RC[-3]>=4,RC[-3]<5),85,IF(AND(RC[-3]<RC[-1],RC[-3]>=5,RC[-3]<6),80,IF(AND(RC[-3]<RC[-1],RC[-3]>=6,RC[-3]<7),75,IF(AND(RC[-3]<RC[-1],RC[-3]>=7,RC[-3]<8),70,IF(AND(RC[-3]<RC[-1],RC[-3]>=8,RC[-3]<9),65,IF(AND(RC[-3]<RC[-1],RC[-3]>=9,RC[-3]<10),60,IF(AND(RC[-3]<RC[-1],RC[-3]>=10,RC[-3]<11),55,IF(AND(RC[-3]<RC[-1],RC[-3]>=11,RC[-3]<12),50,IF(AND(RC[-3]<RC[-1],RC[-3]>=12,RC[-3]<13),45,IF(AND(RC[-3]<RC[-1],RC[-3]>=13,RC[-3]<14),40,IF(AND(RC[-3]<RC[-1],RC[-3]>=14,RC[-3]<15),35,IF(AND(RC[-3]<RC[-1],RC[-3]>=15,RC[-3]<16),30,IF(AND(RC[-3]<RC[-1],RC[-3]>=16,RC[-3]<17),25,IF(AND(RC[-3]<RC[-1],RC[-3]>=17,RC[-3]<18),20,IF(AND(RC[-3]<RC[-1],RC[-3]>=18,RC[-3]<19),15,IF(AND(RC[-3]<RC[-1],RC[-3]>=19,RC[-3]<20),10,IF(AND(RC[-3]<RC[-1],RC[-3]>=20,RC[-3]<21),5,IF(AND(RC[-3]<RC[-1],RC[-3]>=21),0,IF(AND(RC[-3]>RC[-1],RC[-3]>=2,RC[-3]<3),90,IF(AND(RC[-3]>RC[-1],RC[-3]>=3,RC[-3]<4),90,IF(AND(RC[-3]>RC[-1],RC[-3]>=4,RC[-3]<5),80,IF(AND(RC[-3]>RC[-1],RC[-3]>=5,RC[-3]<6),70,IF(AND(RC[-3]>RC[-1],RC[-3]>=6,RC[-3]<7),60,IF(AND(RC[-3]>RC[-1],RC[-3]>=7,RC[-3]<8),50,IF(AND(RC[-3]>RC[-1],RC[-3]>=8,RC[-3]<9),40,IF(AND(RC[-3]>RC[-1],RC[-3]>=9,RC[-3]<10),30,IF(AND(RC[-3]>RC[-1],RC[-3]>=10,RC[-3]<11),20,IF(AND(RC[-3]>RC[-1],RC[-3]>=11,RC[-3]<12),10,IF(AND(RC[-3]>RC[-1],RC[-3]>=12),0))))))))))))))))))))))))))))))))) -> 85 | H298: =IF(RC[-3]="","",IF(RC[-3]<0.3,100,IF(AND(RC[-3]>=0.3,RC[-3]>0.4),95,IF(AND(RC[-3]>=0.4,RC[-3]<0.5),90,IF(AND(RC[-3]>=0.5,RC[-3]<0.6),85,IF(AND(RC[-3]>=0.6,RC[-3]<0.7),80,IF(AND(RC[-3]>=0.6,RC[-3]<1),80,IF(AND(RC[-3]>1,RC[-3]<2),50,IF(RC[-3]>2,0))))))))) ->  | I298: =IF(RC[-1]="",RC[-2],0.7*RC[-1]+0.3*RC[-2]) -> 85
A299: سر. استان هرمزگان | B299: وسهرمز | C299: =VLOOKUP(RC[-1],Sheet1!R3C2:R802C3,2,FALSE) -> سرمایه گذاریها | D299: =VLOOKUP(RC[-2],Sheet1!R3C2:R802C9,8,FALSE) -> 4.3107815594344403E-7 | E299: =IF(VLOOKUP(RC[-3],Sheet1!R3C2:R803C11,10,FALSE)=0,"",VLOOKUP(Sheet2!RC[-3],Sheet1!R[1]C[-3]:R[801]C[6],10,FALSE)) ->  | F299: =Sheet1!R375C10 -> 11.524146113687122 | G299: =IF(RC[-3]<0,0,IF(AND(RC[-3]<RC[-1],RC[-3]<2),100,IF(AND(RC[-3]<RC[-1],RC[-3]>=2,RC[-3]<3),95,IF(AND(RC[-3]<RC[-1],RC[-3]>=3,RC[-3]<4),90,IF(AND(RC[-3]<RC[-1],RC[-3]>=4,RC[-3]<5),85,IF(AND(RC[-3]<RC[-1],RC[-3]>=5,RC[-3]<6),80,IF(AND(RC[-3]<RC[-1],RC[-3]>=6,RC[-3]<7),75,IF(AND(RC[-3]<RC[-1],RC[-3]>=7,RC[-3]<8),70,IF(AND(RC[-3]<RC[-1],RC[-3]>=8,RC[-3]<9),65,IF(AND(RC[-3]<RC[-1],RC[-3]>=9,RC[-3]<10),60,IF(AND(RC[-3]<RC[-1],RC[-3]>=10,RC[-3]<11),55,IF(AND(RC[-3]<RC[-1],RC[-3]>=11,RC[-3]<12),50,IF(AND(RC[-3]<RC[-1],RC[-3]>=12,RC[-3]<13),45,IF(AND(RC[-3]<RC[-1],RC[-3]>=13,RC[-3]<14),40,IF(AND(RC[-3]<RC[-1],RC[-3]>=14,RC[-3]<15),35,IF(AND(RC[-3]<RC[-1],RC[-3]>=15,RC[-3]<16),30,IF(AND(RC[-3]<RC[-1],RC[-3]>=16,RC[-3]<17),25,IF(AND(RC[-3]<RC[-1],RC[-3]>=17,RC[-3]<18),20,IF(AND(RC[-3]<RC[-1],RC[-3]>=18,RC[-3]<19),15,IF(AND(RC[-3]<RC[-1],RC[-3]>=19,RC[-3]<20),10,IF(AND(RC[-3]<RC[-1],RC[-3]>=20,RC[-3]<21),5,IF(AND(RC[-3]<RC[-1],RC[-3]>=21),0,IF(AND(RC[-3]>RC[-1],RC[-3]>=2,RC[-3]<3),90,IF(AND(RC[-3]>RC[-1],RC[-3]>=3,RC[-3]<4),90,IF(AND(RC[-3]>RC[-1],RC[-3]>=4,RC[-3]<5),80,IF(AND(RC[-3]>RC[-1],RC[-3]>=5,RC[-3]<6),70,IF(AND(RC[-3]>RC[-1],RC[-3]>=6,RC[-3]<7),60,IF(AND(RC[-3]>RC[-1],RC[-3]>=7,RC[-3]<8),50,IF(AND(RC[-3]>RC[-1],RC[-3]>=8,RC[-3]<9),40,IF(AND(RC[-3]>RC[-1],RC[-3]>=9,RC[-3]<10),30,IF(AND(RC[-3]>RC[-1],RC[-3]>=10,RC[-3]<11),20,IF(AND(RC[-3]>RC[-1],RC[-3]>=11,RC[-3]<12),10,IF(AND(RC[-3]>RC[-1],RC[-3]>=12),0))))))))))))))))))))))))))))))))) -> 100 | H299: =IF(RC[-3]="","",IF(RC[-3]<0.3,100,IF(AND(RC[-3]>=0.3,RC[-3]>0.4),95,IF(AND(RC[-3]>=0.4,RC[-3]<0.5),90,IF(AND(RC[-3]>=0.5,RC[-3]<0.6),85,IF(AND(RC[-3]>=0.6,RC[-3]<0.7),80,IF(AND(RC[-3]>=0.6,RC[-3]<1),80,IF(AND(RC[-3]>1,RC[-3]<2),50,IF(RC[-3]>2,0))))))))) ->  | I299: =IF(RC[-1]="",RC[-2],0.7*RC[-1]+0.3*RC[-2]) -> 100
A300: سر. استان همدان | B300: وسهمدا | C300: =VLOOKUP(RC[-1],Sheet1!R3C2:R802C3,2,FALSE) -> سرمایه گذاریها | D300: =VLOOKUP(RC[-2],Sheet1!R3C2:R802C9,8,FALSE) -> 1.5524754872291489E-3 | E300: =IF(VLOOKUP(RC[-3],Sheet1!R3C2:R803C11,10,FALSE)=0,"",VLOOKUP(Sheet2!RC[-3],Sheet1!R[1]C[-3]:R[801]C[6],10,FALSE)) ->  | F300: =Sheet1!R375C10 -> 11.524146113687122 | G300: =IF(RC[-3]<0,0,IF(AND(RC[-3]<RC[-1],RC[-3]<2),100,IF(AND(RC[-3]<RC[-1],RC[-3]>=2,RC[-3]<3),95,IF(AND(RC[-3]<RC[-1],RC[-3]>=3,RC[-3]<4),90,IF(AND(RC[-3]<RC[-1],RC[-3]>=4,RC[-3]<5),85,IF(AND(RC[-3]<RC[-1],RC[-3]>=5,RC[-3]<6),80,IF(AND(RC[-3]<RC[-1],RC[-3]>=6,RC[-3]<7),75,IF(AND(RC[-3]<RC[-1],RC[-3]>=7,RC[-3]<8),70,IF(AND(RC[-3]<RC[-1],RC[-3]>=8,RC[-3]<9),65,IF(AND(RC[-3]<RC[-1],RC[-3]>=9,RC[-3]<10),60,IF(AND(RC[-3]<RC[-1],RC[-3]>=10,RC[-3]<11),55,IF(AND(RC[-3]<RC[-1],RC[-3]>=11,RC[-3]<12),50,IF(AND(RC[-3]<RC[-1],RC[-3]>=12,RC[-3]<13),45,IF(AND(RC[-3]<RC[-1],RC[-3]>=13,RC[-3]<14),40,IF(AND(RC[-3]<RC[-1],RC[-3]>=14,RC[-3]<15),35,IF(AND(RC[-3]<RC[-1],RC[-3]>=15,RC[-3]<16),30,IF(AND(RC[-3]<RC[-1],RC[-3]>=16,RC[-3]<17),25,IF(AND(RC[-3]<RC[-1],RC[-3]>=17,RC[-3]<18),20,IF(AND(RC[-3]<RC[-1],RC[-3]>=18,RC[-3]<19),15,IF(AND(RC[-3]<RC[-1],RC[-3]>=19,RC[-3]<20),10,IF(AND(RC[-3]<RC[-1],RC[-3]>=20,RC[-3]<21),5,IF(AND(RC[-3]<RC[-1],RC[-3]>=21),0,IF(AND(RC[-3]>RC[-1],RC[-3]>=2,RC[-3]<3),90,IF(AND(RC[-3]>RC[-1],RC[-3]>=3,RC[-3]<4),90,IF(AND(RC[-3]>RC[-1],RC[-3]>=4,RC[-3]<5),80,IF(AND(RC[-3]>RC[-1],RC[-3]>=5,RC[-3]<6),70,IF(AND(RC[-3]>RC[-1],RC[-3]>=6,RC[-3]<7),60,IF(AND(RC[-3]>RC[-1],RC[-3]>=7,RC[-3]<8),50,IF(AND(RC[-3]>RC[-1],RC[-3]>=8,RC[-3]<9),40,IF(AND(RC[-3]>RC[-1],RC[-3]>=9,RC[-3]<10),30,IF(AND(RC[-3]>RC[-1],RC[-3]>=10,RC[-3]<11),20,IF(AND(RC[-3]>RC[-1],RC[-3]>=11,RC[-3]<12),10,IF(AND(RC[-3]>RC[-1],RC[-3]>=12),0))))))))))))))))))))))))))))))))) -> 100 | H300: =IF(RC[-3]="","",IF(RC[-3]<0.3,100,IF(AND(RC[-3]>=0.3,RC[-3]>0.4),95,IF(AND(RC[-3]>=0.4,RC[-3]<0.5),90,IF(AND(RC[-3]>=0.5,RC[-3]<0.6),85,IF(AND(RC[-3]>=0.6,RC[-3]<0.7),80,IF(AND(RC[-3]>=0.6,RC[-3]<1),80,IF(AND(RC[-3]>1,RC[-3]<2),50,IF(RC[-3]>2,0))))))))) ->  | I300: =IF(RC[-1]="",RC[-2],0.7*RC[-1]+0.3*RC[-2]) -> 100
A301: سر. استان کردستان | B301: وسکرد | C301: =VLOOKUP(RC[-1],Sheet1!R3C2:R802C3,2,FALSE) -> سرمایه گذاریها | D301: =VLOOKUP(RC[-2],Sheet1!R3C2:R802C9,8,FALSE) -> 0.60186549086634056 | E301: =IF(VLOOKUP(RC[-3],Sheet1!R3C2:R803C11,10,FALSE)=0,"",VLOOKUP(Sheet2!RC[-3],Sheet1!R[1]C[-3]:R[801]C[6],10,FALSE)) ->  | F301: =Sheet1!R375C10 -> 11.524146113687122 | G301: =IF(RC[-3]<0,0,IF(AND(RC[-3]<RC[-1],RC[-3]<2),100,IF(AND(RC[-3]<RC[-1],RC[-3]>=2,RC[-3]<3),95,IF(AND(RC[-3]<RC[-1],RC[-3]>=3,RC[-3]<4),90,IF(AND(RC[-3]<RC[-1],RC[-3]>=4,RC[-3]<5),85,IF(AND(RC[-3]<RC[-1],RC[-3]>=5,RC[-3]<6),80,IF(AND(RC[-3]<RC[-1],RC[-3]>=6,RC[-3]<7),75,IF(AND(RC[-3]<RC[-1],RC[-3]>=7,RC[-3]<8),70,IF(AND(RC[-3]<RC[-1],RC[-3]>=8,RC[-3]<9),65,IF(AND(RC[-3]<RC[-1],RC[-3]>=9,RC[-3]<10),60,IF(AND(RC[-3]<RC[-1],RC[-3]>=10,RC[-3]<11),55,IF(AND(RC[-3]<RC[-1],RC[-3]>=11,RC[-3]<12),50,IF(AND(RC[-3]<RC[-1],RC[-3]>=12,RC[-3]<13),45,IF(AND(RC[-3]<RC[-1],RC[-3]>=13,RC[-3]<14),40,IF(AND(RC[-3]<RC[-1],RC[-3]>=14,RC[-3]<15),35,IF(AND(RC[-3]<RC[-1],RC[-3]>=15,RC[-3]<16),30,IF(AND(RC[-3]<RC[-1],RC[-3]>=16,RC[-3]<17),25,IF(AND(RC[-3]<RC[-1],RC[-3]>=17,RC[-3]<18),20,IF(AND(RC[-3]<RC[-1],RC[-3]>=18,RC[-3]<19),15,IF(AND(RC[-3]<RC[-1],RC[-3]>=19,RC[-3]<20),10,IF(AND(RC[-3]<RC[-1],RC[-3]>=20,RC[-3]<21),5,IF(AND(RC[-3]<RC[-1],RC[-3]>=21),0,IF(AND(RC[-3]>RC[-1],RC[-3]>=2,RC[-3]<3),90,IF(AND(RC[-3]>RC[-1],RC[-3]>=3,RC[-3]<4),90,IF(AND(RC[-3]>RC[-1],RC[-3]>=4,RC[-3]<5),80,IF(AND(RC[-3]>RC[-1],RC[-3]>=5,RC[-3]<6),70,IF(AND(RC[-3]>RC[-1],RC[-3]>=6,RC[-3]<7),60,IF(AND(RC[-3]>RC[-1],RC[-3]>=7,RC[-3]<8),50,IF(AND(RC[-3]>RC[-1],RC[-3]>=8,RC[-3]<9),40,IF(AND(RC[-3]>RC[-1],RC[-3]>=9,RC[-3]<10),30,IF(AND(RC[-3]>RC[-1],RC[-3]>=10,RC[-3]<11),20,IF(AND(RC[-3]>RC[-1],RC[-3]>=11,RC[-3]<12),10,IF(AND(RC[-3]>RC[-1],RC[-3]>=12),0))))))))))))))))))))))))))))))))) -> 100 | H301: =IF(RC[-3]="","",IF(RC[-3]<0.3,100,IF(AND(RC[-3]>=0.3,RC[-3]>0.4),95,IF(AND(RC[-3]>=0.4,RC[-3]<0.5),90,IF(AND(RC[-3]>=0.5,RC[-3]<0.6),85,IF(AND(RC[-3]>=0.6,RC[-3]<0.7),80,IF(AND(RC[-3]>=0.6,RC[-3]<1),80,IF(AND(RC[-3]>1,RC[-3]<2),50,IF(RC[-3]>2,0))))))))) ->  | I301: =IF(RC[-1]="",RC[-2],0.7*RC[-1]+0.3*RC[-2]) -> 100
A302: سر. استان کرمان | B302: وسکرمان | C302: =VLOOKUP(RC[-1],Sheet1!R3C2:R802C3,2,FALSE) -> سرمایه گذاریها | D302: =VLOOKUP(RC[-2],Sheet1!R3C2:R802C9,8,FALSE) -> 1.8049665949945011 | E302: =IF(VLOOKUP(RC[-3],Sheet1!R3C2:R803C11,10,FALSE)=0,"",VLOOKUP(Sheet2!RC[-3],Sheet1!R[1]C[-3]:R[801]C[6],10,FALSE)) ->  | F302: =Sheet1!R375C10 -> 11.524146113687122 | G302: =IF(RC[-3]<0,0,IF(AND(RC[-3]<RC[-1],RC[-3]<2),100,IF(AND(RC[-3]<RC[-1],RC[-3]>=2,RC[-3]<3),95,IF(AND(RC[-3]<RC[-1],RC[-3]>=3,RC[-3]<4),90,IF(AND(RC[-3]<RC[-1],RC[-3]>=4,RC[-3]<5),85,IF(AND(RC[-3]<RC[-1],RC[-3]>=5,RC[-3]<6),80,IF(AND(RC[-3]<RC[-1],RC[-3]>=6,RC[-3]<7),75,IF(AND(RC[-3]<RC[-1],RC[-3]>=7,RC[-3]<8),70,IF(AND(RC[-3]<RC[-1],RC[-3]>=8,RC[-3]<9),65,IF(AND(RC[-3]<RC[-1],RC[-3]>=9,RC[-3]<10),60,IF(AND(RC[-3]<RC[-1],RC[-3]>=10,RC[-3]<11),55,IF(AND(RC[-3]<RC[-1],RC[-3]>=11,RC[-3]<12),50,IF(AND(RC[-3]<RC[-1],RC[-3]>=12,RC[-3]<13),45,IF(AND(RC[-3]<RC[-1],RC[-3]>=13,RC[-3]<14),40,IF(AND(RC[-3]<RC[-1],RC[-3]>=14,RC[-3]<15),35,IF(AND(RC[-3]<RC[-1],RC[-3]>=15,RC[-3]<16),30,IF(AND(RC[-3]<RC[-1],RC[-3]>=16,RC[-3]<17),25,IF(AND(RC[-3]<RC[-1],RC[-3]>=17,RC[-3]<18),20,IF(AND(RC[-3]<RC[-1],RC[-3]>=18,RC[-3]<19),15,IF(AND(RC[-3]<RC[-1],RC[-3]>=19,RC[-3]<20),10,IF(AND(RC[-3]<RC[-1],RC[-3]>=20,RC[-3]<21),5,IF(AND(RC[-3]<RC[-1],RC[-3]>=21),0,IF(AND(RC[-3]>RC[-1],RC[-3]>=2,RC[-3]<3),90,IF(AND(RC[-3]>RC[-1],RC[-3]>=3,RC[-3]<4),90,IF(AND(RC[-3]>RC[-1],RC[-3]>=4,RC[-3]<5),80,IF(AND(RC[-3]>RC[-1],RC[-3]>=5,RC[-3]<6),70,IF(AND(RC[-3]>RC[-1],RC[-3]>=6,RC[-3]<7),60,IF(AND(RC[-3]>RC[-1],RC[-3]>=7,RC[-3]<8),50,IF(AND(RC[-3]>RC[-1],RC[-3]>=8,RC[-3]<9),40,IF(AND(RC[-3]>RC[-1],RC[-3]>=9,RC[-3]<10),30,IF(AND(RC[-3]>RC[-1],RC[-3]>=10,RC[-3]<11),20,IF(AND(RC[-3]>RC[-1],RC[-3]>=11,RC[-3]<12),10,IF(AND(RC[-3]>RC[-1],RC[-3]>=12),0))))))))))))))))))))))))))))))))) -> 100 | H302: =IF(RC[-3]="","",IF(RC[-3]<0.3,100,IF(AND(RC[-3]>=0.3,RC[-3]>0.4),95,IF(AND(RC[-3]>=0.4,RC[-3]<0.5),90,IF(AND(RC[-3]>=0.5,RC[-3]<0.6),85,IF(AND(RC[-3]>=0.6,RC[-3]<0.7),80,IF(AND(RC[-3]>=0.6,RC[-3]<1),80,IF(AND(RC[-3]>1,RC[-3]<2),50,IF(RC[-3]>2,0))))))))) ->  | I302: =IF(RC[-1]="",RC[-2],0.7*RC[-1]+0.3*RC[-2]) -> 100
A303: سر. استان کرمانشاه | B303: وسکرشا | C303: =VLOOKUP(RC[-1],Sheet1!R3C2:R802C3,2,FALSE) -> سرمایه گذاریها | D303: =VLOOKUP(RC[-2],Sheet1!R3C2:R802C9,8,FALSE) -> 0.87181036580803162 | E303: =IF(VLOOKUP(RC[-3],Sheet1!R3C2:R803C11,10,FALSE)=0,"",VLOOKUP(Sheet2!RC[-3],Sheet1!R[1]C[-3]:R[801]C[6],10,FALSE)) ->  | F303: =Sheet1!R375C10 -> 11.524146113687122 | G303: =IF(RC[-3]<0,0,IF(AND(RC[-3]<RC[-1],RC[-3]<2),100,IF(AND(RC[-3]<RC[-1],RC[-3]>=2,RC[-3]<3),95,IF(AND(RC[-3]<RC[-1],RC[-3]>=3,RC[-3]<4),90,IF(AND(RC[-3]<RC[-1],RC[-3]>=4,RC[-3]<5),85,IF(AND(RC[-3]<RC[-1],RC[-3]>=5,RC[-3]<6),80,IF(AND(RC[-3]<RC[-1],RC[-3]>=6,RC[-3]<7),75,IF(AND(RC[-3]<RC[-1],RC[-3]>=7,RC[-3]<8),70,IF(AND(RC[-3]<RC[-1],RC[-3]>=8,RC[-3]<9),65,IF(AND(RC[-3]<RC[-1],RC[-3]>=9,RC[-3]<10),60,IF(AND(RC[-3]<RC[-1],RC[-3]>=10,RC[-3]<11),55,IF(AND(RC[-3]<RC[-1],RC[-3]>=11,RC[-3]<12),50,IF(AND(RC[-3]<RC[-1],RC[-3]>=12,RC[-3]<13),45,IF(AND(RC[-3]<RC[-1],RC[-3]>=13,RC[-3]<14),40,IF(AND(RC[-3]<RC[-1],RC[-3]>=14,RC[-3]<15),35,IF(AND(RC[-3]<RC[-1],RC[-3]>=15,RC[-3]<16),30,IF(AND(RC[-3]<RC[-1],RC[-3]>=16,RC[-3]<17),25,IF(AND(RC[-3]<RC[-1],RC[-3]>=17,RC[-3]<18),20,IF(AND(RC[-3]<RC[-1],RC[-3]>=18,RC[-3]<19),15,IF(AND(RC[-3]<RC[-1],RC[-3]>=19,RC[-3]<20),10,IF(AND(RC[-3]<RC[-1],RC[-3]>=20,RC[-3]<21),5,IF(AND(RC[-3]<RC[-1],RC[-3]>=21),0,IF(AND(RC[-3]>RC[-1],RC[-3]>=2,RC[-3]<3),90,IF(AND(RC[-3]>RC[-1],RC[-3]>=3,RC[-3]<4),90,IF(AND(RC[-3]>RC[-1],RC[-3]>=4,RC[-3]<5),80,IF(AND(RC[-3]>RC[-1],RC[-3]>=5,RC[-3]<6),70,IF(AND(RC[-3]>RC[-1],RC[-3]>=6,RC[-3]<7),60,IF(AND(RC[-3]>RC[-1],RC[-3]>=7,RC[-3]<8),50,IF(AND(RC[-3]>RC[-1],RC[-3]>=8,RC[-3]<9),40,IF(AND(RC[-3]>RC[-1],RC[-3]>=9,RC[-3]<10),30,IF(AND(RC[-3]>RC[-1],RC[-3]>=10,RC[-3]<11),20,IF(AND(RC[-3]>RC[-1],RC[-3]>=11,RC[-3]<12),10,IF(AND(RC[-3]>RC[-1],RC[-3]>=12),0))))))))))))))))))))))))))))))))) -> 100 | H303: =IF(RC[-3]="","",IF(RC[-3]<0.3,100,IF(AND(RC[-3]>=0.3,RC[-3]>0.4),95,IF(AND(RC[-3]>=0.4,RC[-3]<0.5),90,IF(AND(RC[-3]>=0.5,RC[-3]<0.6),85,IF(AND(RC[-3]>=0.6,RC[-3]<0.7),80,IF(AND(RC[-3]>=0.6,RC[-3]<1),80,IF(AND(RC[-3]>1,RC[-3]<2),50,IF(RC[-3]>2,0))))))))) ->  | I303: =IF(RC[-1]="",RC[-2],0.7*RC[-1]+0.3*RC[-2]) -> 100
A304: سر. استان کهگیلویه و بویراحمد | B304: وسکهبو | C304: =VLOOKUP(RC[-1],Sheet1!R3C2:R802C3,2,FALSE) -> سرمایه گذاریها | D304: =VLOOKUP(RC[-2],Sheet1!R3C2:R802C9,8,FALSE) -> 0.88625254896750005 | E304: =IF(VLOOKUP(RC[-3],Sheet1!R3C2:R803C11,10,FALSE)=0,"",VLOOKUP(Sheet2!RC[-3],Sheet1!R[1]C[-3]:R[801]C[6],10,FALSE)) ->  | F304: =Sheet1!R375C10 -> 11.524146113687122 | G304: =IF(RC[-3]<0,0,IF(AND(RC[-3]<RC[-1],RC[-3]<2),100,IF(AND(RC[-3]<RC[-1],RC[-3]>=2,RC[-3]<3),95,IF(AND(RC[-3]<RC[-1],RC[-3]>=3,RC[-3]<4),90,IF(AND(RC[-3]<RC[-1],RC[-3]>=4,RC[-3]<5),85,IF(AND(RC[-3]<RC[-1],RC[-3]>=5,RC[-3]<6),80,IF(AND(RC[-3]<RC[-1],RC[-3]>=6,RC[-3]<7),75,IF(AND(RC[-3]<RC[-1],RC[-3]>=7,RC[-3]<8),70,IF(AND(RC[-3]<RC[-1],RC[-3]>=8,RC[-3]<9),65,IF(AND(RC[-3]<RC[-1],RC[-3]>=9,RC[-3]<10),60,IF(AND(RC[-3]<RC[-1],RC[-3]>=10,RC[-3]<11),55,IF(AND(RC[-3]<RC[-1],RC[-3]>=11,RC[-3]<12),50,IF(AND(RC[-3]<RC[-1],RC[-3]>=12,RC[-3]<13),45,IF(AND(RC[-3]<RC[-1],RC[-3]>=13,RC[-3]<14),40,IF(AND(RC[-3]<RC[-1],RC[-3]>=14,RC[-3]<15),35,IF(AND(RC[-3]<RC[-1],RC[-3]>=15,RC[-3]<16),30,IF(AND(RC[-3]<RC[-1],RC[-3]>=16,RC[-3]<17),25,IF(AND(RC[-3]<RC[-1],RC[-3]>=17,RC[-3]<18),20,IF(AND(RC[-3]<RC[-1],RC[-3]>=18,RC[-3]<19),15,IF(AND(RC[-3]<RC[-1],RC[-3]>=19,RC[-3]<20),10,IF(AND(RC[-3]<RC[-1],RC[-3]>=20,RC[-3]<21),5,IF(AND(RC[-3]<RC[-1],RC[-3]>=21),0,IF(AND(RC[-3]>RC[-1],RC[-3]>=2,RC[-3]<3),90,IF(AND(RC[-3]>RC[-1],RC[-3]>=3,RC[-3]<4),90,IF(AND(RC[-3]>RC[-1],RC[-3]>=4,RC[-3]<5),80,IF(AND(RC[-3]>RC[-1],RC[-3]>=5,RC[-3]<6),70,IF(AND(RC[-3]>RC[-1],RC[-3]>=6,RC[-3]<7),60,IF(AND(RC[-3]>RC[-1],RC[-3]>=7,RC[-3]<8),50,IF(AND(RC[-3]>RC[-1],RC[-3]>=8,RC[-3]<9),40,IF(AND(RC[-3]>RC[-1],RC[-3]>=9,RC[-3]<10),30,IF(AND(RC[-3]>RC[-1],RC[-3]>=10,RC[-3]<11),20,IF(AND(RC[-3]>RC[-1],RC[-3]>=11,RC[-3]<12),10,IF(AND(RC[-3]>RC[-1],RC[-3]>=12),0))))))))))))))))))))))))))))))))) -> 100 | H304: =IF(RC[-3]="","",IF(RC[-3]<0.3,100,IF(AND(RC[-3]>=0.3,RC[-3]>0.4),95,IF(AND(RC[-3]>=0.4,RC[-3]<0.5),90,IF(AND(RC[-3]>=0.5,RC[-3]<0.6),85,IF(AND(RC[-3]>=0.6,RC[-3]<0.7),80,IF(AND(RC[-3]>=0.6,RC[-3]<1),80,IF(AND(RC[-3]>1,RC[-3]<2),50,IF(RC[-3]>2,0))))))))) ->  | I304: =IF(RC[-1]="",RC[-2],0.7*RC[-1]+0.3*RC[-2]) -> 100
A305: سر. استان یزد | B305: وسیزد | C305: =VLOOKUP(RC[-1],Sheet1!R3C2:R802C3,2,FALSE) -> سرمایه گذاریها | D305: =VLOOKUP(RC[-2],Sheet1!R3C2:R802C9,8,FALSE) -> 1.1302258177004312 | E305: =IF(VLOOKUP(RC[-3],Sheet1!R3C2:R803C11,10,FALSE)=0,"",VLOOKUP(Sheet2!RC[-3],Sheet1!R[1]C[-3]:R[801]C[6],10,FALSE)) ->  | F305: =Sheet1!R375C10 -> 11.524146113687122 | G305: =IF(RC[-3]<0,0,IF(AND(RC[-3]<RC[-1],RC[-3]<2),100,IF(AND(RC[-3]<RC[-1],RC[-3]>=2,RC[-3]<3),95,IF(AND(RC[-3]<RC[-1],RC[-3]>=3,RC[-3]<4),90,IF(AND(RC[-3]<RC[-1],RC[-3]>=4,RC[-3]<5),85,IF(AND(RC[-3]<RC[-1],RC[-3]>=5,RC[-3]<6),80,IF(AND(RC[-3]<RC[-1],RC[-3]>=6,RC[-3]<7),75,IF(AND(RC[-3]<RC[-1],RC[-3]>=7,RC[-3]<8),70,IF(AND(RC[-3]<RC[-1],RC[-3]>=8,RC[-3]<9),65,IF(AND(RC[-3]<RC[-1],RC[-3]>=9,RC[-3]<10),60,IF(AND(RC[-3]<RC[-1],RC[-3]>=10,RC[-3]<11),55,IF(AND(RC[-3]<RC[-1],RC[-3]>=11,RC[-3]<12),50,IF(AND(RC[-3]<RC[-1],RC[-3]>=12,RC[-3]<13),45,IF(AND(RC[-3]<RC[-1],RC[-3]>=13,RC[-3]<14),40,IF(AND(RC[-3]<RC[-1],RC[-3]>=14,RC[-3]<15),35,IF(AND(RC[-3]<RC[-1],RC[-3]>=15,RC[-3]<16),30,IF(AND(RC[-3]<RC[-1],RC[-3]>=16,RC[-3]<17),25,IF(AND(RC[-3]<RC[-1],RC[-3]>=17,RC[-3]<18),20,IF(AND(RC[-3]<RC[-1],RC[-3]>=18,RC[-3]<19),15,IF(AND(RC[-3]<RC[-1],RC[-3]>=19,RC[-3]<20),10,IF(AND(RC[-3]<RC[-1],RC[-3]>=20,RC[-3]<21),5,IF(AND(RC[-3]<RC[-1],RC[-3]>=21),0,IF(AND(RC[-3]>RC[-1],RC[-3]>=2,RC[-3]<3),90,IF(AND(RC[-3]>RC[-1],RC[-3]>=3,RC[-3]<4),90,IF(AND(RC[-3]>RC[-1],RC[-3]>=4,RC[-3]<5),80,IF(AND(RC[-3]>RC[-1],RC[-3]>=5,RC[-3]<6),70,IF(AND(RC[-3]>RC[-1],RC[-3]>=6,RC[-3]<7),60,IF(AND(RC[-3]>RC[-1],RC[-3]>=7,RC[-3]<8),50,IF(AND(RC[-3]>RC[-1],RC[-3]>=8,RC[-3]<9),40,IF(AND(RC[-3]>RC[-1],RC[-3]>=9,RC[-3]<10),30,IF(AND(RC[-3]>RC[-1],RC[-3]>=10,RC[-3]<11),20,IF(AND(RC[-3]>RC[-1],RC[-3]>=11,RC[-3]<12),10,IF(AND(RC[-3]>RC[-1],RC[-3]>=12),0))))))))))))))))))))))))))))))))) -> 100 | H305: =IF(RC[-3]="","",IF(RC[-3]<0.3,100,IF(AND(RC[-3]>=0.3,RC[-3]>0.4),95,IF(AND(RC[-3]>=0.4,RC[-3]<0.5),90,IF(AND(RC[-3]>=0.5,RC[-3]<0.6),85,IF(AND(RC[-3]>=0.6,RC[-3]<0.7),80,IF(AND(RC[-3]>=0.6,RC[-3]<1),80,IF(AND(RC[-3]>1,RC[-3]<2),50,IF(RC[-3]>2,0))))))))) ->  | I305: =IF(RC[-1]="",RC[-2],0.7*RC[-1]+0.3*RC[-2]) -> 100
A306: سر. اعتبار ایران | B306: واعتبار | C306: =VLOOKUP(RC[-1],Sheet1!R3C2:R802C3,2,FALSE) -> سرمایه گذاریها | D306: =VLOOKUP(RC[-2],Sheet1!R3C2:R802C9,8,FALSE) -> 4.823518128460714 | E306: =IF(VLOOKUP(RC[-3],Sheet1!R3C2:R803C11,10,FALSE)=0,"",VLOOKUP(Sheet2!RC[-3],Sheet1!R[1]C[-3]:R[801]C[6],10,FALSE)) -> 1.2 | F306: =Sheet1!R375C10 -> 11.524146113687122 | G306: =IF(RC[-3]<0,0,IF(AND(RC[-3]<RC[-1],RC[-3]<2),100,IF(AND(RC[-3]<RC[-1],RC[-3]>=2,RC[-3]<3),95,IF(AND(RC[-3]<RC[-1],RC[-3]>=3,RC[-3]<4),90,IF(AND(RC[-3]<RC[-1],RC[-3]>=4,RC[-3]<5),85,IF(AND(RC[-3]<RC[-1],RC[-3]>=5,RC[-3]<6),80,IF(AND(RC[-3]<RC[-1],RC[-3]>=6,RC[-3]<7),75,IF(AND(RC[-3]<RC[-1],RC[-3]>=7,RC[-3]<8),70,IF(AND(RC[-3]<RC[-1],RC[-3]>=8,RC[-3]<9),65,IF(AND(RC[-3]<RC[-1],RC[-3]>=9,RC[-3]<10),60,IF(AND(RC[-3]<RC[-1],RC[-3]>=10,RC[-3]<11),55,IF(AND(RC[-3]<RC[-1],RC[-3]>=11,RC[-3]<12),50,IF(AND(RC[-3]<RC[-1],RC[-3]>=12,RC[-3]<13),45,IF(AND(RC[-3]<RC[-1],RC[-3]>=13,RC[-3]<14),40,IF(AND(RC[-3]<RC[-1],RC[-3]>=14,RC[-3]<15),35,IF(AND(RC[-3]<RC[-1],RC[-3]>=15,RC[-3]<16),30,IF(AND(RC[-3]<RC[-1],RC[-3]>=16,RC[-3]<17),25,IF(AND(RC[-3]<RC[-1],RC[-3]>=17,RC[-3]<18),20,IF(AND(RC[-3]<RC[-1],RC[-3]>=18,RC[-3]<19),15,IF(AND(RC[-3]<RC[-1],RC[-3]>=19,RC[-3]<20),10,IF(AND(RC[-3]<RC[-1],RC[-3]>=20,RC[-3]<21),5,IF(AND(RC[-3]<RC[-1],RC[-3]>=21),0,IF(AND(RC[-3]>RC[-1],RC[-3]>=2,RC[-3]<3),90,IF(AND(RC[-3]>RC[-1],RC[-3]>=3,RC[-3]<4),90,IF(AND(RC[-3]>RC[-1],RC[-3]>=4,RC[-3]<5),80,IF(AND(RC[-3]>RC[-1],RC[-3]>=5,RC[-3]<6),70,IF(AND(RC[-3]>RC[-1],RC[-3]>=6,RC[-3]<7),60,IF(AND(RC[-3]>RC[-1],RC[-3]>=7,RC[-3]<8),50,IF(AND(RC[-3]>RC[-1],RC[-3]>=8,RC[-3]<9),40,IF(AND(RC[-3]>RC[-1],RC[-3]>=9,RC[-3]<10),30,IF(AND(RC[-3]>RC[-1],RC[-3]>=10,RC[-3]<11),20,IF(AND(RC[-3]>RC[-1],RC[-3]>=11,RC[-3]<12),10,IF(AND(RC[-3]>RC[-1],RC[-3]>=12),0))))))))))))))))))))))))))))))))) -> 85 | H306: =IF(RC[-3]="","",IF(RC[-3]<0.3,100,IF(AND(RC[-3]>=0.3,RC[-3]>0.4),95,IF(AND(RC[-3]>=0.4,RC[-3]<0.5),90,IF(AND(RC[-3]>=0.5,RC[-3]<0.6),85,IF(AND(RC[-3]>=0.6,RC[-3]<0.7),80,IF(AND(RC[-3]>=0.6,RC[-3]<1),80,IF(AND(RC[-3]>1,RC[-3]<2),50,IF(RC[-3]>2,0))))))))) -> 95 | I306: =IF(RC[-1]="",RC[-2],0.7*RC[-1]+0.3*RC[-2]) -> 92
A307: سر. اعتلاء البرز | B307: اعتلا | C307: =VLOOKUP(RC[-1],Sheet1!R3C2:R802C3,2,FALSE) -> سرمایه گذاریها | D307: =VLOOKUP(RC[-2],Sheet1!R3C2:R802C9,8,FALSE) -> 2.2284355847833099 | E307: =IF(VLOOKUP(RC[-3],Sheet1!R3C2:R803C11,10,FALSE)=0,"",VLOOKUP(Sheet2!RC[-3],Sheet1!R[1]C[-3]:R[801]C[6],10,FALSE)) -> 1 | F307: =Sheet1!R375C10 -> 11.524146113687122 | G307: =IF(RC[-3]<0,0,IF(AND(RC[-3]<RC[-1],RC[-3]<2),100,IF(AND(RC[-3]<RC[-1],RC[-3]>=2,RC[-3]<3),95,IF(AND(RC[-3]<RC[-1],RC[-3]>=3,RC[-3]<4),90,IF(AND(RC[-3]<RC[-1],RC[-3]>=4,RC[-3]<5),85,IF(AND(RC[-3]<RC[-1],RC[-3]>=5,RC[-3]<6),80,IF(AND(RC[-3]<RC[-1],RC[-3]>=6,RC[-3]<7),75,IF(AND(RC[-3]<RC[-1],RC[-3]>=7,RC[-3]<8),70,IF(AND(RC[-3]<RC[-1],RC[-3]>=8,RC[-3]<9),65,IF(AND(RC[-3]<RC[-1],RC[-3]>=9,RC[-3]<10),60,IF(AND(RC[-3]<RC[-1],RC[-3]>=10,RC[-3]<11),55,IF(AND(RC[-3]<RC[-1],RC[-3]>=11,RC[-3]<12),50,IF(AND(RC[-3]<RC[-1],RC[-3]>=12,RC[-3]<13),45,IF(AND(RC[-3]<RC[-1],RC[-3]>=13,RC[-3]<14),40,IF(AND(RC[-3]<RC[-1],RC[-3]>=14,RC[-3]<15),35,IF(AND(RC[-3]<RC[-1],RC[-3]>=15,RC[-3]<16),30,IF(AND(RC[-3]<RC[-1],RC[-3]>=16,RC[-3]<17),25,IF(AND(RC[-3]<RC[-1],RC[-3]>=17,RC[-3]<18),20,IF(AND(RC[-3]<RC[-1],RC[-3]>=18,RC[-3]<19),15,IF(AND(RC[-3]<RC[-1],RC[-3]>=19,RC[-3]<20),10,IF(AND(RC[-3]<RC[-1],RC[-3]>=20,RC[-3]<21),5,IF(AND(RC[-3]<RC[-1],RC[-3]>=21),0,IF(AND(RC[-3]>RC[-1],RC[-3]>=2,RC[-3]<3),90,IF(AND(RC[-3]>RC[-1],RC[-3]>=3,RC[-3]<4),90,IF(AND(RC[-3]>RC[-1],RC[-3]>=4,RC[-3]<5),80,IF(AND(RC[-3]>RC[-1],RC[-3]>=5,RC[-3]<6),70,IF(AND(RC[-3]>RC[-1],RC[-3]>=6,RC[-3]<7),60,IF(AND(RC[-3]>RC[-1],RC[-3]>=7,RC[-3]<8),50,IF(AND(RC[-3]>RC[-1],RC[-3]>=8,RC[-3]<9),40,IF(AND(RC[-3]>RC[-1],RC[-3]>=9,RC[-3]<10),30,IF(AND(RC[-3]>RC[-1],RC[-3]>=10,RC[-3]<11),20,IF(AND(RC[-3]>RC[-1],RC[-3]>=11,RC[-3]<12),10,IF(AND(RC[-3]>RC[-1],RC[-3]>=12),0))))))))))))))))))))))))))))))))) -> 95 | H307: =IF(RC[-3]="","",IF(RC[-3]<0.3,100,IF(AND(RC[-3]>=0.3,RC[-3]>0.4),95,IF(AND(RC[-3]>=0.4,RC[-3]<0.5),90,IF(AND(RC[-3]>=0.5,RC[-3]<0.6),85,IF(AND(RC[-3]>=0.6,RC[-3]<0.7),80,IF(AND(RC[-3]>=0.6,RC[-3]<1),80,IF(AND(RC[-3]>1,RC[-3]<2),50,IF(RC[-3]>2,0))))))))) -> 95 | I307: =IF(RC[-1]="",RC[-2],0.7*RC[-1]+0.3*RC[-2]) -> 95
A308: سر. افتخار سهام | B308: وفتخار | C308: =VLOOKUP(RC[-1],Sheet1!R3C2:R802C3,2,FALSE) -> سرمایه گذاریها | D308: =VLOOKUP(RC[-2],Sheet1!R3C2:R802C9,8,FALSE) -> 5.64804739507544 | E308: =IF(VLOOKUP(RC[-3],Sheet1!R3C2:R803C11,10,FALSE)=0,"",VLOOKUP(Sheet2!RC[-3],Sheet1!R[1]C[-3]:R[801]C[6],10,FALSE)) -> 5.6 | F308: =Sheet1!R375C10 -> 11.524146113687122 | G308: =IF(RC[-3]<0,0,IF(AND(RC[-3]<RC[-1],RC[-3]<2),100,IF(AND(RC[-3]<RC[-1],RC[-3]>=2,RC[-3]<3),95,IF(AND(RC[-3]<RC[-1],RC[-3]>=3,RC[-3]<4),90,IF(AND(RC[-3]<RC[-1],RC[-3]>=4,RC[-3]<5),85,IF(AND(RC[-3]<RC[-1],RC[-3]>=5,RC[-3]<6),80,IF(AND(RC[-3]<RC[-1],RC[-3]>=6,RC[-3]<7),75,IF(AND(RC[-3]<RC[-1],RC[-3]>=7,RC[-3]<8),70,IF(AND(RC[-3]<RC[-1],RC[-3]>=8,RC[-3]<9),65,IF(AND(RC[-3]<RC[-1],RC[-3]>=9,RC[-3]<10),60,IF(AND(RC[-3]<RC[-1],RC[-3]>=10,RC[-3]<11),55,IF(AND(RC[-3]<RC[-1],RC[-3]>=11,RC[-3]<12),50,IF(AND(RC[-3]<RC[-1],RC[-3]>=12,RC[-3]<13),45,IF(AND(RC[-3]<RC[-1],RC[-3]>=13,RC[-3]<14),40,IF(AND(RC[-3]<RC[-1],RC[-3]>=14,RC[-3]<15),35,IF(AND(RC[-3]<RC[-1],RC[-3]>=15,RC[-3]<16),30,IF(AND(RC[-3]<RC[-1],RC[-3]>=16,RC[-3]<17),25,IF(AND(RC[-3]<RC[-1],RC[-3]>=17,RC[-3]<18),20,IF(AND(RC[-3]<RC[-1],RC[-3]>=18,RC[-3]<19),15,IF(AND(RC[-3]<RC[-1],RC[-3]>=19,RC[-3]<20),10,IF(AND(RC[-3]<RC[-1],RC[-3]>=20,RC[-3]<21),5,IF(AND(RC[-3]<RC[-1],RC[-3]>=21),0,IF(AND(RC[-3]>RC[-1],RC[-3]>=2,RC[-3]<3),90,IF(AND(RC[-3]>RC[-1],RC[-3]>=3,RC[-3]<4),90,IF(AND(RC[-3]>RC[-1],RC[-3]>=4,RC[-3]<5),80,IF(AND(RC[-3]>RC[-1],RC[-3]>=5,RC[-3]<6),70,IF(AND(RC[-3]>RC[-1],RC[-3]>=6,RC[-3]<7),60,IF(AND(RC[-3]>RC[-1],RC[-3]>=7,RC[-3]<8),50,IF(AND(RC[-3]>RC[-1],RC[-3]>=8,RC[-3]<9),40,IF(AND(RC[-3]>RC[-1],RC[-3]>=9,RC[-3]<10),30,IF(AND(RC[-3]>RC[-1],RC[-3]>=10,RC[-3]<11),20,IF(AND(RC[-3]>RC[-1],RC[-3]>=11,RC[-3]<12),10,IF(AND(RC[-3]>RC[-1],RC[-3]>=12),0))))))))))))))))))))))))))))))))) -> 80 | H308: =IF(RC[-3]="","",IF(RC[-3]<0.3,100,IF(AND(RC[-3]>=0.3,RC[-3]>0.4),95,IF(AND(RC[-3]>=0.4,RC[-3]<0.5),90,IF(AND(RC[-3]>=0.5,RC[-3]<0.6),85,IF(AND(RC[-3]>=0.6,RC[-3]<0.7),80,IF(AND(RC[-3]>=0.6,RC[-3]<1),80,IF(AND(RC[-3]>1,RC[-3]<2),50,IF(RC[-3]>2,0))))))))) -> 95 | I308: =IF(RC[-1]="",RC[-2],0.7*RC[-1]+0.3*RC[-2]) -> 90.5
A309: سر. اقتصاد شهر طوبی | B309: وطوبی | C309: =VLOOKUP(RC[-1],Sheet1!R3C2:R802C3,2,FALSE) -> سرمایه گذاریها | D309: =VLOOKUP(RC[-2],Sheet1!R3C2:R802C9,8,FALSE) -> 3.314484595085939 | E309: =IF(VLOOKUP(RC[-3],Sheet1!R3C2:R803C11,10,FALSE)=0,"",VLOOKUP(Sheet2!RC[-3],Sheet1!R[1]C[-3]:R[801]C[6],10,FALSE)) -> 1.1000000000000001 | F309: =Sheet1!R375C10 -> 11.524146113687122 | G309: =IF(RC[-3]<0,0,IF(AND(RC[-3]<RC[-1],RC[-3]<2),100,IF(AND(RC[-3]<RC[-1],RC[-3]>=2,RC[-3]<3),95,IF(AND(RC[-3]<RC[-1],RC[-3]>=3,RC[-3]<4),90,IF(AND(RC[-3]<RC[-1],RC[-3]>=4,RC[-3]<5),85,IF(AND(RC[-3]<RC[-1],RC[-3]>=5,RC[-3]<6),80,IF(AND(RC[-3]<RC[-1],RC[-3]>=6,RC[-3]<7),75,IF(AND(RC[-3]<RC[-1],RC[-3]>=7,RC[-3]<8),70,IF(AND(RC[-3]<RC[-1],RC[-3]>=8,RC[-3]<9),65,IF(AND(RC[-3]<RC[-1],RC[-3]>=9,RC[-3]<10),60,IF(AND(RC[-3]<RC[-1],RC[-3]>=10,RC[-3]<11),55,IF(AND(RC[-3]<RC[-1],RC[-3]>=11,RC[-3]<12),50,IF(AND(RC[-3]<RC[-1],RC[-3]>=12,RC[-3]<13),45,IF(AND(RC[-3]<RC[-1],RC[-3]>=13,RC[-3]<14),40,IF(AND(RC[-3]<RC[-1],RC[-3]>=14,RC[-3]<15),35,IF(AND(RC[-3]<RC[-1],RC[-3]>=15,RC[-3]<16),30,IF(AND(RC[-3]<RC[-1],RC[-3]>=16,RC[-3]<17),25,IF(AND(RC[-3]<RC[-1],RC[-3]>=17,RC[-3]<18),20,IF(AND(RC[-3]<RC[-1],RC[-3]>=18,RC[-3]<19),15,IF(AND(RC[-3]<RC[-1],RC[-3]>=19,RC[-3]<20),10,IF(AND(RC[-3]<RC[-1],RC[-3]>=20,RC[-3]<21),5,IF(AND(RC[-3]<RC[-1],RC[-3]>=21),0,IF(AND(RC[-3]>RC[-1],RC[-3]>=2,RC[-3]<3),90,IF(AND(RC[-3]>RC[-1],RC[-3]>=3,RC[-3]<4),90,IF(AND(RC[-3]>RC[-1],RC[-3]>=4,RC[-3]<5),80,IF(AND(RC[-3]>RC[-1],RC[-3]>=5,RC[-3]<6),70,IF(AND(RC[-3]>RC[-1],RC[-3]>=6,RC[-3]<7),60,IF(AND(RC[-3]>RC[-1],RC[-3]>=7,RC[-3]<8),50,IF(AND(RC[-3]>RC[-1],RC[-3]>=8,RC[-3]<9),40,IF(AND(RC[-3]>RC[-1],RC[-3]>=9,RC[-3]<10),30,IF(AND(RC[-3]>RC[-1],RC[-3]>=10,RC[-3]<11),20,IF(AND(RC[-3]>RC[-1],RC[-3]>=11,RC[-3]<12),10,IF(AND(RC[-3]>RC[-1],RC[-3]>=12),0))))))))))))))))))))))))))))))))) -> 90 | H309: =IF(RC[-3]="","",IF(RC[-3]<0.3,100,IF(AND(RC[-3]>=0.3,RC[-3]>0.4),95,IF(AND(RC[-3]>=0.4,RC[-3]<0.5),90,IF(AND(RC[-3]>=0.5,RC[-3]<0.6),85,IF(AND(RC[-3]>=0.6,RC[-3]<0.7),80,IF(AND(RC[-3]>=0.6,RC[-3]<1),80,IF(AND(RC[-3]>1,RC[-3]<2),50,IF(RC[-3]>2,0))))))))) -> 95 | I309: =IF(RC[-1]="",RC[-2],0.7*RC[-1]+0.3*RC[-2]) -> 93.5
A310: سر. اقتصاد نوین | B310: سنوین | C310: =VLOOKUP(RC[-1],Sheet1!R3C2:R802C3,2,FALSE) -> سرمایه گذاریها | D310: =VLOOKUP(RC[-2],Sheet1!R3C2:R802C9,8,FALSE) -> 4.6375733740575091 | E310: =IF(VLOOKUP(RC[-3],Sheet1!R3C2:R803C11,10,FALSE)=0,"",VLOOKUP(Sheet2!RC[-3],Sheet1!R[1]C[-3]:R[801]C[6],10,FALSE)) -> 2.8 | F310: =Sheet1!R375C10 -> 11.524146113687122 | G310: =IF(RC[-3]<0,0,IF(AND(RC[-3]<RC[-1],RC[-3]<2),100,IF(AND(RC[-3]<RC[-1],RC[-3]>=2,RC[-3]<3),95,IF(AND(RC[-3]<RC[-1],RC[-3]>=3,RC[-3]<4),90,IF(AND(RC[-3]<RC[-1],RC[-3]>=4,RC[-3]<5),85,IF(AND(RC[-3]<RC[-1],RC[-3]>=5,RC[-3]<6),80,IF(AND(RC[-3]<RC[-1],RC[-3]>=6,RC[-3]<7),75,IF(AND(RC[-3]<RC[-1],RC[-3]>=7,RC[-3]<8),70,IF(AND(RC[-3]<RC[-1],RC[-3]>=8,RC[-3]<9),65,IF(AND(RC[-3]<RC[-1],RC[-3]>=9,RC[-3]<10),60,IF(AND(RC[-3]<RC[-1],RC[-3]>=10,RC[-3]<11),55,IF(AND(RC[-3]<RC[-1],RC[-3]>=11,RC[-3]<12),50,IF(AND(RC[-3]<RC[-1],RC[-3]>=12,RC[-3]<13),45,IF(AND(RC[-3]<RC[-1],RC[-3]>=13,RC[-3]<14),40,IF(AND(RC[-3]<RC[-1],RC[-3]>=14,RC[-3]<15),35,IF(AND(RC[-3]<RC[-1],RC[-3]>=15,RC[-3]<16),30,IF(AND(RC[-3]<RC[-1],RC[-3]>=16,RC[-3]<17),25,IF(AND(RC[-3]<RC[-1],RC[-3]>=17,RC[-3]<18),20,IF(AND(RC[-3]<RC[-1],RC[-3]>=18,RC[-3]<19),15,IF(AND(RC[-3]<RC[-1],RC[-3]>=19,RC[-3]<20),10,IF(AND(RC[-3]<RC[-1],RC[-3]>=20,RC[-3]<21),5,IF(AND(RC[-3]<RC[-1],RC[-3]>=21),0,IF(AND(RC[-3]>RC[-1],RC[-3]>=2,RC[-3]<3),90,IF(AND(RC[-3]>RC[-1],RC[-3]>=3,RC[-3]<4),90,IF(AND(RC[-3]>RC[-1],RC[-3]>=4,RC[-3]<5),80,IF(AND(RC[-3]>RC[-1],RC[-3]>=5,RC[-3]<6),70,IF(AND(RC[-3]>RC[-1],RC[-3]>=6,RC[-3]<7),60,IF(AND(RC[-3]>RC[-1],RC[-3]>=7,RC[-3]<8),50,IF(AND(RC[-3]>RC[-1],RC[-3]>=8,RC[-3]<9),40,IF(AND(RC[-3]>RC[-1],RC[-3]>=9,RC[-3]<10),30,IF(AND(RC[-3]>RC[-1],RC[-3]>=10,RC[-3]<11),20,IF(AND(RC[-3]>RC[-1],RC[-3]>=11,RC[-3]<12),10,IF(AND(RC[-3]>RC[-1],RC[-3]>=12),0))))))))))))))))))))))))))))))))) -> 85 | H310: =IF(RC[-3]="","",IF(RC[-3]<0.3,100,IF(AND(RC[-3]>=0.3,RC[-3]>0.4),95,IF(AND(RC[-3]>=0.4,RC[-3]<0.5),90,IF(AND(RC[-3]>=0.5,RC[-3]<0.6),85,IF(AND(RC[-3]>=0.6,RC[-3]<0.7),80,IF(AND(RC[-3]>=0.6,RC[-3]<1),80,IF(AND(RC[-3]>1,RC[-3]<2),50,IF(RC[-3]>2,0))))))))) -> 95 | I310: =IF(RC[-1]="",RC[-2],0.7*RC[-1]+0.3*RC[-2]) -> 92
A311: سر. بهمن | B311: وبهمن | C311: =VLOOKUP(RC[-1],Sheet1!R3C2:R802C3,2,FALSE) -> سرمایه گذاریها | D311: =VLOOKUP(RC[-2],Sheet1!R3C2:R802C9,8,FALSE) -> 2.6455152035179923 | E311: =IF(VLOOKUP(RC[-3],Sheet1!R3C2:R803C11,10,FALSE)=0,"",VLOOKUP(Sheet2!RC[-3],Sheet1!R[1]C[-3]:R[801]C[6],10,FALSE)) -> 0.7 | F311: =Sheet1!R375C10 -> 11.524146113687122 | G311: =IF(RC[-3]<0,0,IF(AND(RC[-3]<RC[-1],RC[-3]<2),100,IF(AND(RC[-3]<RC[-1],RC[-3]>=2,RC[-3]<3),95,IF(AND(RC[-3]<RC[-1],RC[-3]>=3,RC[-3]<4),90,IF(AND(RC[-3]<RC[-1],RC[-3]>=4,RC[-3]<5),85,IF(AND(RC[-3]<RC[-1],RC[-3]>=5,RC[-3]<6),80,IF(AND(RC[-3]<RC[-1],RC[-3]>=6,RC[-3]<7),75,IF(AND(RC[-3]<RC[-1],RC[-3]>=7,RC[-3]<8),70,IF(AND(RC[-3]<RC[-1],RC[-3]>=8,RC[-3]<9),65,IF(AND(RC[-3]<RC[-1],RC[-3]>=9,RC[-3]<10),60,IF(AND(RC[-3]<RC[-1],RC[-3]>=10,RC[-3]<11),55,IF(AND(RC[-3]<RC[-1],RC[-3]>=11,RC[-3]<12),50,IF(AND(RC[-3]<RC[-1],RC[-3]>=12,RC[-3]<13),45,IF(AND(RC[-3]<RC[-1],RC[-3]>=13,RC[-3]<14),40,IF(AND(RC[-3]<RC[-1],RC[-3]>=14,RC[-3]<15),35,IF(AND(RC[-3]<RC[-1],RC[-3]>=15,RC[-3]<16),30,IF(AND(RC[-3]<RC[-1],RC[-3]>=16,RC[-3]<17),25,IF(AND(RC[-3]<RC[-1],RC[-3]>=17,RC[-3]<18),20,IF(AND(RC[-3]<RC[-1],RC[-3]>=18,RC[-3]<19),15,IF(AND(RC[-3]<RC[-1],RC[-3]>=19,RC[-3]<20),10,IF(AND(RC[-3]<RC[-1],RC[-3]>=20,RC[-3]<21),5,IF(AND(RC[-3]<RC[-1],RC[-3]>=21),0,IF(AND(RC[-3]>RC[-1],RC[-3]>=2,RC[-3]<3),90,IF(AND(RC[-3]>RC[-1],RC[-3]>=3,RC[-3]<4),90,IF(AND(RC[-3]>RC[-1],RC[-3]>=4,RC[-3]<5),80,IF(AND(RC[-3]>RC[-1],RC[-3]>=5,RC[-3]<6),70,IF(AND(RC[-3]>RC[-1],RC[-3]>=6,RC[-3]<7),60,IF(AND(RC[-3]>RC[-1],RC[-3]>=7,RC[-3]<8),50,IF(AND(RC[-3]>RC[-1],RC[-3]>=8,RC[-3]<9),40,IF(AND(RC[-3]>RC[-1],RC[-3]>=9,RC[-3]<10),30,IF(AND(RC[-3]>RC[-1],RC[-3]>=10,RC[-3]<11),20,IF(AND(RC[-3]>RC[-1],RC[-3]>=11,RC[-3]<12),10,IF(AND(RC[-3]>RC[-1],RC[-3]>=12),0))))))))))))))))))))))))))))))))) -> 95 | H311: =IF(RC[-3]="","",IF(RC[-3]<0.3,100,IF(AND(RC[-3]>=0.3,RC[-3]>0.4),95,IF(AND(RC[-3]>=0.4,RC[-3]<0.5),90,IF(AND(RC[-3]>=0.5,RC[-3]<0.6),85,IF(AND(RC[-3]>=0.6,RC[-3]<0.7),80,IF(AND(RC[-3]>=0.6,RC[-3]<1),80,IF(AND(RC[-3]>1,RC[-3]<2),50,IF(RC[-3]>2,0))))))))) -> 95 | I311: =IF(RC[-1]="",RC[-2],0.7*RC[-1]+0.3*RC[-2]) -> 95
A312: سر. بوعلی | B312: وبوعلی | C312: =VLOOKUP(RC[-1],Sheet1!R3C2:R802C3,2,FALSE) -> سرمایه گذاریها | D312: =VLOOKUP(RC[-2],Sheet1!R3C2:R802C9,8,FALSE) -> 1.6390762946830224 | E312: =IF(VLOOKUP(RC[-3],Sheet1!R3C2:R803C11,10,FALSE)=0,"",VLOOKUP(Sheet2!RC[-3],Sheet1!R[1]C[-3]:R[801]C[6],10,FALSE)) -> 0.8 | F312: =Sheet1!R375C10 -> 11.524146113687122 | G312: =IF(RC[-3]<0,0,IF(AND(RC[-3]<RC[-1],RC[-3]<2),100,IF(AND(RC[-3]<RC[-1],RC[-3]>=2,RC[-3]<3),95,IF(AND(RC[-3]<RC[-1],RC[-3]>=3,RC[-3]<4),90,IF(AND(RC[-3]<RC[-1],RC[-3]>=4,RC[-3]<5),85,IF(AND(RC[-3]<RC[-1],RC[-3]>=5,RC[-3]<6),80,IF(AND(RC[-3]<RC[-1],RC[-3]>=6,RC[-3]<7),75,IF(AND(RC[-3]<RC[-1],RC[-3]>=7,RC[-3]<8),70,IF(AND(RC[-3]<RC[-1],RC[-3]>=8,RC[-3]<9),65,IF(AND(RC[-3]<RC[-1],RC[-3]>=9,RC[-3]<10),60,IF(AND(RC[-3]<RC[-1],RC[-3]>=10,RC[-3]<11),55,IF(AND(RC[-3]<RC[-1],RC[-3]>=11,RC[-3]<12),50,IF(AND(RC[-3]<RC[-1],RC[-3]>=12,RC[-3]<13),45,IF(AND(RC[-3]<RC[-1],RC[-3]>=13,RC[-3]<14),40,IF(AND(RC[-3]<RC[-1],RC[-3]>=14,RC[-3]<15),35,IF(AND(RC[-3]<RC[-1],RC[-3]>=15,RC[-3]<16),30,IF(AND(RC[-3]<RC[-1],RC[-3]>=16,RC[-3]<17),25,IF(AND(RC[-3]<RC[-1],RC[-3]>=17,RC[-3]<18),20,IF(AND(RC[-3]<RC[-1],RC[-3]>=18,RC[-3]<19),15,IF(AND(RC[-3]<RC[-1],RC[-3]>=19,RC[-3]<20),10,IF(AND(RC[-3]<RC[-1],RC[-3]>=20,RC[-3]<21),5,IF(AND(RC[-3]<RC[-1],RC[-3]>=21),0,IF(AND(RC[-3]>RC[-1],RC[-3]>=2,RC[-3]<3),90,IF(AND(RC[-3]>RC[-1],RC[-3]>=3,RC[-3]<4),90,IF(AND(RC[-3]>RC[-1],RC[-3]>=4,RC[-3]<5),80,IF(AND(RC[-3]>RC[-1],RC[-3]>=5,RC[-3]<6),70,IF(AND(RC[-3]>RC[-1],RC[-3]>=6,RC[-3]<7),60,IF(AND(RC[-3]>RC[-1],RC[-3]>=7,RC[-3]<8),50,IF(AND(RC[-3]>RC[-1],RC[-3]>=8,RC[-3]<9),40,IF(AND(RC[-3]>RC[-1],RC[-3]>=9,RC[-3]<10),30,IF(AND(RC[-3]>RC[-1],RC[-3]>=10,RC[-3]<11),20,IF(AND(RC[-3]>RC[-1],RC[-3]>=11,RC[-3]<12),10,IF(AND(RC[-3]>RC[-1],RC[-3]>=12),0))))))))))))))))))))))))))))))))) -> 100 | H312: =IF(RC[-3]="","",IF(RC[-3]<0.3,100,IF(AND(RC[-3]>=0.3,RC[-3]>0.4),95,IF(AND(RC[-3]>=0.4,RC[-3]<0.5),90,IF(AND(RC[-3]>=0.5,RC[-3]<0.6),85,IF(AND(RC[-3]>=0.6,RC[-3]<0.7),80,IF(AND(RC[-3]>=0.6,RC[-3]<1),80,IF(AND(RC[-3]>1,RC[-3]<2),50,IF(RC[-3]>2,0))))))))) -> 95 | I312: =IF(RC[-1]="",RC[-2],0.7*RC[-1]+0.3*RC[-2]) -> 96.5
A313: سر. پارس آریان | B313: آریان | C313: =VLOOKUP(RC[-1],Sheet1!R3C2:R802C3,2,FALSE) -> سرمایه گذاریها | D313: =VLOOKUP(RC[-2],Sheet1!R3C2:R802C9,8,FALSE) -> 3.8665276161366164 | E313: =IF(VLOOKUP(RC[-3],Sheet1!R3C2:R803C11,10,FALSE)=0,"",VLOOKUP(Sheet2!RC[-3],Sheet1!R[1]C[-3]:R[801]C[6],10,FALSE)) -> 0.8 | F313: =Sheet1!R375C10 -> 11.524146113687122 | G313: =IF(RC[-3]<0,0,IF(AND(RC[-3]<RC[-1],RC[-3]<2),100,IF(AND(RC[-3]<RC[-1],RC[-3]>=2,RC[-3]<3),95,IF(AND(RC[-3]<RC[-1],RC[-3]>=3,RC[-3]<4),90,IF(AND(RC[-3]<RC[-1],RC[-3]>=4,RC[-3]<5),85,IF(AND(RC[-3]<RC[-1],RC[-3]>=5,RC[-3]<6),80,IF(AND(RC[-3]<RC[-1],RC[-3]>=6,RC[-3]<7),75,IF(AND(RC[-3]<RC[-1],RC[-3]>=7,RC[-3]<8),70,IF(AND(RC[-3]<RC[-1],RC[-3]>=8,RC[-3]<9),65,IF(AND(RC[-3]<RC[-1],RC[-3]>=9,RC[-3]<10),60,IF(AND(RC[-3]<RC[-1],RC[-3]>=10,RC[-3]<11),55,IF(AND(RC[-3]<RC[-1],RC[-3]>=11,RC[-3]<12),50,IF(AND(RC[-3]<RC[-1],RC[-3]>=12,RC[-3]<13),45,IF(AND(RC[-3]<RC[-1],RC[-3]>=13,RC[-3]<14),40,IF(AND(RC[-3]<RC[-1],RC[-3]>=14,RC[-3]<15),35,IF(AND(RC[-3]<RC[-1],RC[-3]>=15,RC[-3]<16),30,IF(AND(RC[-3]<RC[-1],RC[-3]>=16,RC[-3]<17),25,IF(AND(RC[-3]<RC[-1],RC[-3]>=17,RC[-3]<18),20,IF(AND(RC[-3]<RC[-1],RC[-3]>=18,RC[-3]<19),15,IF(AND(RC[-3]<RC[-1],RC[-3]>=19,RC[-3]<20),10,IF(AND(RC[-3]<RC[-1],RC[-3]>=20,RC[-3]<21),5,IF(AND(RC[-3]<RC[-1],RC[-3]>=21),0,IF(AND(RC[-3]>RC[-1],RC[-3]>=2,RC[-3]<3),90,IF(AND(RC[-3]>RC[-1],RC[-3]>=3,RC[-3]<4),90,IF(AND(RC[-3]>RC[-1],RC[-3]>=4,RC[-3]<5),80,IF(AND(RC[-3]>RC[-1],RC[-3]>=5,RC[-3]<6),70,IF(AND(RC[-3]>RC[-1],RC[-3]>=6,RC[-3]<7),60,IF(AND(RC[-3]>RC[-1],RC[-3]>=7,RC[-3]<8),50,IF(AND(RC[-3]>RC[-1],RC[-3]>=8,RC[-3]<9),40,IF(AND(RC[-3]>RC[-1],RC[-3]>=9,RC[-3]<10),30,IF(AND(RC[-3]>RC[-1],RC[-3]>=10,RC[-3]<11),20,IF(AND(RC[-3]>RC[-1],RC[-3]>=11,RC[-3]<12),10,IF(AND(RC[-3]>RC[-1],RC[-3]>=12),0))))))))))))))))))))))))))))))))) -> 90 | H313: =IF(RC[-3]="","",IF(RC[-3]<0.3,100,IF(AND(RC[-3]>=0.3,RC[-3]>0.4),95,IF(AND(RC[-3]>=0.4,RC[-3]<0.5),90,IF(AND(RC[-3]>=0.5,RC[-3]<0.6),85,IF(AND(RC[-3]>=0.6,RC[-3]<0.7),80,IF(AND(RC[-3]>=0.6,RC[-3]<1),80,IF(AND(RC[-3]>1,RC[-3]<2),50,IF(RC[-3]>2,0))))))))) -> 95 | I313: =IF(RC[-1]="",RC[-2],0.7*RC[-1]+0.3*RC[-2]) -> 93.5
A314: سر. پردیس | B314: پردیس | C314: =VLOOKUP(RC[-1],Sheet1!R3C2:R802C3,2,FALSE) -> سرمایه گذاریها | D314: =VLOOKUP(RC[-2],Sheet1!R3C2:R802C9,8,FALSE) -> 1.9812215273340816 | E314: =IF(VLOOKUP(RC[-3],Sheet1!R3C2:R803C11,10,FALSE)=0,"",VLOOKUP(Sheet2!RC[-3],Sheet1!R[1]C[-3]:R[801]C[6],10,FALSE)) -> 1 | F314: =Sheet1!R375C10 -> 11.524146113687122 | G314: =IF(RC[-3]<0,0,IF(AND(RC[-3]<RC[-1],RC[-3]<2),100,IF(AND(RC[-3]<RC[-1],RC[-3]>=2,RC[-3]<3),95,IF(AND(RC[-3]<RC[-1],RC[-3]>=3,RC[-3]<4),90,IF(AND(RC[-3]<RC[-1],RC[-3]>=4,RC[-3]<5),85,IF(AND(RC[-3]<RC[-1],RC[-3]>=5,RC[-3]<6),80,IF(AND(RC[-3]<RC[-1],RC[-3]>=6,RC[-3]<7),75,IF(AND(RC[-3]<RC[-1],RC[-3]>=7,RC[-3]<8),70,IF(AND(RC[-3]<RC[-1],RC[-3]>=8,RC[-3]<9),65,IF(AND(RC[-3]<RC[-1],RC[-3]>=9,RC[-3]<10),60,IF(AND(RC[-3]<RC[-1],RC[-3]>=10,RC[-3]<11),55,IF(AND(RC[-3]<RC[-1],RC[-3]>=11,RC[-3]<12),50,IF(AND(RC[-3]<RC[-1],RC[-3]>=12,RC[-3]<13),45,IF(AND(RC[-3]<RC[-1],RC[-3]>=13,RC[-3]<14),40,IF(AND(RC[-3]<RC[-1],RC[-3]>=14,RC[-3]<15),35,IF(AND(RC[-3]<RC[-1],RC[-3]>=15,RC[-3]<16),30,IF(AND(RC[-3]<RC[-1],RC[-3]>=16,RC[-3]<17),25,IF(AND(RC[-3]<RC[-1],RC[-3]>=17,RC[-3]<18),20,IF(AND(RC[-3]<RC[-1],RC[-3]>=18,RC[-3]<19),15,IF(AND(RC[-3]<RC[-1],RC[-3]>=19,RC[-3]<20),10,IF(AND(RC[-3]<RC[-1],RC[-3]>=20,RC[-3]<21),5,IF(AND(RC[-3]<RC[-1],RC[-3]>=21),0,IF(AND(RC[-3]>RC[-1],RC[-3]>=2,RC[-3]<3),90,IF(AND(RC[-3]>RC[-1],RC[-3]>=3,RC[-3]<4),90,IF(AND(RC[-3]>RC[-1],RC[-3]>=4,RC[-3]<5),80,IF(AND(RC[-3]>RC[-1],RC[-3]>=5,RC[-3]<6),70,IF(AND(RC[-3]>RC[-1],RC[-3]>=6,RC[-3]<7),60,IF(AND(RC[-3]>RC[-1],RC[-3]>=7,RC[-3]<8),50,IF(AND(RC[-3]>RC[-1],RC[-3]>=8,RC[-3]<9),40,IF(AND(RC[-3]>RC[-1],RC[-3]>=9,RC[-3]<10),30,IF(AND(RC[-3]>RC[-1],RC[-3]>=10,RC[-3]<11),20,IF(AND(RC[-3]>RC[-1],RC[-3]>=11,RC[-3]<12),10,IF(AND(RC[-3]>RC[-1],RC[-3]>=12),0))))))))))))))))))))))))))))))))) -> 100 | H314: =IF(RC[-3]="","",IF(RC[-3]<0.3,100,IF(AND(RC[-3]>=0.3,RC[-3]>0.4),95,IF(AND(RC[-3]>=0.4,RC[-3]<0.5),90,IF(AND(RC[-3]>=0.5,RC[-3]<0.6),85,IF(AND(RC[-3]>=0.6,RC[-3]<0.7),80,IF(AND(RC[-3]>=0.6,RC[-3]<1),80,IF(AND(RC[-3]>1,RC[-3]<2),50,IF(RC[-3]>2,0))))))))) -> 95 | I314: =IF(RC[-1]="",RC[-2],0.7*RC[-1]+0.3*RC[-2]) -> 96.5
A315: سر. پویا | B315: وپویا | C315: =VLOOKUP(RC[-1],Sheet1!R3C2:R802C3,2,FALSE) -> سرمایه گذاریها | D315: =VLOOKUP(RC[-2],Sheet1!R3C2:R802C9,8,FALSE) -> 1.8482001597464663 | E315: =IF(VLOOKUP(RC[-3],Sheet1!R3C2:R803C11,10,FALSE)=0,"",VLOOKUP(Sheet2!RC[-3],Sheet1!R[1]C[-3]:R[801]C[6],10,FALSE)) -> 0.6 | F315: =Sheet1!R375C10 -> 11.524146113687122 | G315: =IF(RC[-3]<0,0,IF(AND(RC[-3]<RC[-1],RC[-3]<2),100,IF(AND(RC[-3]<RC[-1],RC[-3]>=2,RC[-3]<3),95,IF(AND(RC[-3]<RC[-1],RC[-3]>=3,RC[-3]<4),90,IF(AND(RC[-3]<RC[-1],RC[-3]>=4,RC[-3]<5),85,IF(AND(RC[-3]<RC[-1],RC[-3]>=5,RC[-3]<6),80,IF(AND(RC[-3]<RC[-1],RC[-3]>=6,RC[-3]<7),75,IF(AND(RC[-3]<RC[-1],RC[-3]>=7,RC[-3]<8),70,IF(AND(RC[-3]<RC[-1],RC[-3]>=8,RC[-3]<9),65,IF(AND(RC[-3]<RC[-1],RC[-3]>=9,RC[-3]<10),60,IF(AND(RC[-3]<RC[-1],RC[-3]>=10,RC[-3]<11),55,IF(AND(RC[-3]<RC[-1],RC[-3]>=11,RC[-3]<12),50,IF(AND(RC[-3]<RC[-1],RC[-3]>=12,RC[-3]<13),45,IF(AND(RC[-3]<RC[-1],RC[-3]>=13,RC[-3]<14),40,IF(AND(RC[-3]<RC[-1],RC[-3]>=14,RC[-3]<15),35,IF(AND(RC[-3]<RC[-1],RC[-3]>=15,RC[-3]<16),30,IF(AND(RC[-3]<RC[-1],RC[-3]>=16,RC[-3]<17),25,IF(AND(RC[-3]<RC[-1],RC[-3]>=17,RC[-3]<18),20,IF(AND(RC[-3]<RC[-1],RC[-3]>=18,RC[-3]<19),15,IF(AND(RC[-3]<RC[-1],RC[-3]>=19,RC[-3]<20),10,IF(AND(RC[-3]<RC[-1],RC[-3]>=20,RC[-3]<21),5,IF(AND(RC[-3]<RC[-1],RC[-3]>=21),0,IF(AND(RC[-3]>RC[-1],RC[-3]>=2,RC[-3]<3),90,IF(AND(RC[-3]>RC[-1],RC[-3]>=3,RC[-3]<4),90,IF(AND(RC[-3]>RC[-1],RC[-3]>=4,RC[-3]<5),80,IF(AND(RC[-3]>RC[-1],RC[-3]>=5,RC[-3]<6),70,IF(AND(RC[-3]>RC[-1],RC[-3]>=6,RC[-3]<7),60,IF(AND(RC[-3]>RC[-1],RC[-3]>=7,RC[-3]<8),50,IF(AND(RC[-3]>RC[-1],RC[-3]>=8,RC[-3]<9),40,IF(AND(RC[-3]>RC[-1],RC[-3]>=9,RC[-3]<10),30,IF(AND(RC[-3]>RC[-1],RC[-3]>=10,RC[-3]<11),20,IF(AND(RC[-3]>RC[-1],RC[-3]>=11,RC[-3]<12),10,IF(AND(RC[-3]>RC[-1],RC[-3]>=12),0))))))))))))))))))))))))))))))))) -> 100 | H315: =IF(RC[-3]="","",IF(RC[-3]<0.3,100,IF(AND(RC[-3]>=0.3,RC[-3]>0.4),95,IF(AND(RC[-3]>=0.4,RC[-3]<0.5),90,IF(AND(RC[-3]>=0.5,RC[-3]<0.6),85,IF(AND(RC[-3]>=0.6,RC[-3]<0.7),80,IF(AND(RC[-3]>=0.6,RC[-3]<1),80,IF(AND(RC[-3]>1,RC[-3]<2),50,IF(RC[-3]>2,0))))))))) -> 95 | I315: =IF(RC[-1]="",RC[-2],0.7*RC[-1]+0.3*RC[-2]) -> 96.5
A316: سر. تدبیرگران فارس و خوزستان | B316: سدبیر | C316: =VLOOKUP(RC[-1],Sheet1!R3C2:R802C3,2,FALSE) -> سرمایه گذاریها | D316: =VLOOKUP(RC[-2],Sheet1!R3C2:R802C9,8,FALSE) -> 136.77086858545806 | E316: =IF(VLOOKUP(RC[-3],Sheet1!R3C2:R803C11,10,FALSE)=0,"",VLOOKUP(Sheet2!RC[-3],Sheet1!R[1]C[-3]:R[801]C[6],10,FALSE)) -> 2.8 | F316: =Sheet1!R375C10 -> 11.524146113687122 | G316: =IF(RC[-3]<0,0,IF(AND(RC[-3]<RC[-1],RC[-3]<2),100,IF(AND(RC[-3]<RC[-1],RC[-3]>=2,RC[-3]<3),95,IF(AND(RC[-3]<RC[-1],RC[-3]>=3,RC[-3]<4),90,IF(AND(RC[-3]<RC[-1],RC[-3]>=4,RC[-3]<5),85,IF(AND(RC[-3]<RC[-1],RC[-3]>=5,RC[-3]<6),80,IF(AND(RC[-3]<RC[-1],RC[-3]>=6,RC[-3]<7),75,IF(AND(RC[-3]<RC[-1],RC[-3]>=7,RC[-3]<8),70,IF(AND(RC[-3]<RC[-1],RC[-3]>=8,RC[-3]<9),65,IF(AND(RC[-3]<RC[-1],RC[-3]>=9,RC[-3]<10),60,IF(AND(RC[-3]<RC[-1],RC[-3]>=10,RC[-3]<11),55,IF(AND(RC[-3]<RC[-1],RC[-3]>=11,RC[-3]<12),50,IF(AND(RC[-3]<RC[-1],RC[-3]>=12,RC[-3]<13),45,IF(AND(RC[-3]<RC[-1],RC[-3]>=13,RC[-3]<14),40,IF(AND(RC[-3]<RC[-1],RC[-3]>=14,RC[-3]<15),35,IF(AND(RC[-3]<RC[-1],RC[-3]>=15,RC[-3]<16),30,IF(AND(RC[-3]<RC[-1],RC[-3]>=16,RC[-3]<17),25,IF(AND(RC[-3]<RC[-1],RC[-3]>=17,RC[-3]<18),20,IF(AND(RC[-3]<RC[-1],RC[-3]>=18,RC[-3]<19),15,IF(AND(RC[-3]<RC[-1],RC[-3]>=19,RC[-3]<20),10,IF(AND(RC[-3]<RC[-1],RC[-3]>=20,RC[-3]<21),5,IF(AND(RC[-3]<RC[-1],RC[-3]>=21),0,IF(AND(RC[-3]>RC[-1],RC[-3]>=2,RC[-3]<3),90,IF(AND(RC[-3]>RC[-1],RC[-3]>=3,RC[-3]<4),90,IF(AND(RC[-3]>RC[-1],RC[-3]>=4,RC[-3]<5),80,IF(AND(RC[-3]>RC[-1],RC[-3]>=5,RC[-3]<6),70,IF(AND(RC[-3]>RC[-1],RC[-3]>=6,RC[-3]<7),60,IF(AND(RC[-3]>RC[-1],RC[-3]>=7,RC[-3]<8),50,IF(AND(RC[-3]>RC[-1],RC[-3]>=8,RC[-3]<9),40,IF(AND(RC[-3]>RC[-1],RC[-3]>=9,RC[-3]<10),30,IF(AND(RC[-3]>RC[-1],RC[-3]>=10,RC[-3]<11),20,IF(AND(RC[-3]>RC[-1],RC[-3]>=11,RC[-3]<12),10,IF(AND(RC[-3]>RC[-1],RC[-3]>=12),0))))))))))))))))))))))))))))))))) -> 0 | H316: =IF(RC[-3]="","",IF(RC[-3]<0.3,100,IF(AND(RC[-3]>=0.3,RC[-3]>0.4),95,IF(AND(RC[-3]>=0.4,RC[-3]<0.5),90,IF(AND(RC[-3]>=0.5,RC[-3]<0.6),85,IF(AND(RC[-3]>=0.6,RC[-3]<0.7),80,IF(AND(RC[-3]>=0.6,RC[-3]<1),80,IF(AND(RC[-3]>1,RC[-3]<2),50,IF(RC[-3]>2,0))))))))) -> 95 | I316: =IF(RC[-1]="",RC[-2],0.7*RC[-1]+0.3*RC[-2]) -> 66.5
A317: سر. توسعه شمال | B317: وشمال | C317: =VLOOKUP(RC[-1],Sheet1!R3C2:R802C3,2,FALSE) -> سرمایه گذاریها | D317: =VLOOKUP(RC[-2],Sheet1!R3C2:R802C9,8,FALSE) -> -52.529069767441861 | E317: =IF(VLOOKUP(RC[-3],Sheet1!R3C2:R803C11,10,FALSE)=0,"",VLOOKUP(Sheet2!RC[-3],Sheet1!R[1]C[-3]:R[801]C[6],10,FALSE)) ->  | F317: =Sheet1!R375C10 -> 11.524146113687122 | G317: =IF(RC[-3]<0,0,IF(AND(RC[-3]<RC[-1],RC[-3]<2),100,IF(AND(RC[-3]<RC[-1],RC[-3]>=2,RC[-3]<3),95,IF(AND(RC[-3]<RC[-1],RC[-3]>=3,RC[-3]<4),90,IF(AND(RC[-3]<RC[-1],RC[-3]>=4,RC[-3]<5),85,IF(AND(RC[-3]<RC[-1],RC[-3]>=5,RC[-3]<6),80,IF(AND(RC[-3]<RC[-1],RC[-3]>=6,RC[-3]<7),75,IF(AND(RC[-3]<RC[-1],RC[-3]>=7,RC[-3]<8),70,IF(AND(RC[-3]<RC[-1],RC[-3]>=8,RC[-3]<9),65,IF(AND(RC[-3]<RC[-1],RC[-3]>=9,RC[-3]<10),60,IF(AND(RC[-3]<RC[-1],RC[-3]>=10,RC[-3]<11),55,IF(AND(RC[-3]<RC[-1],RC[-3]>=11,RC[-3]<12),50,IF(AND(RC[-3]<RC[-1],RC[-3]>=12,RC[-3]<13),45,IF(AND(RC[-3]<RC[-1],RC[-3]>=13,RC[-3]<14),40,IF(AND(RC[-3]<RC[-1],RC[-3]>=14,RC[-3]<15),35,IF(AND(RC[-3]<RC[-1],RC[-3]>=15,RC[-3]<16),30,IF(AND(RC[-3]<RC[-1],RC[-3]>=16,RC[-3]<17),25,IF(AND(RC[-3]<RC[-1],RC[-3]>=17,RC[-3]<18),20,IF(AND(RC[-3]<RC[-1],RC[-3]>=18,RC[-3]<19),15,IF(AND(RC[-3]<RC[-1],RC[-3]>=19,RC[-3]<20),10,IF(AND(RC[-3]<RC[-1],RC[-3]>=20,RC[-3]<21),5,IF(AND(RC[-3]<RC[-1],RC[-3]>=21),0,IF(AND(RC[-3]>RC[-1],RC[-3]>=2,RC[-3]<3),90,IF(AND(RC[-3]>RC[-1],RC[-3]>=3,RC[-3]<4),90,IF(AND(RC[-3]>RC[-1],RC[-3]>=4,RC[-3]<5),80,IF(AND(RC[-3]>RC[-1],RC[-3]>=5,RC[-3]<6),70,IF(AND(RC[-3]>RC[-1],RC[-3]>=6,RC[-3]<7),60,IF(AND(RC[-3]>RC[-1],RC[-3]>=7,RC[-3]<8),50,IF(AND(RC[-3]>RC[-1],RC[-3]>=8,RC[-3]<9),40,IF(AND(RC[-3]>RC[-1],RC[-3]>=9,RC[-3]<10),30,IF(AND(RC[-3]>RC[-1],RC[-3]>=10,RC[-3]<11),20,IF(AND(RC[-3]>RC[-1],RC[-3]>=11,RC[-3]<12),10,IF(AND(RC[-3]>RC[-1],RC[-3]>=12),0))))))))))))))))))))))))))))))))) -> 0 | H317: =IF(RC[-3]="","",IF(RC[-3]<0.3,100,IF(AND(RC[-3]>=0.3,RC[-3]>0.4),95,IF(AND(RC[-3]>=0.4,RC[-3]<0.5),90,IF(AND(RC[-3]>=0.5,RC[-3]<0.6),85,IF(AND(RC[-3]>=0.6,RC[-3]<0.7),80,IF(AND(RC[-3]>=0.6,RC[-3]<1),80,IF(AND(RC[-3]>1,RC[-3]<2),50,IF(RC[-3]>2,0))))))))) ->  | I317: =IF(RC[-1]="",RC[-2],0.7*RC[-1]+0.3*RC[-2]) -> 0
A318: سر. توسعه صنعت و تجارت | B318: وصنعت | C318: =VLOOKUP(RC[-1],Sheet1!R3C2:R802C3,2,FALSE) -> سرمایه گذاریها | D318: =VLOOKUP(RC[-2],Sheet1!R3C2:R802C9,8,FALSE) -> 2.666152165865741 | E318: =IF(VLOOKUP(RC[-3],Sheet1!R3C2:R803C11,10,FALSE)=0,"",VLOOKUP(Sheet2!RC[-3],Sheet1!R[1]C[-3]:R[801]C[6],10,FALSE)) -> 0.84 | F318: =Sheet1!R375C10 -> 11.524146113687122 | G318: =IF(RC[-3]<0,0,IF(AND(RC[-3]<RC[-1],RC[-3]<2),100,IF(AND(RC[-3]<RC[-1],RC[-3]>=2,RC[-3]<3),95,IF(AND(RC[-3]<RC[-1],RC[-3]>=3,RC[-3]<4),90,IF(AND(RC[-3]<RC[-1],RC[-3]>=4,RC[-3]<5),85,IF(AND(RC[-3]<RC[-1],RC[-3]>=5,RC[-3]<6),80,IF(AND(RC[-3]<RC[-1],RC[-3]>=6,RC[-3]<7),75,IF(AND(RC[-3]<RC[-1],RC[-3]>=7,RC[-3]<8),70,IF(AND(RC[-3]<RC[-1],RC[-3]>=8,RC[-3]<9),65,IF(AND(RC[-3]<RC[-1],RC[-3]>=9,RC[-3]<10),60,IF(AND(RC[-3]<RC[-1],RC[-3]>=10,RC[-3]<11),55,IF(AND(RC[-3]<RC[-1],RC[-3]>=11,RC[-3]<12),50,IF(AND(RC[-3]<RC[-1],RC[-3]>=12,RC[-3]<13),45,IF(AND(RC[-3]<RC[-1],RC[-3]>=13,RC[-3]<14),40,IF(AND(RC[-3]<RC[-1],RC[-3]>=14,RC[-3]<15),35,IF(AND(RC[-3]<RC[-1],RC[-3]>=15,RC[-3]<16),30,IF(AND(RC[-3]<RC[-1],RC[-3]>=16,RC[-3]<17),25,IF(AND(RC[-3]<RC[-1],RC[-3]>=17,RC[-3]<18),20,IF(AND(RC[-3]<RC[-1],RC[-3]>=18,RC[-3]<19),15,IF(AND(RC[-3]<RC[-1],RC[-3]>=19,RC[-3]<20),10,IF(AND(RC[-3]<RC[-1],RC[-3]>=20,RC[-3]<21),5,IF(AND(RC[-3]<RC[-1],RC[-3]>=21),0,IF(AND(RC[-3]>RC[-1],RC[-3]>=2,RC[-3]<3),90,IF(AND(RC[-3]>RC[-1],RC[-3]>=3,RC[-3]<4),90,IF(AND(RC[-3]>RC[-1],RC[-3]>=4,RC[-3]<5),80,IF(AND(RC[-3]>RC[-1],RC[-3]>=5,RC[-3]<6),70,IF(AND(RC[-3]>RC[-1],RC[-3]>=6,RC[-3]<7),60,IF(AND(RC[-3]>RC[-1],RC[-3]>=7,RC[-3]<8),50,IF(AND(RC[-3]>RC[-1],RC[-3]>=8,RC[-3]<9),40,IF(AND(RC[-3]>RC[-1],RC[-3]>=9,RC[-3]<10),30,IF(AND(RC[-3]>RC[-1],RC[-3]>=10,RC[-3]<11),20,IF(AND(RC[-3]>RC[-1],RC[-3]>=11,RC[-3]<12),10,IF(AND(RC[-3]>RC[-1],RC[-3]>=12),0))))))))))))))))))))))))))))))))) -> 95 | H318: =IF(RC[-3]="","",IF(RC[-3]<0.3,100,IF(AND(RC[-3]>=0.3,RC[-3]>0.4),95,IF(AND(RC[-3]>=0.4,RC[-3]<0.5),90,IF(AND(RC[-3]>=0.5,RC[-3]<0.6),85,IF(AND(RC[-3]>=0.6,RC[-3]<0.7),80,IF(AND(RC[-3]>=0.6,RC[-3]<1),80,IF(AND(RC[-3]>1,RC[-3]<2),50,IF(RC[-3]>2,0))))))))) -> 95 | I318: =IF(RC[-1]="",RC[-2],0.7*RC[-1]+0.3*RC[-2]) -> 95
A319: سر. توسعه صنعتی ایران | B319: وتوصا | C319: =VLOOKUP(RC[-1],Sheet1!R3C2:R802C3,2,FALSE) -> سرمایه گذاریها | D319: =VLOOKUP(RC[-2],Sheet1!R3C2:R802C9,8,FALSE) -> 5.248713529024017 | E319: =IF(VLOOKUP(RC[-3],Sheet1!R3C2:R803C11,10,FALSE)=0,"",VLOOKUP(Sheet2!RC[-3],Sheet1!R[1]C[-3]:R[801]C[6],10,FALSE)) -> 1.5 | F319: =Sheet1!R375C10 -> 11.524146113687122 | G319: =IF(RC[-3]<0,0,IF(AND(RC[-3]<RC[-1],RC[-3]<2),100,IF(AND(RC[-3]<RC[-1],RC[-3]>=2,RC[-3]<3),95,IF(AND(RC[-3]<RC[-1],RC[-3]>=3,RC[-3]<4),90,IF(AND(RC[-3]<RC[-1],RC[-3]>=4,RC[-3]<5),85,IF(AND(RC[-3]<RC[-1],RC[-3]>=5,RC[-3]<6),80,IF(AND(RC[-3]<RC[-1],RC[-3]>=6,RC[-3]<7),75,IF(AND(RC[-3]<RC[-1],RC[-3]>=7,RC[-3]<8),70,IF(AND(RC[-3]<RC[-1],RC[-3]>=8,RC[-3]<9),65,IF(AND(RC[-3]<RC[-1],RC[-3]>=9,RC[-3]<10),60,IF(AND(RC[-3]<RC[-1],RC[-3]>=10,RC[-3]<11),55,IF(AND(RC[-3]<RC[-1],RC[-3]>=11,RC[-3]<12),50,IF(AND(RC[-3]<RC[-1],RC[-3]>=12,RC[-3]<13),45,IF(AND(RC[-3]<RC[-1],RC[-3]>=13,RC[-3]<14),40,IF(AND(RC[-3]<RC[-1],RC[-3]>=14,RC[-3]<15),35,IF(AND(RC[-3]<RC[-1],RC[-3]>=15,RC[-3]<16),30,IF(AND(RC[-3]<RC[-1],RC[-3]>=16,RC[-3]<17),25,IF(AND(RC[-3]<RC[-1],RC[-3]>=17,RC[-3]<18),20,IF(AND(RC[-3]<RC[-1],RC[-3]>=18,RC[-3]<19),15,IF(AND(RC[-3]<RC[-1],RC[-3]>=19,RC[-3]<20),10,IF(AND(RC[-3]<RC[-1],RC[-3]>=20,RC[-3]<21),5,IF(AND(RC[-3]<RC[-1],RC[-3]>=21),0,IF(AND(RC[-3]>RC[-1],RC[-3]>=2,RC[-3]<3),90,IF(AND(RC[-3]>RC[-1],RC[-3]>=3,RC[-3]<4),90,IF(AND(RC[-3]>RC[-1],RC[-3]>=4,RC[-3]<5),80,IF(AND(RC[-3]>RC[-1],RC[-3]>=5,RC[-3]<6),70,IF(AND(RC[-3]>RC[-1],RC[-3]>=6,RC[-3]<7),60,IF(AND(RC[-3]>RC[-1],RC[-3]>=7,RC[-3]<8),50,IF(AND(RC[-3]>RC[-1],RC[-3]>=8,RC[-3]<9),40,IF(AND(RC[-3]>RC[-1],RC[-3]>=9,RC[-3]<10),30,IF(AND(RC[-3]>RC[-1],RC[-3]>=10,RC[-3]<11),20,IF(AND(RC[-3]>RC[-1],RC[-3]>=11,RC[-3]<12),10,IF(AND(RC[-3]>RC[-1],RC[-3]>=12),0))))))))))))))))))))))))))))))))) -> 80 | H319: =IF(RC[-3]="","",IF(RC[-3]<0.3,100,IF(AND(RC[-3]>=0.3,RC[-3]>0.4),95,IF(AND(RC[-3]>=0.4,RC[-3]<0.5),90,IF(AND(RC[-3]>=0.5,RC[-3]<0.6),85,IF(AND(RC[-3]>=0.6,RC[-3]<0.7),80,IF(AND(RC[-3]>=0.6,RC[-3]<1),80,IF(AND(RC[-3]>1,RC[-3]<2),50,IF(RC[-3]>2,0))))))))) -> 95 | I319: =IF(RC[-1]="",RC[-2],0.7*RC[-1]+0.3*RC[-2]) -> 90.5
A320: سر. توسعه گوهران امید | B320: گوهران | C320: =VLOOKUP(RC[-1],Sheet1!R3C2:R802C3,2,FALSE) -> سرمایه گذاریها | D320: =VLOOKUP(RC[-2],Sheet1!R3C2:R802C9,8,FALSE) -> 3.0309335385503569 | E320: =IF(VLOOKUP(RC[-3],Sheet1!R3C2:R803C11,10,FALSE)=0,"",VLOOKUP(Sheet2!RC[-3],Sheet1!R[1]C[-3]:R[801]C[6],10,FALSE)) -> 0.96 | F320: =Sheet1!R375C10 -> 11.524146113687122 | G320: =IF(RC[-3]<0,0,IF(AND(RC[-3]<RC[-1],RC[-3]<2),100,IF(AND(RC[-3]<RC[-1],RC[-3]>=2,RC[-3]<3),95,IF(AND(RC[-3]<RC[-1],RC[-3]>=3,RC[-3]<4),90,IF(AND(RC[-3]<RC[-1],RC[-3]>=4,RC[-3]<5),85,IF(AND(RC[-3]<RC[-1],RC[-3]>=5,RC[-3]<6),80,IF(AND(RC[-3]<RC[-1],RC[-3]>=6,RC[-3]<7),75,IF(AND(RC[-3]<RC[-1],RC[-3]>=7,RC[-3]<8),70,IF(AND(RC[-3]<RC[-1],RC[-3]>=8,RC[-3]<9),65,IF(AND(RC[-3]<RC[-1],RC[-3]>=9,RC[-3]<10),60,IF(AND(RC[-3]<RC[-1],RC[-3]>=10,RC[-3]<11),55,IF(AND(RC[-3]<RC[-1],RC[-3]>=11,RC[-3]<12),50,IF(AND(RC[-3]<RC[-1],RC[-3]>=12,RC[-3]<13),45,IF(AND(RC[-3]<RC[-1],RC[-3]>=13,RC[-3]<14),40,IF(AND(RC[-3]<RC[-1],RC[-3]>=14,RC[-3]<15),35,IF(AND(RC[-3]<RC[-1],RC[-3]>=15,RC[-3]<16),30,IF(AND(RC[-3]<RC[-1],RC[-3]>=16,RC[-3]<17),25,IF(AND(RC[-3]<RC[-1],RC[-3]>=17,RC[-3]<18),20,IF(AND(RC[-3]<RC[-1],RC[-3]>=18,RC[-3]<19),15,IF(AND(RC[-3]<RC[-1],RC[-3]>=19,RC[-3]<20),10,IF(AND(RC[-3]<RC[-1],RC[-3]>=20,RC[-3]<21),5,IF(AND(RC[-3]<RC[-1],RC[-3]>=21),0,IF(AND(RC[-3]>RC[-1],RC[-3]>=2,RC[-3]<3),90,IF(AND(RC[-3]>RC[-1],RC[-3]>=3,RC[-3]<4),90,IF(AND(RC[-3]>RC[-1],RC[-3]>=4,RC[-3]<5),80,IF(AND(RC[-3]>RC[-1],RC[-3]>=5,RC[-3]<6),70,IF(AND(RC[-3]>RC[-1],RC[-3]>=6,RC[-3]<7),60,IF(AND(RC[-3]>RC[-1],RC[-3]>=7,RC[-3]<8),50,IF(AND(RC[-3]>RC[-1],RC[-3]>=8,RC[-3]<9),40,IF(AND(RC[-3]>RC[-1],RC[-3]>=9,RC[-3]<10),30,IF(AND(RC[-3]>RC[-1],RC[-3]>=10,RC[-3]<11),20,IF(AND(RC[-3]>RC[-1],RC[-3]>=11,RC[-3]<12),10,IF(AND(RC[-3]>RC[-1],RC[-3]>=12),0))))))))))))))))))))))))))))))))) -> 90 | H320: =IF(RC[-3]="","",IF(RC[-3]<0.3,100,IF(AND(RC[-3]>=0.3,RC[-3]>0.4),95,IF(AND(RC[-3]>=0.4,RC[-3]<0.5),90,IF(AND(RC[-3]>=0.5,RC[-3]<0.6),85,IF(AND(RC[-3]>=0.6,RC[-3]<0.7),80,IF(AND(RC[-3]>=0.6,RC[-3]<1),80,IF(AND(RC[-3]>1,RC[-3]<2),50,IF(RC[-3]>2,0))))))))) -> 95 | I320: =IF(RC[-1]="",RC[-2],0.7*RC[-1]+0.3*RC[-2]) -> 93.5
A321: سر. توسعه ملی | B321: وتوسم | C321: =VLOOKUP(RC[-1],Sheet1!R3C2:R802C3,2,FALSE) -> سرمایه گذاریها | D321: =VLOOKUP(RC[-2],Sheet1!R3C2:R802C9,8,FALSE) -> 1.9803722032795388 | E321: =IF(VLOOKUP(RC[-3],Sheet1!R3C2:R803C11,10,FALSE)=0,"",VLOOKUP(Sheet2!RC[-3],Sheet1!R[1]C[-3]:R[801]C[6],10,FALSE)) -> 0.75 | F321: =Sheet1!R375C10 -> 11.524146113687122 | G321: =IF(RC[-3]<0,0,IF(AND(RC[-3]<RC[-1],RC[-3]<2),100,IF(AND(RC[-3]<RC[-1],RC[-3]>=2,RC[-3]<3),95,IF(AND(RC[-3]<RC[-1],RC[-3]>=3,RC[-3]<4),90,IF(AND(RC[-3]<RC[-1],RC[-3]>=4,RC[-3]<5),85,IF(AND(RC[-3]<RC[-1],RC[-3]>=5,RC[-3]<6),80,IF(AND(RC[-3]<RC[-1],RC[-3]>=6,RC[-3]<7),75,IF(AND(RC[-3]<RC[-1],RC[-3]>=7,RC[-3]<8),70,IF(AND(RC[-3]<RC[-1],RC[-3]>=8,RC[-3]<9),65,IF(AND(RC[-3]<RC[-1],RC[-3]>=9,RC[-3]<10),60,IF(AND(RC[-3]<RC[-1],RC[-3]>=10,RC[-3]<11),55,IF(AND(RC[-3]<RC[-1],RC[-3]>=11,RC[-3]<12),50,IF(AND(RC[-3]<RC[-1],RC[-3]>=12,RC[-3]<13),45,IF(AND(RC[-3]<RC[-1],RC[-3]>=13,RC[-3]<14),40,IF(AND(RC[-3]<RC[-1],RC[-3]>=14,RC[-3]<15),35,IF(AND(RC[-3]<RC[-1],RC[-3]>=15,RC[-3]<16),30,IF(AND(RC[-3]<RC[-1],RC[-3]>=16,RC[-3]<17),25,IF(AND(RC[-3]<RC[-1],RC[-3]>=17,RC[-3]<18),20,IF(AND(RC[-3]<RC[-1],RC[-3]>=18,RC[-3]<19),15,IF(AND(RC[-3]<RC[-1],RC[-3]>=19,RC[-3]<20),10,IF(AND(RC[-3]<RC[-1],RC[-3]>=20,RC[-3]<21),5,IF(AND(RC[-3]<RC[-1],RC[-3]>=21),0,IF(AND(RC[-3]>RC[-1],RC[-3]>=2,RC[-3]<3),90,IF(AND(RC[-3]>RC[-1],RC[-3]>=3,RC[-3]<4),90,IF(AND(RC[-3]>RC[-1],RC[-3]>=4,RC[-3]<5),80,IF(AND(RC[-3]>RC[-1],RC[-3]>=5,RC[-3]<6),70,IF(AND(RC[-3]>RC[-1],RC[-3]>=6,RC[-3]<7),60,IF(AND(RC[-3]>RC[-1],RC[-3]>=7,RC[-3]<8),50,IF(AND(RC[-3]>RC[-1],RC[-3]>=8,RC[-3]<9),40,IF(AND(RC[-3]>RC[-1],RC[-3]>=9,RC[-3]<10),30,IF(AND(RC[-3]>RC[-1],RC[-3]>=10,RC[-3]<11),20,IF(AND(RC[-3]>RC[-1],RC[-3]>=11,RC[-3]<12),10,IF(AND(RC[-3]>RC[-1],RC[-3]>=12),0))))))))))))))))))))))))))))))))) -> 100 | H321: =IF(RC[-3]="","",IF(RC[-3]<0.3,100,IF(AND(RC[-3]>=0.3,RC[-3]>0.4),95,IF(AND(RC[-3]>=0.4,RC[-3]<0.5),90,IF(AND(RC[-3]>=0.5,RC[-3]<0.6),85,IF(AND(RC[-3]>=0.6,RC[-3]<0.7),80,IF(AND(RC[-3]>=0.6,RC[-3]<1),80,IF(AND(RC[-3]>1,RC[-3]<2),50,IF(RC[-3]>2,0))))))))) -> 95 | I321: =IF(RC[-1]="",RC[-2],0.7*RC[-1]+0.3*RC[-2]) -> 96.5
A322: سر. توسعه و تجارت هیرمند | B322: بهیر | C322: =VLOOKUP(RC[-1],Sheet1!R3C2:R802C3,2,FALSE) -> سرمایه گذاریها | D322: =VLOOKUP(RC[-2],Sheet1!R3C2:R802C9,8,FALSE) -> 25.292265893917943 | E322: =IF(VLOOKUP(RC[-3],Sheet1!R3C2:R803C11,10,FALSE)=0,"",VLOOKUP(Sheet2!RC[-3],Sheet1!R[1]C[-3]:R[801]C[6],10,FALSE)) -> 4.5 | F322: =Sheet1!R375C10 -> 11.524146113687122 | G322: =IF(RC[-3]<0,0,IF(AND(RC[-3]<RC[-1],RC[-3]<2),100,IF(AND(RC[-3]<RC[-1],RC[-3]>=2,RC[-3]<3),95,IF(AND(RC[-3]<RC[-1],RC[-3]>=3,RC[-3]<4),90,IF(AND(RC[-3]<RC[-1],RC[-3]>=4,RC[-3]<5),85,IF(AND(RC[-3]<RC[-1],RC[-3]>=5,RC[-3]<6),80,IF(AND(RC[-3]<RC[-1],RC[-3]>=6,RC[-3]<7),75,IF(AND(RC[-3]<RC[-1],RC[-3]>=7,RC[-3]<8),70,IF(AND(RC[-3]<RC[-1],RC[-3]>=8,RC[-3]<9),65,IF(AND(RC[-3]<RC[-1],RC[-3]>=9,RC[-3]<10),60,IF(AND(RC[-3]<RC[-1],RC[-3]>=10,RC[-3]<11),55,IF(AND(RC[-3]<RC[-1],RC[-3]>=11,RC[-3]<12),50,IF(AND(RC[-3]<RC[-1],RC[-3]>=12,RC[-3]<13),45,IF(AND(RC[-3]<RC[-1],RC[-3]>=13,RC[-3]<14),40,IF(AND(RC[-3]<RC[-1],RC[-3]>=14,RC[-3]<15),35,IF(AND(RC[-3]<RC[-1],RC[-3]>=15,RC[-3]<16),30,IF(AND(RC[-3]<RC[-1],RC[-3]>=16,RC[-3]<17),25,IF(AND(RC[-3]<RC[-1],RC[-3]>=17,RC[-3]<18),20,IF(AND(RC[-3]<RC[-1],RC[-3]>=18,RC[-3]<19),15,IF(AND(RC[-3]<RC[-1],RC[-3]>=19,RC[-3]<20),10,IF(AND(RC[-3]<RC[-1],RC[-3]>=20,RC[-3]<21),5,IF(AND(RC[-3]<RC[-1],RC[-3]>=21),0,IF(AND(RC[-3]>RC[-1],RC[-3]>=2,RC[-3]<3),90,IF(AND(RC[-3]>RC[-1],RC[-3]>=3,RC[-3]<4),90,IF(AND(RC[-3]>RC[-1],RC[-3]>=4,RC[-3]<5),80,IF(AND(RC[-3]>RC[-1],RC[-3]>=5,RC[-3]<6),70,IF(AND(RC[-3]>RC[-1],RC[-3]>=6,RC[-3]<7),60,IF(AND(RC[-3]>RC[-1],RC[-3]>=7,RC[-3]<8),50,IF(AND(RC[-3]>RC[-1],RC[-3]>=8,RC[-3]<9),40,IF(AND(RC[-3]>RC[-1],RC[-3]>=9,RC[-3]<10),30,IF(AND(RC[-3]>RC[-1],RC[-3]>=10,RC[-3]<11),20,IF(AND(RC[-3]>RC[-1],RC[-3]>=11,RC[-3]<12),10,IF(AND(RC[-3]>RC[-1],RC[-3]>=12),0))))))))))))))))))))))))))))))))) -> 0 | H322: =IF(RC[-3]="","",IF(RC[-3]<0.3,100,IF(AND(RC[-3]>=0.3,RC[-3]>0.4),95,IF(AND(RC[-3]>=0.4,RC[-3]<0.5),90,IF(AND(RC[-3]>=0.5,RC[-3]<0.6),85,IF(AND(RC[-3]>=0.6,RC[-3]<0.7),80,IF(AND(RC[-3]>=0.6,RC[-3]<1),80,IF(AND(RC[-3]>1,RC[-3]<2),50,IF(RC[-3]>2,0))))))))) -> 95 | I322: =IF(RC[-1]="",RC[-2],0.7*RC[-1]+0.3*RC[-2]) -> 66.5
A323: سر. جامی | B323: وجامی | C323: =VLOOKUP(RC[-1],Sheet1!R3C2:R802C3,2,FALSE) -> سرمایه گذاریها | D323: =VLOOKUP(RC[-2],Sheet1!R3C2:R802C9,8,FALSE) -> 10.324160160189244 | E323: =IF(VLOOKUP(RC[-3],Sheet1!R3C2:R803C11,10,FALSE)=0,"",VLOOKUP(Sheet2!RC[-3],Sheet1!R[1]C[-3]:R[801]C[6],10,FALSE)) -> 3.5 | F323: =Sheet1!R375C10 -> 11.524146113687122 | G323: =IF(RC[-3]<0,0,IF(AND(RC[-3]<RC[-1],RC[-3]<2),100,IF(AND(RC[-3]<RC[-1],RC[-3]>=2,RC[-3]<3),95,IF(AND(RC[-3]<RC[-1],RC[-3]>=3,RC[-3]<4),90,IF(AND(RC[-3]<RC[-1],RC[-3]>=4,RC[-3]<5),85,IF(AND(RC[-3]<RC[-1],RC[-3]>=5,RC[-3]<6),80,IF(AND(RC[-3]<RC[-1],RC[-3]>=6,RC[-3]<7),75,IF(AND(RC[-3]<RC[-1],RC[-3]>=7,RC[-3]<8),70,IF(AND(RC[-3]<RC[-1],RC[-3]>=8,RC[-3]<9),65,IF(AND(RC[-3]<RC[-1],RC[-3]>=9,RC[-3]<10),60,IF(AND(RC[-3]<RC[-1],RC[-3]>=10,RC[-3]<11),55,IF(AND(RC[-3]<RC[-1],RC[-3]>=11,RC[-3]<12),50,IF(AND(RC[-3]<RC[-1],RC[-3]>=12,RC[-3]<13),45,IF(AND(RC[-3]<RC[-1],RC[-3]>=13,RC[-3]<14),40,IF(AND(RC[-3]<RC[-1],RC[-3]>=14,RC[-3]<15),35,IF(AND(RC[-3]<RC[-1],RC[-3]>=15,RC[-3]<16),30,IF(AND(RC[-3]<RC[-1],RC[-3]>=16,RC[-3]<17),25,IF(AND(RC[-3]<RC[-1],RC[-3]>=17,RC[-3]<18),20,IF(AND(RC[-3]<RC[-1],RC[-3]>=18,RC[-3]<19),15,IF(AND(RC[-3]<RC[-1],RC[-3]>=19,RC[-3]<20),10,IF(AND(RC[-3]<RC[-1],RC[-3]>=20,RC[-3]<21),5,IF(AND(RC[-3]<RC[-1],RC[-3]>=21),0,IF(AND(RC[-3]>RC[-1],RC[-3]>=2,RC[-3]<3),90,IF(AND(RC[-3]>RC[-1],RC[-3]>=3,RC[-3]<4),90,IF(AND(RC[-3]>RC[-1],RC[-3]>=4,RC[-3]<5),80,IF(AND(RC[-3]>RC[-1],RC[-3]>=5,RC[-3]<6),70,IF(AND(RC[-3]>RC[-1],RC[-3]>=6,RC[-3]<7),60,IF(AND(RC[-3]>RC[-1],RC[-3]>=7,RC[-3]<8),50,IF(AND(RC[-3]>RC[-1],RC[-3]>=8,RC[-3]<9),40,IF(AND(RC[-3]>RC[-1],RC[-3]>=9,RC[-3]<10),30,IF(AND(RC[-3]>RC[-1],RC[-3]>=10,RC[-3]<11),20,IF(AND(RC[-3]>RC[-1],RC[-3]>=11,RC[-3]<12),10,IF(AND(RC[-3]>RC[-1],RC[-3]>=12),0))))))))))))))))))))))))))))))))) -> 55 | H323: =IF(RC[-3]="","",IF(RC[-3]<0.3,100,IF(AND(RC[-3]>=0.3,RC[-3]>0.4),95,IF(AND(RC[-3]>=0.4,RC[-3]<0.5),90,IF(AND(RC[-3]>=0.5,RC[-3]<0.6),85,IF(AND(RC[-3]>=0.6,RC[-3]<0.7),80,IF(AND(RC[-3]>=0.6,RC[-3]<1),80,IF(AND(RC[-3]>1,RC[-3]<2),50,IF(RC[-3]>2,0))))))))) -> 95 | I323: =IF(RC[-1]="",RC[-2],0.7*RC[-1]+0.3*RC[-2]) -> 83
A324: سر. خراسان جنوبی | B324: وسخراج | C324: =VLOOKUP(RC[-1],Sheet1!R3C2:R802C3,2,FALSE) -> سرمایه گذاریها | D324: =VLOOKUP(RC[-2],Sheet1!R3C2:R802C9,8,FALSE) -> 3.5996924197538216 | E324: =IF(VLOOKUP(RC[-3],Sheet1!R3C2:R803C11,10,FALSE)=0,"",VLOOKUP(Sheet2!RC[-3],Sheet1!R[1]C[-3]:R[801]C[6],10,FALSE)) ->  | F324: =Sheet1!R375C10 -> 11.524146113687122 | G324: =IF(RC[-3]<0,0,IF(AND(RC[-3]<RC[-1],RC[-3]<2),100,IF(AND(RC[-3]<RC[-1],RC[-3]>=2,RC[-3]<3),95,IF(AND(RC[-3]<RC[-1],RC[-3]>=3,RC[-3]<4),90,IF(AND(RC[-3]<RC[-1],RC[-3]>=4,RC[-3]<5),85,IF(AND(RC[-3]<RC[-1],RC[-3]>=5,RC[-3]<6),80,IF(AND(RC[-3]<RC[-1],RC[-3]>=6,RC[-3]<7),75,IF(AND(RC[-3]<RC[-1],RC[-3]>=7,RC[-3]<8),70,IF(AND(RC[-3]<RC[-1],RC[-3]>=8,RC[-3]<9),65,IF(AND(RC[-3]<RC[-1],RC[-3]>=9,RC[-3]<10),60,IF(AND(RC[-3]<RC[-1],RC[-3]>=10,RC[-3]<11),55,IF(AND(RC[-3]<RC[-1],RC[-3]>=11,RC[-3]<12),50,IF(AND(RC[-3]<RC[-1],RC[-3]>=12,RC[-3]<13),45,IF(AND(RC[-3]<RC[-1],RC[-3]>=13,RC[-3]<14),40,IF(AND(RC[-3]<RC[-1],RC[-3]>=14,RC[-3]<15),35,IF(AND(RC[-3]<RC[-1],RC[-3]>=15,RC[-3]<16),30,IF(AND(RC[-3]<RC[-1],RC[-3]>=16,RC[-3]<17),25,IF(AND(RC[-3]<RC[-1],RC[-3]>=17,RC[-3]<18),20,IF(AND(RC[-3]<RC[-1],RC[-3]>=18,RC[-3]<19),15,IF(AND(RC[-3]<RC[-1],RC[-3]>=19,RC[-3]<20),10,IF(AND(RC[-3]<RC[-1],RC[-3]>=20,RC[-3]<21),5,IF(AND(RC[-3]<RC[-1],RC[-3]>=21),0,IF(AND(RC[-3]>RC[-1],RC[-3]>=2,RC[-3]<3),90,IF(AND(RC[-3]>RC[-1],RC[-3]>=3,RC[-3]<4),90,IF(AND(RC[-3]>RC[-1],RC[-3]>=4,RC[-3]<5),80,IF(AND(RC[-3]>RC[-1],RC[-3]>=5,RC[-3]<6),70,IF(AND(RC[-3]>RC[-1],RC[-3]>=6,RC[-3]<7),60,IF(AND(RC[-3]>RC[-1],RC[-3]>=7,RC[-3]<8),50,IF(AND(RC[-3]>RC[-1],RC[-3]>=8,RC[-3]<9),40,IF(AND(RC[-3]>RC[-1],RC[-3]>=9,RC[-3]<10),30,IF(AND(RC[-3]>RC[-1],RC[-3]>=10,RC[-3]<11),20,IF(AND(RC[-3]>RC[-1],RC[-3]>=11,RC[-3]<12),10,IF(AND(RC[-3]>RC[-1],RC[-3]>=12),0))))))))))))))))))))))))))))))))) -> 90 | H324: =IF(RC[-3]="","",IF(RC[-3]<0.3,100,IF(AND(RC[-3]>=0.3,RC[-3]>0.4),95,IF(AND(RC[-3]>=0.4,RC[-3]<0.5),90,IF(AND(RC[-3]>=0.5,RC[-3]<0.6),85,IF(AND(RC[-3]>=0.6,RC[-3]<0.7),80,IF(AND(RC[-3]>=0.6,RC[-3]<1),80,IF(AND(RC[-3]>1,RC[-3]<2),50,IF(RC[-3]>2,0))))))))) ->  | I324: =IF(RC[-1]="",RC[-2],0.7*RC[-1]+0.3*RC[-2]) -> 90
A325: سر. خوارزمی | B325: وخارزم | C325: =VLOOKUP(RC[-1],Sheet1!R3C2:R802C3,2,FALSE) -> سرمایه گذاریها | D325: =VLOOKUP(RC[-2],Sheet1!R3C2:R802C9,8,FALSE) -> 2.3389846826743921 | E325: =IF(VLOOKUP(RC[-3],Sheet1!R3C2:R803C11,10,FALSE)=0,"",VLOOKUP(Sheet2!RC[-3],Sheet1!R[1]C[-3]:R[801]C[6],10,FALSE)) -> 0.25 | F325: =Sheet1!R375C10 -> 11.524146113687122 | G325: =IF(RC[-3]<0,0,IF(AND(RC[-3]<RC[-1],RC[-3]<2),100,IF(AND(RC[-3]<RC[-1],RC[-3]>=2,RC[-3]<3),95,IF(AND(RC[-3]<RC[-1],RC[-3]>=3,RC[-3]<4),90,IF(AND(RC[-3]<RC[-1],RC[-3]>=4,RC[-3]<5),85,IF(AND(RC[-3]<RC[-1],RC[-3]>=5,RC[-3]<6),80,IF(AND(RC[-3]<RC[-1],RC[-3]>=6,RC[-3]<7),75,IF(AND(RC[-3]<RC[-1],RC[-3]>=7,RC[-3]<8),70,IF(AND(RC[-3]<RC[-1],RC[-3]>=8,RC[-3]<9),65,IF(AND(RC[-3]<RC[-1],RC[-3]>=9,RC[-3]<10),60,IF(AND(RC[-3]<RC[-1],RC[-3]>=10,RC[-3]<11),55,IF(AND(RC[-3]<RC[-1],RC[-3]>=11,RC[-3]<12),50,IF(AND(RC[-3]<RC[-1],RC[-3]>=12,RC[-3]<13),45,IF(AND(RC[-3]<RC[-1],RC[-3]>=13,RC[-3]<14),40,IF(AND(RC[-3]<RC[-1],RC[-3]>=14,RC[-3]<15),35,IF(AND(RC[-3]<RC[-1],RC[-3]>=15,RC[-3]<16),30,IF(AND(RC[-3]<RC[-1],RC[-3]>=16,RC[-3]<17),25,IF(AND(RC[-3]<RC[-1],RC[-3]>=17,RC[-3]<18),20,IF(AND(RC[-3]<RC[-1],RC[-3]>=18,RC[-3]<19),15,IF(AND(RC[-3]<RC[-1],RC[-3]>=19,RC[-3]<20),10,IF(AND(RC[-3]<RC[-1],RC[-3]>=20,RC[-3]<21),5,IF(AND(RC[-3]<RC[-1],RC[-3]>=21),0,IF(AND(RC[-3]>RC[-1],RC[-3]>=2,RC[-3]<3),90,IF(AND(RC[-3]>RC[-1],RC[-3]>=3,RC[-3]<4),90,IF(AND(RC[-3]>RC[-1],RC[-3]>=4,RC[-3]<5),80,IF(AND(RC[-3]>RC[-1],RC[-3]>=5,RC[-3]<6),70,IF(AND(RC[-3]>RC[-1],RC[-3]>=6,RC[-3]<7),60,IF(AND(RC[-3]>RC[-1],RC[-3]>=7,RC[-3]<8),50,IF(AND(RC[-3]>RC[-1],RC[-3]>=8,RC[-3]<9),40,IF(AND(RC[-3]>RC[-1],RC[-3]>=9,RC[-3]<10),30,IF(AND(RC[-3]>RC[-1],RC[-3]>=10,RC[-3]<11),20,IF(AND(RC[-3]>RC[-1],RC[-3]>=11,RC[-3]<12),10,IF(AND(RC[-3]>RC[-1],RC[-3]>=12),0))))))))))))))))))))))))))))))))) -> 95 | H325: =IF(RC[-3]="","",IF(RC[-3]<0.3,100,IF(AND(RC[-3]>=0.3,RC[-3]>0.4),95,IF(AND(RC[-3]>=0.4,RC[-3]<0.5),90,IF(AND(RC[-3]>=0.5,RC[-3]<0.6),85,IF(AND(RC[-3]>=0.6,RC[-3]<0.7),80,IF(AND(RC[-3]>=0.6,RC[-3]<1),80,IF(AND(RC[-3]>1,RC[-3]<2),50,IF(RC[-3]>2,0))))))))) -> 100 | I325: =IF(RC[-1]="",RC[-2],0.7*RC[-1]+0.3*RC[-2]) -> 98.5
A326: سر. دانایان پارس | B326: ودانا | C326: =VLOOKUP(RC[-1],Sheet1!R3C2:R802C3,2,FALSE) -> سرمایه گذاریها | D326: =VLOOKUP(RC[-2],Sheet1!R3C2:R802C9,8,FALSE) -> 1.9209224147062212 | E326: =IF(VLOOKUP(RC[-3],Sheet1!R3C2:R803C11,10,FALSE)=0,"",VLOOKUP(Sheet2!RC[-3],Sheet1!R[1]C[-3]:R[801]C[6],10,FALSE)) -> 1.2 | F326: =Sheet1!R375C10 -> 11.524146113687122 | G326: =IF(RC[-3]<0,0,IF(AND(RC[-3]<RC[-1],RC[-3]<2),100,IF(AND(RC[-3]<RC[-1],RC[-3]>=2,RC[-3]<3),95,IF(AND(RC[-3]<RC[-1],RC[-3]>=3,RC[-3]<4),90,IF(AND(RC[-3]<RC[-1],RC[-3]>=4,RC[-3]<5),85,IF(AND(RC[-3]<RC[-1],RC[-3]>=5,RC[-3]<6),80,IF(AND(RC[-3]<RC[-1],RC[-3]>=6,RC[-3]<7),75,IF(AND(RC[-3]<RC[-1],RC[-3]>=7,RC[-3]<8),70,IF(AND(RC[-3]<RC[-1],RC[-3]>=8,RC[-3]<9),65,IF(AND(RC[-3]<RC[-1],RC[-3]>=9,RC[-3]<10),60,IF(AND(RC[-3]<RC[-1],RC[-3]>=10,RC[-3]<11),55,IF(AND(RC[-3]<RC[-1],RC[-3]>=11,RC[-3]<12),50,IF(AND(RC[-3]<RC[-1],RC[-3]>=12,RC[-3]<13),45,IF(AND(RC[-3]<RC[-1],RC[-3]>=13,RC[-3]<14),40,IF(AND(RC[-3]<RC[-1],RC[-3]>=14,RC[-3]<15),35,IF(AND(RC[-3]<RC[-1],RC[-3]>=15,RC[-3]<16),30,IF(AND(RC[-3]<RC[-1],RC[-3]>=16,RC[-3]<17),25,IF(AND(RC[-3]<RC[-1],RC[-3]>=17,RC[-3]<18),20,IF(AND(RC[-3]<RC[-1],RC[-3]>=18,RC[-3]<19),15,IF(AND(RC[-3]<RC[-1],RC[-3]>=19,RC[-3]<20),10,IF(AND(RC[-3]<RC[-1],RC[-3]>=20,RC[-3]<21),5,IF(AND(RC[-3]<RC[-1],RC[-3]>=21),0,IF(AND(RC[-3]>RC[-1],RC[-3]>=2,RC[-3]<3),90,IF(AND(RC[-3]>RC[-1],RC[-3]>=3,RC[-3]<4),90,IF(AND(RC[-3]>RC[-1],RC[-3]>=4,RC[-3]<5),80,IF(AND(RC[-3]>RC[-1],RC[-3]>=5,RC[-3]<6),70,IF(AND(RC[-3]>RC[-1],RC[-3]>=6,RC[-3]<7),60,IF(AND(RC[-3]>RC[-1],RC[-3]>=7,RC[-3]<8),50,IF(AND(RC[-3]>RC[-1],RC[-3]>=8,RC[-3]<9),40,IF(AND(RC[-3]>RC[-1],RC[-3]>=9,RC[-3]<10),30,IF(AND(RC[-3]>RC[-1],RC[-3]>=10,RC[-3]<11),20,IF(AND(RC[-3]>RC[-1],RC[-3]>=11,RC[-3]<12),10,IF(AND(RC[-3]>RC[-1],RC[-3]>=12),0))))))))))))))))))))))))))))))))) -> 100 | H326: =IF(RC[-3]="","",IF(RC[-3]<0.3,100,IF(AND(RC[-3]>=0.3,RC[-3]>0.4),95,IF(AND(RC[-3]>=0.4,RC[-3]<0.5),90,IF(AND(RC[-3]>=0.5,RC[-3]<0.6),85,IF(AND(RC[-3]>=0.6,RC[-3]<0.7),80,IF(AND(RC[-3]>=0.6,RC[-3]<1),80,IF(AND(RC[-3]>1,RC[-3]<2),50,IF(RC[-3]>2,0))))))))) -> 95 | I326: =IF(RC[-1]="",RC[-2],0.7*RC[-1]+0.3*RC[-2]) -> 96.5
A327: سر. سایپا | B327: وساپا | C327: =VLOOKUP(RC[-1],Sheet1!R3C2:R802C3,2,FALSE) -> سرمایه گذاریها | D327: =VLOOKUP(RC[-2],Sheet1!R3C2:R802C9,8,FALSE) -> 9.8161549138544757 | E327: =IF(VLOOKUP(RC[-3],Sheet1!R3C2:R803C11,10,FALSE)=0,"",VLOOKUP(Sheet2!RC[-3],Sheet1!R[1]C[-3]:R[801]C[6],10,FALSE)) -> 0.75 | F327: =Sheet1!R375C10 -> 11.524146113687122 | G327: =IF(RC[-3]<0,0,IF(AND(RC[-3]<RC[-1],RC[-3]<2),100,IF(AND(RC[-3]<RC[-1],RC[-3]>=2,RC[-3]<3),95,IF(AND(RC[-3]<RC[-1],RC[-3]>=3,RC[-3]<4),90,IF(AND(RC[-3]<RC[-1],RC[-3]>=4,RC[-3]<5),85,IF(AND(RC[-3]<RC[-1],RC[-3]>=5,RC[-3]<6),80,IF(AND(RC[-3]<RC[-1],RC[-3]>=6,RC[-3]<7),75,IF(AND(RC[-3]<RC[-1],RC[-3]>=7,RC[-3]<8),70,IF(AND(RC[-3]<RC[-1],RC[-3]>=8,RC[-3]<9),65,IF(AND(RC[-3]<RC[-1],RC[-3]>=9,RC[-3]<10),60,IF(AND(RC[-3]<RC[-1],RC[-3]>=10,RC[-3]<11),55,IF(AND(RC[-3]<RC[-1],RC[-3]>=11,RC[-3]<12),50,IF(AND(RC[-3]<RC[-1],RC[-3]>=12,RC[-3]<13),45,IF(AND(RC[-3]<RC[-1],RC[-3]>=13,RC[-3]<14),40,IF(AND(RC[-3]<RC[-1],RC[-3]>=14,RC[-3]<15),35,IF(AND(RC[-3]<RC[-1],RC[-3]>=15,RC[-3]<16),30,IF(AND(RC[-3]<RC[-1],RC[-3]>=16,RC[-3]<17),25,IF(AND(RC[-3]<RC[-1],RC[-3]>=17,RC[-3]<18),20,IF(AND(RC[-3]<RC[-1],RC[-3]>=18,RC[-3]<19),15,IF(AND(RC[-3]<RC[-1],RC[-3]>=19,RC[-3]<20),10,IF(AND(RC[-3]<RC[-1],RC[-3]>=20,RC[-3]<21),5,IF(AND(RC[-3]<RC[-1],RC[-3]>=21),0,IF(AND(RC[-3]>RC[-1],RC[-3]>=2,RC[-3]<3),90,IF(AND(RC[-3]>RC[-1],RC[-3]>=3,RC[-3]<4),90,IF(AND(RC[-3]>RC[-1],RC[-3]>=4,RC[-3]<5),80,IF(AND(RC[-3]>RC[-1],RC[-3]>=5,RC[-3]<6),70,IF(AND(RC[-3]>RC[-1],RC[-3]>=6,RC[-3]<7),60,IF(AND(RC[-3]>RC[-1],RC[-3]>=7,RC[-3]<8),50,IF(AND(RC[-3]>RC[-1],RC[-3]>=8,RC[-3]<9),40,IF(AND(RC[-3]>RC[-1],RC[-3]>=9,RC[-3]<10),30,IF(AND(RC[-3]>RC[-1],RC[-3]>=10,RC[-3]<11),20,IF(AND(RC[-3]>RC[-1],RC[-3]>=11,RC[-3]<12),10,IF(AND(RC[-3]>RC[-1],RC[-3]>=12),0))))))))))))))))))))))))))))))))) -> 60 | H327: =IF(RC[-3]="","",IF(RC[-3]<0.3,100,IF(AND(RC[-3]>=0.3,RC[-3]>0.4),95,IF(AND(RC[-3]>=0.4,RC[-3]<0.5),90,IF(AND(RC[-3]>=0.5,RC[-3]<0.6),85,IF(AND(RC[-3]>=0.6,RC[-3]<0.7),80,IF(AND(RC[-3]>=0.6,RC[-3]<1),80,IF(AND(RC[-3]>1,RC[-3]<2),50,IF(RC[-3]>2,0))))))))) -> 95 | I327: =IF(RC[-1]="",RC[-2],0.7*RC[-1]+0.3*RC[-2]) -> 84.5
A328: سر. سپه | B328: وسپه | C328: =VLOOKUP(RC[-1],Sheet1!R3C2:R802C3,2,FALSE) -> سرمایه گذاریها | D328: =VLOOKUP(RC[-2],Sheet1!R3C2:R802C9,8,FALSE) -> 3.1095774367844626 | E328: =IF(VLOOKUP(RC[-3],Sheet1!R3C2:R803C11,10,FALSE)=0,"",VLOOKUP(Sheet2!RC[-3],Sheet1!R[1]C[-3]:R[801]C[6],10,FALSE)) -> 0.66 | F328: =Sheet1!R375C10 -> 11.524146113687122 | G328: =IF(RC[-3]<0,0,IF(AND(RC[-3]<RC[-1],RC[-3]<2),100,IF(AND(RC[-3]<RC[-1],RC[-3]>=2,RC[-3]<3),95,IF(AND(RC[-3]<RC[-1],RC[-3]>=3,RC[-3]<4),90,IF(AND(RC[-3]<RC[-1],RC[-3]>=4,RC[-3]<5),85,IF(AND(RC[-3]<RC[-1],RC[-3]>=5,RC[-3]<6),80,IF(AND(RC[-3]<RC[-1],RC[-3]>=6,RC[-3]<7),75,IF(AND(RC[-3]<RC[-1],RC[-3]>=7,RC[-3]<8),70,IF(AND(RC[-3]<RC[-1],RC[-3]>=8,RC[-3]<9),65,IF(AND(RC[-3]<RC[-1],RC[-3]>=9,RC[-3]<10),60,IF(AND(RC[-3]<RC[-1],RC[-3]>=10,RC[-3]<11),55,IF(AND(RC[-3]<RC[-1],RC[-3]>=11,RC[-3]<12),50,IF(AND(RC[-3]<RC[-1],RC[-3]>=12,RC[-3]<13),45,IF(AND(RC[-3]<RC[-1],RC[-3]>=13,RC[-3]<14),40,IF(AND(RC[-3]<RC[-1],RC[-3]>=14,RC[-3]<15),35,IF(AND(RC[-3]<RC[-1],RC[-3]>=15,RC[-3]<16),30,IF(AND(RC[-3]<RC[-1],RC[-3]>=16,RC[-3]<17),25,IF(AND(RC[-3]<RC[-1],RC[-3]>=17,RC[-3]<18),20,IF(AND(RC[-3]<RC[-1],RC[-3]>=18,RC[-3]<19),15,IF(AND(RC[-3]<RC[-1],RC[-3]>=19,RC[-3]<20),10,IF(AND(RC[-3]<RC[-1],RC[-3]>=20,RC[-3]<21),5,IF(AND(RC[-3]<RC[-1],RC[-3]>=21),0,IF(AND(RC[-3]>RC[-1],RC[-3]>=2,RC[-3]<3),90,IF(AND(RC[-3]>RC[-1],RC[-3]>=3,RC[-3]<4),90,IF(AND(RC[-3]>RC[-1],RC[-3]>=4,RC[-3]<5),80,IF(AND(RC[-3]>RC[-1],RC[-3]>=5,RC[-3]<6),70,IF(AND(RC[-3]>RC[-1],RC[-3]>=6,RC[-3]<7),60,IF(AND(RC[-3]>RC[-1],RC[-3]>=7,RC[-3]<8),50,IF(AND(RC[-3]>RC[-1],RC[-3]>=8,RC[-3]<9),40,IF(AND(RC[-3]>RC[-1],RC[-3]>=9,RC[-3]<10),30,IF(AND(RC[-3]>RC[-1],RC[-3]>=10,RC[-3]<11),20,IF(AND(RC[-3]>RC[-1],RC[-3]>=11,RC[-3]<12),10,IF(AND(RC[-3]>RC[-1],RC[-3]>=12),0))))))))))))))))))))))))))))))))) -> 90 | H328: =IF(RC[-3]="","",IF(RC[-3]<0.3,100,IF(AND(RC[-3]>=0.3,RC[-3]>0.4),95,IF(AND(RC[-3]>=0.4,RC[-3]<0.5),90,IF(AND(RC[-3]>=0.5,RC[-3]<0.6),85,IF(AND(RC[-3]>=0.6,RC[-3]<0.7),80,IF(AND(RC[-3]>=0.6,RC[-3]<1),80,IF(AND(RC[-3]>1,RC[-3]<2),50,IF(RC[-3]>2,0))))))))) -> 95 | I328: =IF(RC[-1]="",RC[-2],0.7*RC[-1]+0.3*RC[-2]) -> 93.5
A329: سر. صبا تامین | B329: صبا | C329: =VLOOKUP(RC[-1],Sheet1!R3C2:R802C3,2,FALSE) -> سرمایه گذاریها | D329: =VLOOKUP(RC[-2],Sheet1!R3C2:R802C9,8,FALSE) -> 2.688658835471966 | E329: =IF(VLOOKUP(RC[-3],Sheet1!R3C2:R803C11,10,FALSE)=0,"",VLOOKUP(Sheet2!RC[-3],Sheet1!R[1]C[-3]:R[801]C[6],10,FALSE)) -> 0.6 | F329: =Sheet1!R375C10 -> 11.524146113687122 | G329: =IF(RC[-3]<0,0,IF(AND(RC[-3]<RC[-1],RC[-3]<2),100,IF(AND(RC[-3]<RC[-1],RC[-3]>=2,RC[-3]<3),95,IF(AND(RC[-3]<RC[-1],RC[-3]>=3,RC[-3]<4),90,IF(AND(RC[-3]<RC[-1],RC[-3]>=4,RC[-3]<5),85,IF(AND(RC[-3]<RC[-1],RC[-3]>=5,RC[-3]<6),80,IF(AND(RC[-3]<RC[-1],RC[-3]>=6,RC[-3]<7),75,IF(AND(RC[-3]<RC[-1],RC[-3]>=7,RC[-3]<8),70,IF(AND(RC[-3]<RC[-1],RC[-3]>=8,RC[-3]<9),65,IF(AND(RC[-3]<RC[-1],RC[-3]>=9,RC[-3]<10),60,IF(AND(RC[-3]<RC[-1],RC[-3]>=10,RC[-3]<11),55,IF(AND(RC[-3]<RC[-1],RC[-3]>=11,RC[-3]<12),50,IF(AND(RC[-3]<RC[-1],RC[-3]>=12,RC[-3]<13),45,IF(AND(RC[-3]<RC[-1],RC[-3]>=13,RC[-3]<14),40,IF(AND(RC[-3]<RC[-1],RC[-3]>=14,RC[-3]<15),35,IF(AND(RC[-3]<RC[-1],RC[-3]>=15,RC[-3]<16),30,IF(AND(RC[-3]<RC[-1],RC[-3]>=16,RC[-3]<17),25,IF(AND(RC[-3]<RC[-1],RC[-3]>=17,RC[-3]<18),20,IF(AND(RC[-3]<RC[-1],RC[-3]>=18,RC[-3]<19),15,IF(AND(RC[-3]<RC[-1],RC[-3]>=19,RC[-3]<20),10,IF(AND(RC[-3]<RC[-1],RC[-3]>=20,RC[-3]<21),5,IF(AND(RC[-3]<RC[-1],RC[-3]>=21),0,IF(AND(RC[-3]>RC[-1],RC[-3]>=2,RC[-3]<3),90,IF(AND(RC[-3]>RC[-1],RC[-3]>=3,RC[-3]<4),90,IF(AND(RC[-3]>RC[-1],RC[-3]>=4,RC[-3]<5),80,IF(AND(RC[-3]>RC[-1],RC[-3]>=5,RC[-3]<6),70,IF(AND(RC[-3]>RC[-1],RC[-3]>=6,RC[-3]<7),60,IF(AND(RC[-3]>RC[-1],RC[-3]>=7,RC[-3]<8),50,IF(AND(RC[-3]>RC[-1],RC[-3]>=8,RC[-3]<9),40,IF(AND(RC[-3]>RC[-1],RC[-3]>=9,RC[-3]<10),30,IF(AND(RC[-3]>RC[-1],RC[-3]>=10,RC[-3]<11),20,IF(AND(RC[-3]>RC[-1],RC[-3]>=11,RC[-3]<12),10,IF(AND(RC[-3]>RC[-1],RC[-3]>=12),0))))))))))))))))))))))))))))))))) -> 95 | H329: =IF(RC[-3]="","",IF(RC[-3]<0.3,100,IF(AND(RC[-3]>=0.3,RC[-3]>0.4),95,IF(AND(RC[-3]>=0.4,RC[-3]<0.5),90,IF(AND(RC[-3]>=0.5,RC[-3]<0.6),85,IF(AND(RC[-3]>=0.6,RC[-3]<0.7),80,IF(AND(RC[-3]>=0.6,RC[-3]<1),80,IF(AND(RC[-3]>1,RC[-3]<2),50,IF(RC[-3]>2,0))))))))) -> 95 | I329: =IF(RC[-1]="",RC[-2],0.7*RC[-1]+0.3*RC[-2]) -> 95
A330: سر. صنایع ایران | B330: وایرا | C330: =VLOOKUP(RC[-1],Sheet1!R3C2:R802C3,2,FALSE) -> سرمایه گذاریها | D330: =VLOOKUP(RC[-2],Sheet1!R3C2:R802C9,8,FALSE) -> 10.913067500592222 | E330: =IF(VLOOKUP(RC[-3],Sheet1!R3C2:R803C11,10,FALSE)=0,"",VLOOKUP(Sheet2!RC[-3],Sheet1!R[1]C[-3]:R[801]C[6],10,FALSE)) -> 0.88 | F330: =Sheet1!R375C10 -> 11.524146113687122 | G330: =IF(RC[-3]<0,0,IF(AND(RC[-3]<RC[-1],RC[-3]<2),100,IF(AND(RC[-3]<RC[-1],RC[-3]>=2,RC[-3]<3),95,IF(AND(RC[-3]<RC[-1],RC[-3]>=3,RC[-3]<4),90,IF(AND(RC[-3]<RC[-1],RC[-3]>=4,RC[-3]<5),85,IF(AND(RC[-3]<RC[-1],RC[-3]>=5,RC[-3]<6),80,IF(AND(RC[-3]<RC[-1],RC[-3]>=6,RC[-3]<7),75,IF(AND(RC[-3]<RC[-1],RC[-3]>=7,RC[-3]<8),70,IF(AND(RC[-3]<RC[-1],RC[-3]>=8,RC[-3]<9),65,IF(AND(RC[-3]<RC[-1],RC[-3]>=9,RC[-3]<10),60,IF(AND(RC[-3]<RC[-1],RC[-3]>=10,RC[-3]<11),55,IF(AND(RC[-3]<RC[-1],RC[-3]>=11,RC[-3]<12),50,IF(AND(RC[-3]<RC[-1],RC[-3]>=12,RC[-3]<13),45,IF(AND(RC[-3]<RC[-1],RC[-3]>=13,RC[-3]<14),40,IF(AND(RC[-3]<RC[-1],RC[-3]>=14,RC[-3]<15),35,IF(AND(RC[-3]<RC[-1],RC[-3]>=15,RC[-3]<16),30,IF(AND(RC[-3]<RC[-1],RC[-3]>=16,RC[-3]<17),25,IF(AND(RC[-3]<RC[-1],RC[-3]>=17,RC[-3]<18),20,IF(AND(RC[-3]<RC[-1],RC[-3]>=18,RC[-3]<19),15,IF(AND(RC[-3]<RC[-1],RC[-3]>=19,RC[-3]<20),10,IF(AND(RC[-3]<RC[-1],RC[-3]>=20,RC[-3]<21),5,IF(AND(RC[-3]<RC[-1],RC[-3]>=21),0,IF(AND(RC[-3]>RC[-1],RC[-3]>=2,RC[-3]<3),90,IF(AND(RC[-3]>RC[-1],RC[-3]>=3,RC[-3]<4),90,IF(AND(RC[-3]>RC[-1],RC[-3]>=4,RC[-3]<5),80,IF(AND(RC[-3]>RC[-1],RC[-3]>=5,RC[-3]<6),70,IF(AND(RC[-3]>RC[-1],RC[-3]>=6,RC[-3]<7),60,IF(AND(RC[-3]>RC[-1],RC[-3]>=7,RC[-3]<8),50,IF(AND(RC[-3]>RC[-1],RC[-3]>=8,RC[-3]<9),40,IF(AND(RC[-3]>RC[-1],RC[-3]>=9,RC[-3]<10),30,IF(AND(RC[-3]>RC[-1],RC[-3]>=10,RC[-3]<11),20,IF(AND(RC[-3]>RC[-1],RC[-3]>=11,RC[-3]<12),10,IF(AND(RC[-3]>RC[-1],RC[-3]>=12),0))))))))))))))))))))))))))))))))) -> 55 | H330: =IF(RC[-3]="","",IF(RC[-3]<0.3,100,IF(AND(RC[-3]>=0.3,RC[-3]>0.4),95,IF(AND(RC[-3]>=0.4,RC[-3]<0.5),90,IF(AND(RC[-3]>=0.5,RC[-3]<0.6),85,IF(AND(RC[-3]>=0.6,RC[-3]<0.7),80,IF(AND(RC[-3]>=0.6,RC[-3]<1),80,IF(AND(RC[-3]>1,RC[-3]<2),50,IF(RC[-3]>2,0))))))))) -> 95 | I330: =IF(RC[-1]="",RC[-2],0.7*RC[-1]+0.3*RC[-2]) -> 83
A331: سر. صنعت بیمه | B331: وبیمه | C331: =VLOOKUP(RC[-1],Sheet1!R3C2:R802C3,2,FALSE) -> سرمایه گذاریها | D331: =VLOOKUP(RC[-2],Sheet1!R3C2:R802C9,8,FALSE) -> 9.8388164890535901 | E331: =IF(VLOOKUP(RC[-3],Sheet1!R3C2:R803C11,10,FALSE)=0,"",VLOOKUP(Sheet2!RC[-3],Sheet1!R[1]C[-3]:R[801]C[6],10,FALSE)) -> 2 | F331: =Sheet1!R375C10 -> 11.524146113687122 | G331: =IF(RC[-3]<0,0,IF(AND(RC[-3]<RC[-1],RC[-3]<2),100,IF(AND(RC[-3]<RC[-1],RC[-3]>=2,RC[-3]<3),95,IF(AND(RC[-3]<RC[-1],RC[-3]>=3,RC[-3]<4),90,IF(AND(RC[-3]<RC[-1],RC[-3]>=4,RC[-3]<5),85,IF(AND(RC[-3]<RC[-1],RC[-3]>=5,RC[-3]<6),80,IF(AND(RC[-3]<RC[-1],RC[-3]>=6,RC[-3]<7),75,IF(AND(RC[-3]<RC[-1],RC[-3]>=7,RC[-3]<8),70,IF(AND(RC[-3]<RC[-1],RC[-3]>=8,RC[-3]<9),65,IF(AND(RC[-3]<RC[-1],RC[-3]>=9,RC[-3]<10),60,IF(AND(RC[-3]<RC[-1],RC[-3]>=10,RC[-3]<11),55,IF(AND(RC[-3]<RC[-1],RC[-3]>=11,RC[-3]<12),50,IF(AND(RC[-3]<RC[-1],RC[-3]>=12,RC[-3]<13),45,IF(AND(RC[-3]<RC[-1],RC[-3]>=13,RC[-3]<14),40,IF(AND(RC[-3]<RC[-1],RC[-3]>=14,RC[-3]<15),35,IF(AND(RC[-3]<RC[-1],RC[-3]>=15,RC[-3]<16),30,IF(AND(RC[-3]<RC[-1],RC[-3]>=16,RC[-3]<17),25,IF(AND(RC[-3]<RC[-1],RC[-3]>=17,RC[-3]<18),20,IF(AND(RC[-3]<RC[-1],RC[-3]>=18,RC[-3]<19),15,IF(AND(RC[-3]<RC[-1],RC[-3]>=19,RC[-3]<20),10,IF(AND(RC[-3]<RC[-1],RC[-3]>=20,RC[-3]<21),5,IF(AND(RC[-3]<RC[-1],RC[-3]>=21),0,IF(AND(RC[-3]>RC[-1],RC[-3]>=2,RC[-3]<3),90,IF(AND(RC[-3]>RC[-1],RC[-3]>=3,RC[-3]<4),90,IF(AND(RC[-3]>RC[-1],RC[-3]>=4,RC[-3]<5),80,IF(AND(RC[-3]>RC[-1],RC[-3]>=5,RC[-3]<6),70,IF(AND(RC[-3]>RC[-1],RC[-3]>=6,RC[-3]<7),60,IF(AND(RC[-3]>RC[-1],RC[-3]>=7,RC[-3]<8),50,IF(AND(RC[-3]>RC[-1],RC[-3]>=8,RC[-3]<9),40,IF(AND(RC[-3]>RC[-1],RC[-3]>=9,RC[-3]<10),30,IF(AND(RC[-3]>RC[-1],RC[-3]>=10,RC[-3]<11),20,IF(AND(RC[-3]>RC[-1],RC[-3]>=11,RC[-3]<12),10,IF(AND(RC[-3]>RC[-1],RC[-3]>=12),0))))))))))))))))))))))))))))))))) -> 60 | H331: =IF(RC[-3]="","",IF(RC[-3]<0.3,100,IF(AND(RC[-3]>=0.3,RC[-3]>0.4),95,IF(AND(RC[-3]>=0.4,RC[-3]<0.5),90,IF(AND(RC[-3]>=0.5,RC[-3]<0.6),85,IF(AND(RC[-3]>=0.6,RC[-3]<0.7),80,IF(AND(RC[-3]>=0.6,RC[-3]<1),80,IF(AND(RC[-3]>1,RC[-3]<2),50,IF(RC[-3]>2,0))))))))) -> 95 | I331: =IF(RC[-1]="",RC[-2],0.7*RC[-1]+0.3*RC[-2]) -> 84.5
A332: سر. صنعت پتروشیمی ساختمان خلیج فارس | B332: وپسا | C332: =VLOOKUP(RC[-1],Sheet1!R3C2:R802C3,2,FALSE) -> سرمایه گذاریها | D332: =VLOOKUP(RC[-2],Sheet1!R3C2:R802C9,8,FALSE) -> 40.592187212383188 | E332: =IF(VLOOKUP(RC[-3],Sheet1!R3C2:R803C11,10,FALSE)=0,"",VLOOKUP(Sheet2!RC[-3],Sheet1!R[1]C[-3]:R[801]C[6],10,FALSE)) -> 1.5 | F332: =Sheet1!R375C10 -> 11.524146113687122 | G332: =IF(RC[-3]<0,0,IF(AND(RC[-3]<RC[-1],RC[-3]<2),100,IF(AND(RC[-3]<RC[-1],RC[-3]>=2,RC[-3]<3),95,IF(AND(RC[-3]<RC[-1],RC[-3]>=3,RC[-3]<4),90,IF(AND(RC[-3]<RC[-1],RC[-3]>=4,RC[-3]<5),85,IF(AND(RC[-3]<RC[-1],RC[-3]>=5,RC[-3]<6),80,IF(AND(RC[-3]<RC[-1],RC[-3]>=6,RC[-3]<7),75,IF(AND(RC[-3]<RC[-1],RC[-3]>=7,RC[-3]<8),70,IF(AND(RC[-3]<RC[-1],RC[-3]>=8,RC[-3]<9),65,IF(AND(RC[-3]<RC[-1],RC[-3]>=9,RC[-3]<10),60,IF(AND(RC[-3]<RC[-1],RC[-3]>=10,RC[-3]<11),55,IF(AND(RC[-3]<RC[-1],RC[-3]>=11,RC[-3]<12),50,IF(AND(RC[-3]<RC[-1],RC[-3]>=12,RC[-3]<13),45,IF(AND(RC[-3]<RC[-1],RC[-3]>=13,RC[-3]<14),40,IF(AND(RC[-3]<RC[-1],RC[-3]>=14,RC[-3]<15),35,IF(AND(RC[-3]<RC[-1],RC[-3]>=15,RC[-3]<16),30,IF(AND(RC[-3]<RC[-1],RC[-3]>=16,RC[-3]<17),25,IF(AND(RC[-3]<RC[-1],RC[-3]>=17,RC[-3]<18),20,IF(AND(RC[-3]<RC[-1],RC[-3]>=18,RC[-3]<19),15,IF(AND(RC[-3]<RC[-1],RC[-3]>=19,RC[-3]<20),10,IF(AND(RC[-3]<RC[-1],RC[-3]>=20,RC[-3]<21),5,IF(AND(RC[-3]<RC[-1],RC[-3]>=21),0,IF(AND(RC[-3]>RC[-1],RC[-3]>=2,RC[-3]<3),90,IF(AND(RC[-3]>RC[-1],RC[-3]>=3,RC[-3]<4),90,IF(AND(RC[-3]>RC[-1],RC[-3]>=4,RC[-3]<5),80,IF(AND(RC[-3]>RC[-1],RC[-3]>=5,RC[-3]<6),70,IF(AND(RC[-3]>RC[-1],RC[-3]>=6,RC[-3]<7),60,IF(AND(RC[-3]>RC[-1],RC[-3]>=7,RC[-3]<8),50,IF(AND(RC[-3]>RC[-1],RC[-3]>=8,RC[-3]<9),40,IF(AND(RC[-3]>RC[-1],RC[-3]>=9,RC[-3]<10),30,IF(AND(RC[-3]>RC[-1],RC[-3]>=10,RC[-3]<11),20,IF(AND(RC[-3]>RC[-1],RC[-3]>=11,RC[-3]<12),10,IF(AND(RC[-3]>RC[-1],RC[-3]>=12),0))))))))))))))))))))))))))))))))) -> 0 | H332: =IF(RC[-3]="","",IF(RC[-3]<0.3,100,IF(AND(RC[-3]>=0.3,RC[-3]>0.4),95,IF(AND(RC[-3]>=0.4,RC[-3]<0.5),90,IF(AND(RC[-3]>=0.5,RC[-3]<0.6),85,IF(AND(RC[-3]>=0.6,RC[-3]<0.7),80,IF(AND(RC[-3]>=0.6,RC[-3]<1),80,IF(AND(RC[-3]>1,RC[-3]<2),50,IF(RC[-3]>2,0))))))))) -> 95 | I332: =IF(RC[-1]="",RC[-2],0.7*RC[-1]+0.3*RC[-2]) -> 66.5
A333: سر. فلات ایرانیان | B333: فلات | C333: =VLOOKUP(RC[-1],Sheet1!R3C2:R802C3,2,FALSE) -> سرمایه گذاریها | D333: =VLOOKUP(RC[-2],Sheet1!R3C2:R802C9,8,FALSE) -> 193.40780324043186 | E333: =IF(VLOOKUP(RC[-3],Sheet1!R3C2:R803C11,10,FALSE)=0,"",VLOOKUP(Sheet2!RC[-3],Sheet1!R[1]C[-3]:R[801]C[6],10,FALSE)) ->  | F333: =Sheet1!R375C10 -> 11.524146113687122 | G333: =IF(RC[-3]<0,0,IF(AND(RC[-3]<RC[-1],RC[-3]<2),100,IF(AND(RC[-3]<RC[-1],RC[-3]>=2,RC[-3]<3),95,IF(AND(RC[-3]<RC[-1],RC[-3]>=3,RC[-3]<4),90,IF(AND(RC[-3]<RC[-1],RC[-3]>=4,RC[-3]<5),85,IF(AND(RC[-3]<RC[-1],RC[-3]>=5,RC[-3]<6),80,IF(AND(RC[-3]<RC[-1],RC[-3]>=6,RC[-3]<7),75,IF(AND(RC[-3]<RC[-1],RC[-3]>=7,RC[-3]<8),70,IF(AND(RC[-3]<RC[-1],RC[-3]>=8,RC[-3]<9),65,IF(AND(RC[-3]<RC[-1],RC[-3]>=9,RC[-3]<10),60,IF(AND(RC[-3]<RC[-1],RC[-3]>=10,RC[-3]<11),55,IF(AND(RC[-3]<RC[-1],RC[-3]>=11,RC[-3]<12),50,IF(AND(RC[-3]<RC[-1],RC[-3]>=12,RC[-3]<13),45,IF(AND(RC[-3]<RC[-1],RC[-3]>=13,RC[-3]<14),40,IF(AND(RC[-3]<RC[-1],RC[-3]>=14,RC[-3]<15),35,IF(AND(RC[-3]<RC[-1],RC[-3]>=15,RC[-3]<16),30,IF(AND(RC[-3]<RC[-1],RC[-3]>=16,RC[-3]<17),25,IF(AND(RC[-3]<RC[-1],RC[-3]>=17,RC[-3]<18),20,IF(AND(RC[-3]<RC[-1],RC[-3]>=18,RC[-3]<19),15,IF(AND(RC[-3]<RC[-1],RC[-3]>=19,RC[-3]<20),10,IF(AND(RC[-3]<RC[-1],RC[-3]>=20,RC[-3]<21),5,IF(AND(RC[-3]<RC[-1],RC[-3]>=21),0,IF(AND(RC[-3]>RC[-1],RC[-3]>=2,RC[-3]<3),90,IF(AND(RC[-3]>RC[-1],RC[-3]>=3,RC[-3]<4),90,IF(AND(RC[-3]>RC[-1],RC[-3]>=4,RC[-3]<5),80,IF(AND(RC[-3]>RC[-1],RC[-3]>=5,RC[-3]<6),70,IF(AND(RC[-3]>RC[-1],RC[-3]>=6,RC[-3]<7),60,IF(AND(RC[-3]>RC[-1],RC[-3]>=7,RC[-3]<8),50,IF(AND(RC[-3]>RC[-1],RC[-3]>=8,RC[-3]<9),40,IF(AND(RC[-3]>RC[-1],RC[-3]>=9,RC[-3]<10),30,IF(AND(RC[-3]>RC[-1],RC[-3]>=10,RC[-3]<11),20,IF(AND(RC[-3]>RC[-1],RC[-3]>=11,RC[-3]<12),10,IF(AND(RC[-3]>RC[-1],RC[-3]>=12),0))))))))))))))))))))))))))))))))) -> 0 | H333: =IF(RC[-3]="","",IF(RC[-3]<0.3,100,IF(AND(RC[-3]>=0.3,RC[-3]>0.4),95,IF(AND(RC[-3]>=0.4,RC[-3]<0.5),90,IF(AND(RC[-3]>=0.5,RC[-3]<0.6),85,IF(AND(RC[-3]>=0.6,RC[-3]<0.7),80,IF(AND(RC[-3]>=0.6,RC[-3]<1),80,IF(AND(RC[-3]>1,RC[-3]<2),50,IF(RC[-3]>2,0))))))))) ->  | I333: =IF(RC[-1]="",RC[-2],0.7*RC[-1]+0.3*RC[-2]) -> 0
A334: سر. گروه بهشهر | B334: وصنا | C334: =VLOOKUP(RC[-1],Sheet1!R3C2:R802C3,2,FALSE) -> سرمایه گذاریها | D334: =VLOOKUP(RC[-2],Sheet1!R3C2:R802C9,8,FALSE) -> 10.661634533786719 | E334: =IF(VLOOKUP(RC[-3],Sheet1!R3C2:R803C11,10,FALSE)=0,"",VLOOKUP(Sheet2!RC[-3],Sheet1!R[1]C[-3]:R[801]C[6],10,FALSE)) -> 0.68 | F334: =Sheet1!R375C10 -> 11.524146113687122 | G334: =IF(RC[-3]<0,0,IF(AND(RC[-3]<RC[-1],RC[-3]<2),100,IF(AND(RC[-3]<RC[-1],RC[-3]>=2,RC[-3]<3),95,IF(AND(RC[-3]<RC[-1],RC[-3]>=3,RC[-3]<4),90,IF(AND(RC[-3]<RC[-1],RC[-3]>=4,RC[-3]<5),85,IF(AND(RC[-3]<RC[-1],RC[-3]>=5,RC[-3]<6),80,IF(AND(RC[-3]<RC[-1],RC[-3]>=6,RC[-3]<7),75,IF(AND(RC[-3]<RC[-1],RC[-3]>=7,RC[-3]<8),70,IF(AND(RC[-3]<RC[-1],RC[-3]>=8,RC[-3]<9),65,IF(AND(RC[-3]<RC[-1],RC[-3]>=9,RC[-3]<10),60,IF(AND(RC[-3]<RC[-1],RC[-3]>=10,RC[-3]<11),55,IF(AND(RC[-3]<RC[-1],RC[-3]>=11,RC[-3]<12),50,IF(AND(RC[-3]<RC[-1],RC[-3]>=12,RC[-3]<13),45,IF(AND(RC[-3]<RC[-1],RC[-3]>=13,RC[-3]<14),40,IF(AND(RC[-3]<RC[-1],RC[-3]>=14,RC[-3]<15),35,IF(AND(RC[-3]<RC[-1],RC[-3]>=15,RC[-3]<16),30,IF(AND(RC[-3]<RC[-1],RC[-3]>=16,RC[-3]<17),25,IF(AND(RC[-3]<RC[-1],RC[-3]>=17,RC[-3]<18),20,IF(AND(RC[-3]<RC[-1],RC[-3]>=18,RC[-3]<19),15,IF(AND(RC[-3]<RC[-1],RC[-3]>=19,RC[-3]<20),10,IF(AND(RC[-3]<RC[-1],RC[-3]>=20,RC[-3]<21),5,IF(AND(RC[-3]<RC[-1],RC[-3]>=21),0,IF(AND(RC[-3]>RC[-1],RC[-3]>=2,RC[-3]<3),90,IF(AND(RC[-3]>RC[-1],RC[-3]>=3,RC[-3]<4),90,IF(AND(RC[-3]>RC[-1],RC[-3]>=4,RC[-3]<5),80,IF(AND(RC[-3]>RC[-1],RC[-3]>=5,RC[-3]<6),70,IF(AND(RC[-3]>RC[-1],RC[-3]>=6,RC[-3]<7),60,IF(AND(RC[-3]>RC[-1],RC[-3]>=7,RC[-3]<8),50,IF(AND(RC[-3]>RC[-1],RC[-3]>=8,RC[-3]<9),40,IF(AND(RC[-3]>RC[-1],RC[-3]>=9,RC[-3]<10),30,IF(AND(RC[-3]>RC[-1],RC[-3]>=10,RC[-3]<11),20,IF(AND(RC[-3]>RC[-1],RC[-3]>=11,RC[-3]<12),10,IF(AND(RC[-3]>RC[-1],RC[-3]>=12),0))))))))))))))))))))))))))))))))) -> 55 | H334: =IF(RC[-3]="","",IF(RC[-3]<0.3,100,IF(AND(RC[-3]>=0.3,RC[-3]>0.4),95,IF(AND(RC[-3]>=0.4,RC[-3]<0.5),90,IF(AND(RC[-3]>=0.5,RC[-3]<0.6),85,IF(AND(RC[-3]>=0.6,RC[-3]<0.7),80,IF(AND(RC[-3]>=0.6,RC[-3]<1),80,IF(AND(RC[-3]>1,RC[-3]<2),50,IF(RC[-3]>2,0))))))))) -> 95 | I334: =IF(RC[-1]="",RC[-2],0.7*RC[-1]+0.3*RC[-2]) -> 83
A335: سر. لقمان | B335: ولقمان | C335: =VLOOKUP(RC[-1],Sheet1!R3C2:R802C3,2,FALSE) -> سرمایه گذاریها | D335: =VLOOKUP(RC[-2],Sheet1!R3C2:R802C9,8,FALSE) -> -8.6163235294117655 | E335: =IF(VLOOKUP(RC[-3],Sheet1!R3C2:R803C11,10,FALSE)=0,"",VLOOKUP(Sheet2!RC[-3],Sheet1!R[1]C[-3]:R[801]C[6],10,FALSE)) -> 2 | F335: =Sheet1!R375C10 -> 11.524146113687122 | G335: =IF(RC[-3]<0,0,IF(AND(RC[-3]<RC[-1],RC[-3]<2),100,IF(AND(RC[-3]<RC[-1],RC[-3]>=2,RC[-3]<3),95,IF(AND(RC[-3]<RC[-1],RC[-3]>=3,RC[-3]<4),90,IF(AND(RC[-3]<RC[-1],RC[-3]>=4,RC[-3]<5),85,IF(AND(RC[-3]<RC[-1],RC[-3]>=5,RC[-3]<6),80,IF(AND(RC[-3]<RC[-1],RC[-3]>=6,RC[-3]<7),75,IF(AND(RC[-3]<RC[-1],RC[-3]>=7,RC[-3]<8),70,IF(AND(RC[-3]<RC[-1],RC[-3]>=8,RC[-3]<9),65,IF(AND(RC[-3]<RC[-1],RC[-3]>=9,RC[-3]<10),60,IF(AND(RC[-3]<RC[-1],RC[-3]>=10,RC[-3]<11),55,IF(AND(RC[-3]<RC[-1],RC[-3]>=11,RC[-3]<12),50,IF(AND(RC[-3]<RC[-1],RC[-3]>=12,RC[-3]<13),45,IF(AND(RC[-3]<RC[-1],RC[-3]>=13,RC[-3]<14),40,IF(AND(RC[-3]<RC[-1],RC[-3]>=14,RC[-3]<15),35,IF(AND(RC[-3]<RC[-1],RC[-3]>=15,RC[-3]<16),30,IF(AND(RC[-3]<RC[-1],RC[-3]>=16,RC[-3]<17),25,IF(AND(RC[-3]<RC[-1],RC[-3]>=17,RC[-3]<18),20,IF(AND(RC[-3]<RC[-1],RC[-3]>=18,RC[-3]<19),15,IF(AND(RC[-3]<RC[-1],RC[-3]>=19,RC[-3]<20),10,IF(AND(RC[-3]<RC[-1],RC[-3]>=20,RC[-3]<21),5,IF(AND(RC[-3]<RC[-1],RC[-3]>=21),0,IF(AND(RC[-3]>RC[-1],RC[-3]>=2,RC[-3]<3),90,IF(AND(RC[-3]>RC[-1],RC[-3]>=3,RC[-3]<4),90,IF(AND(RC[-3]>RC[-1],RC[-3]>=4,RC[-3]<5),80,IF(AND(RC[-3]>RC[-1],RC[-3]>=5,RC[-3]<6),70,IF(AND(RC[-3]>RC[-1],RC[-3]>=6,RC[-3]<7),60,IF(AND(RC[-3]>RC[-1],RC[-3]>=7,RC[-3]<8),50,IF(AND(RC[-3]>RC[-1],RC[-3]>=8,RC[-3]<9),40,IF(AND(RC[-3]>RC[-1],RC[-3]>=9,RC[-3]<10),30,IF(AND(RC[-3]>RC[-1],RC[-3]>=10,RC[-3]<11),20,IF(AND(RC[-3]>RC[-1],RC[-3]>=11,RC[-3]<12),10,IF(AND(RC[-3]>RC[-1],RC[-3]>=12),0))))))))))))))))))))))))))))))))) -> 0 | H335: =IF(RC[-3]="","",IF(RC[-3]<0.3,100,IF(AND(RC[-3]>=0.3,RC[-3]>0.4),95,IF(AND(RC[-3]>=0.4,RC[-3]<0.5),90,IF(AND(RC[-3]>=0.5,RC[-3]<0.6),85,IF(AND(RC[-3]>=0.6,RC[-3]<0.7),80,IF(AND(RC[-3]>=0.6,RC[-3]<1),80,IF(AND(RC[-3]>1,RC[-3]<2),50,IF(RC[-3]>2,0))))))))) -> 95 | I335: =IF(RC[-1]="",RC[-2],0.7*RC[-1]+0.3*RC[-2]) -> 66.5
A336: سر. مالی سپهر صادرات | B336: وسپهر | C336: =VLOOKUP(RC[-1],Sheet1!R3C2:R802C3,2,FALSE) -> سرمایه گذاریها | D336: =VLOOKUP(RC[-2],Sheet1!R3C2:R802C9,8,FALSE) -> 5.6131771228585476 | E336: =IF(VLOOKUP(RC[-3],Sheet1!R3C2:R803C11,10,FALSE)=0,"",VLOOKUP(Sheet2!RC[-3],Sheet1!R[1]C[-3]:R[801]C[6],10,FALSE)) -> 0.4 | F336: =Sheet1!R375C10 -> 11.524146113687122 | G336: =IF(RC[-3]<0,0,IF(AND(RC[-3]<RC[-1],RC[-3]<2),100,IF(AND(RC[-3]<RC[-1],RC[-3]>=2,RC[-3]<3),95,IF(AND(RC[-3]<RC[-1],RC[-3]>=3,RC[-3]<4),90,IF(AND(RC[-3]<RC[-1],RC[-3]>=4,RC[-3]<5),85,IF(AND(RC[-3]<RC[-1],RC[-3]>=5,RC[-3]<6),80,IF(AND(RC[-3]<RC[-1],RC[-3]>=6,RC[-3]<7),75,IF(AND(RC[-3]<RC[-1],RC[-3]>=7,RC[-3]<8),70,IF(AND(RC[-3]<RC[-1],RC[-3]>=8,RC[-3]<9),65,IF(AND(RC[-3]<RC[-1],RC[-3]>=9,RC[-3]<10),60,IF(AND(RC[-3]<RC[-1],RC[-3]>=10,RC[-3]<11),55,IF(AND(RC[-3]<RC[-1],RC[-3]>=11,RC[-3]<12),50,IF(AND(RC[-3]<RC[-1],RC[-3]>=12,RC[-3]<13),45,IF(AND(RC[-3]<RC[-1],RC[-3]>=13,RC[-3]<14),40,IF(AND(RC[-3]<RC[-1],RC[-3]>=14,RC[-3]<15),35,IF(AND(RC[-3]<RC[-1],RC[-3]>=15,RC[-3]<16),30,IF(AND(RC[-3]<RC[-1],RC[-3]>=16,RC[-3]<17),25,IF(AND(RC[-3]<RC[-1],RC[-3]>=17,RC[-3]<18),20,IF(AND(RC[-3]<RC[-1],RC[-3]>=18,RC[-3]<19),15,IF(AND(RC[-3]<RC[-1],RC[-3]>=19,RC[-3]<20),10,IF(AND(RC[-3]<RC[-1],RC[-3]>=20,RC[-3]<21),5,IF(AND(RC[-3]<RC[-1],RC[-3]>=21),0,IF(AND(RC[-3]>RC[-1],RC[-3]>=2,RC[-3]<3),90,IF(AND(RC[-3]>RC[-1],RC[-3]>=3,RC[-3]<4),90,IF(AND(RC[-3]>RC[-1],RC[-3]>=4,RC[-3]<5),80,IF(AND(RC[-3]>RC[-1],RC[-3]>=5,RC[-3]<6),70,IF(AND(RC[-3]>RC[-1],RC[-3]>=6,RC[-3]<7),60,IF(AND(RC[-3]>RC[-1],RC[-3]>=7,RC[-3]<8),50,IF(AND(RC[-3]>RC[-1],RC[-3]>=8,RC[-3]<9),40,IF(AND(RC[-3]>RC[-1],RC[-3]>=9,RC[-3]<10),30,IF(AND(RC[-3]>RC[-1],RC[-3]>=10,RC[-3]<11),20,IF(AND(RC[-3]>RC[-1],RC[-3]>=11,RC[-3]<12),10,IF(AND(RC[-3]>RC[-1],RC[-3]>=12),0))))))))))))))))))))))))))))))))) -> 80 | H336: =IF(RC[-3]="","",IF(RC[-3]<0.3,100,IF(AND(RC[-3]>=0.3,RC[-3]>0.4),95,IF(AND(RC[-3]>=0.4,RC[-3]<0.5),90,IF(AND(RC[-3]>=0.5,RC[-3]<0.6),85,IF(AND(RC[-3]>=0.6,RC[-3]<0.7),80,IF(AND(RC[-3]>=0.6,RC[-3]<1),80,IF(AND(RC[-3]>1,RC[-3]<2),50,IF(RC[-3]>2,0))))))))) -> 90 | I336: =IF(RC[-1]="",RC[-2],0.7*RC[-1]+0.3*RC[-2]) -> 87
A337: سر. معیار صنعت پارس | B337: معیار | C337: =VLOOKUP(RC[-1],Sheet1!R3C2:R802C3,2,FALSE) -> سرمایه گذاریها | D337: =VLOOKUP(RC[-2],Sheet1!R3C2:R802C9,8,FALSE) -> 10.784352350023692 | E337: =IF(VLOOKUP(RC[-3],Sheet1!R3C2:R803C11,10,FALSE)=0,"",VLOOKUP(Sheet2!RC[-3],Sheet1!R[1]C[-3]:R[801]C[6],10,FALSE)) ->  | F337: =Sheet1!R375C10 -> 11.524146113687122 | G337: =IF(RC[-3]<0,0,IF(AND(RC[-3]<RC[-1],RC[-3]<2),100,IF(AND(RC[-3]<RC[-1],RC[-3]>=2,RC[-3]<3),95,IF(AND(RC[-3]<RC[-1],RC[-3]>=3,RC[-3]<4),90,IF(AND(RC[-3]<RC[-1],RC[-3]>=4,RC[-3]<5),85,IF(AND(RC[-3]<RC[-1],RC[-3]>=5,RC[-3]<6),80,IF(AND(RC[-3]<RC[-1],RC[-3]>=6,RC[-3]<7),75,IF(AND(RC[-3]<RC[-1],RC[-3]>=7,RC[-3]<8),70,IF(AND(RC[-3]<RC[-1],RC[-3]>=8,RC[-3]<9),65,IF(AND(RC[-3]<RC[-1],RC[-3]>=9,RC[-3]<10),60,IF(AND(RC[-3]<RC[-1],RC[-3]>=10,RC[-3]<11),55,IF(AND(RC[-3]<RC[-1],RC[-3]>=11,RC[-3]<12),50,IF(AND(RC[-3]<RC[-1],RC[-3]>=12,RC[-3]<13),45,IF(AND(RC[-3]<RC[-1],RC[-3]>=13,RC[-3]<14),40,IF(AND(RC[-3]<RC[-1],RC[-3]>=14,RC[-3]<15),35,IF(AND(RC[-3]<RC[-1],RC[-3]>=15,RC[-3]<16),30,IF(AND(RC[-3]<RC[-1],RC[-3]>=16,RC[-3]<17),25,IF(AND(RC[-3]<RC[-1],RC[-3]>=17,RC[-3]<18),20,IF(AND(RC[-3]<RC[-1],RC[-3]>=18,RC[-3]<19),15,IF(AND(RC[-3]<RC[-1],RC[-3]>=19,RC[-3]<20),10,IF(AND(RC[-3]<RC[-1],RC[-3]>=20,RC[-3]<21),5,IF(AND(RC[-3]<RC[-1],RC[-3]>=21),0,IF(AND(RC[-3]>RC[-1],RC[-3]>=2,RC[-3]<3),90,IF(AND(RC[-3]>RC[-1],RC[-3]>=3,RC[-3]<4),90,IF(AND(RC[-3]>RC[-1],RC[-3]>=4,RC[-3]<5),80,IF(AND(RC[-3]>RC[-1],RC[-3]>=5,RC[-3]<6),70,IF(AND(RC[-3]>RC[-1],RC[-3]>=6,RC[-3]<7),60,IF(AND(RC[-3]>RC[-1],RC[-3]>=7,RC[-3]<8),50,IF(AND(RC[-3]>RC[-1],RC[-3]>=8,RC[-3]<9),40,IF(AND(RC[-3]>RC[-1],RC[-3]>=9,RC[-3]<10),30,IF(AND(RC[-3]>RC[-1],RC[-3]>=10,RC[-3]<11),20,IF(AND(RC[-3]>RC[-1],RC[-3]>=11,RC[-3]<12),10,IF(AND(RC[-3]>RC[-1],RC[-3]>=12),0))))))))))))))))))))))))))))))))) -> 55 | H337: =IF(RC[-3]="","",IF(RC[-3]<0.3,100,IF(AND(RC[-3]>=0.3,RC[-3]>0.4),95,IF(AND(RC[-3]>=0.4,RC[-3]<0.5),90,IF(AND(RC[-3]>=0.5,RC[-3]<0.6),85,IF(AND(RC[-3]>=0.6,RC[-3]<0.7),80,IF(AND(RC[-3]>=0.6,RC[-3]<1),80,IF(AND(RC[-3]>1,RC[-3]<2),50,IF(RC[-3]>2,0))))))))) ->  | I337: =IF(RC[-1]="",RC[-2],0.7*RC[-1]+0.3*RC[-2]) -> 55
A338: سر. ملت | B338: وملت | C338: =VLOOKUP(RC[-1],Sheet1!R3C2:R802C3,2,FALSE) -> سرمایه گذاریها | D338: =VLOOKUP(RC[-2],Sheet1!R3C2:R802C9,8,FALSE) -> 9.2584375000000012 | E338: =IF(VLOOKUP(RC[-3],Sheet1!R3C2:R803C11,10,FALSE)=0,"",VLOOKUP(Sheet2!RC[-3],Sheet1!R[1]C[-3]:R[801]C[6],10,FALSE)) -> 2.5 | F338: =Sheet1!R375C10 -> 11.524146113687122 | G338: =IF(RC[-3]<0,0,IF(AND(RC[-3]<RC[-1],RC[-3]<2),100,IF(AND(RC[-3]<RC[-1],RC[-3]>=2,RC[-3]<3),95,IF(AND(RC[-3]<RC[-1],RC[-3]>=3,RC[-3]<4),90,IF(AND(RC[-3]<RC[-1],RC[-3]>=4,RC[-3]<5),85,IF(AND(RC[-3]<RC[-1],RC[-3]>=5,RC[-3]<6),80,IF(AND(RC[-3]<RC[-1],RC[-3]>=6,RC[-3]<7),75,IF(AND(RC[-3]<RC[-1],RC[-3]>=7,RC[-3]<8),70,IF(AND(RC[-3]<RC[-1],RC[-3]>=8,RC[-3]<9),65,IF(AND(RC[-3]<RC[-1],RC[-3]>=9,RC[-3]<10),60,IF(AND(RC[-3]<RC[-1],RC[-3]>=10,RC[-3]<11),55,IF(AND(RC[-3]<RC[-1],RC[-3]>=11,RC[-3]<12),50,IF(AND(RC[-3]<RC[-1],RC[-3]>=12,RC[-3]<13),45,IF(AND(RC[-3]<RC[-1],RC[-3]>=13,RC[-3]<14),40,IF(AND(RC[-3]<RC[-1],RC[-3]>=14,RC[-3]<15),35,IF(AND(RC[-3]<RC[-1],RC[-3]>=15,RC[-3]<16),30,IF(AND(RC[-3]<RC[-1],RC[-3]>=16,RC[-3]<17),25,IF(AND(RC[-3]<RC[-1],RC[-3]>=17,RC[-3]<18),20,IF(AND(RC[-3]<RC[-1],RC[-3]>=18,RC[-3]<19),15,IF(AND(RC[-3]<RC[-1],RC[-3]>=19,RC[-3]<20),10,IF(AND(RC[-3]<RC[-1],RC[-3]>=20,RC[-3]<21),5,IF(AND(RC[-3]<RC[-1],RC[-3]>=21),0,IF(AND(RC[-3]>RC[-1],RC[-3]>=2,RC[-3]<3),90,IF(AND(RC[-3]>RC[-1],RC[-3]>=3,RC[-3]<4),90,IF(AND(RC[-3]>RC[-1],RC[-3]>=4,RC[-3]<5),80,IF(AND(RC[-3]>RC[-1],RC[-3]>=5,RC[-3]<6),70,IF(AND(RC[-3]>RC[-1],RC[-3]>=6,RC[-3]<7),60,IF(AND(RC[-3]>RC[-1],RC[-3]>=7,RC[-3]<8),50,IF(AND(RC[-3]>RC[-1],RC[-3]>=8,RC[-3]<9),40,IF(AND(RC[-3]>RC[-1],RC[-3]>=9,RC[-3]<10),30,IF(AND(RC[-3]>RC[-1],RC[-3]>=10,RC[-3]<11),20,IF(AND(RC[-3]>RC[-1],RC[-3]>=11,RC[-3]<12),10,IF(AND(RC[-3]>RC[-1],RC[-3]>=12),0))))))))))))))))))))))))))))))))) -> 60 | H338: =IF(RC[-3]="","",IF(RC[-3]<0.3,100,IF(AND(RC[-3]>=0.3,RC[-3]>0.4),95,IF(AND(RC[-3]>=0.4,RC[-3]<0.5),90,IF(AND(RC[-3]>=0.5,RC[-3]<0.6),85,IF(AND(RC[-3]>=0.6,RC[-3]<0.7),80,IF(AND(RC[-3]>=0.6,RC[-3]<1),80,IF(AND(RC[-3]>1,RC[-3]<2),50,IF(RC[-3]>2,0))))))))) -> 95 | I338: =IF(RC[-1]="",RC[-2],0.7*RC[-1]+0.3*RC[-2]) -> 84.5
A339: سر. ملی | B339: ونیکی | C339: =VLOOKUP(RC[-1],Sheet1!R3C2:R802C3,2,FALSE) -> سرمایه گذاریها | D339: =VLOOKUP(RC[-2],Sheet1!R3C2:R802C9,8,FALSE) -> 3.4645697307324999 | E339: =IF(VLOOKUP(RC[-3],Sheet1!R3C2:R803C11,10,FALSE)=0,"",VLOOKUP(Sheet2!RC[-3],Sheet1!R[1]C[-3]:R[801]C[6],10,FALSE)) -> 0.6 | F339: =Sheet1!R375C10 -> 11.524146113687122 | G339: =IF(RC[-3]<0,0,IF(AND(RC[-3]<RC[-1],RC[-3]<2),100,IF(AND(RC[-3]<RC[-1],RC[-3]>=2,RC[-3]<3),95,IF(AND(RC[-3]<RC[-1],RC[-3]>=3,RC[-3]<4),90,IF(AND(RC[-3]<RC[-1],RC[-3]>=4,RC[-3]<5),85,IF(AND(RC[-3]<RC[-1],RC[-3]>=5,RC[-3]<6),80,IF(AND(RC[-3]<RC[-1],RC[-3]>=6,RC[-3]<7),75,IF(AND(RC[-3]<RC[-1],RC[-3]>=7,RC[-3]<8),70,IF(AND(RC[-3]<RC[-1],RC[-3]>=8,RC[-3]<9),65,IF(AND(RC[-3]<RC[-1],RC[-3]>=9,RC[-3]<10),60,IF(AND(RC[-3]<RC[-1],RC[-3]>=10,RC[-3]<11),55,IF(AND(RC[-3]<RC[-1],RC[-3]>=11,RC[-3]<12),50,IF(AND(RC[-3]<RC[-1],RC[-3]>=12,RC[-3]<13),45,IF(AND(RC[-3]<RC[-1],RC[-3]>=13,RC[-3]<14),40,IF(AND(RC[-3]<RC[-1],RC[-3]>=14,RC[-3]<15),35,IF(AND(RC[-3]<RC[-1],RC[-3]>=15,RC[-3]<16),30,IF(AND(RC[-3]<RC[-1],RC[-3]>=16,RC[-3]<17),25,IF(AND(RC[-3]<RC[-1],RC[-3]>=17,RC[-3]<18),20,IF(AND(RC[-3]<RC[-1],RC[-3]>=18,RC[-3]<19),15,IF(AND(RC[-3]<RC[-1],RC[-3]>=19,RC[-3]<20),10,IF(AND(RC[-3]<RC[-1],RC[-3]>=20,RC[-3]<21),5,IF(AND(RC[-3]<RC[-1],RC[-3]>=21),0,IF(AND(RC[-3]>RC[-1],RC[-3]>=2,RC[-3]<3),90,IF(AND(RC[-3]>RC[-1],RC[-3]>=3,RC[-3]<4),90,IF(AND(RC[-3]>RC[-1],RC[-3]>=4,RC[-3]<5),80,IF(AND(RC[-3]>RC[-1],RC[-3]>=5,RC[-3]<6),70,IF(AND(RC[-3]>RC[-1],RC[-3]>=6,RC[-3]<7),60,IF(AND(RC[-3]>RC[-1],RC[-3]>=7,RC[-3]<8),50,IF(AND(RC[-3]>RC[-1],RC[-3]>=8,RC[-3]<9),40,IF(AND(RC[-3]>RC[-1],RC[-3]>=9,RC[-3]<10),30,IF(AND(RC[-3]>RC[-1],RC[-3]>=10,RC[-3]<11),20,IF(AND(RC[-3]>RC[-1],RC[-3]>=11,RC[-3]<12),10,IF(AND(RC[-3]>RC[-1],RC[-3]>=12),0))))))))))))))))))))))))))))))))) -> 90 | H339: =IF(RC[-3]="","",IF(RC[-3]<0.3,100,IF(AND(RC[-3]>=0.3,RC[-3]>0.4),95,IF(AND(RC[-3]>=0.4,RC[-3]<0.5),90,IF(AND(RC[-3]>=0.5,RC[-3]<0.6),85,IF(AND(RC[-3]>=0.6,RC[-3]<0.7),80,IF(AND(RC[-3]>=0.6,RC[-3]<1),80,IF(AND(RC[-3]>1,RC[-3]<2),50,IF(RC[-3]>2,0))))))))) -> 95 | I339: =IF(RC[-1]="",RC[-2],0.7*RC[-1]+0.3*RC[-2]) -> 93.5
A340: سر. هامون صبا | B340: وهامون | C340: =VLOOKUP(RC[-1],Sheet1!R3C2:R802C3,2,FALSE) -> سرمایه گذاریها | D340: =VLOOKUP(RC[-2],Sheet1!R3C2:R802C9,8,FALSE) -> 1.8763647680896041 | E340: =IF(VLOOKUP(RC[-3],Sheet1!R3C2:R803C11,10,FALSE)=0,"",VLOOKUP(Sheet2!RC[-3],Sheet1!R[1]C[-3]:R[801]C[6],10,FALSE)) -> 0.81 | F340: =Sheet1!R375C10 -> 11.524146113687122 | G340: =IF(RC[-3]<0,0,IF(AND(RC[-3]<RC[-1],RC[-3]<2),100,IF(AND(RC[-3]<RC[-1],RC[-3]>=2,RC[-3]<3),95,IF(AND(RC[-3]<RC[-1],RC[-3]>=3,RC[-3]<4),90,IF(AND(RC[-3]<RC[-1],RC[-3]>=4,RC[-3]<5),85,IF(AND(RC[-3]<RC[-1],RC[-3]>=5,RC[-3]<6),80,IF(AND(RC[-3]<RC[-1],RC[-3]>=6,RC[-3]<7),75,IF(AND(RC[-3]<RC[-1],RC[-3]>=7,RC[-3]<8),70,IF(AND(RC[-3]<RC[-1],RC[-3]>=8,RC[-3]<9),65,IF(AND(RC[-3]<RC[-1],RC[-3]>=9,RC[-3]<10),60,IF(AND(RC[-3]<RC[-1],RC[-3]>=10,RC[-3]<11),55,IF(AND(RC[-3]<RC[-1],RC[-3]>=11,RC[-3]<12),50,IF(AND(RC[-3]<RC[-1],RC[-3]>=12,RC[-3]<13),45,IF(AND(RC[-3]<RC[-1],RC[-3]>=13,RC[-3]<14),40,IF(AND(RC[-3]<RC[-1],RC[-3]>=14,RC[-3]<15),35,IF(AND(RC[-3]<RC[-1],RC[-3]>=15,RC[-3]<16),30,IF(AND(RC[-3]<RC[-1],RC[-3]>=16,RC[-3]<17),25,IF(AND(RC[-3]<RC[-1],RC[-3]>=17,RC[-3]<18),20,IF(AND(RC[-3]<RC[-1],RC[-3]>=18,RC[-3]<19),15,IF(AND(RC[-3]<RC[-1],RC[-3]>=19,RC[-3]<20),10,IF(AND(RC[-3]<RC[-1],RC[-3]>=20,RC[-3]<21),5,IF(AND(RC[-3]<RC[-1],RC[-3]>=21),0,IF(AND(RC[-3]>RC[-1],RC[-3]>=2,RC[-3]<3),90,IF(AND(RC[-3]>RC[-1],RC[-3]>=3,RC[-3]<4),90,IF(AND(RC[-3]>RC[-1],RC[-3]>=4,RC[-3]<5),80,IF(AND(RC[-3]>RC[-1],RC[-3]>=5,RC[-3]<6),70,IF(AND(RC[-3]>RC[-1],RC[-3]>=6,RC[-3]<7),60,IF(AND(RC[-3]>RC[-1],RC[-3]>=7,RC[-3]<8),50,IF(AND(RC[-3]>RC[-1],RC[-3]>=8,RC[-3]<9),40,IF(AND(RC[-3]>RC[-1],RC[-3]>=9,RC[-3]<10),30,IF(AND(RC[-3]>RC[-1],RC[-3]>=10,RC[-3]<11),20,IF(AND(RC[-3]>RC[-1],RC[-3]>=11,RC[-3]<12),10,IF(AND(RC[-3]>RC[-1],RC[-3]>=12),0))))))))))))))))))))))))))))))))) -> 100 | H340: =IF(RC[-3]="","",IF(RC[-3]<0.3,100,IF(AND(RC[-3]>=0.3,RC[-3]>0.4),95,IF(AND(RC[-3]>=0.4,RC[-3]<0.5),90,IF(AND(RC[-3]>=0.5,RC[-3]<0.6),85,IF(AND(RC[-3]>=0.6,RC[-3]<0.7),80,IF(AND(RC[-3]>=0.6,RC[-3]<1),80,IF(AND(RC[-3]>1,RC[-3]<2),50,IF(RC[-3]>2,0))))))))) -> 95 | I340: =IF(RC[-1]="",RC[-2],0.7*RC[-1]+0.3*RC[-2]) -> 96.5
A341: سر. و خدمات مدیریت ص. بازنشستگی کشوری | B341: مدیریت | C341: =VLOOKUP(RC[-1],Sheet1!R3C2:R802C3,2,FALSE) -> سرمایه گذاریها | D341: =VLOOKUP(RC[-2],Sheet1!R3C2:R802C9,8,FALSE) -> 2.2332738194676325 | E341: =IF(VLOOKUP(RC[-3],Sheet1!R3C2:R803C11,10,FALSE)=0,"",VLOOKUP(Sheet2!RC[-3],Sheet1!R[1]C[-3]:R[801]C[6],10,FALSE)) ->  | F341: =Sheet1!R375C10 -> 11.524146113687122 | G341: =IF(RC[-3]<0,0,IF(AND(RC[-3]<RC[-1],RC[-3]<2),100,IF(AND(RC[-3]<RC[-1],RC[-3]>=2,RC[-3]<3),95,IF(AND(RC[-3]<RC[-1],RC[-3]>=3,RC[-3]<4),90,IF(AND(RC[-3]<RC[-1],RC[-3]>=4,RC[-3]<5),85,IF(AND(RC[-3]<RC[-1],RC[-3]>=5,RC[-3]<6),80,IF(AND(RC[-3]<RC[-1],RC[-3]>=6,RC[-3]<7),75,IF(AND(RC[-3]<RC[-1],RC[-3]>=7,RC[-3]<8),70,IF(AND(RC[-3]<RC[-1],RC[-3]>=8,RC[-3]<9),65,IF(AND(RC[-3]<RC[-1],RC[-3]>=9,RC[-3]<10),60,IF(AND(RC[-3]<RC[-1],RC[-3]>=10,RC[-3]<11),55,IF(AND(RC[-3]<RC[-1],RC[-3]>=11,RC[-3]<12),50,IF(AND(RC[-3]<RC[-1],RC[-3]>=12,RC[-3]<13),45,IF(AND(RC[-3]<RC[-1],RC[-3]>=13,RC[-3]<14),40,IF(AND(RC[-3]<RC[-1],RC[-3]>=14,RC[-3]<15),35,IF(AND(RC[-3]<RC[-1],RC[-3]>=15,RC[-3]<16),30,IF(AND(RC[-3]<RC[-1],RC[-3]>=16,RC[-3]<17),25,IF(AND(RC[-3]<RC[-1],RC[-3]>=17,RC[-3]<18),20,IF(AND(RC[-3]<RC[-1],RC[-3]>=18,RC[-3]<19),15,IF(AND(RC[-3]<RC[-1],RC[-3]>=19,RC[-3]<20),10,IF(AND(RC[-3]<RC[-1],RC[-3]>=20,RC[-3]<21),5,IF(AND(RC[-3]<RC[-1],RC[-3]>=21),0,IF(AND(RC[-3]>RC[-1],RC[-3]>=2,RC[-3]<3),90,IF(AND(RC[-3]>RC[-1],RC[-3]>=3,RC[-3]<4),90,IF(AND(RC[-3]>RC[-1],RC[-3]>=4,RC[-3]<5),80,IF(AND(RC[-3]>RC[-1],RC[-3]>=5,RC[-3]<6),70,IF(AND(RC[-3]>RC[-1],RC[-3]>=6,RC[-3]<7),60,IF(AND(RC[-3]>RC[-1],RC[-3]>=7,RC[-3]<8),50,IF(AND(RC[-3]>RC[-1],RC[-3]>=8,RC[-3]<9),40,IF(AND(RC[-3]>RC[-1],RC[-3]>=9,RC[-3]<10),30,IF(AND(RC[-3]>RC[-1],RC[-3]>=10,RC[-3]<11),20,IF(AND(RC[-3]>RC[-1],RC[-3]>=11,RC[-3]<12),10,IF(AND(RC[-3]>RC[-1],RC[-3]>=12),0))))))))))))))))))))))))))))))))) -> 95 | H341: =IF(RC[-3]="","",IF(RC[-3]<0.3,100,IF(AND(RC[-3]>=0.3,RC[-3]>0.4),95,IF(AND(RC[-3]>=0.4,RC[-3]<0.5),90,IF(AND(RC[-3]>=0.5,RC[-3]<0.6),85,IF(AND(RC[-3]>=0.6,RC[-3]<0.7),80,IF(AND(RC[-3]>=0.6,RC[-3]<1),80,IF(AND(RC[-3]>1,RC[-3]<2),50,IF(RC[-3]>2,0))))))))) ->  | I341: =IF(RC[-1]="",RC[-2],0.7*RC[-1]+0.3*RC[-2]) -> 95
A342: سر. کارکنان صنعت برق زنجان و قزوین | B342: وبرق | C342: =VLOOKUP(RC[-1],Sheet1!R3C2:R802C3,2,FALSE) -> سرمایه گذاریها | D342: =VLOOKUP(RC[-2],Sheet1!R3C2:R802C9,8,FALSE) -> 59.338646121103686 | E342: =IF(VLOOKUP(RC[-3],Sheet1!R3C2:R803C11,10,FALSE)=0,"",VLOOKUP(Sheet2!RC[-3],Sheet1!R[1]C[-3]:R[801]C[6],10,FALSE)) ->  | F342: =Sheet1!R375C10 -> 11.524146113687122 | G342: =IF(RC[-3]<0,0,IF(AND(RC[-3]<RC[-1],RC[-3]<2),100,IF(AND(RC[-3]<RC[-1],RC[-3]>=2,RC[-3]<3),95,IF(AND(RC[-3]<RC[-1],RC[-3]>=3,RC[-3]<4),90,IF(AND(RC[-3]<RC[-1],RC[-3]>=4,RC[-3]<5),85,IF(AND(RC[-3]<RC[-1],RC[-3]>=5,RC[-3]<6),80,IF(AND(RC[-3]<RC[-1],RC[-3]>=6,RC[-3]<7),75,IF(AND(RC[-3]<RC[-1],RC[-3]>=7,RC[-3]<8),70,IF(AND(RC[-3]<RC[-1],RC[-3]>=8,RC[-3]<9),65,IF(AND(RC[-3]<RC[-1],RC[-3]>=9,RC[-3]<10),60,IF(AND(RC[-3]<RC[-1],RC[-3]>=10,RC[-3]<11),55,IF(AND(RC[-3]<RC[-1],RC[-3]>=11,RC[-3]<12),50,IF(AND(RC[-3]<RC[-1],RC[-3]>=12,RC[-3]<13),45,IF(AND(RC[-3]<RC[-1],RC[-3]>=13,RC[-3]<14),40,IF(AND(RC[-3]<RC[-1],RC[-3]>=14,RC[-3]<15),35,IF(AND(RC[-3]<RC[-1],RC[-3]>=15,RC[-3]<16),30,IF(AND(RC[-3]<RC[-1],RC[-3]>=16,RC[-3]<17),25,IF(AND(RC[-3]<RC[-1],RC[-3]>=17,RC[-3]<18),20,IF(AND(RC[-3]<RC[-1],RC[-3]>=18,RC[-3]<19),15,IF(AND(RC[-3]<RC[-1],RC[-3]>=19,RC[-3]<20),10,IF(AND(RC[-3]<RC[-1],RC[-3]>=20,RC[-3]<21),5,IF(AND(RC[-3]<RC[-1],RC[-3]>=21),0,IF(AND(RC[-3]>RC[-1],RC[-3]>=2,RC[-3]<3),90,IF(AND(RC[-3]>RC[-1],RC[-3]>=3,RC[-3]<4),90,IF(AND(RC[-3]>RC[-1],RC[-3]>=4,RC[-3]<5),80,IF(AND(RC[-3]>RC[-1],RC[-3]>=5,RC[-3]<6),70,IF(AND(RC[-3]>RC[-1],RC[-3]>=6,RC[-3]<7),60,IF(AND(RC[-3]>RC[-1],RC[-3]>=7,RC[-3]<8),50,IF(AND(RC[-3]>RC[-1],RC[-3]>=8,RC[-3]<9),40,IF(AND(RC[-3]>RC[-1],RC[-3]>=9,RC[-3]<10),30,IF(AND(RC[-3]>RC[-1],RC[-3]>=10,RC[-3]<11),20,IF(AND(RC[-3]>RC[-1],RC[-3]>=11,RC[-3]<12),10,IF(AND(RC[-3]>RC[-1],RC[-3]>=12),0))))))))))))))))))))))))))))))))) -> 0 | H342: =IF(RC[-3]="","",IF(RC[-3]<0.3,100,IF(AND(RC[-3]>=0.3,RC[-3]>0.4),95,IF(AND(RC[-3]>=0.4,RC[-3]<0.5),90,IF(AND(RC[-3]>=0.5,RC[-3]<0.6),85,IF(AND(RC[-3]>=0.6,RC[-3]<0.7),80,IF(AND(RC[-3]>=0.6,RC[-3]<1),80,IF(AND(RC[-3]>1,RC[-3]<2),50,IF(RC[-3]>2,0))))))))) ->  | I342: =IF(RC[-1]="",RC[-2],0.7*RC[-1]+0.3*RC[-2]) -> 0
A343: سر. کوثر بهمن | B343: وکبهمن | C343: =VLOOKUP(RC[-1],Sheet1!R3C2:R802C3,2,FALSE) -> سرمایه گذاریها | D343: =VLOOKUP(RC[-2],Sheet1!R3C2:R802C9,8,FALSE) -> 3.5770468907444695 | E343: =IF(VLOOKUP(RC[-3],Sheet1!R3C2:R803C11,10,FALSE)=0,"",VLOOKUP(Sheet2!RC[-3],Sheet1!R[1]C[-3]:R[801]C[6],10,FALSE)) -> 0.63 | F343: =Sheet1!R375C10 -> 11.524146113687122 | G343: =IF(RC[-3]<0,0,IF(AND(RC[-3]<RC[-1],RC[-3]<2),100,IF(AND(RC[-3]<RC[-1],RC[-3]>=2,RC[-3]<3),95,IF(AND(RC[-3]<RC[-1],RC[-3]>=3,RC[-3]<4),90,IF(AND(RC[-3]<RC[-1],RC[-3]>=4,RC[-3]<5),85,IF(AND(RC[-3]<RC[-1],RC[-3]>=5,RC[-3]<6),80,IF(AND(RC[-3]<RC[-1],RC[-3]>=6,RC[-3]<7),75,IF(AND(RC[-3]<RC[-1],RC[-3]>=7,RC[-3]<8),70,IF(AND(RC[-3]<RC[-1],RC[-3]>=8,RC[-3]<9),65,IF(AND(RC[-3]<RC[-1],RC[-3]>=9,RC[-3]<10),60,IF(AND(RC[-3]<RC[-1],RC[-3]>=10,RC[-3]<11),55,IF(AND(RC[-3]<RC[-1],RC[-3]>=11,RC[-3]<12),50,IF(AND(RC[-3]<RC[-1],RC[-3]>=12,RC[-3]<13),45,IF(AND(RC[-3]<RC[-1],RC[-3]>=13,RC[-3]<14),40,IF(AND(RC[-3]<RC[-1],RC[-3]>=14,RC[-3]<15),35,IF(AND(RC[-3]<RC[-1],RC[-3]>=15,RC[-3]<16),30,IF(AND(RC[-3]<RC[-1],RC[-3]>=16,RC[-3]<17),25,IF(AND(RC[-3]<RC[-1],RC[-3]>=17,RC[-3]<18),20,IF(AND(RC[-3]<RC[-1],RC[-3]>=18,RC[-3]<19),15,IF(AND(RC[-3]<RC[-1],RC[-3]>=19,RC[-3]<20),10,IF(AND(RC[-3]<RC[-1],RC[-3]>=20,RC[-3]<21),5,IF(AND(RC[-3]<RC[-1],RC[-3]>=21),0,IF(AND(RC[-3]>RC[-1],RC[-3]>=2,RC[-3]<3),90,IF(AND(RC[-3]>RC[-1],RC[-3]>=3,RC[-3]<4),90,IF(AND(RC[-3]>RC[-1],RC[-3]>=4,RC[-3]<5),80,IF(AND(RC[-3]>RC[-1],RC[-3]>=5,RC[-3]<6),70,IF(AND(RC[-3]>RC[-1],RC[-3]>=6,RC[-3]<7),60,IF(AND(RC[-3]>RC[-1],RC[-3]>=7,RC[-3]<8),50,IF(AND(RC[-3]>RC[-1],RC[-3]>=8,RC[-3]<9),40,IF(AND(RC[-3]>RC[-1],RC[-3]>=9,RC[-3]<10),30,IF(AND(RC[-3]>RC[-1],RC[-3]>=10,RC[-3]<11),20,IF(AND(RC[-3]>RC[-1],RC[-3]>=11,RC[-3]<12),10,IF(AND(RC[-3]>RC[-1],RC[-3]>=12),0))))))))))))))))))))))))))))))))) -> 90 | H343: =IF(RC[-3]="","",IF(RC[-3]<0.3,100,IF(AND(RC[-3]>=0.3,RC[-3]>0.4),95,IF(AND(RC[-3]>=0.4,RC[-3]<0.5),90,IF(AND(RC[-3]>=0.5,RC[-3]<0.6),85,IF(AND(RC[-3]>=0.6,RC[-3]<0.7),80,IF(AND(RC[-3]>=0.6,RC[-3]<1),80,IF(AND(RC[-3]>1,RC[-3]<2),50,IF(RC[-3]>2,0))))))))) -> 95 | I343: =IF(RC[-1]="",RC[-2],0.7*RC[-1]+0.3*RC[-2]) -> 93.5
A344: صنعت و تجارت آداک | B344: وآداک | C344: =VLOOKUP(RC[-1],Sheet1!R3C2:R802C3,2,FALSE) -> سرمایه گذاریها | D344: =VLOOKUP(RC[-2],Sheet1!R3C2:R802C9,8,FALSE) -> -26.670939429246669 | E344: =IF(VLOOKUP(RC[-3],Sheet1!R3C2:R803C11,10,FALSE)=0,"",VLOOKUP(Sheet2!RC[-3],Sheet1!R[1]C[-3]:R[801]C[6],10,FALSE)) -> 2 | F344: =Sheet1!R375C10 -> 11.524146113687122 | G344: =IF(RC[-3]<0,0,IF(AND(RC[-3]<RC[-1],RC[-3]<2),100,IF(AND(RC[-3]<RC[-1],RC[-3]>=2,RC[-3]<3),95,IF(AND(RC[-3]<RC[-1],RC[-3]>=3,RC[-3]<4),90,IF(AND(RC[-3]<RC[-1],RC[-3]>=4,RC[-3]<5),85,IF(AND(RC[-3]<RC[-1],RC[-3]>=5,RC[-3]<6),80,IF(AND(RC[-3]<RC[-1],RC[-3]>=6,RC[-3]<7),75,IF(AND(RC[-3]<RC[-1],RC[-3]>=7,RC[-3]<8),70,IF(AND(RC[-3]<RC[-1],RC[-3]>=8,RC[-3]<9),65,IF(AND(RC[-3]<RC[-1],RC[-3]>=9,RC[-3]<10),60,IF(AND(RC[-3]<RC[-1],RC[-3]>=10,RC[-3]<11),55,IF(AND(RC[-3]<RC[-1],RC[-3]>=11,RC[-3]<12),50,IF(AND(RC[-3]<RC[-1],RC[-3]>=12,RC[-3]<13),45,IF(AND(RC[-3]<RC[-1],RC[-3]>=13,RC[-3]<14),40,IF(AND(RC[-3]<RC[-1],RC[-3]>=14,RC[-3]<15),35,IF(AND(RC[-3]<RC[-1],RC[-3]>=15,RC[-3]<16),30,IF(AND(RC[-3]<RC[-1],RC[-3]>=16,RC[-3]<17),25,IF(AND(RC[-3]<RC[-1],RC[-3]>=17,RC[-3]<18),20,IF(AND(RC[-3]<RC[-1],RC[-3]>=18,RC[-3]<19),15,IF(AND(RC[-3]<RC[-1],RC[-3]>=19,RC[-3]<20),10,IF(AND(RC[-3]<RC[-1],RC[-3]>=20,RC[-3]<21),5,IF(AND(RC[-3]<RC[-1],RC[-3]>=21),0,IF(AND(RC[-3]>RC[-1],RC[-3]>=2,RC[-3]<3),90,IF(AND(RC[-3]>RC[-1],RC[-3]>=3,RC[-3]<4),90,IF(AND(RC[-3]>RC[-1],RC[-3]>=4,RC[-3]<5),80,IF(AND(RC[-3]>RC[-1],RC[-3]>=5,RC[-3]<6),70,IF(AND(RC[-3]>RC[-1],RC[-3]>=6,RC[-3]<7),60,IF(AND(RC[-3]>RC[-1],RC[-3]>=7,RC[-3]<8),50,IF(AND(RC[-3]>RC[-1],RC[-3]>=8,RC[-3]<9),40,IF(AND(RC[-3]>RC[-1],RC[-3]>=9,RC[-3]<10),30,IF(AND(RC[-3]>RC[-1],RC[-3]>=10,RC[-3]<11),20,IF(AND(RC[-3]>RC[-1],RC[-3]>=11,RC[-3]<12),10,IF(AND(RC[-3]>RC[-1],RC[-3]>=12),0))))))))))))))))))))))))))))))))) -> 0 | H344: =IF(RC[-3]="","",IF(RC[-3]<0.3,100,IF(AND(RC[-3]>=0.3,RC[-3]>0.4),95,IF(AND(RC[-3]>=0.4,RC[-3]<0.5),90,IF(AND(RC[-3]>=0.5,RC[-3]<0.6),85,IF(AND(RC[-3]>=0.6,RC[-3]<0.7),80,IF(AND(RC[-3]>=0.6,RC[-3]<1),80,IF(AND(RC[-3]>1,RC[-3]<2),50,IF(RC[-3]>2,0))))))))) -> 95 | I344: =IF(RC[-1]="",RC[-2],0.7*RC[-1]+0.3*RC[-2]) -> 66.5
A345: گ مدیریت ارزش سرمایه ص ب کشوری | B345: ومدیر | C345: =VLOOKUP(RC[-1],Sheet1!R3C2:R802C3,2,FALSE) -> سرمایه گذاریها | D345: =VLOOKUP(RC[-2],Sheet1!R3C2:R802C9,8,FALSE) -> 1.6750685454169345 | E345: =IF(VLOOKUP(RC[-3],Sheet1!R3C2:R803C11,10,FALSE)=0,"",VLOOKUP(Sheet2!RC[-3],Sheet1!R[1]C[-3]:R[801]C[6],10,FALSE)) -> 0.6 | F345: =Sheet1!R375C10 -> 11.524146113687122 | G345: =IF(RC[-3]<0,0,IF(AND(RC[-3]<RC[-1],RC[-3]<2),100,IF(AND(RC[-3]<RC[-1],RC[-3]>=2,RC[-3]<3),95,IF(AND(RC[-3]<RC[-1],RC[-3]>=3,RC[-3]<4),90,IF(AND(RC[-3]<RC[-1],RC[-3]>=4,RC[-3]<5),85,IF(AND(RC[-3]<RC[-1],RC[-3]>=5,RC[-3]<6),80,IF(AND(RC[-3]<RC[-1],RC[-3]>=6,RC[-3]<7),75,IF(AND(RC[-3]<RC[-1],RC[-3]>=7,RC[-3]<8),70,IF(AND(RC[-3]<RC[-1],RC[-3]>=8,RC[-3]<9),65,IF(AND(RC[-3]<RC[-1],RC[-3]>=9,RC[-3]<10),60,IF(AND(RC[-3]<RC[-1],RC[-3]>=10,RC[-3]<11),55,IF(AND(RC[-3]<RC[-1],RC[-3]>=11,RC[-3]<12),50,IF(AND(RC[-3]<RC[-1],RC[-3]>=12,RC[-3]<13),45,IF(AND(RC[-3]<RC[-1],RC[-3]>=13,RC[-3]<14),40,IF(AND(RC[-3]<RC[-1],RC[-3]>=14,RC[-3]<15),35,IF(AND(RC[-3]<RC[-1],RC[-3]>=15,RC[-3]<16),30,IF(AND(RC[-3]<RC[-1],RC[-3]>=16,RC[-3]<17),25,IF(AND(RC[-3]<RC[-1],RC[-3]>=17,RC[-3]<18),20,IF(AND(RC[-3]<RC[-1],RC[-3]>=18,RC[-3]<19),15,IF(AND(RC[-3]<RC[-1],RC[-3]>=19,RC[-3]<20),10,IF(AND(RC[-3]<RC[-1],RC[-3]>=20,RC[-3]<21),5,IF(AND(RC[-3]<RC[-1],RC[-3]>=21),0,IF(AND(RC[-3]>RC[-1],RC[-3]>=2,RC[-3]<3),90,IF(AND(RC[-3]>RC[-1],RC[-3]>=3,RC[-3]<4),90,IF(AND(RC[-3]>RC[-1],RC[-3]>=4,RC[-3]<5),80,IF(AND(RC[-3]>RC[-1],RC[-3]>=5,RC[-3]<6),70,IF(AND(RC[-3]>RC[-1],RC[-3]>=6,RC[-3]<7),60,IF(AND(RC[-3]>RC[-1],RC[-3]>=7,RC[-3]<8),50,IF(AND(RC[-3]>RC[-1],RC[-3]>=8,RC[-3]<9),40,IF(AND(RC[-3]>RC[-1],RC[-3]>=9,RC[-3]<10),30,IF(AND(RC[-3]>RC[-1],RC[-3]>=10,RC[-3]<11),20,IF(AND(RC[-3]>RC[-1],RC[-3]>=11,RC[-3]<12),10,IF(AND(RC[-3]>RC[-1],RC[-3]>=12),0))))))))))))))))))))))))))))))))) -> 100 | H345: =IF(RC[-3]="","",IF(RC[-3]<0.3,100,IF(AND(RC[-3]>=0.3,RC[-3]>0.4),95,IF(AND(RC[-3]>=0.4,RC[-3]<0.5),90,IF(AND(RC[-3]>=0.5,RC[-3]<0.6),85,IF(AND(RC[-3]>=0.6,RC[-3]<0.7),80,IF(AND(RC[-3]>=0.6,RC[-3]<1),80,IF(AND(RC[-3]>1,RC[-3]<2),50,IF(RC[-3]>2,0))))))))) -> 95 | I345: =IF(RC[-1]="",RC[-2],0.7*RC[-1]+0.3*RC[-2]) -> 96.5
A346: گروه توسعه مالی مهر آیندگان | B346: ومهان | C346: =VLOOKUP(RC[-1],Sheet1!R3C2:R802C3,2,FALSE) -> سرمایه گذاریها | D346: =VLOOKUP(RC[-2],Sheet1!R3C2:R802C9,8,FALSE) -> 3.1879061147483334 | E346: =IF(VLOOKUP(RC[-3],Sheet1!R3C2:R803C11,10,FALSE)=0,"",VLOOKUP(Sheet2!RC[-3],Sheet1!R[1]C[-3]:R[801]C[6],10,FALSE)) -> 0.6 | F346: =Sheet1!R375C10 -> 11.524146113687122 | G346: =IF(RC[-3]<0,0,IF(AND(RC[-3]<RC[-1],RC[-3]<2),100,IF(AND(RC[-3]<RC[-1],RC[-3]>=2,RC[-3]<3),95,IF(AND(RC[-3]<RC[-1],RC[-3]>=3,RC[-3]<4),90,IF(AND(RC[-3]<RC[-1],RC[-3]>=4,RC[-3]<5),85,IF(AND(RC[-3]<RC[-1],RC[-3]>=5,RC[-3]<6),80,IF(AND(RC[-3]<RC[-1],RC[-3]>=6,RC[-3]<7),75,IF(AND(RC[-3]<RC[-1],RC[-3]>=7,RC[-3]<8),70,IF(AND(RC[-3]<RC[-1],RC[-3]>=8,RC[-3]<9),65,IF(AND(RC[-3]<RC[-1],RC[-3]>=9,RC[-3]<10),60,IF(AND(RC[-3]<RC[-1],RC[-3]>=10,RC[-3]<11),55,IF(AND(RC[-3]<RC[-1],RC[-3]>=11,RC[-3]<12),50,IF(AND(RC[-3]<RC[-1],RC[-3]>=12,RC[-3]<13),45,IF(AND(RC[-3]<RC[-1],RC[-3]>=13,RC[-3]<14),40,IF(AND(RC[-3]<RC[-1],RC[-3]>=14,RC[-3]<15),35,IF(AND(RC[-3]<RC[-1],RC[-3]>=15,RC[-3]<16),30,IF(AND(RC[-3]<RC[-1],RC[-3]>=16,RC[-3]<17),25,IF(AND(RC[-3]<RC[-1],RC[-3]>=17,RC[-3]<18),20,IF(AND(RC[-3]<RC[-1],RC[-3]>=18,RC[-3]<19),15,IF(AND(RC[-3]<RC[-1],RC[-3]>=19,RC[-3]<20),10,IF(AND(RC[-3]<RC[-1],RC[-3]>=20,RC[-3]<21),5,IF(AND(RC[-3]<RC[-1],RC[-3]>=21),0,IF(AND(RC[-3]>RC[-1],RC[-3]>=2,RC[-3]<3),90,IF(AND(RC[-3]>RC[-1],RC[-3]>=3,RC[-3]<4),90,IF(AND(RC[-3]>RC[-1],RC[-3]>=4,RC[-3]<5),80,IF(AND(RC[-3]>RC[-1],RC[-3]>=5,RC[-3]<6),70,IF(AND(RC[-3]>RC[-1],RC[-3]>=6,RC[-3]<7),60,IF(AND(RC[-3]>RC[-1],RC[-3]>=7,RC[-3]<8),50,IF(AND(RC[-3]>RC[-1],RC[-3]>=8,RC[-3]<9),40,IF(AND(RC[-3]>RC[-1],RC[-3]>=9,RC[-3]<10),30,IF(AND(RC[-3]>RC[-1],RC[-3]>=10,RC[-3]<11),20,IF(AND(RC[-3]>RC[-1],RC[-3]>=11,RC[-3]<12),10,IF(AND(RC[-3]>RC[-1],RC[-3]>=12),0))))))))))))))))))))))))))))))))) -> 90 | H346: =IF(RC[-3]="","",IF(RC[-3]<0.3,100,IF(AND(RC[-3]>=0.3,RC[-3]>0.4),95,IF(AND(RC[-3]>=0.4,RC[-3]<0.5),90,IF(AND(RC[-3]>=0.5,RC[-3]<0.6),85,IF(AND(RC[-3]>=0.6,RC[-3]<0.7),80,IF(AND(RC[-3]>=0.6,RC[-3]<1),80,IF(AND(RC[-3]>1,RC[-3]<2),50,IF(RC[-3]>2,0))))))))) -> 95 | I346: =IF(RC[-1]="",RC[-2],0.7*RC[-1]+0.3*RC[-2]) -> 93.5
A347: گسترش سرمایه گذاری ایرانیان | B347: وگستر | C347: =VLOOKUP(RC[-1],Sheet1!R3C2:R802C3,2,FALSE) -> سرمایه گذاریها | D347: =VLOOKUP(RC[-2],Sheet1!R3C2:R802C9,8,FALSE) -> 12.065652956489199 | E347: =IF(VLOOKUP(RC[-3],Sheet1!R3C2:R803C11,10,FALSE)=0,"",VLOOKUP(Sheet2!RC[-3],Sheet1!R[1]C[-3]:R[801]C[6],10,FALSE)) -> 1.8 | F347: =Sheet1!R375C10 -> 11.524146113687122 | G347: =IF(RC[-3]<0,0,IF(AND(RC[-3]<RC[-1],RC[-3]<2),100,IF(AND(RC[-3]<RC[-1],RC[-3]>=2,RC[-3]<3),95,IF(AND(RC[-3]<RC[-1],RC[-3]>=3,RC[-3]<4),90,IF(AND(RC[-3]<RC[-1],RC[-3]>=4,RC[-3]<5),85,IF(AND(RC[-3]<RC[-1],RC[-3]>=5,RC[-3]<6),80,IF(AND(RC[-3]<RC[-1],RC[-3]>=6,RC[-3]<7),75,IF(AND(RC[-3]<RC[-1],RC[-3]>=7,RC[-3]<8),70,IF(AND(RC[-3]<RC[-1],RC[-3]>=8,RC[-3]<9),65,IF(AND(RC[-3]<RC[-1],RC[-3]>=9,RC[-3]<10),60,IF(AND(RC[-3]<RC[-1],RC[-3]>=10,RC[-3]<11),55,IF(AND(RC[-3]<RC[-1],RC[-3]>=11,RC[-3]<12),50,IF(AND(RC[-3]<RC[-1],RC[-3]>=12,RC[-3]<13),45,IF(AND(RC[-3]<RC[-1],RC[-3]>=13,RC[-3]<14),40,IF(AND(RC[-3]<RC[-1],RC[-3]>=14,RC[-3]<15),35,IF(AND(RC[-3]<RC[-1],RC[-3]>=15,RC[-3]<16),30,IF(AND(RC[-3]<RC[-1],RC[-3]>=16,RC[-3]<17),25,IF(AND(RC[-3]<RC[-1],RC[-3]>=17,RC[-3]<18),20,IF(AND(RC[-3]<RC[-1],RC[-3]>=18,RC[-3]<19),15,IF(AND(RC[-3]<RC[-1],RC[-3]>=19,RC[-3]<20),10,IF(AND(RC[-3]<RC[-1],RC[-3]>=20,RC[-3]<21),5,IF(AND(RC[-3]<RC[-1],RC[-3]>=21),0,IF(AND(RC[-3]>RC[-1],RC[-3]>=2,RC[-3]<3),90,IF(AND(RC[-3]>RC[-1],RC[-3]>=3,RC[-3]<4),90,IF(AND(RC[-3]>RC[-1],RC[-3]>=4,RC[-3]<5),80,IF(AND(RC[-3]>RC[-1],RC[-3]>=5,RC[-3]<6),70,IF(AND(RC[-3]>RC[-1],RC[-3]>=6,RC[-3]<7),60,IF(AND(RC[-3]>RC[-1],RC[-3]>=7,RC[-3]<8),50,IF(AND(RC[-3]>RC[-1],RC[-3]>=8,RC[-3]<9),40,IF(AND(RC[-3]>RC[-1],RC[-3]>=9,RC[-3]<10),30,IF(AND(RC[-3]>RC[-1],RC[-3]>=10,RC[-3]<11),20,IF(AND(RC[-3]>RC[-1],RC[-3]>=11,RC[-3]<12),10,IF(AND(RC[-3]>RC[-1],RC[-3]>=12),0))))))))))))))))))))))))))))))))) -> 0 | H347: =IF(RC[-3]="","",IF(RC[-3]<0.3,100,IF(AND(RC[-3]>=0.3,RC[-3]>0.4),95,IF(AND(RC[-3]>=0.4,RC[-3]<0.5),90,IF(AND(RC[-3]>=0.5,RC[-3]<0.6),85,IF(AND(RC[-3]>=0.6,RC[-3]<0.7),80,IF(AND(RC[-3]>=0.6,RC[-3]<1),80,IF(AND(RC[-3]>1,RC[-3]<2),50,IF(RC[-3]>2,0))))))))) -> 95 | I347: =IF(RC[-1]="",RC[-2],0.7*RC[-1]+0.3*RC[-2]) -> 66.5
A348: توسعه سرمایه و صنعت غدیر | B348: سغدیر | C348: =VLOOKUP(RC[-1],Sheet1!R3C2:R802C3,2,FALSE) -> سیمان آهک گچ | D348: =VLOOKUP(RC[-2],Sheet1!R3C2:R802C9,8,FALSE) -> 3.408392831241994 | E348: =IF(VLOOKUP(RC[-3],Sheet1!R3C2:R803C11,10,FALSE)=0,"",VLOOKUP(Sheet2!RC[-3],Sheet1!R[1]C[-3]:R[801]C[6],10,FALSE)) -> 0.68 | F348: =Sheet1!R419C10 -> 6.5383737205402594 | G348: =IF(RC[-3]<0,0,IF(AND(RC[-3]<RC[-1],RC[-3]<2),100,IF(AND(RC[-3]<RC[-1],RC[-3]>=2,RC[-3]<3),95,IF(AND(RC[-3]<RC[-1],RC[-3]>=3,RC[-3]<4),90,IF(AND(RC[-3]<RC[-1],RC[-3]>=4,RC[-3]<5),85,IF(AND(RC[-3]<RC[-1],RC[-3]>=5,RC[-3]<6),80,IF(AND(RC[-3]<RC[-1],RC[-3]>=6,RC[-3]<7),75,IF(AND(RC[-3]<RC[-1],RC[-3]>=7,RC[-3]<8),70,IF(AND(RC[-3]<RC[-1],RC[-3]>=8,RC[-3]<9),65,IF(AND(RC[-3]<RC[-1],RC[-3]>=9,RC[-3]<10),60,IF(AND(RC[-3]<RC[-1],RC[-3]>=10,RC[-3]<11),55,IF(AND(RC[-3]<RC[-1],RC[-3]>=11,RC[-3]<12),50,IF(AND(RC[-3]<RC[-1],RC[-3]>=12,RC[-3]<13),45,IF(AND(RC[-3]<RC[-1],RC[-3]>=13,RC[-3]<14),40,IF(AND(RC[-3]<RC[-1],RC[-3]>=14,RC[-3]<15),35,IF(AND(RC[-3]<RC[-1],RC[-3]>=15,RC[-3]<16),30,IF(AND(RC[-3]<RC[-1],RC[-3]>=16,RC[-3]<17),25,IF(AND(RC[-3]<RC[-1],RC[-3]>=17,RC[-3]<18),20,IF(AND(RC[-3]<RC[-1],RC[-3]>=18,RC[-3]<19),15,IF(AND(RC[-3]<RC[-1],RC[-3]>=19,RC[-3]<20),10,IF(AND(RC[-3]<RC[-1],RC[-3]>=20,RC[-3]<21),5,IF(AND(RC[-3]<RC[-1],RC[-3]>=21),0,IF(AND(RC[-3]>RC[-1],RC[-3]>=2,RC[-3]<3),90,IF(AND(RC[-3]>RC[-1],RC[-3]>=3,RC[-3]<4),90,IF(AND(RC[-3]>RC[-1],RC[-3]>=4,RC[-3]<5),80,IF(AND(RC[-3]>RC[-1],RC[-3]>=5,RC[-3]<6),70,IF(AND(RC[-3]>RC[-1],RC[-3]>=6,RC[-3]<7),60,IF(AND(RC[-3]>RC[-1],RC[-3]>=7,RC[-3]<8),50,IF(AND(RC[-3]>RC[-1],RC[-3]>=8,RC[-3]<9),40,IF(AND(RC[-3]>RC[-1],RC[-3]>=9,RC[-3]<10),30,IF(AND(RC[-3]>RC[-1],RC[-3]>=10,RC[-3]<11),20,IF(AND(RC[-3]>RC[-1],RC[-3]>=11,RC[-3]<12),10,IF(AND(RC[-3]>RC[-1],RC[-3]>=12),0))))))))))))))))))))))))))))))))) -> 90 | H348: =IF(RC[-3]="","",IF(RC[-3]<0.3,100,IF(AND(RC[-3]>=0.3,RC[-3]>0.4),95,IF(AND(RC[-3]>=0.4,RC[-3]<0.5),90,IF(AND(RC[-3]>=0.5,RC[-3]<0.6),85,IF(AND(RC[-3]>=0.6,RC[-3]<0.7),80,IF(AND(RC[-3]>=0.6,RC[-3]<1),80,IF(AND(RC[-3]>1,RC[-3]<2),50,IF(RC[-3]>2,0))))))))) -> 95 | I348: =IF(RC[-1]="",RC[-2],0.7*RC[-1]+0.3*RC[-2]) -> 93.5
A349: ساروج بوشهر | B349: ساروج | C349: =VLOOKUP(RC[-1],Sheet1!R3C2:R802C3,2,FALSE) -> سیمان آهک گچ | D349: =VLOOKUP(RC[-2],Sheet1!R3C2:R802C9,8,FALSE) -> 6.4235819602309601 | E349: =IF(VLOOKUP(RC[-3],Sheet1!R3C2:R803C11,10,FALSE)=0,"",VLOOKUP(Sheet2!RC[-3],Sheet1!R[1]C[-3]:R[801]C[6],10,FALSE)) ->  | F349: =Sheet1!R419C10 -> 6.5383737205402594 | G349: =IF(RC[-3]<0,0,IF(AND(RC[-3]<RC[-1],RC[-3]<2),100,IF(AND(RC[-3]<RC[-1],RC[-3]>=2,RC[-3]<3),95,IF(AND(RC[-3]<RC[-1],RC[-3]>=3,RC[-3]<4),90,IF(AND(RC[-3]<RC[-1],RC[-3]>=4,RC[-3]<5),85,IF(AND(RC[-3]<RC[-1],RC[-3]>=5,RC[-3]<6),80,IF(AND(RC[-3]<RC[-1],RC[-3]>=6,RC[-3]<7),75,IF(AND(RC[-3]<RC[-1],RC[-3]>=7,RC[-3]<8),70,IF(AND(RC[-3]<RC[-1],RC[-3]>=8,RC[-3]<9),65,IF(AND(RC[-3]<RC[-1],RC[-3]>=9,RC[-3]<10),60,IF(AND(RC[-3]<RC[-1],RC[-3]>=10,RC[-3]<11),55,IF(AND(RC[-3]<RC[-1],RC[-3]>=11,RC[-3]<12),50,IF(AND(RC[-3]<RC[-1],RC[-3]>=12,RC[-3]<13),45,IF(AND(RC[-3]<RC[-1],RC[-3]>=13,RC[-3]<14),40,IF(AND(RC[-3]<RC[-1],RC[-3]>=14,RC[-3]<15),35,IF(AND(RC[-3]<RC[-1],RC[-3]>=15,RC[-3]<16),30,IF(AND(RC[-3]<RC[-1],RC[-3]>=16,RC[-3]<17),25,IF(AND(RC[-3]<RC[-1],RC[-3]>=17,RC[-3]<18),20,IF(AND(RC[-3]<RC[-1],RC[-3]>=18,RC[-3]<19),15,IF(AND(RC[-3]<RC[-1],RC[-3]>=19,RC[-3]<20),10,IF(AND(RC[-3]<RC[-1],RC[-3]>=20,RC[-3]<21),5,IF(AND(RC[-3]<RC[-1],RC[-3]>=21),0,IF(AND(RC[-3]>RC[-1],RC[-3]>=2,RC[-3]<3),90,IF(AND(RC[-3]>RC[-1],RC[-3]>=3,RC[-3]<4),90,IF(AND(RC[-3]>RC[-1],RC[-3]>=4,RC[-3]<5),80,IF(AND(RC[-3]>RC[-1],RC[-3]>=5,RC[-3]<6),70,IF(AND(RC[-3]>RC[-1],RC[-3]>=6,RC[-3]<7),60,IF(AND(RC[-3]>RC[-1],RC[-3]>=7,RC[-3]<8),50,IF(AND(RC[-3]>RC[-1],RC[-3]>=8,RC[-3]<9),40,IF(AND(RC[-3]>RC[-1],RC[-3]>=9,RC[-3]<10),30,IF(AND(RC[-3]>RC[-1],RC[-3]>=10,RC[-3]<11),20,IF(AND(RC[-3]>RC[-1],RC[-3]>=11,RC[-3]<12),10,IF(AND(RC[-3]>RC[-1],RC[-3]>=12),0))))))))))))))))))))))))))))))))) -> 75 | H349: =IF(RC[-3]="","",IF(RC[-3]<0.3,100,IF(AND(RC[-3]>=0.3,RC[-3]>0.4),95,IF(AND(RC[-3]>=0.4,RC[-3]<0.5),90,IF(AND(RC[-3]>=0.5,RC[-3]<0.6),85,IF(AND(RC[-3]>=0.6,RC[-3]<0.7),80,IF(AND(RC[-3]>=0.6,RC[-3]<1),80,IF(AND(RC[-3]>1,RC[-3]<2),50,IF(RC[-3]>2,0))))))))) ->  | I349: =IF(RC[-1]="",RC[-2],0.7*RC[-1]+0.3*RC[-2]) -> 75
A350: سر. سیمان تامین | B350: سیتا | C350: =VLOOKUP(RC[-1],Sheet1!R3C2:R802C3,2,FALSE) -> سیمان آهک گچ | D350: =VLOOKUP(RC[-2],Sheet1!R3C2:R802C9,8,FALSE) -> 4.6148487474617674 | E350: =IF(VLOOKUP(RC[-3],Sheet1!R3C2:R803C11,10,FALSE)=0,"",VLOOKUP(Sheet2!RC[-3],Sheet1!R[1]C[-3]:R[801]C[6],10,FALSE)) -> 0.82 | F350: =Sheet1!R419C10 -> 6.5383737205402594 | G350: =IF(RC[-3]<0,0,IF(AND(RC[-3]<RC[-1],RC[-3]<2),100,IF(AND(RC[-3]<RC[-1],RC[-3]>=2,RC[-3]<3),95,IF(AND(RC[-3]<RC[-1],RC[-3]>=3,RC[-3]<4),90,IF(AND(RC[-3]<RC[-1],RC[-3]>=4,RC[-3]<5),85,IF(AND(RC[-3]<RC[-1],RC[-3]>=5,RC[-3]<6),80,IF(AND(RC[-3]<RC[-1],RC[-3]>=6,RC[-3]<7),75,IF(AND(RC[-3]<RC[-1],RC[-3]>=7,RC[-3]<8),70,IF(AND(RC[-3]<RC[-1],RC[-3]>=8,RC[-3]<9),65,IF(AND(RC[-3]<RC[-1],RC[-3]>=9,RC[-3]<10),60,IF(AND(RC[-3]<RC[-1],RC[-3]>=10,RC[-3]<11),55,IF(AND(RC[-3]<RC[-1],RC[-3]>=11,RC[-3]<12),50,IF(AND(RC[-3]<RC[-1],RC[-3]>=12,RC[-3]<13),45,IF(AND(RC[-3]<RC[-1],RC[-3]>=13,RC[-3]<14),40,IF(AND(RC[-3]<RC[-1],RC[-3]>=14,RC[-3]<15),35,IF(AND(RC[-3]<RC[-1],RC[-3]>=15,RC[-3]<16),30,IF(AND(RC[-3]<RC[-1],RC[-3]>=16,RC[-3]<17),25,IF(AND(RC[-3]<RC[-1],RC[-3]>=17,RC[-3]<18),20,IF(AND(RC[-3]<RC[-1],RC[-3]>=18,RC[-3]<19),15,IF(AND(RC[-3]<RC[-1],RC[-3]>=19,RC[-3]<20),10,IF(AND(RC[-3]<RC[-1],RC[-3]>=20,RC[-3]<21),5,IF(AND(RC[-3]<RC[-1],RC[-3]>=21),0,IF(AND(RC[-3]>RC[-1],RC[-3]>=2,RC[-3]<3),90,IF(AND(RC[-3]>RC[-1],RC[-3]>=3,RC[-3]<4),90,IF(AND(RC[-3]>RC[-1],RC[-3]>=4,RC[-3]<5),80,IF(AND(RC[-3]>RC[-1],RC[-3]>=5,RC[-3]<6),70,IF(AND(RC[-3]>RC[-1],RC[-3]>=6,RC[-3]<7),60,IF(AND(RC[-3]>RC[-1],RC[-3]>=7,RC[-3]<8),50,IF(AND(RC[-3]>RC[-1],RC[-3]>=8,RC[-3]<9),40,IF(AND(RC[-3]>RC[-1],RC[-3]>=9,RC[-3]<10),30,IF(AND(RC[-3]>RC[-1],RC[-3]>=10,RC[-3]<11),20,IF(AND(RC[-3]>RC[-1],RC[-3]>=11,RC[-3]<12),10,IF(AND(RC[-3]>RC[-1],RC[-3]>=12),0))))))))))))))))))))))))))))))))) -> 85 | H350: =IF(RC[-3]="","",IF(RC[-3]<0.3,100,IF(AND(RC[-3]>=0.3,RC[-3]>0.4),95,IF(AND(RC[-3]>=0.4,RC[-3]<0.5),90,IF(AND(RC[-3]>=0.5,RC[-3]<0.6),85,IF(AND(RC[-3]>=0.6,RC[-3]<0.7),80,IF(AND(RC[-3]>=0.6,RC[-3]<1),80,IF(AND(RC[-3]>1,RC[-3]<2),50,IF(RC[-3]>2,0))))))))) -> 95 | I350: =IF(RC[-1]="",RC[-2],0.7*RC[-1]+0.3*RC[-2]) -> 92
A351: سرمایه گذاری توسعه صنایع سیمان | B351: سیدکو | C351: =VLOOKUP(RC[-1],Sheet1!R3C2:R802C3,2,FALSE) -> سیمان آهک گچ | D351: =VLOOKUP(RC[-2],Sheet1!R3C2:R802C9,8,FALSE) -> 5.4157068338358227 | E351: =IF(VLOOKUP(RC[-3],Sheet1!R3C2:R803C11,10,FALSE)=0,"",VLOOKUP(Sheet2!RC[-3],Sheet1!R[1]C[-3]:R[801]C[6],10,FALSE)) -> 0.75 | F351: =Sheet1!R419C10 -> 6.5383737205402594 | G351: =IF(RC[-3]<0,0,IF(AND(RC[-3]<RC[-1],RC[-3]<2),100,IF(AND(RC[-3]<RC[-1],RC[-3]>=2,RC[-3]<3),95,IF(AND(RC[-3]<RC[-1],RC[-3]>=3,RC[-3]<4),90,IF(AND(RC[-3]<RC[-1],RC[-3]>=4,RC[-3]<5),85,IF(AND(RC[-3]<RC[-1],RC[-3]>=5,RC[-3]<6),80,IF(AND(RC[-3]<RC[-1],RC[-3]>=6,RC[-3]<7),75,IF(AND(RC[-3]<RC[-1],RC[-3]>=7,RC[-3]<8),70,IF(AND(RC[-3]<RC[-1],RC[-3]>=8,RC[-3]<9),65,IF(AND(RC[-3]<RC[-1],RC[-3]>=9,RC[-3]<10),60,IF(AND(RC[-3]<RC[-1],RC[-3]>=10,RC[-3]<11),55,IF(AND(RC[-3]<RC[-1],RC[-3]>=11,RC[-3]<12),50,IF(AND(RC[-3]<RC[-1],RC[-3]>=12,RC[-3]<13),45,IF(AND(RC[-3]<RC[-1],RC[-3]>=13,RC[-3]<14),40,IF(AND(RC[-3]<RC[-1],RC[-3]>=14,RC[-3]<15),35,IF(AND(RC[-3]<RC[-1],RC[-3]>=15,RC[-3]<16),30,IF(AND(RC[-3]<RC[-1],RC[-3]>=16,RC[-3]<17),25,IF(AND(RC[-3]<RC[-1],RC[-3]>=17,RC[-3]<18),20,IF(AND(RC[-3]<RC[-1],RC[-3]>=18,RC[-3]<19),15,IF(AND(RC[-3]<RC[-1],RC[-3]>=19,RC[-3]<20),10,IF(AND(RC[-3]<RC[-1],RC[-3]>=20,RC[-3]<21),5,IF(AND(RC[-3]<RC[-1],RC[-3]>=21),0,IF(AND(RC[-3]>RC[-1],RC[-3]>=2,RC[-3]<3),90,IF(AND(RC[-3]>RC[-1],RC[-3]>=3,RC[-3]<4),90,IF(AND(RC[-3]>RC[-1],RC[-3]>=4,RC[-3]<5),80,IF(AND(RC[-3]>RC[-1],RC[-3]>=5,RC[-3]<6),70,IF(AND(RC[-3]>RC[-1],RC[-3]>=6,RC[-3]<7),60,IF(AND(RC[-3]>RC[-1],RC[-3]>=7,RC[-3]<8),50,IF(AND(RC[-3]>RC[-1],RC[-3]>=8,RC[-3]<9),40,IF(AND(RC[-3]>RC[-1],RC[-3]>=9,RC[-3]<10),30,IF(AND(RC[-3]>RC[-1],RC[-3]>=10,RC[-3]<11),20,IF(AND(RC[-3]>RC[-1],RC[-3]>=11,RC[-3]<12),10,IF(AND(RC[-3]>RC[-1],RC[-3]>=12),0))))))))))))))))))))))))))))))))) -> 80 | H351: =IF(RC[-3]="","",IF(RC[-3]<0.3,100,IF(AND(RC[-3]>=0.3,RC[-3]>0.4),95,IF(AND(RC[-3]>=0.4,RC[-3]<0.5),90,IF(AND(RC[-3]>=0.5,RC[-3]<0.6),85,IF(AND(RC[-3]>=0.6,RC[-3]<0.7),80,IF(AND(RC[-3]>=0.6,RC[-3]<1),80,IF(AND(RC[-3]>1,RC[-3]<2),50,IF(RC[-3]>2,0))))))))) -> 95 | I351: =IF(RC[-1]="",RC[-2],0.7*RC[-1]+0.3*RC[-2]) -> 90.5
A352: سیمان آبیک | B352: سآبیک | C352: =VLOOKUP(RC[-1],Sheet1!R3C2:R802C3,2,FALSE) -> سیمان آهک گچ | D352: =VLOOKUP(RC[-2],Sheet1!R3C2:R802C9,8,FALSE) -> 4.5795756587354042 | E352: =IF(VLOOKUP(RC[-3],Sheet1!R3C2:R803C11,10,FALSE)=0,"",VLOOKUP(Sheet2!RC[-3],Sheet1!R[1]C[-3]:R[801]C[6],10,FALSE)) ->  | F352: =Sheet1!R419C10 -> 6.5383737205402594 | G352: =IF(RC[-3]<0,0,IF(AND(RC[-3]<RC[-1],RC[-3]<2),100,IF(AND(RC[-3]<RC[-1],RC[-3]>=2,RC[-3]<3),95,IF(AND(RC[-3]<RC[-1],RC[-3]>=3,RC[-3]<4),90,IF(AND(RC[-3]<RC[-1],RC[-3]>=4,RC[-3]<5),85,IF(AND(RC[-3]<RC[-1],RC[-3]>=5,RC[-3]<6),80,IF(AND(RC[-3]<RC[-1],RC[-3]>=6,RC[-3]<7),75,IF(AND(RC[-3]<RC[-1],RC[-3]>=7,RC[-3]<8),70,IF(AND(RC[-3]<RC[-1],RC[-3]>=8,RC[-3]<9),65,IF(AND(RC[-3]<RC[-1],RC[-3]>=9,RC[-3]<10),60,IF(AND(RC[-3]<RC[-1],RC[-3]>=10,RC[-3]<11),55,IF(AND(RC[-3]<RC[-1],RC[-3]>=11,RC[-3]<12),50,IF(AND(RC[-3]<RC[-1],RC[-3]>=12,RC[-3]<13),45,IF(AND(RC[-3]<RC[-1],RC[-3]>=13,RC[-3]<14),40,IF(AND(RC[-3]<RC[-1],RC[-3]>=14,RC[-3]<15),35,IF(AND(RC[-3]<RC[-1],RC[-3]>=15,RC[-3]<16),30,IF(AND(RC[-3]<RC[-1],RC[-3]>=16,RC[-3]<17),25,IF(AND(RC[-3]<RC[-1],RC[-3]>=17,RC[-3]<18),20,IF(AND(RC[-3]<RC[-1],RC[-3]>=18,RC[-3]<19),15,IF(AND(RC[-3]<RC[-1],RC[-3]>=19,RC[-3]<20),10,IF(AND(RC[-3]<RC[-1],RC[-3]>=20,RC[-3]<21),5,IF(AND(RC[-3]<RC[-1],RC[-3]>=21),0,IF(AND(RC[-3]>RC[-1],RC[-3]>=2,RC[-3]<3),90,IF(AND(RC[-3]>RC[-1],RC[-3]>=3,RC[-3]<4),90,IF(AND(RC[-3]>RC[-1],RC[-3]>=4,RC[-3]<5),80,IF(AND(RC[-3]>RC[-1],RC[-3]>=5,RC[-3]<6),70,IF(AND(RC[-3]>RC[-1],RC[-3]>=6,RC[-3]<7),60,IF(AND(RC[-3]>RC[-1],RC[-3]>=7,RC[-3]<8),50,IF(AND(RC[-3]>RC[-1],RC[-3]>=8,RC[-3]<9),40,IF(AND(RC[-3]>RC[-1],RC[-3]>=9,RC[-3]<10),30,IF(AND(RC[-3]>RC[-1],RC[-3]>=10,RC[-3]<11),20,IF(AND(RC[-3]>RC[-1],RC[-3]>=11,RC[-3]<12),10,IF(AND(RC[-3]>RC[-1],RC[-3]>=12),0))))))))))))))))))))))))))))))))) -> 85 | H352: =IF(RC[-3]="","",IF(RC[-3]<0.3,100,IF(AND(RC[-3]>=0.3,RC[-3]>0.4),95,IF(AND(RC[-3]>=0.4,RC[-3]<0.5),90,IF(AND(RC[-3]>=0.5,RC[-3]<0.6),85,IF(AND(RC[-3]>=0.6,RC[-3]<0.7),80,IF(AND(RC[-3]>=0.6,RC[-3]<1),80,IF(AND(RC[-3]>1,RC[-3]<2),50,IF(RC[-3]>2,0))))))))) ->  | I352: =IF(RC[-1]="",RC[-2],0.7*RC[-1]+0.3*RC[-2]) -> 85
A353: سیمان آرتا اردبیل | B353: ساربیل | C353: =VLOOKUP(RC[-1],Sheet1!R3C2:R802C3,2,FALSE) -> سیمان آهک گچ | D353: =VLOOKUP(RC[-2],Sheet1!R3C2:R802C9,8,FALSE) -> 6.5387680665503067 | E353: =IF(VLOOKUP(RC[-3],Sheet1!R3C2:R803C11,10,FALSE)=0,"",VLOOKUP(Sheet2!RC[-3],Sheet1!R[1]C[-3]:R[801]C[6],10,FALSE)) ->  | F353: =Sheet1!R419C10 -> 6.5383737205402594 | G353: =IF(RC[-3]<0,0,IF(AND(RC[-3]<RC[-1],RC[-3]<2),100,IF(AND(RC[-3]<RC[-1],RC[-3]>=2,RC[-3]<3),95,IF(AND(RC[-3]<RC[-1],RC[-3]>=3,RC[-3]<4),90,IF(AND(RC[-3]<RC[-1],RC[-3]>=4,RC[-3]<5),85,IF(AND(RC[-3]<RC[-1],RC[-3]>=5,RC[-3]<6),80,IF(AND(RC[-3]<RC[-1],RC[-3]>=6,RC[-3]<7),75,IF(AND(RC[-3]<RC[-1],RC[-3]>=7,RC[-3]<8),70,IF(AND(RC[-3]<RC[-1],RC[-3]>=8,RC[-3]<9),65,IF(AND(RC[-3]<RC[-1],RC[-3]>=9,RC[-3]<10),60,IF(AND(RC[-3]<RC[-1],RC[-3]>=10,RC[-3]<11),55,IF(AND(RC[-3]<RC[-1],RC[-3]>=11,RC[-3]<12),50,IF(AND(RC[-3]<RC[-1],RC[-3]>=12,RC[-3]<13),45,IF(AND(RC[-3]<RC[-1],RC[-3]>=13,RC[-3]<14),40,IF(AND(RC[-3]<RC[-1],RC[-3]>=14,RC[-3]<15),35,IF(AND(RC[-3]<RC[-1],RC[-3]>=15,RC[-3]<16),30,IF(AND(RC[-3]<RC[-1],RC[-3]>=16,RC[-3]<17),25,IF(AND(RC[-3]<RC[-1],RC[-3]>=17,RC[-3]<18),20,IF(AND(RC[-3]<RC[-1],RC[-3]>=18,RC[-3]<19),15,IF(AND(RC[-3]<RC[-1],RC[-3]>=19,RC[-3]<20),10,IF(AND(RC[-3]<RC[-1],RC[-3]>=20,RC[-3]<21),5,IF(AND(RC[-3]<RC[-1],RC[-3]>=21),0,IF(AND(RC[-3]>RC[-1],RC[-3]>=2,RC[-3]<3),90,IF(AND(RC[-3]>RC[-1],RC[-3]>=3,RC[-3]<4),90,IF(AND(RC[-3]>RC[-1],RC[-3]>=4,RC[-3]<5),80,IF(AND(RC[-3]>RC[-1],RC[-3]>=5,RC[-3]<6),70,IF(AND(RC[-3]>RC[-1],RC[-3]>=6,RC[-3]<7),60,IF(AND(RC[-3]>RC[-1],RC[-3]>=7,RC[-3]<8),50,IF(AND(RC[-3]>RC[-1],RC[-3]>=8,RC[-3]<9),40,IF(AND(RC[-3]>RC[-1],RC[-3]>=9,RC[-3]<10),30,IF(AND(RC[-3]>RC[-1],RC[-3]>=10,RC[-3]<11),20,IF(AND(RC[-3]>RC[-1],RC[-3]>=11,RC[-3]<12),10,IF(AND(RC[-3]>RC[-1],RC[-3]>=12),0))))))))))))))))))))))))))))))))) -> 60 | H353: =IF(RC[-3]="","",IF(RC[-3]<0.3,100,IF(AND(RC[-3]>=0.3,RC[-3]>0.4),95,IF(AND(RC[-3]>=0.4,RC[-3]<0.5),90,IF(AND(RC[-3]>=0.5,RC[-3]<0.6),85,IF(AND(RC[-3]>=0.6,RC[-3]<0.7),80,IF(AND(RC[-3]>=0.6,RC[-3]<1),80,IF(AND(RC[-3]>1,RC[-3]<2),50,IF(RC[-3]>2,0))))))))) ->  | I353: =IF(RC[-1]="",RC[-2],0.7*RC[-1]+0.3*RC[-2]) -> 60
A354: سیمان اردستان | B354: اردستان | C354: =VLOOKUP(RC[-1],Sheet1!R3C2:R802C3,2,FALSE) -> سیمان آهک گچ | D354: =VLOOKUP(RC[-2],Sheet1!R3C2:R802C9,8,FALSE) -> 5.692818173118642 | E354: =IF(VLOOKUP(RC[-3],Sheet1!R3C2:R803C11,10,FALSE)=0,"",VLOOKUP(Sheet2!RC[-3],Sheet1!R[1]C[-3]:R[801]C[6],10,FALSE)) ->  | F354: =Sheet1!R419C10 -> 6.5383737205402594 | G354: =IF(RC[-3]<0,0,IF(AND(RC[-3]<RC[-1],RC[-3]<2),100,IF(AND(RC[-3]<RC[-1],RC[-3]>=2,RC[-3]<3),95,IF(AND(RC[-3]<RC[-1],RC[-3]>=3,RC[-3]<4),90,IF(AND(RC[-3]<RC[-1],RC[-3]>=4,RC[-3]<5),85,IF(AND(RC[-3]<RC[-1],RC[-3]>=5,RC[-3]<6),80,IF(AND(RC[-3]<RC[-1],RC[-3]>=6,RC[-3]<7),75,IF(AND(RC[-3]<RC[-1],RC[-3]>=7,RC[-3]<8),70,IF(AND(RC[-3]<RC[-1],RC[-3]>=8,RC[-3]<9),65,IF(AND(RC[-3]<RC[-1],RC[-3]>=9,RC[-3]<10),60,IF(AND(RC[-3]<RC[-1],RC[-3]>=10,RC[-3]<11),55,IF(AND(RC[-3]<RC[-1],RC[-3]>=11,RC[-3]<12),50,IF(AND(RC[-3]<RC[-1],RC[-3]>=12,RC[-3]<13),45,IF(AND(RC[-3]<RC[-1],RC[-3]>=13,RC[-3]<14),40,IF(AND(RC[-3]<RC[-1],RC[-3]>=14,RC[-3]<15),35,IF(AND(RC[-3]<RC[-1],RC[-3]>=15,RC[-3]<16),30,IF(AND(RC[-3]<RC[-1],RC[-3]>=16,RC[-3]<17),25,IF(AND(RC[-3]<RC[-1],RC[-3]>=17,RC[-3]<18),20,IF(AND(RC[-3]<RC[-1],RC[-3]>=18,RC[-3]<19),15,IF(AND(RC[-3]<RC[-1],RC[-3]>=19,RC[-3]<20),10,IF(AND(RC[-3]<RC[-1],RC[-3]>=20,RC[-3]<21),5,IF(AND(RC[-3]<RC[-1],RC[-3]>=21),0,IF(AND(RC[-3]>RC[-1],RC[-3]>=2,RC[-3]<3),90,IF(AND(RC[-3]>RC[-1],RC[-3]>=3,RC[-3]<4),90,IF(AND(RC[-3]>RC[-1],RC[-3]>=4,RC[-3]<5),80,IF(AND(RC[-3]>RC[-1],RC[-3]>=5,RC[-3]<6),70,IF(AND(RC[-3]>RC[-1],RC[-3]>=6,RC[-3]<7),60,IF(AND(RC[-3]>RC[-1],RC[-3]>=7,RC[-3]<8),50,IF(AND(RC[-3]>RC[-1],RC[-3]>=8,RC[-3]<9),40,IF(AND(RC[-3]>RC[-1],RC[-3]>=9,RC[-3]<10),30,IF(AND(RC[-3]>RC[-1],RC[-3]>=10,RC[-3]<11),20,IF(AND(RC[-3]>RC[-1],RC[-3]>=11,RC[-3]<12),10,IF(AND(RC[-3]>RC[-1],RC[-3]>=12),0))))))))))))))))))))))))))))))))) -> 80 | H354: =IF(RC[-3]="","",IF(RC[-3]<0.3,100,IF(AND(RC[-3]>=0.3,RC[-3]>0.4),95,IF(AND(RC[-3]>=0.4,RC[-3]<0.5),90,IF(AND(RC[-3]>=0.5,RC[-3]<0.6),85,IF(AND(RC[-3]>=0.6,RC[-3]<0.7),80,IF(AND(RC[-3]>=0.6,RC[-3]<1),80,IF(AND(RC[-3]>1,RC[-3]<2),50,IF(RC[-3]>2,0))))))))) ->  | I354: =IF(RC[-1]="",RC[-2],0.7*RC[-1]+0.3*RC[-2]) -> 80
A355: سیمان ارومیه | B355: ساروم | C355: =VLOOKUP(RC[-1],Sheet1!R3C2:R802C3,2,FALSE) -> سیمان آهک گچ | D355: =VLOOKUP(RC[-2],Sheet1!R3C2:R802C9,8,FALSE) -> 3.5086543989476713 | E355: =IF(VLOOKUP(RC[-3],Sheet1!R3C2:R803C11,10,FALSE)=0,"",VLOOKUP(Sheet2!RC[-3],Sheet1!R[1]C[-3]:R[801]C[6],10,FALSE)) ->  | F355: =Sheet1!R419C10 -> 6.5383737205402594 | G355: =IF(RC[-3]<0,0,IF(AND(RC[-3]<RC[-1],RC[-3]<2),100,IF(AND(RC[-3]<RC[-1],RC[-3]>=2,RC[-3]<3),95,IF(AND(RC[-3]<RC[-1],RC[-3]>=3,RC[-3]<4),90,IF(AND(RC[-3]<RC[-1],RC[-3]>=4,RC[-3]<5),85,IF(AND(RC[-3]<RC[-1],RC[-3]>=5,RC[-3]<6),80,IF(AND(RC[-3]<RC[-1],RC[-3]>=6,RC[-3]<7),75,IF(AND(RC[-3]<RC[-1],RC[-3]>=7,RC[-3]<8),70,IF(AND(RC[-3]<RC[-1],RC[-3]>=8,RC[-3]<9),65,IF(AND(RC[-3]<RC[-1],RC[-3]>=9,RC[-3]<10),60,IF(AND(RC[-3]<RC[-1],RC[-3]>=10,RC[-3]<11),55,IF(AND(RC[-3]<RC[-1],RC[-3]>=11,RC[-3]<12),50,IF(AND(RC[-3]<RC[-1],RC[-3]>=12,RC[-3]<13),45,IF(AND(RC[-3]<RC[-1],RC[-3]>=13,RC[-3]<14),40,IF(AND(RC[-3]<RC[-1],RC[-3]>=14,RC[-3]<15),35,IF(AND(RC[-3]<RC[-1],RC[-3]>=15,RC[-3]<16),30,IF(AND(RC[-3]<RC[-1],RC[-3]>=16,RC[-3]<17),25,IF(AND(RC[-3]<RC[-1],RC[-3]>=17,RC[-3]<18),20,IF(AND(RC[-3]<RC[-1],RC[-3]>=18,RC[-3]<19),15,IF(AND(RC[-3]<RC[-1],RC[-3]>=19,RC[-3]<20),10,IF(AND(RC[-3]<RC[-1],RC[-3]>=20,RC[-3]<21),5,IF(AND(RC[-3]<RC[-1],RC[-3]>=21),0,IF(AND(RC[-3]>RC[-1],RC[-3]>=2,RC[-3]<3),90,IF(AND(RC[-3]>RC[-1],RC[-3]>=3,RC[-3]<4),90,IF(AND(RC[-3]>RC[-1],RC[-3]>=4,RC[-3]<5),80,IF(AND(RC[-3]>RC[-1],RC[-3]>=5,RC[-3]<6),70,IF(AND(RC[-3]>RC[-1],RC[-3]>=6,RC[-3]<7),60,IF(AND(RC[-3]>RC[-1],RC[-3]>=7,RC[-3]<8),50,IF(AND(RC[-3]>RC[-1],RC[-3]>=8,RC[-3]<9),40,IF(AND(RC[-3]>RC[-1],RC[-3]>=9,RC[-3]<10),30,IF(AND(RC[-3]>RC[-1],RC[-3]>=10,RC[-3]<11),20,IF(AND(RC[-3]>RC[-1],RC[-3]>=11,RC[-3]<12),10,IF(AND(RC[-3]>RC[-1],RC[-3]>=12),0))))))))))))))))))))))))))))))))) -> 90 | H355: =IF(RC[-3]="","",IF(RC[-3]<0.3,100,IF(AND(RC[-3]>=0.3,RC[-3]>0.4),95,IF(AND(RC[-3]>=0.4,RC[-3]<0.5),90,IF(AND(RC[-3]>=0.5,RC[-3]<0.6),85,IF(AND(RC[-3]>=0.6,RC[-3]<0.7),80,IF(AND(RC[-3]>=0.6,RC[-3]<1),80,IF(AND(RC[-3]>1,RC[-3]<2),50,IF(RC[-3]>2,0))))))))) ->  | I355: =IF(RC[-1]="",RC[-2],0.7*RC[-1]+0.3*RC[-2]) -> 90
A356: سیمان اصفهان | B356: سصفها | C356: =VLOOKUP(RC[-1],Sheet1!R3C2:R802C3,2,FALSE) -> سیمان آهک گچ | D356: =VLOOKUP(RC[-2],Sheet1!R3C2:R802C9,8,FALSE) -> 24.518808699148181 | E356: =IF(VLOOKUP(RC[-3],Sheet1!R3C2:R803C11,10,FALSE)=0,"",VLOOKUP(Sheet2!RC[-3],Sheet1!R[1]C[-3]:R[801]C[6],10,FALSE)) ->  | F356: =Sheet1!R419C10 -> 6.5383737205402594 | G356: =IF(RC[-3]<0,0,IF(AND(RC[-3]<RC[-1],RC[-3]<2),100,IF(AND(RC[-3]<RC[-1],RC[-3]>=2,RC[-3]<3),95,IF(AND(RC[-3]<RC[-1],RC[-3]>=3,RC[-3]<4),90,IF(AND(RC[-3]<RC[-1],RC[-3]>=4,RC[-3]<5),85,IF(AND(RC[-3]<RC[-1],RC[-3]>=5,RC[-3]<6),80,IF(AND(RC[-3]<RC[-1],RC[-3]>=6,RC[-3]<7),75,IF(AND(RC[-3]<RC[-1],RC[-3]>=7,RC[-3]<8),70,IF(AND(RC[-3]<RC[-1],RC[-3]>=8,RC[-3]<9),65,IF(AND(RC[-3]<RC[-1],RC[-3]>=9,RC[-3]<10),60,IF(AND(RC[-3]<RC[-1],RC[-3]>=10,RC[-3]<11),55,IF(AND(RC[-3]<RC[-1],RC[-3]>=11,RC[-3]<12),50,IF(AND(RC[-3]<RC[-1],RC[-3]>=12,RC[-3]<13),45,IF(AND(RC[-3]<RC[-1],RC[-3]>=13,RC[-3]<14),40,IF(AND(RC[-3]<RC[-1],RC[-3]>=14,RC[-3]<15),35,IF(AND(RC[-3]<RC[-1],RC[-3]>=15,RC[-3]<16),30,IF(AND(RC[-3]<RC[-1],RC[-3]>=16,RC[-3]<17),25,IF(AND(RC[-3]<RC[-1],RC[-3]>=17,RC[-3]<18),20,IF(AND(RC[-3]<RC[-1],RC[-3]>=18,RC[-3]<19),15,IF(AND(RC[-3]<RC[-1],RC[-3]>=19,RC[-3]<20),10,IF(AND(RC[-3]<RC[-1],RC[-3]>=20,RC[-3]<21),5,IF(AND(RC[-3]<RC[-1],RC[-3]>=21),0,IF(AND(RC[-3]>RC[-1],RC[-3]>=2,RC[-3]<3),90,IF(AND(RC[-3]>RC[-1],RC[-3]>=3,RC[-3]<4),90,IF(AND(RC[-3]>RC[-1],RC[-3]>=4,RC[-3]<5),80,IF(AND(RC[-3]>RC[-1],RC[-3]>=5,RC[-3]<6),70,IF(AND(RC[-3]>RC[-1],RC[-3]>=6,RC[-3]<7),60,IF(AND(RC[-3]>RC[-1],RC[-3]>=7,RC[-3]<8),50,IF(AND(RC[-3]>RC[-1],RC[-3]>=8,RC[-3]<9),40,IF(AND(RC[-3]>RC[-1],RC[-3]>=9,RC[-3]<10),30,IF(AND(RC[-3]>RC[-1],RC[-3]>=10,RC[-3]<11),20,IF(AND(RC[-3]>RC[-1],RC[-3]>=11,RC[-3]<12),10,IF(AND(RC[-3]>RC[-1],RC[-3]>=12),0))))))))))))))))))))))))))))))))) -> 0 | H356: =IF(RC[-3]="","",IF(RC[-3]<0.3,100,IF(AND(RC[-3]>=0.3,RC[-3]>0.4),95,IF(AND(RC[-3]>=0.4,RC[-3]<0.5),90,IF(AND(RC[-3]>=0.5,RC[-3]<0.6),85,IF(AND(RC[-3]>=0.6,RC[-3]<0.7),80,IF(AND(RC[-3]>=0.6,RC[-3]<1),80,IF(AND(RC[-3]>1,RC[-3]<2),50,IF(RC[-3]>2,0))))))))) ->  | I356: =IF(RC[-1]="",RC[-2],0.7*RC[-1]+0.3*RC[-2]) -> 0
A357: سیمان ایلام | B357: سیلام | C357: =VLOOKUP(RC[-1],Sheet1!R3C2:R802C3,2,FALSE) -> سیمان آهک گچ | D357: =VLOOKUP(RC[-2],Sheet1!R3C2:R802C9,8,FALSE) -> 17.890144427538694 | E357: =IF(VLOOKUP(RC[-3],Sheet1!R3C2:R803C11,10,FALSE)=0,"",VLOOKUP(Sheet2!RC[-3],Sheet1!R[1]C[-3]:R[801]C[6],10,FALSE)) ->  | F357: =Sheet1!R419C10 -> 6.5383737205402594 | G357: =IF(RC[-3]<0,0,IF(AND(RC[-3]<RC[-1],RC[-3]<2),100,IF(AND(RC[-3]<RC[-1],RC[-3]>=2,RC[-3]<3),95,IF(AND(RC[-3]<RC[-1],RC[-3]>=3,RC[-3]<4),90,IF(AND(RC[-3]<RC[-1],RC[-3]>=4,RC[-3]<5),85,IF(AND(RC[-3]<RC[-1],RC[-3]>=5,RC[-3]<6),80,IF(AND(RC[-3]<RC[-1],RC[-3]>=6,RC[-3]<7),75,IF(AND(RC[-3]<RC[-1],RC[-3]>=7,RC[-3]<8),70,IF(AND(RC[-3]<RC[-1],RC[-3]>=8,RC[-3]<9),65,IF(AND(RC[-3]<RC[-1],RC[-3]>=9,RC[-3]<10),60,IF(AND(RC[-3]<RC[-1],RC[-3]>=10,RC[-3]<11),55,IF(AND(RC[-3]<RC[-1],RC[-3]>=11,RC[-3]<12),50,IF(AND(RC[-3]<RC[-1],RC[-3]>=12,RC[-3]<13),45,IF(AND(RC[-3]<RC[-1],RC[-3]>=13,RC[-3]<14),40,IF(AND(RC[-3]<RC[-1],RC[-3]>=14,RC[-3]<15),35,IF(AND(RC[-3]<RC[-1],RC[-3]>=15,RC[-3]<16),30,IF(AND(RC[-3]<RC[-1],RC[-3]>=16,RC[-3]<17),25,IF(AND(RC[-3]<RC[-1],RC[-3]>=17,RC[-3]<18),20,IF(AND(RC[-3]<RC[-1],RC[-3]>=18,RC[-3]<19),15,IF(AND(RC[-3]<RC[-1],RC[-3]>=19,RC[-3]<20),10,IF(AND(RC[-3]<RC[-1],RC[-3]>=20,RC[-3]<21),5,IF(AND(RC[-3]<RC[-1],RC[-3]>=21),0,IF(AND(RC[-3]>RC[-1],RC[-3]>=2,RC[-3]<3),90,IF(AND(RC[-3]>RC[-1],RC[-3]>=3,RC[-3]<4),90,IF(AND(RC[-3]>RC[-1],RC[-3]>=4,RC[-3]<5),80,IF(AND(RC[-3]>RC[-1],RC[-3]>=5,RC[-3]<6),70,IF(AND(RC[-3]>RC[-1],RC[-3]>=6,RC[-3]<7),60,IF(AND(RC[-3]>RC[-1],RC[-3]>=7,RC[-3]<8),50,IF(AND(RC[-3]>RC[-1],RC[-3]>=8,RC[-3]<9),40,IF(AND(RC[-3]>RC[-1],RC[-3]>=9,RC[-3]<10),30,IF(AND(RC[-3]>RC[-1],RC[-3]>=10,RC[-3]<11),20,IF(AND(RC[-3]>RC[-1],RC[-3]>=11,RC[-3]<12),10,IF(AND(RC[-3]>RC[-1],RC[-3]>=12),0))))))))))))))))))))))))))))))))) -> 0 | H357: =IF(RC[-3]="","",IF(RC[-3]<0.3,100,IF(AND(RC[-3]>=0.3,RC[-3]>0.4),95,IF(AND(RC[-3]>=0.4,RC[-3]<0.5),90,IF(AND(RC[-3]>=0.5,RC[-3]<0.6),85,IF(AND(RC[-3]>=0.6,RC[-3]<0.7),80,IF(AND(RC[-3]>=0.6,RC[-3]<1),80,IF(AND(RC[-3]>1,RC[-3]<2),50,IF(RC[-3]>2,0))))))))) ->  | I357: =IF(RC[-1]="",RC[-2],0.7*RC[-1]+0.3*RC[-2]) -> 0
A358: سیمان باقران | B358: سباقر | C358: =VLOOKUP(RC[-1],Sheet1!R3C2:R802C3,2,FALSE) -> سیمان آهک گچ | D358: =VLOOKUP(RC[-2],Sheet1!R3C2:R802C9,8,FALSE) -> 6.0688017869101314 | E358: =IF(VLOOKUP(RC[-3],Sheet1!R3C2:R803C11,10,FALSE)=0,"",VLOOKUP(Sheet2!RC[-3],Sheet1!R[1]C[-3]:R[801]C[6],10,FALSE)) ->  | F358: =Sheet1!R419C10 -> 6.5383737205402594 | G358: =IF(RC[-3]<0,0,IF(AND(RC[-3]<RC[-1],RC[-3]<2),100,IF(AND(RC[-3]<RC[-1],RC[-3]>=2,RC[-3]<3),95,IF(AND(RC[-3]<RC[-1],RC[-3]>=3,RC[-3]<4),90,IF(AND(RC[-3]<RC[-1],RC[-3]>=4,RC[-3]<5),85,IF(AND(RC[-3]<RC[-1],RC[-3]>=5,RC[-3]<6),80,IF(AND(RC[-3]<RC[-1],RC[-3]>=6,RC[-3]<7),75,IF(AND(RC[-3]<RC[-1],RC[-3]>=7,RC[-3]<8),70,IF(AND(RC[-3]<RC[-1],RC[-3]>=8,RC[-3]<9),65,IF(AND(RC[-3]<RC[-1],RC[-3]>=9,RC[-3]<10),60,IF(AND(RC[-3]<RC[-1],RC[-3]>=10,RC[-3]<11),55,IF(AND(RC[-3]<RC[-1],RC[-3]>=11,RC[-3]<12),50,IF(AND(RC[-3]<RC[-1],RC[-3]>=12,RC[-3]<13),45,IF(AND(RC[-3]<RC[-1],RC[-3]>=13,RC[-3]<14),40,IF(AND(RC[-3]<RC[-1],RC[-3]>=14,RC[-3]<15),35,IF(AND(RC[-3]<RC[-1],RC[-3]>=15,RC[-3]<16),30,IF(AND(RC[-3]<RC[-1],RC[-3]>=16,RC[-3]<17),25,IF(AND(RC[-3]<RC[-1],RC[-3]>=17,RC[-3]<18),20,IF(AND(RC[-3]<RC[-1],RC[-3]>=18,RC[-3]<19),15,IF(AND(RC[-3]<RC[-1],RC[-3]>=19,RC[-3]<20),10,IF(AND(RC[-3]<RC[-1],RC[-3]>=20,RC[-3]<21),5,IF(AND(RC[-3]<RC[-1],RC[-3]>=21),0,IF(AND(RC[-3]>RC[-1],RC[-3]>=2,RC[-3]<3),90,IF(AND(RC[-3]>RC[-1],RC[-3]>=3,RC[-3]<4),90,IF(AND(RC[-3]>RC[-1],RC[-3]>=4,RC[-3]<5),80,IF(AND(RC[-3]>RC[-1],RC[-3]>=5,RC[-3]<6),70,IF(AND(RC[-3]>RC[-1],RC[-3]>=6,RC[-3]<7),60,IF(AND(RC[-3]>RC[-1],RC[-3]>=7,RC[-3]<8),50,IF(AND(RC[-3]>RC[-1],RC[-3]>=8,RC[-3]<9),40,IF(AND(RC[-3]>RC[-1],RC[-3]>=9,RC[-3]<10),30,IF(AND(RC[-3]>RC[-1],RC[-3]>=10,RC[-3]<11),20,IF(AND(RC[-3]>RC[-1],RC[-3]>=11,RC[-3]<12),10,IF(AND(RC[-3]>RC[-1],RC[-3]>=12),0))))))))))))))))))))))))))))))))) -> 75 | H358: =IF(RC[-3]="","",IF(RC[-3]<0.3,100,IF(AND(RC[-3]>=0.3,RC[-3]>0.4),95,IF(AND(RC[-3]>=0.4,RC[-3]<0.5),90,IF(AND(RC[-3]>=0.5,RC[-3]<0.6),85,IF(AND(RC[-3]>=0.6,RC[-3]<0.7),80,IF(AND(RC[-3]>=0.6,RC[-3]<1),80,IF(AND(RC[-3]>1,RC[-3]<2),50,IF(RC[-3]>2,0))))))))) ->  | I358: =IF(RC[-1]="",RC[-2],0.7*RC[-1]+0.3*RC[-2]) -> 75
A359: سیمان بجنورد | B359: سبجنو | C359: =VLOOKUP(RC[-1],Sheet1!R3C2:R802C3,2,FALSE) -> سیمان آهک گچ | D359: =VLOOKUP(RC[-2],Sheet1!R3C2:R802C9,8,FALSE) -> 4.3190649599379203 | E359: =IF(VLOOKUP(RC[-3],Sheet1!R3C2:R803C11,10,FALSE)=0,"",VLOOKUP(Sheet2!RC[-3],Sheet1!R[1]C[-3]:R[801]C[6],10,FALSE)) ->  | F359: =Sheet1!R419C10 -> 6.5383737205402594 | G359: =IF(RC[-3]<0,0,IF(AND(RC[-3]<RC[-1],RC[-3]<2),100,IF(AND(RC[-3]<RC[-1],RC[-3]>=2,RC[-3]<3),95,IF(AND(RC[-3]<RC[-1],RC[-3]>=3,RC[-3]<4),90,IF(AND(RC[-3]<RC[-1],RC[-3]>=4,RC[-3]<5),85,IF(AND(RC[-3]<RC[-1],RC[-3]>=5,RC[-3]<6),80,IF(AND(RC[-3]<RC[-1],RC[-3]>=6,RC[-3]<7),75,IF(AND(RC[-3]<RC[-1],RC[-3]>=7,RC[-3]<8),70,IF(AND(RC[-3]<RC[-1],RC[-3]>=8,RC[-3]<9),65,IF(AND(RC[-3]<RC[-1],RC[-3]>=9,RC[-3]<10),60,IF(AND(RC[-3]<RC[-1],RC[-3]>=10,RC[-3]<11),55,IF(AND(RC[-3]<RC[-1],RC[-3]>=11,RC[-3]<12),50,IF(AND(RC[-3]<RC[-1],RC[-3]>=12,RC[-3]<13),45,IF(AND(RC[-3]<RC[-1],RC[-3]>=13,RC[-3]<14),40,IF(AND(RC[-3]<RC[-1],RC[-3]>=14,RC[-3]<15),35,IF(AND(RC[-3]<RC[-1],RC[-3]>=15,RC[-3]<16),30,IF(AND(RC[-3]<RC[-1],RC[-3]>=16,RC[-3]<17),25,IF(AND(RC[-3]<RC[-1],RC[-3]>=17,RC[-3]<18),20,IF(AND(RC[-3]<RC[-1],RC[-3]>=18,RC[-3]<19),15,IF(AND(RC[-3]<RC[-1],RC[-3]>=19,RC[-3]<20),10,IF(AND(RC[-3]<RC[-1],RC[-3]>=20,RC[-3]<21),5,IF(AND(RC[-3]<RC[-1],RC[-3]>=21),0,IF(AND(RC[-3]>RC[-1],RC[-3]>=2,RC[-3]<3),90,IF(AND(RC[-3]>RC[-1],RC[-3]>=3,RC[-3]<4),90,IF(AND(RC[-3]>RC[-1],RC[-3]>=4,RC[-3]<5),80,IF(AND(RC[-3]>RC[-1],RC[-3]>=5,RC[-3]<6),70,IF(AND(RC[-3]>RC[-1],RC[-3]>=6,RC[-3]<7),60,IF(AND(RC[-3]>RC[-1],RC[-3]>=7,RC[-3]<8),50,IF(AND(RC[-3]>RC[-1],RC[-3]>=8,RC[-3]<9),40,IF(AND(RC[-3]>RC[-1],RC[-3]>=9,RC[-3]<10),30,IF(AND(RC[-3]>RC[-1],RC[-3]>=10,RC[-3]<11),20,IF(AND(RC[-3]>RC[-1],RC[-3]>=11,RC[-3]<12),10,IF(AND(RC[-3]>RC[-1],RC[-3]>=12),0))))))))))))))))))))))))))))))))) -> 85 | H359: =IF(RC[-3]="","",IF(RC[-3]<0.3,100,IF(AND(RC[-3]>=0.3,RC[-3]>0.4),95,IF(AND(RC[-3]>=0.4,RC[-3]<0.5),90,IF(AND(RC[-3]>=0.5,RC[-3]<0.6),85,IF(AND(RC[-3]>=0.6,RC[-3]<0.7),80,IF(AND(RC[-3]>=0.6,RC[-3]<1),80,IF(AND(RC[-3]>1,RC[-3]<2),50,IF(RC[-3]>2,0))))))))) ->  | I359: =IF(RC[-1]="",RC[-2],0.7*RC[-1]+0.3*RC[-2]) -> 85
A360: سیمان بهبهان | B360: سبهان | C360: =VLOOKUP(RC[-1],Sheet1!R3C2:R802C3,2,FALSE) -> سیمان آهک گچ | D360: =VLOOKUP(RC[-2],Sheet1!R3C2:R802C9,8,FALSE) -> 6.6726776038115014 | E360: =IF(VLOOKUP(RC[-3],Sheet1!R3C2:R803C11,10,FALSE)=0,"",VLOOKUP(Sheet2!RC[-3],Sheet1!R[1]C[-3]:R[801]C[6],10,FALSE)) ->  | F360: =Sheet1!R419C10 -> 6.5383737205402594 | G360: =IF(RC[-3]<0,0,IF(AND(RC[-3]<RC[-1],RC[-3]<2),100,IF(AND(RC[-3]<RC[-1],RC[-3]>=2,RC[-3]<3),95,IF(AND(RC[-3]<RC[-1],RC[-3]>=3,RC[-3]<4),90,IF(AND(RC[-3]<RC[-1],RC[-3]>=4,RC[-3]<5),85,IF(AND(RC[-3]<RC[-1],RC[-3]>=5,RC[-3]<6),80,IF(AND(RC[-3]<RC[-1],RC[-3]>=6,RC[-3]<7),75,IF(AND(RC[-3]<RC[-1],RC[-3]>=7,RC[-3]<8),70,IF(AND(RC[-3]<RC[-1],RC[-3]>=8,RC[-3]<9),65,IF(AND(RC[-3]<RC[-1],RC[-3]>=9,RC[-3]<10),60,IF(AND(RC[-3]<RC[-1],RC[-3]>=10,RC[-3]<11),55,IF(AND(RC[-3]<RC[-1],RC[-3]>=11,RC[-3]<12),50,IF(AND(RC[-3]<RC[-1],RC[-3]>=12,RC[-3]<13),45,IF(AND(RC[-3]<RC[-1],RC[-3]>=13,RC[-3]<14),40,IF(AND(RC[-3]<RC[-1],RC[-3]>=14,RC[-3]<15),35,IF(AND(RC[-3]<RC[-1],RC[-3]>=15,RC[-3]<16),30,IF(AND(RC[-3]<RC[-1],RC[-3]>=16,RC[-3]<17),25,IF(AND(RC[-3]<RC[-1],RC[-3]>=17,RC[-3]<18),20,IF(AND(RC[-3]<RC[-1],RC[-3]>=18,RC[-3]<19),15,IF(AND(RC[-3]<RC[-1],RC[-3]>=19,RC[-3]<20),10,IF(AND(RC[-3]<RC[-1],RC[-3]>=20,RC[-3]<21),5,IF(AND(RC[-3]<RC[-1],RC[-3]>=21),0,IF(AND(RC[-3]>RC[-1],RC[-3]>=2,RC[-3]<3),90,IF(AND(RC[-3]>RC[-1],RC[-3]>=3,RC[-3]<4),90,IF(AND(RC[-3]>RC[-1],RC[-3]>=4,RC[-3]<5),80,IF(AND(RC[-3]>RC[-1],RC[-3]>=5,RC[-3]<6),70,IF(AND(RC[-3]>RC[-1],RC[-3]>=6,RC[-3]<7),60,IF(AND(RC[-3]>RC[-1],RC[-3]>=7,RC[-3]<8),50,IF(AND(RC[-3]>RC[-1],RC[-3]>=8,RC[-3]<9),40,IF(AND(RC[-3]>RC[-1],RC[-3]>=9,RC[-3]<10),30,IF(AND(RC[-3]>RC[-1],RC[-3]>=10,RC[-3]<11),20,IF(AND(RC[-3]>RC[-1],RC[-3]>=11,RC[-3]<12),10,IF(AND(RC[-3]>RC[-1],RC[-3]>=12),0))))))))))))))))))))))))))))))))) -> 60 | H360: =IF(RC[-3]="","",IF(RC[-3]<0.3,100,IF(AND(RC[-3]>=0.3,RC[-3]>0.4),95,IF(AND(RC[-3]>=0.4,RC[-3]<0.5),90,IF(AND(RC[-3]>=0.5,RC[-3]<0.6),85,IF(AND(RC[-3]>=0.6,RC[-3]<0.7),80,IF(AND(RC[-3]>=0.6,RC[-3]<1),80,IF(AND(RC[-3]>1,RC[-3]<2),50,IF(RC[-3]>2,0))))))))) ->  | I360: =IF(RC[-1]="",RC[-2],0.7*RC[-1]+0.3*RC[-2]) -> 60
A361: سیمان تهران | B361: ستران | C361: =VLOOKUP(RC[-1],Sheet1!R3C2:R802C3,2,FALSE) -> سیمان آهک گچ | D361: =VLOOKUP(RC[-2],Sheet1!R3C2:R802C9,8,FALSE) -> 4.3 | E361: =IF(VLOOKUP(RC[-3],Sheet1!R3C2:R803C11,10,FALSE)=0,"",VLOOKUP(Sheet2!RC[-3],Sheet1!R[1]C[-3]:R[801]C[6],10,FALSE)) ->  | F361: =Sheet1!R419C10 -> 6.5383737205402594 | G361: =IF(RC[-3]<0,0,IF(AND(RC[-3]<RC[-1],RC[-3]<2),100,IF(AND(RC[-3]<RC[-1],RC[-3]>=2,RC[-3]<3),95,IF(AND(RC[-3]<RC[-1],RC[-3]>=3,RC[-3]<4),90,IF(AND(RC[-3]<RC[-1],RC[-3]>=4,RC[-3]<5),85,IF(AND(RC[-3]<RC[-1],RC[-3]>=5,RC[-3]<6),80,IF(AND(RC[-3]<RC[-1],RC[-3]>=6,RC[-3]<7),75,IF(AND(RC[-3]<RC[-1],RC[-3]>=7,RC[-3]<8),70,IF(AND(RC[-3]<RC[-1],RC[-3]>=8,RC[-3]<9),65,IF(AND(RC[-3]<RC[-1],RC[-3]>=9,RC[-3]<10),60,IF(AND(RC[-3]<RC[-1],RC[-3]>=10,RC[-3]<11),55,IF(AND(RC[-3]<RC[-1],RC[-3]>=11,RC[-3]<12),50,IF(AND(RC[-3]<RC[-1],RC[-3]>=12,RC[-3]<13),45,IF(AND(RC[-3]<RC[-1],RC[-3]>=13,RC[-3]<14),40,IF(AND(RC[-3]<RC[-1],RC[-3]>=14,RC[-3]<15),35,IF(AND(RC[-3]<RC[-1],RC[-3]>=15,RC[-3]<16),30,IF(AND(RC[-3]<RC[-1],RC[-3]>=16,RC[-3]<17),25,IF(AND(RC[-3]<RC[-1],RC[-3]>=17,RC[-3]<18),20,IF(AND(RC[-3]<RC[-1],RC[-3]>=18,RC[-3]<19),15,IF(AND(RC[-3]<RC[-1],RC[-3]>=19,RC[-3]<20),10,IF(AND(RC[-3]<RC[-1],RC[-3]>=20,RC[-3]<21),5,IF(AND(RC[-3]<RC[-1],RC[-3]>=21),0,IF(AND(RC[-3]>RC[-1],RC[-3]>=2,RC[-3]<3),90,IF(AND(RC[-3]>RC[-1],RC[-3]>=3,RC[-3]<4),90,IF(AND(RC[-3]>RC[-1],RC[-3]>=4,RC[-3]<5),80,IF(AND(RC[-3]>RC[-1],RC[-3]>=5,RC[-3]<6),70,IF(AND(RC[-3]>RC[-1],RC[-3]>=6,RC[-3]<7),60,IF(AND(RC[-3]>RC[-1],RC[-3]>=7,RC[-3]<8),50,IF(AND(RC[-3]>RC[-1],RC[-3]>=8,RC[-3]<9),40,IF(AND(RC[-3]>RC[-1],RC[-3]>=9,RC[-3]<10),30,IF(AND(RC[-3]>RC[-1],RC[-3]>=10,RC[-3]<11),20,IF(AND(RC[-3]>RC[-1],RC[-3]>=11,RC[-3]<12),10,IF(AND(RC[-3]>RC[-1],RC[-3]>=12),0))))))))))))))))))))))))))))))))) -> 85 | H361: =IF(RC[-3]="","",IF(RC[-3]<0.3,100,IF(AND(RC[-3]>=0.3,RC[-3]>0.4),95,IF(AND(RC[-3]>=0.4,RC[-3]<0.5),90,IF(AND(RC[-3]>=0.5,RC[-3]<0.6),85,IF(AND(RC[-3]>=0.6,RC[-3]<0.7),80,IF(AND(RC[-3]>=0.6,RC[-3]<1),80,IF(AND(RC[-3]>1,RC[-3]<2),50,IF(RC[-3]>2,0))))))))) ->  | I361: =IF(RC[-1]="",RC[-2],0.7*RC[-1]+0.3*RC[-2]) -> 85
A362: سیمان خاش | B362: سخاش | C362: =VLOOKUP(RC[-1],Sheet1!R3C2:R802C3,2,FALSE) -> سیمان آهک گچ | D362: =VLOOKUP(RC[-2],Sheet1!R3C2:R802C9,8,FALSE) -> 3.6400919545033252 | E362: =IF(VLOOKUP(RC[-3],Sheet1!R3C2:R803C11,10,FALSE)=0,"",VLOOKUP(Sheet2!RC[-3],Sheet1!R[1]C[-3]:R[801]C[6],10,FALSE)) ->  | F362: =Sheet1!R419C10 -> 6.5383737205402594 | G362: =IF(RC[-3]<0,0,IF(AND(RC[-3]<RC[-1],RC[-3]<2),100,IF(AND(RC[-3]<RC[-1],RC[-3]>=2,RC[-3]<3),95,IF(AND(RC[-3]<RC[-1],RC[-3]>=3,RC[-3]<4),90,IF(AND(RC[-3]<RC[-1],RC[-3]>=4,RC[-3]<5),85,IF(AND(RC[-3]<RC[-1],RC[-3]>=5,RC[-3]<6),80,IF(AND(RC[-3]<RC[-1],RC[-3]>=6,RC[-3]<7),75,IF(AND(RC[-3]<RC[-1],RC[-3]>=7,RC[-3]<8),70,IF(AND(RC[-3]<RC[-1],RC[-3]>=8,RC[-3]<9),65,IF(AND(RC[-3]<RC[-1],RC[-3]>=9,RC[-3]<10),60,IF(AND(RC[-3]<RC[-1],RC[-3]>=10,RC[-3]<11),55,IF(AND(RC[-3]<RC[-1],RC[-3]>=11,RC[-3]<12),50,IF(AND(RC[-3]<RC[-1],RC[-3]>=12,RC[-3]<13),45,IF(AND(RC[-3]<RC[-1],RC[-3]>=13,RC[-3]<14),40,IF(AND(RC[-3]<RC[-1],RC[-3]>=14,RC[-3]<15),35,IF(AND(RC[-3]<RC[-1],RC[-3]>=15,RC[-3]<16),30,IF(AND(RC[-3]<RC[-1],RC[-3]>=16,RC[-3]<17),25,IF(AND(RC[-3]<RC[-1],RC[-3]>=17,RC[-3]<18),20,IF(AND(RC[-3]<RC[-1],RC[-3]>=18,RC[-3]<19),15,IF(AND(RC[-3]<RC[-1],RC[-3]>=19,RC[-3]<20),10,IF(AND(RC[-3]<RC[-1],RC[-3]>=20,RC[-3]<21),5,IF(AND(RC[-3]<RC[-1],RC[-3]>=21),0,IF(AND(RC[-3]>RC[-1],RC[-3]>=2,RC[-3]<3),90,IF(AND(RC[-3]>RC[-1],RC[-3]>=3,RC[-3]<4),90,IF(AND(RC[-3]>RC[-1],RC[-3]>=4,RC[-3]<5),80,IF(AND(RC[-3]>RC[-1],RC[-3]>=5,RC[-3]<6),70,IF(AND(RC[-3]>RC[-1],RC[-3]>=6,RC[-3]<7),60,IF(AND(RC[-3]>RC[-1],RC[-3]>=7,RC[-3]<8),50,IF(AND(RC[-3]>RC[-1],RC[-3]>=8,RC[-3]<9),40,IF(AND(RC[-3]>RC[-1],RC[-3]>=9,RC[-3]<10),30,IF(AND(RC[-3]>RC[-1],RC[-3]>=10,RC[-3]<11),20,IF(AND(RC[-3]>RC[-1],RC[-3]>=11,RC[-3]<12),10,IF(AND(RC[-3]>RC[-1],RC[-3]>=12),0))))))))))))))))))))))))))))))))) -> 90 | H362: =IF(RC[-3]="","",IF(RC[-3]<0.3,100,IF(AND(RC[-3]>=0.3,RC[-3]>0.4),95,IF(AND(RC[-3]>=0.4,RC[-3]<0.5),90,IF(AND(RC[-3]>=0.5,RC[-3]<0.6),85,IF(AND(RC[-3]>=0.6,RC[-3]<0.7),80,IF(AND(RC[-3]>=0.6,RC[-3]<1),80,IF(AND(RC[-3]>1,RC[-3]<2),50,IF(RC[-3]>2,0))))))))) ->  | I362: =IF(RC[-1]="",RC[-2],0.7*RC[-1]+0.3*RC[-2]) -> 90
A363: سیمان خزر | B363: سخزر | C363: =VLOOKUP(RC[-1],Sheet1!R3C2:R802C3,2,FALSE) -> سیمان آهک گچ | D363: =VLOOKUP(RC[-2],Sheet1!R3C2:R802C9,8,FALSE) -> 6.5288108011103327 | E363: =IF(VLOOKUP(RC[-3],Sheet1!R3C2:R803C11,10,FALSE)=0,"",VLOOKUP(Sheet2!RC[-3],Sheet1!R[1]C[-3]:R[801]C[6],10,FALSE)) ->  | F363: =Sheet1!R419C10 -> 6.5383737205402594 | G363: =IF(RC[-3]<0,0,IF(AND(RC[-3]<RC[-1],RC[-3]<2),100,IF(AND(RC[-3]<RC[-1],RC[-3]>=2,RC[-3]<3),95,IF(AND(RC[-3]<RC[-1],RC[-3]>=3,RC[-3]<4),90,IF(AND(RC[-3]<RC[-1],RC[-3]>=4,RC[-3]<5),85,IF(AND(RC[-3]<RC[-1],RC[-3]>=5,RC[-3]<6),80,IF(AND(RC[-3]<RC[-1],RC[-3]>=6,RC[-3]<7),75,IF(AND(RC[-3]<RC[-1],RC[-3]>=7,RC[-3]<8),70,IF(AND(RC[-3]<RC[-1],RC[-3]>=8,RC[-3]<9),65,IF(AND(RC[-3]<RC[-1],RC[-3]>=9,RC[-3]<10),60,IF(AND(RC[-3]<RC[-1],RC[-3]>=10,RC[-3]<11),55,IF(AND(RC[-3]<RC[-1],RC[-3]>=11,RC[-3]<12),50,IF(AND(RC[-3]<RC[-1],RC[-3]>=12,RC[-3]<13),45,IF(AND(RC[-3]<RC[-1],RC[-3]>=13,RC[-3]<14),40,IF(AND(RC[-3]<RC[-1],RC[-3]>=14,RC[-3]<15),35,IF(AND(RC[-3]<RC[-1],RC[-3]>=15,RC[-3]<16),30,IF(AND(RC[-3]<RC[-1],RC[-3]>=16,RC[-3]<17),25,IF(AND(RC[-3]<RC[-1],RC[-3]>=17,RC[-3]<18),20,IF(AND(RC[-3]<RC[-1],RC[-3]>=18,RC[-3]<19),15,IF(AND(RC[-3]<RC[-1],RC[-3]>=19,RC[-3]<20),10,IF(AND(RC[-3]<RC[-1],RC[-3]>=20,RC[-3]<21),5,IF(AND(RC[-3]<RC[-1],RC[-3]>=21),0,IF(AND(RC[-3]>RC[-1],RC[-3]>=2,RC[-3]<3),90,IF(AND(RC[-3]>RC[-1],RC[-3]>=3,RC[-3]<4),90,IF(AND(RC[-3]>RC[-1],RC[-3]>=4,RC[-3]<5),80,IF(AND(RC[-3]>RC[-1],RC[-3]>=5,RC[-3]<6),70,IF(AND(RC[-3]>RC[-1],RC[-3]>=6,RC[-3]<7),60,IF(AND(RC[-3]>RC[-1],RC[-3]>=7,RC[-3]<8),50,IF(AND(RC[-3]>RC[-1],RC[-3]>=8,RC[-3]<9),40,IF(AND(RC[-3]>RC[-1],RC[-3]>=9,RC[-3]<10),30,IF(AND(RC[-3]>RC[-1],RC[-3]>=10,RC[-3]<11),20,IF(AND(RC[-3]>RC[-1],RC[-3]>=11,RC[-3]<12),10,IF(AND(RC[-3]>RC[-1],RC[-3]>=12),0))))))))))))))))))))))))))))))))) -> 75 | H363: =IF(RC[-3]="","",IF(RC[-3]<0.3,100,IF(AND(RC[-3]>=0.3,RC[-3]>0.4),95,IF(AND(RC[-3]>=0.4,RC[-3]<0.5),90,IF(AND(RC[-3]>=0.5,RC[-3]<0.6),85,IF(AND(RC[-3]>=0.6,RC[-3]<0.7),80,IF(AND(RC[-3]>=0.6,RC[-3]<1),80,IF(AND(RC[-3]>1,RC[-3]<2),50,IF(RC[-3]>2,0))))))))) ->  | I363: =IF(RC[-1]="",RC[-2],0.7*RC[-1]+0.3*RC[-2]) -> 75
A364: سیمان خوزستان | B364: سخوز | C364: =VLOOKUP(RC[-1],Sheet1!R3C2:R802C3,2,FALSE) -> سیمان آهک گچ | D364: =VLOOKUP(RC[-2],Sheet1!R3C2:R802C9,8,FALSE) -> 4.5 | E364: =IF(VLOOKUP(RC[-3],Sheet1!R3C2:R803C11,10,FALSE)=0,"",VLOOKUP(Sheet2!RC[-3],Sheet1!R[1]C[-3]:R[801]C[6],10,FALSE)) ->  | F364: =Sheet1!R419C10 -> 6.5383737205402594 | G364: =IF(RC[-3]<0,0,IF(AND(RC[-3]<RC[-1],RC[-3]<2),100,IF(AND(RC[-3]<RC[-1],RC[-3]>=2,RC[-3]<3),95,IF(AND(RC[-3]<RC[-1],RC[-3]>=3,RC[-3]<4),90,IF(AND(RC[-3]<RC[-1],RC[-3]>=4,RC[-3]<5),85,IF(AND(RC[-3]<RC[-1],RC[-3]>=5,RC[-3]<6),80,IF(AND(RC[-3]<RC[-1],RC[-3]>=6,RC[-3]<7),75,IF(AND(RC[-3]<RC[-1],RC[-3]>=7,RC[-3]<8),70,IF(AND(RC[-3]<RC[-1],RC[-3]>=8,RC[-3]<9),65,IF(AND(RC[-3]<RC[-1],RC[-3]>=9,RC[-3]<10),60,IF(AND(RC[-3]<RC[-1],RC[-3]>=10,RC[-3]<11),55,IF(AND(RC[-3]<RC[-1],RC[-3]>=11,RC[-3]<12),50,IF(AND(RC[-3]<RC[-1],RC[-3]>=12,RC[-3]<13),45,IF(AND(RC[-3]<RC[-1],RC[-3]>=13,RC[-3]<14),40,IF(AND(RC[-3]<RC[-1],RC[-3]>=14,RC[-3]<15),35,IF(AND(RC[-3]<RC[-1],RC[-3]>=15,RC[-3]<16),30,IF(AND(RC[-3]<RC[-1],RC[-3]>=16,RC[-3]<17),25,IF(AND(RC[-3]<RC[-1],RC[-3]>=17,RC[-3]<18),20,IF(AND(RC[-3]<RC[-1],RC[-3]>=18,RC[-3]<19),15,IF(AND(RC[-3]<RC[-1],RC[-3]>=19,RC[-3]<20),10,IF(AND(RC[-3]<RC[-1],RC[-3]>=20,RC[-3]<21),5,IF(AND(RC[-3]<RC[-1],RC[-3]>=21),0,IF(AND(RC[-3]>RC[-1],RC[-3]>=2,RC[-3]<3),90,IF(AND(RC[-3]>RC[-1],RC[-3]>=3,RC[-3]<4),90,IF(AND(RC[-3]>RC[-1],RC[-3]>=4,RC[-3]<5),80,IF(AND(RC[-3]>RC[-1],RC[-3]>=5,RC[-3]<6),70,IF(AND(RC[-3]>RC[-1],RC[-3]>=6,RC[-3]<7),60,IF(AND(RC[-3]>RC[-1],RC[-3]>=7,RC[-3]<8),50,IF(AND(RC[-3]>RC[-1],RC[-3]>=8,RC[-3]<9),40,IF(AND(RC[-3]>RC[-1],RC[-3]>=9,RC[-3]<10),30,IF(AND(RC[-3]>RC[-1],RC[-3]>=10,RC[-3]<11),20,IF(AND(RC[-3]>RC[-1],RC[-3]>=11,RC[-3]<12),10,IF(AND(RC[-3]>RC[-1],RC[-3]>=12),0))))))))))))))))))))))))))))))))) -> 85 | H364: =IF(RC[-3]="","",IF(RC[-3]<0.3,100,IF(AND(RC[-3]>=0.3,RC[-3]>0.4),95,IF(AND(RC[-3]>=0.4,RC[-3]<0.5),90,IF(AND(RC[-3]>=0.5,RC[-3]<0.6),85,IF(AND(RC[-3]>=0.6,RC[-3]<0.7),80,IF(AND(RC[-3]>=0.6,RC[-3]<1),80,IF(AND(RC[-3]>1,RC[-3]<2),50,IF(RC[-3]>2,0))))))))) ->  | I364: =IF(RC[-1]="",RC[-2],0.7*RC[-1]+0.3*RC[-2]) -> 85
A365: سیمان داراب | B365: ساراب | C365: =VLOOKUP(RC[-1],Sheet1!R3C2:R802C3,2,FALSE) -> سیمان آهک گچ | D365: =VLOOKUP(RC[-2],Sheet1!R3C2:R802C9,8,FALSE) -> 5.6151132620575348 | E365: =IF(VLOOKUP(RC[-3],Sheet1!R3C2:R803C11,10,FALSE)=0,"",VLOOKUP(Sheet2!RC[-3],Sheet1!R[1]C[-3]:R[801]C[6],10,FALSE)) ->  | F365: =Sheet1!R419C10 -> 6.5383737205402594 | G365: =IF(RC[-3]<0,0,IF(AND(RC[-3]<RC[-1],RC[-3]<2),100,IF(AND(RC[-3]<RC[-1],RC[-3]>=2,RC[-3]<3),95,IF(AND(RC[-3]<RC[-1],RC[-3]>=3,RC[-3]<4),90,IF(AND(RC[-3]<RC[-1],RC[-3]>=4,RC[-3]<5),85,IF(AND(RC[-3]<RC[-1],RC[-3]>=5,RC[-3]<6),80,IF(AND(RC[-3]<RC[-1],RC[-3]>=6,RC[-3]<7),75,IF(AND(RC[-3]<RC[-1],RC[-3]>=7,RC[-3]<8),70,IF(AND(RC[-3]<RC[-1],RC[-3]>=8,RC[-3]<9),65,IF(AND(RC[-3]<RC[-1],RC[-3]>=9,RC[-3]<10),60,IF(AND(RC[-3]<RC[-1],RC[-3]>=10,RC[-3]<11),55,IF(AND(RC[-3]<RC[-1],RC[-3]>=11,RC[-3]<12),50,IF(AND(RC[-3]<RC[-1],RC[-3]>=12,RC[-3]<13),45,IF(AND(RC[-3]<RC[-1],RC[-3]>=13,RC[-3]<14),40,IF(AND(RC[-3]<RC[-1],RC[-3]>=14,RC[-3]<15),35,IF(AND(RC[-3]<RC[-1],RC[-3]>=15,RC[-3]<16),30,IF(AND(RC[-3]<RC[-1],RC[-3]>=16,RC[-3]<17),25,IF(AND(RC[-3]<RC[-1],RC[-3]>=17,RC[-3]<18),20,IF(AND(RC[-3]<RC[-1],RC[-3]>=18,RC[-3]<19),15,IF(AND(RC[-3]<RC[-1],RC[-3]>=19,RC[-3]<20),10,IF(AND(RC[-3]<RC[-1],RC[-3]>=20,RC[-3]<21),5,IF(AND(RC[-3]<RC[-1],RC[-3]>=21),0,IF(AND(RC[-3]>RC[-1],RC[-3]>=2,RC[-3]<3),90,IF(AND(RC[-3]>RC[-1],RC[-3]>=3,RC[-3]<4),90,IF(AND(RC[-3]>RC[-1],RC[-3]>=4,RC[-3]<5),80,IF(AND(RC[-3]>RC[-1],RC[-3]>=5,RC[-3]<6),70,IF(AND(RC[-3]>RC[-1],RC[-3]>=6,RC[-3]<7),60,IF(AND(RC[-3]>RC[-1],RC[-3]>=7,RC[-3]<8),50,IF(AND(RC[-3]>RC[-1],RC[-3]>=8,RC[-3]<9),40,IF(AND(RC[-3]>RC[-1],RC[-3]>=9,RC[-3]<10),30,IF(AND(RC[-3]>RC[-1],RC[-3]>=10,RC[-3]<11),20,IF(AND(RC[-3]>RC[-1],RC[-3]>=11,RC[-3]<12),10,IF(AND(RC[-3]>RC[-1],RC[-3]>=12),0))))))))))))))))))))))))))))))))) -> 80 | H365: =IF(RC[-3]="","",IF(RC[-3]<0.3,100,IF(AND(RC[-3]>=0.3,RC[-3]>0.4),95,IF(AND(RC[-3]>=0.4,RC[-3]<0.5),90,IF(AND(RC[-3]>=0.5,RC[-3]<0.6),85,IF(AND(RC[-3]>=0.6,RC[-3]<0.7),80,IF(AND(RC[-3]>=0.6,RC[-3]<1),80,IF(AND(RC[-3]>1,RC[-3]<2),50,IF(RC[-3]>2,0))))))))) ->  | I365: =IF(RC[-1]="",RC[-2],0.7*RC[-1]+0.3*RC[-2]) -> 80
A366: سیمان دشتستان | B366: سدشت | C366: =VLOOKUP(RC[-1],Sheet1!R3C2:R802C3,2,FALSE) -> سیمان آهک گچ | D366: =VLOOKUP(RC[-2],Sheet1!R3C2:R802C9,8,FALSE) -> 8.473401994065263 | E366: =IF(VLOOKUP(RC[-3],Sheet1!R3C2:R803C11,10,FALSE)=0,"",VLOOKUP(Sheet2!RC[-3],Sheet1!R[1]C[-3]:R[801]C[6],10,FALSE)) ->  | F366: =Sheet1!R419C10 -> 6.5383737205402594 | G366: =IF(RC[-3]<0,0,IF(AND(RC[-3]<RC[-1],RC[-3]<2),100,IF(AND(RC[-3]<RC[-1],RC[-3]>=2,RC[-3]<3),95,IF(AND(RC[-3]<RC[-1],RC[-3]>=3,RC[-3]<4),90,IF(AND(RC[-3]<RC[-1],RC[-3]>=4,RC[-3]<5),85,IF(AND(RC[-3]<RC[-1],RC[-3]>=5,RC[-3]<6),80,IF(AND(RC[-3]<RC[-1],RC[-3]>=6,RC[-3]<7),75,IF(AND(RC[-3]<RC[-1],RC[-3]>=7,RC[-3]<8),70,IF(AND(RC[-3]<RC[-1],RC[-3]>=8,RC[-3]<9),65,IF(AND(RC[-3]<RC[-1],RC[-3]>=9,RC[-3]<10),60,IF(AND(RC[-3]<RC[-1],RC[-3]>=10,RC[-3]<11),55,IF(AND(RC[-3]<RC[-1],RC[-3]>=11,RC[-3]<12),50,IF(AND(RC[-3]<RC[-1],RC[-3]>=12,RC[-3]<13),45,IF(AND(RC[-3]<RC[-1],RC[-3]>=13,RC[-3]<14),40,IF(AND(RC[-3]<RC[-1],RC[-3]>=14,RC[-3]<15),35,IF(AND(RC[-3]<RC[-1],RC[-3]>=15,RC[-3]<16),30,IF(AND(RC[-3]<RC[-1],RC[-3]>=16,RC[-3]<17),25,IF(AND(RC[-3]<RC[-1],RC[-3]>=17,RC[-3]<18),20,IF(AND(RC[-3]<RC[-1],RC[-3]>=18,RC[-3]<19),15,IF(AND(RC[-3]<RC[-1],RC[-3]>=19,RC[-3]<20),10,IF(AND(RC[-3]<RC[-1],RC[-3]>=20,RC[-3]<21),5,IF(AND(RC[-3]<RC[-1],RC[-3]>=21),0,IF(AND(RC[-3]>RC[-1],RC[-3]>=2,RC[-3]<3),90,IF(AND(RC[-3]>RC[-1],RC[-3]>=3,RC[-3]<4),90,IF(AND(RC[-3]>RC[-1],RC[-3]>=4,RC[-3]<5),80,IF(AND(RC[-3]>RC[-1],RC[-3]>=5,RC[-3]<6),70,IF(AND(RC[-3]>RC[-1],RC[-3]>=6,RC[-3]<7),60,IF(AND(RC[-3]>RC[-1],RC[-3]>=7,RC[-3]<8),50,IF(AND(RC[-3]>RC[-1],RC[-3]>=8,RC[-3]<9),40,IF(AND(RC[-3]>RC[-1],RC[-3]>=9,RC[-3]<10),30,IF(AND(RC[-3]>RC[-1],RC[-3]>=10,RC[-3]<11),20,IF(AND(RC[-3]>RC[-1],RC[-3]>=11,RC[-3]<12),10,IF(AND(RC[-3]>RC[-1],RC[-3]>=12),0))))))))))))))))))))))))))))))))) -> 40 | H366: =IF(RC[-3]="","",IF(RC[-3]<0.3,100,IF(AND(RC[-3]>=0.3,RC[-3]>0.4),95,IF(AND(RC[-3]>=0.4,RC[-3]<0.5),90,IF(AND(RC[-3]>=0.5,RC[-3]<0.6),85,IF(AND(RC[-3]>=0.6,RC[-3]<0.7),80,IF(AND(RC[-3]>=0.6,RC[-3]<1),80,IF(AND(RC[-3]>1,RC[-3]<2),50,IF(RC[-3]>2,0))))))))) ->  | I366: =IF(RC[-1]="",RC[-2],0.7*RC[-1]+0.3*RC[-2]) -> 40
A367: سیمان دورود | B367: سدور | C367: =VLOOKUP(RC[-1],Sheet1!R3C2:R802C3,2,FALSE) -> سیمان آهک گچ | D367: =VLOOKUP(RC[-2],Sheet1!R3C2:R802C9,8,FALSE) -> 17.460518409349813 | E367: =IF(VLOOKUP(RC[-3],Sheet1!R3C2:R803C11,10,FALSE)=0,"",VLOOKUP(Sheet2!RC[-3],Sheet1!R[1]C[-3]:R[801]C[6],10,FALSE)) ->  | F367: =Sheet1!R419C10 -> 6.5383737205402594 | G367: =IF(RC[-3]<0,0,IF(AND(RC[-3]<RC[-1],RC[-3]<2),100,IF(AND(RC[-3]<RC[-1],RC[-3]>=2,RC[-3]<3),95,IF(AND(RC[-3]<RC[-1],RC[-3]>=3,RC[-3]<4),90,IF(AND(RC[-3]<RC[-1],RC[-3]>=4,RC[-3]<5),85,IF(AND(RC[-3]<RC[-1],RC[-3]>=5,RC[-3]<6),80,IF(AND(RC[-3]<RC[-1],RC[-3]>=6,RC[-3]<7),75,IF(AND(RC[-3]<RC[-1],RC[-3]>=7,RC[-3]<8),70,IF(AND(RC[-3]<RC[-1],RC[-3]>=8,RC[-3]<9),65,IF(AND(RC[-3]<RC[-1],RC[-3]>=9,RC[-3]<10),60,IF(AND(RC[-3]<RC[-1],RC[-3]>=10,RC[-3]<11),55,IF(AND(RC[-3]<RC[-1],RC[-3]>=11,RC[-3]<12),50,IF(AND(RC[-3]<RC[-1],RC[-3]>=12,RC[-3]<13),45,IF(AND(RC[-3]<RC[-1],RC[-3]>=13,RC[-3]<14),40,IF(AND(RC[-3]<RC[-1],RC[-3]>=14,RC[-3]<15),35,IF(AND(RC[-3]<RC[-1],RC[-3]>=15,RC[-3]<16),30,IF(AND(RC[-3]<RC[-1],RC[-3]>=16,RC[-3]<17),25,IF(AND(RC[-3]<RC[-1],RC[-3]>=17,RC[-3]<18),20,IF(AND(RC[-3]<RC[-1],RC[-3]>=18,RC[-3]<19),15,IF(AND(RC[-3]<RC[-1],RC[-3]>=19,RC[-3]<20),10,IF(AND(RC[-3]<RC[-1],RC[-3]>=20,RC[-3]<21),5,IF(AND(RC[-3]<RC[-1],RC[-3]>=21),0,IF(AND(RC[-3]>RC[-1],RC[-3]>=2,RC[-3]<3),90,IF(AND(RC[-3]>RC[-1],RC[-3]>=3,RC[-3]<4),90,IF(AND(RC[-3]>RC[-1],RC[-3]>=4,RC[-3]<5),80,IF(AND(RC[-3]>RC[-1],RC[-3]>=5,RC[-3]<6),70,IF(AND(RC[-3]>RC[-1],RC[-3]>=6,RC[-3]<7),60,IF(AND(RC[-3]>RC[-1],RC[-3]>=7,RC[-3]<8),50,IF(AND(RC[-3]>RC[-1],RC[-3]>=8,RC[-3]<9),40,IF(AND(RC[-3]>RC[-1],RC[-3]>=9,RC[-3]<10),30,IF(AND(RC[-3]>RC[-1],RC[-3]>=10,RC[-3]<11),20,IF(AND(RC[-3]>RC[-1],RC[-3]>=11,RC[-3]<12),10,IF(AND(RC[-3]>RC[-1],RC[-3]>=12),0))))))))))))))))))))))))))))))))) -> 0 | H367: =IF(RC[-3]="","",IF(RC[-3]<0.3,100,IF(AND(RC[-3]>=0.3,RC[-3]>0.4),95,IF(AND(RC[-3]>=0.4,RC[-3]<0.5),90,IF(AND(RC[-3]>=0.5,RC[-3]<0.6),85,IF(AND(RC[-3]>=0.6,RC[-3]<0.7),80,IF(AND(RC[-3]>=0.6,RC[-3]<1),80,IF(AND(RC[-3]>1,RC[-3]<2),50,IF(RC[-3]>2,0))))))))) ->  | I367: =IF(RC[-1]="",RC[-2],0.7*RC[-1]+0.3*RC[-2]) -> 0
A368: سیمان ساوه | B368: ساوه | C368: =VLOOKUP(RC[-1],Sheet1!R3C2:R802C3,2,FALSE) -> سیمان آهک گچ | D368: =VLOOKUP(RC[-2],Sheet1!R3C2:R802C9,8,FALSE) -> 5.4567002830868745 | E368: =IF(VLOOKUP(RC[-3],Sheet1!R3C2:R803C11,10,FALSE)=0,"",VLOOKUP(Sheet2!RC[-3],Sheet1!R[1]C[-3]:R[801]C[6],10,FALSE)) ->  | F368: =Sheet1!R419C10 -> 6.5383737205402594 | G368: =IF(RC[-3]<0,0,IF(AND(RC[-3]<RC[-1],RC[-3]<2),100,IF(AND(RC[-3]<RC[-1],RC[-3]>=2,RC[-3]<3),95,IF(AND(RC[-3]<RC[-1],RC[-3]>=3,RC[-3]<4),90,IF(AND(RC[-3]<RC[-1],RC[-3]>=4,RC[-3]<5),85,IF(AND(RC[-3]<RC[-1],RC[-3]>=5,RC[-3]<6),80,IF(AND(RC[-3]<RC[-1],RC[-3]>=6,RC[-3]<7),75,IF(AND(RC[-3]<RC[-1],RC[-3]>=7,RC[-3]<8),70,IF(AND(RC[-3]<RC[-1],RC[-3]>=8,RC[-3]<9),65,IF(AND(RC[-3]<RC[-1],RC[-3]>=9,RC[-3]<10),60,IF(AND(RC[-3]<RC[-1],RC[-3]>=10,RC[-3]<11),55,IF(AND(RC[-3]<RC[-1],RC[-3]>=11,RC[-3]<12),50,IF(AND(RC[-3]<RC[-1],RC[-3]>=12,RC[-3]<13),45,IF(AND(RC[-3]<RC[-1],RC[-3]>=13,RC[-3]<14),40,IF(AND(RC[-3]<RC[-1],RC[-3]>=14,RC[-3]<15),35,IF(AND(RC[-3]<RC[-1],RC[-3]>=15,RC[-3]<16),30,IF(AND(RC[-3]<RC[-1],RC[-3]>=16,RC[-3]<17),25,IF(AND(RC[-3]<RC[-1],RC[-3]>=17,RC[-3]<18),20,IF(AND(RC[-3]<RC[-1],RC[-3]>=18,RC[-3]<19),15,IF(AND(RC[-3]<RC[-1],RC[-3]>=19,RC[-3]<20),10,IF(AND(RC[-3]<RC[-1],RC[-3]>=20,RC[-3]<21),5,IF(AND(RC[-3]<RC[-1],RC[-3]>=21),0,IF(AND(RC[-3]>RC[-1],RC[-3]>=2,RC[-3]<3),90,IF(AND(RC[-3]>RC[-1],RC[-3]>=3,RC[-3]<4),90,IF(AND(RC[-3]>RC[-1],RC[-3]>=4,RC[-3]<5),80,IF(AND(RC[-3]>RC[-1],RC[-3]>=5,RC[-3]<6),70,IF(AND(RC[-3]>RC[-1],RC[-3]>=6,RC[-3]<7),60,IF(AND(RC[-3]>RC[-1],RC[-3]>=7,RC[-3]<8),50,IF(AND(RC[-3]>RC[-1],RC[-3]>=8,RC[-3]<9),40,IF(AND(RC[-3]>RC[-1],RC[-3]>=9,RC[-3]<10),30,IF(AND(RC[-3]>RC[-1],RC[-3]>=10,RC[-3]<11),20,IF(AND(RC[-3]>RC[-1],RC[-3]>=11,RC[-3]<12),10,IF(AND(RC[-3]>RC[-1],RC[-3]>=12),0))))))))))))))))))))))))))))))))) -> 80 | H368: =IF(RC[-3]="","",IF(RC[-3]<0.3,100,IF(AND(RC[-3]>=0.3,RC[-3]>0.4),95,IF(AND(RC[-3]>=0.4,RC[-3]<0.5),90,IF(AND(RC[-3]>=0.5,RC[-3]<0.6),85,IF(AND(RC[-3]>=0.6,RC[-3]<0.7),80,IF(AND(RC[-3]>=0.6,RC[-3]<1),80,IF(AND(RC[-3]>1,RC[-3]<2),50,IF(RC[-3]>2,0))))))))) ->  | I368: =IF(RC[-1]="",RC[-2],0.7*RC[-1]+0.3*RC[-2]) -> 80
A369: سیمان سپاهان | B369: سپاها | C369: =VLOOKUP(RC[-1],Sheet1!R3C2:R802C3,2,FALSE) -> سیمان آهک گچ | D369: =VLOOKUP(RC[-2],Sheet1!R3C2:R802C9,8,FALSE) -> 3.4510929109585256 | E369: =IF(VLOOKUP(RC[-3],Sheet1!R3C2:R803C11,10,FALSE)=0,"",VLOOKUP(Sheet2!RC[-3],Sheet1!R[1]C[-3]:R[801]C[6],10,FALSE)) ->  | F369: =Sheet1!R419C10 -> 6.5383737205402594 | G369: =IF(RC[-3]<0,0,IF(AND(RC[-3]<RC[-1],RC[-3]<2),100,IF(AND(RC[-3]<RC[-1],RC[-3]>=2,RC[-3]<3),95,IF(AND(RC[-3]<RC[-1],RC[-3]>=3,RC[-3]<4),90,IF(AND(RC[-3]<RC[-1],RC[-3]>=4,RC[-3]<5),85,IF(AND(RC[-3]<RC[-1],RC[-3]>=5,RC[-3]<6),80,IF(AND(RC[-3]<RC[-1],RC[-3]>=6,RC[-3]<7),75,IF(AND(RC[-3]<RC[-1],RC[-3]>=7,RC[-3]<8),70,IF(AND(RC[-3]<RC[-1],RC[-3]>=8,RC[-3]<9),65,IF(AND(RC[-3]<RC[-1],RC[-3]>=9,RC[-3]<10),60,IF(AND(RC[-3]<RC[-1],RC[-3]>=10,RC[-3]<11),55,IF(AND(RC[-3]<RC[-1],RC[-3]>=11,RC[-3]<12),50,IF(AND(RC[-3]<RC[-1],RC[-3]>=12,RC[-3]<13),45,IF(AND(RC[-3]<RC[-1],RC[-3]>=13,RC[-3]<14),40,IF(AND(RC[-3]<RC[-1],RC[-3]>=14,RC[-3]<15),35,IF(AND(RC[-3]<RC[-1],RC[-3]>=15,RC[-3]<16),30,IF(AND(RC[-3]<RC[-1],RC[-3]>=16,RC[-3]<17),25,IF(AND(RC[-3]<RC[-1],RC[-3]>=17,RC[-3]<18),20,IF(AND(RC[-3]<RC[-1],RC[-3]>=18,RC[-3]<19),15,IF(AND(RC[-3]<RC[-1],RC[-3]>=19,RC[-3]<20),10,IF(AND(RC[-3]<RC[-1],RC[-3]>=20,RC[-3]<21),5,IF(AND(RC[-3]<RC[-1],RC[-3]>=21),0,IF(AND(RC[-3]>RC[-1],RC[-3]>=2,RC[-3]<3),90,IF(AND(RC[-3]>RC[-1],RC[-3]>=3,RC[-3]<4),90,IF(AND(RC[-3]>RC[-1],RC[-3]>=4,RC[-3]<5),80,IF(AND(RC[-3]>RC[-1],RC[-3]>=5,RC[-3]<6),70,IF(AND(RC[-3]>RC[-1],RC[-3]>=6,RC[-3]<7),60,IF(AND(RC[-3]>RC[-1],RC[-3]>=7,RC[-3]<8),50,IF(AND(RC[-3]>RC[-1],RC[-3]>=8,RC[-3]<9),40,IF(AND(RC[-3]>RC[-1],RC[-3]>=9,RC[-3]<10),30,IF(AND(RC[-3]>RC[-1],RC[-3]>=10,RC[-3]<11),20,IF(AND(RC[-3]>RC[-1],RC[-3]>=11,RC[-3]<12),10,IF(AND(RC[-3]>RC[-1],RC[-3]>=12),0))))))))))))))))))))))))))))))))) -> 90 | H369: =IF(RC[-3]="","",IF(RC[-3]<0.3,100,IF(AND(RC[-3]>=0.3,RC[-3]>0.4),95,IF(AND(RC[-3]>=0.4,RC[-3]<0.5),90,IF(AND(RC[-3]>=0.5,RC[-3]<0.6),85,IF(AND(RC[-3]>=0.6,RC[-3]<0.7),80,IF(AND(RC[-3]>=0.6,RC[-3]<1),80,IF(AND(RC[-3]>1,RC[-3]<2),50,IF(RC[-3]>2,0))))))))) ->  | I369: =IF(RC[-1]="",RC[-2],0.7*RC[-1]+0.3*RC[-2]) -> 90
A370: سیمان سفید نی ریز | B370: سنیر | C370: =VLOOKUP(RC[-1],Sheet1!R3C2:R802C3,2,FALSE) -> سیمان آهک گچ | D370: =VLOOKUP(RC[-2],Sheet1!R3C2:R802C9,8,FALSE) -> 12.523104755454167 | E370: =IF(VLOOKUP(RC[-3],Sheet1!R3C2:R803C11,10,FALSE)=0,"",VLOOKUP(Sheet2!RC[-3],Sheet1!R[1]C[-3]:R[801]C[6],10,FALSE)) ->  | F370: =Sheet1!R419C10 -> 6.5383737205402594 | G370: =IF(RC[-3]<0,0,IF(AND(RC[-3]<RC[-1],RC[-3]<2),100,IF(AND(RC[-3]<RC[-1],RC[-3]>=2,RC[-3]<3),95,IF(AND(RC[-3]<RC[-1],RC[-3]>=3,RC[-3]<4),90,IF(AND(RC[-3]<RC[-1],RC[-3]>=4,RC[-3]<5),85,IF(AND(RC[-3]<RC[-1],RC[-3]>=5,RC[-3]<6),80,IF(AND(RC[-3]<RC[-1],RC[-3]>=6,RC[-3]<7),75,IF(AND(RC[-3]<RC[-1],RC[-3]>=7,RC[-3]<8),70,IF(AND(RC[-3]<RC[-1],RC[-3]>=8,RC[-3]<9),65,IF(AND(RC[-3]<RC[-1],RC[-3]>=9,RC[-3]<10),60,IF(AND(RC[-3]<RC[-1],RC[-3]>=10,RC[-3]<11),55,IF(AND(RC[-3]<RC[-1],RC[-3]>=11,RC[-3]<12),50,IF(AND(RC[-3]<RC[-1],RC[-3]>=12,RC[-3]<13),45,IF(AND(RC[-3]<RC[-1],RC[-3]>=13,RC[-3]<14),40,IF(AND(RC[-3]<RC[-1],RC[-3]>=14,RC[-3]<15),35,IF(AND(RC[-3]<RC[-1],RC[-3]>=15,RC[-3]<16),30,IF(AND(RC[-3]<RC[-1],RC[-3]>=16,RC[-3]<17),25,IF(AND(RC[-3]<RC[-1],RC[-3]>=17,RC[-3]<18),20,IF(AND(RC[-3]<RC[-1],RC[-3]>=18,RC[-3]<19),15,IF(AND(RC[-3]<RC[-1],RC[-3]>=19,RC[-3]<20),10,IF(AND(RC[-3]<RC[-1],RC[-3]>=20,RC[-3]<21),5,IF(AND(RC[-3]<RC[-1],RC[-3]>=21),0,IF(AND(RC[-3]>RC[-1],RC[-3]>=2,RC[-3]<3),90,IF(AND(RC[-3]>RC[-1],RC[-3]>=3,RC[-3]<4),90,IF(AND(RC[-3]>RC[-1],RC[-3]>=4,RC[-3]<5),80,IF(AND(RC[-3]>RC[-1],RC[-3]>=5,RC[-3]<6),70,IF(AND(RC[-3]>RC[-1],RC[-3]>=6,RC[-3]<7),60,IF(AND(RC[-3]>RC[-1],RC[-3]>=7,RC[-3]<8),50,IF(AND(RC[-3]>RC[-1],RC[-3]>=8,RC[-3]<9),40,IF(AND(RC[-3]>RC[-1],RC[-3]>=9,RC[-3]<10),30,IF(AND(RC[-3]>RC[-1],RC[-3]>=10,RC[-3]<11),20,IF(AND(RC[-3]>RC[-1],RC[-3]>=11,RC[-3]<12),10,IF(AND(RC[-3]>RC[-1],RC[-3]>=12),0))))))))))))))))))))))))))))))))) -> 0 | H370: =IF(RC[-3]="","",IF(RC[-3]<0.3,100,IF(AND(RC[-3]>=0.3,RC[-3]>0.4),95,IF(AND(RC[-3]>=0.4,RC[-3]<0.5),90,IF(AND(RC[-3]>=0.5,RC[-3]<0.6),85,IF(AND(RC[-3]>=0.6,RC[-3]<0.7),80,IF(AND(RC[-3]>=0.6,RC[-3]<1),80,IF(AND(RC[-3]>1,RC[-3]<2),50,IF(RC[-3]>2,0))))))))) ->  | I370: =IF(RC[-1]="",RC[-2],0.7*RC[-1]+0.3*RC[-2]) -> 0
A371: سیمان شاهرود | B371: سرود | C371: =VLOOKUP(RC[-1],Sheet1!R3C2:R802C3,2,FALSE) -> سیمان آهک گچ | D371: =VLOOKUP(RC[-2],Sheet1!R3C2:R802C9,8,FALSE) -> 4.4945153789206449 | E371: =IF(VLOOKUP(RC[-3],Sheet1!R3C2:R803C11,10,FALSE)=0,"",VLOOKUP(Sheet2!RC[-3],Sheet1!R[1]C[-3]:R[801]C[6],10,FALSE)) ->  | F371: =Sheet1!R419C10 -> 6.5383737205402594 | G371: =IF(RC[-3]<0,0,IF(AND(RC[-3]<RC[-1],RC[-3]<2),100,IF(AND(RC[-3]<RC[-1],RC[-3]>=2,RC[-3]<3),95,IF(AND(RC[-3]<RC[-1],RC[-3]>=3,RC[-3]<4),90,IF(AND(RC[-3]<RC[-1],RC[-3]>=4,RC[-3]<5),85,IF(AND(RC[-3]<RC[-1],RC[-3]>=5,RC[-3]<6),80,IF(AND(RC[-3]<RC[-1],RC[-3]>=6,RC[-3]<7),75,IF(AND(RC[-3]<RC[-1],RC[-3]>=7,RC[-3]<8),70,IF(AND(RC[-3]<RC[-1],RC[-3]>=8,RC[-3]<9),65,IF(AND(RC[-3]<RC[-1],RC[-3]>=9,RC[-3]<10),60,IF(AND(RC[-3]<RC[-1],RC[-3]>=10,RC[-3]<11),55,IF(AND(RC[-3]<RC[-1],RC[-3]>=11,RC[-3]<12),50,IF(AND(RC[-3]<RC[-1],RC[-3]>=12,RC[-3]<13),45,IF(AND(RC[-3]<RC[-1],RC[-3]>=13,RC[-3]<14),40,IF(AND(RC[-3]<RC[-1],RC[-3]>=14,RC[-3]<15),35,IF(AND(RC[-3]<RC[-1],RC[-3]>=15,RC[-3]<16),30,IF(AND(RC[-3]<RC[-1],RC[-3]>=16,RC[-3]<17),25,IF(AND(RC[-3]<RC[-1],RC[-3]>=17,RC[-3]<18),20,IF(AND(RC[-3]<RC[-1],RC[-3]>=18,RC[-3]<19),15,IF(AND(RC[-3]<RC[-1],RC[-3]>=19,RC[-3]<20),10,IF(AND(RC[-3]<RC[-1],RC[-3]>=20,RC[-3]<21),5,IF(AND(RC[-3]<RC[-1],RC[-3]>=21),0,IF(AND(RC[-3]>RC[-1],RC[-3]>=2,RC[-3]<3),90,IF(AND(RC[-3]>RC[-1],RC[-3]>=3,RC[-3]<4),90,IF(AND(RC[-3]>RC[-1],RC[-3]>=4,RC[-3]<5),80,IF(AND(RC[-3]>RC[-1],RC[-3]>=5,RC[-3]<6),70,IF(AND(RC[-3]>RC[-1],RC[-3]>=6,RC[-3]<7),60,IF(AND(RC[-3]>RC[-1],RC[-3]>=7,RC[-3]<8),50,IF(AND(RC[-3]>RC[-1],RC[-3]>=8,RC[-3]<9),40,IF(AND(RC[-3]>RC[-1],RC[-3]>=9,RC[-3]<10),30,IF(AND(RC[-3]>RC[-1],RC[-3]>=10,RC[-3]<11),20,IF(AND(RC[-3]>RC[-1],RC[-3]>=11,RC[-3]<12),10,IF(AND(RC[-3]>RC[-1],RC[-3]>=12),0))))))))))))))))))))))))))))))))) -> 85 | H371: =IF(RC[-3]="","",IF(RC[-3]<0.3,100,IF(AND(RC[-3]>=0.3,RC[-3]>0.4),95,IF(AND(RC[-3]>=0.4,RC[-3]<0.5),90,IF(AND(RC[-3]>=0.5,RC[-3]<0.6),85,IF(AND(RC[-3]>=0.6,RC[-3]<0.7),80,IF(AND(RC[-3]>=0.6,RC[-3]<1),80,IF(AND(RC[-3]>1,RC[-3]<2),50,IF(RC[-3]>2,0))))))))) ->  | I371: =IF(RC[-1]="",RC[-2],0.7*RC[-1]+0.3*RC[-2]) -> 85
A372: سیمان شرق | B372: سشرق | C372: =VLOOKUP(RC[-1],Sheet1!R3C2:R802C3,2,FALSE) -> سیمان آهک گچ | D372: =VLOOKUP(RC[-2],Sheet1!R3C2:R802C9,8,FALSE) -> 3.7742384378758875 | E372: =IF(VLOOKUP(RC[-3],Sheet1!R3C2:R803C11,10,FALSE)=0,"",VLOOKUP(Sheet2!RC[-3],Sheet1!R[1]C[-3]:R[801]C[6],10,FALSE)) ->  | F372: =Sheet1!R419C10 -> 6.5383737205402594 | G372: =IF(RC[-3]<0,0,IF(AND(RC[-3]<RC[-1],RC[-3]<2),100,IF(AND(RC[-3]<RC[-1],RC[-3]>=2,RC[-3]<3),95,IF(AND(RC[-3]<RC[-1],RC[-3]>=3,RC[-3]<4),90,IF(AND(RC[-3]<RC[-1],RC[-3]>=4,RC[-3]<5),85,IF(AND(RC[-3]<RC[-1],RC[-3]>=5,RC[-3]<6),80,IF(AND(RC[-3]<RC[-1],RC[-3]>=6,RC[-3]<7),75,IF(AND(RC[-3]<RC[-1],RC[-3]>=7,RC[-3]<8),70,IF(AND(RC[-3]<RC[-1],RC[-3]>=8,RC[-3]<9),65,IF(AND(RC[-3]<RC[-1],RC[-3]>=9,RC[-3]<10),60,IF(AND(RC[-3]<RC[-1],RC[-3]>=10,RC[-3]<11),55,IF(AND(RC[-3]<RC[-1],RC[-3]>=11,RC[-3]<12),50,IF(AND(RC[-3]<RC[-1],RC[-3]>=12,RC[-3]<13),45,IF(AND(RC[-3]<RC[-1],RC[-3]>=13,RC[-3]<14),40,IF(AND(RC[-3]<RC[-1],RC[-3]>=14,RC[-3]<15),35,IF(AND(RC[-3]<RC[-1],RC[-3]>=15,RC[-3]<16),30,IF(AND(RC[-3]<RC[-1],RC[-3]>=16,RC[-3]<17),25,IF(AND(RC[-3]<RC[-1],RC[-3]>=17,RC[-3]<18),20,IF(AND(RC[-3]<RC[-1],RC[-3]>=18,RC[-3]<19),15,IF(AND(RC[-3]<RC[-1],RC[-3]>=19,RC[-3]<20),10,IF(AND(RC[-3]<RC[-1],RC[-3]>=20,RC[-3]<21),5,IF(AND(RC[-3]<RC[-1],RC[-3]>=21),0,IF(AND(RC[-3]>RC[-1],RC[-3]>=2,RC[-3]<3),90,IF(AND(RC[-3]>RC[-1],RC[-3]>=3,RC[-3]<4),90,IF(AND(RC[-3]>RC[-1],RC[-3]>=4,RC[-3]<5),80,IF(AND(RC[-3]>RC[-1],RC[-3]>=5,RC[-3]<6),70,IF(AND(RC[-3]>RC[-1],RC[-3]>=6,RC[-3]<7),60,IF(AND(RC[-3]>RC[-1],RC[-3]>=7,RC[-3]<8),50,IF(AND(RC[-3]>RC[-1],RC[-3]>=8,RC[-3]<9),40,IF(AND(RC[-3]>RC[-1],RC[-3]>=9,RC[-3]<10),30,IF(AND(RC[-3]>RC[-1],RC[-3]>=10,RC[-3]<11),20,IF(AND(RC[-3]>RC[-1],RC[-3]>=11,RC[-3]<12),10,IF(AND(RC[-3]>RC[-1],RC[-3]>=12),0))))))))))))))))))))))))))))))))) -> 90 | H372: =IF(RC[-3]="","",IF(RC[-3]<0.3,100,IF(AND(RC[-3]>=0.3,RC[-3]>0.4),95,IF(AND(RC[-3]>=0.4,RC[-3]<0.5),90,IF(AND(RC[-3]>=0.5,RC[-3]<0.6),85,IF(AND(RC[-3]>=0.6,RC[-3]<0.7),80,IF(AND(RC[-3]>=0.6,RC[-3]<1),80,IF(AND(RC[-3]>1,RC[-3]<2),50,IF(RC[-3]>2,0))))))))) ->  | I372: =IF(RC[-1]="",RC[-2],0.7*RC[-1]+0.3*RC[-2]) -> 90
A373: سیمان شمال | B373: سشمال | C373: =VLOOKUP(RC[-1],Sheet1!R3C2:R802C3,2,FALSE) -> سیمان آهک گچ | D373: =VLOOKUP(RC[-2],Sheet1!R3C2:R802C9,8,FALSE) -> 6.4279721391329954 | E373: =IF(VLOOKUP(RC[-3],Sheet1!R3C2:R803C11,10,FALSE)=0,"",VLOOKUP(Sheet2!RC[-3],Sheet1!R[1]C[-3]:R[801]C[6],10,FALSE)) ->  | F373: =Sheet1!R419C10 -> 6.5383737205402594 | G373: =IF(RC[-3]<0,0,IF(AND(RC[-3]<RC[-1],RC[-3]<2),100,IF(AND(RC[-3]<RC[-1],RC[-3]>=2,RC[-3]<3),95,IF(AND(RC[-3]<RC[-1],RC[-3]>=3,RC[-3]<4),90,IF(AND(RC[-3]<RC[-1],RC[-3]>=4,RC[-3]<5),85,IF(AND(RC[-3]<RC[-1],RC[-3]>=5,RC[-3]<6),80,IF(AND(RC[-3]<RC[-1],RC[-3]>=6,RC[-3]<7),75,IF(AND(RC[-3]<RC[-1],RC[-3]>=7,RC[-3]<8),70,IF(AND(RC[-3]<RC[-1],RC[-3]>=8,RC[-3]<9),65,IF(AND(RC[-3]<RC[-1],RC[-3]>=9,RC[-3]<10),60,IF(AND(RC[-3]<RC[-1],RC[-3]>=10,RC[-3]<11),55,IF(AND(RC[-3]<RC[-1],RC[-3]>=11,RC[-3]<12),50,IF(AND(RC[-3]<RC[-1],RC[-3]>=12,RC[-3]<13),45,IF(AND(RC[-3]<RC[-1],RC[-3]>=13,RC[-3]<14),40,IF(AND(RC[-3]<RC[-1],RC[-3]>=14,RC[-3]<15),35,IF(AND(RC[-3]<RC[-1],RC[-3]>=15,RC[-3]<16),30,IF(AND(RC[-3]<RC[-1],RC[-3]>=16,RC[-3]<17),25,IF(AND(RC[-3]<RC[-1],RC[-3]>=17,RC[-3]<18),20,IF(AND(RC[-3]<RC[-1],RC[-3]>=18,RC[-3]<19),15,IF(AND(RC[-3]<RC[-1],RC[-3]>=19,RC[-3]<20),10,IF(AND(RC[-3]<RC[-1],RC[-3]>=20,RC[-3]<21),5,IF(AND(RC[-3]<RC[-1],RC[-3]>=21),0,IF(AND(RC[-3]>RC[-1],RC[-3]>=2,RC[-3]<3),90,IF(AND(RC[-3]>RC[-1],RC[-3]>=3,RC[-3]<4),90,IF(AND(RC[-3]>RC[-1],RC[-3]>=4,RC[-3]<5),80,IF(AND(RC[-3]>RC[-1],RC[-3]>=5,RC[-3]<6),70,IF(AND(RC[-3]>RC[-1],RC[-3]>=6,RC[-3]<7),60,IF(AND(RC[-3]>RC[-1],RC[-3]>=7,RC[-3]<8),50,IF(AND(RC[-3]>RC[-1],RC[-3]>=8,RC[-3]<9),40,IF(AND(RC[-3]>RC[-1],RC[-3]>=9,RC[-3]<10),30,IF(AND(RC[-3]>RC[-1],RC[-3]>=10,RC[-3]<11),20,IF(AND(RC[-3]>RC[-1],RC[-3]>=11,RC[-3]<12),10,IF(AND(RC[-3]>RC[-1],RC[-3]>=12),0))))))))))))))))))))))))))))))))) -> 75 | H373: =IF(RC[-3]="","",IF(RC[-3]<0.3,100,IF(AND(RC[-3]>=0.3,RC[-3]>0.4),95,IF(AND(RC[-3]>=0.4,RC[-3]<0.5),90,IF(AND(RC[-3]>=0.5,RC[-3]<0.6),85,IF(AND(RC[-3]>=0.6,RC[-3]<0.7),80,IF(AND(RC[-3]>=0.6,RC[-3]<1),80,IF(AND(RC[-3]>1,RC[-3]<2),50,IF(RC[-3]>2,0))))))))) ->  | I373: =IF(RC[-1]="",RC[-2],0.7*RC[-1]+0.3*RC[-2]) -> 75
A374: سیمان صوفیان | B374: سصوفی | C374: =VLOOKUP(RC[-1],Sheet1!R3C2:R802C3,2,FALSE) -> سیمان آهک گچ | D374: =VLOOKUP(RC[-2],Sheet1!R3C2:R802C9,8,FALSE) -> 4.9024323063272943 | E374: =IF(VLOOKUP(RC[-3],Sheet1!R3C2:R803C11,10,FALSE)=0,"",VLOOKUP(Sheet2!RC[-3],Sheet1!R[1]C[-3]:R[801]C[6],10,FALSE)) ->  | F374: =Sheet1!R419C10 -> 6.5383737205402594 | G374: =IF(RC[-3]<0,0,IF(AND(RC[-3]<RC[-1],RC[-3]<2),100,IF(AND(RC[-3]<RC[-1],RC[-3]>=2,RC[-3]<3),95,IF(AND(RC[-3]<RC[-1],RC[-3]>=3,RC[-3]<4),90,IF(AND(RC[-3]<RC[-1],RC[-3]>=4,RC[-3]<5),85,IF(AND(RC[-3]<RC[-1],RC[-3]>=5,RC[-3]<6),80,IF(AND(RC[-3]<RC[-1],RC[-3]>=6,RC[-3]<7),75,IF(AND(RC[-3]<RC[-1],RC[-3]>=7,RC[-3]<8),70,IF(AND(RC[-3]<RC[-1],RC[-3]>=8,RC[-3]<9),65,IF(AND(RC[-3]<RC[-1],RC[-3]>=9,RC[-3]<10),60,IF(AND(RC[-3]<RC[-1],RC[-3]>=10,RC[-3]<11),55,IF(AND(RC[-3]<RC[-1],RC[-3]>=11,RC[-3]<12),50,IF(AND(RC[-3]<RC[-1],RC[-3]>=12,RC[-3]<13),45,IF(AND(RC[-3]<RC[-1],RC[-3]>=13,RC[-3]<14),40,IF(AND(RC[-3]<RC[-1],RC[-3]>=14,RC[-3]<15),35,IF(AND(RC[-3]<RC[-1],RC[-3]>=15,RC[-3]<16),30,IF(AND(RC[-3]<RC[-1],RC[-3]>=16,RC[-3]<17),25,IF(AND(RC[-3]<RC[-1],RC[-3]>=17,RC[-3]<18),20,IF(AND(RC[-3]<RC[-1],RC[-3]>=18,RC[-3]<19),15,IF(AND(RC[-3]<RC[-1],RC[-3]>=19,RC[-3]<20),10,IF(AND(RC[-3]<RC[-1],RC[-3]>=20,RC[-3]<21),5,IF(AND(RC[-3]<RC[-1],RC[-3]>=21),0,IF(AND(RC[-3]>RC[-1],RC[-3]>=2,RC[-3]<3),90,IF(AND(RC[-3]>RC[-1],RC[-3]>=3,RC[-3]<4),90,IF(AND(RC[-3]>RC[-1],RC[-3]>=4,RC[-3]<5),80,IF(AND(RC[-3]>RC[-1],RC[-3]>=5,RC[-3]<6),70,IF(AND(RC[-3]>RC[-1],RC[-3]>=6,RC[-3]<7),60,IF(AND(RC[-3]>RC[-1],RC[-3]>=7,RC[-3]<8),50,IF(AND(RC[-3]>RC[-1],RC[-3]>=8,RC[-3]<9),40,IF(AND(RC[-3]>RC[-1],RC[-3]>=9,RC[-3]<10),30,IF(AND(RC[-3]>RC[-1],RC[-3]>=10,RC[-3]<11),20,IF(AND(RC[-3]>RC[-1],RC[-3]>=11,RC[-3]<12),10,IF(AND(RC[-3]>RC[-1],RC[-3]>=12),0))))))))))))))))))))))))))))))))) -> 85 | H374: =IF(RC[-3]="","",IF(RC[-3]<0.3,100,IF(AND(RC[-3]>=0.3,RC[-3]>0.4),95,IF(AND(RC[-3]>=0.4,RC[-3]<0.5),90,IF(AND(RC[-3]>=0.5,RC[-3]<0.6),85,IF(AND(RC[-3]>=0.6,RC[-3]<0.7),80,IF(AND(RC[-3]>=0.6,RC[-3]<1),80,IF(AND(RC[-3]>1,RC[-3]<2),50,IF(RC[-3]>2,0))))))))) ->  | I374: =IF(RC[-1]="",RC[-2],0.7*RC[-1]+0.3*RC[-2]) -> 85
A375: سیمان غرب | B375: سغرب | C375: =VLOOKUP(RC[-1],Sheet1!R3C2:R802C3,2,FALSE) -> سیمان آهک گچ | D375: =VLOOKUP(RC[-2],Sheet1!R3C2:R802C9,8,FALSE) -> 6.1007872269360321 | E375: =IF(VLOOKUP(RC[-3],Sheet1!R3C2:R803C11,10,FALSE)=0,"",VLOOKUP(Sheet2!RC[-3],Sheet1!R[1]C[-3]:R[801]C[6],10,FALSE)) ->  | F375: =Sheet1!R419C10 -> 6.5383737205402594 | G375: =IF(RC[-3]<0,0,IF(AND(RC[-3]<RC[-1],RC[-3]<2),100,IF(AND(RC[-3]<RC[-1],RC[-3]>=2,RC[-3]<3),95,IF(AND(RC[-3]<RC[-1],RC[-3]>=3,RC[-3]<4),90,IF(AND(RC[-3]<RC[-1],RC[-3]>=4,RC[-3]<5),85,IF(AND(RC[-3]<RC[-1],RC[-3]>=5,RC[-3]<6),80,IF(AND(RC[-3]<RC[-1],RC[-3]>=6,RC[-3]<7),75,IF(AND(RC[-3]<RC[-1],RC[-3]>=7,RC[-3]<8),70,IF(AND(RC[-3]<RC[-1],RC[-3]>=8,RC[-3]<9),65,IF(AND(RC[-3]<RC[-1],RC[-3]>=9,RC[-3]<10),60,IF(AND(RC[-3]<RC[-1],RC[-3]>=10,RC[-3]<11),55,IF(AND(RC[-3]<RC[-1],RC[-3]>=11,RC[-3]<12),50,IF(AND(RC[-3]<RC[-1],RC[-3]>=12,RC[-3]<13),45,IF(AND(RC[-3]<RC[-1],RC[-3]>=13,RC[-3]<14),40,IF(AND(RC[-3]<RC[-1],RC[-3]>=14,RC[-3]<15),35,IF(AND(RC[-3]<RC[-1],RC[-3]>=15,RC[-3]<16),30,IF(AND(RC[-3]<RC[-1],RC[-3]>=16,RC[-3]<17),25,IF(AND(RC[-3]<RC[-1],RC[-3]>=17,RC[-3]<18),20,IF(AND(RC[-3]<RC[-1],RC[-3]>=18,RC[-3]<19),15,IF(AND(RC[-3]<RC[-1],RC[-3]>=19,RC[-3]<20),10,IF(AND(RC[-3]<RC[-1],RC[-3]>=20,RC[-3]<21),5,IF(AND(RC[-3]<RC[-1],RC[-3]>=21),0,IF(AND(RC[-3]>RC[-1],RC[-3]>=2,RC[-3]<3),90,IF(AND(RC[-3]>RC[-1],RC[-3]>=3,RC[-3]<4),90,IF(AND(RC[-3]>RC[-1],RC[-3]>=4,RC[-3]<5),80,IF(AND(RC[-3]>RC[-1],RC[-3]>=5,RC[-3]<6),70,IF(AND(RC[-3]>RC[-1],RC[-3]>=6,RC[-3]<7),60,IF(AND(RC[-3]>RC[-1],RC[-3]>=7,RC[-3]<8),50,IF(AND(RC[-3]>RC[-1],RC[-3]>=8,RC[-3]<9),40,IF(AND(RC[-3]>RC[-1],RC[-3]>=9,RC[-3]<10),30,IF(AND(RC[-3]>RC[-1],RC[-3]>=10,RC[-3]<11),20,IF(AND(RC[-3]>RC[-1],RC[-3]>=11,RC[-3]<12),10,IF(AND(RC[-3]>RC[-1],RC[-3]>=12),0))))))))))))))))))))))))))))))))) -> 75 | H375: =IF(RC[-3]="","",IF(RC[-3]<0.3,100,IF(AND(RC[-3]>=0.3,RC[-3]>0.4),95,IF(AND(RC[-3]>=0.4,RC[-3]<0.5),90,IF(AND(RC[-3]>=0.5,RC[-3]<0.6),85,IF(AND(RC[-3]>=0.6,RC[-3]<0.7),80,IF(AND(RC[-3]>=0.6,RC[-3]<1),80,IF(AND(RC[-3]>1,RC[-3]<2),50,IF(RC[-3]>2,0))))))))) ->  | I375: =IF(RC[-1]="",RC[-2],0.7*RC[-1]+0.3*RC[-2]) -> 75
A376: سیمان غرب آسیا | B376: سجام | C376: =VLOOKUP(RC[-1],Sheet1!R3C2:R802C3,2,FALSE) -> سیمان آهک گچ | D376: =VLOOKUP(RC[-2],Sheet1!R3C2:R802C9,8,FALSE) -> 9.029454506554444 | E376: =IF(VLOOKUP(RC[-3],Sheet1!R3C2:R803C11,10,FALSE)=0,"",VLOOKUP(Sheet2!RC[-3],Sheet1!R[1]C[-3]:R[801]C[6],10,FALSE)) ->  | F376: =Sheet1!R419C10 -> 6.5383737205402594 | G376: =IF(RC[-3]<0,0,IF(AND(RC[-3]<RC[-1],RC[-3]<2),100,IF(AND(RC[-3]<RC[-1],RC[-3]>=2,RC[-3]<3),95,IF(AND(RC[-3]<RC[-1],RC[-3]>=3,RC[-3]<4),90,IF(AND(RC[-3]<RC[-1],RC[-3]>=4,RC[-3]<5),85,IF(AND(RC[-3]<RC[-1],RC[-3]>=5,RC[-3]<6),80,IF(AND(RC[-3]<RC[-1],RC[-3]>=6,RC[-3]<7),75,IF(AND(RC[-3]<RC[-1],RC[-3]>=7,RC[-3]<8),70,IF(AND(RC[-3]<RC[-1],RC[-3]>=8,RC[-3]<9),65,IF(AND(RC[-3]<RC[-1],RC[-3]>=9,RC[-3]<10),60,IF(AND(RC[-3]<RC[-1],RC[-3]>=10,RC[-3]<11),55,IF(AND(RC[-3]<RC[-1],RC[-3]>=11,RC[-3]<12),50,IF(AND(RC[-3]<RC[-1],RC[-3]>=12,RC[-3]<13),45,IF(AND(RC[-3]<RC[-1],RC[-3]>=13,RC[-3]<14),40,IF(AND(RC[-3]<RC[-1],RC[-3]>=14,RC[-3]<15),35,IF(AND(RC[-3]<RC[-1],RC[-3]>=15,RC[-3]<16),30,IF(AND(RC[-3]<RC[-1],RC[-3]>=16,RC[-3]<17),25,IF(AND(RC[-3]<RC[-1],RC[-3]>=17,RC[-3]<18),20,IF(AND(RC[-3]<RC[-1],RC[-3]>=18,RC[-3]<19),15,IF(AND(RC[-3]<RC[-1],RC[-3]>=19,RC[-3]<20),10,IF(AND(RC[-3]<RC[-1],RC[-3]>=20,RC[-3]<21),5,IF(AND(RC[-3]<RC[-1],RC[-3]>=21),0,IF(AND(RC[-3]>RC[-1],RC[-3]>=2,RC[-3]<3),90,IF(AND(RC[-3]>RC[-1],RC[-3]>=3,RC[-3]<4),90,IF(AND(RC[-3]>RC[-1],RC[-3]>=4,RC[-3]<5),80,IF(AND(RC[-3]>RC[-1],RC[-3]>=5,RC[-3]<6),70,IF(AND(RC[-3]>RC[-1],RC[-3]>=6,RC[-3]<7),60,IF(AND(RC[-3]>RC[-1],RC[-3]>=7,RC[-3]<8),50,IF(AND(RC[-3]>RC[-1],RC[-3]>=8,RC[-3]<9),40,IF(AND(RC[-3]>RC[-1],RC[-3]>=9,RC[-3]<10),30,IF(AND(RC[-3]>RC[-1],RC[-3]>=10,RC[-3]<11),20,IF(AND(RC[-3]>RC[-1],RC[-3]>=11,RC[-3]<12),10,IF(AND(RC[-3]>RC[-1],RC[-3]>=12),0))))))))))))))))))))))))))))))))) -> 30 | H376: =IF(RC[-3]="","",IF(RC[-3]<0.3,100,IF(AND(RC[-3]>=0.3,RC[-3]>0.4),95,IF(AND(RC[-3]>=0.4,RC[-3]<0.5),90,IF(AND(RC[-3]>=0.5,RC[-3]<0.6),85,IF(AND(RC[-3]>=0.6,RC[-3]<0.7),80,IF(AND(RC[-3]>=0.6,RC[-3]<1),80,IF(AND(RC[-3]>1,RC[-3]<2),50,IF(RC[-3]>2,0))))))))) ->  | I376: =IF(RC[-1]="",RC[-2],0.7*RC[-1]+0.3*RC[-2]) -> 30
A377: سیمان فارس | B377: سفار | C377: =VLOOKUP(RC[-1],Sheet1!R3C2:R802C3,2,FALSE) -> سیمان آهک گچ | D377: =VLOOKUP(RC[-2],Sheet1!R3C2:R802C9,8,FALSE) -> 9.3211768919037183 | E377: =IF(VLOOKUP(RC[-3],Sheet1!R3C2:R803C11,10,FALSE)=0,"",VLOOKUP(Sheet2!RC[-3],Sheet1!R[1]C[-3]:R[801]C[6],10,FALSE)) ->  | F377: =Sheet1!R419C10 -> 6.5383737205402594 | G377: =IF(RC[-3]<0,0,IF(AND(RC[-3]<RC[-1],RC[-3]<2),100,IF(AND(RC[-3]<RC[-1],RC[-3]>=2,RC[-3]<3),95,IF(AND(RC[-3]<RC[-1],RC[-3]>=3,RC[-3]<4),90,IF(AND(RC[-3]<RC[-1],RC[-3]>=4,RC[-3]<5),85,IF(AND(RC[-3]<RC[-1],RC[-3]>=5,RC[-3]<6),80,IF(AND(RC[-3]<RC[-1],RC[-3]>=6,RC[-3]<7),75,IF(AND(RC[-3]<RC[-1],RC[-3]>=7,RC[-3]<8),70,IF(AND(RC[-3]<RC[-1],RC[-3]>=8,RC[-3]<9),65,IF(AND(RC[-3]<RC[-1],RC[-3]>=9,RC[-3]<10),60,IF(AND(RC[-3]<RC[-1],RC[-3]>=10,RC[-3]<11),55,IF(AND(RC[-3]<RC[-1],RC[-3]>=11,RC[-3]<12),50,IF(AND(RC[-3]<RC[-1],RC[-3]>=12,RC[-3]<13),45,IF(AND(RC[-3]<RC[-1],RC[-3]>=13,RC[-3]<14),40,IF(AND(RC[-3]<RC[-1],RC[-3]>=14,RC[-3]<15),35,IF(AND(RC[-3]<RC[-1],RC[-3]>=15,RC[-3]<16),30,IF(AND(RC[-3]<RC[-1],RC[-3]>=16,RC[-3]<17),25,IF(AND(RC[-3]<RC[-1],RC[-3]>=17,RC[-3]<18),20,IF(AND(RC[-3]<RC[-1],RC[-3]>=18,RC[-3]<19),15,IF(AND(RC[-3]<RC[-1],RC[-3]>=19,RC[-3]<20),10,IF(AND(RC[-3]<RC[-1],RC[-3]>=20,RC[-3]<21),5,IF(AND(RC[-3]<RC[-1],RC[-3]>=21),0,IF(AND(RC[-3]>RC[-1],RC[-3]>=2,RC[-3]<3),90,IF(AND(RC[-3]>RC[-1],RC[-3]>=3,RC[-3]<4),90,IF(AND(RC[-3]>RC[-1],RC[-3]>=4,RC[-3]<5),80,IF(AND(RC[-3]>RC[-1],RC[-3]>=5,RC[-3]<6),70,IF(AND(RC[-3]>RC[-1],RC[-3]>=6,RC[-3]<7),60,IF(AND(RC[-3]>RC[-1],RC[-3]>=7,RC[-3]<8),50,IF(AND(RC[-3]>RC[-1],RC[-3]>=8,RC[-3]<9),40,IF(AND(RC[-3]>RC[-1],RC[-3]>=9,RC[-3]<10),30,IF(AND(RC[-3]>RC[-1],RC[-3]>=10,RC[-3]<11),20,IF(AND(RC[-3]>RC[-1],RC[-3]>=11,RC[-3]<12),10,IF(AND(RC[-3]>RC[-1],RC[-3]>=12),0))))))))))))))))))))))))))))))))) -> 30 | H377: =IF(RC[-3]="","",IF(RC[-3]<0.3,100,IF(AND(RC[-3]>=0.3,RC[-3]>0.4),95,IF(AND(RC[-3]>=0.4,RC[-3]<0.5),90,IF(AND(RC[-3]>=0.5,RC[-3]<0.6),85,IF(AND(RC[-3]>=0.6,RC[-3]<0.7),80,IF(AND(RC[-3]>=0.6,RC[-3]<1),80,IF(AND(RC[-3]>1,RC[-3]<2),50,IF(RC[-3]>2,0))))))))) ->  | I377: =IF(RC[-1]="",RC[-2],0.7*RC[-1]+0.3*RC[-2]) -> 30
A378: سیمان فارس نو | B378: سفانو | C378: =VLOOKUP(RC[-1],Sheet1!R3C2:R802C3,2,FALSE) -> سیمان آهک گچ | D378: =VLOOKUP(RC[-2],Sheet1!R3C2:R802C9,8,FALSE) -> 5.840239370216727 | E378: =IF(VLOOKUP(RC[-3],Sheet1!R3C2:R803C11,10,FALSE)=0,"",VLOOKUP(Sheet2!RC[-3],Sheet1!R[1]C[-3]:R[801]C[6],10,FALSE)) ->  | F378: =Sheet1!R419C10 -> 6.5383737205402594 | G378: =IF(RC[-3]<0,0,IF(AND(RC[-3]<RC[-1],RC[-3]<2),100,IF(AND(RC[-3]<RC[-1],RC[-3]>=2,RC[-3]<3),95,IF(AND(RC[-3]<RC[-1],RC[-3]>=3,RC[-3]<4),90,IF(AND(RC[-3]<RC[-1],RC[-3]>=4,RC[-3]<5),85,IF(AND(RC[-3]<RC[-1],RC[-3]>=5,RC[-3]<6),80,IF(AND(RC[-3]<RC[-1],RC[-3]>=6,RC[-3]<7),75,IF(AND(RC[-3]<RC[-1],RC[-3]>=7,RC[-3]<8),70,IF(AND(RC[-3]<RC[-1],RC[-3]>=8,RC[-3]<9),65,IF(AND(RC[-3]<RC[-1],RC[-3]>=9,RC[-3]<10),60,IF(AND(RC[-3]<RC[-1],RC[-3]>=10,RC[-3]<11),55,IF(AND(RC[-3]<RC[-1],RC[-3]>=11,RC[-3]<12),50,IF(AND(RC[-3]<RC[-1],RC[-3]>=12,RC[-3]<13),45,IF(AND(RC[-3]<RC[-1],RC[-3]>=13,RC[-3]<14),40,IF(AND(RC[-3]<RC[-1],RC[-3]>=14,RC[-3]<15),35,IF(AND(RC[-3]<RC[-1],RC[-3]>=15,RC[-3]<16),30,IF(AND(RC[-3]<RC[-1],RC[-3]>=16,RC[-3]<17),25,IF(AND(RC[-3]<RC[-1],RC[-3]>=17,RC[-3]<18),20,IF(AND(RC[-3]<RC[-1],RC[-3]>=18,RC[-3]<19),15,IF(AND(RC[-3]<RC[-1],RC[-3]>=19,RC[-3]<20),10,IF(AND(RC[-3]<RC[-1],RC[-3]>=20,RC[-3]<21),5,IF(AND(RC[-3]<RC[-1],RC[-3]>=21),0,IF(AND(RC[-3]>RC[-1],RC[-3]>=2,RC[-3]<3),90,IF(AND(RC[-3]>RC[-1],RC[-3]>=3,RC[-3]<4),90,IF(AND(RC[-3]>RC[-1],RC[-3]>=4,RC[-3]<5),80,IF(AND(RC[-3]>RC[-1],RC[-3]>=5,RC[-3]<6),70,IF(AND(RC[-3]>RC[-1],RC[-3]>=6,RC[-3]<7),60,IF(AND(RC[-3]>RC[-1],RC[-3]>=7,RC[-3]<8),50,IF(AND(RC[-3]>RC[-1],RC[-3]>=8,RC[-3]<9),40,IF(AND(RC[-3]>RC[-1],RC[-3]>=9,RC[-3]<10),30,IF(AND(RC[-3]>RC[-1],RC[-3]>=10,RC[-3]<11),20,IF(AND(RC[-3]>RC[-1],RC[-3]>=11,RC[-3]<12),10,IF(AND(RC[-3]>RC[-1],RC[-3]>=12),0))))))))))))))))))))))))))))))))) -> 80 | H378: =IF(RC[-3]="","",IF(RC[-3]<0.3,100,IF(AND(RC[-3]>=0.3,RC[-3]>0.4),95,IF(AND(RC[-3]>=0.4,RC[-3]<0.5),90,IF(AND(RC[-3]>=0.5,RC[-3]<0.6),85,IF(AND(RC[-3]>=0.6,RC[-3]<0.7),80,IF(AND(RC[-3]>=0.6,RC[-3]<1),80,IF(AND(RC[-3]>1,RC[-3]<2),50,IF(RC[-3]>2,0))))))))) ->  | I378: =IF(RC[-1]="",RC[-2],0.7*RC[-1]+0.3*RC[-2]) -> 80
A379: سیمان فارس و خوزستان | B379: سفارس | C379: =VLOOKUP(RC[-1],Sheet1!R3C2:R802C3,2,FALSE) -> سیمان آهک گچ | D379: =VLOOKUP(RC[-2],Sheet1!R3C2:R802C9,8,FALSE) -> 4.2 | E379: =IF(VLOOKUP(RC[-3],Sheet1!R3C2:R803C11,10,FALSE)=0,"",VLOOKUP(Sheet2!RC[-3],Sheet1!R[1]C[-3]:R[801]C[6],10,FALSE)) -> 0.75 | F379: =Sheet1!R419C10 -> 6.5383737205402594 | G379: =IF(RC[-3]<0,0,IF(AND(RC[-3]<RC[-1],RC[-3]<2),100,IF(AND(RC[-3]<RC[-1],RC[-3]>=2,RC[-3]<3),95,IF(AND(RC[-3]<RC[-1],RC[-3]>=3,RC[-3]<4),90,IF(AND(RC[-3]<RC[-1],RC[-3]>=4,RC[-3]<5),85,IF(AND(RC[-3]<RC[-1],RC[-3]>=5,RC[-3]<6),80,IF(AND(RC[-3]<RC[-1],RC[-3]>=6,RC[-3]<7),75,IF(AND(RC[-3]<RC[-1],RC[-3]>=7,RC[-3]<8),70,IF(AND(RC[-3]<RC[-1],RC[-3]>=8,RC[-3]<9),65,IF(AND(RC[-3]<RC[-1],RC[-3]>=9,RC[-3]<10),60,IF(AND(RC[-3]<RC[-1],RC[-3]>=10,RC[-3]<11),55,IF(AND(RC[-3]<RC[-1],RC[-3]>=11,RC[-3]<12),50,IF(AND(RC[-3]<RC[-1],RC[-3]>=12,RC[-3]<13),45,IF(AND(RC[-3]<RC[-1],RC[-3]>=13,RC[-3]<14),40,IF(AND(RC[-3]<RC[-1],RC[-3]>=14,RC[-3]<15),35,IF(AND(RC[-3]<RC[-1],RC[-3]>=15,RC[-3]<16),30,IF(AND(RC[-3]<RC[-1],RC[-3]>=16,RC[-3]<17),25,IF(AND(RC[-3]<RC[-1],RC[-3]>=17,RC[-3]<18),20,IF(AND(RC[-3]<RC[-1],RC[-3]>=18,RC[-3]<19),15,IF(AND(RC[-3]<RC[-1],RC[-3]>=19,RC[-3]<20),10,IF(AND(RC[-3]<RC[-1],RC[-3]>=20,RC[-3]<21),5,IF(AND(RC[-3]<RC[-1],RC[-3]>=21),0,IF(AND(RC[-3]>RC[-1],RC[-3]>=2,RC[-3]<3),90,IF(AND(RC[-3]>RC[-1],RC[-3]>=3,RC[-3]<4),90,IF(AND(RC[-3]>RC[-1],RC[-3]>=4,RC[-3]<5),80,IF(AND(RC[-3]>RC[-1],RC[-3]>=5,RC[-3]<6),70,IF(AND(RC[-3]>RC[-1],RC[-3]>=6,RC[-3]<7),60,IF(AND(RC[-3]>RC[-1],RC[-3]>=7,RC[-3]<8),50,IF(AND(RC[-3]>RC[-1],RC[-3]>=8,RC[-3]<9),40,IF(AND(RC[-3]>RC[-1],RC[-3]>=9,RC[-3]<10),30,IF(AND(RC[-3]>RC[-1],RC[-3]>=10,RC[-3]<11),20,IF(AND(RC[-3]>RC[-1],RC[-3]>=11,RC[-3]<12),10,IF(AND(RC[-3]>RC[-1],RC[-3]>=12),0))))))))))))))))))))))))))))))))) -> 85 | H379: =IF(RC[-3]="","",IF(RC[-3]<0.3,100,IF(AND(RC[-3]>=0.3,RC[-3]>0.4),95,IF(AND(RC[-3]>=0.4,RC[-3]<0.5),90,IF(AND(RC[-3]>=0.5,RC[-3]<0.6),85,IF(AND(RC[-3]>=0.6,RC[-3]<0.7),80,IF(AND(RC[-3]>=0.6,RC[-3]<1),80,IF(AND(RC[-3]>1,RC[-3]<2),50,IF(RC[-3]>2,0))))))))) -> 95 | I379: =IF(RC[-1]="",RC[-2],0.7*RC[-1]+0.3*RC[-2]) -> 92
A380: سیمان قائن | B380: سقاین | C380: =VLOOKUP(RC[-1],Sheet1!R3C2:R802C3,2,FALSE) -> سیمان آهک گچ | D380: =VLOOKUP(RC[-2],Sheet1!R3C2:R802C9,8,FALSE) -> 5.9540511336806636 | E380: =IF(VLOOKUP(RC[-3],Sheet1!R3C2:R803C11,10,FALSE)=0,"",VLOOKUP(Sheet2!RC[-3],Sheet1!R[1]C[-3]:R[801]C[6],10,FALSE)) ->  | F380: =Sheet1!R419C10 -> 6.5383737205402594 | G380: =IF(RC[-3]<0,0,IF(AND(RC[-3]<RC[-1],RC[-3]<2),100,IF(AND(RC[-3]<RC[-1],RC[-3]>=2,RC[-3]<3),95,IF(AND(RC[-3]<RC[-1],RC[-3]>=3,RC[-3]<4),90,IF(AND(RC[-3]<RC[-1],RC[-3]>=4,RC[-3]<5),85,IF(AND(RC[-3]<RC[-1],RC[-3]>=5,RC[-3]<6),80,IF(AND(RC[-3]<RC[-1],RC[-3]>=6,RC[-3]<7),75,IF(AND(RC[-3]<RC[-1],RC[-3]>=7,RC[-3]<8),70,IF(AND(RC[-3]<RC[-1],RC[-3]>=8,RC[-3]<9),65,IF(AND(RC[-3]<RC[-1],RC[-3]>=9,RC[-3]<10),60,IF(AND(RC[-3]<RC[-1],RC[-3]>=10,RC[-3]<11),55,IF(AND(RC[-3]<RC[-1],RC[-3]>=11,RC[-3]<12),50,IF(AND(RC[-3]<RC[-1],RC[-3]>=12,RC[-3]<13),45,IF(AND(RC[-3]<RC[-1],RC[-3]>=13,RC[-3]<14),40,IF(AND(RC[-3]<RC[-1],RC[-3]>=14,RC[-3]<15),35,IF(AND(RC[-3]<RC[-1],RC[-3]>=15,RC[-3]<16),30,IF(AND(RC[-3]<RC[-1],RC[-3]>=16,RC[-3]<17),25,IF(AND(RC[-3]<RC[-1],RC[-3]>=17,RC[-3]<18),20,IF(AND(RC[-3]<RC[-1],RC[-3]>=18,RC[-3]<19),15,IF(AND(RC[-3]<RC[-1],RC[-3]>=19,RC[-3]<20),10,IF(AND(RC[-3]<RC[-1],RC[-3]>=20,RC[-3]<21),5,IF(AND(RC[-3]<RC[-1],RC[-3]>=21),0,IF(AND(RC[-3]>RC[-1],RC[-3]>=2,RC[-3]<3),90,IF(AND(RC[-3]>RC[-1],RC[-3]>=3,RC[-3]<4),90,IF(AND(RC[-3]>RC[-1],RC[-3]>=4,RC[-3]<5),80,IF(AND(RC[-3]>RC[-1],RC[-3]>=5,RC[-3]<6),70,IF(AND(RC[-3]>RC[-1],RC[-3]>=6,RC[-3]<7),60,IF(AND(RC[-3]>RC[-1],RC[-3]>=7,RC[-3]<8),50,IF(AND(RC[-3]>RC[-1],RC[-3]>=8,RC[-3]<9),40,IF(AND(RC[-3]>RC[-1],RC[-3]>=9,RC[-3]<10),30,IF(AND(RC[-3]>RC[-1],RC[-3]>=10,RC[-3]<11),20,IF(AND(RC[-3]>RC[-1],RC[-3]>=11,RC[-3]<12),10,IF(AND(RC[-3]>RC[-1],RC[-3]>=12),0))))))))))))))))))))))))))))))))) -> 80 | H380: =IF(RC[-3]="","",IF(RC[-3]<0.3,100,IF(AND(RC[-3]>=0.3,RC[-3]>0.4),95,IF(AND(RC[-3]>=0.4,RC[-3]<0.5),90,IF(AND(RC[-3]>=0.5,RC[-3]<0.6),85,IF(AND(RC[-3]>=0.6,RC[-3]<0.7),80,IF(AND(RC[-3]>=0.6,RC[-3]<1),80,IF(AND(RC[-3]>1,RC[-3]<2),50,IF(RC[-3]>2,0))))))))) ->  | I380: =IF(RC[-1]="",RC[-2],0.7*RC[-1]+0.3*RC[-2]) -> 80
A381: سیمان لار سبزوار | B381: سبزوا | C381: =VLOOKUP(RC[-1],Sheet1!R3C2:R802C3,2,FALSE) -> سیمان آهک گچ | D381: =VLOOKUP(RC[-2],Sheet1!R3C2:R802C9,8,FALSE) -> 19.127292264518399 | E381: =IF(VLOOKUP(RC[-3],Sheet1!R3C2:R803C11,10,FALSE)=0,"",VLOOKUP(Sheet2!RC[-3],Sheet1!R[1]C[-3]:R[801]C[6],10,FALSE)) ->  | F381: =Sheet1!R419C10 -> 6.5383737205402594 | G381: =IF(RC[-3]<0,0,IF(AND(RC[-3]<RC[-1],RC[-3]<2),100,IF(AND(RC[-3]<RC[-1],RC[-3]>=2,RC[-3]<3),95,IF(AND(RC[-3]<RC[-1],RC[-3]>=3,RC[-3]<4),90,IF(AND(RC[-3]<RC[-1],RC[-3]>=4,RC[-3]<5),85,IF(AND(RC[-3]<RC[-1],RC[-3]>=5,RC[-3]<6),80,IF(AND(RC[-3]<RC[-1],RC[-3]>=6,RC[-3]<7),75,IF(AND(RC[-3]<RC[-1],RC[-3]>=7,RC[-3]<8),70,IF(AND(RC[-3]<RC[-1],RC[-3]>=8,RC[-3]<9),65,IF(AND(RC[-3]<RC[-1],RC[-3]>=9,RC[-3]<10),60,IF(AND(RC[-3]<RC[-1],RC[-3]>=10,RC[-3]<11),55,IF(AND(RC[-3]<RC[-1],RC[-3]>=11,RC[-3]<12),50,IF(AND(RC[-3]<RC[-1],RC[-3]>=12,RC[-3]<13),45,IF(AND(RC[-3]<RC[-1],RC[-3]>=13,RC[-3]<14),40,IF(AND(RC[-3]<RC[-1],RC[-3]>=14,RC[-3]<15),35,IF(AND(RC[-3]<RC[-1],RC[-3]>=15,RC[-3]<16),30,IF(AND(RC[-3]<RC[-1],RC[-3]>=16,RC[-3]<17),25,IF(AND(RC[-3]<RC[-1],RC[-3]>=17,RC[-3]<18),20,IF(AND(RC[-3]<RC[-1],RC[-3]>=18,RC[-3]<19),15,IF(AND(RC[-3]<RC[-1],RC[-3]>=19,RC[-3]<20),10,IF(AND(RC[-3]<RC[-1],RC[-3]>=20,RC[-3]<21),5,IF(AND(RC[-3]<RC[-1],RC[-3]>=21),0,IF(AND(RC[-3]>RC[-1],RC[-3]>=2,RC[-3]<3),90,IF(AND(RC[-3]>RC[-1],RC[-3]>=3,RC[-3]<4),90,IF(AND(RC[-3]>RC[-1],RC[-3]>=4,RC[-3]<5),80,IF(AND(RC[-3]>RC[-1],RC[-3]>=5,RC[-3]<6),70,IF(AND(RC[-3]>RC[-1],RC[-3]>=6,RC[-3]<7),60,IF(AND(RC[-3]>RC[-1],RC[-3]>=7,RC[-3]<8),50,IF(AND(RC[-3]>RC[-1],RC[-3]>=8,RC[-3]<9),40,IF(AND(RC[-3]>RC[-1],RC[-3]>=9,RC[-3]<10),30,IF(AND(RC[-3]>RC[-1],RC[-3]>=10,RC[-3]<11),20,IF(AND(RC[-3]>RC[-1],RC[-3]>=11,RC[-3]<12),10,IF(AND(RC[-3]>RC[-1],RC[-3]>=12),0))))))))))))))))))))))))))))))))) -> 0 | H381: =IF(RC[-3]="","",IF(RC[-3]<0.3,100,IF(AND(RC[-3]>=0.3,RC[-3]>0.4),95,IF(AND(RC[-3]>=0.4,RC[-3]<0.5),90,IF(AND(RC[-3]>=0.5,RC[-3]<0.6),85,IF(AND(RC[-3]>=0.6,RC[-3]<0.7),80,IF(AND(RC[-3]>=0.6,RC[-3]<1),80,IF(AND(RC[-3]>1,RC[-3]<2),50,IF(RC[-3]>2,0))))))))) ->  | I381: =IF(RC[-1]="",RC[-2],0.7*RC[-1]+0.3*RC[-2]) -> 0
A382: سیمان لارستان | B382: سلار | C382: =VLOOKUP(RC[-1],Sheet1!R3C2:R802C3,2,FALSE) -> سیمان آهک گچ | D382: =VLOOKUP(RC[-2],Sheet1!R3C2:R802C9,8,FALSE) -> 12.798139251337448 | E382: =IF(VLOOKUP(RC[-3],Sheet1!R3C2:R803C11,10,FALSE)=0,"",VLOOKUP(Sheet2!RC[-3],Sheet1!R[1]C[-3]:R[801]C[6],10,FALSE)) ->  | F382: =Sheet1!R419C10 -> 6.5383737205402594 | G382: =IF(RC[-3]<0,0,IF(AND(RC[-3]<RC[-1],RC[-3]<2),100,IF(AND(RC[-3]<RC[-1],RC[-3]>=2,RC[-3]<3),95,IF(AND(RC[-3]<RC[-1],RC[-3]>=3,RC[-3]<4),90,IF(AND(RC[-3]<RC[-1],RC[-3]>=4,RC[-3]<5),85,IF(AND(RC[-3]<RC[-1],RC[-3]>=5,RC[-3]<6),80,IF(AND(RC[-3]<RC[-1],RC[-3]>=6,RC[-3]<7),75,IF(AND(RC[-3]<RC[-1],RC[-3]>=7,RC[-3]<8),70,IF(AND(RC[-3]<RC[-1],RC[-3]>=8,RC[-3]<9),65,IF(AND(RC[-3]<RC[-1],RC[-3]>=9,RC[-3]<10),60,IF(AND(RC[-3]<RC[-1],RC[-3]>=10,RC[-3]<11),55,IF(AND(RC[-3]<RC[-1],RC[-3]>=11,RC[-3]<12),50,IF(AND(RC[-3]<RC[-1],RC[-3]>=12,RC[-3]<13),45,IF(AND(RC[-3]<RC[-1],RC[-3]>=13,RC[-3]<14),40,IF(AND(RC[-3]<RC[-1],RC[-3]>=14,RC[-3]<15),35,IF(AND(RC[-3]<RC[-1],RC[-3]>=15,RC[-3]<16),30,IF(AND(RC[-3]<RC[-1],RC[-3]>=16,RC[-3]<17),25,IF(AND(RC[-3]<RC[-1],RC[-3]>=17,RC[-3]<18),20,IF(AND(RC[-3]<RC[-1],RC[-3]>=18,RC[-3]<19),15,IF(AND(RC[-3]<RC[-1],RC[-3]>=19,RC[-3]<20),10,IF(AND(RC[-3]<RC[-1],RC[-3]>=20,RC[-3]<21),5,IF(AND(RC[-3]<RC[-1],RC[-3]>=21),0,IF(AND(RC[-3]>RC[-1],RC[-3]>=2,RC[-3]<3),90,IF(AND(RC[-3]>RC[-1],RC[-3]>=3,RC[-3]<4),90,IF(AND(RC[-3]>RC[-1],RC[-3]>=4,RC[-3]<5),80,IF(AND(RC[-3]>RC[-1],RC[-3]>=5,RC[-3]<6),70,IF(AND(RC[-3]>RC[-1],RC[-3]>=6,RC[-3]<7),60,IF(AND(RC[-3]>RC[-1],RC[-3]>=7,RC[-3]<8),50,IF(AND(RC[-3]>RC[-1],RC[-3]>=8,RC[-3]<9),40,IF(AND(RC[-3]>RC[-1],RC[-3]>=9,RC[-3]<10),30,IF(AND(RC[-3]>RC[-1],RC[-3]>=10,RC[-3]<11),20,IF(AND(RC[-3]>RC[-1],RC[-3]>=11,RC[-3]<12),10,IF(AND(RC[-3]>RC[-1],RC[-3]>=12),0))))))))))))))))))))))))))))))))) -> 0 | H382: =IF(RC[-3]="","",IF(RC[-3]<0.3,100,IF(AND(RC[-3]>=0.3,RC[-3]>0.4),95,IF(AND(RC[-3]>=0.4,RC[-3]<0.5),90,IF(AND(RC[-3]>=0.5,RC[-3]<0.6),85,IF(AND(RC[-3]>=0.6,RC[-3]<0.7),80,IF(AND(RC[-3]>=0.6,RC[-3]<1),80,IF(AND(RC[-3]>1,RC[-3]<2),50,IF(RC[-3]>2,0))))))))) ->  | I382: =IF(RC[-1]="",RC[-2],0.7*RC[-1]+0.3*RC[-2]) -> 0
A383: سیمان مازندران | B383: سمازن | C383: =VLOOKUP(RC[-1],Sheet1!R3C2:R802C3,2,FALSE) -> سیمان آهک گچ | D383: =VLOOKUP(RC[-2],Sheet1!R3C2:R802C9,8,FALSE) -> 4.065660483832823 | E383: =IF(VLOOKUP(RC[-3],Sheet1!R3C2:R803C11,10,FALSE)=0,"",VLOOKUP(Sheet2!RC[-3],Sheet1!R[1]C[-3]:R[801]C[6],10,FALSE)) ->  | F383: =Sheet1!R419C10 -> 6.5383737205402594 | G383: =IF(RC[-3]<0,0,IF(AND(RC[-3]<RC[-1],RC[-3]<2),100,IF(AND(RC[-3]<RC[-1],RC[-3]>=2,RC[-3]<3),95,IF(AND(RC[-3]<RC[-1],RC[-3]>=3,RC[-3]<4),90,IF(AND(RC[-3]<RC[-1],RC[-3]>=4,RC[-3]<5),85,IF(AND(RC[-3]<RC[-1],RC[-3]>=5,RC[-3]<6),80,IF(AND(RC[-3]<RC[-1],RC[-3]>=6,RC[-3]<7),75,IF(AND(RC[-3]<RC[-1],RC[-3]>=7,RC[-3]<8),70,IF(AND(RC[-3]<RC[-1],RC[-3]>=8,RC[-3]<9),65,IF(AND(RC[-3]<RC[-1],RC[-3]>=9,RC[-3]<10),60,IF(AND(RC[-3]<RC[-1],RC[-3]>=10,RC[-3]<11),55,IF(AND(RC[-3]<RC[-1],RC[-3]>=11,RC[-3]<12),50,IF(AND(RC[-3]<RC[-1],RC[-3]>=12,RC[-3]<13),45,IF(AND(RC[-3]<RC[-1],RC[-3]>=13,RC[-3]<14),40,IF(AND(RC[-3]<RC[-1],RC[-3]>=14,RC[-3]<15),35,IF(AND(RC[-3]<RC[-1],RC[-3]>=15,RC[-3]<16),30,IF(AND(RC[-3]<RC[-1],RC[-3]>=16,RC[-3]<17),25,IF(AND(RC[-3]<RC[-1],RC[-3]>=17,RC[-3]<18),20,IF(AND(RC[-3]<RC[-1],RC[-3]>=18,RC[-3]<19),15,IF(AND(RC[-3]<RC[-1],RC[-3]>=19,RC[-3]<20),10,IF(AND(RC[-3]<RC[-1],RC[-3]>=20,RC[-3]<21),5,IF(AND(RC[-3]<RC[-1],RC[-3]>=21),0,IF(AND(RC[-3]>RC[-1],RC[-3]>=2,RC[-3]<3),90,IF(AND(RC[-3]>RC[-1],RC[-3]>=3,RC[-3]<4),90,IF(AND(RC[-3]>RC[-1],RC[-3]>=4,RC[-3]<5),80,IF(AND(RC[-3]>RC[-1],RC[-3]>=5,RC[-3]<6),70,IF(AND(RC[-3]>RC[-1],RC[-3]>=6,RC[-3]<7),60,IF(AND(RC[-3]>RC[-1],RC[-3]>=7,RC[-3]<8),50,IF(AND(RC[-3]>RC[-1],RC[-3]>=8,RC[-3]<9),40,IF(AND(RC[-3]>RC[-1],RC[-3]>=9,RC[-3]<10),30,IF(AND(RC[-3]>RC[-1],RC[-3]>=10,RC[-3]<11),20,IF(AND(RC[-3]>RC[-1],RC[-3]>=11,RC[-3]<12),10,IF(AND(RC[-3]>RC[-1],RC[-3]>=12),0))))))))))))))))))))))))))))))))) -> 85 | H383: =IF(RC[-3]="","",IF(RC[-3]<0.3,100,IF(AND(RC[-3]>=0.3,RC[-3]>0.4),95,IF(AND(RC[-3]>=0.4,RC[-3]<0.5),90,IF(AND(RC[-3]>=0.5,RC[-3]<0.6),85,IF(AND(RC[-3]>=0.6,RC[-3]<0.7),80,IF(AND(RC[-3]>=0.6,RC[-3]<1),80,IF(AND(RC[-3]>1,RC[-3]<2),50,IF(RC[-3]>2,0))))))))) ->  | I383: =IF(RC[-1]="",RC[-2],0.7*RC[-1]+0.3*RC[-2]) -> 85
A384: سیمان مجد خواف | B384: سخواف | C384: =VLOOKUP(RC[-1],Sheet1!R3C2:R802C3,2,FALSE) -> سیمان آهک گچ | D384: =VLOOKUP(RC[-2],Sheet1!R3C2:R802C9,8,FALSE) -> -47.64204545454546 | E384: =IF(VLOOKUP(RC[-3],Sheet1!R3C2:R803C11,10,FALSE)=0,"",VLOOKUP(Sheet2!RC[-3],Sheet1!R[1]C[-3]:R[801]C[6],10,FALSE)) ->  | F384: =Sheet1!R419C10 -> 6.5383737205402594 | G384: =IF(RC[-3]<0,0,IF(AND(RC[-3]<RC[-1],RC[-3]<2),100,IF(AND(RC[-3]<RC[-1],RC[-3]>=2,RC[-3]<3),95,IF(AND(RC[-3]<RC[-1],RC[-3]>=3,RC[-3]<4),90,IF(AND(RC[-3]<RC[-1],RC[-3]>=4,RC[-3]<5),85,IF(AND(RC[-3]<RC[-1],RC[-3]>=5,RC[-3]<6),80,IF(AND(RC[-3]<RC[-1],RC[-3]>=6,RC[-3]<7),75,IF(AND(RC[-3]<RC[-1],RC[-3]>=7,RC[-3]<8),70,IF(AND(RC[-3]<RC[-1],RC[-3]>=8,RC[-3]<9),65,IF(AND(RC[-3]<RC[-1],RC[-3]>=9,RC[-3]<10),60,IF(AND(RC[-3]<RC[-1],RC[-3]>=10,RC[-3]<11),55,IF(AND(RC[-3]<RC[-1],RC[-3]>=11,RC[-3]<12),50,IF(AND(RC[-3]<RC[-1],RC[-3]>=12,RC[-3]<13),45,IF(AND(RC[-3]<RC[-1],RC[-3]>=13,RC[-3]<14),40,IF(AND(RC[-3]<RC[-1],RC[-3]>=14,RC[-3]<15),35,IF(AND(RC[-3]<RC[-1],RC[-3]>=15,RC[-3]<16),30,IF(AND(RC[-3]<RC[-1],RC[-3]>=16,RC[-3]<17),25,IF(AND(RC[-3]<RC[-1],RC[-3]>=17,RC[-3]<18),20,IF(AND(RC[-3]<RC[-1],RC[-3]>=18,RC[-3]<19),15,IF(AND(RC[-3]<RC[-1],RC[-3]>=19,RC[-3]<20),10,IF(AND(RC[-3]<RC[-1],RC[-3]>=20,RC[-3]<21),5,IF(AND(RC[-3]<RC[-1],RC[-3]>=21),0,IF(AND(RC[-3]>RC[-1],RC[-3]>=2,RC[-3]<3),90,IF(AND(RC[-3]>RC[-1],RC[-3]>=3,RC[-3]<4),90,IF(AND(RC[-3]>RC[-1],RC[-3]>=4,RC[-3]<5),80,IF(AND(RC[-3]>RC[-1],RC[-3]>=5,RC[-3]<6),70,IF(AND(RC[-3]>RC[-1],RC[-3]>=6,RC[-3]<7),60,IF(AND(RC[-3]>RC[-1],RC[-3]>=7,RC[-3]<8),50,IF(AND(RC[-3]>RC[-1],RC[-3]>=8,RC[-3]<9),40,IF(AND(RC[-3]>RC[-1],RC[-3]>=9,RC[-3]<10),30,IF(AND(RC[-3]>RC[-1],RC[-3]>=10,RC[-3]<11),20,IF(AND(RC[-3]>RC[-1],RC[-3]>=11,RC[-3]<12),10,IF(AND(RC[-3]>RC[-1],RC[-3]>=12),0))))))))))))))))))))))))))))))))) -> 0 | H384: =IF(RC[-3]="","",IF(RC[-3]<0.3,100,IF(AND(RC[-3]>=0.3,RC[-3]>0.4),95,IF(AND(RC[-3]>=0.4,RC[-3]<0.5),90,IF(AND(RC[-3]>=0.5,RC[-3]<0.6),85,IF(AND(RC[-3]>=0.6,RC[-3]<0.7),80,IF(AND(RC[-3]>=0.6,RC[-3]<1),80,IF(AND(RC[-3]>1,RC[-3]<2),50,IF(RC[-3]>2,0))))))))) ->  | I384: =IF(RC[-1]="",RC[-2],0.7*RC[-1]+0.3*RC[-2]) -> 0
A385: سیمان ممتازان کرمان | B385: سمتاز | C385: =VLOOKUP(RC[-1],Sheet1!R3C2:R802C3,2,FALSE) -> سیمان آهک گچ | D385: =VLOOKUP(RC[-2],Sheet1!R3C2:R802C9,8,FALSE) -> 6.804059145071923 | E385: =IF(VLOOKUP(RC[-3],Sheet1!R3C2:R803C11,10,FALSE)=0,"",VLOOKUP(Sheet2!RC[-3],Sheet1!R[1]C[-3]:R[801]C[6],10,FALSE)) ->  | F385: =Sheet1!R419C10 -> 6.5383737205402594 | G385: =IF(RC[-3]<0,0,IF(AND(RC[-3]<RC[-1],RC[-3]<2),100,IF(AND(RC[-3]<RC[-1],RC[-3]>=2,RC[-3]<3),95,IF(AND(RC[-3]<RC[-1],RC[-3]>=3,RC[-3]<4),90,IF(AND(RC[-3]<RC[-1],RC[-3]>=4,RC[-3]<5),85,IF(AND(RC[-3]<RC[-1],RC[-3]>=5,RC[-3]<6),80,IF(AND(RC[-3]<RC[-1],RC[-3]>=6,RC[-3]<7),75,IF(AND(RC[-3]<RC[-1],RC[-3]>=7,RC[-3]<8),70,IF(AND(RC[-3]<RC[-1],RC[-3]>=8,RC[-3]<9),65,IF(AND(RC[-3]<RC[-1],RC[-3]>=9,RC[-3]<10),60,IF(AND(RC[-3]<RC[-1],RC[-3]>=10,RC[-3]<11),55,IF(AND(RC[-3]<RC[-1],RC[-3]>=11,RC[-3]<12),50,IF(AND(RC[-3]<RC[-1],RC[-3]>=12,RC[-3]<13),45,IF(AND(RC[-3]<RC[-1],RC[-3]>=13,RC[-3]<14),40,IF(AND(RC[-3]<RC[-1],RC[-3]>=14,RC[-3]<15),35,IF(AND(RC[-3]<RC[-1],RC[-3]>=15,RC[-3]<16),30,IF(AND(RC[-3]<RC[-1],RC[-3]>=16,RC[-3]<17),25,IF(AND(RC[-3]<RC[-1],RC[-3]>=17,RC[-3]<18),20,IF(AND(RC[-3]<RC[-1],RC[-3]>=18,RC[-3]<19),15,IF(AND(RC[-3]<RC[-1],RC[-3]>=19,RC[-3]<20),10,IF(AND(RC[-3]<RC[-1],RC[-3]>=20,RC[-3]<21),5,IF(AND(RC[-3]<RC[-1],RC[-3]>=21),0,IF(AND(RC[-3]>RC[-1],RC[-3]>=2,RC[-3]<3),90,IF(AND(RC[-3]>RC[-1],RC[-3]>=3,RC[-3]<4),90,IF(AND(RC[-3]>RC[-1],RC[-3]>=4,RC[-3]<5),80,IF(AND(RC[-3]>RC[-1],RC[-3]>=5,RC[-3]<6),70,IF(AND(RC[-3]>RC[-1],RC[-3]>=6,RC[-3]<7),60,IF(AND(RC[-3]>RC[-1],RC[-3]>=7,RC[-3]<8),50,IF(AND(RC[-3]>RC[-1],RC[-3]>=8,RC[-3]<9),40,IF(AND(RC[-3]>RC[-1],RC[-3]>=9,RC[-3]<10),30,IF(AND(RC[-3]>RC[-1],RC[-3]>=10,RC[-3]<11),20,IF(AND(RC[-3]>RC[-1],RC[-3]>=11,RC[-3]<12),10,IF(AND(RC[-3]>RC[-1],RC[-3]>=12),0))))))))))))))))))))))))))))))))) -> 60 | H385: =IF(RC[-3]="","",IF(RC[-3]<0.3,100,IF(AND(RC[-3]>=0.3,RC[-3]>0.4),95,IF(AND(RC[-3]>=0.4,RC[-3]<0.5),90,IF(AND(RC[-3]>=0.5,RC[-3]<0.6),85,IF(AND(RC[-3]>=0.6,RC[-3]<0.7),80,IF(AND(RC[-3]>=0.6,RC[-3]<1),80,IF(AND(RC[-3]>1,RC[-3]<2),50,IF(RC[-3]>2,0))))))))) ->  | I385: =IF(RC[-1]="",RC[-2],0.7*RC[-1]+0.3*RC[-2]) -> 60
A386: سیمان هرمزگان | B386: سهرمز | C386: =VLOOKUP(RC[-1],Sheet1!R3C2:R802C3,2,FALSE) -> سیمان آهک گچ | D386: =VLOOKUP(RC[-2],Sheet1!R3C2:R802C9,8,FALSE) -> 8.2556900309874486 | E386: =IF(VLOOKUP(RC[-3],Sheet1!R3C2:R803C11,10,FALSE)=0,"",VLOOKUP(Sheet2!RC[-3],Sheet1!R[1]C[-3]:R[801]C[6],10,FALSE)) ->  | F386: =Sheet1!R419C10 -> 6.5383737205402594 | G386: =IF(RC[-3]<0,0,IF(AND(RC[-3]<RC[-1],RC[-3]<2),100,IF(AND(RC[-3]<RC[-1],RC[-3]>=2,RC[-3]<3),95,IF(AND(RC[-3]<RC[-1],RC[-3]>=3,RC[-3]<4),90,IF(AND(RC[-3]<RC[-1],RC[-3]>=4,RC[-3]<5),85,IF(AND(RC[-3]<RC[-1],RC[-3]>=5,RC[-3]<6),80,IF(AND(RC[-3]<RC[-1],RC[-3]>=6,RC[-3]<7),75,IF(AND(RC[-3]<RC[-1],RC[-3]>=7,RC[-3]<8),70,IF(AND(RC[-3]<RC[-1],RC[-3]>=8,RC[-3]<9),65,IF(AND(RC[-3]<RC[-1],RC[-3]>=9,RC[-3]<10),60,IF(AND(RC[-3]<RC[-1],RC[-3]>=10,RC[-3]<11),55,IF(AND(RC[-3]<RC[-1],RC[-3]>=11,RC[-3]<12),50,IF(AND(RC[-3]<RC[-1],RC[-3]>=12,RC[-3]<13),45,IF(AND(RC[-3]<RC[-1],RC[-3]>=13,RC[-3]<14),40,IF(AND(RC[-3]<RC[-1],RC[-3]>=14,RC[-3]<15),35,IF(AND(RC[-3]<RC[-1],RC[-3]>=15,RC[-3]<16),30,IF(AND(RC[-3]<RC[-1],RC[-3]>=16,RC[-3]<17),25,IF(AND(RC[-3]<RC[-1],RC[-3]>=17,RC[-3]<18),20,IF(AND(RC[-3]<RC[-1],RC[-3]>=18,RC[-3]<19),15,IF(AND(RC[-3]<RC[-1],RC[-3]>=19,RC[-3]<20),10,IF(AND(RC[-3]<RC[-1],RC[-3]>=20,RC[-3]<21),5,IF(AND(RC[-3]<RC[-1],RC[-3]>=21),0,IF(AND(RC[-3]>RC[-1],RC[-3]>=2,RC[-3]<3),90,IF(AND(RC[-3]>RC[-1],RC[-3]>=3,RC[-3]<4),90,IF(AND(RC[-3]>RC[-1],RC[-3]>=4,RC[-3]<5),80,IF(AND(RC[-3]>RC[-1],RC[-3]>=5,RC[-3]<6),70,IF(AND(RC[-3]>RC[-1],RC[-3]>=6,RC[-3]<7),60,IF(AND(RC[-3]>RC[-1],RC[-3]>=7,RC[-3]<8),50,IF(AND(RC[-3]>RC[-1],RC[-3]>=8,RC[-3]<9),40,IF(AND(RC[-3]>RC[-1],RC[-3]>=9,RC[-3]<10),30,IF(AND(RC[-3]>RC[-1],RC[-3]>=10,RC[-3]<11),20,IF(AND(RC[-3]>RC[-1],RC[-3]>=11,RC[-3]<12),10,IF(AND(RC[-3]>RC[-1],RC[-3]>=12),0))))))))))))))))))))))))))))))))) -> 40 | H386: =IF(RC[-3]="","",IF(RC[-3]<0.3,100,IF(AND(RC[-3]>=0.3,RC[-3]>0.4),95,IF(AND(RC[-3]>=0.4,RC[-3]<0.5),90,IF(AND(RC[-3]>=0.5,RC[-3]<0.6),85,IF(AND(RC[-3]>=0.6,RC[-3]<0.7),80,IF(AND(RC[-3]>=0.6,RC[-3]<1),80,IF(AND(RC[-3]>1,RC[-3]<2),50,IF(RC[-3]>2,0))))))))) ->  | I386: =IF(RC[-1]="",RC[-2],0.7*RC[-1]+0.3*RC[-2]) -> 40
A387: سیمان هگمتان | B387: سهگمت | C387: =VLOOKUP(RC[-1],Sheet1!R3C2:R802C3,2,FALSE) -> سیمان آهک گچ | D387: =VLOOKUP(RC[-2],Sheet1!R3C2:R802C9,8,FALSE) -> 5.5614956661899217 | E387: =IF(VLOOKUP(RC[-3],Sheet1!R3C2:R803C11,10,FALSE)=0,"",VLOOKUP(Sheet2!RC[-3],Sheet1!R[1]C[-3]:R[801]C[6],10,FALSE)) ->  | F387: =Sheet1!R419C10 -> 6.5383737205402594 | G387: =IF(RC[-3]<0,0,IF(AND(RC[-3]<RC[-1],RC[-3]<2),100,IF(AND(RC[-3]<RC[-1],RC[-3]>=2,RC[-3]<3),95,IF(AND(RC[-3]<RC[-1],RC[-3]>=3,RC[-3]<4),90,IF(AND(RC[-3]<RC[-1],RC[-3]>=4,RC[-3]<5),85,IF(AND(RC[-3]<RC[-1],RC[-3]>=5,RC[-3]<6),80,IF(AND(RC[-3]<RC[-1],RC[-3]>=6,RC[-3]<7),75,IF(AND(RC[-3]<RC[-1],RC[-3]>=7,RC[-3]<8),70,IF(AND(RC[-3]<RC[-1],RC[-3]>=8,RC[-3]<9),65,IF(AND(RC[-3]<RC[-1],RC[-3]>=9,RC[-3]<10),60,IF(AND(RC[-3]<RC[-1],RC[-3]>=10,RC[-3]<11),55,IF(AND(RC[-3]<RC[-1],RC[-3]>=11,RC[-3]<12),50,IF(AND(RC[-3]<RC[-1],RC[-3]>=12,RC[-3]<13),45,IF(AND(RC[-3]<RC[-1],RC[-3]>=13,RC[-3]<14),40,IF(AND(RC[-3]<RC[-1],RC[-3]>=14,RC[-3]<15),35,IF(AND(RC[-3]<RC[-1],RC[-3]>=15,RC[-3]<16),30,IF(AND(RC[-3]<RC[-1],RC[-3]>=16,RC[-3]<17),25,IF(AND(RC[-3]<RC[-1],RC[-3]>=17,RC[-3]<18),20,IF(AND(RC[-3]<RC[-1],RC[-3]>=18,RC[-3]<19),15,IF(AND(RC[-3]<RC[-1],RC[-3]>=19,RC[-3]<20),10,IF(AND(RC[-3]<RC[-1],RC[-3]>=20,RC[-3]<21),5,IF(AND(RC[-3]<RC[-1],RC[-3]>=21),0,IF(AND(RC[-3]>RC[-1],RC[-3]>=2,RC[-3]<3),90,IF(AND(RC[-3]>RC[-1],RC[-3]>=3,RC[-3]<4),90,IF(AND(RC[-3]>RC[-1],RC[-3]>=4,RC[-3]<5),80,IF(AND(RC[-3]>RC[-1],RC[-3]>=5,RC[-3]<6),70,IF(AND(RC[-3]>RC[-1],RC[-3]>=6,RC[-3]<7),60,IF(AND(RC[-3]>RC[-1],RC[-3]>=7,RC[-3]<8),50,IF(AND(RC[-3]>RC[-1],RC[-3]>=8,RC[-3]<9),40,IF(AND(RC[-3]>RC[-1],RC[-3]>=9,RC[-3]<10),30,IF(AND(RC[-3]>RC[-1],RC[-3]>=10,RC[-3]<11),20,IF(AND(RC[-3]>RC[-1],RC[-3]>=11,RC[-3]<12),10,IF(AND(RC[-3]>RC[-1],RC[-3]>=12),0))))))))))))))))))))))))))))))))) -> 80 | H387: =IF(RC[-3]="","",IF(RC[-3]<0.3,100,IF(AND(RC[-3]>=0.3,RC[-3]>0.4),95,IF(AND(RC[-3]>=0.4,RC[-3]<0.5),90,IF(AND(RC[-3]>=0.5,RC[-3]<0.6),85,IF(AND(RC[-3]>=0.6,RC[-3]<0.7),80,IF(AND(RC[-3]>=0.6,RC[-3]<1),80,IF(AND(RC[-3]>1,RC[-3]<2),50,IF(RC[-3]>2,0))))))))) ->  | I387: =IF(RC[-1]="",RC[-2],0.7*RC[-1]+0.3*RC[-2]) -> 80
A388: سیمان کارون | B388: سکارون | C388: =VLOOKUP(RC[-1],Sheet1!R3C2:R802C3,2,FALSE) -> سیمان آهک گچ | D388: =VLOOKUP(RC[-2],Sheet1!R3C2:R802C9,8,FALSE) -> 11.070245195493706 | E388: =IF(VLOOKUP(RC[-3],Sheet1!R3C2:R803C11,10,FALSE)=0,"",VLOOKUP(Sheet2!RC[-3],Sheet1!R[1]C[-3]:R[801]C[6],10,FALSE)) ->  | F388: =Sheet1!R419C10 -> 6.5383737205402594 | G388: =IF(RC[-3]<0,0,IF(AND(RC[-3]<RC[-1],RC[-3]<2),100,IF(AND(RC[-3]<RC[-1],RC[-3]>=2,RC[-3]<3),95,IF(AND(RC[-3]<RC[-1],RC[-3]>=3,RC[-3]<4),90,IF(AND(RC[-3]<RC[-1],RC[-3]>=4,RC[-3]<5),85,IF(AND(RC[-3]<RC[-1],RC[-3]>=5,RC[-3]<6),80,IF(AND(RC[-3]<RC[-1],RC[-3]>=6,RC[-3]<7),75,IF(AND(RC[-3]<RC[-1],RC[-3]>=7,RC[-3]<8),70,IF(AND(RC[-3]<RC[-1],RC[-3]>=8,RC[-3]<9),65,IF(AND(RC[-3]<RC[-1],RC[-3]>=9,RC[-3]<10),60,IF(AND(RC[-3]<RC[-1],RC[-3]>=10,RC[-3]<11),55,IF(AND(RC[-3]<RC[-1],RC[-3]>=11,RC[-3]<12),50,IF(AND(RC[-3]<RC[-1],RC[-3]>=12,RC[-3]<13),45,IF(AND(RC[-3]<RC[-1],RC[-3]>=13,RC[-3]<14),40,IF(AND(RC[-3]<RC[-1],RC[-3]>=14,RC[-3]<15),35,IF(AND(RC[-3]<RC[-1],RC[-3]>=15,RC[-3]<16),30,IF(AND(RC[-3]<RC[-1],RC[-3]>=16,RC[-3]<17),25,IF(AND(RC[-3]<RC[-1],RC[-3]>=17,RC[-3]<18),20,IF(AND(RC[-3]<RC[-1],RC[-3]>=18,RC[-3]<19),15,IF(AND(RC[-3]<RC[-1],RC[-3]>=19,RC[-3]<20),10,IF(AND(RC[-3]<RC[-1],RC[-3]>=20,RC[-3]<21),5,IF(AND(RC[-3]<RC[-1],RC[-3]>=21),0,IF(AND(RC[-3]>RC[-1],RC[-3]>=2,RC[-3]<3),90,IF(AND(RC[-3]>RC[-1],RC[-3]>=3,RC[-3]<4),90,IF(AND(RC[-3]>RC[-1],RC[-3]>=4,RC[-3]<5),80,IF(AND(RC[-3]>RC[-1],RC[-3]>=5,RC[-3]<6),70,IF(AND(RC[-3]>RC[-1],RC[-3]>=6,RC[-3]<7),60,IF(AND(RC[-3]>RC[-1],RC[-3]>=7,RC[-3]<8),50,IF(AND(RC[-3]>RC[-1],RC[-3]>=8,RC[-3]<9),40,IF(AND(RC[-3]>RC[-1],RC[-3]>=9,RC[-3]<10),30,IF(AND(RC[-3]>RC[-1],RC[-3]>=10,RC[-3]<11),20,IF(AND(RC[-3]>RC[-1],RC[-3]>=11,RC[-3]<12),10,IF(AND(RC[-3]>RC[-1],RC[-3]>=12),0))))))))))))))))))))))))))))))))) -> 10 | H388: =IF(RC[-3]="","",IF(RC[-3]<0.3,100,IF(AND(RC[-3]>=0.3,RC[-3]>0.4),95,IF(AND(RC[-3]>=0.4,RC[-3]<0.5),90,IF(AND(RC[-3]>=0.5,RC[-3]<0.6),85,IF(AND(RC[-3]>=0.6,RC[-3]<0.7),80,IF(AND(RC[-3]>=0.6,RC[-3]<1),80,IF(AND(RC[-3]>1,RC[-3]<2),50,IF(RC[-3]>2,0))))))))) ->  | I388: =IF(RC[-1]="",RC[-2],0.7*RC[-1]+0.3*RC[-2]) -> 10
A389: سیمان کردستان | B389: سکرد | C389: =VLOOKUP(RC[-1],Sheet1!R3C2:R802C3,2,FALSE) -> سیمان آهک گچ | D389: =VLOOKUP(RC[-2],Sheet1!R3C2:R802C9,8,FALSE) -> 10.117458867989882 | E389: =IF(VLOOKUP(RC[-3],Sheet1!R3C2:R803C11,10,FALSE)=0,"",VLOOKUP(Sheet2!RC[-3],Sheet1!R[1]C[-3]:R[801]C[6],10,FALSE)) ->  | F389: =Sheet1!R419C10 -> 6.5383737205402594 | G389: =IF(RC[-3]<0,0,IF(AND(RC[-3]<RC[-1],RC[-3]<2),100,IF(AND(RC[-3]<RC[-1],RC[-3]>=2,RC[-3]<3),95,IF(AND(RC[-3]<RC[-1],RC[-3]>=3,RC[-3]<4),90,IF(AND(RC[-3]<RC[-1],RC[-3]>=4,RC[-3]<5),85,IF(AND(RC[-3]<RC[-1],RC[-3]>=5,RC[-3]<6),80,IF(AND(RC[-3]<RC[-1],RC[-3]>=6,RC[-3]<7),75,IF(AND(RC[-3]<RC[-1],RC[-3]>=7,RC[-3]<8),70,IF(AND(RC[-3]<RC[-1],RC[-3]>=8,RC[-3]<9),65,IF(AND(RC[-3]<RC[-1],RC[-3]>=9,RC[-3]<10),60,IF(AND(RC[-3]<RC[-1],RC[-3]>=10,RC[-3]<11),55,IF(AND(RC[-3]<RC[-1],RC[-3]>=11,RC[-3]<12),50,IF(AND(RC[-3]<RC[-1],RC[-3]>=12,RC[-3]<13),45,IF(AND(RC[-3]<RC[-1],RC[-3]>=13,RC[-3]<14),40,IF(AND(RC[-3]<RC[-1],RC[-3]>=14,RC[-3]<15),35,IF(AND(RC[-3]<RC[-1],RC[-3]>=15,RC[-3]<16),30,IF(AND(RC[-3]<RC[-1],RC[-3]>=16,RC[-3]<17),25,IF(AND(RC[-3]<RC[-1],RC[-3]>=17,RC[-3]<18),20,IF(AND(RC[-3]<RC[-1],RC[-3]>=18,RC[-3]<19),15,IF(AND(RC[-3]<RC[-1],RC[-3]>=19,RC[-3]<20),10,IF(AND(RC[-3]<RC[-1],RC[-3]>=20,RC[-3]<21),5,IF(AND(RC[-3]<RC[-1],RC[-3]>=21),0,IF(AND(RC[-3]>RC[-1],RC[-3]>=2,RC[-3]<3),90,IF(AND(RC[-3]>RC[-1],RC[-3]>=3,RC[-3]<4),90,IF(AND(RC[-3]>RC[-1],RC[-3]>=4,RC[-3]<5),80,IF(AND(RC[-3]>RC[-1],RC[-3]>=5,RC[-3]<6),70,IF(AND(RC[-3]>RC[-1],RC[-3]>=6,RC[-3]<7),60,IF(AND(RC[-3]>RC[-1],RC[-3]>=7,RC[-3]<8),50,IF(AND(RC[-3]>RC[-1],RC[-3]>=8,RC[-3]<9),40,IF(AND(RC[-3]>RC[-1],RC[-3]>=9,RC[-3]<10),30,IF(AND(RC[-3]>RC[-1],RC[-3]>=10,RC[-3]<11),20,IF(AND(RC[-3]>RC[-1],RC[-3]>=11,RC[-3]<12),10,IF(AND(RC[-3]>RC[-1],RC[-3]>=12),0))))))))))))))))))))))))))))))))) -> 20 | H389: =IF(RC[-3]="","",IF(RC[-3]<0.3,100,IF(AND(RC[-3]>=0.3,RC[-3]>0.4),95,IF(AND(RC[-3]>=0.4,RC[-3]<0.5),90,IF(AND(RC[-3]>=0.5,RC[-3]<0.6),85,IF(AND(RC[-3]>=0.6,RC[-3]<0.7),80,IF(AND(RC[-3]>=0.6,RC[-3]<1),80,IF(AND(RC[-3]>1,RC[-3]<2),50,IF(RC[-3]>2,0))))))))) ->  | I389: =IF(RC[-1]="",RC[-2],0.7*RC[-1]+0.3*RC[-2]) -> 20
A390: سیمان کرمان | B390: سکرما | C390: =VLOOKUP(RC[-1],Sheet1!R3C2:R802C3,2,FALSE) -> سیمان آهک گچ | D390: =VLOOKUP(RC[-2],Sheet1!R3C2:R802C9,8,FALSE) -> 4.2 | E390: =IF(VLOOKUP(RC[-3],Sheet1!R3C2:R803C11,10,FALSE)=0,"",VLOOKUP(Sheet2!RC[-3],Sheet1!R[1]C[-3]:R[801]C[6],10,FALSE)) ->  | F390: =Sheet1!R419C10 -> 6.5383737205402594 | G390: =IF(RC[-3]<0,0,IF(AND(RC[-3]<RC[-1],RC[-3]<2),100,IF(AND(RC[-3]<RC[-1],RC[-3]>=2,RC[-3]<3),95,IF(AND(RC[-3]<RC[-1],RC[-3]>=3,RC[-3]<4),90,IF(AND(RC[-3]<RC[-1],RC[-3]>=4,RC[-3]<5),85,IF(AND(RC[-3]<RC[-1],RC[-3]>=5,RC[-3]<6),80,IF(AND(RC[-3]<RC[-1],RC[-3]>=6,RC[-3]<7),75,IF(AND(RC[-3]<RC[-1],RC[-3]>=7,RC[-3]<8),70,IF(AND(RC[-3]<RC[-1],RC[-3]>=8,RC[-3]<9),65,IF(AND(RC[-3]<RC[-1],RC[-3]>=9,RC[-3]<10),60,IF(AND(RC[-3]<RC[-1],RC[-3]>=10,RC[-3]<11),55,IF(AND(RC[-3]<RC[-1],RC[-3]>=11,RC[-3]<12),50,IF(AND(RC[-3]<RC[-1],RC[-3]>=12,RC[-3]<13),45,IF(AND(RC[-3]<RC[-1],RC[-3]>=13,RC[-3]<14),40,IF(AND(RC[-3]<RC[-1],RC[-3]>=14,RC[-3]<15),35,IF(AND(RC[-3]<RC[-1],RC[-3]>=15,RC[-3]<16),30,IF(AND(RC[-3]<RC[-1],RC[-3]>=16,RC[-3]<17),25,IF(AND(RC[-3]<RC[-1],RC[-3]>=17,RC[-3]<18),20,IF(AND(RC[-3]<RC[-1],RC[-3]>=18,RC[-3]<19),15,IF(AND(RC[-3]<RC[-1],RC[-3]>=19,RC[-3]<20),10,IF(AND(RC[-3]<RC[-1],RC[-3]>=20,RC[-3]<21),5,IF(AND(RC[-3]<RC[-1],RC[-3]>=21),0,IF(AND(RC[-3]>RC[-1],RC[-3]>=2,RC[-3]<3),90,IF(AND(RC[-3]>RC[-1],RC[-3]>=3,RC[-3]<4),90,IF(AND(RC[-3]>RC[-1],RC[-3]>=4,RC[-3]<5),80,IF(AND(RC[-3]>RC[-1],RC[-3]>=5,RC[-3]<6),70,IF(AND(RC[-3]>RC[-1],RC[-3]>=6,RC[-3]<7),60,IF(AND(RC[-3]>RC[-1],RC[-3]>=7,RC[-3]<8),50,IF(AND(RC[-3]>RC[-1],RC[-3]>=8,RC[-3]<9),40,IF(AND(RC[-3]>RC[-1],RC[-3]>=9,RC[-3]<10),30,IF(AND(RC[-3]>RC[-1],RC[-3]>=10,RC[-3]<11),20,IF(AND(RC[-3]>RC[-1],RC[-3]>=11,RC[-3]<12),10,IF(AND(RC[-3]>RC[-1],RC[-3]>=12),0))))))))))))))))))))))))))))))))) -> 85 | H390: =IF(RC[-3]="","",IF(RC[-3]<0.3,100,IF(AND(RC[-3]>=0.3,RC[-3]>0.4),95,IF(AND(RC[-3]>=0.4,RC[-3]<0.5),90,IF(AND(RC[-3]>=0.5,RC[-3]<0.6),85,IF(AND(RC[-3]>=0.6,RC[-3]<0.7),80,IF(AND(RC[-3]>=0.6,RC[-3]<1),80,IF(AND(RC[-3]>1,RC[-3]<2),50,IF(RC[-3]>2,0))))))))) ->  | I390: =IF(RC[-1]="",RC[-2],0.7*RC[-1]+0.3*RC[-2]) -> 85
A391: آریان کیمیا تک | B391: کیمیاتک | C391: =VLOOKUP(RC[-1],Sheet1!R3C2:R802C3,2,FALSE) -> شیمیایی | D391: =VLOOKUP(RC[-2],Sheet1!R3C2:R802C9,8,FALSE) -> 5.8 | E391: =IF(VLOOKUP(RC[-3],Sheet1!R3C2:R803C11,10,FALSE)=0,"",VLOOKUP(Sheet2!RC[-3],Sheet1!R[1]C[-3]:R[801]C[6],10,FALSE)) ->  | F391: =Sheet1!R488C10 -> 5.0300989663672855 | G391: =IF(RC[-3]<0,0,IF(AND(RC[-3]<RC[-1],RC[-3]<2),100,IF(AND(RC[-3]<RC[-1],RC[-3]>=2,RC[-3]<3),95,IF(AND(RC[-3]<RC[-1],RC[-3]>=3,RC[-3]<4),90,IF(AND(RC[-3]<RC[-1],RC[-3]>=4,RC[-3]<5),85,IF(AND(RC[-3]<RC[-1],RC[-3]>=5,RC[-3]<6),80,IF(AND(RC[-3]<RC[-1],RC[-3]>=6,RC[-3]<7),75,IF(AND(RC[-3]<RC[-1],RC[-3]>=7,RC[-3]<8),70,IF(AND(RC[-3]<RC[-1],RC[-3]>=8,RC[-3]<9),65,IF(AND(RC[-3]<RC[-1],RC[-3]>=9,RC[-3]<10),60,IF(AND(RC[-3]<RC[-1],RC[-3]>=10,RC[-3]<11),55,IF(AND(RC[-3]<RC[-1],RC[-3]>=11,RC[-3]<12),50,IF(AND(RC[-3]<RC[-1],RC[-3]>=12,RC[-3]<13),45,IF(AND(RC[-3]<RC[-1],RC[-3]>=13,RC[-3]<14),40,IF(AND(RC[-3]<RC[-1],RC[-3]>=14,RC[-3]<15),35,IF(AND(RC[-3]<RC[-1],RC[-3]>=15,RC[-3]<16),30,IF(AND(RC[-3]<RC[-1],RC[-3]>=16,RC[-3]<17),25,IF(AND(RC[-3]<RC[-1],RC[-3]>=17,RC[-3]<18),20,IF(AND(RC[-3]<RC[-1],RC[-3]>=18,RC[-3]<19),15,IF(AND(RC[-3]<RC[-1],RC[-3]>=19,RC[-3]<20),10,IF(AND(RC[-3]<RC[-1],RC[-3]>=20,RC[-3]<21),5,IF(AND(RC[-3]<RC[-1],RC[-3]>=21),0,IF(AND(RC[-3]>RC[-1],RC[-3]>=2,RC[-3]<3),90,IF(AND(RC[-3]>RC[-1],RC[-3]>=3,RC[-3]<4),90,IF(AND(RC[-3]>RC[-1],RC[-3]>=4,RC[-3]<5),80,IF(AND(RC[-3]>RC[-1],RC[-3]>=5,RC[-3]<6),70,IF(AND(RC[-3]>RC[-1],RC[-3]>=6,RC[-3]<7),60,IF(AND(RC[-3]>RC[-1],RC[-3]>=7,RC[-3]<8),50,IF(AND(RC[-3]>RC[-1],RC[-3]>=8,RC[-3]<9),40,IF(AND(RC[-3]>RC[-1],RC[-3]>=9,RC[-3]<10),30,IF(AND(RC[-3]>RC[-1],RC[-3]>=10,RC[-3]<11),20,IF(AND(RC[-3]>RC[-1],RC[-3]>=11,RC[-3]<12),10,IF(AND(RC[-3]>RC[-1],RC[-3]>=12),0))))))))))))))))))))))))))))))))) -> 70 | H391: =IF(RC[-3]="","",IF(RC[-3]<0.3,100,IF(AND(RC[-3]>=0.3,RC[-3]>0.4),95,IF(AND(RC[-3]>=0.4,RC[-3]<0.5),90,IF(AND(RC[-3]>=0.5,RC[-3]<0.6),85,IF(AND(RC[-3]>=0.6,RC[-3]<0.7),80,IF(AND(RC[-3]>=0.6,RC[-3]<1),80,IF(AND(RC[-3]>1,RC[-3]<2),50,IF(RC[-3]>2,0))))))))) ->  | I391: =IF(RC[-1]="",RC[-2],0.7*RC[-1]+0.3*RC[-2]) -> 70
A392: الیاف مصنوعی | B392: شمواد | C392: =VLOOKUP(RC[-1],Sheet1!R3C2:R802C3,2,FALSE) -> شیمیایی | D392: =VLOOKUP(RC[-2],Sheet1!R3C2:R802C9,8,FALSE) -> 5.979382889195314 | E392: =IF(VLOOKUP(RC[-3],Sheet1!R3C2:R803C11,10,FALSE)=0,"",VLOOKUP(Sheet2!RC[-3],Sheet1!R[1]C[-3]:R[801]C[6],10,FALSE)) ->  | F392: =Sheet1!R488C10 -> 5.0300989663672855 | G392: =IF(RC[-3]<0,0,IF(AND(RC[-3]<RC[-1],RC[-3]<2),100,IF(AND(RC[-3]<RC[-1],RC[-3]>=2,RC[-3]<3),95,IF(AND(RC[-3]<RC[-1],RC[-3]>=3,RC[-3]<4),90,IF(AND(RC[-3]<RC[-1],RC[-3]>=4,RC[-3]<5),85,IF(AND(RC[-3]<RC[-1],RC[-3]>=5,RC[-3]<6),80,IF(AND(RC[-3]<RC[-1],RC[-3]>=6,RC[-3]<7),75,IF(AND(RC[-3]<RC[-1],RC[-3]>=7,RC[-3]<8),70,IF(AND(RC[-3]<RC[-1],RC[-3]>=8,RC[-3]<9),65,IF(AND(RC[-3]<RC[-1],RC[-3]>=9,RC[-3]<10),60,IF(AND(RC[-3]<RC[-1],RC[-3]>=10,RC[-3]<11),55,IF(AND(RC[-3]<RC[-1],RC[-3]>=11,RC[-3]<12),50,IF(AND(RC[-3]<RC[-1],RC[-3]>=12,RC[-3]<13),45,IF(AND(RC[-3]<RC[-1],RC[-3]>=13,RC[-3]<14),40,IF(AND(RC[-3]<RC[-1],RC[-3]>=14,RC[-3]<15),35,IF(AND(RC[-3]<RC[-1],RC[-3]>=15,RC[-3]<16),30,IF(AND(RC[-3]<RC[-1],RC[-3]>=16,RC[-3]<17),25,IF(AND(RC[-3]<RC[-1],RC[-3]>=17,RC[-3]<18),20,IF(AND(RC[-3]<RC[-1],RC[-3]>=18,RC[-3]<19),15,IF(AND(RC[-3]<RC[-1],RC[-3]>=19,RC[-3]<20),10,IF(AND(RC[-3]<RC[-1],RC[-3]>=20,RC[-3]<21),5,IF(AND(RC[-3]<RC[-1],RC[-3]>=21),0,IF(AND(RC[-3]>RC[-1],RC[-3]>=2,RC[-3]<3),90,IF(AND(RC[-3]>RC[-1],RC[-3]>=3,RC[-3]<4),90,IF(AND(RC[-3]>RC[-1],RC[-3]>=4,RC[-3]<5),80,IF(AND(RC[-3]>RC[-1],RC[-3]>=5,RC[-3]<6),70,IF(AND(RC[-3]>RC[-1],RC[-3]>=6,RC[-3]<7),60,IF(AND(RC[-3]>RC[-1],RC[-3]>=7,RC[-3]<8),50,IF(AND(RC[-3]>RC[-1],RC[-3]>=8,RC[-3]<9),40,IF(AND(RC[-3]>RC[-1],RC[-3]>=9,RC[-3]<10),30,IF(AND(RC[-3]>RC[-1],RC[-3]>=10,RC[-3]<11),20,IF(AND(RC[-3]>RC[-1],RC[-3]>=11,RC[-3]<12),10,IF(AND(RC[-3]>RC[-1],RC[-3]>=12),0))))))))))))))))))))))))))))))))) -> 70 | H392: =IF(RC[-3]="","",IF(RC[-3]<0.3,100,IF(AND(RC[-3]>=0.3,RC[-3]>0.4),95,IF(AND(RC[-3]>=0.4,RC[-3]<0.5),90,IF(AND(RC[-3]>=0.5,RC[-3]<0.6),85,IF(AND(RC[-3]>=0.6,RC[-3]<0.7),80,IF(AND(RC[-3]>=0.6,RC[-3]<1),80,IF(AND(RC[-3]>1,RC[-3]<2),50,IF(RC[-3]>2,0))))))))) ->  | I392: =IF(RC[-1]="",RC[-2],0.7*RC[-1]+0.3*RC[-2]) -> 70
A393: بین المللی محصولات پارس | B393: شپارس | C393: =VLOOKUP(RC[-1],Sheet1!R3C2:R802C3,2,FALSE) -> شیمیایی | D393: =VLOOKUP(RC[-2],Sheet1!R3C2:R802C9,8,FALSE) -> 35.404502245654072 | E393: =IF(VLOOKUP(RC[-3],Sheet1!R3C2:R803C11,10,FALSE)=0,"",VLOOKUP(Sheet2!RC[-3],Sheet1!R[1]C[-3]:R[801]C[6],10,FALSE)) ->  | F393: =Sheet1!R488C10 -> 5.0300989663672855 | G393: =IF(RC[-3]<0,0,IF(AND(RC[-3]<RC[-1],RC[-3]<2),100,IF(AND(RC[-3]<RC[-1],RC[-3]>=2,RC[-3]<3),95,IF(AND(RC[-3]<RC[-1],RC[-3]>=3,RC[-3]<4),90,IF(AND(RC[-3]<RC[-1],RC[-3]>=4,RC[-3]<5),85,IF(AND(RC[-3]<RC[-1],RC[-3]>=5,RC[-3]<6),80,IF(AND(RC[-3]<RC[-1],RC[-3]>=6,RC[-3]<7),75,IF(AND(RC[-3]<RC[-1],RC[-3]>=7,RC[-3]<8),70,IF(AND(RC[-3]<RC[-1],RC[-3]>=8,RC[-3]<9),65,IF(AND(RC[-3]<RC[-1],RC[-3]>=9,RC[-3]<10),60,IF(AND(RC[-3]<RC[-1],RC[-3]>=10,RC[-3]<11),55,IF(AND(RC[-3]<RC[-1],RC[-3]>=11,RC[-3]<12),50,IF(AND(RC[-3]<RC[-1],RC[-3]>=12,RC[-3]<13),45,IF(AND(RC[-3]<RC[-1],RC[-3]>=13,RC[-3]<14),40,IF(AND(RC[-3]<RC[-1],RC[-3]>=14,RC[-3]<15),35,IF(AND(RC[-3]<RC[-1],RC[-3]>=15,RC[-3]<16),30,IF(AND(RC[-3]<RC[-1],RC[-3]>=16,RC[-3]<17),25,IF(AND(RC[-3]<RC[-1],RC[-3]>=17,RC[-3]<18),20,IF(AND(RC[-3]<RC[-1],RC[-3]>=18,RC[-3]<19),15,IF(AND(RC[-3]<RC[-1],RC[-3]>=19,RC[-3]<20),10,IF(AND(RC[-3]<RC[-1],RC[-3]>=20,RC[-3]<21),5,IF(AND(RC[-3]<RC[-1],RC[-3]>=21),0,IF(AND(RC[-3]>RC[-1],RC[-3]>=2,RC[-3]<3),90,IF(AND(RC[-3]>RC[-1],RC[-3]>=3,RC[-3]<4),90,IF(AND(RC[-3]>RC[-1],RC[-3]>=4,RC[-3]<5),80,IF(AND(RC[-3]>RC[-1],RC[-3]>=5,RC[-3]<6),70,IF(AND(RC[-3]>RC[-1],RC[-3]>=6,RC[-3]<7),60,IF(AND(RC[-3]>RC[-1],RC[-3]>=7,RC[-3]<8),50,IF(AND(RC[-3]>RC[-1],RC[-3]>=8,RC[-3]<9),40,IF(AND(RC[-3]>RC[-1],RC[-3]>=9,RC[-3]<10),30,IF(AND(RC[-3]>RC[-1],RC[-3]>=10,RC[-3]<11),20,IF(AND(RC[-3]>RC[-1],RC[-3]>=11,RC[-3]<12),10,IF(AND(RC[-3]>RC[-1],RC[-3]>=12),0))))))))))))))))))))))))))))))))) -> 0 | H393: =IF(RC[-3]="","",IF(RC[-3]<0.3,100,IF(AND(RC[-3]>=0.3,RC[-3]>0.4),95,IF(AND(RC[-3]>=0.4,RC[-3]<0.5),90,IF(AND(RC[-3]>=0.5,RC[-3]<0.6),85,IF(AND(RC[-3]>=0.6,RC[-3]<0.7),80,IF(AND(RC[-3]>=0.6,RC[-3]<1),80,IF(AND(RC[-3]>1,RC[-3]<2),50,IF(RC[-3]>2,0))))))))) ->  | I393: =IF(RC[-1]="",RC[-2],0.7*RC[-1]+0.3*RC[-2]) -> 0
A394: پارس پامچال | B394: شپمچا | C394: =VLOOKUP(RC[-1],Sheet1!R3C2:R802C3,2,FALSE) -> شیمیایی | D394: =VLOOKUP(RC[-2],Sheet1!R3C2:R802C9,8,FALSE) -> 2.0443548387096775 | E394: =IF(VLOOKUP(RC[-3],Sheet1!R3C2:R803C11,10,FALSE)=0,"",VLOOKUP(Sheet2!RC[-3],Sheet1!R[1]C[-3]:R[801]C[6],10,FALSE)) ->  | F394: =Sheet1!R488C10 -> 5.0300989663672855 | G394: =IF(RC[-3]<0,0,IF(AND(RC[-3]<RC[-1],RC[-3]<2),100,IF(AND(RC[-3]<RC[-1],RC[-3]>=2,RC[-3]<3),95,IF(AND(RC[-3]<RC[-1],RC[-3]>=3,RC[-3]<4),90,IF(AND(RC[-3]<RC[-1],RC[-3]>=4,RC[-3]<5),85,IF(AND(RC[-3]<RC[-1],RC[-3]>=5,RC[-3]<6),80,IF(AND(RC[-3]<RC[-1],RC[-3]>=6,RC[-3]<7),75,IF(AND(RC[-3]<RC[-1],RC[-3]>=7,RC[-3]<8),70,IF(AND(RC[-3]<RC[-1],RC[-3]>=8,RC[-3]<9),65,IF(AND(RC[-3]<RC[-1],RC[-3]>=9,RC[-3]<10),60,IF(AND(RC[-3]<RC[-1],RC[-3]>=10,RC[-3]<11),55,IF(AND(RC[-3]<RC[-1],RC[-3]>=11,RC[-3]<12),50,IF(AND(RC[-3]<RC[-1],RC[-3]>=12,RC[-3]<13),45,IF(AND(RC[-3]<RC[-1],RC[-3]>=13,RC[-3]<14),40,IF(AND(RC[-3]<RC[-1],RC[-3]>=14,RC[-3]<15),35,IF(AND(RC[-3]<RC[-1],RC[-3]>=15,RC[-3]<16),30,IF(AND(RC[-3]<RC[-1],RC[-3]>=16,RC[-3]<17),25,IF(AND(RC[-3]<RC[-1],RC[-3]>=17,RC[-3]<18),20,IF(AND(RC[-3]<RC[-1],RC[-3]>=18,RC[-3]<19),15,IF(AND(RC[-3]<RC[-1],RC[-3]>=19,RC[-3]<20),10,IF(AND(RC[-3]<RC[-1],RC[-3]>=20,RC[-3]<21),5,IF(AND(RC[-3]<RC[-1],RC[-3]>=21),0,IF(AND(RC[-3]>RC[-1],RC[-3]>=2,RC[-3]<3),90,IF(AND(RC[-3]>RC[-1],RC[-3]>=3,RC[-3]<4),90,IF(AND(RC[-3]>RC[-1],RC[-3]>=4,RC[-3]<5),80,IF(AND(RC[-3]>RC[-1],RC[-3]>=5,RC[-3]<6),70,IF(AND(RC[-3]>RC[-1],RC[-3]>=6,RC[-3]<7),60,IF(AND(RC[-3]>RC[-1],RC[-3]>=7,RC[-3]<8),50,IF(AND(RC[-3]>RC[-1],RC[-3]>=8,RC[-3]<9),40,IF(AND(RC[-3]>RC[-1],RC[-3]>=9,RC[-3]<10),30,IF(AND(RC[-3]>RC[-1],RC[-3]>=10,RC[-3]<11),20,IF(AND(RC[-3]>RC[-1],RC[-3]>=11,RC[-3]<12),10,IF(AND(RC[-3]>RC[-1],RC[-3]>=12),0))))))))))))))))))))))))))))))))) -> 95 | H394: =IF(RC[-3]="","",IF(RC[-3]<0.3,100,IF(AND(RC[-3]>=0.3,RC[-3]>0.4),95,IF(AND(RC[-3]>=0.4,RC[-3]<0.5),90,IF(AND(RC[-3]>=0.5,RC[-3]<0.6),85,IF(AND(RC[-3]>=0.6,RC[-3]<0.7),80,IF(AND(RC[-3]>=0.6,RC[-3]<1),80,IF(AND(RC[-3]>1,RC[-3]<2),50,IF(RC[-3]>2,0))))))))) ->  | I394: =IF(RC[-1]="",RC[-2],0.7*RC[-1]+0.3*RC[-2]) -> 95
A395: پاکسان | B395: شپاکسا | C395: =VLOOKUP(RC[-1],Sheet1!R3C2:R802C3,2,FALSE) -> شیمیایی | D395: =VLOOKUP(RC[-2],Sheet1!R3C2:R802C9,8,FALSE) -> 37.372452716698355 | E395: =IF(VLOOKUP(RC[-3],Sheet1!R3C2:R803C11,10,FALSE)=0,"",VLOOKUP(Sheet2!RC[-3],Sheet1!R[1]C[-3]:R[801]C[6],10,FALSE)) ->  | F395: =Sheet1!R488C10 -> 5.0300989663672855 | G395: =IF(RC[-3]<0,0,IF(AND(RC[-3]<RC[-1],RC[-3]<2),100,IF(AND(RC[-3]<RC[-1],RC[-3]>=2,RC[-3]<3),95,IF(AND(RC[-3]<RC[-1],RC[-3]>=3,RC[-3]<4),90,IF(AND(RC[-3]<RC[-1],RC[-3]>=4,RC[-3]<5),85,IF(AND(RC[-3]<RC[-1],RC[-3]>=5,RC[-3]<6),80,IF(AND(RC[-3]<RC[-1],RC[-3]>=6,RC[-3]<7),75,IF(AND(RC[-3]<RC[-1],RC[-3]>=7,RC[-3]<8),70,IF(AND(RC[-3]<RC[-1],RC[-3]>=8,RC[-3]<9),65,IF(AND(RC[-3]<RC[-1],RC[-3]>=9,RC[-3]<10),60,IF(AND(RC[-3]<RC[-1],RC[-3]>=10,RC[-3]<11),55,IF(AND(RC[-3]<RC[-1],RC[-3]>=11,RC[-3]<12),50,IF(AND(RC[-3]<RC[-1],RC[-3]>=12,RC[-3]<13),45,IF(AND(RC[-3]<RC[-1],RC[-3]>=13,RC[-3]<14),40,IF(AND(RC[-3]<RC[-1],RC[-3]>=14,RC[-3]<15),35,IF(AND(RC[-3]<RC[-1],RC[-3]>=15,RC[-3]<16),30,IF(AND(RC[-3]<RC[-1],RC[-3]>=16,RC[-3]<17),25,IF(AND(RC[-3]<RC[-1],RC[-3]>=17,RC[-3]<18),20,IF(AND(RC[-3]<RC[-1],RC[-3]>=18,RC[-3]<19),15,IF(AND(RC[-3]<RC[-1],RC[-3]>=19,RC[-3]<20),10,IF(AND(RC[-3]<RC[-1],RC[-3]>=20,RC[-3]<21),5,IF(AND(RC[-3]<RC[-1],RC[-3]>=21),0,IF(AND(RC[-3]>RC[-1],RC[-3]>=2,RC[-3]<3),90,IF(AND(RC[-3]>RC[-1],RC[-3]>=3,RC[-3]<4),90,IF(AND(RC[-3]>RC[-1],RC[-3]>=4,RC[-3]<5),80,IF(AND(RC[-3]>RC[-1],RC[-3]>=5,RC[-3]<6),70,IF(AND(RC[-3]>RC[-1],RC[-3]>=6,RC[-3]<7),60,IF(AND(RC[-3]>RC[-1],RC[-3]>=7,RC[-3]<8),50,IF(AND(RC[-3]>RC[-1],RC[-3]>=8,RC[-3]<9),40,IF(AND(RC[-3]>RC[-1],RC[-3]>=9,RC[-3]<10),30,IF(AND(RC[-3]>RC[-1],RC[-3]>=10,RC[-3]<11),20,IF(AND(RC[-3]>RC[-1],RC[-3]>=11,RC[-3]<12),10,IF(AND(RC[-3]>RC[-1],RC[-3]>=12),0))))))))))))))))))))))))))))))))) -> 0 | H395: =IF(RC[-3]="","",IF(RC[-3]<0.3,100,IF(AND(RC[-3]>=0.3,RC[-3]>0.4),95,IF(AND(RC[-3]>=0.4,RC[-3]<0.5),90,IF(AND(RC[-3]>=0.5,RC[-3]<0.6),85,IF(AND(RC[-3]>=0.6,RC[-3]<0.7),80,IF(AND(RC[-3]>=0.6,RC[-3]<1),80,IF(AND(RC[-3]>1,RC[-3]<2),50,IF(RC[-3]>2,0))))))))) ->  | I395: =IF(RC[-1]="",RC[-2],0.7*RC[-1]+0.3*RC[-2]) -> 0
A396: پترو گامرون | B396: شگامرن | C396: =VLOOKUP(RC[-1],Sheet1!R3C2:R802C3,2,FALSE) -> شیمیایی | D396: =VLOOKUP(RC[-2],Sheet1!R3C2:R802C9,8,FALSE) -> 145.5017931323755 | E396: =IF(VLOOKUP(RC[-3],Sheet1!R3C2:R803C11,10,FALSE)=0,"",VLOOKUP(Sheet2!RC[-3],Sheet1!R[1]C[-3]:R[801]C[6],10,FALSE)) ->  | F396: =Sheet1!R488C10 -> 5.0300989663672855 | G396: =IF(RC[-3]<0,0,IF(AND(RC[-3]<RC[-1],RC[-3]<2),100,IF(AND(RC[-3]<RC[-1],RC[-3]>=2,RC[-3]<3),95,IF(AND(RC[-3]<RC[-1],RC[-3]>=3,RC[-3]<4),90,IF(AND(RC[-3]<RC[-1],RC[-3]>=4,RC[-3]<5),85,IF(AND(RC[-3]<RC[-1],RC[-3]>=5,RC[-3]<6),80,IF(AND(RC[-3]<RC[-1],RC[-3]>=6,RC[-3]<7),75,IF(AND(RC[-3]<RC[-1],RC[-3]>=7,RC[-3]<8),70,IF(AND(RC[-3]<RC[-1],RC[-3]>=8,RC[-3]<9),65,IF(AND(RC[-3]<RC[-1],RC[-3]>=9,RC[-3]<10),60,IF(AND(RC[-3]<RC[-1],RC[-3]>=10,RC[-3]<11),55,IF(AND(RC[-3]<RC[-1],RC[-3]>=11,RC[-3]<12),50,IF(AND(RC[-3]<RC[-1],RC[-3]>=12,RC[-3]<13),45,IF(AND(RC[-3]<RC[-1],RC[-3]>=13,RC[-3]<14),40,IF(AND(RC[-3]<RC[-1],RC[-3]>=14,RC[-3]<15),35,IF(AND(RC[-3]<RC[-1],RC[-3]>=15,RC[-3]<16),30,IF(AND(RC[-3]<RC[-1],RC[-3]>=16,RC[-3]<17),25,IF(AND(RC[-3]<RC[-1],RC[-3]>=17,RC[-3]<18),20,IF(AND(RC[-3]<RC[-1],RC[-3]>=18,RC[-3]<19),15,IF(AND(RC[-3]<RC[-1],RC[-3]>=19,RC[-3]<20),10,IF(AND(RC[-3]<RC[-1],RC[-3]>=20,RC[-3]<21),5,IF(AND(RC[-3]<RC[-1],RC[-3]>=21),0,IF(AND(RC[-3]>RC[-1],RC[-3]>=2,RC[-3]<3),90,IF(AND(RC[-3]>RC[-1],RC[-3]>=3,RC[-3]<4),90,IF(AND(RC[-3]>RC[-1],RC[-3]>=4,RC[-3]<5),80,IF(AND(RC[-3]>RC[-1],RC[-3]>=5,RC[-3]<6),70,IF(AND(RC[-3]>RC[-1],RC[-3]>=6,RC[-3]<7),60,IF(AND(RC[-3]>RC[-1],RC[-3]>=7,RC[-3]<8),50,IF(AND(RC[-3]>RC[-1],RC[-3]>=8,RC[-3]<9),40,IF(AND(RC[-3]>RC[-1],RC[-3]>=9,RC[-3]<10),30,IF(AND(RC[-3]>RC[-1],RC[-3]>=10,RC[-3]<11),20,IF(AND(RC[-3]>RC[-1],RC[-3]>=11,RC[-3]<12),10,IF(AND(RC[-3]>RC[-1],RC[-3]>=12),0))))))))))))))))))))))))))))))))) -> 0 | H396: =IF(RC[-3]="","",IF(RC[-3]<0.3,100,IF(AND(RC[-3]>=0.3,RC[-3]>0.4),95,IF(AND(RC[-3]>=0.4,RC[-3]<0.5),90,IF(AND(RC[-3]>=0.5,RC[-3]<0.6),85,IF(AND(RC[-3]>=0.6,RC[-3]<0.7),80,IF(AND(RC[-3]>=0.6,RC[-3]<1),80,IF(AND(RC[-3]>1,RC[-3]<2),50,IF(RC[-3]>2,0))))))))) ->  | I396: =IF(RC[-1]="",RC[-2],0.7*RC[-1]+0.3*RC[-2]) -> 0
A397: پتروشیمی آبادان | B397: شپترو | C397: =VLOOKUP(RC[-1],Sheet1!R3C2:R802C3,2,FALSE) -> شیمیایی | D397: =VLOOKUP(RC[-2],Sheet1!R3C2:R802C9,8,FALSE) -> -1.3780343007915568 | E397: =IF(VLOOKUP(RC[-3],Sheet1!R3C2:R803C11,10,FALSE)=0,"",VLOOKUP(Sheet2!RC[-3],Sheet1!R[1]C[-3]:R[801]C[6],10,FALSE)) ->  | F397: =Sheet1!R488C10 -> 5.0300989663672855 | G397: =IF(RC[-3]<0,0,IF(AND(RC[-3]<RC[-1],RC[-3]<2),100,IF(AND(RC[-3]<RC[-1],RC[-3]>=2,RC[-3]<3),95,IF(AND(RC[-3]<RC[-1],RC[-3]>=3,RC[-3]<4),90,IF(AND(RC[-3]<RC[-1],RC[-3]>=4,RC[-3]<5),85,IF(AND(RC[-3]<RC[-1],RC[-3]>=5,RC[-3]<6),80,IF(AND(RC[-3]<RC[-1],RC[-3]>=6,RC[-3]<7),75,IF(AND(RC[-3]<RC[-1],RC[-3]>=7,RC[-3]<8),70,IF(AND(RC[-3]<RC[-1],RC[-3]>=8,RC[-3]<9),65,IF(AND(RC[-3]<RC[-1],RC[-3]>=9,RC[-3]<10),60,IF(AND(RC[-3]<RC[-1],RC[-3]>=10,RC[-3]<11),55,IF(AND(RC[-3]<RC[-1],RC[-3]>=11,RC[-3]<12),50,IF(AND(RC[-3]<RC[-1],RC[-3]>=12,RC[-3]<13),45,IF(AND(RC[-3]<RC[-1],RC[-3]>=13,RC[-3]<14),40,IF(AND(RC[-3]<RC[-1],RC[-3]>=14,RC[-3]<15),35,IF(AND(RC[-3]<RC[-1],RC[-3]>=15,RC[-3]<16),30,IF(AND(RC[-3]<RC[-1],RC[-3]>=16,RC[-3]<17),25,IF(AND(RC[-3]<RC[-1],RC[-3]>=17,RC[-3]<18),20,IF(AND(RC[-3]<RC[-1],RC[-3]>=18,RC[-3]<19),15,IF(AND(RC[-3]<RC[-1],RC[-3]>=19,RC[-3]<20),10,IF(AND(RC[-3]<RC[-1],RC[-3]>=20,RC[-3]<21),5,IF(AND(RC[-3]<RC[-1],RC[-3]>=21),0,IF(AND(RC[-3]>RC[-1],RC[-3]>=2,RC[-3]<3),90,IF(AND(RC[-3]>RC[-1],RC[-3]>=3,RC[-3]<4),90,IF(AND(RC[-3]>RC[-1],RC[-3]>=4,RC[-3]<5),80,IF(AND(RC[-3]>RC[-1],RC[-3]>=5,RC[-3]<6),70,IF(AND(RC[-3]>RC[-1],RC[-3]>=6,RC[-3]<7),60,IF(AND(RC[-3]>RC[-1],RC[-3]>=7,RC[-3]<8),50,IF(AND(RC[-3]>RC[-1],RC[-3]>=8,RC[-3]<9),40,IF(AND(RC[-3]>RC[-1],RC[-3]>=9,RC[-3]<10),30,IF(AND(RC[-3]>RC[-1],RC[-3]>=10,RC[-3]<11),20,IF(AND(RC[-3]>RC[-1],RC[-3]>=11,RC[-3]<12),10,IF(AND(RC[-3]>RC[-1],RC[-3]>=12),0))))))))))))))))))))))))))))))))) -> 0 | H397: =IF(RC[-3]="","",IF(RC[-3]<0.3,100,IF(AND(RC[-3]>=0.3,RC[-3]>0.4),95,IF(AND(RC[-3]>=0.4,RC[-3]<0.5),90,IF(AND(RC[-3]>=0.5,RC[-3]<0.6),85,IF(AND(RC[-3]>=0.6,RC[-3]<0.7),80,IF(AND(RC[-3]>=0.6,RC[-3]<1),80,IF(AND(RC[-3]>1,RC[-3]<2),50,IF(RC[-3]>2,0))))))))) ->  | I397: =IF(RC[-1]="",RC[-2],0.7*RC[-1]+0.3*RC[-2]) -> 0
A398: پتروشیمی ارومیه | B398: شاروم | C398: =VLOOKUP(RC[-1],Sheet1!R3C2:R802C3,2,FALSE) -> شیمیایی | D398: =VLOOKUP(RC[-2],Sheet1!R3C2:R802C9,8,FALSE) -> 5 | E398: =IF(VLOOKUP(RC[-3],Sheet1!R3C2:R803C11,10,FALSE)=0,"",VLOOKUP(Sheet2!RC[-3],Sheet1!R[1]C[-3]:R[801]C[6],10,FALSE)) ->  | F398: =Sheet1!R488C10 -> 5.0300989663672855 | G398: =IF(RC[-3]<0,0,IF(AND(RC[-3]<RC[-1],RC[-3]<2),100,IF(AND(RC[-3]<RC[-1],RC[-3]>=2,RC[-3]<3),95,IF(AND(RC[-3]<RC[-1],RC[-3]>=3,RC[-3]<4),90,IF(AND(RC[-3]<RC[-1],RC[-3]>=4,RC[-3]<5),85,IF(AND(RC[-3]<RC[-1],RC[-3]>=5,RC[-3]<6),80,IF(AND(RC[-3]<RC[-1],RC[-3]>=6,RC[-3]<7),75,IF(AND(RC[-3]<RC[-1],RC[-3]>=7,RC[-3]<8),70,IF(AND(RC[-3]<RC[-1],RC[-3]>=8,RC[-3]<9),65,IF(AND(RC[-3]<RC[-1],RC[-3]>=9,RC[-3]<10),60,IF(AND(RC[-3]<RC[-1],RC[-3]>=10,RC[-3]<11),55,IF(AND(RC[-3]<RC[-1],RC[-3]>=11,RC[-3]<12),50,IF(AND(RC[-3]<RC[-1],RC[-3]>=12,RC[-3]<13),45,IF(AND(RC[-3]<RC[-1],RC[-3]>=13,RC[-3]<14),40,IF(AND(RC[-3]<RC[-1],RC[-3]>=14,RC[-3]<15),35,IF(AND(RC[-3]<RC[-1],RC[-3]>=15,RC[-3]<16),30,IF(AND(RC[-3]<RC[-1],RC[-3]>=16,RC[-3]<17),25,IF(AND(RC[-3]<RC[-1],RC[-3]>=17,RC[-3]<18),20,IF(AND(RC[-3]<RC[-1],RC[-3]>=18,RC[-3]<19),15,IF(AND(RC[-3]<RC[-1],RC[-3]>=19,RC[-3]<20),10,IF(AND(RC[-3]<RC[-1],RC[-3]>=20,RC[-3]<21),5,IF(AND(RC[-3]<RC[-1],RC[-3]>=21),0,IF(AND(RC[-3]>RC[-1],RC[-3]>=2,RC[-3]<3),90,IF(AND(RC[-3]>RC[-1],RC[-3]>=3,RC[-3]<4),90,IF(AND(RC[-3]>RC[-1],RC[-3]>=4,RC[-3]<5),80,IF(AND(RC[-3]>RC[-1],RC[-3]>=5,RC[-3]<6),70,IF(AND(RC[-3]>RC[-1],RC[-3]>=6,RC[-3]<7),60,IF(AND(RC[-3]>RC[-1],RC[-3]>=7,RC[-3]<8),50,IF(AND(RC[-3]>RC[-1],RC[-3]>=8,RC[-3]<9),40,IF(AND(RC[-3]>RC[-1],RC[-3]>=9,RC[-3]<10),30,IF(AND(RC[-3]>RC[-1],RC[-3]>=10,RC[-3]<11),20,IF(AND(RC[-3]>RC[-1],RC[-3]>=11,RC[-3]<12),10,IF(AND(RC[-3]>RC[-1],RC[-3]>=12),0))))))))))))))))))))))))))))))))) -> 80 | H398: =IF(RC[-3]="","",IF(RC[-3]<0.3,100,IF(AND(RC[-3]>=0.3,RC[-3]>0.4),95,IF(AND(RC[-3]>=0.4,RC[-3]<0.5),90,IF(AND(RC[-3]>=0.5,RC[-3]<0.6),85,IF(AND(RC[-3]>=0.6,RC[-3]<0.7),80,IF(AND(RC[-3]>=0.6,RC[-3]<1),80,IF(AND(RC[-3]>1,RC[-3]<2),50,IF(RC[-3]>2,0))))))))) ->  | I398: =IF(RC[-1]="",RC[-2],0.7*RC[-1]+0.3*RC[-2]) -> 80
A399: پتروشیمی اصفهان | B399: شصفها | C399: =VLOOKUP(RC[-1],Sheet1!R3C2:R802C3,2,FALSE) -> شیمیایی | D399: =VLOOKUP(RC[-2],Sheet1!R3C2:R802C9,8,FALSE) -> 4.0999999999999996 | E399: =IF(VLOOKUP(RC[-3],Sheet1!R3C2:R803C11,10,FALSE)=0,"",VLOOKUP(Sheet2!RC[-3],Sheet1!R[1]C[-3]:R[801]C[6],10,FALSE)) ->  | F399: =Sheet1!R488C10 -> 5.0300989663672855 | G399: =IF(RC[-3]<0,0,IF(AND(RC[-3]<RC[-1],RC[-3]<2),100,IF(AND(RC[-3]<RC[-1],RC[-3]>=2,RC[-3]<3),95,IF(AND(RC[-3]<RC[-1],RC[-3]>=3,RC[-3]<4),90,IF(AND(RC[-3]<RC[-1],RC[-3]>=4,RC[-3]<5),85,IF(AND(RC[-3]<RC[-1],RC[-3]>=5,RC[-3]<6),80,IF(AND(RC[-3]<RC[-1],RC[-3]>=6,RC[-3]<7),75,IF(AND(RC[-3]<RC[-1],RC[-3]>=7,RC[-3]<8),70,IF(AND(RC[-3]<RC[-1],RC[-3]>=8,RC[-3]<9),65,IF(AND(RC[-3]<RC[-1],RC[-3]>=9,RC[-3]<10),60,IF(AND(RC[-3]<RC[-1],RC[-3]>=10,RC[-3]<11),55,IF(AND(RC[-3]<RC[-1],RC[-3]>=11,RC[-3]<12),50,IF(AND(RC[-3]<RC[-1],RC[-3]>=12,RC[-3]<13),45,IF(AND(RC[-3]<RC[-1],RC[-3]>=13,RC[-3]<14),40,IF(AND(RC[-3]<RC[-1],RC[-3]>=14,RC[-3]<15),35,IF(AND(RC[-3]<RC[-1],RC[-3]>=15,RC[-3]<16),30,IF(AND(RC[-3]<RC[-1],RC[-3]>=16,RC[-3]<17),25,IF(AND(RC[-3]<RC[-1],RC[-3]>=17,RC[-3]<18),20,IF(AND(RC[-3]<RC[-1],RC[-3]>=18,RC[-3]<19),15,IF(AND(RC[-3]<RC[-1],RC[-3]>=19,RC[-3]<20),10,IF(AND(RC[-3]<RC[-1],RC[-3]>=20,RC[-3]<21),5,IF(AND(RC[-3]<RC[-1],RC[-3]>=21),0,IF(AND(RC[-3]>RC[-1],RC[-3]>=2,RC[-3]<3),90,IF(AND(RC[-3]>RC[-1],RC[-3]>=3,RC[-3]<4),90,IF(AND(RC[-3]>RC[-1],RC[-3]>=4,RC[-3]<5),80,IF(AND(RC[-3]>RC[-1],RC[-3]>=5,RC[-3]<6),70,IF(AND(RC[-3]>RC[-1],RC[-3]>=6,RC[-3]<7),60,IF(AND(RC[-3]>RC[-1],RC[-3]>=7,RC[-3]<8),50,IF(AND(RC[-3]>RC[-1],RC[-3]>=8,RC[-3]<9),40,IF(AND(RC[-3]>RC[-1],RC[-3]>=9,RC[-3]<10),30,IF(AND(RC[-3]>RC[-1],RC[-3]>=10,RC[-3]<11),20,IF(AND(RC[-3]>RC[-1],RC[-3]>=11,RC[-3]<12),10,IF(AND(RC[-3]>RC[-1],RC[-3]>=12),0))))))))))))))))))))))))))))))))) -> 85 | H399: =IF(RC[-3]="","",IF(RC[-3]<0.3,100,IF(AND(RC[-3]>=0.3,RC[-3]>0.4),95,IF(AND(RC[-3]>=0.4,RC[-3]<0.5),90,IF(AND(RC[-3]>=0.5,RC[-3]<0.6),85,IF(AND(RC[-3]>=0.6,RC[-3]<0.7),80,IF(AND(RC[-3]>=0.6,RC[-3]<1),80,IF(AND(RC[-3]>1,RC[-3]<2),50,IF(RC[-3]>2,0))))))))) ->  | I399: =IF(RC[-1]="",RC[-2],0.7*RC[-1]+0.3*RC[-2]) -> 85
A400: پتروشیمی امیرکبیر | B400: شکبیر | C400: =VLOOKUP(RC[-1],Sheet1!R3C2:R802C3,2,FALSE) -> شیمیایی | D400: =VLOOKUP(RC[-2],Sheet1!R3C2:R802C9,8,FALSE) -> 4.8467698970171291 | E400: =IF(VLOOKUP(RC[-3],Sheet1!R3C2:R803C11,10,FALSE)=0,"",VLOOKUP(Sheet2!RC[-3],Sheet1!R[1]C[-3]:R[801]C[6],10,FALSE)) ->  | F400: =Sheet1!R488C10 -> 5.0300989663672855 | G400: =IF(RC[-3]<0,0,IF(AND(RC[-3]<RC[-1],RC[-3]<2),100,IF(AND(RC[-3]<RC[-1],RC[-3]>=2,RC[-3]<3),95,IF(AND(RC[-3]<RC[-1],RC[-3]>=3,RC[-3]<4),90,IF(AND(RC[-3]<RC[-1],RC[-3]>=4,RC[-3]<5),85,IF(AND(RC[-3]<RC[-1],RC[-3]>=5,RC[-3]<6),80,IF(AND(RC[-3]<RC[-1],RC[-3]>=6,RC[-3]<7),75,IF(AND(RC[-3]<RC[-1],RC[-3]>=7,RC[-3]<8),70,IF(AND(RC[-3]<RC[-1],RC[-3]>=8,RC[-3]<9),65,IF(AND(RC[-3]<RC[-1],RC[-3]>=9,RC[-3]<10),60,IF(AND(RC[-3]<RC[-1],RC[-3]>=10,RC[-3]<11),55,IF(AND(RC[-3]<RC[-1],RC[-3]>=11,RC[-3]<12),50,IF(AND(RC[-3]<RC[-1],RC[-3]>=12,RC[-3]<13),45,IF(AND(RC[-3]<RC[-1],RC[-3]>=13,RC[-3]<14),40,IF(AND(RC[-3]<RC[-1],RC[-3]>=14,RC[-3]<15),35,IF(AND(RC[-3]<RC[-1],RC[-3]>=15,RC[-3]<16),30,IF(AND(RC[-3]<RC[-1],RC[-3]>=16,RC[-3]<17),25,IF(AND(RC[-3]<RC[-1],RC[-3]>=17,RC[-3]<18),20,IF(AND(RC[-3]<RC[-1],RC[-3]>=18,RC[-3]<19),15,IF(AND(RC[-3]<RC[-1],RC[-3]>=19,RC[-3]<20),10,IF(AND(RC[-3]<RC[-1],RC[-3]>=20,RC[-3]<21),5,IF(AND(RC[-3]<RC[-1],RC[-3]>=21),0,IF(AND(RC[-3]>RC[-1],RC[-3]>=2,RC[-3]<3),90,IF(AND(RC[-3]>RC[-1],RC[-3]>=3,RC[-3]<4),90,IF(AND(RC[-3]>RC[-1],RC[-3]>=4,RC[-3]<5),80,IF(AND(RC[-3]>RC[-1],RC[-3]>=5,RC[-3]<6),70,IF(AND(RC[-3]>RC[-1],RC[-3]>=6,RC[-3]<7),60,IF(AND(RC[-3]>RC[-1],RC[-3]>=7,RC[-3]<8),50,IF(AND(RC[-3]>RC[-1],RC[-3]>=8,RC[-3]<9),40,IF(AND(RC[-3]>RC[-1],RC[-3]>=9,RC[-3]<10),30,IF(AND(RC[-3]>RC[-1],RC[-3]>=10,RC[-3]<11),20,IF(AND(RC[-3]>RC[-1],RC[-3]>=11,RC[-3]<12),10,IF(AND(RC[-3]>RC[-1],RC[-3]>=12),0))))))))))))))))))))))))))))))))) -> 85 | H400: =IF(RC[-3]="","",IF(RC[-3]<0.3,100,IF(AND(RC[-3]>=0.3,RC[-3]>0.4),95,IF(AND(RC[-3]>=0.4,RC[-3]<0.5),90,IF(AND(RC[-3]>=0.5,RC[-3]<0.6),85,IF(AND(RC[-3]>=0.6,RC[-3]<0.7),80,IF(AND(RC[-3]>=0.6,RC[-3]<1),80,IF(AND(RC[-3]>1,RC[-3]<2),50,IF(RC[-3]>2,0))))))))) ->  | I400: =IF(RC[-1]="",RC[-2],0.7*RC[-1]+0.3*RC[-2]) -> 85
A401: پتروشیمی بوعلی سینا | B401: بوعلی | C401: =VLOOKUP(RC[-1],Sheet1!R3C2:R802C3,2,FALSE) -> شیمیایی | D401: =VLOOKUP(RC[-2],Sheet1!R3C2:R802C9,8,FALSE) -> 6.3 | E401: =IF(VLOOKUP(RC[-3],Sheet1!R3C2:R803C11,10,FALSE)=0,"",VLOOKUP(Sheet2!RC[-3],Sheet1!R[1]C[-3]:R[801]C[6],10,FALSE)) ->  | F401: =Sheet1!R488C10 -> 5.0300989663672855 | G401: =IF(RC[-3]<0,0,IF(AND(RC[-3]<RC[-1],RC[-3]<2),100,IF(AND(RC[-3]<RC[-1],RC[-3]>=2,RC[-3]<3),95,IF(AND(RC[-3]<RC[-1],RC[-3]>=3,RC[-3]<4),90,IF(AND(RC[-3]<RC[-1],RC[-3]>=4,RC[-3]<5),85,IF(AND(RC[-3]<RC[-1],RC[-3]>=5,RC[-3]<6),80,IF(AND(RC[-3]<RC[-1],RC[-3]>=6,RC[-3]<7),75,IF(AND(RC[-3]<RC[-1],RC[-3]>=7,RC[-3]<8),70,IF(AND(RC[-3]<RC[-1],RC[-3]>=8,RC[-3]<9),65,IF(AND(RC[-3]<RC[-1],RC[-3]>=9,RC[-3]<10),60,IF(AND(RC[-3]<RC[-1],RC[-3]>=10,RC[-3]<11),55,IF(AND(RC[-3]<RC[-1],RC[-3]>=11,RC[-3]<12),50,IF(AND(RC[-3]<RC[-1],RC[-3]>=12,RC[-3]<13),45,IF(AND(RC[-3]<RC[-1],RC[-3]>=13,RC[-3]<14),40,IF(AND(RC[-3]<RC[-1],RC[-3]>=14,RC[-3]<15),35,IF(AND(RC[-3]<RC[-1],RC[-3]>=15,RC[-3]<16),30,IF(AND(RC[-3]<RC[-1],RC[-3]>=16,RC[-3]<17),25,IF(AND(RC[-3]<RC[-1],RC[-3]>=17,RC[-3]<18),20,IF(AND(RC[-3]<RC[-1],RC[-3]>=18,RC[-3]<19),15,IF(AND(RC[-3]<RC[-1],RC[-3]>=19,RC[-3]<20),10,IF(AND(RC[-3]<RC[-1],RC[-3]>=20,RC[-3]<21),5,IF(AND(RC[-3]<RC[-1],RC[-3]>=21),0,IF(AND(RC[-3]>RC[-1],RC[-3]>=2,RC[-3]<3),90,IF(AND(RC[-3]>RC[-1],RC[-3]>=3,RC[-3]<4),90,IF(AND(RC[-3]>RC[-1],RC[-3]>=4,RC[-3]<5),80,IF(AND(RC[-3]>RC[-1],RC[-3]>=5,RC[-3]<6),70,IF(AND(RC[-3]>RC[-1],RC[-3]>=6,RC[-3]<7),60,IF(AND(RC[-3]>RC[-1],RC[-3]>=7,RC[-3]<8),50,IF(AND(RC[-3]>RC[-1],RC[-3]>=8,RC[-3]<9),40,IF(AND(RC[-3]>RC[-1],RC[-3]>=9,RC[-3]<10),30,IF(AND(RC[-3]>RC[-1],RC[-3]>=10,RC[-3]<11),20,IF(AND(RC[-3]>RC[-1],RC[-3]>=11,RC[-3]<12),10,IF(AND(RC[-3]>RC[-1],RC[-3]>=12),0))))))))))))))))))))))))))))))))) -> 60 | H401: =IF(RC[-3]="","",IF(RC[-3]<0.3,100,IF(AND(RC[-3]>=0.3,RC[-3]>0.4),95,IF(AND(RC[-3]>=0.4,RC[-3]<0.5),90,IF(AND(RC[-3]>=0.5,RC[-3]<0.6),85,IF(AND(RC[-3]>=0.6,RC[-3]<0.7),80,IF(AND(RC[-3]>=0.6,RC[-3]<1),80,IF(AND(RC[-3]>1,RC[-3]<2),50,IF(RC[-3]>2,0))))))))) ->  | I401: =IF(RC[-1]="",RC[-2],0.7*RC[-1]+0.3*RC[-2]) -> 60
A402: پتروشیمی پارس | B402: پارس | C402: =VLOOKUP(RC[-1],Sheet1!R3C2:R802C3,2,FALSE) -> شیمیایی | D402: =VLOOKUP(RC[-2],Sheet1!R3C2:R802C9,8,FALSE) -> 4.705533222567448 | E402: =IF(VLOOKUP(RC[-3],Sheet1!R3C2:R803C11,10,FALSE)=0,"",VLOOKUP(Sheet2!RC[-3],Sheet1!R[1]C[-3]:R[801]C[6],10,FALSE)) ->  | F402: =Sheet1!R488C10 -> 5.0300989663672855 | G402: =IF(RC[-3]<0,0,IF(AND(RC[-3]<RC[-1],RC[-3]<2),100,IF(AND(RC[-3]<RC[-1],RC[-3]>=2,RC[-3]<3),95,IF(AND(RC[-3]<RC[-1],RC[-3]>=3,RC[-3]<4),90,IF(AND(RC[-3]<RC[-1],RC[-3]>=4,RC[-3]<5),85,IF(AND(RC[-3]<RC[-1],RC[-3]>=5,RC[-3]<6),80,IF(AND(RC[-3]<RC[-1],RC[-3]>=6,RC[-3]<7),75,IF(AND(RC[-3]<RC[-1],RC[-3]>=7,RC[-3]<8),70,IF(AND(RC[-3]<RC[-1],RC[-3]>=8,RC[-3]<9),65,IF(AND(RC[-3]<RC[-1],RC[-3]>=9,RC[-3]<10),60,IF(AND(RC[-3]<RC[-1],RC[-3]>=10,RC[-3]<11),55,IF(AND(RC[-3]<RC[-1],RC[-3]>=11,RC[-3]<12),50,IF(AND(RC[-3]<RC[-1],RC[-3]>=12,RC[-3]<13),45,IF(AND(RC[-3]<RC[-1],RC[-3]>=13,RC[-3]<14),40,IF(AND(RC[-3]<RC[-1],RC[-3]>=14,RC[-3]<15),35,IF(AND(RC[-3]<RC[-1],RC[-3]>=15,RC[-3]<16),30,IF(AND(RC[-3]<RC[-1],RC[-3]>=16,RC[-3]<17),25,IF(AND(RC[-3]<RC[-1],RC[-3]>=17,RC[-3]<18),20,IF(AND(RC[-3]<RC[-1],RC[-3]>=18,RC[-3]<19),15,IF(AND(RC[-3]<RC[-1],RC[-3]>=19,RC[-3]<20),10,IF(AND(RC[-3]<RC[-1],RC[-3]>=20,RC[-3]<21),5,IF(AND(RC[-3]<RC[-1],RC[-3]>=21),0,IF(AND(RC[-3]>RC[-1],RC[-3]>=2,RC[-3]<3),90,IF(AND(RC[-3]>RC[-1],RC[-3]>=3,RC[-3]<4),90,IF(AND(RC[-3]>RC[-1],RC[-3]>=4,RC[-3]<5),80,IF(AND(RC[-3]>RC[-1],RC[-3]>=5,RC[-3]<6),70,IF(AND(RC[-3]>RC[-1],RC[-3]>=6,RC[-3]<7),60,IF(AND(RC[-3]>RC[-1],RC[-3]>=7,RC[-3]<8),50,IF(AND(RC[-3]>RC[-1],RC[-3]>=8,RC[-3]<9),40,IF(AND(RC[-3]>RC[-1],RC[-3]>=9,RC[-3]<10),30,IF(AND(RC[-3]>RC[-1],RC[-3]>=10,RC[-3]<11),20,IF(AND(RC[-3]>RC[-1],RC[-3]>=11,RC[-3]<12),10,IF(AND(RC[-3]>RC[-1],RC[-3]>=12),0))))))))))))))))))))))))))))))))) -> 85 | H402: =IF(RC[-3]="","",IF(RC[-3]<0.3,100,IF(AND(RC[-3]>=0.3,RC[-3]>0.4),95,IF(AND(RC[-3]>=0.4,RC[-3]<0.5),90,IF(AND(RC[-3]>=0.5,RC[-3]<0.6),85,IF(AND(RC[-3]>=0.6,RC[-3]<0.7),80,IF(AND(RC[-3]>=0.6,RC[-3]<1),80,IF(AND(RC[-3]>1,RC[-3]<2),50,IF(RC[-3]>2,0))))))))) ->  | I402: =IF(RC[-1]="",RC[-2],0.7*RC[-1]+0.3*RC[-2]) -> 85
A403: پتروشیمی پردیس | B403: شپدیس | C403: =VLOOKUP(RC[-1],Sheet1!R3C2:R802C3,2,FALSE) -> شیمیایی | D403: =VLOOKUP(RC[-2],Sheet1!R3C2:R802C9,8,FALSE) -> 4.3 | E403: =IF(VLOOKUP(RC[-3],Sheet1!R3C2:R803C11,10,FALSE)=0,"",VLOOKUP(Sheet2!RC[-3],Sheet1!R[1]C[-3]:R[801]C[6],10,FALSE)) ->  | F403: =Sheet1!R488C10 -> 5.0300989663672855 | G403: =IF(RC[-3]<0,0,IF(AND(RC[-3]<RC[-1],RC[-3]<2),100,IF(AND(RC[-3]<RC[-1],RC[-3]>=2,RC[-3]<3),95,IF(AND(RC[-3]<RC[-1],RC[-3]>=3,RC[-3]<4),90,IF(AND(RC[-3]<RC[-1],RC[-3]>=4,RC[-3]<5),85,IF(AND(RC[-3]<RC[-1],RC[-3]>=5,RC[-3]<6),80,IF(AND(RC[-3]<RC[-1],RC[-3]>=6,RC[-3]<7),75,IF(AND(RC[-3]<RC[-1],RC[-3]>=7,RC[-3]<8),70,IF(AND(RC[-3]<RC[-1],RC[-3]>=8,RC[-3]<9),65,IF(AND(RC[-3]<RC[-1],RC[-3]>=9,RC[-3]<10),60,IF(AND(RC[-3]<RC[-1],RC[-3]>=10,RC[-3]<11),55,IF(AND(RC[-3]<RC[-1],RC[-3]>=11,RC[-3]<12),50,IF(AND(RC[-3]<RC[-1],RC[-3]>=12,RC[-3]<13),45,IF(AND(RC[-3]<RC[-1],RC[-3]>=13,RC[-3]<14),40,IF(AND(RC[-3]<RC[-1],RC[-3]>=14,RC[-3]<15),35,IF(AND(RC[-3]<RC[-1],RC[-3]>=15,RC[-3]<16),30,IF(AND(RC[-3]<RC[-1],RC[-3]>=16,RC[-3]<17),25,IF(AND(RC[-3]<RC[-1],RC[-3]>=17,RC[-3]<18),20,IF(AND(RC[-3]<RC[-1],RC[-3]>=18,RC[-3]<19),15,IF(AND(RC[-3]<RC[-1],RC[-3]>=19,RC[-3]<20),10,IF(AND(RC[-3]<RC[-1],RC[-3]>=20,RC[-3]<21),5,IF(AND(RC[-3]<RC[-1],RC[-3]>=21),0,IF(AND(RC[-3]>RC[-1],RC[-3]>=2,RC[-3]<3),90,IF(AND(RC[-3]>RC[-1],RC[-3]>=3,RC[-3]<4),90,IF(AND(RC[-3]>RC[-1],RC[-3]>=4,RC[-3]<5),80,IF(AND(RC[-3]>RC[-1],RC[-3]>=5,RC[-3]<6),70,IF(AND(RC[-3]>RC[-1],RC[-3]>=6,RC[-3]<7),60,IF(AND(RC[-3]>RC[-1],RC[-3]>=7,RC[-3]<8),50,IF(AND(RC[-3]>RC[-1],RC[-3]>=8,RC[-3]<9),40,IF(AND(RC[-3]>RC[-1],RC[-3]>=9,RC[-3]<10),30,IF(AND(RC[-3]>RC[-1],RC[-3]>=10,RC[-3]<11),20,IF(AND(RC[-3]>RC[-1],RC[-3]>=11,RC[-3]<12),10,IF(AND(RC[-3]>RC[-1],RC[-3]>=12),0))))))))))))))))))))))))))))))))) -> 85 | H403: =IF(RC[-3]="","",IF(RC[-3]<0.3,100,IF(AND(RC[-3]>=0.3,RC[-3]>0.4),95,IF(AND(RC[-3]>=0.4,RC[-3]<0.5),90,IF(AND(RC[-3]>=0.5,RC[-3]<0.6),85,IF(AND(RC[-3]>=0.6,RC[-3]<0.7),80,IF(AND(RC[-3]>=0.6,RC[-3]<1),80,IF(AND(RC[-3]>1,RC[-3]<2),50,IF(RC[-3]>2,0))))))))) ->  | I403: =IF(RC[-1]="",RC[-2],0.7*RC[-1]+0.3*RC[-2]) -> 85
A404: پتروشیمی تندگویان | B404: شگویا | C404: =VLOOKUP(RC[-1],Sheet1!R3C2:R802C3,2,FALSE) -> شیمیایی | D404: =VLOOKUP(RC[-2],Sheet1!R3C2:R802C9,8,FALSE) -> 5.739278052822133 | E404: =IF(VLOOKUP(RC[-3],Sheet1!R3C2:R803C11,10,FALSE)=0,"",VLOOKUP(Sheet2!RC[-3],Sheet1!R[1]C[-3]:R[801]C[6],10,FALSE)) ->  | F404: =Sheet1!R488C10 -> 5.0300989663672855 | G404: =IF(RC[-3]<0,0,IF(AND(RC[-3]<RC[-1],RC[-3]<2),100,IF(AND(RC[-3]<RC[-1],RC[-3]>=2,RC[-3]<3),95,IF(AND(RC[-3]<RC[-1],RC[-3]>=3,RC[-3]<4),90,IF(AND(RC[-3]<RC[-1],RC[-3]>=4,RC[-3]<5),85,IF(AND(RC[-3]<RC[-1],RC[-3]>=5,RC[-3]<6),80,IF(AND(RC[-3]<RC[-1],RC[-3]>=6,RC[-3]<7),75,IF(AND(RC[-3]<RC[-1],RC[-3]>=7,RC[-3]<8),70,IF(AND(RC[-3]<RC[-1],RC[-3]>=8,RC[-3]<9),65,IF(AND(RC[-3]<RC[-1],RC[-3]>=9,RC[-3]<10),60,IF(AND(RC[-3]<RC[-1],RC[-3]>=10,RC[-3]<11),55,IF(AND(RC[-3]<RC[-1],RC[-3]>=11,RC[-3]<12),50,IF(AND(RC[-3]<RC[-1],RC[-3]>=12,RC[-3]<13),45,IF(AND(RC[-3]<RC[-1],RC[-3]>=13,RC[-3]<14),40,IF(AND(RC[-3]<RC[-1],RC[-3]>=14,RC[-3]<15),35,IF(AND(RC[-3]<RC[-1],RC[-3]>=15,RC[-3]<16),30,IF(AND(RC[-3]<RC[-1],RC[-3]>=16,RC[-3]<17),25,IF(AND(RC[-3]<RC[-1],RC[-3]>=17,RC[-3]<18),20,IF(AND(RC[-3]<RC[-1],RC[-3]>=18,RC[-3]<19),15,IF(AND(RC[-3]<RC[-1],RC[-3]>=19,RC[-3]<20),10,IF(AND(RC[-3]<RC[-1],RC[-3]>=20,RC[-3]<21),5,IF(AND(RC[-3]<RC[-1],RC[-3]>=21),0,IF(AND(RC[-3]>RC[-1],RC[-3]>=2,RC[-3]<3),90,IF(AND(RC[-3]>RC[-1],RC[-3]>=3,RC[-3]<4),90,IF(AND(RC[-3]>RC[-1],RC[-3]>=4,RC[-3]<5),80,IF(AND(RC[-3]>RC[-1],RC[-3]>=5,RC[-3]<6),70,IF(AND(RC[-3]>RC[-1],RC[-3]>=6,RC[-3]<7),60,IF(AND(RC[-3]>RC[-1],RC[-3]>=7,RC[-3]<8),50,IF(AND(RC[-3]>RC[-1],RC[-3]>=8,RC[-3]<9),40,IF(AND(RC[-3]>RC[-1],RC[-3]>=9,RC[-3]<10),30,IF(AND(RC[-3]>RC[-1],RC[-3]>=10,RC[-3]<11),20,IF(AND(RC[-3]>RC[-1],RC[-3]>=11,RC[-3]<12),10,IF(AND(RC[-3]>RC[-1],RC[-3]>=12),0))))))))))))))))))))))))))))))))) -> 70 | H404: =IF(RC[-3]="","",IF(RC[-3]<0.3,100,IF(AND(RC[-3]>=0.3,RC[-3]>0.4),95,IF(AND(RC[-3]>=0.4,RC[-3]<0.5),90,IF(AND(RC[-3]>=0.5,RC[-3]<0.6),85,IF(AND(RC[-3]>=0.6,RC[-3]<0.7),80,IF(AND(RC[-3]>=0.6,RC[-3]<1),80,IF(AND(RC[-3]>1,RC[-3]<2),50,IF(RC[-3]>2,0))))))))) ->  | I404: =IF(RC[-1]="",RC[-2],0.7*RC[-1]+0.3*RC[-2]) -> 70
A405: پتروشیمی جم | B405: جم | C405: =VLOOKUP(RC[-1],Sheet1!R3C2:R802C3,2,FALSE) -> شیمیایی | D405: =VLOOKUP(RC[-2],Sheet1!R3C2:R802C9,8,FALSE) -> 4.7227377704148834 | E405: =IF(VLOOKUP(RC[-3],Sheet1!R3C2:R803C11,10,FALSE)=0,"",VLOOKUP(Sheet2!RC[-3],Sheet1!R[1]C[-3]:R[801]C[6],10,FALSE)) ->  | F405: =Sheet1!R488C10 -> 5.0300989663672855 | G405: =IF(RC[-3]<0,0,IF(AND(RC[-3]<RC[-1],RC[-3]<2),100,IF(AND(RC[-3]<RC[-1],RC[-3]>=2,RC[-3]<3),95,IF(AND(RC[-3]<RC[-1],RC[-3]>=3,RC[-3]<4),90,IF(AND(RC[-3]<RC[-1],RC[-3]>=4,RC[-3]<5),85,IF(AND(RC[-3]<RC[-1],RC[-3]>=5,RC[-3]<6),80,IF(AND(RC[-3]<RC[-1],RC[-3]>=6,RC[-3]<7),75,IF(AND(RC[-3]<RC[-1],RC[-3]>=7,RC[-3]<8),70,IF(AND(RC[-3]<RC[-1],RC[-3]>=8,RC[-3]<9),65,IF(AND(RC[-3]<RC[-1],RC[-3]>=9,RC[-3]<10),60,IF(AND(RC[-3]<RC[-1],RC[-3]>=10,RC[-3]<11),55,IF(AND(RC[-3]<RC[-1],RC[-3]>=11,RC[-3]<12),50,IF(AND(RC[-3]<RC[-1],RC[-3]>=12,RC[-3]<13),45,IF(AND(RC[-3]<RC[-1],RC[-3]>=13,RC[-3]<14),40,IF(AND(RC[-3]<RC[-1],RC[-3]>=14,RC[-3]<15),35,IF(AND(RC[-3]<RC[-1],RC[-3]>=15,RC[-3]<16),30,IF(AND(RC[-3]<RC[-1],RC[-3]>=16,RC[-3]<17),25,IF(AND(RC[-3]<RC[-1],RC[-3]>=17,RC[-3]<18),20,IF(AND(RC[-3]<RC[-1],RC[-3]>=18,RC[-3]<19),15,IF(AND(RC[-3]<RC[-1],RC[-3]>=19,RC[-3]<20),10,IF(AND(RC[-3]<RC[-1],RC[-3]>=20,RC[-3]<21),5,IF(AND(RC[-3]<RC[-1],RC[-3]>=21),0,IF(AND(RC[-3]>RC[-1],RC[-3]>=2,RC[-3]<3),90,IF(AND(RC[-3]>RC[-1],RC[-3]>=3,RC[-3]<4),90,IF(AND(RC[-3]>RC[-1],RC[-3]>=4,RC[-3]<5),80,IF(AND(RC[-3]>RC[-1],RC[-3]>=5,RC[-3]<6),70,IF(AND(RC[-3]>RC[-1],RC[-3]>=6,RC[-3]<7),60,IF(AND(RC[-3]>RC[-1],RC[-3]>=7,RC[-3]<8),50,IF(AND(RC[-3]>RC[-1],RC[-3]>=8,RC[-3]<9),40,IF(AND(RC[-3]>RC[-1],RC[-3]>=9,RC[-3]<10),30,IF(AND(RC[-3]>RC[-1],RC[-3]>=10,RC[-3]<11),20,IF(AND(RC[-3]>RC[-1],RC[-3]>=11,RC[-3]<12),10,IF(AND(RC[-3]>RC[-1],RC[-3]>=12),0))))))))))))))))))))))))))))))))) -> 85 | H405: =IF(RC[-3]="","",IF(RC[-3]<0.3,100,IF(AND(RC[-3]>=0.3,RC[-3]>0.4),95,IF(AND(RC[-3]>=0.4,RC[-3]<0.5),90,IF(AND(RC[-3]>=0.5,RC[-3]<0.6),85,IF(AND(RC[-3]>=0.6,RC[-3]<0.7),80,IF(AND(RC[-3]>=0.6,RC[-3]<1),80,IF(AND(RC[-3]>1,RC[-3]<2),50,IF(RC[-3]>2,0))))))))) ->  | I405: =IF(RC[-1]="",RC[-2],0.7*RC[-1]+0.3*RC[-2]) -> 85
A406: پتروشیمی جهرم | B406: جهرم | C406: =VLOOKUP(RC[-1],Sheet1!R3C2:R802C3,2,FALSE) -> شیمیایی | D406: =VLOOKUP(RC[-2],Sheet1!R3C2:R802C9,8,FALSE) -> 23.709306776934998 | E406: =IF(VLOOKUP(RC[-3],Sheet1!R3C2:R803C11,10,FALSE)=0,"",VLOOKUP(Sheet2!RC[-3],Sheet1!R[1]C[-3]:R[801]C[6],10,FALSE)) ->  | F406: =Sheet1!R488C10 -> 5.0300989663672855 | G406: =IF(RC[-3]<0,0,IF(AND(RC[-3]<RC[-1],RC[-3]<2),100,IF(AND(RC[-3]<RC[-1],RC[-3]>=2,RC[-3]<3),95,IF(AND(RC[-3]<RC[-1],RC[-3]>=3,RC[-3]<4),90,IF(AND(RC[-3]<RC[-1],RC[-3]>=4,RC[-3]<5),85,IF(AND(RC[-3]<RC[-1],RC[-3]>=5,RC[-3]<6),80,IF(AND(RC[-3]<RC[-1],RC[-3]>=6,RC[-3]<7),75,IF(AND(RC[-3]<RC[-1],RC[-3]>=7,RC[-3]<8),70,IF(AND(RC[-3]<RC[-1],RC[-3]>=8,RC[-3]<9),65,IF(AND(RC[-3]<RC[-1],RC[-3]>=9,RC[-3]<10),60,IF(AND(RC[-3]<RC[-1],RC[-3]>=10,RC[-3]<11),55,IF(AND(RC[-3]<RC[-1],RC[-3]>=11,RC[-3]<12),50,IF(AND(RC[-3]<RC[-1],RC[-3]>=12,RC[-3]<13),45,IF(AND(RC[-3]<RC[-1],RC[-3]>=13,RC[-3]<14),40,IF(AND(RC[-3]<RC[-1],RC[-3]>=14,RC[-3]<15),35,IF(AND(RC[-3]<RC[-1],RC[-3]>=15,RC[-3]<16),30,IF(AND(RC[-3]<RC[-1],RC[-3]>=16,RC[-3]<17),25,IF(AND(RC[-3]<RC[-1],RC[-3]>=17,RC[-3]<18),20,IF(AND(RC[-3]<RC[-1],RC[-3]>=18,RC[-3]<19),15,IF(AND(RC[-3]<RC[-1],RC[-3]>=19,RC[-3]<20),10,IF(AND(RC[-3]<RC[-1],RC[-3]>=20,RC[-3]<21),5,IF(AND(RC[-3]<RC[-1],RC[-3]>=21),0,IF(AND(RC[-3]>RC[-1],RC[-3]>=2,RC[-3]<3),90,IF(AND(RC[-3]>RC[-1],RC[-3]>=3,RC[-3]<4),90,IF(AND(RC[-3]>RC[-1],RC[-3]>=4,RC[-3]<5),80,IF(AND(RC[-3]>RC[-1],RC[-3]>=5,RC[-3]<6),70,IF(AND(RC[-3]>RC[-1],RC[-3]>=6,RC[-3]<7),60,IF(AND(RC[-3]>RC[-1],RC[-3]>=7,RC[-3]<8),50,IF(AND(RC[-3]>RC[-1],RC[-3]>=8,RC[-3]<9),40,IF(AND(RC[-3]>RC[-1],RC[-3]>=9,RC[-3]<10),30,IF(AND(RC[-3]>RC[-1],RC[-3]>=10,RC[-3]<11),20,IF(AND(RC[-3]>RC[-1],RC[-3]>=11,RC[-3]<12),10,IF(AND(RC[-3]>RC[-1],RC[-3]>=12),0))))))))))))))))))))))))))))))))) -> 0 | H406: =IF(RC[-3]="","",IF(RC[-3]<0.3,100,IF(AND(RC[-3]>=0.3,RC[-3]>0.4),95,IF(AND(RC[-3]>=0.4,RC[-3]<0.5),90,IF(AND(RC[-3]>=0.5,RC[-3]<0.6),85,IF(AND(RC[-3]>=0.6,RC[-3]<0.7),80,IF(AND(RC[-3]>=0.6,RC[-3]<1),80,IF(AND(RC[-3]>1,RC[-3]<2),50,IF(RC[-3]>2,0))))))))) ->  | I406: =IF(RC[-1]="",RC[-2],0.7*RC[-1]+0.3*RC[-2]) -> 0
A407: پتروشیمی خارک | B407: شخارک | C407: =VLOOKUP(RC[-1],Sheet1!R3C2:R802C3,2,FALSE) -> شیمیایی | D407: =VLOOKUP(RC[-2],Sheet1!R3C2:R802C9,8,FALSE) -> 6.1742987523092072 | E407: =IF(VLOOKUP(RC[-3],Sheet1!R3C2:R803C11,10,FALSE)=0,"",VLOOKUP(Sheet2!RC[-3],Sheet1!R[1]C[-3]:R[801]C[6],10,FALSE)) ->  | F407: =Sheet1!R488C10 -> 5.0300989663672855 | G407: =IF(RC[-3]<0,0,IF(AND(RC[-3]<RC[-1],RC[-3]<2),100,IF(AND(RC[-3]<RC[-1],RC[-3]>=2,RC[-3]<3),95,IF(AND(RC[-3]<RC[-1],RC[-3]>=3,RC[-3]<4),90,IF(AND(RC[-3]<RC[-1],RC[-3]>=4,RC[-3]<5),85,IF(AND(RC[-3]<RC[-1],RC[-3]>=5,RC[-3]<6),80,IF(AND(RC[-3]<RC[-1],RC[-3]>=6,RC[-3]<7),75,IF(AND(RC[-3]<RC[-1],RC[-3]>=7,RC[-3]<8),70,IF(AND(RC[-3]<RC[-1],RC[-3]>=8,RC[-3]<9),65,IF(AND(RC[-3]<RC[-1],RC[-3]>=9,RC[-3]<10),60,IF(AND(RC[-3]<RC[-1],RC[-3]>=10,RC[-3]<11),55,IF(AND(RC[-3]<RC[-1],RC[-3]>=11,RC[-3]<12),50,IF(AND(RC[-3]<RC[-1],RC[-3]>=12,RC[-3]<13),45,IF(AND(RC[-3]<RC[-1],RC[-3]>=13,RC[-3]<14),40,IF(AND(RC[-3]<RC[-1],RC[-3]>=14,RC[-3]<15),35,IF(AND(RC[-3]<RC[-1],RC[-3]>=15,RC[-3]<16),30,IF(AND(RC[-3]<RC[-1],RC[-3]>=16,RC[-3]<17),25,IF(AND(RC[-3]<RC[-1],RC[-3]>=17,RC[-3]<18),20,IF(AND(RC[-3]<RC[-1],RC[-3]>=18,RC[-3]<19),15,IF(AND(RC[-3]<RC[-1],RC[-3]>=19,RC[-3]<20),10,IF(AND(RC[-3]<RC[-1],RC[-3]>=20,RC[-3]<21),5,IF(AND(RC[-3]<RC[-1],RC[-3]>=21),0,IF(AND(RC[-3]>RC[-1],RC[-3]>=2,RC[-3]<3),90,IF(AND(RC[-3]>RC[-1],RC[-3]>=3,RC[-3]<4),90,IF(AND(RC[-3]>RC[-1],RC[-3]>=4,RC[-3]<5),80,IF(AND(RC[-3]>RC[-1],RC[-3]>=5,RC[-3]<6),70,IF(AND(RC[-3]>RC[-1],RC[-3]>=6,RC[-3]<7),60,IF(AND(RC[-3]>RC[-1],RC[-3]>=7,RC[-3]<8),50,IF(AND(RC[-3]>RC[-1],RC[-3]>=8,RC[-3]<9),40,IF(AND(RC[-3]>RC[-1],RC[-3]>=9,RC[-3]<10),30,IF(AND(RC[-3]>RC[-1],RC[-3]>=10,RC[-3]<11),20,IF(AND(RC[-3]>RC[-1],RC[-3]>=11,RC[-3]<12),10,IF(AND(RC[-3]>RC[-1],RC[-3]>=12),0))))))))))))))))))))))))))))))))) -> 60 | H407: =IF(RC[-3]="","",IF(RC[-3]<0.3,100,IF(AND(RC[-3]>=0.3,RC[-3]>0.4),95,IF(AND(RC[-3]>=0.4,RC[-3]<0.5),90,IF(AND(RC[-3]>=0.5,RC[-3]<0.6),85,IF(AND(RC[-3]>=0.6,RC[-3]<0.7),80,IF(AND(RC[-3]>=0.6,RC[-3]<1),80,IF(AND(RC[-3]>1,RC[-3]<2),50,IF(RC[-3]>2,0))))))))) ->  | I407: =IF(RC[-1]="",RC[-2],0.7*RC[-1]+0.3*RC[-2]) -> 60
A408: پتروشیمی خراسان | B408: خراسان | C408: =VLOOKUP(RC[-1],Sheet1!R3C2:R802C3,2,FALSE) -> شیمیایی | D408: =VLOOKUP(RC[-2],Sheet1!R3C2:R802C9,8,FALSE) -> 3.4476549702992285 | E408: =IF(VLOOKUP(RC[-3],Sheet1!R3C2:R803C11,10,FALSE)=0,"",VLOOKUP(Sheet2!RC[-3],Sheet1!R[1]C[-3]:R[801]C[6],10,FALSE)) ->  | F408: =Sheet1!R488C10 -> 5.0300989663672855 | G408: =IF(RC[-3]<0,0,IF(AND(RC[-3]<RC[-1],RC[-3]<2),100,IF(AND(RC[-3]<RC[-1],RC[-3]>=2,RC[-3]<3),95,IF(AND(RC[-3]<RC[-1],RC[-3]>=3,RC[-3]<4),90,IF(AND(RC[-3]<RC[-1],RC[-3]>=4,RC[-3]<5),85,IF(AND(RC[-3]<RC[-1],RC[-3]>=5,RC[-3]<6),80,IF(AND(RC[-3]<RC[-1],RC[-3]>=6,RC[-3]<7),75,IF(AND(RC[-3]<RC[-1],RC[-3]>=7,RC[-3]<8),70,IF(AND(RC[-3]<RC[-1],RC[-3]>=8,RC[-3]<9),65,IF(AND(RC[-3]<RC[-1],RC[-3]>=9,RC[-3]<10),60,IF(AND(RC[-3]<RC[-1],RC[-3]>=10,RC[-3]<11),55,IF(AND(RC[-3]<RC[-1],RC[-3]>=11,RC[-3]<12),50,IF(AND(RC[-3]<RC[-1],RC[-3]>=12,RC[-3]<13),45,IF(AND(RC[-3]<RC[-1],RC[-3]>=13,RC[-3]<14),40,IF(AND(RC[-3]<RC[-1],RC[-3]>=14,RC[-3]<15),35,IF(AND(RC[-3]<RC[-1],RC[-3]>=15,RC[-3]<16),30,IF(AND(RC[-3]<RC[-1],RC[-3]>=16,RC[-3]<17),25,IF(AND(RC[-3]<RC[-1],RC[-3]>=17,RC[-3]<18),20,IF(AND(RC[-3]<RC[-1],RC[-3]>=18,RC[-3]<19),15,IF(AND(RC[-3]<RC[-1],RC[-3]>=19,RC[-3]<20),10,IF(AND(RC[-3]<RC[-1],RC[-3]>=20,RC[-3]<21),5,IF(AND(RC[-3]<RC[-1],RC[-3]>=21),0,IF(AND(RC[-3]>RC[-1],RC[-3]>=2,RC[-3]<3),90,IF(AND(RC[-3]>RC[-1],RC[-3]>=3,RC[-3]<4),90,IF(AND(RC[-3]>RC[-1],RC[-3]>=4,RC[-3]<5),80,IF(AND(RC[-3]>RC[-1],RC[-3]>=5,RC[-3]<6),70,IF(AND(RC[-3]>RC[-1],RC[-3]>=6,RC[-3]<7),60,IF(AND(RC[-3]>RC[-1],RC[-3]>=7,RC[-3]<8),50,IF(AND(RC[-3]>RC[-1],RC[-3]>=8,RC[-3]<9),40,IF(AND(RC[-3]>RC[-1],RC[-3]>=9,RC[-3]<10),30,IF(AND(RC[-3]>RC[-1],RC[-3]>=10,RC[-3]<11),20,IF(AND(RC[-3]>RC[-1],RC[-3]>=11,RC[-3]<12),10,IF(AND(RC[-3]>RC[-1],RC[-3]>=12),0))))))))))))))))))))))))))))))))) -> 90 | H408: =IF(RC[-3]="","",IF(RC[-3]<0.3,100,IF(AND(RC[-3]>=0.3,RC[-3]>0.4),95,IF(AND(RC[-3]>=0.4,RC[-3]<0.5),90,IF(AND(RC[-3]>=0.5,RC[-3]<0.6),85,IF(AND(RC[-3]>=0.6,RC[-3]<0.7),80,IF(AND(RC[-3]>=0.6,RC[-3]<1),80,IF(AND(RC[-3]>1,RC[-3]<2),50,IF(RC[-3]>2,0))))))))) ->  | I408: =IF(RC[-1]="",RC[-2],0.7*RC[-1]+0.3*RC[-2]) -> 90
A409: پتروشیمی داراب | B409: داراب | C409: =VLOOKUP(RC[-1],Sheet1!R3C2:R802C3,2,FALSE) -> شیمیایی | D409: =VLOOKUP(RC[-2],Sheet1!R3C2:R802C9,8,FALSE) -> 25.596792354011665 | E409: =IF(VLOOKUP(RC[-3],Sheet1!R3C2:R803C11,10,FALSE)=0,"",VLOOKUP(Sheet2!RC[-3],Sheet1!R[1]C[-3]:R[801]C[6],10,FALSE)) ->  | F409: =Sheet1!R488C10 -> 5.0300989663672855 | G409: =IF(RC[-3]<0,0,IF(AND(RC[-3]<RC[-1],RC[-3]<2),100,IF(AND(RC[-3]<RC[-1],RC[-3]>=2,RC[-3]<3),95,IF(AND(RC[-3]<RC[-1],RC[-3]>=3,RC[-3]<4),90,IF(AND(RC[-3]<RC[-1],RC[-3]>=4,RC[-3]<5),85,IF(AND(RC[-3]<RC[-1],RC[-3]>=5,RC[-3]<6),80,IF(AND(RC[-3]<RC[-1],RC[-3]>=6,RC[-3]<7),75,IF(AND(RC[-3]<RC[-1],RC[-3]>=7,RC[-3]<8),70,IF(AND(RC[-3]<RC[-1],RC[-3]>=8,RC[-3]<9),65,IF(AND(RC[-3]<RC[-1],RC[-3]>=9,RC[-3]<10),60,IF(AND(RC[-3]<RC[-1],RC[-3]>=10,RC[-3]<11),55,IF(AND(RC[-3]<RC[-1],RC[-3]>=11,RC[-3]<12),50,IF(AND(RC[-3]<RC[-1],RC[-3]>=12,RC[-3]<13),45,IF(AND(RC[-3]<RC[-1],RC[-3]>=13,RC[-3]<14),40,IF(AND(RC[-3]<RC[-1],RC[-3]>=14,RC[-3]<15),35,IF(AND(RC[-3]<RC[-1],RC[-3]>=15,RC[-3]<16),30,IF(AND(RC[-3]<RC[-1],RC[-3]>=16,RC[-3]<17),25,IF(AND(RC[-3]<RC[-1],RC[-3]>=17,RC[-3]<18),20,IF(AND(RC[-3]<RC[-1],RC[-3]>=18,RC[-3]<19),15,IF(AND(RC[-3]<RC[-1],RC[-3]>=19,RC[-3]<20),10,IF(AND(RC[-3]<RC[-1],RC[-3]>=20,RC[-3]<21),5,IF(AND(RC[-3]<RC[-1],RC[-3]>=21),0,IF(AND(RC[-3]>RC[-1],RC[-3]>=2,RC[-3]<3),90,IF(AND(RC[-3]>RC[-1],RC[-3]>=3,RC[-3]<4),90,IF(AND(RC[-3]>RC[-1],RC[-3]>=4,RC[-3]<5),80,IF(AND(RC[-3]>RC[-1],RC[-3]>=5,RC[-3]<6),70,IF(AND(RC[-3]>RC[-1],RC[-3]>=6,RC[-3]<7),60,IF(AND(RC[-3]>RC[-1],RC[-3]>=7,RC[-3]<8),50,IF(AND(RC[-3]>RC[-1],RC[-3]>=8,RC[-3]<9),40,IF(AND(RC[-3]>RC[-1],RC[-3]>=9,RC[-3]<10),30,IF(AND(RC[-3]>RC[-1],RC[-3]>=10,RC[-3]<11),20,IF(AND(RC[-3]>RC[-1],RC[-3]>=11,RC[-3]<12),10,IF(AND(RC[-3]>RC[-1],RC[-3]>=12),0))))))))))))))))))))))))))))))))) -> 0 | H409: =IF(RC[-3]="","",IF(RC[-3]<0.3,100,IF(AND(RC[-3]>=0.3,RC[-3]>0.4),95,IF(AND(RC[-3]>=0.4,RC[-3]<0.5),90,IF(AND(RC[-3]>=0.5,RC[-3]<0.6),85,IF(AND(RC[-3]>=0.6,RC[-3]<0.7),80,IF(AND(RC[-3]>=0.6,RC[-3]<1),80,IF(AND(RC[-3]>1,RC[-3]<2),50,IF(RC[-3]>2,0))))))))) ->  | I409: =IF(RC[-1]="",RC[-2],0.7*RC[-1]+0.3*RC[-2]) -> 0
A410: پتروشیمی زاگرس | B410: زاگرس | C410: =VLOOKUP(RC[-1],Sheet1!R3C2:R802C3,2,FALSE) -> شیمیایی | D410: =VLOOKUP(RC[-2],Sheet1!R3C2:R802C9,8,FALSE) -> 5.6 | E410: =IF(VLOOKUP(RC[-3],Sheet1!R3C2:R803C11,10,FALSE)=0,"",VLOOKUP(Sheet2!RC[-3],Sheet1!R[1]C[-3]:R[801]C[6],10,FALSE)) ->  | F410: =Sheet1!R488C10 -> 5.0300989663672855 | G410: =IF(RC[-3]<0,0,IF(AND(RC[-3]<RC[-1],RC[-3]<2),100,IF(AND(RC[-3]<RC[-1],RC[-3]>=2,RC[-3]<3),95,IF(AND(RC[-3]<RC[-1],RC[-3]>=3,RC[-3]<4),90,IF(AND(RC[-3]<RC[-1],RC[-3]>=4,RC[-3]<5),85,IF(AND(RC[-3]<RC[-1],RC[-3]>=5,RC[-3]<6),80,IF(AND(RC[-3]<RC[-1],RC[-3]>=6,RC[-3]<7),75,IF(AND(RC[-3]<RC[-1],RC[-3]>=7,RC[-3]<8),70,IF(AND(RC[-3]<RC[-1],RC[-3]>=8,RC[-3]<9),65,IF(AND(RC[-3]<RC[-1],RC[-3]>=9,RC[-3]<10),60,IF(AND(RC[-3]<RC[-1],RC[-3]>=10,RC[-3]<11),55,IF(AND(RC[-3]<RC[-1],RC[-3]>=11,RC[-3]<12),50,IF(AND(RC[-3]<RC[-1],RC[-3]>=12,RC[-3]<13),45,IF(AND(RC[-3]<RC[-1],RC[-3]>=13,RC[-3]<14),40,IF(AND(RC[-3]<RC[-1],RC[-3]>=14,RC[-3]<15),35,IF(AND(RC[-3]<RC[-1],RC[-3]>=15,RC[-3]<16),30,IF(AND(RC[-3]<RC[-1],RC[-3]>=16,RC[-3]<17),25,IF(AND(RC[-3]<RC[-1],RC[-3]>=17,RC[-3]<18),20,IF(AND(RC[-3]<RC[-1],RC[-3]>=18,RC[-3]<19),15,IF(AND(RC[-3]<RC[-1],RC[-3]>=19,RC[-3]<20),10,IF(AND(RC[-3]<RC[-1],RC[-3]>=20,RC[-3]<21),5,IF(AND(RC[-3]<RC[-1],RC[-3]>=21),0,IF(AND(RC[-3]>RC[-1],RC[-3]>=2,RC[-3]<3),90,IF(AND(RC[-3]>RC[-1],RC[-3]>=3,RC[-3]<4),90,IF(AND(RC[-3]>RC[-1],RC[-3]>=4,RC[-3]<5),80,IF(AND(RC[-3]>RC[-1],RC[-3]>=5,RC[-3]<6),70,IF(AND(RC[-3]>RC[-1],RC[-3]>=6,RC[-3]<7),60,IF(AND(RC[-3]>RC[-1],RC[-3]>=7,RC[-3]<8),50,IF(AND(RC[-3]>RC[-1],RC[-3]>=8,RC[-3]<9),40,IF(AND(RC[-3]>RC[-1],RC[-3]>=9,RC[-3]<10),30,IF(AND(RC[-3]>RC[-1],RC[-3]>=10,RC[-3]<11),20,IF(AND(RC[-3]>RC[-1],RC[-3]>=11,RC[-3]<12),10,IF(AND(RC[-3]>RC[-1],RC[-3]>=12),0))))))))))))))))))))))))))))))))) -> 70 | H410: =IF(RC[-3]="","",IF(RC[-3]<0.3,100,IF(AND(RC[-3]>=0.3,RC[-3]>0.4),95,IF(AND(RC[-3]>=0.4,RC[-3]<0.5),90,IF(AND(RC[-3]>=0.5,RC[-3]<0.6),85,IF(AND(RC[-3]>=0.6,RC[-3]<0.7),80,IF(AND(RC[-3]>=0.6,RC[-3]<1),80,IF(AND(RC[-3]>1,RC[-3]<2),50,IF(RC[-3]>2,0))))))))) ->  | I410: =IF(RC[-1]="",RC[-2],0.7*RC[-1]+0.3*RC[-2]) -> 70
A411: پتروشیمی شازند | B411: شاراک | C411: =VLOOKUP(RC[-1],Sheet1!R3C2:R802C3,2,FALSE) -> شیمیایی | D411: =VLOOKUP(RC[-2],Sheet1!R3C2:R802C9,8,FALSE) -> 3.7383079437734721 | E411: =IF(VLOOKUP(RC[-3],Sheet1!R3C2:R803C11,10,FALSE)=0,"",VLOOKUP(Sheet2!RC[-3],Sheet1!R[1]C[-3]:R[801]C[6],10,FALSE)) ->  | F411: =Sheet1!R488C10 -> 5.0300989663672855 | G411: =IF(RC[-3]<0,0,IF(AND(RC[-3]<RC[-1],RC[-3]<2),100,IF(AND(RC[-3]<RC[-1],RC[-3]>=2,RC[-3]<3),95,IF(AND(RC[-3]<RC[-1],RC[-3]>=3,RC[-3]<4),90,IF(AND(RC[-3]<RC[-1],RC[-3]>=4,RC[-3]<5),85,IF(AND(RC[-3]<RC[-1],RC[-3]>=5,RC[-3]<6),80,IF(AND(RC[-3]<RC[-1],RC[-3]>=6,RC[-3]<7),75,IF(AND(RC[-3]<RC[-1],RC[-3]>=7,RC[-3]<8),70,IF(AND(RC[-3]<RC[-1],RC[-3]>=8,RC[-3]<9),65,IF(AND(RC[-3]<RC[-1],RC[-3]>=9,RC[-3]<10),60,IF(AND(RC[-3]<RC[-1],RC[-3]>=10,RC[-3]<11),55,IF(AND(RC[-3]<RC[-1],RC[-3]>=11,RC[-3]<12),50,IF(AND(RC[-3]<RC[-1],RC[-3]>=12,RC[-3]<13),45,IF(AND(RC[-3]<RC[-1],RC[-3]>=13,RC[-3]<14),40,IF(AND(RC[-3]<RC[-1],RC[-3]>=14,RC[-3]<15),35,IF(AND(RC[-3]<RC[-1],RC[-3]>=15,RC[-3]<16),30,IF(AND(RC[-3]<RC[-1],RC[-3]>=16,RC[-3]<17),25,IF(AND(RC[-3]<RC[-1],RC[-3]>=17,RC[-3]<18),20,IF(AND(RC[-3]<RC[-1],RC[-3]>=18,RC[-3]<19),15,IF(AND(RC[-3]<RC[-1],RC[-3]>=19,RC[-3]<20),10,IF(AND(RC[-3]<RC[-1],RC[-3]>=20,RC[-3]<21),5,IF(AND(RC[-3]<RC[-1],RC[-3]>=21),0,IF(AND(RC[-3]>RC[-1],RC[-3]>=2,RC[-3]<3),90,IF(AND(RC[-3]>RC[-1],RC[-3]>=3,RC[-3]<4),90,IF(AND(RC[-3]>RC[-1],RC[-3]>=4,RC[-3]<5),80,IF(AND(RC[-3]>RC[-1],RC[-3]>=5,RC[-3]<6),70,IF(AND(RC[-3]>RC[-1],RC[-3]>=6,RC[-3]<7),60,IF(AND(RC[-3]>RC[-1],RC[-3]>=7,RC[-3]<8),50,IF(AND(RC[-3]>RC[-1],RC[-3]>=8,RC[-3]<9),40,IF(AND(RC[-3]>RC[-1],RC[-3]>=9,RC[-3]<10),30,IF(AND(RC[-3]>RC[-1],RC[-3]>=10,RC[-3]<11),20,IF(AND(RC[-3]>RC[-1],RC[-3]>=11,RC[-3]<12),10,IF(AND(RC[-3]>RC[-1],RC[-3]>=12),0))))))))))))))))))))))))))))))))) -> 90 | H411: =IF(RC[-3]="","",IF(RC[-3]<0.3,100,IF(AND(RC[-3]>=0.3,RC[-3]>0.4),95,IF(AND(RC[-3]>=0.4,RC[-3]<0.5),90,IF(AND(RC[-3]>=0.5,RC[-3]<0.6),85,IF(AND(RC[-3]>=0.6,RC[-3]<0.7),80,IF(AND(RC[-3]>=0.6,RC[-3]<1),80,IF(AND(RC[-3]>1,RC[-3]<2),50,IF(RC[-3]>2,0))))))))) ->  | I411: =IF(RC[-1]="",RC[-2],0.7*RC[-1]+0.3*RC[-2]) -> 90
A412: پتروشیمی شیراز | B412: شیراز | C412: =VLOOKUP(RC[-1],Sheet1!R3C2:R802C3,2,FALSE) -> شیمیایی | D412: =VLOOKUP(RC[-2],Sheet1!R3C2:R802C9,8,FALSE) -> 3.4807503543581904 | E412: =IF(VLOOKUP(RC[-3],Sheet1!R3C2:R803C11,10,FALSE)=0,"",VLOOKUP(Sheet2!RC[-3],Sheet1!R[1]C[-3]:R[801]C[6],10,FALSE)) ->  | F412: =Sheet1!R488C10 -> 5.0300989663672855 | G412: =IF(RC[-3]<0,0,IF(AND(RC[-3]<RC[-1],RC[-3]<2),100,IF(AND(RC[-3]<RC[-1],RC[-3]>=2,RC[-3]<3),95,IF(AND(RC[-3]<RC[-1],RC[-3]>=3,RC[-3]<4),90,IF(AND(RC[-3]<RC[-1],RC[-3]>=4,RC[-3]<5),85,IF(AND(RC[-3]<RC[-1],RC[-3]>=5,RC[-3]<6),80,IF(AND(RC[-3]<RC[-1],RC[-3]>=6,RC[-3]<7),75,IF(AND(RC[-3]<RC[-1],RC[-3]>=7,RC[-3]<8),70,IF(AND(RC[-3]<RC[-1],RC[-3]>=8,RC[-3]<9),65,IF(AND(RC[-3]<RC[-1],RC[-3]>=9,RC[-3]<10),60,IF(AND(RC[-3]<RC[-1],RC[-3]>=10,RC[-3]<11),55,IF(AND(RC[-3]<RC[-1],RC[-3]>=11,RC[-3]<12),50,IF(AND(RC[-3]<RC[-1],RC[-3]>=12,RC[-3]<13),45,IF(AND(RC[-3]<RC[-1],RC[-3]>=13,RC[-3]<14),40,IF(AND(RC[-3]<RC[-1],RC[-3]>=14,RC[-3]<15),35,IF(AND(RC[-3]<RC[-1],RC[-3]>=15,RC[-3]<16),30,IF(AND(RC[-3]<RC[-1],RC[-3]>=16,RC[-3]<17),25,IF(AND(RC[-3]<RC[-1],RC[-3]>=17,RC[-3]<18),20,IF(AND(RC[-3]<RC[-1],RC[-3]>=18,RC[-3]<19),15,IF(AND(RC[-3]<RC[-1],RC[-3]>=19,RC[-3]<20),10,IF(AND(RC[-3]<RC[-1],RC[-3]>=20,RC[-3]<21),5,IF(AND(RC[-3]<RC[-1],RC[-3]>=21),0,IF(AND(RC[-3]>RC[-1],RC[-3]>=2,RC[-3]<3),90,IF(AND(RC[-3]>RC[-1],RC[-3]>=3,RC[-3]<4),90,IF(AND(RC[-3]>RC[-1],RC[-3]>=4,RC[-3]<5),80,IF(AND(RC[-3]>RC[-1],RC[-3]>=5,RC[-3]<6),70,IF(AND(RC[-3]>RC[-1],RC[-3]>=6,RC[-3]<7),60,IF(AND(RC[-3]>RC[-1],RC[-3]>=7,RC[-3]<8),50,IF(AND(RC[-3]>RC[-1],RC[-3]>=8,RC[-3]<9),40,IF(AND(RC[-3]>RC[-1],RC[-3]>=9,RC[-3]<10),30,IF(AND(RC[-3]>RC[-1],RC[-3]>=10,RC[-3]<11),20,IF(AND(RC[-3]>RC[-1],RC[-3]>=11,RC[-3]<12),10,IF(AND(RC[-3]>RC[-1],RC[-3]>=12),0))))))))))))))))))))))))))))))))) -> 90 | H412: =IF(RC[-3]="","",IF(RC[-3]<0.3,100,IF(AND(RC[-3]>=0.3,RC[-3]>0.4),95,IF(AND(RC[-3]>=0.4,RC[-3]<0.5),90,IF(AND(RC[-3]>=0.5,RC[-3]<0.6),85,IF(AND(RC[-3]>=0.6,RC[-3]<0.7),80,IF(AND(RC[-3]>=0.6,RC[-3]<1),80,IF(AND(RC[-3]>1,RC[-3]<2),50,IF(RC[-3]>2,0))))))))) ->  | I412: =IF(RC[-1]="",RC[-2],0.7*RC[-1]+0.3*RC[-2]) -> 90
A413: پتروشیمی غدیر | B413: شغدیر | C413: =VLOOKUP(RC[-1],Sheet1!R3C2:R802C3,2,FALSE) -> شیمیایی | D413: =VLOOKUP(RC[-2],Sheet1!R3C2:R802C9,8,FALSE) -> 4.2 | E413: =IF(VLOOKUP(RC[-3],Sheet1!R3C2:R803C11,10,FALSE)=0,"",VLOOKUP(Sheet2!RC[-3],Sheet1!R[1]C[-3]:R[801]C[6],10,FALSE)) ->  | F413: =Sheet1!R488C10 -> 5.0300989663672855 | G413: =IF(RC[-3]<0,0,IF(AND(RC[-3]<RC[-1],RC[-3]<2),100,IF(AND(RC[-3]<RC[-1],RC[-3]>=2,RC[-3]<3),95,IF(AND(RC[-3]<RC[-1],RC[-3]>=3,RC[-3]<4),90,IF(AND(RC[-3]<RC[-1],RC[-3]>=4,RC[-3]<5),85,IF(AND(RC[-3]<RC[-1],RC[-3]>=5,RC[-3]<6),80,IF(AND(RC[-3]<RC[-1],RC[-3]>=6,RC[-3]<7),75,IF(AND(RC[-3]<RC[-1],RC[-3]>=7,RC[-3]<8),70,IF(AND(RC[-3]<RC[-1],RC[-3]>=8,RC[-3]<9),65,IF(AND(RC[-3]<RC[-1],RC[-3]>=9,RC[-3]<10),60,IF(AND(RC[-3]<RC[-1],RC[-3]>=10,RC[-3]<11),55,IF(AND(RC[-3]<RC[-1],RC[-3]>=11,RC[-3]<12),50,IF(AND(RC[-3]<RC[-1],RC[-3]>=12,RC[-3]<13),45,IF(AND(RC[-3]<RC[-1],RC[-3]>=13,RC[-3]<14),40,IF(AND(RC[-3]<RC[-1],RC[-3]>=14,RC[-3]<15),35,IF(AND(RC[-3]<RC[-1],RC[-3]>=15,RC[-3]<16),30,IF(AND(RC[-3]<RC[-1],RC[-3]>=16,RC[-3]<17),25,IF(AND(RC[-3]<RC[-1],RC[-3]>=17,RC[-3]<18),20,IF(AND(RC[-3]<RC[-1],RC[-3]>=18,RC[-3]<19),15,IF(AND(RC[-3]<RC[-1],RC[-3]>=19,RC[-3]<20),10,IF(AND(RC[-3]<RC[-1],RC[-3]>=20,RC[-3]<21),5,IF(AND(RC[-3]<RC[-1],RC[-3]>=21),0,IF(AND(RC[-3]>RC[-1],RC[-3]>=2,RC[-3]<3),90,IF(AND(RC[-3]>RC[-1],RC[-3]>=3,RC[-3]<4),90,IF(AND(RC[-3]>RC[-1],RC[-3]>=4,RC[-3]<5),80,IF(AND(RC[-3]>RC[-1],RC[-3]>=5,RC[-3]<6),70,IF(AND(RC[-3]>RC[-1],RC[-3]>=6,RC[-3]<7),60,IF(AND(RC[-3]>RC[-1],RC[-3]>=7,RC[-3]<8),50,IF(AND(RC[-3]>RC[-1],RC[-3]>=8,RC[-3]<9),40,IF(AND(RC[-3]>RC[-1],RC[-3]>=9,RC[-3]<10),30,IF(AND(RC[-3]>RC[-1],RC[-3]>=10,RC[-3]<11),20,IF(AND(RC[-3]>RC[-1],RC[-3]>=11,RC[-3]<12),10,IF(AND(RC[-3]>RC[-1],RC[-3]>=12),0))))))))))))))))))))))))))))))))) -> 85 | H413: =IF(RC[-3]="","",IF(RC[-3]<0.3,100,IF(AND(RC[-3]>=0.3,RC[-3]>0.4),95,IF(AND(RC[-3]>=0.4,RC[-3]<0.5),90,IF(AND(RC[-3]>=0.5,RC[-3]<0.6),85,IF(AND(RC[-3]>=0.6,RC[-3]<0.7),80,IF(AND(RC[-3]>=0.6,RC[-3]<1),80,IF(AND(RC[-3]>1,RC[-3]<2),50,IF(RC[-3]>2,0))))))))) ->  | I413: =IF(RC[-1]="",RC[-2],0.7*RC[-1]+0.3*RC[-2]) -> 85
A414: پتروشیمی فارابی | B414: شفارا | C414: =VLOOKUP(RC[-1],Sheet1!R3C2:R802C3,2,FALSE) -> شیمیایی | D414: =VLOOKUP(RC[-2],Sheet1!R3C2:R802C9,8,FALSE) -> 20.887093027199938 | E414: =IF(VLOOKUP(RC[-3],Sheet1!R3C2:R803C11,10,FALSE)=0,"",VLOOKUP(Sheet2!RC[-3],Sheet1!R[1]C[-3]:R[801]C[6],10,FALSE)) ->  | F414: =Sheet1!R488C10 -> 5.0300989663672855 | G414: =IF(RC[-3]<0,0,IF(AND(RC[-3]<RC[-1],RC[-3]<2),100,IF(AND(RC[-3]<RC[-1],RC[-3]>=2,RC[-3]<3),95,IF(AND(RC[-3]<RC[-1],RC[-3]>=3,RC[-3]<4),90,IF(AND(RC[-3]<RC[-1],RC[-3]>=4,RC[-3]<5),85,IF(AND(RC[-3]<RC[-1],RC[-3]>=5,RC[-3]<6),80,IF(AND(RC[-3]<RC[-1],RC[-3]>=6,RC[-3]<7),75,IF(AND(RC[-3]<RC[-1],RC[-3]>=7,RC[-3]<8),70,IF(AND(RC[-3]<RC[-1],RC[-3]>=8,RC[-3]<9),65,IF(AND(RC[-3]<RC[-1],RC[-3]>=9,RC[-3]<10),60,IF(AND(RC[-3]<RC[-1],RC[-3]>=10,RC[-3]<11),55,IF(AND(RC[-3]<RC[-1],RC[-3]>=11,RC[-3]<12),50,IF(AND(RC[-3]<RC[-1],RC[-3]>=12,RC[-3]<13),45,IF(AND(RC[-3]<RC[-1],RC[-3]>=13,RC[-3]<14),40,IF(AND(RC[-3]<RC[-1],RC[-3]>=14,RC[-3]<15),35,IF(AND(RC[-3]<RC[-1],RC[-3]>=15,RC[-3]<16),30,IF(AND(RC[-3]<RC[-1],RC[-3]>=16,RC[-3]<17),25,IF(AND(RC[-3]<RC[-1],RC[-3]>=17,RC[-3]<18),20,IF(AND(RC[-3]<RC[-1],RC[-3]>=18,RC[-3]<19),15,IF(AND(RC[-3]<RC[-1],RC[-3]>=19,RC[-3]<20),10,IF(AND(RC[-3]<RC[-1],RC[-3]>=20,RC[-3]<21),5,IF(AND(RC[-3]<RC[-1],RC[-3]>=21),0,IF(AND(RC[-3]>RC[-1],RC[-3]>=2,RC[-3]<3),90,IF(AND(RC[-3]>RC[-1],RC[-3]>=3,RC[-3]<4),90,IF(AND(RC[-3]>RC[-1],RC[-3]>=4,RC[-3]<5),80,IF(AND(RC[-3]>RC[-1],RC[-3]>=5,RC[-3]<6),70,IF(AND(RC[-3]>RC[-1],RC[-3]>=6,RC[-3]<7),60,IF(AND(RC[-3]>RC[-1],RC[-3]>=7,RC[-3]<8),50,IF(AND(RC[-3]>RC[-1],RC[-3]>=8,RC[-3]<9),40,IF(AND(RC[-3]>RC[-1],RC[-3]>=9,RC[-3]<10),30,IF(AND(RC[-3]>RC[-1],RC[-3]>=10,RC[-3]<11),20,IF(AND(RC[-3]>RC[-1],RC[-3]>=11,RC[-3]<12),10,IF(AND(RC[-3]>RC[-1],RC[-3]>=12),0))))))))))))))))))))))))))))))))) -> 0 | H414: =IF(RC[-3]="","",IF(RC[-3]<0.3,100,IF(AND(RC[-3]>=0.3,RC[-3]>0.4),95,IF(AND(RC[-3]>=0.4,RC[-3]<0.5),90,IF(AND(RC[-3]>=0.5,RC[-3]<0.6),85,IF(AND(RC[-3]>=0.6,RC[-3]<0.7),80,IF(AND(RC[-3]>=0.6,RC[-3]<1),80,IF(AND(RC[-3]>1,RC[-3]<2),50,IF(RC[-3]>2,0))))))))) ->  | I414: =IF(RC[-1]="",RC[-2],0.7*RC[-1]+0.3*RC[-2]) -> 0
A415: پتروشیمی فسا | B415: فسا | C415: =VLOOKUP(RC[-1],Sheet1!R3C2:R802C3,2,FALSE) -> شیمیایی | D415: =VLOOKUP(RC[-2],Sheet1!R3C2:R802C9,8,FALSE) -> -290.2647415343975 | E415: =IF(VLOOKUP(RC[-3],Sheet1!R3C2:R803C11,10,FALSE)=0,"",VLOOKUP(Sheet2!RC[-3],Sheet1!R[1]C[-3]:R[801]C[6],10,FALSE)) ->  | F415: =Sheet1!R488C10 -> 5.0300989663672855 | G415: =IF(RC[-3]<0,0,IF(AND(RC[-3]<RC[-1],RC[-3]<2),100,IF(AND(RC[-3]<RC[-1],RC[-3]>=2,RC[-3]<3),95,IF(AND(RC[-3]<RC[-1],RC[-3]>=3,RC[-3]<4),90,IF(AND(RC[-3]<RC[-1],RC[-3]>=4,RC[-3]<5),85,IF(AND(RC[-3]<RC[-1],RC[-3]>=5,RC[-3]<6),80,IF(AND(RC[-3]<RC[-1],RC[-3]>=6,RC[-3]<7),75,IF(AND(RC[-3]<RC[-1],RC[-3]>=7,RC[-3]<8),70,IF(AND(RC[-3]<RC[-1],RC[-3]>=8,RC[-3]<9),65,IF(AND(RC[-3]<RC[-1],RC[-3]>=9,RC[-3]<10),60,IF(AND(RC[-3]<RC[-1],RC[-3]>=10,RC[-3]<11),55,IF(AND(RC[-3]<RC[-1],RC[-3]>=11,RC[-3]<12),50,IF(AND(RC[-3]<RC[-1],RC[-3]>=12,RC[-3]<13),45,IF(AND(RC[-3]<RC[-1],RC[-3]>=13,RC[-3]<14),40,IF(AND(RC[-3]<RC[-1],RC[-3]>=14,RC[-3]<15),35,IF(AND(RC[-3]<RC[-1],RC[-3]>=15,RC[-3]<16),30,IF(AND(RC[-3]<RC[-1],RC[-3]>=16,RC[-3]<17),25,IF(AND(RC[-3]<RC[-1],RC[-3]>=17,RC[-3]<18),20,IF(AND(RC[-3]<RC[-1],RC[-3]>=18,RC[-3]<19),15,IF(AND(RC[-3]<RC[-1],RC[-3]>=19,RC[-3]<20),10,IF(AND(RC[-3]<RC[-1],RC[-3]>=20,RC[-3]<21),5,IF(AND(RC[-3]<RC[-1],RC[-3]>=21),0,IF(AND(RC[-3]>RC[-1],RC[-3]>=2,RC[-3]<3),90,IF(AND(RC[-3]>RC[-1],RC[-3]>=3,RC[-3]<4),90,IF(AND(RC[-3]>RC[-1],RC[-3]>=4,RC[-3]<5),80,IF(AND(RC[-3]>RC[-1],RC[-3]>=5,RC[-3]<6),70,IF(AND(RC[-3]>RC[-1],RC[-3]>=6,RC[-3]<7),60,IF(AND(RC[-3]>RC[-1],RC[-3]>=7,RC[-3]<8),50,IF(AND(RC[-3]>RC[-1],RC[-3]>=8,RC[-3]<9),40,IF(AND(RC[-3]>RC[-1],RC[-3]>=9,RC[-3]<10),30,IF(AND(RC[-3]>RC[-1],RC[-3]>=10,RC[-3]<11),20,IF(AND(RC[-3]>RC[-1],RC[-3]>=11,RC[-3]<12),10,IF(AND(RC[-3]>RC[-1],RC[-3]>=12),0))))))))))))))))))))))))))))))))) -> 0 | H415: =IF(RC[-3]="","",IF(RC[-3]<0.3,100,IF(AND(RC[-3]>=0.3,RC[-3]>0.4),95,IF(AND(RC[-3]>=0.4,RC[-3]<0.5),90,IF(AND(RC[-3]>=0.5,RC[-3]<0.6),85,IF(AND(RC[-3]>=0.6,RC[-3]<0.7),80,IF(AND(RC[-3]>=0.6,RC[-3]<1),80,IF(AND(RC[-3]>1,RC[-3]<2),50,IF(RC[-3]>2,0))))))))) ->  | I415: =IF(RC[-1]="",RC[-2],0.7*RC[-1]+0.3*RC[-2]) -> 0
A416: پتروشیمی فن آوران | B416: شفن | C416: =VLOOKUP(RC[-1],Sheet1!R3C2:R802C3,2,FALSE) -> شیمیایی | D416: =VLOOKUP(RC[-2],Sheet1!R3C2:R802C9,8,FALSE) -> 10.207425920844306 | E416: =IF(VLOOKUP(RC[-3],Sheet1!R3C2:R803C11,10,FALSE)=0,"",VLOOKUP(Sheet2!RC[-3],Sheet1!R[1]C[-3]:R[801]C[6],10,FALSE)) ->  | F416: =Sheet1!R488C10 -> 5.0300989663672855 | G416: =IF(RC[-3]<0,0,IF(AND(RC[-3]<RC[-1],RC[-3]<2),100,IF(AND(RC[-3]<RC[-1],RC[-3]>=2,RC[-3]<3),95,IF(AND(RC[-3]<RC[-1],RC[-3]>=3,RC[-3]<4),90,IF(AND(RC[-3]<RC[-1],RC[-3]>=4,RC[-3]<5),85,IF(AND(RC[-3]<RC[-1],RC[-3]>=5,RC[-3]<6),80,IF(AND(RC[-3]<RC[-1],RC[-3]>=6,RC[-3]<7),75,IF(AND(RC[-3]<RC[-1],RC[-3]>=7,RC[-3]<8),70,IF(AND(RC[-3]<RC[-1],RC[-3]>=8,RC[-3]<9),65,IF(AND(RC[-3]<RC[-1],RC[-3]>=9,RC[-3]<10),60,IF(AND(RC[-3]<RC[-1],RC[-3]>=10,RC[-3]<11),55,IF(AND(RC[-3]<RC[-1],RC[-3]>=11,RC[-3]<12),50,IF(AND(RC[-3]<RC[-1],RC[-3]>=12,RC[-3]<13),45,IF(AND(RC[-3]<RC[-1],RC[-3]>=13,RC[-3]<14),40,IF(AND(RC[-3]<RC[-1],RC[-3]>=14,RC[-3]<15),35,IF(AND(RC[-3]<RC[-1],RC[-3]>=15,RC[-3]<16),30,IF(AND(RC[-3]<RC[-1],RC[-3]>=16,RC[-3]<17),25,IF(AND(RC[-3]<RC[-1],RC[-3]>=17,RC[-3]<18),20,IF(AND(RC[-3]<RC[-1],RC[-3]>=18,RC[-3]<19),15,IF(AND(RC[-3]<RC[-1],RC[-3]>=19,RC[-3]<20),10,IF(AND(RC[-3]<RC[-1],RC[-3]>=20,RC[-3]<21),5,IF(AND(RC[-3]<RC[-1],RC[-3]>=21),0,IF(AND(RC[-3]>RC[-1],RC[-3]>=2,RC[-3]<3),90,IF(AND(RC[-3]>RC[-1],RC[-3]>=3,RC[-3]<4),90,IF(AND(RC[-3]>RC[-1],RC[-3]>=4,RC[-3]<5),80,IF(AND(RC[-3]>RC[-1],RC[-3]>=5,RC[-3]<6),70,IF(AND(RC[-3]>RC[-1],RC[-3]>=6,RC[-3]<7),60,IF(AND(RC[-3]>RC[-1],RC[-3]>=7,RC[-3]<8),50,IF(AND(RC[-3]>RC[-1],RC[-3]>=8,RC[-3]<9),40,IF(AND(RC[-3]>RC[-1],RC[-3]>=9,RC[-3]<10),30,IF(AND(RC[-3]>RC[-1],RC[-3]>=10,RC[-3]<11),20,IF(AND(RC[-3]>RC[-1],RC[-3]>=11,RC[-3]<12),10,IF(AND(RC[-3]>RC[-1],RC[-3]>=12),0))))))))))))))))))))))))))))))))) -> 20 | H416: =IF(RC[-3]="","",IF(RC[-3]<0.3,100,IF(AND(RC[-3]>=0.3,RC[-3]>0.4),95,IF(AND(RC[-3]>=0.4,RC[-3]<0.5),90,IF(AND(RC[-3]>=0.5,RC[-3]<0.6),85,IF(AND(RC[-3]>=0.6,RC[-3]<0.7),80,IF(AND(RC[-3]>=0.6,RC[-3]<1),80,IF(AND(RC[-3]>1,RC[-3]<2),50,IF(RC[-3]>2,0))))))))) ->  | I416: =IF(RC[-1]="",RC[-2],0.7*RC[-1]+0.3*RC[-2]) -> 20
A417: پتروشیمی قائد بصیر | B417: شبصیر | C417: =VLOOKUP(RC[-1],Sheet1!R3C2:R802C3,2,FALSE) -> شیمیایی | D417: =VLOOKUP(RC[-2],Sheet1!R3C2:R802C9,8,FALSE) -> 4.3674963320252012 | E417: =IF(VLOOKUP(RC[-3],Sheet1!R3C2:R803C11,10,FALSE)=0,"",VLOOKUP(Sheet2!RC[-3],Sheet1!R[1]C[-3]:R[801]C[6],10,FALSE)) ->  | F417: =Sheet1!R488C10 -> 5.0300989663672855 | G417: =IF(RC[-3]<0,0,IF(AND(RC[-3]<RC[-1],RC[-3]<2),100,IF(AND(RC[-3]<RC[-1],RC[-3]>=2,RC[-3]<3),95,IF(AND(RC[-3]<RC[-1],RC[-3]>=3,RC[-3]<4),90,IF(AND(RC[-3]<RC[-1],RC[-3]>=4,RC[-3]<5),85,IF(AND(RC[-3]<RC[-1],RC[-3]>=5,RC[-3]<6),80,IF(AND(RC[-3]<RC[-1],RC[-3]>=6,RC[-3]<7),75,IF(AND(RC[-3]<RC[-1],RC[-3]>=7,RC[-3]<8),70,IF(AND(RC[-3]<RC[-1],RC[-3]>=8,RC[-3]<9),65,IF(AND(RC[-3]<RC[-1],RC[-3]>=9,RC[-3]<10),60,IF(AND(RC[-3]<RC[-1],RC[-3]>=10,RC[-3]<11),55,IF(AND(RC[-3]<RC[-1],RC[-3]>=11,RC[-3]<12),50,IF(AND(RC[-3]<RC[-1],RC[-3]>=12,RC[-3]<13),45,IF(AND(RC[-3]<RC[-1],RC[-3]>=13,RC[-3]<14),40,IF(AND(RC[-3]<RC[-1],RC[-3]>=14,RC[-3]<15),35,IF(AND(RC[-3]<RC[-1],RC[-3]>=15,RC[-3]<16),30,IF(AND(RC[-3]<RC[-1],RC[-3]>=16,RC[-3]<17),25,IF(AND(RC[-3]<RC[-1],RC[-3]>=17,RC[-3]<18),20,IF(AND(RC[-3]<RC[-1],RC[-3]>=18,RC[-3]<19),15,IF(AND(RC[-3]<RC[-1],RC[-3]>=19,RC[-3]<20),10,IF(AND(RC[-3]<RC[-1],RC[-3]>=20,RC[-3]<21),5,IF(AND(RC[-3]<RC[-1],RC[-3]>=21),0,IF(AND(RC[-3]>RC[-1],RC[-3]>=2,RC[-3]<3),90,IF(AND(RC[-3]>RC[-1],RC[-3]>=3,RC[-3]<4),90,IF(AND(RC[-3]>RC[-1],RC[-3]>=4,RC[-3]<5),80,IF(AND(RC[-3]>RC[-1],RC[-3]>=5,RC[-3]<6),70,IF(AND(RC[-3]>RC[-1],RC[-3]>=6,RC[-3]<7),60,IF(AND(RC[-3]>RC[-1],RC[-3]>=7,RC[-3]<8),50,IF(AND(RC[-3]>RC[-1],RC[-3]>=8,RC[-3]<9),40,IF(AND(RC[-3]>RC[-1],RC[-3]>=9,RC[-3]<10),30,IF(AND(RC[-3]>RC[-1],RC[-3]>=10,RC[-3]<11),20,IF(AND(RC[-3]>RC[-1],RC[-3]>=11,RC[-3]<12),10,IF(AND(RC[-3]>RC[-1],RC[-3]>=12),0))))))))))))))))))))))))))))))))) -> 85 | H417: =IF(RC[-3]="","",IF(RC[-3]<0.3,100,IF(AND(RC[-3]>=0.3,RC[-3]>0.4),95,IF(AND(RC[-3]>=0.4,RC[-3]<0.5),90,IF(AND(RC[-3]>=0.5,RC[-3]<0.6),85,IF(AND(RC[-3]>=0.6,RC[-3]<0.7),80,IF(AND(RC[-3]>=0.6,RC[-3]<1),80,IF(AND(RC[-3]>1,RC[-3]<2),50,IF(RC[-3]>2,0))))))))) ->  | I417: =IF(RC[-1]="",RC[-2],0.7*RC[-1]+0.3*RC[-2]) -> 85
A418: پتروشیمی مارون | B418: مارون | C418: =VLOOKUP(RC[-1],Sheet1!R3C2:R802C3,2,FALSE) -> شیمیایی | D418: =VLOOKUP(RC[-2],Sheet1!R3C2:R802C9,8,FALSE) -> 8.0082452309065104 | E418: =IF(VLOOKUP(RC[-3],Sheet1!R3C2:R803C11,10,FALSE)=0,"",VLOOKUP(Sheet2!RC[-3],Sheet1!R[1]C[-3]:R[801]C[6],10,FALSE)) ->  | F418: =Sheet1!R488C10 -> 5.0300989663672855 | G418: =IF(RC[-3]<0,0,IF(AND(RC[-3]<RC[-1],RC[-3]<2),100,IF(AND(RC[-3]<RC[-1],RC[-3]>=2,RC[-3]<3),95,IF(AND(RC[-3]<RC[-1],RC[-3]>=3,RC[-3]<4),90,IF(AND(RC[-3]<RC[-1],RC[-3]>=4,RC[-3]<5),85,IF(AND(RC[-3]<RC[-1],RC[-3]>=5,RC[-3]<6),80,IF(AND(RC[-3]<RC[-1],RC[-3]>=6,RC[-3]<7),75,IF(AND(RC[-3]<RC[-1],RC[-3]>=7,RC[-3]<8),70,IF(AND(RC[-3]<RC[-1],RC[-3]>=8,RC[-3]<9),65,IF(AND(RC[-3]<RC[-1],RC[-3]>=9,RC[-3]<10),60,IF(AND(RC[-3]<RC[-1],RC[-3]>=10,RC[-3]<11),55,IF(AND(RC[-3]<RC[-1],RC[-3]>=11,RC[-3]<12),50,IF(AND(RC[-3]<RC[-1],RC[-3]>=12,RC[-3]<13),45,IF(AND(RC[-3]<RC[-1],RC[-3]>=13,RC[-3]<14),40,IF(AND(RC[-3]<RC[-1],RC[-3]>=14,RC[-3]<15),35,IF(AND(RC[-3]<RC[-1],RC[-3]>=15,RC[-3]<16),30,IF(AND(RC[-3]<RC[-1],RC[-3]>=16,RC[-3]<17),25,IF(AND(RC[-3]<RC[-1],RC[-3]>=17,RC[-3]<18),20,IF(AND(RC[-3]<RC[-1],RC[-3]>=18,RC[-3]<19),15,IF(AND(RC[-3]<RC[-1],RC[-3]>=19,RC[-3]<20),10,IF(AND(RC[-3]<RC[-1],RC[-3]>=20,RC[-3]<21),5,IF(AND(RC[-3]<RC[-1],RC[-3]>=21),0,IF(AND(RC[-3]>RC[-1],RC[-3]>=2,RC[-3]<3),90,IF(AND(RC[-3]>RC[-1],RC[-3]>=3,RC[-3]<4),90,IF(AND(RC[-3]>RC[-1],RC[-3]>=4,RC[-3]<5),80,IF(AND(RC[-3]>RC[-1],RC[-3]>=5,RC[-3]<6),70,IF(AND(RC[-3]>RC[-1],RC[-3]>=6,RC[-3]<7),60,IF(AND(RC[-3]>RC[-1],RC[-3]>=7,RC[-3]<8),50,IF(AND(RC[-3]>RC[-1],RC[-3]>=8,RC[-3]<9),40,IF(AND(RC[-3]>RC[-1],RC[-3]>=9,RC[-3]<10),30,IF(AND(RC[-3]>RC[-1],RC[-3]>=10,RC[-3]<11),20,IF(AND(RC[-3]>RC[-1],RC[-3]>=11,RC[-3]<12),10,IF(AND(RC[-3]>RC[-1],RC[-3]>=12),0))))))))))))))))))))))))))))))))) -> 40 | H418: =IF(RC[-3]="","",IF(RC[-3]<0.3,100,IF(AND(RC[-3]>=0.3,RC[-3]>0.4),95,IF(AND(RC[-3]>=0.4,RC[-3]<0.5),90,IF(AND(RC[-3]>=0.5,RC[-3]<0.6),85,IF(AND(RC[-3]>=0.6,RC[-3]<0.7),80,IF(AND(RC[-3]>=0.6,RC[-3]<1),80,IF(AND(RC[-3]>1,RC[-3]<2),50,IF(RC[-3]>2,0))))))))) ->  | I418: =IF(RC[-1]="",RC[-2],0.7*RC[-1]+0.3*RC[-2]) -> 40
A419: پتروشیمی ممسنی | B419: ممسنی | C419: =VLOOKUP(RC[-1],Sheet1!R3C2:R802C3,2,FALSE) -> شیمیایی | D419: =VLOOKUP(RC[-2],Sheet1!R3C2:R802C9,8,FALSE) -> -589.17857142857144 | E419: =IF(VLOOKUP(RC[-3],Sheet1!R3C2:R803C11,10,FALSE)=0,"",VLOOKUP(Sheet2!RC[-3],Sheet1!R[1]C[-3]:R[801]C[6],10,FALSE)) ->  | F419: =Sheet1!R488C10 -> 5.0300989663672855 | G419: =IF(RC[-3]<0,0,IF(AND(RC[-3]<RC[-1],RC[-3]<2),100,IF(AND(RC[-3]<RC[-1],RC[-3]>=2,RC[-3]<3),95,IF(AND(RC[-3]<RC[-1],RC[-3]>=3,RC[-3]<4),90,IF(AND(RC[-3]<RC[-1],RC[-3]>=4,RC[-3]<5),85,IF(AND(RC[-3]<RC[-1],RC[-3]>=5,RC[-3]<6),80,IF(AND(RC[-3]<RC[-1],RC[-3]>=6,RC[-3]<7),75,IF(AND(RC[-3]<RC[-1],RC[-3]>=7,RC[-3]<8),70,IF(AND(RC[-3]<RC[-1],RC[-3]>=8,RC[-3]<9),65,IF(AND(RC[-3]<RC[-1],RC[-3]>=9,RC[-3]<10),60,IF(AND(RC[-3]<RC[-1],RC[-3]>=10,RC[-3]<11),55,IF(AND(RC[-3]<RC[-1],RC[-3]>=11,RC[-3]<12),50,IF(AND(RC[-3]<RC[-1],RC[-3]>=12,RC[-3]<13),45,IF(AND(RC[-3]<RC[-1],RC[-3]>=13,RC[-3]<14),40,IF(AND(RC[-3]<RC[-1],RC[-3]>=14,RC[-3]<15),35,IF(AND(RC[-3]<RC[-1],RC[-3]>=15,RC[-3]<16),30,IF(AND(RC[-3]<RC[-1],RC[-3]>=16,RC[-3]<17),25,IF(AND(RC[-3]<RC[-1],RC[-3]>=17,RC[-3]<18),20,IF(AND(RC[-3]<RC[-1],RC[-3]>=18,RC[-3]<19),15,IF(AND(RC[-3]<RC[-1],RC[-3]>=19,RC[-3]<20),10,IF(AND(RC[-3]<RC[-1],RC[-3]>=20,RC[-3]<21),5,IF(AND(RC[-3]<RC[-1],RC[-3]>=21),0,IF(AND(RC[-3]>RC[-1],RC[-3]>=2,RC[-3]<3),90,IF(AND(RC[-3]>RC[-1],RC[-3]>=3,RC[-3]<4),90,IF(AND(RC[-3]>RC[-1],RC[-3]>=4,RC[-3]<5),80,IF(AND(RC[-3]>RC[-1],RC[-3]>=5,RC[-3]<6),70,IF(AND(RC[-3]>RC[-1],RC[-3]>=6,RC[-3]<7),60,IF(AND(RC[-3]>RC[-1],RC[-3]>=7,RC[-3]<8),50,IF(AND(RC[-3]>RC[-1],RC[-3]>=8,RC[-3]<9),40,IF(AND(RC[-3]>RC[-1],RC[-3]>=9,RC[-3]<10),30,IF(AND(RC[-3]>RC[-1],RC[-3]>=10,RC[-3]<11),20,IF(AND(RC[-3]>RC[-1],RC[-3]>=11,RC[-3]<12),10,IF(AND(RC[-3]>RC[-1],RC[-3]>=12),0))))))))))))))))))))))))))))))))) -> 0 | H419: =IF(RC[-3]="","",IF(RC[-3]<0.3,100,IF(AND(RC[-3]>=0.3,RC[-3]>0.4),95,IF(AND(RC[-3]>=0.4,RC[-3]<0.5),90,IF(AND(RC[-3]>=0.5,RC[-3]<0.6),85,IF(AND(RC[-3]>=0.6,RC[-3]<0.7),80,IF(AND(RC[-3]>=0.6,RC[-3]<1),80,IF(AND(RC[-3]>1,RC[-3]<2),50,IF(RC[-3]>2,0))))))))) ->  | I419: =IF(RC[-1]="",RC[-2],0.7*RC[-1]+0.3*RC[-2]) -> 0
A420: پتروشیمی نوری | B420: نوری | C420: =VLOOKUP(RC[-1],Sheet1!R3C2:R802C3,2,FALSE) -> شیمیایی | D420: =VLOOKUP(RC[-2],Sheet1!R3C2:R802C9,8,FALSE) -> 5.7 | E420: =IF(VLOOKUP(RC[-3],Sheet1!R3C2:R803C11,10,FALSE)=0,"",VLOOKUP(Sheet2!RC[-3],Sheet1!R[1]C[-3]:R[801]C[6],10,FALSE)) ->  | F420: =Sheet1!R488C10 -> 5.0300989663672855 | G420: =IF(RC[-3]<0,0,IF(AND(RC[-3]<RC[-1],RC[-3]<2),100,IF(AND(RC[-3]<RC[-1],RC[-3]>=2,RC[-3]<3),95,IF(AND(RC[-3]<RC[-1],RC[-3]>=3,RC[-3]<4),90,IF(AND(RC[-3]<RC[-1],RC[-3]>=4,RC[-3]<5),85,IF(AND(RC[-3]<RC[-1],RC[-3]>=5,RC[-3]<6),80,IF(AND(RC[-3]<RC[-1],RC[-3]>=6,RC[-3]<7),75,IF(AND(RC[-3]<RC[-1],RC[-3]>=7,RC[-3]<8),70,IF(AND(RC[-3]<RC[-1],RC[-3]>=8,RC[-3]<9),65,IF(AND(RC[-3]<RC[-1],RC[-3]>=9,RC[-3]<10),60,IF(AND(RC[-3]<RC[-1],RC[-3]>=10,RC[-3]<11),55,IF(AND(RC[-3]<RC[-1],RC[-3]>=11,RC[-3]<12),50,IF(AND(RC[-3]<RC[-1],RC[-3]>=12,RC[-3]<13),45,IF(AND(RC[-3]<RC[-1],RC[-3]>=13,RC[-3]<14),40,IF(AND(RC[-3]<RC[-1],RC[-3]>=14,RC[-3]<15),35,IF(AND(RC[-3]<RC[-1],RC[-3]>=15,RC[-3]<16),30,IF(AND(RC[-3]<RC[-1],RC[-3]>=16,RC[-3]<17),25,IF(AND(RC[-3]<RC[-1],RC[-3]>=17,RC[-3]<18),20,IF(AND(RC[-3]<RC[-1],RC[-3]>=18,RC[-3]<19),15,IF(AND(RC[-3]<RC[-1],RC[-3]>=19,RC[-3]<20),10,IF(AND(RC[-3]<RC[-1],RC[-3]>=20,RC[-3]<21),5,IF(AND(RC[-3]<RC[-1],RC[-3]>=21),0,IF(AND(RC[-3]>RC[-1],RC[-3]>=2,RC[-3]<3),90,IF(AND(RC[-3]>RC[-1],RC[-3]>=3,RC[-3]<4),90,IF(AND(RC[-3]>RC[-1],RC[-3]>=4,RC[-3]<5),80,IF(AND(RC[-3]>RC[-1],RC[-3]>=5,RC[-3]<6),70,IF(AND(RC[-3]>RC[-1],RC[-3]>=6,RC[-3]<7),60,IF(AND(RC[-3]>RC[-1],RC[-3]>=7,RC[-3]<8),50,IF(AND(RC[-3]>RC[-1],RC[-3]>=8,RC[-3]<9),40,IF(AND(RC[-3]>RC[-1],RC[-3]>=9,RC[-3]<10),30,IF(AND(RC[-3]>RC[-1],RC[-3]>=10,RC[-3]<11),20,IF(AND(RC[-3]>RC[-1],RC[-3]>=11,RC[-3]<12),10,IF(AND(RC[-3]>RC[-1],RC[-3]>=12),0))))))))))))))))))))))))))))))))) -> 70 | H420: =IF(RC[-3]="","",IF(RC[-3]<0.3,100,IF(AND(RC[-3]>=0.3,RC[-3]>0.4),95,IF(AND(RC[-3]>=0.4,RC[-3]<0.5),90,IF(AND(RC[-3]>=0.5,RC[-3]<0.6),85,IF(AND(RC[-3]>=0.6,RC[-3]<0.7),80,IF(AND(RC[-3]>=0.6,RC[-3]<1),80,IF(AND(RC[-3]>1,RC[-3]<2),50,IF(RC[-3]>2,0))))))))) ->  | I420: =IF(RC[-1]="",RC[-2],0.7*RC[-1]+0.3*RC[-2]) -> 70
A421: پتروشیمی کازرون | B421: کازرو | C421: =VLOOKUP(RC[-1],Sheet1!R3C2:R802C3,2,FALSE) -> شیمیایی | D421: =VLOOKUP(RC[-2],Sheet1!R3C2:R802C9,8,FALSE) -> -129.2890625 | E421: =IF(VLOOKUP(RC[-3],Sheet1!R3C2:R803C11,10,FALSE)=0,"",VLOOKUP(Sheet2!RC[-3],Sheet1!R[1]C[-3]:R[801]C[6],10,FALSE)) ->  | F421: =Sheet1!R488C10 -> 5.0300989663672855 | G421: =IF(RC[-3]<0,0,IF(AND(RC[-3]<RC[-1],RC[-3]<2),100,IF(AND(RC[-3]<RC[-1],RC[-3]>=2,RC[-3]<3),95,IF(AND(RC[-3]<RC[-1],RC[-3]>=3,RC[-3]<4),90,IF(AND(RC[-3]<RC[-1],RC[-3]>=4,RC[-3]<5),85,IF(AND(RC[-3]<RC[-1],RC[-3]>=5,RC[-3]<6),80,IF(AND(RC[-3]<RC[-1],RC[-3]>=6,RC[-3]<7),75,IF(AND(RC[-3]<RC[-1],RC[-3]>=7,RC[-3]<8),70,IF(AND(RC[-3]<RC[-1],RC[-3]>=8,RC[-3]<9),65,IF(AND(RC[-3]<RC[-1],RC[-3]>=9,RC[-3]<10),60,IF(AND(RC[-3]<RC[-1],RC[-3]>=10,RC[-3]<11),55,IF(AND(RC[-3]<RC[-1],RC[-3]>=11,RC[-3]<12),50,IF(AND(RC[-3]<RC[-1],RC[-3]>=12,RC[-3]<13),45,IF(AND(RC[-3]<RC[-1],RC[-3]>=13,RC[-3]<14),40,IF(AND(RC[-3]<RC[-1],RC[-3]>=14,RC[-3]<15),35,IF(AND(RC[-3]<RC[-1],RC[-3]>=15,RC[-3]<16),30,IF(AND(RC[-3]<RC[-1],RC[-3]>=16,RC[-3]<17),25,IF(AND(RC[-3]<RC[-1],RC[-3]>=17,RC[-3]<18),20,IF(AND(RC[-3]<RC[-1],RC[-3]>=18,RC[-3]<19),15,IF(AND(RC[-3]<RC[-1],RC[-3]>=19,RC[-3]<20),10,IF(AND(RC[-3]<RC[-1],RC[-3]>=20,RC[-3]<21),5,IF(AND(RC[-3]<RC[-1],RC[-3]>=21),0,IF(AND(RC[-3]>RC[-1],RC[-3]>=2,RC[-3]<3),90,IF(AND(RC[-3]>RC[-1],RC[-3]>=3,RC[-3]<4),90,IF(AND(RC[-3]>RC[-1],RC[-3]>=4,RC[-3]<5),80,IF(AND(RC[-3]>RC[-1],RC[-3]>=5,RC[-3]<6),70,IF(AND(RC[-3]>RC[-1],RC[-3]>=6,RC[-3]<7),60,IF(AND(RC[-3]>RC[-1],RC[-3]>=7,RC[-3]<8),50,IF(AND(RC[-3]>RC[-1],RC[-3]>=8,RC[-3]<9),40,IF(AND(RC[-3]>RC[-1],RC[-3]>=9,RC[-3]<10),30,IF(AND(RC[-3]>RC[-1],RC[-3]>=10,RC[-3]<11),20,IF(AND(RC[-3]>RC[-1],RC[-3]>=11,RC[-3]<12),10,IF(AND(RC[-3]>RC[-1],RC[-3]>=12),0))))))))))))))))))))))))))))))))) -> 0 | H421: =IF(RC[-3]="","",IF(RC[-3]<0.3,100,IF(AND(RC[-3]>=0.3,RC[-3]>0.4),95,IF(AND(RC[-3]>=0.4,RC[-3]<0.5),90,IF(AND(RC[-3]>=0.5,RC[-3]<0.6),85,IF(AND(RC[-3]>=0.6,RC[-3]<0.7),80,IF(AND(RC[-3]>=0.6,RC[-3]<1),80,IF(AND(RC[-3]>1,RC[-3]<2),50,IF(RC[-3]>2,0))))))))) ->  | I421: =IF(RC[-1]="",RC[-2],0.7*RC[-1]+0.3*RC[-2]) -> 0
A422: پدیده شیمی قرن | B422: قرن | C422: =VLOOKUP(RC[-1],Sheet1!R3C2:R802C3,2,FALSE) -> شیمیایی | D422: =VLOOKUP(RC[-2],Sheet1!R3C2:R802C9,8,FALSE) -> 6 | E422: =IF(VLOOKUP(RC[-3],Sheet1!R3C2:R803C11,10,FALSE)=0,"",VLOOKUP(Sheet2!RC[-3],Sheet1!R[1]C[-3]:R[801]C[6],10,FALSE)) ->  | F422: =Sheet1!R488C10 -> 5.0300989663672855 | G422: =IF(RC[-3]<0,0,IF(AND(RC[-3]<RC[-1],RC[-3]<2),100,IF(AND(RC[-3]<RC[-1],RC[-3]>=2,RC[-3]<3),95,IF(AND(RC[-3]<RC[-1],RC[-3]>=3,RC[-3]<4),90,IF(AND(RC[-3]<RC[-1],RC[-3]>=4,RC[-3]<5),85,IF(AND(RC[-3]<RC[-1],RC[-3]>=5,RC[-3]<6),80,IF(AND(RC[-3]<RC[-1],RC[-3]>=6,RC[-3]<7),75,IF(AND(RC[-3]<RC[-1],RC[-3]>=7,RC[-3]<8),70,IF(AND(RC[-3]<RC[-1],RC[-3]>=8,RC[-3]<9),65,IF(AND(RC[-3]<RC[-1],RC[-3]>=9,RC[-3]<10),60,IF(AND(RC[-3]<RC[-1],RC[-3]>=10,RC[-3]<11),55,IF(AND(RC[-3]<RC[-1],RC[-3]>=11,RC[-3]<12),50,IF(AND(RC[-3]<RC[-1],RC[-3]>=12,RC[-3]<13),45,IF(AND(RC[-3]<RC[-1],RC[-3]>=13,RC[-3]<14),40,IF(AND(RC[-3]<RC[-1],RC[-3]>=14,RC[-3]<15),35,IF(AND(RC[-3]<RC[-1],RC[-3]>=15,RC[-3]<16),30,IF(AND(RC[-3]<RC[-1],RC[-3]>=16,RC[-3]<17),25,IF(AND(RC[-3]<RC[-1],RC[-3]>=17,RC[-3]<18),20,IF(AND(RC[-3]<RC[-1],RC[-3]>=18,RC[-3]<19),15,IF(AND(RC[-3]<RC[-1],RC[-3]>=19,RC[-3]<20),10,IF(AND(RC[-3]<RC[-1],RC[-3]>=20,RC[-3]<21),5,IF(AND(RC[-3]<RC[-1],RC[-3]>=21),0,IF(AND(RC[-3]>RC[-1],RC[-3]>=2,RC[-3]<3),90,IF(AND(RC[-3]>RC[-1],RC[-3]>=3,RC[-3]<4),90,IF(AND(RC[-3]>RC[-1],RC[-3]>=4,RC[-3]<5),80,IF(AND(RC[-3]>RC[-1],RC[-3]>=5,RC[-3]<6),70,IF(AND(RC[-3]>RC[-1],RC[-3]>=6,RC[-3]<7),60,IF(AND(RC[-3]>RC[-1],RC[-3]>=7,RC[-3]<8),50,IF(AND(RC[-3]>RC[-1],RC[-3]>=8,RC[-3]<9),40,IF(AND(RC[-3]>RC[-1],RC[-3]>=9,RC[-3]<10),30,IF(AND(RC[-3]>RC[-1],RC[-3]>=10,RC[-3]<11),20,IF(AND(RC[-3]>RC[-1],RC[-3]>=11,RC[-3]<12),10,IF(AND(RC[-3]>RC[-1],RC[-3]>=12),0))))))))))))))))))))))))))))))))) -> 60 | H422: =IF(RC[-3]="","",IF(RC[-3]<0.3,100,IF(AND(RC[-3]>=0.3,RC[-3]>0.4),95,IF(AND(RC[-3]>=0.4,RC[-3]<0.5),90,IF(AND(RC[-3]>=0.5,RC[-3]<0.6),85,IF(AND(RC[-3]>=0.6,RC[-3]<0.7),80,IF(AND(RC[-3]>=0.6,RC[-3]<1),80,IF(AND(RC[-3]>1,RC[-3]<2),50,IF(RC[-3]>2,0))))))))) ->  | I422: =IF(RC[-1]="",RC[-2],0.7*RC[-1]+0.3*RC[-2]) -> 60
A423: پلی اکریل ایران | B423: شپلی | C423: =VLOOKUP(RC[-1],Sheet1!R3C2:R802C3,2,FALSE) -> شیمیایی | D423: =VLOOKUP(RC[-2],Sheet1!R3C2:R802C9,8,FALSE) -> 43.297209730040343 | E423: =IF(VLOOKUP(RC[-3],Sheet1!R3C2:R803C11,10,FALSE)=0,"",VLOOKUP(Sheet2!RC[-3],Sheet1!R[1]C[-3]:R[801]C[6],10,FALSE)) ->  | F423: =Sheet1!R488C10 -> 5.0300989663672855 | G423: =IF(RC[-3]<0,0,IF(AND(RC[-3]<RC[-1],RC[-3]<2),100,IF(AND(RC[-3]<RC[-1],RC[-3]>=2,RC[-3]<3),95,IF(AND(RC[-3]<RC[-1],RC[-3]>=3,RC[-3]<4),90,IF(AND(RC[-3]<RC[-1],RC[-3]>=4,RC[-3]<5),85,IF(AND(RC[-3]<RC[-1],RC[-3]>=5,RC[-3]<6),80,IF(AND(RC[-3]<RC[-1],RC[-3]>=6,RC[-3]<7),75,IF(AND(RC[-3]<RC[-1],RC[-3]>=7,RC[-3]<8),70,IF(AND(RC[-3]<RC[-1],RC[-3]>=8,RC[-3]<9),65,IF(AND(RC[-3]<RC[-1],RC[-3]>=9,RC[-3]<10),60,IF(AND(RC[-3]<RC[-1],RC[-3]>=10,RC[-3]<11),55,IF(AND(RC[-3]<RC[-1],RC[-3]>=11,RC[-3]<12),50,IF(AND(RC[-3]<RC[-1],RC[-3]>=12,RC[-3]<13),45,IF(AND(RC[-3]<RC[-1],RC[-3]>=13,RC[-3]<14),40,IF(AND(RC[-3]<RC[-1],RC[-3]>=14,RC[-3]<15),35,IF(AND(RC[-3]<RC[-1],RC[-3]>=15,RC[-3]<16),30,IF(AND(RC[-3]<RC[-1],RC[-3]>=16,RC[-3]<17),25,IF(AND(RC[-3]<RC[-1],RC[-3]>=17,RC[-3]<18),20,IF(AND(RC[-3]<RC[-1],RC[-3]>=18,RC[-3]<19),15,IF(AND(RC[-3]<RC[-1],RC[-3]>=19,RC[-3]<20),10,IF(AND(RC[-3]<RC[-1],RC[-3]>=20,RC[-3]<21),5,IF(AND(RC[-3]<RC[-1],RC[-3]>=21),0,IF(AND(RC[-3]>RC[-1],RC[-3]>=2,RC[-3]<3),90,IF(AND(RC[-3]>RC[-1],RC[-3]>=3,RC[-3]<4),90,IF(AND(RC[-3]>RC[-1],RC[-3]>=4,RC[-3]<5),80,IF(AND(RC[-3]>RC[-1],RC[-3]>=5,RC[-3]<6),70,IF(AND(RC[-3]>RC[-1],RC[-3]>=6,RC[-3]<7),60,IF(AND(RC[-3]>RC[-1],RC[-3]>=7,RC[-3]<8),50,IF(AND(RC[-3]>RC[-1],RC[-3]>=8,RC[-3]<9),40,IF(AND(RC[-3]>RC[-1],RC[-3]>=9,RC[-3]<10),30,IF(AND(RC[-3]>RC[-1],RC[-3]>=10,RC[-3]<11),20,IF(AND(RC[-3]>RC[-1],RC[-3]>=11,RC[-3]<12),10,IF(AND(RC[-3]>RC[-1],RC[-3]>=12),0))))))))))))))))))))))))))))))))) -> 0 | H423: =IF(RC[-3]="","",IF(RC[-3]<0.3,100,IF(AND(RC[-3]>=0.3,RC[-3]>0.4),95,IF(AND(RC[-3]>=0.4,RC[-3]<0.5),90,IF(AND(RC[-3]>=0.5,RC[-3]<0.6),85,IF(AND(RC[-3]>=0.6,RC[-3]<0.7),80,IF(AND(RC[-3]>=0.6,RC[-3]<1),80,IF(AND(RC[-3]>1,RC[-3]<2),50,IF(RC[-3]>2,0))))))))) ->  | I423: =IF(RC[-1]="",RC[-2],0.7*RC[-1]+0.3*RC[-2]) -> 0
A424: پلی پروپیلن جم | B424: جم پیلن | C424: =VLOOKUP(RC[-1],Sheet1!R3C2:R802C3,2,FALSE) -> شیمیایی | D424: =VLOOKUP(RC[-2],Sheet1!R3C2:R802C9,8,FALSE) -> 4.3844354436664688 | E424: =IF(VLOOKUP(RC[-3],Sheet1!R3C2:R803C11,10,FALSE)=0,"",VLOOKUP(Sheet2!RC[-3],Sheet1!R[1]C[-3]:R[801]C[6],10,FALSE)) ->  | F424: =Sheet1!R488C10 -> 5.0300989663672855 | G424: =IF(RC[-3]<0,0,IF(AND(RC[-3]<RC[-1],RC[-3]<2),100,IF(AND(RC[-3]<RC[-1],RC[-3]>=2,RC[-3]<3),95,IF(AND(RC[-3]<RC[-1],RC[-3]>=3,RC[-3]<4),90,IF(AND(RC[-3]<RC[-1],RC[-3]>=4,RC[-3]<5),85,IF(AND(RC[-3]<RC[-1],RC[-3]>=5,RC[-3]<6),80,IF(AND(RC[-3]<RC[-1],RC[-3]>=6,RC[-3]<7),75,IF(AND(RC[-3]<RC[-1],RC[-3]>=7,RC[-3]<8),70,IF(AND(RC[-3]<RC[-1],RC[-3]>=8,RC[-3]<9),65,IF(AND(RC[-3]<RC[-1],RC[-3]>=9,RC[-3]<10),60,IF(AND(RC[-3]<RC[-1],RC[-3]>=10,RC[-3]<11),55,IF(AND(RC[-3]<RC[-1],RC[-3]>=11,RC[-3]<12),50,IF(AND(RC[-3]<RC[-1],RC[-3]>=12,RC[-3]<13),45,IF(AND(RC[-3]<RC[-1],RC[-3]>=13,RC[-3]<14),40,IF(AND(RC[-3]<RC[-1],RC[-3]>=14,RC[-3]<15),35,IF(AND(RC[-3]<RC[-1],RC[-3]>=15,RC[-3]<16),30,IF(AND(RC[-3]<RC[-1],RC[-3]>=16,RC[-3]<17),25,IF(AND(RC[-3]<RC[-1],RC[-3]>=17,RC[-3]<18),20,IF(AND(RC[-3]<RC[-1],RC[-3]>=18,RC[-3]<19),15,IF(AND(RC[-3]<RC[-1],RC[-3]>=19,RC[-3]<20),10,IF(AND(RC[-3]<RC[-1],RC[-3]>=20,RC[-3]<21),5,IF(AND(RC[-3]<RC[-1],RC[-3]>=21),0,IF(AND(RC[-3]>RC[-1],RC[-3]>=2,RC[-3]<3),90,IF(AND(RC[-3]>RC[-1],RC[-3]>=3,RC[-3]<4),90,IF(AND(RC[-3]>RC[-1],RC[-3]>=4,RC[-3]<5),80,IF(AND(RC[-3]>RC[-1],RC[-3]>=5,RC[-3]<6),70,IF(AND(RC[-3]>RC[-1],RC[-3]>=6,RC[-3]<7),60,IF(AND(RC[-3]>RC[-1],RC[-3]>=7,RC[-3]<8),50,IF(AND(RC[-3]>RC[-1],RC[-3]>=8,RC[-3]<9),40,IF(AND(RC[-3]>RC[-1],RC[-3]>=9,RC[-3]<10),30,IF(AND(RC[-3]>RC[-1],RC[-3]>=10,RC[-3]<11),20,IF(AND(RC[-3]>RC[-1],RC[-3]>=11,RC[-3]<12),10,IF(AND(RC[-3]>RC[-1],RC[-3]>=12),0))))))))))))))))))))))))))))))))) -> 85 | H424: =IF(RC[-3]="","",IF(RC[-3]<0.3,100,IF(AND(RC[-3]>=0.3,RC[-3]>0.4),95,IF(AND(RC[-3]>=0.4,RC[-3]<0.5),90,IF(AND(RC[-3]>=0.5,RC[-3]<0.6),85,IF(AND(RC[-3]>=0.6,RC[-3]<0.7),80,IF(AND(RC[-3]>=0.6,RC[-3]<1),80,IF(AND(RC[-3]>1,RC[-3]<2),50,IF(RC[-3]>2,0))))))))) ->  | I424: =IF(RC[-1]="",RC[-2],0.7*RC[-1]+0.3*RC[-2]) -> 85
A425: پلیمر آریا ساسول | B425: آریا | C425: =VLOOKUP(RC[-1],Sheet1!R3C2:R802C3,2,FALSE) -> شیمیایی | D425: =VLOOKUP(RC[-2],Sheet1!R3C2:R802C9,8,FALSE) -> 6.1054161524171882 | E425: =IF(VLOOKUP(RC[-3],Sheet1!R3C2:R803C11,10,FALSE)=0,"",VLOOKUP(Sheet2!RC[-3],Sheet1!R[1]C[-3]:R[801]C[6],10,FALSE)) ->  | F425: =Sheet1!R488C10 -> 5.0300989663672855 | G425: =IF(RC[-3]<0,0,IF(AND(RC[-3]<RC[-1],RC[-3]<2),100,IF(AND(RC[-3]<RC[-1],RC[-3]>=2,RC[-3]<3),95,IF(AND(RC[-3]<RC[-1],RC[-3]>=3,RC[-3]<4),90,IF(AND(RC[-3]<RC[-1],RC[-3]>=4,RC[-3]<5),85,IF(AND(RC[-3]<RC[-1],RC[-3]>=5,RC[-3]<6),80,IF(AND(RC[-3]<RC[-1],RC[-3]>=6,RC[-3]<7),75,IF(AND(RC[-3]<RC[-1],RC[-3]>=7,RC[-3]<8),70,IF(AND(RC[-3]<RC[-1],RC[-3]>=8,RC[-3]<9),65,IF(AND(RC[-3]<RC[-1],RC[-3]>=9,RC[-3]<10),60,IF(AND(RC[-3]<RC[-1],RC[-3]>=10,RC[-3]<11),55,IF(AND(RC[-3]<RC[-1],RC[-3]>=11,RC[-3]<12),50,IF(AND(RC[-3]<RC[-1],RC[-3]>=12,RC[-3]<13),45,IF(AND(RC[-3]<RC[-1],RC[-3]>=13,RC[-3]<14),40,IF(AND(RC[-3]<RC[-1],RC[-3]>=14,RC[-3]<15),35,IF(AND(RC[-3]<RC[-1],RC[-3]>=15,RC[-3]<16),30,IF(AND(RC[-3]<RC[-1],RC[-3]>=16,RC[-3]<17),25,IF(AND(RC[-3]<RC[-1],RC[-3]>=17,RC[-3]<18),20,IF(AND(RC[-3]<RC[-1],RC[-3]>=18,RC[-3]<19),15,IF(AND(RC[-3]<RC[-1],RC[-3]>=19,RC[-3]<20),10,IF(AND(RC[-3]<RC[-1],RC[-3]>=20,RC[-3]<21),5,IF(AND(RC[-3]<RC[-1],RC[-3]>=21),0,IF(AND(RC[-3]>RC[-1],RC[-3]>=2,RC[-3]<3),90,IF(AND(RC[-3]>RC[-1],RC[-3]>=3,RC[-3]<4),90,IF(AND(RC[-3]>RC[-1],RC[-3]>=4,RC[-3]<5),80,IF(AND(RC[-3]>RC[-1],RC[-3]>=5,RC[-3]<6),70,IF(AND(RC[-3]>RC[-1],RC[-3]>=6,RC[-3]<7),60,IF(AND(RC[-3]>RC[-1],RC[-3]>=7,RC[-3]<8),50,IF(AND(RC[-3]>RC[-1],RC[-3]>=8,RC[-3]<9),40,IF(AND(RC[-3]>RC[-1],RC[-3]>=9,RC[-3]<10),30,IF(AND(RC[-3]>RC[-1],RC[-3]>=10,RC[-3]<11),20,IF(AND(RC[-3]>RC[-1],RC[-3]>=11,RC[-3]<12),10,IF(AND(RC[-3]>RC[-1],RC[-3]>=12),0))))))))))))))))))))))))))))))))) -> 60 | H425: =IF(RC[-3]="","",IF(RC[-3]<0.3,100,IF(AND(RC[-3]>=0.3,RC[-3]>0.4),95,IF(AND(RC[-3]>=0.4,RC[-3]<0.5),90,IF(AND(RC[-3]>=0.5,RC[-3]<0.6),85,IF(AND(RC[-3]>=0.6,RC[-3]<0.7),80,IF(AND(RC[-3]>=0.6,RC[-3]<1),80,IF(AND(RC[-3]>1,RC[-3]<2),50,IF(RC[-3]>2,0))))))))) ->  | I425: =IF(RC[-1]="",RC[-2],0.7*RC[-1]+0.3*RC[-2]) -> 60
A426: تولی پرس | B426: شتولی | C426: =VLOOKUP(RC[-1],Sheet1!R3C2:R802C3,2,FALSE) -> شیمیایی | D426: =VLOOKUP(RC[-2],Sheet1!R3C2:R802C9,8,FALSE) -> 777.27084601338254 | E426: =IF(VLOOKUP(RC[-3],Sheet1!R3C2:R803C11,10,FALSE)=0,"",VLOOKUP(Sheet2!RC[-3],Sheet1!R[1]C[-3]:R[801]C[6],10,FALSE)) ->  | F426: =Sheet1!R488C10 -> 5.0300989663672855 | G426: =IF(RC[-3]<0,0,IF(AND(RC[-3]<RC[-1],RC[-3]<2),100,IF(AND(RC[-3]<RC[-1],RC[-3]>=2,RC[-3]<3),95,IF(AND(RC[-3]<RC[-1],RC[-3]>=3,RC[-3]<4),90,IF(AND(RC[-3]<RC[-1],RC[-3]>=4,RC[-3]<5),85,IF(AND(RC[-3]<RC[-1],RC[-3]>=5,RC[-3]<6),80,IF(AND(RC[-3]<RC[-1],RC[-3]>=6,RC[-3]<7),75,IF(AND(RC[-3]<RC[-1],RC[-3]>=7,RC[-3]<8),70,IF(AND(RC[-3]<RC[-1],RC[-3]>=8,RC[-3]<9),65,IF(AND(RC[-3]<RC[-1],RC[-3]>=9,RC[-3]<10),60,IF(AND(RC[-3]<RC[-1],RC[-3]>=10,RC[-3]<11),55,IF(AND(RC[-3]<RC[-1],RC[-3]>=11,RC[-3]<12),50,IF(AND(RC[-3]<RC[-1],RC[-3]>=12,RC[-3]<13),45,IF(AND(RC[-3]<RC[-1],RC[-3]>=13,RC[-3]<14),40,IF(AND(RC[-3]<RC[-1],RC[-3]>=14,RC[-3]<15),35,IF(AND(RC[-3]<RC[-1],RC[-3]>=15,RC[-3]<16),30,IF(AND(RC[-3]<RC[-1],RC[-3]>=16,RC[-3]<17),25,IF(AND(RC[-3]<RC[-1],RC[-3]>=17,RC[-3]<18),20,IF(AND(RC[-3]<RC[-1],RC[-3]>=18,RC[-3]<19),15,IF(AND(RC[-3]<RC[-1],RC[-3]>=19,RC[-3]<20),10,IF(AND(RC[-3]<RC[-1],RC[-3]>=20,RC[-3]<21),5,IF(AND(RC[-3]<RC[-1],RC[-3]>=21),0,IF(AND(RC[-3]>RC[-1],RC[-3]>=2,RC[-3]<3),90,IF(AND(RC[-3]>RC[-1],RC[-3]>=3,RC[-3]<4),90,IF(AND(RC[-3]>RC[-1],RC[-3]>=4,RC[-3]<5),80,IF(AND(RC[-3]>RC[-1],RC[-3]>=5,RC[-3]<6),70,IF(AND(RC[-3]>RC[-1],RC[-3]>=6,RC[-3]<7),60,IF(AND(RC[-3]>RC[-1],RC[-3]>=7,RC[-3]<8),50,IF(AND(RC[-3]>RC[-1],RC[-3]>=8,RC[-3]<9),40,IF(AND(RC[-3]>RC[-1],RC[-3]>=9,RC[-3]<10),30,IF(AND(RC[-3]>RC[-1],RC[-3]>=10,RC[-3]<11),20,IF(AND(RC[-3]>RC[-1],RC[-3]>=11,RC[-3]<12),10,IF(AND(RC[-3]>RC[-1],RC[-3]>=12),0))))))))))))))))))))))))))))))))) -> 0 | H426: =IF(RC[-3]="","",IF(RC[-3]<0.3,100,IF(AND(RC[-3]>=0.3,RC[-3]>0.4),95,IF(AND(RC[-3]>=0.4,RC[-3]<0.5),90,IF(AND(RC[-3]>=0.5,RC[-3]<0.6),85,IF(AND(RC[-3]>=0.6,RC[-3]<0.7),80,IF(AND(RC[-3]>=0.6,RC[-3]<1),80,IF(AND(RC[-3]>1,RC[-3]<2),50,IF(RC[-3]>2,0))))))))) ->  | I426: =IF(RC[-1]="",RC[-2],0.7*RC[-1]+0.3*RC[-2]) -> 0
A427: تولید دارو | B427: تولیددارو | C427: =VLOOKUP(RC[-1],Sheet1!R3C2:R802C3,2,FALSE) -> شیمیایی | D427: =VLOOKUP(RC[-2],Sheet1!R3C2:R802C9,8,FALSE) -> 1.1121372549019608 | E427: =IF(VLOOKUP(RC[-3],Sheet1!R3C2:R803C11,10,FALSE)=0,"",VLOOKUP(Sheet2!RC[-3],Sheet1!R[1]C[-3]:R[801]C[6],10,FALSE)) ->  | F427: =Sheet1!R488C10 -> 5.0300989663672855 | G427: =IF(RC[-3]<0,0,IF(AND(RC[-3]<RC[-1],RC[-3]<2),100,IF(AND(RC[-3]<RC[-1],RC[-3]>=2,RC[-3]<3),95,IF(AND(RC[-3]<RC[-1],RC[-3]>=3,RC[-3]<4),90,IF(AND(RC[-3]<RC[-1],RC[-3]>=4,RC[-3]<5),85,IF(AND(RC[-3]<RC[-1],RC[-3]>=5,RC[-3]<6),80,IF(AND(RC[-3]<RC[-1],RC[-3]>=6,RC[-3]<7),75,IF(AND(RC[-3]<RC[-1],RC[-3]>=7,RC[-3]<8),70,IF(AND(RC[-3]<RC[-1],RC[-3]>=8,RC[-3]<9),65,IF(AND(RC[-3]<RC[-1],RC[-3]>=9,RC[-3]<10),60,IF(AND(RC[-3]<RC[-1],RC[-3]>=10,RC[-3]<11),55,IF(AND(RC[-3]<RC[-1],RC[-3]>=11,RC[-3]<12),50,IF(AND(RC[-3]<RC[-1],RC[-3]>=12,RC[-3]<13),45,IF(AND(RC[-3]<RC[-1],RC[-3]>=13,RC[-3]<14),40,IF(AND(RC[-3]<RC[-1],RC[-3]>=14,RC[-3]<15),35,IF(AND(RC[-3]<RC[-1],RC[-3]>=15,RC[-3]<16),30,IF(AND(RC[-3]<RC[-1],RC[-3]>=16,RC[-3]<17),25,IF(AND(RC[-3]<RC[-1],RC[-3]>=17,RC[-3]<18),20,IF(AND(RC[-3]<RC[-1],RC[-3]>=18,RC[-3]<19),15,IF(AND(RC[-3]<RC[-1],RC[-3]>=19,RC[-3]<20),10,IF(AND(RC[-3]<RC[-1],RC[-3]>=20,RC[-3]<21),5,IF(AND(RC[-3]<RC[-1],RC[-3]>=21),0,IF(AND(RC[-3]>RC[-1],RC[-3]>=2,RC[-3]<3),90,IF(AND(RC[-3]>RC[-1],RC[-3]>=3,RC[-3]<4),90,IF(AND(RC[-3]>RC[-1],RC[-3]>=4,RC[-3]<5),80,IF(AND(RC[-3]>RC[-1],RC[-3]>=5,RC[-3]<6),70,IF(AND(RC[-3]>RC[-1],RC[-3]>=6,RC[-3]<7),60,IF(AND(RC[-3]>RC[-1],RC[-3]>=7,RC[-3]<8),50,IF(AND(RC[-3]>RC[-1],RC[-3]>=8,RC[-3]<9),40,IF(AND(RC[-3]>RC[-1],RC[-3]>=9,RC[-3]<10),30,IF(AND(RC[-3]>RC[-1],RC[-3]>=10,RC[-3]<11),20,IF(AND(RC[-3]>RC[-1],RC[-3]>=11,RC[-3]<12),10,IF(AND(RC[-3]>RC[-1],RC[-3]>=12),0))))))))))))))))))))))))))))))))) -> 100 | H427: =IF(RC[-3]="","",IF(RC[-3]<0.3,100,IF(AND(RC[-3]>=0.3,RC[-3]>0.4),95,IF(AND(RC[-3]>=0.4,RC[-3]<0.5),90,IF(AND(RC[-3]>=0.5,RC[-3]<0.6),85,IF(AND(RC[-3]>=0.6,RC[-3]<0.7),80,IF(AND(RC[-3]>=0.6,RC[-3]<1),80,IF(AND(RC[-3]>1,RC[-3]<2),50,IF(RC[-3]>2,0))))))))) ->  | I427: =IF(RC[-1]="",RC[-2],0.7*RC[-1]+0.3*RC[-2]) -> 100
A428: توکا رنگ فولاد سپاهان | B428: شتوکا | C428: =VLOOKUP(RC[-1],Sheet1!R3C2:R802C3,2,FALSE) -> شیمیایی | D428: =VLOOKUP(RC[-2],Sheet1!R3C2:R802C9,8,FALSE) -> 10.116632708961543 | E428: =IF(VLOOKUP(RC[-3],Sheet1!R3C2:R803C11,10,FALSE)=0,"",VLOOKUP(Sheet2!RC[-3],Sheet1!R[1]C[-3]:R[801]C[6],10,FALSE)) ->  | F428: =Sheet1!R488C10 -> 5.0300989663672855 | G428: =IF(RC[-3]<0,0,IF(AND(RC[-3]<RC[-1],RC[-3]<2),100,IF(AND(RC[-3]<RC[-1],RC[-3]>=2,RC[-3]<3),95,IF(AND(RC[-3]<RC[-1],RC[-3]>=3,RC[-3]<4),90,IF(AND(RC[-3]<RC[-1],RC[-3]>=4,RC[-3]<5),85,IF(AND(RC[-3]<RC[-1],RC[-3]>=5,RC[-3]<6),80,IF(AND(RC[-3]<RC[-1],RC[-3]>=6,RC[-3]<7),75,IF(AND(RC[-3]<RC[-1],RC[-3]>=7,RC[-3]<8),70,IF(AND(RC[-3]<RC[-1],RC[-3]>=8,RC[-3]<9),65,IF(AND(RC[-3]<RC[-1],RC[-3]>=9,RC[-3]<10),60,IF(AND(RC[-3]<RC[-1],RC[-3]>=10,RC[-3]<11),55,IF(AND(RC[-3]<RC[-1],RC[-3]>=11,RC[-3]<12),50,IF(AND(RC[-3]<RC[-1],RC[-3]>=12,RC[-3]<13),45,IF(AND(RC[-3]<RC[-1],RC[-3]>=13,RC[-3]<14),40,IF(AND(RC[-3]<RC[-1],RC[-3]>=14,RC[-3]<15),35,IF(AND(RC[-3]<RC[-1],RC[-3]>=15,RC[-3]<16),30,IF(AND(RC[-3]<RC[-1],RC[-3]>=16,RC[-3]<17),25,IF(AND(RC[-3]<RC[-1],RC[-3]>=17,RC[-3]<18),20,IF(AND(RC[-3]<RC[-1],RC[-3]>=18,RC[-3]<19),15,IF(AND(RC[-3]<RC[-1],RC[-3]>=19,RC[-3]<20),10,IF(AND(RC[-3]<RC[-1],RC[-3]>=20,RC[-3]<21),5,IF(AND(RC[-3]<RC[-1],RC[-3]>=21),0,IF(AND(RC[-3]>RC[-1],RC[-3]>=2,RC[-3]<3),90,IF(AND(RC[-3]>RC[-1],RC[-3]>=3,RC[-3]<4),90,IF(AND(RC[-3]>RC[-1],RC[-3]>=4,RC[-3]<5),80,IF(AND(RC[-3]>RC[-1],RC[-3]>=5,RC[-3]<6),70,IF(AND(RC[-3]>RC[-1],RC[-3]>=6,RC[-3]<7),60,IF(AND(RC[-3]>RC[-1],RC[-3]>=7,RC[-3]<8),50,IF(AND(RC[-3]>RC[-1],RC[-3]>=8,RC[-3]<9),40,IF(AND(RC[-3]>RC[-1],RC[-3]>=9,RC[-3]<10),30,IF(AND(RC[-3]>RC[-1],RC[-3]>=10,RC[-3]<11),20,IF(AND(RC[-3]>RC[-1],RC[-3]>=11,RC[-3]<12),10,IF(AND(RC[-3]>RC[-1],RC[-3]>=12),0))))))))))))))))))))))))))))))))) -> 20 | H428: =IF(RC[-3]="","",IF(RC[-3]<0.3,100,IF(AND(RC[-3]>=0.3,RC[-3]>0.4),95,IF(AND(RC[-3]>=0.4,RC[-3]<0.5),90,IF(AND(RC[-3]>=0.5,RC[-3]<0.6),85,IF(AND(RC[-3]>=0.6,RC[-3]<0.7),80,IF(AND(RC[-3]>=0.6,RC[-3]<1),80,IF(AND(RC[-3]>1,RC[-3]<2),50,IF(RC[-3]>2,0))))))))) ->  | I428: =IF(RC[-1]="",RC[-2],0.7*RC[-1]+0.3*RC[-2]) -> 20
A429: تکمیلی پتروشیمی خلیج فارس | B429: پترول | C429: =VLOOKUP(RC[-1],Sheet1!R3C2:R802C3,2,FALSE) -> شیمیایی | D429: =VLOOKUP(RC[-2],Sheet1!R3C2:R802C9,8,FALSE) -> 7.4491672517383343 | E429: =IF(VLOOKUP(RC[-3],Sheet1!R3C2:R803C11,10,FALSE)=0,"",VLOOKUP(Sheet2!RC[-3],Sheet1!R[1]C[-3]:R[801]C[6],10,FALSE)) -> 0.5 | F429: =Sheet1!R488C10 -> 5.0300989663672855 | G429: =IF(RC[-3]<0,0,IF(AND(RC[-3]<RC[-1],RC[-3]<2),100,IF(AND(RC[-3]<RC[-1],RC[-3]>=2,RC[-3]<3),95,IF(AND(RC[-3]<RC[-1],RC[-3]>=3,RC[-3]<4),90,IF(AND(RC[-3]<RC[-1],RC[-3]>=4,RC[-3]<5),85,IF(AND(RC[-3]<RC[-1],RC[-3]>=5,RC[-3]<6),80,IF(AND(RC[-3]<RC[-1],RC[-3]>=6,RC[-3]<7),75,IF(AND(RC[-3]<RC[-1],RC[-3]>=7,RC[-3]<8),70,IF(AND(RC[-3]<RC[-1],RC[-3]>=8,RC[-3]<9),65,IF(AND(RC[-3]<RC[-1],RC[-3]>=9,RC[-3]<10),60,IF(AND(RC[-3]<RC[-1],RC[-3]>=10,RC[-3]<11),55,IF(AND(RC[-3]<RC[-1],RC[-3]>=11,RC[-3]<12),50,IF(AND(RC[-3]<RC[-1],RC[-3]>=12,RC[-3]<13),45,IF(AND(RC[-3]<RC[-1],RC[-3]>=13,RC[-3]<14),40,IF(AND(RC[-3]<RC[-1],RC[-3]>=14,RC[-3]<15),35,IF(AND(RC[-3]<RC[-1],RC[-3]>=15,RC[-3]<16),30,IF(AND(RC[-3]<RC[-1],RC[-3]>=16,RC[-3]<17),25,IF(AND(RC[-3]<RC[-1],RC[-3]>=17,RC[-3]<18),20,IF(AND(RC[-3]<RC[-1],RC[-3]>=18,RC[-3]<19),15,IF(AND(RC[-3]<RC[-1],RC[-3]>=19,RC[-3]<20),10,IF(AND(RC[-3]<RC[-1],RC[-3]>=20,RC[-3]<21),5,IF(AND(RC[-3]<RC[-1],RC[-3]>=21),0,IF(AND(RC[-3]>RC[-1],RC[-3]>=2,RC[-3]<3),90,IF(AND(RC[-3]>RC[-1],RC[-3]>=3,RC[-3]<4),90,IF(AND(RC[-3]>RC[-1],RC[-3]>=4,RC[-3]<5),80,IF(AND(RC[-3]>RC[-1],RC[-3]>=5,RC[-3]<6),70,IF(AND(RC[-3]>RC[-1],RC[-3]>=6,RC[-3]<7),60,IF(AND(RC[-3]>RC[-1],RC[-3]>=7,RC[-3]<8),50,IF(AND(RC[-3]>RC[-1],RC[-3]>=8,RC[-3]<9),40,IF(AND(RC[-3]>RC[-1],RC[-3]>=9,RC[-3]<10),30,IF(AND(RC[-3]>RC[-1],RC[-3]>=10,RC[-3]<11),20,IF(AND(RC[-3]>RC[-1],RC[-3]>=11,RC[-3]<12),10,IF(AND(RC[-3]>RC[-1],RC[-3]>=12),0))))))))))))))))))))))))))))))))) -> 50 | H429: =IF(RC[-3]="","",IF(RC[-3]<0.3,100,IF(AND(RC[-3]>=0.3,RC[-3]>0.4),95,IF(AND(RC[-3]>=0.4,RC[-3]<0.5),90,IF(AND(RC[-3]>=0.5,RC[-3]<0.6),85,IF(AND(RC[-3]>=0.6,RC[-3]<0.7),80,IF(AND(RC[-3]>=0.6,RC[-3]<1),80,IF(AND(RC[-3]>1,RC[-3]<2),50,IF(RC[-3]>2,0))))))))) -> 95 | I429: =IF(RC[-1]="",RC[-2],0.7*RC[-1]+0.3*RC[-2]) -> 81.5
A430: دوده صنعتی پارس | B430: شدوص | C430: =VLOOKUP(RC[-1],Sheet1!R3C2:R802C3,2,FALSE) -> شیمیایی | D430: =VLOOKUP(RC[-2],Sheet1!R3C2:R802C9,8,FALSE) -> 3.3294461225583709 | E430: =IF(VLOOKUP(RC[-3],Sheet1!R3C2:R803C11,10,FALSE)=0,"",VLOOKUP(Sheet2!RC[-3],Sheet1!R[1]C[-3]:R[801]C[6],10,FALSE)) ->  | F430: =Sheet1!R488C10 -> 5.0300989663672855 | G430: =IF(RC[-3]<0,0,IF(AND(RC[-3]<RC[-1],RC[-3]<2),100,IF(AND(RC[-3]<RC[-1],RC[-3]>=2,RC[-3]<3),95,IF(AND(RC[-3]<RC[-1],RC[-3]>=3,RC[-3]<4),90,IF(AND(RC[-3]<RC[-1],RC[-3]>=4,RC[-3]<5),85,IF(AND(RC[-3]<RC[-1],RC[-3]>=5,RC[-3]<6),80,IF(AND(RC[-3]<RC[-1],RC[-3]>=6,RC[-3]<7),75,IF(AND(RC[-3]<RC[-1],RC[-3]>=7,RC[-3]<8),70,IF(AND(RC[-3]<RC[-1],RC[-3]>=8,RC[-3]<9),65,IF(AND(RC[-3]<RC[-1],RC[-3]>=9,RC[-3]<10),60,IF(AND(RC[-3]<RC[-1],RC[-3]>=10,RC[-3]<11),55,IF(AND(RC[-3]<RC[-1],RC[-3]>=11,RC[-3]<12),50,IF(AND(RC[-3]<RC[-1],RC[-3]>=12,RC[-3]<13),45,IF(AND(RC[-3]<RC[-1],RC[-3]>=13,RC[-3]<14),40,IF(AND(RC[-3]<RC[-1],RC[-3]>=14,RC[-3]<15),35,IF(AND(RC[-3]<RC[-1],RC[-3]>=15,RC[-3]<16),30,IF(AND(RC[-3]<RC[-1],RC[-3]>=16,RC[-3]<17),25,IF(AND(RC[-3]<RC[-1],RC[-3]>=17,RC[-3]<18),20,IF(AND(RC[-3]<RC[-1],RC[-3]>=18,RC[-3]<19),15,IF(AND(RC[-3]<RC[-1],RC[-3]>=19,RC[-3]<20),10,IF(AND(RC[-3]<RC[-1],RC[-3]>=20,RC[-3]<21),5,IF(AND(RC[-3]<RC[-1],RC[-3]>=21),0,IF(AND(RC[-3]>RC[-1],RC[-3]>=2,RC[-3]<3),90,IF(AND(RC[-3]>RC[-1],RC[-3]>=3,RC[-3]<4),90,IF(AND(RC[-3]>RC[-1],RC[-3]>=4,RC[-3]<5),80,IF(AND(RC[-3]>RC[-1],RC[-3]>=5,RC[-3]<6),70,IF(AND(RC[-3]>RC[-1],RC[-3]>=6,RC[-3]<7),60,IF(AND(RC[-3]>RC[-1],RC[-3]>=7,RC[-3]<8),50,IF(AND(RC[-3]>RC[-1],RC[-3]>=8,RC[-3]<9),40,IF(AND(RC[-3]>RC[-1],RC[-3]>=9,RC[-3]<10),30,IF(AND(RC[-3]>RC[-1],RC[-3]>=10,RC[-3]<11),20,IF(AND(RC[-3]>RC[-1],RC[-3]>=11,RC[-3]<12),10,IF(AND(RC[-3]>RC[-1],RC[-3]>=12),0))))))))))))))))))))))))))))))))) -> 90 | H430: =IF(RC[-3]="","",IF(RC[-3]<0.3,100,IF(AND(RC[-3]>=0.3,RC[-3]>0.4),95,IF(AND(RC[-3]>=0.4,RC[-3]<0.5),90,IF(AND(RC[-3]>=0.5,RC[-3]<0.6),85,IF(AND(RC[-3]>=0.6,RC[-3]<0.7),80,IF(AND(RC[-3]>=0.6,RC[-3]<1),80,IF(AND(RC[-3]>1,RC[-3]<2),50,IF(RC[-3]>2,0))))))))) ->  | I430: =IF(RC[-1]="",RC[-2],0.7*RC[-1]+0.3*RC[-2]) -> 90
A431: رنگین | B431: شرنگی | C431: =VLOOKUP(RC[-1],Sheet1!R3C2:R802C3,2,FALSE) -> شیمیایی | D431: =VLOOKUP(RC[-2],Sheet1!R3C2:R802C9,8,FALSE) -> 16.818795194003386 | E431: =IF(VLOOKUP(RC[-3],Sheet1!R3C2:R803C11,10,FALSE)=0,"",VLOOKUP(Sheet2!RC[-3],Sheet1!R[1]C[-3]:R[801]C[6],10,FALSE)) ->  | F431: =Sheet1!R488C10 -> 5.0300989663672855 | G431: =IF(RC[-3]<0,0,IF(AND(RC[-3]<RC[-1],RC[-3]<2),100,IF(AND(RC[-3]<RC[-1],RC[-3]>=2,RC[-3]<3),95,IF(AND(RC[-3]<RC[-1],RC[-3]>=3,RC[-3]<4),90,IF(AND(RC[-3]<RC[-1],RC[-3]>=4,RC[-3]<5),85,IF(AND(RC[-3]<RC[-1],RC[-3]>=5,RC[-3]<6),80,IF(AND(RC[-3]<RC[-1],RC[-3]>=6,RC[-3]<7),75,IF(AND(RC[-3]<RC[-1],RC[-3]>=7,RC[-3]<8),70,IF(AND(RC[-3]<RC[-1],RC[-3]>=8,RC[-3]<9),65,IF(AND(RC[-3]<RC[-1],RC[-3]>=9,RC[-3]<10),60,IF(AND(RC[-3]<RC[-1],RC[-3]>=10,RC[-3]<11),55,IF(AND(RC[-3]<RC[-1],RC[-3]>=11,RC[-3]<12),50,IF(AND(RC[-3]<RC[-1],RC[-3]>=12,RC[-3]<13),45,IF(AND(RC[-3]<RC[-1],RC[-3]>=13,RC[-3]<14),40,IF(AND(RC[-3]<RC[-1],RC[-3]>=14,RC[-3]<15),35,IF(AND(RC[-3]<RC[-1],RC[-3]>=15,RC[-3]<16),30,IF(AND(RC[-3]<RC[-1],RC[-3]>=16,RC[-3]<17),25,IF(AND(RC[-3]<RC[-1],RC[-3]>=17,RC[-3]<18),20,IF(AND(RC[-3]<RC[-1],RC[-3]>=18,RC[-3]<19),15,IF(AND(RC[-3]<RC[-1],RC[-3]>=19,RC[-3]<20),10,IF(AND(RC[-3]<RC[-1],RC[-3]>=20,RC[-3]<21),5,IF(AND(RC[-3]<RC[-1],RC[-3]>=21),0,IF(AND(RC[-3]>RC[-1],RC[-3]>=2,RC[-3]<3),90,IF(AND(RC[-3]>RC[-1],RC[-3]>=3,RC[-3]<4),90,IF(AND(RC[-3]>RC[-1],RC[-3]>=4,RC[-3]<5),80,IF(AND(RC[-3]>RC[-1],RC[-3]>=5,RC[-3]<6),70,IF(AND(RC[-3]>RC[-1],RC[-3]>=6,RC[-3]<7),60,IF(AND(RC[-3]>RC[-1],RC[-3]>=7,RC[-3]<8),50,IF(AND(RC[-3]>RC[-1],RC[-3]>=8,RC[-3]<9),40,IF(AND(RC[-3]>RC[-1],RC[-3]>=9,RC[-3]<10),30,IF(AND(RC[-3]>RC[-1],RC[-3]>=10,RC[-3]<11),20,IF(AND(RC[-3]>RC[-1],RC[-3]>=11,RC[-3]<12),10,IF(AND(RC[-3]>RC[-1],RC[-3]>=12),0))))))))))))))))))))))))))))))))) -> 0 | H431: =IF(RC[-3]="","",IF(RC[-3]<0.3,100,IF(AND(RC[-3]>=0.3,RC[-3]>0.4),95,IF(AND(RC[-3]>=0.4,RC[-3]<0.5),90,IF(AND(RC[-3]>=0.5,RC[-3]<0.6),85,IF(AND(RC[-3]>=0.6,RC[-3]<0.7),80,IF(AND(RC[-3]>=0.6,RC[-3]<1),80,IF(AND(RC[-3]>1,RC[-3]<2),50,IF(RC[-3]>2,0))))))))) ->  | I431: =IF(RC[-1]="",RC[-2],0.7*RC[-1]+0.3*RC[-2]) -> 0
A432: سر. پتروشیمی | B432: وپترو | C432: =VLOOKUP(RC[-1],Sheet1!R3C2:R802C3,2,FALSE) -> شیمیایی | D432: =VLOOKUP(RC[-2],Sheet1!R3C2:R802C9,8,FALSE) -> 5.191932846620074 | E432: =IF(VLOOKUP(RC[-3],Sheet1!R3C2:R803C11,10,FALSE)=0,"",VLOOKUP(Sheet2!RC[-3],Sheet1!R[1]C[-3]:R[801]C[6],10,FALSE)) -> 1.1200000000000001 | F432: =Sheet1!R488C10 -> 5.0300989663672855 | G432: =IF(RC[-3]<0,0,IF(AND(RC[-3]<RC[-1],RC[-3]<2),100,IF(AND(RC[-3]<RC[-1],RC[-3]>=2,RC[-3]<3),95,IF(AND(RC[-3]<RC[-1],RC[-3]>=3,RC[-3]<4),90,IF(AND(RC[-3]<RC[-1],RC[-3]>=4,RC[-3]<5),85,IF(AND(RC[-3]<RC[-1],RC[-3]>=5,RC[-3]<6),80,IF(AND(RC[-3]<RC[-1],RC[-3]>=6,RC[-3]<7),75,IF(AND(RC[-3]<RC[-1],RC[-3]>=7,RC[-3]<8),70,IF(AND(RC[-3]<RC[-1],RC[-3]>=8,RC[-3]<9),65,IF(AND(RC[-3]<RC[-1],RC[-3]>=9,RC[-3]<10),60,IF(AND(RC[-3]<RC[-1],RC[-3]>=10,RC[-3]<11),55,IF(AND(RC[-3]<RC[-1],RC[-3]>=11,RC[-3]<12),50,IF(AND(RC[-3]<RC[-1],RC[-3]>=12,RC[-3]<13),45,IF(AND(RC[-3]<RC[-1],RC[-3]>=13,RC[-3]<14),40,IF(AND(RC[-3]<RC[-1],RC[-3]>=14,RC[-3]<15),35,IF(AND(RC[-3]<RC[-1],RC[-3]>=15,RC[-3]<16),30,IF(AND(RC[-3]<RC[-1],RC[-3]>=16,RC[-3]<17),25,IF(AND(RC[-3]<RC[-1],RC[-3]>=17,RC[-3]<18),20,IF(AND(RC[-3]<RC[-1],RC[-3]>=18,RC[-3]<19),15,IF(AND(RC[-3]<RC[-1],RC[-3]>=19,RC[-3]<20),10,IF(AND(RC[-3]<RC[-1],RC[-3]>=20,RC[-3]<21),5,IF(AND(RC[-3]<RC[-1],RC[-3]>=21),0,IF(AND(RC[-3]>RC[-1],RC[-3]>=2,RC[-3]<3),90,IF(AND(RC[-3]>RC[-1],RC[-3]>=3,RC[-3]<4),90,IF(AND(RC[-3]>RC[-1],RC[-3]>=4,RC[-3]<5),80,IF(AND(RC[-3]>RC[-1],RC[-3]>=5,RC[-3]<6),70,IF(AND(RC[-3]>RC[-1],RC[-3]>=6,RC[-3]<7),60,IF(AND(RC[-3]>RC[-1],RC[-3]>=7,RC[-3]<8),50,IF(AND(RC[-3]>RC[-1],RC[-3]>=8,RC[-3]<9),40,IF(AND(RC[-3]>RC[-1],RC[-3]>=9,RC[-3]<10),30,IF(AND(RC[-3]>RC[-1],RC[-3]>=10,RC[-3]<11),20,IF(AND(RC[-3]>RC[-1],RC[-3]>=11,RC[-3]<12),10,IF(AND(RC[-3]>RC[-1],RC[-3]>=12),0))))))))))))))))))))))))))))))))) -> 70 | H432: =IF(RC[-3]="","",IF(RC[-3]<0.3,100,IF(AND(RC[-3]>=0.3,RC[-3]>0.4),95,IF(AND(RC[-3]>=0.4,RC[-3]<0.5),90,IF(AND(RC[-3]>=0.5,RC[-3]<0.6),85,IF(AND(RC[-3]>=0.6,RC[-3]<0.7),80,IF(AND(RC[-3]>=0.6,RC[-3]<1),80,IF(AND(RC[-3]>1,RC[-3]<2),50,IF(RC[-3]>2,0))))))))) -> 95 | I432: =IF(RC[-1]="",RC[-2],0.7*RC[-1]+0.3*RC[-2]) -> 87.5
A433: سر. نفت و گاز تامین | B433: تاپیکو | C433: =VLOOKUP(RC[-1],Sheet1!R3C2:R802C3,2,FALSE) -> شیمیایی | D433: =VLOOKUP(RC[-2],Sheet1!R3C2:R802C9,8,FALSE) -> 3.6816356294203803 | E433: =IF(VLOOKUP(RC[-3],Sheet1!R3C2:R803C11,10,FALSE)=0,"",VLOOKUP(Sheet2!RC[-3],Sheet1!R[1]C[-3]:R[801]C[6],10,FALSE)) -> 0.55000000000000004 | F433: =Sheet1!R488C10 -> 5.0300989663672855 | G433: =IF(RC[-3]<0,0,IF(AND(RC[-3]<RC[-1],RC[-3]<2),100,IF(AND(RC[-3]<RC[-1],RC[-3]>=2,RC[-3]<3),95,IF(AND(RC[-3]<RC[-1],RC[-3]>=3,RC[-3]<4),90,IF(AND(RC[-3]<RC[-1],RC[-3]>=4,RC[-3]<5),85,IF(AND(RC[-3]<RC[-1],RC[-3]>=5,RC[-3]<6),80,IF(AND(RC[-3]<RC[-1],RC[-3]>=6,RC[-3]<7),75,IF(AND(RC[-3]<RC[-1],RC[-3]>=7,RC[-3]<8),70,IF(AND(RC[-3]<RC[-1],RC[-3]>=8,RC[-3]<9),65,IF(AND(RC[-3]<RC[-1],RC[-3]>=9,RC[-3]<10),60,IF(AND(RC[-3]<RC[-1],RC[-3]>=10,RC[-3]<11),55,IF(AND(RC[-3]<RC[-1],RC[-3]>=11,RC[-3]<12),50,IF(AND(RC[-3]<RC[-1],RC[-3]>=12,RC[-3]<13),45,IF(AND(RC[-3]<RC[-1],RC[-3]>=13,RC[-3]<14),40,IF(AND(RC[-3]<RC[-1],RC[-3]>=14,RC[-3]<15),35,IF(AND(RC[-3]<RC[-1],RC[-3]>=15,RC[-3]<16),30,IF(AND(RC[-3]<RC[-1],RC[-3]>=16,RC[-3]<17),25,IF(AND(RC[-3]<RC[-1],RC[-3]>=17,RC[-3]<18),20,IF(AND(RC[-3]<RC[-1],RC[-3]>=18,RC[-3]<19),15,IF(AND(RC[-3]<RC[-1],RC[-3]>=19,RC[-3]<20),10,IF(AND(RC[-3]<RC[-1],RC[-3]>=20,RC[-3]<21),5,IF(AND(RC[-3]<RC[-1],RC[-3]>=21),0,IF(AND(RC[-3]>RC[-1],RC[-3]>=2,RC[-3]<3),90,IF(AND(RC[-3]>RC[-1],RC[-3]>=3,RC[-3]<4),90,IF(AND(RC[-3]>RC[-1],RC[-3]>=4,RC[-3]<5),80,IF(AND(RC[-3]>RC[-1],RC[-3]>=5,RC[-3]<6),70,IF(AND(RC[-3]>RC[-1],RC[-3]>=6,RC[-3]<7),60,IF(AND(RC[-3]>RC[-1],RC[-3]>=7,RC[-3]<8),50,IF(AND(RC[-3]>RC[-1],RC[-3]>=8,RC[-3]<9),40,IF(AND(RC[-3]>RC[-1],RC[-3]>=9,RC[-3]<10),30,IF(AND(RC[-3]>RC[-1],RC[-3]>=10,RC[-3]<11),20,IF(AND(RC[-3]>RC[-1],RC[-3]>=11,RC[-3]<12),10,IF(AND(RC[-3]>RC[-1],RC[-3]>=12),0))))))))))))))))))))))))))))))))) -> 90 | H433: =IF(RC[-3]="","",IF(RC[-3]<0.3,100,IF(AND(RC[-3]>=0.3,RC[-3]>0.4),95,IF(AND(RC[-3]>=0.4,RC[-3]<0.5),90,IF(AND(RC[-3]>=0.5,RC[-3]<0.6),85,IF(AND(RC[-3]>=0.6,RC[-3]<0.7),80,IF(AND(RC[-3]>=0.6,RC[-3]<1),80,IF(AND(RC[-3]>1,RC[-3]<2),50,IF(RC[-3]>2,0))))))))) -> 95 | I433: =IF(RC[-1]="",RC[-2],0.7*RC[-1]+0.3*RC[-2]) -> 93.5
A434: سموم علف کش | B434: شسم | C434: =VLOOKUP(RC[-1],Sheet1!R3C2:R802C3,2,FALSE) -> شیمیایی | D434: =VLOOKUP(RC[-2],Sheet1!R3C2:R802C9,8,FALSE) -> 766.67360301953192 | E434: =IF(VLOOKUP(RC[-3],Sheet1!R3C2:R803C11,10,FALSE)=0,"",VLOOKUP(Sheet2!RC[-3],Sheet1!R[1]C[-3]:R[801]C[6],10,FALSE)) ->  | F434: =Sheet1!R488C10 -> 5.0300989663672855 | G434: =IF(RC[-3]<0,0,IF(AND(RC[-3]<RC[-1],RC[-3]<2),100,IF(AND(RC[-3]<RC[-1],RC[-3]>=2,RC[-3]<3),95,IF(AND(RC[-3]<RC[-1],RC[-3]>=3,RC[-3]<4),90,IF(AND(RC[-3]<RC[-1],RC[-3]>=4,RC[-3]<5),85,IF(AND(RC[-3]<RC[-1],RC[-3]>=5,RC[-3]<6),80,IF(AND(RC[-3]<RC[-1],RC[-3]>=6,RC[-3]<7),75,IF(AND(RC[-3]<RC[-1],RC[-3]>=7,RC[-3]<8),70,IF(AND(RC[-3]<RC[-1],RC[-3]>=8,RC[-3]<9),65,IF(AND(RC[-3]<RC[-1],RC[-3]>=9,RC[-3]<10),60,IF(AND(RC[-3]<RC[-1],RC[-3]>=10,RC[-3]<11),55,IF(AND(RC[-3]<RC[-1],RC[-3]>=11,RC[-3]<12),50,IF(AND(RC[-3]<RC[-1],RC[-3]>=12,RC[-3]<13),45,IF(AND(RC[-3]<RC[-1],RC[-3]>=13,RC[-3]<14),40,IF(AND(RC[-3]<RC[-1],RC[-3]>=14,RC[-3]<15),35,IF(AND(RC[-3]<RC[-1],RC[-3]>=15,RC[-3]<16),30,IF(AND(RC[-3]<RC[-1],RC[-3]>=16,RC[-3]<17),25,IF(AND(RC[-3]<RC[-1],RC[-3]>=17,RC[-3]<18),20,IF(AND(RC[-3]<RC[-1],RC[-3]>=18,RC[-3]<19),15,IF(AND(RC[-3]<RC[-1],RC[-3]>=19,RC[-3]<20),10,IF(AND(RC[-3]<RC[-1],RC[-3]>=20,RC[-3]<21),5,IF(AND(RC[-3]<RC[-1],RC[-3]>=21),0,IF(AND(RC[-3]>RC[-1],RC[-3]>=2,RC[-3]<3),90,IF(AND(RC[-3]>RC[-1],RC[-3]>=3,RC[-3]<4),90,IF(AND(RC[-3]>RC[-1],RC[-3]>=4,RC[-3]<5),80,IF(AND(RC[-3]>RC[-1],RC[-3]>=5,RC[-3]<6),70,IF(AND(RC[-3]>RC[-1],RC[-3]>=6,RC[-3]<7),60,IF(AND(RC[-3]>RC[-1],RC[-3]>=7,RC[-3]<8),50,IF(AND(RC[-3]>RC[-1],RC[-3]>=8,RC[-3]<9),40,IF(AND(RC[-3]>RC[-1],RC[-3]>=9,RC[-3]<10),30,IF(AND(RC[-3]>RC[-1],RC[-3]>=10,RC[-3]<11),20,IF(AND(RC[-3]>RC[-1],RC[-3]>=11,RC[-3]<12),10,IF(AND(RC[-3]>RC[-1],RC[-3]>=12),0))))))))))))))))))))))))))))))))) -> 0 | H434: =IF(RC[-3]="","",IF(RC[-3]<0.3,100,IF(AND(RC[-3]>=0.3,RC[-3]>0.4),95,IF(AND(RC[-3]>=0.4,RC[-3]<0.5),90,IF(AND(RC[-3]>=0.5,RC[-3]<0.6),85,IF(AND(RC[-3]>=0.6,RC[-3]<0.7),80,IF(AND(RC[-3]>=0.6,RC[-3]<1),80,IF(AND(RC[-3]>1,RC[-3]<2),50,IF(RC[-3]>2,0))))))))) ->  | I434: =IF(RC[-1]="",RC[-2],0.7*RC[-1]+0.3*RC[-2]) -> 0
A435: شیمیایی سینا | B435: شسینا | C435: =VLOOKUP(RC[-1],Sheet1!R3C2:R802C3,2,FALSE) -> شیمیایی | D435: =VLOOKUP(RC[-2],Sheet1!R3C2:R802C9,8,FALSE) -> 8.9851495368591667 | E435: =IF(VLOOKUP(RC[-3],Sheet1!R3C2:R803C11,10,FALSE)=0,"",VLOOKUP(Sheet2!RC[-3],Sheet1!R[1]C[-3]:R[801]C[6],10,FALSE)) ->  | F435: =Sheet1!R488C10 -> 5.0300989663672855 | G435: =IF(RC[-3]<0,0,IF(AND(RC[-3]<RC[-1],RC[-3]<2),100,IF(AND(RC[-3]<RC[-1],RC[-3]>=2,RC[-3]<3),95,IF(AND(RC[-3]<RC[-1],RC[-3]>=3,RC[-3]<4),90,IF(AND(RC[-3]<RC[-1],RC[-3]>=4,RC[-3]<5),85,IF(AND(RC[-3]<RC[-1],RC[-3]>=5,RC[-3]<6),80,IF(AND(RC[-3]<RC[-1],RC[-3]>=6,RC[-3]<7),75,IF(AND(RC[-3]<RC[-1],RC[-3]>=7,RC[-3]<8),70,IF(AND(RC[-3]<RC[-1],RC[-3]>=8,RC[-3]<9),65,IF(AND(RC[-3]<RC[-1],RC[-3]>=9,RC[-3]<10),60,IF(AND(RC[-3]<RC[-1],RC[-3]>=10,RC[-3]<11),55,IF(AND(RC[-3]<RC[-1],RC[-3]>=11,RC[-3]<12),50,IF(AND(RC[-3]<RC[-1],RC[-3]>=12,RC[-3]<13),45,IF(AND(RC[-3]<RC[-1],RC[-3]>=13,RC[-3]<14),40,IF(AND(RC[-3]<RC[-1],RC[-3]>=14,RC[-3]<15),35,IF(AND(RC[-3]<RC[-1],RC[-3]>=15,RC[-3]<16),30,IF(AND(RC[-3]<RC[-1],RC[-3]>=16,RC[-3]<17),25,IF(AND(RC[-3]<RC[-1],RC[-3]>=17,RC[-3]<18),20,IF(AND(RC[-3]<RC[-1],RC[-3]>=18,RC[-3]<19),15,IF(AND(RC[-3]<RC[-1],RC[-3]>=19,RC[-3]<20),10,IF(AND(RC[-3]<RC[-1],RC[-3]>=20,RC[-3]<21),5,IF(AND(RC[-3]<RC[-1],RC[-3]>=21),0,IF(AND(RC[-3]>RC[-1],RC[-3]>=2,RC[-3]<3),90,IF(AND(RC[-3]>RC[-1],RC[-3]>=3,RC[-3]<4),90,IF(AND(RC[-3]>RC[-1],RC[-3]>=4,RC[-3]<5),80,IF(AND(RC[-3]>RC[-1],RC[-3]>=5,RC[-3]<6),70,IF(AND(RC[-3]>RC[-1],RC[-3]>=6,RC[-3]<7),60,IF(AND(RC[-3]>RC[-1],RC[-3]>=7,RC[-3]<8),50,IF(AND(RC[-3]>RC[-1],RC[-3]>=8,RC[-3]<9),40,IF(AND(RC[-3]>RC[-1],RC[-3]>=9,RC[-3]<10),30,IF(AND(RC[-3]>RC[-1],RC[-3]>=10,RC[-3]<11),20,IF(AND(RC[-3]>RC[-1],RC[-3]>=11,RC[-3]<12),10,IF(AND(RC[-3]>RC[-1],RC[-3]>=12),0))))))))))))))))))))))))))))))))) -> 40 | H435: =IF(RC[-3]="","",IF(RC[-3]<0.3,100,IF(AND(RC[-3]>=0.3,RC[-3]>0.4),95,IF(AND(RC[-3]>=0.4,RC[-3]<0.5),90,IF(AND(RC[-3]>=0.5,RC[-3]<0.6),85,IF(AND(RC[-3]>=0.6,RC[-3]<0.7),80,IF(AND(RC[-3]>=0.6,RC[-3]<1),80,IF(AND(RC[-3]>1,RC[-3]<2),50,IF(RC[-3]>2,0))))))))) ->  | I435: =IF(RC[-1]="",RC[-2],0.7*RC[-1]+0.3*RC[-2]) -> 40
A436: شیمیایی فارس | B436: شفارس | C436: =VLOOKUP(RC[-1],Sheet1!R3C2:R802C3,2,FALSE) -> شیمیایی | D436: =VLOOKUP(RC[-2],Sheet1!R3C2:R802C9,8,FALSE) -> 40.300642740085003 | E436: =IF(VLOOKUP(RC[-3],Sheet1!R3C2:R803C11,10,FALSE)=0,"",VLOOKUP(Sheet2!RC[-3],Sheet1!R[1]C[-3]:R[801]C[6],10,FALSE)) ->  | F436: =Sheet1!R488C10 -> 5.0300989663672855 | G436: =IF(RC[-3]<0,0,IF(AND(RC[-3]<RC[-1],RC[-3]<2),100,IF(AND(RC[-3]<RC[-1],RC[-3]>=2,RC[-3]<3),95,IF(AND(RC[-3]<RC[-1],RC[-3]>=3,RC[-3]<4),90,IF(AND(RC[-3]<RC[-1],RC[-3]>=4,RC[-3]<5),85,IF(AND(RC[-3]<RC[-1],RC[-3]>=5,RC[-3]<6),80,IF(AND(RC[-3]<RC[-1],RC[-3]>=6,RC[-3]<7),75,IF(AND(RC[-3]<RC[-1],RC[-3]>=7,RC[-3]<8),70,IF(AND(RC[-3]<RC[-1],RC[-3]>=8,RC[-3]<9),65,IF(AND(RC[-3]<RC[-1],RC[-3]>=9,RC[-3]<10),60,IF(AND(RC[-3]<RC[-1],RC[-3]>=10,RC[-3]<11),55,IF(AND(RC[-3]<RC[-1],RC[-3]>=11,RC[-3]<12),50,IF(AND(RC[-3]<RC[-1],RC[-3]>=12,RC[-3]<13),45,IF(AND(RC[-3]<RC[-1],RC[-3]>=13,RC[-3]<14),40,IF(AND(RC[-3]<RC[-1],RC[-3]>=14,RC[-3]<15),35,IF(AND(RC[-3]<RC[-1],RC[-3]>=15,RC[-3]<16),30,IF(AND(RC[-3]<RC[-1],RC[-3]>=16,RC[-3]<17),25,IF(AND(RC[-3]<RC[-1],RC[-3]>=17,RC[-3]<18),20,IF(AND(RC[-3]<RC[-1],RC[-3]>=18,RC[-3]<19),15,IF(AND(RC[-3]<RC[-1],RC[-3]>=19,RC[-3]<20),10,IF(AND(RC[-3]<RC[-1],RC[-3]>=20,RC[-3]<21),5,IF(AND(RC[-3]<RC[-1],RC[-3]>=21),0,IF(AND(RC[-3]>RC[-1],RC[-3]>=2,RC[-3]<3),90,IF(AND(RC[-3]>RC[-1],RC[-3]>=3,RC[-3]<4),90,IF(AND(RC[-3]>RC[-1],RC[-3]>=4,RC[-3]<5),80,IF(AND(RC[-3]>RC[-1],RC[-3]>=5,RC[-3]<6),70,IF(AND(RC[-3]>RC[-1],RC[-3]>=6,RC[-3]<7),60,IF(AND(RC[-3]>RC[-1],RC[-3]>=7,RC[-3]<8),50,IF(AND(RC[-3]>RC[-1],RC[-3]>=8,RC[-3]<9),40,IF(AND(RC[-3]>RC[-1],RC[-3]>=9,RC[-3]<10),30,IF(AND(RC[-3]>RC[-1],RC[-3]>=10,RC[-3]<11),20,IF(AND(RC[-3]>RC[-1],RC[-3]>=11,RC[-3]<12),10,IF(AND(RC[-3]>RC[-1],RC[-3]>=12),0))))))))))))))))))))))))))))))))) -> 0 | H436: =IF(RC[-3]="","",IF(RC[-3]<0.3,100,IF(AND(RC[-3]>=0.3,RC[-3]>0.4),95,IF(AND(RC[-3]>=0.4,RC[-3]<0.5),90,IF(AND(RC[-3]>=0.5,RC[-3]<0.6),85,IF(AND(RC[-3]>=0.6,RC[-3]<0.7),80,IF(AND(RC[-3]>=0.6,RC[-3]<1),80,IF(AND(RC[-3]>1,RC[-3]<2),50,IF(RC[-3]>2,0))))))))) ->  | I436: =IF(RC[-1]="",RC[-2],0.7*RC[-1]+0.3*RC[-2]) -> 0
A437: صنایع بهداشتی ساینا | B437: ساینا | C437: =VLOOKUP(RC[-1],Sheet1!R3C2:R802C3,2,FALSE) -> شیمیایی | D437: =VLOOKUP(RC[-2],Sheet1!R3C2:R802C9,8,FALSE) -> 73.174855338110774 | E437: =IF(VLOOKUP(RC[-3],Sheet1!R3C2:R803C11,10,FALSE)=0,"",VLOOKUP(Sheet2!RC[-3],Sheet1!R[1]C[-3]:R[801]C[6],10,FALSE)) ->  | F437: =Sheet1!R488C10 -> 5.0300989663672855 | G437: =IF(RC[-3]<0,0,IF(AND(RC[-3]<RC[-1],RC[-3]<2),100,IF(AND(RC[-3]<RC[-1],RC[-3]>=2,RC[-3]<3),95,IF(AND(RC[-3]<RC[-1],RC[-3]>=3,RC[-3]<4),90,IF(AND(RC[-3]<RC[-1],RC[-3]>=4,RC[-3]<5),85,IF(AND(RC[-3]<RC[-1],RC[-3]>=5,RC[-3]<6),80,IF(AND(RC[-3]<RC[-1],RC[-3]>=6,RC[-3]<7),75,IF(AND(RC[-3]<RC[-1],RC[-3]>=7,RC[-3]<8),70,IF(AND(RC[-3]<RC[-1],RC[-3]>=8,RC[-3]<9),65,IF(AND(RC[-3]<RC[-1],RC[-3]>=9,RC[-3]<10),60,IF(AND(RC[-3]<RC[-1],RC[-3]>=10,RC[-3]<11),55,IF(AND(RC[-3]<RC[-1],RC[-3]>=11,RC[-3]<12),50,IF(AND(RC[-3]<RC[-1],RC[-3]>=12,RC[-3]<13),45,IF(AND(RC[-3]<RC[-1],RC[-3]>=13,RC[-3]<14),40,IF(AND(RC[-3]<RC[-1],RC[-3]>=14,RC[-3]<15),35,IF(AND(RC[-3]<RC[-1],RC[-3]>=15,RC[-3]<16),30,IF(AND(RC[-3]<RC[-1],RC[-3]>=16,RC[-3]<17),25,IF(AND(RC[-3]<RC[-1],RC[-3]>=17,RC[-3]<18),20,IF(AND(RC[-3]<RC[-1],RC[-3]>=18,RC[-3]<19),15,IF(AND(RC[-3]<RC[-1],RC[-3]>=19,RC[-3]<20),10,IF(AND(RC[-3]<RC[-1],RC[-3]>=20,RC[-3]<21),5,IF(AND(RC[-3]<RC[-1],RC[-3]>=21),0,IF(AND(RC[-3]>RC[-1],RC[-3]>=2,RC[-3]<3),90,IF(AND(RC[-3]>RC[-1],RC[-3]>=3,RC[-3]<4),90,IF(AND(RC[-3]>RC[-1],RC[-3]>=4,RC[-3]<5),80,IF(AND(RC[-3]>RC[-1],RC[-3]>=5,RC[-3]<6),70,IF(AND(RC[-3]>RC[-1],RC[-3]>=6,RC[-3]<7),60,IF(AND(RC[-3]>RC[-1],RC[-3]>=7,RC[-3]<8),50,IF(AND(RC[-3]>RC[-1],RC[-3]>=8,RC[-3]<9),40,IF(AND(RC[-3]>RC[-1],RC[-3]>=9,RC[-3]<10),30,IF(AND(RC[-3]>RC[-1],RC[-3]>=10,RC[-3]<11),20,IF(AND(RC[-3]>RC[-1],RC[-3]>=11,RC[-3]<12),10,IF(AND(RC[-3]>RC[-1],RC[-3]>=12),0))))))))))))))))))))))))))))))))) -> 0 | H437: =IF(RC[-3]="","",IF(RC[-3]<0.3,100,IF(AND(RC[-3]>=0.3,RC[-3]>0.4),95,IF(AND(RC[-3]>=0.4,RC[-3]<0.5),90,IF(AND(RC[-3]>=0.5,RC[-3]<0.6),85,IF(AND(RC[-3]>=0.6,RC[-3]<0.7),80,IF(AND(RC[-3]>=0.6,RC[-3]<1),80,IF(AND(RC[-3]>1,RC[-3]<2),50,IF(RC[-3]>2,0))))))))) ->  | I437: =IF(RC[-1]="",RC[-2],0.7*RC[-1]+0.3*RC[-2]) -> 0
A438: صنایع پتروشیمی تخت جمشید | B438: شجم | C438: =VLOOKUP(RC[-1],Sheet1!R3C2:R802C3,2,FALSE) -> شیمیایی | D438: =VLOOKUP(RC[-2],Sheet1!R3C2:R802C9,8,FALSE) -> 6.7682694960579566 | E438: =IF(VLOOKUP(RC[-3],Sheet1!R3C2:R803C11,10,FALSE)=0,"",VLOOKUP(Sheet2!RC[-3],Sheet1!R[1]C[-3]:R[801]C[6],10,FALSE)) ->  | F438: =Sheet1!R488C10 -> 5.0300989663672855 | G438: =IF(RC[-3]<0,0,IF(AND(RC[-3]<RC[-1],RC[-3]<2),100,IF(AND(RC[-3]<RC[-1],RC[-3]>=2,RC[-3]<3),95,IF(AND(RC[-3]<RC[-1],RC[-3]>=3,RC[-3]<4),90,IF(AND(RC[-3]<RC[-1],RC[-3]>=4,RC[-3]<5),85,IF(AND(RC[-3]<RC[-1],RC[-3]>=5,RC[-3]<6),80,IF(AND(RC[-3]<RC[-1],RC[-3]>=6,RC[-3]<7),75,IF(AND(RC[-3]<RC[-1],RC[-3]>=7,RC[-3]<8),70,IF(AND(RC[-3]<RC[-1],RC[-3]>=8,RC[-3]<9),65,IF(AND(RC[-3]<RC[-1],RC[-3]>=9,RC[-3]<10),60,IF(AND(RC[-3]<RC[-1],RC[-3]>=10,RC[-3]<11),55,IF(AND(RC[-3]<RC[-1],RC[-3]>=11,RC[-3]<12),50,IF(AND(RC[-3]<RC[-1],RC[-3]>=12,RC[-3]<13),45,IF(AND(RC[-3]<RC[-1],RC[-3]>=13,RC[-3]<14),40,IF(AND(RC[-3]<RC[-1],RC[-3]>=14,RC[-3]<15),35,IF(AND(RC[-3]<RC[-1],RC[-3]>=15,RC[-3]<16),30,IF(AND(RC[-3]<RC[-1],RC[-3]>=16,RC[-3]<17),25,IF(AND(RC[-3]<RC[-1],RC[-3]>=17,RC[-3]<18),20,IF(AND(RC[-3]<RC[-1],RC[-3]>=18,RC[-3]<19),15,IF(AND(RC[-3]<RC[-1],RC[-3]>=19,RC[-3]<20),10,IF(AND(RC[-3]<RC[-1],RC[-3]>=20,RC[-3]<21),5,IF(AND(RC[-3]<RC[-1],RC[-3]>=21),0,IF(AND(RC[-3]>RC[-1],RC[-3]>=2,RC[-3]<3),90,IF(AND(RC[-3]>RC[-1],RC[-3]>=3,RC[-3]<4),90,IF(AND(RC[-3]>RC[-1],RC[-3]>=4,RC[-3]<5),80,IF(AND(RC[-3]>RC[-1],RC[-3]>=5,RC[-3]<6),70,IF(AND(RC[-3]>RC[-1],RC[-3]>=6,RC[-3]<7),60,IF(AND(RC[-3]>RC[-1],RC[-3]>=7,RC[-3]<8),50,IF(AND(RC[-3]>RC[-1],RC[-3]>=8,RC[-3]<9),40,IF(AND(RC[-3]>RC[-1],RC[-3]>=9,RC[-3]<10),30,IF(AND(RC[-3]>RC[-1],RC[-3]>=10,RC[-3]<11),20,IF(AND(RC[-3]>RC[-1],RC[-3]>=11,RC[-3]<12),10,IF(AND(RC[-3]>RC[-1],RC[-3]>=12),0))))))))))))))))))))))))))))))))) -> 60 | H438: =IF(RC[-3]="","",IF(RC[-3]<0.3,100,IF(AND(RC[-3]>=0.3,RC[-3]>0.4),95,IF(AND(RC[-3]>=0.4,RC[-3]<0.5),90,IF(AND(RC[-3]>=0.5,RC[-3]<0.6),85,IF(AND(RC[-3]>=0.6,RC[-3]<0.7),80,IF(AND(RC[-3]>=0.6,RC[-3]<1),80,IF(AND(RC[-3]>1,RC[-3]<2),50,IF(RC[-3]>2,0))))))))) ->  | I438: =IF(RC[-1]="",RC[-2],0.7*RC[-1]+0.3*RC[-2]) -> 60
A439: صنایع پتروشیمی خلیج فارس | B439: فارس | C439: =VLOOKUP(RC[-1],Sheet1!R3C2:R802C3,2,FALSE) -> شیمیایی | D439: =VLOOKUP(RC[-2],Sheet1!R3C2:R802C9,8,FALSE) -> 5.0409450222349932 | E439: =IF(VLOOKUP(RC[-3],Sheet1!R3C2:R803C11,10,FALSE)=0,"",VLOOKUP(Sheet2!RC[-3],Sheet1!R[1]C[-3]:R[801]C[6],10,FALSE)) -> 1.3 | F439: =Sheet1!R488C10 -> 5.0300989663672855 | G439: =IF(RC[-3]<0,0,IF(AND(RC[-3]<RC[-1],RC[-3]<2),100,IF(AND(RC[-3]<RC[-1],RC[-3]>=2,RC[-3]<3),95,IF(AND(RC[-3]<RC[-1],RC[-3]>=3,RC[-3]<4),90,IF(AND(RC[-3]<RC[-1],RC[-3]>=4,RC[-3]<5),85,IF(AND(RC[-3]<RC[-1],RC[-3]>=5,RC[-3]<6),80,IF(AND(RC[-3]<RC[-1],RC[-3]>=6,RC[-3]<7),75,IF(AND(RC[-3]<RC[-1],RC[-3]>=7,RC[-3]<8),70,IF(AND(RC[-3]<RC[-1],RC[-3]>=8,RC[-3]<9),65,IF(AND(RC[-3]<RC[-1],RC[-3]>=9,RC[-3]<10),60,IF(AND(RC[-3]<RC[-1],RC[-3]>=10,RC[-3]<11),55,IF(AND(RC[-3]<RC[-1],RC[-3]>=11,RC[-3]<12),50,IF(AND(RC[-3]<RC[-1],RC[-3]>=12,RC[-3]<13),45,IF(AND(RC[-3]<RC[-1],RC[-3]>=13,RC[-3]<14),40,IF(AND(RC[-3]<RC[-1],RC[-3]>=14,RC[-3]<15),35,IF(AND(RC[-3]<RC[-1],RC[-3]>=15,RC[-3]<16),30,IF(AND(RC[-3]<RC[-1],RC[-3]>=16,RC[-3]<17),25,IF(AND(RC[-3]<RC[-1],RC[-3]>=17,RC[-3]<18),20,IF(AND(RC[-3]<RC[-1],RC[-3]>=18,RC[-3]<19),15,IF(AND(RC[-3]<RC[-1],RC[-3]>=19,RC[-3]<20),10,IF(AND(RC[-3]<RC[-1],RC[-3]>=20,RC[-3]<21),5,IF(AND(RC[-3]<RC[-1],RC[-3]>=21),0,IF(AND(RC[-3]>RC[-1],RC[-3]>=2,RC[-3]<3),90,IF(AND(RC[-3]>RC[-1],RC[-3]>=3,RC[-3]<4),90,IF(AND(RC[-3]>RC[-1],RC[-3]>=4,RC[-3]<5),80,IF(AND(RC[-3]>RC[-1],RC[-3]>=5,RC[-3]<6),70,IF(AND(RC[-3]>RC[-1],RC[-3]>=6,RC[-3]<7),60,IF(AND(RC[-3]>RC[-1],RC[-3]>=7,RC[-3]<8),50,IF(AND(RC[-3]>RC[-1],RC[-3]>=8,RC[-3]<9),40,IF(AND(RC[-3]>RC[-1],RC[-3]>=9,RC[-3]<10),30,IF(AND(RC[-3]>RC[-1],RC[-3]>=10,RC[-3]<11),20,IF(AND(RC[-3]>RC[-1],RC[-3]>=11,RC[-3]<12),10,IF(AND(RC[-3]>RC[-1],RC[-3]>=12),0))))))))))))))))))))))))))))))))) -> 70 | H439: =IF(RC[-3]="","",IF(RC[-3]<0.3,100,IF(AND(RC[-3]>=0.3,RC[-3]>0.4),95,IF(AND(RC[-3]>=0.4,RC[-3]<0.5),90,IF(AND(RC[-3]>=0.5,RC[-3]<0.6),85,IF(AND(RC[-3]>=0.6,RC[-3]<0.7),80,IF(AND(RC[-3]>=0.6,RC[-3]<1),80,IF(AND(RC[-3]>1,RC[-3]<2),50,IF(RC[-3]>2,0))))))))) -> 95 | I439: =IF(RC[-1]="",RC[-2],0.7*RC[-1]+0.3*RC[-2]) -> 87.5
A440: صنایع پتروشیمی دهدشت | B440: دهدشت | C440: =VLOOKUP(RC[-1],Sheet1!R3C2:R802C3,2,FALSE) -> شیمیایی | D440: =VLOOKUP(RC[-2],Sheet1!R3C2:R802C9,8,FALSE) -> -421.77777777777783 | E440: =IF(VLOOKUP(RC[-3],Sheet1!R3C2:R803C11,10,FALSE)=0,"",VLOOKUP(Sheet2!RC[-3],Sheet1!R[1]C[-3]:R[801]C[6],10,FALSE)) ->  | F440: =Sheet1!R488C10 -> 5.0300989663672855 | G440: =IF(RC[-3]<0,0,IF(AND(RC[-3]<RC[-1],RC[-3]<2),100,IF(AND(RC[-3]<RC[-1],RC[-3]>=2,RC[-3]<3),95,IF(AND(RC[-3]<RC[-1],RC[-3]>=3,RC[-3]<4),90,IF(AND(RC[-3]<RC[-1],RC[-3]>=4,RC[-3]<5),85,IF(AND(RC[-3]<RC[-1],RC[-3]>=5,RC[-3]<6),80,IF(AND(RC[-3]<RC[-1],RC[-3]>=6,RC[-3]<7),75,IF(AND(RC[-3]<RC[-1],RC[-3]>=7,RC[-3]<8),70,IF(AND(RC[-3]<RC[-1],RC[-3]>=8,RC[-3]<9),65,IF(AND(RC[-3]<RC[-1],RC[-3]>=9,RC[-3]<10),60,IF(AND(RC[-3]<RC[-1],RC[-3]>=10,RC[-3]<11),55,IF(AND(RC[-3]<RC[-1],RC[-3]>=11,RC[-3]<12),50,IF(AND(RC[-3]<RC[-1],RC[-3]>=12,RC[-3]<13),45,IF(AND(RC[-3]<RC[-1],RC[-3]>=13,RC[-3]<14),40,IF(AND(RC[-3]<RC[-1],RC[-3]>=14,RC[-3]<15),35,IF(AND(RC[-3]<RC[-1],RC[-3]>=15,RC[-3]<16),30,IF(AND(RC[-3]<RC[-1],RC[-3]>=16,RC[-3]<17),25,IF(AND(RC[-3]<RC[-1],RC[-3]>=17,RC[-3]<18),20,IF(AND(RC[-3]<RC[-1],RC[-3]>=18,RC[-3]<19),15,IF(AND(RC[-3]<RC[-1],RC[-3]>=19,RC[-3]<20),10,IF(AND(RC[-3]<RC[-1],RC[-3]>=20,RC[-3]<21),5,IF(AND(RC[-3]<RC[-1],RC[-3]>=21),0,IF(AND(RC[-3]>RC[-1],RC[-3]>=2,RC[-3]<3),90,IF(AND(RC[-3]>RC[-1],RC[-3]>=3,RC[-3]<4),90,IF(AND(RC[-3]>RC[-1],RC[-3]>=4,RC[-3]<5),80,IF(AND(RC[-3]>RC[-1],RC[-3]>=5,RC[-3]<6),70,IF(AND(RC[-3]>RC[-1],RC[-3]>=6,RC[-3]<7),60,IF(AND(RC[-3]>RC[-1],RC[-3]>=7,RC[-3]<8),50,IF(AND(RC[-3]>RC[-1],RC[-3]>=8,RC[-3]<9),40,IF(AND(RC[-3]>RC[-1],RC[-3]>=9,RC[-3]<10),30,IF(AND(RC[-3]>RC[-1],RC[-3]>=10,RC[-3]<11),20,IF(AND(RC[-3]>RC[-1],RC[-3]>=11,RC[-3]<12),10,IF(AND(RC[-3]>RC[-1],RC[-3]>=12),0))))))))))))))))))))))))))))))))) -> 0 | H440: =IF(RC[-3]="","",IF(RC[-3]<0.3,100,IF(AND(RC[-3]>=0.3,RC[-3]>0.4),95,IF(AND(RC[-3]>=0.4,RC[-3]<0.5),90,IF(AND(RC[-3]>=0.5,RC[-3]<0.6),85,IF(AND(RC[-3]>=0.6,RC[-3]<0.7),80,IF(AND(RC[-3]>=0.6,RC[-3]<1),80,IF(AND(RC[-3]>1,RC[-3]<2),50,IF(RC[-3]>2,0))))))))) ->  | I440: =IF(RC[-1]="",RC[-2],0.7*RC[-1]+0.3*RC[-2]) -> 0
A441: صنایع پتروشیمی گلستان | B441: شستان | C441: =VLOOKUP(RC[-1],Sheet1!R3C2:R802C3,2,FALSE) -> شیمیایی | D441: =VLOOKUP(RC[-2],Sheet1!R3C2:R802C9,8,FALSE) -> 266.03571428571428 | E441: =IF(VLOOKUP(RC[-3],Sheet1!R3C2:R803C11,10,FALSE)=0,"",VLOOKUP(Sheet2!RC[-3],Sheet1!R[1]C[-3]:R[801]C[6],10,FALSE)) ->  | F441: =Sheet1!R488C10 -> 5.0300989663672855 | G441: =IF(RC[-3]<0,0,IF(AND(RC[-3]<RC[-1],RC[-3]<2),100,IF(AND(RC[-3]<RC[-1],RC[-3]>=2,RC[-3]<3),95,IF(AND(RC[-3]<RC[-1],RC[-3]>=3,RC[-3]<4),90,IF(AND(RC[-3]<RC[-1],RC[-3]>=4,RC[-3]<5),85,IF(AND(RC[-3]<RC[-1],RC[-3]>=5,RC[-3]<6),80,IF(AND(RC[-3]<RC[-1],RC[-3]>=6,RC[-3]<7),75,IF(AND(RC[-3]<RC[-1],RC[-3]>=7,RC[-3]<8),70,IF(AND(RC[-3]<RC[-1],RC[-3]>=8,RC[-3]<9),65,IF(AND(RC[-3]<RC[-1],RC[-3]>=9,RC[-3]<10),60,IF(AND(RC[-3]<RC[-1],RC[-3]>=10,RC[-3]<11),55,IF(AND(RC[-3]<RC[-1],RC[-3]>=11,RC[-3]<12),50,IF(AND(RC[-3]<RC[-1],RC[-3]>=12,RC[-3]<13),45,IF(AND(RC[-3]<RC[-1],RC[-3]>=13,RC[-3]<14),40,IF(AND(RC[-3]<RC[-1],RC[-3]>=14,RC[-3]<15),35,IF(AND(RC[-3]<RC[-1],RC[-3]>=15,RC[-3]<16),30,IF(AND(RC[-3]<RC[-1],RC[-3]>=16,RC[-3]<17),25,IF(AND(RC[-3]<RC[-1],RC[-3]>=17,RC[-3]<18),20,IF(AND(RC[-3]<RC[-1],RC[-3]>=18,RC[-3]<19),15,IF(AND(RC[-3]<RC[-1],RC[-3]>=19,RC[-3]<20),10,IF(AND(RC[-3]<RC[-1],RC[-3]>=20,RC[-3]<21),5,IF(AND(RC[-3]<RC[-1],RC[-3]>=21),0,IF(AND(RC[-3]>RC[-1],RC[-3]>=2,RC[-3]<3),90,IF(AND(RC[-3]>RC[-1],RC[-3]>=3,RC[-3]<4),90,IF(AND(RC[-3]>RC[-1],RC[-3]>=4,RC[-3]<5),80,IF(AND(RC[-3]>RC[-1],RC[-3]>=5,RC[-3]<6),70,IF(AND(RC[-3]>RC[-1],RC[-3]>=6,RC[-3]<7),60,IF(AND(RC[-3]>RC[-1],RC[-3]>=7,RC[-3]<8),50,IF(AND(RC[-3]>RC[-1],RC[-3]>=8,RC[-3]<9),40,IF(AND(RC[-3]>RC[-1],RC[-3]>=9,RC[-3]<10),30,IF(AND(RC[-3]>RC[-1],RC[-3]>=10,RC[-3]<11),20,IF(AND(RC[-3]>RC[-1],RC[-3]>=11,RC[-3]<12),10,IF(AND(RC[-3]>RC[-1],RC[-3]>=12),0))))))))))))))))))))))))))))))))) -> 0 | H441: =IF(RC[-3]="","",IF(RC[-3]<0.3,100,IF(AND(RC[-3]>=0.3,RC[-3]>0.4),95,IF(AND(RC[-3]>=0.4,RC[-3]<0.5),90,IF(AND(RC[-3]>=0.5,RC[-3]<0.6),85,IF(AND(RC[-3]>=0.6,RC[-3]<0.7),80,IF(AND(RC[-3]>=0.6,RC[-3]<1),80,IF(AND(RC[-3]>1,RC[-3]<2),50,IF(RC[-3]>2,0))))))))) ->  | I441: =IF(RC[-1]="",RC[-2],0.7*RC[-1]+0.3*RC[-2]) -> 0
A442: صنایع پتروشیمی کرمانشاه | B442: کرماشا | C442: =VLOOKUP(RC[-1],Sheet1!R3C2:R802C3,2,FALSE) -> شیمیایی | D442: =VLOOKUP(RC[-2],Sheet1!R3C2:R802C9,8,FALSE) -> 2.795281452575793 | E442: =IF(VLOOKUP(RC[-3],Sheet1!R3C2:R803C11,10,FALSE)=0,"",VLOOKUP(Sheet2!RC[-3],Sheet1!R[1]C[-3]:R[801]C[6],10,FALSE)) ->  | F442: =Sheet1!R488C10 -> 5.0300989663672855 | G442: =IF(RC[-3]<0,0,IF(AND(RC[-3]<RC[-1],RC[-3]<2),100,IF(AND(RC[-3]<RC[-1],RC[-3]>=2,RC[-3]<3),95,IF(AND(RC[-3]<RC[-1],RC[-3]>=3,RC[-3]<4),90,IF(AND(RC[-3]<RC[-1],RC[-3]>=4,RC[-3]<5),85,IF(AND(RC[-3]<RC[-1],RC[-3]>=5,RC[-3]<6),80,IF(AND(RC[-3]<RC[-1],RC[-3]>=6,RC[-3]<7),75,IF(AND(RC[-3]<RC[-1],RC[-3]>=7,RC[-3]<8),70,IF(AND(RC[-3]<RC[-1],RC[-3]>=8,RC[-3]<9),65,IF(AND(RC[-3]<RC[-1],RC[-3]>=9,RC[-3]<10),60,IF(AND(RC[-3]<RC[-1],RC[-3]>=10,RC[-3]<11),55,IF(AND(RC[-3]<RC[-1],RC[-3]>=11,RC[-3]<12),50,IF(AND(RC[-3]<RC[-1],RC[-3]>=12,RC[-3]<13),45,IF(AND(RC[-3]<RC[-1],RC[-3]>=13,RC[-3]<14),40,IF(AND(RC[-3]<RC[-1],RC[-3]>=14,RC[-3]<15),35,IF(AND(RC[-3]<RC[-1],RC[-3]>=15,RC[-3]<16),30,IF(AND(RC[-3]<RC[-1],RC[-3]>=16,RC[-3]<17),25,IF(AND(RC[-3]<RC[-1],RC[-3]>=17,RC[-3]<18),20,IF(AND(RC[-3]<RC[-1],RC[-3]>=18,RC[-3]<19),15,IF(AND(RC[-3]<RC[-1],RC[-3]>=19,RC[-3]<20),10,IF(AND(RC[-3]<RC[-1],RC[-3]>=20,RC[-3]<21),5,IF(AND(RC[-3]<RC[-1],RC[-3]>=21),0,IF(AND(RC[-3]>RC[-1],RC[-3]>=2,RC[-3]<3),90,IF(AND(RC[-3]>RC[-1],RC[-3]>=3,RC[-3]<4),90,IF(AND(RC[-3]>RC[-1],RC[-3]>=4,RC[-3]<5),80,IF(AND(RC[-3]>RC[-1],RC[-3]>=5,RC[-3]<6),70,IF(AND(RC[-3]>RC[-1],RC[-3]>=6,RC[-3]<7),60,IF(AND(RC[-3]>RC[-1],RC[-3]>=7,RC[-3]<8),50,IF(AND(RC[-3]>RC[-1],RC[-3]>=8,RC[-3]<9),40,IF(AND(RC[-3]>RC[-1],RC[-3]>=9,RC[-3]<10),30,IF(AND(RC[-3]>RC[-1],RC[-3]>=10,RC[-3]<11),20,IF(AND(RC[-3]>RC[-1],RC[-3]>=11,RC[-3]<12),10,IF(AND(RC[-3]>RC[-1],RC[-3]>=12),0))))))))))))))))))))))))))))))))) -> 95 | H442: =IF(RC[-3]="","",IF(RC[-3]<0.3,100,IF(AND(RC[-3]>=0.3,RC[-3]>0.4),95,IF(AND(RC[-3]>=0.4,RC[-3]<0.5),90,IF(AND(RC[-3]>=0.5,RC[-3]<0.6),85,IF(AND(RC[-3]>=0.6,RC[-3]<0.7),80,IF(AND(RC[-3]>=0.6,RC[-3]<1),80,IF(AND(RC[-3]>1,RC[-3]<2),50,IF(RC[-3]>2,0))))))))) ->  | I442: =IF(RC[-1]="",RC[-2],0.7*RC[-1]+0.3*RC[-2]) -> 95
A443: صنایع شیمیایی ایران | B443: شیران | C443: =VLOOKUP(RC[-1],Sheet1!R3C2:R802C3,2,FALSE) -> شیمیایی | D443: =VLOOKUP(RC[-2],Sheet1!R3C2:R802C9,8,FALSE) -> 4.0863568888463986 | E443: =IF(VLOOKUP(RC[-3],Sheet1!R3C2:R803C11,10,FALSE)=0,"",VLOOKUP(Sheet2!RC[-3],Sheet1!R[1]C[-3]:R[801]C[6],10,FALSE)) ->  | F443: =Sheet1!R488C10 -> 5.0300989663672855 | G443: =IF(RC[-3]<0,0,IF(AND(RC[-3]<RC[-1],RC[-3]<2),100,IF(AND(RC[-3]<RC[-1],RC[-3]>=2,RC[-3]<3),95,IF(AND(RC[-3]<RC[-1],RC[-3]>=3,RC[-3]<4),90,IF(AND(RC[-3]<RC[-1],RC[-3]>=4,RC[-3]<5),85,IF(AND(RC[-3]<RC[-1],RC[-3]>=5,RC[-3]<6),80,IF(AND(RC[-3]<RC[-1],RC[-3]>=6,RC[-3]<7),75,IF(AND(RC[-3]<RC[-1],RC[-3]>=7,RC[-3]<8),70,IF(AND(RC[-3]<RC[-1],RC[-3]>=8,RC[-3]<9),65,IF(AND(RC[-3]<RC[-1],RC[-3]>=9,RC[-3]<10),60,IF(AND(RC[-3]<RC[-1],RC[-3]>=10,RC[-3]<11),55,IF(AND(RC[-3]<RC[-1],RC[-3]>=11,RC[-3]<12),50,IF(AND(RC[-3]<RC[-1],RC[-3]>=12,RC[-3]<13),45,IF(AND(RC[-3]<RC[-1],RC[-3]>=13,RC[-3]<14),40,IF(AND(RC[-3]<RC[-1],RC[-3]>=14,RC[-3]<15),35,IF(AND(RC[-3]<RC[-1],RC[-3]>=15,RC[-3]<16),30,IF(AND(RC[-3]<RC[-1],RC[-3]>=16,RC[-3]<17),25,IF(AND(RC[-3]<RC[-1],RC[-3]>=17,RC[-3]<18),20,IF(AND(RC[-3]<RC[-1],RC[-3]>=18,RC[-3]<19),15,IF(AND(RC[-3]<RC[-1],RC[-3]>=19,RC[-3]<20),10,IF(AND(RC[-3]<RC[-1],RC[-3]>=20,RC[-3]<21),5,IF(AND(RC[-3]<RC[-1],RC[-3]>=21),0,IF(AND(RC[-3]>RC[-1],RC[-3]>=2,RC[-3]<3),90,IF(AND(RC[-3]>RC[-1],RC[-3]>=3,RC[-3]<4),90,IF(AND(RC[-3]>RC[-1],RC[-3]>=4,RC[-3]<5),80,IF(AND(RC[-3]>RC[-1],RC[-3]>=5,RC[-3]<6),70,IF(AND(RC[-3]>RC[-1],RC[-3]>=6,RC[-3]<7),60,IF(AND(RC[-3]>RC[-1],RC[-3]>=7,RC[-3]<8),50,IF(AND(RC[-3]>RC[-1],RC[-3]>=8,RC[-3]<9),40,IF(AND(RC[-3]>RC[-1],RC[-3]>=9,RC[-3]<10),30,IF(AND(RC[-3]>RC[-1],RC[-3]>=10,RC[-3]<11),20,IF(AND(RC[-3]>RC[-1],RC[-3]>=11,RC[-3]<12),10,IF(AND(RC[-3]>RC[-1],RC[-3]>=12),0))))))))))))))))))))))))))))))))) -> 85 | H443: =IF(RC[-3]="","",IF(RC[-3]<0.3,100,IF(AND(RC[-3]>=0.3,RC[-3]>0.4),95,IF(AND(RC[-3]>=0.4,RC[-3]<0.5),90,IF(AND(RC[-3]>=0.5,RC[-3]<0.6),85,IF(AND(RC[-3]>=0.6,RC[-3]<0.7),80,IF(AND(RC[-3]>=0.6,RC[-3]<1),80,IF(AND(RC[-3]>1,RC[-3]<2),50,IF(RC[-3]>2,0))))))))) ->  | I443: =IF(RC[-1]="",RC[-2],0.7*RC[-1]+0.3*RC[-2]) -> 85
A444: صنایع شیمیایی کیمیاگران امروز | B444: شکام | C444: =VLOOKUP(RC[-1],Sheet1!R3C2:R802C3,2,FALSE) -> شیمیایی | D444: =VLOOKUP(RC[-2],Sheet1!R3C2:R802C9,8,FALSE) -> 6 | E444: =IF(VLOOKUP(RC[-3],Sheet1!R3C2:R803C11,10,FALSE)=0,"",VLOOKUP(Sheet2!RC[-3],Sheet1!R[1]C[-3]:R[801]C[6],10,FALSE)) ->  | F444: =Sheet1!R488C10 -> 5.0300989663672855 | G444: =IF(RC[-3]<0,0,IF(AND(RC[-3]<RC[-1],RC[-3]<2),100,IF(AND(RC[-3]<RC[-1],RC[-3]>=2,RC[-3]<3),95,IF(AND(RC[-3]<RC[-1],RC[-3]>=3,RC[-3]<4),90,IF(AND(RC[-3]<RC[-1],RC[-3]>=4,RC[-3]<5),85,IF(AND(RC[-3]<RC[-1],RC[-3]>=5,RC[-3]<6),80,IF(AND(RC[-3]<RC[-1],RC[-3]>=6,RC[-3]<7),75,IF(AND(RC[-3]<RC[-1],RC[-3]>=7,RC[-3]<8),70,IF(AND(RC[-3]<RC[-1],RC[-3]>=8,RC[-3]<9),65,IF(AND(RC[-3]<RC[-1],RC[-3]>=9,RC[-3]<10),60,IF(AND(RC[-3]<RC[-1],RC[-3]>=10,RC[-3]<11),55,IF(AND(RC[-3]<RC[-1],RC[-3]>=11,RC[-3]<12),50,IF(AND(RC[-3]<RC[-1],RC[-3]>=12,RC[-3]<13),45,IF(AND(RC[-3]<RC[-1],RC[-3]>=13,RC[-3]<14),40,IF(AND(RC[-3]<RC[-1],RC[-3]>=14,RC[-3]<15),35,IF(AND(RC[-3]<RC[-1],RC[-3]>=15,RC[-3]<16),30,IF(AND(RC[-3]<RC[-1],RC[-3]>=16,RC[-3]<17),25,IF(AND(RC[-3]<RC[-1],RC[-3]>=17,RC[-3]<18),20,IF(AND(RC[-3]<RC[-1],RC[-3]>=18,RC[-3]<19),15,IF(AND(RC[-3]<RC[-1],RC[-3]>=19,RC[-3]<20),10,IF(AND(RC[-3]<RC[-1],RC[-3]>=20,RC[-3]<21),5,IF(AND(RC[-3]<RC[-1],RC[-3]>=21),0,IF(AND(RC[-3]>RC[-1],RC[-3]>=2,RC[-3]<3),90,IF(AND(RC[-3]>RC[-1],RC[-3]>=3,RC[-3]<4),90,IF(AND(RC[-3]>RC[-1],RC[-3]>=4,RC[-3]<5),80,IF(AND(RC[-3]>RC[-1],RC[-3]>=5,RC[-3]<6),70,IF(AND(RC[-3]>RC[-1],RC[-3]>=6,RC[-3]<7),60,IF(AND(RC[-3]>RC[-1],RC[-3]>=7,RC[-3]<8),50,IF(AND(RC[-3]>RC[-1],RC[-3]>=8,RC[-3]<9),40,IF(AND(RC[-3]>RC[-1],RC[-3]>=9,RC[-3]<10),30,IF(AND(RC[-3]>RC[-1],RC[-3]>=10,RC[-3]<11),20,IF(AND(RC[-3]>RC[-1],RC[-3]>=11,RC[-3]<12),10,IF(AND(RC[-3]>RC[-1],RC[-3]>=12),0))))))))))))))))))))))))))))))))) -> 60 | H444: =IF(RC[-3]="","",IF(RC[-3]<0.3,100,IF(AND(RC[-3]>=0.3,RC[-3]>0.4),95,IF(AND(RC[-3]>=0.4,RC[-3]<0.5),90,IF(AND(RC[-3]>=0.5,RC[-3]<0.6),85,IF(AND(RC[-3]>=0.6,RC[-3]<0.7),80,IF(AND(RC[-3]>=0.6,RC[-3]<1),80,IF(AND(RC[-3]>1,RC[-3]<2),50,IF(RC[-3]>2,0))))))))) ->  | I444: =IF(RC[-1]="",RC[-2],0.7*RC[-1]+0.3*RC[-2]) -> 60
A445: صنایع کشاورزی و کود زنجان | B445: زنجان | C445: =VLOOKUP(RC[-1],Sheet1!R3C2:R802C3,2,FALSE) -> شیمیایی | D445: =VLOOKUP(RC[-2],Sheet1!R3C2:R802C9,8,FALSE) -> -36.18333333333333 | E445: =IF(VLOOKUP(RC[-3],Sheet1!R3C2:R803C11,10,FALSE)=0,"",VLOOKUP(Sheet2!RC[-3],Sheet1!R[1]C[-3]:R[801]C[6],10,FALSE)) ->  | F445: =Sheet1!R488C10 -> 5.0300989663672855 | G445: =IF(RC[-3]<0,0,IF(AND(RC[-3]<RC[-1],RC[-3]<2),100,IF(AND(RC[-3]<RC[-1],RC[-3]>=2,RC[-3]<3),95,IF(AND(RC[-3]<RC[-1],RC[-3]>=3,RC[-3]<4),90,IF(AND(RC[-3]<RC[-1],RC[-3]>=4,RC[-3]<5),85,IF(AND(RC[-3]<RC[-1],RC[-3]>=5,RC[-3]<6),80,IF(AND(RC[-3]<RC[-1],RC[-3]>=6,RC[-3]<7),75,IF(AND(RC[-3]<RC[-1],RC[-3]>=7,RC[-3]<8),70,IF(AND(RC[-3]<RC[-1],RC[-3]>=8,RC[-3]<9),65,IF(AND(RC[-3]<RC[-1],RC[-3]>=9,RC[-3]<10),60,IF(AND(RC[-3]<RC[-1],RC[-3]>=10,RC[-3]<11),55,IF(AND(RC[-3]<RC[-1],RC[-3]>=11,RC[-3]<12),50,IF(AND(RC[-3]<RC[-1],RC[-3]>=12,RC[-3]<13),45,IF(AND(RC[-3]<RC[-1],RC[-3]>=13,RC[-3]<14),40,IF(AND(RC[-3]<RC[-1],RC[-3]>=14,RC[-3]<15),35,IF(AND(RC[-3]<RC[-1],RC[-3]>=15,RC[-3]<16),30,IF(AND(RC[-3]<RC[-1],RC[-3]>=16,RC[-3]<17),25,IF(AND(RC[-3]<RC[-1],RC[-3]>=17,RC[-3]<18),20,IF(AND(RC[-3]<RC[-1],RC[-3]>=18,RC[-3]<19),15,IF(AND(RC[-3]<RC[-1],RC[-3]>=19,RC[-3]<20),10,IF(AND(RC[-3]<RC[-1],RC[-3]>=20,RC[-3]<21),5,IF(AND(RC[-3]<RC[-1],RC[-3]>=21),0,IF(AND(RC[-3]>RC[-1],RC[-3]>=2,RC[-3]<3),90,IF(AND(RC[-3]>RC[-1],RC[-3]>=3,RC[-3]<4),90,IF(AND(RC[-3]>RC[-1],RC[-3]>=4,RC[-3]<5),80,IF(AND(RC[-3]>RC[-1],RC[-3]>=5,RC[-3]<6),70,IF(AND(RC[-3]>RC[-1],RC[-3]>=6,RC[-3]<7),60,IF(AND(RC[-3]>RC[-1],RC[-3]>=7,RC[-3]<8),50,IF(AND(RC[-3]>RC[-1],RC[-3]>=8,RC[-3]<9),40,IF(AND(RC[-3]>RC[-1],RC[-3]>=9,RC[-3]<10),30,IF(AND(RC[-3]>RC[-1],RC[-3]>=10,RC[-3]<11),20,IF(AND(RC[-3]>RC[-1],RC[-3]>=11,RC[-3]<12),10,IF(AND(RC[-3]>RC[-1],RC[-3]>=12),0))))))))))))))))))))))))))))))))) -> 0 | H445: =IF(RC[-3]="","",IF(RC[-3]<0.3,100,IF(AND(RC[-3]>=0.3,RC[-3]>0.4),95,IF(AND(RC[-3]>=0.4,RC[-3]<0.5),90,IF(AND(RC[-3]>=0.5,RC[-3]<0.6),85,IF(AND(RC[-3]>=0.6,RC[-3]<0.7),80,IF(AND(RC[-3]>=0.6,RC[-3]<1),80,IF(AND(RC[-3]>1,RC[-3]<2),50,IF(RC[-3]>2,0))))))))) ->  | I445: =IF(RC[-1]="",RC[-2],0.7*RC[-1]+0.3*RC[-2]) -> 0
A446: صنعتی دوده فام | B446: شصدف | C446: =VLOOKUP(RC[-1],Sheet1!R3C2:R802C3,2,FALSE) -> شیمیایی | D446: =VLOOKUP(RC[-2],Sheet1!R3C2:R802C9,8,FALSE) -> 5.5214684067635291 | E446: =IF(VLOOKUP(RC[-3],Sheet1!R3C2:R803C11,10,FALSE)=0,"",VLOOKUP(Sheet2!RC[-3],Sheet1!R[1]C[-3]:R[801]C[6],10,FALSE)) ->  | F446: =Sheet1!R488C10 -> 5.0300989663672855 | G446: =IF(RC[-3]<0,0,IF(AND(RC[-3]<RC[-1],RC[-3]<2),100,IF(AND(RC[-3]<RC[-1],RC[-3]>=2,RC[-3]<3),95,IF(AND(RC[-3]<RC[-1],RC[-3]>=3,RC[-3]<4),90,IF(AND(RC[-3]<RC[-1],RC[-3]>=4,RC[-3]<5),85,IF(AND(RC[-3]<RC[-1],RC[-3]>=5,RC[-3]<6),80,IF(AND(RC[-3]<RC[-1],RC[-3]>=6,RC[-3]<7),75,IF(AND(RC[-3]<RC[-1],RC[-3]>=7,RC[-3]<8),70,IF(AND(RC[-3]<RC[-1],RC[-3]>=8,RC[-3]<9),65,IF(AND(RC[-3]<RC[-1],RC[-3]>=9,RC[-3]<10),60,IF(AND(RC[-3]<RC[-1],RC[-3]>=10,RC[-3]<11),55,IF(AND(RC[-3]<RC[-1],RC[-3]>=11,RC[-3]<12),50,IF(AND(RC[-3]<RC[-1],RC[-3]>=12,RC[-3]<13),45,IF(AND(RC[-3]<RC[-1],RC[-3]>=13,RC[-3]<14),40,IF(AND(RC[-3]<RC[-1],RC[-3]>=14,RC[-3]<15),35,IF(AND(RC[-3]<RC[-1],RC[-3]>=15,RC[-3]<16),30,IF(AND(RC[-3]<RC[-1],RC[-3]>=16,RC[-3]<17),25,IF(AND(RC[-3]<RC[-1],RC[-3]>=17,RC[-3]<18),20,IF(AND(RC[-3]<RC[-1],RC[-3]>=18,RC[-3]<19),15,IF(AND(RC[-3]<RC[-1],RC[-3]>=19,RC[-3]<20),10,IF(AND(RC[-3]<RC[-1],RC[-3]>=20,RC[-3]<21),5,IF(AND(RC[-3]<RC[-1],RC[-3]>=21),0,IF(AND(RC[-3]>RC[-1],RC[-3]>=2,RC[-3]<3),90,IF(AND(RC[-3]>RC[-1],RC[-3]>=3,RC[-3]<4),90,IF(AND(RC[-3]>RC[-1],RC[-3]>=4,RC[-3]<5),80,IF(AND(RC[-3]>RC[-1],RC[-3]>=5,RC[-3]<6),70,IF(AND(RC[-3]>RC[-1],RC[-3]>=6,RC[-3]<7),60,IF(AND(RC[-3]>RC[-1],RC[-3]>=7,RC[-3]<8),50,IF(AND(RC[-3]>RC[-1],RC[-3]>=8,RC[-3]<9),40,IF(AND(RC[-3]>RC[-1],RC[-3]>=9,RC[-3]<10),30,IF(AND(RC[-3]>RC[-1],RC[-3]>=10,RC[-3]<11),20,IF(AND(RC[-3]>RC[-1],RC[-3]>=11,RC[-3]<12),10,IF(AND(RC[-3]>RC[-1],RC[-3]>=12),0))))))))))))))))))))))))))))))))) -> 70 | H446: =IF(RC[-3]="","",IF(RC[-3]<0.3,100,IF(AND(RC[-3]>=0.3,RC[-3]>0.4),95,IF(AND(RC[-3]>=0.4,RC[-3]<0.5),90,IF(AND(RC[-3]>=0.5,RC[-3]<0.6),85,IF(AND(RC[-3]>=0.6,RC[-3]<0.7),80,IF(AND(RC[-3]>=0.6,RC[-3]<1),80,IF(AND(RC[-3]>1,RC[-3]<2),50,IF(RC[-3]>2,0))))))))) ->  | I446: =IF(RC[-1]="",RC[-2],0.7*RC[-1]+0.3*RC[-2]) -> 70
A447: گروه صنعتی پاکشو | B447: پاکشو | C447: =VLOOKUP(RC[-1],Sheet1!R3C2:R802C3,2,FALSE) -> شیمیایی | D447: =VLOOKUP(RC[-2],Sheet1!R3C2:R802C9,8,FALSE) -> 26.129042404889763 | E447: =IF(VLOOKUP(RC[-3],Sheet1!R3C2:R803C11,10,FALSE)=0,"",VLOOKUP(Sheet2!RC[-3],Sheet1!R[1]C[-3]:R[801]C[6],10,FALSE)) ->  | F447: =Sheet1!R488C10 -> 5.0300989663672855 | G447: =IF(RC[-3]<0,0,IF(AND(RC[-3]<RC[-1],RC[-3]<2),100,IF(AND(RC[-3]<RC[-1],RC[-3]>=2,RC[-3]<3),95,IF(AND(RC[-3]<RC[-1],RC[-3]>=3,RC[-3]<4),90,IF(AND(RC[-3]<RC[-1],RC[-3]>=4,RC[-3]<5),85,IF(AND(RC[-3]<RC[-1],RC[-3]>=5,RC[-3]<6),80,IF(AND(RC[-3]<RC[-1],RC[-3]>=6,RC[-3]<7),75,IF(AND(RC[-3]<RC[-1],RC[-3]>=7,RC[-3]<8),70,IF(AND(RC[-3]<RC[-1],RC[-3]>=8,RC[-3]<9),65,IF(AND(RC[-3]<RC[-1],RC[-3]>=9,RC[-3]<10),60,IF(AND(RC[-3]<RC[-1],RC[-3]>=10,RC[-3]<11),55,IF(AND(RC[-3]<RC[-1],RC[-3]>=11,RC[-3]<12),50,IF(AND(RC[-3]<RC[-1],RC[-3]>=12,RC[-3]<13),45,IF(AND(RC[-3]<RC[-1],RC[-3]>=13,RC[-3]<14),40,IF(AND(RC[-3]<RC[-1],RC[-3]>=14,RC[-3]<15),35,IF(AND(RC[-3]<RC[-1],RC[-3]>=15,RC[-3]<16),30,IF(AND(RC[-3]<RC[-1],RC[-3]>=16,RC[-3]<17),25,IF(AND(RC[-3]<RC[-1],RC[-3]>=17,RC[-3]<18),20,IF(AND(RC[-3]<RC[-1],RC[-3]>=18,RC[-3]<19),15,IF(AND(RC[-3]<RC[-1],RC[-3]>=19,RC[-3]<20),10,IF(AND(RC[-3]<RC[-1],RC[-3]>=20,RC[-3]<21),5,IF(AND(RC[-3]<RC[-1],RC[-3]>=21),0,IF(AND(RC[-3]>RC[-1],RC[-3]>=2,RC[-3]<3),90,IF(AND(RC[-3]>RC[-1],RC[-3]>=3,RC[-3]<4),90,IF(AND(RC[-3]>RC[-1],RC[-3]>=4,RC[-3]<5),80,IF(AND(RC[-3]>RC[-1],RC[-3]>=5,RC[-3]<6),70,IF(AND(RC[-3]>RC[-1],RC[-3]>=6,RC[-3]<7),60,IF(AND(RC[-3]>RC[-1],RC[-3]>=7,RC[-3]<8),50,IF(AND(RC[-3]>RC[-1],RC[-3]>=8,RC[-3]<9),40,IF(AND(RC[-3]>RC[-1],RC[-3]>=9,RC[-3]<10),30,IF(AND(RC[-3]>RC[-1],RC[-3]>=10,RC[-3]<11),20,IF(AND(RC[-3]>RC[-1],RC[-3]>=11,RC[-3]<12),10,IF(AND(RC[-3]>RC[-1],RC[-3]>=12),0))))))))))))))))))))))))))))))))) -> 0 | H447: =IF(RC[-3]="","",IF(RC[-3]<0.3,100,IF(AND(RC[-3]>=0.3,RC[-3]>0.4),95,IF(AND(RC[-3]>=0.4,RC[-3]<0.5),90,IF(AND(RC[-3]>=0.5,RC[-3]<0.6),85,IF(AND(RC[-3]>=0.6,RC[-3]<0.7),80,IF(AND(RC[-3]>=0.6,RC[-3]<1),80,IF(AND(RC[-3]>1,RC[-3]<2),50,IF(RC[-3]>2,0))))))))) ->  | I447: =IF(RC[-1]="",RC[-2],0.7*RC[-1]+0.3*RC[-2]) -> 0
A448: گسترش نفت و گاز پارسیان | B448: پارسان | C448: =VLOOKUP(RC[-1],Sheet1!R3C2:R802C3,2,FALSE) -> شیمیایی | D448: =VLOOKUP(RC[-2],Sheet1!R3C2:R802C9,8,FALSE) -> 3.4710893283643496 | E448: =IF(VLOOKUP(RC[-3],Sheet1!R3C2:R803C11,10,FALSE)=0,"",VLOOKUP(Sheet2!RC[-3],Sheet1!R[1]C[-3]:R[801]C[6],10,FALSE)) -> 0.6 | F448: =Sheet1!R488C10 -> 5.0300989663672855 | G448: =IF(RC[-3]<0,0,IF(AND(RC[-3]<RC[-1],RC[-3]<2),100,IF(AND(RC[-3]<RC[-1],RC[-3]>=2,RC[-3]<3),95,IF(AND(RC[-3]<RC[-1],RC[-3]>=3,RC[-3]<4),90,IF(AND(RC[-3]<RC[-1],RC[-3]>=4,RC[-3]<5),85,IF(AND(RC[-3]<RC[-1],RC[-3]>=5,RC[-3]<6),80,IF(AND(RC[-3]<RC[-1],RC[-3]>=6,RC[-3]<7),75,IF(AND(RC[-3]<RC[-1],RC[-3]>=7,RC[-3]<8),70,IF(AND(RC[-3]<RC[-1],RC[-3]>=8,RC[-3]<9),65,IF(AND(RC[-3]<RC[-1],RC[-3]>=9,RC[-3]<10),60,IF(AND(RC[-3]<RC[-1],RC[-3]>=10,RC[-3]<11),55,IF(AND(RC[-3]<RC[-1],RC[-3]>=11,RC[-3]<12),50,IF(AND(RC[-3]<RC[-1],RC[-3]>=12,RC[-3]<13),45,IF(AND(RC[-3]<RC[-1],RC[-3]>=13,RC[-3]<14),40,IF(AND(RC[-3]<RC[-1],RC[-3]>=14,RC[-3]<15),35,IF(AND(RC[-3]<RC[-1],RC[-3]>=15,RC[-3]<16),30,IF(AND(RC[-3]<RC[-1],RC[-3]>=16,RC[-3]<17),25,IF(AND(RC[-3]<RC[-1],RC[-3]>=17,RC[-3]<18),20,IF(AND(RC[-3]<RC[-1],RC[-3]>=18,RC[-3]<19),15,IF(AND(RC[-3]<RC[-1],RC[-3]>=19,RC[-3]<20),10,IF(AND(RC[-3]<RC[-1],RC[-3]>=20,RC[-3]<21),5,IF(AND(RC[-3]<RC[-1],RC[-3]>=21),0,IF(AND(RC[-3]>RC[-1],RC[-3]>=2,RC[-3]<3),90,IF(AND(RC[-3]>RC[-1],RC[-3]>=3,RC[-3]<4),90,IF(AND(RC[-3]>RC[-1],RC[-3]>=4,RC[-3]<5),80,IF(AND(RC[-3]>RC[-1],RC[-3]>=5,RC[-3]<6),70,IF(AND(RC[-3]>RC[-1],RC[-3]>=6,RC[-3]<7),60,IF(AND(RC[-3]>RC[-1],RC[-3]>=7,RC[-3]<8),50,IF(AND(RC[-3]>RC[-1],RC[-3]>=8,RC[-3]<9),40,IF(AND(RC[-3]>RC[-1],RC[-3]>=9,RC[-3]<10),30,IF(AND(RC[-3]>RC[-1],RC[-3]>=10,RC[-3]<11),20,IF(AND(RC[-3]>RC[-1],RC[-3]>=11,RC[-3]<12),10,IF(AND(RC[-3]>RC[-1],RC[-3]>=12),0))))))))))))))))))))))))))))))))) -> 90 | H448: =IF(RC[-3]="","",IF(RC[-3]<0.3,100,IF(AND(RC[-3]>=0.3,RC[-3]>0.4),95,IF(AND(RC[-3]>=0.4,RC[-3]<0.5),90,IF(AND(RC[-3]>=0.5,RC[-3]<0.6),85,IF(AND(RC[-3]>=0.6,RC[-3]<0.7),80,IF(AND(RC[-3]>=0.6,RC[-3]<1),80,IF(AND(RC[-3]>1,RC[-3]<2),50,IF(RC[-3]>2,0))))))))) -> 95 | I448: =IF(RC[-1]="",RC[-2],0.7*RC[-1]+0.3*RC[-2]) -> 93.5
A449: گلتاش | B449: شگل | C449: =VLOOKUP(RC[-1],Sheet1!R3C2:R802C3,2,FALSE) -> شیمیایی | D449: =VLOOKUP(RC[-2],Sheet1!R3C2:R802C9,8,FALSE) -> 11.465736573536521 | E449: =IF(VLOOKUP(RC[-3],Sheet1!R3C2:R803C11,10,FALSE)=0,"",VLOOKUP(Sheet2!RC[-3],Sheet1!R[1]C[-3]:R[801]C[6],10,FALSE)) ->  | F449: =Sheet1!R488C10 -> 5.0300989663672855 | G449: =IF(RC[-3]<0,0,IF(AND(RC[-3]<RC[-1],RC[-3]<2),100,IF(AND(RC[-3]<RC[-1],RC[-3]>=2,RC[-3]<3),95,IF(AND(RC[-3]<RC[-1],RC[-3]>=3,RC[-3]<4),90,IF(AND(RC[-3]<RC[-1],RC[-3]>=4,RC[-3]<5),85,IF(AND(RC[-3]<RC[-1],RC[-3]>=5,RC[-3]<6),80,IF(AND(RC[-3]<RC[-1],RC[-3]>=6,RC[-3]<7),75,IF(AND(RC[-3]<RC[-1],RC[-3]>=7,RC[-3]<8),70,IF(AND(RC[-3]<RC[-1],RC[-3]>=8,RC[-3]<9),65,IF(AND(RC[-3]<RC[-1],RC[-3]>=9,RC[-3]<10),60,IF(AND(RC[-3]<RC[-1],RC[-3]>=10,RC[-3]<11),55,IF(AND(RC[-3]<RC[-1],RC[-3]>=11,RC[-3]<12),50,IF(AND(RC[-3]<RC[-1],RC[-3]>=12,RC[-3]<13),45,IF(AND(RC[-3]<RC[-1],RC[-3]>=13,RC[-3]<14),40,IF(AND(RC[-3]<RC[-1],RC[-3]>=14,RC[-3]<15),35,IF(AND(RC[-3]<RC[-1],RC[-3]>=15,RC[-3]<16),30,IF(AND(RC[-3]<RC[-1],RC[-3]>=16,RC[-3]<17),25,IF(AND(RC[-3]<RC[-1],RC[-3]>=17,RC[-3]<18),20,IF(AND(RC[-3]<RC[-1],RC[-3]>=18,RC[-3]<19),15,IF(AND(RC[-3]<RC[-1],RC[-3]>=19,RC[-3]<20),10,IF(AND(RC[-3]<RC[-1],RC[-3]>=20,RC[-3]<21),5,IF(AND(RC[-3]<RC[-1],RC[-3]>=21),0,IF(AND(RC[-3]>RC[-1],RC[-3]>=2,RC[-3]<3),90,IF(AND(RC[-3]>RC[-1],RC[-3]>=3,RC[-3]<4),90,IF(AND(RC[-3]>RC[-1],RC[-3]>=4,RC[-3]<5),80,IF(AND(RC[-3]>RC[-1],RC[-3]>=5,RC[-3]<6),70,IF(AND(RC[-3]>RC[-1],RC[-3]>=6,RC[-3]<7),60,IF(AND(RC[-3]>RC[-1],RC[-3]>=7,RC[-3]<8),50,IF(AND(RC[-3]>RC[-1],RC[-3]>=8,RC[-3]<9),40,IF(AND(RC[-3]>RC[-1],RC[-3]>=9,RC[-3]<10),30,IF(AND(RC[-3]>RC[-1],RC[-3]>=10,RC[-3]<11),20,IF(AND(RC[-3]>RC[-1],RC[-3]>=11,RC[-3]<12),10,IF(AND(RC[-3]>RC[-1],RC[-3]>=12),0))))))))))))))))))))))))))))))))) -> 10 | H449: =IF(RC[-3]="","",IF(RC[-3]<0.3,100,IF(AND(RC[-3]>=0.3,RC[-3]>0.4),95,IF(AND(RC[-3]>=0.4,RC[-3]<0.5),90,IF(AND(RC[-3]>=0.5,RC[-3]<0.6),85,IF(AND(RC[-3]>=0.6,RC[-3]<0.7),80,IF(AND(RC[-3]>=0.6,RC[-3]<1),80,IF(AND(RC[-3]>1,RC[-3]<2),50,IF(RC[-3]>2,0))))))))) ->  | I449: =IF(RC[-1]="",RC[-2],0.7*RC[-1]+0.3*RC[-2]) -> 10
A450: لعابیران | B450: شلعاب | C450: =VLOOKUP(RC[-1],Sheet1!R3C2:R802C3,2,FALSE) -> شیمیایی | D450: =VLOOKUP(RC[-2],Sheet1!R3C2:R802C9,8,FALSE) -> 35.243575969605004 | E450: =IF(VLOOKUP(RC[-3],Sheet1!R3C2:R803C11,10,FALSE)=0,"",VLOOKUP(Sheet2!RC[-3],Sheet1!R[1]C[-3]:R[801]C[6],10,FALSE)) ->  | F450: =Sheet1!R488C10 -> 5.0300989663672855 | G450: =IF(RC[-3]<0,0,IF(AND(RC[-3]<RC[-1],RC[-3]<2),100,IF(AND(RC[-3]<RC[-1],RC[-3]>=2,RC[-3]<3),95,IF(AND(RC[-3]<RC[-1],RC[-3]>=3,RC[-3]<4),90,IF(AND(RC[-3]<RC[-1],RC[-3]>=4,RC[-3]<5),85,IF(AND(RC[-3]<RC[-1],RC[-3]>=5,RC[-3]<6),80,IF(AND(RC[-3]<RC[-1],RC[-3]>=6,RC[-3]<7),75,IF(AND(RC[-3]<RC[-1],RC[-3]>=7,RC[-3]<8),70,IF(AND(RC[-3]<RC[-1],RC[-3]>=8,RC[-3]<9),65,IF(AND(RC[-3]<RC[-1],RC[-3]>=9,RC[-3]<10),60,IF(AND(RC[-3]<RC[-1],RC[-3]>=10,RC[-3]<11),55,IF(AND(RC[-3]<RC[-1],RC[-3]>=11,RC[-3]<12),50,IF(AND(RC[-3]<RC[-1],RC[-3]>=12,RC[-3]<13),45,IF(AND(RC[-3]<RC[-1],RC[-3]>=13,RC[-3]<14),40,IF(AND(RC[-3]<RC[-1],RC[-3]>=14,RC[-3]<15),35,IF(AND(RC[-3]<RC[-1],RC[-3]>=15,RC[-3]<16),30,IF(AND(RC[-3]<RC[-1],RC[-3]>=16,RC[-3]<17),25,IF(AND(RC[-3]<RC[-1],RC[-3]>=17,RC[-3]<18),20,IF(AND(RC[-3]<RC[-1],RC[-3]>=18,RC[-3]<19),15,IF(AND(RC[-3]<RC[-1],RC[-3]>=19,RC[-3]<20),10,IF(AND(RC[-3]<RC[-1],RC[-3]>=20,RC[-3]<21),5,IF(AND(RC[-3]<RC[-1],RC[-3]>=21),0,IF(AND(RC[-3]>RC[-1],RC[-3]>=2,RC[-3]<3),90,IF(AND(RC[-3]>RC[-1],RC[-3]>=3,RC[-3]<4),90,IF(AND(RC[-3]>RC[-1],RC[-3]>=4,RC[-3]<5),80,IF(AND(RC[-3]>RC[-1],RC[-3]>=5,RC[-3]<6),70,IF(AND(RC[-3]>RC[-1],RC[-3]>=6,RC[-3]<7),60,IF(AND(RC[-3]>RC[-1],RC[-3]>=7,RC[-3]<8),50,IF(AND(RC[-3]>RC[-1],RC[-3]>=8,RC[-3]<9),40,IF(AND(RC[-3]>RC[-1],RC[-3]>=9,RC[-3]<10),30,IF(AND(RC[-3]>RC[-1],RC[-3]>=10,RC[-3]<11),20,IF(AND(RC[-3]>RC[-1],RC[-3]>=11,RC[-3]<12),10,IF(AND(RC[-3]>RC[-1],RC[-3]>=12),0))))))))))))))))))))))))))))))))) -> 0 | H450: =IF(RC[-3]="","",IF(RC[-3]<0.3,100,IF(AND(RC[-3]>=0.3,RC[-3]>0.4),95,IF(AND(RC[-3]>=0.4,RC[-3]<0.5),90,IF(AND(RC[-3]>=0.5,RC[-3]<0.6),85,IF(AND(RC[-3]>=0.6,RC[-3]<0.7),80,IF(AND(RC[-3]>=0.6,RC[-3]<1),80,IF(AND(RC[-3]>1,RC[-3]<2),50,IF(RC[-3]>2,0))))))))) ->  | I450: =IF(RC[-1]="",RC[-2],0.7*RC[-1]+0.3*RC[-2]) -> 0
A451: مدیریت صنعت شوینده ت.ص بهشهر | B451: شوینده | C451: =VLOOKUP(RC[-1],Sheet1!R3C2:R802C3,2,FALSE) -> شیمیایی | D451: =VLOOKUP(RC[-2],Sheet1!R3C2:R802C9,8,FALSE) -> 4.5496326887993819 | E451: =IF(VLOOKUP(RC[-3],Sheet1!R3C2:R803C11,10,FALSE)=0,"",VLOOKUP(Sheet2!RC[-3],Sheet1!R[1]C[-3]:R[801]C[6],10,FALSE)) -> 0.6 | F451: =Sheet1!R488C10 -> 5.0300989663672855 | G451: =IF(RC[-3]<0,0,IF(AND(RC[-3]<RC[-1],RC[-3]<2),100,IF(AND(RC[-3]<RC[-1],RC[-3]>=2,RC[-3]<3),95,IF(AND(RC[-3]<RC[-1],RC[-3]>=3,RC[-3]<4),90,IF(AND(RC[-3]<RC[-1],RC[-3]>=4,RC[-3]<5),85,IF(AND(RC[-3]<RC[-1],RC[-3]>=5,RC[-3]<6),80,IF(AND(RC[-3]<RC[-1],RC[-3]>=6,RC[-3]<7),75,IF(AND(RC[-3]<RC[-1],RC[-3]>=7,RC[-3]<8),70,IF(AND(RC[-3]<RC[-1],RC[-3]>=8,RC[-3]<9),65,IF(AND(RC[-3]<RC[-1],RC[-3]>=9,RC[-3]<10),60,IF(AND(RC[-3]<RC[-1],RC[-3]>=10,RC[-3]<11),55,IF(AND(RC[-3]<RC[-1],RC[-3]>=11,RC[-3]<12),50,IF(AND(RC[-3]<RC[-1],RC[-3]>=12,RC[-3]<13),45,IF(AND(RC[-3]<RC[-1],RC[-3]>=13,RC[-3]<14),40,IF(AND(RC[-3]<RC[-1],RC[-3]>=14,RC[-3]<15),35,IF(AND(RC[-3]<RC[-1],RC[-3]>=15,RC[-3]<16),30,IF(AND(RC[-3]<RC[-1],RC[-3]>=16,RC[-3]<17),25,IF(AND(RC[-3]<RC[-1],RC[-3]>=17,RC[-3]<18),20,IF(AND(RC[-3]<RC[-1],RC[-3]>=18,RC[-3]<19),15,IF(AND(RC[-3]<RC[-1],RC[-3]>=19,RC[-3]<20),10,IF(AND(RC[-3]<RC[-1],RC[-3]>=20,RC[-3]<21),5,IF(AND(RC[-3]<RC[-1],RC[-3]>=21),0,IF(AND(RC[-3]>RC[-1],RC[-3]>=2,RC[-3]<3),90,IF(AND(RC[-3]>RC[-1],RC[-3]>=3,RC[-3]<4),90,IF(AND(RC[-3]>RC[-1],RC[-3]>=4,RC[-3]<5),80,IF(AND(RC[-3]>RC[-1],RC[-3]>=5,RC[-3]<6),70,IF(AND(RC[-3]>RC[-1],RC[-3]>=6,RC[-3]<7),60,IF(AND(RC[-3]>RC[-1],RC[-3]>=7,RC[-3]<8),50,IF(AND(RC[-3]>RC[-1],RC[-3]>=8,RC[-3]<9),40,IF(AND(RC[-3]>RC[-1],RC[-3]>=9,RC[-3]<10),30,IF(AND(RC[-3]>RC[-1],RC[-3]>=10,RC[-3]<11),20,IF(AND(RC[-3]>RC[-1],RC[-3]>=11,RC[-3]<12),10,IF(AND(RC[-3]>RC[-1],RC[-3]>=12),0))))))))))))))))))))))))))))))))) -> 85 | H451: =IF(RC[-3]="","",IF(RC[-3]<0.3,100,IF(AND(RC[-3]>=0.3,RC[-3]>0.4),95,IF(AND(RC[-3]>=0.4,RC[-3]<0.5),90,IF(AND(RC[-3]>=0.5,RC[-3]<0.6),85,IF(AND(RC[-3]>=0.6,RC[-3]<0.7),80,IF(AND(RC[-3]>=0.6,RC[-3]<1),80,IF(AND(RC[-3]>1,RC[-3]<2),50,IF(RC[-3]>2,0))))))))) -> 95 | I451: =IF(RC[-1]="",RC[-2],0.7*RC[-1]+0.3*RC[-2]) -> 92
A452: معدنی املاح ایران | B452: شاملا | C452: =VLOOKUP(RC[-1],Sheet1!R3C2:R802C3,2,FALSE) -> شیمیایی | D452: =VLOOKUP(RC[-2],Sheet1!R3C2:R802C9,8,FALSE) -> 9.5 | E452: =IF(VLOOKUP(RC[-3],Sheet1!R3C2:R803C11,10,FALSE)=0,"",VLOOKUP(Sheet2!RC[-3],Sheet1!R[1]C[-3]:R[801]C[6],10,FALSE)) ->  | F452: =Sheet1!R488C10 -> 5.0300989663672855 | G452: =IF(RC[-3]<0,0,IF(AND(RC[-3]<RC[-1],RC[-3]<2),100,IF(AND(RC[-3]<RC[-1],RC[-3]>=2,RC[-3]<3),95,IF(AND(RC[-3]<RC[-1],RC[-3]>=3,RC[-3]<4),90,IF(AND(RC[-3]<RC[-1],RC[-3]>=4,RC[-3]<5),85,IF(AND(RC[-3]<RC[-1],RC[-3]>=5,RC[-3]<6),80,IF(AND(RC[-3]<RC[-1],RC[-3]>=6,RC[-3]<7),75,IF(AND(RC[-3]<RC[-1],RC[-3]>=7,RC[-3]<8),70,IF(AND(RC[-3]<RC[-1],RC[-3]>=8,RC[-3]<9),65,IF(AND(RC[-3]<RC[-1],RC[-3]>=9,RC[-3]<10),60,IF(AND(RC[-3]<RC[-1],RC[-3]>=10,RC[-3]<11),55,IF(AND(RC[-3]<RC[-1],RC[-3]>=11,RC[-3]<12),50,IF(AND(RC[-3]<RC[-1],RC[-3]>=12,RC[-3]<13),45,IF(AND(RC[-3]<RC[-1],RC[-3]>=13,RC[-3]<14),40,IF(AND(RC[-3]<RC[-1],RC[-3]>=14,RC[-3]<15),35,IF(AND(RC[-3]<RC[-1],RC[-3]>=15,RC[-3]<16),30,IF(AND(RC[-3]<RC[-1],RC[-3]>=16,RC[-3]<17),25,IF(AND(RC[-3]<RC[-1],RC[-3]>=17,RC[-3]<18),20,IF(AND(RC[-3]<RC[-1],RC[-3]>=18,RC[-3]<19),15,IF(AND(RC[-3]<RC[-1],RC[-3]>=19,RC[-3]<20),10,IF(AND(RC[-3]<RC[-1],RC[-3]>=20,RC[-3]<21),5,IF(AND(RC[-3]<RC[-1],RC[-3]>=21),0,IF(AND(RC[-3]>RC[-1],RC[-3]>=2,RC[-3]<3),90,IF(AND(RC[-3]>RC[-1],RC[-3]>=3,RC[-3]<4),90,IF(AND(RC[-3]>RC[-1],RC[-3]>=4,RC[-3]<5),80,IF(AND(RC[-3]>RC[-1],RC[-3]>=5,RC[-3]<6),70,IF(AND(RC[-3]>RC[-1],RC[-3]>=6,RC[-3]<7),60,IF(AND(RC[-3]>RC[-1],RC[-3]>=7,RC[-3]<8),50,IF(AND(RC[-3]>RC[-1],RC[-3]>=8,RC[-3]<9),40,IF(AND(RC[-3]>RC[-1],RC[-3]>=9,RC[-3]<10),30,IF(AND(RC[-3]>RC[-1],RC[-3]>=10,RC[-3]<11),20,IF(AND(RC[-3]>RC[-1],RC[-3]>=11,RC[-3]<12),10,IF(AND(RC[-3]>RC[-1],RC[-3]>=12),0))))))))))))))))))))))))))))))))) -> 30 | H452: =IF(RC[-3]="","",IF(RC[-3]<0.3,100,IF(AND(RC[-3]>=0.3,RC[-3]>0.4),95,IF(AND(RC[-3]>=0.4,RC[-3]<0.5),90,IF(AND(RC[-3]>=0.5,RC[-3]<0.6),85,IF(AND(RC[-3]>=0.6,RC[-3]<0.7),80,IF(AND(RC[-3]>=0.6,RC[-3]<1),80,IF(AND(RC[-3]>1,RC[-3]<2),50,IF(RC[-3]>2,0))))))))) ->  | I452: =IF(RC[-1]="",RC[-2],0.7*RC[-1]+0.3*RC[-2]) -> 30
A453: مواد ویژه لیا | B453: شلیا | C453: =VLOOKUP(RC[-1],Sheet1!R3C2:R802C3,2,FALSE) -> شیمیایی | D453: =VLOOKUP(RC[-2],Sheet1!R3C2:R802C9,8,FALSE) -> 105.56352780932637 | E453: =IF(VLOOKUP(RC[-3],Sheet1!R3C2:R803C11,10,FALSE)=0,"",VLOOKUP(Sheet2!RC[-3],Sheet1!R[1]C[-3]:R[801]C[6],10,FALSE)) ->  | F453: =Sheet1!R488C10 -> 5.0300989663672855 | G453: =IF(RC[-3]<0,0,IF(AND(RC[-3]<RC[-1],RC[-3]<2),100,IF(AND(RC[-3]<RC[-1],RC[-3]>=2,RC[-3]<3),95,IF(AND(RC[-3]<RC[-1],RC[-3]>=3,RC[-3]<4),90,IF(AND(RC[-3]<RC[-1],RC[-3]>=4,RC[-3]<5),85,IF(AND(RC[-3]<RC[-1],RC[-3]>=5,RC[-3]<6),80,IF(AND(RC[-3]<RC[-1],RC[-3]>=6,RC[-3]<7),75,IF(AND(RC[-3]<RC[-1],RC[-3]>=7,RC[-3]<8),70,IF(AND(RC[-3]<RC[-1],RC[-3]>=8,RC[-3]<9),65,IF(AND(RC[-3]<RC[-1],RC[-3]>=9,RC[-3]<10),60,IF(AND(RC[-3]<RC[-1],RC[-3]>=10,RC[-3]<11),55,IF(AND(RC[-3]<RC[-1],RC[-3]>=11,RC[-3]<12),50,IF(AND(RC[-3]<RC[-1],RC[-3]>=12,RC[-3]<13),45,IF(AND(RC[-3]<RC[-1],RC[-3]>=13,RC[-3]<14),40,IF(AND(RC[-3]<RC[-1],RC[-3]>=14,RC[-3]<15),35,IF(AND(RC[-3]<RC[-1],RC[-3]>=15,RC[-3]<16),30,IF(AND(RC[-3]<RC[-1],RC[-3]>=16,RC[-3]<17),25,IF(AND(RC[-3]<RC[-1],RC[-3]>=17,RC[-3]<18),20,IF(AND(RC[-3]<RC[-1],RC[-3]>=18,RC[-3]<19),15,IF(AND(RC[-3]<RC[-1],RC[-3]>=19,RC[-3]<20),10,IF(AND(RC[-3]<RC[-1],RC[-3]>=20,RC[-3]<21),5,IF(AND(RC[-3]<RC[-1],RC[-3]>=21),0,IF(AND(RC[-3]>RC[-1],RC[-3]>=2,RC[-3]<3),90,IF(AND(RC[-3]>RC[-1],RC[-3]>=3,RC[-3]<4),90,IF(AND(RC[-3]>RC[-1],RC[-3]>=4,RC[-3]<5),80,IF(AND(RC[-3]>RC[-1],RC[-3]>=5,RC[-3]<6),70,IF(AND(RC[-3]>RC[-1],RC[-3]>=6,RC[-3]<7),60,IF(AND(RC[-3]>RC[-1],RC[-3]>=7,RC[-3]<8),50,IF(AND(RC[-3]>RC[-1],RC[-3]>=8,RC[-3]<9),40,IF(AND(RC[-3]>RC[-1],RC[-3]>=9,RC[-3]<10),30,IF(AND(RC[-3]>RC[-1],RC[-3]>=10,RC[-3]<11),20,IF(AND(RC[-3]>RC[-1],RC[-3]>=11,RC[-3]<12),10,IF(AND(RC[-3]>RC[-1],RC[-3]>=12),0))))))))))))))))))))))))))))))))) -> 0 | H453: =IF(RC[-3]="","",IF(RC[-3]<0.3,100,IF(AND(RC[-3]>=0.3,RC[-3]>0.4),95,IF(AND(RC[-3]>=0.4,RC[-3]<0.5),90,IF(AND(RC[-3]>=0.5,RC[-3]<0.6),85,IF(AND(RC[-3]>=0.6,RC[-3]<0.7),80,IF(AND(RC[-3]>=0.6,RC[-3]<1),80,IF(AND(RC[-3]>1,RC[-3]<2),50,IF(RC[-3]>2,0))))))))) ->  | I453: =IF(RC[-1]="",RC[-2],0.7*RC[-1]+0.3*RC[-2]) -> 0
A454: نیروکلر | B454: شکلر | C454: =VLOOKUP(RC[-1],Sheet1!R3C2:R802C3,2,FALSE) -> شیمیایی | D454: =VLOOKUP(RC[-2],Sheet1!R3C2:R802C9,8,FALSE) -> 5.0999999999999996 | E454: =IF(VLOOKUP(RC[-3],Sheet1!R3C2:R803C11,10,FALSE)=0,"",VLOOKUP(Sheet2!RC[-3],Sheet1!R[1]C[-3]:R[801]C[6],10,FALSE)) ->  | F454: =Sheet1!R488C10 -> 5.0300989663672855 | G454: =IF(RC[-3]<0,0,IF(AND(RC[-3]<RC[-1],RC[-3]<2),100,IF(AND(RC[-3]<RC[-1],RC[-3]>=2,RC[-3]<3),95,IF(AND(RC[-3]<RC[-1],RC[-3]>=3,RC[-3]<4),90,IF(AND(RC[-3]<RC[-1],RC[-3]>=4,RC[-3]<5),85,IF(AND(RC[-3]<RC[-1],RC[-3]>=5,RC[-3]<6),80,IF(AND(RC[-3]<RC[-1],RC[-3]>=6,RC[-3]<7),75,IF(AND(RC[-3]<RC[-1],RC[-3]>=7,RC[-3]<8),70,IF(AND(RC[-3]<RC[-1],RC[-3]>=8,RC[-3]<9),65,IF(AND(RC[-3]<RC[-1],RC[-3]>=9,RC[-3]<10),60,IF(AND(RC[-3]<RC[-1],RC[-3]>=10,RC[-3]<11),55,IF(AND(RC[-3]<RC[-1],RC[-3]>=11,RC[-3]<12),50,IF(AND(RC[-3]<RC[-1],RC[-3]>=12,RC[-3]<13),45,IF(AND(RC[-3]<RC[-1],RC[-3]>=13,RC[-3]<14),40,IF(AND(RC[-3]<RC[-1],RC[-3]>=14,RC[-3]<15),35,IF(AND(RC[-3]<RC[-1],RC[-3]>=15,RC[-3]<16),30,IF(AND(RC[-3]<RC[-1],RC[-3]>=16,RC[-3]<17),25,IF(AND(RC[-3]<RC[-1],RC[-3]>=17,RC[-3]<18),20,IF(AND(RC[-3]<RC[-1],RC[-3]>=18,RC[-3]<19),15,IF(AND(RC[-3]<RC[-1],RC[-3]>=19,RC[-3]<20),10,IF(AND(RC[-3]<RC[-1],RC[-3]>=20,RC[-3]<21),5,IF(AND(RC[-3]<RC[-1],RC[-3]>=21),0,IF(AND(RC[-3]>RC[-1],RC[-3]>=2,RC[-3]<3),90,IF(AND(RC[-3]>RC[-1],RC[-3]>=3,RC[-3]<4),90,IF(AND(RC[-3]>RC[-1],RC[-3]>=4,RC[-3]<5),80,IF(AND(RC[-3]>RC[-1],RC[-3]>=5,RC[-3]<6),70,IF(AND(RC[-3]>RC[-1],RC[-3]>=6,RC[-3]<7),60,IF(AND(RC[-3]>RC[-1],RC[-3]>=7,RC[-3]<8),50,IF(AND(RC[-3]>RC[-1],RC[-3]>=8,RC[-3]<9),40,IF(AND(RC[-3]>RC[-1],RC[-3]>=9,RC[-3]<10),30,IF(AND(RC[-3]>RC[-1],RC[-3]>=10,RC[-3]<11),20,IF(AND(RC[-3]>RC[-1],RC[-3]>=11,RC[-3]<12),10,IF(AND(RC[-3]>RC[-1],RC[-3]>=12),0))))))))))))))))))))))))))))))))) -> 70 | H454: =IF(RC[-3]="","",IF(RC[-3]<0.3,100,IF(AND(RC[-3]>=0.3,RC[-3]>0.4),95,IF(AND(RC[-3]>=0.4,RC[-3]<0.5),90,IF(AND(RC[-3]>=0.5,RC[-3]<0.6),85,IF(AND(RC[-3]>=0.6,RC[-3]<0.7),80,IF(AND(RC[-3]>=0.6,RC[-3]<1),80,IF(AND(RC[-3]>1,RC[-3]<2),50,IF(RC[-3]>2,0))))))))) ->  | I454: =IF(RC[-1]="",RC[-2],0.7*RC[-1]+0.3*RC[-2]) -> 70
A455: کربن ایران | B455: شکربن | C455: =VLOOKUP(RC[-1],Sheet1!R3C2:R802C3,2,FALSE) -> شیمیایی | D455: =VLOOKUP(RC[-2],Sheet1!R3C2:R802C9,8,FALSE) -> 5.8 | E455: =IF(VLOOKUP(RC[-3],Sheet1!R3C2:R803C11,10,FALSE)=0,"",VLOOKUP(Sheet2!RC[-3],Sheet1!R[1]C[-3]:R[801]C[6],10,FALSE)) ->  | F455: =Sheet1!R488C10 -> 5.0300989663672855 | G455: =IF(RC[-3]<0,0,IF(AND(RC[-3]<RC[-1],RC[-3]<2),100,IF(AND(RC[-3]<RC[-1],RC[-3]>=2,RC[-3]<3),95,IF(AND(RC[-3]<RC[-1],RC[-3]>=3,RC[-3]<4),90,IF(AND(RC[-3]<RC[-1],RC[-3]>=4,RC[-3]<5),85,IF(AND(RC[-3]<RC[-1],RC[-3]>=5,RC[-3]<6),80,IF(AND(RC[-3]<RC[-1],RC[-3]>=6,RC[-3]<7),75,IF(AND(RC[-3]<RC[-1],RC[-3]>=7,RC[-3]<8),70,IF(AND(RC[-3]<RC[-1],RC[-3]>=8,RC[-3]<9),65,IF(AND(RC[-3]<RC[-1],RC[-3]>=9,RC[-3]<10),60,IF(AND(RC[-3]<RC[-1],RC[-3]>=10,RC[-3]<11),55,IF(AND(RC[-3]<RC[-1],RC[-3]>=11,RC[-3]<12),50,IF(AND(RC[-3]<RC[-1],RC[-3]>=12,RC[-3]<13),45,IF(AND(RC[-3]<RC[-1],RC[-3]>=13,RC[-3]<14),40,IF(AND(RC[-3]<RC[-1],RC[-3]>=14,RC[-3]<15),35,IF(AND(RC[-3]<RC[-1],RC[-3]>=15,RC[-3]<16),30,IF(AND(RC[-3]<RC[-1],RC[-3]>=16,RC[-3]<17),25,IF(AND(RC[-3]<RC[-1],RC[-3]>=17,RC[-3]<18),20,IF(AND(RC[-3]<RC[-1],RC[-3]>=18,RC[-3]<19),15,IF(AND(RC[-3]<RC[-1],RC[-3]>=19,RC[-3]<20),10,IF(AND(RC[-3]<RC[-1],RC[-3]>=20,RC[-3]<21),5,IF(AND(RC[-3]<RC[-1],RC[-3]>=21),0,IF(AND(RC[-3]>RC[-1],RC[-3]>=2,RC[-3]<3),90,IF(AND(RC[-3]>RC[-1],RC[-3]>=3,RC[-3]<4),90,IF(AND(RC[-3]>RC[-1],RC[-3]>=4,RC[-3]<5),80,IF(AND(RC[-3]>RC[-1],RC[-3]>=5,RC[-3]<6),70,IF(AND(RC[-3]>RC[-1],RC[-3]>=6,RC[-3]<7),60,IF(AND(RC[-3]>RC[-1],RC[-3]>=7,RC[-3]<8),50,IF(AND(RC[-3]>RC[-1],RC[-3]>=8,RC[-3]<9),40,IF(AND(RC[-3]>RC[-1],RC[-3]>=9,RC[-3]<10),30,IF(AND(RC[-3]>RC[-1],RC[-3]>=10,RC[-3]<11),20,IF(AND(RC[-3]>RC[-1],RC[-3]>=11,RC[-3]<12),10,IF(AND(RC[-3]>RC[-1],RC[-3]>=12),0))))))))))))))))))))))))))))))))) -> 70 | H455: =IF(RC[-3]="","",IF(RC[-3]<0.3,100,IF(AND(RC[-3]>=0.3,RC[-3]>0.4),95,IF(AND(RC[-3]>=0.4,RC[-3]<0.5),90,IF(AND(RC[-3]>=0.5,RC[-3]<0.6),85,IF(AND(RC[-3]>=0.6,RC[-3]<0.7),80,IF(AND(RC[-3]>=0.6,RC[-3]<1),80,IF(AND(RC[-3]>1,RC[-3]<2),50,IF(RC[-3]>2,0))))))))) ->  | I455: =IF(RC[-1]="",RC[-2],0.7*RC[-1]+0.3*RC[-2]) -> 70
A456: کف | B456: شکف | C456: =VLOOKUP(RC[-1],Sheet1!R3C2:R802C3,2,FALSE) -> شیمیایی | D456: =VLOOKUP(RC[-2],Sheet1!R3C2:R802C9,8,FALSE) -> -4.6158256880733948 | E456: =IF(VLOOKUP(RC[-3],Sheet1!R3C2:R803C11,10,FALSE)=0,"",VLOOKUP(Sheet2!RC[-3],Sheet1!R[1]C[-3]:R[801]C[6],10,FALSE)) ->  | F456: =Sheet1!R488C10 -> 5.0300989663672855 | G456: =IF(RC[-3]<0,0,IF(AND(RC[-3]<RC[-1],RC[-3]<2),100,IF(AND(RC[-3]<RC[-1],RC[-3]>=2,RC[-3]<3),95,IF(AND(RC[-3]<RC[-1],RC[-3]>=3,RC[-3]<4),90,IF(AND(RC[-3]<RC[-1],RC[-3]>=4,RC[-3]<5),85,IF(AND(RC[-3]<RC[-1],RC[-3]>=5,RC[-3]<6),80,IF(AND(RC[-3]<RC[-1],RC[-3]>=6,RC[-3]<7),75,IF(AND(RC[-3]<RC[-1],RC[-3]>=7,RC[-3]<8),70,IF(AND(RC[-3]<RC[-1],RC[-3]>=8,RC[-3]<9),65,IF(AND(RC[-3]<RC[-1],RC[-3]>=9,RC[-3]<10),60,IF(AND(RC[-3]<RC[-1],RC[-3]>=10,RC[-3]<11),55,IF(AND(RC[-3]<RC[-1],RC[-3]>=11,RC[-3]<12),50,IF(AND(RC[-3]<RC[-1],RC[-3]>=12,RC[-3]<13),45,IF(AND(RC[-3]<RC[-1],RC[-3]>=13,RC[-3]<14),40,IF(AND(RC[-3]<RC[-1],RC[-3]>=14,RC[-3]<15),35,IF(AND(RC[-3]<RC[-1],RC[-3]>=15,RC[-3]<16),30,IF(AND(RC[-3]<RC[-1],RC[-3]>=16,RC[-3]<17),25,IF(AND(RC[-3]<RC[-1],RC[-3]>=17,RC[-3]<18),20,IF(AND(RC[-3]<RC[-1],RC[-3]>=18,RC[-3]<19),15,IF(AND(RC[-3]<RC[-1],RC[-3]>=19,RC[-3]<20),10,IF(AND(RC[-3]<RC[-1],RC[-3]>=20,RC[-3]<21),5,IF(AND(RC[-3]<RC[-1],RC[-3]>=21),0,IF(AND(RC[-3]>RC[-1],RC[-3]>=2,RC[-3]<3),90,IF(AND(RC[-3]>RC[-1],RC[-3]>=3,RC[-3]<4),90,IF(AND(RC[-3]>RC[-1],RC[-3]>=4,RC[-3]<5),80,IF(AND(RC[-3]>RC[-1],RC[-3]>=5,RC[-3]<6),70,IF(AND(RC[-3]>RC[-1],RC[-3]>=6,RC[-3]<7),60,IF(AND(RC[-3]>RC[-1],RC[-3]>=7,RC[-3]<8),50,IF(AND(RC[-3]>RC[-1],RC[-3]>=8,RC[-3]<9),40,IF(AND(RC[-3]>RC[-1],RC[-3]>=9,RC[-3]<10),30,IF(AND(RC[-3]>RC[-1],RC[-3]>=10,RC[-3]<11),20,IF(AND(RC[-3]>RC[-1],RC[-3]>=11,RC[-3]<12),10,IF(AND(RC[-3]>RC[-1],RC[-3]>=12),0))))))))))))))))))))))))))))))))) -> 0 | H456: =IF(RC[-3]="","",IF(RC[-3]<0.3,100,IF(AND(RC[-3]>=0.3,RC[-3]>0.4),95,IF(AND(RC[-3]>=0.4,RC[-3]<0.5),90,IF(AND(RC[-3]>=0.5,RC[-3]<0.6),85,IF(AND(RC[-3]>=0.6,RC[-3]<0.7),80,IF(AND(RC[-3]>=0.6,RC[-3]<1),80,IF(AND(RC[-3]>1,RC[-3]<2),50,IF(RC[-3]>2,0))))))))) ->  | I456: =IF(RC[-1]="",RC[-2],0.7*RC[-1]+0.3*RC[-2]) -> 0
A457: کلر پارس | B457: کلر | C457: =VLOOKUP(RC[-1],Sheet1!R3C2:R802C3,2,FALSE) -> شیمیایی | D457: =VLOOKUP(RC[-2],Sheet1!R3C2:R802C9,8,FALSE) -> 8.5634058807757505 | E457: =IF(VLOOKUP(RC[-3],Sheet1!R3C2:R803C11,10,FALSE)=0,"",VLOOKUP(Sheet2!RC[-3],Sheet1!R[1]C[-3]:R[801]C[6],10,FALSE)) ->  | F457: =Sheet1!R488C10 -> 5.0300989663672855 | G457: =IF(RC[-3]<0,0,IF(AND(RC[-3]<RC[-1],RC[-3]<2),100,IF(AND(RC[-3]<RC[-1],RC[-3]>=2,RC[-3]<3),95,IF(AND(RC[-3]<RC[-1],RC[-3]>=3,RC[-3]<4),90,IF(AND(RC[-3]<RC[-1],RC[-3]>=4,RC[-3]<5),85,IF(AND(RC[-3]<RC[-1],RC[-3]>=5,RC[-3]<6),80,IF(AND(RC[-3]<RC[-1],RC[-3]>=6,RC[-3]<7),75,IF(AND(RC[-3]<RC[-1],RC[-3]>=7,RC[-3]<8),70,IF(AND(RC[-3]<RC[-1],RC[-3]>=8,RC[-3]<9),65,IF(AND(RC[-3]<RC[-1],RC[-3]>=9,RC[-3]<10),60,IF(AND(RC[-3]<RC[-1],RC[-3]>=10,RC[-3]<11),55,IF(AND(RC[-3]<RC[-1],RC[-3]>=11,RC[-3]<12),50,IF(AND(RC[-3]<RC[-1],RC[-3]>=12,RC[-3]<13),45,IF(AND(RC[-3]<RC[-1],RC[-3]>=13,RC[-3]<14),40,IF(AND(RC[-3]<RC[-1],RC[-3]>=14,RC[-3]<15),35,IF(AND(RC[-3]<RC[-1],RC[-3]>=15,RC[-3]<16),30,IF(AND(RC[-3]<RC[-1],RC[-3]>=16,RC[-3]<17),25,IF(AND(RC[-3]<RC[-1],RC[-3]>=17,RC[-3]<18),20,IF(AND(RC[-3]<RC[-1],RC[-3]>=18,RC[-3]<19),15,IF(AND(RC[-3]<RC[-1],RC[-3]>=19,RC[-3]<20),10,IF(AND(RC[-3]<RC[-1],RC[-3]>=20,RC[-3]<21),5,IF(AND(RC[-3]<RC[-1],RC[-3]>=21),0,IF(AND(RC[-3]>RC[-1],RC[-3]>=2,RC[-3]<3),90,IF(AND(RC[-3]>RC[-1],RC[-3]>=3,RC[-3]<4),90,IF(AND(RC[-3]>RC[-1],RC[-3]>=4,RC[-3]<5),80,IF(AND(RC[-3]>RC[-1],RC[-3]>=5,RC[-3]<6),70,IF(AND(RC[-3]>RC[-1],RC[-3]>=6,RC[-3]<7),60,IF(AND(RC[-3]>RC[-1],RC[-3]>=7,RC[-3]<8),50,IF(AND(RC[-3]>RC[-1],RC[-3]>=8,RC[-3]<9),40,IF(AND(RC[-3]>RC[-1],RC[-3]>=9,RC[-3]<10),30,IF(AND(RC[-3]>RC[-1],RC[-3]>=10,RC[-3]<11),20,IF(AND(RC[-3]>RC[-1],RC[-3]>=11,RC[-3]<12),10,IF(AND(RC[-3]>RC[-1],RC[-3]>=12),0))))))))))))))))))))))))))))))))) -> 40 | H457: =IF(RC[-3]="","",IF(RC[-3]<0.3,100,IF(AND(RC[-3]>=0.3,RC[-3]>0.4),95,IF(AND(RC[-3]>=0.4,RC[-3]<0.5),90,IF(AND(RC[-3]>=0.5,RC[-3]<0.6),85,IF(AND(RC[-3]>=0.6,RC[-3]<0.7),80,IF(AND(RC[-3]>=0.6,RC[-3]<1),80,IF(AND(RC[-3]>1,RC[-3]<2),50,IF(RC[-3]>2,0))))))))) ->  | I457: =IF(RC[-1]="",RC[-2],0.7*RC[-1]+0.3*RC[-2]) -> 40
A458: کود شیمیایی اوره لردگان | B458: شلرد | C458: =VLOOKUP(RC[-1],Sheet1!R3C2:R802C3,2,FALSE) -> شیمیایی | D458: =VLOOKUP(RC[-2],Sheet1!R3C2:R802C9,8,FALSE) -> -3.5312444168200816 | E458: =IF(VLOOKUP(RC[-3],Sheet1!R3C2:R803C11,10,FALSE)=0,"",VLOOKUP(Sheet2!RC[-3],Sheet1!R[1]C[-3]:R[801]C[6],10,FALSE)) ->  | F458: =Sheet1!R488C10 -> 5.0300989663672855 | G458: =IF(RC[-3]<0,0,IF(AND(RC[-3]<RC[-1],RC[-3]<2),100,IF(AND(RC[-3]<RC[-1],RC[-3]>=2,RC[-3]<3),95,IF(AND(RC[-3]<RC[-1],RC[-3]>=3,RC[-3]<4),90,IF(AND(RC[-3]<RC[-1],RC[-3]>=4,RC[-3]<5),85,IF(AND(RC[-3]<RC[-1],RC[-3]>=5,RC[-3]<6),80,IF(AND(RC[-3]<RC[-1],RC[-3]>=6,RC[-3]<7),75,IF(AND(RC[-3]<RC[-1],RC[-3]>=7,RC[-3]<8),70,IF(AND(RC[-3]<RC[-1],RC[-3]>=8,RC[-3]<9),65,IF(AND(RC[-3]<RC[-1],RC[-3]>=9,RC[-3]<10),60,IF(AND(RC[-3]<RC[-1],RC[-3]>=10,RC[-3]<11),55,IF(AND(RC[-3]<RC[-1],RC[-3]>=11,RC[-3]<12),50,IF(AND(RC[-3]<RC[-1],RC[-3]>=12,RC[-3]<13),45,IF(AND(RC[-3]<RC[-1],RC[-3]>=13,RC[-3]<14),40,IF(AND(RC[-3]<RC[-1],RC[-3]>=14,RC[-3]<15),35,IF(AND(RC[-3]<RC[-1],RC[-3]>=15,RC[-3]<16),30,IF(AND(RC[-3]<RC[-1],RC[-3]>=16,RC[-3]<17),25,IF(AND(RC[-3]<RC[-1],RC[-3]>=17,RC[-3]<18),20,IF(AND(RC[-3]<RC[-1],RC[-3]>=18,RC[-3]<19),15,IF(AND(RC[-3]<RC[-1],RC[-3]>=19,RC[-3]<20),10,IF(AND(RC[-3]<RC[-1],RC[-3]>=20,RC[-3]<21),5,IF(AND(RC[-3]<RC[-1],RC[-3]>=21),0,IF(AND(RC[-3]>RC[-1],RC[-3]>=2,RC[-3]<3),90,IF(AND(RC[-3]>RC[-1],RC[-3]>=3,RC[-3]<4),90,IF(AND(RC[-3]>RC[-1],RC[-3]>=4,RC[-3]<5),80,IF(AND(RC[-3]>RC[-1],RC[-3]>=5,RC[-3]<6),70,IF(AND(RC[-3]>RC[-1],RC[-3]>=6,RC[-3]<7),60,IF(AND(RC[-3]>RC[-1],RC[-3]>=7,RC[-3]<8),50,IF(AND(RC[-3]>RC[-1],RC[-3]>=8,RC[-3]<9),40,IF(AND(RC[-3]>RC[-1],RC[-3]>=9,RC[-3]<10),30,IF(AND(RC[-3]>RC[-1],RC[-3]>=10,RC[-3]<11),20,IF(AND(RC[-3]>RC[-1],RC[-3]>=11,RC[-3]<12),10,IF(AND(RC[-3]>RC[-1],RC[-3]>=12),0))))))))))))))))))))))))))))))))) -> 0 | H458: =IF(RC[-3]="","",IF(RC[-3]<0.3,100,IF(AND(RC[-3]>=0.3,RC[-3]>0.4),95,IF(AND(RC[-3]>=0.4,RC[-3]<0.5),90,IF(AND(RC[-3]>=0.5,RC[-3]<0.6),85,IF(AND(RC[-3]>=0.6,RC[-3]<0.7),80,IF(AND(RC[-3]>=0.6,RC[-3]<1),80,IF(AND(RC[-3]>1,RC[-3]<2),50,IF(RC[-3]>2,0))))))))) ->  | I458: =IF(RC[-1]="",RC[-2],0.7*RC[-1]+0.3*RC[-2]) -> 0
A459: برق آبادان | B459: آبادا | C459: =VLOOKUP(RC[-1],Sheet1!R3C2:R802C3,2,FALSE) -> عرضه برق،گاز،بخار و آب گرم | D459: =VLOOKUP(RC[-2],Sheet1!R3C2:R802C9,8,FALSE) -> 315.13122481198195 | E459: =IF(VLOOKUP(RC[-3],Sheet1!R3C2:R803C11,10,FALSE)=0,"",VLOOKUP(Sheet2!RC[-3],Sheet1!R[1]C[-3]:R[801]C[6],10,FALSE)) ->  | F459: =Sheet1!R501C10 -> 12.402061270454334 | G459: =IF(RC[-3]<0,0,IF(AND(RC[-3]<RC[-1],RC[-3]<2),100,IF(AND(RC[-3]<RC[-1],RC[-3]>=2,RC[-3]<3),95,IF(AND(RC[-3]<RC[-1],RC[-3]>=3,RC[-3]<4),90,IF(AND(RC[-3]<RC[-1],RC[-3]>=4,RC[-3]<5),85,IF(AND(RC[-3]<RC[-1],RC[-3]>=5,RC[-3]<6),80,IF(AND(RC[-3]<RC[-1],RC[-3]>=6,RC[-3]<7),75,IF(AND(RC[-3]<RC[-1],RC[-3]>=7,RC[-3]<8),70,IF(AND(RC[-3]<RC[-1],RC[-3]>=8,RC[-3]<9),65,IF(AND(RC[-3]<RC[-1],RC[-3]>=9,RC[-3]<10),60,IF(AND(RC[-3]<RC[-1],RC[-3]>=10,RC[-3]<11),55,IF(AND(RC[-3]<RC[-1],RC[-3]>=11,RC[-3]<12),50,IF(AND(RC[-3]<RC[-1],RC[-3]>=12,RC[-3]<13),45,IF(AND(RC[-3]<RC[-1],RC[-3]>=13,RC[-3]<14),40,IF(AND(RC[-3]<RC[-1],RC[-3]>=14,RC[-3]<15),35,IF(AND(RC[-3]<RC[-1],RC[-3]>=15,RC[-3]<16),30,IF(AND(RC[-3]<RC[-1],RC[-3]>=16,RC[-3]<17),25,IF(AND(RC[-3]<RC[-1],RC[-3]>=17,RC[-3]<18),20,IF(AND(RC[-3]<RC[-1],RC[-3]>=18,RC[-3]<19),15,IF(AND(RC[-3]<RC[-1],RC[-3]>=19,RC[-3]<20),10,IF(AND(RC[-3]<RC[-1],RC[-3]>=20,RC[-3]<21),5,IF(AND(RC[-3]<RC[-1],RC[-3]>=21),0,IF(AND(RC[-3]>RC[-1],RC[-3]>=2,RC[-3]<3),90,IF(AND(RC[-3]>RC[-1],RC[-3]>=3,RC[-3]<4),90,IF(AND(RC[-3]>RC[-1],RC[-3]>=4,RC[-3]<5),80,IF(AND(RC[-3]>RC[-1],RC[-3]>=5,RC[-3]<6),70,IF(AND(RC[-3]>RC[-1],RC[-3]>=6,RC[-3]<7),60,IF(AND(RC[-3]>RC[-1],RC[-3]>=7,RC[-3]<8),50,IF(AND(RC[-3]>RC[-1],RC[-3]>=8,RC[-3]<9),40,IF(AND(RC[-3]>RC[-1],RC[-3]>=9,RC[-3]<10),30,IF(AND(RC[-3]>RC[-1],RC[-3]>=10,RC[-3]<11),20,IF(AND(RC[-3]>RC[-1],RC[-3]>=11,RC[-3]<12),10,IF(AND(RC[-3]>RC[-1],RC[-3]>=12),0))))))))))))))))))))))))))))))))) -> 0 | H459: =IF(RC[-3]="","",IF(RC[-3]<0.3,100,IF(AND(RC[-3]>=0.3,RC[-3]>0.4),95,IF(AND(RC[-3]>=0.4,RC[-3]<0.5),90,IF(AND(RC[-3]>=0.5,RC[-3]<0.6),85,IF(AND(RC[-3]>=0.6,RC[-3]<0.7),80,IF(AND(RC[-3]>=0.6,RC[-3]<1),80,IF(AND(RC[-3]>1,RC[-3]<2),50,IF(RC[-3]>2,0))))))))) ->  | I459: =IF(RC[-1]="",RC[-2],0.7*RC[-1]+0.3*RC[-2]) -> 0
A460: پیوند گستر پارس | B460: بپیوند | C460: =VLOOKUP(RC[-1],Sheet1!R3C2:R802C3,2,FALSE) -> عرضه برق،گاز،بخار و آب گرم | D460: =VLOOKUP(RC[-2],Sheet1!R3C2:R802C9,8,FALSE) -> 11.200050387790027 | E460: =IF(VLOOKUP(RC[-3],Sheet1!R3C2:R803C11,10,FALSE)=0,"",VLOOKUP(Sheet2!RC[-3],Sheet1!R[1]C[-3]:R[801]C[6],10,FALSE)) ->  | F460: =Sheet1!R501C10 -> 12.402061270454334 | G460: =IF(RC[-3]<0,0,IF(AND(RC[-3]<RC[-1],RC[-3]<2),100,IF(AND(RC[-3]<RC[-1],RC[-3]>=2,RC[-3]<3),95,IF(AND(RC[-3]<RC[-1],RC[-3]>=3,RC[-3]<4),90,IF(AND(RC[-3]<RC[-1],RC[-3]>=4,RC[-3]<5),85,IF(AND(RC[-3]<RC[-1],RC[-3]>=5,RC[-3]<6),80,IF(AND(RC[-3]<RC[-1],RC[-3]>=6,RC[-3]<7),75,IF(AND(RC[-3]<RC[-1],RC[-3]>=7,RC[-3]<8),70,IF(AND(RC[-3]<RC[-1],RC[-3]>=8,RC[-3]<9),65,IF(AND(RC[-3]<RC[-1],RC[-3]>=9,RC[-3]<10),60,IF(AND(RC[-3]<RC[-1],RC[-3]>=10,RC[-3]<11),55,IF(AND(RC[-3]<RC[-1],RC[-3]>=11,RC[-3]<12),50,IF(AND(RC[-3]<RC[-1],RC[-3]>=12,RC[-3]<13),45,IF(AND(RC[-3]<RC[-1],RC[-3]>=13,RC[-3]<14),40,IF(AND(RC[-3]<RC[-1],RC[-3]>=14,RC[-3]<15),35,IF(AND(RC[-3]<RC[-1],RC[-3]>=15,RC[-3]<16),30,IF(AND(RC[-3]<RC[-1],RC[-3]>=16,RC[-3]<17),25,IF(AND(RC[-3]<RC[-1],RC[-3]>=17,RC[-3]<18),20,IF(AND(RC[-3]<RC[-1],RC[-3]>=18,RC[-3]<19),15,IF(AND(RC[-3]<RC[-1],RC[-3]>=19,RC[-3]<20),10,IF(AND(RC[-3]<RC[-1],RC[-3]>=20,RC[-3]<21),5,IF(AND(RC[-3]<RC[-1],RC[-3]>=21),0,IF(AND(RC[-3]>RC[-1],RC[-3]>=2,RC[-3]<3),90,IF(AND(RC[-3]>RC[-1],RC[-3]>=3,RC[-3]<4),90,IF(AND(RC[-3]>RC[-1],RC[-3]>=4,RC[-3]<5),80,IF(AND(RC[-3]>RC[-1],RC[-3]>=5,RC[-3]<6),70,IF(AND(RC[-3]>RC[-1],RC[-3]>=6,RC[-3]<7),60,IF(AND(RC[-3]>RC[-1],RC[-3]>=7,RC[-3]<8),50,IF(AND(RC[-3]>RC[-1],RC[-3]>=8,RC[-3]<9),40,IF(AND(RC[-3]>RC[-1],RC[-3]>=9,RC[-3]<10),30,IF(AND(RC[-3]>RC[-1],RC[-3]>=10,RC[-3]<11),20,IF(AND(RC[-3]>RC[-1],RC[-3]>=11,RC[-3]<12),10,IF(AND(RC[-3]>RC[-1],RC[-3]>=12),0))))))))))))))))))))))))))))))))) -> 50 | H460: =IF(RC[-3]="","",IF(RC[-3]<0.3,100,IF(AND(RC[-3]>=0.3,RC[-3]>0.4),95,IF(AND(RC[-3]>=0.4,RC[-3]<0.5),90,IF(AND(RC[-3]>=0.5,RC[-3]<0.6),85,IF(AND(RC[-3]>=0.6,RC[-3]<0.7),80,IF(AND(RC[-3]>=0.6,RC[-3]<1),80,IF(AND(RC[-3]>1,RC[-3]<2),50,IF(RC[-3]>2,0))))))))) ->  | I460: =IF(RC[-1]="",RC[-2],0.7*RC[-1]+0.3*RC[-2]) -> 50
A461: توسعه مسیر برق گیلان | B461: بگیلان | C461: =VLOOKUP(RC[-1],Sheet1!R3C2:R802C3,2,FALSE) -> عرضه برق،گاز،بخار و آب گرم | D461: =VLOOKUP(RC[-2],Sheet1!R3C2:R802C9,8,FALSE) -> 10.004438264530172 | E461: =IF(VLOOKUP(RC[-3],Sheet1!R3C2:R803C11,10,FALSE)=0,"",VLOOKUP(Sheet2!RC[-3],Sheet1!R[1]C[-3]:R[801]C[6],10,FALSE)) ->  | F461: =Sheet1!R501C10 -> 12.402061270454334 | G461: =IF(RC[-3]<0,0,IF(AND(RC[-3]<RC[-1],RC[-3]<2),100,IF(AND(RC[-3]<RC[-1],RC[-3]>=2,RC[-3]<3),95,IF(AND(RC[-3]<RC[-1],RC[-3]>=3,RC[-3]<4),90,IF(AND(RC[-3]<RC[-1],RC[-3]>=4,RC[-3]<5),85,IF(AND(RC[-3]<RC[-1],RC[-3]>=5,RC[-3]<6),80,IF(AND(RC[-3]<RC[-1],RC[-3]>=6,RC[-3]<7),75,IF(AND(RC[-3]<RC[-1],RC[-3]>=7,RC[-3]<8),70,IF(AND(RC[-3]<RC[-1],RC[-3]>=8,RC[-3]<9),65,IF(AND(RC[-3]<RC[-1],RC[-3]>=9,RC[-3]<10),60,IF(AND(RC[-3]<RC[-1],RC[-3]>=10,RC[-3]<11),55,IF(AND(RC[-3]<RC[-1],RC[-3]>=11,RC[-3]<12),50,IF(AND(RC[-3]<RC[-1],RC[-3]>=12,RC[-3]<13),45,IF(AND(RC[-3]<RC[-1],RC[-3]>=13,RC[-3]<14),40,IF(AND(RC[-3]<RC[-1],RC[-3]>=14,RC[-3]<15),35,IF(AND(RC[-3]<RC[-1],RC[-3]>=15,RC[-3]<16),30,IF(AND(RC[-3]<RC[-1],RC[-3]>=16,RC[-3]<17),25,IF(AND(RC[-3]<RC[-1],RC[-3]>=17,RC[-3]<18),20,IF(AND(RC[-3]<RC[-1],RC[-3]>=18,RC[-3]<19),15,IF(AND(RC[-3]<RC[-1],RC[-3]>=19,RC[-3]<20),10,IF(AND(RC[-3]<RC[-1],RC[-3]>=20,RC[-3]<21),5,IF(AND(RC[-3]<RC[-1],RC[-3]>=21),0,IF(AND(RC[-3]>RC[-1],RC[-3]>=2,RC[-3]<3),90,IF(AND(RC[-3]>RC[-1],RC[-3]>=3,RC[-3]<4),90,IF(AND(RC[-3]>RC[-1],RC[-3]>=4,RC[-3]<5),80,IF(AND(RC[-3]>RC[-1],RC[-3]>=5,RC[-3]<6),70,IF(AND(RC[-3]>RC[-1],RC[-3]>=6,RC[-3]<7),60,IF(AND(RC[-3]>RC[-1],RC[-3]>=7,RC[-3]<8),50,IF(AND(RC[-3]>RC[-1],RC[-3]>=8,RC[-3]<9),40,IF(AND(RC[-3]>RC[-1],RC[-3]>=9,RC[-3]<10),30,IF(AND(RC[-3]>RC[-1],RC[-3]>=10,RC[-3]<11),20,IF(AND(RC[-3]>RC[-1],RC[-3]>=11,RC[-3]<12),10,IF(AND(RC[-3]>RC[-1],RC[-3]>=12),0))))))))))))))))))))))))))))))))) -> 55 | H461: =IF(RC[-3]="","",IF(RC[-3]<0.3,100,IF(AND(RC[-3]>=0.3,RC[-3]>0.4),95,IF(AND(RC[-3]>=0.4,RC[-3]<0.5),90,IF(AND(RC[-3]>=0.5,RC[-3]<0.6),85,IF(AND(RC[-3]>=0.6,RC[-3]<0.7),80,IF(AND(RC[-3]>=0.6,RC[-3]<1),80,IF(AND(RC[-3]>1,RC[-3]<2),50,IF(RC[-3]>2,0))))))))) ->  | I461: =IF(RC[-1]="",RC[-2],0.7*RC[-1]+0.3*RC[-2]) -> 55
A462: تولید برق دماوند | B462: دماوند | C462: =VLOOKUP(RC[-1],Sheet1!R3C2:R802C3,2,FALSE) -> عرضه برق،گاز،بخار و آب گرم | D462: =VLOOKUP(RC[-2],Sheet1!R3C2:R802C9,8,FALSE) -> 10.561442310775783 | E462: =IF(VLOOKUP(RC[-3],Sheet1!R3C2:R803C11,10,FALSE)=0,"",VLOOKUP(Sheet2!RC[-3],Sheet1!R[1]C[-3]:R[801]C[6],10,FALSE)) ->  | F462: =Sheet1!R501C10 -> 12.402061270454334 | G462: =IF(RC[-3]<0,0,IF(AND(RC[-3]<RC[-1],RC[-3]<2),100,IF(AND(RC[-3]<RC[-1],RC[-3]>=2,RC[-3]<3),95,IF(AND(RC[-3]<RC[-1],RC[-3]>=3,RC[-3]<4),90,IF(AND(RC[-3]<RC[-1],RC[-3]>=4,RC[-3]<5),85,IF(AND(RC[-3]<RC[-1],RC[-3]>=5,RC[-3]<6),80,IF(AND(RC[-3]<RC[-1],RC[-3]>=6,RC[-3]<7),75,IF(AND(RC[-3]<RC[-1],RC[-3]>=7,RC[-3]<8),70,IF(AND(RC[-3]<RC[-1],RC[-3]>=8,RC[-3]<9),65,IF(AND(RC[-3]<RC[-1],RC[-3]>=9,RC[-3]<10),60,IF(AND(RC[-3]<RC[-1],RC[-3]>=10,RC[-3]<11),55,IF(AND(RC[-3]<RC[-1],RC[-3]>=11,RC[-3]<12),50,IF(AND(RC[-3]<RC[-1],RC[-3]>=12,RC[-3]<13),45,IF(AND(RC[-3]<RC[-1],RC[-3]>=13,RC[-3]<14),40,IF(AND(RC[-3]<RC[-1],RC[-3]>=14,RC[-3]<15),35,IF(AND(RC[-3]<RC[-1],RC[-3]>=15,RC[-3]<16),30,IF(AND(RC[-3]<RC[-1],RC[-3]>=16,RC[-3]<17),25,IF(AND(RC[-3]<RC[-1],RC[-3]>=17,RC[-3]<18),20,IF(AND(RC[-3]<RC[-1],RC[-3]>=18,RC[-3]<19),15,IF(AND(RC[-3]<RC[-1],RC[-3]>=19,RC[-3]<20),10,IF(AND(RC[-3]<RC[-1],RC[-3]>=20,RC[-3]<21),5,IF(AND(RC[-3]<RC[-1],RC[-3]>=21),0,IF(AND(RC[-3]>RC[-1],RC[-3]>=2,RC[-3]<3),90,IF(AND(RC[-3]>RC[-1],RC[-3]>=3,RC[-3]<4),90,IF(AND(RC[-3]>RC[-1],RC[-3]>=4,RC[-3]<5),80,IF(AND(RC[-3]>RC[-1],RC[-3]>=5,RC[-3]<6),70,IF(AND(RC[-3]>RC[-1],RC[-3]>=6,RC[-3]<7),60,IF(AND(RC[-3]>RC[-1],RC[-3]>=7,RC[-3]<8),50,IF(AND(RC[-3]>RC[-1],RC[-3]>=8,RC[-3]<9),40,IF(AND(RC[-3]>RC[-1],RC[-3]>=9,RC[-3]<10),30,IF(AND(RC[-3]>RC[-1],RC[-3]>=10,RC[-3]<11),20,IF(AND(RC[-3]>RC[-1],RC[-3]>=11,RC[-3]<12),10,IF(AND(RC[-3]>RC[-1],RC[-3]>=12),0))))))))))))))))))))))))))))))))) -> 55 | H462: =IF(RC[-3]="","",IF(RC[-3]<0.3,100,IF(AND(RC[-3]>=0.3,RC[-3]>0.4),95,IF(AND(RC[-3]>=0.4,RC[-3]<0.5),90,IF(AND(RC[-3]>=0.5,RC[-3]<0.6),85,IF(AND(RC[-3]>=0.6,RC[-3]<0.7),80,IF(AND(RC[-3]>=0.6,RC[-3]<1),80,IF(AND(RC[-3]>1,RC[-3]<2),50,IF(RC[-3]>2,0))))))))) ->  | I462: =IF(RC[-1]="",RC[-2],0.7*RC[-1]+0.3*RC[-2]) -> 55
A463: تولید برق عسلویه مپنا | B463: بمپنا | C463: =VLOOKUP(RC[-1],Sheet1!R3C2:R802C3,2,FALSE) -> عرضه برق،گاز،بخار و آب گرم | D463: =VLOOKUP(RC[-2],Sheet1!R3C2:R802C9,8,FALSE) -> 13.128212623938044 | E463: =IF(VLOOKUP(RC[-3],Sheet1!R3C2:R803C11,10,FALSE)=0,"",VLOOKUP(Sheet2!RC[-3],Sheet1!R[1]C[-3]:R[801]C[6],10,FALSE)) ->  | F463: =Sheet1!R501C10 -> 12.402061270454334 | G463: =IF(RC[-3]<0,0,IF(AND(RC[-3]<RC[-1],RC[-3]<2),100,IF(AND(RC[-3]<RC[-1],RC[-3]>=2,RC[-3]<3),95,IF(AND(RC[-3]<RC[-1],RC[-3]>=3,RC[-3]<4),90,IF(AND(RC[-3]<RC[-1],RC[-3]>=4,RC[-3]<5),85,IF(AND(RC[-3]<RC[-1],RC[-3]>=5,RC[-3]<6),80,IF(AND(RC[-3]<RC[-1],RC[-3]>=6,RC[-3]<7),75,IF(AND(RC[-3]<RC[-1],RC[-3]>=7,RC[-3]<8),70,IF(AND(RC[-3]<RC[-1],RC[-3]>=8,RC[-3]<9),65,IF(AND(RC[-3]<RC[-1],RC[-3]>=9,RC[-3]<10),60,IF(AND(RC[-3]<RC[-1],RC[-3]>=10,RC[-3]<11),55,IF(AND(RC[-3]<RC[-1],RC[-3]>=11,RC[-3]<12),50,IF(AND(RC[-3]<RC[-1],RC[-3]>=12,RC[-3]<13),45,IF(AND(RC[-3]<RC[-1],RC[-3]>=13,RC[-3]<14),40,IF(AND(RC[-3]<RC[-1],RC[-3]>=14,RC[-3]<15),35,IF(AND(RC[-3]<RC[-1],RC[-3]>=15,RC[-3]<16),30,IF(AND(RC[-3]<RC[-1],RC[-3]>=16,RC[-3]<17),25,IF(AND(RC[-3]<RC[-1],RC[-3]>=17,RC[-3]<18),20,IF(AND(RC[-3]<RC[-1],RC[-3]>=18,RC[-3]<19),15,IF(AND(RC[-3]<RC[-1],RC[-3]>=19,RC[-3]<20),10,IF(AND(RC[-3]<RC[-1],RC[-3]>=20,RC[-3]<21),5,IF(AND(RC[-3]<RC[-1],RC[-3]>=21),0,IF(AND(RC[-3]>RC[-1],RC[-3]>=2,RC[-3]<3),90,IF(AND(RC[-3]>RC[-1],RC[-3]>=3,RC[-3]<4),90,IF(AND(RC[-3]>RC[-1],RC[-3]>=4,RC[-3]<5),80,IF(AND(RC[-3]>RC[-1],RC[-3]>=5,RC[-3]<6),70,IF(AND(RC[-3]>RC[-1],RC[-3]>=6,RC[-3]<7),60,IF(AND(RC[-3]>RC[-1],RC[-3]>=7,RC[-3]<8),50,IF(AND(RC[-3]>RC[-1],RC[-3]>=8,RC[-3]<9),40,IF(AND(RC[-3]>RC[-1],RC[-3]>=9,RC[-3]<10),30,IF(AND(RC[-3]>RC[-1],RC[-3]>=10,RC[-3]<11),20,IF(AND(RC[-3]>RC[-1],RC[-3]>=11,RC[-3]<12),10,IF(AND(RC[-3]>RC[-1],RC[-3]>=12),0))))))))))))))))))))))))))))))))) -> 0 | H463: =IF(RC[-3]="","",IF(RC[-3]<0.3,100,IF(AND(RC[-3]>=0.3,RC[-3]>0.4),95,IF(AND(RC[-3]>=0.4,RC[-3]<0.5),90,IF(AND(RC[-3]>=0.5,RC[-3]<0.6),85,IF(AND(RC[-3]>=0.6,RC[-3]<0.7),80,IF(AND(RC[-3]>=0.6,RC[-3]<1),80,IF(AND(RC[-3]>1,RC[-3]<2),50,IF(RC[-3]>2,0))))))))) ->  | I463: =IF(RC[-1]="",RC[-2],0.7*RC[-1]+0.3*RC[-2]) -> 0
A464: تولید برق ماهتاب کهنوج | B464: بکهنوج | C464: =VLOOKUP(RC[-1],Sheet1!R3C2:R802C3,2,FALSE) -> عرضه برق،گاز،بخار و آب گرم | D464: =VLOOKUP(RC[-2],Sheet1!R3C2:R802C9,8,FALSE) -> -0.73330522765598649 | E464: =IF(VLOOKUP(RC[-3],Sheet1!R3C2:R803C11,10,FALSE)=0,"",VLOOKUP(Sheet2!RC[-3],Sheet1!R[1]C[-3]:R[801]C[6],10,FALSE)) ->  | F464: =Sheet1!R501C10 -> 12.402061270454334 | G464: =IF(RC[-3]<0,0,IF(AND(RC[-3]<RC[-1],RC[-3]<2),100,IF(AND(RC[-3]<RC[-1],RC[-3]>=2,RC[-3]<3),95,IF(AND(RC[-3]<RC[-1],RC[-3]>=3,RC[-3]<4),90,IF(AND(RC[-3]<RC[-1],RC[-3]>=4,RC[-3]<5),85,IF(AND(RC[-3]<RC[-1],RC[-3]>=5,RC[-3]<6),80,IF(AND(RC[-3]<RC[-1],RC[-3]>=6,RC[-3]<7),75,IF(AND(RC[-3]<RC[-1],RC[-3]>=7,RC[-3]<8),70,IF(AND(RC[-3]<RC[-1],RC[-3]>=8,RC[-3]<9),65,IF(AND(RC[-3]<RC[-1],RC[-3]>=9,RC[-3]<10),60,IF(AND(RC[-3]<RC[-1],RC[-3]>=10,RC[-3]<11),55,IF(AND(RC[-3]<RC[-1],RC[-3]>=11,RC[-3]<12),50,IF(AND(RC[-3]<RC[-1],RC[-3]>=12,RC[-3]<13),45,IF(AND(RC[-3]<RC[-1],RC[-3]>=13,RC[-3]<14),40,IF(AND(RC[-3]<RC[-1],RC[-3]>=14,RC[-3]<15),35,IF(AND(RC[-3]<RC[-1],RC[-3]>=15,RC[-3]<16),30,IF(AND(RC[-3]<RC[-1],RC[-3]>=16,RC[-3]<17),25,IF(AND(RC[-3]<RC[-1],RC[-3]>=17,RC[-3]<18),20,IF(AND(RC[-3]<RC[-1],RC[-3]>=18,RC[-3]<19),15,IF(AND(RC[-3]<RC[-1],RC[-3]>=19,RC[-3]<20),10,IF(AND(RC[-3]<RC[-1],RC[-3]>=20,RC[-3]<21),5,IF(AND(RC[-3]<RC[-1],RC[-3]>=21),0,IF(AND(RC[-3]>RC[-1],RC[-3]>=2,RC[-3]<3),90,IF(AND(RC[-3]>RC[-1],RC[-3]>=3,RC[-3]<4),90,IF(AND(RC[-3]>RC[-1],RC[-3]>=4,RC[-3]<5),80,IF(AND(RC[-3]>RC[-1],RC[-3]>=5,RC[-3]<6),70,IF(AND(RC[-3]>RC[-1],RC[-3]>=6,RC[-3]<7),60,IF(AND(RC[-3]>RC[-1],RC[-3]>=7,RC[-3]<8),50,IF(AND(RC[-3]>RC[-1],RC[-3]>=8,RC[-3]<9),40,IF(AND(RC[-3]>RC[-1],RC[-3]>=9,RC[-3]<10),30,IF(AND(RC[-3]>RC[-1],RC[-3]>=10,RC[-3]<11),20,IF(AND(RC[-3]>RC[-1],RC[-3]>=11,RC[-3]<12),10,IF(AND(RC[-3]>RC[-1],RC[-3]>=12),0))))))))))))))))))))))))))))))))) -> 0 | H464: =IF(RC[-3]="","",IF(RC[-3]<0.3,100,IF(AND(RC[-3]>=0.3,RC[-3]>0.4),95,IF(AND(RC[-3]>=0.4,RC[-3]<0.5),90,IF(AND(RC[-3]>=0.5,RC[-3]<0.6),85,IF(AND(RC[-3]>=0.6,RC[-3]<0.7),80,IF(AND(RC[-3]>=0.6,RC[-3]<1),80,IF(AND(RC[-3]>1,RC[-3]<2),50,IF(RC[-3]>2,0))))))))) ->  | I464: =IF(RC[-1]="",RC[-2],0.7*RC[-1]+0.3*RC[-2]) -> 0
A465: سر. نیرو | B465: ونیرو | C465: =VLOOKUP(RC[-1],Sheet1!R3C2:R802C3,2,FALSE) -> عرضه برق،گاز،بخار و آب گرم | D465: =VLOOKUP(RC[-2],Sheet1!R3C2:R802C9,8,FALSE) -> 49.641835855943846 | E465: =IF(VLOOKUP(RC[-3],Sheet1!R3C2:R803C11,10,FALSE)=0,"",VLOOKUP(Sheet2!RC[-3],Sheet1!R[1]C[-3]:R[801]C[6],10,FALSE)) -> 1.7 | F465: =Sheet1!R501C10 -> 12.402061270454334 | G465: =IF(RC[-3]<0,0,IF(AND(RC[-3]<RC[-1],RC[-3]<2),100,IF(AND(RC[-3]<RC[-1],RC[-3]>=2,RC[-3]<3),95,IF(AND(RC[-3]<RC[-1],RC[-3]>=3,RC[-3]<4),90,IF(AND(RC[-3]<RC[-1],RC[-3]>=4,RC[-3]<5),85,IF(AND(RC[-3]<RC[-1],RC[-3]>=5,RC[-3]<6),80,IF(AND(RC[-3]<RC[-1],RC[-3]>=6,RC[-3]<7),75,IF(AND(RC[-3]<RC[-1],RC[-3]>=7,RC[-3]<8),70,IF(AND(RC[-3]<RC[-1],RC[-3]>=8,RC[-3]<9),65,IF(AND(RC[-3]<RC[-1],RC[-3]>=9,RC[-3]<10),60,IF(AND(RC[-3]<RC[-1],RC[-3]>=10,RC[-3]<11),55,IF(AND(RC[-3]<RC[-1],RC[-3]>=11,RC[-3]<12),50,IF(AND(RC[-3]<RC[-1],RC[-3]>=12,RC[-3]<13),45,IF(AND(RC[-3]<RC[-1],RC[-3]>=13,RC[-3]<14),40,IF(AND(RC[-3]<RC[-1],RC[-3]>=14,RC[-3]<15),35,IF(AND(RC[-3]<RC[-1],RC[-3]>=15,RC[-3]<16),30,IF(AND(RC[-3]<RC[-1],RC[-3]>=16,RC[-3]<17),25,IF(AND(RC[-3]<RC[-1],RC[-3]>=17,RC[-3]<18),20,IF(AND(RC[-3]<RC[-1],RC[-3]>=18,RC[-3]<19),15,IF(AND(RC[-3]<RC[-1],RC[-3]>=19,RC[-3]<20),10,IF(AND(RC[-3]<RC[-1],RC[-3]>=20,RC[-3]<21),5,IF(AND(RC[-3]<RC[-1],RC[-3]>=21),0,IF(AND(RC[-3]>RC[-1],RC[-3]>=2,RC[-3]<3),90,IF(AND(RC[-3]>RC[-1],RC[-3]>=3,RC[-3]<4),90,IF(AND(RC[-3]>RC[-1],RC[-3]>=4,RC[-3]<5),80,IF(AND(RC[-3]>RC[-1],RC[-3]>=5,RC[-3]<6),70,IF(AND(RC[-3]>RC[-1],RC[-3]>=6,RC[-3]<7),60,IF(AND(RC[-3]>RC[-1],RC[-3]>=7,RC[-3]<8),50,IF(AND(RC[-3]>RC[-1],RC[-3]>=8,RC[-3]<9),40,IF(AND(RC[-3]>RC[-1],RC[-3]>=9,RC[-3]<10),30,IF(AND(RC[-3]>RC[-1],RC[-3]>=10,RC[-3]<11),20,IF(AND(RC[-3]>RC[-1],RC[-3]>=11,RC[-3]<12),10,IF(AND(RC[-3]>RC[-1],RC[-3]>=12),0))))))))))))))))))))))))))))))))) -> 0 | H465: =IF(RC[-3]="","",IF(RC[-3]<0.3,100,IF(AND(RC[-3]>=0.3,RC[-3]>0.4),95,IF(AND(RC[-3]>=0.4,RC[-3]<0.5),90,IF(AND(RC[-3]>=0.5,RC[-3]<0.6),85,IF(AND(RC[-3]>=0.6,RC[-3]<0.7),80,IF(AND(RC[-3]>=0.6,RC[-3]<1),80,IF(AND(RC[-3]>1,RC[-3]<2),50,IF(RC[-3]>2,0))))))))) -> 95 | I465: =IF(RC[-1]="",RC[-2],0.7*RC[-1]+0.3*RC[-2]) -> 66.5
A466: فجر انرژی خلیج فارس | B466: بفجر | C466: =VLOOKUP(RC[-1],Sheet1!R3C2:R802C3,2,FALSE) -> عرضه برق،گاز،بخار و آب گرم | D466: =VLOOKUP(RC[-2],Sheet1!R3C2:R802C9,8,FALSE) -> 3.2584147112043671 | E466: =IF(VLOOKUP(RC[-3],Sheet1!R3C2:R803C11,10,FALSE)=0,"",VLOOKUP(Sheet2!RC[-3],Sheet1!R[1]C[-3]:R[801]C[6],10,FALSE)) ->  | F466: =Sheet1!R501C10 -> 12.402061270454334 | G466: =IF(RC[-3]<0,0,IF(AND(RC[-3]<RC[-1],RC[-3]<2),100,IF(AND(RC[-3]<RC[-1],RC[-3]>=2,RC[-3]<3),95,IF(AND(RC[-3]<RC[-1],RC[-3]>=3,RC[-3]<4),90,IF(AND(RC[-3]<RC[-1],RC[-3]>=4,RC[-3]<5),85,IF(AND(RC[-3]<RC[-1],RC[-3]>=5,RC[-3]<6),80,IF(AND(RC[-3]<RC[-1],RC[-3]>=6,RC[-3]<7),75,IF(AND(RC[-3]<RC[-1],RC[-3]>=7,RC[-3]<8),70,IF(AND(RC[-3]<RC[-1],RC[-3]>=8,RC[-3]<9),65,IF(AND(RC[-3]<RC[-1],RC[-3]>=9,RC[-3]<10),60,IF(AND(RC[-3]<RC[-1],RC[-3]>=10,RC[-3]<11),55,IF(AND(RC[-3]<RC[-1],RC[-3]>=11,RC[-3]<12),50,IF(AND(RC[-3]<RC[-1],RC[-3]>=12,RC[-3]<13),45,IF(AND(RC[-3]<RC[-1],RC[-3]>=13,RC[-3]<14),40,IF(AND(RC[-3]<RC[-1],RC[-3]>=14,RC[-3]<15),35,IF(AND(RC[-3]<RC[-1],RC[-3]>=15,RC[-3]<16),30,IF(AND(RC[-3]<RC[-1],RC[-3]>=16,RC[-3]<17),25,IF(AND(RC[-3]<RC[-1],RC[-3]>=17,RC[-3]<18),20,IF(AND(RC[-3]<RC[-1],RC[-3]>=18,RC[-3]<19),15,IF(AND(RC[-3]<RC[-1],RC[-3]>=19,RC[-3]<20),10,IF(AND(RC[-3]<RC[-1],RC[-3]>=20,RC[-3]<21),5,IF(AND(RC[-3]<RC[-1],RC[-3]>=21),0,IF(AND(RC[-3]>RC[-1],RC[-3]>=2,RC[-3]<3),90,IF(AND(RC[-3]>RC[-1],RC[-3]>=3,RC[-3]<4),90,IF(AND(RC[-3]>RC[-1],RC[-3]>=4,RC[-3]<5),80,IF(AND(RC[-3]>RC[-1],RC[-3]>=5,RC[-3]<6),70,IF(AND(RC[-3]>RC[-1],RC[-3]>=6,RC[-3]<7),60,IF(AND(RC[-3]>RC[-1],RC[-3]>=7,RC[-3]<8),50,IF(AND(RC[-3]>RC[-1],RC[-3]>=8,RC[-3]<9),40,IF(AND(RC[-3]>RC[-1],RC[-3]>=9,RC[-3]<10),30,IF(AND(RC[-3]>RC[-1],RC[-3]>=10,RC[-3]<11),20,IF(AND(RC[-3]>RC[-1],RC[-3]>=11,RC[-3]<12),10,IF(AND(RC[-3]>RC[-1],RC[-3]>=12),0))))))))))))))))))))))))))))))))) -> 90 | H466: =IF(RC[-3]="","",IF(RC[-3]<0.3,100,IF(AND(RC[-3]>=0.3,RC[-3]>0.4),95,IF(AND(RC[-3]>=0.4,RC[-3]<0.5),90,IF(AND(RC[-3]>=0.5,RC[-3]<0.6),85,IF(AND(RC[-3]>=0.6,RC[-3]<0.7),80,IF(AND(RC[-3]>=0.6,RC[-3]<1),80,IF(AND(RC[-3]>1,RC[-3]<2),50,IF(RC[-3]>2,0))))))))) ->  | I466: =IF(RC[-1]="",RC[-2],0.7*RC[-1]+0.3*RC[-2]) -> 90
A467: مبین انرژی خلیج فارس | B467: مبین | C467: =VLOOKUP(RC[-1],Sheet1!R3C2:R802C3,2,FALSE) -> عرضه برق،گاز،بخار و آب گرم | D467: =VLOOKUP(RC[-2],Sheet1!R3C2:R802C9,8,FALSE) -> 3.4151054759935748 | E467: =IF(VLOOKUP(RC[-3],Sheet1!R3C2:R803C11,10,FALSE)=0,"",VLOOKUP(Sheet2!RC[-3],Sheet1!R[1]C[-3]:R[801]C[6],10,FALSE)) ->  | F467: =Sheet1!R501C10 -> 12.402061270454334 | G467: =IF(RC[-3]<0,0,IF(AND(RC[-3]<RC[-1],RC[-3]<2),100,IF(AND(RC[-3]<RC[-1],RC[-3]>=2,RC[-3]<3),95,IF(AND(RC[-3]<RC[-1],RC[-3]>=3,RC[-3]<4),90,IF(AND(RC[-3]<RC[-1],RC[-3]>=4,RC[-3]<5),85,IF(AND(RC[-3]<RC[-1],RC[-3]>=5,RC[-3]<6),80,IF(AND(RC[-3]<RC[-1],RC[-3]>=6,RC[-3]<7),75,IF(AND(RC[-3]<RC[-1],RC[-3]>=7,RC[-3]<8),70,IF(AND(RC[-3]<RC[-1],RC[-3]>=8,RC[-3]<9),65,IF(AND(RC[-3]<RC[-1],RC[-3]>=9,RC[-3]<10),60,IF(AND(RC[-3]<RC[-1],RC[-3]>=10,RC[-3]<11),55,IF(AND(RC[-3]<RC[-1],RC[-3]>=11,RC[-3]<12),50,IF(AND(RC[-3]<RC[-1],RC[-3]>=12,RC[-3]<13),45,IF(AND(RC[-3]<RC[-1],RC[-3]>=13,RC[-3]<14),40,IF(AND(RC[-3]<RC[-1],RC[-3]>=14,RC[-3]<15),35,IF(AND(RC[-3]<RC[-1],RC[-3]>=15,RC[-3]<16),30,IF(AND(RC[-3]<RC[-1],RC[-3]>=16,RC[-3]<17),25,IF(AND(RC[-3]<RC[-1],RC[-3]>=17,RC[-3]<18),20,IF(AND(RC[-3]<RC[-1],RC[-3]>=18,RC[-3]<19),15,IF(AND(RC[-3]<RC[-1],RC[-3]>=19,RC[-3]<20),10,IF(AND(RC[-3]<RC[-1],RC[-3]>=20,RC[-3]<21),5,IF(AND(RC[-3]<RC[-1],RC[-3]>=21),0,IF(AND(RC[-3]>RC[-1],RC[-3]>=2,RC[-3]<3),90,IF(AND(RC[-3]>RC[-1],RC[-3]>=3,RC[-3]<4),90,IF(AND(RC[-3]>RC[-1],RC[-3]>=4,RC[-3]<5),80,IF(AND(RC[-3]>RC[-1],RC[-3]>=5,RC[-3]<6),70,IF(AND(RC[-3]>RC[-1],RC[-3]>=6,RC[-3]<7),60,IF(AND(RC[-3]>RC[-1],RC[-3]>=7,RC[-3]<8),50,IF(AND(RC[-3]>RC[-1],RC[-3]>=8,RC[-3]<9),40,IF(AND(RC[-3]>RC[-1],RC[-3]>=9,RC[-3]<10),30,IF(AND(RC[-3]>RC[-1],RC[-3]>=10,RC[-3]<11),20,IF(AND(RC[-3]>RC[-1],RC[-3]>=11,RC[-3]<12),10,IF(AND(RC[-3]>RC[-1],RC[-3]>=12),0))))))))))))))))))))))))))))))))) -> 90 | H467: =IF(RC[-3]="","",IF(RC[-3]<0.3,100,IF(AND(RC[-3]>=0.3,RC[-3]>0.4),95,IF(AND(RC[-3]>=0.4,RC[-3]<0.5),90,IF(AND(RC[-3]>=0.5,RC[-3]<0.6),85,IF(AND(RC[-3]>=0.6,RC[-3]<0.7),80,IF(AND(RC[-3]>=0.6,RC[-3]<1),80,IF(AND(RC[-3]>1,RC[-3]<2),50,IF(RC[-3]>2,0))))))))) ->  | I467: =IF(RC[-1]="",RC[-2],0.7*RC[-1]+0.3*RC[-2]) -> 90
A468: مدیریت انرژی امید تابان هور | B468: وهور | C468: =VLOOKUP(RC[-1],Sheet1!R3C2:R802C3,2,FALSE) -> عرضه برق،گاز،بخار و آب گرم | D468: =VLOOKUP(RC[-2],Sheet1!R3C2:R802C9,8,FALSE) -> 22.563609695222791 | E468: =IF(VLOOKUP(RC[-3],Sheet1!R3C2:R803C11,10,FALSE)=0,"",VLOOKUP(Sheet2!RC[-3],Sheet1!R[1]C[-3]:R[801]C[6],10,FALSE)) -> 1.5 | F468: =Sheet1!R501C10 -> 12.402061270454334 | G468: =IF(RC[-3]<0,0,IF(AND(RC[-3]<RC[-1],RC[-3]<2),100,IF(AND(RC[-3]<RC[-1],RC[-3]>=2,RC[-3]<3),95,IF(AND(RC[-3]<RC[-1],RC[-3]>=3,RC[-3]<4),90,IF(AND(RC[-3]<RC[-1],RC[-3]>=4,RC[-3]<5),85,IF(AND(RC[-3]<RC[-1],RC[-3]>=5,RC[-3]<6),80,IF(AND(RC[-3]<RC[-1],RC[-3]>=6,RC[-3]<7),75,IF(AND(RC[-3]<RC[-1],RC[-3]>=7,RC[-3]<8),70,IF(AND(RC[-3]<RC[-1],RC[-3]>=8,RC[-3]<9),65,IF(AND(RC[-3]<RC[-1],RC[-3]>=9,RC[-3]<10),60,IF(AND(RC[-3]<RC[-1],RC[-3]>=10,RC[-3]<11),55,IF(AND(RC[-3]<RC[-1],RC[-3]>=11,RC[-3]<12),50,IF(AND(RC[-3]<RC[-1],RC[-3]>=12,RC[-3]<13),45,IF(AND(RC[-3]<RC[-1],RC[-3]>=13,RC[-3]<14),40,IF(AND(RC[-3]<RC[-1],RC[-3]>=14,RC[-3]<15),35,IF(AND(RC[-3]<RC[-1],RC[-3]>=15,RC[-3]<16),30,IF(AND(RC[-3]<RC[-1],RC[-3]>=16,RC[-3]<17),25,IF(AND(RC[-3]<RC[-1],RC[-3]>=17,RC[-3]<18),20,IF(AND(RC[-3]<RC[-1],RC[-3]>=18,RC[-3]<19),15,IF(AND(RC[-3]<RC[-1],RC[-3]>=19,RC[-3]<20),10,IF(AND(RC[-3]<RC[-1],RC[-3]>=20,RC[-3]<21),5,IF(AND(RC[-3]<RC[-1],RC[-3]>=21),0,IF(AND(RC[-3]>RC[-1],RC[-3]>=2,RC[-3]<3),90,IF(AND(RC[-3]>RC[-1],RC[-3]>=3,RC[-3]<4),90,IF(AND(RC[-3]>RC[-1],RC[-3]>=4,RC[-3]<5),80,IF(AND(RC[-3]>RC[-1],RC[-3]>=5,RC[-3]<6),70,IF(AND(RC[-3]>RC[-1],RC[-3]>=6,RC[-3]<7),60,IF(AND(RC[-3]>RC[-1],RC[-3]>=7,RC[-3]<8),50,IF(AND(RC[-3]>RC[-1],RC[-3]>=8,RC[-3]<9),40,IF(AND(RC[-3]>RC[-1],RC[-3]>=9,RC[-3]<10),30,IF(AND(RC[-3]>RC[-1],RC[-3]>=10,RC[-3]<11),20,IF(AND(RC[-3]>RC[-1],RC[-3]>=11,RC[-3]<12),10,IF(AND(RC[-3]>RC[-1],RC[-3]>=12),0))))))))))))))))))))))))))))))))) -> 0 | H468: =IF(RC[-3]="","",IF(RC[-3]<0.3,100,IF(AND(RC[-3]>=0.3,RC[-3]>0.4),95,IF(AND(RC[-3]>=0.4,RC[-3]<0.5),90,IF(AND(RC[-3]>=0.5,RC[-3]<0.6),85,IF(AND(RC[-3]>=0.6,RC[-3]<0.7),80,IF(AND(RC[-3]>=0.6,RC[-3]<1),80,IF(AND(RC[-3]>1,RC[-3]<2),50,IF(RC[-3]>2,0))))))))) -> 95 | I468: =IF(RC[-1]="",RC[-2],0.7*RC[-1]+0.3*RC[-2]) -> 66.5
A469: نیروگاه زاگرس کوثر | B469: بزاگرس | C469: =VLOOKUP(RC[-1],Sheet1!R3C2:R802C3,2,FALSE) -> عرضه برق،گاز،بخار و آب گرم | D469: =VLOOKUP(RC[-2],Sheet1!R3C2:R802C9,8,FALSE) -> 13.138413643919378 | E469: =IF(VLOOKUP(RC[-3],Sheet1!R3C2:R803C11,10,FALSE)=0,"",VLOOKUP(Sheet2!RC[-3],Sheet1!R[1]C[-3]:R[801]C[6],10,FALSE)) ->  | F469: =Sheet1!R501C10 -> 12.402061270454334 | G469: =IF(RC[-3]<0,0,IF(AND(RC[-3]<RC[-1],RC[-3]<2),100,IF(AND(RC[-3]<RC[-1],RC[-3]>=2,RC[-3]<3),95,IF(AND(RC[-3]<RC[-1],RC[-3]>=3,RC[-3]<4),90,IF(AND(RC[-3]<RC[-1],RC[-3]>=4,RC[-3]<5),85,IF(AND(RC[-3]<RC[-1],RC[-3]>=5,RC[-3]<6),80,IF(AND(RC[-3]<RC[-1],RC[-3]>=6,RC[-3]<7),75,IF(AND(RC[-3]<RC[-1],RC[-3]>=7,RC[-3]<8),70,IF(AND(RC[-3]<RC[-1],RC[-3]>=8,RC[-3]<9),65,IF(AND(RC[-3]<RC[-1],RC[-3]>=9,RC[-3]<10),60,IF(AND(RC[-3]<RC[-1],RC[-3]>=10,RC[-3]<11),55,IF(AND(RC[-3]<RC[-1],RC[-3]>=11,RC[-3]<12),50,IF(AND(RC[-3]<RC[-1],RC[-3]>=12,RC[-3]<13),45,IF(AND(RC[-3]<RC[-1],RC[-3]>=13,RC[-3]<14),40,IF(AND(RC[-3]<RC[-1],RC[-3]>=14,RC[-3]<15),35,IF(AND(RC[-3]<RC[-1],RC[-3]>=15,RC[-3]<16),30,IF(AND(RC[-3]<RC[-1],RC[-3]>=16,RC[-3]<17),25,IF(AND(RC[-3]<RC[-1],RC[-3]>=17,RC[-3]<18),20,IF(AND(RC[-3]<RC[-1],RC[-3]>=18,RC[-3]<19),15,IF(AND(RC[-3]<RC[-1],RC[-3]>=19,RC[-3]<20),10,IF(AND(RC[-3]<RC[-1],RC[-3]>=20,RC[-3]<21),5,IF(AND(RC[-3]<RC[-1],RC[-3]>=21),0,IF(AND(RC[-3]>RC[-1],RC[-3]>=2,RC[-3]<3),90,IF(AND(RC[-3]>RC[-1],RC[-3]>=3,RC[-3]<4),90,IF(AND(RC[-3]>RC[-1],RC[-3]>=4,RC[-3]<5),80,IF(AND(RC[-3]>RC[-1],RC[-3]>=5,RC[-3]<6),70,IF(AND(RC[-3]>RC[-1],RC[-3]>=6,RC[-3]<7),60,IF(AND(RC[-3]>RC[-1],RC[-3]>=7,RC[-3]<8),50,IF(AND(RC[-3]>RC[-1],RC[-3]>=8,RC[-3]<9),40,IF(AND(RC[-3]>RC[-1],RC[-3]>=9,RC[-3]<10),30,IF(AND(RC[-3]>RC[-1],RC[-3]>=10,RC[-3]<11),20,IF(AND(RC[-3]>RC[-1],RC[-3]>=11,RC[-3]<12),10,IF(AND(RC[-3]>RC[-1],RC[-3]>=12),0))))))))))))))))))))))))))))))))) -> 0 | H469: =IF(RC[-3]="","",IF(RC[-3]<0.3,100,IF(AND(RC[-3]>=0.3,RC[-3]>0.4),95,IF(AND(RC[-3]>=0.4,RC[-3]<0.5),90,IF(AND(RC[-3]>=0.5,RC[-3]<0.6),85,IF(AND(RC[-3]>=0.6,RC[-3]<0.7),80,IF(AND(RC[-3]>=0.6,RC[-3]<1),80,IF(AND(RC[-3]>1,RC[-3]<2),50,IF(RC[-3]>2,0))))))))) ->  | I469: =IF(RC[-1]="",RC[-2],0.7*RC[-1]+0.3*RC[-2]) -> 0
A470: نیروگاهی جهرم | B470: بجهرم | C470: =VLOOKUP(RC[-1],Sheet1!R3C2:R802C3,2,FALSE) -> عرضه برق،گاز،بخار و آب گرم | D470: =VLOOKUP(RC[-2],Sheet1!R3C2:R802C9,8,FALSE) -> 11.184660159902977 | E470: =IF(VLOOKUP(RC[-3],Sheet1!R3C2:R803C11,10,FALSE)=0,"",VLOOKUP(Sheet2!RC[-3],Sheet1!R[1]C[-3]:R[801]C[6],10,FALSE)) ->  | F470: =Sheet1!R501C10 -> 12.402061270454334 | G470: =IF(RC[-3]<0,0,IF(AND(RC[-3]<RC[-1],RC[-3]<2),100,IF(AND(RC[-3]<RC[-1],RC[-3]>=2,RC[-3]<3),95,IF(AND(RC[-3]<RC[-1],RC[-3]>=3,RC[-3]<4),90,IF(AND(RC[-3]<RC[-1],RC[-3]>=4,RC[-3]<5),85,IF(AND(RC[-3]<RC[-1],RC[-3]>=5,RC[-3]<6),80,IF(AND(RC[-3]<RC[-1],RC[-3]>=6,RC[-3]<7),75,IF(AND(RC[-3]<RC[-1],RC[-3]>=7,RC[-3]<8),70,IF(AND(RC[-3]<RC[-1],RC[-3]>=8,RC[-3]<9),65,IF(AND(RC[-3]<RC[-1],RC[-3]>=9,RC[-3]<10),60,IF(AND(RC[-3]<RC[-1],RC[-3]>=10,RC[-3]<11),55,IF(AND(RC[-3]<RC[-1],RC[-3]>=11,RC[-3]<12),50,IF(AND(RC[-3]<RC[-1],RC[-3]>=12,RC[-3]<13),45,IF(AND(RC[-3]<RC[-1],RC[-3]>=13,RC[-3]<14),40,IF(AND(RC[-3]<RC[-1],RC[-3]>=14,RC[-3]<15),35,IF(AND(RC[-3]<RC[-1],RC[-3]>=15,RC[-3]<16),30,IF(AND(RC[-3]<RC[-1],RC[-3]>=16,RC[-3]<17),25,IF(AND(RC[-3]<RC[-1],RC[-3]>=17,RC[-3]<18),20,IF(AND(RC[-3]<RC[-1],RC[-3]>=18,RC[-3]<19),15,IF(AND(RC[-3]<RC[-1],RC[-3]>=19,RC[-3]<20),10,IF(AND(RC[-3]<RC[-1],RC[-3]>=20,RC[-3]<21),5,IF(AND(RC[-3]<RC[-1],RC[-3]>=21),0,IF(AND(RC[-3]>RC[-1],RC[-3]>=2,RC[-3]<3),90,IF(AND(RC[-3]>RC[-1],RC[-3]>=3,RC[-3]<4),90,IF(AND(RC[-3]>RC[-1],RC[-3]>=4,RC[-3]<5),80,IF(AND(RC[-3]>RC[-1],RC[-3]>=5,RC[-3]<6),70,IF(AND(RC[-3]>RC[-1],RC[-3]>=6,RC[-3]<7),60,IF(AND(RC[-3]>RC[-1],RC[-3]>=7,RC[-3]<8),50,IF(AND(RC[-3]>RC[-1],RC[-3]>=8,RC[-3]<9),40,IF(AND(RC[-3]>RC[-1],RC[-3]>=9,RC[-3]<10),30,IF(AND(RC[-3]>RC[-1],RC[-3]>=10,RC[-3]<11),20,IF(AND(RC[-3]>RC[-1],RC[-3]>=11,RC[-3]<12),10,IF(AND(RC[-3]>RC[-1],RC[-3]>=12),0))))))))))))))))))))))))))))))))) -> 50 | H470: =IF(RC[-3]="","",IF(RC[-3]<0.3,100,IF(AND(RC[-3]>=0.3,RC[-3]>0.4),95,IF(AND(RC[-3]>=0.4,RC[-3]<0.5),90,IF(AND(RC[-3]>=0.5,RC[-3]<0.6),85,IF(AND(RC[-3]>=0.6,RC[-3]<0.7),80,IF(AND(RC[-3]>=0.6,RC[-3]<1),80,IF(AND(RC[-3]>1,RC[-3]<2),50,IF(RC[-3]>2,0))))))))) ->  | I470: =IF(RC[-1]="",RC[-2],0.7*RC[-1]+0.3*RC[-2]) -> 50
A471: بهنوش | B471: غبهنوش | C471: =VLOOKUP(RC[-1],Sheet1!R3C2:R802C3,2,FALSE) -> غذایی بجز قند وشکر | D471: =VLOOKUP(RC[-2],Sheet1!R3C2:R802C9,8,FALSE) -> 10.761831399888202 | E471: =IF(VLOOKUP(RC[-3],Sheet1!R3C2:R803C11,10,FALSE)=0,"",VLOOKUP(Sheet2!RC[-3],Sheet1!R[1]C[-3]:R[801]C[6],10,FALSE)) ->  | F471: =Sheet1!R546C10 -> 18.927119434200804 | G471: =IF(RC[-3]<0,0,IF(AND(RC[-3]<RC[-1],RC[-3]<2),100,IF(AND(RC[-3]<RC[-1],RC[-3]>=2,RC[-3]<3),95,IF(AND(RC[-3]<RC[-1],RC[-3]>=3,RC[-3]<4),90,IF(AND(RC[-3]<RC[-1],RC[-3]>=4,RC[-3]<5),85,IF(AND(RC[-3]<RC[-1],RC[-3]>=5,RC[-3]<6),80,IF(AND(RC[-3]<RC[-1],RC[-3]>=6,RC[-3]<7),75,IF(AND(RC[-3]<RC[-1],RC[-3]>=7,RC[-3]<8),70,IF(AND(RC[-3]<RC[-1],RC[-3]>=8,RC[-3]<9),65,IF(AND(RC[-3]<RC[-1],RC[-3]>=9,RC[-3]<10),60,IF(AND(RC[-3]<RC[-1],RC[-3]>=10,RC[-3]<11),55,IF(AND(RC[-3]<RC[-1],RC[-3]>=11,RC[-3]<12),50,IF(AND(RC[-3]<RC[-1],RC[-3]>=12,RC[-3]<13),45,IF(AND(RC[-3]<RC[-1],RC[-3]>=13,RC[-3]<14),40,IF(AND(RC[-3]<RC[-1],RC[-3]>=14,RC[-3]<15),35,IF(AND(RC[-3]<RC[-1],RC[-3]>=15,RC[-3]<16),30,IF(AND(RC[-3]<RC[-1],RC[-3]>=16,RC[-3]<17),25,IF(AND(RC[-3]<RC[-1],RC[-3]>=17,RC[-3]<18),20,IF(AND(RC[-3]<RC[-1],RC[-3]>=18,RC[-3]<19),15,IF(AND(RC[-3]<RC[-1],RC[-3]>=19,RC[-3]<20),10,IF(AND(RC[-3]<RC[-1],RC[-3]>=20,RC[-3]<21),5,IF(AND(RC[-3]<RC[-1],RC[-3]>=21),0,IF(AND(RC[-3]>RC[-1],RC[-3]>=2,RC[-3]<3),90,IF(AND(RC[-3]>RC[-1],RC[-3]>=3,RC[-3]<4),90,IF(AND(RC[-3]>RC[-1],RC[-3]>=4,RC[-3]<5),80,IF(AND(RC[-3]>RC[-1],RC[-3]>=5,RC[-3]<6),70,IF(AND(RC[-3]>RC[-1],RC[-3]>=6,RC[-3]<7),60,IF(AND(RC[-3]>RC[-1],RC[-3]>=7,RC[-3]<8),50,IF(AND(RC[-3]>RC[-1],RC[-3]>=8,RC[-3]<9),40,IF(AND(RC[-3]>RC[-1],RC[-3]>=9,RC[-3]<10),30,IF(AND(RC[-3]>RC[-1],RC[-3]>=10,RC[-3]<11),20,IF(AND(RC[-3]>RC[-1],RC[-3]>=11,RC[-3]<12),10,IF(AND(RC[-3]>RC[-1],RC[-3]>=12),0))))))))))))))))))))))))))))))))) -> 55 | H471: =IF(RC[-3]="","",IF(RC[-3]<0.3,100,IF(AND(RC[-3]>=0.3,RC[-3]>0.4),95,IF(AND(RC[-3]>=0.4,RC[-3]<0.5),90,IF(AND(RC[-3]>=0.5,RC[-3]<0.6),85,IF(AND(RC[-3]>=0.6,RC[-3]<0.7),80,IF(AND(RC[-3]>=0.6,RC[-3]<1),80,IF(AND(RC[-3]>1,RC[-3]<2),50,IF(RC[-3]>2,0))))))))) ->  | I471: =IF(RC[-1]="",RC[-2],0.7*RC[-1]+0.3*RC[-2]) -> 55
A472: بیسکویت گرجی | B472: غگرجی | C472: =VLOOKUP(RC[-1],Sheet1!R3C2:R802C3,2,FALSE) -> غذایی بجز قند وشکر | D472: =VLOOKUP(RC[-2],Sheet1!R3C2:R802C9,8,FALSE) -> 14.22972972972973 | E472: =IF(VLOOKUP(RC[-3],Sheet1!R3C2:R803C11,10,FALSE)=0,"",VLOOKUP(Sheet2!RC[-3],Sheet1!R[1]C[-3]:R[801]C[6],10,FALSE)) ->  | F472: =Sheet1!R546C10 -> 18.927119434200804 | G472: =IF(RC[-3]<0,0,IF(AND(RC[-3]<RC[-1],RC[-3]<2),100,IF(AND(RC[-3]<RC[-1],RC[-3]>=2,RC[-3]<3),95,IF(AND(RC[-3]<RC[-1],RC[-3]>=3,RC[-3]<4),90,IF(AND(RC[-3]<RC[-1],RC[-3]>=4,RC[-3]<5),85,IF(AND(RC[-3]<RC[-1],RC[-3]>=5,RC[-3]<6),80,IF(AND(RC[-3]<RC[-1],RC[-3]>=6,RC[-3]<7),75,IF(AND(RC[-3]<RC[-1],RC[-3]>=7,RC[-3]<8),70,IF(AND(RC[-3]<RC[-1],RC[-3]>=8,RC[-3]<9),65,IF(AND(RC[-3]<RC[-1],RC[-3]>=9,RC[-3]<10),60,IF(AND(RC[-3]<RC[-1],RC[-3]>=10,RC[-3]<11),55,IF(AND(RC[-3]<RC[-1],RC[-3]>=11,RC[-3]<12),50,IF(AND(RC[-3]<RC[-1],RC[-3]>=12,RC[-3]<13),45,IF(AND(RC[-3]<RC[-1],RC[-3]>=13,RC[-3]<14),40,IF(AND(RC[-3]<RC[-1],RC[-3]>=14,RC[-3]<15),35,IF(AND(RC[-3]<RC[-1],RC[-3]>=15,RC[-3]<16),30,IF(AND(RC[-3]<RC[-1],RC[-3]>=16,RC[-3]<17),25,IF(AND(RC[-3]<RC[-1],RC[-3]>=17,RC[-3]<18),20,IF(AND(RC[-3]<RC[-1],RC[-3]>=18,RC[-3]<19),15,IF(AND(RC[-3]<RC[-1],RC[-3]>=19,RC[-3]<20),10,IF(AND(RC[-3]<RC[-1],RC[-3]>=20,RC[-3]<21),5,IF(AND(RC[-3]<RC[-1],RC[-3]>=21),0,IF(AND(RC[-3]>RC[-1],RC[-3]>=2,RC[-3]<3),90,IF(AND(RC[-3]>RC[-1],RC[-3]>=3,RC[-3]<4),90,IF(AND(RC[-3]>RC[-1],RC[-3]>=4,RC[-3]<5),80,IF(AND(RC[-3]>RC[-1],RC[-3]>=5,RC[-3]<6),70,IF(AND(RC[-3]>RC[-1],RC[-3]>=6,RC[-3]<7),60,IF(AND(RC[-3]>RC[-1],RC[-3]>=7,RC[-3]<8),50,IF(AND(RC[-3]>RC[-1],RC[-3]>=8,RC[-3]<9),40,IF(AND(RC[-3]>RC[-1],RC[-3]>=9,RC[-3]<10),30,IF(AND(RC[-3]>RC[-1],RC[-3]>=10,RC[-3]<11),20,IF(AND(RC[-3]>RC[-1],RC[-3]>=11,RC[-3]<12),10,IF(AND(RC[-3]>RC[-1],RC[-3]>=12),0))))))))))))))))))))))))))))))))) -> 35 | H472: =IF(RC[-3]="","",IF(RC[-3]<0.3,100,IF(AND(RC[-3]>=0.3,RC[-3]>0.4),95,IF(AND(RC[-3]>=0.4,RC[-3]<0.5),90,IF(AND(RC[-3]>=0.5,RC[-3]<0.6),85,IF(AND(RC[-3]>=0.6,RC[-3]<0.7),80,IF(AND(RC[-3]>=0.6,RC[-3]<1),80,IF(AND(RC[-3]>1,RC[-3]<2),50,IF(RC[-3]>2,0))))))))) ->  | I472: =IF(RC[-1]="",RC[-2],0.7*RC[-1]+0.3*RC[-2]) -> 35
A473: پارس مینو | B473: غپینو | C473: =VLOOKUP(RC[-1],Sheet1!R3C2:R802C3,2,FALSE) -> غذایی بجز قند وشکر | D473: =VLOOKUP(RC[-2],Sheet1!R3C2:R802C9,8,FALSE) -> 4.5 | E473: =IF(VLOOKUP(RC[-3],Sheet1!R3C2:R803C11,10,FALSE)=0,"",VLOOKUP(Sheet2!RC[-3],Sheet1!R[1]C[-3]:R[801]C[6],10,FALSE)) ->  | F473: =Sheet1!R546C10 -> 18.927119434200804 | G473: =IF(RC[-3]<0,0,IF(AND(RC[-3]<RC[-1],RC[-3]<2),100,IF(AND(RC[-3]<RC[-1],RC[-3]>=2,RC[-3]<3),95,IF(AND(RC[-3]<RC[-1],RC[-3]>=3,RC[-3]<4),90,IF(AND(RC[-3]<RC[-1],RC[-3]>=4,RC[-3]<5),85,IF(AND(RC[-3]<RC[-1],RC[-3]>=5,RC[-3]<6),80,IF(AND(RC[-3]<RC[-1],RC[-3]>=6,RC[-3]<7),75,IF(AND(RC[-3]<RC[-1],RC[-3]>=7,RC[-3]<8),70,IF(AND(RC[-3]<RC[-1],RC[-3]>=8,RC[-3]<9),65,IF(AND(RC[-3]<RC[-1],RC[-3]>=9,RC[-3]<10),60,IF(AND(RC[-3]<RC[-1],RC[-3]>=10,RC[-3]<11),55,IF(AND(RC[-3]<RC[-1],RC[-3]>=11,RC[-3]<12),50,IF(AND(RC[-3]<RC[-1],RC[-3]>=12,RC[-3]<13),45,IF(AND(RC[-3]<RC[-1],RC[-3]>=13,RC[-3]<14),40,IF(AND(RC[-3]<RC[-1],RC[-3]>=14,RC[-3]<15),35,IF(AND(RC[-3]<RC[-1],RC[-3]>=15,RC[-3]<16),30,IF(AND(RC[-3]<RC[-1],RC[-3]>=16,RC[-3]<17),25,IF(AND(RC[-3]<RC[-1],RC[-3]>=17,RC[-3]<18),20,IF(AND(RC[-3]<RC[-1],RC[-3]>=18,RC[-3]<19),15,IF(AND(RC[-3]<RC[-1],RC[-3]>=19,RC[-3]<20),10,IF(AND(RC[-3]<RC[-1],RC[-3]>=20,RC[-3]<21),5,IF(AND(RC[-3]<RC[-1],RC[-3]>=21),0,IF(AND(RC[-3]>RC[-1],RC[-3]>=2,RC[-3]<3),90,IF(AND(RC[-3]>RC[-1],RC[-3]>=3,RC[-3]<4),90,IF(AND(RC[-3]>RC[-1],RC[-3]>=4,RC[-3]<5),80,IF(AND(RC[-3]>RC[-1],RC[-3]>=5,RC[-3]<6),70,IF(AND(RC[-3]>RC[-1],RC[-3]>=6,RC[-3]<7),60,IF(AND(RC[-3]>RC[-1],RC[-3]>=7,RC[-3]<8),50,IF(AND(RC[-3]>RC[-1],RC[-3]>=8,RC[-3]<9),40,IF(AND(RC[-3]>RC[-1],RC[-3]>=9,RC[-3]<10),30,IF(AND(RC[-3]>RC[-1],RC[-3]>=10,RC[-3]<11),20,IF(AND(RC[-3]>RC[-1],RC[-3]>=11,RC[-3]<12),10,IF(AND(RC[-3]>RC[-1],RC[-3]>=12),0))))))))))))))))))))))))))))))))) -> 85 | H473: =IF(RC[-3]="","",IF(RC[-3]<0.3,100,IF(AND(RC[-3]>=0.3,RC[-3]>0.4),95,IF(AND(RC[-3]>=0.4,RC[-3]<0.5),90,IF(AND(RC[-3]>=0.5,RC[-3]<0.6),85,IF(AND(RC[-3]>=0.6,RC[-3]<0.7),80,IF(AND(RC[-3]>=0.6,RC[-3]<1),80,IF(AND(RC[-3]>1,RC[-3]<2),50,IF(RC[-3]>2,0))))))))) ->  | I473: =IF(RC[-1]="",RC[-2],0.7*RC[-1]+0.3*RC[-2]) -> 85
A474: پاکدیس | B474: غدیس | C474: =VLOOKUP(RC[-1],Sheet1!R3C2:R802C3,2,FALSE) -> غذایی بجز قند وشکر | D474: =VLOOKUP(RC[-2],Sheet1!R3C2:R802C9,8,FALSE) -> 12.001309989924318 | E474: =IF(VLOOKUP(RC[-3],Sheet1!R3C2:R803C11,10,FALSE)=0,"",VLOOKUP(Sheet2!RC[-3],Sheet1!R[1]C[-3]:R[801]C[6],10,FALSE)) ->  | F474: =Sheet1!R546C10 -> 18.927119434200804 | G474: =IF(RC[-3]<0,0,IF(AND(RC[-3]<RC[-1],RC[-3]<2),100,IF(AND(RC[-3]<RC[-1],RC[-3]>=2,RC[-3]<3),95,IF(AND(RC[-3]<RC[-1],RC[-3]>=3,RC[-3]<4),90,IF(AND(RC[-3]<RC[-1],RC[-3]>=4,RC[-3]<5),85,IF(AND(RC[-3]<RC[-1],RC[-3]>=5,RC[-3]<6),80,IF(AND(RC[-3]<RC[-1],RC[-3]>=6,RC[-3]<7),75,IF(AND(RC[-3]<RC[-1],RC[-3]>=7,RC[-3]<8),70,IF(AND(RC[-3]<RC[-1],RC[-3]>=8,RC[-3]<9),65,IF(AND(RC[-3]<RC[-1],RC[-3]>=9,RC[-3]<10),60,IF(AND(RC[-3]<RC[-1],RC[-3]>=10,RC[-3]<11),55,IF(AND(RC[-3]<RC[-1],RC[-3]>=11,RC[-3]<12),50,IF(AND(RC[-3]<RC[-1],RC[-3]>=12,RC[-3]<13),45,IF(AND(RC[-3]<RC[-1],RC[-3]>=13,RC[-3]<14),40,IF(AND(RC[-3]<RC[-1],RC[-3]>=14,RC[-3]<15),35,IF(AND(RC[-3]<RC[-1],RC[-3]>=15,RC[-3]<16),30,IF(AND(RC[-3]<RC[-1],RC[-3]>=16,RC[-3]<17),25,IF(AND(RC[-3]<RC[-1],RC[-3]>=17,RC[-3]<18),20,IF(AND(RC[-3]<RC[-1],RC[-3]>=18,RC[-3]<19),15,IF(AND(RC[-3]<RC[-1],RC[-3]>=19,RC[-3]<20),10,IF(AND(RC[-3]<RC[-1],RC[-3]>=20,RC[-3]<21),5,IF(AND(RC[-3]<RC[-1],RC[-3]>=21),0,IF(AND(RC[-3]>RC[-1],RC[-3]>=2,RC[-3]<3),90,IF(AND(RC[-3]>RC[-1],RC[-3]>=3,RC[-3]<4),90,IF(AND(RC[-3]>RC[-1],RC[-3]>=4,RC[-3]<5),80,IF(AND(RC[-3]>RC[-1],RC[-3]>=5,RC[-3]<6),70,IF(AND(RC[-3]>RC[-1],RC[-3]>=6,RC[-3]<7),60,IF(AND(RC[-3]>RC[-1],RC[-3]>=7,RC[-3]<8),50,IF(AND(RC[-3]>RC[-1],RC[-3]>=8,RC[-3]<9),40,IF(AND(RC[-3]>RC[-1],RC[-3]>=9,RC[-3]<10),30,IF(AND(RC[-3]>RC[-1],RC[-3]>=10,RC[-3]<11),20,IF(AND(RC[-3]>RC[-1],RC[-3]>=11,RC[-3]<12),10,IF(AND(RC[-3]>RC[-1],RC[-3]>=12),0))))))))))))))))))))))))))))))))) -> 45 | H474: =IF(RC[-3]="","",IF(RC[-3]<0.3,100,IF(AND(RC[-3]>=0.3,RC[-3]>0.4),95,IF(AND(RC[-3]>=0.4,RC[-3]<0.5),90,IF(AND(RC[-3]>=0.5,RC[-3]<0.6),85,IF(AND(RC[-3]>=0.6,RC[-3]<0.7),80,IF(AND(RC[-3]>=0.6,RC[-3]<1),80,IF(AND(RC[-3]>1,RC[-3]<2),50,IF(RC[-3]>2,0))))))))) ->  | I474: =IF(RC[-1]="",RC[-2],0.7*RC[-1]+0.3*RC[-2]) -> 45
A475: پگاه آذربایجان شرقی | B475: غپآذر | C475: =VLOOKUP(RC[-1],Sheet1!R3C2:R802C3,2,FALSE) -> غذایی بجز قند وشکر | D475: =VLOOKUP(RC[-2],Sheet1!R3C2:R802C9,8,FALSE) -> 10.186044905538832 | E475: =IF(VLOOKUP(RC[-3],Sheet1!R3C2:R803C11,10,FALSE)=0,"",VLOOKUP(Sheet2!RC[-3],Sheet1!R[1]C[-3]:R[801]C[6],10,FALSE)) ->  | F475: =Sheet1!R546C10 -> 18.927119434200804 | G475: =IF(RC[-3]<0,0,IF(AND(RC[-3]<RC[-1],RC[-3]<2),100,IF(AND(RC[-3]<RC[-1],RC[-3]>=2,RC[-3]<3),95,IF(AND(RC[-3]<RC[-1],RC[-3]>=3,RC[-3]<4),90,IF(AND(RC[-3]<RC[-1],RC[-3]>=4,RC[-3]<5),85,IF(AND(RC[-3]<RC[-1],RC[-3]>=5,RC[-3]<6),80,IF(AND(RC[-3]<RC[-1],RC[-3]>=6,RC[-3]<7),75,IF(AND(RC[-3]<RC[-1],RC[-3]>=7,RC[-3]<8),70,IF(AND(RC[-3]<RC[-1],RC[-3]>=8,RC[-3]<9),65,IF(AND(RC[-3]<RC[-1],RC[-3]>=9,RC[-3]<10),60,IF(AND(RC[-3]<RC[-1],RC[-3]>=10,RC[-3]<11),55,IF(AND(RC[-3]<RC[-1],RC[-3]>=11,RC[-3]<12),50,IF(AND(RC[-3]<RC[-1],RC[-3]>=12,RC[-3]<13),45,IF(AND(RC[-3]<RC[-1],RC[-3]>=13,RC[-3]<14),40,IF(AND(RC[-3]<RC[-1],RC[-3]>=14,RC[-3]<15),35,IF(AND(RC[-3]<RC[-1],RC[-3]>=15,RC[-3]<16),30,IF(AND(RC[-3]<RC[-1],RC[-3]>=16,RC[-3]<17),25,IF(AND(RC[-3]<RC[-1],RC[-3]>=17,RC[-3]<18),20,IF(AND(RC[-3]<RC[-1],RC[-3]>=18,RC[-3]<19),15,IF(AND(RC[-3]<RC[-1],RC[-3]>=19,RC[-3]<20),10,IF(AND(RC[-3]<RC[-1],RC[-3]>=20,RC[-3]<21),5,IF(AND(RC[-3]<RC[-1],RC[-3]>=21),0,IF(AND(RC[-3]>RC[-1],RC[-3]>=2,RC[-3]<3),90,IF(AND(RC[-3]>RC[-1],RC[-3]>=3,RC[-3]<4),90,IF(AND(RC[-3]>RC[-1],RC[-3]>=4,RC[-3]<5),80,IF(AND(RC[-3]>RC[-1],RC[-3]>=5,RC[-3]<6),70,IF(AND(RC[-3]>RC[-1],RC[-3]>=6,RC[-3]<7),60,IF(AND(RC[-3]>RC[-1],RC[-3]>=7,RC[-3]<8),50,IF(AND(RC[-3]>RC[-1],RC[-3]>=8,RC[-3]<9),40,IF(AND(RC[-3]>RC[-1],RC[-3]>=9,RC[-3]<10),30,IF(AND(RC[-3]>RC[-1],RC[-3]>=10,RC[-3]<11),20,IF(AND(RC[-3]>RC[-1],RC[-3]>=11,RC[-3]<12),10,IF(AND(RC[-3]>RC[-1],RC[-3]>=12),0))))))))))))))))))))))))))))))))) -> 55 | H475: =IF(RC[-3]="","",IF(RC[-3]<0.3,100,IF(AND(RC[-3]>=0.3,RC[-3]>0.4),95,IF(AND(RC[-3]>=0.4,RC[-3]<0.5),90,IF(AND(RC[-3]>=0.5,RC[-3]<0.6),85,IF(AND(RC[-3]>=0.6,RC[-3]<0.7),80,IF(AND(RC[-3]>=0.6,RC[-3]<1),80,IF(AND(RC[-3]>1,RC[-3]<2),50,IF(RC[-3]>2,0))))))))) ->  | I475: =IF(RC[-1]="",RC[-2],0.7*RC[-1]+0.3*RC[-2]) -> 55
A476: پگاه آذربایجان غربی | B476: غشاذر | C476: =VLOOKUP(RC[-1],Sheet1!R3C2:R802C3,2,FALSE) -> غذایی بجز قند وشکر | D476: =VLOOKUP(RC[-2],Sheet1!R3C2:R802C9,8,FALSE) -> 9.5025426158156492 | E476: =IF(VLOOKUP(RC[-3],Sheet1!R3C2:R803C11,10,FALSE)=0,"",VLOOKUP(Sheet2!RC[-3],Sheet1!R[1]C[-3]:R[801]C[6],10,FALSE)) ->  | F476: =Sheet1!R546C10 -> 18.927119434200804 | G476: =IF(RC[-3]<0,0,IF(AND(RC[-3]<RC[-1],RC[-3]<2),100,IF(AND(RC[-3]<RC[-1],RC[-3]>=2,RC[-3]<3),95,IF(AND(RC[-3]<RC[-1],RC[-3]>=3,RC[-3]<4),90,IF(AND(RC[-3]<RC[-1],RC[-3]>=4,RC[-3]<5),85,IF(AND(RC[-3]<RC[-1],RC[-3]>=5,RC[-3]<6),80,IF(AND(RC[-3]<RC[-1],RC[-3]>=6,RC[-3]<7),75,IF(AND(RC[-3]<RC[-1],RC[-3]>=7,RC[-3]<8),70,IF(AND(RC[-3]<RC[-1],RC[-3]>=8,RC[-3]<9),65,IF(AND(RC[-3]<RC[-1],RC[-3]>=9,RC[-3]<10),60,IF(AND(RC[-3]<RC[-1],RC[-3]>=10,RC[-3]<11),55,IF(AND(RC[-3]<RC[-1],RC[-3]>=11,RC[-3]<12),50,IF(AND(RC[-3]<RC[-1],RC[-3]>=12,RC[-3]<13),45,IF(AND(RC[-3]<RC[-1],RC[-3]>=13,RC[-3]<14),40,IF(AND(RC[-3]<RC[-1],RC[-3]>=14,RC[-3]<15),35,IF(AND(RC[-3]<RC[-1],RC[-3]>=15,RC[-3]<16),30,IF(AND(RC[-3]<RC[-1],RC[-3]>=16,RC[-3]<17),25,IF(AND(RC[-3]<RC[-1],RC[-3]>=17,RC[-3]<18),20,IF(AND(RC[-3]<RC[-1],RC[-3]>=18,RC[-3]<19),15,IF(AND(RC[-3]<RC[-1],RC[-3]>=19,RC[-3]<20),10,IF(AND(RC[-3]<RC[-1],RC[-3]>=20,RC[-3]<21),5,IF(AND(RC[-3]<RC[-1],RC[-3]>=21),0,IF(AND(RC[-3]>RC[-1],RC[-3]>=2,RC[-3]<3),90,IF(AND(RC[-3]>RC[-1],RC[-3]>=3,RC[-3]<4),90,IF(AND(RC[-3]>RC[-1],RC[-3]>=4,RC[-3]<5),80,IF(AND(RC[-3]>RC[-1],RC[-3]>=5,RC[-3]<6),70,IF(AND(RC[-3]>RC[-1],RC[-3]>=6,RC[-3]<7),60,IF(AND(RC[-3]>RC[-1],RC[-3]>=7,RC[-3]<8),50,IF(AND(RC[-3]>RC[-1],RC[-3]>=8,RC[-3]<9),40,IF(AND(RC[-3]>RC[-1],RC[-3]>=9,RC[-3]<10),30,IF(AND(RC[-3]>RC[-1],RC[-3]>=10,RC[-3]<11),20,IF(AND(RC[-3]>RC[-1],RC[-3]>=11,RC[-3]<12),10,IF(AND(RC[-3]>RC[-1],RC[-3]>=12),0))))))))))))))))))))))))))))))))) -> 60 | H476: =IF(RC[-3]="","",IF(RC[-3]<0.3,100,IF(AND(RC[-3]>=0.3,RC[-3]>0.4),95,IF(AND(RC[-3]>=0.4,RC[-3]<0.5),90,IF(AND(RC[-3]>=0.5,RC[-3]<0.6),85,IF(AND(RC[-3]>=0.6,RC[-3]<0.7),80,IF(AND(RC[-3]>=0.6,RC[-3]<1),80,IF(AND(RC[-3]>1,RC[-3]<2),50,IF(RC[-3]>2,0))))))))) ->  | I476: =IF(RC[-1]="",RC[-2],0.7*RC[-1]+0.3*RC[-2]) -> 60
A477: پگاه اصفهان | B477: غشصفا | C477: =VLOOKUP(RC[-1],Sheet1!R3C2:R802C3,2,FALSE) -> غذایی بجز قند وشکر | D477: =VLOOKUP(RC[-2],Sheet1!R3C2:R802C9,8,FALSE) -> 8.996993573993592 | E477: =IF(VLOOKUP(RC[-3],Sheet1!R3C2:R803C11,10,FALSE)=0,"",VLOOKUP(Sheet2!RC[-3],Sheet1!R[1]C[-3]:R[801]C[6],10,FALSE)) ->  | F477: =Sheet1!R546C10 -> 18.927119434200804 | G477: =IF(RC[-3]<0,0,IF(AND(RC[-3]<RC[-1],RC[-3]<2),100,IF(AND(RC[-3]<RC[-1],RC[-3]>=2,RC[-3]<3),95,IF(AND(RC[-3]<RC[-1],RC[-3]>=3,RC[-3]<4),90,IF(AND(RC[-3]<RC[-1],RC[-3]>=4,RC[-3]<5),85,IF(AND(RC[-3]<RC[-1],RC[-3]>=5,RC[-3]<6),80,IF(AND(RC[-3]<RC[-1],RC[-3]>=6,RC[-3]<7),75,IF(AND(RC[-3]<RC[-1],RC[-3]>=7,RC[-3]<8),70,IF(AND(RC[-3]<RC[-1],RC[-3]>=8,RC[-3]<9),65,IF(AND(RC[-3]<RC[-1],RC[-3]>=9,RC[-3]<10),60,IF(AND(RC[-3]<RC[-1],RC[-3]>=10,RC[-3]<11),55,IF(AND(RC[-3]<RC[-1],RC[-3]>=11,RC[-3]<12),50,IF(AND(RC[-3]<RC[-1],RC[-3]>=12,RC[-3]<13),45,IF(AND(RC[-3]<RC[-1],RC[-3]>=13,RC[-3]<14),40,IF(AND(RC[-3]<RC[-1],RC[-3]>=14,RC[-3]<15),35,IF(AND(RC[-3]<RC[-1],RC[-3]>=15,RC[-3]<16),30,IF(AND(RC[-3]<RC[-1],RC[-3]>=16,RC[-3]<17),25,IF(AND(RC[-3]<RC[-1],RC[-3]>=17,RC[-3]<18),20,IF(AND(RC[-3]<RC[-1],RC[-3]>=18,RC[-3]<19),15,IF(AND(RC[-3]<RC[-1],RC[-3]>=19,RC[-3]<20),10,IF(AND(RC[-3]<RC[-1],RC[-3]>=20,RC[-3]<21),5,IF(AND(RC[-3]<RC[-1],RC[-3]>=21),0,IF(AND(RC[-3]>RC[-1],RC[-3]>=2,RC[-3]<3),90,IF(AND(RC[-3]>RC[-1],RC[-3]>=3,RC[-3]<4),90,IF(AND(RC[-3]>RC[-1],RC[-3]>=4,RC[-3]<5),80,IF(AND(RC[-3]>RC[-1],RC[-3]>=5,RC[-3]<6),70,IF(AND(RC[-3]>RC[-1],RC[-3]>=6,RC[-3]<7),60,IF(AND(RC[-3]>RC[-1],RC[-3]>=7,RC[-3]<8),50,IF(AND(RC[-3]>RC[-1],RC[-3]>=8,RC[-3]<9),40,IF(AND(RC[-3]>RC[-1],RC[-3]>=9,RC[-3]<10),30,IF(AND(RC[-3]>RC[-1],RC[-3]>=10,RC[-3]<11),20,IF(AND(RC[-3]>RC[-1],RC[-3]>=11,RC[-3]<12),10,IF(AND(RC[-3]>RC[-1],RC[-3]>=12),0))))))))))))))))))))))))))))))))) -> 65 | H477: =IF(RC[-3]="","",IF(RC[-3]<0.3,100,IF(AND(RC[-3]>=0.3,RC[-3]>0.4),95,IF(AND(RC[-3]>=0.4,RC[-3]<0.5),90,IF(AND(RC[-3]>=0.5,RC[-3]<0.6),85,IF(AND(RC[-3]>=0.6,RC[-3]<0.7),80,IF(AND(RC[-3]>=0.6,RC[-3]<1),80,IF(AND(RC[-3]>1,RC[-3]<2),50,IF(RC[-3]>2,0))))))))) ->  | I477: =IF(RC[-1]="",RC[-2],0.7*RC[-1]+0.3*RC[-2]) -> 65
A478: پگاه خراسان | B478: غشان | C478: =VLOOKUP(RC[-1],Sheet1!R3C2:R802C3,2,FALSE) -> غذایی بجز قند وشکر | D478: =VLOOKUP(RC[-2],Sheet1!R3C2:R802C9,8,FALSE) -> 13.050668922246768 | E478: =IF(VLOOKUP(RC[-3],Sheet1!R3C2:R803C11,10,FALSE)=0,"",VLOOKUP(Sheet2!RC[-3],Sheet1!R[1]C[-3]:R[801]C[6],10,FALSE)) ->  | F478: =Sheet1!R546C10 -> 18.927119434200804 | G478: =IF(RC[-3]<0,0,IF(AND(RC[-3]<RC[-1],RC[-3]<2),100,IF(AND(RC[-3]<RC[-1],RC[-3]>=2,RC[-3]<3),95,IF(AND(RC[-3]<RC[-1],RC[-3]>=3,RC[-3]<4),90,IF(AND(RC[-3]<RC[-1],RC[-3]>=4,RC[-3]<5),85,IF(AND(RC[-3]<RC[-1],RC[-3]>=5,RC[-3]<6),80,IF(AND(RC[-3]<RC[-1],RC[-3]>=6,RC[-3]<7),75,IF(AND(RC[-3]<RC[-1],RC[-3]>=7,RC[-3]<8),70,IF(AND(RC[-3]<RC[-1],RC[-3]>=8,RC[-3]<9),65,IF(AND(RC[-3]<RC[-1],RC[-3]>=9,RC[-3]<10),60,IF(AND(RC[-3]<RC[-1],RC[-3]>=10,RC[-3]<11),55,IF(AND(RC[-3]<RC[-1],RC[-3]>=11,RC[-3]<12),50,IF(AND(RC[-3]<RC[-1],RC[-3]>=12,RC[-3]<13),45,IF(AND(RC[-3]<RC[-1],RC[-3]>=13,RC[-3]<14),40,IF(AND(RC[-3]<RC[-1],RC[-3]>=14,RC[-3]<15),35,IF(AND(RC[-3]<RC[-1],RC[-3]>=15,RC[-3]<16),30,IF(AND(RC[-3]<RC[-1],RC[-3]>=16,RC[-3]<17),25,IF(AND(RC[-3]<RC[-1],RC[-3]>=17,RC[-3]<18),20,IF(AND(RC[-3]<RC[-1],RC[-3]>=18,RC[-3]<19),15,IF(AND(RC[-3]<RC[-1],RC[-3]>=19,RC[-3]<20),10,IF(AND(RC[-3]<RC[-1],RC[-3]>=20,RC[-3]<21),5,IF(AND(RC[-3]<RC[-1],RC[-3]>=21),0,IF(AND(RC[-3]>RC[-1],RC[-3]>=2,RC[-3]<3),90,IF(AND(RC[-3]>RC[-1],RC[-3]>=3,RC[-3]<4),90,IF(AND(RC[-3]>RC[-1],RC[-3]>=4,RC[-3]<5),80,IF(AND(RC[-3]>RC[-1],RC[-3]>=5,RC[-3]<6),70,IF(AND(RC[-3]>RC[-1],RC[-3]>=6,RC[-3]<7),60,IF(AND(RC[-3]>RC[-1],RC[-3]>=7,RC[-3]<8),50,IF(AND(RC[-3]>RC[-1],RC[-3]>=8,RC[-3]<9),40,IF(AND(RC[-3]>RC[-1],RC[-3]>=9,RC[-3]<10),30,IF(AND(RC[-3]>RC[-1],RC[-3]>=10,RC[-3]<11),20,IF(AND(RC[-3]>RC[-1],RC[-3]>=11,RC[-3]<12),10,IF(AND(RC[-3]>RC[-1],RC[-3]>=12),0))))))))))))))))))))))))))))))))) -> 40 | H478: =IF(RC[-3]="","",IF(RC[-3]<0.3,100,IF(AND(RC[-3]>=0.3,RC[-3]>0.4),95,IF(AND(RC[-3]>=0.4,RC[-3]<0.5),90,IF(AND(RC[-3]>=0.5,RC[-3]<0.6),85,IF(AND(RC[-3]>=0.6,RC[-3]<0.7),80,IF(AND(RC[-3]>=0.6,RC[-3]<1),80,IF(AND(RC[-3]>1,RC[-3]<2),50,IF(RC[-3]>2,0))))))))) ->  | I478: =IF(RC[-1]="",RC[-2],0.7*RC[-1]+0.3*RC[-2]) -> 40
A479: پگاه فارس | B479: غفارس | C479: =VLOOKUP(RC[-1],Sheet1!R3C2:R802C3,2,FALSE) -> غذایی بجز قند وشکر | D479: =VLOOKUP(RC[-2],Sheet1!R3C2:R802C9,8,FALSE) -> 21.869755602451146 | E479: =IF(VLOOKUP(RC[-3],Sheet1!R3C2:R803C11,10,FALSE)=0,"",VLOOKUP(Sheet2!RC[-3],Sheet1!R[1]C[-3]:R[801]C[6],10,FALSE)) ->  | F479: =Sheet1!R546C10 -> 18.927119434200804 | G479: =IF(RC[-3]<0,0,IF(AND(RC[-3]<RC[-1],RC[-3]<2),100,IF(AND(RC[-3]<RC[-1],RC[-3]>=2,RC[-3]<3),95,IF(AND(RC[-3]<RC[-1],RC[-3]>=3,RC[-3]<4),90,IF(AND(RC[-3]<RC[-1],RC[-3]>=4,RC[-3]<5),85,IF(AND(RC[-3]<RC[-1],RC[-3]>=5,RC[-3]<6),80,IF(AND(RC[-3]<RC[-1],RC[-3]>=6,RC[-3]<7),75,IF(AND(RC[-3]<RC[-1],RC[-3]>=7,RC[-3]<8),70,IF(AND(RC[-3]<RC[-1],RC[-3]>=8,RC[-3]<9),65,IF(AND(RC[-3]<RC[-1],RC[-3]>=9,RC[-3]<10),60,IF(AND(RC[-3]<RC[-1],RC[-3]>=10,RC[-3]<11),55,IF(AND(RC[-3]<RC[-1],RC[-3]>=11,RC[-3]<12),50,IF(AND(RC[-3]<RC[-1],RC[-3]>=12,RC[-3]<13),45,IF(AND(RC[-3]<RC[-1],RC[-3]>=13,RC[-3]<14),40,IF(AND(RC[-3]<RC[-1],RC[-3]>=14,RC[-3]<15),35,IF(AND(RC[-3]<RC[-1],RC[-3]>=15,RC[-3]<16),30,IF(AND(RC[-3]<RC[-1],RC[-3]>=16,RC[-3]<17),25,IF(AND(RC[-3]<RC[-1],RC[-3]>=17,RC[-3]<18),20,IF(AND(RC[-3]<RC[-1],RC[-3]>=18,RC[-3]<19),15,IF(AND(RC[-3]<RC[-1],RC[-3]>=19,RC[-3]<20),10,IF(AND(RC[-3]<RC[-1],RC[-3]>=20,RC[-3]<21),5,IF(AND(RC[-3]<RC[-1],RC[-3]>=21),0,IF(AND(RC[-3]>RC[-1],RC[-3]>=2,RC[-3]<3),90,IF(AND(RC[-3]>RC[-1],RC[-3]>=3,RC[-3]<4),90,IF(AND(RC[-3]>RC[-1],RC[-3]>=4,RC[-3]<5),80,IF(AND(RC[-3]>RC[-1],RC[-3]>=5,RC[-3]<6),70,IF(AND(RC[-3]>RC[-1],RC[-3]>=6,RC[-3]<7),60,IF(AND(RC[-3]>RC[-1],RC[-3]>=7,RC[-3]<8),50,IF(AND(RC[-3]>RC[-1],RC[-3]>=8,RC[-3]<9),40,IF(AND(RC[-3]>RC[-1],RC[-3]>=9,RC[-3]<10),30,IF(AND(RC[-3]>RC[-1],RC[-3]>=10,RC[-3]<11),20,IF(AND(RC[-3]>RC[-1],RC[-3]>=11,RC[-3]<12),10,IF(AND(RC[-3]>RC[-1],RC[-3]>=12),0))))))))))))))))))))))))))))))))) -> 0 | H479: =IF(RC[-3]="","",IF(RC[-3]<0.3,100,IF(AND(RC[-3]>=0.3,RC[-3]>0.4),95,IF(AND(RC[-3]>=0.4,RC[-3]<0.5),90,IF(AND(RC[-3]>=0.5,RC[-3]<0.6),85,IF(AND(RC[-3]>=0.6,RC[-3]<0.7),80,IF(AND(RC[-3]>=0.6,RC[-3]<1),80,IF(AND(RC[-3]>1,RC[-3]<2),50,IF(RC[-3]>2,0))))))))) ->  | I479: =IF(RC[-1]="",RC[-2],0.7*RC[-1]+0.3*RC[-2]) -> 0
A480: پنبه و دانه های روغنی خراسان | B480: غدانه | C480: =VLOOKUP(RC[-1],Sheet1!R3C2:R802C3,2,FALSE) -> غذایی بجز قند وشکر | D480: =VLOOKUP(RC[-2],Sheet1!R3C2:R802C9,8,FALSE) -> 14.231673940936441 | E480: =IF(VLOOKUP(RC[-3],Sheet1!R3C2:R803C11,10,FALSE)=0,"",VLOOKUP(Sheet2!RC[-3],Sheet1!R[1]C[-3]:R[801]C[6],10,FALSE)) ->  | F480: =Sheet1!R546C10 -> 18.927119434200804 | G480: =IF(RC[-3]<0,0,IF(AND(RC[-3]<RC[-1],RC[-3]<2),100,IF(AND(RC[-3]<RC[-1],RC[-3]>=2,RC[-3]<3),95,IF(AND(RC[-3]<RC[-1],RC[-3]>=3,RC[-3]<4),90,IF(AND(RC[-3]<RC[-1],RC[-3]>=4,RC[-3]<5),85,IF(AND(RC[-3]<RC[-1],RC[-3]>=5,RC[-3]<6),80,IF(AND(RC[-3]<RC[-1],RC[-3]>=6,RC[-3]<7),75,IF(AND(RC[-3]<RC[-1],RC[-3]>=7,RC[-3]<8),70,IF(AND(RC[-3]<RC[-1],RC[-3]>=8,RC[-3]<9),65,IF(AND(RC[-3]<RC[-1],RC[-3]>=9,RC[-3]<10),60,IF(AND(RC[-3]<RC[-1],RC[-3]>=10,RC[-3]<11),55,IF(AND(RC[-3]<RC[-1],RC[-3]>=11,RC[-3]<12),50,IF(AND(RC[-3]<RC[-1],RC[-3]>=12,RC[-3]<13),45,IF(AND(RC[-3]<RC[-1],RC[-3]>=13,RC[-3]<14),40,IF(AND(RC[-3]<RC[-1],RC[-3]>=14,RC[-3]<15),35,IF(AND(RC[-3]<RC[-1],RC[-3]>=15,RC[-3]<16),30,IF(AND(RC[-3]<RC[-1],RC[-3]>=16,RC[-3]<17),25,IF(AND(RC[-3]<RC[-1],RC[-3]>=17,RC[-3]<18),20,IF(AND(RC[-3]<RC[-1],RC[-3]>=18,RC[-3]<19),15,IF(AND(RC[-3]<RC[-1],RC[-3]>=19,RC[-3]<20),10,IF(AND(RC[-3]<RC[-1],RC[-3]>=20,RC[-3]<21),5,IF(AND(RC[-3]<RC[-1],RC[-3]>=21),0,IF(AND(RC[-3]>RC[-1],RC[-3]>=2,RC[-3]<3),90,IF(AND(RC[-3]>RC[-1],RC[-3]>=3,RC[-3]<4),90,IF(AND(RC[-3]>RC[-1],RC[-3]>=4,RC[-3]<5),80,IF(AND(RC[-3]>RC[-1],RC[-3]>=5,RC[-3]<6),70,IF(AND(RC[-3]>RC[-1],RC[-3]>=6,RC[-3]<7),60,IF(AND(RC[-3]>RC[-1],RC[-3]>=7,RC[-3]<8),50,IF(AND(RC[-3]>RC[-1],RC[-3]>=8,RC[-3]<9),40,IF(AND(RC[-3]>RC[-1],RC[-3]>=9,RC[-3]<10),30,IF(AND(RC[-3]>RC[-1],RC[-3]>=10,RC[-3]<11),20,IF(AND(RC[-3]>RC[-1],RC[-3]>=11,RC[-3]<12),10,IF(AND(RC[-3]>RC[-1],RC[-3]>=12),0))))))))))))))))))))))))))))))))) -> 35 | H480: =IF(RC[-3]="","",IF(RC[-3]<0.3,100,IF(AND(RC[-3]>=0.3,RC[-3]>0.4),95,IF(AND(RC[-3]>=0.4,RC[-3]<0.5),90,IF(AND(RC[-3]>=0.5,RC[-3]<0.6),85,IF(AND(RC[-3]>=0.6,RC[-3]<0.7),80,IF(AND(RC[-3]>=0.6,RC[-3]<1),80,IF(AND(RC[-3]>1,RC[-3]<2),50,IF(RC[-3]>2,0))))))))) ->  | I480: =IF(RC[-1]="",RC[-2],0.7*RC[-1]+0.3*RC[-2]) -> 35
A481: تبرک | B481: تبرک | C481: =VLOOKUP(RC[-1],Sheet1!R3C2:R802C3,2,FALSE) -> غذایی بجز قند وشکر | D481: =VLOOKUP(RC[-2],Sheet1!R3C2:R802C9,8,FALSE) -> 21.548537068586921 | E481: =IF(VLOOKUP(RC[-3],Sheet1!R3C2:R803C11,10,FALSE)=0,"",VLOOKUP(Sheet2!RC[-3],Sheet1!R[1]C[-3]:R[801]C[6],10,FALSE)) ->  | F481: =Sheet1!R546C10 -> 18.927119434200804 | G481: =IF(RC[-3]<0,0,IF(AND(RC[-3]<RC[-1],RC[-3]<2),100,IF(AND(RC[-3]<RC[-1],RC[-3]>=2,RC[-3]<3),95,IF(AND(RC[-3]<RC[-1],RC[-3]>=3,RC[-3]<4),90,IF(AND(RC[-3]<RC[-1],RC[-3]>=4,RC[-3]<5),85,IF(AND(RC[-3]<RC[-1],RC[-3]>=5,RC[-3]<6),80,IF(AND(RC[-3]<RC[-1],RC[-3]>=6,RC[-3]<7),75,IF(AND(RC[-3]<RC[-1],RC[-3]>=7,RC[-3]<8),70,IF(AND(RC[-3]<RC[-1],RC[-3]>=8,RC[-3]<9),65,IF(AND(RC[-3]<RC[-1],RC[-3]>=9,RC[-3]<10),60,IF(AND(RC[-3]<RC[-1],RC[-3]>=10,RC[-3]<11),55,IF(AND(RC[-3]<RC[-1],RC[-3]>=11,RC[-3]<12),50,IF(AND(RC[-3]<RC[-1],RC[-3]>=12,RC[-3]<13),45,IF(AND(RC[-3]<RC[-1],RC[-3]>=13,RC[-3]<14),40,IF(AND(RC[-3]<RC[-1],RC[-3]>=14,RC[-3]<15),35,IF(AND(RC[-3]<RC[-1],RC[-3]>=15,RC[-3]<16),30,IF(AND(RC[-3]<RC[-1],RC[-3]>=16,RC[-3]<17),25,IF(AND(RC[-3]<RC[-1],RC[-3]>=17,RC[-3]<18),20,IF(AND(RC[-3]<RC[-1],RC[-3]>=18,RC[-3]<19),15,IF(AND(RC[-3]<RC[-1],RC[-3]>=19,RC[-3]<20),10,IF(AND(RC[-3]<RC[-1],RC[-3]>=20,RC[-3]<21),5,IF(AND(RC[-3]<RC[-1],RC[-3]>=21),0,IF(AND(RC[-3]>RC[-1],RC[-3]>=2,RC[-3]<3),90,IF(AND(RC[-3]>RC[-1],RC[-3]>=3,RC[-3]<4),90,IF(AND(RC[-3]>RC[-1],RC[-3]>=4,RC[-3]<5),80,IF(AND(RC[-3]>RC[-1],RC[-3]>=5,RC[-3]<6),70,IF(AND(RC[-3]>RC[-1],RC[-3]>=6,RC[-3]<7),60,IF(AND(RC[-3]>RC[-1],RC[-3]>=7,RC[-3]<8),50,IF(AND(RC[-3]>RC[-1],RC[-3]>=8,RC[-3]<9),40,IF(AND(RC[-3]>RC[-1],RC[-3]>=9,RC[-3]<10),30,IF(AND(RC[-3]>RC[-1],RC[-3]>=10,RC[-3]<11),20,IF(AND(RC[-3]>RC[-1],RC[-3]>=11,RC[-3]<12),10,IF(AND(RC[-3]>RC[-1],RC[-3]>=12),0))))))))))))))))))))))))))))))))) -> 0 | H481: =IF(RC[-3]="","",IF(RC[-3]<0.3,100,IF(AND(RC[-3]>=0.3,RC[-3]>0.4),95,IF(AND(RC[-3]>=0.4,RC[-3]<0.5),90,IF(AND(RC[-3]>=0.5,RC[-3]<0.6),85,IF(AND(RC[-3]>=0.6,RC[-3]<0.7),80,IF(AND(RC[-3]>=0.6,RC[-3]<1),80,IF(AND(RC[-3]>1,RC[-3]<2),50,IF(RC[-3]>2,0))))))))) ->  | I481: =IF(RC[-1]="",RC[-2],0.7*RC[-1]+0.3*RC[-2]) -> 0
A482: توسعه صنایع بهشهر | B482: وبشهر | C482: =VLOOKUP(RC[-1],Sheet1!R3C2:R802C3,2,FALSE) -> غذایی بجز قند وشکر | D482: =VLOOKUP(RC[-2],Sheet1!R3C2:R802C9,8,FALSE) -> 8.7965925594297278 | E482: =IF(VLOOKUP(RC[-3],Sheet1!R3C2:R803C11,10,FALSE)=0,"",VLOOKUP(Sheet2!RC[-3],Sheet1!R[1]C[-3]:R[801]C[6],10,FALSE)) -> 0.43 | F482: =Sheet1!R546C10 -> 18.927119434200804 | G482: =IF(RC[-3]<0,0,IF(AND(RC[-3]<RC[-1],RC[-3]<2),100,IF(AND(RC[-3]<RC[-1],RC[-3]>=2,RC[-3]<3),95,IF(AND(RC[-3]<RC[-1],RC[-3]>=3,RC[-3]<4),90,IF(AND(RC[-3]<RC[-1],RC[-3]>=4,RC[-3]<5),85,IF(AND(RC[-3]<RC[-1],RC[-3]>=5,RC[-3]<6),80,IF(AND(RC[-3]<RC[-1],RC[-3]>=6,RC[-3]<7),75,IF(AND(RC[-3]<RC[-1],RC[-3]>=7,RC[-3]<8),70,IF(AND(RC[-3]<RC[-1],RC[-3]>=8,RC[-3]<9),65,IF(AND(RC[-3]<RC[-1],RC[-3]>=9,RC[-3]<10),60,IF(AND(RC[-3]<RC[-1],RC[-3]>=10,RC[-3]<11),55,IF(AND(RC[-3]<RC[-1],RC[-3]>=11,RC[-3]<12),50,IF(AND(RC[-3]<RC[-1],RC[-3]>=12,RC[-3]<13),45,IF(AND(RC[-3]<RC[-1],RC[-3]>=13,RC[-3]<14),40,IF(AND(RC[-3]<RC[-1],RC[-3]>=14,RC[-3]<15),35,IF(AND(RC[-3]<RC[-1],RC[-3]>=15,RC[-3]<16),30,IF(AND(RC[-3]<RC[-1],RC[-3]>=16,RC[-3]<17),25,IF(AND(RC[-3]<RC[-1],RC[-3]>=17,RC[-3]<18),20,IF(AND(RC[-3]<RC[-1],RC[-3]>=18,RC[-3]<19),15,IF(AND(RC[-3]<RC[-1],RC[-3]>=19,RC[-3]<20),10,IF(AND(RC[-3]<RC[-1],RC[-3]>=20,RC[-3]<21),5,IF(AND(RC[-3]<RC[-1],RC[-3]>=21),0,IF(AND(RC[-3]>RC[-1],RC[-3]>=2,RC[-3]<3),90,IF(AND(RC[-3]>RC[-1],RC[-3]>=3,RC[-3]<4),90,IF(AND(RC[-3]>RC[-1],RC[-3]>=4,RC[-3]<5),80,IF(AND(RC[-3]>RC[-1],RC[-3]>=5,RC[-3]<6),70,IF(AND(RC[-3]>RC[-1],RC[-3]>=6,RC[-3]<7),60,IF(AND(RC[-3]>RC[-1],RC[-3]>=7,RC[-3]<8),50,IF(AND(RC[-3]>RC[-1],RC[-3]>=8,RC[-3]<9),40,IF(AND(RC[-3]>RC[-1],RC[-3]>=9,RC[-3]<10),30,IF(AND(RC[-3]>RC[-1],RC[-3]>=10,RC[-3]<11),20,IF(AND(RC[-3]>RC[-1],RC[-3]>=11,RC[-3]<12),10,IF(AND(RC[-3]>RC[-1],RC[-3]>=12),0))))))))))))))))))))))))))))))))) -> 65 | H482: =IF(RC[-3]="","",IF(RC[-3]<0.3,100,IF(AND(RC[-3]>=0.3,RC[-3]>0.4),95,IF(AND(RC[-3]>=0.4,RC[-3]<0.5),90,IF(AND(RC[-3]>=0.5,RC[-3]<0.6),85,IF(AND(RC[-3]>=0.6,RC[-3]<0.7),80,IF(AND(RC[-3]>=0.6,RC[-3]<1),80,IF(AND(RC[-3]>1,RC[-3]<2),50,IF(RC[-3]>2,0))))))))) -> 95 | I482: =IF(RC[-1]="",RC[-2],0.7*RC[-1]+0.3*RC[-2]) -> 86
A483: خودکفایی آزادگان | B483: خودکفا | C483: =VLOOKUP(RC[-1],Sheet1!R3C2:R802C3,2,FALSE) -> غذایی بجز قند وشکر | D483: =VLOOKUP(RC[-2],Sheet1!R3C2:R802C9,8,FALSE) -> 24.970026646456716 | E483: =IF(VLOOKUP(RC[-3],Sheet1!R3C2:R803C11,10,FALSE)=0,"",VLOOKUP(Sheet2!RC[-3],Sheet1!R[1]C[-3]:R[801]C[6],10,FALSE)) -> 0.6 | F483: =Sheet1!R546C10 -> 18.927119434200804 | G483: =IF(RC[-3]<0,0,IF(AND(RC[-3]<RC[-1],RC[-3]<2),100,IF(AND(RC[-3]<RC[-1],RC[-3]>=2,RC[-3]<3),95,IF(AND(RC[-3]<RC[-1],RC[-3]>=3,RC[-3]<4),90,IF(AND(RC[-3]<RC[-1],RC[-3]>=4,RC[-3]<5),85,IF(AND(RC[-3]<RC[-1],RC[-3]>=5,RC[-3]<6),80,IF(AND(RC[-3]<RC[-1],RC[-3]>=6,RC[-3]<7),75,IF(AND(RC[-3]<RC[-1],RC[-3]>=7,RC[-3]<8),70,IF(AND(RC[-3]<RC[-1],RC[-3]>=8,RC[-3]<9),65,IF(AND(RC[-3]<RC[-1],RC[-3]>=9,RC[-3]<10),60,IF(AND(RC[-3]<RC[-1],RC[-3]>=10,RC[-3]<11),55,IF(AND(RC[-3]<RC[-1],RC[-3]>=11,RC[-3]<12),50,IF(AND(RC[-3]<RC[-1],RC[-3]>=12,RC[-3]<13),45,IF(AND(RC[-3]<RC[-1],RC[-3]>=13,RC[-3]<14),40,IF(AND(RC[-3]<RC[-1],RC[-3]>=14,RC[-3]<15),35,IF(AND(RC[-3]<RC[-1],RC[-3]>=15,RC[-3]<16),30,IF(AND(RC[-3]<RC[-1],RC[-3]>=16,RC[-3]<17),25,IF(AND(RC[-3]<RC[-1],RC[-3]>=17,RC[-3]<18),20,IF(AND(RC[-3]<RC[-1],RC[-3]>=18,RC[-3]<19),15,IF(AND(RC[-3]<RC[-1],RC[-3]>=19,RC[-3]<20),10,IF(AND(RC[-3]<RC[-1],RC[-3]>=20,RC[-3]<21),5,IF(AND(RC[-3]<RC[-1],RC[-3]>=21),0,IF(AND(RC[-3]>RC[-1],RC[-3]>=2,RC[-3]<3),90,IF(AND(RC[-3]>RC[-1],RC[-3]>=3,RC[-3]<4),90,IF(AND(RC[-3]>RC[-1],RC[-3]>=4,RC[-3]<5),80,IF(AND(RC[-3]>RC[-1],RC[-3]>=5,RC[-3]<6),70,IF(AND(RC[-3]>RC[-1],RC[-3]>=6,RC[-3]<7),60,IF(AND(RC[-3]>RC[-1],RC[-3]>=7,RC[-3]<8),50,IF(AND(RC[-3]>RC[-1],RC[-3]>=8,RC[-3]<9),40,IF(AND(RC[-3]>RC[-1],RC[-3]>=9,RC[-3]<10),30,IF(AND(RC[-3]>RC[-1],RC[-3]>=10,RC[-3]<11),20,IF(AND(RC[-3]>RC[-1],RC[-3]>=11,RC[-3]<12),10,IF(AND(RC[-3]>RC[-1],RC[-3]>=12),0))))))))))))))))))))))))))))))))) -> 0 | H483: =IF(RC[-3]="","",IF(RC[-3]<0.3,100,IF(AND(RC[-3]>=0.3,RC[-3]>0.4),95,IF(AND(RC[-3]>=0.4,RC[-3]<0.5),90,IF(AND(RC[-3]>=0.5,RC[-3]<0.6),85,IF(AND(RC[-3]>=0.6,RC[-3]<0.7),80,IF(AND(RC[-3]>=0.6,RC[-3]<1),80,IF(AND(RC[-3]>1,RC[-3]<2),50,IF(RC[-3]>2,0))))))))) -> 95 | I483: =IF(RC[-1]="",RC[-2],0.7*RC[-1]+0.3*RC[-2]) -> 66.5
A484: خوراک دام پارس | B484: غدام | C484: =VLOOKUP(RC[-1],Sheet1!R3C2:R802C3,2,FALSE) -> غذایی بجز قند وشکر | D484: =VLOOKUP(RC[-2],Sheet1!R3C2:R802C9,8,FALSE) -> 86.258077124701714 | E484: =IF(VLOOKUP(RC[-3],Sheet1!R3C2:R803C11,10,FALSE)=0,"",VLOOKUP(Sheet2!RC[-3],Sheet1!R[1]C[-3]:R[801]C[6],10,FALSE)) ->  | F484: =Sheet1!R546C10 -> 18.927119434200804 | G484: =IF(RC[-3]<0,0,IF(AND(RC[-3]<RC[-1],RC[-3]<2),100,IF(AND(RC[-3]<RC[-1],RC[-3]>=2,RC[-3]<3),95,IF(AND(RC[-3]<RC[-1],RC[-3]>=3,RC[-3]<4),90,IF(AND(RC[-3]<RC[-1],RC[-3]>=4,RC[-3]<5),85,IF(AND(RC[-3]<RC[-1],RC[-3]>=5,RC[-3]<6),80,IF(AND(RC[-3]<RC[-1],RC[-3]>=6,RC[-3]<7),75,IF(AND(RC[-3]<RC[-1],RC[-3]>=7,RC[-3]<8),70,IF(AND(RC[-3]<RC[-1],RC[-3]>=8,RC[-3]<9),65,IF(AND(RC[-3]<RC[-1],RC[-3]>=9,RC[-3]<10),60,IF(AND(RC[-3]<RC[-1],RC[-3]>=10,RC[-3]<11),55,IF(AND(RC[-3]<RC[-1],RC[-3]>=11,RC[-3]<12),50,IF(AND(RC[-3]<RC[-1],RC[-3]>=12,RC[-3]<13),45,IF(AND(RC[-3]<RC[-1],RC[-3]>=13,RC[-3]<14),40,IF(AND(RC[-3]<RC[-1],RC[-3]>=14,RC[-3]<15),35,IF(AND(RC[-3]<RC[-1],RC[-3]>=15,RC[-3]<16),30,IF(AND(RC[-3]<RC[-1],RC[-3]>=16,RC[-3]<17),25,IF(AND(RC[-3]<RC[-1],RC[-3]>=17,RC[-3]<18),20,IF(AND(RC[-3]<RC[-1],RC[-3]>=18,RC[-3]<19),15,IF(AND(RC[-3]<RC[-1],RC[-3]>=19,RC[-3]<20),10,IF(AND(RC[-3]<RC[-1],RC[-3]>=20,RC[-3]<21),5,IF(AND(RC[-3]<RC[-1],RC[-3]>=21),0,IF(AND(RC[-3]>RC[-1],RC[-3]>=2,RC[-3]<3),90,IF(AND(RC[-3]>RC[-1],RC[-3]>=3,RC[-3]<4),90,IF(AND(RC[-3]>RC[-1],RC[-3]>=4,RC[-3]<5),80,IF(AND(RC[-3]>RC[-1],RC[-3]>=5,RC[-3]<6),70,IF(AND(RC[-3]>RC[-1],RC[-3]>=6,RC[-3]<7),60,IF(AND(RC[-3]>RC[-1],RC[-3]>=7,RC[-3]<8),50,IF(AND(RC[-3]>RC[-1],RC[-3]>=8,RC[-3]<9),40,IF(AND(RC[-3]>RC[-1],RC[-3]>=9,RC[-3]<10),30,IF(AND(RC[-3]>RC[-1],RC[-3]>=10,RC[-3]<11),20,IF(AND(RC[-3]>RC[-1],RC[-3]>=11,RC[-3]<12),10,IF(AND(RC[-3]>RC[-1],RC[-3]>=12),0))))))))))))))))))))))))))))))))) -> 0 | H484: =IF(RC[-3]="","",IF(RC[-3]<0.3,100,IF(AND(RC[-3]>=0.3,RC[-3]>0.4),95,IF(AND(RC[-3]>=0.4,RC[-3]<0.5),90,IF(AND(RC[-3]>=0.5,RC[-3]<0.6),85,IF(AND(RC[-3]>=0.6,RC[-3]<0.7),80,IF(AND(RC[-3]>=0.6,RC[-3]<1),80,IF(AND(RC[-3]>1,RC[-3]<2),50,IF(RC[-3]>2,0))))))))) ->  | I484: =IF(RC[-1]="",RC[-2],0.7*RC[-1]+0.3*RC[-2]) -> 0
A485: دشت مرغاب | B485: غدشت | C485: =VLOOKUP(RC[-1],Sheet1!R3C2:R802C3,2,FALSE) -> غذایی بجز قند وشکر | D485: =VLOOKUP(RC[-2],Sheet1!R3C2:R802C9,8,FALSE) -> 35.125667026723448 | E485: =IF(VLOOKUP(RC[-3],Sheet1!R3C2:R803C11,10,FALSE)=0,"",VLOOKUP(Sheet2!RC[-3],Sheet1!R[1]C[-3]:R[801]C[6],10,FALSE)) ->  | F485: =Sheet1!R546C10 -> 18.927119434200804 | G485: =IF(RC[-3]<0,0,IF(AND(RC[-3]<RC[-1],RC[-3]<2),100,IF(AND(RC[-3]<RC[-1],RC[-3]>=2,RC[-3]<3),95,IF(AND(RC[-3]<RC[-1],RC[-3]>=3,RC[-3]<4),90,IF(AND(RC[-3]<RC[-1],RC[-3]>=4,RC[-3]<5),85,IF(AND(RC[-3]<RC[-1],RC[-3]>=5,RC[-3]<6),80,IF(AND(RC[-3]<RC[-1],RC[-3]>=6,RC[-3]<7),75,IF(AND(RC[-3]<RC[-1],RC[-3]>=7,RC[-3]<8),70,IF(AND(RC[-3]<RC[-1],RC[-3]>=8,RC[-3]<9),65,IF(AND(RC[-3]<RC[-1],RC[-3]>=9,RC[-3]<10),60,IF(AND(RC[-3]<RC[-1],RC[-3]>=10,RC[-3]<11),55,IF(AND(RC[-3]<RC[-1],RC[-3]>=11,RC[-3]<12),50,IF(AND(RC[-3]<RC[-1],RC[-3]>=12,RC[-3]<13),45,IF(AND(RC[-3]<RC[-1],RC[-3]>=13,RC[-3]<14),40,IF(AND(RC[-3]<RC[-1],RC[-3]>=14,RC[-3]<15),35,IF(AND(RC[-3]<RC[-1],RC[-3]>=15,RC[-3]<16),30,IF(AND(RC[-3]<RC[-1],RC[-3]>=16,RC[-3]<17),25,IF(AND(RC[-3]<RC[-1],RC[-3]>=17,RC[-3]<18),20,IF(AND(RC[-3]<RC[-1],RC[-3]>=18,RC[-3]<19),15,IF(AND(RC[-3]<RC[-1],RC[-3]>=19,RC[-3]<20),10,IF(AND(RC[-3]<RC[-1],RC[-3]>=20,RC[-3]<21),5,IF(AND(RC[-3]<RC[-1],RC[-3]>=21),0,IF(AND(RC[-3]>RC[-1],RC[-3]>=2,RC[-3]<3),90,IF(AND(RC[-3]>RC[-1],RC[-3]>=3,RC[-3]<4),90,IF(AND(RC[-3]>RC[-1],RC[-3]>=4,RC[-3]<5),80,IF(AND(RC[-3]>RC[-1],RC[-3]>=5,RC[-3]<6),70,IF(AND(RC[-3]>RC[-1],RC[-3]>=6,RC[-3]<7),60,IF(AND(RC[-3]>RC[-1],RC[-3]>=7,RC[-3]<8),50,IF(AND(RC[-3]>RC[-1],RC[-3]>=8,RC[-3]<9),40,IF(AND(RC[-3]>RC[-1],RC[-3]>=9,RC[-3]<10),30,IF(AND(RC[-3]>RC[-1],RC[-3]>=10,RC[-3]<11),20,IF(AND(RC[-3]>RC[-1],RC[-3]>=11,RC[-3]<12),10,IF(AND(RC[-3]>RC[-1],RC[-3]>=12),0))))))))))))))))))))))))))))))))) -> 0 | H485: =IF(RC[-3]="","",IF(RC[-3]<0.3,100,IF(AND(RC[-3]>=0.3,RC[-3]>0.4),95,IF(AND(RC[-3]>=0.4,RC[-3]<0.5),90,IF(AND(RC[-3]>=0.5,RC[-3]<0.6),85,IF(AND(RC[-3]>=0.6,RC[-3]<0.7),80,IF(AND(RC[-3]>=0.6,RC[-3]<1),80,IF(AND(RC[-3]>1,RC[-3]<2),50,IF(RC[-3]>2,0))))))))) ->  | I485: =IF(RC[-1]="",RC[-2],0.7*RC[-1]+0.3*RC[-2]) -> 0
A486: زر ماکارون | B486: غزر | C486: =VLOOKUP(RC[-1],Sheet1!R3C2:R802C3,2,FALSE) -> غذایی بجز قند وشکر | D486: =VLOOKUP(RC[-2],Sheet1!R3C2:R802C9,8,FALSE) -> 5.4395068334270062 | E486: =IF(VLOOKUP(RC[-3],Sheet1!R3C2:R803C11,10,FALSE)=0,"",VLOOKUP(Sheet2!RC[-3],Sheet1!R[1]C[-3]:R[801]C[6],10,FALSE)) ->  | F486: =Sheet1!R546C10 -> 18.927119434200804 | G486: =IF(RC[-3]<0,0,IF(AND(RC[-3]<RC[-1],RC[-3]<2),100,IF(AND(RC[-3]<RC[-1],RC[-3]>=2,RC[-3]<3),95,IF(AND(RC[-3]<RC[-1],RC[-3]>=3,RC[-3]<4),90,IF(AND(RC[-3]<RC[-1],RC[-3]>=4,RC[-3]<5),85,IF(AND(RC[-3]<RC[-1],RC[-3]>=5,RC[-3]<6),80,IF(AND(RC[-3]<RC[-1],RC[-3]>=6,RC[-3]<7),75,IF(AND(RC[-3]<RC[-1],RC[-3]>=7,RC[-3]<8),70,IF(AND(RC[-3]<RC[-1],RC[-3]>=8,RC[-3]<9),65,IF(AND(RC[-3]<RC[-1],RC[-3]>=9,RC[-3]<10),60,IF(AND(RC[-3]<RC[-1],RC[-3]>=10,RC[-3]<11),55,IF(AND(RC[-3]<RC[-1],RC[-3]>=11,RC[-3]<12),50,IF(AND(RC[-3]<RC[-1],RC[-3]>=12,RC[-3]<13),45,IF(AND(RC[-3]<RC[-1],RC[-3]>=13,RC[-3]<14),40,IF(AND(RC[-3]<RC[-1],RC[-3]>=14,RC[-3]<15),35,IF(AND(RC[-3]<RC[-1],RC[-3]>=15,RC[-3]<16),30,IF(AND(RC[-3]<RC[-1],RC[-3]>=16,RC[-3]<17),25,IF(AND(RC[-3]<RC[-1],RC[-3]>=17,RC[-3]<18),20,IF(AND(RC[-3]<RC[-1],RC[-3]>=18,RC[-3]<19),15,IF(AND(RC[-3]<RC[-1],RC[-3]>=19,RC[-3]<20),10,IF(AND(RC[-3]<RC[-1],RC[-3]>=20,RC[-3]<21),5,IF(AND(RC[-3]<RC[-1],RC[-3]>=21),0,IF(AND(RC[-3]>RC[-1],RC[-3]>=2,RC[-3]<3),90,IF(AND(RC[-3]>RC[-1],RC[-3]>=3,RC[-3]<4),90,IF(AND(RC[-3]>RC[-1],RC[-3]>=4,RC[-3]<5),80,IF(AND(RC[-3]>RC[-1],RC[-3]>=5,RC[-3]<6),70,IF(AND(RC[-3]>RC[-1],RC[-3]>=6,RC[-3]<7),60,IF(AND(RC[-3]>RC[-1],RC[-3]>=7,RC[-3]<8),50,IF(AND(RC[-3]>RC[-1],RC[-3]>=8,RC[-3]<9),40,IF(AND(RC[-3]>RC[-1],RC[-3]>=9,RC[-3]<10),30,IF(AND(RC[-3]>RC[-1],RC[-3]>=10,RC[-3]<11),20,IF(AND(RC[-3]>RC[-1],RC[-3]>=11,RC[-3]<12),10,IF(AND(RC[-3]>RC[-1],RC[-3]>=12),0))))))))))))))))))))))))))))))))) -> 80 | H486: =IF(RC[-3]="","",IF(RC[-3]<0.3,100,IF(AND(RC[-3]>=0.3,RC[-3]>0.4),95,IF(AND(RC[-3]>=0.4,RC[-3]<0.5),90,IF(AND(RC[-3]>=0.5,RC[-3]<0.6),85,IF(AND(RC[-3]>=0.6,RC[-3]<0.7),80,IF(AND(RC[-3]>=0.6,RC[-3]<1),80,IF(AND(RC[-3]>1,RC[-3]<2),50,IF(RC[-3]>2,0))))))))) ->  | I486: =IF(RC[-1]="",RC[-2],0.7*RC[-1]+0.3*RC[-2]) -> 80
A487: سالمین | B487: غسالم | C487: =VLOOKUP(RC[-1],Sheet1!R3C2:R802C3,2,FALSE) -> غذایی بجز قند وشکر | D487: =VLOOKUP(RC[-2],Sheet1!R3C2:R802C9,8,FALSE) -> 8.7941995820915153 | E487: =IF(VLOOKUP(RC[-3],Sheet1!R3C2:R803C11,10,FALSE)=0,"",VLOOKUP(Sheet2!RC[-3],Sheet1!R[1]C[-3]:R[801]C[6],10,FALSE)) ->  | F487: =Sheet1!R546C10 -> 18.927119434200804 | G487: =IF(RC[-3]<0,0,IF(AND(RC[-3]<RC[-1],RC[-3]<2),100,IF(AND(RC[-3]<RC[-1],RC[-3]>=2,RC[-3]<3),95,IF(AND(RC[-3]<RC[-1],RC[-3]>=3,RC[-3]<4),90,IF(AND(RC[-3]<RC[-1],RC[-3]>=4,RC[-3]<5),85,IF(AND(RC[-3]<RC[-1],RC[-3]>=5,RC[-3]<6),80,IF(AND(RC[-3]<RC[-1],RC[-3]>=6,RC[-3]<7),75,IF(AND(RC[-3]<RC[-1],RC[-3]>=7,RC[-3]<8),70,IF(AND(RC[-3]<RC[-1],RC[-3]>=8,RC[-3]<9),65,IF(AND(RC[-3]<RC[-1],RC[-3]>=9,RC[-3]<10),60,IF(AND(RC[-3]<RC[-1],RC[-3]>=10,RC[-3]<11),55,IF(AND(RC[-3]<RC[-1],RC[-3]>=11,RC[-3]<12),50,IF(AND(RC[-3]<RC[-1],RC[-3]>=12,RC[-3]<13),45,IF(AND(RC[-3]<RC[-1],RC[-3]>=13,RC[-3]<14),40,IF(AND(RC[-3]<RC[-1],RC[-3]>=14,RC[-3]<15),35,IF(AND(RC[-3]<RC[-1],RC[-3]>=15,RC[-3]<16),30,IF(AND(RC[-3]<RC[-1],RC[-3]>=16,RC[-3]<17),25,IF(AND(RC[-3]<RC[-1],RC[-3]>=17,RC[-3]<18),20,IF(AND(RC[-3]<RC[-1],RC[-3]>=18,RC[-3]<19),15,IF(AND(RC[-3]<RC[-1],RC[-3]>=19,RC[-3]<20),10,IF(AND(RC[-3]<RC[-1],RC[-3]>=20,RC[-3]<21),5,IF(AND(RC[-3]<RC[-1],RC[-3]>=21),0,IF(AND(RC[-3]>RC[-1],RC[-3]>=2,RC[-3]<3),90,IF(AND(RC[-3]>RC[-1],RC[-3]>=3,RC[-3]<4),90,IF(AND(RC[-3]>RC[-1],RC[-3]>=4,RC[-3]<5),80,IF(AND(RC[-3]>RC[-1],RC[-3]>=5,RC[-3]<6),70,IF(AND(RC[-3]>RC[-1],RC[-3]>=6,RC[-3]<7),60,IF(AND(RC[-3]>RC[-1],RC[-3]>=7,RC[-3]<8),50,IF(AND(RC[-3]>RC[-1],RC[-3]>=8,RC[-3]<9),40,IF(AND(RC[-3]>RC[-1],RC[-3]>=9,RC[-3]<10),30,IF(AND(RC[-3]>RC[-1],RC[-3]>=10,RC[-3]<11),20,IF(AND(RC[-3]>RC[-1],RC[-3]>=11,RC[-3]<12),10,IF(AND(RC[-3]>RC[-1],RC[-3]>=12),0))))))))))))))))))))))))))))))))) -> 65 | H487: =IF(RC[-3]="","",IF(RC[-3]<0.3,100,IF(AND(RC[-3]>=0.3,RC[-3]>0.4),95,IF(AND(RC[-3]>=0.4,RC[-3]<0.5),90,IF(AND(RC[-3]>=0.5,RC[-3]<0.6),85,IF(AND(RC[-3]>=0.6,RC[-3]<0.7),80,IF(AND(RC[-3]>=0.6,RC[-3]<1),80,IF(AND(RC[-3]>1,RC[-3]<2),50,IF(RC[-3]>2,0))))))))) ->  | I487: =IF(RC[-1]="",RC[-2],0.7*RC[-1]+0.3*RC[-2]) -> 65
A488: شهد ایران | B488: غشهد | C488: =VLOOKUP(RC[-1],Sheet1!R3C2:R802C3,2,FALSE) -> غذایی بجز قند وشکر | D488: =VLOOKUP(RC[-2],Sheet1!R3C2:R802C9,8,FALSE) -> 11.586667356755381 | E488: =IF(VLOOKUP(RC[-3],Sheet1!R3C2:R803C11,10,FALSE)=0,"",VLOOKUP(Sheet2!RC[-3],Sheet1!R[1]C[-3]:R[801]C[6],10,FALSE)) ->  | F488: =Sheet1!R546C10 -> 18.927119434200804 | G488: =IF(RC[-3]<0,0,IF(AND(RC[-3]<RC[-1],RC[-3]<2),100,IF(AND(RC[-3]<RC[-1],RC[-3]>=2,RC[-3]<3),95,IF(AND(RC[-3]<RC[-1],RC[-3]>=3,RC[-3]<4),90,IF(AND(RC[-3]<RC[-1],RC[-3]>=4,RC[-3]<5),85,IF(AND(RC[-3]<RC[-1],RC[-3]>=5,RC[-3]<6),80,IF(AND(RC[-3]<RC[-1],RC[-3]>=6,RC[-3]<7),75,IF(AND(RC[-3]<RC[-1],RC[-3]>=7,RC[-3]<8),70,IF(AND(RC[-3]<RC[-1],RC[-3]>=8,RC[-3]<9),65,IF(AND(RC[-3]<RC[-1],RC[-3]>=9,RC[-3]<10),60,IF(AND(RC[-3]<RC[-1],RC[-3]>=10,RC[-3]<11),55,IF(AND(RC[-3]<RC[-1],RC[-3]>=11,RC[-3]<12),50,IF(AND(RC[-3]<RC[-1],RC[-3]>=12,RC[-3]<13),45,IF(AND(RC[-3]<RC[-1],RC[-3]>=13,RC[-3]<14),40,IF(AND(RC[-3]<RC[-1],RC[-3]>=14,RC[-3]<15),35,IF(AND(RC[-3]<RC[-1],RC[-3]>=15,RC[-3]<16),30,IF(AND(RC[-3]<RC[-1],RC[-3]>=16,RC[-3]<17),25,IF(AND(RC[-3]<RC[-1],RC[-3]>=17,RC[-3]<18),20,IF(AND(RC[-3]<RC[-1],RC[-3]>=18,RC[-3]<19),15,IF(AND(RC[-3]<RC[-1],RC[-3]>=19,RC[-3]<20),10,IF(AND(RC[-3]<RC[-1],RC[-3]>=20,RC[-3]<21),5,IF(AND(RC[-3]<RC[-1],RC[-3]>=21),0,IF(AND(RC[-3]>RC[-1],RC[-3]>=2,RC[-3]<3),90,IF(AND(RC[-3]>RC[-1],RC[-3]>=3,RC[-3]<4),90,IF(AND(RC[-3]>RC[-1],RC[-3]>=4,RC[-3]<5),80,IF(AND(RC[-3]>RC[-1],RC[-3]>=5,RC[-3]<6),70,IF(AND(RC[-3]>RC[-1],RC[-3]>=6,RC[-3]<7),60,IF(AND(RC[-3]>RC[-1],RC[-3]>=7,RC[-3]<8),50,IF(AND(RC[-3]>RC[-1],RC[-3]>=8,RC[-3]<9),40,IF(AND(RC[-3]>RC[-1],RC[-3]>=9,RC[-3]<10),30,IF(AND(RC[-3]>RC[-1],RC[-3]>=10,RC[-3]<11),20,IF(AND(RC[-3]>RC[-1],RC[-3]>=11,RC[-3]<12),10,IF(AND(RC[-3]>RC[-1],RC[-3]>=12),0))))))))))))))))))))))))))))))))) -> 50 | H488: =IF(RC[-3]="","",IF(RC[-3]<0.3,100,IF(AND(RC[-3]>=0.3,RC[-3]>0.4),95,IF(AND(RC[-3]>=0.4,RC[-3]<0.5),90,IF(AND(RC[-3]>=0.5,RC[-3]<0.6),85,IF(AND(RC[-3]>=0.6,RC[-3]<0.7),80,IF(AND(RC[-3]>=0.6,RC[-3]<1),80,IF(AND(RC[-3]>1,RC[-3]<2),50,IF(RC[-3]>2,0))))))))) ->  | I488: =IF(RC[-1]="",RC[-2],0.7*RC[-1]+0.3*RC[-2]) -> 50
A489: شهداب ناب خراسان | B489: غشهداب | C489: =VLOOKUP(RC[-1],Sheet1!R3C2:R802C3,2,FALSE) -> غذایی بجز قند وشکر | D489: =VLOOKUP(RC[-2],Sheet1!R3C2:R802C9,8,FALSE) -> 5.0942142130734469 | E489: =IF(VLOOKUP(RC[-3],Sheet1!R3C2:R803C11,10,FALSE)=0,"",VLOOKUP(Sheet2!RC[-3],Sheet1!R[1]C[-3]:R[801]C[6],10,FALSE)) ->  | F489: =Sheet1!R546C10 -> 18.927119434200804 | G489: =IF(RC[-3]<0,0,IF(AND(RC[-3]<RC[-1],RC[-3]<2),100,IF(AND(RC[-3]<RC[-1],RC[-3]>=2,RC[-3]<3),95,IF(AND(RC[-3]<RC[-1],RC[-3]>=3,RC[-3]<4),90,IF(AND(RC[-3]<RC[-1],RC[-3]>=4,RC[-3]<5),85,IF(AND(RC[-3]<RC[-1],RC[-3]>=5,RC[-3]<6),80,IF(AND(RC[-3]<RC[-1],RC[-3]>=6,RC[-3]<7),75,IF(AND(RC[-3]<RC[-1],RC[-3]>=7,RC[-3]<8),70,IF(AND(RC[-3]<RC[-1],RC[-3]>=8,RC[-3]<9),65,IF(AND(RC[-3]<RC[-1],RC[-3]>=9,RC[-3]<10),60,IF(AND(RC[-3]<RC[-1],RC[-3]>=10,RC[-3]<11),55,IF(AND(RC[-3]<RC[-1],RC[-3]>=11,RC[-3]<12),50,IF(AND(RC[-3]<RC[-1],RC[-3]>=12,RC[-3]<13),45,IF(AND(RC[-3]<RC[-1],RC[-3]>=13,RC[-3]<14),40,IF(AND(RC[-3]<RC[-1],RC[-3]>=14,RC[-3]<15),35,IF(AND(RC[-3]<RC[-1],RC[-3]>=15,RC[-3]<16),30,IF(AND(RC[-3]<RC[-1],RC[-3]>=16,RC[-3]<17),25,IF(AND(RC[-3]<RC[-1],RC[-3]>=17,RC[-3]<18),20,IF(AND(RC[-3]<RC[-1],RC[-3]>=18,RC[-3]<19),15,IF(AND(RC[-3]<RC[-1],RC[-3]>=19,RC[-3]<20),10,IF(AND(RC[-3]<RC[-1],RC[-3]>=20,RC[-3]<21),5,IF(AND(RC[-3]<RC[-1],RC[-3]>=21),0,IF(AND(RC[-3]>RC[-1],RC[-3]>=2,RC[-3]<3),90,IF(AND(RC[-3]>RC[-1],RC[-3]>=3,RC[-3]<4),90,IF(AND(RC[-3]>RC[-1],RC[-3]>=4,RC[-3]<5),80,IF(AND(RC[-3]>RC[-1],RC[-3]>=5,RC[-3]<6),70,IF(AND(RC[-3]>RC[-1],RC[-3]>=6,RC[-3]<7),60,IF(AND(RC[-3]>RC[-1],RC[-3]>=7,RC[-3]<8),50,IF(AND(RC[-3]>RC[-1],RC[-3]>=8,RC[-3]<9),40,IF(AND(RC[-3]>RC[-1],RC[-3]>=9,RC[-3]<10),30,IF(AND(RC[-3]>RC[-1],RC[-3]>=10,RC[-3]<11),20,IF(AND(RC[-3]>RC[-1],RC[-3]>=11,RC[-3]<12),10,IF(AND(RC[-3]>RC[-1],RC[-3]>=12),0))))))))))))))))))))))))))))))))) -> 80 | H489: =IF(RC[-3]="","",IF(RC[-3]<0.3,100,IF(AND(RC[-3]>=0.3,RC[-3]>0.4),95,IF(AND(RC[-3]>=0.4,RC[-3]<0.5),90,IF(AND(RC[-3]>=0.5,RC[-3]<0.6),85,IF(AND(RC[-3]>=0.6,RC[-3]<0.7),80,IF(AND(RC[-3]>=0.6,RC[-3]<1),80,IF(AND(RC[-3]>1,RC[-3]<2),50,IF(RC[-3]>2,0))))))))) ->  | I489: =IF(RC[-1]="",RC[-2],0.7*RC[-1]+0.3*RC[-2]) -> 80
A490: شوکوپارس | B490: غشوکو | C490: =VLOOKUP(RC[-1],Sheet1!R3C2:R802C3,2,FALSE) -> غذایی بجز قند وشکر | D490: =VLOOKUP(RC[-2],Sheet1!R3C2:R802C9,8,FALSE) -> 10.378789345796111 | E490: =IF(VLOOKUP(RC[-3],Sheet1!R3C2:R803C11,10,FALSE)=0,"",VLOOKUP(Sheet2!RC[-3],Sheet1!R[1]C[-3]:R[801]C[6],10,FALSE)) ->  | F490: =Sheet1!R546C10 -> 18.927119434200804 | G490: =IF(RC[-3]<0,0,IF(AND(RC[-3]<RC[-1],RC[-3]<2),100,IF(AND(RC[-3]<RC[-1],RC[-3]>=2,RC[-3]<3),95,IF(AND(RC[-3]<RC[-1],RC[-3]>=3,RC[-3]<4),90,IF(AND(RC[-3]<RC[-1],RC[-3]>=4,RC[-3]<5),85,IF(AND(RC[-3]<RC[-1],RC[-3]>=5,RC[-3]<6),80,IF(AND(RC[-3]<RC[-1],RC[-3]>=6,RC[-3]<7),75,IF(AND(RC[-3]<RC[-1],RC[-3]>=7,RC[-3]<8),70,IF(AND(RC[-3]<RC[-1],RC[-3]>=8,RC[-3]<9),65,IF(AND(RC[-3]<RC[-1],RC[-3]>=9,RC[-3]<10),60,IF(AND(RC[-3]<RC[-1],RC[-3]>=10,RC[-3]<11),55,IF(AND(RC[-3]<RC[-1],RC[-3]>=11,RC[-3]<12),50,IF(AND(RC[-3]<RC[-1],RC[-3]>=12,RC[-3]<13),45,IF(AND(RC[-3]<RC[-1],RC[-3]>=13,RC[-3]<14),40,IF(AND(RC[-3]<RC[-1],RC[-3]>=14,RC[-3]<15),35,IF(AND(RC[-3]<RC[-1],RC[-3]>=15,RC[-3]<16),30,IF(AND(RC[-3]<RC[-1],RC[-3]>=16,RC[-3]<17),25,IF(AND(RC[-3]<RC[-1],RC[-3]>=17,RC[-3]<18),20,IF(AND(RC[-3]<RC[-1],RC[-3]>=18,RC[-3]<19),15,IF(AND(RC[-3]<RC[-1],RC[-3]>=19,RC[-3]<20),10,IF(AND(RC[-3]<RC[-1],RC[-3]>=20,RC[-3]<21),5,IF(AND(RC[-3]<RC[-1],RC[-3]>=21),0,IF(AND(RC[-3]>RC[-1],RC[-3]>=2,RC[-3]<3),90,IF(AND(RC[-3]>RC[-1],RC[-3]>=3,RC[-3]<4),90,IF(AND(RC[-3]>RC[-1],RC[-3]>=4,RC[-3]<5),80,IF(AND(RC[-3]>RC[-1],RC[-3]>=5,RC[-3]<6),70,IF(AND(RC[-3]>RC[-1],RC[-3]>=6,RC[-3]<7),60,IF(AND(RC[-3]>RC[-1],RC[-3]>=7,RC[-3]<8),50,IF(AND(RC[-3]>RC[-1],RC[-3]>=8,RC[-3]<9),40,IF(AND(RC[-3]>RC[-1],RC[-3]>=9,RC[-3]<10),30,IF(AND(RC[-3]>RC[-1],RC[-3]>=10,RC[-3]<11),20,IF(AND(RC[-3]>RC[-1],RC[-3]>=11,RC[-3]<12),10,IF(AND(RC[-3]>RC[-1],RC[-3]>=12),0))))))))))))))))))))))))))))))))) -> 55 | H490: =IF(RC[-3]="","",IF(RC[-3]<0.3,100,IF(AND(RC[-3]>=0.3,RC[-3]>0.4),95,IF(AND(RC[-3]>=0.4,RC[-3]<0.5),90,IF(AND(RC[-3]>=0.5,RC[-3]<0.6),85,IF(AND(RC[-3]>=0.6,RC[-3]<0.7),80,IF(AND(RC[-3]>=0.6,RC[-3]<1),80,IF(AND(RC[-3]>1,RC[-3]<2),50,IF(RC[-3]>2,0))))))))) ->  | I490: =IF(RC[-1]="",RC[-2],0.7*RC[-1]+0.3*RC[-2]) -> 55
A491: شیر پاستوریزه پگاه گلپایگان | B491: غگلپا | C491: =VLOOKUP(RC[-1],Sheet1!R3C2:R802C3,2,FALSE) -> غذایی بجز قند وشکر | D491: =VLOOKUP(RC[-2],Sheet1!R3C2:R802C9,8,FALSE) -> 9.4719554674396296 | E491: =IF(VLOOKUP(RC[-3],Sheet1!R3C2:R803C11,10,FALSE)=0,"",VLOOKUP(Sheet2!RC[-3],Sheet1!R[1]C[-3]:R[801]C[6],10,FALSE)) ->  | F491: =Sheet1!R546C10 -> 18.927119434200804 | G491: =IF(RC[-3]<0,0,IF(AND(RC[-3]<RC[-1],RC[-3]<2),100,IF(AND(RC[-3]<RC[-1],RC[-3]>=2,RC[-3]<3),95,IF(AND(RC[-3]<RC[-1],RC[-3]>=3,RC[-3]<4),90,IF(AND(RC[-3]<RC[-1],RC[-3]>=4,RC[-3]<5),85,IF(AND(RC[-3]<RC[-1],RC[-3]>=5,RC[-3]<6),80,IF(AND(RC[-3]<RC[-1],RC[-3]>=6,RC[-3]<7),75,IF(AND(RC[-3]<RC[-1],RC[-3]>=7,RC[-3]<8),70,IF(AND(RC[-3]<RC[-1],RC[-3]>=8,RC[-3]<9),65,IF(AND(RC[-3]<RC[-1],RC[-3]>=9,RC[-3]<10),60,IF(AND(RC[-3]<RC[-1],RC[-3]>=10,RC[-3]<11),55,IF(AND(RC[-3]<RC[-1],RC[-3]>=11,RC[-3]<12),50,IF(AND(RC[-3]<RC[-1],RC[-3]>=12,RC[-3]<13),45,IF(AND(RC[-3]<RC[-1],RC[-3]>=13,RC[-3]<14),40,IF(AND(RC[-3]<RC[-1],RC[-3]>=14,RC[-3]<15),35,IF(AND(RC[-3]<RC[-1],RC[-3]>=15,RC[-3]<16),30,IF(AND(RC[-3]<RC[-1],RC[-3]>=16,RC[-3]<17),25,IF(AND(RC[-3]<RC[-1],RC[-3]>=17,RC[-3]<18),20,IF(AND(RC[-3]<RC[-1],RC[-3]>=18,RC[-3]<19),15,IF(AND(RC[-3]<RC[-1],RC[-3]>=19,RC[-3]<20),10,IF(AND(RC[-3]<RC[-1],RC[-3]>=20,RC[-3]<21),5,IF(AND(RC[-3]<RC[-1],RC[-3]>=21),0,IF(AND(RC[-3]>RC[-1],RC[-3]>=2,RC[-3]<3),90,IF(AND(RC[-3]>RC[-1],RC[-3]>=3,RC[-3]<4),90,IF(AND(RC[-3]>RC[-1],RC[-3]>=4,RC[-3]<5),80,IF(AND(RC[-3]>RC[-1],RC[-3]>=5,RC[-3]<6),70,IF(AND(RC[-3]>RC[-1],RC[-3]>=6,RC[-3]<7),60,IF(AND(RC[-3]>RC[-1],RC[-3]>=7,RC[-3]<8),50,IF(AND(RC[-3]>RC[-1],RC[-3]>=8,RC[-3]<9),40,IF(AND(RC[-3]>RC[-1],RC[-3]>=9,RC[-3]<10),30,IF(AND(RC[-3]>RC[-1],RC[-3]>=10,RC[-3]<11),20,IF(AND(RC[-3]>RC[-1],RC[-3]>=11,RC[-3]<12),10,IF(AND(RC[-3]>RC[-1],RC[-3]>=12),0))))))))))))))))))))))))))))))))) -> 60 | H491: =IF(RC[-3]="","",IF(RC[-3]<0.3,100,IF(AND(RC[-3]>=0.3,RC[-3]>0.4),95,IF(AND(RC[-3]>=0.4,RC[-3]<0.5),90,IF(AND(RC[-3]>=0.5,RC[-3]<0.6),85,IF(AND(RC[-3]>=0.6,RC[-3]<0.7),80,IF(AND(RC[-3]>=0.6,RC[-3]<1),80,IF(AND(RC[-3]>1,RC[-3]<2),50,IF(RC[-3]>2,0))))))))) ->  | I491: =IF(RC[-1]="",RC[-2],0.7*RC[-1]+0.3*RC[-2]) -> 60
A492: شیر پاستوریزه پگاه گلستان | B492: غگلستا | C492: =VLOOKUP(RC[-1],Sheet1!R3C2:R802C3,2,FALSE) -> غذایی بجز قند وشکر | D492: =VLOOKUP(RC[-2],Sheet1!R3C2:R802C9,8,FALSE) -> 10.104247101757736 | E492: =IF(VLOOKUP(RC[-3],Sheet1!R3C2:R803C11,10,FALSE)=0,"",VLOOKUP(Sheet2!RC[-3],Sheet1!R[1]C[-3]:R[801]C[6],10,FALSE)) ->  | F492: =Sheet1!R546C10 -> 18.927119434200804 | G492: =IF(RC[-3]<0,0,IF(AND(RC[-3]<RC[-1],RC[-3]<2),100,IF(AND(RC[-3]<RC[-1],RC[-3]>=2,RC[-3]<3),95,IF(AND(RC[-3]<RC[-1],RC[-3]>=3,RC[-3]<4),90,IF(AND(RC[-3]<RC[-1],RC[-3]>=4,RC[-3]<5),85,IF(AND(RC[-3]<RC[-1],RC[-3]>=5,RC[-3]<6),80,IF(AND(RC[-3]<RC[-1],RC[-3]>=6,RC[-3]<7),75,IF(AND(RC[-3]<RC[-1],RC[-3]>=7,RC[-3]<8),70,IF(AND(RC[-3]<RC[-1],RC[-3]>=8,RC[-3]<9),65,IF(AND(RC[-3]<RC[-1],RC[-3]>=9,RC[-3]<10),60,IF(AND(RC[-3]<RC[-1],RC[-3]>=10,RC[-3]<11),55,IF(AND(RC[-3]<RC[-1],RC[-3]>=11,RC[-3]<12),50,IF(AND(RC[-3]<RC[-1],RC[-3]>=12,RC[-3]<13),45,IF(AND(RC[-3]<RC[-1],RC[-3]>=13,RC[-3]<14),40,IF(AND(RC[-3]<RC[-1],RC[-3]>=14,RC[-3]<15),35,IF(AND(RC[-3]<RC[-1],RC[-3]>=15,RC[-3]<16),30,IF(AND(RC[-3]<RC[-1],RC[-3]>=16,RC[-3]<17),25,IF(AND(RC[-3]<RC[-1],RC[-3]>=17,RC[-3]<18),20,IF(AND(RC[-3]<RC[-1],RC[-3]>=18,RC[-3]<19),15,IF(AND(RC[-3]<RC[-1],RC[-3]>=19,RC[-3]<20),10,IF(AND(RC[-3]<RC[-1],RC[-3]>=20,RC[-3]<21),5,IF(AND(RC[-3]<RC[-1],RC[-3]>=21),0,IF(AND(RC[-3]>RC[-1],RC[-3]>=2,RC[-3]<3),90,IF(AND(RC[-3]>RC[-1],RC[-3]>=3,RC[-3]<4),90,IF(AND(RC[-3]>RC[-1],RC[-3]>=4,RC[-3]<5),80,IF(AND(RC[-3]>RC[-1],RC[-3]>=5,RC[-3]<6),70,IF(AND(RC[-3]>RC[-1],RC[-3]>=6,RC[-3]<7),60,IF(AND(RC[-3]>RC[-1],RC[-3]>=7,RC[-3]<8),50,IF(AND(RC[-3]>RC[-1],RC[-3]>=8,RC[-3]<9),40,IF(AND(RC[-3]>RC[-1],RC[-3]>=9,RC[-3]<10),30,IF(AND(RC[-3]>RC[-1],RC[-3]>=10,RC[-3]<11),20,IF(AND(RC[-3]>RC[-1],RC[-3]>=11,RC[-3]<12),10,IF(AND(RC[-3]>RC[-1],RC[-3]>=12),0))))))))))))))))))))))))))))))))) -> 55 | H492: =IF(RC[-3]="","",IF(RC[-3]<0.3,100,IF(AND(RC[-3]>=0.3,RC[-3]>0.4),95,IF(AND(RC[-3]>=0.4,RC[-3]<0.5),90,IF(AND(RC[-3]>=0.5,RC[-3]<0.6),85,IF(AND(RC[-3]>=0.6,RC[-3]<0.7),80,IF(AND(RC[-3]>=0.6,RC[-3]<1),80,IF(AND(RC[-3]>1,RC[-3]<2),50,IF(RC[-3]>2,0))))))))) ->  | I492: =IF(RC[-1]="",RC[-2],0.7*RC[-1]+0.3*RC[-2]) -> 55
A493: شیر پاستوریزه پگاه گیلان | B493: غگیلا | C493: =VLOOKUP(RC[-1],Sheet1!R3C2:R802C3,2,FALSE) -> غذایی بجز قند وشکر | D493: =VLOOKUP(RC[-2],Sheet1!R3C2:R802C9,8,FALSE) -> 20.39401131381365 | E493: =IF(VLOOKUP(RC[-3],Sheet1!R3C2:R803C11,10,FALSE)=0,"",VLOOKUP(Sheet2!RC[-3],Sheet1!R[1]C[-3]:R[801]C[6],10,FALSE)) ->  | F493: =Sheet1!R546C10 -> 18.927119434200804 | G493: =IF(RC[-3]<0,0,IF(AND(RC[-3]<RC[-1],RC[-3]<2),100,IF(AND(RC[-3]<RC[-1],RC[-3]>=2,RC[-3]<3),95,IF(AND(RC[-3]<RC[-1],RC[-3]>=3,RC[-3]<4),90,IF(AND(RC[-3]<RC[-1],RC[-3]>=4,RC[-3]<5),85,IF(AND(RC[-3]<RC[-1],RC[-3]>=5,RC[-3]<6),80,IF(AND(RC[-3]<RC[-1],RC[-3]>=6,RC[-3]<7),75,IF(AND(RC[-3]<RC[-1],RC[-3]>=7,RC[-3]<8),70,IF(AND(RC[-3]<RC[-1],RC[-3]>=8,RC[-3]<9),65,IF(AND(RC[-3]<RC[-1],RC[-3]>=9,RC[-3]<10),60,IF(AND(RC[-3]<RC[-1],RC[-3]>=10,RC[-3]<11),55,IF(AND(RC[-3]<RC[-1],RC[-3]>=11,RC[-3]<12),50,IF(AND(RC[-3]<RC[-1],RC[-3]>=12,RC[-3]<13),45,IF(AND(RC[-3]<RC[-1],RC[-3]>=13,RC[-3]<14),40,IF(AND(RC[-3]<RC[-1],RC[-3]>=14,RC[-3]<15),35,IF(AND(RC[-3]<RC[-1],RC[-3]>=15,RC[-3]<16),30,IF(AND(RC[-3]<RC[-1],RC[-3]>=16,RC[-3]<17),25,IF(AND(RC[-3]<RC[-1],RC[-3]>=17,RC[-3]<18),20,IF(AND(RC[-3]<RC[-1],RC[-3]>=18,RC[-3]<19),15,IF(AND(RC[-3]<RC[-1],RC[-3]>=19,RC[-3]<20),10,IF(AND(RC[-3]<RC[-1],RC[-3]>=20,RC[-3]<21),5,IF(AND(RC[-3]<RC[-1],RC[-3]>=21),0,IF(AND(RC[-3]>RC[-1],RC[-3]>=2,RC[-3]<3),90,IF(AND(RC[-3]>RC[-1],RC[-3]>=3,RC[-3]<4),90,IF(AND(RC[-3]>RC[-1],RC[-3]>=4,RC[-3]<5),80,IF(AND(RC[-3]>RC[-1],RC[-3]>=5,RC[-3]<6),70,IF(AND(RC[-3]>RC[-1],RC[-3]>=6,RC[-3]<7),60,IF(AND(RC[-3]>RC[-1],RC[-3]>=7,RC[-3]<8),50,IF(AND(RC[-3]>RC[-1],RC[-3]>=8,RC[-3]<9),40,IF(AND(RC[-3]>RC[-1],RC[-3]>=9,RC[-3]<10),30,IF(AND(RC[-3]>RC[-1],RC[-3]>=10,RC[-3]<11),20,IF(AND(RC[-3]>RC[-1],RC[-3]>=11,RC[-3]<12),10,IF(AND(RC[-3]>RC[-1],RC[-3]>=12),0))))))))))))))))))))))))))))))))) -> 0 | H493: =IF(RC[-3]="","",IF(RC[-3]<0.3,100,IF(AND(RC[-3]>=0.3,RC[-3]>0.4),95,IF(AND(RC[-3]>=0.4,RC[-3]<0.5),90,IF(AND(RC[-3]>=0.5,RC[-3]<0.6),85,IF(AND(RC[-3]>=0.6,RC[-3]<0.7),80,IF(AND(RC[-3]>=0.6,RC[-3]<1),80,IF(AND(RC[-3]>1,RC[-3]<2),50,IF(RC[-3]>2,0))))))))) ->  | I493: =IF(RC[-1]="",RC[-2],0.7*RC[-1]+0.3*RC[-2]) -> 0
A494: صنایع غذایی مینو شرق | B494: غمینو | C494: =VLOOKUP(RC[-1],Sheet1!R3C2:R802C3,2,FALSE) -> غذایی بجز قند وشکر | D494: =VLOOKUP(RC[-2],Sheet1!R3C2:R802C9,8,FALSE) -> 5 | E494: =IF(VLOOKUP(RC[-3],Sheet1!R3C2:R803C11,10,FALSE)=0,"",VLOOKUP(Sheet2!RC[-3],Sheet1!R[1]C[-3]:R[801]C[6],10,FALSE)) ->  | F494: =Sheet1!R546C10 -> 18.927119434200804 | G494: =IF(RC[-3]<0,0,IF(AND(RC[-3]<RC[-1],RC[-3]<2),100,IF(AND(RC[-3]<RC[-1],RC[-3]>=2,RC[-3]<3),95,IF(AND(RC[-3]<RC[-1],RC[-3]>=3,RC[-3]<4),90,IF(AND(RC[-3]<RC[-1],RC[-3]>=4,RC[-3]<5),85,IF(AND(RC[-3]<RC[-1],RC[-3]>=5,RC[-3]<6),80,IF(AND(RC[-3]<RC[-1],RC[-3]>=6,RC[-3]<7),75,IF(AND(RC[-3]<RC[-1],RC[-3]>=7,RC[-3]<8),70,IF(AND(RC[-3]<RC[-1],RC[-3]>=8,RC[-3]<9),65,IF(AND(RC[-3]<RC[-1],RC[-3]>=9,RC[-3]<10),60,IF(AND(RC[-3]<RC[-1],RC[-3]>=10,RC[-3]<11),55,IF(AND(RC[-3]<RC[-1],RC[-3]>=11,RC[-3]<12),50,IF(AND(RC[-3]<RC[-1],RC[-3]>=12,RC[-3]<13),45,IF(AND(RC[-3]<RC[-1],RC[-3]>=13,RC[-3]<14),40,IF(AND(RC[-3]<RC[-1],RC[-3]>=14,RC[-3]<15),35,IF(AND(RC[-3]<RC[-1],RC[-3]>=15,RC[-3]<16),30,IF(AND(RC[-3]<RC[-1],RC[-3]>=16,RC[-3]<17),25,IF(AND(RC[-3]<RC[-1],RC[-3]>=17,RC[-3]<18),20,IF(AND(RC[-3]<RC[-1],RC[-3]>=18,RC[-3]<19),15,IF(AND(RC[-3]<RC[-1],RC[-3]>=19,RC[-3]<20),10,IF(AND(RC[-3]<RC[-1],RC[-3]>=20,RC[-3]<21),5,IF(AND(RC[-3]<RC[-1],RC[-3]>=21),0,IF(AND(RC[-3]>RC[-1],RC[-3]>=2,RC[-3]<3),90,IF(AND(RC[-3]>RC[-1],RC[-3]>=3,RC[-3]<4),90,IF(AND(RC[-3]>RC[-1],RC[-3]>=4,RC[-3]<5),80,IF(AND(RC[-3]>RC[-1],RC[-3]>=5,RC[-3]<6),70,IF(AND(RC[-3]>RC[-1],RC[-3]>=6,RC[-3]<7),60,IF(AND(RC[-3]>RC[-1],RC[-3]>=7,RC[-3]<8),50,IF(AND(RC[-3]>RC[-1],RC[-3]>=8,RC[-3]<9),40,IF(AND(RC[-3]>RC[-1],RC[-3]>=9,RC[-3]<10),30,IF(AND(RC[-3]>RC[-1],RC[-3]>=10,RC[-3]<11),20,IF(AND(RC[-3]>RC[-1],RC[-3]>=11,RC[-3]<12),10,IF(AND(RC[-3]>RC[-1],RC[-3]>=12),0))))))))))))))))))))))))))))))))) -> 80 | H494: =IF(RC[-3]="","",IF(RC[-3]<0.3,100,IF(AND(RC[-3]>=0.3,RC[-3]>0.4),95,IF(AND(RC[-3]>=0.4,RC[-3]<0.5),90,IF(AND(RC[-3]>=0.5,RC[-3]<0.6),85,IF(AND(RC[-3]>=0.6,RC[-3]<0.7),80,IF(AND(RC[-3]>=0.6,RC[-3]<1),80,IF(AND(RC[-3]>1,RC[-3]<2),50,IF(RC[-3]>2,0))))))))) ->  | I494: =IF(RC[-1]="",RC[-2],0.7*RC[-1]+0.3*RC[-2]) -> 80
A495: صنعت غذایی کورش | B495: غکورش | C495: =VLOOKUP(RC[-1],Sheet1!R3C2:R802C3,2,FALSE) -> غذایی بجز قند وشکر | D495: =VLOOKUP(RC[-2],Sheet1!R3C2:R802C9,8,FALSE) -> 3.5656485694431352 | E495: =IF(VLOOKUP(RC[-3],Sheet1!R3C2:R803C11,10,FALSE)=0,"",VLOOKUP(Sheet2!RC[-3],Sheet1!R[1]C[-3]:R[801]C[6],10,FALSE)) ->  | F495: =Sheet1!R546C10 -> 18.927119434200804 | G495: =IF(RC[-3]<0,0,IF(AND(RC[-3]<RC[-1],RC[-3]<2),100,IF(AND(RC[-3]<RC[-1],RC[-3]>=2,RC[-3]<3),95,IF(AND(RC[-3]<RC[-1],RC[-3]>=3,RC[-3]<4),90,IF(AND(RC[-3]<RC[-1],RC[-3]>=4,RC[-3]<5),85,IF(AND(RC[-3]<RC[-1],RC[-3]>=5,RC[-3]<6),80,IF(AND(RC[-3]<RC[-1],RC[-3]>=6,RC[-3]<7),75,IF(AND(RC[-3]<RC[-1],RC[-3]>=7,RC[-3]<8),70,IF(AND(RC[-3]<RC[-1],RC[-3]>=8,RC[-3]<9),65,IF(AND(RC[-3]<RC[-1],RC[-3]>=9,RC[-3]<10),60,IF(AND(RC[-3]<RC[-1],RC[-3]>=10,RC[-3]<11),55,IF(AND(RC[-3]<RC[-1],RC[-3]>=11,RC[-3]<12),50,IF(AND(RC[-3]<RC[-1],RC[-3]>=12,RC[-3]<13),45,IF(AND(RC[-3]<RC[-1],RC[-3]>=13,RC[-3]<14),40,IF(AND(RC[-3]<RC[-1],RC[-3]>=14,RC[-3]<15),35,IF(AND(RC[-3]<RC[-1],RC[-3]>=15,RC[-3]<16),30,IF(AND(RC[-3]<RC[-1],RC[-3]>=16,RC[-3]<17),25,IF(AND(RC[-3]<RC[-1],RC[-3]>=17,RC[-3]<18),20,IF(AND(RC[-3]<RC[-1],RC[-3]>=18,RC[-3]<19),15,IF(AND(RC[-3]<RC[-1],RC[-3]>=19,RC[-3]<20),10,IF(AND(RC[-3]<RC[-1],RC[-3]>=20,RC[-3]<21),5,IF(AND(RC[-3]<RC[-1],RC[-3]>=21),0,IF(AND(RC[-3]>RC[-1],RC[-3]>=2,RC[-3]<3),90,IF(AND(RC[-3]>RC[-1],RC[-3]>=3,RC[-3]<4),90,IF(AND(RC[-3]>RC[-1],RC[-3]>=4,RC[-3]<5),80,IF(AND(RC[-3]>RC[-1],RC[-3]>=5,RC[-3]<6),70,IF(AND(RC[-3]>RC[-1],RC[-3]>=6,RC[-3]<7),60,IF(AND(RC[-3]>RC[-1],RC[-3]>=7,RC[-3]<8),50,IF(AND(RC[-3]>RC[-1],RC[-3]>=8,RC[-3]<9),40,IF(AND(RC[-3]>RC[-1],RC[-3]>=9,RC[-3]<10),30,IF(AND(RC[-3]>RC[-1],RC[-3]>=10,RC[-3]<11),20,IF(AND(RC[-3]>RC[-1],RC[-3]>=11,RC[-3]<12),10,IF(AND(RC[-3]>RC[-1],RC[-3]>=12),0))))))))))))))))))))))))))))))))) -> 90 | H495: =IF(RC[-3]="","",IF(RC[-3]<0.3,100,IF(AND(RC[-3]>=0.3,RC[-3]>0.4),95,IF(AND(RC[-3]>=0.4,RC[-3]<0.5),90,IF(AND(RC[-3]>=0.5,RC[-3]<0.6),85,IF(AND(RC[-3]>=0.6,RC[-3]<0.7),80,IF(AND(RC[-3]>=0.6,RC[-3]<1),80,IF(AND(RC[-3]>1,RC[-3]<2),50,IF(RC[-3]>2,0))))))))) ->  | I495: =IF(RC[-1]="",RC[-2],0.7*RC[-1]+0.3*RC[-2]) -> 90
A496: صنعتی بهپاک | B496: بهپاک | C496: =VLOOKUP(RC[-1],Sheet1!R3C2:R802C3,2,FALSE) -> غذایی بجز قند وشکر | D496: =VLOOKUP(RC[-2],Sheet1!R3C2:R802C9,8,FALSE) -> 6.4734309150461362 | E496: =IF(VLOOKUP(RC[-3],Sheet1!R3C2:R803C11,10,FALSE)=0,"",VLOOKUP(Sheet2!RC[-3],Sheet1!R[1]C[-3]:R[801]C[6],10,FALSE)) ->  | F496: =Sheet1!R546C10 -> 18.927119434200804 | G496: =IF(RC[-3]<0,0,IF(AND(RC[-3]<RC[-1],RC[-3]<2),100,IF(AND(RC[-3]<RC[-1],RC[-3]>=2,RC[-3]<3),95,IF(AND(RC[-3]<RC[-1],RC[-3]>=3,RC[-3]<4),90,IF(AND(RC[-3]<RC[-1],RC[-3]>=4,RC[-3]<5),85,IF(AND(RC[-3]<RC[-1],RC[-3]>=5,RC[-3]<6),80,IF(AND(RC[-3]<RC[-1],RC[-3]>=6,RC[-3]<7),75,IF(AND(RC[-3]<RC[-1],RC[-3]>=7,RC[-3]<8),70,IF(AND(RC[-3]<RC[-1],RC[-3]>=8,RC[-3]<9),65,IF(AND(RC[-3]<RC[-1],RC[-3]>=9,RC[-3]<10),60,IF(AND(RC[-3]<RC[-1],RC[-3]>=10,RC[-3]<11),55,IF(AND(RC[-3]<RC[-1],RC[-3]>=11,RC[-3]<12),50,IF(AND(RC[-3]<RC[-1],RC[-3]>=12,RC[-3]<13),45,IF(AND(RC[-3]<RC[-1],RC[-3]>=13,RC[-3]<14),40,IF(AND(RC[-3]<RC[-1],RC[-3]>=14,RC[-3]<15),35,IF(AND(RC[-3]<RC[-1],RC[-3]>=15,RC[-3]<16),30,IF(AND(RC[-3]<RC[-1],RC[-3]>=16,RC[-3]<17),25,IF(AND(RC[-3]<RC[-1],RC[-3]>=17,RC[-3]<18),20,IF(AND(RC[-3]<RC[-1],RC[-3]>=18,RC[-3]<19),15,IF(AND(RC[-3]<RC[-1],RC[-3]>=19,RC[-3]<20),10,IF(AND(RC[-3]<RC[-1],RC[-3]>=20,RC[-3]<21),5,IF(AND(RC[-3]<RC[-1],RC[-3]>=21),0,IF(AND(RC[-3]>RC[-1],RC[-3]>=2,RC[-3]<3),90,IF(AND(RC[-3]>RC[-1],RC[-3]>=3,RC[-3]<4),90,IF(AND(RC[-3]>RC[-1],RC[-3]>=4,RC[-3]<5),80,IF(AND(RC[-3]>RC[-1],RC[-3]>=5,RC[-3]<6),70,IF(AND(RC[-3]>RC[-1],RC[-3]>=6,RC[-3]<7),60,IF(AND(RC[-3]>RC[-1],RC[-3]>=7,RC[-3]<8),50,IF(AND(RC[-3]>RC[-1],RC[-3]>=8,RC[-3]<9),40,IF(AND(RC[-3]>RC[-1],RC[-3]>=9,RC[-3]<10),30,IF(AND(RC[-3]>RC[-1],RC[-3]>=10,RC[-3]<11),20,IF(AND(RC[-3]>RC[-1],RC[-3]>=11,RC[-3]<12),10,IF(AND(RC[-3]>RC[-1],RC[-3]>=12),0))))))))))))))))))))))))))))))))) -> 75 | H496: =IF(RC[-3]="","",IF(RC[-3]<0.3,100,IF(AND(RC[-3]>=0.3,RC[-3]>0.4),95,IF(AND(RC[-3]>=0.4,RC[-3]<0.5),90,IF(AND(RC[-3]>=0.5,RC[-3]<0.6),85,IF(AND(RC[-3]>=0.6,RC[-3]<0.7),80,IF(AND(RC[-3]>=0.6,RC[-3]<1),80,IF(AND(RC[-3]>1,RC[-3]<2),50,IF(RC[-3]>2,0))))))))) ->  | I496: =IF(RC[-1]="",RC[-2],0.7*RC[-1]+0.3*RC[-2]) -> 75
A497: صنعتی بهشهر | B497: غبشهر | C497: =VLOOKUP(RC[-1],Sheet1!R3C2:R802C3,2,FALSE) -> غذایی بجز قند وشکر | D497: =VLOOKUP(RC[-2],Sheet1!R3C2:R802C9,8,FALSE) -> 6.4471456841139032 | E497: =IF(VLOOKUP(RC[-3],Sheet1!R3C2:R803C11,10,FALSE)=0,"",VLOOKUP(Sheet2!RC[-3],Sheet1!R[1]C[-3]:R[801]C[6],10,FALSE)) ->  | F497: =Sheet1!R546C10 -> 18.927119434200804 | G497: =IF(RC[-3]<0,0,IF(AND(RC[-3]<RC[-1],RC[-3]<2),100,IF(AND(RC[-3]<RC[-1],RC[-3]>=2,RC[-3]<3),95,IF(AND(RC[-3]<RC[-1],RC[-3]>=3,RC[-3]<4),90,IF(AND(RC[-3]<RC[-1],RC[-3]>=4,RC[-3]<5),85,IF(AND(RC[-3]<RC[-1],RC[-3]>=5,RC[-3]<6),80,IF(AND(RC[-3]<RC[-1],RC[-3]>=6,RC[-3]<7),75,IF(AND(RC[-3]<RC[-1],RC[-3]>=7,RC[-3]<8),70,IF(AND(RC[-3]<RC[-1],RC[-3]>=8,RC[-3]<9),65,IF(AND(RC[-3]<RC[-1],RC[-3]>=9,RC[-3]<10),60,IF(AND(RC[-3]<RC[-1],RC[-3]>=10,RC[-3]<11),55,IF(AND(RC[-3]<RC[-1],RC[-3]>=11,RC[-3]<12),50,IF(AND(RC[-3]<RC[-1],RC[-3]>=12,RC[-3]<13),45,IF(AND(RC[-3]<RC[-1],RC[-3]>=13,RC[-3]<14),40,IF(AND(RC[-3]<RC[-1],RC[-3]>=14,RC[-3]<15),35,IF(AND(RC[-3]<RC[-1],RC[-3]>=15,RC[-3]<16),30,IF(AND(RC[-3]<RC[-1],RC[-3]>=16,RC[-3]<17),25,IF(AND(RC[-3]<RC[-1],RC[-3]>=17,RC[-3]<18),20,IF(AND(RC[-3]<RC[-1],RC[-3]>=18,RC[-3]<19),15,IF(AND(RC[-3]<RC[-1],RC[-3]>=19,RC[-3]<20),10,IF(AND(RC[-3]<RC[-1],RC[-3]>=20,RC[-3]<21),5,IF(AND(RC[-3]<RC[-1],RC[-3]>=21),0,IF(AND(RC[-3]>RC[-1],RC[-3]>=2,RC[-3]<3),90,IF(AND(RC[-3]>RC[-1],RC[-3]>=3,RC[-3]<4),90,IF(AND(RC[-3]>RC[-1],RC[-3]>=4,RC[-3]<5),80,IF(AND(RC[-3]>RC[-1],RC[-3]>=5,RC[-3]<6),70,IF(AND(RC[-3]>RC[-1],RC[-3]>=6,RC[-3]<7),60,IF(AND(RC[-3]>RC[-1],RC[-3]>=7,RC[-3]<8),50,IF(AND(RC[-3]>RC[-1],RC[-3]>=8,RC[-3]<9),40,IF(AND(RC[-3]>RC[-1],RC[-3]>=9,RC[-3]<10),30,IF(AND(RC[-3]>RC[-1],RC[-3]>=10,RC[-3]<11),20,IF(AND(RC[-3]>RC[-1],RC[-3]>=11,RC[-3]<12),10,IF(AND(RC[-3]>RC[-1],RC[-3]>=12),0))))))))))))))))))))))))))))))))) -> 75 | H497: =IF(RC[-3]="","",IF(RC[-3]<0.3,100,IF(AND(RC[-3]>=0.3,RC[-3]>0.4),95,IF(AND(RC[-3]>=0.4,RC[-3]<0.5),90,IF(AND(RC[-3]>=0.5,RC[-3]<0.6),85,IF(AND(RC[-3]>=0.6,RC[-3]<0.7),80,IF(AND(RC[-3]>=0.6,RC[-3]<1),80,IF(AND(RC[-3]>1,RC[-3]<2),50,IF(RC[-3]>2,0))))))))) ->  | I497: =IF(RC[-1]="",RC[-2],0.7*RC[-1]+0.3*RC[-2]) -> 75
A498: صنعتی مینو (خرمدره) | B498: غصینو | C498: =VLOOKUP(RC[-1],Sheet1!R3C2:R802C3,2,FALSE) -> غذایی بجز قند وشکر | D498: =VLOOKUP(RC[-2],Sheet1!R3C2:R802C9,8,FALSE) -> 8.8602906012738583 | E498: =IF(VLOOKUP(RC[-3],Sheet1!R3C2:R803C11,10,FALSE)=0,"",VLOOKUP(Sheet2!RC[-3],Sheet1!R[1]C[-3]:R[801]C[6],10,FALSE)) ->  | F498: =Sheet1!R546C10 -> 18.927119434200804 | G498: =IF(RC[-3]<0,0,IF(AND(RC[-3]<RC[-1],RC[-3]<2),100,IF(AND(RC[-3]<RC[-1],RC[-3]>=2,RC[-3]<3),95,IF(AND(RC[-3]<RC[-1],RC[-3]>=3,RC[-3]<4),90,IF(AND(RC[-3]<RC[-1],RC[-3]>=4,RC[-3]<5),85,IF(AND(RC[-3]<RC[-1],RC[-3]>=5,RC[-3]<6),80,IF(AND(RC[-3]<RC[-1],RC[-3]>=6,RC[-3]<7),75,IF(AND(RC[-3]<RC[-1],RC[-3]>=7,RC[-3]<8),70,IF(AND(RC[-3]<RC[-1],RC[-3]>=8,RC[-3]<9),65,IF(AND(RC[-3]<RC[-1],RC[-3]>=9,RC[-3]<10),60,IF(AND(RC[-3]<RC[-1],RC[-3]>=10,RC[-3]<11),55,IF(AND(RC[-3]<RC[-1],RC[-3]>=11,RC[-3]<12),50,IF(AND(RC[-3]<RC[-1],RC[-3]>=12,RC[-3]<13),45,IF(AND(RC[-3]<RC[-1],RC[-3]>=13,RC[-3]<14),40,IF(AND(RC[-3]<RC[-1],RC[-3]>=14,RC[-3]<15),35,IF(AND(RC[-3]<RC[-1],RC[-3]>=15,RC[-3]<16),30,IF(AND(RC[-3]<RC[-1],RC[-3]>=16,RC[-3]<17),25,IF(AND(RC[-3]<RC[-1],RC[-3]>=17,RC[-3]<18),20,IF(AND(RC[-3]<RC[-1],RC[-3]>=18,RC[-3]<19),15,IF(AND(RC[-3]<RC[-1],RC[-3]>=19,RC[-3]<20),10,IF(AND(RC[-3]<RC[-1],RC[-3]>=20,RC[-3]<21),5,IF(AND(RC[-3]<RC[-1],RC[-3]>=21),0,IF(AND(RC[-3]>RC[-1],RC[-3]>=2,RC[-3]<3),90,IF(AND(RC[-3]>RC[-1],RC[-3]>=3,RC[-3]<4),90,IF(AND(RC[-3]>RC[-1],RC[-3]>=4,RC[-3]<5),80,IF(AND(RC[-3]>RC[-1],RC[-3]>=5,RC[-3]<6),70,IF(AND(RC[-3]>RC[-1],RC[-3]>=6,RC[-3]<7),60,IF(AND(RC[-3]>RC[-1],RC[-3]>=7,RC[-3]<8),50,IF(AND(RC[-3]>RC[-1],RC[-3]>=8,RC[-3]<9),40,IF(AND(RC[-3]>RC[-1],RC[-3]>=9,RC[-3]<10),30,IF(AND(RC[-3]>RC[-1],RC[-3]>=10,RC[-3]<11),20,IF(AND(RC[-3]>RC[-1],RC[-3]>=11,RC[-3]<12),10,IF(AND(RC[-3]>RC[-1],RC[-3]>=12),0))))))))))))))))))))))))))))))))) -> 65 | H498: =IF(RC[-3]="","",IF(RC[-3]<0.3,100,IF(AND(RC[-3]>=0.3,RC[-3]>0.4),95,IF(AND(RC[-3]>=0.4,RC[-3]<0.5),90,IF(AND(RC[-3]>=0.5,RC[-3]<0.6),85,IF(AND(RC[-3]>=0.6,RC[-3]<0.7),80,IF(AND(RC[-3]>=0.6,RC[-3]<1),80,IF(AND(RC[-3]>1,RC[-3]<2),50,IF(RC[-3]>2,0))))))))) ->  | I498: =IF(RC[-1]="",RC[-2],0.7*RC[-1]+0.3*RC[-2]) -> 65
A499: گز سکه | B499: غگز | C499: =VLOOKUP(RC[-1],Sheet1!R3C2:R802C3,2,FALSE) -> غذایی بجز قند وشکر | D499: =VLOOKUP(RC[-2],Sheet1!R3C2:R802C9,8,FALSE) -> 52.238552184990397 | E499: =IF(VLOOKUP(RC[-3],Sheet1!R3C2:R803C11,10,FALSE)=0,"",VLOOKUP(Sheet2!RC[-3],Sheet1!R[1]C[-3]:R[801]C[6],10,FALSE)) ->  | F499: =Sheet1!R546C10 -> 18.927119434200804 | G499: =IF(RC[-3]<0,0,IF(AND(RC[-3]<RC[-1],RC[-3]<2),100,IF(AND(RC[-3]<RC[-1],RC[-3]>=2,RC[-3]<3),95,IF(AND(RC[-3]<RC[-1],RC[-3]>=3,RC[-3]<4),90,IF(AND(RC[-3]<RC[-1],RC[-3]>=4,RC[-3]<5),85,IF(AND(RC[-3]<RC[-1],RC[-3]>=5,RC[-3]<6),80,IF(AND(RC[-3]<RC[-1],RC[-3]>=6,RC[-3]<7),75,IF(AND(RC[-3]<RC[-1],RC[-3]>=7,RC[-3]<8),70,IF(AND(RC[-3]<RC[-1],RC[-3]>=8,RC[-3]<9),65,IF(AND(RC[-3]<RC[-1],RC[-3]>=9,RC[-3]<10),60,IF(AND(RC[-3]<RC[-1],RC[-3]>=10,RC[-3]<11),55,IF(AND(RC[-3]<RC[-1],RC[-3]>=11,RC[-3]<12),50,IF(AND(RC[-3]<RC[-1],RC[-3]>=12,RC[-3]<13),45,IF(AND(RC[-3]<RC[-1],RC[-3]>=13,RC[-3]<14),40,IF(AND(RC[-3]<RC[-1],RC[-3]>=14,RC[-3]<15),35,IF(AND(RC[-3]<RC[-1],RC[-3]>=15,RC[-3]<16),30,IF(AND(RC[-3]<RC[-1],RC[-3]>=16,RC[-3]<17),25,IF(AND(RC[-3]<RC[-1],RC[-3]>=17,RC[-3]<18),20,IF(AND(RC[-3]<RC[-1],RC[-3]>=18,RC[-3]<19),15,IF(AND(RC[-3]<RC[-1],RC[-3]>=19,RC[-3]<20),10,IF(AND(RC[-3]<RC[-1],RC[-3]>=20,RC[-3]<21),5,IF(AND(RC[-3]<RC[-1],RC[-3]>=21),0,IF(AND(RC[-3]>RC[-1],RC[-3]>=2,RC[-3]<3),90,IF(AND(RC[-3]>RC[-1],RC[-3]>=3,RC[-3]<4),90,IF(AND(RC[-3]>RC[-1],RC[-3]>=4,RC[-3]<5),80,IF(AND(RC[-3]>RC[-1],RC[-3]>=5,RC[-3]<6),70,IF(AND(RC[-3]>RC[-1],RC[-3]>=6,RC[-3]<7),60,IF(AND(RC[-3]>RC[-1],RC[-3]>=7,RC[-3]<8),50,IF(AND(RC[-3]>RC[-1],RC[-3]>=8,RC[-3]<9),40,IF(AND(RC[-3]>RC[-1],RC[-3]>=9,RC[-3]<10),30,IF(AND(RC[-3]>RC[-1],RC[-3]>=10,RC[-3]<11),20,IF(AND(RC[-3]>RC[-1],RC[-3]>=11,RC[-3]<12),10,IF(AND(RC[-3]>RC[-1],RC[-3]>=12),0))))))))))))))))))))))))))))))))) -> 0 | H499: =IF(RC[-3]="","",IF(RC[-3]<0.3,100,IF(AND(RC[-3]>=0.3,RC[-3]>0.4),95,IF(AND(RC[-3]>=0.4,RC[-3]<0.5),90,IF(AND(RC[-3]>=0.5,RC[-3]<0.6),85,IF(AND(RC[-3]>=0.6,RC[-3]<0.7),80,IF(AND(RC[-3]>=0.6,RC[-3]<1),80,IF(AND(RC[-3]>1,RC[-3]<2),50,IF(RC[-3]>2,0))))))))) ->  | I499: =IF(RC[-1]="",RC[-2],0.7*RC[-1]+0.3*RC[-2]) -> 0
A500: گلوکوزان | B500: غگل | C500: =VLOOKUP(RC[-1],Sheet1!R3C2:R802C3,2,FALSE) -> غذایی بجز قند وشکر | D500: =VLOOKUP(RC[-2],Sheet1!R3C2:R802C9,8,FALSE) -> 5.5 | E500: =IF(VLOOKUP(RC[-3],Sheet1!R3C2:R803C11,10,FALSE)=0,"",VLOOKUP(Sheet2!RC[-3],Sheet1!R[1]C[-3]:R[801]C[6],10,FALSE)) ->  | F500: =Sheet1!R546C10 -> 18.927119434200804 | G500: =IF(RC[-3]<0,0,IF(AND(RC[-3]<RC[-1],RC[-3]<2),100,IF(AND(RC[-3]<RC[-1],RC[-3]>=2,RC[-3]<3),95,IF(AND(RC[-3]<RC[-1],RC[-3]>=3,RC[-3]<4),90,IF(AND(RC[-3]<RC[-1],RC[-3]>=4,RC[-3]<5),85,IF(AND(RC[-3]<RC[-1],RC[-3]>=5,RC[-3]<6),80,IF(AND(RC[-3]<RC[-1],RC[-3]>=6,RC[-3]<7),75,IF(AND(RC[-3]<RC[-1],RC[-3]>=7,RC[-3]<8),70,IF(AND(RC[-3]<RC[-1],RC[-3]>=8,RC[-3]<9),65,IF(AND(RC[-3]<RC[-1],RC[-3]>=9,RC[-3]<10),60,IF(AND(RC[-3]<RC[-1],RC[-3]>=10,RC[-3]<11),55,IF(AND(RC[-3]<RC[-1],RC[-3]>=11,RC[-3]<12),50,IF(AND(RC[-3]<RC[-1],RC[-3]>=12,RC[-3]<13),45,IF(AND(RC[-3]<RC[-1],RC[-3]>=13,RC[-3]<14),40,IF(AND(RC[-3]<RC[-1],RC[-3]>=14,RC[-3]<15),35,IF(AND(RC[-3]<RC[-1],RC[-3]>=15,RC[-3]<16),30,IF(AND(RC[-3]<RC[-1],RC[-3]>=16,RC[-3]<17),25,IF(AND(RC[-3]<RC[-1],RC[-3]>=17,RC[-3]<18),20,IF(AND(RC[-3]<RC[-1],RC[-3]>=18,RC[-3]<19),15,IF(AND(RC[-3]<RC[-1],RC[-3]>=19,RC[-3]<20),10,IF(AND(RC[-3]<RC[-1],RC[-3]>=20,RC[-3]<21),5,IF(AND(RC[-3]<RC[-1],RC[-3]>=21),0,IF(AND(RC[-3]>RC[-1],RC[-3]>=2,RC[-3]<3),90,IF(AND(RC[-3]>RC[-1],RC[-3]>=3,RC[-3]<4),90,IF(AND(RC[-3]>RC[-1],RC[-3]>=4,RC[-3]<5),80,IF(AND(RC[-3]>RC[-1],RC[-3]>=5,RC[-3]<6),70,IF(AND(RC[-3]>RC[-1],RC[-3]>=6,RC[-3]<7),60,IF(AND(RC[-3]>RC[-1],RC[-3]>=7,RC[-3]<8),50,IF(AND(RC[-3]>RC[-1],RC[-3]>=8,RC[-3]<9),40,IF(AND(RC[-3]>RC[-1],RC[-3]>=9,RC[-3]<10),30,IF(AND(RC[-3]>RC[-1],RC[-3]>=10,RC[-3]<11),20,IF(AND(RC[-3]>RC[-1],RC[-3]>=11,RC[-3]<12),10,IF(AND(RC[-3]>RC[-1],RC[-3]>=12),0))))))))))))))))))))))))))))))))) -> 80 | H500: =IF(RC[-3]="","",IF(RC[-3]<0.3,100,IF(AND(RC[-3]>=0.3,RC[-3]>0.4),95,IF(AND(RC[-3]>=0.4,RC[-3]<0.5),90,IF(AND(RC[-3]>=0.5,RC[-3]<0.6),85,IF(AND(RC[-3]>=0.6,RC[-3]<0.7),80,IF(AND(RC[-3]>=0.6,RC[-3]<1),80,IF(AND(RC[-3]>1,RC[-3]<2),50,IF(RC[-3]>2,0))))))))) ->  | I500: =IF(RC[-1]="",RC[-2],0.7*RC[-1]+0.3*RC[-2]) -> 80
A501: لبنیات پاک | B501: غپاک | C501: =VLOOKUP(RC[-1],Sheet1!R3C2:R802C3,2,FALSE) -> غذایی بجز قند وشکر | D501: =VLOOKUP(RC[-2],Sheet1!R3C2:R802C9,8,FALSE) -> 72.776144550596371 | E501: =IF(VLOOKUP(RC[-3],Sheet1!R3C2:R803C11,10,FALSE)=0,"",VLOOKUP(Sheet2!RC[-3],Sheet1!R[1]C[-3]:R[801]C[6],10,FALSE)) ->  | F501: =Sheet1!R546C10 -> 18.927119434200804 | G501: =IF(RC[-3]<0,0,IF(AND(RC[-3]<RC[-1],RC[-3]<2),100,IF(AND(RC[-3]<RC[-1],RC[-3]>=2,RC[-3]<3),95,IF(AND(RC[-3]<RC[-1],RC[-3]>=3,RC[-3]<4),90,IF(AND(RC[-3]<RC[-1],RC[-3]>=4,RC[-3]<5),85,IF(AND(RC[-3]<RC[-1],RC[-3]>=5,RC[-3]<6),80,IF(AND(RC[-3]<RC[-1],RC[-3]>=6,RC[-3]<7),75,IF(AND(RC[-3]<RC[-1],RC[-3]>=7,RC[-3]<8),70,IF(AND(RC[-3]<RC[-1],RC[-3]>=8,RC[-3]<9),65,IF(AND(RC[-3]<RC[-1],RC[-3]>=9,RC[-3]<10),60,IF(AND(RC[-3]<RC[-1],RC[-3]>=10,RC[-3]<11),55,IF(AND(RC[-3]<RC[-1],RC[-3]>=11,RC[-3]<12),50,IF(AND(RC[-3]<RC[-1],RC[-3]>=12,RC[-3]<13),45,IF(AND(RC[-3]<RC[-1],RC[-3]>=13,RC[-3]<14),40,IF(AND(RC[-3]<RC[-1],RC[-3]>=14,RC[-3]<15),35,IF(AND(RC[-3]<RC[-1],RC[-3]>=15,RC[-3]<16),30,IF(AND(RC[-3]<RC[-1],RC[-3]>=16,RC[-3]<17),25,IF(AND(RC[-3]<RC[-1],RC[-3]>=17,RC[-3]<18),20,IF(AND(RC[-3]<RC[-1],RC[-3]>=18,RC[-3]<19),15,IF(AND(RC[-3]<RC[-1],RC[-3]>=19,RC[-3]<20),10,IF(AND(RC[-3]<RC[-1],RC[-3]>=20,RC[-3]<21),5,IF(AND(RC[-3]<RC[-1],RC[-3]>=21),0,IF(AND(RC[-3]>RC[-1],RC[-3]>=2,RC[-3]<3),90,IF(AND(RC[-3]>RC[-1],RC[-3]>=3,RC[-3]<4),90,IF(AND(RC[-3]>RC[-1],RC[-3]>=4,RC[-3]<5),80,IF(AND(RC[-3]>RC[-1],RC[-3]>=5,RC[-3]<6),70,IF(AND(RC[-3]>RC[-1],RC[-3]>=6,RC[-3]<7),60,IF(AND(RC[-3]>RC[-1],RC[-3]>=7,RC[-3]<8),50,IF(AND(RC[-3]>RC[-1],RC[-3]>=8,RC[-3]<9),40,IF(AND(RC[-3]>RC[-1],RC[-3]>=9,RC[-3]<10),30,IF(AND(RC[-3]>RC[-1],RC[-3]>=10,RC[-3]<11),20,IF(AND(RC[-3]>RC[-1],RC[-3]>=11,RC[-3]<12),10,IF(AND(RC[-3]>RC[-1],RC[-3]>=12),0))))))))))))))))))))))))))))))))) -> 0 | H501: =IF(RC[-3]="","",IF(RC[-3]<0.3,100,IF(AND(RC[-3]>=0.3,RC[-3]>0.4),95,IF(AND(RC[-3]>=0.4,RC[-3]<0.5),90,IF(AND(RC[-3]>=0.5,RC[-3]<0.6),85,IF(AND(RC[-3]>=0.6,RC[-3]<0.7),80,IF(AND(RC[-3]>=0.6,RC[-3]<1),80,IF(AND(RC[-3]>1,RC[-3]<2),50,IF(RC[-3]>2,0))))))))) ->  | I501: =IF(RC[-1]="",RC[-2],0.7*RC[-1]+0.3*RC[-2]) -> 0
A502: لبنیات کالبر | B502: غالبر | C502: =VLOOKUP(RC[-1],Sheet1!R3C2:R802C3,2,FALSE) -> غذایی بجز قند وشکر | D502: =VLOOKUP(RC[-2],Sheet1!R3C2:R802C9,8,FALSE) -> 31.839333832623687 | E502: =IF(VLOOKUP(RC[-3],Sheet1!R3C2:R803C11,10,FALSE)=0,"",VLOOKUP(Sheet2!RC[-3],Sheet1!R[1]C[-3]:R[801]C[6],10,FALSE)) ->  | F502: =Sheet1!R546C10 -> 18.927119434200804 | G502: =IF(RC[-3]<0,0,IF(AND(RC[-3]<RC[-1],RC[-3]<2),100,IF(AND(RC[-3]<RC[-1],RC[-3]>=2,RC[-3]<3),95,IF(AND(RC[-3]<RC[-1],RC[-3]>=3,RC[-3]<4),90,IF(AND(RC[-3]<RC[-1],RC[-3]>=4,RC[-3]<5),85,IF(AND(RC[-3]<RC[-1],RC[-3]>=5,RC[-3]<6),80,IF(AND(RC[-3]<RC[-1],RC[-3]>=6,RC[-3]<7),75,IF(AND(RC[-3]<RC[-1],RC[-3]>=7,RC[-3]<8),70,IF(AND(RC[-3]<RC[-1],RC[-3]>=8,RC[-3]<9),65,IF(AND(RC[-3]<RC[-1],RC[-3]>=9,RC[-3]<10),60,IF(AND(RC[-3]<RC[-1],RC[-3]>=10,RC[-3]<11),55,IF(AND(RC[-3]<RC[-1],RC[-3]>=11,RC[-3]<12),50,IF(AND(RC[-3]<RC[-1],RC[-3]>=12,RC[-3]<13),45,IF(AND(RC[-3]<RC[-1],RC[-3]>=13,RC[-3]<14),40,IF(AND(RC[-3]<RC[-1],RC[-3]>=14,RC[-3]<15),35,IF(AND(RC[-3]<RC[-1],RC[-3]>=15,RC[-3]<16),30,IF(AND(RC[-3]<RC[-1],RC[-3]>=16,RC[-3]<17),25,IF(AND(RC[-3]<RC[-1],RC[-3]>=17,RC[-3]<18),20,IF(AND(RC[-3]<RC[-1],RC[-3]>=18,RC[-3]<19),15,IF(AND(RC[-3]<RC[-1],RC[-3]>=19,RC[-3]<20),10,IF(AND(RC[-3]<RC[-1],RC[-3]>=20,RC[-3]<21),5,IF(AND(RC[-3]<RC[-1],RC[-3]>=21),0,IF(AND(RC[-3]>RC[-1],RC[-3]>=2,RC[-3]<3),90,IF(AND(RC[-3]>RC[-1],RC[-3]>=3,RC[-3]<4),90,IF(AND(RC[-3]>RC[-1],RC[-3]>=4,RC[-3]<5),80,IF(AND(RC[-3]>RC[-1],RC[-3]>=5,RC[-3]<6),70,IF(AND(RC[-3]>RC[-1],RC[-3]>=6,RC[-3]<7),60,IF(AND(RC[-3]>RC[-1],RC[-3]>=7,RC[-3]<8),50,IF(AND(RC[-3]>RC[-1],RC[-3]>=8,RC[-3]<9),40,IF(AND(RC[-3]>RC[-1],RC[-3]>=9,RC[-3]<10),30,IF(AND(RC[-3]>RC[-1],RC[-3]>=10,RC[-3]<11),20,IF(AND(RC[-3]>RC[-1],RC[-3]>=11,RC[-3]<12),10,IF(AND(RC[-3]>RC[-1],RC[-3]>=12),0))))))))))))))))))))))))))))))))) -> 0 | H502: =IF(RC[-3]="","",IF(RC[-3]<0.3,100,IF(AND(RC[-3]>=0.3,RC[-3]>0.4),95,IF(AND(RC[-3]>=0.4,RC[-3]<0.5),90,IF(AND(RC[-3]>=0.5,RC[-3]<0.6),85,IF(AND(RC[-3]>=0.6,RC[-3]<0.7),80,IF(AND(RC[-3]>=0.6,RC[-3]<1),80,IF(AND(RC[-3]>1,RC[-3]<2),50,IF(RC[-3]>2,0))))))))) ->  | I502: =IF(RC[-1]="",RC[-2],0.7*RC[-1]+0.3*RC[-2]) -> 0
A503: مارگارین | B503: غمارگ | C503: =VLOOKUP(RC[-1],Sheet1!R3C2:R802C3,2,FALSE) -> غذایی بجز قند وشکر | D503: =VLOOKUP(RC[-2],Sheet1!R3C2:R802C9,8,FALSE) -> 1.7644176136363636 | E503: =IF(VLOOKUP(RC[-3],Sheet1!R3C2:R803C11,10,FALSE)=0,"",VLOOKUP(Sheet2!RC[-3],Sheet1!R[1]C[-3]:R[801]C[6],10,FALSE)) ->  | F503: =Sheet1!R546C10 -> 18.927119434200804 | G503: =IF(RC[-3]<0,0,IF(AND(RC[-3]<RC[-1],RC[-3]<2),100,IF(AND(RC[-3]<RC[-1],RC[-3]>=2,RC[-3]<3),95,IF(AND(RC[-3]<RC[-1],RC[-3]>=3,RC[-3]<4),90,IF(AND(RC[-3]<RC[-1],RC[-3]>=4,RC[-3]<5),85,IF(AND(RC[-3]<RC[-1],RC[-3]>=5,RC[-3]<6),80,IF(AND(RC[-3]<RC[-1],RC[-3]>=6,RC[-3]<7),75,IF(AND(RC[-3]<RC[-1],RC[-3]>=7,RC[-3]<8),70,IF(AND(RC[-3]<RC[-1],RC[-3]>=8,RC[-3]<9),65,IF(AND(RC[-3]<RC[-1],RC[-3]>=9,RC[-3]<10),60,IF(AND(RC[-3]<RC[-1],RC[-3]>=10,RC[-3]<11),55,IF(AND(RC[-3]<RC[-1],RC[-3]>=11,RC[-3]<12),50,IF(AND(RC[-3]<RC[-1],RC[-3]>=12,RC[-3]<13),45,IF(AND(RC[-3]<RC[-1],RC[-3]>=13,RC[-3]<14),40,IF(AND(RC[-3]<RC[-1],RC[-3]>=14,RC[-3]<15),35,IF(AND(RC[-3]<RC[-1],RC[-3]>=15,RC[-3]<16),30,IF(AND(RC[-3]<RC[-1],RC[-3]>=16,RC[-3]<17),25,IF(AND(RC[-3]<RC[-1],RC[-3]>=17,RC[-3]<18),20,IF(AND(RC[-3]<RC[-1],RC[-3]>=18,RC[-3]<19),15,IF(AND(RC[-3]<RC[-1],RC[-3]>=19,RC[-3]<20),10,IF(AND(RC[-3]<RC[-1],RC[-3]>=20,RC[-3]<21),5,IF(AND(RC[-3]<RC[-1],RC[-3]>=21),0,IF(AND(RC[-3]>RC[-1],RC[-3]>=2,RC[-3]<3),90,IF(AND(RC[-3]>RC[-1],RC[-3]>=3,RC[-3]<4),90,IF(AND(RC[-3]>RC[-1],RC[-3]>=4,RC[-3]<5),80,IF(AND(RC[-3]>RC[-1],RC[-3]>=5,RC[-3]<6),70,IF(AND(RC[-3]>RC[-1],RC[-3]>=6,RC[-3]<7),60,IF(AND(RC[-3]>RC[-1],RC[-3]>=7,RC[-3]<8),50,IF(AND(RC[-3]>RC[-1],RC[-3]>=8,RC[-3]<9),40,IF(AND(RC[-3]>RC[-1],RC[-3]>=9,RC[-3]<10),30,IF(AND(RC[-3]>RC[-1],RC[-3]>=10,RC[-3]<11),20,IF(AND(RC[-3]>RC[-1],RC[-3]>=11,RC[-3]<12),10,IF(AND(RC[-3]>RC[-1],RC[-3]>=12),0))))))))))))))))))))))))))))))))) -> 100 | H503: =IF(RC[-3]="","",IF(RC[-3]<0.3,100,IF(AND(RC[-3]>=0.3,RC[-3]>0.4),95,IF(AND(RC[-3]>=0.4,RC[-3]<0.5),90,IF(AND(RC[-3]>=0.5,RC[-3]<0.6),85,IF(AND(RC[-3]>=0.6,RC[-3]<0.7),80,IF(AND(RC[-3]>=0.6,RC[-3]<1),80,IF(AND(RC[-3]>1,RC[-3]<2),50,IF(RC[-3]>2,0))))))))) ->  | I503: =IF(RC[-1]="",RC[-2],0.7*RC[-1]+0.3*RC[-2]) -> 100
A504: مجتمع تولیدی نیلی صنعت کرمان | B504: غنیلی | C504: =VLOOKUP(RC[-1],Sheet1!R3C2:R802C3,2,FALSE) -> غذایی بجز قند وشکر | D504: =VLOOKUP(RC[-2],Sheet1!R3C2:R802C9,8,FALSE) -> 197.03148464446778 | E504: =IF(VLOOKUP(RC[-3],Sheet1!R3C2:R803C11,10,FALSE)=0,"",VLOOKUP(Sheet2!RC[-3],Sheet1!R[1]C[-3]:R[801]C[6],10,FALSE)) ->  | F504: =Sheet1!R546C10 -> 18.927119434200804 | G504: =IF(RC[-3]<0,0,IF(AND(RC[-3]<RC[-1],RC[-3]<2),100,IF(AND(RC[-3]<RC[-1],RC[-3]>=2,RC[-3]<3),95,IF(AND(RC[-3]<RC[-1],RC[-3]>=3,RC[-3]<4),90,IF(AND(RC[-3]<RC[-1],RC[-3]>=4,RC[-3]<5),85,IF(AND(RC[-3]<RC[-1],RC[-3]>=5,RC[-3]<6),80,IF(AND(RC[-3]<RC[-1],RC[-3]>=6,RC[-3]<7),75,IF(AND(RC[-3]<RC[-1],RC[-3]>=7,RC[-3]<8),70,IF(AND(RC[-3]<RC[-1],RC[-3]>=8,RC[-3]<9),65,IF(AND(RC[-3]<RC[-1],RC[-3]>=9,RC[-3]<10),60,IF(AND(RC[-3]<RC[-1],RC[-3]>=10,RC[-3]<11),55,IF(AND(RC[-3]<RC[-1],RC[-3]>=11,RC[-3]<12),50,IF(AND(RC[-3]<RC[-1],RC[-3]>=12,RC[-3]<13),45,IF(AND(RC[-3]<RC[-1],RC[-3]>=13,RC[-3]<14),40,IF(AND(RC[-3]<RC[-1],RC[-3]>=14,RC[-3]<15),35,IF(AND(RC[-3]<RC[-1],RC[-3]>=15,RC[-3]<16),30,IF(AND(RC[-3]<RC[-1],RC[-3]>=16,RC[-3]<17),25,IF(AND(RC[-3]<RC[-1],RC[-3]>=17,RC[-3]<18),20,IF(AND(RC[-3]<RC[-1],RC[-3]>=18,RC[-3]<19),15,IF(AND(RC[-3]<RC[-1],RC[-3]>=19,RC[-3]<20),10,IF(AND(RC[-3]<RC[-1],RC[-3]>=20,RC[-3]<21),5,IF(AND(RC[-3]<RC[-1],RC[-3]>=21),0,IF(AND(RC[-3]>RC[-1],RC[-3]>=2,RC[-3]<3),90,IF(AND(RC[-3]>RC[-1],RC[-3]>=3,RC[-3]<4),90,IF(AND(RC[-3]>RC[-1],RC[-3]>=4,RC[-3]<5),80,IF(AND(RC[-3]>RC[-1],RC[-3]>=5,RC[-3]<6),70,IF(AND(RC[-3]>RC[-1],RC[-3]>=6,RC[-3]<7),60,IF(AND(RC[-3]>RC[-1],RC[-3]>=7,RC[-3]<8),50,IF(AND(RC[-3]>RC[-1],RC[-3]>=8,RC[-3]<9),40,IF(AND(RC[-3]>RC[-1],RC[-3]>=9,RC[-3]<10),30,IF(AND(RC[-3]>RC[-1],RC[-3]>=10,RC[-3]<11),20,IF(AND(RC[-3]>RC[-1],RC[-3]>=11,RC[-3]<12),10,IF(AND(RC[-3]>RC[-1],RC[-3]>=12),0))))))))))))))))))))))))))))))))) -> 0 | H504: =IF(RC[-3]="","",IF(RC[-3]<0.3,100,IF(AND(RC[-3]>=0.3,RC[-3]>0.4),95,IF(AND(RC[-3]>=0.4,RC[-3]<0.5),90,IF(AND(RC[-3]>=0.5,RC[-3]<0.6),85,IF(AND(RC[-3]>=0.6,RC[-3]<0.7),80,IF(AND(RC[-3]>=0.6,RC[-3]<1),80,IF(AND(RC[-3]>1,RC[-3]<2),50,IF(RC[-3]>2,0))))))))) ->  | I504: =IF(RC[-1]="",RC[-2],0.7*RC[-1]+0.3*RC[-2]) -> 0
A505: مهرام | B505: غمهرا | C505: =VLOOKUP(RC[-1],Sheet1!R3C2:R802C3,2,FALSE) -> غذایی بجز قند وشکر | D505: =VLOOKUP(RC[-2],Sheet1!R3C2:R802C9,8,FALSE) -> 5.7567707232801482 | E505: =IF(VLOOKUP(RC[-3],Sheet1!R3C2:R803C11,10,FALSE)=0,"",VLOOKUP(Sheet2!RC[-3],Sheet1!R[1]C[-3]:R[801]C[6],10,FALSE)) ->  | F505: =Sheet1!R546C10 -> 18.927119434200804 | G505: =IF(RC[-3]<0,0,IF(AND(RC[-3]<RC[-1],RC[-3]<2),100,IF(AND(RC[-3]<RC[-1],RC[-3]>=2,RC[-3]<3),95,IF(AND(RC[-3]<RC[-1],RC[-3]>=3,RC[-3]<4),90,IF(AND(RC[-3]<RC[-1],RC[-3]>=4,RC[-3]<5),85,IF(AND(RC[-3]<RC[-1],RC[-3]>=5,RC[-3]<6),80,IF(AND(RC[-3]<RC[-1],RC[-3]>=6,RC[-3]<7),75,IF(AND(RC[-3]<RC[-1],RC[-3]>=7,RC[-3]<8),70,IF(AND(RC[-3]<RC[-1],RC[-3]>=8,RC[-3]<9),65,IF(AND(RC[-3]<RC[-1],RC[-3]>=9,RC[-3]<10),60,IF(AND(RC[-3]<RC[-1],RC[-3]>=10,RC[-3]<11),55,IF(AND(RC[-3]<RC[-1],RC[-3]>=11,RC[-3]<12),50,IF(AND(RC[-3]<RC[-1],RC[-3]>=12,RC[-3]<13),45,IF(AND(RC[-3]<RC[-1],RC[-3]>=13,RC[-3]<14),40,IF(AND(RC[-3]<RC[-1],RC[-3]>=14,RC[-3]<15),35,IF(AND(RC[-3]<RC[-1],RC[-3]>=15,RC[-3]<16),30,IF(AND(RC[-3]<RC[-1],RC[-3]>=16,RC[-3]<17),25,IF(AND(RC[-3]<RC[-1],RC[-3]>=17,RC[-3]<18),20,IF(AND(RC[-3]<RC[-1],RC[-3]>=18,RC[-3]<19),15,IF(AND(RC[-3]<RC[-1],RC[-3]>=19,RC[-3]<20),10,IF(AND(RC[-3]<RC[-1],RC[-3]>=20,RC[-3]<21),5,IF(AND(RC[-3]<RC[-1],RC[-3]>=21),0,IF(AND(RC[-3]>RC[-1],RC[-3]>=2,RC[-3]<3),90,IF(AND(RC[-3]>RC[-1],RC[-3]>=3,RC[-3]<4),90,IF(AND(RC[-3]>RC[-1],RC[-3]>=4,RC[-3]<5),80,IF(AND(RC[-3]>RC[-1],RC[-3]>=5,RC[-3]<6),70,IF(AND(RC[-3]>RC[-1],RC[-3]>=6,RC[-3]<7),60,IF(AND(RC[-3]>RC[-1],RC[-3]>=7,RC[-3]<8),50,IF(AND(RC[-3]>RC[-1],RC[-3]>=8,RC[-3]<9),40,IF(AND(RC[-3]>RC[-1],RC[-3]>=9,RC[-3]<10),30,IF(AND(RC[-3]>RC[-1],RC[-3]>=10,RC[-3]<11),20,IF(AND(RC[-3]>RC[-1],RC[-3]>=11,RC[-3]<12),10,IF(AND(RC[-3]>RC[-1],RC[-3]>=12),0))))))))))))))))))))))))))))))))) -> 80 | H505: =IF(RC[-3]="","",IF(RC[-3]<0.3,100,IF(AND(RC[-3]>=0.3,RC[-3]>0.4),95,IF(AND(RC[-3]>=0.4,RC[-3]<0.5),90,IF(AND(RC[-3]>=0.5,RC[-3]<0.6),85,IF(AND(RC[-3]>=0.6,RC[-3]<0.7),80,IF(AND(RC[-3]>=0.6,RC[-3]<1),80,IF(AND(RC[-3]>1,RC[-3]<2),50,IF(RC[-3]>2,0))))))))) ->  | I505: =IF(RC[-1]="",RC[-2],0.7*RC[-1]+0.3*RC[-2]) -> 80
A506: ناب | B506: غناب | C506: =VLOOKUP(RC[-1],Sheet1!R3C2:R802C3,2,FALSE) -> غذایی بجز قند وشکر | D506: =VLOOKUP(RC[-2],Sheet1!R3C2:R802C9,8,FALSE) -> 308.38644491703644 | E506: =IF(VLOOKUP(RC[-3],Sheet1!R3C2:R803C11,10,FALSE)=0,"",VLOOKUP(Sheet2!RC[-3],Sheet1!R[1]C[-3]:R[801]C[6],10,FALSE)) ->  | F506: =Sheet1!R546C10 -> 18.927119434200804 | G506: =IF(RC[-3]<0,0,IF(AND(RC[-3]<RC[-1],RC[-3]<2),100,IF(AND(RC[-3]<RC[-1],RC[-3]>=2,RC[-3]<3),95,IF(AND(RC[-3]<RC[-1],RC[-3]>=3,RC[-3]<4),90,IF(AND(RC[-3]<RC[-1],RC[-3]>=4,RC[-3]<5),85,IF(AND(RC[-3]<RC[-1],RC[-3]>=5,RC[-3]<6),80,IF(AND(RC[-3]<RC[-1],RC[-3]>=6,RC[-3]<7),75,IF(AND(RC[-3]<RC[-1],RC[-3]>=7,RC[-3]<8),70,IF(AND(RC[-3]<RC[-1],RC[-3]>=8,RC[-3]<9),65,IF(AND(RC[-3]<RC[-1],RC[-3]>=9,RC[-3]<10),60,IF(AND(RC[-3]<RC[-1],RC[-3]>=10,RC[-3]<11),55,IF(AND(RC[-3]<RC[-1],RC[-3]>=11,RC[-3]<12),50,IF(AND(RC[-3]<RC[-1],RC[-3]>=12,RC[-3]<13),45,IF(AND(RC[-3]<RC[-1],RC[-3]>=13,RC[-3]<14),40,IF(AND(RC[-3]<RC[-1],RC[-3]>=14,RC[-3]<15),35,IF(AND(RC[-3]<RC[-1],RC[-3]>=15,RC[-3]<16),30,IF(AND(RC[-3]<RC[-1],RC[-3]>=16,RC[-3]<17),25,IF(AND(RC[-3]<RC[-1],RC[-3]>=17,RC[-3]<18),20,IF(AND(RC[-3]<RC[-1],RC[-3]>=18,RC[-3]<19),15,IF(AND(RC[-3]<RC[-1],RC[-3]>=19,RC[-3]<20),10,IF(AND(RC[-3]<RC[-1],RC[-3]>=20,RC[-3]<21),5,IF(AND(RC[-3]<RC[-1],RC[-3]>=21),0,IF(AND(RC[-3]>RC[-1],RC[-3]>=2,RC[-3]<3),90,IF(AND(RC[-3]>RC[-1],RC[-3]>=3,RC[-3]<4),90,IF(AND(RC[-3]>RC[-1],RC[-3]>=4,RC[-3]<5),80,IF(AND(RC[-3]>RC[-1],RC[-3]>=5,RC[-3]<6),70,IF(AND(RC[-3]>RC[-1],RC[-3]>=6,RC[-3]<7),60,IF(AND(RC[-3]>RC[-1],RC[-3]>=7,RC[-3]<8),50,IF(AND(RC[-3]>RC[-1],RC[-3]>=8,RC[-3]<9),40,IF(AND(RC[-3]>RC[-1],RC[-3]>=9,RC[-3]<10),30,IF(AND(RC[-3]>RC[-1],RC[-3]>=10,RC[-3]<11),20,IF(AND(RC[-3]>RC[-1],RC[-3]>=11,RC[-3]<12),10,IF(AND(RC[-3]>RC[-1],RC[-3]>=12),0))))))))))))))))))))))))))))))))) -> 0 | H506: =IF(RC[-3]="","",IF(RC[-3]<0.3,100,IF(AND(RC[-3]>=0.3,RC[-3]>0.4),95,IF(AND(RC[-3]>=0.4,RC[-3]<0.5),90,IF(AND(RC[-3]>=0.5,RC[-3]<0.6),85,IF(AND(RC[-3]>=0.6,RC[-3]<0.7),80,IF(AND(RC[-3]>=0.6,RC[-3]<1),80,IF(AND(RC[-3]>1,RC[-3]<2),50,IF(RC[-3]>2,0))))))))) ->  | I506: =IF(RC[-1]="",RC[-2],0.7*RC[-1]+0.3*RC[-2]) -> 0
A507: نوش پونه مشهد | B507: غپونه | C507: =VLOOKUP(RC[-1],Sheet1!R3C2:R802C3,2,FALSE) -> غذایی بجز قند وشکر | D507: =VLOOKUP(RC[-2],Sheet1!R3C2:R802C9,8,FALSE) -> 11.917306654188797 | E507: =IF(VLOOKUP(RC[-3],Sheet1!R3C2:R803C11,10,FALSE)=0,"",VLOOKUP(Sheet2!RC[-3],Sheet1!R[1]C[-3]:R[801]C[6],10,FALSE)) ->  | F507: =Sheet1!R546C10 -> 18.927119434200804 | G507: =IF(RC[-3]<0,0,IF(AND(RC[-3]<RC[-1],RC[-3]<2),100,IF(AND(RC[-3]<RC[-1],RC[-3]>=2,RC[-3]<3),95,IF(AND(RC[-3]<RC[-1],RC[-3]>=3,RC[-3]<4),90,IF(AND(RC[-3]<RC[-1],RC[-3]>=4,RC[-3]<5),85,IF(AND(RC[-3]<RC[-1],RC[-3]>=5,RC[-3]<6),80,IF(AND(RC[-3]<RC[-1],RC[-3]>=6,RC[-3]<7),75,IF(AND(RC[-3]<RC[-1],RC[-3]>=7,RC[-3]<8),70,IF(AND(RC[-3]<RC[-1],RC[-3]>=8,RC[-3]<9),65,IF(AND(RC[-3]<RC[-1],RC[-3]>=9,RC[-3]<10),60,IF(AND(RC[-3]<RC[-1],RC[-3]>=10,RC[-3]<11),55,IF(AND(RC[-3]<RC[-1],RC[-3]>=11,RC[-3]<12),50,IF(AND(RC[-3]<RC[-1],RC[-3]>=12,RC[-3]<13),45,IF(AND(RC[-3]<RC[-1],RC[-3]>=13,RC[-3]<14),40,IF(AND(RC[-3]<RC[-1],RC[-3]>=14,RC[-3]<15),35,IF(AND(RC[-3]<RC[-1],RC[-3]>=15,RC[-3]<16),30,IF(AND(RC[-3]<RC[-1],RC[-3]>=16,RC[-3]<17),25,IF(AND(RC[-3]<RC[-1],RC[-3]>=17,RC[-3]<18),20,IF(AND(RC[-3]<RC[-1],RC[-3]>=18,RC[-3]<19),15,IF(AND(RC[-3]<RC[-1],RC[-3]>=19,RC[-3]<20),10,IF(AND(RC[-3]<RC[-1],RC[-3]>=20,RC[-3]<21),5,IF(AND(RC[-3]<RC[-1],RC[-3]>=21),0,IF(AND(RC[-3]>RC[-1],RC[-3]>=2,RC[-3]<3),90,IF(AND(RC[-3]>RC[-1],RC[-3]>=3,RC[-3]<4),90,IF(AND(RC[-3]>RC[-1],RC[-3]>=4,RC[-3]<5),80,IF(AND(RC[-3]>RC[-1],RC[-3]>=5,RC[-3]<6),70,IF(AND(RC[-3]>RC[-1],RC[-3]>=6,RC[-3]<7),60,IF(AND(RC[-3]>RC[-1],RC[-3]>=7,RC[-3]<8),50,IF(AND(RC[-3]>RC[-1],RC[-3]>=8,RC[-3]<9),40,IF(AND(RC[-3]>RC[-1],RC[-3]>=9,RC[-3]<10),30,IF(AND(RC[-3]>RC[-1],RC[-3]>=10,RC[-3]<11),20,IF(AND(RC[-3]>RC[-1],RC[-3]>=11,RC[-3]<12),10,IF(AND(RC[-3]>RC[-1],RC[-3]>=12),0))))))))))))))))))))))))))))))))) -> 50 | H507: =IF(RC[-3]="","",IF(RC[-3]<0.3,100,IF(AND(RC[-3]>=0.3,RC[-3]>0.4),95,IF(AND(RC[-3]>=0.4,RC[-3]<0.5),90,IF(AND(RC[-3]>=0.5,RC[-3]<0.6),85,IF(AND(RC[-3]>=0.6,RC[-3]<0.7),80,IF(AND(RC[-3]>=0.6,RC[-3]<1),80,IF(AND(RC[-3]>1,RC[-3]<2),50,IF(RC[-3]>2,0))))))))) ->  | I507: =IF(RC[-1]="",RC[-2],0.7*RC[-1]+0.3*RC[-2]) -> 50
A508: نوش مازندران | B508: غنوش | C508: =VLOOKUP(RC[-1],Sheet1!R3C2:R802C3,2,FALSE) -> غذایی بجز قند وشکر | D508: =VLOOKUP(RC[-2],Sheet1!R3C2:R802C9,8,FALSE) -> 232.99871416440752 | E508: =IF(VLOOKUP(RC[-3],Sheet1!R3C2:R803C11,10,FALSE)=0,"",VLOOKUP(Sheet2!RC[-3],Sheet1!R[1]C[-3]:R[801]C[6],10,FALSE)) ->  | F508: =Sheet1!R546C10 -> 18.927119434200804 | G508: =IF(RC[-3]<0,0,IF(AND(RC[-3]<RC[-1],RC[-3]<2),100,IF(AND(RC[-3]<RC[-1],RC[-3]>=2,RC[-3]<3),95,IF(AND(RC[-3]<RC[-1],RC[-3]>=3,RC[-3]<4),90,IF(AND(RC[-3]<RC[-1],RC[-3]>=4,RC[-3]<5),85,IF(AND(RC[-3]<RC[-1],RC[-3]>=5,RC[-3]<6),80,IF(AND(RC[-3]<RC[-1],RC[-3]>=6,RC[-3]<7),75,IF(AND(RC[-3]<RC[-1],RC[-3]>=7,RC[-3]<8),70,IF(AND(RC[-3]<RC[-1],RC[-3]>=8,RC[-3]<9),65,IF(AND(RC[-3]<RC[-1],RC[-3]>=9,RC[-3]<10),60,IF(AND(RC[-3]<RC[-1],RC[-3]>=10,RC[-3]<11),55,IF(AND(RC[-3]<RC[-1],RC[-3]>=11,RC[-3]<12),50,IF(AND(RC[-3]<RC[-1],RC[-3]>=12,RC[-3]<13),45,IF(AND(RC[-3]<RC[-1],RC[-3]>=13,RC[-3]<14),40,IF(AND(RC[-3]<RC[-1],RC[-3]>=14,RC[-3]<15),35,IF(AND(RC[-3]<RC[-1],RC[-3]>=15,RC[-3]<16),30,IF(AND(RC[-3]<RC[-1],RC[-3]>=16,RC[-3]<17),25,IF(AND(RC[-3]<RC[-1],RC[-3]>=17,RC[-3]<18),20,IF(AND(RC[-3]<RC[-1],RC[-3]>=18,RC[-3]<19),15,IF(AND(RC[-3]<RC[-1],RC[-3]>=19,RC[-3]<20),10,IF(AND(RC[-3]<RC[-1],RC[-3]>=20,RC[-3]<21),5,IF(AND(RC[-3]<RC[-1],RC[-3]>=21),0,IF(AND(RC[-3]>RC[-1],RC[-3]>=2,RC[-3]<3),90,IF(AND(RC[-3]>RC[-1],RC[-3]>=3,RC[-3]<4),90,IF(AND(RC[-3]>RC[-1],RC[-3]>=4,RC[-3]<5),80,IF(AND(RC[-3]>RC[-1],RC[-3]>=5,RC[-3]<6),70,IF(AND(RC[-3]>RC[-1],RC[-3]>=6,RC[-3]<7),60,IF(AND(RC[-3]>RC[-1],RC[-3]>=7,RC[-3]<8),50,IF(AND(RC[-3]>RC[-1],RC[-3]>=8,RC[-3]<9),40,IF(AND(RC[-3]>RC[-1],RC[-3]>=9,RC[-3]<10),30,IF(AND(RC[-3]>RC[-1],RC[-3]>=10,RC[-3]<11),20,IF(AND(RC[-3]>RC[-1],RC[-3]>=11,RC[-3]<12),10,IF(AND(RC[-3]>RC[-1],RC[-3]>=12),0))))))))))))))))))))))))))))))))) -> 0 | H508: =IF(RC[-3]="","",IF(RC[-3]<0.3,100,IF(AND(RC[-3]>=0.3,RC[-3]>0.4),95,IF(AND(RC[-3]>=0.4,RC[-3]<0.5),90,IF(AND(RC[-3]>=0.5,RC[-3]<0.6),85,IF(AND(RC[-3]>=0.6,RC[-3]<0.7),80,IF(AND(RC[-3]>=0.6,RC[-3]<1),80,IF(AND(RC[-3]>1,RC[-3]<2),50,IF(RC[-3]>2,0))))))))) ->  | I508: =IF(RC[-1]="",RC[-2],0.7*RC[-1]+0.3*RC[-2]) -> 0
A509: ویتانا | B509: غویتا | C509: =VLOOKUP(RC[-1],Sheet1!R3C2:R802C3,2,FALSE) -> غذایی بجز قند وشکر | D509: =VLOOKUP(RC[-2],Sheet1!R3C2:R802C9,8,FALSE) -> 6.568014210160265 | E509: =IF(VLOOKUP(RC[-3],Sheet1!R3C2:R803C11,10,FALSE)=0,"",VLOOKUP(Sheet2!RC[-3],Sheet1!R[1]C[-3]:R[801]C[6],10,FALSE)) ->  | F509: =Sheet1!R546C10 -> 18.927119434200804 | G509: =IF(RC[-3]<0,0,IF(AND(RC[-3]<RC[-1],RC[-3]<2),100,IF(AND(RC[-3]<RC[-1],RC[-3]>=2,RC[-3]<3),95,IF(AND(RC[-3]<RC[-1],RC[-3]>=3,RC[-3]<4),90,IF(AND(RC[-3]<RC[-1],RC[-3]>=4,RC[-3]<5),85,IF(AND(RC[-3]<RC[-1],RC[-3]>=5,RC[-3]<6),80,IF(AND(RC[-3]<RC[-1],RC[-3]>=6,RC[-3]<7),75,IF(AND(RC[-3]<RC[-1],RC[-3]>=7,RC[-3]<8),70,IF(AND(RC[-3]<RC[-1],RC[-3]>=8,RC[-3]<9),65,IF(AND(RC[-3]<RC[-1],RC[-3]>=9,RC[-3]<10),60,IF(AND(RC[-3]<RC[-1],RC[-3]>=10,RC[-3]<11),55,IF(AND(RC[-3]<RC[-1],RC[-3]>=11,RC[-3]<12),50,IF(AND(RC[-3]<RC[-1],RC[-3]>=12,RC[-3]<13),45,IF(AND(RC[-3]<RC[-1],RC[-3]>=13,RC[-3]<14),40,IF(AND(RC[-3]<RC[-1],RC[-3]>=14,RC[-3]<15),35,IF(AND(RC[-3]<RC[-1],RC[-3]>=15,RC[-3]<16),30,IF(AND(RC[-3]<RC[-1],RC[-3]>=16,RC[-3]<17),25,IF(AND(RC[-3]<RC[-1],RC[-3]>=17,RC[-3]<18),20,IF(AND(RC[-3]<RC[-1],RC[-3]>=18,RC[-3]<19),15,IF(AND(RC[-3]<RC[-1],RC[-3]>=19,RC[-3]<20),10,IF(AND(RC[-3]<RC[-1],RC[-3]>=20,RC[-3]<21),5,IF(AND(RC[-3]<RC[-1],RC[-3]>=21),0,IF(AND(RC[-3]>RC[-1],RC[-3]>=2,RC[-3]<3),90,IF(AND(RC[-3]>RC[-1],RC[-3]>=3,RC[-3]<4),90,IF(AND(RC[-3]>RC[-1],RC[-3]>=4,RC[-3]<5),80,IF(AND(RC[-3]>RC[-1],RC[-3]>=5,RC[-3]<6),70,IF(AND(RC[-3]>RC[-1],RC[-3]>=6,RC[-3]<7),60,IF(AND(RC[-3]>RC[-1],RC[-3]>=7,RC[-3]<8),50,IF(AND(RC[-3]>RC[-1],RC[-3]>=8,RC[-3]<9),40,IF(AND(RC[-3]>RC[-1],RC[-3]>=9,RC[-3]<10),30,IF(AND(RC[-3]>RC[-1],RC[-3]>=10,RC[-3]<11),20,IF(AND(RC[-3]>RC[-1],RC[-3]>=11,RC[-3]<12),10,IF(AND(RC[-3]>RC[-1],RC[-3]>=12),0))))))))))))))))))))))))))))))))) -> 75 | H509: =IF(RC[-3]="","",IF(RC[-3]<0.3,100,IF(AND(RC[-3]>=0.3,RC[-3]>0.4),95,IF(AND(RC[-3]>=0.4,RC[-3]<0.5),90,IF(AND(RC[-3]>=0.5,RC[-3]<0.6),85,IF(AND(RC[-3]>=0.6,RC[-3]<0.7),80,IF(AND(RC[-3]>=0.6,RC[-3]<1),80,IF(AND(RC[-3]>1,RC[-3]<2),50,IF(RC[-3]>2,0))))))))) ->  | I509: =IF(RC[-1]="",RC[-2],0.7*RC[-1]+0.3*RC[-2]) -> 75
A510: کشت و صنعت بهاران گل بهار خراسان | B510: غبهار | C510: =VLOOKUP(RC[-1],Sheet1!R3C2:R802C3,2,FALSE) -> غذایی بجز قند وشکر | D510: =VLOOKUP(RC[-2],Sheet1!R3C2:R802C9,8,FALSE) -> 12.330961061252486 | E510: =IF(VLOOKUP(RC[-3],Sheet1!R3C2:R803C11,10,FALSE)=0,"",VLOOKUP(Sheet2!RC[-3],Sheet1!R[1]C[-3]:R[801]C[6],10,FALSE)) ->  | F510: =Sheet1!R546C10 -> 18.927119434200804 | G510: =IF(RC[-3]<0,0,IF(AND(RC[-3]<RC[-1],RC[-3]<2),100,IF(AND(RC[-3]<RC[-1],RC[-3]>=2,RC[-3]<3),95,IF(AND(RC[-3]<RC[-1],RC[-3]>=3,RC[-3]<4),90,IF(AND(RC[-3]<RC[-1],RC[-3]>=4,RC[-3]<5),85,IF(AND(RC[-3]<RC[-1],RC[-3]>=5,RC[-3]<6),80,IF(AND(RC[-3]<RC[-1],RC[-3]>=6,RC[-3]<7),75,IF(AND(RC[-3]<RC[-1],RC[-3]>=7,RC[-3]<8),70,IF(AND(RC[-3]<RC[-1],RC[-3]>=8,RC[-3]<9),65,IF(AND(RC[-3]<RC[-1],RC[-3]>=9,RC[-3]<10),60,IF(AND(RC[-3]<RC[-1],RC[-3]>=10,RC[-3]<11),55,IF(AND(RC[-3]<RC[-1],RC[-3]>=11,RC[-3]<12),50,IF(AND(RC[-3]<RC[-1],RC[-3]>=12,RC[-3]<13),45,IF(AND(RC[-3]<RC[-1],RC[-3]>=13,RC[-3]<14),40,IF(AND(RC[-3]<RC[-1],RC[-3]>=14,RC[-3]<15),35,IF(AND(RC[-3]<RC[-1],RC[-3]>=15,RC[-3]<16),30,IF(AND(RC[-3]<RC[-1],RC[-3]>=16,RC[-3]<17),25,IF(AND(RC[-3]<RC[-1],RC[-3]>=17,RC[-3]<18),20,IF(AND(RC[-3]<RC[-1],RC[-3]>=18,RC[-3]<19),15,IF(AND(RC[-3]<RC[-1],RC[-3]>=19,RC[-3]<20),10,IF(AND(RC[-3]<RC[-1],RC[-3]>=20,RC[-3]<21),5,IF(AND(RC[-3]<RC[-1],RC[-3]>=21),0,IF(AND(RC[-3]>RC[-1],RC[-3]>=2,RC[-3]<3),90,IF(AND(RC[-3]>RC[-1],RC[-3]>=3,RC[-3]<4),90,IF(AND(RC[-3]>RC[-1],RC[-3]>=4,RC[-3]<5),80,IF(AND(RC[-3]>RC[-1],RC[-3]>=5,RC[-3]<6),70,IF(AND(RC[-3]>RC[-1],RC[-3]>=6,RC[-3]<7),60,IF(AND(RC[-3]>RC[-1],RC[-3]>=7,RC[-3]<8),50,IF(AND(RC[-3]>RC[-1],RC[-3]>=8,RC[-3]<9),40,IF(AND(RC[-3]>RC[-1],RC[-3]>=9,RC[-3]<10),30,IF(AND(RC[-3]>RC[-1],RC[-3]>=10,RC[-3]<11),20,IF(AND(RC[-3]>RC[-1],RC[-3]>=11,RC[-3]<12),10,IF(AND(RC[-3]>RC[-1],RC[-3]>=12),0))))))))))))))))))))))))))))))))) -> 45 | H510: =IF(RC[-3]="","",IF(RC[-3]<0.3,100,IF(AND(RC[-3]>=0.3,RC[-3]>0.4),95,IF(AND(RC[-3]>=0.4,RC[-3]<0.5),90,IF(AND(RC[-3]>=0.5,RC[-3]<0.6),85,IF(AND(RC[-3]>=0.6,RC[-3]<0.7),80,IF(AND(RC[-3]>=0.6,RC[-3]<1),80,IF(AND(RC[-3]>1,RC[-3]<2),50,IF(RC[-3]>2,0))))))))) ->  | I510: =IF(RC[-1]="",RC[-2],0.7*RC[-1]+0.3*RC[-2]) -> 45
A511: کشت و صنعت پیاذر | B511: غاذر | C511: =VLOOKUP(RC[-1],Sheet1!R3C2:R802C3,2,FALSE) -> غذایی بجز قند وشکر | D511: =VLOOKUP(RC[-2],Sheet1!R3C2:R802C9,8,FALSE) -> 19.596818370708196 | E511: =IF(VLOOKUP(RC[-3],Sheet1!R3C2:R803C11,10,FALSE)=0,"",VLOOKUP(Sheet2!RC[-3],Sheet1!R[1]C[-3]:R[801]C[6],10,FALSE)) ->  | F511: =Sheet1!R546C10 -> 18.927119434200804 | G511: =IF(RC[-3]<0,0,IF(AND(RC[-3]<RC[-1],RC[-3]<2),100,IF(AND(RC[-3]<RC[-1],RC[-3]>=2,RC[-3]<3),95,IF(AND(RC[-3]<RC[-1],RC[-3]>=3,RC[-3]<4),90,IF(AND(RC[-3]<RC[-1],RC[-3]>=4,RC[-3]<5),85,IF(AND(RC[-3]<RC[-1],RC[-3]>=5,RC[-3]<6),80,IF(AND(RC[-3]<RC[-1],RC[-3]>=6,RC[-3]<7),75,IF(AND(RC[-3]<RC[-1],RC[-3]>=7,RC[-3]<8),70,IF(AND(RC[-3]<RC[-1],RC[-3]>=8,RC[-3]<9),65,IF(AND(RC[-3]<RC[-1],RC[-3]>=9,RC[-3]<10),60,IF(AND(RC[-3]<RC[-1],RC[-3]>=10,RC[-3]<11),55,IF(AND(RC[-3]<RC[-1],RC[-3]>=11,RC[-3]<12),50,IF(AND(RC[-3]<RC[-1],RC[-3]>=12,RC[-3]<13),45,IF(AND(RC[-3]<RC[-1],RC[-3]>=13,RC[-3]<14),40,IF(AND(RC[-3]<RC[-1],RC[-3]>=14,RC[-3]<15),35,IF(AND(RC[-3]<RC[-1],RC[-3]>=15,RC[-3]<16),30,IF(AND(RC[-3]<RC[-1],RC[-3]>=16,RC[-3]<17),25,IF(AND(RC[-3]<RC[-1],RC[-3]>=17,RC[-3]<18),20,IF(AND(RC[-3]<RC[-1],RC[-3]>=18,RC[-3]<19),15,IF(AND(RC[-3]<RC[-1],RC[-3]>=19,RC[-3]<20),10,IF(AND(RC[-3]<RC[-1],RC[-3]>=20,RC[-3]<21),5,IF(AND(RC[-3]<RC[-1],RC[-3]>=21),0,IF(AND(RC[-3]>RC[-1],RC[-3]>=2,RC[-3]<3),90,IF(AND(RC[-3]>RC[-1],RC[-3]>=3,RC[-3]<4),90,IF(AND(RC[-3]>RC[-1],RC[-3]>=4,RC[-3]<5),80,IF(AND(RC[-3]>RC[-1],RC[-3]>=5,RC[-3]<6),70,IF(AND(RC[-3]>RC[-1],RC[-3]>=6,RC[-3]<7),60,IF(AND(RC[-3]>RC[-1],RC[-3]>=7,RC[-3]<8),50,IF(AND(RC[-3]>RC[-1],RC[-3]>=8,RC[-3]<9),40,IF(AND(RC[-3]>RC[-1],RC[-3]>=9,RC[-3]<10),30,IF(AND(RC[-3]>RC[-1],RC[-3]>=10,RC[-3]<11),20,IF(AND(RC[-3]>RC[-1],RC[-3]>=11,RC[-3]<12),10,IF(AND(RC[-3]>RC[-1],RC[-3]>=12),0))))))))))))))))))))))))))))))))) -> 0 | H511: =IF(RC[-3]="","",IF(RC[-3]<0.3,100,IF(AND(RC[-3]>=0.3,RC[-3]>0.4),95,IF(AND(RC[-3]>=0.4,RC[-3]<0.5),90,IF(AND(RC[-3]>=0.5,RC[-3]<0.6),85,IF(AND(RC[-3]>=0.6,RC[-3]<0.7),80,IF(AND(RC[-3]>=0.6,RC[-3]<1),80,IF(AND(RC[-3]>1,RC[-3]<2),50,IF(RC[-3]>2,0))))))))) ->  | I511: =IF(RC[-1]="",RC[-2],0.7*RC[-1]+0.3*RC[-2]) -> 0
A512: کشت و صنعت جوین | B512: جوین | C512: =VLOOKUP(RC[-1],Sheet1!R3C2:R802C3,2,FALSE) -> غذایی بجز قند وشکر | D512: =VLOOKUP(RC[-2],Sheet1!R3C2:R802C9,8,FALSE) -> 3.5783699268703968 | E512: =IF(VLOOKUP(RC[-3],Sheet1!R3C2:R803C11,10,FALSE)=0,"",VLOOKUP(Sheet2!RC[-3],Sheet1!R[1]C[-3]:R[801]C[6],10,FALSE)) ->  | F512: =Sheet1!R546C10 -> 18.927119434200804 | G512: =IF(RC[-3]<0,0,IF(AND(RC[-3]<RC[-1],RC[-3]<2),100,IF(AND(RC[-3]<RC[-1],RC[-3]>=2,RC[-3]<3),95,IF(AND(RC[-3]<RC[-1],RC[-3]>=3,RC[-3]<4),90,IF(AND(RC[-3]<RC[-1],RC[-3]>=4,RC[-3]<5),85,IF(AND(RC[-3]<RC[-1],RC[-3]>=5,RC[-3]<6),80,IF(AND(RC[-3]<RC[-1],RC[-3]>=6,RC[-3]<7),75,IF(AND(RC[-3]<RC[-1],RC[-3]>=7,RC[-3]<8),70,IF(AND(RC[-3]<RC[-1],RC[-3]>=8,RC[-3]<9),65,IF(AND(RC[-3]<RC[-1],RC[-3]>=9,RC[-3]<10),60,IF(AND(RC[-3]<RC[-1],RC[-3]>=10,RC[-3]<11),55,IF(AND(RC[-3]<RC[-1],RC[-3]>=11,RC[-3]<12),50,IF(AND(RC[-3]<RC[-1],RC[-3]>=12,RC[-3]<13),45,IF(AND(RC[-3]<RC[-1],RC[-3]>=13,RC[-3]<14),40,IF(AND(RC[-3]<RC[-1],RC[-3]>=14,RC[-3]<15),35,IF(AND(RC[-3]<RC[-1],RC[-3]>=15,RC[-3]<16),30,IF(AND(RC[-3]<RC[-1],RC[-3]>=16,RC[-3]<17),25,IF(AND(RC[-3]<RC[-1],RC[-3]>=17,RC[-3]<18),20,IF(AND(RC[-3]<RC[-1],RC[-3]>=18,RC[-3]<19),15,IF(AND(RC[-3]<RC[-1],RC[-3]>=19,RC[-3]<20),10,IF(AND(RC[-3]<RC[-1],RC[-3]>=20,RC[-3]<21),5,IF(AND(RC[-3]<RC[-1],RC[-3]>=21),0,IF(AND(RC[-3]>RC[-1],RC[-3]>=2,RC[-3]<3),90,IF(AND(RC[-3]>RC[-1],RC[-3]>=3,RC[-3]<4),90,IF(AND(RC[-3]>RC[-1],RC[-3]>=4,RC[-3]<5),80,IF(AND(RC[-3]>RC[-1],RC[-3]>=5,RC[-3]<6),70,IF(AND(RC[-3]>RC[-1],RC[-3]>=6,RC[-3]<7),60,IF(AND(RC[-3]>RC[-1],RC[-3]>=7,RC[-3]<8),50,IF(AND(RC[-3]>RC[-1],RC[-3]>=8,RC[-3]<9),40,IF(AND(RC[-3]>RC[-1],RC[-3]>=9,RC[-3]<10),30,IF(AND(RC[-3]>RC[-1],RC[-3]>=10,RC[-3]<11),20,IF(AND(RC[-3]>RC[-1],RC[-3]>=11,RC[-3]<12),10,IF(AND(RC[-3]>RC[-1],RC[-3]>=12),0))))))))))))))))))))))))))))))))) -> 90 | H512: =IF(RC[-3]="","",IF(RC[-3]<0.3,100,IF(AND(RC[-3]>=0.3,RC[-3]>0.4),95,IF(AND(RC[-3]>=0.4,RC[-3]<0.5),90,IF(AND(RC[-3]>=0.5,RC[-3]<0.6),85,IF(AND(RC[-3]>=0.6,RC[-3]<0.7),80,IF(AND(RC[-3]>=0.6,RC[-3]<1),80,IF(AND(RC[-3]>1,RC[-3]<2),50,IF(RC[-3]>2,0))))))))) ->  | I512: =IF(RC[-1]="",RC[-2],0.7*RC[-1]+0.3*RC[-2]) -> 90
A513: کشت و صنعت چین چین | B513: غچین | C513: =VLOOKUP(RC[-1],Sheet1!R3C2:R802C3,2,FALSE) -> غذایی بجز قند وشکر | D513: =VLOOKUP(RC[-2],Sheet1!R3C2:R802C9,8,FALSE) -> 6.1455076829693178 | E513: =IF(VLOOKUP(RC[-3],Sheet1!R3C2:R803C11,10,FALSE)=0,"",VLOOKUP(Sheet2!RC[-3],Sheet1!R[1]C[-3]:R[801]C[6],10,FALSE)) ->  | F513: =Sheet1!R546C10 -> 18.927119434200804 | G513: =IF(RC[-3]<0,0,IF(AND(RC[-3]<RC[-1],RC[-3]<2),100,IF(AND(RC[-3]<RC[-1],RC[-3]>=2,RC[-3]<3),95,IF(AND(RC[-3]<RC[-1],RC[-3]>=3,RC[-3]<4),90,IF(AND(RC[-3]<RC[-1],RC[-3]>=4,RC[-3]<5),85,IF(AND(RC[-3]<RC[-1],RC[-3]>=5,RC[-3]<6),80,IF(AND(RC[-3]<RC[-1],RC[-3]>=6,RC[-3]<7),75,IF(AND(RC[-3]<RC[-1],RC[-3]>=7,RC[-3]<8),70,IF(AND(RC[-3]<RC[-1],RC[-3]>=8,RC[-3]<9),65,IF(AND(RC[-3]<RC[-1],RC[-3]>=9,RC[-3]<10),60,IF(AND(RC[-3]<RC[-1],RC[-3]>=10,RC[-3]<11),55,IF(AND(RC[-3]<RC[-1],RC[-3]>=11,RC[-3]<12),50,IF(AND(RC[-3]<RC[-1],RC[-3]>=12,RC[-3]<13),45,IF(AND(RC[-3]<RC[-1],RC[-3]>=13,RC[-3]<14),40,IF(AND(RC[-3]<RC[-1],RC[-3]>=14,RC[-3]<15),35,IF(AND(RC[-3]<RC[-1],RC[-3]>=15,RC[-3]<16),30,IF(AND(RC[-3]<RC[-1],RC[-3]>=16,RC[-3]<17),25,IF(AND(RC[-3]<RC[-1],RC[-3]>=17,RC[-3]<18),20,IF(AND(RC[-3]<RC[-1],RC[-3]>=18,RC[-3]<19),15,IF(AND(RC[-3]<RC[-1],RC[-3]>=19,RC[-3]<20),10,IF(AND(RC[-3]<RC[-1],RC[-3]>=20,RC[-3]<21),5,IF(AND(RC[-3]<RC[-1],RC[-3]>=21),0,IF(AND(RC[-3]>RC[-1],RC[-3]>=2,RC[-3]<3),90,IF(AND(RC[-3]>RC[-1],RC[-3]>=3,RC[-3]<4),90,IF(AND(RC[-3]>RC[-1],RC[-3]>=4,RC[-3]<5),80,IF(AND(RC[-3]>RC[-1],RC[-3]>=5,RC[-3]<6),70,IF(AND(RC[-3]>RC[-1],RC[-3]>=6,RC[-3]<7),60,IF(AND(RC[-3]>RC[-1],RC[-3]>=7,RC[-3]<8),50,IF(AND(RC[-3]>RC[-1],RC[-3]>=8,RC[-3]<9),40,IF(AND(RC[-3]>RC[-1],RC[-3]>=9,RC[-3]<10),30,IF(AND(RC[-3]>RC[-1],RC[-3]>=10,RC[-3]<11),20,IF(AND(RC[-3]>RC[-1],RC[-3]>=11,RC[-3]<12),10,IF(AND(RC[-3]>RC[-1],RC[-3]>=12),0))))))))))))))))))))))))))))))))) -> 75 | H513: =IF(RC[-3]="","",IF(RC[-3]<0.3,100,IF(AND(RC[-3]>=0.3,RC[-3]>0.4),95,IF(AND(RC[-3]>=0.4,RC[-3]<0.5),90,IF(AND(RC[-3]>=0.5,RC[-3]<0.6),85,IF(AND(RC[-3]>=0.6,RC[-3]<0.7),80,IF(AND(RC[-3]>=0.6,RC[-3]<1),80,IF(AND(RC[-3]>1,RC[-3]<2),50,IF(RC[-3]>2,0))))))))) ->  | I513: =IF(RC[-1]="",RC[-2],0.7*RC[-1]+0.3*RC[-2]) -> 75
A514: کیوان | B514: غیوان | C514: =VLOOKUP(RC[-1],Sheet1!R3C2:R802C3,2,FALSE) -> غذایی بجز قند وشکر | D514: =VLOOKUP(RC[-2],Sheet1!R3C2:R802C9,8,FALSE) -> 55.069389236738637 | E514: =IF(VLOOKUP(RC[-3],Sheet1!R3C2:R803C11,10,FALSE)=0,"",VLOOKUP(Sheet2!RC[-3],Sheet1!R[1]C[-3]:R[801]C[6],10,FALSE)) ->  | F514: =Sheet1!R546C10 -> 18.927119434200804 | G514: =IF(RC[-3]<0,0,IF(AND(RC[-3]<RC[-1],RC[-3]<2),100,IF(AND(RC[-3]<RC[-1],RC[-3]>=2,RC[-3]<3),95,IF(AND(RC[-3]<RC[-1],RC[-3]>=3,RC[-3]<4),90,IF(AND(RC[-3]<RC[-1],RC[-3]>=4,RC[-3]<5),85,IF(AND(RC[-3]<RC[-1],RC[-3]>=5,RC[-3]<6),80,IF(AND(RC[-3]<RC[-1],RC[-3]>=6,RC[-3]<7),75,IF(AND(RC[-3]<RC[-1],RC[-3]>=7,RC[-3]<8),70,IF(AND(RC[-3]<RC[-1],RC[-3]>=8,RC[-3]<9),65,IF(AND(RC[-3]<RC[-1],RC[-3]>=9,RC[-3]<10),60,IF(AND(RC[-3]<RC[-1],RC[-3]>=10,RC[-3]<11),55,IF(AND(RC[-3]<RC[-1],RC[-3]>=11,RC[-3]<12),50,IF(AND(RC[-3]<RC[-1],RC[-3]>=12,RC[-3]<13),45,IF(AND(RC[-3]<RC[-1],RC[-3]>=13,RC[-3]<14),40,IF(AND(RC[-3]<RC[-1],RC[-3]>=14,RC[-3]<15),35,IF(AND(RC[-3]<RC[-1],RC[-3]>=15,RC[-3]<16),30,IF(AND(RC[-3]<RC[-1],RC[-3]>=16,RC[-3]<17),25,IF(AND(RC[-3]<RC[-1],RC[-3]>=17,RC[-3]<18),20,IF(AND(RC[-3]<RC[-1],RC[-3]>=18,RC[-3]<19),15,IF(AND(RC[-3]<RC[-1],RC[-3]>=19,RC[-3]<20),10,IF(AND(RC[-3]<RC[-1],RC[-3]>=20,RC[-3]<21),5,IF(AND(RC[-3]<RC[-1],RC[-3]>=21),0,IF(AND(RC[-3]>RC[-1],RC[-3]>=2,RC[-3]<3),90,IF(AND(RC[-3]>RC[-1],RC[-3]>=3,RC[-3]<4),90,IF(AND(RC[-3]>RC[-1],RC[-3]>=4,RC[-3]<5),80,IF(AND(RC[-3]>RC[-1],RC[-3]>=5,RC[-3]<6),70,IF(AND(RC[-3]>RC[-1],RC[-3]>=6,RC[-3]<7),60,IF(AND(RC[-3]>RC[-1],RC[-3]>=7,RC[-3]<8),50,IF(AND(RC[-3]>RC[-1],RC[-3]>=8,RC[-3]<9),40,IF(AND(RC[-3]>RC[-1],RC[-3]>=9,RC[-3]<10),30,IF(AND(RC[-3]>RC[-1],RC[-3]>=10,RC[-3]<11),20,IF(AND(RC[-3]>RC[-1],RC[-3]>=11,RC[-3]<12),10,IF(AND(RC[-3]>RC[-1],RC[-3]>=12),0))))))))))))))))))))))))))))))))) -> 0 | H514: =IF(RC[-3]="","",IF(RC[-3]<0.3,100,IF(AND(RC[-3]>=0.3,RC[-3]>0.4),95,IF(AND(RC[-3]>=0.4,RC[-3]<0.5),90,IF(AND(RC[-3]>=0.5,RC[-3]<0.6),85,IF(AND(RC[-3]>=0.6,RC[-3]<0.7),80,IF(AND(RC[-3]>=0.6,RC[-3]<1),80,IF(AND(RC[-3]>1,RC[-3]<2),50,IF(RC[-3]>2,0))))))))) ->  | I514: =IF(RC[-1]="",RC[-2],0.7*RC[-1]+0.3*RC[-2]) -> 0
A515: پالایش نفت اصفهان | B515: شپنا | C515: =VLOOKUP(RC[-1],Sheet1!R3C2:R802C3,2,FALSE) -> فرآورده های نفتی | D515: =VLOOKUP(RC[-2],Sheet1!R3C2:R802C9,8,FALSE) -> 6.5 | E515: =IF(VLOOKUP(RC[-3],Sheet1!R3C2:R803C11,10,FALSE)=0,"",VLOOKUP(Sheet2!RC[-3],Sheet1!R[1]C[-3]:R[801]C[6],10,FALSE)) ->  | F515: =Sheet1!R560C10 -> 4.1317587268007188 | G515: =IF(RC[-3]<0,0,IF(AND(RC[-3]<RC[-1],RC[-3]<2),100,IF(AND(RC[-3]<RC[-1],RC[-3]>=2,RC[-3]<3),95,IF(AND(RC[-3]<RC[-1],RC[-3]>=3,RC[-3]<4),90,IF(AND(RC[-3]<RC[-1],RC[-3]>=4,RC[-3]<5),85,IF(AND(RC[-3]<RC[-1],RC[-3]>=5,RC[-3]<6),80,IF(AND(RC[-3]<RC[-1],RC[-3]>=6,RC[-3]<7),75,IF(AND(RC[-3]<RC[-1],RC[-3]>=7,RC[-3]<8),70,IF(AND(RC[-3]<RC[-1],RC[-3]>=8,RC[-3]<9),65,IF(AND(RC[-3]<RC[-1],RC[-3]>=9,RC[-3]<10),60,IF(AND(RC[-3]<RC[-1],RC[-3]>=10,RC[-3]<11),55,IF(AND(RC[-3]<RC[-1],RC[-3]>=11,RC[-3]<12),50,IF(AND(RC[-3]<RC[-1],RC[-3]>=12,RC[-3]<13),45,IF(AND(RC[-3]<RC[-1],RC[-3]>=13,RC[-3]<14),40,IF(AND(RC[-3]<RC[-1],RC[-3]>=14,RC[-3]<15),35,IF(AND(RC[-3]<RC[-1],RC[-3]>=15,RC[-3]<16),30,IF(AND(RC[-3]<RC[-1],RC[-3]>=16,RC[-3]<17),25,IF(AND(RC[-3]<RC[-1],RC[-3]>=17,RC[-3]<18),20,IF(AND(RC[-3]<RC[-1],RC[-3]>=18,RC[-3]<19),15,IF(AND(RC[-3]<RC[-1],RC[-3]>=19,RC[-3]<20),10,IF(AND(RC[-3]<RC[-1],RC[-3]>=20,RC[-3]<21),5,IF(AND(RC[-3]<RC[-1],RC[-3]>=21),0,IF(AND(RC[-3]>RC[-1],RC[-3]>=2,RC[-3]<3),90,IF(AND(RC[-3]>RC[-1],RC[-3]>=3,RC[-3]<4),90,IF(AND(RC[-3]>RC[-1],RC[-3]>=4,RC[-3]<5),80,IF(AND(RC[-3]>RC[-1],RC[-3]>=5,RC[-3]<6),70,IF(AND(RC[-3]>RC[-1],RC[-3]>=6,RC[-3]<7),60,IF(AND(RC[-3]>RC[-1],RC[-3]>=7,RC[-3]<8),50,IF(AND(RC[-3]>RC[-1],RC[-3]>=8,RC[-3]<9),40,IF(AND(RC[-3]>RC[-1],RC[-3]>=9,RC[-3]<10),30,IF(AND(RC[-3]>RC[-1],RC[-3]>=10,RC[-3]<11),20,IF(AND(RC[-3]>RC[-1],RC[-3]>=11,RC[-3]<12),10,IF(AND(RC[-3]>RC[-1],RC[-3]>=12),0))))))))))))))))))))))))))))))))) -> 60 | H515: =IF(RC[-3]="","",IF(RC[-3]<0.3,100,IF(AND(RC[-3]>=0.3,RC[-3]>0.4),95,IF(AND(RC[-3]>=0.4,RC[-3]<0.5),90,IF(AND(RC[-3]>=0.5,RC[-3]<0.6),85,IF(AND(RC[-3]>=0.6,RC[-3]<0.7),80,IF(AND(RC[-3]>=0.6,RC[-3]<1),80,IF(AND(RC[-3]>1,RC[-3]<2),50,IF(RC[-3]>2,0))))))))) ->  | I515: =IF(RC[-1]="",RC[-2],0.7*RC[-1]+0.3*RC[-2]) -> 60
A516: پالایش نفت بندر عباس | B516: شبندر | C516: =VLOOKUP(RC[-1],Sheet1!R3C2:R802C3,2,FALSE) -> فرآورده های نفتی | D516: =VLOOKUP(RC[-2],Sheet1!R3C2:R802C9,8,FALSE) -> 2.7452296695113998 | E516: =IF(VLOOKUP(RC[-3],Sheet1!R3C2:R803C11,10,FALSE)=0,"",VLOOKUP(Sheet2!RC[-3],Sheet1!R[1]C[-3]:R[801]C[6],10,FALSE)) ->  | F516: =Sheet1!R560C10 -> 4.1317587268007188 | G516: =IF(RC[-3]<0,0,IF(AND(RC[-3]<RC[-1],RC[-3]<2),100,IF(AND(RC[-3]<RC[-1],RC[-3]>=2,RC[-3]<3),95,IF(AND(RC[-3]<RC[-1],RC[-3]>=3,RC[-3]<4),90,IF(AND(RC[-3]<RC[-1],RC[-3]>=4,RC[-3]<5),85,IF(AND(RC[-3]<RC[-1],RC[-3]>=5,RC[-3]<6),80,IF(AND(RC[-3]<RC[-1],RC[-3]>=6,RC[-3]<7),75,IF(AND(RC[-3]<RC[-1],RC[-3]>=7,RC[-3]<8),70,IF(AND(RC[-3]<RC[-1],RC[-3]>=8,RC[-3]<9),65,IF(AND(RC[-3]<RC[-1],RC[-3]>=9,RC[-3]<10),60,IF(AND(RC[-3]<RC[-1],RC[-3]>=10,RC[-3]<11),55,IF(AND(RC[-3]<RC[-1],RC[-3]>=11,RC[-3]<12),50,IF(AND(RC[-3]<RC[-1],RC[-3]>=12,RC[-3]<13),45,IF(AND(RC[-3]<RC[-1],RC[-3]>=13,RC[-3]<14),40,IF(AND(RC[-3]<RC[-1],RC[-3]>=14,RC[-3]<15),35,IF(AND(RC[-3]<RC[-1],RC[-3]>=15,RC[-3]<16),30,IF(AND(RC[-3]<RC[-1],RC[-3]>=16,RC[-3]<17),25,IF(AND(RC[-3]<RC[-1],RC[-3]>=17,RC[-3]<18),20,IF(AND(RC[-3]<RC[-1],RC[-3]>=18,RC[-3]<19),15,IF(AND(RC[-3]<RC[-1],RC[-3]>=19,RC[-3]<20),10,IF(AND(RC[-3]<RC[-1],RC[-3]>=20,RC[-3]<21),5,IF(AND(RC[-3]<RC[-1],RC[-3]>=21),0,IF(AND(RC[-3]>RC[-1],RC[-3]>=2,RC[-3]<3),90,IF(AND(RC[-3]>RC[-1],RC[-3]>=3,RC[-3]<4),90,IF(AND(RC[-3]>RC[-1],RC[-3]>=4,RC[-3]<5),80,IF(AND(RC[-3]>RC[-1],RC[-3]>=5,RC[-3]<6),70,IF(AND(RC[-3]>RC[-1],RC[-3]>=6,RC[-3]<7),60,IF(AND(RC[-3]>RC[-1],RC[-3]>=7,RC[-3]<8),50,IF(AND(RC[-3]>RC[-1],RC[-3]>=8,RC[-3]<9),40,IF(AND(RC[-3]>RC[-1],RC[-3]>=9,RC[-3]<10),30,IF(AND(RC[-3]>RC[-1],RC[-3]>=10,RC[-3]<11),20,IF(AND(RC[-3]>RC[-1],RC[-3]>=11,RC[-3]<12),10,IF(AND(RC[-3]>RC[-1],RC[-3]>=12),0))))))))))))))))))))))))))))))))) -> 95 | H516: =IF(RC[-3]="","",IF(RC[-3]<0.3,100,IF(AND(RC[-3]>=0.3,RC[-3]>0.4),95,IF(AND(RC[-3]>=0.4,RC[-3]<0.5),90,IF(AND(RC[-3]>=0.5,RC[-3]<0.6),85,IF(AND(RC[-3]>=0.6,RC[-3]<0.7),80,IF(AND(RC[-3]>=0.6,RC[-3]<1),80,IF(AND(RC[-3]>1,RC[-3]<2),50,IF(RC[-3]>2,0))))))))) ->  | I516: =IF(RC[-1]="",RC[-2],0.7*RC[-1]+0.3*RC[-2]) -> 95
A517: پالایش نفت تبریز | B517: شبریز | C517: =VLOOKUP(RC[-1],Sheet1!R3C2:R802C3,2,FALSE) -> فرآورده های نفتی | D517: =VLOOKUP(RC[-2],Sheet1!R3C2:R802C9,8,FALSE) -> 2.2684580363647004 | E517: =IF(VLOOKUP(RC[-3],Sheet1!R3C2:R803C11,10,FALSE)=0,"",VLOOKUP(Sheet2!RC[-3],Sheet1!R[1]C[-3]:R[801]C[6],10,FALSE)) ->  | F517: =Sheet1!R560C10 -> 4.1317587268007188 | G517: =IF(RC[-3]<0,0,IF(AND(RC[-3]<RC[-1],RC[-3]<2),100,IF(AND(RC[-3]<RC[-1],RC[-3]>=2,RC[-3]<3),95,IF(AND(RC[-3]<RC[-1],RC[-3]>=3,RC[-3]<4),90,IF(AND(RC[-3]<RC[-1],RC[-3]>=4,RC[-3]<5),85,IF(AND(RC[-3]<RC[-1],RC[-3]>=5,RC[-3]<6),80,IF(AND(RC[-3]<RC[-1],RC[-3]>=6,RC[-3]<7),75,IF(AND(RC[-3]<RC[-1],RC[-3]>=7,RC[-3]<8),70,IF(AND(RC[-3]<RC[-1],RC[-3]>=8,RC[-3]<9),65,IF(AND(RC[-3]<RC[-1],RC[-3]>=9,RC[-3]<10),60,IF(AND(RC[-3]<RC[-1],RC[-3]>=10,RC[-3]<11),55,IF(AND(RC[-3]<RC[-1],RC[-3]>=11,RC[-3]<12),50,IF(AND(RC[-3]<RC[-1],RC[-3]>=12,RC[-3]<13),45,IF(AND(RC[-3]<RC[-1],RC[-3]>=13,RC[-3]<14),40,IF(AND(RC[-3]<RC[-1],RC[-3]>=14,RC[-3]<15),35,IF(AND(RC[-3]<RC[-1],RC[-3]>=15,RC[-3]<16),30,IF(AND(RC[-3]<RC[-1],RC[-3]>=16,RC[-3]<17),25,IF(AND(RC[-3]<RC[-1],RC[-3]>=17,RC[-3]<18),20,IF(AND(RC[-3]<RC[-1],RC[-3]>=18,RC[-3]<19),15,IF(AND(RC[-3]<RC[-1],RC[-3]>=19,RC[-3]<20),10,IF(AND(RC[-3]<RC[-1],RC[-3]>=20,RC[-3]<21),5,IF(AND(RC[-3]<RC[-1],RC[-3]>=21),0,IF(AND(RC[-3]>RC[-1],RC[-3]>=2,RC[-3]<3),90,IF(AND(RC[-3]>RC[-1],RC[-3]>=3,RC[-3]<4),90,IF(AND(RC[-3]>RC[-1],RC[-3]>=4,RC[-3]<5),80,IF(AND(RC[-3]>RC[-1],RC[-3]>=5,RC[-3]<6),70,IF(AND(RC[-3]>RC[-1],RC[-3]>=6,RC[-3]<7),60,IF(AND(RC[-3]>RC[-1],RC[-3]>=7,RC[-3]<8),50,IF(AND(RC[-3]>RC[-1],RC[-3]>=8,RC[-3]<9),40,IF(AND(RC[-3]>RC[-1],RC[-3]>=9,RC[-3]<10),30,IF(AND(RC[-3]>RC[-1],RC[-3]>=10,RC[-3]<11),20,IF(AND(RC[-3]>RC[-1],RC[-3]>=11,RC[-3]<12),10,IF(AND(RC[-3]>RC[-1],RC[-3]>=12),0))))))))))))))))))))))))))))))))) -> 95 | H517: =IF(RC[-3]="","",IF(RC[-3]<0.3,100,IF(AND(RC[-3]>=0.3,RC[-3]>0.4),95,IF(AND(RC[-3]>=0.4,RC[-3]<0.5),90,IF(AND(RC[-3]>=0.5,RC[-3]<0.6),85,IF(AND(RC[-3]>=0.6,RC[-3]<0.7),80,IF(AND(RC[-3]>=0.6,RC[-3]<1),80,IF(AND(RC[-3]>1,RC[-3]<2),50,IF(RC[-3]>2,0))))))))) ->  | I517: =IF(RC[-1]="",RC[-2],0.7*RC[-1]+0.3*RC[-2]) -> 95
A518: پالایش نفت تهران | B518: شتران | C518: =VLOOKUP(RC[-1],Sheet1!R3C2:R802C3,2,FALSE) -> فرآورده های نفتی | D518: =VLOOKUP(RC[-2],Sheet1!R3C2:R802C9,8,FALSE) -> 2.7045543535179148 | E518: =IF(VLOOKUP(RC[-3],Sheet1!R3C2:R803C11,10,FALSE)=0,"",VLOOKUP(Sheet2!RC[-3],Sheet1!R[1]C[-3]:R[801]C[6],10,FALSE)) ->  | F518: =Sheet1!R560C10 -> 4.1317587268007188 | G518: =IF(RC[-3]<0,0,IF(AND(RC[-3]<RC[-1],RC[-3]<2),100,IF(AND(RC[-3]<RC[-1],RC[-3]>=2,RC[-3]<3),95,IF(AND(RC[-3]<RC[-1],RC[-3]>=3,RC[-3]<4),90,IF(AND(RC[-3]<RC[-1],RC[-3]>=4,RC[-3]<5),85,IF(AND(RC[-3]<RC[-1],RC[-3]>=5,RC[-3]<6),80,IF(AND(RC[-3]<RC[-1],RC[-3]>=6,RC[-3]<7),75,IF(AND(RC[-3]<RC[-1],RC[-3]>=7,RC[-3]<8),70,IF(AND(RC[-3]<RC[-1],RC[-3]>=8,RC[-3]<9),65,IF(AND(RC[-3]<RC[-1],RC[-3]>=9,RC[-3]<10),60,IF(AND(RC[-3]<RC[-1],RC[-3]>=10,RC[-3]<11),55,IF(AND(RC[-3]<RC[-1],RC[-3]>=11,RC[-3]<12),50,IF(AND(RC[-3]<RC[-1],RC[-3]>=12,RC[-3]<13),45,IF(AND(RC[-3]<RC[-1],RC[-3]>=13,RC[-3]<14),40,IF(AND(RC[-3]<RC[-1],RC[-3]>=14,RC[-3]<15),35,IF(AND(RC[-3]<RC[-1],RC[-3]>=15,RC[-3]<16),30,IF(AND(RC[-3]<RC[-1],RC[-3]>=16,RC[-3]<17),25,IF(AND(RC[-3]<RC[-1],RC[-3]>=17,RC[-3]<18),20,IF(AND(RC[-3]<RC[-1],RC[-3]>=18,RC[-3]<19),15,IF(AND(RC[-3]<RC[-1],RC[-3]>=19,RC[-3]<20),10,IF(AND(RC[-3]<RC[-1],RC[-3]>=20,RC[-3]<21),5,IF(AND(RC[-3]<RC[-1],RC[-3]>=21),0,IF(AND(RC[-3]>RC[-1],RC[-3]>=2,RC[-3]<3),90,IF(AND(RC[-3]>RC[-1],RC[-3]>=3,RC[-3]<4),90,IF(AND(RC[-3]>RC[-1],RC[-3]>=4,RC[-3]<5),80,IF(AND(RC[-3]>RC[-1],RC[-3]>=5,RC[-3]<6),70,IF(AND(RC[-3]>RC[-1],RC[-3]>=6,RC[-3]<7),60,IF(AND(RC[-3]>RC[-1],RC[-3]>=7,RC[-3]<8),50,IF(AND(RC[-3]>RC[-1],RC[-3]>=8,RC[-3]<9),40,IF(AND(RC[-3]>RC[-1],RC[-3]>=9,RC[-3]<10),30,IF(AND(RC[-3]>RC[-1],RC[-3]>=10,RC[-3]<11),20,IF(AND(RC[-3]>RC[-1],RC[-3]>=11,RC[-3]<12),10,IF(AND(RC[-3]>RC[-1],RC[-3]>=12),0))))))))))))))))))))))))))))))))) -> 95 | H518: =IF(RC[-3]="","",IF(RC[-3]<0.3,100,IF(AND(RC[-3]>=0.3,RC[-3]>0.4),95,IF(AND(RC[-3]>=0.4,RC[-3]<0.5),90,IF(AND(RC[-3]>=0.5,RC[-3]<0.6),85,IF(AND(RC[-3]>=0.6,RC[-3]<0.7),80,IF(AND(RC[-3]>=0.6,RC[-3]<1),80,IF(AND(RC[-3]>1,RC[-3]<2),50,IF(RC[-3]>2,0))))))))) ->  | I518: =IF(RC[-1]="",RC[-2],0.7*RC[-1]+0.3*RC[-2]) -> 95
A519: پالایش نفت شیراز | B519: شراز | C519: =VLOOKUP(RC[-1],Sheet1!R3C2:R802C3,2,FALSE) -> فرآورده های نفتی | D519: =VLOOKUP(RC[-2],Sheet1!R3C2:R802C9,8,FALSE) -> 2.9107136009889518 | E519: =IF(VLOOKUP(RC[-3],Sheet1!R3C2:R803C11,10,FALSE)=0,"",VLOOKUP(Sheet2!RC[-3],Sheet1!R[1]C[-3]:R[801]C[6],10,FALSE)) ->  | F519: =Sheet1!R560C10 -> 4.1317587268007188 | G519: =IF(RC[-3]<0,0,IF(AND(RC[-3]<RC[-1],RC[-3]<2),100,IF(AND(RC[-3]<RC[-1],RC[-3]>=2,RC[-3]<3),95,IF(AND(RC[-3]<RC[-1],RC[-3]>=3,RC[-3]<4),90,IF(AND(RC[-3]<RC[-1],RC[-3]>=4,RC[-3]<5),85,IF(AND(RC[-3]<RC[-1],RC[-3]>=5,RC[-3]<6),80,IF(AND(RC[-3]<RC[-1],RC[-3]>=6,RC[-3]<7),75,IF(AND(RC[-3]<RC[-1],RC[-3]>=7,RC[-3]<8),70,IF(AND(RC[-3]<RC[-1],RC[-3]>=8,RC[-3]<9),65,IF(AND(RC[-3]<RC[-1],RC[-3]>=9,RC[-3]<10),60,IF(AND(RC[-3]<RC[-1],RC[-3]>=10,RC[-3]<11),55,IF(AND(RC[-3]<RC[-1],RC[-3]>=11,RC[-3]<12),50,IF(AND(RC[-3]<RC[-1],RC[-3]>=12,RC[-3]<13),45,IF(AND(RC[-3]<RC[-1],RC[-3]>=13,RC[-3]<14),40,IF(AND(RC[-3]<RC[-1],RC[-3]>=14,RC[-3]<15),35,IF(AND(RC[-3]<RC[-1],RC[-3]>=15,RC[-3]<16),30,IF(AND(RC[-3]<RC[-1],RC[-3]>=16,RC[-3]<17),25,IF(AND(RC[-3]<RC[-1],RC[-3]>=17,RC[-3]<18),20,IF(AND(RC[-3]<RC[-1],RC[-3]>=18,RC[-3]<19),15,IF(AND(RC[-3]<RC[-1],RC[-3]>=19,RC[-3]<20),10,IF(AND(RC[-3]<RC[-1],RC[-3]>=20,RC[-3]<21),5,IF(AND(RC[-3]<RC[-1],RC[-3]>=21),0,IF(AND(RC[-3]>RC[-1],RC[-3]>=2,RC[-3]<3),90,IF(AND(RC[-3]>RC[-1],RC[-3]>=3,RC[-3]<4),90,IF(AND(RC[-3]>RC[-1],RC[-3]>=4,RC[-3]<5),80,IF(AND(RC[-3]>RC[-1],RC[-3]>=5,RC[-3]<6),70,IF(AND(RC[-3]>RC[-1],RC[-3]>=6,RC[-3]<7),60,IF(AND(RC[-3]>RC[-1],RC[-3]>=7,RC[-3]<8),50,IF(AND(RC[-3]>RC[-1],RC[-3]>=8,RC[-3]<9),40,IF(AND(RC[-3]>RC[-1],RC[-3]>=9,RC[-3]<10),30,IF(AND(RC[-3]>RC[-1],RC[-3]>=10,RC[-3]<11),20,IF(AND(RC[-3]>RC[-1],RC[-3]>=11,RC[-3]<12),10,IF(AND(RC[-3]>RC[-1],RC[-3]>=12),0))))))))))))))))))))))))))))))))) -> 95 | H519: =IF(RC[-3]="","",IF(RC[-3]<0.3,100,IF(AND(RC[-3]>=0.3,RC[-3]>0.4),95,IF(AND(RC[-3]>=0.4,RC[-3]<0.5),90,IF(AND(RC[-3]>=0.5,RC[-3]<0.6),85,IF(AND(RC[-3]>=0.6,RC[-3]<0.7),80,IF(AND(RC[-3]>=0.6,RC[-3]<1),80,IF(AND(RC[-3]>1,RC[-3]<2),50,IF(RC[-3]>2,0))))))))) ->  | I519: =IF(RC[-1]="",RC[-2],0.7*RC[-1]+0.3*RC[-2]) -> 95
A520: پالایش نفت لاوان | B520: شاوان | C520: =VLOOKUP(RC[-1],Sheet1!R3C2:R802C3,2,FALSE) -> فرآورده های نفتی | D520: =VLOOKUP(RC[-2],Sheet1!R3C2:R802C9,8,FALSE) -> 6 | E520: =IF(VLOOKUP(RC[-3],Sheet1!R3C2:R803C11,10,FALSE)=0,"",VLOOKUP(Sheet2!RC[-3],Sheet1!R[1]C[-3]:R[801]C[6],10,FALSE)) ->  | F520: =Sheet1!R560C10 -> 4.1317587268007188 | G520: =IF(RC[-3]<0,0,IF(AND(RC[-3]<RC[-1],RC[-3]<2),100,IF(AND(RC[-3]<RC[-1],RC[-3]>=2,RC[-3]<3),95,IF(AND(RC[-3]<RC[-1],RC[-3]>=3,RC[-3]<4),90,IF(AND(RC[-3]<RC[-1],RC[-3]>=4,RC[-3]<5),85,IF(AND(RC[-3]<RC[-1],RC[-3]>=5,RC[-3]<6),80,IF(AND(RC[-3]<RC[-1],RC[-3]>=6,RC[-3]<7),75,IF(AND(RC[-3]<RC[-1],RC[-3]>=7,RC[-3]<8),70,IF(AND(RC[-3]<RC[-1],RC[-3]>=8,RC[-3]<9),65,IF(AND(RC[-3]<RC[-1],RC[-3]>=9,RC[-3]<10),60,IF(AND(RC[-3]<RC[-1],RC[-3]>=10,RC[-3]<11),55,IF(AND(RC[-3]<RC[-1],RC[-3]>=11,RC[-3]<12),50,IF(AND(RC[-3]<RC[-1],RC[-3]>=12,RC[-3]<13),45,IF(AND(RC[-3]<RC[-1],RC[-3]>=13,RC[-3]<14),40,IF(AND(RC[-3]<RC[-1],RC[-3]>=14,RC[-3]<15),35,IF(AND(RC[-3]<RC[-1],RC[-3]>=15,RC[-3]<16),30,IF(AND(RC[-3]<RC[-1],RC[-3]>=16,RC[-3]<17),25,IF(AND(RC[-3]<RC[-1],RC[-3]>=17,RC[-3]<18),20,IF(AND(RC[-3]<RC[-1],RC[-3]>=18,RC[-3]<19),15,IF(AND(RC[-3]<RC[-1],RC[-3]>=19,RC[-3]<20),10,IF(AND(RC[-3]<RC[-1],RC[-3]>=20,RC[-3]<21),5,IF(AND(RC[-3]<RC[-1],RC[-3]>=21),0,IF(AND(RC[-3]>RC[-1],RC[-3]>=2,RC[-3]<3),90,IF(AND(RC[-3]>RC[-1],RC[-3]>=3,RC[-3]<4),90,IF(AND(RC[-3]>RC[-1],RC[-3]>=4,RC[-3]<5),80,IF(AND(RC[-3]>RC[-1],RC[-3]>=5,RC[-3]<6),70,IF(AND(RC[-3]>RC[-1],RC[-3]>=6,RC[-3]<7),60,IF(AND(RC[-3]>RC[-1],RC[-3]>=7,RC[-3]<8),50,IF(AND(RC[-3]>RC[-1],RC[-3]>=8,RC[-3]<9),40,IF(AND(RC[-3]>RC[-1],RC[-3]>=9,RC[-3]<10),30,IF(AND(RC[-3]>RC[-1],RC[-3]>=10,RC[-3]<11),20,IF(AND(RC[-3]>RC[-1],RC[-3]>=11,RC[-3]<12),10,IF(AND(RC[-3]>RC[-1],RC[-3]>=12),0))))))))))))))))))))))))))))))))) -> 60 | H520: =IF(RC[-3]="","",IF(RC[-3]<0.3,100,IF(AND(RC[-3]>=0.3,RC[-3]>0.4),95,IF(AND(RC[-3]>=0.4,RC[-3]<0.5),90,IF(AND(RC[-3]>=0.5,RC[-3]<0.6),85,IF(AND(RC[-3]>=0.6,RC[-3]<0.7),80,IF(AND(RC[-3]>=0.6,RC[-3]<1),80,IF(AND(RC[-3]>1,RC[-3]<2),50,IF(RC[-3]>2,0))))))))) ->  | I520: =IF(RC[-1]="",RC[-2],0.7*RC[-1]+0.3*RC[-2]) -> 60
A521: تجهیز نیروی زنگان | B521: شزنگ | C521: =VLOOKUP(RC[-1],Sheet1!R3C2:R802C3,2,FALSE) -> فرآورده های نفتی | D521: =VLOOKUP(RC[-2],Sheet1!R3C2:R802C9,8,FALSE) -> 22.858012217402091 | E521: =IF(VLOOKUP(RC[-3],Sheet1!R3C2:R803C11,10,FALSE)=0,"",VLOOKUP(Sheet2!RC[-3],Sheet1!R[1]C[-3]:R[801]C[6],10,FALSE)) ->  | F521: =Sheet1!R560C10 -> 4.1317587268007188 | G521: =IF(RC[-3]<0,0,IF(AND(RC[-3]<RC[-1],RC[-3]<2),100,IF(AND(RC[-3]<RC[-1],RC[-3]>=2,RC[-3]<3),95,IF(AND(RC[-3]<RC[-1],RC[-3]>=3,RC[-3]<4),90,IF(AND(RC[-3]<RC[-1],RC[-3]>=4,RC[-3]<5),85,IF(AND(RC[-3]<RC[-1],RC[-3]>=5,RC[-3]<6),80,IF(AND(RC[-3]<RC[-1],RC[-3]>=6,RC[-3]<7),75,IF(AND(RC[-3]<RC[-1],RC[-3]>=7,RC[-3]<8),70,IF(AND(RC[-3]<RC[-1],RC[-3]>=8,RC[-3]<9),65,IF(AND(RC[-3]<RC[-1],RC[-3]>=9,RC[-3]<10),60,IF(AND(RC[-3]<RC[-1],RC[-3]>=10,RC[-3]<11),55,IF(AND(RC[-3]<RC[-1],RC[-3]>=11,RC[-3]<12),50,IF(AND(RC[-3]<RC[-1],RC[-3]>=12,RC[-3]<13),45,IF(AND(RC[-3]<RC[-1],RC[-3]>=13,RC[-3]<14),40,IF(AND(RC[-3]<RC[-1],RC[-3]>=14,RC[-3]<15),35,IF(AND(RC[-3]<RC[-1],RC[-3]>=15,RC[-3]<16),30,IF(AND(RC[-3]<RC[-1],RC[-3]>=16,RC[-3]<17),25,IF(AND(RC[-3]<RC[-1],RC[-3]>=17,RC[-3]<18),20,IF(AND(RC[-3]<RC[-1],RC[-3]>=18,RC[-3]<19),15,IF(AND(RC[-3]<RC[-1],RC[-3]>=19,RC[-3]<20),10,IF(AND(RC[-3]<RC[-1],RC[-3]>=20,RC[-3]<21),5,IF(AND(RC[-3]<RC[-1],RC[-3]>=21),0,IF(AND(RC[-3]>RC[-1],RC[-3]>=2,RC[-3]<3),90,IF(AND(RC[-3]>RC[-1],RC[-3]>=3,RC[-3]<4),90,IF(AND(RC[-3]>RC[-1],RC[-3]>=4,RC[-3]<5),80,IF(AND(RC[-3]>RC[-1],RC[-3]>=5,RC[-3]<6),70,IF(AND(RC[-3]>RC[-1],RC[-3]>=6,RC[-3]<7),60,IF(AND(RC[-3]>RC[-1],RC[-3]>=7,RC[-3]<8),50,IF(AND(RC[-3]>RC[-1],RC[-3]>=8,RC[-3]<9),40,IF(AND(RC[-3]>RC[-1],RC[-3]>=9,RC[-3]<10),30,IF(AND(RC[-3]>RC[-1],RC[-3]>=10,RC[-3]<11),20,IF(AND(RC[-3]>RC[-1],RC[-3]>=11,RC[-3]<12),10,IF(AND(RC[-3]>RC[-1],RC[-3]>=12),0))))))))))))))))))))))))))))))))) -> 0 | H521: =IF(RC[-3]="","",IF(RC[-3]<0.3,100,IF(AND(RC[-3]>=0.3,RC[-3]>0.4),95,IF(AND(RC[-3]>=0.4,RC[-3]<0.5),90,IF(AND(RC[-3]>=0.5,RC[-3]<0.6),85,IF(AND(RC[-3]>=0.6,RC[-3]<0.7),80,IF(AND(RC[-3]>=0.6,RC[-3]<1),80,IF(AND(RC[-3]>1,RC[-3]<2),50,IF(RC[-3]>2,0))))))))) ->  | I521: =IF(RC[-1]="",RC[-2],0.7*RC[-1]+0.3*RC[-2]) -> 0
A522: سر. نفت | B522: ونفت | C522: =VLOOKUP(RC[-1],Sheet1!R3C2:R802C3,2,FALSE) -> فرآورده های نفتی | D522: =VLOOKUP(RC[-2],Sheet1!R3C2:R802C9,8,FALSE) -> 4.5032853508952702 | E522: =IF(VLOOKUP(RC[-3],Sheet1!R3C2:R803C11,10,FALSE)=0,"",VLOOKUP(Sheet2!RC[-3],Sheet1!R[1]C[-3]:R[801]C[6],10,FALSE)) -> 0.45 | F522: =Sheet1!R560C10 -> 4.1317587268007188 | G522: =IF(RC[-3]<0,0,IF(AND(RC[-3]<RC[-1],RC[-3]<2),100,IF(AND(RC[-3]<RC[-1],RC[-3]>=2,RC[-3]<3),95,IF(AND(RC[-3]<RC[-1],RC[-3]>=3,RC[-3]<4),90,IF(AND(RC[-3]<RC[-1],RC[-3]>=4,RC[-3]<5),85,IF(AND(RC[-3]<RC[-1],RC[-3]>=5,RC[-3]<6),80,IF(AND(RC[-3]<RC[-1],RC[-3]>=6,RC[-3]<7),75,IF(AND(RC[-3]<RC[-1],RC[-3]>=7,RC[-3]<8),70,IF(AND(RC[-3]<RC[-1],RC[-3]>=8,RC[-3]<9),65,IF(AND(RC[-3]<RC[-1],RC[-3]>=9,RC[-3]<10),60,IF(AND(RC[-3]<RC[-1],RC[-3]>=10,RC[-3]<11),55,IF(AND(RC[-3]<RC[-1],RC[-3]>=11,RC[-3]<12),50,IF(AND(RC[-3]<RC[-1],RC[-3]>=12,RC[-3]<13),45,IF(AND(RC[-3]<RC[-1],RC[-3]>=13,RC[-3]<14),40,IF(AND(RC[-3]<RC[-1],RC[-3]>=14,RC[-3]<15),35,IF(AND(RC[-3]<RC[-1],RC[-3]>=15,RC[-3]<16),30,IF(AND(RC[-3]<RC[-1],RC[-3]>=16,RC[-3]<17),25,IF(AND(RC[-3]<RC[-1],RC[-3]>=17,RC[-3]<18),20,IF(AND(RC[-3]<RC[-1],RC[-3]>=18,RC[-3]<19),15,IF(AND(RC[-3]<RC[-1],RC[-3]>=19,RC[-3]<20),10,IF(AND(RC[-3]<RC[-1],RC[-3]>=20,RC[-3]<21),5,IF(AND(RC[-3]<RC[-1],RC[-3]>=21),0,IF(AND(RC[-3]>RC[-1],RC[-3]>=2,RC[-3]<3),90,IF(AND(RC[-3]>RC[-1],RC[-3]>=3,RC[-3]<4),90,IF(AND(RC[-3]>RC[-1],RC[-3]>=4,RC[-3]<5),80,IF(AND(RC[-3]>RC[-1],RC[-3]>=5,RC[-3]<6),70,IF(AND(RC[-3]>RC[-1],RC[-3]>=6,RC[-3]<7),60,IF(AND(RC[-3]>RC[-1],RC[-3]>=7,RC[-3]<8),50,IF(AND(RC[-3]>RC[-1],RC[-3]>=8,RC[-3]<9),40,IF(AND(RC[-3]>RC[-1],RC[-3]>=9,RC[-3]<10),30,IF(AND(RC[-3]>RC[-1],RC[-3]>=10,RC[-3]<11),20,IF(AND(RC[-3]>RC[-1],RC[-3]>=11,RC[-3]<12),10,IF(AND(RC[-3]>RC[-1],RC[-3]>=12),0))))))))))))))))))))))))))))))))) -> 80 | H522: =IF(RC[-3]="","",IF(RC[-3]<0.3,100,IF(AND(RC[-3]>=0.3,RC[-3]>0.4),95,IF(AND(RC[-3]>=0.4,RC[-3]<0.5),90,IF(AND(RC[-3]>=0.5,RC[-3]<0.6),85,IF(AND(RC[-3]>=0.6,RC[-3]<0.7),80,IF(AND(RC[-3]>=0.6,RC[-3]<1),80,IF(AND(RC[-3]>1,RC[-3]<2),50,IF(RC[-3]>2,0))))))))) -> 95 | I522: =IF(RC[-1]="",RC[-2],0.7*RC[-1]+0.3*RC[-2]) -> 90.5
A523: نفت ایرانول | B523: شرانل | C523: =VLOOKUP(RC[-1],Sheet1!R3C2:R802C3,2,FALSE) -> فرآورده های نفتی | D523: =VLOOKUP(RC[-2],Sheet1!R3C2:R802C9,8,FALSE) -> 7 | E523: =IF(VLOOKUP(RC[-3],Sheet1!R3C2:R803C11,10,FALSE)=0,"",VLOOKUP(Sheet2!RC[-3],Sheet1!R[1]C[-3]:R[801]C[6],10,FALSE)) ->  | F523: =Sheet1!R560C10 -> 4.1317587268007188 | G523: =IF(RC[-3]<0,0,IF(AND(RC[-3]<RC[-1],RC[-3]<2),100,IF(AND(RC[-3]<RC[-1],RC[-3]>=2,RC[-3]<3),95,IF(AND(RC[-3]<RC[-1],RC[-3]>=3,RC[-3]<4),90,IF(AND(RC[-3]<RC[-1],RC[-3]>=4,RC[-3]<5),85,IF(AND(RC[-3]<RC[-1],RC[-3]>=5,RC[-3]<6),80,IF(AND(RC[-3]<RC[-1],RC[-3]>=6,RC[-3]<7),75,IF(AND(RC[-3]<RC[-1],RC[-3]>=7,RC[-3]<8),70,IF(AND(RC[-3]<RC[-1],RC[-3]>=8,RC[-3]<9),65,IF(AND(RC[-3]<RC[-1],RC[-3]>=9,RC[-3]<10),60,IF(AND(RC[-3]<RC[-1],RC[-3]>=10,RC[-3]<11),55,IF(AND(RC[-3]<RC[-1],RC[-3]>=11,RC[-3]<12),50,IF(AND(RC[-3]<RC[-1],RC[-3]>=12,RC[-3]<13),45,IF(AND(RC[-3]<RC[-1],RC[-3]>=13,RC[-3]<14),40,IF(AND(RC[-3]<RC[-1],RC[-3]>=14,RC[-3]<15),35,IF(AND(RC[-3]<RC[-1],RC[-3]>=15,RC[-3]<16),30,IF(AND(RC[-3]<RC[-1],RC[-3]>=16,RC[-3]<17),25,IF(AND(RC[-3]<RC[-1],RC[-3]>=17,RC[-3]<18),20,IF(AND(RC[-3]<RC[-1],RC[-3]>=18,RC[-3]<19),15,IF(AND(RC[-3]<RC[-1],RC[-3]>=19,RC[-3]<20),10,IF(AND(RC[-3]<RC[-1],RC[-3]>=20,RC[-3]<21),5,IF(AND(RC[-3]<RC[-1],RC[-3]>=21),0,IF(AND(RC[-3]>RC[-1],RC[-3]>=2,RC[-3]<3),90,IF(AND(RC[-3]>RC[-1],RC[-3]>=3,RC[-3]<4),90,IF(AND(RC[-3]>RC[-1],RC[-3]>=4,RC[-3]<5),80,IF(AND(RC[-3]>RC[-1],RC[-3]>=5,RC[-3]<6),70,IF(AND(RC[-3]>RC[-1],RC[-3]>=6,RC[-3]<7),60,IF(AND(RC[-3]>RC[-1],RC[-3]>=7,RC[-3]<8),50,IF(AND(RC[-3]>RC[-1],RC[-3]>=8,RC[-3]<9),40,IF(AND(RC[-3]>RC[-1],RC[-3]>=9,RC[-3]<10),30,IF(AND(RC[-3]>RC[-1],RC[-3]>=10,RC[-3]<11),20,IF(AND(RC[-3]>RC[-1],RC[-3]>=11,RC[-3]<12),10,IF(AND(RC[-3]>RC[-1],RC[-3]>=12),0))))))))))))))))))))))))))))))))) -> 50 | H523: =IF(RC[-3]="","",IF(RC[-3]<0.3,100,IF(AND(RC[-3]>=0.3,RC[-3]>0.4),95,IF(AND(RC[-3]>=0.4,RC[-3]<0.5),90,IF(AND(RC[-3]>=0.5,RC[-3]<0.6),85,IF(AND(RC[-3]>=0.6,RC[-3]<0.7),80,IF(AND(RC[-3]>=0.6,RC[-3]<1),80,IF(AND(RC[-3]>1,RC[-3]<2),50,IF(RC[-3]>2,0))))))))) ->  | I523: =IF(RC[-1]="",RC[-2],0.7*RC[-1]+0.3*RC[-2]) -> 50
A524: نفت بهران | B524: شبهرن | C524: =VLOOKUP(RC[-1],Sheet1!R3C2:R802C3,2,FALSE) -> فرآورده های نفتی | D524: =VLOOKUP(RC[-2],Sheet1!R3C2:R802C9,8,FALSE) -> 5.0265122420505417 | E524: =IF(VLOOKUP(RC[-3],Sheet1!R3C2:R803C11,10,FALSE)=0,"",VLOOKUP(Sheet2!RC[-3],Sheet1!R[1]C[-3]:R[801]C[6],10,FALSE)) ->  | F524: =Sheet1!R560C10 -> 4.1317587268007188 | G524: =IF(RC[-3]<0,0,IF(AND(RC[-3]<RC[-1],RC[-3]<2),100,IF(AND(RC[-3]<RC[-1],RC[-3]>=2,RC[-3]<3),95,IF(AND(RC[-3]<RC[-1],RC[-3]>=3,RC[-3]<4),90,IF(AND(RC[-3]<RC[-1],RC[-3]>=4,RC[-3]<5),85,IF(AND(RC[-3]<RC[-1],RC[-3]>=5,RC[-3]<6),80,IF(AND(RC[-3]<RC[-1],RC[-3]>=6,RC[-3]<7),75,IF(AND(RC[-3]<RC[-1],RC[-3]>=7,RC[-3]<8),70,IF(AND(RC[-3]<RC[-1],RC[-3]>=8,RC[-3]<9),65,IF(AND(RC[-3]<RC[-1],RC[-3]>=9,RC[-3]<10),60,IF(AND(RC[-3]<RC[-1],RC[-3]>=10,RC[-3]<11),55,IF(AND(RC[-3]<RC[-1],RC[-3]>=11,RC[-3]<12),50,IF(AND(RC[-3]<RC[-1],RC[-3]>=12,RC[-3]<13),45,IF(AND(RC[-3]<RC[-1],RC[-3]>=13,RC[-3]<14),40,IF(AND(RC[-3]<RC[-1],RC[-3]>=14,RC[-3]<15),35,IF(AND(RC[-3]<RC[-1],RC[-3]>=15,RC[-3]<16),30,IF(AND(RC[-3]<RC[-1],RC[-3]>=16,RC[-3]<17),25,IF(AND(RC[-3]<RC[-1],RC[-3]>=17,RC[-3]<18),20,IF(AND(RC[-3]<RC[-1],RC[-3]>=18,RC[-3]<19),15,IF(AND(RC[-3]<RC[-1],RC[-3]>=19,RC[-3]<20),10,IF(AND(RC[-3]<RC[-1],RC[-3]>=20,RC[-3]<21),5,IF(AND(RC[-3]<RC[-1],RC[-3]>=21),0,IF(AND(RC[-3]>RC[-1],RC[-3]>=2,RC[-3]<3),90,IF(AND(RC[-3]>RC[-1],RC[-3]>=3,RC[-3]<4),90,IF(AND(RC[-3]>RC[-1],RC[-3]>=4,RC[-3]<5),80,IF(AND(RC[-3]>RC[-1],RC[-3]>=5,RC[-3]<6),70,IF(AND(RC[-3]>RC[-1],RC[-3]>=6,RC[-3]<7),60,IF(AND(RC[-3]>RC[-1],RC[-3]>=7,RC[-3]<8),50,IF(AND(RC[-3]>RC[-1],RC[-3]>=8,RC[-3]<9),40,IF(AND(RC[-3]>RC[-1],RC[-3]>=9,RC[-3]<10),30,IF(AND(RC[-3]>RC[-1],RC[-3]>=10,RC[-3]<11),20,IF(AND(RC[-3]>RC[-1],RC[-3]>=11,RC[-3]<12),10,IF(AND(RC[-3]>RC[-1],RC[-3]>=12),0))))))))))))))))))))))))))))))))) -> 70 | H524: =IF(RC[-3]="","",IF(RC[-3]<0.3,100,IF(AND(RC[-3]>=0.3,RC[-3]>0.4),95,IF(AND(RC[-3]>=0.4,RC[-3]<0.5),90,IF(AND(RC[-3]>=0.5,RC[-3]<0.6),85,IF(AND(RC[-3]>=0.6,RC[-3]<0.7),80,IF(AND(RC[-3]>=0.6,RC[-3]<1),80,IF(AND(RC[-3]>1,RC[-3]<2),50,IF(RC[-3]>2,0))))))))) ->  | I524: =IF(RC[-1]="",RC[-2],0.7*RC[-1]+0.3*RC[-2]) -> 70
A525: نفت پارس | B525: شنفت | C525: =VLOOKUP(RC[-1],Sheet1!R3C2:R802C3,2,FALSE) -> فرآورده های نفتی | D525: =VLOOKUP(RC[-2],Sheet1!R3C2:R802C9,8,FALSE) -> 5.6939249401962559 | E525: =IF(VLOOKUP(RC[-3],Sheet1!R3C2:R803C11,10,FALSE)=0,"",VLOOKUP(Sheet2!RC[-3],Sheet1!R[1]C[-3]:R[801]C[6],10,FALSE)) ->  | F525: =Sheet1!R560C10 -> 4.1317587268007188 | G525: =IF(RC[-3]<0,0,IF(AND(RC[-3]<RC[-1],RC[-3]<2),100,IF(AND(RC[-3]<RC[-1],RC[-3]>=2,RC[-3]<3),95,IF(AND(RC[-3]<RC[-1],RC[-3]>=3,RC[-3]<4),90,IF(AND(RC[-3]<RC[-1],RC[-3]>=4,RC[-3]<5),85,IF(AND(RC[-3]<RC[-1],RC[-3]>=5,RC[-3]<6),80,IF(AND(RC[-3]<RC[-1],RC[-3]>=6,RC[-3]<7),75,IF(AND(RC[-3]<RC[-1],RC[-3]>=7,RC[-3]<8),70,IF(AND(RC[-3]<RC[-1],RC[-3]>=8,RC[-3]<9),65,IF(AND(RC[-3]<RC[-1],RC[-3]>=9,RC[-3]<10),60,IF(AND(RC[-3]<RC[-1],RC[-3]>=10,RC[-3]<11),55,IF(AND(RC[-3]<RC[-1],RC[-3]>=11,RC[-3]<12),50,IF(AND(RC[-3]<RC[-1],RC[-3]>=12,RC[-3]<13),45,IF(AND(RC[-3]<RC[-1],RC[-3]>=13,RC[-3]<14),40,IF(AND(RC[-3]<RC[-1],RC[-3]>=14,RC[-3]<15),35,IF(AND(RC[-3]<RC[-1],RC[-3]>=15,RC[-3]<16),30,IF(AND(RC[-3]<RC[-1],RC[-3]>=16,RC[-3]<17),25,IF(AND(RC[-3]<RC[-1],RC[-3]>=17,RC[-3]<18),20,IF(AND(RC[-3]<RC[-1],RC[-3]>=18,RC[-3]<19),15,IF(AND(RC[-3]<RC[-1],RC[-3]>=19,RC[-3]<20),10,IF(AND(RC[-3]<RC[-1],RC[-3]>=20,RC[-3]<21),5,IF(AND(RC[-3]<RC[-1],RC[-3]>=21),0,IF(AND(RC[-3]>RC[-1],RC[-3]>=2,RC[-3]<3),90,IF(AND(RC[-3]>RC[-1],RC[-3]>=3,RC[-3]<4),90,IF(AND(RC[-3]>RC[-1],RC[-3]>=4,RC[-3]<5),80,IF(AND(RC[-3]>RC[-1],RC[-3]>=5,RC[-3]<6),70,IF(AND(RC[-3]>RC[-1],RC[-3]>=6,RC[-3]<7),60,IF(AND(RC[-3]>RC[-1],RC[-3]>=7,RC[-3]<8),50,IF(AND(RC[-3]>RC[-1],RC[-3]>=8,RC[-3]<9),40,IF(AND(RC[-3]>RC[-1],RC[-3]>=9,RC[-3]<10),30,IF(AND(RC[-3]>RC[-1],RC[-3]>=10,RC[-3]<11),20,IF(AND(RC[-3]>RC[-1],RC[-3]>=11,RC[-3]<12),10,IF(AND(RC[-3]>RC[-1],RC[-3]>=12),0))))))))))))))))))))))))))))))))) -> 70 | H525: =IF(RC[-3]="","",IF(RC[-3]<0.3,100,IF(AND(RC[-3]>=0.3,RC[-3]>0.4),95,IF(AND(RC[-3]>=0.4,RC[-3]<0.5),90,IF(AND(RC[-3]>=0.5,RC[-3]<0.6),85,IF(AND(RC[-3]>=0.6,RC[-3]<0.7),80,IF(AND(RC[-3]>=0.6,RC[-3]<1),80,IF(AND(RC[-3]>1,RC[-3]<2),50,IF(RC[-3]>2,0))))))))) ->  | I525: =IF(RC[-1]="",RC[-2],0.7*RC[-1]+0.3*RC[-2]) -> 70
A526: نفت پاسارگاد | B526: شپاس | C526: =VLOOKUP(RC[-1],Sheet1!R3C2:R802C3,2,FALSE) -> فرآورده های نفتی | D526: =VLOOKUP(RC[-2],Sheet1!R3C2:R802C9,8,FALSE) -> 3.7505593060788747 | E526: =IF(VLOOKUP(RC[-3],Sheet1!R3C2:R803C11,10,FALSE)=0,"",VLOOKUP(Sheet2!RC[-3],Sheet1!R[1]C[-3]:R[801]C[6],10,FALSE)) ->  | F526: =Sheet1!R560C10 -> 4.1317587268007188 | G526: =IF(RC[-3]<0,0,IF(AND(RC[-3]<RC[-1],RC[-3]<2),100,IF(AND(RC[-3]<RC[-1],RC[-3]>=2,RC[-3]<3),95,IF(AND(RC[-3]<RC[-1],RC[-3]>=3,RC[-3]<4),90,IF(AND(RC[-3]<RC[-1],RC[-3]>=4,RC[-3]<5),85,IF(AND(RC[-3]<RC[-1],RC[-3]>=5,RC[-3]<6),80,IF(AND(RC[-3]<RC[-1],RC[-3]>=6,RC[-3]<7),75,IF(AND(RC[-3]<RC[-1],RC[-3]>=7,RC[-3]<8),70,IF(AND(RC[-3]<RC[-1],RC[-3]>=8,RC[-3]<9),65,IF(AND(RC[-3]<RC[-1],RC[-3]>=9,RC[-3]<10),60,IF(AND(RC[-3]<RC[-1],RC[-3]>=10,RC[-3]<11),55,IF(AND(RC[-3]<RC[-1],RC[-3]>=11,RC[-3]<12),50,IF(AND(RC[-3]<RC[-1],RC[-3]>=12,RC[-3]<13),45,IF(AND(RC[-3]<RC[-1],RC[-3]>=13,RC[-3]<14),40,IF(AND(RC[-3]<RC[-1],RC[-3]>=14,RC[-3]<15),35,IF(AND(RC[-3]<RC[-1],RC[-3]>=15,RC[-3]<16),30,IF(AND(RC[-3]<RC[-1],RC[-3]>=16,RC[-3]<17),25,IF(AND(RC[-3]<RC[-1],RC[-3]>=17,RC[-3]<18),20,IF(AND(RC[-3]<RC[-1],RC[-3]>=18,RC[-3]<19),15,IF(AND(RC[-3]<RC[-1],RC[-3]>=19,RC[-3]<20),10,IF(AND(RC[-3]<RC[-1],RC[-3]>=20,RC[-3]<21),5,IF(AND(RC[-3]<RC[-1],RC[-3]>=21),0,IF(AND(RC[-3]>RC[-1],RC[-3]>=2,RC[-3]<3),90,IF(AND(RC[-3]>RC[-1],RC[-3]>=3,RC[-3]<4),90,IF(AND(RC[-3]>RC[-1],RC[-3]>=4,RC[-3]<5),80,IF(AND(RC[-3]>RC[-1],RC[-3]>=5,RC[-3]<6),70,IF(AND(RC[-3]>RC[-1],RC[-3]>=6,RC[-3]<7),60,IF(AND(RC[-3]>RC[-1],RC[-3]>=7,RC[-3]<8),50,IF(AND(RC[-3]>RC[-1],RC[-3]>=8,RC[-3]<9),40,IF(AND(RC[-3]>RC[-1],RC[-3]>=9,RC[-3]<10),30,IF(AND(RC[-3]>RC[-1],RC[-3]>=10,RC[-3]<11),20,IF(AND(RC[-3]>RC[-1],RC[-3]>=11,RC[-3]<12),10,IF(AND(RC[-3]>RC[-1],RC[-3]>=12),0))))))))))))))))))))))))))))))))) -> 90 | H526: =IF(RC[-3]="","",IF(RC[-3]<0.3,100,IF(AND(RC[-3]>=0.3,RC[-3]>0.4),95,IF(AND(RC[-3]>=0.4,RC[-3]<0.5),90,IF(AND(RC[-3]>=0.5,RC[-3]<0.6),85,IF(AND(RC[-3]>=0.6,RC[-3]<0.7),80,IF(AND(RC[-3]>=0.6,RC[-3]<1),80,IF(AND(RC[-3]>1,RC[-3]<2),50,IF(RC[-3]>2,0))))))))) ->  | I526: =IF(RC[-1]="",RC[-2],0.7*RC[-1]+0.3*RC[-2]) -> 90
A527: نفت سپاهان | B527: شسپا | C527: =VLOOKUP(RC[-1],Sheet1!R3C2:R802C3,2,FALSE) -> فرآورده های نفتی | D527: =VLOOKUP(RC[-2],Sheet1!R3C2:R802C9,8,FALSE) -> 3.943497518431569 | E527: =IF(VLOOKUP(RC[-3],Sheet1!R3C2:R803C11,10,FALSE)=0,"",VLOOKUP(Sheet2!RC[-3],Sheet1!R[1]C[-3]:R[801]C[6],10,FALSE)) ->  | F527: =Sheet1!R560C10 -> 4.1317587268007188 | G527: =IF(RC[-3]<0,0,IF(AND(RC[-3]<RC[-1],RC[-3]<2),100,IF(AND(RC[-3]<RC[-1],RC[-3]>=2,RC[-3]<3),95,IF(AND(RC[-3]<RC[-1],RC[-3]>=3,RC[-3]<4),90,IF(AND(RC[-3]<RC[-1],RC[-3]>=4,RC[-3]<5),85,IF(AND(RC[-3]<RC[-1],RC[-3]>=5,RC[-3]<6),80,IF(AND(RC[-3]<RC[-1],RC[-3]>=6,RC[-3]<7),75,IF(AND(RC[-3]<RC[-1],RC[-3]>=7,RC[-3]<8),70,IF(AND(RC[-3]<RC[-1],RC[-3]>=8,RC[-3]<9),65,IF(AND(RC[-3]<RC[-1],RC[-3]>=9,RC[-3]<10),60,IF(AND(RC[-3]<RC[-1],RC[-3]>=10,RC[-3]<11),55,IF(AND(RC[-3]<RC[-1],RC[-3]>=11,RC[-3]<12),50,IF(AND(RC[-3]<RC[-1],RC[-3]>=12,RC[-3]<13),45,IF(AND(RC[-3]<RC[-1],RC[-3]>=13,RC[-3]<14),40,IF(AND(RC[-3]<RC[-1],RC[-3]>=14,RC[-3]<15),35,IF(AND(RC[-3]<RC[-1],RC[-3]>=15,RC[-3]<16),30,IF(AND(RC[-3]<RC[-1],RC[-3]>=16,RC[-3]<17),25,IF(AND(RC[-3]<RC[-1],RC[-3]>=17,RC[-3]<18),20,IF(AND(RC[-3]<RC[-1],RC[-3]>=18,RC[-3]<19),15,IF(AND(RC[-3]<RC[-1],RC[-3]>=19,RC[-3]<20),10,IF(AND(RC[-3]<RC[-1],RC[-3]>=20,RC[-3]<21),5,IF(AND(RC[-3]<RC[-1],RC[-3]>=21),0,IF(AND(RC[-3]>RC[-1],RC[-3]>=2,RC[-3]<3),90,IF(AND(RC[-3]>RC[-1],RC[-3]>=3,RC[-3]<4),90,IF(AND(RC[-3]>RC[-1],RC[-3]>=4,RC[-3]<5),80,IF(AND(RC[-3]>RC[-1],RC[-3]>=5,RC[-3]<6),70,IF(AND(RC[-3]>RC[-1],RC[-3]>=6,RC[-3]<7),60,IF(AND(RC[-3]>RC[-1],RC[-3]>=7,RC[-3]<8),50,IF(AND(RC[-3]>RC[-1],RC[-3]>=8,RC[-3]<9),40,IF(AND(RC[-3]>RC[-1],RC[-3]>=9,RC[-3]<10),30,IF(AND(RC[-3]>RC[-1],RC[-3]>=10,RC[-3]<11),20,IF(AND(RC[-3]>RC[-1],RC[-3]>=11,RC[-3]<12),10,IF(AND(RC[-3]>RC[-1],RC[-3]>=12),0))))))))))))))))))))))))))))))))) -> 90 | H527: =IF(RC[-3]="","",IF(RC[-3]<0.3,100,IF(AND(RC[-3]>=0.3,RC[-3]>0.4),95,IF(AND(RC[-3]>=0.4,RC[-3]<0.5),90,IF(AND(RC[-3]>=0.5,RC[-3]<0.6),85,IF(AND(RC[-3]>=0.6,RC[-3]<0.7),80,IF(AND(RC[-3]>=0.6,RC[-3]<1),80,IF(AND(RC[-3]>1,RC[-3]<2),50,IF(RC[-3]>2,0))))))))) ->  | I527: =IF(RC[-1]="",RC[-2],0.7*RC[-1]+0.3*RC[-2]) -> 90
A528: بورس اوراق بهادار تهران | B528: بورس | C528: =VLOOKUP(RC[-1],Sheet1!R3C2:R802C3,2,FALSE) -> فعالیتهای کمکی به نهاد های مالی واسط | D528: =VLOOKUP(RC[-2],Sheet1!R3C2:R802C9,8,FALSE) -> 15.11936349210912 | E528: =IF(VLOOKUP(RC[-3],Sheet1!R3C2:R803C11,10,FALSE)=0,"",VLOOKUP(Sheet2!RC[-3],Sheet1!R[1]C[-3]:R[801]C[6],10,FALSE)) ->  | F528: =Sheet1!R582C10 -> 20.545875985533669 | G528: =IF(RC[-3]<0,0,IF(AND(RC[-3]<RC[-1],RC[-3]<2),100,IF(AND(RC[-3]<RC[-1],RC[-3]>=2,RC[-3]<3),95,IF(AND(RC[-3]<RC[-1],RC[-3]>=3,RC[-3]<4),90,IF(AND(RC[-3]<RC[-1],RC[-3]>=4,RC[-3]<5),85,IF(AND(RC[-3]<RC[-1],RC[-3]>=5,RC[-3]<6),80,IF(AND(RC[-3]<RC[-1],RC[-3]>=6,RC[-3]<7),75,IF(AND(RC[-3]<RC[-1],RC[-3]>=7,RC[-3]<8),70,IF(AND(RC[-3]<RC[-1],RC[-3]>=8,RC[-3]<9),65,IF(AND(RC[-3]<RC[-1],RC[-3]>=9,RC[-3]<10),60,IF(AND(RC[-3]<RC[-1],RC[-3]>=10,RC[-3]<11),55,IF(AND(RC[-3]<RC[-1],RC[-3]>=11,RC[-3]<12),50,IF(AND(RC[-3]<RC[-1],RC[-3]>=12,RC[-3]<13),45,IF(AND(RC[-3]<RC[-1],RC[-3]>=13,RC[-3]<14),40,IF(AND(RC[-3]<RC[-1],RC[-3]>=14,RC[-3]<15),35,IF(AND(RC[-3]<RC[-1],RC[-3]>=15,RC[-3]<16),30,IF(AND(RC[-3]<RC[-1],RC[-3]>=16,RC[-3]<17),25,IF(AND(RC[-3]<RC[-1],RC[-3]>=17,RC[-3]<18),20,IF(AND(RC[-3]<RC[-1],RC[-3]>=18,RC[-3]<19),15,IF(AND(RC[-3]<RC[-1],RC[-3]>=19,RC[-3]<20),10,IF(AND(RC[-3]<RC[-1],RC[-3]>=20,RC[-3]<21),5,IF(AND(RC[-3]<RC[-1],RC[-3]>=21),0,IF(AND(RC[-3]>RC[-1],RC[-3]>=2,RC[-3]<3),90,IF(AND(RC[-3]>RC[-1],RC[-3]>=3,RC[-3]<4),90,IF(AND(RC[-3]>RC[-1],RC[-3]>=4,RC[-3]<5),80,IF(AND(RC[-3]>RC[-1],RC[-3]>=5,RC[-3]<6),70,IF(AND(RC[-3]>RC[-1],RC[-3]>=6,RC[-3]<7),60,IF(AND(RC[-3]>RC[-1],RC[-3]>=7,RC[-3]<8),50,IF(AND(RC[-3]>RC[-1],RC[-3]>=8,RC[-3]<9),40,IF(AND(RC[-3]>RC[-1],RC[-3]>=9,RC[-3]<10),30,IF(AND(RC[-3]>RC[-1],RC[-3]>=10,RC[-3]<11),20,IF(AND(RC[-3]>RC[-1],RC[-3]>=11,RC[-3]<12),10,IF(AND(RC[-3]>RC[-1],RC[-3]>=12),0))))))))))))))))))))))))))))))))) -> 30 | H528: =IF(RC[-3]="","",IF(RC[-3]<0.3,100,IF(AND(RC[-3]>=0.3,RC[-3]>0.4),95,IF(AND(RC[-3]>=0.4,RC[-3]<0.5),90,IF(AND(RC[-3]>=0.5,RC[-3]<0.6),85,IF(AND(RC[-3]>=0.6,RC[-3]<0.7),80,IF(AND(RC[-3]>=0.6,RC[-3]<1),80,IF(AND(RC[-3]>1,RC[-3]<2),50,IF(RC[-3]>2,0))))))))) ->  | I528: =IF(RC[-1]="",RC[-2],0.7*RC[-1]+0.3*RC[-2]) -> 30
A529: بورس کالای ایران | B529: کالا | C529: =VLOOKUP(RC[-1],Sheet1!R3C2:R802C3,2,FALSE) -> فعالیتهای کمکی به نهاد های مالی واسط | D529: =VLOOKUP(RC[-2],Sheet1!R3C2:R802C9,8,FALSE) -> 15.851052345127336 | E529: =IF(VLOOKUP(RC[-3],Sheet1!R3C2:R803C11,10,FALSE)=0,"",VLOOKUP(Sheet2!RC[-3],Sheet1!R[1]C[-3]:R[801]C[6],10,FALSE)) ->  | F529: =Sheet1!R582C10 -> 20.545875985533669 | G529: =IF(RC[-3]<0,0,IF(AND(RC[-3]<RC[-1],RC[-3]<2),100,IF(AND(RC[-3]<RC[-1],RC[-3]>=2,RC[-3]<3),95,IF(AND(RC[-3]<RC[-1],RC[-3]>=3,RC[-3]<4),90,IF(AND(RC[-3]<RC[-1],RC[-3]>=4,RC[-3]<5),85,IF(AND(RC[-3]<RC[-1],RC[-3]>=5,RC[-3]<6),80,IF(AND(RC[-3]<RC[-1],RC[-3]>=6,RC[-3]<7),75,IF(AND(RC[-3]<RC[-1],RC[-3]>=7,RC[-3]<8),70,IF(AND(RC[-3]<RC[-1],RC[-3]>=8,RC[-3]<9),65,IF(AND(RC[-3]<RC[-1],RC[-3]>=9,RC[-3]<10),60,IF(AND(RC[-3]<RC[-1],RC[-3]>=10,RC[-3]<11),55,IF(AND(RC[-3]<RC[-1],RC[-3]>=11,RC[-3]<12),50,IF(AND(RC[-3]<RC[-1],RC[-3]>=12,RC[-3]<13),45,IF(AND(RC[-3]<RC[-1],RC[-3]>=13,RC[-3]<14),40,IF(AND(RC[-3]<RC[-1],RC[-3]>=14,RC[-3]<15),35,IF(AND(RC[-3]<RC[-1],RC[-3]>=15,RC[-3]<16),30,IF(AND(RC[-3]<RC[-1],RC[-3]>=16,RC[-3]<17),25,IF(AND(RC[-3]<RC[-1],RC[-3]>=17,RC[-3]<18),20,IF(AND(RC[-3]<RC[-1],RC[-3]>=18,RC[-3]<19),15,IF(AND(RC[-3]<RC[-1],RC[-3]>=19,RC[-3]<20),10,IF(AND(RC[-3]<RC[-1],RC[-3]>=20,RC[-3]<21),5,IF(AND(RC[-3]<RC[-1],RC[-3]>=21),0,IF(AND(RC[-3]>RC[-1],RC[-3]>=2,RC[-3]<3),90,IF(AND(RC[-3]>RC[-1],RC[-3]>=3,RC[-3]<4),90,IF(AND(RC[-3]>RC[-1],RC[-3]>=4,RC[-3]<5),80,IF(AND(RC[-3]>RC[-1],RC[-3]>=5,RC[-3]<6),70,IF(AND(RC[-3]>RC[-1],RC[-3]>=6,RC[-3]<7),60,IF(AND(RC[-3]>RC[-1],RC[-3]>=7,RC[-3]<8),50,IF(AND(RC[-3]>RC[-1],RC[-3]>=8,RC[-3]<9),40,IF(AND(RC[-3]>RC[-1],RC[-3]>=9,RC[-3]<10),30,IF(AND(RC[-3]>RC[-1],RC[-3]>=10,RC[-3]<11),20,IF(AND(RC[-3]>RC[-1],RC[-3]>=11,RC[-3]<12),10,IF(AND(RC[-3]>RC[-1],RC[-3]>=12),0))))))))))))))))))))))))))))))))) -> 30 | H529: =IF(RC[-3]="","",IF(RC[-3]<0.3,100,IF(AND(RC[-3]>=0.3,RC[-3]>0.4),95,IF(AND(RC[-3]>=0.4,RC[-3]<0.5),90,IF(AND(RC[-3]>=0.5,RC[-3]<0.6),85,IF(AND(RC[-3]>=0.6,RC[-3]<0.7),80,IF(AND(RC[-3]>=0.6,RC[-3]<1),80,IF(AND(RC[-3]>1,RC[-3]<2),50,IF(RC[-3]>2,0))))))))) ->  | I529: =IF(RC[-1]="",RC[-2],0.7*RC[-1]+0.3*RC[-2]) -> 30
A530: تامین سرمایه امید | B530: امید | C530: =VLOOKUP(RC[-1],Sheet1!R3C2:R802C3,2,FALSE) -> فعالیتهای کمکی به نهاد های مالی واسط | D530: =VLOOKUP(RC[-2],Sheet1!R3C2:R802C9,8,FALSE) -> 7.4790203767500003 | E530: =IF(VLOOKUP(RC[-3],Sheet1!R3C2:R803C11,10,FALSE)=0,"",VLOOKUP(Sheet2!RC[-3],Sheet1!R[1]C[-3]:R[801]C[6],10,FALSE)) ->  | F530: =Sheet1!R582C10 -> 20.545875985533669 | G530: =IF(RC[-3]<0,0,IF(AND(RC[-3]<RC[-1],RC[-3]<2),100,IF(AND(RC[-3]<RC[-1],RC[-3]>=2,RC[-3]<3),95,IF(AND(RC[-3]<RC[-1],RC[-3]>=3,RC[-3]<4),90,IF(AND(RC[-3]<RC[-1],RC[-3]>=4,RC[-3]<5),85,IF(AND(RC[-3]<RC[-1],RC[-3]>=5,RC[-3]<6),80,IF(AND(RC[-3]<RC[-1],RC[-3]>=6,RC[-3]<7),75,IF(AND(RC[-3]<RC[-1],RC[-3]>=7,RC[-3]<8),70,IF(AND(RC[-3]<RC[-1],RC[-3]>=8,RC[-3]<9),65,IF(AND(RC[-3]<RC[-1],RC[-3]>=9,RC[-3]<10),60,IF(AND(RC[-3]<RC[-1],RC[-3]>=10,RC[-3]<11),55,IF(AND(RC[-3]<RC[-1],RC[-3]>=11,RC[-3]<12),50,IF(AND(RC[-3]<RC[-1],RC[-3]>=12,RC[-3]<13),45,IF(AND(RC[-3]<RC[-1],RC[-3]>=13,RC[-3]<14),40,IF(AND(RC[-3]<RC[-1],RC[-3]>=14,RC[-3]<15),35,IF(AND(RC[-3]<RC[-1],RC[-3]>=15,RC[-3]<16),30,IF(AND(RC[-3]<RC[-1],RC[-3]>=16,RC[-3]<17),25,IF(AND(RC[-3]<RC[-1],RC[-3]>=17,RC[-3]<18),20,IF(AND(RC[-3]<RC[-1],RC[-3]>=18,RC[-3]<19),15,IF(AND(RC[-3]<RC[-1],RC[-3]>=19,RC[-3]<20),10,IF(AND(RC[-3]<RC[-1],RC[-3]>=20,RC[-3]<21),5,IF(AND(RC[-3]<RC[-1],RC[-3]>=21),0,IF(AND(RC[-3]>RC[-1],RC[-3]>=2,RC[-3]<3),90,IF(AND(RC[-3]>RC[-1],RC[-3]>=3,RC[-3]<4),90,IF(AND(RC[-3]>RC[-1],RC[-3]>=4,RC[-3]<5),80,IF(AND(RC[-3]>RC[-1],RC[-3]>=5,RC[-3]<6),70,IF(AND(RC[-3]>RC[-1],RC[-3]>=6,RC[-3]<7),60,IF(AND(RC[-3]>RC[-1],RC[-3]>=7,RC[-3]<8),50,IF(AND(RC[-3]>RC[-1],RC[-3]>=8,RC[-3]<9),40,IF(AND(RC[-3]>RC[-1],RC[-3]>=9,RC[-3]<10),30,IF(AND(RC[-3]>RC[-1],RC[-3]>=10,RC[-3]<11),20,IF(AND(RC[-3]>RC[-1],RC[-3]>=11,RC[-3]<12),10,IF(AND(RC[-3]>RC[-1],RC[-3]>=12),0))))))))))))))))))))))))))))))))) -> 70 | H530: =IF(RC[-3]="","",IF(RC[-3]<0.3,100,IF(AND(RC[-3]>=0.3,RC[-3]>0.4),95,IF(AND(RC[-3]>=0.4,RC[-3]<0.5),90,IF(AND(RC[-3]>=0.5,RC[-3]<0.6),85,IF(AND(RC[-3]>=0.6,RC[-3]<0.7),80,IF(AND(RC[-3]>=0.6,RC[-3]<1),80,IF(AND(RC[-3]>1,RC[-3]<2),50,IF(RC[-3]>2,0))))))))) ->  | I530: =IF(RC[-1]="",RC[-2],0.7*RC[-1]+0.3*RC[-2]) -> 70
A531: تامین سرمایه امین | B531: امین | C531: =VLOOKUP(RC[-1],Sheet1!R3C2:R802C3,2,FALSE) -> فعالیتهای کمکی به نهاد های مالی واسط | D531: =VLOOKUP(RC[-2],Sheet1!R3C2:R802C9,8,FALSE) -> 10.850883354808451 | E531: =IF(VLOOKUP(RC[-3],Sheet1!R3C2:R803C11,10,FALSE)=0,"",VLOOKUP(Sheet2!RC[-3],Sheet1!R[1]C[-3]:R[801]C[6],10,FALSE)) ->  | F531: =Sheet1!R582C10 -> 20.545875985533669 | G531: =IF(RC[-3]<0,0,IF(AND(RC[-3]<RC[-1],RC[-3]<2),100,IF(AND(RC[-3]<RC[-1],RC[-3]>=2,RC[-3]<3),95,IF(AND(RC[-3]<RC[-1],RC[-3]>=3,RC[-3]<4),90,IF(AND(RC[-3]<RC[-1],RC[-3]>=4,RC[-3]<5),85,IF(AND(RC[-3]<RC[-1],RC[-3]>=5,RC[-3]<6),80,IF(AND(RC[-3]<RC[-1],RC[-3]>=6,RC[-3]<7),75,IF(AND(RC[-3]<RC[-1],RC[-3]>=7,RC[-3]<8),70,IF(AND(RC[-3]<RC[-1],RC[-3]>=8,RC[-3]<9),65,IF(AND(RC[-3]<RC[-1],RC[-3]>=9,RC[-3]<10),60,IF(AND(RC[-3]<RC[-1],RC[-3]>=10,RC[-3]<11),55,IF(AND(RC[-3]<RC[-1],RC[-3]>=11,RC[-3]<12),50,IF(AND(RC[-3]<RC[-1],RC[-3]>=12,RC[-3]<13),45,IF(AND(RC[-3]<RC[-1],RC[-3]>=13,RC[-3]<14),40,IF(AND(RC[-3]<RC[-1],RC[-3]>=14,RC[-3]<15),35,IF(AND(RC[-3]<RC[-1],RC[-3]>=15,RC[-3]<16),30,IF(AND(RC[-3]<RC[-1],RC[-3]>=16,RC[-3]<17),25,IF(AND(RC[-3]<RC[-1],RC[-3]>=17,RC[-3]<18),20,IF(AND(RC[-3]<RC[-1],RC[-3]>=18,RC[-3]<19),15,IF(AND(RC[-3]<RC[-1],RC[-3]>=19,RC[-3]<20),10,IF(AND(RC[-3]<RC[-1],RC[-3]>=20,RC[-3]<21),5,IF(AND(RC[-3]<RC[-1],RC[-3]>=21),0,IF(AND(RC[-3]>RC[-1],RC[-3]>=2,RC[-3]<3),90,IF(AND(RC[-3]>RC[-1],RC[-3]>=3,RC[-3]<4),90,IF(AND(RC[-3]>RC[-1],RC[-3]>=4,RC[-3]<5),80,IF(AND(RC[-3]>RC[-1],RC[-3]>=5,RC[-3]<6),70,IF(AND(RC[-3]>RC[-1],RC[-3]>=6,RC[-3]<7),60,IF(AND(RC[-3]>RC[-1],RC[-3]>=7,RC[-3]<8),50,IF(AND(RC[-3]>RC[-1],RC[-3]>=8,RC[-3]<9),40,IF(AND(RC[-3]>RC[-1],RC[-3]>=9,RC[-3]<10),30,IF(AND(RC[-3]>RC[-1],RC[-3]>=10,RC[-3]<11),20,IF(AND(RC[-3]>RC[-1],RC[-3]>=11,RC[-3]<12),10,IF(AND(RC[-3]>RC[-1],RC[-3]>=12),0))))))))))))))))))))))))))))))))) -> 55 | H531: =IF(RC[-3]="","",IF(RC[-3]<0.3,100,IF(AND(RC[-3]>=0.3,RC[-3]>0.4),95,IF(AND(RC[-3]>=0.4,RC[-3]<0.5),90,IF(AND(RC[-3]>=0.5,RC[-3]<0.6),85,IF(AND(RC[-3]>=0.6,RC[-3]<0.7),80,IF(AND(RC[-3]>=0.6,RC[-3]<1),80,IF(AND(RC[-3]>1,RC[-3]<2),50,IF(RC[-3]>2,0))))))))) ->  | I531: =IF(RC[-1]="",RC[-2],0.7*RC[-1]+0.3*RC[-2]) -> 55
A532: تامین سرمایه بانک ملت | B532: تملت | C532: =VLOOKUP(RC[-1],Sheet1!R3C2:R802C3,2,FALSE) -> فعالیتهای کمکی به نهاد های مالی واسط | D532: =VLOOKUP(RC[-2],Sheet1!R3C2:R802C9,8,FALSE) -> 5.7356137803809464 | E532: =IF(VLOOKUP(RC[-3],Sheet1!R3C2:R803C11,10,FALSE)=0,"",VLOOKUP(Sheet2!RC[-3],Sheet1!R[1]C[-3]:R[801]C[6],10,FALSE)) ->  | F532: =Sheet1!R582C10 -> 20.545875985533669 | G532: =IF(RC[-3]<0,0,IF(AND(RC[-3]<RC[-1],RC[-3]<2),100,IF(AND(RC[-3]<RC[-1],RC[-3]>=2,RC[-3]<3),95,IF(AND(RC[-3]<RC[-1],RC[-3]>=3,RC[-3]<4),90,IF(AND(RC[-3]<RC[-1],RC[-3]>=4,RC[-3]<5),85,IF(AND(RC[-3]<RC[-1],RC[-3]>=5,RC[-3]<6),80,IF(AND(RC[-3]<RC[-1],RC[-3]>=6,RC[-3]<7),75,IF(AND(RC[-3]<RC[-1],RC[-3]>=7,RC[-3]<8),70,IF(AND(RC[-3]<RC[-1],RC[-3]>=8,RC[-3]<9),65,IF(AND(RC[-3]<RC[-1],RC[-3]>=9,RC[-3]<10),60,IF(AND(RC[-3]<RC[-1],RC[-3]>=10,RC[-3]<11),55,IF(AND(RC[-3]<RC[-1],RC[-3]>=11,RC[-3]<12),50,IF(AND(RC[-3]<RC[-1],RC[-3]>=12,RC[-3]<13),45,IF(AND(RC[-3]<RC[-1],RC[-3]>=13,RC[-3]<14),40,IF(AND(RC[-3]<RC[-1],RC[-3]>=14,RC[-3]<15),35,IF(AND(RC[-3]<RC[-1],RC[-3]>=15,RC[-3]<16),30,IF(AND(RC[-3]<RC[-1],RC[-3]>=16,RC[-3]<17),25,IF(AND(RC[-3]<RC[-1],RC[-3]>=17,RC[-3]<18),20,IF(AND(RC[-3]<RC[-1],RC[-3]>=18,RC[-3]<19),15,IF(AND(RC[-3]<RC[-1],RC[-3]>=19,RC[-3]<20),10,IF(AND(RC[-3]<RC[-1],RC[-3]>=20,RC[-3]<21),5,IF(AND(RC[-3]<RC[-1],RC[-3]>=21),0,IF(AND(RC[-3]>RC[-1],RC[-3]>=2,RC[-3]<3),90,IF(AND(RC[-3]>RC[-1],RC[-3]>=3,RC[-3]<4),90,IF(AND(RC[-3]>RC[-1],RC[-3]>=4,RC[-3]<5),80,IF(AND(RC[-3]>RC[-1],RC[-3]>=5,RC[-3]<6),70,IF(AND(RC[-3]>RC[-1],RC[-3]>=6,RC[-3]<7),60,IF(AND(RC[-3]>RC[-1],RC[-3]>=7,RC[-3]<8),50,IF(AND(RC[-3]>RC[-1],RC[-3]>=8,RC[-3]<9),40,IF(AND(RC[-3]>RC[-1],RC[-3]>=9,RC[-3]<10),30,IF(AND(RC[-3]>RC[-1],RC[-3]>=10,RC[-3]<11),20,IF(AND(RC[-3]>RC[-1],RC[-3]>=11,RC[-3]<12),10,IF(AND(RC[-3]>RC[-1],RC[-3]>=12),0))))))))))))))))))))))))))))))))) -> 80 | H532: =IF(RC[-3]="","",IF(RC[-3]<0.3,100,IF(AND(RC[-3]>=0.3,RC[-3]>0.4),95,IF(AND(RC[-3]>=0.4,RC[-3]<0.5),90,IF(AND(RC[-3]>=0.5,RC[-3]<0.6),85,IF(AND(RC[-3]>=0.6,RC[-3]<0.7),80,IF(AND(RC[-3]>=0.6,RC[-3]<1),80,IF(AND(RC[-3]>1,RC[-3]<2),50,IF(RC[-3]>2,0))))))))) ->  | I532: =IF(RC[-1]="",RC[-2],0.7*RC[-1]+0.3*RC[-2]) -> 80
A533: تامین سرمایه خلیج فارس | B533: تفارس | C533: =VLOOKUP(RC[-1],Sheet1!R3C2:R802C3,2,FALSE) -> فعالیتهای کمکی به نهاد های مالی واسط | D533: =VLOOKUP(RC[-2],Sheet1!R3C2:R802C9,8,FALSE) -> 41.393565467947731 | E533: =IF(VLOOKUP(RC[-3],Sheet1!R3C2:R803C11,10,FALSE)=0,"",VLOOKUP(Sheet2!RC[-3],Sheet1!R[1]C[-3]:R[801]C[6],10,FALSE)) ->  | F533: =Sheet1!R582C10 -> 20.545875985533669 | G533: =IF(RC[-3]<0,0,IF(AND(RC[-3]<RC[-1],RC[-3]<2),100,IF(AND(RC[-3]<RC[-1],RC[-3]>=2,RC[-3]<3),95,IF(AND(RC[-3]<RC[-1],RC[-3]>=3,RC[-3]<4),90,IF(AND(RC[-3]<RC[-1],RC[-3]>=4,RC[-3]<5),85,IF(AND(RC[-3]<RC[-1],RC[-3]>=5,RC[-3]<6),80,IF(AND(RC[-3]<RC[-1],RC[-3]>=6,RC[-3]<7),75,IF(AND(RC[-3]<RC[-1],RC[-3]>=7,RC[-3]<8),70,IF(AND(RC[-3]<RC[-1],RC[-3]>=8,RC[-3]<9),65,IF(AND(RC[-3]<RC[-1],RC[-3]>=9,RC[-3]<10),60,IF(AND(RC[-3]<RC[-1],RC[-3]>=10,RC[-3]<11),55,IF(AND(RC[-3]<RC[-1],RC[-3]>=11,RC[-3]<12),50,IF(AND(RC[-3]<RC[-1],RC[-3]>=12,RC[-3]<13),45,IF(AND(RC[-3]<RC[-1],RC[-3]>=13,RC[-3]<14),40,IF(AND(RC[-3]<RC[-1],RC[-3]>=14,RC[-3]<15),35,IF(AND(RC[-3]<RC[-1],RC[-3]>=15,RC[-3]<16),30,IF(AND(RC[-3]<RC[-1],RC[-3]>=16,RC[-3]<17),25,IF(AND(RC[-3]<RC[-1],RC[-3]>=17,RC[-3]<18),20,IF(AND(RC[-3]<RC[-1],RC[-3]>=18,RC[-3]<19),15,IF(AND(RC[-3]<RC[-1],RC[-3]>=19,RC[-3]<20),10,IF(AND(RC[-3]<RC[-1],RC[-3]>=20,RC[-3]<21),5,IF(AND(RC[-3]<RC[-1],RC[-3]>=21),0,IF(AND(RC[-3]>RC[-1],RC[-3]>=2,RC[-3]<3),90,IF(AND(RC[-3]>RC[-1],RC[-3]>=3,RC[-3]<4),90,IF(AND(RC[-3]>RC[-1],RC[-3]>=4,RC[-3]<5),80,IF(AND(RC[-3]>RC[-1],RC[-3]>=5,RC[-3]<6),70,IF(AND(RC[-3]>RC[-1],RC[-3]>=6,RC[-3]<7),60,IF(AND(RC[-3]>RC[-1],RC[-3]>=7,RC[-3]<8),50,IF(AND(RC[-3]>RC[-1],RC[-3]>=8,RC[-3]<9),40,IF(AND(RC[-3]>RC[-1],RC[-3]>=9,RC[-3]<10),30,IF(AND(RC[-3]>RC[-1],RC[-3]>=10,RC[-3]<11),20,IF(AND(RC[-3]>RC[-1],RC[-3]>=11,RC[-3]<12),10,IF(AND(RC[-3]>RC[-1],RC[-3]>=12),0))))))))))))))))))))))))))))))))) -> 0 | H533: =IF(RC[-3]="","",IF(RC[-3]<0.3,100,IF(AND(RC[-3]>=0.3,RC[-3]>0.4),95,IF(AND(RC[-3]>=0.4,RC[-3]<0.5),90,IF(AND(RC[-3]>=0.5,RC[-3]<0.6),85,IF(AND(RC[-3]>=0.6,RC[-3]<0.7),80,IF(AND(RC[-3]>=0.6,RC[-3]<1),80,IF(AND(RC[-3]>1,RC[-3]<2),50,IF(RC[-3]>2,0))))))))) ->  | I533: =IF(RC[-1]="",RC[-2],0.7*RC[-1]+0.3*RC[-2]) -> 0
A534: تامین سرمایه دماوند | B534: تماوند | C534: =VLOOKUP(RC[-1],Sheet1!R3C2:R802C3,2,FALSE) -> فعالیتهای کمکی به نهاد های مالی واسط | D534: =VLOOKUP(RC[-2],Sheet1!R3C2:R802C9,8,FALSE) -> 6.6265965397180322 | E534: =IF(VLOOKUP(RC[-3],Sheet1!R3C2:R803C11,10,FALSE)=0,"",VLOOKUP(Sheet2!RC[-3],Sheet1!R[1]C[-3]:R[801]C[6],10,FALSE)) ->  | F534: =Sheet1!R582C10 -> 20.545875985533669 | G534: =IF(RC[-3]<0,0,IF(AND(RC[-3]<RC[-1],RC[-3]<2),100,IF(AND(RC[-3]<RC[-1],RC[-3]>=2,RC[-3]<3),95,IF(AND(RC[-3]<RC[-1],RC[-3]>=3,RC[-3]<4),90,IF(AND(RC[-3]<RC[-1],RC[-3]>=4,RC[-3]<5),85,IF(AND(RC[-3]<RC[-1],RC[-3]>=5,RC[-3]<6),80,IF(AND(RC[-3]<RC[-1],RC[-3]>=6,RC[-3]<7),75,IF(AND(RC[-3]<RC[-1],RC[-3]>=7,RC[-3]<8),70,IF(AND(RC[-3]<RC[-1],RC[-3]>=8,RC[-3]<9),65,IF(AND(RC[-3]<RC[-1],RC[-3]>=9,RC[-3]<10),60,IF(AND(RC[-3]<RC[-1],RC[-3]>=10,RC[-3]<11),55,IF(AND(RC[-3]<RC[-1],RC[-3]>=11,RC[-3]<12),50,IF(AND(RC[-3]<RC[-1],RC[-3]>=12,RC[-3]<13),45,IF(AND(RC[-3]<RC[-1],RC[-3]>=13,RC[-3]<14),40,IF(AND(RC[-3]<RC[-1],RC[-3]>=14,RC[-3]<15),35,IF(AND(RC[-3]<RC[-1],RC[-3]>=15,RC[-3]<16),30,IF(AND(RC[-3]<RC[-1],RC[-3]>=16,RC[-3]<17),25,IF(AND(RC[-3]<RC[-1],RC[-3]>=17,RC[-3]<18),20,IF(AND(RC[-3]<RC[-1],RC[-3]>=18,RC[-3]<19),15,IF(AND(RC[-3]<RC[-1],RC[-3]>=19,RC[-3]<20),10,IF(AND(RC[-3]<RC[-1],RC[-3]>=20,RC[-3]<21),5,IF(AND(RC[-3]<RC[-1],RC[-3]>=21),0,IF(AND(RC[-3]>RC[-1],RC[-3]>=2,RC[-3]<3),90,IF(AND(RC[-3]>RC[-1],RC[-3]>=3,RC[-3]<4),90,IF(AND(RC[-3]>RC[-1],RC[-3]>=4,RC[-3]<5),80,IF(AND(RC[-3]>RC[-1],RC[-3]>=5,RC[-3]<6),70,IF(AND(RC[-3]>RC[-1],RC[-3]>=6,RC[-3]<7),60,IF(AND(RC[-3]>RC[-1],RC[-3]>=7,RC[-3]<8),50,IF(AND(RC[-3]>RC[-1],RC[-3]>=8,RC[-3]<9),40,IF(AND(RC[-3]>RC[-1],RC[-3]>=9,RC[-3]<10),30,IF(AND(RC[-3]>RC[-1],RC[-3]>=10,RC[-3]<11),20,IF(AND(RC[-3]>RC[-1],RC[-3]>=11,RC[-3]<12),10,IF(AND(RC[-3]>RC[-1],RC[-3]>=12),0))))))))))))))))))))))))))))))))) -> 75 | H534: =IF(RC[-3]="","",IF(RC[-3]<0.3,100,IF(AND(RC[-3]>=0.3,RC[-3]>0.4),95,IF(AND(RC[-3]>=0.4,RC[-3]<0.5),90,IF(AND(RC[-3]>=0.5,RC[-3]<0.6),85,IF(AND(RC[-3]>=0.6,RC[-3]<0.7),80,IF(AND(RC[-3]>=0.6,RC[-3]<1),80,IF(AND(RC[-3]>1,RC[-3]<2),50,IF(RC[-3]>2,0))))))))) ->  | I534: =IF(RC[-1]="",RC[-2],0.7*RC[-1]+0.3*RC[-2]) -> 75
A535: تامین سرمایه لوتوس پارسیان | B535: لوتوس | C535: =VLOOKUP(RC[-1],Sheet1!R3C2:R802C3,2,FALSE) -> فعالیتهای کمکی به نهاد های مالی واسط | D535: =VLOOKUP(RC[-2],Sheet1!R3C2:R802C9,8,FALSE) -> 4.4638158662302745 | E535: =IF(VLOOKUP(RC[-3],Sheet1!R3C2:R803C11,10,FALSE)=0,"",VLOOKUP(Sheet2!RC[-3],Sheet1!R[1]C[-3]:R[801]C[6],10,FALSE)) ->  | F535: =Sheet1!R582C10 -> 20.545875985533669 | G535: =IF(RC[-3]<0,0,IF(AND(RC[-3]<RC[-1],RC[-3]<2),100,IF(AND(RC[-3]<RC[-1],RC[-3]>=2,RC[-3]<3),95,IF(AND(RC[-3]<RC[-1],RC[-3]>=3,RC[-3]<4),90,IF(AND(RC[-3]<RC[-1],RC[-3]>=4,RC[-3]<5),85,IF(AND(RC[-3]<RC[-1],RC[-3]>=5,RC[-3]<6),80,IF(AND(RC[-3]<RC[-1],RC[-3]>=6,RC[-3]<7),75,IF(AND(RC[-3]<RC[-1],RC[-3]>=7,RC[-3]<8),70,IF(AND(RC[-3]<RC[-1],RC[-3]>=8,RC[-3]<9),65,IF(AND(RC[-3]<RC[-1],RC[-3]>=9,RC[-3]<10),60,IF(AND(RC[-3]<RC[-1],RC[-3]>=10,RC[-3]<11),55,IF(AND(RC[-3]<RC[-1],RC[-3]>=11,RC[-3]<12),50,IF(AND(RC[-3]<RC[-1],RC[-3]>=12,RC[-3]<13),45,IF(AND(RC[-3]<RC[-1],RC[-3]>=13,RC[-3]<14),40,IF(AND(RC[-3]<RC[-1],RC[-3]>=14,RC[-3]<15),35,IF(AND(RC[-3]<RC[-1],RC[-3]>=15,RC[-3]<16),30,IF(AND(RC[-3]<RC[-1],RC[-3]>=16,RC[-3]<17),25,IF(AND(RC[-3]<RC[-1],RC[-3]>=17,RC[-3]<18),20,IF(AND(RC[-3]<RC[-1],RC[-3]>=18,RC[-3]<19),15,IF(AND(RC[-3]<RC[-1],RC[-3]>=19,RC[-3]<20),10,IF(AND(RC[-3]<RC[-1],RC[-3]>=20,RC[-3]<21),5,IF(AND(RC[-3]<RC[-1],RC[-3]>=21),0,IF(AND(RC[-3]>RC[-1],RC[-3]>=2,RC[-3]<3),90,IF(AND(RC[-3]>RC[-1],RC[-3]>=3,RC[-3]<4),90,IF(AND(RC[-3]>RC[-1],RC[-3]>=4,RC[-3]<5),80,IF(AND(RC[-3]>RC[-1],RC[-3]>=5,RC[-3]<6),70,IF(AND(RC[-3]>RC[-1],RC[-3]>=6,RC[-3]<7),60,IF(AND(RC[-3]>RC[-1],RC[-3]>=7,RC[-3]<8),50,IF(AND(RC[-3]>RC[-1],RC[-3]>=8,RC[-3]<9),40,IF(AND(RC[-3]>RC[-1],RC[-3]>=9,RC[-3]<10),30,IF(AND(RC[-3]>RC[-1],RC[-3]>=10,RC[-3]<11),20,IF(AND(RC[-3]>RC[-1],RC[-3]>=11,RC[-3]<12),10,IF(AND(RC[-3]>RC[-1],RC[-3]>=12),0))))))))))))))))))))))))))))))))) -> 85 | H535: =IF(RC[-3]="","",IF(RC[-3]<0.3,100,IF(AND(RC[-3]>=0.3,RC[-3]>0.4),95,IF(AND(RC[-3]>=0.4,RC[-3]<0.5),90,IF(AND(RC[-3]>=0.5,RC[-3]<0.6),85,IF(AND(RC[-3]>=0.6,RC[-3]<0.7),80,IF(AND(RC[-3]>=0.6,RC[-3]<1),80,IF(AND(RC[-3]>1,RC[-3]<2),50,IF(RC[-3]>2,0))))))))) ->  | I535: =IF(RC[-1]="",RC[-2],0.7*RC[-1]+0.3*RC[-2]) -> 85
A536: تامین سرمایه نوین | B536: تنوین | C536: =VLOOKUP(RC[-1],Sheet1!R3C2:R802C3,2,FALSE) -> فعالیتهای کمکی به نهاد های مالی واسط | D536: =VLOOKUP(RC[-2],Sheet1!R3C2:R802C9,8,FALSE) -> 3.1136430836641664 | E536: =IF(VLOOKUP(RC[-3],Sheet1!R3C2:R803C11,10,FALSE)=0,"",VLOOKUP(Sheet2!RC[-3],Sheet1!R[1]C[-3]:R[801]C[6],10,FALSE)) ->  | F536: =Sheet1!R582C10 -> 20.545875985533669 | G536: =IF(RC[-3]<0,0,IF(AND(RC[-3]<RC[-1],RC[-3]<2),100,IF(AND(RC[-3]<RC[-1],RC[-3]>=2,RC[-3]<3),95,IF(AND(RC[-3]<RC[-1],RC[-3]>=3,RC[-3]<4),90,IF(AND(RC[-3]<RC[-1],RC[-3]>=4,RC[-3]<5),85,IF(AND(RC[-3]<RC[-1],RC[-3]>=5,RC[-3]<6),80,IF(AND(RC[-3]<RC[-1],RC[-3]>=6,RC[-3]<7),75,IF(AND(RC[-3]<RC[-1],RC[-3]>=7,RC[-3]<8),70,IF(AND(RC[-3]<RC[-1],RC[-3]>=8,RC[-3]<9),65,IF(AND(RC[-3]<RC[-1],RC[-3]>=9,RC[-3]<10),60,IF(AND(RC[-3]<RC[-1],RC[-3]>=10,RC[-3]<11),55,IF(AND(RC[-3]<RC[-1],RC[-3]>=11,RC[-3]<12),50,IF(AND(RC[-3]<RC[-1],RC[-3]>=12,RC[-3]<13),45,IF(AND(RC[-3]<RC[-1],RC[-3]>=13,RC[-3]<14),40,IF(AND(RC[-3]<RC[-1],RC[-3]>=14,RC[-3]<15),35,IF(AND(RC[-3]<RC[-1],RC[-3]>=15,RC[-3]<16),30,IF(AND(RC[-3]<RC[-1],RC[-3]>=16,RC[-3]<17),25,IF(AND(RC[-3]<RC[-1],RC[-3]>=17,RC[-3]<18),20,IF(AND(RC[-3]<RC[-1],RC[-3]>=18,RC[-3]<19),15,IF(AND(RC[-3]<RC[-1],RC[-3]>=19,RC[-3]<20),10,IF(AND(RC[-3]<RC[-1],RC[-3]>=20,RC[-3]<21),5,IF(AND(RC[-3]<RC[-1],RC[-3]>=21),0,IF(AND(RC[-3]>RC[-1],RC[-3]>=2,RC[-3]<3),90,IF(AND(RC[-3]>RC[-1],RC[-3]>=3,RC[-3]<4),90,IF(AND(RC[-3]>RC[-1],RC[-3]>=4,RC[-3]<5),80,IF(AND(RC[-3]>RC[-1],RC[-3]>=5,RC[-3]<6),70,IF(AND(RC[-3]>RC[-1],RC[-3]>=6,RC[-3]<7),60,IF(AND(RC[-3]>RC[-1],RC[-3]>=7,RC[-3]<8),50,IF(AND(RC[-3]>RC[-1],RC[-3]>=8,RC[-3]<9),40,IF(AND(RC[-3]>RC[-1],RC[-3]>=9,RC[-3]<10),30,IF(AND(RC[-3]>RC[-1],RC[-3]>=10,RC[-3]<11),20,IF(AND(RC[-3]>RC[-1],RC[-3]>=11,RC[-3]<12),10,IF(AND(RC[-3]>RC[-1],RC[-3]>=12),0))))))))))))))))))))))))))))))))) -> 90 | H536: =IF(RC[-3]="","",IF(RC[-3]<0.3,100,IF(AND(RC[-3]>=0.3,RC[-3]>0.4),95,IF(AND(RC[-3]>=0.4,RC[-3]<0.5),90,IF(AND(RC[-3]>=0.5,RC[-3]<0.6),85,IF(AND(RC[-3]>=0.6,RC[-3]<0.7),80,IF(AND(RC[-3]>=0.6,RC[-3]<1),80,IF(AND(RC[-3]>1,RC[-3]<2),50,IF(RC[-3]>2,0))))))))) ->  | I536: =IF(RC[-1]="",RC[-2],0.7*RC[-1]+0.3*RC[-2]) -> 90
A537: تامین سرمایه کیمیا | B537: تکیمیا | C537: =VLOOKUP(RC[-1],Sheet1!R3C2:R802C3,2,FALSE) -> فعالیتهای کمکی به نهاد های مالی واسط | D537: =VLOOKUP(RC[-2],Sheet1!R3C2:R802C9,8,FALSE) -> 0 | E537: =IF(VLOOKUP(RC[-3],Sheet1!R3C2:R803C11,10,FALSE)=0,"",VLOOKUP(Sheet2!RC[-3],Sheet1!R[1]C[-3]:R[801]C[6],10,FALSE)) ->  | F537: =Sheet1!R582C10 -> 20.545875985533669 | G537: =IF(RC[-3]<0,0,IF(AND(RC[-3]<RC[-1],RC[-3]<2),100,IF(AND(RC[-3]<RC[-1],RC[-3]>=2,RC[-3]<3),95,IF(AND(RC[-3]<RC[-1],RC[-3]>=3,RC[-3]<4),90,IF(AND(RC[-3]<RC[-1],RC[-3]>=4,RC[-3]<5),85,IF(AND(RC[-3]<RC[-1],RC[-3]>=5,RC[-3]<6),80,IF(AND(RC[-3]<RC[-1],RC[-3]>=6,RC[-3]<7),75,IF(AND(RC[-3]<RC[-1],RC[-3]>=7,RC[-3]<8),70,IF(AND(RC[-3]<RC[-1],RC[-3]>=8,RC[-3]<9),65,IF(AND(RC[-3]<RC[-1],RC[-3]>=9,RC[-3]<10),60,IF(AND(RC[-3]<RC[-1],RC[-3]>=10,RC[-3]<11),55,IF(AND(RC[-3]<RC[-1],RC[-3]>=11,RC[-3]<12),50,IF(AND(RC[-3]<RC[-1],RC[-3]>=12,RC[-3]<13),45,IF(AND(RC[-3]<RC[-1],RC[-3]>=13,RC[-3]<14),40,IF(AND(RC[-3]<RC[-1],RC[-3]>=14,RC[-3]<15),35,IF(AND(RC[-3]<RC[-1],RC[-3]>=15,RC[-3]<16),30,IF(AND(RC[-3]<RC[-1],RC[-3]>=16,RC[-3]<17),25,IF(AND(RC[-3]<RC[-1],RC[-3]>=17,RC[-3]<18),20,IF(AND(RC[-3]<RC[-1],RC[-3]>=18,RC[-3]<19),15,IF(AND(RC[-3]<RC[-1],RC[-3]>=19,RC[-3]<20),10,IF(AND(RC[-3]<RC[-1],RC[-3]>=20,RC[-3]<21),5,IF(AND(RC[-3]<RC[-1],RC[-3]>=21),0,IF(AND(RC[-3]>RC[-1],RC[-3]>=2,RC[-3]<3),90,IF(AND(RC[-3]>RC[-1],RC[-3]>=3,RC[-3]<4),90,IF(AND(RC[-3]>RC[-1],RC[-3]>=4,RC[-3]<5),80,IF(AND(RC[-3]>RC[-1],RC[-3]>=5,RC[-3]<6),70,IF(AND(RC[-3]>RC[-1],RC[-3]>=6,RC[-3]<7),60,IF(AND(RC[-3]>RC[-1],RC[-3]>=7,RC[-3]<8),50,IF(AND(RC[-3]>RC[-1],RC[-3]>=8,RC[-3]<9),40,IF(AND(RC[-3]>RC[-1],RC[-3]>=9,RC[-3]<10),30,IF(AND(RC[-3]>RC[-1],RC[-3]>=10,RC[-3]<11),20,IF(AND(RC[-3]>RC[-1],RC[-3]>=11,RC[-3]<12),10,IF(AND(RC[-3]>RC[-1],RC[-3]>=12),0))))))))))))))))))))))))))))))))) -> 100 | H537: =IF(RC[-3]="","",IF(RC[-3]<0.3,100,IF(AND(RC[-3]>=0.3,RC[-3]>0.4),95,IF(AND(RC[-3]>=0.4,RC[-3]<0.5),90,IF(AND(RC[-3]>=0.5,RC[-3]<0.6),85,IF(AND(RC[-3]>=0.6,RC[-3]<0.7),80,IF(AND(RC[-3]>=0.6,RC[-3]<1),80,IF(AND(RC[-3]>1,RC[-3]<2),50,IF(RC[-3]>2,0))))))))) ->  | I537: =IF(RC[-1]="",RC[-2],0.7*RC[-1]+0.3*RC[-2]) -> 100
A538: تولیدکنندگان بورس کالای ایران | B538: تکالا | C538: =VLOOKUP(RC[-1],Sheet1!R3C2:R802C3,2,FALSE) -> فعالیتهای کمکی به نهاد های مالی واسط | D538: =VLOOKUP(RC[-2],Sheet1!R3C2:R802C9,8,FALSE) -> 7.110655737704918 | E538: =IF(VLOOKUP(RC[-3],Sheet1!R3C2:R803C11,10,FALSE)=0,"",VLOOKUP(Sheet2!RC[-3],Sheet1!R[1]C[-3]:R[801]C[6],10,FALSE)) ->  | F538: =Sheet1!R582C10 -> 20.545875985533669 | G538: =IF(RC[-3]<0,0,IF(AND(RC[-3]<RC[-1],RC[-3]<2),100,IF(AND(RC[-3]<RC[-1],RC[-3]>=2,RC[-3]<3),95,IF(AND(RC[-3]<RC[-1],RC[-3]>=3,RC[-3]<4),90,IF(AND(RC[-3]<RC[-1],RC[-3]>=4,RC[-3]<5),85,IF(AND(RC[-3]<RC[-1],RC[-3]>=5,RC[-3]<6),80,IF(AND(RC[-3]<RC[-1],RC[-3]>=6,RC[-3]<7),75,IF(AND(RC[-3]<RC[-1],RC[-3]>=7,RC[-3]<8),70,IF(AND(RC[-3]<RC[-1],RC[-3]>=8,RC[-3]<9),65,IF(AND(RC[-3]<RC[-1],RC[-3]>=9,RC[-3]<10),60,IF(AND(RC[-3]<RC[-1],RC[-3]>=10,RC[-3]<11),55,IF(AND(RC[-3]<RC[-1],RC[-3]>=11,RC[-3]<12),50,IF(AND(RC[-3]<RC[-1],RC[-3]>=12,RC[-3]<13),45,IF(AND(RC[-3]<RC[-1],RC[-3]>=13,RC[-3]<14),40,IF(AND(RC[-3]<RC[-1],RC[-3]>=14,RC[-3]<15),35,IF(AND(RC[-3]<RC[-1],RC[-3]>=15,RC[-3]<16),30,IF(AND(RC[-3]<RC[-1],RC[-3]>=16,RC[-3]<17),25,IF(AND(RC[-3]<RC[-1],RC[-3]>=17,RC[-3]<18),20,IF(AND(RC[-3]<RC[-1],RC[-3]>=18,RC[-3]<19),15,IF(AND(RC[-3]<RC[-1],RC[-3]>=19,RC[-3]<20),10,IF(AND(RC[-3]<RC[-1],RC[-3]>=20,RC[-3]<21),5,IF(AND(RC[-3]<RC[-1],RC[-3]>=21),0,IF(AND(RC[-3]>RC[-1],RC[-3]>=2,RC[-3]<3),90,IF(AND(RC[-3]>RC[-1],RC[-3]>=3,RC[-3]<4),90,IF(AND(RC[-3]>RC[-1],RC[-3]>=4,RC[-3]<5),80,IF(AND(RC[-3]>RC[-1],RC[-3]>=5,RC[-3]<6),70,IF(AND(RC[-3]>RC[-1],RC[-3]>=6,RC[-3]<7),60,IF(AND(RC[-3]>RC[-1],RC[-3]>=7,RC[-3]<8),50,IF(AND(RC[-3]>RC[-1],RC[-3]>=8,RC[-3]<9),40,IF(AND(RC[-3]>RC[-1],RC[-3]>=9,RC[-3]<10),30,IF(AND(RC[-3]>RC[-1],RC[-3]>=10,RC[-3]<11),20,IF(AND(RC[-3]>RC[-1],RC[-3]>=11,RC[-3]<12),10,IF(AND(RC[-3]>RC[-1],RC[-3]>=12),0))))))))))))))))))))))))))))))))) -> 70 | H538: =IF(RC[-3]="","",IF(RC[-3]<0.3,100,IF(AND(RC[-3]>=0.3,RC[-3]>0.4),95,IF(AND(RC[-3]>=0.4,RC[-3]<0.5),90,IF(AND(RC[-3]>=0.5,RC[-3]<0.6),85,IF(AND(RC[-3]>=0.6,RC[-3]<0.7),80,IF(AND(RC[-3]>=0.6,RC[-3]<1),80,IF(AND(RC[-3]>1,RC[-3]<2),50,IF(RC[-3]>2,0))))))))) ->  | I538: =IF(RC[-1]="",RC[-2],0.7*RC[-1]+0.3*RC[-2]) -> 70
A539: سایر اشخاص بورس انرژی | B539: انرژی3 | C539: =VLOOKUP(RC[-1],Sheet1!R3C2:R802C3,2,FALSE) -> فعالیتهای کمکی به نهاد های مالی واسط | D539: =VLOOKUP(RC[-2],Sheet1!R3C2:R802C9,8,FALSE) -> 62.112617299467544 | E539: =IF(VLOOKUP(RC[-3],Sheet1!R3C2:R803C11,10,FALSE)=0,"",VLOOKUP(Sheet2!RC[-3],Sheet1!R[1]C[-3]:R[801]C[6],10,FALSE)) ->  | F539: =Sheet1!R582C10 -> 20.545875985533669 | G539: =IF(RC[-3]<0,0,IF(AND(RC[-3]<RC[-1],RC[-3]<2),100,IF(AND(RC[-3]<RC[-1],RC[-3]>=2,RC[-3]<3),95,IF(AND(RC[-3]<RC[-1],RC[-3]>=3,RC[-3]<4),90,IF(AND(RC[-3]<RC[-1],RC[-3]>=4,RC[-3]<5),85,IF(AND(RC[-3]<RC[-1],RC[-3]>=5,RC[-3]<6),80,IF(AND(RC[-3]<RC[-1],RC[-3]>=6,RC[-3]<7),75,IF(AND(RC[-3]<RC[-1],RC[-3]>=7,RC[-3]<8),70,IF(AND(RC[-3]<RC[-1],RC[-3]>=8,RC[-3]<9),65,IF(AND(RC[-3]<RC[-1],RC[-3]>=9,RC[-3]<10),60,IF(AND(RC[-3]<RC[-1],RC[-3]>=10,RC[-3]<11),55,IF(AND(RC[-3]<RC[-1],RC[-3]>=11,RC[-3]<12),50,IF(AND(RC[-3]<RC[-1],RC[-3]>=12,RC[-3]<13),45,IF(AND(RC[-3]<RC[-1],RC[-3]>=13,RC[-3]<14),40,IF(AND(RC[-3]<RC[-1],RC[-3]>=14,RC[-3]<15),35,IF(AND(RC[-3]<RC[-1],RC[-3]>=15,RC[-3]<16),30,IF(AND(RC[-3]<RC[-1],RC[-3]>=16,RC[-3]<17),25,IF(AND(RC[-3]<RC[-1],RC[-3]>=17,RC[-3]<18),20,IF(AND(RC[-3]<RC[-1],RC[-3]>=18,RC[-3]<19),15,IF(AND(RC[-3]<RC[-1],RC[-3]>=19,RC[-3]<20),10,IF(AND(RC[-3]<RC[-1],RC[-3]>=20,RC[-3]<21),5,IF(AND(RC[-3]<RC[-1],RC[-3]>=21),0,IF(AND(RC[-3]>RC[-1],RC[-3]>=2,RC[-3]<3),90,IF(AND(RC[-3]>RC[-1],RC[-3]>=3,RC[-3]<4),90,IF(AND(RC[-3]>RC[-1],RC[-3]>=4,RC[-3]<5),80,IF(AND(RC[-3]>RC[-1],RC[-3]>=5,RC[-3]<6),70,IF(AND(RC[-3]>RC[-1],RC[-3]>=6,RC[-3]<7),60,IF(AND(RC[-3]>RC[-1],RC[-3]>=7,RC[-3]<8),50,IF(AND(RC[-3]>RC[-1],RC[-3]>=8,RC[-3]<9),40,IF(AND(RC[-3]>RC[-1],RC[-3]>=9,RC[-3]<10),30,IF(AND(RC[-3]>RC[-1],RC[-3]>=10,RC[-3]<11),20,IF(AND(RC[-3]>RC[-1],RC[-3]>=11,RC[-3]<12),10,IF(AND(RC[-3]>RC[-1],RC[-3]>=12),0))))))))))))))))))))))))))))))))) -> 0 | H539: =IF(RC[-3]="","",IF(RC[-3]<0.3,100,IF(AND(RC[-3]>=0.3,RC[-3]>0.4),95,IF(AND(RC[-3]>=0.4,RC[-3]<0.5),90,IF(AND(RC[-3]>=0.5,RC[-3]<0.6),85,IF(AND(RC[-3]>=0.6,RC[-3]<0.7),80,IF(AND(RC[-3]>=0.6,RC[-3]<1),80,IF(AND(RC[-3]>1,RC[-3]<2),50,IF(RC[-3]>2,0))))))))) ->  | I539: =IF(RC[-1]="",RC[-2],0.7*RC[-1]+0.3*RC[-2]) -> 0
A540: سپرده گذاری و تسویه وجوه | B540: سپرده | C540: =VLOOKUP(RC[-1],Sheet1!R3C2:R802C3,2,FALSE) -> فعالیتهای کمکی به نهاد های مالی واسط | D540: =VLOOKUP(RC[-2],Sheet1!R3C2:R802C9,8,FALSE) -> 1.4898132427843804 | E540: =IF(VLOOKUP(RC[-3],Sheet1!R3C2:R803C11,10,FALSE)=0,"",VLOOKUP(Sheet2!RC[-3],Sheet1!R[1]C[-3]:R[801]C[6],10,FALSE)) ->  | F540: =Sheet1!R582C10 -> 20.545875985533669 | G540: =IF(RC[-3]<0,0,IF(AND(RC[-3]<RC[-1],RC[-3]<2),100,IF(AND(RC[-3]<RC[-1],RC[-3]>=2,RC[-3]<3),95,IF(AND(RC[-3]<RC[-1],RC[-3]>=3,RC[-3]<4),90,IF(AND(RC[-3]<RC[-1],RC[-3]>=4,RC[-3]<5),85,IF(AND(RC[-3]<RC[-1],RC[-3]>=5,RC[-3]<6),80,IF(AND(RC[-3]<RC[-1],RC[-3]>=6,RC[-3]<7),75,IF(AND(RC[-3]<RC[-1],RC[-3]>=7,RC[-3]<8),70,IF(AND(RC[-3]<RC[-1],RC[-3]>=8,RC[-3]<9),65,IF(AND(RC[-3]<RC[-1],RC[-3]>=9,RC[-3]<10),60,IF(AND(RC[-3]<RC[-1],RC[-3]>=10,RC[-3]<11),55,IF(AND(RC[-3]<RC[-1],RC[-3]>=11,RC[-3]<12),50,IF(AND(RC[-3]<RC[-1],RC[-3]>=12,RC[-3]<13),45,IF(AND(RC[-3]<RC[-1],RC[-3]>=13,RC[-3]<14),40,IF(AND(RC[-3]<RC[-1],RC[-3]>=14,RC[-3]<15),35,IF(AND(RC[-3]<RC[-1],RC[-3]>=15,RC[-3]<16),30,IF(AND(RC[-3]<RC[-1],RC[-3]>=16,RC[-3]<17),25,IF(AND(RC[-3]<RC[-1],RC[-3]>=17,RC[-3]<18),20,IF(AND(RC[-3]<RC[-1],RC[-3]>=18,RC[-3]<19),15,IF(AND(RC[-3]<RC[-1],RC[-3]>=19,RC[-3]<20),10,IF(AND(RC[-3]<RC[-1],RC[-3]>=20,RC[-3]<21),5,IF(AND(RC[-3]<RC[-1],RC[-3]>=21),0,IF(AND(RC[-3]>RC[-1],RC[-3]>=2,RC[-3]<3),90,IF(AND(RC[-3]>RC[-1],RC[-3]>=3,RC[-3]<4),90,IF(AND(RC[-3]>RC[-1],RC[-3]>=4,RC[-3]<5),80,IF(AND(RC[-3]>RC[-1],RC[-3]>=5,RC[-3]<6),70,IF(AND(RC[-3]>RC[-1],RC[-3]>=6,RC[-3]<7),60,IF(AND(RC[-3]>RC[-1],RC[-3]>=7,RC[-3]<8),50,IF(AND(RC[-3]>RC[-1],RC[-3]>=8,RC[-3]<9),40,IF(AND(RC[-3]>RC[-1],RC[-3]>=9,RC[-3]<10),30,IF(AND(RC[-3]>RC[-1],RC[-3]>=10,RC[-3]<11),20,IF(AND(RC[-3]>RC[-1],RC[-3]>=11,RC[-3]<12),10,IF(AND(RC[-3]>RC[-1],RC[-3]>=12),0))))))))))))))))))))))))))))))))) -> 100 | H540: =IF(RC[-3]="","",IF(RC[-3]<0.3,100,IF(AND(RC[-3]>=0.3,RC[-3]>0.4),95,IF(AND(RC[-3]>=0.4,RC[-3]<0.5),90,IF(AND(RC[-3]>=0.5,RC[-3]<0.6),85,IF(AND(RC[-3]>=0.6,RC[-3]<0.7),80,IF(AND(RC[-3]>=0.6,RC[-3]<1),80,IF(AND(RC[-3]>1,RC[-3]<2),50,IF(RC[-3]>2,0))))))))) ->  | I540: =IF(RC[-1]="",RC[-2],0.7*RC[-1]+0.3*RC[-2]) -> 100
A541: فرابورس ایران | B541: فرابورس | C541: =VLOOKUP(RC[-1],Sheet1!R3C2:R802C3,2,FALSE) -> فعالیتهای کمکی به نهاد های مالی واسط | D541: =VLOOKUP(RC[-2],Sheet1!R3C2:R802C9,8,FALSE) -> 19.852340045930774 | E541: =IF(VLOOKUP(RC[-3],Sheet1!R3C2:R803C11,10,FALSE)=0,"",VLOOKUP(Sheet2!RC[-3],Sheet1!R[1]C[-3]:R[801]C[6],10,FALSE)) ->  | F541: =Sheet1!R582C10 -> 20.545875985533669 | G541: =IF(RC[-3]<0,0,IF(AND(RC[-3]<RC[-1],RC[-3]<2),100,IF(AND(RC[-3]<RC[-1],RC[-3]>=2,RC[-3]<3),95,IF(AND(RC[-3]<RC[-1],RC[-3]>=3,RC[-3]<4),90,IF(AND(RC[-3]<RC[-1],RC[-3]>=4,RC[-3]<5),85,IF(AND(RC[-3]<RC[-1],RC[-3]>=5,RC[-3]<6),80,IF(AND(RC[-3]<RC[-1],RC[-3]>=6,RC[-3]<7),75,IF(AND(RC[-3]<RC[-1],RC[-3]>=7,RC[-3]<8),70,IF(AND(RC[-3]<RC[-1],RC[-3]>=8,RC[-3]<9),65,IF(AND(RC[-3]<RC[-1],RC[-3]>=9,RC[-3]<10),60,IF(AND(RC[-3]<RC[-1],RC[-3]>=10,RC[-3]<11),55,IF(AND(RC[-3]<RC[-1],RC[-3]>=11,RC[-3]<12),50,IF(AND(RC[-3]<RC[-1],RC[-3]>=12,RC[-3]<13),45,IF(AND(RC[-3]<RC[-1],RC[-3]>=13,RC[-3]<14),40,IF(AND(RC[-3]<RC[-1],RC[-3]>=14,RC[-3]<15),35,IF(AND(RC[-3]<RC[-1],RC[-3]>=15,RC[-3]<16),30,IF(AND(RC[-3]<RC[-1],RC[-3]>=16,RC[-3]<17),25,IF(AND(RC[-3]<RC[-1],RC[-3]>=17,RC[-3]<18),20,IF(AND(RC[-3]<RC[-1],RC[-3]>=18,RC[-3]<19),15,IF(AND(RC[-3]<RC[-1],RC[-3]>=19,RC[-3]<20),10,IF(AND(RC[-3]<RC[-1],RC[-3]>=20,RC[-3]<21),5,IF(AND(RC[-3]<RC[-1],RC[-3]>=21),0,IF(AND(RC[-3]>RC[-1],RC[-3]>=2,RC[-3]<3),90,IF(AND(RC[-3]>RC[-1],RC[-3]>=3,RC[-3]<4),90,IF(AND(RC[-3]>RC[-1],RC[-3]>=4,RC[-3]<5),80,IF(AND(RC[-3]>RC[-1],RC[-3]>=5,RC[-3]<6),70,IF(AND(RC[-3]>RC[-1],RC[-3]>=6,RC[-3]<7),60,IF(AND(RC[-3]>RC[-1],RC[-3]>=7,RC[-3]<8),50,IF(AND(RC[-3]>RC[-1],RC[-3]>=8,RC[-3]<9),40,IF(AND(RC[-3]>RC[-1],RC[-3]>=9,RC[-3]<10),30,IF(AND(RC[-3]>RC[-1],RC[-3]>=10,RC[-3]<11),20,IF(AND(RC[-3]>RC[-1],RC[-3]>=11,RC[-3]<12),10,IF(AND(RC[-3]>RC[-1],RC[-3]>=12),0))))))))))))))))))))))))))))))))) -> 10 | H541: =IF(RC[-3]="","",IF(RC[-3]<0.3,100,IF(AND(RC[-3]>=0.3,RC[-3]>0.4),95,IF(AND(RC[-3]>=0.4,RC[-3]<0.5),90,IF(AND(RC[-3]>=0.5,RC[-3]<0.6),85,IF(AND(RC[-3]>=0.6,RC[-3]<0.7),80,IF(AND(RC[-3]>=0.6,RC[-3]<1),80,IF(AND(RC[-3]>1,RC[-3]<2),50,IF(RC[-3]>2,0))))))))) ->  | I541: =IF(RC[-1]="",RC[-2],0.7*RC[-1]+0.3*RC[-2]) -> 10
A542: فعالان بورس انرژی | B542: انرژی2 | C542: =VLOOKUP(RC[-1],Sheet1!R3C2:R802C3,2,FALSE) -> فعالیتهای کمکی به نهاد های مالی واسط | D542: =VLOOKUP(RC[-2],Sheet1!R3C2:R802C9,8,FALSE) -> 64.397138841381562 | E542: =IF(VLOOKUP(RC[-3],Sheet1!R3C2:R803C11,10,FALSE)=0,"",VLOOKUP(Sheet2!RC[-3],Sheet1!R[1]C[-3]:R[801]C[6],10,FALSE)) ->  | F542: =Sheet1!R582C10 -> 20.545875985533669 | G542: =IF(RC[-3]<0,0,IF(AND(RC[-3]<RC[-1],RC[-3]<2),100,IF(AND(RC[-3]<RC[-1],RC[-3]>=2,RC[-3]<3),95,IF(AND(RC[-3]<RC[-1],RC[-3]>=3,RC[-3]<4),90,IF(AND(RC[-3]<RC[-1],RC[-3]>=4,RC[-3]<5),85,IF(AND(RC[-3]<RC[-1],RC[-3]>=5,RC[-3]<6),80,IF(AND(RC[-3]<RC[-1],RC[-3]>=6,RC[-3]<7),75,IF(AND(RC[-3]<RC[-1],RC[-3]>=7,RC[-3]<8),70,IF(AND(RC[-3]<RC[-1],RC[-3]>=8,RC[-3]<9),65,IF(AND(RC[-3]<RC[-1],RC[-3]>=9,RC[-3]<10),60,IF(AND(RC[-3]<RC[-1],RC[-3]>=10,RC[-3]<11),55,IF(AND(RC[-3]<RC[-1],RC[-3]>=11,RC[-3]<12),50,IF(AND(RC[-3]<RC[-1],RC[-3]>=12,RC[-3]<13),45,IF(AND(RC[-3]<RC[-1],RC[-3]>=13,RC[-3]<14),40,IF(AND(RC[-3]<RC[-1],RC[-3]>=14,RC[-3]<15),35,IF(AND(RC[-3]<RC[-1],RC[-3]>=15,RC[-3]<16),30,IF(AND(RC[-3]<RC[-1],RC[-3]>=16,RC[-3]<17),25,IF(AND(RC[-3]<RC[-1],RC[-3]>=17,RC[-3]<18),20,IF(AND(RC[-3]<RC[-1],RC[-3]>=18,RC[-3]<19),15,IF(AND(RC[-3]<RC[-1],RC[-3]>=19,RC[-3]<20),10,IF(AND(RC[-3]<RC[-1],RC[-3]>=20,RC[-3]<21),5,IF(AND(RC[-3]<RC[-1],RC[-3]>=21),0,IF(AND(RC[-3]>RC[-1],RC[-3]>=2,RC[-3]<3),90,IF(AND(RC[-3]>RC[-1],RC[-3]>=3,RC[-3]<4),90,IF(AND(RC[-3]>RC[-1],RC[-3]>=4,RC[-3]<5),80,IF(AND(RC[-3]>RC[-1],RC[-3]>=5,RC[-3]<6),70,IF(AND(RC[-3]>RC[-1],RC[-3]>=6,RC[-3]<7),60,IF(AND(RC[-3]>RC[-1],RC[-3]>=7,RC[-3]<8),50,IF(AND(RC[-3]>RC[-1],RC[-3]>=8,RC[-3]<9),40,IF(AND(RC[-3]>RC[-1],RC[-3]>=9,RC[-3]<10),30,IF(AND(RC[-3]>RC[-1],RC[-3]>=10,RC[-3]<11),20,IF(AND(RC[-3]>RC[-1],RC[-3]>=11,RC[-3]<12),10,IF(AND(RC[-3]>RC[-1],RC[-3]>=12),0))))))))))))))))))))))))))))))))) -> 0 | H542: =IF(RC[-3]="","",IF(RC[-3]<0.3,100,IF(AND(RC[-3]>=0.3,RC[-3]>0.4),95,IF(AND(RC[-3]>=0.4,RC[-3]<0.5),90,IF(AND(RC[-3]>=0.5,RC[-3]<0.6),85,IF(AND(RC[-3]>=0.6,RC[-3]<0.7),80,IF(AND(RC[-3]>=0.6,RC[-3]<1),80,IF(AND(RC[-3]>1,RC[-3]<2),50,IF(RC[-3]>2,0))))))))) ->  | I542: =IF(RC[-1]="",RC[-2],0.7*RC[-1]+0.3*RC[-2]) -> 0
A543: نهادهای مالی بورس انرژی | B543: انرژی1 | C543: =VLOOKUP(RC[-1],Sheet1!R3C2:R802C3,2,FALSE) -> فعالیتهای کمکی به نهاد های مالی واسط | D543: =VLOOKUP(RC[-2],Sheet1!R3C2:R802C9,8,FALSE) -> 66.578168896254056 | E543: =IF(VLOOKUP(RC[-3],Sheet1!R3C2:R803C11,10,FALSE)=0,"",VLOOKUP(Sheet2!RC[-3],Sheet1!R[1]C[-3]:R[801]C[6],10,FALSE)) ->  | F543: =Sheet1!R582C10 -> 20.545875985533669 | G543: =IF(RC[-3]<0,0,IF(AND(RC[-3]<RC[-1],RC[-3]<2),100,IF(AND(RC[-3]<RC[-1],RC[-3]>=2,RC[-3]<3),95,IF(AND(RC[-3]<RC[-1],RC[-3]>=3,RC[-3]<4),90,IF(AND(RC[-3]<RC[-1],RC[-3]>=4,RC[-3]<5),85,IF(AND(RC[-3]<RC[-1],RC[-3]>=5,RC[-3]<6),80,IF(AND(RC[-3]<RC[-1],RC[-3]>=6,RC[-3]<7),75,IF(AND(RC[-3]<RC[-1],RC[-3]>=7,RC[-3]<8),70,IF(AND(RC[-3]<RC[-1],RC[-3]>=8,RC[-3]<9),65,IF(AND(RC[-3]<RC[-1],RC[-3]>=9,RC[-3]<10),60,IF(AND(RC[-3]<RC[-1],RC[-3]>=10,RC[-3]<11),55,IF(AND(RC[-3]<RC[-1],RC[-3]>=11,RC[-3]<12),50,IF(AND(RC[-3]<RC[-1],RC[-3]>=12,RC[-3]<13),45,IF(AND(RC[-3]<RC[-1],RC[-3]>=13,RC[-3]<14),40,IF(AND(RC[-3]<RC[-1],RC[-3]>=14,RC[-3]<15),35,IF(AND(RC[-3]<RC[-1],RC[-3]>=15,RC[-3]<16),30,IF(AND(RC[-3]<RC[-1],RC[-3]>=16,RC[-3]<17),25,IF(AND(RC[-3]<RC[-1],RC[-3]>=17,RC[-3]<18),20,IF(AND(RC[-3]<RC[-1],RC[-3]>=18,RC[-3]<19),15,IF(AND(RC[-3]<RC[-1],RC[-3]>=19,RC[-3]<20),10,IF(AND(RC[-3]<RC[-1],RC[-3]>=20,RC[-3]<21),5,IF(AND(RC[-3]<RC[-1],RC[-3]>=21),0,IF(AND(RC[-3]>RC[-1],RC[-3]>=2,RC[-3]<3),90,IF(AND(RC[-3]>RC[-1],RC[-3]>=3,RC[-3]<4),90,IF(AND(RC[-3]>RC[-1],RC[-3]>=4,RC[-3]<5),80,IF(AND(RC[-3]>RC[-1],RC[-3]>=5,RC[-3]<6),70,IF(AND(RC[-3]>RC[-1],RC[-3]>=6,RC[-3]<7),60,IF(AND(RC[-3]>RC[-1],RC[-3]>=7,RC[-3]<8),50,IF(AND(RC[-3]>RC[-1],RC[-3]>=8,RC[-3]<9),40,IF(AND(RC[-3]>RC[-1],RC[-3]>=9,RC[-3]<10),30,IF(AND(RC[-3]>RC[-1],RC[-3]>=10,RC[-3]<11),20,IF(AND(RC[-3]>RC[-1],RC[-3]>=11,RC[-3]<12),10,IF(AND(RC[-3]>RC[-1],RC[-3]>=12),0))))))))))))))))))))))))))))))))) -> 0 | H543: =IF(RC[-3]="","",IF(RC[-3]<0.3,100,IF(AND(RC[-3]>=0.3,RC[-3]>0.4),95,IF(AND(RC[-3]>=0.4,RC[-3]<0.5),90,IF(AND(RC[-3]>=0.5,RC[-3]<0.6),85,IF(AND(RC[-3]>=0.6,RC[-3]<0.7),80,IF(AND(RC[-3]>=0.6,RC[-3]<1),80,IF(AND(RC[-3]>1,RC[-3]<2),50,IF(RC[-3]>2,0))))))))) ->  | I543: =IF(RC[-1]="",RC[-2],0.7*RC[-1]+0.3*RC[-2]) -> 0
A544: آلومراد | B544: فمراد | C544: =VLOOKUP(RC[-1],Sheet1!R3C2:R802C3,2,FALSE) -> فلزات اساسی | D544: =VLOOKUP(RC[-2],Sheet1!R3C2:R802C9,8,FALSE) -> 30 | E544: =IF(VLOOKUP(RC[-3],Sheet1!R3C2:R803C11,10,FALSE)=0,"",VLOOKUP(Sheet2!RC[-3],Sheet1!R[1]C[-3]:R[801]C[6],10,FALSE)) ->  | F544: =Sheet1!R634C10 -> 7.4779348942651307 | G544: =IF(RC[-3]<0,0,IF(AND(RC[-3]<RC[-1],RC[-3]<2),100,IF(AND(RC[-3]<RC[-1],RC[-3]>=2,RC[-3]<3),95,IF(AND(RC[-3]<RC[-1],RC[-3]>=3,RC[-3]<4),90,IF(AND(RC[-3]<RC[-1],RC[-3]>=4,RC[-3]<5),85,IF(AND(RC[-3]<RC[-1],RC[-3]>=5,RC[-3]<6),80,IF(AND(RC[-3]<RC[-1],RC[-3]>=6,RC[-3]<7),75,IF(AND(RC[-3]<RC[-1],RC[-3]>=7,RC[-3]<8),70,IF(AND(RC[-3]<RC[-1],RC[-3]>=8,RC[-3]<9),65,IF(AND(RC[-3]<RC[-1],RC[-3]>=9,RC[-3]<10),60,IF(AND(RC[-3]<RC[-1],RC[-3]>=10,RC[-3]<11),55,IF(AND(RC[-3]<RC[-1],RC[-3]>=11,RC[-3]<12),50,IF(AND(RC[-3]<RC[-1],RC[-3]>=12,RC[-3]<13),45,IF(AND(RC[-3]<RC[-1],RC[-3]>=13,RC[-3]<14),40,IF(AND(RC[-3]<RC[-1],RC[-3]>=14,RC[-3]<15),35,IF(AND(RC[-3]<RC[-1],RC[-3]>=15,RC[-3]<16),30,IF(AND(RC[-3]<RC[-1],RC[-3]>=16,RC[-3]<17),25,IF(AND(RC[-3]<RC[-1],RC[-3]>=17,RC[-3]<18),20,IF(AND(RC[-3]<RC[-1],RC[-3]>=18,RC[-3]<19),15,IF(AND(RC[-3]<RC[-1],RC[-3]>=19,RC[-3]<20),10,IF(AND(RC[-3]<RC[-1],RC[-3]>=20,RC[-3]<21),5,IF(AND(RC[-3]<RC[-1],RC[-3]>=21),0,IF(AND(RC[-3]>RC[-1],RC[-3]>=2,RC[-3]<3),90,IF(AND(RC[-3]>RC[-1],RC[-3]>=3,RC[-3]<4),90,IF(AND(RC[-3]>RC[-1],RC[-3]>=4,RC[-3]<5),80,IF(AND(RC[-3]>RC[-1],RC[-3]>=5,RC[-3]<6),70,IF(AND(RC[-3]>RC[-1],RC[-3]>=6,RC[-3]<7),60,IF(AND(RC[-3]>RC[-1],RC[-3]>=7,RC[-3]<8),50,IF(AND(RC[-3]>RC[-1],RC[-3]>=8,RC[-3]<9),40,IF(AND(RC[-3]>RC[-1],RC[-3]>=9,RC[-3]<10),30,IF(AND(RC[-3]>RC[-1],RC[-3]>=10,RC[-3]<11),20,IF(AND(RC[-3]>RC[-1],RC[-3]>=11,RC[-3]<12),10,IF(AND(RC[-3]>RC[-1],RC[-3]>=12),0))))))))))))))))))))))))))))))))) -> 0 | H544: =IF(RC[-3]="","",IF(RC[-3]<0.3,100,IF(AND(RC[-3]>=0.3,RC[-3]>0.4),95,IF(AND(RC[-3]>=0.4,RC[-3]<0.5),90,IF(AND(RC[-3]>=0.5,RC[-3]<0.6),85,IF(AND(RC[-3]>=0.6,RC[-3]<0.7),80,IF(AND(RC[-3]>=0.6,RC[-3]<1),80,IF(AND(RC[-3]>1,RC[-3]<2),50,IF(RC[-3]>2,0))))))))) ->  | I544: =IF(RC[-1]="",RC[-2],0.7*RC[-1]+0.3*RC[-2]) -> 0
A545: آلومینیوم ایران | B545: فایرا | C545: =VLOOKUP(RC[-1],Sheet1!R3C2:R802C3,2,FALSE) -> فلزات اساسی | D545: =VLOOKUP(RC[-2],Sheet1!R3C2:R802C9,8,FALSE) -> 3.2994075433615184 | E545: =IF(VLOOKUP(RC[-3],Sheet1!R3C2:R803C11,10,FALSE)=0,"",VLOOKUP(Sheet2!RC[-3],Sheet1!R[1]C[-3]:R[801]C[6],10,FALSE)) ->  | F545: =Sheet1!R634C10 -> 7.4779348942651307 | G545: =IF(RC[-3]<0,0,IF(AND(RC[-3]<RC[-1],RC[-3]<2),100,IF(AND(RC[-3]<RC[-1],RC[-3]>=2,RC[-3]<3),95,IF(AND(RC[-3]<RC[-1],RC[-3]>=3,RC[-3]<4),90,IF(AND(RC[-3]<RC[-1],RC[-3]>=4,RC[-3]<5),85,IF(AND(RC[-3]<RC[-1],RC[-3]>=5,RC[-3]<6),80,IF(AND(RC[-3]<RC[-1],RC[-3]>=6,RC[-3]<7),75,IF(AND(RC[-3]<RC[-1],RC[-3]>=7,RC[-3]<8),70,IF(AND(RC[-3]<RC[-1],RC[-3]>=8,RC[-3]<9),65,IF(AND(RC[-3]<RC[-1],RC[-3]>=9,RC[-3]<10),60,IF(AND(RC[-3]<RC[-1],RC[-3]>=10,RC[-3]<11),55,IF(AND(RC[-3]<RC[-1],RC[-3]>=11,RC[-3]<12),50,IF(AND(RC[-3]<RC[-1],RC[-3]>=12,RC[-3]<13),45,IF(AND(RC[-3]<RC[-1],RC[-3]>=13,RC[-3]<14),40,IF(AND(RC[-3]<RC[-1],RC[-3]>=14,RC[-3]<15),35,IF(AND(RC[-3]<RC[-1],RC[-3]>=15,RC[-3]<16),30,IF(AND(RC[-3]<RC[-1],RC[-3]>=16,RC[-3]<17),25,IF(AND(RC[-3]<RC[-1],RC[-3]>=17,RC[-3]<18),20,IF(AND(RC[-3]<RC[-1],RC[-3]>=18,RC[-3]<19),15,IF(AND(RC[-3]<RC[-1],RC[-3]>=19,RC[-3]<20),10,IF(AND(RC[-3]<RC[-1],RC[-3]>=20,RC[-3]<21),5,IF(AND(RC[-3]<RC[-1],RC[-3]>=21),0,IF(AND(RC[-3]>RC[-1],RC[-3]>=2,RC[-3]<3),90,IF(AND(RC[-3]>RC[-1],RC[-3]>=3,RC[-3]<4),90,IF(AND(RC[-3]>RC[-1],RC[-3]>=4,RC[-3]<5),80,IF(AND(RC[-3]>RC[-1],RC[-3]>=5,RC[-3]<6),70,IF(AND(RC[-3]>RC[-1],RC[-3]>=6,RC[-3]<7),60,IF(AND(RC[-3]>RC[-1],RC[-3]>=7,RC[-3]<8),50,IF(AND(RC[-3]>RC[-1],RC[-3]>=8,RC[-3]<9),40,IF(AND(RC[-3]>RC[-1],RC[-3]>=9,RC[-3]<10),30,IF(AND(RC[-3]>RC[-1],RC[-3]>=10,RC[-3]<11),20,IF(AND(RC[-3]>RC[-1],RC[-3]>=11,RC[-3]<12),10,IF(AND(RC[-3]>RC[-1],RC[-3]>=12),0))))))))))))))))))))))))))))))))) -> 90 | H545: =IF(RC[-3]="","",IF(RC[-3]<0.3,100,IF(AND(RC[-3]>=0.3,RC[-3]>0.4),95,IF(AND(RC[-3]>=0.4,RC[-3]<0.5),90,IF(AND(RC[-3]>=0.5,RC[-3]<0.6),85,IF(AND(RC[-3]>=0.6,RC[-3]<0.7),80,IF(AND(RC[-3]>=0.6,RC[-3]<1),80,IF(AND(RC[-3]>1,RC[-3]<2),50,IF(RC[-3]>2,0))))))))) ->  | I545: =IF(RC[-1]="",RC[-2],0.7*RC[-1]+0.3*RC[-2]) -> 90
A546: آهن و فولاد ارفع | B546: ارفع | C546: =VLOOKUP(RC[-1],Sheet1!R3C2:R802C3,2,FALSE) -> فلزات اساسی | D546: =VLOOKUP(RC[-2],Sheet1!R3C2:R802C9,8,FALSE) -> 5.5946475659304982 | E546: =IF(VLOOKUP(RC[-3],Sheet1!R3C2:R803C11,10,FALSE)=0,"",VLOOKUP(Sheet2!RC[-3],Sheet1!R[1]C[-3]:R[801]C[6],10,FALSE)) ->  | F546: =Sheet1!R634C10 -> 7.4779348942651307 | G546: =IF(RC[-3]<0,0,IF(AND(RC[-3]<RC[-1],RC[-3]<2),100,IF(AND(RC[-3]<RC[-1],RC[-3]>=2,RC[-3]<3),95,IF(AND(RC[-3]<RC[-1],RC[-3]>=3,RC[-3]<4),90,IF(AND(RC[-3]<RC[-1],RC[-3]>=4,RC[-3]<5),85,IF(AND(RC[-3]<RC[-1],RC[-3]>=5,RC[-3]<6),80,IF(AND(RC[-3]<RC[-1],RC[-3]>=6,RC[-3]<7),75,IF(AND(RC[-3]<RC[-1],RC[-3]>=7,RC[-3]<8),70,IF(AND(RC[-3]<RC[-1],RC[-3]>=8,RC[-3]<9),65,IF(AND(RC[-3]<RC[-1],RC[-3]>=9,RC[-3]<10),60,IF(AND(RC[-3]<RC[-1],RC[-3]>=10,RC[-3]<11),55,IF(AND(RC[-3]<RC[-1],RC[-3]>=11,RC[-3]<12),50,IF(AND(RC[-3]<RC[-1],RC[-3]>=12,RC[-3]<13),45,IF(AND(RC[-3]<RC[-1],RC[-3]>=13,RC[-3]<14),40,IF(AND(RC[-3]<RC[-1],RC[-3]>=14,RC[-3]<15),35,IF(AND(RC[-3]<RC[-1],RC[-3]>=15,RC[-3]<16),30,IF(AND(RC[-3]<RC[-1],RC[-3]>=16,RC[-3]<17),25,IF(AND(RC[-3]<RC[-1],RC[-3]>=17,RC[-3]<18),20,IF(AND(RC[-3]<RC[-1],RC[-3]>=18,RC[-3]<19),15,IF(AND(RC[-3]<RC[-1],RC[-3]>=19,RC[-3]<20),10,IF(AND(RC[-3]<RC[-1],RC[-3]>=20,RC[-3]<21),5,IF(AND(RC[-3]<RC[-1],RC[-3]>=21),0,IF(AND(RC[-3]>RC[-1],RC[-3]>=2,RC[-3]<3),90,IF(AND(RC[-3]>RC[-1],RC[-3]>=3,RC[-3]<4),90,IF(AND(RC[-3]>RC[-1],RC[-3]>=4,RC[-3]<5),80,IF(AND(RC[-3]>RC[-1],RC[-3]>=5,RC[-3]<6),70,IF(AND(RC[-3]>RC[-1],RC[-3]>=6,RC[-3]<7),60,IF(AND(RC[-3]>RC[-1],RC[-3]>=7,RC[-3]<8),50,IF(AND(RC[-3]>RC[-1],RC[-3]>=8,RC[-3]<9),40,IF(AND(RC[-3]>RC[-1],RC[-3]>=9,RC[-3]<10),30,IF(AND(RC[-3]>RC[-1],RC[-3]>=10,RC[-3]<11),20,IF(AND(RC[-3]>RC[-1],RC[-3]>=11,RC[-3]<12),10,IF(AND(RC[-3]>RC[-1],RC[-3]>=12),0))))))))))))))))))))))))))))))))) -> 80 | H546: =IF(RC[-3]="","",IF(RC[-3]<0.3,100,IF(AND(RC[-3]>=0.3,RC[-3]>0.4),95,IF(AND(RC[-3]>=0.4,RC[-3]<0.5),90,IF(AND(RC[-3]>=0.5,RC[-3]<0.6),85,IF(AND(RC[-3]>=0.6,RC[-3]<0.7),80,IF(AND(RC[-3]>=0.6,RC[-3]<1),80,IF(AND(RC[-3]>1,RC[-3]<2),50,IF(RC[-3]>2,0))))))))) ->  | I546: =IF(RC[-1]="",RC[-2],0.7*RC[-1]+0.3*RC[-2]) -> 80
A547: آهن و فولاد غدیر ایرانیان | B547: فغدیر | C547: =VLOOKUP(RC[-1],Sheet1!R3C2:R802C3,2,FALSE) -> فلزات اساسی | D547: =VLOOKUP(RC[-2],Sheet1!R3C2:R802C9,8,FALSE) -> 5.1353920247805878 | E547: =IF(VLOOKUP(RC[-3],Sheet1!R3C2:R803C11,10,FALSE)=0,"",VLOOKUP(Sheet2!RC[-3],Sheet1!R[1]C[-3]:R[801]C[6],10,FALSE)) ->  | F547: =Sheet1!R634C10 -> 7.4779348942651307 | G547: =IF(RC[-3]<0,0,IF(AND(RC[-3]<RC[-1],RC[-3]<2),100,IF(AND(RC[-3]<RC[-1],RC[-3]>=2,RC[-3]<3),95,IF(AND(RC[-3]<RC[-1],RC[-3]>=3,RC[-3]<4),90,IF(AND(RC[-3]<RC[-1],RC[-3]>=4,RC[-3]<5),85,IF(AND(RC[-3]<RC[-1],RC[-3]>=5,RC[-3]<6),80,IF(AND(RC[-3]<RC[-1],RC[-3]>=6,RC[-3]<7),75,IF(AND(RC[-3]<RC[-1],RC[-3]>=7,RC[-3]<8),70,IF(AND(RC[-3]<RC[-1],RC[-3]>=8,RC[-3]<9),65,IF(AND(RC[-3]<RC[-1],RC[-3]>=9,RC[-3]<10),60,IF(AND(RC[-3]<RC[-1],RC[-3]>=10,RC[-3]<11),55,IF(AND(RC[-3]<RC[-1],RC[-3]>=11,RC[-3]<12),50,IF(AND(RC[-3]<RC[-1],RC[-3]>=12,RC[-3]<13),45,IF(AND(RC[-3]<RC[-1],RC[-3]>=13,RC[-3]<14),40,IF(AND(RC[-3]<RC[-1],RC[-3]>=14,RC[-3]<15),35,IF(AND(RC[-3]<RC[-1],RC[-3]>=15,RC[-3]<16),30,IF(AND(RC[-3]<RC[-1],RC[-3]>=16,RC[-3]<17),25,IF(AND(RC[-3]<RC[-1],RC[-3]>=17,RC[-3]<18),20,IF(AND(RC[-3]<RC[-1],RC[-3]>=18,RC[-3]<19),15,IF(AND(RC[-3]<RC[-1],RC[-3]>=19,RC[-3]<20),10,IF(AND(RC[-3]<RC[-1],RC[-3]>=20,RC[-3]<21),5,IF(AND(RC[-3]<RC[-1],RC[-3]>=21),0,IF(AND(RC[-3]>RC[-1],RC[-3]>=2,RC[-3]<3),90,IF(AND(RC[-3]>RC[-1],RC[-3]>=3,RC[-3]<4),90,IF(AND(RC[-3]>RC[-1],RC[-3]>=4,RC[-3]<5),80,IF(AND(RC[-3]>RC[-1],RC[-3]>=5,RC[-3]<6),70,IF(AND(RC[-3]>RC[-1],RC[-3]>=6,RC[-3]<7),60,IF(AND(RC[-3]>RC[-1],RC[-3]>=7,RC[-3]<8),50,IF(AND(RC[-3]>RC[-1],RC[-3]>=8,RC[-3]<9),40,IF(AND(RC[-3]>RC[-1],RC[-3]>=9,RC[-3]<10),30,IF(AND(RC[-3]>RC[-1],RC[-3]>=10,RC[-3]<11),20,IF(AND(RC[-3]>RC[-1],RC[-3]>=11,RC[-3]<12),10,IF(AND(RC[-3]>RC[-1],RC[-3]>=12),0))))))))))))))))))))))))))))))))) -> 80 | H547: =IF(RC[-3]="","",IF(RC[-3]<0.3,100,IF(AND(RC[-3]>=0.3,RC[-3]>0.4),95,IF(AND(RC[-3]>=0.4,RC[-3]<0.5),90,IF(AND(RC[-3]>=0.5,RC[-3]<0.6),85,IF(AND(RC[-3]>=0.6,RC[-3]<0.7),80,IF(AND(RC[-3]>=0.6,RC[-3]<1),80,IF(AND(RC[-3]>1,RC[-3]<2),50,IF(RC[-3]>2,0))))))))) ->  | I547: =IF(RC[-1]="",RC[-2],0.7*RC[-1]+0.3*RC[-2]) -> 80
A548: پارس فولاد سبزوار | B548: فسبزوار | C548: =VLOOKUP(RC[-1],Sheet1!R3C2:R802C3,2,FALSE) -> فلزات اساسی | D548: =VLOOKUP(RC[-2],Sheet1!R3C2:R802C9,8,FALSE) -> 3.7782312457470142 | E548: =IF(VLOOKUP(RC[-3],Sheet1!R3C2:R803C11,10,FALSE)=0,"",VLOOKUP(Sheet2!RC[-3],Sheet1!R[1]C[-3]:R[801]C[6],10,FALSE)) ->  | F548: =Sheet1!R634C10 -> 7.4779348942651307 | G548: =IF(RC[-3]<0,0,IF(AND(RC[-3]<RC[-1],RC[-3]<2),100,IF(AND(RC[-3]<RC[-1],RC[-3]>=2,RC[-3]<3),95,IF(AND(RC[-3]<RC[-1],RC[-3]>=3,RC[-3]<4),90,IF(AND(RC[-3]<RC[-1],RC[-3]>=4,RC[-3]<5),85,IF(AND(RC[-3]<RC[-1],RC[-3]>=5,RC[-3]<6),80,IF(AND(RC[-3]<RC[-1],RC[-3]>=6,RC[-3]<7),75,IF(AND(RC[-3]<RC[-1],RC[-3]>=7,RC[-3]<8),70,IF(AND(RC[-3]<RC[-1],RC[-3]>=8,RC[-3]<9),65,IF(AND(RC[-3]<RC[-1],RC[-3]>=9,RC[-3]<10),60,IF(AND(RC[-3]<RC[-1],RC[-3]>=10,RC[-3]<11),55,IF(AND(RC[-3]<RC[-1],RC[-3]>=11,RC[-3]<12),50,IF(AND(RC[-3]<RC[-1],RC[-3]>=12,RC[-3]<13),45,IF(AND(RC[-3]<RC[-1],RC[-3]>=13,RC[-3]<14),40,IF(AND(RC[-3]<RC[-1],RC[-3]>=14,RC[-3]<15),35,IF(AND(RC[-3]<RC[-1],RC[-3]>=15,RC[-3]<16),30,IF(AND(RC[-3]<RC[-1],RC[-3]>=16,RC[-3]<17),25,IF(AND(RC[-3]<RC[-1],RC[-3]>=17,RC[-3]<18),20,IF(AND(RC[-3]<RC[-1],RC[-3]>=18,RC[-3]<19),15,IF(AND(RC[-3]<RC[-1],RC[-3]>=19,RC[-3]<20),10,IF(AND(RC[-3]<RC[-1],RC[-3]>=20,RC[-3]<21),5,IF(AND(RC[-3]<RC[-1],RC[-3]>=21),0,IF(AND(RC[-3]>RC[-1],RC[-3]>=2,RC[-3]<3),90,IF(AND(RC[-3]>RC[-1],RC[-3]>=3,RC[-3]<4),90,IF(AND(RC[-3]>RC[-1],RC[-3]>=4,RC[-3]<5),80,IF(AND(RC[-3]>RC[-1],RC[-3]>=5,RC[-3]<6),70,IF(AND(RC[-3]>RC[-1],RC[-3]>=6,RC[-3]<7),60,IF(AND(RC[-3]>RC[-1],RC[-3]>=7,RC[-3]<8),50,IF(AND(RC[-3]>RC[-1],RC[-3]>=8,RC[-3]<9),40,IF(AND(RC[-3]>RC[-1],RC[-3]>=9,RC[-3]<10),30,IF(AND(RC[-3]>RC[-1],RC[-3]>=10,RC[-3]<11),20,IF(AND(RC[-3]>RC[-1],RC[-3]>=11,RC[-3]<12),10,IF(AND(RC[-3]>RC[-1],RC[-3]>=12),0))))))))))))))))))))))))))))))))) -> 90 | H548: =IF(RC[-3]="","",IF(RC[-3]<0.3,100,IF(AND(RC[-3]>=0.3,RC[-3]>0.4),95,IF(AND(RC[-3]>=0.4,RC[-3]<0.5),90,IF(AND(RC[-3]>=0.5,RC[-3]<0.6),85,IF(AND(RC[-3]>=0.6,RC[-3]<0.7),80,IF(AND(RC[-3]>=0.6,RC[-3]<1),80,IF(AND(RC[-3]>1,RC[-3]<2),50,IF(RC[-3]>2,0))))))))) ->  | I548: =IF(RC[-1]="",RC[-2],0.7*RC[-1]+0.3*RC[-2]) -> 90
A549: تجهیزات سدید | B549: فسدید | C549: =VLOOKUP(RC[-1],Sheet1!R3C2:R802C3,2,FALSE) -> فلزات اساسی | D549: =VLOOKUP(RC[-2],Sheet1!R3C2:R802C9,8,FALSE) -> -2.7579439252336453 | E549: =IF(VLOOKUP(RC[-3],Sheet1!R3C2:R803C11,10,FALSE)=0,"",VLOOKUP(Sheet2!RC[-3],Sheet1!R[1]C[-3]:R[801]C[6],10,FALSE)) ->  | F549: =Sheet1!R634C10 -> 7.4779348942651307 | G549: =IF(RC[-3]<0,0,IF(AND(RC[-3]<RC[-1],RC[-3]<2),100,IF(AND(RC[-3]<RC[-1],RC[-3]>=2,RC[-3]<3),95,IF(AND(RC[-3]<RC[-1],RC[-3]>=3,RC[-3]<4),90,IF(AND(RC[-3]<RC[-1],RC[-3]>=4,RC[-3]<5),85,IF(AND(RC[-3]<RC[-1],RC[-3]>=5,RC[-3]<6),80,IF(AND(RC[-3]<RC[-1],RC[-3]>=6,RC[-3]<7),75,IF(AND(RC[-3]<RC[-1],RC[-3]>=7,RC[-3]<8),70,IF(AND(RC[-3]<RC[-1],RC[-3]>=8,RC[-3]<9),65,IF(AND(RC[-3]<RC[-1],RC[-3]>=9,RC[-3]<10),60,IF(AND(RC[-3]<RC[-1],RC[-3]>=10,RC[-3]<11),55,IF(AND(RC[-3]<RC[-1],RC[-3]>=11,RC[-3]<12),50,IF(AND(RC[-3]<RC[-1],RC[-3]>=12,RC[-3]<13),45,IF(AND(RC[-3]<RC[-1],RC[-3]>=13,RC[-3]<14),40,IF(AND(RC[-3]<RC[-1],RC[-3]>=14,RC[-3]<15),35,IF(AND(RC[-3]<RC[-1],RC[-3]>=15,RC[-3]<16),30,IF(AND(RC[-3]<RC[-1],RC[-3]>=16,RC[-3]<17),25,IF(AND(RC[-3]<RC[-1],RC[-3]>=17,RC[-3]<18),20,IF(AND(RC[-3]<RC[-1],RC[-3]>=18,RC[-3]<19),15,IF(AND(RC[-3]<RC[-1],RC[-3]>=19,RC[-3]<20),10,IF(AND(RC[-3]<RC[-1],RC[-3]>=20,RC[-3]<21),5,IF(AND(RC[-3]<RC[-1],RC[-3]>=21),0,IF(AND(RC[-3]>RC[-1],RC[-3]>=2,RC[-3]<3),90,IF(AND(RC[-3]>RC[-1],RC[-3]>=3,RC[-3]<4),90,IF(AND(RC[-3]>RC[-1],RC[-3]>=4,RC[-3]<5),80,IF(AND(RC[-3]>RC[-1],RC[-3]>=5,RC[-3]<6),70,IF(AND(RC[-3]>RC[-1],RC[-3]>=6,RC[-3]<7),60,IF(AND(RC[-3]>RC[-1],RC[-3]>=7,RC[-3]<8),50,IF(AND(RC[-3]>RC[-1],RC[-3]>=8,RC[-3]<9),40,IF(AND(RC[-3]>RC[-1],RC[-3]>=9,RC[-3]<10),30,IF(AND(RC[-3]>RC[-1],RC[-3]>=10,RC[-3]<11),20,IF(AND(RC[-3]>RC[-1],RC[-3]>=11,RC[-3]<12),10,IF(AND(RC[-3]>RC[-1],RC[-3]>=12),0))))))))))))))))))))))))))))))))) -> 0 | H549: =IF(RC[-3]="","",IF(RC[-3]<0.3,100,IF(AND(RC[-3]>=0.3,RC[-3]>0.4),95,IF(AND(RC[-3]>=0.4,RC[-3]<0.5),90,IF(AND(RC[-3]>=0.5,RC[-3]<0.6),85,IF(AND(RC[-3]>=0.6,RC[-3]<0.7),80,IF(AND(RC[-3]>=0.6,RC[-3]<1),80,IF(AND(RC[-3]>1,RC[-3]<2),50,IF(RC[-3]>2,0))))))))) ->  | I549: =IF(RC[-1]="",RC[-2],0.7*RC[-1]+0.3*RC[-2]) -> 0
A550: تولید و توسعه سرب روی ایرانیان | B550: فتوسا | C550: =VLOOKUP(RC[-1],Sheet1!R3C2:R802C3,2,FALSE) -> فلزات اساسی | D550: =VLOOKUP(RC[-2],Sheet1!R3C2:R802C9,8,FALSE) -> 9 | E550: =IF(VLOOKUP(RC[-3],Sheet1!R3C2:R803C11,10,FALSE)=0,"",VLOOKUP(Sheet2!RC[-3],Sheet1!R[1]C[-3]:R[801]C[6],10,FALSE)) ->  | F550: =Sheet1!R634C10 -> 7.4779348942651307 | G550: =IF(RC[-3]<0,0,IF(AND(RC[-3]<RC[-1],RC[-3]<2),100,IF(AND(RC[-3]<RC[-1],RC[-3]>=2,RC[-3]<3),95,IF(AND(RC[-3]<RC[-1],RC[-3]>=3,RC[-3]<4),90,IF(AND(RC[-3]<RC[-1],RC[-3]>=4,RC[-3]<5),85,IF(AND(RC[-3]<RC[-1],RC[-3]>=5,RC[-3]<6),80,IF(AND(RC[-3]<RC[-1],RC[-3]>=6,RC[-3]<7),75,IF(AND(RC[-3]<RC[-1],RC[-3]>=7,RC[-3]<8),70,IF(AND(RC[-3]<RC[-1],RC[-3]>=8,RC[-3]<9),65,IF(AND(RC[-3]<RC[-1],RC[-3]>=9,RC[-3]<10),60,IF(AND(RC[-3]<RC[-1],RC[-3]>=10,RC[-3]<11),55,IF(AND(RC[-3]<RC[-1],RC[-3]>=11,RC[-3]<12),50,IF(AND(RC[-3]<RC[-1],RC[-3]>=12,RC[-3]<13),45,IF(AND(RC[-3]<RC[-1],RC[-3]>=13,RC[-3]<14),40,IF(AND(RC[-3]<RC[-1],RC[-3]>=14,RC[-3]<15),35,IF(AND(RC[-3]<RC[-1],RC[-3]>=15,RC[-3]<16),30,IF(AND(RC[-3]<RC[-1],RC[-3]>=16,RC[-3]<17),25,IF(AND(RC[-3]<RC[-1],RC[-3]>=17,RC[-3]<18),20,IF(AND(RC[-3]<RC[-1],RC[-3]>=18,RC[-3]<19),15,IF(AND(RC[-3]<RC[-1],RC[-3]>=19,RC[-3]<20),10,IF(AND(RC[-3]<RC[-1],RC[-3]>=20,RC[-3]<21),5,IF(AND(RC[-3]<RC[-1],RC[-3]>=21),0,IF(AND(RC[-3]>RC[-1],RC[-3]>=2,RC[-3]<3),90,IF(AND(RC[-3]>RC[-1],RC[-3]>=3,RC[-3]<4),90,IF(AND(RC[-3]>RC[-1],RC[-3]>=4,RC[-3]<5),80,IF(AND(RC[-3]>RC[-1],RC[-3]>=5,RC[-3]<6),70,IF(AND(RC[-3]>RC[-1],RC[-3]>=6,RC[-3]<7),60,IF(AND(RC[-3]>RC[-1],RC[-3]>=7,RC[-3]<8),50,IF(AND(RC[-3]>RC[-1],RC[-3]>=8,RC[-3]<9),40,IF(AND(RC[-3]>RC[-1],RC[-3]>=9,RC[-3]<10),30,IF(AND(RC[-3]>RC[-1],RC[-3]>=10,RC[-3]<11),20,IF(AND(RC[-3]>RC[-1],RC[-3]>=11,RC[-3]<12),10,IF(AND(RC[-3]>RC[-1],RC[-3]>=12),0))))))))))))))))))))))))))))))))) -> 30 | H550: =IF(RC[-3]="","",IF(RC[-3]<0.3,100,IF(AND(RC[-3]>=0.3,RC[-3]>0.4),95,IF(AND(RC[-3]>=0.4,RC[-3]<0.5),90,IF(AND(RC[-3]>=0.5,RC[-3]<0.6),85,IF(AND(RC[-3]>=0.6,RC[-3]<0.7),80,IF(AND(RC[-3]>=0.6,RC[-3]<1),80,IF(AND(RC[-3]>1,RC[-3]<2),50,IF(RC[-3]>2,0))))))))) ->  | I550: =IF(RC[-1]="",RC[-2],0.7*RC[-1]+0.3*RC[-2]) -> 30
A551: جهان فولاد سیرجان | B551: فجهان | C551: =VLOOKUP(RC[-1],Sheet1!R3C2:R802C3,2,FALSE) -> فلزات اساسی | D551: =VLOOKUP(RC[-2],Sheet1!R3C2:R802C9,8,FALSE) -> 4 | E551: =IF(VLOOKUP(RC[-3],Sheet1!R3C2:R803C11,10,FALSE)=0,"",VLOOKUP(Sheet2!RC[-3],Sheet1!R[1]C[-3]:R[801]C[6],10,FALSE)) ->  | F551: =Sheet1!R634C10 -> 7.4779348942651307 | G551: =IF(RC[-3]<0,0,IF(AND(RC[-3]<RC[-1],RC[-3]<2),100,IF(AND(RC[-3]<RC[-1],RC[-3]>=2,RC[-3]<3),95,IF(AND(RC[-3]<RC[-1],RC[-3]>=3,RC[-3]<4),90,IF(AND(RC[-3]<RC[-1],RC[-3]>=4,RC[-3]<5),85,IF(AND(RC[-3]<RC[-1],RC[-3]>=5,RC[-3]<6),80,IF(AND(RC[-3]<RC[-1],RC[-3]>=6,RC[-3]<7),75,IF(AND(RC[-3]<RC[-1],RC[-3]>=7,RC[-3]<8),70,IF(AND(RC[-3]<RC[-1],RC[-3]>=8,RC[-3]<9),65,IF(AND(RC[-3]<RC[-1],RC[-3]>=9,RC[-3]<10),60,IF(AND(RC[-3]<RC[-1],RC[-3]>=10,RC[-3]<11),55,IF(AND(RC[-3]<RC[-1],RC[-3]>=11,RC[-3]<12),50,IF(AND(RC[-3]<RC[-1],RC[-3]>=12,RC[-3]<13),45,IF(AND(RC[-3]<RC[-1],RC[-3]>=13,RC[-3]<14),40,IF(AND(RC[-3]<RC[-1],RC[-3]>=14,RC[-3]<15),35,IF(AND(RC[-3]<RC[-1],RC[-3]>=15,RC[-3]<16),30,IF(AND(RC[-3]<RC[-1],RC[-3]>=16,RC[-3]<17),25,IF(AND(RC[-3]<RC[-1],RC[-3]>=17,RC[-3]<18),20,IF(AND(RC[-3]<RC[-1],RC[-3]>=18,RC[-3]<19),15,IF(AND(RC[-3]<RC[-1],RC[-3]>=19,RC[-3]<20),10,IF(AND(RC[-3]<RC[-1],RC[-3]>=20,RC[-3]<21),5,IF(AND(RC[-3]<RC[-1],RC[-3]>=21),0,IF(AND(RC[-3]>RC[-1],RC[-3]>=2,RC[-3]<3),90,IF(AND(RC[-3]>RC[-1],RC[-3]>=3,RC[-3]<4),90,IF(AND(RC[-3]>RC[-1],RC[-3]>=4,RC[-3]<5),80,IF(AND(RC[-3]>RC[-1],RC[-3]>=5,RC[-3]<6),70,IF(AND(RC[-3]>RC[-1],RC[-3]>=6,RC[-3]<7),60,IF(AND(RC[-3]>RC[-1],RC[-3]>=7,RC[-3]<8),50,IF(AND(RC[-3]>RC[-1],RC[-3]>=8,RC[-3]<9),40,IF(AND(RC[-3]>RC[-1],RC[-3]>=9,RC[-3]<10),30,IF(AND(RC[-3]>RC[-1],RC[-3]>=10,RC[-3]<11),20,IF(AND(RC[-3]>RC[-1],RC[-3]>=11,RC[-3]<12),10,IF(AND(RC[-3]>RC[-1],RC[-3]>=12),0))))))))))))))))))))))))))))))))) -> 85 | H551: =IF(RC[-3]="","",IF(RC[-3]<0.3,100,IF(AND(RC[-3]>=0.3,RC[-3]>0.4),95,IF(AND(RC[-3]>=0.4,RC[-3]<0.5),90,IF(AND(RC[-3]>=0.5,RC[-3]<0.6),85,IF(AND(RC[-3]>=0.6,RC[-3]<0.7),80,IF(AND(RC[-3]>=0.6,RC[-3]<1),80,IF(AND(RC[-3]>1,RC[-3]<2),50,IF(RC[-3]>2,0))))))))) ->  | I551: =IF(RC[-1]="",RC[-2],0.7*RC[-1]+0.3*RC[-2]) -> 85
A552: ذوب آهن اصفهان | B552: ذوب | C552: =VLOOKUP(RC[-1],Sheet1!R3C2:R802C3,2,FALSE) -> فلزات اساسی | D552: =VLOOKUP(RC[-2],Sheet1!R3C2:R802C9,8,FALSE) -> 2.7634908536585368 | E552: =IF(VLOOKUP(RC[-3],Sheet1!R3C2:R803C11,10,FALSE)=0,"",VLOOKUP(Sheet2!RC[-3],Sheet1!R[1]C[-3]:R[801]C[6],10,FALSE)) ->  | F552: =Sheet1!R634C10 -> 7.4779348942651307 | G552: =IF(RC[-3]<0,0,IF(AND(RC[-3]<RC[-1],RC[-3]<2),100,IF(AND(RC[-3]<RC[-1],RC[-3]>=2,RC[-3]<3),95,IF(AND(RC[-3]<RC[-1],RC[-3]>=3,RC[-3]<4),90,IF(AND(RC[-3]<RC[-1],RC[-3]>=4,RC[-3]<5),85,IF(AND(RC[-3]<RC[-1],RC[-3]>=5,RC[-3]<6),80,IF(AND(RC[-3]<RC[-1],RC[-3]>=6,RC[-3]<7),75,IF(AND(RC[-3]<RC[-1],RC[-3]>=7,RC[-3]<8),70,IF(AND(RC[-3]<RC[-1],RC[-3]>=8,RC[-3]<9),65,IF(AND(RC[-3]<RC[-1],RC[-3]>=9,RC[-3]<10),60,IF(AND(RC[-3]<RC[-1],RC[-3]>=10,RC[-3]<11),55,IF(AND(RC[-3]<RC[-1],RC[-3]>=11,RC[-3]<12),50,IF(AND(RC[-3]<RC[-1],RC[-3]>=12,RC[-3]<13),45,IF(AND(RC[-3]<RC[-1],RC[-3]>=13,RC[-3]<14),40,IF(AND(RC[-3]<RC[-1],RC[-3]>=14,RC[-3]<15),35,IF(AND(RC[-3]<RC[-1],RC[-3]>=15,RC[-3]<16),30,IF(AND(RC[-3]<RC[-1],RC[-3]>=16,RC[-3]<17),25,IF(AND(RC[-3]<RC[-1],RC[-3]>=17,RC[-3]<18),20,IF(AND(RC[-3]<RC[-1],RC[-3]>=18,RC[-3]<19),15,IF(AND(RC[-3]<RC[-1],RC[-3]>=19,RC[-3]<20),10,IF(AND(RC[-3]<RC[-1],RC[-3]>=20,RC[-3]<21),5,IF(AND(RC[-3]<RC[-1],RC[-3]>=21),0,IF(AND(RC[-3]>RC[-1],RC[-3]>=2,RC[-3]<3),90,IF(AND(RC[-3]>RC[-1],RC[-3]>=3,RC[-3]<4),90,IF(AND(RC[-3]>RC[-1],RC[-3]>=4,RC[-3]<5),80,IF(AND(RC[-3]>RC[-1],RC[-3]>=5,RC[-3]<6),70,IF(AND(RC[-3]>RC[-1],RC[-3]>=6,RC[-3]<7),60,IF(AND(RC[-3]>RC[-1],RC[-3]>=7,RC[-3]<8),50,IF(AND(RC[-3]>RC[-1],RC[-3]>=8,RC[-3]<9),40,IF(AND(RC[-3]>RC[-1],RC[-3]>=9,RC[-3]<10),30,IF(AND(RC[-3]>RC[-1],RC[-3]>=10,RC[-3]<11),20,IF(AND(RC[-3]>RC[-1],RC[-3]>=11,RC[-3]<12),10,IF(AND(RC[-3]>RC[-1],RC[-3]>=12),0))))))))))))))))))))))))))))))))) -> 95 | H552: =IF(RC[-3]="","",IF(RC[-3]<0.3,100,IF(AND(RC[-3]>=0.3,RC[-3]>0.4),95,IF(AND(RC[-3]>=0.4,RC[-3]<0.5),90,IF(AND(RC[-3]>=0.5,RC[-3]<0.6),85,IF(AND(RC[-3]>=0.6,RC[-3]<0.7),80,IF(AND(RC[-3]>=0.6,RC[-3]<1),80,IF(AND(RC[-3]>1,RC[-3]<2),50,IF(RC[-3]>2,0))))))))) ->  | I552: =IF(RC[-1]="",RC[-2],0.7*RC[-1]+0.3*RC[-2]) -> 95
A553: ذوب روی اصفهان | B553: فروی | C553: =VLOOKUP(RC[-1],Sheet1!R3C2:R802C3,2,FALSE) -> فلزات اساسی | D553: =VLOOKUP(RC[-2],Sheet1!R3C2:R802C9,8,FALSE) -> 7 | E553: =IF(VLOOKUP(RC[-3],Sheet1!R3C2:R803C11,10,FALSE)=0,"",VLOOKUP(Sheet2!RC[-3],Sheet1!R[1]C[-3]:R[801]C[6],10,FALSE)) ->  | F553: =Sheet1!R634C10 -> 7.4779348942651307 | G553: =IF(RC[-3]<0,0,IF(AND(RC[-3]<RC[-1],RC[-3]<2),100,IF(AND(RC[-3]<RC[-1],RC[-3]>=2,RC[-3]<3),95,IF(AND(RC[-3]<RC[-1],RC[-3]>=3,RC[-3]<4),90,IF(AND(RC[-3]<RC[-1],RC[-3]>=4,RC[-3]<5),85,IF(AND(RC[-3]<RC[-1],RC[-3]>=5,RC[-3]<6),80,IF(AND(RC[-3]<RC[-1],RC[-3]>=6,RC[-3]<7),75,IF(AND(RC[-3]<RC[-1],RC[-3]>=7,RC[-3]<8),70,IF(AND(RC[-3]<RC[-1],RC[-3]>=8,RC[-3]<9),65,IF(AND(RC[-3]<RC[-1],RC[-3]>=9,RC[-3]<10),60,IF(AND(RC[-3]<RC[-1],RC[-3]>=10,RC[-3]<11),55,IF(AND(RC[-3]<RC[-1],RC[-3]>=11,RC[-3]<12),50,IF(AND(RC[-3]<RC[-1],RC[-3]>=12,RC[-3]<13),45,IF(AND(RC[-3]<RC[-1],RC[-3]>=13,RC[-3]<14),40,IF(AND(RC[-3]<RC[-1],RC[-3]>=14,RC[-3]<15),35,IF(AND(RC[-3]<RC[-1],RC[-3]>=15,RC[-3]<16),30,IF(AND(RC[-3]<RC[-1],RC[-3]>=16,RC[-3]<17),25,IF(AND(RC[-3]<RC[-1],RC[-3]>=17,RC[-3]<18),20,IF(AND(RC[-3]<RC[-1],RC[-3]>=18,RC[-3]<19),15,IF(AND(RC[-3]<RC[-1],RC[-3]>=19,RC[-3]<20),10,IF(AND(RC[-3]<RC[-1],RC[-3]>=20,RC[-3]<21),5,IF(AND(RC[-3]<RC[-1],RC[-3]>=21),0,IF(AND(RC[-3]>RC[-1],RC[-3]>=2,RC[-3]<3),90,IF(AND(RC[-3]>RC[-1],RC[-3]>=3,RC[-3]<4),90,IF(AND(RC[-3]>RC[-1],RC[-3]>=4,RC[-3]<5),80,IF(AND(RC[-3]>RC[-1],RC[-3]>=5,RC[-3]<6),70,IF(AND(RC[-3]>RC[-1],RC[-3]>=6,RC[-3]<7),60,IF(AND(RC[-3]>RC[-1],RC[-3]>=7,RC[-3]<8),50,IF(AND(RC[-3]>RC[-1],RC[-3]>=8,RC[-3]<9),40,IF(AND(RC[-3]>RC[-1],RC[-3]>=9,RC[-3]<10),30,IF(AND(RC[-3]>RC[-1],RC[-3]>=10,RC[-3]<11),20,IF(AND(RC[-3]>RC[-1],RC[-3]>=11,RC[-3]<12),10,IF(AND(RC[-3]>RC[-1],RC[-3]>=12),0))))))))))))))))))))))))))))))))) -> 70 | H553: =IF(RC[-3]="","",IF(RC[-3]<0.3,100,IF(AND(RC[-3]>=0.3,RC[-3]>0.4),95,IF(AND(RC[-3]>=0.4,RC[-3]<0.5),90,IF(AND(RC[-3]>=0.5,RC[-3]<0.6),85,IF(AND(RC[-3]>=0.6,RC[-3]<0.7),80,IF(AND(RC[-3]>=0.6,RC[-3]<1),80,IF(AND(RC[-3]>1,RC[-3]<2),50,IF(RC[-3]>2,0))))))))) ->  | I553: =IF(RC[-1]="",RC[-2],0.7*RC[-1]+0.3*RC[-2]) -> 70
A554: زرین معدن آسیا | B554: فزرین | C554: =VLOOKUP(RC[-1],Sheet1!R3C2:R802C3,2,FALSE) -> فلزات اساسی | D554: =VLOOKUP(RC[-2],Sheet1!R3C2:R802C9,8,FALSE) -> 4.2069580673633338 | E554: =IF(VLOOKUP(RC[-3],Sheet1!R3C2:R803C11,10,FALSE)=0,"",VLOOKUP(Sheet2!RC[-3],Sheet1!R[1]C[-3]:R[801]C[6],10,FALSE)) ->  | F554: =Sheet1!R634C10 -> 7.4779348942651307 | G554: =IF(RC[-3]<0,0,IF(AND(RC[-3]<RC[-1],RC[-3]<2),100,IF(AND(RC[-3]<RC[-1],RC[-3]>=2,RC[-3]<3),95,IF(AND(RC[-3]<RC[-1],RC[-3]>=3,RC[-3]<4),90,IF(AND(RC[-3]<RC[-1],RC[-3]>=4,RC[-3]<5),85,IF(AND(RC[-3]<RC[-1],RC[-3]>=5,RC[-3]<6),80,IF(AND(RC[-3]<RC[-1],RC[-3]>=6,RC[-3]<7),75,IF(AND(RC[-3]<RC[-1],RC[-3]>=7,RC[-3]<8),70,IF(AND(RC[-3]<RC[-1],RC[-3]>=8,RC[-3]<9),65,IF(AND(RC[-3]<RC[-1],RC[-3]>=9,RC[-3]<10),60,IF(AND(RC[-3]<RC[-1],RC[-3]>=10,RC[-3]<11),55,IF(AND(RC[-3]<RC[-1],RC[-3]>=11,RC[-3]<12),50,IF(AND(RC[-3]<RC[-1],RC[-3]>=12,RC[-3]<13),45,IF(AND(RC[-3]<RC[-1],RC[-3]>=13,RC[-3]<14),40,IF(AND(RC[-3]<RC[-1],RC[-3]>=14,RC[-3]<15),35,IF(AND(RC[-3]<RC[-1],RC[-3]>=15,RC[-3]<16),30,IF(AND(RC[-3]<RC[-1],RC[-3]>=16,RC[-3]<17),25,IF(AND(RC[-3]<RC[-1],RC[-3]>=17,RC[-3]<18),20,IF(AND(RC[-3]<RC[-1],RC[-3]>=18,RC[-3]<19),15,IF(AND(RC[-3]<RC[-1],RC[-3]>=19,RC[-3]<20),10,IF(AND(RC[-3]<RC[-1],RC[-3]>=20,RC[-3]<21),5,IF(AND(RC[-3]<RC[-1],RC[-3]>=21),0,IF(AND(RC[-3]>RC[-1],RC[-3]>=2,RC[-3]<3),90,IF(AND(RC[-3]>RC[-1],RC[-3]>=3,RC[-3]<4),90,IF(AND(RC[-3]>RC[-1],RC[-3]>=4,RC[-3]<5),80,IF(AND(RC[-3]>RC[-1],RC[-3]>=5,RC[-3]<6),70,IF(AND(RC[-3]>RC[-1],RC[-3]>=6,RC[-3]<7),60,IF(AND(RC[-3]>RC[-1],RC[-3]>=7,RC[-3]<8),50,IF(AND(RC[-3]>RC[-1],RC[-3]>=8,RC[-3]<9),40,IF(AND(RC[-3]>RC[-1],RC[-3]>=9,RC[-3]<10),30,IF(AND(RC[-3]>RC[-1],RC[-3]>=10,RC[-3]<11),20,IF(AND(RC[-3]>RC[-1],RC[-3]>=11,RC[-3]<12),10,IF(AND(RC[-3]>RC[-1],RC[-3]>=12),0))))))))))))))))))))))))))))))))) -> 85 | H554: =IF(RC[-3]="","",IF(RC[-3]<0.3,100,IF(AND(RC[-3]>=0.3,RC[-3]>0.4),95,IF(AND(RC[-3]>=0.4,RC[-3]<0.5),90,IF(AND(RC[-3]>=0.5,RC[-3]<0.6),85,IF(AND(RC[-3]>=0.6,RC[-3]<0.7),80,IF(AND(RC[-3]>=0.6,RC[-3]<1),80,IF(AND(RC[-3]>1,RC[-3]<2),50,IF(RC[-3]>2,0))))))))) ->  | I554: =IF(RC[-1]="",RC[-2],0.7*RC[-1]+0.3*RC[-2]) -> 85
A555: سپنتا | B555: فپنتا | C555: =VLOOKUP(RC[-1],Sheet1!R3C2:R802C3,2,FALSE) -> فلزات اساسی | D555: =VLOOKUP(RC[-2],Sheet1!R3C2:R802C9,8,FALSE) -> 5.7249128688704829 | E555: =IF(VLOOKUP(RC[-3],Sheet1!R3C2:R803C11,10,FALSE)=0,"",VLOOKUP(Sheet2!RC[-3],Sheet1!R[1]C[-3]:R[801]C[6],10,FALSE)) ->  | F555: =Sheet1!R634C10 -> 7.4779348942651307 | G555: =IF(RC[-3]<0,0,IF(AND(RC[-3]<RC[-1],RC[-3]<2),100,IF(AND(RC[-3]<RC[-1],RC[-3]>=2,RC[-3]<3),95,IF(AND(RC[-3]<RC[-1],RC[-3]>=3,RC[-3]<4),90,IF(AND(RC[-3]<RC[-1],RC[-3]>=4,RC[-3]<5),85,IF(AND(RC[-3]<RC[-1],RC[-3]>=5,RC[-3]<6),80,IF(AND(RC[-3]<RC[-1],RC[-3]>=6,RC[-3]<7),75,IF(AND(RC[-3]<RC[-1],RC[-3]>=7,RC[-3]<8),70,IF(AND(RC[-3]<RC[-1],RC[-3]>=8,RC[-3]<9),65,IF(AND(RC[-3]<RC[-1],RC[-3]>=9,RC[-3]<10),60,IF(AND(RC[-3]<RC[-1],RC[-3]>=10,RC[-3]<11),55,IF(AND(RC[-3]<RC[-1],RC[-3]>=11,RC[-3]<12),50,IF(AND(RC[-3]<RC[-1],RC[-3]>=12,RC[-3]<13),45,IF(AND(RC[-3]<RC[-1],RC[-3]>=13,RC[-3]<14),40,IF(AND(RC[-3]<RC[-1],RC[-3]>=14,RC[-3]<15),35,IF(AND(RC[-3]<RC[-1],RC[-3]>=15,RC[-3]<16),30,IF(AND(RC[-3]<RC[-1],RC[-3]>=16,RC[-3]<17),25,IF(AND(RC[-3]<RC[-1],RC[-3]>=17,RC[-3]<18),20,IF(AND(RC[-3]<RC[-1],RC[-3]>=18,RC[-3]<19),15,IF(AND(RC[-3]<RC[-1],RC[-3]>=19,RC[-3]<20),10,IF(AND(RC[-3]<RC[-1],RC[-3]>=20,RC[-3]<21),5,IF(AND(RC[-3]<RC[-1],RC[-3]>=21),0,IF(AND(RC[-3]>RC[-1],RC[-3]>=2,RC[-3]<3),90,IF(AND(RC[-3]>RC[-1],RC[-3]>=3,RC[-3]<4),90,IF(AND(RC[-3]>RC[-1],RC[-3]>=4,RC[-3]<5),80,IF(AND(RC[-3]>RC[-1],RC[-3]>=5,RC[-3]<6),70,IF(AND(RC[-3]>RC[-1],RC[-3]>=6,RC[-3]<7),60,IF(AND(RC[-3]>RC[-1],RC[-3]>=7,RC[-3]<8),50,IF(AND(RC[-3]>RC[-1],RC[-3]>=8,RC[-3]<9),40,IF(AND(RC[-3]>RC[-1],RC[-3]>=9,RC[-3]<10),30,IF(AND(RC[-3]>RC[-1],RC[-3]>=10,RC[-3]<11),20,IF(AND(RC[-3]>RC[-1],RC[-3]>=11,RC[-3]<12),10,IF(AND(RC[-3]>RC[-1],RC[-3]>=12),0))))))))))))))))))))))))))))))))) -> 80 | H555: =IF(RC[-3]="","",IF(RC[-3]<0.3,100,IF(AND(RC[-3]>=0.3,RC[-3]>0.4),95,IF(AND(RC[-3]>=0.4,RC[-3]<0.5),90,IF(AND(RC[-3]>=0.5,RC[-3]<0.6),85,IF(AND(RC[-3]>=0.6,RC[-3]<0.7),80,IF(AND(RC[-3]>=0.6,RC[-3]<1),80,IF(AND(RC[-3]>1,RC[-3]<2),50,IF(RC[-3]>2,0))))))))) ->  | I555: =IF(RC[-1]="",RC[-2],0.7*RC[-1]+0.3*RC[-2]) -> 80
A556: سر. توسعه معادن و صنایع معدنی خاورمیانه | B556: میدکو | C556: =VLOOKUP(RC[-1],Sheet1!R3C2:R802C3,2,FALSE) -> فلزات اساسی | D556: =VLOOKUP(RC[-2],Sheet1!R3C2:R802C9,8,FALSE) -> 15.369884080042143 | E556: =IF(VLOOKUP(RC[-3],Sheet1!R3C2:R803C11,10,FALSE)=0,"",VLOOKUP(Sheet2!RC[-3],Sheet1!R[1]C[-3]:R[801]C[6],10,FALSE)) -> 3 | F556: =Sheet1!R634C10 -> 7.4779348942651307 | G556: =IF(RC[-3]<0,0,IF(AND(RC[-3]<RC[-1],RC[-3]<2),100,IF(AND(RC[-3]<RC[-1],RC[-3]>=2,RC[-3]<3),95,IF(AND(RC[-3]<RC[-1],RC[-3]>=3,RC[-3]<4),90,IF(AND(RC[-3]<RC[-1],RC[-3]>=4,RC[-3]<5),85,IF(AND(RC[-3]<RC[-1],RC[-3]>=5,RC[-3]<6),80,IF(AND(RC[-3]<RC[-1],RC[-3]>=6,RC[-3]<7),75,IF(AND(RC[-3]<RC[-1],RC[-3]>=7,RC[-3]<8),70,IF(AND(RC[-3]<RC[-1],RC[-3]>=8,RC[-3]<9),65,IF(AND(RC[-3]<RC[-1],RC[-3]>=9,RC[-3]<10),60,IF(AND(RC[-3]<RC[-1],RC[-3]>=10,RC[-3]<11),55,IF(AND(RC[-3]<RC[-1],RC[-3]>=11,RC[-3]<12),50,IF(AND(RC[-3]<RC[-1],RC[-3]>=12,RC[-3]<13),45,IF(AND(RC[-3]<RC[-1],RC[-3]>=13,RC[-3]<14),40,IF(AND(RC[-3]<RC[-1],RC[-3]>=14,RC[-3]<15),35,IF(AND(RC[-3]<RC[-1],RC[-3]>=15,RC[-3]<16),30,IF(AND(RC[-3]<RC[-1],RC[-3]>=16,RC[-3]<17),25,IF(AND(RC[-3]<RC[-1],RC[-3]>=17,RC[-3]<18),20,IF(AND(RC[-3]<RC[-1],RC[-3]>=18,RC[-3]<19),15,IF(AND(RC[-3]<RC[-1],RC[-3]>=19,RC[-3]<20),10,IF(AND(RC[-3]<RC[-1],RC[-3]>=20,RC[-3]<21),5,IF(AND(RC[-3]<RC[-1],RC[-3]>=21),0,IF(AND(RC[-3]>RC[-1],RC[-3]>=2,RC[-3]<3),90,IF(AND(RC[-3]>RC[-1],RC[-3]>=3,RC[-3]<4),90,IF(AND(RC[-3]>RC[-1],RC[-3]>=4,RC[-3]<5),80,IF(AND(RC[-3]>RC[-1],RC[-3]>=5,RC[-3]<6),70,IF(AND(RC[-3]>RC[-1],RC[-3]>=6,RC[-3]<7),60,IF(AND(RC[-3]>RC[-1],RC[-3]>=7,RC[-3]<8),50,IF(AND(RC[-3]>RC[-1],RC[-3]>=8,RC[-3]<9),40,IF(AND(RC[-3]>RC[-1],RC[-3]>=9,RC[-3]<10),30,IF(AND(RC[-3]>RC[-1],RC[-3]>=10,RC[-3]<11),20,IF(AND(RC[-3]>RC[-1],RC[-3]>=11,RC[-3]<12),10,IF(AND(RC[-3]>RC[-1],RC[-3]>=12),0))))))))))))))))))))))))))))))))) -> 0 | H556: =IF(RC[-3]="","",IF(RC[-3]<0.3,100,IF(AND(RC[-3]>=0.3,RC[-3]>0.4),95,IF(AND(RC[-3]>=0.4,RC[-3]<0.5),90,IF(AND(RC[-3]>=0.5,RC[-3]<0.6),85,IF(AND(RC[-3]>=0.6,RC[-3]<0.7),80,IF(AND(RC[-3]>=0.6,RC[-3]<1),80,IF(AND(RC[-3]>1,RC[-3]<2),50,IF(RC[-3]>2,0))))))))) -> 95 | I556: =IF(RC[-1]="",RC[-2],0.7*RC[-1]+0.3*RC[-2]) -> 66.5
A557: سر. توکا فولاد | B557: وتوکا | C557: =VLOOKUP(RC[-1],Sheet1!R3C2:R802C3,2,FALSE) -> فلزات اساسی | D557: =VLOOKUP(RC[-2],Sheet1!R3C2:R802C9,8,FALSE) -> 4.352669376665161 | E557: =IF(VLOOKUP(RC[-3],Sheet1!R3C2:R803C11,10,FALSE)=0,"",VLOOKUP(Sheet2!RC[-3],Sheet1!R[1]C[-3]:R[801]C[6],10,FALSE)) -> 1.2 | F557: =Sheet1!R634C10 -> 7.4779348942651307 | G557: =IF(RC[-3]<0,0,IF(AND(RC[-3]<RC[-1],RC[-3]<2),100,IF(AND(RC[-3]<RC[-1],RC[-3]>=2,RC[-3]<3),95,IF(AND(RC[-3]<RC[-1],RC[-3]>=3,RC[-3]<4),90,IF(AND(RC[-3]<RC[-1],RC[-3]>=4,RC[-3]<5),85,IF(AND(RC[-3]<RC[-1],RC[-3]>=5,RC[-3]<6),80,IF(AND(RC[-3]<RC[-1],RC[-3]>=6,RC[-3]<7),75,IF(AND(RC[-3]<RC[-1],RC[-3]>=7,RC[-3]<8),70,IF(AND(RC[-3]<RC[-1],RC[-3]>=8,RC[-3]<9),65,IF(AND(RC[-3]<RC[-1],RC[-3]>=9,RC[-3]<10),60,IF(AND(RC[-3]<RC[-1],RC[-3]>=10,RC[-3]<11),55,IF(AND(RC[-3]<RC[-1],RC[-3]>=11,RC[-3]<12),50,IF(AND(RC[-3]<RC[-1],RC[-3]>=12,RC[-3]<13),45,IF(AND(RC[-3]<RC[-1],RC[-3]>=13,RC[-3]<14),40,IF(AND(RC[-3]<RC[-1],RC[-3]>=14,RC[-3]<15),35,IF(AND(RC[-3]<RC[-1],RC[-3]>=15,RC[-3]<16),30,IF(AND(RC[-3]<RC[-1],RC[-3]>=16,RC[-3]<17),25,IF(AND(RC[-3]<RC[-1],RC[-3]>=17,RC[-3]<18),20,IF(AND(RC[-3]<RC[-1],RC[-3]>=18,RC[-3]<19),15,IF(AND(RC[-3]<RC[-1],RC[-3]>=19,RC[-3]<20),10,IF(AND(RC[-3]<RC[-1],RC[-3]>=20,RC[-3]<21),5,IF(AND(RC[-3]<RC[-1],RC[-3]>=21),0,IF(AND(RC[-3]>RC[-1],RC[-3]>=2,RC[-3]<3),90,IF(AND(RC[-3]>RC[-1],RC[-3]>=3,RC[-3]<4),90,IF(AND(RC[-3]>RC[-1],RC[-3]>=4,RC[-3]<5),80,IF(AND(RC[-3]>RC[-1],RC[-3]>=5,RC[-3]<6),70,IF(AND(RC[-3]>RC[-1],RC[-3]>=6,RC[-3]<7),60,IF(AND(RC[-3]>RC[-1],RC[-3]>=7,RC[-3]<8),50,IF(AND(RC[-3]>RC[-1],RC[-3]>=8,RC[-3]<9),40,IF(AND(RC[-3]>RC[-1],RC[-3]>=9,RC[-3]<10),30,IF(AND(RC[-3]>RC[-1],RC[-3]>=10,RC[-3]<11),20,IF(AND(RC[-3]>RC[-1],RC[-3]>=11,RC[-3]<12),10,IF(AND(RC[-3]>RC[-1],RC[-3]>=12),0))))))))))))))))))))))))))))))))) -> 85 | H557: =IF(RC[-3]="","",IF(RC[-3]<0.3,100,IF(AND(RC[-3]>=0.3,RC[-3]>0.4),95,IF(AND(RC[-3]>=0.4,RC[-3]<0.5),90,IF(AND(RC[-3]>=0.5,RC[-3]<0.6),85,IF(AND(RC[-3]>=0.6,RC[-3]<0.7),80,IF(AND(RC[-3]>=0.6,RC[-3]<1),80,IF(AND(RC[-3]>1,RC[-3]<2),50,IF(RC[-3]>2,0))))))))) -> 95 | I557: =IF(RC[-1]="",RC[-2],0.7*RC[-1]+0.3*RC[-2]) -> 92
A558: سوژمیران | B558: فسوژ | C558: =VLOOKUP(RC[-1],Sheet1!R3C2:R802C3,2,FALSE) -> فلزات اساسی | D558: =VLOOKUP(RC[-2],Sheet1!R3C2:R802C9,8,FALSE) -> 8.0365345573924749 | E558: =IF(VLOOKUP(RC[-3],Sheet1!R3C2:R803C11,10,FALSE)=0,"",VLOOKUP(Sheet2!RC[-3],Sheet1!R[1]C[-3]:R[801]C[6],10,FALSE)) ->  | F558: =Sheet1!R634C10 -> 7.4779348942651307 | G558: =IF(RC[-3]<0,0,IF(AND(RC[-3]<RC[-1],RC[-3]<2),100,IF(AND(RC[-3]<RC[-1],RC[-3]>=2,RC[-3]<3),95,IF(AND(RC[-3]<RC[-1],RC[-3]>=3,RC[-3]<4),90,IF(AND(RC[-3]<RC[-1],RC[-3]>=4,RC[-3]<5),85,IF(AND(RC[-3]<RC[-1],RC[-3]>=5,RC[-3]<6),80,IF(AND(RC[-3]<RC[-1],RC[-3]>=6,RC[-3]<7),75,IF(AND(RC[-3]<RC[-1],RC[-3]>=7,RC[-3]<8),70,IF(AND(RC[-3]<RC[-1],RC[-3]>=8,RC[-3]<9),65,IF(AND(RC[-3]<RC[-1],RC[-3]>=9,RC[-3]<10),60,IF(AND(RC[-3]<RC[-1],RC[-3]>=10,RC[-3]<11),55,IF(AND(RC[-3]<RC[-1],RC[-3]>=11,RC[-3]<12),50,IF(AND(RC[-3]<RC[-1],RC[-3]>=12,RC[-3]<13),45,IF(AND(RC[-3]<RC[-1],RC[-3]>=13,RC[-3]<14),40,IF(AND(RC[-3]<RC[-1],RC[-3]>=14,RC[-3]<15),35,IF(AND(RC[-3]<RC[-1],RC[-3]>=15,RC[-3]<16),30,IF(AND(RC[-3]<RC[-1],RC[-3]>=16,RC[-3]<17),25,IF(AND(RC[-3]<RC[-1],RC[-3]>=17,RC[-3]<18),20,IF(AND(RC[-3]<RC[-1],RC[-3]>=18,RC[-3]<19),15,IF(AND(RC[-3]<RC[-1],RC[-3]>=19,RC[-3]<20),10,IF(AND(RC[-3]<RC[-1],RC[-3]>=20,RC[-3]<21),5,IF(AND(RC[-3]<RC[-1],RC[-3]>=21),0,IF(AND(RC[-3]>RC[-1],RC[-3]>=2,RC[-3]<3),90,IF(AND(RC[-3]>RC[-1],RC[-3]>=3,RC[-3]<4),90,IF(AND(RC[-3]>RC[-1],RC[-3]>=4,RC[-3]<5),80,IF(AND(RC[-3]>RC[-1],RC[-3]>=5,RC[-3]<6),70,IF(AND(RC[-3]>RC[-1],RC[-3]>=6,RC[-3]<7),60,IF(AND(RC[-3]>RC[-1],RC[-3]>=7,RC[-3]<8),50,IF(AND(RC[-3]>RC[-1],RC[-3]>=8,RC[-3]<9),40,IF(AND(RC[-3]>RC[-1],RC[-3]>=9,RC[-3]<10),30,IF(AND(RC[-3]>RC[-1],RC[-3]>=10,RC[-3]<11),20,IF(AND(RC[-3]>RC[-1],RC[-3]>=11,RC[-3]<12),10,IF(AND(RC[-3]>RC[-1],RC[-3]>=12),0))))))))))))))))))))))))))))))))) -> 40 | H558: =IF(RC[-3]="","",IF(RC[-3]<0.3,100,IF(AND(RC[-3]>=0.3,RC[-3]>0.4),95,IF(AND(RC[-3]>=0.4,RC[-3]<0.5),90,IF(AND(RC[-3]>=0.5,RC[-3]<0.6),85,IF(AND(RC[-3]>=0.6,RC[-3]<0.7),80,IF(AND(RC[-3]>=0.6,RC[-3]<1),80,IF(AND(RC[-3]>1,RC[-3]<2),50,IF(RC[-3]>2,0))))))))) ->  | I558: =IF(RC[-1]="",RC[-2],0.7*RC[-1]+0.3*RC[-2]) -> 40
A559: صنایع تجهیزات نفت | B559: فنفت | C559: =VLOOKUP(RC[-1],Sheet1!R3C2:R802C3,2,FALSE) -> فلزات اساسی | D559: =VLOOKUP(RC[-2],Sheet1!R3C2:R802C9,8,FALSE) -> 18.711016953189432 | E559: =IF(VLOOKUP(RC[-3],Sheet1!R3C2:R803C11,10,FALSE)=0,"",VLOOKUP(Sheet2!RC[-3],Sheet1!R[1]C[-3]:R[801]C[6],10,FALSE)) ->  | F559: =Sheet1!R634C10 -> 7.4779348942651307 | G559: =IF(RC[-3]<0,0,IF(AND(RC[-3]<RC[-1],RC[-3]<2),100,IF(AND(RC[-3]<RC[-1],RC[-3]>=2,RC[-3]<3),95,IF(AND(RC[-3]<RC[-1],RC[-3]>=3,RC[-3]<4),90,IF(AND(RC[-3]<RC[-1],RC[-3]>=4,RC[-3]<5),85,IF(AND(RC[-3]<RC[-1],RC[-3]>=5,RC[-3]<6),80,IF(AND(RC[-3]<RC[-1],RC[-3]>=6,RC[-3]<7),75,IF(AND(RC[-3]<RC[-1],RC[-3]>=7,RC[-3]<8),70,IF(AND(RC[-3]<RC[-1],RC[-3]>=8,RC[-3]<9),65,IF(AND(RC[-3]<RC[-1],RC[-3]>=9,RC[-3]<10),60,IF(AND(RC[-3]<RC[-1],RC[-3]>=10,RC[-3]<11),55,IF(AND(RC[-3]<RC[-1],RC[-3]>=11,RC[-3]<12),50,IF(AND(RC[-3]<RC[-1],RC[-3]>=12,RC[-3]<13),45,IF(AND(RC[-3]<RC[-1],RC[-3]>=13,RC[-3]<14),40,IF(AND(RC[-3]<RC[-1],RC[-3]>=14,RC[-3]<15),35,IF(AND(RC[-3]<RC[-1],RC[-3]>=15,RC[-3]<16),30,IF(AND(RC[-3]<RC[-1],RC[-3]>=16,RC[-3]<17),25,IF(AND(RC[-3]<RC[-1],RC[-3]>=17,RC[-3]<18),20,IF(AND(RC[-3]<RC[-1],RC[-3]>=18,RC[-3]<19),15,IF(AND(RC[-3]<RC[-1],RC[-3]>=19,RC[-3]<20),10,IF(AND(RC[-3]<RC[-1],RC[-3]>=20,RC[-3]<21),5,IF(AND(RC[-3]<RC[-1],RC[-3]>=21),0,IF(AND(RC[-3]>RC[-1],RC[-3]>=2,RC[-3]<3),90,IF(AND(RC[-3]>RC[-1],RC[-3]>=3,RC[-3]<4),90,IF(AND(RC[-3]>RC[-1],RC[-3]>=4,RC[-3]<5),80,IF(AND(RC[-3]>RC[-1],RC[-3]>=5,RC[-3]<6),70,IF(AND(RC[-3]>RC[-1],RC[-3]>=6,RC[-3]<7),60,IF(AND(RC[-3]>RC[-1],RC[-3]>=7,RC[-3]<8),50,IF(AND(RC[-3]>RC[-1],RC[-3]>=8,RC[-3]<9),40,IF(AND(RC[-3]>RC[-1],RC[-3]>=9,RC[-3]<10),30,IF(AND(RC[-3]>RC[-1],RC[-3]>=10,RC[-3]<11),20,IF(AND(RC[-3]>RC[-1],RC[-3]>=11,RC[-3]<12),10,IF(AND(RC[-3]>RC[-1],RC[-3]>=12),0))))))))))))))))))))))))))))))))) -> 0 | H559: =IF(RC[-3]="","",IF(RC[-3]<0.3,100,IF(AND(RC[-3]>=0.3,RC[-3]>0.4),95,IF(AND(RC[-3]>=0.4,RC[-3]<0.5),90,IF(AND(RC[-3]>=0.5,RC[-3]<0.6),85,IF(AND(RC[-3]>=0.6,RC[-3]<0.7),80,IF(AND(RC[-3]>=0.6,RC[-3]<1),80,IF(AND(RC[-3]>1,RC[-3]<2),50,IF(RC[-3]>2,0))))))))) ->  | I559: =IF(RC[-1]="",RC[-2],0.7*RC[-1]+0.3*RC[-2]) -> 0
A560: صنایع مس افق کرمان | B560: فافق | C560: =VLOOKUP(RC[-1],Sheet1!R3C2:R802C3,2,FALSE) -> فلزات اساسی | D560: =VLOOKUP(RC[-2],Sheet1!R3C2:R802C9,8,FALSE) -> 3.7793390390081334 | E560: =IF(VLOOKUP(RC[-3],Sheet1!R3C2:R803C11,10,FALSE)=0,"",VLOOKUP(Sheet2!RC[-3],Sheet1!R[1]C[-3]:R[801]C[6],10,FALSE)) -> 3 | F560: =Sheet1!R634C10 -> 7.4779348942651307 | G560: =IF(RC[-3]<0,0,IF(AND(RC[-3]<RC[-1],RC[-3]<2),100,IF(AND(RC[-3]<RC[-1],RC[-3]>=2,RC[-3]<3),95,IF(AND(RC[-3]<RC[-1],RC[-3]>=3,RC[-3]<4),90,IF(AND(RC[-3]<RC[-1],RC[-3]>=4,RC[-3]<5),85,IF(AND(RC[-3]<RC[-1],RC[-3]>=5,RC[-3]<6),80,IF(AND(RC[-3]<RC[-1],RC[-3]>=6,RC[-3]<7),75,IF(AND(RC[-3]<RC[-1],RC[-3]>=7,RC[-3]<8),70,IF(AND(RC[-3]<RC[-1],RC[-3]>=8,RC[-3]<9),65,IF(AND(RC[-3]<RC[-1],RC[-3]>=9,RC[-3]<10),60,IF(AND(RC[-3]<RC[-1],RC[-3]>=10,RC[-3]<11),55,IF(AND(RC[-3]<RC[-1],RC[-3]>=11,RC[-3]<12),50,IF(AND(RC[-3]<RC[-1],RC[-3]>=12,RC[-3]<13),45,IF(AND(RC[-3]<RC[-1],RC[-3]>=13,RC[-3]<14),40,IF(AND(RC[-3]<RC[-1],RC[-3]>=14,RC[-3]<15),35,IF(AND(RC[-3]<RC[-1],RC[-3]>=15,RC[-3]<16),30,IF(AND(RC[-3]<RC[-1],RC[-3]>=16,RC[-3]<17),25,IF(AND(RC[-3]<RC[-1],RC[-3]>=17,RC[-3]<18),20,IF(AND(RC[-3]<RC[-1],RC[-3]>=18,RC[-3]<19),15,IF(AND(RC[-3]<RC[-1],RC[-3]>=19,RC[-3]<20),10,IF(AND(RC[-3]<RC[-1],RC[-3]>=20,RC[-3]<21),5,IF(AND(RC[-3]<RC[-1],RC[-3]>=21),0,IF(AND(RC[-3]>RC[-1],RC[-3]>=2,RC[-3]<3),90,IF(AND(RC[-3]>RC[-1],RC[-3]>=3,RC[-3]<4),90,IF(AND(RC[-3]>RC[-1],RC[-3]>=4,RC[-3]<5),80,IF(AND(RC[-3]>RC[-1],RC[-3]>=5,RC[-3]<6),70,IF(AND(RC[-3]>RC[-1],RC[-3]>=6,RC[-3]<7),60,IF(AND(RC[-3]>RC[-1],RC[-3]>=7,RC[-3]<8),50,IF(AND(RC[-3]>RC[-1],RC[-3]>=8,RC[-3]<9),40,IF(AND(RC[-3]>RC[-1],RC[-3]>=9,RC[-3]<10),30,IF(AND(RC[-3]>RC[-1],RC[-3]>=10,RC[-3]<11),20,IF(AND(RC[-3]>RC[-1],RC[-3]>=11,RC[-3]<12),10,IF(AND(RC[-3]>RC[-1],RC[-3]>=12),0))))))))))))))))))))))))))))))))) -> 90 | H560: =IF(RC[-3]="","",IF(RC[-3]<0.3,100,IF(AND(RC[-3]>=0.3,RC[-3]>0.4),95,IF(AND(RC[-3]>=0.4,RC[-3]<0.5),90,IF(AND(RC[-3]>=0.5,RC[-3]<0.6),85,IF(AND(RC[-3]>=0.6,RC[-3]<0.7),80,IF(AND(RC[-3]>=0.6,RC[-3]<1),80,IF(AND(RC[-3]>1,RC[-3]<2),50,IF(RC[-3]>2,0))))))))) -> 95 | I560: =IF(RC[-1]="",RC[-2],0.7*RC[-1]+0.3*RC[-2]) -> 93.5
A561: صنعت روی زنگان | B561: زنگان | C561: =VLOOKUP(RC[-1],Sheet1!R3C2:R802C3,2,FALSE) -> فلزات اساسی | D561: =VLOOKUP(RC[-2],Sheet1!R3C2:R802C9,8,FALSE) -> 17.789090388575868 | E561: =IF(VLOOKUP(RC[-3],Sheet1!R3C2:R803C11,10,FALSE)=0,"",VLOOKUP(Sheet2!RC[-3],Sheet1!R[1]C[-3]:R[801]C[6],10,FALSE)) ->  | F561: =Sheet1!R634C10 -> 7.4779348942651307 | G561: =IF(RC[-3]<0,0,IF(AND(RC[-3]<RC[-1],RC[-3]<2),100,IF(AND(RC[-3]<RC[-1],RC[-3]>=2,RC[-3]<3),95,IF(AND(RC[-3]<RC[-1],RC[-3]>=3,RC[-3]<4),90,IF(AND(RC[-3]<RC[-1],RC[-3]>=4,RC[-3]<5),85,IF(AND(RC[-3]<RC[-1],RC[-3]>=5,RC[-3]<6),80,IF(AND(RC[-3]<RC[-1],RC[-3]>=6,RC[-3]<7),75,IF(AND(RC[-3]<RC[-1],RC[-3]>=7,RC[-3]<8),70,IF(AND(RC[-3]<RC[-1],RC[-3]>=8,RC[-3]<9),65,IF(AND(RC[-3]<RC[-1],RC[-3]>=9,RC[-3]<10),60,IF(AND(RC[-3]<RC[-1],RC[-3]>=10,RC[-3]<11),55,IF(AND(RC[-3]<RC[-1],RC[-3]>=11,RC[-3]<12),50,IF(AND(RC[-3]<RC[-1],RC[-3]>=12,RC[-3]<13),45,IF(AND(RC[-3]<RC[-1],RC[-3]>=13,RC[-3]<14),40,IF(AND(RC[-3]<RC[-1],RC[-3]>=14,RC[-3]<15),35,IF(AND(RC[-3]<RC[-1],RC[-3]>=15,RC[-3]<16),30,IF(AND(RC[-3]<RC[-1],RC[-3]>=16,RC[-3]<17),25,IF(AND(RC[-3]<RC[-1],RC[-3]>=17,RC[-3]<18),20,IF(AND(RC[-3]<RC[-1],RC[-3]>=18,RC[-3]<19),15,IF(AND(RC[-3]<RC[-1],RC[-3]>=19,RC[-3]<20),10,IF(AND(RC[-3]<RC[-1],RC[-3]>=20,RC[-3]<21),5,IF(AND(RC[-3]<RC[-1],RC[-3]>=21),0,IF(AND(RC[-3]>RC[-1],RC[-3]>=2,RC[-3]<3),90,IF(AND(RC[-3]>RC[-1],RC[-3]>=3,RC[-3]<4),90,IF(AND(RC[-3]>RC[-1],RC[-3]>=4,RC[-3]<5),80,IF(AND(RC[-3]>RC[-1],RC[-3]>=5,RC[-3]<6),70,IF(AND(RC[-3]>RC[-1],RC[-3]>=6,RC[-3]<7),60,IF(AND(RC[-3]>RC[-1],RC[-3]>=7,RC[-3]<8),50,IF(AND(RC[-3]>RC[-1],RC[-3]>=8,RC[-3]<9),40,IF(AND(RC[-3]>RC[-1],RC[-3]>=9,RC[-3]<10),30,IF(AND(RC[-3]>RC[-1],RC[-3]>=10,RC[-3]<11),20,IF(AND(RC[-3]>RC[-1],RC[-3]>=11,RC[-3]<12),10,IF(AND(RC[-3]>RC[-1],RC[-3]>=12),0))))))))))))))))))))))))))))))))) -> 0 | H561: =IF(RC[-3]="","",IF(RC[-3]<0.3,100,IF(AND(RC[-3]>=0.3,RC[-3]>0.4),95,IF(AND(RC[-3]>=0.4,RC[-3]<0.5),90,IF(AND(RC[-3]>=0.5,RC[-3]<0.6),85,IF(AND(RC[-3]>=0.6,RC[-3]<0.7),80,IF(AND(RC[-3]>=0.6,RC[-3]<1),80,IF(AND(RC[-3]>1,RC[-3]<2),50,IF(RC[-3]>2,0))))))))) ->  | I561: =IF(RC[-1]="",RC[-2],0.7*RC[-1]+0.3*RC[-2]) -> 0
A562: صنعتی سپاهان | B562: فسپا | C562: =VLOOKUP(RC[-1],Sheet1!R3C2:R802C3,2,FALSE) -> فلزات اساسی | D562: =VLOOKUP(RC[-2],Sheet1!R3C2:R802C9,8,FALSE) -> 2.2000000000000002 | E562: =IF(VLOOKUP(RC[-3],Sheet1!R3C2:R803C11,10,FALSE)=0,"",VLOOKUP(Sheet2!RC[-3],Sheet1!R[1]C[-3]:R[801]C[6],10,FALSE)) ->  | F562: =Sheet1!R634C10 -> 7.4779348942651307 | G562: =IF(RC[-3]<0,0,IF(AND(RC[-3]<RC[-1],RC[-3]<2),100,IF(AND(RC[-3]<RC[-1],RC[-3]>=2,RC[-3]<3),95,IF(AND(RC[-3]<RC[-1],RC[-3]>=3,RC[-3]<4),90,IF(AND(RC[-3]<RC[-1],RC[-3]>=4,RC[-3]<5),85,IF(AND(RC[-3]<RC[-1],RC[-3]>=5,RC[-3]<6),80,IF(AND(RC[-3]<RC[-1],RC[-3]>=6,RC[-3]<7),75,IF(AND(RC[-3]<RC[-1],RC[-3]>=7,RC[-3]<8),70,IF(AND(RC[-3]<RC[-1],RC[-3]>=8,RC[-3]<9),65,IF(AND(RC[-3]<RC[-1],RC[-3]>=9,RC[-3]<10),60,IF(AND(RC[-3]<RC[-1],RC[-3]>=10,RC[-3]<11),55,IF(AND(RC[-3]<RC[-1],RC[-3]>=11,RC[-3]<12),50,IF(AND(RC[-3]<RC[-1],RC[-3]>=12,RC[-3]<13),45,IF(AND(RC[-3]<RC[-1],RC[-3]>=13,RC[-3]<14),40,IF(AND(RC[-3]<RC[-1],RC[-3]>=14,RC[-3]<15),35,IF(AND(RC[-3]<RC[-1],RC[-3]>=15,RC[-3]<16),30,IF(AND(RC[-3]<RC[-1],RC[-3]>=16,RC[-3]<17),25,IF(AND(RC[-3]<RC[-1],RC[-3]>=17,RC[-3]<18),20,IF(AND(RC[-3]<RC[-1],RC[-3]>=18,RC[-3]<19),15,IF(AND(RC[-3]<RC[-1],RC[-3]>=19,RC[-3]<20),10,IF(AND(RC[-3]<RC[-1],RC[-3]>=20,RC[-3]<21),5,IF(AND(RC[-3]<RC[-1],RC[-3]>=21),0,IF(AND(RC[-3]>RC[-1],RC[-3]>=2,RC[-3]<3),90,IF(AND(RC[-3]>RC[-1],RC[-3]>=3,RC[-3]<4),90,IF(AND(RC[-3]>RC[-1],RC[-3]>=4,RC[-3]<5),80,IF(AND(RC[-3]>RC[-1],RC[-3]>=5,RC[-3]<6),70,IF(AND(RC[-3]>RC[-1],RC[-3]>=6,RC[-3]<7),60,IF(AND(RC[-3]>RC[-1],RC[-3]>=7,RC[-3]<8),50,IF(AND(RC[-3]>RC[-1],RC[-3]>=8,RC[-3]<9),40,IF(AND(RC[-3]>RC[-1],RC[-3]>=9,RC[-3]<10),30,IF(AND(RC[-3]>RC[-1],RC[-3]>=10,RC[-3]<11),20,IF(AND(RC[-3]>RC[-1],RC[-3]>=11,RC[-3]<12),10,IF(AND(RC[-3]>RC[-1],RC[-3]>=12),0))))))))))))))))))))))))))))))))) -> 95 | H562: =IF(RC[-3]="","",IF(RC[-3]<0.3,100,IF(AND(RC[-3]>=0.3,RC[-3]>0.4),95,IF(AND(RC[-3]>=0.4,RC[-3]<0.5),90,IF(AND(RC[-3]>=0.5,RC[-3]<0.6),85,IF(AND(RC[-3]>=0.6,RC[-3]<0.7),80,IF(AND(RC[-3]>=0.6,RC[-3]<1),80,IF(AND(RC[-3]>1,RC[-3]<2),50,IF(RC[-3]>2,0))))))))) ->  | I562: =IF(RC[-1]="",RC[-2],0.7*RC[-1]+0.3*RC[-2]) -> 95
A563: غلتک سازان سپاهان | B563: فسازان | C563: =VLOOKUP(RC[-1],Sheet1!R3C2:R802C3,2,FALSE) -> فلزات اساسی | D563: =VLOOKUP(RC[-2],Sheet1!R3C2:R802C9,8,FALSE) -> 10.852468260791474 | E563: =IF(VLOOKUP(RC[-3],Sheet1!R3C2:R803C11,10,FALSE)=0,"",VLOOKUP(Sheet2!RC[-3],Sheet1!R[1]C[-3]:R[801]C[6],10,FALSE)) ->  | F563: =Sheet1!R634C10 -> 7.4779348942651307 | G563: =IF(RC[-3]<0,0,IF(AND(RC[-3]<RC[-1],RC[-3]<2),100,IF(AND(RC[-3]<RC[-1],RC[-3]>=2,RC[-3]<3),95,IF(AND(RC[-3]<RC[-1],RC[-3]>=3,RC[-3]<4),90,IF(AND(RC[-3]<RC[-1],RC[-3]>=4,RC[-3]<5),85,IF(AND(RC[-3]<RC[-1],RC[-3]>=5,RC[-3]<6),80,IF(AND(RC[-3]<RC[-1],RC[-3]>=6,RC[-3]<7),75,IF(AND(RC[-3]<RC[-1],RC[-3]>=7,RC[-3]<8),70,IF(AND(RC[-3]<RC[-1],RC[-3]>=8,RC[-3]<9),65,IF(AND(RC[-3]<RC[-1],RC[-3]>=9,RC[-3]<10),60,IF(AND(RC[-3]<RC[-1],RC[-3]>=10,RC[-3]<11),55,IF(AND(RC[-3]<RC[-1],RC[-3]>=11,RC[-3]<12),50,IF(AND(RC[-3]<RC[-1],RC[-3]>=12,RC[-3]<13),45,IF(AND(RC[-3]<RC[-1],RC[-3]>=13,RC[-3]<14),40,IF(AND(RC[-3]<RC[-1],RC[-3]>=14,RC[-3]<15),35,IF(AND(RC[-3]<RC[-1],RC[-3]>=15,RC[-3]<16),30,IF(AND(RC[-3]<RC[-1],RC[-3]>=16,RC[-3]<17),25,IF(AND(RC[-3]<RC[-1],RC[-3]>=17,RC[-3]<18),20,IF(AND(RC[-3]<RC[-1],RC[-3]>=18,RC[-3]<19),15,IF(AND(RC[-3]<RC[-1],RC[-3]>=19,RC[-3]<20),10,IF(AND(RC[-3]<RC[-1],RC[-3]>=20,RC[-3]<21),5,IF(AND(RC[-3]<RC[-1],RC[-3]>=21),0,IF(AND(RC[-3]>RC[-1],RC[-3]>=2,RC[-3]<3),90,IF(AND(RC[-3]>RC[-1],RC[-3]>=3,RC[-3]<4),90,IF(AND(RC[-3]>RC[-1],RC[-3]>=4,RC[-3]<5),80,IF(AND(RC[-3]>RC[-1],RC[-3]>=5,RC[-3]<6),70,IF(AND(RC[-3]>RC[-1],RC[-3]>=6,RC[-3]<7),60,IF(AND(RC[-3]>RC[-1],RC[-3]>=7,RC[-3]<8),50,IF(AND(RC[-3]>RC[-1],RC[-3]>=8,RC[-3]<9),40,IF(AND(RC[-3]>RC[-1],RC[-3]>=9,RC[-3]<10),30,IF(AND(RC[-3]>RC[-1],RC[-3]>=10,RC[-3]<11),20,IF(AND(RC[-3]>RC[-1],RC[-3]>=11,RC[-3]<12),10,IF(AND(RC[-3]>RC[-1],RC[-3]>=12),0))))))))))))))))))))))))))))))))) -> 20 | H563: =IF(RC[-3]="","",IF(RC[-3]<0.3,100,IF(AND(RC[-3]>=0.3,RC[-3]>0.4),95,IF(AND(RC[-3]>=0.4,RC[-3]<0.5),90,IF(AND(RC[-3]>=0.5,RC[-3]<0.6),85,IF(AND(RC[-3]>=0.6,RC[-3]<0.7),80,IF(AND(RC[-3]>=0.6,RC[-3]<1),80,IF(AND(RC[-3]>1,RC[-3]<2),50,IF(RC[-3]>2,0))))))))) ->  | I563: =IF(RC[-1]="",RC[-2],0.7*RC[-1]+0.3*RC[-2]) -> 20
A564: فرآوری مواد معدنی | B564: فرآور | C564: =VLOOKUP(RC[-1],Sheet1!R3C2:R802C3,2,FALSE) -> فلزات اساسی | D564: =VLOOKUP(RC[-2],Sheet1!R3C2:R802C9,8,FALSE) -> 10.5 | E564: =IF(VLOOKUP(RC[-3],Sheet1!R3C2:R803C11,10,FALSE)=0,"",VLOOKUP(Sheet2!RC[-3],Sheet1!R[1]C[-3]:R[801]C[6],10,FALSE)) ->  | F564: =Sheet1!R634C10 -> 7.4779348942651307 | G564: =IF(RC[-3]<0,0,IF(AND(RC[-3]<RC[-1],RC[-3]<2),100,IF(AND(RC[-3]<RC[-1],RC[-3]>=2,RC[-3]<3),95,IF(AND(RC[-3]<RC[-1],RC[-3]>=3,RC[-3]<4),90,IF(AND(RC[-3]<RC[-1],RC[-3]>=4,RC[-3]<5),85,IF(AND(RC[-3]<RC[-1],RC[-3]>=5,RC[-3]<6),80,IF(AND(RC[-3]<RC[-1],RC[-3]>=6,RC[-3]<7),75,IF(AND(RC[-3]<RC[-1],RC[-3]>=7,RC[-3]<8),70,IF(AND(RC[-3]<RC[-1],RC[-3]>=8,RC[-3]<9),65,IF(AND(RC[-3]<RC[-1],RC[-3]>=9,RC[-3]<10),60,IF(AND(RC[-3]<RC[-1],RC[-3]>=10,RC[-3]<11),55,IF(AND(RC[-3]<RC[-1],RC[-3]>=11,RC[-3]<12),50,IF(AND(RC[-3]<RC[-1],RC[-3]>=12,RC[-3]<13),45,IF(AND(RC[-3]<RC[-1],RC[-3]>=13,RC[-3]<14),40,IF(AND(RC[-3]<RC[-1],RC[-3]>=14,RC[-3]<15),35,IF(AND(RC[-3]<RC[-1],RC[-3]>=15,RC[-3]<16),30,IF(AND(RC[-3]<RC[-1],RC[-3]>=16,RC[-3]<17),25,IF(AND(RC[-3]<RC[-1],RC[-3]>=17,RC[-3]<18),20,IF(AND(RC[-3]<RC[-1],RC[-3]>=18,RC[-3]<19),15,IF(AND(RC[-3]<RC[-1],RC[-3]>=19,RC[-3]<20),10,IF(AND(RC[-3]<RC[-1],RC[-3]>=20,RC[-3]<21),5,IF(AND(RC[-3]<RC[-1],RC[-3]>=21),0,IF(AND(RC[-3]>RC[-1],RC[-3]>=2,RC[-3]<3),90,IF(AND(RC[-3]>RC[-1],RC[-3]>=3,RC[-3]<4),90,IF(AND(RC[-3]>RC[-1],RC[-3]>=4,RC[-3]<5),80,IF(AND(RC[-3]>RC[-1],RC[-3]>=5,RC[-3]<6),70,IF(AND(RC[-3]>RC[-1],RC[-3]>=6,RC[-3]<7),60,IF(AND(RC[-3]>RC[-1],RC[-3]>=7,RC[-3]<8),50,IF(AND(RC[-3]>RC[-1],RC[-3]>=8,RC[-3]<9),40,IF(AND(RC[-3]>RC[-1],RC[-3]>=9,RC[-3]<10),30,IF(AND(RC[-3]>RC[-1],RC[-3]>=10,RC[-3]<11),20,IF(AND(RC[-3]>RC[-1],RC[-3]>=11,RC[-3]<12),10,IF(AND(RC[-3]>RC[-1],RC[-3]>=12),0))))))))))))))))))))))))))))))))) -> 20 | H564: =IF(RC[-3]="","",IF(RC[-3]<0.3,100,IF(AND(RC[-3]>=0.3,RC[-3]>0.4),95,IF(AND(RC[-3]>=0.4,RC[-3]<0.5),90,IF(AND(RC[-3]>=0.5,RC[-3]<0.6),85,IF(AND(RC[-3]>=0.6,RC[-3]<0.7),80,IF(AND(RC[-3]>=0.6,RC[-3]<1),80,IF(AND(RC[-3]>1,RC[-3]<2),50,IF(RC[-3]>2,0))))))))) ->  | I564: =IF(RC[-1]="",RC[-2],0.7*RC[-1]+0.3*RC[-2]) -> 20
A565: فرو آلیاژ ایران | B565: فروژ | C565: =VLOOKUP(RC[-1],Sheet1!R3C2:R802C3,2,FALSE) -> فلزات اساسی | D565: =VLOOKUP(RC[-2],Sheet1!R3C2:R802C9,8,FALSE) -> 4.0416646180861378 | E565: =IF(VLOOKUP(RC[-3],Sheet1!R3C2:R803C11,10,FALSE)=0,"",VLOOKUP(Sheet2!RC[-3],Sheet1!R[1]C[-3]:R[801]C[6],10,FALSE)) ->  | F565: =Sheet1!R634C10 -> 7.4779348942651307 | G565: =IF(RC[-3]<0,0,IF(AND(RC[-3]<RC[-1],RC[-3]<2),100,IF(AND(RC[-3]<RC[-1],RC[-3]>=2,RC[-3]<3),95,IF(AND(RC[-3]<RC[-1],RC[-3]>=3,RC[-3]<4),90,IF(AND(RC[-3]<RC[-1],RC[-3]>=4,RC[-3]<5),85,IF(AND(RC[-3]<RC[-1],RC[-3]>=5,RC[-3]<6),80,IF(AND(RC[-3]<RC[-1],RC[-3]>=6,RC[-3]<7),75,IF(AND(RC[-3]<RC[-1],RC[-3]>=7,RC[-3]<8),70,IF(AND(RC[-3]<RC[-1],RC[-3]>=8,RC[-3]<9),65,IF(AND(RC[-3]<RC[-1],RC[-3]>=9,RC[-3]<10),60,IF(AND(RC[-3]<RC[-1],RC[-3]>=10,RC[-3]<11),55,IF(AND(RC[-3]<RC[-1],RC[-3]>=11,RC[-3]<12),50,IF(AND(RC[-3]<RC[-1],RC[-3]>=12,RC[-3]<13),45,IF(AND(RC[-3]<RC[-1],RC[-3]>=13,RC[-3]<14),40,IF(AND(RC[-3]<RC[-1],RC[-3]>=14,RC[-3]<15),35,IF(AND(RC[-3]<RC[-1],RC[-3]>=15,RC[-3]<16),30,IF(AND(RC[-3]<RC[-1],RC[-3]>=16,RC[-3]<17),25,IF(AND(RC[-3]<RC[-1],RC[-3]>=17,RC[-3]<18),20,IF(AND(RC[-3]<RC[-1],RC[-3]>=18,RC[-3]<19),15,IF(AND(RC[-3]<RC[-1],RC[-3]>=19,RC[-3]<20),10,IF(AND(RC[-3]<RC[-1],RC[-3]>=20,RC[-3]<21),5,IF(AND(RC[-3]<RC[-1],RC[-3]>=21),0,IF(AND(RC[-3]>RC[-1],RC[-3]>=2,RC[-3]<3),90,IF(AND(RC[-3]>RC[-1],RC[-3]>=3,RC[-3]<4),90,IF(AND(RC[-3]>RC[-1],RC[-3]>=4,RC[-3]<5),80,IF(AND(RC[-3]>RC[-1],RC[-3]>=5,RC[-3]<6),70,IF(AND(RC[-3]>RC[-1],RC[-3]>=6,RC[-3]<7),60,IF(AND(RC[-3]>RC[-1],RC[-3]>=7,RC[-3]<8),50,IF(AND(RC[-3]>RC[-1],RC[-3]>=8,RC[-3]<9),40,IF(AND(RC[-3]>RC[-1],RC[-3]>=9,RC[-3]<10),30,IF(AND(RC[-3]>RC[-1],RC[-3]>=10,RC[-3]<11),20,IF(AND(RC[-3]>RC[-1],RC[-3]>=11,RC[-3]<12),10,IF(AND(RC[-3]>RC[-1],RC[-3]>=12),0))))))))))))))))))))))))))))))))) -> 85 | H565: =IF(RC[-3]="","",IF(RC[-3]<0.3,100,IF(AND(RC[-3]>=0.3,RC[-3]>0.4),95,IF(AND(RC[-3]>=0.4,RC[-3]<0.5),90,IF(AND(RC[-3]>=0.5,RC[-3]<0.6),85,IF(AND(RC[-3]>=0.6,RC[-3]<0.7),80,IF(AND(RC[-3]>=0.6,RC[-3]<1),80,IF(AND(RC[-3]>1,RC[-3]<2),50,IF(RC[-3]>2,0))))))))) ->  | I565: =IF(RC[-1]="",RC[-2],0.7*RC[-1]+0.3*RC[-2]) -> 85
A566: فروسیلیس ایران | B566: فروس | C566: =VLOOKUP(RC[-1],Sheet1!R3C2:R802C3,2,FALSE) -> فلزات اساسی | D566: =VLOOKUP(RC[-2],Sheet1!R3C2:R802C9,8,FALSE) -> 3.4564758251560641 | E566: =IF(VLOOKUP(RC[-3],Sheet1!R3C2:R803C11,10,FALSE)=0,"",VLOOKUP(Sheet2!RC[-3],Sheet1!R[1]C[-3]:R[801]C[6],10,FALSE)) ->  | F566: =Sheet1!R634C10 -> 7.4779348942651307 | G566: =IF(RC[-3]<0,0,IF(AND(RC[-3]<RC[-1],RC[-3]<2),100,IF(AND(RC[-3]<RC[-1],RC[-3]>=2,RC[-3]<3),95,IF(AND(RC[-3]<RC[-1],RC[-3]>=3,RC[-3]<4),90,IF(AND(RC[-3]<RC[-1],RC[-3]>=4,RC[-3]<5),85,IF(AND(RC[-3]<RC[-1],RC[-3]>=5,RC[-3]<6),80,IF(AND(RC[-3]<RC[-1],RC[-3]>=6,RC[-3]<7),75,IF(AND(RC[-3]<RC[-1],RC[-3]>=7,RC[-3]<8),70,IF(AND(RC[-3]<RC[-1],RC[-3]>=8,RC[-3]<9),65,IF(AND(RC[-3]<RC[-1],RC[-3]>=9,RC[-3]<10),60,IF(AND(RC[-3]<RC[-1],RC[-3]>=10,RC[-3]<11),55,IF(AND(RC[-3]<RC[-1],RC[-3]>=11,RC[-3]<12),50,IF(AND(RC[-3]<RC[-1],RC[-3]>=12,RC[-3]<13),45,IF(AND(RC[-3]<RC[-1],RC[-3]>=13,RC[-3]<14),40,IF(AND(RC[-3]<RC[-1],RC[-3]>=14,RC[-3]<15),35,IF(AND(RC[-3]<RC[-1],RC[-3]>=15,RC[-3]<16),30,IF(AND(RC[-3]<RC[-1],RC[-3]>=16,RC[-3]<17),25,IF(AND(RC[-3]<RC[-1],RC[-3]>=17,RC[-3]<18),20,IF(AND(RC[-3]<RC[-1],RC[-3]>=18,RC[-3]<19),15,IF(AND(RC[-3]<RC[-1],RC[-3]>=19,RC[-3]<20),10,IF(AND(RC[-3]<RC[-1],RC[-3]>=20,RC[-3]<21),5,IF(AND(RC[-3]<RC[-1],RC[-3]>=21),0,IF(AND(RC[-3]>RC[-1],RC[-3]>=2,RC[-3]<3),90,IF(AND(RC[-3]>RC[-1],RC[-3]>=3,RC[-3]<4),90,IF(AND(RC[-3]>RC[-1],RC[-3]>=4,RC[-3]<5),80,IF(AND(RC[-3]>RC[-1],RC[-3]>=5,RC[-3]<6),70,IF(AND(RC[-3]>RC[-1],RC[-3]>=6,RC[-3]<7),60,IF(AND(RC[-3]>RC[-1],RC[-3]>=7,RC[-3]<8),50,IF(AND(RC[-3]>RC[-1],RC[-3]>=8,RC[-3]<9),40,IF(AND(RC[-3]>RC[-1],RC[-3]>=9,RC[-3]<10),30,IF(AND(RC[-3]>RC[-1],RC[-3]>=10,RC[-3]<11),20,IF(AND(RC[-3]>RC[-1],RC[-3]>=11,RC[-3]<12),10,IF(AND(RC[-3]>RC[-1],RC[-3]>=12),0))))))))))))))))))))))))))))))))) -> 90 | H566: =IF(RC[-3]="","",IF(RC[-3]<0.3,100,IF(AND(RC[-3]>=0.3,RC[-3]>0.4),95,IF(AND(RC[-3]>=0.4,RC[-3]<0.5),90,IF(AND(RC[-3]>=0.5,RC[-3]<0.6),85,IF(AND(RC[-3]>=0.6,RC[-3]<0.7),80,IF(AND(RC[-3]>=0.6,RC[-3]<1),80,IF(AND(RC[-3]>1,RC[-3]<2),50,IF(RC[-3]>2,0))))))))) ->  | I566: =IF(RC[-1]="",RC[-2],0.7*RC[-1]+0.3*RC[-2]) -> 90
A567: فروسیلیسیم خمین | B567: فروسیل | C567: =VLOOKUP(RC[-1],Sheet1!R3C2:R802C3,2,FALSE) -> فلزات اساسی | D567: =VLOOKUP(RC[-2],Sheet1!R3C2:R802C9,8,FALSE) -> 5.8830695701298659 | E567: =IF(VLOOKUP(RC[-3],Sheet1!R3C2:R803C11,10,FALSE)=0,"",VLOOKUP(Sheet2!RC[-3],Sheet1!R[1]C[-3]:R[801]C[6],10,FALSE)) ->  | F567: =Sheet1!R634C10 -> 7.4779348942651307 | G567: =IF(RC[-3]<0,0,IF(AND(RC[-3]<RC[-1],RC[-3]<2),100,IF(AND(RC[-3]<RC[-1],RC[-3]>=2,RC[-3]<3),95,IF(AND(RC[-3]<RC[-1],RC[-3]>=3,RC[-3]<4),90,IF(AND(RC[-3]<RC[-1],RC[-3]>=4,RC[-3]<5),85,IF(AND(RC[-3]<RC[-1],RC[-3]>=5,RC[-3]<6),80,IF(AND(RC[-3]<RC[-1],RC[-3]>=6,RC[-3]<7),75,IF(AND(RC[-3]<RC[-1],RC[-3]>=7,RC[-3]<8),70,IF(AND(RC[-3]<RC[-1],RC[-3]>=8,RC[-3]<9),65,IF(AND(RC[-3]<RC[-1],RC[-3]>=9,RC[-3]<10),60,IF(AND(RC[-3]<RC[-1],RC[-3]>=10,RC[-3]<11),55,IF(AND(RC[-3]<RC[-1],RC[-3]>=11,RC[-3]<12),50,IF(AND(RC[-3]<RC[-1],RC[-3]>=12,RC[-3]<13),45,IF(AND(RC[-3]<RC[-1],RC[-3]>=13,RC[-3]<14),40,IF(AND(RC[-3]<RC[-1],RC[-3]>=14,RC[-3]<15),35,IF(AND(RC[-3]<RC[-1],RC[-3]>=15,RC[-3]<16),30,IF(AND(RC[-3]<RC[-1],RC[-3]>=16,RC[-3]<17),25,IF(AND(RC[-3]<RC[-1],RC[-3]>=17,RC[-3]<18),20,IF(AND(RC[-3]<RC[-1],RC[-3]>=18,RC[-3]<19),15,IF(AND(RC[-3]<RC[-1],RC[-3]>=19,RC[-3]<20),10,IF(AND(RC[-3]<RC[-1],RC[-3]>=20,RC[-3]<21),5,IF(AND(RC[-3]<RC[-1],RC[-3]>=21),0,IF(AND(RC[-3]>RC[-1],RC[-3]>=2,RC[-3]<3),90,IF(AND(RC[-3]>RC[-1],RC[-3]>=3,RC[-3]<4),90,IF(AND(RC[-3]>RC[-1],RC[-3]>=4,RC[-3]<5),80,IF(AND(RC[-3]>RC[-1],RC[-3]>=5,RC[-3]<6),70,IF(AND(RC[-3]>RC[-1],RC[-3]>=6,RC[-3]<7),60,IF(AND(RC[-3]>RC[-1],RC[-3]>=7,RC[-3]<8),50,IF(AND(RC[-3]>RC[-1],RC[-3]>=8,RC[-3]<9),40,IF(AND(RC[-3]>RC[-1],RC[-3]>=9,RC[-3]<10),30,IF(AND(RC[-3]>RC[-1],RC[-3]>=10,RC[-3]<11),20,IF(AND(RC[-3]>RC[-1],RC[-3]>=11,RC[-3]<12),10,IF(AND(RC[-3]>RC[-1],RC[-3]>=12),0))))))))))))))))))))))))))))))))) -> 80 | H567: =IF(RC[-3]="","",IF(RC[-3]<0.3,100,IF(AND(RC[-3]>=0.3,RC[-3]>0.4),95,IF(AND(RC[-3]>=0.4,RC[-3]<0.5),90,IF(AND(RC[-3]>=0.5,RC[-3]<0.6),85,IF(AND(RC[-3]>=0.6,RC[-3]<0.7),80,IF(AND(RC[-3]>=0.6,RC[-3]<1),80,IF(AND(RC[-3]>1,RC[-3]<2),50,IF(RC[-3]>2,0))))))))) ->  | I567: =IF(RC[-1]="",RC[-2],0.7*RC[-1]+0.3*RC[-2]) -> 80
A568: فولاد آلیاژی ایران | B568: فولاژ | C568: =VLOOKUP(RC[-1],Sheet1!R3C2:R802C3,2,FALSE) -> فلزات اساسی | D568: =VLOOKUP(RC[-2],Sheet1!R3C2:R802C9,8,FALSE) -> 6.5 | E568: =IF(VLOOKUP(RC[-3],Sheet1!R3C2:R803C11,10,FALSE)=0,"",VLOOKUP(Sheet2!RC[-3],Sheet1!R[1]C[-3]:R[801]C[6],10,FALSE)) ->  | F568: =Sheet1!R634C10 -> 7.4779348942651307 | G568: =IF(RC[-3]<0,0,IF(AND(RC[-3]<RC[-1],RC[-3]<2),100,IF(AND(RC[-3]<RC[-1],RC[-3]>=2,RC[-3]<3),95,IF(AND(RC[-3]<RC[-1],RC[-3]>=3,RC[-3]<4),90,IF(AND(RC[-3]<RC[-1],RC[-3]>=4,RC[-3]<5),85,IF(AND(RC[-3]<RC[-1],RC[-3]>=5,RC[-3]<6),80,IF(AND(RC[-3]<RC[-1],RC[-3]>=6,RC[-3]<7),75,IF(AND(RC[-3]<RC[-1],RC[-3]>=7,RC[-3]<8),70,IF(AND(RC[-3]<RC[-1],RC[-3]>=8,RC[-3]<9),65,IF(AND(RC[-3]<RC[-1],RC[-3]>=9,RC[-3]<10),60,IF(AND(RC[-3]<RC[-1],RC[-3]>=10,RC[-3]<11),55,IF(AND(RC[-3]<RC[-1],RC[-3]>=11,RC[-3]<12),50,IF(AND(RC[-3]<RC[-1],RC[-3]>=12,RC[-3]<13),45,IF(AND(RC[-3]<RC[-1],RC[-3]>=13,RC[-3]<14),40,IF(AND(RC[-3]<RC[-1],RC[-3]>=14,RC[-3]<15),35,IF(AND(RC[-3]<RC[-1],RC[-3]>=15,RC[-3]<16),30,IF(AND(RC[-3]<RC[-1],RC[-3]>=16,RC[-3]<17),25,IF(AND(RC[-3]<RC[-1],RC[-3]>=17,RC[-3]<18),20,IF(AND(RC[-3]<RC[-1],RC[-3]>=18,RC[-3]<19),15,IF(AND(RC[-3]<RC[-1],RC[-3]>=19,RC[-3]<20),10,IF(AND(RC[-3]<RC[-1],RC[-3]>=20,RC[-3]<21),5,IF(AND(RC[-3]<RC[-1],RC[-3]>=21),0,IF(AND(RC[-3]>RC[-1],RC[-3]>=2,RC[-3]<3),90,IF(AND(RC[-3]>RC[-1],RC[-3]>=3,RC[-3]<4),90,IF(AND(RC[-3]>RC[-1],RC[-3]>=4,RC[-3]<5),80,IF(AND(RC[-3]>RC[-1],RC[-3]>=5,RC[-3]<6),70,IF(AND(RC[-3]>RC[-1],RC[-3]>=6,RC[-3]<7),60,IF(AND(RC[-3]>RC[-1],RC[-3]>=7,RC[-3]<8),50,IF(AND(RC[-3]>RC[-1],RC[-3]>=8,RC[-3]<9),40,IF(AND(RC[-3]>RC[-1],RC[-3]>=9,RC[-3]<10),30,IF(AND(RC[-3]>RC[-1],RC[-3]>=10,RC[-3]<11),20,IF(AND(RC[-3]>RC[-1],RC[-3]>=11,RC[-3]<12),10,IF(AND(RC[-3]>RC[-1],RC[-3]>=12),0))))))))))))))))))))))))))))))))) -> 75 | H568: =IF(RC[-3]="","",IF(RC[-3]<0.3,100,IF(AND(RC[-3]>=0.3,RC[-3]>0.4),95,IF(AND(RC[-3]>=0.4,RC[-3]<0.5),90,IF(AND(RC[-3]>=0.5,RC[-3]<0.6),85,IF(AND(RC[-3]>=0.6,RC[-3]<0.7),80,IF(AND(RC[-3]>=0.6,RC[-3]<1),80,IF(AND(RC[-3]>1,RC[-3]<2),50,IF(RC[-3]>2,0))))))))) ->  | I568: =IF(RC[-1]="",RC[-2],0.7*RC[-1]+0.3*RC[-2]) -> 75
A569: فولاد آلیاژی یزد | B569: فولای | C569: =VLOOKUP(RC[-1],Sheet1!R3C2:R802C3,2,FALSE) -> فلزات اساسی | D569: =VLOOKUP(RC[-2],Sheet1!R3C2:R802C9,8,FALSE) -> 5.011740982041708 | E569: =IF(VLOOKUP(RC[-3],Sheet1!R3C2:R803C11,10,FALSE)=0,"",VLOOKUP(Sheet2!RC[-3],Sheet1!R[1]C[-3]:R[801]C[6],10,FALSE)) ->  | F569: =Sheet1!R634C10 -> 7.4779348942651307 | G569: =IF(RC[-3]<0,0,IF(AND(RC[-3]<RC[-1],RC[-3]<2),100,IF(AND(RC[-3]<RC[-1],RC[-3]>=2,RC[-3]<3),95,IF(AND(RC[-3]<RC[-1],RC[-3]>=3,RC[-3]<4),90,IF(AND(RC[-3]<RC[-1],RC[-3]>=4,RC[-3]<5),85,IF(AND(RC[-3]<RC[-1],RC[-3]>=5,RC[-3]<6),80,IF(AND(RC[-3]<RC[-1],RC[-3]>=6,RC[-3]<7),75,IF(AND(RC[-3]<RC[-1],RC[-3]>=7,RC[-3]<8),70,IF(AND(RC[-3]<RC[-1],RC[-3]>=8,RC[-3]<9),65,IF(AND(RC[-3]<RC[-1],RC[-3]>=9,RC[-3]<10),60,IF(AND(RC[-3]<RC[-1],RC[-3]>=10,RC[-3]<11),55,IF(AND(RC[-3]<RC[-1],RC[-3]>=11,RC[-3]<12),50,IF(AND(RC[-3]<RC[-1],RC[-3]>=12,RC[-3]<13),45,IF(AND(RC[-3]<RC[-1],RC[-3]>=13,RC[-3]<14),40,IF(AND(RC[-3]<RC[-1],RC[-3]>=14,RC[-3]<15),35,IF(AND(RC[-3]<RC[-1],RC[-3]>=15,RC[-3]<16),30,IF(AND(RC[-3]<RC[-1],RC[-3]>=16,RC[-3]<17),25,IF(AND(RC[-3]<RC[-1],RC[-3]>=17,RC[-3]<18),20,IF(AND(RC[-3]<RC[-1],RC[-3]>=18,RC[-3]<19),15,IF(AND(RC[-3]<RC[-1],RC[-3]>=19,RC[-3]<20),10,IF(AND(RC[-3]<RC[-1],RC[-3]>=20,RC[-3]<21),5,IF(AND(RC[-3]<RC[-1],RC[-3]>=21),0,IF(AND(RC[-3]>RC[-1],RC[-3]>=2,RC[-3]<3),90,IF(AND(RC[-3]>RC[-1],RC[-3]>=3,RC[-3]<4),90,IF(AND(RC[-3]>RC[-1],RC[-3]>=4,RC[-3]<5),80,IF(AND(RC[-3]>RC[-1],RC[-3]>=5,RC[-3]<6),70,IF(AND(RC[-3]>RC[-1],RC[-3]>=6,RC[-3]<7),60,IF(AND(RC[-3]>RC[-1],RC[-3]>=7,RC[-3]<8),50,IF(AND(RC[-3]>RC[-1],RC[-3]>=8,RC[-3]<9),40,IF(AND(RC[-3]>RC[-1],RC[-3]>=9,RC[-3]<10),30,IF(AND(RC[-3]>RC[-1],RC[-3]>=10,RC[-3]<11),20,IF(AND(RC[-3]>RC[-1],RC[-3]>=11,RC[-3]<12),10,IF(AND(RC[-3]>RC[-1],RC[-3]>=12),0))))))))))))))))))))))))))))))))) -> 80 | H569: =IF(RC[-3]="","",IF(RC[-3]<0.3,100,IF(AND(RC[-3]>=0.3,RC[-3]>0.4),95,IF(AND(RC[-3]>=0.4,RC[-3]<0.5),90,IF(AND(RC[-3]>=0.5,RC[-3]<0.6),85,IF(AND(RC[-3]>=0.6,RC[-3]<0.7),80,IF(AND(RC[-3]>=0.6,RC[-3]<1),80,IF(AND(RC[-3]>1,RC[-3]<2),50,IF(RC[-3]>2,0))))))))) ->  | I569: =IF(RC[-1]="",RC[-2],0.7*RC[-1]+0.3*RC[-2]) -> 80
A570: فولاد افزا سپاهان | B570: فافزا | C570: =VLOOKUP(RC[-1],Sheet1!R3C2:R802C3,2,FALSE) -> فلزات اساسی | D570: =VLOOKUP(RC[-2],Sheet1!R3C2:R802C9,8,FALSE) -> 7.1910419618241317 | E570: =IF(VLOOKUP(RC[-3],Sheet1!R3C2:R803C11,10,FALSE)=0,"",VLOOKUP(Sheet2!RC[-3],Sheet1!R[1]C[-3]:R[801]C[6],10,FALSE)) ->  | F570: =Sheet1!R634C10 -> 7.4779348942651307 | G570: =IF(RC[-3]<0,0,IF(AND(RC[-3]<RC[-1],RC[-3]<2),100,IF(AND(RC[-3]<RC[-1],RC[-3]>=2,RC[-3]<3),95,IF(AND(RC[-3]<RC[-1],RC[-3]>=3,RC[-3]<4),90,IF(AND(RC[-3]<RC[-1],RC[-3]>=4,RC[-3]<5),85,IF(AND(RC[-3]<RC[-1],RC[-3]>=5,RC[-3]<6),80,IF(AND(RC[-3]<RC[-1],RC[-3]>=6,RC[-3]<7),75,IF(AND(RC[-3]<RC[-1],RC[-3]>=7,RC[-3]<8),70,IF(AND(RC[-3]<RC[-1],RC[-3]>=8,RC[-3]<9),65,IF(AND(RC[-3]<RC[-1],RC[-3]>=9,RC[-3]<10),60,IF(AND(RC[-3]<RC[-1],RC[-3]>=10,RC[-3]<11),55,IF(AND(RC[-3]<RC[-1],RC[-3]>=11,RC[-3]<12),50,IF(AND(RC[-3]<RC[-1],RC[-3]>=12,RC[-3]<13),45,IF(AND(RC[-3]<RC[-1],RC[-3]>=13,RC[-3]<14),40,IF(AND(RC[-3]<RC[-1],RC[-3]>=14,RC[-3]<15),35,IF(AND(RC[-3]<RC[-1],RC[-3]>=15,RC[-3]<16),30,IF(AND(RC[-3]<RC[-1],RC[-3]>=16,RC[-3]<17),25,IF(AND(RC[-3]<RC[-1],RC[-3]>=17,RC[-3]<18),20,IF(AND(RC[-3]<RC[-1],RC[-3]>=18,RC[-3]<19),15,IF(AND(RC[-3]<RC[-1],RC[-3]>=19,RC[-3]<20),10,IF(AND(RC[-3]<RC[-1],RC[-3]>=20,RC[-3]<21),5,IF(AND(RC[-3]<RC[-1],RC[-3]>=21),0,IF(AND(RC[-3]>RC[-1],RC[-3]>=2,RC[-3]<3),90,IF(AND(RC[-3]>RC[-1],RC[-3]>=3,RC[-3]<4),90,IF(AND(RC[-3]>RC[-1],RC[-3]>=4,RC[-3]<5),80,IF(AND(RC[-3]>RC[-1],RC[-3]>=5,RC[-3]<6),70,IF(AND(RC[-3]>RC[-1],RC[-3]>=6,RC[-3]<7),60,IF(AND(RC[-3]>RC[-1],RC[-3]>=7,RC[-3]<8),50,IF(AND(RC[-3]>RC[-1],RC[-3]>=8,RC[-3]<9),40,IF(AND(RC[-3]>RC[-1],RC[-3]>=9,RC[-3]<10),30,IF(AND(RC[-3]>RC[-1],RC[-3]>=10,RC[-3]<11),20,IF(AND(RC[-3]>RC[-1],RC[-3]>=11,RC[-3]<12),10,IF(AND(RC[-3]>RC[-1],RC[-3]>=12),0))))))))))))))))))))))))))))))))) -> 70 | H570: =IF(RC[-3]="","",IF(RC[-3]<0.3,100,IF(AND(RC[-3]>=0.3,RC[-3]>0.4),95,IF(AND(RC[-3]>=0.4,RC[-3]<0.5),90,IF(AND(RC[-3]>=0.5,RC[-3]<0.6),85,IF(AND(RC[-3]>=0.6,RC[-3]<0.7),80,IF(AND(RC[-3]>=0.6,RC[-3]<1),80,IF(AND(RC[-3]>1,RC[-3]<2),50,IF(RC[-3]>2,0))))))))) ->  | I570: =IF(RC[-1]="",RC[-2],0.7*RC[-1]+0.3*RC[-2]) -> 70
A571: فولاد امیرکبیر کاشان | B571: فجر | C571: =VLOOKUP(RC[-1],Sheet1!R3C2:R802C3,2,FALSE) -> فلزات اساسی | D571: =VLOOKUP(RC[-2],Sheet1!R3C2:R802C9,8,FALSE) -> 3.7 | E571: =IF(VLOOKUP(RC[-3],Sheet1!R3C2:R803C11,10,FALSE)=0,"",VLOOKUP(Sheet2!RC[-3],Sheet1!R[1]C[-3]:R[801]C[6],10,FALSE)) ->  | F571: =Sheet1!R634C10 -> 7.4779348942651307 | G571: =IF(RC[-3]<0,0,IF(AND(RC[-3]<RC[-1],RC[-3]<2),100,IF(AND(RC[-3]<RC[-1],RC[-3]>=2,RC[-3]<3),95,IF(AND(RC[-3]<RC[-1],RC[-3]>=3,RC[-3]<4),90,IF(AND(RC[-3]<RC[-1],RC[-3]>=4,RC[-3]<5),85,IF(AND(RC[-3]<RC[-1],RC[-3]>=5,RC[-3]<6),80,IF(AND(RC[-3]<RC[-1],RC[-3]>=6,RC[-3]<7),75,IF(AND(RC[-3]<RC[-1],RC[-3]>=7,RC[-3]<8),70,IF(AND(RC[-3]<RC[-1],RC[-3]>=8,RC[-3]<9),65,IF(AND(RC[-3]<RC[-1],RC[-3]>=9,RC[-3]<10),60,IF(AND(RC[-3]<RC[-1],RC[-3]>=10,RC[-3]<11),55,IF(AND(RC[-3]<RC[-1],RC[-3]>=11,RC[-3]<12),50,IF(AND(RC[-3]<RC[-1],RC[-3]>=12,RC[-3]<13),45,IF(AND(RC[-3]<RC[-1],RC[-3]>=13,RC[-3]<14),40,IF(AND(RC[-3]<RC[-1],RC[-3]>=14,RC[-3]<15),35,IF(AND(RC[-3]<RC[-1],RC[-3]>=15,RC[-3]<16),30,IF(AND(RC[-3]<RC[-1],RC[-3]>=16,RC[-3]<17),25,IF(AND(RC[-3]<RC[-1],RC[-3]>=17,RC[-3]<18),20,IF(AND(RC[-3]<RC[-1],RC[-3]>=18,RC[-3]<19),15,IF(AND(RC[-3]<RC[-1],RC[-3]>=19,RC[-3]<20),10,IF(AND(RC[-3]<RC[-1],RC[-3]>=20,RC[-3]<21),5,IF(AND(RC[-3]<RC[-1],RC[-3]>=21),0,IF(AND(RC[-3]>RC[-1],RC[-3]>=2,RC[-3]<3),90,IF(AND(RC[-3]>RC[-1],RC[-3]>=3,RC[-3]<4),90,IF(AND(RC[-3]>RC[-1],RC[-3]>=4,RC[-3]<5),80,IF(AND(RC[-3]>RC[-1],RC[-3]>=5,RC[-3]<6),70,IF(AND(RC[-3]>RC[-1],RC[-3]>=6,RC[-3]<7),60,IF(AND(RC[-3]>RC[-1],RC[-3]>=7,RC[-3]<8),50,IF(AND(RC[-3]>RC[-1],RC[-3]>=8,RC[-3]<9),40,IF(AND(RC[-3]>RC[-1],RC[-3]>=9,RC[-3]<10),30,IF(AND(RC[-3]>RC[-1],RC[-3]>=10,RC[-3]<11),20,IF(AND(RC[-3]>RC[-1],RC[-3]>=11,RC[-3]<12),10,IF(AND(RC[-3]>RC[-1],RC[-3]>=12),0))))))))))))))))))))))))))))))))) -> 90 | H571: =IF(RC[-3]="","",IF(RC[-3]<0.3,100,IF(AND(RC[-3]>=0.3,RC[-3]>0.4),95,IF(AND(RC[-3]>=0.4,RC[-3]<0.5),90,IF(AND(RC[-3]>=0.5,RC[-3]<0.6),85,IF(AND(RC[-3]>=0.6,RC[-3]<0.7),80,IF(AND(RC[-3]>=0.6,RC[-3]<1),80,IF(AND(RC[-3]>1,RC[-3]<2),50,IF(RC[-3]>2,0))))))))) ->  | I571: =IF(RC[-1]="",RC[-2],0.7*RC[-1]+0.3*RC[-2]) -> 90
A572: فولاد خوزستان | B572: فخوز | C572: =VLOOKUP(RC[-1],Sheet1!R3C2:R802C3,2,FALSE) -> فلزات اساسی | D572: =VLOOKUP(RC[-2],Sheet1!R3C2:R802C9,8,FALSE) -> 4.1276221604331944 | E572: =IF(VLOOKUP(RC[-3],Sheet1!R3C2:R803C11,10,FALSE)=0,"",VLOOKUP(Sheet2!RC[-3],Sheet1!R[1]C[-3]:R[801]C[6],10,FALSE)) ->  | F572: =Sheet1!R634C10 -> 7.4779348942651307 | G572: =IF(RC[-3]<0,0,IF(AND(RC[-3]<RC[-1],RC[-3]<2),100,IF(AND(RC[-3]<RC[-1],RC[-3]>=2,RC[-3]<3),95,IF(AND(RC[-3]<RC[-1],RC[-3]>=3,RC[-3]<4),90,IF(AND(RC[-3]<RC[-1],RC[-3]>=4,RC[-3]<5),85,IF(AND(RC[-3]<RC[-1],RC[-3]>=5,RC[-3]<6),80,IF(AND(RC[-3]<RC[-1],RC[-3]>=6,RC[-3]<7),75,IF(AND(RC[-3]<RC[-1],RC[-3]>=7,RC[-3]<8),70,IF(AND(RC[-3]<RC[-1],RC[-3]>=8,RC[-3]<9),65,IF(AND(RC[-3]<RC[-1],RC[-3]>=9,RC[-3]<10),60,IF(AND(RC[-3]<RC[-1],RC[-3]>=10,RC[-3]<11),55,IF(AND(RC[-3]<RC[-1],RC[-3]>=11,RC[-3]<12),50,IF(AND(RC[-3]<RC[-1],RC[-3]>=12,RC[-3]<13),45,IF(AND(RC[-3]<RC[-1],RC[-3]>=13,RC[-3]<14),40,IF(AND(RC[-3]<RC[-1],RC[-3]>=14,RC[-3]<15),35,IF(AND(RC[-3]<RC[-1],RC[-3]>=15,RC[-3]<16),30,IF(AND(RC[-3]<RC[-1],RC[-3]>=16,RC[-3]<17),25,IF(AND(RC[-3]<RC[-1],RC[-3]>=17,RC[-3]<18),20,IF(AND(RC[-3]<RC[-1],RC[-3]>=18,RC[-3]<19),15,IF(AND(RC[-3]<RC[-1],RC[-3]>=19,RC[-3]<20),10,IF(AND(RC[-3]<RC[-1],RC[-3]>=20,RC[-3]<21),5,IF(AND(RC[-3]<RC[-1],RC[-3]>=21),0,IF(AND(RC[-3]>RC[-1],RC[-3]>=2,RC[-3]<3),90,IF(AND(RC[-3]>RC[-1],RC[-3]>=3,RC[-3]<4),90,IF(AND(RC[-3]>RC[-1],RC[-3]>=4,RC[-3]<5),80,IF(AND(RC[-3]>RC[-1],RC[-3]>=5,RC[-3]<6),70,IF(AND(RC[-3]>RC[-1],RC[-3]>=6,RC[-3]<7),60,IF(AND(RC[-3]>RC[-1],RC[-3]>=7,RC[-3]<8),50,IF(AND(RC[-3]>RC[-1],RC[-3]>=8,RC[-3]<9),40,IF(AND(RC[-3]>RC[-1],RC[-3]>=9,RC[-3]<10),30,IF(AND(RC[-3]>RC[-1],RC[-3]>=10,RC[-3]<11),20,IF(AND(RC[-3]>RC[-1],RC[-3]>=11,RC[-3]<12),10,IF(AND(RC[-3]>RC[-1],RC[-3]>=12),0))))))))))))))))))))))))))))))))) -> 85 | H572: =IF(RC[-3]="","",IF(RC[-3]<0.3,100,IF(AND(RC[-3]>=0.3,RC[-3]>0.4),95,IF(AND(RC[-3]>=0.4,RC[-3]<0.5),90,IF(AND(RC[-3]>=0.5,RC[-3]<0.6),85,IF(AND(RC[-3]>=0.6,RC[-3]<0.7),80,IF(AND(RC[-3]>=0.6,RC[-3]<1),80,IF(AND(RC[-3]>1,RC[-3]<2),50,IF(RC[-3]>2,0))))))))) ->  | I572: =IF(RC[-1]="",RC[-2],0.7*RC[-1]+0.3*RC[-2]) -> 85
A573: فولاد سپید فراب کویر | B573: کویر | C573: =VLOOKUP(RC[-1],Sheet1!R3C2:R802C3,2,FALSE) -> فلزات اساسی | D573: =VLOOKUP(RC[-2],Sheet1!R3C2:R802C9,8,FALSE) -> 4.9900598949802157 | E573: =IF(VLOOKUP(RC[-3],Sheet1!R3C2:R803C11,10,FALSE)=0,"",VLOOKUP(Sheet2!RC[-3],Sheet1!R[1]C[-3]:R[801]C[6],10,FALSE)) ->  | F573: =Sheet1!R634C10 -> 7.4779348942651307 | G573: =IF(RC[-3]<0,0,IF(AND(RC[-3]<RC[-1],RC[-3]<2),100,IF(AND(RC[-3]<RC[-1],RC[-3]>=2,RC[-3]<3),95,IF(AND(RC[-3]<RC[-1],RC[-3]>=3,RC[-3]<4),90,IF(AND(RC[-3]<RC[-1],RC[-3]>=4,RC[-3]<5),85,IF(AND(RC[-3]<RC[-1],RC[-3]>=5,RC[-3]<6),80,IF(AND(RC[-3]<RC[-1],RC[-3]>=6,RC[-3]<7),75,IF(AND(RC[-3]<RC[-1],RC[-3]>=7,RC[-3]<8),70,IF(AND(RC[-3]<RC[-1],RC[-3]>=8,RC[-3]<9),65,IF(AND(RC[-3]<RC[-1],RC[-3]>=9,RC[-3]<10),60,IF(AND(RC[-3]<RC[-1],RC[-3]>=10,RC[-3]<11),55,IF(AND(RC[-3]<RC[-1],RC[-3]>=11,RC[-3]<12),50,IF(AND(RC[-3]<RC[-1],RC[-3]>=12,RC[-3]<13),45,IF(AND(RC[-3]<RC[-1],RC[-3]>=13,RC[-3]<14),40,IF(AND(RC[-3]<RC[-1],RC[-3]>=14,RC[-3]<15),35,IF(AND(RC[-3]<RC[-1],RC[-3]>=15,RC[-3]<16),30,IF(AND(RC[-3]<RC[-1],RC[-3]>=16,RC[-3]<17),25,IF(AND(RC[-3]<RC[-1],RC[-3]>=17,RC[-3]<18),20,IF(AND(RC[-3]<RC[-1],RC[-3]>=18,RC[-3]<19),15,IF(AND(RC[-3]<RC[-1],RC[-3]>=19,RC[-3]<20),10,IF(AND(RC[-3]<RC[-1],RC[-3]>=20,RC[-3]<21),5,IF(AND(RC[-3]<RC[-1],RC[-3]>=21),0,IF(AND(RC[-3]>RC[-1],RC[-3]>=2,RC[-3]<3),90,IF(AND(RC[-3]>RC[-1],RC[-3]>=3,RC[-3]<4),90,IF(AND(RC[-3]>RC[-1],RC[-3]>=4,RC[-3]<5),80,IF(AND(RC[-3]>RC[-1],RC[-3]>=5,RC[-3]<6),70,IF(AND(RC[-3]>RC[-1],RC[-3]>=6,RC[-3]<7),60,IF(AND(RC[-3]>RC[-1],RC[-3]>=7,RC[-3]<8),50,IF(AND(RC[-3]>RC[-1],RC[-3]>=8,RC[-3]<9),40,IF(AND(RC[-3]>RC[-1],RC[-3]>=9,RC[-3]<10),30,IF(AND(RC[-3]>RC[-1],RC[-3]>=10,RC[-3]<11),20,IF(AND(RC[-3]>RC[-1],RC[-3]>=11,RC[-3]<12),10,IF(AND(RC[-3]>RC[-1],RC[-3]>=12),0))))))))))))))))))))))))))))))))) -> 85 | H573: =IF(RC[-3]="","",IF(RC[-3]<0.3,100,IF(AND(RC[-3]>=0.3,RC[-3]>0.4),95,IF(AND(RC[-3]>=0.4,RC[-3]<0.5),90,IF(AND(RC[-3]>=0.5,RC[-3]<0.6),85,IF(AND(RC[-3]>=0.6,RC[-3]<0.7),80,IF(AND(RC[-3]>=0.6,RC[-3]<1),80,IF(AND(RC[-3]>1,RC[-3]<2),50,IF(RC[-3]>2,0))))))))) ->  | I573: =IF(RC[-1]="",RC[-2],0.7*RC[-1]+0.3*RC[-2]) -> 85
A574: فولاد شاهرود | B574: فرود | C574: =VLOOKUP(RC[-1],Sheet1!R3C2:R802C3,2,FALSE) -> فلزات اساسی | D574: =VLOOKUP(RC[-2],Sheet1!R3C2:R802C9,8,FALSE) -> 7.8862918239578335 | E574: =IF(VLOOKUP(RC[-3],Sheet1!R3C2:R803C11,10,FALSE)=0,"",VLOOKUP(Sheet2!RC[-3],Sheet1!R[1]C[-3]:R[801]C[6],10,FALSE)) ->  | F574: =Sheet1!R634C10 -> 7.4779348942651307 | G574: =IF(RC[-3]<0,0,IF(AND(RC[-3]<RC[-1],RC[-3]<2),100,IF(AND(RC[-3]<RC[-1],RC[-3]>=2,RC[-3]<3),95,IF(AND(RC[-3]<RC[-1],RC[-3]>=3,RC[-3]<4),90,IF(AND(RC[-3]<RC[-1],RC[-3]>=4,RC[-3]<5),85,IF(AND(RC[-3]<RC[-1],RC[-3]>=5,RC[-3]<6),80,IF(AND(RC[-3]<RC[-1],RC[-3]>=6,RC[-3]<7),75,IF(AND(RC[-3]<RC[-1],RC[-3]>=7,RC[-3]<8),70,IF(AND(RC[-3]<RC[-1],RC[-3]>=8,RC[-3]<9),65,IF(AND(RC[-3]<RC[-1],RC[-3]>=9,RC[-3]<10),60,IF(AND(RC[-3]<RC[-1],RC[-3]>=10,RC[-3]<11),55,IF(AND(RC[-3]<RC[-1],RC[-3]>=11,RC[-3]<12),50,IF(AND(RC[-3]<RC[-1],RC[-3]>=12,RC[-3]<13),45,IF(AND(RC[-3]<RC[-1],RC[-3]>=13,RC[-3]<14),40,IF(AND(RC[-3]<RC[-1],RC[-3]>=14,RC[-3]<15),35,IF(AND(RC[-3]<RC[-1],RC[-3]>=15,RC[-3]<16),30,IF(AND(RC[-3]<RC[-1],RC[-3]>=16,RC[-3]<17),25,IF(AND(RC[-3]<RC[-1],RC[-3]>=17,RC[-3]<18),20,IF(AND(RC[-3]<RC[-1],RC[-3]>=18,RC[-3]<19),15,IF(AND(RC[-3]<RC[-1],RC[-3]>=19,RC[-3]<20),10,IF(AND(RC[-3]<RC[-1],RC[-3]>=20,RC[-3]<21),5,IF(AND(RC[-3]<RC[-1],RC[-3]>=21),0,IF(AND(RC[-3]>RC[-1],RC[-3]>=2,RC[-3]<3),90,IF(AND(RC[-3]>RC[-1],RC[-3]>=3,RC[-3]<4),90,IF(AND(RC[-3]>RC[-1],RC[-3]>=4,RC[-3]<5),80,IF(AND(RC[-3]>RC[-1],RC[-3]>=5,RC[-3]<6),70,IF(AND(RC[-3]>RC[-1],RC[-3]>=6,RC[-3]<7),60,IF(AND(RC[-3]>RC[-1],RC[-3]>=7,RC[-3]<8),50,IF(AND(RC[-3]>RC[-1],RC[-3]>=8,RC[-3]<9),40,IF(AND(RC[-3]>RC[-1],RC[-3]>=9,RC[-3]<10),30,IF(AND(RC[-3]>RC[-1],RC[-3]>=10,RC[-3]<11),20,IF(AND(RC[-3]>RC[-1],RC[-3]>=11,RC[-3]<12),10,IF(AND(RC[-3]>RC[-1],RC[-3]>=12),0))))))))))))))))))))))))))))))))) -> 50 | H574: =IF(RC[-3]="","",IF(RC[-3]<0.3,100,IF(AND(RC[-3]>=0.3,RC[-3]>0.4),95,IF(AND(RC[-3]>=0.4,RC[-3]<0.5),90,IF(AND(RC[-3]>=0.5,RC[-3]<0.6),85,IF(AND(RC[-3]>=0.6,RC[-3]<0.7),80,IF(AND(RC[-3]>=0.6,RC[-3]<1),80,IF(AND(RC[-3]>1,RC[-3]<2),50,IF(RC[-3]>2,0))))))))) ->  | I574: =IF(RC[-1]="",RC[-2],0.7*RC[-1]+0.3*RC[-2]) -> 50
A575: فولاد مبارکه اصفهان | B575: فولاد | C575: =VLOOKUP(RC[-1],Sheet1!R3C2:R802C3,2,FALSE) -> فلزات اساسی | D575: =VLOOKUP(RC[-2],Sheet1!R3C2:R802C9,8,FALSE) -> 2.1 | E575: =IF(VLOOKUP(RC[-3],Sheet1!R3C2:R803C11,10,FALSE)=0,"",VLOOKUP(Sheet2!RC[-3],Sheet1!R[1]C[-3]:R[801]C[6],10,FALSE)) ->  | F575: =Sheet1!R634C10 -> 7.4779348942651307 | G575: =IF(RC[-3]<0,0,IF(AND(RC[-3]<RC[-1],RC[-3]<2),100,IF(AND(RC[-3]<RC[-1],RC[-3]>=2,RC[-3]<3),95,IF(AND(RC[-3]<RC[-1],RC[-3]>=3,RC[-3]<4),90,IF(AND(RC[-3]<RC[-1],RC[-3]>=4,RC[-3]<5),85,IF(AND(RC[-3]<RC[-1],RC[-3]>=5,RC[-3]<6),80,IF(AND(RC[-3]<RC[-1],RC[-3]>=6,RC[-3]<7),75,IF(AND(RC[-3]<RC[-1],RC[-3]>=7,RC[-3]<8),70,IF(AND(RC[-3]<RC[-1],RC[-3]>=8,RC[-3]<9),65,IF(AND(RC[-3]<RC[-1],RC[-3]>=9,RC[-3]<10),60,IF(AND(RC[-3]<RC[-1],RC[-3]>=10,RC[-3]<11),55,IF(AND(RC[-3]<RC[-1],RC[-3]>=11,RC[-3]<12),50,IF(AND(RC[-3]<RC[-1],RC[-3]>=12,RC[-3]<13),45,IF(AND(RC[-3]<RC[-1],RC[-3]>=13,RC[-3]<14),40,IF(AND(RC[-3]<RC[-1],RC[-3]>=14,RC[-3]<15),35,IF(AND(RC[-3]<RC[-1],RC[-3]>=15,RC[-3]<16),30,IF(AND(RC[-3]<RC[-1],RC[-3]>=16,RC[-3]<17),25,IF(AND(RC[-3]<RC[-1],RC[-3]>=17,RC[-3]<18),20,IF(AND(RC[-3]<RC[-1],RC[-3]>=18,RC[-3]<19),15,IF(AND(RC[-3]<RC[-1],RC[-3]>=19,RC[-3]<20),10,IF(AND(RC[-3]<RC[-1],RC[-3]>=20,RC[-3]<21),5,IF(AND(RC[-3]<RC[-1],RC[-3]>=21),0,IF(AND(RC[-3]>RC[-1],RC[-3]>=2,RC[-3]<3),90,IF(AND(RC[-3]>RC[-1],RC[-3]>=3,RC[-3]<4),90,IF(AND(RC[-3]>RC[-1],RC[-3]>=4,RC[-3]<5),80,IF(AND(RC[-3]>RC[-1],RC[-3]>=5,RC[-3]<6),70,IF(AND(RC[-3]>RC[-1],RC[-3]>=6,RC[-3]<7),60,IF(AND(RC[-3]>RC[-1],RC[-3]>=7,RC[-3]<8),50,IF(AND(RC[-3]>RC[-1],RC[-3]>=8,RC[-3]<9),40,IF(AND(RC[-3]>RC[-1],RC[-3]>=9,RC[-3]<10),30,IF(AND(RC[-3]>RC[-1],RC[-3]>=10,RC[-3]<11),20,IF(AND(RC[-3]>RC[-1],RC[-3]>=11,RC[-3]<12),10,IF(AND(RC[-3]>RC[-1],RC[-3]>=12),0))))))))))))))))))))))))))))))))) -> 95 | H575: =IF(RC[-3]="","",IF(RC[-3]<0.3,100,IF(AND(RC[-3]>=0.3,RC[-3]>0.4),95,IF(AND(RC[-3]>=0.4,RC[-3]<0.5),90,IF(AND(RC[-3]>=0.5,RC[-3]<0.6),85,IF(AND(RC[-3]>=0.6,RC[-3]<0.7),80,IF(AND(RC[-3]>=0.6,RC[-3]<1),80,IF(AND(RC[-3]>1,RC[-3]<2),50,IF(RC[-3]>2,0))))))))) ->  | I575: =IF(RC[-1]="",RC[-2],0.7*RC[-1]+0.3*RC[-2]) -> 95
A576: فولاد هرمزگان جنوب | B576: هرمز | C576: =VLOOKUP(RC[-1],Sheet1!R3C2:R802C3,2,FALSE) -> فلزات اساسی | D576: =VLOOKUP(RC[-2],Sheet1!R3C2:R802C9,8,FALSE) -> 3.7276142618572012 | E576: =IF(VLOOKUP(RC[-3],Sheet1!R3C2:R803C11,10,FALSE)=0,"",VLOOKUP(Sheet2!RC[-3],Sheet1!R[1]C[-3]:R[801]C[6],10,FALSE)) ->  | F576: =Sheet1!R634C10 -> 7.4779348942651307 | G576: =IF(RC[-3]<0,0,IF(AND(RC[-3]<RC[-1],RC[-3]<2),100,IF(AND(RC[-3]<RC[-1],RC[-3]>=2,RC[-3]<3),95,IF(AND(RC[-3]<RC[-1],RC[-3]>=3,RC[-3]<4),90,IF(AND(RC[-3]<RC[-1],RC[-3]>=4,RC[-3]<5),85,IF(AND(RC[-3]<RC[-1],RC[-3]>=5,RC[-3]<6),80,IF(AND(RC[-3]<RC[-1],RC[-3]>=6,RC[-3]<7),75,IF(AND(RC[-3]<RC[-1],RC[-3]>=7,RC[-3]<8),70,IF(AND(RC[-3]<RC[-1],RC[-3]>=8,RC[-3]<9),65,IF(AND(RC[-3]<RC[-1],RC[-3]>=9,RC[-3]<10),60,IF(AND(RC[-3]<RC[-1],RC[-3]>=10,RC[-3]<11),55,IF(AND(RC[-3]<RC[-1],RC[-3]>=11,RC[-3]<12),50,IF(AND(RC[-3]<RC[-1],RC[-3]>=12,RC[-3]<13),45,IF(AND(RC[-3]<RC[-1],RC[-3]>=13,RC[-3]<14),40,IF(AND(RC[-3]<RC[-1],RC[-3]>=14,RC[-3]<15),35,IF(AND(RC[-3]<RC[-1],RC[-3]>=15,RC[-3]<16),30,IF(AND(RC[-3]<RC[-1],RC[-3]>=16,RC[-3]<17),25,IF(AND(RC[-3]<RC[-1],RC[-3]>=17,RC[-3]<18),20,IF(AND(RC[-3]<RC[-1],RC[-3]>=18,RC[-3]<19),15,IF(AND(RC[-3]<RC[-1],RC[-3]>=19,RC[-3]<20),10,IF(AND(RC[-3]<RC[-1],RC[-3]>=20,RC[-3]<21),5,IF(AND(RC[-3]<RC[-1],RC[-3]>=21),0,IF(AND(RC[-3]>RC[-1],RC[-3]>=2,RC[-3]<3),90,IF(AND(RC[-3]>RC[-1],RC[-3]>=3,RC[-3]<4),90,IF(AND(RC[-3]>RC[-1],RC[-3]>=4,RC[-3]<5),80,IF(AND(RC[-3]>RC[-1],RC[-3]>=5,RC[-3]<6),70,IF(AND(RC[-3]>RC[-1],RC[-3]>=6,RC[-3]<7),60,IF(AND(RC[-3]>RC[-1],RC[-3]>=7,RC[-3]<8),50,IF(AND(RC[-3]>RC[-1],RC[-3]>=8,RC[-3]<9),40,IF(AND(RC[-3]>RC[-1],RC[-3]>=9,RC[-3]<10),30,IF(AND(RC[-3]>RC[-1],RC[-3]>=10,RC[-3]<11),20,IF(AND(RC[-3]>RC[-1],RC[-3]>=11,RC[-3]<12),10,IF(AND(RC[-3]>RC[-1],RC[-3]>=12),0))))))))))))))))))))))))))))))))) -> 90 | H576: =IF(RC[-3]="","",IF(RC[-3]<0.3,100,IF(AND(RC[-3]>=0.3,RC[-3]>0.4),95,IF(AND(RC[-3]>=0.4,RC[-3]<0.5),90,IF(AND(RC[-3]>=0.5,RC[-3]<0.6),85,IF(AND(RC[-3]>=0.6,RC[-3]<0.7),80,IF(AND(RC[-3]>=0.6,RC[-3]<1),80,IF(AND(RC[-3]>1,RC[-3]<2),50,IF(RC[-3]>2,0))))))))) ->  | I576: =IF(RC[-1]="",RC[-2],0.7*RC[-1]+0.3*RC[-2]) -> 90
A577: فولاد کاوه جنوب کیش | B577: کاوه | C577: =VLOOKUP(RC[-1],Sheet1!R3C2:R802C3,2,FALSE) -> فلزات اساسی | D577: =VLOOKUP(RC[-2],Sheet1!R3C2:R802C9,8,FALSE) -> 6.6 | E577: =IF(VLOOKUP(RC[-3],Sheet1!R3C2:R803C11,10,FALSE)=0,"",VLOOKUP(Sheet2!RC[-3],Sheet1!R[1]C[-3]:R[801]C[6],10,FALSE)) ->  | F577: =Sheet1!R634C10 -> 7.4779348942651307 | G577: =IF(RC[-3]<0,0,IF(AND(RC[-3]<RC[-1],RC[-3]<2),100,IF(AND(RC[-3]<RC[-1],RC[-3]>=2,RC[-3]<3),95,IF(AND(RC[-3]<RC[-1],RC[-3]>=3,RC[-3]<4),90,IF(AND(RC[-3]<RC[-1],RC[-3]>=4,RC[-3]<5),85,IF(AND(RC[-3]<RC[-1],RC[-3]>=5,RC[-3]<6),80,IF(AND(RC[-3]<RC[-1],RC[-3]>=6,RC[-3]<7),75,IF(AND(RC[-3]<RC[-1],RC[-3]>=7,RC[-3]<8),70,IF(AND(RC[-3]<RC[-1],RC[-3]>=8,RC[-3]<9),65,IF(AND(RC[-3]<RC[-1],RC[-3]>=9,RC[-3]<10),60,IF(AND(RC[-3]<RC[-1],RC[-3]>=10,RC[-3]<11),55,IF(AND(RC[-3]<RC[-1],RC[-3]>=11,RC[-3]<12),50,IF(AND(RC[-3]<RC[-1],RC[-3]>=12,RC[-3]<13),45,IF(AND(RC[-3]<RC[-1],RC[-3]>=13,RC[-3]<14),40,IF(AND(RC[-3]<RC[-1],RC[-3]>=14,RC[-3]<15),35,IF(AND(RC[-3]<RC[-1],RC[-3]>=15,RC[-3]<16),30,IF(AND(RC[-3]<RC[-1],RC[-3]>=16,RC[-3]<17),25,IF(AND(RC[-3]<RC[-1],RC[-3]>=17,RC[-3]<18),20,IF(AND(RC[-3]<RC[-1],RC[-3]>=18,RC[-3]<19),15,IF(AND(RC[-3]<RC[-1],RC[-3]>=19,RC[-3]<20),10,IF(AND(RC[-3]<RC[-1],RC[-3]>=20,RC[-3]<21),5,IF(AND(RC[-3]<RC[-1],RC[-3]>=21),0,IF(AND(RC[-3]>RC[-1],RC[-3]>=2,RC[-3]<3),90,IF(AND(RC[-3]>RC[-1],RC[-3]>=3,RC[-3]<4),90,IF(AND(RC[-3]>RC[-1],RC[-3]>=4,RC[-3]<5),80,IF(AND(RC[-3]>RC[-1],RC[-3]>=5,RC[-3]<6),70,IF(AND(RC[-3]>RC[-1],RC[-3]>=6,RC[-3]<7),60,IF(AND(RC[-3]>RC[-1],RC[-3]>=7,RC[-3]<8),50,IF(AND(RC[-3]>RC[-1],RC[-3]>=8,RC[-3]<9),40,IF(AND(RC[-3]>RC[-1],RC[-3]>=9,RC[-3]<10),30,IF(AND(RC[-3]>RC[-1],RC[-3]>=10,RC[-3]<11),20,IF(AND(RC[-3]>RC[-1],RC[-3]>=11,RC[-3]<12),10,IF(AND(RC[-3]>RC[-1],RC[-3]>=12),0))))))))))))))))))))))))))))))))) -> 75 | H577: =IF(RC[-3]="","",IF(RC[-3]<0.3,100,IF(AND(RC[-3]>=0.3,RC[-3]>0.4),95,IF(AND(RC[-3]>=0.4,RC[-3]<0.5),90,IF(AND(RC[-3]>=0.5,RC[-3]<0.6),85,IF(AND(RC[-3]>=0.6,RC[-3]<0.7),80,IF(AND(RC[-3]>=0.6,RC[-3]<1),80,IF(AND(RC[-3]>1,RC[-3]<2),50,IF(RC[-3]>2,0))))))))) ->  | I577: =IF(RC[-1]="",RC[-2],0.7*RC[-1]+0.3*RC[-2]) -> 75
A578: فولاد کاویان | B578: فوکا | C578: =VLOOKUP(RC[-1],Sheet1!R3C2:R802C3,2,FALSE) -> فلزات اساسی | D578: =VLOOKUP(RC[-2],Sheet1!R3C2:R802C9,8,FALSE) -> 8.1043864527746017 | E578: =IF(VLOOKUP(RC[-3],Sheet1!R3C2:R803C11,10,FALSE)=0,"",VLOOKUP(Sheet2!RC[-3],Sheet1!R[1]C[-3]:R[801]C[6],10,FALSE)) ->  | F578: =Sheet1!R634C10 -> 7.4779348942651307 | G578: =IF(RC[-3]<0,0,IF(AND(RC[-3]<RC[-1],RC[-3]<2),100,IF(AND(RC[-3]<RC[-1],RC[-3]>=2,RC[-3]<3),95,IF(AND(RC[-3]<RC[-1],RC[-3]>=3,RC[-3]<4),90,IF(AND(RC[-3]<RC[-1],RC[-3]>=4,RC[-3]<5),85,IF(AND(RC[-3]<RC[-1],RC[-3]>=5,RC[-3]<6),80,IF(AND(RC[-3]<RC[-1],RC[-3]>=6,RC[-3]<7),75,IF(AND(RC[-3]<RC[-1],RC[-3]>=7,RC[-3]<8),70,IF(AND(RC[-3]<RC[-1],RC[-3]>=8,RC[-3]<9),65,IF(AND(RC[-3]<RC[-1],RC[-3]>=9,RC[-3]<10),60,IF(AND(RC[-3]<RC[-1],RC[-3]>=10,RC[-3]<11),55,IF(AND(RC[-3]<RC[-1],RC[-3]>=11,RC[-3]<12),50,IF(AND(RC[-3]<RC[-1],RC[-3]>=12,RC[-3]<13),45,IF(AND(RC[-3]<RC[-1],RC[-3]>=13,RC[-3]<14),40,IF(AND(RC[-3]<RC[-1],RC[-3]>=14,RC[-3]<15),35,IF(AND(RC[-3]<RC[-1],RC[-3]>=15,RC[-3]<16),30,IF(AND(RC[-3]<RC[-1],RC[-3]>=16,RC[-3]<17),25,IF(AND(RC[-3]<RC[-1],RC[-3]>=17,RC[-3]<18),20,IF(AND(RC[-3]<RC[-1],RC[-3]>=18,RC[-3]<19),15,IF(AND(RC[-3]<RC[-1],RC[-3]>=19,RC[-3]<20),10,IF(AND(RC[-3]<RC[-1],RC[-3]>=20,RC[-3]<21),5,IF(AND(RC[-3]<RC[-1],RC[-3]>=21),0,IF(AND(RC[-3]>RC[-1],RC[-3]>=2,RC[-3]<3),90,IF(AND(RC[-3]>RC[-1],RC[-3]>=3,RC[-3]<4),90,IF(AND(RC[-3]>RC[-1],RC[-3]>=4,RC[-3]<5),80,IF(AND(RC[-3]>RC[-1],RC[-3]>=5,RC[-3]<6),70,IF(AND(RC[-3]>RC[-1],RC[-3]>=6,RC[-3]<7),60,IF(AND(RC[-3]>RC[-1],RC[-3]>=7,RC[-3]<8),50,IF(AND(RC[-3]>RC[-1],RC[-3]>=8,RC[-3]<9),40,IF(AND(RC[-3]>RC[-1],RC[-3]>=9,RC[-3]<10),30,IF(AND(RC[-3]>RC[-1],RC[-3]>=10,RC[-3]<11),20,IF(AND(RC[-3]>RC[-1],RC[-3]>=11,RC[-3]<12),10,IF(AND(RC[-3]>RC[-1],RC[-3]>=12),0))))))))))))))))))))))))))))))))) -> 40 | H578: =IF(RC[-3]="","",IF(RC[-3]<0.3,100,IF(AND(RC[-3]>=0.3,RC[-3]>0.4),95,IF(AND(RC[-3]>=0.4,RC[-3]<0.5),90,IF(AND(RC[-3]>=0.5,RC[-3]<0.6),85,IF(AND(RC[-3]>=0.6,RC[-3]<0.7),80,IF(AND(RC[-3]>=0.6,RC[-3]<1),80,IF(AND(RC[-3]>1,RC[-3]<2),50,IF(RC[-3]>2,0))))))))) ->  | I578: =IF(RC[-1]="",RC[-2],0.7*RC[-1]+0.3*RC[-2]) -> 40
A579: فولادخراسان | B579: فخاس | C579: =VLOOKUP(RC[-1],Sheet1!R3C2:R802C3,2,FALSE) -> فلزات اساسی | D579: =VLOOKUP(RC[-2],Sheet1!R3C2:R802C9,8,FALSE) -> 4.5519595012434886 | E579: =IF(VLOOKUP(RC[-3],Sheet1!R3C2:R803C11,10,FALSE)=0,"",VLOOKUP(Sheet2!RC[-3],Sheet1!R[1]C[-3]:R[801]C[6],10,FALSE)) ->  | F579: =Sheet1!R634C10 -> 7.4779348942651307 | G579: =IF(RC[-3]<0,0,IF(AND(RC[-3]<RC[-1],RC[-3]<2),100,IF(AND(RC[-3]<RC[-1],RC[-3]>=2,RC[-3]<3),95,IF(AND(RC[-3]<RC[-1],RC[-3]>=3,RC[-3]<4),90,IF(AND(RC[-3]<RC[-1],RC[-3]>=4,RC[-3]<5),85,IF(AND(RC[-3]<RC[-1],RC[-3]>=5,RC[-3]<6),80,IF(AND(RC[-3]<RC[-1],RC[-3]>=6,RC[-3]<7),75,IF(AND(RC[-3]<RC[-1],RC[-3]>=7,RC[-3]<8),70,IF(AND(RC[-3]<RC[-1],RC[-3]>=8,RC[-3]<9),65,IF(AND(RC[-3]<RC[-1],RC[-3]>=9,RC[-3]<10),60,IF(AND(RC[-3]<RC[-1],RC[-3]>=10,RC[-3]<11),55,IF(AND(RC[-3]<RC[-1],RC[-3]>=11,RC[-3]<12),50,IF(AND(RC[-3]<RC[-1],RC[-3]>=12,RC[-3]<13),45,IF(AND(RC[-3]<RC[-1],RC[-3]>=13,RC[-3]<14),40,IF(AND(RC[-3]<RC[-1],RC[-3]>=14,RC[-3]<15),35,IF(AND(RC[-3]<RC[-1],RC[-3]>=15,RC[-3]<16),30,IF(AND(RC[-3]<RC[-1],RC[-3]>=16,RC[-3]<17),25,IF(AND(RC[-3]<RC[-1],RC[-3]>=17,RC[-3]<18),20,IF(AND(RC[-3]<RC[-1],RC[-3]>=18,RC[-3]<19),15,IF(AND(RC[-3]<RC[-1],RC[-3]>=19,RC[-3]<20),10,IF(AND(RC[-3]<RC[-1],RC[-3]>=20,RC[-3]<21),5,IF(AND(RC[-3]<RC[-1],RC[-3]>=21),0,IF(AND(RC[-3]>RC[-1],RC[-3]>=2,RC[-3]<3),90,IF(AND(RC[-3]>RC[-1],RC[-3]>=3,RC[-3]<4),90,IF(AND(RC[-3]>RC[-1],RC[-3]>=4,RC[-3]<5),80,IF(AND(RC[-3]>RC[-1],RC[-3]>=5,RC[-3]<6),70,IF(AND(RC[-3]>RC[-1],RC[-3]>=6,RC[-3]<7),60,IF(AND(RC[-3]>RC[-1],RC[-3]>=7,RC[-3]<8),50,IF(AND(RC[-3]>RC[-1],RC[-3]>=8,RC[-3]<9),40,IF(AND(RC[-3]>RC[-1],RC[-3]>=9,RC[-3]<10),30,IF(AND(RC[-3]>RC[-1],RC[-3]>=10,RC[-3]<11),20,IF(AND(RC[-3]>RC[-1],RC[-3]>=11,RC[-3]<12),10,IF(AND(RC[-3]>RC[-1],RC[-3]>=12),0))))))))))))))))))))))))))))))))) -> 85 | H579: =IF(RC[-3]="","",IF(RC[-3]<0.3,100,IF(AND(RC[-3]>=0.3,RC[-3]>0.4),95,IF(AND(RC[-3]>=0.4,RC[-3]<0.5),90,IF(AND(RC[-3]>=0.5,RC[-3]<0.6),85,IF(AND(RC[-3]>=0.6,RC[-3]<0.7),80,IF(AND(RC[-3]>=0.6,RC[-3]<1),80,IF(AND(RC[-3]>1,RC[-3]<2),50,IF(RC[-3]>2,0))))))))) ->  | I579: =IF(RC[-1]="",RC[-2],0.7*RC[-1]+0.3*RC[-2]) -> 85
A580: گروه صنعتی سدید | B580: وسدید | C580: =VLOOKUP(RC[-1],Sheet1!R3C2:R802C3,2,FALSE) -> فلزات اساسی | D580: =VLOOKUP(RC[-2],Sheet1!R3C2:R802C9,8,FALSE) -> 274.78405280078005 | E580: =IF(VLOOKUP(RC[-3],Sheet1!R3C2:R803C11,10,FALSE)=0,"",VLOOKUP(Sheet2!RC[-3],Sheet1!R[1]C[-3]:R[801]C[6],10,FALSE)) -> 1.5 | F580: =Sheet1!R634C10 -> 7.4779348942651307 | G580: =IF(RC[-3]<0,0,IF(AND(RC[-3]<RC[-1],RC[-3]<2),100,IF(AND(RC[-3]<RC[-1],RC[-3]>=2,RC[-3]<3),95,IF(AND(RC[-3]<RC[-1],RC[-3]>=3,RC[-3]<4),90,IF(AND(RC[-3]<RC[-1],RC[-3]>=4,RC[-3]<5),85,IF(AND(RC[-3]<RC[-1],RC[-3]>=5,RC[-3]<6),80,IF(AND(RC[-3]<RC[-1],RC[-3]>=6,RC[-3]<7),75,IF(AND(RC[-3]<RC[-1],RC[-3]>=7,RC[-3]<8),70,IF(AND(RC[-3]<RC[-1],RC[-3]>=8,RC[-3]<9),65,IF(AND(RC[-3]<RC[-1],RC[-3]>=9,RC[-3]<10),60,IF(AND(RC[-3]<RC[-1],RC[-3]>=10,RC[-3]<11),55,IF(AND(RC[-3]<RC[-1],RC[-3]>=11,RC[-3]<12),50,IF(AND(RC[-3]<RC[-1],RC[-3]>=12,RC[-3]<13),45,IF(AND(RC[-3]<RC[-1],RC[-3]>=13,RC[-3]<14),40,IF(AND(RC[-3]<RC[-1],RC[-3]>=14,RC[-3]<15),35,IF(AND(RC[-3]<RC[-1],RC[-3]>=15,RC[-3]<16),30,IF(AND(RC[-3]<RC[-1],RC[-3]>=16,RC[-3]<17),25,IF(AND(RC[-3]<RC[-1],RC[-3]>=17,RC[-3]<18),20,IF(AND(RC[-3]<RC[-1],RC[-3]>=18,RC[-3]<19),15,IF(AND(RC[-3]<RC[-1],RC[-3]>=19,RC[-3]<20),10,IF(AND(RC[-3]<RC[-1],RC[-3]>=20,RC[-3]<21),5,IF(AND(RC[-3]<RC[-1],RC[-3]>=21),0,IF(AND(RC[-3]>RC[-1],RC[-3]>=2,RC[-3]<3),90,IF(AND(RC[-3]>RC[-1],RC[-3]>=3,RC[-3]<4),90,IF(AND(RC[-3]>RC[-1],RC[-3]>=4,RC[-3]<5),80,IF(AND(RC[-3]>RC[-1],RC[-3]>=5,RC[-3]<6),70,IF(AND(RC[-3]>RC[-1],RC[-3]>=6,RC[-3]<7),60,IF(AND(RC[-3]>RC[-1],RC[-3]>=7,RC[-3]<8),50,IF(AND(RC[-3]>RC[-1],RC[-3]>=8,RC[-3]<9),40,IF(AND(RC[-3]>RC[-1],RC[-3]>=9,RC[-3]<10),30,IF(AND(RC[-3]>RC[-1],RC[-3]>=10,RC[-3]<11),20,IF(AND(RC[-3]>RC[-1],RC[-3]>=11,RC[-3]<12),10,IF(AND(RC[-3]>RC[-1],RC[-3]>=12),0))))))))))))))))))))))))))))))))) -> 0 | H580: =IF(RC[-3]="","",IF(RC[-3]<0.3,100,IF(AND(RC[-3]>=0.3,RC[-3]>0.4),95,IF(AND(RC[-3]>=0.4,RC[-3]<0.5),90,IF(AND(RC[-3]>=0.5,RC[-3]<0.6),85,IF(AND(RC[-3]>=0.6,RC[-3]<0.7),80,IF(AND(RC[-3]>=0.6,RC[-3]<1),80,IF(AND(RC[-3]>1,RC[-3]<2),50,IF(RC[-3]>2,0))))))))) -> 95 | I580: =IF(RC[-1]="",RC[-2],0.7*RC[-1]+0.3*RC[-2]) -> 66.5
A581: گسترش صنایع روی ایرانیان | B581: فگستر | C581: =VLOOKUP(RC[-1],Sheet1!R3C2:R802C3,2,FALSE) -> فلزات اساسی | D581: =VLOOKUP(RC[-2],Sheet1!R3C2:R802C9,8,FALSE) -> 5.5722847479852682 | E581: =IF(VLOOKUP(RC[-3],Sheet1!R3C2:R803C11,10,FALSE)=0,"",VLOOKUP(Sheet2!RC[-3],Sheet1!R[1]C[-3]:R[801]C[6],10,FALSE)) ->  | F581: =Sheet1!R634C10 -> 7.4779348942651307 | G581: =IF(RC[-3]<0,0,IF(AND(RC[-3]<RC[-1],RC[-3]<2),100,IF(AND(RC[-3]<RC[-1],RC[-3]>=2,RC[-3]<3),95,IF(AND(RC[-3]<RC[-1],RC[-3]>=3,RC[-3]<4),90,IF(AND(RC[-3]<RC[-1],RC[-3]>=4,RC[-3]<5),85,IF(AND(RC[-3]<RC[-1],RC[-3]>=5,RC[-3]<6),80,IF(AND(RC[-3]<RC[-1],RC[-3]>=6,RC[-3]<7),75,IF(AND(RC[-3]<RC[-1],RC[-3]>=7,RC[-3]<8),70,IF(AND(RC[-3]<RC[-1],RC[-3]>=8,RC[-3]<9),65,IF(AND(RC[-3]<RC[-1],RC[-3]>=9,RC[-3]<10),60,IF(AND(RC[-3]<RC[-1],RC[-3]>=10,RC[-3]<11),55,IF(AND(RC[-3]<RC[-1],RC[-3]>=11,RC[-3]<12),50,IF(AND(RC[-3]<RC[-1],RC[-3]>=12,RC[-3]<13),45,IF(AND(RC[-3]<RC[-1],RC[-3]>=13,RC[-3]<14),40,IF(AND(RC[-3]<RC[-1],RC[-3]>=14,RC[-3]<15),35,IF(AND(RC[-3]<RC[-1],RC[-3]>=15,RC[-3]<16),30,IF(AND(RC[-3]<RC[-1],RC[-3]>=16,RC[-3]<17),25,IF(AND(RC[-3]<RC[-1],RC[-3]>=17,RC[-3]<18),20,IF(AND(RC[-3]<RC[-1],RC[-3]>=18,RC[-3]<19),15,IF(AND(RC[-3]<RC[-1],RC[-3]>=19,RC[-3]<20),10,IF(AND(RC[-3]<RC[-1],RC[-3]>=20,RC[-3]<21),5,IF(AND(RC[-3]<RC[-1],RC[-3]>=21),0,IF(AND(RC[-3]>RC[-1],RC[-3]>=2,RC[-3]<3),90,IF(AND(RC[-3]>RC[-1],RC[-3]>=3,RC[-3]<4),90,IF(AND(RC[-3]>RC[-1],RC[-3]>=4,RC[-3]<5),80,IF(AND(RC[-3]>RC[-1],RC[-3]>=5,RC[-3]<6),70,IF(AND(RC[-3]>RC[-1],RC[-3]>=6,RC[-3]<7),60,IF(AND(RC[-3]>RC[-1],RC[-3]>=7,RC[-3]<8),50,IF(AND(RC[-3]>RC[-1],RC[-3]>=8,RC[-3]<9),40,IF(AND(RC[-3]>RC[-1],RC[-3]>=9,RC[-3]<10),30,IF(AND(RC[-3]>RC[-1],RC[-3]>=10,RC[-3]<11),20,IF(AND(RC[-3]>RC[-1],RC[-3]>=11,RC[-3]<12),10,IF(AND(RC[-3]>RC[-1],RC[-3]>=12),0))))))))))))))))))))))))))))))))) -> 80 | H581: =IF(RC[-3]="","",IF(RC[-3]<0.3,100,IF(AND(RC[-3]>=0.3,RC[-3]>0.4),95,IF(AND(RC[-3]>=0.4,RC[-3]<0.5),90,IF(AND(RC[-3]>=0.5,RC[-3]<0.6),85,IF(AND(RC[-3]>=0.6,RC[-3]<0.7),80,IF(AND(RC[-3]>=0.6,RC[-3]<1),80,IF(AND(RC[-3]>1,RC[-3]<2),50,IF(RC[-3]>2,0))))))))) ->  | I581: =IF(RC[-1]="",RC[-2],0.7*RC[-1]+0.3*RC[-2]) -> 80
A582: لوله و ماشین سازی | B582: فلوله | C582: =VLOOKUP(RC[-1],Sheet1!R3C2:R802C3,2,FALSE) -> فلزات اساسی | D582: =VLOOKUP(RC[-2],Sheet1!R3C2:R802C9,8,FALSE) -> 137.5694957467675 | E582: =IF(VLOOKUP(RC[-3],Sheet1!R3C2:R803C11,10,FALSE)=0,"",VLOOKUP(Sheet2!RC[-3],Sheet1!R[1]C[-3]:R[801]C[6],10,FALSE)) ->  | F582: =Sheet1!R634C10 -> 7.4779348942651307 | G582: =IF(RC[-3]<0,0,IF(AND(RC[-3]<RC[-1],RC[-3]<2),100,IF(AND(RC[-3]<RC[-1],RC[-3]>=2,RC[-3]<3),95,IF(AND(RC[-3]<RC[-1],RC[-3]>=3,RC[-3]<4),90,IF(AND(RC[-3]<RC[-1],RC[-3]>=4,RC[-3]<5),85,IF(AND(RC[-3]<RC[-1],RC[-3]>=5,RC[-3]<6),80,IF(AND(RC[-3]<RC[-1],RC[-3]>=6,RC[-3]<7),75,IF(AND(RC[-3]<RC[-1],RC[-3]>=7,RC[-3]<8),70,IF(AND(RC[-3]<RC[-1],RC[-3]>=8,RC[-3]<9),65,IF(AND(RC[-3]<RC[-1],RC[-3]>=9,RC[-3]<10),60,IF(AND(RC[-3]<RC[-1],RC[-3]>=10,RC[-3]<11),55,IF(AND(RC[-3]<RC[-1],RC[-3]>=11,RC[-3]<12),50,IF(AND(RC[-3]<RC[-1],RC[-3]>=12,RC[-3]<13),45,IF(AND(RC[-3]<RC[-1],RC[-3]>=13,RC[-3]<14),40,IF(AND(RC[-3]<RC[-1],RC[-3]>=14,RC[-3]<15),35,IF(AND(RC[-3]<RC[-1],RC[-3]>=15,RC[-3]<16),30,IF(AND(RC[-3]<RC[-1],RC[-3]>=16,RC[-3]<17),25,IF(AND(RC[-3]<RC[-1],RC[-3]>=17,RC[-3]<18),20,IF(AND(RC[-3]<RC[-1],RC[-3]>=18,RC[-3]<19),15,IF(AND(RC[-3]<RC[-1],RC[-3]>=19,RC[-3]<20),10,IF(AND(RC[-3]<RC[-1],RC[-3]>=20,RC[-3]<21),5,IF(AND(RC[-3]<RC[-1],RC[-3]>=21),0,IF(AND(RC[-3]>RC[-1],RC[-3]>=2,RC[-3]<3),90,IF(AND(RC[-3]>RC[-1],RC[-3]>=3,RC[-3]<4),90,IF(AND(RC[-3]>RC[-1],RC[-3]>=4,RC[-3]<5),80,IF(AND(RC[-3]>RC[-1],RC[-3]>=5,RC[-3]<6),70,IF(AND(RC[-3]>RC[-1],RC[-3]>=6,RC[-3]<7),60,IF(AND(RC[-3]>RC[-1],RC[-3]>=7,RC[-3]<8),50,IF(AND(RC[-3]>RC[-1],RC[-3]>=8,RC[-3]<9),40,IF(AND(RC[-3]>RC[-1],RC[-3]>=9,RC[-3]<10),30,IF(AND(RC[-3]>RC[-1],RC[-3]>=10,RC[-3]<11),20,IF(AND(RC[-3]>RC[-1],RC[-3]>=11,RC[-3]<12),10,IF(AND(RC[-3]>RC[-1],RC[-3]>=12),0))))))))))))))))))))))))))))))))) -> 0 | H582: =IF(RC[-3]="","",IF(RC[-3]<0.3,100,IF(AND(RC[-3]>=0.3,RC[-3]>0.4),95,IF(AND(RC[-3]>=0.4,RC[-3]<0.5),90,IF(AND(RC[-3]>=0.5,RC[-3]<0.6),85,IF(AND(RC[-3]>=0.6,RC[-3]<0.7),80,IF(AND(RC[-3]>=0.6,RC[-3]<1),80,IF(AND(RC[-3]>1,RC[-3]<2),50,IF(RC[-3]>2,0))))))))) ->  | I582: =IF(RC[-1]="",RC[-2],0.7*RC[-1]+0.3*RC[-2]) -> 0
A583: ماداکتو استیل کرد | B583: فماک | C583: =VLOOKUP(RC[-1],Sheet1!R3C2:R802C3,2,FALSE) -> فلزات اساسی | D583: =VLOOKUP(RC[-2],Sheet1!R3C2:R802C9,8,FALSE) -> 10.333482944344704 | E583: =IF(VLOOKUP(RC[-3],Sheet1!R3C2:R803C11,10,FALSE)=0,"",VLOOKUP(Sheet2!RC[-3],Sheet1!R[1]C[-3]:R[801]C[6],10,FALSE)) ->  | F583: =Sheet1!R634C10 -> 7.4779348942651307 | G583: =IF(RC[-3]<0,0,IF(AND(RC[-3]<RC[-1],RC[-3]<2),100,IF(AND(RC[-3]<RC[-1],RC[-3]>=2,RC[-3]<3),95,IF(AND(RC[-3]<RC[-1],RC[-3]>=3,RC[-3]<4),90,IF(AND(RC[-3]<RC[-1],RC[-3]>=4,RC[-3]<5),85,IF(AND(RC[-3]<RC[-1],RC[-3]>=5,RC[-3]<6),80,IF(AND(RC[-3]<RC[-1],RC[-3]>=6,RC[-3]<7),75,IF(AND(RC[-3]<RC[-1],RC[-3]>=7,RC[-3]<8),70,IF(AND(RC[-3]<RC[-1],RC[-3]>=8,RC[-3]<9),65,IF(AND(RC[-3]<RC[-1],RC[-3]>=9,RC[-3]<10),60,IF(AND(RC[-3]<RC[-1],RC[-3]>=10,RC[-3]<11),55,IF(AND(RC[-3]<RC[-1],RC[-3]>=11,RC[-3]<12),50,IF(AND(RC[-3]<RC[-1],RC[-3]>=12,RC[-3]<13),45,IF(AND(RC[-3]<RC[-1],RC[-3]>=13,RC[-3]<14),40,IF(AND(RC[-3]<RC[-1],RC[-3]>=14,RC[-3]<15),35,IF(AND(RC[-3]<RC[-1],RC[-3]>=15,RC[-3]<16),30,IF(AND(RC[-3]<RC[-1],RC[-3]>=16,RC[-3]<17),25,IF(AND(RC[-3]<RC[-1],RC[-3]>=17,RC[-3]<18),20,IF(AND(RC[-3]<RC[-1],RC[-3]>=18,RC[-3]<19),15,IF(AND(RC[-3]<RC[-1],RC[-3]>=19,RC[-3]<20),10,IF(AND(RC[-3]<RC[-1],RC[-3]>=20,RC[-3]<21),5,IF(AND(RC[-3]<RC[-1],RC[-3]>=21),0,IF(AND(RC[-3]>RC[-1],RC[-3]>=2,RC[-3]<3),90,IF(AND(RC[-3]>RC[-1],RC[-3]>=3,RC[-3]<4),90,IF(AND(RC[-3]>RC[-1],RC[-3]>=4,RC[-3]<5),80,IF(AND(RC[-3]>RC[-1],RC[-3]>=5,RC[-3]<6),70,IF(AND(RC[-3]>RC[-1],RC[-3]>=6,RC[-3]<7),60,IF(AND(RC[-3]>RC[-1],RC[-3]>=7,RC[-3]<8),50,IF(AND(RC[-3]>RC[-1],RC[-3]>=8,RC[-3]<9),40,IF(AND(RC[-3]>RC[-1],RC[-3]>=9,RC[-3]<10),30,IF(AND(RC[-3]>RC[-1],RC[-3]>=10,RC[-3]<11),20,IF(AND(RC[-3]>RC[-1],RC[-3]>=11,RC[-3]<12),10,IF(AND(RC[-3]>RC[-1],RC[-3]>=12),0))))))))))))))))))))))))))))))))) -> 20 | H583: =IF(RC[-3]="","",IF(RC[-3]<0.3,100,IF(AND(RC[-3]>=0.3,RC[-3]>0.4),95,IF(AND(RC[-3]>=0.4,RC[-3]<0.5),90,IF(AND(RC[-3]>=0.5,RC[-3]<0.6),85,IF(AND(RC[-3]>=0.6,RC[-3]<0.7),80,IF(AND(RC[-3]>=0.6,RC[-3]<1),80,IF(AND(RC[-3]>1,RC[-3]<2),50,IF(RC[-3]>2,0))))))))) ->  | I583: =IF(RC[-1]="",RC[-2],0.7*RC[-1]+0.3*RC[-2]) -> 20
A584: مس باهنر | B584: فباهنر | C584: =VLOOKUP(RC[-1],Sheet1!R3C2:R802C3,2,FALSE) -> فلزات اساسی | D584: =VLOOKUP(RC[-2],Sheet1!R3C2:R802C9,8,FALSE) -> 4.2804002297039707 | E584: =IF(VLOOKUP(RC[-3],Sheet1!R3C2:R803C11,10,FALSE)=0,"",VLOOKUP(Sheet2!RC[-3],Sheet1!R[1]C[-3]:R[801]C[6],10,FALSE)) ->  | F584: =Sheet1!R634C10 -> 7.4779348942651307 | G584: =IF(RC[-3]<0,0,IF(AND(RC[-3]<RC[-1],RC[-3]<2),100,IF(AND(RC[-3]<RC[-1],RC[-3]>=2,RC[-3]<3),95,IF(AND(RC[-3]<RC[-1],RC[-3]>=3,RC[-3]<4),90,IF(AND(RC[-3]<RC[-1],RC[-3]>=4,RC[-3]<5),85,IF(AND(RC[-3]<RC[-1],RC[-3]>=5,RC[-3]<6),80,IF(AND(RC[-3]<RC[-1],RC[-3]>=6,RC[-3]<7),75,IF(AND(RC[-3]<RC[-1],RC[-3]>=7,RC[-3]<8),70,IF(AND(RC[-3]<RC[-1],RC[-3]>=8,RC[-3]<9),65,IF(AND(RC[-3]<RC[-1],RC[-3]>=9,RC[-3]<10),60,IF(AND(RC[-3]<RC[-1],RC[-3]>=10,RC[-3]<11),55,IF(AND(RC[-3]<RC[-1],RC[-3]>=11,RC[-3]<12),50,IF(AND(RC[-3]<RC[-1],RC[-3]>=12,RC[-3]<13),45,IF(AND(RC[-3]<RC[-1],RC[-3]>=13,RC[-3]<14),40,IF(AND(RC[-3]<RC[-1],RC[-3]>=14,RC[-3]<15),35,IF(AND(RC[-3]<RC[-1],RC[-3]>=15,RC[-3]<16),30,IF(AND(RC[-3]<RC[-1],RC[-3]>=16,RC[-3]<17),25,IF(AND(RC[-3]<RC[-1],RC[-3]>=17,RC[-3]<18),20,IF(AND(RC[-3]<RC[-1],RC[-3]>=18,RC[-3]<19),15,IF(AND(RC[-3]<RC[-1],RC[-3]>=19,RC[-3]<20),10,IF(AND(RC[-3]<RC[-1],RC[-3]>=20,RC[-3]<21),5,IF(AND(RC[-3]<RC[-1],RC[-3]>=21),0,IF(AND(RC[-3]>RC[-1],RC[-3]>=2,RC[-3]<3),90,IF(AND(RC[-3]>RC[-1],RC[-3]>=3,RC[-3]<4),90,IF(AND(RC[-3]>RC[-1],RC[-3]>=4,RC[-3]<5),80,IF(AND(RC[-3]>RC[-1],RC[-3]>=5,RC[-3]<6),70,IF(AND(RC[-3]>RC[-1],RC[-3]>=6,RC[-3]<7),60,IF(AND(RC[-3]>RC[-1],RC[-3]>=7,RC[-3]<8),50,IF(AND(RC[-3]>RC[-1],RC[-3]>=8,RC[-3]<9),40,IF(AND(RC[-3]>RC[-1],RC[-3]>=9,RC[-3]<10),30,IF(AND(RC[-3]>RC[-1],RC[-3]>=10,RC[-3]<11),20,IF(AND(RC[-3]>RC[-1],RC[-3]>=11,RC[-3]<12),10,IF(AND(RC[-3]>RC[-1],RC[-3]>=12),0))))))))))))))))))))))))))))))))) -> 85 | H584: =IF(RC[-3]="","",IF(RC[-3]<0.3,100,IF(AND(RC[-3]>=0.3,RC[-3]>0.4),95,IF(AND(RC[-3]>=0.4,RC[-3]<0.5),90,IF(AND(RC[-3]>=0.5,RC[-3]<0.6),85,IF(AND(RC[-3]>=0.6,RC[-3]<0.7),80,IF(AND(RC[-3]>=0.6,RC[-3]<1),80,IF(AND(RC[-3]>1,RC[-3]<2),50,IF(RC[-3]>2,0))))))))) ->  | I584: =IF(RC[-1]="",RC[-2],0.7*RC[-1]+0.3*RC[-2]) -> 85
A585: ملی سرب و روی | B585: فسرب | C585: =VLOOKUP(RC[-1],Sheet1!R3C2:R802C3,2,FALSE) -> فلزات اساسی | D585: =VLOOKUP(RC[-2],Sheet1!R3C2:R802C9,8,FALSE) -> 4.5 | E585: =IF(VLOOKUP(RC[-3],Sheet1!R3C2:R803C11,10,FALSE)=0,"",VLOOKUP(Sheet2!RC[-3],Sheet1!R[1]C[-3]:R[801]C[6],10,FALSE)) ->  | F585: =Sheet1!R634C10 -> 7.4779348942651307 | G585: =IF(RC[-3]<0,0,IF(AND(RC[-3]<RC[-1],RC[-3]<2),100,IF(AND(RC[-3]<RC[-1],RC[-3]>=2,RC[-3]<3),95,IF(AND(RC[-3]<RC[-1],RC[-3]>=3,RC[-3]<4),90,IF(AND(RC[-3]<RC[-1],RC[-3]>=4,RC[-3]<5),85,IF(AND(RC[-3]<RC[-1],RC[-3]>=5,RC[-3]<6),80,IF(AND(RC[-3]<RC[-1],RC[-3]>=6,RC[-3]<7),75,IF(AND(RC[-3]<RC[-1],RC[-3]>=7,RC[-3]<8),70,IF(AND(RC[-3]<RC[-1],RC[-3]>=8,RC[-3]<9),65,IF(AND(RC[-3]<RC[-1],RC[-3]>=9,RC[-3]<10),60,IF(AND(RC[-3]<RC[-1],RC[-3]>=10,RC[-3]<11),55,IF(AND(RC[-3]<RC[-1],RC[-3]>=11,RC[-3]<12),50,IF(AND(RC[-3]<RC[-1],RC[-3]>=12,RC[-3]<13),45,IF(AND(RC[-3]<RC[-1],RC[-3]>=13,RC[-3]<14),40,IF(AND(RC[-3]<RC[-1],RC[-3]>=14,RC[-3]<15),35,IF(AND(RC[-3]<RC[-1],RC[-3]>=15,RC[-3]<16),30,IF(AND(RC[-3]<RC[-1],RC[-3]>=16,RC[-3]<17),25,IF(AND(RC[-3]<RC[-1],RC[-3]>=17,RC[-3]<18),20,IF(AND(RC[-3]<RC[-1],RC[-3]>=18,RC[-3]<19),15,IF(AND(RC[-3]<RC[-1],RC[-3]>=19,RC[-3]<20),10,IF(AND(RC[-3]<RC[-1],RC[-3]>=20,RC[-3]<21),5,IF(AND(RC[-3]<RC[-1],RC[-3]>=21),0,IF(AND(RC[-3]>RC[-1],RC[-3]>=2,RC[-3]<3),90,IF(AND(RC[-3]>RC[-1],RC[-3]>=3,RC[-3]<4),90,IF(AND(RC[-3]>RC[-1],RC[-3]>=4,RC[-3]<5),80,IF(AND(RC[-3]>RC[-1],RC[-3]>=5,RC[-3]<6),70,IF(AND(RC[-3]>RC[-1],RC[-3]>=6,RC[-3]<7),60,IF(AND(RC[-3]>RC[-1],RC[-3]>=7,RC[-3]<8),50,IF(AND(RC[-3]>RC[-1],RC[-3]>=8,RC[-3]<9),40,IF(AND(RC[-3]>RC[-1],RC[-3]>=9,RC[-3]<10),30,IF(AND(RC[-3]>RC[-1],RC[-3]>=10,RC[-3]<11),20,IF(AND(RC[-3]>RC[-1],RC[-3]>=11,RC[-3]<12),10,IF(AND(RC[-3]>RC[-1],RC[-3]>=12),0))))))))))))))))))))))))))))))))) -> 85 | H585: =IF(RC[-3]="","",IF(RC[-3]<0.3,100,IF(AND(RC[-3]>=0.3,RC[-3]>0.4),95,IF(AND(RC[-3]>=0.4,RC[-3]<0.5),90,IF(AND(RC[-3]>=0.5,RC[-3]<0.6),85,IF(AND(RC[-3]>=0.6,RC[-3]<0.7),80,IF(AND(RC[-3]>=0.6,RC[-3]<1),80,IF(AND(RC[-3]>1,RC[-3]<2),50,IF(RC[-3]>2,0))))))))) ->  | I585: =IF(RC[-1]="",RC[-2],0.7*RC[-1]+0.3*RC[-2]) -> 85
A586: ملی صنایع مس ایران | B586: فملی | C586: =VLOOKUP(RC[-1],Sheet1!R3C2:R802C3,2,FALSE) -> فلزات اساسی | D586: =VLOOKUP(RC[-2],Sheet1!R3C2:R802C9,8,FALSE) -> 6.3 | E586: =IF(VLOOKUP(RC[-3],Sheet1!R3C2:R803C11,10,FALSE)=0,"",VLOOKUP(Sheet2!RC[-3],Sheet1!R[1]C[-3]:R[801]C[6],10,FALSE)) ->  | F586: =Sheet1!R634C10 -> 7.4779348942651307 | G586: =IF(RC[-3]<0,0,IF(AND(RC[-3]<RC[-1],RC[-3]<2),100,IF(AND(RC[-3]<RC[-1],RC[-3]>=2,RC[-3]<3),95,IF(AND(RC[-3]<RC[-1],RC[-3]>=3,RC[-3]<4),90,IF(AND(RC[-3]<RC[-1],RC[-3]>=4,RC[-3]<5),85,IF(AND(RC[-3]<RC[-1],RC[-3]>=5,RC[-3]<6),80,IF(AND(RC[-3]<RC[-1],RC[-3]>=6,RC[-3]<7),75,IF(AND(RC[-3]<RC[-1],RC[-3]>=7,RC[-3]<8),70,IF(AND(RC[-3]<RC[-1],RC[-3]>=8,RC[-3]<9),65,IF(AND(RC[-3]<RC[-1],RC[-3]>=9,RC[-3]<10),60,IF(AND(RC[-3]<RC[-1],RC[-3]>=10,RC[-3]<11),55,IF(AND(RC[-3]<RC[-1],RC[-3]>=11,RC[-3]<12),50,IF(AND(RC[-3]<RC[-1],RC[-3]>=12,RC[-3]<13),45,IF(AND(RC[-3]<RC[-1],RC[-3]>=13,RC[-3]<14),40,IF(AND(RC[-3]<RC[-1],RC[-3]>=14,RC[-3]<15),35,IF(AND(RC[-3]<RC[-1],RC[-3]>=15,RC[-3]<16),30,IF(AND(RC[-3]<RC[-1],RC[-3]>=16,RC[-3]<17),25,IF(AND(RC[-3]<RC[-1],RC[-3]>=17,RC[-3]<18),20,IF(AND(RC[-3]<RC[-1],RC[-3]>=18,RC[-3]<19),15,IF(AND(RC[-3]<RC[-1],RC[-3]>=19,RC[-3]<20),10,IF(AND(RC[-3]<RC[-1],RC[-3]>=20,RC[-3]<21),5,IF(AND(RC[-3]<RC[-1],RC[-3]>=21),0,IF(AND(RC[-3]>RC[-1],RC[-3]>=2,RC[-3]<3),90,IF(AND(RC[-3]>RC[-1],RC[-3]>=3,RC[-3]<4),90,IF(AND(RC[-3]>RC[-1],RC[-3]>=4,RC[-3]<5),80,IF(AND(RC[-3]>RC[-1],RC[-3]>=5,RC[-3]<6),70,IF(AND(RC[-3]>RC[-1],RC[-3]>=6,RC[-3]<7),60,IF(AND(RC[-3]>RC[-1],RC[-3]>=7,RC[-3]<8),50,IF(AND(RC[-3]>RC[-1],RC[-3]>=8,RC[-3]<9),40,IF(AND(RC[-3]>RC[-1],RC[-3]>=9,RC[-3]<10),30,IF(AND(RC[-3]>RC[-1],RC[-3]>=10,RC[-3]<11),20,IF(AND(RC[-3]>RC[-1],RC[-3]>=11,RC[-3]<12),10,IF(AND(RC[-3]>RC[-1],RC[-3]>=12),0))))))))))))))))))))))))))))))))) -> 75 | H586: =IF(RC[-3]="","",IF(RC[-3]<0.3,100,IF(AND(RC[-3]>=0.3,RC[-3]>0.4),95,IF(AND(RC[-3]>=0.4,RC[-3]<0.5),90,IF(AND(RC[-3]>=0.5,RC[-3]<0.6),85,IF(AND(RC[-3]>=0.6,RC[-3]<0.7),80,IF(AND(RC[-3]>=0.6,RC[-3]<1),80,IF(AND(RC[-3]>1,RC[-3]<2),50,IF(RC[-3]>2,0))))))))) ->  | I586: =IF(RC[-1]="",RC[-2],0.7*RC[-1]+0.3*RC[-2]) -> 75
A587: نورد آلومینیوم | B587: فنوال | C587: =VLOOKUP(RC[-1],Sheet1!R3C2:R802C3,2,FALSE) -> فلزات اساسی | D587: =VLOOKUP(RC[-2],Sheet1!R3C2:R802C9,8,FALSE) -> 3.0588494713495904 | E587: =IF(VLOOKUP(RC[-3],Sheet1!R3C2:R803C11,10,FALSE)=0,"",VLOOKUP(Sheet2!RC[-3],Sheet1!R[1]C[-3]:R[801]C[6],10,FALSE)) ->  | F587: =Sheet1!R634C10 -> 7.4779348942651307 | G587: =IF(RC[-3]<0,0,IF(AND(RC[-3]<RC[-1],RC[-3]<2),100,IF(AND(RC[-3]<RC[-1],RC[-3]>=2,RC[-3]<3),95,IF(AND(RC[-3]<RC[-1],RC[-3]>=3,RC[-3]<4),90,IF(AND(RC[-3]<RC[-1],RC[-3]>=4,RC[-3]<5),85,IF(AND(RC[-3]<RC[-1],RC[-3]>=5,RC[-3]<6),80,IF(AND(RC[-3]<RC[-1],RC[-3]>=6,RC[-3]<7),75,IF(AND(RC[-3]<RC[-1],RC[-3]>=7,RC[-3]<8),70,IF(AND(RC[-3]<RC[-1],RC[-3]>=8,RC[-3]<9),65,IF(AND(RC[-3]<RC[-1],RC[-3]>=9,RC[-3]<10),60,IF(AND(RC[-3]<RC[-1],RC[-3]>=10,RC[-3]<11),55,IF(AND(RC[-3]<RC[-1],RC[-3]>=11,RC[-3]<12),50,IF(AND(RC[-3]<RC[-1],RC[-3]>=12,RC[-3]<13),45,IF(AND(RC[-3]<RC[-1],RC[-3]>=13,RC[-3]<14),40,IF(AND(RC[-3]<RC[-1],RC[-3]>=14,RC[-3]<15),35,IF(AND(RC[-3]<RC[-1],RC[-3]>=15,RC[-3]<16),30,IF(AND(RC[-3]<RC[-1],RC[-3]>=16,RC[-3]<17),25,IF(AND(RC[-3]<RC[-1],RC[-3]>=17,RC[-3]<18),20,IF(AND(RC[-3]<RC[-1],RC[-3]>=18,RC[-3]<19),15,IF(AND(RC[-3]<RC[-1],RC[-3]>=19,RC[-3]<20),10,IF(AND(RC[-3]<RC[-1],RC[-3]>=20,RC[-3]<21),5,IF(AND(RC[-3]<RC[-1],RC[-3]>=21),0,IF(AND(RC[-3]>RC[-1],RC[-3]>=2,RC[-3]<3),90,IF(AND(RC[-3]>RC[-1],RC[-3]>=3,RC[-3]<4),90,IF(AND(RC[-3]>RC[-1],RC[-3]>=4,RC[-3]<5),80,IF(AND(RC[-3]>RC[-1],RC[-3]>=5,RC[-3]<6),70,IF(AND(RC[-3]>RC[-1],RC[-3]>=6,RC[-3]<7),60,IF(AND(RC[-3]>RC[-1],RC[-3]>=7,RC[-3]<8),50,IF(AND(RC[-3]>RC[-1],RC[-3]>=8,RC[-3]<9),40,IF(AND(RC[-3]>RC[-1],RC[-3]>=9,RC[-3]<10),30,IF(AND(RC[-3]>RC[-1],RC[-3]>=10,RC[-3]<11),20,IF(AND(RC[-3]>RC[-1],RC[-3]>=11,RC[-3]<12),10,IF(AND(RC[-3]>RC[-1],RC[-3]>=12),0))))))))))))))))))))))))))))))))) -> 90 | H587: =IF(RC[-3]="","",IF(RC[-3]<0.3,100,IF(AND(RC[-3]>=0.3,RC[-3]>0.4),95,IF(AND(RC[-3]>=0.4,RC[-3]<0.5),90,IF(AND(RC[-3]>=0.5,RC[-3]<0.6),85,IF(AND(RC[-3]>=0.6,RC[-3]<0.7),80,IF(AND(RC[-3]>=0.6,RC[-3]<1),80,IF(AND(RC[-3]>1,RC[-3]<2),50,IF(RC[-3]>2,0))))))))) ->  | I587: =IF(RC[-1]="",RC[-2],0.7*RC[-1]+0.3*RC[-2]) -> 90
A588: نورد قطعات فولادی | B588: فنورد | C588: =VLOOKUP(RC[-1],Sheet1!R3C2:R802C3,2,FALSE) -> فلزات اساسی | D588: =VLOOKUP(RC[-2],Sheet1!R3C2:R802C9,8,FALSE) -> 2.2280833871332657 | E588: =IF(VLOOKUP(RC[-3],Sheet1!R3C2:R803C11,10,FALSE)=0,"",VLOOKUP(Sheet2!RC[-3],Sheet1!R[1]C[-3]:R[801]C[6],10,FALSE)) ->  | F588: =Sheet1!R634C10 -> 7.4779348942651307 | G588: =IF(RC[-3]<0,0,IF(AND(RC[-3]<RC[-1],RC[-3]<2),100,IF(AND(RC[-3]<RC[-1],RC[-3]>=2,RC[-3]<3),95,IF(AND(RC[-3]<RC[-1],RC[-3]>=3,RC[-3]<4),90,IF(AND(RC[-3]<RC[-1],RC[-3]>=4,RC[-3]<5),85,IF(AND(RC[-3]<RC[-1],RC[-3]>=5,RC[-3]<6),80,IF(AND(RC[-3]<RC[-1],RC[-3]>=6,RC[-3]<7),75,IF(AND(RC[-3]<RC[-1],RC[-3]>=7,RC[-3]<8),70,IF(AND(RC[-3]<RC[-1],RC[-3]>=8,RC[-3]<9),65,IF(AND(RC[-3]<RC[-1],RC[-3]>=9,RC[-3]<10),60,IF(AND(RC[-3]<RC[-1],RC[-3]>=10,RC[-3]<11),55,IF(AND(RC[-3]<RC[-1],RC[-3]>=11,RC[-3]<12),50,IF(AND(RC[-3]<RC[-1],RC[-3]>=12,RC[-3]<13),45,IF(AND(RC[-3]<RC[-1],RC[-3]>=13,RC[-3]<14),40,IF(AND(RC[-3]<RC[-1],RC[-3]>=14,RC[-3]<15),35,IF(AND(RC[-3]<RC[-1],RC[-3]>=15,RC[-3]<16),30,IF(AND(RC[-3]<RC[-1],RC[-3]>=16,RC[-3]<17),25,IF(AND(RC[-3]<RC[-1],RC[-3]>=17,RC[-3]<18),20,IF(AND(RC[-3]<RC[-1],RC[-3]>=18,RC[-3]<19),15,IF(AND(RC[-3]<RC[-1],RC[-3]>=19,RC[-3]<20),10,IF(AND(RC[-3]<RC[-1],RC[-3]>=20,RC[-3]<21),5,IF(AND(RC[-3]<RC[-1],RC[-3]>=21),0,IF(AND(RC[-3]>RC[-1],RC[-3]>=2,RC[-3]<3),90,IF(AND(RC[-3]>RC[-1],RC[-3]>=3,RC[-3]<4),90,IF(AND(RC[-3]>RC[-1],RC[-3]>=4,RC[-3]<5),80,IF(AND(RC[-3]>RC[-1],RC[-3]>=5,RC[-3]<6),70,IF(AND(RC[-3]>RC[-1],RC[-3]>=6,RC[-3]<7),60,IF(AND(RC[-3]>RC[-1],RC[-3]>=7,RC[-3]<8),50,IF(AND(RC[-3]>RC[-1],RC[-3]>=8,RC[-3]<9),40,IF(AND(RC[-3]>RC[-1],RC[-3]>=9,RC[-3]<10),30,IF(AND(RC[-3]>RC[-1],RC[-3]>=10,RC[-3]<11),20,IF(AND(RC[-3]>RC[-1],RC[-3]>=11,RC[-3]<12),10,IF(AND(RC[-3]>RC[-1],RC[-3]>=12),0))))))))))))))))))))))))))))))))) -> 95 | H588: =IF(RC[-3]="","",IF(RC[-3]<0.3,100,IF(AND(RC[-3]>=0.3,RC[-3]>0.4),95,IF(AND(RC[-3]>=0.4,RC[-3]<0.5),90,IF(AND(RC[-3]>=0.5,RC[-3]<0.6),85,IF(AND(RC[-3]>=0.6,RC[-3]<0.7),80,IF(AND(RC[-3]>=0.6,RC[-3]<1),80,IF(AND(RC[-3]>1,RC[-3]<2),50,IF(RC[-3]>2,0))))))))) ->  | I588: =IF(RC[-1]="",RC[-2],0.7*RC[-1]+0.3*RC[-2]) -> 95
A589: نورد و لوله اهواز | B589: فاهواز | C589: =VLOOKUP(RC[-1],Sheet1!R3C2:R802C3,2,FALSE) -> فلزات اساسی | D589: =VLOOKUP(RC[-2],Sheet1!R3C2:R802C9,8,FALSE) -> -4.4455737704918032 | E589: =IF(VLOOKUP(RC[-3],Sheet1!R3C2:R803C11,10,FALSE)=0,"",VLOOKUP(Sheet2!RC[-3],Sheet1!R[1]C[-3]:R[801]C[6],10,FALSE)) ->  | F589: =Sheet1!R634C10 -> 7.4779348942651307 | G589: =IF(RC[-3]<0,0,IF(AND(RC[-3]<RC[-1],RC[-3]<2),100,IF(AND(RC[-3]<RC[-1],RC[-3]>=2,RC[-3]<3),95,IF(AND(RC[-3]<RC[-1],RC[-3]>=3,RC[-3]<4),90,IF(AND(RC[-3]<RC[-1],RC[-3]>=4,RC[-3]<5),85,IF(AND(RC[-3]<RC[-1],RC[-3]>=5,RC[-3]<6),80,IF(AND(RC[-3]<RC[-1],RC[-3]>=6,RC[-3]<7),75,IF(AND(RC[-3]<RC[-1],RC[-3]>=7,RC[-3]<8),70,IF(AND(RC[-3]<RC[-1],RC[-3]>=8,RC[-3]<9),65,IF(AND(RC[-3]<RC[-1],RC[-3]>=9,RC[-3]<10),60,IF(AND(RC[-3]<RC[-1],RC[-3]>=10,RC[-3]<11),55,IF(AND(RC[-3]<RC[-1],RC[-3]>=11,RC[-3]<12),50,IF(AND(RC[-3]<RC[-1],RC[-3]>=12,RC[-3]<13),45,IF(AND(RC[-3]<RC[-1],RC[-3]>=13,RC[-3]<14),40,IF(AND(RC[-3]<RC[-1],RC[-3]>=14,RC[-3]<15),35,IF(AND(RC[-3]<RC[-1],RC[-3]>=15,RC[-3]<16),30,IF(AND(RC[-3]<RC[-1],RC[-3]>=16,RC[-3]<17),25,IF(AND(RC[-3]<RC[-1],RC[-3]>=17,RC[-3]<18),20,IF(AND(RC[-3]<RC[-1],RC[-3]>=18,RC[-3]<19),15,IF(AND(RC[-3]<RC[-1],RC[-3]>=19,RC[-3]<20),10,IF(AND(RC[-3]<RC[-1],RC[-3]>=20,RC[-3]<21),5,IF(AND(RC[-3]<RC[-1],RC[-3]>=21),0,IF(AND(RC[-3]>RC[-1],RC[-3]>=2,RC[-3]<3),90,IF(AND(RC[-3]>RC[-1],RC[-3]>=3,RC[-3]<4),90,IF(AND(RC[-3]>RC[-1],RC[-3]>=4,RC[-3]<5),80,IF(AND(RC[-3]>RC[-1],RC[-3]>=5,RC[-3]<6),70,IF(AND(RC[-3]>RC[-1],RC[-3]>=6,RC[-3]<7),60,IF(AND(RC[-3]>RC[-1],RC[-3]>=7,RC[-3]<8),50,IF(AND(RC[-3]>RC[-1],RC[-3]>=8,RC[-3]<9),40,IF(AND(RC[-3]>RC[-1],RC[-3]>=9,RC[-3]<10),30,IF(AND(RC[-3]>RC[-1],RC[-3]>=10,RC[-3]<11),20,IF(AND(RC[-3]>RC[-1],RC[-3]>=11,RC[-3]<12),10,IF(AND(RC[-3]>RC[-1],RC[-3]>=12),0))))))))))))))))))))))))))))))))) -> 0 | H589: =IF(RC[-3]="","",IF(RC[-3]<0.3,100,IF(AND(RC[-3]>=0.3,RC[-3]>0.4),95,IF(AND(RC[-3]>=0.4,RC[-3]<0.5),90,IF(AND(RC[-3]>=0.5,RC[-3]<0.6),85,IF(AND(RC[-3]>=0.6,RC[-3]<0.7),80,IF(AND(RC[-3]>=0.6,RC[-3]<1),80,IF(AND(RC[-3]>1,RC[-3]<2),50,IF(RC[-3]>2,0))))))))) ->  | I589: =IF(RC[-1]="",RC[-2],0.7*RC[-1]+0.3*RC[-2]) -> 0
A590: کالسیمین | B590: فاسمین | C590: =VLOOKUP(RC[-1],Sheet1!R3C2:R802C3,2,FALSE) -> فلزات اساسی | D590: =VLOOKUP(RC[-2],Sheet1!R3C2:R802C9,8,FALSE) -> 3.6702151030259196 | E590: =IF(VLOOKUP(RC[-3],Sheet1!R3C2:R803C11,10,FALSE)=0,"",VLOOKUP(Sheet2!RC[-3],Sheet1!R[1]C[-3]:R[801]C[6],10,FALSE)) ->  | F590: =Sheet1!R634C10 -> 7.4779348942651307 | G590: =IF(RC[-3]<0,0,IF(AND(RC[-3]<RC[-1],RC[-3]<2),100,IF(AND(RC[-3]<RC[-1],RC[-3]>=2,RC[-3]<3),95,IF(AND(RC[-3]<RC[-1],RC[-3]>=3,RC[-3]<4),90,IF(AND(RC[-3]<RC[-1],RC[-3]>=4,RC[-3]<5),85,IF(AND(RC[-3]<RC[-1],RC[-3]>=5,RC[-3]<6),80,IF(AND(RC[-3]<RC[-1],RC[-3]>=6,RC[-3]<7),75,IF(AND(RC[-3]<RC[-1],RC[-3]>=7,RC[-3]<8),70,IF(AND(RC[-3]<RC[-1],RC[-3]>=8,RC[-3]<9),65,IF(AND(RC[-3]<RC[-1],RC[-3]>=9,RC[-3]<10),60,IF(AND(RC[-3]<RC[-1],RC[-3]>=10,RC[-3]<11),55,IF(AND(RC[-3]<RC[-1],RC[-3]>=11,RC[-3]<12),50,IF(AND(RC[-3]<RC[-1],RC[-3]>=12,RC[-3]<13),45,IF(AND(RC[-3]<RC[-1],RC[-3]>=13,RC[-3]<14),40,IF(AND(RC[-3]<RC[-1],RC[-3]>=14,RC[-3]<15),35,IF(AND(RC[-3]<RC[-1],RC[-3]>=15,RC[-3]<16),30,IF(AND(RC[-3]<RC[-1],RC[-3]>=16,RC[-3]<17),25,IF(AND(RC[-3]<RC[-1],RC[-3]>=17,RC[-3]<18),20,IF(AND(RC[-3]<RC[-1],RC[-3]>=18,RC[-3]<19),15,IF(AND(RC[-3]<RC[-1],RC[-3]>=19,RC[-3]<20),10,IF(AND(RC[-3]<RC[-1],RC[-3]>=20,RC[-3]<21),5,IF(AND(RC[-3]<RC[-1],RC[-3]>=21),0,IF(AND(RC[-3]>RC[-1],RC[-3]>=2,RC[-3]<3),90,IF(AND(RC[-3]>RC[-1],RC[-3]>=3,RC[-3]<4),90,IF(AND(RC[-3]>RC[-1],RC[-3]>=4,RC[-3]<5),80,IF(AND(RC[-3]>RC[-1],RC[-3]>=5,RC[-3]<6),70,IF(AND(RC[-3]>RC[-1],RC[-3]>=6,RC[-3]<7),60,IF(AND(RC[-3]>RC[-1],RC[-3]>=7,RC[-3]<8),50,IF(AND(RC[-3]>RC[-1],RC[-3]>=8,RC[-3]<9),40,IF(AND(RC[-3]>RC[-1],RC[-3]>=9,RC[-3]<10),30,IF(AND(RC[-3]>RC[-1],RC[-3]>=10,RC[-3]<11),20,IF(AND(RC[-3]>RC[-1],RC[-3]>=11,RC[-3]<12),10,IF(AND(RC[-3]>RC[-1],RC[-3]>=12),0))))))))))))))))))))))))))))))))) -> 90 | H590: =IF(RC[-3]="","",IF(RC[-3]<0.3,100,IF(AND(RC[-3]>=0.3,RC[-3]>0.4),95,IF(AND(RC[-3]>=0.4,RC[-3]<0.5),90,IF(AND(RC[-3]>=0.5,RC[-3]<0.6),85,IF(AND(RC[-3]>=0.6,RC[-3]<0.7),80,IF(AND(RC[-3]>=0.6,RC[-3]<1),80,IF(AND(RC[-3]>1,RC[-3]<2),50,IF(RC[-3]>2,0))))))))) ->  | I590: =IF(RC[-1]="",RC[-2],0.7*RC[-1]+0.3*RC[-2]) -> 90
A591: کیمیای زنجان گستران | B591: کیمیا | C591: =VLOOKUP(RC[-1],Sheet1!R3C2:R802C3,2,FALSE) -> فلزات اساسی | D591: =VLOOKUP(RC[-2],Sheet1!R3C2:R802C9,8,FALSE) -> 4.0168483462099278 | E591: =IF(VLOOKUP(RC[-3],Sheet1!R3C2:R803C11,10,FALSE)=0,"",VLOOKUP(Sheet2!RC[-3],Sheet1!R[1]C[-3]:R[801]C[6],10,FALSE)) ->  | F591: =Sheet1!R634C10 -> 7.4779348942651307 | G591: =IF(RC[-3]<0,0,IF(AND(RC[-3]<RC[-1],RC[-3]<2),100,IF(AND(RC[-3]<RC[-1],RC[-3]>=2,RC[-3]<3),95,IF(AND(RC[-3]<RC[-1],RC[-3]>=3,RC[-3]<4),90,IF(AND(RC[-3]<RC[-1],RC[-3]>=4,RC[-3]<5),85,IF(AND(RC[-3]<RC[-1],RC[-3]>=5,RC[-3]<6),80,IF(AND(RC[-3]<RC[-1],RC[-3]>=6,RC[-3]<7),75,IF(AND(RC[-3]<RC[-1],RC[-3]>=7,RC[-3]<8),70,IF(AND(RC[-3]<RC[-1],RC[-3]>=8,RC[-3]<9),65,IF(AND(RC[-3]<RC[-1],RC[-3]>=9,RC[-3]<10),60,IF(AND(RC[-3]<RC[-1],RC[-3]>=10,RC[-3]<11),55,IF(AND(RC[-3]<RC[-1],RC[-3]>=11,RC[-3]<12),50,IF(AND(RC[-3]<RC[-1],RC[-3]>=12,RC[-3]<13),45,IF(AND(RC[-3]<RC[-1],RC[-3]>=13,RC[-3]<14),40,IF(AND(RC[-3]<RC[-1],RC[-3]>=14,RC[-3]<15),35,IF(AND(RC[-3]<RC[-1],RC[-3]>=15,RC[-3]<16),30,IF(AND(RC[-3]<RC[-1],RC[-3]>=16,RC[-3]<17),25,IF(AND(RC[-3]<RC[-1],RC[-3]>=17,RC[-3]<18),20,IF(AND(RC[-3]<RC[-1],RC[-3]>=18,RC[-3]<19),15,IF(AND(RC[-3]<RC[-1],RC[-3]>=19,RC[-3]<20),10,IF(AND(RC[-3]<RC[-1],RC[-3]>=20,RC[-3]<21),5,IF(AND(RC[-3]<RC[-1],RC[-3]>=21),0,IF(AND(RC[-3]>RC[-1],RC[-3]>=2,RC[-3]<3),90,IF(AND(RC[-3]>RC[-1],RC[-3]>=3,RC[-3]<4),90,IF(AND(RC[-3]>RC[-1],RC[-3]>=4,RC[-3]<5),80,IF(AND(RC[-3]>RC[-1],RC[-3]>=5,RC[-3]<6),70,IF(AND(RC[-3]>RC[-1],RC[-3]>=6,RC[-3]<7),60,IF(AND(RC[-3]>RC[-1],RC[-3]>=7,RC[-3]<8),50,IF(AND(RC[-3]>RC[-1],RC[-3]>=8,RC[-3]<9),40,IF(AND(RC[-3]>RC[-1],RC[-3]>=9,RC[-3]<10),30,IF(AND(RC[-3]>RC[-1],RC[-3]>=10,RC[-3]<11),20,IF(AND(RC[-3]>RC[-1],RC[-3]>=11,RC[-3]<12),10,IF(AND(RC[-3]>RC[-1],RC[-3]>=12),0))))))))))))))))))))))))))))))))) -> 85 | H591: =IF(RC[-3]="","",IF(RC[-3]<0.3,100,IF(AND(RC[-3]>=0.3,RC[-3]>0.4),95,IF(AND(RC[-3]>=0.4,RC[-3]<0.5),90,IF(AND(RC[-3]>=0.5,RC[-3]<0.6),85,IF(AND(RC[-3]>=0.6,RC[-3]<0.7),80,IF(AND(RC[-3]>=0.6,RC[-3]<1),80,IF(AND(RC[-3]>1,RC[-3]<2),50,IF(RC[-3]>2,0))))))))) ->  | I591: =IF(RC[-1]="",RC[-2],0.7*RC[-1]+0.3*RC[-2]) -> 85
A592: تابان نیرو سپاهان | B592: تابا | C592: =VLOOKUP(RC[-1],Sheet1!R3C2:R802C3,2,FALSE) -> فنی و مهندسی | D592: =VLOOKUP(RC[-2],Sheet1!R3C2:R802C9,8,FALSE) -> 248.08101015802001 | E592: =IF(VLOOKUP(RC[-3],Sheet1!R3C2:R803C11,10,FALSE)=0,"",VLOOKUP(Sheet2!RC[-3],Sheet1!R[1]C[-3]:R[801]C[6],10,FALSE)) ->  | F592: =Sheet1!R640C10 -> 4.5579030885795602 | G592: =IF(RC[-3]<0,0,IF(AND(RC[-3]<RC[-1],RC[-3]<2),100,IF(AND(RC[-3]<RC[-1],RC[-3]>=2,RC[-3]<3),95,IF(AND(RC[-3]<RC[-1],RC[-3]>=3,RC[-3]<4),90,IF(AND(RC[-3]<RC[-1],RC[-3]>=4,RC[-3]<5),85,IF(AND(RC[-3]<RC[-1],RC[-3]>=5,RC[-3]<6),80,IF(AND(RC[-3]<RC[-1],RC[-3]>=6,RC[-3]<7),75,IF(AND(RC[-3]<RC[-1],RC[-3]>=7,RC[-3]<8),70,IF(AND(RC[-3]<RC[-1],RC[-3]>=8,RC[-3]<9),65,IF(AND(RC[-3]<RC[-1],RC[-3]>=9,RC[-3]<10),60,IF(AND(RC[-3]<RC[-1],RC[-3]>=10,RC[-3]<11),55,IF(AND(RC[-3]<RC[-1],RC[-3]>=11,RC[-3]<12),50,IF(AND(RC[-3]<RC[-1],RC[-3]>=12,RC[-3]<13),45,IF(AND(RC[-3]<RC[-1],RC[-3]>=13,RC[-3]<14),40,IF(AND(RC[-3]<RC[-1],RC[-3]>=14,RC[-3]<15),35,IF(AND(RC[-3]<RC[-1],RC[-3]>=15,RC[-3]<16),30,IF(AND(RC[-3]<RC[-1],RC[-3]>=16,RC[-3]<17),25,IF(AND(RC[-3]<RC[-1],RC[-3]>=17,RC[-3]<18),20,IF(AND(RC[-3]<RC[-1],RC[-3]>=18,RC[-3]<19),15,IF(AND(RC[-3]<RC[-1],RC[-3]>=19,RC[-3]<20),10,IF(AND(RC[-3]<RC[-1],RC[-3]>=20,RC[-3]<21),5,IF(AND(RC[-3]<RC[-1],RC[-3]>=21),0,IF(AND(RC[-3]>RC[-1],RC[-3]>=2,RC[-3]<3),90,IF(AND(RC[-3]>RC[-1],RC[-3]>=3,RC[-3]<4),90,IF(AND(RC[-3]>RC[-1],RC[-3]>=4,RC[-3]<5),80,IF(AND(RC[-3]>RC[-1],RC[-3]>=5,RC[-3]<6),70,IF(AND(RC[-3]>RC[-1],RC[-3]>=6,RC[-3]<7),60,IF(AND(RC[-3]>RC[-1],RC[-3]>=7,RC[-3]<8),50,IF(AND(RC[-3]>RC[-1],RC[-3]>=8,RC[-3]<9),40,IF(AND(RC[-3]>RC[-1],RC[-3]>=9,RC[-3]<10),30,IF(AND(RC[-3]>RC[-1],RC[-3]>=10,RC[-3]<11),20,IF(AND(RC[-3]>RC[-1],RC[-3]>=11,RC[-3]<12),10,IF(AND(RC[-3]>RC[-1],RC[-3]>=12),0))))))))))))))))))))))))))))))))) -> 0 | H592: =IF(RC[-3]="","",IF(RC[-3]<0.3,100,IF(AND(RC[-3]>=0.3,RC[-3]>0.4),95,IF(AND(RC[-3]>=0.4,RC[-3]<0.5),90,IF(AND(RC[-3]>=0.5,RC[-3]<0.6),85,IF(AND(RC[-3]>=0.6,RC[-3]<0.7),80,IF(AND(RC[-3]>=0.6,RC[-3]<1),80,IF(AND(RC[-3]>1,RC[-3]<2),50,IF(RC[-3]>2,0))))))))) ->  | I592: =IF(RC[-1]="",RC[-2],0.7*RC[-1]+0.3*RC[-2]) -> 0
A593: جنرال مکانیک | B593: رنیک | C593: =VLOOKUP(RC[-1],Sheet1!R3C2:R802C3,2,FALSE) -> فنی و مهندسی | D593: =VLOOKUP(RC[-2],Sheet1!R3C2:R802C9,8,FALSE) -> 5.9216759282297575 | E593: =IF(VLOOKUP(RC[-3],Sheet1!R3C2:R803C11,10,FALSE)=0,"",VLOOKUP(Sheet2!RC[-3],Sheet1!R[1]C[-3]:R[801]C[6],10,FALSE)) ->  | F593: =Sheet1!R640C10 -> 4.5579030885795602 | G593: =IF(RC[-3]<0,0,IF(AND(RC[-3]<RC[-1],RC[-3]<2),100,IF(AND(RC[-3]<RC[-1],RC[-3]>=2,RC[-3]<3),95,IF(AND(RC[-3]<RC[-1],RC[-3]>=3,RC[-3]<4),90,IF(AND(RC[-3]<RC[-1],RC[-3]>=4,RC[-3]<5),85,IF(AND(RC[-3]<RC[-1],RC[-3]>=5,RC[-3]<6),80,IF(AND(RC[-3]<RC[-1],RC[-3]>=6,RC[-3]<7),75,IF(AND(RC[-3]<RC[-1],RC[-3]>=7,RC[-3]<8),70,IF(AND(RC[-3]<RC[-1],RC[-3]>=8,RC[-3]<9),65,IF(AND(RC[-3]<RC[-1],RC[-3]>=9,RC[-3]<10),60,IF(AND(RC[-3]<RC[-1],RC[-3]>=10,RC[-3]<11),55,IF(AND(RC[-3]<RC[-1],RC[-3]>=11,RC[-3]<12),50,IF(AND(RC[-3]<RC[-1],RC[-3]>=12,RC[-3]<13),45,IF(AND(RC[-3]<RC[-1],RC[-3]>=13,RC[-3]<14),40,IF(AND(RC[-3]<RC[-1],RC[-3]>=14,RC[-3]<15),35,IF(AND(RC[-3]<RC[-1],RC[-3]>=15,RC[-3]<16),30,IF(AND(RC[-3]<RC[-1],RC[-3]>=16,RC[-3]<17),25,IF(AND(RC[-3]<RC[-1],RC[-3]>=17,RC[-3]<18),20,IF(AND(RC[-3]<RC[-1],RC[-3]>=18,RC[-3]<19),15,IF(AND(RC[-3]<RC[-1],RC[-3]>=19,RC[-3]<20),10,IF(AND(RC[-3]<RC[-1],RC[-3]>=20,RC[-3]<21),5,IF(AND(RC[-3]<RC[-1],RC[-3]>=21),0,IF(AND(RC[-3]>RC[-1],RC[-3]>=2,RC[-3]<3),90,IF(AND(RC[-3]>RC[-1],RC[-3]>=3,RC[-3]<4),90,IF(AND(RC[-3]>RC[-1],RC[-3]>=4,RC[-3]<5),80,IF(AND(RC[-3]>RC[-1],RC[-3]>=5,RC[-3]<6),70,IF(AND(RC[-3]>RC[-1],RC[-3]>=6,RC[-3]<7),60,IF(AND(RC[-3]>RC[-1],RC[-3]>=7,RC[-3]<8),50,IF(AND(RC[-3]>RC[-1],RC[-3]>=8,RC[-3]<9),40,IF(AND(RC[-3]>RC[-1],RC[-3]>=9,RC[-3]<10),30,IF(AND(RC[-3]>RC[-1],RC[-3]>=10,RC[-3]<11),20,IF(AND(RC[-3]>RC[-1],RC[-3]>=11,RC[-3]<12),10,IF(AND(RC[-3]>RC[-1],RC[-3]>=12),0))))))))))))))))))))))))))))))))) -> 70 | H593: =IF(RC[-3]="","",IF(RC[-3]<0.3,100,IF(AND(RC[-3]>=0.3,RC[-3]>0.4),95,IF(AND(RC[-3]>=0.4,RC[-3]<0.5),90,IF(AND(RC[-3]>=0.5,RC[-3]<0.6),85,IF(AND(RC[-3]>=0.6,RC[-3]<0.7),80,IF(AND(RC[-3]>=0.6,RC[-3]<1),80,IF(AND(RC[-3]>1,RC[-3]<2),50,IF(RC[-3]>2,0))))))))) ->  | I593: =IF(RC[-1]="",RC[-2],0.7*RC[-1]+0.3*RC[-2]) -> 70
A594: خدمات فنی فولاد یزد | B594: خفولا | C594: =VLOOKUP(RC[-1],Sheet1!R3C2:R802C3,2,FALSE) -> فنی و مهندسی | D594: =VLOOKUP(RC[-2],Sheet1!R3C2:R802C9,8,FALSE) -> 108.64237561961727 | E594: =IF(VLOOKUP(RC[-3],Sheet1!R3C2:R803C11,10,FALSE)=0,"",VLOOKUP(Sheet2!RC[-3],Sheet1!R[1]C[-3]:R[801]C[6],10,FALSE)) ->  | F594: =Sheet1!R640C10 -> 4.5579030885795602 | G594: =IF(RC[-3]<0,0,IF(AND(RC[-3]<RC[-1],RC[-3]<2),100,IF(AND(RC[-3]<RC[-1],RC[-3]>=2,RC[-3]<3),95,IF(AND(RC[-3]<RC[-1],RC[-3]>=3,RC[-3]<4),90,IF(AND(RC[-3]<RC[-1],RC[-3]>=4,RC[-3]<5),85,IF(AND(RC[-3]<RC[-1],RC[-3]>=5,RC[-3]<6),80,IF(AND(RC[-3]<RC[-1],RC[-3]>=6,RC[-3]<7),75,IF(AND(RC[-3]<RC[-1],RC[-3]>=7,RC[-3]<8),70,IF(AND(RC[-3]<RC[-1],RC[-3]>=8,RC[-3]<9),65,IF(AND(RC[-3]<RC[-1],RC[-3]>=9,RC[-3]<10),60,IF(AND(RC[-3]<RC[-1],RC[-3]>=10,RC[-3]<11),55,IF(AND(RC[-3]<RC[-1],RC[-3]>=11,RC[-3]<12),50,IF(AND(RC[-3]<RC[-1],RC[-3]>=12,RC[-3]<13),45,IF(AND(RC[-3]<RC[-1],RC[-3]>=13,RC[-3]<14),40,IF(AND(RC[-3]<RC[-1],RC[-3]>=14,RC[-3]<15),35,IF(AND(RC[-3]<RC[-1],RC[-3]>=15,RC[-3]<16),30,IF(AND(RC[-3]<RC[-1],RC[-3]>=16,RC[-3]<17),25,IF(AND(RC[-3]<RC[-1],RC[-3]>=17,RC[-3]<18),20,IF(AND(RC[-3]<RC[-1],RC[-3]>=18,RC[-3]<19),15,IF(AND(RC[-3]<RC[-1],RC[-3]>=19,RC[-3]<20),10,IF(AND(RC[-3]<RC[-1],RC[-3]>=20,RC[-3]<21),5,IF(AND(RC[-3]<RC[-1],RC[-3]>=21),0,IF(AND(RC[-3]>RC[-1],RC[-3]>=2,RC[-3]<3),90,IF(AND(RC[-3]>RC[-1],RC[-3]>=3,RC[-3]<4),90,IF(AND(RC[-3]>RC[-1],RC[-3]>=4,RC[-3]<5),80,IF(AND(RC[-3]>RC[-1],RC[-3]>=5,RC[-3]<6),70,IF(AND(RC[-3]>RC[-1],RC[-3]>=6,RC[-3]<7),60,IF(AND(RC[-3]>RC[-1],RC[-3]>=7,RC[-3]<8),50,IF(AND(RC[-3]>RC[-1],RC[-3]>=8,RC[-3]<9),40,IF(AND(RC[-3]>RC[-1],RC[-3]>=9,RC[-3]<10),30,IF(AND(RC[-3]>RC[-1],RC[-3]>=10,RC[-3]<11),20,IF(AND(RC[-3]>RC[-1],RC[-3]>=11,RC[-3]<12),10,IF(AND(RC[-3]>RC[-1],RC[-3]>=12),0))))))))))))))))))))))))))))))))) -> 0 | H594: =IF(RC[-3]="","",IF(RC[-3]<0.3,100,IF(AND(RC[-3]>=0.3,RC[-3]>0.4),95,IF(AND(RC[-3]>=0.4,RC[-3]<0.5),90,IF(AND(RC[-3]>=0.5,RC[-3]<0.6),85,IF(AND(RC[-3]>=0.6,RC[-3]<0.7),80,IF(AND(RC[-3]>=0.6,RC[-3]<1),80,IF(AND(RC[-3]>1,RC[-3]<2),50,IF(RC[-3]>2,0))))))))) ->  | I594: =IF(RC[-1]="",RC[-2],0.7*RC[-1]+0.3*RC[-2]) -> 0
A595: گروه مپنا | B595: رمپنا | C595: =VLOOKUP(RC[-1],Sheet1!R3C2:R802C3,2,FALSE) -> فنی و مهندسی | D595: =VLOOKUP(RC[-2],Sheet1!R3C2:R802C9,8,FALSE) -> 2.6294498381877021 | E595: =IF(VLOOKUP(RC[-3],Sheet1!R3C2:R803C11,10,FALSE)=0,"",VLOOKUP(Sheet2!RC[-3],Sheet1!R[1]C[-3]:R[801]C[6],10,FALSE)) ->  | F595: =Sheet1!R640C10 -> 4.5579030885795602 | G595: =IF(RC[-3]<0,0,IF(AND(RC[-3]<RC[-1],RC[-3]<2),100,IF(AND(RC[-3]<RC[-1],RC[-3]>=2,RC[-3]<3),95,IF(AND(RC[-3]<RC[-1],RC[-3]>=3,RC[-3]<4),90,IF(AND(RC[-3]<RC[-1],RC[-3]>=4,RC[-3]<5),85,IF(AND(RC[-3]<RC[-1],RC[-3]>=5,RC[-3]<6),80,IF(AND(RC[-3]<RC[-1],RC[-3]>=6,RC[-3]<7),75,IF(AND(RC[-3]<RC[-1],RC[-3]>=7,RC[-3]<8),70,IF(AND(RC[-3]<RC[-1],RC[-3]>=8,RC[-3]<9),65,IF(AND(RC[-3]<RC[-1],RC[-3]>=9,RC[-3]<10),60,IF(AND(RC[-3]<RC[-1],RC[-3]>=10,RC[-3]<11),55,IF(AND(RC[-3]<RC[-1],RC[-3]>=11,RC[-3]<12),50,IF(AND(RC[-3]<RC[-1],RC[-3]>=12,RC[-3]<13),45,IF(AND(RC[-3]<RC[-1],RC[-3]>=13,RC[-3]<14),40,IF(AND(RC[-3]<RC[-1],RC[-3]>=14,RC[-3]<15),35,IF(AND(RC[-3]<RC[-1],RC[-3]>=15,RC[-3]<16),30,IF(AND(RC[-3]<RC[-1],RC[-3]>=16,RC[-3]<17),25,IF(AND(RC[-3]<RC[-1],RC[-3]>=17,RC[-3]<18),20,IF(AND(RC[-3]<RC[-1],RC[-3]>=18,RC[-3]<19),15,IF(AND(RC[-3]<RC[-1],RC[-3]>=19,RC[-3]<20),10,IF(AND(RC[-3]<RC[-1],RC[-3]>=20,RC[-3]<21),5,IF(AND(RC[-3]<RC[-1],RC[-3]>=21),0,IF(AND(RC[-3]>RC[-1],RC[-3]>=2,RC[-3]<3),90,IF(AND(RC[-3]>RC[-1],RC[-3]>=3,RC[-3]<4),90,IF(AND(RC[-3]>RC[-1],RC[-3]>=4,RC[-3]<5),80,IF(AND(RC[-3]>RC[-1],RC[-3]>=5,RC[-3]<6),70,IF(AND(RC[-3]>RC[-1],RC[-3]>=6,RC[-3]<7),60,IF(AND(RC[-3]>RC[-1],RC[-3]>=7,RC[-3]<8),50,IF(AND(RC[-3]>RC[-1],RC[-3]>=8,RC[-3]<9),40,IF(AND(RC[-3]>RC[-1],RC[-3]>=9,RC[-3]<10),30,IF(AND(RC[-3]>RC[-1],RC[-3]>=10,RC[-3]<11),20,IF(AND(RC[-3]>RC[-1],RC[-3]>=11,RC[-3]<12),10,IF(AND(RC[-3]>RC[-1],RC[-3]>=12),0))))))))))))))))))))))))))))))))) -> 95 | H595: =IF(RC[-3]="","",IF(RC[-3]<0.3,100,IF(AND(RC[-3]>=0.3,RC[-3]>0.4),95,IF(AND(RC[-3]>=0.4,RC[-3]<0.5),90,IF(AND(RC[-3]>=0.5,RC[-3]<0.6),85,IF(AND(RC[-3]>=0.6,RC[-3]<0.7),80,IF(AND(RC[-3]>=0.6,RC[-3]<1),80,IF(AND(RC[-3]>1,RC[-3]<2),50,IF(RC[-3]>2,0))))))))) ->  | I595: =IF(RC[-1]="",RC[-2],0.7*RC[-1]+0.3*RC[-2]) -> 95
A596: مرآت پولاد | B596: تپولا | C596: =VLOOKUP(RC[-1],Sheet1!R3C2:R802C3,2,FALSE) -> فنی و مهندسی | D596: =VLOOKUP(RC[-2],Sheet1!R3C2:R802C9,8,FALSE) -> -20.467391304347828 | E596: =IF(VLOOKUP(RC[-3],Sheet1!R3C2:R803C11,10,FALSE)=0,"",VLOOKUP(Sheet2!RC[-3],Sheet1!R[1]C[-3]:R[801]C[6],10,FALSE)) ->  | F596: =Sheet1!R640C10 -> 4.5579030885795602 | G596: =IF(RC[-3]<0,0,IF(AND(RC[-3]<RC[-1],RC[-3]<2),100,IF(AND(RC[-3]<RC[-1],RC[-3]>=2,RC[-3]<3),95,IF(AND(RC[-3]<RC[-1],RC[-3]>=3,RC[-3]<4),90,IF(AND(RC[-3]<RC[-1],RC[-3]>=4,RC[-3]<5),85,IF(AND(RC[-3]<RC[-1],RC[-3]>=5,RC[-3]<6),80,IF(AND(RC[-3]<RC[-1],RC[-3]>=6,RC[-3]<7),75,IF(AND(RC[-3]<RC[-1],RC[-3]>=7,RC[-3]<8),70,IF(AND(RC[-3]<RC[-1],RC[-3]>=8,RC[-3]<9),65,IF(AND(RC[-3]<RC[-1],RC[-3]>=9,RC[-3]<10),60,IF(AND(RC[-3]<RC[-1],RC[-3]>=10,RC[-3]<11),55,IF(AND(RC[-3]<RC[-1],RC[-3]>=11,RC[-3]<12),50,IF(AND(RC[-3]<RC[-1],RC[-3]>=12,RC[-3]<13),45,IF(AND(RC[-3]<RC[-1],RC[-3]>=13,RC[-3]<14),40,IF(AND(RC[-3]<RC[-1],RC[-3]>=14,RC[-3]<15),35,IF(AND(RC[-3]<RC[-1],RC[-3]>=15,RC[-3]<16),30,IF(AND(RC[-3]<RC[-1],RC[-3]>=16,RC[-3]<17),25,IF(AND(RC[-3]<RC[-1],RC[-3]>=17,RC[-3]<18),20,IF(AND(RC[-3]<RC[-1],RC[-3]>=18,RC[-3]<19),15,IF(AND(RC[-3]<RC[-1],RC[-3]>=19,RC[-3]<20),10,IF(AND(RC[-3]<RC[-1],RC[-3]>=20,RC[-3]<21),5,IF(AND(RC[-3]<RC[-1],RC[-3]>=21),0,IF(AND(RC[-3]>RC[-1],RC[-3]>=2,RC[-3]<3),90,IF(AND(RC[-3]>RC[-1],RC[-3]>=3,RC[-3]<4),90,IF(AND(RC[-3]>RC[-1],RC[-3]>=4,RC[-3]<5),80,IF(AND(RC[-3]>RC[-1],RC[-3]>=5,RC[-3]<6),70,IF(AND(RC[-3]>RC[-1],RC[-3]>=6,RC[-3]<7),60,IF(AND(RC[-3]>RC[-1],RC[-3]>=7,RC[-3]<8),50,IF(AND(RC[-3]>RC[-1],RC[-3]>=8,RC[-3]<9),40,IF(AND(RC[-3]>RC[-1],RC[-3]>=9,RC[-3]<10),30,IF(AND(RC[-3]>RC[-1],RC[-3]>=10,RC[-3]<11),20,IF(AND(RC[-3]>RC[-1],RC[-3]>=11,RC[-3]<12),10,IF(AND(RC[-3]>RC[-1],RC[-3]>=12),0))))))))))))))))))))))))))))))))) -> 0 | H596: =IF(RC[-3]="","",IF(RC[-3]<0.3,100,IF(AND(RC[-3]>=0.3,RC[-3]>0.4),95,IF(AND(RC[-3]>=0.4,RC[-3]<0.5),90,IF(AND(RC[-3]>=0.5,RC[-3]<0.6),85,IF(AND(RC[-3]>=0.6,RC[-3]<0.7),80,IF(AND(RC[-3]>=0.6,RC[-3]<1),80,IF(AND(RC[-3]>1,RC[-3]<2),50,IF(RC[-3]>2,0))))))))) ->  | I596: =IF(RC[-1]="",RC[-2],0.7*RC[-1]+0.3*RC[-2]) -> 0
A597: شهد | B597: قشهد | C597: =VLOOKUP(RC[-1],Sheet1!R3C2:R802C3,2,FALSE) -> قند و شکر | D597: =VLOOKUP(RC[-2],Sheet1!R3C2:R802C9,8,FALSE) -> 6.646845011756076 | E597: =IF(VLOOKUP(RC[-3],Sheet1!R3C2:R803C11,10,FALSE)=0,"",VLOOKUP(Sheet2!RC[-3],Sheet1!R[1]C[-3]:R[801]C[6],10,FALSE)) ->  | F597: =Sheet1!R659C10 -> 5.3172321257248409 | G597: =IF(RC[-3]<0,0,IF(AND(RC[-3]<RC[-1],RC[-3]<2),100,IF(AND(RC[-3]<RC[-1],RC[-3]>=2,RC[-3]<3),95,IF(AND(RC[-3]<RC[-1],RC[-3]>=3,RC[-3]<4),90,IF(AND(RC[-3]<RC[-1],RC[-3]>=4,RC[-3]<5),85,IF(AND(RC[-3]<RC[-1],RC[-3]>=5,RC[-3]<6),80,IF(AND(RC[-3]<RC[-1],RC[-3]>=6,RC[-3]<7),75,IF(AND(RC[-3]<RC[-1],RC[-3]>=7,RC[-3]<8),70,IF(AND(RC[-3]<RC[-1],RC[-3]>=8,RC[-3]<9),65,IF(AND(RC[-3]<RC[-1],RC[-3]>=9,RC[-3]<10),60,IF(AND(RC[-3]<RC[-1],RC[-3]>=10,RC[-3]<11),55,IF(AND(RC[-3]<RC[-1],RC[-3]>=11,RC[-3]<12),50,IF(AND(RC[-3]<RC[-1],RC[-3]>=12,RC[-3]<13),45,IF(AND(RC[-3]<RC[-1],RC[-3]>=13,RC[-3]<14),40,IF(AND(RC[-3]<RC[-1],RC[-3]>=14,RC[-3]<15),35,IF(AND(RC[-3]<RC[-1],RC[-3]>=15,RC[-3]<16),30,IF(AND(RC[-3]<RC[-1],RC[-3]>=16,RC[-3]<17),25,IF(AND(RC[-3]<RC[-1],RC[-3]>=17,RC[-3]<18),20,IF(AND(RC[-3]<RC[-1],RC[-3]>=18,RC[-3]<19),15,IF(AND(RC[-3]<RC[-1],RC[-3]>=19,RC[-3]<20),10,IF(AND(RC[-3]<RC[-1],RC[-3]>=20,RC[-3]<21),5,IF(AND(RC[-3]<RC[-1],RC[-3]>=21),0,IF(AND(RC[-3]>RC[-1],RC[-3]>=2,RC[-3]<3),90,IF(AND(RC[-3]>RC[-1],RC[-3]>=3,RC[-3]<4),90,IF(AND(RC[-3]>RC[-1],RC[-3]>=4,RC[-3]<5),80,IF(AND(RC[-3]>RC[-1],RC[-3]>=5,RC[-3]<6),70,IF(AND(RC[-3]>RC[-1],RC[-3]>=6,RC[-3]<7),60,IF(AND(RC[-3]>RC[-1],RC[-3]>=7,RC[-3]<8),50,IF(AND(RC[-3]>RC[-1],RC[-3]>=8,RC[-3]<9),40,IF(AND(RC[-3]>RC[-1],RC[-3]>=9,RC[-3]<10),30,IF(AND(RC[-3]>RC[-1],RC[-3]>=10,RC[-3]<11),20,IF(AND(RC[-3]>RC[-1],RC[-3]>=11,RC[-3]<12),10,IF(AND(RC[-3]>RC[-1],RC[-3]>=12),0))))))))))))))))))))))))))))))))) -> 60 | H597: =IF(RC[-3]="","",IF(RC[-3]<0.3,100,IF(AND(RC[-3]>=0.3,RC[-3]>0.4),95,IF(AND(RC[-3]>=0.4,RC[-3]<0.5),90,IF(AND(RC[-3]>=0.5,RC[-3]<0.6),85,IF(AND(RC[-3]>=0.6,RC[-3]<0.7),80,IF(AND(RC[-3]>=0.6,RC[-3]<1),80,IF(AND(RC[-3]>1,RC[-3]<2),50,IF(RC[-3]>2,0))))))))) ->  | I597: =IF(RC[-1]="",RC[-2],0.7*RC[-1]+0.3*RC[-2]) -> 60
A598: شکر شاهرود | B598: قشکر | C598: =VLOOKUP(RC[-1],Sheet1!R3C2:R802C3,2,FALSE) -> قند و شکر | D598: =VLOOKUP(RC[-2],Sheet1!R3C2:R802C9,8,FALSE) -> -2.7285447761194033 | E598: =IF(VLOOKUP(RC[-3],Sheet1!R3C2:R803C11,10,FALSE)=0,"",VLOOKUP(Sheet2!RC[-3],Sheet1!R[1]C[-3]:R[801]C[6],10,FALSE)) ->  | F598: =Sheet1!R659C10 -> 5.3172321257248409 | G598: =IF(RC[-3]<0,0,IF(AND(RC[-3]<RC[-1],RC[-3]<2),100,IF(AND(RC[-3]<RC[-1],RC[-3]>=2,RC[-3]<3),95,IF(AND(RC[-3]<RC[-1],RC[-3]>=3,RC[-3]<4),90,IF(AND(RC[-3]<RC[-1],RC[-3]>=4,RC[-3]<5),85,IF(AND(RC[-3]<RC[-1],RC[-3]>=5,RC[-3]<6),80,IF(AND(RC[-3]<RC[-1],RC[-3]>=6,RC[-3]<7),75,IF(AND(RC[-3]<RC[-1],RC[-3]>=7,RC[-3]<8),70,IF(AND(RC[-3]<RC[-1],RC[-3]>=8,RC[-3]<9),65,IF(AND(RC[-3]<RC[-1],RC[-3]>=9,RC[-3]<10),60,IF(AND(RC[-3]<RC[-1],RC[-3]>=10,RC[-3]<11),55,IF(AND(RC[-3]<RC[-1],RC[-3]>=11,RC[-3]<12),50,IF(AND(RC[-3]<RC[-1],RC[-3]>=12,RC[-3]<13),45,IF(AND(RC[-3]<RC[-1],RC[-3]>=13,RC[-3]<14),40,IF(AND(RC[-3]<RC[-1],RC[-3]>=14,RC[-3]<15),35,IF(AND(RC[-3]<RC[-1],RC[-3]>=15,RC[-3]<16),30,IF(AND(RC[-3]<RC[-1],RC[-3]>=16,RC[-3]<17),25,IF(AND(RC[-3]<RC[-1],RC[-3]>=17,RC[-3]<18),20,IF(AND(RC[-3]<RC[-1],RC[-3]>=18,RC[-3]<19),15,IF(AND(RC[-3]<RC[-1],RC[-3]>=19,RC[-3]<20),10,IF(AND(RC[-3]<RC[-1],RC[-3]>=20,RC[-3]<21),5,IF(AND(RC[-3]<RC[-1],RC[-3]>=21),0,IF(AND(RC[-3]>RC[-1],RC[-3]>=2,RC[-3]<3),90,IF(AND(RC[-3]>RC[-1],RC[-3]>=3,RC[-3]<4),90,IF(AND(RC[-3]>RC[-1],RC[-3]>=4,RC[-3]<5),80,IF(AND(RC[-3]>RC[-1],RC[-3]>=5,RC[-3]<6),70,IF(AND(RC[-3]>RC[-1],RC[-3]>=6,RC[-3]<7),60,IF(AND(RC[-3]>RC[-1],RC[-3]>=7,RC[-3]<8),50,IF(AND(RC[-3]>RC[-1],RC[-3]>=8,RC[-3]<9),40,IF(AND(RC[-3]>RC[-1],RC[-3]>=9,RC[-3]<10),30,IF(AND(RC[-3]>RC[-1],RC[-3]>=10,RC[-3]<11),20,IF(AND(RC[-3]>RC[-1],RC[-3]>=11,RC[-3]<12),10,IF(AND(RC[-3]>RC[-1],RC[-3]>=12),0))))))))))))))))))))))))))))))))) -> 0 | H598: =IF(RC[-3]="","",IF(RC[-3]<0.3,100,IF(AND(RC[-3]>=0.3,RC[-3]>0.4),95,IF(AND(RC[-3]>=0.4,RC[-3]<0.5),90,IF(AND(RC[-3]>=0.5,RC[-3]<0.6),85,IF(AND(RC[-3]>=0.6,RC[-3]<0.7),80,IF(AND(RC[-3]>=0.6,RC[-3]<1),80,IF(AND(RC[-3]>1,RC[-3]<2),50,IF(RC[-3]>2,0))))))))) ->  | I598: =IF(RC[-1]="",RC[-2],0.7*RC[-1]+0.3*RC[-2]) -> 0
A599: فرآورده های غذایی و قند چهارمحال | B599: قچار | C599: =VLOOKUP(RC[-1],Sheet1!R3C2:R802C3,2,FALSE) -> قند و شکر | D599: =VLOOKUP(RC[-2],Sheet1!R3C2:R802C9,8,FALSE) -> 11.246234187273332 | E599: =IF(VLOOKUP(RC[-3],Sheet1!R3C2:R803C11,10,FALSE)=0,"",VLOOKUP(Sheet2!RC[-3],Sheet1!R[1]C[-3]:R[801]C[6],10,FALSE)) ->  | F599: =Sheet1!R659C10 -> 5.3172321257248409 | G599: =IF(RC[-3]<0,0,IF(AND(RC[-3]<RC[-1],RC[-3]<2),100,IF(AND(RC[-3]<RC[-1],RC[-3]>=2,RC[-3]<3),95,IF(AND(RC[-3]<RC[-1],RC[-3]>=3,RC[-3]<4),90,IF(AND(RC[-3]<RC[-1],RC[-3]>=4,RC[-3]<5),85,IF(AND(RC[-3]<RC[-1],RC[-3]>=5,RC[-3]<6),80,IF(AND(RC[-3]<RC[-1],RC[-3]>=6,RC[-3]<7),75,IF(AND(RC[-3]<RC[-1],RC[-3]>=7,RC[-3]<8),70,IF(AND(RC[-3]<RC[-1],RC[-3]>=8,RC[-3]<9),65,IF(AND(RC[-3]<RC[-1],RC[-3]>=9,RC[-3]<10),60,IF(AND(RC[-3]<RC[-1],RC[-3]>=10,RC[-3]<11),55,IF(AND(RC[-3]<RC[-1],RC[-3]>=11,RC[-3]<12),50,IF(AND(RC[-3]<RC[-1],RC[-3]>=12,RC[-3]<13),45,IF(AND(RC[-3]<RC[-1],RC[-3]>=13,RC[-3]<14),40,IF(AND(RC[-3]<RC[-1],RC[-3]>=14,RC[-3]<15),35,IF(AND(RC[-3]<RC[-1],RC[-3]>=15,RC[-3]<16),30,IF(AND(RC[-3]<RC[-1],RC[-3]>=16,RC[-3]<17),25,IF(AND(RC[-3]<RC[-1],RC[-3]>=17,RC[-3]<18),20,IF(AND(RC[-3]<RC[-1],RC[-3]>=18,RC[-3]<19),15,IF(AND(RC[-3]<RC[-1],RC[-3]>=19,RC[-3]<20),10,IF(AND(RC[-3]<RC[-1],RC[-3]>=20,RC[-3]<21),5,IF(AND(RC[-3]<RC[-1],RC[-3]>=21),0,IF(AND(RC[-3]>RC[-1],RC[-3]>=2,RC[-3]<3),90,IF(AND(RC[-3]>RC[-1],RC[-3]>=3,RC[-3]<4),90,IF(AND(RC[-3]>RC[-1],RC[-3]>=4,RC[-3]<5),80,IF(AND(RC[-3]>RC[-1],RC[-3]>=5,RC[-3]<6),70,IF(AND(RC[-3]>RC[-1],RC[-3]>=6,RC[-3]<7),60,IF(AND(RC[-3]>RC[-1],RC[-3]>=7,RC[-3]<8),50,IF(AND(RC[-3]>RC[-1],RC[-3]>=8,RC[-3]<9),40,IF(AND(RC[-3]>RC[-1],RC[-3]>=9,RC[-3]<10),30,IF(AND(RC[-3]>RC[-1],RC[-3]>=10,RC[-3]<11),20,IF(AND(RC[-3]>RC[-1],RC[-3]>=11,RC[-3]<12),10,IF(AND(RC[-3]>RC[-1],RC[-3]>=12),0))))))))))))))))))))))))))))))))) -> 10 | H599: =IF(RC[-3]="","",IF(RC[-3]<0.3,100,IF(AND(RC[-3]>=0.3,RC[-3]>0.4),95,IF(AND(RC[-3]>=0.4,RC[-3]<0.5),90,IF(AND(RC[-3]>=0.5,RC[-3]<0.6),85,IF(AND(RC[-3]>=0.6,RC[-3]<0.7),80,IF(AND(RC[-3]>=0.6,RC[-3]<1),80,IF(AND(RC[-3]>1,RC[-3]<2),50,IF(RC[-3]>2,0))))))))) ->  | I599: =IF(RC[-1]="",RC[-2],0.7*RC[-1]+0.3*RC[-2]) -> 10
A600: قند ارومیه | B600: قاروم | C600: =VLOOKUP(RC[-1],Sheet1!R3C2:R802C3,2,FALSE) -> قند و شکر | D600: =VLOOKUP(RC[-2],Sheet1!R3C2:R802C9,8,FALSE) -> 26.198786251877866 | E600: =IF(VLOOKUP(RC[-3],Sheet1!R3C2:R803C11,10,FALSE)=0,"",VLOOKUP(Sheet2!RC[-3],Sheet1!R[1]C[-3]:R[801]C[6],10,FALSE)) ->  | F600: =Sheet1!R659C10 -> 5.3172321257248409 | G600: =IF(RC[-3]<0,0,IF(AND(RC[-3]<RC[-1],RC[-3]<2),100,IF(AND(RC[-3]<RC[-1],RC[-3]>=2,RC[-3]<3),95,IF(AND(RC[-3]<RC[-1],RC[-3]>=3,RC[-3]<4),90,IF(AND(RC[-3]<RC[-1],RC[-3]>=4,RC[-3]<5),85,IF(AND(RC[-3]<RC[-1],RC[-3]>=5,RC[-3]<6),80,IF(AND(RC[-3]<RC[-1],RC[-3]>=6,RC[-3]<7),75,IF(AND(RC[-3]<RC[-1],RC[-3]>=7,RC[-3]<8),70,IF(AND(RC[-3]<RC[-1],RC[-3]>=8,RC[-3]<9),65,IF(AND(RC[-3]<RC[-1],RC[-3]>=9,RC[-3]<10),60,IF(AND(RC[-3]<RC[-1],RC[-3]>=10,RC[-3]<11),55,IF(AND(RC[-3]<RC[-1],RC[-3]>=11,RC[-3]<12),50,IF(AND(RC[-3]<RC[-1],RC[-3]>=12,RC[-3]<13),45,IF(AND(RC[-3]<RC[-1],RC[-3]>=13,RC[-3]<14),40,IF(AND(RC[-3]<RC[-1],RC[-3]>=14,RC[-3]<15),35,IF(AND(RC[-3]<RC[-1],RC[-3]>=15,RC[-3]<16),30,IF(AND(RC[-3]<RC[-1],RC[-3]>=16,RC[-3]<17),25,IF(AND(RC[-3]<RC[-1],RC[-3]>=17,RC[-3]<18),20,IF(AND(RC[-3]<RC[-1],RC[-3]>=18,RC[-3]<19),15,IF(AND(RC[-3]<RC[-1],RC[-3]>=19,RC[-3]<20),10,IF(AND(RC[-3]<RC[-1],RC[-3]>=20,RC[-3]<21),5,IF(AND(RC[-3]<RC[-1],RC[-3]>=21),0,IF(AND(RC[-3]>RC[-1],RC[-3]>=2,RC[-3]<3),90,IF(AND(RC[-3]>RC[-1],RC[-3]>=3,RC[-3]<4),90,IF(AND(RC[-3]>RC[-1],RC[-3]>=4,RC[-3]<5),80,IF(AND(RC[-3]>RC[-1],RC[-3]>=5,RC[-3]<6),70,IF(AND(RC[-3]>RC[-1],RC[-3]>=6,RC[-3]<7),60,IF(AND(RC[-3]>RC[-1],RC[-3]>=7,RC[-3]<8),50,IF(AND(RC[-3]>RC[-1],RC[-3]>=8,RC[-3]<9),40,IF(AND(RC[-3]>RC[-1],RC[-3]>=9,RC[-3]<10),30,IF(AND(RC[-3]>RC[-1],RC[-3]>=10,RC[-3]<11),20,IF(AND(RC[-3]>RC[-1],RC[-3]>=11,RC[-3]<12),10,IF(AND(RC[-3]>RC[-1],RC[-3]>=12),0))))))))))))))))))))))))))))))))) -> 0 | H600: =IF(RC[-3]="","",IF(RC[-3]<0.3,100,IF(AND(RC[-3]>=0.3,RC[-3]>0.4),95,IF(AND(RC[-3]>=0.4,RC[-3]<0.5),90,IF(AND(RC[-3]>=0.5,RC[-3]<0.6),85,IF(AND(RC[-3]>=0.6,RC[-3]<0.7),80,IF(AND(RC[-3]>=0.6,RC[-3]<1),80,IF(AND(RC[-3]>1,RC[-3]<2),50,IF(RC[-3]>2,0))))))))) ->  | I600: =IF(RC[-1]="",RC[-2],0.7*RC[-1]+0.3*RC[-2]) -> 0
A601: قند اصفهان | B601: قصفها | C601: =VLOOKUP(RC[-1],Sheet1!R3C2:R802C3,2,FALSE) -> قند و شکر | D601: =VLOOKUP(RC[-2],Sheet1!R3C2:R802C9,8,FALSE) -> 9.2590859244682626 | E601: =IF(VLOOKUP(RC[-3],Sheet1!R3C2:R803C11,10,FALSE)=0,"",VLOOKUP(Sheet2!RC[-3],Sheet1!R[1]C[-3]:R[801]C[6],10,FALSE)) ->  | F601: =Sheet1!R659C10 -> 5.3172321257248409 | G601: =IF(RC[-3]<0,0,IF(AND(RC[-3]<RC[-1],RC[-3]<2),100,IF(AND(RC[-3]<RC[-1],RC[-3]>=2,RC[-3]<3),95,IF(AND(RC[-3]<RC[-1],RC[-3]>=3,RC[-3]<4),90,IF(AND(RC[-3]<RC[-1],RC[-3]>=4,RC[-3]<5),85,IF(AND(RC[-3]<RC[-1],RC[-3]>=5,RC[-3]<6),80,IF(AND(RC[-3]<RC[-1],RC[-3]>=6,RC[-3]<7),75,IF(AND(RC[-3]<RC[-1],RC[-3]>=7,RC[-3]<8),70,IF(AND(RC[-3]<RC[-1],RC[-3]>=8,RC[-3]<9),65,IF(AND(RC[-3]<RC[-1],RC[-3]>=9,RC[-3]<10),60,IF(AND(RC[-3]<RC[-1],RC[-3]>=10,RC[-3]<11),55,IF(AND(RC[-3]<RC[-1],RC[-3]>=11,RC[-3]<12),50,IF(AND(RC[-3]<RC[-1],RC[-3]>=12,RC[-3]<13),45,IF(AND(RC[-3]<RC[-1],RC[-3]>=13,RC[-3]<14),40,IF(AND(RC[-3]<RC[-1],RC[-3]>=14,RC[-3]<15),35,IF(AND(RC[-3]<RC[-1],RC[-3]>=15,RC[-3]<16),30,IF(AND(RC[-3]<RC[-1],RC[-3]>=16,RC[-3]<17),25,IF(AND(RC[-3]<RC[-1],RC[-3]>=17,RC[-3]<18),20,IF(AND(RC[-3]<RC[-1],RC[-3]>=18,RC[-3]<19),15,IF(AND(RC[-3]<RC[-1],RC[-3]>=19,RC[-3]<20),10,IF(AND(RC[-3]<RC[-1],RC[-3]>=20,RC[-3]<21),5,IF(AND(RC[-3]<RC[-1],RC[-3]>=21),0,IF(AND(RC[-3]>RC[-1],RC[-3]>=2,RC[-3]<3),90,IF(AND(RC[-3]>RC[-1],RC[-3]>=3,RC[-3]<4),90,IF(AND(RC[-3]>RC[-1],RC[-3]>=4,RC[-3]<5),80,IF(AND(RC[-3]>RC[-1],RC[-3]>=5,RC[-3]<6),70,IF(AND(RC[-3]>RC[-1],RC[-3]>=6,RC[-3]<7),60,IF(AND(RC[-3]>RC[-1],RC[-3]>=7,RC[-3]<8),50,IF(AND(RC[-3]>RC[-1],RC[-3]>=8,RC[-3]<9),40,IF(AND(RC[-3]>RC[-1],RC[-3]>=9,RC[-3]<10),30,IF(AND(RC[-3]>RC[-1],RC[-3]>=10,RC[-3]<11),20,IF(AND(RC[-3]>RC[-1],RC[-3]>=11,RC[-3]<12),10,IF(AND(RC[-3]>RC[-1],RC[-3]>=12),0))))))))))))))))))))))))))))))))) -> 30 | H601: =IF(RC[-3]="","",IF(RC[-3]<0.3,100,IF(AND(RC[-3]>=0.3,RC[-3]>0.4),95,IF(AND(RC[-3]>=0.4,RC[-3]<0.5),90,IF(AND(RC[-3]>=0.5,RC[-3]<0.6),85,IF(AND(RC[-3]>=0.6,RC[-3]<0.7),80,IF(AND(RC[-3]>=0.6,RC[-3]<1),80,IF(AND(RC[-3]>1,RC[-3]<2),50,IF(RC[-3]>2,0))))))))) ->  | I601: =IF(RC[-1]="",RC[-2],0.7*RC[-1]+0.3*RC[-2]) -> 30
A602: قند بیستون | B602: قیستو | C602: =VLOOKUP(RC[-1],Sheet1!R3C2:R802C3,2,FALSE) -> قند و شکر | D602: =VLOOKUP(RC[-2],Sheet1!R3C2:R802C9,8,FALSE) -> 7.6219512195121961 | E602: =IF(VLOOKUP(RC[-3],Sheet1!R3C2:R803C11,10,FALSE)=0,"",VLOOKUP(Sheet2!RC[-3],Sheet1!R[1]C[-3]:R[801]C[6],10,FALSE)) ->  | F602: =Sheet1!R659C10 -> 5.3172321257248409 | G602: =IF(RC[-3]<0,0,IF(AND(RC[-3]<RC[-1],RC[-3]<2),100,IF(AND(RC[-3]<RC[-1],RC[-3]>=2,RC[-3]<3),95,IF(AND(RC[-3]<RC[-1],RC[-3]>=3,RC[-3]<4),90,IF(AND(RC[-3]<RC[-1],RC[-3]>=4,RC[-3]<5),85,IF(AND(RC[-3]<RC[-1],RC[-3]>=5,RC[-3]<6),80,IF(AND(RC[-3]<RC[-1],RC[-3]>=6,RC[-3]<7),75,IF(AND(RC[-3]<RC[-1],RC[-3]>=7,RC[-3]<8),70,IF(AND(RC[-3]<RC[-1],RC[-3]>=8,RC[-3]<9),65,IF(AND(RC[-3]<RC[-1],RC[-3]>=9,RC[-3]<10),60,IF(AND(RC[-3]<RC[-1],RC[-3]>=10,RC[-3]<11),55,IF(AND(RC[-3]<RC[-1],RC[-3]>=11,RC[-3]<12),50,IF(AND(RC[-3]<RC[-1],RC[-3]>=12,RC[-3]<13),45,IF(AND(RC[-3]<RC[-1],RC[-3]>=13,RC[-3]<14),40,IF(AND(RC[-3]<RC[-1],RC[-3]>=14,RC[-3]<15),35,IF(AND(RC[-3]<RC[-1],RC[-3]>=15,RC[-3]<16),30,IF(AND(RC[-3]<RC[-1],RC[-3]>=16,RC[-3]<17),25,IF(AND(RC[-3]<RC[-1],RC[-3]>=17,RC[-3]<18),20,IF(AND(RC[-3]<RC[-1],RC[-3]>=18,RC[-3]<19),15,IF(AND(RC[-3]<RC[-1],RC[-3]>=19,RC[-3]<20),10,IF(AND(RC[-3]<RC[-1],RC[-3]>=20,RC[-3]<21),5,IF(AND(RC[-3]<RC[-1],RC[-3]>=21),0,IF(AND(RC[-3]>RC[-1],RC[-3]>=2,RC[-3]<3),90,IF(AND(RC[-3]>RC[-1],RC[-3]>=3,RC[-3]<4),90,IF(AND(RC[-3]>RC[-1],RC[-3]>=4,RC[-3]<5),80,IF(AND(RC[-3]>RC[-1],RC[-3]>=5,RC[-3]<6),70,IF(AND(RC[-3]>RC[-1],RC[-3]>=6,RC[-3]<7),60,IF(AND(RC[-3]>RC[-1],RC[-3]>=7,RC[-3]<8),50,IF(AND(RC[-3]>RC[-1],RC[-3]>=8,RC[-3]<9),40,IF(AND(RC[-3]>RC[-1],RC[-3]>=9,RC[-3]<10),30,IF(AND(RC[-3]>RC[-1],RC[-3]>=10,RC[-3]<11),20,IF(AND(RC[-3]>RC[-1],RC[-3]>=11,RC[-3]<12),10,IF(AND(RC[-3]>RC[-1],RC[-3]>=12),0))))))))))))))))))))))))))))))))) -> 50 | H602: =IF(RC[-3]="","",IF(RC[-3]<0.3,100,IF(AND(RC[-3]>=0.3,RC[-3]>0.4),95,IF(AND(RC[-3]>=0.4,RC[-3]<0.5),90,IF(AND(RC[-3]>=0.5,RC[-3]<0.6),85,IF(AND(RC[-3]>=0.6,RC[-3]<0.7),80,IF(AND(RC[-3]>=0.6,RC[-3]<1),80,IF(AND(RC[-3]>1,RC[-3]<2),50,IF(RC[-3]>2,0))))))))) ->  | I602: =IF(RC[-1]="",RC[-2],0.7*RC[-1]+0.3*RC[-2]) -> 50
A603: قند پیرانشهر | B603: قپیرا | C603: =VLOOKUP(RC[-1],Sheet1!R3C2:R802C3,2,FALSE) -> قند و شکر | D603: =VLOOKUP(RC[-2],Sheet1!R3C2:R802C9,8,FALSE) -> 13.096713809376691 | E603: =IF(VLOOKUP(RC[-3],Sheet1!R3C2:R803C11,10,FALSE)=0,"",VLOOKUP(Sheet2!RC[-3],Sheet1!R[1]C[-3]:R[801]C[6],10,FALSE)) ->  | F603: =Sheet1!R659C10 -> 5.3172321257248409 | G603: =IF(RC[-3]<0,0,IF(AND(RC[-3]<RC[-1],RC[-3]<2),100,IF(AND(RC[-3]<RC[-1],RC[-3]>=2,RC[-3]<3),95,IF(AND(RC[-3]<RC[-1],RC[-3]>=3,RC[-3]<4),90,IF(AND(RC[-3]<RC[-1],RC[-3]>=4,RC[-3]<5),85,IF(AND(RC[-3]<RC[-1],RC[-3]>=5,RC[-3]<6),80,IF(AND(RC[-3]<RC[-1],RC[-3]>=6,RC[-3]<7),75,IF(AND(RC[-3]<RC[-1],RC[-3]>=7,RC[-3]<8),70,IF(AND(RC[-3]<RC[-1],RC[-3]>=8,RC[-3]<9),65,IF(AND(RC[-3]<RC[-1],RC[-3]>=9,RC[-3]<10),60,IF(AND(RC[-3]<RC[-1],RC[-3]>=10,RC[-3]<11),55,IF(AND(RC[-3]<RC[-1],RC[-3]>=11,RC[-3]<12),50,IF(AND(RC[-3]<RC[-1],RC[-3]>=12,RC[-3]<13),45,IF(AND(RC[-3]<RC[-1],RC[-3]>=13,RC[-3]<14),40,IF(AND(RC[-3]<RC[-1],RC[-3]>=14,RC[-3]<15),35,IF(AND(RC[-3]<RC[-1],RC[-3]>=15,RC[-3]<16),30,IF(AND(RC[-3]<RC[-1],RC[-3]>=16,RC[-3]<17),25,IF(AND(RC[-3]<RC[-1],RC[-3]>=17,RC[-3]<18),20,IF(AND(RC[-3]<RC[-1],RC[-3]>=18,RC[-3]<19),15,IF(AND(RC[-3]<RC[-1],RC[-3]>=19,RC[-3]<20),10,IF(AND(RC[-3]<RC[-1],RC[-3]>=20,RC[-3]<21),5,IF(AND(RC[-3]<RC[-1],RC[-3]>=21),0,IF(AND(RC[-3]>RC[-1],RC[-3]>=2,RC[-3]<3),90,IF(AND(RC[-3]>RC[-1],RC[-3]>=3,RC[-3]<4),90,IF(AND(RC[-3]>RC[-1],RC[-3]>=4,RC[-3]<5),80,IF(AND(RC[-3]>RC[-1],RC[-3]>=5,RC[-3]<6),70,IF(AND(RC[-3]>RC[-1],RC[-3]>=6,RC[-3]<7),60,IF(AND(RC[-3]>RC[-1],RC[-3]>=7,RC[-3]<8),50,IF(AND(RC[-3]>RC[-1],RC[-3]>=8,RC[-3]<9),40,IF(AND(RC[-3]>RC[-1],RC[-3]>=9,RC[-3]<10),30,IF(AND(RC[-3]>RC[-1],RC[-3]>=10,RC[-3]<11),20,IF(AND(RC[-3]>RC[-1],RC[-3]>=11,RC[-3]<12),10,IF(AND(RC[-3]>RC[-1],RC[-3]>=12),0))))))))))))))))))))))))))))))))) -> 0 | H603: =IF(RC[-3]="","",IF(RC[-3]<0.3,100,IF(AND(RC[-3]>=0.3,RC[-3]>0.4),95,IF(AND(RC[-3]>=0.4,RC[-3]<0.5),90,IF(AND(RC[-3]>=0.5,RC[-3]<0.6),85,IF(AND(RC[-3]>=0.6,RC[-3]<0.7),80,IF(AND(RC[-3]>=0.6,RC[-3]<1),80,IF(AND(RC[-3]>1,RC[-3]<2),50,IF(RC[-3]>2,0))))))))) ->  | I603: =IF(RC[-1]="",RC[-2],0.7*RC[-1]+0.3*RC[-2]) -> 0
A604: قند تربت جام | B604: قجام | C604: =VLOOKUP(RC[-1],Sheet1!R3C2:R802C3,2,FALSE) -> قند و شکر | D604: =VLOOKUP(RC[-2],Sheet1!R3C2:R802C9,8,FALSE) -> -10.215166481779788 | E604: =IF(VLOOKUP(RC[-3],Sheet1!R3C2:R803C11,10,FALSE)=0,"",VLOOKUP(Sheet2!RC[-3],Sheet1!R[1]C[-3]:R[801]C[6],10,FALSE)) ->  | F604: =Sheet1!R659C10 -> 5.3172321257248409 | G604: =IF(RC[-3]<0,0,IF(AND(RC[-3]<RC[-1],RC[-3]<2),100,IF(AND(RC[-3]<RC[-1],RC[-3]>=2,RC[-3]<3),95,IF(AND(RC[-3]<RC[-1],RC[-3]>=3,RC[-3]<4),90,IF(AND(RC[-3]<RC[-1],RC[-3]>=4,RC[-3]<5),85,IF(AND(RC[-3]<RC[-1],RC[-3]>=5,RC[-3]<6),80,IF(AND(RC[-3]<RC[-1],RC[-3]>=6,RC[-3]<7),75,IF(AND(RC[-3]<RC[-1],RC[-3]>=7,RC[-3]<8),70,IF(AND(RC[-3]<RC[-1],RC[-3]>=8,RC[-3]<9),65,IF(AND(RC[-3]<RC[-1],RC[-3]>=9,RC[-3]<10),60,IF(AND(RC[-3]<RC[-1],RC[-3]>=10,RC[-3]<11),55,IF(AND(RC[-3]<RC[-1],RC[-3]>=11,RC[-3]<12),50,IF(AND(RC[-3]<RC[-1],RC[-3]>=12,RC[-3]<13),45,IF(AND(RC[-3]<RC[-1],RC[-3]>=13,RC[-3]<14),40,IF(AND(RC[-3]<RC[-1],RC[-3]>=14,RC[-3]<15),35,IF(AND(RC[-3]<RC[-1],RC[-3]>=15,RC[-3]<16),30,IF(AND(RC[-3]<RC[-1],RC[-3]>=16,RC[-3]<17),25,IF(AND(RC[-3]<RC[-1],RC[-3]>=17,RC[-3]<18),20,IF(AND(RC[-3]<RC[-1],RC[-3]>=18,RC[-3]<19),15,IF(AND(RC[-3]<RC[-1],RC[-3]>=19,RC[-3]<20),10,IF(AND(RC[-3]<RC[-1],RC[-3]>=20,RC[-3]<21),5,IF(AND(RC[-3]<RC[-1],RC[-3]>=21),0,IF(AND(RC[-3]>RC[-1],RC[-3]>=2,RC[-3]<3),90,IF(AND(RC[-3]>RC[-1],RC[-3]>=3,RC[-3]<4),90,IF(AND(RC[-3]>RC[-1],RC[-3]>=4,RC[-3]<5),80,IF(AND(RC[-3]>RC[-1],RC[-3]>=5,RC[-3]<6),70,IF(AND(RC[-3]>RC[-1],RC[-3]>=6,RC[-3]<7),60,IF(AND(RC[-3]>RC[-1],RC[-3]>=7,RC[-3]<8),50,IF(AND(RC[-3]>RC[-1],RC[-3]>=8,RC[-3]<9),40,IF(AND(RC[-3]>RC[-1],RC[-3]>=9,RC[-3]<10),30,IF(AND(RC[-3]>RC[-1],RC[-3]>=10,RC[-3]<11),20,IF(AND(RC[-3]>RC[-1],RC[-3]>=11,RC[-3]<12),10,IF(AND(RC[-3]>RC[-1],RC[-3]>=12),0))))))))))))))))))))))))))))))))) -> 0 | H604: =IF(RC[-3]="","",IF(RC[-3]<0.3,100,IF(AND(RC[-3]>=0.3,RC[-3]>0.4),95,IF(AND(RC[-3]>=0.4,RC[-3]<0.5),90,IF(AND(RC[-3]>=0.5,RC[-3]<0.6),85,IF(AND(RC[-3]>=0.6,RC[-3]<0.7),80,IF(AND(RC[-3]>=0.6,RC[-3]<1),80,IF(AND(RC[-3]>1,RC[-3]<2),50,IF(RC[-3]>2,0))))))))) ->  | I604: =IF(RC[-1]="",RC[-2],0.7*RC[-1]+0.3*RC[-2]) -> 0
A605: قند تربت حیدریه | B605: قتربت | C605: =VLOOKUP(RC[-1],Sheet1!R3C2:R802C3,2,FALSE) -> قند و شکر | D605: =VLOOKUP(RC[-2],Sheet1!R3C2:R802C9,8,FALSE) -> 51.099173527310001 | E605: =IF(VLOOKUP(RC[-3],Sheet1!R3C2:R803C11,10,FALSE)=0,"",VLOOKUP(Sheet2!RC[-3],Sheet1!R[1]C[-3]:R[801]C[6],10,FALSE)) ->  | F605: =Sheet1!R659C10 -> 5.3172321257248409 | G605: =IF(RC[-3]<0,0,IF(AND(RC[-3]<RC[-1],RC[-3]<2),100,IF(AND(RC[-3]<RC[-1],RC[-3]>=2,RC[-3]<3),95,IF(AND(RC[-3]<RC[-1],RC[-3]>=3,RC[-3]<4),90,IF(AND(RC[-3]<RC[-1],RC[-3]>=4,RC[-3]<5),85,IF(AND(RC[-3]<RC[-1],RC[-3]>=5,RC[-3]<6),80,IF(AND(RC[-3]<RC[-1],RC[-3]>=6,RC[-3]<7),75,IF(AND(RC[-3]<RC[-1],RC[-3]>=7,RC[-3]<8),70,IF(AND(RC[-3]<RC[-1],RC[-3]>=8,RC[-3]<9),65,IF(AND(RC[-3]<RC[-1],RC[-3]>=9,RC[-3]<10),60,IF(AND(RC[-3]<RC[-1],RC[-3]>=10,RC[-3]<11),55,IF(AND(RC[-3]<RC[-1],RC[-3]>=11,RC[-3]<12),50,IF(AND(RC[-3]<RC[-1],RC[-3]>=12,RC[-3]<13),45,IF(AND(RC[-3]<RC[-1],RC[-3]>=13,RC[-3]<14),40,IF(AND(RC[-3]<RC[-1],RC[-3]>=14,RC[-3]<15),35,IF(AND(RC[-3]<RC[-1],RC[-3]>=15,RC[-3]<16),30,IF(AND(RC[-3]<RC[-1],RC[-3]>=16,RC[-3]<17),25,IF(AND(RC[-3]<RC[-1],RC[-3]>=17,RC[-3]<18),20,IF(AND(RC[-3]<RC[-1],RC[-3]>=18,RC[-3]<19),15,IF(AND(RC[-3]<RC[-1],RC[-3]>=19,RC[-3]<20),10,IF(AND(RC[-3]<RC[-1],RC[-3]>=20,RC[-3]<21),5,IF(AND(RC[-3]<RC[-1],RC[-3]>=21),0,IF(AND(RC[-3]>RC[-1],RC[-3]>=2,RC[-3]<3),90,IF(AND(RC[-3]>RC[-1],RC[-3]>=3,RC[-3]<4),90,IF(AND(RC[-3]>RC[-1],RC[-3]>=4,RC[-3]<5),80,IF(AND(RC[-3]>RC[-1],RC[-3]>=5,RC[-3]<6),70,IF(AND(RC[-3]>RC[-1],RC[-3]>=6,RC[-3]<7),60,IF(AND(RC[-3]>RC[-1],RC[-3]>=7,RC[-3]<8),50,IF(AND(RC[-3]>RC[-1],RC[-3]>=8,RC[-3]<9),40,IF(AND(RC[-3]>RC[-1],RC[-3]>=9,RC[-3]<10),30,IF(AND(RC[-3]>RC[-1],RC[-3]>=10,RC[-3]<11),20,IF(AND(RC[-3]>RC[-1],RC[-3]>=11,RC[-3]<12),10,IF(AND(RC[-3]>RC[-1],RC[-3]>=12),0))))))))))))))))))))))))))))))))) -> 0 | H605: =IF(RC[-3]="","",IF(RC[-3]<0.3,100,IF(AND(RC[-3]>=0.3,RC[-3]>0.4),95,IF(AND(RC[-3]>=0.4,RC[-3]<0.5),90,IF(AND(RC[-3]>=0.5,RC[-3]<0.6),85,IF(AND(RC[-3]>=0.6,RC[-3]<0.7),80,IF(AND(RC[-3]>=0.6,RC[-3]<1),80,IF(AND(RC[-3]>1,RC[-3]<2),50,IF(RC[-3]>2,0))))))))) ->  | I605: =IF(RC[-1]="",RC[-2],0.7*RC[-1]+0.3*RC[-2]) -> 0
A606: قند ثابت خراسان | B606: قثابت | C606: =VLOOKUP(RC[-1],Sheet1!R3C2:R802C3,2,FALSE) -> قند و شکر | D606: =VLOOKUP(RC[-2],Sheet1!R3C2:R802C9,8,FALSE) -> 51.141071428571429 | E606: =IF(VLOOKUP(RC[-3],Sheet1!R3C2:R803C11,10,FALSE)=0,"",VLOOKUP(Sheet2!RC[-3],Sheet1!R[1]C[-3]:R[801]C[6],10,FALSE)) ->  | F606: =Sheet1!R659C10 -> 5.3172321257248409 | G606: =IF(RC[-3]<0,0,IF(AND(RC[-3]<RC[-1],RC[-3]<2),100,IF(AND(RC[-3]<RC[-1],RC[-3]>=2,RC[-3]<3),95,IF(AND(RC[-3]<RC[-1],RC[-3]>=3,RC[-3]<4),90,IF(AND(RC[-3]<RC[-1],RC[-3]>=4,RC[-3]<5),85,IF(AND(RC[-3]<RC[-1],RC[-3]>=5,RC[-3]<6),80,IF(AND(RC[-3]<RC[-1],RC[-3]>=6,RC[-3]<7),75,IF(AND(RC[-3]<RC[-1],RC[-3]>=7,RC[-3]<8),70,IF(AND(RC[-3]<RC[-1],RC[-3]>=8,RC[-3]<9),65,IF(AND(RC[-3]<RC[-1],RC[-3]>=9,RC[-3]<10),60,IF(AND(RC[-3]<RC[-1],RC[-3]>=10,RC[-3]<11),55,IF(AND(RC[-3]<RC[-1],RC[-3]>=11,RC[-3]<12),50,IF(AND(RC[-3]<RC[-1],RC[-3]>=12,RC[-3]<13),45,IF(AND(RC[-3]<RC[-1],RC[-3]>=13,RC[-3]<14),40,IF(AND(RC[-3]<RC[-1],RC[-3]>=14,RC[-3]<15),35,IF(AND(RC[-3]<RC[-1],RC[-3]>=15,RC[-3]<16),30,IF(AND(RC[-3]<RC[-1],RC[-3]>=16,RC[-3]<17),25,IF(AND(RC[-3]<RC[-1],RC[-3]>=17,RC[-3]<18),20,IF(AND(RC[-3]<RC[-1],RC[-3]>=18,RC[-3]<19),15,IF(AND(RC[-3]<RC[-1],RC[-3]>=19,RC[-3]<20),10,IF(AND(RC[-3]<RC[-1],RC[-3]>=20,RC[-3]<21),5,IF(AND(RC[-3]<RC[-1],RC[-3]>=21),0,IF(AND(RC[-3]>RC[-1],RC[-3]>=2,RC[-3]<3),90,IF(AND(RC[-3]>RC[-1],RC[-3]>=3,RC[-3]<4),90,IF(AND(RC[-3]>RC[-1],RC[-3]>=4,RC[-3]<5),80,IF(AND(RC[-3]>RC[-1],RC[-3]>=5,RC[-3]<6),70,IF(AND(RC[-3]>RC[-1],RC[-3]>=6,RC[-3]<7),60,IF(AND(RC[-3]>RC[-1],RC[-3]>=7,RC[-3]<8),50,IF(AND(RC[-3]>RC[-1],RC[-3]>=8,RC[-3]<9),40,IF(AND(RC[-3]>RC[-1],RC[-3]>=9,RC[-3]<10),30,IF(AND(RC[-3]>RC[-1],RC[-3]>=10,RC[-3]<11),20,IF(AND(RC[-3]>RC[-1],RC[-3]>=11,RC[-3]<12),10,IF(AND(RC[-3]>RC[-1],RC[-3]>=12),0))))))))))))))))))))))))))))))))) -> 0 | H606: =IF(RC[-3]="","",IF(RC[-3]<0.3,100,IF(AND(RC[-3]>=0.3,RC[-3]>0.4),95,IF(AND(RC[-3]>=0.4,RC[-3]<0.5),90,IF(AND(RC[-3]>=0.5,RC[-3]<0.6),85,IF(AND(RC[-3]>=0.6,RC[-3]<0.7),80,IF(AND(RC[-3]>=0.6,RC[-3]<1),80,IF(AND(RC[-3]>1,RC[-3]<2),50,IF(RC[-3]>2,0))))))))) ->  | I606: =IF(RC[-1]="",RC[-2],0.7*RC[-1]+0.3*RC[-2]) -> 0
A607: قند شیروان قوچان | B607: قشیر | C607: =VLOOKUP(RC[-1],Sheet1!R3C2:R802C3,2,FALSE) -> قند و شکر | D607: =VLOOKUP(RC[-2],Sheet1!R3C2:R802C9,8,FALSE) -> 1.5333355250619001 | E607: =IF(VLOOKUP(RC[-3],Sheet1!R3C2:R803C11,10,FALSE)=0,"",VLOOKUP(Sheet2!RC[-3],Sheet1!R[1]C[-3]:R[801]C[6],10,FALSE)) ->  | F607: =Sheet1!R659C10 -> 5.3172321257248409 | G607: =IF(RC[-3]<0,0,IF(AND(RC[-3]<RC[-1],RC[-3]<2),100,IF(AND(RC[-3]<RC[-1],RC[-3]>=2,RC[-3]<3),95,IF(AND(RC[-3]<RC[-1],RC[-3]>=3,RC[-3]<4),90,IF(AND(RC[-3]<RC[-1],RC[-3]>=4,RC[-3]<5),85,IF(AND(RC[-3]<RC[-1],RC[-3]>=5,RC[-3]<6),80,IF(AND(RC[-3]<RC[-1],RC[-3]>=6,RC[-3]<7),75,IF(AND(RC[-3]<RC[-1],RC[-3]>=7,RC[-3]<8),70,IF(AND(RC[-3]<RC[-1],RC[-3]>=8,RC[-3]<9),65,IF(AND(RC[-3]<RC[-1],RC[-3]>=9,RC[-3]<10),60,IF(AND(RC[-3]<RC[-1],RC[-3]>=10,RC[-3]<11),55,IF(AND(RC[-3]<RC[-1],RC[-3]>=11,RC[-3]<12),50,IF(AND(RC[-3]<RC[-1],RC[-3]>=12,RC[-3]<13),45,IF(AND(RC[-3]<RC[-1],RC[-3]>=13,RC[-3]<14),40,IF(AND(RC[-3]<RC[-1],RC[-3]>=14,RC[-3]<15),35,IF(AND(RC[-3]<RC[-1],RC[-3]>=15,RC[-3]<16),30,IF(AND(RC[-3]<RC[-1],RC[-3]>=16,RC[-3]<17),25,IF(AND(RC[-3]<RC[-1],RC[-3]>=17,RC[-3]<18),20,IF(AND(RC[-3]<RC[-1],RC[-3]>=18,RC[-3]<19),15,IF(AND(RC[-3]<RC[-1],RC[-3]>=19,RC[-3]<20),10,IF(AND(RC[-3]<RC[-1],RC[-3]>=20,RC[-3]<21),5,IF(AND(RC[-3]<RC[-1],RC[-3]>=21),0,IF(AND(RC[-3]>RC[-1],RC[-3]>=2,RC[-3]<3),90,IF(AND(RC[-3]>RC[-1],RC[-3]>=3,RC[-3]<4),90,IF(AND(RC[-3]>RC[-1],RC[-3]>=4,RC[-3]<5),80,IF(AND(RC[-3]>RC[-1],RC[-3]>=5,RC[-3]<6),70,IF(AND(RC[-3]>RC[-1],RC[-3]>=6,RC[-3]<7),60,IF(AND(RC[-3]>RC[-1],RC[-3]>=7,RC[-3]<8),50,IF(AND(RC[-3]>RC[-1],RC[-3]>=8,RC[-3]<9),40,IF(AND(RC[-3]>RC[-1],RC[-3]>=9,RC[-3]<10),30,IF(AND(RC[-3]>RC[-1],RC[-3]>=10,RC[-3]<11),20,IF(AND(RC[-3]>RC[-1],RC[-3]>=11,RC[-3]<12),10,IF(AND(RC[-3]>RC[-1],RC[-3]>=12),0))))))))))))))))))))))))))))))))) -> 100 | H607: =IF(RC[-3]="","",IF(RC[-3]<0.3,100,IF(AND(RC[-3]>=0.3,RC[-3]>0.4),95,IF(AND(RC[-3]>=0.4,RC[-3]<0.5),90,IF(AND(RC[-3]>=0.5,RC[-3]<0.6),85,IF(AND(RC[-3]>=0.6,RC[-3]<0.7),80,IF(AND(RC[-3]>=0.6,RC[-3]<1),80,IF(AND(RC[-3]>1,RC[-3]<2),50,IF(RC[-3]>2,0))))))))) ->  | I607: =IF(RC[-1]="",RC[-2],0.7*RC[-1]+0.3*RC[-2]) -> 100
A608: قند شیرین خراسان | B608: قشرین | C608: =VLOOKUP(RC[-1],Sheet1!R3C2:R802C3,2,FALSE) -> قند و شکر | D608: =VLOOKUP(RC[-2],Sheet1!R3C2:R802C9,8,FALSE) -> 34.998509032129142 | E608: =IF(VLOOKUP(RC[-3],Sheet1!R3C2:R803C11,10,FALSE)=0,"",VLOOKUP(Sheet2!RC[-3],Sheet1!R[1]C[-3]:R[801]C[6],10,FALSE)) ->  | F608: =Sheet1!R659C10 -> 5.3172321257248409 | G608: =IF(RC[-3]<0,0,IF(AND(RC[-3]<RC[-1],RC[-3]<2),100,IF(AND(RC[-3]<RC[-1],RC[-3]>=2,RC[-3]<3),95,IF(AND(RC[-3]<RC[-1],RC[-3]>=3,RC[-3]<4),90,IF(AND(RC[-3]<RC[-1],RC[-3]>=4,RC[-3]<5),85,IF(AND(RC[-3]<RC[-1],RC[-3]>=5,RC[-3]<6),80,IF(AND(RC[-3]<RC[-1],RC[-3]>=6,RC[-3]<7),75,IF(AND(RC[-3]<RC[-1],RC[-3]>=7,RC[-3]<8),70,IF(AND(RC[-3]<RC[-1],RC[-3]>=8,RC[-3]<9),65,IF(AND(RC[-3]<RC[-1],RC[-3]>=9,RC[-3]<10),60,IF(AND(RC[-3]<RC[-1],RC[-3]>=10,RC[-3]<11),55,IF(AND(RC[-3]<RC[-1],RC[-3]>=11,RC[-3]<12),50,IF(AND(RC[-3]<RC[-1],RC[-3]>=12,RC[-3]<13),45,IF(AND(RC[-3]<RC[-1],RC[-3]>=13,RC[-3]<14),40,IF(AND(RC[-3]<RC[-1],RC[-3]>=14,RC[-3]<15),35,IF(AND(RC[-3]<RC[-1],RC[-3]>=15,RC[-3]<16),30,IF(AND(RC[-3]<RC[-1],RC[-3]>=16,RC[-3]<17),25,IF(AND(RC[-3]<RC[-1],RC[-3]>=17,RC[-3]<18),20,IF(AND(RC[-3]<RC[-1],RC[-3]>=18,RC[-3]<19),15,IF(AND(RC[-3]<RC[-1],RC[-3]>=19,RC[-3]<20),10,IF(AND(RC[-3]<RC[-1],RC[-3]>=20,RC[-3]<21),5,IF(AND(RC[-3]<RC[-1],RC[-3]>=21),0,IF(AND(RC[-3]>RC[-1],RC[-3]>=2,RC[-3]<3),90,IF(AND(RC[-3]>RC[-1],RC[-3]>=3,RC[-3]<4),90,IF(AND(RC[-3]>RC[-1],RC[-3]>=4,RC[-3]<5),80,IF(AND(RC[-3]>RC[-1],RC[-3]>=5,RC[-3]<6),70,IF(AND(RC[-3]>RC[-1],RC[-3]>=6,RC[-3]<7),60,IF(AND(RC[-3]>RC[-1],RC[-3]>=7,RC[-3]<8),50,IF(AND(RC[-3]>RC[-1],RC[-3]>=8,RC[-3]<9),40,IF(AND(RC[-3]>RC[-1],RC[-3]>=9,RC[-3]<10),30,IF(AND(RC[-3]>RC[-1],RC[-3]>=10,RC[-3]<11),20,IF(AND(RC[-3]>RC[-1],RC[-3]>=11,RC[-3]<12),10,IF(AND(RC[-3]>RC[-1],RC[-3]>=12),0))))))))))))))))))))))))))))))))) -> 0 | H608: =IF(RC[-3]="","",IF(RC[-3]<0.3,100,IF(AND(RC[-3]>=0.3,RC[-3]>0.4),95,IF(AND(RC[-3]>=0.4,RC[-3]<0.5),90,IF(AND(RC[-3]>=0.5,RC[-3]<0.6),85,IF(AND(RC[-3]>=0.6,RC[-3]<0.7),80,IF(AND(RC[-3]>=0.6,RC[-3]<1),80,IF(AND(RC[-3]>1,RC[-3]<2),50,IF(RC[-3]>2,0))))))))) ->  | I608: =IF(RC[-1]="",RC[-2],0.7*RC[-1]+0.3*RC[-2]) -> 0
A609: قند قزوین | B609: قزوین | C609: =VLOOKUP(RC[-1],Sheet1!R3C2:R802C3,2,FALSE) -> قند و شکر | D609: =VLOOKUP(RC[-2],Sheet1!R3C2:R802C9,8,FALSE) -> 6.2666653240982848 | E609: =IF(VLOOKUP(RC[-3],Sheet1!R3C2:R803C11,10,FALSE)=0,"",VLOOKUP(Sheet2!RC[-3],Sheet1!R[1]C[-3]:R[801]C[6],10,FALSE)) ->  | F609: =Sheet1!R659C10 -> 5.3172321257248409 | G609: =IF(RC[-3]<0,0,IF(AND(RC[-3]<RC[-1],RC[-3]<2),100,IF(AND(RC[-3]<RC[-1],RC[-3]>=2,RC[-3]<3),95,IF(AND(RC[-3]<RC[-1],RC[-3]>=3,RC[-3]<4),90,IF(AND(RC[-3]<RC[-1],RC[-3]>=4,RC[-3]<5),85,IF(AND(RC[-3]<RC[-1],RC[-3]>=5,RC[-3]<6),80,IF(AND(RC[-3]<RC[-1],RC[-3]>=6,RC[-3]<7),75,IF(AND(RC[-3]<RC[-1],RC[-3]>=7,RC[-3]<8),70,IF(AND(RC[-3]<RC[-1],RC[-3]>=8,RC[-3]<9),65,IF(AND(RC[-3]<RC[-1],RC[-3]>=9,RC[-3]<10),60,IF(AND(RC[-3]<RC[-1],RC[-3]>=10,RC[-3]<11),55,IF(AND(RC[-3]<RC[-1],RC[-3]>=11,RC[-3]<12),50,IF(AND(RC[-3]<RC[-1],RC[-3]>=12,RC[-3]<13),45,IF(AND(RC[-3]<RC[-1],RC[-3]>=13,RC[-3]<14),40,IF(AND(RC[-3]<RC[-1],RC[-3]>=14,RC[-3]<15),35,IF(AND(RC[-3]<RC[-1],RC[-3]>=15,RC[-3]<16),30,IF(AND(RC[-3]<RC[-1],RC[-3]>=16,RC[-3]<17),25,IF(AND(RC[-3]<RC[-1],RC[-3]>=17,RC[-3]<18),20,IF(AND(RC[-3]<RC[-1],RC[-3]>=18,RC[-3]<19),15,IF(AND(RC[-3]<RC[-1],RC[-3]>=19,RC[-3]<20),10,IF(AND(RC[-3]<RC[-1],RC[-3]>=20,RC[-3]<21),5,IF(AND(RC[-3]<RC[-1],RC[-3]>=21),0,IF(AND(RC[-3]>RC[-1],RC[-3]>=2,RC[-3]<3),90,IF(AND(RC[-3]>RC[-1],RC[-3]>=3,RC[-3]<4),90,IF(AND(RC[-3]>RC[-1],RC[-3]>=4,RC[-3]<5),80,IF(AND(RC[-3]>RC[-1],RC[-3]>=5,RC[-3]<6),70,IF(AND(RC[-3]>RC[-1],RC[-3]>=6,RC[-3]<7),60,IF(AND(RC[-3]>RC[-1],RC[-3]>=7,RC[-3]<8),50,IF(AND(RC[-3]>RC[-1],RC[-3]>=8,RC[-3]<9),40,IF(AND(RC[-3]>RC[-1],RC[-3]>=9,RC[-3]<10),30,IF(AND(RC[-3]>RC[-1],RC[-3]>=10,RC[-3]<11),20,IF(AND(RC[-3]>RC[-1],RC[-3]>=11,RC[-3]<12),10,IF(AND(RC[-3]>RC[-1],RC[-3]>=12),0))))))))))))))))))))))))))))))))) -> 60 | H609: =IF(RC[-3]="","",IF(RC[-3]<0.3,100,IF(AND(RC[-3]>=0.3,RC[-3]>0.4),95,IF(AND(RC[-3]>=0.4,RC[-3]<0.5),90,IF(AND(RC[-3]>=0.5,RC[-3]<0.6),85,IF(AND(RC[-3]>=0.6,RC[-3]<0.7),80,IF(AND(RC[-3]>=0.6,RC[-3]<1),80,IF(AND(RC[-3]>1,RC[-3]<2),50,IF(RC[-3]>2,0))))))))) ->  | I609: =IF(RC[-1]="",RC[-2],0.7*RC[-1]+0.3*RC[-2]) -> 60
A610: قند لرستان | B610: قلرست | C610: =VLOOKUP(RC[-1],Sheet1!R3C2:R802C3,2,FALSE) -> قند و شکر | D610: =VLOOKUP(RC[-2],Sheet1!R3C2:R802C9,8,FALSE) -> 5.6118143840273715 | E610: =IF(VLOOKUP(RC[-3],Sheet1!R3C2:R803C11,10,FALSE)=0,"",VLOOKUP(Sheet2!RC[-3],Sheet1!R[1]C[-3]:R[801]C[6],10,FALSE)) ->  | F610: =Sheet1!R659C10 -> 5.3172321257248409 | G610: =IF(RC[-3]<0,0,IF(AND(RC[-3]<RC[-1],RC[-3]<2),100,IF(AND(RC[-3]<RC[-1],RC[-3]>=2,RC[-3]<3),95,IF(AND(RC[-3]<RC[-1],RC[-3]>=3,RC[-3]<4),90,IF(AND(RC[-3]<RC[-1],RC[-3]>=4,RC[-3]<5),85,IF(AND(RC[-3]<RC[-1],RC[-3]>=5,RC[-3]<6),80,IF(AND(RC[-3]<RC[-1],RC[-3]>=6,RC[-3]<7),75,IF(AND(RC[-3]<RC[-1],RC[-3]>=7,RC[-3]<8),70,IF(AND(RC[-3]<RC[-1],RC[-3]>=8,RC[-3]<9),65,IF(AND(RC[-3]<RC[-1],RC[-3]>=9,RC[-3]<10),60,IF(AND(RC[-3]<RC[-1],RC[-3]>=10,RC[-3]<11),55,IF(AND(RC[-3]<RC[-1],RC[-3]>=11,RC[-3]<12),50,IF(AND(RC[-3]<RC[-1],RC[-3]>=12,RC[-3]<13),45,IF(AND(RC[-3]<RC[-1],RC[-3]>=13,RC[-3]<14),40,IF(AND(RC[-3]<RC[-1],RC[-3]>=14,RC[-3]<15),35,IF(AND(RC[-3]<RC[-1],RC[-3]>=15,RC[-3]<16),30,IF(AND(RC[-3]<RC[-1],RC[-3]>=16,RC[-3]<17),25,IF(AND(RC[-3]<RC[-1],RC[-3]>=17,RC[-3]<18),20,IF(AND(RC[-3]<RC[-1],RC[-3]>=18,RC[-3]<19),15,IF(AND(RC[-3]<RC[-1],RC[-3]>=19,RC[-3]<20),10,IF(AND(RC[-3]<RC[-1],RC[-3]>=20,RC[-3]<21),5,IF(AND(RC[-3]<RC[-1],RC[-3]>=21),0,IF(AND(RC[-3]>RC[-1],RC[-3]>=2,RC[-3]<3),90,IF(AND(RC[-3]>RC[-1],RC[-3]>=3,RC[-3]<4),90,IF(AND(RC[-3]>RC[-1],RC[-3]>=4,RC[-3]<5),80,IF(AND(RC[-3]>RC[-1],RC[-3]>=5,RC[-3]<6),70,IF(AND(RC[-3]>RC[-1],RC[-3]>=6,RC[-3]<7),60,IF(AND(RC[-3]>RC[-1],RC[-3]>=7,RC[-3]<8),50,IF(AND(RC[-3]>RC[-1],RC[-3]>=8,RC[-3]<9),40,IF(AND(RC[-3]>RC[-1],RC[-3]>=9,RC[-3]<10),30,IF(AND(RC[-3]>RC[-1],RC[-3]>=10,RC[-3]<11),20,IF(AND(RC[-3]>RC[-1],RC[-3]>=11,RC[-3]<12),10,IF(AND(RC[-3]>RC[-1],RC[-3]>=12),0))))))))))))))))))))))))))))))))) -> 70 | H610: =IF(RC[-3]="","",IF(RC[-3]<0.3,100,IF(AND(RC[-3]>=0.3,RC[-3]>0.4),95,IF(AND(RC[-3]>=0.4,RC[-3]<0.5),90,IF(AND(RC[-3]>=0.5,RC[-3]<0.6),85,IF(AND(RC[-3]>=0.6,RC[-3]<0.7),80,IF(AND(RC[-3]>=0.6,RC[-3]<1),80,IF(AND(RC[-3]>1,RC[-3]<2),50,IF(RC[-3]>2,0))))))))) ->  | I610: =IF(RC[-1]="",RC[-2],0.7*RC[-1]+0.3*RC[-2]) -> 70
A611: قند مرودشت | B611: قمرو | C611: =VLOOKUP(RC[-1],Sheet1!R3C2:R802C3,2,FALSE) -> قند و شکر | D611: =VLOOKUP(RC[-2],Sheet1!R3C2:R802C9,8,FALSE) -> 4.7483596299676645 | E611: =IF(VLOOKUP(RC[-3],Sheet1!R3C2:R803C11,10,FALSE)=0,"",VLOOKUP(Sheet2!RC[-3],Sheet1!R[1]C[-3]:R[801]C[6],10,FALSE)) ->  | F611: =Sheet1!R659C10 -> 5.3172321257248409 | G611: =IF(RC[-3]<0,0,IF(AND(RC[-3]<RC[-1],RC[-3]<2),100,IF(AND(RC[-3]<RC[-1],RC[-3]>=2,RC[-3]<3),95,IF(AND(RC[-3]<RC[-1],RC[-3]>=3,RC[-3]<4),90,IF(AND(RC[-3]<RC[-1],RC[-3]>=4,RC[-3]<5),85,IF(AND(RC[-3]<RC[-1],RC[-3]>=5,RC[-3]<6),80,IF(AND(RC[-3]<RC[-1],RC[-3]>=6,RC[-3]<7),75,IF(AND(RC[-3]<RC[-1],RC[-3]>=7,RC[-3]<8),70,IF(AND(RC[-3]<RC[-1],RC[-3]>=8,RC[-3]<9),65,IF(AND(RC[-3]<RC[-1],RC[-3]>=9,RC[-3]<10),60,IF(AND(RC[-3]<RC[-1],RC[-3]>=10,RC[-3]<11),55,IF(AND(RC[-3]<RC[-1],RC[-3]>=11,RC[-3]<12),50,IF(AND(RC[-3]<RC[-1],RC[-3]>=12,RC[-3]<13),45,IF(AND(RC[-3]<RC[-1],RC[-3]>=13,RC[-3]<14),40,IF(AND(RC[-3]<RC[-1],RC[-3]>=14,RC[-3]<15),35,IF(AND(RC[-3]<RC[-1],RC[-3]>=15,RC[-3]<16),30,IF(AND(RC[-3]<RC[-1],RC[-3]>=16,RC[-3]<17),25,IF(AND(RC[-3]<RC[-1],RC[-3]>=17,RC[-3]<18),20,IF(AND(RC[-3]<RC[-1],RC[-3]>=18,RC[-3]<19),15,IF(AND(RC[-3]<RC[-1],RC[-3]>=19,RC[-3]<20),10,IF(AND(RC[-3]<RC[-1],RC[-3]>=20,RC[-3]<21),5,IF(AND(RC[-3]<RC[-1],RC[-3]>=21),0,IF(AND(RC[-3]>RC[-1],RC[-3]>=2,RC[-3]<3),90,IF(AND(RC[-3]>RC[-1],RC[-3]>=3,RC[-3]<4),90,IF(AND(RC[-3]>RC[-1],RC[-3]>=4,RC[-3]<5),80,IF(AND(RC[-3]>RC[-1],RC[-3]>=5,RC[-3]<6),70,IF(AND(RC[-3]>RC[-1],RC[-3]>=6,RC[-3]<7),60,IF(AND(RC[-3]>RC[-1],RC[-3]>=7,RC[-3]<8),50,IF(AND(RC[-3]>RC[-1],RC[-3]>=8,RC[-3]<9),40,IF(AND(RC[-3]>RC[-1],RC[-3]>=9,RC[-3]<10),30,IF(AND(RC[-3]>RC[-1],RC[-3]>=10,RC[-3]<11),20,IF(AND(RC[-3]>RC[-1],RC[-3]>=11,RC[-3]<12),10,IF(AND(RC[-3]>RC[-1],RC[-3]>=12),0))))))))))))))))))))))))))))))))) -> 85 | H611: =IF(RC[-3]="","",IF(RC[-3]<0.3,100,IF(AND(RC[-3]>=0.3,RC[-3]>0.4),95,IF(AND(RC[-3]>=0.4,RC[-3]<0.5),90,IF(AND(RC[-3]>=0.5,RC[-3]<0.6),85,IF(AND(RC[-3]>=0.6,RC[-3]<0.7),80,IF(AND(RC[-3]>=0.6,RC[-3]<1),80,IF(AND(RC[-3]>1,RC[-3]<2),50,IF(RC[-3]>2,0))))))))) ->  | I611: =IF(RC[-1]="",RC[-2],0.7*RC[-1]+0.3*RC[-2]) -> 85
A612: قند نقش جهان | B612: قنقش | C612: =VLOOKUP(RC[-1],Sheet1!R3C2:R802C3,2,FALSE) -> قند و شکر | D612: =VLOOKUP(RC[-2],Sheet1!R3C2:R802C9,8,FALSE) -> -92.084187752308893 | E612: =IF(VLOOKUP(RC[-3],Sheet1!R3C2:R803C11,10,FALSE)=0,"",VLOOKUP(Sheet2!RC[-3],Sheet1!R[1]C[-3]:R[801]C[6],10,FALSE)) ->  | F612: =Sheet1!R659C10 -> 5.3172321257248409 | G612: =IF(RC[-3]<0,0,IF(AND(RC[-3]<RC[-1],RC[-3]<2),100,IF(AND(RC[-3]<RC[-1],RC[-3]>=2,RC[-3]<3),95,IF(AND(RC[-3]<RC[-1],RC[-3]>=3,RC[-3]<4),90,IF(AND(RC[-3]<RC[-1],RC[-3]>=4,RC[-3]<5),85,IF(AND(RC[-3]<RC[-1],RC[-3]>=5,RC[-3]<6),80,IF(AND(RC[-3]<RC[-1],RC[-3]>=6,RC[-3]<7),75,IF(AND(RC[-3]<RC[-1],RC[-3]>=7,RC[-3]<8),70,IF(AND(RC[-3]<RC[-1],RC[-3]>=8,RC[-3]<9),65,IF(AND(RC[-3]<RC[-1],RC[-3]>=9,RC[-3]<10),60,IF(AND(RC[-3]<RC[-1],RC[-3]>=10,RC[-3]<11),55,IF(AND(RC[-3]<RC[-1],RC[-3]>=11,RC[-3]<12),50,IF(AND(RC[-3]<RC[-1],RC[-3]>=12,RC[-3]<13),45,IF(AND(RC[-3]<RC[-1],RC[-3]>=13,RC[-3]<14),40,IF(AND(RC[-3]<RC[-1],RC[-3]>=14,RC[-3]<15),35,IF(AND(RC[-3]<RC[-1],RC[-3]>=15,RC[-3]<16),30,IF(AND(RC[-3]<RC[-1],RC[-3]>=16,RC[-3]<17),25,IF(AND(RC[-3]<RC[-1],RC[-3]>=17,RC[-3]<18),20,IF(AND(RC[-3]<RC[-1],RC[-3]>=18,RC[-3]<19),15,IF(AND(RC[-3]<RC[-1],RC[-3]>=19,RC[-3]<20),10,IF(AND(RC[-3]<RC[-1],RC[-3]>=20,RC[-3]<21),5,IF(AND(RC[-3]<RC[-1],RC[-3]>=21),0,IF(AND(RC[-3]>RC[-1],RC[-3]>=2,RC[-3]<3),90,IF(AND(RC[-3]>RC[-1],RC[-3]>=3,RC[-3]<4),90,IF(AND(RC[-3]>RC[-1],RC[-3]>=4,RC[-3]<5),80,IF(AND(RC[-3]>RC[-1],RC[-3]>=5,RC[-3]<6),70,IF(AND(RC[-3]>RC[-1],RC[-3]>=6,RC[-3]<7),60,IF(AND(RC[-3]>RC[-1],RC[-3]>=7,RC[-3]<8),50,IF(AND(RC[-3]>RC[-1],RC[-3]>=8,RC[-3]<9),40,IF(AND(RC[-3]>RC[-1],RC[-3]>=9,RC[-3]<10),30,IF(AND(RC[-3]>RC[-1],RC[-3]>=10,RC[-3]<11),20,IF(AND(RC[-3]>RC[-1],RC[-3]>=11,RC[-3]<12),10,IF(AND(RC[-3]>RC[-1],RC[-3]>=12),0))))))))))))))))))))))))))))))))) -> 0 | H612: =IF(RC[-3]="","",IF(RC[-3]<0.3,100,IF(AND(RC[-3]>=0.3,RC[-3]>0.4),95,IF(AND(RC[-3]>=0.4,RC[-3]<0.5),90,IF(AND(RC[-3]>=0.5,RC[-3]<0.6),85,IF(AND(RC[-3]>=0.6,RC[-3]<0.7),80,IF(AND(RC[-3]>=0.6,RC[-3]<1),80,IF(AND(RC[-3]>1,RC[-3]<2),50,IF(RC[-3]>2,0))))))))) ->  | I612: =IF(RC[-1]="",RC[-2],0.7*RC[-1]+0.3*RC[-2]) -> 0
A613: قند نیشابور | B613: قنیشا | C613: =VLOOKUP(RC[-1],Sheet1!R3C2:R802C3,2,FALSE) -> قند و شکر | D613: =VLOOKUP(RC[-2],Sheet1!R3C2:R802C9,8,FALSE) -> 88.561433592578453 | E613: =IF(VLOOKUP(RC[-3],Sheet1!R3C2:R803C11,10,FALSE)=0,"",VLOOKUP(Sheet2!RC[-3],Sheet1!R[1]C[-3]:R[801]C[6],10,FALSE)) ->  | F613: =Sheet1!R659C10 -> 5.3172321257248409 | G613: =IF(RC[-3]<0,0,IF(AND(RC[-3]<RC[-1],RC[-3]<2),100,IF(AND(RC[-3]<RC[-1],RC[-3]>=2,RC[-3]<3),95,IF(AND(RC[-3]<RC[-1],RC[-3]>=3,RC[-3]<4),90,IF(AND(RC[-3]<RC[-1],RC[-3]>=4,RC[-3]<5),85,IF(AND(RC[-3]<RC[-1],RC[-3]>=5,RC[-3]<6),80,IF(AND(RC[-3]<RC[-1],RC[-3]>=6,RC[-3]<7),75,IF(AND(RC[-3]<RC[-1],RC[-3]>=7,RC[-3]<8),70,IF(AND(RC[-3]<RC[-1],RC[-3]>=8,RC[-3]<9),65,IF(AND(RC[-3]<RC[-1],RC[-3]>=9,RC[-3]<10),60,IF(AND(RC[-3]<RC[-1],RC[-3]>=10,RC[-3]<11),55,IF(AND(RC[-3]<RC[-1],RC[-3]>=11,RC[-3]<12),50,IF(AND(RC[-3]<RC[-1],RC[-3]>=12,RC[-3]<13),45,IF(AND(RC[-3]<RC[-1],RC[-3]>=13,RC[-3]<14),40,IF(AND(RC[-3]<RC[-1],RC[-3]>=14,RC[-3]<15),35,IF(AND(RC[-3]<RC[-1],RC[-3]>=15,RC[-3]<16),30,IF(AND(RC[-3]<RC[-1],RC[-3]>=16,RC[-3]<17),25,IF(AND(RC[-3]<RC[-1],RC[-3]>=17,RC[-3]<18),20,IF(AND(RC[-3]<RC[-1],RC[-3]>=18,RC[-3]<19),15,IF(AND(RC[-3]<RC[-1],RC[-3]>=19,RC[-3]<20),10,IF(AND(RC[-3]<RC[-1],RC[-3]>=20,RC[-3]<21),5,IF(AND(RC[-3]<RC[-1],RC[-3]>=21),0,IF(AND(RC[-3]>RC[-1],RC[-3]>=2,RC[-3]<3),90,IF(AND(RC[-3]>RC[-1],RC[-3]>=3,RC[-3]<4),90,IF(AND(RC[-3]>RC[-1],RC[-3]>=4,RC[-3]<5),80,IF(AND(RC[-3]>RC[-1],RC[-3]>=5,RC[-3]<6),70,IF(AND(RC[-3]>RC[-1],RC[-3]>=6,RC[-3]<7),60,IF(AND(RC[-3]>RC[-1],RC[-3]>=7,RC[-3]<8),50,IF(AND(RC[-3]>RC[-1],RC[-3]>=8,RC[-3]<9),40,IF(AND(RC[-3]>RC[-1],RC[-3]>=9,RC[-3]<10),30,IF(AND(RC[-3]>RC[-1],RC[-3]>=10,RC[-3]<11),20,IF(AND(RC[-3]>RC[-1],RC[-3]>=11,RC[-3]<12),10,IF(AND(RC[-3]>RC[-1],RC[-3]>=12),0))))))))))))))))))))))))))))))))) -> 0 | H613: =IF(RC[-3]="","",IF(RC[-3]<0.3,100,IF(AND(RC[-3]>=0.3,RC[-3]>0.4),95,IF(AND(RC[-3]>=0.4,RC[-3]<0.5),90,IF(AND(RC[-3]>=0.5,RC[-3]<0.6),85,IF(AND(RC[-3]>=0.6,RC[-3]<0.7),80,IF(AND(RC[-3]>=0.6,RC[-3]<1),80,IF(AND(RC[-3]>1,RC[-3]<2),50,IF(RC[-3]>2,0))))))))) ->  | I613: =IF(RC[-1]="",RC[-2],0.7*RC[-1]+0.3*RC[-2]) -> 0
A614: قند هگمتان | B614: قهکمت | C614: =VLOOKUP(RC[-1],Sheet1!R3C2:R802C3,2,FALSE) -> قند و شکر | D614: =VLOOKUP(RC[-2],Sheet1!R3C2:R802C9,8,FALSE) -> 7.4441061147136764 | E614: =IF(VLOOKUP(RC[-3],Sheet1!R3C2:R803C11,10,FALSE)=0,"",VLOOKUP(Sheet2!RC[-3],Sheet1!R[1]C[-3]:R[801]C[6],10,FALSE)) ->  | F614: =Sheet1!R659C10 -> 5.3172321257248409 | G614: =IF(RC[-3]<0,0,IF(AND(RC[-3]<RC[-1],RC[-3]<2),100,IF(AND(RC[-3]<RC[-1],RC[-3]>=2,RC[-3]<3),95,IF(AND(RC[-3]<RC[-1],RC[-3]>=3,RC[-3]<4),90,IF(AND(RC[-3]<RC[-1],RC[-3]>=4,RC[-3]<5),85,IF(AND(RC[-3]<RC[-1],RC[-3]>=5,RC[-3]<6),80,IF(AND(RC[-3]<RC[-1],RC[-3]>=6,RC[-3]<7),75,IF(AND(RC[-3]<RC[-1],RC[-3]>=7,RC[-3]<8),70,IF(AND(RC[-3]<RC[-1],RC[-3]>=8,RC[-3]<9),65,IF(AND(RC[-3]<RC[-1],RC[-3]>=9,RC[-3]<10),60,IF(AND(RC[-3]<RC[-1],RC[-3]>=10,RC[-3]<11),55,IF(AND(RC[-3]<RC[-1],RC[-3]>=11,RC[-3]<12),50,IF(AND(RC[-3]<RC[-1],RC[-3]>=12,RC[-3]<13),45,IF(AND(RC[-3]<RC[-1],RC[-3]>=13,RC[-3]<14),40,IF(AND(RC[-3]<RC[-1],RC[-3]>=14,RC[-3]<15),35,IF(AND(RC[-3]<RC[-1],RC[-3]>=15,RC[-3]<16),30,IF(AND(RC[-3]<RC[-1],RC[-3]>=16,RC[-3]<17),25,IF(AND(RC[-3]<RC[-1],RC[-3]>=17,RC[-3]<18),20,IF(AND(RC[-3]<RC[-1],RC[-3]>=18,RC[-3]<19),15,IF(AND(RC[-3]<RC[-1],RC[-3]>=19,RC[-3]<20),10,IF(AND(RC[-3]<RC[-1],RC[-3]>=20,RC[-3]<21),5,IF(AND(RC[-3]<RC[-1],RC[-3]>=21),0,IF(AND(RC[-3]>RC[-1],RC[-3]>=2,RC[-3]<3),90,IF(AND(RC[-3]>RC[-1],RC[-3]>=3,RC[-3]<4),90,IF(AND(RC[-3]>RC[-1],RC[-3]>=4,RC[-3]<5),80,IF(AND(RC[-3]>RC[-1],RC[-3]>=5,RC[-3]<6),70,IF(AND(RC[-3]>RC[-1],RC[-3]>=6,RC[-3]<7),60,IF(AND(RC[-3]>RC[-1],RC[-3]>=7,RC[-3]<8),50,IF(AND(RC[-3]>RC[-1],RC[-3]>=8,RC[-3]<9),40,IF(AND(RC[-3]>RC[-1],RC[-3]>=9,RC[-3]<10),30,IF(AND(RC[-3]>RC[-1],RC[-3]>=10,RC[-3]<11),20,IF(AND(RC[-3]>RC[-1],RC[-3]>=11,RC[-3]<12),10,IF(AND(RC[-3]>RC[-1],RC[-3]>=12),0))))))))))))))))))))))))))))))))) -> 50 | H614: =IF(RC[-3]="","",IF(RC[-3]<0.3,100,IF(AND(RC[-3]>=0.3,RC[-3]>0.4),95,IF(AND(RC[-3]>=0.4,RC[-3]<0.5),90,IF(AND(RC[-3]>=0.5,RC[-3]<0.6),85,IF(AND(RC[-3]>=0.6,RC[-3]<0.7),80,IF(AND(RC[-3]>=0.6,RC[-3]<1),80,IF(AND(RC[-3]>1,RC[-3]<2),50,IF(RC[-3]>2,0))))))))) ->  | I614: =IF(RC[-1]="",RC[-2],0.7*RC[-1]+0.3*RC[-2]) -> 50
A615: بهسرام | B615: کهرام | C615: =VLOOKUP(RC[-1],Sheet1!R3C2:R802C3,2,FALSE) -> کاشی و سرامیک | D615: =VLOOKUP(RC[-2],Sheet1!R3C2:R802C9,8,FALSE) -> -16.030997304582211 | E615: =IF(VLOOKUP(RC[-3],Sheet1!R3C2:R803C11,10,FALSE)=0,"",VLOOKUP(Sheet2!RC[-3],Sheet1!R[1]C[-3]:R[801]C[6],10,FALSE)) ->  | F615: =Sheet1!R670C10 -> 5.1512135805536294 | G615: =IF(RC[-3]<0,0,IF(AND(RC[-3]<RC[-1],RC[-3]<2),100,IF(AND(RC[-3]<RC[-1],RC[-3]>=2,RC[-3]<3),95,IF(AND(RC[-3]<RC[-1],RC[-3]>=3,RC[-3]<4),90,IF(AND(RC[-3]<RC[-1],RC[-3]>=4,RC[-3]<5),85,IF(AND(RC[-3]<RC[-1],RC[-3]>=5,RC[-3]<6),80,IF(AND(RC[-3]<RC[-1],RC[-3]>=6,RC[-3]<7),75,IF(AND(RC[-3]<RC[-1],RC[-3]>=7,RC[-3]<8),70,IF(AND(RC[-3]<RC[-1],RC[-3]>=8,RC[-3]<9),65,IF(AND(RC[-3]<RC[-1],RC[-3]>=9,RC[-3]<10),60,IF(AND(RC[-3]<RC[-1],RC[-3]>=10,RC[-3]<11),55,IF(AND(RC[-3]<RC[-1],RC[-3]>=11,RC[-3]<12),50,IF(AND(RC[-3]<RC[-1],RC[-3]>=12,RC[-3]<13),45,IF(AND(RC[-3]<RC[-1],RC[-3]>=13,RC[-3]<14),40,IF(AND(RC[-3]<RC[-1],RC[-3]>=14,RC[-3]<15),35,IF(AND(RC[-3]<RC[-1],RC[-3]>=15,RC[-3]<16),30,IF(AND(RC[-3]<RC[-1],RC[-3]>=16,RC[-3]<17),25,IF(AND(RC[-3]<RC[-1],RC[-3]>=17,RC[-3]<18),20,IF(AND(RC[-3]<RC[-1],RC[-3]>=18,RC[-3]<19),15,IF(AND(RC[-3]<RC[-1],RC[-3]>=19,RC[-3]<20),10,IF(AND(RC[-3]<RC[-1],RC[-3]>=20,RC[-3]<21),5,IF(AND(RC[-3]<RC[-1],RC[-3]>=21),0,IF(AND(RC[-3]>RC[-1],RC[-3]>=2,RC[-3]<3),90,IF(AND(RC[-3]>RC[-1],RC[-3]>=3,RC[-3]<4),90,IF(AND(RC[-3]>RC[-1],RC[-3]>=4,RC[-3]<5),80,IF(AND(RC[-3]>RC[-1],RC[-3]>=5,RC[-3]<6),70,IF(AND(RC[-3]>RC[-1],RC[-3]>=6,RC[-3]<7),60,IF(AND(RC[-3]>RC[-1],RC[-3]>=7,RC[-3]<8),50,IF(AND(RC[-3]>RC[-1],RC[-3]>=8,RC[-3]<9),40,IF(AND(RC[-3]>RC[-1],RC[-3]>=9,RC[-3]<10),30,IF(AND(RC[-3]>RC[-1],RC[-3]>=10,RC[-3]<11),20,IF(AND(RC[-3]>RC[-1],RC[-3]>=11,RC[-3]<12),10,IF(AND(RC[-3]>RC[-1],RC[-3]>=12),0))))))))))))))))))))))))))))))))) -> 0 | H615: =IF(RC[-3]="","",IF(RC[-3]<0.3,100,IF(AND(RC[-3]>=0.3,RC[-3]>0.4),95,IF(AND(RC[-3]>=0.4,RC[-3]<0.5),90,IF(AND(RC[-3]>=0.5,RC[-3]<0.6),85,IF(AND(RC[-3]>=0.6,RC[-3]<0.7),80,IF(AND(RC[-3]>=0.6,RC[-3]<1),80,IF(AND(RC[-3]>1,RC[-3]<2),50,IF(RC[-3]>2,0))))))))) ->  | I615: =IF(RC[-1]="",RC[-2],0.7*RC[-1]+0.3*RC[-2]) -> 0
A616: کاشی اصفهان | B616: کاصفا | C616: =VLOOKUP(RC[-1],Sheet1!R3C2:R802C3,2,FALSE) -> کاشی و سرامیک | D616: =VLOOKUP(RC[-2],Sheet1!R3C2:R802C9,8,FALSE) -> 1.6407575757575759 | E616: =IF(VLOOKUP(RC[-3],Sheet1!R3C2:R803C11,10,FALSE)=0,"",VLOOKUP(Sheet2!RC[-3],Sheet1!R[1]C[-3]:R[801]C[6],10,FALSE)) ->  | F616: =Sheet1!R670C10 -> 5.1512135805536294 | G616: =IF(RC[-3]<0,0,IF(AND(RC[-3]<RC[-1],RC[-3]<2),100,IF(AND(RC[-3]<RC[-1],RC[-3]>=2,RC[-3]<3),95,IF(AND(RC[-3]<RC[-1],RC[-3]>=3,RC[-3]<4),90,IF(AND(RC[-3]<RC[-1],RC[-3]>=4,RC[-3]<5),85,IF(AND(RC[-3]<RC[-1],RC[-3]>=5,RC[-3]<6),80,IF(AND(RC[-3]<RC[-1],RC[-3]>=6,RC[-3]<7),75,IF(AND(RC[-3]<RC[-1],RC[-3]>=7,RC[-3]<8),70,IF(AND(RC[-3]<RC[-1],RC[-3]>=8,RC[-3]<9),65,IF(AND(RC[-3]<RC[-1],RC[-3]>=9,RC[-3]<10),60,IF(AND(RC[-3]<RC[-1],RC[-3]>=10,RC[-3]<11),55,IF(AND(RC[-3]<RC[-1],RC[-3]>=11,RC[-3]<12),50,IF(AND(RC[-3]<RC[-1],RC[-3]>=12,RC[-3]<13),45,IF(AND(RC[-3]<RC[-1],RC[-3]>=13,RC[-3]<14),40,IF(AND(RC[-3]<RC[-1],RC[-3]>=14,RC[-3]<15),35,IF(AND(RC[-3]<RC[-1],RC[-3]>=15,RC[-3]<16),30,IF(AND(RC[-3]<RC[-1],RC[-3]>=16,RC[-3]<17),25,IF(AND(RC[-3]<RC[-1],RC[-3]>=17,RC[-3]<18),20,IF(AND(RC[-3]<RC[-1],RC[-3]>=18,RC[-3]<19),15,IF(AND(RC[-3]<RC[-1],RC[-3]>=19,RC[-3]<20),10,IF(AND(RC[-3]<RC[-1],RC[-3]>=20,RC[-3]<21),5,IF(AND(RC[-3]<RC[-1],RC[-3]>=21),0,IF(AND(RC[-3]>RC[-1],RC[-3]>=2,RC[-3]<3),90,IF(AND(RC[-3]>RC[-1],RC[-3]>=3,RC[-3]<4),90,IF(AND(RC[-3]>RC[-1],RC[-3]>=4,RC[-3]<5),80,IF(AND(RC[-3]>RC[-1],RC[-3]>=5,RC[-3]<6),70,IF(AND(RC[-3]>RC[-1],RC[-3]>=6,RC[-3]<7),60,IF(AND(RC[-3]>RC[-1],RC[-3]>=7,RC[-3]<8),50,IF(AND(RC[-3]>RC[-1],RC[-3]>=8,RC[-3]<9),40,IF(AND(RC[-3]>RC[-1],RC[-3]>=9,RC[-3]<10),30,IF(AND(RC[-3]>RC[-1],RC[-3]>=10,RC[-3]<11),20,IF(AND(RC[-3]>RC[-1],RC[-3]>=11,RC[-3]<12),10,IF(AND(RC[-3]>RC[-1],RC[-3]>=12),0))))))))))))))))))))))))))))))))) -> 100 | H616: =IF(RC[-3]="","",IF(RC[-3]<0.3,100,IF(AND(RC[-3]>=0.3,RC[-3]>0.4),95,IF(AND(RC[-3]>=0.4,RC[-3]<0.5),90,IF(AND(RC[-3]>=0.5,RC[-3]<0.6),85,IF(AND(RC[-3]>=0.6,RC[-3]<0.7),80,IF(AND(RC[-3]>=0.6,RC[-3]<1),80,IF(AND(RC[-3]>1,RC[-3]<2),50,IF(RC[-3]>2,0))))))))) ->  | I616: =IF(RC[-1]="",RC[-2],0.7*RC[-1]+0.3*RC[-2]) -> 100
A617: کاشی الوند | B617: کلوند | C617: =VLOOKUP(RC[-1],Sheet1!R3C2:R802C3,2,FALSE) -> کاشی و سرامیک | D617: =VLOOKUP(RC[-2],Sheet1!R3C2:R802C9,8,FALSE) -> 6.4299581770383165 | E617: =IF(VLOOKUP(RC[-3],Sheet1!R3C2:R803C11,10,FALSE)=0,"",VLOOKUP(Sheet2!RC[-3],Sheet1!R[1]C[-3]:R[801]C[6],10,FALSE)) ->  | F617: =Sheet1!R670C10 -> 5.1512135805536294 | G617: =IF(RC[-3]<0,0,IF(AND(RC[-3]<RC[-1],RC[-3]<2),100,IF(AND(RC[-3]<RC[-1],RC[-3]>=2,RC[-3]<3),95,IF(AND(RC[-3]<RC[-1],RC[-3]>=3,RC[-3]<4),90,IF(AND(RC[-3]<RC[-1],RC[-3]>=4,RC[-3]<5),85,IF(AND(RC[-3]<RC[-1],RC[-3]>=5,RC[-3]<6),80,IF(AND(RC[-3]<RC[-1],RC[-3]>=6,RC[-3]<7),75,IF(AND(RC[-3]<RC[-1],RC[-3]>=7,RC[-3]<8),70,IF(AND(RC[-3]<RC[-1],RC[-3]>=8,RC[-3]<9),65,IF(AND(RC[-3]<RC[-1],RC[-3]>=9,RC[-3]<10),60,IF(AND(RC[-3]<RC[-1],RC[-3]>=10,RC[-3]<11),55,IF(AND(RC[-3]<RC[-1],RC[-3]>=11,RC[-3]<12),50,IF(AND(RC[-3]<RC[-1],RC[-3]>=12,RC[-3]<13),45,IF(AND(RC[-3]<RC[-1],RC[-3]>=13,RC[-3]<14),40,IF(AND(RC[-3]<RC[-1],RC[-3]>=14,RC[-3]<15),35,IF(AND(RC[-3]<RC[-1],RC[-3]>=15,RC[-3]<16),30,IF(AND(RC[-3]<RC[-1],RC[-3]>=16,RC[-3]<17),25,IF(AND(RC[-3]<RC[-1],RC[-3]>=17,RC[-3]<18),20,IF(AND(RC[-3]<RC[-1],RC[-3]>=18,RC[-3]<19),15,IF(AND(RC[-3]<RC[-1],RC[-3]>=19,RC[-3]<20),10,IF(AND(RC[-3]<RC[-1],RC[-3]>=20,RC[-3]<21),5,IF(AND(RC[-3]<RC[-1],RC[-3]>=21),0,IF(AND(RC[-3]>RC[-1],RC[-3]>=2,RC[-3]<3),90,IF(AND(RC[-3]>RC[-1],RC[-3]>=3,RC[-3]<4),90,IF(AND(RC[-3]>RC[-1],RC[-3]>=4,RC[-3]<5),80,IF(AND(RC[-3]>RC[-1],RC[-3]>=5,RC[-3]<6),70,IF(AND(RC[-3]>RC[-1],RC[-3]>=6,RC[-3]<7),60,IF(AND(RC[-3]>RC[-1],RC[-3]>=7,RC[-3]<8),50,IF(AND(RC[-3]>RC[-1],RC[-3]>=8,RC[-3]<9),40,IF(AND(RC[-3]>RC[-1],RC[-3]>=9,RC[-3]<10),30,IF(AND(RC[-3]>RC[-1],RC[-3]>=10,RC[-3]<11),20,IF(AND(RC[-3]>RC[-1],RC[-3]>=11,RC[-3]<12),10,IF(AND(RC[-3]>RC[-1],RC[-3]>=12),0))))))))))))))))))))))))))))))))) -> 60 | H617: =IF(RC[-3]="","",IF(RC[-3]<0.3,100,IF(AND(RC[-3]>=0.3,RC[-3]>0.4),95,IF(AND(RC[-3]>=0.4,RC[-3]<0.5),90,IF(AND(RC[-3]>=0.5,RC[-3]<0.6),85,IF(AND(RC[-3]>=0.6,RC[-3]<0.7),80,IF(AND(RC[-3]>=0.6,RC[-3]<1),80,IF(AND(RC[-3]>1,RC[-3]<2),50,IF(RC[-3]>2,0))))))))) ->  | I617: =IF(RC[-1]="",RC[-2],0.7*RC[-1]+0.3*RC[-2]) -> 60
A618: کاشی پارس | B618: کپارس | C618: =VLOOKUP(RC[-1],Sheet1!R3C2:R802C3,2,FALSE) -> کاشی و سرامیک | D618: =VLOOKUP(RC[-2],Sheet1!R3C2:R802C9,8,FALSE) -> 5.3753249894004265 | E618: =IF(VLOOKUP(RC[-3],Sheet1!R3C2:R803C11,10,FALSE)=0,"",VLOOKUP(Sheet2!RC[-3],Sheet1!R[1]C[-3]:R[801]C[6],10,FALSE)) ->  | F618: =Sheet1!R670C10 -> 5.1512135805536294 | G618: =IF(RC[-3]<0,0,IF(AND(RC[-3]<RC[-1],RC[-3]<2),100,IF(AND(RC[-3]<RC[-1],RC[-3]>=2,RC[-3]<3),95,IF(AND(RC[-3]<RC[-1],RC[-3]>=3,RC[-3]<4),90,IF(AND(RC[-3]<RC[-1],RC[-3]>=4,RC[-3]<5),85,IF(AND(RC[-3]<RC[-1],RC[-3]>=5,RC[-3]<6),80,IF(AND(RC[-3]<RC[-1],RC[-3]>=6,RC[-3]<7),75,IF(AND(RC[-3]<RC[-1],RC[-3]>=7,RC[-3]<8),70,IF(AND(RC[-3]<RC[-1],RC[-3]>=8,RC[-3]<9),65,IF(AND(RC[-3]<RC[-1],RC[-3]>=9,RC[-3]<10),60,IF(AND(RC[-3]<RC[-1],RC[-3]>=10,RC[-3]<11),55,IF(AND(RC[-3]<RC[-1],RC[-3]>=11,RC[-3]<12),50,IF(AND(RC[-3]<RC[-1],RC[-3]>=12,RC[-3]<13),45,IF(AND(RC[-3]<RC[-1],RC[-3]>=13,RC[-3]<14),40,IF(AND(RC[-3]<RC[-1],RC[-3]>=14,RC[-3]<15),35,IF(AND(RC[-3]<RC[-1],RC[-3]>=15,RC[-3]<16),30,IF(AND(RC[-3]<RC[-1],RC[-3]>=16,RC[-3]<17),25,IF(AND(RC[-3]<RC[-1],RC[-3]>=17,RC[-3]<18),20,IF(AND(RC[-3]<RC[-1],RC[-3]>=18,RC[-3]<19),15,IF(AND(RC[-3]<RC[-1],RC[-3]>=19,RC[-3]<20),10,IF(AND(RC[-3]<RC[-1],RC[-3]>=20,RC[-3]<21),5,IF(AND(RC[-3]<RC[-1],RC[-3]>=21),0,IF(AND(RC[-3]>RC[-1],RC[-3]>=2,RC[-3]<3),90,IF(AND(RC[-3]>RC[-1],RC[-3]>=3,RC[-3]<4),90,IF(AND(RC[-3]>RC[-1],RC[-3]>=4,RC[-3]<5),80,IF(AND(RC[-3]>RC[-1],RC[-3]>=5,RC[-3]<6),70,IF(AND(RC[-3]>RC[-1],RC[-3]>=6,RC[-3]<7),60,IF(AND(RC[-3]>RC[-1],RC[-3]>=7,RC[-3]<8),50,IF(AND(RC[-3]>RC[-1],RC[-3]>=8,RC[-3]<9),40,IF(AND(RC[-3]>RC[-1],RC[-3]>=9,RC[-3]<10),30,IF(AND(RC[-3]>RC[-1],RC[-3]>=10,RC[-3]<11),20,IF(AND(RC[-3]>RC[-1],RC[-3]>=11,RC[-3]<12),10,IF(AND(RC[-3]>RC[-1],RC[-3]>=12),0))))))))))))))))))))))))))))))))) -> 70 | H618: =IF(RC[-3]="","",IF(RC[-3]<0.3,100,IF(AND(RC[-3]>=0.3,RC[-3]>0.4),95,IF(AND(RC[-3]>=0.4,RC[-3]<0.5),90,IF(AND(RC[-3]>=0.5,RC[-3]<0.6),85,IF(AND(RC[-3]>=0.6,RC[-3]<0.7),80,IF(AND(RC[-3]>=0.6,RC[-3]<1),80,IF(AND(RC[-3]>1,RC[-3]<2),50,IF(RC[-3]>2,0))))))))) ->  | I618: =IF(RC[-1]="",RC[-2],0.7*RC[-1]+0.3*RC[-2]) -> 70
A619: کاشی تکسرام | B619: کترام | C619: =VLOOKUP(RC[-1],Sheet1!R3C2:R802C3,2,FALSE) -> کاشی و سرامیک | D619: =VLOOKUP(RC[-2],Sheet1!R3C2:R802C9,8,FALSE) -> 7.4608956894622223 | E619: =IF(VLOOKUP(RC[-3],Sheet1!R3C2:R803C11,10,FALSE)=0,"",VLOOKUP(Sheet2!RC[-3],Sheet1!R[1]C[-3]:R[801]C[6],10,FALSE)) ->  | F619: =Sheet1!R670C10 -> 5.1512135805536294 | G619: =IF(RC[-3]<0,0,IF(AND(RC[-3]<RC[-1],RC[-3]<2),100,IF(AND(RC[-3]<RC[-1],RC[-3]>=2,RC[-3]<3),95,IF(AND(RC[-3]<RC[-1],RC[-3]>=3,RC[-3]<4),90,IF(AND(RC[-3]<RC[-1],RC[-3]>=4,RC[-3]<5),85,IF(AND(RC[-3]<RC[-1],RC[-3]>=5,RC[-3]<6),80,IF(AND(RC[-3]<RC[-1],RC[-3]>=6,RC[-3]<7),75,IF(AND(RC[-3]<RC[-1],RC[-3]>=7,RC[-3]<8),70,IF(AND(RC[-3]<RC[-1],RC[-3]>=8,RC[-3]<9),65,IF(AND(RC[-3]<RC[-1],RC[-3]>=9,RC[-3]<10),60,IF(AND(RC[-3]<RC[-1],RC[-3]>=10,RC[-3]<11),55,IF(AND(RC[-3]<RC[-1],RC[-3]>=11,RC[-3]<12),50,IF(AND(RC[-3]<RC[-1],RC[-3]>=12,RC[-3]<13),45,IF(AND(RC[-3]<RC[-1],RC[-3]>=13,RC[-3]<14),40,IF(AND(RC[-3]<RC[-1],RC[-3]>=14,RC[-3]<15),35,IF(AND(RC[-3]<RC[-1],RC[-3]>=15,RC[-3]<16),30,IF(AND(RC[-3]<RC[-1],RC[-3]>=16,RC[-3]<17),25,IF(AND(RC[-3]<RC[-1],RC[-3]>=17,RC[-3]<18),20,IF(AND(RC[-3]<RC[-1],RC[-3]>=18,RC[-3]<19),15,IF(AND(RC[-3]<RC[-1],RC[-3]>=19,RC[-3]<20),10,IF(AND(RC[-3]<RC[-1],RC[-3]>=20,RC[-3]<21),5,IF(AND(RC[-3]<RC[-1],RC[-3]>=21),0,IF(AND(RC[-3]>RC[-1],RC[-3]>=2,RC[-3]<3),90,IF(AND(RC[-3]>RC[-1],RC[-3]>=3,RC[-3]<4),90,IF(AND(RC[-3]>RC[-1],RC[-3]>=4,RC[-3]<5),80,IF(AND(RC[-3]>RC[-1],RC[-3]>=5,RC[-3]<6),70,IF(AND(RC[-3]>RC[-1],RC[-3]>=6,RC[-3]<7),60,IF(AND(RC[-3]>RC[-1],RC[-3]>=7,RC[-3]<8),50,IF(AND(RC[-3]>RC[-1],RC[-3]>=8,RC[-3]<9),40,IF(AND(RC[-3]>RC[-1],RC[-3]>=9,RC[-3]<10),30,IF(AND(RC[-3]>RC[-1],RC[-3]>=10,RC[-3]<11),20,IF(AND(RC[-3]>RC[-1],RC[-3]>=11,RC[-3]<12),10,IF(AND(RC[-3]>RC[-1],RC[-3]>=12),0))))))))))))))))))))))))))))))))) -> 50 | H619: =IF(RC[-3]="","",IF(RC[-3]<0.3,100,IF(AND(RC[-3]>=0.3,RC[-3]>0.4),95,IF(AND(RC[-3]>=0.4,RC[-3]<0.5),90,IF(AND(RC[-3]>=0.5,RC[-3]<0.6),85,IF(AND(RC[-3]>=0.6,RC[-3]<0.7),80,IF(AND(RC[-3]>=0.6,RC[-3]<1),80,IF(AND(RC[-3]>1,RC[-3]<2),50,IF(RC[-3]>2,0))))))))) ->  | I619: =IF(RC[-1]="",RC[-2],0.7*RC[-1]+0.3*RC[-2]) -> 50
A620: کاشی حافظ | B620: کحافظ | C620: =VLOOKUP(RC[-1],Sheet1!R3C2:R802C3,2,FALSE) -> کاشی و سرامیک | D620: =VLOOKUP(RC[-2],Sheet1!R3C2:R802C9,8,FALSE) -> 5 | E620: =IF(VLOOKUP(RC[-3],Sheet1!R3C2:R803C11,10,FALSE)=0,"",VLOOKUP(Sheet2!RC[-3],Sheet1!R[1]C[-3]:R[801]C[6],10,FALSE)) ->  | F620: =Sheet1!R670C10 -> 5.1512135805536294 | G620: =IF(RC[-3]<0,0,IF(AND(RC[-3]<RC[-1],RC[-3]<2),100,IF(AND(RC[-3]<RC[-1],RC[-3]>=2,RC[-3]<3),95,IF(AND(RC[-3]<RC[-1],RC[-3]>=3,RC[-3]<4),90,IF(AND(RC[-3]<RC[-1],RC[-3]>=4,RC[-3]<5),85,IF(AND(RC[-3]<RC[-1],RC[-3]>=5,RC[-3]<6),80,IF(AND(RC[-3]<RC[-1],RC[-3]>=6,RC[-3]<7),75,IF(AND(RC[-3]<RC[-1],RC[-3]>=7,RC[-3]<8),70,IF(AND(RC[-3]<RC[-1],RC[-3]>=8,RC[-3]<9),65,IF(AND(RC[-3]<RC[-1],RC[-3]>=9,RC[-3]<10),60,IF(AND(RC[-3]<RC[-1],RC[-3]>=10,RC[-3]<11),55,IF(AND(RC[-3]<RC[-1],RC[-3]>=11,RC[-3]<12),50,IF(AND(RC[-3]<RC[-1],RC[-3]>=12,RC[-3]<13),45,IF(AND(RC[-3]<RC[-1],RC[-3]>=13,RC[-3]<14),40,IF(AND(RC[-3]<RC[-1],RC[-3]>=14,RC[-3]<15),35,IF(AND(RC[-3]<RC[-1],RC[-3]>=15,RC[-3]<16),30,IF(AND(RC[-3]<RC[-1],RC[-3]>=16,RC[-3]<17),25,IF(AND(RC[-3]<RC[-1],RC[-3]>=17,RC[-3]<18),20,IF(AND(RC[-3]<RC[-1],RC[-3]>=18,RC[-3]<19),15,IF(AND(RC[-3]<RC[-1],RC[-3]>=19,RC[-3]<20),10,IF(AND(RC[-3]<RC[-1],RC[-3]>=20,RC[-3]<21),5,IF(AND(RC[-3]<RC[-1],RC[-3]>=21),0,IF(AND(RC[-3]>RC[-1],RC[-3]>=2,RC[-3]<3),90,IF(AND(RC[-3]>RC[-1],RC[-3]>=3,RC[-3]<4),90,IF(AND(RC[-3]>RC[-1],RC[-3]>=4,RC[-3]<5),80,IF(AND(RC[-3]>RC[-1],RC[-3]>=5,RC[-3]<6),70,IF(AND(RC[-3]>RC[-1],RC[-3]>=6,RC[-3]<7),60,IF(AND(RC[-3]>RC[-1],RC[-3]>=7,RC[-3]<8),50,IF(AND(RC[-3]>RC[-1],RC[-3]>=8,RC[-3]<9),40,IF(AND(RC[-3]>RC[-1],RC[-3]>=9,RC[-3]<10),30,IF(AND(RC[-3]>RC[-1],RC[-3]>=10,RC[-3]<11),20,IF(AND(RC[-3]>RC[-1],RC[-3]>=11,RC[-3]<12),10,IF(AND(RC[-3]>RC[-1],RC[-3]>=12),0))))))))))))))))))))))))))))))))) -> 80 | H620: =IF(RC[-3]="","",IF(RC[-3]<0.3,100,IF(AND(RC[-3]>=0.3,RC[-3]>0.4),95,IF(AND(RC[-3]>=0.4,RC[-3]<0.5),90,IF(AND(RC[-3]>=0.5,RC[-3]<0.6),85,IF(AND(RC[-3]>=0.6,RC[-3]<0.7),80,IF(AND(RC[-3]>=0.6,RC[-3]<1),80,IF(AND(RC[-3]>1,RC[-3]<2),50,IF(RC[-3]>2,0))))))))) ->  | I620: =IF(RC[-1]="",RC[-2],0.7*RC[-1]+0.3*RC[-2]) -> 80
A621: کاشی سعدی | B621: کسعدی | C621: =VLOOKUP(RC[-1],Sheet1!R3C2:R802C3,2,FALSE) -> کاشی و سرامیک | D621: =VLOOKUP(RC[-2],Sheet1!R3C2:R802C9,8,FALSE) -> 7.7894532500802498 | E621: =IF(VLOOKUP(RC[-3],Sheet1!R3C2:R803C11,10,FALSE)=0,"",VLOOKUP(Sheet2!RC[-3],Sheet1!R[1]C[-3]:R[801]C[6],10,FALSE)) ->  | F621: =Sheet1!R670C10 -> 5.1512135805536294 | G621: =IF(RC[-3]<0,0,IF(AND(RC[-3]<RC[-1],RC[-3]<2),100,IF(AND(RC[-3]<RC[-1],RC[-3]>=2,RC[-3]<3),95,IF(AND(RC[-3]<RC[-1],RC[-3]>=3,RC[-3]<4),90,IF(AND(RC[-3]<RC[-1],RC[-3]>=4,RC[-3]<5),85,IF(AND(RC[-3]<RC[-1],RC[-3]>=5,RC[-3]<6),80,IF(AND(RC[-3]<RC[-1],RC[-3]>=6,RC[-3]<7),75,IF(AND(RC[-3]<RC[-1],RC[-3]>=7,RC[-3]<8),70,IF(AND(RC[-3]<RC[-1],RC[-3]>=8,RC[-3]<9),65,IF(AND(RC[-3]<RC[-1],RC[-3]>=9,RC[-3]<10),60,IF(AND(RC[-3]<RC[-1],RC[-3]>=10,RC[-3]<11),55,IF(AND(RC[-3]<RC[-1],RC[-3]>=11,RC[-3]<12),50,IF(AND(RC[-3]<RC[-1],RC[-3]>=12,RC[-3]<13),45,IF(AND(RC[-3]<RC[-1],RC[-3]>=13,RC[-3]<14),40,IF(AND(RC[-3]<RC[-1],RC[-3]>=14,RC[-3]<15),35,IF(AND(RC[-3]<RC[-1],RC[-3]>=15,RC[-3]<16),30,IF(AND(RC[-3]<RC[-1],RC[-3]>=16,RC[-3]<17),25,IF(AND(RC[-3]<RC[-1],RC[-3]>=17,RC[-3]<18),20,IF(AND(RC[-3]<RC[-1],RC[-3]>=18,RC[-3]<19),15,IF(AND(RC[-3]<RC[-1],RC[-3]>=19,RC[-3]<20),10,IF(AND(RC[-3]<RC[-1],RC[-3]>=20,RC[-3]<21),5,IF(AND(RC[-3]<RC[-1],RC[-3]>=21),0,IF(AND(RC[-3]>RC[-1],RC[-3]>=2,RC[-3]<3),90,IF(AND(RC[-3]>RC[-1],RC[-3]>=3,RC[-3]<4),90,IF(AND(RC[-3]>RC[-1],RC[-3]>=4,RC[-3]<5),80,IF(AND(RC[-3]>RC[-1],RC[-3]>=5,RC[-3]<6),70,IF(AND(RC[-3]>RC[-1],RC[-3]>=6,RC[-3]<7),60,IF(AND(RC[-3]>RC[-1],RC[-3]>=7,RC[-3]<8),50,IF(AND(RC[-3]>RC[-1],RC[-3]>=8,RC[-3]<9),40,IF(AND(RC[-3]>RC[-1],RC[-3]>=9,RC[-3]<10),30,IF(AND(RC[-3]>RC[-1],RC[-3]>=10,RC[-3]<11),20,IF(AND(RC[-3]>RC[-1],RC[-3]>=11,RC[-3]<12),10,IF(AND(RC[-3]>RC[-1],RC[-3]>=12),0))))))))))))))))))))))))))))))))) -> 50 | H621: =IF(RC[-3]="","",IF(RC[-3]<0.3,100,IF(AND(RC[-3]>=0.3,RC[-3]>0.4),95,IF(AND(RC[-3]>=0.4,RC[-3]<0.5),90,IF(AND(RC[-3]>=0.5,RC[-3]<0.6),85,IF(AND(RC[-3]>=0.6,RC[-3]<0.7),80,IF(AND(RC[-3]>=0.6,RC[-3]<1),80,IF(AND(RC[-3]>1,RC[-3]<2),50,IF(RC[-3]>2,0))))))))) ->  | I621: =IF(RC[-1]="",RC[-2],0.7*RC[-1]+0.3*RC[-2]) -> 50
A622: کاشی سینا | B622: کساوه | C622: =VLOOKUP(RC[-1],Sheet1!R3C2:R802C3,2,FALSE) -> کاشی و سرامیک | D622: =VLOOKUP(RC[-2],Sheet1!R3C2:R802C9,8,FALSE) -> 5.8646765680738122 | E622: =IF(VLOOKUP(RC[-3],Sheet1!R3C2:R803C11,10,FALSE)=0,"",VLOOKUP(Sheet2!RC[-3],Sheet1!R[1]C[-3]:R[801]C[6],10,FALSE)) ->  | F622: =Sheet1!R670C10 -> 5.1512135805536294 | G622: =IF(RC[-3]<0,0,IF(AND(RC[-3]<RC[-1],RC[-3]<2),100,IF(AND(RC[-3]<RC[-1],RC[-3]>=2,RC[-3]<3),95,IF(AND(RC[-3]<RC[-1],RC[-3]>=3,RC[-3]<4),90,IF(AND(RC[-3]<RC[-1],RC[-3]>=4,RC[-3]<5),85,IF(AND(RC[-3]<RC[-1],RC[-3]>=5,RC[-3]<6),80,IF(AND(RC[-3]<RC[-1],RC[-3]>=6,RC[-3]<7),75,IF(AND(RC[-3]<RC[-1],RC[-3]>=7,RC[-3]<8),70,IF(AND(RC[-3]<RC[-1],RC[-3]>=8,RC[-3]<9),65,IF(AND(RC[-3]<RC[-1],RC[-3]>=9,RC[-3]<10),60,IF(AND(RC[-3]<RC[-1],RC[-3]>=10,RC[-3]<11),55,IF(AND(RC[-3]<RC[-1],RC[-3]>=11,RC[-3]<12),50,IF(AND(RC[-3]<RC[-1],RC[-3]>=12,RC[-3]<13),45,IF(AND(RC[-3]<RC[-1],RC[-3]>=13,RC[-3]<14),40,IF(AND(RC[-3]<RC[-1],RC[-3]>=14,RC[-3]<15),35,IF(AND(RC[-3]<RC[-1],RC[-3]>=15,RC[-3]<16),30,IF(AND(RC[-3]<RC[-1],RC[-3]>=16,RC[-3]<17),25,IF(AND(RC[-3]<RC[-1],RC[-3]>=17,RC[-3]<18),20,IF(AND(RC[-3]<RC[-1],RC[-3]>=18,RC[-3]<19),15,IF(AND(RC[-3]<RC[-1],RC[-3]>=19,RC[-3]<20),10,IF(AND(RC[-3]<RC[-1],RC[-3]>=20,RC[-3]<21),5,IF(AND(RC[-3]<RC[-1],RC[-3]>=21),0,IF(AND(RC[-3]>RC[-1],RC[-3]>=2,RC[-3]<3),90,IF(AND(RC[-3]>RC[-1],RC[-3]>=3,RC[-3]<4),90,IF(AND(RC[-3]>RC[-1],RC[-3]>=4,RC[-3]<5),80,IF(AND(RC[-3]>RC[-1],RC[-3]>=5,RC[-3]<6),70,IF(AND(RC[-3]>RC[-1],RC[-3]>=6,RC[-3]<7),60,IF(AND(RC[-3]>RC[-1],RC[-3]>=7,RC[-3]<8),50,IF(AND(RC[-3]>RC[-1],RC[-3]>=8,RC[-3]<9),40,IF(AND(RC[-3]>RC[-1],RC[-3]>=9,RC[-3]<10),30,IF(AND(RC[-3]>RC[-1],RC[-3]>=10,RC[-3]<11),20,IF(AND(RC[-3]>RC[-1],RC[-3]>=11,RC[-3]<12),10,IF(AND(RC[-3]>RC[-1],RC[-3]>=12),0))))))))))))))))))))))))))))))))) -> 70 | H622: =IF(RC[-3]="","",IF(RC[-3]<0.3,100,IF(AND(RC[-3]>=0.3,RC[-3]>0.4),95,IF(AND(RC[-3]>=0.4,RC[-3]<0.5),90,IF(AND(RC[-3]>=0.5,RC[-3]<0.6),85,IF(AND(RC[-3]>=0.6,RC[-3]<0.7),80,IF(AND(RC[-3]>=0.6,RC[-3]<1),80,IF(AND(RC[-3]>1,RC[-3]<2),50,IF(RC[-3]>2,0))))))))) ->  | I622: =IF(RC[-1]="",RC[-2],0.7*RC[-1]+0.3*RC[-2]) -> 70
A623: کاشی صدف سرام استقلال آباده | B623: کصدف | C623: =VLOOKUP(RC[-1],Sheet1!R3C2:R802C3,2,FALSE) -> کاشی و سرامیک | D623: =VLOOKUP(RC[-2],Sheet1!R3C2:R802C9,8,FALSE) -> 8.6000344446463011 | E623: =IF(VLOOKUP(RC[-3],Sheet1!R3C2:R803C11,10,FALSE)=0,"",VLOOKUP(Sheet2!RC[-3],Sheet1!R[1]C[-3]:R[801]C[6],10,FALSE)) ->  | F623: =Sheet1!R670C10 -> 5.1512135805536294 | G623: =IF(RC[-3]<0,0,IF(AND(RC[-3]<RC[-1],RC[-3]<2),100,IF(AND(RC[-3]<RC[-1],RC[-3]>=2,RC[-3]<3),95,IF(AND(RC[-3]<RC[-1],RC[-3]>=3,RC[-3]<4),90,IF(AND(RC[-3]<RC[-1],RC[-3]>=4,RC[-3]<5),85,IF(AND(RC[-3]<RC[-1],RC[-3]>=5,RC[-3]<6),80,IF(AND(RC[-3]<RC[-1],RC[-3]>=6,RC[-3]<7),75,IF(AND(RC[-3]<RC[-1],RC[-3]>=7,RC[-3]<8),70,IF(AND(RC[-3]<RC[-1],RC[-3]>=8,RC[-3]<9),65,IF(AND(RC[-3]<RC[-1],RC[-3]>=9,RC[-3]<10),60,IF(AND(RC[-3]<RC[-1],RC[-3]>=10,RC[-3]<11),55,IF(AND(RC[-3]<RC[-1],RC[-3]>=11,RC[-3]<12),50,IF(AND(RC[-3]<RC[-1],RC[-3]>=12,RC[-3]<13),45,IF(AND(RC[-3]<RC[-1],RC[-3]>=13,RC[-3]<14),40,IF(AND(RC[-3]<RC[-1],RC[-3]>=14,RC[-3]<15),35,IF(AND(RC[-3]<RC[-1],RC[-3]>=15,RC[-3]<16),30,IF(AND(RC[-3]<RC[-1],RC[-3]>=16,RC[-3]<17),25,IF(AND(RC[-3]<RC[-1],RC[-3]>=17,RC[-3]<18),20,IF(AND(RC[-3]<RC[-1],RC[-3]>=18,RC[-3]<19),15,IF(AND(RC[-3]<RC[-1],RC[-3]>=19,RC[-3]<20),10,IF(AND(RC[-3]<RC[-1],RC[-3]>=20,RC[-3]<21),5,IF(AND(RC[-3]<RC[-1],RC[-3]>=21),0,IF(AND(RC[-3]>RC[-1],RC[-3]>=2,RC[-3]<3),90,IF(AND(RC[-3]>RC[-1],RC[-3]>=3,RC[-3]<4),90,IF(AND(RC[-3]>RC[-1],RC[-3]>=4,RC[-3]<5),80,IF(AND(RC[-3]>RC[-1],RC[-3]>=5,RC[-3]<6),70,IF(AND(RC[-3]>RC[-1],RC[-3]>=6,RC[-3]<7),60,IF(AND(RC[-3]>RC[-1],RC[-3]>=7,RC[-3]<8),50,IF(AND(RC[-3]>RC[-1],RC[-3]>=8,RC[-3]<9),40,IF(AND(RC[-3]>RC[-1],RC[-3]>=9,RC[-3]<10),30,IF(AND(RC[-3]>RC[-1],RC[-3]>=10,RC[-3]<11),20,IF(AND(RC[-3]>RC[-1],RC[-3]>=11,RC[-3]<12),10,IF(AND(RC[-3]>RC[-1],RC[-3]>=12),0))))))))))))))))))))))))))))))))) -> 40 | H623: =IF(RC[-3]="","",IF(RC[-3]<0.3,100,IF(AND(RC[-3]>=0.3,RC[-3]>0.4),95,IF(AND(RC[-3]>=0.4,RC[-3]<0.5),90,IF(AND(RC[-3]>=0.5,RC[-3]<0.6),85,IF(AND(RC[-3]>=0.6,RC[-3]<0.7),80,IF(AND(RC[-3]>=0.6,RC[-3]<1),80,IF(AND(RC[-3]>1,RC[-3]<2),50,IF(RC[-3]>2,0))))))))) ->  | I623: =IF(RC[-1]="",RC[-2],0.7*RC[-1]+0.3*RC[-2]) -> 40
A624: کاشی نیلو | B624: کنیلو | C624: =VLOOKUP(RC[-1],Sheet1!R3C2:R802C3,2,FALSE) -> کاشی و سرامیک | D624: =VLOOKUP(RC[-2],Sheet1!R3C2:R802C9,8,FALSE) -> -1.4469497607655504 | E624: =IF(VLOOKUP(RC[-3],Sheet1!R3C2:R803C11,10,FALSE)=0,"",VLOOKUP(Sheet2!RC[-3],Sheet1!R[1]C[-3]:R[801]C[6],10,FALSE)) ->  | F624: =Sheet1!R670C10 -> 5.1512135805536294 | G624: =IF(RC[-3]<0,0,IF(AND(RC[-3]<RC[-1],RC[-3]<2),100,IF(AND(RC[-3]<RC[-1],RC[-3]>=2,RC[-3]<3),95,IF(AND(RC[-3]<RC[-1],RC[-3]>=3,RC[-3]<4),90,IF(AND(RC[-3]<RC[-1],RC[-3]>=4,RC[-3]<5),85,IF(AND(RC[-3]<RC[-1],RC[-3]>=5,RC[-3]<6),80,IF(AND(RC[-3]<RC[-1],RC[-3]>=6,RC[-3]<7),75,IF(AND(RC[-3]<RC[-1],RC[-3]>=7,RC[-3]<8),70,IF(AND(RC[-3]<RC[-1],RC[-3]>=8,RC[-3]<9),65,IF(AND(RC[-3]<RC[-1],RC[-3]>=9,RC[-3]<10),60,IF(AND(RC[-3]<RC[-1],RC[-3]>=10,RC[-3]<11),55,IF(AND(RC[-3]<RC[-1],RC[-3]>=11,RC[-3]<12),50,IF(AND(RC[-3]<RC[-1],RC[-3]>=12,RC[-3]<13),45,IF(AND(RC[-3]<RC[-1],RC[-3]>=13,RC[-3]<14),40,IF(AND(RC[-3]<RC[-1],RC[-3]>=14,RC[-3]<15),35,IF(AND(RC[-3]<RC[-1],RC[-3]>=15,RC[-3]<16),30,IF(AND(RC[-3]<RC[-1],RC[-3]>=16,RC[-3]<17),25,IF(AND(RC[-3]<RC[-1],RC[-3]>=17,RC[-3]<18),20,IF(AND(RC[-3]<RC[-1],RC[-3]>=18,RC[-3]<19),15,IF(AND(RC[-3]<RC[-1],RC[-3]>=19,RC[-3]<20),10,IF(AND(RC[-3]<RC[-1],RC[-3]>=20,RC[-3]<21),5,IF(AND(RC[-3]<RC[-1],RC[-3]>=21),0,IF(AND(RC[-3]>RC[-1],RC[-3]>=2,RC[-3]<3),90,IF(AND(RC[-3]>RC[-1],RC[-3]>=3,RC[-3]<4),90,IF(AND(RC[-3]>RC[-1],RC[-3]>=4,RC[-3]<5),80,IF(AND(RC[-3]>RC[-1],RC[-3]>=5,RC[-3]<6),70,IF(AND(RC[-3]>RC[-1],RC[-3]>=6,RC[-3]<7),60,IF(AND(RC[-3]>RC[-1],RC[-3]>=7,RC[-3]<8),50,IF(AND(RC[-3]>RC[-1],RC[-3]>=8,RC[-3]<9),40,IF(AND(RC[-3]>RC[-1],RC[-3]>=9,RC[-3]<10),30,IF(AND(RC[-3]>RC[-1],RC[-3]>=10,RC[-3]<11),20,IF(AND(RC[-3]>RC[-1],RC[-3]>=11,RC[-3]<12),10,IF(AND(RC[-3]>RC[-1],RC[-3]>=12),0))))))))))))))))))))))))))))))))) -> 0 | H624: =IF(RC[-3]="","",IF(RC[-3]<0.3,100,IF(AND(RC[-3]>=0.3,RC[-3]>0.4),95,IF(AND(RC[-3]>=0.4,RC[-3]<0.5),90,IF(AND(RC[-3]>=0.5,RC[-3]<0.6),85,IF(AND(RC[-3]>=0.6,RC[-3]<0.7),80,IF(AND(RC[-3]>=0.6,RC[-3]<1),80,IF(AND(RC[-3]>1,RC[-3]<2),50,IF(RC[-3]>2,0))))))))) ->  | I624: =IF(RC[-1]="",RC[-2],0.7*RC[-1]+0.3*RC[-2]) -> 0
A625: آذریت | B625: ساذری | C625: =VLOOKUP(RC[-1],Sheet1!R3C2:R802C3,2,FALSE) -> کانی غیر فلزی | D625: =VLOOKUP(RC[-2],Sheet1!R3C2:R802C9,8,FALSE) -> 86.223842582754429 | E625: =IF(VLOOKUP(RC[-3],Sheet1!R3C2:R803C11,10,FALSE)=0,"",VLOOKUP(Sheet2!RC[-3],Sheet1!R[1]C[-3]:R[801]C[6],10,FALSE)) ->  | F625: =Sheet1!R696C10 -> 31.547386804071571 | G625: =IF(RC[-3]<0,0,IF(AND(RC[-3]<RC[-1],RC[-3]<2),100,IF(AND(RC[-3]<RC[-1],RC[-3]>=2,RC[-3]<3),95,IF(AND(RC[-3]<RC[-1],RC[-3]>=3,RC[-3]<4),90,IF(AND(RC[-3]<RC[-1],RC[-3]>=4,RC[-3]<5),85,IF(AND(RC[-3]<RC[-1],RC[-3]>=5,RC[-3]<6),80,IF(AND(RC[-3]<RC[-1],RC[-3]>=6,RC[-3]<7),75,IF(AND(RC[-3]<RC[-1],RC[-3]>=7,RC[-3]<8),70,IF(AND(RC[-3]<RC[-1],RC[-3]>=8,RC[-3]<9),65,IF(AND(RC[-3]<RC[-1],RC[-3]>=9,RC[-3]<10),60,IF(AND(RC[-3]<RC[-1],RC[-3]>=10,RC[-3]<11),55,IF(AND(RC[-3]<RC[-1],RC[-3]>=11,RC[-3]<12),50,IF(AND(RC[-3]<RC[-1],RC[-3]>=12,RC[-3]<13),45,IF(AND(RC[-3]<RC[-1],RC[-3]>=13,RC[-3]<14),40,IF(AND(RC[-3]<RC[-1],RC[-3]>=14,RC[-3]<15),35,IF(AND(RC[-3]<RC[-1],RC[-3]>=15,RC[-3]<16),30,IF(AND(RC[-3]<RC[-1],RC[-3]>=16,RC[-3]<17),25,IF(AND(RC[-3]<RC[-1],RC[-3]>=17,RC[-3]<18),20,IF(AND(RC[-3]<RC[-1],RC[-3]>=18,RC[-3]<19),15,IF(AND(RC[-3]<RC[-1],RC[-3]>=19,RC[-3]<20),10,IF(AND(RC[-3]<RC[-1],RC[-3]>=20,RC[-3]<21),5,IF(AND(RC[-3]<RC[-1],RC[-3]>=21),0,IF(AND(RC[-3]>RC[-1],RC[-3]>=2,RC[-3]<3),90,IF(AND(RC[-3]>RC[-1],RC[-3]>=3,RC[-3]<4),90,IF(AND(RC[-3]>RC[-1],RC[-3]>=4,RC[-3]<5),80,IF(AND(RC[-3]>RC[-1],RC[-3]>=5,RC[-3]<6),70,IF(AND(RC[-3]>RC[-1],RC[-3]>=6,RC[-3]<7),60,IF(AND(RC[-3]>RC[-1],RC[-3]>=7,RC[-3]<8),50,IF(AND(RC[-3]>RC[-1],RC[-3]>=8,RC[-3]<9),40,IF(AND(RC[-3]>RC[-1],RC[-3]>=9,RC[-3]<10),30,IF(AND(RC[-3]>RC[-1],RC[-3]>=10,RC[-3]<11),20,IF(AND(RC[-3]>RC[-1],RC[-3]>=11,RC[-3]<12),10,IF(AND(RC[-3]>RC[-1],RC[-3]>=12),0))))))))))))))))))))))))))))))))) -> 0 | H625: =IF(RC[-3]="","",IF(RC[-3]<0.3,100,IF(AND(RC[-3]>=0.3,RC[-3]>0.4),95,IF(AND(RC[-3]>=0.4,RC[-3]<0.5),90,IF(AND(RC[-3]>=0.5,RC[-3]<0.6),85,IF(AND(RC[-3]>=0.6,RC[-3]<0.7),80,IF(AND(RC[-3]>=0.6,RC[-3]<1),80,IF(AND(RC[-3]>1,RC[-3]<2),50,IF(RC[-3]>2,0))))))))) ->  | I625: =IF(RC[-1]="",RC[-2],0.7*RC[-1]+0.3*RC[-2]) -> 0
A626: ایتالران | B626: کایتا | C626: =VLOOKUP(RC[-1],Sheet1!R3C2:R802C3,2,FALSE) -> کانی غیر فلزی | D626: =VLOOKUP(RC[-2],Sheet1!R3C2:R802C9,8,FALSE) -> 890.88758958884159 | E626: =IF(VLOOKUP(RC[-3],Sheet1!R3C2:R803C11,10,FALSE)=0,"",VLOOKUP(Sheet2!RC[-3],Sheet1!R[1]C[-3]:R[801]C[6],10,FALSE)) ->  | F626: =Sheet1!R696C10 -> 31.547386804071571 | G626: =IF(RC[-3]<0,0,IF(AND(RC[-3]<RC[-1],RC[-3]<2),100,IF(AND(RC[-3]<RC[-1],RC[-3]>=2,RC[-3]<3),95,IF(AND(RC[-3]<RC[-1],RC[-3]>=3,RC[-3]<4),90,IF(AND(RC[-3]<RC[-1],RC[-3]>=4,RC[-3]<5),85,IF(AND(RC[-3]<RC[-1],RC[-3]>=5,RC[-3]<6),80,IF(AND(RC[-3]<RC[-1],RC[-3]>=6,RC[-3]<7),75,IF(AND(RC[-3]<RC[-1],RC[-3]>=7,RC[-3]<8),70,IF(AND(RC[-3]<RC[-1],RC[-3]>=8,RC[-3]<9),65,IF(AND(RC[-3]<RC[-1],RC[-3]>=9,RC[-3]<10),60,IF(AND(RC[-3]<RC[-1],RC[-3]>=10,RC[-3]<11),55,IF(AND(RC[-3]<RC[-1],RC[-3]>=11,RC[-3]<12),50,IF(AND(RC[-3]<RC[-1],RC[-3]>=12,RC[-3]<13),45,IF(AND(RC[-3]<RC[-1],RC[-3]>=13,RC[-3]<14),40,IF(AND(RC[-3]<RC[-1],RC[-3]>=14,RC[-3]<15),35,IF(AND(RC[-3]<RC[-1],RC[-3]>=15,RC[-3]<16),30,IF(AND(RC[-3]<RC[-1],RC[-3]>=16,RC[-3]<17),25,IF(AND(RC[-3]<RC[-1],RC[-3]>=17,RC[-3]<18),20,IF(AND(RC[-3]<RC[-1],RC[-3]>=18,RC[-3]<19),15,IF(AND(RC[-3]<RC[-1],RC[-3]>=19,RC[-3]<20),10,IF(AND(RC[-3]<RC[-1],RC[-3]>=20,RC[-3]<21),5,IF(AND(RC[-3]<RC[-1],RC[-3]>=21),0,IF(AND(RC[-3]>RC[-1],RC[-3]>=2,RC[-3]<3),90,IF(AND(RC[-3]>RC[-1],RC[-3]>=3,RC[-3]<4),90,IF(AND(RC[-3]>RC[-1],RC[-3]>=4,RC[-3]<5),80,IF(AND(RC[-3]>RC[-1],RC[-3]>=5,RC[-3]<6),70,IF(AND(RC[-3]>RC[-1],RC[-3]>=6,RC[-3]<7),60,IF(AND(RC[-3]>RC[-1],RC[-3]>=7,RC[-3]<8),50,IF(AND(RC[-3]>RC[-1],RC[-3]>=8,RC[-3]<9),40,IF(AND(RC[-3]>RC[-1],RC[-3]>=9,RC[-3]<10),30,IF(AND(RC[-3]>RC[-1],RC[-3]>=10,RC[-3]<11),20,IF(AND(RC[-3]>RC[-1],RC[-3]>=11,RC[-3]<12),10,IF(AND(RC[-3]>RC[-1],RC[-3]>=12),0))))))))))))))))))))))))))))))))) -> 0 | H626: =IF(RC[-3]="","",IF(RC[-3]<0.3,100,IF(AND(RC[-3]>=0.3,RC[-3]>0.4),95,IF(AND(RC[-3]>=0.4,RC[-3]<0.5),90,IF(AND(RC[-3]>=0.5,RC[-3]<0.6),85,IF(AND(RC[-3]>=0.6,RC[-3]<0.7),80,IF(AND(RC[-3]>=0.6,RC[-3]<1),80,IF(AND(RC[-3]>1,RC[-3]<2),50,IF(RC[-3]>2,0))))))))) ->  | I626: =IF(RC[-1]="",RC[-2],0.7*RC[-1]+0.3*RC[-2]) -> 0
A627: ایرانیت | B627: سایرا | C627: =VLOOKUP(RC[-1],Sheet1!R3C2:R802C3,2,FALSE) -> کانی غیر فلزی | D627: =VLOOKUP(RC[-2],Sheet1!R3C2:R802C9,8,FALSE) -> -15.579633568575943 | E627: =IF(VLOOKUP(RC[-3],Sheet1!R3C2:R803C11,10,FALSE)=0,"",VLOOKUP(Sheet2!RC[-3],Sheet1!R[1]C[-3]:R[801]C[6],10,FALSE)) ->  | F627: =Sheet1!R696C10 -> 31.547386804071571 | G627: =IF(RC[-3]<0,0,IF(AND(RC[-3]<RC[-1],RC[-3]<2),100,IF(AND(RC[-3]<RC[-1],RC[-3]>=2,RC[-3]<3),95,IF(AND(RC[-3]<RC[-1],RC[-3]>=3,RC[-3]<4),90,IF(AND(RC[-3]<RC[-1],RC[-3]>=4,RC[-3]<5),85,IF(AND(RC[-3]<RC[-1],RC[-3]>=5,RC[-3]<6),80,IF(AND(RC[-3]<RC[-1],RC[-3]>=6,RC[-3]<7),75,IF(AND(RC[-3]<RC[-1],RC[-3]>=7,RC[-3]<8),70,IF(AND(RC[-3]<RC[-1],RC[-3]>=8,RC[-3]<9),65,IF(AND(RC[-3]<RC[-1],RC[-3]>=9,RC[-3]<10),60,IF(AND(RC[-3]<RC[-1],RC[-3]>=10,RC[-3]<11),55,IF(AND(RC[-3]<RC[-1],RC[-3]>=11,RC[-3]<12),50,IF(AND(RC[-3]<RC[-1],RC[-3]>=12,RC[-3]<13),45,IF(AND(RC[-3]<RC[-1],RC[-3]>=13,RC[-3]<14),40,IF(AND(RC[-3]<RC[-1],RC[-3]>=14,RC[-3]<15),35,IF(AND(RC[-3]<RC[-1],RC[-3]>=15,RC[-3]<16),30,IF(AND(RC[-3]<RC[-1],RC[-3]>=16,RC[-3]<17),25,IF(AND(RC[-3]<RC[-1],RC[-3]>=17,RC[-3]<18),20,IF(AND(RC[-3]<RC[-1],RC[-3]>=18,RC[-3]<19),15,IF(AND(RC[-3]<RC[-1],RC[-3]>=19,RC[-3]<20),10,IF(AND(RC[-3]<RC[-1],RC[-3]>=20,RC[-3]<21),5,IF(AND(RC[-3]<RC[-1],RC[-3]>=21),0,IF(AND(RC[-3]>RC[-1],RC[-3]>=2,RC[-3]<3),90,IF(AND(RC[-3]>RC[-1],RC[-3]>=3,RC[-3]<4),90,IF(AND(RC[-3]>RC[-1],RC[-3]>=4,RC[-3]<5),80,IF(AND(RC[-3]>RC[-1],RC[-3]>=5,RC[-3]<6),70,IF(AND(RC[-3]>RC[-1],RC[-3]>=6,RC[-3]<7),60,IF(AND(RC[-3]>RC[-1],RC[-3]>=7,RC[-3]<8),50,IF(AND(RC[-3]>RC[-1],RC[-3]>=8,RC[-3]<9),40,IF(AND(RC[-3]>RC[-1],RC[-3]>=9,RC[-3]<10),30,IF(AND(RC[-3]>RC[-1],RC[-3]>=10,RC[-3]<11),20,IF(AND(RC[-3]>RC[-1],RC[-3]>=11,RC[-3]<12),10,IF(AND(RC[-3]>RC[-1],RC[-3]>=12),0))))))))))))))))))))))))))))))))) -> 0 | H627: =IF(RC[-3]="","",IF(RC[-3]<0.3,100,IF(AND(RC[-3]>=0.3,RC[-3]>0.4),95,IF(AND(RC[-3]>=0.4,RC[-3]<0.5),90,IF(AND(RC[-3]>=0.5,RC[-3]<0.6),85,IF(AND(RC[-3]>=0.6,RC[-3]<0.7),80,IF(AND(RC[-3]>=0.6,RC[-3]<1),80,IF(AND(RC[-3]>1,RC[-3]<2),50,IF(RC[-3]>2,0))))))))) ->  | I627: =IF(RC[-1]="",RC[-2],0.7*RC[-1]+0.3*RC[-2]) -> 0
A628: پارس سرام | B628: کسرام | C628: =VLOOKUP(RC[-1],Sheet1!R3C2:R802C3,2,FALSE) -> کانی غیر فلزی | D628: =VLOOKUP(RC[-2],Sheet1!R3C2:R802C9,8,FALSE) -> 35.184962881275275 | E628: =IF(VLOOKUP(RC[-3],Sheet1!R3C2:R803C11,10,FALSE)=0,"",VLOOKUP(Sheet2!RC[-3],Sheet1!R[1]C[-3]:R[801]C[6],10,FALSE)) ->  | F628: =Sheet1!R696C10 -> 31.547386804071571 | G628: =IF(RC[-3]<0,0,IF(AND(RC[-3]<RC[-1],RC[-3]<2),100,IF(AND(RC[-3]<RC[-1],RC[-3]>=2,RC[-3]<3),95,IF(AND(RC[-3]<RC[-1],RC[-3]>=3,RC[-3]<4),90,IF(AND(RC[-3]<RC[-1],RC[-3]>=4,RC[-3]<5),85,IF(AND(RC[-3]<RC[-1],RC[-3]>=5,RC[-3]<6),80,IF(AND(RC[-3]<RC[-1],RC[-3]>=6,RC[-3]<7),75,IF(AND(RC[-3]<RC[-1],RC[-3]>=7,RC[-3]<8),70,IF(AND(RC[-3]<RC[-1],RC[-3]>=8,RC[-3]<9),65,IF(AND(RC[-3]<RC[-1],RC[-3]>=9,RC[-3]<10),60,IF(AND(RC[-3]<RC[-1],RC[-3]>=10,RC[-3]<11),55,IF(AND(RC[-3]<RC[-1],RC[-3]>=11,RC[-3]<12),50,IF(AND(RC[-3]<RC[-1],RC[-3]>=12,RC[-3]<13),45,IF(AND(RC[-3]<RC[-1],RC[-3]>=13,RC[-3]<14),40,IF(AND(RC[-3]<RC[-1],RC[-3]>=14,RC[-3]<15),35,IF(AND(RC[-3]<RC[-1],RC[-3]>=15,RC[-3]<16),30,IF(AND(RC[-3]<RC[-1],RC[-3]>=16,RC[-3]<17),25,IF(AND(RC[-3]<RC[-1],RC[-3]>=17,RC[-3]<18),20,IF(AND(RC[-3]<RC[-1],RC[-3]>=18,RC[-3]<19),15,IF(AND(RC[-3]<RC[-1],RC[-3]>=19,RC[-3]<20),10,IF(AND(RC[-3]<RC[-1],RC[-3]>=20,RC[-3]<21),5,IF(AND(RC[-3]<RC[-1],RC[-3]>=21),0,IF(AND(RC[-3]>RC[-1],RC[-3]>=2,RC[-3]<3),90,IF(AND(RC[-3]>RC[-1],RC[-3]>=3,RC[-3]<4),90,IF(AND(RC[-3]>RC[-1],RC[-3]>=4,RC[-3]<5),80,IF(AND(RC[-3]>RC[-1],RC[-3]>=5,RC[-3]<6),70,IF(AND(RC[-3]>RC[-1],RC[-3]>=6,RC[-3]<7),60,IF(AND(RC[-3]>RC[-1],RC[-3]>=7,RC[-3]<8),50,IF(AND(RC[-3]>RC[-1],RC[-3]>=8,RC[-3]<9),40,IF(AND(RC[-3]>RC[-1],RC[-3]>=9,RC[-3]<10),30,IF(AND(RC[-3]>RC[-1],RC[-3]>=10,RC[-3]<11),20,IF(AND(RC[-3]>RC[-1],RC[-3]>=11,RC[-3]<12),10,IF(AND(RC[-3]>RC[-1],RC[-3]>=12),0))))))))))))))))))))))))))))))))) -> 0 | H628: =IF(RC[-3]="","",IF(RC[-3]<0.3,100,IF(AND(RC[-3]>=0.3,RC[-3]>0.4),95,IF(AND(RC[-3]>=0.4,RC[-3]<0.5),90,IF(AND(RC[-3]>=0.5,RC[-3]<0.6),85,IF(AND(RC[-3]>=0.6,RC[-3]<0.7),80,IF(AND(RC[-3]>=0.6,RC[-3]<1),80,IF(AND(RC[-3]>1,RC[-3]<2),50,IF(RC[-3]>2,0))))))))) ->  | I628: =IF(RC[-1]="",RC[-2],0.7*RC[-1]+0.3*RC[-2]) -> 0
A629: پرمیت | B629: سپرمی | C629: =VLOOKUP(RC[-1],Sheet1!R3C2:R802C3,2,FALSE) -> کانی غیر فلزی | D629: =VLOOKUP(RC[-2],Sheet1!R3C2:R802C9,8,FALSE) -> 11.559278350515465 | E629: =IF(VLOOKUP(RC[-3],Sheet1!R3C2:R803C11,10,FALSE)=0,"",VLOOKUP(Sheet2!RC[-3],Sheet1!R[1]C[-3]:R[801]C[6],10,FALSE)) ->  | F629: =Sheet1!R696C10 -> 31.547386804071571 | G629: =IF(RC[-3]<0,0,IF(AND(RC[-3]<RC[-1],RC[-3]<2),100,IF(AND(RC[-3]<RC[-1],RC[-3]>=2,RC[-3]<3),95,IF(AND(RC[-3]<RC[-1],RC[-3]>=3,RC[-3]<4),90,IF(AND(RC[-3]<RC[-1],RC[-3]>=4,RC[-3]<5),85,IF(AND(RC[-3]<RC[-1],RC[-3]>=5,RC[-3]<6),80,IF(AND(RC[-3]<RC[-1],RC[-3]>=6,RC[-3]<7),75,IF(AND(RC[-3]<RC[-1],RC[-3]>=7,RC[-3]<8),70,IF(AND(RC[-3]<RC[-1],RC[-3]>=8,RC[-3]<9),65,IF(AND(RC[-3]<RC[-1],RC[-3]>=9,RC[-3]<10),60,IF(AND(RC[-3]<RC[-1],RC[-3]>=10,RC[-3]<11),55,IF(AND(RC[-3]<RC[-1],RC[-3]>=11,RC[-3]<12),50,IF(AND(RC[-3]<RC[-1],RC[-3]>=12,RC[-3]<13),45,IF(AND(RC[-3]<RC[-1],RC[-3]>=13,RC[-3]<14),40,IF(AND(RC[-3]<RC[-1],RC[-3]>=14,RC[-3]<15),35,IF(AND(RC[-3]<RC[-1],RC[-3]>=15,RC[-3]<16),30,IF(AND(RC[-3]<RC[-1],RC[-3]>=16,RC[-3]<17),25,IF(AND(RC[-3]<RC[-1],RC[-3]>=17,RC[-3]<18),20,IF(AND(RC[-3]<RC[-1],RC[-3]>=18,RC[-3]<19),15,IF(AND(RC[-3]<RC[-1],RC[-3]>=19,RC[-3]<20),10,IF(AND(RC[-3]<RC[-1],RC[-3]>=20,RC[-3]<21),5,IF(AND(RC[-3]<RC[-1],RC[-3]>=21),0,IF(AND(RC[-3]>RC[-1],RC[-3]>=2,RC[-3]<3),90,IF(AND(RC[-3]>RC[-1],RC[-3]>=3,RC[-3]<4),90,IF(AND(RC[-3]>RC[-1],RC[-3]>=4,RC[-3]<5),80,IF(AND(RC[-3]>RC[-1],RC[-3]>=5,RC[-3]<6),70,IF(AND(RC[-3]>RC[-1],RC[-3]>=6,RC[-3]<7),60,IF(AND(RC[-3]>RC[-1],RC[-3]>=7,RC[-3]<8),50,IF(AND(RC[-3]>RC[-1],RC[-3]>=8,RC[-3]<9),40,IF(AND(RC[-3]>RC[-1],RC[-3]>=9,RC[-3]<10),30,IF(AND(RC[-3]>RC[-1],RC[-3]>=10,RC[-3]<11),20,IF(AND(RC[-3]>RC[-1],RC[-3]>=11,RC[-3]<12),10,IF(AND(RC[-3]>RC[-1],RC[-3]>=12),0))))))))))))))))))))))))))))))))) -> 50 | H629: =IF(RC[-3]="","",IF(RC[-3]<0.3,100,IF(AND(RC[-3]>=0.3,RC[-3]>0.4),95,IF(AND(RC[-3]>=0.4,RC[-3]<0.5),90,IF(AND(RC[-3]>=0.5,RC[-3]<0.6),85,IF(AND(RC[-3]>=0.6,RC[-3]<0.7),80,IF(AND(RC[-3]>=0.6,RC[-3]<1),80,IF(AND(RC[-3]>1,RC[-3]<2),50,IF(RC[-3]>2,0))))))))) ->  | I629: =IF(RC[-1]="",RC[-2],0.7*RC[-1]+0.3*RC[-2]) -> 50
A630: پشم شیشه ایران | B630: کپشیر | C630: =VLOOKUP(RC[-1],Sheet1!R3C2:R802C3,2,FALSE) -> کانی غیر فلزی | D630: =VLOOKUP(RC[-2],Sheet1!R3C2:R802C9,8,FALSE) -> 7.4535344080567176 | E630: =IF(VLOOKUP(RC[-3],Sheet1!R3C2:R803C11,10,FALSE)=0,"",VLOOKUP(Sheet2!RC[-3],Sheet1!R[1]C[-3]:R[801]C[6],10,FALSE)) ->  | F630: =Sheet1!R696C10 -> 31.547386804071571 | G630: =IF(RC[-3]<0,0,IF(AND(RC[-3]<RC[-1],RC[-3]<2),100,IF(AND(RC[-3]<RC[-1],RC[-3]>=2,RC[-3]<3),95,IF(AND(RC[-3]<RC[-1],RC[-3]>=3,RC[-3]<4),90,IF(AND(RC[-3]<RC[-1],RC[-3]>=4,RC[-3]<5),85,IF(AND(RC[-3]<RC[-1],RC[-3]>=5,RC[-3]<6),80,IF(AND(RC[-3]<RC[-1],RC[-3]>=6,RC[-3]<7),75,IF(AND(RC[-3]<RC[-1],RC[-3]>=7,RC[-3]<8),70,IF(AND(RC[-3]<RC[-1],RC[-3]>=8,RC[-3]<9),65,IF(AND(RC[-3]<RC[-1],RC[-3]>=9,RC[-3]<10),60,IF(AND(RC[-3]<RC[-1],RC[-3]>=10,RC[-3]<11),55,IF(AND(RC[-3]<RC[-1],RC[-3]>=11,RC[-3]<12),50,IF(AND(RC[-3]<RC[-1],RC[-3]>=12,RC[-3]<13),45,IF(AND(RC[-3]<RC[-1],RC[-3]>=13,RC[-3]<14),40,IF(AND(RC[-3]<RC[-1],RC[-3]>=14,RC[-3]<15),35,IF(AND(RC[-3]<RC[-1],RC[-3]>=15,RC[-3]<16),30,IF(AND(RC[-3]<RC[-1],RC[-3]>=16,RC[-3]<17),25,IF(AND(RC[-3]<RC[-1],RC[-3]>=17,RC[-3]<18),20,IF(AND(RC[-3]<RC[-1],RC[-3]>=18,RC[-3]<19),15,IF(AND(RC[-3]<RC[-1],RC[-3]>=19,RC[-3]<20),10,IF(AND(RC[-3]<RC[-1],RC[-3]>=20,RC[-3]<21),5,IF(AND(RC[-3]<RC[-1],RC[-3]>=21),0,IF(AND(RC[-3]>RC[-1],RC[-3]>=2,RC[-3]<3),90,IF(AND(RC[-3]>RC[-1],RC[-3]>=3,RC[-3]<4),90,IF(AND(RC[-3]>RC[-1],RC[-3]>=4,RC[-3]<5),80,IF(AND(RC[-3]>RC[-1],RC[-3]>=5,RC[-3]<6),70,IF(AND(RC[-3]>RC[-1],RC[-3]>=6,RC[-3]<7),60,IF(AND(RC[-3]>RC[-1],RC[-3]>=7,RC[-3]<8),50,IF(AND(RC[-3]>RC[-1],RC[-3]>=8,RC[-3]<9),40,IF(AND(RC[-3]>RC[-1],RC[-3]>=9,RC[-3]<10),30,IF(AND(RC[-3]>RC[-1],RC[-3]>=10,RC[-3]<11),20,IF(AND(RC[-3]>RC[-1],RC[-3]>=11,RC[-3]<12),10,IF(AND(RC[-3]>RC[-1],RC[-3]>=12),0))))))))))))))))))))))))))))))))) -> 70 | H630: =IF(RC[-3]="","",IF(RC[-3]<0.3,100,IF(AND(RC[-3]>=0.3,RC[-3]>0.4),95,IF(AND(RC[-3]>=0.4,RC[-3]<0.5),90,IF(AND(RC[-3]>=0.5,RC[-3]<0.6),85,IF(AND(RC[-3]>=0.6,RC[-3]<0.7),80,IF(AND(RC[-3]>=0.6,RC[-3]<1),80,IF(AND(RC[-3]>1,RC[-3]<2),50,IF(RC[-3]>2,0))))))))) ->  | I630: =IF(RC[-1]="",RC[-2],0.7*RC[-1]+0.3*RC[-2]) -> 70
A631: تهیه و تولید خاک نسوز استقلال آباده | B631: کباده | C631: =VLOOKUP(RC[-1],Sheet1!R3C2:R802C3,2,FALSE) -> کانی غیر فلزی | D631: =VLOOKUP(RC[-2],Sheet1!R3C2:R802C9,8,FALSE) -> 6.8384835410016818 | E631: =IF(VLOOKUP(RC[-3],Sheet1!R3C2:R803C11,10,FALSE)=0,"",VLOOKUP(Sheet2!RC[-3],Sheet1!R[1]C[-3]:R[801]C[6],10,FALSE)) ->  | F631: =Sheet1!R696C10 -> 31.547386804071571 | G631: =IF(RC[-3]<0,0,IF(AND(RC[-3]<RC[-1],RC[-3]<2),100,IF(AND(RC[-3]<RC[-1],RC[-3]>=2,RC[-3]<3),95,IF(AND(RC[-3]<RC[-1],RC[-3]>=3,RC[-3]<4),90,IF(AND(RC[-3]<RC[-1],RC[-3]>=4,RC[-3]<5),85,IF(AND(RC[-3]<RC[-1],RC[-3]>=5,RC[-3]<6),80,IF(AND(RC[-3]<RC[-1],RC[-3]>=6,RC[-3]<7),75,IF(AND(RC[-3]<RC[-1],RC[-3]>=7,RC[-3]<8),70,IF(AND(RC[-3]<RC[-1],RC[-3]>=8,RC[-3]<9),65,IF(AND(RC[-3]<RC[-1],RC[-3]>=9,RC[-3]<10),60,IF(AND(RC[-3]<RC[-1],RC[-3]>=10,RC[-3]<11),55,IF(AND(RC[-3]<RC[-1],RC[-3]>=11,RC[-3]<12),50,IF(AND(RC[-3]<RC[-1],RC[-3]>=12,RC[-3]<13),45,IF(AND(RC[-3]<RC[-1],RC[-3]>=13,RC[-3]<14),40,IF(AND(RC[-3]<RC[-1],RC[-3]>=14,RC[-3]<15),35,IF(AND(RC[-3]<RC[-1],RC[-3]>=15,RC[-3]<16),30,IF(AND(RC[-3]<RC[-1],RC[-3]>=16,RC[-3]<17),25,IF(AND(RC[-3]<RC[-1],RC[-3]>=17,RC[-3]<18),20,IF(AND(RC[-3]<RC[-1],RC[-3]>=18,RC[-3]<19),15,IF(AND(RC[-3]<RC[-1],RC[-3]>=19,RC[-3]<20),10,IF(AND(RC[-3]<RC[-1],RC[-3]>=20,RC[-3]<21),5,IF(AND(RC[-3]<RC[-1],RC[-3]>=21),0,IF(AND(RC[-3]>RC[-1],RC[-3]>=2,RC[-3]<3),90,IF(AND(RC[-3]>RC[-1],RC[-3]>=3,RC[-3]<4),90,IF(AND(RC[-3]>RC[-1],RC[-3]>=4,RC[-3]<5),80,IF(AND(RC[-3]>RC[-1],RC[-3]>=5,RC[-3]<6),70,IF(AND(RC[-3]>RC[-1],RC[-3]>=6,RC[-3]<7),60,IF(AND(RC[-3]>RC[-1],RC[-3]>=7,RC[-3]<8),50,IF(AND(RC[-3]>RC[-1],RC[-3]>=8,RC[-3]<9),40,IF(AND(RC[-3]>RC[-1],RC[-3]>=9,RC[-3]<10),30,IF(AND(RC[-3]>RC[-1],RC[-3]>=10,RC[-3]<11),20,IF(AND(RC[-3]>RC[-1],RC[-3]>=11,RC[-3]<12),10,IF(AND(RC[-3]>RC[-1],RC[-3]>=12),0))))))))))))))))))))))))))))))))) -> 75 | H631: =IF(RC[-3]="","",IF(RC[-3]<0.3,100,IF(AND(RC[-3]>=0.3,RC[-3]>0.4),95,IF(AND(RC[-3]>=0.4,RC[-3]<0.5),90,IF(AND(RC[-3]>=0.5,RC[-3]<0.6),85,IF(AND(RC[-3]>=0.6,RC[-3]<0.7),80,IF(AND(RC[-3]>=0.6,RC[-3]<1),80,IF(AND(RC[-3]>1,RC[-3]<2),50,IF(RC[-3]>2,0))))))))) ->  | I631: =IF(RC[-1]="",RC[-2],0.7*RC[-1]+0.3*RC[-2]) -> 75
A632: خاک چینی ایران | B632: کخاک | C632: =VLOOKUP(RC[-1],Sheet1!R3C2:R802C3,2,FALSE) -> کانی غیر فلزی | D632: =VLOOKUP(RC[-2],Sheet1!R3C2:R802C9,8,FALSE) -> 4.3057509017998914 | E632: =IF(VLOOKUP(RC[-3],Sheet1!R3C2:R803C11,10,FALSE)=0,"",VLOOKUP(Sheet2!RC[-3],Sheet1!R[1]C[-3]:R[801]C[6],10,FALSE)) ->  | F632: =Sheet1!R696C10 -> 31.547386804071571 | G632: =IF(RC[-3]<0,0,IF(AND(RC[-3]<RC[-1],RC[-3]<2),100,IF(AND(RC[-3]<RC[-1],RC[-3]>=2,RC[-3]<3),95,IF(AND(RC[-3]<RC[-1],RC[-3]>=3,RC[-3]<4),90,IF(AND(RC[-3]<RC[-1],RC[-3]>=4,RC[-3]<5),85,IF(AND(RC[-3]<RC[-1],RC[-3]>=5,RC[-3]<6),80,IF(AND(RC[-3]<RC[-1],RC[-3]>=6,RC[-3]<7),75,IF(AND(RC[-3]<RC[-1],RC[-3]>=7,RC[-3]<8),70,IF(AND(RC[-3]<RC[-1],RC[-3]>=8,RC[-3]<9),65,IF(AND(RC[-3]<RC[-1],RC[-3]>=9,RC[-3]<10),60,IF(AND(RC[-3]<RC[-1],RC[-3]>=10,RC[-3]<11),55,IF(AND(RC[-3]<RC[-1],RC[-3]>=11,RC[-3]<12),50,IF(AND(RC[-3]<RC[-1],RC[-3]>=12,RC[-3]<13),45,IF(AND(RC[-3]<RC[-1],RC[-3]>=13,RC[-3]<14),40,IF(AND(RC[-3]<RC[-1],RC[-3]>=14,RC[-3]<15),35,IF(AND(RC[-3]<RC[-1],RC[-3]>=15,RC[-3]<16),30,IF(AND(RC[-3]<RC[-1],RC[-3]>=16,RC[-3]<17),25,IF(AND(RC[-3]<RC[-1],RC[-3]>=17,RC[-3]<18),20,IF(AND(RC[-3]<RC[-1],RC[-3]>=18,RC[-3]<19),15,IF(AND(RC[-3]<RC[-1],RC[-3]>=19,RC[-3]<20),10,IF(AND(RC[-3]<RC[-1],RC[-3]>=20,RC[-3]<21),5,IF(AND(RC[-3]<RC[-1],RC[-3]>=21),0,IF(AND(RC[-3]>RC[-1],RC[-3]>=2,RC[-3]<3),90,IF(AND(RC[-3]>RC[-1],RC[-3]>=3,RC[-3]<4),90,IF(AND(RC[-3]>RC[-1],RC[-3]>=4,RC[-3]<5),80,IF(AND(RC[-3]>RC[-1],RC[-3]>=5,RC[-3]<6),70,IF(AND(RC[-3]>RC[-1],RC[-3]>=6,RC[-3]<7),60,IF(AND(RC[-3]>RC[-1],RC[-3]>=7,RC[-3]<8),50,IF(AND(RC[-3]>RC[-1],RC[-3]>=8,RC[-3]<9),40,IF(AND(RC[-3]>RC[-1],RC[-3]>=9,RC[-3]<10),30,IF(AND(RC[-3]>RC[-1],RC[-3]>=10,RC[-3]<11),20,IF(AND(RC[-3]>RC[-1],RC[-3]>=11,RC[-3]<12),10,IF(AND(RC[-3]>RC[-1],RC[-3]>=12),0))))))))))))))))))))))))))))))))) -> 85 | H632: =IF(RC[-3]="","",IF(RC[-3]<0.3,100,IF(AND(RC[-3]>=0.3,RC[-3]>0.4),95,IF(AND(RC[-3]>=0.4,RC[-3]<0.5),90,IF(AND(RC[-3]>=0.5,RC[-3]<0.6),85,IF(AND(RC[-3]>=0.6,RC[-3]<0.7),80,IF(AND(RC[-3]>=0.6,RC[-3]<1),80,IF(AND(RC[-3]>1,RC[-3]<2),50,IF(RC[-3]>2,0))))))))) ->  | I632: =IF(RC[-1]="",RC[-2],0.7*RC[-1]+0.3*RC[-2]) -> 85
A633: سایپا شیشه | B633: کساپا | C633: =VLOOKUP(RC[-1],Sheet1!R3C2:R802C3,2,FALSE) -> کانی غیر فلزی | D633: =VLOOKUP(RC[-2],Sheet1!R3C2:R802C9,8,FALSE) -> 44.853591160221001 | E633: =IF(VLOOKUP(RC[-3],Sheet1!R3C2:R803C11,10,FALSE)=0,"",VLOOKUP(Sheet2!RC[-3],Sheet1!R[1]C[-3]:R[801]C[6],10,FALSE)) ->  | F633: =Sheet1!R696C10 -> 31.547386804071571 | G633: =IF(RC[-3]<0,0,IF(AND(RC[-3]<RC[-1],RC[-3]<2),100,IF(AND(RC[-3]<RC[-1],RC[-3]>=2,RC[-3]<3),95,IF(AND(RC[-3]<RC[-1],RC[-3]>=3,RC[-3]<4),90,IF(AND(RC[-3]<RC[-1],RC[-3]>=4,RC[-3]<5),85,IF(AND(RC[-3]<RC[-1],RC[-3]>=5,RC[-3]<6),80,IF(AND(RC[-3]<RC[-1],RC[-3]>=6,RC[-3]<7),75,IF(AND(RC[-3]<RC[-1],RC[-3]>=7,RC[-3]<8),70,IF(AND(RC[-3]<RC[-1],RC[-3]>=8,RC[-3]<9),65,IF(AND(RC[-3]<RC[-1],RC[-3]>=9,RC[-3]<10),60,IF(AND(RC[-3]<RC[-1],RC[-3]>=10,RC[-3]<11),55,IF(AND(RC[-3]<RC[-1],RC[-3]>=11,RC[-3]<12),50,IF(AND(RC[-3]<RC[-1],RC[-3]>=12,RC[-3]<13),45,IF(AND(RC[-3]<RC[-1],RC[-3]>=13,RC[-3]<14),40,IF(AND(RC[-3]<RC[-1],RC[-3]>=14,RC[-3]<15),35,IF(AND(RC[-3]<RC[-1],RC[-3]>=15,RC[-3]<16),30,IF(AND(RC[-3]<RC[-1],RC[-3]>=16,RC[-3]<17),25,IF(AND(RC[-3]<RC[-1],RC[-3]>=17,RC[-3]<18),20,IF(AND(RC[-3]<RC[-1],RC[-3]>=18,RC[-3]<19),15,IF(AND(RC[-3]<RC[-1],RC[-3]>=19,RC[-3]<20),10,IF(AND(RC[-3]<RC[-1],RC[-3]>=20,RC[-3]<21),5,IF(AND(RC[-3]<RC[-1],RC[-3]>=21),0,IF(AND(RC[-3]>RC[-1],RC[-3]>=2,RC[-3]<3),90,IF(AND(RC[-3]>RC[-1],RC[-3]>=3,RC[-3]<4),90,IF(AND(RC[-3]>RC[-1],RC[-3]>=4,RC[-3]<5),80,IF(AND(RC[-3]>RC[-1],RC[-3]>=5,RC[-3]<6),70,IF(AND(RC[-3]>RC[-1],RC[-3]>=6,RC[-3]<7),60,IF(AND(RC[-3]>RC[-1],RC[-3]>=7,RC[-3]<8),50,IF(AND(RC[-3]>RC[-1],RC[-3]>=8,RC[-3]<9),40,IF(AND(RC[-3]>RC[-1],RC[-3]>=9,RC[-3]<10),30,IF(AND(RC[-3]>RC[-1],RC[-3]>=10,RC[-3]<11),20,IF(AND(RC[-3]>RC[-1],RC[-3]>=11,RC[-3]<12),10,IF(AND(RC[-3]>RC[-1],RC[-3]>=12),0))))))))))))))))))))))))))))))))) -> 0 | H633: =IF(RC[-3]="","",IF(RC[-3]<0.3,100,IF(AND(RC[-3]>=0.3,RC[-3]>0.4),95,IF(AND(RC[-3]>=0.4,RC[-3]<0.5),90,IF(AND(RC[-3]>=0.5,RC[-3]<0.6),85,IF(AND(RC[-3]>=0.6,RC[-3]<0.7),80,IF(AND(RC[-3]>=0.6,RC[-3]<1),80,IF(AND(RC[-3]>1,RC[-3]<2),50,IF(RC[-3]>2,0))))))))) ->  | I633: =IF(RC[-1]="",RC[-2],0.7*RC[-1]+0.3*RC[-2]) -> 0
A634: سرامیک اردکان | B634: کسرا | C634: =VLOOKUP(RC[-1],Sheet1!R3C2:R802C3,2,FALSE) -> کانی غیر فلزی | D634: =VLOOKUP(RC[-2],Sheet1!R3C2:R802C9,8,FALSE) -> 7.5276986529718108 | E634: =IF(VLOOKUP(RC[-3],Sheet1!R3C2:R803C11,10,FALSE)=0,"",VLOOKUP(Sheet2!RC[-3],Sheet1!R[1]C[-3]:R[801]C[6],10,FALSE)) ->  | F634: =Sheet1!R696C10 -> 31.547386804071571 | G634: =IF(RC[-3]<0,0,IF(AND(RC[-3]<RC[-1],RC[-3]<2),100,IF(AND(RC[-3]<RC[-1],RC[-3]>=2,RC[-3]<3),95,IF(AND(RC[-3]<RC[-1],RC[-3]>=3,RC[-3]<4),90,IF(AND(RC[-3]<RC[-1],RC[-3]>=4,RC[-3]<5),85,IF(AND(RC[-3]<RC[-1],RC[-3]>=5,RC[-3]<6),80,IF(AND(RC[-3]<RC[-1],RC[-3]>=6,RC[-3]<7),75,IF(AND(RC[-3]<RC[-1],RC[-3]>=7,RC[-3]<8),70,IF(AND(RC[-3]<RC[-1],RC[-3]>=8,RC[-3]<9),65,IF(AND(RC[-3]<RC[-1],RC[-3]>=9,RC[-3]<10),60,IF(AND(RC[-3]<RC[-1],RC[-3]>=10,RC[-3]<11),55,IF(AND(RC[-3]<RC[-1],RC[-3]>=11,RC[-3]<12),50,IF(AND(RC[-3]<RC[-1],RC[-3]>=12,RC[-3]<13),45,IF(AND(RC[-3]<RC[-1],RC[-3]>=13,RC[-3]<14),40,IF(AND(RC[-3]<RC[-1],RC[-3]>=14,RC[-3]<15),35,IF(AND(RC[-3]<RC[-1],RC[-3]>=15,RC[-3]<16),30,IF(AND(RC[-3]<RC[-1],RC[-3]>=16,RC[-3]<17),25,IF(AND(RC[-3]<RC[-1],RC[-3]>=17,RC[-3]<18),20,IF(AND(RC[-3]<RC[-1],RC[-3]>=18,RC[-3]<19),15,IF(AND(RC[-3]<RC[-1],RC[-3]>=19,RC[-3]<20),10,IF(AND(RC[-3]<RC[-1],RC[-3]>=20,RC[-3]<21),5,IF(AND(RC[-3]<RC[-1],RC[-3]>=21),0,IF(AND(RC[-3]>RC[-1],RC[-3]>=2,RC[-3]<3),90,IF(AND(RC[-3]>RC[-1],RC[-3]>=3,RC[-3]<4),90,IF(AND(RC[-3]>RC[-1],RC[-3]>=4,RC[-3]<5),80,IF(AND(RC[-3]>RC[-1],RC[-3]>=5,RC[-3]<6),70,IF(AND(RC[-3]>RC[-1],RC[-3]>=6,RC[-3]<7),60,IF(AND(RC[-3]>RC[-1],RC[-3]>=7,RC[-3]<8),50,IF(AND(RC[-3]>RC[-1],RC[-3]>=8,RC[-3]<9),40,IF(AND(RC[-3]>RC[-1],RC[-3]>=9,RC[-3]<10),30,IF(AND(RC[-3]>RC[-1],RC[-3]>=10,RC[-3]<11),20,IF(AND(RC[-3]>RC[-1],RC[-3]>=11,RC[-3]<12),10,IF(AND(RC[-3]>RC[-1],RC[-3]>=12),0))))))))))))))))))))))))))))))))) -> 70 | H634: =IF(RC[-3]="","",IF(RC[-3]<0.3,100,IF(AND(RC[-3]>=0.3,RC[-3]>0.4),95,IF(AND(RC[-3]>=0.4,RC[-3]<0.5),90,IF(AND(RC[-3]>=0.5,RC[-3]<0.6),85,IF(AND(RC[-3]>=0.6,RC[-3]<0.7),80,IF(AND(RC[-3]>=0.6,RC[-3]<1),80,IF(AND(RC[-3]>1,RC[-3]<2),50,IF(RC[-3]>2,0))))))))) ->  | I634: =IF(RC[-1]="",RC[-2],0.7*RC[-1]+0.3*RC[-2]) -> 70
A635: شیشه دارویی رازی | B635: کرازی | C635: =VLOOKUP(RC[-1],Sheet1!R3C2:R802C3,2,FALSE) -> کانی غیر فلزی | D635: =VLOOKUP(RC[-2],Sheet1!R3C2:R802C9,8,FALSE) -> 4.9342823901775139 | E635: =IF(VLOOKUP(RC[-3],Sheet1!R3C2:R803C11,10,FALSE)=0,"",VLOOKUP(Sheet2!RC[-3],Sheet1!R[1]C[-3]:R[801]C[6],10,FALSE)) ->  | F635: =Sheet1!R696C10 -> 31.547386804071571 | G635: =IF(RC[-3]<0,0,IF(AND(RC[-3]<RC[-1],RC[-3]<2),100,IF(AND(RC[-3]<RC[-1],RC[-3]>=2,RC[-3]<3),95,IF(AND(RC[-3]<RC[-1],RC[-3]>=3,RC[-3]<4),90,IF(AND(RC[-3]<RC[-1],RC[-3]>=4,RC[-3]<5),85,IF(AND(RC[-3]<RC[-1],RC[-3]>=5,RC[-3]<6),80,IF(AND(RC[-3]<RC[-1],RC[-3]>=6,RC[-3]<7),75,IF(AND(RC[-3]<RC[-1],RC[-3]>=7,RC[-3]<8),70,IF(AND(RC[-3]<RC[-1],RC[-3]>=8,RC[-3]<9),65,IF(AND(RC[-3]<RC[-1],RC[-3]>=9,RC[-3]<10),60,IF(AND(RC[-3]<RC[-1],RC[-3]>=10,RC[-3]<11),55,IF(AND(RC[-3]<RC[-1],RC[-3]>=11,RC[-3]<12),50,IF(AND(RC[-3]<RC[-1],RC[-3]>=12,RC[-3]<13),45,IF(AND(RC[-3]<RC[-1],RC[-3]>=13,RC[-3]<14),40,IF(AND(RC[-3]<RC[-1],RC[-3]>=14,RC[-3]<15),35,IF(AND(RC[-3]<RC[-1],RC[-3]>=15,RC[-3]<16),30,IF(AND(RC[-3]<RC[-1],RC[-3]>=16,RC[-3]<17),25,IF(AND(RC[-3]<RC[-1],RC[-3]>=17,RC[-3]<18),20,IF(AND(RC[-3]<RC[-1],RC[-3]>=18,RC[-3]<19),15,IF(AND(RC[-3]<RC[-1],RC[-3]>=19,RC[-3]<20),10,IF(AND(RC[-3]<RC[-1],RC[-3]>=20,RC[-3]<21),5,IF(AND(RC[-3]<RC[-1],RC[-3]>=21),0,IF(AND(RC[-3]>RC[-1],RC[-3]>=2,RC[-3]<3),90,IF(AND(RC[-3]>RC[-1],RC[-3]>=3,RC[-3]<4),90,IF(AND(RC[-3]>RC[-1],RC[-3]>=4,RC[-3]<5),80,IF(AND(RC[-3]>RC[-1],RC[-3]>=5,RC[-3]<6),70,IF(AND(RC[-3]>RC[-1],RC[-3]>=6,RC[-3]<7),60,IF(AND(RC[-3]>RC[-1],RC[-3]>=7,RC[-3]<8),50,IF(AND(RC[-3]>RC[-1],RC[-3]>=8,RC[-3]<9),40,IF(AND(RC[-3]>RC[-1],RC[-3]>=9,RC[-3]<10),30,IF(AND(RC[-3]>RC[-1],RC[-3]>=10,RC[-3]<11),20,IF(AND(RC[-3]>RC[-1],RC[-3]>=11,RC[-3]<12),10,IF(AND(RC[-3]>RC[-1],RC[-3]>=12),0))))))))))))))))))))))))))))))))) -> 85 | H635: =IF(RC[-3]="","",IF(RC[-3]<0.3,100,IF(AND(RC[-3]>=0.3,RC[-3]>0.4),95,IF(AND(RC[-3]>=0.4,RC[-3]<0.5),90,IF(AND(RC[-3]>=0.5,RC[-3]<0.6),85,IF(AND(RC[-3]>=0.6,RC[-3]<0.7),80,IF(AND(RC[-3]>=0.6,RC[-3]<1),80,IF(AND(RC[-3]>1,RC[-3]<2),50,IF(RC[-3]>2,0))))))))) ->  | I635: =IF(RC[-1]="",RC[-2],0.7*RC[-1]+0.3*RC[-2]) -> 85
A636: شیشه سازی مینا | B636: کمینا | C636: =VLOOKUP(RC[-1],Sheet1!R3C2:R802C3,2,FALSE) -> کانی غیر فلزی | D636: =VLOOKUP(RC[-2],Sheet1!R3C2:R802C9,8,FALSE) -> 4.9693200663349915 | E636: =IF(VLOOKUP(RC[-3],Sheet1!R3C2:R803C11,10,FALSE)=0,"",VLOOKUP(Sheet2!RC[-3],Sheet1!R[1]C[-3]:R[801]C[6],10,FALSE)) ->  | F636: =Sheet1!R696C10 -> 31.547386804071571 | G636: =IF(RC[-3]<0,0,IF(AND(RC[-3]<RC[-1],RC[-3]<2),100,IF(AND(RC[-3]<RC[-1],RC[-3]>=2,RC[-3]<3),95,IF(AND(RC[-3]<RC[-1],RC[-3]>=3,RC[-3]<4),90,IF(AND(RC[-3]<RC[-1],RC[-3]>=4,RC[-3]<5),85,IF(AND(RC[-3]<RC[-1],RC[-3]>=5,RC[-3]<6),80,IF(AND(RC[-3]<RC[-1],RC[-3]>=6,RC[-3]<7),75,IF(AND(RC[-3]<RC[-1],RC[-3]>=7,RC[-3]<8),70,IF(AND(RC[-3]<RC[-1],RC[-3]>=8,RC[-3]<9),65,IF(AND(RC[-3]<RC[-1],RC[-3]>=9,RC[-3]<10),60,IF(AND(RC[-3]<RC[-1],RC[-3]>=10,RC[-3]<11),55,IF(AND(RC[-3]<RC[-1],RC[-3]>=11,RC[-3]<12),50,IF(AND(RC[-3]<RC[-1],RC[-3]>=12,RC[-3]<13),45,IF(AND(RC[-3]<RC[-1],RC[-3]>=13,RC[-3]<14),40,IF(AND(RC[-3]<RC[-1],RC[-3]>=14,RC[-3]<15),35,IF(AND(RC[-3]<RC[-1],RC[-3]>=15,RC[-3]<16),30,IF(AND(RC[-3]<RC[-1],RC[-3]>=16,RC[-3]<17),25,IF(AND(RC[-3]<RC[-1],RC[-3]>=17,RC[-3]<18),20,IF(AND(RC[-3]<RC[-1],RC[-3]>=18,RC[-3]<19),15,IF(AND(RC[-3]<RC[-1],RC[-3]>=19,RC[-3]<20),10,IF(AND(RC[-3]<RC[-1],RC[-3]>=20,RC[-3]<21),5,IF(AND(RC[-3]<RC[-1],RC[-3]>=21),0,IF(AND(RC[-3]>RC[-1],RC[-3]>=2,RC[-3]<3),90,IF(AND(RC[-3]>RC[-1],RC[-3]>=3,RC[-3]<4),90,IF(AND(RC[-3]>RC[-1],RC[-3]>=4,RC[-3]<5),80,IF(AND(RC[-3]>RC[-1],RC[-3]>=5,RC[-3]<6),70,IF(AND(RC[-3]>RC[-1],RC[-3]>=6,RC[-3]<7),60,IF(AND(RC[-3]>RC[-1],RC[-3]>=7,RC[-3]<8),50,IF(AND(RC[-3]>RC[-1],RC[-3]>=8,RC[-3]<9),40,IF(AND(RC[-3]>RC[-1],RC[-3]>=9,RC[-3]<10),30,IF(AND(RC[-3]>RC[-1],RC[-3]>=10,RC[-3]<11),20,IF(AND(RC[-3]>RC[-1],RC[-3]>=11,RC[-3]<12),10,IF(AND(RC[-3]>RC[-1],RC[-3]>=12),0))))))))))))))))))))))))))))))))) -> 85 | H636: =IF(RC[-3]="","",IF(RC[-3]<0.3,100,IF(AND(RC[-3]>=0.3,RC[-3]>0.4),95,IF(AND(RC[-3]>=0.4,RC[-3]<0.5),90,IF(AND(RC[-3]>=0.5,RC[-3]<0.6),85,IF(AND(RC[-3]>=0.6,RC[-3]<0.7),80,IF(AND(RC[-3]>=0.6,RC[-3]<1),80,IF(AND(RC[-3]>1,RC[-3]<2),50,IF(RC[-3]>2,0))))))))) ->  | I636: =IF(RC[-1]="",RC[-2],0.7*RC[-1]+0.3*RC[-2]) -> 85
A637: شیشه قزوین | B637: کقزوی | C637: =VLOOKUP(RC[-1],Sheet1!R3C2:R802C3,2,FALSE) -> کانی غیر فلزی | D637: =VLOOKUP(RC[-2],Sheet1!R3C2:R802C9,8,FALSE) -> 4.0910051651480615 | E637: =IF(VLOOKUP(RC[-3],Sheet1!R3C2:R803C11,10,FALSE)=0,"",VLOOKUP(Sheet2!RC[-3],Sheet1!R[1]C[-3]:R[801]C[6],10,FALSE)) ->  | F637: =Sheet1!R696C10 -> 31.547386804071571 | G637: =IF(RC[-3]<0,0,IF(AND(RC[-3]<RC[-1],RC[-3]<2),100,IF(AND(RC[-3]<RC[-1],RC[-3]>=2,RC[-3]<3),95,IF(AND(RC[-3]<RC[-1],RC[-3]>=3,RC[-3]<4),90,IF(AND(RC[-3]<RC[-1],RC[-3]>=4,RC[-3]<5),85,IF(AND(RC[-3]<RC[-1],RC[-3]>=5,RC[-3]<6),80,IF(AND(RC[-3]<RC[-1],RC[-3]>=6,RC[-3]<7),75,IF(AND(RC[-3]<RC[-1],RC[-3]>=7,RC[-3]<8),70,IF(AND(RC[-3]<RC[-1],RC[-3]>=8,RC[-3]<9),65,IF(AND(RC[-3]<RC[-1],RC[-3]>=9,RC[-3]<10),60,IF(AND(RC[-3]<RC[-1],RC[-3]>=10,RC[-3]<11),55,IF(AND(RC[-3]<RC[-1],RC[-3]>=11,RC[-3]<12),50,IF(AND(RC[-3]<RC[-1],RC[-3]>=12,RC[-3]<13),45,IF(AND(RC[-3]<RC[-1],RC[-3]>=13,RC[-3]<14),40,IF(AND(RC[-3]<RC[-1],RC[-3]>=14,RC[-3]<15),35,IF(AND(RC[-3]<RC[-1],RC[-3]>=15,RC[-3]<16),30,IF(AND(RC[-3]<RC[-1],RC[-3]>=16,RC[-3]<17),25,IF(AND(RC[-3]<RC[-1],RC[-3]>=17,RC[-3]<18),20,IF(AND(RC[-3]<RC[-1],RC[-3]>=18,RC[-3]<19),15,IF(AND(RC[-3]<RC[-1],RC[-3]>=19,RC[-3]<20),10,IF(AND(RC[-3]<RC[-1],RC[-3]>=20,RC[-3]<21),5,IF(AND(RC[-3]<RC[-1],RC[-3]>=21),0,IF(AND(RC[-3]>RC[-1],RC[-3]>=2,RC[-3]<3),90,IF(AND(RC[-3]>RC[-1],RC[-3]>=3,RC[-3]<4),90,IF(AND(RC[-3]>RC[-1],RC[-3]>=4,RC[-3]<5),80,IF(AND(RC[-3]>RC[-1],RC[-3]>=5,RC[-3]<6),70,IF(AND(RC[-3]>RC[-1],RC[-3]>=6,RC[-3]<7),60,IF(AND(RC[-3]>RC[-1],RC[-3]>=7,RC[-3]<8),50,IF(AND(RC[-3]>RC[-1],RC[-3]>=8,RC[-3]<9),40,IF(AND(RC[-3]>RC[-1],RC[-3]>=9,RC[-3]<10),30,IF(AND(RC[-3]>RC[-1],RC[-3]>=10,RC[-3]<11),20,IF(AND(RC[-3]>RC[-1],RC[-3]>=11,RC[-3]<12),10,IF(AND(RC[-3]>RC[-1],RC[-3]>=12),0))))))))))))))))))))))))))))))))) -> 85 | H637: =IF(RC[-3]="","",IF(RC[-3]<0.3,100,IF(AND(RC[-3]>=0.3,RC[-3]>0.4),95,IF(AND(RC[-3]>=0.4,RC[-3]<0.5),90,IF(AND(RC[-3]>=0.5,RC[-3]<0.6),85,IF(AND(RC[-3]>=0.6,RC[-3]<0.7),80,IF(AND(RC[-3]>=0.6,RC[-3]<1),80,IF(AND(RC[-3]>1,RC[-3]<2),50,IF(RC[-3]>2,0))))))))) ->  | I637: =IF(RC[-1]="",RC[-2],0.7*RC[-1]+0.3*RC[-2]) -> 85
A638: شیشه همدان | B638: کهمدا | C638: =VLOOKUP(RC[-1],Sheet1!R3C2:R802C3,2,FALSE) -> کانی غیر فلزی | D638: =VLOOKUP(RC[-2],Sheet1!R3C2:R802C9,8,FALSE) -> 5.068499284064508 | E638: =IF(VLOOKUP(RC[-3],Sheet1!R3C2:R803C11,10,FALSE)=0,"",VLOOKUP(Sheet2!RC[-3],Sheet1!R[1]C[-3]:R[801]C[6],10,FALSE)) ->  | F638: =Sheet1!R696C10 -> 31.547386804071571 | G638: =IF(RC[-3]<0,0,IF(AND(RC[-3]<RC[-1],RC[-3]<2),100,IF(AND(RC[-3]<RC[-1],RC[-3]>=2,RC[-3]<3),95,IF(AND(RC[-3]<RC[-1],RC[-3]>=3,RC[-3]<4),90,IF(AND(RC[-3]<RC[-1],RC[-3]>=4,RC[-3]<5),85,IF(AND(RC[-3]<RC[-1],RC[-3]>=5,RC[-3]<6),80,IF(AND(RC[-3]<RC[-1],RC[-3]>=6,RC[-3]<7),75,IF(AND(RC[-3]<RC[-1],RC[-3]>=7,RC[-3]<8),70,IF(AND(RC[-3]<RC[-1],RC[-3]>=8,RC[-3]<9),65,IF(AND(RC[-3]<RC[-1],RC[-3]>=9,RC[-3]<10),60,IF(AND(RC[-3]<RC[-1],RC[-3]>=10,RC[-3]<11),55,IF(AND(RC[-3]<RC[-1],RC[-3]>=11,RC[-3]<12),50,IF(AND(RC[-3]<RC[-1],RC[-3]>=12,RC[-3]<13),45,IF(AND(RC[-3]<RC[-1],RC[-3]>=13,RC[-3]<14),40,IF(AND(RC[-3]<RC[-1],RC[-3]>=14,RC[-3]<15),35,IF(AND(RC[-3]<RC[-1],RC[-3]>=15,RC[-3]<16),30,IF(AND(RC[-3]<RC[-1],RC[-3]>=16,RC[-3]<17),25,IF(AND(RC[-3]<RC[-1],RC[-3]>=17,RC[-3]<18),20,IF(AND(RC[-3]<RC[-1],RC[-3]>=18,RC[-3]<19),15,IF(AND(RC[-3]<RC[-1],RC[-3]>=19,RC[-3]<20),10,IF(AND(RC[-3]<RC[-1],RC[-3]>=20,RC[-3]<21),5,IF(AND(RC[-3]<RC[-1],RC[-3]>=21),0,IF(AND(RC[-3]>RC[-1],RC[-3]>=2,RC[-3]<3),90,IF(AND(RC[-3]>RC[-1],RC[-3]>=3,RC[-3]<4),90,IF(AND(RC[-3]>RC[-1],RC[-3]>=4,RC[-3]<5),80,IF(AND(RC[-3]>RC[-1],RC[-3]>=5,RC[-3]<6),70,IF(AND(RC[-3]>RC[-1],RC[-3]>=6,RC[-3]<7),60,IF(AND(RC[-3]>RC[-1],RC[-3]>=7,RC[-3]<8),50,IF(AND(RC[-3]>RC[-1],RC[-3]>=8,RC[-3]<9),40,IF(AND(RC[-3]>RC[-1],RC[-3]>=9,RC[-3]<10),30,IF(AND(RC[-3]>RC[-1],RC[-3]>=10,RC[-3]<11),20,IF(AND(RC[-3]>RC[-1],RC[-3]>=11,RC[-3]<12),10,IF(AND(RC[-3]>RC[-1],RC[-3]>=12),0))))))))))))))))))))))))))))))))) -> 80 | H638: =IF(RC[-3]="","",IF(RC[-3]<0.3,100,IF(AND(RC[-3]>=0.3,RC[-3]>0.4),95,IF(AND(RC[-3]>=0.4,RC[-3]<0.5),90,IF(AND(RC[-3]>=0.5,RC[-3]<0.6),85,IF(AND(RC[-3]>=0.6,RC[-3]<0.7),80,IF(AND(RC[-3]>=0.6,RC[-3]<1),80,IF(AND(RC[-3]>1,RC[-3]<2),50,IF(RC[-3]>2,0))))))))) ->  | I638: =IF(RC[-1]="",RC[-2],0.7*RC[-1]+0.3*RC[-2]) -> 80
A639: شیشه و گاز | B639: کگاز | C639: =VLOOKUP(RC[-1],Sheet1!R3C2:R802C3,2,FALSE) -> کانی غیر فلزی | D639: =VLOOKUP(RC[-2],Sheet1!R3C2:R802C9,8,FALSE) -> 29.724094350748743 | E639: =IF(VLOOKUP(RC[-3],Sheet1!R3C2:R803C11,10,FALSE)=0,"",VLOOKUP(Sheet2!RC[-3],Sheet1!R[1]C[-3]:R[801]C[6],10,FALSE)) ->  | F639: =Sheet1!R696C10 -> 31.547386804071571 | G639: =IF(RC[-3]<0,0,IF(AND(RC[-3]<RC[-1],RC[-3]<2),100,IF(AND(RC[-3]<RC[-1],RC[-3]>=2,RC[-3]<3),95,IF(AND(RC[-3]<RC[-1],RC[-3]>=3,RC[-3]<4),90,IF(AND(RC[-3]<RC[-1],RC[-3]>=4,RC[-3]<5),85,IF(AND(RC[-3]<RC[-1],RC[-3]>=5,RC[-3]<6),80,IF(AND(RC[-3]<RC[-1],RC[-3]>=6,RC[-3]<7),75,IF(AND(RC[-3]<RC[-1],RC[-3]>=7,RC[-3]<8),70,IF(AND(RC[-3]<RC[-1],RC[-3]>=8,RC[-3]<9),65,IF(AND(RC[-3]<RC[-1],RC[-3]>=9,RC[-3]<10),60,IF(AND(RC[-3]<RC[-1],RC[-3]>=10,RC[-3]<11),55,IF(AND(RC[-3]<RC[-1],RC[-3]>=11,RC[-3]<12),50,IF(AND(RC[-3]<RC[-1],RC[-3]>=12,RC[-3]<13),45,IF(AND(RC[-3]<RC[-1],RC[-3]>=13,RC[-3]<14),40,IF(AND(RC[-3]<RC[-1],RC[-3]>=14,RC[-3]<15),35,IF(AND(RC[-3]<RC[-1],RC[-3]>=15,RC[-3]<16),30,IF(AND(RC[-3]<RC[-1],RC[-3]>=16,RC[-3]<17),25,IF(AND(RC[-3]<RC[-1],RC[-3]>=17,RC[-3]<18),20,IF(AND(RC[-3]<RC[-1],RC[-3]>=18,RC[-3]<19),15,IF(AND(RC[-3]<RC[-1],RC[-3]>=19,RC[-3]<20),10,IF(AND(RC[-3]<RC[-1],RC[-3]>=20,RC[-3]<21),5,IF(AND(RC[-3]<RC[-1],RC[-3]>=21),0,IF(AND(RC[-3]>RC[-1],RC[-3]>=2,RC[-3]<3),90,IF(AND(RC[-3]>RC[-1],RC[-3]>=3,RC[-3]<4),90,IF(AND(RC[-3]>RC[-1],RC[-3]>=4,RC[-3]<5),80,IF(AND(RC[-3]>RC[-1],RC[-3]>=5,RC[-3]<6),70,IF(AND(RC[-3]>RC[-1],RC[-3]>=6,RC[-3]<7),60,IF(AND(RC[-3]>RC[-1],RC[-3]>=7,RC[-3]<8),50,IF(AND(RC[-3]>RC[-1],RC[-3]>=8,RC[-3]<9),40,IF(AND(RC[-3]>RC[-1],RC[-3]>=9,RC[-3]<10),30,IF(AND(RC[-3]>RC[-1],RC[-3]>=10,RC[-3]<11),20,IF(AND(RC[-3]>RC[-1],RC[-3]>=11,RC[-3]<12),10,IF(AND(RC[-3]>RC[-1],RC[-3]>=12),0))))))))))))))))))))))))))))))))) -> 0 | H639: =IF(RC[-3]="","",IF(RC[-3]<0.3,100,IF(AND(RC[-3]>=0.3,RC[-3]>0.4),95,IF(AND(RC[-3]>=0.4,RC[-3]<0.5),90,IF(AND(RC[-3]>=0.5,RC[-3]<0.6),85,IF(AND(RC[-3]>=0.6,RC[-3]<0.7),80,IF(AND(RC[-3]>=0.6,RC[-3]<1),80,IF(AND(RC[-3]>1,RC[-3]<2),50,IF(RC[-3]>2,0))))))))) ->  | I639: =IF(RC[-1]="",RC[-2],0.7*RC[-1]+0.3*RC[-2]) -> 0
A640: صنایع نسوز توکا | B640: کتوکا | C640: =VLOOKUP(RC[-1],Sheet1!R3C2:R802C3,2,FALSE) -> کانی غیر فلزی | D640: =VLOOKUP(RC[-2],Sheet1!R3C2:R802C9,8,FALSE) -> 8.4536069286368711 | E640: =IF(VLOOKUP(RC[-3],Sheet1!R3C2:R803C11,10,FALSE)=0,"",VLOOKUP(Sheet2!RC[-3],Sheet1!R[1]C[-3]:R[801]C[6],10,FALSE)) ->  | F640: =Sheet1!R696C10 -> 31.547386804071571 | G640: =IF(RC[-3]<0,0,IF(AND(RC[-3]<RC[-1],RC[-3]<2),100,IF(AND(RC[-3]<RC[-1],RC[-3]>=2,RC[-3]<3),95,IF(AND(RC[-3]<RC[-1],RC[-3]>=3,RC[-3]<4),90,IF(AND(RC[-3]<RC[-1],RC[-3]>=4,RC[-3]<5),85,IF(AND(RC[-3]<RC[-1],RC[-3]>=5,RC[-3]<6),80,IF(AND(RC[-3]<RC[-1],RC[-3]>=6,RC[-3]<7),75,IF(AND(RC[-3]<RC[-1],RC[-3]>=7,RC[-3]<8),70,IF(AND(RC[-3]<RC[-1],RC[-3]>=8,RC[-3]<9),65,IF(AND(RC[-3]<RC[-1],RC[-3]>=9,RC[-3]<10),60,IF(AND(RC[-3]<RC[-1],RC[-3]>=10,RC[-3]<11),55,IF(AND(RC[-3]<RC[-1],RC[-3]>=11,RC[-3]<12),50,IF(AND(RC[-3]<RC[-1],RC[-3]>=12,RC[-3]<13),45,IF(AND(RC[-3]<RC[-1],RC[-3]>=13,RC[-3]<14),40,IF(AND(RC[-3]<RC[-1],RC[-3]>=14,RC[-3]<15),35,IF(AND(RC[-3]<RC[-1],RC[-3]>=15,RC[-3]<16),30,IF(AND(RC[-3]<RC[-1],RC[-3]>=16,RC[-3]<17),25,IF(AND(RC[-3]<RC[-1],RC[-3]>=17,RC[-3]<18),20,IF(AND(RC[-3]<RC[-1],RC[-3]>=18,RC[-3]<19),15,IF(AND(RC[-3]<RC[-1],RC[-3]>=19,RC[-3]<20),10,IF(AND(RC[-3]<RC[-1],RC[-3]>=20,RC[-3]<21),5,IF(AND(RC[-3]<RC[-1],RC[-3]>=21),0,IF(AND(RC[-3]>RC[-1],RC[-3]>=2,RC[-3]<3),90,IF(AND(RC[-3]>RC[-1],RC[-3]>=3,RC[-3]<4),90,IF(AND(RC[-3]>RC[-1],RC[-3]>=4,RC[-3]<5),80,IF(AND(RC[-3]>RC[-1],RC[-3]>=5,RC[-3]<6),70,IF(AND(RC[-3]>RC[-1],RC[-3]>=6,RC[-3]<7),60,IF(AND(RC[-3]>RC[-1],RC[-3]>=7,RC[-3]<8),50,IF(AND(RC[-3]>RC[-1],RC[-3]>=8,RC[-3]<9),40,IF(AND(RC[-3]>RC[-1],RC[-3]>=9,RC[-3]<10),30,IF(AND(RC[-3]>RC[-1],RC[-3]>=10,RC[-3]<11),20,IF(AND(RC[-3]>RC[-1],RC[-3]>=11,RC[-3]<12),10,IF(AND(RC[-3]>RC[-1],RC[-3]>=12),0))))))))))))))))))))))))))))))))) -> 65 | H640: =IF(RC[-3]="","",IF(RC[-3]<0.3,100,IF(AND(RC[-3]>=0.3,RC[-3]>0.4),95,IF(AND(RC[-3]>=0.4,RC[-3]<0.5),90,IF(AND(RC[-3]>=0.5,RC[-3]<0.6),85,IF(AND(RC[-3]>=0.6,RC[-3]<0.7),80,IF(AND(RC[-3]>=0.6,RC[-3]<1),80,IF(AND(RC[-3]>1,RC[-3]<2),50,IF(RC[-3]>2,0))))))))) ->  | I640: =IF(RC[-1]="",RC[-2],0.7*RC[-1]+0.3*RC[-2]) -> 65
A641: فارسیت اهواز | B641: سفاسی | C641: =VLOOKUP(RC[-1],Sheet1!R3C2:R802C3,2,FALSE) -> کانی غیر فلزی | D641: =VLOOKUP(RC[-2],Sheet1!R3C2:R802C9,8,FALSE) -> -12.194414893617022 | E641: =IF(VLOOKUP(RC[-3],Sheet1!R3C2:R803C11,10,FALSE)=0,"",VLOOKUP(Sheet2!RC[-3],Sheet1!R[1]C[-3]:R[801]C[6],10,FALSE)) ->  | F641: =Sheet1!R696C10 -> 31.547386804071571 | G641: =IF(RC[-3]<0,0,IF(AND(RC[-3]<RC[-1],RC[-3]<2),100,IF(AND(RC[-3]<RC[-1],RC[-3]>=2,RC[-3]<3),95,IF(AND(RC[-3]<RC[-1],RC[-3]>=3,RC[-3]<4),90,IF(AND(RC[-3]<RC[-1],RC[-3]>=4,RC[-3]<5),85,IF(AND(RC[-3]<RC[-1],RC[-3]>=5,RC[-3]<6),80,IF(AND(RC[-3]<RC[-1],RC[-3]>=6,RC[-3]<7),75,IF(AND(RC[-3]<RC[-1],RC[-3]>=7,RC[-3]<8),70,IF(AND(RC[-3]<RC[-1],RC[-3]>=8,RC[-3]<9),65,IF(AND(RC[-3]<RC[-1],RC[-3]>=9,RC[-3]<10),60,IF(AND(RC[-3]<RC[-1],RC[-3]>=10,RC[-3]<11),55,IF(AND(RC[-3]<RC[-1],RC[-3]>=11,RC[-3]<12),50,IF(AND(RC[-3]<RC[-1],RC[-3]>=12,RC[-3]<13),45,IF(AND(RC[-3]<RC[-1],RC[-3]>=13,RC[-3]<14),40,IF(AND(RC[-3]<RC[-1],RC[-3]>=14,RC[-3]<15),35,IF(AND(RC[-3]<RC[-1],RC[-3]>=15,RC[-3]<16),30,IF(AND(RC[-3]<RC[-1],RC[-3]>=16,RC[-3]<17),25,IF(AND(RC[-3]<RC[-1],RC[-3]>=17,RC[-3]<18),20,IF(AND(RC[-3]<RC[-1],RC[-3]>=18,RC[-3]<19),15,IF(AND(RC[-3]<RC[-1],RC[-3]>=19,RC[-3]<20),10,IF(AND(RC[-3]<RC[-1],RC[-3]>=20,RC[-3]<21),5,IF(AND(RC[-3]<RC[-1],RC[-3]>=21),0,IF(AND(RC[-3]>RC[-1],RC[-3]>=2,RC[-3]<3),90,IF(AND(RC[-3]>RC[-1],RC[-3]>=3,RC[-3]<4),90,IF(AND(RC[-3]>RC[-1],RC[-3]>=4,RC[-3]<5),80,IF(AND(RC[-3]>RC[-1],RC[-3]>=5,RC[-3]<6),70,IF(AND(RC[-3]>RC[-1],RC[-3]>=6,RC[-3]<7),60,IF(AND(RC[-3]>RC[-1],RC[-3]>=7,RC[-3]<8),50,IF(AND(RC[-3]>RC[-1],RC[-3]>=8,RC[-3]<9),40,IF(AND(RC[-3]>RC[-1],RC[-3]>=9,RC[-3]<10),30,IF(AND(RC[-3]>RC[-1],RC[-3]>=10,RC[-3]<11),20,IF(AND(RC[-3]>RC[-1],RC[-3]>=11,RC[-3]<12),10,IF(AND(RC[-3]>RC[-1],RC[-3]>=12),0))))))))))))))))))))))))))))))))) -> 0 | H641: =IF(RC[-3]="","",IF(RC[-3]<0.3,100,IF(AND(RC[-3]>=0.3,RC[-3]>0.4),95,IF(AND(RC[-3]>=0.4,RC[-3]<0.5),90,IF(AND(RC[-3]>=0.5,RC[-3]<0.6),85,IF(AND(RC[-3]>=0.6,RC[-3]<0.7),80,IF(AND(RC[-3]>=0.6,RC[-3]<1),80,IF(AND(RC[-3]>1,RC[-3]<2),50,IF(RC[-3]>2,0))))))))) ->  | I641: =IF(RC[-1]="",RC[-2],0.7*RC[-1]+0.3*RC[-2]) -> 0
A642: فارسیت درود | B642: سفارود | C642: =VLOOKUP(RC[-1],Sheet1!R3C2:R802C3,2,FALSE) -> کانی غیر فلزی | D642: =VLOOKUP(RC[-2],Sheet1!R3C2:R802C9,8,FALSE) -> -6.3309248554913298 | E642: =IF(VLOOKUP(RC[-3],Sheet1!R3C2:R803C11,10,FALSE)=0,"",VLOOKUP(Sheet2!RC[-3],Sheet1!R[1]C[-3]:R[801]C[6],10,FALSE)) ->  | F642: =Sheet1!R696C10 -> 31.547386804071571 | G642: =IF(RC[-3]<0,0,IF(AND(RC[-3]<RC[-1],RC[-3]<2),100,IF(AND(RC[-3]<RC[-1],RC[-3]>=2,RC[-3]<3),95,IF(AND(RC[-3]<RC[-1],RC[-3]>=3,RC[-3]<4),90,IF(AND(RC[-3]<RC[-1],RC[-3]>=4,RC[-3]<5),85,IF(AND(RC[-3]<RC[-1],RC[-3]>=5,RC[-3]<6),80,IF(AND(RC[-3]<RC[-1],RC[-3]>=6,RC[-3]<7),75,IF(AND(RC[-3]<RC[-1],RC[-3]>=7,RC[-3]<8),70,IF(AND(RC[-3]<RC[-1],RC[-3]>=8,RC[-3]<9),65,IF(AND(RC[-3]<RC[-1],RC[-3]>=9,RC[-3]<10),60,IF(AND(RC[-3]<RC[-1],RC[-3]>=10,RC[-3]<11),55,IF(AND(RC[-3]<RC[-1],RC[-3]>=11,RC[-3]<12),50,IF(AND(RC[-3]<RC[-1],RC[-3]>=12,RC[-3]<13),45,IF(AND(RC[-3]<RC[-1],RC[-3]>=13,RC[-3]<14),40,IF(AND(RC[-3]<RC[-1],RC[-3]>=14,RC[-3]<15),35,IF(AND(RC[-3]<RC[-1],RC[-3]>=15,RC[-3]<16),30,IF(AND(RC[-3]<RC[-1],RC[-3]>=16,RC[-3]<17),25,IF(AND(RC[-3]<RC[-1],RC[-3]>=17,RC[-3]<18),20,IF(AND(RC[-3]<RC[-1],RC[-3]>=18,RC[-3]<19),15,IF(AND(RC[-3]<RC[-1],RC[-3]>=19,RC[-3]<20),10,IF(AND(RC[-3]<RC[-1],RC[-3]>=20,RC[-3]<21),5,IF(AND(RC[-3]<RC[-1],RC[-3]>=21),0,IF(AND(RC[-3]>RC[-1],RC[-3]>=2,RC[-3]<3),90,IF(AND(RC[-3]>RC[-1],RC[-3]>=3,RC[-3]<4),90,IF(AND(RC[-3]>RC[-1],RC[-3]>=4,RC[-3]<5),80,IF(AND(RC[-3]>RC[-1],RC[-3]>=5,RC[-3]<6),70,IF(AND(RC[-3]>RC[-1],RC[-3]>=6,RC[-3]<7),60,IF(AND(RC[-3]>RC[-1],RC[-3]>=7,RC[-3]<8),50,IF(AND(RC[-3]>RC[-1],RC[-3]>=8,RC[-3]<9),40,IF(AND(RC[-3]>RC[-1],RC[-3]>=9,RC[-3]<10),30,IF(AND(RC[-3]>RC[-1],RC[-3]>=10,RC[-3]<11),20,IF(AND(RC[-3]>RC[-1],RC[-3]>=11,RC[-3]<12),10,IF(AND(RC[-3]>RC[-1],RC[-3]>=12),0))))))))))))))))))))))))))))))))) -> 0 | H642: =IF(RC[-3]="","",IF(RC[-3]<0.3,100,IF(AND(RC[-3]>=0.3,RC[-3]>0.4),95,IF(AND(RC[-3]>=0.4,RC[-3]<0.5),90,IF(AND(RC[-3]>=0.5,RC[-3]<0.6),85,IF(AND(RC[-3]>=0.6,RC[-3]<0.7),80,IF(AND(RC[-3]>=0.6,RC[-3]<1),80,IF(AND(RC[-3]>1,RC[-3]<2),50,IF(RC[-3]>2,0))))))))) ->  | I642: =IF(RC[-1]="",RC[-2],0.7*RC[-1]+0.3*RC[-2]) -> 0
A643: فرآورده نسوز پارس | B643: کفپارس | C643: =VLOOKUP(RC[-1],Sheet1!R3C2:R802C3,2,FALSE) -> کانی غیر فلزی | D643: =VLOOKUP(RC[-2],Sheet1!R3C2:R802C9,8,FALSE) -> 6.7419380857899389 | E643: =IF(VLOOKUP(RC[-3],Sheet1!R3C2:R803C11,10,FALSE)=0,"",VLOOKUP(Sheet2!RC[-3],Sheet1!R[1]C[-3]:R[801]C[6],10,FALSE)) ->  | F643: =Sheet1!R696C10 -> 31.547386804071571 | G643: =IF(RC[-3]<0,0,IF(AND(RC[-3]<RC[-1],RC[-3]<2),100,IF(AND(RC[-3]<RC[-1],RC[-3]>=2,RC[-3]<3),95,IF(AND(RC[-3]<RC[-1],RC[-3]>=3,RC[-3]<4),90,IF(AND(RC[-3]<RC[-1],RC[-3]>=4,RC[-3]<5),85,IF(AND(RC[-3]<RC[-1],RC[-3]>=5,RC[-3]<6),80,IF(AND(RC[-3]<RC[-1],RC[-3]>=6,RC[-3]<7),75,IF(AND(RC[-3]<RC[-1],RC[-3]>=7,RC[-3]<8),70,IF(AND(RC[-3]<RC[-1],RC[-3]>=8,RC[-3]<9),65,IF(AND(RC[-3]<RC[-1],RC[-3]>=9,RC[-3]<10),60,IF(AND(RC[-3]<RC[-1],RC[-3]>=10,RC[-3]<11),55,IF(AND(RC[-3]<RC[-1],RC[-3]>=11,RC[-3]<12),50,IF(AND(RC[-3]<RC[-1],RC[-3]>=12,RC[-3]<13),45,IF(AND(RC[-3]<RC[-1],RC[-3]>=13,RC[-3]<14),40,IF(AND(RC[-3]<RC[-1],RC[-3]>=14,RC[-3]<15),35,IF(AND(RC[-3]<RC[-1],RC[-3]>=15,RC[-3]<16),30,IF(AND(RC[-3]<RC[-1],RC[-3]>=16,RC[-3]<17),25,IF(AND(RC[-3]<RC[-1],RC[-3]>=17,RC[-3]<18),20,IF(AND(RC[-3]<RC[-1],RC[-3]>=18,RC[-3]<19),15,IF(AND(RC[-3]<RC[-1],RC[-3]>=19,RC[-3]<20),10,IF(AND(RC[-3]<RC[-1],RC[-3]>=20,RC[-3]<21),5,IF(AND(RC[-3]<RC[-1],RC[-3]>=21),0,IF(AND(RC[-3]>RC[-1],RC[-3]>=2,RC[-3]<3),90,IF(AND(RC[-3]>RC[-1],RC[-3]>=3,RC[-3]<4),90,IF(AND(RC[-3]>RC[-1],RC[-3]>=4,RC[-3]<5),80,IF(AND(RC[-3]>RC[-1],RC[-3]>=5,RC[-3]<6),70,IF(AND(RC[-3]>RC[-1],RC[-3]>=6,RC[-3]<7),60,IF(AND(RC[-3]>RC[-1],RC[-3]>=7,RC[-3]<8),50,IF(AND(RC[-3]>RC[-1],RC[-3]>=8,RC[-3]<9),40,IF(AND(RC[-3]>RC[-1],RC[-3]>=9,RC[-3]<10),30,IF(AND(RC[-3]>RC[-1],RC[-3]>=10,RC[-3]<11),20,IF(AND(RC[-3]>RC[-1],RC[-3]>=11,RC[-3]<12),10,IF(AND(RC[-3]>RC[-1],RC[-3]>=12),0))))))))))))))))))))))))))))))))) -> 75 | H643: =IF(RC[-3]="","",IF(RC[-3]<0.3,100,IF(AND(RC[-3]>=0.3,RC[-3]>0.4),95,IF(AND(RC[-3]>=0.4,RC[-3]<0.5),90,IF(AND(RC[-3]>=0.5,RC[-3]<0.6),85,IF(AND(RC[-3]>=0.6,RC[-3]<0.7),80,IF(AND(RC[-3]>=0.6,RC[-3]<1),80,IF(AND(RC[-3]>1,RC[-3]<2),50,IF(RC[-3]>2,0))))))))) ->  | I643: =IF(RC[-1]="",RC[-2],0.7*RC[-1]+0.3*RC[-2]) -> 75
A644: فرآورده های سیمان شرق | B644: کفرآور | C644: =VLOOKUP(RC[-1],Sheet1!R3C2:R802C3,2,FALSE) -> کانی غیر فلزی | D644: =VLOOKUP(RC[-2],Sheet1!R3C2:R802C9,8,FALSE) -> 10.189597343430936 | E644: =IF(VLOOKUP(RC[-3],Sheet1!R3C2:R803C11,10,FALSE)=0,"",VLOOKUP(Sheet2!RC[-3],Sheet1!R[1]C[-3]:R[801]C[6],10,FALSE)) ->  | F644: =Sheet1!R696C10 -> 31.547386804071571 | G644: =IF(RC[-3]<0,0,IF(AND(RC[-3]<RC[-1],RC[-3]<2),100,IF(AND(RC[-3]<RC[-1],RC[-3]>=2,RC[-3]<3),95,IF(AND(RC[-3]<RC[-1],RC[-3]>=3,RC[-3]<4),90,IF(AND(RC[-3]<RC[-1],RC[-3]>=4,RC[-3]<5),85,IF(AND(RC[-3]<RC[-1],RC[-3]>=5,RC[-3]<6),80,IF(AND(RC[-3]<RC[-1],RC[-3]>=6,RC[-3]<7),75,IF(AND(RC[-3]<RC[-1],RC[-3]>=7,RC[-3]<8),70,IF(AND(RC[-3]<RC[-1],RC[-3]>=8,RC[-3]<9),65,IF(AND(RC[-3]<RC[-1],RC[-3]>=9,RC[-3]<10),60,IF(AND(RC[-3]<RC[-1],RC[-3]>=10,RC[-3]<11),55,IF(AND(RC[-3]<RC[-1],RC[-3]>=11,RC[-3]<12),50,IF(AND(RC[-3]<RC[-1],RC[-3]>=12,RC[-3]<13),45,IF(AND(RC[-3]<RC[-1],RC[-3]>=13,RC[-3]<14),40,IF(AND(RC[-3]<RC[-1],RC[-3]>=14,RC[-3]<15),35,IF(AND(RC[-3]<RC[-1],RC[-3]>=15,RC[-3]<16),30,IF(AND(RC[-3]<RC[-1],RC[-3]>=16,RC[-3]<17),25,IF(AND(RC[-3]<RC[-1],RC[-3]>=17,RC[-3]<18),20,IF(AND(RC[-3]<RC[-1],RC[-3]>=18,RC[-3]<19),15,IF(AND(RC[-3]<RC[-1],RC[-3]>=19,RC[-3]<20),10,IF(AND(RC[-3]<RC[-1],RC[-3]>=20,RC[-3]<21),5,IF(AND(RC[-3]<RC[-1],RC[-3]>=21),0,IF(AND(RC[-3]>RC[-1],RC[-3]>=2,RC[-3]<3),90,IF(AND(RC[-3]>RC[-1],RC[-3]>=3,RC[-3]<4),90,IF(AND(RC[-3]>RC[-1],RC[-3]>=4,RC[-3]<5),80,IF(AND(RC[-3]>RC[-1],RC[-3]>=5,RC[-3]<6),70,IF(AND(RC[-3]>RC[-1],RC[-3]>=6,RC[-3]<7),60,IF(AND(RC[-3]>RC[-1],RC[-3]>=7,RC[-3]<8),50,IF(AND(RC[-3]>RC[-1],RC[-3]>=8,RC[-3]<9),40,IF(AND(RC[-3]>RC[-1],RC[-3]>=9,RC[-3]<10),30,IF(AND(RC[-3]>RC[-1],RC[-3]>=10,RC[-3]<11),20,IF(AND(RC[-3]>RC[-1],RC[-3]>=11,RC[-3]<12),10,IF(AND(RC[-3]>RC[-1],RC[-3]>=12),0))))))))))))))))))))))))))))))))) -> 55 | H644: =IF(RC[-3]="","",IF(RC[-3]<0.3,100,IF(AND(RC[-3]>=0.3,RC[-3]>0.4),95,IF(AND(RC[-3]>=0.4,RC[-3]<0.5),90,IF(AND(RC[-3]>=0.5,RC[-3]<0.6),85,IF(AND(RC[-3]>=0.6,RC[-3]<0.7),80,IF(AND(RC[-3]>=0.6,RC[-3]<1),80,IF(AND(RC[-3]>1,RC[-3]<2),50,IF(RC[-3]>2,0))))))))) ->  | I644: =IF(RC[-1]="",RC[-2],0.7*RC[-1]+0.3*RC[-2]) -> 55
A645: فرآورده های نسوز آذر | B645: کاذر | C645: =VLOOKUP(RC[-1],Sheet1!R3C2:R802C3,2,FALSE) -> کانی غیر فلزی | D645: =VLOOKUP(RC[-2],Sheet1!R3C2:R802C9,8,FALSE) -> 3.7765076034929792 | E645: =IF(VLOOKUP(RC[-3],Sheet1!R3C2:R803C11,10,FALSE)=0,"",VLOOKUP(Sheet2!RC[-3],Sheet1!R[1]C[-3]:R[801]C[6],10,FALSE)) ->  | F645: =Sheet1!R696C10 -> 31.547386804071571 | G645: =IF(RC[-3]<0,0,IF(AND(RC[-3]<RC[-1],RC[-3]<2),100,IF(AND(RC[-3]<RC[-1],RC[-3]>=2,RC[-3]<3),95,IF(AND(RC[-3]<RC[-1],RC[-3]>=3,RC[-3]<4),90,IF(AND(RC[-3]<RC[-1],RC[-3]>=4,RC[-3]<5),85,IF(AND(RC[-3]<RC[-1],RC[-3]>=5,RC[-3]<6),80,IF(AND(RC[-3]<RC[-1],RC[-3]>=6,RC[-3]<7),75,IF(AND(RC[-3]<RC[-1],RC[-3]>=7,RC[-3]<8),70,IF(AND(RC[-3]<RC[-1],RC[-3]>=8,RC[-3]<9),65,IF(AND(RC[-3]<RC[-1],RC[-3]>=9,RC[-3]<10),60,IF(AND(RC[-3]<RC[-1],RC[-3]>=10,RC[-3]<11),55,IF(AND(RC[-3]<RC[-1],RC[-3]>=11,RC[-3]<12),50,IF(AND(RC[-3]<RC[-1],RC[-3]>=12,RC[-3]<13),45,IF(AND(RC[-3]<RC[-1],RC[-3]>=13,RC[-3]<14),40,IF(AND(RC[-3]<RC[-1],RC[-3]>=14,RC[-3]<15),35,IF(AND(RC[-3]<RC[-1],RC[-3]>=15,RC[-3]<16),30,IF(AND(RC[-3]<RC[-1],RC[-3]>=16,RC[-3]<17),25,IF(AND(RC[-3]<RC[-1],RC[-3]>=17,RC[-3]<18),20,IF(AND(RC[-3]<RC[-1],RC[-3]>=18,RC[-3]<19),15,IF(AND(RC[-3]<RC[-1],RC[-3]>=19,RC[-3]<20),10,IF(AND(RC[-3]<RC[-1],RC[-3]>=20,RC[-3]<21),5,IF(AND(RC[-3]<RC[-1],RC[-3]>=21),0,IF(AND(RC[-3]>RC[-1],RC[-3]>=2,RC[-3]<3),90,IF(AND(RC[-3]>RC[-1],RC[-3]>=3,RC[-3]<4),90,IF(AND(RC[-3]>RC[-1],RC[-3]>=4,RC[-3]<5),80,IF(AND(RC[-3]>RC[-1],RC[-3]>=5,RC[-3]<6),70,IF(AND(RC[-3]>RC[-1],RC[-3]>=6,RC[-3]<7),60,IF(AND(RC[-3]>RC[-1],RC[-3]>=7,RC[-3]<8),50,IF(AND(RC[-3]>RC[-1],RC[-3]>=8,RC[-3]<9),40,IF(AND(RC[-3]>RC[-1],RC[-3]>=9,RC[-3]<10),30,IF(AND(RC[-3]>RC[-1],RC[-3]>=10,RC[-3]<11),20,IF(AND(RC[-3]>RC[-1],RC[-3]>=11,RC[-3]<12),10,IF(AND(RC[-3]>RC[-1],RC[-3]>=12),0))))))))))))))))))))))))))))))))) -> 90 | H645: =IF(RC[-3]="","",IF(RC[-3]<0.3,100,IF(AND(RC[-3]>=0.3,RC[-3]>0.4),95,IF(AND(RC[-3]>=0.4,RC[-3]<0.5),90,IF(AND(RC[-3]>=0.5,RC[-3]<0.6),85,IF(AND(RC[-3]>=0.6,RC[-3]<0.7),80,IF(AND(RC[-3]>=0.6,RC[-3]<1),80,IF(AND(RC[-3]>1,RC[-3]<2),50,IF(RC[-3]>2,0))))))))) ->  | I645: =IF(RC[-1]="",RC[-2],0.7*RC[-1]+0.3*RC[-2]) -> 90
A646: فرآورده های نسوز ایران | B646: کفرا | C646: =VLOOKUP(RC[-1],Sheet1!R3C2:R802C3,2,FALSE) -> کانی غیر فلزی | D646: =VLOOKUP(RC[-2],Sheet1!R3C2:R802C9,8,FALSE) -> 4.4086345778168203 | E646: =IF(VLOOKUP(RC[-3],Sheet1!R3C2:R803C11,10,FALSE)=0,"",VLOOKUP(Sheet2!RC[-3],Sheet1!R[1]C[-3]:R[801]C[6],10,FALSE)) ->  | F646: =Sheet1!R696C10 -> 31.547386804071571 | G646: =IF(RC[-3]<0,0,IF(AND(RC[-3]<RC[-1],RC[-3]<2),100,IF(AND(RC[-3]<RC[-1],RC[-3]>=2,RC[-3]<3),95,IF(AND(RC[-3]<RC[-1],RC[-3]>=3,RC[-3]<4),90,IF(AND(RC[-3]<RC[-1],RC[-3]>=4,RC[-3]<5),85,IF(AND(RC[-3]<RC[-1],RC[-3]>=5,RC[-3]<6),80,IF(AND(RC[-3]<RC[-1],RC[-3]>=6,RC[-3]<7),75,IF(AND(RC[-3]<RC[-1],RC[-3]>=7,RC[-3]<8),70,IF(AND(RC[-3]<RC[-1],RC[-3]>=8,RC[-3]<9),65,IF(AND(RC[-3]<RC[-1],RC[-3]>=9,RC[-3]<10),60,IF(AND(RC[-3]<RC[-1],RC[-3]>=10,RC[-3]<11),55,IF(AND(RC[-3]<RC[-1],RC[-3]>=11,RC[-3]<12),50,IF(AND(RC[-3]<RC[-1],RC[-3]>=12,RC[-3]<13),45,IF(AND(RC[-3]<RC[-1],RC[-3]>=13,RC[-3]<14),40,IF(AND(RC[-3]<RC[-1],RC[-3]>=14,RC[-3]<15),35,IF(AND(RC[-3]<RC[-1],RC[-3]>=15,RC[-3]<16),30,IF(AND(RC[-3]<RC[-1],RC[-3]>=16,RC[-3]<17),25,IF(AND(RC[-3]<RC[-1],RC[-3]>=17,RC[-3]<18),20,IF(AND(RC[-3]<RC[-1],RC[-3]>=18,RC[-3]<19),15,IF(AND(RC[-3]<RC[-1],RC[-3]>=19,RC[-3]<20),10,IF(AND(RC[-3]<RC[-1],RC[-3]>=20,RC[-3]<21),5,IF(AND(RC[-3]<RC[-1],RC[-3]>=21),0,IF(AND(RC[-3]>RC[-1],RC[-3]>=2,RC[-3]<3),90,IF(AND(RC[-3]>RC[-1],RC[-3]>=3,RC[-3]<4),90,IF(AND(RC[-3]>RC[-1],RC[-3]>=4,RC[-3]<5),80,IF(AND(RC[-3]>RC[-1],RC[-3]>=5,RC[-3]<6),70,IF(AND(RC[-3]>RC[-1],RC[-3]>=6,RC[-3]<7),60,IF(AND(RC[-3]>RC[-1],RC[-3]>=7,RC[-3]<8),50,IF(AND(RC[-3]>RC[-1],RC[-3]>=8,RC[-3]<9),40,IF(AND(RC[-3]>RC[-1],RC[-3]>=9,RC[-3]<10),30,IF(AND(RC[-3]>RC[-1],RC[-3]>=10,RC[-3]<11),20,IF(AND(RC[-3]>RC[-1],RC[-3]>=11,RC[-3]<12),10,IF(AND(RC[-3]>RC[-1],RC[-3]>=12),0))))))))))))))))))))))))))))))))) -> 85 | H646: =IF(RC[-3]="","",IF(RC[-3]<0.3,100,IF(AND(RC[-3]>=0.3,RC[-3]>0.4),95,IF(AND(RC[-3]>=0.4,RC[-3]<0.5),90,IF(AND(RC[-3]>=0.5,RC[-3]<0.6),85,IF(AND(RC[-3]>=0.6,RC[-3]<0.7),80,IF(AND(RC[-3]>=0.6,RC[-3]<1),80,IF(AND(RC[-3]>1,RC[-3]<2),50,IF(RC[-3]>2,0))))))))) ->  | I646: =IF(RC[-1]="",RC[-2],0.7*RC[-1]+0.3*RC[-2]) -> 85
A647: فرانسوز یزد | B647: کایزد | C647: =VLOOKUP(RC[-1],Sheet1!R3C2:R802C3,2,FALSE) -> کانی غیر فلزی | D647: =VLOOKUP(RC[-2],Sheet1!R3C2:R802C9,8,FALSE) -> 16.340558138712559 | E647: =IF(VLOOKUP(RC[-3],Sheet1!R3C2:R803C11,10,FALSE)=0,"",VLOOKUP(Sheet2!RC[-3],Sheet1!R[1]C[-3]:R[801]C[6],10,FALSE)) ->  | F647: =Sheet1!R696C10 -> 31.547386804071571 | G647: =IF(RC[-3]<0,0,IF(AND(RC[-3]<RC[-1],RC[-3]<2),100,IF(AND(RC[-3]<RC[-1],RC[-3]>=2,RC[-3]<3),95,IF(AND(RC[-3]<RC[-1],RC[-3]>=3,RC[-3]<4),90,IF(AND(RC[-3]<RC[-1],RC[-3]>=4,RC[-3]<5),85,IF(AND(RC[-3]<RC[-1],RC[-3]>=5,RC[-3]<6),80,IF(AND(RC[-3]<RC[-1],RC[-3]>=6,RC[-3]<7),75,IF(AND(RC[-3]<RC[-1],RC[-3]>=7,RC[-3]<8),70,IF(AND(RC[-3]<RC[-1],RC[-3]>=8,RC[-3]<9),65,IF(AND(RC[-3]<RC[-1],RC[-3]>=9,RC[-3]<10),60,IF(AND(RC[-3]<RC[-1],RC[-3]>=10,RC[-3]<11),55,IF(AND(RC[-3]<RC[-1],RC[-3]>=11,RC[-3]<12),50,IF(AND(RC[-3]<RC[-1],RC[-3]>=12,RC[-3]<13),45,IF(AND(RC[-3]<RC[-1],RC[-3]>=13,RC[-3]<14),40,IF(AND(RC[-3]<RC[-1],RC[-3]>=14,RC[-3]<15),35,IF(AND(RC[-3]<RC[-1],RC[-3]>=15,RC[-3]<16),30,IF(AND(RC[-3]<RC[-1],RC[-3]>=16,RC[-3]<17),25,IF(AND(RC[-3]<RC[-1],RC[-3]>=17,RC[-3]<18),20,IF(AND(RC[-3]<RC[-1],RC[-3]>=18,RC[-3]<19),15,IF(AND(RC[-3]<RC[-1],RC[-3]>=19,RC[-3]<20),10,IF(AND(RC[-3]<RC[-1],RC[-3]>=20,RC[-3]<21),5,IF(AND(RC[-3]<RC[-1],RC[-3]>=21),0,IF(AND(RC[-3]>RC[-1],RC[-3]>=2,RC[-3]<3),90,IF(AND(RC[-3]>RC[-1],RC[-3]>=3,RC[-3]<4),90,IF(AND(RC[-3]>RC[-1],RC[-3]>=4,RC[-3]<5),80,IF(AND(RC[-3]>RC[-1],RC[-3]>=5,RC[-3]<6),70,IF(AND(RC[-3]>RC[-1],RC[-3]>=6,RC[-3]<7),60,IF(AND(RC[-3]>RC[-1],RC[-3]>=7,RC[-3]<8),50,IF(AND(RC[-3]>RC[-1],RC[-3]>=8,RC[-3]<9),40,IF(AND(RC[-3]>RC[-1],RC[-3]>=9,RC[-3]<10),30,IF(AND(RC[-3]>RC[-1],RC[-3]>=10,RC[-3]<11),20,IF(AND(RC[-3]>RC[-1],RC[-3]>=11,RC[-3]<12),10,IF(AND(RC[-3]>RC[-1],RC[-3]>=12),0))))))))))))))))))))))))))))))))) -> 25 | H647: =IF(RC[-3]="","",IF(RC[-3]<0.3,100,IF(AND(RC[-3]>=0.3,RC[-3]>0.4),95,IF(AND(RC[-3]>=0.4,RC[-3]<0.5),90,IF(AND(RC[-3]>=0.5,RC[-3]<0.6),85,IF(AND(RC[-3]>=0.6,RC[-3]<0.7),80,IF(AND(RC[-3]>=0.6,RC[-3]<1),80,IF(AND(RC[-3]>1,RC[-3]<2),50,IF(RC[-3]>2,0))))))))) ->  | I647: =IF(RC[-1]="",RC[-2],0.7*RC[-1]+0.3*RC[-2]) -> 25
A648: مرجان کار | B648: کمرجان | C648: =VLOOKUP(RC[-1],Sheet1!R3C2:R802C3,2,FALSE) -> کانی غیر فلزی | D648: =VLOOKUP(RC[-2],Sheet1!R3C2:R802C9,8,FALSE) -> 18.160343580752713 | E648: =IF(VLOOKUP(RC[-3],Sheet1!R3C2:R803C11,10,FALSE)=0,"",VLOOKUP(Sheet2!RC[-3],Sheet1!R[1]C[-3]:R[801]C[6],10,FALSE)) ->  | F648: =Sheet1!R696C10 -> 31.547386804071571 | G648: =IF(RC[-3]<0,0,IF(AND(RC[-3]<RC[-1],RC[-3]<2),100,IF(AND(RC[-3]<RC[-1],RC[-3]>=2,RC[-3]<3),95,IF(AND(RC[-3]<RC[-1],RC[-3]>=3,RC[-3]<4),90,IF(AND(RC[-3]<RC[-1],RC[-3]>=4,RC[-3]<5),85,IF(AND(RC[-3]<RC[-1],RC[-3]>=5,RC[-3]<6),80,IF(AND(RC[-3]<RC[-1],RC[-3]>=6,RC[-3]<7),75,IF(AND(RC[-3]<RC[-1],RC[-3]>=7,RC[-3]<8),70,IF(AND(RC[-3]<RC[-1],RC[-3]>=8,RC[-3]<9),65,IF(AND(RC[-3]<RC[-1],RC[-3]>=9,RC[-3]<10),60,IF(AND(RC[-3]<RC[-1],RC[-3]>=10,RC[-3]<11),55,IF(AND(RC[-3]<RC[-1],RC[-3]>=11,RC[-3]<12),50,IF(AND(RC[-3]<RC[-1],RC[-3]>=12,RC[-3]<13),45,IF(AND(RC[-3]<RC[-1],RC[-3]>=13,RC[-3]<14),40,IF(AND(RC[-3]<RC[-1],RC[-3]>=14,RC[-3]<15),35,IF(AND(RC[-3]<RC[-1],RC[-3]>=15,RC[-3]<16),30,IF(AND(RC[-3]<RC[-1],RC[-3]>=16,RC[-3]<17),25,IF(AND(RC[-3]<RC[-1],RC[-3]>=17,RC[-3]<18),20,IF(AND(RC[-3]<RC[-1],RC[-3]>=18,RC[-3]<19),15,IF(AND(RC[-3]<RC[-1],RC[-3]>=19,RC[-3]<20),10,IF(AND(RC[-3]<RC[-1],RC[-3]>=20,RC[-3]<21),5,IF(AND(RC[-3]<RC[-1],RC[-3]>=21),0,IF(AND(RC[-3]>RC[-1],RC[-3]>=2,RC[-3]<3),90,IF(AND(RC[-3]>RC[-1],RC[-3]>=3,RC[-3]<4),90,IF(AND(RC[-3]>RC[-1],RC[-3]>=4,RC[-3]<5),80,IF(AND(RC[-3]>RC[-1],RC[-3]>=5,RC[-3]<6),70,IF(AND(RC[-3]>RC[-1],RC[-3]>=6,RC[-3]<7),60,IF(AND(RC[-3]>RC[-1],RC[-3]>=7,RC[-3]<8),50,IF(AND(RC[-3]>RC[-1],RC[-3]>=8,RC[-3]<9),40,IF(AND(RC[-3]>RC[-1],RC[-3]>=9,RC[-3]<10),30,IF(AND(RC[-3]>RC[-1],RC[-3]>=10,RC[-3]<11),20,IF(AND(RC[-3]>RC[-1],RC[-3]>=11,RC[-3]<12),10,IF(AND(RC[-3]>RC[-1],RC[-3]>=12),0))))))))))))))))))))))))))))))))) -> 15 | H648: =IF(RC[-3]="","",IF(RC[-3]<0.3,100,IF(AND(RC[-3]>=0.3,RC[-3]>0.4),95,IF(AND(RC[-3]>=0.4,RC[-3]<0.5),90,IF(AND(RC[-3]>=0.5,RC[-3]<0.6),85,IF(AND(RC[-3]>=0.6,RC[-3]<0.7),80,IF(AND(RC[-3]>=0.6,RC[-3]<1),80,IF(AND(RC[-3]>1,RC[-3]<2),50,IF(RC[-3]>2,0))))))))) ->  | I648: =IF(RC[-1]="",RC[-2],0.7*RC[-1]+0.3*RC[-2]) -> 15
A649: ورزیران | B649: کورز | C649: =VLOOKUP(RC[-1],Sheet1!R3C2:R802C3,2,FALSE) -> کانی غیر فلزی | D649: =VLOOKUP(RC[-2],Sheet1!R3C2:R802C9,8,FALSE) -> 54.210836640245958 | E649: =IF(VLOOKUP(RC[-3],Sheet1!R3C2:R803C11,10,FALSE)=0,"",VLOOKUP(Sheet2!RC[-3],Sheet1!R[1]C[-3]:R[801]C[6],10,FALSE)) ->  | F649: =Sheet1!R696C10 -> 31.547386804071571 | G649: =IF(RC[-3]<0,0,IF(AND(RC[-3]<RC[-1],RC[-3]<2),100,IF(AND(RC[-3]<RC[-1],RC[-3]>=2,RC[-3]<3),95,IF(AND(RC[-3]<RC[-1],RC[-3]>=3,RC[-3]<4),90,IF(AND(RC[-3]<RC[-1],RC[-3]>=4,RC[-3]<5),85,IF(AND(RC[-3]<RC[-1],RC[-3]>=5,RC[-3]<6),80,IF(AND(RC[-3]<RC[-1],RC[-3]>=6,RC[-3]<7),75,IF(AND(RC[-3]<RC[-1],RC[-3]>=7,RC[-3]<8),70,IF(AND(RC[-3]<RC[-1],RC[-3]>=8,RC[-3]<9),65,IF(AND(RC[-3]<RC[-1],RC[-3]>=9,RC[-3]<10),60,IF(AND(RC[-3]<RC[-1],RC[-3]>=10,RC[-3]<11),55,IF(AND(RC[-3]<RC[-1],RC[-3]>=11,RC[-3]<12),50,IF(AND(RC[-3]<RC[-1],RC[-3]>=12,RC[-3]<13),45,IF(AND(RC[-3]<RC[-1],RC[-3]>=13,RC[-3]<14),40,IF(AND(RC[-3]<RC[-1],RC[-3]>=14,RC[-3]<15),35,IF(AND(RC[-3]<RC[-1],RC[-3]>=15,RC[-3]<16),30,IF(AND(RC[-3]<RC[-1],RC[-3]>=16,RC[-3]<17),25,IF(AND(RC[-3]<RC[-1],RC[-3]>=17,RC[-3]<18),20,IF(AND(RC[-3]<RC[-1],RC[-3]>=18,RC[-3]<19),15,IF(AND(RC[-3]<RC[-1],RC[-3]>=19,RC[-3]<20),10,IF(AND(RC[-3]<RC[-1],RC[-3]>=20,RC[-3]<21),5,IF(AND(RC[-3]<RC[-1],RC[-3]>=21),0,IF(AND(RC[-3]>RC[-1],RC[-3]>=2,RC[-3]<3),90,IF(AND(RC[-3]>RC[-1],RC[-3]>=3,RC[-3]<4),90,IF(AND(RC[-3]>RC[-1],RC[-3]>=4,RC[-3]<5),80,IF(AND(RC[-3]>RC[-1],RC[-3]>=5,RC[-3]<6),70,IF(AND(RC[-3]>RC[-1],RC[-3]>=6,RC[-3]<7),60,IF(AND(RC[-3]>RC[-1],RC[-3]>=7,RC[-3]<8),50,IF(AND(RC[-3]>RC[-1],RC[-3]>=8,RC[-3]<9),40,IF(AND(RC[-3]>RC[-1],RC[-3]>=9,RC[-3]<10),30,IF(AND(RC[-3]>RC[-1],RC[-3]>=10,RC[-3]<11),20,IF(AND(RC[-3]>RC[-1],RC[-3]>=11,RC[-3]<12),10,IF(AND(RC[-3]>RC[-1],RC[-3]>=12),0))))))))))))))))))))))))))))))))) -> 0 | H649: =IF(RC[-3]="","",IF(RC[-3]<0.3,100,IF(AND(RC[-3]>=0.3,RC[-3]>0.4),95,IF(AND(RC[-3]>=0.4,RC[-3]<0.5),90,IF(AND(RC[-3]>=0.5,RC[-3]<0.6),85,IF(AND(RC[-3]>=0.6,RC[-3]<0.7),80,IF(AND(RC[-3]>=0.6,RC[-3]<1),80,IF(AND(RC[-3]>1,RC[-3]<2),50,IF(RC[-3]>2,0))))))))) ->  | I649: =IF(RC[-1]="",RC[-2],0.7*RC[-1]+0.3*RC[-2]) -> 0
A650: آرتاویل تایر | B650: پارتا | C650: =VLOOKUP(RC[-1],Sheet1!R3C2:R802C3,2,FALSE) -> لاستیک و پلاستیک | D650: =VLOOKUP(RC[-2],Sheet1!R3C2:R802C9,8,FALSE) -> 12.404849702254198 | E650: =IF(VLOOKUP(RC[-3],Sheet1!R3C2:R803C11,10,FALSE)=0,"",VLOOKUP(Sheet2!RC[-3],Sheet1!R[1]C[-3]:R[801]C[6],10,FALSE)) ->  | F650: =Sheet1!R709C10 -> 24.085633469465741 | G650: =IF(RC[-3]<0,0,IF(AND(RC[-3]<RC[-1],RC[-3]<2),100,IF(AND(RC[-3]<RC[-1],RC[-3]>=2,RC[-3]<3),95,IF(AND(RC[-3]<RC[-1],RC[-3]>=3,RC[-3]<4),90,IF(AND(RC[-3]<RC[-1],RC[-3]>=4,RC[-3]<5),85,IF(AND(RC[-3]<RC[-1],RC[-3]>=5,RC[-3]<6),80,IF(AND(RC[-3]<RC[-1],RC[-3]>=6,RC[-3]<7),75,IF(AND(RC[-3]<RC[-1],RC[-3]>=7,RC[-3]<8),70,IF(AND(RC[-3]<RC[-1],RC[-3]>=8,RC[-3]<9),65,IF(AND(RC[-3]<RC[-1],RC[-3]>=9,RC[-3]<10),60,IF(AND(RC[-3]<RC[-1],RC[-3]>=10,RC[-3]<11),55,IF(AND(RC[-3]<RC[-1],RC[-3]>=11,RC[-3]<12),50,IF(AND(RC[-3]<RC[-1],RC[-3]>=12,RC[-3]<13),45,IF(AND(RC[-3]<RC[-1],RC[-3]>=13,RC[-3]<14),40,IF(AND(RC[-3]<RC[-1],RC[-3]>=14,RC[-3]<15),35,IF(AND(RC[-3]<RC[-1],RC[-3]>=15,RC[-3]<16),30,IF(AND(RC[-3]<RC[-1],RC[-3]>=16,RC[-3]<17),25,IF(AND(RC[-3]<RC[-1],RC[-3]>=17,RC[-3]<18),20,IF(AND(RC[-3]<RC[-1],RC[-3]>=18,RC[-3]<19),15,IF(AND(RC[-3]<RC[-1],RC[-3]>=19,RC[-3]<20),10,IF(AND(RC[-3]<RC[-1],RC[-3]>=20,RC[-3]<21),5,IF(AND(RC[-3]<RC[-1],RC[-3]>=21),0,IF(AND(RC[-3]>RC[-1],RC[-3]>=2,RC[-3]<3),90,IF(AND(RC[-3]>RC[-1],RC[-3]>=3,RC[-3]<4),90,IF(AND(RC[-3]>RC[-1],RC[-3]>=4,RC[-3]<5),80,IF(AND(RC[-3]>RC[-1],RC[-3]>=5,RC[-3]<6),70,IF(AND(RC[-3]>RC[-1],RC[-3]>=6,RC[-3]<7),60,IF(AND(RC[-3]>RC[-1],RC[-3]>=7,RC[-3]<8),50,IF(AND(RC[-3]>RC[-1],RC[-3]>=8,RC[-3]<9),40,IF(AND(RC[-3]>RC[-1],RC[-3]>=9,RC[-3]<10),30,IF(AND(RC[-3]>RC[-1],RC[-3]>=10,RC[-3]<11),20,IF(AND(RC[-3]>RC[-1],RC[-3]>=11,RC[-3]<12),10,IF(AND(RC[-3]>RC[-1],RC[-3]>=12),0))))))))))))))))))))))))))))))))) -> 45 | H650: =IF(RC[-3]="","",IF(RC[-3]<0.3,100,IF(AND(RC[-3]>=0.3,RC[-3]>0.4),95,IF(AND(RC[-3]>=0.4,RC[-3]<0.5),90,IF(AND(RC[-3]>=0.5,RC[-3]<0.6),85,IF(AND(RC[-3]>=0.6,RC[-3]<0.7),80,IF(AND(RC[-3]>=0.6,RC[-3]<1),80,IF(AND(RC[-3]>1,RC[-3]<2),50,IF(RC[-3]>2,0))))))))) ->  | I650: =IF(RC[-1]="",RC[-2],0.7*RC[-1]+0.3*RC[-2]) -> 45
A651: ایران تایر | B651: پتایر | C651: =VLOOKUP(RC[-1],Sheet1!R3C2:R802C3,2,FALSE) -> لاستیک و پلاستیک | D651: =VLOOKUP(RC[-2],Sheet1!R3C2:R802C9,8,FALSE) -> 11.776628776137288 | E651: =IF(VLOOKUP(RC[-3],Sheet1!R3C2:R803C11,10,FALSE)=0,"",VLOOKUP(Sheet2!RC[-3],Sheet1!R[1]C[-3]:R[801]C[6],10,FALSE)) ->  | F651: =Sheet1!R709C10 -> 24.085633469465741 | G651: =IF(RC[-3]<0,0,IF(AND(RC[-3]<RC[-1],RC[-3]<2),100,IF(AND(RC[-3]<RC[-1],RC[-3]>=2,RC[-3]<3),95,IF(AND(RC[-3]<RC[-1],RC[-3]>=3,RC[-3]<4),90,IF(AND(RC[-3]<RC[-1],RC[-3]>=4,RC[-3]<5),85,IF(AND(RC[-3]<RC[-1],RC[-3]>=5,RC[-3]<6),80,IF(AND(RC[-3]<RC[-1],RC[-3]>=6,RC[-3]<7),75,IF(AND(RC[-3]<RC[-1],RC[-3]>=7,RC[-3]<8),70,IF(AND(RC[-3]<RC[-1],RC[-3]>=8,RC[-3]<9),65,IF(AND(RC[-3]<RC[-1],RC[-3]>=9,RC[-3]<10),60,IF(AND(RC[-3]<RC[-1],RC[-3]>=10,RC[-3]<11),55,IF(AND(RC[-3]<RC[-1],RC[-3]>=11,RC[-3]<12),50,IF(AND(RC[-3]<RC[-1],RC[-3]>=12,RC[-3]<13),45,IF(AND(RC[-3]<RC[-1],RC[-3]>=13,RC[-3]<14),40,IF(AND(RC[-3]<RC[-1],RC[-3]>=14,RC[-3]<15),35,IF(AND(RC[-3]<RC[-1],RC[-3]>=15,RC[-3]<16),30,IF(AND(RC[-3]<RC[-1],RC[-3]>=16,RC[-3]<17),25,IF(AND(RC[-3]<RC[-1],RC[-3]>=17,RC[-3]<18),20,IF(AND(RC[-3]<RC[-1],RC[-3]>=18,RC[-3]<19),15,IF(AND(RC[-3]<RC[-1],RC[-3]>=19,RC[-3]<20),10,IF(AND(RC[-3]<RC[-1],RC[-3]>=20,RC[-3]<21),5,IF(AND(RC[-3]<RC[-1],RC[-3]>=21),0,IF(AND(RC[-3]>RC[-1],RC[-3]>=2,RC[-3]<3),90,IF(AND(RC[-3]>RC[-1],RC[-3]>=3,RC[-3]<4),90,IF(AND(RC[-3]>RC[-1],RC[-3]>=4,RC[-3]<5),80,IF(AND(RC[-3]>RC[-1],RC[-3]>=5,RC[-3]<6),70,IF(AND(RC[-3]>RC[-1],RC[-3]>=6,RC[-3]<7),60,IF(AND(RC[-3]>RC[-1],RC[-3]>=7,RC[-3]<8),50,IF(AND(RC[-3]>RC[-1],RC[-3]>=8,RC[-3]<9),40,IF(AND(RC[-3]>RC[-1],RC[-3]>=9,RC[-3]<10),30,IF(AND(RC[-3]>RC[-1],RC[-3]>=10,RC[-3]<11),20,IF(AND(RC[-3]>RC[-1],RC[-3]>=11,RC[-3]<12),10,IF(AND(RC[-3]>RC[-1],RC[-3]>=12),0))))))))))))))))))))))))))))))))) -> 50 | H651: =IF(RC[-3]="","",IF(RC[-3]<0.3,100,IF(AND(RC[-3]>=0.3,RC[-3]>0.4),95,IF(AND(RC[-3]>=0.4,RC[-3]<0.5),90,IF(AND(RC[-3]>=0.5,RC[-3]<0.6),85,IF(AND(RC[-3]>=0.6,RC[-3]<0.7),80,IF(AND(RC[-3]>=0.6,RC[-3]<1),80,IF(AND(RC[-3]>1,RC[-3]<2),50,IF(RC[-3]>2,0))))))))) ->  | I651: =IF(RC[-1]="",RC[-2],0.7*RC[-1]+0.3*RC[-2]) -> 50
A652: ایران یاسا | B652: پاسا | C652: =VLOOKUP(RC[-1],Sheet1!R3C2:R802C3,2,FALSE) -> لاستیک و پلاستیک | D652: =VLOOKUP(RC[-2],Sheet1!R3C2:R802C9,8,FALSE) -> 5.2628024054601861 | E652: =IF(VLOOKUP(RC[-3],Sheet1!R3C2:R803C11,10,FALSE)=0,"",VLOOKUP(Sheet2!RC[-3],Sheet1!R[1]C[-3]:R[801]C[6],10,FALSE)) ->  | F652: =Sheet1!R709C10 -> 24.085633469465741 | G652: =IF(RC[-3]<0,0,IF(AND(RC[-3]<RC[-1],RC[-3]<2),100,IF(AND(RC[-3]<RC[-1],RC[-3]>=2,RC[-3]<3),95,IF(AND(RC[-3]<RC[-1],RC[-3]>=3,RC[-3]<4),90,IF(AND(RC[-3]<RC[-1],RC[-3]>=4,RC[-3]<5),85,IF(AND(RC[-3]<RC[-1],RC[-3]>=5,RC[-3]<6),80,IF(AND(RC[-3]<RC[-1],RC[-3]>=6,RC[-3]<7),75,IF(AND(RC[-3]<RC[-1],RC[-3]>=7,RC[-3]<8),70,IF(AND(RC[-3]<RC[-1],RC[-3]>=8,RC[-3]<9),65,IF(AND(RC[-3]<RC[-1],RC[-3]>=9,RC[-3]<10),60,IF(AND(RC[-3]<RC[-1],RC[-3]>=10,RC[-3]<11),55,IF(AND(RC[-3]<RC[-1],RC[-3]>=11,RC[-3]<12),50,IF(AND(RC[-3]<RC[-1],RC[-3]>=12,RC[-3]<13),45,IF(AND(RC[-3]<RC[-1],RC[-3]>=13,RC[-3]<14),40,IF(AND(RC[-3]<RC[-1],RC[-3]>=14,RC[-3]<15),35,IF(AND(RC[-3]<RC[-1],RC[-3]>=15,RC[-3]<16),30,IF(AND(RC[-3]<RC[-1],RC[-3]>=16,RC[-3]<17),25,IF(AND(RC[-3]<RC[-1],RC[-3]>=17,RC[-3]<18),20,IF(AND(RC[-3]<RC[-1],RC[-3]>=18,RC[-3]<19),15,IF(AND(RC[-3]<RC[-1],RC[-3]>=19,RC[-3]<20),10,IF(AND(RC[-3]<RC[-1],RC[-3]>=20,RC[-3]<21),5,IF(AND(RC[-3]<RC[-1],RC[-3]>=21),0,IF(AND(RC[-3]>RC[-1],RC[-3]>=2,RC[-3]<3),90,IF(AND(RC[-3]>RC[-1],RC[-3]>=3,RC[-3]<4),90,IF(AND(RC[-3]>RC[-1],RC[-3]>=4,RC[-3]<5),80,IF(AND(RC[-3]>RC[-1],RC[-3]>=5,RC[-3]<6),70,IF(AND(RC[-3]>RC[-1],RC[-3]>=6,RC[-3]<7),60,IF(AND(RC[-3]>RC[-1],RC[-3]>=7,RC[-3]<8),50,IF(AND(RC[-3]>RC[-1],RC[-3]>=8,RC[-3]<9),40,IF(AND(RC[-3]>RC[-1],RC[-3]>=9,RC[-3]<10),30,IF(AND(RC[-3]>RC[-1],RC[-3]>=10,RC[-3]<11),20,IF(AND(RC[-3]>RC[-1],RC[-3]>=11,RC[-3]<12),10,IF(AND(RC[-3]>RC[-1],RC[-3]>=12),0))))))))))))))))))))))))))))))))) -> 80 | H652: =IF(RC[-3]="","",IF(RC[-3]<0.3,100,IF(AND(RC[-3]>=0.3,RC[-3]>0.4),95,IF(AND(RC[-3]>=0.4,RC[-3]<0.5),90,IF(AND(RC[-3]>=0.5,RC[-3]<0.6),85,IF(AND(RC[-3]>=0.6,RC[-3]<0.7),80,IF(AND(RC[-3]>=0.6,RC[-3]<1),80,IF(AND(RC[-3]>1,RC[-3]<2),50,IF(RC[-3]>2,0))))))))) ->  | I652: =IF(RC[-1]="",RC[-2],0.7*RC[-1]+0.3*RC[-2]) -> 80
A653: پلاستیران | B653: پلاست | C653: =VLOOKUP(RC[-1],Sheet1!R3C2:R802C3,2,FALSE) -> لاستیک و پلاستیک | D653: =VLOOKUP(RC[-2],Sheet1!R3C2:R802C9,8,FALSE) -> 2.9839465492551667 | E653: =IF(VLOOKUP(RC[-3],Sheet1!R3C2:R803C11,10,FALSE)=0,"",VLOOKUP(Sheet2!RC[-3],Sheet1!R[1]C[-3]:R[801]C[6],10,FALSE)) ->  | F653: =Sheet1!R709C10 -> 24.085633469465741 | G653: =IF(RC[-3]<0,0,IF(AND(RC[-3]<RC[-1],RC[-3]<2),100,IF(AND(RC[-3]<RC[-1],RC[-3]>=2,RC[-3]<3),95,IF(AND(RC[-3]<RC[-1],RC[-3]>=3,RC[-3]<4),90,IF(AND(RC[-3]<RC[-1],RC[-3]>=4,RC[-3]<5),85,IF(AND(RC[-3]<RC[-1],RC[-3]>=5,RC[-3]<6),80,IF(AND(RC[-3]<RC[-1],RC[-3]>=6,RC[-3]<7),75,IF(AND(RC[-3]<RC[-1],RC[-3]>=7,RC[-3]<8),70,IF(AND(RC[-3]<RC[-1],RC[-3]>=8,RC[-3]<9),65,IF(AND(RC[-3]<RC[-1],RC[-3]>=9,RC[-3]<10),60,IF(AND(RC[-3]<RC[-1],RC[-3]>=10,RC[-3]<11),55,IF(AND(RC[-3]<RC[-1],RC[-3]>=11,RC[-3]<12),50,IF(AND(RC[-3]<RC[-1],RC[-3]>=12,RC[-3]<13),45,IF(AND(RC[-3]<RC[-1],RC[-3]>=13,RC[-3]<14),40,IF(AND(RC[-3]<RC[-1],RC[-3]>=14,RC[-3]<15),35,IF(AND(RC[-3]<RC[-1],RC[-3]>=15,RC[-3]<16),30,IF(AND(RC[-3]<RC[-1],RC[-3]>=16,RC[-3]<17),25,IF(AND(RC[-3]<RC[-1],RC[-3]>=17,RC[-3]<18),20,IF(AND(RC[-3]<RC[-1],RC[-3]>=18,RC[-3]<19),15,IF(AND(RC[-3]<RC[-1],RC[-3]>=19,RC[-3]<20),10,IF(AND(RC[-3]<RC[-1],RC[-3]>=20,RC[-3]<21),5,IF(AND(RC[-3]<RC[-1],RC[-3]>=21),0,IF(AND(RC[-3]>RC[-1],RC[-3]>=2,RC[-3]<3),90,IF(AND(RC[-3]>RC[-1],RC[-3]>=3,RC[-3]<4),90,IF(AND(RC[-3]>RC[-1],RC[-3]>=4,RC[-3]<5),80,IF(AND(RC[-3]>RC[-1],RC[-3]>=5,RC[-3]<6),70,IF(AND(RC[-3]>RC[-1],RC[-3]>=6,RC[-3]<7),60,IF(AND(RC[-3]>RC[-1],RC[-3]>=7,RC[-3]<8),50,IF(AND(RC[-3]>RC[-1],RC[-3]>=8,RC[-3]<9),40,IF(AND(RC[-3]>RC[-1],RC[-3]>=9,RC[-3]<10),30,IF(AND(RC[-3]>RC[-1],RC[-3]>=10,RC[-3]<11),20,IF(AND(RC[-3]>RC[-1],RC[-3]>=11,RC[-3]<12),10,IF(AND(RC[-3]>RC[-1],RC[-3]>=12),0))))))))))))))))))))))))))))))))) -> 95 | H653: =IF(RC[-3]="","",IF(RC[-3]<0.3,100,IF(AND(RC[-3]>=0.3,RC[-3]>0.4),95,IF(AND(RC[-3]>=0.4,RC[-3]<0.5),90,IF(AND(RC[-3]>=0.5,RC[-3]<0.6),85,IF(AND(RC[-3]>=0.6,RC[-3]<0.7),80,IF(AND(RC[-3]>=0.6,RC[-3]<1),80,IF(AND(RC[-3]>1,RC[-3]<2),50,IF(RC[-3]>2,0))))))))) ->  | I653: =IF(RC[-1]="",RC[-2],0.7*RC[-1]+0.3*RC[-2]) -> 95
A654: پلاستیک شاهین | B654: پشاهن | C654: =VLOOKUP(RC[-1],Sheet1!R3C2:R802C3,2,FALSE) -> لاستیک و پلاستیک | D654: =VLOOKUP(RC[-2],Sheet1!R3C2:R802C9,8,FALSE) -> 27.796030097691695 | E654: =IF(VLOOKUP(RC[-3],Sheet1!R3C2:R803C11,10,FALSE)=0,"",VLOOKUP(Sheet2!RC[-3],Sheet1!R[1]C[-3]:R[801]C[6],10,FALSE)) ->  | F654: =Sheet1!R709C10 -> 24.085633469465741 | G654: =IF(RC[-3]<0,0,IF(AND(RC[-3]<RC[-1],RC[-3]<2),100,IF(AND(RC[-3]<RC[-1],RC[-3]>=2,RC[-3]<3),95,IF(AND(RC[-3]<RC[-1],RC[-3]>=3,RC[-3]<4),90,IF(AND(RC[-3]<RC[-1],RC[-3]>=4,RC[-3]<5),85,IF(AND(RC[-3]<RC[-1],RC[-3]>=5,RC[-3]<6),80,IF(AND(RC[-3]<RC[-1],RC[-3]>=6,RC[-3]<7),75,IF(AND(RC[-3]<RC[-1],RC[-3]>=7,RC[-3]<8),70,IF(AND(RC[-3]<RC[-1],RC[-3]>=8,RC[-3]<9),65,IF(AND(RC[-3]<RC[-1],RC[-3]>=9,RC[-3]<10),60,IF(AND(RC[-3]<RC[-1],RC[-3]>=10,RC[-3]<11),55,IF(AND(RC[-3]<RC[-1],RC[-3]>=11,RC[-3]<12),50,IF(AND(RC[-3]<RC[-1],RC[-3]>=12,RC[-3]<13),45,IF(AND(RC[-3]<RC[-1],RC[-3]>=13,RC[-3]<14),40,IF(AND(RC[-3]<RC[-1],RC[-3]>=14,RC[-3]<15),35,IF(AND(RC[-3]<RC[-1],RC[-3]>=15,RC[-3]<16),30,IF(AND(RC[-3]<RC[-1],RC[-3]>=16,RC[-3]<17),25,IF(AND(RC[-3]<RC[-1],RC[-3]>=17,RC[-3]<18),20,IF(AND(RC[-3]<RC[-1],RC[-3]>=18,RC[-3]<19),15,IF(AND(RC[-3]<RC[-1],RC[-3]>=19,RC[-3]<20),10,IF(AND(RC[-3]<RC[-1],RC[-3]>=20,RC[-3]<21),5,IF(AND(RC[-3]<RC[-1],RC[-3]>=21),0,IF(AND(RC[-3]>RC[-1],RC[-3]>=2,RC[-3]<3),90,IF(AND(RC[-3]>RC[-1],RC[-3]>=3,RC[-3]<4),90,IF(AND(RC[-3]>RC[-1],RC[-3]>=4,RC[-3]<5),80,IF(AND(RC[-3]>RC[-1],RC[-3]>=5,RC[-3]<6),70,IF(AND(RC[-3]>RC[-1],RC[-3]>=6,RC[-3]<7),60,IF(AND(RC[-3]>RC[-1],RC[-3]>=7,RC[-3]<8),50,IF(AND(RC[-3]>RC[-1],RC[-3]>=8,RC[-3]<9),40,IF(AND(RC[-3]>RC[-1],RC[-3]>=9,RC[-3]<10),30,IF(AND(RC[-3]>RC[-1],RC[-3]>=10,RC[-3]<11),20,IF(AND(RC[-3]>RC[-1],RC[-3]>=11,RC[-3]<12),10,IF(AND(RC[-3]>RC[-1],RC[-3]>=12),0))))))))))))))))))))))))))))))))) -> 0 | H654: =IF(RC[-3]="","",IF(RC[-3]<0.3,100,IF(AND(RC[-3]>=0.3,RC[-3]>0.4),95,IF(AND(RC[-3]>=0.4,RC[-3]<0.5),90,IF(AND(RC[-3]>=0.5,RC[-3]<0.6),85,IF(AND(RC[-3]>=0.6,RC[-3]<0.7),80,IF(AND(RC[-3]>=0.6,RC[-3]<1),80,IF(AND(RC[-3]>1,RC[-3]<2),50,IF(RC[-3]>2,0))))))))) ->  | I654: =IF(RC[-1]="",RC[-2],0.7*RC[-1]+0.3*RC[-2]) -> 0
A655: پلاسکوکار سایپا | B655: پلاسک | C655: =VLOOKUP(RC[-1],Sheet1!R3C2:R802C3,2,FALSE) -> لاستیک و پلاستیک | D655: =VLOOKUP(RC[-2],Sheet1!R3C2:R802C9,8,FALSE) -> 399.31666666666672 | E655: =IF(VLOOKUP(RC[-3],Sheet1!R3C2:R803C11,10,FALSE)=0,"",VLOOKUP(Sheet2!RC[-3],Sheet1!R[1]C[-3]:R[801]C[6],10,FALSE)) ->  | F655: =Sheet1!R709C10 -> 24.085633469465741 | G655: =IF(RC[-3]<0,0,IF(AND(RC[-3]<RC[-1],RC[-3]<2),100,IF(AND(RC[-3]<RC[-1],RC[-3]>=2,RC[-3]<3),95,IF(AND(RC[-3]<RC[-1],RC[-3]>=3,RC[-3]<4),90,IF(AND(RC[-3]<RC[-1],RC[-3]>=4,RC[-3]<5),85,IF(AND(RC[-3]<RC[-1],RC[-3]>=5,RC[-3]<6),80,IF(AND(RC[-3]<RC[-1],RC[-3]>=6,RC[-3]<7),75,IF(AND(RC[-3]<RC[-1],RC[-3]>=7,RC[-3]<8),70,IF(AND(RC[-3]<RC[-1],RC[-3]>=8,RC[-3]<9),65,IF(AND(RC[-3]<RC[-1],RC[-3]>=9,RC[-3]<10),60,IF(AND(RC[-3]<RC[-1],RC[-3]>=10,RC[-3]<11),55,IF(AND(RC[-3]<RC[-1],RC[-3]>=11,RC[-3]<12),50,IF(AND(RC[-3]<RC[-1],RC[-3]>=12,RC[-3]<13),45,IF(AND(RC[-3]<RC[-1],RC[-3]>=13,RC[-3]<14),40,IF(AND(RC[-3]<RC[-1],RC[-3]>=14,RC[-3]<15),35,IF(AND(RC[-3]<RC[-1],RC[-3]>=15,RC[-3]<16),30,IF(AND(RC[-3]<RC[-1],RC[-3]>=16,RC[-3]<17),25,IF(AND(RC[-3]<RC[-1],RC[-3]>=17,RC[-3]<18),20,IF(AND(RC[-3]<RC[-1],RC[-3]>=18,RC[-3]<19),15,IF(AND(RC[-3]<RC[-1],RC[-3]>=19,RC[-3]<20),10,IF(AND(RC[-3]<RC[-1],RC[-3]>=20,RC[-3]<21),5,IF(AND(RC[-3]<RC[-1],RC[-3]>=21),0,IF(AND(RC[-3]>RC[-1],RC[-3]>=2,RC[-3]<3),90,IF(AND(RC[-3]>RC[-1],RC[-3]>=3,RC[-3]<4),90,IF(AND(RC[-3]>RC[-1],RC[-3]>=4,RC[-3]<5),80,IF(AND(RC[-3]>RC[-1],RC[-3]>=5,RC[-3]<6),70,IF(AND(RC[-3]>RC[-1],RC[-3]>=6,RC[-3]<7),60,IF(AND(RC[-3]>RC[-1],RC[-3]>=7,RC[-3]<8),50,IF(AND(RC[-3]>RC[-1],RC[-3]>=8,RC[-3]<9),40,IF(AND(RC[-3]>RC[-1],RC[-3]>=9,RC[-3]<10),30,IF(AND(RC[-3]>RC[-1],RC[-3]>=10,RC[-3]<11),20,IF(AND(RC[-3]>RC[-1],RC[-3]>=11,RC[-3]<12),10,IF(AND(RC[-3]>RC[-1],RC[-3]>=12),0))))))))))))))))))))))))))))))))) -> 0 | H655: =IF(RC[-3]="","",IF(RC[-3]<0.3,100,IF(AND(RC[-3]>=0.3,RC[-3]>0.4),95,IF(AND(RC[-3]>=0.4,RC[-3]<0.5),90,IF(AND(RC[-3]>=0.5,RC[-3]<0.6),85,IF(AND(RC[-3]>=0.6,RC[-3]<0.7),80,IF(AND(RC[-3]>=0.6,RC[-3]<1),80,IF(AND(RC[-3]>1,RC[-3]<2),50,IF(RC[-3]>2,0))))))))) ->  | I655: =IF(RC[-1]="",RC[-2],0.7*RC[-1]+0.3*RC[-2]) -> 0
A656: درخشان تهران | B656: پدرخش | C656: =VLOOKUP(RC[-1],Sheet1!R3C2:R802C3,2,FALSE) -> لاستیک و پلاستیک | D656: =VLOOKUP(RC[-2],Sheet1!R3C2:R802C9,8,FALSE) -> 39.834370562796408 | E656: =IF(VLOOKUP(RC[-3],Sheet1!R3C2:R803C11,10,FALSE)=0,"",VLOOKUP(Sheet2!RC[-3],Sheet1!R[1]C[-3]:R[801]C[6],10,FALSE)) ->  | F656: =Sheet1!R709C10 -> 24.085633469465741 | G656: =IF(RC[-3]<0,0,IF(AND(RC[-3]<RC[-1],RC[-3]<2),100,IF(AND(RC[-3]<RC[-1],RC[-3]>=2,RC[-3]<3),95,IF(AND(RC[-3]<RC[-1],RC[-3]>=3,RC[-3]<4),90,IF(AND(RC[-3]<RC[-1],RC[-3]>=4,RC[-3]<5),85,IF(AND(RC[-3]<RC[-1],RC[-3]>=5,RC[-3]<6),80,IF(AND(RC[-3]<RC[-1],RC[-3]>=6,RC[-3]<7),75,IF(AND(RC[-3]<RC[-1],RC[-3]>=7,RC[-3]<8),70,IF(AND(RC[-3]<RC[-1],RC[-3]>=8,RC[-3]<9),65,IF(AND(RC[-3]<RC[-1],RC[-3]>=9,RC[-3]<10),60,IF(AND(RC[-3]<RC[-1],RC[-3]>=10,RC[-3]<11),55,IF(AND(RC[-3]<RC[-1],RC[-3]>=11,RC[-3]<12),50,IF(AND(RC[-3]<RC[-1],RC[-3]>=12,RC[-3]<13),45,IF(AND(RC[-3]<RC[-1],RC[-3]>=13,RC[-3]<14),40,IF(AND(RC[-3]<RC[-1],RC[-3]>=14,RC[-3]<15),35,IF(AND(RC[-3]<RC[-1],RC[-3]>=15,RC[-3]<16),30,IF(AND(RC[-3]<RC[-1],RC[-3]>=16,RC[-3]<17),25,IF(AND(RC[-3]<RC[-1],RC[-3]>=17,RC[-3]<18),20,IF(AND(RC[-3]<RC[-1],RC[-3]>=18,RC[-3]<19),15,IF(AND(RC[-3]<RC[-1],RC[-3]>=19,RC[-3]<20),10,IF(AND(RC[-3]<RC[-1],RC[-3]>=20,RC[-3]<21),5,IF(AND(RC[-3]<RC[-1],RC[-3]>=21),0,IF(AND(RC[-3]>RC[-1],RC[-3]>=2,RC[-3]<3),90,IF(AND(RC[-3]>RC[-1],RC[-3]>=3,RC[-3]<4),90,IF(AND(RC[-3]>RC[-1],RC[-3]>=4,RC[-3]<5),80,IF(AND(RC[-3]>RC[-1],RC[-3]>=5,RC[-3]<6),70,IF(AND(RC[-3]>RC[-1],RC[-3]>=6,RC[-3]<7),60,IF(AND(RC[-3]>RC[-1],RC[-3]>=7,RC[-3]<8),50,IF(AND(RC[-3]>RC[-1],RC[-3]>=8,RC[-3]<9),40,IF(AND(RC[-3]>RC[-1],RC[-3]>=9,RC[-3]<10),30,IF(AND(RC[-3]>RC[-1],RC[-3]>=10,RC[-3]<11),20,IF(AND(RC[-3]>RC[-1],RC[-3]>=11,RC[-3]<12),10,IF(AND(RC[-3]>RC[-1],RC[-3]>=12),0))))))))))))))))))))))))))))))))) -> 0 | H656: =IF(RC[-3]="","",IF(RC[-3]<0.3,100,IF(AND(RC[-3]>=0.3,RC[-3]>0.4),95,IF(AND(RC[-3]>=0.4,RC[-3]<0.5),90,IF(AND(RC[-3]>=0.5,RC[-3]<0.6),85,IF(AND(RC[-3]>=0.6,RC[-3]<0.7),80,IF(AND(RC[-3]>=0.6,RC[-3]<1),80,IF(AND(RC[-3]>1,RC[-3]<2),50,IF(RC[-3]>2,0))))))))) ->  | I656: =IF(RC[-1]="",RC[-2],0.7*RC[-1]+0.3*RC[-2]) -> 0
A657: صنعتی بارز | B657: پکرمان | C657: =VLOOKUP(RC[-1],Sheet1!R3C2:R802C3,2,FALSE) -> لاستیک و پلاستیک | D657: =VLOOKUP(RC[-2],Sheet1!R3C2:R802C9,8,FALSE) -> 14.689224623364336 | E657: =IF(VLOOKUP(RC[-3],Sheet1!R3C2:R803C11,10,FALSE)=0,"",VLOOKUP(Sheet2!RC[-3],Sheet1!R[1]C[-3]:R[801]C[6],10,FALSE)) ->  | F657: =Sheet1!R709C10 -> 24.085633469465741 | G657: =IF(RC[-3]<0,0,IF(AND(RC[-3]<RC[-1],RC[-3]<2),100,IF(AND(RC[-3]<RC[-1],RC[-3]>=2,RC[-3]<3),95,IF(AND(RC[-3]<RC[-1],RC[-3]>=3,RC[-3]<4),90,IF(AND(RC[-3]<RC[-1],RC[-3]>=4,RC[-3]<5),85,IF(AND(RC[-3]<RC[-1],RC[-3]>=5,RC[-3]<6),80,IF(AND(RC[-3]<RC[-1],RC[-3]>=6,RC[-3]<7),75,IF(AND(RC[-3]<RC[-1],RC[-3]>=7,RC[-3]<8),70,IF(AND(RC[-3]<RC[-1],RC[-3]>=8,RC[-3]<9),65,IF(AND(RC[-3]<RC[-1],RC[-3]>=9,RC[-3]<10),60,IF(AND(RC[-3]<RC[-1],RC[-3]>=10,RC[-3]<11),55,IF(AND(RC[-3]<RC[-1],RC[-3]>=11,RC[-3]<12),50,IF(AND(RC[-3]<RC[-1],RC[-3]>=12,RC[-3]<13),45,IF(AND(RC[-3]<RC[-1],RC[-3]>=13,RC[-3]<14),40,IF(AND(RC[-3]<RC[-1],RC[-3]>=14,RC[-3]<15),35,IF(AND(RC[-3]<RC[-1],RC[-3]>=15,RC[-3]<16),30,IF(AND(RC[-3]<RC[-1],RC[-3]>=16,RC[-3]<17),25,IF(AND(RC[-3]<RC[-1],RC[-3]>=17,RC[-3]<18),20,IF(AND(RC[-3]<RC[-1],RC[-3]>=18,RC[-3]<19),15,IF(AND(RC[-3]<RC[-1],RC[-3]>=19,RC[-3]<20),10,IF(AND(RC[-3]<RC[-1],RC[-3]>=20,RC[-3]<21),5,IF(AND(RC[-3]<RC[-1],RC[-3]>=21),0,IF(AND(RC[-3]>RC[-1],RC[-3]>=2,RC[-3]<3),90,IF(AND(RC[-3]>RC[-1],RC[-3]>=3,RC[-3]<4),90,IF(AND(RC[-3]>RC[-1],RC[-3]>=4,RC[-3]<5),80,IF(AND(RC[-3]>RC[-1],RC[-3]>=5,RC[-3]<6),70,IF(AND(RC[-3]>RC[-1],RC[-3]>=6,RC[-3]<7),60,IF(AND(RC[-3]>RC[-1],RC[-3]>=7,RC[-3]<8),50,IF(AND(RC[-3]>RC[-1],RC[-3]>=8,RC[-3]<9),40,IF(AND(RC[-3]>RC[-1],RC[-3]>=9,RC[-3]<10),30,IF(AND(RC[-3]>RC[-1],RC[-3]>=10,RC[-3]<11),20,IF(AND(RC[-3]>RC[-1],RC[-3]>=11,RC[-3]<12),10,IF(AND(RC[-3]>RC[-1],RC[-3]>=12),0))))))))))))))))))))))))))))))))) -> 35 | H657: =IF(RC[-3]="","",IF(RC[-3]<0.3,100,IF(AND(RC[-3]>=0.3,RC[-3]>0.4),95,IF(AND(RC[-3]>=0.4,RC[-3]<0.5),90,IF(AND(RC[-3]>=0.5,RC[-3]<0.6),85,IF(AND(RC[-3]>=0.6,RC[-3]<0.7),80,IF(AND(RC[-3]>=0.6,RC[-3]<1),80,IF(AND(RC[-3]>1,RC[-3]<2),50,IF(RC[-3]>2,0))))))))) ->  | I657: =IF(RC[-1]="",RC[-2],0.7*RC[-1]+0.3*RC[-2]) -> 35
A658: گازلوله | B658: پلوله | C658: =VLOOKUP(RC[-1],Sheet1!R3C2:R802C3,2,FALSE) -> لاستیک و پلاستیک | D658: =VLOOKUP(RC[-2],Sheet1!R3C2:R802C9,8,FALSE) -> 4.9418150171979383 | E658: =IF(VLOOKUP(RC[-3],Sheet1!R3C2:R803C11,10,FALSE)=0,"",VLOOKUP(Sheet2!RC[-3],Sheet1!R[1]C[-3]:R[801]C[6],10,FALSE)) ->  | F658: =Sheet1!R709C10 -> 24.085633469465741 | G658: =IF(RC[-3]<0,0,IF(AND(RC[-3]<RC[-1],RC[-3]<2),100,IF(AND(RC[-3]<RC[-1],RC[-3]>=2,RC[-3]<3),95,IF(AND(RC[-3]<RC[-1],RC[-3]>=3,RC[-3]<4),90,IF(AND(RC[-3]<RC[-1],RC[-3]>=4,RC[-3]<5),85,IF(AND(RC[-3]<RC[-1],RC[-3]>=5,RC[-3]<6),80,IF(AND(RC[-3]<RC[-1],RC[-3]>=6,RC[-3]<7),75,IF(AND(RC[-3]<RC[-1],RC[-3]>=7,RC[-3]<8),70,IF(AND(RC[-3]<RC[-1],RC[-3]>=8,RC[-3]<9),65,IF(AND(RC[-3]<RC[-1],RC[-3]>=9,RC[-3]<10),60,IF(AND(RC[-3]<RC[-1],RC[-3]>=10,RC[-3]<11),55,IF(AND(RC[-3]<RC[-1],RC[-3]>=11,RC[-3]<12),50,IF(AND(RC[-3]<RC[-1],RC[-3]>=12,RC[-3]<13),45,IF(AND(RC[-3]<RC[-1],RC[-3]>=13,RC[-3]<14),40,IF(AND(RC[-3]<RC[-1],RC[-3]>=14,RC[-3]<15),35,IF(AND(RC[-3]<RC[-1],RC[-3]>=15,RC[-3]<16),30,IF(AND(RC[-3]<RC[-1],RC[-3]>=16,RC[-3]<17),25,IF(AND(RC[-3]<RC[-1],RC[-3]>=17,RC[-3]<18),20,IF(AND(RC[-3]<RC[-1],RC[-3]>=18,RC[-3]<19),15,IF(AND(RC[-3]<RC[-1],RC[-3]>=19,RC[-3]<20),10,IF(AND(RC[-3]<RC[-1],RC[-3]>=20,RC[-3]<21),5,IF(AND(RC[-3]<RC[-1],RC[-3]>=21),0,IF(AND(RC[-3]>RC[-1],RC[-3]>=2,RC[-3]<3),90,IF(AND(RC[-3]>RC[-1],RC[-3]>=3,RC[-3]<4),90,IF(AND(RC[-3]>RC[-1],RC[-3]>=4,RC[-3]<5),80,IF(AND(RC[-3]>RC[-1],RC[-3]>=5,RC[-3]<6),70,IF(AND(RC[-3]>RC[-1],RC[-3]>=6,RC[-3]<7),60,IF(AND(RC[-3]>RC[-1],RC[-3]>=7,RC[-3]<8),50,IF(AND(RC[-3]>RC[-1],RC[-3]>=8,RC[-3]<9),40,IF(AND(RC[-3]>RC[-1],RC[-3]>=9,RC[-3]<10),30,IF(AND(RC[-3]>RC[-1],RC[-3]>=10,RC[-3]<11),20,IF(AND(RC[-3]>RC[-1],RC[-3]>=11,RC[-3]<12),10,IF(AND(RC[-3]>RC[-1],RC[-3]>=12),0))))))))))))))))))))))))))))))))) -> 85 | H658: =IF(RC[-3]="","",IF(RC[-3]<0.3,100,IF(AND(RC[-3]>=0.3,RC[-3]>0.4),95,IF(AND(RC[-3]>=0.4,RC[-3]<0.5),90,IF(AND(RC[-3]>=0.5,RC[-3]<0.6),85,IF(AND(RC[-3]>=0.6,RC[-3]<0.7),80,IF(AND(RC[-3]>=0.6,RC[-3]<1),80,IF(AND(RC[-3]>1,RC[-3]<2),50,IF(RC[-3]>2,0))))))))) ->  | I658: =IF(RC[-1]="",RC[-2],0.7*RC[-1]+0.3*RC[-2]) -> 85
A659: لاستیک سهند | B659: پسهند | C659: =VLOOKUP(RC[-1],Sheet1!R3C2:R802C3,2,FALSE) -> لاستیک و پلاستیک | D659: =VLOOKUP(RC[-2],Sheet1!R3C2:R802C9,8,FALSE) -> 5.559531050179352 | E659: =IF(VLOOKUP(RC[-3],Sheet1!R3C2:R803C11,10,FALSE)=0,"",VLOOKUP(Sheet2!RC[-3],Sheet1!R[1]C[-3]:R[801]C[6],10,FALSE)) ->  | F659: =Sheet1!R709C10 -> 24.085633469465741 | G659: =IF(RC[-3]<0,0,IF(AND(RC[-3]<RC[-1],RC[-3]<2),100,IF(AND(RC[-3]<RC[-1],RC[-3]>=2,RC[-3]<3),95,IF(AND(RC[-3]<RC[-1],RC[-3]>=3,RC[-3]<4),90,IF(AND(RC[-3]<RC[-1],RC[-3]>=4,RC[-3]<5),85,IF(AND(RC[-3]<RC[-1],RC[-3]>=5,RC[-3]<6),80,IF(AND(RC[-3]<RC[-1],RC[-3]>=6,RC[-3]<7),75,IF(AND(RC[-3]<RC[-1],RC[-3]>=7,RC[-3]<8),70,IF(AND(RC[-3]<RC[-1],RC[-3]>=8,RC[-3]<9),65,IF(AND(RC[-3]<RC[-1],RC[-3]>=9,RC[-3]<10),60,IF(AND(RC[-3]<RC[-1],RC[-3]>=10,RC[-3]<11),55,IF(AND(RC[-3]<RC[-1],RC[-3]>=11,RC[-3]<12),50,IF(AND(RC[-3]<RC[-1],RC[-3]>=12,RC[-3]<13),45,IF(AND(RC[-3]<RC[-1],RC[-3]>=13,RC[-3]<14),40,IF(AND(RC[-3]<RC[-1],RC[-3]>=14,RC[-3]<15),35,IF(AND(RC[-3]<RC[-1],RC[-3]>=15,RC[-3]<16),30,IF(AND(RC[-3]<RC[-1],RC[-3]>=16,RC[-3]<17),25,IF(AND(RC[-3]<RC[-1],RC[-3]>=17,RC[-3]<18),20,IF(AND(RC[-3]<RC[-1],RC[-3]>=18,RC[-3]<19),15,IF(AND(RC[-3]<RC[-1],RC[-3]>=19,RC[-3]<20),10,IF(AND(RC[-3]<RC[-1],RC[-3]>=20,RC[-3]<21),5,IF(AND(RC[-3]<RC[-1],RC[-3]>=21),0,IF(AND(RC[-3]>RC[-1],RC[-3]>=2,RC[-3]<3),90,IF(AND(RC[-3]>RC[-1],RC[-3]>=3,RC[-3]<4),90,IF(AND(RC[-3]>RC[-1],RC[-3]>=4,RC[-3]<5),80,IF(AND(RC[-3]>RC[-1],RC[-3]>=5,RC[-3]<6),70,IF(AND(RC[-3]>RC[-1],RC[-3]>=6,RC[-3]<7),60,IF(AND(RC[-3]>RC[-1],RC[-3]>=7,RC[-3]<8),50,IF(AND(RC[-3]>RC[-1],RC[-3]>=8,RC[-3]<9),40,IF(AND(RC[-3]>RC[-1],RC[-3]>=9,RC[-3]<10),30,IF(AND(RC[-3]>RC[-1],RC[-3]>=10,RC[-3]<11),20,IF(AND(RC[-3]>RC[-1],RC[-3]>=11,RC[-3]<12),10,IF(AND(RC[-3]>RC[-1],RC[-3]>=12),0))))))))))))))))))))))))))))))))) -> 80 | H659: =IF(RC[-3]="","",IF(RC[-3]<0.3,100,IF(AND(RC[-3]>=0.3,RC[-3]>0.4),95,IF(AND(RC[-3]>=0.4,RC[-3]<0.5),90,IF(AND(RC[-3]>=0.5,RC[-3]<0.6),85,IF(AND(RC[-3]>=0.6,RC[-3]<0.7),80,IF(AND(RC[-3]>=0.6,RC[-3]<1),80,IF(AND(RC[-3]>1,RC[-3]<2),50,IF(RC[-3]>2,0))))))))) ->  | I659: =IF(RC[-1]="",RC[-2],0.7*RC[-1]+0.3*RC[-2]) -> 80
A660: لاستیک یزد | B660: پیزد | C660: =VLOOKUP(RC[-1],Sheet1!R3C2:R802C3,2,FALSE) -> لاستیک و پلاستیک | D660: =VLOOKUP(RC[-2],Sheet1!R3C2:R802C9,8,FALSE) -> 35.734109776782383 | E660: =IF(VLOOKUP(RC[-3],Sheet1!R3C2:R803C11,10,FALSE)=0,"",VLOOKUP(Sheet2!RC[-3],Sheet1!R[1]C[-3]:R[801]C[6],10,FALSE)) ->  | F660: =Sheet1!R709C10 -> 24.085633469465741 | G660: =IF(RC[-3]<0,0,IF(AND(RC[-3]<RC[-1],RC[-3]<2),100,IF(AND(RC[-3]<RC[-1],RC[-3]>=2,RC[-3]<3),95,IF(AND(RC[-3]<RC[-1],RC[-3]>=3,RC[-3]<4),90,IF(AND(RC[-3]<RC[-1],RC[-3]>=4,RC[-3]<5),85,IF(AND(RC[-3]<RC[-1],RC[-3]>=5,RC[-3]<6),80,IF(AND(RC[-3]<RC[-1],RC[-3]>=6,RC[-3]<7),75,IF(AND(RC[-3]<RC[-1],RC[-3]>=7,RC[-3]<8),70,IF(AND(RC[-3]<RC[-1],RC[-3]>=8,RC[-3]<9),65,IF(AND(RC[-3]<RC[-1],RC[-3]>=9,RC[-3]<10),60,IF(AND(RC[-3]<RC[-1],RC[-3]>=10,RC[-3]<11),55,IF(AND(RC[-3]<RC[-1],RC[-3]>=11,RC[-3]<12),50,IF(AND(RC[-3]<RC[-1],RC[-3]>=12,RC[-3]<13),45,IF(AND(RC[-3]<RC[-1],RC[-3]>=13,RC[-3]<14),40,IF(AND(RC[-3]<RC[-1],RC[-3]>=14,RC[-3]<15),35,IF(AND(RC[-3]<RC[-1],RC[-3]>=15,RC[-3]<16),30,IF(AND(RC[-3]<RC[-1],RC[-3]>=16,RC[-3]<17),25,IF(AND(RC[-3]<RC[-1],RC[-3]>=17,RC[-3]<18),20,IF(AND(RC[-3]<RC[-1],RC[-3]>=18,RC[-3]<19),15,IF(AND(RC[-3]<RC[-1],RC[-3]>=19,RC[-3]<20),10,IF(AND(RC[-3]<RC[-1],RC[-3]>=20,RC[-3]<21),5,IF(AND(RC[-3]<RC[-1],RC[-3]>=21),0,IF(AND(RC[-3]>RC[-1],RC[-3]>=2,RC[-3]<3),90,IF(AND(RC[-3]>RC[-1],RC[-3]>=3,RC[-3]<4),90,IF(AND(RC[-3]>RC[-1],RC[-3]>=4,RC[-3]<5),80,IF(AND(RC[-3]>RC[-1],RC[-3]>=5,RC[-3]<6),70,IF(AND(RC[-3]>RC[-1],RC[-3]>=6,RC[-3]<7),60,IF(AND(RC[-3]>RC[-1],RC[-3]>=7,RC[-3]<8),50,IF(AND(RC[-3]>RC[-1],RC[-3]>=8,RC[-3]<9),40,IF(AND(RC[-3]>RC[-1],RC[-3]>=9,RC[-3]<10),30,IF(AND(RC[-3]>RC[-1],RC[-3]>=10,RC[-3]<11),20,IF(AND(RC[-3]>RC[-1],RC[-3]>=11,RC[-3]<12),10,IF(AND(RC[-3]>RC[-1],RC[-3]>=12),0))))))))))))))))))))))))))))))))) -> 0 | H660: =IF(RC[-3]="","",IF(RC[-3]<0.3,100,IF(AND(RC[-3]>=0.3,RC[-3]>0.4),95,IF(AND(RC[-3]>=0.4,RC[-3]<0.5),90,IF(AND(RC[-3]>=0.5,RC[-3]<0.6),85,IF(AND(RC[-3]>=0.6,RC[-3]<0.7),80,IF(AND(RC[-3]>=0.6,RC[-3]<1),80,IF(AND(RC[-3]>1,RC[-3]<2),50,IF(RC[-3]>2,0))))))))) ->  | I660: =IF(RC[-1]="",RC[-2],0.7*RC[-1]+0.3*RC[-2]) -> 0
A661: کویر تایر | B661: پکویر | C661: =VLOOKUP(RC[-1],Sheet1!R3C2:R802C3,2,FALSE) -> لاستیک و پلاستیک | D661: =VLOOKUP(RC[-2],Sheet1!R3C2:R802C9,8,FALSE) -> 3.75 | E661: =IF(VLOOKUP(RC[-3],Sheet1!R3C2:R803C11,10,FALSE)=0,"",VLOOKUP(Sheet2!RC[-3],Sheet1!R[1]C[-3]:R[801]C[6],10,FALSE)) ->  | F661: =Sheet1!R709C10 -> 24.085633469465741 | G661: =IF(RC[-3]<0,0,IF(AND(RC[-3]<RC[-1],RC[-3]<2),100,IF(AND(RC[-3]<RC[-1],RC[-3]>=2,RC[-3]<3),95,IF(AND(RC[-3]<RC[-1],RC[-3]>=3,RC[-3]<4),90,IF(AND(RC[-3]<RC[-1],RC[-3]>=4,RC[-3]<5),85,IF(AND(RC[-3]<RC[-1],RC[-3]>=5,RC[-3]<6),80,IF(AND(RC[-3]<RC[-1],RC[-3]>=6,RC[-3]<7),75,IF(AND(RC[-3]<RC[-1],RC[-3]>=7,RC[-3]<8),70,IF(AND(RC[-3]<RC[-1],RC[-3]>=8,RC[-3]<9),65,IF(AND(RC[-3]<RC[-1],RC[-3]>=9,RC[-3]<10),60,IF(AND(RC[-3]<RC[-1],RC[-3]>=10,RC[-3]<11),55,IF(AND(RC[-3]<RC[-1],RC[-3]>=11,RC[-3]<12),50,IF(AND(RC[-3]<RC[-1],RC[-3]>=12,RC[-3]<13),45,IF(AND(RC[-3]<RC[-1],RC[-3]>=13,RC[-3]<14),40,IF(AND(RC[-3]<RC[-1],RC[-3]>=14,RC[-3]<15),35,IF(AND(RC[-3]<RC[-1],RC[-3]>=15,RC[-3]<16),30,IF(AND(RC[-3]<RC[-1],RC[-3]>=16,RC[-3]<17),25,IF(AND(RC[-3]<RC[-1],RC[-3]>=17,RC[-3]<18),20,IF(AND(RC[-3]<RC[-1],RC[-3]>=18,RC[-3]<19),15,IF(AND(RC[-3]<RC[-1],RC[-3]>=19,RC[-3]<20),10,IF(AND(RC[-3]<RC[-1],RC[-3]>=20,RC[-3]<21),5,IF(AND(RC[-3]<RC[-1],RC[-3]>=21),0,IF(AND(RC[-3]>RC[-1],RC[-3]>=2,RC[-3]<3),90,IF(AND(RC[-3]>RC[-1],RC[-3]>=3,RC[-3]<4),90,IF(AND(RC[-3]>RC[-1],RC[-3]>=4,RC[-3]<5),80,IF(AND(RC[-3]>RC[-1],RC[-3]>=5,RC[-3]<6),70,IF(AND(RC[-3]>RC[-1],RC[-3]>=6,RC[-3]<7),60,IF(AND(RC[-3]>RC[-1],RC[-3]>=7,RC[-3]<8),50,IF(AND(RC[-3]>RC[-1],RC[-3]>=8,RC[-3]<9),40,IF(AND(RC[-3]>RC[-1],RC[-3]>=9,RC[-3]<10),30,IF(AND(RC[-3]>RC[-1],RC[-3]>=10,RC[-3]<11),20,IF(AND(RC[-3]>RC[-1],RC[-3]>=11,RC[-3]<12),10,IF(AND(RC[-3]>RC[-1],RC[-3]>=12),0))))))))))))))))))))))))))))))))) -> 90 | H661: =IF(RC[-3]="","",IF(RC[-3]<0.3,100,IF(AND(RC[-3]>=0.3,RC[-3]>0.4),95,IF(AND(RC[-3]>=0.4,RC[-3]<0.5),90,IF(AND(RC[-3]>=0.5,RC[-3]<0.6),85,IF(AND(RC[-3]>=0.6,RC[-3]<0.7),80,IF(AND(RC[-3]>=0.6,RC[-3]<1),80,IF(AND(RC[-3]>1,RC[-3]<2),50,IF(RC[-3]>2,0))))))))) ->  | I661: =IF(RC[-1]="",RC[-2],0.7*RC[-1]+0.3*RC[-2]) -> 90
A662: آبسال | B662: لابسا | C662: =VLOOKUP(RC[-1],Sheet1!R3C2:R802C3,2,FALSE) -> ماشین آلات و تجهیزات | D662: =VLOOKUP(RC[-2],Sheet1!R3C2:R802C9,8,FALSE) -> 9.4798878325799141 | E662: =IF(VLOOKUP(RC[-3],Sheet1!R3C2:R803C11,10,FALSE)=0,"",VLOOKUP(Sheet2!RC[-3],Sheet1!R[1]C[-3]:R[801]C[6],10,FALSE)) ->  | F662: =Sheet1!R728C10 -> 19.5081528262597 | G662: =IF(RC[-3]<0,0,IF(AND(RC[-3]<RC[-1],RC[-3]<2),100,IF(AND(RC[-3]<RC[-1],RC[-3]>=2,RC[-3]<3),95,IF(AND(RC[-3]<RC[-1],RC[-3]>=3,RC[-3]<4),90,IF(AND(RC[-3]<RC[-1],RC[-3]>=4,RC[-3]<5),85,IF(AND(RC[-3]<RC[-1],RC[-3]>=5,RC[-3]<6),80,IF(AND(RC[-3]<RC[-1],RC[-3]>=6,RC[-3]<7),75,IF(AND(RC[-3]<RC[-1],RC[-3]>=7,RC[-3]<8),70,IF(AND(RC[-3]<RC[-1],RC[-3]>=8,RC[-3]<9),65,IF(AND(RC[-3]<RC[-1],RC[-3]>=9,RC[-3]<10),60,IF(AND(RC[-3]<RC[-1],RC[-3]>=10,RC[-3]<11),55,IF(AND(RC[-3]<RC[-1],RC[-3]>=11,RC[-3]<12),50,IF(AND(RC[-3]<RC[-1],RC[-3]>=12,RC[-3]<13),45,IF(AND(RC[-3]<RC[-1],RC[-3]>=13,RC[-3]<14),40,IF(AND(RC[-3]<RC[-1],RC[-3]>=14,RC[-3]<15),35,IF(AND(RC[-3]<RC[-1],RC[-3]>=15,RC[-3]<16),30,IF(AND(RC[-3]<RC[-1],RC[-3]>=16,RC[-3]<17),25,IF(AND(RC[-3]<RC[-1],RC[-3]>=17,RC[-3]<18),20,IF(AND(RC[-3]<RC[-1],RC[-3]>=18,RC[-3]<19),15,IF(AND(RC[-3]<RC[-1],RC[-3]>=19,RC[-3]<20),10,IF(AND(RC[-3]<RC[-1],RC[-3]>=20,RC[-3]<21),5,IF(AND(RC[-3]<RC[-1],RC[-3]>=21),0,IF(AND(RC[-3]>RC[-1],RC[-3]>=2,RC[-3]<3),90,IF(AND(RC[-3]>RC[-1],RC[-3]>=3,RC[-3]<4),90,IF(AND(RC[-3]>RC[-1],RC[-3]>=4,RC[-3]<5),80,IF(AND(RC[-3]>RC[-1],RC[-3]>=5,RC[-3]<6),70,IF(AND(RC[-3]>RC[-1],RC[-3]>=6,RC[-3]<7),60,IF(AND(RC[-3]>RC[-1],RC[-3]>=7,RC[-3]<8),50,IF(AND(RC[-3]>RC[-1],RC[-3]>=8,RC[-3]<9),40,IF(AND(RC[-3]>RC[-1],RC[-3]>=9,RC[-3]<10),30,IF(AND(RC[-3]>RC[-1],RC[-3]>=10,RC[-3]<11),20,IF(AND(RC[-3]>RC[-1],RC[-3]>=11,RC[-3]<12),10,IF(AND(RC[-3]>RC[-1],RC[-3]>=12),0))))))))))))))))))))))))))))))))) -> 60 | H662: =IF(RC[-3]="","",IF(RC[-3]<0.3,100,IF(AND(RC[-3]>=0.3,RC[-3]>0.4),95,IF(AND(RC[-3]>=0.4,RC[-3]<0.5),90,IF(AND(RC[-3]>=0.5,RC[-3]<0.6),85,IF(AND(RC[-3]>=0.6,RC[-3]<0.7),80,IF(AND(RC[-3]>=0.6,RC[-3]<1),80,IF(AND(RC[-3]>1,RC[-3]<2),50,IF(RC[-3]>2,0))))))))) ->  | I662: =IF(RC[-1]="",RC[-2],0.7*RC[-1]+0.3*RC[-2]) -> 60
A663: آزمایش | B663: لازما | C663: =VLOOKUP(RC[-1],Sheet1!R3C2:R802C3,2,FALSE) -> ماشین آلات و تجهیزات | D663: =VLOOKUP(RC[-2],Sheet1!R3C2:R802C9,8,FALSE) -> 95.825554102727168 | E663: =IF(VLOOKUP(RC[-3],Sheet1!R3C2:R803C11,10,FALSE)=0,"",VLOOKUP(Sheet2!RC[-3],Sheet1!R[1]C[-3]:R[801]C[6],10,FALSE)) ->  | F663: =Sheet1!R728C10 -> 19.5081528262597 | G663: =IF(RC[-3]<0,0,IF(AND(RC[-3]<RC[-1],RC[-3]<2),100,IF(AND(RC[-3]<RC[-1],RC[-3]>=2,RC[-3]<3),95,IF(AND(RC[-3]<RC[-1],RC[-3]>=3,RC[-3]<4),90,IF(AND(RC[-3]<RC[-1],RC[-3]>=4,RC[-3]<5),85,IF(AND(RC[-3]<RC[-1],RC[-3]>=5,RC[-3]<6),80,IF(AND(RC[-3]<RC[-1],RC[-3]>=6,RC[-3]<7),75,IF(AND(RC[-3]<RC[-1],RC[-3]>=7,RC[-3]<8),70,IF(AND(RC[-3]<RC[-1],RC[-3]>=8,RC[-3]<9),65,IF(AND(RC[-3]<RC[-1],RC[-3]>=9,RC[-3]<10),60,IF(AND(RC[-3]<RC[-1],RC[-3]>=10,RC[-3]<11),55,IF(AND(RC[-3]<RC[-1],RC[-3]>=11,RC[-3]<12),50,IF(AND(RC[-3]<RC[-1],RC[-3]>=12,RC[-3]<13),45,IF(AND(RC[-3]<RC[-1],RC[-3]>=13,RC[-3]<14),40,IF(AND(RC[-3]<RC[-1],RC[-3]>=14,RC[-3]<15),35,IF(AND(RC[-3]<RC[-1],RC[-3]>=15,RC[-3]<16),30,IF(AND(RC[-3]<RC[-1],RC[-3]>=16,RC[-3]<17),25,IF(AND(RC[-3]<RC[-1],RC[-3]>=17,RC[-3]<18),20,IF(AND(RC[-3]<RC[-1],RC[-3]>=18,RC[-3]<19),15,IF(AND(RC[-3]<RC[-1],RC[-3]>=19,RC[-3]<20),10,IF(AND(RC[-3]<RC[-1],RC[-3]>=20,RC[-3]<21),5,IF(AND(RC[-3]<RC[-1],RC[-3]>=21),0,IF(AND(RC[-3]>RC[-1],RC[-3]>=2,RC[-3]<3),90,IF(AND(RC[-3]>RC[-1],RC[-3]>=3,RC[-3]<4),90,IF(AND(RC[-3]>RC[-1],RC[-3]>=4,RC[-3]<5),80,IF(AND(RC[-3]>RC[-1],RC[-3]>=5,RC[-3]<6),70,IF(AND(RC[-3]>RC[-1],RC[-3]>=6,RC[-3]<7),60,IF(AND(RC[-3]>RC[-1],RC[-3]>=7,RC[-3]<8),50,IF(AND(RC[-3]>RC[-1],RC[-3]>=8,RC[-3]<9),40,IF(AND(RC[-3]>RC[-1],RC[-3]>=9,RC[-3]<10),30,IF(AND(RC[-3]>RC[-1],RC[-3]>=10,RC[-3]<11),20,IF(AND(RC[-3]>RC[-1],RC[-3]>=11,RC[-3]<12),10,IF(AND(RC[-3]>RC[-1],RC[-3]>=12),0))))))))))))))))))))))))))))))))) -> 0 | H663: =IF(RC[-3]="","",IF(RC[-3]<0.3,100,IF(AND(RC[-3]>=0.3,RC[-3]>0.4),95,IF(AND(RC[-3]>=0.4,RC[-3]<0.5),90,IF(AND(RC[-3]>=0.5,RC[-3]<0.6),85,IF(AND(RC[-3]>=0.6,RC[-3]<0.7),80,IF(AND(RC[-3]>=0.6,RC[-3]<1),80,IF(AND(RC[-3]>1,RC[-3]<2),50,IF(RC[-3]>2,0))))))))) ->  | I663: =IF(RC[-1]="",RC[-2],0.7*RC[-1]+0.3*RC[-2]) -> 0
A664: پارس خزر | B664: لخزر | C664: =VLOOKUP(RC[-1],Sheet1!R3C2:R802C3,2,FALSE) -> ماشین آلات و تجهیزات | D664: =VLOOKUP(RC[-2],Sheet1!R3C2:R802C9,8,FALSE) -> 6.2017788625121959 | E664: =IF(VLOOKUP(RC[-3],Sheet1!R3C2:R803C11,10,FALSE)=0,"",VLOOKUP(Sheet2!RC[-3],Sheet1!R[1]C[-3]:R[801]C[6],10,FALSE)) ->  | F664: =Sheet1!R728C10 -> 19.5081528262597 | G664: =IF(RC[-3]<0,0,IF(AND(RC[-3]<RC[-1],RC[-3]<2),100,IF(AND(RC[-3]<RC[-1],RC[-3]>=2,RC[-3]<3),95,IF(AND(RC[-3]<RC[-1],RC[-3]>=3,RC[-3]<4),90,IF(AND(RC[-3]<RC[-1],RC[-3]>=4,RC[-3]<5),85,IF(AND(RC[-3]<RC[-1],RC[-3]>=5,RC[-3]<6),80,IF(AND(RC[-3]<RC[-1],RC[-3]>=6,RC[-3]<7),75,IF(AND(RC[-3]<RC[-1],RC[-3]>=7,RC[-3]<8),70,IF(AND(RC[-3]<RC[-1],RC[-3]>=8,RC[-3]<9),65,IF(AND(RC[-3]<RC[-1],RC[-3]>=9,RC[-3]<10),60,IF(AND(RC[-3]<RC[-1],RC[-3]>=10,RC[-3]<11),55,IF(AND(RC[-3]<RC[-1],RC[-3]>=11,RC[-3]<12),50,IF(AND(RC[-3]<RC[-1],RC[-3]>=12,RC[-3]<13),45,IF(AND(RC[-3]<RC[-1],RC[-3]>=13,RC[-3]<14),40,IF(AND(RC[-3]<RC[-1],RC[-3]>=14,RC[-3]<15),35,IF(AND(RC[-3]<RC[-1],RC[-3]>=15,RC[-3]<16),30,IF(AND(RC[-3]<RC[-1],RC[-3]>=16,RC[-3]<17),25,IF(AND(RC[-3]<RC[-1],RC[-3]>=17,RC[-3]<18),20,IF(AND(RC[-3]<RC[-1],RC[-3]>=18,RC[-3]<19),15,IF(AND(RC[-3]<RC[-1],RC[-3]>=19,RC[-3]<20),10,IF(AND(RC[-3]<RC[-1],RC[-3]>=20,RC[-3]<21),5,IF(AND(RC[-3]<RC[-1],RC[-3]>=21),0,IF(AND(RC[-3]>RC[-1],RC[-3]>=2,RC[-3]<3),90,IF(AND(RC[-3]>RC[-1],RC[-3]>=3,RC[-3]<4),90,IF(AND(RC[-3]>RC[-1],RC[-3]>=4,RC[-3]<5),80,IF(AND(RC[-3]>RC[-1],RC[-3]>=5,RC[-3]<6),70,IF(AND(RC[-3]>RC[-1],RC[-3]>=6,RC[-3]<7),60,IF(AND(RC[-3]>RC[-1],RC[-3]>=7,RC[-3]<8),50,IF(AND(RC[-3]>RC[-1],RC[-3]>=8,RC[-3]<9),40,IF(AND(RC[-3]>RC[-1],RC[-3]>=9,RC[-3]<10),30,IF(AND(RC[-3]>RC[-1],RC[-3]>=10,RC[-3]<11),20,IF(AND(RC[-3]>RC[-1],RC[-3]>=11,RC[-3]<12),10,IF(AND(RC[-3]>RC[-1],RC[-3]>=12),0))))))))))))))))))))))))))))))))) -> 75 | H664: =IF(RC[-3]="","",IF(RC[-3]<0.3,100,IF(AND(RC[-3]>=0.3,RC[-3]>0.4),95,IF(AND(RC[-3]>=0.4,RC[-3]<0.5),90,IF(AND(RC[-3]>=0.5,RC[-3]<0.6),85,IF(AND(RC[-3]>=0.6,RC[-3]<0.7),80,IF(AND(RC[-3]>=0.6,RC[-3]<1),80,IF(AND(RC[-3]>1,RC[-3]<2),50,IF(RC[-3]>2,0))))))))) ->  | I664: =IF(RC[-1]="",RC[-2],0.7*RC[-1]+0.3*RC[-2]) -> 75
A665: پمپ ایران | B665: تپمپی | C665: =VLOOKUP(RC[-1],Sheet1!R3C2:R802C3,2,FALSE) -> ماشین آلات و تجهیزات | D665: =VLOOKUP(RC[-2],Sheet1!R3C2:R802C9,8,FALSE) -> 4.9661152519863254 | E665: =IF(VLOOKUP(RC[-3],Sheet1!R3C2:R803C11,10,FALSE)=0,"",VLOOKUP(Sheet2!RC[-3],Sheet1!R[1]C[-3]:R[801]C[6],10,FALSE)) ->  | F665: =Sheet1!R728C10 -> 19.5081528262597 | G665: =IF(RC[-3]<0,0,IF(AND(RC[-3]<RC[-1],RC[-3]<2),100,IF(AND(RC[-3]<RC[-1],RC[-3]>=2,RC[-3]<3),95,IF(AND(RC[-3]<RC[-1],RC[-3]>=3,RC[-3]<4),90,IF(AND(RC[-3]<RC[-1],RC[-3]>=4,RC[-3]<5),85,IF(AND(RC[-3]<RC[-1],RC[-3]>=5,RC[-3]<6),80,IF(AND(RC[-3]<RC[-1],RC[-3]>=6,RC[-3]<7),75,IF(AND(RC[-3]<RC[-1],RC[-3]>=7,RC[-3]<8),70,IF(AND(RC[-3]<RC[-1],RC[-3]>=8,RC[-3]<9),65,IF(AND(RC[-3]<RC[-1],RC[-3]>=9,RC[-3]<10),60,IF(AND(RC[-3]<RC[-1],RC[-3]>=10,RC[-3]<11),55,IF(AND(RC[-3]<RC[-1],RC[-3]>=11,RC[-3]<12),50,IF(AND(RC[-3]<RC[-1],RC[-3]>=12,RC[-3]<13),45,IF(AND(RC[-3]<RC[-1],RC[-3]>=13,RC[-3]<14),40,IF(AND(RC[-3]<RC[-1],RC[-3]>=14,RC[-3]<15),35,IF(AND(RC[-3]<RC[-1],RC[-3]>=15,RC[-3]<16),30,IF(AND(RC[-3]<RC[-1],RC[-3]>=16,RC[-3]<17),25,IF(AND(RC[-3]<RC[-1],RC[-3]>=17,RC[-3]<18),20,IF(AND(RC[-3]<RC[-1],RC[-3]>=18,RC[-3]<19),15,IF(AND(RC[-3]<RC[-1],RC[-3]>=19,RC[-3]<20),10,IF(AND(RC[-3]<RC[-1],RC[-3]>=20,RC[-3]<21),5,IF(AND(RC[-3]<RC[-1],RC[-3]>=21),0,IF(AND(RC[-3]>RC[-1],RC[-3]>=2,RC[-3]<3),90,IF(AND(RC[-3]>RC[-1],RC[-3]>=3,RC[-3]<4),90,IF(AND(RC[-3]>RC[-1],RC[-3]>=4,RC[-3]<5),80,IF(AND(RC[-3]>RC[-1],RC[-3]>=5,RC[-3]<6),70,IF(AND(RC[-3]>RC[-1],RC[-3]>=6,RC[-3]<7),60,IF(AND(RC[-3]>RC[-1],RC[-3]>=7,RC[-3]<8),50,IF(AND(RC[-3]>RC[-1],RC[-3]>=8,RC[-3]<9),40,IF(AND(RC[-3]>RC[-1],RC[-3]>=9,RC[-3]<10),30,IF(AND(RC[-3]>RC[-1],RC[-3]>=10,RC[-3]<11),20,IF(AND(RC[-3]>RC[-1],RC[-3]>=11,RC[-3]<12),10,IF(AND(RC[-3]>RC[-1],RC[-3]>=12),0))))))))))))))))))))))))))))))))) -> 85 | H665: =IF(RC[-3]="","",IF(RC[-3]<0.3,100,IF(AND(RC[-3]>=0.3,RC[-3]>0.4),95,IF(AND(RC[-3]>=0.4,RC[-3]<0.5),90,IF(AND(RC[-3]>=0.5,RC[-3]<0.6),85,IF(AND(RC[-3]>=0.6,RC[-3]<0.7),80,IF(AND(RC[-3]>=0.6,RC[-3]<1),80,IF(AND(RC[-3]>1,RC[-3]<2),50,IF(RC[-3]>2,0))))))))) ->  | I665: =IF(RC[-1]="",RC[-2],0.7*RC[-1]+0.3*RC[-2]) -> 85
A666: تراکتورسازی | B666: تایرا | C666: =VLOOKUP(RC[-1],Sheet1!R3C2:R802C3,2,FALSE) -> ماشین آلات و تجهیزات | D666: =VLOOKUP(RC[-2],Sheet1!R3C2:R802C9,8,FALSE) -> 6.6583585136510832 | E666: =IF(VLOOKUP(RC[-3],Sheet1!R3C2:R803C11,10,FALSE)=0,"",VLOOKUP(Sheet2!RC[-3],Sheet1!R[1]C[-3]:R[801]C[6],10,FALSE)) ->  | F666: =Sheet1!R728C10 -> 19.5081528262597 | G666: =IF(RC[-3]<0,0,IF(AND(RC[-3]<RC[-1],RC[-3]<2),100,IF(AND(RC[-3]<RC[-1],RC[-3]>=2,RC[-3]<3),95,IF(AND(RC[-3]<RC[-1],RC[-3]>=3,RC[-3]<4),90,IF(AND(RC[-3]<RC[-1],RC[-3]>=4,RC[-3]<5),85,IF(AND(RC[-3]<RC[-1],RC[-3]>=5,RC[-3]<6),80,IF(AND(RC[-3]<RC[-1],RC[-3]>=6,RC[-3]<7),75,IF(AND(RC[-3]<RC[-1],RC[-3]>=7,RC[-3]<8),70,IF(AND(RC[-3]<RC[-1],RC[-3]>=8,RC[-3]<9),65,IF(AND(RC[-3]<RC[-1],RC[-3]>=9,RC[-3]<10),60,IF(AND(RC[-3]<RC[-1],RC[-3]>=10,RC[-3]<11),55,IF(AND(RC[-3]<RC[-1],RC[-3]>=11,RC[-3]<12),50,IF(AND(RC[-3]<RC[-1],RC[-3]>=12,RC[-3]<13),45,IF(AND(RC[-3]<RC[-1],RC[-3]>=13,RC[-3]<14),40,IF(AND(RC[-3]<RC[-1],RC[-3]>=14,RC[-3]<15),35,IF(AND(RC[-3]<RC[-1],RC[-3]>=15,RC[-3]<16),30,IF(AND(RC[-3]<RC[-1],RC[-3]>=16,RC[-3]<17),25,IF(AND(RC[-3]<RC[-1],RC[-3]>=17,RC[-3]<18),20,IF(AND(RC[-3]<RC[-1],RC[-3]>=18,RC[-3]<19),15,IF(AND(RC[-3]<RC[-1],RC[-3]>=19,RC[-3]<20),10,IF(AND(RC[-3]<RC[-1],RC[-3]>=20,RC[-3]<21),5,IF(AND(RC[-3]<RC[-1],RC[-3]>=21),0,IF(AND(RC[-3]>RC[-1],RC[-3]>=2,RC[-3]<3),90,IF(AND(RC[-3]>RC[-1],RC[-3]>=3,RC[-3]<4),90,IF(AND(RC[-3]>RC[-1],RC[-3]>=4,RC[-3]<5),80,IF(AND(RC[-3]>RC[-1],RC[-3]>=5,RC[-3]<6),70,IF(AND(RC[-3]>RC[-1],RC[-3]>=6,RC[-3]<7),60,IF(AND(RC[-3]>RC[-1],RC[-3]>=7,RC[-3]<8),50,IF(AND(RC[-3]>RC[-1],RC[-3]>=8,RC[-3]<9),40,IF(AND(RC[-3]>RC[-1],RC[-3]>=9,RC[-3]<10),30,IF(AND(RC[-3]>RC[-1],RC[-3]>=10,RC[-3]<11),20,IF(AND(RC[-3]>RC[-1],RC[-3]>=11,RC[-3]<12),10,IF(AND(RC[-3]>RC[-1],RC[-3]>=12),0))))))))))))))))))))))))))))))))) -> 75 | H666: =IF(RC[-3]="","",IF(RC[-3]<0.3,100,IF(AND(RC[-3]>=0.3,RC[-3]>0.4),95,IF(AND(RC[-3]>=0.4,RC[-3]<0.5),90,IF(AND(RC[-3]>=0.5,RC[-3]<0.6),85,IF(AND(RC[-3]>=0.6,RC[-3]<0.7),80,IF(AND(RC[-3]>=0.6,RC[-3]<1),80,IF(AND(RC[-3]>1,RC[-3]<2),50,IF(RC[-3]>2,0))))))))) ->  | I666: =IF(RC[-1]="",RC[-2],0.7*RC[-1]+0.3*RC[-2]) -> 75
A667: تکنوتار | B667: تکنو | C667: =VLOOKUP(RC[-1],Sheet1!R3C2:R802C3,2,FALSE) -> ماشین آلات و تجهیزات | D667: =VLOOKUP(RC[-2],Sheet1!R3C2:R802C9,8,FALSE) -> -4.4513006440553617 | E667: =IF(VLOOKUP(RC[-3],Sheet1!R3C2:R803C11,10,FALSE)=0,"",VLOOKUP(Sheet2!RC[-3],Sheet1!R[1]C[-3]:R[801]C[6],10,FALSE)) ->  | F667: =Sheet1!R728C10 -> 19.5081528262597 | G667: =IF(RC[-3]<0,0,IF(AND(RC[-3]<RC[-1],RC[-3]<2),100,IF(AND(RC[-3]<RC[-1],RC[-3]>=2,RC[-3]<3),95,IF(AND(RC[-3]<RC[-1],RC[-3]>=3,RC[-3]<4),90,IF(AND(RC[-3]<RC[-1],RC[-3]>=4,RC[-3]<5),85,IF(AND(RC[-3]<RC[-1],RC[-3]>=5,RC[-3]<6),80,IF(AND(RC[-3]<RC[-1],RC[-3]>=6,RC[-3]<7),75,IF(AND(RC[-3]<RC[-1],RC[-3]>=7,RC[-3]<8),70,IF(AND(RC[-3]<RC[-1],RC[-3]>=8,RC[-3]<9),65,IF(AND(RC[-3]<RC[-1],RC[-3]>=9,RC[-3]<10),60,IF(AND(RC[-3]<RC[-1],RC[-3]>=10,RC[-3]<11),55,IF(AND(RC[-3]<RC[-1],RC[-3]>=11,RC[-3]<12),50,IF(AND(RC[-3]<RC[-1],RC[-3]>=12,RC[-3]<13),45,IF(AND(RC[-3]<RC[-1],RC[-3]>=13,RC[-3]<14),40,IF(AND(RC[-3]<RC[-1],RC[-3]>=14,RC[-3]<15),35,IF(AND(RC[-3]<RC[-1],RC[-3]>=15,RC[-3]<16),30,IF(AND(RC[-3]<RC[-1],RC[-3]>=16,RC[-3]<17),25,IF(AND(RC[-3]<RC[-1],RC[-3]>=17,RC[-3]<18),20,IF(AND(RC[-3]<RC[-1],RC[-3]>=18,RC[-3]<19),15,IF(AND(RC[-3]<RC[-1],RC[-3]>=19,RC[-3]<20),10,IF(AND(RC[-3]<RC[-1],RC[-3]>=20,RC[-3]<21),5,IF(AND(RC[-3]<RC[-1],RC[-3]>=21),0,IF(AND(RC[-3]>RC[-1],RC[-3]>=2,RC[-3]<3),90,IF(AND(RC[-3]>RC[-1],RC[-3]>=3,RC[-3]<4),90,IF(AND(RC[-3]>RC[-1],RC[-3]>=4,RC[-3]<5),80,IF(AND(RC[-3]>RC[-1],RC[-3]>=5,RC[-3]<6),70,IF(AND(RC[-3]>RC[-1],RC[-3]>=6,RC[-3]<7),60,IF(AND(RC[-3]>RC[-1],RC[-3]>=7,RC[-3]<8),50,IF(AND(RC[-3]>RC[-1],RC[-3]>=8,RC[-3]<9),40,IF(AND(RC[-3]>RC[-1],RC[-3]>=9,RC[-3]<10),30,IF(AND(RC[-3]>RC[-1],RC[-3]>=10,RC[-3]<11),20,IF(AND(RC[-3]>RC[-1],RC[-3]>=11,RC[-3]<12),10,IF(AND(RC[-3]>RC[-1],RC[-3]>=12),0))))))))))))))))))))))))))))))))) -> 0 | H667: =IF(RC[-3]="","",IF(RC[-3]<0.3,100,IF(AND(RC[-3]>=0.3,RC[-3]>0.4),95,IF(AND(RC[-3]>=0.4,RC[-3]<0.5),90,IF(AND(RC[-3]>=0.5,RC[-3]<0.6),85,IF(AND(RC[-3]>=0.6,RC[-3]<0.7),80,IF(AND(RC[-3]>=0.6,RC[-3]<1),80,IF(AND(RC[-3]>1,RC[-3]<2),50,IF(RC[-3]>2,0))))))))) ->  | I667: =IF(RC[-1]="",RC[-2],0.7*RC[-1]+0.3*RC[-2]) -> 0
A668: خدمات کشاورزی | B668: تکشا | C668: =VLOOKUP(RC[-1],Sheet1!R3C2:R802C3,2,FALSE) -> ماشین آلات و تجهیزات | D668: =VLOOKUP(RC[-2],Sheet1!R3C2:R802C9,8,FALSE) -> 40.717857142857149 | E668: =IF(VLOOKUP(RC[-3],Sheet1!R3C2:R803C11,10,FALSE)=0,"",VLOOKUP(Sheet2!RC[-3],Sheet1!R[1]C[-3]:R[801]C[6],10,FALSE)) ->  | F668: =Sheet1!R728C10 -> 19.5081528262597 | G668: =IF(RC[-3]<0,0,IF(AND(RC[-3]<RC[-1],RC[-3]<2),100,IF(AND(RC[-3]<RC[-1],RC[-3]>=2,RC[-3]<3),95,IF(AND(RC[-3]<RC[-1],RC[-3]>=3,RC[-3]<4),90,IF(AND(RC[-3]<RC[-1],RC[-3]>=4,RC[-3]<5),85,IF(AND(RC[-3]<RC[-1],RC[-3]>=5,RC[-3]<6),80,IF(AND(RC[-3]<RC[-1],RC[-3]>=6,RC[-3]<7),75,IF(AND(RC[-3]<RC[-1],RC[-3]>=7,RC[-3]<8),70,IF(AND(RC[-3]<RC[-1],RC[-3]>=8,RC[-3]<9),65,IF(AND(RC[-3]<RC[-1],RC[-3]>=9,RC[-3]<10),60,IF(AND(RC[-3]<RC[-1],RC[-3]>=10,RC[-3]<11),55,IF(AND(RC[-3]<RC[-1],RC[-3]>=11,RC[-3]<12),50,IF(AND(RC[-3]<RC[-1],RC[-3]>=12,RC[-3]<13),45,IF(AND(RC[-3]<RC[-1],RC[-3]>=13,RC[-3]<14),40,IF(AND(RC[-3]<RC[-1],RC[-3]>=14,RC[-3]<15),35,IF(AND(RC[-3]<RC[-1],RC[-3]>=15,RC[-3]<16),30,IF(AND(RC[-3]<RC[-1],RC[-3]>=16,RC[-3]<17),25,IF(AND(RC[-3]<RC[-1],RC[-3]>=17,RC[-3]<18),20,IF(AND(RC[-3]<RC[-1],RC[-3]>=18,RC[-3]<19),15,IF(AND(RC[-3]<RC[-1],RC[-3]>=19,RC[-3]<20),10,IF(AND(RC[-3]<RC[-1],RC[-3]>=20,RC[-3]<21),5,IF(AND(RC[-3]<RC[-1],RC[-3]>=21),0,IF(AND(RC[-3]>RC[-1],RC[-3]>=2,RC[-3]<3),90,IF(AND(RC[-3]>RC[-1],RC[-3]>=3,RC[-3]<4),90,IF(AND(RC[-3]>RC[-1],RC[-3]>=4,RC[-3]<5),80,IF(AND(RC[-3]>RC[-1],RC[-3]>=5,RC[-3]<6),70,IF(AND(RC[-3]>RC[-1],RC[-3]>=6,RC[-3]<7),60,IF(AND(RC[-3]>RC[-1],RC[-3]>=7,RC[-3]<8),50,IF(AND(RC[-3]>RC[-1],RC[-3]>=8,RC[-3]<9),40,IF(AND(RC[-3]>RC[-1],RC[-3]>=9,RC[-3]<10),30,IF(AND(RC[-3]>RC[-1],RC[-3]>=10,RC[-3]<11),20,IF(AND(RC[-3]>RC[-1],RC[-3]>=11,RC[-3]<12),10,IF(AND(RC[-3]>RC[-1],RC[-3]>=12),0))))))))))))))))))))))))))))))))) -> 0 | H668: =IF(RC[-3]="","",IF(RC[-3]<0.3,100,IF(AND(RC[-3]>=0.3,RC[-3]>0.4),95,IF(AND(RC[-3]>=0.4,RC[-3]<0.5),90,IF(AND(RC[-3]>=0.5,RC[-3]<0.6),85,IF(AND(RC[-3]>=0.6,RC[-3]<0.7),80,IF(AND(RC[-3]>=0.6,RC[-3]<1),80,IF(AND(RC[-3]>1,RC[-3]<2),50,IF(RC[-3]>2,0))))))))) ->  | I668: =IF(RC[-1]="",RC[-2],0.7*RC[-1]+0.3*RC[-2]) -> 0
A669: سر. پارس توشه | B669: وتوشه | C669: =VLOOKUP(RC[-1],Sheet1!R3C2:R802C3,2,FALSE) -> ماشین آلات و تجهیزات | D669: =VLOOKUP(RC[-2],Sheet1!R3C2:R802C9,8,FALSE) -> 4.0621815332924305 | E669: =IF(VLOOKUP(RC[-3],Sheet1!R3C2:R803C11,10,FALSE)=0,"",VLOOKUP(Sheet2!RC[-3],Sheet1!R[1]C[-3]:R[801]C[6],10,FALSE)) -> 0.5 | F669: =Sheet1!R728C10 -> 19.5081528262597 | G669: =IF(RC[-3]<0,0,IF(AND(RC[-3]<RC[-1],RC[-3]<2),100,IF(AND(RC[-3]<RC[-1],RC[-3]>=2,RC[-3]<3),95,IF(AND(RC[-3]<RC[-1],RC[-3]>=3,RC[-3]<4),90,IF(AND(RC[-3]<RC[-1],RC[-3]>=4,RC[-3]<5),85,IF(AND(RC[-3]<RC[-1],RC[-3]>=5,RC[-3]<6),80,IF(AND(RC[-3]<RC[-1],RC[-3]>=6,RC[-3]<7),75,IF(AND(RC[-3]<RC[-1],RC[-3]>=7,RC[-3]<8),70,IF(AND(RC[-3]<RC[-1],RC[-3]>=8,RC[-3]<9),65,IF(AND(RC[-3]<RC[-1],RC[-3]>=9,RC[-3]<10),60,IF(AND(RC[-3]<RC[-1],RC[-3]>=10,RC[-3]<11),55,IF(AND(RC[-3]<RC[-1],RC[-3]>=11,RC[-3]<12),50,IF(AND(RC[-3]<RC[-1],RC[-3]>=12,RC[-3]<13),45,IF(AND(RC[-3]<RC[-1],RC[-3]>=13,RC[-3]<14),40,IF(AND(RC[-3]<RC[-1],RC[-3]>=14,RC[-3]<15),35,IF(AND(RC[-3]<RC[-1],RC[-3]>=15,RC[-3]<16),30,IF(AND(RC[-3]<RC[-1],RC[-3]>=16,RC[-3]<17),25,IF(AND(RC[-3]<RC[-1],RC[-3]>=17,RC[-3]<18),20,IF(AND(RC[-3]<RC[-1],RC[-3]>=18,RC[-3]<19),15,IF(AND(RC[-3]<RC[-1],RC[-3]>=19,RC[-3]<20),10,IF(AND(RC[-3]<RC[-1],RC[-3]>=20,RC[-3]<21),5,IF(AND(RC[-3]<RC[-1],RC[-3]>=21),0,IF(AND(RC[-3]>RC[-1],RC[-3]>=2,RC[-3]<3),90,IF(AND(RC[-3]>RC[-1],RC[-3]>=3,RC[-3]<4),90,IF(AND(RC[-3]>RC[-1],RC[-3]>=4,RC[-3]<5),80,IF(AND(RC[-3]>RC[-1],RC[-3]>=5,RC[-3]<6),70,IF(AND(RC[-3]>RC[-1],RC[-3]>=6,RC[-3]<7),60,IF(AND(RC[-3]>RC[-1],RC[-3]>=7,RC[-3]<8),50,IF(AND(RC[-3]>RC[-1],RC[-3]>=8,RC[-3]<9),40,IF(AND(RC[-3]>RC[-1],RC[-3]>=9,RC[-3]<10),30,IF(AND(RC[-3]>RC[-1],RC[-3]>=10,RC[-3]<11),20,IF(AND(RC[-3]>RC[-1],RC[-3]>=11,RC[-3]<12),10,IF(AND(RC[-3]>RC[-1],RC[-3]>=12),0))))))))))))))))))))))))))))))))) -> 85 | H669: =IF(RC[-3]="","",IF(RC[-3]<0.3,100,IF(AND(RC[-3]>=0.3,RC[-3]>0.4),95,IF(AND(RC[-3]>=0.4,RC[-3]<0.5),90,IF(AND(RC[-3]>=0.5,RC[-3]<0.6),85,IF(AND(RC[-3]>=0.6,RC[-3]<0.7),80,IF(AND(RC[-3]>=0.6,RC[-3]<1),80,IF(AND(RC[-3]>1,RC[-3]<2),50,IF(RC[-3]>2,0))))))))) -> 95 | I669: =IF(RC[-1]="",RC[-2],0.7*RC[-1]+0.3*RC[-2]) -> 92
A670: سرماآفرین | B670: لسرما | C670: =VLOOKUP(RC[-1],Sheet1!R3C2:R802C3,2,FALSE) -> ماشین آلات و تجهیزات | D670: =VLOOKUP(RC[-2],Sheet1!R3C2:R802C9,8,FALSE) -> 12.722986281639352 | E670: =IF(VLOOKUP(RC[-3],Sheet1!R3C2:R803C11,10,FALSE)=0,"",VLOOKUP(Sheet2!RC[-3],Sheet1!R[1]C[-3]:R[801]C[6],10,FALSE)) ->  | F670: =Sheet1!R728C10 -> 19.5081528262597 | G670: =IF(RC[-3]<0,0,IF(AND(RC[-3]<RC[-1],RC[-3]<2),100,IF(AND(RC[-3]<RC[-1],RC[-3]>=2,RC[-3]<3),95,IF(AND(RC[-3]<RC[-1],RC[-3]>=3,RC[-3]<4),90,IF(AND(RC[-3]<RC[-1],RC[-3]>=4,RC[-3]<5),85,IF(AND(RC[-3]<RC[-1],RC[-3]>=5,RC[-3]<6),80,IF(AND(RC[-3]<RC[-1],RC[-3]>=6,RC[-3]<7),75,IF(AND(RC[-3]<RC[-1],RC[-3]>=7,RC[-3]<8),70,IF(AND(RC[-3]<RC[-1],RC[-3]>=8,RC[-3]<9),65,IF(AND(RC[-3]<RC[-1],RC[-3]>=9,RC[-3]<10),60,IF(AND(RC[-3]<RC[-1],RC[-3]>=10,RC[-3]<11),55,IF(AND(RC[-3]<RC[-1],RC[-3]>=11,RC[-3]<12),50,IF(AND(RC[-3]<RC[-1],RC[-3]>=12,RC[-3]<13),45,IF(AND(RC[-3]<RC[-1],RC[-3]>=13,RC[-3]<14),40,IF(AND(RC[-3]<RC[-1],RC[-3]>=14,RC[-3]<15),35,IF(AND(RC[-3]<RC[-1],RC[-3]>=15,RC[-3]<16),30,IF(AND(RC[-3]<RC[-1],RC[-3]>=16,RC[-3]<17),25,IF(AND(RC[-3]<RC[-1],RC[-3]>=17,RC[-3]<18),20,IF(AND(RC[-3]<RC[-1],RC[-3]>=18,RC[-3]<19),15,IF(AND(RC[-3]<RC[-1],RC[-3]>=19,RC[-3]<20),10,IF(AND(RC[-3]<RC[-1],RC[-3]>=20,RC[-3]<21),5,IF(AND(RC[-3]<RC[-1],RC[-3]>=21),0,IF(AND(RC[-3]>RC[-1],RC[-3]>=2,RC[-3]<3),90,IF(AND(RC[-3]>RC[-1],RC[-3]>=3,RC[-3]<4),90,IF(AND(RC[-3]>RC[-1],RC[-3]>=4,RC[-3]<5),80,IF(AND(RC[-3]>RC[-1],RC[-3]>=5,RC[-3]<6),70,IF(AND(RC[-3]>RC[-1],RC[-3]>=6,RC[-3]<7),60,IF(AND(RC[-3]>RC[-1],RC[-3]>=7,RC[-3]<8),50,IF(AND(RC[-3]>RC[-1],RC[-3]>=8,RC[-3]<9),40,IF(AND(RC[-3]>RC[-1],RC[-3]>=9,RC[-3]<10),30,IF(AND(RC[-3]>RC[-1],RC[-3]>=10,RC[-3]<11),20,IF(AND(RC[-3]>RC[-1],RC[-3]>=11,RC[-3]<12),10,IF(AND(RC[-3]>RC[-1],RC[-3]>=12),0))))))))))))))))))))))))))))))))) -> 45 | H670: =IF(RC[-3]="","",IF(RC[-3]<0.3,100,IF(AND(RC[-3]>=0.3,RC[-3]>0.4),95,IF(AND(RC[-3]>=0.4,RC[-3]<0.5),90,IF(AND(RC[-3]>=0.5,RC[-3]<0.6),85,IF(AND(RC[-3]>=0.6,RC[-3]<0.7),80,IF(AND(RC[-3]>=0.6,RC[-3]<1),80,IF(AND(RC[-3]>1,RC[-3]<2),50,IF(RC[-3]>2,0))))))))) ->  | I670: =IF(RC[-1]="",RC[-2],0.7*RC[-1]+0.3*RC[-2]) -> 45
A671: صنایع گلدیران | B671: گلدیرا | C671: =VLOOKUP(RC[-1],Sheet1!R3C2:R802C3,2,FALSE) -> ماشین آلات و تجهیزات | D671: =VLOOKUP(RC[-2],Sheet1!R3C2:R802C9,8,FALSE) -> 5.1408963830696157 | E671: =IF(VLOOKUP(RC[-3],Sheet1!R3C2:R803C11,10,FALSE)=0,"",VLOOKUP(Sheet2!RC[-3],Sheet1!R[1]C[-3]:R[801]C[6],10,FALSE)) ->  | F671: =Sheet1!R728C10 -> 19.5081528262597 | G671: =IF(RC[-3]<0,0,IF(AND(RC[-3]<RC[-1],RC[-3]<2),100,IF(AND(RC[-3]<RC[-1],RC[-3]>=2,RC[-3]<3),95,IF(AND(RC[-3]<RC[-1],RC[-3]>=3,RC[-3]<4),90,IF(AND(RC[-3]<RC[-1],RC[-3]>=4,RC[-3]<5),85,IF(AND(RC[-3]<RC[-1],RC[-3]>=5,RC[-3]<6),80,IF(AND(RC[-3]<RC[-1],RC[-3]>=6,RC[-3]<7),75,IF(AND(RC[-3]<RC[-1],RC[-3]>=7,RC[-3]<8),70,IF(AND(RC[-3]<RC[-1],RC[-3]>=8,RC[-3]<9),65,IF(AND(RC[-3]<RC[-1],RC[-3]>=9,RC[-3]<10),60,IF(AND(RC[-3]<RC[-1],RC[-3]>=10,RC[-3]<11),55,IF(AND(RC[-3]<RC[-1],RC[-3]>=11,RC[-3]<12),50,IF(AND(RC[-3]<RC[-1],RC[-3]>=12,RC[-3]<13),45,IF(AND(RC[-3]<RC[-1],RC[-3]>=13,RC[-3]<14),40,IF(AND(RC[-3]<RC[-1],RC[-3]>=14,RC[-3]<15),35,IF(AND(RC[-3]<RC[-1],RC[-3]>=15,RC[-3]<16),30,IF(AND(RC[-3]<RC[-1],RC[-3]>=16,RC[-3]<17),25,IF(AND(RC[-3]<RC[-1],RC[-3]>=17,RC[-3]<18),20,IF(AND(RC[-3]<RC[-1],RC[-3]>=18,RC[-3]<19),15,IF(AND(RC[-3]<RC[-1],RC[-3]>=19,RC[-3]<20),10,IF(AND(RC[-3]<RC[-1],RC[-3]>=20,RC[-3]<21),5,IF(AND(RC[-3]<RC[-1],RC[-3]>=21),0,IF(AND(RC[-3]>RC[-1],RC[-3]>=2,RC[-3]<3),90,IF(AND(RC[-3]>RC[-1],RC[-3]>=3,RC[-3]<4),90,IF(AND(RC[-3]>RC[-1],RC[-3]>=4,RC[-3]<5),80,IF(AND(RC[-3]>RC[-1],RC[-3]>=5,RC[-3]<6),70,IF(AND(RC[-3]>RC[-1],RC[-3]>=6,RC[-3]<7),60,IF(AND(RC[-3]>RC[-1],RC[-3]>=7,RC[-3]<8),50,IF(AND(RC[-3]>RC[-1],RC[-3]>=8,RC[-3]<9),40,IF(AND(RC[-3]>RC[-1],RC[-3]>=9,RC[-3]<10),30,IF(AND(RC[-3]>RC[-1],RC[-3]>=10,RC[-3]<11),20,IF(AND(RC[-3]>RC[-1],RC[-3]>=11,RC[-3]<12),10,IF(AND(RC[-3]>RC[-1],RC[-3]>=12),0))))))))))))))))))))))))))))))))) -> 80 | H671: =IF(RC[-3]="","",IF(RC[-3]<0.3,100,IF(AND(RC[-3]>=0.3,RC[-3]>0.4),95,IF(AND(RC[-3]>=0.4,RC[-3]<0.5),90,IF(AND(RC[-3]>=0.5,RC[-3]<0.6),85,IF(AND(RC[-3]>=0.6,RC[-3]<0.7),80,IF(AND(RC[-3]>=0.6,RC[-3]<1),80,IF(AND(RC[-3]>1,RC[-3]<2),50,IF(RC[-3]>2,0))))))))) ->  | I671: =IF(RC[-1]="",RC[-2],0.7*RC[-1]+0.3*RC[-2]) -> 80
A672: صنعتی بوتان | B672: لبوتان | C672: =VLOOKUP(RC[-1],Sheet1!R3C2:R802C3,2,FALSE) -> ماشین آلات و تجهیزات | D672: =VLOOKUP(RC[-2],Sheet1!R3C2:R802C9,8,FALSE) -> 7.0543728257678291 | E672: =IF(VLOOKUP(RC[-3],Sheet1!R3C2:R803C11,10,FALSE)=0,"",VLOOKUP(Sheet2!RC[-3],Sheet1!R[1]C[-3]:R[801]C[6],10,FALSE)) ->  | F672: =Sheet1!R728C10 -> 19.5081528262597 | G672: =IF(RC[-3]<0,0,IF(AND(RC[-3]<RC[-1],RC[-3]<2),100,IF(AND(RC[-3]<RC[-1],RC[-3]>=2,RC[-3]<3),95,IF(AND(RC[-3]<RC[-1],RC[-3]>=3,RC[-3]<4),90,IF(AND(RC[-3]<RC[-1],RC[-3]>=4,RC[-3]<5),85,IF(AND(RC[-3]<RC[-1],RC[-3]>=5,RC[-3]<6),80,IF(AND(RC[-3]<RC[-1],RC[-3]>=6,RC[-3]<7),75,IF(AND(RC[-3]<RC[-1],RC[-3]>=7,RC[-3]<8),70,IF(AND(RC[-3]<RC[-1],RC[-3]>=8,RC[-3]<9),65,IF(AND(RC[-3]<RC[-1],RC[-3]>=9,RC[-3]<10),60,IF(AND(RC[-3]<RC[-1],RC[-3]>=10,RC[-3]<11),55,IF(AND(RC[-3]<RC[-1],RC[-3]>=11,RC[-3]<12),50,IF(AND(RC[-3]<RC[-1],RC[-3]>=12,RC[-3]<13),45,IF(AND(RC[-3]<RC[-1],RC[-3]>=13,RC[-3]<14),40,IF(AND(RC[-3]<RC[-1],RC[-3]>=14,RC[-3]<15),35,IF(AND(RC[-3]<RC[-1],RC[-3]>=15,RC[-3]<16),30,IF(AND(RC[-3]<RC[-1],RC[-3]>=16,RC[-3]<17),25,IF(AND(RC[-3]<RC[-1],RC[-3]>=17,RC[-3]<18),20,IF(AND(RC[-3]<RC[-1],RC[-3]>=18,RC[-3]<19),15,IF(AND(RC[-3]<RC[-1],RC[-3]>=19,RC[-3]<20),10,IF(AND(RC[-3]<RC[-1],RC[-3]>=20,RC[-3]<21),5,IF(AND(RC[-3]<RC[-1],RC[-3]>=21),0,IF(AND(RC[-3]>RC[-1],RC[-3]>=2,RC[-3]<3),90,IF(AND(RC[-3]>RC[-1],RC[-3]>=3,RC[-3]<4),90,IF(AND(RC[-3]>RC[-1],RC[-3]>=4,RC[-3]<5),80,IF(AND(RC[-3]>RC[-1],RC[-3]>=5,RC[-3]<6),70,IF(AND(RC[-3]>RC[-1],RC[-3]>=6,RC[-3]<7),60,IF(AND(RC[-3]>RC[-1],RC[-3]>=7,RC[-3]<8),50,IF(AND(RC[-3]>RC[-1],RC[-3]>=8,RC[-3]<9),40,IF(AND(RC[-3]>RC[-1],RC[-3]>=9,RC[-3]<10),30,IF(AND(RC[-3]>RC[-1],RC[-3]>=10,RC[-3]<11),20,IF(AND(RC[-3]>RC[-1],RC[-3]>=11,RC[-3]<12),10,IF(AND(RC[-3]>RC[-1],RC[-3]>=12),0))))))))))))))))))))))))))))))))) -> 70 | H672: =IF(RC[-3]="","",IF(RC[-3]<0.3,100,IF(AND(RC[-3]>=0.3,RC[-3]>0.4),95,IF(AND(RC[-3]>=0.4,RC[-3]<0.5),90,IF(AND(RC[-3]>=0.5,RC[-3]<0.6),85,IF(AND(RC[-3]>=0.6,RC[-3]<0.7),80,IF(AND(RC[-3]>=0.6,RC[-3]<1),80,IF(AND(RC[-3]>1,RC[-3]<2),50,IF(RC[-3]>2,0))))))))) ->  | I672: =IF(RC[-1]="",RC[-2],0.7*RC[-1]+0.3*RC[-2]) -> 70
A673: لوازم خانگی پارس | B673: لخانه | C673: =VLOOKUP(RC[-1],Sheet1!R3C2:R802C3,2,FALSE) -> ماشین آلات و تجهیزات | D673: =VLOOKUP(RC[-2],Sheet1!R3C2:R802C9,8,FALSE) -> 14.397849462365594 | E673: =IF(VLOOKUP(RC[-3],Sheet1!R3C2:R803C11,10,FALSE)=0,"",VLOOKUP(Sheet2!RC[-3],Sheet1!R[1]C[-3]:R[801]C[6],10,FALSE)) ->  | F673: =Sheet1!R728C10 -> 19.5081528262597 | G673: =IF(RC[-3]<0,0,IF(AND(RC[-3]<RC[-1],RC[-3]<2),100,IF(AND(RC[-3]<RC[-1],RC[-3]>=2,RC[-3]<3),95,IF(AND(RC[-3]<RC[-1],RC[-3]>=3,RC[-3]<4),90,IF(AND(RC[-3]<RC[-1],RC[-3]>=4,RC[-3]<5),85,IF(AND(RC[-3]<RC[-1],RC[-3]>=5,RC[-3]<6),80,IF(AND(RC[-3]<RC[-1],RC[-3]>=6,RC[-3]<7),75,IF(AND(RC[-3]<RC[-1],RC[-3]>=7,RC[-3]<8),70,IF(AND(RC[-3]<RC[-1],RC[-3]>=8,RC[-3]<9),65,IF(AND(RC[-3]<RC[-1],RC[-3]>=9,RC[-3]<10),60,IF(AND(RC[-3]<RC[-1],RC[-3]>=10,RC[-3]<11),55,IF(AND(RC[-3]<RC[-1],RC[-3]>=11,RC[-3]<12),50,IF(AND(RC[-3]<RC[-1],RC[-3]>=12,RC[-3]<13),45,IF(AND(RC[-3]<RC[-1],RC[-3]>=13,RC[-3]<14),40,IF(AND(RC[-3]<RC[-1],RC[-3]>=14,RC[-3]<15),35,IF(AND(RC[-3]<RC[-1],RC[-3]>=15,RC[-3]<16),30,IF(AND(RC[-3]<RC[-1],RC[-3]>=16,RC[-3]<17),25,IF(AND(RC[-3]<RC[-1],RC[-3]>=17,RC[-3]<18),20,IF(AND(RC[-3]<RC[-1],RC[-3]>=18,RC[-3]<19),15,IF(AND(RC[-3]<RC[-1],RC[-3]>=19,RC[-3]<20),10,IF(AND(RC[-3]<RC[-1],RC[-3]>=20,RC[-3]<21),5,IF(AND(RC[-3]<RC[-1],RC[-3]>=21),0,IF(AND(RC[-3]>RC[-1],RC[-3]>=2,RC[-3]<3),90,IF(AND(RC[-3]>RC[-1],RC[-3]>=3,RC[-3]<4),90,IF(AND(RC[-3]>RC[-1],RC[-3]>=4,RC[-3]<5),80,IF(AND(RC[-3]>RC[-1],RC[-3]>=5,RC[-3]<6),70,IF(AND(RC[-3]>RC[-1],RC[-3]>=6,RC[-3]<7),60,IF(AND(RC[-3]>RC[-1],RC[-3]>=7,RC[-3]<8),50,IF(AND(RC[-3]>RC[-1],RC[-3]>=8,RC[-3]<9),40,IF(AND(RC[-3]>RC[-1],RC[-3]>=9,RC[-3]<10),30,IF(AND(RC[-3]>RC[-1],RC[-3]>=10,RC[-3]<11),20,IF(AND(RC[-3]>RC[-1],RC[-3]>=11,RC[-3]<12),10,IF(AND(RC[-3]>RC[-1],RC[-3]>=12),0))))))))))))))))))))))))))))))))) -> 35 | H673: =IF(RC[-3]="","",IF(RC[-3]<0.3,100,IF(AND(RC[-3]>=0.3,RC[-3]>0.4),95,IF(AND(RC[-3]>=0.4,RC[-3]<0.5),90,IF(AND(RC[-3]>=0.5,RC[-3]<0.6),85,IF(AND(RC[-3]>=0.6,RC[-3]<0.7),80,IF(AND(RC[-3]>=0.6,RC[-3]<1),80,IF(AND(RC[-3]>1,RC[-3]<2),50,IF(RC[-3]>2,0))))))))) ->  | I673: =IF(RC[-1]="",RC[-2],0.7*RC[-1]+0.3*RC[-2]) -> 35
A674: ماشین آلات تراکتورسازی ایران | B674: تراک | C674: =VLOOKUP(RC[-1],Sheet1!R3C2:R802C3,2,FALSE) -> ماشین آلات و تجهیزات | D674: =VLOOKUP(RC[-2],Sheet1!R3C2:R802C9,8,FALSE) -> -0.25870860927152317 | E674: =IF(VLOOKUP(RC[-3],Sheet1!R3C2:R803C11,10,FALSE)=0,"",VLOOKUP(Sheet2!RC[-3],Sheet1!R[1]C[-3]:R[801]C[6],10,FALSE)) ->  | F674: =Sheet1!R728C10 -> 19.5081528262597 | G674: =IF(RC[-3]<0,0,IF(AND(RC[-3]<RC[-1],RC[-3]<2),100,IF(AND(RC[-3]<RC[-1],RC[-3]>=2,RC[-3]<3),95,IF(AND(RC[-3]<RC[-1],RC[-3]>=3,RC[-3]<4),90,IF(AND(RC[-3]<RC[-1],RC[-3]>=4,RC[-3]<5),85,IF(AND(RC[-3]<RC[-1],RC[-3]>=5,RC[-3]<6),80,IF(AND(RC[-3]<RC[-1],RC[-3]>=6,RC[-3]<7),75,IF(AND(RC[-3]<RC[-1],RC[-3]>=7,RC[-3]<8),70,IF(AND(RC[-3]<RC[-1],RC[-3]>=8,RC[-3]<9),65,IF(AND(RC[-3]<RC[-1],RC[-3]>=9,RC[-3]<10),60,IF(AND(RC[-3]<RC[-1],RC[-3]>=10,RC[-3]<11),55,IF(AND(RC[-3]<RC[-1],RC[-3]>=11,RC[-3]<12),50,IF(AND(RC[-3]<RC[-1],RC[-3]>=12,RC[-3]<13),45,IF(AND(RC[-3]<RC[-1],RC[-3]>=13,RC[-3]<14),40,IF(AND(RC[-3]<RC[-1],RC[-3]>=14,RC[-3]<15),35,IF(AND(RC[-3]<RC[-1],RC[-3]>=15,RC[-3]<16),30,IF(AND(RC[-3]<RC[-1],RC[-3]>=16,RC[-3]<17),25,IF(AND(RC[-3]<RC[-1],RC[-3]>=17,RC[-3]<18),20,IF(AND(RC[-3]<RC[-1],RC[-3]>=18,RC[-3]<19),15,IF(AND(RC[-3]<RC[-1],RC[-3]>=19,RC[-3]<20),10,IF(AND(RC[-3]<RC[-1],RC[-3]>=20,RC[-3]<21),5,IF(AND(RC[-3]<RC[-1],RC[-3]>=21),0,IF(AND(RC[-3]>RC[-1],RC[-3]>=2,RC[-3]<3),90,IF(AND(RC[-3]>RC[-1],RC[-3]>=3,RC[-3]<4),90,IF(AND(RC[-3]>RC[-1],RC[-3]>=4,RC[-3]<5),80,IF(AND(RC[-3]>RC[-1],RC[-3]>=5,RC[-3]<6),70,IF(AND(RC[-3]>RC[-1],RC[-3]>=6,RC[-3]<7),60,IF(AND(RC[-3]>RC[-1],RC[-3]>=7,RC[-3]<8),50,IF(AND(RC[-3]>RC[-1],RC[-3]>=8,RC[-3]<9),40,IF(AND(RC[-3]>RC[-1],RC[-3]>=9,RC[-3]<10),30,IF(AND(RC[-3]>RC[-1],RC[-3]>=10,RC[-3]<11),20,IF(AND(RC[-3]>RC[-1],RC[-3]>=11,RC[-3]<12),10,IF(AND(RC[-3]>RC[-1],RC[-3]>=12),0))))))))))))))))))))))))))))))))) -> 0 | H674: =IF(RC[-3]="","",IF(RC[-3]<0.3,100,IF(AND(RC[-3]>=0.3,RC[-3]>0.4),95,IF(AND(RC[-3]>=0.4,RC[-3]<0.5),90,IF(AND(RC[-3]>=0.5,RC[-3]<0.6),85,IF(AND(RC[-3]>=0.6,RC[-3]<0.7),80,IF(AND(RC[-3]>=0.6,RC[-3]<1),80,IF(AND(RC[-3]>1,RC[-3]<2),50,IF(RC[-3]>2,0))))))))) ->  | I674: =IF(RC[-1]="",RC[-2],0.7*RC[-1]+0.3*RC[-2]) -> 0
A675: ماشین سازی نیرو محرکه | B675: تمحرکه | C675: =VLOOKUP(RC[-1],Sheet1!R3C2:R802C3,2,FALSE) -> ماشین آلات و تجهیزات | D675: =VLOOKUP(RC[-2],Sheet1!R3C2:R802C9,8,FALSE) -> 1645.0601664639405 | E675: =IF(VLOOKUP(RC[-3],Sheet1!R3C2:R803C11,10,FALSE)=0,"",VLOOKUP(Sheet2!RC[-3],Sheet1!R[1]C[-3]:R[801]C[6],10,FALSE)) ->  | F675: =Sheet1!R728C10 -> 19.5081528262597 | G675: =IF(RC[-3]<0,0,IF(AND(RC[-3]<RC[-1],RC[-3]<2),100,IF(AND(RC[-3]<RC[-1],RC[-3]>=2,RC[-3]<3),95,IF(AND(RC[-3]<RC[-1],RC[-3]>=3,RC[-3]<4),90,IF(AND(RC[-3]<RC[-1],RC[-3]>=4,RC[-3]<5),85,IF(AND(RC[-3]<RC[-1],RC[-3]>=5,RC[-3]<6),80,IF(AND(RC[-3]<RC[-1],RC[-3]>=6,RC[-3]<7),75,IF(AND(RC[-3]<RC[-1],RC[-3]>=7,RC[-3]<8),70,IF(AND(RC[-3]<RC[-1],RC[-3]>=8,RC[-3]<9),65,IF(AND(RC[-3]<RC[-1],RC[-3]>=9,RC[-3]<10),60,IF(AND(RC[-3]<RC[-1],RC[-3]>=10,RC[-3]<11),55,IF(AND(RC[-3]<RC[-1],RC[-3]>=11,RC[-3]<12),50,IF(AND(RC[-3]<RC[-1],RC[-3]>=12,RC[-3]<13),45,IF(AND(RC[-3]<RC[-1],RC[-3]>=13,RC[-3]<14),40,IF(AND(RC[-3]<RC[-1],RC[-3]>=14,RC[-3]<15),35,IF(AND(RC[-3]<RC[-1],RC[-3]>=15,RC[-3]<16),30,IF(AND(RC[-3]<RC[-1],RC[-3]>=16,RC[-3]<17),25,IF(AND(RC[-3]<RC[-1],RC[-3]>=17,RC[-3]<18),20,IF(AND(RC[-3]<RC[-1],RC[-3]>=18,RC[-3]<19),15,IF(AND(RC[-3]<RC[-1],RC[-3]>=19,RC[-3]<20),10,IF(AND(RC[-3]<RC[-1],RC[-3]>=20,RC[-3]<21),5,IF(AND(RC[-3]<RC[-1],RC[-3]>=21),0,IF(AND(RC[-3]>RC[-1],RC[-3]>=2,RC[-3]<3),90,IF(AND(RC[-3]>RC[-1],RC[-3]>=3,RC[-3]<4),90,IF(AND(RC[-3]>RC[-1],RC[-3]>=4,RC[-3]<5),80,IF(AND(RC[-3]>RC[-1],RC[-3]>=5,RC[-3]<6),70,IF(AND(RC[-3]>RC[-1],RC[-3]>=6,RC[-3]<7),60,IF(AND(RC[-3]>RC[-1],RC[-3]>=7,RC[-3]<8),50,IF(AND(RC[-3]>RC[-1],RC[-3]>=8,RC[-3]<9),40,IF(AND(RC[-3]>RC[-1],RC[-3]>=9,RC[-3]<10),30,IF(AND(RC[-3]>RC[-1],RC[-3]>=10,RC[-3]<11),20,IF(AND(RC[-3]>RC[-1],RC[-3]>=11,RC[-3]<12),10,IF(AND(RC[-3]>RC[-1],RC[-3]>=12),0))))))))))))))))))))))))))))))))) -> 0 | H675: =IF(RC[-3]="","",IF(RC[-3]<0.3,100,IF(AND(RC[-3]>=0.3,RC[-3]>0.4),95,IF(AND(RC[-3]>=0.4,RC[-3]<0.5),90,IF(AND(RC[-3]>=0.5,RC[-3]<0.6),85,IF(AND(RC[-3]>=0.6,RC[-3]<0.7),80,IF(AND(RC[-3]>=0.6,RC[-3]<1),80,IF(AND(RC[-3]>1,RC[-3]<2),50,IF(RC[-3]>2,0))))))))) ->  | I675: =IF(RC[-1]="",RC[-2],0.7*RC[-1]+0.3*RC[-2]) -> 0
A676: مهندسی فیروزا | B676: تفیرو | C676: =VLOOKUP(RC[-1],Sheet1!R3C2:R802C3,2,FALSE) -> ماشین آلات و تجهیزات | D676: =VLOOKUP(RC[-2],Sheet1!R3C2:R802C9,8,FALSE) -> 100.06533855746501 | E676: =IF(VLOOKUP(RC[-3],Sheet1!R3C2:R803C11,10,FALSE)=0,"",VLOOKUP(Sheet2!RC[-3],Sheet1!R[1]C[-3]:R[801]C[6],10,FALSE)) ->  | F676: =Sheet1!R728C10 -> 19.5081528262597 | G676: =IF(RC[-3]<0,0,IF(AND(RC[-3]<RC[-1],RC[-3]<2),100,IF(AND(RC[-3]<RC[-1],RC[-3]>=2,RC[-3]<3),95,IF(AND(RC[-3]<RC[-1],RC[-3]>=3,RC[-3]<4),90,IF(AND(RC[-3]<RC[-1],RC[-3]>=4,RC[-3]<5),85,IF(AND(RC[-3]<RC[-1],RC[-3]>=5,RC[-3]<6),80,IF(AND(RC[-3]<RC[-1],RC[-3]>=6,RC[-3]<7),75,IF(AND(RC[-3]<RC[-1],RC[-3]>=7,RC[-3]<8),70,IF(AND(RC[-3]<RC[-1],RC[-3]>=8,RC[-3]<9),65,IF(AND(RC[-3]<RC[-1],RC[-3]>=9,RC[-3]<10),60,IF(AND(RC[-3]<RC[-1],RC[-3]>=10,RC[-3]<11),55,IF(AND(RC[-3]<RC[-1],RC[-3]>=11,RC[-3]<12),50,IF(AND(RC[-3]<RC[-1],RC[-3]>=12,RC[-3]<13),45,IF(AND(RC[-3]<RC[-1],RC[-3]>=13,RC[-3]<14),40,IF(AND(RC[-3]<RC[-1],RC[-3]>=14,RC[-3]<15),35,IF(AND(RC[-3]<RC[-1],RC[-3]>=15,RC[-3]<16),30,IF(AND(RC[-3]<RC[-1],RC[-3]>=16,RC[-3]<17),25,IF(AND(RC[-3]<RC[-1],RC[-3]>=17,RC[-3]<18),20,IF(AND(RC[-3]<RC[-1],RC[-3]>=18,RC[-3]<19),15,IF(AND(RC[-3]<RC[-1],RC[-3]>=19,RC[-3]<20),10,IF(AND(RC[-3]<RC[-1],RC[-3]>=20,RC[-3]<21),5,IF(AND(RC[-3]<RC[-1],RC[-3]>=21),0,IF(AND(RC[-3]>RC[-1],RC[-3]>=2,RC[-3]<3),90,IF(AND(RC[-3]>RC[-1],RC[-3]>=3,RC[-3]<4),90,IF(AND(RC[-3]>RC[-1],RC[-3]>=4,RC[-3]<5),80,IF(AND(RC[-3]>RC[-1],RC[-3]>=5,RC[-3]<6),70,IF(AND(RC[-3]>RC[-1],RC[-3]>=6,RC[-3]<7),60,IF(AND(RC[-3]>RC[-1],RC[-3]>=7,RC[-3]<8),50,IF(AND(RC[-3]>RC[-1],RC[-3]>=8,RC[-3]<9),40,IF(AND(RC[-3]>RC[-1],RC[-3]>=9,RC[-3]<10),30,IF(AND(RC[-3]>RC[-1],RC[-3]>=10,RC[-3]<11),20,IF(AND(RC[-3]>RC[-1],RC[-3]>=11,RC[-3]<12),10,IF(AND(RC[-3]>RC[-1],RC[-3]>=12),0))))))))))))))))))))))))))))))))) -> 0 | H676: =IF(RC[-3]="","",IF(RC[-3]<0.3,100,IF(AND(RC[-3]>=0.3,RC[-3]>0.4),95,IF(AND(RC[-3]>=0.4,RC[-3]<0.5),90,IF(AND(RC[-3]>=0.5,RC[-3]<0.6),85,IF(AND(RC[-3]>=0.6,RC[-3]<0.7),80,IF(AND(RC[-3]>=0.6,RC[-3]<1),80,IF(AND(RC[-3]>1,RC[-3]<2),50,IF(RC[-3]>2,0))))))))) ->  | I676: =IF(RC[-1]="",RC[-2],0.7*RC[-1]+0.3*RC[-2]) -> 0
A677: هپکو | B677: تپکو | C677: =VLOOKUP(RC[-1],Sheet1!R3C2:R802C3,2,FALSE) -> ماشین آلات و تجهیزات | D677: =VLOOKUP(RC[-2],Sheet1!R3C2:R802C9,8,FALSE) -> -32.233116980303571 | E677: =IF(VLOOKUP(RC[-3],Sheet1!R3C2:R803C11,10,FALSE)=0,"",VLOOKUP(Sheet2!RC[-3],Sheet1!R[1]C[-3]:R[801]C[6],10,FALSE)) ->  | F677: =Sheet1!R728C10 -> 19.5081528262597 | G677: =IF(RC[-3]<0,0,IF(AND(RC[-3]<RC[-1],RC[-3]<2),100,IF(AND(RC[-3]<RC[-1],RC[-3]>=2,RC[-3]<3),95,IF(AND(RC[-3]<RC[-1],RC[-3]>=3,RC[-3]<4),90,IF(AND(RC[-3]<RC[-1],RC[-3]>=4,RC[-3]<5),85,IF(AND(RC[-3]<RC[-1],RC[-3]>=5,RC[-3]<6),80,IF(AND(RC[-3]<RC[-1],RC[-3]>=6,RC[-3]<7),75,IF(AND(RC[-3]<RC[-1],RC[-3]>=7,RC[-3]<8),70,IF(AND(RC[-3]<RC[-1],RC[-3]>=8,RC[-3]<9),65,IF(AND(RC[-3]<RC[-1],RC[-3]>=9,RC[-3]<10),60,IF(AND(RC[-3]<RC[-1],RC[-3]>=10,RC[-3]<11),55,IF(AND(RC[-3]<RC[-1],RC[-3]>=11,RC[-3]<12),50,IF(AND(RC[-3]<RC[-1],RC[-3]>=12,RC[-3]<13),45,IF(AND(RC[-3]<RC[-1],RC[-3]>=13,RC[-3]<14),40,IF(AND(RC[-3]<RC[-1],RC[-3]>=14,RC[-3]<15),35,IF(AND(RC[-3]<RC[-1],RC[-3]>=15,RC[-3]<16),30,IF(AND(RC[-3]<RC[-1],RC[-3]>=16,RC[-3]<17),25,IF(AND(RC[-3]<RC[-1],RC[-3]>=17,RC[-3]<18),20,IF(AND(RC[-3]<RC[-1],RC[-3]>=18,RC[-3]<19),15,IF(AND(RC[-3]<RC[-1],RC[-3]>=19,RC[-3]<20),10,IF(AND(RC[-3]<RC[-1],RC[-3]>=20,RC[-3]<21),5,IF(AND(RC[-3]<RC[-1],RC[-3]>=21),0,IF(AND(RC[-3]>RC[-1],RC[-3]>=2,RC[-3]<3),90,IF(AND(RC[-3]>RC[-1],RC[-3]>=3,RC[-3]<4),90,IF(AND(RC[-3]>RC[-1],RC[-3]>=4,RC[-3]<5),80,IF(AND(RC[-3]>RC[-1],RC[-3]>=5,RC[-3]<6),70,IF(AND(RC[-3]>RC[-1],RC[-3]>=6,RC[-3]<7),60,IF(AND(RC[-3]>RC[-1],RC[-3]>=7,RC[-3]<8),50,IF(AND(RC[-3]>RC[-1],RC[-3]>=8,RC[-3]<9),40,IF(AND(RC[-3]>RC[-1],RC[-3]>=9,RC[-3]<10),30,IF(AND(RC[-3]>RC[-1],RC[-3]>=10,RC[-3]<11),20,IF(AND(RC[-3]>RC[-1],RC[-3]>=11,RC[-3]<12),10,IF(AND(RC[-3]>RC[-1],RC[-3]>=12),0))))))))))))))))))))))))))))))))) -> 0 | H677: =IF(RC[-3]="","",IF(RC[-3]<0.3,100,IF(AND(RC[-3]>=0.3,RC[-3]>0.4),95,IF(AND(RC[-3]>=0.4,RC[-3]<0.5),90,IF(AND(RC[-3]>=0.5,RC[-3]<0.6),85,IF(AND(RC[-3]>=0.6,RC[-3]<0.7),80,IF(AND(RC[-3]>=0.6,RC[-3]<1),80,IF(AND(RC[-3]>1,RC[-3]<2),50,IF(RC[-3]>2,0))))))))) ->  | I677: =IF(RC[-1]="",RC[-2],0.7*RC[-1]+0.3*RC[-2]) -> 0
A678: کارخانجات اتمسفر | B678: تاتمس | C678: =VLOOKUP(RC[-1],Sheet1!R3C2:R802C3,2,FALSE) -> ماشین آلات و تجهیزات | D678: =VLOOKUP(RC[-2],Sheet1!R3C2:R802C9,8,FALSE) -> 33.867558124530859 | E678: =IF(VLOOKUP(RC[-3],Sheet1!R3C2:R803C11,10,FALSE)=0,"",VLOOKUP(Sheet2!RC[-3],Sheet1!R[1]C[-3]:R[801]C[6],10,FALSE)) ->  | F678: =Sheet1!R728C10 -> 19.5081528262597 | G678: =IF(RC[-3]<0,0,IF(AND(RC[-3]<RC[-1],RC[-3]<2),100,IF(AND(RC[-3]<RC[-1],RC[-3]>=2,RC[-3]<3),95,IF(AND(RC[-3]<RC[-1],RC[-3]>=3,RC[-3]<4),90,IF(AND(RC[-3]<RC[-1],RC[-3]>=4,RC[-3]<5),85,IF(AND(RC[-3]<RC[-1],RC[-3]>=5,RC[-3]<6),80,IF(AND(RC[-3]<RC[-1],RC[-3]>=6,RC[-3]<7),75,IF(AND(RC[-3]<RC[-1],RC[-3]>=7,RC[-3]<8),70,IF(AND(RC[-3]<RC[-1],RC[-3]>=8,RC[-3]<9),65,IF(AND(RC[-3]<RC[-1],RC[-3]>=9,RC[-3]<10),60,IF(AND(RC[-3]<RC[-1],RC[-3]>=10,RC[-3]<11),55,IF(AND(RC[-3]<RC[-1],RC[-3]>=11,RC[-3]<12),50,IF(AND(RC[-3]<RC[-1],RC[-3]>=12,RC[-3]<13),45,IF(AND(RC[-3]<RC[-1],RC[-3]>=13,RC[-3]<14),40,IF(AND(RC[-3]<RC[-1],RC[-3]>=14,RC[-3]<15),35,IF(AND(RC[-3]<RC[-1],RC[-3]>=15,RC[-3]<16),30,IF(AND(RC[-3]<RC[-1],RC[-3]>=16,RC[-3]<17),25,IF(AND(RC[-3]<RC[-1],RC[-3]>=17,RC[-3]<18),20,IF(AND(RC[-3]<RC[-1],RC[-3]>=18,RC[-3]<19),15,IF(AND(RC[-3]<RC[-1],RC[-3]>=19,RC[-3]<20),10,IF(AND(RC[-3]<RC[-1],RC[-3]>=20,RC[-3]<21),5,IF(AND(RC[-3]<RC[-1],RC[-3]>=21),0,IF(AND(RC[-3]>RC[-1],RC[-3]>=2,RC[-3]<3),90,IF(AND(RC[-3]>RC[-1],RC[-3]>=3,RC[-3]<4),90,IF(AND(RC[-3]>RC[-1],RC[-3]>=4,RC[-3]<5),80,IF(AND(RC[-3]>RC[-1],RC[-3]>=5,RC[-3]<6),70,IF(AND(RC[-3]>RC[-1],RC[-3]>=6,RC[-3]<7),60,IF(AND(RC[-3]>RC[-1],RC[-3]>=7,RC[-3]<8),50,IF(AND(RC[-3]>RC[-1],RC[-3]>=8,RC[-3]<9),40,IF(AND(RC[-3]>RC[-1],RC[-3]>=9,RC[-3]<10),30,IF(AND(RC[-3]>RC[-1],RC[-3]>=10,RC[-3]<11),20,IF(AND(RC[-3]>RC[-1],RC[-3]>=11,RC[-3]<12),10,IF(AND(RC[-3]>RC[-1],RC[-3]>=12),0))))))))))))))))))))))))))))))))) -> 0 | H678: =IF(RC[-3]="","",IF(RC[-3]<0.3,100,IF(AND(RC[-3]>=0.3,RC[-3]>0.4),95,IF(AND(RC[-3]>=0.4,RC[-3]<0.5),90,IF(AND(RC[-3]>=0.5,RC[-3]<0.6),85,IF(AND(RC[-3]>=0.6,RC[-3]<0.7),80,IF(AND(RC[-3]>=0.6,RC[-3]<1),80,IF(AND(RC[-3]>1,RC[-3]<2),50,IF(RC[-3]>2,0))))))))) ->  | I678: =IF(RC[-1]="",RC[-2],0.7*RC[-1]+0.3*RC[-2]) -> 0
A679: کمباین سازی | B679: تکمبا | C679: =VLOOKUP(RC[-1],Sheet1!R3C2:R802C3,2,FALSE) -> ماشین آلات و تجهیزات | D679: =VLOOKUP(RC[-2],Sheet1!R3C2:R802C9,8,FALSE) -> 17.689860386317331 | E679: =IF(VLOOKUP(RC[-3],Sheet1!R3C2:R803C11,10,FALSE)=0,"",VLOOKUP(Sheet2!RC[-3],Sheet1!R[1]C[-3]:R[801]C[6],10,FALSE)) ->  | F679: =Sheet1!R728C10 -> 19.5081528262597 | G679: =IF(RC[-3]<0,0,IF(AND(RC[-3]<RC[-1],RC[-3]<2),100,IF(AND(RC[-3]<RC[-1],RC[-3]>=2,RC[-3]<3),95,IF(AND(RC[-3]<RC[-1],RC[-3]>=3,RC[-3]<4),90,IF(AND(RC[-3]<RC[-1],RC[-3]>=4,RC[-3]<5),85,IF(AND(RC[-3]<RC[-1],RC[-3]>=5,RC[-3]<6),80,IF(AND(RC[-3]<RC[-1],RC[-3]>=6,RC[-3]<7),75,IF(AND(RC[-3]<RC[-1],RC[-3]>=7,RC[-3]<8),70,IF(AND(RC[-3]<RC[-1],RC[-3]>=8,RC[-3]<9),65,IF(AND(RC[-3]<RC[-1],RC[-3]>=9,RC[-3]<10),60,IF(AND(RC[-3]<RC[-1],RC[-3]>=10,RC[-3]<11),55,IF(AND(RC[-3]<RC[-1],RC[-3]>=11,RC[-3]<12),50,IF(AND(RC[-3]<RC[-1],RC[-3]>=12,RC[-3]<13),45,IF(AND(RC[-3]<RC[-1],RC[-3]>=13,RC[-3]<14),40,IF(AND(RC[-3]<RC[-1],RC[-3]>=14,RC[-3]<15),35,IF(AND(RC[-3]<RC[-1],RC[-3]>=15,RC[-3]<16),30,IF(AND(RC[-3]<RC[-1],RC[-3]>=16,RC[-3]<17),25,IF(AND(RC[-3]<RC[-1],RC[-3]>=17,RC[-3]<18),20,IF(AND(RC[-3]<RC[-1],RC[-3]>=18,RC[-3]<19),15,IF(AND(RC[-3]<RC[-1],RC[-3]>=19,RC[-3]<20),10,IF(AND(RC[-3]<RC[-1],RC[-3]>=20,RC[-3]<21),5,IF(AND(RC[-3]<RC[-1],RC[-3]>=21),0,IF(AND(RC[-3]>RC[-1],RC[-3]>=2,RC[-3]<3),90,IF(AND(RC[-3]>RC[-1],RC[-3]>=3,RC[-3]<4),90,IF(AND(RC[-3]>RC[-1],RC[-3]>=4,RC[-3]<5),80,IF(AND(RC[-3]>RC[-1],RC[-3]>=5,RC[-3]<6),70,IF(AND(RC[-3]>RC[-1],RC[-3]>=6,RC[-3]<7),60,IF(AND(RC[-3]>RC[-1],RC[-3]>=7,RC[-3]<8),50,IF(AND(RC[-3]>RC[-1],RC[-3]>=8,RC[-3]<9),40,IF(AND(RC[-3]>RC[-1],RC[-3]>=9,RC[-3]<10),30,IF(AND(RC[-3]>RC[-1],RC[-3]>=10,RC[-3]<11),20,IF(AND(RC[-3]>RC[-1],RC[-3]>=11,RC[-3]<12),10,IF(AND(RC[-3]>RC[-1],RC[-3]>=12),0))))))))))))))))))))))))))))))))) -> 20 | H679: =IF(RC[-3]="","",IF(RC[-3]<0.3,100,IF(AND(RC[-3]>=0.3,RC[-3]>0.4),95,IF(AND(RC[-3]>=0.4,RC[-3]<0.5),90,IF(AND(RC[-3]>=0.5,RC[-3]<0.6),85,IF(AND(RC[-3]>=0.6,RC[-3]<0.7),80,IF(AND(RC[-3]>=0.6,RC[-3]<1),80,IF(AND(RC[-3]>1,RC[-3]<2),50,IF(RC[-3]>2,0))))))))) ->  | I679: =IF(RC[-1]="",RC[-2],0.7*RC[-1]+0.3*RC[-2]) -> 20
A680: صنایع چوب خزر کاسپین | B680: چخزر | C680: =VLOOKUP(RC[-1],Sheet1!R3C2:R802C3,2,FALSE) -> محصولات چوبی | D680: =VLOOKUP(RC[-2],Sheet1!R3C2:R802C9,8,FALSE) -> 7.8785098044801805 | E680: =IF(VLOOKUP(RC[-3],Sheet1!R3C2:R803C11,10,FALSE)=0,"",VLOOKUP(Sheet2!RC[-3],Sheet1!R[1]C[-3]:R[801]C[6],10,FALSE)) ->  | F680: =Sheet1!R734C10 -> 102.92034006927268 | G680: =IF(RC[-3]<0,0,IF(AND(RC[-3]<RC[-1],RC[-3]<2),100,IF(AND(RC[-3]<RC[-1],RC[-3]>=2,RC[-3]<3),95,IF(AND(RC[-3]<RC[-1],RC[-3]>=3,RC[-3]<4),90,IF(AND(RC[-3]<RC[-1],RC[-3]>=4,RC[-3]<5),85,IF(AND(RC[-3]<RC[-1],RC[-3]>=5,RC[-3]<6),80,IF(AND(RC[-3]<RC[-1],RC[-3]>=6,RC[-3]<7),75,IF(AND(RC[-3]<RC[-1],RC[-3]>=7,RC[-3]<8),70,IF(AND(RC[-3]<RC[-1],RC[-3]>=8,RC[-3]<9),65,IF(AND(RC[-3]<RC[-1],RC[-3]>=9,RC[-3]<10),60,IF(AND(RC[-3]<RC[-1],RC[-3]>=10,RC[-3]<11),55,IF(AND(RC[-3]<RC[-1],RC[-3]>=11,RC[-3]<12),50,IF(AND(RC[-3]<RC[-1],RC[-3]>=12,RC[-3]<13),45,IF(AND(RC[-3]<RC[-1],RC[-3]>=13,RC[-3]<14),40,IF(AND(RC[-3]<RC[-1],RC[-3]>=14,RC[-3]<15),35,IF(AND(RC[-3]<RC[-1],RC[-3]>=15,RC[-3]<16),30,IF(AND(RC[-3]<RC[-1],RC[-3]>=16,RC[-3]<17),25,IF(AND(RC[-3]<RC[-1],RC[-3]>=17,RC[-3]<18),20,IF(AND(RC[-3]<RC[-1],RC[-3]>=18,RC[-3]<19),15,IF(AND(RC[-3]<RC[-1],RC[-3]>=19,RC[-3]<20),10,IF(AND(RC[-3]<RC[-1],RC[-3]>=20,RC[-3]<21),5,IF(AND(RC[-3]<RC[-1],RC[-3]>=21),0,IF(AND(RC[-3]>RC[-1],RC[-3]>=2,RC[-3]<3),90,IF(AND(RC[-3]>RC[-1],RC[-3]>=3,RC[-3]<4),90,IF(AND(RC[-3]>RC[-1],RC[-3]>=4,RC[-3]<5),80,IF(AND(RC[-3]>RC[-1],RC[-3]>=5,RC[-3]<6),70,IF(AND(RC[-3]>RC[-1],RC[-3]>=6,RC[-3]<7),60,IF(AND(RC[-3]>RC[-1],RC[-3]>=7,RC[-3]<8),50,IF(AND(RC[-3]>RC[-1],RC[-3]>=8,RC[-3]<9),40,IF(AND(RC[-3]>RC[-1],RC[-3]>=9,RC[-3]<10),30,IF(AND(RC[-3]>RC[-1],RC[-3]>=10,RC[-3]<11),20,IF(AND(RC[-3]>RC[-1],RC[-3]>=11,RC[-3]<12),10,IF(AND(RC[-3]>RC[-1],RC[-3]>=12),0))))))))))))))))))))))))))))))))) -> 70 | H680: =IF(RC[-3]="","",IF(RC[-3]<0.3,100,IF(AND(RC[-3]>=0.3,RC[-3]>0.4),95,IF(AND(RC[-3]>=0.4,RC[-3]<0.5),90,IF(AND(RC[-3]>=0.5,RC[-3]<0.6),85,IF(AND(RC[-3]>=0.6,RC[-3]<0.7),80,IF(AND(RC[-3]>=0.6,RC[-3]<1),80,IF(AND(RC[-3]>1,RC[-3]<2),50,IF(RC[-3]>2,0))))))))) ->  | I680: =IF(RC[-1]="",RC[-2],0.7*RC[-1]+0.3*RC[-2]) -> 70
A681: فیبر ایران | B681: چفیبر | C681: =VLOOKUP(RC[-1],Sheet1!R3C2:R802C3,2,FALSE) -> محصولات چوبی | D681: =VLOOKUP(RC[-2],Sheet1!R3C2:R802C9,8,FALSE) -> 52.116071428571431 | E681: =IF(VLOOKUP(RC[-3],Sheet1!R3C2:R803C11,10,FALSE)=0,"",VLOOKUP(Sheet2!RC[-3],Sheet1!R[1]C[-3]:R[801]C[6],10,FALSE)) ->  | F681: =Sheet1!R734C10 -> 102.92034006927268 | G681: =IF(RC[-3]<0,0,IF(AND(RC[-3]<RC[-1],RC[-3]<2),100,IF(AND(RC[-3]<RC[-1],RC[-3]>=2,RC[-3]<3),95,IF(AND(RC[-3]<RC[-1],RC[-3]>=3,RC[-3]<4),90,IF(AND(RC[-3]<RC[-1],RC[-3]>=4,RC[-3]<5),85,IF(AND(RC[-3]<RC[-1],RC[-3]>=5,RC[-3]<6),80,IF(AND(RC[-3]<RC[-1],RC[-3]>=6,RC[-3]<7),75,IF(AND(RC[-3]<RC[-1],RC[-3]>=7,RC[-3]<8),70,IF(AND(RC[-3]<RC[-1],RC[-3]>=8,RC[-3]<9),65,IF(AND(RC[-3]<RC[-1],RC[-3]>=9,RC[-3]<10),60,IF(AND(RC[-3]<RC[-1],RC[-3]>=10,RC[-3]<11),55,IF(AND(RC[-3]<RC[-1],RC[-3]>=11,RC[-3]<12),50,IF(AND(RC[-3]<RC[-1],RC[-3]>=12,RC[-3]<13),45,IF(AND(RC[-3]<RC[-1],RC[-3]>=13,RC[-3]<14),40,IF(AND(RC[-3]<RC[-1],RC[-3]>=14,RC[-3]<15),35,IF(AND(RC[-3]<RC[-1],RC[-3]>=15,RC[-3]<16),30,IF(AND(RC[-3]<RC[-1],RC[-3]>=16,RC[-3]<17),25,IF(AND(RC[-3]<RC[-1],RC[-3]>=17,RC[-3]<18),20,IF(AND(RC[-3]<RC[-1],RC[-3]>=18,RC[-3]<19),15,IF(AND(RC[-3]<RC[-1],RC[-3]>=19,RC[-3]<20),10,IF(AND(RC[-3]<RC[-1],RC[-3]>=20,RC[-3]<21),5,IF(AND(RC[-3]<RC[-1],RC[-3]>=21),0,IF(AND(RC[-3]>RC[-1],RC[-3]>=2,RC[-3]<3),90,IF(AND(RC[-3]>RC[-1],RC[-3]>=3,RC[-3]<4),90,IF(AND(RC[-3]>RC[-1],RC[-3]>=4,RC[-3]<5),80,IF(AND(RC[-3]>RC[-1],RC[-3]>=5,RC[-3]<6),70,IF(AND(RC[-3]>RC[-1],RC[-3]>=6,RC[-3]<7),60,IF(AND(RC[-3]>RC[-1],RC[-3]>=7,RC[-3]<8),50,IF(AND(RC[-3]>RC[-1],RC[-3]>=8,RC[-3]<9),40,IF(AND(RC[-3]>RC[-1],RC[-3]>=9,RC[-3]<10),30,IF(AND(RC[-3]>RC[-1],RC[-3]>=10,RC[-3]<11),20,IF(AND(RC[-3]>RC[-1],RC[-3]>=11,RC[-3]<12),10,IF(AND(RC[-3]>RC[-1],RC[-3]>=12),0))))))))))))))))))))))))))))))))) -> 0 | H681: =IF(RC[-3]="","",IF(RC[-3]<0.3,100,IF(AND(RC[-3]>=0.3,RC[-3]>0.4),95,IF(AND(RC[-3]>=0.4,RC[-3]<0.5),90,IF(AND(RC[-3]>=0.5,RC[-3]<0.6),85,IF(AND(RC[-3]>=0.6,RC[-3]<0.7),80,IF(AND(RC[-3]>=0.6,RC[-3]<1),80,IF(AND(RC[-3]>1,RC[-3]<2),50,IF(RC[-3]>2,0))))))))) ->  | I681: =IF(RC[-1]="",RC[-2],0.7*RC[-1]+0.3*RC[-2]) -> 0
A682: نئوپان 22 بهمن | B682: چنوپا | C682: =VLOOKUP(RC[-1],Sheet1!R3C2:R802C3,2,FALSE) -> محصولات چوبی | D682: =VLOOKUP(RC[-2],Sheet1!R3C2:R802C9,8,FALSE) -> 181.06003723139034 | E682: =IF(VLOOKUP(RC[-3],Sheet1!R3C2:R803C11,10,FALSE)=0,"",VLOOKUP(Sheet2!RC[-3],Sheet1!R[1]C[-3]:R[801]C[6],10,FALSE)) ->  | F682: =Sheet1!R734C10 -> 102.92034006927268 | G682: =IF(RC[-3]<0,0,IF(AND(RC[-3]<RC[-1],RC[-3]<2),100,IF(AND(RC[-3]<RC[-1],RC[-3]>=2,RC[-3]<3),95,IF(AND(RC[-3]<RC[-1],RC[-3]>=3,RC[-3]<4),90,IF(AND(RC[-3]<RC[-1],RC[-3]>=4,RC[-3]<5),85,IF(AND(RC[-3]<RC[-1],RC[-3]>=5,RC[-3]<6),80,IF(AND(RC[-3]<RC[-1],RC[-3]>=6,RC[-3]<7),75,IF(AND(RC[-3]<RC[-1],RC[-3]>=7,RC[-3]<8),70,IF(AND(RC[-3]<RC[-1],RC[-3]>=8,RC[-3]<9),65,IF(AND(RC[-3]<RC[-1],RC[-3]>=9,RC[-3]<10),60,IF(AND(RC[-3]<RC[-1],RC[-3]>=10,RC[-3]<11),55,IF(AND(RC[-3]<RC[-1],RC[-3]>=11,RC[-3]<12),50,IF(AND(RC[-3]<RC[-1],RC[-3]>=12,RC[-3]<13),45,IF(AND(RC[-3]<RC[-1],RC[-3]>=13,RC[-3]<14),40,IF(AND(RC[-3]<RC[-1],RC[-3]>=14,RC[-3]<15),35,IF(AND(RC[-3]<RC[-1],RC[-3]>=15,RC[-3]<16),30,IF(AND(RC[-3]<RC[-1],RC[-3]>=16,RC[-3]<17),25,IF(AND(RC[-3]<RC[-1],RC[-3]>=17,RC[-3]<18),20,IF(AND(RC[-3]<RC[-1],RC[-3]>=18,RC[-3]<19),15,IF(AND(RC[-3]<RC[-1],RC[-3]>=19,RC[-3]<20),10,IF(AND(RC[-3]<RC[-1],RC[-3]>=20,RC[-3]<21),5,IF(AND(RC[-3]<RC[-1],RC[-3]>=21),0,IF(AND(RC[-3]>RC[-1],RC[-3]>=2,RC[-3]<3),90,IF(AND(RC[-3]>RC[-1],RC[-3]>=3,RC[-3]<4),90,IF(AND(RC[-3]>RC[-1],RC[-3]>=4,RC[-3]<5),80,IF(AND(RC[-3]>RC[-1],RC[-3]>=5,RC[-3]<6),70,IF(AND(RC[-3]>RC[-1],RC[-3]>=6,RC[-3]<7),60,IF(AND(RC[-3]>RC[-1],RC[-3]>=7,RC[-3]<8),50,IF(AND(RC[-3]>RC[-1],RC[-3]>=8,RC[-3]<9),40,IF(AND(RC[-3]>RC[-1],RC[-3]>=9,RC[-3]<10),30,IF(AND(RC[-3]>RC[-1],RC[-3]>=10,RC[-3]<11),20,IF(AND(RC[-3]>RC[-1],RC[-3]>=11,RC[-3]<12),10,IF(AND(RC[-3]>RC[-1],RC[-3]>=12),0))))))))))))))))))))))))))))))))) -> 0 | H682: =IF(RC[-3]="","",IF(RC[-3]<0.3,100,IF(AND(RC[-3]>=0.3,RC[-3]>0.4),95,IF(AND(RC[-3]>=0.4,RC[-3]<0.5),90,IF(AND(RC[-3]>=0.5,RC[-3]<0.6),85,IF(AND(RC[-3]>=0.6,RC[-3]<0.7),80,IF(AND(RC[-3]>=0.6,RC[-3]<1),80,IF(AND(RC[-3]>1,RC[-3]<2),50,IF(RC[-3]>2,0))))))))) ->  | I682: =IF(RC[-1]="",RC[-2],0.7*RC[-1]+0.3*RC[-2]) -> 0
A683: آذراب | B683: فاذر | C683: =VLOOKUP(RC[-1],Sheet1!R3C2:R802C3,2,FALSE) -> محصولات فلزی | D683: =VLOOKUP(RC[-2],Sheet1!R3C2:R802C9,8,FALSE) -> -24.098750000000003 | E683: =IF(VLOOKUP(RC[-3],Sheet1!R3C2:R803C11,10,FALSE)=0,"",VLOOKUP(Sheet2!RC[-3],Sheet1!R[1]C[-3]:R[801]C[6],10,FALSE)) ->  | F683: =Sheet1!R748C10 -> 4.6263479498913709 | G683: =IF(RC[-3]<0,0,IF(AND(RC[-3]<RC[-1],RC[-3]<2),100,IF(AND(RC[-3]<RC[-1],RC[-3]>=2,RC[-3]<3),95,IF(AND(RC[-3]<RC[-1],RC[-3]>=3,RC[-3]<4),90,IF(AND(RC[-3]<RC[-1],RC[-3]>=4,RC[-3]<5),85,IF(AND(RC[-3]<RC[-1],RC[-3]>=5,RC[-3]<6),80,IF(AND(RC[-3]<RC[-1],RC[-3]>=6,RC[-3]<7),75,IF(AND(RC[-3]<RC[-1],RC[-3]>=7,RC[-3]<8),70,IF(AND(RC[-3]<RC[-1],RC[-3]>=8,RC[-3]<9),65,IF(AND(RC[-3]<RC[-1],RC[-3]>=9,RC[-3]<10),60,IF(AND(RC[-3]<RC[-1],RC[-3]>=10,RC[-3]<11),55,IF(AND(RC[-3]<RC[-1],RC[-3]>=11,RC[-3]<12),50,IF(AND(RC[-3]<RC[-1],RC[-3]>=12,RC[-3]<13),45,IF(AND(RC[-3]<RC[-1],RC[-3]>=13,RC[-3]<14),40,IF(AND(RC[-3]<RC[-1],RC[-3]>=14,RC[-3]<15),35,IF(AND(RC[-3]<RC[-1],RC[-3]>=15,RC[-3]<16),30,IF(AND(RC[-3]<RC[-1],RC[-3]>=16,RC[-3]<17),25,IF(AND(RC[-3]<RC[-1],RC[-3]>=17,RC[-3]<18),20,IF(AND(RC[-3]<RC[-1],RC[-3]>=18,RC[-3]<19),15,IF(AND(RC[-3]<RC[-1],RC[-3]>=19,RC[-3]<20),10,IF(AND(RC[-3]<RC[-1],RC[-3]>=20,RC[-3]<21),5,IF(AND(RC[-3]<RC[-1],RC[-3]>=21),0,IF(AND(RC[-3]>RC[-1],RC[-3]>=2,RC[-3]<3),90,IF(AND(RC[-3]>RC[-1],RC[-3]>=3,RC[-3]<4),90,IF(AND(RC[-3]>RC[-1],RC[-3]>=4,RC[-3]<5),80,IF(AND(RC[-3]>RC[-1],RC[-3]>=5,RC[-3]<6),70,IF(AND(RC[-3]>RC[-1],RC[-3]>=6,RC[-3]<7),60,IF(AND(RC[-3]>RC[-1],RC[-3]>=7,RC[-3]<8),50,IF(AND(RC[-3]>RC[-1],RC[-3]>=8,RC[-3]<9),40,IF(AND(RC[-3]>RC[-1],RC[-3]>=9,RC[-3]<10),30,IF(AND(RC[-3]>RC[-1],RC[-3]>=10,RC[-3]<11),20,IF(AND(RC[-3]>RC[-1],RC[-3]>=11,RC[-3]<12),10,IF(AND(RC[-3]>RC[-1],RC[-3]>=12),0))))))))))))))))))))))))))))))))) -> 0 | H683: =IF(RC[-3]="","",IF(RC[-3]<0.3,100,IF(AND(RC[-3]>=0.3,RC[-3]>0.4),95,IF(AND(RC[-3]>=0.4,RC[-3]<0.5),90,IF(AND(RC[-3]>=0.5,RC[-3]<0.6),85,IF(AND(RC[-3]>=0.6,RC[-3]<0.7),80,IF(AND(RC[-3]>=0.6,RC[-3]<1),80,IF(AND(RC[-3]>1,RC[-3]<2),50,IF(RC[-3]>2,0))))))))) ->  | I683: =IF(RC[-1]="",RC[-2],0.7*RC[-1]+0.3*RC[-2]) -> 0
A684: آما | B684: فاما | C684: =VLOOKUP(RC[-1],Sheet1!R3C2:R802C3,2,FALSE) -> محصولات فلزی | D684: =VLOOKUP(RC[-2],Sheet1!R3C2:R802C9,8,FALSE) -> 6.2957343172806031 | E684: =IF(VLOOKUP(RC[-3],Sheet1!R3C2:R803C11,10,FALSE)=0,"",VLOOKUP(Sheet2!RC[-3],Sheet1!R[1]C[-3]:R[801]C[6],10,FALSE)) ->  | F684: =Sheet1!R748C10 -> 4.6263479498913709 | G684: =IF(RC[-3]<0,0,IF(AND(RC[-3]<RC[-1],RC[-3]<2),100,IF(AND(RC[-3]<RC[-1],RC[-3]>=2,RC[-3]<3),95,IF(AND(RC[-3]<RC[-1],RC[-3]>=3,RC[-3]<4),90,IF(AND(RC[-3]<RC[-1],RC[-3]>=4,RC[-3]<5),85,IF(AND(RC[-3]<RC[-1],RC[-3]>=5,RC[-3]<6),80,IF(AND(RC[-3]<RC[-1],RC[-3]>=6,RC[-3]<7),75,IF(AND(RC[-3]<RC[-1],RC[-3]>=7,RC[-3]<8),70,IF(AND(RC[-3]<RC[-1],RC[-3]>=8,RC[-3]<9),65,IF(AND(RC[-3]<RC[-1],RC[-3]>=9,RC[-3]<10),60,IF(AND(RC[-3]<RC[-1],RC[-3]>=10,RC[-3]<11),55,IF(AND(RC[-3]<RC[-1],RC[-3]>=11,RC[-3]<12),50,IF(AND(RC[-3]<RC[-1],RC[-3]>=12,RC[-3]<13),45,IF(AND(RC[-3]<RC[-1],RC[-3]>=13,RC[-3]<14),40,IF(AND(RC[-3]<RC[-1],RC[-3]>=14,RC[-3]<15),35,IF(AND(RC[-3]<RC[-1],RC[-3]>=15,RC[-3]<16),30,IF(AND(RC[-3]<RC[-1],RC[-3]>=16,RC[-3]<17),25,IF(AND(RC[-3]<RC[-1],RC[-3]>=17,RC[-3]<18),20,IF(AND(RC[-3]<RC[-1],RC[-3]>=18,RC[-3]<19),15,IF(AND(RC[-3]<RC[-1],RC[-3]>=19,RC[-3]<20),10,IF(AND(RC[-3]<RC[-1],RC[-3]>=20,RC[-3]<21),5,IF(AND(RC[-3]<RC[-1],RC[-3]>=21),0,IF(AND(RC[-3]>RC[-1],RC[-3]>=2,RC[-3]<3),90,IF(AND(RC[-3]>RC[-1],RC[-3]>=3,RC[-3]<4),90,IF(AND(RC[-3]>RC[-1],RC[-3]>=4,RC[-3]<5),80,IF(AND(RC[-3]>RC[-1],RC[-3]>=5,RC[-3]<6),70,IF(AND(RC[-3]>RC[-1],RC[-3]>=6,RC[-3]<7),60,IF(AND(RC[-3]>RC[-1],RC[-3]>=7,RC[-3]<8),50,IF(AND(RC[-3]>RC[-1],RC[-3]>=8,RC[-3]<9),40,IF(AND(RC[-3]>RC[-1],RC[-3]>=9,RC[-3]<10),30,IF(AND(RC[-3]>RC[-1],RC[-3]>=10,RC[-3]<11),20,IF(AND(RC[-3]>RC[-1],RC[-3]>=11,RC[-3]<12),10,IF(AND(RC[-3]>RC[-1],RC[-3]>=12),0))))))))))))))))))))))))))))))))) -> 60 | H684: =IF(RC[-3]="","",IF(RC[-3]<0.3,100,IF(AND(RC[-3]>=0.3,RC[-3]>0.4),95,IF(AND(RC[-3]>=0.4,RC[-3]<0.5),90,IF(AND(RC[-3]>=0.5,RC[-3]<0.6),85,IF(AND(RC[-3]>=0.6,RC[-3]<0.7),80,IF(AND(RC[-3]>=0.6,RC[-3]<1),80,IF(AND(RC[-3]>1,RC[-3]<2),50,IF(RC[-3]>2,0))))))))) ->  | I684: =IF(RC[-1]="",RC[-2],0.7*RC[-1]+0.3*RC[-2]) -> 60
A685: انرژی آذرآب | B685: فنرژی | C685: =VLOOKUP(RC[-1],Sheet1!R3C2:R802C3,2,FALSE) -> محصولات فلزی | D685: =VLOOKUP(RC[-2],Sheet1!R3C2:R802C9,8,FALSE) -> -0.54987293519695046 | E685: =IF(VLOOKUP(RC[-3],Sheet1!R3C2:R803C11,10,FALSE)=0,"",VLOOKUP(Sheet2!RC[-3],Sheet1!R[1]C[-3]:R[801]C[6],10,FALSE)) ->  | F685: =Sheet1!R748C10 -> 4.6263479498913709 | G685: =IF(RC[-3]<0,0,IF(AND(RC[-3]<RC[-1],RC[-3]<2),100,IF(AND(RC[-3]<RC[-1],RC[-3]>=2,RC[-3]<3),95,IF(AND(RC[-3]<RC[-1],RC[-3]>=3,RC[-3]<4),90,IF(AND(RC[-3]<RC[-1],RC[-3]>=4,RC[-3]<5),85,IF(AND(RC[-3]<RC[-1],RC[-3]>=5,RC[-3]<6),80,IF(AND(RC[-3]<RC[-1],RC[-3]>=6,RC[-3]<7),75,IF(AND(RC[-3]<RC[-1],RC[-3]>=7,RC[-3]<8),70,IF(AND(RC[-3]<RC[-1],RC[-3]>=8,RC[-3]<9),65,IF(AND(RC[-3]<RC[-1],RC[-3]>=9,RC[-3]<10),60,IF(AND(RC[-3]<RC[-1],RC[-3]>=10,RC[-3]<11),55,IF(AND(RC[-3]<RC[-1],RC[-3]>=11,RC[-3]<12),50,IF(AND(RC[-3]<RC[-1],RC[-3]>=12,RC[-3]<13),45,IF(AND(RC[-3]<RC[-1],RC[-3]>=13,RC[-3]<14),40,IF(AND(RC[-3]<RC[-1],RC[-3]>=14,RC[-3]<15),35,IF(AND(RC[-3]<RC[-1],RC[-3]>=15,RC[-3]<16),30,IF(AND(RC[-3]<RC[-1],RC[-3]>=16,RC[-3]<17),25,IF(AND(RC[-3]<RC[-1],RC[-3]>=17,RC[-3]<18),20,IF(AND(RC[-3]<RC[-1],RC[-3]>=18,RC[-3]<19),15,IF(AND(RC[-3]<RC[-1],RC[-3]>=19,RC[-3]<20),10,IF(AND(RC[-3]<RC[-1],RC[-3]>=20,RC[-3]<21),5,IF(AND(RC[-3]<RC[-1],RC[-3]>=21),0,IF(AND(RC[-3]>RC[-1],RC[-3]>=2,RC[-3]<3),90,IF(AND(RC[-3]>RC[-1],RC[-3]>=3,RC[-3]<4),90,IF(AND(RC[-3]>RC[-1],RC[-3]>=4,RC[-3]<5),80,IF(AND(RC[-3]>RC[-1],RC[-3]>=5,RC[-3]<6),70,IF(AND(RC[-3]>RC[-1],RC[-3]>=6,RC[-3]<7),60,IF(AND(RC[-3]>RC[-1],RC[-3]>=7,RC[-3]<8),50,IF(AND(RC[-3]>RC[-1],RC[-3]>=8,RC[-3]<9),40,IF(AND(RC[-3]>RC[-1],RC[-3]>=9,RC[-3]<10),30,IF(AND(RC[-3]>RC[-1],RC[-3]>=10,RC[-3]<11),20,IF(AND(RC[-3]>RC[-1],RC[-3]>=11,RC[-3]<12),10,IF(AND(RC[-3]>RC[-1],RC[-3]>=12),0))))))))))))))))))))))))))))))))) -> 0 | H685: =IF(RC[-3]="","",IF(RC[-3]<0.3,100,IF(AND(RC[-3]>=0.3,RC[-3]>0.4),95,IF(AND(RC[-3]>=0.4,RC[-3]<0.5),90,IF(AND(RC[-3]>=0.5,RC[-3]<0.6),85,IF(AND(RC[-3]>=0.6,RC[-3]<0.7),80,IF(AND(RC[-3]>=0.6,RC[-3]<1),80,IF(AND(RC[-3]>1,RC[-3]<2),50,IF(RC[-3]>2,0))))))))) ->  | I685: =IF(RC[-1]="",RC[-2],0.7*RC[-1]+0.3*RC[-2]) -> 0
A686: بسته بندی ایران | B686: فبیرا | C686: =VLOOKUP(RC[-1],Sheet1!R3C2:R802C3,2,FALSE) -> محصولات فلزی | D686: =VLOOKUP(RC[-2],Sheet1!R3C2:R802C9,8,FALSE) -> -5.740654205607477 | E686: =IF(VLOOKUP(RC[-3],Sheet1!R3C2:R803C11,10,FALSE)=0,"",VLOOKUP(Sheet2!RC[-3],Sheet1!R[1]C[-3]:R[801]C[6],10,FALSE)) ->  | F686: =Sheet1!R748C10 -> 4.6263479498913709 | G686: =IF(RC[-3]<0,0,IF(AND(RC[-3]<RC[-1],RC[-3]<2),100,IF(AND(RC[-3]<RC[-1],RC[-3]>=2,RC[-3]<3),95,IF(AND(RC[-3]<RC[-1],RC[-3]>=3,RC[-3]<4),90,IF(AND(RC[-3]<RC[-1],RC[-3]>=4,RC[-3]<5),85,IF(AND(RC[-3]<RC[-1],RC[-3]>=5,RC[-3]<6),80,IF(AND(RC[-3]<RC[-1],RC[-3]>=6,RC[-3]<7),75,IF(AND(RC[-3]<RC[-1],RC[-3]>=7,RC[-3]<8),70,IF(AND(RC[-3]<RC[-1],RC[-3]>=8,RC[-3]<9),65,IF(AND(RC[-3]<RC[-1],RC[-3]>=9,RC[-3]<10),60,IF(AND(RC[-3]<RC[-1],RC[-3]>=10,RC[-3]<11),55,IF(AND(RC[-3]<RC[-1],RC[-3]>=11,RC[-3]<12),50,IF(AND(RC[-3]<RC[-1],RC[-3]>=12,RC[-3]<13),45,IF(AND(RC[-3]<RC[-1],RC[-3]>=13,RC[-3]<14),40,IF(AND(RC[-3]<RC[-1],RC[-3]>=14,RC[-3]<15),35,IF(AND(RC[-3]<RC[-1],RC[-3]>=15,RC[-3]<16),30,IF(AND(RC[-3]<RC[-1],RC[-3]>=16,RC[-3]<17),25,IF(AND(RC[-3]<RC[-1],RC[-3]>=17,RC[-3]<18),20,IF(AND(RC[-3]<RC[-1],RC[-3]>=18,RC[-3]<19),15,IF(AND(RC[-3]<RC[-1],RC[-3]>=19,RC[-3]<20),10,IF(AND(RC[-3]<RC[-1],RC[-3]>=20,RC[-3]<21),5,IF(AND(RC[-3]<RC[-1],RC[-3]>=21),0,IF(AND(RC[-3]>RC[-1],RC[-3]>=2,RC[-3]<3),90,IF(AND(RC[-3]>RC[-1],RC[-3]>=3,RC[-3]<4),90,IF(AND(RC[-3]>RC[-1],RC[-3]>=4,RC[-3]<5),80,IF(AND(RC[-3]>RC[-1],RC[-3]>=5,RC[-3]<6),70,IF(AND(RC[-3]>RC[-1],RC[-3]>=6,RC[-3]<7),60,IF(AND(RC[-3]>RC[-1],RC[-3]>=7,RC[-3]<8),50,IF(AND(RC[-3]>RC[-1],RC[-3]>=8,RC[-3]<9),40,IF(AND(RC[-3]>RC[-1],RC[-3]>=9,RC[-3]<10),30,IF(AND(RC[-3]>RC[-1],RC[-3]>=10,RC[-3]<11),20,IF(AND(RC[-3]>RC[-1],RC[-3]>=11,RC[-3]<12),10,IF(AND(RC[-3]>RC[-1],RC[-3]>=12),0))))))))))))))))))))))))))))))))) -> 0 | H686: =IF(RC[-3]="","",IF(RC[-3]<0.3,100,IF(AND(RC[-3]>=0.3,RC[-3]>0.4),95,IF(AND(RC[-3]>=0.4,RC[-3]<0.5),90,IF(AND(RC[-3]>=0.5,RC[-3]<0.6),85,IF(AND(RC[-3]>=0.6,RC[-3]<0.7),80,IF(AND(RC[-3]>=0.6,RC[-3]<1),80,IF(AND(RC[-3]>1,RC[-3]<2),50,IF(RC[-3]>2,0))))))))) ->  | I686: =IF(RC[-1]="",RC[-2],0.7*RC[-1]+0.3*RC[-2]) -> 0
A687: بسته بندی مشهد | B687: فبستم | C687: =VLOOKUP(RC[-1],Sheet1!R3C2:R802C3,2,FALSE) -> محصولات فلزی | D687: =VLOOKUP(RC[-2],Sheet1!R3C2:R802C9,8,FALSE) -> 62.744460393936585 | E687: =IF(VLOOKUP(RC[-3],Sheet1!R3C2:R803C11,10,FALSE)=0,"",VLOOKUP(Sheet2!RC[-3],Sheet1!R[1]C[-3]:R[801]C[6],10,FALSE)) ->  | F687: =Sheet1!R748C10 -> 4.6263479498913709 | G687: =IF(RC[-3]<0,0,IF(AND(RC[-3]<RC[-1],RC[-3]<2),100,IF(AND(RC[-3]<RC[-1],RC[-3]>=2,RC[-3]<3),95,IF(AND(RC[-3]<RC[-1],RC[-3]>=3,RC[-3]<4),90,IF(AND(RC[-3]<RC[-1],RC[-3]>=4,RC[-3]<5),85,IF(AND(RC[-3]<RC[-1],RC[-3]>=5,RC[-3]<6),80,IF(AND(RC[-3]<RC[-1],RC[-3]>=6,RC[-3]<7),75,IF(AND(RC[-3]<RC[-1],RC[-3]>=7,RC[-3]<8),70,IF(AND(RC[-3]<RC[-1],RC[-3]>=8,RC[-3]<9),65,IF(AND(RC[-3]<RC[-1],RC[-3]>=9,RC[-3]<10),60,IF(AND(RC[-3]<RC[-1],RC[-3]>=10,RC[-3]<11),55,IF(AND(RC[-3]<RC[-1],RC[-3]>=11,RC[-3]<12),50,IF(AND(RC[-3]<RC[-1],RC[-3]>=12,RC[-3]<13),45,IF(AND(RC[-3]<RC[-1],RC[-3]>=13,RC[-3]<14),40,IF(AND(RC[-3]<RC[-1],RC[-3]>=14,RC[-3]<15),35,IF(AND(RC[-3]<RC[-1],RC[-3]>=15,RC[-3]<16),30,IF(AND(RC[-3]<RC[-1],RC[-3]>=16,RC[-3]<17),25,IF(AND(RC[-3]<RC[-1],RC[-3]>=17,RC[-3]<18),20,IF(AND(RC[-3]<RC[-1],RC[-3]>=18,RC[-3]<19),15,IF(AND(RC[-3]<RC[-1],RC[-3]>=19,RC[-3]<20),10,IF(AND(RC[-3]<RC[-1],RC[-3]>=20,RC[-3]<21),5,IF(AND(RC[-3]<RC[-1],RC[-3]>=21),0,IF(AND(RC[-3]>RC[-1],RC[-3]>=2,RC[-3]<3),90,IF(AND(RC[-3]>RC[-1],RC[-3]>=3,RC[-3]<4),90,IF(AND(RC[-3]>RC[-1],RC[-3]>=4,RC[-3]<5),80,IF(AND(RC[-3]>RC[-1],RC[-3]>=5,RC[-3]<6),70,IF(AND(RC[-3]>RC[-1],RC[-3]>=6,RC[-3]<7),60,IF(AND(RC[-3]>RC[-1],RC[-3]>=7,RC[-3]<8),50,IF(AND(RC[-3]>RC[-1],RC[-3]>=8,RC[-3]<9),40,IF(AND(RC[-3]>RC[-1],RC[-3]>=9,RC[-3]<10),30,IF(AND(RC[-3]>RC[-1],RC[-3]>=10,RC[-3]<11),20,IF(AND(RC[-3]>RC[-1],RC[-3]>=11,RC[-3]<12),10,IF(AND(RC[-3]>RC[-1],RC[-3]>=12),0))))))))))))))))))))))))))))))))) -> 0 | H687: =IF(RC[-3]="","",IF(RC[-3]<0.3,100,IF(AND(RC[-3]>=0.3,RC[-3]>0.4),95,IF(AND(RC[-3]>=0.4,RC[-3]<0.5),90,IF(AND(RC[-3]>=0.5,RC[-3]<0.6),85,IF(AND(RC[-3]>=0.6,RC[-3]<0.7),80,IF(AND(RC[-3]>=0.6,RC[-3]<1),80,IF(AND(RC[-3]>1,RC[-3]<2),50,IF(RC[-3]>2,0))))))))) ->  | I687: =IF(RC[-1]="",RC[-2],0.7*RC[-1]+0.3*RC[-2]) -> 0
A688: جام دارو | B688: فجام | C688: =VLOOKUP(RC[-1],Sheet1!R3C2:R802C3,2,FALSE) -> محصولات فلزی | D688: =VLOOKUP(RC[-2],Sheet1!R3C2:R802C9,8,FALSE) -> 7.7037013802401209 | E688: =IF(VLOOKUP(RC[-3],Sheet1!R3C2:R803C11,10,FALSE)=0,"",VLOOKUP(Sheet2!RC[-3],Sheet1!R[1]C[-3]:R[801]C[6],10,FALSE)) ->  | F688: =Sheet1!R748C10 -> 4.6263479498913709 | G688: =IF(RC[-3]<0,0,IF(AND(RC[-3]<RC[-1],RC[-3]<2),100,IF(AND(RC[-3]<RC[-1],RC[-3]>=2,RC[-3]<3),95,IF(AND(RC[-3]<RC[-1],RC[-3]>=3,RC[-3]<4),90,IF(AND(RC[-3]<RC[-1],RC[-3]>=4,RC[-3]<5),85,IF(AND(RC[-3]<RC[-1],RC[-3]>=5,RC[-3]<6),80,IF(AND(RC[-3]<RC[-1],RC[-3]>=6,RC[-3]<7),75,IF(AND(RC[-3]<RC[-1],RC[-3]>=7,RC[-3]<8),70,IF(AND(RC[-3]<RC[-1],RC[-3]>=8,RC[-3]<9),65,IF(AND(RC[-3]<RC[-1],RC[-3]>=9,RC[-3]<10),60,IF(AND(RC[-3]<RC[-1],RC[-3]>=10,RC[-3]<11),55,IF(AND(RC[-3]<RC[-1],RC[-3]>=11,RC[-3]<12),50,IF(AND(RC[-3]<RC[-1],RC[-3]>=12,RC[-3]<13),45,IF(AND(RC[-3]<RC[-1],RC[-3]>=13,RC[-3]<14),40,IF(AND(RC[-3]<RC[-1],RC[-3]>=14,RC[-3]<15),35,IF(AND(RC[-3]<RC[-1],RC[-3]>=15,RC[-3]<16),30,IF(AND(RC[-3]<RC[-1],RC[-3]>=16,RC[-3]<17),25,IF(AND(RC[-3]<RC[-1],RC[-3]>=17,RC[-3]<18),20,IF(AND(RC[-3]<RC[-1],RC[-3]>=18,RC[-3]<19),15,IF(AND(RC[-3]<RC[-1],RC[-3]>=19,RC[-3]<20),10,IF(AND(RC[-3]<RC[-1],RC[-3]>=20,RC[-3]<21),5,IF(AND(RC[-3]<RC[-1],RC[-3]>=21),0,IF(AND(RC[-3]>RC[-1],RC[-3]>=2,RC[-3]<3),90,IF(AND(RC[-3]>RC[-1],RC[-3]>=3,RC[-3]<4),90,IF(AND(RC[-3]>RC[-1],RC[-3]>=4,RC[-3]<5),80,IF(AND(RC[-3]>RC[-1],RC[-3]>=5,RC[-3]<6),70,IF(AND(RC[-3]>RC[-1],RC[-3]>=6,RC[-3]<7),60,IF(AND(RC[-3]>RC[-1],RC[-3]>=7,RC[-3]<8),50,IF(AND(RC[-3]>RC[-1],RC[-3]>=8,RC[-3]<9),40,IF(AND(RC[-3]>RC[-1],RC[-3]>=9,RC[-3]<10),30,IF(AND(RC[-3]>RC[-1],RC[-3]>=10,RC[-3]<11),20,IF(AND(RC[-3]>RC[-1],RC[-3]>=11,RC[-3]<12),10,IF(AND(RC[-3]>RC[-1],RC[-3]>=12),0))))))))))))))))))))))))))))))))) -> 50 | H688: =IF(RC[-3]="","",IF(RC[-3]<0.3,100,IF(AND(RC[-3]>=0.3,RC[-3]>0.4),95,IF(AND(RC[-3]>=0.4,RC[-3]<0.5),90,IF(AND(RC[-3]>=0.5,RC[-3]<0.6),85,IF(AND(RC[-3]>=0.6,RC[-3]<0.7),80,IF(AND(RC[-3]>=0.6,RC[-3]<1),80,IF(AND(RC[-3]>1,RC[-3]<2),50,IF(RC[-3]>2,0))))))))) ->  | I688: =IF(RC[-1]="",RC[-2],0.7*RC[-1]+0.3*RC[-2]) -> 50
A689: جوش و اکسیژن | B689: فجوش | C689: =VLOOKUP(RC[-1],Sheet1!R3C2:R802C3,2,FALSE) -> محصولات فلزی | D689: =VLOOKUP(RC[-2],Sheet1!R3C2:R802C9,8,FALSE) -> -6.5187909191395291E-2 | E689: =IF(VLOOKUP(RC[-3],Sheet1!R3C2:R803C11,10,FALSE)=0,"",VLOOKUP(Sheet2!RC[-3],Sheet1!R[1]C[-3]:R[801]C[6],10,FALSE)) ->  | F689: =Sheet1!R748C10 -> 4.6263479498913709 | G689: =IF(RC[-3]<0,0,IF(AND(RC[-3]<RC[-1],RC[-3]<2),100,IF(AND(RC[-3]<RC[-1],RC[-3]>=2,RC[-3]<3),95,IF(AND(RC[-3]<RC[-1],RC[-3]>=3,RC[-3]<4),90,IF(AND(RC[-3]<RC[-1],RC[-3]>=4,RC[-3]<5),85,IF(AND(RC[-3]<RC[-1],RC[-3]>=5,RC[-3]<6),80,IF(AND(RC[-3]<RC[-1],RC[-3]>=6,RC[-3]<7),75,IF(AND(RC[-3]<RC[-1],RC[-3]>=7,RC[-3]<8),70,IF(AND(RC[-3]<RC[-1],RC[-3]>=8,RC[-3]<9),65,IF(AND(RC[-3]<RC[-1],RC[-3]>=9,RC[-3]<10),60,IF(AND(RC[-3]<RC[-1],RC[-3]>=10,RC[-3]<11),55,IF(AND(RC[-3]<RC[-1],RC[-3]>=11,RC[-3]<12),50,IF(AND(RC[-3]<RC[-1],RC[-3]>=12,RC[-3]<13),45,IF(AND(RC[-3]<RC[-1],RC[-3]>=13,RC[-3]<14),40,IF(AND(RC[-3]<RC[-1],RC[-3]>=14,RC[-3]<15),35,IF(AND(RC[-3]<RC[-1],RC[-3]>=15,RC[-3]<16),30,IF(AND(RC[-3]<RC[-1],RC[-3]>=16,RC[-3]<17),25,IF(AND(RC[-3]<RC[-1],RC[-3]>=17,RC[-3]<18),20,IF(AND(RC[-3]<RC[-1],RC[-3]>=18,RC[-3]<19),15,IF(AND(RC[-3]<RC[-1],RC[-3]>=19,RC[-3]<20),10,IF(AND(RC[-3]<RC[-1],RC[-3]>=20,RC[-3]<21),5,IF(AND(RC[-3]<RC[-1],RC[-3]>=21),0,IF(AND(RC[-3]>RC[-1],RC[-3]>=2,RC[-3]<3),90,IF(AND(RC[-3]>RC[-1],RC[-3]>=3,RC[-3]<4),90,IF(AND(RC[-3]>RC[-1],RC[-3]>=4,RC[-3]<5),80,IF(AND(RC[-3]>RC[-1],RC[-3]>=5,RC[-3]<6),70,IF(AND(RC[-3]>RC[-1],RC[-3]>=6,RC[-3]<7),60,IF(AND(RC[-3]>RC[-1],RC[-3]>=7,RC[-3]<8),50,IF(AND(RC[-3]>RC[-1],RC[-3]>=8,RC[-3]<9),40,IF(AND(RC[-3]>RC[-1],RC[-3]>=9,RC[-3]<10),30,IF(AND(RC[-3]>RC[-1],RC[-3]>=10,RC[-3]<11),20,IF(AND(RC[-3]>RC[-1],RC[-3]>=11,RC[-3]<12),10,IF(AND(RC[-3]>RC[-1],RC[-3]>=12),0))))))))))))))))))))))))))))))))) -> 0 | H689: =IF(RC[-3]="","",IF(RC[-3]<0.3,100,IF(AND(RC[-3]>=0.3,RC[-3]>0.4),95,IF(AND(RC[-3]>=0.4,RC[-3]<0.5),90,IF(AND(RC[-3]>=0.5,RC[-3]<0.6),85,IF(AND(RC[-3]>=0.6,RC[-3]<0.7),80,IF(AND(RC[-3]>=0.6,RC[-3]<1),80,IF(AND(RC[-3]>1,RC[-3]<2),50,IF(RC[-3]>2,0))))))))) ->  | I689: =IF(RC[-1]="",RC[-2],0.7*RC[-1]+0.3*RC[-2]) -> 0
A690: چدن سازان | B690: چدن | C690: =VLOOKUP(RC[-1],Sheet1!R3C2:R802C3,2,FALSE) -> محصولات فلزی | D690: =VLOOKUP(RC[-2],Sheet1!R3C2:R802C9,8,FALSE) -> 5.739551832900295 | E690: =IF(VLOOKUP(RC[-3],Sheet1!R3C2:R803C11,10,FALSE)=0,"",VLOOKUP(Sheet2!RC[-3],Sheet1!R[1]C[-3]:R[801]C[6],10,FALSE)) ->  | F690: =Sheet1!R748C10 -> 4.6263479498913709 | G690: =IF(RC[-3]<0,0,IF(AND(RC[-3]<RC[-1],RC[-3]<2),100,IF(AND(RC[-3]<RC[-1],RC[-3]>=2,RC[-3]<3),95,IF(AND(RC[-3]<RC[-1],RC[-3]>=3,RC[-3]<4),90,IF(AND(RC[-3]<RC[-1],RC[-3]>=4,RC[-3]<5),85,IF(AND(RC[-3]<RC[-1],RC[-3]>=5,RC[-3]<6),80,IF(AND(RC[-3]<RC[-1],RC[-3]>=6,RC[-3]<7),75,IF(AND(RC[-3]<RC[-1],RC[-3]>=7,RC[-3]<8),70,IF(AND(RC[-3]<RC[-1],RC[-3]>=8,RC[-3]<9),65,IF(AND(RC[-3]<RC[-1],RC[-3]>=9,RC[-3]<10),60,IF(AND(RC[-3]<RC[-1],RC[-3]>=10,RC[-3]<11),55,IF(AND(RC[-3]<RC[-1],RC[-3]>=11,RC[-3]<12),50,IF(AND(RC[-3]<RC[-1],RC[-3]>=12,RC[-3]<13),45,IF(AND(RC[-3]<RC[-1],RC[-3]>=13,RC[-3]<14),40,IF(AND(RC[-3]<RC[-1],RC[-3]>=14,RC[-3]<15),35,IF(AND(RC[-3]<RC[-1],RC[-3]>=15,RC[-3]<16),30,IF(AND(RC[-3]<RC[-1],RC[-3]>=16,RC[-3]<17),25,IF(AND(RC[-3]<RC[-1],RC[-3]>=17,RC[-3]<18),20,IF(AND(RC[-3]<RC[-1],RC[-3]>=18,RC[-3]<19),15,IF(AND(RC[-3]<RC[-1],RC[-3]>=19,RC[-3]<20),10,IF(AND(RC[-3]<RC[-1],RC[-3]>=20,RC[-3]<21),5,IF(AND(RC[-3]<RC[-1],RC[-3]>=21),0,IF(AND(RC[-3]>RC[-1],RC[-3]>=2,RC[-3]<3),90,IF(AND(RC[-3]>RC[-1],RC[-3]>=3,RC[-3]<4),90,IF(AND(RC[-3]>RC[-1],RC[-3]>=4,RC[-3]<5),80,IF(AND(RC[-3]>RC[-1],RC[-3]>=5,RC[-3]<6),70,IF(AND(RC[-3]>RC[-1],RC[-3]>=6,RC[-3]<7),60,IF(AND(RC[-3]>RC[-1],RC[-3]>=7,RC[-3]<8),50,IF(AND(RC[-3]>RC[-1],RC[-3]>=8,RC[-3]<9),40,IF(AND(RC[-3]>RC[-1],RC[-3]>=9,RC[-3]<10),30,IF(AND(RC[-3]>RC[-1],RC[-3]>=10,RC[-3]<11),20,IF(AND(RC[-3]>RC[-1],RC[-3]>=11,RC[-3]<12),10,IF(AND(RC[-3]>RC[-1],RC[-3]>=12),0))))))))))))))))))))))))))))))))) -> 70 | H690: =IF(RC[-3]="","",IF(RC[-3]<0.3,100,IF(AND(RC[-3]>=0.3,RC[-3]>0.4),95,IF(AND(RC[-3]>=0.4,RC[-3]<0.5),90,IF(AND(RC[-3]>=0.5,RC[-3]<0.6),85,IF(AND(RC[-3]>=0.6,RC[-3]<0.7),80,IF(AND(RC[-3]>=0.6,RC[-3]<1),80,IF(AND(RC[-3]>1,RC[-3]<2),50,IF(RC[-3]>2,0))))))))) ->  | I690: =IF(RC[-1]="",RC[-2],0.7*RC[-1]+0.3*RC[-2]) -> 70
A691: سولیران | B691: فسلیر | C691: =VLOOKUP(RC[-1],Sheet1!R3C2:R802C3,2,FALSE) -> محصولات فلزی | D691: =VLOOKUP(RC[-2],Sheet1!R3C2:R802C9,8,FALSE) -> -7.8648224043715853 | E691: =IF(VLOOKUP(RC[-3],Sheet1!R3C2:R803C11,10,FALSE)=0,"",VLOOKUP(Sheet2!RC[-3],Sheet1!R[1]C[-3]:R[801]C[6],10,FALSE)) ->  | F691: =Sheet1!R748C10 -> 4.6263479498913709 | G691: =IF(RC[-3]<0,0,IF(AND(RC[-3]<RC[-1],RC[-3]<2),100,IF(AND(RC[-3]<RC[-1],RC[-3]>=2,RC[-3]<3),95,IF(AND(RC[-3]<RC[-1],RC[-3]>=3,RC[-3]<4),90,IF(AND(RC[-3]<RC[-1],RC[-3]>=4,RC[-3]<5),85,IF(AND(RC[-3]<RC[-1],RC[-3]>=5,RC[-3]<6),80,IF(AND(RC[-3]<RC[-1],RC[-3]>=6,RC[-3]<7),75,IF(AND(RC[-3]<RC[-1],RC[-3]>=7,RC[-3]<8),70,IF(AND(RC[-3]<RC[-1],RC[-3]>=8,RC[-3]<9),65,IF(AND(RC[-3]<RC[-1],RC[-3]>=9,RC[-3]<10),60,IF(AND(RC[-3]<RC[-1],RC[-3]>=10,RC[-3]<11),55,IF(AND(RC[-3]<RC[-1],RC[-3]>=11,RC[-3]<12),50,IF(AND(RC[-3]<RC[-1],RC[-3]>=12,RC[-3]<13),45,IF(AND(RC[-3]<RC[-1],RC[-3]>=13,RC[-3]<14),40,IF(AND(RC[-3]<RC[-1],RC[-3]>=14,RC[-3]<15),35,IF(AND(RC[-3]<RC[-1],RC[-3]>=15,RC[-3]<16),30,IF(AND(RC[-3]<RC[-1],RC[-3]>=16,RC[-3]<17),25,IF(AND(RC[-3]<RC[-1],RC[-3]>=17,RC[-3]<18),20,IF(AND(RC[-3]<RC[-1],RC[-3]>=18,RC[-3]<19),15,IF(AND(RC[-3]<RC[-1],RC[-3]>=19,RC[-3]<20),10,IF(AND(RC[-3]<RC[-1],RC[-3]>=20,RC[-3]<21),5,IF(AND(RC[-3]<RC[-1],RC[-3]>=21),0,IF(AND(RC[-3]>RC[-1],RC[-3]>=2,RC[-3]<3),90,IF(AND(RC[-3]>RC[-1],RC[-3]>=3,RC[-3]<4),90,IF(AND(RC[-3]>RC[-1],RC[-3]>=4,RC[-3]<5),80,IF(AND(RC[-3]>RC[-1],RC[-3]>=5,RC[-3]<6),70,IF(AND(RC[-3]>RC[-1],RC[-3]>=6,RC[-3]<7),60,IF(AND(RC[-3]>RC[-1],RC[-3]>=7,RC[-3]<8),50,IF(AND(RC[-3]>RC[-1],RC[-3]>=8,RC[-3]<9),40,IF(AND(RC[-3]>RC[-1],RC[-3]>=9,RC[-3]<10),30,IF(AND(RC[-3]>RC[-1],RC[-3]>=10,RC[-3]<11),20,IF(AND(RC[-3]>RC[-1],RC[-3]>=11,RC[-3]<12),10,IF(AND(RC[-3]>RC[-1],RC[-3]>=12),0))))))))))))))))))))))))))))))))) -> 0 | H691: =IF(RC[-3]="","",IF(RC[-3]<0.3,100,IF(AND(RC[-3]>=0.3,RC[-3]>0.4),95,IF(AND(RC[-3]>=0.4,RC[-3]<0.5),90,IF(AND(RC[-3]>=0.5,RC[-3]<0.6),85,IF(AND(RC[-3]>=0.6,RC[-3]<0.7),80,IF(AND(RC[-3]>=0.6,RC[-3]<1),80,IF(AND(RC[-3]>1,RC[-3]<2),50,IF(RC[-3]>2,0))))))))) ->  | I691: =IF(RC[-1]="",RC[-2],0.7*RC[-1]+0.3*RC[-2]) -> 0
A692: گسترش قطعه سازی کمند | B692: فکمند | C692: =VLOOKUP(RC[-1],Sheet1!R3C2:R802C3,2,FALSE) -> محصولات فلزی | D692: =VLOOKUP(RC[-2],Sheet1!R3C2:R802C9,8,FALSE) -> 78.533591623005279 | E692: =IF(VLOOKUP(RC[-3],Sheet1!R3C2:R803C11,10,FALSE)=0,"",VLOOKUP(Sheet2!RC[-3],Sheet1!R[1]C[-3]:R[801]C[6],10,FALSE)) ->  | F692: =Sheet1!R748C10 -> 4.6263479498913709 | G692: =IF(RC[-3]<0,0,IF(AND(RC[-3]<RC[-1],RC[-3]<2),100,IF(AND(RC[-3]<RC[-1],RC[-3]>=2,RC[-3]<3),95,IF(AND(RC[-3]<RC[-1],RC[-3]>=3,RC[-3]<4),90,IF(AND(RC[-3]<RC[-1],RC[-3]>=4,RC[-3]<5),85,IF(AND(RC[-3]<RC[-1],RC[-3]>=5,RC[-3]<6),80,IF(AND(RC[-3]<RC[-1],RC[-3]>=6,RC[-3]<7),75,IF(AND(RC[-3]<RC[-1],RC[-3]>=7,RC[-3]<8),70,IF(AND(RC[-3]<RC[-1],RC[-3]>=8,RC[-3]<9),65,IF(AND(RC[-3]<RC[-1],RC[-3]>=9,RC[-3]<10),60,IF(AND(RC[-3]<RC[-1],RC[-3]>=10,RC[-3]<11),55,IF(AND(RC[-3]<RC[-1],RC[-3]>=11,RC[-3]<12),50,IF(AND(RC[-3]<RC[-1],RC[-3]>=12,RC[-3]<13),45,IF(AND(RC[-3]<RC[-1],RC[-3]>=13,RC[-3]<14),40,IF(AND(RC[-3]<RC[-1],RC[-3]>=14,RC[-3]<15),35,IF(AND(RC[-3]<RC[-1],RC[-3]>=15,RC[-3]<16),30,IF(AND(RC[-3]<RC[-1],RC[-3]>=16,RC[-3]<17),25,IF(AND(RC[-3]<RC[-1],RC[-3]>=17,RC[-3]<18),20,IF(AND(RC[-3]<RC[-1],RC[-3]>=18,RC[-3]<19),15,IF(AND(RC[-3]<RC[-1],RC[-3]>=19,RC[-3]<20),10,IF(AND(RC[-3]<RC[-1],RC[-3]>=20,RC[-3]<21),5,IF(AND(RC[-3]<RC[-1],RC[-3]>=21),0,IF(AND(RC[-3]>RC[-1],RC[-3]>=2,RC[-3]<3),90,IF(AND(RC[-3]>RC[-1],RC[-3]>=3,RC[-3]<4),90,IF(AND(RC[-3]>RC[-1],RC[-3]>=4,RC[-3]<5),80,IF(AND(RC[-3]>RC[-1],RC[-3]>=5,RC[-3]<6),70,IF(AND(RC[-3]>RC[-1],RC[-3]>=6,RC[-3]<7),60,IF(AND(RC[-3]>RC[-1],RC[-3]>=7,RC[-3]<8),50,IF(AND(RC[-3]>RC[-1],RC[-3]>=8,RC[-3]<9),40,IF(AND(RC[-3]>RC[-1],RC[-3]>=9,RC[-3]<10),30,IF(AND(RC[-3]>RC[-1],RC[-3]>=10,RC[-3]<11),20,IF(AND(RC[-3]>RC[-1],RC[-3]>=11,RC[-3]<12),10,IF(AND(RC[-3]>RC[-1],RC[-3]>=12),0))))))))))))))))))))))))))))))))) -> 0 | H692: =IF(RC[-3]="","",IF(RC[-3]<0.3,100,IF(AND(RC[-3]>=0.3,RC[-3]>0.4),95,IF(AND(RC[-3]>=0.4,RC[-3]<0.5),90,IF(AND(RC[-3]>=0.5,RC[-3]<0.6),85,IF(AND(RC[-3]>=0.6,RC[-3]<0.7),80,IF(AND(RC[-3]>=0.6,RC[-3]<1),80,IF(AND(RC[-3]>1,RC[-3]<2),50,IF(RC[-3]>2,0))))))))) ->  | I692: =IF(RC[-1]="",RC[-2],0.7*RC[-1]+0.3*RC[-2]) -> 0
A693: لامیران | B693: فلامی | C693: =VLOOKUP(RC[-1],Sheet1!R3C2:R802C3,2,FALSE) -> محصولات فلزی | D693: =VLOOKUP(RC[-2],Sheet1!R3C2:R802C9,8,FALSE) -> 7.7243055788698767 | E693: =IF(VLOOKUP(RC[-3],Sheet1!R3C2:R803C11,10,FALSE)=0,"",VLOOKUP(Sheet2!RC[-3],Sheet1!R[1]C[-3]:R[801]C[6],10,FALSE)) ->  | F693: =Sheet1!R748C10 -> 4.6263479498913709 | G693: =IF(RC[-3]<0,0,IF(AND(RC[-3]<RC[-1],RC[-3]<2),100,IF(AND(RC[-3]<RC[-1],RC[-3]>=2,RC[-3]<3),95,IF(AND(RC[-3]<RC[-1],RC[-3]>=3,RC[-3]<4),90,IF(AND(RC[-3]<RC[-1],RC[-3]>=4,RC[-3]<5),85,IF(AND(RC[-3]<RC[-1],RC[-3]>=5,RC[-3]<6),80,IF(AND(RC[-3]<RC[-1],RC[-3]>=6,RC[-3]<7),75,IF(AND(RC[-3]<RC[-1],RC[-3]>=7,RC[-3]<8),70,IF(AND(RC[-3]<RC[-1],RC[-3]>=8,RC[-3]<9),65,IF(AND(RC[-3]<RC[-1],RC[-3]>=9,RC[-3]<10),60,IF(AND(RC[-3]<RC[-1],RC[-3]>=10,RC[-3]<11),55,IF(AND(RC[-3]<RC[-1],RC[-3]>=11,RC[-3]<12),50,IF(AND(RC[-3]<RC[-1],RC[-3]>=12,RC[-3]<13),45,IF(AND(RC[-3]<RC[-1],RC[-3]>=13,RC[-3]<14),40,IF(AND(RC[-3]<RC[-1],RC[-3]>=14,RC[-3]<15),35,IF(AND(RC[-3]<RC[-1],RC[-3]>=15,RC[-3]<16),30,IF(AND(RC[-3]<RC[-1],RC[-3]>=16,RC[-3]<17),25,IF(AND(RC[-3]<RC[-1],RC[-3]>=17,RC[-3]<18),20,IF(AND(RC[-3]<RC[-1],RC[-3]>=18,RC[-3]<19),15,IF(AND(RC[-3]<RC[-1],RC[-3]>=19,RC[-3]<20),10,IF(AND(RC[-3]<RC[-1],RC[-3]>=20,RC[-3]<21),5,IF(AND(RC[-3]<RC[-1],RC[-3]>=21),0,IF(AND(RC[-3]>RC[-1],RC[-3]>=2,RC[-3]<3),90,IF(AND(RC[-3]>RC[-1],RC[-3]>=3,RC[-3]<4),90,IF(AND(RC[-3]>RC[-1],RC[-3]>=4,RC[-3]<5),80,IF(AND(RC[-3]>RC[-1],RC[-3]>=5,RC[-3]<6),70,IF(AND(RC[-3]>RC[-1],RC[-3]>=6,RC[-3]<7),60,IF(AND(RC[-3]>RC[-1],RC[-3]>=7,RC[-3]<8),50,IF(AND(RC[-3]>RC[-1],RC[-3]>=8,RC[-3]<9),40,IF(AND(RC[-3]>RC[-1],RC[-3]>=9,RC[-3]<10),30,IF(AND(RC[-3]>RC[-1],RC[-3]>=10,RC[-3]<11),20,IF(AND(RC[-3]>RC[-1],RC[-3]>=11,RC[-3]<12),10,IF(AND(RC[-3]>RC[-1],RC[-3]>=12),0))))))))))))))))))))))))))))))))) -> 50 | H693: =IF(RC[-3]="","",IF(RC[-3]<0.3,100,IF(AND(RC[-3]>=0.3,RC[-3]>0.4),95,IF(AND(RC[-3]>=0.4,RC[-3]<0.5),90,IF(AND(RC[-3]>=0.5,RC[-3]<0.6),85,IF(AND(RC[-3]>=0.6,RC[-3]<0.7),80,IF(AND(RC[-3]>=0.6,RC[-3]<1),80,IF(AND(RC[-3]>1,RC[-3]<2),50,IF(RC[-3]>2,0))))))))) ->  | I693: =IF(RC[-1]="",RC[-2],0.7*RC[-1]+0.3*RC[-2]) -> 50
A694: ماشین سازی اراک | B694: فاراک | C694: =VLOOKUP(RC[-1],Sheet1!R3C2:R802C3,2,FALSE) -> محصولات فلزی | D694: =VLOOKUP(RC[-2],Sheet1!R3C2:R802C9,8,FALSE) -> 11.53236215619091 | E694: =IF(VLOOKUP(RC[-3],Sheet1!R3C2:R803C11,10,FALSE)=0,"",VLOOKUP(Sheet2!RC[-3],Sheet1!R[1]C[-3]:R[801]C[6],10,FALSE)) ->  | F694: =Sheet1!R748C10 -> 4.6263479498913709 | G694: =IF(RC[-3]<0,0,IF(AND(RC[-3]<RC[-1],RC[-3]<2),100,IF(AND(RC[-3]<RC[-1],RC[-3]>=2,RC[-3]<3),95,IF(AND(RC[-3]<RC[-1],RC[-3]>=3,RC[-3]<4),90,IF(AND(RC[-3]<RC[-1],RC[-3]>=4,RC[-3]<5),85,IF(AND(RC[-3]<RC[-1],RC[-3]>=5,RC[-3]<6),80,IF(AND(RC[-3]<RC[-1],RC[-3]>=6,RC[-3]<7),75,IF(AND(RC[-3]<RC[-1],RC[-3]>=7,RC[-3]<8),70,IF(AND(RC[-3]<RC[-1],RC[-3]>=8,RC[-3]<9),65,IF(AND(RC[-3]<RC[-1],RC[-3]>=9,RC[-3]<10),60,IF(AND(RC[-3]<RC[-1],RC[-3]>=10,RC[-3]<11),55,IF(AND(RC[-3]<RC[-1],RC[-3]>=11,RC[-3]<12),50,IF(AND(RC[-3]<RC[-1],RC[-3]>=12,RC[-3]<13),45,IF(AND(RC[-3]<RC[-1],RC[-3]>=13,RC[-3]<14),40,IF(AND(RC[-3]<RC[-1],RC[-3]>=14,RC[-3]<15),35,IF(AND(RC[-3]<RC[-1],RC[-3]>=15,RC[-3]<16),30,IF(AND(RC[-3]<RC[-1],RC[-3]>=16,RC[-3]<17),25,IF(AND(RC[-3]<RC[-1],RC[-3]>=17,RC[-3]<18),20,IF(AND(RC[-3]<RC[-1],RC[-3]>=18,RC[-3]<19),15,IF(AND(RC[-3]<RC[-1],RC[-3]>=19,RC[-3]<20),10,IF(AND(RC[-3]<RC[-1],RC[-3]>=20,RC[-3]<21),5,IF(AND(RC[-3]<RC[-1],RC[-3]>=21),0,IF(AND(RC[-3]>RC[-1],RC[-3]>=2,RC[-3]<3),90,IF(AND(RC[-3]>RC[-1],RC[-3]>=3,RC[-3]<4),90,IF(AND(RC[-3]>RC[-1],RC[-3]>=4,RC[-3]<5),80,IF(AND(RC[-3]>RC[-1],RC[-3]>=5,RC[-3]<6),70,IF(AND(RC[-3]>RC[-1],RC[-3]>=6,RC[-3]<7),60,IF(AND(RC[-3]>RC[-1],RC[-3]>=7,RC[-3]<8),50,IF(AND(RC[-3]>RC[-1],RC[-3]>=8,RC[-3]<9),40,IF(AND(RC[-3]>RC[-1],RC[-3]>=9,RC[-3]<10),30,IF(AND(RC[-3]>RC[-1],RC[-3]>=10,RC[-3]<11),20,IF(AND(RC[-3]>RC[-1],RC[-3]>=11,RC[-3]<12),10,IF(AND(RC[-3]>RC[-1],RC[-3]>=12),0))))))))))))))))))))))))))))))))) -> 10 | H694: =IF(RC[-3]="","",IF(RC[-3]<0.3,100,IF(AND(RC[-3]>=0.3,RC[-3]>0.4),95,IF(AND(RC[-3]>=0.4,RC[-3]<0.5),90,IF(AND(RC[-3]>=0.5,RC[-3]<0.6),85,IF(AND(RC[-3]>=0.6,RC[-3]<0.7),80,IF(AND(RC[-3]>=0.6,RC[-3]<1),80,IF(AND(RC[-3]>1,RC[-3]<2),50,IF(RC[-3]>2,0))))))))) ->  | I694: =IF(RC[-1]="",RC[-2],0.7*RC[-1]+0.3*RC[-2]) -> 10
A695: کیا الکترود شرق | B695: کیا | C695: =VLOOKUP(RC[-1],Sheet1!R3C2:R802C3,2,FALSE) -> محصولات فلزی | D695: =VLOOKUP(RC[-2],Sheet1!R3C2:R802C9,8,FALSE) -> 35.507067408104909 | E695: =IF(VLOOKUP(RC[-3],Sheet1!R3C2:R803C11,10,FALSE)=0,"",VLOOKUP(Sheet2!RC[-3],Sheet1!R[1]C[-3]:R[801]C[6],10,FALSE)) ->  | F695: =Sheet1!R748C10 -> 4.6263479498913709 | G695: =IF(RC[-3]<0,0,IF(AND(RC[-3]<RC[-1],RC[-3]<2),100,IF(AND(RC[-3]<RC[-1],RC[-3]>=2,RC[-3]<3),95,IF(AND(RC[-3]<RC[-1],RC[-3]>=3,RC[-3]<4),90,IF(AND(RC[-3]<RC[-1],RC[-3]>=4,RC[-3]<5),85,IF(AND(RC[-3]<RC[-1],RC[-3]>=5,RC[-3]<6),80,IF(AND(RC[-3]<RC[-1],RC[-3]>=6,RC[-3]<7),75,IF(AND(RC[-3]<RC[-1],RC[-3]>=7,RC[-3]<8),70,IF(AND(RC[-3]<RC[-1],RC[-3]>=8,RC[-3]<9),65,IF(AND(RC[-3]<RC[-1],RC[-3]>=9,RC[-3]<10),60,IF(AND(RC[-3]<RC[-1],RC[-3]>=10,RC[-3]<11),55,IF(AND(RC[-3]<RC[-1],RC[-3]>=11,RC[-3]<12),50,IF(AND(RC[-3]<RC[-1],RC[-3]>=12,RC[-3]<13),45,IF(AND(RC[-3]<RC[-1],RC[-3]>=13,RC[-3]<14),40,IF(AND(RC[-3]<RC[-1],RC[-3]>=14,RC[-3]<15),35,IF(AND(RC[-3]<RC[-1],RC[-3]>=15,RC[-3]<16),30,IF(AND(RC[-3]<RC[-1],RC[-3]>=16,RC[-3]<17),25,IF(AND(RC[-3]<RC[-1],RC[-3]>=17,RC[-3]<18),20,IF(AND(RC[-3]<RC[-1],RC[-3]>=18,RC[-3]<19),15,IF(AND(RC[-3]<RC[-1],RC[-3]>=19,RC[-3]<20),10,IF(AND(RC[-3]<RC[-1],RC[-3]>=20,RC[-3]<21),5,IF(AND(RC[-3]<RC[-1],RC[-3]>=21),0,IF(AND(RC[-3]>RC[-1],RC[-3]>=2,RC[-3]<3),90,IF(AND(RC[-3]>RC[-1],RC[-3]>=3,RC[-3]<4),90,IF(AND(RC[-3]>RC[-1],RC[-3]>=4,RC[-3]<5),80,IF(AND(RC[-3]>RC[-1],RC[-3]>=5,RC[-3]<6),70,IF(AND(RC[-3]>RC[-1],RC[-3]>=6,RC[-3]<7),60,IF(AND(RC[-3]>RC[-1],RC[-3]>=7,RC[-3]<8),50,IF(AND(RC[-3]>RC[-1],RC[-3]>=8,RC[-3]<9),40,IF(AND(RC[-3]>RC[-1],RC[-3]>=9,RC[-3]<10),30,IF(AND(RC[-3]>RC[-1],RC[-3]>=10,RC[-3]<11),20,IF(AND(RC[-3]>RC[-1],RC[-3]>=11,RC[-3]<12),10,IF(AND(RC[-3]>RC[-1],RC[-3]>=12),0))))))))))))))))))))))))))))))))) -> 0 | H695: =IF(RC[-3]="","",IF(RC[-3]<0.3,100,IF(AND(RC[-3]>=0.3,RC[-3]>0.4),95,IF(AND(RC[-3]>=0.4,RC[-3]<0.5),90,IF(AND(RC[-3]>=0.5,RC[-3]<0.6),85,IF(AND(RC[-3]>=0.6,RC[-3]<0.7),80,IF(AND(RC[-3]>=0.6,RC[-3]<1),80,IF(AND(RC[-3]>1,RC[-3]<2),50,IF(RC[-3]>2,0))))))))) ->  | I695: =IF(RC[-1]="",RC[-2],0.7*RC[-1]+0.3*RC[-2]) -> 0
A696: بسته بندی پارس | B696: چبسپا | C696: =VLOOKUP(RC[-1],Sheet1!R3C2:R802C3,2,FALSE) -> محصولات کاغذی | D696: =VLOOKUP(RC[-2],Sheet1!R3C2:R802C9,8,FALSE) -> -6.3427010148321625E-2 | E696: =IF(VLOOKUP(RC[-3],Sheet1!R3C2:R803C11,10,FALSE)=0,"",VLOOKUP(Sheet2!RC[-3],Sheet1!R[1]C[-3]:R[801]C[6],10,FALSE)) ->  | F696: =Sheet1!R755C10 -> 10.102190911187936 | G696: =IF(RC[-3]<0,0,IF(AND(RC[-3]<RC[-1],RC[-3]<2),100,IF(AND(RC[-3]<RC[-1],RC[-3]>=2,RC[-3]<3),95,IF(AND(RC[-3]<RC[-1],RC[-3]>=3,RC[-3]<4),90,IF(AND(RC[-3]<RC[-1],RC[-3]>=4,RC[-3]<5),85,IF(AND(RC[-3]<RC[-1],RC[-3]>=5,RC[-3]<6),80,IF(AND(RC[-3]<RC[-1],RC[-3]>=6,RC[-3]<7),75,IF(AND(RC[-3]<RC[-1],RC[-3]>=7,RC[-3]<8),70,IF(AND(RC[-3]<RC[-1],RC[-3]>=8,RC[-3]<9),65,IF(AND(RC[-3]<RC[-1],RC[-3]>=9,RC[-3]<10),60,IF(AND(RC[-3]<RC[-1],RC[-3]>=10,RC[-3]<11),55,IF(AND(RC[-3]<RC[-1],RC[-3]>=11,RC[-3]<12),50,IF(AND(RC[-3]<RC[-1],RC[-3]>=12,RC[-3]<13),45,IF(AND(RC[-3]<RC[-1],RC[-3]>=13,RC[-3]<14),40,IF(AND(RC[-3]<RC[-1],RC[-3]>=14,RC[-3]<15),35,IF(AND(RC[-3]<RC[-1],RC[-3]>=15,RC[-3]<16),30,IF(AND(RC[-3]<RC[-1],RC[-3]>=16,RC[-3]<17),25,IF(AND(RC[-3]<RC[-1],RC[-3]>=17,RC[-3]<18),20,IF(AND(RC[-3]<RC[-1],RC[-3]>=18,RC[-3]<19),15,IF(AND(RC[-3]<RC[-1],RC[-3]>=19,RC[-3]<20),10,IF(AND(RC[-3]<RC[-1],RC[-3]>=20,RC[-3]<21),5,IF(AND(RC[-3]<RC[-1],RC[-3]>=21),0,IF(AND(RC[-3]>RC[-1],RC[-3]>=2,RC[-3]<3),90,IF(AND(RC[-3]>RC[-1],RC[-3]>=3,RC[-3]<4),90,IF(AND(RC[-3]>RC[-1],RC[-3]>=4,RC[-3]<5),80,IF(AND(RC[-3]>RC[-1],RC[-3]>=5,RC[-3]<6),70,IF(AND(RC[-3]>RC[-1],RC[-3]>=6,RC[-3]<7),60,IF(AND(RC[-3]>RC[-1],RC[-3]>=7,RC[-3]<8),50,IF(AND(RC[-3]>RC[-1],RC[-3]>=8,RC[-3]<9),40,IF(AND(RC[-3]>RC[-1],RC[-3]>=9,RC[-3]<10),30,IF(AND(RC[-3]>RC[-1],RC[-3]>=10,RC[-3]<11),20,IF(AND(RC[-3]>RC[-1],RC[-3]>=11,RC[-3]<12),10,IF(AND(RC[-3]>RC[-1],RC[-3]>=12),0))))))))))))))))))))))))))))))))) -> 0 | H696: =IF(RC[-3]="","",IF(RC[-3]<0.3,100,IF(AND(RC[-3]>=0.3,RC[-3]>0.4),95,IF(AND(RC[-3]>=0.4,RC[-3]<0.5),90,IF(AND(RC[-3]>=0.5,RC[-3]<0.6),85,IF(AND(RC[-3]>=0.6,RC[-3]<0.7),80,IF(AND(RC[-3]>=0.6,RC[-3]<1),80,IF(AND(RC[-3]>1,RC[-3]<2),50,IF(RC[-3]>2,0))))))))) ->  | I696: =IF(RC[-1]="",RC[-2],0.7*RC[-1]+0.3*RC[-2]) -> 0
A697: محصولات کاغذی لطیف | B697: لطیف | C697: =VLOOKUP(RC[-1],Sheet1!R3C2:R802C3,2,FALSE) -> محصولات کاغذی | D697: =VLOOKUP(RC[-2],Sheet1!R3C2:R802C9,8,FALSE) -> 7.3114222164603486 | E697: =IF(VLOOKUP(RC[-3],Sheet1!R3C2:R803C11,10,FALSE)=0,"",VLOOKUP(Sheet2!RC[-3],Sheet1!R[1]C[-3]:R[801]C[6],10,FALSE)) ->  | F697: =Sheet1!R755C10 -> 10.102190911187936 | G697: =IF(RC[-3]<0,0,IF(AND(RC[-3]<RC[-1],RC[-3]<2),100,IF(AND(RC[-3]<RC[-1],RC[-3]>=2,RC[-3]<3),95,IF(AND(RC[-3]<RC[-1],RC[-3]>=3,RC[-3]<4),90,IF(AND(RC[-3]<RC[-1],RC[-3]>=4,RC[-3]<5),85,IF(AND(RC[-3]<RC[-1],RC[-3]>=5,RC[-3]<6),80,IF(AND(RC[-3]<RC[-1],RC[-3]>=6,RC[-3]<7),75,IF(AND(RC[-3]<RC[-1],RC[-3]>=7,RC[-3]<8),70,IF(AND(RC[-3]<RC[-1],RC[-3]>=8,RC[-3]<9),65,IF(AND(RC[-3]<RC[-1],RC[-3]>=9,RC[-3]<10),60,IF(AND(RC[-3]<RC[-1],RC[-3]>=10,RC[-3]<11),55,IF(AND(RC[-3]<RC[-1],RC[-3]>=11,RC[-3]<12),50,IF(AND(RC[-3]<RC[-1],RC[-3]>=12,RC[-3]<13),45,IF(AND(RC[-3]<RC[-1],RC[-3]>=13,RC[-3]<14),40,IF(AND(RC[-3]<RC[-1],RC[-3]>=14,RC[-3]<15),35,IF(AND(RC[-3]<RC[-1],RC[-3]>=15,RC[-3]<16),30,IF(AND(RC[-3]<RC[-1],RC[-3]>=16,RC[-3]<17),25,IF(AND(RC[-3]<RC[-1],RC[-3]>=17,RC[-3]<18),20,IF(AND(RC[-3]<RC[-1],RC[-3]>=18,RC[-3]<19),15,IF(AND(RC[-3]<RC[-1],RC[-3]>=19,RC[-3]<20),10,IF(AND(RC[-3]<RC[-1],RC[-3]>=20,RC[-3]<21),5,IF(AND(RC[-3]<RC[-1],RC[-3]>=21),0,IF(AND(RC[-3]>RC[-1],RC[-3]>=2,RC[-3]<3),90,IF(AND(RC[-3]>RC[-1],RC[-3]>=3,RC[-3]<4),90,IF(AND(RC[-3]>RC[-1],RC[-3]>=4,RC[-3]<5),80,IF(AND(RC[-3]>RC[-1],RC[-3]>=5,RC[-3]<6),70,IF(AND(RC[-3]>RC[-1],RC[-3]>=6,RC[-3]<7),60,IF(AND(RC[-3]>RC[-1],RC[-3]>=7,RC[-3]<8),50,IF(AND(RC[-3]>RC[-1],RC[-3]>=8,RC[-3]<9),40,IF(AND(RC[-3]>RC[-1],RC[-3]>=9,RC[-3]<10),30,IF(AND(RC[-3]>RC[-1],RC[-3]>=10,RC[-3]<11),20,IF(AND(RC[-3]>RC[-1],RC[-3]>=11,RC[-3]<12),10,IF(AND(RC[-3]>RC[-1],RC[-3]>=12),0))))))))))))))))))))))))))))))))) -> 70 | H697: =IF(RC[-3]="","",IF(RC[-3]<0.3,100,IF(AND(RC[-3]>=0.3,RC[-3]>0.4),95,IF(AND(RC[-3]>=0.4,RC[-3]<0.5),90,IF(AND(RC[-3]>=0.5,RC[-3]<0.6),85,IF(AND(RC[-3]>=0.6,RC[-3]<0.7),80,IF(AND(RC[-3]>=0.6,RC[-3]<1),80,IF(AND(RC[-3]>1,RC[-3]<2),50,IF(RC[-3]>2,0))))))))) ->  | I697: =IF(RC[-1]="",RC[-2],0.7*RC[-1]+0.3*RC[-2]) -> 70
A698: کارتن ایران | B698: چکارن | C698: =VLOOKUP(RC[-1],Sheet1!R3C2:R802C3,2,FALSE) -> محصولات کاغذی | D698: =VLOOKUP(RC[-2],Sheet1!R3C2:R802C9,8,FALSE) -> 21.438782055282338 | E698: =IF(VLOOKUP(RC[-3],Sheet1!R3C2:R803C11,10,FALSE)=0,"",VLOOKUP(Sheet2!RC[-3],Sheet1!R[1]C[-3]:R[801]C[6],10,FALSE)) ->  | F698: =Sheet1!R755C10 -> 10.102190911187936 | G698: =IF(RC[-3]<0,0,IF(AND(RC[-3]<RC[-1],RC[-3]<2),100,IF(AND(RC[-3]<RC[-1],RC[-3]>=2,RC[-3]<3),95,IF(AND(RC[-3]<RC[-1],RC[-3]>=3,RC[-3]<4),90,IF(AND(RC[-3]<RC[-1],RC[-3]>=4,RC[-3]<5),85,IF(AND(RC[-3]<RC[-1],RC[-3]>=5,RC[-3]<6),80,IF(AND(RC[-3]<RC[-1],RC[-3]>=6,RC[-3]<7),75,IF(AND(RC[-3]<RC[-1],RC[-3]>=7,RC[-3]<8),70,IF(AND(RC[-3]<RC[-1],RC[-3]>=8,RC[-3]<9),65,IF(AND(RC[-3]<RC[-1],RC[-3]>=9,RC[-3]<10),60,IF(AND(RC[-3]<RC[-1],RC[-3]>=10,RC[-3]<11),55,IF(AND(RC[-3]<RC[-1],RC[-3]>=11,RC[-3]<12),50,IF(AND(RC[-3]<RC[-1],RC[-3]>=12,RC[-3]<13),45,IF(AND(RC[-3]<RC[-1],RC[-3]>=13,RC[-3]<14),40,IF(AND(RC[-3]<RC[-1],RC[-3]>=14,RC[-3]<15),35,IF(AND(RC[-3]<RC[-1],RC[-3]>=15,RC[-3]<16),30,IF(AND(RC[-3]<RC[-1],RC[-3]>=16,RC[-3]<17),25,IF(AND(RC[-3]<RC[-1],RC[-3]>=17,RC[-3]<18),20,IF(AND(RC[-3]<RC[-1],RC[-3]>=18,RC[-3]<19),15,IF(AND(RC[-3]<RC[-1],RC[-3]>=19,RC[-3]<20),10,IF(AND(RC[-3]<RC[-1],RC[-3]>=20,RC[-3]<21),5,IF(AND(RC[-3]<RC[-1],RC[-3]>=21),0,IF(AND(RC[-3]>RC[-1],RC[-3]>=2,RC[-3]<3),90,IF(AND(RC[-3]>RC[-1],RC[-3]>=3,RC[-3]<4),90,IF(AND(RC[-3]>RC[-1],RC[-3]>=4,RC[-3]<5),80,IF(AND(RC[-3]>RC[-1],RC[-3]>=5,RC[-3]<6),70,IF(AND(RC[-3]>RC[-1],RC[-3]>=6,RC[-3]<7),60,IF(AND(RC[-3]>RC[-1],RC[-3]>=7,RC[-3]<8),50,IF(AND(RC[-3]>RC[-1],RC[-3]>=8,RC[-3]<9),40,IF(AND(RC[-3]>RC[-1],RC[-3]>=9,RC[-3]<10),30,IF(AND(RC[-3]>RC[-1],RC[-3]>=10,RC[-3]<11),20,IF(AND(RC[-3]>RC[-1],RC[-3]>=11,RC[-3]<12),10,IF(AND(RC[-3]>RC[-1],RC[-3]>=12),0))))))))))))))))))))))))))))))))) -> 0 | H698: =IF(RC[-3]="","",IF(RC[-3]<0.3,100,IF(AND(RC[-3]>=0.3,RC[-3]>0.4),95,IF(AND(RC[-3]>=0.4,RC[-3]<0.5),90,IF(AND(RC[-3]>=0.5,RC[-3]<0.6),85,IF(AND(RC[-3]>=0.6,RC[-3]<0.7),80,IF(AND(RC[-3]>=0.6,RC[-3]<1),80,IF(AND(RC[-3]>1,RC[-3]<2),50,IF(RC[-3]>2,0))))))))) ->  | I698: =IF(RC[-1]="",RC[-2],0.7*RC[-1]+0.3*RC[-2]) -> 0
A699: کارتن مشهد | B699: چکارم | C699: =VLOOKUP(RC[-1],Sheet1!R3C2:R802C3,2,FALSE) -> محصولات کاغذی | D699: =VLOOKUP(RC[-2],Sheet1!R3C2:R802C9,8,FALSE) -> -0.20373007577737132 | E699: =IF(VLOOKUP(RC[-3],Sheet1!R3C2:R803C11,10,FALSE)=0,"",VLOOKUP(Sheet2!RC[-3],Sheet1!R[1]C[-3]:R[801]C[6],10,FALSE)) ->  | F699: =Sheet1!R755C10 -> 10.102190911187936 | G699: =IF(RC[-3]<0,0,IF(AND(RC[-3]<RC[-1],RC[-3]<2),100,IF(AND(RC[-3]<RC[-1],RC[-3]>=2,RC[-3]<3),95,IF(AND(RC[-3]<RC[-1],RC[-3]>=3,RC[-3]<4),90,IF(AND(RC[-3]<RC[-1],RC[-3]>=4,RC[-3]<5),85,IF(AND(RC[-3]<RC[-1],RC[-3]>=5,RC[-3]<6),80,IF(AND(RC[-3]<RC[-1],RC[-3]>=6,RC[-3]<7),75,IF(AND(RC[-3]<RC[-1],RC[-3]>=7,RC[-3]<8),70,IF(AND(RC[-3]<RC[-1],RC[-3]>=8,RC[-3]<9),65,IF(AND(RC[-3]<RC[-1],RC[-3]>=9,RC[-3]<10),60,IF(AND(RC[-3]<RC[-1],RC[-3]>=10,RC[-3]<11),55,IF(AND(RC[-3]<RC[-1],RC[-3]>=11,RC[-3]<12),50,IF(AND(RC[-3]<RC[-1],RC[-3]>=12,RC[-3]<13),45,IF(AND(RC[-3]<RC[-1],RC[-3]>=13,RC[-3]<14),40,IF(AND(RC[-3]<RC[-1],RC[-3]>=14,RC[-3]<15),35,IF(AND(RC[-3]<RC[-1],RC[-3]>=15,RC[-3]<16),30,IF(AND(RC[-3]<RC[-1],RC[-3]>=16,RC[-3]<17),25,IF(AND(RC[-3]<RC[-1],RC[-3]>=17,RC[-3]<18),20,IF(AND(RC[-3]<RC[-1],RC[-3]>=18,RC[-3]<19),15,IF(AND(RC[-3]<RC[-1],RC[-3]>=19,RC[-3]<20),10,IF(AND(RC[-3]<RC[-1],RC[-3]>=20,RC[-3]<21),5,IF(AND(RC[-3]<RC[-1],RC[-3]>=21),0,IF(AND(RC[-3]>RC[-1],RC[-3]>=2,RC[-3]<3),90,IF(AND(RC[-3]>RC[-1],RC[-3]>=3,RC[-3]<4),90,IF(AND(RC[-3]>RC[-1],RC[-3]>=4,RC[-3]<5),80,IF(AND(RC[-3]>RC[-1],RC[-3]>=5,RC[-3]<6),70,IF(AND(RC[-3]>RC[-1],RC[-3]>=6,RC[-3]<7),60,IF(AND(RC[-3]>RC[-1],RC[-3]>=7,RC[-3]<8),50,IF(AND(RC[-3]>RC[-1],RC[-3]>=8,RC[-3]<9),40,IF(AND(RC[-3]>RC[-1],RC[-3]>=9,RC[-3]<10),30,IF(AND(RC[-3]>RC[-1],RC[-3]>=10,RC[-3]<11),20,IF(AND(RC[-3]>RC[-1],RC[-3]>=11,RC[-3]<12),10,IF(AND(RC[-3]>RC[-1],RC[-3]>=12),0))))))))))))))))))))))))))))))))) -> 0 | H699: =IF(RC[-3]="","",IF(RC[-3]<0.3,100,IF(AND(RC[-3]>=0.3,RC[-3]>0.4),95,IF(AND(RC[-3]>=0.4,RC[-3]<0.5),90,IF(AND(RC[-3]>=0.5,RC[-3]<0.6),85,IF(AND(RC[-3]>=0.6,RC[-3]<0.7),80,IF(AND(RC[-3]>=0.6,RC[-3]<1),80,IF(AND(RC[-3]>1,RC[-3]<2),50,IF(RC[-3]>2,0))))))))) ->  | I699: =IF(RC[-1]="",RC[-2],0.7*RC[-1]+0.3*RC[-2]) -> 0
A700: کاغذ پارس | B700: چکاپا | C700: =VLOOKUP(RC[-1],Sheet1!R3C2:R802C3,2,FALSE) -> محصولات کاغذی | D700: =VLOOKUP(RC[-2],Sheet1!R3C2:R802C9,8,FALSE) -> 6.1332603492318034 | E700: =IF(VLOOKUP(RC[-3],Sheet1!R3C2:R803C11,10,FALSE)=0,"",VLOOKUP(Sheet2!RC[-3],Sheet1!R[1]C[-3]:R[801]C[6],10,FALSE)) ->  | F700: =Sheet1!R755C10 -> 10.102190911187936 | G700: =IF(RC[-3]<0,0,IF(AND(RC[-3]<RC[-1],RC[-3]<2),100,IF(AND(RC[-3]<RC[-1],RC[-3]>=2,RC[-3]<3),95,IF(AND(RC[-3]<RC[-1],RC[-3]>=3,RC[-3]<4),90,IF(AND(RC[-3]<RC[-1],RC[-3]>=4,RC[-3]<5),85,IF(AND(RC[-3]<RC[-1],RC[-3]>=5,RC[-3]<6),80,IF(AND(RC[-3]<RC[-1],RC[-3]>=6,RC[-3]<7),75,IF(AND(RC[-3]<RC[-1],RC[-3]>=7,RC[-3]<8),70,IF(AND(RC[-3]<RC[-1],RC[-3]>=8,RC[-3]<9),65,IF(AND(RC[-3]<RC[-1],RC[-3]>=9,RC[-3]<10),60,IF(AND(RC[-3]<RC[-1],RC[-3]>=10,RC[-3]<11),55,IF(AND(RC[-3]<RC[-1],RC[-3]>=11,RC[-3]<12),50,IF(AND(RC[-3]<RC[-1],RC[-3]>=12,RC[-3]<13),45,IF(AND(RC[-3]<RC[-1],RC[-3]>=13,RC[-3]<14),40,IF(AND(RC[-3]<RC[-1],RC[-3]>=14,RC[-3]<15),35,IF(AND(RC[-3]<RC[-1],RC[-3]>=15,RC[-3]<16),30,IF(AND(RC[-3]<RC[-1],RC[-3]>=16,RC[-3]<17),25,IF(AND(RC[-3]<RC[-1],RC[-3]>=17,RC[-3]<18),20,IF(AND(RC[-3]<RC[-1],RC[-3]>=18,RC[-3]<19),15,IF(AND(RC[-3]<RC[-1],RC[-3]>=19,RC[-3]<20),10,IF(AND(RC[-3]<RC[-1],RC[-3]>=20,RC[-3]<21),5,IF(AND(RC[-3]<RC[-1],RC[-3]>=21),0,IF(AND(RC[-3]>RC[-1],RC[-3]>=2,RC[-3]<3),90,IF(AND(RC[-3]>RC[-1],RC[-3]>=3,RC[-3]<4),90,IF(AND(RC[-3]>RC[-1],RC[-3]>=4,RC[-3]<5),80,IF(AND(RC[-3]>RC[-1],RC[-3]>=5,RC[-3]<6),70,IF(AND(RC[-3]>RC[-1],RC[-3]>=6,RC[-3]<7),60,IF(AND(RC[-3]>RC[-1],RC[-3]>=7,RC[-3]<8),50,IF(AND(RC[-3]>RC[-1],RC[-3]>=8,RC[-3]<9),40,IF(AND(RC[-3]>RC[-1],RC[-3]>=9,RC[-3]<10),30,IF(AND(RC[-3]>RC[-1],RC[-3]>=10,RC[-3]<11),20,IF(AND(RC[-3]>RC[-1],RC[-3]>=11,RC[-3]<12),10,IF(AND(RC[-3]>RC[-1],RC[-3]>=12),0))))))))))))))))))))))))))))))))) -> 75 | H700: =IF(RC[-3]="","",IF(RC[-3]<0.3,100,IF(AND(RC[-3]>=0.3,RC[-3]>0.4),95,IF(AND(RC[-3]>=0.4,RC[-3]<0.5),90,IF(AND(RC[-3]>=0.5,RC[-3]<0.6),85,IF(AND(RC[-3]>=0.6,RC[-3]<0.7),80,IF(AND(RC[-3]>=0.6,RC[-3]<1),80,IF(AND(RC[-3]>1,RC[-3]<2),50,IF(RC[-3]>2,0))))))))) ->  | I700: =IF(RC[-1]="",RC[-2],0.7*RC[-1]+0.3*RC[-2]) -> 75
A701: کاغذ سازی کاوه | B701: چکاوه | C701: =VLOOKUP(RC[-1],Sheet1!R3C2:R802C3,2,FALSE) -> محصولات کاغذی | D701: =VLOOKUP(RC[-2],Sheet1!R3C2:R802C9,8,FALSE) -> 13.133556021010278 | E701: =IF(VLOOKUP(RC[-3],Sheet1!R3C2:R803C11,10,FALSE)=0,"",VLOOKUP(Sheet2!RC[-3],Sheet1!R[1]C[-3]:R[801]C[6],10,FALSE)) ->  | F701: =Sheet1!R755C10 -> 10.102190911187936 | G701: =IF(RC[-3]<0,0,IF(AND(RC[-3]<RC[-1],RC[-3]<2),100,IF(AND(RC[-3]<RC[-1],RC[-3]>=2,RC[-3]<3),95,IF(AND(RC[-3]<RC[-1],RC[-3]>=3,RC[-3]<4),90,IF(AND(RC[-3]<RC[-1],RC[-3]>=4,RC[-3]<5),85,IF(AND(RC[-3]<RC[-1],RC[-3]>=5,RC[-3]<6),80,IF(AND(RC[-3]<RC[-1],RC[-3]>=6,RC[-3]<7),75,IF(AND(RC[-3]<RC[-1],RC[-3]>=7,RC[-3]<8),70,IF(AND(RC[-3]<RC[-1],RC[-3]>=8,RC[-3]<9),65,IF(AND(RC[-3]<RC[-1],RC[-3]>=9,RC[-3]<10),60,IF(AND(RC[-3]<RC[-1],RC[-3]>=10,RC[-3]<11),55,IF(AND(RC[-3]<RC[-1],RC[-3]>=11,RC[-3]<12),50,IF(AND(RC[-3]<RC[-1],RC[-3]>=12,RC[-3]<13),45,IF(AND(RC[-3]<RC[-1],RC[-3]>=13,RC[-3]<14),40,IF(AND(RC[-3]<RC[-1],RC[-3]>=14,RC[-3]<15),35,IF(AND(RC[-3]<RC[-1],RC[-3]>=15,RC[-3]<16),30,IF(AND(RC[-3]<RC[-1],RC[-3]>=16,RC[-3]<17),25,IF(AND(RC[-3]<RC[-1],RC[-3]>=17,RC[-3]<18),20,IF(AND(RC[-3]<RC[-1],RC[-3]>=18,RC[-3]<19),15,IF(AND(RC[-3]<RC[-1],RC[-3]>=19,RC[-3]<20),10,IF(AND(RC[-3]<RC[-1],RC[-3]>=20,RC[-3]<21),5,IF(AND(RC[-3]<RC[-1],RC[-3]>=21),0,IF(AND(RC[-3]>RC[-1],RC[-3]>=2,RC[-3]<3),90,IF(AND(RC[-3]>RC[-1],RC[-3]>=3,RC[-3]<4),90,IF(AND(RC[-3]>RC[-1],RC[-3]>=4,RC[-3]<5),80,IF(AND(RC[-3]>RC[-1],RC[-3]>=5,RC[-3]<6),70,IF(AND(RC[-3]>RC[-1],RC[-3]>=6,RC[-3]<7),60,IF(AND(RC[-3]>RC[-1],RC[-3]>=7,RC[-3]<8),50,IF(AND(RC[-3]>RC[-1],RC[-3]>=8,RC[-3]<9),40,IF(AND(RC[-3]>RC[-1],RC[-3]>=9,RC[-3]<10),30,IF(AND(RC[-3]>RC[-1],RC[-3]>=10,RC[-3]<11),20,IF(AND(RC[-3]>RC[-1],RC[-3]>=11,RC[-3]<12),10,IF(AND(RC[-3]>RC[-1],RC[-3]>=12),0))))))))))))))))))))))))))))))))) -> 0 | H701: =IF(RC[-3]="","",IF(RC[-3]<0.3,100,IF(AND(RC[-3]>=0.3,RC[-3]>0.4),95,IF(AND(RC[-3]>=0.4,RC[-3]<0.5),90,IF(AND(RC[-3]>=0.5,RC[-3]<0.6),85,IF(AND(RC[-3]>=0.6,RC[-3]<0.7),80,IF(AND(RC[-3]>=0.6,RC[-3]<1),80,IF(AND(RC[-3]>1,RC[-3]<2),50,IF(RC[-3]>2,0))))))))) ->  | I701: =IF(RC[-1]="",RC[-2],0.7*RC[-1]+0.3*RC[-2]) -> 0
A702: صنایع مادیران | B702: مادیرا | C702: =VLOOKUP(RC[-1],Sheet1!R3C2:R802C3,2,FALSE) -> محصولات کامپیوتری الکترونیکی و نوری | D702: =VLOOKUP(RC[-2],Sheet1!R3C2:R802C9,8,FALSE) -> 12.4525737232 | E702: =IF(VLOOKUP(RC[-3],Sheet1!R3C2:R803C11,10,FALSE)=0,"",VLOOKUP(Sheet2!RC[-3],Sheet1!R[1]C[-3]:R[801]C[6],10,FALSE)) ->  | F702: =Sheet1!R[54]C[3] -> 12.4525737232 | G702: =IF(RC[-3]<0,0,IF(AND(RC[-3]<RC[-1],RC[-3]<2),100,IF(AND(RC[-3]<RC[-1],RC[-3]>=2,RC[-3]<3),95,IF(AND(RC[-3]<RC[-1],RC[-3]>=3,RC[-3]<4),90,IF(AND(RC[-3]<RC[-1],RC[-3]>=4,RC[-3]<5),85,IF(AND(RC[-3]<RC[-1],RC[-3]>=5,RC[-3]<6),80,IF(AND(RC[-3]<RC[-1],RC[-3]>=6,RC[-3]<7),75,IF(AND(RC[-3]<RC[-1],RC[-3]>=7,RC[-3]<8),70,IF(AND(RC[-3]<RC[-1],RC[-3]>=8,RC[-3]<9),65,IF(AND(RC[-3]<RC[-1],RC[-3]>=9,RC[-3]<10),60,IF(AND(RC[-3]<RC[-1],RC[-3]>=10,RC[-3]<11),55,IF(AND(RC[-3]<RC[-1],RC[-3]>=11,RC[-3]<12),50,IF(AND(RC[-3]<RC[-1],RC[-3]>=12,RC[-3]<13),45,IF(AND(RC[-3]<RC[-1],RC[-3]>=13,RC[-3]<14),40,IF(AND(RC[-3]<RC[-1],RC[-3]>=14,RC[-3]<15),35,IF(AND(RC[-3]<RC[-1],RC[-3]>=15,RC[-3]<16),30,IF(AND(RC[-3]<RC[-1],RC[-3]>=16,RC[-3]<17),25,IF(AND(RC[-3]<RC[-1],RC[-3]>=17,RC[-3]<18),20,IF(AND(RC[-3]<RC[-1],RC[-3]>=18,RC[-3]<19),15,IF(AND(RC[-3]<RC[-1],RC[-3]>=19,RC[-3]<20),10,IF(AND(RC[-3]<RC[-1],RC[-3]>=20,RC[-3]<21),5,IF(AND(RC[-3]<RC[-1],RC[-3]>=21),0,IF(AND(RC[-3]>RC[-1],RC[-3]>=2,RC[-3]<3),90,IF(AND(RC[-3]>RC[-1],RC[-3]>=3,RC[-3]<4),90,IF(AND(RC[-3]>RC[-1],RC[-3]>=4,RC[-3]<5),80,IF(AND(RC[-3]>RC[-1],RC[-3]>=5,RC[-3]<6),70,IF(AND(RC[-3]>RC[-1],RC[-3]>=6,RC[-3]<7),60,IF(AND(RC[-3]>RC[-1],RC[-3]>=7,RC[-3]<8),50,IF(AND(RC[-3]>RC[-1],RC[-3]>=8,RC[-3]<9),40,IF(AND(RC[-3]>RC[-1],RC[-3]>=9,RC[-3]<10),30,IF(AND(RC[-3]>RC[-1],RC[-3]>=10,RC[-3]<11),20,IF(AND(RC[-3]>RC[-1],RC[-3]>=11,RC[-3]<12),10,IF(AND(RC[-3]>RC[-1],RC[-3]>=12),0))))))))))))))))))))))))))))))))) -> 0 | H702: =IF(RC[-3]="","",IF(RC[-3]<0.3,100,IF(AND(RC[-3]>=0.3,RC[-3]>0.4),95,IF(AND(RC[-3]>=0.4,RC[-3]<0.5),90,IF(AND(RC[-3]>=0.5,RC[-3]<0.6),85,IF(AND(RC[-3]>=0.6,RC[-3]<0.7),80,IF(AND(RC[-3]>=0.6,RC[-3]<1),80,IF(AND(RC[-3]>1,RC[-3]<2),50,IF(RC[-3]>2,0))))))))) ->  | I702: =IF(RC[-1]="",RC[-2],0.7*RC[-1]+0.3*RC[-2]) -> 0
A703: ارتباطات سیار | B703: همراه | C703: =VLOOKUP(RC[-1],Sheet1!R3C2:R802C3,2,FALSE) -> مخابرات | D703: =VLOOKUP(RC[-2],Sheet1!R3C2:R802C9,8,FALSE) -> 4.4317698888375867 | E703: =IF(VLOOKUP(RC[-3],Sheet1!R3C2:R803C11,10,FALSE)=0,"",VLOOKUP(Sheet2!RC[-3],Sheet1!R[1]C[-3]:R[801]C[6],10,FALSE)) ->  | G703: =IF(RC[-3]<0,0,IF(AND(RC[-3]<RC[-1],RC[-3]<2),100,IF(AND(RC[-3]<RC[-1],RC[-3]>=2,RC[-3]<3),95,IF(AND(RC[-3]<RC[-1],RC[-3]>=3,RC[-3]<4),90,IF(AND(RC[-3]<RC[-1],RC[-3]>=4,RC[-3]<5),85,IF(AND(RC[-3]<RC[-1],RC[-3]>=5,RC[-3]<6),80,IF(AND(RC[-3]<RC[-1],RC[-3]>=6,RC[-3]<7),75,IF(AND(RC[-3]<RC[-1],RC[-3]>=7,RC[-3]<8),70,IF(AND(RC[-3]<RC[-1],RC[-3]>=8,RC[-3]<9),65,IF(AND(RC[-3]<RC[-1],RC[-3]>=9,RC[-3]<10),60,IF(AND(RC[-3]<RC[-1],RC[-3]>=10,RC[-3]<11),55,IF(AND(RC[-3]<RC[-1],RC[-3]>=11,RC[-3]<12),50,IF(AND(RC[-3]<RC[-1],RC[-3]>=12,RC[-3]<13),45,IF(AND(RC[-3]<RC[-1],RC[-3]>=13,RC[-3]<14),40,IF(AND(RC[-3]<RC[-1],RC[-3]>=14,RC[-3]<15),35,IF(AND(RC[-3]<RC[-1],RC[-3]>=15,RC[-3]<16),30,IF(AND(RC[-3]<RC[-1],RC[-3]>=16,RC[-3]<17),25,IF(AND(RC[-3]<RC[-1],RC[-3]>=17,RC[-3]<18),20,IF(AND(RC[-3]<RC[-1],RC[-3]>=18,RC[-3]<19),15,IF(AND(RC[-3]<RC[-1],RC[-3]>=19,RC[-3]<20),10,IF(AND(RC[-3]<RC[-1],RC[-3]>=20,RC[-3]<21),5,IF(AND(RC[-3]<RC[-1],RC[-3]>=21),0,IF(AND(RC[-3]>RC[-1],RC[-3]>=2,RC[-3]<3),90,IF(AND(RC[-3]>RC[-1],RC[-3]>=3,RC[-3]<4),90,IF(AND(RC[-3]>RC[-1],RC[-3]>=4,RC[-3]<5),80,IF(AND(RC[-3]>RC[-1],RC[-3]>=5,RC[-3]<6),70,IF(AND(RC[-3]>RC[-1],RC[-3]>=6,RC[-3]<7),60,IF(AND(RC[-3]>RC[-1],RC[-3]>=7,RC[-3]<8),50,IF(AND(RC[-3]>RC[-1],RC[-3]>=8,RC[-3]<9),40,IF(AND(RC[-3]>RC[-1],RC[-3]>=9,RC[-3]<10),30,IF(AND(RC[-3]>RC[-1],RC[-3]>=10,RC[-3]<11),20,IF(AND(RC[-3]>RC[-1],RC[-3]>=11,RC[-3]<12),10,IF(AND(RC[-3]>RC[-1],RC[-3]>=12),0))))))))))))))))))))))))))))))))) -> 80 | H703: =IF(RC[-3]="","",IF(RC[-3]<0.3,100,IF(AND(RC[-3]>=0.3,RC[-3]>0.4),95,IF(AND(RC[-3]>=0.4,RC[-3]<0.5),90,IF(AND(RC[-3]>=0.5,RC[-3]<0.6),85,IF(AND(RC[-3]>=0.6,RC[-3]<0.7),80,IF(AND(RC[-3]>=0.6,RC[-3]<1),80,IF(AND(RC[-3]>1,RC[-3]<2),50,IF(RC[-3]>2,0))))))))) ->  | I703: =IF(RC[-1]="",RC[-2],0.7*RC[-1]+0.3*RC[-2]) -> 80
A704: مخابرات ایران | B704: اخابر | C704: =VLOOKUP(RC[-1],Sheet1!R3C2:R802C3,2,FALSE) -> مخابرات | D704: =VLOOKUP(RC[-2],Sheet1!R3C2:R802C9,8,FALSE) -> 369.41666666666669 | E704: =IF(VLOOKUP(RC[-3],Sheet1!R3C2:R803C11,10,FALSE)=0,"",VLOOKUP(Sheet2!RC[-3],Sheet1!R[1]C[-3]:R[801]C[6],10,FALSE)) ->  | G704: =IF(RC[-3]<0,0,IF(AND(RC[-3]<RC[-1],RC[-3]<2),100,IF(AND(RC[-3]<RC[-1],RC[-3]>=2,RC[-3]<3),95,IF(AND(RC[-3]<RC[-1],RC[-3]>=3,RC[-3]<4),90,IF(AND(RC[-3]<RC[-1],RC[-3]>=4,RC[-3]<5),85,IF(AND(RC[-3]<RC[-1],RC[-3]>=5,RC[-3]<6),80,IF(AND(RC[-3]<RC[-1],RC[-3]>=6,RC[-3]<7),75,IF(AND(RC[-3]<RC[-1],RC[-3]>=7,RC[-3]<8),70,IF(AND(RC[-3]<RC[-1],RC[-3]>=8,RC[-3]<9),65,IF(AND(RC[-3]<RC[-1],RC[-3]>=9,RC[-3]<10),60,IF(AND(RC[-3]<RC[-1],RC[-3]>=10,RC[-3]<11),55,IF(AND(RC[-3]<RC[-1],RC[-3]>=11,RC[-3]<12),50,IF(AND(RC[-3]<RC[-1],RC[-3]>=12,RC[-3]<13),45,IF(AND(RC[-3]<RC[-1],RC[-3]>=13,RC[-3]<14),40,IF(AND(RC[-3]<RC[-1],RC[-3]>=14,RC[-3]<15),35,IF(AND(RC[-3]<RC[-1],RC[-3]>=15,RC[-3]<16),30,IF(AND(RC[-3]<RC[-1],RC[-3]>=16,RC[-3]<17),25,IF(AND(RC[-3]<RC[-1],RC[-3]>=17,RC[-3]<18),20,IF(AND(RC[-3]<RC[-1],RC[-3]>=18,RC[-3]<19),15,IF(AND(RC[-3]<RC[-1],RC[-3]>=19,RC[-3]<20),10,IF(AND(RC[-3]<RC[-1],RC[-3]>=20,RC[-3]<21),5,IF(AND(RC[-3]<RC[-1],RC[-3]>=21),0,IF(AND(RC[-3]>RC[-1],RC[-3]>=2,RC[-3]<3),90,IF(AND(RC[-3]>RC[-1],RC[-3]>=3,RC[-3]<4),90,IF(AND(RC[-3]>RC[-1],RC[-3]>=4,RC[-3]<5),80,IF(AND(RC[-3]>RC[-1],RC[-3]>=5,RC[-3]<6),70,IF(AND(RC[-3]>RC[-1],RC[-3]>=6,RC[-3]<7),60,IF(AND(RC[-3]>RC[-1],RC[-3]>=7,RC[-3]<8),50,IF(AND(RC[-3]>RC[-1],RC[-3]>=8,RC[-3]<9),40,IF(AND(RC[-3]>RC[-1],RC[-3]>=9,RC[-3]<10),30,IF(AND(RC[-3]>RC[-1],RC[-3]>=10,RC[-3]<11),20,IF(AND(RC[-3]>RC[-1],RC[-3]>=11,RC[-3]<12),10,IF(AND(RC[-3]>RC[-1],RC[-3]>=12),0))))))))))))))))))))))))))))))))) -> 0 | H704: =IF(RC[-3]="","",IF(RC[-3]<0.3,100,IF(AND(RC[-3]>=0.3,RC[-3]>0.4),95,IF(AND(RC[-3]>=0.4,RC[-3]<0.5),90,IF(AND(RC[-3]>=0.5,RC[-3]<0.6),85,IF(AND(RC[-3]>=0.6,RC[-3]<0.7),80,IF(AND(RC[-3]>=0.6,RC[-3]<1),80,IF(AND(RC[-3]>1,RC[-3]<2),50,IF(RC[-3]>2,0))))))))) ->  | I704: =IF(RC[-1]="",RC[-2],0.7*RC[-1]+0.3*RC[-2]) -> 0
A705: ایران مرینوس | B705: نمرینو | C705: =VLOOKUP(RC[-1],Sheet1!R3C2:R802C3,2,FALSE) -> منسوجات | D705: =VLOOKUP(RC[-2],Sheet1!R3C2:R802C9,8,FALSE) -> 842.12580746136859 | E705: =IF(VLOOKUP(RC[-3],Sheet1!R3C2:R803C11,10,FALSE)=0,"",VLOOKUP(Sheet2!RC[-3],Sheet1!R[1]C[-3]:R[801]C[6],10,FALSE)) ->  | F705: =Sheet1!R766C10 -> 471.40083895934987 | G705: =IF(RC[-3]<0,0,IF(AND(RC[-3]<RC[-1],RC[-3]<2),100,IF(AND(RC[-3]<RC[-1],RC[-3]>=2,RC[-3]<3),95,IF(AND(RC[-3]<RC[-1],RC[-3]>=3,RC[-3]<4),90,IF(AND(RC[-3]<RC[-1],RC[-3]>=4,RC[-3]<5),85,IF(AND(RC[-3]<RC[-1],RC[-3]>=5,RC[-3]<6),80,IF(AND(RC[-3]<RC[-1],RC[-3]>=6,RC[-3]<7),75,IF(AND(RC[-3]<RC[-1],RC[-3]>=7,RC[-3]<8),70,IF(AND(RC[-3]<RC[-1],RC[-3]>=8,RC[-3]<9),65,IF(AND(RC[-3]<RC[-1],RC[-3]>=9,RC[-3]<10),60,IF(AND(RC[-3]<RC[-1],RC[-3]>=10,RC[-3]<11),55,IF(AND(RC[-3]<RC[-1],RC[-3]>=11,RC[-3]<12),50,IF(AND(RC[-3]<RC[-1],RC[-3]>=12,RC[-3]<13),45,IF(AND(RC[-3]<RC[-1],RC[-3]>=13,RC[-3]<14),40,IF(AND(RC[-3]<RC[-1],RC[-3]>=14,RC[-3]<15),35,IF(AND(RC[-3]<RC[-1],RC[-3]>=15,RC[-3]<16),30,IF(AND(RC[-3]<RC[-1],RC[-3]>=16,RC[-3]<17),25,IF(AND(RC[-3]<RC[-1],RC[-3]>=17,RC[-3]<18),20,IF(AND(RC[-3]<RC[-1],RC[-3]>=18,RC[-3]<19),15,IF(AND(RC[-3]<RC[-1],RC[-3]>=19,RC[-3]<20),10,IF(AND(RC[-3]<RC[-1],RC[-3]>=20,RC[-3]<21),5,IF(AND(RC[-3]<RC[-1],RC[-3]>=21),0,IF(AND(RC[-3]>RC[-1],RC[-3]>=2,RC[-3]<3),90,IF(AND(RC[-3]>RC[-1],RC[-3]>=3,RC[-3]<4),90,IF(AND(RC[-3]>RC[-1],RC[-3]>=4,RC[-3]<5),80,IF(AND(RC[-3]>RC[-1],RC[-3]>=5,RC[-3]<6),70,IF(AND(RC[-3]>RC[-1],RC[-3]>=6,RC[-3]<7),60,IF(AND(RC[-3]>RC[-1],RC[-3]>=7,RC[-3]<8),50,IF(AND(RC[-3]>RC[-1],RC[-3]>=8,RC[-3]<9),40,IF(AND(RC[-3]>RC[-1],RC[-3]>=9,RC[-3]<10),30,IF(AND(RC[-3]>RC[-1],RC[-3]>=10,RC[-3]<11),20,IF(AND(RC[-3]>RC[-1],RC[-3]>=11,RC[-3]<12),10,IF(AND(RC[-3]>RC[-1],RC[-3]>=12),0))))))))))))))))))))))))))))))))) -> 0 | H705: =IF(RC[-3]="","",IF(RC[-3]<0.3,100,IF(AND(RC[-3]>=0.3,RC[-3]>0.4),95,IF(AND(RC[-3]>=0.4,RC[-3]<0.5),90,IF(AND(RC[-3]>=0.5,RC[-3]<0.6),85,IF(AND(RC[-3]>=0.6,RC[-3]<0.7),80,IF(AND(RC[-3]>=0.6,RC[-3]<1),80,IF(AND(RC[-3]>1,RC[-3]<2),50,IF(RC[-3]>2,0))))))))) ->  | I705: =IF(RC[-1]="",RC[-2],0.7*RC[-1]+0.3*RC[-2]) -> 0
A706: پشم بافی توس | B706: نتوس | C706: =VLOOKUP(RC[-1],Sheet1!R3C2:R802C3,2,FALSE) -> منسوجات | D706: =VLOOKUP(RC[-2],Sheet1!R3C2:R802C9,8,FALSE) -> 97.436366802386203 | E706: =IF(VLOOKUP(RC[-3],Sheet1!R3C2:R803C11,10,FALSE)=0,"",VLOOKUP(Sheet2!RC[-3],Sheet1!R[1]C[-3]:R[801]C[6],10,FALSE)) ->  | F706: =Sheet1!R766C10 -> 471.40083895934987 | G706: =IF(RC[-3]<0,0,IF(AND(RC[-3]<RC[-1],RC[-3]<2),100,IF(AND(RC[-3]<RC[-1],RC[-3]>=2,RC[-3]<3),95,IF(AND(RC[-3]<RC[-1],RC[-3]>=3,RC[-3]<4),90,IF(AND(RC[-3]<RC[-1],RC[-3]>=4,RC[-3]<5),85,IF(AND(RC[-3]<RC[-1],RC[-3]>=5,RC[-3]<6),80,IF(AND(RC[-3]<RC[-1],RC[-3]>=6,RC[-3]<7),75,IF(AND(RC[-3]<RC[-1],RC[-3]>=7,RC[-3]<8),70,IF(AND(RC[-3]<RC[-1],RC[-3]>=8,RC[-3]<9),65,IF(AND(RC[-3]<RC[-1],RC[-3]>=9,RC[-3]<10),60,IF(AND(RC[-3]<RC[-1],RC[-3]>=10,RC[-3]<11),55,IF(AND(RC[-3]<RC[-1],RC[-3]>=11,RC[-3]<12),50,IF(AND(RC[-3]<RC[-1],RC[-3]>=12,RC[-3]<13),45,IF(AND(RC[-3]<RC[-1],RC[-3]>=13,RC[-3]<14),40,IF(AND(RC[-3]<RC[-1],RC[-3]>=14,RC[-3]<15),35,IF(AND(RC[-3]<RC[-1],RC[-3]>=15,RC[-3]<16),30,IF(AND(RC[-3]<RC[-1],RC[-3]>=16,RC[-3]<17),25,IF(AND(RC[-3]<RC[-1],RC[-3]>=17,RC[-3]<18),20,IF(AND(RC[-3]<RC[-1],RC[-3]>=18,RC[-3]<19),15,IF(AND(RC[-3]<RC[-1],RC[-3]>=19,RC[-3]<20),10,IF(AND(RC[-3]<RC[-1],RC[-3]>=20,RC[-3]<21),5,IF(AND(RC[-3]<RC[-1],RC[-3]>=21),0,IF(AND(RC[-3]>RC[-1],RC[-3]>=2,RC[-3]<3),90,IF(AND(RC[-3]>RC[-1],RC[-3]>=3,RC[-3]<4),90,IF(AND(RC[-3]>RC[-1],RC[-3]>=4,RC[-3]<5),80,IF(AND(RC[-3]>RC[-1],RC[-3]>=5,RC[-3]<6),70,IF(AND(RC[-3]>RC[-1],RC[-3]>=6,RC[-3]<7),60,IF(AND(RC[-3]>RC[-1],RC[-3]>=7,RC[-3]<8),50,IF(AND(RC[-3]>RC[-1],RC[-3]>=8,RC[-3]<9),40,IF(AND(RC[-3]>RC[-1],RC[-3]>=9,RC[-3]<10),30,IF(AND(RC[-3]>RC[-1],RC[-3]>=10,RC[-3]<11),20,IF(AND(RC[-3]>RC[-1],RC[-3]>=11,RC[-3]<12),10,IF(AND(RC[-3]>RC[-1],RC[-3]>=12),0))))))))))))))))))))))))))))))))) -> 0 | H706: =IF(RC[-3]="","",IF(RC[-3]<0.3,100,IF(AND(RC[-3]>=0.3,RC[-3]>0.4),95,IF(AND(RC[-3]>=0.4,RC[-3]<0.5),90,IF(AND(RC[-3]>=0.5,RC[-3]<0.6),85,IF(AND(RC[-3]>=0.6,RC[-3]<0.7),80,IF(AND(RC[-3]>=0.6,RC[-3]<1),80,IF(AND(RC[-3]>1,RC[-3]<2),50,IF(RC[-3]>2,0))))))))) ->  | I706: =IF(RC[-1]="",RC[-2],0.7*RC[-1]+0.3*RC[-2]) -> 0
A707: عطرین نخ قم | B707: نطرین | C707: =VLOOKUP(RC[-1],Sheet1!R3C2:R802C3,2,FALSE) -> منسوجات | D707: =VLOOKUP(RC[-2],Sheet1!R3C2:R802C9,8,FALSE) -> 12.112829050128793 | E707: =IF(VLOOKUP(RC[-3],Sheet1!R3C2:R803C11,10,FALSE)=0,"",VLOOKUP(Sheet2!RC[-3],Sheet1!R[1]C[-3]:R[801]C[6],10,FALSE)) ->  | F707: =Sheet1!R766C10 -> 471.40083895934987 | G707: =IF(RC[-3]<0,0,IF(AND(RC[-3]<RC[-1],RC[-3]<2),100,IF(AND(RC[-3]<RC[-1],RC[-3]>=2,RC[-3]<3),95,IF(AND(RC[-3]<RC[-1],RC[-3]>=3,RC[-3]<4),90,IF(AND(RC[-3]<RC[-1],RC[-3]>=4,RC[-3]<5),85,IF(AND(RC[-3]<RC[-1],RC[-3]>=5,RC[-3]<6),80,IF(AND(RC[-3]<RC[-1],RC[-3]>=6,RC[-3]<7),75,IF(AND(RC[-3]<RC[-1],RC[-3]>=7,RC[-3]<8),70,IF(AND(RC[-3]<RC[-1],RC[-3]>=8,RC[-3]<9),65,IF(AND(RC[-3]<RC[-1],RC[-3]>=9,RC[-3]<10),60,IF(AND(RC[-3]<RC[-1],RC[-3]>=10,RC[-3]<11),55,IF(AND(RC[-3]<RC[-1],RC[-3]>=11,RC[-3]<12),50,IF(AND(RC[-3]<RC[-1],RC[-3]>=12,RC[-3]<13),45,IF(AND(RC[-3]<RC[-1],RC[-3]>=13,RC[-3]<14),40,IF(AND(RC[-3]<RC[-1],RC[-3]>=14,RC[-3]<15),35,IF(AND(RC[-3]<RC[-1],RC[-3]>=15,RC[-3]<16),30,IF(AND(RC[-3]<RC[-1],RC[-3]>=16,RC[-3]<17),25,IF(AND(RC[-3]<RC[-1],RC[-3]>=17,RC[-3]<18),20,IF(AND(RC[-3]<RC[-1],RC[-3]>=18,RC[-3]<19),15,IF(AND(RC[-3]<RC[-1],RC[-3]>=19,RC[-3]<20),10,IF(AND(RC[-3]<RC[-1],RC[-3]>=20,RC[-3]<21),5,IF(AND(RC[-3]<RC[-1],RC[-3]>=21),0,IF(AND(RC[-3]>RC[-1],RC[-3]>=2,RC[-3]<3),90,IF(AND(RC[-3]>RC[-1],RC[-3]>=3,RC[-3]<4),90,IF(AND(RC[-3]>RC[-1],RC[-3]>=4,RC[-3]<5),80,IF(AND(RC[-3]>RC[-1],RC[-3]>=5,RC[-3]<6),70,IF(AND(RC[-3]>RC[-1],RC[-3]>=6,RC[-3]<7),60,IF(AND(RC[-3]>RC[-1],RC[-3]>=7,RC[-3]<8),50,IF(AND(RC[-3]>RC[-1],RC[-3]>=8,RC[-3]<9),40,IF(AND(RC[-3]>RC[-1],RC[-3]>=9,RC[-3]<10),30,IF(AND(RC[-3]>RC[-1],RC[-3]>=10,RC[-3]<11),20,IF(AND(RC[-3]>RC[-1],RC[-3]>=11,RC[-3]<12),10,IF(AND(RC[-3]>RC[-1],RC[-3]>=12),0))))))))))))))))))))))))))))))))) -> 45 | H707: =IF(RC[-3]="","",IF(RC[-3]<0.3,100,IF(AND(RC[-3]>=0.3,RC[-3]>0.4),95,IF(AND(RC[-3]>=0.4,RC[-3]<0.5),90,IF(AND(RC[-3]>=0.5,RC[-3]<0.6),85,IF(AND(RC[-3]>=0.6,RC[-3]<0.7),80,IF(AND(RC[-3]>=0.6,RC[-3]<1),80,IF(AND(RC[-3]>1,RC[-3]<2),50,IF(RC[-3]>2,0))))))))) ->  | I707: =IF(RC[-1]="",RC[-2],0.7*RC[-1]+0.3*RC[-2]) -> 45
A708: نساجی بروجرد | B708: نبروج | C708: =VLOOKUP(RC[-1],Sheet1!R3C2:R802C3,2,FALSE) -> منسوجات | D708: =VLOOKUP(RC[-2],Sheet1!R3C2:R802C9,8,FALSE) -> 6.9597101542754771 | E708: =IF(VLOOKUP(RC[-3],Sheet1!R3C2:R803C11,10,FALSE)=0,"",VLOOKUP(Sheet2!RC[-3],Sheet1!R[1]C[-3]:R[801]C[6],10,FALSE)) ->  | F708: =Sheet1!R766C10 -> 471.40083895934987 | G708: =IF(RC[-3]<0,0,IF(AND(RC[-3]<RC[-1],RC[-3]<2),100,IF(AND(RC[-3]<RC[-1],RC[-3]>=2,RC[-3]<3),95,IF(AND(RC[-3]<RC[-1],RC[-3]>=3,RC[-3]<4),90,IF(AND(RC[-3]<RC[-1],RC[-3]>=4,RC[-3]<5),85,IF(AND(RC[-3]<RC[-1],RC[-3]>=5,RC[-3]<6),80,IF(AND(RC[-3]<RC[-1],RC[-3]>=6,RC[-3]<7),75,IF(AND(RC[-3]<RC[-1],RC[-3]>=7,RC[-3]<8),70,IF(AND(RC[-3]<RC[-1],RC[-3]>=8,RC[-3]<9),65,IF(AND(RC[-3]<RC[-1],RC[-3]>=9,RC[-3]<10),60,IF(AND(RC[-3]<RC[-1],RC[-3]>=10,RC[-3]<11),55,IF(AND(RC[-3]<RC[-1],RC[-3]>=11,RC[-3]<12),50,IF(AND(RC[-3]<RC[-1],RC[-3]>=12,RC[-3]<13),45,IF(AND(RC[-3]<RC[-1],RC[-3]>=13,RC[-3]<14),40,IF(AND(RC[-3]<RC[-1],RC[-3]>=14,RC[-3]<15),35,IF(AND(RC[-3]<RC[-1],RC[-3]>=15,RC[-3]<16),30,IF(AND(RC[-3]<RC[-1],RC[-3]>=16,RC[-3]<17),25,IF(AND(RC[-3]<RC[-1],RC[-3]>=17,RC[-3]<18),20,IF(AND(RC[-3]<RC[-1],RC[-3]>=18,RC[-3]<19),15,IF(AND(RC[-3]<RC[-1],RC[-3]>=19,RC[-3]<20),10,IF(AND(RC[-3]<RC[-1],RC[-3]>=20,RC[-3]<21),5,IF(AND(RC[-3]<RC[-1],RC[-3]>=21),0,IF(AND(RC[-3]>RC[-1],RC[-3]>=2,RC[-3]<3),90,IF(AND(RC[-3]>RC[-1],RC[-3]>=3,RC[-3]<4),90,IF(AND(RC[-3]>RC[-1],RC[-3]>=4,RC[-3]<5),80,IF(AND(RC[-3]>RC[-1],RC[-3]>=5,RC[-3]<6),70,IF(AND(RC[-3]>RC[-1],RC[-3]>=6,RC[-3]<7),60,IF(AND(RC[-3]>RC[-1],RC[-3]>=7,RC[-3]<8),50,IF(AND(RC[-3]>RC[-1],RC[-3]>=8,RC[-3]<9),40,IF(AND(RC[-3]>RC[-1],RC[-3]>=9,RC[-3]<10),30,IF(AND(RC[-3]>RC[-1],RC[-3]>=10,RC[-3]<11),20,IF(AND(RC[-3]>RC[-1],RC[-3]>=11,RC[-3]<12),10,IF(AND(RC[-3]>RC[-1],RC[-3]>=12),0))))))))))))))))))))))))))))))))) -> 75 | H708: =IF(RC[-3]="","",IF(RC[-3]<0.3,100,IF(AND(RC[-3]>=0.3,RC[-3]>0.4),95,IF(AND(RC[-3]>=0.4,RC[-3]<0.5),90,IF(AND(RC[-3]>=0.5,RC[-3]<0.6),85,IF(AND(RC[-3]>=0.6,RC[-3]<0.7),80,IF(AND(RC[-3]>=0.6,RC[-3]<1),80,IF(AND(RC[-3]>1,RC[-3]<2),50,IF(RC[-3]>2,0))))))))) ->  | I708: =IF(RC[-1]="",RC[-2],0.7*RC[-1]+0.3*RC[-2]) -> 75
A709: نساجی قائمشهر | B709: نساجی قائمشهر | C709: =VLOOKUP(RC[-1],Sheet1!R3C2:R802C3,2,FALSE) -> منسوجات | D709: =VLOOKUP(RC[-2],Sheet1!R3C2:R802C9,8,FALSE) -> -0.39331210191082805 | E709: =IF(VLOOKUP(RC[-3],Sheet1!R3C2:R803C11,10,FALSE)=0,"",VLOOKUP(Sheet2!RC[-3],Sheet1!R[1]C[-3]:R[801]C[6],10,FALSE)) ->  | F709: =Sheet1!R766C10 -> 471.40083895934987 | G709: =IF(RC[-3]<0,0,IF(AND(RC[-3]<RC[-1],RC[-3]<2),100,IF(AND(RC[-3]<RC[-1],RC[-3]>=2,RC[-3]<3),95,IF(AND(RC[-3]<RC[-1],RC[-3]>=3,RC[-3]<4),90,IF(AND(RC[-3]<RC[-1],RC[-3]>=4,RC[-3]<5),85,IF(AND(RC[-3]<RC[-1],RC[-3]>=5,RC[-3]<6),80,IF(AND(RC[-3]<RC[-1],RC[-3]>=6,RC[-3]<7),75,IF(AND(RC[-3]<RC[-1],RC[-3]>=7,RC[-3]<8),70,IF(AND(RC[-3]<RC[-1],RC[-3]>=8,RC[-3]<9),65,IF(AND(RC[-3]<RC[-1],RC[-3]>=9,RC[-3]<10),60,IF(AND(RC[-3]<RC[-1],RC[-3]>=10,RC[-3]<11),55,IF(AND(RC[-3]<RC[-1],RC[-3]>=11,RC[-3]<12),50,IF(AND(RC[-3]<RC[-1],RC[-3]>=12,RC[-3]<13),45,IF(AND(RC[-3]<RC[-1],RC[-3]>=13,RC[-3]<14),40,IF(AND(RC[-3]<RC[-1],RC[-3]>=14,RC[-3]<15),35,IF(AND(RC[-3]<RC[-1],RC[-3]>=15,RC[-3]<16),30,IF(AND(RC[-3]<RC[-1],RC[-3]>=16,RC[-3]<17),25,IF(AND(RC[-3]<RC[-1],RC[-3]>=17,RC[-3]<18),20,IF(AND(RC[-3]<RC[-1],RC[-3]>=18,RC[-3]<19),15,IF(AND(RC[-3]<RC[-1],RC[-3]>=19,RC[-3]<20),10,IF(AND(RC[-3]<RC[-1],RC[-3]>=20,RC[-3]<21),5,IF(AND(RC[-3]<RC[-1],RC[-3]>=21),0,IF(AND(RC[-3]>RC[-1],RC[-3]>=2,RC[-3]<3),90,IF(AND(RC[-3]>RC[-1],RC[-3]>=3,RC[-3]<4),90,IF(AND(RC[-3]>RC[-1],RC[-3]>=4,RC[-3]<5),80,IF(AND(RC[-3]>RC[-1],RC[-3]>=5,RC[-3]<6),70,IF(AND(RC[-3]>RC[-1],RC[-3]>=6,RC[-3]<7),60,IF(AND(RC[-3]>RC[-1],RC[-3]>=7,RC[-3]<8),50,IF(AND(RC[-3]>RC[-1],RC[-3]>=8,RC[-3]<9),40,IF(AND(RC[-3]>RC[-1],RC[-3]>=9,RC[-3]<10),30,IF(AND(RC[-3]>RC[-1],RC[-3]>=10,RC[-3]<11),20,IF(AND(RC[-3]>RC[-1],RC[-3]>=11,RC[-3]<12),10,IF(AND(RC[-3]>RC[-1],RC[-3]>=12),0))))))))))))))))))))))))))))))))) -> 0 | H709: =IF(RC[-3]="","",IF(RC[-3]<0.3,100,IF(AND(RC[-3]>=0.3,RC[-3]>0.4),95,IF(AND(RC[-3]>=0.4,RC[-3]<0.5),90,IF(AND(RC[-3]>=0.5,RC[-3]<0.6),85,IF(AND(RC[-3]>=0.6,RC[-3]<0.7),80,IF(AND(RC[-3]>=0.6,RC[-3]<1),80,IF(AND(RC[-3]>1,RC[-3]<2),50,IF(RC[-3]>2,0))))))))) ->  | I709: =IF(RC[-1]="",RC[-2],0.7*RC[-1]+0.3*RC[-2]) -> 0
A710: آبادگران ایران کیش | B710: گکیش | C710: =VLOOKUP(RC[-1],Sheet1!R3C2:R802C3,2,FALSE) -> هتل و رستوران | D710: =VLOOKUP(RC[-2],Sheet1!R3C2:R802C9,8,FALSE) -> 47.046566957707647 | E710: =IF(VLOOKUP(RC[-3],Sheet1!R3C2:R803C11,10,FALSE)=0,"",VLOOKUP(Sheet2!RC[-3],Sheet1!R[1]C[-3]:R[801]C[6],10,FALSE)) ->  | F710: =Sheet1!R775C10 -> 34.015880314842121 | G710: =IF(RC[-3]<0,0,IF(AND(RC[-3]<RC[-1],RC[-3]<2),100,IF(AND(RC[-3]<RC[-1],RC[-3]>=2,RC[-3]<3),95,IF(AND(RC[-3]<RC[-1],RC[-3]>=3,RC[-3]<4),90,IF(AND(RC[-3]<RC[-1],RC[-3]>=4,RC[-3]<5),85,IF(AND(RC[-3]<RC[-1],RC[-3]>=5,RC[-3]<6),80,IF(AND(RC[-3]<RC[-1],RC[-3]>=6,RC[-3]<7),75,IF(AND(RC[-3]<RC[-1],RC[-3]>=7,RC[-3]<8),70,IF(AND(RC[-3]<RC[-1],RC[-3]>=8,RC[-3]<9),65,IF(AND(RC[-3]<RC[-1],RC[-3]>=9,RC[-3]<10),60,IF(AND(RC[-3]<RC[-1],RC[-3]>=10,RC[-3]<11),55,IF(AND(RC[-3]<RC[-1],RC[-3]>=11,RC[-3]<12),50,IF(AND(RC[-3]<RC[-1],RC[-3]>=12,RC[-3]<13),45,IF(AND(RC[-3]<RC[-1],RC[-3]>=13,RC[-3]<14),40,IF(AND(RC[-3]<RC[-1],RC[-3]>=14,RC[-3]<15),35,IF(AND(RC[-3]<RC[-1],RC[-3]>=15,RC[-3]<16),30,IF(AND(RC[-3]<RC[-1],RC[-3]>=16,RC[-3]<17),25,IF(AND(RC[-3]<RC[-1],RC[-3]>=17,RC[-3]<18),20,IF(AND(RC[-3]<RC[-1],RC[-3]>=18,RC[-3]<19),15,IF(AND(RC[-3]<RC[-1],RC[-3]>=19,RC[-3]<20),10,IF(AND(RC[-3]<RC[-1],RC[-3]>=20,RC[-3]<21),5,IF(AND(RC[-3]<RC[-1],RC[-3]>=21),0,IF(AND(RC[-3]>RC[-1],RC[-3]>=2,RC[-3]<3),90,IF(AND(RC[-3]>RC[-1],RC[-3]>=3,RC[-3]<4),90,IF(AND(RC[-3]>RC[-1],RC[-3]>=4,RC[-3]<5),80,IF(AND(RC[-3]>RC[-1],RC[-3]>=5,RC[-3]<6),70,IF(AND(RC[-3]>RC[-1],RC[-3]>=6,RC[-3]<7),60,IF(AND(RC[-3]>RC[-1],RC[-3]>=7,RC[-3]<8),50,IF(AND(RC[-3]>RC[-1],RC[-3]>=8,RC[-3]<9),40,IF(AND(RC[-3]>RC[-1],RC[-3]>=9,RC[-3]<10),30,IF(AND(RC[-3]>RC[-1],RC[-3]>=10,RC[-3]<11),20,IF(AND(RC[-3]>RC[-1],RC[-3]>=11,RC[-3]<12),10,IF(AND(RC[-3]>RC[-1],RC[-3]>=12),0))))))))))))))))))))))))))))))))) -> 0 | H710: =IF(RC[-3]="","",IF(RC[-3]<0.3,100,IF(AND(RC[-3]>=0.3,RC[-3]>0.4),95,IF(AND(RC[-3]>=0.4,RC[-3]<0.5),90,IF(AND(RC[-3]>=0.5,RC[-3]<0.6),85,IF(AND(RC[-3]>=0.6,RC[-3]<0.7),80,IF(AND(RC[-3]>=0.6,RC[-3]<1),80,IF(AND(RC[-3]>1,RC[-3]<2),50,IF(RC[-3]>2,0))))))))) ->  | I710: =IF(RC[-1]="",RC[-2],0.7*RC[-1]+0.3*RC[-2]) -> 0
A711: اقتصادی نگین گردشگری ایرانیان | B711: گنگین | C711: =VLOOKUP(RC[-1],Sheet1!R3C2:R802C3,2,FALSE) -> هتل و رستوران | D711: =VLOOKUP(RC[-2],Sheet1!R3C2:R802C9,8,FALSE) -> 6.374461407467849 | E711: =IF(VLOOKUP(RC[-3],Sheet1!R3C2:R803C11,10,FALSE)=0,"",VLOOKUP(Sheet2!RC[-3],Sheet1!R[1]C[-3]:R[801]C[6],10,FALSE)) ->  | F711: =Sheet1!R775C10 -> 34.015880314842121 | G711: =IF(RC[-3]<0,0,IF(AND(RC[-3]<RC[-1],RC[-3]<2),100,IF(AND(RC[-3]<RC[-1],RC[-3]>=2,RC[-3]<3),95,IF(AND(RC[-3]<RC[-1],RC[-3]>=3,RC[-3]<4),90,IF(AND(RC[-3]<RC[-1],RC[-3]>=4,RC[-3]<5),85,IF(AND(RC[-3]<RC[-1],RC[-3]>=5,RC[-3]<6),80,IF(AND(RC[-3]<RC[-1],RC[-3]>=6,RC[-3]<7),75,IF(AND(RC[-3]<RC[-1],RC[-3]>=7,RC[-3]<8),70,IF(AND(RC[-3]<RC[-1],RC[-3]>=8,RC[-3]<9),65,IF(AND(RC[-3]<RC[-1],RC[-3]>=9,RC[-3]<10),60,IF(AND(RC[-3]<RC[-1],RC[-3]>=10,RC[-3]<11),55,IF(AND(RC[-3]<RC[-1],RC[-3]>=11,RC[-3]<12),50,IF(AND(RC[-3]<RC[-1],RC[-3]>=12,RC[-3]<13),45,IF(AND(RC[-3]<RC[-1],RC[-3]>=13,RC[-3]<14),40,IF(AND(RC[-3]<RC[-1],RC[-3]>=14,RC[-3]<15),35,IF(AND(RC[-3]<RC[-1],RC[-3]>=15,RC[-3]<16),30,IF(AND(RC[-3]<RC[-1],RC[-3]>=16,RC[-3]<17),25,IF(AND(RC[-3]<RC[-1],RC[-3]>=17,RC[-3]<18),20,IF(AND(RC[-3]<RC[-1],RC[-3]>=18,RC[-3]<19),15,IF(AND(RC[-3]<RC[-1],RC[-3]>=19,RC[-3]<20),10,IF(AND(RC[-3]<RC[-1],RC[-3]>=20,RC[-3]<21),5,IF(AND(RC[-3]<RC[-1],RC[-3]>=21),0,IF(AND(RC[-3]>RC[-1],RC[-3]>=2,RC[-3]<3),90,IF(AND(RC[-3]>RC[-1],RC[-3]>=3,RC[-3]<4),90,IF(AND(RC[-3]>RC[-1],RC[-3]>=4,RC[-3]<5),80,IF(AND(RC[-3]>RC[-1],RC[-3]>=5,RC[-3]<6),70,IF(AND(RC[-3]>RC[-1],RC[-3]>=6,RC[-3]<7),60,IF(AND(RC[-3]>RC[-1],RC[-3]>=7,RC[-3]<8),50,IF(AND(RC[-3]>RC[-1],RC[-3]>=8,RC[-3]<9),40,IF(AND(RC[-3]>RC[-1],RC[-3]>=9,RC[-3]<10),30,IF(AND(RC[-3]>RC[-1],RC[-3]>=10,RC[-3]<11),20,IF(AND(RC[-3]>RC[-1],RC[-3]>=11,RC[-3]<12),10,IF(AND(RC[-3]>RC[-1],RC[-3]>=12),0))))))))))))))))))))))))))))))))) -> 75 | H711: =IF(RC[-3]="","",IF(RC[-3]<0.3,100,IF(AND(RC[-3]>=0.3,RC[-3]>0.4),95,IF(AND(RC[-3]>=0.4,RC[-3]<0.5),90,IF(AND(RC[-3]>=0.5,RC[-3]<0.6),85,IF(AND(RC[-3]>=0.6,RC[-3]<0.7),80,IF(AND(RC[-3]>=0.6,RC[-3]<1),80,IF(AND(RC[-3]>1,RC[-3]<2),50,IF(RC[-3]>2,0))))))))) ->  | I711: =IF(RC[-1]="",RC[-2],0.7*RC[-1]+0.3*RC[-2]) -> 75
A712: توریستی و رفاهی آبادگران ایران | B712: آباد | C712: =VLOOKUP(RC[-1],Sheet1!R3C2:R802C3,2,FALSE) -> هتل و رستوران | D712: =VLOOKUP(RC[-2],Sheet1!R3C2:R802C9,8,FALSE) -> 817.32955641272963 | E712: =IF(VLOOKUP(RC[-3],Sheet1!R3C2:R803C11,10,FALSE)=0,"",VLOOKUP(Sheet2!RC[-3],Sheet1!R[1]C[-3]:R[801]C[6],10,FALSE)) ->  | F712: =Sheet1!R775C10 -> 34.015880314842121 | G712: =IF(RC[-3]<0,0,IF(AND(RC[-3]<RC[-1],RC[-3]<2),100,IF(AND(RC[-3]<RC[-1],RC[-3]>=2,RC[-3]<3),95,IF(AND(RC[-3]<RC[-1],RC[-3]>=3,RC[-3]<4),90,IF(AND(RC[-3]<RC[-1],RC[-3]>=4,RC[-3]<5),85,IF(AND(RC[-3]<RC[-1],RC[-3]>=5,RC[-3]<6),80,IF(AND(RC[-3]<RC[-1],RC[-3]>=6,RC[-3]<7),75,IF(AND(RC[-3]<RC[-1],RC[-3]>=7,RC[-3]<8),70,IF(AND(RC[-3]<RC[-1],RC[-3]>=8,RC[-3]<9),65,IF(AND(RC[-3]<RC[-1],RC[-3]>=9,RC[-3]<10),60,IF(AND(RC[-3]<RC[-1],RC[-3]>=10,RC[-3]<11),55,IF(AND(RC[-3]<RC[-1],RC[-3]>=11,RC[-3]<12),50,IF(AND(RC[-3]<RC[-1],RC[-3]>=12,RC[-3]<13),45,IF(AND(RC[-3]<RC[-1],RC[-3]>=13,RC[-3]<14),40,IF(AND(RC[-3]<RC[-1],RC[-3]>=14,RC[-3]<15),35,IF(AND(RC[-3]<RC[-1],RC[-3]>=15,RC[-3]<16),30,IF(AND(RC[-3]<RC[-1],RC[-3]>=16,RC[-3]<17),25,IF(AND(RC[-3]<RC[-1],RC[-3]>=17,RC[-3]<18),20,IF(AND(RC[-3]<RC[-1],RC[-3]>=18,RC[-3]<19),15,IF(AND(RC[-3]<RC[-1],RC[-3]>=19,RC[-3]<20),10,IF(AND(RC[-3]<RC[-1],RC[-3]>=20,RC[-3]<21),5,IF(AND(RC[-3]<RC[-1],RC[-3]>=21),0,IF(AND(RC[-3]>RC[-1],RC[-3]>=2,RC[-3]<3),90,IF(AND(RC[-3]>RC[-1],RC[-3]>=3,RC[-3]<4),90,IF(AND(RC[-3]>RC[-1],RC[-3]>=4,RC[-3]<5),80,IF(AND(RC[-3]>RC[-1],RC[-3]>=5,RC[-3]<6),70,IF(AND(RC[-3]>RC[-1],RC[-3]>=6,RC[-3]<7),60,IF(AND(RC[-3]>RC[-1],RC[-3]>=7,RC[-3]<8),50,IF(AND(RC[-3]>RC[-1],RC[-3]>=8,RC[-3]<9),40,IF(AND(RC[-3]>RC[-1],RC[-3]>=9,RC[-3]<10),30,IF(AND(RC[-3]>RC[-1],RC[-3]>=10,RC[-3]<11),20,IF(AND(RC[-3]>RC[-1],RC[-3]>=11,RC[-3]<12),10,IF(AND(RC[-3]>RC[-1],RC[-3]>=12),0))))))))))))))))))))))))))))))))) -> 0 | H712: =IF(RC[-3]="","",IF(RC[-3]<0.3,100,IF(AND(RC[-3]>=0.3,RC[-3]>0.4),95,IF(AND(RC[-3]>=0.4,RC[-3]<0.5),90,IF(AND(RC[-3]>=0.5,RC[-3]<0.6),85,IF(AND(RC[-3]>=0.6,RC[-3]<0.7),80,IF(AND(RC[-3]>=0.6,RC[-3]<1),80,IF(AND(RC[-3]>1,RC[-3]<2),50,IF(RC[-3]>2,0))))))))) ->  | I712: =IF(RC[-1]="",RC[-2],0.7*RC[-1]+0.3*RC[-2]) -> 0
A713: توسعه بین الملی پدیده شاندیز | B713: گشان | C713: =VLOOKUP(RC[-1],Sheet1!R3C2:R802C3,2,FALSE) -> هتل و رستوران | D713: =VLOOKUP(RC[-2],Sheet1!R3C2:R802C9,8,FALSE) -> 17.55263991677991 | E713: =IF(VLOOKUP(RC[-3],Sheet1!R3C2:R803C11,10,FALSE)=0,"",VLOOKUP(Sheet2!RC[-3],Sheet1!R[1]C[-3]:R[801]C[6],10,FALSE)) ->  | F713: =Sheet1!R775C10 -> 34.015880314842121 | G713: =IF(RC[-3]<0,0,IF(AND(RC[-3]<RC[-1],RC[-3]<2),100,IF(AND(RC[-3]<RC[-1],RC[-3]>=2,RC[-3]<3),95,IF(AND(RC[-3]<RC[-1],RC[-3]>=3,RC[-3]<4),90,IF(AND(RC[-3]<RC[-1],RC[-3]>=4,RC[-3]<5),85,IF(AND(RC[-3]<RC[-1],RC[-3]>=5,RC[-3]<6),80,IF(AND(RC[-3]<RC[-1],RC[-3]>=6,RC[-3]<7),75,IF(AND(RC[-3]<RC[-1],RC[-3]>=7,RC[-3]<8),70,IF(AND(RC[-3]<RC[-1],RC[-3]>=8,RC[-3]<9),65,IF(AND(RC[-3]<RC[-1],RC[-3]>=9,RC[-3]<10),60,IF(AND(RC[-3]<RC[-1],RC[-3]>=10,RC[-3]<11),55,IF(AND(RC[-3]<RC[-1],RC[-3]>=11,RC[-3]<12),50,IF(AND(RC[-3]<RC[-1],RC[-3]>=12,RC[-3]<13),45,IF(AND(RC[-3]<RC[-1],RC[-3]>=13,RC[-3]<14),40,IF(AND(RC[-3]<RC[-1],RC[-3]>=14,RC[-3]<15),35,IF(AND(RC[-3]<RC[-1],RC[-3]>=15,RC[-3]<16),30,IF(AND(RC[-3]<RC[-1],RC[-3]>=16,RC[-3]<17),25,IF(AND(RC[-3]<RC[-1],RC[-3]>=17,RC[-3]<18),20,IF(AND(RC[-3]<RC[-1],RC[-3]>=18,RC[-3]<19),15,IF(AND(RC[-3]<RC[-1],RC[-3]>=19,RC[-3]<20),10,IF(AND(RC[-3]<RC[-1],RC[-3]>=20,RC[-3]<21),5,IF(AND(RC[-3]<RC[-1],RC[-3]>=21),0,IF(AND(RC[-3]>RC[-1],RC[-3]>=2,RC[-3]<3),90,IF(AND(RC[-3]>RC[-1],RC[-3]>=3,RC[-3]<4),90,IF(AND(RC[-3]>RC[-1],RC[-3]>=4,RC[-3]<5),80,IF(AND(RC[-3]>RC[-1],RC[-3]>=5,RC[-3]<6),70,IF(AND(RC[-3]>RC[-1],RC[-3]>=6,RC[-3]<7),60,IF(AND(RC[-3]>RC[-1],RC[-3]>=7,RC[-3]<8),50,IF(AND(RC[-3]>RC[-1],RC[-3]>=8,RC[-3]<9),40,IF(AND(RC[-3]>RC[-1],RC[-3]>=9,RC[-3]<10),30,IF(AND(RC[-3]>RC[-1],RC[-3]>=10,RC[-3]<11),20,IF(AND(RC[-3]>RC[-1],RC[-3]>=11,RC[-3]<12),10,IF(AND(RC[-3]>RC[-1],RC[-3]>=12),0))))))))))))))))))))))))))))))))) -> 20 | H713: =IF(RC[-3]="","",IF(RC[-3]<0.3,100,IF(AND(RC[-3]>=0.3,RC[-3]>0.4),95,IF(AND(RC[-3]>=0.4,RC[-3]<0.5),90,IF(AND(RC[-3]>=0.5,RC[-3]<0.6),85,IF(AND(RC[-3]>=0.6,RC[-3]<0.7),80,IF(AND(RC[-3]>=0.6,RC[-3]<1),80,IF(AND(RC[-3]>1,RC[-3]<2),50,IF(RC[-3]>2,0))))))))) ->  | I713: =IF(RC[-1]="",RC[-2],0.7*RC[-1]+0.3*RC[-2]) -> 20
A714: دنا آفرین فدک | B714: گدنا | C714: =VLOOKUP(RC[-1],Sheet1!R3C2:R802C3,2,FALSE) -> هتل و رستوران | D714: =VLOOKUP(RC[-2],Sheet1!R3C2:R802C9,8,FALSE) -> 15.258329658258068 | E714: =IF(VLOOKUP(RC[-3],Sheet1!R3C2:R803C11,10,FALSE)=0,"",VLOOKUP(Sheet2!RC[-3],Sheet1!R[1]C[-3]:R[801]C[6],10,FALSE)) ->  | F714: =Sheet1!R775C10 -> 34.015880314842121 | G714: =IF(RC[-3]<0,0,IF(AND(RC[-3]<RC[-1],RC[-3]<2),100,IF(AND(RC[-3]<RC[-1],RC[-3]>=2,RC[-3]<3),95,IF(AND(RC[-3]<RC[-1],RC[-3]>=3,RC[-3]<4),90,IF(AND(RC[-3]<RC[-1],RC[-3]>=4,RC[-3]<5),85,IF(AND(RC[-3]<RC[-1],RC[-3]>=5,RC[-3]<6),80,IF(AND(RC[-3]<RC[-1],RC[-3]>=6,RC[-3]<7),75,IF(AND(RC[-3]<RC[-1],RC[-3]>=7,RC[-3]<8),70,IF(AND(RC[-3]<RC[-1],RC[-3]>=8,RC[-3]<9),65,IF(AND(RC[-3]<RC[-1],RC[-3]>=9,RC[-3]<10),60,IF(AND(RC[-3]<RC[-1],RC[-3]>=10,RC[-3]<11),55,IF(AND(RC[-3]<RC[-1],RC[-3]>=11,RC[-3]<12),50,IF(AND(RC[-3]<RC[-1],RC[-3]>=12,RC[-3]<13),45,IF(AND(RC[-3]<RC[-1],RC[-3]>=13,RC[-3]<14),40,IF(AND(RC[-3]<RC[-1],RC[-3]>=14,RC[-3]<15),35,IF(AND(RC[-3]<RC[-1],RC[-3]>=15,RC[-3]<16),30,IF(AND(RC[-3]<RC[-1],RC[-3]>=16,RC[-3]<17),25,IF(AND(RC[-3]<RC[-1],RC[-3]>=17,RC[-3]<18),20,IF(AND(RC[-3]<RC[-1],RC[-3]>=18,RC[-3]<19),15,IF(AND(RC[-3]<RC[-1],RC[-3]>=19,RC[-3]<20),10,IF(AND(RC[-3]<RC[-1],RC[-3]>=20,RC[-3]<21),5,IF(AND(RC[-3]<RC[-1],RC[-3]>=21),0,IF(AND(RC[-3]>RC[-1],RC[-3]>=2,RC[-3]<3),90,IF(AND(RC[-3]>RC[-1],RC[-3]>=3,RC[-3]<4),90,IF(AND(RC[-3]>RC[-1],RC[-3]>=4,RC[-3]<5),80,IF(AND(RC[-3]>RC[-1],RC[-3]>=5,RC[-3]<6),70,IF(AND(RC[-3]>RC[-1],RC[-3]>=6,RC[-3]<7),60,IF(AND(RC[-3]>RC[-1],RC[-3]>=7,RC[-3]<8),50,IF(AND(RC[-3]>RC[-1],RC[-3]>=8,RC[-3]<9),40,IF(AND(RC[-3]>RC[-1],RC[-3]>=9,RC[-3]<10),30,IF(AND(RC[-3]>RC[-1],RC[-3]>=10,RC[-3]<11),20,IF(AND(RC[-3]>RC[-1],RC[-3]>=11,RC[-3]<12),10,IF(AND(RC[-3]>RC[-1],RC[-3]>=12),0))))))))))))))))))))))))))))))))) -> 30 | H714: =IF(RC[-3]="","",IF(RC[-3]<0.3,100,IF(AND(RC[-3]>=0.3,RC[-3]>0.4),95,IF(AND(RC[-3]>=0.4,RC[-3]<0.5),90,IF(AND(RC[-3]>=0.5,RC[-3]<0.6),85,IF(AND(RC[-3]>=0.6,RC[-3]<0.7),80,IF(AND(RC[-3]>=0.6,RC[-3]<1),80,IF(AND(RC[-3]>1,RC[-3]<2),50,IF(RC[-3]>2,0))))))))) ->  | I714: =IF(RC[-1]="",RC[-2],0.7*RC[-1]+0.3*RC[-2]) -> 30
A715: سر. میراث فرهنگی و گردشگری | B715: سمگا | C715: =VLOOKUP(RC[-1],Sheet1!R3C2:R802C3,2,FALSE) -> هتل و رستوران | D715: =VLOOKUP(RC[-2],Sheet1!R3C2:R802C9,8,FALSE) -> 3.4293428301834079 | E715: =IF(VLOOKUP(RC[-3],Sheet1!R3C2:R803C11,10,FALSE)=0,"",VLOOKUP(Sheet2!RC[-3],Sheet1!R[1]C[-3]:R[801]C[6],10,FALSE)) -> 0.65 | F715: =Sheet1!R775C10 -> 34.015880314842121 | G715: =IF(RC[-3]<0,0,IF(AND(RC[-3]<RC[-1],RC[-3]<2),100,IF(AND(RC[-3]<RC[-1],RC[-3]>=2,RC[-3]<3),95,IF(AND(RC[-3]<RC[-1],RC[-3]>=3,RC[-3]<4),90,IF(AND(RC[-3]<RC[-1],RC[-3]>=4,RC[-3]<5),85,IF(AND(RC[-3]<RC[-1],RC[-3]>=5,RC[-3]<6),80,IF(AND(RC[-3]<RC[-1],RC[-3]>=6,RC[-3]<7),75,IF(AND(RC[-3]<RC[-1],RC[-3]>=7,RC[-3]<8),70,IF(AND(RC[-3]<RC[-1],RC[-3]>=8,RC[-3]<9),65,IF(AND(RC[-3]<RC[-1],RC[-3]>=9,RC[-3]<10),60,IF(AND(RC[-3]<RC[-1],RC[-3]>=10,RC[-3]<11),55,IF(AND(RC[-3]<RC[-1],RC[-3]>=11,RC[-3]<12),50,IF(AND(RC[-3]<RC[-1],RC[-3]>=12,RC[-3]<13),45,IF(AND(RC[-3]<RC[-1],RC[-3]>=13,RC[-3]<14),40,IF(AND(RC[-3]<RC[-1],RC[-3]>=14,RC[-3]<15),35,IF(AND(RC[-3]<RC[-1],RC[-3]>=15,RC[-3]<16),30,IF(AND(RC[-3]<RC[-1],RC[-3]>=16,RC[-3]<17),25,IF(AND(RC[-3]<RC[-1],RC[-3]>=17,RC[-3]<18),20,IF(AND(RC[-3]<RC[-1],RC[-3]>=18,RC[-3]<19),15,IF(AND(RC[-3]<RC[-1],RC[-3]>=19,RC[-3]<20),10,IF(AND(RC[-3]<RC[-1],RC[-3]>=20,RC[-3]<21),5,IF(AND(RC[-3]<RC[-1],RC[-3]>=21),0,IF(AND(RC[-3]>RC[-1],RC[-3]>=2,RC[-3]<3),90,IF(AND(RC[-3]>RC[-1],RC[-3]>=3,RC[-3]<4),90,IF(AND(RC[-3]>RC[-1],RC[-3]>=4,RC[-3]<5),80,IF(AND(RC[-3]>RC[-1],RC[-3]>=5,RC[-3]<6),70,IF(AND(RC[-3]>RC[-1],RC[-3]>=6,RC[-3]<7),60,IF(AND(RC[-3]>RC[-1],RC[-3]>=7,RC[-3]<8),50,IF(AND(RC[-3]>RC[-1],RC[-3]>=8,RC[-3]<9),40,IF(AND(RC[-3]>RC[-1],RC[-3]>=9,RC[-3]<10),30,IF(AND(RC[-3]>RC[-1],RC[-3]>=10,RC[-3]<11),20,IF(AND(RC[-3]>RC[-1],RC[-3]>=11,RC[-3]<12),10,IF(AND(RC[-3]>RC[-1],RC[-3]>=12),0))))))))))))))))))))))))))))))))) -> 90 | H715: =IF(RC[-3]="","",IF(RC[-3]<0.3,100,IF(AND(RC[-3]>=0.3,RC[-3]>0.4),95,IF(AND(RC[-3]>=0.4,RC[-3]<0.5),90,IF(AND(RC[-3]>=0.5,RC[-3]<0.6),85,IF(AND(RC[-3]>=0.6,RC[-3]<0.7),80,IF(AND(RC[-3]>=0.6,RC[-3]<1),80,IF(AND(RC[-3]>1,RC[-3]<2),50,IF(RC[-3]>2,0))))))))) -> 95 | I715: =IF(RC[-1]="",RC[-2],0.7*RC[-1]+0.3*RC[-2]) -> 93.5
A716: هتل بین المللی پارسیان کوثر اصفهان | B716: گکوثر | C716: =VLOOKUP(RC[-1],Sheet1!R3C2:R802C3,2,FALSE) -> هتل و رستوران | D716: =VLOOKUP(RC[-2],Sheet1!R3C2:R802C9,8,FALSE) -> 64.101139261011667 | E716: =IF(VLOOKUP(RC[-3],Sheet1!R3C2:R803C11,10,FALSE)=0,"",VLOOKUP(Sheet2!RC[-3],Sheet1!R[1]C[-3]:R[801]C[6],10,FALSE)) ->  | F716: =Sheet1!R775C10 -> 34.015880314842121 | G716: =IF(RC[-3]<0,0,IF(AND(RC[-3]<RC[-1],RC[-3]<2),100,IF(AND(RC[-3]<RC[-1],RC[-3]>=2,RC[-3]<3),95,IF(AND(RC[-3]<RC[-1],RC[-3]>=3,RC[-3]<4),90,IF(AND(RC[-3]<RC[-1],RC[-3]>=4,RC[-3]<5),85,IF(AND(RC[-3]<RC[-1],RC[-3]>=5,RC[-3]<6),80,IF(AND(RC[-3]<RC[-1],RC[-3]>=6,RC[-3]<7),75,IF(AND(RC[-3]<RC[-1],RC[-3]>=7,RC[-3]<8),70,IF(AND(RC[-3]<RC[-1],RC[-3]>=8,RC[-3]<9),65,IF(AND(RC[-3]<RC[-1],RC[-3]>=9,RC[-3]<10),60,IF(AND(RC[-3]<RC[-1],RC[-3]>=10,RC[-3]<11),55,IF(AND(RC[-3]<RC[-1],RC[-3]>=11,RC[-3]<12),50,IF(AND(RC[-3]<RC[-1],RC[-3]>=12,RC[-3]<13),45,IF(AND(RC[-3]<RC[-1],RC[-3]>=13,RC[-3]<14),40,IF(AND(RC[-3]<RC[-1],RC[-3]>=14,RC[-3]<15),35,IF(AND(RC[-3]<RC[-1],RC[-3]>=15,RC[-3]<16),30,IF(AND(RC[-3]<RC[-1],RC[-3]>=16,RC[-3]<17),25,IF(AND(RC[-3]<RC[-1],RC[-3]>=17,RC[-3]<18),20,IF(AND(RC[-3]<RC[-1],RC[-3]>=18,RC[-3]<19),15,IF(AND(RC[-3]<RC[-1],RC[-3]>=19,RC[-3]<20),10,IF(AND(RC[-3]<RC[-1],RC[-3]>=20,RC[-3]<21),5,IF(AND(RC[-3]<RC[-1],RC[-3]>=21),0,IF(AND(RC[-3]>RC[-1],RC[-3]>=2,RC[-3]<3),90,IF(AND(RC[-3]>RC[-1],RC[-3]>=3,RC[-3]<4),90,IF(AND(RC[-3]>RC[-1],RC[-3]>=4,RC[-3]<5),80,IF(AND(RC[-3]>RC[-1],RC[-3]>=5,RC[-3]<6),70,IF(AND(RC[-3]>RC[-1],RC[-3]>=6,RC[-3]<7),60,IF(AND(RC[-3]>RC[-1],RC[-3]>=7,RC[-3]<8),50,IF(AND(RC[-3]>RC[-1],RC[-3]>=8,RC[-3]<9),40,IF(AND(RC[-3]>RC[-1],RC[-3]>=9,RC[-3]<10),30,IF(AND(RC[-3]>RC[-1],RC[-3]>=10,RC[-3]<11),20,IF(AND(RC[-3]>RC[-1],RC[-3]>=11,RC[-3]<12),10,IF(AND(RC[-3]>RC[-1],RC[-3]>=12),0))))))))))))))))))))))))))))))))) -> 0 | H716: =IF(RC[-3]="","",IF(RC[-3]<0.3,100,IF(AND(RC[-3]>=0.3,RC[-3]>0.4),95,IF(AND(RC[-3]>=0.4,RC[-3]<0.5),90,IF(AND(RC[-3]>=0.5,RC[-3]<0.6),85,IF(AND(RC[-3]>=0.6,RC[-3]<0.7),80,IF(AND(RC[-3]>=0.6,RC[-3]<1),80,IF(AND(RC[-3]>1,RC[-3]<2),50,IF(RC[-3]>2,0))))))))) ->  | I716: =IF(RC[-1]="",RC[-2],0.7*RC[-1]+0.3*RC[-2]) -> 0
A717: کارگزاران پارس | B717: گپارس | C717: =VLOOKUP(RC[-1],Sheet1!R3C2:R802C3,2,FALSE) -> هتل و رستوران | D717: =VLOOKUP(RC[-2],Sheet1!R3C2:R802C9,8,FALSE) -> -44.018280868834069 | E717: =IF(VLOOKUP(RC[-3],Sheet1!R3C2:R803C11,10,FALSE)=0,"",VLOOKUP(Sheet2!RC[-3],Sheet1!R[1]C[-3]:R[801]C[6],10,FALSE)) ->  | F717: =Sheet1!R775C10 -> 34.015880314842121 | G717: =IF(RC[-3]<0,0,IF(AND(RC[-3]<RC[-1],RC[-3]<2),100,IF(AND(RC[-3]<RC[-1],RC[-3]>=2,RC[-3]<3),95,IF(AND(RC[-3]<RC[-1],RC[-3]>=3,RC[-3]<4),90,IF(AND(RC[-3]<RC[-1],RC[-3]>=4,RC[-3]<5),85,IF(AND(RC[-3]<RC[-1],RC[-3]>=5,RC[-3]<6),80,IF(AND(RC[-3]<RC[-1],RC[-3]>=6,RC[-3]<7),75,IF(AND(RC[-3]<RC[-1],RC[-3]>=7,RC[-3]<8),70,IF(AND(RC[-3]<RC[-1],RC[-3]>=8,RC[-3]<9),65,IF(AND(RC[-3]<RC[-1],RC[-3]>=9,RC[-3]<10),60,IF(AND(RC[-3]<RC[-1],RC[-3]>=10,RC[-3]<11),55,IF(AND(RC[-3]<RC[-1],RC[-3]>=11,RC[-3]<12),50,IF(AND(RC[-3]<RC[-1],RC[-3]>=12,RC[-3]<13),45,IF(AND(RC[-3]<RC[-1],RC[-3]>=13,RC[-3]<14),40,IF(AND(RC[-3]<RC[-1],RC[-3]>=14,RC[-3]<15),35,IF(AND(RC[-3]<RC[-1],RC[-3]>=15,RC[-3]<16),30,IF(AND(RC[-3]<RC[-1],RC[-3]>=16,RC[-3]<17),25,IF(AND(RC[-3]<RC[-1],RC[-3]>=17,RC[-3]<18),20,IF(AND(RC[-3]<RC[-1],RC[-3]>=18,RC[-3]<19),15,IF(AND(RC[-3]<RC[-1],RC[-3]>=19,RC[-3]<20),10,IF(AND(RC[-3]<RC[-1],RC[-3]>=20,RC[-3]<21),5,IF(AND(RC[-3]<RC[-1],RC[-3]>=21),0,IF(AND(RC[-3]>RC[-1],RC[-3]>=2,RC[-3]<3),90,IF(AND(RC[-3]>RC[-1],RC[-3]>=3,RC[-3]<4),90,IF(AND(RC[-3]>RC[-1],RC[-3]>=4,RC[-3]<5),80,IF(AND(RC[-3]>RC[-1],RC[-3]>=5,RC[-3]<6),70,IF(AND(RC[-3]>RC[-1],RC[-3]>=6,RC[-3]<7),60,IF(AND(RC[-3]>RC[-1],RC[-3]>=7,RC[-3]<8),50,IF(AND(RC[-3]>RC[-1],RC[-3]>=8,RC[-3]<9),40,IF(AND(RC[-3]>RC[-1],RC[-3]>=9,RC[-3]<10),30,IF(AND(RC[-3]>RC[-1],RC[-3]>=10,RC[-3]<11),20,IF(AND(RC[-3]>RC[-1],RC[-3]>=11,RC[-3]<12),10,IF(AND(RC[-3]>RC[-1],RC[-3]>=12),0))))))))))))))))))))))))))))))))) -> 0 | H717: =IF(RC[-3]="","",IF(RC[-3]<0.3,100,IF(AND(RC[-3]>=0.3,RC[-3]>0.4),95,IF(AND(RC[-3]>=0.4,RC[-3]<0.5),90,IF(AND(RC[-3]>=0.5,RC[-3]<0.6),85,IF(AND(RC[-3]>=0.6,RC[-3]<0.7),80,IF(AND(RC[-3]>=0.6,RC[-3]<1),80,IF(AND(RC[-3]>1,RC[-3]<2),50,IF(RC[-3]>2,0))))))))) ->  | I717: =IF(RC[-1]="",RC[-2],0.7*RC[-1]+0.3*RC[-2]) -> 0
A718: آرین توسکا | B718: وآتوس | C718: =VLOOKUP(RC[-1],Sheet1!R3C2:R802C3,2,FALSE) -> واسطه گریهای مالی و پولی | D718: =VLOOKUP(RC[-2],Sheet1!R3C2:R802C9,8,FALSE) -> 1184.21875 | E718: =IF(VLOOKUP(RC[-3],Sheet1!R3C2:R803C11,10,FALSE)=0,"",VLOOKUP(Sheet2!RC[-3],Sheet1!R[1]C[-3]:R[801]C[6],10,FALSE)) ->  | F718: =Sheet1!R798C10 -> 18.05532147750397 | G718: =IF(RC[-3]<0,0,IF(AND(RC[-3]<RC[-1],RC[-3]<2),100,IF(AND(RC[-3]<RC[-1],RC[-3]>=2,RC[-3]<3),95,IF(AND(RC[-3]<RC[-1],RC[-3]>=3,RC[-3]<4),90,IF(AND(RC[-3]<RC[-1],RC[-3]>=4,RC[-3]<5),85,IF(AND(RC[-3]<RC[-1],RC[-3]>=5,RC[-3]<6),80,IF(AND(RC[-3]<RC[-1],RC[-3]>=6,RC[-3]<7),75,IF(AND(RC[-3]<RC[-1],RC[-3]>=7,RC[-3]<8),70,IF(AND(RC[-3]<RC[-1],RC[-3]>=8,RC[-3]<9),65,IF(AND(RC[-3]<RC[-1],RC[-3]>=9,RC[-3]<10),60,IF(AND(RC[-3]<RC[-1],RC[-3]>=10,RC[-3]<11),55,IF(AND(RC[-3]<RC[-1],RC[-3]>=11,RC[-3]<12),50,IF(AND(RC[-3]<RC[-1],RC[-3]>=12,RC[-3]<13),45,IF(AND(RC[-3]<RC[-1],RC[-3]>=13,RC[-3]<14),40,IF(AND(RC[-3]<RC[-1],RC[-3]>=14,RC[-3]<15),35,IF(AND(RC[-3]<RC[-1],RC[-3]>=15,RC[-3]<16),30,IF(AND(RC[-3]<RC[-1],RC[-3]>=16,RC[-3]<17),25,IF(AND(RC[-3]<RC[-1],RC[-3]>=17,RC[-3]<18),20,IF(AND(RC[-3]<RC[-1],RC[-3]>=18,RC[-3]<19),15,IF(AND(RC[-3]<RC[-1],RC[-3]>=19,RC[-3]<20),10,IF(AND(RC[-3]<RC[-1],RC[-3]>=20,RC[-3]<21),5,IF(AND(RC[-3]<RC[-1],RC[-3]>=21),0,IF(AND(RC[-3]>RC[-1],RC[-3]>=2,RC[-3]<3),90,IF(AND(RC[-3]>RC[-1],RC[-3]>=3,RC[-3]<4),90,IF(AND(RC[-3]>RC[-1],RC[-3]>=4,RC[-3]<5),80,IF(AND(RC[-3]>RC[-1],RC[-3]>=5,RC[-3]<6),70,IF(AND(RC[-3]>RC[-1],RC[-3]>=6,RC[-3]<7),60,IF(AND(RC[-3]>RC[-1],RC[-3]>=7,RC[-3]<8),50,IF(AND(RC[-3]>RC[-1],RC[-3]>=8,RC[-3]<9),40,IF(AND(RC[-3]>RC[-1],RC[-3]>=9,RC[-3]<10),30,IF(AND(RC[-3]>RC[-1],RC[-3]>=10,RC[-3]<11),20,IF(AND(RC[-3]>RC[-1],RC[-3]>=11,RC[-3]<12),10,IF(AND(RC[-3]>RC[-1],RC[-3]>=12),0))))))))))))))))))))))))))))))))) -> 0 | H718: =IF(RC[-3]="","",IF(RC[-3]<0.3,100,IF(AND(RC[-3]>=0.3,RC[-3]>0.4),95,IF(AND(RC[-3]>=0.4,RC[-3]<0.5),90,IF(AND(RC[-3]>=0.5,RC[-3]<0.6),85,IF(AND(RC[-3]>=0.6,RC[-3]<0.7),80,IF(AND(RC[-3]>=0.6,RC[-3]<1),80,IF(AND(RC[-3]>1,RC[-3]<2),50,IF(RC[-3]>2,0))))))))) ->  | I718: =IF(RC[-1]="",RC[-2],0.7*RC[-1]+0.3*RC[-2]) -> 0
A719: احیاء صنایع خراسان | B719: واحصا | C719: =VLOOKUP(RC[-1],Sheet1!R3C2:R802C3,2,FALSE) -> واسطه گریهای مالی و پولی | D719: =VLOOKUP(RC[-2],Sheet1!R3C2:R802C9,8,FALSE) -> 49.573922721082731 | E719: =IF(VLOOKUP(RC[-3],Sheet1!R3C2:R803C11,10,FALSE)=0,"",VLOOKUP(Sheet2!RC[-3],Sheet1!R[1]C[-3]:R[801]C[6],10,FALSE)) ->  | F719: =Sheet1!R798C10 -> 18.05532147750397 | G719: =IF(RC[-3]<0,0,IF(AND(RC[-3]<RC[-1],RC[-3]<2),100,IF(AND(RC[-3]<RC[-1],RC[-3]>=2,RC[-3]<3),95,IF(AND(RC[-3]<RC[-1],RC[-3]>=3,RC[-3]<4),90,IF(AND(RC[-3]<RC[-1],RC[-3]>=4,RC[-3]<5),85,IF(AND(RC[-3]<RC[-1],RC[-3]>=5,RC[-3]<6),80,IF(AND(RC[-3]<RC[-1],RC[-3]>=6,RC[-3]<7),75,IF(AND(RC[-3]<RC[-1],RC[-3]>=7,RC[-3]<8),70,IF(AND(RC[-3]<RC[-1],RC[-3]>=8,RC[-3]<9),65,IF(AND(RC[-3]<RC[-1],RC[-3]>=9,RC[-3]<10),60,IF(AND(RC[-3]<RC[-1],RC[-3]>=10,RC[-3]<11),55,IF(AND(RC[-3]<RC[-1],RC[-3]>=11,RC[-3]<12),50,IF(AND(RC[-3]<RC[-1],RC[-3]>=12,RC[-3]<13),45,IF(AND(RC[-3]<RC[-1],RC[-3]>=13,RC[-3]<14),40,IF(AND(RC[-3]<RC[-1],RC[-3]>=14,RC[-3]<15),35,IF(AND(RC[-3]<RC[-1],RC[-3]>=15,RC[-3]<16),30,IF(AND(RC[-3]<RC[-1],RC[-3]>=16,RC[-3]<17),25,IF(AND(RC[-3]<RC[-1],RC[-3]>=17,RC[-3]<18),20,IF(AND(RC[-3]<RC[-1],RC[-3]>=18,RC[-3]<19),15,IF(AND(RC[-3]<RC[-1],RC[-3]>=19,RC[-3]<20),10,IF(AND(RC[-3]<RC[-1],RC[-3]>=20,RC[-3]<21),5,IF(AND(RC[-3]<RC[-1],RC[-3]>=21),0,IF(AND(RC[-3]>RC[-1],RC[-3]>=2,RC[-3]<3),90,IF(AND(RC[-3]>RC[-1],RC[-3]>=3,RC[-3]<4),90,IF(AND(RC[-3]>RC[-1],RC[-3]>=4,RC[-3]<5),80,IF(AND(RC[-3]>RC[-1],RC[-3]>=5,RC[-3]<6),70,IF(AND(RC[-3]>RC[-1],RC[-3]>=6,RC[-3]<7),60,IF(AND(RC[-3]>RC[-1],RC[-3]>=7,RC[-3]<8),50,IF(AND(RC[-3]>RC[-1],RC[-3]>=8,RC[-3]<9),40,IF(AND(RC[-3]>RC[-1],RC[-3]>=9,RC[-3]<10),30,IF(AND(RC[-3]>RC[-1],RC[-3]>=10,RC[-3]<11),20,IF(AND(RC[-3]>RC[-1],RC[-3]>=11,RC[-3]<12),10,IF(AND(RC[-3]>RC[-1],RC[-3]>=12),0))))))))))))))))))))))))))))))))) -> 0 | H719: =IF(RC[-3]="","",IF(RC[-3]<0.3,100,IF(AND(RC[-3]>=0.3,RC[-3]>0.4),95,IF(AND(RC[-3]>=0.4,RC[-3]<0.5),90,IF(AND(RC[-3]>=0.5,RC[-3]<0.6),85,IF(AND(RC[-3]>=0.6,RC[-3]<0.7),80,IF(AND(RC[-3]>=0.6,RC[-3]<1),80,IF(AND(RC[-3]>1,RC[-3]<2),50,IF(RC[-3]>2,0))))))))) ->  | I719: =IF(RC[-1]="",RC[-2],0.7*RC[-1]+0.3*RC[-2]) -> 0
A720: بانک شهر | B720: وشهر | C720: =VLOOKUP(RC[-1],Sheet1!R3C2:R802C3,2,FALSE) -> واسطه گریهای مالی و پولی | D720: =VLOOKUP(RC[-2],Sheet1!R3C2:R802C9,8,FALSE) -> 8.6246916731229621 | E720: =IF(VLOOKUP(RC[-3],Sheet1!R3C2:R803C11,10,FALSE)=0,"",VLOOKUP(Sheet2!RC[-3],Sheet1!R[1]C[-3]:R[801]C[6],10,FALSE)) ->  | F720: =Sheet1!R798C10 -> 18.05532147750397 | G720: =IF(RC[-3]<0,0,IF(AND(RC[-3]<RC[-1],RC[-3]<2),100,IF(AND(RC[-3]<RC[-1],RC[-3]>=2,RC[-3]<3),95,IF(AND(RC[-3]<RC[-1],RC[-3]>=3,RC[-3]<4),90,IF(AND(RC[-3]<RC[-1],RC[-3]>=4,RC[-3]<5),85,IF(AND(RC[-3]<RC[-1],RC[-3]>=5,RC[-3]<6),80,IF(AND(RC[-3]<RC[-1],RC[-3]>=6,RC[-3]<7),75,IF(AND(RC[-3]<RC[-1],RC[-3]>=7,RC[-3]<8),70,IF(AND(RC[-3]<RC[-1],RC[-3]>=8,RC[-3]<9),65,IF(AND(RC[-3]<RC[-1],RC[-3]>=9,RC[-3]<10),60,IF(AND(RC[-3]<RC[-1],RC[-3]>=10,RC[-3]<11),55,IF(AND(RC[-3]<RC[-1],RC[-3]>=11,RC[-3]<12),50,IF(AND(RC[-3]<RC[-1],RC[-3]>=12,RC[-3]<13),45,IF(AND(RC[-3]<RC[-1],RC[-3]>=13,RC[-3]<14),40,IF(AND(RC[-3]<RC[-1],RC[-3]>=14,RC[-3]<15),35,IF(AND(RC[-3]<RC[-1],RC[-3]>=15,RC[-3]<16),30,IF(AND(RC[-3]<RC[-1],RC[-3]>=16,RC[-3]<17),25,IF(AND(RC[-3]<RC[-1],RC[-3]>=17,RC[-3]<18),20,IF(AND(RC[-3]<RC[-1],RC[-3]>=18,RC[-3]<19),15,IF(AND(RC[-3]<RC[-1],RC[-3]>=19,RC[-3]<20),10,IF(AND(RC[-3]<RC[-1],RC[-3]>=20,RC[-3]<21),5,IF(AND(RC[-3]<RC[-1],RC[-3]>=21),0,IF(AND(RC[-3]>RC[-1],RC[-3]>=2,RC[-3]<3),90,IF(AND(RC[-3]>RC[-1],RC[-3]>=3,RC[-3]<4),90,IF(AND(RC[-3]>RC[-1],RC[-3]>=4,RC[-3]<5),80,IF(AND(RC[-3]>RC[-1],RC[-3]>=5,RC[-3]<6),70,IF(AND(RC[-3]>RC[-1],RC[-3]>=6,RC[-3]<7),60,IF(AND(RC[-3]>RC[-1],RC[-3]>=7,RC[-3]<8),50,IF(AND(RC[-3]>RC[-1],RC[-3]>=8,RC[-3]<9),40,IF(AND(RC[-3]>RC[-1],RC[-3]>=9,RC[-3]<10),30,IF(AND(RC[-3]>RC[-1],RC[-3]>=10,RC[-3]<11),20,IF(AND(RC[-3]>RC[-1],RC[-3]>=11,RC[-3]<12),10,IF(AND(RC[-3]>RC[-1],RC[-3]>=12),0))))))))))))))))))))))))))))))))) -> 65 | H720: =IF(RC[-3]="","",IF(RC[-3]<0.3,100,IF(AND(RC[-3]>=0.3,RC[-3]>0.4),95,IF(AND(RC[-3]>=0.4,RC[-3]<0.5),90,IF(AND(RC[-3]>=0.5,RC[-3]<0.6),85,IF(AND(RC[-3]>=0.6,RC[-3]<0.7),80,IF(AND(RC[-3]>=0.6,RC[-3]<1),80,IF(AND(RC[-3]>1,RC[-3]<2),50,IF(RC[-3]>2,0))))))))) ->  | I720: =IF(RC[-1]="",RC[-2],0.7*RC[-1]+0.3*RC[-2]) -> 65
A721: بهمن لیزینگ | B721: ولبهمن | C721: =VLOOKUP(RC[-1],Sheet1!R3C2:R802C3,2,FALSE) -> واسطه گریهای مالی و پولی | D721: =VLOOKUP(RC[-2],Sheet1!R3C2:R802C9,8,FALSE) -> 3.0185953313271385 | E721: =IF(VLOOKUP(RC[-3],Sheet1!R3C2:R803C11,10,FALSE)=0,"",VLOOKUP(Sheet2!RC[-3],Sheet1!R[1]C[-3]:R[801]C[6],10,FALSE)) ->  | F721: =Sheet1!R798C10 -> 18.05532147750397 | G721: =IF(RC[-3]<0,0,IF(AND(RC[-3]<RC[-1],RC[-3]<2),100,IF(AND(RC[-3]<RC[-1],RC[-3]>=2,RC[-3]<3),95,IF(AND(RC[-3]<RC[-1],RC[-3]>=3,RC[-3]<4),90,IF(AND(RC[-3]<RC[-1],RC[-3]>=4,RC[-3]<5),85,IF(AND(RC[-3]<RC[-1],RC[-3]>=5,RC[-3]<6),80,IF(AND(RC[-3]<RC[-1],RC[-3]>=6,RC[-3]<7),75,IF(AND(RC[-3]<RC[-1],RC[-3]>=7,RC[-3]<8),70,IF(AND(RC[-3]<RC[-1],RC[-3]>=8,RC[-3]<9),65,IF(AND(RC[-3]<RC[-1],RC[-3]>=9,RC[-3]<10),60,IF(AND(RC[-3]<RC[-1],RC[-3]>=10,RC[-3]<11),55,IF(AND(RC[-3]<RC[-1],RC[-3]>=11,RC[-3]<12),50,IF(AND(RC[-3]<RC[-1],RC[-3]>=12,RC[-3]<13),45,IF(AND(RC[-3]<RC[-1],RC[-3]>=13,RC[-3]<14),40,IF(AND(RC[-3]<RC[-1],RC[-3]>=14,RC[-3]<15),35,IF(AND(RC[-3]<RC[-1],RC[-3]>=15,RC[-3]<16),30,IF(AND(RC[-3]<RC[-1],RC[-3]>=16,RC[-3]<17),25,IF(AND(RC[-3]<RC[-1],RC[-3]>=17,RC[-3]<18),20,IF(AND(RC[-3]<RC[-1],RC[-3]>=18,RC[-3]<19),15,IF(AND(RC[-3]<RC[-1],RC[-3]>=19,RC[-3]<20),10,IF(AND(RC[-3]<RC[-1],RC[-3]>=20,RC[-3]<21),5,IF(AND(RC[-3]<RC[-1],RC[-3]>=21),0,IF(AND(RC[-3]>RC[-1],RC[-3]>=2,RC[-3]<3),90,IF(AND(RC[-3]>RC[-1],RC[-3]>=3,RC[-3]<4),90,IF(AND(RC[-3]>RC[-1],RC[-3]>=4,RC[-3]<5),80,IF(AND(RC[-3]>RC[-1],RC[-3]>=5,RC[-3]<6),70,IF(AND(RC[-3]>RC[-1],RC[-3]>=6,RC[-3]<7),60,IF(AND(RC[-3]>RC[-1],RC[-3]>=7,RC[-3]<8),50,IF(AND(RC[-3]>RC[-1],RC[-3]>=8,RC[-3]<9),40,IF(AND(RC[-3]>RC[-1],RC[-3]>=9,RC[-3]<10),30,IF(AND(RC[-3]>RC[-1],RC[-3]>=10,RC[-3]<11),20,IF(AND(RC[-3]>RC[-1],RC[-3]>=11,RC[-3]<12),10,IF(AND(RC[-3]>RC[-1],RC[-3]>=12),0))))))))))))))))))))))))))))))))) -> 90 | H721: =IF(RC[-3]="","",IF(RC[-3]<0.3,100,IF(AND(RC[-3]>=0.3,RC[-3]>0.4),95,IF(AND(RC[-3]>=0.4,RC[-3]<0.5),90,IF(AND(RC[-3]>=0.5,RC[-3]<0.6),85,IF(AND(RC[-3]>=0.6,RC[-3]<0.7),80,IF(AND(RC[-3]>=0.6,RC[-3]<1),80,IF(AND(RC[-3]>1,RC[-3]<2),50,IF(RC[-3]>2,0))))))))) ->  | I721: =IF(RC[-1]="",RC[-2],0.7*RC[-1]+0.3*RC[-2]) -> 90
A722: سر. ارس صبا | B722: وارس | C722: =VLOOKUP(RC[-1],Sheet1!R3C2:R802C3,2,FALSE) -> واسطه گریهای مالی و پولی | D722: =VLOOKUP(RC[-2],Sheet1!R3C2:R802C9,8,FALSE) -> 4.8054446366277421 | E722: =IF(VLOOKUP(RC[-3],Sheet1!R3C2:R803C11,10,FALSE)=0,"",VLOOKUP(Sheet2!RC[-3],Sheet1!R[1]C[-3]:R[801]C[6],10,FALSE)) -> 4 | F722: =Sheet1!R798C10 -> 18.05532147750397 | G722: =IF(RC[-3]<0,0,IF(AND(RC[-3]<RC[-1],RC[-3]<2),100,IF(AND(RC[-3]<RC[-1],RC[-3]>=2,RC[-3]<3),95,IF(AND(RC[-3]<RC[-1],RC[-3]>=3,RC[-3]<4),90,IF(AND(RC[-3]<RC[-1],RC[-3]>=4,RC[-3]<5),85,IF(AND(RC[-3]<RC[-1],RC[-3]>=5,RC[-3]<6),80,IF(AND(RC[-3]<RC[-1],RC[-3]>=6,RC[-3]<7),75,IF(AND(RC[-3]<RC[-1],RC[-3]>=7,RC[-3]<8),70,IF(AND(RC[-3]<RC[-1],RC[-3]>=8,RC[-3]<9),65,IF(AND(RC[-3]<RC[-1],RC[-3]>=9,RC[-3]<10),60,IF(AND(RC[-3]<RC[-1],RC[-3]>=10,RC[-3]<11),55,IF(AND(RC[-3]<RC[-1],RC[-3]>=11,RC[-3]<12),50,IF(AND(RC[-3]<RC[-1],RC[-3]>=12,RC[-3]<13),45,IF(AND(RC[-3]<RC[-1],RC[-3]>=13,RC[-3]<14),40,IF(AND(RC[-3]<RC[-1],RC[-3]>=14,RC[-3]<15),35,IF(AND(RC[-3]<RC[-1],RC[-3]>=15,RC[-3]<16),30,IF(AND(RC[-3]<RC[-1],RC[-3]>=16,RC[-3]<17),25,IF(AND(RC[-3]<RC[-1],RC[-3]>=17,RC[-3]<18),20,IF(AND(RC[-3]<RC[-1],RC[-3]>=18,RC[-3]<19),15,IF(AND(RC[-3]<RC[-1],RC[-3]>=19,RC[-3]<20),10,IF(AND(RC[-3]<RC[-1],RC[-3]>=20,RC[-3]<21),5,IF(AND(RC[-3]<RC[-1],RC[-3]>=21),0,IF(AND(RC[-3]>RC[-1],RC[-3]>=2,RC[-3]<3),90,IF(AND(RC[-3]>RC[-1],RC[-3]>=3,RC[-3]<4),90,IF(AND(RC[-3]>RC[-1],RC[-3]>=4,RC[-3]<5),80,IF(AND(RC[-3]>RC[-1],RC[-3]>=5,RC[-3]<6),70,IF(AND(RC[-3]>RC[-1],RC[-3]>=6,RC[-3]<7),60,IF(AND(RC[-3]>RC[-1],RC[-3]>=7,RC[-3]<8),50,IF(AND(RC[-3]>RC[-1],RC[-3]>=8,RC[-3]<9),40,IF(AND(RC[-3]>RC[-1],RC[-3]>=9,RC[-3]<10),30,IF(AND(RC[-3]>RC[-1],RC[-3]>=10,RC[-3]<11),20,IF(AND(RC[-3]>RC[-1],RC[-3]>=11,RC[-3]<12),10,IF(AND(RC[-3]>RC[-1],RC[-3]>=12),0))))))))))))))))))))))))))))))))) -> 85 | H722: =IF(RC[-3]="","",IF(RC[-3]<0.3,100,IF(AND(RC[-3]>=0.3,RC[-3]>0.4),95,IF(AND(RC[-3]>=0.4,RC[-3]<0.5),90,IF(AND(RC[-3]>=0.5,RC[-3]<0.6),85,IF(AND(RC[-3]>=0.6,RC[-3]<0.7),80,IF(AND(RC[-3]>=0.6,RC[-3]<1),80,IF(AND(RC[-3]>1,RC[-3]<2),50,IF(RC[-3]>2,0))))))))) -> 95 | I722: =IF(RC[-1]="",RC[-2],0.7*RC[-1]+0.3*RC[-2]) -> 92
A723: سر. ایساتیس پویا | B723: ویسا | C723: =VLOOKUP(RC[-1],Sheet1!R3C2:R802C3,2,FALSE) -> واسطه گریهای مالی و پولی | D723: =VLOOKUP(RC[-2],Sheet1!R3C2:R802C9,8,FALSE) -> 10.585065248446666 | E723: =IF(VLOOKUP(RC[-3],Sheet1!R3C2:R803C11,10,FALSE)=0,"",VLOOKUP(Sheet2!RC[-3],Sheet1!R[1]C[-3]:R[801]C[6],10,FALSE)) -> 4 | F723: =Sheet1!R798C10 -> 18.05532147750397 | G723: =IF(RC[-3]<0,0,IF(AND(RC[-3]<RC[-1],RC[-3]<2),100,IF(AND(RC[-3]<RC[-1],RC[-3]>=2,RC[-3]<3),95,IF(AND(RC[-3]<RC[-1],RC[-3]>=3,RC[-3]<4),90,IF(AND(RC[-3]<RC[-1],RC[-3]>=4,RC[-3]<5),85,IF(AND(RC[-3]<RC[-1],RC[-3]>=5,RC[-3]<6),80,IF(AND(RC[-3]<RC[-1],RC[-3]>=6,RC[-3]<7),75,IF(AND(RC[-3]<RC[-1],RC[-3]>=7,RC[-3]<8),70,IF(AND(RC[-3]<RC[-1],RC[-3]>=8,RC[-3]<9),65,IF(AND(RC[-3]<RC[-1],RC[-3]>=9,RC[-3]<10),60,IF(AND(RC[-3]<RC[-1],RC[-3]>=10,RC[-3]<11),55,IF(AND(RC[-3]<RC[-1],RC[-3]>=11,RC[-3]<12),50,IF(AND(RC[-3]<RC[-1],RC[-3]>=12,RC[-3]<13),45,IF(AND(RC[-3]<RC[-1],RC[-3]>=13,RC[-3]<14),40,IF(AND(RC[-3]<RC[-1],RC[-3]>=14,RC[-3]<15),35,IF(AND(RC[-3]<RC[-1],RC[-3]>=15,RC[-3]<16),30,IF(AND(RC[-3]<RC[-1],RC[-3]>=16,RC[-3]<17),25,IF(AND(RC[-3]<RC[-1],RC[-3]>=17,RC[-3]<18),20,IF(AND(RC[-3]<RC[-1],RC[-3]>=18,RC[-3]<19),15,IF(AND(RC[-3]<RC[-1],RC[-3]>=19,RC[-3]<20),10,IF(AND(RC[-3]<RC[-1],RC[-3]>=20,RC[-3]<21),5,IF(AND(RC[-3]<RC[-1],RC[-3]>=21),0,IF(AND(RC[-3]>RC[-1],RC[-3]>=2,RC[-3]<3),90,IF(AND(RC[-3]>RC[-1],RC[-3]>=3,RC[-3]<4),90,IF(AND(RC[-3]>RC[-1],RC[-3]>=4,RC[-3]<5),80,IF(AND(RC[-3]>RC[-1],RC[-3]>=5,RC[-3]<6),70,IF(AND(RC[-3]>RC[-1],RC[-3]>=6,RC[-3]<7),60,IF(AND(RC[-3]>RC[-1],RC[-3]>=7,RC[-3]<8),50,IF(AND(RC[-3]>RC[-1],RC[-3]>=8,RC[-3]<9),40,IF(AND(RC[-3]>RC[-1],RC[-3]>=9,RC[-3]<10),30,IF(AND(RC[-3]>RC[-1],RC[-3]>=10,RC[-3]<11),20,IF(AND(RC[-3]>RC[-1],RC[-3]>=11,RC[-3]<12),10,IF(AND(RC[-3]>RC[-1],RC[-3]>=12),0))))))))))))))))))))))))))))))))) -> 55 | H723: =IF(RC[-3]="","",IF(RC[-3]<0.3,100,IF(AND(RC[-3]>=0.3,RC[-3]>0.4),95,IF(AND(RC[-3]>=0.4,RC[-3]<0.5),90,IF(AND(RC[-3]>=0.5,RC[-3]<0.6),85,IF(AND(RC[-3]>=0.6,RC[-3]<0.7),80,IF(AND(RC[-3]>=0.6,RC[-3]<1),80,IF(AND(RC[-3]>1,RC[-3]<2),50,IF(RC[-3]>2,0))))))))) -> 95 | I723: =IF(RC[-1]="",RC[-2],0.7*RC[-1]+0.3*RC[-2]) -> 83
A724: سر. ساختمان نوین | B724: وثنو | C724: =VLOOKUP(RC[-1],Sheet1!R3C2:R802C3,2,FALSE) -> واسطه گریهای مالی و پولی | D724: =VLOOKUP(RC[-2],Sheet1!R3C2:R802C9,8,FALSE) -> 4.9527649679930885 | E724: =IF(VLOOKUP(RC[-3],Sheet1!R3C2:R803C11,10,FALSE)=0,"",VLOOKUP(Sheet2!RC[-3],Sheet1!R[1]C[-3]:R[801]C[6],10,FALSE)) -> 0.6 | F724: =Sheet1!R798C10 -> 18.05532147750397 | G724: =IF(RC[-3]<0,0,IF(AND(RC[-3]<RC[-1],RC[-3]<2),100,IF(AND(RC[-3]<RC[-1],RC[-3]>=2,RC[-3]<3),95,IF(AND(RC[-3]<RC[-1],RC[-3]>=3,RC[-3]<4),90,IF(AND(RC[-3]<RC[-1],RC[-3]>=4,RC[-3]<5),85,IF(AND(RC[-3]<RC[-1],RC[-3]>=5,RC[-3]<6),80,IF(AND(RC[-3]<RC[-1],RC[-3]>=6,RC[-3]<7),75,IF(AND(RC[-3]<RC[-1],RC[-3]>=7,RC[-3]<8),70,IF(AND(RC[-3]<RC[-1],RC[-3]>=8,RC[-3]<9),65,IF(AND(RC[-3]<RC[-1],RC[-3]>=9,RC[-3]<10),60,IF(AND(RC[-3]<RC[-1],RC[-3]>=10,RC[-3]<11),55,IF(AND(RC[-3]<RC[-1],RC[-3]>=11,RC[-3]<12),50,IF(AND(RC[-3]<RC[-1],RC[-3]>=12,RC[-3]<13),45,IF(AND(RC[-3]<RC[-1],RC[-3]>=13,RC[-3]<14),40,IF(AND(RC[-3]<RC[-1],RC[-3]>=14,RC[-3]<15),35,IF(AND(RC[-3]<RC[-1],RC[-3]>=15,RC[-3]<16),30,IF(AND(RC[-3]<RC[-1],RC[-3]>=16,RC[-3]<17),25,IF(AND(RC[-3]<RC[-1],RC[-3]>=17,RC[-3]<18),20,IF(AND(RC[-3]<RC[-1],RC[-3]>=18,RC[-3]<19),15,IF(AND(RC[-3]<RC[-1],RC[-3]>=19,RC[-3]<20),10,IF(AND(RC[-3]<RC[-1],RC[-3]>=20,RC[-3]<21),5,IF(AND(RC[-3]<RC[-1],RC[-3]>=21),0,IF(AND(RC[-3]>RC[-1],RC[-3]>=2,RC[-3]<3),90,IF(AND(RC[-3]>RC[-1],RC[-3]>=3,RC[-3]<4),90,IF(AND(RC[-3]>RC[-1],RC[-3]>=4,RC[-3]<5),80,IF(AND(RC[-3]>RC[-1],RC[-3]>=5,RC[-3]<6),70,IF(AND(RC[-3]>RC[-1],RC[-3]>=6,RC[-3]<7),60,IF(AND(RC[-3]>RC[-1],RC[-3]>=7,RC[-3]<8),50,IF(AND(RC[-3]>RC[-1],RC[-3]>=8,RC[-3]<9),40,IF(AND(RC[-3]>RC[-1],RC[-3]>=9,RC[-3]<10),30,IF(AND(RC[-3]>RC[-1],RC[-3]>=10,RC[-3]<11),20,IF(AND(RC[-3]>RC[-1],RC[-3]>=11,RC[-3]<12),10,IF(AND(RC[-3]>RC[-1],RC[-3]>=12),0))))))))))))))))))))))))))))))))) -> 85 | H724: =IF(RC[-3]="","",IF(RC[-3]<0.3,100,IF(AND(RC[-3]>=0.3,RC[-3]>0.4),95,IF(AND(RC[-3]>=0.4,RC[-3]<0.5),90,IF(AND(RC[-3]>=0.5,RC[-3]<0.6),85,IF(AND(RC[-3]>=0.6,RC[-3]<0.7),80,IF(AND(RC[-3]>=0.6,RC[-3]<1),80,IF(AND(RC[-3]>1,RC[-3]<2),50,IF(RC[-3]>2,0))))))))) -> 95 | I724: =IF(RC[-1]="",RC[-2],0.7*RC[-1]+0.3*RC[-2]) -> 92
A725: سر. سبحان | B725: وسبحان | C725: =VLOOKUP(RC[-1],Sheet1!R3C2:R802C3,2,FALSE) -> واسطه گریهای مالی و پولی | D725: =VLOOKUP(RC[-2],Sheet1!R3C2:R802C9,8,FALSE) -> 1.5893384156507415 | E725: =IF(VLOOKUP(RC[-3],Sheet1!R3C2:R803C11,10,FALSE)=0,"",VLOOKUP(Sheet2!RC[-3],Sheet1!R[1]C[-3]:R[801]C[6],10,FALSE)) -> 1.2 | F725: =Sheet1!R798C10 -> 18.05532147750397 | G725: =IF(RC[-3]<0,0,IF(AND(RC[-3]<RC[-1],RC[-3]<2),100,IF(AND(RC[-3]<RC[-1],RC[-3]>=2,RC[-3]<3),95,IF(AND(RC[-3]<RC[-1],RC[-3]>=3,RC[-3]<4),90,IF(AND(RC[-3]<RC[-1],RC[-3]>=4,RC[-3]<5),85,IF(AND(RC[-3]<RC[-1],RC[-3]>=5,RC[-3]<6),80,IF(AND(RC[-3]<RC[-1],RC[-3]>=6,RC[-3]<7),75,IF(AND(RC[-3]<RC[-1],RC[-3]>=7,RC[-3]<8),70,IF(AND(RC[-3]<RC[-1],RC[-3]>=8,RC[-3]<9),65,IF(AND(RC[-3]<RC[-1],RC[-3]>=9,RC[-3]<10),60,IF(AND(RC[-3]<RC[-1],RC[-3]>=10,RC[-3]<11),55,IF(AND(RC[-3]<RC[-1],RC[-3]>=11,RC[-3]<12),50,IF(AND(RC[-3]<RC[-1],RC[-3]>=12,RC[-3]<13),45,IF(AND(RC[-3]<RC[-1],RC[-3]>=13,RC[-3]<14),40,IF(AND(RC[-3]<RC[-1],RC[-3]>=14,RC[-3]<15),35,IF(AND(RC[-3]<RC[-1],RC[-3]>=15,RC[-3]<16),30,IF(AND(RC[-3]<RC[-1],RC[-3]>=16,RC[-3]<17),25,IF(AND(RC[-3]<RC[-1],RC[-3]>=17,RC[-3]<18),20,IF(AND(RC[-3]<RC[-1],RC[-3]>=18,RC[-3]<19),15,IF(AND(RC[-3]<RC[-1],RC[-3]>=19,RC[-3]<20),10,IF(AND(RC[-3]<RC[-1],RC[-3]>=20,RC[-3]<21),5,IF(AND(RC[-3]<RC[-1],RC[-3]>=21),0,IF(AND(RC[-3]>RC[-1],RC[-3]>=2,RC[-3]<3),90,IF(AND(RC[-3]>RC[-1],RC[-3]>=3,RC[-3]<4),90,IF(AND(RC[-3]>RC[-1],RC[-3]>=4,RC[-3]<5),80,IF(AND(RC[-3]>RC[-1],RC[-3]>=5,RC[-3]<6),70,IF(AND(RC[-3]>RC[-1],RC[-3]>=6,RC[-3]<7),60,IF(AND(RC[-3]>RC[-1],RC[-3]>=7,RC[-3]<8),50,IF(AND(RC[-3]>RC[-1],RC[-3]>=8,RC[-3]<9),40,IF(AND(RC[-3]>RC[-1],RC[-3]>=9,RC[-3]<10),30,IF(AND(RC[-3]>RC[-1],RC[-3]>=10,RC[-3]<11),20,IF(AND(RC[-3]>RC[-1],RC[-3]>=11,RC[-3]<12),10,IF(AND(RC[-3]>RC[-1],RC[-3]>=12),0))))))))))))))))))))))))))))))))) -> 100 | H725: =IF(RC[-3]="","",IF(RC[-3]<0.3,100,IF(AND(RC[-3]>=0.3,RC[-3]>0.4),95,IF(AND(RC[-3]>=0.4,RC[-3]<0.5),90,IF(AND(RC[-3]>=0.5,RC[-3]<0.6),85,IF(AND(RC[-3]>=0.6,RC[-3]<0.7),80,IF(AND(RC[-3]>=0.6,RC[-3]<1),80,IF(AND(RC[-3]>1,RC[-3]<2),50,IF(RC[-3]>2,0))))))))) -> 95 | I725: =IF(RC[-1]="",RC[-2],0.7*RC[-1]+0.3*RC[-2]) -> 96.5
A726: سر. فنی و مهندسی مشانیر | B726: ومشان | C726: =VLOOKUP(RC[-1],Sheet1!R3C2:R802C3,2,FALSE) -> واسطه گریهای مالی و پولی | D726: =VLOOKUP(RC[-2],Sheet1!R3C2:R802C9,8,FALSE) -> 118.18135651053633 | E726: =IF(VLOOKUP(RC[-3],Sheet1!R3C2:R803C11,10,FALSE)=0,"",VLOOKUP(Sheet2!RC[-3],Sheet1!R[1]C[-3]:R[801]C[6],10,FALSE)) ->  | F726: =Sheet1!R798C10 -> 18.05532147750397 | G726: =IF(RC[-3]<0,0,IF(AND(RC[-3]<RC[-1],RC[-3]<2),100,IF(AND(RC[-3]<RC[-1],RC[-3]>=2,RC[-3]<3),95,IF(AND(RC[-3]<RC[-1],RC[-3]>=3,RC[-3]<4),90,IF(AND(RC[-3]<RC[-1],RC[-3]>=4,RC[-3]<5),85,IF(AND(RC[-3]<RC[-1],RC[-3]>=5,RC[-3]<6),80,IF(AND(RC[-3]<RC[-1],RC[-3]>=6,RC[-3]<7),75,IF(AND(RC[-3]<RC[-1],RC[-3]>=7,RC[-3]<8),70,IF(AND(RC[-3]<RC[-1],RC[-3]>=8,RC[-3]<9),65,IF(AND(RC[-3]<RC[-1],RC[-3]>=9,RC[-3]<10),60,IF(AND(RC[-3]<RC[-1],RC[-3]>=10,RC[-3]<11),55,IF(AND(RC[-3]<RC[-1],RC[-3]>=11,RC[-3]<12),50,IF(AND(RC[-3]<RC[-1],RC[-3]>=12,RC[-3]<13),45,IF(AND(RC[-3]<RC[-1],RC[-3]>=13,RC[-3]<14),40,IF(AND(RC[-3]<RC[-1],RC[-3]>=14,RC[-3]<15),35,IF(AND(RC[-3]<RC[-1],RC[-3]>=15,RC[-3]<16),30,IF(AND(RC[-3]<RC[-1],RC[-3]>=16,RC[-3]<17),25,IF(AND(RC[-3]<RC[-1],RC[-3]>=17,RC[-3]<18),20,IF(AND(RC[-3]<RC[-1],RC[-3]>=18,RC[-3]<19),15,IF(AND(RC[-3]<RC[-1],RC[-3]>=19,RC[-3]<20),10,IF(AND(RC[-3]<RC[-1],RC[-3]>=20,RC[-3]<21),5,IF(AND(RC[-3]<RC[-1],RC[-3]>=21),0,IF(AND(RC[-3]>RC[-1],RC[-3]>=2,RC[-3]<3),90,IF(AND(RC[-3]>RC[-1],RC[-3]>=3,RC[-3]<4),90,IF(AND(RC[-3]>RC[-1],RC[-3]>=4,RC[-3]<5),80,IF(AND(RC[-3]>RC[-1],RC[-3]>=5,RC[-3]<6),70,IF(AND(RC[-3]>RC[-1],RC[-3]>=6,RC[-3]<7),60,IF(AND(RC[-3]>RC[-1],RC[-3]>=7,RC[-3]<8),50,IF(AND(RC[-3]>RC[-1],RC[-3]>=8,RC[-3]<9),40,IF(AND(RC[-3]>RC[-1],RC[-3]>=9,RC[-3]<10),30,IF(AND(RC[-3]>RC[-1],RC[-3]>=10,RC[-3]<11),20,IF(AND(RC[-3]>RC[-1],RC[-3]>=11,RC[-3]<12),10,IF(AND(RC[-3]>RC[-1],RC[-3]>=12),0))))))))))))))))))))))))))))))))) -> 0 | H726: =IF(RC[-3]="","",IF(RC[-3]<0.3,100,IF(AND(RC[-3]>=0.3,RC[-3]>0.4),95,IF(AND(RC[-3]>=0.4,RC[-3]<0.5),90,IF(AND(RC[-3]>=0.5,RC[-3]<0.6),85,IF(AND(RC[-3]>=0.6,RC[-3]<0.7),80,IF(AND(RC[-3]>=0.6,RC[-3]<1),80,IF(AND(RC[-3]>1,RC[-3]<2),50,IF(RC[-3]>2,0))))))))) ->  | I726: =IF(RC[-1]="",RC[-2],0.7*RC[-1]+0.3*RC[-2]) -> 0
A727: سر. مس سرچشمه | B727: سرچشمه | C727: =VLOOKUP(RC[-1],Sheet1!R3C2:R802C3,2,FALSE) -> واسطه گریهای مالی و پولی | D727: =VLOOKUP(RC[-2],Sheet1!R3C2:R802C9,8,FALSE) -> 7.8906682772343597 | E727: =IF(VLOOKUP(RC[-3],Sheet1!R3C2:R803C11,10,FALSE)=0,"",VLOOKUP(Sheet2!RC[-3],Sheet1!R[1]C[-3]:R[801]C[6],10,FALSE)) -> 1.2 | F727: =Sheet1!R798C10 -> 18.05532147750397 | G727: =IF(RC[-3]<0,0,IF(AND(RC[-3]<RC[-1],RC[-3]<2),100,IF(AND(RC[-3]<RC[-1],RC[-3]>=2,RC[-3]<3),95,IF(AND(RC[-3]<RC[-1],RC[-3]>=3,RC[-3]<4),90,IF(AND(RC[-3]<RC[-1],RC[-3]>=4,RC[-3]<5),85,IF(AND(RC[-3]<RC[-1],RC[-3]>=5,RC[-3]<6),80,IF(AND(RC[-3]<RC[-1],RC[-3]>=6,RC[-3]<7),75,IF(AND(RC[-3]<RC[-1],RC[-3]>=7,RC[-3]<8),70,IF(AND(RC[-3]<RC[-1],RC[-3]>=8,RC[-3]<9),65,IF(AND(RC[-3]<RC[-1],RC[-3]>=9,RC[-3]<10),60,IF(AND(RC[-3]<RC[-1],RC[-3]>=10,RC[-3]<11),55,IF(AND(RC[-3]<RC[-1],RC[-3]>=11,RC[-3]<12),50,IF(AND(RC[-3]<RC[-1],RC[-3]>=12,RC[-3]<13),45,IF(AND(RC[-3]<RC[-1],RC[-3]>=13,RC[-3]<14),40,IF(AND(RC[-3]<RC[-1],RC[-3]>=14,RC[-3]<15),35,IF(AND(RC[-3]<RC[-1],RC[-3]>=15,RC[-3]<16),30,IF(AND(RC[-3]<RC[-1],RC[-3]>=16,RC[-3]<17),25,IF(AND(RC[-3]<RC[-1],RC[-3]>=17,RC[-3]<18),20,IF(AND(RC[-3]<RC[-1],RC[-3]>=18,RC[-3]<19),15,IF(AND(RC[-3]<RC[-1],RC[-3]>=19,RC[-3]<20),10,IF(AND(RC[-3]<RC[-1],RC[-3]>=20,RC[-3]<21),5,IF(AND(RC[-3]<RC[-1],RC[-3]>=21),0,IF(AND(RC[-3]>RC[-1],RC[-3]>=2,RC[-3]<3),90,IF(AND(RC[-3]>RC[-1],RC[-3]>=3,RC[-3]<4),90,IF(AND(RC[-3]>RC[-1],RC[-3]>=4,RC[-3]<5),80,IF(AND(RC[-3]>RC[-1],RC[-3]>=5,RC[-3]<6),70,IF(AND(RC[-3]>RC[-1],RC[-3]>=6,RC[-3]<7),60,IF(AND(RC[-3]>RC[-1],RC[-3]>=7,RC[-3]<8),50,IF(AND(RC[-3]>RC[-1],RC[-3]>=8,RC[-3]<9),40,IF(AND(RC[-3]>RC[-1],RC[-3]>=9,RC[-3]<10),30,IF(AND(RC[-3]>RC[-1],RC[-3]>=10,RC[-3]<11),20,IF(AND(RC[-3]>RC[-1],RC[-3]>=11,RC[-3]<12),10,IF(AND(RC[-3]>RC[-1],RC[-3]>=12),0))))))))))))))))))))))))))))))))) -> 70 | H727: =IF(RC[-3]="","",IF(RC[-3]<0.3,100,IF(AND(RC[-3]>=0.3,RC[-3]>0.4),95,IF(AND(RC[-3]>=0.4,RC[-3]<0.5),90,IF(AND(RC[-3]>=0.5,RC[-3]<0.6),85,IF(AND(RC[-3]>=0.6,RC[-3]<0.7),80,IF(AND(RC[-3]>=0.6,RC[-3]<1),80,IF(AND(RC[-3]>1,RC[-3]<2),50,IF(RC[-3]>2,0))))))))) -> 95 | I727: =IF(RC[-1]="",RC[-2],0.7*RC[-1]+0.3*RC[-2]) -> 87.5
A728: سر. نیروگاهی ایران سنا | B728: وسنا | C728: =VLOOKUP(RC[-1],Sheet1!R3C2:R802C3,2,FALSE) -> واسطه گریهای مالی و پولی | D728: =VLOOKUP(RC[-2],Sheet1!R3C2:R802C9,8,FALSE) -> 24.303657799368413 | E728: =IF(VLOOKUP(RC[-3],Sheet1!R3C2:R803C11,10,FALSE)=0,"",VLOOKUP(Sheet2!RC[-3],Sheet1!R[1]C[-3]:R[801]C[6],10,FALSE)) -> 1 | F728: =Sheet1!R798C10 -> 18.05532147750397 | G728: =IF(RC[-3]<0,0,IF(AND(RC[-3]<RC[-1],RC[-3]<2),100,IF(AND(RC[-3]<RC[-1],RC[-3]>=2,RC[-3]<3),95,IF(AND(RC[-3]<RC[-1],RC[-3]>=3,RC[-3]<4),90,IF(AND(RC[-3]<RC[-1],RC[-3]>=4,RC[-3]<5),85,IF(AND(RC[-3]<RC[-1],RC[-3]>=5,RC[-3]<6),80,IF(AND(RC[-3]<RC[-1],RC[-3]>=6,RC[-3]<7),75,IF(AND(RC[-3]<RC[-1],RC[-3]>=7,RC[-3]<8),70,IF(AND(RC[-3]<RC[-1],RC[-3]>=8,RC[-3]<9),65,IF(AND(RC[-3]<RC[-1],RC[-3]>=9,RC[-3]<10),60,IF(AND(RC[-3]<RC[-1],RC[-3]>=10,RC[-3]<11),55,IF(AND(RC[-3]<RC[-1],RC[-3]>=11,RC[-3]<12),50,IF(AND(RC[-3]<RC[-1],RC[-3]>=12,RC[-3]<13),45,IF(AND(RC[-3]<RC[-1],RC[-3]>=13,RC[-3]<14),40,IF(AND(RC[-3]<RC[-1],RC[-3]>=14,RC[-3]<15),35,IF(AND(RC[-3]<RC[-1],RC[-3]>=15,RC[-3]<16),30,IF(AND(RC[-3]<RC[-1],RC[-3]>=16,RC[-3]<17),25,IF(AND(RC[-3]<RC[-1],RC[-3]>=17,RC[-3]<18),20,IF(AND(RC[-3]<RC[-1],RC[-3]>=18,RC[-3]<19),15,IF(AND(RC[-3]<RC[-1],RC[-3]>=19,RC[-3]<20),10,IF(AND(RC[-3]<RC[-1],RC[-3]>=20,RC[-3]<21),5,IF(AND(RC[-3]<RC[-1],RC[-3]>=21),0,IF(AND(RC[-3]>RC[-1],RC[-3]>=2,RC[-3]<3),90,IF(AND(RC[-3]>RC[-1],RC[-3]>=3,RC[-3]<4),90,IF(AND(RC[-3]>RC[-1],RC[-3]>=4,RC[-3]<5),80,IF(AND(RC[-3]>RC[-1],RC[-3]>=5,RC[-3]<6),70,IF(AND(RC[-3]>RC[-1],RC[-3]>=6,RC[-3]<7),60,IF(AND(RC[-3]>RC[-1],RC[-3]>=7,RC[-3]<8),50,IF(AND(RC[-3]>RC[-1],RC[-3]>=8,RC[-3]<9),40,IF(AND(RC[-3]>RC[-1],RC[-3]>=9,RC[-3]<10),30,IF(AND(RC[-3]>RC[-1],RC[-3]>=10,RC[-3]<11),20,IF(AND(RC[-3]>RC[-1],RC[-3]>=11,RC[-3]<12),10,IF(AND(RC[-3]>RC[-1],RC[-3]>=12),0))))))))))))))))))))))))))))))))) -> 0 | H728: =IF(RC[-3]="","",IF(RC[-3]<0.3,100,IF(AND(RC[-3]>=0.3,RC[-3]>0.4),95,IF(AND(RC[-3]>=0.4,RC[-3]<0.5),90,IF(AND(RC[-3]>=0.5,RC[-3]<0.6),85,IF(AND(RC[-3]>=0.6,RC[-3]<0.7),80,IF(AND(RC[-3]>=0.6,RC[-3]<1),80,IF(AND(RC[-3]>1,RC[-3]<2),50,IF(RC[-3]>2,0))))))))) -> 95 | I728: =IF(RC[-1]="",RC[-2],0.7*RC[-1]+0.3*RC[-2]) -> 66.5
A729: سر. وثوق امین | B729: وثوق | C729: =VLOOKUP(RC[-1],Sheet1!R3C2:R802C3,2,FALSE) -> واسطه گریهای مالی و پولی | D729: =VLOOKUP(RC[-2],Sheet1!R3C2:R802C9,8,FALSE) -> 48.065564154255398 | E729: =IF(VLOOKUP(RC[-3],Sheet1!R3C2:R803C11,10,FALSE)=0,"",VLOOKUP(Sheet2!RC[-3],Sheet1!R[1]C[-3]:R[801]C[6],10,FALSE)) ->  | F729: =Sheet1!R798C10 -> 18.05532147750397 | G729: =IF(RC[-3]<0,0,IF(AND(RC[-3]<RC[-1],RC[-3]<2),100,IF(AND(RC[-3]<RC[-1],RC[-3]>=2,RC[-3]<3),95,IF(AND(RC[-3]<RC[-1],RC[-3]>=3,RC[-3]<4),90,IF(AND(RC[-3]<RC[-1],RC[-3]>=4,RC[-3]<5),85,IF(AND(RC[-3]<RC[-1],RC[-3]>=5,RC[-3]<6),80,IF(AND(RC[-3]<RC[-1],RC[-3]>=6,RC[-3]<7),75,IF(AND(RC[-3]<RC[-1],RC[-3]>=7,RC[-3]<8),70,IF(AND(RC[-3]<RC[-1],RC[-3]>=8,RC[-3]<9),65,IF(AND(RC[-3]<RC[-1],RC[-3]>=9,RC[-3]<10),60,IF(AND(RC[-3]<RC[-1],RC[-3]>=10,RC[-3]<11),55,IF(AND(RC[-3]<RC[-1],RC[-3]>=11,RC[-3]<12),50,IF(AND(RC[-3]<RC[-1],RC[-3]>=12,RC[-3]<13),45,IF(AND(RC[-3]<RC[-1],RC[-3]>=13,RC[-3]<14),40,IF(AND(RC[-3]<RC[-1],RC[-3]>=14,RC[-3]<15),35,IF(AND(RC[-3]<RC[-1],RC[-3]>=15,RC[-3]<16),30,IF(AND(RC[-3]<RC[-1],RC[-3]>=16,RC[-3]<17),25,IF(AND(RC[-3]<RC[-1],RC[-3]>=17,RC[-3]<18),20,IF(AND(RC[-3]<RC[-1],RC[-3]>=18,RC[-3]<19),15,IF(AND(RC[-3]<RC[-1],RC[-3]>=19,RC[-3]<20),10,IF(AND(RC[-3]<RC[-1],RC[-3]>=20,RC[-3]<21),5,IF(AND(RC[-3]<RC[-1],RC[-3]>=21),0,IF(AND(RC[-3]>RC[-1],RC[-3]>=2,RC[-3]<3),90,IF(AND(RC[-3]>RC[-1],RC[-3]>=3,RC[-3]<4),90,IF(AND(RC[-3]>RC[-1],RC[-3]>=4,RC[-3]<5),80,IF(AND(RC[-3]>RC[-1],RC[-3]>=5,RC[-3]<6),70,IF(AND(RC[-3]>RC[-1],RC[-3]>=6,RC[-3]<7),60,IF(AND(RC[-3]>RC[-1],RC[-3]>=7,RC[-3]<8),50,IF(AND(RC[-3]>RC[-1],RC[-3]>=8,RC[-3]<9),40,IF(AND(RC[-3]>RC[-1],RC[-3]>=9,RC[-3]<10),30,IF(AND(RC[-3]>RC[-1],RC[-3]>=10,RC[-3]<11),20,IF(AND(RC[-3]>RC[-1],RC[-3]>=11,RC[-3]<12),10,IF(AND(RC[-3]>RC[-1],RC[-3]>=12),0))))))))))))))))))))))))))))))))) -> 0 | H729: =IF(RC[-3]="","",IF(RC[-3]<0.3,100,IF(AND(RC[-3]>=0.3,RC[-3]>0.4),95,IF(AND(RC[-3]>=0.4,RC[-3]<0.5),90,IF(AND(RC[-3]>=0.5,RC[-3]<0.6),85,IF(AND(RC[-3]>=0.6,RC[-3]<0.7),80,IF(AND(RC[-3]>=0.6,RC[-3]<1),80,IF(AND(RC[-3]>1,RC[-3]<2),50,IF(RC[-3]>2,0))))))))) ->  | I729: =IF(RC[-1]="",RC[-2],0.7*RC[-1]+0.3*RC[-2]) -> 0
A730: لیزینگ آریادانا | B730: ولانا | C730: =VLOOKUP(RC[-1],Sheet1!R3C2:R802C3,2,FALSE) -> واسطه گریهای مالی و پولی | D730: =VLOOKUP(RC[-2],Sheet1!R3C2:R802C9,8,FALSE) -> 29.277541411362758 | E730: =IF(VLOOKUP(RC[-3],Sheet1!R3C2:R803C11,10,FALSE)=0,"",VLOOKUP(Sheet2!RC[-3],Sheet1!R[1]C[-3]:R[801]C[6],10,FALSE)) ->  | F730: =Sheet1!R798C10 -> 18.05532147750397 | G730: =IF(RC[-3]<0,0,IF(AND(RC[-3]<RC[-1],RC[-3]<2),100,IF(AND(RC[-3]<RC[-1],RC[-3]>=2,RC[-3]<3),95,IF(AND(RC[-3]<RC[-1],RC[-3]>=3,RC[-3]<4),90,IF(AND(RC[-3]<RC[-1],RC[-3]>=4,RC[-3]<5),85,IF(AND(RC[-3]<RC[-1],RC[-3]>=5,RC[-3]<6),80,IF(AND(RC[-3]<RC[-1],RC[-3]>=6,RC[-3]<7),75,IF(AND(RC[-3]<RC[-1],RC[-3]>=7,RC[-3]<8),70,IF(AND(RC[-3]<RC[-1],RC[-3]>=8,RC[-3]<9),65,IF(AND(RC[-3]<RC[-1],RC[-3]>=9,RC[-3]<10),60,IF(AND(RC[-3]<RC[-1],RC[-3]>=10,RC[-3]<11),55,IF(AND(RC[-3]<RC[-1],RC[-3]>=11,RC[-3]<12),50,IF(AND(RC[-3]<RC[-1],RC[-3]>=12,RC[-3]<13),45,IF(AND(RC[-3]<RC[-1],RC[-3]>=13,RC[-3]<14),40,IF(AND(RC[-3]<RC[-1],RC[-3]>=14,RC[-3]<15),35,IF(AND(RC[-3]<RC[-1],RC[-3]>=15,RC[-3]<16),30,IF(AND(RC[-3]<RC[-1],RC[-3]>=16,RC[-3]<17),25,IF(AND(RC[-3]<RC[-1],RC[-3]>=17,RC[-3]<18),20,IF(AND(RC[-3]<RC[-1],RC[-3]>=18,RC[-3]<19),15,IF(AND(RC[-3]<RC[-1],RC[-3]>=19,RC[-3]<20),10,IF(AND(RC[-3]<RC[-1],RC[-3]>=20,RC[-3]<21),5,IF(AND(RC[-3]<RC[-1],RC[-3]>=21),0,IF(AND(RC[-3]>RC[-1],RC[-3]>=2,RC[-3]<3),90,IF(AND(RC[-3]>RC[-1],RC[-3]>=3,RC[-3]<4),90,IF(AND(RC[-3]>RC[-1],RC[-3]>=4,RC[-3]<5),80,IF(AND(RC[-3]>RC[-1],RC[-3]>=5,RC[-3]<6),70,IF(AND(RC[-3]>RC[-1],RC[-3]>=6,RC[-3]<7),60,IF(AND(RC[-3]>RC[-1],RC[-3]>=7,RC[-3]<8),50,IF(AND(RC[-3]>RC[-1],RC[-3]>=8,RC[-3]<9),40,IF(AND(RC[-3]>RC[-1],RC[-3]>=9,RC[-3]<10),30,IF(AND(RC[-3]>RC[-1],RC[-3]>=10,RC[-3]<11),20,IF(AND(RC[-3]>RC[-1],RC[-3]>=11,RC[-3]<12),10,IF(AND(RC[-3]>RC[-1],RC[-3]>=12),0))))))))))))))))))))))))))))))))) -> 0 | H730: =IF(RC[-3]="","",IF(RC[-3]<0.3,100,IF(AND(RC[-3]>=0.3,RC[-3]>0.4),95,IF(AND(RC[-3]>=0.4,RC[-3]<0.5),90,IF(AND(RC[-3]>=0.5,RC[-3]<0.6),85,IF(AND(RC[-3]>=0.6,RC[-3]<0.7),80,IF(AND(RC[-3]>=0.6,RC[-3]<1),80,IF(AND(RC[-3]>1,RC[-3]<2),50,IF(RC[-3]>2,0))))))))) ->  | I730: =IF(RC[-1]="",RC[-2],0.7*RC[-1]+0.3*RC[-2]) -> 0
A731: لیزینگ ایران | B731: ولیز | C731: =VLOOKUP(RC[-1],Sheet1!R3C2:R802C3,2,FALSE) -> واسطه گریهای مالی و پولی | D731: =VLOOKUP(RC[-2],Sheet1!R3C2:R802C9,8,FALSE) -> -0.63882165605095542 | E731: =IF(VLOOKUP(RC[-3],Sheet1!R3C2:R803C11,10,FALSE)=0,"",VLOOKUP(Sheet2!RC[-3],Sheet1!R[1]C[-3]:R[801]C[6],10,FALSE)) ->  | F731: =Sheet1!R798C10 -> 18.05532147750397 | G731: =IF(RC[-3]<0,0,IF(AND(RC[-3]<RC[-1],RC[-3]<2),100,IF(AND(RC[-3]<RC[-1],RC[-3]>=2,RC[-3]<3),95,IF(AND(RC[-3]<RC[-1],RC[-3]>=3,RC[-3]<4),90,IF(AND(RC[-3]<RC[-1],RC[-3]>=4,RC[-3]<5),85,IF(AND(RC[-3]<RC[-1],RC[-3]>=5,RC[-3]<6),80,IF(AND(RC[-3]<RC[-1],RC[-3]>=6,RC[-3]<7),75,IF(AND(RC[-3]<RC[-1],RC[-3]>=7,RC[-3]<8),70,IF(AND(RC[-3]<RC[-1],RC[-3]>=8,RC[-3]<9),65,IF(AND(RC[-3]<RC[-1],RC[-3]>=9,RC[-3]<10),60,IF(AND(RC[-3]<RC[-1],RC[-3]>=10,RC[-3]<11),55,IF(AND(RC[-3]<RC[-1],RC[-3]>=11,RC[-3]<12),50,IF(AND(RC[-3]<RC[-1],RC[-3]>=12,RC[-3]<13),45,IF(AND(RC[-3]<RC[-1],RC[-3]>=13,RC[-3]<14),40,IF(AND(RC[-3]<RC[-1],RC[-3]>=14,RC[-3]<15),35,IF(AND(RC[-3]<RC[-1],RC[-3]>=15,RC[-3]<16),30,IF(AND(RC[-3]<RC[-1],RC[-3]>=16,RC[-3]<17),25,IF(AND(RC[-3]<RC[-1],RC[-3]>=17,RC[-3]<18),20,IF(AND(RC[-3]<RC[-1],RC[-3]>=18,RC[-3]<19),15,IF(AND(RC[-3]<RC[-1],RC[-3]>=19,RC[-3]<20),10,IF(AND(RC[-3]<RC[-1],RC[-3]>=20,RC[-3]<21),5,IF(AND(RC[-3]<RC[-1],RC[-3]>=21),0,IF(AND(RC[-3]>RC[-1],RC[-3]>=2,RC[-3]<3),90,IF(AND(RC[-3]>RC[-1],RC[-3]>=3,RC[-3]<4),90,IF(AND(RC[-3]>RC[-1],RC[-3]>=4,RC[-3]<5),80,IF(AND(RC[-3]>RC[-1],RC[-3]>=5,RC[-3]<6),70,IF(AND(RC[-3]>RC[-1],RC[-3]>=6,RC[-3]<7),60,IF(AND(RC[-3]>RC[-1],RC[-3]>=7,RC[-3]<8),50,IF(AND(RC[-3]>RC[-1],RC[-3]>=8,RC[-3]<9),40,IF(AND(RC[-3]>RC[-1],RC[-3]>=9,RC[-3]<10),30,IF(AND(RC[-3]>RC[-1],RC[-3]>=10,RC[-3]<11),20,IF(AND(RC[-3]>RC[-1],RC[-3]>=11,RC[-3]<12),10,IF(AND(RC[-3]>RC[-1],RC[-3]>=12),0))))))))))))))))))))))))))))))))) -> 0 | H731: =IF(RC[-3]="","",IF(RC[-3]<0.3,100,IF(AND(RC[-3]>=0.3,RC[-3]>0.4),95,IF(AND(RC[-3]>=0.4,RC[-3]<0.5),90,IF(AND(RC[-3]>=0.5,RC[-3]<0.6),85,IF(AND(RC[-3]>=0.6,RC[-3]<0.7),80,IF(AND(RC[-3]>=0.6,RC[-3]<1),80,IF(AND(RC[-3]>1,RC[-3]<2),50,IF(RC[-3]>2,0))))))))) ->  | I731: =IF(RC[-1]="",RC[-2],0.7*RC[-1]+0.3*RC[-2]) -> 0
A732: لیزینگ ایران و شرق | B732: ولشرق | C732: =VLOOKUP(RC[-1],Sheet1!R3C2:R802C3,2,FALSE) -> واسطه گریهای مالی و پولی | D732: =VLOOKUP(RC[-2],Sheet1!R3C2:R802C9,8,FALSE) -> 10.45264946908509 | E732: =IF(VLOOKUP(RC[-3],Sheet1!R3C2:R803C11,10,FALSE)=0,"",VLOOKUP(Sheet2!RC[-3],Sheet1!R[1]C[-3]:R[801]C[6],10,FALSE)) ->  | F732: =Sheet1!R798C10 -> 18.05532147750397 | G732: =IF(RC[-3]<0,0,IF(AND(RC[-3]<RC[-1],RC[-3]<2),100,IF(AND(RC[-3]<RC[-1],RC[-3]>=2,RC[-3]<3),95,IF(AND(RC[-3]<RC[-1],RC[-3]>=3,RC[-3]<4),90,IF(AND(RC[-3]<RC[-1],RC[-3]>=4,RC[-3]<5),85,IF(AND(RC[-3]<RC[-1],RC[-3]>=5,RC[-3]<6),80,IF(AND(RC[-3]<RC[-1],RC[-3]>=6,RC[-3]<7),75,IF(AND(RC[-3]<RC[-1],RC[-3]>=7,RC[-3]<8),70,IF(AND(RC[-3]<RC[-1],RC[-3]>=8,RC[-3]<9),65,IF(AND(RC[-3]<RC[-1],RC[-3]>=9,RC[-3]<10),60,IF(AND(RC[-3]<RC[-1],RC[-3]>=10,RC[-3]<11),55,IF(AND(RC[-3]<RC[-1],RC[-3]>=11,RC[-3]<12),50,IF(AND(RC[-3]<RC[-1],RC[-3]>=12,RC[-3]<13),45,IF(AND(RC[-3]<RC[-1],RC[-3]>=13,RC[-3]<14),40,IF(AND(RC[-3]<RC[-1],RC[-3]>=14,RC[-3]<15),35,IF(AND(RC[-3]<RC[-1],RC[-3]>=15,RC[-3]<16),30,IF(AND(RC[-3]<RC[-1],RC[-3]>=16,RC[-3]<17),25,IF(AND(RC[-3]<RC[-1],RC[-3]>=17,RC[-3]<18),20,IF(AND(RC[-3]<RC[-1],RC[-3]>=18,RC[-3]<19),15,IF(AND(RC[-3]<RC[-1],RC[-3]>=19,RC[-3]<20),10,IF(AND(RC[-3]<RC[-1],RC[-3]>=20,RC[-3]<21),5,IF(AND(RC[-3]<RC[-1],RC[-3]>=21),0,IF(AND(RC[-3]>RC[-1],RC[-3]>=2,RC[-3]<3),90,IF(AND(RC[-3]>RC[-1],RC[-3]>=3,RC[-3]<4),90,IF(AND(RC[-3]>RC[-1],RC[-3]>=4,RC[-3]<5),80,IF(AND(RC[-3]>RC[-1],RC[-3]>=5,RC[-3]<6),70,IF(AND(RC[-3]>RC[-1],RC[-3]>=6,RC[-3]<7),60,IF(AND(RC[-3]>RC[-1],RC[-3]>=7,RC[-3]<8),50,IF(AND(RC[-3]>RC[-1],RC[-3]>=8,RC[-3]<9),40,IF(AND(RC[-3]>RC[-1],RC[-3]>=9,RC[-3]<10),30,IF(AND(RC[-3]>RC[-1],RC[-3]>=10,RC[-3]<11),20,IF(AND(RC[-3]>RC[-1],RC[-3]>=11,RC[-3]<12),10,IF(AND(RC[-3]>RC[-1],RC[-3]>=12),0))))))))))))))))))))))))))))))))) -> 55 | H732: =IF(RC[-3]="","",IF(RC[-3]<0.3,100,IF(AND(RC[-3]>=0.3,RC[-3]>0.4),95,IF(AND(RC[-3]>=0.4,RC[-3]<0.5),90,IF(AND(RC[-3]>=0.5,RC[-3]<0.6),85,IF(AND(RC[-3]>=0.6,RC[-3]<0.7),80,IF(AND(RC[-3]>=0.6,RC[-3]<1),80,IF(AND(RC[-3]>1,RC[-3]<2),50,IF(RC[-3]>2,0))))))))) ->  | I732: =IF(RC[-1]="",RC[-2],0.7*RC[-1]+0.3*RC[-2]) -> 55
A733: لیزینگ ایرانیان | B733: وایران | C733: =VLOOKUP(RC[-1],Sheet1!R3C2:R802C3,2,FALSE) -> واسطه گریهای مالی و پولی | D733: =VLOOKUP(RC[-2],Sheet1!R3C2:R802C9,8,FALSE) -> 14.968118025174366 | E733: =IF(VLOOKUP(RC[-3],Sheet1!R3C2:R803C11,10,FALSE)=0,"",VLOOKUP(Sheet2!RC[-3],Sheet1!R[1]C[-3]:R[801]C[6],10,FALSE)) ->  | F733: =Sheet1!R798C10 -> 18.05532147750397 | G733: =IF(RC[-3]<0,0,IF(AND(RC[-3]<RC[-1],RC[-3]<2),100,IF(AND(RC[-3]<RC[-1],RC[-3]>=2,RC[-3]<3),95,IF(AND(RC[-3]<RC[-1],RC[-3]>=3,RC[-3]<4),90,IF(AND(RC[-3]<RC[-1],RC[-3]>=4,RC[-3]<5),85,IF(AND(RC[-3]<RC[-1],RC[-3]>=5,RC[-3]<6),80,IF(AND(RC[-3]<RC[-1],RC[-3]>=6,RC[-3]<7),75,IF(AND(RC[-3]<RC[-1],RC[-3]>=7,RC[-3]<8),70,IF(AND(RC[-3]<RC[-1],RC[-3]>=8,RC[-3]<9),65,IF(AND(RC[-3]<RC[-1],RC[-3]>=9,RC[-3]<10),60,IF(AND(RC[-3]<RC[-1],RC[-3]>=10,RC[-3]<11),55,IF(AND(RC[-3]<RC[-1],RC[-3]>=11,RC[-3]<12),50,IF(AND(RC[-3]<RC[-1],RC[-3]>=12,RC[-3]<13),45,IF(AND(RC[-3]<RC[-1],RC[-3]>=13,RC[-3]<14),40,IF(AND(RC[-3]<RC[-1],RC[-3]>=14,RC[-3]<15),35,IF(AND(RC[-3]<RC[-1],RC[-3]>=15,RC[-3]<16),30,IF(AND(RC[-3]<RC[-1],RC[-3]>=16,RC[-3]<17),25,IF(AND(RC[-3]<RC[-1],RC[-3]>=17,RC[-3]<18),20,IF(AND(RC[-3]<RC[-1],RC[-3]>=18,RC[-3]<19),15,IF(AND(RC[-3]<RC[-1],RC[-3]>=19,RC[-3]<20),10,IF(AND(RC[-3]<RC[-1],RC[-3]>=20,RC[-3]<21),5,IF(AND(RC[-3]<RC[-1],RC[-3]>=21),0,IF(AND(RC[-3]>RC[-1],RC[-3]>=2,RC[-3]<3),90,IF(AND(RC[-3]>RC[-1],RC[-3]>=3,RC[-3]<4),90,IF(AND(RC[-3]>RC[-1],RC[-3]>=4,RC[-3]<5),80,IF(AND(RC[-3]>RC[-1],RC[-3]>=5,RC[-3]<6),70,IF(AND(RC[-3]>RC[-1],RC[-3]>=6,RC[-3]<7),60,IF(AND(RC[-3]>RC[-1],RC[-3]>=7,RC[-3]<8),50,IF(AND(RC[-3]>RC[-1],RC[-3]>=8,RC[-3]<9),40,IF(AND(RC[-3]>RC[-1],RC[-3]>=9,RC[-3]<10),30,IF(AND(RC[-3]>RC[-1],RC[-3]>=10,RC[-3]<11),20,IF(AND(RC[-3]>RC[-1],RC[-3]>=11,RC[-3]<12),10,IF(AND(RC[-3]>RC[-1],RC[-3]>=12),0))))))))))))))))))))))))))))))))) -> 35 | H733: =IF(RC[-3]="","",IF(RC[-3]<0.3,100,IF(AND(RC[-3]>=0.3,RC[-3]>0.4),95,IF(AND(RC[-3]>=0.4,RC[-3]<0.5),90,IF(AND(RC[-3]>=0.5,RC[-3]<0.6),85,IF(AND(RC[-3]>=0.6,RC[-3]<0.7),80,IF(AND(RC[-3]>=0.6,RC[-3]<1),80,IF(AND(RC[-3]>1,RC[-3]<2),50,IF(RC[-3]>2,0))))))))) ->  | I733: =IF(RC[-1]="",RC[-2],0.7*RC[-1]+0.3*RC[-2]) -> 35
A734: لیزینگ خودرو غدیر | B734: ولغدر | C734: =VLOOKUP(RC[-1],Sheet1!R3C2:R802C3,2,FALSE) -> واسطه گریهای مالی و پولی | D734: =VLOOKUP(RC[-2],Sheet1!R3C2:R802C9,8,FALSE) -> 7.2552190741699611 | E734: =IF(VLOOKUP(RC[-3],Sheet1!R3C2:R803C11,10,FALSE)=0,"",VLOOKUP(Sheet2!RC[-3],Sheet1!R[1]C[-3]:R[801]C[6],10,FALSE)) ->  | F734: =Sheet1!R798C10 -> 18.05532147750397 | G734: =IF(RC[-3]<0,0,IF(AND(RC[-3]<RC[-1],RC[-3]<2),100,IF(AND(RC[-3]<RC[-1],RC[-3]>=2,RC[-3]<3),95,IF(AND(RC[-3]<RC[-1],RC[-3]>=3,RC[-3]<4),90,IF(AND(RC[-3]<RC[-1],RC[-3]>=4,RC[-3]<5),85,IF(AND(RC[-3]<RC[-1],RC[-3]>=5,RC[-3]<6),80,IF(AND(RC[-3]<RC[-1],RC[-3]>=6,RC[-3]<7),75,IF(AND(RC[-3]<RC[-1],RC[-3]>=7,RC[-3]<8),70,IF(AND(RC[-3]<RC[-1],RC[-3]>=8,RC[-3]<9),65,IF(AND(RC[-3]<RC[-1],RC[-3]>=9,RC[-3]<10),60,IF(AND(RC[-3]<RC[-1],RC[-3]>=10,RC[-3]<11),55,IF(AND(RC[-3]<RC[-1],RC[-3]>=11,RC[-3]<12),50,IF(AND(RC[-3]<RC[-1],RC[-3]>=12,RC[-3]<13),45,IF(AND(RC[-3]<RC[-1],RC[-3]>=13,RC[-3]<14),40,IF(AND(RC[-3]<RC[-1],RC[-3]>=14,RC[-3]<15),35,IF(AND(RC[-3]<RC[-1],RC[-3]>=15,RC[-3]<16),30,IF(AND(RC[-3]<RC[-1],RC[-3]>=16,RC[-3]<17),25,IF(AND(RC[-3]<RC[-1],RC[-3]>=17,RC[-3]<18),20,IF(AND(RC[-3]<RC[-1],RC[-3]>=18,RC[-3]<19),15,IF(AND(RC[-3]<RC[-1],RC[-3]>=19,RC[-3]<20),10,IF(AND(RC[-3]<RC[-1],RC[-3]>=20,RC[-3]<21),5,IF(AND(RC[-3]<RC[-1],RC[-3]>=21),0,IF(AND(RC[-3]>RC[-1],RC[-3]>=2,RC[-3]<3),90,IF(AND(RC[-3]>RC[-1],RC[-3]>=3,RC[-3]<4),90,IF(AND(RC[-3]>RC[-1],RC[-3]>=4,RC[-3]<5),80,IF(AND(RC[-3]>RC[-1],RC[-3]>=5,RC[-3]<6),70,IF(AND(RC[-3]>RC[-1],RC[-3]>=6,RC[-3]<7),60,IF(AND(RC[-3]>RC[-1],RC[-3]>=7,RC[-3]<8),50,IF(AND(RC[-3]>RC[-1],RC[-3]>=8,RC[-3]<9),40,IF(AND(RC[-3]>RC[-1],RC[-3]>=9,RC[-3]<10),30,IF(AND(RC[-3]>RC[-1],RC[-3]>=10,RC[-3]<11),20,IF(AND(RC[-3]>RC[-1],RC[-3]>=11,RC[-3]<12),10,IF(AND(RC[-3]>RC[-1],RC[-3]>=12),0))))))))))))))))))))))))))))))))) -> 70 | H734: =IF(RC[-3]="","",IF(RC[-3]<0.3,100,IF(AND(RC[-3]>=0.3,RC[-3]>0.4),95,IF(AND(RC[-3]>=0.4,RC[-3]<0.5),90,IF(AND(RC[-3]>=0.5,RC[-3]<0.6),85,IF(AND(RC[-3]>=0.6,RC[-3]<0.7),80,IF(AND(RC[-3]>=0.6,RC[-3]<1),80,IF(AND(RC[-3]>1,RC[-3]<2),50,IF(RC[-3]>2,0))))))))) ->  | I734: =IF(RC[-1]="",RC[-2],0.7*RC[-1]+0.3*RC[-2]) -> 70
A735: لیزینگ رازی | B735: ولراز | C735: =VLOOKUP(RC[-1],Sheet1!R3C2:R802C3,2,FALSE) -> واسطه گریهای مالی و پولی | D735: =VLOOKUP(RC[-2],Sheet1!R3C2:R802C9,8,FALSE) -> -185.06944444444446 | E735: =IF(VLOOKUP(RC[-3],Sheet1!R3C2:R803C11,10,FALSE)=0,"",VLOOKUP(Sheet2!RC[-3],Sheet1!R[1]C[-3]:R[801]C[6],10,FALSE)) ->  | F735: =Sheet1!R798C10 -> 18.05532147750397 | G735: =IF(RC[-3]<0,0,IF(AND(RC[-3]<RC[-1],RC[-3]<2),100,IF(AND(RC[-3]<RC[-1],RC[-3]>=2,RC[-3]<3),95,IF(AND(RC[-3]<RC[-1],RC[-3]>=3,RC[-3]<4),90,IF(AND(RC[-3]<RC[-1],RC[-3]>=4,RC[-3]<5),85,IF(AND(RC[-3]<RC[-1],RC[-3]>=5,RC[-3]<6),80,IF(AND(RC[-3]<RC[-1],RC[-3]>=6,RC[-3]<7),75,IF(AND(RC[-3]<RC[-1],RC[-3]>=7,RC[-3]<8),70,IF(AND(RC[-3]<RC[-1],RC[-3]>=8,RC[-3]<9),65,IF(AND(RC[-3]<RC[-1],RC[-3]>=9,RC[-3]<10),60,IF(AND(RC[-3]<RC[-1],RC[-3]>=10,RC[-3]<11),55,IF(AND(RC[-3]<RC[-1],RC[-3]>=11,RC[-3]<12),50,IF(AND(RC[-3]<RC[-1],RC[-3]>=12,RC[-3]<13),45,IF(AND(RC[-3]<RC[-1],RC[-3]>=13,RC[-3]<14),40,IF(AND(RC[-3]<RC[-1],RC[-3]>=14,RC[-3]<15),35,IF(AND(RC[-3]<RC[-1],RC[-3]>=15,RC[-3]<16),30,IF(AND(RC[-3]<RC[-1],RC[-3]>=16,RC[-3]<17),25,IF(AND(RC[-3]<RC[-1],RC[-3]>=17,RC[-3]<18),20,IF(AND(RC[-3]<RC[-1],RC[-3]>=18,RC[-3]<19),15,IF(AND(RC[-3]<RC[-1],RC[-3]>=19,RC[-3]<20),10,IF(AND(RC[-3]<RC[-1],RC[-3]>=20,RC[-3]<21),5,IF(AND(RC[-3]<RC[-1],RC[-3]>=21),0,IF(AND(RC[-3]>RC[-1],RC[-3]>=2,RC[-3]<3),90,IF(AND(RC[-3]>RC[-1],RC[-3]>=3,RC[-3]<4),90,IF(AND(RC[-3]>RC[-1],RC[-3]>=4,RC[-3]<5),80,IF(AND(RC[-3]>RC[-1],RC[-3]>=5,RC[-3]<6),70,IF(AND(RC[-3]>RC[-1],RC[-3]>=6,RC[-3]<7),60,IF(AND(RC[-3]>RC[-1],RC[-3]>=7,RC[-3]<8),50,IF(AND(RC[-3]>RC[-1],RC[-3]>=8,RC[-3]<9),40,IF(AND(RC[-3]>RC[-1],RC[-3]>=9,RC[-3]<10),30,IF(AND(RC[-3]>RC[-1],RC[-3]>=10,RC[-3]<11),20,IF(AND(RC[-3]>RC[-1],RC[-3]>=11,RC[-3]<12),10,IF(AND(RC[-3]>RC[-1],RC[-3]>=12),0))))))))))))))))))))))))))))))))) -> 0 | H735: =IF(RC[-3]="","",IF(RC[-3]<0.3,100,IF(AND(RC[-3]>=0.3,RC[-3]>0.4),95,IF(AND(RC[-3]>=0.4,RC[-3]<0.5),90,IF(AND(RC[-3]>=0.5,RC[-3]<0.6),85,IF(AND(RC[-3]>=0.6,RC[-3]<0.7),80,IF(AND(RC[-3]>=0.6,RC[-3]<1),80,IF(AND(RC[-3]>1,RC[-3]<2),50,IF(RC[-3]>2,0))))))))) ->  | I735: =IF(RC[-1]="",RC[-2],0.7*RC[-1]+0.3*RC[-2]) -> 0
A736: لیزینگ رایان سایپا | B736: ولساپا | C736: =VLOOKUP(RC[-1],Sheet1!R3C2:R802C3,2,FALSE) -> واسطه گریهای مالی و پولی | D736: =VLOOKUP(RC[-2],Sheet1!R3C2:R802C9,8,FALSE) -> 3.5272212123012583 | E736: =IF(VLOOKUP(RC[-3],Sheet1!R3C2:R803C11,10,FALSE)=0,"",VLOOKUP(Sheet2!RC[-3],Sheet1!R[1]C[-3]:R[801]C[6],10,FALSE)) ->  | F736: =Sheet1!R798C10 -> 18.05532147750397 | G736: =IF(RC[-3]<0,0,IF(AND(RC[-3]<RC[-1],RC[-3]<2),100,IF(AND(RC[-3]<RC[-1],RC[-3]>=2,RC[-3]<3),95,IF(AND(RC[-3]<RC[-1],RC[-3]>=3,RC[-3]<4),90,IF(AND(RC[-3]<RC[-1],RC[-3]>=4,RC[-3]<5),85,IF(AND(RC[-3]<RC[-1],RC[-3]>=5,RC[-3]<6),80,IF(AND(RC[-3]<RC[-1],RC[-3]>=6,RC[-3]<7),75,IF(AND(RC[-3]<RC[-1],RC[-3]>=7,RC[-3]<8),70,IF(AND(RC[-3]<RC[-1],RC[-3]>=8,RC[-3]<9),65,IF(AND(RC[-3]<RC[-1],RC[-3]>=9,RC[-3]<10),60,IF(AND(RC[-3]<RC[-1],RC[-3]>=10,RC[-3]<11),55,IF(AND(RC[-3]<RC[-1],RC[-3]>=11,RC[-3]<12),50,IF(AND(RC[-3]<RC[-1],RC[-3]>=12,RC[-3]<13),45,IF(AND(RC[-3]<RC[-1],RC[-3]>=13,RC[-3]<14),40,IF(AND(RC[-3]<RC[-1],RC[-3]>=14,RC[-3]<15),35,IF(AND(RC[-3]<RC[-1],RC[-3]>=15,RC[-3]<16),30,IF(AND(RC[-3]<RC[-1],RC[-3]>=16,RC[-3]<17),25,IF(AND(RC[-3]<RC[-1],RC[-3]>=17,RC[-3]<18),20,IF(AND(RC[-3]<RC[-1],RC[-3]>=18,RC[-3]<19),15,IF(AND(RC[-3]<RC[-1],RC[-3]>=19,RC[-3]<20),10,IF(AND(RC[-3]<RC[-1],RC[-3]>=20,RC[-3]<21),5,IF(AND(RC[-3]<RC[-1],RC[-3]>=21),0,IF(AND(RC[-3]>RC[-1],RC[-3]>=2,RC[-3]<3),90,IF(AND(RC[-3]>RC[-1],RC[-3]>=3,RC[-3]<4),90,IF(AND(RC[-3]>RC[-1],RC[-3]>=4,RC[-3]<5),80,IF(AND(RC[-3]>RC[-1],RC[-3]>=5,RC[-3]<6),70,IF(AND(RC[-3]>RC[-1],RC[-3]>=6,RC[-3]<7),60,IF(AND(RC[-3]>RC[-1],RC[-3]>=7,RC[-3]<8),50,IF(AND(RC[-3]>RC[-1],RC[-3]>=8,RC[-3]<9),40,IF(AND(RC[-3]>RC[-1],RC[-3]>=9,RC[-3]<10),30,IF(AND(RC[-3]>RC[-1],RC[-3]>=10,RC[-3]<11),20,IF(AND(RC[-3]>RC[-1],RC[-3]>=11,RC[-3]<12),10,IF(AND(RC[-3]>RC[-1],RC[-3]>=12),0))))))))))))))))))))))))))))))))) -> 90 | H736: =IF(RC[-3]="","",IF(RC[-3]<0.3,100,IF(AND(RC[-3]>=0.3,RC[-3]>0.4),95,IF(AND(RC[-3]>=0.4,RC[-3]<0.5),90,IF(AND(RC[-3]>=0.5,RC[-3]<0.6),85,IF(AND(RC[-3]>=0.6,RC[-3]<0.7),80,IF(AND(RC[-3]>=0.6,RC[-3]<1),80,IF(AND(RC[-3]>1,RC[-3]<2),50,IF(RC[-3]>2,0))))))))) ->  | I736: =IF(RC[-1]="",RC[-2],0.7*RC[-1]+0.3*RC[-2]) -> 90
A737: لیزینگ صنعت و معدن | B737: ولصنم | C737: =VLOOKUP(RC[-1],Sheet1!R3C2:R802C3,2,FALSE) -> واسطه گریهای مالی و پولی | D737: =VLOOKUP(RC[-2],Sheet1!R3C2:R802C9,8,FALSE) -> 6.5993766912332124 | E737: =IF(VLOOKUP(RC[-3],Sheet1!R3C2:R803C11,10,FALSE)=0,"",VLOOKUP(Sheet2!RC[-3],Sheet1!R[1]C[-3]:R[801]C[6],10,FALSE)) ->  | F737: =Sheet1!R798C10 -> 18.05532147750397 | G737: =IF(RC[-3]<0,0,IF(AND(RC[-3]<RC[-1],RC[-3]<2),100,IF(AND(RC[-3]<RC[-1],RC[-3]>=2,RC[-3]<3),95,IF(AND(RC[-3]<RC[-1],RC[-3]>=3,RC[-3]<4),90,IF(AND(RC[-3]<RC[-1],RC[-3]>=4,RC[-3]<5),85,IF(AND(RC[-3]<RC[-1],RC[-3]>=5,RC[-3]<6),80,IF(AND(RC[-3]<RC[-1],RC[-3]>=6,RC[-3]<7),75,IF(AND(RC[-3]<RC[-1],RC[-3]>=7,RC[-3]<8),70,IF(AND(RC[-3]<RC[-1],RC[-3]>=8,RC[-3]<9),65,IF(AND(RC[-3]<RC[-1],RC[-3]>=9,RC[-3]<10),60,IF(AND(RC[-3]<RC[-1],RC[-3]>=10,RC[-3]<11),55,IF(AND(RC[-3]<RC[-1],RC[-3]>=11,RC[-3]<12),50,IF(AND(RC[-3]<RC[-1],RC[-3]>=12,RC[-3]<13),45,IF(AND(RC[-3]<RC[-1],RC[-3]>=13,RC[-3]<14),40,IF(AND(RC[-3]<RC[-1],RC[-3]>=14,RC[-3]<15),35,IF(AND(RC[-3]<RC[-1],RC[-3]>=15,RC[-3]<16),30,IF(AND(RC[-3]<RC[-1],RC[-3]>=16,RC[-3]<17),25,IF(AND(RC[-3]<RC[-1],RC[-3]>=17,RC[-3]<18),20,IF(AND(RC[-3]<RC[-1],RC[-3]>=18,RC[-3]<19),15,IF(AND(RC[-3]<RC[-1],RC[-3]>=19,RC[-3]<20),10,IF(AND(RC[-3]<RC[-1],RC[-3]>=20,RC[-3]<21),5,IF(AND(RC[-3]<RC[-1],RC[-3]>=21),0,IF(AND(RC[-3]>RC[-1],RC[-3]>=2,RC[-3]<3),90,IF(AND(RC[-3]>RC[-1],RC[-3]>=3,RC[-3]<4),90,IF(AND(RC[-3]>RC[-1],RC[-3]>=4,RC[-3]<5),80,IF(AND(RC[-3]>RC[-1],RC[-3]>=5,RC[-3]<6),70,IF(AND(RC[-3]>RC[-1],RC[-3]>=6,RC[-3]<7),60,IF(AND(RC[-3]>RC[-1],RC[-3]>=7,RC[-3]<8),50,IF(AND(RC[-3]>RC[-1],RC[-3]>=8,RC[-3]<9),40,IF(AND(RC[-3]>RC[-1],RC[-3]>=9,RC[-3]<10),30,IF(AND(RC[-3]>RC[-1],RC[-3]>=10,RC[-3]<11),20,IF(AND(RC[-3]>RC[-1],RC[-3]>=11,RC[-3]<12),10,IF(AND(RC[-3]>RC[-1],RC[-3]>=12),0))))))))))))))))))))))))))))))))) -> 75 | H737: =IF(RC[-3]="","",IF(RC[-3]<0.3,100,IF(AND(RC[-3]>=0.3,RC[-3]>0.4),95,IF(AND(RC[-3]>=0.4,RC[-3]<0.5),90,IF(AND(RC[-3]>=0.5,RC[-3]<0.6),85,IF(AND(RC[-3]>=0.6,RC[-3]<0.7),80,IF(AND(RC[-3]>=0.6,RC[-3]<1),80,IF(AND(RC[-3]>1,RC[-3]<2),50,IF(RC[-3]>2,0))))))))) ->  | I737: =IF(RC[-1]="",RC[-2],0.7*RC[-1]+0.3*RC[-2]) -> 75
A738: مجتمع صنایع و معادن احیاء سپاهان | B738: واحیا | C738: =VLOOKUP(RC[-1],Sheet1!R3C2:R802C3,2,FALSE) -> واسطه گریهای مالی و پولی | D738: =VLOOKUP(RC[-2],Sheet1!R3C2:R802C9,8,FALSE) -> 3.620293290870046 | E738: =IF(VLOOKUP(RC[-3],Sheet1!R3C2:R803C11,10,FALSE)=0,"",VLOOKUP(Sheet2!RC[-3],Sheet1!R[1]C[-3]:R[801]C[6],10,FALSE)) -> 2.5 | F738: =Sheet1!R798C10 -> 18.05532147750397 | G738: =IF(RC[-3]<0,0,IF(AND(RC[-3]<RC[-1],RC[-3]<2),100,IF(AND(RC[-3]<RC[-1],RC[-3]>=2,RC[-3]<3),95,IF(AND(RC[-3]<RC[-1],RC[-3]>=3,RC[-3]<4),90,IF(AND(RC[-3]<RC[-1],RC[-3]>=4,RC[-3]<5),85,IF(AND(RC[-3]<RC[-1],RC[-3]>=5,RC[-3]<6),80,IF(AND(RC[-3]<RC[-1],RC[-3]>=6,RC[-3]<7),75,IF(AND(RC[-3]<RC[-1],RC[-3]>=7,RC[-3]<8),70,IF(AND(RC[-3]<RC[-1],RC[-3]>=8,RC[-3]<9),65,IF(AND(RC[-3]<RC[-1],RC[-3]>=9,RC[-3]<10),60,IF(AND(RC[-3]<RC[-1],RC[-3]>=10,RC[-3]<11),55,IF(AND(RC[-3]<RC[-1],RC[-3]>=11,RC[-3]<12),50,IF(AND(RC[-3]<RC[-1],RC[-3]>=12,RC[-3]<13),45,IF(AND(RC[-3]<RC[-1],RC[-3]>=13,RC[-3]<14),40,IF(AND(RC[-3]<RC[-1],RC[-3]>=14,RC[-3]<15),35,IF(AND(RC[-3]<RC[-1],RC[-3]>=15,RC[-3]<16),30,IF(AND(RC[-3]<RC[-1],RC[-3]>=16,RC[-3]<17),25,IF(AND(RC[-3]<RC[-1],RC[-3]>=17,RC[-3]<18),20,IF(AND(RC[-3]<RC[-1],RC[-3]>=18,RC[-3]<19),15,IF(AND(RC[-3]<RC[-1],RC[-3]>=19,RC[-3]<20),10,IF(AND(RC[-3]<RC[-1],RC[-3]>=20,RC[-3]<21),5,IF(AND(RC[-3]<RC[-1],RC[-3]>=21),0,IF(AND(RC[-3]>RC[-1],RC[-3]>=2,RC[-3]<3),90,IF(AND(RC[-3]>RC[-1],RC[-3]>=3,RC[-3]<4),90,IF(AND(RC[-3]>RC[-1],RC[-3]>=4,RC[-3]<5),80,IF(AND(RC[-3]>RC[-1],RC[-3]>=5,RC[-3]<6),70,IF(AND(RC[-3]>RC[-1],RC[-3]>=6,RC[-3]<7),60,IF(AND(RC[-3]>RC[-1],RC[-3]>=7,RC[-3]<8),50,IF(AND(RC[-3]>RC[-1],RC[-3]>=8,RC[-3]<9),40,IF(AND(RC[-3]>RC[-1],RC[-3]>=9,RC[-3]<10),30,IF(AND(RC[-3]>RC[-1],RC[-3]>=10,RC[-3]<11),20,IF(AND(RC[-3]>RC[-1],RC[-3]>=11,RC[-3]<12),10,IF(AND(RC[-3]>RC[-1],RC[-3]>=12),0))))))))))))))))))))))))))))))))) -> 90 | H738: =IF(RC[-3]="","",IF(RC[-3]<0.3,100,IF(AND(RC[-3]>=0.3,RC[-3]>0.4),95,IF(AND(RC[-3]>=0.4,RC[-3]<0.5),90,IF(AND(RC[-3]>=0.5,RC[-3]<0.6),85,IF(AND(RC[-3]>=0.6,RC[-3]<0.7),80,IF(AND(RC[-3]>=0.6,RC[-3]<1),80,IF(AND(RC[-3]>1,RC[-3]<2),50,IF(RC[-3]>2,0))))))))) -> 95 | I738: =IF(RC[-1]="",RC[-2],0.7*RC[-1]+0.3*RC[-2]) -> 93.5
A739: واسپاری ملت | B739: ولملت | C739: =VLOOKUP(RC[-1],Sheet1!R3C2:R802C3,2,FALSE) -> واسطه گریهای مالی و پولی | D739: =VLOOKUP(RC[-2],Sheet1!R3C2:R802C9,8,FALSE) -> 5.6815929654997195 | E739: =IF(VLOOKUP(RC[-3],Sheet1!R3C2:R803C11,10,FALSE)=0,"",VLOOKUP(Sheet2!RC[-3],Sheet1!R[1]C[-3]:R[801]C[6],10,FALSE)) ->  | F739: =Sheet1!R798C10 -> 18.05532147750397 | G739: =IF(RC[-3]<0,0,IF(AND(RC[-3]<RC[-1],RC[-3]<2),100,IF(AND(RC[-3]<RC[-1],RC[-3]>=2,RC[-3]<3),95,IF(AND(RC[-3]<RC[-1],RC[-3]>=3,RC[-3]<4),90,IF(AND(RC[-3]<RC[-1],RC[-3]>=4,RC[-3]<5),85,IF(AND(RC[-3]<RC[-1],RC[-3]>=5,RC[-3]<6),80,IF(AND(RC[-3]<RC[-1],RC[-3]>=6,RC[-3]<7),75,IF(AND(RC[-3]<RC[-1],RC[-3]>=7,RC[-3]<8),70,IF(AND(RC[-3]<RC[-1],RC[-3]>=8,RC[-3]<9),65,IF(AND(RC[-3]<RC[-1],RC[-3]>=9,RC[-3]<10),60,IF(AND(RC[-3]<RC[-1],RC[-3]>=10,RC[-3]<11),55,IF(AND(RC[-3]<RC[-1],RC[-3]>=11,RC[-3]<12),50,IF(AND(RC[-3]<RC[-1],RC[-3]>=12,RC[-3]<13),45,IF(AND(RC[-3]<RC[-1],RC[-3]>=13,RC[-3]<14),40,IF(AND(RC[-3]<RC[-1],RC[-3]>=14,RC[-3]<15),35,IF(AND(RC[-3]<RC[-1],RC[-3]>=15,RC[-3]<16),30,IF(AND(RC[-3]<RC[-1],RC[-3]>=16,RC[-3]<17),25,IF(AND(RC[-3]<RC[-1],RC[-3]>=17,RC[-3]<18),20,IF(AND(RC[-3]<RC[-1],RC[-3]>=18,RC[-3]<19),15,IF(AND(RC[-3]<RC[-1],RC[-3]>=19,RC[-3]<20),10,IF(AND(RC[-3]<RC[-1],RC[-3]>=20,RC[-3]<21),5,IF(AND(RC[-3]<RC[-1],RC[-3]>=21),0,IF(AND(RC[-3]>RC[-1],RC[-3]>=2,RC[-3]<3),90,IF(AND(RC[-3]>RC[-1],RC[-3]>=3,RC[-3]<4),90,IF(AND(RC[-3]>RC[-1],RC[-3]>=4,RC[-3]<5),80,IF(AND(RC[-3]>RC[-1],RC[-3]>=5,RC[-3]<6),70,IF(AND(RC[-3]>RC[-1],RC[-3]>=6,RC[-3]<7),60,IF(AND(RC[-3]>RC[-1],RC[-3]>=7,RC[-3]<8),50,IF(AND(RC[-3]>RC[-1],RC[-3]>=8,RC[-3]<9),40,IF(AND(RC[-3]>RC[-1],RC[-3]>=9,RC[-3]<10),30,IF(AND(RC[-3]>RC[-1],RC[-3]>=10,RC[-3]<11),20,IF(AND(RC[-3]>RC[-1],RC[-3]>=11,RC[-3]<12),10,IF(AND(RC[-3]>RC[-1],RC[-3]>=12),0))))))))))))))))))))))))))))))))) -> 80 | H739: =IF(RC[-3]="","",IF(RC[-3]<0.3,100,IF(AND(RC[-3]>=0.3,RC[-3]>0.4),95,IF(AND(RC[-3]>=0.4,RC[-3]<0.5),90,IF(AND(RC[-3]>=0.5,RC[-3]<0.6),85,IF(AND(RC[-3]>=0.6,RC[-3]<0.7),80,IF(AND(RC[-3]>=0.6,RC[-3]<1),80,IF(AND(RC[-3]>1,RC[-3]<2),50,IF(RC[-3]>2,0))))))))) ->  | I739: =IF(RC[-1]="",RC[-2],0.7*RC[-1]+0.3*RC[-2]) -> 80
A740: پارس الکتریک | B740: لپارس | C740: =VLOOKUP(RC[-1],Sheet1!R3C2:R802C3,2,FALSE) -> وسایل ارتباطی | D740: =VLOOKUP(RC[-2],Sheet1!R3C2:R802C9,8,FALSE) -> 43.707676141156284 | E740: =IF(VLOOKUP(RC[-3],Sheet1!R3C2:R803C11,10,FALSE)=0,"",VLOOKUP(Sheet2!RC[-3],Sheet1!R[1]C[-3]:R[801]C[6],10,FALSE)) ->  | F740: =Sheet1!R802C10 -> 39.158199426761932 | G740: =IF(RC[-3]<0,0,IF(AND(RC[-3]<RC[-1],RC[-3]<2),100,IF(AND(RC[-3]<RC[-1],RC[-3]>=2,RC[-3]<3),95,IF(AND(RC[-3]<RC[-1],RC[-3]>=3,RC[-3]<4),90,IF(AND(RC[-3]<RC[-1],RC[-3]>=4,RC[-3]<5),85,IF(AND(RC[-3]<RC[-1],RC[-3]>=5,RC[-3]<6),80,IF(AND(RC[-3]<RC[-1],RC[-3]>=6,RC[-3]<7),75,IF(AND(RC[-3]<RC[-1],RC[-3]>=7,RC[-3]<8),70,IF(AND(RC[-3]<RC[-1],RC[-3]>=8,RC[-3]<9),65,IF(AND(RC[-3]<RC[-1],RC[-3]>=9,RC[-3]<10),60,IF(AND(RC[-3]<RC[-1],RC[-3]>=10,RC[-3]<11),55,IF(AND(RC[-3]<RC[-1],RC[-3]>=11,RC[-3]<12),50,IF(AND(RC[-3]<RC[-1],RC[-3]>=12,RC[-3]<13),45,IF(AND(RC[-3]<RC[-1],RC[-3]>=13,RC[-3]<14),40,IF(AND(RC[-3]<RC[-1],RC[-3]>=14,RC[-3]<15),35,IF(AND(RC[-3]<RC[-1],RC[-3]>=15,RC[-3]<16),30,IF(AND(RC[-3]<RC[-1],RC[-3]>=16,RC[-3]<17),25,IF(AND(RC[-3]<RC[-1],RC[-3]>=17,RC[-3]<18),20,IF(AND(RC[-3]<RC[-1],RC[-3]>=18,RC[-3]<19),15,IF(AND(RC[-3]<RC[-1],RC[-3]>=19,RC[-3]<20),10,IF(AND(RC[-3]<RC[-1],RC[-3]>=20,RC[-3]<21),5,IF(AND(RC[-3]<RC[-1],RC[-3]>=21),0,IF(AND(RC[-3]>RC[-1],RC[-3]>=2,RC[-3]<3),90,IF(AND(RC[-3]>RC[-1],RC[-3]>=3,RC[-3]<4),90,IF(AND(RC[-3]>RC[-1],RC[-3]>=4,RC[-3]<5),80,IF(AND(RC[-3]>RC[-1],RC[-3]>=5,RC[-3]<6),70,IF(AND(RC[-3]>RC[-1],RC[-3]>=6,RC[-3]<7),60,IF(AND(RC[-3]>RC[-1],RC[-3]>=7,RC[-3]<8),50,IF(AND(RC[-3]>RC[-1],RC[-3]>=8,RC[-3]<9),40,IF(AND(RC[-3]>RC[-1],RC[-3]>=9,RC[-3]<10),30,IF(AND(RC[-3]>RC[-1],RC[-3]>=10,RC[-3]<11),20,IF(AND(RC[-3]>RC[-1],RC[-3]>=11,RC[-3]<12),10,IF(AND(RC[-3]>RC[-1],RC[-3]>=12),0))))))))))))))))))))))))))))))))) -> 0 | H740: =IF(RC[-3]="","",IF(RC[-3]<0.3,100,IF(AND(RC[-3]>=0.3,RC[-3]>0.4),95,IF(AND(RC[-3]>=0.4,RC[-3]<0.5),90,IF(AND(RC[-3]>=0.5,RC[-3]<0.6),85,IF(AND(RC[-3]>=0.6,RC[-3]<0.7),80,IF(AND(RC[-3]>=0.6,RC[-3]<1),80,IF(AND(RC[-3]>1,RC[-3]<2),50,IF(RC[-3]>2,0))))))))) ->  | I740: =IF(RC[-1]="",RC[-2],0.7*RC[-1]+0.3*RC[-2]) -> 0
A741: صنعتی پیام | B741: لپیام | C741: =VLOOKUP(RC[-1],Sheet1!R3C2:R802C3,2,FALSE) -> وسایل ارتباطی | D741: =VLOOKUP(RC[-2],Sheet1!R3C2:R802C9,8,FALSE) -> 101.34648810496509 | E741: =IF(VLOOKUP(RC[-3],Sheet1!R3C2:R803C11,10,FALSE)=0,"",VLOOKUP(Sheet2!RC[-3],Sheet1!R[1]C[-3]:R[801]C[6],10,FALSE)) -> 1.8 | F741: =Sheet1!R802C10 -> 39.158199426761932 | G741: =IF(RC[-3]<0,0,IF(AND(RC[-3]<RC[-1],RC[-3]<2),100,IF(AND(RC[-3]<RC[-1],RC[-3]>=2,RC[-3]<3),95,IF(AND(RC[-3]<RC[-1],RC[-3]>=3,RC[-3]<4),90,IF(AND(RC[-3]<RC[-1],RC[-3]>=4,RC[-3]<5),85,IF(AND(RC[-3]<RC[-1],RC[-3]>=5,RC[-3]<6),80,IF(AND(RC[-3]<RC[-1],RC[-3]>=6,RC[-3]<7),75,IF(AND(RC[-3]<RC[-1],RC[-3]>=7,RC[-3]<8),70,IF(AND(RC[-3]<RC[-1],RC[-3]>=8,RC[-3]<9),65,IF(AND(RC[-3]<RC[-1],RC[-3]>=9,RC[-3]<10),60,IF(AND(RC[-3]<RC[-1],RC[-3]>=10,RC[-3]<11),55,IF(AND(RC[-3]<RC[-1],RC[-3]>=11,RC[-3]<12),50,IF(AND(RC[-3]<RC[-1],RC[-3]>=12,RC[-3]<13),45,IF(AND(RC[-3]<RC[-1],RC[-3]>=13,RC[-3]<14),40,IF(AND(RC[-3]<RC[-1],RC[-3]>=14,RC[-3]<15),35,IF(AND(RC[-3]<RC[-1],RC[-3]>=15,RC[-3]<16),30,IF(AND(RC[-3]<RC[-1],RC[-3]>=16,RC[-3]<17),25,IF(AND(RC[-3]<RC[-1],RC[-3]>=17,RC[-3]<18),20,IF(AND(RC[-3]<RC[-1],RC[-3]>=18,RC[-3]<19),15,IF(AND(RC[-3]<RC[-1],RC[-3]>=19,RC[-3]<20),10,IF(AND(RC[-3]<RC[-1],RC[-3]>=20,RC[-3]<21),5,IF(AND(RC[-3]<RC[-1],RC[-3]>=21),0,IF(AND(RC[-3]>RC[-1],RC[-3]>=2,RC[-3]<3),90,IF(AND(RC[-3]>RC[-1],RC[-3]>=3,RC[-3]<4),90,IF(AND(RC[-3]>RC[-1],RC[-3]>=4,RC[-3]<5),80,IF(AND(RC[-3]>RC[-1],RC[-3]>=5,RC[-3]<6),70,IF(AND(RC[-3]>RC[-1],RC[-3]>=6,RC[-3]<7),60,IF(AND(RC[-3]>RC[-1],RC[-3]>=7,RC[-3]<8),50,IF(AND(RC[-3]>RC[-1],RC[-3]>=8,RC[-3]<9),40,IF(AND(RC[-3]>RC[-1],RC[-3]>=9,RC[-3]<10),30,IF(AND(RC[-3]>RC[-1],RC[-3]>=10,RC[-3]<11),20,IF(AND(RC[-3]>RC[-1],RC[-3]>=11,RC[-3]<12),10,IF(AND(RC[-3]>RC[-1],RC[-3]>=12),0))))))))))))))))))))))))))))))))) -> 0 | H741: =IF(RC[-3]="","",IF(RC[-3]<0.3,100,IF(AND(RC[-3]>=0.3,RC[-3]>0.4),95,IF(AND(RC[-3]>=0.4,RC[-3]<0.5),90,IF(AND(RC[-3]>=0.5,RC[-3]<0.6),85,IF(AND(RC[-3]>=0.6,RC[-3]<0.7),80,IF(AND(RC[-3]>=0.6,RC[-3]<1),80,IF(AND(RC[-3]>1,RC[-3]<2),50,IF(RC[-3]>2,0))))))))) -> 95 | I741: =IF(RC[-1]="",RC[-2],0.7*RC[-1]+0.3*RC[-2]) -> 66.5
A742: مخابراتی ایران | B742: لکما | C742: =VLOOKUP(RC[-1],Sheet1!R3C2:R802C3,2,FALSE) -> وسایل ارتباطی | D742: =VLOOKUP(RC[-2],Sheet1!R3C2:R802C9,8,FALSE) -> -5.185227272727273 | E742: =IF(VLOOKUP(RC[-3],Sheet1!R3C2:R803C11,10,FALSE)=0,"",VLOOKUP(Sheet2!RC[-3],Sheet1!R[1]C[-3]:R[801]C[6],10,FALSE)) ->  | F742: =Sheet1!R802C10 -> 39.158199426761932 | G742: =IF(RC[-3]<0,0,IF(AND(RC[-3]<RC[-1],RC[-3]<2),100,IF(AND(RC[-3]<RC[-1],RC[-3]>=2,RC[-3]<3),95,IF(AND(RC[-3]<RC[-1],RC[-3]>=3,RC[-3]<4),90,IF(AND(RC[-3]<RC[-1],RC[-3]>=4,RC[-3]<5),85,IF(AND(RC[-3]<RC[-1],RC[-3]>=5,RC[-3]<6),80,IF(AND(RC[-3]<RC[-1],RC[-3]>=6,RC[-3]<7),75,IF(AND(RC[-3]<RC[-1],RC[-3]>=7,RC[-3]<8),70,IF(AND(RC[-3]<RC[-1],RC[-3]>=8,RC[-3]<9),65,IF(AND(RC[-3]<RC[-1],RC[-3]>=9,RC[-3]<10),60,IF(AND(RC[-3]<RC[-1],RC[-3]>=10,RC[-3]<11),55,IF(AND(RC[-3]<RC[-1],RC[-3]>=11,RC[-3]<12),50,IF(AND(RC[-3]<RC[-1],RC[-3]>=12,RC[-3]<13),45,IF(AND(RC[-3]<RC[-1],RC[-3]>=13,RC[-3]<14),40,IF(AND(RC[-3]<RC[-1],RC[-3]>=14,RC[-3]<15),35,IF(AND(RC[-3]<RC[-1],RC[-3]>=15,RC[-3]<16),30,IF(AND(RC[-3]<RC[-1],RC[-3]>=16,RC[-3]<17),25,IF(AND(RC[-3]<RC[-1],RC[-3]>=17,RC[-3]<18),20,IF(AND(RC[-3]<RC[-1],RC[-3]>=18,RC[-3]<19),15,IF(AND(RC[-3]<RC[-1],RC[-3]>=19,RC[-3]<20),10,IF(AND(RC[-3]<RC[-1],RC[-3]>=20,RC[-3]<21),5,IF(AND(RC[-3]<RC[-1],RC[-3]>=21),0,IF(AND(RC[-3]>RC[-1],RC[-3]>=2,RC[-3]<3),90,IF(AND(RC[-3]>RC[-1],RC[-3]>=3,RC[-3]<4),90,IF(AND(RC[-3]>RC[-1],RC[-3]>=4,RC[-3]<5),80,IF(AND(RC[-3]>RC[-1],RC[-3]>=5,RC[-3]<6),70,IF(AND(RC[-3]>RC[-1],RC[-3]>=6,RC[-3]<7),60,IF(AND(RC[-3]>RC[-1],RC[-3]>=7,RC[-3]<8),50,IF(AND(RC[-3]>RC[-1],RC[-3]>=8,RC[-3]<9),40,IF(AND(RC[-3]>RC[-1],RC[-3]>=9,RC[-3]<10),30,IF(AND(RC[-3]>RC[-1],RC[-3]>=10,RC[-3]<11),20,IF(AND(RC[-3]>RC[-1],RC[-3]>=11,RC[-3]<12),10,IF(AND(RC[-3]>RC[-1],RC[-3]>=12),0))))))))))))))))))))))))))))))))) -> 0 | H742: =IF(RC[-3]="","",IF(RC[-3]<0.3,100,IF(AND(RC[-3]>=0.3,RC[-3]>0.4),95,IF(AND(RC[-3]>=0.4,RC[-3]<0.5),90,IF(AND(RC[-3]>=0.5,RC[-3]<0.6),85,IF(AND(RC[-3]>=0.6,RC[-3]<0.7),80,IF(AND(RC[-3]>=0.6,RC[-3]<1),80,IF(AND(RC[-3]>1,RC[-3]<2),50,IF(RC[-3]>2,0))))))))) ->  | I742: =IF(RC[-1]="",RC[-2],0.7*RC[-1]+0.3*RC[-2]) -> 0
C743: =VLOOKUP(RC[-1],Sheet1!R3C2:R802C3,2,FALSE) -> 

Sheet: Sheet1
A1: شرکت | B1: نماد | C1: صنعت | D1: %نوسان قیمت | F1: P/E | G1: p/e b | H1: p/e f | I1: P/E | K1: p/nav | M1: P/S | N1: P/BV
A3: ذغالسنگ نگین | B3: کطبس | C3: استخراج زغال سنگ | D3: -0.99206349206348998 | E3: =VLOOKUP(RC[-3],'[screener-data-1401-11-24.xlsx]overview'!R8C2:R902C7,6,0) -> 12018350000000 | F3: 8.8058823529411772 | G3: =VLOOKUP(RC[-5],'[screener-data-1401-11-24.xlsx]overview'!R8C2:R897C8,7,FALSE) -> 8.6946229022000008 | H3: 7.8 | I3: =IF(RC[-1]="",((RC[-2]+RC[-3])/2)*0.65,RC[-1]) -> 7.8 | J3: =RC[-1]*RC[-5]/R9C5 -> 0.82832547077394814 | M3: 4.0503525956971602 | N3: 3.7714307170964014
A4: زغال سنگ پروده طبس | B4: کزغال | C4: استخراج زغال سنگ | D4: 0.30349013657056001 | E4: =VLOOKUP(RC[-3],'[screener-data-1401-11-24.xlsx]overview'!R8C2:R902C7,6,0) -> 68740000000000 | F4: 7.9066985645933014 | G4: =VLOOKUP(RC[-5],'[screener-data-1401-11-24.xlsx]overview'!R8C2:R897C8,7,FALSE) -> 7.9653537027999999 | I4: =IF(RC[-1]="",((RC[-2]+RC[-3])/2)*0.65,RC[-1]) -> 5.1584169869028225 | J4: =RC[-1]*RC[-5]/R9C5 -> 3.1331958281425609 | M4: 4.7081595685194424 | N4: 6.133665929648739
A5: صنعتی و معدنی شمال شرق شاهرود | B5: کشرق | C5: استخراج زغال سنگ | D5: 0.10515247108307001 | E5: =VLOOKUP(RC[-3],'[screener-data-1401-11-24.xlsx]overview'!R8C2:R902C7,6,0) -> 7929600000000 | F5: 36.770954036307458 | G5: =VLOOKUP(RC[-5],'[screener-data-1401-11-24.xlsx]overview'!R8C2:R897C8,7,FALSE) -> 45.337719749199998 | I5: =IF(RC[-1]="",((RC[-2]+RC[-3])/2)*0.65,RC[-1]) -> 26.685318980289921 | J5: =RC[-1]*RC[-5]/R9C5 -> 1.8697573309804465 | M5: 6.3014065639651706 | N5: 12.685601157389781
A6: فرآوری ذغال سنگ پروده طبس | B6: کپرور | C6: استخراج زغال سنگ | D6: 0.32467532467532001 | E6: =VLOOKUP(RC[-3],'[screener-data-1401-11-24.xlsx]overview'!R8C2:R902C7,6,0) -> 16245000000000 | F6: 6.746724890829694 | G6: =VLOOKUP(RC[-5],'[screener-data-1401-11-24.xlsx]overview'!R8C2:R897C8,7,FALSE) -> 7.7939343580999996 | I6: =IF(RC[-1]="",((RC[-2]+RC[-3])/2)*0.65,RC[-1]) -> 4.7257142559021501 | J6: =RC[-1]*RC[-5]/R9C5 -> 0.67834205019850424 | M6: 1.6331292913339588 | N6: 3.4942083920782339
A7: جمع | E7: =SUM(R[-4]C:R[-1]C) -> 104932950000000 | I7: =IF(RC[-1]="",((RC[-2]+RC[-3])/2)*0.65,RC[-1]) -> 0 | J7: =RC[-1]*RC[-5]/R9C5 -> 0
A8: تامین ماسه ریخته گری | B8: کماسه | C8: استخراج سایر معادن | D8: -0.43478260869565 | E8: =VLOOKUP(RC[-3],'[screener-data-1401-11-24.xlsx]overview'!R8C2:R902C7,6,0) -> 8238904914000 | F8: 16.235074626865671 | G8: =VLOOKUP(RC[-5],'[screener-data-1401-11-24.xlsx]overview'!R8C2:R897C8,7,FALSE) -> 11.603209936200001 | I8: =IF(RC[-1]="",((RC[-2]+RC[-3])/2)*0.65,RC[-1]) -> 9.0474424829963436 | J8: =RC[-1]*RC[-5]/R9C5 -> 0.65865332320421122 | M8: 6.8159523156810824 | N8: 3.0352237372794995
E9: =R[-2]C+R[-1]C -> 113171854914000 | J9: =SUM(R[-6]C:R[-1]C) -> 7.1682740032996701
I10: =IF(RC[-1]="",((RC[-2]+RC[-3])/2)*0.65,RC[-1]) -> 0
A11: باما | B11: کاما | C11: استخراج کانه های فلزی | D11: 0 | E11: =VLOOKUP(RC[-3],'[screener-data-1401-11-24.xlsx]overview'!R8C2:R902C7,6,0) -> 74900000000000 | F11: 22.89085545722714 | G11: =VLOOKUP(RC[-5],'[screener-data-1401-11-24.xlsx]overview'!R8C2:R897C8,7,FALSE) -> 14.478539974 | I11: =IF(RC[-1]="",((RC[-2]+RC[-3])/2)*0.65,RC[-1]) -> 12.14505351514882 | J11: =RC[-1]*RC[-5]/R28C5 -> 0.14402152462563611 | M11: 10.164887309256086 | N11: 2.5646520355471347
A12: پویا زرکان آق دره | B12: فزر | C12: استخراج کانه های فلزی | D12: 0.16181229773462 | E12: =VLOOKUP(RC[-3],'[screener-data-1401-11-24.xlsx]overview'!R8C2:R902C7,6,0) -> 97050000000000 | F12: 4.4809613435645002 | G12: =VLOOKUP(RC[-5],'[screener-data-1401-11-24.xlsx]overview'!R8C2:R897C8,7,FALSE) -> 4.5534381882000003 | H12: 4 | I12: =IF(RC[-1]="",((RC[-2]+RC[-3])/2)*0.65,RC[-1]) -> 4 | J12: =RC[-1]*RC[-5]/R28C5 -> 6.1461291883421698E-2 | M12: 44.804596946821263 | N12: 13.30339579744509
A13: تجلی توسعه معادن و فلزات | B13: تجلی | C13: استخراج کانه های فلزی | D13: 7.3583517292119996E-2 | E13: =VLOOKUP(RC[-3],'[screener-data-1401-11-24.xlsx]overview'!R8C2:R902C7,6,0) -> 82894000000000 | F13: 43.87096774193548 | G13: =VLOOKUP(RC[-5],'[screener-data-1401-11-24.xlsx]overview'!R8C2:R897C8,7,FALSE) -> 16.108662964499999 | I13: =IF(RC[-1]="",((RC[-2]+RC[-3])/2)*0.65,RC[-1]) -> 19.493379979591531 | J13: =RC[-1]*RC[-5]/R28C5 -> 0.25583290295259647 | M13: 44.00862635882897 | N13: 1.2511330046527398
A14: توسعه بازرگانی آهن و فولاد میلاد | B14: بمیلا | C14: استخراج کانه های فلزی | D14: -1.04058272632674 | E14: =VLOOKUP(RC[-3],'[screener-data-1401-11-24.xlsx]overview'!R8C2:R902C7,6,0) -> 10464700000000 | F14: -528.33333333333337 | G14: =VLOOKUP(RC[-5],'[screener-data-1401-11-24.xlsx]overview'!R8C2:R897C8,7,FALSE) -> 43.876130105000001 | I14: =IF(RC[-1]="",((RC[-2]+RC[-3])/2)*0.65,RC[-1]) -> -157.44859104920835 | J14: =RC[-1]*RC[-5]/R28C5 -> -0.26086253769992584 | M14: 8.9198884709211228 | N14: 6.920660709797545
A15: توسعه معدنی و صنعتی صبانور | B15: کنور | C15: استخراج کانه های فلزی | D15: 6.0422960725070002E-2 | E15: =VLOOKUP(RC[-3],'[screener-data-1401-11-24.xlsx]overview'!R8C2:R902C7,6,0) -> 208039948380000 | F15: 7.5409836065573774 | G15: =VLOOKUP(RC[-5],'[screener-data-1401-11-24.xlsx]overview'!R8C2:R897C8,7,FALSE) -> 10.1456049588 | I15: =IF(RC[-1]="",((RC[-2]+RC[-3])/2)*0.65,RC[-1]) -> 5.7481412837411474 | J15: =RC[-1]*RC[-5]/R28C5 -> 0.18933038807337002 | M15: 6.9109680515945966 | N15: 5.7359772181855826
A16: چادرملو | B16: کچاد | C16: استخراج کانه های فلزی | D16: 1.0869565217391299 | E16: =VLOOKUP(RC[-3],'[screener-data-1401-11-24.xlsx]overview'!R8C2:R902C7,6,0) -> 1337560000000000 | F16: 4.927152317880795 | G16: =VLOOKUP(RC[-5],'[screener-data-1401-11-24.xlsx]overview'!R8C2:R897C8,7,FALSE) -> 5.8958766119000003 | I16: =IF(RC[-1]="",((RC[-2]+RC[-3])/2)*0.65,RC[-1]) -> 3.5174844021787588 | J16: =RC[-1]*RC[-5]/R28C5 -> 0.74488907812930205 | M16: 2.9124556158861141 | N16: 3.8449208093504454
A17: سر. توسعه معادن و فلزات | B17: ومعادن | C17: استخراج کانه های فلزی | D17: 0.42598509052182998 | E17: =VLOOKUP(RC[-3],'[screener-data-1401-11-24.xlsx]overview'!R8C2:R902C7,6,0) -> 906143452000000 | F17: 2.871498172959805 | G17: =VLOOKUP(RC[-5],'[screener-data-1401-11-24.xlsx]overview'!R8C2:R897C8,7,FALSE) -> 6.7869261680999999 | I17: =IF(RC[-1]="",((RC[-2]+RC[-3])/2)*0.65,RC[-1]) -> 3.1389879108444365 | J17: =RC[-1]*RC[-5]/R28C5 -> 0.45033194270020876 | K17: 0.6 | M17: 6.7193527379204099 | N17: 1.1901101146333619
A18: سر. صدر تامین | B18: تاصیکو | C18: استخراج کانه های فلزی | D18: 0.87032201914707996 | E18: =VLOOKUP(RC[-3],'[screener-data-1401-11-24.xlsx]overview'!R8C2:R902C7,6,0) -> 359290000000000 | F18: 8.0822873082287305 | G18: =VLOOKUP(RC[-5],'[screener-data-1401-11-24.xlsx]overview'!R8C2:R897C8,7,FALSE) -> 6.0692769108000002 | I18: =IF(RC[-1]="",((RC[-2]+RC[-3])/2)*0.65,RC[-1]) -> 4.5992583711843382 | J18: =RC[-1]*RC[-5]/R28C5 -> 0.26162490936387489 | K18: 0.7 | M18: 7.8835413405719699 | N18: 5.1989335479372381
A19: سنگ آهن گهر زمین | B19: کگهر | C19: استخراج کانه های فلزی | D19: 0.23041474654377 | E19: =VLOOKUP(RC[-3],'[screener-data-1401-11-24.xlsx]overview'!R8C2:R902C7,6,0) -> 1088750000000000 | F19: 10.081112398609502 | G19: =VLOOKUP(RC[-5],'[screener-data-1401-11-24.xlsx]overview'!R8C2:R897C8,7,FALSE) -> 7.9734082953999996 | I19: =IF(RC[-1]="",((RC[-2]+RC[-3])/2)*0.65,RC[-1]) -> 5.8677192255530883 | J19: =RC[-1]*RC[-5]/R28C5 -> 1.0114482003290066 | M19: 4.9278319352926863 | N19: 7.5662959371829484
A20: فراوری معدنی اپال کانی پارس | B20: اپال | C20: استخراج کانه های فلزی | D20: -0.32981530343006998 | E20: =VLOOKUP(RC[-3],'[screener-data-1401-11-24.xlsx]overview'!R8C2:R902C7,6,0) -> 301600000000000 | F20: 6.2232289950576609 | G20: =VLOOKUP(RC[-5],'[screener-data-1401-11-24.xlsx]overview'!R8C2:R897C8,7,FALSE) -> 8.9740330457000006 | I20: =IF(RC[-1]="",((RC[-2]+RC[-3])/2)*0.65,RC[-1]) -> 4.93911016324624 | J20: =RC[-1]*RC[-5]/R28C5 -> 0.235844744880257 | M20: 8.3556953713650373 | N20: 7.1486412093665272
A21: گروه صنعتی و معدنی امیر | B21: وامیر | C21: استخراج کانه های فلزی | D21: -2.4206562668101101 | E21: =VLOOKUP(RC[-3],'[screener-data-1401-11-24.xlsx]overview'!R8C2:R902C7,6,0) -> 22205400000000 | F21: 21.453914688953716 | G21: =VLOOKUP(RC[-5],'[screener-data-1401-11-24.xlsx]overview'!R8C2:R897C8,7,FALSE) -> 12.5070557331 | I21: =IF(RC[-1]="",((RC[-2]+RC[-3])/2)*0.65,RC[-1]) -> 11.037315387167459 | J21: =RC[-1]*RC[-5]/R28C5 -> 3.8803259390891139E-2 | K21: 0.45 | M21: 19.824018942465731 | N21: 4.8357572346790674
A22: گل گهر | B22: کگل | C22: استخراج کانه های فلزی | D22: 3.9950062421972499 | E22: =VLOOKUP(RC[-3],'[screener-data-1401-11-24.xlsx]overview'!R8C2:R902C7,6,0) -> 1700000000000000 | F22: 3.9952038369304557 | G22: =VLOOKUP(RC[-5],'[screener-data-1401-11-24.xlsx]overview'!R8C2:R897C8,7,FALSE) -> 14.0517258839 | I22: =IF(RC[-1]="",((RC[-2]+RC[-3])/2)*0.65,RC[-1]) -> 5.8652521592698985 | J22: =RC[-1]*RC[-5]/R28C5 -> 1.5786351297843542 | M22: 3.3939387924162467 | N22: 4.6175225679891119
A23: معادن بافق | B23: کبافق | C23: استخراج کانه های فلزی | D23: -1.2888551933282699 | E23: =VLOOKUP(RC[-3],'[screener-data-1401-11-24.xlsx]overview'!R8C2:R902C7,6,0) -> 31031100000000 | F23: 21 | G23: =VLOOKUP(RC[-5],'[screener-data-1401-11-24.xlsx]overview'!R8C2:R897C8,7,FALSE) -> 13.1459108098 | I23: =IF(RC[-1]="",((RC[-2]+RC[-3])/2)*0.65,RC[-1]) -> 11.097421013185 | J23: =RC[-1]*RC[-5]/R28C5 -> 5.4521197620707333E-2 | M23: 14.694024274078901 | N23: 8.0757726819541382
A24: معادن روی ایران | B24: کروی | C24: استخراج کانه های فلزی | D24: 2.0254169976171501 | E24: =VLOOKUP(RC[-3],'[screener-data-1401-11-24.xlsx]overview'!R8C2:R902C7,6,0) -> 62714421000000 | F24: 7.3045208984930339 | G24: =VLOOKUP(RC[-5],'[screener-data-1401-11-24.xlsx]overview'!R8C2:R897C8,7,FALSE) -> 7.4265680288000002 | I24: =IF(RC[-1]="",((RC[-2]+RC[-3])/2)*0.65,RC[-1]) -> 4.7876039013702361 | J24: =RC[-1]*RC[-5]/R28C5 -> 4.7537001357932679E-2 | K24: 0.56000000000000005 | M24: 7.1875350093792978 | N24: 5.6907078976056846
A25: معادن مس تکنار | B25: تکنار | C25: استخراج کانه های فلزی | D25: -0.27522935779815999 | E25: =VLOOKUP(RC[-3],'[screener-data-1401-11-24.xlsx]overview'!R8C2:R902C7,6,0) -> 3243000000000 | F25: 56.970649895178198 | G25: =VLOOKUP(RC[-5],'[screener-data-1401-11-24.xlsx]overview'!R8C2:R897C8,7,FALSE) -> 30.447330447300001 | I25: =IF(RC[-1]="",((RC[-2]+RC[-3])/2)*0.65,RC[-1]) -> 28.410843611305417 | J25: =RC[-1]*RC[-5]/R28C5 -> 1.4587377829586034E-2 | M25: 12.325334401705364 | N25: 43.983760672232641
A26: معادن منگنز ایران | B26: کمنگنز | C26: استخراج کانه های فلزی | D26: -0.35335689045935997 | E26: =VLOOKUP(RC[-3],'[screener-data-1401-11-24.xlsx]overview'!R8C2:R902C7,6,0) -> 18352000000000 | F26: 7.8387769284225159 | G26: =VLOOKUP(RC[-5],'[screener-data-1401-11-24.xlsx]overview'!R8C2:R897C8,7,FALSE) -> 9.8019596451000002 | I26: =IF(RC[-1]="",((RC[-2]+RC[-3])/2)*0.65,RC[-1]) -> 5.7332393863948186 | J26: =RC[-1]*RC[-5]/R28C5 -> 1.6658259757706684E-2 | M26: 4.7921160184423437 | N26: 4.5720169906036814
A27: معدنی دماوند | B27: کدما | C27: استخراج کانه های فلزی | D27: -0.75965393542940995 | E27: =VLOOKUP(RC[-3],'[screener-data-1401-11-24.xlsx]overview'!R8C2:R902C7,6,0) -> 11932500000000 | F27: 139.9702380952381 | G27: =VLOOKUP(RC[-5],'[screener-data-1401-11-24.xlsx]overview'!R8C2:R897C8,7,FALSE) -> 340.81486776269998 | I27: =IF(RC[-1]="",((RC[-2]+RC[-3])/2)*0.65,RC[-1]) -> 156.25515940382988 | J27: =RC[-1]*RC[-5]/R28C5 -> 0.29519701586188779 | M27: 25.333761398307274 | N27: 55.63626211387038
A28: جمع | E28: =SUM(R[-17]C:R[-1]C) -> 6316170521380000 | I28: =IF(RC[-1]="",((RC[-2]+RC[-3])/2)*0.65,RC[-1]) -> 0 | J28: =SUM(R[-17]C:R[-1]C) -> 5.1398616868408133
A29: حفاری شمال | B29: حفاری | C29: استخراج نفت گاز جز اکتشاف | D29: -0.83144368858654005 | E29: =VLOOKUP(RC[-3],'[screener-data-1401-11-24.xlsx]overview'!R8C2:R902C7,6,0) -> 34713000000000 | F29: 17.038961038961038 | G29: =VLOOKUP(RC[-5],'[screener-data-1401-11-24.xlsx]overview'!R8C2:R897C8,7,FALSE) -> 11.1524773788 | I29: =IF(RC[-1]="",((RC[-2]+RC[-3])/2)*0.65,RC[-1]) -> 9.162217485772338 | J29: =RC[-1]*RC[-5]/R31C5 -> 2.4986533940855535 | M29: 2.0751080873330889 | N29: 1.2500494917121761
A30: مهندسی و ساختمان صنایع نفت | B30: شساخت | C30: استخراج نفت گاز جز اکتشاف | D30: -0.13550135501355001 | E30: =VLOOKUP(RC[-3],'[screener-data-1401-11-24.xlsx]overview'!R8C2:R902C7,6,0) -> 92574784827000 | F30: 13.17012151536812 | G30: =VLOOKUP(RC[-5],'[screener-data-1401-11-24.xlsx]overview'!R8C2:R897C8,7,FALSE) -> 28.0729341061 | I30: =IF(RC[-1]="",((RC[-2]+RC[-3])/2)*0.65,RC[-1]) -> 13.403993076977137 | J30: =RC[-1]*RC[-5]/R31C5 -> 9.7485534579005826 | M30: 1.3792371366071918 | N30: 11.583269198613403
E31: =SUM(R[-2]C:R[-1]C) -> 127287784827000 | J31: =SUM(R[-2]C:R[-1]C) -> 12.247206851986135
A32: آتیه داده پرداز | B32: اپرداز | C32: اطلاعات و ارتباطات | D32: 3.5134534133867001 | E32: =VLOOKUP(RC[-3],'[screener-data-1401-11-24.xlsx]overview'!R8C2:R902C7,6,0) -> 11103750000000 | F32: 12.479892761394101 | G32: =VLOOKUP(RC[-5],'[screener-data-1401-11-24.xlsx]overview'!R8C2:R897C8,7,FALSE) -> 27.710993671899999 | I32: =IF(RC[-1]="",((RC[-2]+RC[-3])/2)*0.65,RC[-1]) -> 13.062038090820582 | J32: =RC[-1]*RC[-5]/R36C5 -> 1.2272939089198935 | M32: 2.5720303562816107 | N32: 3.103228513170222
A33: انتقال داده های آسیاتک | B33: اسیاتک | C33: اطلاعات و ارتباطات | D33: -4.2566317088217103 | E33: =VLOOKUP(RC[-3],'[screener-data-1401-11-24.xlsx]overview'!R8C2:R902C7,6,0) -> 31050000000000 | F33: 24.871794871794872 | G33: =VLOOKUP(RC[-5],'[screener-data-1401-11-24.xlsx]overview'!R8C2:R897C8,7,FALSE) -> 19.155753691800001 | I33: =IF(RC[-1]="",((RC[-2]+RC[-3])/2)*0.65,RC[-1]) -> 14.308953283168336 | J33: =RC[-1]*RC[-5]/R36C5 -> 3.7595635304099733 | M33: 3.7189276644607099 | N33: 6.8810720639336722
A34: داده گستر عصر نوین - های وب | B34: های وب | C34: اطلاعات و ارتباطات | D34: 4.2480883602369998E-2 | E34: =VLOOKUP(RC[-3],'[screener-data-1401-11-24.xlsx]overview'!R8C2:R902C7,6,0) -> 70470000000000 | F34: 1.1155850307910942 | G34: =VLOOKUP(RC[-5],'[screener-data-1401-11-24.xlsx]overview'!R8C2:R897C8,7,FALSE) -> 3.3947283021999999 | I34: =IF(RC[-1]="",((RC[-2]+RC[-3])/2)*0.65,RC[-1]) -> 1.4658518332221058 | J34: =RC[-1]*RC[-5]/R36C5 -> 0.87410238212814106 | M34: 2.7051734288025346 | N34: 1.580194537268603
A35: مبین وان کیش | B35: اوان | C35: اطلاعات و ارتباطات | D35: -2.3219814241485999 | E35: =VLOOKUP(RC[-3],'[screener-data-1401-11-24.xlsx]overview'!R8C2:R902C7,6,0) -> 5553000000000 | F35: 94.887218045112789 | G35: =VLOOKUP(RC[-5],'[screener-data-1401-11-24.xlsx]overview'!R8C2:R897C8,7,FALSE) -> 331.77123753810002 | I35: =IF(RC[-1]="",((RC[-2]+RC[-3])/2)*0.65,RC[-1]) -> 138.66399806454416 | J35: =RC[-1]*RC[-5]/R36C5 -> 6.515674032772214 | M35: 4.6098997170257014 | N35: 10.656563666353293
E36: =SUM(R[-4]C:R[-1]C) -> 118176750000000 | I36: =IF(RC[-1]="",((RC[-2]+RC[-3])/2)*0.65,RC[-1]) -> 0 | J36: =SUM(R[-4]C:R[-1]C) -> 12.376633854230223
A37: آ.س.پ | B37: آ س پ | C37: انبوه سازی املاک و مستغلات | D37: 5.9815950920245298 | E37: =VLOOKUP(RC[-3],'[screener-data-1401-11-24.xlsx]overview'!R8C2:R902C7,6,0) -> 7060000000000 | F37: 287.91666666666669 | G37: =VLOOKUP(RC[-5],'[screener-data-1401-11-24.xlsx]overview'!R8C2:R897C8,7,FALSE) -> 293.61038107749999 | I37: =IF(RC[-1]="",((RC[-2]+RC[-3])/2)*0.65,RC[-1]) -> 188.99629051685417 | J37: =RC[-1]*RC[-5]/R71C5 -> 2.4853984997145697 | M37: 4.0996761196535862 | N37: 6.4013903338079565
A38: بهساز کاشانه تهران | B38: ثبهساز | C38: انبوه سازی املاک و مستغلات | D38: 1.9790454016298 | E38: =VLOOKUP(RC[-3],'[screener-data-1401-11-24.xlsx]overview'!R8C2:R902C7,6,0) -> 35128223315000 | F38: 7.2697095435684647 | G38: =VLOOKUP(RC[-5],'[screener-data-1401-11-24.xlsx]overview'!R8C2:R897C8,7,FALSE) -> 7.7688262687999998 | I38: =IF(RC[-1]="",((RC[-2]+RC[-3])/2)*0.65,RC[-1]) -> 4.8875241390197512 | J38: =RC[-1]*RC[-5]/R71C5 -> 0.31980345465912779 | M38: 4.8460884603805763 | N38: 1.4373432367763128
A39: تامین مسکن جوانان | B39: ثجوان | C39: انبوه سازی املاک و مستغلات | D39: -1.47058823529411 | E39: =VLOOKUP(RC[-3],'[screener-data-1401-11-24.xlsx]overview'!R8C2:R902C7,6,0) -> 15289552870000 | F39: 1005 | G39: =VLOOKUP(RC[-5],'[screener-data-1401-11-24.xlsx]overview'!R8C2:R897C8,7,FALSE) -> 327.45336834720001 | I39: =IF(RC[-1]="",((RC[-2]+RC[-3])/2)*0.65,RC[-1]) -> 433.04734471284002 | J39: =RC[-1]*RC[-5]/R71C5 -> 12.332985349262502 | M39: 3215.3025673699603 | N39: 6.2038228170552543
A40: توسعه ساختمان | B40: ثاخت | C40: انبوه سازی املاک و مستغلات | D40: -0.86021505376343999 | E40: =VLOOKUP(RC[-3],'[screener-data-1401-11-24.xlsx]overview'!R8C2:R902C7,6,0) -> 24651000000000 | F40: 17.61783439490446 | G40: =VLOOKUP(RC[-5],'[screener-data-1401-11-24.xlsx]overview'!R8C2:R897C8,7,FALSE) -> 19.183456681999999 | I40: =IF(RC[-1]="",((RC[-2]+RC[-3])/2)*0.65,RC[-1]) -> 11.960419599993951 | J40: =RC[-1]*RC[-5]/R71C5 -> 0.54918543183777613 | M40: 12.448531169333828 | N40: 2.8768431690575835
A41: توسعه و عمران امید | B41: ثامید | C41: انبوه سازی املاک و مستغلات | D41: 0.47309284447071998 | E41: =VLOOKUP(RC[-3],'[screener-data-1401-11-24.xlsx]overview'!R8C2:R902C7,6,0) -> 60286119000000 | F41: 8.3694581280788185 | G41: =VLOOKUP(RC[-5],'[screener-data-1401-11-24.xlsx]overview'!R8C2:R897C8,7,FALSE) -> 4.6397972573999997 | I41: =IF(RC[-1]="",((RC[-2]+RC[-3])/2)*0.65,RC[-1]) -> 4.2280080002806164 | J41: =RC[-1]*RC[-5]/R71C5 -> 0.47477864586022572 | M41: 5.6156902562735684 | N41: 1.1719449575792
A42: ساختمان اصفهان | B42: ثاصفا | C42: انبوه سازی املاک و مستغلات | D42: 0.37902716361339001 | E42: =VLOOKUP(RC[-3],'[screener-data-1401-11-24.xlsx]overview'!R8C2:R902C7,6,0) -> 2556800000000 | F42: -1444.5454545454545 | G42: =VLOOKUP(RC[-5],'[screener-data-1401-11-24.xlsx]overview'!R8C2:R897C8,7,FALSE) -> 0 | I42: =IF(RC[-1]="",((RC[-2]+RC[-3])/2)*0.65,RC[-1]) -> -469.47727272727275 | J42: =RC[-1]*RC[-5]/R71C5 -> -2.235884582112043 | M42: 83.376512642245757 | N42: 15.846422338568935
A43: سخت آژند | B43: ثاژن | C43: انبوه سازی املاک و مستغلات | D43: -6.4088869899590006E-2 | E43: =VLOOKUP(RC[-3],'[screener-data-1401-11-24.xlsx]overview'!R8C2:R902C7,6,0) -> 1830400000000 | F43: 233.9 | G43: =VLOOKUP(RC[-5],'[screener-data-1401-11-24.xlsx]overview'!R8C2:R897C8,7,FALSE) -> 222.0730797912 | I43: =IF(RC[-1]="",((RC[-2]+RC[-3])/2)*0.65,RC[-1]) -> 148.19125093214001 | J43: =RC[-1]*RC[-5]/R71C5 -> 0.50525034849548489 | M43: 24.923081021324204 | N43: 3.7854481159748663
A44: سر. توس گستر | B44: وتوس | C44: انبوه سازی املاک و مستغلات | D44: 6.7415730337078603 | E44: =VLOOKUP(RC[-3],'[screener-data-1401-11-24.xlsx]overview'!R8C2:R902C7,6,0) -> 26540000000000 | F44: 26.965065502183407 | G44: =VLOOKUP(RC[-5],'[screener-data-1401-11-24.xlsx]overview'!R8C2:R897C8,7,FALSE) -> 16.129111030800001 | I44: =IF(RC[-1]="",((RC[-2]+RC[-3])/2)*0.65,RC[-1]) -> 14.005607373219609 | J44: =RC[-1]*RC[-5]/R71C5 -> 0.69237426392978429 | M44: 40.738840938741646 | N44: 6.7476162065174874
A45: سر. توسعه آذربایجان | B45: وآذر | C45: انبوه سازی املاک و مستغلات | D45: -2.7789518174133501 | E45: =VLOOKUP(RC[-3],'[screener-data-1401-11-24.xlsx]overview'!R8C2:R902C7,6,0) -> 18104000000000 | F45: -298.73376623376623 | G45: =VLOOKUP(RC[-5],'[screener-data-1401-11-24.xlsx]overview'!R8C2:R897C8,7,FALSE) -> 59.744848963300001 | I45: =IF(RC[-1]="",((RC[-2]+RC[-3])/2)*0.65,RC[-1]) -> -77.671398112901528 | J45: =RC[-1]*RC[-5]/R71C5 -> -2.6192304691214741 | K45: 4 | M45: -670.43136111920728 | N45: 5.7100532870041834
A46: سر. توسعه خوزستان | B46: وثخوز | C46: انبوه سازی املاک و مستغلات | D46: 0.15898251192367999 | E46: =VLOOKUP(RC[-3],'[screener-data-1401-11-24.xlsx]overview'!R8C2:R902C7,6,0) -> 2205000000000 | F46: 60.928433268858804 | G46: =VLOOKUP(RC[-5],'[screener-data-1401-11-24.xlsx]overview'!R8C2:R897C8,7,FALSE) -> 26.068665877400001 | I46: =IF(RC[-1]="",((RC[-2]+RC[-3])/2)*0.65,RC[-1]) -> 28.274057222534111 | J46: =RC[-1]*RC[-5]/R71C5 -> 0.11612741987508808 | K46: 3 | M46: 37.240959989190834 | N46: 14.782288070257769
A47: سر. توسعه و عمران استان اردبیل | B47: ثتوسا | C47: انبوه سازی املاک و مستغلات | D47: 0.42761148442272001 | E47: =VLOOKUP(RC[-3],'[screener-data-1401-11-24.xlsx]overview'!R8C2:R902C7,6,0) -> 1581120000000 | F47: -47.790697674418603 | G47: =VLOOKUP(RC[-5],'[screener-data-1401-11-24.xlsx]overview'!R8C2:R897C8,7,FALSE) -> 0 | I47: =IF(RC[-1]="",((RC[-2]+RC[-3])/2)*0.65,RC[-1]) -> -15.531976744186046 | J47: =RC[-1]*RC[-5]/R71C5 -> -4.5743523529991274E-2 | M47: 63.129600000000003 | N47: -454.82420749279538
A48: سر. توسعه و عمران استان کرمان | B48: کرمان | C48: انبوه سازی املاک و مستغلات | D48: -3.6846615252784898 | E48: =VLOOKUP(RC[-3],'[screener-data-1401-11-24.xlsx]overview'!R8C2:R902C7,6,0) -> 49268925768000 | F48: 224.8 | G48: =VLOOKUP(RC[-5],'[screener-data-1401-11-24.xlsx]overview'!R8C2:R897C8,7,FALSE) -> 279.22933513089998 | I48: =IF(RC[-1]="",((RC[-2]+RC[-3])/2)*0.65,RC[-1]) -> 163.8095339175425 | J48: =RC[-1]*RC[-5]/R71C5 -> 15.033161340014038 | K48: 1 | M48: 140.50223510364972 | N48: 1.0542927408088187
A49: سر. توسعه و عمران زاگرس | B49: ثزاگرس | C49: انبوه سازی املاک و مستغلات | D49: -0.16103059581320001 | E49: =VLOOKUP(RC[-3],'[screener-data-1401-11-24.xlsx]overview'!R8C2:R902C7,6,0) -> 2046000000000 | F49: 264.95726495726495 | G49: =VLOOKUP(RC[-5],'[screener-data-1401-11-24.xlsx]overview'!R8C2:R897C8,7,FALSE) -> 0 | I49: =IF(RC[-1]="",((RC[-2]+RC[-3])/2)*0.65,RC[-1]) -> 86.111111111111114 | J49: =RC[-1]*RC[-5]/R71C5 -> 0.32817301950665434 | M49: 81.981007332612094 | N49: -29.528070428633281
A50: سر. ساختمان ایران | B50: وساخت | C50: انبوه سازی املاک و مستغلات | D50: -4.8146098505810704 | E50: =VLOOKUP(RC[-3],'[screener-data-1401-11-24.xlsx]overview'!R8C2:R902C7,6,0) -> 51846622996031 | F50: 1.3870967741935485 | G50: =VLOOKUP(RC[-5],'[screener-data-1401-11-24.xlsx]overview'!R8C2:R897C8,7,FALSE) -> 23.664579140899999 | I50: =IF(RC[-1]="",((RC[-2]+RC[-3])/2)*0.65,RC[-1]) -> 8.1417946724054033 | J50: =RC[-1]*RC[-5]/R71C5 -> 0.78628260958814511 | K50: 1.1000000000000001 | M50: 32.027347164523135 | N50: 1.5201247781927476
A51: سر. ساختمانی اعتماد گستر | B51: ثعتما | C51: انبوه سازی املاک و مستغلات | D51: -0.92460881934565997 | E51: =VLOOKUP(RC[-3],'[screener-data-1401-11-24.xlsx]overview'!R8C2:R902C7,6,0) -> 1970634752800 | F51: 6.5154349859681941 | G51: =VLOOKUP(RC[-5],'[screener-data-1401-11-24.xlsx]overview'!R8C2:R897C8,7,FALSE) -> 125.0313830364 | I51: =IF(RC[-1]="",((RC[-2]+RC[-3])/2)*0.65,RC[-1]) -> 42.752715857269664 | J51: =RC[-1]*RC[-5]/R71C5 -> 0.15693069438368065 | K51: 0.2 | M51: 12.554052651428281 | N51: 9.2872986568388107
A52: سر. ساختمانی بین المللی نام آوران مهندسی | B52: ثنام | C52: انبوه سازی املاک و مستغلات | D52: -2.7548209366391099 | E52: =VLOOKUP(RC[-3],'[screener-data-1401-11-24.xlsx]overview'!R8C2:R902C7,6,0) -> 3527799465520 | F52: 172.19512195121951 | G52: =VLOOKUP(RC[-5],'[screener-data-1401-11-24.xlsx]overview'!R8C2:R897C8,7,FALSE) -> 51.801306038600003 | I52: =IF(RC[-1]="",((RC[-2]+RC[-3])/2)*0.65,RC[-1]) -> 72.798839096691339 | J52: =RC[-1]*RC[-5]/R71C5 -> 0.47837270801552673 | M52: 171.35922330097088 | N52: 4.5892551625870395
A53: سر. ساختمانی نظام مهندسی ایران | B53: ثنظام | C53: انبوه سازی املاک و مستغلات | D53: 1.46938775510204 | E53: =VLOOKUP(RC[-3],'[screener-data-1401-11-24.xlsx]overview'!R8C2:R902C7,6,0) -> 4728951342000 | F53: 31075 | G53: =VLOOKUP(RC[-5],'[screener-data-1401-11-24.xlsx]overview'!R8C2:R897C8,7,FALSE) -> 0 | I53: =IF(RC[-1]="",((RC[-2]+RC[-3])/2)*0.65,RC[-1]) -> 10099.375 | J53: =RC[-1]*RC[-5]/R71C5 -> 88.960536681912643 | M53: 290.22944072681702 | N53: 22.630418129497809
A54: سر. سامان گستر اصفهان | B54: ثامان | C54: انبوه سازی املاک و مستغلات | D54: 1.70610897083104 | E54: =VLOOKUP(RC[-3],'[screener-data-1401-11-24.xlsx]overview'!R8C2:R902C7,6,0) -> 3846240302800 | F54: 26.287339971550498 | G54: =VLOOKUP(RC[-5],'[screener-data-1401-11-24.xlsx]overview'!R8C2:R897C8,7,FALSE) -> 30.769915833900001 | I54: =IF(RC[-1]="",((RC[-2]+RC[-3])/2)*0.65,RC[-1]) -> 18.543608136771411 | J54: =RC[-1]*RC[-5]/R71C5 -> 0.13285218637401192 | M54: 10.912865862419446 | N54: 5.3981693338545309
A55: سر. شاهد | B55: ثشاهد | C55: انبوه سازی املاک و مستغلات | D55: -2.04572803850782 | E55: =VLOOKUP(RC[-3],'[screener-data-1401-11-24.xlsx]overview'!R8C2:R902C7,6,0) -> 33174912960000 | F55: 33.360655737704917 | G55: =VLOOKUP(RC[-5],'[screener-data-1401-11-24.xlsx]overview'!R8C2:R897C8,7,FALSE) -> 27.9538203605 | I55: =IF(RC[-1]="",((RC[-2]+RC[-3])/2)*0.65,RC[-1]) -> 19.9272047319166 | J55: =RC[-1]*RC[-5]/R71C5 -> 1.2313860389884594 | K55: 1.6 | M55: 19.409238811592701 | N55: 2.7333412460082882
A56: سر. مسکن | B56: ثمسکن | C56: انبوه سازی املاک و مستغلات | D56: -5.5666889334223999 | E56: =VLOOKUP(RC[-3],'[screener-data-1401-11-24.xlsx]overview'!R8C2:R902C7,6,0) -> 26422200000000 | F56: 40.390476190476193 | G56: =VLOOKUP(RC[-5],'[screener-data-1401-11-24.xlsx]overview'!R8C2:R897C8,7,FALSE) -> 11.018866103400001 | I56: =IF(RC[-1]="",((RC[-2]+RC[-3])/2)*0.65,RC[-1]) -> 16.708036245509764 | J56: =RC[-1]*RC[-5]/R71C5 -> 0.82230406064138994 | K56: 0.33 | M56: 30.283758281242029 | N56: 2.4703849311724722
A57: سر. مسکن الوند | B57: ثالوند | C57: انبوه سازی املاک و مستغلات | D57: -0.21613832853025 | E57: =VLOOKUP(RC[-3],'[screener-data-1401-11-24.xlsx]overview'!R8C2:R902C7,6,0) -> 11328000000000 | F57: 21.472868217054263 | G57: =VLOOKUP(RC[-5],'[screener-data-1401-11-24.xlsx]overview'!R8C2:R897C8,7,FALSE) -> 19.027569734 | I57: =IF(RC[-1]="",((RC[-2]+RC[-3])/2)*0.65,RC[-1]) -> 13.162642334092636 | J57: =RC[-1]*RC[-5]/R71C5 -> 0.27773740368280891 | M57: 6.4456379087279059 | N57: 5.429919247103471
A58: سر. مسکن پردیس | B58: ثپردیس | C58: انبوه سازی املاک و مستغلات | D58: -0.55555555555555003 | E58: =VLOOKUP(RC[-3],'[screener-data-1401-11-24.xlsx]overview'!R8C2:R902C7,6,0) -> 11900000000000 | F58: 6.3776722090261284 | G58: =VLOOKUP(RC[-5],'[screener-data-1401-11-24.xlsx]overview'!R8C2:R897C8,7,FALSE) -> 6.2260894843000001 | I58: =IF(RC[-1]="",((RC[-2]+RC[-3])/2)*0.65,RC[-1]) -> 4.0962225503309915 | J58: =RC[-1]*RC[-5]/R71C5 -> 9.0796384652364587E-2 | M58: 3.7093077029611257 | N58: 2.5406876700001559
A59: سر. مسکن تهران | B59: ثتران | C59: انبوه سازی املاک و مستغلات | D59: -4.7817047817047804 | E59: =VLOOKUP(RC[-3],'[screener-data-1401-11-24.xlsx]overview'!R8C2:R902C7,6,0) -> 8056800000000 | F59: 40.530973451327434 | G59: =VLOOKUP(RC[-5],'[screener-data-1401-11-24.xlsx]overview'!R8C2:R897C8,7,FALSE) -> 33.472522962100001 | I59: =IF(RC[-1]="",((RC[-2]+RC[-3])/2)*0.65,RC[-1]) -> 24.051136334363914 | J59: =RC[-1]*RC[-5]/R71C5 -> 0.360941013643439 | M59: 2.5358125073630533 | N59: 4.429897834003496
A60: سر. مسکن جنوب | B60: ثجنوب | C60: انبوه سازی املاک و مستغلات | D60: -3.5071090047393301 | E60: =VLOOKUP(RC[-3],'[screener-data-1401-11-24.xlsx]overview'!R8C2:R902C7,6,0) -> 14154000000000 | F60: 12.384428223844282 | G60: =VLOOKUP(RC[-5],'[screener-data-1401-11-24.xlsx]overview'!R8C2:R897C8,7,FALSE) -> 10.089875788100001 | I60: =IF(RC[-1]="",((RC[-2]+RC[-3])/2)*0.65,RC[-1]) -> 7.3041488038818922 | J60: =RC[-1]*RC[-5]/R71C5 -> 0.19256921237724542 | M60: 7.6130729903105854 | N60: 4.0860548612785523
A61: سر. مسکن زاینده رود | B61: ثرود | C61: انبوه سازی املاک و مستغلات | D61: 6.60569105691056 | E61: =VLOOKUP(RC[-3],'[screener-data-1401-11-24.xlsx]overview'!R8C2:R902C7,6,0) -> 5840000000000 | F61: 20.05736137667304 | G61: =VLOOKUP(RC[-5],'[screener-data-1401-11-24.xlsx]overview'!R8C2:R897C8,7,FALSE) -> 17.217461759399999 | I61: =IF(RC[-1]="",((RC[-2]+RC[-3])/2)*0.65,RC[-1]) -> 12.114317519223738 | J61: =RC[-1]*RC[-5]/R71C5 -> 0.13178010526013847 | M61: 3.1943686538948763 | N61: 4.93412078577167
A62: سر. مسکن شمال شرق | B62: ثشرق | C62: انبوه سازی املاک و مستغلات | D62: -2.6737967914438499 | E62: =VLOOKUP(RC[-3],'[screener-data-1401-11-24.xlsx]overview'!R8C2:R902C7,6,0) -> 4682700000000 | F62: 23.610810810810811 | G62: =VLOOKUP(RC[-5],'[screener-data-1401-11-24.xlsx]overview'!R8C2:R897C8,7,FALSE) -> 25.8530852974 | I62: =IF(RC[-1]="",((RC[-2]+RC[-3])/2)*0.65,RC[-1]) -> 16.075766235168516 | J62: =RC[-1]*RC[-5]/R71C5 -> 0.14021874256549655 | M62: 2.8325011348161597 | N62: 3.1369251369891185
A63: سر. مسکن شمالغرب | B63: ثغرب | C63: انبوه سازی املاک و مستغلات | D63: 5.6417489421720699 | E63: =VLOOKUP(RC[-3],'[screener-data-1401-11-24.xlsx]overview'!R8C2:R902C7,6,0) -> 8484000000000 | F63: 27.947761194029852 | G63: =VLOOKUP(RC[-5],'[screener-data-1401-11-24.xlsx]overview'!R8C2:R897C8,7,FALSE) -> 6.5899000563000003 | I63: =IF(RC[-1]="",((RC[-2]+RC[-3])/2)*0.65,RC[-1]) -> 11.224739906357204 | J63: =RC[-1]*RC[-5]/R71C5 -> 0.17738422585269006 | M63: 7.1975053773084792 | N63: 3.4853163405419303
A64: سر. کوه نور | B64: ثنور | C64: انبوه سازی املاک و مستغلات | D64: 0.45317220543806003 | E64: =VLOOKUP(RC[-3],'[screener-data-1401-11-24.xlsx]overview'!R8C2:R902C7,6,0) -> 7911202740000 | F64: 1.3204924543288323 | G64: =VLOOKUP(RC[-5],'[screener-data-1401-11-24.xlsx]overview'!R8C2:R897C8,7,FALSE) -> 2.3109355411000001 | I64: =IF(RC[-1]="",((RC[-2]+RC[-3])/2)*0.65,RC[-1]) -> 1.1802140985143705 | J64: =RC[-1]*RC[-5]/R71C5 -> 1.7391673079258787E-2 | M64: 1.3351207845325157 | N64: 1.0316071075057671
A65: شهر سازی و خانه سازی باغمیشه | B65: ثباغ | C65: انبوه سازی املاک و مستغلات | D65: -1.7782426778242599 | E65: =VLOOKUP(RC[-3],'[screener-data-1401-11-24.xlsx]overview'!R8C2:R902C7,6,0) -> 12315600000000 | F65: 14.077961019490255 | G65: =VLOOKUP(RC[-5],'[screener-data-1401-11-24.xlsx]overview'!R8C2:R897C8,7,FALSE) -> 14.1426591713 | I65: =IF(RC[-1]="",((RC[-2]+RC[-3])/2)*0.65,RC[-1]) -> 9.1717015620068345 | J65: =RC[-1]*RC[-5]/R71C5 -> 0.21039893650948319 | M65: 10.562249680443118 | N65: 4.4138856423722768
A66: عمران و توسعه شاهد | B66: ثعمرا | C66: انبوه سازی املاک و مستغلات | D66: -1.6776075857038599 | E66: =VLOOKUP(RC[-3],'[screener-data-1401-11-24.xlsx]overview'!R8C2:R902C7,6,0) -> 17251000000000 | F66: 13.412935323383085 | G66: =VLOOKUP(RC[-5],'[screener-data-1401-11-24.xlsx]overview'!R8C2:R897C8,7,FALSE) -> 12.717293267900001 | I66: =IF(RC[-1]="",((RC[-2]+RC[-3])/2)*0.65,RC[-1]) -> 8.4923242921670035 | J66: =RC[-1]*RC[-5]/R71C5 -> 0.27288451730093155 | M66: 11.592523206215137 | N66: 4.9912658544039434
A67: عمران و توسعه فارس | B67: ثفارس | C67: انبوه سازی املاک و مستغلات | D67: 0 | E67: =VLOOKUP(RC[-3],'[screener-data-1401-11-24.xlsx]overview'!R8C2:R902C7,6,0) -> 15480000000000 | F67: 129.71428571428572 | G67: =VLOOKUP(RC[-5],'[screener-data-1401-11-24.xlsx]overview'!R8C2:R897C8,7,FALSE) -> 125.7885062311 | I67: =IF(RC[-1]="",((RC[-2]+RC[-3])/2)*0.65,RC[-1]) -> 83.038407382250369 | J67: =RC[-1]*RC[-5]/R71C5 -> 2.3943521129314158 | M67: 50.425457080975683 | N67: 7.2696089071390189
A68: عمران و سازندگی استان قزوین | B68: ثقزوی | C68: انبوه سازی املاک و مستغلات | D68: -0.43975373790677003 | E68: =VLOOKUP(RC[-3],'[screener-data-1401-11-24.xlsx]overview'!R8C2:R902C7,6,0) -> 2298000000000 | F68: -82.028985507246375 | G68: =VLOOKUP(RC[-5],'[screener-data-1401-11-24.xlsx]overview'!R8C2:R897C8,7,FALSE) -> 0 | I68: =IF(RC[-1]="",((RC[-2]+RC[-3])/2)*0.65,RC[-1]) -> -26.659420289855074 | J68: =RC[-1]*RC[-5]/R71C5 -> -0.11411395993476522 | M68: 4847.9657387580301 | N68: 42.535602900837937
A69: نوسازی و ساختمان تهران | B69: ثنوسا | C69: انبوه سازی املاک و مستغلات | D69: 1.54963680387409 | E69: =VLOOKUP(RC[-3],'[screener-data-1401-11-24.xlsx]overview'!R8C2:R902C7,6,0) -> 10722510000000 | F69: -279.60000000000002 | G69: =VLOOKUP(RC[-5],'[screener-data-1401-11-24.xlsx]overview'!R8C2:R897C8,7,FALSE) -> 0 | I69: =IF(RC[-1]="",((RC[-2]+RC[-3])/2)*0.65,RC[-1]) -> -90.87 | J69: =RC[-1]*RC[-5]/R71C5 -> -1.8149097700445154 | M69: 21.865704039821352 | N69: 6.2472113242747742
A70: کیسون | B70: کیسون | C70: انبوه سازی املاک و مستغلات | D70: -1.7817371937639099 | E70: =VLOOKUP(RC[-3],'[screener-data-1401-11-24.xlsx]overview'!R8C2:R902C7,6,0) -> 34372800000000 | F70: 18.375 | G70: =VLOOKUP(RC[-5],'[screener-data-1401-11-24.xlsx]overview'!R8C2:R897C8,7,FALSE) -> 9.9724294078 | I70: =IF(RC[-1]="",((RC[-2]+RC[-3])/2)*0.65,RC[-1]) -> 9.2129145575350009 | J70: =RC[-1]*RC[-5]/R71C5 -> 0.5898614378155157 | M70: 1.3260783468290098 | N70: 1.0019333334253686
E71: =SUM(R[-34]C:R[-1]C) -> 536861115512151 | I71: =IF(RC[-1]="",((RC[-2]+RC[-3])/2)*0.65,RC[-1]) -> 0 | J71: =SUM(R[-34]C:R[-1]C) -> 123.43233621398711
A72: اعتباری توسعه | B72: توسعه | C72: بانکها و موسسات اعتباری | D72: -0.94786729857818997 | E72: =VLOOKUP(RC[-3],'[screener-data-1401-11-24.xlsx]overview'!R8C2:R902C7,6,0) -> 5434000000000 | F72: 38.814285714285717 | G72: =VLOOKUP(RC[-5],'[screener-data-1401-11-24.xlsx]overview'!R8C2:R897C8,7,FALSE) -> 0 | I72: =IF(RC[-1]="",((RC[-2]+RC[-3])/2)*0.65,RC[-1]) -> 12.614642857142858 | J72: =RC[-1]*RC[-5]/R92C5 -> 1.8318227328040761E-2 | M72: 2.1908171941655077 | N72: -7.076526105466284E-2
A73: اعتباری ملل | B73: وملل | C73: بانکها و موسسات اعتباری | D73: 0.75782537067544997 | E73: =VLOOKUP(RC[-3],'[screener-data-1401-11-24.xlsx]overview'!R8C2:R902C7,6,0) -> 63180000000000 | F73: -1.7189432265317595 | G73: =VLOOKUP(RC[-5],'[screener-data-1401-11-24.xlsx]overview'!R8C2:R897C8,7,FALSE) -> 0 | I73: =IF(RC[-1]="",((RC[-2]+RC[-3])/2)*0.65,RC[-1]) -> -0.55865654862282188 | J73: =RC[-1]*RC[-5]/R92C5 -> -9.4322079361587388E-3 | M73: 9.493792711201186 | N73: -1.6543321185875899
A74: بانک آینده | B74: وآیند | C74: بانکها و موسسات اعتباری | D74: -0.81644698012983996 | E74: =VLOOKUP(RC[-3],'[screener-data-1401-11-24.xlsx]overview'!R8C2:R902C7,6,0) -> 161328000000000 | F74: 234.48837209302326 | G74: =VLOOKUP(RC[-5],'[screener-data-1401-11-24.xlsx]overview'!R8C2:R897C8,7,FALSE) -> 0 | I74: =IF(RC[-1]="",((RC[-2]+RC[-3])/2)*0.65,RC[-1]) -> 76.208720930232559 | J74: =RC[-1]*RC[-5]/R92C5 -> 3.2855136303386656 | M74: 1.8861693389990588 | N74: -0.16407972111369964
A75: بانک اقتصاد نوین | B75: ونوین | C75: بانکها و موسسات اعتباری | D75: -0.12202562538132999 | E75: =VLOOKUP(RC[-3],'[screener-data-1401-11-24.xlsx]overview'!R8C2:R902C7,6,0) -> 98427249490000 | F75: 3.9541062801932365 | G75: =VLOOKUP(RC[-5],'[screener-data-1401-11-24.xlsx]overview'!R8C2:R897C8,7,FALSE) -> 4.8716656818999997 | I75: =IF(RC[-1]="",((RC[-2]+RC[-3])/2)*0.65,RC[-1]) -> 2.868375887680302 | J75: =RC[-1]*RC[-5]/R92C5 -> 7.5446702475791994E-2 | M75: 1.6068923954133538 | N75: 1.3636007094610831
A76: بانک ایران زمین | B76: وزمین | C76: بانکها و موسسات اعتباری | D76: -0.52493438320208996 | E76: =VLOOKUP(RC[-3],'[screener-data-1401-11-24.xlsx]overview'!R8C2:R902C7,6,0) -> 30120000000000 | F76: 101.06666666666666 | G76: =VLOOKUP(RC[-5],'[screener-data-1401-11-24.xlsx]overview'!R8C2:R897C8,7,FALSE) -> 0 | I76: =IF(RC[-1]="",((RC[-2]+RC[-3])/2)*0.65,RC[-1]) -> 32.846666666666664 | J76: =RC[-1]*RC[-5]/R92C5 -> 0.26438397114798967 | M76: -7.5987118278761452 | N76: -9.9575322088974003E-2
A77: بانک پارسیان | B77: وپارس | C77: بانکها و موسسات اعتباری | D77: -0.56053811659191999 | E77: =VLOOKUP(RC[-3],'[screener-data-1401-11-24.xlsx]overview'!R8C2:R902C7,6,0) -> 274064020000000 | F77: 50.685714285714283 | G77: =VLOOKUP(RC[-5],'[screener-data-1401-11-24.xlsx]overview'!R8C2:R897C8,7,FALSE) -> 0 | I77: =IF(RC[-1]="",((RC[-2]+RC[-3])/2)*0.65,RC[-1]) -> 16.472857142857144 | J77: =RC[-1]*RC[-5]/R92C5 -> 1.206451330361008 | M77: 4.9820438009753083 | N77: 23.413082420634453
A78: بانک پاسارگاد | B78: وپاسار | C78: بانکها و موسسات اعتباری | D78: -0.89119170984454998 | E78: =VLOOKUP(RC[-3],'[screener-data-1401-11-24.xlsx]overview'!R8C2:R902C7,6,0) -> 614315520000000 | F78: 4.0388513513513518 | G78: =VLOOKUP(RC[-5],'[screener-data-1401-11-24.xlsx]overview'!R8C2:R897C8,7,FALSE) -> 3.1415028682999999 | I78: =IF(RC[-1]="",((RC[-2]+RC[-3])/2)*0.65,RC[-1]) -> 2.3336151213866896 | J78: =RC[-1]*RC[-5]/R92C5 -> 0.38309772107616574 | M78: 3.5881776250115016 | N78: 1.4261723628852196
A79: بانک تجارت | B79: وتجارت | C79: بانکها و موسسات اعتباری | D79: -2.0372526193247902 | E79: =VLOOKUP(RC[-3],'[screener-data-1401-11-24.xlsx]overview'!R8C2:R902C7,6,0) -> 375524114979000 | F79: 8.3731343283582085 | G79: =VLOOKUP(RC[-5],'[screener-data-1401-11-24.xlsx]overview'!R8C2:R897C8,7,FALSE) -> 8.0984224769999997 | I79: =IF(RC[-1]="",((RC[-2]+RC[-3])/2)*0.65,RC[-1]) -> 5.3532559617414179 | J79: =RC[-1]*RC[-5]/R92C5 -> 0.53721074599447871 | M79: 1.5180567341550919 | N79: 1.1750716866628339
A80: بانک خاورمیانه | B80: وخاور | C80: بانکها و موسسات اعتباری | D80: -0.85967130214916998 | E80: =VLOOKUP(RC[-3],'[screener-data-1401-11-24.xlsx]overview'!R8C2:R902C7,6,0) -> 137165000000000 | F80: 4.7642770352369377 | G80: =VLOOKUP(RC[-5],'[screener-data-1401-11-24.xlsx]overview'!R8C2:R897C8,7,FALSE) -> 5.4746722920000002 | I80: =IF(RC[-1]="",((RC[-2]+RC[-3])/2)*0.65,RC[-1]) -> 3.3276585313520051 | J80: =RC[-1]*RC[-5]/R92C5 -> 0.12197502429784102 | M80: 5.0675140500875031 | N80: 1.4968239388728406
A81: بانک دی | B81: دی | C81: بانکها و موسسات اعتباری | D81: -2.4881516587677699 | E81: =VLOOKUP(RC[-3],'[screener-data-1401-11-24.xlsx]overview'!R8C2:R902C7,6,0) -> 106515000000000 | F81: 3.2023346303501947 | G81: =VLOOKUP(RC[-5],'[screener-data-1401-11-24.xlsx]overview'!R8C2:R897C8,7,FALSE) -> 0 | I81: =IF(RC[-1]="",((RC[-2]+RC[-3])/2)*0.65,RC[-1]) -> 1.0407587548638133 | J81: =RC[-1]*RC[-5]/R92C5 -> 2.9624409023939802E-2 | M81: 2.8277735131193751 | N81: -2.6190983126128211
A82: بانک سامان | B82: سامان | C82: بانکها و موسسات اعتباری | D82: -1.5366430260047199 | E82: =VLOOKUP(RC[-3],'[screener-data-1401-11-24.xlsx]overview'!R8C2:R902C7,6,0) -> 116861670000000 | F82: 3.9169278996865202 | G82: =VLOOKUP(RC[-5],'[screener-data-1401-11-24.xlsx]overview'!R8C2:R897C8,7,FALSE) -> 3.0545245081000001 | I82: =IF(RC[-1]="",((RC[-2]+RC[-3])/2)*0.65,RC[-1]) -> 2.2657220325306193 | J82: =RC[-1]*RC[-5]/R92C5 -> 7.0756699540295093E-2 | M82: 5.45770817549566 | N82: 0.81322018489491521
A83: بانک سرمایه | B83: سمایه | C83: بانکها و موسسات اعتباری | D83: -0.19841269841268999 | E83: =VLOOKUP(RC[-3],'[screener-data-1401-11-24.xlsx]overview'!R8C2:R902C7,6,0) -> 19360000000000 | F83: -0.2908859588248901 | G83: =VLOOKUP(RC[-5],'[screener-data-1401-11-24.xlsx]overview'!R8C2:R897C8,7,FALSE) -> 0 | I83: =IF(RC[-1]="",((RC[-2]+RC[-3])/2)*0.65,RC[-1]) -> -9.4537936618089291E-2 | J83: =RC[-1]*RC[-5]/R92C5 -> -4.8910299584685663E-4 | M83: -1.114180522164135 | N83: -4.3695707160856835E-2
A84: بانک سینا | B84: وسینا | C84: بانکها و موسسات اعتباری | D84: -2.9110684580934101 | E84: =VLOOKUP(RC[-3],'[screener-data-1401-11-24.xlsx]overview'!R8C2:R902C7,6,0) -> 71176315927152 | F84: 10.574912891986063 | G84: =VLOOKUP(RC[-5],'[screener-data-1401-11-24.xlsx]overview'!R8C2:R897C8,7,FALSE) -> 12.506671677 | I84: =IF(RC[-1]="",((RC[-2]+RC[-3])/2)*0.65,RC[-1]) -> 7.5015149849204708 | J84: =RC[-1]*RC[-5]/R92C5 -> 0.14268336308081916 | M84: 2.8201097862660918 | N84: 1.8372476505630591
A85: بانک صادرات ایران | B85: وبصادر | C85: بانکها و موسسات اعتباری | D85: -1.01431980906921 | E85: =VLOOKUP(RC[-3],'[screener-data-1401-11-24.xlsx]overview'!R8C2:R902C7,6,0) -> 296523566652000 | F85: 79 | G85: =VLOOKUP(RC[-5],'[screener-data-1401-11-24.xlsx]overview'!R8C2:R897C8,7,FALSE) -> 410.23804211070001 | I85: =IF(RC[-1]="",((RC[-2]+RC[-3])/2)*0.65,RC[-1]) -> 159.00236368597751 | J85: =RC[-1]*RC[-5]/R92C5 -> 12.599451716260059 | M85: 1.3659891563242887 | N85: 1.2407219242081988
A86: بانک قرض الحسنه رسالت | B86: وسالت | C86: بانکها و موسسات اعتباری | D86: -0.61837455830388 | E86: =VLOOKUP(RC[-3],'[screener-data-1401-11-24.xlsx]overview'!R8C2:R902C7,6,0) -> 107134257600000 | F86: 7.6645319525820961 | G86: =VLOOKUP(RC[-5],'[screener-data-1401-11-24.xlsx]overview'!R8C2:R897C8,7,FALSE) -> 4.7118350615000004 | I86: =IF(RC[-1]="",((RC[-2]+RC[-3])/2)*0.65,RC[-1]) -> 4.0223192795766813 | J86: =RC[-1]*RC[-5]/R92C5 -> 0.11515790512753854 | M86: 3.2500078293974881 | N86: 3.5289769331874017
A87: بانک گردشگری | B87: وگردش | C87: بانکها و موسسات اعتباری | D87: 0.13568521031207001 | E87: =VLOOKUP(RC[-3],'[screener-data-1401-11-24.xlsx]overview'!R8C2:R902C7,6,0) -> 106950000000000 | F87: 20.386740331491712 | G87: =VLOOKUP(RC[-5],'[screener-data-1401-11-24.xlsx]overview'!R8C2:R897C8,7,FALSE) -> 15.847528479099999 | I87: =IF(RC[-1]="",((RC[-2]+RC[-3])/2)*0.65,RC[-1]) -> 11.776137363442308 | J87: =RC[-1]*RC[-5]/R92C5 -> 0.3365677524543399 | M87: 26.804490660196784 | N87: 5.1231701269662251
A88: بانک ملت | B88: وبملت | C88: بانکها و موسسات اعتباری | D88: 4.66726889491117 | E88: =VLOOKUP(RC[-3],'[screener-data-1401-11-24.xlsx]overview'!R8C2:R902C7,6,0) -> 910860988312000 | F88: 4.5676741130091987 | G88: =VLOOKUP(RC[-5],'[screener-data-1401-11-24.xlsx]overview'!R8C2:R897C8,7,FALSE) -> 3.1847067948999999 | I88: =IF(RC[-1]="",((RC[-2]+RC[-3])/2)*0.65,RC[-1]) -> 2.5195237950704898 | J88: =RC[-1]*RC[-5]/R92C5 -> 0.61328086858501385 | M88: 1.8746280519419301 | N88: 1.203466058703498
A89: بانک کار آفرین | B89: وکار | C89: بانکها و موسسات اعتباری | D89: 9.1687041564790003E-2 | E89: =VLOOKUP(RC[-3],'[screener-data-1401-11-24.xlsx]overview'!R8C2:R902C7,6,0) -> 150696000000000 | F89: 9.8348348348348349 | G89: =VLOOKUP(RC[-5],'[screener-data-1401-11-24.xlsx]overview'!R8C2:R897C8,7,FALSE) -> 11.519452165800001 | I89: =IF(RC[-1]="",((RC[-2]+RC[-3])/2)*0.65,RC[-1]) -> 6.9401432752063208 | J89: =RC[-1]*RC[-5]/R92C5 -> 0.27948532671860382 | M89: 5.6364287572428484 | N89: 1.9959108994825405
A90: پست بانک ایران | B90: وپست | C90: بانکها و موسسات اعتباری | D90: -0.68846815834766995 | E90: =VLOOKUP(RC[-3],'[screener-data-1401-11-24.xlsx]overview'!R8C2:R902C7,6,0) -> 93427765200000 | F90: 7.7972972972972974 | G90: =VLOOKUP(RC[-5],'[screener-data-1401-11-24.xlsx]overview'!R8C2:R897C8,7,FALSE) -> 4.6297332413000003 | I90: =IF(RC[-1]="",((RC[-2]+RC[-3])/2)*0.65,RC[-1]) -> 4.0387849250441219 | J90: =RC[-1]*RC[-5]/R92C5 -> 0.10083598337679844 | M90: 2.6297305988768098 | N90: 2.7162461151556454
A91: موسسه اعتباری نور | B91: ونور | C91: بانکها و موسسات اعتباری | D91: 0 | E91: =VLOOKUP(RC[-3],'[screener-data-1401-11-24.xlsx]overview'!R8C2:R902C7,6,0) -> 3000000000000 | G91: =VLOOKUP(RC[-5],'[screener-data-1401-11-24.xlsx]overview'!R8C2:R897C8,7,FALSE) -> 0 | I91: =IF(RC[-1]="",((RC[-2]+RC[-3])/2)*0.65,RC[-1]) -> 0 | J91: =RC[-1]*RC[-5]/R92C5 -> 0 | N91: 0.87766029807099044
E92: =SUM(R[-20]C:R[-1]C) -> 3742063468160152 | I92: =IF(RC[-1]="",((RC[-2]+RC[-3])/2)*0.65,RC[-1]) -> 0 | J92: =SUM(R[-20]C:R[-1]C) -> 20.170320066255385
A93: بیمه آرمان | B93: آرمان | C93: بیمه و بازنشستگی | D93: -0.93984962406015005 | E93: =VLOOKUP(RC[-3],'[screener-data-1401-11-24.xlsx]overview'!R8C2:R902C7,6,0) -> 15780000000000 | F93: 85 | G93: =VLOOKUP(RC[-5],'[screener-data-1401-11-24.xlsx]overview'!R8C2:R897C8,7,FALSE) -> 47.107149634800003 | I93: =IF(RC[-1]="",((RC[-2]+RC[-3])/2)*0.65,RC[-1]) -> 42.934823631310003 | J93: =RC[-1]*RC[-5]/R123C5 -> 0.39667396231527896 | M93: 30.443246740492985 | N93: 6.470258908576592
A94: بیمه آسیا | B94: آسیا | C94: بیمه و بازنشستگی | D94: -19.725013220518239 | E94: =VLOOKUP(RC[-3],'[screener-data-1401-11-24.xlsx]overview'!R8C2:R902C7,6,0) -> 36632078470482 | F94: 6.0720000000000001 | G94: =VLOOKUP(RC[-5],'[screener-data-1401-11-24.xlsx]overview'!R8C2:R897C8,7,FALSE) -> 9.1279757309999994 | I94: =IF(RC[-1]="",((RC[-2]+RC[-3])/2)*0.65,RC[-1]) -> 4.9399921125749993 | J94: =RC[-1]*RC[-5]/R123C5 -> 0.10595094351589601 | N94: 0.97869613150557222
A95: بیمه اتکائی امین | B95: اتکام | C95: بیمه و بازنشستگی | D95: 0 | E95: =VLOOKUP(RC[-3],'[screener-data-1401-11-24.xlsx]overview'!R8C2:R902C7,6,0) -> 39112000000000 | F95: 8.6888111888111883 | G95: =VLOOKUP(RC[-5],'[screener-data-1401-11-24.xlsx]overview'!R8C2:R897C8,7,FALSE) -> 8.3464740618000004 | I95: =IF(RC[-1]="",((RC[-2]+RC[-3])/2)*0.65,RC[-1]) -> 5.5364677064486365 | J95: =RC[-1]*RC[-5]/R123C5 -> 0.12678264486711827 | N95: 1.8185738078242437
A96: بیمه اتکائی ایرانیان | B96: اتکای | C96: بیمه و بازنشستگی | D96: -0.15898251192367999 | E96: =VLOOKUP(RC[-3],'[screener-data-1401-11-24.xlsx]overview'!R8C2:R902C7,6,0) -> 50240000000000 | F96: 6.5484880083420229 | G96: =VLOOKUP(RC[-5],'[screener-data-1401-11-24.xlsx]overview'!R8C2:R897C8,7,FALSE) -> 9.3275954714000004 | I96: =IF(RC[-1]="",((RC[-2]+RC[-3])/2)*0.65,RC[-1]) -> 5.1597271309161581 | J96: =RC[-1]*RC[-5]/R123C5 -> 0.15177260130101583 | N96: 3.5950548532095596
A97: بیمه اتکای آوای پارس | B97: آواپارس | C97: بیمه و بازنشستگی | D97: -2.9778393351800498 | E97: =VLOOKUP(RC[-3],'[screener-data-1401-11-24.xlsx]overview'!R8C2:R902C7,6,0) -> 3500000000000 | G97: =VLOOKUP(RC[-5],'[screener-data-1401-11-24.xlsx]overview'!R8C2:R897C8,7,FALSE) -> 4.0517043784000002 | I97: =IF(RC[-1]="",((RC[-2]+RC[-3])/2)*0.65,RC[-1]) -> 1.3168039229800002 | J97: =RC[-1]*RC[-5]/R123C5 -> 2.6983990063846838E-3
A98: بیمه اتکایی سامان | B98: اتکاسا | C98: بیمه و بازنشستگی | D98: 2.42137489563039 | E98: =VLOOKUP(RC[-3],'[screener-data-1401-11-24.xlsx]overview'!R8C2:R902C7,6,0) -> 1250000000000 | G98: =VLOOKUP(RC[-5],'[screener-data-1401-11-24.xlsx]overview'!R8C2:R897C8,7,FALSE) -> 1.8351802586999999 | I98: =IF(RC[-1]="",((RC[-2]+RC[-3])/2)*0.65,RC[-1]) -> 0.59643358407750002 | J98: =RC[-1]*RC[-5]/R123C5 -> 4.3650489170968937E-4 | N98: 2.2691117167556634
A99: بیمه البرز | B99: البرز | C99: بیمه و بازنشستگی | D99: 1.2692656391659101 | E99: =VLOOKUP(RC[-3],'[screener-data-1401-11-24.xlsx]overview'!R8C2:R902C7,6,0) -> 80255000000000 | F99: 5.8328981723237598 | G99: =VLOOKUP(RC[-5],'[screener-data-1401-11-24.xlsx]overview'!R8C2:R897C8,7,FALSE) -> 6.6552587587999996 | I99: =IF(RC[-1]="",((RC[-2]+RC[-3])/2)*0.65,RC[-1]) -> 4.058651002615222 | J99: =RC[-1]*RC[-5]/R123C5 -> 0.19070883795359364 | N99: 1.6483814871263915
A100: بیمه پارسیان | B100: پارسیان | C100: بیمه و بازنشستگی | D100: 2.50994796449341 | E100: =VLOOKUP(RC[-3],'[screener-data-1401-11-24.xlsx]overview'!R8C2:R902C7,6,0) -> 43524000000000 | F100: 39.86904761904762 | G100: =VLOOKUP(RC[-5],'[screener-data-1401-11-24.xlsx]overview'!R8C2:R897C8,7,FALSE) -> 10.006090525899999 | I100: =IF(RC[-1]="",((RC[-2]+RC[-3])/2)*0.65,RC[-1]) -> 16.209419897107978 | J100: =RC[-1]*RC[-5]/R123C5 -> 0.41306013859798157 | N100: 2.1709377405220538
A101: بیمه پاسارگاد | B101: بپاس | C101: بیمه و بازنشستگی | D101: 1.10081112398609 | E101: =VLOOKUP(RC[-3],'[screener-data-1401-11-24.xlsx]overview'!R8C2:R902C7,6,0) -> 1005250176000000 | F101: 17.124631992149165 | G101: =VLOOKUP(RC[-5],'[screener-data-1401-11-24.xlsx]overview'!R8C2:R897C8,7,FALSE) -> 32.779712793000002 | I101: =IF(RC[-1]="",((RC[-2]+RC[-3])/2)*0.65,RC[-1]) -> 16.21891205517348 | J101: =RC[-1]*RC[-5]/R123C5 -> 9.5458122643173269 | N101: 12.763608637557736
A102: بیمه تجارت نو | B102: بنو | C102: بیمه و بازنشستگی | D102: 3.8472499287546298 | E102: =VLOOKUP(RC[-3],'[screener-data-1401-11-24.xlsx]overview'!R8C2:R902C7,6,0) -> 23082000000000 | F102: 86.761904761904759 | G102: =VLOOKUP(RC[-5],'[screener-data-1401-11-24.xlsx]overview'!R8C2:R897C8,7,FALSE) -> 79.686261420999998 | I102: =IF(RC[-1]="",((RC[-2]+RC[-3])/2)*0.65,RC[-1]) -> 54.09565400944404 | J102: =RC[-1]*RC[-5]/R123C5 -> 0.7310596675793003 | N102: 3.1728341314758381
A103: بیمه تعاون | B103: وتعاون | C103: بیمه و بازنشستگی | D103: -3.8095238095238 | E103: =VLOOKUP(RC[-3],'[screener-data-1401-11-24.xlsx]overview'!R8C2:R902C7,6,0) -> 8210000000000 | F103: 17.376344086021504 | G103: =VLOOKUP(RC[-5],'[screener-data-1401-11-24.xlsx]overview'!R8C2:R897C8,7,FALSE) -> 148.38282410639999 | I103: =IF(RC[-1]="",((RC[-2]+RC[-3])/2)*0.65,RC[-1]) -> 53.871729662536985 | J103: =RC[-1]*RC[-5]/R123C5 -> 0.25895308483517765 | N103: 1.4771056845351971
A104: بیمه حافظ | B104: وحافظ | C104: بیمه و بازنشستگی | D104: 2.9778569610587899 | E104: =VLOOKUP(RC[-3],'[screener-data-1401-11-24.xlsx]overview'!R8C2:R902C7,6,0) -> 7382669016000 | F104: 84.291666666666671 | G104: =VLOOKUP(RC[-5],'[screener-data-1401-11-24.xlsx]overview'!R8C2:R897C8,7,FALSE) -> 100.11130681189999 | I104: =IF(RC[-1]="",((RC[-2]+RC[-3])/2)*0.65,RC[-1]) -> 59.930966380534166 | J104: =RC[-1]*RC[-5]/R123C5 -> 0.25904886346791928 | N104: 14.820512820512821
A105: بیمه حکمت صبا | B105: وحکمت | C105: بیمه و بازنشستگی | D105: 2.0167240531234598 | E105: =VLOOKUP(RC[-3],'[screener-data-1401-11-24.xlsx]overview'!R8C2:R902C7,6,0) -> 6267425175000 | F105: 30.955223880597014 | G105: =VLOOKUP(RC[-5],'[screener-data-1401-11-24.xlsx]overview'!R8C2:R897C8,7,FALSE) -> 10.3621873428 | I105: =IF(RC[-1]="",((RC[-2]+RC[-3])/2)*0.65,RC[-1]) -> 13.428158647604031 | J105: =RC[-1]*RC[-5]/R123C5 -> 4.9274546230351615E-2 | N105: 1.835692375875688
A106: بیمه دانا | B106: دانا | C106: بیمه و بازنشستگی | D106: -2.30695289971163 | E106: =VLOOKUP(RC[-3],'[screener-data-1401-11-24.xlsx]overview'!R8C2:R902C7,6,0) -> 56970160416000 | F106: -2.0984170681348933 | G106: =VLOOKUP(RC[-5],'[screener-data-1401-11-24.xlsx]overview'!R8C2:R897C8,7,FALSE) -> 1.5055723940000001 | I106: =IF(RC[-1]="",((RC[-2]+RC[-3])/2)*0.65,RC[-1]) -> -0.19267451909384029 | J106: =RC[-1]*RC[-5]/R123C5 -> -6.4267105187831748E-3 | N106: 1.054698937257367
A107: بیمه دی | B107: ودی | C107: بیمه و بازنشستگی | D107: -2.4850894632206701 | E107: =VLOOKUP(RC[-3],'[screener-data-1401-11-24.xlsx]overview'!R8C2:R902C7,6,0) -> 23573900000000 | F107: 6.6734693877551017 | G107: =VLOOKUP(RC[-5],'[screener-data-1401-11-24.xlsx]overview'!R8C2:R897C8,7,FALSE) -> 10.877307305900001 | I107: =IF(RC[-1]="",((RC[-2]+RC[-3])/2)*0.65,RC[-1]) -> 5.704002425437908 | J107: =RC[-1]*RC[-5]/R123C5 -> 7.8727806368651843E-2 | M107: 29.516814159292036 | N107: 1.8406309599491417
A108: بیمه رازی | B108: ورازی | C108: بیمه و بازنشستگی | D108: -2.4729520865533199 | E108: =VLOOKUP(RC[-3],'[screener-data-1401-11-24.xlsx]overview'!R8C2:R902C7,6,0) -> 25093999054000 | F108: 114.72727272727273 | G108: =VLOOKUP(RC[-5],'[screener-data-1401-11-24.xlsx]overview'!R8C2:R897C8,7,FALSE) -> 179.46629016040001 | I108: =IF(RC[-1]="",((RC[-2]+RC[-3])/2)*0.65,RC[-1]) -> 95.612907938493635 | J108: =RC[-1]*RC[-5]/R123C5 -> 1.4047641532084683 | N108: 1.4279463871207949
A109: بیمه زندگی باران | B109: باران | C109: بیمه و بازنشستگی | D109: 0 | E109: =VLOOKUP(RC[-3],'[screener-data-1401-11-24.xlsx]overview'!R8C2:R902C7,6,0) -> 4106400000000 | F109: 126.81481481481481 | G109: =VLOOKUP(RC[-5],'[screener-data-1401-11-24.xlsx]overview'!R8C2:R897C8,7,FALSE) -> 36.289055681599997 | I109: =IF(RC[-1]="",((RC[-2]+RC[-3])/2)*0.65,RC[-1]) -> 53.008757911334811 | J109: =RC[-1]*RC[-5]/R123C5 -> 0.12744590673952591 | N109: 2.5816553432311031
A110: بیمه زندگی خاورمیانه | B110: بخاور | C110: بیمه و بازنشستگی | D110: -0.50662509742789996 | E110: =VLOOKUP(RC[-3],'[screener-data-1401-11-24.xlsx]overview'!R8C2:R902C7,6,0) -> 6079200000000 | F110: 20.756097560975611 | G110: =VLOOKUP(RC[-5],'[screener-data-1401-11-24.xlsx]overview'!R8C2:R897C8,7,FALSE) -> 8.9919566947000007 | I110: =IF(RC[-1]="",((RC[-2]+RC[-3])/2)*0.65,RC[-1]) -> 9.6681176330945746 | J110: =RC[-1]*RC[-5]/R123C5 -> 3.4411639900163028E-2 | N110: 1.9206999683707686
A111: بیمه زندگی کاریزما | B111: کاریز | C111: بیمه و بازنشستگی | E111: =VLOOKUP(RC[-3],'[screener-data-1401-11-24.xlsx]overview'!R8C2:R902C7,6,0) -> 1200000000000 | G111: =VLOOKUP(RC[-5],'[screener-data-1401-11-24.xlsx]overview'!R8C2:R897C8,7,FALSE) -> 5.4439544885000002 | I111: =IF(RC[-1]="",((RC[-2]+RC[-3])/2)*0.65,RC[-1]) -> 1.7692852087625002 | J111: =RC[-1]*RC[-5]/R123C5 -> 1.2430714874364201E-3 | N111: 0.42161271078000462
A112: بیمه سامان | B112: بساما | C112: بیمه و بازنشستگی | D112: 1.0309278350515401 | E112: =VLOOKUP(RC[-3],'[screener-data-1401-11-24.xlsx]overview'!R8C2:R902C7,6,0) -> 53000000000000 | F112: 19.67153284671533 | G112: =VLOOKUP(RC[-5],'[screener-data-1401-11-24.xlsx]overview'!R8C2:R897C8,7,FALSE) -> 22.680743876899999 | I112: =IF(RC[-1]="",((RC[-2]+RC[-3])/2)*0.65,RC[-1]) -> 13.764489935174984 | J112: =RC[-1]*RC[-5]/R123C5 -> 0.42712304537704732 | N112: 4.5847461836878987
A113: بیمه سرمد | B113: وسرمد | C113: بیمه و بازنشستگی | D113: 1.99516324062877 | E113: =VLOOKUP(RC[-3],'[screener-data-1401-11-24.xlsx]overview'!R8C2:R902C7,6,0) -> 11352647591098 | F113: -2.2081151832460733 | G113: =VLOOKUP(RC[-5],'[screener-data-1401-11-24.xlsx]overview'!R8C2:R897C8,7,FALSE) -> 0 | I113: =IF(RC[-1]="",((RC[-2]+RC[-3])/2)*0.65,RC[-1]) -> -0.71763743455497386 | J113: =RC[-1]*RC[-5]/R123C5 -> -4.7700096088054318E-3 | N113: 1.4953174382606336
A114: بیمه سینا | B114: وسین | C114: بیمه و بازنشستگی | D114: -2.9217719132893398 | E114: =VLOOKUP(RC[-3],'[screener-data-1401-11-24.xlsx]overview'!R8C2:R902C7,6,0) -> 12108665627380 | F114: -2.0892494929006085 | G114: =VLOOKUP(RC[-5],'[screener-data-1401-11-24.xlsx]overview'!R8C2:R897C8,7,FALSE) -> 0 | I114: =IF(RC[-1]="",((RC[-2]+RC[-3])/2)*0.65,RC[-1]) -> -0.67900608519269778 | J114: =RC[-1]*RC[-5]/R123C5 -> -4.8137880583498261E-3 | N114: -56.677099553928748
A115: بیمه ما | B115: ما | C115: بیمه و بازنشستگی | D115: 0.82808877111626 | E115: =VLOOKUP(RC[-3],'[screener-data-1401-11-24.xlsx]overview'!R8C2:R902C7,6,0) -> 24368000000000 | F115: 4.3547925608011449 | G115: =VLOOKUP(RC[-5],'[screener-data-1401-11-24.xlsx]overview'!R8C2:R897C8,7,FALSE) -> 7.0265414388999998 | I115: =IF(RC[-1]="",((RC[-2]+RC[-3])/2)*0.65,RC[-1]) -> 3.6989335499028719 | J115: =RC[-1]*RC[-5]/R123C5 -> 5.2773199806814768E-2 | N115: 1.3100476523377982
A116: بیمه معلم | B116: ومعلم | C116: بیمه و بازنشستگی | D116: 1.6896120150187699 | E116: =VLOOKUP(RC[-3],'[screener-data-1401-11-24.xlsx]overview'!R8C2:R902C7,6,0) -> 9487730000000 | F116: 5.4898648648648649 | G116: =VLOOKUP(RC[-5],'[screener-data-1401-11-24.xlsx]overview'!R8C2:R897C8,7,FALSE) -> 10.396751242200001 | I116: =IF(RC[-1]="",((RC[-2]+RC[-3])/2)*0.65,RC[-1]) -> 5.1631502347960812 | J116: =RC[-1]*RC[-5]/R123C5 -> 2.8680986921040739E-2 | N116: 0.96774995353924476
A117: بیمه ملت | B117: ملت | C117: بیمه و بازنشستگی | D117: 0.89219330855017998 | E117: =VLOOKUP(RC[-3],'[screener-data-1401-11-24.xlsx]overview'!R8C2:R902C7,6,0) -> 41540524833145 | F117: 84.8125 | G117: =VLOOKUP(RC[-5],'[screener-data-1401-11-24.xlsx]overview'!R8C2:R897C8,7,FALSE) -> 0 | I117: =IF(RC[-1]="",((RC[-2]+RC[-3])/2)*0.65,RC[-1]) -> 27.564062500000002 | J117: =RC[-1]*RC[-5]/R123C5 -> 0.67039723962027598 | N117: 1.1661903744867832
A118: بیمه میهن | B118: میهن | C118: بیمه و بازنشستگی | D118: 2.3529411764705799 | E118: =VLOOKUP(RC[-3],'[screener-data-1401-11-24.xlsx]overview'!R8C2:R902C7,6,0) -> 7185000000000 | F118: -2.4553151458137346 | G118: =VLOOKUP(RC[-5],'[screener-data-1401-11-24.xlsx]overview'!R8C2:R897C8,7,FALSE) -> 0 | I118: =IF(RC[-1]="",((RC[-2]+RC[-3])/2)*0.65,RC[-1]) -> -0.79797742238946379 | J118: =RC[-1]*RC[-5]/R123C5 -> -3.3568689613523942E-3 | N118: -1.4677436618498556
A119: بیمه نوین | B119: نوین | C119: بیمه و بازنشستگی | D119: 0.92355053873781001 | E119: =VLOOKUP(RC[-3],'[screener-data-1401-11-24.xlsx]overview'!R8C2:R902C7,6,0) -> 10230000000000 | F119: 16.529411764705884 | G119: =VLOOKUP(RC[-5],'[screener-data-1401-11-24.xlsx]overview'!R8C2:R897C8,7,FALSE) -> 0 | I119: =IF(RC[-1]="",((RC[-2]+RC[-3])/2)*0.65,RC[-1]) -> 5.3720588235294127 | J119: =RC[-1]*RC[-5]/R123C5 -> 3.2176100179853125E-2 | N119: 1.3149826732481316
A120: بیمه هوشمند فردا | B120: وفردا | C120: بیمه و بازنشستگی | E120: =VLOOKUP(RC[-3],'[screener-data-1401-11-24.xlsx]overview'!R8C2:R902C7,6,0) -> 2500000000000 | G120: =VLOOKUP(RC[-5],'[screener-data-1401-11-24.xlsx]overview'!R8C2:R897C8,7,FALSE) -> 0 | I120: =IF(RC[-1]="",((RC[-2]+RC[-3])/2)*0.65,RC[-1]) -> 0 | J120: =RC[-1]*RC[-5]/R123C5 -> 0
A121: بیمه کارآفرین | B121: وآفری | C121: بیمه و بازنشستگی | D121: -3.8461538461529998E-2 | E121: =VLOOKUP(RC[-3],'[screener-data-1401-11-24.xlsx]overview'!R8C2:R902C7,6,0) -> 31176000000000 | F121: 8.3301282051282044 | G121: =VLOOKUP(RC[-5],'[screener-data-1401-11-24.xlsx]overview'!R8C2:R897C8,7,FALSE) -> 8.3302259228000004 | I121: =IF(RC[-1]="",((RC[-2]+RC[-3])/2)*0.65,RC[-1]) -> 5.4146150915766667 | J121: =RC[-1]*RC[-5]/R123C5 -> 9.8833686390178047E-2 | N121: 1.8583445467794504
A122: بیمه کوثر | B122: کوثر | C122: بیمه و بازنشستگی | D122: 2.3618327822390001E-2 | E122: =VLOOKUP(RC[-3],'[screener-data-1401-11-24.xlsx]overview'!R8C2:R902C7,6,0) -> 67523237449380 | F122: 10.508684863523573 | G122: =VLOOKUP(RC[-5],'[screener-data-1401-11-24.xlsx]overview'!R8C2:R897C8,7,FALSE) -> 8.3369231019000001 | I122: =IF(RC[-1]="",((RC[-2]+RC[-3])/2)*0.65,RC[-1]) -> 6.1248225887626617 | J122: =RC[-1]*RC[-5]/R123C5 -> 0.24213846355614685 | N122: 2.4215093661491589
E123: =SUM(R[-30]C:R[-1]C) -> 1707980813632485 | J123: =SUM(R[-30]C:R[-1]C) -> 15.41158038128737
A124: تأسیسات راه آهن | B124: بالاس | C124: پیمانکاری صنعتی | D124: 1.40664961636828 | E124: =VLOOKUP(RC[-3],'[screener-data-1401-11-24.xlsx]overview'!R8C2:R902C7,6,0) -> 5430000000000 | F124: 217.85714285714286 | G124: =VLOOKUP(RC[-5],'[screener-data-1401-11-24.xlsx]overview'!R8C2:R897C8,7,FALSE) -> 277.50515261560003 | I124: =IF(RC[-1]="",((RC[-2]+RC[-3])/2)*0.65,RC[-1]) -> 160.99274602864142 | J124: =RC[-1]*RC[-5]/R126C5 -> 15.718017700331446 | M124: 3.1306470740885595 | N124: 25.201271186440678
A125: صنعتی دریایی | B125: خصدرا | C125: پیمانکاری صنعتی | D125: -1.9918283963227701 | E125: =VLOOKUP(RC[-3],'[screener-data-1401-11-24.xlsx]overview'!R8C2:R902C7,6,0) -> 50187103098000 | F125: 50.5 | G125: =VLOOKUP(RC[-5],'[screener-data-1401-11-24.xlsx]overview'!R8C2:R897C8,7,FALSE) -> 20.2634087285 | I125: =IF(RC[-1]="",((RC[-2]+RC[-3])/2)*0.65,RC[-1]) -> 22.9981078367625 | J125: =RC[-1]*RC[-5]/R126C5 -> 20.752760298010323 | M125: 3.1074262525359124 | N125: 2.1523699661751059
E126: =SUM(R[-2]C:R[-1]C) -> 55617103098000 | J126: =SUM(R[-2]C:R[-1]C) -> 36.470777998341767
A127: فروشگاه های زنجیره ای دیاکو ایرانیان | B127: بدکو | C127: تجارت عمده و خرده فروشی وسائط نقلیه موتور | D127: 0.56818181818181002 | E127: =VLOOKUP(RC[-3],'[screener-data-1401-11-24.xlsx]overview'!R8C2:R902C7,6,0) -> 31860000000 | F127: 3.3875598086124401 | G127: =VLOOKUP(RC[-5],'[screener-data-1401-11-24.xlsx]overview'!R8C2:R897C8,7,FALSE) -> 9.6972025821999992 | I127: =IF(RC[-1]="",((RC[-2]+RC[-3])/2)*0.65,RC[-1]) -> 4.2525477770140432 | M127: 0.5888550041585805 | N127: 0.49726085124315211
A129: افست | B129: چافست | C129: چاپ | D129: -1.35396518375241 | E129: =VLOOKUP(RC[-3],'[screener-data-1401-11-24.xlsx]overview'!R8C2:R902C7,6,0) -> 9514900000000 | F129: 11.915887850467289 | G129: =VLOOKUP(RC[-5],'[screener-data-1401-11-24.xlsx]overview'!R8C2:R897C8,7,FALSE) -> 10.101569119600001 | I129: =IF(RC[-1]="",((RC[-2]+RC[-3])/2)*0.65,RC[-1]) -> 7.1556735152718698 | M129: 2.3753123886911673 | N129: 3.0316283567976789
I130: =IF(RC[-1]="",((RC[-2]+RC[-3])/2)*0.65,RC[-1]) -> 0
A131: سر. امید | B131: وامید | C131: چندرشته ای صنعتی | D131: -0.15860428231561999 | E131: =VLOOKUP(RC[-3],'[screener-data-1401-11-24.xlsx]overview'!R8C2:R902C7,6,0) -> 1218065559520000 | F131: 9.1830780452224658 | G131: =VLOOKUP(RC[-5],'[screener-data-1401-11-24.xlsx]overview'!R8C2:R897C8,7,FALSE) -> 6.8191669393999996 | I131: =IF(RC[-1]="",((RC[-2]+RC[-3])/2)*0.65,RC[-1]) -> 5.200729620002301 | J131: =RC[-1]*RC[-5]/R136C5 -> 1.2949916184040187 | K131: 0.6 | M131: 8.7857534651603792 | N131: 4.1882723497906618
A132: سر. تامین اجتماعی | B132: شستا | C132: چندرشته ای صنعتی | D132: -0.10504201680672 | E132: =VLOOKUP(RC[-3],'[screener-data-1401-11-24.xlsx]overview'!R8C2:R902C7,6,0) -> 1560756837024000 | F132: 7.3153846153846152 | G132: =VLOOKUP(RC[-5],'[screener-data-1401-11-24.xlsx]overview'!R8C2:R897C8,7,FALSE) -> 7.4682472667999997 | I132: =IF(RC[-1]="",((RC[-2]+RC[-3])/2)*0.65,RC[-1]) -> 4.80468036171 | J132: =RC[-1]*RC[-5]/R136C5 -> 1.5329633250047732 | K132: 0.9 | M132: 6.984362864976057 | N132: 0.87807153844012464
A133: سر. صندوق بازنشستگی | B133: وصندوق | C133: چندرشته ای صنعتی | D133: -1.6771488469601601 | E133: =VLOOKUP(RC[-3],'[screener-data-1401-11-24.xlsx]overview'!R8C2:R902C7,6,0) -> 569964600000000 | F133: 5.5568720379146921 | G133: =VLOOKUP(RC[-5],'[screener-data-1401-11-24.xlsx]overview'!R8C2:R897C8,7,FALSE) -> 5.6446170909999998 | I133: =IF(RC[-1]="",((RC[-2]+RC[-3])/2)*0.65,RC[-1]) -> 3.6404839668972748 | J133: =RC[-1]*RC[-5]/R136C5 -> 0.42416909579658069 | K133: 0.9 | M133: 5.3714851672056874 | N133: 5.2533193961310891
A134: سر. غدیر | B134: وغدیر | C134: چندرشته ای صنعتی | D134: -0.60773480662983004 | E134: =VLOOKUP(RC[-3],'[screener-data-1401-11-24.xlsx]overview'!R8C2:R902C7,6,0) -> 1283040000000000 | F134: 8.0348369807949975 | G134: =VLOOKUP(RC[-5],'[screener-data-1401-11-24.xlsx]overview'!R8C2:R897C8,7,FALSE) -> 8.6823636570999998 | I134: =IF(RC[-1]="",((RC[-2]+RC[-3])/2)*0.65,RC[-1]) -> 5.4330902073158747 | J134: =RC[-1]*RC[-5]/R136C5 -> 1.425013995795285 | K134: 1.1000000000000001 | M134: 7.737318814737951 | N134: 7.6640544951148781
A135: سر. گروه توسعه ملی | B135: وبانک | C135: چندرشته ای صنعتی | D135: 0.83594566353187005 | E135: =VLOOKUP(RC[-3],'[screener-data-1401-11-24.xlsx]overview'!R8C2:R902C7,6,0) -> 259965000000000 | F135: 4.6573359073359075 | G135: =VLOOKUP(RC[-5],'[screener-data-1401-11-24.xlsx]overview'!R8C2:R897C8,7,FALSE) -> 4.6217256831000002 | I135: =IF(RC[-1]="",((RC[-2]+RC[-3])/2)*0.65,RC[-1]) -> 3.0156950168916703 | J135: =RC[-1]*RC[-5]/R136C5 -> 0.16026338724543346 | K135: 0.6 | M135: 4.6121472870392459 | N135: 3.4834950589974936
E136: =SUM(R[-5]C:R[-1]C) -> 4891791996544000 | I136: =IF(RC[-1]="",((RC[-2]+RC[-3])/2)*0.65,RC[-1]) -> 0 | J136: =SUM(R[-5]C:R[-1]C) -> 4.8374014222460913
A137: آسیا سیر ارس | B137: حآسا | C137: حمل و نقل انبارداری و ارتباطات | D137: -5.6039850560398499 | E137: =VLOOKUP(RC[-3],'[screener-data-1401-11-24.xlsx]overview'!R8C2:R902C7,6,0) -> 13644000000000 | F137: 11.825273010920437 | G137: =VLOOKUP(RC[-5],'[screener-data-1401-11-24.xlsx]overview'!R8C2:R897C8,7,FALSE) -> 25.1248384634 | I137: =IF(RC[-1]="",((RC[-2]+RC[-3])/2)*0.65,RC[-1]) -> 12.008786229154142 | J137: =RC[-1]*RC[-5]/R156C5 -> 0.18788434540746074 | M137: 2.7857570311065993 | N137: 3.0074994060883018
A138: تاید واتر خاورمیانه | B138: حتاید | C138: حمل و نقل انبارداری و ارتباطات | D138: 1.7565359477124101 | E138: =VLOOKUP(RC[-3],'[screener-data-1401-11-24.xlsx]overview'!R8C2:R902C7,6,0) -> 34483380339343 | F138: 4.9180651530108586 | G138: =VLOOKUP(RC[-5],'[screener-data-1401-11-24.xlsx]overview'!R8C2:R897C8,7,FALSE) -> 4.8199554356999998 | I138: =IF(RC[-1]="",((RC[-2]+RC[-3])/2)*0.65,RC[-1]) -> 3.1648566913310292 | J138: =RC[-1]*RC[-5]/R156C5 -> 0.12514504334477525 | M138: 6.5642878647940073 | N138: 2.0273943283527358
A139: توسعه حمل و نقل ریلی پارسیان | B139: حپارسا | C139: حمل و نقل انبارداری و ارتباطات | D139: -0.75757575757575002 | E139: =VLOOKUP(RC[-3],'[screener-data-1401-11-24.xlsx]overview'!R8C2:R902C7,6,0) -> 11125000000000 | F139: 7.2639416983523448 | G139: =VLOOKUP(RC[-5],'[screener-data-1401-11-24.xlsx]overview'!R8C2:R897C8,7,FALSE) -> 6.1386234230000003 | I139: =IF(RC[-1]="",((RC[-2]+RC[-3])/2)*0.65,RC[-1]) -> 4.3558336644395128 | J139: =RC[-1]*RC[-5]/R156C5 -> 5.556752813719517E-2 | M139: 2.1360899407075475 | N139: 9.2456665349217992
A140: توسعه خدمات دریایی و بندری سینا | B140: حسینا | C140: حمل و نقل انبارداری و ارتباطات | D140: -0.99502487562189001 | E140: =VLOOKUP(RC[-3],'[screener-data-1401-11-24.xlsx]overview'!R8C2:R902C7,6,0) -> 26573006700000 | F140: 1.8005790807093738 | G140: =VLOOKUP(RC[-5],'[screener-data-1401-11-24.xlsx]overview'!R8C2:R897C8,7,FALSE) -> 7.4084528212 | I140: =IF(RC[-1]="",((RC[-2]+RC[-3])/2)*0.65,RC[-1]) -> 2.9929353681205466 | J140: =RC[-1]*RC[-5]/R156C5 -> 9.1198523426859579E-2 | M140: 2.2843820353435511 | N140: 3.9321656936203735
A141: توکا ریل | B141: توریل | C141: حمل و نقل انبارداری و ارتباطات | D141: 4.58984375 | E141: =VLOOKUP(RC[-3],'[screener-data-1401-11-24.xlsx]overview'!R8C2:R902C7,6,0) -> 32608000000000 | F141: 18.402061855670102 | G141: =VLOOKUP(RC[-5],'[screener-data-1401-11-24.xlsx]overview'!R8C2:R897C8,7,FALSE) -> 11.969435391699999 | I141: =IF(RC[-1]="",((RC[-2]+RC[-3])/2)*0.65,RC[-1]) -> 9.8707366053952832 | J141: =RC[-1]*RC[-5]/R156C5 -> 0.36908253671899194 | M141: 2.6018043640804329 | N141: 3.7491397555510995
A142: حمل و نقل بین المللی خلیج فارس | B142: حفارس | C142: حمل و نقل انبارداری و ارتباطات | D142: 4.3616177636796101 | E142: =VLOOKUP(RC[-3],'[screener-data-1401-11-24.xlsx]overview'!R8C2:R902C7,6,0) -> 30362565120000 | F142: -286.08695652173913 | G142: =VLOOKUP(RC[-5],'[screener-data-1401-11-24.xlsx]overview'!R8C2:R897C8,7,FALSE) -> 330.41062201760002 | I142: =IF(RC[-1]="",((RC[-2]+RC[-3])/2)*0.65,RC[-1]) -> 14.405191286154791 | J142: =RC[-1]*RC[-5]/R156C5 -> 0.50154194551244002 | M142: 4.3650991894860942 | N142: 18.593002381322904
A143: حمل و نقل توکا | B143: حتوکا | C143: حمل و نقل انبارداری و ارتباطات | D143: 1.51515151515151 | E143: =VLOOKUP(RC[-3],'[screener-data-1401-11-24.xlsx]overview'!R8C2:R902C7,6,0) -> 6732000000000 | F143: 4.5493827160493829 | G143: =VLOOKUP(RC[-5],'[screener-data-1401-11-24.xlsx]overview'!R8C2:R897C8,7,FALSE) -> 10.0293804384 | I143: =IF(RC[-1]="",((RC[-2]+RC[-3])/2)*0.65,RC[-1]) -> 4.7380980251960496 | J143: =RC[-1]*RC[-5]/R156C5 -> 3.6576144136175229E-2 | M143: 1.7489694424741915 | N143: 4.6366192707919609
A144: حمل و نقل گهر ترابر سیرجان | B144: حگهر | C144: حمل و نقل انبارداری و ارتباطات | D144: 1.23253903040262 | E144: =VLOOKUP(RC[-3],'[screener-data-1401-11-24.xlsx]overview'!R8C2:R902C7,6,0) -> 57409200000000 | F144: 15.419274092615769 | G144: =VLOOKUP(RC[-5],'[screener-data-1401-11-24.xlsx]overview'!R8C2:R897C8,7,FALSE) -> 8.7285697229999997 | I144: =IF(RC[-1]="",((RC[-2]+RC[-3])/2)*0.65,RC[-1]) -> 7.8480492400751247 | J144: =RC[-1]*RC[-5]/R156C5 -> 0.51664589800345839 | M144: 2.7702842487840935 | N144: 3.8478862083434602
A145: خط دریا بندر | B145: حبندر | C145: حمل و نقل انبارداری و ارتباطات | D145: -1.94850382741823 | E145: =VLOOKUP(RC[-3],'[screener-data-1401-11-24.xlsx]overview'!R8C2:R902C7,6,0) -> 10612500000000 | F145: 16.753864447086801 | G145: =VLOOKUP(RC[-5],'[screener-data-1401-11-24.xlsx]overview'!R8C2:R897C8,7,FALSE) -> 65.302547770700002 | I145: =IF(RC[-1]="",((RC[-2]+RC[-3])/2)*0.65,RC[-1]) -> 26.668333970780711 | J145: =RC[-1]*RC[-5]/R156C5 -> 0.32453635927076802 | M145: 5.2058291492933764 | N145: 8.9697893748797526
A146: دلیجان شکوه پارس | B146: حشکوه | C146: حمل و نقل انبارداری و ارتباطات | D146: 2.95138888888888 | E146: =VLOOKUP(RC[-3],'[screener-data-1401-11-24.xlsx]overview'!R8C2:R902C7,6,0) -> 7108576880000 | F146: 69.183333333333337 | G146: =VLOOKUP(RC[-5],'[screener-data-1401-11-24.xlsx]overview'!R8C2:R897C8,7,FALSE) -> 38.825796756499997 | I146: =IF(RC[-1]="",((RC[-2]+RC[-3])/2)*0.65,RC[-1]) -> 35.102967279195838 | J146: =RC[-1]*RC[-5]/R156C5 -> 0.28613847969054867 | M146: 19.754865866801172 | N146: 3.5416024983446488
A147: رهشاد سپاهان | B147: حرهشا | C147: حمل و نقل انبارداری و ارتباطات | D147: 1.0050251256281399 | E147: =VLOOKUP(RC[-3],'[screener-data-1401-11-24.xlsx]overview'!R8C2:R902C7,6,0) -> 1722750000000 | F147: 1270.6896551724137 | G147: =VLOOKUP(RC[-5],'[screener-data-1401-11-24.xlsx]overview'!R8C2:R897C8,7,FALSE) -> 0 | I147: =IF(RC[-1]="",((RC[-2]+RC[-3])/2)*0.65,RC[-1]) -> 412.97413793103448 | J147: =RC[-1]*RC[-5]/R156C5 -> 0.81582100931018953 | M147: 53.988279342340874 | N147: -411.37434879682462
A148: ریل پرداز سیر | B148: حریل | C148: حمل و نقل انبارداری و ارتباطات | D148: -0.66577896138481996 | E148: =VLOOKUP(RC[-3],'[screener-data-1401-11-24.xlsx]overview'!R8C2:R902C7,6,0) -> 11136735600000 | F148: 16.577777777777779 | G148: =VLOOKUP(RC[-5],'[screener-data-1401-11-24.xlsx]overview'!R8C2:R897C8,7,FALSE) -> 19.835458934199998 | I148: =IF(RC[-1]="",((RC[-2]+RC[-3])/2)*0.65,RC[-1]) -> 11.834301931392776 | J148: =RC[-1]*RC[-5]/R156C5 -> 0.15112987592492785 | M148: 2.2285665916389448 | N148: 2.1921223444711617
A149: ریل پرداز نو آفرین | B149: حآفرین | C149: حمل و نقل انبارداری و ارتباطات | D149: -0.91486658195679005 | E149: =VLOOKUP(RC[-3],'[screener-data-1401-11-24.xlsx]overview'!R8C2:R902C7,6,0) -> 27320184000000 | F149: 7.2878504672897195 | G149: =VLOOKUP(RC[-5],'[screener-data-1401-11-24.xlsx]overview'!R8C2:R897C8,7,FALSE) -> 10.2911971497 | I149: =IF(RC[-1]="",((RC[-2]+RC[-3])/2)*0.65,RC[-1]) -> 5.7131904755216585 | J149: =RC[-1]*RC[-5]/R156C5 -> 0.17898312844670131 | M149: 5.5974273509592543 | N149: 2.9872408474415786
A150: ریل سیر کوثر | B150: حسیر | C150: حمل و نقل انبارداری و ارتباطات | D150: -0.44642857142857001 | E150: =VLOOKUP(RC[-3],'[screener-data-1401-11-24.xlsx]overview'!R8C2:R902C7,6,0) -> 14229556421600 | F150: 18.552412645590682 | G150: =VLOOKUP(RC[-5],'[screener-data-1401-11-24.xlsx]overview'!R8C2:R897C8,7,FALSE) -> 3.4054485705999999 | I150: =IF(RC[-1]="",((RC[-2]+RC[-3])/2)*0.65,RC[-1]) -> 7.1363048952619721 | J150: =RC[-1]*RC[-5]/R156C5 -> 0.11644330679532362 | M150: 13.783927365643427 | N150: 2.6484541354233557
A151: ریل گردش ایرانیان | B151: حگردش | C151: حمل و نقل انبارداری و ارتباطات | D151: 2.9411764705882302 | E151: =VLOOKUP(RC[-3],'[screener-data-1401-11-24.xlsx]overview'!R8C2:R902C7,6,0) -> 9296000000000 | F151: 185.9375 | G151: =VLOOKUP(RC[-5],'[screener-data-1401-11-24.xlsx]overview'!R8C2:R897C8,7,FALSE) -> 48.499494796900002 | I151: =IF(RC[-1]="",((RC[-2]+RC[-3])/2)*0.65,RC[-1]) -> 76.192023308992503 | J151: =RC[-1]*RC[-5]/R156C5 -> 0.81218580158476017 | M151: 38.385239423898845 | N151: 5.2259739689405871
A152: مهندسی حمل و نقل پتروشیمی | B152: حپترو | C152: حمل و نقل انبارداری و ارتباطات | D152: 0.72559366754617005 | E152: =VLOOKUP(RC[-3],'[screener-data-1401-11-24.xlsx]overview'!R8C2:R902C7,6,0) -> 6444000000000 | F152: 97.571884984025559 | G152: =VLOOKUP(RC[-5],'[screener-data-1401-11-24.xlsx]overview'!R8C2:R897C8,7,FALSE) -> 28.939196996 | I152: =IF(RC[-1]="",((RC[-2]+RC[-3])/2)*0.65,RC[-1]) -> 41.116101643508308 | J152: =RC[-1]*RC[-5]/R156C5 -> 0.30382061193427773 | M152: 5.8889658058183905 | N152: 12.359893884604567
A153: کشتیرانی آریا | B153: حاریا | C153: حمل و نقل انبارداری و ارتباطات | D153: 0 | E153: =VLOOKUP(RC[-3],'[screener-data-1401-11-24.xlsx]overview'!R8C2:R902C7,6,0) -> 1536300000000 | F153: -22.440944881889763 | G153: =VLOOKUP(RC[-5],'[screener-data-1401-11-24.xlsx]overview'!R8C2:R897C8,7,FALSE) -> 0 | I153: =IF(RC[-1]="",((RC[-2]+RC[-3])/2)*0.65,RC[-1]) -> -7.2933070866141732 | J153: =RC[-1]*RC[-5]/R156C5 -> -1.2848437076293838E-2 | M153: 4750 | N153: -2.2508358366995931
A154: کشتیرانی ایران | B154: حکشتی | C154: حمل و نقل انبارداری و ارتباطات | D154: 0.91524074810982003 | E154: =VLOOKUP(RC[-3],'[screener-data-1401-11-24.xlsx]overview'!R8C2:R902C7,6,0) -> 540078000000000 | F154: 6.2632748826870834 | G154: =VLOOKUP(RC[-5],'[screener-data-1401-11-24.xlsx]overview'!R8C2:R897C8,7,FALSE) -> 6.0243582008000001 | I154: =IF(RC[-1]="",((RC[-2]+RC[-3])/2)*0.65,RC[-1]) -> 3.9934807521333022 | J154: =RC[-1]*RC[-5]/R156C5 -> 2.4731921173945088 | M154: 5.0715786073322278 | N154: 21.269944550713028
A155: کشتیرانی دریای خزر | B155: حخزر | C155: حمل و نقل انبارداری و ارتباطات | D155: 3.3928571428571401 | E155: =VLOOKUP(RC[-3],'[screener-data-1401-11-24.xlsx]overview'!R8C2:R902C7,6,0) -> 29646000000000 | F155: 20.963070238957279 | G155: =VLOOKUP(RC[-5],'[screener-data-1401-11-24.xlsx]overview'!R8C2:R897C8,7,FALSE) -> 11.0340459318 | H155: 9 | I155: =IF(RC[-1]="",((RC[-2]+RC[-3])/2)*0.65,RC[-1]) -> 9 | J155: =RC[-1]*RC[-5]/R156C5 -> 0.3059555848173221 | M155: 4.3083693374624747 | N155: 8.1486108971837954
E156: =SUM(R[-19]C:R[-1]C) -> 872067755060943 | I156: =IF(RC[-1]="",((RC[-2]+RC[-3])/2)*0.65,RC[-1]) -> 0 | J156: =SUM(R[-19]C:R[-1]C) -> 7.6389998027803898
A157: فروشگاه رفاه | B157: رفاه | C157: خرده فروشی | D157: -4.3290043290039999E-2 | E157: =VLOOKUP(RC[-3],'[screener-data-1401-11-24.xlsx]overview'!R8C2:R902C7,6,0) -> 155752161838000 | F157: 16.83599066692592 | G157: =VLOOKUP(RC[-5],'[screener-data-1401-11-24.xlsx]overview'!R8C2:R897C8,7,FALSE) -> 9.4498821285000005 | I157: =IF(RC[-1]="",((RC[-2]+RC[-3])/2)*0.65,RC[-1]) -> 8.542908658513424 | J157: =RC[-1]*RC[-5]/R160C5 -> 3.538276406774747 | M157: 1.5904462723130268 | N157: 7.6435092212657922
A158: فروشگاه های افق کوروش | B158: افق | C158: خرده فروشی | D158: 0.40080160320641001 | E158: =VLOOKUP(RC[-3],'[screener-data-1401-11-24.xlsx]overview'!R8C2:R902C7,6,0) -> 186750000000000 | F158: 3.8263747454175152 | G158: =VLOOKUP(RC[-5],'[screener-data-1401-11-24.xlsx]overview'!R8C2:R897C8,7,FALSE) -> 12.4229825076 | I158: =IF(RC[-1]="",((RC[-2]+RC[-3])/2)*0.65,RC[-1]) -> 5.281041107230692 | J158: =RC[-1]*RC[-5]/R160C5 -> 2.622600072168161 | M158: 1.2312265233855184 | N158: 9.6515243603447409
A159: قاسم ایران | B159: قاسم | C159: خرده فروشی | D159: 0.14903129657228001 | E159: =VLOOKUP(RC[-3],'[screener-data-1401-11-24.xlsx]overview'!R8C2:R902C7,6,0) -> 33550000000000 | F159: 12.607879924953096 | G159: =VLOOKUP(RC[-5],'[screener-data-1401-11-24.xlsx]overview'!R8C2:R897C8,7,FALSE) -> 6.9972876385999996 | I159: =IF(RC[-1]="",((RC[-2]+RC[-3])/2)*0.65,RC[-1]) -> 6.3716794581547562 | J159: =RC[-1]*RC[-5]/R160C5 -> 0.56845796278970007 | M159: 0.51860765020679556 | N159: 3.1829744213901945
E160: =SUM(R[-3]C:R[-1]C) -> 376052161838000 | J160: =SUM(R[-3]C:R[-1]C) -> 6.7293344417326084
A161: آهنگری تراکتور | B161: خاهن | C161: خودرو و قطعات | D161: 2.1972132904608701 | E161: =VLOOKUP(RC[-3],'[screener-data-1401-11-24.xlsx]overview'!R8C2:R902C7,6,0) -> 54473496301500 | F161: 8.9112149532710276 | G161: =VLOOKUP(RC[-5],'[screener-data-1401-11-24.xlsx]overview'!R8C2:R897C8,7,FALSE) -> 7.2975797649 | I161: =IF(RC[-1]="",((RC[-2]+RC[-3])/2)*0.65,RC[-1]) -> 5.2678582834055838 | J161: =RC[-1]*RC[-5]/R197C5 -> 9.8158665947745222E-2 | M161: 6.7587343278673009 | N161: 1.5933597331120948
A162: اشتاد ایران | B162: تشتاد | C162: خودرو و قطعات | D162: 0 | E162: =VLOOKUP(RC[-3],'[screener-data-1401-11-24.xlsx]overview'!R8C2:R902C7,6,0) -> 5190634692750 | F162: 108.49056603773585 | G162: =VLOOKUP(RC[-5],'[screener-data-1401-11-24.xlsx]overview'!R8C2:R897C8,7,FALSE) -> 22.040043345600001 | I162: =IF(RC[-1]="",((RC[-2]+RC[-3])/2)*0.65,RC[-1]) -> 42.422448049584148 | J162: =RC[-1]*RC[-5]/R197C5 -> 7.5322635136639005E-2 | M162: 2.527788734234298 | N162: 6.70547533003311
A163: الکتریک خودرو شرق | B163: خشرق | C163: خودرو و قطعات | D163: 0.35714285714284999 | E163: =VLOOKUP(RC[-3],'[screener-data-1401-11-24.xlsx]overview'!R8C2:R902C7,6,0) -> 8820000000000 | F163: 14.696652719665272 | G163: =VLOOKUP(RC[-5],'[screener-data-1401-11-24.xlsx]overview'!R8C2:R897C8,7,FALSE) -> 14.5779100037 | I163: =IF(RC[-1]="",((RC[-2]+RC[-3])/2)*0.65,RC[-1]) -> 9.5142328850937137 | J163: =RC[-1]*RC[-5]/R197C5 -> 2.8704611706443166E-2 | M163: 0.56349180430247625 | N163: 7.131025904197811
A164: ایران خودرو | B164: خودرو | C164: خودرو و قطعات | D164: -0.13647219379051001 | E164: =VLOOKUP(RC[-3],'[screener-data-1401-11-24.xlsx]overview'!R8C2:R902C7,6,0) -> 882947311036000 | F164: -7.9538043478260869 | G164: =VLOOKUP(RC[-5],'[screener-data-1401-11-24.xlsx]overview'!R8C2:R897C8,7,FALSE) -> 0 | I164: =IF(RC[-1]="",((RC[-2]+RC[-3])/2)*0.65,RC[-1]) -> -2.5849864130434783 | J164: =RC[-1]*RC[-5]/R197C5 -> -0.78073269466976547 | M164: 0.80372325162026781 | N164: -8.0620472369747365
A165: ایران خودرو دیزل | B165: خاور | C165: خودرو و قطعات | D165: 2.98464213271515 | E165: =VLOOKUP(RC[-3],'[screener-data-1401-11-24.xlsx]overview'!R8C2:R902C7,6,0) -> 306926457346000 | F165: 9.0203045685279193 | G165: =VLOOKUP(RC[-5],'[screener-data-1401-11-24.xlsx]overview'!R8C2:R897C8,7,FALSE) -> 5.8679453927000003 | H165: 6 | I165: =IF(RC[-1]="",((RC[-2]+RC[-3])/2)*0.65,RC[-1]) -> 6 | J165: =RC[-1]*RC[-5]/R197C5 -> 0.62993376952112434 | M165: 2.7628931288486163 | N165: 2.7818259026011267
A166: ایرکا پارت صنعت | B166: خکار | C166: خودرو و قطعات | D166: 2.1682242990654199 | E166: =VLOOKUP(RC[-3],'[screener-data-1401-11-24.xlsx]overview'!R8C2:R902C7,6,0) -> 9265663082000 | F166: 8.9606557377049185 | G166: =VLOOKUP(RC[-5],'[screener-data-1401-11-24.xlsx]overview'!R8C2:R897C8,7,FALSE) -> 7.6073898446000001 | I166: =IF(RC[-1]="",((RC[-2]+RC[-3])/2)*0.65,RC[-1]) -> 5.3846148142490984 | J166: =RC[-1]*RC[-5]/R197C5 -> 1.7066342600388477E-2 | M166: 3.9949972018842814 | N166: 1.5337348921882017
A167: بنیان دیزل | B167: خبنیان | C167: خودرو و قطعات | D167: 0 | E167: =VLOOKUP(RC[-3],'[screener-data-1401-11-24.xlsx]overview'!R8C2:R902C7,6,0) -> 106697127510000 | F167: 2707.5 | G167: =VLOOKUP(RC[-5],'[screener-data-1401-11-24.xlsx]overview'!R8C2:R897C8,7,FALSE) -> 364.3610532372 | I167: =IF(RC[-1]="",((RC[-2]+RC[-3])/2)*0.65,RC[-1]) -> 998.35484230208999 | J167: =RC[-1]*RC[-5]/R197C5 -> 36.43736557552613 | M167: 561.66433735510566 | N167: 10.481213369162301
A168: بهمن دیزل | B168: خدیزل | C168: خودرو و قطعات | D168: 0.48309178743961001 | E168: =VLOOKUP(RC[-3],'[screener-data-1401-11-24.xlsx]overview'!R8C2:R902C7,6,0) -> 102245000000000 | F168: 5 | G168: =VLOOKUP(RC[-5],'[screener-data-1401-11-24.xlsx]overview'!R8C2:R897C8,7,FALSE) -> 7.3239102238999996 | I168: =IF(RC[-1]="",((RC[-2]+RC[-3])/2)*0.65,RC[-1]) -> 4.0052708227675007 | J168: =RC[-1]*RC[-5]/R197C5 -> 0.14008230517680423 | M168: 3.807970204120867 | N168: 3.8354397895308963
A169: توسعه و عمران شهرستان نائین | B169: خعمرا | C169: خودرو و قطعات | D169: 0.39292730844793 | E169: =VLOOKUP(RC[-3],'[screener-data-1401-11-24.xlsx]overview'!R8C2:R902C7,6,0) -> 7212811900000 | F169: 21.380753138075313 | G169: =VLOOKUP(RC[-5],'[screener-data-1401-11-24.xlsx]overview'!R8C2:R897C8,7,FALSE) -> 63.482889913400001 | I169: =IF(RC[-1]="",((RC[-2]+RC[-3])/2)*0.65,RC[-1]) -> 27.580683991729479 | J169: =RC[-1]*RC[-5]/R197C5 -> 6.8048562059013717E-2 | M169: 5.5796035301363558 | N169: 2.2327106560627157
A170: چرخشگر | B170: خچرخش | C170: خودرو و قطعات | D170: 0.11129660545353 | E170: =VLOOKUP(RC[-3],'[screener-data-1401-11-24.xlsx]overview'!R8C2:R902C7,6,0) -> 16623574317540 | F170: 53.382789317507417 | G170: =VLOOKUP(RC[-5],'[screener-data-1401-11-24.xlsx]overview'!R8C2:R897C8,7,FALSE) -> 23.775974437199999 | I170: =IF(RC[-1]="",((RC[-2]+RC[-3])/2)*0.65,RC[-1]) -> 25.076598220279912 | J170: =RC[-1]*RC[-5]/R197C5 -> 0.14259435879566504 | M170: 2.6371964068909408 | N170: 7.8709236354516774
A171: رادیاتور ایران | B171: ختور | C171: خودرو و قطعات | D171: 2.59481037924151 | E171: =VLOOKUP(RC[-3],'[screener-data-1401-11-24.xlsx]overview'!R8C2:R902C7,6,0) -> 13333100000000 | F171: 3.5061391541609823 | G171: =VLOOKUP(RC[-5],'[screener-data-1401-11-24.xlsx]overview'!R8C2:R897C8,7,FALSE) -> 8.7405623762999998 | I171: =IF(RC[-1]="",((RC[-2]+RC[-3])/2)*0.65,RC[-1]) -> 3.980177997399819 | J171: =RC[-1]*RC[-5]/R197C5 -> 1.8152771652334358E-2 | M171: 1.4002378478276354 | N171: 2.8469055963422121
A172: ریخته گری تراکتور | B172: ختراک | C172: خودرو و قطعات | D172: 4.5914396887159503 | E172: =VLOOKUP(RC[-3],'[screener-data-1401-11-24.xlsx]overview'!R8C2:R902C7,6,0) -> 24322320000000 | F172: 18.06451612903226 | G172: =VLOOKUP(RC[-5],'[screener-data-1401-11-24.xlsx]overview'!R8C2:R897C8,7,FALSE) -> 7.9305950986999996 | I172: =IF(RC[-1]="",((RC[-2]+RC[-3])/2)*0.65,RC[-1]) -> 8.4484111490129852 | J172: =RC[-1]*RC[-5]/R197C5 -> 7.0289321753965253E-2 | M172: 1.7924867658475492 | N172: 5.1098735328454596
A173: رینگ سازی مشهد | B173: خرینگ | C173: خودرو و قطعات | D173: -1.5849056603773499 | E173: =VLOOKUP(RC[-3],'[screener-data-1401-11-24.xlsx]overview'!R8C2:R902C7,6,0) -> 11067150000000 | F173: 18.161559888579387 | G173: =VLOOKUP(RC[-5],'[screener-data-1401-11-24.xlsx]overview'!R8C2:R897C8,7,FALSE) -> 15.756398880300001 | I173: =IF(RC[-1]="",((RC[-2]+RC[-3])/2)*0.65,RC[-1]) -> 11.023336599885802 | J173: =RC[-1]*RC[-5]/R197C5 -> 4.1730941091726079E-2 | M173: 0.59149217785028552 | N173: 2.5910435125455389
A174: زامیاد | B174: خزامیا | C174: خودرو و قطعات | D174: 4.8300536672629599 | E174: =VLOOKUP(RC[-3],'[screener-data-1401-11-24.xlsx]overview'!R8C2:R902C7,6,0) -> 97301010531500 | F174: 59.593220338983052 | G174: =VLOOKUP(RC[-5],'[screener-data-1401-11-24.xlsx]overview'!R8C2:R897C8,7,FALSE) -> 9.9428230739999997 | I174: =IF(RC[-1]="",((RC[-2]+RC[-3])/2)*0.65,RC[-1]) -> 22.599214109219492 | J174: =RC[-1]*RC[-5]/R197C5 -> 0.75217691623338812 | M174: 1.1454041490244233 | N174: 2.9649510031525943
A175: سازه پویش | B175: خپویش | C175: خودرو و قطعات | D175: -3.4557235421166301 | E175: =VLOOKUP(RC[-3],'[screener-data-1401-11-24.xlsx]overview'!R8C2:R902C7,6,0) -> 31135693311600 | F175: 16.494464944649447 | G175: =VLOOKUP(RC[-5],'[screener-data-1401-11-24.xlsx]overview'!R8C2:R897C8,7,FALSE) -> 9.6952347808999999 | I175: =IF(RC[-1]="",((RC[-2]+RC[-3])/2)*0.65,RC[-1]) -> 8.5116524108035705 | J175: =RC[-1]*RC[-5]/R197C5 -> 9.0652906827447033E-2 | M175: 1.150806663223646 | N175: 5.7338563180855529
A176: سایپا | B176: خساپا | C176: خودرو و قطعات | D176: -3.4778681120144501 | E176: =VLOOKUP(RC[-3],'[screener-data-1401-11-24.xlsx]overview'!R8C2:R902C7,6,0) -> 417806045350000 | F176: -4.4800838574423478 | G176: =VLOOKUP(RC[-5],'[screener-data-1401-11-24.xlsx]overview'!R8C2:R897C8,7,FALSE) -> 0 | I176: =IF(RC[-1]="",((RC[-2]+RC[-3])/2)*0.65,RC[-1]) -> -1.4560272536687631 | J176: =RC[-1]*RC[-5]/R197C5 -> -0.20809111504711028 | M176: 0.94717719616886464 | N176: -4.9887662484350779
A177: سایپا آذین | B177: خاذین | C177: خودرو و قطعات | D177: 0.61162079510703005 | E177: =VLOOKUP(RC[-3],'[screener-data-1401-11-24.xlsx]overview'!R8C2:R902C7,6,0) -> 10381764331180 | F177: 767.66666666666663 | G177: =VLOOKUP(RC[-5],'[screener-data-1401-11-24.xlsx]overview'!R8C2:R897C8,7,FALSE) -> 0 | I177: =IF(RC[-1]="",((RC[-2]+RC[-3])/2)*0.65,RC[-1]) -> 249.49166666666667 | J177: =RC[-1]*RC[-5]/R197C5 -> 0.88600571640801695 | M177: 0.7602804366234448 | N177: 4.3391069966399956
A178: سایپا دیزل | B178: خکاوه | C178: خودرو و قطعات | D178: 0 | E178: =VLOOKUP(RC[-3],'[screener-data-1401-11-24.xlsx]overview'!R8C2:R902C7,6,0) -> 51449114871040 | F178: 40.414078674948243 | G178: =VLOOKUP(RC[-5],'[screener-data-1401-11-24.xlsx]overview'!R8C2:R897C8,7,FALSE) -> 139.092787453 | I178: =IF(RC[-1]="",((RC[-2]+RC[-3])/2)*0.65,RC[-1]) -> 58.339731491583173 | J178: =RC[-1]*RC[-5]/R197C5 -> 1.0267191139684371 | M178: 4.0310681112612743 | N178: -2.7997476576423814
A179: سر. ایران خودرو | B179: خگستر | C179: خودرو و قطعات | D179: 1.7295597484276699 | E179: =VLOOKUP(RC[-3],'[screener-data-1401-11-24.xlsx]overview'!R8C2:R902C7,6,0) -> 156955157931000 | F179: 34.05263157894737 | G179: =VLOOKUP(RC[-5],'[screener-data-1401-11-24.xlsx]overview'!R8C2:R897C8,7,FALSE) -> 95.594806048400002 | I179: =IF(RC[-1]="",((RC[-2]+RC[-3])/2)*0.65,RC[-1]) -> 42.135417228887896 | J179: =RC[-1]*RC[-5]/R197C5 -> 2.2622062847722435 | K179: 0.9 | M179: 32.035533293507825 | N179: 2.3690179425897777
A180: سر. رنا | B180: ورنا | C180: خودرو و قطعات | D180: -0.1592356687898 | E180: =VLOOKUP(RC[-3],'[screener-data-1401-11-24.xlsx]overview'!R8C2:R902C7,6,0) -> 73669931480000 | F180: 37.544910179640716 | G180: =VLOOKUP(RC[-5],'[screener-data-1401-11-24.xlsx]overview'!R8C2:R897C8,7,FALSE) -> 35.347649259000001 | I180: =IF(RC[-1]="",((RC[-2]+RC[-3])/2)*0.65,RC[-1]) -> 23.690081817558234 | J180: =RC[-1]*RC[-5]/R197C5 -> 0.59698874048536388 | K180: 0.85 | M180: 31.417470917469348 | N180: 3.5223877119008011
A181: صنایع ریخته گری ایران | B181: خریخت | C181: خودرو و قطعات | D181: 1.13068630028924 | E181: =VLOOKUP(RC[-3],'[screener-data-1401-11-24.xlsx]overview'!R8C2:R902C7,6,0) -> 8824040000000 | F181: 12.056426332288401 | G181: =VLOOKUP(RC[-5],'[screener-data-1401-11-24.xlsx]overview'!R8C2:R897C8,7,FALSE) -> 8.2218185903999998 | I181: =IF(RC[-1]="",((RC[-2]+RC[-3])/2)*0.65,RC[-1]) -> 6.5904295998737306 | J181: =RC[-1]*RC[-5]/R197C5 -> 1.9892552226449835E-2 | M181: 2.0888810538946849 | N181: 2.7613223955365354
A182: صنعتی روان فن آور | B182: خفناور | C182: خودرو و قطعات | D182: -1.98675496688741 | E182: =VLOOKUP(RC[-3],'[screener-data-1401-11-24.xlsx]overview'!R8C2:R902C7,6,0) -> 2160000000000 | F182: 238.70967741935485 | G182: =VLOOKUP(RC[-5],'[screener-data-1401-11-24.xlsx]overview'!R8C2:R897C8,7,FALSE) -> 123.84875007150001 | I182: =IF(RC[-1]="",((RC[-2]+RC[-3])/2)*0.65,RC[-1]) -> 117.83148893452783 | J182: =RC[-1]*RC[-5]/R197C5 -> 8.7061156175564869E-2 | M182: 4.3450009003155019 | N182: 16.004498561757899
A183: فنرسازی خاور | B183: خفنر | C183: خودرو و قطعات | D183: 6.6795740561471399 | E183: =VLOOKUP(RC[-3],'[screener-data-1401-11-24.xlsx]overview'!R8C2:R902C7,6,0) -> 13071404936940 | F183: 20.483271375464685 | G183: =VLOOKUP(RC[-5],'[screener-data-1401-11-24.xlsx]overview'!R8C2:R897C8,7,FALSE) -> 10.4084545968 | I183: =IF(RC[-1]="",((RC[-2]+RC[-3])/2)*0.65,RC[-1]) -> 10.039810940986024 | J183: =RC[-1]*RC[-5]/R197C5 -> 4.4890776444396437E-2 | M183: 4.1357768836981448 | N183: 4.7434660412679435
A184: فنرسازی زر | B184: خزر | C184: خودرو و قطعات | D184: -0.66639741518578 | E184: =VLOOKUP(RC[-3],'[screener-data-1401-11-24.xlsx]overview'!R8C2:R902C7,6,0) -> 11987602418976 | F184: 15.970779220779221 | G184: =VLOOKUP(RC[-5],'[screener-data-1401-11-24.xlsx]overview'!R8C2:R897C8,7,FALSE) -> 9.2827005185000004 | I184: =IF(RC[-1]="",((RC[-2]+RC[-3])/2)*0.65,RC[-1]) -> 8.2073809152657464 | J184: =RC[-1]*RC[-5]/R197C5 -> 3.3654739584381817E-2 | M184: 4.1871410614094584 | N184: 2.8597969618020032
A185: قطعات اتومبیل | B185: ختوقا | C185: خودرو و قطعات | D185: 0.36083714216982998 | E185: =VLOOKUP(RC[-3],'[screener-data-1401-11-24.xlsx]overview'!R8C2:R902C7,6,0) -> 25995899904000 | F185: 13.501618122977346 | G185: =VLOOKUP(RC[-5],'[screener-data-1401-11-24.xlsx]overview'!R8C2:R897C8,7,FALSE) -> 12.825910088400001 | I185: =IF(RC[-1]="",((RC[-2]+RC[-3])/2)*0.65,RC[-1]) -> 8.5564466686976388 | J185: =RC[-1]*RC[-5]/R197C5 -> 7.6086501857032876E-2 | M185: 12.43792839791181 | N185: 2.8074912009375712
A186: گروه اقتصادی کرمان خودرو | B186: خکرمان | C186: خودرو و قطعات | D186: -1.7642546663257399 | E186: =VLOOKUP(RC[-3],'[screener-data-1401-11-24.xlsx]overview'!R8C2:R902C7,6,0) -> 18160000000000 | F186: -480.25 | G186: =VLOOKUP(RC[-5],'[screener-data-1401-11-24.xlsx]overview'!R8C2:R897C8,7,FALSE) -> 9.7927005888000007 | I186: =IF(RC[-1]="",((RC[-2]+RC[-3])/2)*0.65,RC[-1]) -> -152.89862230864 | J186: =RC[-1]*RC[-5]/R197C5 -> -0.94979248726432142 | K186: 1.5 | M186: 2342.9686547139895 | N186: 2.1649439340378436
A187: گروه بهمن | B187: خبهمن | C187: خودرو و قطعات | D187: 5.3663570691434401 | E187: =VLOOKUP(RC[-3],'[screener-data-1401-11-24.xlsx]overview'!R8C2:R902C7,6,0) -> 270487675703000 | F187: 33.475409836065573 | G187: =VLOOKUP(RC[-5],'[screener-data-1401-11-24.xlsx]overview'!R8C2:R897C8,7,FALSE) -> 38.639944518999997 | I187: =IF(RC[-1]="",((RC[-2]+RC[-3])/2)*0.65,RC[-1]) -> 23.437490165396309 | J187: =RC[-1]*RC[-5]/R197C5 -> 2.1685423025088224 | K187: 0.9 | M187: 36.881458294603632 | N187: 1.7630892621196963
A188: لنت ترمز | B188: خلنت | C188: خودرو و قطعات | D188: 1.04553119730185 | E188: =VLOOKUP(RC[-3],'[screener-data-1401-11-24.xlsx]overview'!R8C2:R902C7,6,0) -> 8751000000000 | F188: 21.836734693877553 | G188: =VLOOKUP(RC[-5],'[screener-data-1401-11-24.xlsx]overview'!R8C2:R897C8,7,FALSE) -> 22.1280351857 | I188: =IF(RC[-1]="",((RC[-2]+RC[-3])/2)*0.65,RC[-1]) -> 14.288550210862706 | J188: =RC[-1]*RC[-5]/R197C5 -> 4.2771567118197747E-2 | M188: 5.0149197769063729 | N188: 8.8276024632428776
A189: مالیبل سایپا | B189: خلیبل | C189: خودرو و قطعات | D189: 1.27272727272727 | E189: =VLOOKUP(RC[-3],'[screener-data-1401-11-24.xlsx]overview'!R8C2:R902C7,6,0) -> 41949057450000 | F189: 1465.7894736842106 | G189: =VLOOKUP(RC[-5],'[screener-data-1401-11-24.xlsx]overview'!R8C2:R897C8,7,FALSE) -> 93.5408226821 | I189: =IF(RC[-1]="",((RC[-2]+RC[-3])/2)*0.65,RC[-1]) -> 506.78234631905099 | J189: =RC[-1]*RC[-5]/R197C5 -> 7.2719854067130481 | M189: 2.9864556044209474 | N189: -129.52569320030639
A190: محورخودرو | B190: خمحور | C190: خودرو و قطعات | D190: 2.02351654361498 | E190: =VLOOKUP(RC[-3],'[screener-data-1401-11-24.xlsx]overview'!R8C2:R902C7,6,0) -> 22992898065000 | F190: 106.6 | G190: =VLOOKUP(RC[-5],'[screener-data-1401-11-24.xlsx]overview'!R8C2:R897C8,7,FALSE) -> 61.678927100199999 | I190: =IF(RC[-1]="",((RC[-2]+RC[-3])/2)*0.65,RC[-1]) -> 54.690651307565005 | J190: =RC[-1]*RC[-5]/R197C5 -> 0.43014623206607405 | M190: 2.3692653361847342 | N190: 3.4887928786763123
A191: محورسازان | B191: خوساز | C191: خودرو و قطعات | D191: 4.8503611971104199 | E191: =VLOOKUP(RC[-3],'[screener-data-1401-11-24.xlsx]overview'!R8C2:R902C7,6,0) -> 22531909586640 | F191: 81.606425702811251 | G191: =VLOOKUP(RC[-5],'[screener-data-1401-11-24.xlsx]overview'!R8C2:R897C8,7,FALSE) -> 54.017782937699998 | I191: =IF(RC[-1]="",((RC[-2]+RC[-3])/2)*0.65,RC[-1]) -> 44.077867808166161 | J191: =RC[-1]*RC[-5]/R197C5 -> 0.33972530061796286 | M191: 1.2663665364477337 | N191: 14.003888585591479
A192: مهرکام پارس | B192: خمهر | C192: خودرو و قطعات | D192: 4.7363717605004396 | E192: =VLOOKUP(RC[-3],'[screener-data-1401-11-24.xlsx]overview'!R8C2:R902C7,6,0) -> 15137709204744 | F192: 24.164948453608247 | G192: =VLOOKUP(RC[-5],'[screener-data-1401-11-24.xlsx]overview'!R8C2:R897C8,7,FALSE) -> 46.630094817 | I192: =IF(RC[-1]="",((RC[-2]+RC[-3])/2)*0.65,RC[-1]) -> 23.008389062947682 | J192: =RC[-1]*RC[-5]/R197C5 -> 0.1191394756410325 | M192: 0.58849586972563039 | N192: 2.5297348374981903
A193: موتورسازان تراکتور | B193: خموتور | C193: خودرو و قطعات | D193: 3.7996545768566401 | E193: =VLOOKUP(RC[-3],'[screener-data-1401-11-24.xlsx]overview'!R8C2:R902C7,6,0) -> 17430000000000 | F193: 23.204633204633204 | G193: =VLOOKUP(RC[-5],'[screener-data-1401-11-24.xlsx]overview'!R8C2:R897C8,7,FALSE) -> 7.8549158339999998 | I193: =IF(RC[-1]="",((RC[-2]+RC[-3])/2)*0.65,RC[-1]) -> 10.094353437555792 | J193: =RC[-1]*RC[-5]/R197C5 -> 6.0184576313502505E-2 | M193: 1.8905627365366087 | N193: 3.6545418171403483
A194: نصیر ماشین | B194: خنصیر | C194: خودرو و قطعات | D194: -1.43072289156626 | E194: =VLOOKUP(RC[-3],'[screener-data-1401-11-24.xlsx]overview'!R8C2:R902C7,6,0) -> 18696954169400 | F194: 52.570281124497996 | G194: =VLOOKUP(RC[-5],'[screener-data-1401-11-24.xlsx]overview'!R8C2:R897C8,7,FALSE) -> 46.504969665099999 | I194: =IF(RC[-1]="",((RC[-2]+RC[-3])/2)*0.65,RC[-1]) -> 32.199456506619349 | J194: =RC[-1]*RC[-5]/R197C5 -> 0.20593431450169403 | M194: 8.0008165759151204 | N194: 9.2548815435248155
A195: نیرو محرکه | B195: خمحرکه | C195: خودرو و قطعات | D195: 3.4764826175869099 | E195: =VLOOKUP(RC[-3],'[screener-data-1401-11-24.xlsx]overview'!R8C2:R902C7,6,0) -> 30906739710000 | F195: 63.25 | G195: =VLOOKUP(RC[-5],'[screener-data-1401-11-24.xlsx]overview'!R8C2:R897C8,7,FALSE) -> 47.313868356500002 | I195: =IF(RC[-1]="",((RC[-2]+RC[-3])/2)*0.65,RC[-1]) -> 35.933257215862497 | J195: =RC[-1]*RC[-5]/R197C5 -> 0.3798910783973824 | M195: 1.1266741575084356 | N195: 3.6167526512827015
A196: کمک فنر ایندامین | B196: خکمک | C196: خودرو و قطعات | D196: 2.685546875 | E196: =VLOOKUP(RC[-3],'[screener-data-1401-11-24.xlsx]overview'!R8C2:R902C7,6,0) -> 6510194617000 | F196: 467.33333333333331 | G196: =VLOOKUP(RC[-5],'[screener-data-1401-11-24.xlsx]overview'!R8C2:R897C8,7,FALSE) -> 0 | I196: =IF(RC[-1]="",((RC[-2]+RC[-3])/2)*0.65,RC[-1]) -> 151.88333333333333 | J196: =RC[-1]*RC[-5]/R197C5 -> 0.33823099653167765 | M196: 1.0322268771234078 | N196: -21.05894434110656
E197: =SUM(R[-36]C:R[-1]C) -> 2923416449757810 | J197: =SUM(R[-36]C:R[-1]C) -> 53.061720219378913
A198: البرز بالک | B198: دبالک | C198: دارویی | D198: -2.2900763358778602 | E198: =VLOOKUP(RC[-3],'[screener-data-1401-11-24.xlsx]overview'!R8C2:R902C7,6,0) -> 7053200000000 | F198: 11.743119266055047 | G198: =VLOOKUP(RC[-5],'[screener-data-1401-11-24.xlsx]overview'!R8C2:R897C8,7,FALSE) -> 15.5280938195 | I198: =IF(RC[-1]="",((RC[-2]+RC[-3])/2)*0.65,RC[-1]) -> 8.863144252805391 | J198: =RC[-1]*RC[-5]/R246C5 -> 3.2095633607157587E-2 | M198: 3.1313115725817799 | N198: 5.0503550488917117
A199: البرزدارو | B199: دالبر | C199: دارویی | D199: -0.80645161290321998 | E199: =VLOOKUP(RC[-3],'[screener-data-1401-11-24.xlsx]overview'!R8C2:R902C7,6,0) -> 48494600000000 | F199: 5.0513347022587265 | G199: =VLOOKUP(RC[-5],'[screener-data-1401-11-24.xlsx]overview'!R8C2:R897C8,7,FALSE) -> 8.4817954909999997 | I199: =IF(RC[-1]="",((RC[-2]+RC[-3])/2)*0.65,RC[-1]) -> 4.3982673128090859 | J199: =RC[-1]*RC[-5]/R246C5 -> 0.10950827536689157 | M199: 3.3396480771666921 | N199: 2.6970408386197633
A200: ایران دارو | B200: دیران | C200: دارویی | D200: -4.73856209150326 | E200: =VLOOKUP(RC[-3],'[screener-data-1401-11-24.xlsx]overview'!R8C2:R902C7,6,0) -> 10260800000000 | F200: 15.484727755644091 | G200: =VLOOKUP(RC[-5],'[screener-data-1401-11-24.xlsx]overview'!R8C2:R897C8,7,FALSE) -> 18.645780970400001 | I200: =IF(RC[-1]="",((RC[-2]+RC[-3])/2)*0.65,RC[-1]) -> 11.092415335964331 | J200: =RC[-1]*RC[-5]/R246C5 -> 5.8435838775383289E-2 | M200: 3.6152733035701385 | N200: 7.5014402227154555
A201: پارس دارو | B201: دپارس | C201: دارویی | D201: 0.23171987641606001 | E201: =VLOOKUP(RC[-3],'[screener-data-1401-11-24.xlsx]overview'!R8C2:R902C7,6,0) -> 36860000000000 | F201: 11.393034825870647 | G201: =VLOOKUP(RC[-5],'[screener-data-1401-11-24.xlsx]overview'!R8C2:R897C8,7,FALSE) -> 9.301918465 | I201: =IF(RC[-1]="",((RC[-2]+RC[-3])/2)*0.65,RC[-1]) -> 6.7258598195329604 | J201: =RC[-1]*RC[-5]/R246C5 -> 0.12728437060272466 | M201: 6.3699780241054498 | N201: 11.49085122123015
A202: پخش البرز | B202: پخش | C202: دارویی | D202: 4.40528634361233 | E202: =VLOOKUP(RC[-3],'[screener-data-1401-11-24.xlsx]overview'!R8C2:R902C7,6,0) -> 85080000000000 | F202: 11.779324055666004 | G202: =VLOOKUP(RC[-5],'[screener-data-1401-11-24.xlsx]overview'!R8C2:R897C8,7,FALSE) -> 15.1641894661 | I202: =IF(RC[-1]="",((RC[-2]+RC[-3])/2)*0.65,RC[-1]) -> 8.756641894573951 | J202: =RC[-1]*RC[-5]/R246C5 -> 0.38250490418444305 | M202: 1.0949835610010183 | N202: 6.2393597416501398
A203: پخش رازی | B203: درازی | C203: دارویی | D203: 1.16279069767441 | E203: =VLOOKUP(RC[-3],'[screener-data-1401-11-24.xlsx]overview'!R8C2:R902C7,6,0) -> 22400000000000 | F203: 10.891337005508262 | G203: =VLOOKUP(RC[-5],'[screener-data-1401-11-24.xlsx]overview'!R8C2:R897C8,7,FALSE) -> 10.979675180499999 | I203: =IF(RC[-1]="",((RC[-2]+RC[-3])/2)*0.65,RC[-1]) -> 7.1080789604526853 | J203: =RC[-1]*RC[-5]/R246C5 -> 8.1747070635511732E-2 | M203: 0.37364938631309413 | N203: 5.886084376410631
A204: پخش هجرت | B204: هجرت | C204: دارویی | D204: -0.17301038062283 | E204: =VLOOKUP(RC[-3],'[screener-data-1401-11-24.xlsx]overview'!R8C2:R902C7,6,0) -> 44640000000000 | F204: 6.8723201524535495 | G204: =VLOOKUP(RC[-5],'[screener-data-1401-11-24.xlsx]overview'!R8C2:R897C8,7,FALSE) -> 8.8120033307999996 | I204: =IF(RC[-1]="",((RC[-2]+RC[-3])/2)*0.65,RC[-1]) -> 5.0974051320574043 | J204: =RC[-1]*RC[-5]/R246C5 -> 0.11682755151679697 | M204: 0.73981477320349864 | N204: 6.2814480642906751
A205: تهران دارو | B205: دتهران‌ | C205: دارویی | D205: 0 | E205: =VLOOKUP(RC[-3],'[screener-data-1401-11-24.xlsx]overview'!R8C2:R902C7,6,0) -> 1078800000000 | F205: 20.176032498307379 | G205: =VLOOKUP(RC[-5],'[screener-data-1401-11-24.xlsx]overview'!R8C2:R897C8,7,FALSE) -> 1.6969904045999999 | I205: =IF(RC[-1]="",((RC[-2]+RC[-3])/2)*0.65,RC[-1]) -> 7.1087324434448984 | J205: =RC[-1]*RC[-5]/R246C5 -> 3.9373592613898521E-3 | M205: 1.6109414276833256 | N205: 1.2573928086695405
A206: تهران شیمی | B206: شتهران | C206: دارویی | D206: 1.9359642591213699 | E206: =VLOOKUP(RC[-3],'[screener-data-1401-11-24.xlsx]overview'!R8C2:R902C7,6,0) -> 30483337500000 | F206: 20.59265944645006 | G206: =VLOOKUP(RC[-5],'[screener-data-1401-11-24.xlsx]overview'!R8C2:R897C8,7,FALSE) -> 14.336227582099999 | I206: =IF(RC[-1]="",((RC[-2]+RC[-3])/2)*0.65,RC[-1]) -> 11.35188828427877 | J206: =RC[-1]*RC[-5]/R246C5 -> 0.17766527807766741 | M206: 4.7651317610133166 | N206: 4.4698815384044854
A207: توزیع داروپخش | B207: دتوزیع | C207: دارویی | D207: -0.29940119760479 | E207: =VLOOKUP(RC[-3],'[screener-data-1401-11-24.xlsx]overview'!R8C2:R902C7,6,0) -> 56520000000000 | F207: 7.2850579741850803 | G207: =VLOOKUP(RC[-5],'[screener-data-1401-11-24.xlsx]overview'!R8C2:R897C8,7,FALSE) -> 7.8280402206000002 | I207: =IF(RC[-1]="",((RC[-2]+RC[-3])/2)*0.65,RC[-1]) -> 4.911756913305152 | J207: =RC[-1]*RC[-5]/R246C5 -> 0.14253153269051178 | M207: 0.66552556900604121 | N207: 4.7965700922811596
A208: تولید ژلاتین کپسول ایران | B208: دکپسول | C208: دارویی | D208: -0.42052144659377 | E208: =VLOOKUP(RC[-3],'[screener-data-1401-11-24.xlsx]overview'!R8C2:R902C7,6,0) -> 17595000000000 | F208: 12.611844908393694 | G208: =VLOOKUP(RC[-5],'[screener-data-1401-11-24.xlsx]overview'!R8C2:R897C8,7,FALSE) -> 6.9852126328999997 | I208: =IF(RC[-1]="",((RC[-2]+RC[-3])/2)*0.65,RC[-1]) -> 6.369043700920451 | J208: =RC[-1]*RC[-5]/R246C5 -> 5.7535439772365304E-2 | M208: 5.1378467504131828 | N208: 6.9322601861483601
A209: تولیدو صادرات ریشمک | B209: ریشمک | C209: دارویی | D209: -0.45454545454544998 | E209: =VLOOKUP(RC[-3],'[screener-data-1401-11-24.xlsx]overview'!R8C2:R902C7,6,0) -> 6555000000000 | F209: 22.788761706555672 | G209: =VLOOKUP(RC[-5],'[screener-data-1401-11-24.xlsx]overview'!R8C2:R897C8,7,FALSE) -> 14.915331546799999 | I209: =IF(RC[-1]="",((RC[-2]+RC[-3])/2)*0.65,RC[-1]) -> 12.253830307340595 | J209: =RC[-1]*RC[-5]/R246C5 -> 4.123979472838836E-2 | M209: 12.103548900548253 | N209: 5.1868038867082031
A210: دارو ابوریحان | B210: دابور | C210: دارویی | D210: -0.51873198847262003 | E210: =VLOOKUP(RC[-3],'[screener-data-1401-11-24.xlsx]overview'!R8C2:R902C7,6,0) -> 31014000000000 | F210: 4.6385380274119861 | G210: =VLOOKUP(RC[-5],'[screener-data-1401-11-24.xlsx]overview'!R8C2:R897C8,7,FALSE) -> 7.1489715962 | I210: =IF(RC[-1]="",((RC[-2]+RC[-3])/2)*0.65,RC[-1]) -> 3.8309406276738951 | J210: =RC[-1]*RC[-5]/R246C5 -> 6.1000745251670548E-2 | M210: 2.8902161605951009 | N210: 2.8128233891316805
A211: دارو اسوه | B211: داسوه | C211: دارویی | D211: 4.8290084206908404 | E211: =VLOOKUP(RC[-3],'[screener-data-1401-11-24.xlsx]overview'!R8C2:R902C7,6,0) -> 45457500000000 | F211: 19.588953114964674 | G211: =VLOOKUP(RC[-5],'[screener-data-1401-11-24.xlsx]overview'!R8C2:R897C8,7,FALSE) -> 13.7927526421 | I211: =IF(RC[-1]="",((RC[-2]+RC[-3])/2)*0.65,RC[-1]) -> 10.849054371046019 | J211: =RC[-1]*RC[-5]/R246C5 -> 0.25320330500383531 | M211: 8.3867841879695568 | N211: 9.3212025268099179
A212: دارو امین | B212: دامین | C212: دارویی | D212: -1.3432835820895499 | E212: =VLOOKUP(RC[-3],'[screener-data-1401-11-24.xlsx]overview'!R8C2:R902C7,6,0) -> 17759500000000 | F212: 11.719858156028369 | G212: =VLOOKUP(RC[-5],'[screener-data-1401-11-24.xlsx]overview'!R8C2:R897C8,7,FALSE) -> 9.6291024454999992 | I212: =IF(RC[-1]="",((RC[-2]+RC[-3])/2)*0.65,RC[-1]) -> 6.9384121954967197 | J212: =RC[-1]*RC[-5]/R246C5 -> 6.3264891602253154E-2 | M212: 3.3625870545161796 | N212: 1.7785299438817765
A213: دارو اکسیر | B213: دلر | C213: دارویی | D213: 1.5989628349178899 | E213: =VLOOKUP(RC[-3],'[screener-data-1401-11-24.xlsx]overview'!R8C2:R902C7,6,0) -> 52155000000000 | F213: 3.2711840823709477 | G213: =VLOOKUP(RC[-5],'[screener-data-1401-11-24.xlsx]overview'!R8C2:R897C8,7,FALSE) -> 7.5497548663999998 | I213: =IF(RC[-1]="",((RC[-2]+RC[-3])/2)*0.65,RC[-1]) -> 3.5168051583505582 | J213: =RC[-1]*RC[-5]/R246C5 -> 9.4170785830379786E-2 | M213: 2.4984958721858357 | N213: 3.1043571036211777
A214: دارو جابرابن حیان | B214: دجابر | C214: دارویی | D214: -1.4168530947054401 | E214: =VLOOKUP(RC[-3],'[screener-data-1401-11-24.xlsx]overview'!R8C2:R902C7,6,0) -> 29166480000000 | F214: 11.835273052820053 | G214: =VLOOKUP(RC[-5],'[screener-data-1401-11-24.xlsx]overview'!R8C2:R897C8,7,FALSE) -> 7.9524280220000003 | I214: =IF(RC[-1]="",((RC[-2]+RC[-3])/2)*0.65,RC[-1]) -> 6.431002849316517 | J214: =RC[-1]*RC[-5]/R246C5 -> 9.6301856128003752E-2 | M214: 5.8890936621105663 | N214: 5.1600489863690404
A215: دارو رازک | B215: درازک | C215: دارویی | D215: -1.4542936288088599 | E215: =VLOOKUP(RC[-3],'[screener-data-1401-11-24.xlsx]overview'!R8C2:R902C7,6,0) -> 29148000000000 | F215: 4.0867317633543943 | G215: =VLOOKUP(RC[-5],'[screener-data-1401-11-24.xlsx]overview'!R8C2:R897C8,7,FALSE) -> 7.8360201562 | I215: =IF(RC[-1]="",((RC[-2]+RC[-3])/2)*0.65,RC[-1]) -> 3.8748943738551778 | J215: =RC[-1]*RC[-5]/R246C5 -> 5.7988325282186719E-2 | M215: 2.8079150448544765 | N215: 5.0945421756932561
A216: دارو زهراوی | B216: دزهراوی | C216: دارویی | D216: 4.7932524171980999 | E216: =VLOOKUP(RC[-3],'[screener-data-1401-11-24.xlsx]overview'!R8C2:R902C7,6,0) -> 17686080000000 | F216: 24.608695652173914 | G216: =VLOOKUP(RC[-5],'[screener-data-1401-11-24.xlsx]overview'!R8C2:R897C8,7,FALSE) -> 59.565414500899998 | I216: =IF(RC[-1]="",((RC[-2]+RC[-3])/2)*0.65,RC[-1]) -> 27.356585799749023 | J216: =RC[-1]*RC[-5]/R246C5 -> 0.24840790782754085 | M216: 3.2461838210081377 | N216: 5.4256955991870024
A217: دارو سبحان | B217: دسبحا | C217: دارویی | D217: -9.7087378640769995E-2 | E217: =VLOOKUP(RC[-3],'[screener-data-1401-11-24.xlsx]overview'!R8C2:R902C7,6,0) -> 71563500000000 | F217: 10.553846153846154 | G217: =VLOOKUP(RC[-5],'[screener-data-1401-11-24.xlsx]overview'!R8C2:R897C8,7,FALSE) -> 17.4945892183 | I217: =IF(RC[-1]="",((RC[-2]+RC[-3])/2)*0.65,RC[-1]) -> 9.1157414959474998 | J217: =RC[-1]*RC[-5]/R246C5 -> 0.33493112692400157 | K217: 1.1000000000000001 | M217: 23.834354758635346 | N217: 3.2368330100210159
A218: دارو عبیدی | B218: دعبید | C218: دارویی | D218: -0.74906367041197996 | E218: =VLOOKUP(RC[-3],'[screener-data-1401-11-24.xlsx]overview'!R8C2:R902C7,6,0) -> 177795000000000 | F218: 8.6885245901639347 | G218: =VLOOKUP(RC[-5],'[screener-data-1401-11-24.xlsx]overview'!R8C2:R897C8,7,FALSE) -> 16.172888633100001 | I218: =IF(RC[-1]="",((RC[-2]+RC[-3])/2)*0.65,RC[-1]) -> 8.0799592975607801 | J218: =RC[-1]*RC[-5]/R246C5 -> 0.73756560076980016 | M218: 7.592761580027898 | N218: 2.6385691321707405
A219: دارو فارابی | B219: دفارا | C219: دارویی | D219: 1.3765978367748199 | E219: =VLOOKUP(RC[-3],'[screener-data-1401-11-24.xlsx]overview'!R8C2:R902C7,6,0) -> 32752000000000 | F219: 14.655294953802416 | G219: =VLOOKUP(RC[-5],'[screener-data-1401-11-24.xlsx]overview'!R8C2:R897C8,7,FALSE) -> 8.0427289766999994 | H219: 5.5 | I219: =IF(RC[-1]="",((RC[-2]+RC[-3])/2)*0.65,RC[-1]) -> 5.5 | J219: =RC[-1]*RC[-5]/R246C5 -> 9.2485245096306123E-2 | M219: 4.8265707165318679 | N219: 8.0876640815002769
A220: دارو لقمان | B220: دلقما | C220: دارویی | D220: -0.42331488114619997 | E220: =VLOOKUP(RC[-3],'[screener-data-1401-11-24.xlsx]overview'!R8C2:R902C7,6,0) -> 21114695250000 | F220: 105.44827586206897 | G220: =VLOOKUP(RC[-5],'[screener-data-1401-11-24.xlsx]overview'!R8C2:R897C8,7,FALSE) -> 11.7325822922 | I220: =IF(RC[-1]="",((RC[-2]+RC[-3])/2)*0.65,RC[-1]) -> 38.083778900137418 | J220: =RC[-1]*RC[-5]/R246C5 -> 0.41285427860900908 | M220: 8.5148408373249058 | N220: 1.9205169652083569
A221: داروپخش | B221: وپخش | C221: دارویی | D221: -0.32290114257327002 | E221: =VLOOKUP(RC[-3],'[screener-data-1401-11-24.xlsx]overview'!R8C2:R902C7,6,0) -> 142461500000000 | F221: 7.5774169184290034 | G221: =VLOOKUP(RC[-5],'[screener-data-1401-11-24.xlsx]overview'!R8C2:R897C8,7,FALSE) -> 7.5281902705999997 | I221: =IF(RC[-1]="",((RC[-2]+RC[-3])/2)*0.65,RC[-1]) -> 4.9093223364344265 | J221: =RC[-1]*RC[-5]/R246C5 -> 0.35907981913309689 | K221: 0.75 | M221: 7.5382006971095441 | N221: 20.187077798926012
A222: داروسازی آوه سینا | B222: داوه | C222: دارویی | D222: -3.9800995024875601 | E222: =VLOOKUP(RC[-3],'[screener-data-1401-11-24.xlsx]overview'!R8C2:R902C7,6,0) -> 5581920000000 | F222: 27.571428571428573 | G222: =VLOOKUP(RC[-5],'[screener-data-1401-11-24.xlsx]overview'!R8C2:R897C8,7,FALSE) -> 18.6157924635 | I222: =IF(RC[-1]="",((RC[-2]+RC[-3])/2)*0.65,RC[-1]) -> 15.010846836351785 | J222: =RC[-1]*RC[-5]/R246C5 -> 4.3019042374915384E-2 | M222: 4.3901984655483748 | N222: 4.0669960761517219
A223: داروسازی الحاوی | B223: دحاوی | C223: دارویی | D223: 2.55795363709032 | E223: =VLOOKUP(RC[-3],'[screener-data-1401-11-24.xlsx]overview'!R8C2:R902C7,6,0) -> 13856400000000 | F223: 33.152454780361758 | G223: =VLOOKUP(RC[-5],'[screener-data-1401-11-24.xlsx]overview'!R8C2:R897C8,7,FALSE) -> 8.2967911249000004 | I223: =IF(RC[-1]="",((RC[-2]+RC[-3])/2)*0.65,RC[-1]) -> 13.471004919210072 | J223: =RC[-1]*RC[-5]/R246C5 -> 9.5834602007001266E-2 | M223: 3.4752494691092699 | N223: 2.7848477783762493
A224: داروسازی تولید دارو | B224: دتولید | C224: دارویی | D224: -0.46189376443418001 | E224: =VLOOKUP(RC[-3],'[screener-data-1401-11-24.xlsx]overview'!R8C2:R902C7,6,0) -> 7225000000000 | F224: 175.91836734693877 | G224: =VLOOKUP(RC[-5],'[screener-data-1401-11-24.xlsx]overview'!R8C2:R897C8,7,FALSE) -> 36.456973810100003 | I224: =IF(RC[-1]="",((RC[-2]+RC[-3])/2)*0.65,RC[-1]) -> 69.021985876037604 | J224: =RC[-1]*RC[-5]/R246C5 -> 0.25603376284379092 | M224: 2.9761469559382396 | N224: 6.3807478546509708
A225: داروسازی دانا | B225: ددانا | C225: دارویی | D225: -0.76335877862595003 | E225: =VLOOKUP(RC[-3],'[screener-data-1401-11-24.xlsx]overview'!R8C2:R902C7,6,0) -> 78600000000000 | F225: 9.2277115275411692 | G225: =VLOOKUP(RC[-5],'[screener-data-1401-11-24.xlsx]overview'!R8C2:R897C8,7,FALSE) -> 7.2102901297999997 | I225: =IF(RC[-1]="",((RC[-2]+RC[-3])/2)*0.65,RC[-1]) -> 5.3423505386358796 | J225: =RC[-1]*RC[-5]/R246C5 -> 0.2155891319777902 | M225: 4.0896460909406214 | N225: 5.174195939901316
A226: داروسازی قاضی | B226: دقاضی | C226: دارویی | D226: -0.90725806451612001 | E226: =VLOOKUP(RC[-3],'[screener-data-1401-11-24.xlsx]overview'!R8C2:R902C7,6,0) -> 32725000000000 | F226: 6.9298554811420514 | G226: =VLOOKUP(RC[-5],'[screener-data-1401-11-24.xlsx]overview'!R8C2:R897C8,7,FALSE) -> 7.9294863410999996 | I226: =IF(RC[-1]="",((RC[-2]+RC[-3])/2)*0.65,RC[-1]) -> 4.8292860922286671 | J226: =RC[-1]*RC[-5]/R246C5 -> 8.1139910902714538E-2 | M226: 5.6937617516247627 | N226: 3.2514361596046366
A227: داروسازی کوثر | B227: دکوثر | C227: دارویی | D227: 0.28985507246376002 | E227: =VLOOKUP(RC[-3],'[screener-data-1401-11-24.xlsx]overview'!R8C2:R902C7,6,0) -> 12342000000000 | F227: 209.69696969696969 | G227: =VLOOKUP(RC[-5],'[screener-data-1401-11-24.xlsx]overview'!R8C2:R897C8,7,FALSE) -> 8.9659721673000004 | I227: =IF(RC[-1]="",((RC[-2]+RC[-3])/2)*0.65,RC[-1]) -> 71.065456105887648 | J227: =RC[-1]*RC[-5]/R246C5 -> 0.45031459899765069 | M227: 4.0626751562441186 | N227: 3.2695696836071546
A228: دارویی برکت | B228: برکت | C228: دارویی | D228: -2.5402201524132 | E228: =VLOOKUP(RC[-3],'[screener-data-1401-11-24.xlsx]overview'!R8C2:R902C7,6,0) -> 83162200000000 | F228: 5.9452479338842972 | G228: =VLOOKUP(RC[-5],'[screener-data-1401-11-24.xlsx]overview'!R8C2:R897C8,7,FALSE) -> 5.5748623416000003 | I228: =IF(RC[-1]="",((RC[-2]+RC[-3])/2)*0.65,RC[-1]) -> 3.7440358395323967 | J228: =RC[-1]*RC[-5]/R246C5 -> 0.15985929897193293 | K228: 1 | M228: 5.7908107206294401 | N228: 7.0376588730452605
A229: دارویی ره آورد تامین | B229: درهآور | C229: دارویی | D229: 0.60105184072125994 | E229: =VLOOKUP(RC[-3],'[screener-data-1401-11-24.xlsx]overview'!R8C2:R902C7,6,0) -> 15925000000000 | F229: 16.662518666002988 | G229: =VLOOKUP(RC[-5],'[screener-data-1401-11-24.xlsx]overview'!R8C2:R897C8,7,FALSE) -> 8.1787782941000007 | I229: =IF(RC[-1]="",((RC[-2]+RC[-3])/2)*0.65,RC[-1]) -> 8.0734215120334714 | J229: =RC[-1]*RC[-5]/R246C5 -> 6.6009889468797628E-2 | M229: 7.4042992933898573 | N229: 8.9556399530427502
A230: روز دارو | B230: دروز | C230: دارویی | D230: -9.7991180793720004E-2 | E230: =VLOOKUP(RC[-3],'[screener-data-1401-11-24.xlsx]overview'!R8C2:R902C7,6,0) -> 14192755200000 | F230: 25.875634517766496 | G230: =VLOOKUP(RC[-5],'[screener-data-1401-11-24.xlsx]overview'!R8C2:R897C8,7,FALSE) -> 71.582002584999998 | I230: =IF(RC[-1]="",((RC[-2]+RC[-3])/2)*0.65,RC[-1]) -> 31.673732058399114 | J230: =RC[-1]*RC[-5]/R246C5 -> 0.23080110702090087 | M230: 6.6803979848890087 | N230: 8.832305416462928
A231: زاگرس فارمد پارس | B231: ددام | C231: دارویی | D231: 4.6875 | E231: =VLOOKUP(RC[-3],'[screener-data-1401-11-24.xlsx]overview'!R8C2:R902C7,6,0) -> 12167000000000 | F231: 10.684803001876173 | G231: =VLOOKUP(RC[-5],'[screener-data-1401-11-24.xlsx]overview'!R8C2:R897C8,7,FALSE) -> 12.354514910800001 | I231: =IF(RC[-1]="",((RC[-2]+RC[-3])/2)*0.65,RC[-1]) -> 7.4877783216197571 | J231: =RC[-1]*RC[-5]/R246C5 -> 4.6774421352995144E-2 | M231: 3.2656306368185426 | N231: 7.0653185286272562
A232: سبحان آنکولوژی | B232: دسانکو | C232: دارویی | D232: -2.2690437601296498 | E232: =VLOOKUP(RC[-3],'[screener-data-1401-11-24.xlsx]overview'!R8C2:R902C7,6,0) -> 9408240000000 | F232: 24.612244897959183 | G232: =VLOOKUP(RC[-5],'[screener-data-1401-11-24.xlsx]overview'!R8C2:R897C8,7,FALSE) -> 30.697306809000001 | I232: =IF(RC[-1]="",((RC[-2]+RC[-3])/2)*0.65,RC[-1]) -> 17.975604304761735 | J232: =RC[-1]*RC[-5]/R246C5 -> 8.6828804997295339E-2 | M232: 2.2535163891700338 | N232: 4.7857708701589683
A233: سبحان دارو | B233: دسبحان | C233: دارویی | D233: 1.51515151515151 | E233: =VLOOKUP(RC[-3],'[screener-data-1401-11-24.xlsx]overview'!R8C2:R902C7,6,0) -> 27007200000000 | F233: 9.9192462987886945 | G233: =VLOOKUP(RC[-5],'[screener-data-1401-11-24.xlsx]overview'!R8C2:R897C8,7,FALSE) -> 9.7089996251000006 | I233: =IF(RC[-1]="",((RC[-2]+RC[-3])/2)*0.65,RC[-1]) -> 6.3791799252638262 | J233: =RC[-1]*RC[-5]/R246C5 -> 8.8453770298416376E-2 | M233: 3.699227759881428 | N233: 4.1236724084142145
A234: سر. البرز | B234: والبر | C234: دارویی | D234: 0 | E234: =VLOOKUP(RC[-3],'[screener-data-1401-11-24.xlsx]overview'!R8C2:R902C7,6,0) -> 76275565000000 | F234: 6.678403755868545 | G234: =VLOOKUP(RC[-5],'[screener-data-1401-11-24.xlsx]overview'!R8C2:R897C8,7,FALSE) -> 8.9545599567000007 | I234: =IF(RC[-1]="",((RC[-2]+RC[-3])/2)*0.65,RC[-1]) -> 5.080713206584778 | J234: =RC[-1]*RC[-5]/R246C5 -> 0.19896745783418696 | K234: 0.65 | M234: 12.717565192456568 | N234: 2.0616796605662304
A235: سر. دارویی تامین | B235: تیپیکو | C235: دارویی | D235: -0.28676771814829 | E235: =VLOOKUP(RC[-3],'[screener-data-1401-11-24.xlsx]overview'!R8C2:R902C7,6,0) -> 267520000000000 | F235: 7.4662576687116564 | G235: =VLOOKUP(RC[-5],'[screener-data-1401-11-24.xlsx]overview'!R8C2:R897C8,7,FALSE) -> 7.8323628336000004 | I235: =IF(RC[-1]="",((RC[-2]+RC[-3])/2)*0.65,RC[-1]) -> 4.972051663251289 | J235: =RC[-1]*RC[-5]/R246C5 -> 0.6829105553444883 | K235: 0.95 | M235: 7.4441430006135425 | N235: 14.445650976368244
A236: سر. شفا دارو | B236: شفا | C236: دارویی | D236: 0.18371096142068999 | E236: =VLOOKUP(RC[-3],'[screener-data-1401-11-24.xlsx]overview'!R8C2:R902C7,6,0) -> 43907280000000 | F236: 9.7380952380952372 | G236: =VLOOKUP(RC[-5],'[screener-data-1401-11-24.xlsx]overview'!R8C2:R897C8,7,FALSE) -> 7.5048357909999996 | I236: =IF(RC[-1]="",((RC[-2]+RC[-3])/2)*0.65,RC[-1]) -> 5.6039525844559526 | J236: =RC[-1]*RC[-5]/R246C5 -> 0.1263289606257226 | K236: 0.55000000000000004 | M236: 9.4320027193767704 | N236: 6.9784485646689332
A237: سینادارو | B237: دسینا | C237: دارویی | D237: -0.49751243781094001 | E237: =VLOOKUP(RC[-3],'[screener-data-1401-11-24.xlsx]overview'!R8C2:R902C7,6,0) -> 31080000000000 | F237: 3.9126181936746005 | G237: =VLOOKUP(RC[-5],'[screener-data-1401-11-24.xlsx]overview'!R8C2:R897C8,7,FALSE) -> 9.5831367216000007 | I237: =IF(RC[-1]="",((RC[-2]+RC[-3])/2)*0.65,RC[-1]) -> 4.3861203474642458 | J237: =RC[-1]*RC[-5]/R246C5 -> 6.9989596689720435E-2 | M237: 4.3713252598396179 | N237: 1.7930569473018696
A238: شیرین دارو | B238: دشیری | C238: دارویی | D238: 2.9995162070633699 | E238: =VLOOKUP(RC[-3],'[screener-data-1401-11-24.xlsx]overview'!R8C2:R902C7,6,0) -> 5600000000000 | F238: 22.405809303304569 | G238: =VLOOKUP(RC[-5],'[screener-data-1401-11-24.xlsx]overview'!R8C2:R897C8,7,FALSE) -> 18.214875703400001 | I238: =IF(RC[-1]="",((RC[-2]+RC[-3])/2)*0.65,RC[-1]) -> 13.201722627178986 | J238: =RC[-1]*RC[-5]/R246C5 -> 3.795688533142378E-2 | M238: 6.2290803548439948 | N238: 23.651666170451971
A239: شیمی داروپخش | B239: دشیمی | C239: دارویی | D239: -2.0137299771167001 | E239: =VLOOKUP(RC[-3],'[screener-data-1401-11-24.xlsx]overview'!R8C2:R902C7,6,0) -> 18495000000000 | F239: 6.4197901049475261 | G239: =VLOOKUP(RC[-5],'[screener-data-1401-11-24.xlsx]overview'!R8C2:R897C8,7,FALSE) -> 8.5251286234000005 | I239: =IF(RC[-1]="",((RC[-2]+RC[-3])/2)*0.65,RC[-1]) -> 4.8570985867129464 | J239: =RC[-1]*RC[-5]/R246C5 -> 4.6121475359403613E-2 | M239: 4.4839668341434908 | N239: 3.390869153117241
A240: فرآورده تزریقی | B240: دفرا | C240: دارویی | D240: 0.23474178403755 | E240: =VLOOKUP(RC[-3],'[screener-data-1401-11-24.xlsx]overview'!R8C2:R902C7,6,0) -> 35882000000000 | F240: 11.192660550458715 | G240: =VLOOKUP(RC[-5],'[screener-data-1401-11-24.xlsx]overview'!R8C2:R897C8,7,FALSE) -> 8.2453116116 | I240: =IF(RC[-1]="",((RC[-2]+RC[-3])/2)*0.65,RC[-1]) -> 6.317340952669082 | J240: =RC[-1]*RC[-5]/R246C5 -> 0.11638121736694575 | M240: 6.7981091598020003 | N240: 7.0432588601851851
A241: مواد داروپخش | B241: دتماد | C241: دارویی | D241: -0.32295948326481999 | E241: =VLOOKUP(RC[-3],'[screener-data-1401-11-24.xlsx]overview'!R8C2:R902C7,6,0) -> 24016850000000 | F241: 5.9322033898305087 | G241: =VLOOKUP(RC[-5],'[screener-data-1401-11-24.xlsx]overview'!R8C2:R897C8,7,FALSE) -> 6.1223129006999999 | I241: =IF(RC[-1]="",((RC[-2]+RC[-3])/2)*0.65,RC[-1]) -> 3.9177177944224151 | J241: =RC[-1]*RC[-5]/R246C5 -> 4.8308230721907014E-2 | M241: 2.5373092673655049 | N241: 5.9545609421228232
A242: کارخانجات داروپخش | B242: دارو | C242: دارویی | D242: 1.8600097895251999 | E242: =VLOOKUP(RC[-3],'[screener-data-1401-11-24.xlsx]overview'!R8C2:R902C7,6,0) -> 54574000000000 | F242: 5.0436257876878337 | G242: =VLOOKUP(RC[-5],'[screener-data-1401-11-24.xlsx]overview'!R8C2:R897C8,7,FALSE) -> 8.5451309677000005 | I242: =IF(RC[-1]="",((RC[-2]+RC[-3])/2)*0.65,RC[-1]) -> 4.4163459455010461 | J242: =RC[-1]*RC[-5]/R246C5 -> 0.1237430479933979 | M242: 2.1405067461607286 | N242: 3.5257358385202822
A243: کاسپین تامین | B243: کاسپین | C243: دارویی | D243: -1.3812154696132499 | E243: =VLOOKUP(RC[-3],'[screener-data-1401-11-24.xlsx]overview'!R8C2:R902C7,6,0) -> 19362000000000 | F243: 4.6019980663873667 | G243: =VLOOKUP(RC[-5],'[screener-data-1401-11-24.xlsx]overview'!R8C2:R897C8,7,FALSE) -> 7.3445662882000002 | I243: =IF(RC[-1]="",((RC[-2]+RC[-3])/2)*0.65,RC[-1]) -> 3.8826334152408939 | J243: =RC[-1]*RC[-5]/R246C5 -> 3.859655482092194E-2 | M243: 2.4617933780565697 | N243: 2.5260731894074748
A244: کی بی سی | B244: کی بی سی | C244: دارویی | D244: 4.2589437819420697 | E244: =VLOOKUP(RC[-3],'[screener-data-1401-11-24.xlsx]overview'!R8C2:R902C7,6,0) -> 5698700000000 | F244: 8.9933872152828798 | G244: =VLOOKUP(RC[-5],'[screener-data-1401-11-24.xlsx]overview'!R8C2:R897C8,7,FALSE) -> 15.4270858388 | I244: =IF(RC[-1]="",((RC[-2]+RC[-3])/2)*0.65,RC[-1]) -> 7.9366537425769366 | J244: =RC[-1]*RC[-5]/R246C5 -> 2.3221227069524258E-2 | M244: 0.82801420446936602 | N244: 4.0580956126471373
A245: کیمیدارو | B245: دکیمی | C245: دارویی | D245: -1.1889862327909799 | E245: =VLOOKUP(RC[-3],'[screener-data-1401-11-24.xlsx]overview'!R8C2:R902C7,6,0) -> 18028800000000 | F245: 12.03047619047619 | G245: =VLOOKUP(RC[-5],'[screener-data-1401-11-24.xlsx]overview'!R8C2:R897C8,7,FALSE) -> 5.8503902725000003 | I245: =IF(RC[-1]="",((RC[-2]+RC[-3])/2)*0.65,RC[-1]) -> 5.8112816004672618 | J245: =RC[-1]*RC[-5]/R246C5 -> 5.3791131374640012E-2 | M245: 3.8801770752296685 | N245: 4.8451103090122647
E246: =SUM(R[-48]C:R[-1]C) -> 1947726902950000 | I246: =IF(RC[-1]="",((RC[-2]+RC[-3])/2)*0.65,RC[-1]) -> 0 | J246: =SUM(R[-48]C:R[-1]C) -> 7.5295416184238002
A247: ایران ترانسفو | B247: بترانس | C247: دستگاههای برقی | D247: -0.36008230452674 | E247: =VLOOKUP(RC[-3],'[screener-data-1401-11-24.xlsx]overview'!R8C2:R902C7,6,0) -> 70293721836000 | F247: 7.45 | G247: =VLOOKUP(RC[-5],'[screener-data-1401-11-24.xlsx]overview'!R8C2:R897C8,7,FALSE) -> 7.1598050651999996 | I247: =IF(RC[-1]="",((RC[-2]+RC[-3])/2)*0.65,RC[-1]) -> 4.7481866461899997 | J247: =RC[-1]*RC[-5]/R258C5 -> 1.3704497271588905 | M247: 2.8079671679704408 | N247: 1.3190177335069
A248: پارس سوئیچ | B248: بسویچ | C248: دستگاههای برقی | D248: 0.58302238805969997 | E248: =VLOOKUP(RC[-3],'[screener-data-1401-11-24.xlsx]overview'!R8C2:R902C7,6,0) -> 34163648780430 | F248: 2.1640742599096838 | G248: =VLOOKUP(RC[-5],'[screener-data-1401-11-24.xlsx]overview'!R8C2:R897C8,7,FALSE) -> 7.0975418826999999 | I248: =IF(RC[-1]="",((RC[-2]+RC[-3])/2)*0.65,RC[-1]) -> 3.0100252463481474 | J248: =RC[-1]*RC[-5]/R258C5 -> 0.42223397386601857 | M248: 4.0883729357086755 | N248: 2.1369351434170634
A249: جوشکاب یزد | B249: بکاب | C249: دستگاههای برقی | D249: -3.01772915880799 | E249: =VLOOKUP(RC[-3],'[screener-data-1401-11-24.xlsx]overview'!R8C2:R902C7,6,0) -> 3699878000000 | F249: 24.300567107750474 | G249: =VLOOKUP(RC[-5],'[screener-data-1401-11-24.xlsx]overview'!R8C2:R897C8,7,FALSE) -> 33.717302812900002 | I249: =IF(RC[-1]="",((RC[-2]+RC[-3])/2)*0.65,RC[-1]) -> 18.855807724211406 | J249: =RC[-1]*RC[-5]/R258C5 -> 0.28645165304550257 | M249: 8.2513631930995643 | N249: 10.860325399216631
A250: شهید قندی | B250: بکام | C250: دستگاههای برقی | D250: 0.33798056611743998 | E250: =VLOOKUP(RC[-3],'[screener-data-1401-11-24.xlsx]overview'!R8C2:R902C7,6,0) -> 23774965417152 | F250: 59.375 | G250: =VLOOKUP(RC[-5],'[screener-data-1401-11-24.xlsx]overview'!R8C2:R897C8,7,FALSE) -> 5677.3261563984997 | I250: =IF(RC[-1]="",((RC[-2]+RC[-3])/2)*0.65,RC[-1]) -> 1864.4278758295125 | J250: =RC[-1]*RC[-5]/R258C5 -> 182.0053983435586 | M250: 5.6239902258971641 | N250: 2.0932192460261723
A251: لامپ پارس شهاب | B251: بشهاب | C251: دستگاههای برقی | D251: 3.6353467561521202 | E251: =VLOOKUP(RC[-3],'[screener-data-1401-11-24.xlsx]overview'!R8C2:R902C7,6,0) -> 13413600000000 | F251: 3.8174701277297074 | G251: =VLOOKUP(RC[-5],'[screener-data-1401-11-24.xlsx]overview'!R8C2:R897C8,7,FALSE) -> 14.0465419099 | I251: =IF(RC[-1]="",((RC[-2]+RC[-3])/2)*0.65,RC[-1]) -> 5.8058039122296545 | J251: =RC[-1]*RC[-5]/R258C5 -> 0.31976174332202001 | M251: 4.4277746420149819 | N251: 1.5361461505002174
A252: موتوژن | B252: بموتو | C252: دستگاههای برقی | D252: 0.33345683586512997 | E252: =VLOOKUP(RC[-3],'[screener-data-1401-11-24.xlsx]overview'!R8C2:R902C7,6,0) -> 38521526400000 | F252: 8.8208469055374596 | G252: =VLOOKUP(RC[-5],'[screener-data-1401-11-24.xlsx]overview'!R8C2:R897C8,7,FALSE) -> 8.1454867503999999 | I252: =IF(RC[-1]="",((RC[-2]+RC[-3])/2)*0.65,RC[-1]) -> 5.5140584381796751 | J252: =RC[-1]*RC[-5]/R258C5 -> 0.87215492986285414 | M252: 2.12381291646216 | N252: 2.1686866497011379
A253: نیرو ترانس | B253: بنیرو | C253: دستگاههای برقی | D253: -0.13409319477036 | E253: =VLOOKUP(RC[-3],'[screener-data-1401-11-24.xlsx]overview'!R8C2:R902C7,6,0) -> 28143356472000 | F253: 11.501930501930502 | G253: =VLOOKUP(RC[-5],'[screener-data-1401-11-24.xlsx]overview'!R8C2:R897C8,7,FALSE) -> 9.9380836324999997 | I253: =IF(RC[-1]="",((RC[-2]+RC[-3])/2)*0.65,RC[-1]) -> 6.9680045936899138 | J253: =RC[-1]*RC[-5]/R258C5 -> 0.80519877948518737 | M253: 3.2987531503150316 | N253: 1.9892634856841322
A254: نیرو سرمایه | B254: نیرو | C254: دستگاههای برقی | D254: 2.8380634390650998 | E254: =VLOOKUP(RC[-3],'[screener-data-1401-11-24.xlsx]overview'!R8C2:R902C7,6,0) -> 4329423592800 | F254: 993.54838709677415 | G254: =VLOOKUP(RC[-5],'[screener-data-1401-11-24.xlsx]overview'!R8C2:R897C8,7,FALSE) -> 310.56468056710003 | I254: =IF(RC[-1]="",((RC[-2]+RC[-3])/2)*0.65,RC[-1]) -> 423.83674699075908 | J254: =RC[-1]*RC[-5]/R258C5 -> 7.5343792171995343 | M254: 159.61593935518252 | N254: 14.266026872699314
A255: کابل البرز | B255: بالبر | C255: دستگاههای برقی | D255: -1.5783320342946201 | E255: =VLOOKUP(RC[-3],'[screener-data-1401-11-24.xlsx]overview'!R8C2:R902C7,6,0) -> 15760431600000 | F255: 55.202185792349724 | G255: =VLOOKUP(RC[-5],'[screener-data-1401-11-24.xlsx]overview'!R8C2:R897C8,7,FALSE) -> 52.294326894599998 | I255: =IF(RC[-1]="",((RC[-2]+RC[-3])/2)*0.65,RC[-1]) -> 34.936366623258664 | J255: =RC[-1]*RC[-5]/R258C5 -> 2.2608129434840154 | M255: 1.3926589997887646 | N255: 23.43400644713612
A256: کابل تک | B256: بتک | C256: دستگاههای برقی | D256: -2.6766595289070001E-2 | E256: =VLOOKUP(RC[-3],'[screener-data-1401-11-24.xlsx]overview'!R8C2:R902C7,6,0) -> 3359723517900 | F256: 587.2641509433962 | G256: =VLOOKUP(RC[-5],'[screener-data-1401-11-24.xlsx]overview'!R8C2:R897C8,7,FALSE) -> 575.95682887240002 | I256: =IF(RC[-1]="",((RC[-2]+RC[-3])/2)*0.65,RC[-1]) -> 378.04681844013379 | J256: =RC[-1]*RC[-5]/R258C5 -> 5.2151633366475911 | M256: 1.8454347518174361 | N256: 178.38569305879855
A257: کابلسازی ایران | B257: بایکا | C257: دستگاههای برقی | D257: -0.12468827930173999 | E257: =VLOOKUP(RC[-3],'[screener-data-1401-11-24.xlsx]overview'!R8C2:R902C7,6,0) -> 8085842652960 | F257: 180 | G257: =VLOOKUP(RC[-5],'[screener-data-1401-11-24.xlsx]overview'!R8C2:R897C8,7,FALSE) -> 1223.0734779229999 | I257: =IF(RC[-1]="",((RC[-2]+RC[-3])/2)*0.65,RC[-1]) -> 455.998880324975 | J257: =RC[-1]*RC[-5]/R258C5 -> 15.139371641134231 | M257: 4.1387054562056962 | N257: 10.316101204580713
E258: =SUM(R[-11]C:R[-1]C) -> 243546118269242 | I258: =IF(RC[-1]="",((RC[-2]+RC[-3])/2)*0.65,RC[-1]) -> 0 | J258: =SUM(R[-11]C:R[-1]C) -> 216.23137628876444
A259: آسان پرداخت پرشین | B259: آپ | C259: رایانه | D259: -2.1897810218978102 | E259: =VLOOKUP(RC[-3],'[screener-data-1401-11-24.xlsx]overview'!R8C2:R902C7,6,0) -> 36186000000000 | F259: 30.73394495412844 | G259: =VLOOKUP(RC[-5],'[screener-data-1401-11-24.xlsx]overview'!R8C2:R897C8,7,FALSE) -> 34.734632140800002 | I259: =IF(RC[-1]="",((RC[-2]+RC[-3])/2)*0.65,RC[-1]) -> 21.277287555851743 | J259: =RC[-1]*RC[-5]/R276C5 -> 1.0591399933742134 | M259: 0.57176369333298627 | N259: 3.9000901473035259
A260: افرانت | B260: افرا | C260: رایانه | D260: 0.92240911557242999 | E260: =VLOOKUP(RC[-3],'[screener-data-1401-11-24.xlsx]overview'!R8C2:R902C7,6,0) -> 12262500000000 | F260: 20.484581497797357 | G260: =VLOOKUP(RC[-5],'[screener-data-1401-11-24.xlsx]overview'!R8C2:R897C8,7,FALSE) -> 23.834836845800002 | I260: =IF(RC[-1]="",((RC[-2]+RC[-3])/2)*0.65,RC[-1]) -> 14.403810961669143 | J260: =RC[-1]*RC[-5]/R276C5 -> 0.24297017077833691 | M260: 5.4640699212938921 | N260: 8.6795704191280567
A261: ایران ارقام | B261: مرقام | C261: رایانه | D261: 1.6183986371379799 | E261: =VLOOKUP(RC[-3],'[screener-data-1401-11-24.xlsx]overview'!R8C2:R902C7,6,0) -> 5965000000000 | F261: -9.9665831244778609 | G261: =VLOOKUP(RC[-5],'[screener-data-1401-11-24.xlsx]overview'!R8C2:R897C8,7,FALSE) -> 0 | I261: =IF(RC[-1]="",((RC[-2]+RC[-3])/2)*0.65,RC[-1]) -> -3.2391395154553049 | J261: =RC[-1]*RC[-5]/R276C5 -> -2.6578877028762805E-2 | M261: 2.5279965553133277 | N261: -3.2364689553991246
A262: به پرداخت ملت | B262: پرداخت | C262: رایانه | D262: -0.17921146953405001 | E262: =VLOOKUP(RC[-3],'[screener-data-1401-11-24.xlsx]overview'!R8C2:R902C7,6,0) -> 89520000000000 | F262: 24.810690423162583 | G262: =VLOOKUP(RC[-5],'[screener-data-1401-11-24.xlsx]overview'!R8C2:R897C8,7,FALSE) -> 19.313221163200001 | I262: =IF(RC[-1]="",((RC[-2]+RC[-3])/2)*0.65,RC[-1]) -> 14.340271265567839 | J262: =RC[-1]*RC[-5]/R276C5 -> 1.7659319569245917 | M262: 3.3761356006377077 | N262: 3.0301076830637923
A263: پرداخت الکترونیک سامان کیش | B263: سپ | C263: رایانه | D263: -0.56109725685784995 | E263: =VLOOKUP(RC[-3],'[screener-data-1401-11-24.xlsx]overview'!R8C2:R902C7,6,0) -> 181896000000000 | F263: 21.612466124661246 | G263: =VLOOKUP(RC[-5],'[screener-data-1401-11-24.xlsx]overview'!R8C2:R897C8,7,FALSE) -> 53.557442087600002 | I263: =IF(RC[-1]="",((RC[-2]+RC[-3])/2)*0.65,RC[-1]) -> 24.430220168984906 | J263: =RC[-1]*RC[-5]/R276C5 -> 6.112896678017675 | M263: 5.7325894132895741 | N263: 7.270357413847262
A264: پیشگامان فن آوری و دانش آرامیس | B264: تپسی | C264: رایانه | D264: 4.2441982019652897 | E264: =VLOOKUP(RC[-3],'[screener-data-1401-11-24.xlsx]overview'!R8C2:R902C7,6,0) -> 13342187946402 | F264: 30.218181818181819 | G264: =VLOOKUP(RC[-5],'[screener-data-1401-11-24.xlsx]overview'!R8C2:R897C8,7,FALSE) -> 21.037586020900001 | I264: =IF(RC[-1]="",((RC[-2]+RC[-3])/2)*0.65,RC[-1]) -> 16.658124547701593 | J264: =RC[-1]*RC[-5]/R276C5 -> 0.30573818602106789 | M264: 4.6122866277477392 | N264: 4.1293323030440412
A265: تجارت الکترونیک پارسیان | B265: رتاپ | C265: رایانه | D265: -7.2411296162200003E-2 | E265: =VLOOKUP(RC[-3],'[screener-data-1401-11-24.xlsx]overview'!R8C2:R902C7,6,0) -> 24444000000000 | F265: 4.8936170212765955 | G265: =VLOOKUP(RC[-5],'[screener-data-1401-11-24.xlsx]overview'!R8C2:R897C8,7,FALSE) -> 10.012900693800001 | I265: =IF(RC[-1]="",((RC[-2]+RC[-3])/2)*0.65,RC[-1]) -> 4.8446182573998939 | J265: =RC[-1]*RC[-5]/R276C5 -> 0.16290272987700488 | M265: 0.79043887177261329 | N265: 1.4721137126058892
A266: تجارت الکترونیک پارسیان کیش | B266: تاپکیش | C266: رایانه | D266: 1.47058823529411 | E266: =VLOOKUP(RC[-3],'[screener-data-1401-11-24.xlsx]overview'!R8C2:R902C7,6,0) -> 16920000000000 | F266: 16.046511627906977 | G266: =VLOOKUP(RC[-5],'[screener-data-1401-11-24.xlsx]overview'!R8C2:R897C8,7,FALSE) -> 48.297907090700001 | I266: =IF(RC[-1]="",((RC[-2]+RC[-3])/2)*0.65,RC[-1]) -> 20.911936083547268 | J266: =RC[-1]*RC[-5]/R276C5 -> 0.4867333756227602 | M266: 1.9142667887516611 | N266: 5.4691425833518368
A267: توسعه فناوری اطلاعات خوارزمی | B267: مفاخر | C267: رایانه | D267: -2.03252032520325 | E267: =VLOOKUP(RC[-3],'[screener-data-1401-11-24.xlsx]overview'!R8C2:R902C7,6,0) -> 5931026937990 | F267: -49.520547945205479 | G267: =VLOOKUP(RC[-5],'[screener-data-1401-11-24.xlsx]overview'!R8C2:R897C8,7,FALSE) -> 108.4562591648 | I267: =IF(RC[-1]="",((RC[-2]+RC[-3])/2)*0.65,RC[-1]) -> 19.154106146368221 | J267: =RC[-1]*RC[-5]/R276C5 -> 0.15627456977151577 | M267: 5.1715353487122862 | N267: 5.717994166166557
A268: خدمات انفورماتیک | B268: رانفور | C268: رایانه | D268: 0 | E268: =VLOOKUP(RC[-3],'[screener-data-1401-11-24.xlsx]overview'!R8C2:R902C7,6,0) -> 143892000000000 | F268: 10.524934383202099 | G268: =VLOOKUP(RC[-5],'[screener-data-1401-11-24.xlsx]overview'!R8C2:R897C8,7,FALSE) -> 9.8047272578999998 | I268: =IF(RC[-1]="",((RC[-2]+RC[-3])/2)*0.65,RC[-1]) -> 6.6071400333581822 | J268: =RC[-1]*RC[-5]/R276C5 -> 1.3078161197922049 | M268: 4.3542593560473897 | N268: 2.9741062394589814
A269: داده پردازی ایران | B269: مداران | C269: رایانه | D269: -1.6369047619047601 | E269: =VLOOKUP(RC[-3],'[screener-data-1401-11-24.xlsx]overview'!R8C2:R902C7,6,0) -> 12889500000000 | F269: 4.7214285714285715 | G269: =VLOOKUP(RC[-5],'[screener-data-1401-11-24.xlsx]overview'!R8C2:R897C8,7,FALSE) -> 10.959664630100001 | I269: =IF(RC[-1]="",((RC[-2]+RC[-3])/2)*0.65,RC[-1]) -> 5.0963552904967857 | J269: =RC[-1]*RC[-5]/R276C5 -> 9.0363343869418605E-2 | M269: 1.9006066547111069 | N269: 4.4396811985468698
A270: رایان هم افزا | B270: رافزا | C270: رایانه | D270: -6.50205761316872 | E270: =VLOOKUP(RC[-3],'[screener-data-1401-11-24.xlsx]overview'!R8C2:R902C7,6,0) -> 11430000000000 | F270: 13.78640776699029 | G270: =VLOOKUP(RC[-5],'[screener-data-1401-11-24.xlsx]overview'!R8C2:R897C8,7,FALSE) -> 18.341719618900001 | I270: =IF(RC[-1]="",((RC[-2]+RC[-3])/2)*0.65,RC[-1]) -> 10.441641400414346 | J270: =RC[-1]*RC[-5]/R276C5 -> 0.16417670304853299 | M270: 5.8595150322866498 | N270: 14.774007111291452
A271: سپیدار سیستم آسیا | B271: سپیدار | C271: رایانه | D271: 0.77821011673150997 | E271: =VLOOKUP(RC[-3],'[screener-data-1401-11-24.xlsx]overview'!R8C2:R902C7,6,0) -> 17850000000000 | F271: 13.302516692347201 | G271: =VLOOKUP(RC[-5],'[screener-data-1401-11-24.xlsx]overview'!R8C2:R897C8,7,FALSE) -> 10.660627851399999 | I271: =IF(RC[-1]="",((RC[-2]+RC[-3])/2)*0.65,RC[-1]) -> 7.7880219767178396 | J271: =RC[-1]*RC[-5]/R276C5 -> 0.19123259324121383 | M271: 12.913399735606509 | N271: 8.7905630178638017
A272: فن آوا | B272: فن آوا | C272: رایانه | D272: -2.3008849557522102 | E272: =VLOOKUP(RC[-3],'[screener-data-1401-11-24.xlsx]overview'!R8C2:R902C7,6,0) -> 11682000000000 | F272: -141.53846153846155 | G272: =VLOOKUP(RC[-5],'[screener-data-1401-11-24.xlsx]overview'!R8C2:R897C8,7,FALSE) -> 0 | I272: =IF(RC[-1]="",((RC[-2]+RC[-3])/2)*0.65,RC[-1]) -> -46.000000000000007 | J272: =RC[-1]*RC[-5]/R276C5 -> -0.73921634168323724 | M272: 18.917007548733412 | N272: 1.7505766963847147
A273: نرم افزاری نگین | B273: توسن | C273: رایانه | D273: 6.5832784726789995E-2 | E273: =VLOOKUP(RC[-3],'[screener-data-1401-11-24.xlsx]overview'!R8C2:R902C7,6,0) -> 45780000000000 | F273: 19.947506561679791 | G273: =VLOOKUP(RC[-5],'[screener-data-1401-11-24.xlsx]overview'!R8C2:R897C8,7,FALSE) -> 17.160698732299998 | I273: =IF(RC[-1]="",((RC[-2]+RC[-3])/2)*0.65,RC[-1]) -> 12.060166720543434 | J273: =RC[-1]*RC[-5]/R276C5 -> 0.75949623530512722 | M273: 10.668490916224505 | N273: 9.1199142728058362
A274: همکاران سیستم | B274: سیستم | C274: رایانه | D274: 0.12903225806450999 | E274: =VLOOKUP(RC[-3],'[screener-data-1401-11-24.xlsx]overview'!R8C2:R902C7,6,0) -> 77400000000000 | F274: 14.894433781190019 | G274: =VLOOKUP(RC[-5],'[screener-data-1401-11-24.xlsx]overview'!R8C2:R897C8,7,FALSE) -> 12.7827775036 | I274: =IF(RC[-1]="",((RC[-2]+RC[-3])/2)*0.65,RC[-1]) -> 8.9950936675567572 | J274: =RC[-1]*RC[-5]/R276C5 -> 0.95773018712153279 | M274: 11.68249624835301 | N274: 5.9139800925979911
A275: کارت اعتباری ایران کیش | B275: رکیش | C275: رایانه | D275: -0.95020904599011002 | E275: =VLOOKUP(RC[-3],'[screener-data-1401-11-24.xlsx]overview'!R8C2:R902C7,6,0) -> 19558000000000 | F275: 14.477777777777778 | G275: =VLOOKUP(RC[-5],'[screener-data-1401-11-24.xlsx]overview'!R8C2:R897C8,7,FALSE) -> 34.157425209300001 | I275: =IF(RC[-1]="",((RC[-2]+RC[-3])/2)*0.65,RC[-1]) -> 15.806440970800278 | J275: =RC[-1]*RC[-5]/R276C5 -> 0.4252605153670751 | M275: 3.1754796293730299 | N275: 1.7960778118784131
E276: =SUM(R[-17]C:R[-1]C) -> 726948214884392 | I276: =IF(RC[-1]="",((RC[-2]+RC[-3])/2)*0.65,RC[-1]) -> 0 | J276: =SUM(R[-17]C:R[-1]C) -> 13.422868139420268
A277: آینده سازان بهشت پارس | B277: آینده | C277: زراعت و خدمات وابسته | D277: -1.97044334975369 | E277: =VLOOKUP(RC[-3],'[screener-data-1401-11-24.xlsx]overview'!R8C2:R902C7,6,0) -> 3200585460000 | F277: 4.1653584510727368 | G277: =VLOOKUP(RC[-5],'[screener-data-1401-11-24.xlsx]overview'!R8C2:R897C8,7,FALSE) -> 0 | I277: =IF(RC[-1]="",((RC[-2]+RC[-3])/2)*0.65,RC[-1]) -> 1.3537414965986396 | J277: =RC[-1]*RC[-5]/R295C5 -> 1.11724641982328E-2 | M277: 38673.660000000003 | N277: 15.79363759396354
A278: تلیسه نمونه | B278: تلیسه | C278: زراعت و خدمات وابسته | D278: -0.90537383177569997 | E278: =VLOOKUP(RC[-3],'[screener-data-1401-11-24.xlsx]overview'!R8C2:R902C7,6,0) -> 17164171780000 | F278: 24.235714285714284 | G278: =VLOOKUP(RC[-5],'[screener-data-1401-11-24.xlsx]overview'!R8C2:R897C8,7,FALSE) -> 15.047648415999999 | I278: =IF(RC[-1]="",((RC[-2]+RC[-3])/2)*0.65,RC[-1]) -> 12.767092878057142 | J278: =RC[-1]*RC[-5]/R295C5 -> 0.56506534368564554 | M278: 5.0035991731754494 | N278: 2.7973790801278797
A279: سپید ماکیان | B279: سپید | C279: زراعت و خدمات وابسته | D279: -3.2144650929181302 | E279: =VLOOKUP(RC[-3],'[screener-data-1401-11-24.xlsx]overview'!R8C2:R902C7,6,0) -> 57450000000000 | F279: 8.0459290187891437 | G279: =VLOOKUP(RC[-5],'[screener-data-1401-11-24.xlsx]overview'!R8C2:R897C8,7,FALSE) -> 6.8511522425000004 | I279: =IF(RC[-1]="",((RC[-2]+RC[-3])/2)*0.65,RC[-1]) -> 4.8415514099189725 | J279: =RC[-1]*RC[-5]/R295C5 -> 0.71722989442912144 | M279: 1.8439924935055962 | N279: 3.8597221667696417
A280: سر. کشاورزی کوثر | B280: زکوثر | C280: زراعت و خدمات وابسته | D280: 0.78909612625537995 | E280: =VLOOKUP(RC[-3],'[screener-data-1401-11-24.xlsx]overview'!R8C2:R902C7,6,0) -> 38637500000000 | F280: 10.392011834319527 | G280: =VLOOKUP(RC[-5],'[screener-data-1401-11-24.xlsx]overview'!R8C2:R897C8,7,FALSE) -> 7.9680284272000002 | I280: =IF(RC[-1]="",((RC[-2]+RC[-3])/2)*0.65,RC[-1]) -> 5.9670130849938472 | J280: =RC[-1]*RC[-5]/R295C5 -> 0.59449719566514458 | K280: 1.4 | M280: 9.2085453394095236 | N280: 5.1809771815752317
A281: سیمرغ | B281: سیمرغ | C281: زراعت و خدمات وابسته | D281: -1.4925373134328299 | E281: =VLOOKUP(RC[-3],'[screener-data-1401-11-24.xlsx]overview'!R8C2:R902C7,6,0) -> 29939000000000 | F281: 6.0917721518987342 | G281: =VLOOKUP(RC[-5],'[screener-data-1401-11-24.xlsx]overview'!R8C2:R897C8,7,FALSE) -> 5.3622074787000003 | H281: 4.3 | I281: =IF(RC[-1]="",((RC[-2]+RC[-3])/2)*0.65,RC[-1]) -> 4.3 | J281: =RC[-1]*RC[-5]/R295C5 -> 0.33196289847766436 | M281: 2.0507876923236621 | N281: 2.5613989417660874
A282: شیر و گوشت زاگرس شهرکرد | B282: زشگزا | C282: زراعت و خدمات وابسته | D282: -0.49261083743841999 | E282: =VLOOKUP(RC[-3],'[screener-data-1401-11-24.xlsx]overview'!R8C2:R902C7,6,0) -> 5952000000000 | F282: 14.258823529411766 | G282: =VLOOKUP(RC[-5],'[screener-data-1401-11-24.xlsx]overview'!R8C2:R897C8,7,FALSE) -> 8.8329810555999995 | I282: =IF(RC[-1]="",((RC[-2]+RC[-3])/2)*0.65,RC[-1]) -> 7.5048364901288238 | J282: =RC[-1]*RC[-5]/R295C5 -> 0.11518288686250537 | M282: 2.2923358688148383 | N282: 2.9118851423082757
A283: گوشت مرغ ماهان | B283: زماهان | C283: زراعت و خدمات وابسته | D283: -2.7434842249656999 | E283: =VLOOKUP(RC[-3],'[screener-data-1401-11-24.xlsx]overview'!R8C2:R902C7,6,0) -> 8294200000000 | F283: 10.503703703703703 | G283: =VLOOKUP(RC[-5],'[screener-data-1401-11-24.xlsx]overview'!R8C2:R897C8,7,FALSE) -> 13.6718704115 | I283: =IF(RC[-1]="",((RC[-2]+RC[-3])/2)*0.65,RC[-1]) -> 7.8570615874412031 | J283: =RC[-1]*RC[-5]/R295C5 -> 0.16804224029993131 | M283: 3.2848527439510646 | N283: 3.9204508197924608
A284: مگسال | B284: زمگسا | C284: زراعت و خدمات وابسته | D284: 4.5678144764581798 | E284: =VLOOKUP(RC[-3],'[screener-data-1401-11-24.xlsx]overview'!R8C2:R902C7,6,0) -> 8709000000000 | F284: 14.45361826129189 | G284: =VLOOKUP(RC[-5],'[screener-data-1401-11-24.xlsx]overview'!R8C2:R897C8,7,FALSE) -> 8.9747279115000005 | I284: =IF(RC[-1]="",((RC[-2]+RC[-3])/2)*0.65,RC[-1]) -> 7.6142125061573642 | J284: =RC[-1]*RC[-5]/R295C5 -> 0.17099250947506264 | M284: 3.0523483902862294 | N284: 7.1982642894979358
A285: کشاورزی مکانیزه اصفهان کشت | B285: زکشت | C285: زراعت و خدمات وابسته | D285: 6.2880324543610504 | E285: =VLOOKUP(RC[-3],'[screener-data-1401-11-24.xlsx]overview'!R8C2:R902C7,6,0) -> 7695000000000 | F285: 20.153846153846153 | G285: =VLOOKUP(RC[-5],'[screener-data-1401-11-24.xlsx]overview'!R8C2:R897C8,7,FALSE) -> 11.1034844753 | I285: =IF(RC[-1]="",((RC[-2]+RC[-3])/2)*0.65,RC[-1]) -> 10.1586324544725 | J285: =RC[-1]*RC[-5]/R295C5 -> 0.20157082521771105 | M285: 4.5409062863243621 | N285: 6.3243930875831884
A286: کشاورزی و دامپروری بینالود | B286: زبینا | C286: زراعت و خدمات وابسته | D286: -4.6992481203007497 | E286: =VLOOKUP(RC[-3],'[screener-data-1401-11-24.xlsx]overview'!R8C2:R902C7,6,0) -> 13981359067159 | F286: 16.8298755186722 | G286: =VLOOKUP(RC[-5],'[screener-data-1401-11-24.xlsx]overview'!R8C2:R897C8,7,FALSE) -> 10.272052757200001 | I286: =IF(RC[-1]="",((RC[-2]+RC[-3])/2)*0.65,RC[-1]) -> 8.8081266896584651 | J286: =RC[-1]*RC[-5]/R295C5 -> 0.31755338314111092 | M286: 4.8257952941522557 | N286: 2.7879215973596638
A287: کشاورزی و دامپروری ملارد شیر | B287: زملارد | C287: زراعت و خدمات وابسته | D287: 4.1666666666666599 | E287: =VLOOKUP(RC[-3],'[screener-data-1401-11-24.xlsx]overview'!R8C2:R902C7,6,0) -> 9584000000000 | F287: 8.8582677165354333 | G287: =VLOOKUP(RC[-5],'[screener-data-1401-11-24.xlsx]overview'!R8C2:R897C8,7,FALSE) -> 34.405313709600001 | I287: =IF(RC[-1]="",((RC[-2]+RC[-3])/2)*0.65,RC[-1]) -> 14.060663963494015 | J287: =RC[-1]*RC[-5]/R295C5 -> 0.34748529943179768 | M287: 3.9424818185880133 | N287: 3.4274537522240367
A288: کشت و دام قیام اصفهان | B288: زقیام | C288: زراعت و خدمات وابسته | D288: 1.7394822006472399 | E288: =VLOOKUP(RC[-3],'[screener-data-1401-11-24.xlsx]overview'!R8C2:R902C7,6,0) -> 16856461711440 | F288: 20.785123966942148 | G288: =VLOOKUP(RC[-5],'[screener-data-1401-11-24.xlsx]overview'!R8C2:R897C8,7,FALSE) -> 10.0312037332 | I288: =IF(RC[-1]="",((RC[-2]+RC[-3])/2)*0.65,RC[-1]) -> 10.015306502546197 | J288: =RC[-1]*RC[-5]/R295C5 -> 0.43532585853859801 | M288: 3.4289564032413686 | N288: 1.8577791306943379
A289: کشت و دام گلدشت نمونه اصفهان | B289: زگلدشت | C289: زراعت و خدمات وابسته | D289: 1.1214953271028001 | E289: =VLOOKUP(RC[-3],'[screener-data-1401-11-24.xlsx]overview'!R8C2:R902C7,6,0) -> 11655000000000 | F289: 20.596446700507613 | G289: =VLOOKUP(RC[-5],'[screener-data-1401-11-24.xlsx]overview'!R8C2:R897C8,7,FALSE) -> 16.864699695900001 | I289: =IF(RC[-1]="",((RC[-2]+RC[-3])/2)*0.65,RC[-1]) -> 12.174872578832474 | J289: =RC[-1]*RC[-5]/R295C5 -> 0.36589839504575578 | M289: 3.4721956923501978 | N289: 8.694760413852535
A290: کشت و دامداری فکا | B290: زفکا | C290: زراعت و خدمات وابسته | D290: 0.25531914893617003 | E290: =VLOOKUP(RC[-3],'[screener-data-1401-11-24.xlsx]overview'!R8C2:R902C7,6,0) -> 17085000000000 | F290: 15.664893617021276 | G290: =VLOOKUP(RC[-5],'[screener-data-1401-11-24.xlsx]overview'!R8C2:R897C8,7,FALSE) -> 8.7349641331000001 | I290: =IF(RC[-1]="",((RC[-2]+RC[-3])/2)*0.65,RC[-1]) -> 7.9299537687894155 | J290: =RC[-1]*RC[-5]/R295C5 -> 0.34935699279387872 | M290: 3.3920990009145422 | N290: 4.8800035571276634
A291: کشت و صنعت آبشیرین | B291: آبین | C291: زراعت و خدمات وابسته | D291: 0 | E291: =VLOOKUP(RC[-3],'[screener-data-1401-11-24.xlsx]overview'!R8C2:R902C7,6,0) -> 17142869201580 | F291: 501.57894736842104 | G291: =VLOOKUP(RC[-5],'[screener-data-1401-11-24.xlsx]overview'!R8C2:R897C8,7,FALSE) -> 81.539169000900003 | I291: =IF(RC[-1]="",((RC[-2]+RC[-3])/2)*0.65,RC[-1]) -> 189.51338782002932 | J291: =RC[-1]*RC[-5]/R295C5 -> 8.3773605810731411 | M291: 104.38734818064155 | N291: 8.3068814129064545
A292: کشت و صنعت دشت خرمدره | B292: زدشت | C292: زراعت و خدمات وابسته | D292: 5.0096339113680104 | E292: =VLOOKUP(RC[-3],'[screener-data-1401-11-24.xlsx]overview'!R8C2:R902C7,6,0) -> 18388500000000 | F292: 23.92449517120281 | G292: =VLOOKUP(RC[-5],'[screener-data-1401-11-24.xlsx]overview'!R8C2:R897C8,7,FALSE) -> 13.5041837807 | I292: =IF(RC[-1]="",((RC[-2]+RC[-3])/2)*0.65,RC[-1]) -> 12.164320659368414 | J292: =RC[-1]*RC[-5]/R295C5 -> 0.57679032377619976 | M292: 5.458445560115913 | N292: 6.5431862472160356
A293: کشت و صنعت شریف آباد | B293: زشریف | C293: زراعت و خدمات وابسته | D293: 0.11271415689810001 | E293: =VLOOKUP(RC[-3],'[screener-data-1401-11-24.xlsx]overview'!R8C2:R902C7,6,0) -> 10561824504000 | F293: 14.279742765273312 | G293: =VLOOKUP(RC[-5],'[screener-data-1401-11-24.xlsx]overview'!R8C2:R897C8,7,FALSE) -> 9.0740275338000007 | I293: =IF(RC[-1]="",((RC[-2]+RC[-3])/2)*0.65,RC[-1]) -> 7.5899753471988261 | J293: =RC[-1]*RC[-5]/R295C5 -> 0.20671077453986711 | M293: 2.467886769139616 | N293: 2.719318668489449
A294: کشت و صنعت و دامپروری پارس | B294: زپارس | C294: زراعت و خدمات وابسته | D294: -0.14581510644501999 | E294: =VLOOKUP(RC[-3],'[screener-data-1401-11-24.xlsx]overview'!R8C2:R902C7,6,0) -> 95511023000000 | F294: 94.585635359116026 | G294: =VLOOKUP(RC[-5],'[screener-data-1401-11-24.xlsx]overview'!R8C2:R897C8,7,FALSE) -> 63.403214711399997 | I294: =IF(RC[-1]="",((RC[-2]+RC[-3])/2)*0.65,RC[-1]) -> 51.346376272917716 | J294: =RC[-1]*RC[-5]/R295C5 -> 12.645822971155525 | M294: 37.67403586160345 | N294: 29.358313067849608
E295: =SUM(R[-18]C:R[-1]C) -> 387807494724179 | I295: =IF(RC[-1]="",((RC[-2]+RC[-3])/2)*0.65,RC[-1]) -> 0 | J295: =SUM(R[-18]C:R[-1]C) -> 26.498020837806894
A296: واسپاری گسترش تجارت و سرمایه ایرانیان | B296: ولتجار | C296: سایر حمل و نقل | D296: 8.36820083682E-2 | E296: =VLOOKUP(RC[-3],'[screener-data-1401-11-24.xlsx]overview'!R8C2:R902C7,6,0) -> 4303800000000 | F296: 27.181818181818183 | G296: =VLOOKUP(RC[-5],'[screener-data-1401-11-24.xlsx]overview'!R8C2:R897C8,7,FALSE) -> 27.559055118100002 | I296: =IF(RC[-1]="",((RC[-2]+RC[-3])/2)*0.65,RC[-1]) -> 17.790783822473411 | M296: 23.555414528464979 | N296: 1.9023011764789048
I297: =IF(RC[-1]="",((RC[-2]+RC[-3])/2)*0.65,RC[-1]) -> 0
A298: لیزینگ پارسیان | B298: ولپارس | C298: سایر واسطه گریهای مالی | D298: 2.0677177565262301 | E298: =VLOOKUP(RC[-3],'[screener-data-1401-11-24.xlsx]overview'!R8C2:R902C7,6,0) -> 7666000000000 | F298: 25.980263157894736 | G298: =VLOOKUP(RC[-5],'[screener-data-1401-11-24.xlsx]overview'!R8C2:R897C8,7,FALSE) -> 28.561230844000001 | I298: =IF(RC[-1]="",((RC[-2]+RC[-3])/2)*0.65,RC[-1]) -> 17.725985550615789 | J298: =RC[-1]*RC[-5]/R300C5 -> 6.7451308066623969 | M298: 3.9144646357510862 | N298: 3.0912143055354968
A299: لیزینگ کارآفرین | B299: ولکار | C299: سایر واسطه گریهای مالی | D299: 0.24125452352231 | E299: =VLOOKUP(RC[-3],'[screener-data-1401-11-24.xlsx]overview'!R8C2:R902C7,6,0) -> 12480000000000 | F299: 20.317848410757946 | G299: =VLOOKUP(RC[-5],'[screener-data-1401-11-24.xlsx]overview'!R8C2:R897C8,7,FALSE) -> 29.669105571100001 | I299: =IF(RC[-1]="",((RC[-2]+RC[-3])/2)*0.65,RC[-1]) -> 16.245760044103836 | J299: =RC[-1]*RC[-5]/R300C5 -> 10.063887885953335 | M299: 9.3965620568859496 | N299: 5.1222308517326827
E300: =SUM(R[-2]C:R[-1]C) -> 20146000000000 | J300: =SUM(R[-2]C:R[-1]C) -> 16.80901869261573
A301: توسعه اقتصادی آرین | B301: وآرین | C301: سرمایه گذاریها | D301: -2.46815286624203 | E301: =VLOOKUP(RC[-3],'[screener-data-1401-11-24.xlsx]overview'!R8C2:R902C7,6,0) -> 4920000000000 | F301: 47.115384615384613 | G301: =VLOOKUP(RC[-5],'[screener-data-1401-11-24.xlsx]overview'!R8C2:R897C8,7,FALSE) -> 0 | I301: =IF(RC[-1]="",((RC[-2]+RC[-3])/2)*0.65,RC[-1]) -> 15.3125 | J301: =RC[-1]*RC[-5]/R375C5 -> 1.6415235525794415E-2 | K301: 0.9 | M301: 22.191526459998641 | N301: 1.1059113217107319
A302: تکادو | B302: وکادو | C302: سرمایه گذاریها | D302: 2.9429797670141 | E302: =VLOOKUP(RC[-3],'[screener-data-1401-11-24.xlsx]overview'!R8C2:R902C7,6,0) -> 13625515200000 | F302: 7.8311567164179108 | G302: =VLOOKUP(RC[-5],'[screener-data-1401-11-24.xlsx]overview'!R8C2:R897C8,7,FALSE) -> 5.933105093 | I302: =IF(RC[-1]="",((RC[-2]+RC[-3])/2)*0.65,RC[-1]) -> 4.4733850880608212 | J302: =RC[-1]*RC[-5]/R375C5 -> 1.3280827386996307E-2 | K302: 0.45 | M302: 6.9153702777651498 | N302: 2.9670970247309598
A303: س. امین توان آفرین ساز | B303: وامین | C303: سرمایه گذاریها | D303: 0 | E303: =VLOOKUP(RC[-3],'[screener-data-1401-11-24.xlsx]overview'!R8C2:R902C7,6,0) -> 113200000000000 | F303: 7.1645569620253164 | G303: =VLOOKUP(RC[-5],'[screener-data-1401-11-24.xlsx]overview'!R8C2:R897C8,7,FALSE) -> 27.673107264599999 | I303: =IF(RC[-1]="",((RC[-2]+RC[-3])/2)*0.65,RC[-1]) -> 11.322240873653227 | J303: =RC[-1]*RC[-5]/R375C5 -> 0.27926385625052447 | K303: 0.55000000000000004 | M303: 6.7246727113078402 | N303: 3.9849073394635899
A304: س.ص. بازنشستگی کارکنان بانکها | B304: وسکاب | C304: سرمایه گذاریها | D304: -0.1324064879179 | E304: =VLOOKUP(RC[-3],'[screener-data-1401-11-24.xlsx]overview'!R8C2:R902C7,6,0) -> 36072000000000 | F304: 2.7253839205058719 | G304: =VLOOKUP(RC[-5],'[screener-data-1401-11-24.xlsx]overview'!R8C2:R897C8,7,FALSE) -> 4.0032865330999998 | I304: =IF(RC[-1]="",((RC[-2]+RC[-3])/2)*0.65,RC[-1]) -> 2.1868178974219084 | J304: =RC[-1]*RC[-5]/R375C5 -> 1.7187739221445685E-2 | K304: 0.64 | M304: 2.7033803903518798 | N304: 1.0637938395511874
A305: سر. آتیه دماوند | B305: واتی | C305: سرمایه گذاریها | D305: -0.49950049950049003 | E305: =VLOOKUP(RC[-3],'[screener-data-1401-11-24.xlsx]overview'!R8C2:R902C7,6,0) -> 44595000000000 | F305: 5.2092050209205025 | G305: =VLOOKUP(RC[-5],'[screener-data-1401-11-24.xlsx]overview'!R8C2:R897C8,7,FALSE) -> 4.6030338982999996 | I305: =IF(RC[-1]="",((RC[-2]+RC[-3])/2)*0.65,RC[-1]) -> 3.188977648746663 | J305: =RC[-1]*RC[-5]/R375C5 -> 3.0986573709081852E-2 | K305: 0.45 | M305: 5.4266691366365549 | N305: 3.4322592858235743
A306: سر. آوا نوین | B306: وآوا | C306: سرمایه گذاریها | D306: 0.3125 | E306: =VLOOKUP(RC[-3],'[screener-data-1401-11-24.xlsx]overview'!R8C2:R902C7,6,0) -> 3672240000000 | F306: -4.7292817679558015 | G306: =VLOOKUP(RC[-5],'[screener-data-1401-11-24.xlsx]overview'!R8C2:R897C8,7,FALSE) -> 13.8559773782 | I306: =IF(RC[-1]="",((RC[-2]+RC[-3])/2)*0.65,RC[-1]) -> 2.9661760733293643 | J306: =RC[-1]*RC[-5]/R375C5 -> 2.3733615273841199E-3 | K306: 1.2 | M306: -6.1196613908682407 | N306: 1.1841898415169323
A307: سر. ارزش آفرینان | B307: وآفر | C307: سرمایه گذاریها | D307: 2.98245614035087 | E307: =VLOOKUP(RC[-3],'[screener-data-1401-11-24.xlsx]overview'!R8C2:R902C7,6,0) -> 8805000000000 | F307: 8.8350391330523781 | G307: =VLOOKUP(RC[-5],'[screener-data-1401-11-24.xlsx]overview'!R8C2:R897C8,7,FALSE) -> 3.5673495747000001 | I307: =IF(RC[-1]="",((RC[-2]+RC[-3])/2)*0.65,RC[-1]) -> 4.0307763300195232 | J307: =RC[-1]*RC[-5]/R375C5 -> 7.7331061879388242E-3 | K307: 0.9 | M307: 8.8234763594967855 | N307: 1.3876655210743132
A308: سر. استان آذربایجان شرقی | B308: وساشرقی | C308: سرمایه گذاریها | D308: 0 | E308: =VLOOKUP(RC[-3],'[screener-data-1401-11-24.xlsx]overview'!R8C2:R902C7,6,0) -> 87721004145060 | F308: 1.4264813460131675E-2 | G308: =VLOOKUP(RC[-5],'[screener-data-1401-11-24.xlsx]overview'!R8C2:R897C8,7,FALSE) -> 5.2283570288999996 | I308: =IF(RC[-1]="",((RC[-2]+RC[-3])/2)*0.65,RC[-1]) -> 1.7038520987670429 | J308: =RC[-1]*RC[-5]/R375C5 -> 3.2566523655497254E-2 | M308: 18.507485843159081 | N308: 0.38602625798266388
A309: سر. استان آذربایجان غربی | B309: وساغربی | C309: سرمایه گذاریها | D309: -0.92378752886836002 | E309: =VLOOKUP(RC[-3],'[screener-data-1401-11-24.xlsx]overview'!R8C2:R902C7,6,0) -> 68106338102946 | F309: 3.6062845181953445E-6 | G309: =VLOOKUP(RC[-5],'[screener-data-1401-11-24.xlsx]overview'!R8C2:R897C8,7,FALSE) -> 0 | I309: =IF(RC[-1]="",((RC[-2]+RC[-3])/2)*0.65,RC[-1]) -> 1.172042468413487E-6 | J309: =RC[-1]*RC[-5]/R375C5 -> 1.7392691442560183E-8 | M309: 40.79359711356755 | N309: 0.42889967506032756
A310: سر. استان اردبیل | B310: وساربیل | C310: سرمایه گذاریها | D310: 0 | E310: =VLOOKUP(RC[-3],'[screener-data-1401-11-24.xlsx]overview'!R8C2:R902C7,6,0) -> 80905990575360 | F310: 7.5529948804856578E-6 | G310: =VLOOKUP(RC[-5],'[screener-data-1401-11-24.xlsx]overview'!R8C2:R897C8,7,FALSE) -> 2.9873791186999998 | I310: =IF(RC[-1]="",((RC[-2]+RC[-3])/2)*0.65,RC[-1]) -> 0.97090066830083621 | J310: =RC[-1]*RC[-5]/R375C5 -> 1.7115571042122336E-2 | M310: 95.302021454915106 | N310: 0.90954344374872453
A311: سر. استان اصفهان | B311: وسصفا | C311: سرمایه گذاریها | D311: 0 | E311: =VLOOKUP(RC[-3],'[screener-data-1401-11-24.xlsx]overview'!R8C2:R902C7,6,0) -> 168581556409635 | F311: 5.6348636200682769E-5 | G311: =VLOOKUP(RC[-5],'[screener-data-1401-11-24.xlsx]overview'!R8C2:R897C8,7,FALSE) -> 351.16793639640002 | I311: =IF(RC[-1]="",((RC[-2]+RC[-3])/2)*0.65,RC[-1]) -> 114.12959764213677 | J311: =RC[-1]*RC[-5]/R375C5 -> 4.1922218690076436 | M311: 54.938972672203313 | N311: 0.72661838335384632
A312: سر. استان ایلام | B312: وسیلام | C312: سرمایه گذاریها | D312: 0 | E312: =VLOOKUP(RC[-3],'[screener-data-1401-11-24.xlsx]overview'!R8C2:R902C7,6,0) -> 36321644214400 | F312: 7.3810666117451819E-6 | G312: =VLOOKUP(RC[-5],'[screener-data-1401-11-24.xlsx]overview'!R8C2:R897C8,7,FALSE) -> 2.9886501571999999 | I312: =IF(RC[-1]="",((RC[-2]+RC[-3])/2)*0.65,RC[-1]) -> 0.97131369993664884 | J312: =RC[-1]*RC[-5]/R375C5 -> 7.6870716345502502E-3 | M312: 43.026303281436391 | N312: 0.8892701948725904
A313: سر. استان بوشهر | B313: وسبوشهر | C313: سرمایه گذاریها | D313: 0 | E313: =VLOOKUP(RC[-3],'[screener-data-1401-11-24.xlsx]overview'!R8C2:R902C7,6,0) -> 60763508012340 | F313: 5.4103956888593082E-5 | G313: =VLOOKUP(RC[-5],'[screener-data-1401-11-24.xlsx]overview'!R8C2:R897C8,7,FALSE) -> 59.968478806299998 | I313: =IF(RC[-1]="",((RC[-2]+RC[-3])/2)*0.65,RC[-1]) -> 19.489773195833489 | J313: =RC[-1]*RC[-5]/R375C5 -> 0.25803911149250613 | M313: 144.59549048023587 | N313: 1.2472311222114751
A314: سر. استان خراسان رضوی | B314: وسرضوی | C314: سرمایه گذاریها | D314: 0 | E314: =VLOOKUP(RC[-3],'[screener-data-1401-11-24.xlsx]overview'!R8C2:R902C7,6,0) -> 253762928859025 | F314: 1.3380983168199696E-4 | G314: =VLOOKUP(RC[-5],'[screener-data-1401-11-24.xlsx]overview'!R8C2:R897C8,7,FALSE) -> 0 | I314: =IF(RC[-1]="",((RC[-2]+RC[-3])/2)*0.65,RC[-1]) -> 4.3488195296649012E-5 | J314: =RC[-1]*RC[-5]/R375C5 -> 2.4045592200333516E-6 | M314: 491.18796379814609 | N314: 0.74733443342916028
A315: سر. استان خراسان شمالی | B315: وسخراش | C315: سرمایه گذاریها | D315: 0 | E315: =VLOOKUP(RC[-3],'[screener-data-1401-11-24.xlsx]overview'!R8C2:R902C7,6,0) -> 93892795357601 | F315: 1.0721949844144046E-2 | G315: =VLOOKUP(RC[-5],'[screener-data-1401-11-24.xlsx]overview'!R8C2:R897C8,7,FALSE) -> 0 | I315: =IF(RC[-1]="",((RC[-2]+RC[-3])/2)*0.65,RC[-1]) -> 3.4846336993468153E-3 | J315: =RC[-1]*RC[-5]/R375C5 -> 7.1289458378334111E-5 | M315: 146.43909706272723 | N315: 1.4843402838355444
A316: سر. استان خوزستان | B316: وسخوز | C316: سرمایه گذاریها | D316: 0 | E316: =VLOOKUP(RC[-3],'[screener-data-1401-11-24.xlsx]overview'!R8C2:R902C7,6,0) -> 162592427427525 | F316: 1.1173610368263135E-6 | G316: =VLOOKUP(RC[-5],'[screener-data-1401-11-24.xlsx]overview'!R8C2:R897C8,7,FALSE) -> 9.4438574619000004 | I316: =IF(RC[-1]="",((RC[-2]+RC[-3])/2)*0.65,RC[-1]) -> 3.0692540382598374 | J316: =RC[-1]*RC[-5]/R375C5 -> 0.10873492637145804 | M316: 57.256438149072991 | N316: 0.63279011456860235
A317: سر. استان زنجان | B317: وسزنجان | C317: سرمایه گذاریها | D317: 0 | E317: =VLOOKUP(RC[-3],'[screener-data-1401-11-24.xlsx]overview'!R8C2:R902C7,6,0) -> 66767768909292 | F317: 1.0251068090498365E-5 | G317: =VLOOKUP(RC[-5],'[screener-data-1401-11-24.xlsx]overview'!R8C2:R897C8,7,FALSE) -> 8.0772526789000008 | I317: =IF(RC[-1]="",((RC[-2]+RC[-3])/2)*0.65,RC[-1]) -> 2.6251104522396296 | J317: =RC[-1]*RC[-5]/R375C5 -> 3.8190061636995142E-2 | M317: 96.16725124011937 | N317: 1.2873767446253936
A318: سر. استان سیستان و بلوچستان | B318: وسیستا | C318: سرمایه گذاریها | D318: 0 | E318: =VLOOKUP(RC[-3],'[screener-data-1401-11-24.xlsx]overview'!R8C2:R902C7,6,0) -> 97621762750641 | F318: 1.6611787638353037E-3 | G318: =VLOOKUP(RC[-5],'[screener-data-1401-11-24.xlsx]overview'!R8C2:R897C8,7,FALSE) -> 354.4596446992 | I318: =IF(RC[-1]="",((RC[-2]+RC[-3])/2)*0.65,RC[-1]) -> 115.19992441033824 | J318: =RC[-1]*RC[-5]/R375C5 -> 2.4503874157462455 | M318: 52.226047085516065 | N318: 0.61654717188786645
A319: سر. استان فارس | B319: وسفارس | C319: سرمایه گذاریها | D319: 0 | E319: =VLOOKUP(RC[-3],'[screener-data-1401-11-24.xlsx]overview'!R8C2:R902C7,6,0) -> 271674729973830 | F319: 6.6448869207981088E-6 | G319: =VLOOKUP(RC[-5],'[screener-data-1401-11-24.xlsx]overview'!R8C2:R897C8,7,FALSE) -> 5.3186304371000004 | I319: =IF(RC[-1]="",((RC[-2]+RC[-3])/2)*0.65,RC[-1]) -> 1.7285570516457494 | J319: =RC[-1]*RC[-5]/R375C5 -> 0.10232196602371564 | M319: 357.4564025433869 | N319: 0.91930233106042858
A320: سر. استان قم | B320: وسقم | C320: سرمایه گذاریها | D320: 0 | E320: =VLOOKUP(RC[-3],'[screener-data-1401-11-24.xlsx]overview'!R8C2:R902C7,6,0) -> 69685564586760 | F320: 3.3172286696219556E-2 | G320: =VLOOKUP(RC[-5],'[screener-data-1401-11-24.xlsx]overview'!R8C2:R897C8,7,FALSE) -> 7.0410908871000002 | I320: =IF(RC[-1]="",((RC[-2]+RC[-3])/2)*0.65,RC[-1]) -> 2.2991355314837714 | J320: =RC[-1]*RC[-5]/R375C5 -> 3.4909474401083121E-2 | M320: 176.55815933051085 | N320: 1.2020104771136624
A321: سر. استان گلستان | B321: وسگلستا | C321: سرمایه گذاریها | D321: 0 | E321: =VLOOKUP(RC[-3],'[screener-data-1401-11-24.xlsx]overview'!R8C2:R902C7,6,0) -> 88719583734540 | F321: 1.9270833333333333 | G321: =VLOOKUP(RC[-5],'[screener-data-1401-11-24.xlsx]overview'!R8C2:R897C8,7,FALSE) -> 9.0332532915999995 | I321: =IF(RC[-1]="",((RC[-2]+RC[-3])/2)*0.65,RC[-1]) -> 3.5621094031033333 | J321: =RC[-1]*RC[-5]/R375C5 -> 6.8859309462732526E-2 | M321: 71.163938302805903 | N321: 0.68689351272285737
A322: سر. استان گیلان | B322: وسگیلا | C322: سرمایه گذاریها | D322: -0.23041474654377 | E322: =VLOOKUP(RC[-3],'[screener-data-1401-11-24.xlsx]overview'!R8C2:R902C7,6,0) -> 64738985916882 | F322: 3.9485430970256436E-4 | G322: =VLOOKUP(RC[-5],'[screener-data-1401-11-24.xlsx]overview'!R8C2:R897C8,7,FALSE) -> 270.25675750890002 | I322: =IF(RC[-1]="",((RC[-2]+RC[-3])/2)*0.65,RC[-1]) -> 87.833574518043164 | J322: =RC[-1]*RC[-5]/R375C5 -> 1.2389744871517538 | M322: 88.595311131081786 | N322: 0.4319110597595005
A323: سر. استان لرستان | B323: وسلرستا | C323: سرمایه گذاریها | D323: -1.6701461377870499 | E323: =VLOOKUP(RC[-3],'[screener-data-1401-11-24.xlsx]overview'!R8C2:R902C7,6,0) -> 43765175139240 | F323: 1.5309177120353536E-6 | G323: =VLOOKUP(RC[-5],'[screener-data-1401-11-24.xlsx]overview'!R8C2:R897C8,7,FALSE) -> 4.3962399639000003 | I323: =IF(RC[-1]="",((RC[-2]+RC[-3])/2)*0.65,RC[-1]) -> 1.4287784858157564 | J323: =RC[-1]*RC[-5]/R375C5 -> 1.3624779633643429E-2 | M323: 28.370365116355956 | N323: 0.42330996536252125
A324: سر. استان مازندران | B324: وسمازن | C324: سرمایه گذاریها | D324: 0 | E324: =VLOOKUP(RC[-3],'[screener-data-1401-11-24.xlsx]overview'!R8C2:R902C7,6,0) -> 182914473125630 | G324: =VLOOKUP(RC[-5],'[screener-data-1401-11-24.xlsx]overview'!R8C2:R897C8,7,FALSE) -> 0 | I324: =IF(RC[-1]="",((RC[-2]+RC[-3])/2)*0.65,RC[-1]) -> 0 | J324: =RC[-1]*RC[-5]/R375C5 -> 0 | N324: 0.9205153611540684
A325: سر. استان مرکزی | B325: وسمرکز | C325: سرمایه گذاریها | D325: 0 | E325: =VLOOKUP(RC[-3],'[screener-data-1401-11-24.xlsx]overview'!R8C2:R902C7,6,0) -> 109160160831400 | F325: 7.9308250777220852E-6 | G325: =VLOOKUP(RC[-5],'[screener-data-1401-11-24.xlsx]overview'!R8C2:R897C8,7,FALSE) -> 12.492695513499999 | I325: =IF(RC[-1]="",((RC[-2]+RC[-3])/2)*0.65,RC[-1]) -> 4.0601286194056501 | J325: =RC[-1]*RC[-5]/R375C5 -> 9.6569475455432222E-2 | M325: 123.45348074746019 | N325: 1.3066214645249261
A326: سر. استان هرمزگان | B326: وسهرمز | C326: سرمایه گذاریها | D326: -2.9940119760478998 | E326: =VLOOKUP(RC[-3],'[screener-data-1401-11-24.xlsx]overview'!R8C2:R902C7,6,0) -> 62277471303048 | F326: 1.3263943259798278E-6 | G326: =VLOOKUP(RC[-5],'[screener-data-1401-11-24.xlsx]overview'!R8C2:R897C8,7,FALSE) -> 0 | I326: =IF(RC[-1]="",((RC[-2]+RC[-3])/2)*0.65,RC[-1]) -> 4.3107815594344403E-7 | J326: =RC[-1]*RC[-5]/R375C5 -> 5.8495559670574843E-9 | M326: 21.231682169128739 | N326: 0.58596277984128642
A327: سر. استان همدان | B327: وسهمدا | C327: سرمایه گذاریها | D327: 0.39138943248531999 | E327: =VLOOKUP(RC[-3],'[screener-data-1401-11-24.xlsx]overview'!R8C2:R902C7,6,0) -> 58747924057779 | F327: 4.7768476530127661E-3 | G327: =VLOOKUP(RC[-5],'[screener-data-1401-11-24.xlsx]overview'!R8C2:R897C8,7,FALSE) -> 0 | I327: =IF(RC[-1]="",((RC[-2]+RC[-3])/2)*0.65,RC[-1]) -> 1.5524754872291489E-3 | J327: =RC[-1]*RC[-5]/R375C5 -> 1.9872531328456325E-5 | M327: 54.323844257512441 | N327: 0.53350290828388569
A328: سر. استان کردستان | B328: وسکرد | C328: سرمایه گذاریها | D328: -0.46189376443418001 | E328: =VLOOKUP(RC[-3],'[screener-data-1401-11-24.xlsx]overview'!R8C2:R902C7,6,0) -> 39314794870810 | F328: 6.1838305027841589E-4 | G328: =VLOOKUP(RC[-5],'[screener-data-1401-11-24.xlsx]overview'!R8C2:R897C8,7,FALSE) -> 1.851275435 | I328: =IF(RC[-1]="",((RC[-2]+RC[-3])/2)*0.65,RC[-1]) -> 0.60186549086634056 | J328: =RC[-1]*RC[-5]/R375C5 -> 5.1557443062807884E-3 | M328: 56.128872337023402 | N328: 0.332472250511193
A329: سر. استان کرمان | B329: وسکرمان | C329: سرمایه گذاریها | D329: 0.46620046620046002 | E329: =VLOOKUP(RC[-3],'[screener-data-1401-11-24.xlsx]overview'!R8C2:R902C7,6,0) -> 76045867840823 | F329: 1.2071138496008962E-6 | G329: =VLOOKUP(RC[-5],'[screener-data-1401-11-24.xlsx]overview'!R8C2:R897C8,7,FALSE) -> 5.5537421620999998 | I329: =IF(RC[-1]="",((RC[-2]+RC[-3])/2)*0.65,RC[-1]) -> 1.8049665949945011 | J329: =RC[-1]*RC[-5]/R375C5 -> 2.9907540743901073E-2 | M329: 41.752061237390251 | N329: 0.39861945666176923
A330: سر. استان کرمانشاه | B330: وسکرشا | C330: سرمایه گذاریها | D330: -0.68965517241379004 | E330: =VLOOKUP(RC[-3],'[screener-data-1401-11-24.xlsx]overview'!R8C2:R902C7,6,0) -> 37017505923408 | F330: 0.17940199335548174 | G330: =VLOOKUP(RC[-5],'[screener-data-1401-11-24.xlsx]overview'!R8C2:R897C8,7,FALSE) -> 2.5030914398999999 | I330: =IF(RC[-1]="",((RC[-2]+RC[-3])/2)*0.65,RC[-1]) -> 0.87181036580803162 | J330: =RC[-1]*RC[-5]/R375C5 -> 7.0317771211586321E-3 | M330: 23296.101870358718 | N330: 0.38919446690512305
A331: سر. استان کهگیلویه و بویراحمد | B331: وسکهبو | C331: سرمایه گذاریها | D331: 0 | E331: =VLOOKUP(RC[-3],'[screener-data-1401-11-24.xlsx]overview'!R8C2:R902C7,6,0) -> 44164785748090 | G331: =VLOOKUP(RC[-5],'[screener-data-1401-11-24.xlsx]overview'!R8C2:R897C8,7,FALSE) -> 2.7269309199 | I331: =IF(RC[-1]="",((RC[-2]+RC[-3])/2)*0.65,RC[-1]) -> 0.88625254896750005 | J331: =RC[-1]*RC[-5]/R375C5 -> 8.5284388351039853E-3 | N331: 0.77842676214915218
A332: سر. استان یزد | B332: وسیزد | C332: سرمایه گذاریها | D332: 0 | E332: =VLOOKUP(RC[-3],'[screener-data-1401-11-24.xlsx]overview'!R8C2:R902C7,6,0) -> 75820378056878 | F332: 1.2446316710889843E-5 | G332: =VLOOKUP(RC[-5],'[screener-data-1401-11-24.xlsx]overview'!R8C2:R897C8,7,FALSE) -> 3.4776054542999999 | I332: =IF(RC[-1]="",((RC[-2]+RC[-3])/2)*0.65,RC[-1]) -> 1.1302258177004312 | J332: =RC[-1]*RC[-5]/R375C5 -> 1.8671838533697215E-2 | M332: 148.18102416773181 | N332: 1.1739396323051097
A333: سر. اعتبار ایران | B333: واعتبار | C333: سرمایه گذاریها | D333: -0.59952038369303995 | E333: =VLOOKUP(RC[-3],'[screener-data-1401-11-24.xlsx]overview'!R8C2:R902C7,6,0) -> 4784400000000 | F333: 6.8324175824175821 | G333: =VLOOKUP(RC[-5],'[screener-data-1401-11-24.xlsx]overview'!R8C2:R897C8,7,FALSE) -> 8.0091766589999995 | I333: =IF(RC[-1]="",((RC[-2]+RC[-3])/2)*0.65,RC[-1]) -> 4.823518128460714 | J333: =RC[-1]*RC[-5]/R375C5 -> 5.028370972967976E-3 | K333: 1.2 | M333: 6.4891145053438146 | N333: 1.8327087292548065
A334: سر. اعتلاء البرز | B334: اعتلا | C334: سرمایه گذاریها | D334: 4.74958852574653 | E334: =VLOOKUP(RC[-3],'[screener-data-1401-11-24.xlsx]overview'!R8C2:R902C7,6,0) -> 10132100000000 | F334: 2.852112676056338 | G334: =VLOOKUP(RC[-5],'[screener-data-1401-11-24.xlsx]overview'!R8C2:R897C8,7,FALSE) -> 4.0046122002000004 | I334: =IF(RC[-1]="",((RC[-2]+RC[-3])/2)*0.65,RC[-1]) -> 2.2284355847833099 | J334: =RC[-1]*RC[-5]/R375C5 -> 4.9196642674554526E-3 | K334: 1 | M334: 4.9752700572937121 | N334: 2.4955315425710105
A335: سر. افتخار سهام | B335: وفتخار | C335: سرمایه گذاریها | D335: 2.2093344380005502 | E335: =VLOOKUP(RC[-3],'[screener-data-1401-11-24.xlsx]overview'!R8C2:R902C7,6,0) -> 7734000000000 | F335: -5.8191823899371071 | G335: =VLOOKUP(RC[-5],'[screener-data-1401-11-24.xlsx]overview'!R8C2:R897C8,7,FALSE) -> 23.197789759399999 | I335: =IF(RC[-1]="",((RC[-2]+RC[-3])/2)*0.65,RC[-1]) -> 5.64804739507544 | J335: =RC[-1]*RC[-5]/R375C5 -> 9.5178403118411723E-3 | K335: 5.6 | M335: -20.049894495624073 | N335: 4.8461437737331412
A336: سر. اقتصاد شهر طوبی | B336: وطوبی | C336: سرمایه گذاریها | D336: 0.82444228903976002 | E336: =VLOOKUP(RC[-3],'[screener-data-1401-11-24.xlsx]overview'!R8C2:R902C7,6,0) -> 5916000000000 | F336: 2.8715469613259668 | G336: =VLOOKUP(RC[-5],'[screener-data-1401-11-24.xlsx]overview'!R8C2:R897C8,7,FALSE) -> 7.3268671773999996 | I336: =IF(RC[-1]="",((RC[-2]+RC[-3])/2)*0.65,RC[-1]) -> 3.314484595085939 | J336: =RC[-1]*RC[-5]/R375C5 -> 4.2724804492665948E-3 | K336: 1.1000000000000001 | M336: 7.3912378812495776 | N336: 1.6110887958680493
A337: سر. اقتصاد نوین | B337: سنوین | C337: سرمایه گذاریها | D337: 0.30165912518853 | E337: =VLOOKUP(RC[-3],'[screener-data-1401-11-24.xlsx]overview'!R8C2:R902C7,6,0) -> 6760000000000 | F337: 5.9163701067615655 | G337: =VLOOKUP(RC[-5],'[screener-data-1401-11-24.xlsx]overview'!R8C2:R897C8,7,FALSE) -> 8.3530864287999993 | I337: =IF(RC[-1]="",((RC[-2]+RC[-3])/2)*0.65,RC[-1]) -> 4.6375733740575091 | J337: =RC[-1]*RC[-5]/R375C5 -> 6.8308288463826911E-3 | K337: 2.8 | M337: 5.5728187233300819 | N337: 2.6517593925118303
A338: سر. بهمن | B338: وبهمن | C338: سرمایه گذاریها | D338: 2.2712310730743899 | E338: =VLOOKUP(RC[-3],'[screener-data-1401-11-24.xlsx]overview'!R8C2:R902C7,6,0) -> 46564000000000 | F338: 1.2666123114553607 | G338: =VLOOKUP(RC[-5],'[screener-data-1401-11-24.xlsx]overview'!R8C2:R897C8,7,FALSE) -> 6.8734344686000002 | I338: =IF(RC[-1]="",((RC[-2]+RC[-3])/2)*0.65,RC[-1]) -> 2.6455152035179923 | J338: =RC[-1]*RC[-5]/R375C5 -> 2.6840861814313027E-2 | K338: 0.7 | M338: 6.4086263192432344 | N338: 2.2955751730415521
A339: سر. بوعلی | B339: وبوعلی | C339: سرمایه گذاریها | D339: 0.32976092333057999 | E339: =VLOOKUP(RC[-3],'[screener-data-1401-11-24.xlsx]overview'!R8C2:R902C7,6,0) -> 14616000000000 | F339: 1.8164179104477611 | G339: =VLOOKUP(RC[-5],'[screener-data-1401-11-24.xlsx]overview'!R8C2:R897C8,7,FALSE) -> 3.2268937654999998 | I339: =IF(RC[-1]="",((RC[-2]+RC[-3])/2)*0.65,RC[-1]) -> 1.6390762946830224 | J339: =RC[-1]*RC[-5]/R375C5 -> 5.2199172408891664E-3 | K339: 0.8 | M339: 3.5229325929160202 | N339: 1.3653620621566962
A340: سر. پارس آریان | B340: آریان | C340: سرمایه گذاریها | D340: -1.3829519738496301 | E340: =VLOOKUP(RC[-3],'[screener-data-1401-11-24.xlsx]overview'!R8C2:R902C7,6,0) -> 227976000000000 | F340: 2.948872180451128 | G340: =VLOOKUP(RC[-5],'[screener-data-1401-11-24.xlsx]overview'!R8C2:R897C8,7,FALSE) -> 8.9481358691999997 | I340: =IF(RC[-1]="",((RC[-2]+RC[-3])/2)*0.65,RC[-1]) -> 3.8665276161366164 | J340: =RC[-1]*RC[-5]/R375C5 -> 0.19206408415069418 | K340: 0.8 | M340: 8.045096598142873 | N340: 3.2581875765219563
A341: سر. پردیس | B341: پردیس | C341: سرمایه گذاریها | D341: 8.7489063867009997E-2 | E341: =VLOOKUP(RC[-3],'[screener-data-1401-11-24.xlsx]overview'!R8C2:R902C7,6,0) -> 9957000000000 | F341: 2.3346938775510204 | G341: =VLOOKUP(RC[-5],'[screener-data-1401-11-24.xlsx]overview'!R8C2:R897C8,7,FALSE) -> 3.7613723603999998 | I341: =IF(RC[-1]="",((RC[-2]+RC[-3])/2)*0.65,RC[-1]) -> 1.9812215273340816 | J341: =RC[-1]*RC[-5]/R375C5 -> 4.2983072789199595E-3 | K341: 1 | M341: 5.462526832487816 | N341: 1.5421877316988779
A342: سر. پویا | B342: وپویا | C342: سرمایه گذاریها | D342: -0.30342436064152001 | E342: =VLOOKUP(RC[-3],'[screener-data-1401-11-24.xlsx]overview'!R8C2:R902C7,6,0) -> 16072000000000 | F342: 2.1515434985968196 | G342: =VLOOKUP(RC[-5],'[screener-data-1401-11-24.xlsx]overview'!R8C2:R897C8,7,FALSE) -> 3.5352262237000001 | I342: =IF(RC[-1]="",((RC[-2]+RC[-3])/2)*0.65,RC[-1]) -> 1.8482001597464663 | J342: =RC[-1]*RC[-5]/R375C5 -> 6.4722433964904767E-3 | K342: 0.6 | M342: 3.7155298068570679 | N342: 0.73910732545337809
A343: سر. تدبیرگران فارس و خوزستان | B343: سدبیر | C343: سرمایه گذاریها | D343: -4.92505353319057 | E343: =VLOOKUP(RC[-3],'[screener-data-1401-11-24.xlsx]overview'!R8C2:R902C7,6,0) -> 5900000000000 | F343: 23.197492163009404 | G343: =VLOOKUP(RC[-5],'[screener-data-1401-11-24.xlsx]overview'!R8C2:R897C8,7,FALSE) -> 397.63594963840001 | I343: =IF(RC[-1]="",((RC[-2]+RC[-3])/2)*0.65,RC[-1]) -> 136.77086858545806 | J343: =RC[-1]*RC[-5]/R375C5 -> 0.1758253661628916 | K343: 2.8 | M343: 17.308376006536641 | N343: 3.7536242764128338
A344: سر. توسعه شمال | B344: وشمال | C344: سرمایه گذاریها | D344: -1.18483412322274 | E344: =VLOOKUP(RC[-3],'[screener-data-1401-11-24.xlsx]overview'!R8C2:R902C7,6,0) -> 2505045000000 | F344: -161.62790697674419 | G344: =VLOOKUP(RC[-5],'[screener-data-1401-11-24.xlsx]overview'!R8C2:R897C8,7,FALSE) -> 0 | I344: =IF(RC[-1]="",((RC[-2]+RC[-3])/2)*0.65,RC[-1]) -> -52.529069767441861 | J344: =RC[-1]*RC[-5]/R375C5 -> -2.8671548938933176E-2 | M344: 93.082402490386372 | N344: 2275.3939122649954
A345: سر. توسعه صنعت و تجارت | B345: وصنعت | C345: سرمایه گذاریها | D345: -0.21953896816683999 | E345: =VLOOKUP(RC[-3],'[screener-data-1401-11-24.xlsx]overview'!R8C2:R902C7,6,0) -> 32508000000000 | F345: 3.7407407407407409 | G345: =VLOOKUP(RC[-5],'[screener-data-1401-11-24.xlsx]overview'!R8C2:R897C8,7,FALSE) -> 4.4628043850000001 | I345: =IF(RC[-1]="",((RC[-2]+RC[-3])/2)*0.65,RC[-1]) -> 2.666152165865741 | J345: =RC[-1]*RC[-5]/R375C5 -> 1.888474379970833E-2 | K345: 0.84 | M345: 3.6029592622499402 | N345: 1.1858740096924654
A346: سر. توسعه صنعتی ایران | B346: وتوصا | C346: سرمایه گذاریها | D346: 0.70521861777149997 | E346: =VLOOKUP(RC[-3],'[screener-data-1401-11-24.xlsx]overview'!R8C2:R902C7,6,0) -> 28120000000000 | F346: 8.02247191011236 | G346: =VLOOKUP(RC[-5],'[screener-data-1401-11-24.xlsx]overview'!R8C2:R897C8,7,FALSE) -> 8.1274158715000002 | I346: =IF(RC[-1]="",((RC[-2]+RC[-3])/2)*0.65,RC[-1]) -> 5.248713529024017 | J346: =RC[-1]*RC[-5]/R375C5 -> 3.2159115848976155E-2 | K346: 1.5 | M346: 7.4934845254034634 | N346: 4.0972758710477102
A347: سر. توسعه گوهران امید | B347: گوهران | C347: سرمایه گذاریها | D347: 1.12886048988285 | E347: =VLOOKUP(RC[-3],'[screener-data-1401-11-24.xlsx]overview'!R8C2:R902C7,6,0) -> 31167500000000 | F347: 4.2392857142857139 | G347: =VLOOKUP(RC[-5],'[screener-data-1401-11-24.xlsx]overview'!R8C2:R897C8,7,FALSE) -> 5.0866636350999999 | I347: =IF(RC[-1]="",((RC[-2]+RC[-3])/2)*0.65,RC[-1]) -> 3.0309335385503569 | J347: =RC[-1]*RC[-5]/R375C5 -> 2.0583266422051601E-2 | K347: 0.96 | M347: 7.1517010143124393 | N347: 1.5432074450245288
A348: سر. توسعه ملی | B348: وتوسم | C348: سرمایه گذاریها | D348: 0.16303240269003 | E348: =VLOOKUP(RC[-3],'[screener-data-1401-11-24.xlsx]overview'!R8C2:R902C7,6,0) -> 39408000000000 | F348: 2.1642448260678115 | G348: =VLOOKUP(RC[-5],'[screener-data-1401-11-24.xlsx]overview'!R8C2:R897C8,7,FALSE) -> 3.9292081071 | I348: =IF(RC[-1]="",((RC[-2]+RC[-3])/2)*0.65,RC[-1]) -> 1.9803722032795388 | J348: =RC[-1]*RC[-5]/R375C5 -> 1.7004627792860452E-2 | K348: 0.75 | M348: 3.7913130912054744 | N348: 1.766364511418949
A349: سر. توسعه و تجارت هیرمند | B349: بهیر | C349: سرمایه گذاریها | D349: -0.5656108597285 | E349: =VLOOKUP(RC[-3],'[screener-data-1401-11-24.xlsx]overview'!R8C2:R902C7,6,0) -> 5208000000000 | F349: 25.852941176470587 | G349: =VLOOKUP(RC[-5],'[screener-data-1401-11-24.xlsx]overview'!R8C2:R897C8,7,FALSE) -> 51.969415420200001 | I349: =IF(RC[-1]="",((RC[-2]+RC[-3])/2)*0.65,RC[-1]) -> 25.292265893917943 | J349: =RC[-1]*RC[-5]/R375C5 -> 2.8700841367013438E-2 | K349: 4.5 | M349: 19.170722664272446 | N349: 5.5051962204750708
A350: سر. جامی | B350: وجامی | C350: سرمایه گذاریها | D350: 2.3439490445859801 | E350: =VLOOKUP(RC[-3],'[screener-data-1401-11-24.xlsx]overview'!R8C2:R902C7,6,0) -> 2609445000000 | F350: 11.252100840336135 | G350: =VLOOKUP(RC[-5],'[screener-data-1401-11-24.xlsx]overview'!R8C2:R897C8,7,FALSE) -> 20.514545806400001 | I350: =IF(RC[-1]="",((RC[-2]+RC[-3])/2)*0.65,RC[-1]) -> 10.324160160189244 | J350: =RC[-1]*RC[-5]/R375C5 -> 5.8700093718902302E-3 | K350: 3.5 | M350: 13.525252525252526 | N350: 2.8614927128549605
A351: سر. خراسان جنوبی | B351: وسخراج | C351: سرمایه گذاریها | D351: 0 | E351: =VLOOKUP(RC[-3],'[screener-data-1401-11-24.xlsx]overview'!R8C2:R902C7,6,0) -> 135629993938877 | F351: 1.7378265603464009E-5 | G351: =VLOOKUP(RC[-5],'[screener-data-1401-11-24.xlsx]overview'!R8C2:R897C8,7,FALSE) -> 11.075959297900001 | I351: =IF(RC[-1]="",((RC[-2]+RC[-3])/2)*0.65,RC[-1]) -> 3.5996924197538216 | J351: =RC[-1]*RC[-5]/R375C5 -> 0.10637928077506978 | M351: 212.80233431447616 | N351: 1.995437775205795
A352: سر. خوارزمی | B352: وخارزم | C352: سرمایه گذاریها | D352: -0.78682075239733995 | E352: =VLOOKUP(RC[-3],'[screener-data-1401-11-24.xlsx]overview'!R8C2:R902C7,6,0) -> 75174000000000 | F352: 4.1047812817904372 | G352: =VLOOKUP(RC[-5],'[screener-data-1401-11-24.xlsx]overview'!R8C2:R897C8,7,FALSE) -> 3.0920946648999998 | I352: =IF(RC[-1]="",((RC[-2]+RC[-3])/2)*0.65,RC[-1]) -> 2.3389846826743921 | J352: =RC[-1]*RC[-5]/R375C5 -> 3.8311658358652717E-2 | K352: 0.25 | M352: 3.793387963576397 | N352: 1.1712273199418732
A353: سر. دانایان پارس | B353: ودانا | C353: سرمایه گذاریها | D353: -2.8195488721804498 | E353: =VLOOKUP(RC[-3],'[screener-data-1401-11-24.xlsx]overview'!R8C2:R902C7,6,0) -> 6574500000000 | F353: 3.0058139534883721 | G353: =VLOOKUP(RC[-5],'[screener-data-1401-11-24.xlsx]overview'!R8C2:R897C8,7,FALSE) -> 2.9047165533000001 | I353: =IF(RC[-1]="",((RC[-2]+RC[-3])/2)*0.65,RC[-1]) -> 1.9209224147062212 | J353: =RC[-1]*RC[-5]/R375C5 -> 2.7517467855988553E-3 | K353: 1.2 | M353: 2.9686760967874752 | N353: 1.4510524730262662
A354: سر. سایپا | B354: وساپا | C354: سرمایه گذاریها | D354: -6.55737704918032 | E354: =VLOOKUP(RC[-3],'[screener-data-1401-11-24.xlsx]overview'!R8C2:R902C7,6,0) -> 77120000000000 | F354: 10.604651162790697 | G354: =VLOOKUP(RC[-5],'[screener-data-1401-11-24.xlsx]overview'!R8C2:R897C8,7,FALSE) -> 19.5989024183 | I354: =IF(RC[-1]="",((RC[-2]+RC[-3])/2)*0.65,RC[-1]) -> 9.8161549138544757 | J354: =RC[-1]*RC[-5]/R375C5 -> 0.16494696856501542 | K354: 0.75 | M354: 35.415808090589913 | N354: 2.9979443371806402
A355: سر. سپه | B355: وسپه | C355: سرمایه گذاریها | D355: 1.0940032414910801 | E355: =VLOOKUP(RC[-3],'[screener-data-1401-11-24.xlsx]overview'!R8C2:R902C7,6,0) -> 98046000000000 | F355: 3.8179035960214232 | G355: =VLOOKUP(RC[-5],'[screener-data-1401-11-24.xlsx]overview'!R8C2:R897C8,7,FALSE) -> 5.7500269787000002 | I355: =IF(RC[-1]="",((RC[-2]+RC[-3])/2)*0.65,RC[-1]) -> 3.1095774367844626 | J355: =RC[-1]*RC[-5]/R375C5 -> 6.6430446371949725E-2 | K355: 0.66 | M355: 7.3522374436584101 | N355: 1.3372142918730132
A356: سر. صبا تامین | B356: صبا | C356: سرمایه گذاریها | D356: -0.30487804878048003 | E356: =VLOOKUP(RC[-3],'[screener-data-1401-11-24.xlsx]overview'!R8C2:R902C7,6,0) -> 269775000000000 | F356: 2.50836820083682 | G356: =VLOOKUP(RC[-5],'[screener-data-1401-11-24.xlsx]overview'!R8C2:R897C8,7,FALSE) -> 5.7644282159999998 | I356: =IF(RC[-1]="",((RC[-2]+RC[-3])/2)*0.65,RC[-1]) -> 2.688658835471966 | J356: =RC[-1]*RC[-5]/R375C5 -> 0.15804228971021533 | K356: 0.6 | M356: 3.8314930449613405 | N356: 2.6295952560902656
A357: سر. صنایع ایران | B357: وایرا | C357: سرمایه گذاریها | D357: 0.15608740894900999 | E357: =VLOOKUP(RC[-3],'[screener-data-1401-11-24.xlsx]overview'!R8C2:R902C7,6,0) -> 4224000000000 | F357: 16.452991452991451 | G357: =VLOOKUP(RC[-5],'[screener-data-1401-11-24.xlsx]overview'!R8C2:R897C8,7,FALSE) -> 17.1256777796 | I357: =IF(RC[-1]="",((RC[-2]+RC[-3])/2)*0.65,RC[-1]) -> 10.913067500592222 | J357: =RC[-1]*RC[-5]/R375C5 -> 1.0043999094084953E-2 | K357: 0.88 | M357: 12.380144995322732 | N357: 1.610042100605011
A358: سر. صنعت بیمه | B358: وبیمه | C358: سرمایه گذاریها | D358: -4.3478260869565197 | E358: =VLOOKUP(RC[-3],'[screener-data-1401-11-24.xlsx]overview'!R8C2:R902C7,6,0) -> 23136000000000 | F358: 7.126760563380282 | G358: =VLOOKUP(RC[-5],'[screener-data-1401-11-24.xlsx]overview'!R8C2:R897C8,7,FALSE) -> 23.146520941399999 | I358: =IF(RC[-1]="",((RC[-2]+RC[-3])/2)*0.65,RC[-1]) -> 9.8388164890535901 | J358: =RC[-1]*RC[-5]/R375C5 -> 4.9598329540816902E-2 | K358: 2 | M358: 21.20394920061775 | N358: 1.0391278883031987
A359: سر. صنعت پتروشیمی ساختمان خلیج فارس | B359: وپسا | C359: سرمایه گذاریها | D359: 0.50314465408804998 | E359: =VLOOKUP(RC[-3],'[screener-data-1401-11-24.xlsx]overview'!R8C2:R902C7,6,0) -> 3980000000000 | F359: 72.63636363636364 | G359: =VLOOKUP(RC[-5],'[screener-data-1401-11-24.xlsx]overview'!R8C2:R897C8,7,FALSE) -> 52.262673940200003 | I359: =IF(RC[-1]="",((RC[-2]+RC[-3])/2)*0.65,RC[-1]) -> 40.592187212383188 | J359: =RC[-1]*RC[-5]/R375C5 -> 3.5201521793551328E-2 | K359: 1.5 | M359: 77.290667079399469 | N359: 1.5539722369926301
A360: سر. فلات ایرانیان | B360: فلات | C360: سرمایه گذاریها | D360: -0.75471698113206998 | E360: =VLOOKUP(RC[-3],'[screener-data-1401-11-24.xlsx]overview'!R8C2:R902C7,6,0) -> 10398715500000 | F360: 571.73913043478262 | G360: =VLOOKUP(RC[-5],'[screener-data-1401-11-24.xlsx]overview'!R8C2:R897C8,7,FALSE) -> 23.3618026127 | I360: =IF(RC[-1]="",((RC[-2]+RC[-3])/2)*0.65,RC[-1]) -> 193.40780324043186 | J360: =RC[-1]*RC[-5]/R375C5 -> 0.43821738455842896 | M360: 308.89413449939684 | N360: 9.2994027931992154
A361: سر. گروه بهشهر | B361: وصنا | C361: سرمایه گذاریها | D361: 0.42301184433164002 | E361: =VLOOKUP(RC[-3],'[screener-data-1401-11-24.xlsx]overview'!R8C2:R902C7,6,0) -> 12305000000000 | F361: 2.3716283716283715 | G361: =VLOOKUP(RC[-5],'[screener-data-1401-11-24.xlsx]overview'!R8C2:R897C8,7,FALSE) -> 30.433400963099999 | I361: =IF(RC[-1]="",((RC[-2]+RC[-3])/2)*0.65,RC[-1]) -> 10.661634533786719 | J361: =RC[-1]*RC[-5]/R375C5 -> 2.858520580511769E-2 | K361: 0.68 | M361: 2.2440654677269545 | N361: 1.2792860312203991
A362: سر. لقمان | B362: ولقمان | C362: سرمایه گذاریها | D362: -0.13294925769997001 | E362: =VLOOKUP(RC[-3],'[screener-data-1401-11-24.xlsx]overview'!R8C2:R902C7,6,0) -> 4139927400000 | F362: -26.511764705882353 | G362: =VLOOKUP(RC[-5],'[screener-data-1401-11-24.xlsx]overview'!R8C2:R897C8,7,FALSE) -> 0 | I362: =IF(RC[-1]="",((RC[-2]+RC[-3])/2)*0.65,RC[-1]) -> -8.6163235294117655 | J362: =RC[-1]*RC[-5]/R375C5 -> -7.7723193516010137E-3 | K362: 2 | M362: -58.807295976472965 | N362: 3.0559926673299134
A363: سر. مالی سپهر صادرات | B363: وسپهر | C363: سرمایه گذاریها | D363: -0.36764705882352 | E363: =VLOOKUP(RC[-3],'[screener-data-1401-11-24.xlsx]overview'!R8C2:R902C7,6,0) -> 243900000000000 | F363: 7.4382433668801466 | G363: =VLOOKUP(RC[-5],'[screener-data-1401-11-24.xlsx]overview'!R8C2:R897C8,7,FALSE) -> 9.8330708572999992 | I363: =IF(RC[-1]="",((RC[-2]+RC[-3])/2)*0.65,RC[-1]) -> 5.6131771228585476 | J363: =RC[-1]*RC[-5]/R375C5 -> 0.29830220302453242 | K363: 0.4 | M363: 7.3915187792156676 | N363: 7.2489138517559963
A364: سر. معیار صنعت پارس | B364: معیار | C364: سرمایه گذاریها | D364: 0 | E364: =VLOOKUP(RC[-3],'[screener-data-1401-11-24.xlsx]overview'!R8C2:R902C7,6,0) -> 2982000000000 | F364: 4.7947851279575087 | G364: =VLOOKUP(RC[-5],'[screener-data-1401-11-24.xlsx]overview'!R8C2:R897C8,7,FALSE) -> 28.387837487500001 | I364: =IF(RC[-1]="",((RC[-2]+RC[-3])/2)*0.65,RC[-1]) -> 10.784352350023692 | J364: =RC[-1]*RC[-5]/R375C5 -> 7.0070888089947495E-3 | M364: 20.679888652093325 | N364: 3.1831208047237127
A365: سر. ملت | B365: وملت | C365: سرمایه گذاریها | D365: 0.13181019332161001 | E365: =VLOOKUP(RC[-3],'[screener-data-1401-11-24.xlsx]overview'!R8C2:R902C7,6,0) -> 2282000000000 | F365: 28.487500000000001 | G365: =VLOOKUP(RC[-5],'[screener-data-1401-11-24.xlsx]overview'!R8C2:R897C8,7,FALSE) -> 0 | I365: =IF(RC[-1]="",((RC[-2]+RC[-3])/2)*0.65,RC[-1]) -> 9.2584375000000012 | J365: =RC[-1]*RC[-5]/R375C5 -> 4.6035117198839686E-3 | K365: 2.5 | M365: 12.827223657475418 | N365: 2.3845447183223856
A366: سر. ملی | B366: ونیکی | C366: سرمایه گذاریها | D366: -0.15822784810126 | E366: =VLOOKUP(RC[-3],'[screener-data-1401-11-24.xlsx]overview'!R8C2:R902C7,6,0) -> 220500000000000 | F366: 3.9437500000000001 | G366: =VLOOKUP(RC[-5],'[screener-data-1401-11-24.xlsx]overview'!R8C2:R897C8,7,FALSE) -> 6.7164645561 | I366: =IF(RC[-1]="",((RC[-2]+RC[-3])/2)*0.65,RC[-1]) -> 3.4645697307324999 | J366: =RC[-1]*RC[-5]/R375C5 -> 0.16645383841613307 | K366: 0.6 | M366: 7.8460462552581562 | N366: 1.4123184609623283
A367: سر. هامون صبا | B367: وهامون | C367: سرمایه گذاریها | D367: -0.93366093366092995 | E367: =VLOOKUP(RC[-3],'[screener-data-1401-11-24.xlsx]overview'!R8C2:R902C7,6,0) -> 9970000000000 | F367: 2.0200400801603204 | G367: =VLOOKUP(RC[-5],'[screener-data-1401-11-24.xlsx]overview'!R8C2:R897C8,7,FALSE) -> 3.7533899755000002 | I367: =IF(RC[-1]="",((RC[-2]+RC[-3])/2)*0.65,RC[-1]) -> 1.8763647680896041 | J367: =RC[-1]*RC[-5]/R375C5 -> 4.0761329605697016E-3 | K367: 0.81 | M367: 3.3061602818632836 | N367: 1.2447190509807533
A368: سر. و خدمات مدیریت ص. بازنشستگی کشوری | B368: مدیریت | C368: سرمایه گذاریها | D368: -1.76 | E368: =VLOOKUP(RC[-3],'[screener-data-1401-11-24.xlsx]overview'!R8C2:R902C7,6,0) -> 9153000000000 | F368: 3.4533183352080989 | G368: =VLOOKUP(RC[-5],'[screener-data-1401-11-24.xlsx]overview'!R8C2:R897C8,7,FALSE) -> 3.4182934170000001 | I368: =IF(RC[-1]="",((RC[-2]+RC[-3])/2)*0.65,RC[-1]) -> 2.2332738194676325 | J368: =RC[-1]*RC[-5]/R375C5 -> 4.45390911789757E-3 | M368: 3.3444876778688242 | N368: 0.9692669752745362
A369: سر. کارکنان صنعت برق زنجان و قزوین | B369: وبرق | C369: سرمایه گذاریها | D369: -1.6617790811339099 | E369: =VLOOKUP(RC[-3],'[screener-data-1401-11-24.xlsx]overview'!R8C2:R902C7,6,0) -> 16672950000000 | F369: 112.78026905829596 | G369: =VLOOKUP(RC[-5],'[screener-data-1401-11-24.xlsx]overview'!R8C2:R897C8,7,FALSE) -> 69.800180545100005 | I369: =IF(RC[-1]="",((RC[-2]+RC[-3])/2)*0.65,RC[-1]) -> 59.338646121103686 | J369: =RC[-1]*RC[-5]/R375C5 -> 0.21556884501296064 | M369: 102.3813037062755 | N369: 24.875468180591174
A370: سر. کوثر بهمن | B370: وکبهمن | C370: سرمایه گذاریها | D370: -0.74992789154887995 | E370: =VLOOKUP(RC[-3],'[screener-data-1401-11-24.xlsx]overview'!R8C2:R902C7,6,0) -> 33840000000000 | F370: 2.1861499364675985 | G370: =VLOOKUP(RC[-5],'[screener-data-1401-11-24.xlsx]overview'!R8C2:R897C8,7,FALSE) -> 8.8201481888999993 | I370: =IF(RC[-1]="",((RC[-2]+RC[-3])/2)*0.65,RC[-1]) -> 3.5770468907444695 | J370: =RC[-1]*RC[-5]/R375C5 -> 2.6374904848093121E-2 | K370: 0.63 | M370: 4.3176267582942103 | N370: 1.0730546588659138
A371: صنعت و تجارت آداک | B371: وآداک | C371: سرمایه گذاریها | D371: 1.84623617552622 | E371: =VLOOKUP(RC[-3],'[screener-data-1401-11-24.xlsx]overview'!R8C2:R902C7,6,0) -> 9795330000000 | F371: -100.16666666666667 | G371: =VLOOKUP(RC[-5],'[screener-data-1401-11-24.xlsx]overview'!R8C2:R897C8,7,FALSE) -> 18.1022376536 | I371: =IF(RC[-1]="",((RC[-2]+RC[-3])/2)*0.65,RC[-1]) -> -26.670939429246669 | J371: =RC[-1]*RC[-5]/R375C5 -> -5.6923723274915246E-2 | K371: 2 | M371: 22.767655794510752 | N371: 2.2850081652367917
A372: گ مدیریت ارزش سرمایه ص ب کشوری | B372: ومدیر | C372: سرمایه گذاریها | D372: 0.59171597633135997 | E372: =VLOOKUP(RC[-3],'[screener-data-1401-11-24.xlsx]overview'!R8C2:R902C7,6,0) -> 36234000000000 | F372: 2.0976863753213366 | G372: =VLOOKUP(RC[-5],'[screener-data-1401-11-24.xlsx]overview'!R8C2:R897C8,7,FALSE) -> 3.0563706874999998 | I372: =IF(RC[-1]="",((RC[-2]+RC[-3])/2)*0.65,RC[-1]) -> 1.6750685454169345 | J372: =RC[-1]*RC[-5]/R375C5 -> 1.3224667979079178E-2 | K372: 0.6 | M372: 2.0756268667287583 | N372: 1.2902807319869414
A373: گروه توسعه مالی مهر آیندگان | B373: ومهان | C373: سرمایه گذاریها | D373: 0.19230769230768999 | E373: =VLOOKUP(RC[-3],'[screener-data-1401-11-24.xlsx]overview'!R8C2:R902C7,6,0) -> 156300000000000 | F373: 5.427083333333333 | G373: =VLOOKUP(RC[-5],'[screener-data-1401-11-24.xlsx]overview'!R8C2:R897C8,7,FALSE) -> 4.3818585582000003 | I373: =IF(RC[-1]="",((RC[-2]+RC[-3])/2)*0.65,RC[-1]) -> 3.1879061147483334 | J373: =RC[-1]*RC[-5]/R375C5 -> 0.10856764431147453 | K373: 0.6 | M373: 4.8109062968730552 | N373: 2.1577140423684753
A374: گسترش سرمایه گذاری ایرانیان | B374: وگستر | C374: سرمایه گذاریها | D374: -2.4181138711804699 | E374: =VLOOKUP(RC[-3],'[screener-data-1401-11-24.xlsx]overview'!R8C2:R902C7,6,0) -> 3441600000000 | F374: -1.3113737075332348 | G374: =VLOOKUP(RC[-5],'[screener-data-1401-11-24.xlsx]overview'!R8C2:R897C8,7,FALSE) -> 38.436459727500001 | I374: =IF(RC[-1]="",((RC[-2]+RC[-3])/2)*0.65,RC[-1]) -> 12.065652956489199 | J374: =RC[-1]*RC[-5]/R375C5 -> 9.0478863439764651E-3 | K374: 1.8 | M374: -3.5282171932034725 | N374: 1.0151053809274986
E375: =SUM(R[-74]C:R[-1]C) -> 4589486387911820 | I375: =IF(RC[-1]="",((RC[-2]+RC[-3])/2)*0.65,RC[-1]) -> 0 | J375: =SUM(R[-74]C:R[-1]C) -> 11.524146113687122
A376: توسعه سرمایه و صنعت غدیر | B376: سغدیر | C376: سیمان آهک گچ | D376: -0.32310177705977 | E376: =VLOOKUP(RC[-3],'[screener-data-1401-11-24.xlsx]overview'!R8C2:R902C7,6,0) -> 39780000000000 | F376: 3.5809634358676727 | G376: =VLOOKUP(RC[-5],'[screener-data-1401-11-24.xlsx]overview'!R8C2:R897C8,7,FALSE) -> 6.9063991217999998 | I376: =IF(RC[-1]="",((RC[-2]+RC[-3])/2)*0.65,RC[-1]) -> 3.408392831241994 | J376: =RC[-1]*RC[-5]/R419C5 -> 0.10876740194907768 | K376: 0.68 | M376: 6.7928005291287583 | N376: 1.2706765031415423
A377: ساروج بوشهر | B377: ساروج | C377: سیمان آهک گچ | D377: 3.2906764168190099 | E377: =VLOOKUP(RC[-3],'[screener-data-1401-11-24.xlsx]overview'!R8C2:R902C7,6,0) -> 38190000000000 | F377: 11.414141414141413 | G377: =VLOOKUP(RC[-5],'[screener-data-1401-11-24.xlsx]overview'!R8C2:R897C8,7,FALSE) -> 8.3507261558000003 | I377: =IF(RC[-1]="",((RC[-2]+RC[-3])/2)*0.65,RC[-1]) -> 6.4235819602309601 | J377: =RC[-1]*RC[-5]/R419C5 -> 0.19679373170867634 | M377: 4.5984794345139726 | N377: 4.3298173607432711
A378: سر. سیمان تامین | B378: سیتا | C378: سیمان آهک گچ | D378: -9.8814229249009997E-2 | E378: =VLOOKUP(RC[-3],'[screener-data-1401-11-24.xlsx]overview'!R8C2:R902C7,6,0) -> 112420000000000 | F378: 7.4011713030746709 | G378: =VLOOKUP(RC[-5],'[screener-data-1401-11-24.xlsx]overview'!R8C2:R897C8,7,FALSE) -> 6.7983633044999996 | I378: =IF(RC[-1]="",((RC[-2]+RC[-3])/2)*0.65,RC[-1]) -> 4.6148487474617674 | J378: =RC[-1]*RC[-5]/R419C5 -> 0.41618400527278204 | K378: 0.82 | M378: 7.2982770592924471 | N378: 5.7037707355992229
A379: سرمایه گذاری توسعه صنایع سیمان | B379: سیدکو | C379: سیمان آهک گچ | D379: 1.5118790496760199 | E379: =VLOOKUP(RC[-3],'[screener-data-1401-11-24.xlsx]overview'!R8C2:R902C7,6,0) -> 56340000000000 | F379: 8.0479452054794525 | G379: =VLOOKUP(RC[-5],'[screener-data-1401-11-24.xlsx]overview'!R8C2:R897C8,7,FALSE) -> 8.6157681293999993 | I379: =IF(RC[-1]="",((RC[-2]+RC[-3])/2)*0.65,RC[-1]) -> 5.4157068338358227 | J379: =RC[-1]*RC[-5]/R419C5 -> 0.24476894866482304 | K379: 0.75 | M379: 7.8565560034535418 | N379: 4.5400904476174988
A380: سیمان آبیک | B380: سآبیک | C380: سیمان آهک گچ | D380: 7.4128984432909995E-2 | E380: =VLOOKUP(RC[-3],'[screener-data-1401-11-24.xlsx]overview'!R8C2:R902C7,6,0) -> 39920971623160 | F380: 8.1423401688781656 | G380: =VLOOKUP(RC[-5],'[screener-data-1401-11-24.xlsx]overview'!R8C2:R897C8,7,FALSE) -> 5.9486618580000004 | I380: =IF(RC[-1]="",((RC[-2]+RC[-3])/2)*0.65,RC[-1]) -> 4.5795756587354042 | J380: =RC[-1]*RC[-5]/R419C5 -> 0.14665966013022175 | M380: 3.2862892107588055 | N380: 4.2995657876483557
A381: سیمان آرتا اردبیل | B381: ساربیل | C381: سیمان آهک گچ | D381: -0.87408457358847003 | E381: =VLOOKUP(RC[-3],'[screener-data-1401-11-24.xlsx]overview'!R8C2:R902C7,6,0) -> 17740800000000 | F381: 13.380102040816327 | G381: =VLOOKUP(RC[-5],'[screener-data-1401-11-24.xlsx]overview'!R8C2:R897C8,7,FALSE) -> 6.7391843178000004 | I381: =IF(RC[-1]="",((RC[-2]+RC[-3])/2)*0.65,RC[-1]) -> 6.5387680665503067 | J381: =RC[-1]*RC[-5]/R419C5 -> 9.3057946740271319E-2 | M381: 5.3760280844937114 | N381: 4.8929045498803792
A382: سیمان اردستان | B382: اردستان | C382: سیمان آهک گچ | D382: 4.2367962855484604 | E382: =VLOOKUP(RC[-3],'[screener-data-1401-11-24.xlsx]overview'!R8C2:R902C7,6,0) -> 20191650000000 | F382: 11.54983922829582 | G382: =VLOOKUP(RC[-5],'[screener-data-1401-11-24.xlsx]overview'!R8C2:R897C8,7,FALSE) -> 5.9665243813000002 | I382: =IF(RC[-1]="",((RC[-2]+RC[-3])/2)*0.65,RC[-1]) -> 5.692818173118642 | J382: =RC[-1]*RC[-5]/R419C5 -> 9.2211153628052933E-2 | M382: 5.0039841185131655 | N382: 4.8381588100720174
A383: سیمان ارومیه | B383: ساروم | C383: سیمان آهک گچ | D383: -0.30895983522142001 | E383: =VLOOKUP(RC[-3],'[screener-data-1401-11-24.xlsx]overview'!R8C2:R902C7,6,0) -> 29090000000000 | F383: 4.5177349097697572 | G383: =VLOOKUP(RC[-5],'[screener-data-1401-11-24.xlsx]overview'!R8C2:R897C8,7,FALSE) -> 6.2781247792999997 | I383: =IF(RC[-1]="",((RC[-2]+RC[-3])/2)*0.65,RC[-1]) -> 3.5086543989476713 | J383: =RC[-1]*RC[-5]/R419C5 -> 8.1878267889751624E-2 | M383: 3.868734272442822 | N383: 5.3058026003913943
A384: سیمان اصفهان | B384: سصفها | C384: سیمان آهک گچ | D384: 4.8117774923426504 | E384: =VLOOKUP(RC[-3],'[screener-data-1401-11-24.xlsx]overview'!R8C2:R902C7,6,0) -> 55480000000000 | F384: 42.262948207171313 | G384: =VLOOKUP(RC[-5],'[screener-data-1401-11-24.xlsx]overview'!R8C2:R897C8,7,FALSE) -> 33.179540097900002 | I384: =IF(RC[-1]="",((RC[-2]+RC[-3])/2)*0.65,RC[-1]) -> 24.518808699148181 | J384: =RC[-1]*RC[-5]/R419C5 -> 1.0912396825785959 | M384: 13.450451670427418 | N384: 22.797685158122405
A385: سیمان ایلام | B385: سیلام | C385: سیمان آهک گچ | D385: 3.0277544154751799 | E385: =VLOOKUP(RC[-3],'[screener-data-1401-11-24.xlsx]overview'!R8C2:R902C7,6,0) -> 14352000000000 | F385: 45.708955223880594 | G385: =VLOOKUP(RC[-5],'[screener-data-1401-11-24.xlsx]overview'!R8C2:R897C8,7,FALSE) -> 9.3376430146999994 | I385: =IF(RC[-1]="",((RC[-2]+RC[-3])/2)*0.65,RC[-1]) -> 17.890144427538694 | J385: =RC[-1]*RC[-5]/R419C5 -> 0.20597314739647687 | M385: 4.1532240178402162 | N385: 6.7621245583343645
A386: سیمان باقران | B386: سباقر | C386: سیمان آهک گچ | D386: -0.52750565184625997 | E386: =VLOOKUP(RC[-3],'[screener-data-1401-11-24.xlsx]overview'!R8C2:R902C7,6,0) -> 7848000000000 | F386: 8.6842105263157894 | G386: =VLOOKUP(RC[-5],'[screener-data-1401-11-24.xlsx]overview'!R8C2:R897C8,7,FALSE) -> 9.9890257411000007 | I386: =IF(RC[-1]="",((RC[-2]+RC[-3])/2)*0.65,RC[-1]) -> 6.0688017869101314 | J386: =RC[-1]*RC[-5]/R419C5 -> 3.8207294031344749E-2 | M386: 2.6460046665900485 | N386: 4.009115676148495
A387: سیمان بجنورد | B387: سبجنو | C387: سیمان آهک گچ | D387: -2.6232948583419999E-2 | E387: =VLOOKUP(RC[-3],'[screener-data-1401-11-24.xlsx]overview'!R8C2:R902C7,6,0) -> 14876400000000 | F387: 6.7451327433628316 | G387: =VLOOKUP(RC[-5],'[screener-data-1401-11-24.xlsx]overview'!R8C2:R897C8,7,FALSE) -> 6.5442979026000003 | I387: =IF(RC[-1]="",((RC[-2]+RC[-3])/2)*0.65,RC[-1]) -> 4.3190649599379203 | J387: =RC[-1]*RC[-5]/R419C5 -> 5.154326391260064E-2 | M387: 2.508627483313874 | N387: 5.8049567303190077
A388: سیمان بهبهان | B388: سبهان | C388: سیمان آهک گچ | D388: 0.99673202614378997 | E388: =VLOOKUP(RC[-3],'[screener-data-1401-11-24.xlsx]overview'!R8C2:R902C7,6,0) -> 11808000000000 | F388: 10.887792848335389 | G388: =VLOOKUP(RC[-5],'[screener-data-1401-11-24.xlsx]overview'!R8C2:R897C8,7,FALSE) -> 9.6435228557000006 | I388: =IF(RC[-1]="",((RC[-2]+RC[-3])/2)*0.65,RC[-1]) -> 6.6726776038115014 | J388: =RC[-1]*RC[-5]/R419C5 -> 6.3206365690942012E-2 | M388: 2.763641371367048 | N388: 8.6202027372386212
A389: سیمان تهران | B389: ستران | C389: سیمان آهک گچ | D389: 0.45545118132649998 | E389: =VLOOKUP(RC[-3],'[screener-data-1401-11-24.xlsx]overview'!R8C2:R902C7,6,0) -> 61337500000000 | F389: 12.240721470690254 | G389: =VLOOKUP(RC[-5],'[screener-data-1401-11-24.xlsx]overview'!R8C2:R897C8,7,FALSE) -> 7.0164661135999999 | H389: 4.3 | I389: =IF(RC[-1]="",((RC[-2]+RC[-3])/2)*0.65,RC[-1]) -> 4.3 | J389: =RC[-1]*RC[-5]/R419C5 -> 0.2115820689479849 | M389: 4.3246095369343331 | N389: 5.5846792735173931
A390: سیمان خاش | B390: سخاش | C390: سیمان آهک گچ | D390: -0.28814073400059997 | E390: =VLOOKUP(RC[-3],'[screener-data-1401-11-24.xlsx]overview'!R8C2:R902C7,6,0) -> 13004000000000 | F390: 5.1347130027333074 | G390: =VLOOKUP(RC[-5],'[screener-data-1401-11-24.xlsx]overview'!R8C2:R897C8,7,FALSE) -> 6.0655699342 | I390: =IF(RC[-1]="",((RC[-2]+RC[-3])/2)*0.65,RC[-1]) -> 3.6400919545033252 | J390: =RC[-1]*RC[-5]/R419C5 -> 3.7972889767836318E-2 | M390: 3.202160033487532 | N390: 6.7342998632655462
A391: سیمان خزر | B391: سخزر | C391: سیمان آهک گچ | D391: -3.512469265893E-2 | E391: =VLOOKUP(RC[-3],'[screener-data-1401-11-24.xlsx]overview'!R8C2:R902C7,6,0) -> 14185000000000 | F391: 11.630568042501022 | G391: =VLOOKUP(RC[-5],'[screener-data-1401-11-24.xlsx]overview'!R8C2:R897C8,7,FALSE) -> 8.4580805763000004 | I391: =IF(RC[-1]="",((RC[-2]+RC[-3])/2)*0.65,RC[-1]) -> 6.5288108011103327 | J391: =RC[-1]*RC[-5]/R419C5 -> 7.4292976161902502E-2 | M391: 2.7189427191567188 | N391: 7.5405549912062186
A392: سیمان خوزستان | B392: سخوز | C392: سیمان آهک گچ | D392: 9.3516209476300002E-2 | E392: =VLOOKUP(RC[-3],'[screener-data-1401-11-24.xlsx]overview'!R8C2:R902C7,6,0) -> 44898000000000 | F392: 8.59475374732334 | G392: =VLOOKUP(RC[-5],'[screener-data-1401-11-24.xlsx]overview'!R8C2:R897C8,7,FALSE) -> 6.4642935767000003 | H392: 4.5 | I392: =IF(RC[-1]="",((RC[-2]+RC[-3])/2)*0.65,RC[-1]) -> 4.5 | J392: =RC[-1]*RC[-5]/R419C5 -> 0.16207791543099725 | M392: 3.5054265334603545 | N392: 5.691247121713233
A393: سیمان داراب | B393: ساراب | C393: سیمان آهک گچ | D393: 0.61755624172915002 | E393: =VLOOKUP(RC[-3],'[screener-data-1401-11-24.xlsx]overview'!R8C2:R902C7,6,0) -> 29169000000000 | F393: 9.9868651488616464 | G393: =VLOOKUP(RC[-5],'[screener-data-1401-11-24.xlsx]overview'!R8C2:R897C8,7,FALSE) -> 7.2904064266999997 | I393: =IF(RC[-1]="",((RC[-2]+RC[-3])/2)*0.65,RC[-1]) -> 5.6151132620575348 | J393: =RC[-1]*RC[-5]/R419C5 -> 0.13139062976986482 | M393: 6.7716382192329831 | N393: 4.4320317249125871
A394: سیمان دشتستان | B394: سدشت | C394: سیمان آهک گچ | D394: -0.17618040873853999 | E394: =VLOOKUP(RC[-3],'[screener-data-1401-11-24.xlsx]overview'!R8C2:R902C7,6,0) -> 34550400000000 | F394: 12.983501374885426 | G394: =VLOOKUP(RC[-5],'[screener-data-1401-11-24.xlsx]overview'!R8C2:R897C8,7,FALSE) -> 13.088504760699999 | I394: =IF(RC[-1]="",((RC[-2]+RC[-3])/2)*0.65,RC[-1]) -> 8.473401994065263 | J394: =RC[-1]*RC[-5]/R419C5 -> 0.23485251931272838 | M394: 6.8603172876736789 | N394: 13.867495219092104
A395: سیمان دورود | B395: سدور | C395: سیمان آهک گچ | D395: 0.13089005235602 | E395: =VLOOKUP(RC[-3],'[screener-data-1401-11-24.xlsx]overview'!R8C2:R902C7,6,0) -> 4934652275450 | F395: 19.029850746268657 | G395: =VLOOKUP(RC[-5],'[screener-data-1401-11-24.xlsx]overview'!R8C2:R897C8,7,FALSE) -> 34.694821282500001 | I395: =IF(RC[-1]="",((RC[-2]+RC[-3])/2)*0.65,RC[-1]) -> 17.460518409349813 | J395: =RC[-1]*RC[-5]/R419C5 -> 6.9119091644045907E-2 | M395: 1.2175009141206499 | N395: 5.7035055155943564
A396: سیمان ساوه | B396: ساوه | C396: سیمان آهک گچ | D396: 0.93399750933996994 | E396: =VLOOKUP(RC[-3],'[screener-data-1401-11-24.xlsx]overview'!R8C2:R902C7,6,0) -> 53105000000000 | F396: 10.316955193482688 | G396: =VLOOKUP(RC[-5],'[screener-data-1401-11-24.xlsx]overview'!R8C2:R897C8,7,FALSE) -> 6.4728918314000001 | I396: =IF(RC[-1]="",((RC[-2]+RC[-3])/2)*0.65,RC[-1]) -> 5.4567002830868745 | J396: =RC[-1]*RC[-5]/R419C5 -> 0.23246086331735907 | M396: 4.6411560264462866 | N396: 6.2593892323653524
A397: سیمان سپاهان | B397: سپاها | C397: سیمان آهک گچ | D397: -1.14235500878734 | E397: =VLOOKUP(RC[-3],'[screener-data-1401-11-24.xlsx]overview'!R8C2:R902C7,6,0) -> 27268500000000 | F397: 5.713560182833926 | G397: =VLOOKUP(RC[-5],'[screener-data-1401-11-24.xlsx]overview'!R8C2:R897C8,7,FALSE) -> 4.9051872354999997 | I397: =IF(RC[-1]="",((RC[-2]+RC[-3])/2)*0.65,RC[-1]) -> 3.4510929109585256 | J397: =RC[-1]*RC[-5]/R419C5 -> 7.5492226331925441E-2 | M397: 1.8399492177353682 | N397: 4.3897355758664167
A398: سیمان سفید نی ریز | B398: سنیر | C398: سیمان آهک گچ | D398: -0.25940337224382998 | E398: =VLOOKUP(RC[-3],'[screener-data-1401-11-24.xlsx]overview'!R8C2:R902C7,6,0) -> 7072500000000 | F398: 22.903946388682055 | G398: =VLOOKUP(RC[-5],'[screener-data-1401-11-24.xlsx]overview'!R8C2:R897C8,7,FALSE) -> 15.628683628099999 | I398: =IF(RC[-1]="",((RC[-2]+RC[-3])/2)*0.65,RC[-1]) -> 12.523104755454167 | J398: =RC[-1]*RC[-5]/R419C5 -> 7.1050854040239461E-2 | M398: 4.085963006406625 | N398: 10.255027642248139
A399: سیمان شاهرود | B399: سرود | C399: سیمان آهک گچ | D399: 0 | E399: =VLOOKUP(RC[-3],'[screener-data-1401-11-24.xlsx]overview'!R8C2:R902C7,6,0) -> 21934800000000 | F399: 7.731958762886598 | G399: =VLOOKUP(RC[-5],'[screener-data-1401-11-24.xlsx]overview'!R8C2:R897C8,7,FALSE) -> 6.0973193261 | I399: =IF(RC[-1]="",((RC[-2]+RC[-3])/2)*0.65,RC[-1]) -> 4.4945153789206449 | J399: =RC[-1]*RC[-5]/R419C5 -> 7.9086231680564598E-2 | M399: 3.0776674067422447 | N399: 5.3247021380614674
A400: سیمان شرق | B400: سشرق | C400: سیمان آهک گچ | D400: -0.22172949002216999 | E400: =VLOOKUP(RC[-3],'[screener-data-1401-11-24.xlsx]overview'!R8C2:R902C7,6,0) -> 23245185600000 | F400: 5.8631921824104234 | G400: =VLOOKUP(RC[-5],'[screener-data-1401-11-24.xlsx]overview'!R8C2:R897C8,7,FALSE) -> 5.7498491648999996 | I400: =IF(RC[-1]="",((RC[-2]+RC[-3])/2)*0.65,RC[-1]) -> 3.7742384378758875 | J400: =RC[-1]*RC[-5]/R419C5 -> 7.0379582206177099E-2 | M400: 3.3249594578941273 | N400: 5.2019549664188904
A401: سیمان شمال | B401: سشمال | C401: سیمان آهک گچ | D401: 8.1499592502029997E-2 | E401: =VLOOKUP(RC[-3],'[screener-data-1401-11-24.xlsx]overview'!R8C2:R902C7,6,0) -> 21029000000000 | F401: 11.864734299516908 | G401: =VLOOKUP(RC[-5],'[screener-data-1401-11-24.xlsx]overview'!R8C2:R897C8,7,FALSE) -> 7.9136415132 | I401: =IF(RC[-1]="",((RC[-2]+RC[-3])/2)*0.65,RC[-1]) -> 6.4279721391329954 | J401: =RC[-1]*RC[-5]/R419C5 -> 0.10843686161403529 | M401: 5.9456252689643545 | N401: 4.8158240281844282
A402: سیمان صوفیان | B402: سصوفی | C402: سیمان آهک گچ | D402: -0.91543156059285002 | E402: =VLOOKUP(RC[-3],'[screener-data-1401-11-24.xlsx]overview'!R8C2:R902C7,6,0) -> 25674000000000 | F402: 8.9277297721916735 | G402: =VLOOKUP(RC[-5],'[screener-data-1401-11-24.xlsx]overview'!R8C2:R897C8,7,FALSE) -> 6.1566773242000004 | I402: =IF(RC[-1]="",((RC[-2]+RC[-3])/2)*0.65,RC[-1]) -> 4.9024323063272943 | J402: =RC[-1]*RC[-5]/R419C5 -> 0.10096933022839842 | M402: 3.0617956648460964 | N402: 4.7376625699645114
A403: سیمان غرب | B403: سغرب | C403: سیمان آهک گچ | D403: -0.52674230145866996 | E403: =VLOOKUP(RC[-3],'[screener-data-1401-11-24.xlsx]overview'!R8C2:R902C7,6,0) -> 12205000000000 | F403: 11.569274269557022 | G403: =VLOOKUP(RC[-5],'[screener-data-1401-11-24.xlsx]overview'!R8C2:R897C8,7,FALSE) -> 7.2023787364 | I403: =IF(RC[-1]="",((RC[-2]+RC[-3])/2)*0.65,RC[-1]) -> 6.1007872269360321 | J403: =RC[-1]*RC[-5]/R419C5 -> 5.9732129144011735E-2 | M403: 2.781291683971852 | N403: 6.4910376088868258
A404: سیمان غرب آسیا | B404: سجام | C404: سیمان آهک گچ | D404: 0 | E404: =VLOOKUP(RC[-3],'[screener-data-1401-11-24.xlsx]overview'!R8C2:R902C7,6,0) -> 14231526389300 | F404: 14.819444444444445 | G404: =VLOOKUP(RC[-5],'[screener-data-1401-11-24.xlsx]overview'!R8C2:R897C8,7,FALSE) -> 12.963492498800001 | I404: =IF(RC[-1]="",((RC[-2]+RC[-3])/2)*0.65,RC[-1]) -> 9.029454506554444 | J404: =RC[-1]*RC[-5]/R419C5 -> 0.10308544015891559 | M404: 4.9225827502906361 | N404: 1.855670694239784
A405: سیمان فارس | B405: سفار | C405: سیمان آهک گچ | D405: 1.35948026948989 | E405: =VLOOKUP(RC[-3],'[screener-data-1401-11-24.xlsx]overview'!R8C2:R902C7,6,0) -> 19627920000000 | F405: 18.295331161780673 | G405: =VLOOKUP(RC[-5],'[screener-data-1401-11-24.xlsx]overview'!R8C2:R897C8,7,FALSE) -> 10.385213121 | I405: =IF(RC[-1]="",((RC[-2]+RC[-3])/2)*0.65,RC[-1]) -> 9.3211768919037183 | J405: =RC[-1]*RC[-5]/R419C5 -> 0.14676731933257059 | M405: 6.9323859075535914 | N405: 9.9408015840260493
A406: سیمان فارس نو | B406: سفانو | C406: سیمان آهک گچ | D406: -1.32852222404461 | E406: =VLOOKUP(RC[-3],'[screener-data-1401-11-24.xlsx]overview'!R8C2:R902C7,6,0) -> 30115000000000 | F406: 11.211330600074543 | G406: =VLOOKUP(RC[-5],'[screener-data-1401-11-24.xlsx]overview'!R8C2:R897C8,7,FALSE) -> 6.7586366928999997 | I406: =IF(RC[-1]="",((RC[-2]+RC[-3])/2)*0.65,RC[-1]) -> 5.840239370216727 | J406: =RC[-1]*RC[-5]/R419C5 -> 0.14109052455639418 | M406: 5.5961645436093397 | N406: 6.6338429644985748
A407: سیمان فارس و خوزستان | B407: سفارس | C407: سیمان آهک گچ | D407: 0 | E407: =VLOOKUP(RC[-3],'[screener-data-1401-11-24.xlsx]overview'!R8C2:R902C7,6,0) -> 112950000000000 | F407: 5.7332579824809269 | G407: =VLOOKUP(RC[-5],'[screener-data-1401-11-24.xlsx]overview'!R8C2:R897C8,7,FALSE) -> 4.9077250033000004 | H407: 4.2 | I407: =IF(RC[-1]="",((RC[-2]+RC[-3])/2)*0.65,RC[-1]) -> 4.2 | J407: =RC[-1]*RC[-5]/R419C5 -> 0.38055712603536307 | K407: 0.75 | M407: 5.6855458796558525 | N407: 5.9509538941431117
A408: سیمان قائن | B408: سقاین | C408: سیمان آهک گچ | D408: 0.48672566371680998 | E408: =VLOOKUP(RC[-3],'[screener-data-1401-11-24.xlsx]overview'!R8C2:R902C7,6,0) -> 11312500000000 | F408: 9.2693877551020414 | G408: =VLOOKUP(RC[-5],'[screener-data-1401-11-24.xlsx]overview'!R8C2:R897C8,7,FALSE) -> 9.0507695793000007 | I408: =IF(RC[-1]="",((RC[-2]+RC[-3])/2)*0.65,RC[-1]) -> 5.9540511336806636 | J408: =RC[-1]*RC[-5]/R419C5 -> 5.4032552643118091E-2 | M408: 4.2842719114757362 | N408: 8.4227532277948622
A409: سیمان لار سبزوار | B409: سبزوا | C409: سیمان آهک گچ | D409: 1.85528756957328 | E409: =VLOOKUP(RC[-3],'[screener-data-1401-11-24.xlsx]overview'!R8C2:R902C7,6,0) -> 21231556321350 | F409: 19.74820143884892 | G409: =VLOOKUP(RC[-5],'[screener-data-1401-11-24.xlsx]overview'!R8C2:R897C8,7,FALSE) -> 39.105005528900001 | I409: =IF(RC[-1]="",((RC[-2]+RC[-3])/2)*0.65,RC[-1]) -> 19.127292264518399 | J409: =RC[-1]*RC[-5]/R419C5 -> 0.32577642790741351 | M409: 8.7134004470714252 | N409: 3.5048144538067101
A410: سیمان لارستان | B410: سلار | C410: سیمان آهک گچ | D410: 2.0872865275142298 | E410: =VLOOKUP(RC[-3],'[screener-data-1401-11-24.xlsx]overview'!R8C2:R902C7,6,0) -> 6562674086800 | F410: 18.041582830315225 | G410: =VLOOKUP(RC[-5],'[screener-data-1401-11-24.xlsx]overview'!R8C2:R897C8,7,FALSE) -> 21.337307173799999 | I410: =IF(RC[-1]="",((RC[-2]+RC[-3])/2)*0.65,RC[-1]) -> 12.798139251337448 | J410: =RC[-1]*RC[-5]/R419C5 -> 6.7377051409614711E-2 | M410: 5.2104818119196992 | N410: 7.026006632086081
A411: سیمان مازندران | B411: سمازن | C411: سیمان آهک گچ | D411: 0 | E411: =VLOOKUP(RC[-3],'[screener-data-1401-11-24.xlsx]overview'!R8C2:R902C7,6,0) -> 35732340000000 | F411: 6.2414965986394559 | G411: =VLOOKUP(RC[-5],'[screener-data-1401-11-24.xlsx]overview'!R8C2:R897C8,7,FALSE) -> 6.2682279669999996 | I411: =IF(RC[-1]="",((RC[-2]+RC[-3])/2)*0.65,RC[-1]) -> 4.065660483832823 | J411: =RC[-1]*RC[-5]/R419C5 -> 0.11654050599041822 | M411: 4.0654421448302145 | N411: 4.7657205054489822
A412: سیمان مجد خواف | B412: سخواف | C412: سیمان آهک گچ | D412: 2.8708133971291798 | E412: =VLOOKUP(RC[-3],'[screener-data-1401-11-24.xlsx]overview'!R8C2:R902C7,6,0) -> 3409113078140 | F412: -146.59090909090909 | G412: =VLOOKUP(RC[-5],'[screener-data-1401-11-24.xlsx]overview'!R8C2:R897C8,7,FALSE) -> 0 | I412: =IF(RC[-1]="",((RC[-2]+RC[-3])/2)*0.65,RC[-1]) -> -47.64204545454546 | J412: =RC[-1]*RC[-5]/R419C5 -> -0.13029151645918302 | M412: 40.546782381601567 | N412: 1.2693728325005873
A413: سیمان ممتازان کرمان | B413: سمتاز | C413: سیمان آهک گچ | D413: -0.14492753623188001 | E413: =VLOOKUP(RC[-3],'[screener-data-1401-11-24.xlsx]overview'!R8C2:R902C7,6,0) -> 34550000000000 | F413: 13.638163103721299 | G413: =VLOOKUP(RC[-5],'[screener-data-1401-11-24.xlsx]overview'!R8C2:R897C8,7,FALSE) -> 7.2974034965000003 | I413: =IF(RC[-1]="",((RC[-2]+RC[-3])/2)*0.65,RC[-1]) -> 6.804059145071923 | J413: =RC[-1]*RC[-5]/R419C5 -> 0.18858209877881399 | M413: 6.9573667911654971 | N413: 6.4894344660363341
A414: سیمان هرمزگان | B414: سهرمز | C414: سیمان آهک گچ | D414: 0.92518101367658001 | E414: =VLOOKUP(RC[-3],'[screener-data-1401-11-24.xlsx]overview'!R8C2:R902C7,6,0) -> 25029560000000 | F414: 15.069069069069069 | G414: =VLOOKUP(RC[-5],'[screener-data-1401-11-24.xlsx]overview'!R8C2:R897C8,7,FALSE) -> 10.3330541032 | I414: =IF(RC[-1]="",((RC[-2]+RC[-3])/2)*0.65,RC[-1]) -> 8.2556900309874486 | J414: =RC[-1]*RC[-5]/R419C5 -> 0.1657642704648031 | M414: 3.9100740306675066 | N414: 8.5770068291083046
A415: سیمان هگمتان | B415: سهگمت | C415: سیمان آهک گچ | D415: 9.876543209876E-2 | E415: =VLOOKUP(RC[-3],'[screener-data-1401-11-24.xlsx]overview'!R8C2:R902C7,6,0) -> 29632560740000 | F415: 10.865719646207451 | G415: =VLOOKUP(RC[-5],'[screener-data-1401-11-24.xlsx]overview'!R8C2:R897C8,7,FALSE) -> 6.2465747113000001 | I415: =IF(RC[-1]="",((RC[-2]+RC[-3])/2)*0.65,RC[-1]) -> 5.5614956661899217 | J415: =RC[-1]*RC[-5]/R419C5 -> 0.13220415948492778 | M415: 4.7207823544196321 | N415: 5.8952546134267259
A416: سیمان کارون | B416: سکارون | C416: سیمان آهک گچ | D416: 2.6973026973026899 | E416: =VLOOKUP(RC[-3],'[screener-data-1401-11-24.xlsx]overview'!R8C2:R902C7,6,0) -> 10828008316050 | F416: 34.062292909211401 | G416: =VLOOKUP(RC[-5],'[screener-data-1401-11-24.xlsx]overview'!R8C2:R897C8,7,FALSE) -> 0 | I416: =IF(RC[-1]="",((RC[-2]+RC[-3])/2)*0.65,RC[-1]) -> 11.070245195493706 | J416: =RC[-1]*RC[-5]/R419C5 -> 9.6159047728183358E-2 | M416: 3.5443030366867632 | N416: 16.796436706067919
A417: سیمان کردستان | B417: سکرد | C417: سیمان آهک گچ | D417: 0.30627871362940001 | E417: =VLOOKUP(RC[-3],'[screener-data-1401-11-24.xlsx]overview'!R8C2:R902C7,6,0) -> 14234000000000 | F417: 15.595238095238095 | G417: =VLOOKUP(RC[-5],'[screener-data-1401-11-24.xlsx]overview'!R8C2:R897C8,7,FALSE) -> 15.535404575499999 | I417: =IF(RC[-1]="",((RC[-2]+RC[-3])/2)*0.65,RC[-1]) -> 10.117458867989882 | J417: =RC[-1]*RC[-5]/R419C5 -> 0.11552679947816702 | M417: 2.9603808187866876 | N417: 5.4651647893199833
A418: سیمان کرمان | B418: سکرما | C418: سیمان آهک گچ | D418: -0.92432120161756004 | E418: =VLOOKUP(RC[-3],'[screener-data-1401-11-24.xlsx]overview'!R8C2:R902C7,6,0) -> 25470000000000 | F418: 7.5252303641948224 | G418: =VLOOKUP(RC[-5],'[screener-data-1401-11-24.xlsx]overview'!R8C2:R897C8,7,FALSE) -> 7.0037056732999998 | H418: 4.2 | I418: =IF(RC[-1]="",((RC[-2]+RC[-3])/2)*0.65,RC[-1]) -> 4.2 | J418: =RC[-1]*RC[-5]/R419C5 -> 8.5814873839049996E-2 | M418: 6.5113905672541224 | N418: 4.6454941686181659
E419: =SUM(R[-43]C:R[-1]C) -> 1246567118430250 | I419: =IF(RC[-1]="",((RC[-2]+RC[-3])/2)*0.65,RC[-1]) -> 0 | J419: =SUM(R[-43]C:R[-1]C) -> 6.5383737205402594
A420: آریان کیمیا تک | B420: کیمیاتک | C420: شیمیایی | D420: 0.83798882681564002 | E420: =VLOOKUP(RC[-3],'[screener-data-1401-11-24.xlsx]overview'!R8C2:R902C7,6,0) -> 43320000000000 | F420: 3.9410480349344978 | G420: =VLOOKUP(RC[-5],'[screener-data-1401-11-24.xlsx]overview'!R8C2:R897C8,7,FALSE) -> 8.0779243466999997 | H420: 5.8 | I420: =IF(RC[-1]="",((RC[-2]+RC[-3])/2)*0.65,RC[-1]) -> 5.8 | J420: =RC[-1]*RC[-5]/R488C5 -> 1.4354125148113685E-2 | M420: 2.5171252546976897 | N420: 4.9503145883782569
A421: الیاف مصنوعی | B421: شمواد | C421: شیمیایی | D421: 2.9529130087789301 | E421: =VLOOKUP(RC[-3],'[screener-data-1401-11-24.xlsx]overview'!R8C2:R902C7,6,0) -> 9412812800000 | F421: 8.7315554352240419 | G421: =VLOOKUP(RC[-5],'[screener-data-1401-11-24.xlsx]overview'!R8C2:R897C8,7,FALSE) -> 9.6665457623000002 | I421: =IF(RC[-1]="",((RC[-2]+RC[-3])/2)*0.65,RC[-1]) -> 5.979382889195314 | J421: =RC[-1]*RC[-5]/R488C5 -> 3.215407887575236E-3 | M421: 0.79162854280352191 | N421: 7.0107771567001764
A422: بین المللی محصولات پارس | B422: شپارس | C422: شیمیایی | D422: 2.9032258064516099 | E422: =VLOOKUP(RC[-3],'[screener-data-1401-11-24.xlsx]overview'!R8C2:R902C7,6,0) -> 6534000000000 | F422: 74.186046511627907 | G422: =VLOOKUP(RC[-5],'[screener-data-1401-11-24.xlsx]overview'!R8C2:R897C8,7,FALSE) -> 34.750883475000002 | I422: =IF(RC[-1]="",((RC[-2]+RC[-3])/2)*0.65,RC[-1]) -> 35.404502245654072 | J422: =RC[-1]*RC[-5]/R488C5 -> 1.3215935486398437E-2 | M422: 0.73487388085660865 | N422: 4.5994819848160731
A423: پارس پامچال | B423: شپمچا | C423: شیمیایی | D423: 0 | E423: =VLOOKUP(RC[-3],'[screener-data-1401-11-24.xlsx]overview'!R8C2:R902C7,6,0) -> 0 | F423: 6.290322580645161 | G423: =VLOOKUP(RC[-5],'[screener-data-1401-11-24.xlsx]overview'!R8C2:R897C8,7,FALSE) -> 0 | I423: =IF(RC[-1]="",((RC[-2]+RC[-3])/2)*0.65,RC[-1]) -> 2.0443548387096775 | J423: =RC[-1]*RC[-5]/R488C5 -> 0 | M423: 0.17488895939086294 | N423: 8.0818327504677392E-2
A424: پاکسان | B424: شپاکسا | C424: شیمیایی | D424: -1.63329820864067 | E424: =VLOOKUP(RC[-3],'[screener-data-1401-11-24.xlsx]overview'!R8C2:R902C7,6,0) -> 17031922106000 | F424: 1.6774483378256964 | G424: =VLOOKUP(RC[-5],'[screener-data-1401-11-24.xlsx]overview'!R8C2:R897C8,7,FALSE) -> 113.3147138674 | I424: =IF(RC[-1]="",((RC[-2]+RC[-3])/2)*0.65,RC[-1]) -> 37.372452716698355 | J424: =RC[-1]*RC[-5]/R488C5 -> 3.6364326643213596E-2 | M424: 0.68711352160909323 | N424: 1.5882801465881915
A425: پترو گامرون | B425: شگامرن | C425: شیمیایی | D425: 1.1439243609198 | E425: =VLOOKUP(RC[-3],'[screener-data-1401-11-24.xlsx]overview'!R8C2:R902C7,6,0) -> 27207000000000 | F425: 212.06558981889378 | G425: =VLOOKUP(RC[-5],'[screener-data-1401-11-24.xlsx]overview'!R8C2:R897C8,7,FALSE) -> 235.63223520380001 | I425: =IF(RC[-1]="",((RC[-2]+RC[-3])/2)*0.65,RC[-1]) -> 145.5017931323755 | J425: =RC[-1]*RC[-5]/R488C5 -> 0.22615661174035834 | M425: 132.0320594868044 | N425: 88.562658208441647
A426: پتروشیمی آبادان | B426: شپترو | C426: شیمیایی | D426: -2.95893719806763 | E426: =VLOOKUP(RC[-3],'[screener-data-1401-11-24.xlsx]overview'!R8C2:R902C7,6,0) -> 15140000000000 | F426: -4.2401055408970976 | G426: =VLOOKUP(RC[-5],'[screener-data-1401-11-24.xlsx]overview'!R8C2:R897C8,7,FALSE) -> 0 | I426: =IF(RC[-1]="",((RC[-2]+RC[-3])/2)*0.65,RC[-1]) -> -1.3780343007915568 | J426: =RC[-1]*RC[-5]/R488C5 -> -1.1919174823009355E-3 | M426: 1.1972684101437765 | N426: 1.7112600698074287
A427: پتروشیمی ارومیه | B427: شاروم | C427: شیمیایی | D427: 1.3060760931288999 | E427: =VLOOKUP(RC[-3],'[screener-data-1401-11-24.xlsx]overview'!R8C2:R902C7,6,0) -> 12096000000000 | F427: 18.372811534500514 | G427: =VLOOKUP(RC[-5],'[screener-data-1401-11-24.xlsx]overview'!R8C2:R897C8,7,FALSE) -> 11.1431653505 | H427: 5 | I427: =IF(RC[-1]="",((RC[-2]+RC[-3])/2)*0.65,RC[-1]) -> 5 | J427: =RC[-1]*RC[-5]/R488C5 -> 3.4551910758665091E-3 | M427: 2.2128645254851538 | N427: 5.1429550411502296
A428: پتروشیمی اصفهان | B428: شصفها | C428: شیمیایی | D428: 1.0782501540357301 | E428: =VLOOKUP(RC[-3],'[screener-data-1401-11-24.xlsx]overview'!R8C2:R902C7,6,0) -> 49860000000000 | F428: 30.435992578849721 | G428: =VLOOKUP(RC[-5],'[screener-data-1401-11-24.xlsx]overview'!R8C2:R897C8,7,FALSE) -> 37.196391814099997 | H428: 4.0999999999999996 | I428: =IF(RC[-1]="",((RC[-2]+RC[-3])/2)*0.65,RC[-1]) -> 4.0999999999999996 | J428: =RC[-1]*RC[-5]/R488C5 -> 1.1678751502564267E-2 | M428: 1.3308536882197179 | N428: 13.55287438524641
A429: پتروشیمی امیرکبیر | B429: شکبیر | C429: شیمیایی | D429: -6.4892926670990003E-2 | E429: =VLOOKUP(RC[-3],'[screener-data-1401-11-24.xlsx]overview'!R8C2:R902C7,6,0) -> 275220000000000 | F429: 6.7008963536680879 | G429: =VLOOKUP(RC[-5],'[screener-data-1401-11-24.xlsx]overview'!R8C2:R897C8,7,FALSE) -> 8.2122417910000003 | I429: =IF(RC[-1]="",((RC[-2]+RC[-3])/2)*0.65,RC[-1]) -> 4.8467698970171291 | J429: =RC[-1]*RC[-5]/R488C5 -> 7.6206616396373938E-2 | M429: 1.1513602432417147 | N429: 6.7518184970890456
A430: پتروشیمی بوعلی سینا | B430: بوعلی | C430: شیمیایی | D430: -1.3150531617235499 | E430: =VLOOKUP(RC[-3],'[screener-data-1401-11-24.xlsx]overview'!R8C2:R902C7,6,0) -> 496940500000000 | F430: 3.3851617237738747 | G430: =VLOOKUP(RC[-5],'[screener-data-1401-11-24.xlsx]overview'!R8C2:R897C8,7,FALSE) -> 7.9705183128000003 | H430: 6.3 | I430: =IF(RC[-1]="",((RC[-2]+RC[-3])/2)*0.65,RC[-1]) -> 6.3 | J430: =RC[-1]*RC[-5]/R488C5 -> 0.17885670633715012 | M430: 1.9198118064045941 | N430: 6.8645226241800996
A431: پتروشیمی پارس | B431: پارس | C431: شیمیایی | D431: -0.29698769622401 | E431: =VLOOKUP(RC[-3],'[screener-data-1401-11-24.xlsx]overview'!R8C2:R902C7,6,0) -> 1107766201462284 | F431: 6.9732937685459939 | G431: =VLOOKUP(RC[-5],'[screener-data-1401-11-24.xlsx]overview'!R8C2:R897C8,7,FALSE) -> 7.5052699931999998 | I431: =IF(RC[-1]="",((RC[-2]+RC[-3])/2)*0.65,RC[-1]) -> 4.705533222567448 | J431: =RC[-1]*RC[-5]/R488C5 -> 0.29779489006965104 | M431: 2.4736777007392625 | N431: 1.8703920099777351
A432: پتروشیمی پردیس | B432: شپدیس | C432: شیمیایی | D432: -0.75717321997873999 | E432: =VLOOKUP(RC[-3],'[screener-data-1401-11-24.xlsx]overview'!R8C2:R902C7,6,0) -> 862560000000000 | F432: 3.5043857591819503 | G432: =VLOOKUP(RC[-5],'[screener-data-1401-11-24.xlsx]overview'!R8C2:R897C8,7,FALSE) -> 3.1023166850999999 | H432: 4.3 | I432: =IF(RC[-1]="",((RC[-2]+RC[-3])/2)*0.65,RC[-1]) -> 4.3 | J432: =RC[-1]*RC[-5]/R488C5 -> 0.21189370605022304 | M432: 2.0772837847626757 | N432: 2.148224896430853
A433: پتروشیمی تندگویان | B433: شگویا | C433: شیمیایی | D433: -0.90991810737032996 | E433: =VLOOKUP(RC[-3],'[screener-data-1401-11-24.xlsx]overview'!R8C2:R902C7,6,0) -> 256107449540000 | F433: 7.9431072210065645 | G433: =VLOOKUP(RC[-5],'[screener-data-1401-11-24.xlsx]overview'!R8C2:R897C8,7,FALSE) -> 9.7162098645999997 | I433: =IF(RC[-1]="",((RC[-2]+RC[-3])/2)*0.65,RC[-1]) -> 5.739278052822133 | J433: =RC[-1]*RC[-5]/R488C5 -> 8.3973018323881057E-2 | M433: 1.5305173367050133 | N433: 5.3256119770520547
A434: پتروشیمی جم | B434: جم | C434: شیمیایی | D434: -0.24258760107815999 | E434: =VLOOKUP(RC[-3],'[screener-data-1401-11-24.xlsx]overview'!R8C2:R902C7,6,0) -> 665460000000000 | F434: 6.9177570093457943 | G434: =VLOOKUP(RC[-5],'[screener-data-1401-11-24.xlsx]overview'!R8C2:R897C8,7,FALSE) -> 7.6137438227000001 | I434: =IF(RC[-1]="",((RC[-2]+RC[-3])/2)*0.65,RC[-1]) -> 4.7227377704148834 | J434: =RC[-1]*RC[-5]/R488C5 -> 0.17954614073925076 | M434: 1.7079790498261136 | N434: 7.7909618667396305
A435: پتروشیمی جهرم | B435: جهرم | C435: شیمیایی | D435: 2.1301775147928899 | E435: =VLOOKUP(RC[-3],'[screener-data-1401-11-24.xlsx]overview'!R8C2:R902C7,6,0) -> 2902188000000 | F435: 26.96875 | G435: =VLOOKUP(RC[-5],'[screener-data-1401-11-24.xlsx]overview'!R8C2:R897C8,7,FALSE) -> 45.982963159800001 | I435: =IF(RC[-1]="",((RC[-2]+RC[-3])/2)*0.65,RC[-1]) -> 23.709306776934998 | J435: =RC[-1]*RC[-5]/R488C5 -> 3.9310148547961957E-3 | N435: 0.73542383239928022
A436: پتروشیمی خارک | B436: شخارک | C436: شیمیایی | D436: 2.598077422707E-2 | E436: =VLOOKUP(RC[-3],'[screener-data-1401-11-24.xlsx]overview'!R8C2:R902C7,6,0) -> 231000000000000 | F436: 8.1069698883975576 | G436: =VLOOKUP(RC[-5],'[screener-data-1401-11-24.xlsx]overview'!R8C2:R897C8,7,FALSE) -> 10.8908724264 | I436: =IF(RC[-1]="",((RC[-2]+RC[-3])/2)*0.65,RC[-1]) -> 6.1742987523092072 | J436: =RC[-1]*RC[-5]/R488C5 -> 8.148166716522133E-2 | M436: 2.483548560411077 | N436: 6.3016580808166642
A437: پتروشیمی خراسان | B437: خراسان | C437: شیمیایی | D437: 8.7481410200299994E-3 | E437: =VLOOKUP(RC[-3],'[screener-data-1401-11-24.xlsx]overview'!R8C2:R902C7,6,0) -> 203709884720000 | F437: 6.3048753584822412 | G437: =VLOOKUP(RC[-5],'[screener-data-1401-11-24.xlsx]overview'!R8C2:R897C8,7,FALSE) -> 4.3032937808999998 | I437: =IF(RC[-1]="",((RC[-2]+RC[-3])/2)*0.65,RC[-1]) -> 3.4476549702992285 | J437: =RC[-1]*RC[-5]/R488C5 -> 4.0123257634977726E-2 | M437: 3.8803000143627204 | N437: 3.6723520450224116
A438: پتروشیمی داراب | B438: داراب | C438: شیمیایی | D438: -0.31152647975077002 | E438: =VLOOKUP(RC[-3],'[screener-data-1401-11-24.xlsx]overview'!R8C2:R902C7,6,0) -> 3254640000000 | F438: 26.666666666666668 | G438: =VLOOKUP(RC[-5],'[screener-data-1401-11-24.xlsx]overview'!R8C2:R897C8,7,FALSE) -> 52.092694422599997 | I438: =IF(RC[-1]="",((RC[-2]+RC[-3])/2)*0.65,RC[-1]) -> 25.596792354011665 | J438: =RC[-1]*RC[-5]/R488C5 -> 4.759362560462342E-3 | N438: 0.35771553913817883
A439: پتروشیمی زاگرس | B439: زاگرس | C439: شیمیایی | D439: 3.7579857196540001E-2 | E439: =VLOOKUP(RC[-3],'[screener-data-1401-11-24.xlsx]overview'!R8C2:R902C7,6,0) -> 320520000000000 | F439: 10.427765590723912 | G439: =VLOOKUP(RC[-5],'[screener-data-1401-11-24.xlsx]overview'!R8C2:R897C8,7,FALSE) -> 15.2045190448 | H439: 5.6 | I439: =IF(RC[-1]="",((RC[-2]+RC[-3])/2)*0.65,RC[-1]) -> 5.6 | J439: =RC[-1]*RC[-5]/R488C5 -> 0.10254239292932718 | M439: 1.6583220700261692 | N439: 10.62766325784523
A440: پتروشیمی شازند | B440: شاراک | C440: شیمیایی | D440: 0.10420284821118 | E440: =VLOOKUP(RC[-3],'[screener-data-1401-11-24.xlsx]overview'!R8C2:R902C7,6,0) -> 231436800000000 | F440: 4.2183840749414516 | G440: =VLOOKUP(RC[-5],'[screener-data-1401-11-24.xlsx]overview'!R8C2:R897C8,7,FALSE) -> 7.2841019059000001 | I440: =IF(RC[-1]="",((RC[-2]+RC[-3])/2)*0.65,RC[-1]) -> 3.7383079437734721 | J440: =RC[-1]*RC[-5]/R488C5 -> 4.9427401155332312E-2 | M440: 1.1237211783343286 | N440: 6.3888439958765808
A441: پتروشیمی شیراز | B441: شیراز | C441: شیمیایی | D441: 1.3499873832954801 | E441: =VLOOKUP(RC[-3],'[screener-data-1401-11-24.xlsx]overview'!R8C2:R902C7,6,0) -> 409734000000000 | F441: 7.3724302496328926 | G441: =VLOOKUP(RC[-5],'[screener-data-1401-11-24.xlsx]overview'!R8C2:R897C8,7,FALSE) -> 3.3375708407000002 | I441: =IF(RC[-1]="",((RC[-2]+RC[-3])/2)*0.65,RC[-1]) -> 3.4807503543581904 | J441: =RC[-1]*RC[-5]/R488C5 -> 8.1477025618131749E-2 | M441: 2.903023052483003 | N441: 2.3464074833218316
A442: پتروشیمی غدیر | B442: شغدیر | C442: شیمیایی | D442: 0.58181818181818001 | E442: =VLOOKUP(RC[-3],'[screener-data-1401-11-24.xlsx]overview'!R8C2:R902C7,6,0) -> 87542000000000 | F442: 4.5526367766146549 | G442: =VLOOKUP(RC[-5],'[screener-data-1401-11-24.xlsx]overview'!R8C2:R897C8,7,FALSE) -> 5.4244072781000003 | H442: 4.2 | I442: =IF(RC[-1]="",((RC[-2]+RC[-3])/2)*0.65,RC[-1]) -> 4.2 | J442: =RC[-1]*RC[-5]/R488C5 -> 2.1005162303021248E-2 | M442: 2.2994181918190795 | N442: 8.4813804945702937
A443: پتروشیمی فارابی | B443: شفارا | C443: شیمیایی | D443: -2.8673835125448002 | E443: =VLOOKUP(RC[-3],'[screener-data-1401-11-24.xlsx]overview'!R8C2:R902C7,6,0) -> 13704712230000 | F443: 34.522292993630572 | G443: =VLOOKUP(RC[-5],'[screener-data-1401-11-24.xlsx]overview'!R8C2:R897C8,7,FALSE) -> 29.745685551600001 | I443: =IF(RC[-1]="",((RC[-2]+RC[-3])/2)*0.65,RC[-1]) -> 20.887093027199938 | J443: =RC[-1]*RC[-5]/R488C5 -> 1.6353405608668388E-2 | M443: 1.8744290062670685 | N443: 7.8175077820808987
A444: پتروشیمی فسا | B444: فسا | C444: شیمیایی | D444: -0.10952902519167 | E444: =VLOOKUP(RC[-3],'[screener-data-1401-11-24.xlsx]overview'!R8C2:R902C7,6,0) -> 3179232000000 | F444: -912 | G444: =VLOOKUP(RC[-5],'[screener-data-1401-11-24.xlsx]overview'!R8C2:R897C8,7,FALSE) -> 18.877718355700001 | I444: =IF(RC[-1]="",((RC[-2]+RC[-3])/2)*0.65,RC[-1]) -> -290.2647415343975 | J444: =RC[-1]*RC[-5]/R488C5 -> -5.2720168933860889E-2 | N444: 0.77803816538332771
A445: پتروشیمی فن آوران | B445: شفن | C445: شیمیایی | D445: -0.54744525547445 | E445: =VLOOKUP(RC[-3],'[screener-data-1401-11-24.xlsx]overview'!R8C2:R902C7,6,0) -> 164654000000000 | F445: 8.1709145427286352 | G445: =VLOOKUP(RC[-5],'[screener-data-1401-11-24.xlsx]overview'!R8C2:R897C8,7,FALSE) -> 23.236549829099999 | I445: =IF(RC[-1]="",((RC[-2]+RC[-3])/2)*0.65,RC[-1]) -> 10.207425920844306 | J445: =RC[-1]*RC[-5]/R488C5 -> 9.6017149613509573E-2 | M445: 3.0552015985671854 | N445: 3.463928252661538
A446: پتروشیمی قائد بصیر | B446: شبصیر | C446: شیمیایی | D446: 1.4486754966887401 | E446: =VLOOKUP(RC[-3],'[screener-data-1401-11-24.xlsx]overview'!R8C2:R902C7,6,0) -> 61250000000000 | F446: 6.4256501677852347 | G446: =VLOOKUP(RC[-5],'[screener-data-1401-11-24.xlsx]overview'!R8C2:R897C8,7,FALSE) -> 7.0128000846000003 | I446: =IF(RC[-1]="",((RC[-2]+RC[-3])/2)*0.65,RC[-1]) -> 4.3674963320252012 | J446: =RC[-1]*RC[-5]/R488C5 -> 1.5282659208919604E-2 | M446: 2.498784964536624 | N446: 8.9739038436866778
A447: پتروشیمی مارون | B447: مارون | C447: شیمیایی | D447: 0 | E447: =VLOOKUP(RC[-3],'[screener-data-1401-11-24.xlsx]overview'!R8C2:R902C7,6,0) -> 1458800000000000 | F447: 10.305666986835414 | G447: =VLOOKUP(RC[-5],'[screener-data-1401-11-24.xlsx]overview'!R8C2:R897C8,7,FALSE) -> 14.335087569800001 | I447: =IF(RC[-1]="",((RC[-2]+RC[-3])/2)*0.65,RC[-1]) -> 8.0082452309065104 | J447: =RC[-1]*RC[-5]/R488C5 -> 0.66741106917352344 | M447: 4.4527799122745595 | N447: 12.720992482209027
A448: پتروشیمی ممسنی | B448: ممسنی | C448: شیمیایی | D448: 2.8363047001620698 | E448: =VLOOKUP(RC[-3],'[screener-data-1401-11-24.xlsx]overview'!R8C2:R902C7,6,0) -> 17708600000000 | F448: -1812.8571428571429 | G448: =VLOOKUP(RC[-5],'[screener-data-1401-11-24.xlsx]overview'!R8C2:R897C8,7,FALSE) -> 0 | I448: =IF(RC[-1]="",((RC[-2]+RC[-3])/2)*0.65,RC[-1]) -> -589.17857142857144 | J448: =RC[-1]*RC[-5]/R488C5 -> -0.59606203085460441 | N448: 12.372837010418545
A449: پتروشیمی نوری | B449: نوری | C449: شیمیایی | D449: -0.54222311477054996 | E449: =VLOOKUP(RC[-3],'[screener-data-1401-11-24.xlsx]overview'!R8C2:R902C7,6,0) -> 879570000000000 | F449: 6.7768199233716473 | G449: =VLOOKUP(RC[-5],'[screener-data-1401-11-24.xlsx]overview'!R8C2:R897C8,7,FALSE) -> 7.8175589198999997 | H449: 5.7 | I449: =IF(RC[-1]="",((RC[-2]+RC[-3])/2)*0.65,RC[-1]) -> 5.7 | J449: =RC[-1]*RC[-5]/R488C5 -> 0.28642145772518951 | M449: 1.1848460207565432 | N449: 8.5152224131772556
A450: پتروشیمی کازرون | B450: کازرو | C450: شیمیایی | D450: 2.9935275080906099 | E450: =VLOOKUP(RC[-3],'[screener-data-1401-11-24.xlsx]overview'!R8C2:R902C7,6,0) -> 16051500000000 | F450: -397.8125 | G450: =VLOOKUP(RC[-5],'[screener-data-1401-11-24.xlsx]overview'!R8C2:R897C8,7,FALSE) -> 0 | I450: =IF(RC[-1]="",((RC[-2]+RC[-3])/2)*0.65,RC[-1]) -> -129.2890625 | J450: =RC[-1]*RC[-5]/R488C5 -> -0.11855986504108219 | N450: 14.005227172711368
A451: پدیده شیمی قرن | B451: قرن | C451: شیمیایی | D451: 1.3671875 | E451: =VLOOKUP(RC[-3],'[screener-data-1401-11-24.xlsx]overview'!R8C2:R902C7,6,0) -> 39480000000000 | F451: 7.632352941176471 | G451: =VLOOKUP(RC[-5],'[screener-data-1401-11-24.xlsx]overview'!R8C2:R897C8,7,FALSE) -> 9.3795172885000007 | H451: 6 | I451: =IF(RC[-1]="",((RC[-2]+RC[-3])/2)*0.65,RC[-1]) -> 6 | J451: =RC[-1]*RC[-5]/R488C5 -> 1.3532831713810495E-2 | M451: 2.3010265948131581 | N451: 2.6457177477958087
A452: پلی اکریل ایران | B452: شپلی | C452: شیمیایی | D452: 2.4716786817713601 | E452: =VLOOKUP(RC[-3],'[screener-data-1401-11-24.xlsx]overview'!R8C2:R902C7,6,0) -> 37638118660000 | F452: 122.83950617283951 | G452: =VLOOKUP(RC[-5],'[screener-data-1401-11-24.xlsx]overview'!R8C2:R897C8,7,FALSE) -> 10.3826776119 | I452: =IF(RC[-1]="",((RC[-2]+RC[-3])/2)*0.65,RC[-1]) -> 43.297209730040343 | J452: =RC[-1]*RC[-5]/R488C5 -> 9.3099661788251242E-2 | M452: 2.0214582875586404 | N452: -8.0958012330342726
A453: پلی پروپیلن جم | B453: جم پیلن | C453: شیمیایی | D453: 0.11245431543435 | E453: =VLOOKUP(RC[-3],'[screener-data-1401-11-24.xlsx]overview'!R8C2:R902C7,6,0) -> 284880000000000 | F453: 5.8878968253968251 | G453: =VLOOKUP(RC[-5],'[screener-data-1401-11-24.xlsx]overview'!R8C2:R897C8,7,FALSE) -> 7.6026737705 | I453: =IF(RC[-1]="",((RC[-2]+RC[-3])/2)*0.65,RC[-1]) -> 4.3844354436664688 | J453: =RC[-1]*RC[-5]/R488C5 -> 7.1356892271322789E-2 | M453: 3.0570427894884471 | N453: 8.8233416659731496
A454: پلیمر آریا ساسول | B454: آریا | C454: شیمیایی | D454: 0.93926111458984995 | E454: =VLOOKUP(RC[-3],'[screener-data-1401-11-24.xlsx]overview'!R8C2:R902C7,6,0) -> 1060929768000000 | F454: 8.2320498416913495 | G454: =VLOOKUP(RC[-5],'[screener-data-1401-11-24.xlsx]overview'!R8C2:R897C8,7,FALSE) -> 10.553846011899999 | I454: =IF(RC[-1]="",((RC[-2]+RC[-3])/2)*0.65,RC[-1]) -> 6.1054161524171882 | J454: =RC[-1]*RC[-5]/R488C5 -> 0.37005152078799697 | M454: 4.1774721783685855 | N454: 12.430724380633107
A455: تولی پرس | B455: شتولی | C455: شیمیایی | D455: -0.24154589371980001 | E455: =VLOOKUP(RC[-3],'[screener-data-1401-11-24.xlsx]overview'!R8C2:R902C7,6,0) -> 4120000000000 | F455: 2360 | G455: =VLOOKUP(RC[-5],'[screener-data-1401-11-24.xlsx]overview'!R8C2:R897C8,7,FALSE) -> 31.602603118099999 | I455: =IF(RC[-1]="",((RC[-2]+RC[-3])/2)*0.65,RC[-1]) -> 777.27084601338254 | J455: =RC[-1]*RC[-5]/R488C5 -> 0.18294893316117397 | M455: 62.492434329984263 | N455: -0.58715064181394006
A456: تولید دارو | B456: تولیددارو | C456: شیمیایی | D456: 6.8807339449539998E-2 | E456: =VLOOKUP(RC[-3],'[screener-data-1401-11-24.xlsx]overview'!R8C2:R902C7,6,0) -> 0 | F456: 3.4219607843137254 | G456: =VLOOKUP(RC[-5],'[screener-data-1401-11-24.xlsx]overview'!R8C2:R897C8,7,FALSE) -> 0 | I456: =IF(RC[-1]="",((RC[-2]+RC[-3])/2)*0.65,RC[-1]) -> 1.1121372549019608 | J456: =RC[-1]*RC[-5]/R488C5 -> 0 | M456: 1.167310054874553 | N456: -25.958150359202673
A457: توکا رنگ فولاد سپاهان | B457: شتوکا | C457: شیمیایی | D457: -0.60240963855421004 | E457: =VLOOKUP(RC[-3],'[screener-data-1401-11-24.xlsx]overview'!R8C2:R902C7,6,0) -> 5666250000000 | F457: 8.423142370958594 | G457: =VLOOKUP(RC[-5],'[screener-data-1401-11-24.xlsx]overview'!R8C2:R897C8,7,FALSE) -> 22.704958271999999 | I457: =IF(RC[-1]="",((RC[-2]+RC[-3])/2)*0.65,RC[-1]) -> 10.116632708961543 | J457: =RC[-1]*RC[-5]/R488C5 -> 3.2748544438446665E-3 | M457: 3.2242814520513523 | N457: 5.6864248763920573
A458: تکمیلی پتروشیمی خلیج فارس | B458: پترول | C458: شیمیایی | D458: 9.6385542168669999E-2 | E458: =VLOOKUP(RC[-3],'[screener-data-1401-11-24.xlsx]overview'!R8C2:R902C7,6,0) -> 142380000000000 | F458: 10.817708333333334 | G458: =VLOOKUP(RC[-5],'[screener-data-1401-11-24.xlsx]overview'!R8C2:R897C8,7,FALSE) -> 12.1028062874 | I458: =IF(RC[-1]="",((RC[-2]+RC[-3])/2)*0.65,RC[-1]) -> 7.4491672517383343 | J458: =RC[-1]*RC[-5]/R488C5 -> 6.0592238996360369E-2 | K458: 0.5 | M458: 11.559743216114722 | N458: 1.0094491915040302
A459: دوده صنعتی پارس | B459: شدوص | C459: شیمیایی | D459: -0.60449050086355005 | E459: =VLOOKUP(RC[-3],'[screener-data-1401-11-24.xlsx]overview'!R8C2:R902C7,6,0) -> 10877500000000 | F459: 3.8858879135719109 | G459: =VLOOKUP(RC[-5],'[screener-data-1401-11-24.xlsx]overview'!R8C2:R897C8,7,FALSE) -> 6.3585616942999996 | I459: =IF(RC[-1]="",((RC[-2]+RC[-3])/2)*0.65,RC[-1]) -> 3.3294461225583709 | J459: =RC[-1]*RC[-5]/R488C5 -> 2.0690041906036333E-3 | M459: 1.3158038822261364 | N459: 4.3371958023068515
A460: رنگین | B460: شرنگی | C460: شیمیایی | D460: 0.25974025974025 | E460: =VLOOKUP(RC[-3],'[screener-data-1401-11-24.xlsx]overview'!R8C2:R902C7,6,0) -> 18500000000000 | F460: 8.7947140578719534 | G460: =VLOOKUP(RC[-5],'[screener-data-1401-11-24.xlsx]overview'!R8C2:R897C8,7,FALSE) -> 42.955425000600002 | I460: =IF(RC[-1]="",((RC[-2]+RC[-3])/2)*0.65,RC[-1]) -> 16.818795194003386 | J460: =RC[-1]*RC[-5]/R488C5 -> 1.7775707583188163E-2 | M460: 11.440908301416361 | N460: 14.704268961650047
A461: سر. پتروشیمی | B461: وپترو | C461: شیمیایی | D461: 6.9306930693069297 | E461: =VLOOKUP(RC[-3],'[screener-data-1401-11-24.xlsx]overview'!R8C2:R902C7,6,0) -> 29393000000000 | F461: 11.376975169300225 | G461: =VLOOKUP(RC[-5],'[screener-data-1401-11-24.xlsx]overview'!R8C2:R897C8,7,FALSE) -> 4.5982028203 | I461: =IF(RC[-1]="",((RC[-2]+RC[-3])/2)*0.65,RC[-1]) -> 5.191932846620074 | J461: =RC[-1]*RC[-5]/R488C5 -> 8.7183292870543251E-3 | K461: 1.1200000000000001 | M461: 7.2152990013361666 | N461: 7.5218452334094312
A462: سر. نفت و گاز تامین | B462: تاپیکو | C462: شیمیایی | D462: 0 | E462: =VLOOKUP(RC[-3],'[screener-data-1401-11-24.xlsx]overview'!R8C2:R902C7,6,0) -> 1235255000000000 | F462: 5.1412905946857865 | G462: =VLOOKUP(RC[-5],'[screener-data-1401-11-24.xlsx]overview'!R8C2:R897C8,7,FALSE) -> 6.1868190343 | I462: =IF(RC[-1]="",((RC[-2]+RC[-3])/2)*0.65,RC[-1]) -> 3.6816356294203803 | J462: =RC[-1]*RC[-5]/R488C5 -> 0.25981110595324175 | K462: 0.55000000000000004 | M462: 6.1853197452147279 | N462: 5.8316091476912035
A463: سموم علف کش | B463: شسم | C463: شیمیایی | D463: -4.7221784983470003E-2 | E463: =VLOOKUP(RC[-3],'[screener-data-1401-11-24.xlsx]overview'!R8C2:R902C7,6,0) -> 3174500000000 | F463: 2300.7246376811595 | G463: =VLOOKUP(RC[-5],'[screener-data-1401-11-24.xlsx]overview'!R8C2:R897C8,7,FALSE) -> 58.271063917399999 | I463: =IF(RC[-1]="",((RC[-2]+RC[-3])/2)*0.65,RC[-1]) -> 766.67360301953192 | J463: =RC[-1]*RC[-5]/R488C5 -> 0.13904203927481176 | M463: 665.33948030176032 | N463: -600.75685903500471
A464: شیمیایی سینا | B464: شسینا | C464: شیمیایی | D464: -3.88247639034627 | E464: =VLOOKUP(RC[-3],'[screener-data-1401-11-24.xlsx]overview'!R8C2:R902C7,6,0) -> 6529065922500 | F464: 15.266666666666667 | G464: =VLOOKUP(RC[-5],'[screener-data-1401-11-24.xlsx]overview'!R8C2:R897C8,7,FALSE) -> 12.379947292900001 | I464: =IF(RC[-1]="",((RC[-2]+RC[-3])/2)*0.65,RC[-1]) -> 8.9851495368591667 | J464: =RC[-1]*RC[-5]/R488C5 -> 3.351480136496878E-3 | M464: 2.759158492251796 | N464: 1.5327667885861755
A465: شیمیایی فارس | B465: شفارس | C465: شیمیایی | D465: -1.3104013104013099 | E465: =VLOOKUP(RC[-3],'[screener-data-1401-11-24.xlsx]overview'!R8C2:R902C7,6,0) -> 13969161180000 | F465: 75.3125 | G465: =VLOOKUP(RC[-5],'[screener-data-1401-11-24.xlsx]overview'!R8C2:R897C8,7,FALSE) -> 48.689477661799998 | I465: =IF(RC[-1]="",((RC[-2]+RC[-3])/2)*0.65,RC[-1]) -> 40.300642740085003 | J465: =RC[-1]*RC[-5]/R488C5 -> 3.2161965951451099E-2 | M465: 2.4357990250737407 | N465: 1.1706202332576248
A466: صنایع بهداشتی ساینا | B466: ساینا | C466: شیمیایی | D466: 5.3475935828876997 | E466: =VLOOKUP(RC[-3],'[screener-data-1401-11-24.xlsx]overview'!R8C2:R902C7,6,0) -> 7200000000000 | F466: 57.490272373540854 | G466: =VLOOKUP(RC[-5],'[screener-data-1401-11-24.xlsx]overview'!R8C2:R897C8,7,FALSE) -> 167.66312866679999 | I466: =IF(RC[-1]="",((RC[-2]+RC[-3])/2)*0.65,RC[-1]) -> 73.174855338110774 | J466: =RC[-1]*RC[-5]/R488C5 -> 3.0099179421674182E-2 | M466: 1.9370611786194594 | N466: 6.4612195633921079
A467: صنایع پتروشیمی تخت جمشید | B467: شجم | C467: شیمیایی | D467: 0 | E467: =VLOOKUP(RC[-3],'[screener-data-1401-11-24.xlsx]overview'!R8C2:R902C7,6,0) -> 51090000000000 | F467: 8.9155251141552512 | G467: =VLOOKUP(RC[-5],'[screener-data-1401-11-24.xlsx]overview'!R8C2:R897C8,7,FALSE) -> 11.9099194891 | I467: =IF(RC[-1]="",((RC[-2]+RC[-3])/2)*0.65,RC[-1]) -> 6.7682694960579566 | J467: =RC[-1]*RC[-5]/R488C5 -> 1.9754854369152659E-2 | M467: 1.8574423174791708 | N467: 5.7850513543675284
A468: صنایع پتروشیمی خلیج فارس | B468: فارس | C468: شیمیایی | D468: -0.97508125677139001 | E468: =VLOOKUP(RC[-3],'[screener-data-1401-11-24.xlsx]overview'!R8C2:R902C7,6,0) -> 4420185000000000 | F468: 8.0245829675153644 | G468: =VLOOKUP(RC[-5],'[screener-data-1401-11-24.xlsx]overview'!R8C2:R897C8,7,FALSE) -> 7.4860171008999998 | I468: =IF(RC[-1]="",((RC[-2]+RC[-3])/2)*0.65,RC[-1]) -> 5.0409450222349932 | J468: =RC[-1]*RC[-5]/R488C5 -> 1.2729539535427672 | K468: 1.3 | M468: 8.5222901996133285 | N468: 4.9155336360701645
A469: صنایع پتروشیمی دهدشت | B469: دهدشت | C469: شیمیایی | D469: 2.90748898678414 | E469: =VLOOKUP(RC[-3],'[screener-data-1401-11-24.xlsx]overview'!R8C2:R902C7,6,0) -> 17988882300000 | F469: -1297.7777777777778 | G469: =VLOOKUP(RC[-5],'[screener-data-1401-11-24.xlsx]overview'!R8C2:R897C8,7,FALSE) -> 0 | I469: =IF(RC[-1]="",((RC[-2]+RC[-3])/2)*0.65,RC[-1]) -> -421.77777777777783 | J469: =RC[-1]*RC[-5]/R488C5 -> -0.43345913641090966 | N469: 12.565260354322945
A470: صنایع پتروشیمی گلستان | B470: شستان | C470: شیمیایی | D470: 1.9572953736654799 | E470: =VLOOKUP(RC[-3],'[screener-data-1401-11-24.xlsx]overview'!R8C2:R902C7,6,0) -> 2710290000000 | F470: 818.57142857142856 | G470: =VLOOKUP(RC[-5],'[screener-data-1401-11-24.xlsx]overview'!R8C2:R897C8,7,FALSE) -> 0 | I470: =IF(RC[-1]="",((RC[-2]+RC[-3])/2)*0.65,RC[-1]) -> 266.03571428571428 | J470: =RC[-1]*RC[-5]/R488C5 -> 4.1192295325907784E-2 | N470: 6.7371380418652169
A471: صنایع پتروشیمی کرمانشاه | B471: کرماشا | C471: شیمیایی | D471: -2.9402102496714799 | E471: =VLOOKUP(RC[-3],'[screener-data-1401-11-24.xlsx]overview'!R8C2:R902C7,6,0) -> 198341040000000 | F471: 5.3090745732255167 | G471: =VLOOKUP(RC[-5],'[screener-data-1401-11-24.xlsx]overview'!R8C2:R897C8,7,FALSE) -> 3.2917914346999999 | I471: =IF(RC[-1]="",((RC[-2]+RC[-3])/2)*0.65,RC[-1]) -> 2.795281452575793 | J471: =RC[-1]*RC[-5]/R488C5 -> 3.1673672058810727E-2 | M471: 3.4122828545966821 | N471: 2.6235963791324246
A472: صنایع شیمیایی ایران | B472: شیران | C472: شیمیایی | D472: -0.2016129032258 | E472: =VLOOKUP(RC[-3],'[screener-data-1401-11-24.xlsx]overview'!R8C2:R902C7,6,0) -> 187983432000000 | F472: 3.9099526066350712 | G472: =VLOOKUP(RC[-5],'[screener-data-1401-11-24.xlsx]overview'!R8C2:R897C8,7,FALSE) -> 8.6634532051999997 | I472: =IF(RC[-1]="",((RC[-2]+RC[-3])/2)*0.65,RC[-1]) -> 4.0863568888463986 | J472: =RC[-1]*RC[-5]/R488C5 -> 4.3885005271037981E-2 | M472: 3.6350381941324663 | N472: 6.1838114302397864
A473: صنایع شیمیایی کیمیاگران امروز | B473: شکام | C473: شیمیایی | D473: 0.14388489208633001 | E473: =VLOOKUP(RC[-3],'[screener-data-1401-11-24.xlsx]overview'!R8C2:R902C7,6,0) -> 28360000000000 | F473: 1.7330677290836654 | G473: =VLOOKUP(RC[-5],'[screener-data-1401-11-24.xlsx]overview'!R8C2:R897C8,7,FALSE) -> 5.7406527759000001 | H473: 6 | I473: =IF(RC[-1]="",((RC[-2]+RC[-3])/2)*0.65,RC[-1]) -> 6 | J473: =RC[-1]*RC[-5]/R488C5 -> 9.7211526697990273E-3 | M473: 1.5167337574376614 | N473: 3.6144859873752653
A474: صنایع کشاورزی و کود زنجان | B474: زنجان | C474: شیمیایی | D474: -2.29837024655244 | E474: =VLOOKUP(RC[-3],'[screener-data-1401-11-24.xlsx]overview'!R8C2:R902C7,6,0) -> 10810625000000 | F474: -111.33333333333333 | G474: =VLOOKUP(RC[-5],'[screener-data-1401-11-24.xlsx]overview'!R8C2:R897C8,7,FALSE) -> 0 | I474: =IF(RC[-1]="",((RC[-2]+RC[-3])/2)*0.65,RC[-1]) -> -36.18333333333333 | J474: =RC[-1]*RC[-5]/R488C5 -> -2.234702231544174E-2 | N474: 2.3112536072357761
A475: صنعتی دوده فام | B475: شصدف | C475: شیمیایی | D475: -0.32206119162640001 | E475: =VLOOKUP(RC[-3],'[screener-data-1401-11-24.xlsx]overview'!R8C2:R902C7,6,0) -> 21000000000000 | F475: 9.8661141217723944 | G475: =VLOOKUP(RC[-5],'[screener-data-1401-11-24.xlsx]overview'!R8C2:R897C8,7,FALSE) -> 7.1230194375 | I475: =IF(RC[-1]="",((RC[-2]+RC[-3])/2)*0.65,RC[-1]) -> 5.5214684067635291 | J475: =RC[-1]*RC[-5]/R488C5 -> 6.6242112377528535E-3 | M475: 2.0451268351508829 | N475: 5.4447751771531054
A476: گروه صنعتی پاکشو | B476: پاکشو | C476: شیمیایی | D476: -0.66889632107023 | E476: =VLOOKUP(RC[-3],'[screener-data-1401-11-24.xlsx]overview'!R8C2:R902C7,6,0) -> 284160000000000 | F476: 46.046511627906973 | G476: =VLOOKUP(RC[-5],'[screener-data-1401-11-24.xlsx]overview'!R8C2:R897C8,7,FALSE) -> 34.350541925599998 | I476: =IF(RC[-1]="",((RC[-2]+RC[-3])/2)*0.65,RC[-1]) -> 26.129042404889763 | J476: =RC[-1]*RC[-5]/R488C5 -> 0.42417661753873903 | M476: 5.5512982146614513 | N476: 4.4853483575723105
A477: گسترش نفت و گاز پارسیان | B477: پارسان | C477: شیمیایی | D477: -1.1977986403366701 | E477: =VLOOKUP(RC[-3],'[screener-data-1401-11-24.xlsx]overview'!R8C2:R902C7,6,0) -> 1209735000000000 | F477: 5.4267425320056901 | G477: =VLOOKUP(RC[-5],'[screener-data-1401-11-24.xlsx]overview'!R8C2:R897C8,7,FALSE) -> 5.2535323245000001 | I477: =IF(RC[-1]="",((RC[-2]+RC[-3])/2)*0.65,RC[-1]) -> 3.4710893283643496 | J477: =RC[-1]*RC[-5]/R488C5 -> 0.23989230812530063 | K477: 0.6 | M477: 5.5052414815077562 | N477: 3.7836283260037051
A478: گلتاش | B478: شگل | C478: شیمیایی | D478: 6.9597069597069501 | E478: =VLOOKUP(RC[-3],'[screener-data-1401-11-24.xlsx]overview'!R8C2:R902C7,6,0) -> 14872000000000 | F478: 15.449735449735449 | G478: =VLOOKUP(RC[-5],'[screener-data-1401-11-24.xlsx]overview'!R8C2:R897C8,7,FALSE) -> 19.829454007300001 | I478: =IF(RC[-1]="",((RC[-2]+RC[-3])/2)*0.65,RC[-1]) -> 11.465736573536521 | J478: =RC[-1]*RC[-5]/R488C5 -> 9.7416298369517734E-3 | M478: 1.3548845399054275 | N478: 3.3052893118602724
A479: لعابیران | B479: شلعاب | C479: شیمیایی | D479: -0.15243902439024001 | E479: =VLOOKUP(RC[-3],'[screener-data-1401-11-24.xlsx]overview'!R8C2:R902C7,6,0) -> 3882000000000 | F479: 62.980769230769234 | G479: =VLOOKUP(RC[-5],'[screener-data-1401-11-24.xlsx]overview'!R8C2:R897C8,7,FALSE) -> 45.4610029834 | I479: =IF(RC[-1]="",((RC[-2]+RC[-3])/2)*0.65,RC[-1]) -> 35.243575969605004 | J479: =RC[-1]*RC[-5]/R488C5 -> 7.8162021918805821E-3 | M479: 2.9044996094076225 | N479: 5.5647435970049504
A480: مدیریت صنعت شوینده ت.ص بهشهر | B480: شوینده | C480: شیمیایی | D480: 0.12004801920768 | E480: =VLOOKUP(RC[-3],'[screener-data-1401-11-24.xlsx]overview'!R8C2:R902C7,6,0) -> 16370000000000 | F480: 5.9275053304904048 | G480: =VLOOKUP(RC[-5],'[screener-data-1401-11-24.xlsx]overview'!R8C2:R897C8,7,FALSE) -> 8.0713644811999998 | I480: =IF(RC[-1]="",((RC[-2]+RC[-3])/2)*0.65,RC[-1]) -> 4.5496326887993819 | J480: =RC[-1]*RC[-5]/R488C5 -> 4.2548602651280186E-3 | K480: 0.6 | M480: 5.5326190682313232 | N480: 3.9676847774350059
A481: معدنی املاح ایران | B481: شاملا | C481: شیمیایی | D481: -0.60396893874029001 | E481: =VLOOKUP(RC[-3],'[screener-data-1401-11-24.xlsx]overview'!R8C2:R902C7,6,0) -> 31104000000000 | F481: 2.5963488843813387 | G481: =VLOOKUP(RC[-5],'[screener-data-1401-11-24.xlsx]overview'!R8C2:R897C8,7,FALSE) -> 7.7748659243000002 | H481: 9.5 | I481: =IF(RC[-1]="",((RC[-2]+RC[-3])/2)*0.65,RC[-1]) -> 9.5 | J481: =RC[-1]*RC[-5]/R488C5 -> 1.6881076399233516E-2 | M481: 5.1805695994968666 | N481: 4.9312965311442669
A482: مواد ویژه لیا | B482: شلیا | C482: شیمیایی | D482: 0.71647901740020004 | E482: =VLOOKUP(RC[-3],'[screener-data-1401-11-24.xlsx]overview'!R8C2:R902C7,6,0) -> 3952098000000 | F482: 139.77272727272728 | G482: =VLOOKUP(RC[-5],'[screener-data-1401-11-24.xlsx]overview'!R8C2:R897C8,7,FALSE) -> 185.0381275252 | I482: =IF(RC[-1]="",((RC[-2]+RC[-3])/2)*0.65,RC[-1]) -> 105.56352780932637 | J482: =RC[-1]*RC[-5]/R488C5 -> 2.3834271792062586E-2 | M482: 8.1201747238542179 | N482: 7.6919315214237356
A483: نیروکلر | B483: شکلر | C483: شیمیایی | D483: -0.45118949958982002 | E483: =VLOOKUP(RC[-3],'[screener-data-1401-11-24.xlsx]overview'!R8C2:R902C7,6,0) -> 23760000000000 | F483: 5.7868383404864092 | G483: =VLOOKUP(RC[-5],'[screener-data-1401-11-24.xlsx]overview'!R8C2:R897C8,7,FALSE) -> 5.6750792960999998 | H483: 5.0999999999999996 | I483: =IF(RC[-1]="",((RC[-2]+RC[-3])/2)*0.65,RC[-1]) -> 5.0999999999999996 | J483: =RC[-1]*RC[-5]/R488C5 -> 6.9227221198611124E-3 | M483: 3.0331676318146914 | N483: 10.580815721165207
A484: کربن ایران | B484: شکربن | C484: شیمیایی | D484: -0.98552510009239003 | E484: =VLOOKUP(RC[-3],'[screener-data-1401-11-24.xlsx]overview'!R8C2:R902C7,6,0) -> 20189774736000 | F484: 7.7469879518072293 | G484: =VLOOKUP(RC[-5],'[screener-data-1401-11-24.xlsx]overview'!R8C2:R897C8,7,FALSE) -> 6.2356980006000002 | H484: 5.8 | I484: =IF(RC[-1]="",((RC[-2]+RC[-3])/2)*0.65,RC[-1]) -> 5.8 | J484: =RC[-1]*RC[-5]/R488C5 -> 6.6899019684387795E-3 | M484: 1.8305842585452052 | N484: 2.3988400554504694
A485: کف | B485: شکف | C485: شیمیایی | D485: 0 | E485: =VLOOKUP(RC[-3],'[screener-data-1401-11-24.xlsx]overview'!R8C2:R902C7,6,0) -> 10062500000000 | F485: -14.202540578687367 | G485: =VLOOKUP(RC[-5],'[screener-data-1401-11-24.xlsx]overview'!R8C2:R897C8,7,FALSE) -> 0 | I485: =IF(RC[-1]="",((RC[-2]+RC[-3])/2)*0.65,RC[-1]) -> -4.6158256880733948 | J485: =RC[-1]*RC[-5]/R488C5 -> -2.6534785422402444E-3 | M485: 219.56142264891992 | N485: -1.6259578002346227
A486: کلر پارس | B486: کلر | C486: شیمیایی | D486: 0.56529112492932998 | E486: =VLOOKUP(RC[-3],'[screener-data-1401-11-24.xlsx]overview'!R8C2:R902C7,6,0) -> 28934625000000 | F486: 16.830652790917693 | G486: =VLOOKUP(RC[-5],'[screener-data-1401-11-24.xlsx]overview'!R8C2:R897C8,7,FALSE) -> 9.5182883806999996 | I486: =IF(RC[-1]="",((RC[-2]+RC[-3])/2)*0.65,RC[-1]) -> 8.5634058807757505 | J486: =RC[-1]*RC[-5]/R488C5 -> 1.4155482390230912E-2 | M486: 6.2203315204034153 | N486: 11.651569141372912
A487: کود شیمیایی اوره لردگان | B487: شلرد | C487: شیمیایی | D487: 0.74812967581046996 | E487: =VLOOKUP(RC[-3],'[screener-data-1401-11-24.xlsx]overview'!R8C2:R902C7,6,0) -> 68940000000000 | F487: -37.93427230046948 | G487: =VLOOKUP(RC[-5],'[screener-data-1401-11-24.xlsx]overview'!R8C2:R897C8,7,FALSE) -> 27.068904864099999 | I487: =IF(RC[-1]="",((RC[-2]+RC[-3])/2)*0.65,RC[-1]) -> -3.5312444168200816 | J487: =RC[-1]*RC[-5]/R488C5 -> -1.3907829068313006E-2 | N487: 9.050351541191981
E488: =SUM(R[-68]C:R[-1]C) -> 1.7504097073656784E+16 | I488: =IF(RC[-1]="",((RC[-2]+RC[-3])/2)*0.65,RC[-1]) -> 0 | J488: =SUM(R[-68]C:R[-1]C) -> 5.0300989663672855
A489: برق آبادان | B489: آبادا | C489: عرضه برق،گاز،بخار و آب گرم | D489: -0.48355899419728998 | E489: =VLOOKUP(RC[-3],'[screener-data-1401-11-24.xlsx]overview'!R8C2:R902C7,6,0) -> 24875000000000 | F489: 18.021015761821367 | G489: =VLOOKUP(RC[-5],'[screener-data-1401-11-24.xlsx]overview'!R8C2:R897C8,7,FALSE) -> 951.61352212120005 | I489: =IF(RC[-1]="",((RC[-2]+RC[-3])/2)*0.65,RC[-1]) -> 315.13122481198195 | J489: =RC[-1]*RC[-5]/R501C5 -> 5.439462316519438 | M489: 7.8326072123317054 | N489: 9.9495733576532235
A490: پیوند گستر پارس | B490: بپیوند | C490: عرضه برق،گاز،بخار و آب گرم | D490: 5.71428571428571 | E490: =VLOOKUP(RC[-3],'[screener-data-1401-11-24.xlsx]overview'!R8C2:R902C7,6,0) -> 30960000000000 | F490: 16.903553299492387 | G490: =VLOOKUP(RC[-5],'[screener-data-1401-11-24.xlsx]overview'!R8C2:R897C8,7,FALSE) -> 17.558140201400001 | I490: =IF(RC[-1]="",((RC[-2]+RC[-3])/2)*0.65,RC[-1]) -> 11.200050387790027 | J490: =RC[-1]*RC[-5]/R501C5 -> 0.24061482060919803 | M490: 9.4219802191860058 | N490: 6.6404872969937445
A491: توسعه مسیر برق گیلان | B491: بگیلان | C491: عرضه برق،گاز،بخار و آب گرم | D491: -1.14591291061879 | E491: =VLOOKUP(RC[-3],'[screener-data-1401-11-24.xlsx]overview'!R8C2:R902C7,6,0) -> 53492000000000 | F491: 16.154806491885143 | G491: =VLOOKUP(RC[-5],'[screener-data-1401-11-24.xlsx]overview'!R8C2:R897C8,7,FALSE) -> 14.628080475899999 | I491: =IF(RC[-1]="",((RC[-2]+RC[-3])/2)*0.65,RC[-1]) -> 10.004438264530172 | J491: =RC[-1]*RC[-5]/R501C5 -> 0.37134962536137861 | M491: 8.0906457089057149 | N491: 8.5562046630869482
A492: تولید برق دماوند | B492: دماوند | C492: عرضه برق،گاز،بخار و آب گرم | D492: -0.28425241614552998 | E492: =VLOOKUP(RC[-3],'[screener-data-1401-11-24.xlsx]overview'!R8C2:R902C7,6,0) -> 96268800000000 | F492: 15.844625112917797 | G492: =VLOOKUP(RC[-5],'[screener-data-1401-11-24.xlsx]overview'!R8C2:R897C8,7,FALSE) -> 16.652120458700001 | I492: =IF(RC[-1]="",((RC[-2]+RC[-3])/2)*0.65,RC[-1]) -> 10.561442310775783 | J492: =RC[-1]*RC[-5]/R501C5 -> 0.70552147091511985 | M492: 8.0182823940859649 | N492: 6.7247178708282798
A493: تولید برق عسلویه مپنا | B493: بمپنا | C493: عرضه برق،گاز،بخار و آب گرم | D493: -0.17825311942958999 | E493: =VLOOKUP(RC[-3],'[screener-data-1401-11-24.xlsx]overview'!R8C2:R902C7,6,0) -> 43122240000000 | F493: 15.217391304347826 | G493: =VLOOKUP(RC[-5],'[screener-data-1401-11-24.xlsx]overview'!R8C2:R897C8,7,FALSE) -> 25.177109077000001 | I493: =IF(RC[-1]="",((RC[-2]+RC[-3])/2)*0.65,RC[-1]) -> 13.128212623938044 | J493: =RC[-1]*RC[-5]/R501C5 -> 0.39283335836948513 | M493: 8.4044208036447738 | N493: 3.3698534200039418
A494: تولید برق ماهتاب کهنوج | B494: بکهنوج | C494: عرضه برق،گاز،بخار و آب گرم | D494: -0.14925373134327999 | E494: =VLOOKUP(RC[-3],'[screener-data-1401-11-24.xlsx]overview'!R8C2:R902C7,6,0) -> 21523714509753 | F494: -2.2563237774030354 | G494: =VLOOKUP(RC[-5],'[screener-data-1401-11-24.xlsx]overview'!R8C2:R897C8,7,FALSE) -> 0 | I494: =IF(RC[-1]="",((RC[-2]+RC[-3])/2)*0.65,RC[-1]) -> -0.73330522765598649 | J494: =RC[-1]*RC[-5]/R501C5 -> -1.0952252545564239E-2 | M494: 7.1301929593724136 | N494: -9.4172605844380506
A495: سر. نیرو | B495: ونیرو | C495: عرضه برق،گاز،بخار و آب گرم | D495: 1.29986553115194 | E495: =VLOOKUP(RC[-3],'[screener-data-1401-11-24.xlsx]overview'!R8C2:R902C7,6,0) -> 23478000000000 | F495: 61.081081081081081 | G495: =VLOOKUP(RC[-5],'[screener-data-1401-11-24.xlsx]overview'!R8C2:R897C8,7,FALSE) -> 91.663029244900002 | I495: =IF(RC[-1]="",((RC[-2]+RC[-3])/2)*0.65,RC[-1]) -> 49.641835855943846 | J495: =RC[-1]*RC[-5]/R501C5 -> 0.80874270830750217 | K495: 1.7 | M495: 39.946199724265171 | N495: 1.6309227909604402
A496: فجر انرژی خلیج فارس | B496: بفجر | C496: عرضه برق،گاز،بخار و آب گرم | D496: -0.10471204188480999 | E496: =VLOOKUP(RC[-3],'[screener-data-1401-11-24.xlsx]overview'!R8C2:R902C7,6,0) -> 370695000000000 | F496: 4.3373493975903612 | G496: =VLOOKUP(RC[-5],'[screener-data-1401-11-24.xlsx]overview'!R8C2:R897C8,7,FALSE) -> 5.6885420215 | I496: =IF(RC[-1]="",((RC[-2]+RC[-3])/2)*0.65,RC[-1]) -> 3.2584147112043671 | J496: =RC[-1]*RC[-5]/R501C5 -> 0.83815536958581505 | M496: 3.1812360869551202 | N496: 5.5724772285314605
A497: مبین انرژی خلیج فارس | B497: مبین | C497: عرضه برق،گاز،بخار و آب گرم | D497: -0.52287581699345997 | E497: =VLOOKUP(RC[-3],'[screener-data-1401-11-24.xlsx]overview'!R8C2:R902C7,6,0) -> 603492388800000 | F497: 4.5123035873109991 | G497: =VLOOKUP(RC[-5],'[screener-data-1401-11-24.xlsx]overview'!R8C2:R897C8,7,FALSE) -> 5.9957132618999998 | I497: =IF(RC[-1]="",((RC[-2]+RC[-3])/2)*0.65,RC[-1]) -> 3.4151054759935748 | J497: =RC[-1]*RC[-5]/R501C5 -> 1.4301360828968592 | M497: 1.6781500949699324 | N497: 5.9189830645789225
A498: مدیریت انرژی امید تابان هور | B498: وهور | C498: عرضه برق،گاز،بخار و آب گرم | D498: 3.7946428571428501 | E498: =VLOOKUP(RC[-3],'[screener-data-1401-11-24.xlsx]overview'!R8C2:R902C7,6,0) -> 102609453201000 | F498: 32.441860465116278 | G498: =VLOOKUP(RC[-5],'[screener-data-1401-11-24.xlsx]overview'!R8C2:R897C8,7,FALSE) -> 36.984630904799999 | I498: =IF(RC[-1]="",((RC[-2]+RC[-3])/2)*0.65,RC[-1]) -> 22.563609695222791 | J498: =RC[-1]*RC[-5]/R501C5 -> 1.6065616565856016 | K498: 1.5 | M498: 32.108211517159987 | N498: 1.2299744405606094
A499: نیروگاه زاگرس کوثر | B499: بزاگرس | C499: عرضه برق،گاز،بخار و آب گرم | D499: -2.54047322540473 | E499: =VLOOKUP(RC[-3],'[screener-data-1401-11-24.xlsx]overview'!R8C2:R902C7,6,0) -> 23394000000000 | F499: 19.862944162436548 | G499: =VLOOKUP(RC[-5],'[screener-data-1401-11-24.xlsx]overview'!R8C2:R897C8,7,FALSE) -> 20.562943972700001 | I499: =IF(RC[-1]="",((RC[-2]+RC[-3])/2)*0.65,RC[-1]) -> 13.138413643919378 | J499: =RC[-1]*RC[-5]/R501C5 -> 0.21327937628027926 | M499: 9.522283758215595 | N499: 2.7843307098940393
A500: نیروگاهی جهرم | B500: بجهرم | C500: عرضه برق،گاز،بخار و آب گرم | D500: 0.47796070100901999 | E500: =VLOOKUP(RC[-3],'[screener-data-1401-11-24.xlsx]overview'!R8C2:R902C7,6,0) -> 47204124220310 | F500: 18.019047619047619 | G500: =VLOOKUP(RC[-5],'[screener-data-1401-11-24.xlsx]overview'!R8C2:R897C8,7,FALSE) -> 16.395291334500001 | I500: =IF(RC[-1]="",((RC[-2]+RC[-3])/2)*0.65,RC[-1]) -> 11.184660159902977 | J500: =RC[-1]*RC[-5]/R501C5 -> 0.36635673756922182 | M500: 8.0194096679569213 | N500: 1.4600881104644696
E501: =SUM(R[-12]C:R[-1]C) -> 1441114720731063 | I501: =IF(RC[-1]="",((RC[-2]+RC[-3])/2)*0.65,RC[-1]) -> 0 | J501: =SUM(R[-12]C:R[-1]C) -> 12.402061270454334
A502: بهنوش | B502: غبهنوش | C502: غذایی بجز قند وشکر | D502: 0.44061686360905 | E502: =VLOOKUP(RC[-3],'[screener-data-1401-11-24.xlsx]overview'!R8C2:R902C7,6,0) -> 17892000000000 | F502: 13.43423519957139 | G502: =VLOOKUP(RC[-5],'[screener-data-1401-11-24.xlsx]overview'!R8C2:R897C8,7,FALSE) -> 19.6790921847 | I502: =IF(RC[-1]="",((RC[-2]+RC[-3])/2)*0.65,RC[-1]) -> 10.761831399888202 | J502: =RC[-1]*RC[-5]/R546C5 -> 0.18881919590876087 | M502: 0.89959643727123606 | N502: 8.1027624522637609
A503: بیسکویت گرجی | B503: غگرجی | C503: غذایی بجز قند وشکر | D503: 0.24752475247524 | E503: =VLOOKUP(RC[-3],'[screener-data-1401-11-24.xlsx]overview'!R8C2:R902C7,6,0) -> 6123750000000 | F503: 43.783783783783782 | G503: =VLOOKUP(RC[-5],'[screener-data-1401-11-24.xlsx]overview'!R8C2:R897C8,7,FALSE) -> 0 | I503: =IF(RC[-1]="",((RC[-2]+RC[-3])/2)*0.65,RC[-1]) -> 14.22972972972973 | J503: =RC[-1]*RC[-5]/R546C5 -> 8.5450611384611269E-2 | M503: 2.1923453764969749 | N503: 1.5525180437097079
A504: پارس مینو | B504: غپینو | C504: غذایی بجز قند وشکر | D504: 2.7260638297872299 | E504: =VLOOKUP(RC[-3],'[screener-data-1401-11-24.xlsx]overview'!R8C2:R902C7,6,0) -> 28161000000000 | F504: 23.953488372093023 | G504: =VLOOKUP(RC[-5],'[screener-data-1401-11-24.xlsx]overview'!R8C2:R897C8,7,FALSE) -> 7.4382767548000004 | H504: 4.5 | I504: =IF(RC[-1]="",((RC[-2]+RC[-3])/2)*0.65,RC[-1]) -> 4.5 | J504: =RC[-1]*RC[-5]/R546C5 -> 0.12426867187125284 | M504: 2.6554487880325484 | N504: 2.0719943918316481
A505: پاکدیس | B505: غدیس | C505: غذایی بجز قند وشکر | D505: 5.1835853131749401 | E505: =VLOOKUP(RC[-3],'[screener-data-1401-11-24.xlsx]overview'!R8C2:R902C7,6,0) -> 26899394516000 | F505: 18.905279503105589 | G505: =VLOOKUP(RC[-5],'[screener-data-1401-11-24.xlsx]overview'!R8C2:R897C8,7,FALSE) -> 18.021828158200002 | I505: =IF(RC[-1]="",((RC[-2]+RC[-3])/2)*0.65,RC[-1]) -> 12.001309989924318 | J505: =RC[-1]*RC[-5]/R546C5 -> 0.31657180213147273 | M505: 2.8191430684218757 | N505: 6.5986120514556532
A506: پگاه آذربایجان شرقی | B506: غپآذر | C506: غذایی بجز قند وشکر | D506: 2.9972752043596702 | E506: =VLOOKUP(RC[-3],'[screener-data-1401-11-24.xlsx]overview'!R8C2:R902C7,6,0) -> 7460000000000 | F506: 21.811886901327178 | G506: =VLOOKUP(RC[-5],'[screener-data-1401-11-24.xlsx]overview'!R8C2:R897C8,7,FALSE) -> 9.5297897310999993 | I506: =IF(RC[-1]="",((RC[-2]+RC[-3])/2)*0.65,RC[-1]) -> 10.186044905538832 | J506: =RC[-1]*RC[-5]/R546C5 -> 7.4515305164830778E-2 | M506: 0.7124686633946512 | N506: 7.3441124698366806
A507: پگاه آذربایجان غربی | B507: غشاذر | C507: غذایی بجز قند وشکر | D507: 5.4794520547945202 | E507: =VLOOKUP(RC[-3],'[screener-data-1401-11-24.xlsx]overview'!R8C2:R902C7,6,0) -> 6642757814000 | F507: 18.148148148148149 | G507: =VLOOKUP(RC[-5],'[screener-data-1401-11-24.xlsx]overview'!R8C2:R897C8,7,FALSE) -> 11.0904445159 | I507: =IF(RC[-1]="",((RC[-2]+RC[-3])/2)*0.65,RC[-1]) -> 9.5025426158156492 | J507: =RC[-1]*RC[-5]/R546C5 -> 6.1899809910822334E-2 | M507: 1.0126480619947054 | N507: 3.4080543359255957
A508: پگاه اصفهان | B508: غشصفا | C508: غذایی بجز قند وشکر | D508: -0.72202166064980999 | E508: =VLOOKUP(RC[-3],'[screener-data-1401-11-24.xlsx]overview'!R8C2:R902C7,6,0) -> 16089546030250 | F508: 18.689320388349515 | G508: =VLOOKUP(RC[-5],'[screener-data-1401-11-24.xlsx]overview'!R8C2:R897C8,7,FALSE) -> 8.9937367623999993 | I508: =IF(RC[-1]="",((RC[-2]+RC[-3])/2)*0.65,RC[-1]) -> 8.996993573993592 | J508: =RC[-1]*RC[-5]/R546C5 -> 0.14195224694387293 | M508: 0.86263087161792518 | N508: 5.8002899254340701
A509: پگاه خراسان | B509: غشان | C509: غذایی بجز قند وشکر | D509: -0.16 | E509: =VLOOKUP(RC[-3],'[screener-data-1401-11-24.xlsx]overview'!R8C2:R902C7,6,0) -> 9617414558960 | F509: 30.439024390243901 | G509: =VLOOKUP(RC[-5],'[screener-data-1401-11-24.xlsx]overview'!R8C2:R897C8,7,FALSE) -> 9.7168799859000003 | I509: =IF(RC[-1]="",((RC[-2]+RC[-3])/2)*0.65,RC[-1]) -> 13.050668922246768 | J509: =RC[-1]*RC[-5]/R546C5 -> 0.12308132971660438 | M509: 1.5812036836388592 | N509: 3.6141508401854239
A510: پگاه فارس | B510: غفارس | C510: غذایی بجز قند وشکر | D510: 4.7508690614136704 | E510: =VLOOKUP(RC[-3],'[screener-data-1401-11-24.xlsx]overview'!R8C2:R902C7,6,0) -> 11458872570080 | F510: 56.855345911949684 | G510: =VLOOKUP(RC[-5],'[screener-data-1401-11-24.xlsx]overview'!R8C2:R897C8,7,FALSE) -> 10.436209787899999 | I510: =IF(RC[-1]="",((RC[-2]+RC[-3])/2)*0.65,RC[-1]) -> 21.869755602451146 | J510: =RC[-1]*RC[-5]/R546C5 -> 0.2457462447168057 | M510: 1.0626078809821775 | N510: 5.0771979676946355
A511: پنبه و دانه های روغنی خراسان | B511: غدانه | C511: غذایی بجز قند وشکر | D511: 4.4810242341106497 | E511: =VLOOKUP(RC[-3],'[screener-data-1401-11-24.xlsx]overview'!R8C2:R902C7,6,0) -> 11772000000000 | F511: 34.621212121212125 | G511: =VLOOKUP(RC[-5],'[screener-data-1401-11-24.xlsx]overview'!R8C2:R897C8,7,FALSE) -> 9.1685538509000004 | I511: =IF(RC[-1]="",((RC[-2]+RC[-3])/2)*0.65,RC[-1]) -> 14.231673940936441 | J511: =RC[-1]*RC[-5]/R546C5 -> 0.16428855471336362 | M511: 5.3848023674103151 | N511: 6.8109257427491432
A512: تبرک | B512: تبرک | C512: غذایی بجز قند وشکر | D512: -1.4145810663764899 | E512: =VLOOKUP(RC[-3],'[screener-data-1401-11-24.xlsx]overview'!R8C2:R902C7,6,0) -> 20619098835720 | F512: 35.116279069767444 | G512: =VLOOKUP(RC[-5],'[screener-data-1401-11-24.xlsx]overview'!R8C2:R897C8,7,FALSE) -> 31.186911910500001 | I512: =IF(RC[-1]="",((RC[-2]+RC[-3])/2)*0.65,RC[-1]) -> 21.548537068586921 | J512: =RC[-1]*RC[-5]/R546C5 -> 0.43570098530005935 | M512: 20.263505451396476 | N512: 4.5833560013901442
A513: توسعه صنایع بهشهر | B513: وبشهر | C513: غذایی بجز قند وشکر | D513: -1.6923076923076901 | E513: =VLOOKUP(RC[-3],'[screener-data-1401-11-24.xlsx]overview'!R8C2:R902C7,6,0) -> 95100000000000 | F513: 13.42436974789916 | G513: =VLOOKUP(RC[-5],'[screener-data-1401-11-24.xlsx]overview'!R8C2:R897C8,7,FALSE) -> 13.6420688965 | I513: =IF(RC[-1]="",((RC[-2]+RC[-3])/2)*0.65,RC[-1]) -> 8.7965925594297278 | J513: =RC[-1]*RC[-5]/R546C5 -> 0.82034410986793094 | K513: 0.43 | M513: 12.978531734710415 | N513: 4.2341042185990485
A514: خودکفایی آزادگان | B514: خودکفا | C514: غذایی بجز قند وشکر | D514: -1.5831134564643701 | E514: =VLOOKUP(RC[-3],'[screener-data-1401-11-24.xlsx]overview'!R8C2:R902C7,6,0) -> 58950000000000 | F514: 35.355450236966824 | G514: =VLOOKUP(RC[-5],'[screener-data-1401-11-24.xlsx]overview'!R8C2:R897C8,7,FALSE) -> 41.475400982899998 | I514: =IF(RC[-1]="",((RC[-2]+RC[-3])/2)*0.65,RC[-1]) -> 24.970026646456716 | J514: =RC[-1]*RC[-5]/R546C5 -> 1.4434571154461526 | K514: 0.6 | M514: 14.370174144936112 | N514: 7.2182297262568618
A515: خوراک دام پارس | B515: غدام | C515: غذایی بجز قند وشکر | D515: 0.90909090909089996 | E515: =VLOOKUP(RC[-3],'[screener-data-1401-11-24.xlsx]overview'!R8C2:R902C7,6,0) -> 7160000000000 | F515: 137.52212389380531 | G515: =VLOOKUP(RC[-5],'[screener-data-1401-11-24.xlsx]overview'!R8C2:R897C8,7,FALSE) -> 127.8873441822 | I515: =IF(RC[-1]="",((RC[-2]+RC[-3])/2)*0.65,RC[-1]) -> 86.258077124701714 | J515: =RC[-1]*RC[-5]/R546C5 -> 0.6056390441183529 | M515: 10.517217798845802 | N515: 28.202413720093162
A516: دشت مرغاب | B516: غدشت | C516: غذایی بجز قند وشکر | D516: 0.77967806841045995 | E516: =VLOOKUP(RC[-3],'[screener-data-1401-11-24.xlsx]overview'!R8C2:R902C7,6,0) -> 27481357542600 | F516: 55.268965517241377 | G516: =VLOOKUP(RC[-5],'[screener-data-1401-11-24.xlsx]overview'!R8C2:R897C8,7,FALSE) -> 52.810009949600001 | I516: =IF(RC[-1]="",((RC[-2]+RC[-3])/2)*0.65,RC[-1]) -> 35.125667026723448 | J516: =RC[-1]*RC[-5]/R546C5 -> 0.94659418680572982 | M516: 7.2034672287026016 | N516: 23.583205567150536
A517: زر ماکارون | B517: غزر | C517: غذایی بجز قند وشکر | D517: -0.58190282222867995 | E517: =VLOOKUP(RC[-3],'[screener-data-1401-11-24.xlsx]overview'!R8C2:R902C7,6,0) -> 59832000000000 | F517: 5.4847512038523272 | G517: =VLOOKUP(RC[-5],'[screener-data-1401-11-24.xlsx]overview'!R8C2:R897C8,7,FALSE) -> 11.252192899000001 | I517: =IF(RC[-1]="",((RC[-2]+RC[-3])/2)*0.65,RC[-1]) -> 5.4395068334270062 | J517: =RC[-1]*RC[-5]/R546C5 -> 0.3191494625016012 | M517: 2.6776118502412816 | N517: 1.7228371275434553
A518: سالمین | B518: غسالم | C518: غذایی بجز قند وشکر | D518: 1.4917560847945499 | E518: =VLOOKUP(RC[-3],'[screener-data-1401-11-24.xlsx]overview'!R8C2:R902C7,6,0) -> 17075072000000 | F518: 20.093264248704664 | G518: =VLOOKUP(RC[-5],'[screener-data-1401-11-24.xlsx]overview'!R8C2:R897C8,7,FALSE) -> 6.9658113884999997 | I518: =IF(RC[-1]="",((RC[-2]+RC[-3])/2)*0.65,RC[-1]) -> 8.7941995820915153 | J518: =RC[-1]*RC[-5]/R546C5 -> 0.14725156923430768 | M518: 2.9185398029573184 | N518: 2.2408605010551623
A519: شهد ایران | B519: غشهد | C519: غذایی بجز قند وشکر | D519: 0.16025641025640999 | E519: =VLOOKUP(RC[-3],'[screener-data-1401-11-24.xlsx]overview'!R8C2:R902C7,6,0) -> 5070695478400 | F519: 10.032102728731942 | G519: =VLOOKUP(RC[-5],'[screener-data-1401-11-24.xlsx]overview'!R8C2:R897C8,7,FALSE) -> 25.619181445900001 | I519: =IF(RC[-1]="",((RC[-2]+RC[-3])/2)*0.65,RC[-1]) -> 11.586667356755381 | J519: =RC[-1]*RC[-5]/R546C5 -> 5.7613882035623676E-2 | M519: 6.2493161553343546 | N519: 2.6858997562682498
A520: شهداب ناب خراسان | B520: غشهداب | C520: غذایی بجز قند وشکر | D520: -0.80775444264942997 | E520: =VLOOKUP(RC[-3],'[screener-data-1401-11-24.xlsx]overview'!R8C2:R902C7,6,0) -> 11303797916680 | F520: 6.2866894197952217 | G520: =VLOOKUP(RC[-5],'[screener-data-1401-11-24.xlsx]overview'!R8C2:R897C8,7,FALSE) -> 9.3878158511999992 | I520: =IF(RC[-1]="",((RC[-2]+RC[-3])/2)*0.65,RC[-1]) -> 5.0942142130734469 | J520: =RC[-1]*RC[-5]/R546C5 -> 5.6468032823470619E-2 | M520: 1.8743599030840485 | N520: 1.37575085788937
A521: شوکوپارس | B521: غشوکو | C521: غذایی بجز قند وشکر | D521: 1.1737089201877899 | E521: =VLOOKUP(RC[-3],'[screener-data-1401-11-24.xlsx]overview'!R8C2:R902C7,6,0) -> 3524000000000 | F521: 18.418803418803417 | G521: =VLOOKUP(RC[-5],'[screener-data-1401-11-24.xlsx]overview'!R8C2:R897C8,7,FALSE) -> 13.515933029799999 | I521: =IF(RC[-1]="",((RC[-2]+RC[-3])/2)*0.65,RC[-1]) -> 10.378789345796111 | J521: =RC[-1]*RC[-5]/R546C5 -> 3.5866059740151092E-2 | M521: 3.5881570006004542 | N521: 4.0025956507758513
A522: شیر پاستوریزه پگاه گلپایگان | B522: غگلپا | C522: غذایی بجز قند وشکر | D522: 0.41666666666666002 | E522: =VLOOKUP(RC[-3],'[screener-data-1401-11-24.xlsx]overview'!R8C2:R902C7,6,0) -> 10224500000000 | F522: 21.456552706552706 | G522: =VLOOKUP(RC[-5],'[screener-data-1401-11-24.xlsx]overview'!R8C2:R897C8,7,FALSE) -> 7.6879256547999999 | I522: =IF(RC[-1]="",((RC[-2]+RC[-3])/2)*0.65,RC[-1]) -> 9.4719554674396296 | J522: =RC[-1]*RC[-5]/R546C5 -> 9.4969203857993525E-2 | M522: 1.2156977082237148 | N522: 6.3190292938338537
A523: شیر پاستوریزه پگاه گلستان | B523: غگلستا | C523: غذایی بجز قند وشکر | D523: 3.3607681755829901 | E523: =VLOOKUP(RC[-3],'[screener-data-1401-11-24.xlsx]overview'!R8C2:R902C7,6,0) -> 7610586240000 | F523: 21.872278664731496 | G523: =VLOOKUP(RC[-5],'[screener-data-1401-11-24.xlsx]overview'!R8C2:R897C8,7,FALSE) -> 9.2177124175999996 | I523: =IF(RC[-1]="",((RC[-2]+RC[-3])/2)*0.65,RC[-1]) -> 10.104247101757736 | J523: =RC[-1]*RC[-5]/R546C5 -> 7.5408992851332166E-2 | M523: 1.293914621207451 | N523: 5.6149147072675705
A524: شیر پاستوریزه پگاه گیلان | B524: غگیلا | C524: غذایی بجز قند وشکر | D524: -6.3829787234042499 | E524: =VLOOKUP(RC[-3],'[screener-data-1401-11-24.xlsx]overview'!R8C2:R902C7,6,0) -> 7398809000000 | F524: 48.565121412803535 | G524: =VLOOKUP(RC[-5],'[screener-data-1401-11-24.xlsx]overview'!R8C2:R897C8,7,FALSE) -> 14.1856826297 | I524: =IF(RC[-1]="",((RC[-2]+RC[-3])/2)*0.65,RC[-1]) -> 20.39401131381365 | J524: =RC[-1]*RC[-5]/R546C5 -> 0.14796722958617034 | M524: 1.7644417766877813 | N524: 7.8250885223431661
A525: صنایع غذایی مینو شرق | B525: غمینو | C525: غذایی بجز قند وشکر | D525: -1.3613861386138599 | E525: =VLOOKUP(RC[-3],'[screener-data-1401-11-24.xlsx]overview'!R8C2:R902C7,6,0) -> 11955000000000 | F525: 13.765112262521589 | G525: =VLOOKUP(RC[-5],'[screener-data-1401-11-24.xlsx]overview'!R8C2:R897C8,7,FALSE) -> 6.6503640956999996 | H525: 5 | I525: =IF(RC[-1]="",((RC[-2]+RC[-3])/2)*0.65,RC[-1]) -> 5 | J525: =RC[-1]*RC[-5]/R546C5 -> 5.861660421705462E-2 | M525: 2.9914026262788527 | N525: 3.4825605428075295
A526: صنعت غذایی کورش | B526: غکورش | C526: غذایی بجز قند وشکر | D526: 0.22396416573347999 | E526: =VLOOKUP(RC[-3],'[screener-data-1401-11-24.xlsx]overview'!R8C2:R902C7,6,0) -> 107760000000000 | F526: 2.7708978328173375 | G526: =VLOOKUP(RC[-5],'[screener-data-1401-11-24.xlsx]overview'!R8C2:R897C8,7,FALSE) -> 8.2003285347000006 | I526: =IF(RC[-1]="",((RC[-2]+RC[-3])/2)*0.65,RC[-1]) -> 3.5656485694431352 | J526: =RC[-1]*RC[-5]/R546C5 -> 0.37678811031968967 | M526: 1.8265356134733635 | N526: 4.3752629638960148
A527: صنعتی بهپاک | B527: بهپاک | C527: غذایی بجز قند وشکر | D527: -20.661157024793379 | E527: =VLOOKUP(RC[-3],'[screener-data-1401-11-24.xlsx]overview'!R8C2:R902C7,6,0) -> 23083000000000 | F527: 8.7272727272727266 | G527: =VLOOKUP(RC[-5],'[screener-data-1401-11-24.xlsx]overview'!R8C2:R897C8,7,FALSE) -> 11.1909762421 | I527: =IF(RC[-1]="",((RC[-2]+RC[-3])/2)*0.65,RC[-1]) -> 6.4734309150461362 | J527: =RC[-1]*RC[-5]/R546C5 -> 0.14653043522774964 | M527: 3.3309754908978584 | N527: 2.8067893513258952
A528: صنعتی بهشهر | B528: غبشهر | C528: غذایی بجز قند وشکر | D528: 2.2329735764793401 | E528: =VLOOKUP(RC[-3],'[screener-data-1401-11-24.xlsx]overview'!R8C2:R902C7,6,0) -> 79650000000000 | F528: 12.048245614035087 | G528: =VLOOKUP(RC[-5],'[screener-data-1401-11-24.xlsx]overview'!R8C2:R897C8,7,FALSE) -> 7.7891257216999996 | I528: =IF(RC[-1]="",((RC[-2]+RC[-3])/2)*0.65,RC[-1]) -> 6.4471456841139032 | J528: =RC[-1]*RC[-5]/R546C5 -> 0.50356360562473157 | M528: 1.4044217730755346 | N528: 1.5395122934899295
A529: صنعتی مینو (خرمدره) | B529: غصینو | C529: غذایی بجز قند وشکر | D529: 0.19047619047618999 | E529: =VLOOKUP(RC[-3],'[screener-data-1401-11-24.xlsx]overview'!R8C2:R902C7,6,0) -> 104900000000000 | F529: 18.327526132404181 | G529: =VLOOKUP(RC[-5],'[screener-data-1401-11-24.xlsx]overview'!R8C2:R897C8,7,FALSE) -> 8.9349064868999992 | I529: =IF(RC[-1]="",((RC[-2]+RC[-3])/2)*0.65,RC[-1]) -> 8.8602906012738583 | J529: =RC[-1]*RC[-5]/R546C5 -> 0.91143252973096389 | M529: 6.1515341557794159 | N529: 5.0725025519220299
A530: گز سکه | B530: غگز | C530: غذایی بجز قند وشکر | D530: 4.9943246311010201 | E530: =VLOOKUP(RC[-3],'[screener-data-1401-11-24.xlsx]overview'!R8C2:R902C7,6,0) -> 1190143020000 | F530: 146.05263157894737 | G530: =VLOOKUP(RC[-5],'[screener-data-1401-11-24.xlsx]overview'!R8C2:R897C8,7,FALSE) -> 14.6813751441 | I530: =IF(RC[-1]="",((RC[-2]+RC[-3])/2)*0.65,RC[-1]) -> 52.238552184990397 | J530: =RC[-1]*RC[-5]/R546C5 -> 6.0966512998282818E-2 | M530: 5.0861212754835341 | N530: 0.92252443128826889
A531: گلوکوزان | B531: غگل | C531: غذایی بجز قند وشکر | D531: 1.07913669064748 | E531: =VLOOKUP(RC[-3],'[screener-data-1401-11-24.xlsx]overview'!R8C2:R902C7,6,0) -> 35053169760000 | F531: 8.977635782747603 | G531: =VLOOKUP(RC[-5],'[screener-data-1401-11-24.xlsx]overview'!R8C2:R897C8,7,FALSE) -> 9.0960658745000007 | H531: 5.5 | I531: =IF(RC[-1]="",((RC[-2]+RC[-3])/2)*0.65,RC[-1]) -> 5.5 | J531: =RC[-1]*RC[-5]/R546C5 -> 0.18905625731599016 | M531: 2.7112333639449937 | N531: 2.9933717275267631
A532: لبنیات پاک | B532: غپاک | C532: غذایی بجز قند وشکر | D532: 3.5071942446043098 | E532: =VLOOKUP(RC[-3],'[screener-data-1401-11-24.xlsx]overview'!R8C2:R902C7,6,0) -> 16348824432800 | F532: -22.568627450980394 | G532: =VLOOKUP(RC[-5],'[screener-data-1401-11-24.xlsx]overview'!R8C2:R897C8,7,FALSE) -> 246.4952260682 | I532: =IF(RC[-1]="",((RC[-2]+RC[-3])/2)*0.65,RC[-1]) -> 72.776144550596371 | J532: =RC[-1]*RC[-5]/R546C5 -> 1.1667468708605593 | M532: 0.70271364014689841 | N532: 11.202557672272267
A533: لبنیات کالبر | B533: غالبر | C533: غذایی بجز قند وشکر | D533: -4.6702429788576802 | E533: =VLOOKUP(RC[-3],'[screener-data-1401-11-24.xlsx]overview'!R8C2:R902C7,6,0) -> 13592040000000 | F533: 64.828326180257505 | G533: =VLOOKUP(RC[-5],'[screener-data-1401-11-24.xlsx]overview'!R8C2:R897C8,7,FALSE) -> 33.138854843200001 | I533: =IF(RC[-1]="",((RC[-2]+RC[-3])/2)*0.65,RC[-1]) -> 31.839333832623687 | J533: =RC[-1]*RC[-5]/R546C5 -> 0.42437489767977016 | M533: 4.3015288173047139 | N533: 10.978446658606746
A534: مارگارین | B534: غمارگ | C534: غذایی بجز قند وشکر | D534: 0 | E534: =VLOOKUP(RC[-3],'[screener-data-1401-11-24.xlsx]overview'!R8C2:R902C7,6,0) -> 18183189843000 | F534: 5.4289772727272725 | G534: =VLOOKUP(RC[-5],'[screener-data-1401-11-24.xlsx]overview'!R8C2:R897C8,7,FALSE) -> 0 | I534: =IF(RC[-1]="",((RC[-2]+RC[-3])/2)*0.65,RC[-1]) -> 1.7644176136363636 | J534: =RC[-1]*RC[-5]/R546C5 -> 3.1461000385567379E-2 | M534: 2.0513255683561038 | N534: 1.7814350834707711
A535: مجتمع تولیدی نیلی صنعت کرمان | B535: غنیلی | C535: غذایی بجز قند وشکر | D535: 4.7557840616966498 | E535: =VLOOKUP(RC[-3],'[screener-data-1401-11-24.xlsx]overview'!R8C2:R902C7,6,0) -> 3000000000000 | F535: 452.77777777777777 | G535: =VLOOKUP(RC[-5],'[screener-data-1401-11-24.xlsx]overview'!R8C2:R897C8,7,FALSE) -> 153.47294420520001 | I535: =IF(RC[-1]="",((RC[-2]+RC[-3])/2)*0.65,RC[-1]) -> 197.03148464446778 | J535: =RC[-1]*RC[-5]/R546C5 -> 0.57963947571911889 | M535: 46.343023669059633 | N535: 8.8328930434193591
A536: مهرام | B536: غمهرا | C536: غذایی بجز قند وشکر | D536: 0 | E536: =VLOOKUP(RC[-3],'[screener-data-1401-11-24.xlsx]overview'!R8C2:R902C7,6,0) -> 15029000000000 | F536: 7.8415841584158414 | G536: =VLOOKUP(RC[-5],'[screener-data-1401-11-24.xlsx]overview'!R8C2:R897C8,7,FALSE) -> 9.8715565285999993 | I536: =IF(RC[-1]="",((RC[-2]+RC[-3])/2)*0.65,RC[-1]) -> 5.7567707232801482 | J536: =RC[-1]*RC[-5]/R546C5 -> 8.4841841806828702E-2 | M536: 1.3116194420910603 | N536: 2.3494714134295429
A537: ناب | B537: غناب | C537: غذایی بجز قند وشکر | D537: 2.9988307311369402 | E537: =VLOOKUP(RC[-3],'[screener-data-1401-11-24.xlsx]overview'!R8C2:R902C7,6,0) -> 15868000000000 | F537: 633.99661303979678 | G537: =VLOOKUP(RC[-5],'[screener-data-1401-11-24.xlsx]overview'!R8C2:R897C8,7,FALSE) -> 314.88475593570001 | I537: =IF(RC[-1]="",((RC[-2]+RC[-3])/2)*0.65,RC[-1]) -> 308.38644491703644 | J537: =RC[-1]*RC[-5]/R546C5 -> 4.7986441198651439 | M537: 75.378528570853305 | N537: 524.62864349775782
A538: نوش پونه مشهد | B538: غپونه | C538: غذایی بجز قند وشکر | D538: -3.5495716034271698 | E538: =VLOOKUP(RC[-3],'[screener-data-1401-11-24.xlsx]overview'!R8C2:R902C7,6,0) -> 9642384640000 | F538: 22.450142450142451 | G538: =VLOOKUP(RC[-5],'[screener-data-1401-11-24.xlsx]overview'!R8C2:R897C8,7,FALSE) -> 14.218493408900001 | I538: =IF(RC[-1]="",((RC[-2]+RC[-3])/2)*0.65,RC[-1]) -> 11.917306654188797 | J538: =RC[-1]*RC[-5]/R546C5 -> 0.11268435855925722 | M538: 2.7733218857732593 | N538: 5.8554699564895882
A539: نوش مازندران | B539: غنوش | C539: غذایی بجز قند وشکر | D539: 2.36486486486486 | E539: =VLOOKUP(RC[-3],'[screener-data-1401-11-24.xlsx]overview'!R8C2:R902C7,6,0) -> 9790000000000 | F539: 699.23076923076928 | G539: =VLOOKUP(RC[-5],'[screener-data-1401-11-24.xlsx]overview'!R8C2:R897C8,7,FALSE) -> 17.6883512751 | I539: =IF(RC[-1]="",((RC[-2]+RC[-3])/2)*0.65,RC[-1]) -> 232.99871416440752 | J539: =RC[-1]*RC[-5]/R546C5 -> 2.2368521873059475 | M539: 18.573763792398857 | N539: 5.3125273954589289
A540: ویتانا | B540: غویتا | C540: غذایی بجز قند وشکر | D540: 0.81265099934108997 | E540: =VLOOKUP(RC[-3],'[screener-data-1401-11-24.xlsx]overview'!R8C2:R902C7,6,0) -> 16180500000000 | F540: 12.506811989100818 | G540: =VLOOKUP(RC[-5],'[screener-data-1401-11-24.xlsx]overview'!R8C2:R897C8,7,FALSE) -> 7.7024625036999996 | I540: =IF(RC[-1]="",((RC[-2]+RC[-3])/2)*0.65,RC[-1]) -> 6.568014210160265 | J540: =RC[-1]*RC[-5]/R546C5 -> 0.10421424630077482 | M540: 2.4715380813018335 | N540: 2.2145022118831306
A541: کشت و صنعت بهاران گل بهار خراسان | B541: غبهار | C541: غذایی بجز قند وشکر | D541: 1.26050420168067 | E541: =VLOOKUP(RC[-3],'[screener-data-1401-11-24.xlsx]overview'!R8C2:R902C7,6,0) -> 5933123725650 | F541: 26.338797814207652 | G541: =VLOOKUP(RC[-5],'[screener-data-1401-11-24.xlsx]overview'!R8C2:R897C8,7,FALSE) -> 11.6026208358 | I541: =IF(RC[-1]="",((RC[-2]+RC[-3])/2)*0.65,RC[-1]) -> 12.330961061252486 | J541: =RC[-1]*RC[-5]/R546C5 -> 7.1743308679991943E-2 | M541: 6.2255293794387425 | N541: 4.9661998367036979
A542: کشت و صنعت پیاذر | B542: غاذر | C542: غذایی بجز قند وشکر | D542: -3.0323151837096001 | E542: =VLOOKUP(RC[-3],'[screener-data-1401-11-24.xlsx]overview'!R8C2:R902C7,6,0) -> 6687540000000 | F542: 38.976868327402137 | G542: =VLOOKUP(RC[-5],'[screener-data-1401-11-24.xlsx]overview'!R8C2:R897C8,7,FALSE) -> 21.3210343517 | I542: =IF(RC[-1]="",((RC[-2]+RC[-3])/2)*0.65,RC[-1]) -> 19.596818370708196 | J542: =RC[-1]*RC[-5]/R546C5 -> 0.12851476623452696 | M542: 9.6499000486249926 | N542: 10.600241959414733
A543: کشت و صنعت جوین | B543: جوین | C543: غذایی بجز قند وشکر | D543: -2.6168224299065401 | E543: =VLOOKUP(RC[-3],'[screener-data-1401-11-24.xlsx]overview'!R8C2:R902C7,6,0) -> 40183743600000 | F543: 5.7378854625550657 | G543: =VLOOKUP(RC[-5],'[screener-data-1401-11-24.xlsx]overview'!R8C2:R897C8,7,FALSE) -> 5.2724835431999999 | I543: =IF(RC[-1]="",((RC[-2]+RC[-3])/2)*0.65,RC[-1]) -> 3.5783699268703968 | J543: =RC[-1]*RC[-5]/R546C5 -> 0.14100571004410772 | M543: 1.692028363075031 | N543: 2.3111550128229243
A544: کشت و صنعت چین چین | B544: غچین | C544: غذایی بجز قند وشکر | D544: -3.27868852459016 | E544: =VLOOKUP(RC[-3],'[screener-data-1401-11-24.xlsx]overview'!R8C2:R902C7,6,0) -> 12005400000000 | F544: 5.3636363636363633 | G544: =VLOOKUP(RC[-5],'[screener-data-1401-11-24.xlsx]overview'!R8C2:R897C8,7,FALSE) -> 13.545618045499999 | I544: =IF(RC[-1]="",((RC[-2]+RC[-3])/2)*0.65,RC[-1]) -> 6.1455076829693178 | J544: =RC[-1]*RC[-5]/R546C5 -> 7.2349489489924285E-2 | M544: 3.674492254492784 | N544: 0.99492679679543639
A545: کیوان | B545: غیوان | C545: غذایی بجز قند وشکر | D545: 0.95907928388746 | E545: =VLOOKUP(RC[-3],'[screener-data-1401-11-24.xlsx]overview'!R8C2:R902C7,6,0) -> 260535000000 | F545: 110.41958041958041 | G545: =VLOOKUP(RC[-5],'[screener-data-1401-11-24.xlsx]overview'!R8C2:R897C8,7,FALSE) -> 59.024694154999999 | I545: =IF(RC[-1]="",((RC[-2]+RC[-3])/2)*0.65,RC[-1]) -> 55.069389236738637 | J545: =RC[-1]*RC[-5]/R546C5 -> 1.4069459203551781E-2 | M545: 3.5520395920815835 | N545: -1.2629244528466517
E546: =SUM(R[-44]C:R[-1]C) -> 1019762246524140 | J546: =SUM(R[-44]C:R[-1]C) -> 18.927119434200804
A547: پالایش نفت اصفهان | B547: شپنا | C547: فرآورده های نفتی | D547: -1.2747875354107601 | E547: =VLOOKUP(RC[-3],'[screener-data-1401-11-24.xlsx]overview'!R8C2:R902C7,6,0) -> 1307200000000000 | F547: 7.9748283752860409 | G547: =VLOOKUP(RC[-5],'[screener-data-1401-11-24.xlsx]overview'!R8C2:R897C8,7,FALSE) -> 3.9444506013999998 | H547: 6.5 | I547: =IF(RC[-1]="",((RC[-2]+RC[-3])/2)*0.65,RC[-1]) -> 6.5 | J547: =RC[-1]*RC[-5]/R560C5 -> 1.691528039642892 | M547: 0.62150968522740213 | N547: 2.5741241279274965
A548: پالایش نفت بندر عباس | B548: شبندر | C548: فرآورده های نفتی | D548: -0.45977011494252001 | E548: =VLOOKUP(RC[-3],'[screener-data-1401-11-24.xlsx]overview'!R8C2:R902C7,6,0) -> 1156683948420000 | F548: 5.1151801535735384 | G548: =VLOOKUP(RC[-5],'[screener-data-1401-11-24.xlsx]overview'!R8C2:R897C8,7,FALSE) -> 3.3316803679999998 | I548: =IF(RC[-1]="",((RC[-2]+RC[-3])/2)*0.65,RC[-1]) -> 2.7452296695113998 | J548: =RC[-1]*RC[-5]/R560C5 -> 0.63214571469472836 | M548: 0.58867316874572551 | N548: 2.4979849885408103
A549: پالایش نفت تبریز | B549: شبریز | C549: فرآورده های نفتی | D549: -0.62717770034843001 | E549: =VLOOKUP(RC[-3],'[screener-data-1401-11-24.xlsx]overview'!R8C2:R902C7,6,0) -> 424500000000000 | F549: 2.1347305389221556 | G549: =VLOOKUP(RC[-5],'[screener-data-1401-11-24.xlsx]overview'!R8C2:R897C8,7,FALSE) -> 4.8451403421999997 | I549: =IF(RC[-1]="",((RC[-2]+RC[-3])/2)*0.65,RC[-1]) -> 2.2684580363647004 | J549: =RC[-1]*RC[-5]/R560C5 -> 0.19170447454331394 | M549: 0.58711623971465299 | N549: 1.3542534403450599
A550: پالایش نفت تهران | B550: شتران | C550: فرآورده های نفتی | D550: -0.25214321734744999 | E550: =VLOOKUP(RC[-3],'[screener-data-1401-11-24.xlsx]overview'!R8C2:R902C7,6,0) -> 1087625000000000 | F550: 4.3712707182320445 | G550: =VLOOKUP(RC[-5],'[screener-data-1401-11-24.xlsx]overview'!R8C2:R897C8,7,FALSE) -> 3.9504349848999998 | I550: =IF(RC[-1]="",((RC[-2]+RC[-3])/2)*0.65,RC[-1]) -> 2.7045543535179148 | J550: =RC[-1]*RC[-5]/R560C5 -> 0.58559680829597371 | M550: 0.7702454533943377 | N550: 2.1050165574673767
A551: پالایش نفت شیراز | B551: شراز | C551: فرآورده های نفتی | D551: -1.74672489082969 | E551: =VLOOKUP(RC[-3],'[screener-data-1401-11-24.xlsx]overview'!R8C2:R902C7,6,0) -> 146520000000000 | F551: 5.443548387096774 | G551: =VLOOKUP(RC[-5],'[screener-data-1401-11-24.xlsx]overview'!R8C2:R897C8,7,FALSE) -> 3.5124934621000001 | I551: =IF(RC[-1]="",((RC[-2]+RC[-3])/2)*0.65,RC[-1]) -> 2.9107136009889518 | J551: =RC[-1]*RC[-5]/R560C5 -> 8.4902443736440888E-2 | M551: 0.47362863507824565 | N551: 3.0166637458183909
A552: پالایش نفت لاوان | B552: شاوان | C552: فرآورده های نفتی | D552: -1.58244002041858 | E552: =VLOOKUP(RC[-3],'[screener-data-1401-11-24.xlsx]overview'!R8C2:R902C7,6,0) -> 151120000000000 | F552: 5.4051023268853378 | G552: =VLOOKUP(RC[-5],'[screener-data-1401-11-24.xlsx]overview'!R8C2:R897C8,7,FALSE) -> 3.5882200495999999 | H552: 6 | I552: =IF(RC[-1]="",((RC[-2]+RC[-3])/2)*0.65,RC[-1]) -> 6 | J552: =RC[-1]*RC[-5]/R560C5 -> 0.18050822710961809 | M552: 0.47209007111266837 | N552: 3.1916051514294974
A553: تجهیز نیروی زنگان | B553: شزنگ | C553: فرآورده های نفتی | D553: 2.9754204398447599 | E553: =VLOOKUP(RC[-3],'[screener-data-1401-11-24.xlsx]overview'!R8C2:R902C7,6,0) -> 2315600000000 | F553: 42.612419700214133 | G553: =VLOOKUP(RC[-5],'[screener-data-1401-11-24.xlsx]overview'!R8C2:R897C8,7,FALSE) -> 27.7199255841 | I553: =IF(RC[-1]="",((RC[-2]+RC[-3])/2)*0.65,RC[-1]) -> 22.858012217402091 | J553: =RC[-1]*RC[-5]/R560C5 -> 1.0537214160794978E-2 | M553: 1.9259234936224523 | N553: 20.811429105000233
A554: سر. نفت | B554: ونفت | C554: فرآورده های نفتی | D554: 0.33463469046291 | E554: =VLOOKUP(RC[-3],'[screener-data-1401-11-24.xlsx]overview'!R8C2:R902C7,6,0) -> 18175000000000 | F554: 6.7001862197392921 | G554: =VLOOKUP(RC[-5],'[screener-data-1401-11-24.xlsx]overview'!R8C2:R897C8,7,FALSE) -> 7.1560763983999998 | I554: =IF(RC[-1]="",((RC[-2]+RC[-3])/2)*0.65,RC[-1]) -> 4.5032853508952702 | J554: =RC[-1]*RC[-5]/R560C5 -> 1.6293999246800608E-2 | K554: 0.45 | M554: 6.1679485416864521 | N554: 3.1713958778199904
A555: نفت ایرانول | B555: شرانل | C555: فرآورده های نفتی | D555: 0.40160642570281002 | E555: =VLOOKUP(RC[-3],'[screener-data-1401-11-24.xlsx]overview'!R8C2:R902C7,6,0) -> 125100000000000 | F555: 7.8261958427247684 | G555: =VLOOKUP(RC[-5],'[screener-data-1401-11-24.xlsx]overview'!R8C2:R897C8,7,FALSE) -> 6.4371555880000004 | H555: 7 | I555: =IF(RC[-1]="",((RC[-2]+RC[-3])/2)*0.65,RC[-1]) -> 7 | J555: =RC[-1]*RC[-5]/R560C5 -> 0.17433281992223901 | M555: 1.4216683270994503 | N555: 6.5291382905963795
A556: نفت بهران | B556: شبهرن | C556: فرآورده های نفتی | D556: 1.2247071352502601 | E556: =VLOOKUP(RC[-3],'[screener-data-1401-11-24.xlsx]overview'!R8C2:R902C7,6,0) -> 225855000000000 | F556: 9.0480723465016659 | G556: =VLOOKUP(RC[-5],'[screener-data-1401-11-24.xlsx]overview'!R8C2:R897C8,7,FALSE) -> 6.4181191675000004 | I556: =IF(RC[-1]="",((RC[-2]+RC[-3])/2)*0.65,RC[-1]) -> 5.0265122420505417 | J556: =RC[-1]*RC[-5]/R560C5 -> 0.22600615121627496 | M556: 1.9918186288419093 | N556: 5.2823765142656107
A557: نفت پارس | B557: شنفت | C557: فرآورده های نفتی | D557: -1.42630744849445 | E557: =VLOOKUP(RC[-3],'[screener-data-1401-11-24.xlsx]overview'!R8C2:R902C7,6,0) -> 123600000000000 | F557: 8.4856753069577078 | G557: =VLOOKUP(RC[-5],'[screener-data-1401-11-24.xlsx]overview'!R8C2:R897C8,7,FALSE) -> 9.0340937397999994 | I557: =IF(RC[-1]="",((RC[-2]+RC[-3])/2)*0.65,RC[-1]) -> 5.6939249401962559 | J557: =RC[-1]*RC[-5]/R560C5 -> 0.14010512243747569 | M557: 1.8487342731452281 | N557: 3.1710101559578785
A558: نفت پاسارگاد | B558: شپاس | C558: فرآورده های نفتی | D558: -0.16574585635358999 | E558: =VLOOKUP(RC[-3],'[screener-data-1401-11-24.xlsx]overview'!R8C2:R902C7,6,0) -> 43392000000000 | F558: 6.6045321637426904 | G558: =VLOOKUP(RC[-5],'[screener-data-1401-11-24.xlsx]overview'!R8C2:R897C8,7,FALSE) -> 4.9356503165000003 | I558: =IF(RC[-1]="",((RC[-2]+RC[-3])/2)*0.65,RC[-1]) -> 3.7505593060788747 | J558: =RC[-1]*RC[-5]/R560C5 -> 3.2398843681992508E-2 | M558: 0.5431098584708407 | N558: 4.0091057211199574
A559: نفت سپاهان | B559: شسپا | C559: فرآورده های نفتی | D559: 1.4504431909750199 | E559: =VLOOKUP(RC[-3],'[screener-data-1401-11-24.xlsx]overview'!R8C2:R902C7,6,0) -> 211064000000000 | F559: 6.1715686274509807 | G559: =VLOOKUP(RC[-5],'[screener-data-1401-11-24.xlsx]overview'!R8C2:R897C8,7,FALSE) -> 5.9622698908 | I559: =IF(RC[-1]="",((RC[-2]+RC[-3])/2)*0.65,RC[-1]) -> 3.943497518431569 | J559: =RC[-1]*RC[-5]/R560C5 -> 0.1656988681121741 | M559: 1.6026372988236022 | N559: 2.2801107521173507
E560: =SUM(R[-13]C:R[-1]C) -> 5023150548420000 | I560: =IF(RC[-1]="",((RC[-2]+RC[-3])/2)*0.65,RC[-1]) -> 0 | J560: =SUM(R[-13]C:R[-1]C) -> 4.1317587268007188
A561: بازرسی مهندسی و صنعتی ایران | B561: خبازرس | C561: فعالیت مهندسی، تجزیه، تحلیل و آزمایش فنی | D561: -0.15633142261593999 | E561: =VLOOKUP(RC[-3],'[screener-data-1401-11-24.xlsx]overview'!R8C2:R902C7,6,0) -> 2868000000000 | F561: 31.307189542483659 | G561: =VLOOKUP(RC[-5],'[screener-data-1401-11-24.xlsx]overview'!R8C2:R897C8,7,FALSE) -> 23.563859453399999 | I561: =IF(RC[-1]="",((RC[-2]+RC[-3])/2)*0.65,RC[-1]) -> 17.833090923662187 | M561: 2.8450037220647162 | N561: 5.4144687264506404
I562: =IF(RC[-1]="",((RC[-2]+RC[-3])/2)*0.65,RC[-1]) -> 0
A563: استقلال | B563: استقلال | C563: فعالیتهای فرهنگی و ورزشی | D563: -1.88877229800629 | E563: =VLOOKUP(RC[-3],'[screener-data-1401-11-24.xlsx]overview'!R8C2:R902C7,6,0) -> 19812551400000 | F563: -4.9483335758987044E-4 | G563: =VLOOKUP(RC[-5],'[screener-data-1401-11-24.xlsx]overview'!R8C2:R897C8,7,FALSE) -> 0 | I563: =IF(RC[-1]="",((RC[-2]+RC[-3])/2)*0.65,RC[-1]) -> -1.6082084121670791E-4 | M563: 57.247155294938679 | N563: 2.4767048398069589
A564: پرسپولیس | B564: پرسپولیس | C564: فعالیتهای فرهنگی و ورزشی | D564: -0.46709129511677 | E564: =VLOOKUP(RC[-3],'[screener-data-1401-11-24.xlsx]overview'!R8C2:R902C7,6,0) -> 24216079545000 | F564: 117.2 | G564: =VLOOKUP(RC[-5],'[screener-data-1401-11-24.xlsx]overview'!R8C2:R897C8,7,FALSE) -> 0 | I564: =IF(RC[-1]="",((RC[-2]+RC[-3])/2)*0.65,RC[-1]) -> 38.090000000000003 | M564: 13.54837025065963 | N564: 4.0026638461321093
E565: =SUM(R[-2]C:R[-1]C) -> 44028630945000 | I565: =IF(RC[-1]="",((RC[-2]+RC[-3])/2)*0.65,RC[-1]) -> 0
A566: بورس اوراق بهادار تهران | B566: بورس | C566: فعالیتهای کمکی به نهاد های مالی واسط | D566: -1.6216216216216199 | E566: =VLOOKUP(RC[-3],'[screener-data-1401-11-24.xlsx]overview'!R8C2:R902C7,6,0) -> 97916000000000 | F566: 15.294117647058824 | G566: =VLOOKUP(RC[-5],'[screener-data-1401-11-24.xlsx]overview'!R8C2:R897C8,7,FALSE) -> 31.227000790200002 | I566: =IF(RC[-1]="",((RC[-2]+RC[-3])/2)*0.65,RC[-1]) -> 15.11936349210912 | J566: =RC[-1]*RC[-5]/R582C5 -> 1.4045617384109987 | M566: 19.440682266764927 | N566: 4.8313220894519979
A567: بورس کالای ایران | B567: کالا | C567: فعالیتهای کمکی به نهاد های مالی واسط | D567: 1.5561959654178601 | E567: =VLOOKUP(RC[-3],'[screener-data-1401-11-24.xlsx]overview'!R8C2:R902C7,6,0) -> 142179000000000 | F567: 22.219419924337956 | G567: =VLOOKUP(RC[-5],'[screener-data-1401-11-24.xlsx]overview'!R8C2:R897C8,7,FALSE) -> 26.5530488299 | I567: =IF(RC[-1]="",((RC[-2]+RC[-3])/2)*0.65,RC[-1]) -> 15.851052345127336 | J567: =RC[-1]*RC[-5]/R582C5 -> 2.1381945450414452 | M567: 33.317454426740717 | N567: 11.419749953343677
A568: تامین سرمایه امید | B568: امید | C568: فعالیتهای کمکی به نهاد های مالی واسط | D568: 0.35813768404296997 | E568: =VLOOKUP(RC[-3],'[screener-data-1401-11-24.xlsx]overview'!R8C2:R902C7,6,0) -> 76152000000000 | F568: 10.087999999999999 | G568: =VLOOKUP(RC[-5],'[screener-data-1401-11-24.xlsx]overview'!R8C2:R897C8,7,FALSE) -> 12.92437039 | I568: =IF(RC[-1]="",((RC[-2]+RC[-3])/2)*0.65,RC[-1]) -> 7.4790203767500003 | J568: =RC[-1]*RC[-5]/R582C5 -> 0.54035564401026026 | M568: 12.766715633984672 | N568: 2.9775482281427181
A569: تامین سرمایه امین | B569: امین | C569: فعالیتهای کمکی به نهاد های مالی واسط | D569: 0 | E569: =VLOOKUP(RC[-3],'[screener-data-1401-11-24.xlsx]overview'!R8C2:R902C7,6,0) -> 153360000000000 | F569: 12.223816355810618 | G569: =VLOOKUP(RC[-5],'[screener-data-1401-11-24.xlsx]overview'!R8C2:R897C8,7,FALSE) -> 21.163517043599999 | I569: =IF(RC[-1]="",((RC[-2]+RC[-3])/2)*0.65,RC[-1]) -> 10.850883354808451 | J569: =RC[-1]*RC[-5]/R582C5 -> 1.578813591825899 | M569: 11.786100716595845 | N569: 5.0309174354624604
A570: تامین سرمایه بانک ملت | B570: تملت | C570: فعالیتهای کمکی به نهاد های مالی واسط | D570: -3.4904013961599999E-2 | E570: =VLOOKUP(RC[-3],'[screener-data-1401-11-24.xlsx]overview'!R8C2:R902C7,6,0) -> 61538400000000 | F570: 8.3988269794721404 | G570: =VLOOKUP(RC[-5],'[screener-data-1401-11-24.xlsx]overview'!R8C2:R897C8,7,FALSE) -> 9.2492154217000007 | I570: =IF(RC[-1]="",((RC[-2]+RC[-3])/2)*0.65,RC[-1]) -> 5.7356137803809464 | J570: =RC[-1]*RC[-5]/R582C5 -> 0.33487271378735595 | M570: 9.4854242009691134 | N570: 2.2073040518300271
A571: تامین سرمایه خلیج فارس | B571: تفارس | C571: فعالیتهای کمکی به نهاد های مالی واسط | D571: 1.1428571428571399 | E571: =VLOOKUP(RC[-3],'[screener-data-1401-11-24.xlsx]overview'!R8C2:R902C7,6,0) -> 26350000000000 | F571: 96.545454545454547 | G571: =VLOOKUP(RC[-5],'[screener-data-1401-11-24.xlsx]overview'!R8C2:R897C8,7,FALSE) -> 30.819362279 | I571: =IF(RC[-1]="",((RC[-2]+RC[-3])/2)*0.65,RC[-1]) -> 41.393565467947731 | J571: =RC[-1]*RC[-5]/R582C5 -> 1.0348254895693716 | M571: 80.055722401128918 | N571: 4.9152121279665755
A572: تامین سرمایه دماوند | B572: تماوند | C572: فعالیتهای کمکی به نهاد های مالی واسط | D572: 0.18484288354898001 | E572: =VLOOKUP(RC[-3],'[screener-data-1401-11-24.xlsx]overview'!R8C2:R902C7,6,0) -> 37240000000000 | F572: 11.531914893617021 | G572: =VLOOKUP(RC[-5],'[screener-data-1401-11-24.xlsx]overview'!R8C2:R897C8,7,FALSE) -> 8.8576129208999994 | I572: =IF(RC[-1]="",((RC[-2]+RC[-3])/2)*0.65,RC[-1]) -> 6.6265965397180322 | J572: =RC[-1]*RC[-5]/R582C5 -> 0.23412827396213612 | M572: 6.9832929226332503 | N572: 3.3743775878714515
A573: تامین سرمایه لوتوس پارسیان | B573: لوتوس | C573: فعالیتهای کمکی به نهاد های مالی واسط | D573: 2.044571662236E-2 | E573: =VLOOKUP(RC[-3],'[screener-data-1401-11-24.xlsx]overview'!R8C2:R902C7,6,0) -> 117336000000000 | F573: 6.0469715698393074 | G573: =VLOOKUP(RC[-5],'[screener-data-1401-11-24.xlsx]overview'!R8C2:R897C8,7,FALSE) -> 7.6878464801000002 | I573: =IF(RC[-1]="",((RC[-2]+RC[-3])/2)*0.65,RC[-1]) -> 4.4638158662302745 | J573: =RC[-1]*RC[-5]/R582C5 -> 0.4969254186116478 | M573: 8.0088268447952142 | N573: 2.1840759315516913
A574: تامین سرمایه نوین | B574: تنوین | C574: فعالیتهای کمکی به نهاد های مالی واسط | D574: -2.54850854329568 | E574: =VLOOKUP(RC[-3],'[screener-data-1401-11-24.xlsx]overview'!R8C2:R902C7,6,0) -> 82442500000000 | F574: 5.3926282051282053 | G574: =VLOOKUP(RC[-5],'[screener-data-1401-11-24.xlsx]overview'!R8C2:R897C8,7,FALSE) -> 4.1878120523 | I574: =IF(RC[-1]="",((RC[-2]+RC[-3])/2)*0.65,RC[-1]) -> 3.1136430836641664 | J574: =RC[-1]*RC[-5]/R582C5 -> 0.24354187352271447 | M574: 5.9958382406224775 | N574: 1.8881838827373278
A575: تامین سرمایه کیمیا | B575: تکیمیا | C575: فعالیتهای کمکی به نهاد های مالی واسط | D575: 0 | E575: =VLOOKUP(RC[-3],'[screener-data-1401-11-24.xlsx]overview'!R8C2:R902C7,6,0) -> 0 | G575: =VLOOKUP(RC[-5],'[screener-data-1401-11-24.xlsx]overview'!R8C2:R897C8,7,FALSE) -> 0 | I575: =IF(RC[-1]="",((RC[-2]+RC[-3])/2)*0.65,RC[-1]) -> 0 | J575: =RC[-1]*RC[-5]/R582C5 -> 0
A576: تولیدکنندگان بورس کالای ایران | B576: تکالا | C576: فعالیتهای کمکی به نهاد های مالی واسط | E576: =VLOOKUP(RC[-3],'[screener-data-1401-11-24.xlsx]overview'!R8C2:R902C7,6,0) -> 0 | F576: 21.878940731399748 | G576: =VLOOKUP(RC[-5],'[screener-data-1401-11-24.xlsx]overview'!R8C2:R897C8,7,FALSE) -> 0 | I576: =IF(RC[-1]="",((RC[-2]+RC[-3])/2)*0.65,RC[-1]) -> 7.110655737704918 | J576: =RC[-1]*RC[-5]/R582C5 -> 0
A577: سایر اشخاص بورس انرژی | B577: انرژی3 | C577: فعالیتهای کمکی به نهاد های مالی واسط | D577: -2.0524515393386502 | E577: =VLOOKUP(RC[-3],'[screener-data-1401-11-24.xlsx]overview'!R8C2:R902C7,6,0) -> 61506000000000 | F577: 94.917127071823202 | G577: =VLOOKUP(RC[-5],'[screener-data-1401-11-24.xlsx]overview'!R8C2:R897C8,7,FALSE) -> 96.198618464999996 | I577: =IF(RC[-1]="",((RC[-2]+RC[-3])/2)*0.65,RC[-1]) -> 62.112617299467544 | J577: =RC[-1]*RC[-5]/R582C5 -> 3.624523964647004
A578: سپرده گذاری و تسویه وجوه | B578: سپرده | C578: فعالیتهای کمکی به نهاد های مالی واسط | D578: 0 | E578: =VLOOKUP(RC[-3],'[screener-data-1401-11-24.xlsx]overview'!R8C2:R902C7,6,0) -> 2226000000000 | F578: 4.5840407470288627 | G578: =VLOOKUP(RC[-5],'[screener-data-1401-11-24.xlsx]overview'!R8C2:R897C8,7,FALSE) -> 0 | I578: =IF(RC[-1]="",((RC[-2]+RC[-3])/2)*0.65,RC[-1]) -> 1.4898132427843804 | J578: =RC[-1]*RC[-5]/R582C5 -> 3.146376227522266E-3 | M578: 4.9217442661679298 | N578: 1.9614077968139265
A579: فرابورس ایران | B579: فرابورس | C579: فعالیتهای کمکی به نهاد های مالی واسط | D579: -2.0386266094420602 | E579: =VLOOKUP(RC[-3],'[screener-data-1401-11-24.xlsx]overview'!R8C2:R902C7,6,0) -> 75096000000000 | F579: 26.695906432748536 | G579: =VLOOKUP(RC[-5],'[screener-data-1401-11-24.xlsx]overview'!R8C2:R897C8,7,FALSE) -> 34.388216785499999 | I579: =IF(RC[-1]="",((RC[-2]+RC[-3])/2)*0.65,RC[-1]) -> 19.852340045930774 | J579: =RC[-1]*RC[-5]/R582C5 -> 1.4144323220872301 | M579: 32.44626346745008 | N579: 7.3711363095069897
A580: فعالان بورس انرژی | B580: انرژی2 | C580: فعالیتهای کمکی به نهاد های مالی واسط | E580: =VLOOKUP(RC[-3],'[screener-data-1401-11-24.xlsx]overview'!R8C2:R902C7,6,0) -> 60336000000000 | F580: 96.906077348066304 | G580: =VLOOKUP(RC[-5],'[screener-data-1401-11-24.xlsx]overview'!R8C2:R897C8,7,FALSE) -> 101.2389652408 | I580: =IF(RC[-1]="",((RC[-2]+RC[-3])/2)*0.65,RC[-1]) -> 64.397138841381562 | J580: =RC[-1]*RC[-5]/R582C5 -> 3.6863515453957465
A581: نهادهای مالی بورس انرژی | B581: انرژی1 | C581: فعالیتهای کمکی به نهاد های مالی واسط | E581: =VLOOKUP(RC[-3],'[screener-data-1401-11-24.xlsx]overview'!R8C2:R902C7,6,0) -> 60336000000000 | F581: 96.906077348066304 | G581: =VLOOKUP(RC[-5],'[screener-data-1401-11-24.xlsx]overview'!R8C2:R897C8,7,FALSE) -> 107.9498269481 | I581: =IF(RC[-1]="",((RC[-2]+RC[-3])/2)*0.65,RC[-1]) -> 66.578168896254056 | J581: =RC[-1]*RC[-5]/R582C5 -> 3.8112024884343407
E582: =SUM(R[-16]C:R[-1]C) -> 1054013900000000 | I582: =IF(RC[-1]="",((RC[-2]+RC[-3])/2)*0.65,RC[-1]) -> 0 | J582: =SUM(R[-16]C:R[-1]C) -> 20.545875985533669
A583: گروه توسعه هنر ایران | B583: وهنر | C583: فعالیتهای هنری، سرگرمی و خلاقانه | D583: 2.23285486443381 | E583: =VLOOKUP(RC[-3],'[screener-data-1401-11-24.xlsx]overview'!R8C2:R902C7,6,0) -> 2585732296000 | F583: 22.892857142857142 | G583: =VLOOKUP(RC[-5],'[screener-data-1401-11-24.xlsx]overview'!R8C2:R897C8,7,FALSE) -> 28.4433744281 | H583: 1.6 | I583: =IF(RC[-1]="",((RC[-2]+RC[-3])/2)*0.65,RC[-1]) -> 1.6 | M583: 17.247944654292407 | N583: 1.5943345839538463
I584: =IF(RC[-1]="",((RC[-2]+RC[-3])/2)*0.65,RC[-1]) -> 0
A585: آلومتک | B585: فالوم | C585: فلزات اساسی | D585: -0.10256410256409999 | E585: =VLOOKUP(RC[-3],'[screener-data-1401-11-24.xlsx]overview'!R8C2:R902C7,6,0) -> 13580000000000 | F585: 21.741071428571427 | G585: =VLOOKUP(RC[-5],'[screener-data-1401-11-24.xlsx]overview'!R8C2:R897C8,7,FALSE) -> 34.092578228699999 | I585: =IF(RC[-1]="",((RC[-2]+RC[-3])/2)*0.65,RC[-1]) -> 18.145936138613212 | J585: =RC[-1]*RC[-5]/R634C5 -> 2.1080346335802334E-2 | M585: 2.8644056011775234 | N585: 4.213619248020378
A586: آلومراد | B586: فمراد | C586: فلزات اساسی | D586: -4.4090056285178196 | E586: =VLOOKUP(RC[-3],'[screener-data-1401-11-24.xlsx]overview'!R8C2:R902C7,6,0) -> 7325500000000 | F586: 21.010309278350515 | G586: =VLOOKUP(RC[-5],'[screener-data-1401-11-24.xlsx]overview'!R8C2:R897C8,7,FALSE) -> 24.753975791599999 | H586: 30 | I586: =IF(RC[-1]="",((RC[-2]+RC[-3])/2)*0.65,RC[-1]) -> 30 | J586: =RC[-1]*RC[-5]/R634C5 -> 1.8799968479069198E-2 | M586: 2.9600814364756896 | N586: 7.4377526162605037
A587: آلومینیوم ایران | B587: فایرا | C587: فلزات اساسی | D587: 0 | E587: =VLOOKUP(RC[-3],'[screener-data-1401-11-24.xlsx]overview'!R8C2:R902C7,6,0) -> 231586951400000 | F587: 1.8690731110431325 | G587: =VLOOKUP(RC[-5],'[screener-data-1401-11-24.xlsx]overview'!R8C2:R897C8,7,FALSE) -> 8.2829500993000007 | I587: =IF(RC[-1]="",((RC[-2]+RC[-3])/2)*0.65,RC[-1]) -> 3.2994075433615184 | J587: =RC[-1]*RC[-5]/R634C5 -> 6.5365508254082244E-2 | M587: 2.2156859619504687 | N587: 3.9319674097386517
A588: آهن و فولاد ارفع | B588: ارفع | C588: فلزات اساسی | D588: 0.46003450258769002 | E588: =VLOOKUP(RC[-3],'[screener-data-1401-11-24.xlsx]overview'!R8C2:R902C7,6,0) -> 209880000000000 | F588: 10.405002977963074 | G588: =VLOOKUP(RC[-5],'[screener-data-1401-11-24.xlsx]overview'!R8C2:R897C8,7,FALSE) -> 6.8092972248999999 | I588: =IF(RC[-1]="",((RC[-2]+RC[-3])/2)*0.65,RC[-1]) -> 5.5946475659304982 | J588: =RC[-1]*RC[-5]/R634C5 -> 0.1004482517842329 | M588: 2.1813783191452001 | N588: 4.295193900529628
A589: آهن و فولاد غدیر ایرانیان | B589: فغدیر | C589: فلزات اساسی | D589: -0.80795525170912996 | E589: =VLOOKUP(RC[-3],'[screener-data-1401-11-24.xlsx]overview'!R8C2:R902C7,6,0) -> 202650000000000 | F589: 7.5105882352941178 | G589: =VLOOKUP(RC[-5],'[screener-data-1401-11-24.xlsx]overview'!R8C2:R897C8,7,FALSE) -> 8.2906179947999998 | I589: =IF(RC[-1]="",((RC[-2]+RC[-3])/2)*0.65,RC[-1]) -> 5.1353920247805878 | J589: =RC[-1]*RC[-5]/R634C5 -> 8.9026398382001493E-2 | M589: 2.5008072258913145 | N589: 10.3291137442683
A590: پارس فولاد سبزوار | B590: فسبزوار | C590: فلزات اساسی | D590: -9.6536796536796494 | E590: =VLOOKUP(RC[-3],'[screener-data-1401-11-24.xlsx]overview'!R8C2:R902C7,6,0) -> 82880000000000 | F590: 5.827981010890813 | G590: =VLOOKUP(RC[-5],'[screener-data-1401-11-24.xlsx]overview'!R8C2:R897C8,7,FALSE) -> 5.7973458990999998 | I590: =IF(RC[-1]="",((RC[-2]+RC[-3])/2)*0.65,RC[-1]) -> 3.7782312457470142 | J590: =RC[-1]*RC[-5]/R634C5 -> 2.6787789118900149E-2 | M590: 1.4490126336266329 | N590: 7.8063932190982834
A591: تجهیزات سدید | B591: فسدید | C591: فلزات اساسی | D591: 0.73964497041419996 | E591: =VLOOKUP(RC[-3],'[screener-data-1401-11-24.xlsx]overview'!R8C2:R902C7,6,0) -> 6728640000000 | F591: -8.4859813084112155 | G591: =VLOOKUP(RC[-5],'[screener-data-1401-11-24.xlsx]overview'!R8C2:R897C8,7,FALSE) -> 0 | I591: =IF(RC[-1]="",((RC[-2]+RC[-3])/2)*0.65,RC[-1]) -> -2.7579439252336453 | J591: =RC[-1]*RC[-5]/R634C5 -> -1.5874911707751092E-3 | M591: 6.3633184668829754 | N591: -1.1574028859217387
A592: تولید و توسعه سرب روی ایرانیان | B592: فتوسا | C592: فلزات اساسی | D592: -1.1095700416088701 | E592: =VLOOKUP(RC[-3],'[screener-data-1401-11-24.xlsx]overview'!R8C2:R902C7,6,0) -> 9690000000000 | F592: 11.804635761589404 | G592: =VLOOKUP(RC[-5],'[screener-data-1401-11-24.xlsx]overview'!R8C2:R897C8,7,FALSE) -> 11.009191898299999 | H592: 9 | I592: =IF(RC[-1]="",((RC[-2]+RC[-3])/2)*0.65,RC[-1]) -> 9 | J592: =RC[-1]*RC[-5]/R634C5 -> 7.4604475283126283E-3 | M592: 1.4262728434927272 | N592: 3.0849409700746837
A593: جهان فولاد سیرجان | B593: فجهان | C593: فلزات اساسی | D593: 1.5212981744421901 | E593: =VLOOKUP(RC[-3],'[screener-data-1401-11-24.xlsx]overview'!R8C2:R902C7,6,0) -> 198770000000000 | F593: 8.0509383378016093 | G593: =VLOOKUP(RC[-5],'[screener-data-1401-11-24.xlsx]overview'!R8C2:R897C8,7,FALSE) -> 15.3683127941 | H593: 4 | I593: =IF(RC[-1]="",((RC[-2]+RC[-3])/2)*0.65,RC[-1]) -> 4 | J593: =RC[-1]*RC[-5]/R634C5 -> 6.8015739259383146E-2 | M593: 1.7993192702176004 | N593: 2.2034275373908203
A594: ذوب آهن اصفهان | B594: ذوب | C594: فلزات اساسی | D594: 4.8102217211574496 | E594: =VLOOKUP(RC[-3],'[screener-data-1401-11-24.xlsx]overview'!R8C2:R902C7,6,0) -> 183958464000000 | F594: 8.5030487804878057 | G594: =VLOOKUP(RC[-5],'[screener-data-1401-11-24.xlsx]overview'!R8C2:R897C8,7,FALSE) -> 0 | I594: =IF(RC[-1]="",((RC[-2]+RC[-3])/2)*0.65,RC[-1]) -> 2.7634908536585368 | J594: =RC[-1]*RC[-5]/R634C5 -> 4.3488697430724435E-2 | M594: 0.56304054464896947 | N594: 3.1356568221462706
A595: ذوب روی اصفهان | B595: فروی | C595: فلزات اساسی | D595: -2.0741671904462602 | E595: =VLOOKUP(RC[-3],'[screener-data-1401-11-24.xlsx]overview'!R8C2:R902C7,6,0) -> 12960000000000 | F595: 21.342465753424658 | G595: =VLOOKUP(RC[-5],'[screener-data-1401-11-24.xlsx]overview'!R8C2:R897C8,7,FALSE) -> 18.7772004666 | H595: 7 | I595: =IF(RC[-1]="",((RC[-2]+RC[-3])/2)*0.65,RC[-1]) -> 7 | J595: =RC[-1]*RC[-5]/R634C5 -> 7.7607132183066356E-3 | M595: 2.441484552151604 | N595: 3.7745153723612446
A596: زرین معدن آسیا | B596: فزرین | C596: فلزات اساسی | D596: -0.16129032258063999 | E596: =VLOOKUP(RC[-3],'[screener-data-1401-11-24.xlsx]overview'!R8C2:R902C7,6,0) -> 12420000000000 | F596: 6.3487179487179484 | G596: =VLOOKUP(RC[-5],'[screener-data-1401-11-24.xlsx]overview'!R8C2:R897C8,7,FALSE) -> 6.5957684124 | I596: =IF(RC[-1]="",((RC[-2]+RC[-3])/2)*0.65,RC[-1]) -> 4.2069580673633338 | J596: =RC[-1]*RC[-5]/R634C5 -> 4.4698028981649549E-3 | M596: 1.7099827772413172 | N596: 2.5142702097161314
A597: سپنتا | B597: فپنتا | C597: فلزات اساسی | D597: -0.59703398623948001 | E597: =VLOOKUP(RC[-3],'[screener-data-1401-11-24.xlsx]overview'!R8C2:R902C7,6,0) -> 33729610464000 | F597: 8.5990278123014878 | G597: =VLOOKUP(RC[-5],'[screener-data-1401-11-24.xlsx]overview'!R8C2:R897C8,7,FALSE) -> 9.0160887072999998 | I597: =IF(RC[-1]="",((RC[-2]+RC[-3])/2)*0.65,RC[-1]) -> 5.7249128688704829 | J597: =RC[-1]*RC[-5]/R634C5 -> 1.6518811622757316E-2 | M597: 2.0150081681849725 | N597: 18.736918225537149
A598: سر. توسعه معادن و صنایع معدنی خاورمیانه | B598: میدکو | C598: فلزات اساسی | D598: 0.20449897750511001 | E598: =VLOOKUP(RC[-3],'[screener-data-1401-11-24.xlsx]overview'!R8C2:R902C7,6,0) -> 1362200000000000 | F598: 14.285714285714286 | G598: =VLOOKUP(RC[-5],'[screener-data-1401-11-24.xlsx]overview'!R8C2:R897C8,7,FALSE) -> 33.006236729800001 | I598: =IF(RC[-1]="",((RC[-2]+RC[-3])/2)*0.65,RC[-1]) -> 15.369884080042143 | J598: =RC[-1]*RC[-5]/R634C5 -> 1.7910596983817986 | K598: 3 | M598: 32.519834966104 | N598: 9.4135922762820172
A599: سر. توکا فولاد | B599: وتوکا | C599: فلزات اساسی | D599: 5.1980198019801902 | E599: =VLOOKUP(RC[-3],'[screener-data-1401-11-24.xlsx]overview'!R8C2:R902C7,6,0) -> 33731100000000 | F599: 6.854838709677419 | G599: =VLOOKUP(RC[-5],'[screener-data-1401-11-24.xlsx]overview'!R8C2:R897C8,7,FALSE) -> 6.5379901415999999 | I599: =IF(RC[-1]="",((RC[-2]+RC[-3])/2)*0.65,RC[-1]) -> 4.352669376665161 | J599: =RC[-1]*RC[-5]/R634C5 -> 1.255985940025842E-2 | K599: 1.2 | M599: 6.2890737739289575 | N599: 2.9390542002606583
A600: سوژمیران | B600: فسوژ | C600: فلزات اساسی | D600: 0.97442143727161001 | E600: =VLOOKUP(RC[-3],'[screener-data-1401-11-24.xlsx]overview'!R8C2:R902C7,6,0) -> 9744000000000 | F600: 9.9400479616306949 | G600: =VLOOKUP(RC[-5],'[screener-data-1401-11-24.xlsx]overview'!R8C2:R897C8,7,FALSE) -> 14.7877506765 | I600: =IF(RC[-1]="",((RC[-2]+RC[-3])/2)*0.65,RC[-1]) -> 8.0365345573924749 | J600: =RC[-1]*RC[-5]/R634C5 -> 6.698918367033636E-3 | M600: 6.8399763199854782 | N600: 5.798162399837735
A601: صنایع تجهیزات نفت | B601: فنفت | C601: فلزات اساسی | D601: -2.9562982005141301 | E601: =VLOOKUP(RC[-3],'[screener-data-1401-11-24.xlsx]overview'!R8C2:R902C7,6,0) -> 42720000000000 | F601: 28.949386503067483 | G601: =VLOOKUP(RC[-5],'[screener-data-1401-11-24.xlsx]overview'!R8C2:R897C8,7,FALSE) -> 28.622973352900001 | I601: =IF(RC[-1]="",((RC[-2]+RC[-3])/2)*0.65,RC[-1]) -> 18.711016953189432 | J601: =RC[-1]*RC[-5]/R634C5 -> 6.8379706122197528E-2 | M601: 27.292921734383839 | N601: 25.015544979937864
A602: صنایع مس افق کرمان | B602: فافق | C602: فلزات اساسی | D602: 2.8571428571428501 | E602: =VLOOKUP(RC[-3],'[screener-data-1401-11-24.xlsx]overview'!R8C2:R902C7,6,0) -> 15631000000000 | F602: 5.0314192849404114 | G602: =VLOOKUP(RC[-5],'[screener-data-1401-11-24.xlsx]overview'!R8C2:R897C8,7,FALSE) -> 6.5973162196999997 | I602: =IF(RC[-1]="",((RC[-2]+RC[-3])/2)*0.65,RC[-1]) -> 3.7793390390081334 | J602: =RC[-1]*RC[-5]/R634C5 -> 5.0536040318432283E-3 | K602: 3 | M602: 8.9352122896275343 | N602: 3.0500368166127365
A603: صنعت روی زنگان | B603: زنگان | C603: فلزات اساسی | D603: -1.1466011466011401 | E603: =VLOOKUP(RC[-3],'[screener-data-1401-11-24.xlsx]overview'!R8C2:R902C7,6,0) -> 5920000000000 | F603: 21.453963739779596 | G603: =VLOOKUP(RC[-5],'[screener-data-1401-11-24.xlsx]overview'!R8C2:R897C8,7,FALSE) -> 33.281698994300001 | I603: =IF(RC[-1]="",((RC[-2]+RC[-3])/2)*0.65,RC[-1]) -> 17.789090388575868 | J603: =RC[-1]*RC[-5]/R634C5 -> 9.0089472134921942E-3 | M603: 4.2280765299366738 | N603: 10.987050391146276
A604: صنعتی سپاهان | B604: فسپا | C604: فلزات اساسی | D604: 4.1206769683590796 | E604: =VLOOKUP(RC[-3],'[screener-data-1401-11-24.xlsx]overview'!R8C2:R902C7,6,0) -> 18408000000000 | F604: 4.2188431723315443 | G604: =VLOOKUP(RC[-5],'[screener-data-1401-11-24.xlsx]overview'!R8C2:R897C8,7,FALSE) -> 6.6811934029 | H604: 2.2000000000000002 | I604: =IF(RC[-1]="",((RC[-2]+RC[-3])/2)*0.65,RC[-1]) -> 2.2000000000000002 | J604: =RC[-1]*RC[-5]/R634C5 -> 3.4643988054419619E-3 | M604: 0.62136764251055898 | N604: 2.6347375718304371
A605: غلتک سازان سپاهان | B605: فسازان | C605: فلزات اساسی | D605: 0.73298429319370995 | E605: =VLOOKUP(RC[-3],'[screener-data-1401-11-24.xlsx]overview'!R8C2:R902C7,6,0) -> 11310000000000 | F605: 11.625377643504532 | G605: =VLOOKUP(RC[-5],'[screener-data-1401-11-24.xlsx]overview'!R8C2:R897C8,7,FALSE) -> 21.766832389699999 | I605: =IF(RC[-1]="",((RC[-2]+RC[-3])/2)*0.65,RC[-1]) -> 10.852468260791474 | J605: =RC[-1]*RC[-5]/R634C5 -> 1.0500010249274853E-2 | M605: 0.45547220619349876 | N605: 2.5567908111454285
A606: فرآوری مواد معدنی | B606: فرآور | C606: فلزات اساسی | D606: -1.4843087362171301 | E606: =VLOOKUP(RC[-3],'[screener-data-1401-11-24.xlsx]overview'!R8C2:R902C7,6,0) -> 15127200000000 | F606: 9.6071133167907359 | G606: =VLOOKUP(RC[-5],'[screener-data-1401-11-24.xlsx]overview'!R8C2:R897C8,7,FALSE) -> 12.7235931144 | H606: 10.5 | I606: =IF(RC[-1]="",((RC[-2]+RC[-3])/2)*0.65,RC[-1]) -> 10.5 | J606: =RC[-1]*RC[-5]/R634C5 -> 1.3587715393051867E-2 | M606: 3.7954152409743838 | N606: 5.1364586449716692
A607: فرو آلیاژ ایران | B607: فروژ | C607: فلزات اساسی | D607: -1.7130620985010701 | E607: =VLOOKUP(RC[-3],'[screener-data-1401-11-24.xlsx]overview'!R8C2:R902C7,6,0) -> 49445000000000 | F607: 6.3406547865727312 | G607: =VLOOKUP(RC[-5],'[screener-data-1401-11-24.xlsx]overview'!R8C2:R897C8,7,FALSE) -> 6.0952363460000001 | I607: =IF(RC[-1]="",((RC[-2]+RC[-3])/2)*0.65,RC[-1]) -> 4.0416646180861378 | J607: =RC[-1]*RC[-5]/R634C5 -> 1.7095477957043539E-2 | M607: 3.0228937049630598 | N607: 7.8388765425850186
A608: فروسیلیس ایران | B608: فروس | C608: فلزات اساسی | D608: 0.16207455429497 | E608: =VLOOKUP(RC[-3],'[screener-data-1401-11-24.xlsx]overview'!R8C2:R902C7,6,0) -> 24360000000000 | F608: 4.7211611917494274 | G608: =VLOOKUP(RC[-5],'[screener-data-1401-11-24.xlsx]overview'!R8C2:R897C8,7,FALSE) -> 5.9141490394999998 | I608: =IF(RC[-1]="",((RC[-2]+RC[-3])/2)*0.65,RC[-1]) -> 3.4564758251560641 | J608: =RC[-1]*RC[-5]/R634C5 -> 7.2029334363549443E-3 | M608: 2.3779737297392454 | N608: 2.4288519312123982
A609: فروسیلیسیم خمین | B609: فروسیل | C609: فلزات اساسی | D609: -1.26436781609195 | E609: =VLOOKUP(RC[-3],'[screener-data-1401-11-24.xlsx]overview'!R8C2:R902C7,6,0) -> 27104000000000 | F609: 5.9261814418765093 | G609: =VLOOKUP(RC[-5],'[screener-data-1401-11-24.xlsx]overview'!R8C2:R897C8,7,FALSE) -> 12.175571081599999 | I609: =IF(RC[-1]="",((RC[-2]+RC[-3])/2)*0.65,RC[-1]) -> 5.8830695701298659 | J609: =RC[-1]*RC[-5]/R634C5 -> 1.3640678293906297E-2 | M609: 6.4823048970785528 | N609: 4.2932344073499777
A610: فولاد آلیاژی ایران | B610: فولاژ | C610: فلزات اساسی | D610: 0.18331805682859001 | E610: =VLOOKUP(RC[-3],'[screener-data-1401-11-24.xlsx]overview'!R8C2:R902C7,6,0) -> 261600000000000 | F610: 8.6334913112164298 | G610: =VLOOKUP(RC[-5],'[screener-data-1401-11-24.xlsx]overview'!R8C2:R897C8,7,FALSE) -> 6.4694118184000002 | H610: 6.5 | I610: =IF(RC[-1]="",((RC[-2]+RC[-3])/2)*0.65,RC[-1]) -> 6.5 | J610: =RC[-1]*RC[-5]/R634C5 -> 0.14546204537487437 | M610: 2.7363381703402641 | N610: 4.3792590598175538
A611: فولاد آلیاژی یزد | B611: فولای | C611: فلزات اساسی | D611: -4.1015625 | E611: =VLOOKUP(RC[-3],'[screener-data-1401-11-24.xlsx]overview'!R8C2:R902C7,6,0) -> 5561920000000 | F611: 3.7944358578052548 | G611: =VLOOKUP(RC[-5],'[screener-data-1401-11-24.xlsx]overview'!R8C2:R897C8,7,FALSE) -> 11.626305625400001 | I611: =IF(RC[-1]="",((RC[-2]+RC[-3])/2)*0.65,RC[-1]) -> 5.011740982041708 | J611: =RC[-1]*RC[-5]/R634C5 -> 2.3845802858984541E-3 | M611: 0.90303743881031318 | N611: 1.7847696111427367
A612: فولاد افزا سپاهان | B612: فافزا | C612: فلزات اساسی | D612: 2.8387096774193501 | E612: =VLOOKUP(RC[-3],'[screener-data-1401-11-24.xlsx]overview'!R8C2:R902C7,6,0) -> 3798000000000 | F612: 14.131205673758865 | G612: =VLOOKUP(RC[-5],'[screener-data-1401-11-24.xlsx]overview'!R8C2:R897C8,7,FALSE) -> 7.9950772856999999 | I612: =IF(RC[-1]="",((RC[-2]+RC[-3])/2)*0.65,RC[-1]) -> 7.1910419618241317 | J612: =RC[-1]*RC[-5]/R634C5 -> 2.3363902063049664E-3 | M612: 2.976731446783611 | N612: 8.0038473812589679
A613: فولاد امیرکبیر کاشان | B613: فجر | C613: فلزات اساسی | D613: 0.52083333333333004 | E613: =VLOOKUP(RC[-3],'[screener-data-1401-11-24.xlsx]overview'!R8C2:R902C7,6,0) -> 43727820000000 | F613: 5.2052741983817796 | G613: =VLOOKUP(RC[-5],'[screener-data-1401-11-24.xlsx]overview'!R8C2:R897C8,7,FALSE) -> 12.5246144271 | H613: 3.7 | I613: =IF(RC[-1]="",((RC[-2]+RC[-3])/2)*0.65,RC[-1]) -> 3.7 | J613: =RC[-1]*RC[-5]/R634C5 -> 1.3840702838650937E-2 | M613: 0.81236974539717921 | N613: 2.6054164740365526
A614: فولاد خوزستان | B614: فخوز | C614: فلزات اساسی | D614: 0.43933761405880001 | E614: =VLOOKUP(RC[-3],'[screener-data-1401-11-24.xlsx]overview'!R8C2:R902C7,6,0) -> 579690000000000 | F614: 2.8440191387559808 | G614: =VLOOKUP(RC[-5],'[screener-data-1401-11-24.xlsx]overview'!R8C2:R897C8,7,FALSE) -> 9.8563567395000007 | I614: =IF(RC[-1]="",((RC[-2]+RC[-3])/2)*0.65,RC[-1]) -> 4.1276221604331944 | J614: =RC[-1]*RC[-5]/R634C5 -> 0.20468892150242265 | M614: 1.1244885670948543 | N614: 2.2564943384002398
A615: فولاد سپید فراب کویر | B615: کویر | C615: فلزات اساسی | D615: 1.0842952081147199 | E615: =VLOOKUP(RC[-3],'[screener-data-1401-11-24.xlsx]overview'!R8C2:R902C7,6,0) -> 111109320000000 | F615: 5.0790861159929701 | G615: =VLOOKUP(RC[-5],'[screener-data-1401-11-24.xlsx]overview'!R8C2:R897C8,7,FALSE) -> 10.2749443301 | I615: =IF(RC[-1]="",((RC[-2]+RC[-3])/2)*0.65,RC[-1]) -> 4.9900598949802157 | J615: =RC[-1]*RC[-5]/R634C5 -> 4.7430187533268831E-2 | M615: 0.87586658360032565 | N615: 2.3252900749777532
A616: فولاد شاهرود | B616: فرود | C616: فلزات اساسی | E616: =VLOOKUP(RC[-3],'[screener-data-1401-11-24.xlsx]overview'!R8C2:R902C7,6,0) -> 11115900000000 | F616: 10.74934725848564 | G616: =VLOOKUP(RC[-5],'[screener-data-1401-11-24.xlsx]overview'!R8C2:R897C8,7,FALSE) -> 13.516166046 | I616: =IF(RC[-1]="",((RC[-2]+RC[-3])/2)*0.65,RC[-1]) -> 7.8862918239578335 | J616: =RC[-1]*RC[-5]/R634C5 -> 7.4992195524714624E-3 | M616: 0.77457168921975483 | N616: 2.9691283729532301
A617: فولاد مبارکه اصفهان | B617: فولاد | C617: فلزات اساسی | D617: 1.4563106796116501 | E617: =VLOOKUP(RC[-3],'[screener-data-1401-11-24.xlsx]overview'!R8C2:R902C7,6,0) -> 3365500000000000 | F617: 2.1861924686192467 | G617: =VLOOKUP(RC[-5],'[screener-data-1401-11-24.xlsx]overview'!R8C2:R897C8,7,FALSE) -> 5.0201566816999996 | H617: 2.1 | I617: =IF(RC[-1]="",((RC[-2]+RC[-3])/2)*0.65,RC[-1]) -> 2.1 | J617: =RC[-1]*RC[-5]/R634C5 -> 0.60459908185673572 | M617: 2.2819312434236751 | N617: 2.6044477804755881
A618: فولاد هرمزگان جنوب | B618: هرمز | C618: فلزات اساسی | D618: 0.94821298322392 | E618: =VLOOKUP(RC[-3],'[screener-data-1401-11-24.xlsx]overview'!R8C2:R902C7,6,0) -> 346250000000000 | F618: 4.3128700529760051 | G618: =VLOOKUP(RC[-5],'[screener-data-1401-11-24.xlsx]overview'!R8C2:R897C8,7,FALSE) -> 7.1567122911999999 | I618: =IF(RC[-1]="",((RC[-2]+RC[-3])/2)*0.65,RC[-1]) -> 3.7276142618572012 | J618: =RC[-1]*RC[-5]/R634C5 -> 0.11041277889528155 | M618: 1.5627489784318962 | N618: 2.6503159839231833
A619: فولاد کاوه جنوب کیش | B619: کاوه | C619: فلزات اساسی | D619: 2.0671834625322898 | E619: =VLOOKUP(RC[-3],'[screener-data-1401-11-24.xlsx]overview'!R8C2:R902C7,6,0) -> 254080000000000 | F619: 9.5757575757575761 | G619: =VLOOKUP(RC[-5],'[screener-data-1401-11-24.xlsx]overview'!R8C2:R897C8,7,FALSE) -> 7.6952636673999999 | H619: 6.6 | I619: =IF(RC[-1]="",((RC[-2]+RC[-3])/2)*0.65,RC[-1]) -> 6.6 | J619: =RC[-1]*RC[-5]/R634C5 -> 0.14345411481204265 | M619: 1.3443358144057622 | N619: 3.8425151255713574
A620: فولاد کاویان | B620: فوکا | C620: فلزات اساسی | D620: -0.53571428571428004 | E620: =VLOOKUP(RC[-3],'[screener-data-1401-11-24.xlsx]overview'!R8C2:R902C7,6,0) -> 67036422095940 | F620: 10.090579710144928 | G620: =VLOOKUP(RC[-5],'[screener-data-1401-11-24.xlsx]overview'!R8C2:R897C8,7,FALSE) -> 14.8459939907 | I620: =IF(RC[-1]="",((RC[-2]+RC[-3])/2)*0.65,RC[-1]) -> 8.1043864527746017 | J620: =RC[-1]*RC[-5]/R634C5 -> 4.6476087690337078E-2 | M620: 1.6751647705463912 | N620: 7.0187850787201089
A621: فولادخراسان | B621: فخاس | C621: فلزات اساسی | D621: -9.3109869646179996E-2 | E621: =VLOOKUP(RC[-3],'[screener-data-1401-11-24.xlsx]overview'!R8C2:R902C7,6,0) -> 246330000000000 | F621: 4.3023255813953485 | G621: =VLOOKUP(RC[-5],'[screener-data-1401-11-24.xlsx]overview'!R8C2:R897C8,7,FALSE) -> 9.7037036531999998 | I621: =IF(RC[-1]="",((RC[-2]+RC[-3])/2)*0.65,RC[-1]) -> 4.5519595012434886 | J621: =RC[-1]*RC[-5]/R634C5 -> 9.5921130817807329E-2 | M621: 2.3518875267327197 | N621: 2.1084396535994498
A622: گروه صنعتی سدید | B622: وسدید | C622: فلزات اساسی | D622: -2.7487417731320098 | E622: =VLOOKUP(RC[-3],'[screener-data-1401-11-24.xlsx]overview'!R8C2:R902C7,6,0) -> 71164314776142 | F622: 193.23076923076923 | G622: =VLOOKUP(RC[-5],'[screener-data-1401-11-24.xlsx]overview'!R8C2:R897C8,7,FALSE) -> 652.25862400239998 | I622: =IF(RC[-1]="",((RC[-2]+RC[-3])/2)*0.65,RC[-1]) -> 274.78405280078005 | J622: =RC[-1]*RC[-5]/R634C5 -> 1.6728322417068646 | K622: 1.5 | M622: 120.32111604253647 | N622: 2.4572967284041751
A623: گسترش صنایع روی ایرانیان | B623: فگستر | C623: فلزات اساسی | D623: -25.305514157973171 | E623: =VLOOKUP(RC[-3],'[screener-data-1401-11-24.xlsx]overview'!R8C2:R902C7,6,0) -> 7110000000000 | F623: 4.6236162361623618 | G623: =VLOOKUP(RC[-5],'[screener-data-1401-11-24.xlsx]overview'!R8C2:R897C8,7,FALSE) -> 12.521875296099999 | I623: =IF(RC[-1]="",((RC[-2]+RC[-3])/2)*0.65,RC[-1]) -> 5.5722847479852682 | J623: =RC[-1]*RC[-5]/R634C5 -> 3.389233539770596E-3 | M623: 1.3550291805299717 | N623: 2.3493610506687617
A624: لوله و ماشین سازی | B624: فلوله | C624: فلزات اساسی | D624: 1.6757023164120199 | E624: =VLOOKUP(RC[-3],'[screener-data-1401-11-24.xlsx]overview'!R8C2:R902C7,6,0) -> 13701500000000 | F624: 412.6 | G624: =VLOOKUP(RC[-5],'[screener-data-1401-11-24.xlsx]overview'!R8C2:R897C8,7,FALSE) -> 10.6907561439 | I624: =IF(RC[-1]="",((RC[-2]+RC[-3])/2)*0.65,RC[-1]) -> 137.5694957467675 | J624: =RC[-1]*RC[-5]/R634C5 -> 0.161245964417668 | M624: 2.390051426714813 | N624: 1.719009518408454
A625: ماداکتو استیل کرد | B625: فماک | C625: فلزات اساسی | D625: 4.9792531120331898 | E625: =VLOOKUP(RC[-3],'[screener-data-1401-11-24.xlsx]overview'!R8C2:R902C7,6,0) -> 7881300000000 | F625: 31.795332136445243 | G625: =VLOOKUP(RC[-5],'[screener-data-1401-11-24.xlsx]overview'!R8C2:R897C8,7,FALSE) -> 0 | I625: =IF(RC[-1]="",((RC[-2]+RC[-3])/2)*0.65,RC[-1]) -> 10.333482944344704 | J625: =RC[-1]*RC[-5]/R634C5 -> 6.9669577982173587E-3 | M625: 4.9933758605637797 | N625: 15.648630958874223
A626: مس باهنر | B626: فباهنر | C626: فلزات اساسی | D626: -0.31142946122703002 | E626: =VLOOKUP(RC[-3],'[screener-data-1401-11-24.xlsx]overview'!R8C2:R902C7,6,0) -> 83553750000000 | F626: 6.4601412714429864 | G626: =VLOOKUP(RC[-5],'[screener-data-1401-11-24.xlsx]overview'!R8C2:R897C8,7,FALSE) -> 6.7103209738 | I626: =IF(RC[-1]="",((RC[-2]+RC[-3])/2)*0.65,RC[-1]) -> 4.2804002297039707 | J626: =RC[-1]*RC[-5]/R634C5 -> 3.0594891596776953E-2 | M626: 1.5080440863153006 | N626: 5.9124621025788651
A627: ملی سرب و روی | B627: فسرب | C627: فلزات اساسی | D627: 1.8946121965660101 | E627: =VLOOKUP(RC[-3],'[screener-data-1401-11-24.xlsx]overview'!R8C2:R902C7,6,0) -> 18163594680000 | F627: 17.383838383838384 | G627: =VLOOKUP(RC[-5],'[screener-data-1401-11-24.xlsx]overview'!R8C2:R897C8,7,FALSE) -> 27.959870247200001 | H627: 4.5 | I627: =IF(RC[-1]="",((RC[-2]+RC[-3])/2)*0.65,RC[-1]) -> 4.5 | J627: =RC[-1]*RC[-5]/R634C5 -> 6.9921849863611154E-3 | M627: 3.0656746666666668 | N627: 1.4043505193216732
A628: ملی صنایع مس ایران | B628: فملی | C628: فلزات اساسی | D628: 0.89399744572158002 | E628: =VLOOKUP(RC[-3],'[screener-data-1401-11-24.xlsx]overview'!R8C2:R902C7,6,0) -> 3144000000000000 | F628: 6.3099041533546325 | G628: =VLOOKUP(RC[-5],'[screener-data-1401-11-24.xlsx]overview'!R8C2:R897C8,7,FALSE) -> 7.2133180822999998 | H628: 6.3 | I628: =IF(RC[-1]="",((RC[-2]+RC[-3])/2)*0.65,RC[-1]) -> 6.3 | J628: =RC[-1]*RC[-5]/R634C5 -> 1.6944223859969487 | M628: 3.9038004684760694 | N628: 3.2999620183770313
A629: نورد آلومینیوم | B629: فنوال | C629: فلزات اساسی | D629: -2.31065468549422 | E629: =VLOOKUP(RC[-3],'[screener-data-1401-11-24.xlsx]overview'!R8C2:R902C7,6,0) -> 24861417550000 | F629: 1.6355039759295078 | G629: =VLOOKUP(RC[-5],'[screener-data-1401-11-24.xlsx]overview'!R8C2:R897C8,7,FALSE) -> 7.7763405512999997 | I629: =IF(RC[-1]="",((RC[-2]+RC[-3])/2)*0.65,RC[-1]) -> 3.0588494713495904 | J629: =RC[-1]*RC[-5]/R634C5 -> 6.5055285454819704E-3 | M629: 2.8043348263070782 | N629: 5.1314065735259762
A630: نورد قطعات فولادی | B630: فنورد | C630: فلزات اساسی | D630: -0.68259385665529004 | E630: =VLOOKUP(RC[-3],'[screener-data-1401-11-24.xlsx]overview'!R8C2:R902C7,6,0) -> 22888800000000 | F630: 0.44646966767927826 | G630: =VLOOKUP(RC[-5],'[screener-data-1401-11-24.xlsx]overview'!R8C2:R897C8,7,FALSE) -> 6.4091715235000004 | I630: =IF(RC[-1]="",((RC[-2]+RC[-3])/2)*0.65,RC[-1]) -> 2.2280833871332657 | J630: =RC[-1]*RC[-5]/R634C5 -> 4.3626769826009739E-3 | M630: 0.95180824445372181 | N630: 5.7827088294500841
A631: نورد و لوله اهواز | B631: فاهواز | C631: فلزات اساسی | D631: -4.791566842357E-2 | E631: =VLOOKUP(RC[-3],'[screener-data-1401-11-24.xlsx]overview'!R8C2:R902C7,6,0) -> 23533734000000 | F631: -13.678688524590164 | G631: =VLOOKUP(RC[-5],'[screener-data-1401-11-24.xlsx]overview'!R8C2:R897C8,7,FALSE) -> 0 | I631: =IF(RC[-1]="",((RC[-2]+RC[-3])/2)*0.65,RC[-1]) -> -4.4455737704918032 | J631: =RC[-1]*RC[-5]/R634C5 -> -8.9498808881410662E-3 | M631: 9.7607275269451357 | N631: -5.2324228844852483
A632: کالسیمین | B632: فاسمین | C632: فلزات اساسی | D632: -0.38167938931297002 | E632: =VLOOKUP(RC[-3],'[screener-data-1401-11-24.xlsx]overview'!R8C2:R902C7,6,0) -> 139140000000000 | F632: 6.2506652474720594 | G632: =VLOOKUP(RC[-5],'[screener-data-1401-11-24.xlsx]overview'!R8C2:R897C8,7,FALSE) -> 5.0423043002999997 | I632: =IF(RC[-1]="",((RC[-2]+RC[-3])/2)*0.65,RC[-1]) -> 3.6702151030259196 | J632: =RC[-1]*RC[-5]/R634C5 -> 4.3685982829236726E-2 | M632: 3.7932300451917578 | N632: 3.2839163034258512
A633: کیمیای زنجان گستران | B633: کیمیا | C633: فلزات اساسی | D633: -30 | E633: =VLOOKUP(RC[-3],'[screener-data-1401-11-24.xlsx]overview'!R8C2:R902C7,6,0) -> 15990000000000 | F633: 4.9710144927536231 | G633: =VLOOKUP(RC[-5],'[screener-data-1401-11-24.xlsx]overview'!R8C2:R897C8,7,FALSE) -> 7.3885188802000004 | I633: =IF(RC[-1]="",((RC[-2]+RC[-3])/2)*0.65,RC[-1]) -> 4.0168483462099278 | J633: =RC[-1]*RC[-5]/R634C5 -> 5.4945545945907061E-3 | M633: 2.1804090354116226 | N633: 2.0529677654134186
E634: =SUM(R[-49]C:R[-1]C) -> 1.1689647258966082E+16 | J634: =SUM(R[-49]C:R[-1]C) -> 7.4779348942651307
A635: تابان نیرو سپاهان | B635: تابا | C635: فنی و مهندسی | D635: -4.8728813559321997 | E635: =VLOOKUP(RC[-3],'[screener-data-1401-11-24.xlsx]overview'!R8C2:R902C7,6,0) -> 1435300000000 | F635: 224.5 | G635: =VLOOKUP(RC[-5],'[screener-data-1401-11-24.xlsx]overview'!R8C2:R897C8,7,FALSE) -> 538.8261851016 | I635: =IF(RC[-1]="",((RC[-2]+RC[-3])/2)*0.65,RC[-1]) -> 248.08101015802001 | J635: =RC[-1]*RC[-5]/R640C5 -> 0.55841612977286093 | M635: 2.7348355051163962 | N635: 10.605679627555414
A636: جنرال مکانیک | B636: رنیک | C636: فنی و مهندسی | D636: -0.78571428571428004 | E636: =VLOOKUP(RC[-3],'[screener-data-1401-11-24.xlsx]overview'!R8C2:R902C7,6,0) -> 27020000000000 | F636: 10.611153552330023 | G636: =VLOOKUP(RC[-5],'[screener-data-1401-11-24.xlsx]overview'!R8C2:R897C8,7,FALSE) -> 7.6093877653000002 | I636: =IF(RC[-1]="",((RC[-2]+RC[-3])/2)*0.65,RC[-1]) -> 5.9216759282297575 | J636: =RC[-1]*RC[-5]/R640C5 -> 0.25092950441836764 | M636: 1.0920575106211807 | N636: 0.75781284871816446
A637: خدمات فنی فولاد یزد | B637: خفولا | C637: فنی و مهندسی | D637: -2.4319066147859898 | E637: =VLOOKUP(RC[-3],'[screener-data-1401-11-24.xlsx]overview'!R8C2:R902C7,6,0) -> 7965000000000 | F637: 227.95454545454547 | G637: =VLOOKUP(RC[-5],'[screener-data-1401-11-24.xlsx]overview'!R8C2:R897C8,7,FALSE) -> 106.3296872212 | I637: =IF(RC[-1]="",((RC[-2]+RC[-3])/2)*0.65,RC[-1]) -> 108.64237561961727 | J637: =RC[-1]*RC[-5]/R640C5 -> 1.3570841602740435 | M637: 10.305076851420587 | N637: 18.693713842667144
A638: گروه مپنا | B638: رمپنا | C638: فنی و مهندسی | D638: -9.9900099900089995E-2 | E638: =VLOOKUP(RC[-3],'[screener-data-1401-11-24.xlsx]overview'!R8C2:R902C7,6,0) -> 598800000000000 | F638: 8.090614886731391 | G638: =VLOOKUP(RC[-5],'[screener-data-1401-11-24.xlsx]overview'!R8C2:R897C8,7,FALSE) -> 0 | I638: =IF(RC[-1]="",((RC[-2]+RC[-3])/2)*0.65,RC[-1]) -> 2.6294498381877021 | J638: =RC[-1]*RC[-5]/R640C5 -> 2.4692691454222233 | M638: 2.8713585430956461 | N638: 2.9260292348066335
A639: مرآت پولاد | B639: تپولا | C639: فنی و مهندسی | D639: -0.10610079575596 | E639: =VLOOKUP(RC[-3],'[screener-data-1401-11-24.xlsx]overview'!R8C2:R902C7,6,0) -> 2423662800000 | F639: -62.976588628762542 | G639: =VLOOKUP(RC[-5],'[screener-data-1401-11-24.xlsx]overview'!R8C2:R897C8,7,FALSE) -> 0 | I639: =IF(RC[-1]="",((RC[-2]+RC[-3])/2)*0.65,RC[-1]) -> -20.467391304347828 | J639: =RC[-1]*RC[-5]/R640C5 -> -7.7795851307935121E-2 | M639: 29.51956467630734 | N639: 476.40391644908618
E640: =SUM(R[-5]C:R[-1]C) -> 637643962800000 | J640: =SUM(R[-5]C:R[-1]C) -> 4.5579030885795602
A641: شهد | B641: قشهد | C641: قند و شکر | D641: -4.0343915343915304 | E641: =VLOOKUP(RC[-3],'[screener-data-1401-11-24.xlsx]overview'!R8C2:R902C7,6,0) -> 10082012320000 | F641: 8.5756501182033098 | G641: =VLOOKUP(RC[-5],'[screener-data-1401-11-24.xlsx]overview'!R8C2:R897C8,7,FALSE) -> 11.8761806872 | I641: =IF(RC[-1]="",((RC[-2]+RC[-3])/2)*0.65,RC[-1]) -> 6.646845011756076 | J641: =RC[-1]*RC[-5]/R659C5 -> 0.25758367378983194 | M641: 1.4123252501789219 | N641: 3.8446332006284414
A642: شکر شاهرود | B642: قشکر | C642: قند و شکر | D642: -0.96830985915491996 | E642: =VLOOKUP(RC[-3],'[screener-data-1401-11-24.xlsx]overview'!R8C2:R902C7,6,0) -> 5567190459000 | F642: -8.3955223880597014 | G642: =VLOOKUP(RC[-5],'[screener-data-1401-11-24.xlsx]overview'!R8C2:R897C8,7,FALSE) -> 0 | I642: =IF(RC[-1]="",((RC[-2]+RC[-3])/2)*0.65,RC[-1]) -> -2.7285447761194033 | J642: =RC[-1]*RC[-5]/R659C5 -> -5.8387881951109971E-2 | M642: 1.372628430759403 | N642: 3.0439914375510404
A643: فرآورده های غذایی و قند چهارمحال | B643: قچار | C643: قند و شکر | D643: 0.20682523267837999 | E643: =VLOOKUP(RC[-3],'[screener-data-1401-11-24.xlsx]overview'!R8C2:R902C7,6,0) -> 23798252400000 | F643: 19.037328094302556 | G643: =VLOOKUP(RC[-5],'[screener-data-1401-11-24.xlsx]overview'!R8C2:R897C8,7,FALSE) -> 15.566469404999999 | I643: =IF(RC[-1]="",((RC[-2]+RC[-3])/2)*0.65,RC[-1]) -> 11.246234187273332 | J643: =RC[-1]*RC[-5]/R659C5 -> 1.0287450206500575 | M643: 3.6272123085533354 | N643: 4.9763922688787448
A644: قند ارومیه | B644: قاروم | C644: قند و شکر | D644: -3.7907505686120002E-2 | E644: =VLOOKUP(RC[-3],'[screener-data-1401-11-24.xlsx]overview'!R8C2:R902C7,6,0) -> 22608300000000 | F644: 41.164533250078051 | G644: =VLOOKUP(RC[-5],'[screener-data-1401-11-24.xlsx]overview'!R8C2:R897C8,7,FALSE) -> 39.447116755700002 | I644: =IF(RC[-1]="",((RC[-2]+RC[-3])/2)*0.65,RC[-1]) -> 26.198786251877866 | J644: =RC[-1]*RC[-5]/R659C5 -> 2.2766938586473144 | M644: 2.8634780888580251 | N644: 20.162167364419421
A645: قند اصفهان | B645: قصفها | C645: قند و شکر | D645: -0.35910940866649999 | E645: =VLOOKUP(RC[-3],'[screener-data-1401-11-24.xlsx]overview'!R8C2:R902C7,6,0) -> 16044600000000 | F645: 15.140050927610041 | G645: =VLOOKUP(RC[-5],'[screener-data-1401-11-24.xlsx]overview'!R8C2:R897C8,7,FALSE) -> 13.349444224599999 | I645: =IF(RC[-1]="",((RC[-2]+RC[-3])/2)*0.65,RC[-1]) -> 9.2590859244682626 | J645: =RC[-1]*RC[-5]/R659C5 -> 0.57102163840190057 | M645: 1.523153732790764 | N645: 13.783610277034279
A646: قند بیستون | B646: قیستو | C646: قند و شکر | D646: -1.3806706114398399 | E646: =VLOOKUP(RC[-3],'[screener-data-1401-11-24.xlsx]overview'!R8C2:R902C7,6,0) -> 11952000000000 | F646: 23.452157598499063 | G646: =VLOOKUP(RC[-5],'[screener-data-1401-11-24.xlsx]overview'!R8C2:R897C8,7,FALSE) -> 0 | I646: =IF(RC[-1]="",((RC[-2]+RC[-3])/2)*0.65,RC[-1]) -> 7.6219512195121961 | J646: =RC[-1]*RC[-5]/R659C5 -> 0.35015659178723124 | M646: 3.0362482497293946 | N646: 6.7603043939725129
A647: قند پیرانشهر | B647: قپیرا | C647: قند و شکر | D647: -1.20048019207683 | E647: =VLOOKUP(RC[-3],'[screener-data-1401-11-24.xlsx]overview'!R8C2:R902C7,6,0) -> 20612401350000 | F647: 20.782828282828284 | G647: =VLOOKUP(RC[-5],'[screener-data-1401-11-24.xlsx]overview'!R8C2:R897C8,7,FALSE) -> 19.514752669100002 | I647: =IF(RC[-1]="",((RC[-2]+RC[-3])/2)*0.65,RC[-1]) -> 13.096713809376691 | J647: =RC[-1]*RC[-5]/R659C5 -> 1.0376394732383725 | M647: 2.9134947102207662 | N647: 6.0189113567607864
A648: قند تربت جام | B648: قجام | C648: قند و شکر | D648: 1.9667170953101301 | E648: =VLOOKUP(RC[-3],'[screener-data-1401-11-24.xlsx]overview'!R8C2:R902C7,6,0) -> 4628000000000 | F648: -44.052287581699346 | G648: =VLOOKUP(RC[-5],'[screener-data-1401-11-24.xlsx]overview'!R8C2:R897C8,7,FALSE) -> 12.621006099300001 | I648: =IF(RC[-1]="",((RC[-2]+RC[-3])/2)*0.65,RC[-1]) -> -10.215166481779788 | J648: =RC[-1]*RC[-5]/R659C5 -> -0.18171649702172243 | M648: 4.7808669290814425 | N648: 1.6280556236854036
A649: قند تربت حیدریه | B649: قتربت | C649: قند و شکر | D649: -0.45688178183894002 | E649: =VLOOKUP(RC[-3],'[screener-data-1401-11-24.xlsx]overview'!R8C2:R902C7,6,0) -> 8900000000000 | F649: 83.79807692307692 | G649: =VLOOKUP(RC[-5],'[screener-data-1401-11-24.xlsx]overview'!R8C2:R897C8,7,FALSE) -> 73.430149314800005 | I649: =IF(RC[-1]="",((RC[-2]+RC[-3])/2)*0.65,RC[-1]) -> 51.099173527310001 | J649: =RC[-1]*RC[-5]/R659C5 -> 1.7480724956762983 | M649: 1.7893682575310537 | N649: 1.1717384484381301
A650: قند ثابت خراسان | B650: قثابت | C650: قند و شکر | D650: 0.2730996813837 | E650: =VLOOKUP(RC[-3],'[screener-data-1401-11-24.xlsx]overview'!R8C2:R902C7,6,0) -> 15013105307000 | F650: 157.35714285714286 | G650: =VLOOKUP(RC[-5],'[screener-data-1401-11-24.xlsx]overview'!R8C2:R897C8,7,FALSE) -> 0 | I650: =IF(RC[-1]="",((RC[-2]+RC[-3])/2)*0.65,RC[-1]) -> 51.141071428571429 | J650: =RC[-1]*RC[-5]/R659C5 -> 2.9511814361743682 | M650: 14.584623938234222 | N650: 2.2943144986928714
A651: قند شیروان قوچان | B651: قشیر | C651: قند و شکر | D651: 6.5190651906518999 | E651: =VLOOKUP(RC[-3],'[screener-data-1401-11-24.xlsx]overview'!R8C2:R902C7,6,0) -> 6783973865760 | F651: -17.892561983471076 | G651: =VLOOKUP(RC[-5],'[screener-data-1401-11-24.xlsx]overview'!R8C2:R897C8,7,FALSE) -> 22.610517445199999 | I651: =IF(RC[-1]="",((RC[-2]+RC[-3])/2)*0.65,RC[-1]) -> 1.5333355250619001 | J651: =RC[-1]*RC[-5]/R659C5 -> 3.9983142150091425E-2 | M651: 1.0904631340173985 | N651: 9.3313553894872268
A652: قند شیرین خراسان | B652: قشرین | C652: قند و شکر | D652: 2.6225769669327201 | E652: =VLOOKUP(RC[-3],'[screener-data-1401-11-24.xlsx]overview'!R8C2:R902C7,6,0) -> 18613867950000 | F652: 41.095890410958901 | G652: =VLOOKUP(RC[-5],'[screener-data-1401-11-24.xlsx]overview'!R8C2:R897C8,7,FALSE) -> 66.591829687900002 | I652: =IF(RC[-1]="",((RC[-2]+RC[-3])/2)*0.65,RC[-1]) -> 34.998509032129142 | J652: =RC[-1]*RC[-5]/R659C5 -> 2.5040426924799304 | M652: 12.014310872983293 | N652: 8.71857816471082
A653: قند قزوین | B653: قزوین | C653: قند و شکر | D653: 3.9408866995073799 | E653: =VLOOKUP(RC[-3],'[screener-data-1401-11-24.xlsx]overview'!R8C2:R902C7,6,0) -> 12540836700000 | F653: 11.965973534971644 | G653: =VLOOKUP(RC[-5],'[screener-data-1401-11-24.xlsx]overview'!R8C2:R897C8,7,FALSE) -> 7.3160736160999997 | I653: =IF(RC[-1]="",((RC[-2]+RC[-3])/2)*0.65,RC[-1]) -> 6.2666653240982848 | J653: =RC[-1]*RC[-5]/R659C5 -> 0.30207763415174266 | M653: 2.1273741890087274 | N653: 3.7344843667938523
A654: قند لرستان | B654: قلرست | C654: قند و شکر | D654: 2.3360287511230902 | E654: =VLOOKUP(RC[-3],'[screener-data-1401-11-24.xlsx]overview'!R8C2:R902C7,6,0) -> 9108000000000 | F654: 8.6255206361226815 | G654: =VLOOKUP(RC[-5],'[screener-data-1401-11-24.xlsx]overview'!R8C2:R897C8,7,FALSE) -> 8.6416005454999993 | I654: =IF(RC[-1]="",((RC[-2]+RC[-3])/2)*0.65,RC[-1]) -> 5.6118143840273715 | J654: =RC[-1]*RC[-5]/R659C5 -> 0.19646350006129187 | M654: 3.0804077010192525 | N654: 4.1535462861498011
A655: قند مرودشت | B655: قمرو | C655: قند و شکر | D655: -0.18315018315018 | E655: =VLOOKUP(RC[-3],'[screener-data-1401-11-24.xlsx]overview'!R8C2:R902C7,6,0) -> 10390000000000 | F655: 7.6170510132774281 | G655: =VLOOKUP(RC[-5],'[screener-data-1401-11-24.xlsx]overview'!R8C2:R897C8,7,FALSE) -> 6.9932863097000002 | I655: =IF(RC[-1]="",((RC[-2]+RC[-3])/2)*0.65,RC[-1]) -> 4.7483596299676645 | J655: =RC[-1]*RC[-5]/R659C5 -> 0.18963334623545505 | M655: 2.1107186164220106 | N655: 4.5645521902103336
A656: قند نقش جهان | B656: قنقش | C656: قند و شکر | D656: -0.60901339829475998 | E656: =VLOOKUP(RC[-3],'[screener-data-1401-11-24.xlsx]overview'!R8C2:R902C7,6,0) -> 33172350000000 | F656: -313.44430217669657 | G656: =VLOOKUP(RC[-5],'[screener-data-1401-11-24.xlsx]overview'!R8C2:R897C8,7,FALSE) -> 30.108339861899999 | I656: =IF(RC[-1]="",((RC[-2]+RC[-3])/2)*0.65,RC[-1]) -> -92.084187752308893 | J656: =RC[-1]*RC[-5]/R659C5 -> -11.741318191523476 | M656: 9.1932930718797436 | N656: 34.297464016449624
A657: قند نیشابور | B657: قنیشا | C657: قند و شکر | D657: -0.75939248601119003 | E657: =VLOOKUP(RC[-3],'[screener-data-1401-11-24.xlsx]overview'!R8C2:R902C7,6,0) -> 9548000000000 | F657: 118.23809523809524 | G657: =VLOOKUP(RC[-5],'[screener-data-1401-11-24.xlsx]overview'!R8C2:R897C8,7,FALSE) -> 154.25862350829999 | I657: =IF(RC[-1]="",((RC[-2]+RC[-3])/2)*0.65,RC[-1]) -> 88.561433592578453 | J657: =RC[-1]*RC[-5]/R659C5 -> 3.2502188555597167 | M657: 2.5225087939858026 | N657: 2.3699497056140952
A658: قند هگمتان | B658: قهکمت | C658: قند و شکر | D658: 1.31578947368421 | E658: =VLOOKUP(RC[-3],'[screener-data-1401-11-24.xlsx]overview'!R8C2:R902C7,6,0) -> 20799457330000 | F658: 15.338645418326694 | G658: =VLOOKUP(RC[-5],'[screener-data-1401-11-24.xlsx]overview'!R8C2:R897C8,7,FALSE) -> 7.5662964731000004 | I658: =IF(RC[-1]="",((RC[-2]+RC[-3])/2)*0.65,RC[-1]) -> 7.4441061147136764 | J658: =RC[-1]*RC[-5]/R659C5 -> 0.59514133721754758 | M658: 3.4459978851344584 | N658: 3.8119089504381951
E659: =SUM(R[-18]C:R[-1]C) -> 260162347681760 | J659: =SUM(R[-18]C:R[-1]C) -> 5.3172321257248409
A660: بهسرام | B660: کهرام | C660: کاشی و سرامیک | D660: -9.0991810737029999E-2 | E660: =VLOOKUP(RC[-3],'[screener-data-1401-11-24.xlsx]overview'!R8C2:R902C7,6,0) -> 4095000000000 | F660: -49.326145552560646 | G660: =VLOOKUP(RC[-5],'[screener-data-1401-11-24.xlsx]overview'!R8C2:R897C8,7,FALSE) -> 0 | I660: =IF(RC[-1]="",((RC[-2]+RC[-3])/2)*0.65,RC[-1]) -> -16.030997304582211 | J660: =RC[-1]*RC[-5]/R670C5 -> -0.61124738036561699 | M660: 17.371878441150784 | N660: -5.4712809241980107
A661: کاشی اصفهان | B661: کاصفا | C661: کاشی و سرامیک | D661: -6.4395357543990999 | E661: =VLOOKUP(RC[-3],'[screener-data-1401-11-24.xlsx]overview'!R8C2:R902C7,6,0) -> 150000000000 | F661: 5.0484848484848488 | G661: =VLOOKUP(RC[-5],'[screener-data-1401-11-24.xlsx]overview'!R8C2:R897C8,7,FALSE) -> 0 | I661: =IF(RC[-1]="",((RC[-2]+RC[-3])/2)*0.65,RC[-1]) -> 1.6407575757575759 | J661: =RC[-1]*RC[-5]/R670C5 -> 2.2915969782534573E-3 | M661: 1.2870430456413584 | N661: -1.4352445678185124
A662: کاشی الوند | B662: کلوند | C662: کاشی و سرامیک | D662: 3.029385034837E-2 | E662: =VLOOKUP(RC[-3],'[screener-data-1401-11-24.xlsx]overview'!R8C2:R902C7,6,0) -> 13284000000000 | F662: 11.955104996379434 | G662: =VLOOKUP(RC[-5],'[screener-data-1401-11-24.xlsx]overview'!R8C2:R897C8,7,FALSE) -> 7.8293817022000001 | I662: =IF(RC[-1]="",((RC[-2]+RC[-3])/2)*0.65,RC[-1]) -> 6.4299581770383165 | J662: =RC[-1]*RC[-5]/R670C5 -> 0.79531574203444444 | M662: 3.6892412028579886 | N662: 6.090599044170677
A663: کاشی پارس | B663: کپارس | C663: کاشی و سرامیک | D663: 0 | E663: =VLOOKUP(RC[-3],'[screener-data-1401-11-24.xlsx]overview'!R8C2:R902C7,6,0) -> 13590764010000 | F663: 9.7235023041474662 | G663: =VLOOKUP(RC[-5],'[screener-data-1401-11-24.xlsx]overview'!R8C2:R897C8,7,FALSE) -> 6.8159592017000001 | I663: =IF(RC[-1]="",((RC[-2]+RC[-3])/2)*0.65,RC[-1]) -> 5.3753249894004265 | J663: =RC[-1]*RC[-5]/R670C5 -> 0.68022276401378712 | M663: 2.9094123538852026 | N663: 3.401381766694175
A664: کاشی تکسرام | B664: کترام | C664: کاشی و سرامیک | D664: -1.9467213114754001 | E664: =VLOOKUP(RC[-3],'[screener-data-1401-11-24.xlsx]overview'!R8C2:R902C7,6,0) -> 8802716740000 | F664: 12.222222222222221 | G664: =VLOOKUP(RC[-5],'[screener-data-1401-11-24.xlsx]overview'!R8C2:R897C8,7,FALSE) -> 10.7343798992 | I664: =IF(RC[-1]="",((RC[-2]+RC[-3])/2)*0.65,RC[-1]) -> 7.4608956894622223 | J664: =RC[-1]*RC[-5]/R670C5 -> 0.61151942765860445 | M664: 3.338454026774988 | N664: 4.2115599917718951
A665: کاشی حافظ | B665: کحافظ | C665: کاشی و سرامیک | D665: -0.68493150684931003 | E665: =VLOOKUP(RC[-3],'[screener-data-1401-11-24.xlsx]overview'!R8C2:R902C7,6,0) -> 29562095500000 | F665: 16.201117318435752 | G665: =VLOOKUP(RC[-5],'[screener-data-1401-11-24.xlsx]overview'!R8C2:R897C8,7,FALSE) -> 7.4083022036999999 | H665: 5 | I665: =IF(RC[-1]="",((RC[-2]+RC[-3])/2)*0.65,RC[-1]) -> 5 | J665: =RC[-1]*RC[-5]/R670C5 -> 1.376283121073121 | M665: 6.6584949009269678 | N665: 2.9830346562995778
A666: کاشی سعدی | B666: کسعدی | C666: کاشی و سرامیک | D666: -0.93808630393995995 | E666: =VLOOKUP(RC[-3],'[screener-data-1401-11-24.xlsx]overview'!R8C2:R902C7,6,0) -> 5260000000000 | F666: 12.862362971985384 | G666: =VLOOKUP(RC[-5],'[screener-data-1401-11-24.xlsx]overview'!R8C2:R897C8,7,FALSE) -> 11.1051854898 | I666: =IF(RC[-1]="",((RC[-2]+RC[-3])/2)*0.65,RC[-1]) -> 7.7894532500802498 | J666: =RC[-1]*RC[-5]/R670C5 -> 0.38150065065780742 | M666: 2.502948549237928 | N666: 5.507969343143361
A667: کاشی سینا | B667: کساوه | C667: کاشی و سرامیک | D667: 2.1916716477385898 | E667: =VLOOKUP(RC[-3],'[screener-data-1401-11-24.xlsx]overview'!R8C2:R902C7,6,0) -> 26911731000000 | F667: 9.8729547641963418 | G667: =VLOOKUP(RC[-5],'[screener-data-1401-11-24.xlsx]overview'!R8C2:R897C8,7,FALSE) -> 8.1722039068000001 | I667: =IF(RC[-1]="",((RC[-2]+RC[-3])/2)*0.65,RC[-1]) -> 5.8646765680738122 | J667: =RC[-1]*RC[-5]/R670C5 -> 1.4695631825426712 | M667: 3.2865629349741248 | N667: 5.2051053137815435
A668: کاشی صدف سرام استقلال آباده | B668: کصدف | C668: کاشی و سرامیک | D668: -2.62096774193548 | E668: =VLOOKUP(RC[-3],'[screener-data-1401-11-24.xlsx]overview'!R8C2:R902C7,6,0) -> 5592000000000 | F668: 11.991062562065542 | G668: =VLOOKUP(RC[-5],'[screener-data-1401-11-24.xlsx]overview'!R8C2:R897C8,7,FALSE) -> 14.470581882999999 | I668: =IF(RC[-1]="",((RC[-2]+RC[-3])/2)*0.65,RC[-1]) -> 8.6000344446463011 | J668: =RC[-1]*RC[-5]/R670C5 -> 0.44778538736663487 | M668: 7.9989952952769219 | N668: 5.1661253346929028
A669: کاشی نیلو | B669: کنیلو | C669: کاشی و سرامیک | D669: -4.9540347293156204 | E669: =VLOOKUP(RC[-3],'[screener-data-1401-11-24.xlsx]overview'!R8C2:R902C7,6,0) -> 150000000000 | F669: -4.4521531100478473 | G669: =VLOOKUP(RC[-5],'[screener-data-1401-11-24.xlsx]overview'!R8C2:R897C8,7,FALSE) -> 0 | I669: =IF(RC[-1]="",((RC[-2]+RC[-3])/2)*0.65,RC[-1]) -> -1.4469497607655504 | J669: =RC[-1]*RC[-5]/R670C5 -> -2.0209114060764917E-3 | M669: 0.73085291045186429 | N669: -1.1841234559522194
E670: =SUM(R[-10]C:R[-1]C) -> 107398307250000 | J670: =SUM(R[-10]C:R[-1]C) -> 5.1512135805536294
A671: آذریت | B671: ساذری | C671: کانی غیر فلزی | D671: -0.68306010928961003 | E671: =VLOOKUP(RC[-3],'[screener-data-1401-11-24.xlsx]overview'!R8C2:R902C7,6,0) -> 1653000000000 | F671: -11.253869969040247 | G671: =VLOOKUP(RC[-5],'[screener-data-1401-11-24.xlsx]overview'!R8C2:R897C8,7,FALSE) -> 276.55800099290002 | I671: =IF(RC[-1]="",((RC[-2]+RC[-3])/2)*0.65,RC[-1]) -> 86.223842582754429 | J671: =RC[-1]*RC[-5]/R696C5 -> 0.47948684278747034 | M671: 30.036422941016582 | N671: -72.401502577094433
A672: ایتالران | B672: کایتا | C672: کانی غیر فلزی | D672: -0.14598540145985001 | E672: =VLOOKUP(RC[-3],'[screener-data-1401-11-24.xlsx]overview'!R8C2:R902C7,6,0) -> 6780000000000 | F672: 621.81818181818187 | G672: =VLOOKUP(RC[-5],'[screener-data-1401-11-24.xlsx]overview'!R8C2:R897C8,7,FALSE) -> 2119.3744015320999 | I672: =IF(RC[-1]="",((RC[-2]+RC[-3])/2)*0.65,RC[-1]) -> 890.88758958884159 | J672: =RC[-1]*RC[-5]/R696C5 -> 20.320251113028661 | M672: 3967.5174013921114 | N672: 41.096137323584017
A673: ایرانیت | B673: سایرا | C673: کانی غیر فلزی | D673: 0 | E673: =VLOOKUP(RC[-3],'[screener-data-1401-11-24.xlsx]overview'!R8C2:R902C7,6,0) -> 1409040000000 | F673: -53.460207612456749 | G673: =VLOOKUP(RC[-5],'[screener-data-1401-11-24.xlsx]overview'!R8C2:R897C8,7,FALSE) -> 5.5228735553000003 | I673: =IF(RC[-1]="",((RC[-2]+RC[-3])/2)*0.65,RC[-1]) -> -15.579633568575943 | J673: =RC[-1]*RC[-5]/R696C5 -> -7.3851110227740213E-2 | M673: 6234.6902654867254 | N673: -2.1657646745988686
A674: پارس سرام | B674: کسرام | C674: کانی غیر فلزی | D674: -0.78431372549018996 | E674: =VLOOKUP(RC[-3],'[screener-data-1401-11-24.xlsx]overview'!R8C2:R902C7,6,0) -> 4965120729360 | F674: 70.277777777777771 | G674: =VLOOKUP(RC[-5],'[screener-data-1401-11-24.xlsx]overview'!R8C2:R897C8,7,FALSE) -> 37.983646472300002 | I674: =IF(RC[-1]="",((RC[-2]+RC[-3])/2)*0.65,RC[-1]) -> 35.184962881275275 | J674: =RC[-1]*RC[-5]/R696C5 -> 0.58771040254719253 | M674: 5.6731844134594622 | N674: 5.130941714323507
A675: پرمیت | B675: سپرمی | C675: کانی غیر فلزی | D675: 0.87719298245613997 | E675: =VLOOKUP(RC[-3],'[screener-data-1401-11-24.xlsx]overview'!R8C2:R902C7,6,0) -> 1214400000000 | F675: 35.567010309278352 | G675: =VLOOKUP(RC[-5],'[screener-data-1401-11-24.xlsx]overview'!R8C2:R897C8,7,FALSE) -> 0 | I675: =IF(RC[-1]="",((RC[-2]+RC[-3])/2)*0.65,RC[-1]) -> 11.559278350515465 | J675: =RC[-1]*RC[-5]/R696C5 -> 4.7224671754124842E-2 | M675: 2409.5238095238096 | N675: -6.8399945928896502
A676: پشم شیشه ایران | B676: کپشیر | C676: کانی غیر فلزی | D676: -1.7543859649122799 | E676: =VLOOKUP(RC[-3],'[screener-data-1401-11-24.xlsx]overview'!R8C2:R902C7,6,0) -> 11055000000000 | F676: 9.8989898989898997 | G676: =VLOOKUP(RC[-5],'[screener-data-1401-11-24.xlsx]overview'!R8C2:R897C8,7,FALSE) -> 13.0349621258 | I676: =IF(RC[-1]="",((RC[-2]+RC[-3])/2)*0.65,RC[-1]) -> 7.4535344080567176 | J676: =RC[-1]*RC[-5]/R696C5 -> 0.27720271220127118 | M676: 4.9140480348195403 | N676: 2.8622916441528932
A677: تهیه و تولید خاک نسوز استقلال آباده | B677: کباده | C677: کانی غیر فلزی | D677: 2.8863499699338502 | E677: =VLOOKUP(RC[-3],'[screener-data-1401-11-24.xlsx]overview'!R8C2:R902C7,6,0) -> 7606056090000 | F677: 11.301188903566711 | G677: =VLOOKUP(RC[-5],'[screener-data-1401-11-24.xlsx]overview'!R8C2:R897C8,7,FALSE) -> 9.7402989149000003 | I677: =IF(RC[-1]="",((RC[-2]+RC[-3])/2)*0.65,RC[-1]) -> 6.8384835410016818 | J677: =RC[-1]*RC[-5]/R696C5 -> 0.17498297554598324 | M677: 4.4632145303559696 | N677: 5.467353459680611
A678: خاک چینی ایران | B678: کخاک | C678: کانی غیر فلزی | D678: -0.37965072133637001 | E678: =VLOOKUP(RC[-3],'[screener-data-1401-11-24.xlsx]overview'!R8C2:R902C7,6,0) -> 44520000000000 | F678: 4.4565217391304346 | G678: =VLOOKUP(RC[-5],'[screener-data-1401-11-24.xlsx]overview'!R8C2:R897C8,7,FALSE) -> 8.7919425741000001 | I678: =IF(RC[-1]="",((RC[-2]+RC[-3])/2)*0.65,RC[-1]) -> 4.3057509017998914 | J678: =RC[-1]*RC[-5]/R696C5 -> 0.64488240009359832 | M678: 7.5465161702022066 | N678: 5.6193277463118267
A679: سایپا شیشه | B679: کساپا | C679: کانی غیر فلزی | D679: -0.27944111776447 | E679: =VLOOKUP(RC[-3],'[screener-data-1401-11-24.xlsx]overview'!R8C2:R902C7,6,0) -> 15771696462000 | F679: 138.01104972375691 | G679: =VLOOKUP(RC[-5],'[screener-data-1401-11-24.xlsx]overview'!R8C2:R897C8,7,FALSE) -> 0 | I679: =IF(RC[-1]="",((RC[-2]+RC[-3])/2)*0.65,RC[-1]) -> 44.853591160221001 | J679: =RC[-1]*RC[-5]/R696C5 -> 2.3798637720057818 | M679: 7.314650760647007 | N679: 17.699229544103286
A680: سرامیک اردکان | B680: کسرا | C680: کانی غیر فلزی | D680: 0.51635111876075002 | E680: =VLOOKUP(RC[-3],'[screener-data-1401-11-24.xlsx]overview'!R8C2:R902C7,6,0) -> 20045150580000 | F680: 12.586206896551724 | G680: =VLOOKUP(RC[-5],'[screener-data-1401-11-24.xlsx]overview'!R8C2:R897C8,7,FALSE) -> 10.5759428049 | I680: =IF(RC[-1]="",((RC[-2]+RC[-3])/2)*0.65,RC[-1]) -> 7.5276986529718108 | J680: =RC[-1]*RC[-5]/R696C5 -> 0.50763085987199341 | M680: 5.583250410992008 | N680: 3.6796561893148687
A681: شیشه دارویی رازی | B681: کرازی | C681: کانی غیر فلزی | D681: -1.4757554462403299 | E681: =VLOOKUP(RC[-3],'[screener-data-1401-11-24.xlsx]overview'!R8C2:R902C7,6,0) -> 29033600000000 | F681: 7.6612021857923498 | G681: =VLOOKUP(RC[-5],'[screener-data-1401-11-24.xlsx]overview'!R8C2:R897C8,7,FALSE) -> 7.5212051685999999 | I681: =IF(RC[-1]="",((RC[-2]+RC[-3])/2)*0.65,RC[-1]) -> 4.9342823901775139 | J681: =RC[-1]*RC[-5]/R696C5 -> 0.48194930401883684 | M681: 4.508852117600652 | N681: 1.2339120039238654
A682: شیشه سازی مینا | B682: کمینا | C682: کانی غیر فلزی | D682: -0.10834236186347999 | E682: =VLOOKUP(RC[-3],'[screener-data-1401-11-24.xlsx]overview'!R8C2:R902C7,6,0) -> 11737060000000 | F682: 15.290215588723051 | G682: =VLOOKUP(RC[-5],'[screener-data-1401-11-24.xlsx]overview'!R8C2:R897C8,7,FALSE) -> 0 | I682: =IF(RC[-1]="",((RC[-2]+RC[-3])/2)*0.65,RC[-1]) -> 4.9693200663349915 | J682: =RC[-1]*RC[-5]/R696C5 -> 0.19621525187367231 | M682: 3.574655617178482 | N682: 7.0575975668640361
A683: شیشه قزوین | B683: کقزوی | C683: کانی غیر فلزی | D683: 2.8062601187263798 | E683: =VLOOKUP(RC[-3],'[screener-data-1401-11-24.xlsx]overview'!R8C2:R902C7,6,0) -> 26675040000000 | F683: 7.2461011791555725 | G683: =VLOOKUP(RC[-5],'[screener-data-1401-11-24.xlsx]overview'!R8C2:R897C8,7,FALSE) -> 5.3416070212999998 | I683: =IF(RC[-1]="",((RC[-2]+RC[-3])/2)*0.65,RC[-1]) -> 4.0910051651480615 | J683: =RC[-1]*RC[-5]/R696C5 -> 0.36712298407214611 | M683: 3.098446528294279 | N683: 4.3211798396407257
A684: شیشه همدان | B684: کهمدا | C684: کانی غیر فلزی | D684: -0.56338028169013998 | E684: =VLOOKUP(RC[-3],'[screener-data-1401-11-24.xlsx]overview'!R8C2:R902C7,6,0) -> 30525000000000 | F684: 8.1776061776061777 | G684: =VLOOKUP(RC[-5],'[screener-data-1401-11-24.xlsx]overview'!R8C2:R897C8,7,FALSE) -> 7.4177762348999998 | I684: =IF(RC[-1]="",((RC[-2]+RC[-3])/2)*0.65,RC[-1]) -> 5.068499284064508 | J684: =RC[-1]*RC[-5]/R696C5 -> 0.5204889689961294 | M684: 4.261289569905844 | N684: 2.9627286727967941
A685: شیشه و گاز | B685: کگاز | C685: کانی غیر فلزی | D685: 4.6546546546546503 | E685: =VLOOKUP(RC[-3],'[screener-data-1401-11-24.xlsx]overview'!R8C2:R902C7,6,0) -> 11237000000000 | F685: 26.104868913857679 | G685: =VLOOKUP(RC[-5],'[screener-data-1401-11-24.xlsx]overview'!R8C2:R897C8,7,FALSE) -> 65.353882934599994 | I685: =IF(RC[-1]="",((RC[-2]+RC[-3])/2)*0.65,RC[-1]) -> 29.724094350748743 | J685: =RC[-1]*RC[-5]/R696C5 -> 1.1236614450359381 | M685: 4.9472230793029546 | N685: 6.5795866782388321
A686: صنایع نسوز توکا | B686: کتوکا | C686: کانی غیر فلزی | D686: -4.7313552526062503 | E686: =VLOOKUP(RC[-3],'[screener-data-1401-11-24.xlsx]overview'!R8C2:R902C7,6,0) -> 13424400000000 | F686: 10.8098271155596 | G686: =VLOOKUP(RC[-5],'[screener-data-1401-11-24.xlsx]overview'!R8C2:R897C8,7,FALSE) -> 15.2012711264 | I686: =IF(RC[-1]="",((RC[-2]+RC[-3])/2)*0.65,RC[-1]) -> 8.4536069286368711 | J686: =RC[-1]*RC[-5]/R696C5 -> 0.38178020085164471 | M686: 1.6475390189654024 | N686: 4.8167490424377251
A687: فارسیت اهواز | B687: سفاسی | C687: کانی غیر فلزی | D687: 2.97810218978102 | E687: =VLOOKUP(RC[-3],'[screener-data-1401-11-24.xlsx]overview'!R8C2:R902C7,6,0) -> 2280300000000 | F687: -37.521276595744681 | G687: =VLOOKUP(RC[-5],'[screener-data-1401-11-24.xlsx]overview'!R8C2:R897C8,7,FALSE) -> 0 | I687: =IF(RC[-1]="",((RC[-2]+RC[-3])/2)*0.65,RC[-1]) -> -12.194414893617022 | J687: =RC[-1]*RC[-5]/R696C5 -> -9.3546904669354405E-2 | M687: 5.3107411657613222 | N687: 5.886776993263064
A688: فارسیت درود | B688: سفارود | C688: کانی غیر فلزی | D688: -2.7417027417027402 | E688: =VLOOKUP(RC[-3],'[screener-data-1401-11-24.xlsx]overview'!R8C2:R902C7,6,0) -> 1537401600000 | F688: -19.479768786127167 | G688: =VLOOKUP(RC[-5],'[screener-data-1401-11-24.xlsx]overview'!R8C2:R897C8,7,FALSE) -> 0 | I688: =IF(RC[-1]="",((RC[-2]+RC[-3])/2)*0.65,RC[-1]) -> -6.3309248554913298 | J688: =RC[-1]*RC[-5]/R696C5 -> -3.2743941447587931E-2 | M688: 727.27065120428188 | N688: -2.0558122997666231
A689: فرآورده نسوز پارس | B689: کفپارس | C689: کانی غیر فلزی | D689: 2.2637795275590502 | E689: =VLOOKUP(RC[-3],'[screener-data-1401-11-24.xlsx]overview'!R8C2:R902C7,6,0) -> 6455402734000 | F689: 10.136585365853659 | G689: =VLOOKUP(RC[-5],'[screener-data-1401-11-24.xlsx]overview'!R8C2:R897C8,7,FALSE) -> 10.6078395135 | I689: =IF(RC[-1]="",((RC[-2]+RC[-3])/2)*0.65,RC[-1]) -> 6.7419380857899389 | J689: =RC[-1]*RC[-5]/R696C5 -> 0.14641466202134973 | M689: 2.6243113729682772 | N689: 2.7374408296200854
A690: فرآورده های سیمان شرق | B690: کفرآور | C690: کانی غیر فلزی | D690: -2.1892655367231599 | E690: =VLOOKUP(RC[-3],'[screener-data-1401-11-24.xlsx]overview'!R8C2:R902C7,6,0) -> 2572200000000 | F690: 16.198830409356724 | G690: =VLOOKUP(RC[-5],'[screener-data-1401-11-24.xlsx]overview'!R8C2:R897C8,7,FALSE) -> 15.153776801199999 | I690: =IF(RC[-1]="",((RC[-2]+RC[-3])/2)*0.65,RC[-1]) -> 10.189597343430936 | J690: =RC[-1]*RC[-5]/R696C5 -> 8.8173529205797616E-2 | M690: 2.0706186440396417 | N690: 9.2565088889218927
A691: فرآورده های نسوز آذر | B691: کاذر | C691: کانی غیر فلزی | D691: 1.04759735823274 | E691: =VLOOKUP(RC[-3],'[screener-data-1401-11-24.xlsx]overview'!R8C2:R902C7,6,0) -> 8710000000000 | F691: 3.7988013698630136 | G691: =VLOOKUP(RC[-5],'[screener-data-1401-11-24.xlsx]overview'!R8C2:R897C8,7,FALSE) -> 7.8212220255 | I691: =IF(RC[-1]="",((RC[-2]+RC[-3])/2)*0.65,RC[-1]) -> 3.7765076034929792 | J691: =RC[-1]*RC[-5]/R696C5 -> 0.11065855276350268 | M691: 2.9016698825696747 | N691: 2.7211652008538216
A692: فرآورده های نسوز ایران | B692: کفرا | C692: کانی غیر فلزی | D692: -2.4705882352941102 | E692: =VLOOKUP(RC[-3],'[screener-data-1401-11-24.xlsx]overview'!R8C2:R902C7,6,0) -> 15940000000000 | F692: 3.9363722697056032 | G692: =VLOOKUP(RC[-5],'[screener-data-1401-11-24.xlsx]overview'!R8C2:R897C8,7,FALSE) -> 9.6286572004999993 | I692: =IF(RC[-1]="",((RC[-2]+RC[-3])/2)*0.65,RC[-1]) -> 4.4086345778168203 | J692: =RC[-1]*RC[-5]/R696C5 -> 0.23641165716159196 | M692: 2.034600229892646 | N692: 4.8841487573847715
A693: فرانسوز یزد | B693: کایزد | C693: کانی غیر فلزی | D693: 1.9845644983461901 | E693: =VLOOKUP(RC[-3],'[screener-data-1401-11-24.xlsx]overview'!R8C2:R902C7,6,0) -> 6083000000000 | F693: 12.991573033707866 | G693: =VLOOKUP(RC[-5],'[screener-data-1401-11-24.xlsx]overview'!R8C2:R897C8,7,FALSE) -> 37.287067393100003 | I693: =IF(RC[-1]="",((RC[-2]+RC[-3])/2)*0.65,RC[-1]) -> 16.340558138712559 | J693: =RC[-1]*RC[-5]/R696C5 -> 0.33439607448364017 | M693: 3.6469935536924756 | N693: 3.5035131753738717
A694: مرجان کار | B694: کمرجان | C694: کانی غیر فلزی | D694: -3.39673913043478 | E694: =VLOOKUP(RC[-3],'[screener-data-1401-11-24.xlsx]overview'!R8C2:R902C7,6,0) -> 4789274214960 | F694: 28.554216867469879 | G694: =VLOOKUP(RC[-5],'[screener-data-1401-11-24.xlsx]overview'!R8C2:R897C8,7,FALSE) -> 27.323763380999999 | I694: =IF(RC[-1]="",((RC[-2]+RC[-3])/2)*0.65,RC[-1]) -> 18.160343580752713 | J694: =RC[-1]*RC[-5]/R696C5 -> 0.29259724467620324 | M694: 9.916565387808852 | N694: 5.8550093217552037
A695: ورزیران | B695: کورز | C695: کانی غیر فلزی | D695: 0.35797386790764002 | E695: =VLOOKUP(RC[-3],'[screener-data-1401-11-24.xlsx]overview'!R8C2:R902C7,6,0) -> 11232000000000 | F695: 72.39509360877986 | G695: =VLOOKUP(RC[-5],'[screener-data-1401-11-24.xlsx]overview'!R8C2:R897C8,7,FALSE) -> 94.407480668900007 | I695: =IF(RC[-1]="",((RC[-2]+RC[-3])/2)*0.65,RC[-1]) -> 54.210836640245958 | J695: =RC[-1]*RC[-5]/R696C5 -> 2.048423135419724 | M695: 4.8911016755098169 | N695: 21.690564198383363
E696: =SUM(R[-25]C:R[-1]C) -> 297251142410320 | J696: =SUM(R[-25]C:R[-1]C) -> 31.547386804071571
A697: آرتاویل تایر | B697: پارتا | C697: لاستیک و پلاستیک | D697: -4.4444444444444402 | E697: =VLOOKUP(RC[-3],'[screener-data-1401-11-24.xlsx]overview'!R8C2:R902C7,6,0) -> 39757859836000 | F697: 19.268867924528301 | G697: =VLOOKUP(RC[-5],'[screener-data-1401-11-24.xlsx]overview'!R8C2:R897C8,7,FALSE) -> 18.899900390100001 | I697: =IF(RC[-1]="",((RC[-2]+RC[-3])/2)*0.65,RC[-1]) -> 12.404849702254198 | J697: =RC[-1]*RC[-5]/R709C5 -> 2.3907955933598344 | M697: 2.3741309550930296 | N697: 4.5314499624635767
A698: ایران تایر | B698: پتایر | C698: لاستیک و پلاستیک | D698: -0.23094688221709 | E698: =VLOOKUP(RC[-3],'[screener-data-1401-11-24.xlsx]overview'!R8C2:R902C7,6,0) -> 16471000000000 | F698: 13.787234042553191 | G698: =VLOOKUP(RC[-5],'[screener-data-1401-11-24.xlsx]overview'!R8C2:R897C8,7,FALSE) -> 22.448546807100001 | I698: =IF(RC[-1]="",((RC[-2]+RC[-3])/2)*0.65,RC[-1]) -> 11.776628776137288 | J698: =RC[-1]*RC[-5]/R709C5 -> 0.94030532223253771 | M698: 1.1652877865902129 | N698: 1.2059541840483068
A699: ایران یاسا | B699: پاسا | C699: لاستیک و پلاستیک | D699: -1.84782608695652 | E699: =VLOOKUP(RC[-3],'[screener-data-1401-11-24.xlsx]overview'!R8C2:R902C7,6,0) -> 16948000000000 | F699: 6.572052401746725 | G699: =VLOOKUP(RC[-5],'[screener-data-1401-11-24.xlsx]overview'!R8C2:R897C8,7,FALSE) -> 9.6211857689000002 | I699: =IF(RC[-1]="",((RC[-2]+RC[-3])/2)*0.65,RC[-1]) -> 5.2628024054601861 | J699: =RC[-1]*RC[-5]/R709C5 -> 0.43237787375568831 | M699: 1.6289007649387108 | N699: 2.1770355563722825
A700: پلاستیران | B700: پلاست | C700: لاستیک و پلاستیک | D700: 2.3397761953204399 | E700: =VLOOKUP(RC[-3],'[screener-data-1401-11-24.xlsx]overview'!R8C2:R902C7,6,0) -> 4845000000000 | F700: 1.5515114127082048 | G700: =VLOOKUP(RC[-5],'[screener-data-1401-11-24.xlsx]overview'!R8C2:R897C8,7,FALSE) -> 7.6298625849999997 | I700: =IF(RC[-1]="",((RC[-2]+RC[-3])/2)*0.65,RC[-1]) -> 2.9839465492551667 | J700: =RC[-1]*RC[-5]/R709C5 -> 7.008301264861462E-2 | M700: 2.5095868212266144 | N700: 7.2416925692747798
A701: پلاستیک شاهین | B701: پشاهن | C701: لاستیک و پلاستیک | D701: -0.15372790161413999 | E701: =VLOOKUP(RC[-3],'[screener-data-1401-11-24.xlsx]overview'!R8C2:R902C7,6,0) -> 3916027752000 | F701: 46.726618705035975 | G701: =VLOOKUP(RC[-5],'[screener-data-1401-11-24.xlsx]overview'!R8C2:R897C8,7,FALSE) -> 38.799627749400003 | I701: =IF(RC[-1]="",((RC[-2]+RC[-3])/2)*0.65,RC[-1]) -> 27.796030097691695 | J701: =RC[-1]*RC[-5]/R709C5 -> 0.52766279774830127 | M701: 3.5937500344138362 | N701: 22.299205354956637
A702: پلاسکوکار سایپا | B702: پلاسک | C702: لاستیک و پلاستیک | D702: 0.51813471502590003 | E702: =VLOOKUP(RC[-3],'[screener-data-1401-11-24.xlsx]overview'!R8C2:R902C7,6,0) -> 5288801598826 | F702: 1228.6666666666667 | G702: =VLOOKUP(RC[-5],'[screener-data-1401-11-24.xlsx]overview'!R8C2:R897C8,7,FALSE) -> 0 | I702: =IF(RC[-1]="",((RC[-2]+RC[-3])/2)*0.65,RC[-1]) -> 399.31666666666672 | J702: =RC[-1]*RC[-5]/R709C5 -> 10.237706015635986 | M702: 0.38397470156419872 | N702: -2.8254916646348796
A703: درخشان تهران | B703: پدرخش | C703: لاستیک و پلاستیک | D703: -4.2780748663101598 | E703: =VLOOKUP(RC[-3],'[screener-data-1401-11-24.xlsx]overview'!R8C2:R902C7,6,0) -> 5785000000000 | F703: 72.011494252873561 | G703: =VLOOKUP(RC[-5],'[screener-data-1401-11-24.xlsx]overview'!R8C2:R897C8,7,FALSE) -> 50.555799786500003 | I703: =IF(RC[-1]="",((RC[-2]+RC[-3])/2)*0.65,RC[-1]) -> 39.834370562796408 | J703: =RC[-1]*RC[-5]/R709C5 -> 1.11709282936079 | M703: 5.3511510575493881 | N703: 8.4348200480207165
A704: صنعتی بارز | B704: پکرمان | C704: لاستیک و پلاستیک | D704: 0.16547159404302 | E704: =VLOOKUP(RC[-3],'[screener-data-1401-11-24.xlsx]overview'!R8C2:R902C7,6,0) -> 44390605000000 | F704: 32.255772646536414 | G704: =VLOOKUP(RC[-5],'[screener-data-1401-11-24.xlsx]overview'!R8C2:R897C8,7,FALSE) -> 12.9418415792 | I704: =IF(RC[-1]="",((RC[-2]+RC[-3])/2)*0.65,RC[-1]) -> 14.689224623364336 | J704: =RC[-1]*RC[-5]/R709C5 -> 3.1609518306632021 | M704: 0.89890406219793462 | N704: 9.0752728837858445
A705: گازلوله | B705: پلوله | C705: لاستیک و پلاستیک | D705: -1.5384615384615301 | E705: =VLOOKUP(RC[-3],'[screener-data-1401-11-24.xlsx]overview'!R8C2:R902C7,6,0) -> 6480000000000 | F705: 7.762803234501348 | G705: =VLOOKUP(RC[-5],'[screener-data-1401-11-24.xlsx]overview'!R8C2:R897C8,7,FALSE) -> 7.4427814337999996 | I705: =IF(RC[-1]="",((RC[-2]+RC[-3])/2)*0.65,RC[-1]) -> 4.9418150171979383 | J705: =RC[-1]*RC[-5]/R709C5 -> 0.15523492362755723 | M705: 3.3475915938255532 | N705: 9.2509711378266211
A706: لاستیک سهند | B706: پسهند | C706: لاستیک و پلاستیک | D706: -0.16625103906899 | E706: =VLOOKUP(RC[-3],'[screener-data-1401-11-24.xlsx]overview'!R8C2:R902C7,6,0) -> 12631500000000 | F706: 9.6131270010672356 | G706: =VLOOKUP(RC[-5],'[screener-data-1401-11-24.xlsx]overview'!R8C2:R897C8,7,FALSE) -> 7.4931223841000003 | I706: =IF(RC[-1]="",((RC[-2]+RC[-3])/2)*0.65,RC[-1]) -> 5.559531050179352 | J706: =RC[-1]*RC[-5]/R709C5 -> 0.3404246724069917 | M706: 3.7031022603004415 | N706: 6.1628330901204071
A707: لاستیک یزد | B707: پیزد | C707: لاستیک و پلاستیک | D707: 3.4705407586763499 | E707: =VLOOKUP(RC[-3],'[screener-data-1401-11-24.xlsx]overview'!R8C2:R902C7,6,0) -> 24561600000000 | F707: 20.610932475884244 | G707: =VLOOKUP(RC[-5],'[screener-data-1401-11-24.xlsx]overview'!R8C2:R897C8,7,FALSE) -> 89.340174529600006 | I707: =IF(RC[-1]="",((RC[-2]+RC[-3])/2)*0.65,RC[-1]) -> 35.734109776782383 | J707: =RC[-1]*RC[-5]/R709C5 -> 4.2546864802823396 | M707: 1.4024945642395741 | N707: 9.0732596818489011
A708: کویر تایر | B708: پکویر | C708: لاستیک و پلاستیک | D708: -0.28025477707006002 | E708: =VLOOKUP(RC[-3],'[screener-data-1401-11-24.xlsx]overview'!R8C2:R902C7,6,0) -> 25211700000000 | F708: 2.9318352059925092 | G708: =VLOOKUP(RC[-5],'[screener-data-1401-11-24.xlsx]overview'!R8C2:R897C8,7,FALSE) -> 21.784213518000001 | H708: 3.75 | I708: =IF(RC[-1]="",((RC[-2]+RC[-3])/2)*0.65,RC[-1]) -> 3.75 | J708: =RC[-1]*RC[-5]/R709C5 -> 0.45831211774390201 | M708: 1.2863263540126655 | N708: 2.5630056348444192
E709: =SUM(R[-12]C:R[-1]C) -> 206287094186826 | J709: =SUM(R[-12]C:R[-1]C) -> 24.085633469465741
A710: آبسال | B710: لابسا | C710: ماشین آلات و تجهیزات | D710: 3.52941176470588 | E710: =VLOOKUP(RC[-3],'[screener-data-1401-11-24.xlsx]overview'!R8C2:R902C7,6,0) -> 13743000000000 | F710: 8.8151986183074271 | G710: =VLOOKUP(RC[-5],'[screener-data-1401-11-24.xlsx]overview'!R8C2:R897C8,7,FALSE) -> 20.353687020399999 | I710: =IF(RC[-1]="",((RC[-2]+RC[-3])/2)*0.65,RC[-1]) -> 9.4798878325799141 | J710: =RC[-1]*RC[-5]/R728C5 -> 0.4001363791424089 | M710: 2.2038017691438969 | N710: 2.7741308194483865
A711: آزمایش | B711: لازما | C711: ماشین آلات و تجهیزات | D711: 0.24630541871921 | E711: =VLOOKUP(RC[-3],'[screener-data-1401-11-24.xlsx]overview'!R8C2:R902C7,6,0) -> 4447875000000 | F711: 186.69724770642202 | G711: =VLOOKUP(RC[-5],'[screener-data-1401-11-24.xlsx]overview'!R8C2:R897C8,7,FALSE) -> 108.1506110712 | I711: =IF(RC[-1]="",((RC[-2]+RC[-3])/2)*0.65,RC[-1]) -> 95.825554102727168 | J711: =RC[-1]*RC[-5]/R728C5 -> 1.3090529251322911 | M711: 12.376441803565188 | N711: -4.4112370748723055
A712: پارس خزر | B712: لخزر | C712: ماشین آلات و تجهیزات | D712: -0.49613018456042002 | E712: =VLOOKUP(RC[-3],'[screener-data-1401-11-24.xlsx]overview'!R8C2:R902C7,6,0) -> 22735944000000 | F712: 10.170385395537526 | G712: =VLOOKUP(RC[-5],'[screener-data-1401-11-24.xlsx]overview'!R8C2:R897C8,7,FALSE) -> 8.9120111044999994 | I712: =IF(RC[-1]="",((RC[-2]+RC[-3])/2)*0.65,RC[-1]) -> 6.2017788625121959 | J712: =RC[-1]*RC[-5]/R728C5 -> 0.43306447572606405 | M712: 1.7391468986436209 | N712: 3.9935579120667639
A713: پمپ ایران | B713: تپمپی | C713: ماشین آلات و تجهیزات | D713: 2.6854802002730902 | E713: =VLOOKUP(RC[-3],'[screener-data-1401-11-24.xlsx]overview'!R8C2:R902C7,6,0) -> 23771000000000 | F713: 7.9971641261963846 | G713: =VLOOKUP(RC[-5],'[screener-data-1401-11-24.xlsx]overview'!R8C2:R897C8,7,FALSE) -> 7.2831904953000004 | I713: =IF(RC[-1]="",((RC[-2]+RC[-3])/2)*0.65,RC[-1]) -> 4.9661152519863254 | J713: =RC[-1]*RC[-5]/R728C5 -> 0.36256638713236689 | M713: 9.2392544707961601 | N713: 5.2569633156491253
A714: تراکتورسازی | B714: تایرا | C714: ماشین آلات و تجهیزات | D714: -0.26070763500930999 | E714: =VLOOKUP(RC[-3],'[screener-data-1401-11-24.xlsx]overview'!R8C2:R902C7,6,0) -> 86112000000000 | F714: 13.121019108280255 | G714: =VLOOKUP(RC[-5],'[screener-data-1401-11-24.xlsx]overview'!R8C2:R897C8,7,FALSE) -> 7.3662378567999998 | I714: =IF(RC[-1]="",((RC[-2]+RC[-3])/2)*0.65,RC[-1]) -> 6.6583585136510832 | J714: =RC[-1]*RC[-5]/R728C5 -> 1.7609788679356047 | M714: 1.4737448103962021 | N714: 4.1026685921224706
A715: تکنوتار | B715: تکنو | C715: ماشین آلات و تجهیزات | D715: 1.5267175572519001 | E715: =VLOOKUP(RC[-3],'[screener-data-1401-11-24.xlsx]overview'!R8C2:R902C7,6,0) -> 2993242310000 | F715: -64.5631067961165 | G715: =VLOOKUP(RC[-5],'[screener-data-1401-11-24.xlsx]overview'!R8C2:R897C8,7,FALSE) -> 50.866797122100003 | I715: =IF(RC[-1]="",((RC[-2]+RC[-3])/2)*0.65,RC[-1]) -> -4.4513006440553617 | J715: =RC[-1]*RC[-5]/R728C5 -> -4.0921551942576281E-2 | M715: 18.813955779334499 | N715: 16.777384089799902
A716: خدمات کشاورزی | B716: تکشا | C716: ماشین آلات و تجهیزات | D716: 4.9880287310454898 | E716: =VLOOKUP(RC[-3],'[screener-data-1401-11-24.xlsx]overview'!R8C2:R902C7,6,0) -> 5604000000000 | F716: 125.28571428571429 | G716: =VLOOKUP(RC[-5],'[screener-data-1401-11-24.xlsx]overview'!R8C2:R897C8,7,FALSE) -> 0 | I716: =IF(RC[-1]="",((RC[-2]+RC[-3])/2)*0.65,RC[-1]) -> 40.717857142857149 | J716: =RC[-1]*RC[-5]/R728C5 -> 0.70081975205180003 | M716: 6.4975396526495812 | N716: 7.6389181247922231
A717: سر. پارس توشه | B717: وتوشه | C717: ماشین آلات و تجهیزات | D717: 0 | E717: =VLOOKUP(RC[-3],'[screener-data-1401-11-24.xlsx]overview'!R8C2:R902C7,6,0) -> 31500000000000 | F717: 5.9907834101382491 | G717: =VLOOKUP(RC[-5],'[screener-data-1401-11-24.xlsx]overview'!R8C2:R897C8,7,FALSE) -> 6.5082366922999997 | I717: =IF(RC[-1]="",((RC[-2]+RC[-3])/2)*0.65,RC[-1]) -> 4.0621815332924305 | J717: =RC[-1]*RC[-5]/R728C5 -> 0.39300056428223457 | K717: 0.5 | M717: 9.8864359050002228 | N717: 1.792156901039049
A718: سرماآفرین | B718: لسرما | C718: ماشین آلات و تجهیزات | D718: 4.9917491749174898 | E718: =VLOOKUP(RC[-3],'[screener-data-1401-11-24.xlsx]overview'!R8C2:R902C7,6,0) -> 5430380000000 | F718: 18.851851851851851 | G718: =VLOOKUP(RC[-5],'[screener-data-1401-11-24.xlsx]overview'!R8C2:R897C8,7,FALSE) -> 20.295798245499999 | I718: =IF(RC[-1]="",((RC[-2]+RC[-3])/2)*0.65,RC[-1]) -> 12.722986281639352 | J718: =RC[-1]*RC[-5]/R728C5 -> 0.21219862853867591 | M718: 4.882631504374312 | N718: 10.196801335043798
A719: صنایع گلدیران | B719: گلدیرا | C719: ماشین آلات و تجهیزات | E719: =VLOOKUP(RC[-3],'[screener-data-1401-11-24.xlsx]overview'!R8C2:R902C7,6,0) -> 24456800000000 | F719: 7.6165680473372781 | G719: =VLOOKUP(RC[-5],'[screener-data-1401-11-24.xlsx]overview'!R8C2:R897C8,7,FALSE) -> 8.2015746697999994 | I719: =IF(RC[-1]="",((RC[-2]+RC[-3])/2)*0.65,RC[-1]) -> 5.1408963830696157 | J719: =RC[-1]*RC[-5]/R728C5 -> 0.38615510022332539 | M719: 0.84149635977678505 | N719: 3.5444567664432509
A720: صنعتی بوتان | B720: لبوتان | C720: ماشین آلات و تجهیزات | D720: 1.88679245283018 | E720: =VLOOKUP(RC[-3],'[screener-data-1401-11-24.xlsx]overview'!R8C2:R902C7,6,0) -> 27125000000000 | F720: 5.9124087591240873 | G720: =VLOOKUP(RC[-5],'[screener-data-1401-11-24.xlsx]overview'!R8C2:R897C8,7,FALSE) -> 15.7933537817 | I720: =IF(RC[-1]="",((RC[-2]+RC[-3])/2)*0.65,RC[-1]) -> 7.0543728257678291 | J720: =RC[-1]*RC[-5]/R728C5 -> 0.58769425869885183 | M720: 0.67362858842661888 | N720: 6.1266286621193471
A721: لوازم خانگی پارس | B721: لخانه | C721: ماشین آلات و تجهیزات | D721: 0.73349633251833002 | E721: =VLOOKUP(RC[-3],'[screener-data-1401-11-24.xlsx]overview'!R8C2:R902C7,6,0) -> 18675000000000 | F721: 44.301075268817208 | G721: =VLOOKUP(RC[-5],'[screener-data-1401-11-24.xlsx]overview'!R8C2:R897C8,7,FALSE) -> 0 | I721: =IF(RC[-1]="",((RC[-2]+RC[-3])/2)*0.65,RC[-1]) -> 14.397849462365594 | J721: =RC[-1]*RC[-5]/R728C5 -> 0.8258126506889486 | M721: 3.2088310353153142 | N721: 9.5152420388140353
A722: ماشین آلات تراکتورسازی ایران | B722: تراک | C722: ماشین آلات و تجهیزات | D722: 3.5017221584385698 | E722: =VLOOKUP(RC[-3],'[screener-data-1401-11-24.xlsx]overview'!R8C2:R902C7,6,0) -> 91953000000 | F722: -0.79602649006622517 | G722: =VLOOKUP(RC[-5],'[screener-data-1401-11-24.xlsx]overview'!R8C2:R897C8,7,FALSE) -> 0 | I722: =IF(RC[-1]="",((RC[-2]+RC[-3])/2)*0.65,RC[-1]) -> -0.25870860927152317 | J722: =RC[-1]*RC[-5]/R728C5 -> -7.3063433411414791E-5 | M722: 1.4907107191492122 | N722: -0.34525186230926347
A723: ماشین سازی نیرو محرکه | B723: تمحرکه | C723: ماشین آلات و تجهیزات | D723: -0.26350461133068998 | E723: =VLOOKUP(RC[-3],'[screener-data-1401-11-24.xlsx]overview'!R8C2:R902C7,6,0) -> 2685092760000 | F723: -56.917293233082709 | G723: =VLOOKUP(RC[-5],'[screener-data-1401-11-24.xlsx]overview'!R8C2:R897C8,7,FALSE) -> 5118.6408823529 | I723: =IF(RC[-1]="",((RC[-2]+RC[-3])/2)*0.65,RC[-1]) -> 1645.0601664639405 | J723: =RC[-1]*RC[-5]/R728C5 -> 13.566392338787258 | M723: 56.711689130755765 | N723: 9.2484493985477094
A724: مهندسی فیروزا | B724: تفیرو | C724: ماشین آلات و تجهیزات | D724: 1.93050193050193 | E724: =VLOOKUP(RC[-3],'[screener-data-1401-11-24.xlsx]overview'!R8C2:R902C7,6,0) -> 475200000000 | F724: 304.61538461538464 | G724: =VLOOKUP(RC[-5],'[screener-data-1401-11-24.xlsx]overview'!R8C2:R897C8,7,FALSE) -> 3.2779647922000001 | I724: =IF(RC[-1]="",((RC[-2]+RC[-3])/2)*0.65,RC[-1]) -> 100.06533855746501 | J724: =RC[-1]*RC[-5]/R728C5 -> 0.14604389049453059 | M724: 5.0235213277657378 | N724: 1.4629325764176007
A725: هپکو | B725: تپکو | C725: ماشین آلات و تجهیزات | D725: -3.6144578313253 | E725: =VLOOKUP(RC[-3],'[screener-data-1401-11-24.xlsx]overview'!R8C2:R902C7,6,0) -> 33879517976000 | F725: -217.14285714285714 | G725: =VLOOKUP(RC[-5],'[screener-data-1401-11-24.xlsx]overview'!R8C2:R897C8,7,FALSE) -> 117.964035665 | I725: =IF(RC[-1]="",((RC[-2]+RC[-3])/2)*0.65,RC[-1]) -> -32.233116980303571 | J725: =RC[-1]*RC[-5]/R728C5 -> -3.3539981575766515 | M725: 19.272715031026369 | N725: 2.5874777384552994
A726: کارخانجات اتمسفر | B726: تاتمس | C726: ماشین آلات و تجهیزات | D726: -0.13574660633484001 | E726: =VLOOKUP(RC[-3],'[screener-data-1401-11-24.xlsx]overview'!R8C2:R902C7,6,0) -> 12701724200000 | F726: 85.344160866202628 | G726: =VLOOKUP(RC[-5],'[screener-data-1401-11-24.xlsx]overview'!R8C2:R897C8,7,FALSE) -> 18.8637102862 | I726: =IF(RC[-1]="",((RC[-2]+RC[-3])/2)*0.65,RC[-1]) -> 33.867558124530859 | J726: =RC[-1]*RC[-5]/R728C5 -> 1.3212039270193285 | M726: 12.309554391106513 | N726: 20.076246615851407
A727: کمباین سازی | B727: تکمبا | C727: ماشین آلات و تجهیزات | D727: 5.5335968379446596 | E727: =VLOOKUP(RC[-3],'[screener-data-1401-11-24.xlsx]overview'!R8C2:R902C7,6,0) -> 9166506305320 | F727: 23.946188340807176 | G727: =VLOOKUP(RC[-5],'[screener-data-1401-11-24.xlsx]overview'!R8C2:R897C8,7,FALSE) -> 30.484151309400001 | I727: =IF(RC[-1]="",((RC[-2]+RC[-3])/2)*0.65,RC[-1]) -> 17.689860386317331 | J727: =RC[-1]*RC[-5]/R728C5 -> 0.49802545335864723 | M727: 2.1812563606195634 | N727: 4.3798944248565261
E728: =SUM(R[-18]C:R[-1]C) -> 325594235551320 | J728: =SUM(R[-18]C:R[-1]C) -> 19.5081528262597
A729: گروه صنعتی ملی (هلدینگ) | B729: وملی | C729: محصولات چرمی | D729: -8.448919242413E-2 | E729: =VLOOKUP(RC[-3],'[screener-data-1401-11-24.xlsx]overview'!R8C2:R902C7,6,0) -> 35102877467400 | F729: 83.970414201183431 | G729: =VLOOKUP(RC[-5],'[screener-data-1401-11-24.xlsx]overview'!R8C2:R897C8,7,FALSE) -> 80.908125363600007 | I729: =IF(RC[-1]="",((RC[-2]+RC[-3])/2)*0.65,RC[-1]) -> 53.585525358554619 | K729: 0.33 | M729: 79.115951640450859 | N729: 99.759509676447607
A731: صنایع چوب خزر کاسپین | B731: چخزر | C731: محصولات چوبی | D731: -0.81037277147486997 | E731: =VLOOKUP(RC[-3],'[screener-data-1401-11-24.xlsx]overview'!R8C2:R902C7,6,0) -> 6090000000000 | F731: 12.949640287769784 | G731: =VLOOKUP(RC[-5],'[screener-data-1401-11-24.xlsx]overview'!R8C2:R897C8,7,FALSE) -> 11.2919283414 | I731: =IF(RC[-1]="",((RC[-2]+RC[-3])/2)*0.65,RC[-1]) -> 7.8785098044801805 | J731: =RC[-1]*RC[-5]/R734C5 -> 1.7880347584886449 | M731: 1.7070172634672365 | N731: 10.356048389143748
A732: فیبر ایران | B732: چفیبر | C732: محصولات چوبی | D732: -1.5350877192982399 | E732: =VLOOKUP(RC[-3],'[screener-data-1401-11-24.xlsx]overview'!R8C2:R902C7,6,0) -> 8082000000000 | F732: 160.35714285714286 | G732: =VLOOKUP(RC[-5],'[screener-data-1401-11-24.xlsx]overview'!R8C2:R897C8,7,FALSE) -> 0 | I732: =IF(RC[-1]="",((RC[-2]+RC[-3])/2)*0.65,RC[-1]) -> 52.116071428571431 | J732: =RC[-1]*RC[-5]/R734C5 -> 15.696582294317444 | M732: 6.5904064817895378 | N732: 4.3553424887856131
A733: نئوپان 22 بهمن | B733: چنوپا | C733: محصولات چوبی | D733: 2.9082774049217002 | E733: =VLOOKUP(RC[-3],'[screener-data-1401-11-24.xlsx]overview'!R8C2:R902C7,6,0) -> 12662000000000 | F733: 14.556962025316455 | G733: =VLOOKUP(RC[-5],'[screener-data-1401-11-24.xlsx]overview'!R8C2:R897C8,7,FALSE) -> 542.55084484049996 | I733: =IF(RC[-1]="",((RC[-2]+RC[-3])/2)*0.65,RC[-1]) -> 181.06003723139034 | J733: =RC[-1]*RC[-5]/R734C5 -> 85.435723016466596 | M733: 6.2219692740845094 | N733: 2.7826676103539434
E734: =SUM(R[-3]C:R[-1]C) -> 26834000000000 | J734: =SUM(R[-3]C:R[-1]C) -> 102.92034006927268
A735: آذراب | B735: فاذر | C735: محصولات فلزی | D735: -4.75272960822093 | E735: =VLOOKUP(RC[-3],'[screener-data-1401-11-24.xlsx]overview'!R8C2:R902C7,6,0) -> 26881562425000 | F735: -74.150000000000006 | G735: =VLOOKUP(RC[-5],'[screener-data-1401-11-24.xlsx]overview'!R8C2:R897C8,7,FALSE) -> 0 | I735: =IF(RC[-1]="",((RC[-2]+RC[-3])/2)*0.65,RC[-1]) -> -24.098750000000003 | J735: =RC[-1]*RC[-5]/R748C5 -> -4.742316028953387 | M735: 4.4718272832150703 | N735: 1.5058504280556793
A736: آما | B736: فاما | C736: محصولات فلزی | D736: -1.2771392081736901 | E736: =VLOOKUP(RC[-3],'[screener-data-1401-11-24.xlsx]overview'!R8C2:R902C7,6,0) -> 26565000000000 | F736: 10.662068965517241 | G736: =VLOOKUP(RC[-5],'[screener-data-1401-11-24.xlsx]overview'!R8C2:R897C8,7,FALSE) -> 8.7094212414999994 | I736: =IF(RC[-1]="",((RC[-2]+RC[-3])/2)*0.65,RC[-1]) -> 6.2957343172806031 | J736: =RC[-1]*RC[-5]/R748C5 -> 1.2243277155604333 | M736: 3.0904247663476672 | N736: 3.0494665287713421
A737: انرژی آذرآب | B737: فنرژی | C737: محصولات فلزی | D737: 1.9434628975265 | E737: =VLOOKUP(RC[-3],'[screener-data-1401-11-24.xlsx]overview'!R8C2:R902C7,6,0) -> 2910774400000 | F737: -1.6919167236829245 | G737: =VLOOKUP(RC[-5],'[screener-data-1401-11-24.xlsx]overview'!R8C2:R897C8,7,FALSE) -> 0 | I737: =IF(RC[-1]="",((RC[-2]+RC[-3])/2)*0.65,RC[-1]) -> -0.54987293519695046 | J737: =RC[-1]*RC[-5]/R748C5 -> -1.171689017477999E-2 | M737: 28.175375099760576 | N737: -1.0531958904359895
A738: بسته بندی ایران | B738: فبیرا | C738: محصولات فلزی | D738: -1.92008303061754 | E738: =VLOOKUP(RC[-3],'[screener-data-1401-11-24.xlsx]overview'!R8C2:R902C7,6,0) -> 3290190128000 | F738: -17.66355140186916 | G738: =VLOOKUP(RC[-5],'[screener-data-1401-11-24.xlsx]overview'!R8C2:R897C8,7,FALSE) -> 0 | I738: =IF(RC[-1]="",((RC[-2]+RC[-3])/2)*0.65,RC[-1]) -> -5.740654205607477 | J738: =RC[-1]*RC[-5]/R748C5 -> -0.13826869080282714 | M738: 5.2990932804129871 | N738: 4.4198210252831593
A739: بسته بندی مشهد | B739: فبستم | C739: محصولات فلزی | D739: 0 | E739: =VLOOKUP(RC[-3],'[screener-data-1401-11-24.xlsx]overview'!R8C2:R902C7,6,0) -> 3726135382120 | F739: 86.71052631578948 | G739: =VLOOKUP(RC[-5],'[screener-data-1401-11-24.xlsx]overview'!R8C2:R897C8,7,FALSE) -> 106.3493518194 | I739: =IF(RC[-1]="",((RC[-2]+RC[-3])/2)*0.65,RC[-1]) -> 62.744460393936585 | J739: =RC[-1]*RC[-5]/R748C5 -> 1.7114944183979219 | M739: 4368.2660961313013 | N739: 12.423625330501496
A740: جام دارو | B740: فجام | C740: محصولات فلزی | D740: 0.18726591760299 | E740: =VLOOKUP(RC[-3],'[screener-data-1401-11-24.xlsx]overview'!R8C2:R902C7,6,0) -> 4698000000000 | F740: 12.953995157384988 | G740: =VLOOKUP(RC[-5],'[screener-data-1401-11-24.xlsx]overview'!R8C2:R897C8,7,FALSE) -> 10.749701397200001 | I740: =IF(RC[-1]="",((RC[-2]+RC[-3])/2)*0.65,RC[-1]) -> 7.7037013802401209 | J740: =RC[-1]*RC[-5]/R748C5 -> 0.26494389737723339 | M740: 4.3396049562524563 | N740: 3.8081062441870031
A741: جوش و اکسیژن | B741: فجوش | C741: محصولات فلزی | D741: 0 | E741: =VLOOKUP(RC[-3],'[screener-data-1401-11-24.xlsx]overview'!R8C2:R902C7,6,0) -> 4974500466000 | F741: -0.20057818212737011 | G741: =VLOOKUP(RC[-5],'[screener-data-1401-11-24.xlsx]overview'!R8C2:R897C8,7,FALSE) -> 0 | I741: =IF(RC[-1]="",((RC[-2]+RC[-3])/2)*0.65,RC[-1]) -> -6.5187909191395291E-2 | J741: =RC[-1]*RC[-5]/R748C5 -> -2.3738758161603373E-3 | M741: 250.21922132837247 | N741: 3.3969455080971316
A742: چدن سازان | B742: چدن | C742: محصولات فلزی | D742: 1.0333489901362101 | E742: =VLOOKUP(RC[-3],'[screener-data-1401-11-24.xlsx]overview'!R8C2:R902C7,6,0) -> 18873401031000 | F742: 8.4352941176470591 | G742: =VLOOKUP(RC[-5],'[screener-data-1401-11-24.xlsx]overview'!R8C2:R897C8,7,FALSE) -> 9.2248653681999997 | I742: =IF(RC[-1]="",((RC[-2]+RC[-3])/2)*0.65,RC[-1]) -> 5.739551832900295 | J742: =RC[-1]*RC[-5]/R748C5 -> 0.79299348390294977 | M742: 3.1542030398242877 | N742: 1.1095105788779871
A743: سولیران | B743: فسلیر | C743: محصولات فلزی | D743: 0.75840885821546 | E743: =VLOOKUP(RC[-3],'[screener-data-1401-11-24.xlsx]overview'!R8C2:R902C7,6,0) -> 2657100000000 | F743: -24.199453551912569 | G743: =VLOOKUP(RC[-5],'[screener-data-1401-11-24.xlsx]overview'!R8C2:R897C8,7,FALSE) -> 0 | I743: =IF(RC[-1]="",((RC[-2]+RC[-3])/2)*0.65,RC[-1]) -> -7.8648224043715853 | J743: =RC[-1]*RC[-5]/R748C5 -> -0.15298127916228357 | M743: 10.800429236885106 | N743: -13.198980681631904
A744: گسترش قطعه سازی کمند | B744: فکمند | C744: محصولات فلزی | D744: 0 | E744: =VLOOKUP(RC[-3],'[screener-data-1401-11-24.xlsx]overview'!R8C2:R902C7,6,0) -> 3496790000000 | F744: 115.27777777777777 | G744: =VLOOKUP(RC[-5],'[screener-data-1401-11-24.xlsx]overview'!R8C2:R897C8,7,FALSE) -> 126.3640426007 | I744: =IF(RC[-1]="",((RC[-2]+RC[-3])/2)*0.65,RC[-1]) -> 78.533591623005279 | J744: =RC[-1]*RC[-5]/R748C5 -> 2.0103259539688789 | M744: 41.430179379635554 | N744: 25.222995636022649
A745: لامیران | B745: فلامی | C745: محصولات فلزی | D745: 4.4103992571959099 | E745: =VLOOKUP(RC[-3],'[screener-data-1401-11-24.xlsx]overview'!R8C2:R902C7,6,0) -> 4786000000000 | F745: 12.336807460230389 | G745: =VLOOKUP(RC[-5],'[screener-data-1401-11-24.xlsx]overview'!R8C2:R897C8,7,FALSE) -> 11.430286628599999 | I745: =IF(RC[-1]="",((RC[-2]+RC[-3])/2)*0.65,RC[-1]) -> 7.7243055788698767 | J745: =RC[-1]*RC[-5]/R748C5 -> 0.27062854900005551 | M745: 5.9052352838464639 | N745: 4.8312655273415475
A746: ماشین سازی اراک | B746: فاراک | C746: محصولات فلزی | D746: -1.84243964421855 | E746: =VLOOKUP(RC[-3],'[screener-data-1401-11-24.xlsx]overview'!R8C2:R902C7,6,0) -> 30605750078256 | F746: 17.556818181818183 | G746: =VLOOKUP(RC[-5],'[screener-data-1401-11-24.xlsx]overview'!R8C2:R897C8,7,FALSE) -> 17.927373068000001 | I746: =IF(RC[-1]="",((RC[-2]+RC[-3])/2)*0.65,RC[-1]) -> 11.53236215619091 | J746: =RC[-1]*RC[-5]/R748C5 -> 2.5838230496784109 | M746: 1.6848246256108985 | N746: 1.3621780600897708
A747: کیا الکترود شرق | B747: کیا | C747: محصولات فلزی | D747: 4.9645390070921902 | E747: =VLOOKUP(RC[-3],'[screener-data-1401-11-24.xlsx]overview'!R8C2:R902C7,6,0) -> 3137259640000 | F747: 54.612546125461257 | G747: =VLOOKUP(RC[-5],'[screener-data-1401-11-24.xlsx]overview'!R8C2:R897C8,7,FALSE) -> 54.639968976399999 | I747: =IF(RC[-1]="",((RC[-2]+RC[-3])/2)*0.65,RC[-1]) -> 35.507067408104909 | J747: =RC[-1]*RC[-5]/R748C5 -> 0.81546764691492502 | M747: 11.62959250956086 | N747: 8.7624508561239178
E748: =SUM(R[-13]C:R[-1]C) -> 136602463550376 | J748: =SUM(R[-13]C:R[-1]C) -> 4.6263479498913709
A749: بسته بندی پارس | B749: چبسپا | C749: محصولات کاغذی | D749: 0 | E749: =VLOOKUP(RC[-3],'[screener-data-1401-11-24.xlsx]overview'!R8C2:R902C7,6,0) -> 21429809800 | F749: -0.19516003122560499 | G749: =VLOOKUP(RC[-5],'[screener-data-1401-11-24.xlsx]overview'!R8C2:R897C8,7,FALSE) -> 0 | I749: =IF(RC[-1]="",((RC[-2]+RC[-3])/2)*0.65,RC[-1]) -> -6.3427010148321625E-2 | J749: =RC[-1]*RC[-5]/R755C5 -> -2.4700282443906839E-5 | M749: 0.2280397701359117 | N749: -4.9685326266975818E-2
A750: محصولات کاغذی لطیف | B750: لطیف | C750: محصولات کاغذی | D750: -1.8355945730247401 | E750: =VLOOKUP(RC[-3],'[screener-data-1401-11-24.xlsx]overview'!R8C2:R902C7,6,0) -> 11920000000000 | F750: 14.716439339554917 | G750: =VLOOKUP(RC[-5],'[screener-data-1401-11-24.xlsx]overview'!R8C2:R897C8,7,FALSE) -> 7.7802444034000002 | I750: =IF(RC[-1]="",((RC[-2]+RC[-3])/2)*0.65,RC[-1]) -> 7.3114222164603486 | J750: =RC[-1]*RC[-5]/R755C5 -> 1.5837531163298908 | M750: 2.5382800490569051 | N750: 7.2141524074740966
A751: کارتن ایران | B751: چکارن | C751: محصولات کاغذی | D751: 4.0404040404040398 | E751: =VLOOKUP(RC[-3],'[screener-data-1401-11-24.xlsx]overview'!R8C2:R902C7,6,0) -> 10369459188000 | F751: 32.395161290322584 | G751: =VLOOKUP(RC[-5],'[screener-data-1401-11-24.xlsx]overview'!R8C2:R897C8,7,FALSE) -> 33.570321956699999 | I751: =IF(RC[-1]="",((RC[-2]+RC[-3])/2)*0.65,RC[-1]) -> 21.438782055282338 | J751: =RC[-1]*RC[-5]/R755C5 -> 4.0398531526878578 | M751: 2.8414869014708599 | N751: 3.2406137439845217
A752: کارتن مشهد | B752: چکارم | C752: محصولات کاغذی | D752: 0 | E752: =VLOOKUP(RC[-3],'[screener-data-1401-11-24.xlsx]overview'!R8C2:R902C7,6,0) -> 35985000000 | F752: -0.62686177162268097 | G752: =VLOOKUP(RC[-5],'[screener-data-1401-11-24.xlsx]overview'!R8C2:R897C8,7,FALSE) -> 0 | I752: =IF(RC[-1]="",((RC[-2]+RC[-3])/2)*0.65,RC[-1]) -> -0.20373007577737132 | J752: =RC[-1]*RC[-5]/R755C5 -> -1.3322508829251954E-4 | M752: 0.21200070696359138 | N752: -0.14431406204883057
A753: کاغذ پارس | B753: چکاپا | C753: محصولات کاغذی | D753: 0.10737294201861 | E753: =VLOOKUP(RC[-3],'[screener-data-1401-11-24.xlsx]overview'!R8C2:R902C7,6,0) -> 26109001350000 | F753: 10.397769516728625 | G753: =VLOOKUP(RC[-5],'[screener-data-1401-11-24.xlsx]overview'!R8C2:R897C8,7,FALSE) -> 8.4738007886000002 | I753: =IF(RC[-1]="",((RC[-2]+RC[-3])/2)*0.65,RC[-1]) -> 6.1332603492318034 | J753: =RC[-1]*RC[-5]/R755C5 -> 2.9099868337468502 | M753: 2.5146460162070183 | N753: 1.9378397293118299
A754: کاغذ سازی کاوه | B754: چکاوه | C754: محصولات کاغذی | D754: -2.4752475247524699 | E754: =VLOOKUP(RC[-3],'[screener-data-1401-11-24.xlsx]overview'!R8C2:R902C7,6,0) -> 6573000000000 | F754: 21.047008547008549 | G754: =VLOOKUP(RC[-5],'[screener-data-1401-11-24.xlsx]overview'!R8C2:R897C8,7,FALSE) -> 19.363933056099999 | I754: =IF(RC[-1]="",((RC[-2]+RC[-3])/2)*0.65,RC[-1]) -> 13.133556021010278 | J754: =RC[-1]*RC[-5]/R755C5 -> 1.568755733794073 | M754: 3.1348119158315502 | N754: 7.4927408978683454
E755: =SUM(R[-6]C:R[-1]C) -> 55028875347800 | J755: =SUM(R[-6]C:R[-1]C) -> 10.102190911187936
A756: صنایع مادیران | B756: مادیرا | C756: محصولات کامپیوتری الکترونیکی و نوری | D756: -2.0631067961165002 | E756: =VLOOKUP(RC[-3],'[screener-data-1401-11-24.xlsx]overview'!R8C2:R902C7,6,0) -> 47101400000000 | F756: 13.45 | G756: =VLOOKUP(RC[-5],'[screener-data-1401-11-24.xlsx]overview'!R8C2:R897C8,7,FALSE) -> 24.865611456 | I756: =IF(RC[-1]="",((RC[-2]+RC[-3])/2)*0.65,RC[-1]) -> 12.4525737232 | M756: 13.294966182204522 | N756: 2.2827700354809046
A758: ارتباطات سیار | B758: همراه | C758: مخابرات | D758: 0.41436464088397001 | E758: =VLOOKUP(RC[-3],'[screener-data-1401-11-24.xlsx]overview'!R8C2:R902C7,6,0) -> 344088000000000 | F758: 6.9971126082771899 | G758: =VLOOKUP(RC[-5],'[screener-data-1401-11-24.xlsx]overview'!R8C2:R897C8,7,FALSE) -> 6.6391024342999998 | I758: =IF(RC[-1]="",((RC[-2]+RC[-3])/2)*0.65,RC[-1]) -> 4.4317698888375867 | M758: 1.1509581477366195 | N758: 3.0168378453526494
A759: مخابرات ایران | B759: اخابر | C759: مخابرات | D759: 1.7910447761193999 | E759: =VLOOKUP(RC[-3],'[screener-data-1401-11-24.xlsx]overview'!R8C2:R902C7,6,0) -> 400200000000000 | F759: 1136.6666666666667 | G759: =VLOOKUP(RC[-5],'[screener-data-1401-11-24.xlsx]overview'!R8C2:R897C8,7,FALSE) -> 0 | I759: =IF(RC[-1]="",((RC[-2]+RC[-3])/2)*0.65,RC[-1]) -> 369.41666666666669 | M759: 4.2285201407142381 | N759: 9.1535582545130758
E760: =SUM(R[-2]C:R[-1]C) -> 744288000000000
A761: ایران مرینوس | B761: نمرینو | C761: منسوجات | D761: -1.43244617731818 | E761: =VLOOKUP(RC[-3],'[screener-data-1401-11-24.xlsx]overview'!R8C2:R902C7,6,0) -> 14768830000000 | F761: 74.117272147864881 | G761: =VLOOKUP(RC[-5],'[screener-data-1401-11-24.xlsx]overview'!R8C2:R897C8,7,FALSE) -> 2517.0390585025002 | I761: =IF(RC[-1]="",((RC[-2]+RC[-3])/2)*0.65,RC[-1]) -> 842.12580746136859 | J761: =RC[-1]*RC[-5]/R766C5 -> 459.21355430653995 | M761: 32.128572329821459 | N761: 40.09793141271561
A762: پشم بافی توس | B762: نتوس | C762: منسوجات | D762: 0 | E762: =VLOOKUP(RC[-3],'[screener-data-1401-11-24.xlsx]overview'!R8C2:R902C7,6,0) -> 2422822228750 | F762: 81.203703703703709 | G762: =VLOOKUP(RC[-5],'[screener-data-1401-11-24.xlsx]overview'!R8C2:R897C8,7,FALSE) -> 218.60050184209999 | I762: =IF(RC[-1]="",((RC[-2]+RC[-3])/2)*0.65,RC[-1]) -> 97.436366802386203 | J762: =RC[-1]*RC[-5]/R766C5 -> 8.7163419829985731 | M762: 7.3746901848258188 | N762: 8.0766842216368495
A763: عطرین نخ قم | B763: نطرین | C763: منسوجات | D763: -3.4428794992175198 | E763: =VLOOKUP(RC[-3],'[screener-data-1401-11-24.xlsx]overview'!R8C2:R902C7,6,0) -> 4882500000000 | F763: 21.275862068965516 | G763: =VLOOKUP(RC[-5],'[screener-data-1401-11-24.xlsx]overview'!R8C2:R897C8,7,FALSE) -> 15.9943811622 | I763: =IF(RC[-1]="",((RC[-2]+RC[-3])/2)*0.65,RC[-1]) -> 12.112829050128793 | J763: =RC[-1]*RC[-5]/R766C5 -> 2.1836321007730404 | M763: 2.9295074163542698 | N763: 5.3665119776439756
A764: نساجی بروجرد | B764: نبروج | C764: منسوجات | D764: 1.9607843137254899 | E764: =VLOOKUP(RC[-3],'[screener-data-1401-11-24.xlsx]overview'!R8C2:R902C7,6,0) -> 5009571177000 | F764: 9.7772635232860861 | G764: =VLOOKUP(RC[-5],'[screener-data-1401-11-24.xlsx]overview'!R8C2:R897C8,7,FALSE) -> 11.6372292591 | I764: =IF(RC[-1]="",((RC[-2]+RC[-3])/2)*0.65,RC[-1]) -> 6.9597101542754771 | J764: =RC[-1]*RC[-5]/R766C5 -> 1.2873105690383257 | M764: 0.93587269416537111 | N764: 7.2145143352141643
A765: نساجی قائمشهر | B765: نساجی قائمشهر | C765: منسوجات | D765: 0 | F765: -1.2101910828025477 | G765: =VLOOKUP(RC[-5],'[screener-data-1401-11-24.xlsx]overview'!R8C2:R897C8,7,FALSE) -> 0 | I765: =IF(RC[-1]="",((RC[-2]+RC[-3])/2)*0.65,RC[-1]) -> -0.39331210191082805 | J765: =RC[-1]*RC[-5]/R766C5 -> 0 | M765: 1.1668351409216946 | N765: 0.31668011601459684
E766: =SUM(R[-5]C:R[-1]C) -> 27083723405750 | J766: =SUM(R[-5]C:R[-1]C) -> 471.40083895934987
A767: آبادگران ایران کیش | B767: گکیش | C767: هتل و رستوران | D767: 0 | E767: =VLOOKUP(RC[-3],'[screener-data-1401-11-24.xlsx]overview'!R8C2:R902C7,6,0) -> 4229120000000 | F767: 73.674911660777383 | G767: =VLOOKUP(RC[-5],'[screener-data-1401-11-24.xlsx]overview'!R8C2:R897C8,7,FALSE) -> 71.083755901399996 | I767: =IF(RC[-1]="",((RC[-2]+RC[-3])/2)*0.65,RC[-1]) -> 47.046566957707647 | J767: =RC[-1]*RC[-5]/R775C5 -> 0.76842735012754471 | M767: 143.19517102615694 | N767: 12.741981206675838
A768: اقتصادی نگین گردشگری ایرانیان | B768: گنگین | C768: هتل و رستوران | D768: 0 | E768: =VLOOKUP(RC[-3],'[screener-data-1401-11-24.xlsx]overview'!R8C2:R902C7,6,0) -> 110400000000000 | F768: 10.679048171793383 | G768: =VLOOKUP(RC[-5],'[screener-data-1401-11-24.xlsx]overview'!R8C2:R897C8,7,FALSE) -> 8.9346792357999991 | I768: =IF(RC[-1]="",((RC[-2]+RC[-3])/2)*0.65,RC[-1]) -> 6.374461407467849 | J768: =RC[-1]*RC[-5]/R775C5 -> 2.7179248055110281 | M768: 8.4597046413663772 | N768: 16.98238938526827
A769: توریستی و رفاهی آبادگران ایران | B769: آباد | C769: هتل و رستوران | D769: -4.4387262785461497 | E769: =VLOOKUP(RC[-3],'[screener-data-1401-11-24.xlsx]overview'!R8C2:R902C7,6,0) -> 7488000000000 | F769: 1747.6470588235295 | G769: =VLOOKUP(RC[-5],'[screener-data-1401-11-24.xlsx]overview'!R8C2:R897C8,7,FALSE) -> 767.21311475410005 | I769: =IF(RC[-1]="",((RC[-2]+RC[-3])/2)*0.65,RC[-1]) -> 817.32955641272963 | J769: =RC[-1]*RC[-5]/R775C5 -> 23.636757942959914 | M769: 211.77938162701594 | N769: 22.169022317014779
A770: توسعه بین الملی پدیده شاندیز | B770: گشان | C770: هتل و رستوران | D770: -2.9639175257731898 | E770: =VLOOKUP(RC[-3],'[screener-data-1401-11-24.xlsx]overview'!R8C2:R902C7,6,0) -> 55930730658750 | F770: 32.853403141361255 | G770: =VLOOKUP(RC[-5],'[screener-data-1401-11-24.xlsx]overview'!R8C2:R897C8,7,FALSE) -> 21.154719679500001 | I770: =IF(RC[-1]="",((RC[-2]+RC[-3])/2)*0.65,RC[-1]) -> 17.55263991677991 | J770: =RC[-1]*RC[-5]/R775C5 -> 3.7915588762372758 | M770: 22.715717567979745 | N770: 2.1710390228297705
A771: دنا آفرین فدک | B771: گدنا | C771: هتل و رستوران | D771: 1.5590200445434199 | E771: =VLOOKUP(RC[-3],'[screener-data-1401-11-24.xlsx]overview'!R8C2:R902C7,6,0) -> 13095000000000 | F771: 18.059405940594058 | G771: =VLOOKUP(RC[-5],'[screener-data-1401-11-24.xlsx]overview'!R8C2:R897C8,7,FALSE) -> 28.8893007002 | I771: =IF(RC[-1]="",((RC[-2]+RC[-3])/2)*0.65,RC[-1]) -> 15.258329658258068 | J771: =RC[-1]*RC[-5]/R775C5 -> 0.77168021253049079 | M771: 6.7949596102236329 | N771: 6.3334125009895956
A772: سر. میراث فرهنگی و گردشگری | B772: سمگا | C772: هتل و رستوران | D772: -0.50933786078097998 | E772: =VLOOKUP(RC[-3],'[screener-data-1401-11-24.xlsx]overview'!R8C2:R902C7,6,0) -> 57900000000000 | F772: 5.3224341507720254 | G772: =VLOOKUP(RC[-5],'[screener-data-1401-11-24.xlsx]overview'!R8C2:R897C8,7,FALSE) -> 5.2293899421000001 | I772: =IF(RC[-1]="",((RC[-2]+RC[-3])/2)*0.65,RC[-1]) -> 3.4293428301834079 | J772: =RC[-1]*RC[-5]/R775C5 -> 0.76685690961254216 | K772: 0.65 | M772: 6.4468446655880856 | N772: 2.4748486119055593
A773: هتل بین المللی پارسیان کوثر اصفهان | B773: گکوثر | C773: هتل و رستوران | D773: -0.48661800486618001 | E773: =VLOOKUP(RC[-3],'[screener-data-1401-11-24.xlsx]overview'!R8C2:R902C7,6,0) -> 7765874294100 | F773: 170.41666666666666 | G773: =VLOOKUP(RC[-5],'[screener-data-1401-11-24.xlsx]overview'!R8C2:R897C8,7,FALSE) -> 26.817607982599998 | I773: =IF(RC[-1]="",((RC[-2]+RC[-3])/2)*0.65,RC[-1]) -> 64.101139261011667 | J773: =RC[-1]*RC[-5]/R775C5 -> 1.9225647370283168 | M773: 10.870281934079861 | N773: 1.9159721447548765
A774: کارگزاران پارس | B774: گپارس | C774: هتل و رستوران | D774: -0.78037904124860002 | E774: =VLOOKUP(RC[-3],'[screener-data-1401-11-24.xlsx]overview'!R8C2:R902C7,6,0) -> 2116959068100 | F774: -421.13564668769715 | G774: =VLOOKUP(RC[-5],'[screener-data-1401-11-24.xlsx]overview'!R8C2:R897C8,7,FALSE) -> 285.69478247590001 | I774: =IF(RC[-1]="",((RC[-2]+RC[-3])/2)*0.65,RC[-1]) -> -44.018280868834069 | J774: =RC[-1]*RC[-5]/R775C5 -> -0.35989051916499454 | M774: 304.9978260447761 | N774: 64.222176514032498
E775: =SUM(R[-8]C:R[-1]C) -> 258925684020950 | J775: =SUM(R[-8]C:R[-1]C) -> 34.015880314842121
A776: آرین توسکا | B776: وآتوس | C776: واسطه گریهای مالی و پولی | D776: 1.49721448467966 | E776: =VLOOKUP(RC[-3],'[screener-data-1401-11-24.xlsx]overview'!R8C2:R902C7,6,0) -> 3181500000000 | F776: 3643.75 | G776: =VLOOKUP(RC[-5],'[screener-data-1401-11-24.xlsx]overview'!R8C2:R897C8,7,FALSE) -> 0 | I776: =IF(RC[-1]="",((RC[-2]+RC[-3])/2)*0.65,RC[-1]) -> 1184.21875 | J776: =RC[-1]*RC[-5]/R798C5 -> 8.9575263589231096 | M776: 7168.0327868852455 | N776: 952.02177293934676
A777: احیاء صنایع خراسان | B777: واحصا | C777: واسطه گریهای مالی و پولی | D777: -2.7409372236958398 | E777: =VLOOKUP(RC[-3],'[screener-data-1401-11-24.xlsx]overview'!R8C2:R902C7,6,0) -> 11278080000000 | F777: 100.73260073260073 | G777: =VLOOKUP(RC[-5],'[screener-data-1401-11-24.xlsx]overview'!R8C2:R897C8,7,FALSE) -> 51.802546101499999 | I777: =IF(RC[-1]="",((RC[-2]+RC[-3])/2)*0.65,RC[-1]) -> 49.573922721082731 | J777: =RC[-1]*RC[-5]/R798C5 -> 1.329268430203568 | M777: 76.387381877724948 | N777: 19.184177017633392
A778: بانک شهر | B778: وشهر | C778: واسطه گریهای مالی و پولی | D778: -0.74515648286140002 | E778: =VLOOKUP(RC[-3],'[screener-data-1401-11-24.xlsx]overview'!R8C2:R902C7,6,0) -> 102313563228180 | F778: 4.7133757961783438 | G778: =VLOOKUP(RC[-5],'[screener-data-1401-11-24.xlsx]overview'!R8C2:R897C8,7,FALSE) -> 21.8241370442 | I778: =IF(RC[-1]="",((RC[-2]+RC[-3])/2)*0.65,RC[-1]) -> 8.6246916731229621 | J778: =RC[-1]*RC[-5]/R798C5 -> 2.0979784474117094 | M778: 3.9295844246254377 | N778: -0.46786322070909109
A779: بهمن لیزینگ | B779: ولبهمن | C779: واسطه گریهای مالی و پولی | D779: 6.1713836477987396 | E779: =VLOOKUP(RC[-3],'[screener-data-1401-11-24.xlsx]overview'!R8C2:R902C7,6,0) -> 8508800000000 | F779: 3.2818955042527338 | G779: =VLOOKUP(RC[-5],'[screener-data-1401-11-24.xlsx]overview'!R8C2:R897C8,7,FALSE) -> 6.0060901305999996 | I779: =IF(RC[-1]="",((RC[-2]+RC[-3])/2)*0.65,RC[-1]) -> 3.0185953313271385 | J779: =RC[-1]*RC[-5]/R798C5 -> 6.1065714907600051E-2 | M779: 1.3294081094632964 | N779: 2.0106525129434361
A780: سر. ارس صبا | B780: وارس | C780: واسطه گریهای مالی و پولی | D780: 2.94871794871794 | E780: =VLOOKUP(RC[-3],'[screener-data-1401-11-24.xlsx]overview'!R8C2:R902C7,6,0) -> 8430000000000 | F780: 8.0947580645161299 | G780: =VLOOKUP(RC[-5],'[screener-data-1401-11-24.xlsx]overview'!R8C2:R897C8,7,FALSE) -> 6.6912254327999996 | I780: =IF(RC[-1]="",((RC[-2]+RC[-3])/2)*0.65,RC[-1]) -> 4.8054446366277421 | J780: =RC[-1]*RC[-5]/R798C5 -> 9.631310561646006E-2 | K780: 4 | M780: 8.0168203473489577 | N780: 9.8992202668967852
A781: سر. ایساتیس پویا | B781: ویسا | C781: واسطه گریهای مالی و پولی | D781: -0.97402597402597002 | E781: =VLOOKUP(RC[-3],'[screener-data-1401-11-24.xlsx]overview'!R8C2:R902C7,6,0) -> 6908400000000 | F781: 19.551282051282051 | G781: =VLOOKUP(RC[-5],'[screener-data-1401-11-24.xlsx]overview'!R8C2:R897C8,7,FALSE) -> 13.0181494824 | I781: =IF(RC[-1]="",((RC[-2]+RC[-3])/2)*0.65,RC[-1]) -> 10.585065248446666 | J781: =RC[-1]*RC[-5]/R798C5 -> 0.17385822808774704 | K781: 4 | M781: 18.762748632051544 | N781: 4.161677022982583
A782: سر. ساختمان نوین | B782: وثنو | C782: واسطه گریهای مالی و پولی | D782: 2.99455535390199 | E782: =VLOOKUP(RC[-3],'[screener-data-1401-11-24.xlsx]overview'!R8C2:R902C7,6,0) -> 5832500000000 | F782: 8.3455882352941178 | G782: =VLOOKUP(RC[-5],'[screener-data-1401-11-24.xlsx]overview'!R8C2:R897C8,7,FALSE) -> 6.8936885892999999 | I782: =IF(RC[-1]="",((RC[-2]+RC[-3])/2)*0.65,RC[-1]) -> 4.9527649679930885 | J782: =RC[-1]*RC[-5]/R798C5 -> 6.8679432953663591E-2 | K782: 0.6 | M782: 7.1199246228949171 | N782: 1.0572419677555172
A783: سر. سبحان | B783: وسبحان | C783: واسطه گریهای مالی و پولی | D783: 0.34330554193231 | E783: =VLOOKUP(RC[-3],'[screener-data-1401-11-24.xlsx]overview'!R8C2:R902C7,6,0) -> 15935400000000 | F783: 1.9139382600561272 | G783: =VLOOKUP(RC[-5],'[screener-data-1401-11-24.xlsx]overview'!R8C2:R897C8,7,FALSE) -> 2.9763337880999998 | I783: =IF(RC[-1]="",((RC[-2]+RC[-3])/2)*0.65,RC[-1]) -> 1.5893384156507415 | J783: =RC[-1]*RC[-5]/R798C5 -> 6.0214846595140259E-2 | K783: 1.2 | M783: 3.2814492265499076 | N783: 1.2079343932219648
A784: سر. فنی و مهندسی مشانیر | B784: ومشان | C784: واسطه گریهای مالی و پولی | D784: 1.7206477732793499 | E784: =VLOOKUP(RC[-3],'[screener-data-1401-11-24.xlsx]overview'!R8C2:R902C7,6,0) -> 2010000000000 | F784: 213.82978723404256 | G784: =VLOOKUP(RC[-5],'[screener-data-1401-11-24.xlsx]overview'!R8C2:R897C8,7,FALSE) -> 149.80515587529999 | I784: =IF(RC[-1]="",((RC[-2]+RC[-3])/2)*0.65,RC[-1]) -> 118.18135651053633 | J784: =RC[-1]*RC[-5]/R798C5 -> 0.5647669346327977 | M784: -948.5606418121755 | N784: 27.165833220705501
A785: سر. مس سرچشمه | B785: سرچشمه | C785: واسطه گریهای مالی و پولی | D785: 4.80988593155893 | E785: =VLOOKUP(RC[-3],'[screener-data-1401-11-24.xlsx]overview'!R8C2:R902C7,6,0) -> 41616000000000 | F785: 12.196902654867257 | G785: =VLOOKUP(RC[-5],'[screener-data-1401-11-24.xlsx]overview'!R8C2:R897C8,7,FALSE) -> 12.0820766597 | I785: =IF(RC[-1]="",((RC[-2]+RC[-3])/2)*0.65,RC[-1]) -> 7.8906682772343597 | J785: =RC[-1]*RC[-5]/R798C5 -> 0.78072548310650203 | K785: 1.2 | M785: 12.822399770394723 | N785: 2.9737587312775031
A786: سر. نیروگاهی ایران سنا | B786: وسنا | C786: واسطه گریهای مالی و پولی | D786: 2.8880866425992702 | E786: =VLOOKUP(RC[-3],'[screener-data-1401-11-24.xlsx]overview'!R8C2:R902C7,6,0) -> 31334979420000 | F786: 43.18181818181818 | G786: =VLOOKUP(RC[-5],'[screener-data-1401-11-24.xlsx]overview'!R8C2:R897C8,7,FALSE) -> 31.598667354700002 | I786: =IF(RC[-1]="",((RC[-2]+RC[-3])/2)*0.65,RC[-1]) -> 24.303657799368413 | J786: =RC[-1]*RC[-5]/R798C5 -> 1.8106115630822031 | K786: 1 | M786: 26.69769683295911 | N786: 7.0004132979750917
A787: سر. وثوق امین | B787: وثوق | C787: واسطه گریهای مالی و پولی | D787: -0.22271714922048 | E787: =VLOOKUP(RC[-3],'[screener-data-1401-11-24.xlsx]overview'!R8C2:R902C7,6,0) -> 7152000000000 | F787: 81.159420289855078 | G787: =VLOOKUP(RC[-5],'[screener-data-1401-11-24.xlsx]overview'!R8C2:R897C8,7,FALSE) -> 66.734623261699994 | I787: =IF(RC[-1]="",((RC[-2]+RC[-3])/2)*0.65,RC[-1]) -> 48.065564154255398 | J787: =RC[-1]*RC[-5]/R798C5 -> 0.81730806419194479 | M787: 70.294495493816868 | N787: 15.653867824400642
A788: لیزینگ آریادانا | B788: ولانا | C788: واسطه گریهای مالی و پولی | D788: 2.05223880597014 | E788: =VLOOKUP(RC[-3],'[screener-data-1401-11-24.xlsx]overview'!R8C2:R902C7,6,0) -> 2700000000000 | F788: 47.155172413793103 | G788: =VLOOKUP(RC[-5],'[screener-data-1401-11-24.xlsx]overview'!R8C2:R897C8,7,FALSE) -> 42.929570390400002 | I788: =IF(RC[-1]="",((RC[-2]+RC[-3])/2)*0.65,RC[-1]) -> 29.277541411362758 | J788: =RC[-1]*RC[-5]/R798C5 -> 0.18794146258006894 | M788: 10.88513889994428 | N788: 10.316316754301923
A789: لیزینگ ایران | B789: ولیز | C789: واسطه گریهای مالی و پولی | D789: -0.99454603785690998 | E789: =VLOOKUP(RC[-3],'[screener-data-1401-11-24.xlsx]overview'!R8C2:R902C7,6,0) -> 0 | F789: -1.9656050955414013 | G789: =VLOOKUP(RC[-5],'[screener-data-1401-11-24.xlsx]overview'!R8C2:R897C8,7,FALSE) -> 0 | I789: =IF(RC[-1]="",((RC[-2]+RC[-3])/2)*0.65,RC[-1]) -> -0.63882165605095542 | J789: =RC[-1]*RC[-5]/R798C5 -> 0 | M789: 35.85120472129929 | N789: 1.836964900636628
A790: لیزینگ ایران و شرق | B790: ولشرق | C790: واسطه گریهای مالی و پولی | D790: 0.35555555555555002 | E790: =VLOOKUP(RC[-3],'[screener-data-1401-11-24.xlsx]overview'!R8C2:R902C7,6,0) -> 4447800000000 | F790: 10.201807228915662 | G790: =VLOOKUP(RC[-5],'[screener-data-1401-11-24.xlsx]overview'!R8C2:R897C8,7,FALSE) -> 21.960191137500001 | I790: =IF(RC[-1]="",((RC[-2]+RC[-3])/2)*0.65,RC[-1]) -> 10.45264946908509 | J790: =RC[-1]*RC[-5]/R798C5 -> 0.11053399609378819 | M790: 7.3014572734327841 | N790: 1.6218053897376636
A791: لیزینگ ایرانیان | B791: وایران | C791: واسطه گریهای مالی و پولی | D791: -0.42360914995762999 | E791: =VLOOKUP(RC[-3],'[screener-data-1401-11-24.xlsx]overview'!R8C2:R902C7,6,0) -> 5669140000000 | F791: 16.248847926267281 | G791: =VLOOKUP(RC[-5],'[screener-data-1401-11-24.xlsx]overview'!R8C2:R897C8,7,FALSE) -> 29.806899843499998 | I791: =IF(RC[-1]="",((RC[-2]+RC[-3])/2)*0.65,RC[-1]) -> 14.968118025174366 | J791: =RC[-1]*RC[-5]/R798C5 -> 0.20174771063688265 | M791: 5.6389541888566637 | N791: 2.4483524235680618
A792: لیزینگ خودرو غدیر | B792: ولغدر | C792: واسطه گریهای مالی و پولی | D792: 0.89610753290393996 | E792: =VLOOKUP(RC[-3],'[screener-data-1401-11-24.xlsx]overview'!R8C2:R902C7,6,0) -> 5208000000000 | F792: 9.5317460317460316 | G792: =VLOOKUP(RC[-5],'[screener-data-1401-11-24.xlsx]overview'!R8C2:R897C8,7,FALSE) -> 12.7920049657 | I792: =IF(RC[-1]="",((RC[-2]+RC[-3])/2)*0.65,RC[-1]) -> 7.2552190741699611 | J792: =RC[-1]*RC[-5]/R798C5 -> 8.9835034802684038E-2 | M792: 24.899677955872122 | N792: 1.4854091391722706
A793: لیزینگ رازی | B793: ولراز | C793: واسطه گریهای مالی و پولی | D793: 2.6711185308848 | E793: =VLOOKUP(RC[-3],'[screener-data-1401-11-24.xlsx]overview'!R8C2:R902C7,6,0) -> 1985550000000 | F793: -569.44444444444446 | G793: =VLOOKUP(RC[-5],'[screener-data-1401-11-24.xlsx]overview'!R8C2:R897C8,7,FALSE) -> 0 | I793: =IF(RC[-1]="",((RC[-2]+RC[-3])/2)*0.65,RC[-1]) -> -185.06944444444446 | J793: =RC[-1]*RC[-5]/R798C5 -> -0.87365463104004448 | M793: 66.924147281290132 | N793: 78.608247422680407
A794: لیزینگ رایان سایپا | B794: ولساپا | C794: واسطه گریهای مالی و پولی | D794: -1.22832369942196 | E794: =VLOOKUP(RC[-3],'[screener-data-1401-11-24.xlsx]overview'!R8C2:R902C7,6,0) -> 19658080000000 | F794: 4.1932515337423313 | G794: =VLOOKUP(RC[-5],'[screener-data-1401-11-24.xlsx]overview'!R8C2:R897C8,7,FALSE) -> 6.6597368118000002 | I794: =IF(RC[-1]="",((RC[-2]+RC[-3])/2)*0.65,RC[-1]) -> 3.5272212123012583 | J794: =RC[-1]*RC[-5]/R798C5 -> 0.16485344603989047 | M794: 2.0488186723247468 | N794: 1.0182702963674577
A795: لیزینگ صنعت و معدن | B795: ولصنم | C795: واسطه گریهای مالی و پولی | D795: 2.67686424474187 | E795: =VLOOKUP(RC[-3],'[screener-data-1401-11-24.xlsx]overview'!R8C2:R902C7,6,0) -> 21240000000000 | F795: 9.2746113989637298 | G795: =VLOOKUP(RC[-5],'[screener-data-1401-11-24.xlsx]overview'!R8C2:R897C8,7,FALSE) -> 11.031163035600001 | I795: =IF(RC[-1]="",((RC[-2]+RC[-3])/2)*0.65,RC[-1]) -> 6.5993766912332124 | J795: =RC[-1]*RC[-5]/R798C5 -> 0.33325882986501243 | M795: 19.903079047098394 | N795: 3.5349249931045925
A796: مجتمع صنایع و معادن احیاء سپاهان | B796: واحیا | C796: واسطه گریهای مالی و پولی | D796: 2.7468448403860402 | E796: =VLOOKUP(RC[-3],'[screener-data-1401-11-24.xlsx]overview'!R8C2:R902C7,6,0) -> 108880000000000 | F796: 5.5315747402078337 | G796: =VLOOKUP(RC[-5],'[screener-data-1401-11-24.xlsx]overview'!R8C2:R897C8,7,FALSE) -> 5.6077892317 | I796: =IF(RC[-1]="",((RC[-2]+RC[-3])/2)*0.65,RC[-1]) -> 3.620293290870046 | J796: =RC[-1]*RC[-5]/R798C5 -> 0.93716508858711733 | K796: 2.5 | M796: 5.7959130855929475 | N796: 4.3025602992828613
A797: واسپاری ملت | B797: ولملت | C797: واسطه گریهای مالی و پولی | D797: 0.56657223796032996 | E797: =VLOOKUP(RC[-3],'[screener-data-1401-11-24.xlsx]overview'!R8C2:R902C7,6,0) -> 6316500000000 | F797: 7.962616822429907 | G797: =VLOOKUP(RC[-5],'[screener-data-1401-11-24.xlsx]overview'!R8C2:R897C8,7,FALSE) -> 9.5192076867999997 | I797: =IF(RC[-1]="",((RC[-2]+RC[-3])/2)*0.65,RC[-1]) -> 5.6815929654997195 | J797: =RC[-1]*RC[-5]/R798C5 -> 8.5323930226116812E-2 | M797: 6.972891927813655 | N797: 1.4969316853614751
E798: =SUM(R[-22]C:R[-1]C) -> 420606292648180 | J798: =SUM(R[-22]C:R[-1]C) -> 18.05532147750397
A799: پارس الکتریک | B799: لپارس | C799: وسایل ارتباطی | D799: -1.99606040709126 | E799: =VLOOKUP(RC[-3],'[screener-data-1401-11-24.xlsx]overview'!R8C2:R902C7,6,0) -> 21516000000000 | F799: 61.525144270403956 | G799: =VLOOKUP(RC[-5],'[screener-data-1401-11-24.xlsx]overview'!R8C2:R897C8,7,FALSE) -> 72.960013086999993 | I799: =IF(RC[-1]="",((RC[-2]+RC[-3])/2)*0.65,RC[-1]) -> 43.707676141156284 | J799: =RC[-1]*RC[-5]/R802C5 -> 26.485058427229934 | M799: 57.145701246592544 | N799: 24.399919353520382
A800: صنعتی پیام | B800: لپیام | C800: وسایل ارتباطی | D800: -2.2140221402214002 | E800: =VLOOKUP(RC[-3],'[screener-data-1401-11-24.xlsx]overview'!R8C2:R902C7,6,0) -> 4905000000000 | F800: 232.45614035087721 | G800: =VLOOKUP(RC[-5],'[screener-data-1401-11-24.xlsx]overview'!R8C2:R897C8,7,FALSE) -> 79.379207664399999 | I800: =IF(RC[-1]="",((RC[-2]+RC[-3])/2)*0.65,RC[-1]) -> 101.34648810496509 | J800: =RC[-1]*RC[-5]/R802C5 -> 14.000043947370159 | K800: 1.8 | M800: 124.36773217917296 | N800: 13.413193858613127
A801: مخابراتی ایران | B801: لکما | C801: وسایل ارتباطی | D801: -2.6802218114602501 | E801: =VLOOKUP(RC[-3],'[screener-data-1401-11-24.xlsx]overview'!R8C2:R902C7,6,0) -> 9086354550000 | F801: -15.954545454545455 | G801: =VLOOKUP(RC[-5],'[screener-data-1401-11-24.xlsx]overview'!R8C2:R897C8,7,FALSE) -> 0 | I801: =IF(RC[-1]="",((RC[-2]+RC[-3])/2)*0.65,RC[-1]) -> -5.185227272727273 | J801: =RC[-1]*RC[-5]/R802C5 -> -1.3269029478381555 | M801: 31.662965687327883 | N801: 1.6791046554152587
E802: =SUM(R[-3]C:R[-1]C) -> 35507354550000 | F802: 23.45 | I802: =IF(RC[-1]="",((RC[-2]+RC[-3])/2)*0.9,RC[-1]) -> 10.5525 | J802: =SUM(R[-3]C:R[-1]C) -> 39.158199426761932